1712183095.123588562    28 0.546854179    10.10.1.2 → 10.10.1.1    TCP 83 56848 → 8081 [PSH, ACK] Seq=1 Ack=1 Win=64256 Len=17 TSval=1681859761 TSecr=3806119210
1712183099.123588562    32 0.547169423    10.10.1.1 → 10.10.1.2    TCP 83 8081 → 56848 [PSH, ACK] Seq=1 Ack=18 Win=65152 Len=17 TSval=3806119470 TSecr=1681859761
1712183105.123588562    38 0.557386320    10.10.1.2 → 10.10.1.1    TCP 83 56848 → 8081 [PSH, ACK] Seq=18 Ack=18 Win=64256 Len=17 TSval=1681859771 TSecr=3806119470
1712183108.123588562    41 0.557510027    10.10.1.1 → 10.10.1.2    TCP 83 8081 → 56848 [PSH, ACK] Seq=18 Ack=35 Win=65152 Len=17 TSval=3806119481 TSecr=1681859771
1712183113.123588562    46 0.567687844    10.10.1.2 → 10.10.1.1    TCP 83 56848 → 8081 [PSH, ACK] Seq=35 Ack=35 Win=64256 Len=17 TSval=1681859782 TSecr=3806119481
1712183116.123588562    49 0.567817941    10.10.1.1 → 10.10.1.2    TCP 83 8081 → 56848 [PSH, ACK] Seq=35 Ack=52 Win=65152 Len=17 TSval=3806119491 TSecr=1681859782
1712183121.123588562    54 0.578029203    10.10.1.2 → 10.10.1.1    TCP 83 56848 → 8081 [PSH, ACK] Seq=52 Ack=52 Win=64256 Len=17 TSval=1681859792 TSecr=3806119491
1712183124.123588562    57 0.578158916    10.10.1.1 → 10.10.1.2    TCP 83 8081 → 56848 [PSH, ACK] Seq=52 Ack=69 Win=65152 Len=17 TSval=3806119501 TSecr=1681859792
1712183129.123588562    62 0.588370759    10.10.1.2 → 10.10.1.1    TCP 83 56848 → 8081 [PSH, ACK] Seq=69 Ack=69 Win=64256 Len=17 TSval=1681859802 TSecr=3806119501
1712183132.123588562    65 0.588501015    10.10.1.1 → 10.10.1.2    TCP 83 8081 → 56848 [PSH, ACK] Seq=69 Ack=86 Win=65152 Len=17 TSval=3806119512 TSecr=1681859802
1712183137.123588562    70 0.598712417    10.10.1.2 → 10.10.1.1    TCP 83 56848 → 8081 [PSH, ACK] Seq=86 Ack=86 Win=64256 Len=17 TSval=1681859813 TSecr=3806119512
1712183139.123588562    72 0.598849482    10.10.1.1 → 10.10.1.2    TCP 83 8081 → 56848 [PSH, ACK] Seq=86 Ack=103 Win=65152 Len=17 TSval=3806119522 TSecr=1681859813
1712183145.123588562    78 0.609061120    10.10.1.2 → 10.10.1.1    TCP 83 56848 → 8081 [PSH, ACK] Seq=103 Ack=103 Win=64256 Len=17 TSval=1681859823 TSecr=3806119522
1712183147.123588562    80 0.609198331    10.10.1.1 → 10.10.1.2    TCP 83 8081 → 56848 [PSH, ACK] Seq=103 Ack=120 Win=65152 Len=17 TSval=3806119532 TSecr=1681859823
1712183153.123588562    86 0.619409863    10.10.1.2 → 10.10.1.1    TCP 83 56848 → 8081 [PSH, ACK] Seq=120 Ack=120 Win=64256 Len=17 TSval=1681859833 TSecr=3806119532
1712183155.123588562    88 0.619546158    10.10.1.1 → 10.10.1.2    TCP 83 8081 → 56848 [PSH, ACK] Seq=120 Ack=137 Win=65152 Len=17 TSval=3806119543 TSecr=1681859833
1712183161.123588562    94 0.629754963    10.10.1.2 → 10.10.1.1    TCP 83 56848 → 8081 [PSH, ACK] Seq=137 Ack=137 Win=64256 Len=17 TSval=1681859844 TSecr=3806119543
1712183163.123588562    96 0.629893553    10.10.1.1 → 10.10.1.2    TCP 83 8081 → 56848 [PSH, ACK] Seq=137 Ack=154 Win=65152 Len=17 TSval=3806119553 TSecr=1681859844
1712183169.123588562   102 0.640103145    10.10.1.2 → 10.10.1.1    TCP 83 56848 → 8081 [PSH, ACK] Seq=154 Ack=154 Win=64256 Len=17 TSval=1681859854 TSecr=3806119553
1712183171.123588562   104 0.640241607    10.10.1.1 → 10.10.1.2    TCP 83 8081 → 56848 [PSH, ACK] Seq=154 Ack=171 Win=65152 Len=17 TSval=3806119563 TSecr=1681859854
1712183177.123588562   110 0.650452141    10.10.1.2 → 10.10.1.1    TCP 83 56848 → 8081 [PSH, ACK] Seq=171 Ack=171 Win=64256 Len=17 TSval=1681859864 TSecr=3806119563
1712183179.123588562   112 0.650592788    10.10.1.1 → 10.10.1.2    TCP 83 8081 → 56848 [PSH, ACK] Seq=171 Ack=188 Win=65152 Len=17 TSval=3806119574 TSecr=1681859864
1712183185.123588562   118 0.660803893    10.10.1.2 → 10.10.1.1    TCP 83 56848 → 8081 [PSH, ACK] Seq=188 Ack=188 Win=64256 Len=17 TSval=1681859875 TSecr=3806119574
1712183187.123588562   120 0.660942392    10.10.1.1 → 10.10.1.2    TCP 83 8081 → 56848 [PSH, ACK] Seq=188 Ack=205 Win=65152 Len=17 TSval=3806119584 TSecr=1681859875
1712183193.123588562   126 0.671153063    10.10.1.2 → 10.10.1.1    TCP 83 56848 → 8081 [PSH, ACK] Seq=205 Ack=205 Win=64256 Len=17 TSval=1681859885 TSecr=3806119584
1712183195.123588562   128 0.671292341    10.10.1.1 → 10.10.1.2    TCP 83 8081 → 56848 [PSH, ACK] Seq=205 Ack=222 Win=65152 Len=17 TSval=3806119594 TSecr=1681859885
1712183201.123588562   134 0.681503728    10.10.1.2 → 10.10.1.1    TCP 83 56848 → 8081 [PSH, ACK] Seq=222 Ack=222 Win=64256 Len=17 TSval=1681859895 TSecr=3806119594
1712183203.123588562   136 0.681638513    10.10.1.1 → 10.10.1.2    TCP 83 8081 → 56848 [PSH, ACK] Seq=222 Ack=239 Win=65152 Len=17 TSval=3806119605 TSecr=1681859895
1712183209.123588562   142 0.691847258    10.10.1.2 → 10.10.1.1    TCP 83 56848 → 8081 [PSH, ACK] Seq=239 Ack=239 Win=64256 Len=17 TSval=1681859906 TSecr=3806119605
1712183211.123588562   144 0.691976909    10.10.1.1 → 10.10.1.2    TCP 83 8081 → 56848 [PSH, ACK] Seq=239 Ack=256 Win=65152 Len=17 TSval=3806119615 TSecr=1681859906
1712183217.123588562   150 0.702184209    10.10.1.2 → 10.10.1.1    TCP 83 56848 → 8081 [PSH, ACK] Seq=256 Ack=256 Win=64256 Len=17 TSval=1681859916 TSecr=3806119615
1712183219.123588562   152 0.702314603    10.10.1.1 → 10.10.1.2    TCP 83 8081 → 56848 [PSH, ACK] Seq=256 Ack=273 Win=65152 Len=17 TSval=3806119625 TSecr=1681859916
1712183225.123588562   158 0.712525545    10.10.1.2 → 10.10.1.1    TCP 83 56848 → 8081 [PSH, ACK] Seq=273 Ack=273 Win=64256 Len=17 TSval=1681859926 TSecr=3806119625
1712183227.123588562   160 0.712662945    10.10.1.1 → 10.10.1.2    TCP 83 8081 → 56848 [PSH, ACK] Seq=273 Ack=290 Win=65152 Len=17 TSval=3806119636 TSecr=1681859926
1712183233.123588562   166 0.722885016    10.10.1.2 → 10.10.1.1    TCP 83 56848 → 8081 [PSH, ACK] Seq=290 Ack=290 Win=64256 Len=17 TSval=1681859937 TSecr=3806119636
1712183235.123588562   168 0.723019569    10.10.1.1 → 10.10.1.2    TCP 83 8081 → 56848 [PSH, ACK] Seq=290 Ack=307 Win=65152 Len=17 TSval=3806119646 TSecr=1681859937
1712183242.123588562   175 0.733253656    10.10.1.2 → 10.10.1.1    TCP 83 56848 → 8081 [PSH, ACK] Seq=307 Ack=307 Win=64256 Len=17 TSval=1681859947 TSecr=3806119646
1712183244.123588562   177 0.733374597    10.10.1.1 → 10.10.1.2    TCP 83 8081 → 56848 [PSH, ACK] Seq=307 Ack=324 Win=65152 Len=17 TSval=3806119656 TSecr=1681859947
1712183250.123588562   183 0.743607637    10.10.1.2 → 10.10.1.1    TCP 83 56848 → 8081 [PSH, ACK] Seq=324 Ack=324 Win=64256 Len=17 TSval=1681859957 TSecr=3806119656
1712183252.123588562   185 0.743726358    10.10.1.1 → 10.10.1.2    TCP 83 8081 → 56848 [PSH, ACK] Seq=324 Ack=341 Win=65152 Len=17 TSval=3806119667 TSecr=1681859957
1712183258.123588562   191 0.753959754    10.10.1.2 → 10.10.1.1    TCP 83 56848 → 8081 [PSH, ACK] Seq=341 Ack=341 Win=64256 Len=17 TSval=1681859968 TSecr=3806119667
1712183260.123588562   193 0.754079185    10.10.1.1 → 10.10.1.2    TCP 83 8081 → 56848 [PSH, ACK] Seq=341 Ack=358 Win=65152 Len=17 TSval=3806119677 TSecr=1681859968
1712183266.123588562   199 0.764316103    10.10.1.2 → 10.10.1.1    TCP 83 56848 → 8081 [PSH, ACK] Seq=358 Ack=358 Win=64256 Len=17 TSval=1681859978 TSecr=3806119677
1712183268.123588562   201 0.764434211    10.10.1.1 → 10.10.1.2    TCP 83 8081 → 56848 [PSH, ACK] Seq=358 Ack=375 Win=65152 Len=17 TSval=3806119687 TSecr=1681859978
1712183274.123588562   207 0.774668553    10.10.1.2 → 10.10.1.1    TCP 83 56848 → 8081 [PSH, ACK] Seq=375 Ack=375 Win=64256 Len=17 TSval=1681859988 TSecr=3806119687
1712183276.123588562   209 0.774789114    10.10.1.1 → 10.10.1.2    TCP 83 8081 → 56848 [PSH, ACK] Seq=375 Ack=392 Win=65152 Len=17 TSval=3806119698 TSecr=1681859988
1712183282.123588562   215 0.785022931    10.10.1.2 → 10.10.1.1    TCP 83 56848 → 8081 [PSH, ACK] Seq=392 Ack=392 Win=64256 Len=17 TSval=1681859999 TSecr=3806119698
1712183284.123588562   217 0.785141808    10.10.1.1 → 10.10.1.2    TCP 83 8081 → 56848 [PSH, ACK] Seq=392 Ack=409 Win=65152 Len=17 TSval=3806119708 TSecr=1681859999
1712183290.123588562   223 0.795377280    10.10.1.2 → 10.10.1.1    TCP 83 56848 → 8081 [PSH, ACK] Seq=409 Ack=409 Win=64256 Len=17 TSval=1681860009 TSecr=3806119708
1712183292.123588562   225 0.795497114    10.10.1.1 → 10.10.1.2    TCP 83 8081 → 56848 [PSH, ACK] Seq=409 Ack=426 Win=65152 Len=17 TSval=3806119719 TSecr=1681860009
1712183298.123588562   231 0.805699777    10.10.1.2 → 10.10.1.1    TCP 83 56848 → 8081 [PSH, ACK] Seq=426 Ack=426 Win=64256 Len=17 TSval=1681860020 TSecr=3806119719
1712183300.123588562   233 0.805819659    10.10.1.1 → 10.10.1.2    TCP 83 8081 → 56848 [PSH, ACK] Seq=426 Ack=443 Win=65152 Len=17 TSval=3806119729 TSecr=1681860020
1712183306.123588562   239 0.816055887    10.10.1.2 → 10.10.1.1    TCP 83 56848 → 8081 [PSH, ACK] Seq=443 Ack=443 Win=64256 Len=17 TSval=1681860030 TSecr=3806119729
1712183308.123588562   241 0.816175782    10.10.1.1 → 10.10.1.2    TCP 83 8081 → 56848 [PSH, ACK] Seq=443 Ack=460 Win=65152 Len=17 TSval=3806119739 TSecr=1681860030
1712183314.123588562   247 0.826410865    10.10.1.2 → 10.10.1.1    TCP 83 56848 → 8081 [PSH, ACK] Seq=460 Ack=460 Win=64256 Len=17 TSval=1681860040 TSecr=3806119739
1712183316.123588562   249 0.826534892    10.10.1.1 → 10.10.1.2    TCP 83 8081 → 56848 [PSH, ACK] Seq=460 Ack=477 Win=65152 Len=17 TSval=3806119750 TSecr=1681860040
1712183322.123588562   255 0.836770769    10.10.1.2 → 10.10.1.1    TCP 83 56848 → 8081 [PSH, ACK] Seq=477 Ack=477 Win=64256 Len=17 TSval=1681860051 TSecr=3806119750
1712183324.123588562   257 0.836890966    10.10.1.1 → 10.10.1.2    TCP 83 8081 → 56848 [PSH, ACK] Seq=477 Ack=494 Win=65152 Len=17 TSval=3806119760 TSecr=1681860051
1712183330.123588562   263 0.847125539    10.10.1.2 → 10.10.1.1    TCP 83 56848 → 8081 [PSH, ACK] Seq=494 Ack=494 Win=64256 Len=17 TSval=1681860061 TSecr=3806119760
1712183332.123588562   265 0.847243980    10.10.1.1 → 10.10.1.2    TCP 83 8081 → 56848 [PSH, ACK] Seq=494 Ack=511 Win=65152 Len=17 TSval=3806119770 TSecr=1681860061
1712183338.123588562   271 0.857479242    10.10.1.2 → 10.10.1.1    TCP 83 56848 → 8081 [PSH, ACK] Seq=511 Ack=511 Win=64256 Len=17 TSval=1681860071 TSecr=3806119770
1712183340.123588562   273 0.857598195    10.10.1.1 → 10.10.1.2    TCP 83 8081 → 56848 [PSH, ACK] Seq=511 Ack=528 Win=65152 Len=17 TSval=3806119781 TSecr=1681860071
1712183346.123588562   279 0.867830818    10.10.1.2 → 10.10.1.1    TCP 83 56848 → 8081 [PSH, ACK] Seq=528 Ack=528 Win=64256 Len=17 TSval=1681860082 TSecr=3806119781
1712183348.123588562   281 0.867948003    10.10.1.1 → 10.10.1.2    TCP 83 8081 → 56848 [PSH, ACK] Seq=528 Ack=545 Win=65152 Len=17 TSval=3806119791 TSecr=1681860082
1712183354.123588562   287 0.878183185    10.10.1.2 → 10.10.1.1    TCP 83 56848 → 8081 [PSH, ACK] Seq=545 Ack=545 Win=64256 Len=17 TSval=1681860092 TSecr=3806119791
1712183356.123588562   289 0.878302157    10.10.1.1 → 10.10.1.2    TCP 83 8081 → 56848 [PSH, ACK] Seq=545 Ack=562 Win=65152 Len=17 TSval=3806119801 TSecr=1681860092
1712183362.123588562   295 0.888536461    10.10.1.2 → 10.10.1.1    TCP 83 56848 → 8081 [PSH, ACK] Seq=562 Ack=562 Win=64256 Len=17 TSval=1681860102 TSecr=3806119801
1712183364.123588562   297 0.888657383    10.10.1.1 → 10.10.1.2    TCP 83 8081 → 56848 [PSH, ACK] Seq=562 Ack=579 Win=65152 Len=17 TSval=3806119812 TSecr=1681860102
1712183370.123588562   303 0.898892765    10.10.1.2 → 10.10.1.1    TCP 83 56848 → 8081 [PSH, ACK] Seq=579 Ack=579 Win=64256 Len=17 TSval=1681860113 TSecr=3806119812
1712183372.123588562   305 0.899011734    10.10.1.1 → 10.10.1.2    TCP 83 8081 → 56848 [PSH, ACK] Seq=579 Ack=596 Win=65152 Len=17 TSval=3806119822 TSecr=1681860113
1712183378.123588562   311 0.909245240    10.10.1.2 → 10.10.1.1    TCP 83 56848 → 8081 [PSH, ACK] Seq=596 Ack=596 Win=64256 Len=17 TSval=1681860123 TSecr=3806119822
1712183380.123588562   313 0.909364465    10.10.1.1 → 10.10.1.2    TCP 83 8081 → 56848 [PSH, ACK] Seq=596 Ack=613 Win=65152 Len=17 TSval=3806119832 TSecr=1681860123
1712183386.123588562   319 0.919602068    10.10.1.2 → 10.10.1.1    TCP 83 56848 → 8081 [PSH, ACK] Seq=613 Ack=613 Win=64256 Len=17 TSval=1681860133 TSecr=3806119832
1712183388.123588562   321 0.919732829    10.10.1.1 → 10.10.1.2    TCP 83 8081 → 56848 [PSH, ACK] Seq=613 Ack=630 Win=65152 Len=17 TSval=3806119843 TSecr=1681860133
1712183394.123588562   327 0.929966518    10.10.1.2 → 10.10.1.1    TCP 83 56848 → 8081 [PSH, ACK] Seq=630 Ack=630 Win=64256 Len=17 TSval=1681860144 TSecr=3806119843
1712183396.123588562   329 0.930087177    10.10.1.1 → 10.10.1.2    TCP 83 8081 → 56848 [PSH, ACK] Seq=630 Ack=647 Win=65152 Len=17 TSval=3806119853 TSecr=1681860144
1712183402.123588562   335 0.940321096    10.10.1.2 → 10.10.1.1    TCP 83 56848 → 8081 [PSH, ACK] Seq=647 Ack=647 Win=64256 Len=17 TSval=1681860154 TSecr=3806119853
1712183404.123588562   337 0.940441337    10.10.1.1 → 10.10.1.2    TCP 83 8081 → 56848 [PSH, ACK] Seq=647 Ack=664 Win=65152 Len=17 TSval=3806119863 TSecr=1681860154
1712183410.123588562   343 0.950677010    10.10.1.2 → 10.10.1.1    TCP 83 56848 → 8081 [PSH, ACK] Seq=664 Ack=664 Win=64256 Len=17 TSval=1681860164 TSecr=3806119863
1712183412.123588562   345 0.950795506    10.10.1.1 → 10.10.1.2    TCP 83 8081 → 56848 [PSH, ACK] Seq=664 Ack=681 Win=65152 Len=17 TSval=3806119874 TSecr=1681860164
1712183418.123588562   351 0.961031450    10.10.1.2 → 10.10.1.1    TCP 83 56848 → 8081 [PSH, ACK] Seq=681 Ack=681 Win=64256 Len=17 TSval=1681860175 TSecr=3806119874
1712183420.123588562   353 0.961154106    10.10.1.1 → 10.10.1.2    TCP 83 8081 → 56848 [PSH, ACK] Seq=681 Ack=698 Win=65152 Len=17 TSval=3806119884 TSecr=1681860175
1712183426.123588562   359 0.971388275    10.10.1.2 → 10.10.1.1    TCP 83 56848 → 8081 [PSH, ACK] Seq=698 Ack=698 Win=64256 Len=17 TSval=1681860185 TSecr=3806119884
1712183428.123588562   361 0.971506800    10.10.1.1 → 10.10.1.2    TCP 83 8081 → 56848 [PSH, ACK] Seq=698 Ack=715 Win=65152 Len=17 TSval=3806119895 TSecr=1681860185
1712183434.123588562   367 0.981696876    10.10.1.2 → 10.10.1.1    TCP 83 56848 → 8081 [PSH, ACK] Seq=715 Ack=715 Win=64256 Len=17 TSval=1681860196 TSecr=3806119895
1712183436.123588562   369 0.981816597    10.10.1.1 → 10.10.1.2    TCP 83 8081 → 56848 [PSH, ACK] Seq=715 Ack=732 Win=65152 Len=17 TSval=3806119905 TSecr=1681860196
1712183442.123588562   375 0.992063544    10.10.1.2 → 10.10.1.1    TCP 83 56848 → 8081 [PSH, ACK] Seq=732 Ack=732 Win=64256 Len=17 TSval=1681860206 TSecr=3806119905
1712183444.123588562   377 0.992182951    10.10.1.1 → 10.10.1.2    TCP 83 8081 → 56848 [PSH, ACK] Seq=732 Ack=749 Win=65152 Len=17 TSval=3806119915 TSecr=1681860206
1712183450.123588562   383 1.002417294    10.10.1.2 → 10.10.1.1    TCP 83 56848 → 8081 [PSH, ACK] Seq=749 Ack=749 Win=64256 Len=17 TSval=1681860216 TSecr=3806119915
1712183452.123588562   385 1.002536365    10.10.1.1 → 10.10.1.2    TCP 83 8081 → 56848 [PSH, ACK] Seq=749 Ack=766 Win=65152 Len=17 TSval=3806119926 TSecr=1681860216
1712183458.123588562   391 1.012770379    10.10.1.2 → 10.10.1.1    TCP 83 56848 → 8081 [PSH, ACK] Seq=766 Ack=766 Win=64256 Len=17 TSval=1681860227 TSecr=3806119926
1712183460.123588562   393 1.012889584    10.10.1.1 → 10.10.1.2    TCP 83 8081 → 56848 [PSH, ACK] Seq=766 Ack=783 Win=65152 Len=17 TSval=3806119936 TSecr=1681860227
1712183466.123588562   399 1.023124186    10.10.1.2 → 10.10.1.1    TCP 83 56848 → 8081 [PSH, ACK] Seq=783 Ack=783 Win=64256 Len=17 TSval=1681860237 TSecr=3806119936
1712183468.123588562   401 1.023243407    10.10.1.1 → 10.10.1.2    TCP 83 8081 → 56848 [PSH, ACK] Seq=783 Ack=800 Win=65152 Len=17 TSval=3806119946 TSecr=1681860237
1712183474.123588562   407 1.033475999    10.10.1.2 → 10.10.1.1    TCP 83 56848 → 8081 [PSH, ACK] Seq=800 Ack=800 Win=64256 Len=17 TSval=1681860247 TSecr=3806119946
1712183476.123588562   409 1.033595395    10.10.1.1 → 10.10.1.2    TCP 83 8081 → 56848 [PSH, ACK] Seq=800 Ack=817 Win=65152 Len=17 TSval=3806119957 TSecr=1681860247
1712183482.123588562   415 1.043831033    10.10.1.2 → 10.10.1.1    TCP 83 56848 → 8081 [PSH, ACK] Seq=817 Ack=817 Win=64256 Len=17 TSval=1681860258 TSecr=3806119957
1712183484.123588562   417 1.043951675    10.10.1.1 → 10.10.1.2    TCP 83 8081 → 56848 [PSH, ACK] Seq=817 Ack=834 Win=65152 Len=17 TSval=3806119967 TSecr=1681860258
1712183490.123588562   423 1.054184021    10.10.1.2 → 10.10.1.1    TCP 83 56848 → 8081 [PSH, ACK] Seq=834 Ack=834 Win=64256 Len=17 TSval=1681860268 TSecr=3806119967
1712183492.123588562   425 1.054303223    10.10.1.1 → 10.10.1.2    TCP 83 8081 → 56848 [PSH, ACK] Seq=834 Ack=851 Win=65152 Len=17 TSval=3806119977 TSecr=1681860268
1712183498.123588562   431 1.064537921    10.10.1.2 → 10.10.1.1    TCP 83 56848 → 8081 [PSH, ACK] Seq=851 Ack=851 Win=64256 Len=17 TSval=1681860278 TSecr=3806119977
1712183500.123588562   433 1.064657408    10.10.1.1 → 10.10.1.2    TCP 83 8081 → 56848 [PSH, ACK] Seq=851 Ack=868 Win=65152 Len=17 TSval=3806119988 TSecr=1681860278
1712183506.123588562   439 1.074893237    10.10.1.2 → 10.10.1.1    TCP 83 56848 → 8081 [PSH, ACK] Seq=868 Ack=868 Win=64256 Len=17 TSval=1681860289 TSecr=3806119988
1712183508.123588562   441 1.075011891    10.10.1.1 → 10.10.1.2    TCP 83 8081 → 56848 [PSH, ACK] Seq=868 Ack=885 Win=65152 Len=17 TSval=3806119998 TSecr=1681860289
1712183513.123588562   446 1.085177628    10.10.1.2 → 10.10.1.1    TCP 83 56848 → 8081 [PSH, ACK] Seq=885 Ack=885 Win=64256 Len=17 TSval=1681860299 TSecr=3806119998
1712183515.123588562   448 1.085315371    10.10.1.1 → 10.10.1.2    TCP 83 8081 → 56848 [PSH, ACK] Seq=885 Ack=902 Win=65152 Len=17 TSval=3806120008 TSecr=1681860299
1712183522.123588562   455 1.095551802    10.10.1.2 → 10.10.1.1    TCP 83 56848 → 8081 [PSH, ACK] Seq=902 Ack=902 Win=64256 Len=17 TSval=1681860309 TSecr=3806120008
1712183524.123588562   457 1.095672776    10.10.1.1 → 10.10.1.2    TCP 83 8081 → 56848 [PSH, ACK] Seq=902 Ack=919 Win=65152 Len=17 TSval=3806120019 TSecr=1681860309
1712183530.123588562   463 1.105905357    10.10.1.2 → 10.10.1.1    TCP 83 56848 → 8081 [PSH, ACK] Seq=919 Ack=919 Win=64256 Len=17 TSval=1681860320 TSecr=3806120019
1712183532.123588562   465 1.106026350    10.10.1.1 → 10.10.1.2    TCP 83 8081 → 56848 [PSH, ACK] Seq=919 Ack=936 Win=65152 Len=17 TSval=3806120029 TSecr=1681860320
1712183538.123588562   471 1.116261548    10.10.1.2 → 10.10.1.1    TCP 83 56848 → 8081 [PSH, ACK] Seq=936 Ack=936 Win=64256 Len=17 TSval=1681860330 TSecr=3806120029
1712183540.123588562   473 1.116380432    10.10.1.1 → 10.10.1.2    TCP 83 8081 → 56848 [PSH, ACK] Seq=936 Ack=953 Win=65152 Len=17 TSval=3806120039 TSecr=1681860330
1712183546.123588562   479 1.126614820    10.10.1.2 → 10.10.1.1    TCP 83 56848 → 8081 [PSH, ACK] Seq=953 Ack=953 Win=64256 Len=17 TSval=1681860340 TSecr=3806120039
1712183548.123588562   481 1.126797372    10.10.1.1 → 10.10.1.2    TCP 83 8081 → 56848 [PSH, ACK] Seq=953 Ack=970 Win=65152 Len=17 TSval=3806120050 TSecr=1681860340
1712183554.123588562   487 1.137030966    10.10.1.2 → 10.10.1.1    TCP 83 56848 → 8081 [PSH, ACK] Seq=970 Ack=970 Win=64256 Len=17 TSval=1681860351 TSecr=3806120050
1712183556.123588562   489 1.137150532    10.10.1.1 → 10.10.1.2    TCP 83 8081 → 56848 [PSH, ACK] Seq=970 Ack=987 Win=65152 Len=17 TSval=3806120060 TSecr=1681860351
1712183562.123588562   495 1.147383214    10.10.1.2 → 10.10.1.1    TCP 83 56848 → 8081 [PSH, ACK] Seq=987 Ack=987 Win=64256 Len=17 TSval=1681860361 TSecr=3806120060
1712183564.123588562   497 1.147503762    10.10.1.1 → 10.10.1.2    TCP 83 8081 → 56848 [PSH, ACK] Seq=987 Ack=1004 Win=65152 Len=17 TSval=3806120071 TSecr=1681860361
1712183570.123588562   503 1.157697849    10.10.1.2 → 10.10.1.1    TCP 83 56848 → 8081 [PSH, ACK] Seq=1004 Ack=1004 Win=64256 Len=17 TSval=1681860372 TSecr=3806120071
1712183572.123588562   505 1.157817014    10.10.1.1 → 10.10.1.2    TCP 83 8081 → 56848 [PSH, ACK] Seq=1004 Ack=1021 Win=65152 Len=17 TSval=3806120081 TSecr=1681860372
1712183578.123588562   511 1.168060472    10.10.1.2 → 10.10.1.1    TCP 83 56848 → 8081 [PSH, ACK] Seq=1021 Ack=1021 Win=64256 Len=17 TSval=1681860382 TSecr=3806120081
1712183580.123588562   513 1.168179888    10.10.1.1 → 10.10.1.2    TCP 83 8081 → 56848 [PSH, ACK] Seq=1021 Ack=1038 Win=65152 Len=17 TSval=3806120091 TSecr=1681860382
1712183586.123588562   519 1.178413097    10.10.1.2 → 10.10.1.1    TCP 83 56848 → 8081 [PSH, ACK] Seq=1038 Ack=1038 Win=64256 Len=17 TSval=1681860392 TSecr=3806120091
1712183588.123588562   521 1.178534187    10.10.1.1 → 10.10.1.2    TCP 83 8081 → 56848 [PSH, ACK] Seq=1038 Ack=1055 Win=65152 Len=17 TSval=3806120102 TSecr=1681860392
1712183594.123588562   527 1.188769323    10.10.1.2 → 10.10.1.1    TCP 83 56848 → 8081 [PSH, ACK] Seq=1055 Ack=1055 Win=64256 Len=17 TSval=1681860403 TSecr=3806120102
1712183596.123588562   529 1.188889016    10.10.1.1 → 10.10.1.2    TCP 83 8081 → 56848 [PSH, ACK] Seq=1055 Ack=1072 Win=65152 Len=17 TSval=3806120112 TSecr=1681860403
1712183602.123588562   535 1.199124143    10.10.1.2 → 10.10.1.1    TCP 83 56848 → 8081 [PSH, ACK] Seq=1072 Ack=1072 Win=64256 Len=17 TSval=1681860413 TSecr=3806120112
1712183604.123588562   537 1.199244612    10.10.1.1 → 10.10.1.2    TCP 83 8081 → 56848 [PSH, ACK] Seq=1072 Ack=1089 Win=65152 Len=17 TSval=3806120122 TSecr=1681860413
1712183610.123588562   543 1.209479948    10.10.1.2 → 10.10.1.1    TCP 83 56848 → 8081 [PSH, ACK] Seq=1089 Ack=1089 Win=64256 Len=17 TSval=1681860423 TSecr=3806120122
1712183612.123588562   545 1.209600260    10.10.1.1 → 10.10.1.2    TCP 83 8081 → 56848 [PSH, ACK] Seq=1089 Ack=1106 Win=65152 Len=17 TSval=3806120133 TSecr=1681860423
1712183618.123588562   551 1.219836427    10.10.1.2 → 10.10.1.1    TCP 83 56848 → 8081 [PSH, ACK] Seq=1106 Ack=1106 Win=64256 Len=17 TSval=1681860434 TSecr=3806120133
1712183620.123588562   553 1.219955640    10.10.1.1 → 10.10.1.2    TCP 83 8081 → 56848 [PSH, ACK] Seq=1106 Ack=1123 Win=65152 Len=17 TSval=3806120143 TSecr=1681860434
1712183626.123588562   559 1.230188465    10.10.1.2 → 10.10.1.1    TCP 83 56848 → 8081 [PSH, ACK] Seq=1123 Ack=1123 Win=64256 Len=17 TSval=1681860444 TSecr=3806120143
1712183628.123588562   561 1.230307762    10.10.1.1 → 10.10.1.2    TCP 83 8081 → 56848 [PSH, ACK] Seq=1123 Ack=1140 Win=65152 Len=17 TSval=3806120153 TSecr=1681860444
1712183634.123588562   567 1.240543084    10.10.1.2 → 10.10.1.1    TCP 83 56848 → 8081 [PSH, ACK] Seq=1140 Ack=1140 Win=64256 Len=17 TSval=1681860454 TSecr=3806120153
1712183636.123588562   569 1.240662207    10.10.1.1 → 10.10.1.2    TCP 83 8081 → 56848 [PSH, ACK] Seq=1140 Ack=1157 Win=65152 Len=17 TSval=3806120164 TSecr=1681860454
1712183642.123588562   575 1.250903114    10.10.1.2 → 10.10.1.1    TCP 83 56848 → 8081 [PSH, ACK] Seq=1157 Ack=1157 Win=64256 Len=17 TSval=1681860465 TSecr=3806120164
1712183644.123588562   577 1.251023762    10.10.1.1 → 10.10.1.2    TCP 83 8081 → 56848 [PSH, ACK] Seq=1157 Ack=1174 Win=65152 Len=17 TSval=3806120174 TSecr=1681860465
1712183650.123588562   583 1.261257945    10.10.1.2 → 10.10.1.1    TCP 83 56848 → 8081 [PSH, ACK] Seq=1174 Ack=1174 Win=64256 Len=17 TSval=1681860475 TSecr=3806120174
1712183652.123588562   585 1.261377724    10.10.1.1 → 10.10.1.2    TCP 83 8081 → 56848 [PSH, ACK] Seq=1174 Ack=1191 Win=65152 Len=17 TSval=3806120184 TSecr=1681860475
1712183658.123588562   591 1.271612595    10.10.1.2 → 10.10.1.1    TCP 83 56848 → 8081 [PSH, ACK] Seq=1191 Ack=1191 Win=64256 Len=17 TSval=1681860485 TSecr=3806120184
1712183660.123588562   593 1.271732988    10.10.1.1 → 10.10.1.2    TCP 83 8081 → 56848 [PSH, ACK] Seq=1191 Ack=1208 Win=65152 Len=17 TSval=3806120195 TSecr=1681860485
1712183666.123588562   599 1.281967266    10.10.1.2 → 10.10.1.1    TCP 83 56848 → 8081 [PSH, ACK] Seq=1208 Ack=1208 Win=64256 Len=17 TSval=1681860496 TSecr=3806120195
1712183668.123588562   601 1.282087827    10.10.1.1 → 10.10.1.2    TCP 83 8081 → 56848 [PSH, ACK] Seq=1208 Ack=1225 Win=65152 Len=17 TSval=3806120205 TSecr=1681860496
1712183674.123588562   607 1.292320891    10.10.1.2 → 10.10.1.1    TCP 83 56848 → 8081 [PSH, ACK] Seq=1225 Ack=1225 Win=64256 Len=17 TSval=1681860506 TSecr=3806120205
1712183676.123588562   609 1.292442056    10.10.1.1 → 10.10.1.2    TCP 83 8081 → 56848 [PSH, ACK] Seq=1225 Ack=1242 Win=65152 Len=17 TSval=3806120215 TSecr=1681860506
1712183682.123588562   615 1.302678423    10.10.1.2 → 10.10.1.1    TCP 83 56848 → 8081 [PSH, ACK] Seq=1242 Ack=1242 Win=64256 Len=17 TSval=1681860516 TSecr=3806120215
1712183684.123588562   617 1.302798385    10.10.1.1 → 10.10.1.2    TCP 83 8081 → 56848 [PSH, ACK] Seq=1242 Ack=1259 Win=65152 Len=17 TSval=3806120226 TSecr=1681860516
1712183690.123588562   623 1.313036904    10.10.1.2 → 10.10.1.1    TCP 83 56848 → 8081 [PSH, ACK] Seq=1259 Ack=1259 Win=64256 Len=17 TSval=1681860527 TSecr=3806120226
1712183692.123588562   625 1.313156034    10.10.1.1 → 10.10.1.2    TCP 83 8081 → 56848 [PSH, ACK] Seq=1259 Ack=1276 Win=65152 Len=17 TSval=3806120236 TSecr=1681860527
1712183698.123588562   631 1.323390452    10.10.1.2 → 10.10.1.1    TCP 83 56848 → 8081 [PSH, ACK] Seq=1276 Ack=1276 Win=64256 Len=17 TSval=1681860537 TSecr=3806120236
1712183700.123588562   633 1.323509078    10.10.1.1 → 10.10.1.2    TCP 83 8081 → 56848 [PSH, ACK] Seq=1276 Ack=1293 Win=65152 Len=17 TSval=3806120247 TSecr=1681860537
1712183706.123588562   639 1.333696701    10.10.1.2 → 10.10.1.1    TCP 83 56848 → 8081 [PSH, ACK] Seq=1293 Ack=1293 Win=64256 Len=17 TSval=1681860548 TSecr=3806120247
1712183708.123588562   641 1.333816131    10.10.1.1 → 10.10.1.2    TCP 83 8081 → 56848 [PSH, ACK] Seq=1293 Ack=1310 Win=65152 Len=17 TSval=3806120257 TSecr=1681860548
1712183714.123588562   647 1.344050744    10.10.1.2 → 10.10.1.1    TCP 83 56848 → 8081 [PSH, ACK] Seq=1310 Ack=1310 Win=64256 Len=17 TSval=1681860558 TSecr=3806120257
1712183716.123588562   649 1.344170041    10.10.1.1 → 10.10.1.2    TCP 83 8081 → 56848 [PSH, ACK] Seq=1310 Ack=1327 Win=65152 Len=17 TSval=3806120267 TSecr=1681860558
1712183722.123588562   655 1.354403168    10.10.1.2 → 10.10.1.1    TCP 83 56848 → 8081 [PSH, ACK] Seq=1327 Ack=1327 Win=64256 Len=17 TSval=1681860568 TSecr=3806120267
1712183724.123588562   657 1.354524621    10.10.1.1 → 10.10.1.2    TCP 83 8081 → 56848 [PSH, ACK] Seq=1327 Ack=1344 Win=65152 Len=17 TSval=3806120278 TSecr=1681860568
1712183731.123588562   664 1.364760216    10.10.1.2 → 10.10.1.1    TCP 83 56848 → 8081 [PSH, ACK] Seq=1344 Ack=1344 Win=64256 Len=17 TSval=1681860579 TSecr=3806120278
1712183733.123588562   666 1.364881298    10.10.1.1 → 10.10.1.2    TCP 83 8081 → 56848 [PSH, ACK] Seq=1344 Ack=1361 Win=65152 Len=17 TSval=3806120288 TSecr=1681860579
1712183739.123588562   672 1.375116299    10.10.1.2 → 10.10.1.1    TCP 83 56848 → 8081 [PSH, ACK] Seq=1361 Ack=1361 Win=64256 Len=17 TSval=1681860589 TSecr=3806120288
1712183741.123588562   674 1.375237561    10.10.1.1 → 10.10.1.2    TCP 83 8081 → 56848 [PSH, ACK] Seq=1361 Ack=1378 Win=65152 Len=17 TSval=3806120298 TSecr=1681860589
1712183747.123588562   680 1.385471285    10.10.1.2 → 10.10.1.1    TCP 83 56848 → 8081 [PSH, ACK] Seq=1378 Ack=1378 Win=64256 Len=17 TSval=1681860599 TSecr=3806120298
1712183749.123588562   682 1.385592160    10.10.1.1 → 10.10.1.2    TCP 83 8081 → 56848 [PSH, ACK] Seq=1378 Ack=1395 Win=65152 Len=17 TSval=3806120309 TSecr=1681860599
1712183755.123588562   688 1.395827433    10.10.1.2 → 10.10.1.1    TCP 83 56848 → 8081 [PSH, ACK] Seq=1395 Ack=1395 Win=64256 Len=17 TSval=1681860610 TSecr=3806120309
1712183757.123588562   690 1.395946163    10.10.1.1 → 10.10.1.2    TCP 83 8081 → 56848 [PSH, ACK] Seq=1395 Ack=1412 Win=65152 Len=17 TSval=3806120319 TSecr=1681860610
1712183762.123588562   695 1.406110491    10.10.1.2 → 10.10.1.1    TCP 83 56848 → 8081 [PSH, ACK] Seq=1412 Ack=1412 Win=64256 Len=17 TSval=1681860620 TSecr=3806120319
1712183764.123588562   697 1.406248933    10.10.1.1 → 10.10.1.2    TCP 83 8081 → 56848 [PSH, ACK] Seq=1412 Ack=1429 Win=65152 Len=17 TSval=3806120329 TSecr=1681860620
1712183771.123588562   704 1.416485635    10.10.1.2 → 10.10.1.1    TCP 83 56848 → 8081 [PSH, ACK] Seq=1429 Ack=1429 Win=64256 Len=17 TSval=1681860630 TSecr=3806120329
1712183773.123588562   706 1.416605572    10.10.1.1 → 10.10.1.2    TCP 83 8081 → 56848 [PSH, ACK] Seq=1429 Ack=1446 Win=65152 Len=17 TSval=3806120340 TSecr=1681860630
1712183779.123588562   712 1.426841214    10.10.1.2 → 10.10.1.1    TCP 83 56848 → 8081 [PSH, ACK] Seq=1446 Ack=1446 Win=64256 Len=17 TSval=1681860641 TSecr=3806120340
1712183781.123588562   714 1.426960116    10.10.1.1 → 10.10.1.2    TCP 83 8081 → 56848 [PSH, ACK] Seq=1446 Ack=1463 Win=65152 Len=17 TSval=3806120350 TSecr=1681860641
1712183787.123588562   720 1.437194074    10.10.1.2 → 10.10.1.1    TCP 83 56848 → 8081 [PSH, ACK] Seq=1463 Ack=1463 Win=64256 Len=17 TSval=1681860651 TSecr=3806120350
1712183789.123588562   722 1.437314156    10.10.1.1 → 10.10.1.2    TCP 83 8081 → 56848 [PSH, ACK] Seq=1463 Ack=1480 Win=65152 Len=17 TSval=3806120360 TSecr=1681860651
1712183795.123588562   728 1.447548532    10.10.1.2 → 10.10.1.1    TCP 83 56848 → 8081 [PSH, ACK] Seq=1480 Ack=1480 Win=64256 Len=17 TSval=1681860661 TSecr=3806120360
1712183797.123588562   730 1.447666824    10.10.1.1 → 10.10.1.2    TCP 83 8081 → 56848 [PSH, ACK] Seq=1480 Ack=1497 Win=65152 Len=17 TSval=3806120371 TSecr=1681860661
1712183803.123588562   736 1.457899771    10.10.1.2 → 10.10.1.1    TCP 83 56848 → 8081 [PSH, ACK] Seq=1497 Ack=1497 Win=64256 Len=17 TSval=1681860672 TSecr=3806120371
1712183805.123588562   738 1.458020094    10.10.1.1 → 10.10.1.2    TCP 83 8081 → 56848 [PSH, ACK] Seq=1497 Ack=1514 Win=65152 Len=17 TSval=3806120381 TSecr=1681860672
1712183811.123588562   744 1.468256436    10.10.1.2 → 10.10.1.1    TCP 83 56848 → 8081 [PSH, ACK] Seq=1514 Ack=1514 Win=64256 Len=17 TSval=1681860682 TSecr=3806120381
1712183813.123588562   746 1.468376906    10.10.1.1 → 10.10.1.2    TCP 83 8081 → 56848 [PSH, ACK] Seq=1514 Ack=1531 Win=65152 Len=17 TSval=3806120391 TSecr=1681860682
1712183819.123588562   752 1.478611553    10.10.1.2 → 10.10.1.1    TCP 83 56848 → 8081 [PSH, ACK] Seq=1531 Ack=1531 Win=64256 Len=17 TSval=1681860692 TSecr=3806120391
1712183821.123588562   754 1.478730482    10.10.1.1 → 10.10.1.2    TCP 83 8081 → 56848 [PSH, ACK] Seq=1531 Ack=1548 Win=65152 Len=17 TSval=3806120402 TSecr=1681860692
1712183827.123588562   760 1.488961420    10.10.1.2 → 10.10.1.1    TCP 83 56848 → 8081 [PSH, ACK] Seq=1548 Ack=1548 Win=64256 Len=17 TSval=1681860703 TSecr=3806120402
1712183829.123588562   762 1.489083472    10.10.1.1 → 10.10.1.2    TCP 83 8081 → 56848 [PSH, ACK] Seq=1548 Ack=1565 Win=65152 Len=17 TSval=3806120412 TSecr=1681860703
1712183835.123588562   768 1.499317627    10.10.1.2 → 10.10.1.1    TCP 83 56848 → 8081 [PSH, ACK] Seq=1565 Ack=1565 Win=64256 Len=17 TSval=1681860713 TSecr=3806120412
1712183837.123588562   770 1.499438934    10.10.1.1 → 10.10.1.2    TCP 83 8081 → 56848 [PSH, ACK] Seq=1565 Ack=1582 Win=65152 Len=17 TSval=3806120422 TSecr=1681860713
1712183843.123588562   776 1.509684919    10.10.1.2 → 10.10.1.1    TCP 83 56848 → 8081 [PSH, ACK] Seq=1582 Ack=1582 Win=64256 Len=17 TSval=1681860723 TSecr=3806120422
1712183845.123588562   778 1.509743017    10.10.1.1 → 10.10.1.2    TCP 83 8081 → 56848 [PSH, ACK] Seq=1582 Ack=1599 Win=65152 Len=17 TSval=3806120433 TSecr=1681860723
1712183851.123588562   784 1.519979654    10.10.1.2 → 10.10.1.1    TCP 83 56848 → 8081 [PSH, ACK] Seq=1599 Ack=1599 Win=64256 Len=17 TSval=1681860734 TSecr=3806120433
1712183853.123588562   786 1.520099271    10.10.1.1 → 10.10.1.2    TCP 83 8081 → 56848 [PSH, ACK] Seq=1599 Ack=1616 Win=65152 Len=17 TSval=3806120443 TSecr=1681860734
1712183859.123588562   792 1.530337596    10.10.1.2 → 10.10.1.1    TCP 83 56848 → 8081 [PSH, ACK] Seq=1616 Ack=1616 Win=64256 Len=17 TSval=1681860744 TSecr=3806120443
1712183861.123588562   794 1.530485825    10.10.1.1 → 10.10.1.2    TCP 83 8081 → 56848 [PSH, ACK] Seq=1616 Ack=1633 Win=65152 Len=17 TSval=3806120453 TSecr=1681860744
1712183867.123588562   800 1.540720148    10.10.1.2 → 10.10.1.1    TCP 83 56848 → 8081 [PSH, ACK] Seq=1633 Ack=1633 Win=64256 Len=17 TSval=1681860755 TSecr=3806120453
1712183869.123588562   802 1.540843105    10.10.1.1 → 10.10.1.2    TCP 83 8081 → 56848 [PSH, ACK] Seq=1633 Ack=1650 Win=65152 Len=17 TSval=3806120464 TSecr=1681860755
1712183875.123588562   808 1.551078708    10.10.1.2 → 10.10.1.1    TCP 83 56848 → 8081 [PSH, ACK] Seq=1650 Ack=1650 Win=64256 Len=17 TSval=1681860765 TSecr=3806120464
1712183877.123588562   810 1.551199563    10.10.1.1 → 10.10.1.2    TCP 83 8081 → 56848 [PSH, ACK] Seq=1650 Ack=1667 Win=65152 Len=17 TSval=3806120474 TSecr=1681860765
1712183883.123588562   816 1.561434701    10.10.1.2 → 10.10.1.1    TCP 83 56848 → 8081 [PSH, ACK] Seq=1667 Ack=1667 Win=64256 Len=17 TSval=1681860775 TSecr=3806120474
1712183885.123588562   818 1.561554647    10.10.1.1 → 10.10.1.2    TCP 83 8081 → 56848 [PSH, ACK] Seq=1667 Ack=1684 Win=65152 Len=17 TSval=3806120485 TSecr=1681860775
1712183891.123588562   824 1.571791084    10.10.1.2 → 10.10.1.1    TCP 83 56848 → 8081 [PSH, ACK] Seq=1684 Ack=1684 Win=64256 Len=17 TSval=1681860786 TSecr=3806120485
1712183893.123588562   826 1.571910317    10.10.1.1 → 10.10.1.2    TCP 83 8081 → 56848 [PSH, ACK] Seq=1684 Ack=1701 Win=65152 Len=17 TSval=3806120495 TSecr=1681860786
1712183899.123588562   832 1.582145089    10.10.1.2 → 10.10.1.1    TCP 83 56848 → 8081 [PSH, ACK] Seq=1701 Ack=1701 Win=64256 Len=17 TSval=1681860796 TSecr=3806120495
1712183901.123588562   834 1.582264451    10.10.1.1 → 10.10.1.2    TCP 83 8081 → 56848 [PSH, ACK] Seq=1701 Ack=1718 Win=65152 Len=17 TSval=3806120505 TSecr=1681860796
1712183907.123588562   840 1.592498360    10.10.1.2 → 10.10.1.1    TCP 83 56848 → 8081 [PSH, ACK] Seq=1718 Ack=1718 Win=64256 Len=17 TSval=1681860806 TSecr=3806120505
1712183909.123588562   842 1.592617121    10.10.1.1 → 10.10.1.2    TCP 83 8081 → 56848 [PSH, ACK] Seq=1718 Ack=1735 Win=65152 Len=17 TSval=3806120516 TSecr=1681860806
1712183915.123588562   848 1.602850177    10.10.1.2 → 10.10.1.1    TCP 83 56848 → 8081 [PSH, ACK] Seq=1735 Ack=1735 Win=64256 Len=17 TSval=1681860817 TSecr=3806120516
1712183917.123588562   850 1.602968633    10.10.1.1 → 10.10.1.2    TCP 83 8081 → 56848 [PSH, ACK] Seq=1735 Ack=1752 Win=65152 Len=17 TSval=3806120526 TSecr=1681860817
1712183923.123588562   856 1.613204881    10.10.1.2 → 10.10.1.1    TCP 83 56848 → 8081 [PSH, ACK] Seq=1752 Ack=1752 Win=64256 Len=17 TSval=1681860827 TSecr=3806120526
1712183925.123588562   858 1.613325057    10.10.1.1 → 10.10.1.2    TCP 83 8081 → 56848 [PSH, ACK] Seq=1752 Ack=1769 Win=65152 Len=17 TSval=3806120536 TSecr=1681860827
1712183931.123588562   864 1.623560165    10.10.1.2 → 10.10.1.1    TCP 83 56848 → 8081 [PSH, ACK] Seq=1769 Ack=1769 Win=64256 Len=17 TSval=1681860837 TSecr=3806120536
1712183933.123588562   866 1.623680754    10.10.1.1 → 10.10.1.2    TCP 83 8081 → 56848 [PSH, ACK] Seq=1769 Ack=1786 Win=65152 Len=17 TSval=3806120547 TSecr=1681860837
1712183939.123588562   872 1.633912950    10.10.1.2 → 10.10.1.1    TCP 83 56848 → 8081 [PSH, ACK] Seq=1786 Ack=1786 Win=64256 Len=17 TSval=1681860848 TSecr=3806120547
1712183941.123588562   874 1.634033010    10.10.1.1 → 10.10.1.2    TCP 83 8081 → 56848 [PSH, ACK] Seq=1786 Ack=1803 Win=65152 Len=17 TSval=3806120557 TSecr=1681860848
1712183947.123588562   880 1.644266182    10.10.1.2 → 10.10.1.1    TCP 83 56848 → 8081 [PSH, ACK] Seq=1803 Ack=1803 Win=64256 Len=17 TSval=1681860858 TSecr=3806120557
1712183949.123588562   882 1.644387679    10.10.1.1 → 10.10.1.2    TCP 83 8081 → 56848 [PSH, ACK] Seq=1803 Ack=1820 Win=65152 Len=17 TSval=3806120567 TSecr=1681860858
1712183955.123588562   888 1.654620943    10.10.1.2 → 10.10.1.1    TCP 83 56848 → 8081 [PSH, ACK] Seq=1820 Ack=1820 Win=64256 Len=17 TSval=1681860868 TSecr=3806120567
1712183957.123588562   890 1.654740952    10.10.1.1 → 10.10.1.2    TCP 83 8081 → 56848 [PSH, ACK] Seq=1820 Ack=1837 Win=65152 Len=17 TSval=3806120578 TSecr=1681860868
1712183963.123588562   896 1.664976077    10.10.1.2 → 10.10.1.1    TCP 83 56848 → 8081 [PSH, ACK] Seq=1837 Ack=1837 Win=64256 Len=17 TSval=1681860879 TSecr=3806120578
1712183965.123588562   898 1.665077942    10.10.1.1 → 10.10.1.2    TCP 83 8081 → 56848 [PSH, ACK] Seq=1837 Ack=1854 Win=65152 Len=17 TSval=3806120588 TSecr=1681860879
1712183971.123588562   904 1.675311709    10.10.1.2 → 10.10.1.1    TCP 83 56848 → 8081 [PSH, ACK] Seq=1854 Ack=1854 Win=64256 Len=17 TSval=1681860889 TSecr=3806120588
1712183973.123588562   906 1.675431460    10.10.1.1 → 10.10.1.2    TCP 83 8081 → 56848 [PSH, ACK] Seq=1854 Ack=1871 Win=65152 Len=17 TSval=3806120598 TSecr=1681860889
1712183979.123588562   912 1.685675685    10.10.1.2 → 10.10.1.1    TCP 83 56848 → 8081 [PSH, ACK] Seq=1871 Ack=1871 Win=64256 Len=17 TSval=1681860899 TSecr=3806120598
1712183981.123588562   914 1.685794790    10.10.1.1 → 10.10.1.2    TCP 83 8081 → 56848 [PSH, ACK] Seq=1871 Ack=1888 Win=65152 Len=17 TSval=3806120609 TSecr=1681860899
1712183987.123588562   920 1.696028593    10.10.1.2 → 10.10.1.1    TCP 83 56848 → 8081 [PSH, ACK] Seq=1888 Ack=1888 Win=64256 Len=17 TSval=1681860910 TSecr=3806120609
1712183989.123588562   922 1.696148875    10.10.1.1 → 10.10.1.2    TCP 83 8081 → 56848 [PSH, ACK] Seq=1888 Ack=1905 Win=65152 Len=17 TSval=3806120619 TSecr=1681860910
1712183995.123588562   928 1.706381201    10.10.1.2 → 10.10.1.1    TCP 83 56848 → 8081 [PSH, ACK] Seq=1905 Ack=1905 Win=64256 Len=17 TSval=1681860920 TSecr=3806120619
1712183997.123588562   930 1.706528639    10.10.1.1 → 10.10.1.2    TCP 83 8081 → 56848 [PSH, ACK] Seq=1905 Ack=1922 Win=65152 Len=17 TSval=3806120630 TSecr=1681860920
1712184002.123588562   935 1.716685890    10.10.1.2 → 10.10.1.1    TCP 83 56848 → 8081 [PSH, ACK] Seq=1922 Ack=1922 Win=64256 Len=17 TSval=1681860931 TSecr=3806120630
1712184005.123588562   938 1.716857829    10.10.1.1 → 10.10.1.2    TCP 83 8081 → 56848 [PSH, ACK] Seq=1922 Ack=1939 Win=65152 Len=17 TSval=3806120640 TSecr=1681860931
1712184011.123588562   944 1.727090946    10.10.1.2 → 10.10.1.1    TCP 83 56848 → 8081 [PSH, ACK] Seq=1939 Ack=1939 Win=64256 Len=17 TSval=1681860941 TSecr=3806120640
1712184013.123588562   946 1.727210181    10.10.1.1 → 10.10.1.2    TCP 83 8081 → 56848 [PSH, ACK] Seq=1939 Ack=1956 Win=65152 Len=17 TSval=3806120650 TSecr=1681860941
1712184019.123588562   952 1.737442102    10.10.1.2 → 10.10.1.1    TCP 83 56848 → 8081 [PSH, ACK] Seq=1956 Ack=1956 Win=64256 Len=17 TSval=1681860951 TSecr=3806120650
1712184021.123588562   954 1.737565085    10.10.1.1 → 10.10.1.2    TCP 83 8081 → 56848 [PSH, ACK] Seq=1956 Ack=1973 Win=65152 Len=17 TSval=3806120661 TSecr=1681860951
1712184027.123588562   960 1.747800574    10.10.1.2 → 10.10.1.1    TCP 83 56848 → 8081 [PSH, ACK] Seq=1973 Ack=1973 Win=64256 Len=17 TSval=1681860962 TSecr=3806120661
1712184029.123588562   962 1.747918984    10.10.1.1 → 10.10.1.2    TCP 83 8081 → 56848 [PSH, ACK] Seq=1973 Ack=1990 Win=65152 Len=17 TSval=3806120671 TSecr=1681860962
1712184035.123588562   968 1.758155908    10.10.1.2 → 10.10.1.1    TCP 83 56848 → 8081 [PSH, ACK] Seq=1990 Ack=1990 Win=64256 Len=17 TSval=1681860972 TSecr=3806120671
1712184037.123588562   970 1.758274458    10.10.1.1 → 10.10.1.2    TCP 83 8081 → 56848 [PSH, ACK] Seq=1990 Ack=2007 Win=65152 Len=17 TSval=3806120681 TSecr=1681860972
1712184043.123588562   976 1.768509320    10.10.1.2 → 10.10.1.1    TCP 83 56848 → 8081 [PSH, ACK] Seq=2007 Ack=2007 Win=64256 Len=17 TSval=1681860982 TSecr=3806120681
1712184045.123588562   978 1.768633511    10.10.1.1 → 10.10.1.2    TCP 83 8081 → 56848 [PSH, ACK] Seq=2007 Ack=2024 Win=65152 Len=17 TSval=3806120692 TSecr=1681860982
1712184050.123588562   983 1.778813161    10.10.1.2 → 10.10.1.1    TCP 83 56848 → 8081 [PSH, ACK] Seq=2024 Ack=2024 Win=64256 Len=17 TSval=1681860993 TSecr=3806120692
1712184052.123588562   985 1.778948395    10.10.1.1 → 10.10.1.2    TCP 83 8081 → 56848 [PSH, ACK] Seq=2024 Ack=2041 Win=65152 Len=17 TSval=3806120702 TSecr=1681860993
1712184059.123588562   992 1.789184104    10.10.1.2 → 10.10.1.1    TCP 83 56848 → 8081 [PSH, ACK] Seq=2041 Ack=2041 Win=64256 Len=17 TSval=1681861003 TSecr=3806120702
