1711548686.696070910    22 0.280113458    10.10.1.2 → 10.10.1.1    TCP 74 40834 → 8081 [SYN] Seq=0 Win=64240 Len=0 MSS=1460 SACK_PERM=1 TSval=1047457007 TSecr=0 WS=128
1711548687.696070910    23 0.280149144    10.10.1.1 → 10.10.1.2    TCP 74 8081 → 40834 [SYN, ACK] Seq=0 Ack=1 Win=65160 Len=0 MSS=1460 SACK_PERM=1 TSval=3171716718 TSecr=1047457007 WS=128
1711548688.696070910    24 0.280240272    10.10.1.2 → 10.10.1.1    TCP 66 40834 → 8081 [ACK] Seq=1 Ack=1 Win=64256 Len=0 TSval=1047457008 TSecr=3171716718
1711548698.696070910    34 0.532839201    10.10.1.2 → 10.10.1.1    TCP 83 40834 → 8081 [PSH, ACK] Seq=1 Ack=1 Win=64256 Len=17 TSval=1047457260 TSecr=3171716718
1711548700.696070910    36 0.532868414    10.10.1.1 → 10.10.1.2    TCP 66 8081 → 40834 [ACK] Seq=1 Ack=18 Win=65152 Len=0 TSval=3171716971 TSecr=1047457260
1711548702.696070910    38 0.533133742    10.10.1.1 → 10.10.1.2    TCP 83 8081 → 40834 [PSH, ACK] Seq=1 Ack=18 Win=65152 Len=17 TSval=3171716971 TSecr=1047457260
1711548703.696070910    39 0.533163742    10.10.1.2 → 10.10.1.1    TCP 66 40834 → 8081 [ACK] Seq=18 Ack=18 Win=64256 Len=0 TSval=1047457261 TSecr=3171716971
1711548710.696070910    46 0.534356298    10.10.1.2 → 10.10.1.1    TCP 83 40834 → 8081 [PSH, ACK] Seq=18 Ack=18 Win=64256 Len=17 TSval=1047457262 TSecr=3171716971
1711548713.696070910    49 0.534481058    10.10.1.1 → 10.10.1.2    TCP 83 8081 → 40834 [PSH, ACK] Seq=18 Ack=35 Win=65152 Len=17 TSval=3171716973 TSecr=1047457262
1711548720.696070910    56 0.535652911    10.10.1.2 → 10.10.1.1    TCP 83 40834 → 8081 [PSH, ACK] Seq=35 Ack=35 Win=64256 Len=17 TSval=1047457263 TSecr=3171716973
1711548723.696070910    59 0.535790028    10.10.1.1 → 10.10.1.2    TCP 83 8081 → 40834 [PSH, ACK] Seq=35 Ack=52 Win=65152 Len=17 TSval=3171716974 TSecr=1047457263
1711548730.696070910    66 0.537002444    10.10.1.2 → 10.10.1.1    TCP 83 40834 → 8081 [PSH, ACK] Seq=52 Ack=52 Win=64256 Len=17 TSval=1047457264 TSecr=3171716974
1711548733.696070910    69 0.537129331    10.10.1.1 → 10.10.1.2    TCP 83 8081 → 40834 [PSH, ACK] Seq=52 Ack=69 Win=65152 Len=17 TSval=3171716975 TSecr=1047457264
1711548740.696070910    76 0.538344857    10.10.1.2 → 10.10.1.1    TCP 83 40834 → 8081 [PSH, ACK] Seq=69 Ack=69 Win=64256 Len=17 TSval=1047457266 TSecr=3171716975
1711548743.696070910    79 0.538470985    10.10.1.1 → 10.10.1.2    TCP 83 8081 → 40834 [PSH, ACK] Seq=69 Ack=86 Win=65152 Len=17 TSval=3171716977 TSecr=1047457266
1711548750.696070910    86 0.539682471    10.10.1.2 → 10.10.1.1    TCP 83 40834 → 8081 [PSH, ACK] Seq=86 Ack=86 Win=64256 Len=17 TSval=1047457267 TSecr=3171716977
1711548752.696070910    88 0.539740364    10.10.1.1 → 10.10.1.2    TCP 83 8081 → 40834 [PSH, ACK] Seq=86 Ack=103 Win=65152 Len=17 TSval=3171716978 TSecr=1047457267
1711548760.696070910    96 0.540950280    10.10.1.2 → 10.10.1.1    TCP 83 40834 → 8081 [PSH, ACK] Seq=103 Ack=103 Win=64256 Len=17 TSval=1047457268 TSecr=3171716978
1711548762.696070910    98 0.541077487    10.10.1.1 → 10.10.1.2    TCP 83 8081 → 40834 [PSH, ACK] Seq=103 Ack=120 Win=65152 Len=17 TSval=3171716979 TSecr=1047457268
1711548770.696070910   106 0.542293188    10.10.1.2 → 10.10.1.1    TCP 83 40834 → 8081 [PSH, ACK] Seq=120 Ack=120 Win=64256 Len=17 TSval=1047457270 TSecr=3171716979
1711548772.696070910   108 0.542415266    10.10.1.1 → 10.10.1.2    TCP 83 8081 → 40834 [PSH, ACK] Seq=120 Ack=137 Win=65152 Len=17 TSval=3171716981 TSecr=1047457270
1711548780.696070910   116 0.543627807    10.10.1.2 → 10.10.1.1    TCP 83 40834 → 8081 [PSH, ACK] Seq=137 Ack=137 Win=64256 Len=17 TSval=1047457271 TSecr=3171716981
1711548783.696070910   119 0.543721829    10.10.1.1 → 10.10.1.2    TCP 83 8081 → 40834 [PSH, ACK] Seq=137 Ack=154 Win=65152 Len=17 TSval=3171716982 TSecr=1047457271
1711548790.696070910   126 0.544937322    10.10.1.2 → 10.10.1.1    TCP 83 40834 → 8081 [PSH, ACK] Seq=154 Ack=154 Win=64256 Len=17 TSval=1047457272 TSecr=3171716982
1711548792.696070910   128 0.545074978    10.10.1.1 → 10.10.1.2    TCP 83 8081 → 40834 [PSH, ACK] Seq=154 Ack=171 Win=65152 Len=17 TSval=3171716983 TSecr=1047457272
1711548800.696070910   136 0.546290017    10.10.1.2 → 10.10.1.1    TCP 83 40834 → 8081 [PSH, ACK] Seq=171 Ack=171 Win=64256 Len=17 TSval=1047457274 TSecr=3171716983
1711548802.696070910   138 0.546411399    10.10.1.1 → 10.10.1.2    TCP 83 8081 → 40834 [PSH, ACK] Seq=171 Ack=188 Win=65152 Len=17 TSval=3171716985 TSecr=1047457274
1711548810.696070910   146 0.547622970    10.10.1.2 → 10.10.1.1    TCP 83 40834 → 8081 [PSH, ACK] Seq=188 Ack=188 Win=64256 Len=17 TSval=1047457275 TSecr=3171716985
1711548813.696070910   149 0.547708421    10.10.1.1 → 10.10.1.2    TCP 83 8081 → 40834 [PSH, ACK] Seq=188 Ack=205 Win=65152 Len=17 TSval=3171716986 TSecr=1047457275
1711548820.696070910   156 0.548920899    10.10.1.2 → 10.10.1.1    TCP 83 40834 → 8081 [PSH, ACK] Seq=205 Ack=205 Win=64256 Len=17 TSval=1047457276 TSecr=3171716986
1711548822.696070910   158 0.549042689    10.10.1.1 → 10.10.1.2    TCP 83 8081 → 40834 [PSH, ACK] Seq=205 Ack=222 Win=65152 Len=17 TSval=3171716987 TSecr=1047457276
1711548830.696070910   166 0.550257704    10.10.1.2 → 10.10.1.1    TCP 83 40834 → 8081 [PSH, ACK] Seq=222 Ack=222 Win=64256 Len=17 TSval=1047457278 TSecr=3171716987
1711548832.696070910   168 0.550379565    10.10.1.1 → 10.10.1.2    TCP 83 8081 → 40834 [PSH, ACK] Seq=222 Ack=239 Win=65152 Len=17 TSval=3171716989 TSecr=1047457278
1711548840.696070910   176 0.551591621    10.10.1.2 → 10.10.1.1    TCP 83 40834 → 8081 [PSH, ACK] Seq=239 Ack=239 Win=64256 Len=17 TSval=1047457279 TSecr=3171716989
1711548842.696070910   178 0.551676458    10.10.1.1 → 10.10.1.2    TCP 83 8081 → 40834 [PSH, ACK] Seq=239 Ack=256 Win=65152 Len=17 TSval=3171716990 TSecr=1047457279
1711548850.696070910   186 0.552890035    10.10.1.2 → 10.10.1.1    TCP 83 40834 → 8081 [PSH, ACK] Seq=256 Ack=256 Win=64256 Len=17 TSval=1047457280 TSecr=3171716990
1711548852.696070910   188 0.553012627    10.10.1.1 → 10.10.1.2    TCP 83 8081 → 40834 [PSH, ACK] Seq=256 Ack=273 Win=65152 Len=17 TSval=3171716991 TSecr=1047457280
1711548860.696070910   196 0.554228473    10.10.1.2 → 10.10.1.1    TCP 83 40834 → 8081 [PSH, ACK] Seq=273 Ack=273 Win=64256 Len=17 TSval=1047457282 TSecr=3171716991
1711548862.696070910   198 0.554350866    10.10.1.1 → 10.10.1.2    TCP 83 8081 → 40834 [PSH, ACK] Seq=273 Ack=290 Win=65152 Len=17 TSval=3171716993 TSecr=1047457282
1711548870.696070910   206 0.555563872    10.10.1.2 → 10.10.1.1    TCP 83 40834 → 8081 [PSH, ACK] Seq=290 Ack=290 Win=64256 Len=17 TSval=1047457283 TSecr=3171716993
1711548872.696070910   208 0.555646413    10.10.1.1 → 10.10.1.2    TCP 83 8081 → 40834 [PSH, ACK] Seq=290 Ack=307 Win=65152 Len=17 TSval=3171716994 TSecr=1047457283
1711548880.696070910   216 0.556857887    10.10.1.2 → 10.10.1.1    TCP 83 40834 → 8081 [PSH, ACK] Seq=307 Ack=307 Win=64256 Len=17 TSval=1047457284 TSecr=3171716994
1711548882.696070910   218 0.556979767    10.10.1.1 → 10.10.1.2    TCP 83 8081 → 40834 [PSH, ACK] Seq=307 Ack=324 Win=65152 Len=17 TSval=3171716995 TSecr=1047457284
1711548890.696070910   226 0.558193070    10.10.1.2 → 10.10.1.1    TCP 83 40834 → 8081 [PSH, ACK] Seq=324 Ack=324 Win=64256 Len=17 TSval=1047457285 TSecr=3171716995
1711548892.696070910   228 0.558313756    10.10.1.1 → 10.10.1.2    TCP 83 8081 → 40834 [PSH, ACK] Seq=324 Ack=341 Win=65152 Len=17 TSval=3171716996 TSecr=1047457285
1711548900.696070910   236 0.559524592    10.10.1.2 → 10.10.1.1    TCP 83 40834 → 8081 [PSH, ACK] Seq=341 Ack=341 Win=64256 Len=17 TSval=1047457287 TSecr=3171716996
1711548902.696070910   238 0.559608584    10.10.1.1 → 10.10.1.2    TCP 83 8081 → 40834 [PSH, ACK] Seq=341 Ack=358 Win=65152 Len=17 TSval=3171716998 TSecr=1047457287
1711548910.696070910   246 0.560820578    10.10.1.2 → 10.10.1.1    TCP 83 40834 → 8081 [PSH, ACK] Seq=358 Ack=358 Win=64256 Len=17 TSval=1047457288 TSecr=3171716998
1711548912.696070910   248 0.560942803    10.10.1.1 → 10.10.1.2    TCP 83 8081 → 40834 [PSH, ACK] Seq=358 Ack=375 Win=65152 Len=17 TSval=3171716999 TSecr=1047457288
1711548920.696070910   256 0.562156647    10.10.1.2 → 10.10.1.1    TCP 83 40834 → 8081 [PSH, ACK] Seq=375 Ack=375 Win=64256 Len=17 TSval=1047457289 TSecr=3171716999
1711548922.696070910   258 0.562277597    10.10.1.1 → 10.10.1.2    TCP 83 8081 → 40834 [PSH, ACK] Seq=375 Ack=392 Win=65152 Len=17 TSval=3171717000 TSecr=1047457289
1711548930.696070910   266 0.563488456    10.10.1.2 → 10.10.1.1    TCP 83 40834 → 8081 [PSH, ACK] Seq=392 Ack=392 Win=64256 Len=17 TSval=1047457291 TSecr=3171717000
1711548933.696070910   269 0.563620237    10.10.1.1 → 10.10.1.2    TCP 83 8081 → 40834 [PSH, ACK] Seq=392 Ack=409 Win=65152 Len=17 TSval=3171717002 TSecr=1047457291
1711548940.696070910   276 0.564832227    10.10.1.2 → 10.10.1.1    TCP 83 40834 → 8081 [PSH, ACK] Seq=409 Ack=409 Win=64256 Len=17 TSval=1047457292 TSecr=3171717002
1711548942.696070910   278 0.564957795    10.10.1.1 → 10.10.1.2    TCP 83 8081 → 40834 [PSH, ACK] Seq=409 Ack=426 Win=65152 Len=17 TSval=3171717003 TSecr=1047457292
1711548950.696070910   286 0.566173210    10.10.1.2 → 10.10.1.1    TCP 83 40834 → 8081 [PSH, ACK] Seq=426 Ack=426 Win=64256 Len=17 TSval=1047457293 TSecr=3171717003
1711548952.696070910   288 0.566295292    10.10.1.1 → 10.10.1.2    TCP 83 8081 → 40834 [PSH, ACK] Seq=426 Ack=443 Win=65152 Len=17 TSval=3171717004 TSecr=1047457293
1711548960.696070910   296 0.567508376    10.10.1.2 → 10.10.1.1    TCP 83 40834 → 8081 [PSH, ACK] Seq=443 Ack=443 Win=64256 Len=17 TSval=1047457295 TSecr=3171717004
1711548962.696070910   298 0.567591483    10.10.1.1 → 10.10.1.2    TCP 83 8081 → 40834 [PSH, ACK] Seq=443 Ack=460 Win=65152 Len=17 TSval=3171717006 TSecr=1047457295
1711548970.696070910   306 0.568802794    10.10.1.2 → 10.10.1.1    TCP 83 40834 → 8081 [PSH, ACK] Seq=460 Ack=460 Win=64256 Len=17 TSval=1047457296 TSecr=3171717006
1711548972.696070910   308 0.568924062    10.10.1.1 → 10.10.1.2    TCP 83 8081 → 40834 [PSH, ACK] Seq=460 Ack=477 Win=65152 Len=17 TSval=3171717007 TSecr=1047457296
1711548980.696070910   316 0.570136666    10.10.1.2 → 10.10.1.1    TCP 83 40834 → 8081 [PSH, ACK] Seq=477 Ack=477 Win=64256 Len=17 TSval=1047457297 TSecr=3171717007
1711548982.696070910   318 0.570257501    10.10.1.1 → 10.10.1.2    TCP 83 8081 → 40834 [PSH, ACK] Seq=477 Ack=494 Win=65152 Len=17 TSval=3171717008 TSecr=1047457297
1711548990.696070910   326 0.571468962    10.10.1.2 → 10.10.1.1    TCP 83 40834 → 8081 [PSH, ACK] Seq=494 Ack=494 Win=64256 Len=17 TSval=1047457299 TSecr=3171717008
1711548992.696070910   328 0.571553714    10.10.1.1 → 10.10.1.2    TCP 83 8081 → 40834 [PSH, ACK] Seq=494 Ack=511 Win=65152 Len=17 TSval=3171717010 TSecr=1047457299
1711549000.696070910   336 0.572766046    10.10.1.2 → 10.10.1.1    TCP 83 40834 → 8081 [PSH, ACK] Seq=511 Ack=511 Win=64256 Len=17 TSval=1047457300 TSecr=3171717010
1711549002.696070910   338 0.572887893    10.10.1.1 → 10.10.1.2    TCP 83 8081 → 40834 [PSH, ACK] Seq=511 Ack=528 Win=65152 Len=17 TSval=3171717011 TSecr=1047457300
1711549010.696070910   346 0.574102766    10.10.1.2 → 10.10.1.1    TCP 83 40834 → 8081 [PSH, ACK] Seq=528 Ack=528 Win=64256 Len=17 TSval=1047457301 TSecr=3171717011
1711549012.696070910   348 0.574223213    10.10.1.1 → 10.10.1.2    TCP 83 8081 → 40834 [PSH, ACK] Seq=528 Ack=545 Win=65152 Len=17 TSval=3171717012 TSecr=1047457301
1711549020.696070910   356 0.575434195    10.10.1.2 → 10.10.1.1    TCP 83 40834 → 8081 [PSH, ACK] Seq=545 Ack=545 Win=64256 Len=17 TSval=1047457303 TSecr=3171717012
1711549022.696070910   358 0.575518630    10.10.1.1 → 10.10.1.2    TCP 83 8081 → 40834 [PSH, ACK] Seq=545 Ack=562 Win=65152 Len=17 TSval=3171717014 TSecr=1047457303
1711549030.696070910   366 0.576729007    10.10.1.2 → 10.10.1.1    TCP 83 40834 → 8081 [PSH, ACK] Seq=562 Ack=562 Win=64256 Len=17 TSval=1047457304 TSecr=3171717014
1711549032.696070910   368 0.576849798    10.10.1.1 → 10.10.1.2    TCP 83 8081 → 40834 [PSH, ACK] Seq=562 Ack=579 Win=65152 Len=17 TSval=3171717015 TSecr=1047457304
1711549040.696070910   376 0.578064122    10.10.1.2 → 10.10.1.1    TCP 83 40834 → 8081 [PSH, ACK] Seq=579 Ack=579 Win=64256 Len=17 TSval=1047457305 TSecr=3171717015
1711549042.696070910   378 0.578185318    10.10.1.1 → 10.10.1.2    TCP 83 8081 → 40834 [PSH, ACK] Seq=579 Ack=596 Win=65152 Len=17 TSval=3171717016 TSecr=1047457305
1711549050.696070910   386 0.579410827    10.10.1.2 → 10.10.1.1    TCP 83 40834 → 8081 [PSH, ACK] Seq=596 Ack=596 Win=64256 Len=17 TSval=1047457307 TSecr=3171717016
1711549052.696070910   388 0.579495952    10.10.1.1 → 10.10.1.2    TCP 83 8081 → 40834 [PSH, ACK] Seq=596 Ack=613 Win=65152 Len=17 TSval=3171717018 TSecr=1047457307
1711549060.696070910   396 0.580707199    10.10.1.2 → 10.10.1.1    TCP 83 40834 → 8081 [PSH, ACK] Seq=613 Ack=613 Win=64256 Len=17 TSval=1047457308 TSecr=3171717018
1711549062.696070910   398 0.580828645    10.10.1.1 → 10.10.1.2    TCP 83 8081 → 40834 [PSH, ACK] Seq=613 Ack=630 Win=65152 Len=17 TSval=3171717019 TSecr=1047457308
1711549070.696070910   406 0.582043115    10.10.1.2 → 10.10.1.1    TCP 83 40834 → 8081 [PSH, ACK] Seq=630 Ack=630 Win=64256 Len=17 TSval=1047457309 TSecr=3171717019
1711549072.696070910   408 0.582163904    10.10.1.1 → 10.10.1.2    TCP 83 8081 → 40834 [PSH, ACK] Seq=630 Ack=647 Win=65152 Len=17 TSval=3171717020 TSecr=1047457309
1711549080.696070910   416 0.583407011    10.10.1.2 → 10.10.1.1    TCP 83 40834 → 8081 [PSH, ACK] Seq=647 Ack=647 Win=64256 Len=17 TSval=1047457311 TSecr=3171717020
1711549082.696070910   418 0.583490548    10.10.1.1 → 10.10.1.2    TCP 83 8081 → 40834 [PSH, ACK] Seq=647 Ack=664 Win=65152 Len=17 TSval=3171717022 TSecr=1047457311
1711549090.696070910   426 0.584703116    10.10.1.2 → 10.10.1.1    TCP 83 40834 → 8081 [PSH, ACK] Seq=664 Ack=664 Win=64256 Len=17 TSval=1047457312 TSecr=3171717022
1711549092.696070910   428 0.584823922    10.10.1.1 → 10.10.1.2    TCP 83 8081 → 40834 [PSH, ACK] Seq=664 Ack=681 Win=65152 Len=17 TSval=3171717023 TSecr=1047457312
1711549100.696070910   436 0.586037284    10.10.1.2 → 10.10.1.1    TCP 83 40834 → 8081 [PSH, ACK] Seq=681 Ack=681 Win=64256 Len=17 TSval=1047457313 TSecr=3171717023
1711549102.696070910   438 0.586082852    10.10.1.1 → 10.10.1.2    TCP 83 8081 → 40834 [PSH, ACK] Seq=681 Ack=698 Win=65152 Len=17 TSval=3171717024 TSecr=1047457313
1711549109.696070910   445 0.587289448    10.10.1.2 → 10.10.1.1    TCP 83 40834 → 8081 [PSH, ACK] Seq=698 Ack=698 Win=64256 Len=17 TSval=1047457315 TSecr=3171717024
1711549111.696070910   447 0.587429330    10.10.1.1 → 10.10.1.2    TCP 83 8081 → 40834 [PSH, ACK] Seq=698 Ack=715 Win=65152 Len=17 TSval=3171717026 TSecr=1047457315
1711549119.696070910   455 0.588640556    10.10.1.2 → 10.10.1.1    TCP 83 40834 → 8081 [PSH, ACK] Seq=715 Ack=715 Win=64256 Len=17 TSval=1047457316 TSecr=3171717026
1711549121.696070910   457 0.588766212    10.10.1.1 → 10.10.1.2    TCP 83 8081 → 40834 [PSH, ACK] Seq=715 Ack=732 Win=65152 Len=17 TSval=3171717027 TSecr=1047457316
1711549129.696070910   465 0.589980521    10.10.1.2 → 10.10.1.1    TCP 83 40834 → 8081 [PSH, ACK] Seq=732 Ack=732 Win=64256 Len=17 TSval=1047457317 TSecr=3171717027
1711549131.696070910   467 0.590101933    10.10.1.1 → 10.10.1.2    TCP 83 8081 → 40834 [PSH, ACK] Seq=732 Ack=749 Win=65152 Len=17 TSval=3171717028 TSecr=1047457317
1711549139.696070910   475 0.591312750    10.10.1.2 → 10.10.1.1    TCP 83 40834 → 8081 [PSH, ACK] Seq=749 Ack=749 Win=64256 Len=17 TSval=1047457319 TSecr=3171717028
1711549141.696070910   477 0.591433210    10.10.1.1 → 10.10.1.2    TCP 83 8081 → 40834 [PSH, ACK] Seq=749 Ack=766 Win=65152 Len=17 TSval=3171717030 TSecr=1047457319
1711549149.696070910   485 0.592644942    10.10.1.2 → 10.10.1.1    TCP 83 40834 → 8081 [PSH, ACK] Seq=766 Ack=766 Win=64256 Len=17 TSval=1047457320 TSecr=3171717030
1711549151.696070910   487 0.592766320    10.10.1.1 → 10.10.1.2    TCP 83 8081 → 40834 [PSH, ACK] Seq=766 Ack=783 Win=65152 Len=17 TSval=3171717031 TSecr=1047457320
1711549159.696070910   495 0.593981173    10.10.1.2 → 10.10.1.1    TCP 83 40834 → 8081 [PSH, ACK] Seq=783 Ack=783 Win=64256 Len=17 TSval=1047457321 TSecr=3171717031
1711549162.696070910   498 0.594102390    10.10.1.1 → 10.10.1.2    TCP 83 8081 → 40834 [PSH, ACK] Seq=783 Ack=800 Win=65152 Len=17 TSval=3171717032 TSecr=1047457321
1711549169.696070910   505 0.595313077    10.10.1.2 → 10.10.1.1    TCP 83 40834 → 8081 [PSH, ACK] Seq=800 Ack=800 Win=64256 Len=17 TSval=1047457323 TSecr=3171717032
1711549172.696070910   508 0.595434852    10.10.1.1 → 10.10.1.2    TCP 83 8081 → 40834 [PSH, ACK] Seq=800 Ack=817 Win=65152 Len=17 TSval=3171717034 TSecr=1047457323
1711549179.696070910   515 0.596646315    10.10.1.2 → 10.10.1.1    TCP 83 40834 → 8081 [PSH, ACK] Seq=817 Ack=817 Win=64256 Len=17 TSval=1047457324 TSecr=3171717034
1711549181.696070910   517 0.596767181    10.10.1.1 → 10.10.1.2    TCP 83 8081 → 40834 [PSH, ACK] Seq=817 Ack=834 Win=65152 Len=17 TSval=3171717035 TSecr=1047457324
1711549189.696070910   525 0.597985155    10.10.1.2 → 10.10.1.1    TCP 83 40834 → 8081 [PSH, ACK] Seq=834 Ack=834 Win=64256 Len=17 TSval=1047457325 TSecr=3171717035
1711549191.696070910   527 0.598106865    10.10.1.1 → 10.10.1.2    TCP 83 8081 → 40834 [PSH, ACK] Seq=834 Ack=851 Win=65152 Len=17 TSval=3171717036 TSecr=1047457325
1711549199.696070910   535 0.599318739    10.10.1.2 → 10.10.1.1    TCP 83 40834 → 8081 [PSH, ACK] Seq=851 Ack=851 Win=64256 Len=17 TSval=1047457327 TSecr=3171717036
1711549201.696070910   537 0.599433524    10.10.1.1 → 10.10.1.2    TCP 83 8081 → 40834 [PSH, ACK] Seq=851 Ack=868 Win=65152 Len=17 TSval=3171717038 TSecr=1047457327
1711549209.696070910   545 0.600645535    10.10.1.2 → 10.10.1.1    TCP 83 40834 → 8081 [PSH, ACK] Seq=868 Ack=868 Win=64256 Len=17 TSval=1047457328 TSecr=3171717038
1711549211.696070910   547 0.600724424    10.10.1.1 → 10.10.1.2    TCP 83 8081 → 40834 [PSH, ACK] Seq=868 Ack=885 Win=65152 Len=17 TSval=3171717039 TSecr=1047457328
1711549219.696070910   555 0.601939010    10.10.1.2 → 10.10.1.1    TCP 83 40834 → 8081 [PSH, ACK] Seq=885 Ack=885 Win=64256 Len=17 TSval=1047457329 TSecr=3171717039
1711549221.696070910   557 0.602069986    10.10.1.1 → 10.10.1.2    TCP 83 8081 → 40834 [PSH, ACK] Seq=885 Ack=902 Win=65152 Len=17 TSval=3171717040 TSecr=1047457329
1711549229.696070910   565 0.603280960    10.10.1.2 → 10.10.1.1    TCP 83 40834 → 8081 [PSH, ACK] Seq=902 Ack=902 Win=64256 Len=17 TSval=1047457331 TSecr=3171717040
1711549231.696070910   567 0.603410547    10.10.1.1 → 10.10.1.2    TCP 83 8081 → 40834 [PSH, ACK] Seq=902 Ack=919 Win=65152 Len=17 TSval=3171717042 TSecr=1047457331
1711549239.696070910   575 0.604621422    10.10.1.2 → 10.10.1.1    TCP 83 40834 → 8081 [PSH, ACK] Seq=919 Ack=919 Win=64256 Len=17 TSval=1047457332 TSecr=3171717042
1711549241.696070910   577 0.604751494    10.10.1.1 → 10.10.1.2    TCP 83 8081 → 40834 [PSH, ACK] Seq=919 Ack=936 Win=65152 Len=17 TSval=3171717043 TSecr=1047457332
1711549249.696070910   585 0.605965833    10.10.1.2 → 10.10.1.1    TCP 83 40834 → 8081 [PSH, ACK] Seq=936 Ack=936 Win=64256 Len=17 TSval=1047457333 TSecr=3171717043
1711549251.696070910   587 0.606091239    10.10.1.1 → 10.10.1.2    TCP 83 8081 → 40834 [PSH, ACK] Seq=936 Ack=953 Win=65152 Len=17 TSval=3171717044 TSecr=1047457333
1711549259.696070910   595 0.607303016    10.10.1.2 → 10.10.1.1    TCP 83 40834 → 8081 [PSH, ACK] Seq=953 Ack=953 Win=64256 Len=17 TSval=1047457335 TSecr=3171717044
1711549262.696070910   598 0.607484116    10.10.1.1 → 10.10.1.2    TCP 83 8081 → 40834 [PSH, ACK] Seq=953 Ack=970 Win=65152 Len=17 TSval=3171717046 TSecr=1047457335
1711549269.696070910   605 0.608695902    10.10.1.2 → 10.10.1.1    TCP 83 40834 → 8081 [PSH, ACK] Seq=970 Ack=970 Win=64256 Len=17 TSval=1047457336 TSecr=3171717046
1711549271.696070910   607 0.608826207    10.10.1.1 → 10.10.1.2    TCP 83 8081 → 40834 [PSH, ACK] Seq=970 Ack=987 Win=65152 Len=17 TSval=3171717047 TSecr=1047457336
1711549280.696070910   616 0.610042091    10.10.1.2 → 10.10.1.1    TCP 83 40834 → 8081 [PSH, ACK] Seq=987 Ack=987 Win=64256 Len=17 TSval=1047457337 TSecr=3171717047
1711549282.696070910   618 0.610167687    10.10.1.1 → 10.10.1.2    TCP 83 8081 → 40834 [PSH, ACK] Seq=987 Ack=1004 Win=65152 Len=17 TSval=3171717048 TSecr=1047457337
1711549289.696070910   625 0.611379567    10.10.1.2 → 10.10.1.1    TCP 83 40834 → 8081 [PSH, ACK] Seq=1004 Ack=1004 Win=64256 Len=17 TSval=1047457339 TSecr=3171717048
1711549291.696070910   627 0.611510546    10.10.1.1 → 10.10.1.2    TCP 83 8081 → 40834 [PSH, ACK] Seq=1004 Ack=1021 Win=65152 Len=17 TSval=3171717050 TSecr=1047457339
1711549299.696070910   635 0.612721814    10.10.1.2 → 10.10.1.1    TCP 83 40834 → 8081 [PSH, ACK] Seq=1021 Ack=1021 Win=64256 Len=17 TSval=1047457340 TSecr=3171717050
1711549301.696070910   637 0.612847548    10.10.1.1 → 10.10.1.2    TCP 83 8081 → 40834 [PSH, ACK] Seq=1021 Ack=1038 Win=65152 Len=17 TSval=3171717051 TSecr=1047457340
1711549309.696070910   645 0.614061645    10.10.1.2 → 10.10.1.1    TCP 83 40834 → 8081 [PSH, ACK] Seq=1038 Ack=1038 Win=64256 Len=17 TSval=1047457341 TSecr=3171717051
1711549311.696070910   647 0.614183114    10.10.1.1 → 10.10.1.2    TCP 83 8081 → 40834 [PSH, ACK] Seq=1038 Ack=1055 Win=65152 Len=17 TSval=3171717052 TSecr=1047457341
1711549319.696070910   655 0.615408082    10.10.1.2 → 10.10.1.1    TCP 83 40834 → 8081 [PSH, ACK] Seq=1055 Ack=1055 Win=64256 Len=17 TSval=1047457343 TSecr=3171717052
1711549321.696070910   657 0.615493642    10.10.1.1 → 10.10.1.2    TCP 83 8081 → 40834 [PSH, ACK] Seq=1055 Ack=1072 Win=65152 Len=17 TSval=3171717054 TSecr=1047457343
1711549330.696070910   666 0.616708370    10.10.1.2 → 10.10.1.1    TCP 83 40834 → 8081 [PSH, ACK] Seq=1072 Ack=1072 Win=64256 Len=17 TSval=1047457344 TSecr=3171717054
1711549331.696070910   667 0.616774516    10.10.1.1 → 10.10.1.2    TCP 83 8081 → 40834 [PSH, ACK] Seq=1072 Ack=1089 Win=65152 Len=17 TSval=3171717055 TSecr=1047457344
1711549339.696070910   675 0.617987257    10.10.1.2 → 10.10.1.1    TCP 83 40834 → 8081 [PSH, ACK] Seq=1089 Ack=1089 Win=64256 Len=17 TSval=1047457345 TSecr=3171717055
1711549342.696070910   678 0.618113499    10.10.1.1 → 10.10.1.2    TCP 83 8081 → 40834 [PSH, ACK] Seq=1089 Ack=1106 Win=65152 Len=17 TSval=3171717056 TSecr=1047457345
1711549349.696070910   685 0.619331203    10.10.1.2 → 10.10.1.1    TCP 83 40834 → 8081 [PSH, ACK] Seq=1106 Ack=1106 Win=64256 Len=17 TSval=1047457347 TSecr=3171717056
1711549352.696070910   688 0.619438548    10.10.1.1 → 10.10.1.2    TCP 83 8081 → 40834 [PSH, ACK] Seq=1106 Ack=1123 Win=65152 Len=17 TSval=3171717058 TSecr=1047457347
1711549359.696070910   695 0.620650386    10.10.1.2 → 10.10.1.1    TCP 83 40834 → 8081 [PSH, ACK] Seq=1123 Ack=1123 Win=64256 Len=17 TSval=1047457348 TSecr=3171717058
1711549361.696070910   697 0.620775721    10.10.1.1 → 10.10.1.2    TCP 83 8081 → 40834 [PSH, ACK] Seq=1123 Ack=1140 Win=65152 Len=17 TSval=3171717059 TSecr=1047457348
1711549369.696070910   705 0.621991114    10.10.1.2 → 10.10.1.1    TCP 83 40834 → 8081 [PSH, ACK] Seq=1140 Ack=1140 Win=64256 Len=17 TSval=1047457349 TSecr=3171717059
1711549371.696070910   707 0.622116650    10.10.1.1 → 10.10.1.2    TCP 83 8081 → 40834 [PSH, ACK] Seq=1140 Ack=1157 Win=65152 Len=17 TSval=3171717060 TSecr=1047457349
1711549379.696070910   715 0.623329799    10.10.1.2 → 10.10.1.1    TCP 83 40834 → 8081 [PSH, ACK] Seq=1157 Ack=1157 Win=64256 Len=17 TSval=1047457351 TSecr=3171717060
1711549381.696070910   717 0.623437521    10.10.1.1 → 10.10.1.2    TCP 83 8081 → 40834 [PSH, ACK] Seq=1157 Ack=1174 Win=65152 Len=17 TSval=3171717062 TSecr=1047457351
1711549389.696070910   725 0.624648199    10.10.1.2 → 10.10.1.1    TCP 83 40834 → 8081 [PSH, ACK] Seq=1174 Ack=1174 Win=64256 Len=17 TSval=1047457352 TSecr=3171717062
1711549391.696070910   727 0.624774140    10.10.1.1 → 10.10.1.2    TCP 83 8081 → 40834 [PSH, ACK] Seq=1174 Ack=1191 Win=65152 Len=17 TSval=3171717063 TSecr=1047457352
1711549399.696070910   735 0.625988487    10.10.1.2 → 10.10.1.1    TCP 83 40834 → 8081 [PSH, ACK] Seq=1191 Ack=1191 Win=64256 Len=17 TSval=1047457353 TSecr=3171717063
1711549401.696070910   737 0.626114637    10.10.1.1 → 10.10.1.2    TCP 83 8081 → 40834 [PSH, ACK] Seq=1191 Ack=1208 Win=65152 Len=17 TSval=3171717064 TSecr=1047457353
1711549409.696070910   745 0.627325280    10.10.1.2 → 10.10.1.1    TCP 83 40834 → 8081 [PSH, ACK] Seq=1208 Ack=1208 Win=64256 Len=17 TSval=1047457355 TSecr=3171717064
1711549412.696070910   748 0.627456241    10.10.1.1 → 10.10.1.2    TCP 83 8081 → 40834 [PSH, ACK] Seq=1208 Ack=1225 Win=65152 Len=17 TSval=3171717066 TSecr=1047457355
1711549419.696070910   755 0.628625964    10.10.1.2 → 10.10.1.1    TCP 83 40834 → 8081 [PSH, ACK] Seq=1225 Ack=1225 Win=64256 Len=17 TSval=1047457356 TSecr=3171717066
1711549421.696070910   757 0.628748194    10.10.1.1 → 10.10.1.2    TCP 83 8081 → 40834 [PSH, ACK] Seq=1225 Ack=1242 Win=65152 Len=17 TSval=3171717067 TSecr=1047457356
1711549429.696070910   765 0.629962791    10.10.1.2 → 10.10.1.1    TCP 83 40834 → 8081 [PSH, ACK] Seq=1242 Ack=1242 Win=64256 Len=17 TSval=1047457357 TSecr=3171717067
1711549431.696070910   767 0.630082673    10.10.1.1 → 10.10.1.2    TCP 83 8081 → 40834 [PSH, ACK] Seq=1242 Ack=1259 Win=65152 Len=17 TSval=3171717068 TSecr=1047457357
1711549439.696070910   775 0.631293141    10.10.1.2 → 10.10.1.1    TCP 83 40834 → 8081 [PSH, ACK] Seq=1259 Ack=1259 Win=64256 Len=17 TSval=1047457359 TSecr=3171717068
1711549441.696070910   777 0.631432343    10.10.1.1 → 10.10.1.2    TCP 83 8081 → 40834 [PSH, ACK] Seq=1259 Ack=1276 Win=65152 Len=17 TSval=3171717070 TSecr=1047457359
1711549449.696070910   785 0.632643766    10.10.1.2 → 10.10.1.1    TCP 83 40834 → 8081 [PSH, ACK] Seq=1276 Ack=1276 Win=64256 Len=17 TSval=1047457360 TSecr=3171717070
1711549451.696070910   787 0.632774298    10.10.1.1 → 10.10.1.2    TCP 83 8081 → 40834 [PSH, ACK] Seq=1276 Ack=1293 Win=65152 Len=17 TSval=3171717071 TSecr=1047457360
1711549459.696070910   795 0.633988984    10.10.1.2 → 10.10.1.1    TCP 83 40834 → 8081 [PSH, ACK] Seq=1293 Ack=1293 Win=64256 Len=17 TSval=1047457361 TSecr=3171717071
1711549461.696070910   797 0.634109796    10.10.1.1 → 10.10.1.2    TCP 83 8081 → 40834 [PSH, ACK] Seq=1293 Ack=1310 Win=65152 Len=17 TSval=3171717072 TSecr=1047457361
1711549469.696070910   805 0.635320507    10.10.1.2 → 10.10.1.1    TCP 83 40834 → 8081 [PSH, ACK] Seq=1310 Ack=1310 Win=64256 Len=17 TSval=1047457363 TSecr=3171717072
1711549471.696070910   807 0.635434672    10.10.1.1 → 10.10.1.2    TCP 83 8081 → 40834 [PSH, ACK] Seq=1310 Ack=1327 Win=65152 Len=17 TSval=3171717074 TSecr=1047457363
1711549479.696070910   815 0.636646496    10.10.1.2 → 10.10.1.1    TCP 83 40834 → 8081 [PSH, ACK] Seq=1327 Ack=1327 Win=64256 Len=17 TSval=1047457364 TSecr=3171717074
1711549481.696070910   817 0.636772567    10.10.1.1 → 10.10.1.2    TCP 83 8081 → 40834 [PSH, ACK] Seq=1327 Ack=1344 Win=65152 Len=17 TSval=3171717075 TSecr=1047457364
1711549489.696070910   825 0.637988721    10.10.1.2 → 10.10.1.1    TCP 83 40834 → 8081 [PSH, ACK] Seq=1344 Ack=1344 Win=64256 Len=17 TSval=1047457365 TSecr=3171717075
1711549491.696070910   827 0.638110042    10.10.1.1 → 10.10.1.2    TCP 83 8081 → 40834 [PSH, ACK] Seq=1344 Ack=1361 Win=65152 Len=17 TSval=3171717076 TSecr=1047457365
1711549499.696070910   835 0.639322140    10.10.1.2 → 10.10.1.1    TCP 83 40834 → 8081 [PSH, ACK] Seq=1361 Ack=1361 Win=64256 Len=17 TSval=1047457367 TSecr=3171717076
1711549501.696070910   837 0.639433712    10.10.1.1 → 10.10.1.2    TCP 83 8081 → 40834 [PSH, ACK] Seq=1361 Ack=1378 Win=65152 Len=17 TSval=3171717078 TSecr=1047457367
1711549509.696070910   845 0.640646278    10.10.1.2 → 10.10.1.1    TCP 83 40834 → 8081 [PSH, ACK] Seq=1378 Ack=1378 Win=64256 Len=17 TSval=1047457368 TSecr=3171717078
1711549511.696070910   847 0.640767747    10.10.1.1 → 10.10.1.2    TCP 83 8081 → 40834 [PSH, ACK] Seq=1378 Ack=1395 Win=65152 Len=17 TSval=3171717079 TSecr=1047457368
1711549519.696070910   855 0.641981424    10.10.1.2 → 10.10.1.1    TCP 83 40834 → 8081 [PSH, ACK] Seq=1395 Ack=1395 Win=64256 Len=17 TSval=1047457369 TSecr=3171717079
1711549521.696070910   857 0.642102850    10.10.1.1 → 10.10.1.2    TCP 83 8081 → 40834 [PSH, ACK] Seq=1395 Ack=1412 Win=65152 Len=17 TSval=3171717080 TSecr=1047457369
1711549529.696070910   865 0.643313996    10.10.1.2 → 10.10.1.1    TCP 83 40834 → 8081 [PSH, ACK] Seq=1412 Ack=1412 Win=64256 Len=17 TSval=1047457371 TSecr=3171717080
1711549531.696070910   867 0.643435078    10.10.1.1 → 10.10.1.2    TCP 83 8081 → 40834 [PSH, ACK] Seq=1412 Ack=1429 Win=65152 Len=17 TSval=3171717082 TSecr=1047457371
1711549539.696070910   875 0.644646255    10.10.1.2 → 10.10.1.1    TCP 83 40834 → 8081 [PSH, ACK] Seq=1429 Ack=1429 Win=64256 Len=17 TSval=1047457372 TSecr=3171717082
1711549541.696070910   877 0.644766752    10.10.1.1 → 10.10.1.2    TCP 83 8081 → 40834 [PSH, ACK] Seq=1429 Ack=1446 Win=65152 Len=17 TSval=3171717083 TSecr=1047457372
1711549549.696070910   885 0.645981105    10.10.1.2 → 10.10.1.1    TCP 83 40834 → 8081 [PSH, ACK] Seq=1446 Ack=1446 Win=64256 Len=17 TSval=1047457373 TSecr=3171717083
1711549551.696070910   887 0.646101966    10.10.1.1 → 10.10.1.2    TCP 83 8081 → 40834 [PSH, ACK] Seq=1446 Ack=1463 Win=65152 Len=17 TSval=3171717084 TSecr=1047457373
1711549559.696070910   895 0.647313659    10.10.1.2 → 10.10.1.1    TCP 83 40834 → 8081 [PSH, ACK] Seq=1463 Ack=1463 Win=64256 Len=17 TSval=1047457375 TSecr=3171717084
1711549561.696070910   897 0.647432935    10.10.1.1 → 10.10.1.2    TCP 83 8081 → 40834 [PSH, ACK] Seq=1463 Ack=1480 Win=65152 Len=17 TSval=3171717086 TSecr=1047457375
1711549570.696070910   906 0.648645221    10.10.1.2 → 10.10.1.1    TCP 83 40834 → 8081 [PSH, ACK] Seq=1480 Ack=1480 Win=64256 Len=17 TSval=1047457376 TSecr=3171717086
1711549572.696070910   908 0.648765848    10.10.1.1 → 10.10.1.2    TCP 83 8081 → 40834 [PSH, ACK] Seq=1480 Ack=1497 Win=65152 Len=17 TSval=3171717087 TSecr=1047457376
1711549579.696070910   915 0.649980560    10.10.1.2 → 10.10.1.1    TCP 83 40834 → 8081 [PSH, ACK] Seq=1497 Ack=1497 Win=64256 Len=17 TSval=1047457377 TSecr=3171717087
1711549581.696070910   917 0.650101939    10.10.1.1 → 10.10.1.2    TCP 83 8081 → 40834 [PSH, ACK] Seq=1497 Ack=1514 Win=65152 Len=17 TSval=3171717088 TSecr=1047457377
1711549589.696070910   925 0.651313710    10.10.1.2 → 10.10.1.1    TCP 83 40834 → 8081 [PSH, ACK] Seq=1514 Ack=1514 Win=64256 Len=17 TSval=1047457379 TSecr=3171717088
1711549591.696070910   927 0.651433546    10.10.1.1 → 10.10.1.2    TCP 83 8081 → 40834 [PSH, ACK] Seq=1514 Ack=1531 Win=65152 Len=17 TSval=3171717090 TSecr=1047457379
1711549599.696070910   935 0.652646065    10.10.1.2 → 10.10.1.1    TCP 83 40834 → 8081 [PSH, ACK] Seq=1531 Ack=1531 Win=64256 Len=17 TSval=1047457380 TSecr=3171717090
1711549601.696070910   937 0.652767335    10.10.1.1 → 10.10.1.2    TCP 83 8081 → 40834 [PSH, ACK] Seq=1531 Ack=1548 Win=65152 Len=17 TSval=3171717091 TSecr=1047457380
1711549609.696070910   945 0.653981811    10.10.1.2 → 10.10.1.1    TCP 83 40834 → 8081 [PSH, ACK] Seq=1548 Ack=1548 Win=64256 Len=17 TSval=1047457381 TSecr=3171717091
1711549611.696070910   947 0.654103209    10.10.1.1 → 10.10.1.2    TCP 83 8081 → 40834 [PSH, ACK] Seq=1548 Ack=1565 Win=65152 Len=17 TSval=3171717092 TSecr=1047457381
1711549619.696070910   955 0.655313597    10.10.1.2 → 10.10.1.1    TCP 83 40834 → 8081 [PSH, ACK] Seq=1565 Ack=1565 Win=64256 Len=17 TSval=1047457383 TSecr=3171717092
1711549621.696070910   957 0.655434898    10.10.1.1 → 10.10.1.2    TCP 83 8081 → 40834 [PSH, ACK] Seq=1565 Ack=1582 Win=65152 Len=17 TSval=3171717094 TSecr=1047457383
1711549629.696070910   965 0.656656712    10.10.1.2 → 10.10.1.1    TCP 83 40834 → 8081 [PSH, ACK] Seq=1582 Ack=1582 Win=64256 Len=17 TSval=1047457384 TSecr=3171717094
1711549631.696070910   967 0.656777487    10.10.1.1 → 10.10.1.2    TCP 83 8081 → 40834 [PSH, ACK] Seq=1582 Ack=1599 Win=65152 Len=17 TSval=3171717095 TSecr=1047457384
1711549639.696070910   975 0.657991621    10.10.1.2 → 10.10.1.1    TCP 83 40834 → 8081 [PSH, ACK] Seq=1599 Ack=1599 Win=64256 Len=17 TSval=1047457385 TSecr=3171717095
1711549641.696070910   977 0.658112166    10.10.1.1 → 10.10.1.2    TCP 83 8081 → 40834 [PSH, ACK] Seq=1599 Ack=1616 Win=65152 Len=17 TSval=3171717096 TSecr=1047457385
1711549649.696070910   985 0.659324927    10.10.1.2 → 10.10.1.1    TCP 83 40834 → 8081 [PSH, ACK] Seq=1616 Ack=1616 Win=64256 Len=17 TSval=1047457387 TSecr=3171717096
1711549651.696070910   987 0.659386895    10.10.1.1 → 10.10.1.2    TCP 83 8081 → 40834 [PSH, ACK] Seq=1616 Ack=1633 Win=65152 Len=17 TSval=3171717098 TSecr=1047457387
1711549659.696070910   995 0.660595145    10.10.1.2 → 10.10.1.1    TCP 83 40834 → 8081 [PSH, ACK] Seq=1633 Ack=1633 Win=64256 Len=17 TSval=1047457388 TSecr=3171717098
1711549661.696070910   997 0.660715594    10.10.1.1 → 10.10.1.2    TCP 83 8081 → 40834 [PSH, ACK] Seq=1633 Ack=1650 Win=65152 Len=17 TSval=3171717099 TSecr=1047457388
1711549669.696070910  1005 0.661930804    10.10.1.2 → 10.10.1.1    TCP 83 40834 → 8081 [PSH, ACK] Seq=1650 Ack=1650 Win=64256 Len=17 TSval=1047457389 TSecr=3171717099
1711549671.696070910  1007 0.662051992    10.10.1.1 → 10.10.1.2    TCP 83 8081 → 40834 [PSH, ACK] Seq=1650 Ack=1667 Win=65152 Len=17 TSval=3171717100 TSecr=1047457389
1711549679.696070910  1015 0.663262743    10.10.1.2 → 10.10.1.1    TCP 83 40834 → 8081 [PSH, ACK] Seq=1667 Ack=1667 Win=64256 Len=17 TSval=1047457391 TSecr=3171717100
1711549681.696070910  1017 0.663402021    10.10.1.1 → 10.10.1.2    TCP 83 8081 → 40834 [PSH, ACK] Seq=1667 Ack=1684 Win=65152 Len=17 TSval=3171717102 TSecr=1047457391
1711549689.696070910  1025 0.664613326    10.10.1.2 → 10.10.1.1    TCP 83 40834 → 8081 [PSH, ACK] Seq=1684 Ack=1684 Win=64256 Len=17 TSval=1047457392 TSecr=3171717102
1711549691.696070910  1027 0.664740551    10.10.1.1 → 10.10.1.2    TCP 83 8081 → 40834 [PSH, ACK] Seq=1684 Ack=1701 Win=65152 Len=17 TSval=3171717103 TSecr=1047457392
1711549699.696070910  1035 0.665955106    10.10.1.2 → 10.10.1.1    TCP 83 40834 → 8081 [PSH, ACK] Seq=1701 Ack=1701 Win=64256 Len=17 TSval=1047457393 TSecr=3171717103
1711549701.696070910  1037 0.666075583    10.10.1.1 → 10.10.1.2    TCP 83 8081 → 40834 [PSH, ACK] Seq=1701 Ack=1718 Win=65152 Len=17 TSval=3171717104 TSecr=1047457393
1711549709.696070910  1045 0.667287447    10.10.1.2 → 10.10.1.1    TCP 83 40834 → 8081 [PSH, ACK] Seq=1718 Ack=1718 Win=64256 Len=17 TSval=1047457395 TSecr=3171717104
1711549711.696070910  1047 0.667427378    10.10.1.1 → 10.10.1.2    TCP 83 8081 → 40834 [PSH, ACK] Seq=1718 Ack=1735 Win=65152 Len=17 TSval=3171717106 TSecr=1047457395
1711549719.696070910  1055 0.668638899    10.10.1.2 → 10.10.1.1    TCP 83 40834 → 8081 [PSH, ACK] Seq=1735 Ack=1735 Win=64256 Len=17 TSval=1047457396 TSecr=3171717106
1711549721.696070910  1057 0.668765181    10.10.1.1 → 10.10.1.2    TCP 83 8081 → 40834 [PSH, ACK] Seq=1735 Ack=1752 Win=65152 Len=17 TSval=3171717107 TSecr=1047457396
1711549729.696070910  1065 0.669979871    10.10.1.2 → 10.10.1.1    TCP 83 40834 → 8081 [PSH, ACK] Seq=1752 Ack=1752 Win=64256 Len=17 TSval=1047457397 TSecr=3171717107
1711549731.696070910  1067 0.670100336    10.10.1.1 → 10.10.1.2    TCP 83 8081 → 40834 [PSH, ACK] Seq=1752 Ack=1769 Win=65152 Len=17 TSval=3171717108 TSecr=1047457397
1711549739.696070910  1075 0.671311457    10.10.1.2 → 10.10.1.1    TCP 83 40834 → 8081 [PSH, ACK] Seq=1769 Ack=1769 Win=64256 Len=17 TSval=1047457399 TSecr=3171717108
1711549741.696070910  1077 0.671434906    10.10.1.1 → 10.10.1.2    TCP 83 8081 → 40834 [PSH, ACK] Seq=1769 Ack=1786 Win=65152 Len=17 TSval=3171717110 TSecr=1047457399
1711549749.696070910  1085 0.672647483    10.10.1.2 → 10.10.1.1    TCP 83 40834 → 8081 [PSH, ACK] Seq=1786 Ack=1786 Win=64256 Len=17 TSval=1047457400 TSecr=3171717110
1711549751.696070910  1087 0.672768243    10.10.1.1 → 10.10.1.2    TCP 83 8081 → 40834 [PSH, ACK] Seq=1786 Ack=1803 Win=65152 Len=17 TSval=3171717111 TSecr=1047457400
1711549759.696070910  1095 0.673982495    10.10.1.2 → 10.10.1.1    TCP 83 40834 → 8081 [PSH, ACK] Seq=1803 Ack=1803 Win=64256 Len=17 TSval=1047457401 TSecr=3171717111
1711549761.696070910  1097 0.674104168    10.10.1.1 → 10.10.1.2    TCP 83 8081 → 40834 [PSH, ACK] Seq=1803 Ack=1820 Win=65152 Len=17 TSval=3171717112 TSecr=1047457401
1711549769.696070910  1105 0.675314781    10.10.1.2 → 10.10.1.1    TCP 83 40834 → 8081 [PSH, ACK] Seq=1820 Ack=1820 Win=64256 Len=17 TSval=1047457403 TSecr=3171717112
1711549771.696070910  1107 0.675435279    10.10.1.1 → 10.10.1.2    TCP 83 8081 → 40834 [PSH, ACK] Seq=1820 Ack=1837 Win=65152 Len=17 TSval=3171717114 TSecr=1047457403
1711549779.696070910  1115 0.676646153    10.10.1.2 → 10.10.1.1    TCP 83 40834 → 8081 [PSH, ACK] Seq=1837 Ack=1837 Win=64256 Len=17 TSval=1047457404 TSecr=3171717114
1711549781.696070910  1117 0.676767771    10.10.1.1 → 10.10.1.2    TCP 83 8081 → 40834 [PSH, ACK] Seq=1837 Ack=1854 Win=65152 Len=17 TSval=3171717115 TSecr=1047457404
1711549789.696070910  1125 0.677981779    10.10.1.2 → 10.10.1.1    TCP 83 40834 → 8081 [PSH, ACK] Seq=1854 Ack=1854 Win=64256 Len=17 TSval=1047457405 TSecr=3171717115
1711549791.696070910  1127 0.678102214    10.10.1.1 → 10.10.1.2    TCP 83 8081 → 40834 [PSH, ACK] Seq=1854 Ack=1871 Win=65152 Len=17 TSval=3171717116 TSecr=1047457405
1711549799.696070910  1135 0.679312317    10.10.1.2 → 10.10.1.1    TCP 83 40834 → 8081 [PSH, ACK] Seq=1871 Ack=1871 Win=64256 Len=17 TSval=1047457407 TSecr=3171717116
1711549801.696070910  1137 0.679366455    10.10.1.1 → 10.10.1.2    TCP 83 8081 → 40834 [PSH, ACK] Seq=1871 Ack=1888 Win=65152 Len=17 TSval=3171717118 TSecr=1047457407
1711549809.696070910  1145 0.680574645    10.10.1.2 → 10.10.1.1    TCP 83 40834 → 8081 [PSH, ACK] Seq=1888 Ack=1888 Win=64256 Len=17 TSval=1047457408 TSecr=3171717118
1711549811.696070910  1147 0.680700115    10.10.1.1 → 10.10.1.2    TCP 83 8081 → 40834 [PSH, ACK] Seq=1888 Ack=1905 Win=65152 Len=17 TSval=3171717119 TSecr=1047457408
1711549819.696070910  1155 0.681914344    10.10.1.2 → 10.10.1.1    TCP 83 40834 → 8081 [PSH, ACK] Seq=1905 Ack=1905 Win=64256 Len=17 TSval=1047457409 TSecr=3171717119
1711549821.696070910  1157 0.682041216    10.10.1.1 → 10.10.1.2    TCP 83 8081 → 40834 [PSH, ACK] Seq=1905 Ack=1922 Win=65152 Len=17 TSval=3171717120 TSecr=1047457409
1711549829.696070910  1165 0.683253112    10.10.1.2 → 10.10.1.1    TCP 83 40834 → 8081 [PSH, ACK] Seq=1922 Ack=1922 Win=64256 Len=17 TSval=1047457411 TSecr=3171717120
1711549832.696070910  1168 0.683444176    10.10.1.1 → 10.10.1.2    TCP 83 8081 → 40834 [PSH, ACK] Seq=1922 Ack=1939 Win=65152 Len=17 TSval=3171717122 TSecr=1047457411
1711549839.696070910  1175 0.684655183    10.10.1.2 → 10.10.1.1    TCP 83 40834 → 8081 [PSH, ACK] Seq=1939 Ack=1939 Win=64256 Len=17 TSval=1047457412 TSecr=3171717122
1711549841.696070910  1177 0.684785309    10.10.1.1 → 10.10.1.2    TCP 83 8081 → 40834 [PSH, ACK] Seq=1939 Ack=1956 Win=65152 Len=17 TSval=3171717123 TSecr=1047457412
1711549849.696070910  1185 0.685998972    10.10.1.2 → 10.10.1.1    TCP 83 40834 → 8081 [PSH, ACK] Seq=1956 Ack=1956 Win=64256 Len=17 TSval=1047457413 TSecr=3171717123
1711549851.696070910  1187 0.686125187    10.10.1.1 → 10.10.1.2    TCP 83 8081 → 40834 [PSH, ACK] Seq=1956 Ack=1973 Win=65152 Len=17 TSval=3171717124 TSecr=1047457413
1711549859.696070910  1195 0.687339147    10.10.1.2 → 10.10.1.1    TCP 83 40834 → 8081 [PSH, ACK] Seq=1973 Ack=1973 Win=64256 Len=17 TSval=1047457415 TSecr=3171717124
1711549861.696070910  1197 0.687471102    10.10.1.1 → 10.10.1.2    TCP 83 8081 → 40834 [PSH, ACK] Seq=1973 Ack=1990 Win=65152 Len=17 TSval=3171717126 TSecr=1047457415
1711549869.696070910  1205 0.688682743    10.10.1.2 → 10.10.1.1    TCP 83 40834 → 8081 [PSH, ACK] Seq=1990 Ack=1990 Win=64256 Len=17 TSval=1047457416 TSecr=3171717126
1711549871.696070910  1207 0.688804376    10.10.1.1 → 10.10.1.2    TCP 83 8081 → 40834 [PSH, ACK] Seq=1990 Ack=2007 Win=65152 Len=17 TSval=3171717127 TSecr=1047457416
