1711548302.980133057    40 0.521506042    10.10.1.2 → 10.10.1.1    TCP 83 50338 → 8081 [PSH, ACK] Seq=1 Ack=1 Win=64256 Len=17 TSval=1047055546 TSecr=3171315006
1711548306.980133057    44 0.521716058    10.10.1.1 → 10.10.1.2    TCP 83 8081 → 50338 [PSH, ACK] Seq=1 Ack=18 Win=65152 Len=17 TSval=3171315256 TSecr=1047055546
1711548312.980133057    50 0.522872425    10.10.1.2 → 10.10.1.1    TCP 83 50338 → 8081 [PSH, ACK] Seq=18 Ack=18 Win=64256 Len=17 TSval=1047055547 TSecr=3171315256
1711548315.980133057    53 0.522907356    10.10.1.1 → 10.10.1.2    TCP 83 8081 → 50338 [PSH, ACK] Seq=18 Ack=35 Win=65152 Len=17 TSval=3171315257 TSecr=1047055547
1711548320.980133057    58 0.524062473    10.10.1.2 → 10.10.1.1    TCP 83 50338 → 8081 [PSH, ACK] Seq=35 Ack=35 Win=64256 Len=17 TSval=1047055548 TSecr=3171315257
1711548322.980133057    60 0.524099148    10.10.1.1 → 10.10.1.2    TCP 83 8081 → 50338 [PSH, ACK] Seq=35 Ack=52 Win=65152 Len=17 TSval=3171315259 TSecr=1047055548
1711548328.980133057    66 0.525253737    10.10.1.2 → 10.10.1.1    TCP 83 50338 → 8081 [PSH, ACK] Seq=52 Ack=52 Win=64256 Len=17 TSval=1047055549 TSecr=3171315259
1711548330.980133057    68 0.525283647    10.10.1.1 → 10.10.1.2    TCP 83 8081 → 50338 [PSH, ACK] Seq=52 Ack=69 Win=65152 Len=17 TSval=3171315260 TSecr=1047055549
1711548336.980133057    74 0.526434771    10.10.1.2 → 10.10.1.1    TCP 83 50338 → 8081 [PSH, ACK] Seq=69 Ack=69 Win=64256 Len=17 TSval=1047055550 TSecr=3171315260
1711548339.980133057    77 0.526464754    10.10.1.1 → 10.10.1.2    TCP 83 8081 → 50338 [PSH, ACK] Seq=69 Ack=86 Win=65152 Len=17 TSval=3171315261 TSecr=1047055550
1711548344.980133057    82 0.527616811    10.10.1.2 → 10.10.1.1    TCP 83 50338 → 8081 [PSH, ACK] Seq=86 Ack=86 Win=64256 Len=17 TSval=1047055552 TSecr=3171315261
1711548346.980133057    84 0.527648606    10.10.1.1 → 10.10.1.2    TCP 83 8081 → 50338 [PSH, ACK] Seq=86 Ack=103 Win=65152 Len=17 TSval=3171315262 TSecr=1047055552
1711548352.980133057    90 0.528802542    10.10.1.2 → 10.10.1.1    TCP 83 50338 → 8081 [PSH, ACK] Seq=103 Ack=103 Win=64256 Len=17 TSval=1047055553 TSecr=3171315262
1711548354.980133057    92 0.528833479    10.10.1.1 → 10.10.1.2    TCP 83 8081 → 50338 [PSH, ACK] Seq=103 Ack=120 Win=65152 Len=17 TSval=3171315263 TSecr=1047055553
1711548360.980133057    98 0.529983867    10.10.1.2 → 10.10.1.1    TCP 83 50338 → 8081 [PSH, ACK] Seq=120 Ack=120 Win=64256 Len=17 TSval=1047055554 TSecr=3171315263
1711548362.980133057   100 0.530014166    10.10.1.1 → 10.10.1.2    TCP 83 8081 → 50338 [PSH, ACK] Seq=120 Ack=137 Win=65152 Len=17 TSval=3171315264 TSecr=1047055554
1711548368.980133057   106 0.531165337    10.10.1.2 → 10.10.1.1    TCP 83 50338 → 8081 [PSH, ACK] Seq=137 Ack=137 Win=64256 Len=17 TSval=1047055555 TSecr=3171315264
1711548370.980133057   108 0.531200041    10.10.1.1 → 10.10.1.2    TCP 83 8081 → 50338 [PSH, ACK] Seq=137 Ack=154 Win=65152 Len=17 TSval=3171315266 TSecr=1047055555
1711548376.980133057   114 0.532350401    10.10.1.2 → 10.10.1.1    TCP 83 50338 → 8081 [PSH, ACK] Seq=154 Ack=154 Win=64256 Len=17 TSval=1047055556 TSecr=3171315266
1711548378.980133057   116 0.532381131    10.10.1.1 → 10.10.1.2    TCP 83 8081 → 50338 [PSH, ACK] Seq=154 Ack=171 Win=65152 Len=17 TSval=3171315267 TSecr=1047055556
1711548384.980133057   122 0.533535408    10.10.1.2 → 10.10.1.1    TCP 83 50338 → 8081 [PSH, ACK] Seq=171 Ack=171 Win=64256 Len=17 TSval=1047055558 TSecr=3171315267
1711548386.980133057   124 0.533565572    10.10.1.1 → 10.10.1.2    TCP 83 8081 → 50338 [PSH, ACK] Seq=171 Ack=188 Win=65152 Len=17 TSval=3171315268 TSecr=1047055558
1711548392.980133057   130 0.534716519    10.10.1.2 → 10.10.1.1    TCP 83 50338 → 8081 [PSH, ACK] Seq=188 Ack=188 Win=64256 Len=17 TSval=1047055559 TSecr=3171315268
1711548394.980133057   132 0.534746689    10.10.1.1 → 10.10.1.2    TCP 83 8081 → 50338 [PSH, ACK] Seq=188 Ack=205 Win=65152 Len=17 TSval=3171315269 TSecr=1047055559
1711548400.980133057   138 0.535898011    10.10.1.2 → 10.10.1.1    TCP 83 50338 → 8081 [PSH, ACK] Seq=205 Ack=205 Win=64256 Len=17 TSval=1047055560 TSecr=3171315269
1711548401.980133057   139 0.535933874    10.10.1.1 → 10.10.1.2    TCP 83 8081 → 50338 [PSH, ACK] Seq=205 Ack=222 Win=65152 Len=17 TSval=3171315270 TSecr=1047055560
1711548408.980133057   146 0.537089695    10.10.1.2 → 10.10.1.1    TCP 83 50338 → 8081 [PSH, ACK] Seq=222 Ack=222 Win=64256 Len=17 TSval=1047055561 TSecr=3171315270
1711548410.980133057   148 0.537120465    10.10.1.1 → 10.10.1.2    TCP 83 8081 → 50338 [PSH, ACK] Seq=222 Ack=239 Win=65152 Len=17 TSval=3171315272 TSecr=1047055561
1711548416.980133057   154 0.538271496    10.10.1.2 → 10.10.1.1    TCP 83 50338 → 8081 [PSH, ACK] Seq=239 Ack=239 Win=64256 Len=17 TSval=1047055562 TSecr=3171315272
1711548418.980133057   156 0.538300392    10.10.1.1 → 10.10.1.2    TCP 83 8081 → 50338 [PSH, ACK] Seq=239 Ack=256 Win=65152 Len=17 TSval=3171315273 TSecr=1047055562
1711548424.980133057   162 0.539451962    10.10.1.2 → 10.10.1.1    TCP 83 50338 → 8081 [PSH, ACK] Seq=256 Ack=256 Win=64256 Len=17 TSval=1047055563 TSecr=3171315273
1711548426.980133057   164 0.539484195    10.10.1.1 → 10.10.1.2    TCP 83 8081 → 50338 [PSH, ACK] Seq=256 Ack=273 Win=65152 Len=17 TSval=3171315274 TSecr=1047055563
1711548432.980133057   170 0.540640185    10.10.1.2 → 10.10.1.1    TCP 83 50338 → 8081 [PSH, ACK] Seq=273 Ack=273 Win=64256 Len=17 TSval=1047055565 TSecr=3171315274
1711548434.980133057   172 0.540670827    10.10.1.1 → 10.10.1.2    TCP 83 8081 → 50338 [PSH, ACK] Seq=273 Ack=290 Win=65152 Len=17 TSval=3171315275 TSecr=1047055565
1711548440.980133057   178 0.541824019    10.10.1.2 → 10.10.1.1    TCP 83 50338 → 8081 [PSH, ACK] Seq=290 Ack=290 Win=64256 Len=17 TSval=1047055566 TSecr=3171315275
1711548442.980133057   180 0.541853944    10.10.1.1 → 10.10.1.2    TCP 83 8081 → 50338 [PSH, ACK] Seq=290 Ack=307 Win=65152 Len=17 TSval=3171315276 TSecr=1047055566
1711548448.980133057   186 0.543007070    10.10.1.2 → 10.10.1.1    TCP 83 50338 → 8081 [PSH, ACK] Seq=307 Ack=307 Win=64256 Len=17 TSval=1047055567 TSecr=3171315276
1711548450.980133057   188 0.543060758    10.10.1.1 → 10.10.1.2    TCP 83 8081 → 50338 [PSH, ACK] Seq=307 Ack=324 Win=65152 Len=17 TSval=3171315278 TSecr=1047055567
1711548456.980133057   194 0.544212859    10.10.1.2 → 10.10.1.1    TCP 83 50338 → 8081 [PSH, ACK] Seq=324 Ack=324 Win=64256 Len=17 TSval=1047055568 TSecr=3171315278
1711548458.980133057   196 0.544248349    10.10.1.1 → 10.10.1.2    TCP 83 8081 → 50338 [PSH, ACK] Seq=324 Ack=341 Win=65152 Len=17 TSval=3171315279 TSecr=1047055568
1711548464.980133057   202 0.545402236    10.10.1.2 → 10.10.1.1    TCP 83 50338 → 8081 [PSH, ACK] Seq=341 Ack=341 Win=64256 Len=17 TSval=1047055569 TSecr=3171315279
1711548466.980133057   204 0.545432582    10.10.1.1 → 10.10.1.2    TCP 83 8081 → 50338 [PSH, ACK] Seq=341 Ack=358 Win=65152 Len=17 TSval=3171315280 TSecr=1047055569
1711548472.980133057   210 0.546583070    10.10.1.2 → 10.10.1.1    TCP 83 50338 → 8081 [PSH, ACK] Seq=358 Ack=358 Win=64256 Len=17 TSval=1047055571 TSecr=3171315280
1711548474.980133057   212 0.546613288    10.10.1.1 → 10.10.1.2    TCP 83 8081 → 50338 [PSH, ACK] Seq=358 Ack=375 Win=65152 Len=17 TSval=3171315281 TSecr=1047055571
1711548480.980133057   218 0.547766691    10.10.1.2 → 10.10.1.1    TCP 83 50338 → 8081 [PSH, ACK] Seq=375 Ack=375 Win=64256 Len=17 TSval=1047055572 TSecr=3171315281
1711548482.980133057   220 0.547801117    10.10.1.1 → 10.10.1.2    TCP 83 8081 → 50338 [PSH, ACK] Seq=375 Ack=392 Win=65152 Len=17 TSval=3171315282 TSecr=1047055572
1711548488.980133057   226 0.548954267    10.10.1.2 → 10.10.1.1    TCP 83 50338 → 8081 [PSH, ACK] Seq=392 Ack=392 Win=64256 Len=17 TSval=1047055573 TSecr=3171315282
1711548490.980133057   228 0.548984518    10.10.1.1 → 10.10.1.2    TCP 83 8081 → 50338 [PSH, ACK] Seq=392 Ack=409 Win=65152 Len=17 TSval=3171315283 TSecr=1047055573
1711548496.980133057   234 0.550135496    10.10.1.2 → 10.10.1.1    TCP 83 50338 → 8081 [PSH, ACK] Seq=409 Ack=409 Win=64256 Len=17 TSval=1047055574 TSecr=3171315283
1711548498.980133057   236 0.550163212    10.10.1.1 → 10.10.1.2    TCP 83 8081 → 50338 [PSH, ACK] Seq=409 Ack=426 Win=65152 Len=17 TSval=3171315285 TSecr=1047055574
1711548504.980133057   242 0.551314127    10.10.1.2 → 10.10.1.1    TCP 83 50338 → 8081 [PSH, ACK] Seq=426 Ack=426 Win=64256 Len=17 TSval=1047055575 TSecr=3171315285
1711548506.980133057   244 0.551346287    10.10.1.1 → 10.10.1.2    TCP 83 8081 → 50338 [PSH, ACK] Seq=426 Ack=443 Win=65152 Len=17 TSval=3171315286 TSecr=1047055575
1711548512.980133057   250 0.552499020    10.10.1.2 → 10.10.1.1    TCP 83 50338 → 8081 [PSH, ACK] Seq=443 Ack=443 Win=64256 Len=17 TSval=1047055577 TSecr=3171315286
1711548514.980133057   252 0.552529890    10.10.1.1 → 10.10.1.2    TCP 83 8081 → 50338 [PSH, ACK] Seq=443 Ack=460 Win=65152 Len=17 TSval=3171315287 TSecr=1047055577
1711548520.980133057   258 0.553683161    10.10.1.2 → 10.10.1.1    TCP 83 50338 → 8081 [PSH, ACK] Seq=460 Ack=460 Win=64256 Len=17 TSval=1047055578 TSecr=3171315287
1711548522.980133057   260 0.553713592    10.10.1.1 → 10.10.1.2    TCP 83 8081 → 50338 [PSH, ACK] Seq=460 Ack=477 Win=65152 Len=17 TSval=3171315288 TSecr=1047055578
1711548528.980133057   266 0.554864534    10.10.1.2 → 10.10.1.1    TCP 83 50338 → 8081 [PSH, ACK] Seq=477 Ack=477 Win=64256 Len=17 TSval=1047055579 TSecr=3171315288
1711548530.980133057   268 0.554894409    10.10.1.1 → 10.10.1.2    TCP 83 8081 → 50338 [PSH, ACK] Seq=477 Ack=494 Win=65152 Len=17 TSval=3171315289 TSecr=1047055579
1711548536.980133057   274 0.556046172    10.10.1.2 → 10.10.1.1    TCP 83 50338 → 8081 [PSH, ACK] Seq=494 Ack=494 Win=64256 Len=17 TSval=1047055580 TSecr=3171315289
1711548538.980133057   276 0.556080817    10.10.1.1 → 10.10.1.2    TCP 83 8081 → 50338 [PSH, ACK] Seq=494 Ack=511 Win=65152 Len=17 TSval=3171315291 TSecr=1047055580
1711548544.980133057   282 0.557233775    10.10.1.2 → 10.10.1.1    TCP 83 50338 → 8081 [PSH, ACK] Seq=511 Ack=511 Win=64256 Len=17 TSval=1047055581 TSecr=3171315291
1711548546.980133057   284 0.557263970    10.10.1.1 → 10.10.1.2    TCP 83 8081 → 50338 [PSH, ACK] Seq=511 Ack=528 Win=65152 Len=17 TSval=3171315292 TSecr=1047055581
1711548552.980133057   290 0.558414447    10.10.1.2 → 10.10.1.1    TCP 83 50338 → 8081 [PSH, ACK] Seq=528 Ack=528 Win=64256 Len=17 TSval=1047055582 TSecr=3171315292
1711548554.980133057   292 0.558444597    10.10.1.1 → 10.10.1.2    TCP 83 8081 → 50338 [PSH, ACK] Seq=528 Ack=545 Win=65152 Len=17 TSval=3171315293 TSecr=1047055582
1711548560.980133057   298 0.559596398    10.10.1.2 → 10.10.1.1    TCP 83 50338 → 8081 [PSH, ACK] Seq=545 Ack=545 Win=64256 Len=17 TSval=1047055584 TSecr=3171315293
1711548562.980133057   300 0.559630189    10.10.1.1 → 10.10.1.2    TCP 83 8081 → 50338 [PSH, ACK] Seq=545 Ack=562 Win=65152 Len=17 TSval=3171315294 TSecr=1047055584
1711548568.980133057   306 0.560783962    10.10.1.2 → 10.10.1.1    TCP 83 50338 → 8081 [PSH, ACK] Seq=562 Ack=562 Win=64256 Len=17 TSval=1047055585 TSecr=3171315294
1711548570.980133057   308 0.560814011    10.10.1.1 → 10.10.1.2    TCP 83 8081 → 50338 [PSH, ACK] Seq=562 Ack=579 Win=65152 Len=17 TSval=3171315295 TSecr=1047055585
1711548576.980133057   314 0.561964772    10.10.1.2 → 10.10.1.1    TCP 83 50338 → 8081 [PSH, ACK] Seq=579 Ack=579 Win=64256 Len=17 TSval=1047055586 TSecr=3171315295
1711548578.980133057   316 0.561992089    10.10.1.1 → 10.10.1.2    TCP 83 8081 → 50338 [PSH, ACK] Seq=579 Ack=596 Win=65152 Len=17 TSval=3171315296 TSecr=1047055586
1711548584.980133057   322 0.563142540    10.10.1.2 → 10.10.1.1    TCP 83 50338 → 8081 [PSH, ACK] Seq=596 Ack=596 Win=64256 Len=17 TSval=1047055587 TSecr=3171315296
1711548586.980133057   324 0.563174006    10.10.1.1 → 10.10.1.2    TCP 83 8081 → 50338 [PSH, ACK] Seq=596 Ack=613 Win=65152 Len=17 TSval=3171315298 TSecr=1047055587
1711548592.980133057   330 0.564325730    10.10.1.2 → 10.10.1.1    TCP 83 50338 → 8081 [PSH, ACK] Seq=613 Ack=613 Win=64256 Len=17 TSval=1047055588 TSecr=3171315298
1711548594.980133057   332 0.564355233    10.10.1.1 → 10.10.1.2    TCP 83 8081 → 50338 [PSH, ACK] Seq=613 Ack=630 Win=65152 Len=17 TSval=3171315299 TSecr=1047055588
1711548600.980133057   338 0.565509520    10.10.1.2 → 10.10.1.1    TCP 83 50338 → 8081 [PSH, ACK] Seq=630 Ack=630 Win=64256 Len=17 TSval=1047055590 TSecr=3171315299
1711548602.980133057   340 0.565539417    10.10.1.1 → 10.10.1.2    TCP 83 8081 → 50338 [PSH, ACK] Seq=630 Ack=647 Win=65152 Len=17 TSval=3171315300 TSecr=1047055590
1711548608.980133057   346 0.566689177    10.10.1.2 → 10.10.1.1    TCP 83 50338 → 8081 [PSH, ACK] Seq=647 Ack=647 Win=64256 Len=17 TSval=1047055591 TSecr=3171315300
1711548610.980133057   348 0.566719162    10.10.1.1 → 10.10.1.2    TCP 83 8081 → 50338 [PSH, ACK] Seq=647 Ack=664 Win=65152 Len=17 TSval=3171315301 TSecr=1047055591
1711548616.980133057   354 0.567870369    10.10.1.2 → 10.10.1.1    TCP 83 50338 → 8081 [PSH, ACK] Seq=664 Ack=664 Win=64256 Len=17 TSval=1047055592 TSecr=3171315301
1711548618.980133057   356 0.567903840    10.10.1.1 → 10.10.1.2    TCP 83 8081 → 50338 [PSH, ACK] Seq=664 Ack=681 Win=65152 Len=17 TSval=3171315302 TSecr=1047055592
1711548624.980133057   362 0.569056853    10.10.1.2 → 10.10.1.1    TCP 83 50338 → 8081 [PSH, ACK] Seq=681 Ack=681 Win=64256 Len=17 TSval=1047055593 TSecr=3171315302
1711548626.980133057   364 0.569086603    10.10.1.1 → 10.10.1.2    TCP 83 8081 → 50338 [PSH, ACK] Seq=681 Ack=698 Win=65152 Len=17 TSval=3171315304 TSecr=1047055593
1711548632.980133057   370 0.570236469    10.10.1.2 → 10.10.1.1    TCP 83 50338 → 8081 [PSH, ACK] Seq=698 Ack=698 Win=64256 Len=17 TSval=1047055594 TSecr=3171315304
1711548634.980133057   372 0.570265874    10.10.1.1 → 10.10.1.2    TCP 83 8081 → 50338 [PSH, ACK] Seq=698 Ack=715 Win=65152 Len=17 TSval=3171315305 TSecr=1047055594
1711548640.980133057   378 0.571418101    10.10.1.2 → 10.10.1.1    TCP 83 50338 → 8081 [PSH, ACK] Seq=715 Ack=715 Win=64256 Len=17 TSval=1047055595 TSecr=3171315305
1711548642.980133057   380 0.571451351    10.10.1.1 → 10.10.1.2    TCP 83 8081 → 50338 [PSH, ACK] Seq=715 Ack=732 Win=65152 Len=17 TSval=3171315306 TSecr=1047055595
1711548648.980133057   386 0.572607939    10.10.1.2 → 10.10.1.1    TCP 83 50338 → 8081 [PSH, ACK] Seq=732 Ack=732 Win=64256 Len=17 TSval=1047055597 TSecr=3171315306
1711548650.980133057   388 0.572635772    10.10.1.1 → 10.10.1.2    TCP 83 8081 → 50338 [PSH, ACK] Seq=732 Ack=749 Win=65152 Len=17 TSval=3171315307 TSecr=1047055597
1711548656.980133057   394 0.573793498    10.10.1.2 → 10.10.1.1    TCP 83 50338 → 8081 [PSH, ACK] Seq=749 Ack=749 Win=64256 Len=17 TSval=1047055598 TSecr=3171315307
1711548658.980133057   396 0.573820862    10.10.1.1 → 10.10.1.2    TCP 83 8081 → 50338 [PSH, ACK] Seq=749 Ack=766 Win=65152 Len=17 TSval=3171315308 TSecr=1047055598
1711548664.980133057   402 0.574971333    10.10.1.2 → 10.10.1.1    TCP 83 50338 → 8081 [PSH, ACK] Seq=766 Ack=766 Win=64256 Len=17 TSval=1047055599 TSecr=3171315308
1711548666.980133057   404 0.574998750    10.10.1.1 → 10.10.1.2    TCP 83 8081 → 50338 [PSH, ACK] Seq=766 Ack=783 Win=65152 Len=17 TSval=3171315309 TSecr=1047055599
1711548672.980133057   410 0.576157571    10.10.1.2 → 10.10.1.1    TCP 83 50338 → 8081 [PSH, ACK] Seq=783 Ack=783 Win=64256 Len=17 TSval=1047055600 TSecr=3171315309
1711548674.980133057   412 0.576189401    10.10.1.1 → 10.10.1.2    TCP 83 8081 → 50338 [PSH, ACK] Seq=783 Ack=800 Win=65152 Len=17 TSval=3171315311 TSecr=1047055600
1711548680.980133057   418 0.577341424    10.10.1.2 → 10.10.1.1    TCP 83 50338 → 8081 [PSH, ACK] Seq=800 Ack=800 Win=64256 Len=17 TSval=1047055601 TSecr=3171315311
1711548682.980133057   420 0.577370210    10.10.1.1 → 10.10.1.2    TCP 83 8081 → 50338 [PSH, ACK] Seq=800 Ack=817 Win=65152 Len=17 TSval=3171315312 TSecr=1047055601
1711548688.980133057   426 0.578529687    10.10.1.2 → 10.10.1.1    TCP 83 50338 → 8081 [PSH, ACK] Seq=817 Ack=817 Win=64256 Len=17 TSval=1047055603 TSecr=3171315312
1711548690.980133057   428 0.578557402    10.10.1.1 → 10.10.1.2    TCP 83 8081 → 50338 [PSH, ACK] Seq=817 Ack=834 Win=65152 Len=17 TSval=3171315313 TSecr=1047055603
1711548696.980133057   434 0.579709099    10.10.1.2 → 10.10.1.1    TCP 83 50338 → 8081 [PSH, ACK] Seq=834 Ack=834 Win=64256 Len=17 TSval=1047055604 TSecr=3171315313
1711548698.980133057   436 0.579741609    10.10.1.1 → 10.10.1.2    TCP 83 8081 → 50338 [PSH, ACK] Seq=834 Ack=851 Win=65152 Len=17 TSval=3171315314 TSecr=1047055604
1711548704.980133057   442 0.580900646    10.10.1.2 → 10.10.1.1    TCP 83 50338 → 8081 [PSH, ACK] Seq=851 Ack=851 Win=64256 Len=17 TSval=1047055605 TSecr=3171315314
1711548706.980133057   444 0.580928797    10.10.1.1 → 10.10.1.2    TCP 83 8081 → 50338 [PSH, ACK] Seq=851 Ack=868 Win=65152 Len=17 TSval=3171315315 TSecr=1047055605
1711548712.980133057   450 0.582078970    10.10.1.2 → 10.10.1.1    TCP 83 50338 → 8081 [PSH, ACK] Seq=868 Ack=868 Win=64256 Len=17 TSval=1047055606 TSecr=3171315315
1711548714.980133057   452 0.582106135    10.10.1.1 → 10.10.1.2    TCP 83 8081 → 50338 [PSH, ACK] Seq=868 Ack=885 Win=65152 Len=17 TSval=3171315317 TSecr=1047055606
1711548720.980133057   458 0.583270445    10.10.1.2 → 10.10.1.1    TCP 83 50338 → 8081 [PSH, ACK] Seq=885 Ack=885 Win=64256 Len=17 TSval=1047055607 TSecr=3171315317
1711548722.980133057   460 0.583302441    10.10.1.1 → 10.10.1.2    TCP 83 8081 → 50338 [PSH, ACK] Seq=885 Ack=902 Win=65152 Len=17 TSval=3171315318 TSecr=1047055607
1711548728.980133057   466 0.584453443    10.10.1.2 → 10.10.1.1    TCP 83 50338 → 8081 [PSH, ACK] Seq=902 Ack=902 Win=64256 Len=17 TSval=1047055608 TSecr=3171315318
1711548730.980133057   468 0.584483853    10.10.1.1 → 10.10.1.2    TCP 83 8081 → 50338 [PSH, ACK] Seq=902 Ack=919 Win=65152 Len=17 TSval=3171315319 TSecr=1047055608
1711548736.980133057   474 0.585648932    10.10.1.2 → 10.10.1.1    TCP 83 50338 → 8081 [PSH, ACK] Seq=919 Ack=919 Win=64256 Len=17 TSval=1047055610 TSecr=3171315319
1711548738.980133057   476 0.585678351    10.10.1.1 → 10.10.1.2    TCP 83 8081 → 50338 [PSH, ACK] Seq=919 Ack=936 Win=65152 Len=17 TSval=3171315320 TSecr=1047055610
1711548744.980133057   482 0.586828860    10.10.1.2 → 10.10.1.1    TCP 83 50338 → 8081 [PSH, ACK] Seq=936 Ack=936 Win=64256 Len=17 TSval=1047055611 TSecr=3171315320
1711548746.980133057   484 0.586858423    10.10.1.1 → 10.10.1.2    TCP 83 8081 → 50338 [PSH, ACK] Seq=936 Ack=953 Win=65152 Len=17 TSval=3171315321 TSecr=1047055611
1711548752.980133057   490 0.588027634    10.10.1.2 → 10.10.1.1    TCP 83 50338 → 8081 [PSH, ACK] Seq=953 Ack=953 Win=64256 Len=17 TSval=1047055612 TSecr=3171315321
1711548755.980133057   493 0.588128887    10.10.1.1 → 10.10.1.2    TCP 83 8081 → 50338 [PSH, ACK] Seq=953 Ack=970 Win=65152 Len=17 TSval=3171315323 TSecr=1047055612
1711548760.980133057   498 0.589282789    10.10.1.2 → 10.10.1.1    TCP 83 50338 → 8081 [PSH, ACK] Seq=970 Ack=970 Win=64256 Len=17 TSval=1047055613 TSecr=3171315323
1711548762.980133057   500 0.589314064    10.10.1.1 → 10.10.1.2    TCP 83 8081 → 50338 [PSH, ACK] Seq=970 Ack=987 Win=65152 Len=17 TSval=3171315324 TSecr=1047055613
1711548768.980133057   506 0.590478937    10.10.1.2 → 10.10.1.1    TCP 83 50338 → 8081 [PSH, ACK] Seq=987 Ack=987 Win=64256 Len=17 TSval=1047055615 TSecr=3171315324
1711548770.980133057   508 0.590508538    10.10.1.1 → 10.10.1.2    TCP 83 8081 → 50338 [PSH, ACK] Seq=987 Ack=1004 Win=65152 Len=17 TSval=3171315325 TSecr=1047055615
1711548776.980133057   514 0.591660634    10.10.1.2 → 10.10.1.1    TCP 83 50338 → 8081 [PSH, ACK] Seq=1004 Ack=1004 Win=64256 Len=17 TSval=1047055616 TSecr=3171315325
1711548778.980133057   516 0.591695052    10.10.1.1 → 10.10.1.2    TCP 83 8081 → 50338 [PSH, ACK] Seq=1004 Ack=1021 Win=65152 Len=17 TSval=3171315326 TSecr=1047055616
1711548784.980133057   522 0.592864331    10.10.1.2 → 10.10.1.1    TCP 83 50338 → 8081 [PSH, ACK] Seq=1021 Ack=1021 Win=64256 Len=17 TSval=1047055617 TSecr=3171315326
1711548786.980133057   524 0.592894469    10.10.1.1 → 10.10.1.2    TCP 83 8081 → 50338 [PSH, ACK] Seq=1021 Ack=1038 Win=65152 Len=17 TSval=3171315327 TSecr=1047055617
1711548792.980133057   530 0.594045442    10.10.1.2 → 10.10.1.1    TCP 83 50338 → 8081 [PSH, ACK] Seq=1038 Ack=1038 Win=64256 Len=17 TSval=1047055618 TSecr=3171315327
1711548794.980133057   532 0.594073389    10.10.1.1 → 10.10.1.2    TCP 83 8081 → 50338 [PSH, ACK] Seq=1038 Ack=1055 Win=65152 Len=17 TSval=3171315329 TSecr=1047055618
1711548800.980133057   538 0.595246867    10.10.1.2 → 10.10.1.1    TCP 83 50338 → 8081 [PSH, ACK] Seq=1055 Ack=1055 Win=64256 Len=17 TSval=1047055619 TSecr=3171315329
1711548802.980133057   540 0.595278546    10.10.1.1 → 10.10.1.2    TCP 83 8081 → 50338 [PSH, ACK] Seq=1055 Ack=1072 Win=65152 Len=17 TSval=3171315330 TSecr=1047055619
1711548808.980133057   546 0.596429175    10.10.1.2 → 10.10.1.1    TCP 83 50338 → 8081 [PSH, ACK] Seq=1072 Ack=1072 Win=64256 Len=17 TSval=1047055620 TSecr=3171315330
1711548810.980133057   548 0.596459005    10.10.1.1 → 10.10.1.2    TCP 83 8081 → 50338 [PSH, ACK] Seq=1072 Ack=1089 Win=65152 Len=17 TSval=3171315331 TSecr=1047055620
1711548816.980133057   554 0.597634382    10.10.1.2 → 10.10.1.1    TCP 83 50338 → 8081 [PSH, ACK] Seq=1089 Ack=1089 Win=64256 Len=17 TSval=1047055622 TSecr=3171315331
1711548818.980133057   556 0.597663598    10.10.1.1 → 10.10.1.2    TCP 83 8081 → 50338 [PSH, ACK] Seq=1089 Ack=1106 Win=65152 Len=17 TSval=3171315332 TSecr=1047055622
1711548824.980133057   562 0.598813219    10.10.1.2 → 10.10.1.1    TCP 83 50338 → 8081 [PSH, ACK] Seq=1106 Ack=1106 Win=64256 Len=17 TSval=1047055623 TSecr=3171315332
1711548826.980133057   564 0.598843014    10.10.1.1 → 10.10.1.2    TCP 83 8081 → 50338 [PSH, ACK] Seq=1106 Ack=1123 Win=65152 Len=17 TSval=3171315333 TSecr=1047055623
1711548832.980133057   570 0.600019366    10.10.1.2 → 10.10.1.1    TCP 83 50338 → 8081 [PSH, ACK] Seq=1123 Ack=1123 Win=64256 Len=17 TSval=1047055624 TSecr=3171315333
1711548834.980133057   572 0.600052981    10.10.1.1 → 10.10.1.2    TCP 83 8081 → 50338 [PSH, ACK] Seq=1123 Ack=1140 Win=65152 Len=17 TSval=3171315335 TSecr=1047055624
1711548840.980133057   578 0.601206128    10.10.1.2 → 10.10.1.1    TCP 83 50338 → 8081 [PSH, ACK] Seq=1140 Ack=1140 Win=64256 Len=17 TSval=1047055625 TSecr=3171315335
1711548842.980133057   580 0.601236384    10.10.1.1 → 10.10.1.2    TCP 83 8081 → 50338 [PSH, ACK] Seq=1140 Ack=1157 Win=65152 Len=17 TSval=3171315336 TSecr=1047055625
1711548848.980133057   586 0.602412961    10.10.1.2 → 10.10.1.1    TCP 83 50338 → 8081 [PSH, ACK] Seq=1157 Ack=1157 Win=64256 Len=17 TSval=1047055626 TSecr=3171315336
1711548850.980133057   588 0.602442973    10.10.1.1 → 10.10.1.2    TCP 83 8081 → 50338 [PSH, ACK] Seq=1157 Ack=1174 Win=65152 Len=17 TSval=3171315337 TSecr=1047055626
1711548856.980133057   594 0.603594622    10.10.1.2 → 10.10.1.1    TCP 83 50338 → 8081 [PSH, ACK] Seq=1174 Ack=1174 Win=64256 Len=17 TSval=1047055628 TSecr=3171315337
1711548858.980133057   596 0.603629066    10.10.1.1 → 10.10.1.2    TCP 83 8081 → 50338 [PSH, ACK] Seq=1174 Ack=1191 Win=65152 Len=17 TSval=3171315338 TSecr=1047055628
1711548864.980133057   602 0.604807226    10.10.1.2 → 10.10.1.1    TCP 83 50338 → 8081 [PSH, ACK] Seq=1191 Ack=1191 Win=64256 Len=17 TSval=1047055629 TSecr=3171315338
1711548866.980133057   604 0.604837564    10.10.1.1 → 10.10.1.2    TCP 83 8081 → 50338 [PSH, ACK] Seq=1191 Ack=1208 Win=65152 Len=17 TSval=3171315339 TSecr=1047055629
1711548872.980133057   610 0.605987514    10.10.1.2 → 10.10.1.1    TCP 83 50338 → 8081 [PSH, ACK] Seq=1208 Ack=1208 Win=64256 Len=17 TSval=1047055630 TSecr=3171315339
1711548874.980133057   612 0.606016999    10.10.1.1 → 10.10.1.2    TCP 83 8081 → 50338 [PSH, ACK] Seq=1208 Ack=1225 Win=65152 Len=17 TSval=3171315340 TSecr=1047055630
1711548880.980133057   618 0.607199271    10.10.1.2 → 10.10.1.1    TCP 83 50338 → 8081 [PSH, ACK] Seq=1225 Ack=1225 Win=64256 Len=17 TSval=1047055631 TSecr=3171315340
1711548882.980133057   620 0.607233548    10.10.1.1 → 10.10.1.2    TCP 83 8081 → 50338 [PSH, ACK] Seq=1225 Ack=1242 Win=65152 Len=17 TSval=3171315342 TSecr=1047055631
1711548888.980133057   626 0.608383999    10.10.1.2 → 10.10.1.1    TCP 83 50338 → 8081 [PSH, ACK] Seq=1242 Ack=1242 Win=64256 Len=17 TSval=1047055632 TSecr=3171315342
1711548890.980133057   628 0.608414860    10.10.1.1 → 10.10.1.2    TCP 83 8081 → 50338 [PSH, ACK] Seq=1242 Ack=1259 Win=65152 Len=17 TSval=3171315343 TSecr=1047055632
1711548896.980133057   634 0.609601223    10.10.1.2 → 10.10.1.1    TCP 83 50338 → 8081 [PSH, ACK] Seq=1259 Ack=1259 Win=64256 Len=17 TSval=1047055634 TSecr=3171315343
1711548898.980133057   636 0.609628407    10.10.1.1 → 10.10.1.2    TCP 83 8081 → 50338 [PSH, ACK] Seq=1259 Ack=1276 Win=65152 Len=17 TSval=3171315344 TSecr=1047055634
1711548904.980133057   642 0.610778714    10.10.1.2 → 10.10.1.1    TCP 83 50338 → 8081 [PSH, ACK] Seq=1276 Ack=1276 Win=64256 Len=17 TSval=1047055635 TSecr=3171315344
1711548906.980133057   644 0.610806212    10.10.1.1 → 10.10.1.2    TCP 83 8081 → 50338 [PSH, ACK] Seq=1276 Ack=1293 Win=65152 Len=17 TSval=3171315345 TSecr=1047055635
1711548912.980133057   650 0.611995842    10.10.1.2 → 10.10.1.1    TCP 83 50338 → 8081 [PSH, ACK] Seq=1293 Ack=1293 Win=64256 Len=17 TSval=1047055636 TSecr=3171315345
1711548914.980133057   652 0.612028149    10.10.1.1 → 10.10.1.2    TCP 83 8081 → 50338 [PSH, ACK] Seq=1293 Ack=1310 Win=65152 Len=17 TSval=3171315346 TSecr=1047055636
1711548920.980133057   658 0.613180648    10.10.1.2 → 10.10.1.1    TCP 83 50338 → 8081 [PSH, ACK] Seq=1310 Ack=1310 Win=64256 Len=17 TSval=1047055637 TSecr=3171315346
1711548922.980133057   660 0.613208500    10.10.1.1 → 10.10.1.2    TCP 83 8081 → 50338 [PSH, ACK] Seq=1310 Ack=1327 Win=65152 Len=17 TSval=3171315348 TSecr=1047055637
1711548928.980133057   666 0.614398501    10.10.1.2 → 10.10.1.1    TCP 83 50338 → 8081 [PSH, ACK] Seq=1327 Ack=1327 Win=64256 Len=17 TSval=1047055638 TSecr=3171315348
1711548930.980133057   668 0.614426254    10.10.1.1 → 10.10.1.2    TCP 83 8081 → 50338 [PSH, ACK] Seq=1327 Ack=1344 Win=65152 Len=17 TSval=3171315349 TSecr=1047055638
1711548936.980133057   674 0.615577574    10.10.1.2 → 10.10.1.1    TCP 83 50338 → 8081 [PSH, ACK] Seq=1344 Ack=1344 Win=64256 Len=17 TSval=1047055640 TSecr=3171315349
1711548938.980133057   676 0.615609829    10.10.1.1 → 10.10.1.2    TCP 83 8081 → 50338 [PSH, ACK] Seq=1344 Ack=1361 Win=65152 Len=17 TSval=3171315350 TSecr=1047055640
1711548944.980133057   682 0.616801032    10.10.1.2 → 10.10.1.1    TCP 83 50338 → 8081 [PSH, ACK] Seq=1361 Ack=1361 Win=64256 Len=17 TSval=1047055641 TSecr=3171315350
1711548946.980133057   684 0.616830647    10.10.1.1 → 10.10.1.2    TCP 83 8081 → 50338 [PSH, ACK] Seq=1361 Ack=1378 Win=65152 Len=17 TSval=3171315351 TSecr=1047055641
1711548952.980133057   690 0.617981100    10.10.1.2 → 10.10.1.1    TCP 83 50338 → 8081 [PSH, ACK] Seq=1378 Ack=1378 Win=64256 Len=17 TSval=1047055642 TSecr=3171315351
1711548954.980133057   692 0.618010530    10.10.1.1 → 10.10.1.2    TCP 83 8081 → 50338 [PSH, ACK] Seq=1378 Ack=1395 Win=65152 Len=17 TSval=3171315352 TSecr=1047055642
1711548960.980133057   698 0.619203948    10.10.1.2 → 10.10.1.1    TCP 83 50338 → 8081 [PSH, ACK] Seq=1395 Ack=1395 Win=64256 Len=17 TSval=1047055643 TSecr=3171315352
1711548962.980133057   700 0.619237754    10.10.1.1 → 10.10.1.2    TCP 83 8081 → 50338 [PSH, ACK] Seq=1395 Ack=1412 Win=65152 Len=17 TSval=3171315354 TSecr=1047055643
1711548968.980133057   706 0.620388691    10.10.1.2 → 10.10.1.1    TCP 83 50338 → 8081 [PSH, ACK] Seq=1412 Ack=1412 Win=64256 Len=17 TSval=1047055644 TSecr=3171315354
1711548970.980133057   708 0.620418691    10.10.1.1 → 10.10.1.2    TCP 83 8081 → 50338 [PSH, ACK] Seq=1412 Ack=1429 Win=65152 Len=17 TSval=3171315355 TSecr=1047055644
1711548976.980133057   714 0.621615843    10.10.1.2 → 10.10.1.1    TCP 83 50338 → 8081 [PSH, ACK] Seq=1429 Ack=1429 Win=64256 Len=17 TSval=1047055646 TSecr=3171315355
1711548978.980133057   716 0.621645443    10.10.1.1 → 10.10.1.2    TCP 83 8081 → 50338 [PSH, ACK] Seq=1429 Ack=1446 Win=65152 Len=17 TSval=3171315356 TSecr=1047055646
1711548984.980133057   722 0.622795344    10.10.1.2 → 10.10.1.1    TCP 83 50338 → 8081 [PSH, ACK] Seq=1446 Ack=1446 Win=64256 Len=17 TSval=1047055647 TSecr=3171315356
1711548986.980133057   724 0.622825820    10.10.1.1 → 10.10.1.2    TCP 83 8081 → 50338 [PSH, ACK] Seq=1446 Ack=1463 Win=65152 Len=17 TSval=3171315357 TSecr=1047055647
1711548992.980133057   730 0.624024192    10.10.1.2 → 10.10.1.1    TCP 83 50338 → 8081 [PSH, ACK] Seq=1463 Ack=1463 Win=64256 Len=17 TSval=1047055648 TSecr=3171315357
1711548994.980133057   732 0.624057482    10.10.1.1 → 10.10.1.2    TCP 83 8081 → 50338 [PSH, ACK] Seq=1463 Ack=1480 Win=65152 Len=17 TSval=3171315359 TSecr=1047055648
1711549000.980133057   738 0.625210196    10.10.1.2 → 10.10.1.1    TCP 83 50338 → 8081 [PSH, ACK] Seq=1480 Ack=1480 Win=64256 Len=17 TSval=1047055649 TSecr=3171315359
1711549002.980133057   740 0.625238442    10.10.1.1 → 10.10.1.2    TCP 83 8081 → 50338 [PSH, ACK] Seq=1480 Ack=1497 Win=65152 Len=17 TSval=3171315360 TSecr=1047055649
1711549008.980133057   746 0.626439201    10.10.1.2 → 10.10.1.1    TCP 83 50338 → 8081 [PSH, ACK] Seq=1497 Ack=1497 Win=64256 Len=17 TSval=1047055650 TSecr=3171315360
1711549010.980133057   748 0.626466898    10.10.1.1 → 10.10.1.2    TCP 83 8081 → 50338 [PSH, ACK] Seq=1497 Ack=1514 Win=65152 Len=17 TSval=3171315361 TSecr=1047055650
1711549016.980133057   754 0.627617465    10.10.1.2 → 10.10.1.1    TCP 83 50338 → 8081 [PSH, ACK] Seq=1514 Ack=1514 Win=64256 Len=17 TSval=1047055652 TSecr=3171315361
1711549018.980133057   756 0.627649516    10.10.1.1 → 10.10.1.2    TCP 83 8081 → 50338 [PSH, ACK] Seq=1514 Ack=1531 Win=65152 Len=17 TSval=3171315362 TSecr=1047055652
1711549024.980133057   762 0.628849499    10.10.1.2 → 10.10.1.1    TCP 83 50338 → 8081 [PSH, ACK] Seq=1531 Ack=1531 Win=64256 Len=17 TSval=1047055653 TSecr=3171315362
1711549026.980133057   764 0.628877645    10.10.1.1 → 10.10.1.2    TCP 83 8081 → 50338 [PSH, ACK] Seq=1531 Ack=1548 Win=65152 Len=17 TSval=3171315363 TSecr=1047055653
1711549032.980133057   770 0.630028255    10.10.1.2 → 10.10.1.1    TCP 83 50338 → 8081 [PSH, ACK] Seq=1548 Ack=1548 Win=64256 Len=17 TSval=1047055654 TSecr=3171315363
1711549034.980133057   772 0.630056086    10.10.1.1 → 10.10.1.2    TCP 83 8081 → 50338 [PSH, ACK] Seq=1548 Ack=1565 Win=65152 Len=17 TSval=3171315365 TSecr=1047055654
1711549040.980133057   778 0.631257818    10.10.1.2 → 10.10.1.1    TCP 83 50338 → 8081 [PSH, ACK] Seq=1565 Ack=1565 Win=64256 Len=17 TSval=1047055655 TSecr=3171315365
1711549042.980133057   780 0.631292361    10.10.1.1 → 10.10.1.2    TCP 83 8081 → 50338 [PSH, ACK] Seq=1565 Ack=1582 Win=65152 Len=17 TSval=3171315366 TSecr=1047055655
1711549048.980133057   786 0.632443426    10.10.1.2 → 10.10.1.1    TCP 83 50338 → 8081 [PSH, ACK] Seq=1582 Ack=1582 Win=64256 Len=17 TSval=1047055656 TSecr=3171315366
1711549050.980133057   788 0.632474103    10.10.1.1 → 10.10.1.2    TCP 83 8081 → 50338 [PSH, ACK] Seq=1582 Ack=1599 Win=65152 Len=17 TSval=3171315367 TSecr=1047055656
1711549056.980133057   794 0.633679776    10.10.1.2 → 10.10.1.1    TCP 83 50338 → 8081 [PSH, ACK] Seq=1599 Ack=1599 Win=64256 Len=17 TSval=1047055658 TSecr=3171315367
1711549058.980133057   796 0.633709116    10.10.1.1 → 10.10.1.2    TCP 83 8081 → 50338 [PSH, ACK] Seq=1599 Ack=1616 Win=65152 Len=17 TSval=3171315368 TSecr=1047055658
1711549064.980133057   802 0.634858907    10.10.1.2 → 10.10.1.1    TCP 83 50338 → 8081 [PSH, ACK] Seq=1616 Ack=1616 Win=64256 Len=17 TSval=1047055659 TSecr=3171315368
1711549066.980133057   804 0.634889592    10.10.1.1 → 10.10.1.2    TCP 83 8081 → 50338 [PSH, ACK] Seq=1616 Ack=1633 Win=65152 Len=17 TSval=3171315369 TSecr=1047055659
1711549072.980133057   810 0.636093742    10.10.1.2 → 10.10.1.1    TCP 83 50338 → 8081 [PSH, ACK] Seq=1633 Ack=1633 Win=64256 Len=17 TSval=1047055660 TSecr=3171315369
1711549074.980133057   812 0.636126636    10.10.1.1 → 10.10.1.2    TCP 83 8081 → 50338 [PSH, ACK] Seq=1633 Ack=1650 Win=65152 Len=17 TSval=3171315371 TSecr=1047055660
1711549080.980133057   818 0.637279742    10.10.1.2 → 10.10.1.1    TCP 83 50338 → 8081 [PSH, ACK] Seq=1650 Ack=1650 Win=64256 Len=17 TSval=1047055661 TSecr=3171315371
1711549082.980133057   820 0.637309017    10.10.1.1 → 10.10.1.2    TCP 83 8081 → 50338 [PSH, ACK] Seq=1650 Ack=1667 Win=65152 Len=17 TSval=3171315372 TSecr=1047055661
1711549088.980133057   826 0.638518371    10.10.1.2 → 10.10.1.1    TCP 83 50338 → 8081 [PSH, ACK] Seq=1667 Ack=1667 Win=64256 Len=17 TSval=1047055663 TSecr=3171315372
1711549090.980133057   828 0.638547778    10.10.1.1 → 10.10.1.2    TCP 83 8081 → 50338 [PSH, ACK] Seq=1667 Ack=1684 Win=65152 Len=17 TSval=3171315373 TSecr=1047055663
1711549096.980133057   834 0.639698848    10.10.1.2 → 10.10.1.1    TCP 83 50338 → 8081 [PSH, ACK] Seq=1684 Ack=1684 Win=64256 Len=17 TSval=1047055664 TSecr=3171315373
1711549098.980133057   836 0.639734152    10.10.1.1 → 10.10.1.2    TCP 83 8081 → 50338 [PSH, ACK] Seq=1684 Ack=1701 Win=65152 Len=17 TSval=3171315374 TSecr=1047055664
1711549104.980133057   842 0.640939177    10.10.1.2 → 10.10.1.1    TCP 83 50338 → 8081 [PSH, ACK] Seq=1701 Ack=1701 Win=64256 Len=17 TSval=1047055665 TSecr=3171315374
1711549106.980133057   844 0.640967113    10.10.1.1 → 10.10.1.2    TCP 83 8081 → 50338 [PSH, ACK] Seq=1701 Ack=1718 Win=65152 Len=17 TSval=3171315375 TSecr=1047055665
1711549112.980133057   850 0.642117344    10.10.1.2 → 10.10.1.1    TCP 83 50338 → 8081 [PSH, ACK] Seq=1718 Ack=1718 Win=64256 Len=17 TSval=1047055666 TSecr=3171315375
1711549114.980133057   852 0.642144925    10.10.1.1 → 10.10.1.2    TCP 83 8081 → 50338 [PSH, ACK] Seq=1718 Ack=1735 Win=65152 Len=17 TSval=3171315377 TSecr=1047055666
1711549120.980133057   858 0.643360251    10.10.1.2 → 10.10.1.1    TCP 83 50338 → 8081 [PSH, ACK] Seq=1735 Ack=1735 Win=64256 Len=17 TSval=1047055667 TSecr=3171315377
1711549122.980133057   860 0.643392519    10.10.1.1 → 10.10.1.2    TCP 83 8081 → 50338 [PSH, ACK] Seq=1735 Ack=1752 Win=65152 Len=17 TSval=3171315378 TSecr=1047055667
1711549128.980133057   866 0.644497235    10.10.1.2 → 10.10.1.1    TCP 83 50338 → 8081 [PSH, ACK] Seq=1752 Ack=1752 Win=64256 Len=17 TSval=1047055669 TSecr=3171315378
1711549130.980133057   868 0.644527833    10.10.1.1 → 10.10.1.2    TCP 83 8081 → 50338 [PSH, ACK] Seq=1752 Ack=1769 Win=65152 Len=17 TSval=3171315379 TSecr=1047055669
1711549136.980133057   874 0.645742008    10.10.1.2 → 10.10.1.1    TCP 83 50338 → 8081 [PSH, ACK] Seq=1769 Ack=1769 Win=64256 Len=17 TSval=1047055670 TSecr=3171315379
1711549138.980133057   876 0.645771753    10.10.1.1 → 10.10.1.2    TCP 83 8081 → 50338 [PSH, ACK] Seq=1769 Ack=1786 Win=65152 Len=17 TSval=3171315380 TSecr=1047055670
1711549144.980133057   882 0.646922355    10.10.1.2 → 10.10.1.1    TCP 83 50338 → 8081 [PSH, ACK] Seq=1786 Ack=1786 Win=64256 Len=17 TSval=1047055671 TSecr=3171315380
1711549146.980133057   884 0.646952805    10.10.1.1 → 10.10.1.2    TCP 83 8081 → 50338 [PSH, ACK] Seq=1786 Ack=1803 Win=65152 Len=17 TSval=3171315381 TSecr=1047055671
1711549152.980133057   890 0.648168679    10.10.1.2 → 10.10.1.1    TCP 83 50338 → 8081 [PSH, ACK] Seq=1803 Ack=1803 Win=64256 Len=17 TSval=1047055672 TSecr=3171315381
1711549154.980133057   892 0.648201937    10.10.1.1 → 10.10.1.2    TCP 83 8081 → 50338 [PSH, ACK] Seq=1803 Ack=1820 Win=65152 Len=17 TSval=3171315383 TSecr=1047055672
1711549160.980133057   898 0.649354154    10.10.1.2 → 10.10.1.1    TCP 83 50338 → 8081 [PSH, ACK] Seq=1820 Ack=1820 Win=64256 Len=17 TSval=1047055673 TSecr=3171315383
1711549162.980133057   900 0.649383866    10.10.1.1 → 10.10.1.2    TCP 83 8081 → 50338 [PSH, ACK] Seq=1820 Ack=1837 Win=65152 Len=17 TSval=3171315384 TSecr=1047055673
1711549168.980133057   906 0.650600339    10.10.1.2 → 10.10.1.1    TCP 83 50338 → 8081 [PSH, ACK] Seq=1837 Ack=1837 Win=64256 Len=17 TSval=1047055675 TSecr=3171315384
1711549170.980133057   908 0.650630103    10.10.1.1 → 10.10.1.2    TCP 83 8081 → 50338 [PSH, ACK] Seq=1837 Ack=1854 Win=65152 Len=17 TSval=3171315385 TSecr=1047055675
1711549176.980133057   914 0.651781201    10.10.1.2 → 10.10.1.1    TCP 83 50338 → 8081 [PSH, ACK] Seq=1854 Ack=1854 Win=64256 Len=17 TSval=1047055676 TSecr=3171315385
1711549178.980133057   916 0.651815853    10.10.1.1 → 10.10.1.2    TCP 83 8081 → 50338 [PSH, ACK] Seq=1854 Ack=1871 Win=65152 Len=17 TSval=3171315386 TSecr=1047055676
1711549184.980133057   922 0.653030898    10.10.1.2 → 10.10.1.1    TCP 83 50338 → 8081 [PSH, ACK] Seq=1871 Ack=1871 Win=64256 Len=17 TSval=1047055677 TSecr=3171315386
1711549186.980133057   924 0.653059288    10.10.1.1 → 10.10.1.2    TCP 83 8081 → 50338 [PSH, ACK] Seq=1871 Ack=1888 Win=65152 Len=17 TSval=3171315388 TSecr=1047055677
1711549192.980133057   930 0.654209324    10.10.1.2 → 10.10.1.1    TCP 83 50338 → 8081 [PSH, ACK] Seq=1888 Ack=1888 Win=64256 Len=17 TSval=1047055678 TSecr=3171315388
1711549194.980133057   932 0.654236507    10.10.1.1 → 10.10.1.2    TCP 83 8081 → 50338 [PSH, ACK] Seq=1888 Ack=1905 Win=65152 Len=17 TSval=3171315389 TSecr=1047055678
1711549200.980133057   938 0.655462628    10.10.1.2 → 10.10.1.1    TCP 83 50338 → 8081 [PSH, ACK] Seq=1905 Ack=1905 Win=64256 Len=17 TSval=1047055679 TSecr=3171315389
1711549202.980133057   940 0.655494136    10.10.1.1 → 10.10.1.2    TCP 83 8081 → 50338 [PSH, ACK] Seq=1905 Ack=1922 Win=65152 Len=17 TSval=3171315390 TSecr=1047055679
1711549208.980133057   946 0.656648436    10.10.1.2 → 10.10.1.1    TCP 83 50338 → 8081 [PSH, ACK] Seq=1922 Ack=1922 Win=64256 Len=17 TSval=1047055681 TSecr=3171315390
1711549211.980133057   949 0.656714657    10.10.1.1 → 10.10.1.2    TCP 83 8081 → 50338 [PSH, ACK] Seq=1922 Ack=1939 Win=65152 Len=17 TSval=3171315391 TSecr=1047055681
1711549216.980133057   954 0.657903275    10.10.1.2 → 10.10.1.1    TCP 83 50338 → 8081 [PSH, ACK] Seq=1939 Ack=1939 Win=64256 Len=17 TSval=1047055682 TSecr=3171315391
1711549218.980133057   956 0.657934122    10.10.1.1 → 10.10.1.2    TCP 83 8081 → 50338 [PSH, ACK] Seq=1939 Ack=1956 Win=65152 Len=17 TSval=3171315392 TSecr=1047055682
1711549224.980133057   962 0.659084857    10.10.1.2 → 10.10.1.1    TCP 83 50338 → 8081 [PSH, ACK] Seq=1956 Ack=1956 Win=64256 Len=17 TSval=1047055683 TSecr=3171315392
1711549226.980133057   964 0.659119356    10.10.1.1 → 10.10.1.2    TCP 83 8081 → 50338 [PSH, ACK] Seq=1956 Ack=1973 Win=65152 Len=17 TSval=3171315394 TSecr=1047055683
1711549232.980133057   970 0.660339025    10.10.1.2 → 10.10.1.1    TCP 83 50338 → 8081 [PSH, ACK] Seq=1973 Ack=1973 Win=64256 Len=17 TSval=1047055684 TSecr=3171315394
1711549234.980133057   972 0.660368711    10.10.1.1 → 10.10.1.2    TCP 83 8081 → 50338 [PSH, ACK] Seq=1973 Ack=1990 Win=65152 Len=17 TSval=3171315395 TSecr=1047055684
1711549240.980133057   978 0.661522244    10.10.1.2 → 10.10.1.1    TCP 83 50338 → 8081 [PSH, ACK] Seq=1990 Ack=1990 Win=64256 Len=17 TSval=1047055686 TSecr=3171315395
1711549242.980133057   980 0.661552458    10.10.1.1 → 10.10.1.2    TCP 83 8081 → 50338 [PSH, ACK] Seq=1990 Ack=2007 Win=65152 Len=17 TSval=3171315396 TSecr=1047055686
1711549248.980133057   986 0.662779730    10.10.1.2 → 10.10.1.1    TCP 83 50338 → 8081 [PSH, ACK] Seq=2007 Ack=2007 Win=64256 Len=17 TSval=1047055687 TSecr=3171315396
1711549250.980133057   988 0.662807450    10.10.1.1 → 10.10.1.2    TCP 83 8081 → 50338 [PSH, ACK] Seq=2007 Ack=2024 Win=65152 Len=17 TSval=3171315397 TSecr=1047055687
1711549256.980133057   994 0.663957918    10.10.1.2 → 10.10.1.1    TCP 83 50338 → 8081 [PSH, ACK] Seq=2024 Ack=2024 Win=64256 Len=17 TSval=1047055688 TSecr=3171315397
1711549258.980133057   996 0.663992120    10.10.1.1 → 10.10.1.2    TCP 83 8081 → 50338 [PSH, ACK] Seq=2024 Ack=2041 Win=65152 Len=17 TSval=3171315398 TSecr=1047055688
1711549264.980133057  1002 0.665220418    10.10.1.2 → 10.10.1.1    TCP 83 50338 → 8081 [PSH, ACK] Seq=2041 Ack=2041 Win=64256 Len=17 TSval=1047055689 TSecr=3171315398
