1711548894.975743294    22 0.261651585    10.10.1.2 → 10.10.1.1    TCP 74 45016 → 8081 [SYN] Seq=0 Win=64240 Len=0 MSS=1460 SACK_PERM=1 TSval=1047665267 TSecr=0 WS=128
1711548895.975743294    23 0.261687591    10.10.1.1 → 10.10.1.2    TCP 74 8081 → 45016 [SYN, ACK] Seq=0 Ack=1 Win=65160 Len=0 MSS=1460 SACK_PERM=1 TSval=3171924978 TSecr=1047665267 WS=128
1711548896.975743294    24 0.261781112    10.10.1.2 → 10.10.1.1    TCP 66 45016 → 8081 [ACK] Seq=1 Ack=1 Win=64256 Len=0 TSval=1047665267 TSecr=3171924978
1711548908.975743294    36 0.520425851    10.10.1.2 → 10.10.1.1    TCP 83 45016 → 8081 [PSH, ACK] Seq=1 Ack=1 Win=64256 Len=17 TSval=1047665526 TSecr=3171924978
1711548909.975743294    37 0.520454095    10.10.1.1 → 10.10.1.2    TCP 66 8081 → 45016 [ACK] Seq=1 Ack=18 Win=65152 Len=0 TSval=3171925237 TSecr=1047665526
1711548912.975743294    40 0.520692794    10.10.1.1 → 10.10.1.2    TCP 83 8081 → 45016 [PSH, ACK] Seq=1 Ack=18 Win=65152 Len=17 TSval=3171925237 TSecr=1047665526
1711548913.975743294    41 0.520720396    10.10.1.2 → 10.10.1.1    TCP 66 45016 → 8081 [ACK] Seq=18 Ack=18 Win=64256 Len=0 TSval=1047665526 TSecr=3171925237
1711548920.975743294    48 0.530913550    10.10.1.2 → 10.10.1.1    TCP 83 45016 → 8081 [PSH, ACK] Seq=18 Ack=18 Win=64256 Len=17 TSval=1047665536 TSecr=3171925237
1711548923.975743294    51 0.531009898    10.10.1.1 → 10.10.1.2    TCP 83 8081 → 45016 [PSH, ACK] Seq=18 Ack=35 Win=65152 Len=17 TSval=3171925248 TSecr=1047665536
1711548930.975743294    58 0.541230536    10.10.1.2 → 10.10.1.1    TCP 83 45016 → 8081 [PSH, ACK] Seq=35 Ack=35 Win=64256 Len=17 TSval=1047665547 TSecr=3171925248
1711548933.975743294    61 0.541332031    10.10.1.1 → 10.10.1.2    TCP 83 8081 → 45016 [PSH, ACK] Seq=35 Ack=52 Win=65152 Len=17 TSval=3171925258 TSecr=1047665547
1711548940.975743294    68 0.551548564    10.10.1.2 → 10.10.1.1    TCP 83 45016 → 8081 [PSH, ACK] Seq=52 Ack=52 Win=64256 Len=17 TSval=1047665557 TSecr=3171925258
1711548943.975743294    71 0.551649943    10.10.1.1 → 10.10.1.2    TCP 83 8081 → 45016 [PSH, ACK] Seq=52 Ack=69 Win=65152 Len=17 TSval=3171925268 TSecr=1047665557
1711548950.975743294    78 0.561865065    10.10.1.2 → 10.10.1.1    TCP 83 45016 → 8081 [PSH, ACK] Seq=69 Ack=69 Win=64256 Len=17 TSval=1047665567 TSecr=3171925268
1711548953.975743294    81 0.561996281    10.10.1.1 → 10.10.1.2    TCP 83 8081 → 45016 [PSH, ACK] Seq=69 Ack=86 Win=65152 Len=17 TSval=3171925279 TSecr=1047665567
1711548960.975743294    88 0.572214483    10.10.1.2 → 10.10.1.1    TCP 83 45016 → 8081 [PSH, ACK] Seq=86 Ack=86 Win=64256 Len=17 TSval=1047665578 TSecr=3171925279
1711548962.975743294    90 0.572344014    10.10.1.1 → 10.10.1.2    TCP 83 8081 → 45016 [PSH, ACK] Seq=86 Ack=103 Win=65152 Len=17 TSval=3171925289 TSecr=1047665578
1711548970.975743294    98 0.582563940    10.10.1.2 → 10.10.1.1    TCP 83 45016 → 8081 [PSH, ACK] Seq=103 Ack=103 Win=64256 Len=17 TSval=1047665588 TSecr=3171925289
1711548973.975743294   101 0.582698285    10.10.1.1 → 10.10.1.2    TCP 83 8081 → 45016 [PSH, ACK] Seq=103 Ack=120 Win=65152 Len=17 TSval=3171925299 TSecr=1047665588
1711548980.975743294   108 0.592916995    10.10.1.2 → 10.10.1.1    TCP 83 45016 → 8081 [PSH, ACK] Seq=120 Ack=120 Win=64256 Len=17 TSval=1047665598 TSecr=3171925299
1711548982.975743294   110 0.593055913    10.10.1.1 → 10.10.1.2    TCP 83 8081 → 45016 [PSH, ACK] Seq=120 Ack=137 Win=65152 Len=17 TSval=3171925310 TSecr=1047665598
1711548990.975743294   118 0.603274116    10.10.1.2 → 10.10.1.1    TCP 83 45016 → 8081 [PSH, ACK] Seq=137 Ack=137 Win=64256 Len=17 TSval=1047665609 TSecr=3171925310
1711548992.975743294   120 0.603375299    10.10.1.1 → 10.10.1.2    TCP 83 8081 → 45016 [PSH, ACK] Seq=137 Ack=154 Win=65152 Len=17 TSval=3171925320 TSecr=1047665609
1711549000.975743294   128 0.613591497    10.10.1.2 → 10.10.1.1    TCP 83 45016 → 8081 [PSH, ACK] Seq=154 Ack=154 Win=64256 Len=17 TSval=1047665619 TSecr=3171925320
1711549002.975743294   130 0.613694726    10.10.1.1 → 10.10.1.2    TCP 83 8081 → 45016 [PSH, ACK] Seq=154 Ack=171 Win=65152 Len=17 TSval=3171925330 TSecr=1047665619
1711549010.975743294   138 0.623911728    10.10.1.2 → 10.10.1.1    TCP 83 45016 → 8081 [PSH, ACK] Seq=171 Ack=171 Win=64256 Len=17 TSval=1047665629 TSecr=3171925330
1711549012.975743294   140 0.624014082    10.10.1.1 → 10.10.1.2    TCP 83 8081 → 45016 [PSH, ACK] Seq=171 Ack=188 Win=65152 Len=17 TSval=3171925341 TSecr=1047665629
1711549020.975743294   148 0.634230118    10.10.1.2 → 10.10.1.1    TCP 83 45016 → 8081 [PSH, ACK] Seq=188 Ack=188 Win=64256 Len=17 TSval=1047665640 TSecr=3171925341
1711549022.975743294   150 0.634332828    10.10.1.1 → 10.10.1.2    TCP 83 8081 → 45016 [PSH, ACK] Seq=188 Ack=205 Win=65152 Len=17 TSval=3171925351 TSecr=1047665640
1711549030.975743294   158 0.644549314    10.10.1.2 → 10.10.1.1    TCP 83 45016 → 8081 [PSH, ACK] Seq=205 Ack=205 Win=64256 Len=17 TSval=1047665650 TSecr=3171925351
1711549032.975743294   160 0.644659710    10.10.1.1 → 10.10.1.2    TCP 83 8081 → 45016 [PSH, ACK] Seq=205 Ack=222 Win=65152 Len=17 TSval=3171925361 TSecr=1047665650
1711549040.975743294   168 0.654877608    10.10.1.2 → 10.10.1.1    TCP 83 45016 → 8081 [PSH, ACK] Seq=222 Ack=222 Win=64256 Len=17 TSval=1047665660 TSecr=3171925361
1711549042.975743294   170 0.654979667    10.10.1.1 → 10.10.1.2    TCP 83 8081 → 45016 [PSH, ACK] Seq=222 Ack=239 Win=65152 Len=17 TSval=3171925372 TSecr=1047665660
1711549050.975743294   178 0.665197777    10.10.1.2 → 10.10.1.1    TCP 83 45016 → 8081 [PSH, ACK] Seq=239 Ack=239 Win=64256 Len=17 TSval=1047665671 TSecr=3171925372
1711549052.975743294   180 0.665299672    10.10.1.1 → 10.10.1.2    TCP 83 8081 → 45016 [PSH, ACK] Seq=239 Ack=256 Win=65152 Len=17 TSval=3171925382 TSecr=1047665671
1711549060.975743294   188 0.675516988    10.10.1.2 → 10.10.1.1    TCP 83 45016 → 8081 [PSH, ACK] Seq=256 Ack=256 Win=64256 Len=17 TSval=1047665681 TSecr=3171925382
1711549062.975743294   190 0.675619640    10.10.1.1 → 10.10.1.2    TCP 83 8081 → 45016 [PSH, ACK] Seq=256 Ack=273 Win=65152 Len=17 TSval=3171925392 TSecr=1047665681
1711549070.975743294   198 0.685837102    10.10.1.2 → 10.10.1.1    TCP 83 45016 → 8081 [PSH, ACK] Seq=273 Ack=273 Win=64256 Len=17 TSval=1047665691 TSecr=3171925392
1711549072.975743294   200 0.685939519    10.10.1.1 → 10.10.1.2    TCP 83 8081 → 45016 [PSH, ACK] Seq=273 Ack=290 Win=65152 Len=17 TSval=3171925402 TSecr=1047665691
1711549080.975743294   208 0.696161688    10.10.1.2 → 10.10.1.1    TCP 83 45016 → 8081 [PSH, ACK] Seq=290 Ack=290 Win=64256 Len=17 TSval=1047665702 TSecr=3171925402
1711549082.975743294   210 0.696263555    10.10.1.1 → 10.10.1.2    TCP 83 8081 → 45016 [PSH, ACK] Seq=290 Ack=307 Win=65152 Len=17 TSval=3171925413 TSecr=1047665702
1711549090.975743294   218 0.706482627    10.10.1.2 → 10.10.1.1    TCP 83 45016 → 8081 [PSH, ACK] Seq=307 Ack=307 Win=64256 Len=17 TSval=1047665712 TSecr=3171925413
1711549092.975743294   220 0.706584315    10.10.1.1 → 10.10.1.2    TCP 83 8081 → 45016 [PSH, ACK] Seq=307 Ack=324 Win=65152 Len=17 TSval=3171925423 TSecr=1047665712
1711549100.975743294   228 0.716799226    10.10.1.2 → 10.10.1.1    TCP 83 45016 → 8081 [PSH, ACK] Seq=324 Ack=324 Win=64256 Len=17 TSval=1047665722 TSecr=3171925423
1711549102.975743294   230 0.716901325    10.10.1.1 → 10.10.1.2    TCP 83 8081 → 45016 [PSH, ACK] Seq=324 Ack=341 Win=65152 Len=17 TSval=3171925433 TSecr=1047665722
1711549110.975743294   238 0.727117830    10.10.1.2 → 10.10.1.1    TCP 83 45016 → 8081 [PSH, ACK] Seq=341 Ack=341 Win=64256 Len=17 TSval=1047665733 TSecr=3171925433
1711549112.975743294   240 0.727220504    10.10.1.1 → 10.10.1.2    TCP 83 8081 → 45016 [PSH, ACK] Seq=341 Ack=358 Win=65152 Len=17 TSval=3171925444 TSecr=1047665733
1711549120.975743294   248 0.737439033    10.10.1.2 → 10.10.1.1    TCP 83 45016 → 8081 [PSH, ACK] Seq=358 Ack=358 Win=64256 Len=17 TSval=1047665743 TSecr=3171925444
1711549122.975743294   250 0.737541391    10.10.1.1 → 10.10.1.2    TCP 83 8081 → 45016 [PSH, ACK] Seq=358 Ack=375 Win=65152 Len=17 TSval=3171925454 TSecr=1047665743
1711549130.975743294   258 0.747757270    10.10.1.2 → 10.10.1.1    TCP 83 45016 → 8081 [PSH, ACK] Seq=375 Ack=375 Win=64256 Len=17 TSval=1047665753 TSecr=3171925454
1711549132.975743294   260 0.747860817    10.10.1.1 → 10.10.1.2    TCP 83 8081 → 45016 [PSH, ACK] Seq=375 Ack=392 Win=65152 Len=17 TSval=3171925464 TSecr=1047665753
1711549140.975743294   268 0.758076950    10.10.1.2 → 10.10.1.1    TCP 83 45016 → 8081 [PSH, ACK] Seq=392 Ack=392 Win=64256 Len=17 TSval=1047665764 TSecr=3171925464
1711549142.975743294   270 0.758179342    10.10.1.1 → 10.10.1.2    TCP 83 8081 → 45016 [PSH, ACK] Seq=392 Ack=409 Win=65152 Len=17 TSval=3171925475 TSecr=1047665764
1711549150.975743294   278 0.768396638    10.10.1.2 → 10.10.1.1    TCP 83 45016 → 8081 [PSH, ACK] Seq=409 Ack=409 Win=64256 Len=17 TSval=1047665774 TSecr=3171925475
1711549152.975743294   280 0.768498569    10.10.1.1 → 10.10.1.2    TCP 83 8081 → 45016 [PSH, ACK] Seq=409 Ack=426 Win=65152 Len=17 TSval=3171925485 TSecr=1047665774
1711549160.975743294   288 0.778716220    10.10.1.2 → 10.10.1.1    TCP 83 45016 → 8081 [PSH, ACK] Seq=426 Ack=426 Win=64256 Len=17 TSval=1047665784 TSecr=3171925485
1711549162.975743294   290 0.778818061    10.10.1.1 → 10.10.1.2    TCP 83 8081 → 45016 [PSH, ACK] Seq=426 Ack=443 Win=65152 Len=17 TSval=3171925495 TSecr=1047665784
1711549170.975743294   298 0.789037750    10.10.1.2 → 10.10.1.1    TCP 83 45016 → 8081 [PSH, ACK] Seq=443 Ack=443 Win=64256 Len=17 TSval=1047665795 TSecr=3171925495
1711549172.975743294   300 0.789140188    10.10.1.1 → 10.10.1.2    TCP 83 8081 → 45016 [PSH, ACK] Seq=443 Ack=460 Win=65152 Len=17 TSval=3171925506 TSecr=1047665795
1711549180.975743294   308 0.799356273    10.10.1.2 → 10.10.1.1    TCP 83 45016 → 8081 [PSH, ACK] Seq=460 Ack=460 Win=64256 Len=17 TSval=1047665805 TSecr=3171925506
1711549182.975743294   310 0.799458958    10.10.1.1 → 10.10.1.2    TCP 83 8081 → 45016 [PSH, ACK] Seq=460 Ack=477 Win=65152 Len=17 TSval=3171925516 TSecr=1047665805
1711549190.975743294   318 0.809678279    10.10.1.2 → 10.10.1.1    TCP 83 45016 → 8081 [PSH, ACK] Seq=477 Ack=477 Win=64256 Len=17 TSval=1047665815 TSecr=3171925516
1711549192.975743294   320 0.809780155    10.10.1.1 → 10.10.1.2    TCP 83 8081 → 45016 [PSH, ACK] Seq=477 Ack=494 Win=65152 Len=17 TSval=3171925526 TSecr=1047665815
1711549200.975743294   328 0.819987994    10.10.1.2 → 10.10.1.1    TCP 83 45016 → 8081 [PSH, ACK] Seq=494 Ack=494 Win=64256 Len=17 TSval=1047665825 TSecr=3171925526
1711549202.975743294   330 0.820092186    10.10.1.1 → 10.10.1.2    TCP 83 8081 → 45016 [PSH, ACK] Seq=494 Ack=511 Win=65152 Len=17 TSval=3171925537 TSecr=1047665825
1711549210.975743294   338 0.830308255    10.10.1.2 → 10.10.1.1    TCP 83 45016 → 8081 [PSH, ACK] Seq=511 Ack=511 Win=64256 Len=17 TSval=1047665836 TSecr=3171925537
1711549212.975743294   340 0.830411297    10.10.1.1 → 10.10.1.2    TCP 83 8081 → 45016 [PSH, ACK] Seq=511 Ack=528 Win=65152 Len=17 TSval=3171925547 TSecr=1047665836
1711549220.975743294   348 0.840628773    10.10.1.2 → 10.10.1.1    TCP 83 45016 → 8081 [PSH, ACK] Seq=528 Ack=528 Win=64256 Len=17 TSval=1047665846 TSecr=3171925547
1711549222.975743294   350 0.840730247    10.10.1.1 → 10.10.1.2    TCP 83 8081 → 45016 [PSH, ACK] Seq=528 Ack=545 Win=65152 Len=17 TSval=3171925557 TSecr=1047665846
1711549230.975743294   358 0.850945735    10.10.1.2 → 10.10.1.1    TCP 83 45016 → 8081 [PSH, ACK] Seq=545 Ack=545 Win=64256 Len=17 TSval=1047665856 TSecr=3171925557
1711549232.975743294   360 0.851047589    10.10.1.1 → 10.10.1.2    TCP 83 8081 → 45016 [PSH, ACK] Seq=545 Ack=562 Win=65152 Len=17 TSval=3171925568 TSecr=1047665856
1711549240.975743294   368 0.861262191    10.10.1.2 → 10.10.1.1    TCP 83 45016 → 8081 [PSH, ACK] Seq=562 Ack=562 Win=64256 Len=17 TSval=1047665867 TSecr=3171925568
1711549242.975743294   370 0.861366837    10.10.1.1 → 10.10.1.2    TCP 83 8081 → 45016 [PSH, ACK] Seq=562 Ack=579 Win=65152 Len=17 TSval=3171925578 TSecr=1047665867
1711549250.975743294   378 0.871584694    10.10.1.2 → 10.10.1.1    TCP 83 45016 → 8081 [PSH, ACK] Seq=579 Ack=579 Win=64256 Len=17 TSval=1047665877 TSecr=3171925578
1711549252.975743294   380 0.871686956    10.10.1.1 → 10.10.1.2    TCP 83 8081 → 45016 [PSH, ACK] Seq=579 Ack=596 Win=65152 Len=17 TSval=3171925588 TSecr=1047665877
1711549260.975743294   388 0.881903512    10.10.1.2 → 10.10.1.1    TCP 83 45016 → 8081 [PSH, ACK] Seq=596 Ack=596 Win=64256 Len=17 TSval=1047665887 TSecr=3171925588
1711549262.975743294   390 0.882007603    10.10.1.1 → 10.10.1.2    TCP 83 8081 → 45016 [PSH, ACK] Seq=596 Ack=613 Win=65152 Len=17 TSval=3171925599 TSecr=1047665887
1711549270.975743294   398 0.892223392    10.10.1.2 → 10.10.1.1    TCP 83 45016 → 8081 [PSH, ACK] Seq=613 Ack=613 Win=64256 Len=17 TSval=1047665898 TSecr=3171925599
1711549272.975743294   400 0.892325707    10.10.1.1 → 10.10.1.2    TCP 83 8081 → 45016 [PSH, ACK] Seq=613 Ack=630 Win=65152 Len=17 TSval=3171925609 TSecr=1047665898
1711549280.975743294   408 0.902543061    10.10.1.2 → 10.10.1.1    TCP 83 45016 → 8081 [PSH, ACK] Seq=630 Ack=630 Win=64256 Len=17 TSval=1047665908 TSecr=3171925609
1711549282.975743294   410 0.902645727    10.10.1.1 → 10.10.1.2    TCP 83 8081 → 45016 [PSH, ACK] Seq=630 Ack=647 Win=65152 Len=17 TSval=3171925619 TSecr=1047665908
1711549290.975743294   418 0.912863120    10.10.1.2 → 10.10.1.1    TCP 83 45016 → 8081 [PSH, ACK] Seq=647 Ack=647 Win=64256 Len=17 TSval=1047665918 TSecr=3171925619
1711549292.975743294   420 0.912992422    10.10.1.1 → 10.10.1.2    TCP 83 8081 → 45016 [PSH, ACK] Seq=647 Ack=664 Win=65152 Len=17 TSval=3171925630 TSecr=1047665918
1711549300.975743294   428 0.923207574    10.10.1.2 → 10.10.1.1    TCP 83 45016 → 8081 [PSH, ACK] Seq=664 Ack=664 Win=64256 Len=17 TSval=1047665929 TSecr=3171925630
1711549302.975743294   430 0.923309701    10.10.1.1 → 10.10.1.2    TCP 83 8081 → 45016 [PSH, ACK] Seq=664 Ack=681 Win=65152 Len=17 TSval=3171925640 TSecr=1047665929
1711549310.975743294   438 0.933528197    10.10.1.2 → 10.10.1.1    TCP 83 45016 → 8081 [PSH, ACK] Seq=681 Ack=681 Win=64256 Len=17 TSval=1047665939 TSecr=3171925640
1711549312.975743294   440 0.933630802    10.10.1.1 → 10.10.1.2    TCP 83 8081 → 45016 [PSH, ACK] Seq=681 Ack=698 Win=65152 Len=17 TSval=3171925650 TSecr=1047665939
1711549320.975743294   448 0.943847779    10.10.1.2 → 10.10.1.1    TCP 83 45016 → 8081 [PSH, ACK] Seq=698 Ack=698 Win=64256 Len=17 TSval=1047665949 TSecr=3171925650
1711549322.975743294   450 0.943950256    10.10.1.1 → 10.10.1.2    TCP 83 8081 → 45016 [PSH, ACK] Seq=698 Ack=715 Win=65152 Len=17 TSval=3171925661 TSecr=1047665949
1711549330.975743294   458 0.954165801    10.10.1.2 → 10.10.1.1    TCP 83 45016 → 8081 [PSH, ACK] Seq=715 Ack=715 Win=64256 Len=17 TSval=1047665960 TSecr=3171925661
1711549332.975743294   460 0.954268732    10.10.1.1 → 10.10.1.2    TCP 83 8081 → 45016 [PSH, ACK] Seq=715 Ack=732 Win=65152 Len=17 TSval=3171925671 TSecr=1047665960
1711549340.975743294   468 0.964483512    10.10.1.2 → 10.10.1.1    TCP 83 45016 → 8081 [PSH, ACK] Seq=732 Ack=732 Win=64256 Len=17 TSval=1047665970 TSecr=3171925671
1711549342.975743294   470 0.964586799    10.10.1.1 → 10.10.1.2    TCP 83 8081 → 45016 [PSH, ACK] Seq=732 Ack=749 Win=65152 Len=17 TSval=3171925681 TSecr=1047665970
1711549350.975743294   478 0.974800954    10.10.1.2 → 10.10.1.1    TCP 83 45016 → 8081 [PSH, ACK] Seq=749 Ack=749 Win=64256 Len=17 TSval=1047665980 TSecr=3171925681
1711549352.975743294   480 0.974902609    10.10.1.1 → 10.10.1.2    TCP 83 8081 → 45016 [PSH, ACK] Seq=749 Ack=766 Win=65152 Len=17 TSval=3171925691 TSecr=1047665980
1711549360.975743294   488 0.985118379    10.10.1.2 → 10.10.1.1    TCP 83 45016 → 8081 [PSH, ACK] Seq=766 Ack=766 Win=64256 Len=17 TSval=1047665991 TSecr=3171925691
1711549362.975743294   490 0.985220371    10.10.1.1 → 10.10.1.2    TCP 83 8081 → 45016 [PSH, ACK] Seq=766 Ack=783 Win=65152 Len=17 TSval=3171925702 TSecr=1047665991
1711549370.975743294   498 0.995438587    10.10.1.2 → 10.10.1.1    TCP 83 45016 → 8081 [PSH, ACK] Seq=783 Ack=783 Win=64256 Len=17 TSval=1047666001 TSecr=3171925702
1711549372.975743294   500 0.995540117    10.10.1.1 → 10.10.1.2    TCP 83 8081 → 45016 [PSH, ACK] Seq=783 Ack=800 Win=65152 Len=17 TSval=3171925712 TSecr=1047666001
1711549380.975743294   508 1.005757447    10.10.1.2 → 10.10.1.1    TCP 83 45016 → 8081 [PSH, ACK] Seq=800 Ack=800 Win=64256 Len=17 TSval=1047666011 TSecr=3171925712
1711549382.975743294   510 1.005860219    10.10.1.1 → 10.10.1.2    TCP 83 8081 → 45016 [PSH, ACK] Seq=800 Ack=817 Win=65152 Len=17 TSval=3171925722 TSecr=1047666011
1711549390.975743294   518 1.016077116    10.10.1.2 → 10.10.1.1    TCP 83 45016 → 8081 [PSH, ACK] Seq=817 Ack=817 Win=64256 Len=17 TSval=1047666022 TSecr=3171925722
1711549392.975743294   520 1.016179095    10.10.1.1 → 10.10.1.2    TCP 83 8081 → 45016 [PSH, ACK] Seq=817 Ack=834 Win=65152 Len=17 TSval=3171925733 TSecr=1047666022
1711549400.975743294   528 1.026396855    10.10.1.2 → 10.10.1.1    TCP 83 45016 → 8081 [PSH, ACK] Seq=834 Ack=834 Win=64256 Len=17 TSval=1047666032 TSecr=3171925733
1711549402.975743294   530 1.026498840    10.10.1.1 → 10.10.1.2    TCP 83 8081 → 45016 [PSH, ACK] Seq=834 Ack=851 Win=65152 Len=17 TSval=3171925743 TSecr=1047666032
1711549410.975743294   538 1.036714022    10.10.1.2 → 10.10.1.1    TCP 83 45016 → 8081 [PSH, ACK] Seq=851 Ack=851 Win=64256 Len=17 TSval=1047666042 TSecr=3171925743
1711549412.975743294   540 1.036815751    10.10.1.1 → 10.10.1.2    TCP 83 8081 → 45016 [PSH, ACK] Seq=851 Ack=868 Win=65152 Len=17 TSval=3171925753 TSecr=1047666042
1711549420.975743294   548 1.047030069    10.10.1.2 → 10.10.1.1    TCP 83 45016 → 8081 [PSH, ACK] Seq=868 Ack=868 Win=64256 Len=17 TSval=1047666053 TSecr=3171925753
1711549422.975743294   550 1.047132302    10.10.1.1 → 10.10.1.2    TCP 83 8081 → 45016 [PSH, ACK] Seq=868 Ack=885 Win=65152 Len=17 TSval=3171925764 TSecr=1047666053
1711549430.975743294   558 1.057353726    10.10.1.2 → 10.10.1.1    TCP 83 45016 → 8081 [PSH, ACK] Seq=885 Ack=885 Win=64256 Len=17 TSval=1047666063 TSecr=3171925764
1711549432.975743294   560 1.057455063    10.10.1.1 → 10.10.1.2    TCP 83 8081 → 45016 [PSH, ACK] Seq=885 Ack=902 Win=65152 Len=17 TSval=3171925774 TSecr=1047666063
1711549440.975743294   568 1.067670533    10.10.1.2 → 10.10.1.1    TCP 83 45016 → 8081 [PSH, ACK] Seq=902 Ack=902 Win=64256 Len=17 TSval=1047666073 TSecr=3171925774
1711549442.975743294   570 1.067774010    10.10.1.1 → 10.10.1.2    TCP 83 8081 → 45016 [PSH, ACK] Seq=902 Ack=919 Win=65152 Len=17 TSval=3171925784 TSecr=1047666073
1711549450.975743294   578 1.077988389    10.10.1.2 → 10.10.1.1    TCP 83 45016 → 8081 [PSH, ACK] Seq=919 Ack=919 Win=64256 Len=17 TSval=1047666083 TSecr=3171925784
1711549452.975743294   580 1.078091491    10.10.1.1 → 10.10.1.2    TCP 83 8081 → 45016 [PSH, ACK] Seq=919 Ack=936 Win=65152 Len=17 TSval=3171925795 TSecr=1047666083
1711549460.975743294   588 1.088306795    10.10.1.2 → 10.10.1.1    TCP 83 45016 → 8081 [PSH, ACK] Seq=936 Ack=936 Win=64256 Len=17 TSval=1047666094 TSecr=3171925795
1711549462.975743294   590 1.088409871    10.10.1.1 → 10.10.1.2    TCP 83 8081 → 45016 [PSH, ACK] Seq=936 Ack=953 Win=65152 Len=17 TSval=3171925805 TSecr=1047666094
1711549470.975743294   598 1.098626102    10.10.1.2 → 10.10.1.1    TCP 83 45016 → 8081 [PSH, ACK] Seq=953 Ack=953 Win=64256 Len=17 TSval=1047666104 TSecr=3171925805
1711549473.975743294   601 1.098785154    10.10.1.1 → 10.10.1.2    TCP 83 8081 → 45016 [PSH, ACK] Seq=953 Ack=970 Win=65152 Len=17 TSval=3171925815 TSecr=1047666104
1711549480.975743294   608 1.109002525    10.10.1.2 → 10.10.1.1    TCP 83 45016 → 8081 [PSH, ACK] Seq=970 Ack=970 Win=64256 Len=17 TSval=1047666114 TSecr=3171925815
1711549482.975743294   610 1.109103967    10.10.1.1 → 10.10.1.2    TCP 83 8081 → 45016 [PSH, ACK] Seq=970 Ack=987 Win=65152 Len=17 TSval=3171925826 TSecr=1047666114
1711549490.975743294   618 1.119320017    10.10.1.2 → 10.10.1.1    TCP 83 45016 → 8081 [PSH, ACK] Seq=987 Ack=987 Win=64256 Len=17 TSval=1047666125 TSecr=3171925826
1711549492.975743294   620 1.119423588    10.10.1.1 → 10.10.1.2    TCP 83 8081 → 45016 [PSH, ACK] Seq=987 Ack=1004 Win=65152 Len=17 TSval=3171925836 TSecr=1047666125
1711549500.975743294   628 1.129640627    10.10.1.2 → 10.10.1.1    TCP 83 45016 → 8081 [PSH, ACK] Seq=1004 Ack=1004 Win=64256 Len=17 TSval=1047666135 TSecr=3171925836
1711549502.975743294   630 1.129741856    10.10.1.1 → 10.10.1.2    TCP 83 8081 → 45016 [PSH, ACK] Seq=1004 Ack=1021 Win=65152 Len=17 TSval=3171925846 TSecr=1047666135
1711549510.975743294   638 1.139957070    10.10.1.2 → 10.10.1.1    TCP 83 45016 → 8081 [PSH, ACK] Seq=1021 Ack=1021 Win=64256 Len=17 TSval=1047666145 TSecr=3171925846
1711549512.975743294   640 1.140058771    10.10.1.1 → 10.10.1.2    TCP 83 8081 → 45016 [PSH, ACK] Seq=1021 Ack=1038 Win=65152 Len=17 TSval=3171925857 TSecr=1047666145
1711549520.975743294   648 1.150274251    10.10.1.2 → 10.10.1.1    TCP 83 45016 → 8081 [PSH, ACK] Seq=1038 Ack=1038 Win=64256 Len=17 TSval=1047666156 TSecr=3171925857
1711549522.975743294   650 1.150376727    10.10.1.1 → 10.10.1.2    TCP 83 8081 → 45016 [PSH, ACK] Seq=1038 Ack=1055 Win=65152 Len=17 TSval=3171925867 TSecr=1047666156
1711549530.975743294   658 1.160591032    10.10.1.2 → 10.10.1.1    TCP 83 45016 → 8081 [PSH, ACK] Seq=1055 Ack=1055 Win=64256 Len=17 TSval=1047666166 TSecr=3171925867
1711549532.975743294   660 1.160693779    10.10.1.1 → 10.10.1.2    TCP 83 8081 → 45016 [PSH, ACK] Seq=1055 Ack=1072 Win=65152 Len=17 TSval=3171925877 TSecr=1047666166
1711549540.975743294   668 1.170909000    10.10.1.2 → 10.10.1.1    TCP 83 45016 → 8081 [PSH, ACK] Seq=1072 Ack=1072 Win=64256 Len=17 TSval=1047666176 TSecr=3171925877
1711549542.975743294   670 1.171012498    10.10.1.1 → 10.10.1.2    TCP 83 8081 → 45016 [PSH, ACK] Seq=1072 Ack=1089 Win=65152 Len=17 TSval=3171925888 TSecr=1047666176
1711549550.975743294   678 1.181229587    10.10.1.2 → 10.10.1.1    TCP 83 45016 → 8081 [PSH, ACK] Seq=1089 Ack=1089 Win=64256 Len=17 TSval=1047666187 TSecr=3171925888
1711549552.975743294   680 1.181334047    10.10.1.1 → 10.10.1.2    TCP 83 8081 → 45016 [PSH, ACK] Seq=1089 Ack=1106 Win=65152 Len=17 TSval=3171925898 TSecr=1047666187
1711549560.975743294   688 1.191551394    10.10.1.2 → 10.10.1.1    TCP 83 45016 → 8081 [PSH, ACK] Seq=1106 Ack=1106 Win=64256 Len=17 TSval=1047666197 TSecr=3171925898
1711549562.975743294   690 1.191654628    10.10.1.1 → 10.10.1.2    TCP 83 8081 → 45016 [PSH, ACK] Seq=1106 Ack=1123 Win=65152 Len=17 TSval=3171925908 TSecr=1047666197
1711549570.975743294   698 1.201870100    10.10.1.2 → 10.10.1.1    TCP 83 45016 → 8081 [PSH, ACK] Seq=1123 Ack=1123 Win=64256 Len=17 TSval=1047666207 TSecr=3171925908
1711549572.975743294   700 1.201971780    10.10.1.1 → 10.10.1.2    TCP 83 8081 → 45016 [PSH, ACK] Seq=1123 Ack=1140 Win=65152 Len=17 TSval=3171925919 TSecr=1047666207
1711549580.975743294   708 1.212186750    10.10.1.2 → 10.10.1.1    TCP 83 45016 → 8081 [PSH, ACK] Seq=1140 Ack=1140 Win=64256 Len=17 TSval=1047666218 TSecr=3171925919
1711549582.975743294   710 1.212289128    10.10.1.1 → 10.10.1.2    TCP 83 8081 → 45016 [PSH, ACK] Seq=1140 Ack=1157 Win=65152 Len=17 TSval=3171925929 TSecr=1047666218
1711549590.975743294   718 1.222508042    10.10.1.2 → 10.10.1.1    TCP 83 45016 → 8081 [PSH, ACK] Seq=1157 Ack=1157 Win=64256 Len=17 TSval=1047666228 TSecr=3171925929
1711549592.975743294   720 1.222609804    10.10.1.1 → 10.10.1.2    TCP 83 8081 → 45016 [PSH, ACK] Seq=1157 Ack=1174 Win=65152 Len=17 TSval=3171925939 TSecr=1047666228
1711549600.975743294   728 1.232825604    10.10.1.2 → 10.10.1.1    TCP 83 45016 → 8081 [PSH, ACK] Seq=1174 Ack=1174 Win=64256 Len=17 TSval=1047666238 TSecr=3171925939
1711549602.975743294   730 1.232927245    10.10.1.1 → 10.10.1.2    TCP 83 8081 → 45016 [PSH, ACK] Seq=1174 Ack=1191 Win=65152 Len=17 TSval=3171925949 TSecr=1047666238
1711549610.975743294   738 1.243141525    10.10.1.2 → 10.10.1.1    TCP 83 45016 → 8081 [PSH, ACK] Seq=1191 Ack=1191 Win=64256 Len=17 TSval=1047666249 TSecr=3171925949
1711549612.975743294   740 1.243244588    10.10.1.1 → 10.10.1.2    TCP 83 8081 → 45016 [PSH, ACK] Seq=1191 Ack=1208 Win=65152 Len=17 TSval=3171925960 TSecr=1047666249
1711549620.975743294   748 1.253462145    10.10.1.2 → 10.10.1.1    TCP 83 45016 → 8081 [PSH, ACK] Seq=1208 Ack=1208 Win=64256 Len=17 TSval=1047666259 TSecr=3171925960
1711549622.975743294   750 1.253564472    10.10.1.1 → 10.10.1.2    TCP 83 8081 → 45016 [PSH, ACK] Seq=1208 Ack=1225 Win=65152 Len=17 TSval=3171925970 TSecr=1047666259
1711549630.975743294   758 1.263782915    10.10.1.2 → 10.10.1.1    TCP 83 45016 → 8081 [PSH, ACK] Seq=1225 Ack=1225 Win=64256 Len=17 TSval=1047666269 TSecr=3171925970
1711549632.975743294   760 1.263884505    10.10.1.1 → 10.10.1.2    TCP 83 8081 → 45016 [PSH, ACK] Seq=1225 Ack=1242 Win=65152 Len=17 TSval=3171925980 TSecr=1047666269
1711549640.975743294   768 1.274098742    10.10.1.2 → 10.10.1.1    TCP 83 45016 → 8081 [PSH, ACK] Seq=1242 Ack=1242 Win=64256 Len=17 TSval=1047666280 TSecr=3171925980
1711549642.975743294   770 1.274200526    10.10.1.1 → 10.10.1.2    TCP 83 8081 → 45016 [PSH, ACK] Seq=1242 Ack=1259 Win=65152 Len=17 TSval=3171925991 TSecr=1047666280
1711549650.975743294   778 1.284416407    10.10.1.2 → 10.10.1.1    TCP 83 45016 → 8081 [PSH, ACK] Seq=1259 Ack=1259 Win=64256 Len=17 TSval=1047666290 TSecr=3171925991
1711549652.975743294   780 1.284519387    10.10.1.1 → 10.10.1.2    TCP 83 8081 → 45016 [PSH, ACK] Seq=1259 Ack=1276 Win=65152 Len=17 TSval=3171926001 TSecr=1047666290
1711549660.975743294   788 1.294737139    10.10.1.2 → 10.10.1.1    TCP 83 45016 → 8081 [PSH, ACK] Seq=1276 Ack=1276 Win=64256 Len=17 TSval=1047666300 TSecr=3171926001
1711549662.975743294   790 1.294838486    10.10.1.1 → 10.10.1.2    TCP 83 8081 → 45016 [PSH, ACK] Seq=1276 Ack=1293 Win=65152 Len=17 TSval=3171926011 TSecr=1047666300
1711549670.975743294   798 1.305061812    10.10.1.2 → 10.10.1.1    TCP 83 45016 → 8081 [PSH, ACK] Seq=1293 Ack=1293 Win=64256 Len=17 TSval=1047666311 TSecr=3171926011
1711549672.975743294   800 1.305166187    10.10.1.1 → 10.10.1.2    TCP 83 8081 → 45016 [PSH, ACK] Seq=1293 Ack=1310 Win=65152 Len=17 TSval=3171926022 TSecr=1047666311
1711549680.975743294   808 1.315391818    10.10.1.2 → 10.10.1.1    TCP 83 45016 → 8081 [PSH, ACK] Seq=1310 Ack=1310 Win=64256 Len=17 TSval=1047666321 TSecr=3171926022
1711549682.975743294   810 1.315494133    10.10.1.1 → 10.10.1.2    TCP 83 8081 → 45016 [PSH, ACK] Seq=1310 Ack=1327 Win=65152 Len=17 TSval=3171926032 TSecr=1047666321
1711549690.975743294   818 1.325714445    10.10.1.2 → 10.10.1.1    TCP 83 45016 → 8081 [PSH, ACK] Seq=1327 Ack=1327 Win=64256 Len=17 TSval=1047666331 TSecr=3171926032
1711549692.975743294   820 1.325814881    10.10.1.1 → 10.10.1.2    TCP 83 8081 → 45016 [PSH, ACK] Seq=1327 Ack=1344 Win=65152 Len=17 TSval=3171926042 TSecr=1047666331
1711549700.975743294   828 1.336032882    10.10.1.2 → 10.10.1.1    TCP 83 45016 → 8081 [PSH, ACK] Seq=1344 Ack=1344 Win=64256 Len=17 TSval=1047666342 TSecr=3171926042
1711549702.975743294   830 1.336138368    10.10.1.1 → 10.10.1.2    TCP 83 8081 → 45016 [PSH, ACK] Seq=1344 Ack=1361 Win=65152 Len=17 TSval=3171926053 TSecr=1047666342
1711549710.975743294   838 1.346357033    10.10.1.2 → 10.10.1.1    TCP 83 45016 → 8081 [PSH, ACK] Seq=1361 Ack=1361 Win=64256 Len=17 TSval=1047666352 TSecr=3171926053
1711549712.975743294   840 1.346458158    10.10.1.1 → 10.10.1.2    TCP 83 8081 → 45016 [PSH, ACK] Seq=1361 Ack=1378 Win=65152 Len=17 TSval=3171926063 TSecr=1047666352
1711549720.975743294   848 1.356674248    10.10.1.2 → 10.10.1.1    TCP 83 45016 → 8081 [PSH, ACK] Seq=1378 Ack=1378 Win=64256 Len=17 TSval=1047666362 TSecr=3171926063
1711549722.975743294   850 1.356776366    10.10.1.1 → 10.10.1.2    TCP 83 8081 → 45016 [PSH, ACK] Seq=1378 Ack=1395 Win=65152 Len=17 TSval=3171926073 TSecr=1047666362
1711549730.975743294   858 1.366992390    10.10.1.2 → 10.10.1.1    TCP 83 45016 → 8081 [PSH, ACK] Seq=1395 Ack=1395 Win=64256 Len=17 TSval=1047666372 TSecr=3171926073
1711549732.975743294   860 1.367095617    10.10.1.1 → 10.10.1.2    TCP 83 8081 → 45016 [PSH, ACK] Seq=1395 Ack=1412 Win=65152 Len=17 TSval=3171926084 TSecr=1047666372
1711549740.975743294   868 1.377312282    10.10.1.2 → 10.10.1.1    TCP 83 45016 → 8081 [PSH, ACK] Seq=1412 Ack=1412 Win=64256 Len=17 TSval=1047666383 TSecr=3171926084
1711549742.975743294   870 1.377415973    10.10.1.1 → 10.10.1.2    TCP 83 8081 → 45016 [PSH, ACK] Seq=1412 Ack=1429 Win=65152 Len=17 TSval=3171926094 TSecr=1047666383
1711549750.975743294   878 1.387633995    10.10.1.2 → 10.10.1.1    TCP 83 45016 → 8081 [PSH, ACK] Seq=1429 Ack=1429 Win=64256 Len=17 TSval=1047666393 TSecr=3171926094
1711549752.975743294   880 1.387736194    10.10.1.1 → 10.10.1.2    TCP 83 8081 → 45016 [PSH, ACK] Seq=1429 Ack=1446 Win=65152 Len=17 TSval=3171926104 TSecr=1047666393
1711549760.975743294   888 1.397952438    10.10.1.2 → 10.10.1.1    TCP 83 45016 → 8081 [PSH, ACK] Seq=1446 Ack=1446 Win=64256 Len=17 TSval=1047666403 TSecr=3171926104
1711549762.975743294   890 1.398058656    10.10.1.1 → 10.10.1.2    TCP 83 8081 → 45016 [PSH, ACK] Seq=1446 Ack=1463 Win=65152 Len=17 TSval=3171926115 TSecr=1047666403
1711549770.975743294   898 1.408275698    10.10.1.2 → 10.10.1.1    TCP 83 45016 → 8081 [PSH, ACK] Seq=1463 Ack=1463 Win=64256 Len=17 TSval=1047666414 TSecr=3171926115
1711549772.975743294   900 1.408377423    10.10.1.1 → 10.10.1.2    TCP 83 8081 → 45016 [PSH, ACK] Seq=1463 Ack=1480 Win=65152 Len=17 TSval=3171926125 TSecr=1047666414
1711549780.975743294   908 1.418592577    10.10.1.2 → 10.10.1.1    TCP 83 45016 → 8081 [PSH, ACK] Seq=1480 Ack=1480 Win=64256 Len=17 TSval=1047666424 TSecr=3171926125
1711549782.975743294   910 1.418694906    10.10.1.1 → 10.10.1.2    TCP 83 8081 → 45016 [PSH, ACK] Seq=1480 Ack=1497 Win=65152 Len=17 TSval=3171926135 TSecr=1047666424
1711549790.975743294   918 1.428912451    10.10.1.2 → 10.10.1.1    TCP 83 45016 → 8081 [PSH, ACK] Seq=1497 Ack=1497 Win=64256 Len=17 TSval=1047666434 TSecr=3171926135
1711549792.975743294   920 1.429016172    10.10.1.1 → 10.10.1.2    TCP 83 8081 → 45016 [PSH, ACK] Seq=1497 Ack=1514 Win=65152 Len=17 TSval=3171926146 TSecr=1047666434
1711549800.975743294   928 1.439231796    10.10.1.2 → 10.10.1.1    TCP 83 45016 → 8081 [PSH, ACK] Seq=1514 Ack=1514 Win=64256 Len=17 TSval=1047666445 TSecr=3171926146
1711549802.975743294   930 1.439333917    10.10.1.1 → 10.10.1.2    TCP 83 8081 → 45016 [PSH, ACK] Seq=1514 Ack=1531 Win=65152 Len=17 TSval=3171926156 TSecr=1047666445
1711549810.975743294   938 1.449549878    10.10.1.2 → 10.10.1.1    TCP 83 45016 → 8081 [PSH, ACK] Seq=1531 Ack=1531 Win=64256 Len=17 TSval=1047666455 TSecr=3171926156
1711549812.975743294   940 1.449652409    10.10.1.1 → 10.10.1.2    TCP 83 8081 → 45016 [PSH, ACK] Seq=1531 Ack=1548 Win=65152 Len=17 TSval=3171926166 TSecr=1047666455
1711549820.975743294   948 1.459870437    10.10.1.2 → 10.10.1.1    TCP 83 45016 → 8081 [PSH, ACK] Seq=1548 Ack=1548 Win=64256 Len=17 TSval=1047666465 TSecr=3171926166
1711549822.975743294   950 1.459972651    10.10.1.1 → 10.10.1.2    TCP 83 8081 → 45016 [PSH, ACK] Seq=1548 Ack=1565 Win=65152 Len=17 TSval=3171926177 TSecr=1047666465
1711549830.975743294   958 1.470187584    10.10.1.2 → 10.10.1.1    TCP 83 45016 → 8081 [PSH, ACK] Seq=1565 Ack=1565 Win=64256 Len=17 TSval=1047666476 TSecr=3171926177
1711549832.975743294   960 1.470289773    10.10.1.1 → 10.10.1.2    TCP 83 8081 → 45016 [PSH, ACK] Seq=1565 Ack=1582 Win=65152 Len=17 TSval=3171926187 TSecr=1047666476
1711549840.975743294   968 1.480508513    10.10.1.2 → 10.10.1.1    TCP 83 45016 → 8081 [PSH, ACK] Seq=1582 Ack=1582 Win=64256 Len=17 TSval=1047666486 TSecr=3171926187
1711549842.975743294   970 1.480610692    10.10.1.1 → 10.10.1.2    TCP 83 8081 → 45016 [PSH, ACK] Seq=1582 Ack=1599 Win=65152 Len=17 TSval=3171926197 TSecr=1047666486
1711549850.975743294   978 1.490829881    10.10.1.2 → 10.10.1.1    TCP 83 45016 → 8081 [PSH, ACK] Seq=1599 Ack=1599 Win=64256 Len=17 TSval=1047666496 TSecr=3171926197
1711549852.975743294   980 1.490930399    10.10.1.1 → 10.10.1.2    TCP 83 8081 → 45016 [PSH, ACK] Seq=1599 Ack=1616 Win=65152 Len=17 TSval=3171926207 TSecr=1047666496
1711549860.975743294   988 1.501147797    10.10.1.2 → 10.10.1.1    TCP 83 45016 → 8081 [PSH, ACK] Seq=1616 Ack=1616 Win=64256 Len=17 TSval=1047666507 TSecr=3171926207
1711549862.975743294   990 1.501247573    10.10.1.1 → 10.10.1.2    TCP 83 8081 → 45016 [PSH, ACK] Seq=1616 Ack=1633 Win=65152 Len=17 TSval=3171926218 TSecr=1047666507
1711549870.975743294   998 1.511466135    10.10.1.2 → 10.10.1.1    TCP 83 45016 → 8081 [PSH, ACK] Seq=1633 Ack=1633 Win=64256 Len=17 TSval=1047666517 TSecr=3171926218
1711549872.975743294  1000 1.511567995    10.10.1.1 → 10.10.1.2    TCP 83 8081 → 45016 [PSH, ACK] Seq=1633 Ack=1650 Win=65152 Len=17 TSval=3171926228 TSecr=1047666517
1711549880.975743294  1008 1.521784037    10.10.1.2 → 10.10.1.1    TCP 83 45016 → 8081 [PSH, ACK] Seq=1650 Ack=1650 Win=64256 Len=17 TSval=1047666527 TSecr=3171926228
1711549882.975743294  1010 1.521884291    10.10.1.1 → 10.10.1.2    TCP 83 8081 → 45016 [PSH, ACK] Seq=1650 Ack=1667 Win=65152 Len=17 TSval=3171926238 TSecr=1047666527
1711549890.975743294  1018 1.532099476    10.10.1.2 → 10.10.1.1    TCP 83 45016 → 8081 [PSH, ACK] Seq=1667 Ack=1667 Win=64256 Len=17 TSval=1047666538 TSecr=3171926238
1711549892.975743294  1020 1.532203509    10.10.1.1 → 10.10.1.2    TCP 83 8081 → 45016 [PSH, ACK] Seq=1667 Ack=1684 Win=65152 Len=17 TSval=3171926249 TSecr=1047666538
1711549900.975743294  1028 1.542421942    10.10.1.2 → 10.10.1.1    TCP 83 45016 → 8081 [PSH, ACK] Seq=1684 Ack=1684 Win=64256 Len=17 TSval=1047666548 TSecr=3171926249
1711549902.975743294  1030 1.542524815    10.10.1.1 → 10.10.1.2    TCP 83 8081 → 45016 [PSH, ACK] Seq=1684 Ack=1701 Win=65152 Len=17 TSval=3171926259 TSecr=1047666548
1711549910.975743294  1038 1.552739809    10.10.1.2 → 10.10.1.1    TCP 83 45016 → 8081 [PSH, ACK] Seq=1701 Ack=1701 Win=64256 Len=17 TSval=1047666558 TSecr=3171926259
1711549912.975743294  1040 1.552840803    10.10.1.1 → 10.10.1.2    TCP 83 8081 → 45016 [PSH, ACK] Seq=1701 Ack=1718 Win=65152 Len=17 TSval=3171926269 TSecr=1047666558
1711549920.975743294  1048 1.563055630    10.10.1.2 → 10.10.1.1    TCP 83 45016 → 8081 [PSH, ACK] Seq=1718 Ack=1718 Win=64256 Len=17 TSval=1047666569 TSecr=3171926269
1711549922.975743294  1050 1.563157375    10.10.1.1 → 10.10.1.2    TCP 83 8081 → 45016 [PSH, ACK] Seq=1718 Ack=1735 Win=65152 Len=17 TSval=3171926280 TSecr=1047666569
1711549930.975743294  1058 1.573387041    10.10.1.2 → 10.10.1.1    TCP 83 45016 → 8081 [PSH, ACK] Seq=1735 Ack=1735 Win=64256 Len=17 TSval=1047666579 TSecr=3171926280
1711549932.975743294  1060 1.573486834    10.10.1.1 → 10.10.1.2    TCP 83 8081 → 45016 [PSH, ACK] Seq=1735 Ack=1752 Win=65152 Len=17 TSval=3171926290 TSecr=1047666579
1711549940.975743294  1068 1.583702762    10.10.1.2 → 10.10.1.1    TCP 83 45016 → 8081 [PSH, ACK] Seq=1752 Ack=1752 Win=64256 Len=17 TSval=1047666589 TSecr=3171926290
1711549942.975743294  1070 1.583804785    10.10.1.1 → 10.10.1.2    TCP 83 8081 → 45016 [PSH, ACK] Seq=1752 Ack=1769 Win=65152 Len=17 TSval=3171926300 TSecr=1047666589
1711549950.975743294  1078 1.594028119    10.10.1.2 → 10.10.1.1    TCP 83 45016 → 8081 [PSH, ACK] Seq=1769 Ack=1769 Win=64256 Len=17 TSval=1047666600 TSecr=3171926300
1711549952.975743294  1080 1.594134061    10.10.1.1 → 10.10.1.2    TCP 83 8081 → 45016 [PSH, ACK] Seq=1769 Ack=1786 Win=65152 Len=17 TSval=3171926311 TSecr=1047666600
1711549960.975743294  1088 1.604355202    10.10.1.2 → 10.10.1.1    TCP 83 45016 → 8081 [PSH, ACK] Seq=1786 Ack=1786 Win=64256 Len=17 TSval=1047666610 TSecr=3171926311
1711549962.975743294  1090 1.604456727    10.10.1.1 → 10.10.1.2    TCP 83 8081 → 45016 [PSH, ACK] Seq=1786 Ack=1803 Win=65152 Len=17 TSval=3171926321 TSecr=1047666610
1711549970.975743294  1098 1.614676429    10.10.1.2 → 10.10.1.1    TCP 83 45016 → 8081 [PSH, ACK] Seq=1803 Ack=1803 Win=64256 Len=17 TSval=1047666620 TSecr=3171926321
1711549972.975743294  1100 1.614777265    10.10.1.1 → 10.10.1.2    TCP 83 8081 → 45016 [PSH, ACK] Seq=1803 Ack=1820 Win=65152 Len=17 TSval=3171926331 TSecr=1047666620
1711549980.975743294  1108 1.624998990    10.10.1.2 → 10.10.1.1    TCP 83 45016 → 8081 [PSH, ACK] Seq=1820 Ack=1820 Win=64256 Len=17 TSval=1047666630 TSecr=3171926331
1711549982.975743294  1110 1.625099788    10.10.1.1 → 10.10.1.2    TCP 83 8081 → 45016 [PSH, ACK] Seq=1820 Ack=1837 Win=65152 Len=17 TSval=3171926342 TSecr=1047666630
1711549990.975743294  1118 1.635316690    10.10.1.2 → 10.10.1.1    TCP 83 45016 → 8081 [PSH, ACK] Seq=1837 Ack=1837 Win=64256 Len=17 TSval=1047666641 TSecr=3171926342
1711549992.975743294  1120 1.635422482    10.10.1.1 → 10.10.1.2    TCP 83 8081 → 45016 [PSH, ACK] Seq=1837 Ack=1854 Win=65152 Len=17 TSval=3171926352 TSecr=1047666641
1711550000.975743294  1128 1.645639693    10.10.1.2 → 10.10.1.1    TCP 83 45016 → 8081 [PSH, ACK] Seq=1854 Ack=1854 Win=64256 Len=17 TSval=1047666651 TSecr=3171926352
1711550002.975743294  1130 1.645740818    10.10.1.1 → 10.10.1.2    TCP 83 8081 → 45016 [PSH, ACK] Seq=1854 Ack=1871 Win=65152 Len=17 TSval=3171926362 TSecr=1047666651
1711550010.975743294  1138 1.655958119    10.10.1.2 → 10.10.1.1    TCP 83 45016 → 8081 [PSH, ACK] Seq=1871 Ack=1871 Win=64256 Len=17 TSval=1047666661 TSecr=3171926362
1711550012.975743294  1140 1.656060452    10.10.1.1 → 10.10.1.2    TCP 83 8081 → 45016 [PSH, ACK] Seq=1871 Ack=1888 Win=65152 Len=17 TSval=3171926373 TSecr=1047666661
1711550020.975743294  1148 1.666279256    10.10.1.2 → 10.10.1.1    TCP 83 45016 → 8081 [PSH, ACK] Seq=1888 Ack=1888 Win=64256 Len=17 TSval=1047666672 TSecr=3171926373
1711550022.975743294  1150 1.666409936    10.10.1.1 → 10.10.1.2    TCP 83 8081 → 45016 [PSH, ACK] Seq=1888 Ack=1905 Win=65152 Len=17 TSval=3171926383 TSecr=1047666672
1711550030.975743294  1158 1.676627699    10.10.1.2 → 10.10.1.1    TCP 83 45016 → 8081 [PSH, ACK] Seq=1905 Ack=1905 Win=64256 Len=17 TSval=1047666682 TSecr=3171926383
1711550032.975743294  1160 1.676758176    10.10.1.1 → 10.10.1.2    TCP 83 8081 → 45016 [PSH, ACK] Seq=1905 Ack=1922 Win=65152 Len=17 TSval=3171926393 TSecr=1047666682
1711550040.975743294  1168 1.686975960    10.10.1.2 → 10.10.1.1    TCP 83 45016 → 8081 [PSH, ACK] Seq=1922 Ack=1922 Win=64256 Len=17 TSval=1047666692 TSecr=3171926393
1711550043.975743294  1171 1.687158322    10.10.1.1 → 10.10.1.2    TCP 83 8081 → 45016 [PSH, ACK] Seq=1922 Ack=1939 Win=65152 Len=17 TSval=3171926404 TSecr=1047666692
1711550050.975743294  1178 1.697373538    10.10.1.2 → 10.10.1.1    TCP 83 45016 → 8081 [PSH, ACK] Seq=1939 Ack=1939 Win=64256 Len=17 TSval=1047666703 TSecr=3171926404
1711550052.975743294  1180 1.697503759    10.10.1.1 → 10.10.1.2    TCP 83 8081 → 45016 [PSH, ACK] Seq=1939 Ack=1956 Win=65152 Len=17 TSval=3171926414 TSecr=1047666703
1711550060.975743294  1188 1.707720781    10.10.1.2 → 10.10.1.1    TCP 83 45016 → 8081 [PSH, ACK] Seq=1956 Ack=1956 Win=64256 Len=17 TSval=1047666713 TSecr=3171926414
1711550062.975743294  1190 1.707850451    10.10.1.1 → 10.10.1.2    TCP 83 8081 → 45016 [PSH, ACK] Seq=1956 Ack=1973 Win=65152 Len=17 TSval=3171926424 TSecr=1047666713
1711550070.975743294  1198 1.718031152    10.10.1.2 → 10.10.1.1    TCP 83 45016 → 8081 [PSH, ACK] Seq=1973 Ack=1973 Win=64256 Len=17 TSval=1047666724 TSecr=3171926424
1711550072.975743294  1200 1.718161738    10.10.1.1 → 10.10.1.2    TCP 83 8081 → 45016 [PSH, ACK] Seq=1973 Ack=1990 Win=65152 Len=17 TSval=3171926435 TSecr=1047666724
1711550080.975743294  1208 1.728377479    10.10.1.2 → 10.10.1.1    TCP 83 45016 → 8081 [PSH, ACK] Seq=1990 Ack=1990 Win=64256 Len=17 TSval=1047666734 TSecr=3171926435
1711550082.975743294  1210 1.728508386    10.10.1.1 → 10.10.1.2    TCP 83 8081 → 45016 [PSH, ACK] Seq=1990 Ack=2007 Win=65152 Len=17 TSval=3171926445 TSecr=1047666734
