1711548857.935889721    36 0.525226160    10.10.1.2 → 10.10.1.1    TCP 83 56294 → 8081 [PSH, ACK] Seq=1 Ack=1 Win=64256 Len=17 TSval=1047614491 TSecr=3171873942
1711548861.935889721    40 0.525490432    10.10.1.1 → 10.10.1.2    TCP 83 8081 → 56294 [PSH, ACK] Seq=1 Ack=18 Win=65152 Len=17 TSval=3171874202 TSecr=1047614491
1711548869.935889721    48 0.535711971    10.10.1.2 → 10.10.1.1    TCP 83 56294 → 8081 [PSH, ACK] Seq=18 Ack=18 Win=64256 Len=17 TSval=1047614502 TSecr=3171874202
1711548872.935889721    51 0.535807323    10.10.1.1 → 10.10.1.2    TCP 83 8081 → 56294 [PSH, ACK] Seq=18 Ack=35 Win=65152 Len=17 TSval=3171874213 TSecr=1047614502
1711548879.935889721    58 0.546026418    10.10.1.2 → 10.10.1.1    TCP 83 56294 → 8081 [PSH, ACK] Seq=35 Ack=35 Win=64256 Len=17 TSval=1047614512 TSecr=3171874213
1711548882.935889721    61 0.546127510    10.10.1.1 → 10.10.1.2    TCP 83 8081 → 56294 [PSH, ACK] Seq=35 Ack=52 Win=65152 Len=17 TSval=3171874223 TSecr=1047614512
1711548889.935889721    68 0.556342384    10.10.1.2 → 10.10.1.1    TCP 83 56294 → 8081 [PSH, ACK] Seq=52 Ack=52 Win=64256 Len=17 TSval=1047614522 TSecr=3171874223
1711548892.935889721    71 0.556473156    10.10.1.1 → 10.10.1.2    TCP 83 8081 → 56294 [PSH, ACK] Seq=52 Ack=69 Win=65152 Len=17 TSval=3171874233 TSecr=1047614522
1711548899.935889721    78 0.566690428    10.10.1.2 → 10.10.1.1    TCP 83 56294 → 8081 [PSH, ACK] Seq=69 Ack=69 Win=64256 Len=17 TSval=1047614533 TSecr=3171874233
1711548902.935889721    81 0.566819786    10.10.1.1 → 10.10.1.2    TCP 83 8081 → 56294 [PSH, ACK] Seq=69 Ack=86 Win=65152 Len=17 TSval=3171874244 TSecr=1047614533
1711548909.935889721    88 0.577044114    10.10.1.2 → 10.10.1.1    TCP 83 56294 → 8081 [PSH, ACK] Seq=86 Ack=86 Win=64256 Len=17 TSval=1047614543 TSecr=3171874244
1711548911.935889721    90 0.577174565    10.10.1.1 → 10.10.1.2    TCP 83 8081 → 56294 [PSH, ACK] Seq=86 Ack=103 Win=65152 Len=17 TSval=3171874254 TSecr=1047614543
1711548919.935889721    98 0.587392765    10.10.1.2 → 10.10.1.1    TCP 83 56294 → 8081 [PSH, ACK] Seq=103 Ack=103 Win=64256 Len=17 TSval=1047614553 TSecr=3171874254
1711548921.935889721   100 0.587522491    10.10.1.1 → 10.10.1.2    TCP 83 8081 → 56294 [PSH, ACK] Seq=103 Ack=120 Win=65152 Len=17 TSval=3171874265 TSecr=1047614553
1711548929.935889721   108 0.597739731    10.10.1.2 → 10.10.1.1    TCP 83 56294 → 8081 [PSH, ACK] Seq=120 Ack=120 Win=64256 Len=17 TSval=1047614564 TSecr=3171874265
1711548931.935889721   110 0.597869627    10.10.1.1 → 10.10.1.2    TCP 83 8081 → 56294 [PSH, ACK] Seq=120 Ack=137 Win=65152 Len=17 TSval=3171874275 TSecr=1047614564
1711548939.935889721   118 0.608087500    10.10.1.2 → 10.10.1.1    TCP 83 56294 → 8081 [PSH, ACK] Seq=137 Ack=137 Win=64256 Len=17 TSval=1047614574 TSecr=3171874275
1711548941.935889721   120 0.608189625    10.10.1.1 → 10.10.1.2    TCP 83 8081 → 56294 [PSH, ACK] Seq=137 Ack=154 Win=65152 Len=17 TSval=3171874285 TSecr=1047614574
1711548949.935889721   128 0.618407952    10.10.1.2 → 10.10.1.1    TCP 83 56294 → 8081 [PSH, ACK] Seq=154 Ack=154 Win=64256 Len=17 TSval=1047614584 TSecr=3171874285
1711548951.935889721   130 0.618512317    10.10.1.1 → 10.10.1.2    TCP 83 8081 → 56294 [PSH, ACK] Seq=154 Ack=171 Win=65152 Len=17 TSval=3171874296 TSecr=1047614584
1711548959.935889721   138 0.628730138    10.10.1.2 → 10.10.1.1    TCP 83 56294 → 8081 [PSH, ACK] Seq=171 Ack=171 Win=64256 Len=17 TSval=1047614595 TSecr=3171874296
1711548961.935889721   140 0.628832347    10.10.1.1 → 10.10.1.2    TCP 83 8081 → 56294 [PSH, ACK] Seq=171 Ack=188 Win=65152 Len=17 TSval=3171874306 TSecr=1047614595
1711548969.935889721   148 0.639051699    10.10.1.2 → 10.10.1.1    TCP 83 56294 → 8081 [PSH, ACK] Seq=188 Ack=188 Win=64256 Len=17 TSval=1047614605 TSecr=3171874306
1711548971.935889721   150 0.639154046    10.10.1.1 → 10.10.1.2    TCP 83 8081 → 56294 [PSH, ACK] Seq=188 Ack=205 Win=65152 Len=17 TSval=3171874316 TSecr=1047614605
1711548979.935889721   158 0.649370345    10.10.1.2 → 10.10.1.1    TCP 83 56294 → 8081 [PSH, ACK] Seq=205 Ack=205 Win=64256 Len=17 TSval=1047614615 TSecr=3171874316
1711548981.935889721   160 0.649472916    10.10.1.1 → 10.10.1.2    TCP 83 8081 → 56294 [PSH, ACK] Seq=205 Ack=222 Win=65152 Len=17 TSval=3171874326 TSecr=1047614615
1711548989.935889721   168 0.659690185    10.10.1.2 → 10.10.1.1    TCP 83 56294 → 8081 [PSH, ACK] Seq=222 Ack=222 Win=64256 Len=17 TSval=1047614626 TSecr=3171874326
1711548991.935889721   170 0.659793226    10.10.1.1 → 10.10.1.2    TCP 83 8081 → 56294 [PSH, ACK] Seq=222 Ack=239 Win=65152 Len=17 TSval=3171874337 TSecr=1047614626
1711548999.935889721   178 0.670007554    10.10.1.2 → 10.10.1.1    TCP 83 56294 → 8081 [PSH, ACK] Seq=239 Ack=239 Win=64256 Len=17 TSval=1047614636 TSecr=3171874337
1711549001.935889721   180 0.670110089    10.10.1.1 → 10.10.1.2    TCP 83 8081 → 56294 [PSH, ACK] Seq=239 Ack=256 Win=65152 Len=17 TSval=3171874347 TSecr=1047614636
1711549009.935889721   188 0.680326414    10.10.1.2 → 10.10.1.1    TCP 83 56294 → 8081 [PSH, ACK] Seq=256 Ack=256 Win=64256 Len=17 TSval=1047614646 TSecr=3171874347
1711549011.935889721   190 0.680428690    10.10.1.1 → 10.10.1.2    TCP 83 8081 → 56294 [PSH, ACK] Seq=256 Ack=273 Win=65152 Len=17 TSval=3171874357 TSecr=1047614646
1711549019.935889721   198 0.690644388    10.10.1.2 → 10.10.1.1    TCP 83 56294 → 8081 [PSH, ACK] Seq=273 Ack=273 Win=64256 Len=17 TSval=1047614657 TSecr=3171874357
1711549021.935889721   200 0.690751309    10.10.1.1 → 10.10.1.2    TCP 83 8081 → 56294 [PSH, ACK] Seq=273 Ack=290 Win=65152 Len=17 TSval=3171874368 TSecr=1047614657
1711549030.935889721   209 0.700967518    10.10.1.2 → 10.10.1.1    TCP 83 56294 → 8081 [PSH, ACK] Seq=290 Ack=290 Win=64256 Len=17 TSval=1047614667 TSecr=3171874368
1711549032.935889721   211 0.701070405    10.10.1.1 → 10.10.1.2    TCP 83 8081 → 56294 [PSH, ACK] Seq=290 Ack=307 Win=65152 Len=17 TSval=3171874378 TSecr=1047614667
1711549040.935889721   219 0.711287561    10.10.1.2 → 10.10.1.1    TCP 83 56294 → 8081 [PSH, ACK] Seq=307 Ack=307 Win=64256 Len=17 TSval=1047614677 TSecr=3171874378
1711549042.935889721   221 0.711391311    10.10.1.1 → 10.10.1.2    TCP 83 8081 → 56294 [PSH, ACK] Seq=307 Ack=324 Win=65152 Len=17 TSval=3171874388 TSecr=1047614677
1711549050.935889721   229 0.721606404    10.10.1.2 → 10.10.1.1    TCP 83 56294 → 8081 [PSH, ACK] Seq=324 Ack=324 Win=64256 Len=17 TSval=1047614688 TSecr=3171874388
1711549052.935889721   231 0.721709161    10.10.1.1 → 10.10.1.2    TCP 83 8081 → 56294 [PSH, ACK] Seq=324 Ack=341 Win=65152 Len=17 TSval=3171874399 TSecr=1047614688
1711549060.935889721   239 0.731924615    10.10.1.2 → 10.10.1.1    TCP 83 56294 → 8081 [PSH, ACK] Seq=341 Ack=341 Win=64256 Len=17 TSval=1047614698 TSecr=3171874399
1711549062.935889721   241 0.732027349    10.10.1.1 → 10.10.1.2    TCP 83 8081 → 56294 [PSH, ACK] Seq=341 Ack=358 Win=65152 Len=17 TSval=3171874409 TSecr=1047614698
1711549070.935889721   249 0.742243240    10.10.1.2 → 10.10.1.1    TCP 83 56294 → 8081 [PSH, ACK] Seq=358 Ack=358 Win=64256 Len=17 TSval=1047614708 TSecr=3171874409
1711549072.935889721   251 0.742346114    10.10.1.1 → 10.10.1.2    TCP 83 8081 → 56294 [PSH, ACK] Seq=358 Ack=375 Win=65152 Len=17 TSval=3171874419 TSecr=1047614708
1711549080.935889721   259 0.752561799    10.10.1.2 → 10.10.1.1    TCP 83 56294 → 8081 [PSH, ACK] Seq=375 Ack=375 Win=64256 Len=17 TSval=1047614719 TSecr=3171874419
1711549082.935889721   261 0.752664560    10.10.1.1 → 10.10.1.2    TCP 83 8081 → 56294 [PSH, ACK] Seq=375 Ack=392 Win=65152 Len=17 TSval=3171874430 TSecr=1047614719
1711549090.935889721   269 0.762895151    10.10.1.2 → 10.10.1.1    TCP 83 56294 → 8081 [PSH, ACK] Seq=392 Ack=392 Win=64256 Len=17 TSval=1047614729 TSecr=3171874430
1711549092.935889721   271 0.762995472    10.10.1.1 → 10.10.1.2    TCP 83 8081 → 56294 [PSH, ACK] Seq=392 Ack=409 Win=65152 Len=17 TSval=3171874440 TSecr=1047614729
1711549100.935889721   279 0.773214009    10.10.1.2 → 10.10.1.1    TCP 83 56294 → 8081 [PSH, ACK] Seq=409 Ack=409 Win=64256 Len=17 TSval=1047614739 TSecr=3171874440
1711549102.935889721   281 0.773318071    10.10.1.1 → 10.10.1.2    TCP 83 8081 → 56294 [PSH, ACK] Seq=409 Ack=426 Win=65152 Len=17 TSval=3171874450 TSecr=1047614739
1711549110.935889721   289 0.783539826    10.10.1.2 → 10.10.1.1    TCP 83 56294 → 8081 [PSH, ACK] Seq=426 Ack=426 Win=64256 Len=17 TSval=1047614750 TSecr=3171874450
1711549112.935889721   291 0.783641857    10.10.1.1 → 10.10.1.2    TCP 83 8081 → 56294 [PSH, ACK] Seq=426 Ack=443 Win=65152 Len=17 TSval=3171874461 TSecr=1047614750
1711549120.935889721   299 0.793861430    10.10.1.2 → 10.10.1.1    TCP 83 56294 → 8081 [PSH, ACK] Seq=443 Ack=443 Win=64256 Len=17 TSval=1047614760 TSecr=3171874461
1711549122.935889721   301 0.793962468    10.10.1.1 → 10.10.1.2    TCP 83 8081 → 56294 [PSH, ACK] Seq=443 Ack=460 Win=65152 Len=17 TSval=3171874471 TSecr=1047614760
1711549130.935889721   309 0.804178816    10.10.1.2 → 10.10.1.1    TCP 83 56294 → 8081 [PSH, ACK] Seq=460 Ack=460 Win=64256 Len=17 TSval=1047614770 TSecr=3171874471
1711549132.935889721   311 0.804281353    10.10.1.1 → 10.10.1.2    TCP 83 8081 → 56294 [PSH, ACK] Seq=460 Ack=477 Win=65152 Len=17 TSval=3171874481 TSecr=1047614770
1711549140.935889721   319 0.814498973    10.10.1.2 → 10.10.1.1    TCP 83 56294 → 8081 [PSH, ACK] Seq=477 Ack=477 Win=64256 Len=17 TSval=1047614780 TSecr=3171874481
1711549142.935889721   321 0.814601389    10.10.1.1 → 10.10.1.2    TCP 83 8081 → 56294 [PSH, ACK] Seq=477 Ack=494 Win=65152 Len=17 TSval=3171874492 TSecr=1047614780
1711549150.935889721   329 0.824771350    10.10.1.2 → 10.10.1.1    TCP 83 56294 → 8081 [PSH, ACK] Seq=494 Ack=494 Win=64256 Len=17 TSval=1047614791 TSecr=3171874492
1711549152.935889721   331 0.824903641    10.10.1.1 → 10.10.1.2    TCP 83 8081 → 56294 [PSH, ACK] Seq=494 Ack=511 Win=65152 Len=17 TSval=3171874502 TSecr=1047614791
1711549160.935889721   339 0.835122347    10.10.1.2 → 10.10.1.1    TCP 83 56294 → 8081 [PSH, ACK] Seq=511 Ack=511 Win=64256 Len=17 TSval=1047614801 TSecr=3171874502
1711549162.935889721   341 0.835225100    10.10.1.1 → 10.10.1.2    TCP 83 8081 → 56294 [PSH, ACK] Seq=511 Ack=528 Win=65152 Len=17 TSval=3171874512 TSecr=1047614801
1711549170.935889721   349 0.845440483    10.10.1.2 → 10.10.1.1    TCP 83 56294 → 8081 [PSH, ACK] Seq=528 Ack=528 Win=64256 Len=17 TSval=1047614811 TSecr=3171874512
1711549172.935889721   351 0.845542449    10.10.1.1 → 10.10.1.2    TCP 83 8081 → 56294 [PSH, ACK] Seq=528 Ack=545 Win=65152 Len=17 TSval=3171874523 TSecr=1047614811
1711549180.935889721   359 0.855759065    10.10.1.2 → 10.10.1.1    TCP 83 56294 → 8081 [PSH, ACK] Seq=545 Ack=545 Win=64256 Len=17 TSval=1047614822 TSecr=3171874523
1711549182.935889721   361 0.855861681    10.10.1.1 → 10.10.1.2    TCP 83 8081 → 56294 [PSH, ACK] Seq=545 Ack=562 Win=65152 Len=17 TSval=3171874533 TSecr=1047614822
1711549190.935889721   369 0.866077036    10.10.1.2 → 10.10.1.1    TCP 83 56294 → 8081 [PSH, ACK] Seq=562 Ack=562 Win=64256 Len=17 TSval=1047614832 TSecr=3171874533
1711549192.935889721   371 0.866179175    10.10.1.1 → 10.10.1.2    TCP 83 8081 → 56294 [PSH, ACK] Seq=562 Ack=579 Win=65152 Len=17 TSval=3171874543 TSecr=1047614832
1711549200.935889721   379 0.876395475    10.10.1.2 → 10.10.1.1    TCP 83 56294 → 8081 [PSH, ACK] Seq=579 Ack=579 Win=64256 Len=17 TSval=1047614842 TSecr=3171874543
1711549202.935889721   381 0.876518207    10.10.1.1 → 10.10.1.2    TCP 83 8081 → 56294 [PSH, ACK] Seq=579 Ack=596 Win=65152 Len=17 TSval=3171874553 TSecr=1047614842
1711549210.935889721   389 0.886734910    10.10.1.2 → 10.10.1.1    TCP 83 56294 → 8081 [PSH, ACK] Seq=596 Ack=596 Win=64256 Len=17 TSval=1047614853 TSecr=3171874553
1711549212.935889721   391 0.886836923    10.10.1.1 → 10.10.1.2    TCP 83 8081 → 56294 [PSH, ACK] Seq=596 Ack=613 Win=65152 Len=17 TSval=3171874564 TSecr=1047614853
1711549220.935889721   399 0.897054831    10.10.1.2 → 10.10.1.1    TCP 83 56294 → 8081 [PSH, ACK] Seq=613 Ack=613 Win=64256 Len=17 TSval=1047614863 TSecr=3171874564
1711549222.935889721   401 0.897156521    10.10.1.1 → 10.10.1.2    TCP 83 8081 → 56294 [PSH, ACK] Seq=613 Ack=630 Win=65152 Len=17 TSval=3171874574 TSecr=1047614863
1711549230.935889721   409 0.907372154    10.10.1.2 → 10.10.1.1    TCP 83 56294 → 8081 [PSH, ACK] Seq=630 Ack=630 Win=64256 Len=17 TSval=1047614873 TSecr=3171874574
1711549232.935889721   411 0.907473719    10.10.1.1 → 10.10.1.2    TCP 83 8081 → 56294 [PSH, ACK] Seq=630 Ack=647 Win=65152 Len=17 TSval=3171874584 TSecr=1047614873
1711549240.935889721   419 0.917691533    10.10.1.2 → 10.10.1.1    TCP 83 56294 → 8081 [PSH, ACK] Seq=647 Ack=647 Win=64256 Len=17 TSval=1047614884 TSecr=3171874584
1711549242.935889721   421 0.917794592    10.10.1.1 → 10.10.1.2    TCP 83 8081 → 56294 [PSH, ACK] Seq=647 Ack=664 Win=65152 Len=17 TSval=3171874595 TSecr=1047614884
1711549250.935889721   429 0.928009355    10.10.1.2 → 10.10.1.1    TCP 83 56294 → 8081 [PSH, ACK] Seq=664 Ack=664 Win=64256 Len=17 TSval=1047614894 TSecr=3171874595
1711549252.935889721   431 0.928111452    10.10.1.1 → 10.10.1.2    TCP 83 8081 → 56294 [PSH, ACK] Seq=664 Ack=681 Win=65152 Len=17 TSval=3171874605 TSecr=1047614894
1711549260.935889721   439 0.938327781    10.10.1.2 → 10.10.1.1    TCP 83 56294 → 8081 [PSH, ACK] Seq=681 Ack=681 Win=64256 Len=17 TSval=1047614904 TSecr=3171874605
1711549262.935889721   441 0.938447124    10.10.1.1 → 10.10.1.2    TCP 83 8081 → 56294 [PSH, ACK] Seq=681 Ack=698 Win=65152 Len=17 TSval=3171874615 TSecr=1047614904
1711549270.935889721   449 0.948661687    10.10.1.2 → 10.10.1.1    TCP 83 56294 → 8081 [PSH, ACK] Seq=698 Ack=698 Win=64256 Len=17 TSval=1047614915 TSecr=3171874615
1711549272.935889721   451 0.948762832    10.10.1.1 → 10.10.1.2    TCP 83 8081 → 56294 [PSH, ACK] Seq=698 Ack=715 Win=65152 Len=17 TSval=3171874626 TSecr=1047614915
1711549280.935889721   459 0.958977679    10.10.1.2 → 10.10.1.1    TCP 83 56294 → 8081 [PSH, ACK] Seq=715 Ack=715 Win=64256 Len=17 TSval=1047614925 TSecr=3171874626
1711549282.935889721   461 0.959080292    10.10.1.1 → 10.10.1.2    TCP 83 8081 → 56294 [PSH, ACK] Seq=715 Ack=732 Win=65152 Len=17 TSval=3171874636 TSecr=1047614925
1711549290.935889721   469 0.969295632    10.10.1.2 → 10.10.1.1    TCP 83 56294 → 8081 [PSH, ACK] Seq=732 Ack=732 Win=64256 Len=17 TSval=1047614935 TSecr=3171874636
1711549292.935889721   471 0.969398358    10.10.1.1 → 10.10.1.2    TCP 83 8081 → 56294 [PSH, ACK] Seq=732 Ack=749 Win=65152 Len=17 TSval=3171874646 TSecr=1047614935
1711549300.935889721   479 0.979614954    10.10.1.2 → 10.10.1.1    TCP 83 56294 → 8081 [PSH, ACK] Seq=749 Ack=749 Win=64256 Len=17 TSval=1047614946 TSecr=3171874646
1711549302.935889721   481 0.979717729    10.10.1.1 → 10.10.1.2    TCP 83 8081 → 56294 [PSH, ACK] Seq=749 Ack=766 Win=65152 Len=17 TSval=3171874657 TSecr=1047614946
1711549310.935889721   489 0.989932251    10.10.1.2 → 10.10.1.1    TCP 83 56294 → 8081 [PSH, ACK] Seq=766 Ack=766 Win=64256 Len=17 TSval=1047614956 TSecr=3171874657
1711549312.935889721   491 0.990034736    10.10.1.1 → 10.10.1.2    TCP 83 8081 → 56294 [PSH, ACK] Seq=766 Ack=783 Win=65152 Len=17 TSval=3171874667 TSecr=1047614956
1711549320.935889721   499 1.000249441    10.10.1.2 → 10.10.1.1    TCP 83 56294 → 8081 [PSH, ACK] Seq=783 Ack=783 Win=64256 Len=17 TSval=1047614966 TSecr=3171874667
1711549322.935889721   501 1.000350718    10.10.1.1 → 10.10.1.2    TCP 83 8081 → 56294 [PSH, ACK] Seq=783 Ack=800 Win=65152 Len=17 TSval=3171874677 TSecr=1047614966
1711549330.935889721   509 1.010565459    10.10.1.2 → 10.10.1.1    TCP 83 56294 → 8081 [PSH, ACK] Seq=800 Ack=800 Win=64256 Len=17 TSval=1047614977 TSecr=3171874677
1711549332.935889721   511 1.010667499    10.10.1.1 → 10.10.1.2    TCP 83 8081 → 56294 [PSH, ACK] Seq=800 Ack=817 Win=65152 Len=17 TSval=3171874688 TSecr=1047614977
1711549340.935889721   519 1.020883164    10.10.1.2 → 10.10.1.1    TCP 83 56294 → 8081 [PSH, ACK] Seq=817 Ack=817 Win=64256 Len=17 TSval=1047614987 TSecr=3171874688
1711549342.935889721   521 1.020985531    10.10.1.1 → 10.10.1.2    TCP 83 8081 → 56294 [PSH, ACK] Seq=817 Ack=834 Win=65152 Len=17 TSval=3171874698 TSecr=1047614987
1711549350.935889721   529 1.031200703    10.10.1.2 → 10.10.1.1    TCP 83 56294 → 8081 [PSH, ACK] Seq=834 Ack=834 Win=64256 Len=17 TSval=1047614997 TSecr=3171874698
1711549352.935889721   531 1.031304861    10.10.1.1 → 10.10.1.2    TCP 83 8081 → 56294 [PSH, ACK] Seq=834 Ack=851 Win=65152 Len=17 TSval=3171874708 TSecr=1047614997
1711549360.935889721   539 1.041524503    10.10.1.2 → 10.10.1.1    TCP 83 56294 → 8081 [PSH, ACK] Seq=851 Ack=851 Win=64256 Len=17 TSval=1047615007 TSecr=3171874708
1711549362.935889721   541 1.041627304    10.10.1.1 → 10.10.1.2    TCP 83 8081 → 56294 [PSH, ACK] Seq=851 Ack=868 Win=65152 Len=17 TSval=3171874719 TSecr=1047615007
1711549370.935889721   549 1.051843243    10.10.1.2 → 10.10.1.1    TCP 83 56294 → 8081 [PSH, ACK] Seq=868 Ack=868 Win=64256 Len=17 TSval=1047615018 TSecr=3171874719
1711549372.935889721   551 1.051945913    10.10.1.1 → 10.10.1.2    TCP 83 8081 → 56294 [PSH, ACK] Seq=868 Ack=885 Win=65152 Len=17 TSval=3171874729 TSecr=1047615018
1711549380.935889721   559 1.062160200    10.10.1.2 → 10.10.1.1    TCP 83 56294 → 8081 [PSH, ACK] Seq=885 Ack=885 Win=64256 Len=17 TSval=1047615028 TSecr=3171874729
1711549382.935889721   561 1.062262826    10.10.1.1 → 10.10.1.2    TCP 83 8081 → 56294 [PSH, ACK] Seq=885 Ack=902 Win=65152 Len=17 TSval=3171874739 TSecr=1047615028
1711549390.935889721   569 1.072479872    10.10.1.2 → 10.10.1.1    TCP 83 56294 → 8081 [PSH, ACK] Seq=902 Ack=902 Win=64256 Len=17 TSval=1047615038 TSecr=3171874739
1711549392.935889721   571 1.072582198    10.10.1.1 → 10.10.1.2    TCP 83 8081 → 56294 [PSH, ACK] Seq=902 Ack=919 Win=65152 Len=17 TSval=3171874750 TSecr=1047615038
1711549400.935889721   579 1.082796168    10.10.1.2 → 10.10.1.1    TCP 83 56294 → 8081 [PSH, ACK] Seq=919 Ack=919 Win=64256 Len=17 TSval=1047615049 TSecr=3171874750
1711549402.935889721   581 1.082896650    10.10.1.1 → 10.10.1.2    TCP 83 8081 → 56294 [PSH, ACK] Seq=919 Ack=936 Win=65152 Len=17 TSval=3171874760 TSecr=1047615049
1711549410.935889721   589 1.093112995    10.10.1.2 → 10.10.1.1    TCP 83 56294 → 8081 [PSH, ACK] Seq=936 Ack=936 Win=64256 Len=17 TSval=1047615059 TSecr=3171874760
1711549412.935889721   591 1.093214647    10.10.1.1 → 10.10.1.2    TCP 83 8081 → 56294 [PSH, ACK] Seq=936 Ack=953 Win=65152 Len=17 TSval=3171874770 TSecr=1047615059
1711549420.935889721   599 1.103431741    10.10.1.2 → 10.10.1.1    TCP 83 56294 → 8081 [PSH, ACK] Seq=953 Ack=953 Win=64256 Len=17 TSval=1047615069 TSecr=3171874770
1711549423.935889721   602 1.103588144    10.10.1.1 → 10.10.1.2    TCP 83 8081 → 56294 [PSH, ACK] Seq=953 Ack=970 Win=65152 Len=17 TSval=3171874781 TSecr=1047615069
1711549430.935889721   609 1.113803148    10.10.1.2 → 10.10.1.1    TCP 83 56294 → 8081 [PSH, ACK] Seq=970 Ack=970 Win=64256 Len=17 TSval=1047615080 TSecr=3171874781
1711549432.935889721   611 1.113905044    10.10.1.1 → 10.10.1.2    TCP 83 8081 → 56294 [PSH, ACK] Seq=970 Ack=987 Win=65152 Len=17 TSval=3171874791 TSecr=1047615080
1711549440.935889721   619 1.124119431    10.10.1.2 → 10.10.1.1    TCP 83 56294 → 8081 [PSH, ACK] Seq=987 Ack=987 Win=64256 Len=17 TSval=1047615090 TSecr=3171874791
1711549442.935889721   621 1.124221956    10.10.1.1 → 10.10.1.2    TCP 83 8081 → 56294 [PSH, ACK] Seq=987 Ack=1004 Win=65152 Len=17 TSval=3171874801 TSecr=1047615090
1711549450.935889721   629 1.134436982    10.10.1.2 → 10.10.1.1    TCP 83 56294 → 8081 [PSH, ACK] Seq=1004 Ack=1004 Win=64256 Len=17 TSval=1047615100 TSecr=3171874801
1711549452.935889721   631 1.134541137    10.10.1.1 → 10.10.1.2    TCP 83 8081 → 56294 [PSH, ACK] Seq=1004 Ack=1021 Win=65152 Len=17 TSval=3171874812 TSecr=1047615100
1711549460.935889721   639 1.144757271    10.10.1.2 → 10.10.1.1    TCP 83 56294 → 8081 [PSH, ACK] Seq=1021 Ack=1021 Win=64256 Len=17 TSval=1047615111 TSecr=3171874812
1711549462.935889721   641 1.144861317    10.10.1.1 → 10.10.1.2    TCP 83 8081 → 56294 [PSH, ACK] Seq=1021 Ack=1038 Win=65152 Len=17 TSval=3171874822 TSecr=1047615111
1711549470.935889721   649 1.155075981    10.10.1.2 → 10.10.1.1    TCP 83 56294 → 8081 [PSH, ACK] Seq=1038 Ack=1038 Win=64256 Len=17 TSval=1047615121 TSecr=3171874822
1711549472.935889721   651 1.155178316    10.10.1.1 → 10.10.1.2    TCP 83 8081 → 56294 [PSH, ACK] Seq=1038 Ack=1055 Win=65152 Len=17 TSval=3171874832 TSecr=1047615121
1711549480.935889721   659 1.165391771    10.10.1.2 → 10.10.1.1    TCP 83 56294 → 8081 [PSH, ACK] Seq=1055 Ack=1055 Win=64256 Len=17 TSval=1047615131 TSecr=3171874832
1711549482.935889721   661 1.165495573    10.10.1.1 → 10.10.1.2    TCP 83 8081 → 56294 [PSH, ACK] Seq=1055 Ack=1072 Win=65152 Len=17 TSval=3171874842 TSecr=1047615131
1711549490.935889721   669 1.175713137    10.10.1.2 → 10.10.1.1    TCP 83 56294 → 8081 [PSH, ACK] Seq=1072 Ack=1072 Win=64256 Len=17 TSval=1047615142 TSecr=3171874842
1711549492.935889721   671 1.175815632    10.10.1.1 → 10.10.1.2    TCP 83 8081 → 56294 [PSH, ACK] Seq=1072 Ack=1089 Win=65152 Len=17 TSval=3171874853 TSecr=1047615142
1711549500.935889721   679 1.186036250    10.10.1.2 → 10.10.1.1    TCP 83 56294 → 8081 [PSH, ACK] Seq=1089 Ack=1089 Win=64256 Len=17 TSval=1047615152 TSecr=3171874853
1711549502.935889721   681 1.186139502    10.10.1.1 → 10.10.1.2    TCP 83 8081 → 56294 [PSH, ACK] Seq=1089 Ack=1106 Win=65152 Len=17 TSval=3171874863 TSecr=1047615152
1711549510.935889721   689 1.196358977    10.10.1.2 → 10.10.1.1    TCP 83 56294 → 8081 [PSH, ACK] Seq=1106 Ack=1106 Win=64256 Len=17 TSval=1047615162 TSecr=3171874863
1711549512.935889721   691 1.196461291    10.10.1.1 → 10.10.1.2    TCP 83 8081 → 56294 [PSH, ACK] Seq=1106 Ack=1123 Win=65152 Len=17 TSval=3171874873 TSecr=1047615162
1711549520.935889721   699 1.206678648    10.10.1.2 → 10.10.1.1    TCP 83 56294 → 8081 [PSH, ACK] Seq=1123 Ack=1123 Win=64256 Len=17 TSval=1047615173 TSecr=3171874873
1711549522.935889721   701 1.206787165    10.10.1.1 → 10.10.1.2    TCP 83 8081 → 56294 [PSH, ACK] Seq=1123 Ack=1140 Win=65152 Len=17 TSval=3171874884 TSecr=1047615173
1711549530.935889721   709 1.217004070    10.10.1.2 → 10.10.1.1    TCP 83 56294 → 8081 [PSH, ACK] Seq=1140 Ack=1140 Win=64256 Len=17 TSval=1047615183 TSecr=3171874884
1711549532.935889721   711 1.217106664    10.10.1.1 → 10.10.1.2    TCP 83 8081 → 56294 [PSH, ACK] Seq=1140 Ack=1157 Win=65152 Len=17 TSval=3171874894 TSecr=1047615183
1711549540.935889721   719 1.227335204    10.10.1.2 → 10.10.1.1    TCP 83 56294 → 8081 [PSH, ACK] Seq=1157 Ack=1157 Win=64256 Len=17 TSval=1047615193 TSecr=3171874894
1711549542.935889721   721 1.227434878    10.10.1.1 → 10.10.1.2    TCP 83 8081 → 56294 [PSH, ACK] Seq=1157 Ack=1174 Win=65152 Len=17 TSval=3171874904 TSecr=1047615193
1711549550.935889721   729 1.237651316    10.10.1.2 → 10.10.1.1    TCP 83 56294 → 8081 [PSH, ACK] Seq=1174 Ack=1174 Win=64256 Len=17 TSval=1047615204 TSecr=3171874904
1711549552.935889721   731 1.237753888    10.10.1.1 → 10.10.1.2    TCP 83 8081 → 56294 [PSH, ACK] Seq=1174 Ack=1191 Win=65152 Len=17 TSval=3171874915 TSecr=1047615204
1711549560.935889721   739 1.247971422    10.10.1.2 → 10.10.1.1    TCP 83 56294 → 8081 [PSH, ACK] Seq=1191 Ack=1191 Win=64256 Len=17 TSval=1047615214 TSecr=3171874915
1711549562.935889721   741 1.248073639    10.10.1.1 → 10.10.1.2    TCP 83 8081 → 56294 [PSH, ACK] Seq=1191 Ack=1208 Win=65152 Len=17 TSval=3171874925 TSecr=1047615214
1711549570.935889721   749 1.258292676    10.10.1.2 → 10.10.1.1    TCP 83 56294 → 8081 [PSH, ACK] Seq=1208 Ack=1208 Win=64256 Len=17 TSval=1047615224 TSecr=3171874925
1711549572.935889721   751 1.258403042    10.10.1.1 → 10.10.1.2    TCP 83 8081 → 56294 [PSH, ACK] Seq=1208 Ack=1225 Win=65152 Len=17 TSval=3171874935 TSecr=1047615224
1711549580.935889721   759 1.268621023    10.10.1.2 → 10.10.1.1    TCP 83 56294 → 8081 [PSH, ACK] Seq=1225 Ack=1225 Win=64256 Len=17 TSval=1047615235 TSecr=3171874935
1711549582.935889721   761 1.268723063    10.10.1.1 → 10.10.1.2    TCP 83 8081 → 56294 [PSH, ACK] Seq=1225 Ack=1242 Win=65152 Len=17 TSval=3171874946 TSecr=1047615235
1711549590.935889721   769 1.278940097    10.10.1.2 → 10.10.1.1    TCP 83 56294 → 8081 [PSH, ACK] Seq=1242 Ack=1242 Win=64256 Len=17 TSval=1047615245 TSecr=3171874946
1711549592.935889721   771 1.279041698    10.10.1.1 → 10.10.1.2    TCP 83 8081 → 56294 [PSH, ACK] Seq=1242 Ack=1259 Win=65152 Len=17 TSval=3171874956 TSecr=1047615245
1711549600.935889721   779 1.289258026    10.10.1.2 → 10.10.1.1    TCP 83 56294 → 8081 [PSH, ACK] Seq=1259 Ack=1259 Win=64256 Len=17 TSval=1047615255 TSecr=3171874956
1711549602.935889721   781 1.289361906    10.10.1.1 → 10.10.1.2    TCP 83 8081 → 56294 [PSH, ACK] Seq=1259 Ack=1276 Win=65152 Len=17 TSval=3171874966 TSecr=1047615255
1711549610.935889721   789 1.299543336    10.10.1.2 → 10.10.1.1    TCP 83 56294 → 8081 [PSH, ACK] Seq=1276 Ack=1276 Win=64256 Len=17 TSval=1047615266 TSecr=3171874966
1711549612.935889721   791 1.299646448    10.10.1.1 → 10.10.1.2    TCP 83 8081 → 56294 [PSH, ACK] Seq=1276 Ack=1293 Win=65152 Len=17 TSval=3171874977 TSecr=1047615266
1711549620.935889721   799 1.309861532    10.10.1.2 → 10.10.1.1    TCP 83 56294 → 8081 [PSH, ACK] Seq=1293 Ack=1293 Win=64256 Len=17 TSval=1047615276 TSecr=3171874977
1711549622.935889721   801 1.309963604    10.10.1.1 → 10.10.1.2    TCP 83 8081 → 56294 [PSH, ACK] Seq=1293 Ack=1310 Win=65152 Len=17 TSval=3171874987 TSecr=1047615276
1711549630.935889721   809 1.320178265    10.10.1.2 → 10.10.1.1    TCP 83 56294 → 8081 [PSH, ACK] Seq=1310 Ack=1310 Win=64256 Len=17 TSval=1047615286 TSecr=3171874987
1711549632.935889721   811 1.320281760    10.10.1.1 → 10.10.1.2    TCP 83 8081 → 56294 [PSH, ACK] Seq=1310 Ack=1327 Win=65152 Len=17 TSval=3171874997 TSecr=1047615286
1711549640.935889721   819 1.330496580    10.10.1.2 → 10.10.1.1    TCP 83 56294 → 8081 [PSH, ACK] Seq=1327 Ack=1327 Win=64256 Len=17 TSval=1047615296 TSecr=3171874997
1711549642.935889721   821 1.330599907    10.10.1.1 → 10.10.1.2    TCP 83 8081 → 56294 [PSH, ACK] Seq=1327 Ack=1344 Win=65152 Len=17 TSval=3171875008 TSecr=1047615296
1711549650.935889721   829 1.340817252    10.10.1.2 → 10.10.1.1    TCP 83 56294 → 8081 [PSH, ACK] Seq=1344 Ack=1344 Win=64256 Len=17 TSval=1047615307 TSecr=3171875008
1711549652.935889721   831 1.340920853    10.10.1.1 → 10.10.1.2    TCP 83 8081 → 56294 [PSH, ACK] Seq=1344 Ack=1361 Win=65152 Len=17 TSval=3171875018 TSecr=1047615307
1711549660.935889721   839 1.351136282    10.10.1.2 → 10.10.1.1    TCP 83 56294 → 8081 [PSH, ACK] Seq=1361 Ack=1361 Win=64256 Len=17 TSval=1047615317 TSecr=3171875018
1711549662.935889721   841 1.351239015    10.10.1.1 → 10.10.1.2    TCP 83 8081 → 56294 [PSH, ACK] Seq=1361 Ack=1378 Win=65152 Len=17 TSval=3171875028 TSecr=1047615317
1711549670.935889721   849 1.361454196    10.10.1.2 → 10.10.1.1    TCP 83 56294 → 8081 [PSH, ACK] Seq=1378 Ack=1378 Win=64256 Len=17 TSval=1047615327 TSecr=3171875028
1711549672.935889721   851 1.361556915    10.10.1.1 → 10.10.1.2    TCP 83 8081 → 56294 [PSH, ACK] Seq=1378 Ack=1395 Win=65152 Len=17 TSval=3171875039 TSecr=1047615327
1711549680.935889721   859 1.371773428    10.10.1.2 → 10.10.1.1    TCP 83 56294 → 8081 [PSH, ACK] Seq=1395 Ack=1395 Win=64256 Len=17 TSval=1047615338 TSecr=3171875039
1711549682.935889721   861 1.371876824    10.10.1.1 → 10.10.1.2    TCP 83 8081 → 56294 [PSH, ACK] Seq=1395 Ack=1412 Win=65152 Len=17 TSval=3171875049 TSecr=1047615338
1711549690.935889721   869 1.382093068    10.10.1.2 → 10.10.1.1    TCP 83 56294 → 8081 [PSH, ACK] Seq=1412 Ack=1412 Win=64256 Len=17 TSval=1047615348 TSecr=3171875049
1711549692.935889721   871 1.382196087    10.10.1.1 → 10.10.1.2    TCP 83 8081 → 56294 [PSH, ACK] Seq=1412 Ack=1429 Win=65152 Len=17 TSval=3171875059 TSecr=1047615348
1711549700.935889721   879 1.392411984    10.10.1.2 → 10.10.1.1    TCP 83 56294 → 8081 [PSH, ACK] Seq=1429 Ack=1429 Win=64256 Len=17 TSval=1047615358 TSecr=3171875059
1711549702.935889721   881 1.392545034    10.10.1.1 → 10.10.1.2    TCP 83 8081 → 56294 [PSH, ACK] Seq=1429 Ack=1446 Win=65152 Len=17 TSval=3171875070 TSecr=1047615358
1711549710.935889721   889 1.402760746    10.10.1.2 → 10.10.1.1    TCP 83 56294 → 8081 [PSH, ACK] Seq=1446 Ack=1446 Win=64256 Len=17 TSval=1047615369 TSecr=3171875070
1711549712.935889721   891 1.402874233    10.10.1.1 → 10.10.1.2    TCP 83 8081 → 56294 [PSH, ACK] Seq=1446 Ack=1463 Win=65152 Len=17 TSval=3171875080 TSecr=1047615369
1711549720.935889721   899 1.413092009    10.10.1.2 → 10.10.1.1    TCP 83 56294 → 8081 [PSH, ACK] Seq=1463 Ack=1463 Win=64256 Len=17 TSval=1047615379 TSecr=3171875080
1711549722.935889721   901 1.413194474    10.10.1.1 → 10.10.1.2    TCP 83 8081 → 56294 [PSH, ACK] Seq=1463 Ack=1480 Win=65152 Len=17 TSval=3171875090 TSecr=1047615379
1711549730.935889721   909 1.423409919    10.10.1.2 → 10.10.1.1    TCP 83 56294 → 8081 [PSH, ACK] Seq=1480 Ack=1480 Win=64256 Len=17 TSval=1047615389 TSecr=3171875090
1711549732.935889721   911 1.423513011    10.10.1.1 → 10.10.1.2    TCP 83 8081 → 56294 [PSH, ACK] Seq=1480 Ack=1497 Win=65152 Len=17 TSval=3171875101 TSecr=1047615389
1711549740.935889721   919 1.433728328    10.10.1.2 → 10.10.1.1    TCP 83 56294 → 8081 [PSH, ACK] Seq=1497 Ack=1497 Win=64256 Len=17 TSval=1047615400 TSecr=3171875101
1711549742.935889721   921 1.433830759    10.10.1.1 → 10.10.1.2    TCP 83 8081 → 56294 [PSH, ACK] Seq=1497 Ack=1514 Win=65152 Len=17 TSval=3171875111 TSecr=1047615400
1711549750.935889721   929 1.444048607    10.10.1.2 → 10.10.1.1    TCP 83 56294 → 8081 [PSH, ACK] Seq=1514 Ack=1514 Win=64256 Len=17 TSval=1047615410 TSecr=3171875111
1711549752.935889721   931 1.444152311    10.10.1.1 → 10.10.1.2    TCP 83 8081 → 56294 [PSH, ACK] Seq=1514 Ack=1531 Win=65152 Len=17 TSval=3171875121 TSecr=1047615410
1711549760.935889721   939 1.454367872    10.10.1.2 → 10.10.1.1    TCP 83 56294 → 8081 [PSH, ACK] Seq=1531 Ack=1531 Win=64256 Len=17 TSval=1047615420 TSecr=3171875121
1711549762.935889721   941 1.454470450    10.10.1.1 → 10.10.1.2    TCP 83 8081 → 56294 [PSH, ACK] Seq=1531 Ack=1548 Win=65152 Len=17 TSval=3171875131 TSecr=1047615420
1711549771.935889721   950 1.464686058    10.10.1.2 → 10.10.1.1    TCP 83 56294 → 8081 [PSH, ACK] Seq=1548 Ack=1548 Win=64256 Len=17 TSval=1047615431 TSecr=3171875131
1711549773.935889721   952 1.464767848    10.10.1.1 → 10.10.1.2    TCP 83 8081 → 56294 [PSH, ACK] Seq=1548 Ack=1565 Win=65152 Len=17 TSval=3171875142 TSecr=1047615431
1711549780.935889721   959 1.474983671    10.10.1.2 → 10.10.1.1    TCP 83 56294 → 8081 [PSH, ACK] Seq=1565 Ack=1565 Win=64256 Len=17 TSval=1047615441 TSecr=3171875142
1711549782.935889721   961 1.475085478    10.10.1.1 → 10.10.1.2    TCP 83 8081 → 56294 [PSH, ACK] Seq=1565 Ack=1582 Win=65152 Len=17 TSval=3171875152 TSecr=1047615441
1711549790.935889721   969 1.485302848    10.10.1.2 → 10.10.1.1    TCP 83 56294 → 8081 [PSH, ACK] Seq=1582 Ack=1582 Win=64256 Len=17 TSval=1047615451 TSecr=3171875152
1711549792.935889721   971 1.485406705    10.10.1.1 → 10.10.1.2    TCP 83 8081 → 56294 [PSH, ACK] Seq=1582 Ack=1599 Win=65152 Len=17 TSval=3171875162 TSecr=1047615451
1711549800.935889721   979 1.495623786    10.10.1.2 → 10.10.1.1    TCP 83 56294 → 8081 [PSH, ACK] Seq=1599 Ack=1599 Win=64256 Len=17 TSval=1047615462 TSecr=3171875162
1711549802.935889721   981 1.495725935    10.10.1.1 → 10.10.1.2    TCP 83 8081 → 56294 [PSH, ACK] Seq=1599 Ack=1616 Win=65152 Len=17 TSval=3171875173 TSecr=1047615462
1711549810.935889721   989 1.505941458    10.10.1.2 → 10.10.1.1    TCP 83 56294 → 8081 [PSH, ACK] Seq=1616 Ack=1616 Win=64256 Len=17 TSval=1047615472 TSecr=3171875173
1711549812.935889721   991 1.506044918    10.10.1.1 → 10.10.1.2    TCP 83 8081 → 56294 [PSH, ACK] Seq=1616 Ack=1633 Win=65152 Len=17 TSval=3171875183 TSecr=1047615472
1711549820.935889721   999 1.516261453    10.10.1.2 → 10.10.1.1    TCP 83 56294 → 8081 [PSH, ACK] Seq=1633 Ack=1633 Win=64256 Len=17 TSval=1047615482 TSecr=3171875183
1711549822.935889721  1001 1.516364366    10.10.1.1 → 10.10.1.2    TCP 83 8081 → 56294 [PSH, ACK] Seq=1633 Ack=1650 Win=65152 Len=17 TSval=3171875193 TSecr=1047615482
1711549830.935889721  1009 1.526579191    10.10.1.2 → 10.10.1.1    TCP 83 56294 → 8081 [PSH, ACK] Seq=1650 Ack=1650 Win=64256 Len=17 TSval=1047615493 TSecr=3171875193
1711549832.935889721  1011 1.526681899    10.10.1.1 → 10.10.1.2    TCP 83 8081 → 56294 [PSH, ACK] Seq=1650 Ack=1667 Win=65152 Len=17 TSval=3171875204 TSecr=1047615493
1711549840.935889721  1019 1.536899033    10.10.1.2 → 10.10.1.1    TCP 83 56294 → 8081 [PSH, ACK] Seq=1667 Ack=1667 Win=64256 Len=17 TSval=1047615503 TSecr=3171875204
1711549842.935889721  1021 1.537000498    10.10.1.1 → 10.10.1.2    TCP 83 8081 → 56294 [PSH, ACK] Seq=1667 Ack=1684 Win=65152 Len=17 TSval=3171875214 TSecr=1047615503
1711549850.935889721  1029 1.547215477    10.10.1.2 → 10.10.1.1    TCP 83 56294 → 8081 [PSH, ACK] Seq=1684 Ack=1684 Win=64256 Len=17 TSval=1047615513 TSecr=3171875214
1711549852.935889721  1031 1.547318268    10.10.1.1 → 10.10.1.2    TCP 83 8081 → 56294 [PSH, ACK] Seq=1684 Ack=1701 Win=65152 Len=17 TSval=3171875224 TSecr=1047615513
1711549860.935889721  1039 1.557534195    10.10.1.2 → 10.10.1.1    TCP 83 56294 → 8081 [PSH, ACK] Seq=1701 Ack=1701 Win=64256 Len=17 TSval=1047615524 TSecr=3171875224
1711549862.935889721  1041 1.557635974    10.10.1.1 → 10.10.1.2    TCP 83 8081 → 56294 [PSH, ACK] Seq=1701 Ack=1718 Win=65152 Len=17 TSval=3171875235 TSecr=1047615524
1711549870.935889721  1049 1.567853270    10.10.1.2 → 10.10.1.1    TCP 83 56294 → 8081 [PSH, ACK] Seq=1718 Ack=1718 Win=64256 Len=17 TSval=1047615534 TSecr=3171875235
1711549872.935889721  1051 1.567958413    10.10.1.1 → 10.10.1.2    TCP 83 8081 → 56294 [PSH, ACK] Seq=1718 Ack=1735 Win=65152 Len=17 TSval=3171875245 TSecr=1047615534
1711549880.935889721  1059 1.578173623    10.10.1.2 → 10.10.1.1    TCP 83 56294 → 8081 [PSH, ACK] Seq=1735 Ack=1735 Win=64256 Len=17 TSval=1047615544 TSecr=3171875245
1711549882.935889721  1061 1.578275644    10.10.1.1 → 10.10.1.2    TCP 83 8081 → 56294 [PSH, ACK] Seq=1735 Ack=1752 Win=65152 Len=17 TSval=3171875255 TSecr=1047615544
1711549890.935889721  1069 1.588491653    10.10.1.2 → 10.10.1.1    TCP 83 56294 → 8081 [PSH, ACK] Seq=1752 Ack=1752 Win=64256 Len=17 TSval=1047615554 TSecr=3171875255
1711549892.935889721  1071 1.588606167    10.10.1.1 → 10.10.1.2    TCP 83 8081 → 56294 [PSH, ACK] Seq=1752 Ack=1769 Win=65152 Len=17 TSval=3171875266 TSecr=1047615554
1711549900.935889721  1079 1.598822457    10.10.1.2 → 10.10.1.1    TCP 83 56294 → 8081 [PSH, ACK] Seq=1769 Ack=1769 Win=64256 Len=17 TSval=1047615565 TSecr=3171875266
1711549902.935889721  1081 1.598923382    10.10.1.1 → 10.10.1.2    TCP 83 8081 → 56294 [PSH, ACK] Seq=1769 Ack=1786 Win=65152 Len=17 TSval=3171875276 TSecr=1047615565
1711549910.935889721  1089 1.609138049    10.10.1.2 → 10.10.1.1    TCP 83 56294 → 8081 [PSH, ACK] Seq=1786 Ack=1786 Win=64256 Len=17 TSval=1047615575 TSecr=3171875276
1711549912.935889721  1091 1.609247860    10.10.1.1 → 10.10.1.2    TCP 83 8081 → 56294 [PSH, ACK] Seq=1786 Ack=1803 Win=65152 Len=17 TSval=3171875286 TSecr=1047615575
1711549920.935889721  1099 1.619466252    10.10.1.2 → 10.10.1.1    TCP 83 56294 → 8081 [PSH, ACK] Seq=1803 Ack=1803 Win=64256 Len=17 TSval=1047615585 TSecr=3171875286
1711549922.935889721  1101 1.619568115    10.10.1.1 → 10.10.1.2    TCP 83 8081 → 56294 [PSH, ACK] Seq=1803 Ack=1820 Win=65152 Len=17 TSval=3171875297 TSecr=1047615585
1711549930.935889721  1109 1.629786510    10.10.1.2 → 10.10.1.1    TCP 83 56294 → 8081 [PSH, ACK] Seq=1820 Ack=1820 Win=64256 Len=17 TSval=1047615596 TSecr=3171875297
1711549932.935889721  1111 1.629888448    10.10.1.1 → 10.10.1.2    TCP 83 8081 → 56294 [PSH, ACK] Seq=1820 Ack=1837 Win=65152 Len=17 TSval=3171875307 TSecr=1047615596
1711549940.935889721  1119 1.640105146    10.10.1.2 → 10.10.1.1    TCP 83 56294 → 8081 [PSH, ACK] Seq=1837 Ack=1837 Win=64256 Len=17 TSval=1047615606 TSecr=3171875307
1711549942.935889721  1121 1.640209635    10.10.1.1 → 10.10.1.2    TCP 83 8081 → 56294 [PSH, ACK] Seq=1837 Ack=1854 Win=65152 Len=17 TSval=3171875317 TSecr=1047615606
1711549950.935889721  1129 1.650425977    10.10.1.2 → 10.10.1.1    TCP 83 56294 → 8081 [PSH, ACK] Seq=1854 Ack=1854 Win=64256 Len=17 TSval=1047615616 TSecr=3171875317
1711549952.935889721  1131 1.650528581    10.10.1.1 → 10.10.1.2    TCP 83 8081 → 56294 [PSH, ACK] Seq=1854 Ack=1871 Win=65152 Len=17 TSval=3171875328 TSecr=1047615616
1711549960.935889721  1139 1.660742811    10.10.1.2 → 10.10.1.1    TCP 83 56294 → 8081 [PSH, ACK] Seq=1871 Ack=1871 Win=64256 Len=17 TSval=1047615627 TSecr=3171875328
1711549962.935889721  1141 1.660844943    10.10.1.1 → 10.10.1.2    TCP 83 8081 → 56294 [PSH, ACK] Seq=1871 Ack=1888 Win=65152 Len=17 TSval=3171875338 TSecr=1047615627
1711549970.935889721  1149 1.671062471    10.10.1.2 → 10.10.1.1    TCP 83 56294 → 8081 [PSH, ACK] Seq=1888 Ack=1888 Win=64256 Len=17 TSval=1047615637 TSecr=3171875338
1711549972.935889721  1151 1.671163644    10.10.1.1 → 10.10.1.2    TCP 83 8081 → 56294 [PSH, ACK] Seq=1888 Ack=1905 Win=65152 Len=17 TSval=3171875348 TSecr=1047615637
1711549980.935889721  1159 1.681379499    10.10.1.2 → 10.10.1.1    TCP 83 56294 → 8081 [PSH, ACK] Seq=1905 Ack=1905 Win=64256 Len=17 TSval=1047615647 TSecr=3171875348
1711549982.935889721  1161 1.681481649    10.10.1.1 → 10.10.1.2    TCP 83 8081 → 56294 [PSH, ACK] Seq=1905 Ack=1922 Win=65152 Len=17 TSval=3171875358 TSecr=1047615647
1711549990.935889721  1169 1.691700131    10.10.1.2 → 10.10.1.1    TCP 83 56294 → 8081 [PSH, ACK] Seq=1922 Ack=1922 Win=64256 Len=17 TSval=1047615658 TSecr=3171875358
1711549993.935889721  1172 1.691854837    10.10.1.1 → 10.10.1.2    TCP 83 8081 → 56294 [PSH, ACK] Seq=1922 Ack=1939 Win=65152 Len=17 TSval=3171875369 TSecr=1047615658
1711550000.935889721  1179 1.702070709    10.10.1.2 → 10.10.1.1    TCP 83 56294 → 8081 [PSH, ACK] Seq=1939 Ack=1939 Win=64256 Len=17 TSval=1047615668 TSecr=3171875369
1711550002.935889721  1181 1.702172552    10.10.1.1 → 10.10.1.2    TCP 83 8081 → 56294 [PSH, ACK] Seq=1939 Ack=1956 Win=65152 Len=17 TSval=3171875379 TSecr=1047615668
1711550010.935889721  1189 1.712389572    10.10.1.2 → 10.10.1.1    TCP 83 56294 → 8081 [PSH, ACK] Seq=1956 Ack=1956 Win=64256 Len=17 TSval=1047615678 TSecr=3171875379
1711550012.935889721  1191 1.712517141    10.10.1.1 → 10.10.1.2    TCP 83 8081 → 56294 [PSH, ACK] Seq=1956 Ack=1973 Win=65152 Len=17 TSval=3171875389 TSecr=1047615678
1711550020.935889721  1199 1.722731799    10.10.1.2 → 10.10.1.1    TCP 83 56294 → 8081 [PSH, ACK] Seq=1973 Ack=1973 Win=64256 Len=17 TSval=1047615689 TSecr=3171875389
1711550022.935889721  1201 1.722834246    10.10.1.1 → 10.10.1.2    TCP 83 8081 → 56294 [PSH, ACK] Seq=1973 Ack=1990 Win=65152 Len=17 TSval=3171875400 TSecr=1047615689
1711550030.935889721  1209 1.733048677    10.10.1.2 → 10.10.1.1    TCP 83 56294 → 8081 [PSH, ACK] Seq=1990 Ack=1990 Win=64256 Len=17 TSval=1047615699 TSecr=3171875400
1711550032.935889721  1211 1.733150770    10.10.1.1 → 10.10.1.2    TCP 83 8081 → 56294 [PSH, ACK] Seq=1990 Ack=2007 Win=65152 Len=17 TSval=3171875410 TSecr=1047615699
1711550040.935889721  1219 1.743377936    10.10.1.2 → 10.10.1.1    TCP 83 56294 → 8081 [PSH, ACK] Seq=2007 Ack=2007 Win=64256 Len=17 TSval=1047615709 TSecr=3171875410
1711550042.935889721  1221 1.743477031    10.10.1.1 → 10.10.1.2    TCP 83 8081 → 56294 [PSH, ACK] Seq=2007 Ack=2024 Win=65152 Len=17 TSval=3171875420 TSecr=1047615709
1711550050.935889721  1229 1.753692930    10.10.1.2 → 10.10.1.1    TCP 83 56294 → 8081 [PSH, ACK] Seq=2024 Ack=2024 Win=64256 Len=17 TSval=1047615720 TSecr=3171875420
1711550052.935889721  1231 1.753795080    10.10.1.1 → 10.10.1.2    TCP 83 8081 → 56294 [PSH, ACK] Seq=2024 Ack=2041 Win=65152 Len=17 TSval=3171875431 TSecr=1047615720
1711550060.935889721  1239 1.764013493    10.10.1.2 → 10.10.1.1    TCP 83 56294 → 8081 [PSH, ACK] Seq=2041 Ack=2041 Win=64256 Len=17 TSval=1047615730 TSecr=3171875431
