1712182912.236215353    22 0.784132795    10.10.1.2 → 10.10.1.1    TCP 74 38838 → 8081 [SYN] Seq=0 Win=64240 Len=0 MSS=1460 SACK_PERM=1 TSval=1681683077 TSecr=0 WS=128
1712182913.236215353    23 0.784169950    10.10.1.1 → 10.10.1.2    TCP 74 8081 → 38838 [SYN, ACK] Seq=0 Ack=1 Win=65160 Len=0 MSS=1460 SACK_PERM=1 TSval=3805942786 TSecr=1681683077 WS=128
1712182914.236215353    24 0.784245772    10.10.1.2 → 10.10.1.1    TCP 66 38838 → 8081 [ACK] Seq=1 Ack=1 Win=64256 Len=0 TSval=1681683077 TSecr=3805942786
1712182924.236215353    34 1.033879163    10.10.1.2 → 10.10.1.1    TCP 83 38838 → 8081 [PSH, ACK] Seq=1 Ack=1 Win=64256 Len=17 TSval=1681683327 TSecr=3805942786
1712182926.236215353    36 1.033909205    10.10.1.1 → 10.10.1.2    TCP 66 8081 → 38838 [ACK] Seq=1 Ack=18 Win=65152 Len=0 TSval=3805943036 TSecr=1681683327
1712182928.236215353    38 1.034177461    10.10.1.1 → 10.10.1.2    TCP 83 8081 → 38838 [PSH, ACK] Seq=1 Ack=18 Win=65152 Len=17 TSval=3805943036 TSecr=1681683327
1712182929.236215353    39 1.034214338    10.10.1.2 → 10.10.1.1    TCP 66 38838 → 8081 [ACK] Seq=18 Ack=18 Win=64256 Len=0 TSval=1681683327 TSecr=3805943036
1712182936.236215353    46 1.035396853    10.10.1.2 → 10.10.1.1    TCP 83 38838 → 8081 [PSH, ACK] Seq=18 Ack=18 Win=64256 Len=17 TSval=1681683328 TSecr=3805943036
1712182939.236215353    49 1.035520886    10.10.1.1 → 10.10.1.2    TCP 83 8081 → 38838 [PSH, ACK] Seq=18 Ack=35 Win=65152 Len=17 TSval=3805943038 TSecr=1681683328
1712182946.236215353    56 1.036737927    10.10.1.2 → 10.10.1.1    TCP 83 38838 → 8081 [PSH, ACK] Seq=35 Ack=35 Win=64256 Len=17 TSval=1681683330 TSecr=3805943038
1712182949.236215353    59 1.036865176    10.10.1.1 → 10.10.1.2    TCP 83 8081 → 38838 [PSH, ACK] Seq=35 Ack=52 Win=65152 Len=17 TSval=3805943039 TSecr=1681683330
1712182956.236215353    66 1.038077738    10.10.1.2 → 10.10.1.1    TCP 83 38838 → 8081 [PSH, ACK] Seq=52 Ack=52 Win=64256 Len=17 TSval=1681683331 TSecr=3805943039
1712182959.236215353    69 1.038203929    10.10.1.1 → 10.10.1.2    TCP 83 8081 → 38838 [PSH, ACK] Seq=52 Ack=69 Win=65152 Len=17 TSval=3805943040 TSecr=1681683331
1712182966.236215353    76 1.039422032    10.10.1.2 → 10.10.1.1    TCP 83 38838 → 8081 [PSH, ACK] Seq=69 Ack=69 Win=64256 Len=17 TSval=1681683332 TSecr=3805943040
1712182969.236215353    79 1.039553774    10.10.1.1 → 10.10.1.2    TCP 83 8081 → 38838 [PSH, ACK] Seq=69 Ack=86 Win=65152 Len=17 TSval=3805943042 TSecr=1681683332
1712182976.236215353    86 1.040768983    10.10.1.2 → 10.10.1.1    TCP 83 38838 → 8081 [PSH, ACK] Seq=86 Ack=86 Win=64256 Len=17 TSval=1681683334 TSecr=3805943042
1712182978.236215353    88 1.040895535    10.10.1.1 → 10.10.1.2    TCP 83 8081 → 38838 [PSH, ACK] Seq=86 Ack=103 Win=65152 Len=17 TSval=3805943043 TSecr=1681683334
1712182986.236215353    96 1.042108391    10.10.1.2 → 10.10.1.1    TCP 83 38838 → 8081 [PSH, ACK] Seq=103 Ack=103 Win=64256 Len=17 TSval=1681683335 TSecr=3805943043
1712182988.236215353    98 1.042230565    10.10.1.1 → 10.10.1.2    TCP 83 8081 → 38838 [PSH, ACK] Seq=103 Ack=120 Win=65152 Len=17 TSval=3805943044 TSecr=1681683335
1712182996.236215353   106 1.043444048    10.10.1.2 → 10.10.1.1    TCP 83 38838 → 8081 [PSH, ACK] Seq=120 Ack=120 Win=64256 Len=17 TSval=1681683336 TSecr=3805943044
1712182998.236215353   108 1.043497774    10.10.1.1 → 10.10.1.2    TCP 83 8081 → 38838 [PSH, ACK] Seq=120 Ack=137 Win=65152 Len=17 TSval=3805943046 TSecr=1681683336
1712183005.236215353   115 1.044710828    10.10.1.2 → 10.10.1.1    TCP 83 38838 → 8081 [PSH, ACK] Seq=137 Ack=137 Win=64256 Len=17 TSval=1681683338 TSecr=3805943046
1712183007.236215353   117 1.044756464    10.10.1.1 → 10.10.1.2    TCP 83 8081 → 38838 [PSH, ACK] Seq=137 Ack=154 Win=65152 Len=17 TSval=3805943047 TSecr=1681683338
1712183014.236215353   124 1.045965810    10.10.1.2 → 10.10.1.1    TCP 83 38838 → 8081 [PSH, ACK] Seq=154 Ack=154 Win=64256 Len=17 TSval=1681683339 TSecr=3805943047
1712183016.236215353   126 1.046086988    10.10.1.1 → 10.10.1.2    TCP 83 8081 → 38838 [PSH, ACK] Seq=154 Ack=171 Win=65152 Len=17 TSval=3805943048 TSecr=1681683339
1712183024.236215353   134 1.047300794    10.10.1.2 → 10.10.1.1    TCP 83 38838 → 8081 [PSH, ACK] Seq=171 Ack=171 Win=64256 Len=17 TSval=1681683340 TSecr=3805943048
1712183026.236215353   136 1.047422798    10.10.1.1 → 10.10.1.2    TCP 83 8081 → 38838 [PSH, ACK] Seq=171 Ack=188 Win=65152 Len=17 TSval=3805943050 TSecr=1681683340
1712183034.236215353   144 1.048638641    10.10.1.2 → 10.10.1.1    TCP 83 38838 → 8081 [PSH, ACK] Seq=188 Ack=188 Win=64256 Len=17 TSval=1681683342 TSecr=3805943050
1712183036.236215353   146 1.048764031    10.10.1.1 → 10.10.1.2    TCP 83 8081 → 38838 [PSH, ACK] Seq=188 Ack=205 Win=65152 Len=17 TSval=3805943051 TSecr=1681683342
1712183044.236215353   154 1.049976808    10.10.1.2 → 10.10.1.1    TCP 83 38838 → 8081 [PSH, ACK] Seq=205 Ack=205 Win=64256 Len=17 TSval=1681683343 TSecr=3805943051
1712183046.236215353   156 1.050102083    10.10.1.1 → 10.10.1.2    TCP 83 8081 → 38838 [PSH, ACK] Seq=205 Ack=222 Win=65152 Len=17 TSval=3805943052 TSecr=1681683343
1712183054.236215353   164 1.051316323    10.10.1.2 → 10.10.1.1    TCP 83 38838 → 8081 [PSH, ACK] Seq=222 Ack=222 Win=64256 Len=17 TSval=1681683344 TSecr=3805943052
1712183056.236215353   166 1.051423817    10.10.1.1 → 10.10.1.2    TCP 83 8081 → 38838 [PSH, ACK] Seq=222 Ack=239 Win=65152 Len=17 TSval=3805943054 TSecr=1681683344
1712183064.236215353   174 1.052640856    10.10.1.2 → 10.10.1.1    TCP 83 38838 → 8081 [PSH, ACK] Seq=239 Ack=239 Win=64256 Len=17 TSval=1681683346 TSecr=3805943054
1712183066.236215353   176 1.052766218    10.10.1.1 → 10.10.1.2    TCP 83 8081 → 38838 [PSH, ACK] Seq=239 Ack=256 Win=65152 Len=17 TSval=3805943055 TSecr=1681683346
1712183074.236215353   184 1.053978250    10.10.1.2 → 10.10.1.1    TCP 83 38838 → 8081 [PSH, ACK] Seq=256 Ack=256 Win=64256 Len=17 TSval=1681683347 TSecr=3805943055
1712183076.236215353   186 1.054104199    10.10.1.1 → 10.10.1.2    TCP 83 8081 → 38838 [PSH, ACK] Seq=256 Ack=273 Win=65152 Len=17 TSval=3805943056 TSecr=1681683347
1712183084.236215353   194 1.055316626    10.10.1.2 → 10.10.1.1    TCP 83 38838 → 8081 [PSH, ACK] Seq=273 Ack=273 Win=64256 Len=17 TSval=1681683348 TSecr=3805943056
1712183087.236215353   197 1.055445253    10.10.1.1 → 10.10.1.2    TCP 83 8081 → 38838 [PSH, ACK] Seq=273 Ack=290 Win=65152 Len=17 TSval=3805943058 TSecr=1681683348
1712183094.236215353   204 1.056659845    10.10.1.2 → 10.10.1.1    TCP 83 38838 → 8081 [PSH, ACK] Seq=290 Ack=290 Win=64256 Len=17 TSval=1681683350 TSecr=3805943058
1712183096.236215353   206 1.056781301    10.10.1.1 → 10.10.1.2    TCP 83 8081 → 38838 [PSH, ACK] Seq=290 Ack=307 Win=65152 Len=17 TSval=3805943059 TSecr=1681683350
1712183104.236215353   214 1.057993636    10.10.1.2 → 10.10.1.1    TCP 83 38838 → 8081 [PSH, ACK] Seq=307 Ack=307 Win=64256 Len=17 TSval=1681683351 TSecr=3805943059
1712183106.236215353   216 1.058115702    10.10.1.1 → 10.10.1.2    TCP 83 8081 → 38838 [PSH, ACK] Seq=307 Ack=324 Win=65152 Len=17 TSval=3805943060 TSecr=1681683351
1712183114.236215353   224 1.059329277    10.10.1.2 → 10.10.1.1    TCP 83 38838 → 8081 [PSH, ACK] Seq=324 Ack=324 Win=64256 Len=17 TSval=1681683352 TSecr=3805943060
1712183116.236215353   226 1.059427321    10.10.1.1 → 10.10.1.2    TCP 83 8081 → 38838 [PSH, ACK] Seq=324 Ack=341 Win=65152 Len=17 TSval=3805943062 TSecr=1681683352
1712183124.236215353   234 1.060642334    10.10.1.2 → 10.10.1.1    TCP 83 38838 → 8081 [PSH, ACK] Seq=341 Ack=341 Win=64256 Len=17 TSval=1681683354 TSecr=3805943062
1712183126.236215353   236 1.060768308    10.10.1.1 → 10.10.1.2    TCP 83 8081 → 38838 [PSH, ACK] Seq=341 Ack=358 Win=65152 Len=17 TSval=3805943063 TSecr=1681683354
1712183134.236215353   244 1.061980301    10.10.1.2 → 10.10.1.1    TCP 83 38838 → 8081 [PSH, ACK] Seq=358 Ack=358 Win=64256 Len=17 TSval=1681683355 TSecr=3805943063
1712183136.236215353   246 1.062105899    10.10.1.1 → 10.10.1.2    TCP 83 8081 → 38838 [PSH, ACK] Seq=358 Ack=375 Win=65152 Len=17 TSval=3805943064 TSecr=1681683355
1712183144.236215353   254 1.063322475    10.10.1.2 → 10.10.1.1    TCP 83 38838 → 8081 [PSH, ACK] Seq=375 Ack=375 Win=64256 Len=17 TSval=1681683356 TSecr=3805943064
1712183147.236215353   257 1.063429782    10.10.1.1 → 10.10.1.2    TCP 83 8081 → 38838 [PSH, ACK] Seq=375 Ack=392 Win=65152 Len=17 TSval=3805943066 TSecr=1681683356
1712183154.236215353   264 1.064644426    10.10.1.2 → 10.10.1.1    TCP 83 38838 → 8081 [PSH, ACK] Seq=392 Ack=392 Win=64256 Len=17 TSval=1681683358 TSecr=3805943066
1712183156.236215353   266 1.064769293    10.10.1.1 → 10.10.1.2    TCP 83 8081 → 38838 [PSH, ACK] Seq=392 Ack=409 Win=65152 Len=17 TSval=3805943067 TSecr=1681683358
1712183164.236215353   274 1.065980500    10.10.1.2 → 10.10.1.1    TCP 83 38838 → 8081 [PSH, ACK] Seq=409 Ack=409 Win=64256 Len=17 TSval=1681683359 TSecr=3805943067
1712183166.236215353   276 1.066106181    10.10.1.1 → 10.10.1.2    TCP 83 8081 → 38838 [PSH, ACK] Seq=409 Ack=426 Win=65152 Len=17 TSval=3805943068 TSecr=1681683359
1712183174.236215353   284 1.067321223    10.10.1.2 → 10.10.1.1    TCP 83 38838 → 8081 [PSH, ACK] Seq=426 Ack=426 Win=64256 Len=17 TSval=1681683360 TSecr=3805943068
1712183176.236215353   286 1.067450393    10.10.1.1 → 10.10.1.2    TCP 83 8081 → 38838 [PSH, ACK] Seq=426 Ack=443 Win=65152 Len=17 TSval=3805943070 TSecr=1681683360
1712183184.236215353   294 1.068666368    10.10.1.2 → 10.10.1.1    TCP 83 38838 → 8081 [PSH, ACK] Seq=443 Ack=443 Win=64256 Len=17 TSval=1681683362 TSecr=3805943070
1712183186.236215353   296 1.068788170    10.10.1.1 → 10.10.1.2    TCP 83 8081 → 38838 [PSH, ACK] Seq=443 Ack=460 Win=65152 Len=17 TSval=3805943071 TSecr=1681683362
1712183194.236215353   304 1.069999707    10.10.1.2 → 10.10.1.1    TCP 83 38838 → 8081 [PSH, ACK] Seq=460 Ack=460 Win=64256 Len=17 TSval=1681683363 TSecr=3805943071
1712183196.236215353   306 1.070120486    10.10.1.1 → 10.10.1.2    TCP 83 8081 → 38838 [PSH, ACK] Seq=460 Ack=477 Win=65152 Len=17 TSval=3805943072 TSecr=1681683363
1712183204.236215353   314 1.071335158    10.10.1.2 → 10.10.1.1    TCP 83 38838 → 8081 [PSH, ACK] Seq=477 Ack=477 Win=64256 Len=17 TSval=1681683364 TSecr=3805943072
1712183206.236215353   316 1.071437120    10.10.1.1 → 10.10.1.2    TCP 83 8081 → 38838 [PSH, ACK] Seq=477 Ack=494 Win=65152 Len=17 TSval=3805943074 TSecr=1681683364
1712183214.236215353   324 1.072652065    10.10.1.2 → 10.10.1.1    TCP 83 38838 → 8081 [PSH, ACK] Seq=494 Ack=494 Win=64256 Len=17 TSval=1681683366 TSecr=3805943074
1712183216.236215353   326 1.072777377    10.10.1.1 → 10.10.1.2    TCP 83 8081 → 38838 [PSH, ACK] Seq=494 Ack=511 Win=65152 Len=17 TSval=3805943075 TSecr=1681683366
1712183224.236215353   334 1.073988976    10.10.1.2 → 10.10.1.1    TCP 83 38838 → 8081 [PSH, ACK] Seq=511 Ack=511 Win=64256 Len=17 TSval=1681683367 TSecr=3805943075
1712183226.236215353   336 1.074114844    10.10.1.1 → 10.10.1.2    TCP 83 8081 → 38838 [PSH, ACK] Seq=511 Ack=528 Win=65152 Len=17 TSval=3805943076 TSecr=1681683367
1712183234.236215353   344 1.075329495    10.10.1.2 → 10.10.1.1    TCP 83 38838 → 8081 [PSH, ACK] Seq=528 Ack=528 Win=64256 Len=17 TSval=1681683368 TSecr=3805943076
1712183236.236215353   346 1.075429911    10.10.1.1 → 10.10.1.2    TCP 83 8081 → 38838 [PSH, ACK] Seq=528 Ack=545 Win=65152 Len=17 TSval=3805943078 TSecr=1681683368
1712183244.236215353   354 1.076645587    10.10.1.2 → 10.10.1.1    TCP 83 38838 → 8081 [PSH, ACK] Seq=545 Ack=545 Win=64256 Len=17 TSval=1681683370 TSecr=3805943078
1712183246.236215353   356 1.076771540    10.10.1.1 → 10.10.1.2    TCP 83 8081 → 38838 [PSH, ACK] Seq=545 Ack=562 Win=65152 Len=17 TSval=3805943079 TSecr=1681683370
1712183254.236215353   364 1.077982815    10.10.1.2 → 10.10.1.1    TCP 83 38838 → 8081 [PSH, ACK] Seq=562 Ack=562 Win=64256 Len=17 TSval=1681683371 TSecr=3805943079
1712183256.236215353   366 1.078108557    10.10.1.1 → 10.10.1.2    TCP 83 8081 → 38838 [PSH, ACK] Seq=562 Ack=579 Win=65152 Len=17 TSval=3805943080 TSecr=1681683371
1712183264.236215353   374 1.079340726    10.10.1.2 → 10.10.1.1    TCP 83 38838 → 8081 [PSH, ACK] Seq=579 Ack=579 Win=64256 Len=17 TSval=1681683372 TSecr=3805943080
1712183266.236215353   376 1.079434767    10.10.1.1 → 10.10.1.2    TCP 83 8081 → 38838 [PSH, ACK] Seq=579 Ack=596 Win=65152 Len=17 TSval=3805943082 TSecr=1681683372
1712183274.236215353   384 1.080653170    10.10.1.2 → 10.10.1.1    TCP 83 38838 → 8081 [PSH, ACK] Seq=596 Ack=596 Win=64256 Len=17 TSval=1681683374 TSecr=3805943082
1712183276.236215353   386 1.080779061    10.10.1.1 → 10.10.1.2    TCP 83 8081 → 38838 [PSH, ACK] Seq=596 Ack=613 Win=65152 Len=17 TSval=3805943083 TSecr=1681683374
1712183284.236215353   394 1.081992221    10.10.1.2 → 10.10.1.1    TCP 83 38838 → 8081 [PSH, ACK] Seq=613 Ack=613 Win=64256 Len=17 TSval=1681683375 TSecr=3805943083
1712183286.236215353   396 1.082118718    10.10.1.1 → 10.10.1.2    TCP 83 8081 → 38838 [PSH, ACK] Seq=613 Ack=630 Win=65152 Len=17 TSval=3805943084 TSecr=1681683375
1712183294.236215353   404 1.083333934    10.10.1.2 → 10.10.1.1    TCP 83 38838 → 8081 [PSH, ACK] Seq=630 Ack=630 Win=64256 Len=17 TSval=1681683376 TSecr=3805943084
1712183296.236215353   406 1.083433960    10.10.1.1 → 10.10.1.2    TCP 83 8081 → 38838 [PSH, ACK] Seq=630 Ack=647 Win=65152 Len=17 TSval=3805943086 TSecr=1681683376
1712183304.236215353   414 1.084649160    10.10.1.2 → 10.10.1.1    TCP 83 38838 → 8081 [PSH, ACK] Seq=647 Ack=647 Win=64256 Len=17 TSval=1681683378 TSecr=3805943086
1712183306.236215353   416 1.084773823    10.10.1.1 → 10.10.1.2    TCP 83 8081 → 38838 [PSH, ACK] Seq=647 Ack=664 Win=65152 Len=17 TSval=3805943087 TSecr=1681683378
1712183314.236215353   424 1.085986749    10.10.1.2 → 10.10.1.1    TCP 83 38838 → 8081 [PSH, ACK] Seq=664 Ack=664 Win=64256 Len=17 TSval=1681683379 TSecr=3805943087
1712183316.236215353   426 1.086108866    10.10.1.1 → 10.10.1.2    TCP 83 8081 → 38838 [PSH, ACK] Seq=664 Ack=681 Win=65152 Len=17 TSval=3805943088 TSecr=1681683379
1712183324.236215353   434 1.087323372    10.10.1.2 → 10.10.1.1    TCP 83 38838 → 8081 [PSH, ACK] Seq=681 Ack=681 Win=64256 Len=17 TSval=1681683380 TSecr=3805943088
1712183326.236215353   436 1.087428434    10.10.1.1 → 10.10.1.2    TCP 83 8081 → 38838 [PSH, ACK] Seq=681 Ack=698 Win=65152 Len=17 TSval=3805943090 TSecr=1681683380
1712183334.236215353   444 1.088644382    10.10.1.2 → 10.10.1.1    TCP 83 38838 → 8081 [PSH, ACK] Seq=698 Ack=698 Win=64256 Len=17 TSval=1681683382 TSecr=3805943090
1712183336.236215353   446 1.088697378    10.10.1.1 → 10.10.1.2    TCP 83 8081 → 38838 [PSH, ACK] Seq=698 Ack=715 Win=65152 Len=17 TSval=3805943091 TSecr=1681683382
1712183343.236215353   453 1.089907022    10.10.1.2 → 10.10.1.1    TCP 83 38838 → 8081 [PSH, ACK] Seq=715 Ack=715 Win=64256 Len=17 TSval=1681683383 TSecr=3805943091
1712183345.236215353   455 1.089998211    10.10.1.1 → 10.10.1.2    TCP 83 8081 → 38838 [PSH, ACK] Seq=715 Ack=732 Win=65152 Len=17 TSval=3805943092 TSecr=1681683383
1712183354.236215353   464 1.091211319    10.10.1.2 → 10.10.1.1    TCP 83 38838 → 8081 [PSH, ACK] Seq=732 Ack=732 Win=64256 Len=17 TSval=1681683384 TSecr=3805943092
1712183356.236215353   466 1.091354464    10.10.1.1 → 10.10.1.2    TCP 83 8081 → 38838 [PSH, ACK] Seq=732 Ack=749 Win=65152 Len=17 TSval=3805943094 TSecr=1681683384
1712183363.236215353   473 1.092570897    10.10.1.2 → 10.10.1.1    TCP 83 38838 → 8081 [PSH, ACK] Seq=749 Ack=749 Win=64256 Len=17 TSval=1681683386 TSecr=3805943094
1712183365.236215353   475 1.092700080    10.10.1.1 → 10.10.1.2    TCP 83 8081 → 38838 [PSH, ACK] Seq=749 Ack=766 Win=65152 Len=17 TSval=3805943095 TSecr=1681683386
1712183373.236215353   483 1.093911932    10.10.1.2 → 10.10.1.1    TCP 83 38838 → 8081 [PSH, ACK] Seq=766 Ack=766 Win=64256 Len=17 TSval=1681683387 TSecr=3805943095
1712183375.236215353   485 1.094033543    10.10.1.1 → 10.10.1.2    TCP 83 8081 → 38838 [PSH, ACK] Seq=766 Ack=783 Win=65152 Len=17 TSval=3805943096 TSecr=1681683387
1712183383.236215353   493 1.095245935    10.10.1.2 → 10.10.1.1    TCP 83 38838 → 8081 [PSH, ACK] Seq=783 Ack=783 Win=64256 Len=17 TSval=1681683388 TSecr=3805943096
1712183385.236215353   495 1.095383076    10.10.1.1 → 10.10.1.2    TCP 83 8081 → 38838 [PSH, ACK] Seq=783 Ack=800 Win=65152 Len=17 TSval=3805943098 TSecr=1681683388
1712183393.236215353   503 1.096596922    10.10.1.2 → 10.10.1.1    TCP 83 38838 → 8081 [PSH, ACK] Seq=800 Ack=800 Win=64256 Len=17 TSval=1681683390 TSecr=3805943098
1712183395.236215353   505 1.096722372    10.10.1.1 → 10.10.1.2    TCP 83 8081 → 38838 [PSH, ACK] Seq=800 Ack=817 Win=65152 Len=17 TSval=3805943099 TSecr=1681683390
1712183403.236215353   513 1.097934292    10.10.1.2 → 10.10.1.1    TCP 83 38838 → 8081 [PSH, ACK] Seq=817 Ack=817 Win=64256 Len=17 TSval=1681683391 TSecr=3805943099
1712183405.236215353   515 1.098055692    10.10.1.1 → 10.10.1.2    TCP 83 8081 → 38838 [PSH, ACK] Seq=817 Ack=834 Win=65152 Len=17 TSval=3805943100 TSecr=1681683391
1712183413.236215353   523 1.099267410    10.10.1.2 → 10.10.1.1    TCP 83 38838 → 8081 [PSH, ACK] Seq=834 Ack=834 Win=64256 Len=17 TSval=1681683392 TSecr=3805943100
1712183416.236215353   526 1.099425833    10.10.1.1 → 10.10.1.2    TCP 83 8081 → 38838 [PSH, ACK] Seq=834 Ack=851 Win=65152 Len=17 TSval=3805943102 TSecr=1681683392
1712183423.236215353   533 1.100641414    10.10.1.2 → 10.10.1.1    TCP 83 38838 → 8081 [PSH, ACK] Seq=851 Ack=851 Win=64256 Len=17 TSval=1681683394 TSecr=3805943102
1712183425.236215353   535 1.100768774    10.10.1.1 → 10.10.1.2    TCP 83 8081 → 38838 [PSH, ACK] Seq=851 Ack=868 Win=65152 Len=17 TSval=3805943103 TSecr=1681683394
1712183433.236215353   543 1.101980791    10.10.1.2 → 10.10.1.1    TCP 83 38838 → 8081 [PSH, ACK] Seq=868 Ack=868 Win=64256 Len=17 TSval=1681683395 TSecr=3805943103
1712183435.236215353   545 1.102102417    10.10.1.1 → 10.10.1.2    TCP 83 8081 → 38838 [PSH, ACK] Seq=868 Ack=885 Win=65152 Len=17 TSval=3805943104 TSecr=1681683395
1712183444.236215353   554 1.103315316    10.10.1.2 → 10.10.1.1    TCP 83 38838 → 8081 [PSH, ACK] Seq=885 Ack=885 Win=64256 Len=17 TSval=1681683396 TSecr=3805943104
1712183445.236215353   555 1.103397093    10.10.1.1 → 10.10.1.2    TCP 83 8081 → 38838 [PSH, ACK] Seq=885 Ack=902 Win=65152 Len=17 TSval=3805943106 TSecr=1681683396
1712183453.236215353   563 1.104613644    10.10.1.2 → 10.10.1.1    TCP 83 38838 → 8081 [PSH, ACK] Seq=902 Ack=902 Win=64256 Len=17 TSval=1681683398 TSecr=3805943106
1712183455.236215353   565 1.104749515    10.10.1.1 → 10.10.1.2    TCP 83 8081 → 38838 [PSH, ACK] Seq=902 Ack=919 Win=65152 Len=17 TSval=3805943107 TSecr=1681683398
1712183463.236215353   573 1.105962487    10.10.1.2 → 10.10.1.1    TCP 83 38838 → 8081 [PSH, ACK] Seq=919 Ack=919 Win=64256 Len=17 TSval=1681683399 TSecr=3805943107
1712183465.236215353   575 1.106084928    10.10.1.1 → 10.10.1.2    TCP 83 8081 → 38838 [PSH, ACK] Seq=919 Ack=936 Win=65152 Len=17 TSval=3805943108 TSecr=1681683399
1712183474.236215353   584 1.107296893    10.10.1.2 → 10.10.1.1    TCP 83 38838 → 8081 [PSH, ACK] Seq=936 Ack=936 Win=64256 Len=17 TSval=1681683400 TSecr=3805943108
1712183475.236215353   585 1.107366749    10.10.1.1 → 10.10.1.2    TCP 83 8081 → 38838 [PSH, ACK] Seq=936 Ack=953 Win=65152 Len=17 TSval=3805943110 TSecr=1681683400
1712183483.236215353   593 1.108578121    10.10.1.2 → 10.10.1.1    TCP 83 38838 → 8081 [PSH, ACK] Seq=953 Ack=953 Win=64256 Len=17 TSval=1681683402 TSecr=3805943110
1712183486.236215353   596 1.108763634    10.10.1.1 → 10.10.1.2    TCP 83 8081 → 38838 [PSH, ACK] Seq=953 Ack=970 Win=65152 Len=17 TSval=3805943111 TSecr=1681683402
1712183493.236215353   603 1.109975699    10.10.1.2 → 10.10.1.1    TCP 83 38838 → 8081 [PSH, ACK] Seq=970 Ack=970 Win=64256 Len=17 TSval=1681683403 TSecr=3805943111
1712183495.236215353   605 1.110097200    10.10.1.1 → 10.10.1.2    TCP 83 8081 → 38838 [PSH, ACK] Seq=970 Ack=987 Win=65152 Len=17 TSval=3805943112 TSecr=1681683403
1712183503.236215353   613 1.111308900    10.10.1.2 → 10.10.1.1    TCP 83 38838 → 8081 [PSH, ACK] Seq=987 Ack=987 Win=64256 Len=17 TSval=1681683404 TSecr=3805943112
1712183505.236215353   615 1.111422888    10.10.1.1 → 10.10.1.2    TCP 83 8081 → 38838 [PSH, ACK] Seq=987 Ack=1004 Win=65152 Len=17 TSval=3805943114 TSecr=1681683404
1712183513.236215353   623 1.112638459    10.10.1.2 → 10.10.1.1    TCP 83 38838 → 8081 [PSH, ACK] Seq=1004 Ack=1004 Win=64256 Len=17 TSval=1681683406 TSecr=3805943114
1712183515.236215353   625 1.112765235    10.10.1.1 → 10.10.1.2    TCP 83 8081 → 38838 [PSH, ACK] Seq=1004 Ack=1021 Win=65152 Len=17 TSval=3805943115 TSecr=1681683406
1712183523.236215353   633 1.113977147    10.10.1.2 → 10.10.1.1    TCP 83 38838 → 8081 [PSH, ACK] Seq=1021 Ack=1021 Win=64256 Len=17 TSval=1681683407 TSecr=3805943115
1712183525.236215353   635 1.114112403    10.10.1.1 → 10.10.1.2    TCP 83 8081 → 38838 [PSH, ACK] Seq=1021 Ack=1038 Win=65152 Len=17 TSval=3805943116 TSecr=1681683407
1712183533.236215353   643 1.115326402    10.10.1.2 → 10.10.1.1    TCP 83 38838 → 8081 [PSH, ACK] Seq=1038 Ack=1038 Win=64256 Len=17 TSval=1681683408 TSecr=3805943116
1712183535.236215353   645 1.115424086    10.10.1.1 → 10.10.1.2    TCP 83 8081 → 38838 [PSH, ACK] Seq=1038 Ack=1055 Win=65152 Len=17 TSval=3805943118 TSecr=1681683408
1712183543.236215353   653 1.116639355    10.10.1.2 → 10.10.1.1    TCP 83 38838 → 8081 [PSH, ACK] Seq=1055 Ack=1055 Win=64256 Len=17 TSval=1681683410 TSecr=3805943118
1712183545.236215353   655 1.116765957    10.10.1.1 → 10.10.1.2    TCP 83 8081 → 38838 [PSH, ACK] Seq=1055 Ack=1072 Win=65152 Len=17 TSval=3805943119 TSecr=1681683410
1712183553.236215353   663 1.117976529    10.10.1.2 → 10.10.1.1    TCP 83 38838 → 8081 [PSH, ACK] Seq=1072 Ack=1072 Win=64256 Len=17 TSval=1681683411 TSecr=3805943119
1712183555.236215353   665 1.118103195    10.10.1.1 → 10.10.1.2    TCP 83 8081 → 38838 [PSH, ACK] Seq=1072 Ack=1089 Win=65152 Len=17 TSval=3805943120 TSecr=1681683411
1712183563.236215353   673 1.119316170    10.10.1.2 → 10.10.1.1    TCP 83 38838 → 8081 [PSH, ACK] Seq=1089 Ack=1089 Win=64256 Len=17 TSval=1681683412 TSecr=3805943120
1712183565.236215353   675 1.119423421    10.10.1.1 → 10.10.1.2    TCP 83 8081 → 38838 [PSH, ACK] Seq=1089 Ack=1106 Win=65152 Len=17 TSval=3805943122 TSecr=1681683412
1712183573.236215353   683 1.120639504    10.10.1.2 → 10.10.1.1    TCP 83 38838 → 8081 [PSH, ACK] Seq=1106 Ack=1106 Win=64256 Len=17 TSval=1681683414 TSecr=3805943122
1712183575.236215353   685 1.120765898    10.10.1.1 → 10.10.1.2    TCP 83 8081 → 38838 [PSH, ACK] Seq=1106 Ack=1123 Win=65152 Len=17 TSval=3805943123 TSecr=1681683414
1712183583.236215353   693 1.121977201    10.10.1.2 → 10.10.1.1    TCP 83 38838 → 8081 [PSH, ACK] Seq=1123 Ack=1123 Win=64256 Len=17 TSval=1681683415 TSecr=3805943123
1712183585.236215353   695 1.122103327    10.10.1.1 → 10.10.1.2    TCP 83 8081 → 38838 [PSH, ACK] Seq=1123 Ack=1140 Win=65152 Len=17 TSval=3805943124 TSecr=1681683415
1712183593.236215353   703 1.123316735    10.10.1.2 → 10.10.1.1    TCP 83 38838 → 8081 [PSH, ACK] Seq=1140 Ack=1140 Win=64256 Len=17 TSval=1681683416 TSecr=3805943124
1712183595.236215353   705 1.123428349    10.10.1.1 → 10.10.1.2    TCP 83 8081 → 38838 [PSH, ACK] Seq=1140 Ack=1157 Win=65152 Len=17 TSval=3805943126 TSecr=1681683416
1712183603.236215353   713 1.124641535    10.10.1.2 → 10.10.1.1    TCP 83 38838 → 8081 [PSH, ACK] Seq=1157 Ack=1157 Win=64256 Len=17 TSval=1681683418 TSecr=3805943126
1712183605.236215353   715 1.124767079    10.10.1.1 → 10.10.1.2    TCP 83 8081 → 38838 [PSH, ACK] Seq=1157 Ack=1174 Win=65152 Len=17 TSval=3805943127 TSecr=1681683418
1712183613.236215353   723 1.125978333    10.10.1.2 → 10.10.1.1    TCP 83 38838 → 8081 [PSH, ACK] Seq=1174 Ack=1174 Win=64256 Len=17 TSval=1681683419 TSecr=3805943127
1712183615.236215353   725 1.126099514    10.10.1.1 → 10.10.1.2    TCP 83 8081 → 38838 [PSH, ACK] Seq=1174 Ack=1191 Win=65152 Len=17 TSval=3805943128 TSecr=1681683419
1712183623.236215353   733 1.127310848    10.10.1.2 → 10.10.1.1    TCP 83 38838 → 8081 [PSH, ACK] Seq=1191 Ack=1191 Win=64256 Len=17 TSval=1681683420 TSecr=3805943128
1712183626.236215353   736 1.127427091    10.10.1.1 → 10.10.1.2    TCP 83 8081 → 38838 [PSH, ACK] Seq=1191 Ack=1208 Win=65152 Len=17 TSval=3805943130 TSecr=1681683420
1712183633.236215353   743 1.128640195    10.10.1.2 → 10.10.1.1    TCP 83 38838 → 8081 [PSH, ACK] Seq=1208 Ack=1208 Win=64256 Len=17 TSval=1681683422 TSecr=3805943130
1712183635.236215353   745 1.128766402    10.10.1.1 → 10.10.1.2    TCP 83 8081 → 38838 [PSH, ACK] Seq=1208 Ack=1225 Win=65152 Len=17 TSval=3805943131 TSecr=1681683422
1712183643.236215353   753 1.129976787    10.10.1.2 → 10.10.1.1    TCP 83 38838 → 8081 [PSH, ACK] Seq=1225 Ack=1225 Win=64256 Len=17 TSval=1681683423 TSecr=3805943131
1712183645.236215353   755 1.130112454    10.10.1.1 → 10.10.1.2    TCP 83 8081 → 38838 [PSH, ACK] Seq=1225 Ack=1242 Win=65152 Len=17 TSval=3805943132 TSecr=1681683423
1712183653.236215353   763 1.131324391    10.10.1.2 → 10.10.1.1    TCP 83 38838 → 8081 [PSH, ACK] Seq=1242 Ack=1242 Win=64256 Len=17 TSval=1681683424 TSecr=3805943132
1712183655.236215353   765 1.131429751    10.10.1.1 → 10.10.1.2    TCP 83 8081 → 38838 [PSH, ACK] Seq=1242 Ack=1259 Win=65152 Len=17 TSval=3805943134 TSecr=1681683424
1712183663.236215353   773 1.132645962    10.10.1.2 → 10.10.1.1    TCP 83 38838 → 8081 [PSH, ACK] Seq=1259 Ack=1259 Win=64256 Len=17 TSval=1681683426 TSecr=3805943134
1712183665.236215353   775 1.132768743    10.10.1.1 → 10.10.1.2    TCP 83 8081 → 38838 [PSH, ACK] Seq=1259 Ack=1276 Win=65152 Len=17 TSval=3805943135 TSecr=1681683426
1712183673.236215353   783 1.133979993    10.10.1.2 → 10.10.1.1    TCP 83 38838 → 8081 [PSH, ACK] Seq=1276 Ack=1276 Win=64256 Len=17 TSval=1681683427 TSecr=3805943135
1712183675.236215353   785 1.134102562    10.10.1.1 → 10.10.1.2    TCP 83 8081 → 38838 [PSH, ACK] Seq=1276 Ack=1293 Win=65152 Len=17 TSval=3805943136 TSecr=1681683427
1712183683.236215353   793 1.135314690    10.10.1.2 → 10.10.1.1    TCP 83 38838 → 8081 [PSH, ACK] Seq=1293 Ack=1293 Win=64256 Len=17 TSval=1681683428 TSecr=3805943136
1712183685.236215353   795 1.135435229    10.10.1.1 → 10.10.1.2    TCP 83 8081 → 38838 [PSH, ACK] Seq=1293 Ack=1310 Win=65152 Len=17 TSval=3805943138 TSecr=1681683428
1712183693.236215353   803 1.136649828    10.10.1.2 → 10.10.1.1    TCP 83 38838 → 8081 [PSH, ACK] Seq=1310 Ack=1310 Win=64256 Len=17 TSval=1681683430 TSecr=3805943138
1712183695.236215353   805 1.136772086    10.10.1.1 → 10.10.1.2    TCP 83 8081 → 38838 [PSH, ACK] Seq=1310 Ack=1327 Win=65152 Len=17 TSval=3805943139 TSecr=1681683430
1712183703.236215353   813 1.137983208    10.10.1.2 → 10.10.1.1    TCP 83 38838 → 8081 [PSH, ACK] Seq=1327 Ack=1327 Win=64256 Len=17 TSval=1681683431 TSecr=3805943139
1712183705.236215353   815 1.138105393    10.10.1.1 → 10.10.1.2    TCP 83 8081 → 38838 [PSH, ACK] Seq=1327 Ack=1344 Win=65152 Len=17 TSval=3805943140 TSecr=1681683431
1712183713.236215353   823 1.139316949    10.10.1.2 → 10.10.1.1    TCP 83 38838 → 8081 [PSH, ACK] Seq=1344 Ack=1344 Win=64256 Len=17 TSval=1681683432 TSecr=3805943140
1712183715.236215353   825 1.139441131    10.10.1.1 → 10.10.1.2    TCP 83 8081 → 38838 [PSH, ACK] Seq=1344 Ack=1361 Win=65152 Len=17 TSval=3805943142 TSecr=1681683432
1712183723.236215353   833 1.140657072    10.10.1.2 → 10.10.1.1    TCP 83 38838 → 8081 [PSH, ACK] Seq=1361 Ack=1361 Win=64256 Len=17 TSval=1681683434 TSecr=3805943142
1712183726.236215353   836 1.140779057    10.10.1.1 → 10.10.1.2    TCP 83 8081 → 38838 [PSH, ACK] Seq=1361 Ack=1378 Win=65152 Len=17 TSval=3805943143 TSecr=1681683434
1712183733.236215353   843 1.141990039    10.10.1.2 → 10.10.1.1    TCP 83 38838 → 8081 [PSH, ACK] Seq=1378 Ack=1378 Win=64256 Len=17 TSval=1681683435 TSecr=3805943143
1712183735.236215353   845 1.142128965    10.10.1.1 → 10.10.1.2    TCP 83 8081 → 38838 [PSH, ACK] Seq=1378 Ack=1395 Win=65152 Len=17 TSval=3805943144 TSecr=1681683435
1712183742.236215353   852 1.143344337    10.10.1.2 → 10.10.1.1    TCP 83 38838 → 8081 [PSH, ACK] Seq=1395 Ack=1395 Win=64256 Len=17 TSval=1681683436 TSecr=3805943144
1712183744.236215353   854 1.143446961    10.10.1.1 → 10.10.1.2    TCP 83 8081 → 38838 [PSH, ACK] Seq=1395 Ack=1412 Win=65152 Len=17 TSval=3805943146 TSecr=1681683436
1712183752.236215353   862 1.144661848    10.10.1.2 → 10.10.1.1    TCP 83 38838 → 8081 [PSH, ACK] Seq=1412 Ack=1412 Win=64256 Len=17 TSval=1681683438 TSecr=3805943146
1712183755.236215353   865 1.144786857    10.10.1.1 → 10.10.1.2    TCP 83 8081 → 38838 [PSH, ACK] Seq=1412 Ack=1429 Win=65152 Len=17 TSval=3805943147 TSecr=1681683438
1712183762.236215353   872 1.145999114    10.10.1.2 → 10.10.1.1    TCP 83 38838 → 8081 [PSH, ACK] Seq=1429 Ack=1429 Win=64256 Len=17 TSval=1681683439 TSecr=3805943147
1712183765.236215353   875 1.146120427    10.10.1.1 → 10.10.1.2    TCP 83 8081 → 38838 [PSH, ACK] Seq=1429 Ack=1446 Win=65152 Len=17 TSval=3805943148 TSecr=1681683439
1712183772.236215353   882 1.147334122    10.10.1.2 → 10.10.1.1    TCP 83 38838 → 8081 [PSH, ACK] Seq=1446 Ack=1446 Win=64256 Len=17 TSval=1681683440 TSecr=3805943148
1712183773.236215353   883 1.147384452    10.10.1.1 → 10.10.1.2    TCP 83 8081 → 38838 [PSH, ACK] Seq=1446 Ack=1463 Win=65152 Len=17 TSval=3805943150 TSecr=1681683440
1712183781.236215353   891 1.148597445    10.10.1.2 → 10.10.1.1    TCP 83 38838 → 8081 [PSH, ACK] Seq=1463 Ack=1463 Win=64256 Len=17 TSval=1681683442 TSecr=3805943150
1712183784.236215353   894 1.148718520    10.10.1.1 → 10.10.1.2    TCP 83 8081 → 38838 [PSH, ACK] Seq=1463 Ack=1480 Win=65152 Len=17 TSval=3805943151 TSecr=1681683442
1712183791.236215353   901 1.149929492    10.10.1.2 → 10.10.1.1    TCP 83 38838 → 8081 [PSH, ACK] Seq=1480 Ack=1480 Win=64256 Len=17 TSval=1681683443 TSecr=3805943151
1712183794.236215353   904 1.150052601    10.10.1.1 → 10.10.1.2    TCP 83 8081 → 38838 [PSH, ACK] Seq=1480 Ack=1497 Win=65152 Len=17 TSval=3805943152 TSecr=1681683443
1712183801.236215353   911 1.151264114    10.10.1.2 → 10.10.1.1    TCP 83 38838 → 8081 [PSH, ACK] Seq=1497 Ack=1497 Win=64256 Len=17 TSval=1681683444 TSecr=3805943152
1712183803.236215353   913 1.151330701    10.10.1.1 → 10.10.1.2    TCP 83 8081 → 38838 [PSH, ACK] Seq=1497 Ack=1514 Win=65152 Len=17 TSval=3805943154 TSecr=1681683444
1712183810.236215353   920 1.152542051    10.10.1.2 → 10.10.1.1    TCP 83 38838 → 8081 [PSH, ACK] Seq=1514 Ack=1514 Win=64256 Len=17 TSval=1681683445 TSecr=3805943154
1712183812.236215353   922 1.152680722    10.10.1.1 → 10.10.1.2    TCP 83 8081 → 38838 [PSH, ACK] Seq=1514 Ack=1531 Win=65152 Len=17 TSval=3805943155 TSecr=1681683445
1712183821.236215353   931 1.153891084    10.10.1.2 → 10.10.1.1    TCP 83 38838 → 8081 [PSH, ACK] Seq=1531 Ack=1531 Win=64256 Len=17 TSval=1681683447 TSecr=3805943155
1712183823.236215353   933 1.154030523    10.10.1.1 → 10.10.1.2    TCP 83 8081 → 38838 [PSH, ACK] Seq=1531 Ack=1548 Win=65152 Len=17 TSval=3805943156 TSecr=1681683447
1712183830.236215353   940 1.155243001    10.10.1.2 → 10.10.1.1    TCP 83 38838 → 8081 [PSH, ACK] Seq=1548 Ack=1548 Win=64256 Len=17 TSval=1681683448 TSecr=3805943156
1712183832.236215353   942 1.155382847    10.10.1.1 → 10.10.1.2    TCP 83 8081 → 38838 [PSH, ACK] Seq=1548 Ack=1565 Win=65152 Len=17 TSval=3805943158 TSecr=1681683448
1712183841.236215353   951 1.156597473    10.10.1.2 → 10.10.1.1    TCP 83 38838 → 8081 [PSH, ACK] Seq=1565 Ack=1565 Win=64256 Len=17 TSval=1681683450 TSecr=3805943158
1712183843.236215353   953 1.156726300    10.10.1.1 → 10.10.1.2    TCP 83 8081 → 38838 [PSH, ACK] Seq=1565 Ack=1582 Win=65152 Len=17 TSval=3805943159 TSecr=1681683450
1712183852.236215353   962 1.157937020    10.10.1.2 → 10.10.1.1    TCP 83 38838 → 8081 [PSH, ACK] Seq=1582 Ack=1582 Win=64256 Len=17 TSval=1681683451 TSecr=3805943159
1712183853.236215353   963 1.158063945    10.10.1.1 → 10.10.1.2    TCP 83 8081 → 38838 [PSH, ACK] Seq=1582 Ack=1599 Win=65152 Len=17 TSval=3805943160 TSecr=1681683451
1712183861.236215353   971 1.159277537    10.10.1.2 → 10.10.1.1    TCP 83 38838 → 8081 [PSH, ACK] Seq=1599 Ack=1599 Win=64256 Len=17 TSval=1681683452 TSecr=3805943160
1712183863.236215353   973 1.159404359    10.10.1.1 → 10.10.1.2    TCP 83 8081 → 38838 [PSH, ACK] Seq=1599 Ack=1616 Win=65152 Len=17 TSval=3805943162 TSecr=1681683452
1712183870.236215353   980 1.160618978    10.10.1.2 → 10.10.1.1    TCP 83 38838 → 8081 [PSH, ACK] Seq=1616 Ack=1616 Win=64256 Len=17 TSval=1681683454 TSecr=3805943162
1712183873.236215353   983 1.160759500    10.10.1.1 → 10.10.1.2    TCP 83 8081 → 38838 [PSH, ACK] Seq=1616 Ack=1633 Win=65152 Len=17 TSval=3805943163 TSecr=1681683454
1712183880.236215353   990 1.161970483    10.10.1.2 → 10.10.1.1    TCP 83 38838 → 8081 [PSH, ACK] Seq=1633 Ack=1633 Win=64256 Len=17 TSval=1681683455 TSecr=3805943163
1712183882.236215353   992 1.162095837    10.10.1.1 → 10.10.1.2    TCP 83 8081 → 38838 [PSH, ACK] Seq=1633 Ack=1650 Win=65152 Len=17 TSval=3805943164 TSecr=1681683455
1712183890.236215353  1000 1.163307725    10.10.1.2 → 10.10.1.1    TCP 83 38838 → 8081 [PSH, ACK] Seq=1650 Ack=1650 Win=64256 Len=17 TSval=1681683456 TSecr=3805943164
1712183893.236215353  1003 1.163440782    10.10.1.1 → 10.10.1.2    TCP 83 8081 → 38838 [PSH, ACK] Seq=1650 Ack=1667 Win=65152 Len=17 TSval=3805943166 TSecr=1681683456
1712183900.236215353  1010 1.164670916    10.10.1.2 → 10.10.1.1    TCP 83 38838 → 8081 [PSH, ACK] Seq=1667 Ack=1667 Win=64256 Len=17 TSval=1681683458 TSecr=3805943166
1712183902.236215353  1012 1.164798128    10.10.1.1 → 10.10.1.2    TCP 83 8081 → 38838 [PSH, ACK] Seq=1667 Ack=1684 Win=65152 Len=17 TSval=3805943167 TSecr=1681683458
1712183910.236215353  1020 1.166009184    10.10.1.2 → 10.10.1.1    TCP 83 38838 → 8081 [PSH, ACK] Seq=1684 Ack=1684 Win=64256 Len=17 TSval=1681683459 TSecr=3805943167
1712183912.236215353  1022 1.166131015    10.10.1.1 → 10.10.1.2    TCP 83 8081 → 38838 [PSH, ACK] Seq=1684 Ack=1701 Win=65152 Len=17 TSval=3805943168 TSecr=1681683459
1712183920.236215353  1030 1.167344438    10.10.1.2 → 10.10.1.1    TCP 83 38838 → 8081 [PSH, ACK] Seq=1701 Ack=1701 Win=64256 Len=17 TSval=1681683460 TSecr=3805943168
1712183922.236215353  1032 1.167445034    10.10.1.1 → 10.10.1.2    TCP 83 8081 → 38838 [PSH, ACK] Seq=1701 Ack=1718 Win=65152 Len=17 TSval=3805943170 TSecr=1681683460
1712183930.236215353  1040 1.168660173    10.10.1.2 → 10.10.1.1    TCP 83 38838 → 8081 [PSH, ACK] Seq=1718 Ack=1718 Win=64256 Len=17 TSval=1681683462 TSecr=3805943170
1712183932.236215353  1042 1.168786835    10.10.1.1 → 10.10.1.2    TCP 83 8081 → 38838 [PSH, ACK] Seq=1718 Ack=1735 Win=65152 Len=17 TSval=3805943171 TSecr=1681683462
1712183940.236215353  1050 1.169998936    10.10.1.2 → 10.10.1.1    TCP 83 38838 → 8081 [PSH, ACK] Seq=1735 Ack=1735 Win=64256 Len=17 TSval=1681683463 TSecr=3805943171
1712183942.236215353  1052 1.170133937    10.10.1.1 → 10.10.1.2    TCP 83 8081 → 38838 [PSH, ACK] Seq=1735 Ack=1752 Win=65152 Len=17 TSval=3805943172 TSecr=1681683463
1712183950.236215353  1060 1.171347797    10.10.1.2 → 10.10.1.1    TCP 83 38838 → 8081 [PSH, ACK] Seq=1752 Ack=1752 Win=64256 Len=17 TSval=1681683464 TSecr=3805943172
1712183952.236215353  1062 1.171446299    10.10.1.1 → 10.10.1.2    TCP 83 8081 → 38838 [PSH, ACK] Seq=1752 Ack=1769 Win=65152 Len=17 TSval=3805943174 TSecr=1681683464
1712183960.236215353  1070 1.172661734    10.10.1.2 → 10.10.1.1    TCP 83 38838 → 8081 [PSH, ACK] Seq=1769 Ack=1769 Win=64256 Len=17 TSval=1681683466 TSecr=3805943174
1712183962.236215353  1072 1.172797112    10.10.1.1 → 10.10.1.2    TCP 83 8081 → 38838 [PSH, ACK] Seq=1769 Ack=1786 Win=65152 Len=17 TSval=3805943175 TSecr=1681683466
1712183970.236215353  1080 1.174008418    10.10.1.2 → 10.10.1.1    TCP 83 38838 → 8081 [PSH, ACK] Seq=1786 Ack=1786 Win=64256 Len=17 TSval=1681683467 TSecr=3805943175
1712183972.236215353  1082 1.174133290    10.10.1.1 → 10.10.1.2    TCP 83 8081 → 38838 [PSH, ACK] Seq=1786 Ack=1803 Win=65152 Len=17 TSval=3805943176 TSecr=1681683467
1712183980.236215353  1090 1.175348741    10.10.1.2 → 10.10.1.1    TCP 83 38838 → 8081 [PSH, ACK] Seq=1803 Ack=1803 Win=64256 Len=17 TSval=1681683468 TSecr=3805943176
1712183982.236215353  1092 1.175445577    10.10.1.1 → 10.10.1.2    TCP 83 8081 → 38838 [PSH, ACK] Seq=1803 Ack=1820 Win=65152 Len=17 TSval=3805943178 TSecr=1681683468
1712183990.236215353  1100 1.176661001    10.10.1.2 → 10.10.1.1    TCP 83 38838 → 8081 [PSH, ACK] Seq=1820 Ack=1820 Win=64256 Len=17 TSval=1681683470 TSecr=3805943178
1712183992.236215353  1102 1.176786583    10.10.1.1 → 10.10.1.2    TCP 83 8081 → 38838 [PSH, ACK] Seq=1820 Ack=1837 Win=65152 Len=17 TSval=3805943179 TSecr=1681683470
1712184000.236215353  1110 1.177997495    10.10.1.2 → 10.10.1.1    TCP 83 38838 → 8081 [PSH, ACK] Seq=1837 Ack=1837 Win=64256 Len=17 TSval=1681683471 TSecr=3805943179
1712184002.236215353  1112 1.178123088    10.10.1.1 → 10.10.1.2    TCP 83 8081 → 38838 [PSH, ACK] Seq=1837 Ack=1854 Win=65152 Len=17 TSval=3805943180 TSecr=1681683471
1712184010.236215353  1120 1.179336727    10.10.1.2 → 10.10.1.1    TCP 83 38838 → 8081 [PSH, ACK] Seq=1854 Ack=1854 Win=64256 Len=17 TSval=1681683472 TSecr=3805943180
1712184013.236215353  1123 1.179446642    10.10.1.1 → 10.10.1.2    TCP 83 8081 → 38838 [PSH, ACK] Seq=1854 Ack=1871 Win=65152 Len=17 TSval=3805943182 TSecr=1681683472
1712184020.236215353  1130 1.180661984    10.10.1.2 → 10.10.1.1    TCP 83 38838 → 8081 [PSH, ACK] Seq=1871 Ack=1871 Win=64256 Len=17 TSval=1681683474 TSecr=3805943182
1712184022.236215353  1132 1.180796306    10.10.1.1 → 10.10.1.2    TCP 83 8081 → 38838 [PSH, ACK] Seq=1871 Ack=1888 Win=65152 Len=17 TSval=3805943183 TSecr=1681683474
1712184030.236215353  1140 1.182007267    10.10.1.2 → 10.10.1.1    TCP 83 38838 → 8081 [PSH, ACK] Seq=1888 Ack=1888 Win=64256 Len=17 TSval=1681683475 TSecr=3805943183
1712184032.236215353  1142 1.182128892    10.10.1.1 → 10.10.1.2    TCP 83 8081 → 38838 [PSH, ACK] Seq=1888 Ack=1905 Win=65152 Len=17 TSval=3805943184 TSecr=1681683475
1712184040.236215353  1150 1.183342964    10.10.1.2 → 10.10.1.1    TCP 83 38838 → 8081 [PSH, ACK] Seq=1905 Ack=1905 Win=64256 Len=17 TSval=1681683476 TSecr=3805943184
1712184042.236215353  1152 1.183440496    10.10.1.1 → 10.10.1.2    TCP 83 8081 → 38838 [PSH, ACK] Seq=1905 Ack=1922 Win=65152 Len=17 TSval=3805943186 TSecr=1681683476
1712184050.236215353  1160 1.184666529    10.10.1.2 → 10.10.1.1    TCP 83 38838 → 8081 [PSH, ACK] Seq=1922 Ack=1922 Win=64256 Len=17 TSval=1681683478 TSecr=3805943186
1712184053.236215353  1163 1.184848312    10.10.1.1 → 10.10.1.2    TCP 83 8081 → 38838 [PSH, ACK] Seq=1922 Ack=1939 Win=65152 Len=17 TSval=3805943187 TSecr=1681683478
1712184060.236215353  1170 1.186059408    10.10.1.2 → 10.10.1.1    TCP 83 38838 → 8081 [PSH, ACK] Seq=1939 Ack=1939 Win=64256 Len=17 TSval=1681683479 TSecr=3805943187
1712184062.236215353  1172 1.186179969    10.10.1.1 → 10.10.1.2    TCP 83 8081 → 38838 [PSH, ACK] Seq=1939 Ack=1956 Win=65152 Len=17 TSval=3805943188 TSecr=1681683479
1712184070.236215353  1180 1.187394057    10.10.1.2 → 10.10.1.1    TCP 83 38838 → 8081 [PSH, ACK] Seq=1956 Ack=1956 Win=64256 Len=17 TSval=1681683480 TSecr=3805943188
1712184072.236215353  1182 1.187475256    10.10.1.1 → 10.10.1.2    TCP 83 8081 → 38838 [PSH, ACK] Seq=1956 Ack=1973 Win=65152 Len=17 TSval=3805943190 TSecr=1681683480
1712184080.236215353  1190 1.188689106    10.10.1.2 → 10.10.1.1    TCP 83 38838 → 8081 [PSH, ACK] Seq=1973 Ack=1973 Win=64256 Len=17 TSval=1681683482 TSecr=3805943190
1712184082.236215353  1192 1.188820355    10.10.1.1 → 10.10.1.2    TCP 83 8081 → 38838 [PSH, ACK] Seq=1973 Ack=1990 Win=65152 Len=17 TSval=3805943191 TSecr=1681683482
1712184090.236215353  1200 1.190032629    10.10.1.2 → 10.10.1.1    TCP 83 38838 → 8081 [PSH, ACK] Seq=1990 Ack=1990 Win=64256 Len=17 TSval=1681683483 TSecr=3805943191
1712184092.236215353  1202 1.190153967    10.10.1.1 → 10.10.1.2    TCP 83 8081 → 38838 [PSH, ACK] Seq=1990 Ack=2007 Win=65152 Len=17 TSval=3805943192 TSecr=1681683483
