1711546465.124013662    21 0.279984913    10.10.1.2 → 10.10.1.1    TCP 74 46642 → 8081 [SYN] Seq=0 Win=64240 Len=0 MSS=1460 SACK_PERM=1 TSval=1045236470 TSecr=0 WS=128
1711546466.124013662    22 0.280023113    10.10.1.1 → 10.10.1.2    TCP 74 8081 → 46642 [SYN, ACK] Seq=0 Ack=1 Win=65160 Len=0 MSS=1460 SACK_PERM=1 TSval=3169496178 TSecr=1045236470 WS=128
1711546468.124013662    24 0.280097784    10.10.1.2 → 10.10.1.1    TCP 66 46642 → 8081 [ACK] Seq=1 Ack=1 Win=64256 Len=0 TSval=1045236470 TSecr=3169496178
1711546480.124013662    36 0.560684115    10.10.1.2 → 10.10.1.1    TCP 83 46642 → 8081 [PSH, ACK] Seq=1 Ack=1 Win=64256 Len=17 TSval=1045236750 TSecr=3169496178
1711546481.124013662    37 0.560711117    10.10.1.1 → 10.10.1.2    TCP 66 8081 → 46642 [ACK] Seq=1 Ack=18 Win=65152 Len=0 TSval=3169496459 TSecr=1045236750
1711546484.124013662    40 0.560966022    10.10.1.1 → 10.10.1.2    TCP 83 8081 → 46642 [PSH, ACK] Seq=1 Ack=18 Win=65152 Len=17 TSval=3169496459 TSecr=1045236750
1711546485.124013662    41 0.560993325    10.10.1.2 → 10.10.1.1    TCP 66 46642 → 8081 [ACK] Seq=18 Ack=18 Win=64256 Len=0 TSval=1045236751 TSecr=3169496459
1711546493.124013662    49 0.687085832    10.10.1.2 → 10.10.1.1    TCP 83 46642 → 8081 [PSH, ACK] Seq=18 Ack=18 Win=64256 Len=17 TSval=1045236877 TSecr=3169496459
1711546496.124013662    52 0.687188668    10.10.1.1 → 10.10.1.2    TCP 83 8081 → 46642 [PSH, ACK] Seq=18 Ack=35 Win=65152 Len=17 TSval=3169496585 TSecr=1045236877
1711546497.124013662    53 0.687217714    10.10.1.2 → 10.10.1.1    TCP 66 46642 → 8081 [ACK] Seq=35 Ack=35 Win=64256 Len=0 TSval=1045236877 TSecr=3169496585
1711546505.124013662    61 0.713045419    10.10.1.2 → 10.10.1.1    TCP 83 46642 → 8081 [PSH, ACK] Seq=35 Ack=35 Win=64256 Len=17 TSval=1045236903 TSecr=3169496585
1711546508.124013662    64 0.713170721    10.10.1.1 → 10.10.1.2    TCP 83 8081 → 46642 [PSH, ACK] Seq=35 Ack=52 Win=65152 Len=17 TSval=3169496611 TSecr=1045236903
1711546515.124013662    71 0.753782929    10.10.1.2 → 10.10.1.1    TCP 66 46642 → 8081 [ACK] Seq=52 Ack=52 Win=64256 Len=0 TSval=1045236944 TSecr=3169496611
1711546516.124013662    72 0.757022462    10.10.1.2 → 10.10.1.1    TCP 83 46642 → 8081 [PSH, ACK] Seq=52 Ack=52 Win=64256 Len=17 TSval=1045236947 TSecr=3169496611
1711546519.124013662    75 0.757147444    10.10.1.1 → 10.10.1.2    TCP 83 8081 → 46642 [PSH, ACK] Seq=52 Ack=69 Win=65152 Len=17 TSval=3169496655 TSecr=1045236947
1711546520.124013662    76 0.757177034    10.10.1.2 → 10.10.1.1    TCP 66 46642 → 8081 [ACK] Seq=69 Ack=69 Win=64256 Len=0 TSval=1045236947 TSecr=3169496655
1711546529.124013662    85 0.803801743    10.10.1.2 → 10.10.1.1    TCP 83 46642 → 8081 [PSH, ACK] Seq=69 Ack=69 Win=64256 Len=17 TSval=1045236994 TSecr=3169496655
1711546532.124013662    88 0.803926989    10.10.1.1 → 10.10.1.2    TCP 83 8081 → 46642 [PSH, ACK] Seq=69 Ack=86 Win=65152 Len=17 TSval=3169496702 TSecr=1045236994
1711546533.124013662    89 0.803958022    10.10.1.2 → 10.10.1.1    TCP 66 46642 → 8081 [ACK] Seq=86 Ack=86 Win=64256 Len=0 TSval=1045236994 TSecr=3169496702
1711546541.124013662    97 0.889293389    10.10.1.2 → 10.10.1.1    TCP 83 46642 → 8081 [PSH, ACK] Seq=86 Ack=86 Win=64256 Len=17 TSval=1045237079 TSecr=3169496702
1711546543.124013662    99 0.889418267    10.10.1.1 → 10.10.1.2    TCP 83 8081 → 46642 [PSH, ACK] Seq=86 Ack=103 Win=65152 Len=17 TSval=3169496788 TSecr=1045237079
1711546545.124013662   101 0.889447947    10.10.1.2 → 10.10.1.1    TCP 66 46642 → 8081 [ACK] Seq=103 Ack=103 Win=64256 Len=0 TSval=1045237079 TSecr=3169496788
1711546553.124013662   109 0.960526145    10.10.1.2 → 10.10.1.1    TCP 83 46642 → 8081 [PSH, ACK] Seq=103 Ack=103 Win=64256 Len=17 TSval=1045237150 TSecr=3169496788
1711546555.124013662   111 0.960661838    10.10.1.1 → 10.10.1.2    TCP 83 8081 → 46642 [PSH, ACK] Seq=103 Ack=120 Win=65152 Len=17 TSval=3169496859 TSecr=1045237150
1711546557.124013662   113 0.960691787    10.10.1.2 → 10.10.1.1    TCP 66 46642 → 8081 [ACK] Seq=120 Ack=120 Win=64256 Len=0 TSval=1045237150 TSecr=3169496859
1711546565.124013662   121 1.198821247    10.10.1.2 → 10.10.1.1    TCP 83 46642 → 8081 [PSH, ACK] Seq=120 Ack=120 Win=64256 Len=17 TSval=1045237389 TSecr=3169496859
1711546568.124013662   124 1.198946011    10.10.1.1 → 10.10.1.2    TCP 83 8081 → 46642 [PSH, ACK] Seq=120 Ack=137 Win=65152 Len=17 TSval=3169497097 TSecr=1045237389
1711546569.124013662   125 1.198975657    10.10.1.2 → 10.10.1.1    TCP 66 46642 → 8081 [ACK] Seq=137 Ack=137 Win=64256 Len=0 TSval=1045237389 TSecr=3169497097
1711546577.124013662   133 1.206438368    10.10.1.2 → 10.10.1.1    TCP 83 46642 → 8081 [PSH, ACK] Seq=137 Ack=137 Win=64256 Len=17 TSval=1045237396 TSecr=3169497097
1711546580.124013662   136 1.206564077    10.10.1.1 → 10.10.1.2    TCP 83 8081 → 46642 [PSH, ACK] Seq=137 Ack=154 Win=65152 Len=17 TSval=3169497105 TSecr=1045237396
1711546587.124013662   143 1.247371080    10.10.1.2 → 10.10.1.1    TCP 83 46642 → 8081 [PSH, ACK] Seq=154 Ack=154 Win=64256 Len=17 TSval=1045237437 TSecr=3169497105
1711546590.124013662   146 1.247507058    10.10.1.1 → 10.10.1.2    TCP 83 8081 → 46642 [PSH, ACK] Seq=154 Ack=171 Win=65152 Len=17 TSval=3169497146 TSecr=1045237437
1711546597.124013662   153 1.282640044    10.10.1.2 → 10.10.1.1    TCP 83 46642 → 8081 [PSH, ACK] Seq=171 Ack=171 Win=64256 Len=17 TSval=1045237472 TSecr=3169497146
1711546600.124013662   156 1.282771420    10.10.1.1 → 10.10.1.2    TCP 83 8081 → 46642 [PSH, ACK] Seq=171 Ack=188 Win=65152 Len=17 TSval=3169497181 TSecr=1045237472
1711546607.124013662   163 1.319829003    10.10.1.2 → 10.10.1.1    TCP 83 46642 → 8081 [PSH, ACK] Seq=188 Ack=188 Win=64256 Len=17 TSval=1045237510 TSecr=3169497181
1711546610.124013662   166 1.319961796    10.10.1.1 → 10.10.1.2    TCP 83 8081 → 46642 [PSH, ACK] Seq=188 Ack=205 Win=65152 Len=17 TSval=3169497218 TSecr=1045237510
1711546617.124013662   173 1.336396703    10.10.1.2 → 10.10.1.1    TCP 83 46642 → 8081 [PSH, ACK] Seq=205 Ack=205 Win=64256 Len=17 TSval=1045237526 TSecr=3169497218
1711546620.124013662   176 1.336527101    10.10.1.1 → 10.10.1.2    TCP 83 8081 → 46642 [PSH, ACK] Seq=205 Ack=222 Win=65152 Len=17 TSval=3169497235 TSecr=1045237526
1711546627.124013662   183 1.377788913    10.10.1.2 → 10.10.1.1    TCP 66 46642 → 8081 [ACK] Seq=222 Ack=222 Win=64256 Len=0 TSval=1045237568 TSecr=3169497235
1711546629.124013662   185 1.378193499    10.10.1.2 → 10.10.1.1    TCP 83 46642 → 8081 [PSH, ACK] Seq=222 Ack=222 Win=64256 Len=17 TSval=1045237568 TSecr=3169497235
1711546631.124013662   187 1.378320704    10.10.1.1 → 10.10.1.2    TCP 83 8081 → 46642 [PSH, ACK] Seq=222 Ack=239 Win=65152 Len=17 TSval=3169497276 TSecr=1045237568
1711546633.124013662   189 1.378350500    10.10.1.2 → 10.10.1.1    TCP 66 46642 → 8081 [ACK] Seq=239 Ack=239 Win=64256 Len=0 TSval=1045237568 TSecr=3169497276
1711546641.124013662   197 1.469685998    10.10.1.2 → 10.10.1.1    TCP 83 46642 → 8081 [PSH, ACK] Seq=239 Ack=239 Win=64256 Len=17 TSval=1045237659 TSecr=3169497276
1711546643.124013662   199 1.469813901    10.10.1.1 → 10.10.1.2    TCP 83 8081 → 46642 [PSH, ACK] Seq=239 Ack=256 Win=65152 Len=17 TSval=3169497368 TSecr=1045237659
1711546645.124013662   201 1.469843127    10.10.1.2 → 10.10.1.1    TCP 66 46642 → 8081 [ACK] Seq=256 Ack=256 Win=64256 Len=0 TSval=1045237660 TSecr=3169497368
1711546653.124013662   209 1.672474303    10.10.1.2 → 10.10.1.1    TCP 83 46642 → 8081 [PSH, ACK] Seq=256 Ack=256 Win=64256 Len=17 TSval=1045237862 TSecr=3169497368
1711546655.124013662   211 1.672599832    10.10.1.1 → 10.10.1.2    TCP 83 8081 → 46642 [PSH, ACK] Seq=256 Ack=273 Win=65152 Len=17 TSval=3169497571 TSecr=1045237862
1711546657.124013662   213 1.672629618    10.10.1.2 → 10.10.1.1    TCP 66 46642 → 8081 [ACK] Seq=273 Ack=273 Win=64256 Len=0 TSval=1045237862 TSecr=3169497571
1711546665.124013662   221 1.890299739    10.10.1.2 → 10.10.1.1    TCP 83 46642 → 8081 [PSH, ACK] Seq=273 Ack=273 Win=64256 Len=17 TSval=1045238080 TSecr=3169497571
1711546668.124013662   224 1.890425483    10.10.1.1 → 10.10.1.2    TCP 83 8081 → 46642 [PSH, ACK] Seq=273 Ack=290 Win=65152 Len=17 TSval=3169497789 TSecr=1045238080
1711546669.124013662   225 1.890455147    10.10.1.2 → 10.10.1.1    TCP 66 46642 → 8081 [ACK] Seq=290 Ack=290 Win=64256 Len=0 TSval=1045238080 TSecr=3169497789
1711546677.124013662   233 1.951485798    10.10.1.2 → 10.10.1.1    TCP 83 46642 → 8081 [PSH, ACK] Seq=290 Ack=290 Win=64256 Len=17 TSval=1045238141 TSecr=3169497789
1711546680.124013662   236 1.951611143    10.10.1.1 → 10.10.1.2    TCP 83 8081 → 46642 [PSH, ACK] Seq=290 Ack=307 Win=65152 Len=17 TSval=3169497850 TSecr=1045238141
1711546681.124013662   237 1.951641345    10.10.1.2 → 10.10.1.1    TCP 66 46642 → 8081 [ACK] Seq=307 Ack=307 Win=64256 Len=0 TSval=1045238141 TSecr=3169497850
1711546689.124013662   245 2.039814385    10.10.1.2 → 10.10.1.1    TCP 83 46642 → 8081 [PSH, ACK] Seq=307 Ack=307 Win=64256 Len=17 TSval=1045238230 TSecr=3169497850
1711546692.124013662   248 2.039940029    10.10.1.1 → 10.10.1.2    TCP 83 8081 → 46642 [PSH, ACK] Seq=307 Ack=324 Win=65152 Len=17 TSval=3169497938 TSecr=1045238230
1711546693.124013662   249 2.039969663    10.10.1.2 → 10.10.1.1    TCP 66 46642 → 8081 [ACK] Seq=324 Ack=324 Win=64256 Len=0 TSval=1045238230 TSecr=3169497938
1711546701.124013662   257 2.146939641    10.10.1.2 → 10.10.1.1    TCP 83 46642 → 8081 [PSH, ACK] Seq=324 Ack=324 Win=64256 Len=17 TSval=1045238337 TSecr=3169497938
1711546704.124013662   260 2.147064569    10.10.1.1 → 10.10.1.2    TCP 83 8081 → 46642 [PSH, ACK] Seq=324 Ack=341 Win=65152 Len=17 TSval=3169498045 TSecr=1045238337
1711546705.124013662   261 2.147094393    10.10.1.2 → 10.10.1.1    TCP 66 46642 → 8081 [ACK] Seq=341 Ack=341 Win=64256 Len=0 TSval=1045238337 TSecr=3169498045
1711546713.124013662   269 2.180363115    10.10.1.2 → 10.10.1.1    TCP 83 46642 → 8081 [PSH, ACK] Seq=341 Ack=341 Win=64256 Len=17 TSval=1045238370 TSecr=3169498045
1711546716.124013662   272 2.180489636    10.10.1.1 → 10.10.1.2    TCP 83 8081 → 46642 [PSH, ACK] Seq=341 Ack=358 Win=65152 Len=17 TSval=3169498079 TSecr=1045238370
1711546723.124013662   279 2.221782790    10.10.1.2 → 10.10.1.1    TCP 66 46642 → 8081 [ACK] Seq=358 Ack=358 Win=64256 Len=0 TSval=1045238412 TSecr=3169498079
1711546725.124013662   281 2.281075652    10.10.1.2 → 10.10.1.1    TCP 83 46642 → 8081 [PSH, ACK] Seq=358 Ack=358 Win=64256 Len=17 TSval=1045238471 TSecr=3169498079
1711546728.124013662   284 2.281200508    10.10.1.1 → 10.10.1.2    TCP 83 8081 → 46642 [PSH, ACK] Seq=358 Ack=375 Win=65152 Len=17 TSval=3169498179 TSecr=1045238471
1711546729.124013662   285 2.281229818    10.10.1.2 → 10.10.1.1    TCP 66 46642 → 8081 [ACK] Seq=375 Ack=375 Win=64256 Len=0 TSval=1045238471 TSecr=3169498179
1711546737.124013662   293 2.331798046    10.10.1.2 → 10.10.1.1    TCP 83 46642 → 8081 [PSH, ACK] Seq=375 Ack=375 Win=64256 Len=17 TSval=1045238522 TSecr=3169498179
1711546739.124013662   295 2.331923021    10.10.1.1 → 10.10.1.2    TCP 83 8081 → 46642 [PSH, ACK] Seq=375 Ack=392 Win=65152 Len=17 TSval=3169498230 TSecr=1045238522
1711546741.124013662   297 2.331954231    10.10.1.2 → 10.10.1.1    TCP 66 46642 → 8081 [ACK] Seq=392 Ack=392 Win=64256 Len=0 TSval=1045238522 TSecr=3169498230
1711546749.124013662   305 2.362896409    10.10.1.2 → 10.10.1.1    TCP 83 46642 → 8081 [PSH, ACK] Seq=392 Ack=392 Win=64256 Len=17 TSval=1045238553 TSecr=3169498230
1711546751.124013662   307 2.363022087    10.10.1.1 → 10.10.1.2    TCP 83 8081 → 46642 [PSH, ACK] Seq=392 Ack=409 Win=65152 Len=17 TSval=3169498261 TSecr=1045238553
1711546759.124013662   315 2.405785623    10.10.1.2 → 10.10.1.1    TCP 66 46642 → 8081 [ACK] Seq=409 Ack=409 Win=64256 Len=0 TSval=1045238596 TSecr=3169498261
1711546761.124013662   317 2.595338111    10.10.1.2 → 10.10.1.1    TCP 83 46642 → 8081 [PSH, ACK] Seq=409 Ack=409 Win=64256 Len=17 TSval=1045238785 TSecr=3169498261
1711546764.124013662   320 2.595459482    10.10.1.1 → 10.10.1.2    TCP 83 8081 → 46642 [PSH, ACK] Seq=409 Ack=426 Win=65152 Len=17 TSval=3169498494 TSecr=1045238785
1711546765.124013662   321 2.595489528    10.10.1.2 → 10.10.1.1    TCP 66 46642 → 8081 [ACK] Seq=426 Ack=426 Win=64256 Len=0 TSval=1045238785 TSecr=3169498494
1711546774.124013662   330 2.775957046    10.10.1.2 → 10.10.1.1    TCP 83 46642 → 8081 [PSH, ACK] Seq=426 Ack=426 Win=64256 Len=17 TSval=1045238966 TSecr=3169498494
1711546777.124013662   333 2.776082844    10.10.1.1 → 10.10.1.2    TCP 83 8081 → 46642 [PSH, ACK] Seq=426 Ack=443 Win=65152 Len=17 TSval=3169498674 TSecr=1045238966
1711546778.124013662   334 2.776112738    10.10.1.2 → 10.10.1.1    TCP 66 46642 → 8081 [ACK] Seq=443 Ack=443 Win=64256 Len=0 TSval=1045238966 TSecr=3169498674
1711546786.124013662   342 2.974051183    10.10.1.2 → 10.10.1.1    TCP 83 46642 → 8081 [PSH, ACK] Seq=443 Ack=443 Win=64256 Len=17 TSval=1045239164 TSecr=3169498674
1711546789.124013662   345 2.974176641    10.10.1.1 → 10.10.1.2    TCP 83 8081 → 46642 [PSH, ACK] Seq=443 Ack=460 Win=65152 Len=17 TSval=3169498872 TSecr=1045239164
1711546790.124013662   346 2.974206130    10.10.1.2 → 10.10.1.1    TCP 66 46642 → 8081 [ACK] Seq=460 Ack=460 Win=64256 Len=0 TSval=1045239164 TSecr=3169498872
1711546798.124013662   354 3.006883245    10.10.1.2 → 10.10.1.1    TCP 83 46642 → 8081 [PSH, ACK] Seq=460 Ack=460 Win=64256 Len=17 TSval=1045239197 TSecr=3169498872
1711546801.124013662   357 3.007009625    10.10.1.1 → 10.10.1.2    TCP 83 8081 → 46642 [PSH, ACK] Seq=460 Ack=477 Win=65152 Len=17 TSval=3169498905 TSecr=1045239197
1711546808.124013662   364 3.049781912    10.10.1.2 → 10.10.1.1    TCP 66 46642 → 8081 [ACK] Seq=477 Ack=477 Win=64256 Len=0 TSval=1045239240 TSecr=3169498905
1711546810.124013662   366 3.160000433    10.10.1.2 → 10.10.1.1    TCP 83 46642 → 8081 [PSH, ACK] Seq=477 Ack=477 Win=64256 Len=17 TSval=1045239350 TSecr=3169498905
1711546813.124013662   369 3.160126324    10.10.1.1 → 10.10.1.2    TCP 83 8081 → 46642 [PSH, ACK] Seq=477 Ack=494 Win=65152 Len=17 TSval=3169499058 TSecr=1045239350
1711546814.124013662   370 3.160156375    10.10.1.2 → 10.10.1.1    TCP 66 46642 → 8081 [ACK] Seq=494 Ack=494 Win=64256 Len=0 TSval=1045239350 TSecr=3169499058
1711546822.124013662   378 3.171296832    10.10.1.2 → 10.10.1.1    TCP 83 46642 → 8081 [PSH, ACK] Seq=494 Ack=494 Win=64256 Len=17 TSval=1045239361 TSecr=3169499058
1711546825.124013662   381 3.171423841    10.10.1.1 → 10.10.1.2    TCP 83 8081 → 46642 [PSH, ACK] Seq=494 Ack=511 Win=65152 Len=17 TSval=3169499070 TSecr=1045239361
1711546832.124013662   388 3.213781329    10.10.1.2 → 10.10.1.1    TCP 66 46642 → 8081 [ACK] Seq=511 Ack=511 Win=64256 Len=0 TSval=1045239404 TSecr=3169499070
1711546834.124013662   390 3.225535849    10.10.1.2 → 10.10.1.1    TCP 83 46642 → 8081 [PSH, ACK] Seq=511 Ack=511 Win=64256 Len=17 TSval=1045239415 TSecr=3169499070
1711546836.124013662   392 3.225675938    10.10.1.1 → 10.10.1.2    TCP 83 8081 → 46642 [PSH, ACK] Seq=511 Ack=528 Win=65152 Len=17 TSval=3169499124 TSecr=1045239415
1711546838.124013662   394 3.225705615    10.10.1.2 → 10.10.1.1    TCP 66 46642 → 8081 [ACK] Seq=528 Ack=528 Win=64256 Len=0 TSval=1045239415 TSecr=3169499124
1711546846.124013662   402 3.232304766    10.10.1.2 → 10.10.1.1    TCP 83 46642 → 8081 [PSH, ACK] Seq=528 Ack=528 Win=64256 Len=17 TSval=1045239422 TSecr=3169499124
1711546848.124013662   404 3.232441068    10.10.1.1 → 10.10.1.2    TCP 83 8081 → 46642 [PSH, ACK] Seq=528 Ack=545 Win=65152 Len=17 TSval=3169499131 TSecr=1045239422
1711546856.124013662   412 3.273788134    10.10.1.2 → 10.10.1.1    TCP 66 46642 → 8081 [ACK] Seq=545 Ack=545 Win=64256 Len=0 TSval=1045239464 TSecr=3169499131
1711546858.124013662   414 3.404040477    10.10.1.2 → 10.10.1.1    TCP 83 46642 → 8081 [PSH, ACK] Seq=545 Ack=545 Win=64256 Len=17 TSval=1045239594 TSecr=3169499131
1711546860.124013662   416 3.404166757    10.10.1.1 → 10.10.1.2    TCP 83 8081 → 46642 [PSH, ACK] Seq=545 Ack=562 Win=65152 Len=17 TSval=3169499302 TSecr=1045239594
1711546862.124013662   418 3.404203645    10.10.1.2 → 10.10.1.1    TCP 66 46642 → 8081 [ACK] Seq=562 Ack=562 Win=64256 Len=0 TSval=1045239594 TSecr=3169499302
1711546870.124013662   426 3.507331722    10.10.1.2 → 10.10.1.1    TCP 83 46642 → 8081 [PSH, ACK] Seq=562 Ack=562 Win=64256 Len=17 TSval=1045239697 TSecr=3169499302
1711546872.124013662   428 3.507457872    10.10.1.1 → 10.10.1.2    TCP 83 8081 → 46642 [PSH, ACK] Seq=562 Ack=579 Win=65152 Len=17 TSval=3169499406 TSecr=1045239697
1711546874.124013662   430 3.507494427    10.10.1.2 → 10.10.1.1    TCP 66 46642 → 8081 [ACK] Seq=579 Ack=579 Win=64256 Len=0 TSval=1045239697 TSecr=3169499406
1711546882.124013662   438 3.561411422    10.10.1.2 → 10.10.1.1    TCP 83 46642 → 8081 [PSH, ACK] Seq=579 Ack=579 Win=64256 Len=17 TSval=1045239751 TSecr=3169499406
1711546884.124013662   440 3.561534286    10.10.1.1 → 10.10.1.2    TCP 83 8081 → 46642 [PSH, ACK] Seq=579 Ack=596 Win=65152 Len=17 TSval=3169499460 TSecr=1045239751
1711546886.124013662   442 3.561571986    10.10.1.2 → 10.10.1.1    TCP 66 46642 → 8081 [ACK] Seq=596 Ack=596 Win=64256 Len=0 TSval=1045239751 TSecr=3169499460
1711546893.124013662   449 3.582984794    10.10.1.2 → 10.10.1.1    TCP 83 46642 → 8081 [PSH, ACK] Seq=596 Ack=596 Win=64256 Len=17 TSval=1045239773 TSecr=3169499460
1711546895.124013662   451 3.583110117    10.10.1.1 → 10.10.1.2    TCP 83 8081 → 46642 [PSH, ACK] Seq=596 Ack=613 Win=65152 Len=17 TSval=3169499481 TSecr=1045239773
1711546903.124013662   459 3.607663627    10.10.1.2 → 10.10.1.1    TCP 83 46642 → 8081 [PSH, ACK] Seq=613 Ack=613 Win=64256 Len=17 TSval=1045239797 TSecr=3169499481
1711546905.124013662   461 3.607801589    10.10.1.1 → 10.10.1.2    TCP 83 8081 → 46642 [PSH, ACK] Seq=613 Ack=630 Win=65152 Len=17 TSval=3169499506 TSecr=1045239797
1711546913.124013662   469 3.649783889    10.10.1.2 → 10.10.1.1    TCP 66 46642 → 8081 [ACK] Seq=630 Ack=630 Win=64256 Len=0 TSval=1045239840 TSecr=3169499506
1711546915.124013662   471 3.865077033    10.10.1.2 → 10.10.1.1    TCP 83 46642 → 8081 [PSH, ACK] Seq=630 Ack=630 Win=64256 Len=17 TSval=1045240055 TSecr=3169499506
1711546918.124013662   474 3.865197198    10.10.1.1 → 10.10.1.2    TCP 83 8081 → 46642 [PSH, ACK] Seq=630 Ack=647 Win=65152 Len=17 TSval=3169499763 TSecr=1045240055
1711546919.124013662   475 3.865226694    10.10.1.2 → 10.10.1.1    TCP 66 46642 → 8081 [ACK] Seq=647 Ack=647 Win=64256 Len=0 TSval=1045240055 TSecr=3169499763
1711546927.124013662   483 3.875805216    10.10.1.2 → 10.10.1.1    TCP 83 46642 → 8081 [PSH, ACK] Seq=647 Ack=647 Win=64256 Len=17 TSval=1045240066 TSecr=3169499763
1711546930.124013662   486 3.875930496    10.10.1.1 → 10.10.1.2    TCP 83 8081 → 46642 [PSH, ACK] Seq=647 Ack=664 Win=65152 Len=17 TSval=3169499774 TSecr=1045240066
1711546937.124013662   493 3.909856134    10.10.1.2 → 10.10.1.1    TCP 83 46642 → 8081 [PSH, ACK] Seq=664 Ack=664 Win=64256 Len=17 TSval=1045240100 TSecr=3169499774
1711546940.124013662   496 3.909987207    10.10.1.1 → 10.10.1.2    TCP 83 8081 → 46642 [PSH, ACK] Seq=664 Ack=681 Win=65152 Len=17 TSval=3169499808 TSecr=1045240100
1711546947.124013662   503 3.939907046    10.10.1.2 → 10.10.1.1    TCP 83 46642 → 8081 [PSH, ACK] Seq=681 Ack=681 Win=64256 Len=17 TSval=1045240130 TSecr=3169499808
1711546950.124013662   506 3.940038449    10.10.1.1 → 10.10.1.2    TCP 83 8081 → 46642 [PSH, ACK] Seq=681 Ack=698 Win=65152 Len=17 TSval=3169499838 TSecr=1045240130
1711546957.124013662   513 3.981790136    10.10.1.2 → 10.10.1.1    TCP 66 46642 → 8081 [ACK] Seq=698 Ack=698 Win=64256 Len=0 TSval=1045240172 TSecr=3169499838
1711546959.124013662   515 3.990240899    10.10.1.2 → 10.10.1.1    TCP 83 46642 → 8081 [PSH, ACK] Seq=698 Ack=698 Win=64256 Len=17 TSval=1045240180 TSecr=3169499838
1711546962.124013662   518 3.990366101    10.10.1.1 → 10.10.1.2    TCP 83 8081 → 46642 [PSH, ACK] Seq=698 Ack=715 Win=65152 Len=17 TSval=3169499889 TSecr=1045240180
1711546963.124013662   519 3.990396038    10.10.1.2 → 10.10.1.1    TCP 66 46642 → 8081 [ACK] Seq=715 Ack=715 Win=64256 Len=0 TSval=1045240180 TSecr=3169499889
1711546971.124013662   527 4.080799386    10.10.1.2 → 10.10.1.1    TCP 83 46642 → 8081 [PSH, ACK] Seq=715 Ack=715 Win=64256 Len=17 TSval=1045240271 TSecr=3169499889
1711546974.124013662   530 4.080925279    10.10.1.1 → 10.10.1.2    TCP 83 8081 → 46642 [PSH, ACK] Seq=715 Ack=732 Win=65152 Len=17 TSval=3169499979 TSecr=1045240271
1711546975.124013662   531 4.080954396    10.10.1.2 → 10.10.1.1    TCP 66 46642 → 8081 [ACK] Seq=732 Ack=732 Win=64256 Len=0 TSval=1045240271 TSecr=3169499979
1711546983.124013662   539 4.133340080    10.10.1.2 → 10.10.1.1    TCP 83 46642 → 8081 [PSH, ACK] Seq=732 Ack=732 Win=64256 Len=17 TSval=1045240323 TSecr=3169499979
1711546985.124013662   541 4.133466064    10.10.1.1 → 10.10.1.2    TCP 83 8081 → 46642 [PSH, ACK] Seq=732 Ack=749 Win=65152 Len=17 TSval=3169500032 TSecr=1045240323
1711546987.124013662   543 4.133495125    10.10.1.2 → 10.10.1.1    TCP 66 46642 → 8081 [ACK] Seq=749 Ack=749 Win=64256 Len=0 TSval=1045240323 TSecr=3169500032
1711546995.124013662   551 4.265627054    10.10.1.2 → 10.10.1.1    TCP 83 46642 → 8081 [PSH, ACK] Seq=749 Ack=749 Win=64256 Len=17 TSval=1045240455 TSecr=3169500032
1711546997.124013662   553 4.265752023    10.10.1.1 → 10.10.1.2    TCP 83 8081 → 46642 [PSH, ACK] Seq=749 Ack=766 Win=65152 Len=17 TSval=3169500164 TSecr=1045240455
1711546999.124013662   555 4.265781234    10.10.1.2 → 10.10.1.1    TCP 66 46642 → 8081 [ACK] Seq=766 Ack=766 Win=64256 Len=0 TSval=1045240456 TSecr=3169500164
1711547007.124013662   563 4.287336988    10.10.1.2 → 10.10.1.1    TCP 83 46642 → 8081 [PSH, ACK] Seq=766 Ack=766 Win=64256 Len=17 TSval=1045240477 TSecr=3169500164
1711547009.124013662   565 4.287461791    10.10.1.1 → 10.10.1.2    TCP 83 8081 → 46642 [PSH, ACK] Seq=766 Ack=783 Win=65152 Len=17 TSval=3169500186 TSecr=1045240477
1711547017.124013662   573 4.319782133    10.10.1.2 → 10.10.1.1    TCP 83 46642 → 8081 [PSH, ACK] Seq=783 Ack=783 Win=64256 Len=17 TSval=1045240510 TSecr=3169500186
1711547019.124013662   575 4.319919089    10.10.1.1 → 10.10.1.2    TCP 83 8081 → 46642 [PSH, ACK] Seq=783 Ack=800 Win=65152 Len=17 TSval=3169500218 TSecr=1045240510
1711547028.124013662   584 4.361797383    10.10.1.2 → 10.10.1.1    TCP 66 46642 → 8081 [ACK] Seq=800 Ack=800 Win=64256 Len=0 TSval=1045240552 TSecr=3169500218
1711547029.124013662   585 4.416657963    10.10.1.2 → 10.10.1.1    TCP 83 46642 → 8081 [PSH, ACK] Seq=800 Ack=800 Win=64256 Len=17 TSval=1045240606 TSecr=3169500218
1711547031.124013662   587 4.416793100    10.10.1.1 → 10.10.1.2    TCP 83 8081 → 46642 [PSH, ACK] Seq=800 Ack=817 Win=65152 Len=17 TSval=3169500315 TSecr=1045240606
1711547033.124013662   589 4.416829386    10.10.1.2 → 10.10.1.1    TCP 66 46642 → 8081 [ACK] Seq=817 Ack=817 Win=64256 Len=0 TSval=1045240607 TSecr=3169500315
1711547041.124013662   597 4.521468373    10.10.1.2 → 10.10.1.1    TCP 83 46642 → 8081 [PSH, ACK] Seq=817 Ack=817 Win=64256 Len=17 TSval=1045240711 TSecr=3169500315
1711547043.124013662   599 4.521593320    10.10.1.1 → 10.10.1.2    TCP 83 8081 → 46642 [PSH, ACK] Seq=817 Ack=834 Win=65152 Len=17 TSval=3169500420 TSecr=1045240711
1711547045.124013662   601 4.521629157    10.10.1.2 → 10.10.1.1    TCP 66 46642 → 8081 [ACK] Seq=834 Ack=834 Win=64256 Len=0 TSval=1045240711 TSecr=3169500420
1711547053.124013662   609 4.718231601    10.10.1.2 → 10.10.1.1    TCP 83 46642 → 8081 [PSH, ACK] Seq=834 Ack=834 Win=64256 Len=17 TSval=1045240908 TSecr=3169500420
1711547055.124013662   611 4.718356508    10.10.1.1 → 10.10.1.2    TCP 83 8081 → 46642 [PSH, ACK] Seq=834 Ack=851 Win=65152 Len=17 TSval=3169500617 TSecr=1045240908
1711547057.124013662   613 4.718392651    10.10.1.2 → 10.10.1.1    TCP 66 46642 → 8081 [ACK] Seq=851 Ack=851 Win=64256 Len=0 TSval=1045240908 TSecr=3169500617
1711547064.124013662   620 4.750779167    10.10.1.2 → 10.10.1.1    TCP 83 46642 → 8081 [PSH, ACK] Seq=851 Ack=851 Win=64256 Len=17 TSval=1045240941 TSecr=3169500617
1711547066.124013662   622 4.750903555    10.10.1.1 → 10.10.1.2    TCP 83 8081 → 46642 [PSH, ACK] Seq=851 Ack=868 Win=65152 Len=17 TSval=3169500649 TSecr=1045240941
1711547075.124013662   631 4.793783228    10.10.1.2 → 10.10.1.1    TCP 66 46642 → 8081 [ACK] Seq=868 Ack=868 Win=64256 Len=0 TSval=1045240984 TSecr=3169500649
1711547077.124013662   633 5.016805327    10.10.1.2 → 10.10.1.1    TCP 83 46642 → 8081 [PSH, ACK] Seq=868 Ack=868 Win=64256 Len=17 TSval=1045241207 TSecr=3169500649
1711547080.124013662   636 5.016926977    10.10.1.1 → 10.10.1.2    TCP 83 8081 → 46642 [PSH, ACK] Seq=868 Ack=885 Win=65152 Len=17 TSval=3169500915 TSecr=1045241207
1711547081.124013662   637 5.016956552    10.10.1.2 → 10.10.1.1    TCP 66 46642 → 8081 [ACK] Seq=885 Ack=885 Win=64256 Len=0 TSval=1045241207 TSecr=3169500915
1711547089.124013662   645 5.085111671    10.10.1.2 → 10.10.1.1    TCP 83 46642 → 8081 [PSH, ACK] Seq=885 Ack=885 Win=64256 Len=17 TSval=1045241275 TSecr=3169500915
1711547092.124013662   648 5.085234938    10.10.1.1 → 10.10.1.2    TCP 83 8081 → 46642 [PSH, ACK] Seq=885 Ack=902 Win=65152 Len=17 TSval=3169500983 TSecr=1045241275
1711547093.124013662   649 5.085264629    10.10.1.2 → 10.10.1.1    TCP 66 46642 → 8081 [ACK] Seq=902 Ack=902 Win=64256 Len=0 TSval=1045241275 TSecr=3169500983
1711547101.124013662   657 5.196649280    10.10.1.2 → 10.10.1.1    TCP 83 46642 → 8081 [PSH, ACK] Seq=902 Ack=902 Win=64256 Len=17 TSval=1045241386 TSecr=3169500983
1711547104.124013662   660 5.196775243    10.10.1.1 → 10.10.1.2    TCP 83 8081 → 46642 [PSH, ACK] Seq=902 Ack=919 Win=65152 Len=17 TSval=3169501095 TSecr=1045241386
1711547105.124013662   661 5.196804719    10.10.1.2 → 10.10.1.1    TCP 66 46642 → 8081 [ACK] Seq=919 Ack=919 Win=64256 Len=0 TSval=1045241387 TSecr=3169501095
1711547113.124013662   669 5.218633298    10.10.1.2 → 10.10.1.1    TCP 83 46642 → 8081 [PSH, ACK] Seq=919 Ack=919 Win=64256 Len=17 TSval=1045241408 TSecr=3169501095
1711547116.124013662   672 5.218761483    10.10.1.1 → 10.10.1.2    TCP 83 8081 → 46642 [PSH, ACK] Seq=919 Ack=936 Win=65152 Len=17 TSval=3169501117 TSecr=1045241408
1711547123.124013662   679 5.261788690    10.10.1.2 → 10.10.1.1    TCP 66 46642 → 8081 [ACK] Seq=936 Ack=936 Win=64256 Len=0 TSval=1045241452 TSecr=3169501117
1711547125.124013662   681 5.269238767    10.10.1.2 → 10.10.1.1    TCP 83 46642 → 8081 [PSH, ACK] Seq=936 Ack=936 Win=64256 Len=17 TSval=1045241459 TSecr=3169501117
1711547128.124013662   684 5.269363788    10.10.1.1 → 10.10.1.2    TCP 83 8081 → 46642 [PSH, ACK] Seq=936 Ack=953 Win=65152 Len=17 TSval=3169501168 TSecr=1045241459
1711547129.124013662   685 5.269393058    10.10.1.2 → 10.10.1.1    TCP 66 46642 → 8081 [ACK] Seq=953 Ack=953 Win=64256 Len=0 TSval=1045241459 TSecr=3169501168
1711547137.124013662   693 5.340154039    10.10.1.2 → 10.10.1.1    TCP 83 46642 → 8081 [PSH, ACK] Seq=953 Ack=953 Win=64256 Len=17 TSval=1045241530 TSecr=3169501168
1711547140.124013662   696 5.340334205    10.10.1.1 → 10.10.1.2    TCP 83 8081 → 46642 [PSH, ACK] Seq=953 Ack=970 Win=65152 Len=17 TSval=3169501239 TSecr=1045241530
1711547141.124013662   697 5.340364998    10.10.1.2 → 10.10.1.1    TCP 66 46642 → 8081 [ACK] Seq=970 Ack=970 Win=64256 Len=0 TSval=1045241530 TSecr=3169501239
1711547149.124013662   705 5.346331546    10.10.1.2 → 10.10.1.1    TCP 83 46642 → 8081 [PSH, ACK] Seq=970 Ack=970 Win=64256 Len=17 TSval=1045241536 TSecr=3169501239
1711547151.124013662   707 5.346456458    10.10.1.1 → 10.10.1.2    TCP 83 8081 → 46642 [PSH, ACK] Seq=970 Ack=987 Win=65152 Len=17 TSval=3169501245 TSecr=1045241536
1711547159.124013662   715 5.389784126    10.10.1.2 → 10.10.1.1    TCP 66 46642 → 8081 [ACK] Seq=987 Ack=987 Win=64256 Len=0 TSval=1045241580 TSecr=3169501245
1711547161.124013662   717 5.458288597    10.10.1.2 → 10.10.1.1    TCP 83 46642 → 8081 [PSH, ACK] Seq=987 Ack=987 Win=64256 Len=17 TSval=1045241648 TSecr=3169501245
1711547163.124013662   719 5.458413737    10.10.1.1 → 10.10.1.2    TCP 83 8081 → 46642 [PSH, ACK] Seq=987 Ack=1004 Win=65152 Len=17 TSval=3169501357 TSecr=1045241648
1711547165.124013662   721 5.458443188    10.10.1.2 → 10.10.1.1    TCP 66 46642 → 8081 [ACK] Seq=1004 Ack=1004 Win=64256 Len=0 TSval=1045241648 TSecr=3169501357
1711547173.124013662   729 5.492769085    10.10.1.2 → 10.10.1.1    TCP 83 46642 → 8081 [PSH, ACK] Seq=1004 Ack=1004 Win=64256 Len=17 TSval=1045241682 TSecr=3169501357
1711547175.124013662   731 5.492896633    10.10.1.1 → 10.10.1.2    TCP 83 8081 → 46642 [PSH, ACK] Seq=1004 Ack=1021 Win=65152 Len=17 TSval=3169501391 TSecr=1045241682
1711547183.124013662   739 5.510540638    10.10.1.2 → 10.10.1.1    TCP 83 46642 → 8081 [PSH, ACK] Seq=1021 Ack=1021 Win=64256 Len=17 TSval=1045241700 TSecr=3169501391
1711547186.124013662   742 5.510671497    10.10.1.1 → 10.10.1.2    TCP 83 8081 → 46642 [PSH, ACK] Seq=1021 Ack=1038 Win=65152 Len=17 TSval=3169501409 TSecr=1045241700
1711547193.124013662   749 5.520219602    10.10.1.2 → 10.10.1.1    TCP 83 46642 → 8081 [PSH, ACK] Seq=1038 Ack=1038 Win=64256 Len=17 TSval=1045241710 TSecr=3169501409
1711547195.124013662   751 5.520357175    10.10.1.1 → 10.10.1.2    TCP 83 8081 → 46642 [PSH, ACK] Seq=1038 Ack=1055 Win=65152 Len=17 TSval=3169501419 TSecr=1045241710
1711547204.124013662   760 5.561792102    10.10.1.2 → 10.10.1.1    TCP 66 46642 → 8081 [ACK] Seq=1055 Ack=1055 Win=64256 Len=0 TSval=1045241752 TSecr=3169501419
1711547205.124013662   761 5.563855967    10.10.1.2 → 10.10.1.1    TCP 83 46642 → 8081 [PSH, ACK] Seq=1055 Ack=1055 Win=64256 Len=17 TSval=1045241754 TSecr=3169501419
1711547207.124013662   763 5.563981963    10.10.1.1 → 10.10.1.2    TCP 83 8081 → 46642 [PSH, ACK] Seq=1055 Ack=1072 Win=65152 Len=17 TSval=3169501462 TSecr=1045241754
1711547209.124013662   765 5.564017745    10.10.1.2 → 10.10.1.1    TCP 66 46642 → 8081 [ACK] Seq=1072 Ack=1072 Win=64256 Len=0 TSval=1045241754 TSecr=3169501462
1711547217.124013662   773 5.954249102    10.10.1.2 → 10.10.1.1    TCP 83 46642 → 8081 [PSH, ACK] Seq=1072 Ack=1072 Win=64256 Len=17 TSval=1045242144 TSecr=3169501462
1711547220.124013662   776 5.954371883    10.10.1.1 → 10.10.1.2    TCP 83 8081 → 46642 [PSH, ACK] Seq=1072 Ack=1089 Win=65152 Len=17 TSval=3169501853 TSecr=1045242144
1711547221.124013662   777 5.954401163    10.10.1.2 → 10.10.1.1    TCP 66 46642 → 8081 [ACK] Seq=1089 Ack=1089 Win=64256 Len=0 TSval=1045242144 TSecr=3169501853
1711547229.124013662   785 6.086221974    10.10.1.2 → 10.10.1.1    TCP 83 46642 → 8081 [PSH, ACK] Seq=1089 Ack=1089 Win=64256 Len=17 TSval=1045242276 TSecr=3169501853
1711547232.124013662   788 6.086348467    10.10.1.1 → 10.10.1.2    TCP 83 8081 → 46642 [PSH, ACK] Seq=1089 Ack=1106 Win=65152 Len=17 TSval=3169501985 TSecr=1045242276
1711547233.124013662   789 6.086377178    10.10.1.2 → 10.10.1.1    TCP 66 46642 → 8081 [ACK] Seq=1106 Ack=1106 Win=64256 Len=0 TSval=1045242276 TSecr=3169501985
1711547241.124013662   797 6.232251699    10.10.1.2 → 10.10.1.1    TCP 83 46642 → 8081 [PSH, ACK] Seq=1106 Ack=1106 Win=64256 Len=17 TSval=1045242422 TSecr=3169501985
1711547244.124013662   800 6.232376990    10.10.1.1 → 10.10.1.2    TCP 83 8081 → 46642 [PSH, ACK] Seq=1106 Ack=1123 Win=65152 Len=17 TSval=3169502131 TSecr=1045242422
1711547245.124013662   801 6.232406201    10.10.1.2 → 10.10.1.1    TCP 66 46642 → 8081 [ACK] Seq=1123 Ack=1123 Win=64256 Len=0 TSval=1045242422 TSecr=3169502131
1711547253.124013662   809 6.251355381    10.10.1.2 → 10.10.1.1    TCP 83 46642 → 8081 [PSH, ACK] Seq=1123 Ack=1123 Win=64256 Len=17 TSval=1045242441 TSecr=3169502131
1711547256.124013662   812 6.251479801    10.10.1.1 → 10.10.1.2    TCP 83 8081 → 46642 [PSH, ACK] Seq=1123 Ack=1140 Win=65152 Len=17 TSval=3169502150 TSecr=1045242441
1711547263.124013662   819 6.293789403    10.10.1.2 → 10.10.1.1    TCP 66 46642 → 8081 [ACK] Seq=1140 Ack=1140 Win=64256 Len=0 TSval=1045242484 TSecr=3169502150
1711547265.124013662   821 6.547121674    10.10.1.2 → 10.10.1.1    TCP 83 46642 → 8081 [PSH, ACK] Seq=1140 Ack=1140 Win=64256 Len=17 TSval=1045242737 TSecr=3169502150
1711547268.124013662   824 6.547243923    10.10.1.1 → 10.10.1.2    TCP 83 8081 → 46642 [PSH, ACK] Seq=1140 Ack=1157 Win=65152 Len=17 TSval=3169502445 TSecr=1045242737
1711547269.124013662   825 6.547272791    10.10.1.2 → 10.10.1.1    TCP 66 46642 → 8081 [ACK] Seq=1157 Ack=1157 Win=64256 Len=0 TSval=1045242737 TSecr=3169502445
1711547277.124013662   833 6.664751892    10.10.1.2 → 10.10.1.1    TCP 83 46642 → 8081 [PSH, ACK] Seq=1157 Ack=1157 Win=64256 Len=17 TSval=1045242854 TSecr=3169502445
1711547280.124013662   836 6.664876503    10.10.1.1 → 10.10.1.2    TCP 83 8081 → 46642 [PSH, ACK] Seq=1157 Ack=1174 Win=65152 Len=17 TSval=3169502563 TSecr=1045242854
1711547281.124013662   837 6.664905588    10.10.1.2 → 10.10.1.1    TCP 66 46642 → 8081 [ACK] Seq=1174 Ack=1174 Win=64256 Len=0 TSval=1045242855 TSecr=3169502563
1711547289.124013662   845 6.696529707    10.10.1.2 → 10.10.1.1    TCP 83 46642 → 8081 [PSH, ACK] Seq=1174 Ack=1174 Win=64256 Len=17 TSval=1045242886 TSecr=3169502563
1711547292.124013662   848 6.696655093    10.10.1.1 → 10.10.1.2    TCP 83 8081 → 46642 [PSH, ACK] Seq=1174 Ack=1191 Win=65152 Len=17 TSval=3169502595 TSecr=1045242886
1711547299.124013662   855 6.723532897    10.10.1.2 → 10.10.1.1    TCP 83 46642 → 8081 [PSH, ACK] Seq=1191 Ack=1191 Win=64256 Len=17 TSval=1045242913 TSecr=3169502595
1711547302.124013662   858 6.723663301    10.10.1.1 → 10.10.1.2    TCP 83 8081 → 46642 [PSH, ACK] Seq=1191 Ack=1208 Win=65152 Len=17 TSval=3169502622 TSecr=1045242913
1711547309.124013662   865 6.765786690    10.10.1.2 → 10.10.1.1    TCP 66 46642 → 8081 [ACK] Seq=1208 Ack=1208 Win=64256 Len=0 TSval=1045242956 TSecr=3169502622
1711547312.124013662   868 7.018562765    10.10.1.2 → 10.10.1.1    TCP 83 46642 → 8081 [PSH, ACK] Seq=1208 Ack=1208 Win=64256 Len=17 TSval=1045243208 TSecr=3169502622
1711547315.124013662   871 7.018684915    10.10.1.1 → 10.10.1.2    TCP 83 8081 → 46642 [PSH, ACK] Seq=1208 Ack=1225 Win=65152 Len=17 TSval=3169502917 TSecr=1045243208
1711547316.124013662   872 7.018713914    10.10.1.2 → 10.10.1.1    TCP 66 46642 → 8081 [ACK] Seq=1225 Ack=1225 Win=64256 Len=0 TSval=1045243208 TSecr=3169502917
1711547324.124013662   880 7.127710850    10.10.1.2 → 10.10.1.1    TCP 83 46642 → 8081 [PSH, ACK] Seq=1225 Ack=1225 Win=64256 Len=17 TSval=1045243317 TSecr=3169502917
1711547327.124013662   883 7.127835995    10.10.1.1 → 10.10.1.2    TCP 83 8081 → 46642 [PSH, ACK] Seq=1225 Ack=1242 Win=65152 Len=17 TSval=3169503026 TSecr=1045243317
1711547328.124013662   884 7.127865246    10.10.1.2 → 10.10.1.1    TCP 66 46642 → 8081 [ACK] Seq=1242 Ack=1242 Win=64256 Len=0 TSval=1045243318 TSecr=3169503026
1711547336.124013662   892 7.304278140    10.10.1.2 → 10.10.1.1    TCP 83 46642 → 8081 [PSH, ACK] Seq=1242 Ack=1242 Win=64256 Len=17 TSval=1045243494 TSecr=3169503026
1711547339.124013662   895 7.304404397    10.10.1.1 → 10.10.1.2    TCP 83 8081 → 46642 [PSH, ACK] Seq=1242 Ack=1259 Win=65152 Len=17 TSval=3169503203 TSecr=1045243494
1711547340.124013662   896 7.304433376    10.10.1.2 → 10.10.1.1    TCP 66 46642 → 8081 [ACK] Seq=1259 Ack=1259 Win=64256 Len=0 TSval=1045243494 TSecr=3169503203
1711547348.124013662   904 7.348338396    10.10.1.2 → 10.10.1.1    TCP 83 46642 → 8081 [PSH, ACK] Seq=1259 Ack=1259 Win=64256 Len=17 TSval=1045243538 TSecr=3169503203
1711547351.124013662   907 7.348464067    10.10.1.1 → 10.10.1.2    TCP 83 8081 → 46642 [PSH, ACK] Seq=1259 Ack=1276 Win=65152 Len=17 TSval=3169503247 TSecr=1045243538
1711547352.124013662   908 7.348493218    10.10.1.2 → 10.10.1.1    TCP 66 46642 → 8081 [ACK] Seq=1276 Ack=1276 Win=64256 Len=0 TSval=1045243538 TSecr=3169503247
1711547360.124013662   916 7.399073194    10.10.1.2 → 10.10.1.1    TCP 83 46642 → 8081 [PSH, ACK] Seq=1276 Ack=1276 Win=64256 Len=17 TSval=1045243589 TSecr=3169503247
1711547363.124013662   919 7.399199321    10.10.1.1 → 10.10.1.2    TCP 83 8081 → 46642 [PSH, ACK] Seq=1276 Ack=1293 Win=65152 Len=17 TSval=3169503297 TSecr=1045243589
1711547364.124013662   920 7.399228346    10.10.1.2 → 10.10.1.1    TCP 66 46642 → 8081 [ACK] Seq=1293 Ack=1293 Win=64256 Len=0 TSval=1045243589 TSecr=3169503297
1711547372.124013662   928 7.401506122    10.10.1.2 → 10.10.1.1    TCP 83 46642 → 8081 [PSH, ACK] Seq=1293 Ack=1293 Win=64256 Len=17 TSval=1045243591 TSecr=3169503297
1711547375.124013662   931 7.401631137    10.10.1.1 → 10.10.1.2    TCP 83 8081 → 46642 [PSH, ACK] Seq=1293 Ack=1310 Win=65152 Len=17 TSval=3169503300 TSecr=1045243591
1711547382.124013662   938 7.441785949    10.10.1.2 → 10.10.1.1    TCP 66 46642 → 8081 [ACK] Seq=1310 Ack=1310 Win=64256 Len=0 TSval=1045243632 TSecr=3169503300
1711547384.124013662   940 7.500888975    10.10.1.2 → 10.10.1.1    TCP 83 46642 → 8081 [PSH, ACK] Seq=1310 Ack=1310 Win=64256 Len=17 TSval=1045243691 TSecr=3169503300
1711547386.124013662   942 7.501015389    10.10.1.1 → 10.10.1.2    TCP 83 8081 → 46642 [PSH, ACK] Seq=1310 Ack=1327 Win=65152 Len=17 TSval=3169503399 TSecr=1045243691
1711547388.124013662   944 7.501044693    10.10.1.2 → 10.10.1.1    TCP 66 46642 → 8081 [ACK] Seq=1327 Ack=1327 Win=64256 Len=0 TSval=1045243691 TSecr=3169503399
1711547396.124013662   952 7.502736854    10.10.1.2 → 10.10.1.1    TCP 83 46642 → 8081 [PSH, ACK] Seq=1327 Ack=1327 Win=64256 Len=17 TSval=1045243692 TSecr=3169503399
1711547398.124013662   954 7.502856101    10.10.1.1 → 10.10.1.2    TCP 83 8081 → 46642 [PSH, ACK] Seq=1327 Ack=1344 Win=65152 Len=17 TSval=3169503401 TSecr=1045243692
1711547406.124013662   962 7.545786160    10.10.1.2 → 10.10.1.1    TCP 66 46642 → 8081 [ACK] Seq=1344 Ack=1344 Win=64256 Len=0 TSval=1045243736 TSecr=3169503401
1711547408.124013662   964 7.613601939    10.10.1.2 → 10.10.1.1    TCP 83 46642 → 8081 [PSH, ACK] Seq=1344 Ack=1344 Win=64256 Len=17 TSval=1045243803 TSecr=3169503401
1711547410.124013662   966 7.613728409    10.10.1.1 → 10.10.1.2    TCP 83 8081 → 46642 [PSH, ACK] Seq=1344 Ack=1361 Win=65152 Len=17 TSval=3169503512 TSecr=1045243803
1711547412.124013662   968 7.613763676    10.10.1.2 → 10.10.1.1    TCP 66 46642 → 8081 [ACK] Seq=1361 Ack=1361 Win=64256 Len=0 TSval=1045243804 TSecr=3169503512
1711547420.124013662   976 7.680984036    10.10.1.2 → 10.10.1.1    TCP 83 46642 → 8081 [PSH, ACK] Seq=1361 Ack=1361 Win=64256 Len=17 TSval=1045243871 TSecr=3169503512
1711547422.124013662   978 7.681111146    10.10.1.1 → 10.10.1.2    TCP 83 8081 → 46642 [PSH, ACK] Seq=1361 Ack=1378 Win=65152 Len=17 TSval=3169503579 TSecr=1045243871
1711547424.124013662   980 7.681146636    10.10.1.2 → 10.10.1.1    TCP 66 46642 → 8081 [ACK] Seq=1378 Ack=1378 Win=64256 Len=0 TSval=1045243871 TSecr=3169503579
1711547431.124013662   987 7.715619743    10.10.1.2 → 10.10.1.1    TCP 83 46642 → 8081 [PSH, ACK] Seq=1378 Ack=1378 Win=64256 Len=17 TSval=1045243905 TSecr=3169503579
1711547433.124013662   989 7.715746882    10.10.1.1 → 10.10.1.2    TCP 83 8081 → 46642 [PSH, ACK] Seq=1378 Ack=1395 Win=65152 Len=17 TSval=3169503614 TSecr=1045243905
1711547441.124013662   997 7.757787149    10.10.1.2 → 10.10.1.1    TCP 66 46642 → 8081 [ACK] Seq=1395 Ack=1395 Win=64256 Len=0 TSval=1045243948 TSecr=3169503614
1711547443.124013662   999 7.807268063    10.10.1.2 → 10.10.1.1    TCP 83 46642 → 8081 [PSH, ACK] Seq=1395 Ack=1395 Win=64256 Len=17 TSval=1045243997 TSecr=3169503614
1711547445.124013662  1001 7.807396766    10.10.1.1 → 10.10.1.2    TCP 83 8081 → 46642 [PSH, ACK] Seq=1395 Ack=1412 Win=65152 Len=17 TSval=3169503706 TSecr=1045243997
1711547447.124013662  1003 7.807433457    10.10.1.2 → 10.10.1.1    TCP 66 46642 → 8081 [ACK] Seq=1412 Ack=1412 Win=64256 Len=0 TSval=1045243997 TSecr=3169503706
1711547455.124013662  1011 8.207787658    10.10.1.2 → 10.10.1.1    TCP 83 46642 → 8081 [PSH, ACK] Seq=1412 Ack=1412 Win=64256 Len=17 TSval=1045244398 TSecr=3169503706
1711547458.124013662  1014 8.207908470    10.10.1.1 → 10.10.1.2    TCP 83 8081 → 46642 [PSH, ACK] Seq=1412 Ack=1429 Win=65152 Len=17 TSval=3169504106 TSecr=1045244398
