1711548758.503933191    28 0.534052228    10.10.1.2 → 10.10.1.1    TCP 83 33294 → 8081 [PSH, ACK] Seq=1 Ack=1 Win=64256 Len=17 TSval=1047523134 TSecr=3171782594
1711548762.503933191    32 0.534353421    10.10.1.1 → 10.10.1.2    TCP 83 8081 → 33294 [PSH, ACK] Seq=1 Ack=18 Win=65152 Len=17 TSval=3171782845 TSecr=1047523134
1711548769.503933191    39 0.535569889    10.10.1.2 → 10.10.1.1    TCP 83 33294 → 8081 [PSH, ACK] Seq=18 Ack=18 Win=64256 Len=17 TSval=1047523135 TSecr=3171782845
1711548771.503933191    41 0.535661892    10.10.1.1 → 10.10.1.2    TCP 83 8081 → 33294 [PSH, ACK] Seq=18 Ack=35 Win=65152 Len=17 TSval=3171782846 TSecr=1047523135
1711548776.503933191    46 0.536874771    10.10.1.2 → 10.10.1.1    TCP 83 33294 → 8081 [PSH, ACK] Seq=35 Ack=35 Win=64256 Len=17 TSval=1047523137 TSecr=3171782846
1711548779.503933191    49 0.536965163    10.10.1.1 → 10.10.1.2    TCP 83 8081 → 33294 [PSH, ACK] Seq=35 Ack=52 Win=65152 Len=17 TSval=3171782848 TSecr=1047523137
1711548784.503933191    54 0.538173225    10.10.1.2 → 10.10.1.1    TCP 83 33294 → 8081 [PSH, ACK] Seq=52 Ack=52 Win=64256 Len=17 TSval=1047523138 TSecr=3171782848
1711548787.503933191    57 0.538264488    10.10.1.1 → 10.10.1.2    TCP 83 8081 → 33294 [PSH, ACK] Seq=52 Ack=69 Win=65152 Len=17 TSval=3171782849 TSecr=1047523138
1711548792.503933191    62 0.539470568    10.10.1.2 → 10.10.1.1    TCP 83 33294 → 8081 [PSH, ACK] Seq=69 Ack=69 Win=64256 Len=17 TSval=1047523139 TSecr=3171782849
1711548795.503933191    65 0.539555102    10.10.1.1 → 10.10.1.2    TCP 83 8081 → 33294 [PSH, ACK] Seq=69 Ack=86 Win=65152 Len=17 TSval=3171782850 TSecr=1047523139
1711548800.503933191    70 0.540758612    10.10.1.2 → 10.10.1.1    TCP 83 33294 → 8081 [PSH, ACK] Seq=86 Ack=86 Win=64256 Len=17 TSval=1047523140 TSecr=3171782850
1711548802.503933191    72 0.540838613    10.10.1.1 → 10.10.1.2    TCP 83 8081 → 33294 [PSH, ACK] Seq=86 Ack=103 Win=65152 Len=17 TSval=3171782852 TSecr=1047523140
1711548808.503933191    78 0.542045771    10.10.1.2 → 10.10.1.1    TCP 83 33294 → 8081 [PSH, ACK] Seq=103 Ack=103 Win=64256 Len=17 TSval=1047523142 TSecr=3171782852
1711548810.503933191    80 0.542125744    10.10.1.1 → 10.10.1.2    TCP 83 8081 → 33294 [PSH, ACK] Seq=103 Ack=120 Win=65152 Len=17 TSval=3171782853 TSecr=1047523142
1711548816.503933191    86 0.543329442    10.10.1.2 → 10.10.1.1    TCP 83 33294 → 8081 [PSH, ACK] Seq=120 Ack=120 Win=64256 Len=17 TSval=1047523143 TSecr=3171782853
1711548818.503933191    88 0.543410464    10.10.1.1 → 10.10.1.2    TCP 83 8081 → 33294 [PSH, ACK] Seq=120 Ack=137 Win=65152 Len=17 TSval=3171782854 TSecr=1047523143
1711548824.503933191    94 0.544618601    10.10.1.2 → 10.10.1.1    TCP 83 33294 → 8081 [PSH, ACK] Seq=137 Ack=137 Win=64256 Len=17 TSval=1047523144 TSecr=3171782854
1711548826.503933191    96 0.544707958    10.10.1.1 → 10.10.1.2    TCP 83 8081 → 33294 [PSH, ACK] Seq=137 Ack=154 Win=65152 Len=17 TSval=3171782855 TSecr=1047523144
1711548833.503933191   103 0.545917980    10.10.1.2 → 10.10.1.1    TCP 83 33294 → 8081 [PSH, ACK] Seq=154 Ack=154 Win=64256 Len=17 TSval=1047523146 TSecr=3171782855
1711548834.503933191   104 0.546007030    10.10.1.1 → 10.10.1.2    TCP 83 8081 → 33294 [PSH, ACK] Seq=154 Ack=171 Win=65152 Len=17 TSval=3171782857 TSecr=1047523146
1711548840.503933191   110 0.547215518    10.10.1.2 → 10.10.1.1    TCP 83 33294 → 8081 [PSH, ACK] Seq=171 Ack=171 Win=64256 Len=17 TSval=1047523147 TSecr=3171782857
1711548842.503933191   112 0.547309749    10.10.1.1 → 10.10.1.2    TCP 83 8081 → 33294 [PSH, ACK] Seq=171 Ack=188 Win=65152 Len=17 TSval=3171782858 TSecr=1047523147
1711548849.503933191   119 0.548518315    10.10.1.2 → 10.10.1.1    TCP 83 33294 → 8081 [PSH, ACK] Seq=188 Ack=188 Win=64256 Len=17 TSval=1047523148 TSecr=3171782858
1711548850.503933191   120 0.548608407    10.10.1.1 → 10.10.1.2    TCP 83 8081 → 33294 [PSH, ACK] Seq=188 Ack=205 Win=65152 Len=17 TSval=3171782859 TSecr=1047523148
1711548856.503933191   126 0.549818324    10.10.1.2 → 10.10.1.1    TCP 83 33294 → 8081 [PSH, ACK] Seq=205 Ack=205 Win=64256 Len=17 TSval=1047523150 TSecr=3171782859
1711548858.503933191   128 0.549907672    10.10.1.1 → 10.10.1.2    TCP 83 8081 → 33294 [PSH, ACK] Seq=205 Ack=222 Win=65152 Len=17 TSval=3171782861 TSecr=1047523150
1711548865.503933191   135 0.551115139    10.10.1.2 → 10.10.1.1    TCP 83 33294 → 8081 [PSH, ACK] Seq=222 Ack=222 Win=64256 Len=17 TSval=1047523151 TSecr=3171782861
1711548866.503933191   136 0.551210553    10.10.1.1 → 10.10.1.2    TCP 83 8081 → 33294 [PSH, ACK] Seq=222 Ack=239 Win=65152 Len=17 TSval=3171782862 TSecr=1047523151
1711548873.503933191   143 0.552419151    10.10.1.2 → 10.10.1.1    TCP 83 33294 → 8081 [PSH, ACK] Seq=239 Ack=239 Win=64256 Len=17 TSval=1047523152 TSecr=3171782862
1711548874.503933191   144 0.552507317    10.10.1.1 → 10.10.1.2    TCP 83 8081 → 33294 [PSH, ACK] Seq=239 Ack=256 Win=65152 Len=17 TSval=3171782863 TSecr=1047523152
1711548880.503933191   150 0.553716309    10.10.1.2 → 10.10.1.1    TCP 83 33294 → 8081 [PSH, ACK] Seq=256 Ack=256 Win=64256 Len=17 TSval=1047523153 TSecr=3171782863
1711548882.503933191   152 0.553805055    10.10.1.1 → 10.10.1.2    TCP 83 8081 → 33294 [PSH, ACK] Seq=256 Ack=273 Win=65152 Len=17 TSval=3171782864 TSecr=1047523153
1711548888.503933191   158 0.554964988    10.10.1.2 → 10.10.1.1    TCP 83 33294 → 8081 [PSH, ACK] Seq=273 Ack=273 Win=64256 Len=17 TSval=1047523155 TSecr=3171782864
1711548890.503933191   160 0.555057105    10.10.1.1 → 10.10.1.2    TCP 83 8081 → 33294 [PSH, ACK] Seq=273 Ack=290 Win=65152 Len=17 TSval=3171782866 TSecr=1047523155
1711548896.503933191   166 0.556264670    10.10.1.2 → 10.10.1.1    TCP 83 33294 → 8081 [PSH, ACK] Seq=290 Ack=290 Win=64256 Len=17 TSval=1047523156 TSecr=3171782866
1711548898.503933191   168 0.556353832    10.10.1.1 → 10.10.1.2    TCP 83 8081 → 33294 [PSH, ACK] Seq=290 Ack=307 Win=65152 Len=17 TSval=3171782867 TSecr=1047523156
1711548905.503933191   175 0.557562704    10.10.1.2 → 10.10.1.1    TCP 83 33294 → 8081 [PSH, ACK] Seq=307 Ack=307 Win=64256 Len=17 TSval=1047523157 TSecr=3171782867
1711548906.503933191   176 0.557651740    10.10.1.1 → 10.10.1.2    TCP 83 8081 → 33294 [PSH, ACK] Seq=307 Ack=324 Win=65152 Len=17 TSval=3171782868 TSecr=1047523157
1711548912.503933191   182 0.558861313    10.10.1.2 → 10.10.1.1    TCP 83 33294 → 8081 [PSH, ACK] Seq=324 Ack=324 Win=64256 Len=17 TSval=1047523159 TSecr=3171782868
1711548914.503933191   184 0.558961189    10.10.1.1 → 10.10.1.2    TCP 83 8081 → 33294 [PSH, ACK] Seq=324 Ack=341 Win=65152 Len=17 TSval=3171782870 TSecr=1047523159
1711548920.503933191   190 0.560166346    10.10.1.2 → 10.10.1.1    TCP 83 33294 → 8081 [PSH, ACK] Seq=341 Ack=341 Win=64256 Len=17 TSval=1047523160 TSecr=3171782870
1711548922.503933191   192 0.560262724    10.10.1.1 → 10.10.1.2    TCP 83 8081 → 33294 [PSH, ACK] Seq=341 Ack=358 Win=65152 Len=17 TSval=3171782871 TSecr=1047523160
1711548928.503933191   198 0.561471076    10.10.1.2 → 10.10.1.1    TCP 83 33294 → 8081 [PSH, ACK] Seq=358 Ack=358 Win=64256 Len=17 TSval=1047523161 TSecr=3171782871
1711548930.503933191   200 0.561568392    10.10.1.1 → 10.10.1.2    TCP 83 8081 → 33294 [PSH, ACK] Seq=358 Ack=375 Win=65152 Len=17 TSval=3171782872 TSecr=1047523161
1711548936.503933191   206 0.562774373    10.10.1.2 → 10.10.1.1    TCP 83 33294 → 8081 [PSH, ACK] Seq=375 Ack=375 Win=64256 Len=17 TSval=1047523163 TSecr=3171782872
1711548938.503933191   208 0.562892910    10.10.1.1 → 10.10.1.2    TCP 83 8081 → 33294 [PSH, ACK] Seq=375 Ack=392 Win=65152 Len=17 TSval=3171782874 TSecr=1047523163
1711548944.503933191   214 0.564098108    10.10.1.2 → 10.10.1.1    TCP 83 33294 → 8081 [PSH, ACK] Seq=392 Ack=392 Win=64256 Len=17 TSval=1047523164 TSecr=3171782874
1711548946.503933191   216 0.564197913    10.10.1.1 → 10.10.1.2    TCP 83 8081 → 33294 [PSH, ACK] Seq=392 Ack=409 Win=65152 Len=17 TSval=3171782875 TSecr=1047523164
1711548952.503933191   222 0.565405506    10.10.1.2 → 10.10.1.1    TCP 83 33294 → 8081 [PSH, ACK] Seq=409 Ack=409 Win=64256 Len=17 TSval=1047523165 TSecr=3171782875
1711548954.503933191   224 0.565502688    10.10.1.1 → 10.10.1.2    TCP 83 8081 → 33294 [PSH, ACK] Seq=409 Ack=426 Win=65152 Len=17 TSval=3171782876 TSecr=1047523165
1711548960.503933191   230 0.566708479    10.10.1.2 → 10.10.1.1    TCP 83 33294 → 8081 [PSH, ACK] Seq=426 Ack=426 Win=64256 Len=17 TSval=1047523166 TSecr=3171782876
1711548962.503933191   232 0.566800316    10.10.1.1 → 10.10.1.2    TCP 83 8081 → 33294 [PSH, ACK] Seq=426 Ack=443 Win=65152 Len=17 TSval=3171782877 TSecr=1047523166
1711548968.503933191   238 0.568006146    10.10.1.2 → 10.10.1.1    TCP 83 33294 → 8081 [PSH, ACK] Seq=443 Ack=443 Win=64256 Len=17 TSval=1047523168 TSecr=3171782877
1711548970.503933191   240 0.568102375    10.10.1.1 → 10.10.1.2    TCP 83 8081 → 33294 [PSH, ACK] Seq=443 Ack=460 Win=65152 Len=17 TSval=3171782879 TSecr=1047523168
1711548976.503933191   246 0.569310045    10.10.1.2 → 10.10.1.1    TCP 83 33294 → 8081 [PSH, ACK] Seq=460 Ack=460 Win=64256 Len=17 TSval=1047523169 TSecr=3171782879
1711548978.503933191   248 0.569401677    10.10.1.1 → 10.10.1.2    TCP 83 8081 → 33294 [PSH, ACK] Seq=460 Ack=477 Win=65152 Len=17 TSval=3171782880 TSecr=1047523169
1711548984.503933191   254 0.570605788    10.10.1.2 → 10.10.1.1    TCP 83 33294 → 8081 [PSH, ACK] Seq=477 Ack=477 Win=64256 Len=17 TSval=1047523170 TSecr=3171782880
1711548986.503933191   256 0.570697051    10.10.1.1 → 10.10.1.2    TCP 83 8081 → 33294 [PSH, ACK] Seq=477 Ack=494 Win=65152 Len=17 TSval=3171782881 TSecr=1047523170
1711548992.503933191   262 0.571901502    10.10.1.2 → 10.10.1.1    TCP 83 33294 → 8081 [PSH, ACK] Seq=494 Ack=494 Win=64256 Len=17 TSval=1047523172 TSecr=3171782881
1711548994.503933191   264 0.571999434    10.10.1.1 → 10.10.1.2    TCP 83 8081 → 33294 [PSH, ACK] Seq=494 Ack=511 Win=65152 Len=17 TSval=3171782883 TSecr=1047523172
1711549000.503933191   270 0.573206660    10.10.1.2 → 10.10.1.1    TCP 83 33294 → 8081 [PSH, ACK] Seq=511 Ack=511 Win=64256 Len=17 TSval=1047523173 TSecr=3171782883
1711549002.503933191   272 0.573299901    10.10.1.1 → 10.10.1.2    TCP 83 8081 → 33294 [PSH, ACK] Seq=511 Ack=528 Win=65152 Len=17 TSval=3171782884 TSecr=1047523173
1711549008.503933191   278 0.574505089    10.10.1.2 → 10.10.1.1    TCP 83 33294 → 8081 [PSH, ACK] Seq=528 Ack=528 Win=64256 Len=17 TSval=1047523174 TSecr=3171782884
1711549010.503933191   280 0.574597685    10.10.1.1 → 10.10.1.2    TCP 83 8081 → 33294 [PSH, ACK] Seq=528 Ack=545 Win=65152 Len=17 TSval=3171782885 TSecr=1047523174
1711549016.503933191   286 0.575774969    10.10.1.2 → 10.10.1.1    TCP 83 33294 → 8081 [PSH, ACK] Seq=545 Ack=545 Win=64256 Len=17 TSval=1047523176 TSecr=3171782885
1711549018.503933191   288 0.575871748    10.10.1.1 → 10.10.1.2    TCP 83 8081 → 33294 [PSH, ACK] Seq=545 Ack=562 Win=65152 Len=17 TSval=3171782887 TSecr=1047523176
1711549024.503933191   294 0.577079146    10.10.1.2 → 10.10.1.1    TCP 83 33294 → 8081 [PSH, ACK] Seq=562 Ack=562 Win=64256 Len=17 TSval=1047523177 TSecr=3171782887
1711549026.503933191   296 0.577170867    10.10.1.1 → 10.10.1.2    TCP 83 8081 → 33294 [PSH, ACK] Seq=562 Ack=579 Win=65152 Len=17 TSval=3171782888 TSecr=1047523177
1711549032.503933191   302 0.578375640    10.10.1.2 → 10.10.1.1    TCP 83 33294 → 8081 [PSH, ACK] Seq=579 Ack=579 Win=64256 Len=17 TSval=1047523178 TSecr=3171782888
1711549034.503933191   304 0.578467625    10.10.1.1 → 10.10.1.2    TCP 83 8081 → 33294 [PSH, ACK] Seq=579 Ack=596 Win=65152 Len=17 TSval=3171782889 TSecr=1047523178
1711549040.503933191   310 0.579671635    10.10.1.2 → 10.10.1.1    TCP 83 33294 → 8081 [PSH, ACK] Seq=596 Ack=596 Win=64256 Len=17 TSval=1047523179 TSecr=3171782889
1711549042.503933191   312 0.579767913    10.10.1.1 → 10.10.1.2    TCP 83 8081 → 33294 [PSH, ACK] Seq=596 Ack=613 Win=65152 Len=17 TSval=3171782890 TSecr=1047523179
1711549048.503933191   318 0.580975661    10.10.1.2 → 10.10.1.1    TCP 83 33294 → 8081 [PSH, ACK] Seq=613 Ack=613 Win=64256 Len=17 TSval=1047523181 TSecr=3171782890
1711549050.503933191   320 0.581066354    10.10.1.1 → 10.10.1.2    TCP 83 8081 → 33294 [PSH, ACK] Seq=613 Ack=630 Win=65152 Len=17 TSval=3171782892 TSecr=1047523181
1711549056.503933191   326 0.582271856    10.10.1.2 → 10.10.1.1    TCP 83 33294 → 8081 [PSH, ACK] Seq=630 Ack=630 Win=64256 Len=17 TSval=1047523182 TSecr=3171782892
1711549058.503933191   328 0.582364212    10.10.1.1 → 10.10.1.2    TCP 83 8081 → 33294 [PSH, ACK] Seq=630 Ack=647 Win=65152 Len=17 TSval=3171782893 TSecr=1047523182
1711549064.503933191   334 0.583568327    10.10.1.2 → 10.10.1.1    TCP 83 33294 → 8081 [PSH, ACK] Seq=647 Ack=647 Win=64256 Len=17 TSval=1047523183 TSecr=3171782893
1711549066.503933191   336 0.583665385    10.10.1.1 → 10.10.1.2    TCP 83 8081 → 33294 [PSH, ACK] Seq=647 Ack=664 Win=65152 Len=17 TSval=3171782894 TSecr=1047523183
1711549072.503933191   342 0.584870816    10.10.1.2 → 10.10.1.1    TCP 83 33294 → 8081 [PSH, ACK] Seq=664 Ack=664 Win=64256 Len=17 TSval=1047523185 TSecr=3171782894
1711549074.503933191   344 0.584968194    10.10.1.1 → 10.10.1.2    TCP 83 8081 → 33294 [PSH, ACK] Seq=664 Ack=681 Win=65152 Len=17 TSval=3171782896 TSecr=1047523185
1711549080.503933191   350 0.586174480    10.10.1.2 → 10.10.1.1    TCP 83 33294 → 8081 [PSH, ACK] Seq=681 Ack=681 Win=64256 Len=17 TSval=1047523186 TSecr=3171782896
1711549082.503933191   352 0.586274463    10.10.1.1 → 10.10.1.2    TCP 83 8081 → 33294 [PSH, ACK] Seq=681 Ack=698 Win=65152 Len=17 TSval=3171782897 TSecr=1047523186
1711549088.503933191   358 0.587479222    10.10.1.2 → 10.10.1.1    TCP 83 33294 → 8081 [PSH, ACK] Seq=698 Ack=698 Win=64256 Len=17 TSval=1047523187 TSecr=3171782897
1711549090.503933191   360 0.587581144    10.10.1.1 → 10.10.1.2    TCP 83 8081 → 33294 [PSH, ACK] Seq=698 Ack=715 Win=65152 Len=17 TSval=3171782898 TSecr=1047523187
1711549096.503933191   366 0.588783921    10.10.1.2 → 10.10.1.1    TCP 83 33294 → 8081 [PSH, ACK] Seq=715 Ack=715 Win=64256 Len=17 TSval=1047523189 TSecr=3171782898
1711549098.503933191   368 0.588880939    10.10.1.1 → 10.10.1.2    TCP 83 8081 → 33294 [PSH, ACK] Seq=715 Ack=732 Win=65152 Len=17 TSval=3171782900 TSecr=1047523189
1711549104.503933191   374 0.590088172    10.10.1.2 → 10.10.1.1    TCP 83 33294 → 8081 [PSH, ACK] Seq=732 Ack=732 Win=64256 Len=17 TSval=1047523190 TSecr=3171782900
1711549106.503933191   376 0.590179491    10.10.1.1 → 10.10.1.2    TCP 83 8081 → 33294 [PSH, ACK] Seq=732 Ack=749 Win=65152 Len=17 TSval=3171782901 TSecr=1047523190
1711549112.503933191   382 0.591384268    10.10.1.2 → 10.10.1.1    TCP 83 33294 → 8081 [PSH, ACK] Seq=749 Ack=749 Win=64256 Len=17 TSval=1047523191 TSecr=3171782901
1711549114.503933191   384 0.591487159    10.10.1.1 → 10.10.1.2    TCP 83 8081 → 33294 [PSH, ACK] Seq=749 Ack=766 Win=65152 Len=17 TSval=3171782902 TSecr=1047523191
1711549120.503933191   390 0.592691887    10.10.1.2 → 10.10.1.1    TCP 83 33294 → 8081 [PSH, ACK] Seq=766 Ack=766 Win=64256 Len=17 TSval=1047523192 TSecr=3171782902
1711549122.503933191   392 0.592788821    10.10.1.1 → 10.10.1.2    TCP 83 8081 → 33294 [PSH, ACK] Seq=766 Ack=783 Win=65152 Len=17 TSval=3171782903 TSecr=1047523192
1711549128.503933191   398 0.593996958    10.10.1.2 → 10.10.1.1    TCP 83 33294 → 8081 [PSH, ACK] Seq=783 Ack=783 Win=64256 Len=17 TSval=1047523194 TSecr=3171782903
1711549130.503933191   400 0.594093209    10.10.1.1 → 10.10.1.2    TCP 83 8081 → 33294 [PSH, ACK] Seq=783 Ack=800 Win=65152 Len=17 TSval=3171782905 TSecr=1047523194
1711549136.503933191   406 0.595300973    10.10.1.2 → 10.10.1.1    TCP 83 33294 → 8081 [PSH, ACK] Seq=800 Ack=800 Win=64256 Len=17 TSval=1047523195 TSecr=3171782905
1711549138.503933191   408 0.595402631    10.10.1.1 → 10.10.1.2    TCP 83 8081 → 33294 [PSH, ACK] Seq=800 Ack=817 Win=65152 Len=17 TSval=3171782906 TSecr=1047523195
1711549144.503933191   414 0.596607973    10.10.1.2 → 10.10.1.1    TCP 83 33294 → 8081 [PSH, ACK] Seq=817 Ack=817 Win=64256 Len=17 TSval=1047523196 TSecr=3171782906
1711549146.503933191   416 0.596705799    10.10.1.1 → 10.10.1.2    TCP 83 8081 → 33294 [PSH, ACK] Seq=817 Ack=834 Win=65152 Len=17 TSval=3171782907 TSecr=1047523196
1711549152.503933191   422 0.597912878    10.10.1.2 → 10.10.1.1    TCP 83 33294 → 8081 [PSH, ACK] Seq=834 Ack=834 Win=64256 Len=17 TSval=1047523198 TSecr=3171782907
1711549154.503933191   424 0.598009292    10.10.1.1 → 10.10.1.2    TCP 83 8081 → 33294 [PSH, ACK] Seq=834 Ack=851 Win=65152 Len=17 TSval=3171782909 TSecr=1047523198
1711549160.503933191   430 0.599213909    10.10.1.2 → 10.10.1.1    TCP 83 33294 → 8081 [PSH, ACK] Seq=851 Ack=851 Win=64256 Len=17 TSval=1047523199 TSecr=3171782909
1711549162.503933191   432 0.599316257    10.10.1.1 → 10.10.1.2    TCP 83 8081 → 33294 [PSH, ACK] Seq=851 Ack=868 Win=65152 Len=17 TSval=3171782910 TSecr=1047523199
1711549168.503933191   438 0.600522665    10.10.1.2 → 10.10.1.1    TCP 83 33294 → 8081 [PSH, ACK] Seq=868 Ack=868 Win=64256 Len=17 TSval=1047523200 TSecr=3171782910
1711549170.503933191   440 0.600620054    10.10.1.1 → 10.10.1.2    TCP 83 8081 → 33294 [PSH, ACK] Seq=868 Ack=885 Win=65152 Len=17 TSval=3171782911 TSecr=1047523200
1711549176.503933191   446 0.601827299    10.10.1.2 → 10.10.1.1    TCP 83 33294 → 8081 [PSH, ACK] Seq=885 Ack=885 Win=64256 Len=17 TSval=1047523202 TSecr=3171782911
1711549178.503933191   448 0.601925278    10.10.1.1 → 10.10.1.2    TCP 83 8081 → 33294 [PSH, ACK] Seq=885 Ack=902 Win=65152 Len=17 TSval=3171782913 TSecr=1047523202
1711549185.503933191   455 0.603130385    10.10.1.2 → 10.10.1.1    TCP 83 33294 → 8081 [PSH, ACK] Seq=902 Ack=902 Win=64256 Len=17 TSval=1047523203 TSecr=3171782913
1711549186.503933191   456 0.603190611    10.10.1.1 → 10.10.1.2    TCP 83 8081 → 33294 [PSH, ACK] Seq=902 Ack=919 Win=65152 Len=17 TSval=3171782914 TSecr=1047523203
1711549192.503933191   462 0.604393390    10.10.1.2 → 10.10.1.1    TCP 83 33294 → 8081 [PSH, ACK] Seq=919 Ack=919 Win=64256 Len=17 TSval=1047523204 TSecr=3171782914
1711549194.503933191   464 0.604490255    10.10.1.1 → 10.10.1.2    TCP 83 8081 → 33294 [PSH, ACK] Seq=919 Ack=936 Win=65152 Len=17 TSval=3171782915 TSecr=1047523204
1711549200.503933191   470 0.605698227    10.10.1.2 → 10.10.1.1    TCP 83 33294 → 8081 [PSH, ACK] Seq=936 Ack=936 Win=64256 Len=17 TSval=1047523205 TSecr=3171782915
1711549202.503933191   472 0.605795088    10.10.1.1 → 10.10.1.2    TCP 83 8081 → 33294 [PSH, ACK] Seq=936 Ack=953 Win=65152 Len=17 TSval=3171782916 TSecr=1047523205
1711549208.503933191   478 0.607000972    10.10.1.2 → 10.10.1.1    TCP 83 33294 → 8081 [PSH, ACK] Seq=953 Ack=953 Win=64256 Len=17 TSval=1047523207 TSecr=3171782916
1711549211.503933191   481 0.607173867    10.10.1.1 → 10.10.1.2    TCP 83 8081 → 33294 [PSH, ACK] Seq=953 Ack=970 Win=65152 Len=17 TSval=3171782918 TSecr=1047523207
1711549216.503933191   486 0.608379826    10.10.1.2 → 10.10.1.1    TCP 83 33294 → 8081 [PSH, ACK] Seq=970 Ack=970 Win=64256 Len=17 TSval=1047523208 TSecr=3171782918
1711549218.503933191   488 0.608476486    10.10.1.1 → 10.10.1.2    TCP 83 8081 → 33294 [PSH, ACK] Seq=970 Ack=987 Win=65152 Len=17 TSval=3171782919 TSecr=1047523208
1711549224.503933191   494 0.609682754    10.10.1.2 → 10.10.1.1    TCP 83 33294 → 8081 [PSH, ACK] Seq=987 Ack=987 Win=64256 Len=17 TSval=1047523209 TSecr=3171782919
1711549226.503933191   496 0.609779698    10.10.1.1 → 10.10.1.2    TCP 83 8081 → 33294 [PSH, ACK] Seq=987 Ack=1004 Win=65152 Len=17 TSval=3171782920 TSecr=1047523209
1711549232.503933191   502 0.610986932    10.10.1.2 → 10.10.1.1    TCP 83 33294 → 8081 [PSH, ACK] Seq=1004 Ack=1004 Win=64256 Len=17 TSval=1047523211 TSecr=3171782920
1711549234.503933191   504 0.611088433    10.10.1.1 → 10.10.1.2    TCP 83 8081 → 33294 [PSH, ACK] Seq=1004 Ack=1021 Win=65152 Len=17 TSval=3171782922 TSecr=1047523211
1711549240.503933191   510 0.612294441    10.10.1.2 → 10.10.1.1    TCP 83 33294 → 8081 [PSH, ACK] Seq=1021 Ack=1021 Win=64256 Len=17 TSval=1047523212 TSecr=3171782922
1711549242.503933191   512 0.612394123    10.10.1.1 → 10.10.1.2    TCP 83 8081 → 33294 [PSH, ACK] Seq=1021 Ack=1038 Win=65152 Len=17 TSval=3171782923 TSecr=1047523212
1711549248.503933191   518 0.613602976    10.10.1.2 → 10.10.1.1    TCP 83 33294 → 8081 [PSH, ACK] Seq=1038 Ack=1038 Win=64256 Len=17 TSval=1047523213 TSecr=3171782923
1711549250.503933191   520 0.613702287    10.10.1.1 → 10.10.1.2    TCP 83 8081 → 33294 [PSH, ACK] Seq=1038 Ack=1055 Win=65152 Len=17 TSval=3171782924 TSecr=1047523213
1711549257.503933191   527 0.614906119    10.10.1.2 → 10.10.1.1    TCP 83 33294 → 8081 [PSH, ACK] Seq=1055 Ack=1055 Win=64256 Len=17 TSval=1047523215 TSecr=3171782924
1711549259.503933191   529 0.614994275    10.10.1.1 → 10.10.1.2    TCP 83 8081 → 33294 [PSH, ACK] Seq=1055 Ack=1072 Win=65152 Len=17 TSval=3171782926 TSecr=1047523215
1711549264.503933191   534 0.616199216    10.10.1.2 → 10.10.1.1    TCP 83 33294 → 8081 [PSH, ACK] Seq=1072 Ack=1072 Win=64256 Len=17 TSval=1047523216 TSecr=3171782926
1711549266.503933191   536 0.616295862    10.10.1.1 → 10.10.1.2    TCP 83 8081 → 33294 [PSH, ACK] Seq=1072 Ack=1089 Win=65152 Len=17 TSval=3171782927 TSecr=1047523216
1711549272.503933191   542 0.617502375    10.10.1.2 → 10.10.1.1    TCP 83 33294 → 8081 [PSH, ACK] Seq=1089 Ack=1089 Win=64256 Len=17 TSval=1047523217 TSecr=3171782927
1711549274.503933191   544 0.617598449    10.10.1.1 → 10.10.1.2    TCP 83 8081 → 33294 [PSH, ACK] Seq=1089 Ack=1106 Win=65152 Len=17 TSval=3171782928 TSecr=1047523217
1711549280.503933191   550 0.618803649    10.10.1.2 → 10.10.1.1    TCP 83 33294 → 8081 [PSH, ACK] Seq=1106 Ack=1106 Win=64256 Len=17 TSval=1047523219 TSecr=3171782928
1711549282.503933191   552 0.618903769    10.10.1.1 → 10.10.1.2    TCP 83 8081 → 33294 [PSH, ACK] Seq=1106 Ack=1123 Win=65152 Len=17 TSval=3171782930 TSecr=1047523219
1711549288.503933191   558 0.620107952    10.10.1.2 → 10.10.1.1    TCP 83 33294 → 8081 [PSH, ACK] Seq=1123 Ack=1123 Win=64256 Len=17 TSval=1047523220 TSecr=3171782930
1711549290.503933191   560 0.620204269    10.10.1.1 → 10.10.1.2    TCP 83 8081 → 33294 [PSH, ACK] Seq=1123 Ack=1140 Win=65152 Len=17 TSval=3171782931 TSecr=1047523220
1711549296.503933191   566 0.621372799    10.10.1.2 → 10.10.1.1    TCP 83 33294 → 8081 [PSH, ACK] Seq=1140 Ack=1140 Win=64256 Len=17 TSval=1047523221 TSecr=3171782931
1711549298.503933191   568 0.621498070    10.10.1.1 → 10.10.1.2    TCP 83 8081 → 33294 [PSH, ACK] Seq=1140 Ack=1157 Win=65152 Len=17 TSval=3171782932 TSecr=1047523221
1711549304.503933191   574 0.622700998    10.10.1.2 → 10.10.1.1    TCP 83 33294 → 8081 [PSH, ACK] Seq=1157 Ack=1157 Win=64256 Len=17 TSval=1047523222 TSecr=3171782932
1711549306.503933191   576 0.622792571    10.10.1.1 → 10.10.1.2    TCP 83 8081 → 33294 [PSH, ACK] Seq=1157 Ack=1174 Win=65152 Len=17 TSval=3171782933 TSecr=1047523222
1711549312.503933191   582 0.623997544    10.10.1.2 → 10.10.1.1    TCP 83 33294 → 8081 [PSH, ACK] Seq=1174 Ack=1174 Win=64256 Len=17 TSval=1047523224 TSecr=3171782933
1711549314.503933191   584 0.624094929    10.10.1.1 → 10.10.1.2    TCP 83 8081 → 33294 [PSH, ACK] Seq=1174 Ack=1191 Win=65152 Len=17 TSval=3171782935 TSecr=1047523224
1711549320.503933191   590 0.625301306    10.10.1.2 → 10.10.1.1    TCP 83 33294 → 8081 [PSH, ACK] Seq=1191 Ack=1191 Win=64256 Len=17 TSval=1047523225 TSecr=3171782935
1711549322.503933191   592 0.625397233    10.10.1.1 → 10.10.1.2    TCP 83 8081 → 33294 [PSH, ACK] Seq=1191 Ack=1208 Win=65152 Len=17 TSval=3171782936 TSecr=1047523225
1711549328.503933191   598 0.626600834    10.10.1.2 → 10.10.1.1    TCP 83 33294 → 8081 [PSH, ACK] Seq=1208 Ack=1208 Win=64256 Len=17 TSval=1047523226 TSecr=3171782936
1711549330.503933191   600 0.626691664    10.10.1.1 → 10.10.1.2    TCP 83 8081 → 33294 [PSH, ACK] Seq=1208 Ack=1225 Win=65152 Len=17 TSval=3171782937 TSecr=1047523226
1711549336.503933191   606 0.627898363    10.10.1.2 → 10.10.1.1    TCP 83 33294 → 8081 [PSH, ACK] Seq=1225 Ack=1225 Win=64256 Len=17 TSval=1047523228 TSecr=3171782937
1711549338.503933191   608 0.627995528    10.10.1.1 → 10.10.1.2    TCP 83 8081 → 33294 [PSH, ACK] Seq=1225 Ack=1242 Win=65152 Len=17 TSval=3171782939 TSecr=1047523228
1711549344.503933191   614 0.629202585    10.10.1.2 → 10.10.1.1    TCP 83 33294 → 8081 [PSH, ACK] Seq=1242 Ack=1242 Win=64256 Len=17 TSval=1047523229 TSecr=3171782939
1711549346.503933191   616 0.629294403    10.10.1.1 → 10.10.1.2    TCP 83 8081 → 33294 [PSH, ACK] Seq=1242 Ack=1259 Win=65152 Len=17 TSval=3171782940 TSecr=1047523229
1711549352.503933191   622 0.630500300    10.10.1.2 → 10.10.1.1    TCP 83 33294 → 8081 [PSH, ACK] Seq=1259 Ack=1259 Win=64256 Len=17 TSval=1047523230 TSecr=3171782940
1711549354.503933191   624 0.630592761    10.10.1.1 → 10.10.1.2    TCP 83 8081 → 33294 [PSH, ACK] Seq=1259 Ack=1276 Win=65152 Len=17 TSval=3171782941 TSecr=1047523230
1711549360.503933191   630 0.631777171    10.10.1.2 → 10.10.1.1    TCP 83 33294 → 8081 [PSH, ACK] Seq=1276 Ack=1276 Win=64256 Len=17 TSval=1047523232 TSecr=3171782941
1711549362.503933191   632 0.631884640    10.10.1.1 → 10.10.1.2    TCP 83 8081 → 33294 [PSH, ACK] Seq=1276 Ack=1293 Win=65152 Len=17 TSval=3171782943 TSecr=1047523232
1711549368.503933191   638 0.633092287    10.10.1.2 → 10.10.1.1    TCP 83 33294 → 8081 [PSH, ACK] Seq=1293 Ack=1293 Win=64256 Len=17 TSval=1047523233 TSecr=3171782943
1711549370.503933191   640 0.633184271    10.10.1.1 → 10.10.1.2    TCP 83 8081 → 33294 [PSH, ACK] Seq=1293 Ack=1310 Win=65152 Len=17 TSval=3171782944 TSecr=1047523233
1711549376.503933191   646 0.634389084    10.10.1.2 → 10.10.1.1    TCP 83 33294 → 8081 [PSH, ACK] Seq=1310 Ack=1310 Win=64256 Len=17 TSval=1047523234 TSecr=3171782944
1711549378.503933191   648 0.634481656    10.10.1.1 → 10.10.1.2    TCP 83 8081 → 33294 [PSH, ACK] Seq=1310 Ack=1327 Win=65152 Len=17 TSval=3171782945 TSecr=1047523234
1711549384.503933191   654 0.635684999    10.10.1.2 → 10.10.1.1    TCP 83 33294 → 8081 [PSH, ACK] Seq=1327 Ack=1327 Win=64256 Len=17 TSval=1047523235 TSecr=3171782945
1711549386.503933191   656 0.635782311    10.10.1.1 → 10.10.1.2    TCP 83 8081 → 33294 [PSH, ACK] Seq=1327 Ack=1344 Win=65152 Len=17 TSval=3171782946 TSecr=1047523235
1711549392.503933191   662 0.636989652    10.10.1.2 → 10.10.1.1    TCP 83 33294 → 8081 [PSH, ACK] Seq=1344 Ack=1344 Win=64256 Len=17 TSval=1047523237 TSecr=3171782946
1711549394.503933191   664 0.637080693    10.10.1.1 → 10.10.1.2    TCP 83 8081 → 33294 [PSH, ACK] Seq=1344 Ack=1361 Win=65152 Len=17 TSval=3171782948 TSecr=1047523237
1711549400.503933191   670 0.638284096    10.10.1.2 → 10.10.1.1    TCP 83 33294 → 8081 [PSH, ACK] Seq=1361 Ack=1361 Win=64256 Len=17 TSval=1047523238 TSecr=3171782948
1711549402.503933191   672 0.638376175    10.10.1.1 → 10.10.1.2    TCP 83 8081 → 33294 [PSH, ACK] Seq=1361 Ack=1378 Win=65152 Len=17 TSval=3171782949 TSecr=1047523238
1711549408.503933191   678 0.639579687    10.10.1.2 → 10.10.1.1    TCP 83 33294 → 8081 [PSH, ACK] Seq=1378 Ack=1378 Win=64256 Len=17 TSval=1047523239 TSecr=3171782949
1711549410.503933191   680 0.639675746    10.10.1.1 → 10.10.1.2    TCP 83 8081 → 33294 [PSH, ACK] Seq=1378 Ack=1395 Win=65152 Len=17 TSval=3171782950 TSecr=1047523239
1711549416.503933191   686 0.640887216    10.10.1.2 → 10.10.1.1    TCP 83 33294 → 8081 [PSH, ACK] Seq=1395 Ack=1395 Win=64256 Len=17 TSval=1047523241 TSecr=3171782950
1711549418.503933191   688 0.640984474    10.10.1.1 → 10.10.1.2    TCP 83 8081 → 33294 [PSH, ACK] Seq=1395 Ack=1412 Win=65152 Len=17 TSval=3171782952 TSecr=1047523241
1711549424.503933191   694 0.642151411    10.10.1.2 → 10.10.1.1    TCP 83 33294 → 8081 [PSH, ACK] Seq=1412 Ack=1412 Win=64256 Len=17 TSval=1047523242 TSecr=3171782952
1711549426.503933191   696 0.642280061    10.10.1.1 → 10.10.1.2    TCP 83 8081 → 33294 [PSH, ACK] Seq=1412 Ack=1429 Win=65152 Len=17 TSval=3171782953 TSecr=1047523242
1711549432.503933191   702 0.643483664    10.10.1.2 → 10.10.1.1    TCP 83 33294 → 8081 [PSH, ACK] Seq=1429 Ack=1429 Win=64256 Len=17 TSval=1047523243 TSecr=3171782953
1711549434.503933191   704 0.643585378    10.10.1.1 → 10.10.1.2    TCP 83 8081 → 33294 [PSH, ACK] Seq=1429 Ack=1446 Win=65152 Len=17 TSval=3171782954 TSecr=1047523243
1711549440.503933191   710 0.644783799    10.10.1.2 → 10.10.1.1    TCP 83 33294 → 8081 [PSH, ACK] Seq=1446 Ack=1446 Win=64256 Len=17 TSval=1047523245 TSecr=3171782954
1711549442.503933191   712 0.644884004    10.10.1.1 → 10.10.1.2    TCP 83 8081 → 33294 [PSH, ACK] Seq=1446 Ack=1463 Win=65152 Len=17 TSval=3171782956 TSecr=1047523245
1711549448.503933191   718 0.646090687    10.10.1.2 → 10.10.1.1    TCP 83 33294 → 8081 [PSH, ACK] Seq=1463 Ack=1463 Win=64256 Len=17 TSval=1047523246 TSecr=3171782956
1711549450.503933191   720 0.646183528    10.10.1.1 → 10.10.1.2    TCP 83 8081 → 33294 [PSH, ACK] Seq=1463 Ack=1480 Win=65152 Len=17 TSval=3171782957 TSecr=1047523246
1711549456.503933191   726 0.647388349    10.10.1.2 → 10.10.1.1    TCP 83 33294 → 8081 [PSH, ACK] Seq=1480 Ack=1480 Win=64256 Len=17 TSval=1047523247 TSecr=3171782957
1711549458.503933191   728 0.647501367    10.10.1.1 → 10.10.1.2    TCP 83 8081 → 33294 [PSH, ACK] Seq=1480 Ack=1497 Win=65152 Len=17 TSval=3171782958 TSecr=1047523247
1711549464.503933191   734 0.648706312    10.10.1.2 → 10.10.1.1    TCP 83 33294 → 8081 [PSH, ACK] Seq=1497 Ack=1497 Win=64256 Len=17 TSval=1047523248 TSecr=3171782958
1711549466.503933191   736 0.648802656    10.10.1.1 → 10.10.1.2    TCP 83 8081 → 33294 [PSH, ACK] Seq=1497 Ack=1514 Win=65152 Len=17 TSval=3171782959 TSecr=1047523248
1711549472.503933191   742 0.650010069    10.10.1.2 → 10.10.1.1    TCP 83 33294 → 8081 [PSH, ACK] Seq=1514 Ack=1514 Win=64256 Len=17 TSval=1047523250 TSecr=3171782959
1711549474.503933191   744 0.650107012    10.10.1.1 → 10.10.1.2    TCP 83 8081 → 33294 [PSH, ACK] Seq=1514 Ack=1531 Win=65152 Len=17 TSval=3171782961 TSecr=1047523250
1711549480.503933191   750 0.651310651    10.10.1.2 → 10.10.1.1    TCP 83 33294 → 8081 [PSH, ACK] Seq=1531 Ack=1531 Win=64256 Len=17 TSval=1047523251 TSecr=3171782961
1711549482.503933191   752 0.651413216    10.10.1.1 → 10.10.1.2    TCP 83 8081 → 33294 [PSH, ACK] Seq=1531 Ack=1548 Win=65152 Len=17 TSval=3171782962 TSecr=1047523251
1711549488.503933191   758 0.652617887    10.10.1.2 → 10.10.1.1    TCP 83 33294 → 8081 [PSH, ACK] Seq=1548 Ack=1548 Win=64256 Len=17 TSval=1047523252 TSecr=3171782962
1711549490.503933191   760 0.652715820    10.10.1.1 → 10.10.1.2    TCP 83 8081 → 33294 [PSH, ACK] Seq=1548 Ack=1565 Win=65152 Len=17 TSval=3171782963 TSecr=1047523252
1711549496.503933191   766 0.653923688    10.10.1.2 → 10.10.1.1    TCP 83 33294 → 8081 [PSH, ACK] Seq=1565 Ack=1565 Win=64256 Len=17 TSval=1047523254 TSecr=3171782963
1711549498.503933191   768 0.654021099    10.10.1.1 → 10.10.1.2    TCP 83 8081 → 33294 [PSH, ACK] Seq=1565 Ack=1582 Win=65152 Len=17 TSval=3171782965 TSecr=1047523254
1711549504.503933191   774 0.655226779    10.10.1.2 → 10.10.1.1    TCP 83 33294 → 8081 [PSH, ACK] Seq=1582 Ack=1582 Win=64256 Len=17 TSval=1047523255 TSecr=3171782965
1711549506.503933191   776 0.655330692    10.10.1.1 → 10.10.1.2    TCP 83 8081 → 33294 [PSH, ACK] Seq=1582 Ack=1599 Win=65152 Len=17 TSval=3171782966 TSecr=1047523255
1711549512.503933191   782 0.656535139    10.10.1.2 → 10.10.1.1    TCP 83 33294 → 8081 [PSH, ACK] Seq=1599 Ack=1599 Win=64256 Len=17 TSval=1047523256 TSecr=3171782966
1711549514.503933191   784 0.656627269    10.10.1.1 → 10.10.1.2    TCP 83 8081 → 33294 [PSH, ACK] Seq=1599 Ack=1616 Win=65152 Len=17 TSval=3171782967 TSecr=1047523256
1711549520.503933191   790 0.657834273    10.10.1.2 → 10.10.1.1    TCP 83 33294 → 8081 [PSH, ACK] Seq=1616 Ack=1616 Win=64256 Len=17 TSval=1047523258 TSecr=3171782967
1711549522.503933191   792 0.657926489    10.10.1.1 → 10.10.1.2    TCP 83 8081 → 33294 [PSH, ACK] Seq=1616 Ack=1633 Win=65152 Len=17 TSval=3171782969 TSecr=1047523258
1711549529.503933191   799 0.659130519    10.10.1.2 → 10.10.1.1    TCP 83 33294 → 8081 [PSH, ACK] Seq=1633 Ack=1633 Win=64256 Len=17 TSval=1047523259 TSecr=3171782969
1711549530.503933191   800 0.659190737    10.10.1.1 → 10.10.1.2    TCP 83 8081 → 33294 [PSH, ACK] Seq=1633 Ack=1650 Win=65152 Len=17 TSval=3171782970 TSecr=1047523259
1711549536.503933191   806 0.660394364    10.10.1.2 → 10.10.1.1    TCP 83 33294 → 8081 [PSH, ACK] Seq=1650 Ack=1650 Win=64256 Len=17 TSval=1047523260 TSecr=3171782970
1711549538.503933191   808 0.660491389    10.10.1.1 → 10.10.1.2    TCP 83 8081 → 33294 [PSH, ACK] Seq=1650 Ack=1667 Win=65152 Len=17 TSval=3171782971 TSecr=1047523260
1711549544.503933191   814 0.661698576    10.10.1.2 → 10.10.1.1    TCP 83 33294 → 8081 [PSH, ACK] Seq=1667 Ack=1667 Win=64256 Len=17 TSval=1047523261 TSecr=3171782971
1711549546.503933191   816 0.661795143    10.10.1.1 → 10.10.1.2    TCP 83 8081 → 33294 [PSH, ACK] Seq=1667 Ack=1684 Win=65152 Len=17 TSval=3171782972 TSecr=1047523261
1711549552.503933191   822 0.663000053    10.10.1.2 → 10.10.1.1    TCP 83 33294 → 8081 [PSH, ACK] Seq=1684 Ack=1684 Win=64256 Len=17 TSval=1047523263 TSecr=3171782972
1711549554.503933191   824 0.663102032    10.10.1.1 → 10.10.1.2    TCP 83 8081 → 33294 [PSH, ACK] Seq=1684 Ack=1701 Win=65152 Len=17 TSval=3171782974 TSecr=1047523263
1711549560.503933191   830 0.664306232    10.10.1.2 → 10.10.1.1    TCP 83 33294 → 8081 [PSH, ACK] Seq=1701 Ack=1701 Win=64256 Len=17 TSval=1047523264 TSecr=3171782974
1711549562.503933191   832 0.664403550    10.10.1.1 → 10.10.1.2    TCP 83 8081 → 33294 [PSH, ACK] Seq=1701 Ack=1718 Win=65152 Len=17 TSval=3171782975 TSecr=1047523264
1711549568.503933191   838 0.665610887    10.10.1.2 → 10.10.1.1    TCP 83 33294 → 8081 [PSH, ACK] Seq=1718 Ack=1718 Win=64256 Len=17 TSval=1047523265 TSecr=3171782975
1711549570.503933191   840 0.665707565    10.10.1.1 → 10.10.1.2    TCP 83 8081 → 33294 [PSH, ACK] Seq=1718 Ack=1735 Win=65152 Len=17 TSval=3171782976 TSecr=1047523265
1711549576.503933191   846 0.666913882    10.10.1.2 → 10.10.1.1    TCP 83 33294 → 8081 [PSH, ACK] Seq=1735 Ack=1735 Win=64256 Len=17 TSval=1047523267 TSecr=3171782976
1711549578.503933191   848 0.667015947    10.10.1.1 → 10.10.1.2    TCP 83 8081 → 33294 [PSH, ACK] Seq=1735 Ack=1752 Win=65152 Len=17 TSval=3171782978 TSecr=1047523267
1711549584.503933191   854 0.668219895    10.10.1.2 → 10.10.1.1    TCP 83 33294 → 8081 [PSH, ACK] Seq=1752 Ack=1752 Win=64256 Len=17 TSval=1047523268 TSecr=3171782978
1711549586.503933191   856 0.668313176    10.10.1.1 → 10.10.1.2    TCP 83 8081 → 33294 [PSH, ACK] Seq=1752 Ack=1769 Win=65152 Len=17 TSval=3171782979 TSecr=1047523268
1711549592.503933191   862 0.669519677    10.10.1.2 → 10.10.1.1    TCP 83 33294 → 8081 [PSH, ACK] Seq=1769 Ack=1769 Win=64256 Len=17 TSval=1047523269 TSecr=3171782979
1711549594.503933191   864 0.669611080    10.10.1.1 → 10.10.1.2    TCP 83 8081 → 33294 [PSH, ACK] Seq=1769 Ack=1786 Win=65152 Len=17 TSval=3171782980 TSecr=1047523269
1711549600.503933191   870 0.670815311    10.10.1.2 → 10.10.1.1    TCP 83 33294 → 8081 [PSH, ACK] Seq=1786 Ack=1786 Win=64256 Len=17 TSval=1047523271 TSecr=3171782980
1711549602.503933191   872 0.670921006    10.10.1.1 → 10.10.1.2    TCP 83 8081 → 33294 [PSH, ACK] Seq=1786 Ack=1803 Win=65152 Len=17 TSval=3171782982 TSecr=1047523271
1711549608.503933191   878 0.672125830    10.10.1.2 → 10.10.1.1    TCP 83 33294 → 8081 [PSH, ACK] Seq=1803 Ack=1803 Win=64256 Len=17 TSval=1047523272 TSecr=3171782982
1711549610.503933191   880 0.672216497    10.10.1.1 → 10.10.1.2    TCP 83 8081 → 33294 [PSH, ACK] Seq=1803 Ack=1820 Win=65152 Len=17 TSval=3171782983 TSecr=1047523272
1711549616.503933191   886 0.673423118    10.10.1.2 → 10.10.1.1    TCP 83 33294 → 8081 [PSH, ACK] Seq=1820 Ack=1820 Win=64256 Len=17 TSval=1047523273 TSecr=3171782983
1711549618.503933191   888 0.673514419    10.10.1.1 → 10.10.1.2    TCP 83 8081 → 33294 [PSH, ACK] Seq=1820 Ack=1837 Win=65152 Len=17 TSval=3171782984 TSecr=1047523273
1711549624.503933191   894 0.674718441    10.10.1.2 → 10.10.1.1    TCP 83 33294 → 8081 [PSH, ACK] Seq=1837 Ack=1837 Win=64256 Len=17 TSval=1047523274 TSecr=3171782984
1711549626.503933191   896 0.674810538    10.10.1.1 → 10.10.1.2    TCP 83 8081 → 33294 [PSH, ACK] Seq=1837 Ack=1854 Win=65152 Len=17 TSval=3171782985 TSecr=1047523274
1711549632.503933191   902 0.676017355    10.10.1.2 → 10.10.1.1    TCP 83 33294 → 8081 [PSH, ACK] Seq=1854 Ack=1854 Win=64256 Len=17 TSval=1047523276 TSecr=3171782985
1711549634.503933191   904 0.676114106    10.10.1.1 → 10.10.1.2    TCP 83 8081 → 33294 [PSH, ACK] Seq=1854 Ack=1871 Win=65152 Len=17 TSval=3171782987 TSecr=1047523276
1711549640.503933191   910 0.677321509    10.10.1.2 → 10.10.1.1    TCP 83 33294 → 8081 [PSH, ACK] Seq=1871 Ack=1871 Win=64256 Len=17 TSval=1047523277 TSecr=3171782987
1711549642.503933191   912 0.677415845    10.10.1.1 → 10.10.1.2    TCP 83 8081 → 33294 [PSH, ACK] Seq=1871 Ack=1888 Win=65152 Len=17 TSval=3171782988 TSecr=1047523277
1711549648.503933191   918 0.678620732    10.10.1.2 → 10.10.1.1    TCP 83 33294 → 8081 [PSH, ACK] Seq=1888 Ack=1888 Win=64256 Len=17 TSval=1047523278 TSecr=3171782988
1711549650.503933191   920 0.678712657    10.10.1.1 → 10.10.1.2    TCP 83 8081 → 33294 [PSH, ACK] Seq=1888 Ack=1905 Win=65152 Len=17 TSval=3171782989 TSecr=1047523278
1711549656.503933191   926 0.679917624    10.10.1.2 → 10.10.1.1    TCP 83 33294 → 8081 [PSH, ACK] Seq=1905 Ack=1905 Win=64256 Len=17 TSval=1047523280 TSecr=3171782989
1711549658.503933191   928 0.680016041    10.10.1.1 → 10.10.1.2    TCP 83 8081 → 33294 [PSH, ACK] Seq=1905 Ack=1922 Win=65152 Len=17 TSval=3171782991 TSecr=1047523280
1711549664.503933191   934 0.681223063    10.10.1.2 → 10.10.1.1    TCP 83 33294 → 8081 [PSH, ACK] Seq=1922 Ack=1922 Win=64256 Len=17 TSval=1047523281 TSecr=3171782991
1711549666.503933191   936 0.681368071    10.10.1.1 → 10.10.1.2    TCP 83 8081 → 33294 [PSH, ACK] Seq=1922 Ack=1939 Win=65152 Len=17 TSval=3171782992 TSecr=1047523281
1711549672.503933191   942 0.682571914    10.10.1.2 → 10.10.1.1    TCP 83 33294 → 8081 [PSH, ACK] Seq=1939 Ack=1939 Win=64256 Len=17 TSval=1047523282 TSecr=3171782992
1711549674.503933191   944 0.682664045    10.10.1.1 → 10.10.1.2    TCP 83 8081 → 33294 [PSH, ACK] Seq=1939 Ack=1956 Win=65152 Len=17 TSval=3171782993 TSecr=1047523282
1711549680.503933191   950 0.683870577    10.10.1.2 → 10.10.1.1    TCP 83 33294 → 8081 [PSH, ACK] Seq=1956 Ack=1956 Win=64256 Len=17 TSval=1047523284 TSecr=3171782993
1711549682.503933191   952 0.683966844    10.10.1.1 → 10.10.1.2    TCP 83 8081 → 33294 [PSH, ACK] Seq=1956 Ack=1973 Win=65152 Len=17 TSval=3171782995 TSecr=1047523284
1711549688.503933191   958 0.685173448    10.10.1.2 → 10.10.1.1    TCP 83 33294 → 8081 [PSH, ACK] Seq=1973 Ack=1973 Win=64256 Len=17 TSval=1047523285 TSecr=3171782995
1711549690.503933191   960 0.685264507    10.10.1.1 → 10.10.1.2    TCP 83 8081 → 33294 [PSH, ACK] Seq=1973 Ack=1990 Win=65152 Len=17 TSval=3171782996 TSecr=1047523285
1711549696.503933191   966 0.686468759    10.10.1.2 → 10.10.1.1    TCP 83 33294 → 8081 [PSH, ACK] Seq=1990 Ack=1990 Win=64256 Len=17 TSval=1047523286 TSecr=3171782996
1711549698.503933191   968 0.686560365    10.10.1.1 → 10.10.1.2    TCP 83 8081 → 33294 [PSH, ACK] Seq=1990 Ack=2007 Win=65152 Len=17 TSval=3171782997 TSecr=1047523286
1711549704.503933191   974 0.687769798    10.10.1.2 → 10.10.1.1    TCP 83 33294 → 8081 [PSH, ACK] Seq=2007 Ack=2007 Win=64256 Len=17 TSval=1047523288 TSecr=3171782997
1711549706.503933191   976 0.687866563    10.10.1.1 → 10.10.1.2    TCP 83 8081 → 33294 [PSH, ACK] Seq=2007 Ack=2024 Win=65152 Len=17 TSval=3171782999 TSecr=1047523288
1711549712.503933191   982 0.689074451    10.10.1.2 → 10.10.1.1    TCP 83 33294 → 8081 [PSH, ACK] Seq=2024 Ack=2024 Win=64256 Len=17 TSval=1047523289 TSecr=3171782999
1711549714.503933191   984 0.689166305    10.10.1.1 → 10.10.1.2    TCP 83 8081 → 33294 [PSH, ACK] Seq=2024 Ack=2041 Win=65152 Len=17 TSval=3171783000 TSecr=1047523289
1711549720.503933191   990 0.690371648    10.10.1.2 → 10.10.1.1    TCP 83 33294 → 8081 [PSH, ACK] Seq=2041 Ack=2041 Win=64256 Len=17 TSval=1047523290 TSecr=3171783000
