1711547166.571780205    22 0.291856804    10.10.1.2 → 10.10.1.1    TCP 74 58120 → 8081 [SYN] Seq=0 Win=64240 Len=0 MSS=1460 SACK_PERM=1 TSval=1045936957 TSecr=0 WS=128
1711547167.571780205    23 0.291894534    10.10.1.1 → 10.10.1.2    TCP 74 8081 → 58120 [SYN, ACK] Seq=0 Ack=1 Win=65160 Len=0 MSS=1460 SACK_PERM=1 TSval=3170196666 TSecr=1045936957 WS=128
1711547168.571780205    24 0.291967979    10.10.1.2 → 10.10.1.1    TCP 66 58120 → 8081 [ACK] Seq=1 Ack=1 Win=64256 Len=0 TSval=1045936958 TSecr=3170196666
1711547179.571780205    35 0.605000634    10.10.1.2 → 10.10.1.1    TCP 83 58120 → 8081 [PSH, ACK] Seq=1 Ack=1 Win=64256 Len=17 TSval=1045937271 TSecr=3170196666
1711547181.571780205    37 0.605030634    10.10.1.1 → 10.10.1.2    TCP 66 8081 → 58120 [ACK] Seq=1 Ack=18 Win=65152 Len=0 TSval=3170196980 TSecr=1045937271
1711547183.571780205    39 0.605299587    10.10.1.1 → 10.10.1.2    TCP 83 8081 → 58120 [PSH, ACK] Seq=1 Ack=18 Win=65152 Len=17 TSval=3170196980 TSecr=1045937271
1711547184.571780205    40 0.605329922    10.10.1.2 → 10.10.1.1    TCP 66 58120 → 8081 [ACK] Seq=18 Ack=18 Win=64256 Len=0 TSval=1045937271 TSecr=3170196980
1711547189.571780205    45 0.807296749    10.10.1.2 → 10.10.1.1    TCP 83 58120 → 8081 [PSH, ACK] Seq=18 Ack=18 Win=64256 Len=17 TSval=1045937473 TSecr=3170196980
1711547192.571780205    48 0.807424457    10.10.1.1 → 10.10.1.2    TCP 83 8081 → 58120 [PSH, ACK] Seq=18 Ack=35 Win=65152 Len=17 TSval=3170197182 TSecr=1045937473
1711547193.571780205    49 0.807456450    10.10.1.2 → 10.10.1.1    TCP 66 58120 → 8081 [ACK] Seq=35 Ack=35 Win=64256 Len=0 TSval=1045937473 TSecr=3170197182
1711547198.571780205    54 1.025129906    10.10.1.2 → 10.10.1.1    TCP 83 58120 → 8081 [PSH, ACK] Seq=35 Ack=35 Win=64256 Len=17 TSval=1045937691 TSecr=3170197182
1711547201.571780205    57 1.025250873    10.10.1.1 → 10.10.1.2    TCP 83 8081 → 58120 [PSH, ACK] Seq=35 Ack=52 Win=65152 Len=17 TSval=3170197400 TSecr=1045937691
1711547202.571780205    58 1.025282138    10.10.1.2 → 10.10.1.1    TCP 66 58120 → 8081 [ACK] Seq=52 Ack=52 Win=64256 Len=0 TSval=1045937691 TSecr=3170197400
1711547207.571780205    63 1.075455299    10.10.1.2 → 10.10.1.1    TCP 83 58120 → 8081 [PSH, ACK] Seq=52 Ack=52 Win=64256 Len=17 TSval=1045937741 TSecr=3170197400
1711547210.571780205    66 1.075579772    10.10.1.1 → 10.10.1.2    TCP 83 8081 → 58120 [PSH, ACK] Seq=52 Ack=69 Win=65152 Len=17 TSval=3170197450 TSecr=1045937741
1711547211.571780205    67 1.075609768    10.10.1.2 → 10.10.1.1    TCP 66 58120 → 8081 [ACK] Seq=69 Ack=69 Win=64256 Len=0 TSval=1045937741 TSecr=3170197450
1711547216.571780205    72 1.188944743    10.10.1.2 → 10.10.1.1    TCP 83 58120 → 8081 [PSH, ACK] Seq=69 Ack=69 Win=64256 Len=17 TSval=1045937854 TSecr=3170197450
1711547219.571780205    75 1.189070021    10.10.1.1 → 10.10.1.2    TCP 83 8081 → 58120 [PSH, ACK] Seq=69 Ack=86 Win=65152 Len=17 TSval=3170197564 TSecr=1045937854
1711547220.571780205    76 1.189101252    10.10.1.2 → 10.10.1.1    TCP 66 58120 → 8081 [ACK] Seq=86 Ack=86 Win=64256 Len=0 TSval=1045937855 TSecr=3170197564
1711547225.571780205    81 1.309235790    10.10.1.2 → 10.10.1.1    TCP 83 58120 → 8081 [PSH, ACK] Seq=86 Ack=86 Win=64256 Len=17 TSval=1045937975 TSecr=3170197564
1711547228.571780205    84 1.309361967    10.10.1.1 → 10.10.1.2    TCP 83 8081 → 58120 [PSH, ACK] Seq=86 Ack=103 Win=65152 Len=17 TSval=3170197684 TSecr=1045937975
1711547229.571780205    85 1.309394091    10.10.1.2 → 10.10.1.1    TCP 66 58120 → 8081 [ACK] Seq=103 Ack=103 Win=64256 Len=0 TSval=1045937975 TSecr=3170197684
1711547234.571780205    90 1.323766454    10.10.1.2 → 10.10.1.1    TCP 83 58120 → 8081 [PSH, ACK] Seq=103 Ack=103 Win=64256 Len=17 TSval=1045937989 TSecr=3170197684
1711547237.571780205    93 1.323891530    10.10.1.1 → 10.10.1.2    TCP 83 8081 → 58120 [PSH, ACK] Seq=103 Ack=120 Win=65152 Len=17 TSval=3170197698 TSecr=1045937989
1711547242.571780205    98 1.369962185    10.10.1.2 → 10.10.1.1    TCP 66 58120 → 8081 [ACK] Seq=120 Ack=120 Win=64256 Len=0 TSval=1045938036 TSecr=3170197698
1711547243.571780205    99 1.513523637    10.10.1.2 → 10.10.1.1    TCP 83 58120 → 8081 [PSH, ACK] Seq=120 Ack=120 Win=64256 Len=17 TSval=1045938179 TSecr=3170197698
1711547246.571780205   102 1.513652529    10.10.1.1 → 10.10.1.2    TCP 83 8081 → 58120 [PSH, ACK] Seq=120 Ack=137 Win=65152 Len=17 TSval=3170197888 TSecr=1045938179
1711547247.571780205   103 1.513686250    10.10.1.2 → 10.10.1.1    TCP 66 58120 → 8081 [ACK] Seq=137 Ack=137 Win=64256 Len=0 TSval=1045938179 TSecr=3170197888
1711547252.571780205   108 1.735202773    10.10.1.2 → 10.10.1.1    TCP 83 58120 → 8081 [PSH, ACK] Seq=137 Ack=137 Win=64256 Len=17 TSval=1045938401 TSecr=3170197888
1711547255.571780205   111 1.735327372    10.10.1.1 → 10.10.1.2    TCP 83 8081 → 58120 [PSH, ACK] Seq=137 Ack=154 Win=65152 Len=17 TSval=3170198110 TSecr=1045938401
1711547256.571780205   112 1.735358968    10.10.1.2 → 10.10.1.1    TCP 66 58120 → 8081 [ACK] Seq=154 Ack=154 Win=64256 Len=0 TSval=1045938401 TSecr=3170198110
1711547261.571780205   117 1.747913165    10.10.1.2 → 10.10.1.1    TCP 83 58120 → 8081 [PSH, ACK] Seq=154 Ack=154 Win=64256 Len=17 TSval=1045938413 TSecr=3170198110
1711547264.571780205   120 1.748038089    10.10.1.1 → 10.10.1.2    TCP 83 8081 → 58120 [PSH, ACK] Seq=154 Ack=171 Win=65152 Len=17 TSval=3170198123 TSecr=1045938413
1711547269.571780205   125 1.764386974    10.10.1.2 → 10.10.1.1    TCP 83 58120 → 8081 [PSH, ACK] Seq=171 Ack=171 Win=64256 Len=17 TSval=1045938430 TSecr=3170198123
1711547272.571780205   128 1.764517536    10.10.1.1 → 10.10.1.2    TCP 83 8081 → 58120 [PSH, ACK] Seq=171 Ack=188 Win=65152 Len=17 TSval=3170198139 TSecr=1045938430
1711547277.571780205   133 1.770667840    10.10.1.2 → 10.10.1.1    TCP 83 58120 → 8081 [PSH, ACK] Seq=188 Ack=188 Win=64256 Len=17 TSval=1045938436 TSecr=3170198139
1711547280.571780205   136 1.770797842    10.10.1.1 → 10.10.1.2    TCP 83 8081 → 58120 [PSH, ACK] Seq=188 Ack=205 Win=65152 Len=17 TSval=3170198145 TSecr=1045938436
1711547285.571780205   141 1.813964693    10.10.1.2 → 10.10.1.1    TCP 66 58120 → 8081 [ACK] Seq=205 Ack=205 Win=64256 Len=0 TSval=1045938480 TSecr=3170198145
1711547286.571780205   142 1.828910047    10.10.1.2 → 10.10.1.1    TCP 83 58120 → 8081 [PSH, ACK] Seq=205 Ack=205 Win=64256 Len=17 TSval=1045938494 TSecr=3170198145
1711547289.571780205   145 1.829034855    10.10.1.1 → 10.10.1.2    TCP 83 8081 → 58120 [PSH, ACK] Seq=205 Ack=222 Win=65152 Len=17 TSval=3170198204 TSecr=1045938494
1711547290.571780205   146 1.829065840    10.10.1.2 → 10.10.1.1    TCP 66 58120 → 8081 [ACK] Seq=222 Ack=222 Win=64256 Len=0 TSval=1045938495 TSecr=3170198204
1711547295.571780205   151 1.831828540    10.10.1.2 → 10.10.1.1    TCP 83 58120 → 8081 [PSH, ACK] Seq=222 Ack=222 Win=64256 Len=17 TSval=1045938497 TSecr=3170198204
1711547298.571780205   154 1.831952024    10.10.1.1 → 10.10.1.2    TCP 83 8081 → 58120 [PSH, ACK] Seq=222 Ack=239 Win=65152 Len=17 TSval=3170198206 TSecr=1045938497
1711547303.571780205   159 1.873963414    10.10.1.2 → 10.10.1.1    TCP 66 58120 → 8081 [ACK] Seq=239 Ack=239 Win=64256 Len=0 TSval=1045938540 TSecr=3170198206
1711547304.571780205   160 2.036178322    10.10.1.2 → 10.10.1.1    TCP 83 58120 → 8081 [PSH, ACK] Seq=239 Ack=239 Win=64256 Len=17 TSval=1045938702 TSecr=3170198206
1711547306.571780205   162 2.036302914    10.10.1.1 → 10.10.1.2    TCP 83 8081 → 58120 [PSH, ACK] Seq=239 Ack=256 Win=65152 Len=17 TSval=3170198411 TSecr=1045938702
1711547308.571780205   164 2.036333298    10.10.1.2 → 10.10.1.1    TCP 66 58120 → 8081 [ACK] Seq=256 Ack=256 Win=64256 Len=0 TSval=1045938702 TSecr=3170198411
1711547313.571780205   169 2.223503755    10.10.1.2 → 10.10.1.1    TCP 83 58120 → 8081 [PSH, ACK] Seq=256 Ack=256 Win=64256 Len=17 TSval=1045938889 TSecr=3170198411
1711547315.571780205   171 2.223629723    10.10.1.1 → 10.10.1.2    TCP 83 8081 → 58120 [PSH, ACK] Seq=256 Ack=273 Win=65152 Len=17 TSval=3170198598 TSecr=1045938889
1711547317.571780205   173 2.223665968    10.10.1.2 → 10.10.1.1    TCP 66 58120 → 8081 [ACK] Seq=273 Ack=273 Win=64256 Len=0 TSval=1045938889 TSecr=3170198598
1711547323.571780205   179 2.390713155    10.10.1.2 → 10.10.1.1    TCP 83 58120 → 8081 [PSH, ACK] Seq=273 Ack=273 Win=64256 Len=17 TSval=1045939056 TSecr=3170198598
1711547325.571780205   181 2.390838159    10.10.1.1 → 10.10.1.2    TCP 83 8081 → 58120 [PSH, ACK] Seq=273 Ack=290 Win=65152 Len=17 TSval=3170198765 TSecr=1045939056
1711547327.571780205   183 2.390868837    10.10.1.2 → 10.10.1.1    TCP 66 58120 → 8081 [ACK] Seq=290 Ack=290 Win=64256 Len=0 TSval=1045939056 TSecr=3170198765
1711547332.571780205   188 2.392831768    10.10.1.2 → 10.10.1.1    TCP 83 58120 → 8081 [PSH, ACK] Seq=290 Ack=290 Win=64256 Len=17 TSval=1045939058 TSecr=3170198765
1711547334.571780205   190 2.392958044    10.10.1.1 → 10.10.1.2    TCP 83 8081 → 58120 [PSH, ACK] Seq=290 Ack=307 Win=65152 Len=17 TSval=3170198767 TSecr=1045939058
1711547340.571780205   196 2.433025617    10.10.1.2 → 10.10.1.1    TCP 83 58120 → 8081 [PSH, ACK] Seq=307 Ack=307 Win=64256 Len=17 TSval=1045939099 TSecr=3170198767
1711547342.571780205   198 2.433157039    10.10.1.1 → 10.10.1.2    TCP 83 8081 → 58120 [PSH, ACK] Seq=307 Ack=324 Win=65152 Len=17 TSval=3170198808 TSecr=1045939099
1711547348.571780205   204 2.441535185    10.10.1.2 → 10.10.1.1    TCP 83 58120 → 8081 [PSH, ACK] Seq=324 Ack=324 Win=64256 Len=17 TSval=1045939107 TSecr=3170198808
1711547350.571780205   206 2.441665778    10.10.1.1 → 10.10.1.2    TCP 83 8081 → 58120 [PSH, ACK] Seq=324 Ack=341 Win=65152 Len=17 TSval=3170198816 TSecr=1045939107
1711547356.571780205   212 2.485967907    10.10.1.2 → 10.10.1.1    TCP 66 58120 → 8081 [ACK] Seq=341 Ack=341 Win=64256 Len=0 TSval=1045939152 TSecr=3170198816
1711547357.571780205   213 2.815262775    10.10.1.2 → 10.10.1.1    TCP 83 58120 → 8081 [PSH, ACK] Seq=341 Ack=341 Win=64256 Len=17 TSval=1045939481 TSecr=3170198816
1711547360.571780205   216 2.815387993    10.10.1.1 → 10.10.1.2    TCP 83 8081 → 58120 [PSH, ACK] Seq=341 Ack=358 Win=65152 Len=17 TSval=3170199190 TSecr=1045939481
1711547361.571780205   217 2.815424763    10.10.1.2 → 10.10.1.1    TCP 66 58120 → 8081 [ACK] Seq=358 Ack=358 Win=64256 Len=0 TSval=1045939481 TSecr=3170199190
1711547366.571780205   222 2.923234502    10.10.1.2 → 10.10.1.1    TCP 83 58120 → 8081 [PSH, ACK] Seq=358 Ack=358 Win=64256 Len=17 TSval=1045939589 TSecr=3170199190
1711547369.571780205   225 2.923359369    10.10.1.1 → 10.10.1.2    TCP 83 8081 → 58120 [PSH, ACK] Seq=358 Ack=375 Win=65152 Len=17 TSval=3170199298 TSecr=1045939589
1711547370.571780205   226 2.923396719    10.10.1.2 → 10.10.1.1    TCP 66 58120 → 8081 [ACK] Seq=375 Ack=375 Win=64256 Len=0 TSval=1045939589 TSecr=3170199298
1711547375.571780205   231 2.981234469    10.10.1.2 → 10.10.1.1    TCP 83 58120 → 8081 [PSH, ACK] Seq=375 Ack=375 Win=64256 Len=17 TSval=1045939647 TSecr=3170199298
1711547378.571780205   234 2.981366221    10.10.1.1 → 10.10.1.2    TCP 83 8081 → 58120 [PSH, ACK] Seq=375 Ack=392 Win=65152 Len=17 TSval=3170199356 TSecr=1045939647
1711547379.571780205   235 2.981402526    10.10.1.2 → 10.10.1.1    TCP 66 58120 → 8081 [ACK] Seq=392 Ack=392 Win=64256 Len=0 TSval=1045939647 TSecr=3170199356
1711547384.571780205   240 3.021689911    10.10.1.2 → 10.10.1.1    TCP 83 58120 → 8081 [PSH, ACK] Seq=392 Ack=392 Win=64256 Len=17 TSval=1045939687 TSecr=3170199356
1711547387.571780205   243 3.021816266    10.10.1.1 → 10.10.1.2    TCP 83 8081 → 58120 [PSH, ACK] Seq=392 Ack=409 Win=65152 Len=17 TSval=3170199396 TSecr=1045939687
1711547388.571780205   244 3.021851730    10.10.1.2 → 10.10.1.1    TCP 66 58120 → 8081 [ACK] Seq=409 Ack=409 Win=64256 Len=0 TSval=1045939687 TSecr=3170199396
1711547393.571780205   249 3.104701625    10.10.1.2 → 10.10.1.1    TCP 83 58120 → 8081 [PSH, ACK] Seq=409 Ack=409 Win=64256 Len=17 TSval=1045939770 TSecr=3170199396
1711547396.571780205   252 3.104827510    10.10.1.1 → 10.10.1.2    TCP 83 8081 → 58120 [PSH, ACK] Seq=409 Ack=426 Win=65152 Len=17 TSval=3170199479 TSecr=1045939770
1711547397.571780205   253 3.104862901    10.10.1.2 → 10.10.1.1    TCP 66 58120 → 8081 [ACK] Seq=426 Ack=426 Win=64256 Len=0 TSval=1045939770 TSecr=3170199479
1711547402.571780205   258 3.159826991    10.10.1.2 → 10.10.1.1    TCP 83 58120 → 8081 [PSH, ACK] Seq=426 Ack=426 Win=64256 Len=17 TSval=1045939825 TSecr=3170199479
1711547405.571780205   261 3.159951724    10.10.1.1 → 10.10.1.2    TCP 83 8081 → 58120 [PSH, ACK] Seq=426 Ack=443 Win=65152 Len=17 TSval=3170199534 TSecr=1045939825
1711547406.571780205   262 3.159987417    10.10.1.2 → 10.10.1.1    TCP 66 58120 → 8081 [ACK] Seq=443 Ack=443 Win=64256 Len=0 TSval=1045939826 TSecr=3170199534
1711547411.571780205   267 3.201462545    10.10.1.2 → 10.10.1.1    TCP 83 58120 → 8081 [PSH, ACK] Seq=443 Ack=443 Win=64256 Len=17 TSval=1045939867 TSecr=3170199534
1711547413.571780205   269 3.201587554    10.10.1.1 → 10.10.1.2    TCP 83 8081 → 58120 [PSH, ACK] Seq=443 Ack=460 Win=65152 Len=17 TSval=3170199576 TSecr=1045939867
1711547415.571780205   271 3.201624015    10.10.1.2 → 10.10.1.1    TCP 66 58120 → 8081 [ACK] Seq=460 Ack=460 Win=64256 Len=0 TSval=1045939867 TSecr=3170199576
1711547420.571780205   276 3.229408527    10.10.1.2 → 10.10.1.1    TCP 83 58120 → 8081 [PSH, ACK] Seq=460 Ack=460 Win=64256 Len=17 TSval=1045939895 TSecr=3170199576
1711547422.571780205   278 3.229533113    10.10.1.1 → 10.10.1.2    TCP 83 8081 → 58120 [PSH, ACK] Seq=460 Ack=477 Win=65152 Len=17 TSval=3170199604 TSecr=1045939895
1711547428.571780205   284 3.269969629    10.10.1.2 → 10.10.1.1    TCP 66 58120 → 8081 [ACK] Seq=477 Ack=477 Win=64256 Len=0 TSval=1045939936 TSecr=3170199604
1711547429.571780205   285 3.295142928    10.10.1.2 → 10.10.1.1    TCP 83 58120 → 8081 [PSH, ACK] Seq=477 Ack=477 Win=64256 Len=17 TSval=1045939961 TSecr=3170199604
1711547431.571780205   287 3.295268860    10.10.1.1 → 10.10.1.2    TCP 83 8081 → 58120 [PSH, ACK] Seq=477 Ack=494 Win=65152 Len=17 TSval=3170199670 TSecr=1045939961
1711547433.571780205   289 3.295305805    10.10.1.2 → 10.10.1.1    TCP 66 58120 → 8081 [ACK] Seq=494 Ack=494 Win=64256 Len=0 TSval=1045939961 TSecr=3170199670
1711547438.571780205   294 3.302249733    10.10.1.2 → 10.10.1.1    TCP 83 58120 → 8081 [PSH, ACK] Seq=494 Ack=494 Win=64256 Len=17 TSval=1045939968 TSecr=3170199670
1711547440.571780205   296 3.302374783    10.10.1.1 → 10.10.1.2    TCP 83 8081 → 58120 [PSH, ACK] Seq=494 Ack=511 Win=65152 Len=17 TSval=3170199677 TSecr=1045939968
1711547446.571780205   302 3.313366651    10.10.1.2 → 10.10.1.1    TCP 83 58120 → 8081 [PSH, ACK] Seq=511 Ack=511 Win=64256 Len=17 TSval=1045939979 TSecr=3170199677
1711547448.571780205   304 3.313499618    10.10.1.1 → 10.10.1.2    TCP 83 8081 → 58120 [PSH, ACK] Seq=511 Ack=528 Win=65152 Len=17 TSval=3170199688 TSecr=1045939979
1711547454.571780205   310 3.357963518    10.10.1.2 → 10.10.1.1    TCP 66 58120 → 8081 [ACK] Seq=528 Ack=528 Win=64256 Len=0 TSval=1045940024 TSecr=3170199688
1711547455.571780205   311 3.601043138    10.10.1.2 → 10.10.1.1    TCP 83 58120 → 8081 [PSH, ACK] Seq=528 Ack=528 Win=64256 Len=17 TSval=1045940267 TSecr=3170199688
1711547458.571780205   314 3.601163936    10.10.1.1 → 10.10.1.2    TCP 83 8081 → 58120 [PSH, ACK] Seq=528 Ack=545 Win=65152 Len=17 TSval=3170199976 TSecr=1045940267
1711547459.571780205   315 3.601198535    10.10.1.2 → 10.10.1.1    TCP 66 58120 → 8081 [ACK] Seq=545 Ack=545 Win=64256 Len=0 TSval=1045940267 TSecr=3170199976
1711547464.571780205   320 3.870939864    10.10.1.2 → 10.10.1.1    TCP 83 58120 → 8081 [PSH, ACK] Seq=545 Ack=545 Win=64256 Len=17 TSval=1045940536 TSecr=3170199976
1711547467.571780205   323 3.871063632    10.10.1.1 → 10.10.1.2    TCP 83 8081 → 58120 [PSH, ACK] Seq=545 Ack=562 Win=65152 Len=17 TSval=3170200246 TSecr=1045940536
1711547468.571780205   324 3.871099551    10.10.1.2 → 10.10.1.1    TCP 66 58120 → 8081 [ACK] Seq=562 Ack=562 Win=64256 Len=0 TSval=1045940537 TSecr=3170200246
1711547473.571780205   329 4.318409786    10.10.1.2 → 10.10.1.1    TCP 83 58120 → 8081 [PSH, ACK] Seq=562 Ack=562 Win=64256 Len=17 TSval=1045940984 TSecr=3170200246
1711547476.571780205   332 4.318531979    10.10.1.1 → 10.10.1.2    TCP 83 8081 → 58120 [PSH, ACK] Seq=562 Ack=579 Win=65152 Len=17 TSval=3170200693 TSecr=1045940984
1711547477.571780205   333 4.318568618    10.10.1.2 → 10.10.1.1    TCP 66 58120 → 8081 [ACK] Seq=579 Ack=579 Win=64256 Len=0 TSval=1045940984 TSecr=3170200693
1711547483.571780205   339 4.359827987    10.10.1.2 → 10.10.1.1    TCP 83 58120 → 8081 [PSH, ACK] Seq=579 Ack=579 Win=64256 Len=17 TSval=1045941025 TSecr=3170200693
1711547486.571780205   342 4.359953361    10.10.1.1 → 10.10.1.2    TCP 83 8081 → 58120 [PSH, ACK] Seq=579 Ack=596 Win=65152 Len=17 TSval=3170200734 TSecr=1045941025
1711547487.571780205   343 4.359989880    10.10.1.2 → 10.10.1.1    TCP 66 58120 → 8081 [ACK] Seq=596 Ack=596 Win=64256 Len=0 TSval=1045941026 TSecr=3170200734
1711547492.571780205   348 4.454316657    10.10.1.2 → 10.10.1.1    TCP 83 58120 → 8081 [PSH, ACK] Seq=596 Ack=596 Win=64256 Len=17 TSval=1045941120 TSecr=3170200734
1711547495.571780205   351 4.454443220    10.10.1.1 → 10.10.1.2    TCP 83 8081 → 58120 [PSH, ACK] Seq=596 Ack=613 Win=65152 Len=17 TSval=3170200829 TSecr=1045941120
1711547496.571780205   352 4.454479309    10.10.1.2 → 10.10.1.1    TCP 66 58120 → 8081 [ACK] Seq=613 Ack=613 Win=64256 Len=0 TSval=1045941120 TSecr=3170200829
1711547501.571780205   357 4.570884155    10.10.1.2 → 10.10.1.1    TCP 83 58120 → 8081 [PSH, ACK] Seq=613 Ack=613 Win=64256 Len=17 TSval=1045941236 TSecr=3170200829
1711547504.571780205   360 4.571033064    10.10.1.1 → 10.10.1.2    TCP 83 8081 → 58120 [PSH, ACK] Seq=613 Ack=630 Win=65152 Len=17 TSval=3170200945 TSecr=1045941236
1711547505.571780205   361 4.571070354    10.10.1.2 → 10.10.1.1    TCP 66 58120 → 8081 [ACK] Seq=630 Ack=630 Win=64256 Len=0 TSval=1045941237 TSecr=3170200945
1711547510.571780205   366 4.634589275    10.10.1.2 → 10.10.1.1    TCP 83 58120 → 8081 [PSH, ACK] Seq=630 Ack=630 Win=64256 Len=17 TSval=1045941300 TSecr=3170200945
1711547513.571780205   369 4.634715140    10.10.1.1 → 10.10.1.2    TCP 83 8081 → 58120 [PSH, ACK] Seq=630 Ack=647 Win=65152 Len=17 TSval=3170201009 TSecr=1045941300
1711547514.571780205   370 4.634751038    10.10.1.2 → 10.10.1.1    TCP 66 58120 → 8081 [ACK] Seq=647 Ack=647 Win=64256 Len=0 TSval=1045941300 TSecr=3170201009
1711547519.571780205   375 4.696453505    10.10.1.2 → 10.10.1.1    TCP 83 58120 → 8081 [PSH, ACK] Seq=647 Ack=647 Win=64256 Len=17 TSval=1045941362 TSecr=3170201009
1711547522.571780205   378 4.696580467    10.10.1.1 → 10.10.1.2    TCP 83 8081 → 58120 [PSH, ACK] Seq=647 Ack=664 Win=65152 Len=17 TSval=3170201071 TSecr=1045941362
1711547523.571780205   379 4.696617233    10.10.1.2 → 10.10.1.1    TCP 66 58120 → 8081 [ACK] Seq=664 Ack=664 Win=64256 Len=0 TSval=1045941362 TSecr=3170201071
1711547528.571780205   384 4.783041054    10.10.1.2 → 10.10.1.1    TCP 83 58120 → 8081 [PSH, ACK] Seq=664 Ack=664 Win=64256 Len=17 TSval=1045941449 TSecr=3170201071
1711547531.571780205   387 4.783166906    10.10.1.1 → 10.10.1.2    TCP 83 8081 → 58120 [PSH, ACK] Seq=664 Ack=681 Win=65152 Len=17 TSval=3170201158 TSecr=1045941449
1711547532.571780205   388 4.783202176    10.10.1.2 → 10.10.1.1    TCP 66 58120 → 8081 [ACK] Seq=681 Ack=681 Win=64256 Len=0 TSval=1045941449 TSecr=3170201158
1711547537.571780205   393 4.871476296    10.10.1.2 → 10.10.1.1    TCP 83 58120 → 8081 [PSH, ACK] Seq=681 Ack=681 Win=64256 Len=17 TSval=1045941537 TSecr=3170201158
1711547539.571780205   395 4.871603752    10.10.1.1 → 10.10.1.2    TCP 83 8081 → 58120 [PSH, ACK] Seq=681 Ack=698 Win=65152 Len=17 TSval=3170201246 TSecr=1045941537
1711547541.571780205   397 4.871640302    10.10.1.2 → 10.10.1.1    TCP 66 58120 → 8081 [ACK] Seq=698 Ack=698 Win=64256 Len=0 TSval=1045941537 TSecr=3170201246
1711547546.571780205   402 4.965603766    10.10.1.2 → 10.10.1.1    TCP 83 58120 → 8081 [PSH, ACK] Seq=698 Ack=698 Win=64256 Len=17 TSval=1045941631 TSecr=3170201246
1711547548.571780205   404 4.965729625    10.10.1.1 → 10.10.1.2    TCP 83 8081 → 58120 [PSH, ACK] Seq=698 Ack=715 Win=65152 Len=17 TSval=3170201340 TSecr=1045941631
1711547550.571780205   406 4.965767022    10.10.1.2 → 10.10.1.1    TCP 66 58120 → 8081 [ACK] Seq=715 Ack=715 Win=64256 Len=0 TSval=1045941631 TSecr=3170201340
1711547555.571780205   411 5.066854818    10.10.1.2 → 10.10.1.1    TCP 83 58120 → 8081 [PSH, ACK] Seq=715 Ack=715 Win=64256 Len=17 TSval=1045941732 TSecr=3170201340
1711547557.571780205   413 5.066980774    10.10.1.1 → 10.10.1.2    TCP 83 8081 → 58120 [PSH, ACK] Seq=715 Ack=732 Win=65152 Len=17 TSval=3170201441 TSecr=1045941732
1711547559.571780205   415 5.067017826    10.10.1.2 → 10.10.1.1    TCP 66 58120 → 8081 [ACK] Seq=732 Ack=732 Win=64256 Len=0 TSval=1045941733 TSecr=3170201441
1711547564.571780205   420 5.069741800    10.10.1.2 → 10.10.1.1    TCP 83 58120 → 8081 [PSH, ACK] Seq=732 Ack=732 Win=64256 Len=17 TSval=1045941735 TSecr=3170201441
1711547566.571780205   422 5.069867691    10.10.1.1 → 10.10.1.2    TCP 83 8081 → 58120 [PSH, ACK] Seq=732 Ack=749 Win=65152 Len=17 TSval=3170201444 TSecr=1045941735
1711547572.571780205   428 5.109969890    10.10.1.2 → 10.10.1.1    TCP 66 58120 → 8081 [ACK] Seq=749 Ack=749 Win=64256 Len=0 TSval=1045941776 TSecr=3170201444
1711547573.571780205   429 5.170597871    10.10.1.2 → 10.10.1.1    TCP 83 58120 → 8081 [PSH, ACK] Seq=749 Ack=749 Win=64256 Len=17 TSval=1045941836 TSecr=3170201444
1711547575.571780205   431 5.170723298    10.10.1.1 → 10.10.1.2    TCP 83 8081 → 58120 [PSH, ACK] Seq=749 Ack=766 Win=65152 Len=17 TSval=3170201545 TSecr=1045941836
1711547577.571780205   433 5.170760051    10.10.1.2 → 10.10.1.1    TCP 66 58120 → 8081 [ACK] Seq=766 Ack=766 Win=64256 Len=0 TSval=1045941836 TSecr=3170201545
1711547582.571780205   438 5.241352442    10.10.1.2 → 10.10.1.1    TCP 83 58120 → 8081 [PSH, ACK] Seq=766 Ack=766 Win=64256 Len=17 TSval=1045941907 TSecr=3170201545
1711547584.571780205   440 5.241477080    10.10.1.1 → 10.10.1.2    TCP 83 8081 → 58120 [PSH, ACK] Seq=766 Ack=783 Win=65152 Len=17 TSval=3170201616 TSecr=1045941907
1711547586.571780205   442 5.241514459    10.10.1.2 → 10.10.1.1    TCP 66 58120 → 8081 [ACK] Seq=783 Ack=783 Win=64256 Len=0 TSval=1045941907 TSecr=3170201616
1711547591.571780205   447 5.446500442    10.10.1.2 → 10.10.1.1    TCP 83 58120 → 8081 [PSH, ACK] Seq=783 Ack=783 Win=64256 Len=17 TSval=1045942112 TSecr=3170201616
1711547593.571780205   449 5.446626853    10.10.1.1 → 10.10.1.2    TCP 83 8081 → 58120 [PSH, ACK] Seq=783 Ack=800 Win=65152 Len=17 TSval=3170201821 TSecr=1045942112
1711547595.571780205   451 5.446664021    10.10.1.2 → 10.10.1.1    TCP 66 58120 → 8081 [ACK] Seq=800 Ack=800 Win=64256 Len=0 TSval=1045942112 TSecr=3170201821
1711547600.571780205   456 5.505811658    10.10.1.2 → 10.10.1.1    TCP 83 58120 → 8081 [PSH, ACK] Seq=800 Ack=800 Win=64256 Len=17 TSval=1045942171 TSecr=3170201821
1711547602.571780205   458 5.505937135    10.10.1.1 → 10.10.1.2    TCP 83 8081 → 58120 [PSH, ACK] Seq=800 Ack=817 Win=65152 Len=17 TSval=3170201880 TSecr=1045942171
1711547604.571780205   460 5.505972614    10.10.1.2 → 10.10.1.1    TCP 66 58120 → 8081 [ACK] Seq=817 Ack=817 Win=64256 Len=0 TSval=1045942172 TSecr=3170201880
1711547609.571780205   465 5.580207786    10.10.1.2 → 10.10.1.1    TCP 83 58120 → 8081 [PSH, ACK] Seq=817 Ack=817 Win=64256 Len=17 TSval=1045942246 TSecr=3170201880
1711547611.571780205   467 5.580337962    10.10.1.1 → 10.10.1.2    TCP 83 8081 → 58120 [PSH, ACK] Seq=817 Ack=834 Win=65152 Len=17 TSval=3170201955 TSecr=1045942246
1711547613.571780205   469 5.580373432    10.10.1.2 → 10.10.1.1    TCP 66 58120 → 8081 [ACK] Seq=834 Ack=834 Win=64256 Len=0 TSval=1045942246 TSecr=3170201955
1711547618.571780205   474 5.602829127    10.10.1.2 → 10.10.1.1    TCP 83 58120 → 8081 [PSH, ACK] Seq=834 Ack=834 Win=64256 Len=17 TSval=1045942268 TSecr=3170201955
1711547620.571780205   476 5.602954407    10.10.1.1 → 10.10.1.2    TCP 83 8081 → 58120 [PSH, ACK] Seq=834 Ack=851 Win=65152 Len=17 TSval=3170201977 TSecr=1045942268
1711547626.571780205   482 5.645968897    10.10.1.2 → 10.10.1.1    TCP 66 58120 → 8081 [ACK] Seq=851 Ack=851 Win=64256 Len=0 TSval=1045942312 TSecr=3170201977
1711547627.571780205   483 5.677388290    10.10.1.2 → 10.10.1.1    TCP 83 58120 → 8081 [PSH, ACK] Seq=851 Ack=851 Win=64256 Len=17 TSval=1045942343 TSecr=3170201977
1711547629.571780205   485 5.677513861    10.10.1.1 → 10.10.1.2    TCP 83 8081 → 58120 [PSH, ACK] Seq=851 Ack=868 Win=65152 Len=17 TSval=3170202052 TSecr=1045942343
1711547631.571780205   487 5.677549176    10.10.1.2 → 10.10.1.1    TCP 66 58120 → 8081 [ACK] Seq=868 Ack=868 Win=64256 Len=0 TSval=1045942343 TSecr=3170202052
1711547636.571780205   492 5.746892726    10.10.1.2 → 10.10.1.1    TCP 83 58120 → 8081 [PSH, ACK] Seq=868 Ack=868 Win=64256 Len=17 TSval=1045942412 TSecr=3170202052
1711547638.571780205   494 5.747035718    10.10.1.1 → 10.10.1.2    TCP 83 8081 → 58120 [PSH, ACK] Seq=868 Ack=885 Win=65152 Len=17 TSval=3170202122 TSecr=1045942412
1711547640.571780205   496 5.747071795    10.10.1.2 → 10.10.1.1    TCP 66 58120 → 8081 [ACK] Seq=885 Ack=885 Win=64256 Len=0 TSval=1045942413 TSecr=3170202122
1711547645.571780205   501 5.943079097    10.10.1.2 → 10.10.1.1    TCP 83 58120 → 8081 [PSH, ACK] Seq=885 Ack=885 Win=64256 Len=17 TSval=1045942609 TSecr=3170202122
1711547647.571780205   503 5.943204345    10.10.1.1 → 10.10.1.2    TCP 83 8081 → 58120 [PSH, ACK] Seq=885 Ack=902 Win=65152 Len=17 TSval=3170202318 TSecr=1045942609
1711547649.571780205   505 5.943240395    10.10.1.2 → 10.10.1.1    TCP 66 58120 → 8081 [ACK] Seq=902 Ack=902 Win=64256 Len=0 TSval=1045942609 TSecr=3170202318
1711547654.571780205   510 6.270831715    10.10.1.2 → 10.10.1.1    TCP 83 58120 → 8081 [PSH, ACK] Seq=902 Ack=902 Win=64256 Len=17 TSval=1045942936 TSecr=3170202318
1711547657.571780205   513 6.270953856    10.10.1.1 → 10.10.1.2    TCP 83 8081 → 58120 [PSH, ACK] Seq=902 Ack=919 Win=65152 Len=17 TSval=3170202645 TSecr=1045942936
1711547658.571780205   514 6.270988530    10.10.1.2 → 10.10.1.1    TCP 66 58120 → 8081 [ACK] Seq=919 Ack=919 Win=64256 Len=0 TSval=1045942937 TSecr=3170202645
1711547664.571780205   520 6.448175801    10.10.1.2 → 10.10.1.1    TCP 83 58120 → 8081 [PSH, ACK] Seq=919 Ack=919 Win=64256 Len=17 TSval=1045943114 TSecr=3170202645
1711547667.571780205   523 6.448301997    10.10.1.1 → 10.10.1.2    TCP 83 8081 → 58120 [PSH, ACK] Seq=919 Ack=936 Win=65152 Len=17 TSval=3170202823 TSecr=1045943114
1711547668.571780205   524 6.448337399    10.10.1.2 → 10.10.1.1    TCP 66 58120 → 8081 [ACK] Seq=936 Ack=936 Win=64256 Len=0 TSval=1045943114 TSecr=3170202823
1711547673.571780205   529 6.503232531    10.10.1.2 → 10.10.1.1    TCP 83 58120 → 8081 [PSH, ACK] Seq=936 Ack=936 Win=64256 Len=17 TSval=1045943169 TSecr=3170202823
1711547676.571780205   532 6.503358289    10.10.1.1 → 10.10.1.2    TCP 83 8081 → 58120 [PSH, ACK] Seq=936 Ack=953 Win=65152 Len=17 TSval=3170202878 TSecr=1045943169
1711547677.571780205   533 6.503395606    10.10.1.2 → 10.10.1.1    TCP 66 58120 → 8081 [ACK] Seq=953 Ack=953 Win=64256 Len=0 TSval=1045943169 TSecr=3170202878
1711547682.571780205   538 6.552016062    10.10.1.2 → 10.10.1.1    TCP 83 58120 → 8081 [PSH, ACK] Seq=953 Ack=953 Win=64256 Len=17 TSval=1045943218 TSecr=3170202878
1711547685.571780205   541 6.552403298    10.10.1.1 → 10.10.1.2    TCP 83 8081 → 58120 [PSH, ACK] Seq=953 Ack=970 Win=65152 Len=17 TSval=3170202927 TSecr=1045943218
1711547686.571780205   542 6.552439626    10.10.1.2 → 10.10.1.1    TCP 66 58120 → 8081 [ACK] Seq=970 Ack=970 Win=64256 Len=0 TSval=1045943218 TSecr=3170202927
1711547691.571780205   547 6.571008971    10.10.1.2 → 10.10.1.1    TCP 83 58120 → 8081 [PSH, ACK] Seq=970 Ack=970 Win=64256 Len=17 TSval=1045943237 TSecr=3170202927
1711547694.571780205   550 6.571133420    10.10.1.1 → 10.10.1.2    TCP 83 8081 → 58120 [PSH, ACK] Seq=970 Ack=987 Win=65152 Len=17 TSval=3170202946 TSecr=1045943237
1711547699.571780205   555 6.617966570    10.10.1.2 → 10.10.1.1    TCP 66 58120 → 8081 [ACK] Seq=987 Ack=987 Win=64256 Len=0 TSval=1045943284 TSecr=3170202946
1711547700.571780205   556 6.680014088    10.10.1.2 → 10.10.1.1    TCP 83 58120 → 8081 [PSH, ACK] Seq=987 Ack=987 Win=64256 Len=17 TSval=1045943346 TSecr=3170202946
1711547703.571780205   559 6.680140090    10.10.1.1 → 10.10.1.2    TCP 83 8081 → 58120 [PSH, ACK] Seq=987 Ack=1004 Win=65152 Len=17 TSval=3170203055 TSecr=1045943346
1711547704.571780205   560 6.680176527    10.10.1.2 → 10.10.1.1    TCP 66 58120 → 8081 [ACK] Seq=1004 Ack=1004 Win=64256 Len=0 TSval=1045943346 TSecr=3170203055
1711547709.571780205   565 6.879871194    10.10.1.2 → 10.10.1.1    TCP 83 58120 → 8081 [PSH, ACK] Seq=1004 Ack=1004 Win=64256 Len=17 TSval=1045943545 TSecr=3170203055
1711547711.571780205   567 6.879997898    10.10.1.1 → 10.10.1.2    TCP 83 8081 → 58120 [PSH, ACK] Seq=1004 Ack=1021 Win=65152 Len=17 TSval=3170203254 TSecr=1045943545
1711547713.571780205   569 6.880033111    10.10.1.2 → 10.10.1.1    TCP 66 58120 → 8081 [ACK] Seq=1021 Ack=1021 Win=64256 Len=0 TSval=1045943546 TSecr=3170203254
1711547718.571780205   574 6.906801785    10.10.1.2 → 10.10.1.1    TCP 83 58120 → 8081 [PSH, ACK] Seq=1021 Ack=1021 Win=64256 Len=17 TSval=1045943572 TSecr=3170203254
1711547720.571780205   576 6.906927006    10.10.1.1 → 10.10.1.2    TCP 83 8081 → 58120 [PSH, ACK] Seq=1021 Ack=1038 Win=65152 Len=17 TSval=3170203281 TSecr=1045943572
1711547726.571780205   582 6.949969127    10.10.1.2 → 10.10.1.1    TCP 66 58120 → 8081 [ACK] Seq=1038 Ack=1038 Win=64256 Len=0 TSval=1045943616 TSecr=3170203281
1711547727.571780205   583 7.051900010    10.10.1.2 → 10.10.1.1    TCP 83 58120 → 8081 [PSH, ACK] Seq=1038 Ack=1038 Win=64256 Len=17 TSval=1045943717 TSecr=3170203281
1711547729.571780205   585 7.052025488    10.10.1.1 → 10.10.1.2    TCP 83 8081 → 58120 [PSH, ACK] Seq=1038 Ack=1055 Win=65152 Len=17 TSval=3170203427 TSecr=1045943717
1711547731.571780205   587 7.052061454    10.10.1.2 → 10.10.1.1    TCP 66 58120 → 8081 [ACK] Seq=1055 Ack=1055 Win=64256 Len=0 TSval=1045943718 TSecr=3170203427
1711547736.571780205   592 7.216999608    10.10.1.2 → 10.10.1.1    TCP 83 58120 → 8081 [PSH, ACK] Seq=1055 Ack=1055 Win=64256 Len=17 TSval=1045943883 TSecr=3170203427
1711547738.571780205   594 7.217125757    10.10.1.1 → 10.10.1.2    TCP 83 8081 → 58120 [PSH, ACK] Seq=1055 Ack=1072 Win=65152 Len=17 TSval=3170203592 TSecr=1045943883
1711547740.571780205   596 7.217161471    10.10.1.2 → 10.10.1.1    TCP 66 58120 → 8081 [ACK] Seq=1072 Ack=1072 Win=64256 Len=0 TSval=1045943883 TSecr=3170203592
1711547745.571780205   601 7.235484481    10.10.1.2 → 10.10.1.1    TCP 83 58120 → 8081 [PSH, ACK] Seq=1072 Ack=1072 Win=64256 Len=17 TSval=1045943901 TSecr=3170203592
1711547747.571780205   603 7.235609572    10.10.1.1 → 10.10.1.2    TCP 83 8081 → 58120 [PSH, ACK] Seq=1072 Ack=1089 Win=65152 Len=17 TSval=3170203610 TSecr=1045943901
1711547753.571780205   609 7.277970664    10.10.1.2 → 10.10.1.1    TCP 66 58120 → 8081 [ACK] Seq=1089 Ack=1089 Win=64256 Len=0 TSval=1045943944 TSecr=3170203610
1711547754.571780205   610 7.375829461    10.10.1.2 → 10.10.1.1    TCP 83 58120 → 8081 [PSH, ACK] Seq=1089 Ack=1089 Win=64256 Len=17 TSval=1045944041 TSecr=3170203610
1711547756.571780205   612 7.375953630    10.10.1.1 → 10.10.1.2    TCP 83 8081 → 58120 [PSH, ACK] Seq=1089 Ack=1106 Win=65152 Len=17 TSval=3170203750 TSecr=1045944041
1711547758.571780205   614 7.375988064    10.10.1.2 → 10.10.1.1    TCP 66 58120 → 8081 [ACK] Seq=1106 Ack=1106 Win=64256 Len=0 TSval=1045944042 TSecr=3170203750
1711547763.571780205   619 7.391760821    10.10.1.2 → 10.10.1.1    TCP 83 58120 → 8081 [PSH, ACK] Seq=1106 Ack=1106 Win=64256 Len=17 TSval=1045944057 TSecr=3170203750
1711547765.571780205   621 7.391885633    10.10.1.1 → 10.10.1.2    TCP 83 8081 → 58120 [PSH, ACK] Seq=1106 Ack=1123 Win=65152 Len=17 TSval=3170203766 TSecr=1045944057
1711547771.571780205   627 7.433969303    10.10.1.2 → 10.10.1.1    TCP 66 58120 → 8081 [ACK] Seq=1123 Ack=1123 Win=64256 Len=0 TSval=1045944100 TSecr=3170203766
1711547772.571780205   628 7.541674852    10.10.1.2 → 10.10.1.1    TCP 83 58120 → 8081 [PSH, ACK] Seq=1123 Ack=1123 Win=64256 Len=17 TSval=1045944207 TSecr=3170203766
1711547774.571780205   630 7.541800709    10.10.1.1 → 10.10.1.2    TCP 83 8081 → 58120 [PSH, ACK] Seq=1123 Ack=1140 Win=65152 Len=17 TSval=3170203916 TSecr=1045944207
1711547776.571780205   632 7.541838234    10.10.1.2 → 10.10.1.1    TCP 66 58120 → 8081 [ACK] Seq=1140 Ack=1140 Win=64256 Len=0 TSval=1045944207 TSecr=3170203916
1711547781.571780205   637 7.600114393    10.10.1.2 → 10.10.1.1    TCP 83 58120 → 8081 [PSH, ACK] Seq=1140 Ack=1140 Win=64256 Len=17 TSval=1045944266 TSecr=3170203916
1711547783.571780205   639 7.600239534    10.10.1.1 → 10.10.1.2    TCP 83 8081 → 58120 [PSH, ACK] Seq=1140 Ack=1157 Win=65152 Len=17 TSval=3170203975 TSecr=1045944266
1711547785.571780205   641 7.600274965    10.10.1.2 → 10.10.1.1    TCP 66 58120 → 8081 [ACK] Seq=1157 Ack=1157 Win=64256 Len=0 TSval=1045944266 TSecr=3170203975
1711547790.571780205   646 7.695566978    10.10.1.2 → 10.10.1.1    TCP 83 58120 → 8081 [PSH, ACK] Seq=1157 Ack=1157 Win=64256 Len=17 TSval=1045944361 TSecr=3170203975
1711547792.571780205   648 7.695697957    10.10.1.1 → 10.10.1.2    TCP 83 8081 → 58120 [PSH, ACK] Seq=1157 Ack=1174 Win=65152 Len=17 TSval=3170204070 TSecr=1045944361
1711547794.571780205   650 7.695734122    10.10.1.2 → 10.10.1.1    TCP 66 58120 → 8081 [ACK] Seq=1174 Ack=1174 Win=64256 Len=0 TSval=1045944361 TSecr=3170204070
1711547799.571780205   655 7.722753524    10.10.1.2 → 10.10.1.1    TCP 83 58120 → 8081 [PSH, ACK] Seq=1174 Ack=1174 Win=64256 Len=17 TSval=1045944388 TSecr=3170204070
1711547801.571780205   657 7.722878451    10.10.1.1 → 10.10.1.2    TCP 83 8081 → 58120 [PSH, ACK] Seq=1174 Ack=1191 Win=65152 Len=17 TSval=3170204097 TSecr=1045944388
1711547807.571780205   663 7.724958649    10.10.1.2 → 10.10.1.1    TCP 83 58120 → 8081 [PSH, ACK] Seq=1191 Ack=1191 Win=64256 Len=17 TSval=1045944390 TSecr=3170204097
1711547809.571780205   665 7.725088752    10.10.1.1 → 10.10.1.2    TCP 83 8081 → 58120 [PSH, ACK] Seq=1191 Ack=1208 Win=65152 Len=17 TSval=3170204100 TSecr=1045944390
1711547815.571780205   671 7.747520926    10.10.1.2 → 10.10.1.1    TCP 83 58120 → 8081 [PSH, ACK] Seq=1208 Ack=1208 Win=64256 Len=17 TSval=1045944413 TSecr=3170204100
1711547817.571780205   673 7.747652307    10.10.1.1 → 10.10.1.2    TCP 83 8081 → 58120 [PSH, ACK] Seq=1208 Ack=1225 Win=65152 Len=17 TSval=3170204122 TSecr=1045944413
1711547823.571780205   679 7.789969498    10.10.1.2 → 10.10.1.1    TCP 66 58120 → 8081 [ACK] Seq=1225 Ack=1225 Win=64256 Len=0 TSval=1045944456 TSecr=3170204122
1711547824.571780205   680 7.933632100    10.10.1.2 → 10.10.1.1    TCP 83 58120 → 8081 [PSH, ACK] Seq=1225 Ack=1225 Win=64256 Len=17 TSval=1045944599 TSecr=3170204122
1711547826.571780205   682 7.933757527    10.10.1.1 → 10.10.1.2    TCP 83 8081 → 58120 [PSH, ACK] Seq=1225 Ack=1242 Win=65152 Len=17 TSval=3170204308 TSecr=1045944599
1711547828.571780205   684 7.933793333    10.10.1.2 → 10.10.1.1    TCP 66 58120 → 8081 [ACK] Seq=1242 Ack=1242 Win=64256 Len=0 TSval=1045944599 TSecr=3170204308
1711547833.571780205   689 8.040081300    10.10.1.2 → 10.10.1.1    TCP 83 58120 → 8081 [PSH, ACK] Seq=1242 Ack=1242 Win=64256 Len=17 TSval=1045944706 TSecr=3170204308
1711547835.571780205   691 8.040208156    10.10.1.1 → 10.10.1.2    TCP 83 8081 → 58120 [PSH, ACK] Seq=1242 Ack=1259 Win=65152 Len=17 TSval=3170204415 TSecr=1045944706
1711547837.571780205   693 8.040243466    10.10.1.2 → 10.10.1.1    TCP 66 58120 → 8081 [ACK] Seq=1259 Ack=1259 Win=64256 Len=0 TSval=1045944706 TSecr=3170204415
1711547842.571780205   698 8.065833597    10.10.1.2 → 10.10.1.1    TCP 83 58120 → 8081 [PSH, ACK] Seq=1259 Ack=1259 Win=64256 Len=17 TSval=1045944731 TSecr=3170204415
1711547844.571780205   700 8.065958092    10.10.1.1 → 10.10.1.2    TCP 83 8081 → 58120 [PSH, ACK] Seq=1259 Ack=1276 Win=65152 Len=17 TSval=3170204440 TSecr=1045944731
1711547850.571780205   706 8.109968491    10.10.1.2 → 10.10.1.1    TCP 66 58120 → 8081 [ACK] Seq=1276 Ack=1276 Win=64256 Len=0 TSval=1045944776 TSecr=3170204440
1711547851.571780205   707 8.131178649    10.10.1.2 → 10.10.1.1    TCP 83 58120 → 8081 [PSH, ACK] Seq=1276 Ack=1276 Win=64256 Len=17 TSval=1045944797 TSecr=3170204440
1711547853.571780205   709 8.131304531    10.10.1.1 → 10.10.1.2    TCP 83 8081 → 58120 [PSH, ACK] Seq=1276 Ack=1293 Win=65152 Len=17 TSval=3170204506 TSecr=1045944797
1711547855.571780205   711 8.131339935    10.10.1.2 → 10.10.1.1    TCP 66 58120 → 8081 [ACK] Seq=1293 Ack=1293 Win=64256 Len=0 TSval=1045944797 TSecr=3170204506
1711547860.571780205   716 8.148895581    10.10.1.2 → 10.10.1.1    TCP 83 58120 → 8081 [PSH, ACK] Seq=1293 Ack=1293 Win=64256 Len=17 TSval=1045944814 TSecr=3170204506
1711547862.571780205   718 8.149020840    10.10.1.1 → 10.10.1.2    TCP 83 8081 → 58120 [PSH, ACK] Seq=1293 Ack=1310 Win=65152 Len=17 TSval=3170204524 TSecr=1045944814
1711547868.571780205   724 8.159262501    10.10.1.2 → 10.10.1.1    TCP 83 58120 → 8081 [PSH, ACK] Seq=1310 Ack=1310 Win=64256 Len=17 TSval=1045944825 TSecr=3170204524
1711547870.571780205   726 8.159393135    10.10.1.1 → 10.10.1.2    TCP 83 8081 → 58120 [PSH, ACK] Seq=1310 Ack=1327 Win=65152 Len=17 TSval=3170204534 TSecr=1045944825
1711547876.571780205   732 8.205969526    10.10.1.2 → 10.10.1.1    TCP 66 58120 → 8081 [ACK] Seq=1327 Ack=1327 Win=64256 Len=0 TSval=1045944872 TSecr=3170204534
1711547878.571780205   734 8.416680844    10.10.1.2 → 10.10.1.1    TCP 83 58120 → 8081 [PSH, ACK] Seq=1327 Ack=1327 Win=64256 Len=17 TSval=1045945082 TSecr=3170204534
1711547881.571780205   737 8.416803821    10.10.1.1 → 10.10.1.2    TCP 83 8081 → 58120 [PSH, ACK] Seq=1327 Ack=1344 Win=65152 Len=17 TSval=3170204791 TSecr=1045945082
1711547882.571780205   738 8.416839433    10.10.1.2 → 10.10.1.1    TCP 66 58120 → 8081 [ACK] Seq=1344 Ack=1344 Win=64256 Len=0 TSval=1045945082 TSecr=3170204791
1711547887.571780205   743 8.531801506    10.10.1.2 → 10.10.1.1    TCP 83 58120 → 8081 [PSH, ACK] Seq=1344 Ack=1344 Win=64256 Len=17 TSval=1045945197 TSecr=3170204791
1711547890.571780205   746 8.531927435    10.10.1.1 → 10.10.1.2    TCP 83 8081 → 58120 [PSH, ACK] Seq=1344 Ack=1361 Win=65152 Len=17 TSval=3170204906 TSecr=1045945197
1711547891.571780205   747 8.531963687    10.10.1.2 → 10.10.1.1    TCP 66 58120 → 8081 [ACK] Seq=1361 Ack=1361 Win=64256 Len=0 TSval=1045945198 TSecr=3170204906
1711547896.571780205   752 8.567119992    10.10.1.2 → 10.10.1.1    TCP 83 58120 → 8081 [PSH, ACK] Seq=1361 Ack=1361 Win=64256 Len=17 TSval=1045945233 TSecr=3170204906
1711547899.571780205   755 8.567244811    10.10.1.1 → 10.10.1.2    TCP 83 8081 → 58120 [PSH, ACK] Seq=1361 Ack=1378 Win=65152 Len=17 TSval=3170204942 TSecr=1045945233
1711547904.571780205   760 8.609974281    10.10.1.2 → 10.10.1.1    TCP 66 58120 → 8081 [ACK] Seq=1378 Ack=1378 Win=64256 Len=0 TSval=1045945276 TSecr=3170204942
1711547905.571780205   761 8.626778539    10.10.1.2 → 10.10.1.1    TCP 83 58120 → 8081 [PSH, ACK] Seq=1378 Ack=1378 Win=64256 Len=17 TSval=1045945292 TSecr=3170204942
1711547908.571780205   764 8.626902204    10.10.1.1 → 10.10.1.2    TCP 83 8081 → 58120 [PSH, ACK] Seq=1378 Ack=1395 Win=65152 Len=17 TSval=3170205001 TSecr=1045945292
1711547909.571780205   765 8.626937188    10.10.1.2 → 10.10.1.1    TCP 66 58120 → 8081 [ACK] Seq=1395 Ack=1395 Win=64256 Len=0 TSval=1045945293 TSecr=3170205001
1711547914.571780205   770 8.647196752    10.10.1.2 → 10.10.1.1    TCP 83 58120 → 8081 [PSH, ACK] Seq=1395 Ack=1395 Win=64256 Len=17 TSval=1045945313 TSecr=3170205001
1711547917.571780205   773 8.647320580    10.10.1.1 → 10.10.1.2    TCP 83 8081 → 58120 [PSH, ACK] Seq=1395 Ack=1412 Win=65152 Len=17 TSval=3170205022 TSecr=1045945313
