1712183412.721868753    34 0.534912621    10.10.1.2 → 10.10.1.1    TCP 83 57110 → 8081 [PSH, ACK] Seq=1 Ack=1 Win=64256 Len=17 TSval=1682171318 TSecr=3806430774
1712183415.721868753    37 0.535211554    10.10.1.1 → 10.10.1.2    TCP 83 8081 → 57110 [PSH, ACK] Seq=1 Ack=18 Win=65152 Len=17 TSval=3806431027 TSecr=1682171318
1712183422.721868753    44 0.536421257    10.10.1.2 → 10.10.1.1    TCP 83 57110 → 8081 [PSH, ACK] Seq=18 Ack=18 Win=64256 Len=17 TSval=1682171320 TSecr=3806431027
1712183424.721868753    46 0.536545141    10.10.1.1 → 10.10.1.2    TCP 83 8081 → 57110 [PSH, ACK] Seq=18 Ack=35 Win=65152 Len=17 TSval=3806431029 TSecr=1682171320
1712183431.721868753    53 0.537762311    10.10.1.2 → 10.10.1.1    TCP 83 57110 → 8081 [PSH, ACK] Seq=35 Ack=35 Win=64256 Len=17 TSval=1682171321 TSecr=3806431029
1712183433.721868753    55 0.537894716    10.10.1.1 → 10.10.1.2    TCP 83 8081 → 57110 [PSH, ACK] Seq=35 Ack=52 Win=65152 Len=17 TSval=3806431030 TSecr=1682171321
1712183439.721868753    61 0.539106429    10.10.1.2 → 10.10.1.1    TCP 83 57110 → 8081 [PSH, ACK] Seq=52 Ack=52 Win=64256 Len=17 TSval=1682171322 TSecr=3806431030
1712183442.721868753    64 0.539237570    10.10.1.1 → 10.10.1.2    TCP 83 8081 → 57110 [PSH, ACK] Seq=52 Ack=69 Win=65152 Len=17 TSval=3806431031 TSecr=1682171322
1712183448.721868753    70 0.540419111    10.10.1.2 → 10.10.1.1    TCP 83 57110 → 8081 [PSH, ACK] Seq=69 Ack=69 Win=64256 Len=17 TSval=1682171324 TSecr=3806431031
1712183450.721868753    72 0.540549114    10.10.1.1 → 10.10.1.2    TCP 83 8081 → 57110 [PSH, ACK] Seq=69 Ack=86 Win=65152 Len=17 TSval=3806431033 TSecr=1682171324
1712183458.721868753    80 0.541765648    10.10.1.2 → 10.10.1.1    TCP 83 57110 → 8081 [PSH, ACK] Seq=86 Ack=86 Win=64256 Len=17 TSval=1682171325 TSecr=3806431033
1712183459.721868753    81 0.541898450    10.10.1.1 → 10.10.1.2    TCP 83 8081 → 57110 [PSH, ACK] Seq=86 Ack=103 Win=65152 Len=17 TSval=3806431034 TSecr=1682171325
1712183465.721868753    87 0.543111447    10.10.1.2 → 10.10.1.1    TCP 83 57110 → 8081 [PSH, ACK] Seq=103 Ack=103 Win=64256 Len=17 TSval=1682171326 TSecr=3806431034
1712183467.721868753    89 0.543241418    10.10.1.1 → 10.10.1.2    TCP 83 8081 → 57110 [PSH, ACK] Seq=103 Ack=120 Win=65152 Len=17 TSval=3806431035 TSecr=1682171326
1712183475.721868753    97 0.544419430    10.10.1.2 → 10.10.1.1    TCP 83 57110 → 8081 [PSH, ACK] Seq=120 Ack=120 Win=64256 Len=17 TSval=1682171328 TSecr=3806431035
1712183476.721868753    98 0.544550570    10.10.1.1 → 10.10.1.2    TCP 83 8081 → 57110 [PSH, ACK] Seq=120 Ack=137 Win=65152 Len=17 TSval=3806431037 TSecr=1682171328
1712183483.721868753   105 0.545787088    10.10.1.2 → 10.10.1.1    TCP 83 57110 → 8081 [PSH, ACK] Seq=137 Ack=137 Win=64256 Len=17 TSval=1682171329 TSecr=3806431037
1712183484.721868753   106 0.545921222    10.10.1.1 → 10.10.1.2    TCP 83 8081 → 57110 [PSH, ACK] Seq=137 Ack=154 Win=65152 Len=17 TSval=3806431038 TSecr=1682171329
1712183490.721868753   112 0.547133752    10.10.1.2 → 10.10.1.1    TCP 83 57110 → 8081 [PSH, ACK] Seq=154 Ack=154 Win=64256 Len=17 TSval=1682171330 TSecr=3806431038
1712183493.721868753   115 0.547264095    10.10.1.1 → 10.10.1.2    TCP 83 8081 → 57110 [PSH, ACK] Seq=154 Ack=171 Win=65152 Len=17 TSval=3806431040 TSecr=1682171330
1712183499.721868753   121 0.548477255    10.10.1.2 → 10.10.1.1    TCP 83 57110 → 8081 [PSH, ACK] Seq=171 Ack=171 Win=64256 Len=17 TSval=1682171332 TSecr=3806431040
1712183501.721868753   123 0.548554818    10.10.1.1 → 10.10.1.2    TCP 83 8081 → 57110 [PSH, ACK] Seq=171 Ack=188 Win=65152 Len=17 TSval=3806431041 TSecr=1682171332
1712183507.721868753   129 0.549718986    10.10.1.2 → 10.10.1.1    TCP 83 57110 → 8081 [PSH, ACK] Seq=188 Ack=188 Win=64256 Len=17 TSval=1682171333 TSecr=3806431041
1712183509.721868753   131 0.549765084    10.10.1.1 → 10.10.1.2    TCP 83 8081 → 57110 [PSH, ACK] Seq=188 Ack=205 Win=65152 Len=17 TSval=3806431042 TSecr=1682171333
1712183516.721868753   138 0.550974269    10.10.1.2 → 10.10.1.1    TCP 83 57110 → 8081 [PSH, ACK] Seq=205 Ack=205 Win=64256 Len=17 TSval=1682171334 TSecr=3806431042
1712183518.721868753   140 0.551051609    10.10.1.1 → 10.10.1.2    TCP 83 8081 → 57110 [PSH, ACK] Seq=205 Ack=222 Win=65152 Len=17 TSval=3806431043 TSecr=1682171334
1712183524.721868753   146 0.552262899    10.10.1.2 → 10.10.1.1    TCP 83 57110 → 8081 [PSH, ACK] Seq=222 Ack=222 Win=64256 Len=17 TSval=1682171335 TSecr=3806431043
1712183526.721868753   148 0.552340717    10.10.1.1 → 10.10.1.2    TCP 83 8081 → 57110 [PSH, ACK] Seq=222 Ack=239 Win=65152 Len=17 TSval=3806431045 TSecr=1682171335
1712183533.721868753   155 0.553510571    10.10.1.2 → 10.10.1.1    TCP 83 57110 → 8081 [PSH, ACK] Seq=239 Ack=239 Win=64256 Len=17 TSval=1682171337 TSecr=3806431045
1712183535.721868753   157 0.553590876    10.10.1.1 → 10.10.1.2    TCP 83 8081 → 57110 [PSH, ACK] Seq=239 Ack=256 Win=65152 Len=17 TSval=3806431046 TSecr=1682171337
1712183541.721868753   163 0.554801939    10.10.1.2 → 10.10.1.1    TCP 83 57110 → 8081 [PSH, ACK] Seq=256 Ack=256 Win=64256 Len=17 TSval=1682171338 TSecr=3806431046
1712183543.721868753   165 0.554878885    10.10.1.1 → 10.10.1.2    TCP 83 8081 → 57110 [PSH, ACK] Seq=256 Ack=273 Win=65152 Len=17 TSval=3806431047 TSecr=1682171338
1712183550.721868753   172 0.556089736    10.10.1.2 → 10.10.1.1    TCP 83 57110 → 8081 [PSH, ACK] Seq=273 Ack=273 Win=64256 Len=17 TSval=1682171339 TSecr=3806431047
1712183552.721868753   174 0.556167136    10.10.1.1 → 10.10.1.2    TCP 83 8081 → 57110 [PSH, ACK] Seq=273 Ack=290 Win=65152 Len=17 TSval=3806431048 TSecr=1682171339
1712183558.721868753   180 0.557342975    10.10.1.2 → 10.10.1.1    TCP 83 57110 → 8081 [PSH, ACK] Seq=290 Ack=290 Win=64256 Len=17 TSval=1682171340 TSecr=3806431048
1712183560.721868753   182 0.557421009    10.10.1.1 → 10.10.1.2    TCP 83 8081 → 57110 [PSH, ACK] Seq=290 Ack=307 Win=65152 Len=17 TSval=3806431050 TSecr=1682171340
1712183567.721868753   189 0.558634772    10.10.1.2 → 10.10.1.1    TCP 83 57110 → 8081 [PSH, ACK] Seq=307 Ack=307 Win=64256 Len=17 TSval=1682171342 TSecr=3806431050
1712183569.721868753   191 0.558711622    10.10.1.1 → 10.10.1.2    TCP 83 8081 → 57110 [PSH, ACK] Seq=307 Ack=324 Win=65152 Len=17 TSval=3806431051 TSecr=1682171342
1712183575.721868753   197 0.559922391    10.10.1.2 → 10.10.1.1    TCP 83 57110 → 8081 [PSH, ACK] Seq=324 Ack=324 Win=64256 Len=17 TSval=1682171343 TSecr=3806431051
1712183577.721868753   199 0.560002695    10.10.1.1 → 10.10.1.2    TCP 83 8081 → 57110 [PSH, ACK] Seq=324 Ack=341 Win=65152 Len=17 TSval=3806431052 TSecr=1682171343
1712183585.721868753   207 0.561213811    10.10.1.2 → 10.10.1.1    TCP 83 57110 → 8081 [PSH, ACK] Seq=341 Ack=341 Win=64256 Len=17 TSval=1682171344 TSecr=3806431052
1712183586.721868753   208 0.561301219    10.10.1.1 → 10.10.1.2    TCP 83 8081 → 57110 [PSH, ACK] Seq=341 Ack=358 Win=65152 Len=17 TSval=3806431054 TSecr=1682171344
1712183592.721868753   214 0.562514412    10.10.1.2 → 10.10.1.1    TCP 83 57110 → 8081 [PSH, ACK] Seq=358 Ack=358 Win=64256 Len=17 TSval=1682171346 TSecr=3806431054
1712183594.721868753   216 0.562595179    10.10.1.1 → 10.10.1.2    TCP 83 8081 → 57110 [PSH, ACK] Seq=358 Ack=375 Win=65152 Len=17 TSval=3806431055 TSecr=1682171346
1712183602.721868753   224 0.563810092    10.10.1.2 → 10.10.1.1    TCP 83 57110 → 8081 [PSH, ACK] Seq=375 Ack=375 Win=64256 Len=17 TSval=1682171347 TSecr=3806431055
1712183603.721868753   225 0.563887432    10.10.1.1 → 10.10.1.2    TCP 83 8081 → 57110 [PSH, ACK] Seq=375 Ack=392 Win=65152 Len=17 TSval=3806431056 TSecr=1682171347
1712183611.721868753   233 0.565098585    10.10.1.2 → 10.10.1.1    TCP 83 57110 → 8081 [PSH, ACK] Seq=392 Ack=392 Win=64256 Len=17 TSval=1682171348 TSecr=3806431056
1712183612.721868753   234 0.565176123    10.10.1.1 → 10.10.1.2    TCP 83 8081 → 57110 [PSH, ACK] Seq=392 Ack=409 Win=65152 Len=17 TSval=3806431057 TSecr=1682171348
1712183618.721868753   240 0.566390944    10.10.1.2 → 10.10.1.1    TCP 83 57110 → 8081 [PSH, ACK] Seq=409 Ack=409 Win=64256 Len=17 TSval=1682171349 TSecr=3806431057
1712183620.721868753   242 0.566471275    10.10.1.1 → 10.10.1.2    TCP 83 8081 → 57110 [PSH, ACK] Seq=409 Ack=426 Win=65152 Len=17 TSval=3806431059 TSecr=1682171349
1712183626.721868753   248 0.567681805    10.10.1.2 → 10.10.1.1    TCP 83 57110 → 8081 [PSH, ACK] Seq=426 Ack=426 Win=64256 Len=17 TSval=1682171351 TSecr=3806431059
1712183628.721868753   250 0.567759032    10.10.1.1 → 10.10.1.2    TCP 83 8081 → 57110 [PSH, ACK] Seq=426 Ack=443 Win=65152 Len=17 TSval=3806431060 TSecr=1682171351
1712183635.721868753   257 0.568923245    10.10.1.2 → 10.10.1.1    TCP 83 57110 → 8081 [PSH, ACK] Seq=443 Ack=443 Win=64256 Len=17 TSval=1682171352 TSecr=3806431060
1712183637.721868753   259 0.571257815    10.10.1.1 → 10.10.1.2    TCP 83 8081 → 57110 [PSH, ACK] Seq=443 Ack=460 Win=65152 Len=17 TSval=3806431064 TSecr=1682171352
1712183644.721868753   266 0.572471245    10.10.1.2 → 10.10.1.1    TCP 83 57110 → 8081 [PSH, ACK] Seq=460 Ack=460 Win=64256 Len=17 TSval=1682171356 TSecr=3806431064
1712183646.721868753   268 0.572555365    10.10.1.1 → 10.10.1.2    TCP 83 8081 → 57110 [PSH, ACK] Seq=460 Ack=477 Win=65152 Len=17 TSval=3806431065 TSecr=1682171356
1712183653.721868753   275 0.573769817    10.10.1.2 → 10.10.1.1    TCP 83 57110 → 8081 [PSH, ACK] Seq=477 Ack=477 Win=64256 Len=17 TSval=1682171357 TSecr=3806431065
1712183654.721868753   276 0.573853435    10.10.1.1 → 10.10.1.2    TCP 83 8081 → 57110 [PSH, ACK] Seq=477 Ack=494 Win=65152 Len=17 TSval=3806431066 TSecr=1682171357
1712183660.721868753   282 0.575063781    10.10.1.2 → 10.10.1.1    TCP 83 57110 → 8081 [PSH, ACK] Seq=494 Ack=494 Win=64256 Len=17 TSval=1682171358 TSecr=3806431066
1712183662.721868753   284 0.575145087    10.10.1.1 → 10.10.1.2    TCP 83 8081 → 57110 [PSH, ACK] Seq=494 Ack=511 Win=65152 Len=17 TSval=3806431067 TSecr=1682171358
1712183669.721868753   291 0.576354621    10.10.1.2 → 10.10.1.1    TCP 83 57110 → 8081 [PSH, ACK] Seq=511 Ack=511 Win=64256 Len=17 TSval=1682171359 TSecr=3806431067
1712183671.721868753   293 0.576435968    10.10.1.1 → 10.10.1.2    TCP 83 8081 → 57110 [PSH, ACK] Seq=511 Ack=528 Win=65152 Len=17 TSval=3806431069 TSecr=1682171359
1712183678.721868753   300 0.577650698    10.10.1.2 → 10.10.1.1    TCP 83 57110 → 8081 [PSH, ACK] Seq=528 Ack=528 Win=64256 Len=17 TSval=1682171361 TSecr=3806431069
1712183680.721868753   302 0.577734679    10.10.1.1 → 10.10.1.2    TCP 83 8081 → 57110 [PSH, ACK] Seq=528 Ack=545 Win=65152 Len=17 TSval=3806431070 TSecr=1682171361
1712183686.721868753   308 0.578944505    10.10.1.2 → 10.10.1.1    TCP 83 57110 → 8081 [PSH, ACK] Seq=545 Ack=545 Win=64256 Len=17 TSval=1682171362 TSecr=3806431070
1712183688.721868753   310 0.579026485    10.10.1.1 → 10.10.1.2    TCP 83 8081 → 57110 [PSH, ACK] Seq=545 Ack=562 Win=65152 Len=17 TSval=3806431071 TSecr=1682171362
1712183694.721868753   316 0.580238477    10.10.1.2 → 10.10.1.1    TCP 83 57110 → 8081 [PSH, ACK] Seq=562 Ack=562 Win=64256 Len=17 TSval=1682171363 TSecr=3806431071
1712183696.721868753   318 0.580320048    10.10.1.1 → 10.10.1.2    TCP 83 8081 → 57110 [PSH, ACK] Seq=562 Ack=579 Win=65152 Len=17 TSval=3806431073 TSecr=1682171363
1712183705.721868753   327 0.581542165    10.10.1.2 → 10.10.1.1    TCP 83 57110 → 8081 [PSH, ACK] Seq=579 Ack=579 Win=64256 Len=17 TSval=1682171365 TSecr=3806431073
1712183707.721868753   329 0.581625484    10.10.1.1 → 10.10.1.2    TCP 83 8081 → 57110 [PSH, ACK] Seq=579 Ack=596 Win=65152 Len=17 TSval=3806431074 TSecr=1682171365
1712183713.721868753   335 0.582836781    10.10.1.2 → 10.10.1.1    TCP 83 57110 → 8081 [PSH, ACK] Seq=596 Ack=596 Win=64256 Len=17 TSval=1682171366 TSecr=3806431074
1712183715.721868753   337 0.582918448    10.10.1.1 → 10.10.1.2    TCP 83 8081 → 57110 [PSH, ACK] Seq=596 Ack=613 Win=65152 Len=17 TSval=3806431075 TSecr=1682171366
1712183721.721868753   343 0.584128222    10.10.1.2 → 10.10.1.1    TCP 83 57110 → 8081 [PSH, ACK] Seq=613 Ack=613 Win=64256 Len=17 TSval=1682171367 TSecr=3806431075
1712183723.721868753   345 0.584210272    10.10.1.1 → 10.10.1.2    TCP 83 8081 → 57110 [PSH, ACK] Seq=613 Ack=630 Win=65152 Len=17 TSval=3806431076 TSecr=1682171367
1712183730.721868753   352 0.585424764    10.10.1.2 → 10.10.1.1    TCP 83 57110 → 8081 [PSH, ACK] Seq=630 Ack=630 Win=64256 Len=17 TSval=1682171369 TSecr=3806431076
1712183732.721868753   354 0.585508986    10.10.1.1 → 10.10.1.2    TCP 83 8081 → 57110 [PSH, ACK] Seq=630 Ack=647 Win=65152 Len=17 TSval=3806431078 TSecr=1682171369
1712183738.721868753   360 0.586720988    10.10.1.2 → 10.10.1.1    TCP 83 57110 → 8081 [PSH, ACK] Seq=647 Ack=647 Win=64256 Len=17 TSval=1682171370 TSecr=3806431078
1712183740.721868753   362 0.586802013    10.10.1.1 → 10.10.1.2    TCP 83 8081 → 57110 [PSH, ACK] Seq=647 Ack=664 Win=65152 Len=17 TSval=3806431079 TSecr=1682171370
1712183747.721868753   369 0.588012394    10.10.1.2 → 10.10.1.1    TCP 83 57110 → 8081 [PSH, ACK] Seq=664 Ack=664 Win=64256 Len=17 TSval=1682171371 TSecr=3806431079
1712183749.721868753   371 0.588089758    10.10.1.1 → 10.10.1.2    TCP 83 8081 → 57110 [PSH, ACK] Seq=664 Ack=681 Win=65152 Len=17 TSval=3806431080 TSecr=1682171371
1712183755.721868753   377 0.589272065    10.10.1.2 → 10.10.1.1    TCP 83 57110 → 8081 [PSH, ACK] Seq=681 Ack=681 Win=64256 Len=17 TSval=1682171372 TSecr=3806431080
1712183756.721868753   378 0.589309622    10.10.1.1 → 10.10.1.2    TCP 83 8081 → 57110 [PSH, ACK] Seq=681 Ack=698 Win=65152 Len=17 TSval=3806431082 TSecr=1682171372
1712183763.721868753   385 0.590519914    10.10.1.2 → 10.10.1.1    TCP 83 57110 → 8081 [PSH, ACK] Seq=698 Ack=698 Win=64256 Len=17 TSval=1682171374 TSecr=3806431082
1712183765.721868753   387 0.590603862    10.10.1.1 → 10.10.1.2    TCP 83 8081 → 57110 [PSH, ACK] Seq=698 Ack=715 Win=65152 Len=17 TSval=3806431083 TSecr=1682171374
1712183772.721868753   394 0.591814803    10.10.1.2 → 10.10.1.1    TCP 83 57110 → 8081 [PSH, ACK] Seq=715 Ack=715 Win=64256 Len=17 TSval=1682171375 TSecr=3806431083
1712183774.721868753   396 0.591896149    10.10.1.1 → 10.10.1.2    TCP 83 8081 → 57110 [PSH, ACK] Seq=715 Ack=732 Win=65152 Len=17 TSval=3806431084 TSecr=1682171375
1712183780.721868753   402 0.593056363    10.10.1.2 → 10.10.1.1    TCP 83 57110 → 8081 [PSH, ACK] Seq=732 Ack=732 Win=64256 Len=17 TSval=1682171376 TSecr=3806431084
1712183781.721868753   403 0.593092710    10.10.1.1 → 10.10.1.2    TCP 83 8081 → 57110 [PSH, ACK] Seq=732 Ack=749 Win=65152 Len=17 TSval=3806431085 TSecr=1682171376
1712183788.721868753   410 0.594304345    10.10.1.2 → 10.10.1.1    TCP 83 57110 → 8081 [PSH, ACK] Seq=749 Ack=749 Win=64256 Len=17 TSval=1682171377 TSecr=3806431085
1712183790.721868753   412 0.594387567    10.10.1.1 → 10.10.1.2    TCP 83 8081 → 57110 [PSH, ACK] Seq=749 Ack=766 Win=65152 Len=17 TSval=3806431087 TSecr=1682171377
1712183797.721868753   419 0.595597030    10.10.1.2 → 10.10.1.1    TCP 83 57110 → 8081 [PSH, ACK] Seq=766 Ack=766 Win=64256 Len=17 TSval=1682171379 TSecr=3806431087
1712183799.721868753   421 0.595678041    10.10.1.1 → 10.10.1.2    TCP 83 8081 → 57110 [PSH, ACK] Seq=766 Ack=783 Win=65152 Len=17 TSval=3806431088 TSecr=1682171379
1712183805.721868753   427 0.596889672    10.10.1.2 → 10.10.1.1    TCP 83 57110 → 8081 [PSH, ACK] Seq=783 Ack=783 Win=64256 Len=17 TSval=1682171380 TSecr=3806431088
1712183807.721868753   429 0.596966844    10.10.1.1 → 10.10.1.2    TCP 83 8081 → 57110 [PSH, ACK] Seq=783 Ack=800 Win=65152 Len=17 TSval=3806431089 TSecr=1682171380
1712183814.721868753   436 0.598179523    10.10.1.2 → 10.10.1.1    TCP 83 57110 → 8081 [PSH, ACK] Seq=800 Ack=800 Win=64256 Len=17 TSval=1682171381 TSecr=3806431089
1712183816.721868753   438 0.598263613    10.10.1.1 → 10.10.1.2    TCP 83 8081 → 57110 [PSH, ACK] Seq=800 Ack=817 Win=65152 Len=17 TSval=3806431091 TSecr=1682171381
1712183822.721868753   444 0.599474100    10.10.1.2 → 10.10.1.1    TCP 83 57110 → 8081 [PSH, ACK] Seq=817 Ack=817 Win=64256 Len=17 TSval=1682171383 TSecr=3806431091
1712183824.721868753   446 0.599551623    10.10.1.1 → 10.10.1.2    TCP 83 8081 → 57110 [PSH, ACK] Seq=817 Ack=834 Win=65152 Len=17 TSval=3806431092 TSecr=1682171383
1712183831.721868753   453 0.600763042    10.10.1.2 → 10.10.1.1    TCP 83 57110 → 8081 [PSH, ACK] Seq=834 Ack=834 Win=64256 Len=17 TSval=1682171384 TSecr=3806431092
1712183833.721868753   455 0.600840599    10.10.1.1 → 10.10.1.2    TCP 83 8081 → 57110 [PSH, ACK] Seq=834 Ack=851 Win=65152 Len=17 TSval=3806431093 TSecr=1682171384
1712183839.721868753   461 0.602056283    10.10.1.2 → 10.10.1.1    TCP 83 57110 → 8081 [PSH, ACK] Seq=851 Ack=851 Win=64256 Len=17 TSval=1682171385 TSecr=3806431093
1712183841.721868753   463 0.602139954    10.10.1.1 → 10.10.1.2    TCP 83 8081 → 57110 [PSH, ACK] Seq=851 Ack=868 Win=65152 Len=17 TSval=3806431094 TSecr=1682171385
1712183848.721868753   470 0.603349835    10.10.1.2 → 10.10.1.1    TCP 83 57110 → 8081 [PSH, ACK] Seq=868 Ack=868 Win=64256 Len=17 TSval=1682171386 TSecr=3806431094
1712183850.721868753   472 0.603431587    10.10.1.1 → 10.10.1.2    TCP 83 8081 → 57110 [PSH, ACK] Seq=868 Ack=885 Win=65152 Len=17 TSval=3806431096 TSecr=1682171386
1712183856.721868753   478 0.604642562    10.10.1.2 → 10.10.1.1    TCP 83 57110 → 8081 [PSH, ACK] Seq=885 Ack=885 Win=64256 Len=17 TSval=1682171388 TSecr=3806431096
1712183858.721868753   480 0.604724064    10.10.1.1 → 10.10.1.2    TCP 83 8081 → 57110 [PSH, ACK] Seq=885 Ack=902 Win=65152 Len=17 TSval=3806431097 TSecr=1682171388
1712183865.721868753   487 0.605939650    10.10.1.2 → 10.10.1.1    TCP 83 57110 → 8081 [PSH, ACK] Seq=902 Ack=902 Win=64256 Len=17 TSval=1682171389 TSecr=3806431097
1712183867.721868753   489 0.606022891    10.10.1.1 → 10.10.1.2    TCP 83 8081 → 57110 [PSH, ACK] Seq=902 Ack=919 Win=65152 Len=17 TSval=3806431098 TSecr=1682171389
1712183873.721868753   495 0.607233289    10.10.1.2 → 10.10.1.1    TCP 83 57110 → 8081 [PSH, ACK] Seq=919 Ack=919 Win=64256 Len=17 TSval=1682171390 TSecr=3806431098
1712183875.721868753   497 0.607314723    10.10.1.1 → 10.10.1.2    TCP 83 8081 → 57110 [PSH, ACK] Seq=919 Ack=936 Win=65152 Len=17 TSval=3806431100 TSecr=1682171390
1712183882.721868753   504 0.608525287    10.10.1.2 → 10.10.1.1    TCP 83 57110 → 8081 [PSH, ACK] Seq=936 Ack=936 Win=64256 Len=17 TSval=1682171392 TSecr=3806431100
1712183884.721868753   506 0.608606778    10.10.1.1 → 10.10.1.2    TCP 83 8081 → 57110 [PSH, ACK] Seq=936 Ack=953 Win=65152 Len=17 TSval=3806431101 TSecr=1682171392
1712183890.721868753   512 0.609770149    10.10.1.2 → 10.10.1.1    TCP 83 57110 → 8081 [PSH, ACK] Seq=953 Ack=953 Win=64256 Len=17 TSval=1682171393 TSecr=3806431101
1712183892.721868753   514 0.609852340    10.10.1.1 → 10.10.1.2    TCP 83 8081 → 57110 [PSH, ACK] Seq=953 Ack=970 Win=65152 Len=17 TSval=3806431102 TSecr=1682171393
1712183898.721868753   520 0.611060050    10.10.1.2 → 10.10.1.1    TCP 83 57110 → 8081 [PSH, ACK] Seq=970 Ack=970 Win=64256 Len=17 TSval=1682171394 TSecr=3806431102
1712183900.721868753   522 0.611140660    10.10.1.1 → 10.10.1.2    TCP 83 8081 → 57110 [PSH, ACK] Seq=970 Ack=987 Win=65152 Len=17 TSval=3806431103 TSecr=1682171394
1712183907.721868753   529 0.612350823    10.10.1.2 → 10.10.1.1    TCP 83 57110 → 8081 [PSH, ACK] Seq=987 Ack=987 Win=64256 Len=17 TSval=1682171395 TSecr=3806431103
1712183909.721868753   531 0.612427749    10.10.1.1 → 10.10.1.2    TCP 83 8081 → 57110 [PSH, ACK] Seq=987 Ack=1004 Win=65152 Len=17 TSval=3806431105 TSecr=1682171395
1712183915.721868753   537 0.613591384    10.10.1.2 → 10.10.1.1    TCP 83 57110 → 8081 [PSH, ACK] Seq=1004 Ack=1004 Win=64256 Len=17 TSval=1682171397 TSecr=3806431105
1712183916.721868753   538 0.613635915    10.10.1.1 → 10.10.1.2    TCP 83 8081 → 57110 [PSH, ACK] Seq=1004 Ack=1021 Win=65152 Len=17 TSval=3806431106 TSecr=1682171397
1712183924.721868753   546 0.614843609    10.10.1.2 → 10.10.1.1    TCP 83 57110 → 8081 [PSH, ACK] Seq=1021 Ack=1021 Win=64256 Len=17 TSval=1682171398 TSecr=3806431106
1712183926.721868753   548 0.614924806    10.10.1.1 → 10.10.1.2    TCP 83 8081 → 57110 [PSH, ACK] Seq=1021 Ack=1038 Win=65152 Len=17 TSval=3806431107 TSecr=1682171398
1712183932.721868753   554 0.616134770    10.10.1.2 → 10.10.1.1    TCP 83 57110 → 8081 [PSH, ACK] Seq=1038 Ack=1038 Win=64256 Len=17 TSval=1682171399 TSecr=3806431107
1712183934.721868753   556 0.616215833    10.10.1.1 → 10.10.1.2    TCP 83 8081 → 57110 [PSH, ACK] Seq=1038 Ack=1055 Win=65152 Len=17 TSval=3806431108 TSecr=1682171399
1712183941.721868753   563 0.617376697    10.10.1.2 → 10.10.1.1    TCP 83 57110 → 8081 [PSH, ACK] Seq=1055 Ack=1055 Win=64256 Len=17 TSval=1682171401 TSecr=3806431108
1712183942.721868753   564 0.617418414    10.10.1.1 → 10.10.1.2    TCP 83 8081 → 57110 [PSH, ACK] Seq=1055 Ack=1072 Win=65152 Len=17 TSval=3806431110 TSecr=1682171401
1712183949.721868753   571 0.618579624    10.10.1.2 → 10.10.1.1    TCP 83 57110 → 8081 [PSH, ACK] Seq=1072 Ack=1072 Win=64256 Len=17 TSval=1682171402 TSecr=3806431110
1712183950.721868753   572 0.618619073    10.10.1.1 → 10.10.1.2    TCP 83 8081 → 57110 [PSH, ACK] Seq=1072 Ack=1089 Win=65152 Len=17 TSval=3806431111 TSecr=1682171402
1712183957.721868753   579 0.619827372    10.10.1.2 → 10.10.1.1    TCP 83 57110 → 8081 [PSH, ACK] Seq=1089 Ack=1089 Win=64256 Len=17 TSval=1682171403 TSecr=3806431111
1712183959.721868753   581 0.619904613    10.10.1.1 → 10.10.1.2    TCP 83 8081 → 57110 [PSH, ACK] Seq=1089 Ack=1106 Win=65152 Len=17 TSval=3806431112 TSecr=1682171403
1712183966.721868753   588 0.621066895    10.10.1.2 → 10.10.1.1    TCP 83 57110 → 8081 [PSH, ACK] Seq=1106 Ack=1106 Win=64256 Len=17 TSval=1682171404 TSecr=3806431112
1712183967.721868753   589 0.621100634    10.10.1.1 → 10.10.1.2    TCP 83 8081 → 57110 [PSH, ACK] Seq=1106 Ack=1123 Win=65152 Len=17 TSval=3806431113 TSecr=1682171404
1712183974.721868753   596 0.622262061    10.10.1.2 → 10.10.1.1    TCP 83 57110 → 8081 [PSH, ACK] Seq=1123 Ack=1123 Win=64256 Len=17 TSval=1682171405 TSecr=3806431113
1712183975.721868753   597 0.622301185    10.10.1.1 → 10.10.1.2    TCP 83 8081 → 57110 [PSH, ACK] Seq=1123 Ack=1140 Win=65152 Len=17 TSval=3806431115 TSecr=1682171405
1712183982.721868753   604 0.623457355    10.10.1.2 → 10.10.1.1    TCP 83 57110 → 8081 [PSH, ACK] Seq=1140 Ack=1140 Win=64256 Len=17 TSval=1682171407 TSecr=3806431115
1712183983.721868753   605 0.623489526    10.10.1.1 → 10.10.1.2    TCP 83 8081 → 57110 [PSH, ACK] Seq=1140 Ack=1157 Win=65152 Len=17 TSval=3806431116 TSecr=1682171407
1712183990.721868753   612 0.624647175    10.10.1.2 → 10.10.1.1    TCP 83 57110 → 8081 [PSH, ACK] Seq=1157 Ack=1157 Win=64256 Len=17 TSval=1682171408 TSecr=3806431116
1712183991.721868753   613 0.624676856    10.10.1.1 → 10.10.1.2    TCP 83 8081 → 57110 [PSH, ACK] Seq=1157 Ack=1174 Win=65152 Len=17 TSval=3806431117 TSecr=1682171408
1712183998.721868753   620 0.625846307    10.10.1.2 → 10.10.1.1    TCP 83 57110 → 8081 [PSH, ACK] Seq=1174 Ack=1174 Win=64256 Len=17 TSval=1682171409 TSecr=3806431117
1712183999.721868753   621 0.625894638    10.10.1.1 → 10.10.1.2    TCP 83 8081 → 57110 [PSH, ACK] Seq=1174 Ack=1191 Win=65152 Len=17 TSval=3806431118 TSecr=1682171409
1712184006.721868753   628 0.627101593    10.10.1.2 → 10.10.1.1    TCP 83 57110 → 8081 [PSH, ACK] Seq=1191 Ack=1191 Win=64256 Len=17 TSval=1682171410 TSecr=3806431118
1712184008.721868753   630 0.627179263    10.10.1.1 → 10.10.1.2    TCP 83 8081 → 57110 [PSH, ACK] Seq=1191 Ack=1208 Win=65152 Len=17 TSval=3806431119 TSecr=1682171410
1712184015.721868753   637 0.628338545    10.10.1.2 → 10.10.1.1    TCP 83 57110 → 8081 [PSH, ACK] Seq=1208 Ack=1208 Win=64256 Len=17 TSval=1682171411 TSecr=3806431119
1712184016.721868753   638 0.628374020    10.10.1.1 → 10.10.1.2    TCP 83 8081 → 57110 [PSH, ACK] Seq=1208 Ack=1225 Win=65152 Len=17 TSval=3806431121 TSecr=1682171411
1712184023.721868753   645 0.629533983    10.10.1.2 → 10.10.1.1    TCP 83 57110 → 8081 [PSH, ACK] Seq=1225 Ack=1225 Win=64256 Len=17 TSval=1682171413 TSecr=3806431121
1712184024.721868753   646 0.629570475    10.10.1.1 → 10.10.1.2    TCP 83 8081 → 57110 [PSH, ACK] Seq=1225 Ack=1242 Win=65152 Len=17 TSval=3806431122 TSecr=1682171413
1712184032.721868753   654 0.630777065    10.10.1.2 → 10.10.1.1    TCP 83 57110 → 8081 [PSH, ACK] Seq=1242 Ack=1242 Win=64256 Len=17 TSval=1682171414 TSecr=3806431122
1712184034.721868753   656 0.630854391    10.10.1.1 → 10.10.1.2    TCP 83 8081 → 57110 [PSH, ACK] Seq=1242 Ack=1259 Win=65152 Len=17 TSval=3806431123 TSecr=1682171414
1712184040.721868753   662 0.632013302    10.10.1.2 → 10.10.1.1    TCP 83 57110 → 8081 [PSH, ACK] Seq=1259 Ack=1259 Win=64256 Len=17 TSval=1682171415 TSecr=3806431123
1712184041.721868753   663 0.632049197    10.10.1.1 → 10.10.1.2    TCP 83 8081 → 57110 [PSH, ACK] Seq=1259 Ack=1276 Win=65152 Len=17 TSval=3806431124 TSecr=1682171415
1712184048.721868753   670 0.633270002    10.10.1.2 → 10.10.1.1    TCP 83 57110 → 8081 [PSH, ACK] Seq=1276 Ack=1276 Win=64256 Len=17 TSval=1682171416 TSecr=3806431124
1712184050.721868753   672 0.633348747    10.10.1.1 → 10.10.1.2    TCP 83 8081 → 57110 [PSH, ACK] Seq=1276 Ack=1293 Win=65152 Len=17 TSval=3806431126 TSecr=1682171416
1712184057.721868753   679 0.634561985    10.10.1.2 → 10.10.1.1    TCP 83 57110 → 8081 [PSH, ACK] Seq=1293 Ack=1293 Win=64256 Len=17 TSval=1682171418 TSecr=3806431126
1712184059.721868753   681 0.634638996    10.10.1.1 → 10.10.1.2    TCP 83 8081 → 57110 [PSH, ACK] Seq=1293 Ack=1310 Win=65152 Len=17 TSval=3806431127 TSecr=1682171418
1712184065.721868753   687 0.635797435    10.10.1.2 → 10.10.1.1    TCP 83 57110 → 8081 [PSH, ACK] Seq=1310 Ack=1310 Win=64256 Len=17 TSval=1682171419 TSecr=3806431127
1712184066.721868753   688 0.635832266    10.10.1.1 → 10.10.1.2    TCP 83 8081 → 57110 [PSH, ACK] Seq=1310 Ack=1327 Win=65152 Len=17 TSval=3806431128 TSecr=1682171419
1712184073.721868753   695 0.636989280    10.10.1.2 → 10.10.1.1    TCP 83 57110 → 8081 [PSH, ACK] Seq=1327 Ack=1327 Win=64256 Len=17 TSval=1682171420 TSecr=3806431128
1712184074.721868753   696 0.637018951    10.10.1.1 → 10.10.1.2    TCP 83 8081 → 57110 [PSH, ACK] Seq=1327 Ack=1344 Win=65152 Len=17 TSval=3806431129 TSecr=1682171420
1712184081.721868753   703 0.638228770    10.10.1.2 → 10.10.1.1    TCP 83 57110 → 8081 [PSH, ACK] Seq=1344 Ack=1344 Win=64256 Len=17 TSval=1682171421 TSecr=3806431129
1712184083.721868753   705 0.638308664    10.10.1.1 → 10.10.1.2    TCP 83 8081 → 57110 [PSH, ACK] Seq=1344 Ack=1361 Win=65152 Len=17 TSval=3806431131 TSecr=1682171421
1712184090.721868753   712 0.639517740    10.10.1.2 → 10.10.1.1    TCP 83 57110 → 8081 [PSH, ACK] Seq=1361 Ack=1361 Win=64256 Len=17 TSval=1682171423 TSecr=3806431131
1712184092.721868753   714 0.639594405    10.10.1.1 → 10.10.1.2    TCP 83 8081 → 57110 [PSH, ACK] Seq=1361 Ack=1378 Win=65152 Len=17 TSval=3806431132 TSecr=1682171423
1712184098.721868753   720 0.640754254    10.10.1.2 → 10.10.1.1    TCP 83 57110 → 8081 [PSH, ACK] Seq=1378 Ack=1378 Win=64256 Len=17 TSval=1682171424 TSecr=3806431132
1712184099.721868753   721 0.640788563    10.10.1.1 → 10.10.1.2    TCP 83 8081 → 57110 [PSH, ACK] Seq=1378 Ack=1395 Win=65152 Len=17 TSval=3806431133 TSecr=1682171424
1712184106.721868753   728 0.641997939    10.10.1.2 → 10.10.1.1    TCP 83 57110 → 8081 [PSH, ACK] Seq=1395 Ack=1395 Win=64256 Len=17 TSval=1682171425 TSecr=3806431133
1712184108.721868753   730 0.642079493    10.10.1.1 → 10.10.1.2    TCP 83 8081 → 57110 [PSH, ACK] Seq=1395 Ack=1412 Win=65152 Len=17 TSval=3806431134 TSecr=1682171425
1712184115.721868753   737 0.643289756    10.10.1.2 → 10.10.1.1    TCP 83 57110 → 8081 [PSH, ACK] Seq=1412 Ack=1412 Win=64256 Len=17 TSval=1682171426 TSecr=3806431134
1712184117.721868753   739 0.643366889    10.10.1.1 → 10.10.1.2    TCP 83 8081 → 57110 [PSH, ACK] Seq=1412 Ack=1429 Win=65152 Len=17 TSval=3806431136 TSecr=1682171426
1712184123.721868753   745 0.644527383    10.10.1.2 → 10.10.1.1    TCP 83 57110 → 8081 [PSH, ACK] Seq=1429 Ack=1429 Win=64256 Len=17 TSval=1682171428 TSecr=3806431136
1712184124.721868753   746 0.644563732    10.10.1.1 → 10.10.1.2    TCP 83 8081 → 57110 [PSH, ACK] Seq=1429 Ack=1446 Win=65152 Len=17 TSval=3806431137 TSecr=1682171428
1712184131.721868753   753 0.645725098    10.10.1.2 → 10.10.1.1    TCP 83 57110 → 8081 [PSH, ACK] Seq=1446 Ack=1446 Win=64256 Len=17 TSval=1682171429 TSecr=3806431137
1712184132.721868753   754 0.645761920    10.10.1.1 → 10.10.1.2    TCP 83 8081 → 57110 [PSH, ACK] Seq=1446 Ack=1463 Win=65152 Len=17 TSval=3806431138 TSecr=1682171429
1712184139.721868753   761 0.646975134    10.10.1.2 → 10.10.1.1    TCP 83 57110 → 8081 [PSH, ACK] Seq=1463 Ack=1463 Win=64256 Len=17 TSval=1682171430 TSecr=3806431138
1712184141.721868753   763 0.647052702    10.10.1.1 → 10.10.1.2    TCP 83 8081 → 57110 [PSH, ACK] Seq=1463 Ack=1480 Win=65152 Len=17 TSval=3806431139 TSecr=1682171430
1712184148.721868753   770 0.648212290    10.10.1.2 → 10.10.1.1    TCP 83 57110 → 8081 [PSH, ACK] Seq=1480 Ack=1480 Win=64256 Len=17 TSval=1682171431 TSecr=3806431139
1712184149.721868753   771 0.648248336    10.10.1.1 → 10.10.1.2    TCP 83 8081 → 57110 [PSH, ACK] Seq=1480 Ack=1497 Win=65152 Len=17 TSval=3806431141 TSecr=1682171431
1712184156.721868753   778 0.649376857    10.10.1.2 → 10.10.1.1    TCP 83 57110 → 8081 [PSH, ACK] Seq=1497 Ack=1497 Win=64256 Len=17 TSval=1682171433 TSecr=3806431141
1712184159.721868753   781 0.653294097    10.10.1.1 → 10.10.1.2    TCP 83 8081 → 57110 [PSH, ACK] Seq=1497 Ack=1514 Win=65152 Len=17 TSval=3806431146 TSecr=1682171433
1712184165.721868753   787 0.654505900    10.10.1.2 → 10.10.1.1    TCP 83 57110 → 8081 [PSH, ACK] Seq=1514 Ack=1514 Win=64256 Len=17 TSval=1682171438 TSecr=3806431146
1712184167.721868753   789 0.654586924    10.10.1.1 → 10.10.1.2    TCP 83 8081 → 57110 [PSH, ACK] Seq=1514 Ack=1531 Win=65152 Len=17 TSval=3806431147 TSecr=1682171438
1712184173.721868753   795 0.655797253    10.10.1.2 → 10.10.1.1    TCP 83 57110 → 8081 [PSH, ACK] Seq=1531 Ack=1531 Win=64256 Len=17 TSval=1682171439 TSecr=3806431147
1712184175.721868753   797 0.655874295    10.10.1.1 → 10.10.1.2    TCP 83 8081 → 57110 [PSH, ACK] Seq=1531 Ack=1548 Win=65152 Len=17 TSval=3806431148 TSecr=1682171439
1712184181.721868753   803 0.657034106    10.10.1.2 → 10.10.1.1    TCP 83 57110 → 8081 [PSH, ACK] Seq=1548 Ack=1548 Win=64256 Len=17 TSval=1682171440 TSecr=3806431148
1712184182.721868753   804 0.657069821    10.10.1.1 → 10.10.1.2    TCP 83 8081 → 57110 [PSH, ACK] Seq=1548 Ack=1565 Win=65152 Len=17 TSval=3806431149 TSecr=1682171440
1712184189.721868753   811 0.658229131    10.10.1.2 → 10.10.1.1    TCP 83 57110 → 8081 [PSH, ACK] Seq=1565 Ack=1565 Win=64256 Len=17 TSval=1682171441 TSecr=3806431149
1712184190.721868753   812 0.658264536    10.10.1.1 → 10.10.1.2    TCP 83 8081 → 57110 [PSH, ACK] Seq=1565 Ack=1582 Win=65152 Len=17 TSval=3806431151 TSecr=1682171441
1712184197.721868753   819 0.659420635    10.10.1.2 → 10.10.1.1    TCP 83 57110 → 8081 [PSH, ACK] Seq=1582 Ack=1582 Win=64256 Len=17 TSval=1682171443 TSecr=3806431151
1712184198.721868753   820 0.659452275    10.10.1.1 → 10.10.1.2    TCP 83 8081 → 57110 [PSH, ACK] Seq=1582 Ack=1599 Win=65152 Len=17 TSval=3806431152 TSecr=1682171443
1712184205.721868753   827 0.660608876    10.10.1.2 → 10.10.1.1    TCP 83 57110 → 8081 [PSH, ACK] Seq=1599 Ack=1599 Win=64256 Len=17 TSval=1682171444 TSecr=3806431152
1712184206.721868753   828 0.660637672    10.10.1.1 → 10.10.1.2    TCP 83 8081 → 57110 [PSH, ACK] Seq=1599 Ack=1616 Win=65152 Len=17 TSval=3806431153 TSecr=1682171444
1712184213.721868753   835 0.661862159    10.10.1.2 → 10.10.1.1    TCP 83 57110 → 8081 [PSH, ACK] Seq=1616 Ack=1616 Win=64256 Len=17 TSval=1682171445 TSecr=3806431153
1712184215.721868753   837 0.661942513    10.10.1.1 → 10.10.1.2    TCP 83 8081 → 57110 [PSH, ACK] Seq=1616 Ack=1633 Win=65152 Len=17 TSval=3806431154 TSecr=1682171445
1712184221.721868753   843 0.663153372    10.10.1.2 → 10.10.1.1    TCP 83 57110 → 8081 [PSH, ACK] Seq=1633 Ack=1633 Win=64256 Len=17 TSval=1682171446 TSecr=3806431154
1712184223.721868753   845 0.663229911    10.10.1.1 → 10.10.1.2    TCP 83 8081 → 57110 [PSH, ACK] Seq=1633 Ack=1650 Win=65152 Len=17 TSval=3806431155 TSecr=1682171446
1712184229.721868753   851 0.664370759    10.10.1.2 → 10.10.1.1    TCP 83 57110 → 8081 [PSH, ACK] Seq=1650 Ack=1650 Win=64256 Len=17 TSval=1682171448 TSecr=3806431155
1712184230.721868753   852 0.664407032    10.10.1.1 → 10.10.1.2    TCP 83 8081 → 57110 [PSH, ACK] Seq=1650 Ack=1667 Win=65152 Len=17 TSval=3806431157 TSecr=1682171448
1712184237.721868753   859 0.665567364    10.10.1.2 → 10.10.1.1    TCP 83 57110 → 8081 [PSH, ACK] Seq=1667 Ack=1667 Win=64256 Len=17 TSval=1682171449 TSecr=3806431157
1712184239.721868753   861 0.665604328    10.10.1.1 → 10.10.1.2    TCP 83 8081 → 57110 [PSH, ACK] Seq=1667 Ack=1684 Win=65152 Len=17 TSval=3806431158 TSecr=1682171449
1712184246.721868753   868 0.666811300    10.10.1.2 → 10.10.1.1    TCP 83 57110 → 8081 [PSH, ACK] Seq=1684 Ack=1684 Win=64256 Len=17 TSval=1682171450 TSecr=3806431158
1712184248.721868753   870 0.666888697    10.10.1.1 → 10.10.1.2    TCP 83 8081 → 57110 [PSH, ACK] Seq=1684 Ack=1701 Win=65152 Len=17 TSval=3806431159 TSecr=1682171450
1712184254.721868753   876 0.668047927    10.10.1.2 → 10.10.1.1    TCP 83 57110 → 8081 [PSH, ACK] Seq=1701 Ack=1701 Win=64256 Len=17 TSval=1682171451 TSecr=3806431159
1712184255.721868753   877 0.668083552    10.10.1.1 → 10.10.1.2    TCP 83 8081 → 57110 [PSH, ACK] Seq=1701 Ack=1718 Win=65152 Len=17 TSval=3806431160 TSecr=1682171451
1712184262.721868753   884 0.669329845    10.10.1.2 → 10.10.1.1    TCP 83 57110 → 8081 [PSH, ACK] Seq=1718 Ack=1718 Win=64256 Len=17 TSval=1682171452 TSecr=3806431160
1712184264.721868753   886 0.669407179    10.10.1.1 → 10.10.1.2    TCP 83 8081 → 57110 [PSH, ACK] Seq=1718 Ack=1735 Win=65152 Len=17 TSval=3806431162 TSecr=1682171452
1712184270.721868753   892 0.670587389    10.10.1.2 → 10.10.1.1    TCP 83 57110 → 8081 [PSH, ACK] Seq=1735 Ack=1735 Win=64256 Len=17 TSval=1682171454 TSecr=3806431162
1712184271.721868753   893 0.670623720    10.10.1.1 → 10.10.1.2    TCP 83 8081 → 57110 [PSH, ACK] Seq=1735 Ack=1752 Win=65152 Len=17 TSval=3806431163 TSecr=1682171454
1712184278.721868753   900 0.671780531    10.10.1.2 → 10.10.1.1    TCP 83 57110 → 8081 [PSH, ACK] Seq=1752 Ack=1752 Win=64256 Len=17 TSval=1682171455 TSecr=3806431163
1712184280.721868753   902 0.671812804    10.10.1.1 → 10.10.1.2    TCP 83 8081 → 57110 [PSH, ACK] Seq=1752 Ack=1769 Win=65152 Len=17 TSval=3806431164 TSecr=1682171455
1712184286.721868753   908 0.672970790    10.10.1.2 → 10.10.1.1    TCP 83 57110 → 8081 [PSH, ACK] Seq=1769 Ack=1769 Win=64256 Len=17 TSval=1682171456 TSecr=3806431164
1712184287.721868753   909 0.672999260    10.10.1.1 → 10.10.1.2    TCP 83 8081 → 57110 [PSH, ACK] Seq=1769 Ack=1786 Win=65152 Len=17 TSval=3806431165 TSecr=1682171456
1712184294.721868753   916 0.674209955    10.10.1.2 → 10.10.1.1    TCP 83 57110 → 8081 [PSH, ACK] Seq=1786 Ack=1786 Win=64256 Len=17 TSval=1682171457 TSecr=3806431165
1712184296.721868753   918 0.674293139    10.10.1.1 → 10.10.1.2    TCP 83 8081 → 57110 [PSH, ACK] Seq=1786 Ack=1803 Win=65152 Len=17 TSval=3806431167 TSecr=1682171457
1712184302.721868753   924 0.675502729    10.10.1.2 → 10.10.1.1    TCP 83 57110 → 8081 [PSH, ACK] Seq=1803 Ack=1803 Win=64256 Len=17 TSval=1682171459 TSecr=3806431167
1712184304.721868753   926 0.675583244    10.10.1.1 → 10.10.1.2    TCP 83 8081 → 57110 [PSH, ACK] Seq=1803 Ack=1820 Win=65152 Len=17 TSval=3806431168 TSecr=1682171459
1712184310.721868753   932 0.676743581    10.10.1.2 → 10.10.1.1    TCP 83 57110 → 8081 [PSH, ACK] Seq=1820 Ack=1820 Win=64256 Len=17 TSval=1682171460 TSecr=3806431168
1712184312.721868753   934 0.676779925    10.10.1.1 → 10.10.1.2    TCP 83 8081 → 57110 [PSH, ACK] Seq=1820 Ack=1837 Win=65152 Len=17 TSval=3806431169 TSecr=1682171460
1712184318.721868753   940 0.677989901    10.10.1.2 → 10.10.1.1    TCP 83 57110 → 8081 [PSH, ACK] Seq=1837 Ack=1837 Win=64256 Len=17 TSval=1682171461 TSecr=3806431169
1712184320.721868753   942 0.678072725    10.10.1.1 → 10.10.1.2    TCP 83 8081 → 57110 [PSH, ACK] Seq=1837 Ack=1854 Win=65152 Len=17 TSval=3806431170 TSecr=1682171461
1712184326.721868753   948 0.679283021    10.10.1.2 → 10.10.1.1    TCP 83 57110 → 8081 [PSH, ACK] Seq=1854 Ack=1854 Win=64256 Len=17 TSval=1682171462 TSecr=3806431170
1712184328.721868753   950 0.679363045    10.10.1.1 → 10.10.1.2    TCP 83 8081 → 57110 [PSH, ACK] Seq=1854 Ack=1871 Win=65152 Len=17 TSval=3806431172 TSecr=1682171462
1712184334.721868753   956 0.680573883    10.10.1.2 → 10.10.1.1    TCP 83 57110 → 8081 [PSH, ACK] Seq=1871 Ack=1871 Win=64256 Len=17 TSval=1682171464 TSecr=3806431172
1712184336.721868753   958 0.680650602    10.10.1.1 → 10.10.1.2    TCP 83 8081 → 57110 [PSH, ACK] Seq=1871 Ack=1888 Win=65152 Len=17 TSval=3806431173 TSecr=1682171464
1712184342.721868753   964 0.681883435    10.10.1.2 → 10.10.1.1    TCP 83 57110 → 8081 [PSH, ACK] Seq=1888 Ack=1888 Win=64256 Len=17 TSval=1682171465 TSecr=3806431173
1712184344.721868753   966 0.681966266    10.10.1.1 → 10.10.1.2    TCP 83 8081 → 57110 [PSH, ACK] Seq=1888 Ack=1905 Win=65152 Len=17 TSval=3806431174 TSecr=1682171465
1712184350.721868753   972 0.683177431    10.10.1.2 → 10.10.1.1    TCP 83 57110 → 8081 [PSH, ACK] Seq=1905 Ack=1905 Win=64256 Len=17 TSval=1682171466 TSecr=3806431174
1712184352.721868753   974 0.683257375    10.10.1.1 → 10.10.1.2    TCP 83 8081 → 57110 [PSH, ACK] Seq=1905 Ack=1922 Win=65152 Len=17 TSval=3806431176 TSecr=1682171466
1712184359.721868753   981 0.684467493    10.10.1.2 → 10.10.1.1    TCP 83 57110 → 8081 [PSH, ACK] Seq=1922 Ack=1922 Win=64256 Len=17 TSval=1682171468 TSecr=3806431176
1712184361.721868753   983 0.684599796    10.10.1.1 → 10.10.1.2    TCP 83 8081 → 57110 [PSH, ACK] Seq=1922 Ack=1939 Win=65152 Len=17 TSval=3806431177 TSecr=1682171468
1712184367.721868753   989 0.685763572    10.10.1.2 → 10.10.1.1    TCP 83 57110 → 8081 [PSH, ACK] Seq=1939 Ack=1939 Win=64256 Len=17 TSval=1682171469 TSecr=3806431177
1712184369.721868753   991 0.685807092    10.10.1.1 → 10.10.1.2    TCP 83 8081 → 57110 [PSH, ACK] Seq=1939 Ack=1956 Win=65152 Len=17 TSval=3806431178 TSecr=1682171469
1712184375.721868753   997 0.687015348    10.10.1.2 → 10.10.1.1    TCP 83 57110 → 8081 [PSH, ACK] Seq=1956 Ack=1956 Win=64256 Len=17 TSval=1682171470 TSecr=3806431178
1712184377.721868753   999 0.687095469    10.10.1.1 → 10.10.1.2    TCP 83 8081 → 57110 [PSH, ACK] Seq=1956 Ack=1973 Win=65152 Len=17 TSval=3806431179 TSecr=1682171470
1712184384.721868753  1006 0.688304705    10.10.1.2 → 10.10.1.1    TCP 83 57110 → 8081 [PSH, ACK] Seq=1973 Ack=1973 Win=64256 Len=17 TSval=1682171471 TSecr=3806431179
1712184386.721868753  1008 0.688382102    10.10.1.1 → 10.10.1.2    TCP 83 8081 → 57110 [PSH, ACK] Seq=1973 Ack=1990 Win=65152 Len=17 TSval=3806431181 TSecr=1682171471
1712184392.721868753  1014 0.689546290    10.10.1.2 → 10.10.1.1    TCP 83 57110 → 8081 [PSH, ACK] Seq=1990 Ack=1990 Win=64256 Len=17 TSval=1682171473 TSecr=3806431181
1712184393.721868753  1015 0.689590585    10.10.1.1 → 10.10.1.2    TCP 83 8081 → 57110 [PSH, ACK] Seq=1990 Ack=2007 Win=65152 Len=17 TSval=3806431182 TSecr=1682171473
1712184400.721868753  1022 0.690798855    10.10.1.2 → 10.10.1.1    TCP 83 57110 → 8081 [PSH, ACK] Seq=2007 Ack=2007 Win=64256 Len=17 TSval=1682171474 TSecr=3806431182
1712184402.721868753  1024 0.690876063    10.10.1.1 → 10.10.1.2    TCP 83 8081 → 57110 [PSH, ACK] Seq=2007 Ack=2024 Win=65152 Len=17 TSval=3806431183 TSecr=1682171474
1712184409.721868753  1031 0.692084764    10.10.1.2 → 10.10.1.1    TCP 83 57110 → 8081 [PSH, ACK] Seq=2024 Ack=2024 Win=64256 Len=17 TSval=1682171475 TSecr=3806431183
1712184411.721868753  1033 0.692161555    10.10.1.1 → 10.10.1.2    TCP 83 8081 → 57110 [PSH, ACK] Seq=2024 Ack=2041 Win=65152 Len=17 TSval=3806431184 TSecr=1682171475
1712184417.721868753  1039 0.693337203    10.10.1.2 → 10.10.1.1    TCP 83 57110 → 8081 [PSH, ACK] Seq=2041 Ack=2041 Win=64256 Len=17 TSval=1682171476 TSecr=3806431184
