1711548235.300329208    22 0.262752906    10.10.1.2 → 10.10.1.1    TCP 74 57288 → 8081 [SYN] Seq=0 Win=64240 Len=0 MSS=1460 SACK_PERM=1 TSval=1047005612 TSecr=0 WS=128
1711548236.300329208    23 0.262788537    10.10.1.1 → 10.10.1.2    TCP 74 8081 → 57288 [SYN, ACK] Seq=0 Ack=1 Win=65160 Len=0 MSS=1460 SACK_PERM=1 TSval=3171265322 TSecr=1047005612 WS=128
1711548237.300329208    24 0.262822680    10.10.1.2 → 10.10.1.1    TCP 66 57288 → 8081 [ACK] Seq=1 Ack=1 Win=64256 Len=0 TSval=1047005612 TSecr=3171265322
1711548247.300329208    34 0.512105888    10.10.1.2 → 10.10.1.1    TCP 83 57288 → 8081 [PSH, ACK] Seq=1 Ack=1 Win=64256 Len=17 TSval=1047005861 TSecr=3171265322
1711548248.300329208    35 0.512117739    10.10.1.1 → 10.10.1.2    TCP 66 8081 → 57288 [ACK] Seq=1 Ack=18 Win=65152 Len=0 TSval=3171265572 TSecr=1047005861
1711548251.300329208    38 0.512300178    10.10.1.1 → 10.10.1.2    TCP 83 8081 → 57288 [PSH, ACK] Seq=1 Ack=18 Win=65152 Len=17 TSval=3171265572 TSecr=1047005861
1711548252.300329208    39 0.512330530    10.10.1.2 → 10.10.1.1    TCP 66 57288 → 8081 [ACK] Seq=18 Ack=18 Win=64256 Len=0 TSval=1047005861 TSecr=3171265572
1711548259.300329208    46 0.513465538    10.10.1.2 → 10.10.1.1    TCP 83 57288 → 8081 [PSH, ACK] Seq=18 Ack=18 Win=64256 Len=17 TSval=1047005862 TSecr=3171265572
1711548261.300329208    48 0.513500961    10.10.1.1 → 10.10.1.2    TCP 83 8081 → 57288 [PSH, ACK] Seq=18 Ack=35 Win=65152 Len=17 TSval=3171265573 TSecr=1047005862
1711548269.300329208    56 0.514664169    10.10.1.2 → 10.10.1.1    TCP 83 57288 → 8081 [PSH, ACK] Seq=35 Ack=35 Win=64256 Len=17 TSval=1047005864 TSecr=3171265573
1711548272.300329208    59 0.514701190    10.10.1.1 → 10.10.1.2    TCP 83 8081 → 57288 [PSH, ACK] Seq=35 Ack=52 Win=65152 Len=17 TSval=3171265574 TSecr=1047005864
1711548279.300329208    66 0.515862941    10.10.1.2 → 10.10.1.1    TCP 83 57288 → 8081 [PSH, ACK] Seq=52 Ack=52 Win=64256 Len=17 TSval=1047005865 TSecr=3171265574
1711548282.300329208    69 0.515894944    10.10.1.1 → 10.10.1.2    TCP 83 8081 → 57288 [PSH, ACK] Seq=52 Ack=69 Win=65152 Len=17 TSval=3171265575 TSecr=1047005865
1711548289.300329208    76 0.517052385    10.10.1.2 → 10.10.1.1    TCP 83 57288 → 8081 [PSH, ACK] Seq=69 Ack=69 Win=64256 Len=17 TSval=1047005866 TSecr=3171265575
1711548292.300329208    79 0.517083808    10.10.1.1 → 10.10.1.2    TCP 83 8081 → 57288 [PSH, ACK] Seq=69 Ack=86 Win=65152 Len=17 TSval=3171265576 TSecr=1047005866
1711548299.300329208    86 0.518243403    10.10.1.2 → 10.10.1.1    TCP 83 57288 → 8081 [PSH, ACK] Seq=86 Ack=86 Win=64256 Len=17 TSval=1047005867 TSecr=3171265576
1711548301.300329208    88 0.518279709    10.10.1.1 → 10.10.1.2    TCP 83 8081 → 57288 [PSH, ACK] Seq=86 Ack=103 Win=65152 Len=17 TSval=3171265578 TSecr=1047005867
1711548309.300329208    96 0.519443290    10.10.1.2 → 10.10.1.1    TCP 83 57288 → 8081 [PSH, ACK] Seq=103 Ack=103 Win=64256 Len=17 TSval=1047005868 TSecr=3171265578
1711548311.300329208    98 0.519474600    10.10.1.1 → 10.10.1.2    TCP 83 8081 → 57288 [PSH, ACK] Seq=103 Ack=120 Win=65152 Len=17 TSval=3171265579 TSecr=1047005868
1711548319.300329208   106 0.520635708    10.10.1.2 → 10.10.1.1    TCP 83 57288 → 8081 [PSH, ACK] Seq=120 Ack=120 Win=64256 Len=17 TSval=1047005870 TSecr=3171265579
1711548321.300329208   108 0.520667548    10.10.1.1 → 10.10.1.2    TCP 83 8081 → 57288 [PSH, ACK] Seq=120 Ack=137 Win=65152 Len=17 TSval=3171265580 TSecr=1047005870
1711548329.300329208   116 0.521824109    10.10.1.2 → 10.10.1.1    TCP 83 57288 → 8081 [PSH, ACK] Seq=137 Ack=137 Win=64256 Len=17 TSval=1047005871 TSecr=3171265580
1711548331.300329208   118 0.521855209    10.10.1.1 → 10.10.1.2    TCP 83 8081 → 57288 [PSH, ACK] Seq=137 Ack=154 Win=65152 Len=17 TSval=3171265581 TSecr=1047005871
1711548339.300329208   126 0.523014636    10.10.1.2 → 10.10.1.1    TCP 83 57288 → 8081 [PSH, ACK] Seq=154 Ack=154 Win=64256 Len=17 TSval=1047005872 TSecr=3171265581
1711548341.300329208   128 0.523050953    10.10.1.1 → 10.10.1.2    TCP 83 8081 → 57288 [PSH, ACK] Seq=154 Ack=171 Win=65152 Len=17 TSval=3171265582 TSecr=1047005872
1711548349.300329208   136 0.524212149    10.10.1.2 → 10.10.1.1    TCP 83 57288 → 8081 [PSH, ACK] Seq=171 Ack=171 Win=64256 Len=17 TSval=1047005873 TSecr=3171265582
1711548351.300329208   138 0.524241730    10.10.1.1 → 10.10.1.2    TCP 83 8081 → 57288 [PSH, ACK] Seq=171 Ack=188 Win=65152 Len=17 TSval=3171265584 TSecr=1047005873
1711548359.300329208   146 0.525398090    10.10.1.2 → 10.10.1.1    TCP 83 57288 → 8081 [PSH, ACK] Seq=188 Ack=188 Win=64256 Len=17 TSval=1047005874 TSecr=3171265584
1711548361.300329208   148 0.525427614    10.10.1.1 → 10.10.1.2    TCP 83 8081 → 57288 [PSH, ACK] Seq=188 Ack=205 Win=65152 Len=17 TSval=3171265585 TSecr=1047005874
1711548369.300329208   156 0.526585140    10.10.1.2 → 10.10.1.1    TCP 83 57288 → 8081 [PSH, ACK] Seq=205 Ack=205 Win=64256 Len=17 TSval=1047005876 TSecr=3171265585
1711548371.300329208   158 0.526621689    10.10.1.1 → 10.10.1.2    TCP 83 8081 → 57288 [PSH, ACK] Seq=205 Ack=222 Win=65152 Len=17 TSval=3171265586 TSecr=1047005876
1711548379.300329208   166 0.527781912    10.10.1.2 → 10.10.1.1    TCP 83 57288 → 8081 [PSH, ACK] Seq=222 Ack=222 Win=64256 Len=17 TSval=1047005877 TSecr=3171265586
1711548381.300329208   168 0.527813245    10.10.1.1 → 10.10.1.2    TCP 83 8081 → 57288 [PSH, ACK] Seq=222 Ack=239 Win=65152 Len=17 TSval=3171265587 TSecr=1047005877
1711548389.300329208   176 0.528969849    10.10.1.2 → 10.10.1.1    TCP 83 57288 → 8081 [PSH, ACK] Seq=239 Ack=239 Win=64256 Len=17 TSval=1047005878 TSecr=3171265587
1711548391.300329208   178 0.529001134    10.10.1.1 → 10.10.1.2    TCP 83 8081 → 57288 [PSH, ACK] Seq=239 Ack=256 Win=65152 Len=17 TSval=3171265588 TSecr=1047005878
1711548399.300329208   186 0.530158811    10.10.1.2 → 10.10.1.1    TCP 83 57288 → 8081 [PSH, ACK] Seq=256 Ack=256 Win=64256 Len=17 TSval=1047005879 TSecr=3171265588
1711548401.300329208   188 0.530194793    10.10.1.1 → 10.10.1.2    TCP 83 8081 → 57288 [PSH, ACK] Seq=256 Ack=273 Win=65152 Len=17 TSval=3171265590 TSecr=1047005879
1711548409.300329208   196 0.531353730    10.10.1.2 → 10.10.1.1    TCP 83 57288 → 8081 [PSH, ACK] Seq=273 Ack=273 Win=64256 Len=17 TSval=1047005880 TSecr=3171265590
1711548411.300329208   198 0.531385034    10.10.1.1 → 10.10.1.2    TCP 83 8081 → 57288 [PSH, ACK] Seq=273 Ack=290 Win=65152 Len=17 TSval=3171265591 TSecr=1047005880
1711548419.300329208   206 0.532546040    10.10.1.2 → 10.10.1.1    TCP 83 57288 → 8081 [PSH, ACK] Seq=290 Ack=290 Win=64256 Len=17 TSval=1047005882 TSecr=3171265591
1711548421.300329208   208 0.532575832    10.10.1.1 → 10.10.1.2    TCP 83 8081 → 57288 [PSH, ACK] Seq=290 Ack=307 Win=65152 Len=17 TSval=3171265592 TSecr=1047005882
1711548429.300329208   216 0.533732843    10.10.1.2 → 10.10.1.1    TCP 83 57288 → 8081 [PSH, ACK] Seq=307 Ack=307 Win=64256 Len=17 TSval=1047005883 TSecr=3171265592
1711548431.300329208   218 0.533762096    10.10.1.1 → 10.10.1.2    TCP 83 8081 → 57288 [PSH, ACK] Seq=307 Ack=324 Win=65152 Len=17 TSval=3171265593 TSecr=1047005883
1711548439.300329208   226 0.534921190    10.10.1.2 → 10.10.1.1    TCP 83 57288 → 8081 [PSH, ACK] Seq=324 Ack=324 Win=64256 Len=17 TSval=1047005884 TSecr=3171265593
1711548441.300329208   228 0.534956971    10.10.1.1 → 10.10.1.2    TCP 83 8081 → 57288 [PSH, ACK] Seq=324 Ack=341 Win=65152 Len=17 TSval=3171265594 TSecr=1047005884
1711548449.300329208   236 0.536118624    10.10.1.2 → 10.10.1.1    TCP 83 57288 → 8081 [PSH, ACK] Seq=341 Ack=341 Win=64256 Len=17 TSval=1047005885 TSecr=3171265594
1711548451.300329208   238 0.536150349    10.10.1.1 → 10.10.1.2    TCP 83 8081 → 57288 [PSH, ACK] Seq=341 Ack=358 Win=65152 Len=17 TSval=3171265596 TSecr=1047005885
1711548459.300329208   246 0.537307321    10.10.1.2 → 10.10.1.1    TCP 83 57288 → 8081 [PSH, ACK] Seq=358 Ack=358 Win=64256 Len=17 TSval=1047005886 TSecr=3171265596
1711548461.300329208   248 0.537338785    10.10.1.1 → 10.10.1.2    TCP 83 8081 → 57288 [PSH, ACK] Seq=358 Ack=375 Win=65152 Len=17 TSval=3171265597 TSecr=1047005886
1711548469.300329208   256 0.538490939    10.10.1.2 → 10.10.1.1    TCP 83 57288 → 8081 [PSH, ACK] Seq=375 Ack=375 Win=64256 Len=17 TSval=1047005888 TSecr=3171265597
1711548471.300329208   258 0.538526353    10.10.1.1 → 10.10.1.2    TCP 83 8081 → 57288 [PSH, ACK] Seq=375 Ack=392 Win=65152 Len=17 TSval=3171265598 TSecr=1047005888
1711548479.300329208   266 0.539687047    10.10.1.2 → 10.10.1.1    TCP 83 57288 → 8081 [PSH, ACK] Seq=392 Ack=392 Win=64256 Len=17 TSval=1047005889 TSecr=3171265598
1711548481.300329208   268 0.539718437    10.10.1.1 → 10.10.1.2    TCP 83 8081 → 57288 [PSH, ACK] Seq=392 Ack=409 Win=65152 Len=17 TSval=3171265599 TSecr=1047005889
1711548489.300329208   276 0.540874968    10.10.1.2 → 10.10.1.1    TCP 83 57288 → 8081 [PSH, ACK] Seq=409 Ack=409 Win=64256 Len=17 TSval=1047005890 TSecr=3171265599
1711548491.300329208   278 0.540906104    10.10.1.1 → 10.10.1.2    TCP 83 8081 → 57288 [PSH, ACK] Seq=409 Ack=426 Win=65152 Len=17 TSval=3171265600 TSecr=1047005890
1711548499.300329208   286 0.542063045    10.10.1.2 → 10.10.1.1    TCP 83 57288 → 8081 [PSH, ACK] Seq=426 Ack=426 Win=64256 Len=17 TSval=1047005891 TSecr=3171265600
1711548501.300329208   288 0.542094436    10.10.1.1 → 10.10.1.2    TCP 83 8081 → 57288 [PSH, ACK] Seq=426 Ack=443 Win=65152 Len=17 TSval=3171265601 TSecr=1047005891
1711548509.300329208   296 0.543252639    10.10.1.2 → 10.10.1.1    TCP 83 57288 → 8081 [PSH, ACK] Seq=443 Ack=443 Win=64256 Len=17 TSval=1047005892 TSecr=3171265601
1711548511.300329208   298 0.543287925    10.10.1.1 → 10.10.1.2    TCP 83 8081 → 57288 [PSH, ACK] Seq=443 Ack=460 Win=65152 Len=17 TSval=3171265603 TSecr=1047005892
1711548519.300329208   306 0.544447990    10.10.1.2 → 10.10.1.1    TCP 83 57288 → 8081 [PSH, ACK] Seq=460 Ack=460 Win=64256 Len=17 TSval=1047005893 TSecr=3171265603
1711548521.300329208   308 0.544479762    10.10.1.1 → 10.10.1.2    TCP 83 8081 → 57288 [PSH, ACK] Seq=460 Ack=477 Win=65152 Len=17 TSval=3171265604 TSecr=1047005893
1711548529.300329208   316 0.545635889    10.10.1.2 → 10.10.1.1    TCP 83 57288 → 8081 [PSH, ACK] Seq=477 Ack=477 Win=64256 Len=17 TSval=1047005895 TSecr=3171265604
1711548531.300329208   318 0.545666964    10.10.1.1 → 10.10.1.2    TCP 83 8081 → 57288 [PSH, ACK] Seq=477 Ack=494 Win=65152 Len=17 TSval=3171265605 TSecr=1047005895
1711548539.300329208   326 0.546824337    10.10.1.2 → 10.10.1.1    TCP 83 57288 → 8081 [PSH, ACK] Seq=494 Ack=494 Win=64256 Len=17 TSval=1047005896 TSecr=3171265605
1711548541.300329208   328 0.546862257    10.10.1.1 → 10.10.1.2    TCP 83 8081 → 57288 [PSH, ACK] Seq=494 Ack=511 Win=65152 Len=17 TSval=3171265606 TSecr=1047005896
1711548549.300329208   336 0.548022474    10.10.1.2 → 10.10.1.1    TCP 83 57288 → 8081 [PSH, ACK] Seq=511 Ack=511 Win=64256 Len=17 TSval=1047005897 TSecr=3171265606
1711548551.300329208   338 0.548053798    10.10.1.1 → 10.10.1.2    TCP 83 8081 → 57288 [PSH, ACK] Seq=511 Ack=528 Win=65152 Len=17 TSval=3171265607 TSecr=1047005897
1711548559.300329208   346 0.549211044    10.10.1.2 → 10.10.1.1    TCP 83 57288 → 8081 [PSH, ACK] Seq=528 Ack=528 Win=64256 Len=17 TSval=1047005898 TSecr=3171265607
1711548561.300329208   348 0.549242586    10.10.1.1 → 10.10.1.2    TCP 83 8081 → 57288 [PSH, ACK] Seq=528 Ack=545 Win=65152 Len=17 TSval=3171265609 TSecr=1047005898
1711548569.300329208   356 0.550399176    10.10.1.2 → 10.10.1.1    TCP 83 57288 → 8081 [PSH, ACK] Seq=545 Ack=545 Win=64256 Len=17 TSval=1047005899 TSecr=3171265609
1711548571.300329208   358 0.550435410    10.10.1.1 → 10.10.1.2    TCP 83 8081 → 57288 [PSH, ACK] Seq=545 Ack=562 Win=65152 Len=17 TSval=3171265610 TSecr=1047005899
1711548579.300329208   366 0.551592465    10.10.1.2 → 10.10.1.1    TCP 83 57288 → 8081 [PSH, ACK] Seq=562 Ack=562 Win=64256 Len=17 TSval=1047005901 TSecr=3171265610
1711548581.300329208   368 0.551621758    10.10.1.1 → 10.10.1.2    TCP 83 8081 → 57288 [PSH, ACK] Seq=562 Ack=579 Win=65152 Len=17 TSval=3171265611 TSecr=1047005901
1711548589.300329208   376 0.552780617    10.10.1.2 → 10.10.1.1    TCP 83 57288 → 8081 [PSH, ACK] Seq=579 Ack=579 Win=64256 Len=17 TSval=1047005902 TSecr=3171265611
1711548591.300329208   378 0.552809713    10.10.1.1 → 10.10.1.2    TCP 83 8081 → 57288 [PSH, ACK] Seq=579 Ack=596 Win=65152 Len=17 TSval=3171265612 TSecr=1047005902
1711548599.300329208   386 0.553965985    10.10.1.2 → 10.10.1.1    TCP 83 57288 → 8081 [PSH, ACK] Seq=596 Ack=596 Win=64256 Len=17 TSval=1047005903 TSecr=3171265612
1711548601.300329208   388 0.553995469    10.10.1.1 → 10.10.1.2    TCP 83 8081 → 57288 [PSH, ACK] Seq=596 Ack=613 Win=65152 Len=17 TSval=3171265613 TSecr=1047005903
1711548609.300329208   396 0.555151943    10.10.1.2 → 10.10.1.1    TCP 83 57288 → 8081 [PSH, ACK] Seq=613 Ack=613 Win=64256 Len=17 TSval=1047005904 TSecr=3171265613
1711548611.300329208   398 0.555188923    10.10.1.1 → 10.10.1.2    TCP 83 8081 → 57288 [PSH, ACK] Seq=613 Ack=630 Win=65152 Len=17 TSval=3171265615 TSecr=1047005904
1711548619.300329208   406 0.556350544    10.10.1.2 → 10.10.1.1    TCP 83 57288 → 8081 [PSH, ACK] Seq=630 Ack=630 Win=64256 Len=17 TSval=1047005905 TSecr=3171265615
1711548621.300329208   408 0.556381805    10.10.1.1 → 10.10.1.2    TCP 83 8081 → 57288 [PSH, ACK] Seq=630 Ack=647 Win=65152 Len=17 TSval=3171265616 TSecr=1047005905
1711548629.300329208   416 0.557538502    10.10.1.2 → 10.10.1.1    TCP 83 57288 → 8081 [PSH, ACK] Seq=647 Ack=647 Win=64256 Len=17 TSval=1047005907 TSecr=3171265616
1711548631.300329208   418 0.557569779    10.10.1.1 → 10.10.1.2    TCP 83 8081 → 57288 [PSH, ACK] Seq=647 Ack=664 Win=65152 Len=17 TSval=3171265617 TSecr=1047005907
1711548639.300329208   426 0.558727431    10.10.1.2 → 10.10.1.1    TCP 83 57288 → 8081 [PSH, ACK] Seq=664 Ack=664 Win=64256 Len=17 TSval=1047005908 TSecr=3171265617
1711548641.300329208   428 0.558763310    10.10.1.1 → 10.10.1.2    TCP 83 8081 → 57288 [PSH, ACK] Seq=664 Ack=681 Win=65152 Len=17 TSval=3171265618 TSecr=1047005908
1711548649.300329208   436 0.559922927    10.10.1.2 → 10.10.1.1    TCP 83 57288 → 8081 [PSH, ACK] Seq=681 Ack=681 Win=64256 Len=17 TSval=1047005909 TSecr=3171265618
1711548651.300329208   438 0.559953934    10.10.1.1 → 10.10.1.2    TCP 83 8081 → 57288 [PSH, ACK] Seq=681 Ack=698 Win=65152 Len=17 TSval=3171265619 TSecr=1047005909
1711548659.300329208   446 0.561110173    10.10.1.2 → 10.10.1.1    TCP 83 57288 → 8081 [PSH, ACK] Seq=698 Ack=698 Win=64256 Len=17 TSval=1047005910 TSecr=3171265619
1711548661.300329208   448 0.561141177    10.10.1.1 → 10.10.1.2    TCP 83 8081 → 57288 [PSH, ACK] Seq=698 Ack=715 Win=65152 Len=17 TSval=3171265621 TSecr=1047005910
1711548669.300329208   456 0.562297747    10.10.1.2 → 10.10.1.1    TCP 83 57288 → 8081 [PSH, ACK] Seq=715 Ack=715 Win=64256 Len=17 TSval=1047005911 TSecr=3171265621
1711548671.300329208   458 0.562334698    10.10.1.1 → 10.10.1.2    TCP 83 8081 → 57288 [PSH, ACK] Seq=715 Ack=732 Win=65152 Len=17 TSval=3171265622 TSecr=1047005911
1711548679.300329208   466 0.563448168    10.10.1.2 → 10.10.1.1    TCP 83 57288 → 8081 [PSH, ACK] Seq=732 Ack=732 Win=64256 Len=17 TSval=1047005912 TSecr=3171265622
1711548681.300329208   468 0.563479429    10.10.1.1 → 10.10.1.2    TCP 83 8081 → 57288 [PSH, ACK] Seq=732 Ack=749 Win=65152 Len=17 TSval=3171265623 TSecr=1047005912
1711548689.300329208   476 0.564639105    10.10.1.2 → 10.10.1.1    TCP 83 57288 → 8081 [PSH, ACK] Seq=749 Ack=749 Win=64256 Len=17 TSval=1047005914 TSecr=3171265623
1711548691.300329208   478 0.564670166    10.10.1.1 → 10.10.1.2    TCP 83 8081 → 57288 [PSH, ACK] Seq=749 Ack=766 Win=65152 Len=17 TSval=3171265624 TSecr=1047005914
1711548699.300329208   486 0.565826559    10.10.1.2 → 10.10.1.1    TCP 83 57288 → 8081 [PSH, ACK] Seq=766 Ack=766 Win=64256 Len=17 TSval=1047005915 TSecr=3171265624
1711548701.300329208   488 0.565855789    10.10.1.1 → 10.10.1.2    TCP 83 8081 → 57288 [PSH, ACK] Seq=766 Ack=783 Win=65152 Len=17 TSval=3171265625 TSecr=1047005915
1711548709.300329208   496 0.567012825    10.10.1.2 → 10.10.1.1    TCP 83 57288 → 8081 [PSH, ACK] Seq=783 Ack=783 Win=64256 Len=17 TSval=1047005916 TSecr=3171265625
1711548711.300329208   498 0.567050344    10.10.1.1 → 10.10.1.2    TCP 83 8081 → 57288 [PSH, ACK] Seq=783 Ack=800 Win=65152 Len=17 TSval=3171265626 TSecr=1047005916
1711548719.300329208   506 0.568210714    10.10.1.2 → 10.10.1.1    TCP 83 57288 → 8081 [PSH, ACK] Seq=800 Ack=800 Win=64256 Len=17 TSval=1047005917 TSecr=3171265626
1711548721.300329208   508 0.568241805    10.10.1.1 → 10.10.1.2    TCP 83 8081 → 57288 [PSH, ACK] Seq=800 Ack=817 Win=65152 Len=17 TSval=3171265628 TSecr=1047005917
1711548729.300329208   516 0.569398820    10.10.1.2 → 10.10.1.1    TCP 83 57288 → 8081 [PSH, ACK] Seq=817 Ack=817 Win=64256 Len=17 TSval=1047005918 TSecr=3171265628
1711548731.300329208   518 0.569430095    10.10.1.1 → 10.10.1.2    TCP 83 8081 → 57288 [PSH, ACK] Seq=817 Ack=834 Win=65152 Len=17 TSval=3171265629 TSecr=1047005918
1711548739.300329208   526 0.570587269    10.10.1.2 → 10.10.1.1    TCP 83 57288 → 8081 [PSH, ACK] Seq=834 Ack=834 Win=64256 Len=17 TSval=1047005920 TSecr=3171265629
1711548741.300329208   528 0.570622956    10.10.1.1 → 10.10.1.2    TCP 83 8081 → 57288 [PSH, ACK] Seq=834 Ack=851 Win=65152 Len=17 TSval=3171265630 TSecr=1047005920
1711548749.300329208   536 0.571782781    10.10.1.2 → 10.10.1.1    TCP 83 57288 → 8081 [PSH, ACK] Seq=851 Ack=851 Win=64256 Len=17 TSval=1047005921 TSecr=3171265630
1711548751.300329208   538 0.571813837    10.10.1.1 → 10.10.1.2    TCP 83 8081 → 57288 [PSH, ACK] Seq=851 Ack=868 Win=65152 Len=17 TSval=3171265631 TSecr=1047005921
1711548759.300329208   546 0.572970724    10.10.1.2 → 10.10.1.1    TCP 83 57288 → 8081 [PSH, ACK] Seq=868 Ack=868 Win=64256 Len=17 TSval=1047005922 TSecr=3171265631
1711548761.300329208   548 0.573002071    10.10.1.1 → 10.10.1.2    TCP 83 8081 → 57288 [PSH, ACK] Seq=868 Ack=885 Win=65152 Len=17 TSval=3171265632 TSecr=1047005922
1711548769.300329208   556 0.574157690    10.10.1.2 → 10.10.1.1    TCP 83 57288 → 8081 [PSH, ACK] Seq=885 Ack=885 Win=64256 Len=17 TSval=1047005923 TSecr=3171265632
1711548771.300329208   558 0.574193146    10.10.1.1 → 10.10.1.2    TCP 83 8081 → 57288 [PSH, ACK] Seq=885 Ack=902 Win=65152 Len=17 TSval=3171265634 TSecr=1047005923
1711548779.300329208   566 0.575351008    10.10.1.2 → 10.10.1.1    TCP 83 57288 → 8081 [PSH, ACK] Seq=902 Ack=902 Win=64256 Len=17 TSval=1047005924 TSecr=3171265634
1711548781.300329208   568 0.575380315    10.10.1.1 → 10.10.1.2    TCP 83 8081 → 57288 [PSH, ACK] Seq=902 Ack=919 Win=65152 Len=17 TSval=3171265635 TSecr=1047005924
1711548789.300329208   576 0.576540456    10.10.1.2 → 10.10.1.1    TCP 83 57288 → 8081 [PSH, ACK] Seq=919 Ack=919 Win=64256 Len=17 TSval=1047005926 TSecr=3171265635
1711548791.300329208   578 0.576569880    10.10.1.1 → 10.10.1.2    TCP 83 8081 → 57288 [PSH, ACK] Seq=919 Ack=936 Win=65152 Len=17 TSval=3171265636 TSecr=1047005926
1711548799.300329208   586 0.577725809    10.10.1.2 → 10.10.1.1    TCP 83 57288 → 8081 [PSH, ACK] Seq=936 Ack=936 Win=64256 Len=17 TSval=1047005927 TSecr=3171265636
1711548801.300329208   588 0.577755064    10.10.1.1 → 10.10.1.2    TCP 83 8081 → 57288 [PSH, ACK] Seq=936 Ack=953 Win=65152 Len=17 TSval=3171265637 TSecr=1047005927
1711548809.300329208   596 0.578911507    10.10.1.2 → 10.10.1.1    TCP 83 57288 → 8081 [PSH, ACK] Seq=953 Ack=953 Win=64256 Len=17 TSval=1047005928 TSecr=3171265637
1711548812.300329208   599 0.578982801    10.10.1.1 → 10.10.1.2    TCP 83 8081 → 57288 [PSH, ACK] Seq=953 Ack=970 Win=65152 Len=17 TSval=3171265638 TSecr=1047005928
1711548819.300329208   606 0.580143319    10.10.1.2 → 10.10.1.1    TCP 83 57288 → 8081 [PSH, ACK] Seq=970 Ack=970 Win=64256 Len=17 TSval=1047005929 TSecr=3171265638
1711548821.300329208   608 0.580175484    10.10.1.1 → 10.10.1.2    TCP 83 8081 → 57288 [PSH, ACK] Seq=970 Ack=987 Win=65152 Len=17 TSval=3171265640 TSecr=1047005929
1711548829.300329208   616 0.581332696    10.10.1.2 → 10.10.1.1    TCP 83 57288 → 8081 [PSH, ACK] Seq=987 Ack=987 Win=64256 Len=17 TSval=1047005930 TSecr=3171265640
1711548831.300329208   618 0.581364550    10.10.1.1 → 10.10.1.2    TCP 83 8081 → 57288 [PSH, ACK] Seq=987 Ack=1004 Win=65152 Len=17 TSval=3171265641 TSecr=1047005930
1711548839.300329208   626 0.582491104    10.10.1.2 → 10.10.1.1    TCP 83 57288 → 8081 [PSH, ACK] Seq=1004 Ack=1004 Win=64256 Len=17 TSval=1047005932 TSecr=3171265641
1711548841.300329208   628 0.582527327    10.10.1.1 → 10.10.1.2    TCP 83 8081 → 57288 [PSH, ACK] Seq=1004 Ack=1021 Win=65152 Len=17 TSval=3171265642 TSecr=1047005932
1711548849.300329208   636 0.583686977    10.10.1.2 → 10.10.1.1    TCP 83 57288 → 8081 [PSH, ACK] Seq=1021 Ack=1021 Win=64256 Len=17 TSval=1047005933 TSecr=3171265642
1711548851.300329208   638 0.583718308    10.10.1.1 → 10.10.1.2    TCP 83 8081 → 57288 [PSH, ACK] Seq=1021 Ack=1038 Win=65152 Len=17 TSval=3171265643 TSecr=1047005933
1711548859.300329208   646 0.584874902    10.10.1.2 → 10.10.1.1    TCP 83 57288 → 8081 [PSH, ACK] Seq=1038 Ack=1038 Win=64256 Len=17 TSval=1047005934 TSecr=3171265643
1711548861.300329208   648 0.584906169    10.10.1.1 → 10.10.1.2    TCP 83 8081 → 57288 [PSH, ACK] Seq=1038 Ack=1055 Win=65152 Len=17 TSval=3171265644 TSecr=1047005934
1711548869.300329208   656 0.586062282    10.10.1.2 → 10.10.1.1    TCP 83 57288 → 8081 [PSH, ACK] Seq=1055 Ack=1055 Win=64256 Len=17 TSval=1047005935 TSecr=3171265644
1711548871.300329208   658 0.586091830    10.10.1.1 → 10.10.1.2    TCP 83 8081 → 57288 [PSH, ACK] Seq=1055 Ack=1072 Win=65152 Len=17 TSval=3171265645 TSecr=1047005935
1711548879.300329208   666 0.587248562    10.10.1.2 → 10.10.1.1    TCP 83 57288 → 8081 [PSH, ACK] Seq=1072 Ack=1072 Win=64256 Len=17 TSval=1047005936 TSecr=3171265645
1711548881.300329208   668 0.587284148    10.10.1.1 → 10.10.1.2    TCP 83 8081 → 57288 [PSH, ACK] Seq=1072 Ack=1089 Win=65152 Len=17 TSval=3171265647 TSecr=1047005936
1711548889.300329208   676 0.588443155    10.10.1.2 → 10.10.1.1    TCP 83 57288 → 8081 [PSH, ACK] Seq=1089 Ack=1089 Win=64256 Len=17 TSval=1047005937 TSecr=3171265647
1711548891.300329208   678 0.588474391    10.10.1.1 → 10.10.1.2    TCP 83 8081 → 57288 [PSH, ACK] Seq=1089 Ack=1106 Win=65152 Len=17 TSval=3171265648 TSecr=1047005937
1711548899.300329208   686 0.589630708    10.10.1.2 → 10.10.1.1    TCP 83 57288 → 8081 [PSH, ACK] Seq=1106 Ack=1106 Win=64256 Len=17 TSval=1047005939 TSecr=3171265648
1711548901.300329208   688 0.589662173    10.10.1.1 → 10.10.1.2    TCP 83 8081 → 57288 [PSH, ACK] Seq=1106 Ack=1123 Win=65152 Len=17 TSval=3171265649 TSecr=1047005939
1711548909.300329208   696 0.590819235    10.10.1.2 → 10.10.1.1    TCP 83 57288 → 8081 [PSH, ACK] Seq=1123 Ack=1123 Win=64256 Len=17 TSval=1047005940 TSecr=3171265649
1711548911.300329208   698 0.590855600    10.10.1.1 → 10.10.1.2    TCP 83 8081 → 57288 [PSH, ACK] Seq=1123 Ack=1140 Win=65152 Len=17 TSval=3171265650 TSecr=1047005940
1711548919.300329208   706 0.592016217    10.10.1.2 → 10.10.1.1    TCP 83 57288 → 8081 [PSH, ACK] Seq=1140 Ack=1140 Win=64256 Len=17 TSval=1047005941 TSecr=3171265650
1711548921.300329208   708 0.592047443    10.10.1.1 → 10.10.1.2    TCP 83 8081 → 57288 [PSH, ACK] Seq=1140 Ack=1157 Win=65152 Len=17 TSval=3171265651 TSecr=1047005941
1711548929.300329208   716 0.593203584    10.10.1.2 → 10.10.1.1    TCP 83 57288 → 8081 [PSH, ACK] Seq=1157 Ack=1157 Win=64256 Len=17 TSval=1047005942 TSecr=3171265651
1711548931.300329208   718 0.593234960    10.10.1.1 → 10.10.1.2    TCP 83 8081 → 57288 [PSH, ACK] Seq=1157 Ack=1174 Win=65152 Len=17 TSval=3171265653 TSecr=1047005942
1711548939.300329208   726 0.594393341    10.10.1.2 → 10.10.1.1    TCP 83 57288 → 8081 [PSH, ACK] Seq=1174 Ack=1174 Win=64256 Len=17 TSval=1047005943 TSecr=3171265653
1711548941.300329208   728 0.594429181    10.10.1.1 → 10.10.1.2    TCP 83 8081 → 57288 [PSH, ACK] Seq=1174 Ack=1191 Win=65152 Len=17 TSval=3171265654 TSecr=1047005943
1711548949.300329208   736 0.595587029    10.10.1.2 → 10.10.1.1    TCP 83 57288 → 8081 [PSH, ACK] Seq=1191 Ack=1191 Win=64256 Len=17 TSval=1047005945 TSecr=3171265654
1711548951.300329208   738 0.595618462    10.10.1.1 → 10.10.1.2    TCP 83 8081 → 57288 [PSH, ACK] Seq=1191 Ack=1208 Win=65152 Len=17 TSval=3171265655 TSecr=1047005945
1711548959.300329208   746 0.596776759    10.10.1.2 → 10.10.1.1    TCP 83 57288 → 8081 [PSH, ACK] Seq=1208 Ack=1208 Win=64256 Len=17 TSval=1047005946 TSecr=3171265655
1711548961.300329208   748 0.596808079    10.10.1.1 → 10.10.1.2    TCP 83 8081 → 57288 [PSH, ACK] Seq=1208 Ack=1225 Win=65152 Len=17 TSval=3171265656 TSecr=1047005946
1711548969.300329208   756 0.597963900    10.10.1.2 → 10.10.1.1    TCP 83 57288 → 8081 [PSH, ACK] Seq=1225 Ack=1225 Win=64256 Len=17 TSval=1047005947 TSecr=3171265656
1711548971.300329208   758 0.597995490    10.10.1.1 → 10.10.1.2    TCP 83 8081 → 57288 [PSH, ACK] Seq=1225 Ack=1242 Win=65152 Len=17 TSval=3171265657 TSecr=1047005947
1711548979.300329208   766 0.599152647    10.10.1.2 → 10.10.1.1    TCP 83 57288 → 8081 [PSH, ACK] Seq=1242 Ack=1242 Win=64256 Len=17 TSval=1047005948 TSecr=3171265657
1711548981.300329208   768 0.599188432    10.10.1.1 → 10.10.1.2    TCP 83 8081 → 57288 [PSH, ACK] Seq=1242 Ack=1259 Win=65152 Len=17 TSval=3171265659 TSecr=1047005948
1711548989.300329208   776 0.600348621    10.10.1.2 → 10.10.1.1    TCP 83 57288 → 8081 [PSH, ACK] Seq=1259 Ack=1259 Win=64256 Len=17 TSval=1047005949 TSecr=3171265659
1711548991.300329208   778 0.600380341    10.10.1.1 → 10.10.1.2    TCP 83 8081 → 57288 [PSH, ACK] Seq=1259 Ack=1276 Win=65152 Len=17 TSval=3171265660 TSecr=1047005949
1711548999.300329208   786 0.601536832    10.10.1.2 → 10.10.1.1    TCP 83 57288 → 8081 [PSH, ACK] Seq=1276 Ack=1276 Win=64256 Len=17 TSval=1047005951 TSecr=3171265660
1711549001.300329208   788 0.601568577    10.10.1.1 → 10.10.1.2    TCP 83 8081 → 57288 [PSH, ACK] Seq=1276 Ack=1293 Win=65152 Len=17 TSval=3171265661 TSecr=1047005951
1711549009.300329208   796 0.602726239    10.10.1.2 → 10.10.1.1    TCP 83 57288 → 8081 [PSH, ACK] Seq=1293 Ack=1293 Win=64256 Len=17 TSval=1047005952 TSecr=3171265661
1711549011.300329208   798 0.602762476    10.10.1.1 → 10.10.1.2    TCP 83 8081 → 57288 [PSH, ACK] Seq=1293 Ack=1310 Win=65152 Len=17 TSval=3171265662 TSecr=1047005952
1711549019.300329208   806 0.603924147    10.10.1.2 → 10.10.1.1    TCP 83 57288 → 8081 [PSH, ACK] Seq=1310 Ack=1310 Win=64256 Len=17 TSval=1047005953 TSecr=3171265662
1711549021.300329208   808 0.603955766    10.10.1.1 → 10.10.1.2    TCP 83 8081 → 57288 [PSH, ACK] Seq=1310 Ack=1327 Win=65152 Len=17 TSval=3171265663 TSecr=1047005953
1711549029.300329208   816 0.605111945    10.10.1.2 → 10.10.1.1    TCP 83 57288 → 8081 [PSH, ACK] Seq=1327 Ack=1327 Win=64256 Len=17 TSval=1047005954 TSecr=3171265663
1711549031.300329208   818 0.605143359    10.10.1.1 → 10.10.1.2    TCP 83 8081 → 57288 [PSH, ACK] Seq=1327 Ack=1344 Win=65152 Len=17 TSval=3171265665 TSecr=1047005954
1711549039.300329208   826 0.606300222    10.10.1.2 → 10.10.1.1    TCP 83 57288 → 8081 [PSH, ACK] Seq=1344 Ack=1344 Win=64256 Len=17 TSval=1047005955 TSecr=3171265665
1711549041.300329208   828 0.606336612    10.10.1.1 → 10.10.1.2    TCP 83 8081 → 57288 [PSH, ACK] Seq=1344 Ack=1361 Win=65152 Len=17 TSval=3171265666 TSecr=1047005955
1711549049.300329208   836 0.607447999    10.10.1.2 → 10.10.1.1    TCP 83 57288 → 8081 [PSH, ACK] Seq=1361 Ack=1361 Win=64256 Len=17 TSval=1047005956 TSecr=3171265666
1711549051.300329208   838 0.607479189    10.10.1.1 → 10.10.1.2    TCP 83 8081 → 57288 [PSH, ACK] Seq=1361 Ack=1378 Win=65152 Len=17 TSval=3171265667 TSecr=1047005956
1711549059.300329208   846 0.608639230    10.10.1.2 → 10.10.1.1    TCP 83 57288 → 8081 [PSH, ACK] Seq=1378 Ack=1378 Win=64256 Len=17 TSval=1047005958 TSecr=3171265667
1711549061.300329208   848 0.608670750    10.10.1.1 → 10.10.1.2    TCP 83 8081 → 57288 [PSH, ACK] Seq=1378 Ack=1395 Win=65152 Len=17 TSval=3171265668 TSecr=1047005958
1711549069.300329208   856 0.609827348    10.10.1.2 → 10.10.1.1    TCP 83 57288 → 8081 [PSH, ACK] Seq=1395 Ack=1395 Win=64256 Len=17 TSval=1047005959 TSecr=3171265668
1711549071.300329208   858 0.609858647    10.10.1.1 → 10.10.1.2    TCP 83 8081 → 57288 [PSH, ACK] Seq=1395 Ack=1412 Win=65152 Len=17 TSval=3171265669 TSecr=1047005959
1711549079.300329208   866 0.611016052    10.10.1.2 → 10.10.1.1    TCP 83 57288 → 8081 [PSH, ACK] Seq=1412 Ack=1412 Win=64256 Len=17 TSval=1047005960 TSecr=3171265669
1711549081.300329208   868 0.611052030    10.10.1.1 → 10.10.1.2    TCP 83 8081 → 57288 [PSH, ACK] Seq=1412 Ack=1429 Win=65152 Len=17 TSval=3171265670 TSecr=1047005960
1711549089.300329208   876 0.612211858    10.10.1.2 → 10.10.1.1    TCP 83 57288 → 8081 [PSH, ACK] Seq=1429 Ack=1429 Win=64256 Len=17 TSval=1047005961 TSecr=3171265670
1711549091.300329208   878 0.612243715    10.10.1.1 → 10.10.1.2    TCP 83 8081 → 57288 [PSH, ACK] Seq=1429 Ack=1446 Win=65152 Len=17 TSval=3171265672 TSecr=1047005961
1711549099.300329208   886 0.613400007    10.10.1.2 → 10.10.1.1    TCP 83 57288 → 8081 [PSH, ACK] Seq=1446 Ack=1446 Win=64256 Len=17 TSval=1047005962 TSecr=3171265672
1711549101.300329208   888 0.613431041    10.10.1.1 → 10.10.1.2    TCP 83 8081 → 57288 [PSH, ACK] Seq=1446 Ack=1463 Win=65152 Len=17 TSval=3171265673 TSecr=1047005962
1711549109.300329208   896 0.614588263    10.10.1.2 → 10.10.1.1    TCP 83 57288 → 8081 [PSH, ACK] Seq=1463 Ack=1463 Win=64256 Len=17 TSval=1047005964 TSecr=3171265673
1711549111.300329208   898 0.614624843    10.10.1.1 → 10.10.1.2    TCP 83 8081 → 57288 [PSH, ACK] Seq=1463 Ack=1480 Win=65152 Len=17 TSval=3171265674 TSecr=1047005964
1711549119.300329208   906 0.615785155    10.10.1.2 → 10.10.1.1    TCP 83 57288 → 8081 [PSH, ACK] Seq=1480 Ack=1480 Win=64256 Len=17 TSval=1047005965 TSecr=3171265674
1711549121.300329208   908 0.615816431    10.10.1.1 → 10.10.1.2    TCP 83 8081 → 57288 [PSH, ACK] Seq=1480 Ack=1497 Win=65152 Len=17 TSval=3171265675 TSecr=1047005965
1711549129.300329208   916 0.616972832    10.10.1.2 → 10.10.1.1    TCP 83 57288 → 8081 [PSH, ACK] Seq=1497 Ack=1497 Win=64256 Len=17 TSval=1047005966 TSecr=3171265675
1711549131.300329208   918 0.617004156    10.10.1.1 → 10.10.1.2    TCP 83 8081 → 57288 [PSH, ACK] Seq=1497 Ack=1514 Win=65152 Len=17 TSval=3171265676 TSecr=1047005966
1711549139.300329208   926 0.618160735    10.10.1.2 → 10.10.1.1    TCP 83 57288 → 8081 [PSH, ACK] Seq=1514 Ack=1514 Win=64256 Len=17 TSval=1047005967 TSecr=3171265676
1711549141.300329208   928 0.618197002    10.10.1.1 → 10.10.1.2    TCP 83 8081 → 57288 [PSH, ACK] Seq=1514 Ack=1531 Win=65152 Len=17 TSval=3171265678 TSecr=1047005967
1711549149.300329208   936 0.619353998    10.10.1.2 → 10.10.1.1    TCP 83 57288 → 8081 [PSH, ACK] Seq=1531 Ack=1531 Win=64256 Len=17 TSval=1047005968 TSecr=3171265678
1711549151.300329208   938 0.619383712    10.10.1.1 → 10.10.1.2    TCP 83 8081 → 57288 [PSH, ACK] Seq=1531 Ack=1548 Win=65152 Len=17 TSval=3171265679 TSecr=1047005968
1711549159.300329208   946 0.620544295    10.10.1.2 → 10.10.1.1    TCP 83 57288 → 8081 [PSH, ACK] Seq=1548 Ack=1548 Win=64256 Len=17 TSval=1047005970 TSecr=3171265679
1711549161.300329208   948 0.620573688    10.10.1.1 → 10.10.1.2    TCP 83 8081 → 57288 [PSH, ACK] Seq=1548 Ack=1565 Win=65152 Len=17 TSval=3171265680 TSecr=1047005970
1711549169.300329208   956 0.621729754    10.10.1.2 → 10.10.1.1    TCP 83 57288 → 8081 [PSH, ACK] Seq=1565 Ack=1565 Win=64256 Len=17 TSval=1047005971 TSecr=3171265680
1711549171.300329208   958 0.621758935    10.10.1.1 → 10.10.1.2    TCP 83 8081 → 57288 [PSH, ACK] Seq=1565 Ack=1582 Win=65152 Len=17 TSval=3171265681 TSecr=1047005971
1711549179.300329208   966 0.622915860    10.10.1.2 → 10.10.1.1    TCP 83 57288 → 8081 [PSH, ACK] Seq=1582 Ack=1582 Win=64256 Len=17 TSval=1047005972 TSecr=3171265681
1711549181.300329208   968 0.622951605    10.10.1.1 → 10.10.1.2    TCP 83 8081 → 57288 [PSH, ACK] Seq=1582 Ack=1599 Win=65152 Len=17 TSval=3171265682 TSecr=1047005972
1711549189.300329208   976 0.624111809    10.10.1.2 → 10.10.1.1    TCP 83 57288 → 8081 [PSH, ACK] Seq=1599 Ack=1599 Win=64256 Len=17 TSval=1047005973 TSecr=3171265682
1711549191.300329208   978 0.624143518    10.10.1.1 → 10.10.1.2    TCP 83 8081 → 57288 [PSH, ACK] Seq=1599 Ack=1616 Win=65152 Len=17 TSval=3171265684 TSecr=1047005973
1711549199.300329208   986 0.625299794    10.10.1.2 → 10.10.1.1    TCP 83 57288 → 8081 [PSH, ACK] Seq=1616 Ack=1616 Win=64256 Len=17 TSval=1047005974 TSecr=3171265684
1711549201.300329208   988 0.625331041    10.10.1.1 → 10.10.1.2    TCP 83 8081 → 57288 [PSH, ACK] Seq=1616 Ack=1633 Win=65152 Len=17 TSval=3171265685 TSecr=1047005974
1711549209.300329208   996 0.626489442    10.10.1.2 → 10.10.1.1    TCP 83 57288 → 8081 [PSH, ACK] Seq=1633 Ack=1633 Win=64256 Len=17 TSval=1047005976 TSecr=3171265685
1711549211.300329208   998 0.626526252    10.10.1.1 → 10.10.1.2    TCP 83 8081 → 57288 [PSH, ACK] Seq=1633 Ack=1650 Win=65152 Len=17 TSval=3171265686 TSecr=1047005976
1711549219.300329208  1006 0.627686629    10.10.1.2 → 10.10.1.1    TCP 83 57288 → 8081 [PSH, ACK] Seq=1650 Ack=1650 Win=64256 Len=17 TSval=1047005977 TSecr=3171265686
1711549221.300329208  1008 0.627718086    10.10.1.1 → 10.10.1.2    TCP 83 8081 → 57288 [PSH, ACK] Seq=1650 Ack=1667 Win=65152 Len=17 TSval=3171265687 TSecr=1047005977
1711549229.300329208  1016 0.628874277    10.10.1.2 → 10.10.1.1    TCP 83 57288 → 8081 [PSH, ACK] Seq=1667 Ack=1667 Win=64256 Len=17 TSval=1047005978 TSecr=3171265687
1711549231.300329208  1018 0.628905767    10.10.1.1 → 10.10.1.2    TCP 83 8081 → 57288 [PSH, ACK] Seq=1667 Ack=1684 Win=65152 Len=17 TSval=3171265688 TSecr=1047005978
1711549239.300329208  1026 0.630062900    10.10.1.2 → 10.10.1.1    TCP 83 57288 → 8081 [PSH, ACK] Seq=1684 Ack=1684 Win=64256 Len=17 TSval=1047005979 TSecr=3171265688
1711549241.300329208  1028 0.630092300    10.10.1.1 → 10.10.1.2    TCP 83 8081 → 57288 [PSH, ACK] Seq=1684 Ack=1701 Win=65152 Len=17 TSval=3171265689 TSecr=1047005979
1711549249.300329208  1036 0.631249326    10.10.1.2 → 10.10.1.1    TCP 83 57288 → 8081 [PSH, ACK] Seq=1701 Ack=1701 Win=64256 Len=17 TSval=1047005980 TSecr=3171265689
1711549251.300329208  1038 0.631285565    10.10.1.1 → 10.10.1.2    TCP 83 8081 → 57288 [PSH, ACK] Seq=1701 Ack=1718 Win=65152 Len=17 TSval=3171265691 TSecr=1047005980
1711549259.300329208  1046 0.632445951    10.10.1.2 → 10.10.1.1    TCP 83 57288 → 8081 [PSH, ACK] Seq=1718 Ack=1718 Win=64256 Len=17 TSval=1047005981 TSecr=3171265691
1711549261.300329208  1048 0.632477200    10.10.1.1 → 10.10.1.2    TCP 83 8081 → 57288 [PSH, ACK] Seq=1718 Ack=1735 Win=65152 Len=17 TSval=3171265692 TSecr=1047005981
1711549269.300329208  1056 0.633633727    10.10.1.2 → 10.10.1.1    TCP 83 57288 → 8081 [PSH, ACK] Seq=1735 Ack=1735 Win=64256 Len=17 TSval=1047005983 TSecr=3171265692
1711549271.300329208  1058 0.633665120    10.10.1.1 → 10.10.1.2    TCP 83 8081 → 57288 [PSH, ACK] Seq=1735 Ack=1752 Win=65152 Len=17 TSval=3171265693 TSecr=1047005983
1711549279.300329208  1066 0.634822150    10.10.1.2 → 10.10.1.1    TCP 83 57288 → 8081 [PSH, ACK] Seq=1752 Ack=1752 Win=64256 Len=17 TSval=1047005984 TSecr=3171265693
1711549281.300329208  1068 0.634858600    10.10.1.1 → 10.10.1.2    TCP 83 8081 → 57288 [PSH, ACK] Seq=1752 Ack=1769 Win=65152 Len=17 TSval=3171265694 TSecr=1047005984
1711549289.300329208  1076 0.636018282    10.10.1.2 → 10.10.1.1    TCP 83 57288 → 8081 [PSH, ACK] Seq=1769 Ack=1769 Win=64256 Len=17 TSval=1047005985 TSecr=3171265694
1711549291.300329208  1078 0.636049938    10.10.1.1 → 10.10.1.2    TCP 83 8081 → 57288 [PSH, ACK] Seq=1769 Ack=1786 Win=65152 Len=17 TSval=3171265695 TSecr=1047005985
1711549299.300329208  1086 0.637206605    10.10.1.2 → 10.10.1.1    TCP 83 57288 → 8081 [PSH, ACK] Seq=1786 Ack=1786 Win=64256 Len=17 TSval=1047005986 TSecr=3171265695
1711549301.300329208  1088 0.637238155    10.10.1.1 → 10.10.1.2    TCP 83 8081 → 57288 [PSH, ACK] Seq=1786 Ack=1803 Win=65152 Len=17 TSval=3171265697 TSecr=1047005986
1711549309.300329208  1096 0.638394968    10.10.1.2 → 10.10.1.1    TCP 83 57288 → 8081 [PSH, ACK] Seq=1803 Ack=1803 Win=64256 Len=17 TSval=1047005987 TSecr=3171265697
1711549311.300329208  1098 0.638431002    10.10.1.1 → 10.10.1.2    TCP 83 8081 → 57288 [PSH, ACK] Seq=1803 Ack=1820 Win=65152 Len=17 TSval=3171265698 TSecr=1047005987
1711549319.300329208  1106 0.639588034    10.10.1.2 → 10.10.1.1    TCP 83 57288 → 8081 [PSH, ACK] Seq=1820 Ack=1820 Win=64256 Len=17 TSval=1047005989 TSecr=3171265698
1711549321.300329208  1108 0.639619724    10.10.1.1 → 10.10.1.2    TCP 83 8081 → 57288 [PSH, ACK] Seq=1820 Ack=1837 Win=65152 Len=17 TSval=3171265699 TSecr=1047005989
1711549329.300329208  1116 0.640777998    10.10.1.2 → 10.10.1.1    TCP 83 57288 → 8081 [PSH, ACK] Seq=1837 Ack=1837 Win=64256 Len=17 TSval=1047005990 TSecr=3171265699
1711549331.300329208  1118 0.640809786    10.10.1.1 → 10.10.1.2    TCP 83 8081 → 57288 [PSH, ACK] Seq=1837 Ack=1854 Win=65152 Len=17 TSval=3171265700 TSecr=1047005990
1711549339.300329208  1126 0.641966118    10.10.1.2 → 10.10.1.1    TCP 83 57288 → 8081 [PSH, ACK] Seq=1854 Ack=1854 Win=64256 Len=17 TSval=1047005991 TSecr=3171265700
1711549341.300329208  1128 0.641997381    10.10.1.1 → 10.10.1.2    TCP 83 8081 → 57288 [PSH, ACK] Seq=1854 Ack=1871 Win=65152 Len=17 TSval=3171265701 TSecr=1047005991
1711549349.300329208  1136 0.643154903    10.10.1.2 → 10.10.1.1    TCP 83 57288 → 8081 [PSH, ACK] Seq=1871 Ack=1871 Win=64256 Len=17 TSval=1047005992 TSecr=3171265701
1711549351.300329208  1138 0.643190816    10.10.1.1 → 10.10.1.2    TCP 83 8081 → 57288 [PSH, ACK] Seq=1871 Ack=1888 Win=65152 Len=17 TSval=3171265703 TSecr=1047005992
1711549359.300329208  1146 0.644350220    10.10.1.2 → 10.10.1.1    TCP 83 57288 → 8081 [PSH, ACK] Seq=1888 Ack=1888 Win=64256 Len=17 TSval=1047005993 TSecr=3171265703
1711549361.300329208  1148 0.644379706    10.10.1.1 → 10.10.1.2    TCP 83 8081 → 57288 [PSH, ACK] Seq=1888 Ack=1905 Win=65152 Len=17 TSval=3171265704 TSecr=1047005993
1711549369.300329208  1156 0.645535983    10.10.1.2 → 10.10.1.1    TCP 83 57288 → 8081 [PSH, ACK] Seq=1905 Ack=1905 Win=64256 Len=17 TSval=1047005995 TSecr=3171265704
1711549371.300329208  1158 0.645565307    10.10.1.1 → 10.10.1.2    TCP 83 8081 → 57288 [PSH, ACK] Seq=1905 Ack=1922 Win=65152 Len=17 TSval=3171265705 TSecr=1047005995
1711549379.300329208  1166 0.646722375    10.10.1.2 → 10.10.1.1    TCP 83 57288 → 8081 [PSH, ACK] Seq=1922 Ack=1922 Win=64256 Len=17 TSval=1047005996 TSecr=3171265705
1711549382.300329208  1169 0.646786909    10.10.1.1 → 10.10.1.2    TCP 83 8081 → 57288 [PSH, ACK] Seq=1922 Ack=1939 Win=65152 Len=17 TSval=3171265706 TSecr=1047005996
1711549389.300329208  1176 0.647947547    10.10.1.2 → 10.10.1.1    TCP 83 57288 → 8081 [PSH, ACK] Seq=1939 Ack=1939 Win=64256 Len=17 TSval=1047005997 TSecr=3171265706
1711549391.300329208  1178 0.647979873    10.10.1.1 → 10.10.1.2    TCP 83 8081 → 57288 [PSH, ACK] Seq=1939 Ack=1956 Win=65152 Len=17 TSval=3171265707 TSecr=1047005997
1711549399.300329208  1186 0.649136980    10.10.1.2 → 10.10.1.1    TCP 83 57288 → 8081 [PSH, ACK] Seq=1956 Ack=1956 Win=64256 Len=17 TSval=1047005998 TSecr=3171265707
1711549401.300329208  1188 0.649168837    10.10.1.1 → 10.10.1.2    TCP 83 8081 → 57288 [PSH, ACK] Seq=1956 Ack=1973 Win=65152 Len=17 TSval=3171265709 TSecr=1047005998
1711549409.300329208  1196 0.650324787    10.10.1.2 → 10.10.1.1    TCP 83 57288 → 8081 [PSH, ACK] Seq=1973 Ack=1973 Win=64256 Len=17 TSval=1047005999 TSecr=3171265709
1711549411.300329208  1198 0.650360769    10.10.1.1 → 10.10.1.2    TCP 83 8081 → 57288 [PSH, ACK] Seq=1973 Ack=1990 Win=65152 Len=17 TSval=3171265710 TSecr=1047005999
1711549419.300329208  1206 0.651517871    10.10.1.2 → 10.10.1.1    TCP 83 57288 → 8081 [PSH, ACK] Seq=1990 Ack=1990 Win=64256 Len=17 TSval=1047006001 TSecr=3171265710
1711549421.300329208  1208 0.651549032    10.10.1.1 → 10.10.1.2    TCP 83 8081 → 57288 [PSH, ACK] Seq=1990 Ack=2007 Win=65152 Len=17 TSval=3171265711 TSecr=1047006001
