1711546304.271758318    22 0.310479658    10.10.1.2 → 10.10.1.1    TCP 74 49456 → 8081 [SYN] Seq=0 Win=64240 Len=0 MSS=1460 SACK_PERM=1 TSval=1045074678 TSecr=0 WS=128
1711546305.271758318    23 0.310519118    10.10.1.1 → 10.10.1.2    TCP 74 8081 → 49456 [SYN, ACK] Seq=0 Ack=1 Win=65160 Len=0 MSS=1460 SACK_PERM=1 TSval=3169334386 TSecr=1045074678 WS=128
1711546306.271758318    24 0.310558975    10.10.1.2 → 10.10.1.1    TCP 66 49456 → 8081 [ACK] Seq=1 Ack=1 Win=64256 Len=0 TSval=1045074678 TSecr=3169334386
1711546310.271758318    28 0.563652911    10.10.1.2 → 10.10.1.1    TCP 83 49456 → 8081 [PSH, ACK] Seq=1 Ack=1 Win=64256 Len=17 TSval=1045074931 TSecr=3169334386
1711546312.271758318    30 0.563681432    10.10.1.1 → 10.10.1.2    TCP 66 8081 → 49456 [ACK] Seq=1 Ack=18 Win=65152 Len=0 TSval=3169334639 TSecr=1045074931
1711546314.271758318    32 0.563995202    10.10.1.1 → 10.10.1.2    TCP 83 8081 → 49456 [PSH, ACK] Seq=1 Ack=18 Win=65152 Len=17 TSval=3169334640 TSecr=1045074931
1711546315.271758318    33 0.564081839    10.10.1.2 → 10.10.1.1    TCP 66 49456 → 8081 [ACK] Seq=18 Ack=18 Win=64256 Len=0 TSval=1045074931 TSecr=3169334640
1711546320.271758318    38 0.581217408    10.10.1.2 → 10.10.1.1    TCP 83 49456 → 8081 [PSH, ACK] Seq=18 Ack=18 Win=64256 Len=17 TSval=1045074949 TSecr=3169334640
1711546323.271758318    41 0.581342218    10.10.1.1 → 10.10.1.2    TCP 83 8081 → 49456 [PSH, ACK] Seq=18 Ack=35 Win=65152 Len=17 TSval=3169334657 TSecr=1045074949
1711546328.271758318    46 0.605183878    10.10.1.2 → 10.10.1.1    TCP 83 49456 → 8081 [PSH, ACK] Seq=35 Ack=35 Win=64256 Len=17 TSval=1045074973 TSecr=3169334657
1711546331.271758318    49 0.605315049    10.10.1.1 → 10.10.1.2    TCP 83 8081 → 49456 [PSH, ACK] Seq=35 Ack=52 Win=65152 Len=17 TSval=3169334681 TSecr=1045074973
1711546336.271758318    54 0.610242908    10.10.1.2 → 10.10.1.1    TCP 83 49456 → 8081 [PSH, ACK] Seq=52 Ack=52 Win=64256 Len=17 TSval=1045074978 TSecr=3169334681
1711546339.271758318    57 0.610373247    10.10.1.1 → 10.10.1.2    TCP 83 8081 → 49456 [PSH, ACK] Seq=52 Ack=69 Win=65152 Len=17 TSval=3169334686 TSecr=1045074978
1711546344.271758318    62 0.612135532    10.10.1.2 → 10.10.1.1    TCP 83 49456 → 8081 [PSH, ACK] Seq=69 Ack=69 Win=64256 Len=17 TSval=1045074980 TSecr=3169334686
1711546347.271758318    65 0.612261191    10.10.1.1 → 10.10.1.2    TCP 83 8081 → 49456 [PSH, ACK] Seq=69 Ack=86 Win=65152 Len=17 TSval=3169334688 TSecr=1045074980
1711546352.271758318    70 0.656124108    10.10.1.2 → 10.10.1.1    TCP 66 49456 → 8081 [ACK] Seq=86 Ack=86 Win=64256 Len=0 TSval=1045075024 TSecr=3169334688
1711546353.271758318    71 0.663054718    10.10.1.2 → 10.10.1.1    TCP 83 49456 → 8081 [PSH, ACK] Seq=86 Ack=86 Win=64256 Len=17 TSval=1045075030 TSecr=3169334688
1711546355.271758318    73 0.663181187    10.10.1.1 → 10.10.1.2    TCP 83 8081 → 49456 [PSH, ACK] Seq=86 Ack=103 Win=65152 Len=17 TSval=3169334739 TSecr=1045075030
1711546357.271758318    75 0.663212284    10.10.1.2 → 10.10.1.1    TCP 66 49456 → 8081 [ACK] Seq=103 Ack=103 Win=64256 Len=0 TSval=1045075031 TSecr=3169334739
1711546362.271758318    80 0.666439052    10.10.1.2 → 10.10.1.1    TCP 83 49456 → 8081 [PSH, ACK] Seq=103 Ack=103 Win=64256 Len=17 TSval=1045075034 TSecr=3169334739
1711546364.271758318    82 0.666563114    10.10.1.1 → 10.10.1.2    TCP 83 8081 → 49456 [PSH, ACK] Seq=103 Ack=120 Win=65152 Len=17 TSval=3169334742 TSecr=1045075034
1711546370.271758318    88 0.706793446    10.10.1.2 → 10.10.1.1    TCP 83 49456 → 8081 [PSH, ACK] Seq=120 Ack=120 Win=64256 Len=17 TSval=1045075074 TSecr=3169334742
1711546372.271758318    90 0.706924372    10.10.1.1 → 10.10.1.2    TCP 83 8081 → 49456 [PSH, ACK] Seq=120 Ack=137 Win=65152 Len=17 TSval=3169334783 TSecr=1045075074
1711546378.271758318    96 0.711525219    10.10.1.2 → 10.10.1.1    TCP 83 49456 → 8081 [PSH, ACK] Seq=137 Ack=137 Win=64256 Len=17 TSval=1045075079 TSecr=3169334783
1711546380.271758318    98 0.711656281    10.10.1.1 → 10.10.1.2    TCP 83 8081 → 49456 [PSH, ACK] Seq=137 Ack=154 Win=65152 Len=17 TSval=3169334787 TSecr=1045075079
1711546386.271758318   104 0.713852163    10.10.1.2 → 10.10.1.1    TCP 83 49456 → 8081 [PSH, ACK] Seq=154 Ack=154 Win=64256 Len=17 TSval=1045075081 TSecr=3169334787
1711546388.271758318   106 0.713983415    10.10.1.1 → 10.10.1.2    TCP 83 8081 → 49456 [PSH, ACK] Seq=154 Ack=171 Win=65152 Len=17 TSval=3169334790 TSecr=1045075081
1711546394.271758318   112 0.722625816    10.10.1.2 → 10.10.1.1    TCP 83 49456 → 8081 [PSH, ACK] Seq=171 Ack=171 Win=64256 Len=17 TSval=1045075090 TSecr=3169334790
1711546396.271758318   114 0.722756480    10.10.1.1 → 10.10.1.2    TCP 83 8081 → 49456 [PSH, ACK] Seq=171 Ack=188 Win=65152 Len=17 TSval=3169334798 TSecr=1045075090
1711546402.271758318   120 0.727811711    10.10.1.2 → 10.10.1.1    TCP 83 49456 → 8081 [PSH, ACK] Seq=188 Ack=188 Win=64256 Len=17 TSval=1045075095 TSecr=3169334798
1711546404.271758318   122 0.727942913    10.10.1.1 → 10.10.1.2    TCP 83 8081 → 49456 [PSH, ACK] Seq=188 Ack=205 Win=65152 Len=17 TSval=3169334804 TSecr=1045075095
1711546410.271758318   128 0.734251652    10.10.1.2 → 10.10.1.1    TCP 83 49456 → 8081 [PSH, ACK] Seq=205 Ack=205 Win=64256 Len=17 TSval=1045075102 TSecr=3169334804
1711546412.271758318   130 0.734383012    10.10.1.1 → 10.10.1.2    TCP 83 8081 → 49456 [PSH, ACK] Seq=205 Ack=222 Win=65152 Len=17 TSval=3169334810 TSecr=1045075102
1711546418.271758318   136 0.743787961    10.10.1.2 → 10.10.1.1    TCP 83 49456 → 8081 [PSH, ACK] Seq=222 Ack=222 Win=64256 Len=17 TSval=1045075111 TSecr=3169334810
1711546420.271758318   138 0.743917838    10.10.1.1 → 10.10.1.2    TCP 83 8081 → 49456 [PSH, ACK] Seq=222 Ack=239 Win=65152 Len=17 TSval=3169334820 TSecr=1045075111
1711546426.271758318   144 0.749768930    10.10.1.2 → 10.10.1.1    TCP 83 49456 → 8081 [PSH, ACK] Seq=239 Ack=239 Win=64256 Len=17 TSval=1045075117 TSecr=3169334820
1711546428.271758318   146 0.749902417    10.10.1.1 → 10.10.1.2    TCP 83 8081 → 49456 [PSH, ACK] Seq=239 Ack=256 Win=65152 Len=17 TSval=3169334826 TSecr=1045075117
1711546434.271758318   152 0.751162613    10.10.1.2 → 10.10.1.1    TCP 83 49456 → 8081 [PSH, ACK] Seq=256 Ack=256 Win=64256 Len=17 TSval=1045075119 TSecr=3169334826
1711546436.271758318   154 0.751292898    10.10.1.1 → 10.10.1.2    TCP 83 8081 → 49456 [PSH, ACK] Seq=256 Ack=273 Win=65152 Len=17 TSval=3169334827 TSecr=1045075119
1711546442.271758318   160 0.755908290    10.10.1.2 → 10.10.1.1    TCP 83 49456 → 8081 [PSH, ACK] Seq=273 Ack=273 Win=64256 Len=17 TSval=1045075123 TSecr=3169334827
1711546444.271758318   162 0.756041867    10.10.1.1 → 10.10.1.2    TCP 83 8081 → 49456 [PSH, ACK] Seq=273 Ack=290 Win=65152 Len=17 TSval=3169334832 TSecr=1045075123
1711546450.271758318   168 0.762726609    10.10.1.2 → 10.10.1.1    TCP 83 49456 → 8081 [PSH, ACK] Seq=290 Ack=290 Win=64256 Len=17 TSval=1045075130 TSecr=3169334832
1711546452.271758318   170 0.762858261    10.10.1.1 → 10.10.1.2    TCP 83 8081 → 49456 [PSH, ACK] Seq=290 Ack=307 Win=65152 Len=17 TSval=3169334839 TSecr=1045075130
1711546459.271758318   177 0.763713228    10.10.1.2 → 10.10.1.1    TCP 83 49456 → 8081 [PSH, ACK] Seq=307 Ack=307 Win=64256 Len=17 TSval=1045075131 TSecr=3169334839
1711546461.271758318   179 0.763837806    10.10.1.1 → 10.10.1.2    TCP 83 8081 → 49456 [PSH, ACK] Seq=307 Ack=324 Win=65152 Len=17 TSval=3169334840 TSecr=1045075131
1711546466.271758318   184 0.787921075    10.10.1.2 → 10.10.1.1    TCP 83 49456 → 8081 [PSH, ACK] Seq=324 Ack=324 Win=64256 Len=17 TSval=1045075155 TSecr=3169334840
1711546468.271758318   186 0.788052104    10.10.1.1 → 10.10.1.2    TCP 83 8081 → 49456 [PSH, ACK] Seq=324 Ack=341 Win=65152 Len=17 TSval=3169334864 TSecr=1045075155
1711546474.271758318   192 0.796132139    10.10.1.2 → 10.10.1.1    TCP 83 49456 → 8081 [PSH, ACK] Seq=341 Ack=341 Win=64256 Len=17 TSval=1045075164 TSecr=3169334864
1711546476.271758318   194 0.796262810    10.10.1.1 → 10.10.1.2    TCP 83 8081 → 49456 [PSH, ACK] Seq=341 Ack=358 Win=65152 Len=17 TSval=3169334872 TSecr=1045075164
1711546482.271758318   200 0.801723321    10.10.1.2 → 10.10.1.1    TCP 83 49456 → 8081 [PSH, ACK] Seq=358 Ack=358 Win=64256 Len=17 TSval=1045075169 TSecr=3169334872
1711546484.271758318   202 0.801854083    10.10.1.1 → 10.10.1.2    TCP 83 8081 → 49456 [PSH, ACK] Seq=358 Ack=375 Win=65152 Len=17 TSval=3169334878 TSecr=1045075169
1711546490.271758318   208 0.807041111    10.10.1.2 → 10.10.1.1    TCP 83 49456 → 8081 [PSH, ACK] Seq=375 Ack=375 Win=64256 Len=17 TSval=1045075174 TSecr=3169334878
1711546492.271758318   210 0.807171331    10.10.1.1 → 10.10.1.2    TCP 83 8081 → 49456 [PSH, ACK] Seq=375 Ack=392 Win=65152 Len=17 TSval=3169334883 TSecr=1045075174
1711546498.271758318   216 0.811676997    10.10.1.2 → 10.10.1.1    TCP 83 49456 → 8081 [PSH, ACK] Seq=392 Ack=392 Win=64256 Len=17 TSval=1045075179 TSecr=3169334883
1711546500.271758318   218 0.811807479    10.10.1.1 → 10.10.1.2    TCP 83 8081 → 49456 [PSH, ACK] Seq=392 Ack=409 Win=65152 Len=17 TSval=3169334888 TSecr=1045075179
1711546506.271758318   224 0.825477432    10.10.1.2 → 10.10.1.1    TCP 83 49456 → 8081 [PSH, ACK] Seq=409 Ack=409 Win=64256 Len=17 TSval=1045075193 TSecr=3169334888
1711546508.271758318   226 0.825612761    10.10.1.1 → 10.10.1.2    TCP 83 8081 → 49456 [PSH, ACK] Seq=409 Ack=426 Win=65152 Len=17 TSval=3169334901 TSecr=1045075193
1711546511.271758318   229 0.825718722    10.10.1.2 → 10.10.1.1    TCP 83 49456 → 8081 [PSH, ACK] Seq=426 Ack=426 Win=64256 Len=17 TSval=1045075193 TSecr=3169334901
1711546514.271758318   232 0.825755497    10.10.1.1 → 10.10.1.2    TCP 83 8081 → 49456 [PSH, ACK] Seq=426 Ack=443 Win=65152 Len=17 TSval=3169334901 TSecr=1045075193
1711546520.271758318   238 0.838915738    10.10.1.2 → 10.10.1.1    TCP 83 49456 → 8081 [PSH, ACK] Seq=443 Ack=443 Win=64256 Len=17 TSval=1045075206 TSecr=3169334901
1711546522.271758318   240 0.839046105    10.10.1.1 → 10.10.1.2    TCP 83 8081 → 49456 [PSH, ACK] Seq=443 Ack=460 Win=65152 Len=17 TSval=3169334915 TSecr=1045075206
1711546528.271758318   246 0.843376659    10.10.1.2 → 10.10.1.1    TCP 83 49456 → 8081 [PSH, ACK] Seq=460 Ack=460 Win=64256 Len=17 TSval=1045075211 TSecr=3169334915
1711546530.271758318   248 0.843507276    10.10.1.1 → 10.10.1.2    TCP 83 8081 → 49456 [PSH, ACK] Seq=460 Ack=477 Win=65152 Len=17 TSval=3169334919 TSecr=1045075211
1711546536.271758318   254 0.844307149    10.10.1.2 → 10.10.1.1    TCP 83 49456 → 8081 [PSH, ACK] Seq=477 Ack=477 Win=64256 Len=17 TSval=1045075212 TSecr=3169334919
1711546539.271758318   257 0.844433236    10.10.1.1 → 10.10.1.2    TCP 83 8081 → 49456 [PSH, ACK] Seq=477 Ack=494 Win=65152 Len=17 TSval=3169334920 TSecr=1045075212
1711546544.271758318   262 0.850088429    10.10.1.2 → 10.10.1.1    TCP 83 49456 → 8081 [PSH, ACK] Seq=494 Ack=494 Win=64256 Len=17 TSval=1045075217 TSecr=3169334920
1711546546.271758318   264 0.850218086    10.10.1.1 → 10.10.1.2    TCP 83 8081 → 49456 [PSH, ACK] Seq=494 Ack=511 Win=65152 Len=17 TSval=3169334926 TSecr=1045075217
1711546552.271758318   270 0.857122697    10.10.1.2 → 10.10.1.1    TCP 83 49456 → 8081 [PSH, ACK] Seq=511 Ack=511 Win=64256 Len=17 TSval=1045075225 TSecr=3169334926
1711546554.271758318   272 0.857254199    10.10.1.1 → 10.10.1.2    TCP 83 8081 → 49456 [PSH, ACK] Seq=511 Ack=528 Win=65152 Len=17 TSval=3169334933 TSecr=1045075225
1711546560.271758318   278 0.862276136    10.10.1.2 → 10.10.1.1    TCP 83 49456 → 8081 [PSH, ACK] Seq=528 Ack=528 Win=64256 Len=17 TSval=1045075230 TSecr=3169334933
1711546562.271758318   280 0.862406509    10.10.1.1 → 10.10.1.2    TCP 83 8081 → 49456 [PSH, ACK] Seq=528 Ack=545 Win=65152 Len=17 TSval=3169334938 TSecr=1045075230
1711546568.271758318   286 0.865324627    10.10.1.2 → 10.10.1.1    TCP 83 49456 → 8081 [PSH, ACK] Seq=545 Ack=545 Win=64256 Len=17 TSval=1045075233 TSecr=3169334938
1711546570.271758318   288 0.865450057    10.10.1.1 → 10.10.1.2    TCP 83 8081 → 49456 [PSH, ACK] Seq=545 Ack=562 Win=65152 Len=17 TSval=3169334941 TSecr=1045075233
1711546576.271758318   294 0.870666488    10.10.1.2 → 10.10.1.1    TCP 83 49456 → 8081 [PSH, ACK] Seq=562 Ack=562 Win=64256 Len=17 TSval=1045075238 TSecr=3169334941
1711546578.271758318   296 0.870797132    10.10.1.1 → 10.10.1.2    TCP 83 8081 → 49456 [PSH, ACK] Seq=562 Ack=579 Win=65152 Len=17 TSval=3169334947 TSecr=1045075238
1711546584.271758318   302 0.885192388    10.10.1.2 → 10.10.1.1    TCP 83 49456 → 8081 [PSH, ACK] Seq=579 Ack=579 Win=64256 Len=17 TSval=1045075253 TSecr=3169334947
1711546586.271758318   304 0.885323134    10.10.1.1 → 10.10.1.2    TCP 83 8081 → 49456 [PSH, ACK] Seq=579 Ack=596 Win=65152 Len=17 TSval=3169334961 TSecr=1045075253
1711546592.271758318   310 0.890327484    10.10.1.2 → 10.10.1.1    TCP 83 49456 → 8081 [PSH, ACK] Seq=596 Ack=596 Win=64256 Len=17 TSval=1045075258 TSecr=3169334961
1711546594.271758318   312 0.890457830    10.10.1.1 → 10.10.1.2    TCP 83 8081 → 49456 [PSH, ACK] Seq=596 Ack=613 Win=65152 Len=17 TSval=3169334966 TSecr=1045075258
1711546600.271758318   318 0.895570684    10.10.1.2 → 10.10.1.1    TCP 83 49456 → 8081 [PSH, ACK] Seq=613 Ack=613 Win=64256 Len=17 TSval=1045075263 TSecr=3169334966
1711546602.271758318   320 0.895701333    10.10.1.1 → 10.10.1.2    TCP 83 8081 → 49456 [PSH, ACK] Seq=613 Ack=630 Win=65152 Len=17 TSval=3169334971 TSecr=1045075263
1711546610.271758318   328 0.896123679    10.10.1.2 → 10.10.1.1    TCP 83 49456 → 8081 [PSH, ACK] Seq=630 Ack=630 Win=64256 Len=17 TSval=1045075264 TSecr=3169334971
1711546611.271758318   329 0.896248915    10.10.1.1 → 10.10.1.2    TCP 83 8081 → 49456 [PSH, ACK] Seq=630 Ack=647 Win=65152 Len=17 TSval=3169334972 TSecr=1045075264
1711546616.271758318   334 0.900963730    10.10.1.2 → 10.10.1.1    TCP 83 49456 → 8081 [PSH, ACK] Seq=647 Ack=647 Win=64256 Len=17 TSval=1045075268 TSecr=3169334972
1711546618.271758318   336 0.901093360    10.10.1.1 → 10.10.1.2    TCP 83 8081 → 49456 [PSH, ACK] Seq=647 Ack=664 Win=65152 Len=17 TSval=3169334977 TSecr=1045075268
1711546624.271758318   342 0.914883517    10.10.1.2 → 10.10.1.1    TCP 83 49456 → 8081 [PSH, ACK] Seq=664 Ack=664 Win=64256 Len=17 TSval=1045075282 TSecr=3169334977
1711546626.271758318   344 0.915015620    10.10.1.1 → 10.10.1.2    TCP 83 8081 → 49456 [PSH, ACK] Seq=664 Ack=681 Win=65152 Len=17 TSval=3169334991 TSecr=1045075282
1711546632.271758318   350 0.917460596    10.10.1.2 → 10.10.1.1    TCP 83 49456 → 8081 [PSH, ACK] Seq=681 Ack=681 Win=64256 Len=17 TSval=1045075285 TSecr=3169334991
1711546634.271758318   352 0.917587774    10.10.1.1 → 10.10.1.2    TCP 83 8081 → 49456 [PSH, ACK] Seq=681 Ack=698 Win=65152 Len=17 TSval=3169334993 TSecr=1045075285
1711546640.271758318   358 0.944752688    10.10.1.2 → 10.10.1.1    TCP 83 49456 → 8081 [PSH, ACK] Seq=698 Ack=698 Win=64256 Len=17 TSval=1045075312 TSecr=3169334993
1711546642.271758318   360 0.944883338    10.10.1.1 → 10.10.1.2    TCP 83 8081 → 49456 [PSH, ACK] Seq=698 Ack=715 Win=65152 Len=17 TSval=3169335021 TSecr=1045075312
1711546648.271758318   366 0.946448010    10.10.1.2 → 10.10.1.1    TCP 83 49456 → 8081 [PSH, ACK] Seq=715 Ack=715 Win=64256 Len=17 TSval=1045075314 TSecr=3169335021
1711546650.271758318   368 0.946578362    10.10.1.1 → 10.10.1.2    TCP 83 8081 → 49456 [PSH, ACK] Seq=715 Ack=732 Win=65152 Len=17 TSval=3169335022 TSecr=1045075314
1711546656.271758318   374 0.957489080    10.10.1.2 → 10.10.1.1    TCP 83 49456 → 8081 [PSH, ACK] Seq=732 Ack=732 Win=64256 Len=17 TSval=1045075325 TSecr=3169335022
1711546658.271758318   376 0.957620153    10.10.1.1 → 10.10.1.2    TCP 83 8081 → 49456 [PSH, ACK] Seq=732 Ack=749 Win=65152 Len=17 TSval=3169335033 TSecr=1045075325
1711546664.271758318   382 0.965462468    10.10.1.2 → 10.10.1.1    TCP 83 49456 → 8081 [PSH, ACK] Seq=749 Ack=749 Win=64256 Len=17 TSval=1045075333 TSecr=3169335033
1711546666.271758318   384 0.965593181    10.10.1.1 → 10.10.1.2    TCP 83 8081 → 49456 [PSH, ACK] Seq=749 Ack=766 Win=65152 Len=17 TSval=3169335041 TSecr=1045075333
1711546672.271758318   390 0.974006277    10.10.1.2 → 10.10.1.1    TCP 83 49456 → 8081 [PSH, ACK] Seq=766 Ack=766 Win=64256 Len=17 TSval=1045075341 TSecr=3169335041
1711546674.271758318   392 0.974136176    10.10.1.1 → 10.10.1.2    TCP 83 8081 → 49456 [PSH, ACK] Seq=766 Ack=783 Win=65152 Len=17 TSval=3169335050 TSecr=1045075341
1711546680.271758318   398 0.988498060    10.10.1.2 → 10.10.1.1    TCP 83 49456 → 8081 [PSH, ACK] Seq=783 Ack=783 Win=64256 Len=17 TSval=1045075356 TSecr=3169335050
1711546682.271758318   400 0.988628794    10.10.1.1 → 10.10.1.2    TCP 83 8081 → 49456 [PSH, ACK] Seq=783 Ack=800 Win=65152 Len=17 TSval=3169335064 TSecr=1045075356
1711546688.271758318   406 1.010945309    10.10.1.2 → 10.10.1.1    TCP 83 49456 → 8081 [PSH, ACK] Seq=800 Ack=800 Win=64256 Len=17 TSval=1045075378 TSecr=3169335064
1711546690.271758318   408 1.011075206    10.10.1.1 → 10.10.1.2    TCP 83 8081 → 49456 [PSH, ACK] Seq=800 Ack=817 Win=65152 Len=17 TSval=3169335087 TSecr=1045075378
1711546696.271758318   414 1.011599184    10.10.1.2 → 10.10.1.1    TCP 83 49456 → 8081 [PSH, ACK] Seq=817 Ack=817 Win=64256 Len=17 TSval=1045075379 TSecr=3169335087
1711546698.271758318   416 1.011636011    10.10.1.1 → 10.10.1.2    TCP 83 8081 → 49456 [PSH, ACK] Seq=817 Ack=834 Win=65152 Len=17 TSval=3169335087 TSecr=1045075379
1711546704.271758318   422 1.028956178    10.10.1.2 → 10.10.1.1    TCP 83 49456 → 8081 [PSH, ACK] Seq=834 Ack=834 Win=64256 Len=17 TSval=1045075396 TSecr=3169335087
1711546707.271758318   425 1.029102315    10.10.1.1 → 10.10.1.2    TCP 83 8081 → 49456 [PSH, ACK] Seq=834 Ack=851 Win=65152 Len=17 TSval=3169335105 TSecr=1045075396
1711546712.271758318   430 1.045331889    10.10.1.2 → 10.10.1.1    TCP 83 49456 → 8081 [PSH, ACK] Seq=851 Ack=851 Win=64256 Len=17 TSval=1045075413 TSecr=3169335105
1711546714.271758318   432 1.045461927    10.10.1.1 → 10.10.1.2    TCP 83 8081 → 49456 [PSH, ACK] Seq=851 Ack=868 Win=65152 Len=17 TSval=3169335121 TSecr=1045075413
1711546720.271758318   438 1.054369845    10.10.1.2 → 10.10.1.1    TCP 83 49456 → 8081 [PSH, ACK] Seq=868 Ack=868 Win=64256 Len=17 TSval=1045075422 TSecr=3169335121
1711546722.271758318   440 1.054500496    10.10.1.1 → 10.10.1.2    TCP 83 8081 → 49456 [PSH, ACK] Seq=868 Ack=885 Win=65152 Len=17 TSval=3169335130 TSecr=1045075422
1711546728.271758318   446 1.057292834    10.10.1.2 → 10.10.1.1    TCP 83 49456 → 8081 [PSH, ACK] Seq=885 Ack=885 Win=64256 Len=17 TSval=1045075425 TSecr=3169335130
1711546730.271758318   448 1.057418270    10.10.1.1 → 10.10.1.2    TCP 83 8081 → 49456 [PSH, ACK] Seq=885 Ack=902 Win=65152 Len=17 TSval=3169335133 TSecr=1045075425
1711546736.271758318   454 1.059741309    10.10.1.2 → 10.10.1.1    TCP 83 49456 → 8081 [PSH, ACK] Seq=902 Ack=902 Win=64256 Len=17 TSval=1045075427 TSecr=3169335133
1711546738.271758318   456 1.059871201    10.10.1.1 → 10.10.1.2    TCP 83 8081 → 49456 [PSH, ACK] Seq=902 Ack=919 Win=65152 Len=17 TSval=3169335136 TSecr=1045075427
1711546744.271758318   462 1.086700259    10.10.1.2 → 10.10.1.1    TCP 83 49456 → 8081 [PSH, ACK] Seq=919 Ack=919 Win=64256 Len=17 TSval=1045075454 TSecr=3169335136
1711546746.271758318   464 1.086830690    10.10.1.1 → 10.10.1.2    TCP 83 8081 → 49456 [PSH, ACK] Seq=919 Ack=936 Win=65152 Len=17 TSval=3169335163 TSecr=1045075454
1711546752.271758318   470 1.121313801    10.10.1.2 → 10.10.1.1    TCP 83 49456 → 8081 [PSH, ACK] Seq=936 Ack=936 Win=64256 Len=17 TSval=1045075489 TSecr=3169335163
1711546754.271758318   472 1.121445442    10.10.1.1 → 10.10.1.2    TCP 83 8081 → 49456 [PSH, ACK] Seq=936 Ack=953 Win=65152 Len=17 TSval=3169335197 TSecr=1045075489
1711546760.271758318   478 1.123771678    10.10.1.2 → 10.10.1.1    TCP 83 49456 → 8081 [PSH, ACK] Seq=953 Ack=953 Win=64256 Len=17 TSval=1045075491 TSecr=3169335197
1711546763.271758318   481 1.124166484    10.10.1.1 → 10.10.1.2    TCP 83 8081 → 49456 [PSH, ACK] Seq=953 Ack=970 Win=65152 Len=17 TSval=3169335200 TSecr=1045075491
1711546767.271758318   485 1.135058640    10.10.1.2 → 10.10.1.1    TCP 83 49456 → 8081 [PSH, ACK] Seq=970 Ack=970 Win=64256 Len=17 TSval=1045075502 TSecr=3169335200
1711546769.271758318   487 1.135187994    10.10.1.1 → 10.10.1.2    TCP 83 8081 → 49456 [PSH, ACK] Seq=970 Ack=987 Win=65152 Len=17 TSval=3169335211 TSecr=1045075502
1711546775.271758318   493 1.139037467    10.10.1.2 → 10.10.1.1    TCP 83 49456 → 8081 [PSH, ACK] Seq=987 Ack=987 Win=64256 Len=17 TSval=1045075506 TSecr=3169335211
1711546777.271758318   495 1.139167892    10.10.1.1 → 10.10.1.2    TCP 83 8081 → 49456 [PSH, ACK] Seq=987 Ack=1004 Win=65152 Len=17 TSval=3169335215 TSecr=1045075506
1711546783.271758318   501 1.142244548    10.10.1.2 → 10.10.1.1    TCP 83 49456 → 8081 [PSH, ACK] Seq=1004 Ack=1004 Win=64256 Len=17 TSval=1045075510 TSecr=3169335215
1711546785.271758318   503 1.142374129    10.10.1.1 → 10.10.1.2    TCP 83 8081 → 49456 [PSH, ACK] Seq=1004 Ack=1021 Win=65152 Len=17 TSval=3169335218 TSecr=1045075510
1711546791.271758318   509 1.143375070    10.10.1.2 → 10.10.1.1    TCP 83 49456 → 8081 [PSH, ACK] Seq=1021 Ack=1021 Win=64256 Len=17 TSval=1045075511 TSecr=3169335218
1711546793.271758318   511 1.143501067    10.10.1.1 → 10.10.1.2    TCP 83 8081 → 49456 [PSH, ACK] Seq=1021 Ack=1038 Win=65152 Len=17 TSval=3169335219 TSecr=1045075511
1711546799.271758318   517 1.159466399    10.10.1.2 → 10.10.1.1    TCP 83 49456 → 8081 [PSH, ACK] Seq=1038 Ack=1038 Win=64256 Len=17 TSval=1045075527 TSecr=3169335219
1711546801.271758318   519 1.159597279    10.10.1.1 → 10.10.1.2    TCP 83 8081 → 49456 [PSH, ACK] Seq=1038 Ack=1055 Win=65152 Len=17 TSval=3169335235 TSecr=1045075527
1711546807.271758318   525 1.169759064    10.10.1.2 → 10.10.1.1    TCP 83 49456 → 8081 [PSH, ACK] Seq=1055 Ack=1055 Win=64256 Len=17 TSval=1045075537 TSecr=3169335235
1711546809.271758318   527 1.169890553    10.10.1.1 → 10.10.1.2    TCP 83 8081 → 49456 [PSH, ACK] Seq=1055 Ack=1072 Win=65152 Len=17 TSval=3169335246 TSecr=1045075537
1711546815.271758318   533 1.173863751    10.10.1.2 → 10.10.1.1    TCP 83 49456 → 8081 [PSH, ACK] Seq=1072 Ack=1072 Win=64256 Len=17 TSval=1045075541 TSecr=3169335246
1711546817.271758318   535 1.173994219    10.10.1.1 → 10.10.1.2    TCP 83 8081 → 49456 [PSH, ACK] Seq=1072 Ack=1089 Win=65152 Len=17 TSval=3169335250 TSecr=1045075541
1711546823.271758318   541 1.176271960    10.10.1.2 → 10.10.1.1    TCP 83 49456 → 8081 [PSH, ACK] Seq=1089 Ack=1089 Win=64256 Len=17 TSval=1045075544 TSecr=3169335250
1711546825.271758318   543 1.176397249    10.10.1.1 → 10.10.1.2    TCP 83 8081 → 49456 [PSH, ACK] Seq=1089 Ack=1106 Win=65152 Len=17 TSval=3169335252 TSecr=1045075544
1711546831.271758318   549 1.181519574    10.10.1.2 → 10.10.1.1    TCP 83 49456 → 8081 [PSH, ACK] Seq=1106 Ack=1106 Win=64256 Len=17 TSval=1045075549 TSecr=3169335252
1711546833.271758318   551 1.181650986    10.10.1.1 → 10.10.1.2    TCP 83 8081 → 49456 [PSH, ACK] Seq=1106 Ack=1123 Win=65152 Len=17 TSval=3169335257 TSecr=1045075549
1711546839.271758318   557 1.193722652    10.10.1.2 → 10.10.1.1    TCP 83 49456 → 8081 [PSH, ACK] Seq=1123 Ack=1123 Win=64256 Len=17 TSval=1045075561 TSecr=3169335257
1711546841.271758318   559 1.193854434    10.10.1.1 → 10.10.1.2    TCP 83 8081 → 49456 [PSH, ACK] Seq=1123 Ack=1140 Win=65152 Len=17 TSval=3169335270 TSecr=1045075561
1711546847.271758318   565 1.202607606    10.10.1.2 → 10.10.1.1    TCP 83 49456 → 8081 [PSH, ACK] Seq=1140 Ack=1140 Win=64256 Len=17 TSval=1045075570 TSecr=3169335270
1711546849.271758318   567 1.202739064    10.10.1.1 → 10.10.1.2    TCP 83 8081 → 49456 [PSH, ACK] Seq=1140 Ack=1157 Win=65152 Len=17 TSval=3169335278 TSecr=1045075570
1711546855.271758318   573 1.208206000    10.10.1.2 → 10.10.1.1    TCP 83 49456 → 8081 [PSH, ACK] Seq=1157 Ack=1157 Win=64256 Len=17 TSval=1045075576 TSecr=3169335278
1711546857.271758318   575 1.208336402    10.10.1.1 → 10.10.1.2    TCP 83 8081 → 49456 [PSH, ACK] Seq=1157 Ack=1174 Win=65152 Len=17 TSval=3169335284 TSecr=1045075576
1711546864.271758318   582 1.209134281    10.10.1.2 → 10.10.1.1    TCP 83 49456 → 8081 [PSH, ACK] Seq=1174 Ack=1174 Win=64256 Len=17 TSval=1045075577 TSecr=3169335284
1711546866.271758318   584 1.209258608    10.10.1.1 → 10.10.1.2    TCP 83 8081 → 49456 [PSH, ACK] Seq=1174 Ack=1191 Win=65152 Len=17 TSval=3169335285 TSecr=1045075577
1711546871.271758318   589 1.213281745    10.10.1.2 → 10.10.1.1    TCP 83 49456 → 8081 [PSH, ACK] Seq=1191 Ack=1191 Win=64256 Len=17 TSval=1045075581 TSecr=3169335285
1711546873.271758318   591 1.213411904    10.10.1.1 → 10.10.1.2    TCP 83 8081 → 49456 [PSH, ACK] Seq=1191 Ack=1208 Win=65152 Len=17 TSval=3169335289 TSecr=1045075581
1711546879.271758318   597 1.223022050    10.10.1.2 → 10.10.1.1    TCP 83 49456 → 8081 [PSH, ACK] Seq=1208 Ack=1208 Win=64256 Len=17 TSval=1045075590 TSecr=3169335289
1711546881.271758318   599 1.223152984    10.10.1.1 → 10.10.1.2    TCP 83 8081 → 49456 [PSH, ACK] Seq=1208 Ack=1225 Win=65152 Len=17 TSval=3169335299 TSecr=1045075590
1711546887.271758318   605 1.264122499    10.10.1.2 → 10.10.1.1    TCP 66 49456 → 8081 [ACK] Seq=1225 Ack=1225 Win=64256 Len=0 TSval=1045075632 TSecr=3169335299
1711546888.271758318   606 1.269240922    10.10.1.2 → 10.10.1.1    TCP 83 49456 → 8081 [PSH, ACK] Seq=1225 Ack=1225 Win=64256 Len=17 TSval=1045075637 TSecr=3169335299
1711546890.271758318   608 1.269366701    10.10.1.1 → 10.10.1.2    TCP 83 8081 → 49456 [PSH, ACK] Seq=1225 Ack=1242 Win=65152 Len=17 TSval=3169335345 TSecr=1045075637
1711546892.271758318   610 1.269403450    10.10.1.2 → 10.10.1.1    TCP 66 49456 → 8081 [ACK] Seq=1242 Ack=1242 Win=64256 Len=0 TSval=1045075637 TSecr=3169335345
1711546897.271758318   615 1.275452444    10.10.1.2 → 10.10.1.1    TCP 83 49456 → 8081 [PSH, ACK] Seq=1242 Ack=1242 Win=64256 Len=17 TSval=1045075643 TSecr=3169335345
1711546899.271758318   617 1.275577815    10.10.1.1 → 10.10.1.2    TCP 83 8081 → 49456 [PSH, ACK] Seq=1242 Ack=1259 Win=65152 Len=17 TSval=3169335351 TSecr=1045075643
1711546905.271758318   623 1.278886250    10.10.1.2 → 10.10.1.1    TCP 83 49456 → 8081 [PSH, ACK] Seq=1259 Ack=1259 Win=64256 Len=17 TSval=1045075646 TSecr=3169335351
1711546907.271758318   625 1.279016070    10.10.1.1 → 10.10.1.2    TCP 83 8081 → 49456 [PSH, ACK] Seq=1259 Ack=1276 Win=65152 Len=17 TSval=3169335355 TSecr=1045075646
1711546914.271758318   632 1.286644064    10.10.1.2 → 10.10.1.1    TCP 83 49456 → 8081 [PSH, ACK] Seq=1276 Ack=1276 Win=64256 Len=17 TSval=1045075654 TSecr=3169335355
1711546916.271758318   634 1.286774135    10.10.1.1 → 10.10.1.2    TCP 83 8081 → 49456 [PSH, ACK] Seq=1276 Ack=1293 Win=65152 Len=17 TSval=3169335362 TSecr=1045075654
1711546919.271758318   637 1.286915144    10.10.1.2 → 10.10.1.1    TCP 83 49456 → 8081 [PSH, ACK] Seq=1293 Ack=1293 Win=64256 Len=17 TSval=1045075654 TSecr=3169335362
1711546921.271758318   639 1.286952472    10.10.1.1 → 10.10.1.2    TCP 83 8081 → 49456 [PSH, ACK] Seq=1293 Ack=1310 Win=65152 Len=17 TSval=3169335363 TSecr=1045075654
1711546927.271758318   645 1.287341563    10.10.1.2 → 10.10.1.1    TCP 83 49456 → 8081 [PSH, ACK] Seq=1310 Ack=1310 Win=64256 Len=17 TSval=1045075655 TSecr=3169335363
1711546929.271758318   647 1.287372650    10.10.1.1 → 10.10.1.2    TCP 83 8081 → 49456 [PSH, ACK] Seq=1310 Ack=1327 Win=65152 Len=17 TSval=3169335363 TSecr=1045075655
1711546936.271758318   654 1.292920010    10.10.1.2 → 10.10.1.1    TCP 83 49456 → 8081 [PSH, ACK] Seq=1327 Ack=1327 Win=64256 Len=17 TSval=1045075660 TSecr=3169335363
1711546938.271758318   656 1.293048447    10.10.1.1 → 10.10.1.2    TCP 83 8081 → 49456 [PSH, ACK] Seq=1327 Ack=1344 Win=65152 Len=17 TSval=3169335369 TSecr=1045075660
1711546945.271758318   663 1.293664563    10.10.1.2 → 10.10.1.1    TCP 83 49456 → 8081 [PSH, ACK] Seq=1344 Ack=1344 Win=64256 Len=17 TSval=1045075661 TSecr=3169335369
1711546946.271758318   664 1.293811178    10.10.1.1 → 10.10.1.2    TCP 83 8081 → 49456 [PSH, ACK] Seq=1344 Ack=1361 Win=65152 Len=17 TSval=3169335370 TSecr=1045075661
1711546951.271758318   669 1.312534156    10.10.1.2 → 10.10.1.1    TCP 83 49456 → 8081 [PSH, ACK] Seq=1361 Ack=1361 Win=64256 Len=17 TSval=1045075680 TSecr=3169335370
1711546953.271758318   671 1.312666655    10.10.1.1 → 10.10.1.2    TCP 83 8081 → 49456 [PSH, ACK] Seq=1361 Ack=1378 Win=65152 Len=17 TSval=3169335388 TSecr=1045075680
1711546959.271758318   677 1.315266227    10.10.1.2 → 10.10.1.1    TCP 83 49456 → 8081 [PSH, ACK] Seq=1378 Ack=1378 Win=64256 Len=17 TSval=1045075683 TSecr=3169335388
1711546961.271758318   679 1.315402931    10.10.1.1 → 10.10.1.2    TCP 83 8081 → 49456 [PSH, ACK] Seq=1378 Ack=1395 Win=65152 Len=17 TSval=3169335391 TSecr=1045075683
1711546967.271758318   685 1.325305910    10.10.1.2 → 10.10.1.1    TCP 83 49456 → 8081 [PSH, ACK] Seq=1395 Ack=1395 Win=64256 Len=17 TSval=1045075693 TSecr=3169335391
1711546969.271758318   687 1.325443018    10.10.1.1 → 10.10.1.2    TCP 83 8081 → 49456 [PSH, ACK] Seq=1395 Ack=1412 Win=65152 Len=17 TSval=3169335401 TSecr=1045075693
1711546975.271758318   693 1.326407626    10.10.1.2 → 10.10.1.1    TCP 83 49456 → 8081 [PSH, ACK] Seq=1412 Ack=1412 Win=64256 Len=17 TSval=1045075694 TSecr=3169335401
1711546977.271758318   695 1.326542081    10.10.1.1 → 10.10.1.2    TCP 83 8081 → 49456 [PSH, ACK] Seq=1412 Ack=1429 Win=65152 Len=17 TSval=3169335402 TSecr=1045075694
1711546983.271758318   701 1.331906160    10.10.1.2 → 10.10.1.1    TCP 83 49456 → 8081 [PSH, ACK] Seq=1429 Ack=1429 Win=64256 Len=17 TSval=1045075699 TSecr=3169335402
1711546985.271758318   703 1.332044173    10.10.1.1 → 10.10.1.2    TCP 83 8081 → 49456 [PSH, ACK] Seq=1429 Ack=1446 Win=65152 Len=17 TSval=3169335408 TSecr=1045075699
1711546991.271758318   709 1.340261399    10.10.1.2 → 10.10.1.1    TCP 83 49456 → 8081 [PSH, ACK] Seq=1446 Ack=1446 Win=64256 Len=17 TSval=1045075708 TSecr=3169335408
1711546993.271758318   711 1.340391785    10.10.1.1 → 10.10.1.2    TCP 83 8081 → 49456 [PSH, ACK] Seq=1446 Ack=1463 Win=65152 Len=17 TSval=3169335416 TSecr=1045075708
1711547001.271758318   719 1.341005636    10.10.1.2 → 10.10.1.1    TCP 83 49456 → 8081 [PSH, ACK] Seq=1463 Ack=1463 Win=64256 Len=17 TSval=1045075708 TSecr=3169335416
1711547002.271758318   720 1.341129426    10.10.1.1 → 10.10.1.2    TCP 83 8081 → 49456 [PSH, ACK] Seq=1463 Ack=1480 Win=65152 Len=17 TSval=3169335417 TSecr=1045075708
1711547007.271758318   725 1.350348497    10.10.1.2 → 10.10.1.1    TCP 83 49456 → 8081 [PSH, ACK] Seq=1480 Ack=1480 Win=64256 Len=17 TSval=1045075718 TSecr=3169335417
1711547009.271758318   727 1.350487623    10.10.1.1 → 10.10.1.2    TCP 83 8081 → 49456 [PSH, ACK] Seq=1480 Ack=1497 Win=65152 Len=17 TSval=3169335426 TSecr=1045075718
1711547015.271758318   733 1.353018153    10.10.1.2 → 10.10.1.1    TCP 83 49456 → 8081 [PSH, ACK] Seq=1497 Ack=1497 Win=64256 Len=17 TSval=1045075720 TSecr=3169335426
1711547017.271758318   735 1.353143764    10.10.1.1 → 10.10.1.2    TCP 83 8081 → 49456 [PSH, ACK] Seq=1497 Ack=1514 Win=65152 Len=17 TSval=3169335429 TSecr=1045075720
1711547023.271758318   741 1.357561118    10.10.1.2 → 10.10.1.1    TCP 83 49456 → 8081 [PSH, ACK] Seq=1514 Ack=1514 Win=64256 Len=17 TSval=1045075725 TSecr=3169335429
1711547025.271758318   743 1.357690635    10.10.1.1 → 10.10.1.2    TCP 83 8081 → 49456 [PSH, ACK] Seq=1514 Ack=1531 Win=65152 Len=17 TSval=3169335433 TSecr=1045075725
1711547031.271758318   749 1.376380544    10.10.1.2 → 10.10.1.1    TCP 83 49456 → 8081 [PSH, ACK] Seq=1531 Ack=1531 Win=64256 Len=17 TSval=1045075744 TSecr=3169335433
1711547033.271758318   751 1.376519013    10.10.1.1 → 10.10.1.2    TCP 83 8081 → 49456 [PSH, ACK] Seq=1531 Ack=1548 Win=65152 Len=17 TSval=3169335452 TSecr=1045075744
1711547039.271758318   757 1.380061766    10.10.1.2 → 10.10.1.1    TCP 83 49456 → 8081 [PSH, ACK] Seq=1548 Ack=1548 Win=64256 Len=17 TSval=1045075747 TSecr=3169335452
1711547041.271758318   759 1.380191598    10.10.1.1 → 10.10.1.2    TCP 83 8081 → 49456 [PSH, ACK] Seq=1548 Ack=1565 Win=65152 Len=17 TSval=3169335456 TSecr=1045075747
1711547047.271758318   765 1.381870499    10.10.1.2 → 10.10.1.1    TCP 83 49456 → 8081 [PSH, ACK] Seq=1565 Ack=1565 Win=64256 Len=17 TSval=1045075749 TSecr=3169335456
1711547049.271758318   767 1.382007511    10.10.1.1 → 10.10.1.2    TCP 83 8081 → 49456 [PSH, ACK] Seq=1565 Ack=1582 Win=65152 Len=17 TSval=3169335458 TSecr=1045075749
1711547055.271758318   773 1.388612227    10.10.1.2 → 10.10.1.1    TCP 83 49456 → 8081 [PSH, ACK] Seq=1582 Ack=1582 Win=64256 Len=17 TSval=1045075756 TSecr=3169335458
1711547057.271758318   775 1.388750130    10.10.1.1 → 10.10.1.2    TCP 83 8081 → 49456 [PSH, ACK] Seq=1582 Ack=1599 Win=65152 Len=17 TSval=3169335464 TSecr=1045075756
1711547063.271758318   781 1.398055129    10.10.1.2 → 10.10.1.1    TCP 83 49456 → 8081 [PSH, ACK] Seq=1599 Ack=1599 Win=64256 Len=17 TSval=1045075765 TSecr=3169335464
1711547065.271758318   783 1.398192507    10.10.1.1 → 10.10.1.2    TCP 83 8081 → 49456 [PSH, ACK] Seq=1599 Ack=1616 Win=65152 Len=17 TSval=3169335474 TSecr=1045075765
1711547071.271758318   789 1.402313557    10.10.1.2 → 10.10.1.1    TCP 83 49456 → 8081 [PSH, ACK] Seq=1616 Ack=1616 Win=64256 Len=17 TSval=1045075770 TSecr=3169335474
1711547073.271758318   791 1.402449704    10.10.1.1 → 10.10.1.2    TCP 83 8081 → 49456 [PSH, ACK] Seq=1616 Ack=1633 Win=65152 Len=17 TSval=3169335478 TSecr=1045075770
1711547079.271758318   797 1.422387805    10.10.1.2 → 10.10.1.1    TCP 83 49456 → 8081 [PSH, ACK] Seq=1633 Ack=1633 Win=64256 Len=17 TSval=1045075790 TSecr=3169335478
1711547081.271758318   799 1.422525447    10.10.1.1 → 10.10.1.2    TCP 83 8081 → 49456 [PSH, ACK] Seq=1633 Ack=1650 Win=65152 Len=17 TSval=3169335498 TSecr=1045075790
1711547087.271758318   805 1.426185527    10.10.1.2 → 10.10.1.1    TCP 83 49456 → 8081 [PSH, ACK] Seq=1650 Ack=1650 Win=64256 Len=17 TSval=1045075794 TSecr=3169335498
1711547089.271758318   807 1.426321996    10.10.1.1 → 10.10.1.2    TCP 83 8081 → 49456 [PSH, ACK] Seq=1650 Ack=1667 Win=65152 Len=17 TSval=3169335502 TSecr=1045075794
1711547095.271758318   813 1.449380301    10.10.1.2 → 10.10.1.1    TCP 83 49456 → 8081 [PSH, ACK] Seq=1667 Ack=1667 Win=64256 Len=17 TSval=1045075817 TSecr=3169335502
1711547097.271758318   815 1.449518348    10.10.1.1 → 10.10.1.2    TCP 83 8081 → 49456 [PSH, ACK] Seq=1667 Ack=1684 Win=65152 Len=17 TSval=3169335525 TSecr=1045075817
1711547103.271758318   821 1.452869538    10.10.1.2 → 10.10.1.1    TCP 83 49456 → 8081 [PSH, ACK] Seq=1684 Ack=1684 Win=64256 Len=17 TSval=1045075820 TSecr=3169335525
1711547105.271758318   823 1.453007746    10.10.1.1 → 10.10.1.2    TCP 83 8081 → 49456 [PSH, ACK] Seq=1684 Ack=1701 Win=65152 Len=17 TSval=3169335529 TSecr=1045075820
1711547111.271758318   829 1.457514250    10.10.1.2 → 10.10.1.1    TCP 83 49456 → 8081 [PSH, ACK] Seq=1701 Ack=1701 Win=64256 Len=17 TSval=1045075825 TSecr=3169335529
1711547113.271758318   831 1.457649761    10.10.1.1 → 10.10.1.2    TCP 83 8081 → 49456 [PSH, ACK] Seq=1701 Ack=1718 Win=65152 Len=17 TSval=3169335533 TSecr=1045075825
1711547119.271758318   837 1.460284102    10.10.1.2 → 10.10.1.1    TCP 83 49456 → 8081 [PSH, ACK] Seq=1718 Ack=1718 Win=64256 Len=17 TSval=1045075828 TSecr=3169335533
1711547121.271758318   839 1.460420572    10.10.1.1 → 10.10.1.2    TCP 83 8081 → 49456 [PSH, ACK] Seq=1718 Ack=1735 Win=65152 Len=17 TSval=3169335536 TSecr=1045075828
1711547127.271758318   845 1.481759750    10.10.1.2 → 10.10.1.1    TCP 83 49456 → 8081 [PSH, ACK] Seq=1735 Ack=1735 Win=64256 Len=17 TSval=1045075849 TSecr=3169335536
1711547129.271758318   847 1.481896152    10.10.1.1 → 10.10.1.2    TCP 83 8081 → 49456 [PSH, ACK] Seq=1735 Ack=1752 Win=65152 Len=17 TSval=3169335558 TSecr=1045075849
1711547135.271758318   853 1.486246011    10.10.1.2 → 10.10.1.1    TCP 83 49456 → 8081 [PSH, ACK] Seq=1752 Ack=1752 Win=64256 Len=17 TSval=1045075854 TSecr=3169335558
1711547137.271758318   855 1.486381427    10.10.1.1 → 10.10.1.2    TCP 83 8081 → 49456 [PSH, ACK] Seq=1752 Ack=1769 Win=65152 Len=17 TSval=3169335562 TSecr=1045075854
1711547143.271758318   861 1.497369439    10.10.1.2 → 10.10.1.1    TCP 83 49456 → 8081 [PSH, ACK] Seq=1769 Ack=1769 Win=64256 Len=17 TSval=1045075865 TSecr=3169335562
1711547145.271758318   863 1.497499091    10.10.1.1 → 10.10.1.2    TCP 83 8081 → 49456 [PSH, ACK] Seq=1769 Ack=1786 Win=65152 Len=17 TSval=3169335573 TSecr=1045075865
1711547151.271758318   869 1.499280002    10.10.1.2 → 10.10.1.1    TCP 83 49456 → 8081 [PSH, ACK] Seq=1786 Ack=1786 Win=64256 Len=17 TSval=1045075867 TSecr=3169335573
1711547153.271758318   871 1.499409269    10.10.1.1 → 10.10.1.2    TCP 83 8081 → 49456 [PSH, ACK] Seq=1786 Ack=1803 Win=65152 Len=17 TSval=3169335575 TSecr=1045075867
1711547159.271758318   877 1.519470392    10.10.1.2 → 10.10.1.1    TCP 83 49456 → 8081 [PSH, ACK] Seq=1803 Ack=1803 Win=64256 Len=17 TSval=1045075887 TSecr=3169335575
1711547161.271758318   879 1.519607429    10.10.1.1 → 10.10.1.2    TCP 83 8081 → 49456 [PSH, ACK] Seq=1803 Ack=1820 Win=65152 Len=17 TSval=3169335595 TSecr=1045075887
1711547167.271758318   885 1.530708468    10.10.1.2 → 10.10.1.1    TCP 83 49456 → 8081 [PSH, ACK] Seq=1820 Ack=1820 Win=64256 Len=17 TSval=1045075898 TSecr=3169335595
1711547169.271758318   887 1.530845830    10.10.1.1 → 10.10.1.2    TCP 83 8081 → 49456 [PSH, ACK] Seq=1820 Ack=1837 Win=65152 Len=17 TSval=3169335607 TSecr=1045075898
1711547175.271758318   893 1.532906391    10.10.1.2 → 10.10.1.1    TCP 83 49456 → 8081 [PSH, ACK] Seq=1837 Ack=1837 Win=64256 Len=17 TSval=1045075900 TSecr=3169335607
1711547177.271758318   895 1.533027886    10.10.1.1 → 10.10.1.2    TCP 83 8081 → 49456 [PSH, ACK] Seq=1837 Ack=1854 Win=65152 Len=17 TSval=3169335609 TSecr=1045075900
1711547183.271758318   901 1.536475458    10.10.1.2 → 10.10.1.1    TCP 83 49456 → 8081 [PSH, ACK] Seq=1854 Ack=1854 Win=64256 Len=17 TSval=1045075904 TSecr=3169335609
1711547185.271758318   903 1.536610530    10.10.1.1 → 10.10.1.2    TCP 83 8081 → 49456 [PSH, ACK] Seq=1854 Ack=1871 Win=65152 Len=17 TSval=3169335612 TSecr=1045075904
1711547191.271758318   909 1.548970902    10.10.1.2 → 10.10.1.1    TCP 83 49456 → 8081 [PSH, ACK] Seq=1871 Ack=1871 Win=64256 Len=17 TSval=1045075916 TSecr=3169335612
1711547193.271758318   911 1.549109287    10.10.1.1 → 10.10.1.2    TCP 83 8081 → 49456 [PSH, ACK] Seq=1871 Ack=1888 Win=65152 Len=17 TSval=3169335625 TSecr=1045075916
1711547199.271758318   917 1.549388758    10.10.1.2 → 10.10.1.1    TCP 83 49456 → 8081 [PSH, ACK] Seq=1888 Ack=1888 Win=64256 Len=17 TSval=1045075917 TSecr=3169335625
1711547201.271758318   919 1.549424568    10.10.1.1 → 10.10.1.2    TCP 83 8081 → 49456 [PSH, ACK] Seq=1888 Ack=1905 Win=65152 Len=17 TSval=3169335625 TSecr=1045075917
1711547207.271758318   925 1.556347563    10.10.1.2 → 10.10.1.1    TCP 83 49456 → 8081 [PSH, ACK] Seq=1905 Ack=1905 Win=64256 Len=17 TSval=1045075924 TSecr=3169335625
1711547209.271758318   927 1.556477445    10.10.1.1 → 10.10.1.2    TCP 83 8081 → 49456 [PSH, ACK] Seq=1905 Ack=1922 Win=65152 Len=17 TSval=3169335632 TSecr=1045075924
1711547215.271758318   933 1.560605886    10.10.1.2 → 10.10.1.1    TCP 83 49456 → 8081 [PSH, ACK] Seq=1922 Ack=1922 Win=64256 Len=17 TSval=1045075928 TSecr=3169335632
1711547218.271758318   936 1.560797679    10.10.1.1 → 10.10.1.2    TCP 83 8081 → 49456 [PSH, ACK] Seq=1922 Ack=1939 Win=65152 Len=17 TSval=3169335637 TSecr=1045075928
1711547223.271758318   941 1.561871541    10.10.1.2 → 10.10.1.1    TCP 83 49456 → 8081 [PSH, ACK] Seq=1939 Ack=1939 Win=64256 Len=17 TSval=1045075929 TSecr=3169335637
1711547225.271758318   943 1.562008050    10.10.1.1 → 10.10.1.2    TCP 83 8081 → 49456 [PSH, ACK] Seq=1939 Ack=1956 Win=65152 Len=17 TSval=3169335638 TSecr=1045075929
1711547231.271758318   949 1.584505206    10.10.1.2 → 10.10.1.1    TCP 83 49456 → 8081 [PSH, ACK] Seq=1956 Ack=1956 Win=64256 Len=17 TSval=1045075952 TSecr=3169335638
1711547233.271758318   951 1.584635999    10.10.1.1 → 10.10.1.2    TCP 83 8081 → 49456 [PSH, ACK] Seq=1956 Ack=1973 Win=65152 Len=17 TSval=3169335660 TSecr=1045075952
