1711546354.251649141    21 0.294584129    10.10.1.2 → 10.10.1.1    TCP 74 52282 → 8081 [SYN] Seq=0 Win=64240 Len=0 MSS=1460 SACK_PERM=1 TSval=1045125634 TSecr=0 WS=128
1711546356.251649141    23 0.294622193    10.10.1.1 → 10.10.1.2    TCP 74 8081 → 52282 [SYN, ACK] Seq=0 Ack=1 Win=65160 Len=0 MSS=1460 SACK_PERM=1 TSval=3169385342 TSecr=1045125634 WS=128
1711546357.251649141    24 0.294706796    10.10.1.2 → 10.10.1.1    TCP 66 52282 → 8081 [ACK] Seq=1 Ack=1 Win=64256 Len=0 TSval=1045125634 TSecr=3169385342
1711546367.251649141    34 0.557270338    10.10.1.2 → 10.10.1.1    TCP 83 52282 → 8081 [PSH, ACK] Seq=1 Ack=1 Win=64256 Len=17 TSval=1045125897 TSecr=3169385342
1711546369.251649141    36 0.557296890    10.10.1.1 → 10.10.1.2    TCP 66 8081 → 52282 [ACK] Seq=1 Ack=18 Win=65152 Len=0 TSval=3169385605 TSecr=1045125897
1711546371.251649141    38 0.557568932    10.10.1.1 → 10.10.1.2    TCP 83 8081 → 52282 [PSH, ACK] Seq=1 Ack=18 Win=65152 Len=17 TSval=3169385605 TSecr=1045125897
1711546372.251649141    39 0.557601473    10.10.1.2 → 10.10.1.1    TCP 66 52282 → 8081 [ACK] Seq=18 Ack=18 Win=64256 Len=0 TSval=1045125897 TSecr=3169385605
1711546379.251649141    46 0.585621420    10.10.1.2 → 10.10.1.1    TCP 83 52282 → 8081 [PSH, ACK] Seq=18 Ack=18 Win=64256 Len=17 TSval=1045125925 TSecr=3169385605
1711546382.251649141    49 0.585746591    10.10.1.1 → 10.10.1.2    TCP 83 8081 → 52282 [PSH, ACK] Seq=18 Ack=35 Win=65152 Len=17 TSval=3169385633 TSecr=1045125925
1711546389.251649141    56 0.628187640    10.10.1.2 → 10.10.1.1    TCP 66 52282 → 8081 [ACK] Seq=35 Ack=35 Win=64256 Len=0 TSval=1045125968 TSecr=3169385633
1711546391.251649141    58 0.629792827    10.10.1.2 → 10.10.1.1    TCP 83 52282 → 8081 [PSH, ACK] Seq=35 Ack=35 Win=64256 Len=17 TSval=1045125969 TSecr=3169385633
1711546394.251649141    61 0.629928442    10.10.1.1 → 10.10.1.2    TCP 83 8081 → 52282 [PSH, ACK] Seq=35 Ack=52 Win=65152 Len=17 TSval=3169385678 TSecr=1045125969
1711546395.251649141    62 0.629959088    10.10.1.2 → 10.10.1.1    TCP 66 52282 → 8081 [ACK] Seq=52 Ack=52 Win=64256 Len=0 TSval=1045125969 TSecr=3169385678
1711546403.251649141    70 0.790458194    10.10.1.2 → 10.10.1.1    TCP 83 52282 → 8081 [PSH, ACK] Seq=52 Ack=52 Win=64256 Len=17 TSval=1045126130 TSecr=3169385678
1711546406.251649141    73 0.790583252    10.10.1.1 → 10.10.1.2    TCP 83 8081 → 52282 [PSH, ACK] Seq=52 Ack=69 Win=65152 Len=17 TSval=3169385838 TSecr=1045126130
1711546407.251649141    74 0.790614358    10.10.1.2 → 10.10.1.1    TCP 66 52282 → 8081 [ACK] Seq=69 Ack=69 Win=64256 Len=0 TSval=1045126130 TSecr=3169385838
1711546415.251649141    82 0.842266913    10.10.1.2 → 10.10.1.1    TCP 83 52282 → 8081 [PSH, ACK] Seq=69 Ack=69 Win=64256 Len=17 TSval=1045126182 TSecr=3169385838
1711546418.251649141    85 0.842391338    10.10.1.1 → 10.10.1.2    TCP 83 8081 → 52282 [PSH, ACK] Seq=69 Ack=86 Win=65152 Len=17 TSval=3169385890 TSecr=1045126182
1711546419.251649141    86 0.842421322    10.10.1.2 → 10.10.1.1    TCP 66 52282 → 8081 [ACK] Seq=86 Ack=86 Win=64256 Len=0 TSval=1045126182 TSecr=3169385890
1711546428.251649141    95 0.950671924    10.10.1.2 → 10.10.1.1    TCP 83 52282 → 8081 [PSH, ACK] Seq=86 Ack=86 Win=64256 Len=17 TSval=1045126290 TSecr=3169385890
1711546431.251649141    98 0.950795408    10.10.1.1 → 10.10.1.2    TCP 83 8081 → 52282 [PSH, ACK] Seq=86 Ack=103 Win=65152 Len=17 TSval=3169385998 TSecr=1045126290
1711546432.251649141    99 0.950835043    10.10.1.2 → 10.10.1.1    TCP 66 52282 → 8081 [ACK] Seq=103 Ack=103 Win=64256 Len=0 TSval=1045126290 TSecr=3169385998
1711546440.251649141   107 0.991792509    10.10.1.2 → 10.10.1.1    TCP 83 52282 → 8081 [PSH, ACK] Seq=103 Ack=103 Win=64256 Len=17 TSval=1045126331 TSecr=3169385998
1711546443.251649141   110 0.991917365    10.10.1.1 → 10.10.1.2    TCP 83 8081 → 52282 [PSH, ACK] Seq=103 Ack=120 Win=65152 Len=17 TSval=3169386040 TSecr=1045126331
1711546444.251649141   111 0.991948298    10.10.1.2 → 10.10.1.1    TCP 66 52282 → 8081 [ACK] Seq=120 Ack=120 Win=64256 Len=0 TSval=1045126331 TSecr=3169386040
1711546452.251649141   119 1.144278063    10.10.1.2 → 10.10.1.1    TCP 83 52282 → 8081 [PSH, ACK] Seq=120 Ack=120 Win=64256 Len=17 TSval=1045126484 TSecr=3169386040
1711546455.251649141   122 1.144402919    10.10.1.1 → 10.10.1.2    TCP 83 8081 → 52282 [PSH, ACK] Seq=120 Ack=137 Win=65152 Len=17 TSval=3169386192 TSecr=1045126484
1711546456.251649141   123 1.144433247    10.10.1.2 → 10.10.1.1    TCP 66 52282 → 8081 [ACK] Seq=137 Ack=137 Win=64256 Len=0 TSval=1045126484 TSecr=3169386192
1711546464.251649141   131 1.221430988    10.10.1.2 → 10.10.1.1    TCP 83 52282 → 8081 [PSH, ACK] Seq=137 Ack=137 Win=64256 Len=17 TSval=1045126561 TSecr=3169386192
1711546467.251649141   134 1.221555006    10.10.1.1 → 10.10.1.2    TCP 83 8081 → 52282 [PSH, ACK] Seq=137 Ack=154 Win=65152 Len=17 TSval=3169386269 TSecr=1045126561
1711546468.251649141   135 1.221593883    10.10.1.2 → 10.10.1.1    TCP 66 52282 → 8081 [ACK] Seq=154 Ack=154 Win=64256 Len=0 TSval=1045126561 TSecr=3169386269
1711546476.251649141   143 1.315646360    10.10.1.2 → 10.10.1.1    TCP 83 52282 → 8081 [PSH, ACK] Seq=154 Ack=154 Win=64256 Len=17 TSval=1045126655 TSecr=3169386269
1711546479.251649141   146 1.315770870    10.10.1.1 → 10.10.1.2    TCP 83 8081 → 52282 [PSH, ACK] Seq=154 Ack=171 Win=65152 Len=17 TSval=3169386363 TSecr=1045126655
1711546481.251649141   148 1.315854514    10.10.1.2 → 10.10.1.1    TCP 66 52282 → 8081 [ACK] Seq=171 Ack=171 Win=64256 Len=0 TSval=1045126655 TSecr=3169386363
1711546489.251649141   156 1.320793796    10.10.1.2 → 10.10.1.1    TCP 83 52282 → 8081 [PSH, ACK] Seq=171 Ack=171 Win=64256 Len=17 TSval=1045126660 TSecr=3169386363
1711546492.251649141   159 1.320918981    10.10.1.1 → 10.10.1.2    TCP 83 8081 → 52282 [PSH, ACK] Seq=171 Ack=188 Win=65152 Len=17 TSval=3169386369 TSecr=1045126660
1711546500.251649141   167 1.368195225    10.10.1.2 → 10.10.1.1    TCP 66 52282 → 8081 [ACK] Seq=188 Ack=188 Win=64256 Len=0 TSval=1045126708 TSecr=3169386369
1711546501.251649141   168 1.374438816    10.10.1.2 → 10.10.1.1    TCP 83 52282 → 8081 [PSH, ACK] Seq=188 Ack=188 Win=64256 Len=17 TSval=1045126714 TSecr=3169386369
1711546504.251649141   171 1.374562651    10.10.1.1 → 10.10.1.2    TCP 83 8081 → 52282 [PSH, ACK] Seq=188 Ack=205 Win=65152 Len=17 TSval=3169386422 TSecr=1045126714
1711546505.251649141   172 1.374610754    10.10.1.2 → 10.10.1.1    TCP 66 52282 → 8081 [ACK] Seq=205 Ack=205 Win=64256 Len=0 TSval=1045126714 TSecr=3169386422
1711546513.251649141   180 1.506910176    10.10.1.2 → 10.10.1.1    TCP 83 52282 → 8081 [PSH, ACK] Seq=205 Ack=205 Win=64256 Len=17 TSval=1045126846 TSecr=3169386422
1711546516.251649141   183 1.507035103    10.10.1.1 → 10.10.1.2    TCP 83 8081 → 52282 [PSH, ACK] Seq=205 Ack=222 Win=65152 Len=17 TSval=3169386555 TSecr=1045126846
1711546517.251649141   184 1.507072520    10.10.1.2 → 10.10.1.1    TCP 66 52282 → 8081 [ACK] Seq=222 Ack=222 Win=64256 Len=0 TSval=1045126846 TSecr=3169386555
1711546524.251649141   191 1.511889570    10.10.1.2 → 10.10.1.1    TCP 83 52282 → 8081 [PSH, ACK] Seq=222 Ack=222 Win=64256 Len=17 TSval=1045126851 TSecr=3169386555
1711546527.251649141   194 1.512010021    10.10.1.1 → 10.10.1.2    TCP 83 8081 → 52282 [PSH, ACK] Seq=222 Ack=239 Win=65152 Len=17 TSval=3169386560 TSecr=1045126851
1711546534.251649141   201 1.556181557    10.10.1.2 → 10.10.1.1    TCP 66 52282 → 8081 [ACK] Seq=239 Ack=239 Win=64256 Len=0 TSval=1045126896 TSecr=3169386560
1711546536.251649141   203 1.631671941    10.10.1.2 → 10.10.1.1    TCP 83 52282 → 8081 [PSH, ACK] Seq=239 Ack=239 Win=64256 Len=17 TSval=1045126971 TSecr=3169386560
1711546539.251649141   206 1.631796505    10.10.1.1 → 10.10.1.2    TCP 83 8081 → 52282 [PSH, ACK] Seq=239 Ack=256 Win=65152 Len=17 TSval=3169386679 TSecr=1045126971
1711546540.251649141   207 1.631834766    10.10.1.2 → 10.10.1.1    TCP 66 52282 → 8081 [ACK] Seq=256 Ack=256 Win=64256 Len=0 TSval=1045126971 TSecr=3169386679
1711546547.251649141   214 1.633273258    10.10.1.2 → 10.10.1.1    TCP 83 52282 → 8081 [PSH, ACK] Seq=256 Ack=256 Win=64256 Len=17 TSval=1045126973 TSecr=3169386679
1711546550.251649141   217 1.633392899    10.10.1.1 → 10.10.1.2    TCP 83 8081 → 52282 [PSH, ACK] Seq=256 Ack=273 Win=65152 Len=17 TSval=3169386681 TSecr=1045126973
1711546557.251649141   224 1.666185064    10.10.1.2 → 10.10.1.1    TCP 83 52282 → 8081 [PSH, ACK] Seq=273 Ack=273 Win=64256 Len=17 TSval=1045127006 TSecr=3169386681
1711546560.251649141   227 1.666324592    10.10.1.1 → 10.10.1.2    TCP 83 8081 → 52282 [PSH, ACK] Seq=273 Ack=290 Win=65152 Len=17 TSval=3169386714 TSecr=1045127006
1711546568.251649141   235 1.709971010    10.10.1.2 → 10.10.1.1    TCP 83 52282 → 8081 [PSH, ACK] Seq=290 Ack=290 Win=64256 Len=17 TSval=1045127049 TSecr=3169386714
1711546570.251649141   237 1.710055912    10.10.1.1 → 10.10.1.2    TCP 83 8081 → 52282 [PSH, ACK] Seq=290 Ack=307 Win=65152 Len=17 TSval=3169386758 TSecr=1045127049
1711546578.251649141   245 1.754476622    10.10.1.2 → 10.10.1.1    TCP 83 52282 → 8081 [PSH, ACK] Seq=307 Ack=307 Win=64256 Len=17 TSval=1045127094 TSecr=3169386758
1711546581.251649141   248 1.754605881    10.10.1.1 → 10.10.1.2    TCP 83 8081 → 52282 [PSH, ACK] Seq=307 Ack=324 Win=65152 Len=17 TSval=3169386802 TSecr=1045127094
1711546588.251649141   255 1.796185584    10.10.1.2 → 10.10.1.1    TCP 66 52282 → 8081 [ACK] Seq=324 Ack=324 Win=64256 Len=0 TSval=1045127136 TSecr=3169386802
1711546590.251649141   257 1.907015848    10.10.1.2 → 10.10.1.1    TCP 83 52282 → 8081 [PSH, ACK] Seq=324 Ack=324 Win=64256 Len=17 TSval=1045127246 TSecr=3169386802
1711546593.251649141   260 1.907140410    10.10.1.1 → 10.10.1.2    TCP 83 8081 → 52282 [PSH, ACK] Seq=324 Ack=341 Win=65152 Len=17 TSval=3169386955 TSecr=1045127246
1711546594.251649141   261 1.907178911    10.10.1.2 → 10.10.1.1    TCP 66 52282 → 8081 [ACK] Seq=341 Ack=341 Win=64256 Len=0 TSval=1045127247 TSecr=3169386955
1711546602.251649141   269 1.989768788    10.10.1.2 → 10.10.1.1    TCP 83 52282 → 8081 [PSH, ACK] Seq=341 Ack=341 Win=64256 Len=17 TSval=1045127329 TSecr=3169386955
1711546605.251649141   272 1.989903217    10.10.1.1 → 10.10.1.2    TCP 83 8081 → 52282 [PSH, ACK] Seq=341 Ack=358 Win=65152 Len=17 TSval=3169387038 TSecr=1045127329
1711546606.251649141   273 1.989939959    10.10.1.2 → 10.10.1.1    TCP 66 52282 → 8081 [ACK] Seq=358 Ack=358 Win=64256 Len=0 TSval=1045127329 TSecr=3169387038
1711546614.251649141   281 2.042513037    10.10.1.2 → 10.10.1.1    TCP 83 52282 → 8081 [PSH, ACK] Seq=358 Ack=358 Win=64256 Len=17 TSval=1045127382 TSecr=3169387038
1711546617.251649141   284 2.042637764    10.10.1.1 → 10.10.1.2    TCP 83 8081 → 52282 [PSH, ACK] Seq=358 Ack=375 Win=65152 Len=17 TSval=3169387090 TSecr=1045127382
1711546618.251649141   285 2.042674639    10.10.1.2 → 10.10.1.1    TCP 66 52282 → 8081 [ACK] Seq=375 Ack=375 Win=64256 Len=0 TSval=1045127382 TSecr=3169387090
1711546625.251649141   292 2.065482004    10.10.1.2 → 10.10.1.1    TCP 83 52282 → 8081 [PSH, ACK] Seq=375 Ack=375 Win=64256 Len=17 TSval=1045127405 TSecr=3169387090
1711546628.251649141   295 2.065607718    10.10.1.1 → 10.10.1.2    TCP 83 8081 → 52282 [PSH, ACK] Seq=375 Ack=392 Win=65152 Len=17 TSval=3169387113 TSecr=1045127405
1711546635.251649141   302 2.078661149    10.10.1.2 → 10.10.1.1    TCP 83 52282 → 8081 [PSH, ACK] Seq=392 Ack=392 Win=64256 Len=17 TSval=1045127418 TSecr=3169387113
1711546638.251649141   305 2.078792306    10.10.1.1 → 10.10.1.2    TCP 83 8081 → 52282 [PSH, ACK] Seq=392 Ack=409 Win=65152 Len=17 TSval=3169387126 TSecr=1045127418
1711546646.251649141   313 2.124195086    10.10.1.2 → 10.10.1.1    TCP 66 52282 → 8081 [ACK] Seq=409 Ack=409 Win=64256 Len=0 TSval=1045127464 TSecr=3169387126
1711546647.251649141   314 2.262415246    10.10.1.2 → 10.10.1.1    TCP 83 52282 → 8081 [PSH, ACK] Seq=409 Ack=409 Win=64256 Len=17 TSval=1045127602 TSecr=3169387126
1711546650.251649141   317 2.262549163    10.10.1.1 → 10.10.1.2    TCP 83 8081 → 52282 [PSH, ACK] Seq=409 Ack=426 Win=65152 Len=17 TSval=3169387310 TSecr=1045127602
1711546651.251649141   318 2.262586066    10.10.1.2 → 10.10.1.1    TCP 66 52282 → 8081 [ACK] Seq=426 Ack=426 Win=64256 Len=0 TSval=1045127602 TSecr=3169387310
1711546658.251649141   325 2.271052696    10.10.1.2 → 10.10.1.1    TCP 83 52282 → 8081 [PSH, ACK] Seq=426 Ack=426 Win=64256 Len=17 TSval=1045127610 TSecr=3169387310
1711546661.251649141   328 2.271176187    10.10.1.1 → 10.10.1.2    TCP 83 8081 → 52282 [PSH, ACK] Seq=426 Ack=443 Win=65152 Len=17 TSval=3169387319 TSecr=1045127610
1711546669.251649141   336 2.281221950    10.10.1.2 → 10.10.1.1    TCP 83 52282 → 8081 [PSH, ACK] Seq=443 Ack=443 Win=64256 Len=17 TSval=1045127621 TSecr=3169387319
1711546671.251649141   338 2.281349896    10.10.1.1 → 10.10.1.2    TCP 83 8081 → 52282 [PSH, ACK] Seq=443 Ack=460 Win=65152 Len=17 TSval=3169387329 TSecr=1045127621
1711546678.251649141   345 2.328186918    10.10.1.2 → 10.10.1.1    TCP 66 52282 → 8081 [ACK] Seq=460 Ack=460 Win=64256 Len=0 TSval=1045127668 TSecr=3169387329
1711546680.251649141   347 2.382582859    10.10.1.2 → 10.10.1.1    TCP 83 52282 → 8081 [PSH, ACK] Seq=460 Ack=460 Win=64256 Len=17 TSval=1045127722 TSecr=3169387329
1711546683.251649141   350 2.382708741    10.10.1.1 → 10.10.1.2    TCP 83 8081 → 52282 [PSH, ACK] Seq=460 Ack=477 Win=65152 Len=17 TSval=3169387430 TSecr=1045127722
1711546684.251649141   351 2.382745002    10.10.1.2 → 10.10.1.1    TCP 66 52282 → 8081 [ACK] Seq=477 Ack=477 Win=64256 Len=0 TSval=1045127722 TSecr=3169387430
1711546692.251649141   359 2.497659241    10.10.1.2 → 10.10.1.1    TCP 83 52282 → 8081 [PSH, ACK] Seq=477 Ack=477 Win=64256 Len=17 TSval=1045127837 TSecr=3169387430
1711546695.251649141   362 2.497783558    10.10.1.1 → 10.10.1.2    TCP 83 8081 → 52282 [PSH, ACK] Seq=477 Ack=494 Win=65152 Len=17 TSval=3169387545 TSecr=1045127837
1711546696.251649141   363 2.497819048    10.10.1.2 → 10.10.1.1    TCP 66 52282 → 8081 [ACK] Seq=494 Ack=494 Win=64256 Len=0 TSval=1045127837 TSecr=3169387545
1711546703.251649141   370 2.499743701    10.10.1.2 → 10.10.1.1    TCP 83 52282 → 8081 [PSH, ACK] Seq=494 Ack=494 Win=64256 Len=17 TSval=1045127839 TSecr=3169387545
1711546706.251649141   373 2.499867234    10.10.1.1 → 10.10.1.2    TCP 83 8081 → 52282 [PSH, ACK] Seq=494 Ack=511 Win=65152 Len=17 TSval=3169387548 TSecr=1045127839
1711546713.251649141   380 2.526504538    10.10.1.2 → 10.10.1.1    TCP 83 52282 → 8081 [PSH, ACK] Seq=511 Ack=511 Win=64256 Len=17 TSval=1045127866 TSecr=3169387548
1711546716.251649141   383 2.526633950    10.10.1.1 → 10.10.1.2    TCP 83 8081 → 52282 [PSH, ACK] Seq=511 Ack=528 Win=65152 Len=17 TSval=3169387574 TSecr=1045127866
1711546723.251649141   390 2.572187280    10.10.1.2 → 10.10.1.1    TCP 66 52282 → 8081 [ACK] Seq=528 Ack=528 Win=64256 Len=0 TSval=1045127912 TSecr=3169387574
1711546725.251649141   392 2.694062553    10.10.1.2 → 10.10.1.1    TCP 83 52282 → 8081 [PSH, ACK] Seq=528 Ack=528 Win=64256 Len=17 TSval=1045128033 TSecr=3169387574
1711546728.251649141   395 2.694187877    10.10.1.1 → 10.10.1.2    TCP 83 8081 → 52282 [PSH, ACK] Seq=528 Ack=545 Win=65152 Len=17 TSval=3169387742 TSecr=1045128033
1711546729.251649141   396 2.694225468    10.10.1.2 → 10.10.1.1    TCP 66 52282 → 8081 [ACK] Seq=545 Ack=545 Win=64256 Len=0 TSval=1045128034 TSecr=3169387742
1711546736.251649141   403 2.724547429    10.10.1.2 → 10.10.1.1    TCP 83 52282 → 8081 [PSH, ACK] Seq=545 Ack=545 Win=64256 Len=17 TSval=1045128064 TSecr=3169387742
1711546739.251649141   406 2.724674222    10.10.1.1 → 10.10.1.2    TCP 83 8081 → 52282 [PSH, ACK] Seq=545 Ack=562 Win=65152 Len=17 TSval=3169387772 TSecr=1045128064
1711546747.251649141   414 2.768196121    10.10.1.2 → 10.10.1.1    TCP 66 52282 → 8081 [ACK] Seq=562 Ack=562 Win=64256 Len=0 TSval=1045128108 TSecr=3169387772
1711546748.251649141   415 2.813339570    10.10.1.2 → 10.10.1.1    TCP 83 52282 → 8081 [PSH, ACK] Seq=562 Ack=562 Win=64256 Len=17 TSval=1045128153 TSecr=3169387772
1711546751.251649141   418 2.813464674    10.10.1.1 → 10.10.1.2    TCP 83 8081 → 52282 [PSH, ACK] Seq=562 Ack=579 Win=65152 Len=17 TSval=3169387861 TSecr=1045128153
1711546752.251649141   419 2.813501369    10.10.1.2 → 10.10.1.1    TCP 66 52282 → 8081 [ACK] Seq=579 Ack=579 Win=64256 Len=0 TSval=1045128153 TSecr=3169387861
1711546760.251649141   427 2.908069454    10.10.1.2 → 10.10.1.1    TCP 83 52282 → 8081 [PSH, ACK] Seq=579 Ack=579 Win=64256 Len=17 TSval=1045128247 TSecr=3169387861
1711546763.251649141   430 2.908193807    10.10.1.1 → 10.10.1.2    TCP 83 8081 → 52282 [PSH, ACK] Seq=579 Ack=596 Win=65152 Len=17 TSval=3169387956 TSecr=1045128247
1711546764.251649141   431 2.908230031    10.10.1.2 → 10.10.1.1    TCP 66 52282 → 8081 [ACK] Seq=596 Ack=596 Win=64256 Len=0 TSval=1045128248 TSecr=3169387956
1711546773.251649141   440 3.017027291    10.10.1.2 → 10.10.1.1    TCP 83 52282 → 8081 [PSH, ACK] Seq=596 Ack=596 Win=64256 Len=17 TSval=1045128356 TSecr=3169387956
1711546776.251649141   443 3.017153527    10.10.1.1 → 10.10.1.2    TCP 83 8081 → 52282 [PSH, ACK] Seq=596 Ack=613 Win=65152 Len=17 TSval=3169388065 TSecr=1045128356
1711546777.251649141   444 3.017189522    10.10.1.2 → 10.10.1.1    TCP 66 52282 → 8081 [ACK] Seq=613 Ack=613 Win=64256 Len=0 TSval=1045128357 TSecr=3169388065
1711546784.251649141   451 3.045831623    10.10.1.2 → 10.10.1.1    TCP 83 52282 → 8081 [PSH, ACK] Seq=613 Ack=613 Win=64256 Len=17 TSval=1045128385 TSecr=3169388065
1711546787.251649141   454 3.045954785    10.10.1.1 → 10.10.1.2    TCP 83 8081 → 52282 [PSH, ACK] Seq=613 Ack=630 Win=65152 Len=17 TSval=3169388094 TSecr=1045128385
1711546794.251649141   461 3.088182884    10.10.1.2 → 10.10.1.1    TCP 66 52282 → 8081 [ACK] Seq=630 Ack=630 Win=64256 Len=0 TSval=1045128428 TSecr=3169388094
1711546796.251649141   463 3.337452921    10.10.1.2 → 10.10.1.1    TCP 83 52282 → 8081 [PSH, ACK] Seq=630 Ack=630 Win=64256 Len=17 TSval=1045128677 TSecr=3169388094
1711546799.251649141   466 3.337576761    10.10.1.1 → 10.10.1.2    TCP 83 8081 → 52282 [PSH, ACK] Seq=630 Ack=647 Win=65152 Len=17 TSval=3169388385 TSecr=1045128677
1711546800.251649141   467 3.337614228    10.10.1.2 → 10.10.1.1    TCP 66 52282 → 8081 [ACK] Seq=647 Ack=647 Win=64256 Len=0 TSval=1045128677 TSecr=3169388385
1711546808.251649141   475 3.396508874    10.10.1.2 → 10.10.1.1    TCP 83 52282 → 8081 [PSH, ACK] Seq=647 Ack=647 Win=64256 Len=17 TSval=1045128736 TSecr=3169388385
1711546811.251649141   478 3.396633595    10.10.1.1 → 10.10.1.2    TCP 83 8081 → 52282 [PSH, ACK] Seq=647 Ack=664 Win=65152 Len=17 TSval=3169388444 TSecr=1045128736
1711546812.251649141   479 3.396669676    10.10.1.2 → 10.10.1.1    TCP 66 52282 → 8081 [ACK] Seq=664 Ack=664 Win=64256 Len=0 TSval=1045128736 TSecr=3169388444
1711546820.251649141   487 3.550002099    10.10.1.2 → 10.10.1.1    TCP 83 52282 → 8081 [PSH, ACK] Seq=664 Ack=664 Win=64256 Len=17 TSval=1045128889 TSecr=3169388444
1711546823.251649141   490 3.550127747    10.10.1.1 → 10.10.1.2    TCP 83 8081 → 52282 [PSH, ACK] Seq=664 Ack=681 Win=65152 Len=17 TSval=3169388598 TSecr=1045128889
1711546824.251649141   491 3.550163205    10.10.1.2 → 10.10.1.1    TCP 66 52282 → 8081 [ACK] Seq=681 Ack=681 Win=64256 Len=0 TSval=1045128890 TSecr=3169388598
1711546832.251649141   499 3.631206808    10.10.1.2 → 10.10.1.1    TCP 83 52282 → 8081 [PSH, ACK] Seq=681 Ack=681 Win=64256 Len=17 TSval=1045128971 TSecr=3169388598
1711546835.251649141   502 3.631331807    10.10.1.1 → 10.10.1.2    TCP 83 8081 → 52282 [PSH, ACK] Seq=681 Ack=698 Win=65152 Len=17 TSval=3169388679 TSecr=1045128971
1711546836.251649141   503 3.631367657    10.10.1.2 → 10.10.1.1    TCP 66 52282 → 8081 [ACK] Seq=698 Ack=698 Win=64256 Len=0 TSval=1045128971 TSecr=3169388679
1711546844.251649141   511 3.699064832    10.10.1.2 → 10.10.1.1    TCP 83 52282 → 8081 [PSH, ACK] Seq=698 Ack=698 Win=64256 Len=17 TSval=1045129038 TSecr=3169388679
1711546847.251649141   514 3.699190379    10.10.1.1 → 10.10.1.2    TCP 83 8081 → 52282 [PSH, ACK] Seq=698 Ack=715 Win=65152 Len=17 TSval=3169388747 TSecr=1045129038
1711546848.251649141   515 3.699225520    10.10.1.2 → 10.10.1.1    TCP 66 52282 → 8081 [ACK] Seq=715 Ack=715 Win=64256 Len=0 TSval=1045129039 TSecr=3169388747
1711546856.251649141   523 3.721342072    10.10.1.2 → 10.10.1.1    TCP 83 52282 → 8081 [PSH, ACK] Seq=715 Ack=715 Win=64256 Len=17 TSval=1045129061 TSecr=3169388747
1711546859.251649141   526 3.721467170    10.10.1.1 → 10.10.1.2    TCP 83 8081 → 52282 [PSH, ACK] Seq=715 Ack=732 Win=65152 Len=17 TSval=3169388769 TSecr=1045129061
1711546866.251649141   533 3.755611694    10.10.1.2 → 10.10.1.1    TCP 83 52282 → 8081 [PSH, ACK] Seq=732 Ack=732 Win=64256 Len=17 TSval=1045129095 TSecr=3169388769
1711546869.251649141   536 3.755740823    10.10.1.1 → 10.10.1.2    TCP 83 8081 → 52282 [PSH, ACK] Seq=732 Ack=749 Win=65152 Len=17 TSval=3169388803 TSecr=1045129095
1711546876.251649141   543 3.796184059    10.10.1.2 → 10.10.1.1    TCP 66 52282 → 8081 [ACK] Seq=749 Ack=749 Win=64256 Len=0 TSval=1045129136 TSecr=3169388803
1711546878.251649141   545 3.832787272    10.10.1.2 → 10.10.1.1    TCP 83 52282 → 8081 [PSH, ACK] Seq=749 Ack=749 Win=64256 Len=17 TSval=1045129172 TSecr=3169388803
1711546881.251649141   548 3.832912674    10.10.1.1 → 10.10.1.2    TCP 83 8081 → 52282 [PSH, ACK] Seq=749 Ack=766 Win=65152 Len=17 TSval=3169388881 TSecr=1045129172
1711546882.251649141   549 3.832947923    10.10.1.2 → 10.10.1.1    TCP 66 52282 → 8081 [ACK] Seq=766 Ack=766 Win=64256 Len=0 TSval=1045129172 TSecr=3169388881
1711546890.251649141   557 4.057719400    10.10.1.2 → 10.10.1.1    TCP 83 52282 → 8081 [PSH, ACK] Seq=766 Ack=766 Win=64256 Len=17 TSval=1045129397 TSecr=3169388881
1711546893.251649141   560 4.057861273    10.10.1.1 → 10.10.1.2    TCP 83 8081 → 52282 [PSH, ACK] Seq=766 Ack=783 Win=65152 Len=17 TSval=3169389106 TSecr=1045129397
1711546894.251649141   561 4.057895973    10.10.1.2 → 10.10.1.1    TCP 66 52282 → 8081 [ACK] Seq=783 Ack=783 Win=64256 Len=0 TSval=1045129397 TSecr=3169389106
1711546902.251649141   569 4.093775839    10.10.1.2 → 10.10.1.1    TCP 83 52282 → 8081 [PSH, ACK] Seq=783 Ack=783 Win=64256 Len=17 TSval=1045129433 TSecr=3169389106
1711546905.251649141   572 4.093901626    10.10.1.1 → 10.10.1.2    TCP 83 8081 → 52282 [PSH, ACK] Seq=783 Ack=800 Win=65152 Len=17 TSval=3169389142 TSecr=1045129433
1711546913.251649141   580 4.140180172    10.10.1.2 → 10.10.1.1    TCP 66 52282 → 8081 [ACK] Seq=800 Ack=800 Win=64256 Len=0 TSval=1045129480 TSecr=3169389142
1711546914.251649141   581 4.262432470    10.10.1.2 → 10.10.1.1    TCP 83 52282 → 8081 [PSH, ACK] Seq=800 Ack=800 Win=64256 Len=17 TSval=1045129602 TSecr=3169389142
1711546917.251649141   584 4.262561005    10.10.1.1 → 10.10.1.2    TCP 83 8081 → 52282 [PSH, ACK] Seq=800 Ack=817 Win=65152 Len=17 TSval=3169389310 TSecr=1045129602
1711546918.251649141   585 4.262593849    10.10.1.2 → 10.10.1.1    TCP 66 52282 → 8081 [ACK] Seq=817 Ack=817 Win=64256 Len=0 TSval=1045129602 TSecr=3169389310
1711546926.251649141   593 4.291111286    10.10.1.2 → 10.10.1.1    TCP 83 52282 → 8081 [PSH, ACK] Seq=817 Ack=817 Win=64256 Len=17 TSval=1045129630 TSecr=3169389310
1711546929.251649141   596 4.291235277    10.10.1.1 → 10.10.1.2    TCP 83 8081 → 52282 [PSH, ACK] Seq=817 Ack=834 Win=65152 Len=17 TSval=3169389339 TSecr=1045129630
1711546936.251649141   603 4.336181967    10.10.1.2 → 10.10.1.1    TCP 66 52282 → 8081 [ACK] Seq=834 Ack=834 Win=64256 Len=0 TSval=1045129676 TSecr=3169389339
1711546938.251649141   605 4.398595057    10.10.1.2 → 10.10.1.1    TCP 83 52282 → 8081 [PSH, ACK] Seq=834 Ack=834 Win=64256 Len=17 TSval=1045129738 TSecr=3169389339
1711546941.251649141   608 4.398720897    10.10.1.1 → 10.10.1.2    TCP 83 8081 → 52282 [PSH, ACK] Seq=834 Ack=851 Win=65152 Len=17 TSval=3169389446 TSecr=1045129738
1711546942.251649141   609 4.398756227    10.10.1.2 → 10.10.1.1    TCP 66 52282 → 8081 [ACK] Seq=851 Ack=851 Win=64256 Len=0 TSval=1045129738 TSecr=3169389446
1711546950.251649141   617 4.489566939    10.10.1.2 → 10.10.1.1    TCP 83 52282 → 8081 [PSH, ACK] Seq=851 Ack=851 Win=64256 Len=17 TSval=1045129829 TSecr=3169389446
1711546953.251649141   620 4.489690786    10.10.1.1 → 10.10.1.2    TCP 83 8081 → 52282 [PSH, ACK] Seq=851 Ack=868 Win=65152 Len=17 TSval=3169389537 TSecr=1045129829
1711546954.251649141   621 4.489724694    10.10.1.2 → 10.10.1.1    TCP 66 52282 → 8081 [ACK] Seq=868 Ack=868 Win=64256 Len=0 TSval=1045129829 TSecr=3169389537
1711546962.251649141   629 4.654991251    10.10.1.2 → 10.10.1.1    TCP 83 52282 → 8081 [PSH, ACK] Seq=868 Ack=868 Win=64256 Len=17 TSval=1045129994 TSecr=3169389537
1711546964.251649141   631 4.655117768    10.10.1.1 → 10.10.1.2    TCP 83 8081 → 52282 [PSH, ACK] Seq=868 Ack=885 Win=65152 Len=17 TSval=3169389703 TSecr=1045129994
1711546966.251649141   633 4.655153525    10.10.1.2 → 10.10.1.1    TCP 66 52282 → 8081 [ACK] Seq=885 Ack=885 Win=64256 Len=0 TSval=1045129995 TSecr=3169389703
1711546974.251649141   641 4.662084854    10.10.1.2 → 10.10.1.1    TCP 83 52282 → 8081 [PSH, ACK] Seq=885 Ack=885 Win=64256 Len=17 TSval=1045130001 TSecr=3169389703
1711546976.251649141   643 4.662160356    10.10.1.1 → 10.10.1.2    TCP 83 8081 → 52282 [PSH, ACK] Seq=885 Ack=902 Win=65152 Len=17 TSval=3169389710 TSecr=1045130001
1711546984.251649141   651 4.704181030    10.10.1.2 → 10.10.1.1    TCP 66 52282 → 8081 [ACK] Seq=902 Ack=902 Win=64256 Len=0 TSval=1045130044 TSecr=3169389710
1711546986.251649141   653 4.822521941    10.10.1.2 → 10.10.1.1    TCP 83 52282 → 8081 [PSH, ACK] Seq=902 Ack=902 Win=64256 Len=17 TSval=1045130162 TSecr=3169389710
1711546988.251649141   655 4.822647013    10.10.1.1 → 10.10.1.2    TCP 83 8081 → 52282 [PSH, ACK] Seq=902 Ack=919 Win=65152 Len=17 TSval=3169389870 TSecr=1045130162
1711546990.251649141   657 4.822683704    10.10.1.2 → 10.10.1.1    TCP 66 52282 → 8081 [ACK] Seq=919 Ack=919 Win=64256 Len=0 TSval=1045130162 TSecr=3169389870
1711546999.251649141   666 5.086760827    10.10.1.2 → 10.10.1.1    TCP 83 52282 → 8081 [PSH, ACK] Seq=919 Ack=919 Win=64256 Len=17 TSval=1045130426 TSecr=3169389870
1711547002.251649141   669 5.086881842    10.10.1.1 → 10.10.1.2    TCP 83 8081 → 52282 [PSH, ACK] Seq=919 Ack=936 Win=65152 Len=17 TSval=3169390135 TSecr=1045130426
1711547003.251649141   670 5.086915413    10.10.1.2 → 10.10.1.1    TCP 66 52282 → 8081 [ACK] Seq=936 Ack=936 Win=64256 Len=0 TSval=1045130426 TSecr=3169390135
1711547011.251649141   678 5.323026588    10.10.1.2 → 10.10.1.1    TCP 83 52282 → 8081 [PSH, ACK] Seq=936 Ack=936 Win=64256 Len=17 TSval=1045130662 TSecr=3169390135
1711547014.251649141   681 5.323147461    10.10.1.1 → 10.10.1.2    TCP 83 8081 → 52282 [PSH, ACK] Seq=936 Ack=953 Win=65152 Len=17 TSval=3169390371 TSecr=1045130662
1711547015.251649141   682 5.323181205    10.10.1.2 → 10.10.1.1    TCP 66 52282 → 8081 [ACK] Seq=953 Ack=953 Win=64256 Len=0 TSval=1045130663 TSecr=3169390371
1711547023.251649141   690 5.533638905    10.10.1.2 → 10.10.1.1    TCP 83 52282 → 8081 [PSH, ACK] Seq=953 Ack=953 Win=64256 Len=17 TSval=1045130873 TSecr=3169390371
1711547026.251649141   693 5.533843841    10.10.1.1 → 10.10.1.2    TCP 83 8081 → 52282 [PSH, ACK] Seq=953 Ack=970 Win=65152 Len=17 TSval=3169390582 TSecr=1045130873
1711547027.251649141   694 5.533880012    10.10.1.2 → 10.10.1.1    TCP 66 52282 → 8081 [ACK] Seq=970 Ack=970 Win=64256 Len=0 TSval=1045130873 TSecr=3169390582
1711547035.251649141   702 5.536306523    10.10.1.2 → 10.10.1.1    TCP 83 52282 → 8081 [PSH, ACK] Seq=970 Ack=970 Win=64256 Len=17 TSval=1045130876 TSecr=3169390582
1711547038.251649141   705 5.536429633    10.10.1.1 → 10.10.1.2    TCP 83 8081 → 52282 [PSH, ACK] Seq=970 Ack=987 Win=65152 Len=17 TSval=3169390584 TSecr=1045130876
1711547045.251649141   712 5.584184305    10.10.1.2 → 10.10.1.1    TCP 66 52282 → 8081 [ACK] Seq=987 Ack=987 Win=64256 Len=0 TSval=1045130924 TSecr=3169390584
1711547047.251649141   714 5.614591851    10.10.1.2 → 10.10.1.1    TCP 83 52282 → 8081 [PSH, ACK] Seq=987 Ack=987 Win=64256 Len=17 TSval=1045130954 TSecr=3169390584
1711547050.251649141   717 5.614716786    10.10.1.1 → 10.10.1.2    TCP 83 8081 → 52282 [PSH, ACK] Seq=987 Ack=1004 Win=65152 Len=17 TSval=3169390662 TSecr=1045130954
1711547051.251649141   718 5.614752797    10.10.1.2 → 10.10.1.1    TCP 66 52282 → 8081 [ACK] Seq=1004 Ack=1004 Win=64256 Len=0 TSval=1045130954 TSecr=3169390662
1711547059.251649141   726 5.697117073    10.10.1.2 → 10.10.1.1    TCP 83 52282 → 8081 [PSH, ACK] Seq=1004 Ack=1004 Win=64256 Len=17 TSval=1045131036 TSecr=3169390662
1711547062.251649141   729 5.697242475    10.10.1.1 → 10.10.1.2    TCP 83 8081 → 52282 [PSH, ACK] Seq=1004 Ack=1021 Win=65152 Len=17 TSval=3169390745 TSecr=1045131036
1711547063.251649141   730 5.697279510    10.10.1.2 → 10.10.1.1    TCP 66 52282 → 8081 [ACK] Seq=1021 Ack=1021 Win=64256 Len=0 TSval=1045131037 TSecr=3169390745
1711547071.251649141   738 5.701482691    10.10.1.2 → 10.10.1.1    TCP 83 52282 → 8081 [PSH, ACK] Seq=1021 Ack=1021 Win=64256 Len=17 TSval=1045131041 TSecr=3169390745
1711547074.251649141   741 5.701606103    10.10.1.1 → 10.10.1.2    TCP 83 8081 → 52282 [PSH, ACK] Seq=1021 Ack=1038 Win=65152 Len=17 TSval=3169390749 TSecr=1045131041
1711547081.251649141   748 5.748185757    10.10.1.2 → 10.10.1.1    TCP 66 52282 → 8081 [ACK] Seq=1038 Ack=1038 Win=64256 Len=0 TSval=1045131088 TSecr=3169390749
1711547083.251649141   750 5.850347039    10.10.1.2 → 10.10.1.1    TCP 83 52282 → 8081 [PSH, ACK] Seq=1038 Ack=1038 Win=64256 Len=17 TSval=1045131190 TSecr=3169390749
1711547085.251649141   752 5.850471899    10.10.1.1 → 10.10.1.2    TCP 83 8081 → 52282 [PSH, ACK] Seq=1038 Ack=1055 Win=65152 Len=17 TSval=3169390898 TSecr=1045131190
1711547087.251649141   754 5.850511016    10.10.1.2 → 10.10.1.1    TCP 66 52282 → 8081 [ACK] Seq=1055 Ack=1055 Win=64256 Len=0 TSval=1045131190 TSecr=3169390898
1711547095.251649141   762 5.897293955    10.10.1.2 → 10.10.1.1    TCP 83 52282 → 8081 [PSH, ACK] Seq=1055 Ack=1055 Win=64256 Len=17 TSval=1045131237 TSecr=3169390898
1711547098.251649141   765 5.897418138    10.10.1.1 → 10.10.1.2    TCP 83 8081 → 52282 [PSH, ACK] Seq=1055 Ack=1072 Win=65152 Len=17 TSval=3169390945 TSecr=1045131237
1711547099.251649141   766 5.897453612    10.10.1.2 → 10.10.1.1    TCP 66 52282 → 8081 [ACK] Seq=1072 Ack=1072 Win=64256 Len=0 TSval=1045131237 TSecr=3169390945
1711547107.251649141   774 5.933252912    10.10.1.2 → 10.10.1.1    TCP 83 52282 → 8081 [PSH, ACK] Seq=1072 Ack=1072 Win=64256 Len=17 TSval=1045131273 TSecr=3169390945
1711547110.251649141   777 5.933378394    10.10.1.1 → 10.10.1.2    TCP 83 8081 → 52282 [PSH, ACK] Seq=1072 Ack=1089 Win=65152 Len=17 TSval=3169390981 TSecr=1045131273
1711547117.251649141   784 5.978319562    10.10.1.2 → 10.10.1.1    TCP 83 52282 → 8081 [PSH, ACK] Seq=1089 Ack=1089 Win=64256 Len=17 TSval=1045131318 TSecr=3169390981
1711547120.251649141   787 5.978450390    10.10.1.1 → 10.10.1.2    TCP 83 8081 → 52282 [PSH, ACK] Seq=1089 Ack=1106 Win=65152 Len=17 TSval=3169391026 TSecr=1045131318
1711547128.251649141   795 6.020198326    10.10.1.2 → 10.10.1.1    TCP 66 52282 → 8081 [ACK] Seq=1106 Ack=1106 Win=64256 Len=0 TSval=1045131360 TSecr=3169391026
1711547129.251649141   796 6.388472201    10.10.1.2 → 10.10.1.1    TCP 83 52282 → 8081 [PSH, ACK] Seq=1106 Ack=1106 Win=64256 Len=17 TSval=1045131728 TSecr=3169391026
1711547132.251649141   799 6.388595391    10.10.1.1 → 10.10.1.2    TCP 83 8081 → 52282 [PSH, ACK] Seq=1106 Ack=1123 Win=65152 Len=17 TSval=3169391436 TSecr=1045131728
1711547133.251649141   800 6.388630243    10.10.1.2 → 10.10.1.1    TCP 66 52282 → 8081 [ACK] Seq=1123 Ack=1123 Win=64256 Len=0 TSval=1045131728 TSecr=3169391436
1711547141.251649141   808 6.716195168    10.10.1.2 → 10.10.1.1    TCP 83 52282 → 8081 [PSH, ACK] Seq=1123 Ack=1123 Win=64256 Len=17 TSval=1045132056 TSecr=3169391436
1711547144.251649141   811 6.716317513    10.10.1.1 → 10.10.1.2    TCP 83 8081 → 52282 [PSH, ACK] Seq=1123 Ack=1140 Win=65152 Len=17 TSval=3169391764 TSecr=1045132056
1711547145.251649141   812 6.716354141    10.10.1.2 → 10.10.1.1    TCP 66 52282 → 8081 [ACK] Seq=1140 Ack=1140 Win=64256 Len=0 TSval=1045132056 TSecr=3169391764
1711547153.251649141   820 6.810258590    10.10.1.2 → 10.10.1.1    TCP 83 52282 → 8081 [PSH, ACK] Seq=1140 Ack=1140 Win=64256 Len=17 TSval=1045132150 TSecr=3169391764
1711547156.251649141   823 6.810388409    10.10.1.1 → 10.10.1.2    TCP 83 8081 → 52282 [PSH, ACK] Seq=1140 Ack=1157 Win=65152 Len=17 TSval=3169391858 TSecr=1045132150
1711547157.251649141   824 6.810424053    10.10.1.2 → 10.10.1.1    TCP 66 52282 → 8081 [ACK] Seq=1157 Ack=1157 Win=64256 Len=0 TSval=1045132150 TSecr=3169391858
1711547166.251649141   833 7.075213987    10.10.1.2 → 10.10.1.1    TCP 83 52282 → 8081 [PSH, ACK] Seq=1157 Ack=1157 Win=64256 Len=17 TSval=1045132415 TSecr=3169391858
1711547169.251649141   836 7.075334918    10.10.1.1 → 10.10.1.2    TCP 83 8081 → 52282 [PSH, ACK] Seq=1157 Ack=1174 Win=65152 Len=17 TSval=3169392123 TSecr=1045132415
1711547170.251649141   837 7.075371589    10.10.1.2 → 10.10.1.1    TCP 66 52282 → 8081 [ACK] Seq=1174 Ack=1174 Win=64256 Len=0 TSval=1045132415 TSecr=3169392123
1711547178.251649141   845 7.127677065    10.10.1.2 → 10.10.1.1    TCP 83 52282 → 8081 [PSH, ACK] Seq=1174 Ack=1174 Win=64256 Len=17 TSval=1045132467 TSecr=3169392123
1711547181.251649141   848 7.127800961    10.10.1.1 → 10.10.1.2    TCP 83 8081 → 52282 [PSH, ACK] Seq=1174 Ack=1191 Win=65152 Len=17 TSval=3169392175 TSecr=1045132467
1711547182.251649141   849 7.127837008    10.10.1.2 → 10.10.1.1    TCP 66 52282 → 8081 [ACK] Seq=1191 Ack=1191 Win=64256 Len=0 TSval=1045132467 TSecr=3169392175
1711547190.251649141   857 7.177788338    10.10.1.2 → 10.10.1.1    TCP 83 52282 → 8081 [PSH, ACK] Seq=1191 Ack=1191 Win=64256 Len=17 TSval=1045132517 TSecr=3169392175
1711547193.251649141   860 7.177914872    10.10.1.1 → 10.10.1.2    TCP 83 8081 → 52282 [PSH, ACK] Seq=1191 Ack=1208 Win=65152 Len=17 TSval=3169392226 TSecr=1045132517
1711547194.251649141   861 7.177950949    10.10.1.2 → 10.10.1.1    TCP 66 52282 → 8081 [ACK] Seq=1208 Ack=1208 Win=64256 Len=0 TSval=1045132517 TSecr=3169392226
1711547202.251649141   869 7.244220516    10.10.1.2 → 10.10.1.1    TCP 83 52282 → 8081 [PSH, ACK] Seq=1208 Ack=1208 Win=64256 Len=17 TSval=1045132584 TSecr=3169392226
1711547205.251649141   872 7.244345733    10.10.1.1 → 10.10.1.2    TCP 83 8081 → 52282 [PSH, ACK] Seq=1208 Ack=1225 Win=65152 Len=17 TSval=3169392292 TSecr=1045132584
1711547206.251649141   873 7.244381655    10.10.1.2 → 10.10.1.1    TCP 66 52282 → 8081 [ACK] Seq=1225 Ack=1225 Win=64256 Len=0 TSval=1045132584 TSecr=3169392292
1711547214.251649141   881 7.472006774    10.10.1.2 → 10.10.1.1    TCP 83 52282 → 8081 [PSH, ACK] Seq=1225 Ack=1225 Win=64256 Len=17 TSval=1045132811 TSecr=3169392292
1711547217.251649141   884 7.472127950    10.10.1.1 → 10.10.1.2    TCP 83 8081 → 52282 [PSH, ACK] Seq=1225 Ack=1242 Win=65152 Len=17 TSval=3169392520 TSecr=1045132811
1711547218.251649141   885 7.472161099    10.10.1.2 → 10.10.1.1    TCP 66 52282 → 8081 [ACK] Seq=1242 Ack=1242 Win=64256 Len=0 TSval=1045132812 TSecr=3169392520
1711547226.251649141   893 7.561267049    10.10.1.2 → 10.10.1.1    TCP 83 52282 → 8081 [PSH, ACK] Seq=1242 Ack=1242 Win=64256 Len=17 TSval=1045132901 TSecr=3169392520
1711547229.251649141   896 7.561392567    10.10.1.1 → 10.10.1.2    TCP 83 8081 → 52282 [PSH, ACK] Seq=1242 Ack=1259 Win=65152 Len=17 TSval=3169392609 TSecr=1045132901
1711547230.251649141   897 7.561425678    10.10.1.2 → 10.10.1.1    TCP 66 52282 → 8081 [ACK] Seq=1259 Ack=1259 Win=64256 Len=0 TSval=1045132901 TSecr=3169392609
1711547238.251649141   905 7.709141975    10.10.1.2 → 10.10.1.1    TCP 83 52282 → 8081 [PSH, ACK] Seq=1259 Ack=1259 Win=64256 Len=17 TSval=1045133048 TSecr=3169392609
1711547241.251649141   908 7.709268314    10.10.1.1 → 10.10.1.2    TCP 83 8081 → 52282 [PSH, ACK] Seq=1259 Ack=1276 Win=65152 Len=17 TSval=3169392757 TSecr=1045133048
1711547242.251649141   909 7.709301334    10.10.1.2 → 10.10.1.1    TCP 66 52282 → 8081 [ACK] Seq=1276 Ack=1276 Win=64256 Len=0 TSval=1045133049 TSecr=3169392757
1711547250.251649141   917 7.766286745    10.10.1.2 → 10.10.1.1    TCP 83 52282 → 8081 [PSH, ACK] Seq=1276 Ack=1276 Win=64256 Len=17 TSval=1045133106 TSecr=3169392757
1711547253.251649141   920 7.766412123    10.10.1.1 → 10.10.1.2    TCP 83 8081 → 52282 [PSH, ACK] Seq=1276 Ack=1293 Win=65152 Len=17 TSval=3169392814 TSecr=1045133106
1711547254.251649141   921 7.766446228    10.10.1.2 → 10.10.1.1    TCP 66 52282 → 8081 [ACK] Seq=1293 Ack=1293 Win=64256 Len=0 TSval=1045133106 TSecr=3169392814
1711547262.251649141   929 7.832635111    10.10.1.2 → 10.10.1.1    TCP 83 52282 → 8081 [PSH, ACK] Seq=1293 Ack=1293 Win=64256 Len=17 TSval=1045133172 TSecr=3169392814
1711547265.251649141   932 7.832759399    10.10.1.1 → 10.10.1.2    TCP 83 8081 → 52282 [PSH, ACK] Seq=1293 Ack=1310 Win=65152 Len=17 TSval=3169392880 TSecr=1045133172
1711547266.251649141   933 7.832792876    10.10.1.2 → 10.10.1.1    TCP 66 52282 → 8081 [ACK] Seq=1310 Ack=1310 Win=64256 Len=0 TSval=1045133172 TSecr=3169392880
1711547274.251649141   941 7.840398591    10.10.1.2 → 10.10.1.1    TCP 83 52282 → 8081 [PSH, ACK] Seq=1310 Ack=1310 Win=64256 Len=17 TSval=1045133180 TSecr=3169392880
1711547277.251649141   944 7.840523813    10.10.1.1 → 10.10.1.2    TCP 83 8081 → 52282 [PSH, ACK] Seq=1310 Ack=1327 Win=65152 Len=17 TSval=3169392888 TSecr=1045133180
1711547284.251649141   951 7.869181956    10.10.1.2 → 10.10.1.1    TCP 83 52282 → 8081 [PSH, ACK] Seq=1327 Ack=1327 Win=64256 Len=17 TSval=1045133209 TSecr=3169392888
1711547286.251649141   953 7.869321865    10.10.1.1 → 10.10.1.2    TCP 83 8081 → 52282 [PSH, ACK] Seq=1327 Ack=1344 Win=65152 Len=17 TSval=3169392917 TSecr=1045133209
1711547295.251649141   962 7.916186045    10.10.1.2 → 10.10.1.1    TCP 66 52282 → 8081 [ACK] Seq=1344 Ack=1344 Win=64256 Len=0 TSval=1045133256 TSecr=3169392917
1711547296.251649141   963 8.000441655    10.10.1.2 → 10.10.1.1    TCP 83 52282 → 8081 [PSH, ACK] Seq=1344 Ack=1344 Win=64256 Len=17 TSval=1045133340 TSecr=3169392917
1711547298.251649141   965 8.000566857    10.10.1.1 → 10.10.1.2    TCP 83 8081 → 52282 [PSH, ACK] Seq=1344 Ack=1361 Win=65152 Len=17 TSval=3169393048 TSecr=1045133340
1711547300.251649141   967 8.000603112    10.10.1.2 → 10.10.1.1    TCP 66 52282 → 8081 [ACK] Seq=1361 Ack=1361 Win=64256 Len=0 TSval=1045133340 TSecr=3169393048
1711547308.251649141   975 8.131344513    10.10.1.2 → 10.10.1.1    TCP 83 52282 → 8081 [PSH, ACK] Seq=1361 Ack=1361 Win=64256 Len=17 TSval=1045133471 TSecr=3169393048
1711547310.251649141   977 8.131469970    10.10.1.1 → 10.10.1.2    TCP 83 8081 → 52282 [PSH, ACK] Seq=1361 Ack=1378 Win=65152 Len=17 TSval=3169393179 TSecr=1045133471
1711547312.251649141   979 8.131505072    10.10.1.2 → 10.10.1.1    TCP 66 52282 → 8081 [ACK] Seq=1378 Ack=1378 Win=64256 Len=0 TSval=1045133471 TSecr=3169393179
1711547320.251649141   987 8.317134882    10.10.1.2 → 10.10.1.1    TCP 83 52282 → 8081 [PSH, ACK] Seq=1378 Ack=1378 Win=64256 Len=17 TSval=1045133656 TSecr=3169393179
1711547323.251649141   990 8.317260141    10.10.1.1 → 10.10.1.2    TCP 83 8081 → 52282 [PSH, ACK] Seq=1378 Ack=1395 Win=65152 Len=17 TSval=3169393365 TSecr=1045133656
1711547324.251649141   991 8.317297497    10.10.1.2 → 10.10.1.1    TCP 66 52282 → 8081 [ACK] Seq=1395 Ack=1395 Win=64256 Len=0 TSval=1045133657 TSecr=3169393365
1711547332.251649141   999 8.394705687    10.10.1.2 → 10.10.1.1    TCP 83 52282 → 8081 [PSH, ACK] Seq=1395 Ack=1395 Win=64256 Len=17 TSval=1045133734 TSecr=3169393365
1711547335.251649141  1002 8.394830260    10.10.1.1 → 10.10.1.2    TCP 83 8081 → 52282 [PSH, ACK] Seq=1395 Ack=1412 Win=65152 Len=17 TSval=3169393443 TSecr=1045133734
1711547336.251649141  1003 8.394867857    10.10.1.2 → 10.10.1.1    TCP 66 52282 → 8081 [ACK] Seq=1412 Ack=1412 Win=64256 Len=0 TSval=1045133734 TSecr=3169393443
