1711548318.359918833    22 0.269839041    10.10.1.2 → 10.10.1.1    TCP 74 57850 → 8081 [SYN] Seq=0 Win=64240 Len=0 MSS=1460 SACK_PERM=1 TSval=1047088648 TSecr=0 WS=128
1711548319.359918833    23 0.269870973    10.10.1.1 → 10.10.1.2    TCP 74 8081 → 57850 [SYN, ACK] Seq=0 Ack=1 Win=65160 Len=0 MSS=1460 SACK_PERM=1 TSval=3171348358 TSecr=1047088648 WS=128
1711548320.359918833    24 0.269906742    10.10.1.2 → 10.10.1.1    TCP 66 57850 → 8081 [ACK] Seq=1 Ack=1 Win=64256 Len=0 TSval=1047088648 TSecr=3171348358
1711548336.359918833    40 0.521972288    10.10.1.2 → 10.10.1.1    TCP 83 57850 → 8081 [PSH, ACK] Seq=1 Ack=1 Win=64256 Len=17 TSval=1047088900 TSecr=3171348358
1711548338.359918833    42 0.521993267    10.10.1.1 → 10.10.1.2    TCP 66 8081 → 57850 [ACK] Seq=1 Ack=18 Win=65152 Len=0 TSval=3171348610 TSecr=1047088900
1711548340.359918833    44 0.522183228    10.10.1.1 → 10.10.1.2    TCP 83 8081 → 57850 [PSH, ACK] Seq=1 Ack=18 Win=65152 Len=17 TSval=3171348610 TSecr=1047088900
1711548341.359918833    45 0.522208224    10.10.1.2 → 10.10.1.1    TCP 66 57850 → 8081 [ACK] Seq=18 Ack=18 Win=64256 Len=0 TSval=1047088900 TSecr=3171348610
1711548346.359918833    50 0.523340047    10.10.1.2 → 10.10.1.1    TCP 83 57850 → 8081 [PSH, ACK] Seq=18 Ack=18 Win=64256 Len=17 TSval=1047088901 TSecr=3171348610
1711548349.359918833    53 0.523376367    10.10.1.1 → 10.10.1.2    TCP 83 8081 → 57850 [PSH, ACK] Seq=18 Ack=35 Win=65152 Len=17 TSval=3171348612 TSecr=1047088901
1711548354.359918833    58 0.524531342    10.10.1.2 → 10.10.1.1    TCP 83 57850 → 8081 [PSH, ACK] Seq=35 Ack=35 Win=64256 Len=17 TSval=1047088902 TSecr=3171348612
1711548357.359918833    61 0.524562726    10.10.1.1 → 10.10.1.2    TCP 83 8081 → 57850 [PSH, ACK] Seq=35 Ack=52 Win=65152 Len=17 TSval=3171348613 TSecr=1047088902
1711548362.359918833    66 0.525713516    10.10.1.2 → 10.10.1.1    TCP 83 57850 → 8081 [PSH, ACK] Seq=52 Ack=52 Win=64256 Len=17 TSval=1047088903 TSecr=3171348613
1711548365.359918833    69 0.525747913    10.10.1.1 → 10.10.1.2    TCP 83 8081 → 57850 [PSH, ACK] Seq=52 Ack=69 Win=65152 Len=17 TSval=3171348614 TSecr=1047088903
1711548370.359918833    74 0.526899031    10.10.1.2 → 10.10.1.1    TCP 83 57850 → 8081 [PSH, ACK] Seq=69 Ack=69 Win=64256 Len=17 TSval=1047088905 TSecr=3171348614
1711548373.359918833    77 0.526929538    10.10.1.1 → 10.10.1.2    TCP 83 8081 → 57850 [PSH, ACK] Seq=69 Ack=86 Win=65152 Len=17 TSval=3171348615 TSecr=1047088905
1711548378.359918833    82 0.528084442    10.10.1.2 → 10.10.1.1    TCP 83 57850 → 8081 [PSH, ACK] Seq=86 Ack=86 Win=64256 Len=17 TSval=1047088906 TSecr=3171348615
1711548380.359918833    84 0.528113884    10.10.1.1 → 10.10.1.2    TCP 83 8081 → 57850 [PSH, ACK] Seq=86 Ack=103 Win=65152 Len=17 TSval=3171348616 TSecr=1047088906
1711548386.359918833    90 0.529263439    10.10.1.2 → 10.10.1.1    TCP 83 57850 → 8081 [PSH, ACK] Seq=103 Ack=103 Win=64256 Len=17 TSval=1047088907 TSecr=3171348616
1711548388.359918833    92 0.529293746    10.10.1.1 → 10.10.1.2    TCP 83 8081 → 57850 [PSH, ACK] Seq=103 Ack=120 Win=65152 Len=17 TSval=3171348617 TSecr=1047088907
1711548394.359918833    98 0.530445902    10.10.1.2 → 10.10.1.1    TCP 83 57850 → 8081 [PSH, ACK] Seq=120 Ack=120 Win=64256 Len=17 TSval=1047088908 TSecr=3171348617
1711548396.359918833   100 0.530478777    10.10.1.1 → 10.10.1.2    TCP 83 8081 → 57850 [PSH, ACK] Seq=120 Ack=137 Win=65152 Len=17 TSval=3171348619 TSecr=1047088908
1711548402.359918833   106 0.531633514    10.10.1.2 → 10.10.1.1    TCP 83 57850 → 8081 [PSH, ACK] Seq=137 Ack=137 Win=64256 Len=17 TSval=1047088909 TSecr=3171348619
1711548404.359918833   108 0.531662440    10.10.1.1 → 10.10.1.2    TCP 83 8081 → 57850 [PSH, ACK] Seq=137 Ack=154 Win=65152 Len=17 TSval=3171348620 TSecr=1047088909
1711548410.359918833   114 0.532812448    10.10.1.2 → 10.10.1.1    TCP 83 57850 → 8081 [PSH, ACK] Seq=154 Ack=154 Win=64256 Len=17 TSval=1047088911 TSecr=3171348620
1711548412.359918833   116 0.532841032    10.10.1.1 → 10.10.1.2    TCP 83 8081 → 57850 [PSH, ACK] Seq=154 Ack=171 Win=65152 Len=17 TSval=3171348621 TSecr=1047088911
1711548418.359918833   122 0.533991970    10.10.1.2 → 10.10.1.1    TCP 83 57850 → 8081 [PSH, ACK] Seq=171 Ack=171 Win=64256 Len=17 TSval=1047088912 TSecr=3171348621
1711548420.359918833   124 0.534024191    10.10.1.1 → 10.10.1.2    TCP 83 8081 → 57850 [PSH, ACK] Seq=171 Ack=188 Win=65152 Len=17 TSval=3171348622 TSecr=1047088912
1711548426.359918833   130 0.535177826    10.10.1.2 → 10.10.1.1    TCP 83 57850 → 8081 [PSH, ACK] Seq=188 Ack=188 Win=64256 Len=17 TSval=1047088913 TSecr=3171348622
1711548428.359918833   132 0.535207139    10.10.1.1 → 10.10.1.2    TCP 83 8081 → 57850 [PSH, ACK] Seq=188 Ack=205 Win=65152 Len=17 TSval=3171348623 TSecr=1047088913
1711548434.359918833   138 0.536356973    10.10.1.2 → 10.10.1.1    TCP 83 57850 → 8081 [PSH, ACK] Seq=205 Ack=205 Win=64256 Len=17 TSval=1047088914 TSecr=3171348623
1711548436.359918833   140 0.536385170    10.10.1.1 → 10.10.1.2    TCP 83 8081 → 57850 [PSH, ACK] Seq=205 Ack=222 Win=65152 Len=17 TSval=3171348625 TSecr=1047088914
1711548442.359918833   146 0.537535020    10.10.1.2 → 10.10.1.1    TCP 83 57850 → 8081 [PSH, ACK] Seq=222 Ack=222 Win=64256 Len=17 TSval=1047088915 TSecr=3171348625
1711548444.359918833   148 0.537567107    10.10.1.1 → 10.10.1.2    TCP 83 8081 → 57850 [PSH, ACK] Seq=222 Ack=239 Win=65152 Len=17 TSval=3171348626 TSecr=1047088915
1711548450.359918833   154 0.538718323    10.10.1.2 → 10.10.1.1    TCP 83 57850 → 8081 [PSH, ACK] Seq=239 Ack=239 Win=64256 Len=17 TSval=1047088916 TSecr=3171348626
1711548452.359918833   156 0.538748538    10.10.1.1 → 10.10.1.2    TCP 83 8081 → 57850 [PSH, ACK] Seq=239 Ack=256 Win=65152 Len=17 TSval=3171348627 TSecr=1047088916
1711548458.359918833   162 0.539901667    10.10.1.2 → 10.10.1.1    TCP 83 57850 → 8081 [PSH, ACK] Seq=256 Ack=256 Win=64256 Len=17 TSval=1047088918 TSecr=3171348627
1711548460.359918833   164 0.539931911    10.10.1.1 → 10.10.1.2    TCP 83 8081 → 57850 [PSH, ACK] Seq=256 Ack=273 Win=65152 Len=17 TSval=3171348628 TSecr=1047088918
1711548466.359918833   170 0.541082239    10.10.1.2 → 10.10.1.1    TCP 83 57850 → 8081 [PSH, ACK] Seq=273 Ack=273 Win=64256 Len=17 TSval=1047088919 TSecr=3171348628
1711548468.359918833   172 0.541112849    10.10.1.1 → 10.10.1.2    TCP 83 8081 → 57850 [PSH, ACK] Seq=273 Ack=290 Win=65152 Len=17 TSval=3171348629 TSecr=1047088919
1711548474.359918833   178 0.542264306    10.10.1.2 → 10.10.1.1    TCP 83 57850 → 8081 [PSH, ACK] Seq=290 Ack=290 Win=64256 Len=17 TSval=1047088920 TSecr=3171348629
1711548476.359918833   180 0.542297959    10.10.1.1 → 10.10.1.2    TCP 83 8081 → 57850 [PSH, ACK] Seq=290 Ack=307 Win=65152 Len=17 TSval=3171348630 TSecr=1047088920
1711548482.359918833   186 0.543454153    10.10.1.2 → 10.10.1.1    TCP 83 57850 → 8081 [PSH, ACK] Seq=307 Ack=307 Win=64256 Len=17 TSval=1047088921 TSecr=3171348630
1711548484.359918833   188 0.543494993    10.10.1.1 → 10.10.1.2    TCP 83 8081 → 57850 [PSH, ACK] Seq=307 Ack=324 Win=65152 Len=17 TSval=3171348632 TSecr=1047088921
1711548490.359918833   194 0.544645445    10.10.1.2 → 10.10.1.1    TCP 83 57850 → 8081 [PSH, ACK] Seq=324 Ack=324 Win=64256 Len=17 TSval=1047088922 TSecr=3171348632
1711548492.359918833   196 0.544675691    10.10.1.1 → 10.10.1.2    TCP 83 8081 → 57850 [PSH, ACK] Seq=324 Ack=341 Win=65152 Len=17 TSval=3171348633 TSecr=1047088922
1711548498.359918833   202 0.545804677    10.10.1.2 → 10.10.1.1    TCP 83 57850 → 8081 [PSH, ACK] Seq=341 Ack=341 Win=64256 Len=17 TSval=1047088924 TSecr=3171348633
1711548500.359918833   204 0.545840091    10.10.1.1 → 10.10.1.2    TCP 83 8081 → 57850 [PSH, ACK] Seq=341 Ack=358 Win=65152 Len=17 TSval=3171348634 TSecr=1047088924
1711548506.359918833   210 0.546993101    10.10.1.2 → 10.10.1.1    TCP 83 57850 → 8081 [PSH, ACK] Seq=358 Ack=358 Win=64256 Len=17 TSval=1047088925 TSecr=3171348634
1711548508.359918833   212 0.547023969    10.10.1.1 → 10.10.1.2    TCP 83 8081 → 57850 [PSH, ACK] Seq=358 Ack=375 Win=65152 Len=17 TSval=3171348635 TSecr=1047088925
1711548514.359918833   218 0.548174456    10.10.1.2 → 10.10.1.1    TCP 83 57850 → 8081 [PSH, ACK] Seq=375 Ack=375 Win=64256 Len=17 TSval=1047088926 TSecr=3171348635
1711548516.359918833   220 0.548202622    10.10.1.1 → 10.10.1.2    TCP 83 8081 → 57850 [PSH, ACK] Seq=375 Ack=392 Win=65152 Len=17 TSval=3171348636 TSecr=1047088926
1711548522.359918833   226 0.549353026    10.10.1.2 → 10.10.1.1    TCP 83 57850 → 8081 [PSH, ACK] Seq=392 Ack=392 Win=64256 Len=17 TSval=1047088927 TSecr=3171348636
1711548524.359918833   228 0.549385240    10.10.1.1 → 10.10.1.2    TCP 83 8081 → 57850 [PSH, ACK] Seq=392 Ack=409 Win=65152 Len=17 TSval=3171348638 TSecr=1047088927
1711548530.359918833   234 0.550536793    10.10.1.2 → 10.10.1.1    TCP 83 57850 → 8081 [PSH, ACK] Seq=409 Ack=409 Win=64256 Len=17 TSval=1047088928 TSecr=3171348638
1711548532.359918833   236 0.550566728    10.10.1.1 → 10.10.1.2    TCP 83 8081 → 57850 [PSH, ACK] Seq=409 Ack=426 Win=65152 Len=17 TSval=3171348639 TSecr=1047088928
1711548538.359918833   242 0.551719835    10.10.1.2 → 10.10.1.1    TCP 83 57850 → 8081 [PSH, ACK] Seq=426 Ack=426 Win=64256 Len=17 TSval=1047088929 TSecr=3171348639
1711548540.359918833   244 0.551749651    10.10.1.1 → 10.10.1.2    TCP 83 8081 → 57850 [PSH, ACK] Seq=426 Ack=443 Win=65152 Len=17 TSval=3171348640 TSecr=1047088929
1711548546.359918833   250 0.552900235    10.10.1.2 → 10.10.1.1    TCP 83 57850 → 8081 [PSH, ACK] Seq=443 Ack=443 Win=64256 Len=17 TSval=1047088931 TSecr=3171348640
1711548548.359918833   252 0.552929656    10.10.1.1 → 10.10.1.2    TCP 83 8081 → 57850 [PSH, ACK] Seq=443 Ack=460 Win=65152 Len=17 TSval=3171348641 TSecr=1047088931
1711548554.359918833   258 0.554080943    10.10.1.2 → 10.10.1.1    TCP 83 57850 → 8081 [PSH, ACK] Seq=460 Ack=460 Win=64256 Len=17 TSval=1047088932 TSecr=3171348641
1711548556.359918833   260 0.554115275    10.10.1.1 → 10.10.1.2    TCP 83 8081 → 57850 [PSH, ACK] Seq=460 Ack=477 Win=65152 Len=17 TSval=3171348642 TSecr=1047088932
1711548562.359918833   266 0.555268137    10.10.1.2 → 10.10.1.1    TCP 83 57850 → 8081 [PSH, ACK] Seq=477 Ack=477 Win=64256 Len=17 TSval=1047088933 TSecr=3171348642
1711548564.359918833   268 0.555298096    10.10.1.1 → 10.10.1.2    TCP 83 8081 → 57850 [PSH, ACK] Seq=477 Ack=494 Win=65152 Len=17 TSval=3171348643 TSecr=1047088933
1711548570.359918833   274 0.556448772    10.10.1.2 → 10.10.1.1    TCP 83 57850 → 8081 [PSH, ACK] Seq=494 Ack=494 Win=64256 Len=17 TSval=1047088934 TSecr=3171348643
1711548572.359918833   276 0.556478738    10.10.1.1 → 10.10.1.2    TCP 83 8081 → 57850 [PSH, ACK] Seq=494 Ack=511 Win=65152 Len=17 TSval=3171348645 TSecr=1047088934
1711548578.359918833   282 0.557629720    10.10.1.2 → 10.10.1.1    TCP 83 57850 → 8081 [PSH, ACK] Seq=511 Ack=511 Win=64256 Len=17 TSval=1047088935 TSecr=3171348645
1711548580.359918833   284 0.557663315    10.10.1.1 → 10.10.1.2    TCP 83 8081 → 57850 [PSH, ACK] Seq=511 Ack=528 Win=65152 Len=17 TSval=3171348646 TSecr=1047088935
1711548586.359918833   290 0.558814674    10.10.1.2 → 10.10.1.1    TCP 83 57850 → 8081 [PSH, ACK] Seq=528 Ack=528 Win=64256 Len=17 TSval=1047088937 TSecr=3171348646
1711548588.359918833   292 0.558845213    10.10.1.1 → 10.10.1.2    TCP 83 8081 → 57850 [PSH, ACK] Seq=528 Ack=545 Win=65152 Len=17 TSval=3171348647 TSecr=1047088937
1711548594.359918833   298 0.559997831    10.10.1.2 → 10.10.1.1    TCP 83 57850 → 8081 [PSH, ACK] Seq=545 Ack=545 Win=64256 Len=17 TSval=1047088938 TSecr=3171348647
1711548596.359918833   300 0.560025259    10.10.1.1 → 10.10.1.2    TCP 83 8081 → 57850 [PSH, ACK] Seq=545 Ack=562 Win=65152 Len=17 TSval=3171348648 TSecr=1047088938
1711548602.359918833   306 0.561175492    10.10.1.2 → 10.10.1.1    TCP 83 57850 → 8081 [PSH, ACK] Seq=562 Ack=562 Win=64256 Len=17 TSval=1047088939 TSecr=3171348648
1711548604.359918833   308 0.561203567    10.10.1.1 → 10.10.1.2    TCP 83 8081 → 57850 [PSH, ACK] Seq=562 Ack=579 Win=65152 Len=17 TSval=3171348649 TSecr=1047088939
1711548610.359918833   314 0.562356446    10.10.1.2 → 10.10.1.1    TCP 83 57850 → 8081 [PSH, ACK] Seq=579 Ack=579 Win=64256 Len=17 TSval=1047088940 TSecr=3171348649
1711548612.359918833   316 0.562388286    10.10.1.1 → 10.10.1.2    TCP 83 8081 → 57850 [PSH, ACK] Seq=579 Ack=596 Win=65152 Len=17 TSval=3171348651 TSecr=1047088940
1711548618.359918833   322 0.563540274    10.10.1.2 → 10.10.1.1    TCP 83 57850 → 8081 [PSH, ACK] Seq=596 Ack=596 Win=64256 Len=17 TSval=1047088941 TSecr=3171348651
1711548620.359918833   324 0.563568804    10.10.1.1 → 10.10.1.2    TCP 83 8081 → 57850 [PSH, ACK] Seq=596 Ack=613 Win=65152 Len=17 TSval=3171348652 TSecr=1047088941
1711548626.359918833   330 0.564718269    10.10.1.2 → 10.10.1.1    TCP 83 57850 → 8081 [PSH, ACK] Seq=613 Ack=613 Win=64256 Len=17 TSval=1047088942 TSecr=3171348652
1711548628.359918833   332 0.564745285    10.10.1.1 → 10.10.1.2    TCP 83 8081 → 57850 [PSH, ACK] Seq=613 Ack=630 Win=65152 Len=17 TSval=3171348653 TSecr=1047088942
1711548634.359918833   338 0.565896538    10.10.1.2 → 10.10.1.1    TCP 83 57850 → 8081 [PSH, ACK] Seq=630 Ack=630 Win=64256 Len=17 TSval=1047088944 TSecr=3171348653
1711548636.359918833   340 0.565928722    10.10.1.1 → 10.10.1.2    TCP 83 8081 → 57850 [PSH, ACK] Seq=630 Ack=647 Win=65152 Len=17 TSval=3171348654 TSecr=1047088944
1711548642.359918833   346 0.567082039    10.10.1.2 → 10.10.1.1    TCP 83 57850 → 8081 [PSH, ACK] Seq=647 Ack=647 Win=64256 Len=17 TSval=1047088945 TSecr=3171348654
1711548644.359918833   348 0.567112060    10.10.1.1 → 10.10.1.2    TCP 83 8081 → 57850 [PSH, ACK] Seq=647 Ack=664 Win=65152 Len=17 TSval=3171348655 TSecr=1047088945
1711548650.359918833   354 0.568261991    10.10.1.2 → 10.10.1.1    TCP 83 57850 → 8081 [PSH, ACK] Seq=664 Ack=664 Win=64256 Len=17 TSval=1047088946 TSecr=3171348655
1711548652.359918833   356 0.568291991    10.10.1.1 → 10.10.1.2    TCP 83 8081 → 57850 [PSH, ACK] Seq=664 Ack=681 Win=65152 Len=17 TSval=3171348656 TSecr=1047088946
1711548658.359918833   362 0.569442724    10.10.1.2 → 10.10.1.1    TCP 83 57850 → 8081 [PSH, ACK] Seq=681 Ack=681 Win=64256 Len=17 TSval=1047088947 TSecr=3171348656
1711548660.359918833   364 0.569476095    10.10.1.1 → 10.10.1.2    TCP 83 8081 → 57850 [PSH, ACK] Seq=681 Ack=698 Win=65152 Len=17 TSval=3171348658 TSecr=1047088947
1711548666.359918833   370 0.570626265    10.10.1.2 → 10.10.1.1    TCP 83 57850 → 8081 [PSH, ACK] Seq=698 Ack=698 Win=64256 Len=17 TSval=1047088948 TSecr=3171348658
1711548668.359918833   372 0.570656855    10.10.1.1 → 10.10.1.2    TCP 83 8081 → 57850 [PSH, ACK] Seq=698 Ack=715 Win=65152 Len=17 TSval=3171348659 TSecr=1047088948
1711548674.359918833   378 0.571810243    10.10.1.2 → 10.10.1.1    TCP 83 57850 → 8081 [PSH, ACK] Seq=715 Ack=715 Win=64256 Len=17 TSval=1047088950 TSecr=3171348659
1711548676.359918833   380 0.571839529    10.10.1.1 → 10.10.1.2    TCP 83 8081 → 57850 [PSH, ACK] Seq=715 Ack=732 Win=65152 Len=17 TSval=3171348660 TSecr=1047088950
1711548682.359918833   386 0.572990505    10.10.1.2 → 10.10.1.1    TCP 83 57850 → 8081 [PSH, ACK] Seq=732 Ack=732 Win=64256 Len=17 TSval=1047088951 TSecr=3171348660
1711548684.359918833   388 0.573018462    10.10.1.1 → 10.10.1.2    TCP 83 8081 → 57850 [PSH, ACK] Seq=732 Ack=749 Win=65152 Len=17 TSval=3171348661 TSecr=1047088951
1711548690.359918833   394 0.574173583    10.10.1.2 → 10.10.1.1    TCP 83 57850 → 8081 [PSH, ACK] Seq=749 Ack=749 Win=64256 Len=17 TSval=1047088952 TSecr=3171348661
1711548692.359918833   396 0.574206587    10.10.1.1 → 10.10.1.2    TCP 83 8081 → 57850 [PSH, ACK] Seq=749 Ack=766 Win=65152 Len=17 TSval=3171348662 TSecr=1047088952
1711548698.359918833   402 0.575360047    10.10.1.2 → 10.10.1.1    TCP 83 57850 → 8081 [PSH, ACK] Seq=766 Ack=766 Win=64256 Len=17 TSval=1047088953 TSecr=3171348662
1711548700.359918833   404 0.575387425    10.10.1.1 → 10.10.1.2    TCP 83 8081 → 57850 [PSH, ACK] Seq=766 Ack=783 Win=65152 Len=17 TSval=3171348664 TSecr=1047088953
1711548706.359918833   410 0.576543924    10.10.1.2 → 10.10.1.1    TCP 83 57850 → 8081 [PSH, ACK] Seq=783 Ack=783 Win=64256 Len=17 TSval=1047088954 TSecr=3171348664
1711548708.359918833   412 0.576571569    10.10.1.1 → 10.10.1.2    TCP 83 8081 → 57850 [PSH, ACK] Seq=783 Ack=800 Win=65152 Len=17 TSval=3171348665 TSecr=1047088954
1711548714.359918833   418 0.577721918    10.10.1.2 → 10.10.1.1    TCP 83 57850 → 8081 [PSH, ACK] Seq=800 Ack=800 Win=64256 Len=17 TSval=1047088955 TSecr=3171348665
1711548716.359918833   420 0.577753924    10.10.1.1 → 10.10.1.2    TCP 83 8081 → 57850 [PSH, ACK] Seq=800 Ack=817 Win=65152 Len=17 TSval=3171348666 TSecr=1047088955
1711548722.359918833   426 0.578913647    10.10.1.2 → 10.10.1.1    TCP 83 57850 → 8081 [PSH, ACK] Seq=817 Ack=817 Win=64256 Len=17 TSval=1047088957 TSecr=3171348666
1711548724.359918833   428 0.578944249    10.10.1.1 → 10.10.1.2    TCP 83 8081 → 57850 [PSH, ACK] Seq=817 Ack=834 Win=65152 Len=17 TSval=3171348667 TSecr=1047088957
1711548730.359918833   434 0.580097296    10.10.1.2 → 10.10.1.1    TCP 83 57850 → 8081 [PSH, ACK] Seq=834 Ack=834 Win=64256 Len=17 TSval=1047088958 TSecr=3171348667
1711548732.359918833   436 0.580127874    10.10.1.1 → 10.10.1.2    TCP 83 8081 → 57850 [PSH, ACK] Seq=834 Ack=851 Win=65152 Len=17 TSval=3171348668 TSecr=1047088958
1711548738.359918833   442 0.581288553    10.10.1.2 → 10.10.1.1    TCP 83 57850 → 8081 [PSH, ACK] Seq=851 Ack=851 Win=64256 Len=17 TSval=1047088959 TSecr=3171348668
1711548740.359918833   444 0.581331782    10.10.1.1 → 10.10.1.2    TCP 83 8081 → 57850 [PSH, ACK] Seq=851 Ack=868 Win=65152 Len=17 TSval=3171348670 TSecr=1047088959
1711548746.359918833   450 0.582481999    10.10.1.2 → 10.10.1.1    TCP 83 57850 → 8081 [PSH, ACK] Seq=868 Ack=868 Win=64256 Len=17 TSval=1047088960 TSecr=3171348670
1711548748.359918833   452 0.582516450    10.10.1.1 → 10.10.1.2    TCP 83 8081 → 57850 [PSH, ACK] Seq=868 Ack=885 Win=65152 Len=17 TSval=3171348671 TSecr=1047088960
1711548754.359918833   458 0.583674569    10.10.1.2 → 10.10.1.1    TCP 83 57850 → 8081 [PSH, ACK] Seq=885 Ack=885 Win=64256 Len=17 TSval=1047088961 TSecr=3171348671
1711548756.359918833   460 0.583704713    10.10.1.1 → 10.10.1.2    TCP 83 8081 → 57850 [PSH, ACK] Seq=885 Ack=902 Win=65152 Len=17 TSval=3171348672 TSecr=1047088961
1711548762.359918833   466 0.584854816    10.10.1.2 → 10.10.1.1    TCP 83 57850 → 8081 [PSH, ACK] Seq=902 Ack=902 Win=64256 Len=17 TSval=1047088963 TSecr=3171348672
1711548764.359918833   468 0.584884949    10.10.1.1 → 10.10.1.2    TCP 83 8081 → 57850 [PSH, ACK] Seq=902 Ack=919 Win=65152 Len=17 TSval=3171348673 TSecr=1047088963
1711548770.359918833   474 0.586047312    10.10.1.2 → 10.10.1.1    TCP 83 57850 → 8081 [PSH, ACK] Seq=919 Ack=919 Win=64256 Len=17 TSval=1047088964 TSecr=3171348673
1711548772.359918833   476 0.586080782    10.10.1.1 → 10.10.1.2    TCP 83 8081 → 57850 [PSH, ACK] Seq=919 Ack=936 Win=65152 Len=17 TSval=3171348674 TSecr=1047088964
1711548778.359918833   482 0.587233051    10.10.1.2 → 10.10.1.1    TCP 83 57850 → 8081 [PSH, ACK] Seq=936 Ack=936 Win=64256 Len=17 TSval=1047088965 TSecr=3171348674
1711548780.359918833   484 0.587263195    10.10.1.1 → 10.10.1.2    TCP 83 8081 → 57850 [PSH, ACK] Seq=936 Ack=953 Win=65152 Len=17 TSval=3171348675 TSecr=1047088965
1711548786.359918833   490 0.588427213    10.10.1.2 → 10.10.1.1    TCP 83 57850 → 8081 [PSH, ACK] Seq=953 Ack=953 Win=64256 Len=17 TSval=1047088966 TSecr=3171348675
1711548789.359918833   493 0.588521553    10.10.1.1 → 10.10.1.2    TCP 83 8081 → 57850 [PSH, ACK] Seq=953 Ack=970 Win=65152 Len=17 TSval=3171348677 TSecr=1047088966
1711548794.359918833   498 0.589671760    10.10.1.2 → 10.10.1.1    TCP 83 57850 → 8081 [PSH, ACK] Seq=970 Ack=970 Win=64256 Len=17 TSval=1047088967 TSecr=3171348677
1711548796.359918833   500 0.589705620    10.10.1.1 → 10.10.1.2    TCP 83 8081 → 57850 [PSH, ACK] Seq=970 Ack=987 Win=65152 Len=17 TSval=3171348678 TSecr=1047088967
1711548802.359918833   506 0.590868614    10.10.1.2 → 10.10.1.1    TCP 83 57850 → 8081 [PSH, ACK] Seq=987 Ack=987 Win=64256 Len=17 TSval=1047088969 TSecr=3171348678
1711548804.359918833   508 0.590898573    10.10.1.1 → 10.10.1.2    TCP 83 8081 → 57850 [PSH, ACK] Seq=987 Ack=1004 Win=65152 Len=17 TSval=3171348679 TSecr=1047088969
1711548810.359918833   514 0.592051116    10.10.1.2 → 10.10.1.1    TCP 83 57850 → 8081 [PSH, ACK] Seq=1004 Ack=1004 Win=64256 Len=17 TSval=1047088970 TSecr=3171348679
1711548812.359918833   516 0.592081140    10.10.1.1 → 10.10.1.2    TCP 83 8081 → 57850 [PSH, ACK] Seq=1004 Ack=1021 Win=65152 Len=17 TSval=3171348680 TSecr=1047088970
1711548818.359918833   522 0.593250352    10.10.1.2 → 10.10.1.1    TCP 83 57850 → 8081 [PSH, ACK] Seq=1021 Ack=1021 Win=64256 Len=17 TSval=1047088971 TSecr=3171348680
1711548820.359918833   524 0.593279538    10.10.1.1 → 10.10.1.2    TCP 83 8081 → 57850 [PSH, ACK] Seq=1021 Ack=1038 Win=65152 Len=17 TSval=3171348681 TSecr=1047088971
1711548826.359918833   530 0.594430660    10.10.1.2 → 10.10.1.1    TCP 83 57850 → 8081 [PSH, ACK] Seq=1038 Ack=1038 Win=64256 Len=17 TSval=1047088972 TSecr=3171348681
1711548828.359918833   532 0.594464491    10.10.1.1 → 10.10.1.2    TCP 83 8081 → 57850 [PSH, ACK] Seq=1038 Ack=1055 Win=65152 Len=17 TSval=3171348683 TSecr=1047088972
1711548834.359918833   538 0.595634049    10.10.1.2 → 10.10.1.1    TCP 83 57850 → 8081 [PSH, ACK] Seq=1055 Ack=1055 Win=64256 Len=17 TSval=1047088973 TSecr=3171348683
1711548836.359918833   540 0.595663667    10.10.1.1 → 10.10.1.2    TCP 83 8081 → 57850 [PSH, ACK] Seq=1055 Ack=1072 Win=65152 Len=17 TSval=3171348684 TSecr=1047088973
1711548842.359918833   546 0.596813671    10.10.1.2 → 10.10.1.1    TCP 83 57850 → 8081 [PSH, ACK] Seq=1072 Ack=1072 Win=64256 Len=17 TSval=1047088975 TSecr=3171348684
1711548844.359918833   548 0.596843843    10.10.1.1 → 10.10.1.2    TCP 83 8081 → 57850 [PSH, ACK] Seq=1072 Ack=1089 Win=65152 Len=17 TSval=3171348685 TSecr=1047088975
1711548850.359918833   554 0.598017469    10.10.1.2 → 10.10.1.1    TCP 83 57850 → 8081 [PSH, ACK] Seq=1089 Ack=1089 Win=64256 Len=17 TSval=1047088976 TSecr=3171348685
1711548852.359918833   556 0.598052449    10.10.1.1 → 10.10.1.2    TCP 83 8081 → 57850 [PSH, ACK] Seq=1089 Ack=1106 Win=65152 Len=17 TSval=3171348686 TSecr=1047088976
1711548858.359918833   562 0.599205765    10.10.1.2 → 10.10.1.1    TCP 83 57850 → 8081 [PSH, ACK] Seq=1106 Ack=1106 Win=64256 Len=17 TSval=1047088977 TSecr=3171348686
1711548860.359918833   564 0.599234371    10.10.1.1 → 10.10.1.2    TCP 83 8081 → 57850 [PSH, ACK] Seq=1106 Ack=1123 Win=65152 Len=17 TSval=3171348687 TSecr=1047088977
1711548866.359918833   570 0.600412451    10.10.1.2 → 10.10.1.1    TCP 83 57850 → 8081 [PSH, ACK] Seq=1123 Ack=1123 Win=64256 Len=17 TSval=1047088978 TSecr=3171348687
1711548868.359918833   572 0.600440008    10.10.1.1 → 10.10.1.2    TCP 83 8081 → 57850 [PSH, ACK] Seq=1123 Ack=1140 Win=65152 Len=17 TSval=3171348689 TSecr=1047088978
1711548874.359918833   578 0.601590069    10.10.1.2 → 10.10.1.1    TCP 83 57850 → 8081 [PSH, ACK] Seq=1140 Ack=1140 Win=64256 Len=17 TSval=1047088979 TSecr=3171348689
1711548876.359918833   580 0.601622396    10.10.1.1 → 10.10.1.2    TCP 83 8081 → 57850 [PSH, ACK] Seq=1140 Ack=1157 Win=65152 Len=17 TSval=3171348690 TSecr=1047088979
1711548882.359918833   586 0.602761313    10.10.1.2 → 10.10.1.1    TCP 83 57850 → 8081 [PSH, ACK] Seq=1157 Ack=1157 Win=64256 Len=17 TSval=1047088980 TSecr=3171348690
1711548884.359918833   588 0.602790877    10.10.1.1 → 10.10.1.2    TCP 83 8081 → 57850 [PSH, ACK] Seq=1157 Ack=1174 Win=65152 Len=17 TSval=3171348691 TSecr=1047088980
1711548890.359918833   594 0.603942383    10.10.1.2 → 10.10.1.1    TCP 83 57850 → 8081 [PSH, ACK] Seq=1174 Ack=1174 Win=64256 Len=17 TSval=1047088982 TSecr=3171348691
1711548892.359918833   596 0.603971851    10.10.1.1 → 10.10.1.2    TCP 83 8081 → 57850 [PSH, ACK] Seq=1174 Ack=1191 Win=65152 Len=17 TSval=3171348692 TSecr=1047088982
1711548898.359918833   602 0.605152452    10.10.1.2 → 10.10.1.1    TCP 83 57850 → 8081 [PSH, ACK] Seq=1191 Ack=1191 Win=64256 Len=17 TSval=1047088983 TSecr=3171348692
1711548900.359918833   604 0.605182518    10.10.1.1 → 10.10.1.2    TCP 83 8081 → 57850 [PSH, ACK] Seq=1191 Ack=1208 Win=65152 Len=17 TSval=3171348693 TSecr=1047088983
1711548906.359918833   610 0.606333451    10.10.1.2 → 10.10.1.1    TCP 83 57850 → 8081 [PSH, ACK] Seq=1208 Ack=1208 Win=64256 Len=17 TSval=1047088984 TSecr=3171348693
1711548908.359918833   612 0.606366982    10.10.1.1 → 10.10.1.2    TCP 83 8081 → 57850 [PSH, ACK] Seq=1208 Ack=1225 Win=65152 Len=17 TSval=3171348695 TSecr=1047088984
1711548914.359918833   618 0.607546519    10.10.1.2 → 10.10.1.1    TCP 83 57850 → 8081 [PSH, ACK] Seq=1225 Ack=1225 Win=64256 Len=17 TSval=1047088985 TSecr=3171348695
1711548916.359918833   620 0.607576842    10.10.1.1 → 10.10.1.2    TCP 83 8081 → 57850 [PSH, ACK] Seq=1225 Ack=1242 Win=65152 Len=17 TSval=3171348696 TSecr=1047088985
1711548922.359918833   626 0.608727199    10.10.1.2 → 10.10.1.1    TCP 83 57850 → 8081 [PSH, ACK] Seq=1242 Ack=1242 Win=64256 Len=17 TSval=1047088986 TSecr=3171348696
1711548924.359918833   628 0.608758379    10.10.1.1 → 10.10.1.2    TCP 83 8081 → 57850 [PSH, ACK] Seq=1242 Ack=1259 Win=65152 Len=17 TSval=3171348697 TSecr=1047088986
1711548930.359918833   634 0.609941498    10.10.1.2 → 10.10.1.1    TCP 83 57850 → 8081 [PSH, ACK] Seq=1259 Ack=1259 Win=64256 Len=17 TSval=1047088988 TSecr=3171348697
1711548932.359918833   636 0.609975288    10.10.1.1 → 10.10.1.2    TCP 83 8081 → 57850 [PSH, ACK] Seq=1259 Ack=1276 Win=65152 Len=17 TSval=3171348698 TSecr=1047088988
1711548938.359918833   642 0.611128739    10.10.1.2 → 10.10.1.1    TCP 83 57850 → 8081 [PSH, ACK] Seq=1276 Ack=1276 Win=64256 Len=17 TSval=1047088989 TSecr=3171348698
1711548940.359918833   644 0.611156172    10.10.1.1 → 10.10.1.2    TCP 83 8081 → 57850 [PSH, ACK] Seq=1276 Ack=1293 Win=65152 Len=17 TSval=3171348699 TSecr=1047088989
1711548946.359918833   650 0.612344432    10.10.1.2 → 10.10.1.1    TCP 83 57850 → 8081 [PSH, ACK] Seq=1293 Ack=1293 Win=64256 Len=17 TSval=1047088990 TSecr=3171348699
1711548948.359918833   652 0.612372103    10.10.1.1 → 10.10.1.2    TCP 83 8081 → 57850 [PSH, ACK] Seq=1293 Ack=1310 Win=65152 Len=17 TSval=3171348701 TSecr=1047088990
1711548954.359918833   658 0.613521394    10.10.1.2 → 10.10.1.1    TCP 83 57850 → 8081 [PSH, ACK] Seq=1310 Ack=1310 Win=64256 Len=17 TSval=1047088991 TSecr=3171348701
1711548956.359918833   660 0.613556710    10.10.1.1 → 10.10.1.2    TCP 83 8081 → 57850 [PSH, ACK] Seq=1310 Ack=1327 Win=65152 Len=17 TSval=3171348702 TSecr=1047088991
1711548962.359918833   666 0.614741848    10.10.1.2 → 10.10.1.1    TCP 83 57850 → 8081 [PSH, ACK] Seq=1327 Ack=1327 Win=64256 Len=17 TSval=1047088992 TSecr=3171348702
1711548964.359918833   668 0.614771142    10.10.1.1 → 10.10.1.2    TCP 83 8081 → 57850 [PSH, ACK] Seq=1327 Ack=1344 Win=65152 Len=17 TSval=3171348703 TSecr=1047088992
1711548970.359918833   674 0.615923649    10.10.1.2 → 10.10.1.1    TCP 83 57850 → 8081 [PSH, ACK] Seq=1344 Ack=1344 Win=64256 Len=17 TSval=1047088994 TSecr=3171348703
1711548972.359918833   676 0.615952775    10.10.1.1 → 10.10.1.2    TCP 83 8081 → 57850 [PSH, ACK] Seq=1344 Ack=1361 Win=65152 Len=17 TSval=3171348704 TSecr=1047088994
1711548978.359918833   682 0.617142837    10.10.1.2 → 10.10.1.1    TCP 83 57850 → 8081 [PSH, ACK] Seq=1361 Ack=1361 Win=64256 Len=17 TSval=1047088995 TSecr=3171348704
1711548980.359918833   684 0.617172480    10.10.1.1 → 10.10.1.2    TCP 83 8081 → 57850 [PSH, ACK] Seq=1361 Ack=1378 Win=65152 Len=17 TSval=3171348705 TSecr=1047088995
1711548986.359918833   690 0.618322971    10.10.1.2 → 10.10.1.1    TCP 83 57850 → 8081 [PSH, ACK] Seq=1378 Ack=1378 Win=64256 Len=17 TSval=1047088996 TSecr=3171348705
1711548988.359918833   692 0.618357417    10.10.1.1 → 10.10.1.2    TCP 83 8081 → 57850 [PSH, ACK] Seq=1378 Ack=1395 Win=65152 Len=17 TSval=3171348707 TSecr=1047088996
1711548994.359918833   698 0.619545052    10.10.1.2 → 10.10.1.1    TCP 83 57850 → 8081 [PSH, ACK] Seq=1395 Ack=1395 Win=64256 Len=17 TSval=1047088997 TSecr=3171348707
1711548996.359918833   700 0.619573353    10.10.1.1 → 10.10.1.2    TCP 83 8081 → 57850 [PSH, ACK] Seq=1395 Ack=1412 Win=65152 Len=17 TSval=3171348708 TSecr=1047088997
1711549002.359918833   706 0.620722935    10.10.1.2 → 10.10.1.1    TCP 83 57850 → 8081 [PSH, ACK] Seq=1412 Ack=1412 Win=64256 Len=17 TSval=1047088998 TSecr=3171348708
1711549004.359918833   708 0.620750753    10.10.1.1 → 10.10.1.2    TCP 83 8081 → 57850 [PSH, ACK] Seq=1412 Ack=1429 Win=65152 Len=17 TSval=3171348709 TSecr=1047088998
1711549010.359918833   714 0.621948092    10.10.1.2 → 10.10.1.1    TCP 83 57850 → 8081 [PSH, ACK] Seq=1429 Ack=1429 Win=64256 Len=17 TSval=1047089000 TSecr=3171348709
1711549012.359918833   716 0.621981880    10.10.1.1 → 10.10.1.2    TCP 83 8081 → 57850 [PSH, ACK] Seq=1429 Ack=1446 Win=65152 Len=17 TSval=3171348710 TSecr=1047089000
1711549018.359918833   722 0.623134841    10.10.1.2 → 10.10.1.1    TCP 83 57850 → 8081 [PSH, ACK] Seq=1446 Ack=1446 Win=64256 Len=17 TSval=1047089001 TSecr=3171348710
1711549020.359918833   724 0.623164548    10.10.1.1 → 10.10.1.2    TCP 83 8081 → 57850 [PSH, ACK] Seq=1446 Ack=1463 Win=65152 Len=17 TSval=3171348711 TSecr=1047089001
1711549026.359918833   730 0.624359028    10.10.1.2 → 10.10.1.1    TCP 83 57850 → 8081 [PSH, ACK] Seq=1463 Ack=1463 Win=64256 Len=17 TSval=1047089002 TSecr=3171348711
1711549028.359918833   732 0.624388843    10.10.1.1 → 10.10.1.2    TCP 83 8081 → 57850 [PSH, ACK] Seq=1463 Ack=1480 Win=65152 Len=17 TSval=3171348713 TSecr=1047089002
1711549034.359918833   738 0.625539366    10.10.1.2 → 10.10.1.1    TCP 83 57850 → 8081 [PSH, ACK] Seq=1480 Ack=1480 Win=64256 Len=17 TSval=1047089003 TSecr=3171348713
1711549036.359918833   740 0.625573566    10.10.1.1 → 10.10.1.2    TCP 83 8081 → 57850 [PSH, ACK] Seq=1480 Ack=1497 Win=65152 Len=17 TSval=3171348714 TSecr=1047089003
1711549042.359918833   746 0.626762015    10.10.1.2 → 10.10.1.1    TCP 83 57850 → 8081 [PSH, ACK] Seq=1497 Ack=1497 Win=64256 Len=17 TSval=1047089004 TSecr=3171348714
1711549044.359918833   748 0.626789914    10.10.1.1 → 10.10.1.2    TCP 83 8081 → 57850 [PSH, ACK] Seq=1497 Ack=1514 Win=65152 Len=17 TSval=3171348715 TSecr=1047089004
1711549050.359918833   754 0.627942322    10.10.1.2 → 10.10.1.1    TCP 83 57850 → 8081 [PSH, ACK] Seq=1514 Ack=1514 Win=64256 Len=17 TSval=1047089006 TSecr=3171348715
1711549052.359918833   756 0.627969731    10.10.1.1 → 10.10.1.2    TCP 83 8081 → 57850 [PSH, ACK] Seq=1514 Ack=1531 Win=65152 Len=17 TSval=3171348716 TSecr=1047089006
1711549058.359918833   762 0.629170225    10.10.1.2 → 10.10.1.1    TCP 83 57850 → 8081 [PSH, ACK] Seq=1531 Ack=1531 Win=64256 Len=17 TSval=1047089007 TSecr=3171348716
1711549060.359918833   764 0.629198260    10.10.1.1 → 10.10.1.2    TCP 83 8081 → 57850 [PSH, ACK] Seq=1531 Ack=1548 Win=65152 Len=17 TSval=3171348717 TSecr=1047089007
1711549066.359918833   770 0.630349396    10.10.1.2 → 10.10.1.1    TCP 83 57850 → 8081 [PSH, ACK] Seq=1548 Ack=1548 Win=64256 Len=17 TSval=1047089008 TSecr=3171348717
1711549068.359918833   772 0.630383158    10.10.1.1 → 10.10.1.2    TCP 83 8081 → 57850 [PSH, ACK] Seq=1548 Ack=1565 Win=65152 Len=17 TSval=3171348719 TSecr=1047089008
1711549074.359918833   778 0.631584075    10.10.1.2 → 10.10.1.1    TCP 83 57850 → 8081 [PSH, ACK] Seq=1565 Ack=1565 Win=64256 Len=17 TSval=1047089009 TSecr=3171348719
1711549076.359918833   780 0.631612445    10.10.1.1 → 10.10.1.2    TCP 83 8081 → 57850 [PSH, ACK] Seq=1565 Ack=1582 Win=65152 Len=17 TSval=3171348720 TSecr=1047089009
1711549082.359918833   786 0.632762236    10.10.1.2 → 10.10.1.1    TCP 83 57850 → 8081 [PSH, ACK] Seq=1582 Ack=1582 Win=64256 Len=17 TSval=1047089010 TSecr=3171348720
1711549084.359918833   788 0.632790326    10.10.1.1 → 10.10.1.2    TCP 83 8081 → 57850 [PSH, ACK] Seq=1582 Ack=1599 Win=65152 Len=17 TSval=3171348721 TSecr=1047089010
1711549090.359918833   794 0.633994023    10.10.1.2 → 10.10.1.1    TCP 83 57850 → 8081 [PSH, ACK] Seq=1599 Ack=1599 Win=64256 Len=17 TSval=1047089012 TSecr=3171348721
1711549092.359918833   796 0.634026296    10.10.1.1 → 10.10.1.2    TCP 83 8081 → 57850 [PSH, ACK] Seq=1599 Ack=1616 Win=65152 Len=17 TSval=3171348722 TSecr=1047089012
1711549098.359918833   802 0.635178937    10.10.1.2 → 10.10.1.1    TCP 83 57850 → 8081 [PSH, ACK] Seq=1616 Ack=1616 Win=64256 Len=17 TSval=1047089013 TSecr=3171348722
1711549100.359918833   804 0.635206326    10.10.1.1 → 10.10.1.2    TCP 83 8081 → 57850 [PSH, ACK] Seq=1616 Ack=1633 Win=65152 Len=17 TSval=3171348723 TSecr=1047089013
1711549106.359918833   810 0.636415131    10.10.1.2 → 10.10.1.1    TCP 83 57850 → 8081 [PSH, ACK] Seq=1633 Ack=1633 Win=64256 Len=17 TSval=1047089014 TSecr=3171348723
1711549108.359918833   812 0.636442495    10.10.1.1 → 10.10.1.2    TCP 83 8081 → 57850 [PSH, ACK] Seq=1633 Ack=1650 Win=65152 Len=17 TSval=3171348725 TSecr=1047089014
1711549114.359918833   818 0.637592779    10.10.1.2 → 10.10.1.1    TCP 83 57850 → 8081 [PSH, ACK] Seq=1650 Ack=1650 Win=64256 Len=17 TSval=1047089015 TSecr=3171348725
1711549116.359918833   820 0.637624789    10.10.1.1 → 10.10.1.2    TCP 83 8081 → 57850 [PSH, ACK] Seq=1650 Ack=1667 Win=65152 Len=17 TSval=3171348726 TSecr=1047089015
1711549122.359918833   826 0.638833171    10.10.1.2 → 10.10.1.1    TCP 83 57850 → 8081 [PSH, ACK] Seq=1667 Ack=1667 Win=64256 Len=17 TSval=1047089017 TSecr=3171348726
1711549124.359918833   828 0.638862828    10.10.1.1 → 10.10.1.2    TCP 83 8081 → 57850 [PSH, ACK] Seq=1667 Ack=1684 Win=65152 Len=17 TSval=3171348727 TSecr=1047089017
1711549130.359918833   834 0.640016703    10.10.1.2 → 10.10.1.1    TCP 83 57850 → 8081 [PSH, ACK] Seq=1684 Ack=1684 Win=64256 Len=17 TSval=1047089018 TSecr=3171348727
1711549132.359918833   836 0.640044303    10.10.1.1 → 10.10.1.2    TCP 83 8081 → 57850 [PSH, ACK] Seq=1684 Ack=1701 Win=65152 Len=17 TSval=3171348728 TSecr=1047089018
1711549138.359918833   842 0.641254177    10.10.1.2 → 10.10.1.1    TCP 83 57850 → 8081 [PSH, ACK] Seq=1701 Ack=1701 Win=64256 Len=17 TSval=1047089019 TSecr=3171348728
1711549140.359918833   844 0.641281971    10.10.1.1 → 10.10.1.2    TCP 83 8081 → 57850 [PSH, ACK] Seq=1701 Ack=1718 Win=65152 Len=17 TSval=3171348729 TSecr=1047089019
1711549146.359918833   850 0.642432800    10.10.1.2 → 10.10.1.1    TCP 83 57850 → 8081 [PSH, ACK] Seq=1718 Ack=1718 Win=64256 Len=17 TSval=1047089020 TSecr=3171348729
1711549148.359918833   852 0.642465304    10.10.1.1 → 10.10.1.2    TCP 83 8081 → 57850 [PSH, ACK] Seq=1718 Ack=1735 Win=65152 Len=17 TSval=3171348731 TSecr=1047089020
1711549154.359918833   858 0.643677463    10.10.1.2 → 10.10.1.1    TCP 83 57850 → 8081 [PSH, ACK] Seq=1735 Ack=1735 Win=64256 Len=17 TSval=1047089021 TSecr=3171348731
1711549156.359918833   860 0.643705219    10.10.1.1 → 10.10.1.2    TCP 83 8081 → 57850 [PSH, ACK] Seq=1735 Ack=1752 Win=65152 Len=17 TSval=3171348732 TSecr=1047089021
1711549162.359918833   866 0.644855343    10.10.1.2 → 10.10.1.1    TCP 83 57850 → 8081 [PSH, ACK] Seq=1752 Ack=1752 Win=64256 Len=17 TSval=1047089023 TSecr=3171348732
1711549164.359918833   868 0.644885124    10.10.1.1 → 10.10.1.2    TCP 83 8081 → 57850 [PSH, ACK] Seq=1752 Ack=1769 Win=65152 Len=17 TSval=3171348733 TSecr=1047089023
1711549170.359918833   874 0.646101638    10.10.1.2 → 10.10.1.1    TCP 83 57850 → 8081 [PSH, ACK] Seq=1769 Ack=1769 Win=64256 Len=17 TSval=1047089024 TSecr=3171348733
1711549172.359918833   876 0.646136383    10.10.1.1 → 10.10.1.2    TCP 83 8081 → 57850 [PSH, ACK] Seq=1769 Ack=1786 Win=65152 Len=17 TSval=3171348734 TSecr=1047089024
1711549178.359918833   882 0.647289226    10.10.1.2 → 10.10.1.1    TCP 83 57850 → 8081 [PSH, ACK] Seq=1786 Ack=1786 Win=64256 Len=17 TSval=1047089025 TSecr=3171348734
1711549180.359918833   884 0.647316842    10.10.1.1 → 10.10.1.2    TCP 83 8081 → 57850 [PSH, ACK] Seq=1786 Ack=1803 Win=65152 Len=17 TSval=3171348736 TSecr=1047089025
1711549186.359918833   890 0.648532544    10.10.1.2 → 10.10.1.1    TCP 83 57850 → 8081 [PSH, ACK] Seq=1803 Ack=1803 Win=64256 Len=17 TSval=1047089026 TSecr=3171348736
1711549188.359918833   892 0.648560348    10.10.1.1 → 10.10.1.2    TCP 83 8081 → 57850 [PSH, ACK] Seq=1803 Ack=1820 Win=65152 Len=17 TSval=3171348737 TSecr=1047089026
1711549194.359918833   898 0.649710930    10.10.1.2 → 10.10.1.1    TCP 83 57850 → 8081 [PSH, ACK] Seq=1820 Ack=1820 Win=64256 Len=17 TSval=1047089027 TSecr=3171348737
1711549196.359918833   900 0.649743467    10.10.1.1 → 10.10.1.2    TCP 83 8081 → 57850 [PSH, ACK] Seq=1820 Ack=1837 Win=65152 Len=17 TSval=3171348738 TSecr=1047089027
1711549202.359918833   906 0.650960220    10.10.1.2 → 10.10.1.1    TCP 83 57850 → 8081 [PSH, ACK] Seq=1837 Ack=1837 Win=64256 Len=17 TSval=1047089029 TSecr=3171348738
1711549204.359918833   908 0.650987934    10.10.1.1 → 10.10.1.2    TCP 83 8081 → 57850 [PSH, ACK] Seq=1837 Ack=1854 Win=65152 Len=17 TSval=3171348739 TSecr=1047089029
1711549210.359918833   914 0.652137911    10.10.1.2 → 10.10.1.1    TCP 83 57850 → 8081 [PSH, ACK] Seq=1854 Ack=1854 Win=64256 Len=17 TSval=1047089030 TSecr=3171348739
1711549212.359918833   916 0.652165503    10.10.1.1 → 10.10.1.2    TCP 83 8081 → 57850 [PSH, ACK] Seq=1854 Ack=1871 Win=65152 Len=17 TSval=3171348740 TSecr=1047089030
1711549218.359918833   922 0.653389393    10.10.1.2 → 10.10.1.1    TCP 83 57850 → 8081 [PSH, ACK] Seq=1871 Ack=1871 Win=64256 Len=17 TSval=1047089031 TSecr=3171348740
1711549220.359918833   924 0.653421051    10.10.1.1 → 10.10.1.2    TCP 83 8081 → 57850 [PSH, ACK] Seq=1871 Ack=1888 Win=65152 Len=17 TSval=3171348742 TSecr=1047089031
1711549226.359918833   930 0.654571851    10.10.1.2 → 10.10.1.1    TCP 83 57850 → 8081 [PSH, ACK] Seq=1888 Ack=1888 Win=64256 Len=17 TSval=1047089032 TSecr=3171348742
1711549228.359918833   932 0.654600411    10.10.1.1 → 10.10.1.2    TCP 83 8081 → 57850 [PSH, ACK] Seq=1888 Ack=1905 Win=65152 Len=17 TSval=3171348743 TSecr=1047089032
1711549234.359918833   938 0.655828989    10.10.1.2 → 10.10.1.1    TCP 83 57850 → 8081 [PSH, ACK] Seq=1905 Ack=1905 Win=64256 Len=17 TSval=1047089034 TSecr=3171348743
1711549236.359918833   940 0.655856270    10.10.1.1 → 10.10.1.2    TCP 83 8081 → 57850 [PSH, ACK] Seq=1905 Ack=1922 Win=65152 Len=17 TSval=3171348744 TSecr=1047089034
1711549242.359918833   946 0.657006257    10.10.1.2 → 10.10.1.1    TCP 83 57850 → 8081 [PSH, ACK] Seq=1922 Ack=1922 Win=64256 Len=17 TSval=1047089035 TSecr=3171348744
1711549245.359918833   949 0.657073602    10.10.1.1 → 10.10.1.2    TCP 83 8081 → 57850 [PSH, ACK] Seq=1922 Ack=1939 Win=65152 Len=17 TSval=3171348745 TSecr=1047089035
1711549250.359918833   954 0.658262547    10.10.1.2 → 10.10.1.1    TCP 83 57850 → 8081 [PSH, ACK] Seq=1939 Ack=1939 Win=64256 Len=17 TSval=1047089036 TSecr=3171348745
1711549252.359918833   956 0.658296991    10.10.1.1 → 10.10.1.2    TCP 83 8081 → 57850 [PSH, ACK] Seq=1939 Ack=1956 Win=65152 Len=17 TSval=3171348746 TSecr=1047089036
1711549258.359918833   962 0.659450160    10.10.1.2 → 10.10.1.1    TCP 83 57850 → 8081 [PSH, ACK] Seq=1956 Ack=1956 Win=64256 Len=17 TSval=1047089037 TSecr=3171348746
1711549260.359918833   964 0.659478208    10.10.1.1 → 10.10.1.2    TCP 83 8081 → 57850 [PSH, ACK] Seq=1956 Ack=1973 Win=65152 Len=17 TSval=3171348748 TSecr=1047089037
1711549266.359918833   970 0.660704331    10.10.1.2 → 10.10.1.1    TCP 83 57850 → 8081 [PSH, ACK] Seq=1973 Ack=1973 Win=64256 Len=17 TSval=1047089038 TSecr=3171348748
1711549268.359918833   972 0.660732016    10.10.1.1 → 10.10.1.2    TCP 83 8081 → 57850 [PSH, ACK] Seq=1973 Ack=1990 Win=65152 Len=17 TSval=3171348749 TSecr=1047089038
1711549274.359918833   978 0.661883263    10.10.1.2 → 10.10.1.1    TCP 83 57850 → 8081 [PSH, ACK] Seq=1990 Ack=1990 Win=64256 Len=17 TSval=1047089040 TSecr=3171348749
1711549276.359918833   980 0.661915820    10.10.1.1 → 10.10.1.2    TCP 83 8081 → 57850 [PSH, ACK] Seq=1990 Ack=2007 Win=65152 Len=17 TSval=3171348750 TSecr=1047089040
