1711546819.503988504    22 0.273221501    10.10.1.2 → 10.10.1.1    TCP 74 46652 → 8081 [SYN] Seq=0 Win=64240 Len=0 MSS=1460 SACK_PERM=1 TSval=1045589877 TSecr=0 WS=128
1711546820.503988504    23 0.273260323    10.10.1.1 → 10.10.1.2    TCP 74 8081 → 46652 [SYN, ACK] Seq=0 Ack=1 Win=65160 Len=0 MSS=1460 SACK_PERM=1 TSval=3169849586 TSecr=1045589877 WS=128
1711546821.503988504    24 0.273290238    10.10.1.2 → 10.10.1.1    TCP 66 46652 → 8081 [ACK] Seq=1 Ack=1 Win=64256 Len=0 TSval=1045589878 TSecr=3169849586
1711546825.503988504    28 0.537269446    10.10.1.2 → 10.10.1.1    TCP 83 46652 → 8081 [PSH, ACK] Seq=1 Ack=1 Win=64256 Len=17 TSval=1045590142 TSecr=3169849586
1711546827.503988504    30 0.537299193    10.10.1.1 → 10.10.1.2    TCP 66 8081 → 46652 [ACK] Seq=1 Ack=18 Win=65152 Len=0 TSval=3169849850 TSecr=1045590142
1711546829.503988504    32 0.537549730    10.10.1.1 → 10.10.1.2    TCP 83 8081 → 46652 [PSH, ACK] Seq=1 Ack=18 Win=65152 Len=17 TSval=3169849850 TSecr=1045590142
1711546830.503988504    33 0.537580477    10.10.1.2 → 10.10.1.1    TCP 66 46652 → 8081 [ACK] Seq=18 Ack=18 Win=64256 Len=0 TSval=1045590142 TSecr=3169849850
1711546835.503988504    38 0.543449399    10.10.1.2 → 10.10.1.1    TCP 83 46652 → 8081 [PSH, ACK] Seq=18 Ack=18 Win=64256 Len=17 TSval=1045590148 TSecr=3169849850
1711546838.503988504    41 0.543543909    10.10.1.1 → 10.10.1.2    TCP 83 8081 → 46652 [PSH, ACK] Seq=18 Ack=35 Win=65152 Len=17 TSval=3169849856 TSecr=1045590148
1711546843.503988504    46 0.591258303    10.10.1.2 → 10.10.1.1    TCP 66 46652 → 8081 [ACK] Seq=35 Ack=35 Win=64256 Len=0 TSval=1045590196 TSecr=3169849856
1711546844.503988504    47 0.692808658    10.10.1.2 → 10.10.1.1    TCP 83 46652 → 8081 [PSH, ACK] Seq=35 Ack=35 Win=64256 Len=17 TSval=1045590297 TSecr=3169849856
1711546847.503988504    50 0.692904003    10.10.1.1 → 10.10.1.2    TCP 83 8081 → 46652 [PSH, ACK] Seq=35 Ack=52 Win=65152 Len=17 TSval=3169850006 TSecr=1045590297
1711546848.503988504    51 0.692933860    10.10.1.2 → 10.10.1.1    TCP 66 46652 → 8081 [ACK] Seq=52 Ack=52 Win=64256 Len=0 TSval=1045590297 TSecr=3169850006
1711546853.503988504    56 1.007702636    10.10.1.2 → 10.10.1.1    TCP 83 46652 → 8081 [PSH, ACK] Seq=52 Ack=52 Win=64256 Len=17 TSval=1045590612 TSecr=3169850006
1711546856.503988504    59 1.007797362    10.10.1.1 → 10.10.1.2    TCP 83 8081 → 46652 [PSH, ACK] Seq=52 Ack=69 Win=65152 Len=17 TSval=3169850321 TSecr=1045590612
1711546857.503988504    60 1.007826368    10.10.1.2 → 10.10.1.1    TCP 66 46652 → 8081 [ACK] Seq=69 Ack=69 Win=64256 Len=0 TSval=1045590612 TSecr=3169850321
1711546862.503988504    65 1.083213948    10.10.1.2 → 10.10.1.1    TCP 83 46652 → 8081 [PSH, ACK] Seq=69 Ack=69 Win=64256 Len=17 TSval=1045590687 TSecr=3169850321
1711546865.503988504    68 1.083339098    10.10.1.1 → 10.10.1.2    TCP 83 8081 → 46652 [PSH, ACK] Seq=69 Ack=86 Win=65152 Len=17 TSval=3169850396 TSecr=1045590687
1711546866.503988504    69 1.083369448    10.10.1.2 → 10.10.1.1    TCP 66 46652 → 8081 [ACK] Seq=86 Ack=86 Win=64256 Len=0 TSval=1045590688 TSecr=3169850396
1711546871.503988504    74 1.220211312    10.10.1.2 → 10.10.1.1    TCP 83 46652 → 8081 [PSH, ACK] Seq=86 Ack=86 Win=64256 Len=17 TSval=1045590824 TSecr=3169850396
1711546874.503988504    77 1.220335733    10.10.1.1 → 10.10.1.2    TCP 83 8081 → 46652 [PSH, ACK] Seq=86 Ack=103 Win=65152 Len=17 TSval=3169850533 TSecr=1045590824
1711546875.503988504    78 1.220366693    10.10.1.2 → 10.10.1.1    TCP 66 46652 → 8081 [ACK] Seq=103 Ack=103 Win=64256 Len=0 TSval=1045590825 TSecr=3169850533
1711546880.503988504    83 1.284235666    10.10.1.2 → 10.10.1.1    TCP 83 46652 → 8081 [PSH, ACK] Seq=103 Ack=103 Win=64256 Len=17 TSval=1045590888 TSecr=3169850533
1711546883.503988504    86 1.284360087    10.10.1.1 → 10.10.1.2    TCP 83 8081 → 46652 [PSH, ACK] Seq=103 Ack=120 Win=65152 Len=17 TSval=3169850597 TSecr=1045590888
1711546884.503988504    87 1.284390902    10.10.1.2 → 10.10.1.1    TCP 66 46652 → 8081 [ACK] Seq=120 Ack=120 Win=64256 Len=0 TSval=1045590889 TSecr=3169850597
1711546889.503988504    92 1.317096342    10.10.1.2 → 10.10.1.1    TCP 83 46652 → 8081 [PSH, ACK] Seq=120 Ack=120 Win=64256 Len=17 TSval=1045590921 TSecr=3169850597
1711546892.503988504    95 1.317221242    10.10.1.1 → 10.10.1.2    TCP 83 8081 → 46652 [PSH, ACK] Seq=120 Ack=137 Win=65152 Len=17 TSval=3169850630 TSecr=1045590921
1711546897.503988504   100 1.346324346    10.10.1.2 → 10.10.1.1    TCP 83 46652 → 8081 [PSH, ACK] Seq=137 Ack=137 Win=64256 Len=17 TSval=1045590951 TSecr=3169850630
1711546900.503988504   103 1.346454252    10.10.1.1 → 10.10.1.2    TCP 83 8081 → 46652 [PSH, ACK] Seq=137 Ack=154 Win=65152 Len=17 TSval=3169850659 TSecr=1045590951
1711546906.503988504   109 1.391257197    10.10.1.2 → 10.10.1.1    TCP 66 46652 → 8081 [ACK] Seq=154 Ack=154 Win=64256 Len=0 TSval=1045590996 TSecr=3169850659
1711546907.503988504   110 1.447964032    10.10.1.2 → 10.10.1.1    TCP 83 46652 → 8081 [PSH, ACK] Seq=154 Ack=154 Win=64256 Len=17 TSval=1045591052 TSecr=3169850659
1711546909.503988504   112 1.448089484    10.10.1.1 → 10.10.1.2    TCP 83 8081 → 46652 [PSH, ACK] Seq=154 Ack=171 Win=65152 Len=17 TSval=3169850761 TSecr=1045591052
1711546911.503988504   114 1.448122594    10.10.1.2 → 10.10.1.1    TCP 66 46652 → 8081 [ACK] Seq=171 Ack=171 Win=64256 Len=0 TSval=1045591052 TSecr=3169850761
1711546916.503988504   119 1.623616089    10.10.1.2 → 10.10.1.1    TCP 83 46652 → 8081 [PSH, ACK] Seq=171 Ack=171 Win=64256 Len=17 TSval=1045591228 TSecr=3169850761
1711546918.503988504   121 1.623742393    10.10.1.1 → 10.10.1.2    TCP 83 8081 → 46652 [PSH, ACK] Seq=171 Ack=188 Win=65152 Len=17 TSval=3169850937 TSecr=1045591228
1711546920.503988504   123 1.623772944    10.10.1.2 → 10.10.1.1    TCP 66 46652 → 8081 [ACK] Seq=188 Ack=188 Win=64256 Len=0 TSval=1045591228 TSecr=3169850937
1711546925.503988504   128 1.730013703    10.10.1.2 → 10.10.1.1    TCP 83 46652 → 8081 [PSH, ACK] Seq=188 Ack=188 Win=64256 Len=17 TSval=1045591334 TSecr=3169850937
1711546927.503988504   130 1.730139999    10.10.1.1 → 10.10.1.2    TCP 83 8081 → 46652 [PSH, ACK] Seq=188 Ack=205 Win=65152 Len=17 TSval=3169851043 TSecr=1045591334
1711546929.503988504   132 1.730170705    10.10.1.2 → 10.10.1.1    TCP 66 46652 → 8081 [ACK] Seq=205 Ack=205 Win=64256 Len=0 TSval=1045591334 TSecr=3169851043
1711546935.503988504   138 1.759180714    10.10.1.2 → 10.10.1.1    TCP 83 46652 → 8081 [PSH, ACK] Seq=205 Ack=205 Win=64256 Len=17 TSval=1045591363 TSecr=3169851043
1711546936.503988504   139 1.759254026    10.10.1.1 → 10.10.1.2    TCP 83 8081 → 46652 [PSH, ACK] Seq=205 Ack=222 Win=65152 Len=17 TSval=3169851072 TSecr=1045591363
1711546942.503988504   145 1.769059549    10.10.1.2 → 10.10.1.1    TCP 83 46652 → 8081 [PSH, ACK] Seq=222 Ack=222 Win=64256 Len=17 TSval=1045591373 TSecr=3169851072
1711546944.503988504   147 1.769168517    10.10.1.1 → 10.10.1.2    TCP 83 8081 → 46652 [PSH, ACK] Seq=222 Ack=239 Win=65152 Len=17 TSval=3169851082 TSecr=1045591373
1711546950.503988504   153 1.815256186    10.10.1.2 → 10.10.1.1    TCP 66 46652 → 8081 [ACK] Seq=239 Ack=239 Win=64256 Len=0 TSval=1045591420 TSecr=3169851082
1711546951.503988504   154 1.939556897    10.10.1.2 → 10.10.1.1    TCP 83 46652 → 8081 [PSH, ACK] Seq=239 Ack=239 Win=64256 Len=17 TSval=1045591544 TSecr=3169851082
1711546953.503988504   156 1.939654249    10.10.1.1 → 10.10.1.2    TCP 83 8081 → 46652 [PSH, ACK] Seq=239 Ack=256 Win=65152 Len=17 TSval=3169851253 TSecr=1045591544
1711546954.503988504   157 1.939692595    10.10.1.2 → 10.10.1.1    TCP 66 46652 → 8081 [ACK] Seq=256 Ack=256 Win=64256 Len=0 TSval=1045591544 TSecr=3169851253
1711546960.503988504   163 2.262833333    10.10.1.2 → 10.10.1.1    TCP 83 46652 → 8081 [PSH, ACK] Seq=256 Ack=256 Win=64256 Len=17 TSval=1045591867 TSecr=3169851253
1711546963.503988504   166 2.262930374    10.10.1.1 → 10.10.1.2    TCP 83 8081 → 46652 [PSH, ACK] Seq=256 Ack=273 Win=65152 Len=17 TSval=3169851576 TSecr=1045591867
1711546964.503988504   167 2.262959635    10.10.1.2 → 10.10.1.1    TCP 66 46652 → 8081 [ACK] Seq=273 Ack=273 Win=64256 Len=0 TSval=1045591867 TSecr=3169851576
1711546969.503988504   172 2.324593170    10.10.1.2 → 10.10.1.1    TCP 83 46652 → 8081 [PSH, ACK] Seq=273 Ack=273 Win=64256 Len=17 TSval=1045591929 TSecr=3169851576
1711546972.503988504   175 2.324690431    10.10.1.1 → 10.10.1.2    TCP 83 8081 → 46652 [PSH, ACK] Seq=273 Ack=290 Win=65152 Len=17 TSval=3169851638 TSecr=1045591929
1711546973.503988504   176 2.324719526    10.10.1.2 → 10.10.1.1    TCP 66 46652 → 8081 [ACK] Seq=290 Ack=290 Win=64256 Len=0 TSval=1045591929 TSecr=3169851638
1711546978.503988504   181 2.429827146    10.10.1.2 → 10.10.1.1    TCP 83 46652 → 8081 [PSH, ACK] Seq=290 Ack=290 Win=64256 Len=17 TSval=1045592034 TSecr=3169851638
1711546981.503988504   184 2.429924186    10.10.1.1 → 10.10.1.2    TCP 83 8081 → 46652 [PSH, ACK] Seq=290 Ack=307 Win=65152 Len=17 TSval=3169851743 TSecr=1045592034
1711546982.503988504   185 2.429953237    10.10.1.2 → 10.10.1.1    TCP 66 46652 → 8081 [ACK] Seq=307 Ack=307 Win=64256 Len=0 TSval=1045592034 TSecr=3169851743
1711546987.503988504   190 2.487824216    10.10.1.2 → 10.10.1.1    TCP 83 46652 → 8081 [PSH, ACK] Seq=307 Ack=307 Win=64256 Len=17 TSval=1045592092 TSecr=3169851743
1711546990.503988504   193 2.487919093    10.10.1.1 → 10.10.1.2    TCP 83 8081 → 46652 [PSH, ACK] Seq=307 Ack=324 Win=65152 Len=17 TSval=3169851801 TSecr=1045592092
1711546991.503988504   194 2.487948843    10.10.1.2 → 10.10.1.1    TCP 66 46652 → 8081 [ACK] Seq=324 Ack=324 Win=64256 Len=0 TSval=1045592092 TSecr=3169851801
1711546996.503988504   199 2.611026357    10.10.1.2 → 10.10.1.1    TCP 83 46652 → 8081 [PSH, ACK] Seq=324 Ack=324 Win=64256 Len=17 TSval=1045592215 TSecr=3169851801
1711546999.503988504   202 2.611122006    10.10.1.1 → 10.10.1.2    TCP 83 8081 → 46652 [PSH, ACK] Seq=324 Ack=341 Win=65152 Len=17 TSval=3169851924 TSecr=1045592215
1711547001.503988504   204 2.611192649    10.10.1.2 → 10.10.1.1    TCP 66 46652 → 8081 [ACK] Seq=341 Ack=341 Win=64256 Len=0 TSval=1045592215 TSecr=3169851924
1711547005.503988504   208 2.712416760    10.10.1.2 → 10.10.1.1    TCP 83 46652 → 8081 [PSH, ACK] Seq=341 Ack=341 Win=64256 Len=17 TSval=1045592317 TSecr=3169851924
1711547008.503988504   211 2.712512129    10.10.1.1 → 10.10.1.2    TCP 83 8081 → 46652 [PSH, ACK] Seq=341 Ack=358 Win=65152 Len=17 TSval=3169852025 TSecr=1045592317
1711547009.503988504   212 2.712545309    10.10.1.2 → 10.10.1.1    TCP 66 46652 → 8081 [ACK] Seq=358 Ack=358 Win=64256 Len=0 TSval=1045592317 TSecr=3169852025
1711547014.503988504   217 2.754091774    10.10.1.2 → 10.10.1.1    TCP 83 46652 → 8081 [PSH, ACK] Seq=358 Ack=358 Win=64256 Len=17 TSval=1045592358 TSecr=3169852025
1711547016.503988504   219 2.754188353    10.10.1.1 → 10.10.1.2    TCP 83 8081 → 46652 [PSH, ACK] Seq=358 Ack=375 Win=65152 Len=17 TSval=3169852067 TSecr=1045592358
1711547017.503988504   220 2.754226898    10.10.1.2 → 10.10.1.1    TCP 66 46652 → 8081 [ACK] Seq=375 Ack=375 Win=64256 Len=0 TSval=1045592359 TSecr=3169852067
1711547023.503988504   226 2.788001395    10.10.1.2 → 10.10.1.1    TCP 83 46652 → 8081 [PSH, ACK] Seq=375 Ack=375 Win=64256 Len=17 TSval=1045592392 TSecr=3169852067
1711547025.503988504   228 2.788098389    10.10.1.1 → 10.10.1.2    TCP 83 8081 → 46652 [PSH, ACK] Seq=375 Ack=392 Win=65152 Len=17 TSval=3169852101 TSecr=1045592392
1711547031.503988504   234 2.831255802    10.10.1.2 → 10.10.1.1    TCP 66 46652 → 8081 [ACK] Seq=392 Ack=392 Win=64256 Len=0 TSval=1045592436 TSecr=3169852101
1711547032.503988504   235 2.932104541    10.10.1.2 → 10.10.1.1    TCP 83 46652 → 8081 [PSH, ACK] Seq=392 Ack=392 Win=64256 Len=17 TSval=1045592536 TSecr=3169852101
1711547034.503988504   237 2.932202382    10.10.1.1 → 10.10.1.2    TCP 83 8081 → 46652 [PSH, ACK] Seq=392 Ack=409 Win=65152 Len=17 TSval=3169852245 TSecr=1045592536
1711547035.503988504   238 2.932238840    10.10.1.2 → 10.10.1.1    TCP 66 46652 → 8081 [ACK] Seq=409 Ack=409 Win=64256 Len=0 TSval=1045592537 TSecr=3169852245
1711547041.503988504   244 3.277101621    10.10.1.2 → 10.10.1.1    TCP 83 46652 → 8081 [PSH, ACK] Seq=409 Ack=409 Win=64256 Len=17 TSval=1045592881 TSecr=3169852245
1711547044.503988504   247 3.277197804    10.10.1.1 → 10.10.1.2    TCP 83 8081 → 46652 [PSH, ACK] Seq=409 Ack=426 Win=65152 Len=17 TSval=3169852590 TSecr=1045592881
1711547045.503988504   248 3.277231230    10.10.1.2 → 10.10.1.1    TCP 66 46652 → 8081 [ACK] Seq=426 Ack=426 Win=64256 Len=0 TSval=1045592882 TSecr=3169852590
1711547051.503988504   254 3.619472102    10.10.1.2 → 10.10.1.1    TCP 83 46652 → 8081 [PSH, ACK] Seq=426 Ack=426 Win=64256 Len=17 TSval=1045593224 TSecr=3169852590
1711547054.503988504   257 3.619565980    10.10.1.1 → 10.10.1.2    TCP 83 8081 → 46652 [PSH, ACK] Seq=426 Ack=443 Win=65152 Len=17 TSval=3169852933 TSecr=1045593224
1711547055.503988504   258 3.619599836    10.10.1.2 → 10.10.1.1    TCP 66 46652 → 8081 [ACK] Seq=443 Ack=443 Win=64256 Len=0 TSval=1045593224 TSecr=3169852933
1711547060.503988504   263 3.671599968    10.10.1.2 → 10.10.1.1    TCP 83 46652 → 8081 [PSH, ACK] Seq=443 Ack=443 Win=64256 Len=17 TSval=1045593276 TSecr=3169852933
1711547063.503988504   266 3.671723406    10.10.1.1 → 10.10.1.2    TCP 83 8081 → 46652 [PSH, ACK] Seq=443 Ack=460 Win=65152 Len=17 TSval=3169852985 TSecr=1045593276
1711547064.503988504   267 3.671758682    10.10.1.2 → 10.10.1.1    TCP 66 46652 → 8081 [ACK] Seq=460 Ack=460 Win=64256 Len=0 TSval=1045593276 TSecr=3169852985
1711547069.503988504   272 3.735926392    10.10.1.2 → 10.10.1.1    TCP 83 46652 → 8081 [PSH, ACK] Seq=460 Ack=460 Win=64256 Len=17 TSval=1045593340 TSecr=3169852985
1711547072.503988504   275 3.736051845    10.10.1.1 → 10.10.1.2    TCP 83 8081 → 46652 [PSH, ACK] Seq=460 Ack=477 Win=65152 Len=17 TSval=3169853049 TSecr=1045593340
1711547073.503988504   276 3.736087282    10.10.1.2 → 10.10.1.1    TCP 66 46652 → 8081 [ACK] Seq=477 Ack=477 Win=64256 Len=0 TSval=1045593340 TSecr=3169853049
1711547078.503988504   281 3.790994069    10.10.1.2 → 10.10.1.1    TCP 83 46652 → 8081 [PSH, ACK] Seq=477 Ack=477 Win=64256 Len=17 TSval=1045593395 TSecr=3169853049
1711547081.503988504   284 3.791119031    10.10.1.1 → 10.10.1.2    TCP 83 8081 → 46652 [PSH, ACK] Seq=477 Ack=494 Win=65152 Len=17 TSval=3169853104 TSecr=1045593395
1711547082.503988504   285 3.791154921    10.10.1.2 → 10.10.1.1    TCP 66 46652 → 8081 [ACK] Seq=494 Ack=494 Win=64256 Len=0 TSval=1045593395 TSecr=3169853104
1711547088.503988504   291 3.902505723    10.10.1.2 → 10.10.1.1    TCP 83 46652 → 8081 [PSH, ACK] Seq=494 Ack=494 Win=64256 Len=17 TSval=1045593507 TSecr=3169853104
1711547090.503988504   293 3.902639773    10.10.1.1 → 10.10.1.2    TCP 83 8081 → 46652 [PSH, ACK] Seq=494 Ack=511 Win=65152 Len=17 TSval=3169853216 TSecr=1045593507
1711547091.503988504   294 3.902674459    10.10.1.2 → 10.10.1.1    TCP 66 46652 → 8081 [ACK] Seq=511 Ack=511 Win=64256 Len=0 TSval=1045593507 TSecr=3169853216
1711547096.503988504   299 3.919268682    10.10.1.2 → 10.10.1.1    TCP 83 46652 → 8081 [PSH, ACK] Seq=511 Ack=511 Win=64256 Len=17 TSval=1045593524 TSecr=3169853216
1711547099.503988504   302 3.919394487    10.10.1.1 → 10.10.1.2    TCP 83 8081 → 46652 [PSH, ACK] Seq=511 Ack=528 Win=65152 Len=17 TSval=3169853232 TSecr=1045593524
1711547104.503988504   307 3.967257905    10.10.1.2 → 10.10.1.1    TCP 66 46652 → 8081 [ACK] Seq=528 Ack=528 Win=64256 Len=0 TSval=1045593572 TSecr=3169853232
1711547106.503988504   309 4.004831462    10.10.1.2 → 10.10.1.1    TCP 83 46652 → 8081 [PSH, ACK] Seq=528 Ack=528 Win=64256 Len=17 TSval=1045593609 TSecr=3169853232
1711547108.503988504   311 4.005032363    10.10.1.1 → 10.10.1.2    TCP 83 8081 → 46652 [PSH, ACK] Seq=528 Ack=545 Win=65152 Len=17 TSval=3169853318 TSecr=1045593609
1711547109.503988504   312 4.005064668    10.10.1.2 → 10.10.1.1    TCP 66 46652 → 8081 [ACK] Seq=545 Ack=545 Win=64256 Len=0 TSval=1045593609 TSecr=3169853318
1711547114.503988504   317 4.134790555    10.10.1.2 → 10.10.1.1    TCP 83 46652 → 8081 [PSH, ACK] Seq=545 Ack=545 Win=64256 Len=17 TSval=1045593739 TSecr=3169853318
1711547117.503988504   320 4.134917477    10.10.1.1 → 10.10.1.2    TCP 83 8081 → 46652 [PSH, ACK] Seq=545 Ack=562 Win=65152 Len=17 TSval=3169853448 TSecr=1045593739
1711547118.503988504   321 4.134954294    10.10.1.2 → 10.10.1.1    TCP 66 46652 → 8081 [ACK] Seq=562 Ack=562 Win=64256 Len=0 TSval=1045593739 TSecr=3169853448
1711547123.503988504   326 4.396054348    10.10.1.2 → 10.10.1.1    TCP 83 46652 → 8081 [PSH, ACK] Seq=562 Ack=562 Win=64256 Len=17 TSval=1045594000 TSecr=3169853448
1711547126.503988504   329 4.396177310    10.10.1.1 → 10.10.1.2    TCP 83 8081 → 46652 [PSH, ACK] Seq=562 Ack=579 Win=65152 Len=17 TSval=3169853709 TSecr=1045594000
1711547127.503988504   330 4.396213847    10.10.1.2 → 10.10.1.1    TCP 66 46652 → 8081 [ACK] Seq=579 Ack=579 Win=64256 Len=0 TSval=1045594001 TSecr=3169853709
1711547132.503988504   335 4.472000312    10.10.1.2 → 10.10.1.1    TCP 83 46652 → 8081 [PSH, ACK] Seq=579 Ack=579 Win=64256 Len=17 TSval=1045594076 TSecr=3169853709
1711547135.503988504   338 4.472126634    10.10.1.1 → 10.10.1.2    TCP 83 8081 → 46652 [PSH, ACK] Seq=579 Ack=596 Win=65152 Len=17 TSval=3169853785 TSecr=1045594076
1711547136.503988504   339 4.472162483    10.10.1.2 → 10.10.1.1    TCP 66 46652 → 8081 [ACK] Seq=596 Ack=596 Win=64256 Len=0 TSval=1045594076 TSecr=3169853785
1711547141.503988504   344 4.501753491    10.10.1.2 → 10.10.1.1    TCP 83 46652 → 8081 [PSH, ACK] Seq=596 Ack=596 Win=64256 Len=17 TSval=1045594106 TSecr=3169853785
1711547144.503988504   347 4.501879388    10.10.1.1 → 10.10.1.2    TCP 83 8081 → 46652 [PSH, ACK] Seq=596 Ack=613 Win=65152 Len=17 TSval=3169853815 TSecr=1045594106
1711547149.503988504   352 4.543257041    10.10.1.2 → 10.10.1.1    TCP 66 46652 → 8081 [ACK] Seq=613 Ack=613 Win=64256 Len=0 TSval=1045594148 TSecr=3169853815
1711547150.503988504   353 4.613388839    10.10.1.2 → 10.10.1.1    TCP 83 46652 → 8081 [PSH, ACK] Seq=613 Ack=613 Win=64256 Len=17 TSval=1045594218 TSecr=3169853815
1711547153.503988504   356 4.613515761    10.10.1.1 → 10.10.1.2    TCP 83 8081 → 46652 [PSH, ACK] Seq=613 Ack=630 Win=65152 Len=17 TSval=3169853926 TSecr=1045594218
1711547154.503988504   357 4.613554776    10.10.1.2 → 10.10.1.1    TCP 66 46652 → 8081 [ACK] Seq=630 Ack=630 Win=64256 Len=0 TSval=1045594218 TSecr=3169853926
1711547159.503988504   362 4.613838743    10.10.1.2 → 10.10.1.1    TCP 83 46652 → 8081 [PSH, ACK] Seq=630 Ack=630 Win=64256 Len=17 TSval=1045594218 TSecr=3169853926
1711547162.503988504   365 4.613872045    10.10.1.1 → 10.10.1.2    TCP 83 8081 → 46652 [PSH, ACK] Seq=630 Ack=647 Win=65152 Len=17 TSval=3169853927 TSecr=1045594218
1711547167.503988504   370 4.659256616    10.10.1.2 → 10.10.1.1    TCP 66 46652 → 8081 [ACK] Seq=647 Ack=647 Win=64256 Len=0 TSval=1045594264 TSecr=3169853927
1711547168.503988504   371 4.690113932    10.10.1.2 → 10.10.1.1    TCP 83 46652 → 8081 [PSH, ACK] Seq=647 Ack=647 Win=64256 Len=17 TSval=1045594294 TSecr=3169853927
1711547171.503988504   374 4.690241089    10.10.1.1 → 10.10.1.2    TCP 83 8081 → 46652 [PSH, ACK] Seq=647 Ack=664 Win=65152 Len=17 TSval=3169854003 TSecr=1045594294
1711547172.503988504   375 4.690276374    10.10.1.2 → 10.10.1.1    TCP 66 46652 → 8081 [ACK] Seq=664 Ack=664 Win=64256 Len=0 TSval=1045594295 TSecr=3169854003
1711547177.503988504   380 4.945988131    10.10.1.2 → 10.10.1.1    TCP 83 46652 → 8081 [PSH, ACK] Seq=664 Ack=664 Win=64256 Len=17 TSval=1045594550 TSecr=3169854003
1711547180.503988504   383 4.946118340    10.10.1.1 → 10.10.1.2    TCP 83 8081 → 46652 [PSH, ACK] Seq=664 Ack=681 Win=65152 Len=17 TSval=3169854259 TSecr=1045594550
1711547181.503988504   384 4.946157204    10.10.1.2 → 10.10.1.1    TCP 66 46652 → 8081 [ACK] Seq=681 Ack=681 Win=64256 Len=0 TSval=1045594550 TSecr=3169854259
1711547186.503988504   389 5.048064804    10.10.1.2 → 10.10.1.1    TCP 83 46652 → 8081 [PSH, ACK] Seq=681 Ack=681 Win=64256 Len=17 TSval=1045594652 TSecr=3169854259
1711547189.503988504   392 5.048190912    10.10.1.1 → 10.10.1.2    TCP 83 8081 → 46652 [PSH, ACK] Seq=681 Ack=698 Win=65152 Len=17 TSval=3169854361 TSecr=1045594652
1711547190.503988504   393 5.048227194    10.10.1.2 → 10.10.1.1    TCP 66 46652 → 8081 [ACK] Seq=698 Ack=698 Win=64256 Len=0 TSval=1045594653 TSecr=3169854361
1711547195.503988504   398 5.092911901    10.10.1.2 → 10.10.1.1    TCP 83 46652 → 8081 [PSH, ACK] Seq=698 Ack=698 Win=64256 Len=17 TSval=1045594697 TSecr=3169854361
1711547198.503988504   401 5.093037512    10.10.1.1 → 10.10.1.2    TCP 83 8081 → 46652 [PSH, ACK] Seq=698 Ack=715 Win=65152 Len=17 TSval=3169854406 TSecr=1045594697
1711547199.503988504   402 5.093073646    10.10.1.2 → 10.10.1.1    TCP 66 46652 → 8081 [ACK] Seq=715 Ack=715 Win=64256 Len=0 TSval=1045594697 TSecr=3169854406
1711547204.503988504   407 5.179070313    10.10.1.2 → 10.10.1.1    TCP 83 46652 → 8081 [PSH, ACK] Seq=715 Ack=715 Win=64256 Len=17 TSval=1045594783 TSecr=3169854406
1711547207.503988504   410 5.179195889    10.10.1.1 → 10.10.1.2    TCP 83 8081 → 46652 [PSH, ACK] Seq=715 Ack=732 Win=65152 Len=17 TSval=3169854492 TSecr=1045594783
1711547208.503988504   411 5.179232068    10.10.1.2 → 10.10.1.1    TCP 66 46652 → 8081 [ACK] Seq=732 Ack=732 Win=64256 Len=0 TSval=1045594784 TSecr=3169854492
1711547213.503988504   416 5.399136788    10.10.1.2 → 10.10.1.1    TCP 83 46652 → 8081 [PSH, ACK] Seq=732 Ack=732 Win=64256 Len=17 TSval=1045595003 TSecr=3169854492
1711547216.503988504   419 5.399258235    10.10.1.1 → 10.10.1.2    TCP 83 8081 → 46652 [PSH, ACK] Seq=732 Ack=749 Win=65152 Len=17 TSval=3169854712 TSecr=1045595003
1711547217.503988504   420 5.399292886    10.10.1.2 → 10.10.1.1    TCP 66 46652 → 8081 [ACK] Seq=749 Ack=749 Win=64256 Len=0 TSval=1045595004 TSecr=3169854712
1711547223.503988504   426 5.459388221    10.10.1.2 → 10.10.1.1    TCP 83 46652 → 8081 [PSH, ACK] Seq=749 Ack=749 Win=64256 Len=17 TSval=1045595064 TSecr=3169854712
1711547226.503988504   429 5.459512316    10.10.1.1 → 10.10.1.2    TCP 83 8081 → 46652 [PSH, ACK] Seq=749 Ack=766 Win=65152 Len=17 TSval=3169854772 TSecr=1045595064
1711547227.503988504   430 5.459547816    10.10.1.2 → 10.10.1.1    TCP 66 46652 → 8081 [ACK] Seq=766 Ack=766 Win=64256 Len=0 TSval=1045595064 TSecr=3169854772
1711547232.503988504   435 5.509767595    10.10.1.2 → 10.10.1.1    TCP 83 46652 → 8081 [PSH, ACK] Seq=766 Ack=766 Win=64256 Len=17 TSval=1045595114 TSecr=3169854772
1711547235.503988504   438 5.509892214    10.10.1.1 → 10.10.1.2    TCP 83 8081 → 46652 [PSH, ACK] Seq=766 Ack=783 Win=65152 Len=17 TSval=3169854823 TSecr=1045595114
1711547236.503988504   439 5.509928401    10.10.1.2 → 10.10.1.1    TCP 66 46652 → 8081 [ACK] Seq=783 Ack=783 Win=64256 Len=0 TSval=1045595114 TSecr=3169854823
1711547241.503988504   444 5.699363850    10.10.1.2 → 10.10.1.1    TCP 83 46652 → 8081 [PSH, ACK] Seq=783 Ack=783 Win=64256 Len=17 TSval=1045595304 TSecr=3169854823
1711547244.503988504   447 5.699487993    10.10.1.1 → 10.10.1.2    TCP 83 8081 → 46652 [PSH, ACK] Seq=783 Ack=800 Win=65152 Len=17 TSval=3169855012 TSecr=1045595304
1711547245.503988504   448 5.699523024    10.10.1.2 → 10.10.1.1    TCP 66 46652 → 8081 [ACK] Seq=800 Ack=800 Win=64256 Len=0 TSval=1045595304 TSecr=3169855012
1711547250.503988504   453 5.940316302    10.10.1.2 → 10.10.1.1    TCP 83 46652 → 8081 [PSH, ACK] Seq=800 Ack=800 Win=64256 Len=17 TSval=1045595545 TSecr=3169855012
1711547253.503988504   456 5.940437000    10.10.1.1 → 10.10.1.2    TCP 83 8081 → 46652 [PSH, ACK] Seq=800 Ack=817 Win=65152 Len=17 TSval=3169855253 TSecr=1045595545
1711547254.503988504   457 5.940470680    10.10.1.2 → 10.10.1.1    TCP 66 46652 → 8081 [ACK] Seq=817 Ack=817 Win=64256 Len=0 TSval=1045595545 TSecr=3169855253
1711547259.503988504   462 5.945098309    10.10.1.2 → 10.10.1.1    TCP 83 46652 → 8081 [PSH, ACK] Seq=817 Ack=817 Win=64256 Len=17 TSval=1045595549 TSecr=3169855253
1711547262.503988504   465 5.945222785    10.10.1.1 → 10.10.1.2    TCP 83 8081 → 46652 [PSH, ACK] Seq=817 Ack=834 Win=65152 Len=17 TSval=3169855258 TSecr=1045595549
1711547267.503988504   470 5.979355617    10.10.1.2 → 10.10.1.1    TCP 83 46652 → 8081 [PSH, ACK] Seq=834 Ack=834 Win=64256 Len=17 TSval=1045595584 TSecr=3169855258
1711547270.503988504   473 5.979486573    10.10.1.1 → 10.10.1.2    TCP 83 8081 → 46652 [PSH, ACK] Seq=834 Ack=851 Win=65152 Len=17 TSval=3169855292 TSecr=1045595584
1711547275.503988504   478 6.023257748    10.10.1.2 → 10.10.1.1    TCP 66 46652 → 8081 [ACK] Seq=851 Ack=851 Win=64256 Len=0 TSval=1045595628 TSecr=3169855292
1711547276.503988504   479 6.075734442    10.10.1.2 → 10.10.1.1    TCP 83 46652 → 8081 [PSH, ACK] Seq=851 Ack=851 Win=64256 Len=17 TSval=1045595680 TSecr=3169855292
1711547279.503988504   482 6.075860324    10.10.1.1 → 10.10.1.2    TCP 83 8081 → 46652 [PSH, ACK] Seq=851 Ack=868 Win=65152 Len=17 TSval=3169855389 TSecr=1045595680
1711547280.503988504   483 6.075893959    10.10.1.2 → 10.10.1.1    TCP 66 46652 → 8081 [ACK] Seq=868 Ack=868 Win=64256 Len=0 TSval=1045595680 TSecr=3169855389
1711547285.503988504   488 6.189900226    10.10.1.2 → 10.10.1.1    TCP 83 46652 → 8081 [PSH, ACK] Seq=868 Ack=868 Win=64256 Len=17 TSval=1045595794 TSecr=3169855389
1711547288.503988504   491 6.190024646    10.10.1.1 → 10.10.1.2    TCP 83 8081 → 46652 [PSH, ACK] Seq=868 Ack=885 Win=65152 Len=17 TSval=3169855503 TSecr=1045595794
1711547289.503988504   492 6.190057717    10.10.1.2 → 10.10.1.1    TCP 66 46652 → 8081 [ACK] Seq=885 Ack=885 Win=64256 Len=0 TSval=1045595794 TSecr=3169855503
1711547294.503988504   497 6.288719190    10.10.1.2 → 10.10.1.1    TCP 83 46652 → 8081 [PSH, ACK] Seq=885 Ack=885 Win=64256 Len=17 TSval=1045595893 TSecr=3169855503
1711547297.503988504   500 6.288847776    10.10.1.1 → 10.10.1.2    TCP 83 8081 → 46652 [PSH, ACK] Seq=885 Ack=902 Win=65152 Len=17 TSval=3169855602 TSecr=1045595893
1711547298.503988504   501 6.288882293    10.10.1.2 → 10.10.1.1    TCP 66 46652 → 8081 [ACK] Seq=902 Ack=902 Win=64256 Len=0 TSval=1045595893 TSecr=3169855602
1711547303.503988504   506 6.521895228    10.10.1.2 → 10.10.1.1    TCP 83 46652 → 8081 [PSH, ACK] Seq=902 Ack=902 Win=64256 Len=17 TSval=1045596126 TSecr=3169855602
1711547306.503988504   509 6.522015952    10.10.1.1 → 10.10.1.2    TCP 83 8081 → 46652 [PSH, ACK] Seq=902 Ack=919 Win=65152 Len=17 TSval=3169855835 TSecr=1045596126
1711547307.503988504   510 6.522049114    10.10.1.2 → 10.10.1.1    TCP 66 46652 → 8081 [ACK] Seq=919 Ack=919 Win=64256 Len=0 TSval=1045596126 TSecr=3169855835
1711547312.503988504   515 6.580606970    10.10.1.2 → 10.10.1.1    TCP 83 46652 → 8081 [PSH, ACK] Seq=919 Ack=919 Win=64256 Len=17 TSval=1045596185 TSecr=3169855835
1711547315.503988504   518 6.580731846    10.10.1.1 → 10.10.1.2    TCP 83 8081 → 46652 [PSH, ACK] Seq=919 Ack=936 Win=65152 Len=17 TSval=3169855894 TSecr=1045596185
1711547316.503988504   519 6.580766474    10.10.1.2 → 10.10.1.1    TCP 66 46652 → 8081 [ACK] Seq=936 Ack=936 Win=64256 Len=0 TSval=1045596185 TSecr=3169855894
1711547321.503988504   524 6.671247960    10.10.1.2 → 10.10.1.1    TCP 83 46652 → 8081 [PSH, ACK] Seq=936 Ack=936 Win=64256 Len=17 TSval=1045596275 TSecr=3169855894
1711547324.503988504   527 6.671373072    10.10.1.1 → 10.10.1.2    TCP 83 8081 → 46652 [PSH, ACK] Seq=936 Ack=953 Win=65152 Len=17 TSval=3169855984 TSecr=1045596275
1711547325.503988504   528 6.671408176    10.10.1.2 → 10.10.1.1    TCP 66 46652 → 8081 [ACK] Seq=953 Ack=953 Win=64256 Len=0 TSval=1045596276 TSecr=3169855984
1711547330.503988504   533 6.875494572    10.10.1.2 → 10.10.1.1    TCP 83 46652 → 8081 [PSH, ACK] Seq=953 Ack=953 Win=64256 Len=17 TSval=1045596480 TSecr=3169855984
1711547333.503988504   536 6.875688095    10.10.1.1 → 10.10.1.2    TCP 83 8081 → 46652 [PSH, ACK] Seq=953 Ack=970 Win=65152 Len=17 TSval=3169856189 TSecr=1045596480
1711547334.503988504   537 6.875724410    10.10.1.2 → 10.10.1.1    TCP 66 46652 → 8081 [ACK] Seq=970 Ack=970 Win=64256 Len=0 TSval=1045596480 TSecr=3169856189
1711547339.503988504   542 7.063405903    10.10.1.2 → 10.10.1.1    TCP 83 46652 → 8081 [PSH, ACK] Seq=970 Ack=970 Win=64256 Len=17 TSval=1045596668 TSecr=3169856189
1711547342.503988504   545 7.063531909    10.10.1.1 → 10.10.1.2    TCP 83 8081 → 46652 [PSH, ACK] Seq=970 Ack=987 Win=65152 Len=17 TSval=3169856376 TSecr=1045596668
1711547343.503988504   546 7.063567699    10.10.1.2 → 10.10.1.1    TCP 66 46652 → 8081 [ACK] Seq=987 Ack=987 Win=64256 Len=0 TSval=1045596668 TSecr=3169856376
1711547348.503988504   551 7.070715512    10.10.1.2 → 10.10.1.1    TCP 83 46652 → 8081 [PSH, ACK] Seq=987 Ack=987 Win=64256 Len=17 TSval=1045596675 TSecr=3169856376
1711547351.503988504   554 7.070839540    10.10.1.1 → 10.10.1.2    TCP 83 8081 → 46652 [PSH, ACK] Seq=987 Ack=1004 Win=65152 Len=17 TSval=3169856384 TSecr=1045596675
1711547356.503988504   559 7.105492929    10.10.1.2 → 10.10.1.1    TCP 83 46652 → 8081 [PSH, ACK] Seq=1004 Ack=1004 Win=64256 Len=17 TSval=1045596710 TSecr=3169856384
1711547358.503988504   561 7.105627756    10.10.1.1 → 10.10.1.2    TCP 83 8081 → 46652 [PSH, ACK] Seq=1004 Ack=1021 Win=65152 Len=17 TSval=3169856419 TSecr=1045596710
1711547364.503988504   567 7.147261061    10.10.1.2 → 10.10.1.1    TCP 66 46652 → 8081 [ACK] Seq=1021 Ack=1021 Win=64256 Len=0 TSval=1045596752 TSecr=3169856419
1711547365.503988504   568 7.178755337    10.10.1.2 → 10.10.1.1    TCP 83 46652 → 8081 [PSH, ACK] Seq=1021 Ack=1021 Win=64256 Len=17 TSval=1045596783 TSecr=3169856419
1711547367.503988504   570 7.178885508    10.10.1.1 → 10.10.1.2    TCP 83 8081 → 46652 [PSH, ACK] Seq=1021 Ack=1038 Win=65152 Len=17 TSval=3169856492 TSecr=1045596783
1711547369.503988504   572 7.178931160    10.10.1.2 → 10.10.1.1    TCP 66 46652 → 8081 [ACK] Seq=1038 Ack=1038 Win=64256 Len=0 TSval=1045596783 TSecr=3169856492
1711547374.503988504   577 7.203815370    10.10.1.2 → 10.10.1.1    TCP 83 46652 → 8081 [PSH, ACK] Seq=1038 Ack=1038 Win=64256 Len=17 TSval=1045596808 TSecr=3169856492
1711547376.503988504   579 7.203945219    10.10.1.1 → 10.10.1.2    TCP 83 8081 → 46652 [PSH, ACK] Seq=1038 Ack=1055 Win=65152 Len=17 TSval=3169856517 TSecr=1045596808
1711547382.503988504   585 7.251260033    10.10.1.2 → 10.10.1.1    TCP 66 46652 → 8081 [ACK] Seq=1055 Ack=1055 Win=64256 Len=0 TSval=1045596856 TSecr=3169856517
1711547383.503988504   586 7.404326602    10.10.1.2 → 10.10.1.1    TCP 83 46652 → 8081 [PSH, ACK] Seq=1055 Ack=1055 Win=64256 Len=17 TSval=1045597009 TSecr=3169856517
1711547385.503988504   588 7.404456077    10.10.1.1 → 10.10.1.2    TCP 83 8081 → 46652 [PSH, ACK] Seq=1055 Ack=1072 Win=65152 Len=17 TSval=3169856717 TSecr=1045597009
1711547387.503988504   590 7.404501130    10.10.1.2 → 10.10.1.1    TCP 66 46652 → 8081 [ACK] Seq=1072 Ack=1072 Win=64256 Len=0 TSval=1045597009 TSecr=3169856717
1711547393.503988504   596 7.432629613    10.10.1.2 → 10.10.1.1    TCP 83 46652 → 8081 [PSH, ACK] Seq=1072 Ack=1072 Win=64256 Len=17 TSval=1045597037 TSecr=3169856717
1711547395.503988504   598 7.432758634    10.10.1.1 → 10.10.1.2    TCP 83 8081 → 46652 [PSH, ACK] Seq=1072 Ack=1089 Win=65152 Len=17 TSval=3169856746 TSecr=1045597037
1711547401.503988504   604 7.448683551    10.10.1.2 → 10.10.1.1    TCP 83 46652 → 8081 [PSH, ACK] Seq=1089 Ack=1089 Win=64256 Len=17 TSval=1045597053 TSecr=3169856746
1711547403.503988504   606 7.448818513    10.10.1.1 → 10.10.1.2    TCP 83 8081 → 46652 [PSH, ACK] Seq=1089 Ack=1106 Win=65152 Len=17 TSval=3169856762 TSecr=1045597053
1711547409.503988504   612 7.491258754    10.10.1.2 → 10.10.1.1    TCP 66 46652 → 8081 [ACK] Seq=1106 Ack=1106 Win=64256 Len=0 TSval=1045597096 TSecr=3169856762
1711547410.503988504   613 7.499347153    10.10.1.2 → 10.10.1.1    TCP 83 46652 → 8081 [PSH, ACK] Seq=1106 Ack=1106 Win=64256 Len=17 TSval=1045597104 TSecr=3169856762
1711547413.503988504   616 7.499472965    10.10.1.1 → 10.10.1.2    TCP 83 8081 → 46652 [PSH, ACK] Seq=1106 Ack=1123 Win=65152 Len=17 TSval=3169856812 TSecr=1045597104
1711547414.503988504   617 7.499508766    10.10.1.2 → 10.10.1.1    TCP 66 46652 → 8081 [ACK] Seq=1123 Ack=1123 Win=64256 Len=0 TSval=1045597104 TSecr=3169856812
1711547419.503988504   622 7.568747165    10.10.1.2 → 10.10.1.1    TCP 83 46652 → 8081 [PSH, ACK] Seq=1123 Ack=1123 Win=64256 Len=17 TSval=1045597173 TSecr=3169856812
1711547421.503988504   624 7.568873067    10.10.1.1 → 10.10.1.2    TCP 83 8081 → 46652 [PSH, ACK] Seq=1123 Ack=1140 Win=65152 Len=17 TSval=3169856882 TSecr=1045597173
1711547423.503988504   626 7.568909118    10.10.1.2 → 10.10.1.1    TCP 66 46652 → 8081 [ACK] Seq=1140 Ack=1140 Win=64256 Len=0 TSval=1045597173 TSecr=3169856882
1711547428.503988504   631 7.738823249    10.10.1.2 → 10.10.1.1    TCP 83 46652 → 8081 [PSH, ACK] Seq=1140 Ack=1140 Win=64256 Len=17 TSval=1045597343 TSecr=3169856882
1711547430.503988504   633 7.738947225    10.10.1.1 → 10.10.1.2    TCP 83 8081 → 46652 [PSH, ACK] Seq=1140 Ack=1157 Win=65152 Len=17 TSval=3169857052 TSecr=1045597343
1711547432.503988504   635 7.738983840    10.10.1.2 → 10.10.1.1    TCP 66 46652 → 8081 [ACK] Seq=1157 Ack=1157 Win=64256 Len=0 TSval=1045597343 TSecr=3169857052
1711547437.503988504   640 7.789741793    10.10.1.2 → 10.10.1.1    TCP 83 46652 → 8081 [PSH, ACK] Seq=1157 Ack=1157 Win=64256 Len=17 TSval=1045597394 TSecr=3169857052
1711547439.503988504   642 7.789866280    10.10.1.1 → 10.10.1.2    TCP 83 8081 → 46652 [PSH, ACK] Seq=1157 Ack=1174 Win=65152 Len=17 TSval=3169857103 TSecr=1045597394
1711547441.503988504   644 7.789901690    10.10.1.2 → 10.10.1.1    TCP 66 46652 → 8081 [ACK] Seq=1174 Ack=1174 Win=64256 Len=0 TSval=1045597394 TSecr=3169857103
1711547446.503988504   649 7.793249945    10.10.1.2 → 10.10.1.1    TCP 83 46652 → 8081 [PSH, ACK] Seq=1174 Ack=1174 Win=64256 Len=17 TSval=1045597397 TSecr=3169857103
1711547448.503988504   651 7.793373741    10.10.1.1 → 10.10.1.2    TCP 83 8081 → 46652 [PSH, ACK] Seq=1174 Ack=1191 Win=65152 Len=17 TSval=3169857106 TSecr=1045597397
1711547454.503988504   657 7.835258997    10.10.1.2 → 10.10.1.1    TCP 66 46652 → 8081 [ACK] Seq=1191 Ack=1191 Win=64256 Len=0 TSval=1045597440 TSecr=3169857106
1711547455.503988504   658 7.927973628    10.10.1.2 → 10.10.1.1    TCP 83 46652 → 8081 [PSH, ACK] Seq=1191 Ack=1191 Win=64256 Len=17 TSval=1045597532 TSecr=3169857106
1711547457.503988504   660 7.928100581    10.10.1.1 → 10.10.1.2    TCP 83 8081 → 46652 [PSH, ACK] Seq=1191 Ack=1208 Win=65152 Len=17 TSval=3169857241 TSecr=1045597532
1711547459.503988504   662 7.928137796    10.10.1.2 → 10.10.1.1    TCP 66 46652 → 8081 [ACK] Seq=1208 Ack=1208 Win=64256 Len=0 TSval=1045597532 TSecr=3169857241
1711547464.503988504   667 7.931919558    10.10.1.2 → 10.10.1.1    TCP 83 46652 → 8081 [PSH, ACK] Seq=1208 Ack=1208 Win=64256 Len=17 TSval=1045597536 TSecr=3169857241
1711547466.503988504   669 7.932044604    10.10.1.1 → 10.10.1.2    TCP 83 8081 → 46652 [PSH, ACK] Seq=1208 Ack=1225 Win=65152 Len=17 TSval=3169857245 TSecr=1045597536
1711547472.503988504   675 7.979261481    10.10.1.2 → 10.10.1.1    TCP 66 46652 → 8081 [ACK] Seq=1225 Ack=1225 Win=64256 Len=0 TSval=1045597584 TSecr=3169857245
1711547473.503988504   676 7.981760553    10.10.1.2 → 10.10.1.1    TCP 83 46652 → 8081 [PSH, ACK] Seq=1225 Ack=1225 Win=64256 Len=17 TSval=1045597586 TSecr=3169857245
1711547475.503988504   678 7.981887699    10.10.1.1 → 10.10.1.2    TCP 83 8081 → 46652 [PSH, ACK] Seq=1225 Ack=1242 Win=65152 Len=17 TSval=3169857295 TSecr=1045597586
1711547477.503988504   680 7.981922619    10.10.1.2 → 10.10.1.1    TCP 66 46652 → 8081 [ACK] Seq=1242 Ack=1242 Win=64256 Len=0 TSval=1045597586 TSecr=3169857295
1711547482.503988504   685 8.019972367    10.10.1.2 → 10.10.1.1    TCP 83 46652 → 8081 [PSH, ACK] Seq=1242 Ack=1242 Win=64256 Len=17 TSval=1045597624 TSecr=3169857295
1711547484.503988504   687 8.020097445    10.10.1.1 → 10.10.1.2    TCP 83 8081 → 46652 [PSH, ACK] Seq=1242 Ack=1259 Win=65152 Len=17 TSval=3169857333 TSecr=1045597624
1711547486.503988504   689 8.020132210    10.10.1.2 → 10.10.1.1    TCP 66 46652 → 8081 [ACK] Seq=1259 Ack=1259 Win=64256 Len=0 TSval=1045597624 TSecr=3169857333
1711547491.503988504   694 8.278427400    10.10.1.2 → 10.10.1.1    TCP 83 46652 → 8081 [PSH, ACK] Seq=1259 Ack=1259 Win=64256 Len=17 TSval=1045597883 TSecr=3169857333
1711547494.503988504   697 8.278548571    10.10.1.1 → 10.10.1.2    TCP 83 8081 → 46652 [PSH, ACK] Seq=1259 Ack=1276 Win=65152 Len=17 TSval=3169857591 TSecr=1045597883
1711547495.503988504   698 8.278583046    10.10.1.2 → 10.10.1.1    TCP 66 46652 → 8081 [ACK] Seq=1276 Ack=1276 Win=64256 Len=0 TSval=1045597883 TSecr=3169857591
1711547500.503988504   703 8.462785922    10.10.1.2 → 10.10.1.1    TCP 83 46652 → 8081 [PSH, ACK] Seq=1276 Ack=1276 Win=64256 Len=17 TSval=1045598067 TSecr=3169857591
1711547503.503988504   706 8.462910315    10.10.1.1 → 10.10.1.2    TCP 83 8081 → 46652 [PSH, ACK] Seq=1276 Ack=1293 Win=65152 Len=17 TSval=3169857776 TSecr=1045598067
1711547504.503988504   707 8.462946284    10.10.1.2 → 10.10.1.1    TCP 66 46652 → 8081 [ACK] Seq=1293 Ack=1293 Win=64256 Len=0 TSval=1045598067 TSecr=3169857776
1711547509.503988504   712 8.586563015    10.10.1.2 → 10.10.1.1    TCP 83 46652 → 8081 [PSH, ACK] Seq=1293 Ack=1293 Win=64256 Len=17 TSval=1045598191 TSecr=3169857776
1711547512.503988504   715 8.586687428    10.10.1.1 → 10.10.1.2    TCP 83 8081 → 46652 [PSH, ACK] Seq=1293 Ack=1310 Win=65152 Len=17 TSval=3169857900 TSecr=1045598191
1711547513.503988504   716 8.586722664    10.10.1.2 → 10.10.1.1    TCP 66 46652 → 8081 [ACK] Seq=1310 Ack=1310 Win=64256 Len=0 TSval=1045598191 TSecr=3169857900
1711547518.503988504   721 8.735461077    10.10.1.2 → 10.10.1.1    TCP 83 46652 → 8081 [PSH, ACK] Seq=1310 Ack=1310 Win=64256 Len=17 TSval=1045598340 TSecr=3169857900
1711547521.503988504   724 8.735586706    10.10.1.1 → 10.10.1.2    TCP 83 8081 → 46652 [PSH, ACK] Seq=1310 Ack=1327 Win=65152 Len=17 TSval=3169858049 TSecr=1045598340
1711547522.503988504   725 8.735622594    10.10.1.2 → 10.10.1.1    TCP 66 46652 → 8081 [ACK] Seq=1327 Ack=1327 Win=64256 Len=0 TSval=1045598340 TSecr=3169858049
1711547527.503988504   730 8.874847081    10.10.1.2 → 10.10.1.1    TCP 83 46652 → 8081 [PSH, ACK] Seq=1327 Ack=1327 Win=64256 Len=17 TSval=1045598479 TSecr=3169858049
1711547530.503988504   733 8.874972234    10.10.1.1 → 10.10.1.2    TCP 83 8081 → 46652 [PSH, ACK] Seq=1327 Ack=1344 Win=65152 Len=17 TSval=3169858188 TSecr=1045598479
1711547531.503988504   734 8.875009084    10.10.1.2 → 10.10.1.1    TCP 66 46652 → 8081 [ACK] Seq=1344 Ack=1344 Win=64256 Len=0 TSval=1045598479 TSecr=3169858188
1711547536.503988504   739 9.014827693    10.10.1.2 → 10.10.1.1    TCP 83 46652 → 8081 [PSH, ACK] Seq=1344 Ack=1344 Win=64256 Len=17 TSval=1045598619 TSecr=3169858188
1711547539.503988504   742 9.014952281    10.10.1.1 → 10.10.1.2    TCP 83 8081 → 46652 [PSH, ACK] Seq=1344 Ack=1361 Win=65152 Len=17 TSval=3169858328 TSecr=1045598619
1711547540.503988504   743 9.014987874    10.10.1.2 → 10.10.1.1    TCP 66 46652 → 8081 [ACK] Seq=1361 Ack=1361 Win=64256 Len=0 TSval=1045598619 TSecr=3169858328
1711547545.503988504   748 9.021491693    10.10.1.2 → 10.10.1.1    TCP 83 46652 → 8081 [PSH, ACK] Seq=1361 Ack=1361 Win=64256 Len=17 TSval=1045598626 TSecr=3169858328
1711547547.503988504   750 9.021625308    10.10.1.1 → 10.10.1.2    TCP 83 8081 → 46652 [PSH, ACK] Seq=1361 Ack=1378 Win=65152 Len=17 TSval=3169858335 TSecr=1045598626
1711547553.503988504   756 9.063261008    10.10.1.2 → 10.10.1.1    TCP 66 46652 → 8081 [ACK] Seq=1378 Ack=1378 Win=64256 Len=0 TSval=1045598668 TSecr=3169858335
1711547554.503988504   757 9.067767164    10.10.1.2 → 10.10.1.1    TCP 83 46652 → 8081 [PSH, ACK] Seq=1378 Ack=1378 Win=64256 Len=17 TSval=1045598672 TSecr=3169858335
1711547556.503988504   759 9.067892760    10.10.1.1 → 10.10.1.2    TCP 83 8081 → 46652 [PSH, ACK] Seq=1378 Ack=1395 Win=65152 Len=17 TSval=3169858381 TSecr=1045598672
