1711548274.544164658    28 0.513346271    10.10.1.2 → 10.10.1.1    TCP 83 47420 → 8081 [PSH, ACK] Seq=1 Ack=1 Win=64256 Len=17 TSval=1047039109 TSecr=3171298570
1711548278.544164658    32 0.513591501    10.10.1.1 → 10.10.1.2    TCP 83 8081 → 47420 [PSH, ACK] Seq=1 Ack=18 Win=65152 Len=17 TSval=3171298820 TSecr=1047039109
1711548284.544164658    38 0.514754015    10.10.1.2 → 10.10.1.1    TCP 83 47420 → 8081 [PSH, ACK] Seq=18 Ack=18 Win=64256 Len=17 TSval=1047039111 TSecr=3171298820
1711548287.544164658    41 0.514792793    10.10.1.1 → 10.10.1.2    TCP 83 8081 → 47420 [PSH, ACK] Seq=18 Ack=35 Win=65152 Len=17 TSval=3171298821 TSecr=1047039111
1711548292.544164658    46 0.515948104    10.10.1.2 → 10.10.1.1    TCP 83 47420 → 8081 [PSH, ACK] Seq=35 Ack=35 Win=64256 Len=17 TSval=1047039112 TSecr=3171298821
1711548295.544164658    49 0.515983406    10.10.1.1 → 10.10.1.2    TCP 83 8081 → 47420 [PSH, ACK] Seq=35 Ack=52 Win=65152 Len=17 TSval=3171298822 TSecr=1047039112
1711548300.544164658    54 0.517137330    10.10.1.2 → 10.10.1.1    TCP 83 47420 → 8081 [PSH, ACK] Seq=52 Ack=52 Win=64256 Len=17 TSval=1047039113 TSecr=3171298822
1711548303.544164658    57 0.517168663    10.10.1.1 → 10.10.1.2    TCP 83 8081 → 47420 [PSH, ACK] Seq=52 Ack=69 Win=65152 Len=17 TSval=3171298823 TSecr=1047039113
1711548308.544164658    62 0.518319153    10.10.1.2 → 10.10.1.1    TCP 83 47420 → 8081 [PSH, ACK] Seq=69 Ack=69 Win=64256 Len=17 TSval=1047039114 TSecr=3171298823
1711548310.544164658    64 0.518348729    10.10.1.1 → 10.10.1.2    TCP 83 8081 → 47420 [PSH, ACK] Seq=69 Ack=86 Win=65152 Len=17 TSval=3171298825 TSecr=1047039114
1711548316.544164658    70 0.519499725    10.10.1.2 → 10.10.1.1    TCP 83 47420 → 8081 [PSH, ACK] Seq=86 Ack=86 Win=64256 Len=17 TSval=1047039115 TSecr=3171298825
1711548318.544164658    72 0.519533456    10.10.1.1 → 10.10.1.2    TCP 83 8081 → 47420 [PSH, ACK] Seq=86 Ack=103 Win=65152 Len=17 TSval=3171298826 TSecr=1047039115
1711548324.544164658    78 0.520685369    10.10.1.2 → 10.10.1.1    TCP 83 47420 → 8081 [PSH, ACK] Seq=103 Ack=103 Win=64256 Len=17 TSval=1047039116 TSecr=3171298826
1711548326.544164658    80 0.520715725    10.10.1.1 → 10.10.1.2    TCP 83 8081 → 47420 [PSH, ACK] Seq=103 Ack=120 Win=65152 Len=17 TSval=3171298827 TSecr=1047039116
1711548332.544164658    86 0.521870770    10.10.1.2 → 10.10.1.1    TCP 83 47420 → 8081 [PSH, ACK] Seq=120 Ack=120 Win=64256 Len=17 TSval=1047039118 TSecr=3171298827
1711548333.544164658    87 0.521898600    10.10.1.1 → 10.10.1.2    TCP 83 8081 → 47420 [PSH, ACK] Seq=120 Ack=137 Win=65152 Len=17 TSval=3171298828 TSecr=1047039118
1711548339.544164658    93 0.523052283    10.10.1.2 → 10.10.1.1    TCP 83 47420 → 8081 [PSH, ACK] Seq=137 Ack=137 Win=64256 Len=17 TSval=1047039119 TSecr=3171298828
1711548341.544164658    95 0.523085004    10.10.1.1 → 10.10.1.2    TCP 83 8081 → 47420 [PSH, ACK] Seq=137 Ack=154 Win=65152 Len=17 TSval=3171298829 TSecr=1047039119
1711548347.544164658   101 0.524237474    10.10.1.2 → 10.10.1.1    TCP 83 47420 → 8081 [PSH, ACK] Seq=154 Ack=154 Win=64256 Len=17 TSval=1047039120 TSecr=3171298829
1711548349.544164658   103 0.524273235    10.10.1.1 → 10.10.1.2    TCP 83 8081 → 47420 [PSH, ACK] Seq=154 Ack=171 Win=65152 Len=17 TSval=3171298830 TSecr=1047039120
1711548355.544164658   109 0.525427623    10.10.1.2 → 10.10.1.1    TCP 83 47420 → 8081 [PSH, ACK] Seq=171 Ack=171 Win=64256 Len=17 TSval=1047039121 TSecr=3171298830
1711548357.544164658   111 0.525456936    10.10.1.1 → 10.10.1.2    TCP 83 8081 → 47420 [PSH, ACK] Seq=171 Ack=188 Win=65152 Len=17 TSval=3171298832 TSecr=1047039121
1711548363.544164658   117 0.526608269    10.10.1.2 → 10.10.1.1    TCP 83 47420 → 8081 [PSH, ACK] Seq=188 Ack=188 Win=64256 Len=17 TSval=1047039122 TSecr=3171298832
1711548365.544164658   119 0.526636949    10.10.1.1 → 10.10.1.2    TCP 83 8081 → 47420 [PSH, ACK] Seq=188 Ack=205 Win=65152 Len=17 TSval=3171298833 TSecr=1047039122
1711548371.544164658   125 0.527759302    10.10.1.2 → 10.10.1.1    TCP 83 47420 → 8081 [PSH, ACK] Seq=205 Ack=205 Win=64256 Len=17 TSval=1047039124 TSecr=3171298833
1711548373.544164658   127 0.527792914    10.10.1.1 → 10.10.1.2    TCP 83 8081 → 47420 [PSH, ACK] Seq=205 Ack=222 Win=65152 Len=17 TSval=3171298834 TSecr=1047039124
1711548379.544164658   133 0.528947987    10.10.1.2 → 10.10.1.1    TCP 83 47420 → 8081 [PSH, ACK] Seq=222 Ack=222 Win=64256 Len=17 TSval=1047039125 TSecr=3171298834
1711548381.544164658   135 0.528979890    10.10.1.1 → 10.10.1.2    TCP 83 8081 → 47420 [PSH, ACK] Seq=222 Ack=239 Win=65152 Len=17 TSval=3171298835 TSecr=1047039125
1711548387.544164658   141 0.530130971    10.10.1.2 → 10.10.1.1    TCP 83 47420 → 8081 [PSH, ACK] Seq=239 Ack=239 Win=64256 Len=17 TSval=1047039126 TSecr=3171298835
1711548389.544164658   143 0.530161828    10.10.1.1 → 10.10.1.2    TCP 83 8081 → 47420 [PSH, ACK] Seq=239 Ack=256 Win=65152 Len=17 TSval=3171298836 TSecr=1047039126
1711548395.544164658   149 0.531313509    10.10.1.2 → 10.10.1.1    TCP 83 47420 → 8081 [PSH, ACK] Seq=256 Ack=256 Win=64256 Len=17 TSval=1047039127 TSecr=3171298836
1711548397.544164658   151 0.531358349    10.10.1.1 → 10.10.1.2    TCP 83 8081 → 47420 [PSH, ACK] Seq=256 Ack=273 Win=65152 Len=17 TSval=3171298838 TSecr=1047039127
1711548403.544164658   157 0.532511403    10.10.1.2 → 10.10.1.1    TCP 83 47420 → 8081 [PSH, ACK] Seq=273 Ack=273 Win=64256 Len=17 TSval=1047039128 TSecr=3171298838
1711548405.544164658   159 0.532546080    10.10.1.1 → 10.10.1.2    TCP 83 8081 → 47420 [PSH, ACK] Seq=273 Ack=290 Win=65152 Len=17 TSval=3171298839 TSecr=1047039128
1711548411.544164658   165 0.533700590    10.10.1.2 → 10.10.1.1    TCP 83 47420 → 8081 [PSH, ACK] Seq=290 Ack=290 Win=64256 Len=17 TSval=1047039129 TSecr=3171298839
1711548413.544164658   167 0.533731086    10.10.1.1 → 10.10.1.2    TCP 83 8081 → 47420 [PSH, ACK] Seq=290 Ack=307 Win=65152 Len=17 TSval=3171298840 TSecr=1047039129
1711548419.544164658   173 0.534884356    10.10.1.2 → 10.10.1.1    TCP 83 47420 → 8081 [PSH, ACK] Seq=307 Ack=307 Win=64256 Len=17 TSval=1047039131 TSecr=3171298840
1711548421.544164658   175 0.534914831    10.10.1.1 → 10.10.1.2    TCP 83 8081 → 47420 [PSH, ACK] Seq=307 Ack=324 Win=65152 Len=17 TSval=3171298841 TSecr=1047039131
1711548427.544164658   181 0.536066935    10.10.1.2 → 10.10.1.1    TCP 83 47420 → 8081 [PSH, ACK] Seq=324 Ack=324 Win=64256 Len=17 TSval=1047039132 TSecr=3171298841
1711548429.544164658   183 0.536102208    10.10.1.1 → 10.10.1.2    TCP 83 8081 → 47420 [PSH, ACK] Seq=324 Ack=341 Win=65152 Len=17 TSval=3171298842 TSecr=1047039132
1711548435.544164658   189 0.537256950    10.10.1.2 → 10.10.1.1    TCP 83 47420 → 8081 [PSH, ACK] Seq=341 Ack=341 Win=64256 Len=17 TSval=1047039133 TSecr=3171298842
1711548437.544164658   191 0.537287402    10.10.1.1 → 10.10.1.2    TCP 83 8081 → 47420 [PSH, ACK] Seq=341 Ack=358 Win=65152 Len=17 TSval=3171298843 TSecr=1047039133
1711548443.544164658   197 0.538439048    10.10.1.2 → 10.10.1.1    TCP 83 47420 → 8081 [PSH, ACK] Seq=358 Ack=358 Win=64256 Len=17 TSval=1047039134 TSecr=3171298843
1711548445.544164658   199 0.538469949    10.10.1.1 → 10.10.1.2    TCP 83 8081 → 47420 [PSH, ACK] Seq=358 Ack=375 Win=65152 Len=17 TSval=3171298845 TSecr=1047039134
1711548451.544164658   205 0.539622167    10.10.1.2 → 10.10.1.1    TCP 83 47420 → 8081 [PSH, ACK] Seq=375 Ack=375 Win=64256 Len=17 TSval=1047039135 TSecr=3171298845
1711548453.544164658   207 0.539655566    10.10.1.1 → 10.10.1.2    TCP 83 8081 → 47420 [PSH, ACK] Seq=375 Ack=392 Win=65152 Len=17 TSval=3171298846 TSecr=1047039135
1711548459.544164658   213 0.540769533    10.10.1.2 → 10.10.1.1    TCP 83 47420 → 8081 [PSH, ACK] Seq=392 Ack=392 Win=64256 Len=17 TSval=1047039137 TSecr=3171298846
1711548461.544164658   215 0.540800393    10.10.1.1 → 10.10.1.2    TCP 83 8081 → 47420 [PSH, ACK] Seq=392 Ack=409 Win=65152 Len=17 TSval=3171298847 TSecr=1047039137
1711548467.544164658   221 0.541953840    10.10.1.2 → 10.10.1.1    TCP 83 47420 → 8081 [PSH, ACK] Seq=409 Ack=409 Win=64256 Len=17 TSval=1047039138 TSecr=3171298847
1711548469.544164658   223 0.541983787    10.10.1.1 → 10.10.1.2    TCP 83 8081 → 47420 [PSH, ACK] Seq=409 Ack=426 Win=65152 Len=17 TSval=3171298848 TSecr=1047039138
1711548475.544164658   229 0.543134602    10.10.1.2 → 10.10.1.1    TCP 83 47420 → 8081 [PSH, ACK] Seq=426 Ack=426 Win=64256 Len=17 TSval=1047039139 TSecr=3171298848
1711548477.544164658   231 0.543165054    10.10.1.1 → 10.10.1.2    TCP 83 8081 → 47420 [PSH, ACK] Seq=426 Ack=443 Win=65152 Len=17 TSval=3171298849 TSecr=1047039139
1711548483.544164658   237 0.544318746    10.10.1.2 → 10.10.1.1    TCP 83 47420 → 8081 [PSH, ACK] Seq=443 Ack=443 Win=64256 Len=17 TSval=1047039140 TSecr=3171298849
1711548485.544164658   239 0.544353875    10.10.1.1 → 10.10.1.2    TCP 83 8081 → 47420 [PSH, ACK] Seq=443 Ack=460 Win=65152 Len=17 TSval=3171298851 TSecr=1047039140
1711548491.544164658   245 0.545509123    10.10.1.2 → 10.10.1.1    TCP 83 47420 → 8081 [PSH, ACK] Seq=460 Ack=460 Win=64256 Len=17 TSval=1047039141 TSecr=3171298851
1711548493.544164658   247 0.545539979    10.10.1.1 → 10.10.1.2    TCP 83 8081 → 47420 [PSH, ACK] Seq=460 Ack=477 Win=65152 Len=17 TSval=3171298852 TSecr=1047039141
1711548499.544164658   253 0.546690620    10.10.1.2 → 10.10.1.1    TCP 83 47420 → 8081 [PSH, ACK] Seq=477 Ack=477 Win=64256 Len=17 TSval=1047039142 TSecr=3171298852
1711548501.544164658   255 0.546721180    10.10.1.1 → 10.10.1.2    TCP 83 8081 → 47420 [PSH, ACK] Seq=477 Ack=494 Win=65152 Len=17 TSval=3171298853 TSecr=1047039142
1711548507.544164658   261 0.547873807    10.10.1.2 → 10.10.1.1    TCP 83 47420 → 8081 [PSH, ACK] Seq=494 Ack=494 Win=64256 Len=17 TSval=1047039144 TSecr=3171298853
1711548509.544164658   263 0.547908592    10.10.1.1 → 10.10.1.2    TCP 83 8081 → 47420 [PSH, ACK] Seq=494 Ack=511 Win=65152 Len=17 TSval=3171298854 TSecr=1047039144
1711548515.544164658   269 0.549062579    10.10.1.2 → 10.10.1.1    TCP 83 47420 → 8081 [PSH, ACK] Seq=511 Ack=511 Win=64256 Len=17 TSval=1047039145 TSecr=3171298854
1711548517.544164658   271 0.549093309    10.10.1.1 → 10.10.1.2    TCP 83 8081 → 47420 [PSH, ACK] Seq=511 Ack=528 Win=65152 Len=17 TSval=3171298855 TSecr=1047039145
1711548523.544164658   277 0.550244535    10.10.1.2 → 10.10.1.1    TCP 83 47420 → 8081 [PSH, ACK] Seq=528 Ack=528 Win=64256 Len=17 TSval=1047039146 TSecr=3171298855
1711548525.544164658   279 0.550273358    10.10.1.1 → 10.10.1.2    TCP 83 8081 → 47420 [PSH, ACK] Seq=528 Ack=545 Win=65152 Len=17 TSval=3171298856 TSecr=1047039146
1711548531.544164658   285 0.551423939    10.10.1.2 → 10.10.1.1    TCP 83 47420 → 8081 [PSH, ACK] Seq=545 Ack=545 Win=64256 Len=17 TSval=1047039147 TSecr=3171298856
1711548533.544164658   287 0.551456544    10.10.1.1 → 10.10.1.2    TCP 83 8081 → 47420 [PSH, ACK] Seq=545 Ack=562 Win=65152 Len=17 TSval=3171298858 TSecr=1047039147
1711548539.544164658   293 0.552608953    10.10.1.2 → 10.10.1.1    TCP 83 47420 → 8081 [PSH, ACK] Seq=562 Ack=562 Win=64256 Len=17 TSval=1047039148 TSecr=3171298858
1711548541.544164658   295 0.552639473    10.10.1.1 → 10.10.1.2    TCP 83 8081 → 47420 [PSH, ACK] Seq=562 Ack=579 Win=65152 Len=17 TSval=3171298859 TSecr=1047039148
1711548547.544164658   301 0.553793860    10.10.1.2 → 10.10.1.1    TCP 83 47420 → 8081 [PSH, ACK] Seq=579 Ack=579 Win=64256 Len=17 TSval=1047039150 TSecr=3171298859
1711548549.544164658   303 0.553824380    10.10.1.1 → 10.10.1.2    TCP 83 8081 → 47420 [PSH, ACK] Seq=579 Ack=596 Win=65152 Len=17 TSval=3171298860 TSecr=1047039150
1711548555.544164658   309 0.554976261    10.10.1.2 → 10.10.1.1    TCP 83 47420 → 8081 [PSH, ACK] Seq=596 Ack=596 Win=64256 Len=17 TSval=1047039151 TSecr=3171298860
1711548557.544164658   311 0.555007245    10.10.1.1 → 10.10.1.2    TCP 83 8081 → 47420 [PSH, ACK] Seq=596 Ack=613 Win=65152 Len=17 TSval=3171298861 TSecr=1047039151
1711548563.544164658   317 0.556159702    10.10.1.2 → 10.10.1.1    TCP 83 47420 → 8081 [PSH, ACK] Seq=613 Ack=613 Win=64256 Len=17 TSval=1047039152 TSecr=3171298861
1711548565.544164658   319 0.556194628    10.10.1.1 → 10.10.1.2    TCP 83 8081 → 47420 [PSH, ACK] Seq=613 Ack=630 Win=65152 Len=17 TSval=3171298862 TSecr=1047039152
1711548571.544164658   325 0.557347930    10.10.1.2 → 10.10.1.1    TCP 83 47420 → 8081 [PSH, ACK] Seq=630 Ack=630 Win=64256 Len=17 TSval=1047039153 TSecr=3171298862
1711548573.544164658   327 0.557378863    10.10.1.1 → 10.10.1.2    TCP 83 8081 → 47420 [PSH, ACK] Seq=630 Ack=647 Win=65152 Len=17 TSval=3171298864 TSecr=1047039153
1711548579.544164658   333 0.558530318    10.10.1.2 → 10.10.1.1    TCP 83 47420 → 8081 [PSH, ACK] Seq=647 Ack=647 Win=64256 Len=17 TSval=1047039154 TSecr=3171298864
1711548581.544164658   335 0.558561513    10.10.1.1 → 10.10.1.2    TCP 83 8081 → 47420 [PSH, ACK] Seq=647 Ack=664 Win=65152 Len=17 TSval=3171298865 TSecr=1047039154
1711548587.544164658   341 0.559712490    10.10.1.2 → 10.10.1.1    TCP 83 47420 → 8081 [PSH, ACK] Seq=664 Ack=664 Win=64256 Len=17 TSval=1047039155 TSecr=3171298865
1711548589.544164658   343 0.559747565    10.10.1.1 → 10.10.1.2    TCP 83 8081 → 47420 [PSH, ACK] Seq=664 Ack=681 Win=65152 Len=17 TSval=3171298866 TSecr=1047039155
1711548595.544164658   349 0.560903248    10.10.1.2 → 10.10.1.1    TCP 83 47420 → 8081 [PSH, ACK] Seq=681 Ack=681 Win=64256 Len=17 TSval=1047039157 TSecr=3171298866
1711548597.544164658   351 0.560934972    10.10.1.1 → 10.10.1.2    TCP 83 8081 → 47420 [PSH, ACK] Seq=681 Ack=698 Win=65152 Len=17 TSval=3171298867 TSecr=1047039157
1711548603.544164658   357 0.562086300    10.10.1.2 → 10.10.1.1    TCP 83 47420 → 8081 [PSH, ACK] Seq=698 Ack=698 Win=64256 Len=17 TSval=1047039158 TSecr=3171298867
1711548605.544164658   359 0.562117056    10.10.1.1 → 10.10.1.2    TCP 83 8081 → 47420 [PSH, ACK] Seq=698 Ack=715 Win=65152 Len=17 TSval=3171298868 TSecr=1047039158
1711548611.544164658   365 0.563267639    10.10.1.2 → 10.10.1.1    TCP 83 47420 → 8081 [PSH, ACK] Seq=715 Ack=715 Win=64256 Len=17 TSval=1047039159 TSecr=3171298868
1711548613.544164658   367 0.563298389    10.10.1.1 → 10.10.1.2    TCP 83 8081 → 47420 [PSH, ACK] Seq=715 Ack=732 Win=65152 Len=17 TSval=3171298869 TSecr=1047039159
1711548619.544164658   373 0.564450040    10.10.1.2 → 10.10.1.1    TCP 83 47420 → 8081 [PSH, ACK] Seq=732 Ack=732 Win=64256 Len=17 TSval=1047039160 TSecr=3171298869
1711548621.544164658   375 0.564485015    10.10.1.1 → 10.10.1.2    TCP 83 8081 → 47420 [PSH, ACK] Seq=732 Ack=749 Win=65152 Len=17 TSval=3171298871 TSecr=1047039160
1711548627.544164658   381 0.565638172    10.10.1.2 → 10.10.1.1    TCP 83 47420 → 8081 [PSH, ACK] Seq=749 Ack=749 Win=64256 Len=17 TSval=1047039161 TSecr=3171298871
1711548629.544164658   383 0.565668629    10.10.1.1 → 10.10.1.2    TCP 83 8081 → 47420 [PSH, ACK] Seq=749 Ack=766 Win=65152 Len=17 TSval=3171298872 TSecr=1047039161
1711548635.544164658   389 0.566819694    10.10.1.2 → 10.10.1.1    TCP 83 47420 → 8081 [PSH, ACK] Seq=766 Ack=766 Win=64256 Len=17 TSval=1047039163 TSecr=3171298872
1711548637.544164658   391 0.566850069    10.10.1.1 → 10.10.1.2    TCP 83 8081 → 47420 [PSH, ACK] Seq=766 Ack=783 Win=65152 Len=17 TSval=3171298873 TSecr=1047039163
1711548643.544164658   397 0.568006293    10.10.1.2 → 10.10.1.1    TCP 83 47420 → 8081 [PSH, ACK] Seq=783 Ack=783 Win=64256 Len=17 TSval=1047039164 TSecr=3171298873
1711548645.544164658   399 0.568041647    10.10.1.1 → 10.10.1.2    TCP 83 8081 → 47420 [PSH, ACK] Seq=783 Ack=800 Win=65152 Len=17 TSval=3171298874 TSecr=1047039164
1711548651.544164658   405 0.569197670    10.10.1.2 → 10.10.1.1    TCP 83 47420 → 8081 [PSH, ACK] Seq=800 Ack=800 Win=64256 Len=17 TSval=1047039165 TSecr=3171298874
1711548653.544164658   407 0.569227986    10.10.1.1 → 10.10.1.2    TCP 83 8081 → 47420 [PSH, ACK] Seq=800 Ack=817 Win=65152 Len=17 TSval=3171298875 TSecr=1047039165
1711548659.544164658   413 0.570386021    10.10.1.2 → 10.10.1.1    TCP 83 47420 → 8081 [PSH, ACK] Seq=817 Ack=817 Win=64256 Len=17 TSval=1047039166 TSecr=3171298875
1711548661.544164658   415 0.570414514    10.10.1.1 → 10.10.1.2    TCP 83 8081 → 47420 [PSH, ACK] Seq=817 Ack=834 Win=65152 Len=17 TSval=3171298877 TSecr=1047039166
1711548667.544164658   421 0.571565173    10.10.1.2 → 10.10.1.1    TCP 83 47420 → 8081 [PSH, ACK] Seq=834 Ack=834 Win=64256 Len=17 TSval=1047039167 TSecr=3171298877
1711548669.544164658   423 0.571597728    10.10.1.1 → 10.10.1.2    TCP 83 8081 → 47420 [PSH, ACK] Seq=834 Ack=851 Win=65152 Len=17 TSval=3171298878 TSecr=1047039167
1711548675.544164658   429 0.572765425    10.10.1.2 → 10.10.1.1    TCP 83 47420 → 8081 [PSH, ACK] Seq=851 Ack=851 Win=64256 Len=17 TSval=1047039169 TSecr=3171298878
1711548677.544164658   431 0.572796866    10.10.1.1 → 10.10.1.2    TCP 83 8081 → 47420 [PSH, ACK] Seq=851 Ack=868 Win=65152 Len=17 TSval=3171298879 TSecr=1047039169
1711548683.544164658   437 0.573949663    10.10.1.2 → 10.10.1.1    TCP 83 47420 → 8081 [PSH, ACK] Seq=868 Ack=868 Win=64256 Len=17 TSval=1047039170 TSecr=3171298879
1711548685.544164658   439 0.573980714    10.10.1.1 → 10.10.1.2    TCP 83 8081 → 47420 [PSH, ACK] Seq=868 Ack=885 Win=65152 Len=17 TSval=3171298880 TSecr=1047039170
1711548691.544164658   445 0.575142813    10.10.1.2 → 10.10.1.1    TCP 83 47420 → 8081 [PSH, ACK] Seq=885 Ack=885 Win=64256 Len=17 TSval=1047039171 TSecr=3171298880
1711548693.544164658   447 0.575173163    10.10.1.1 → 10.10.1.2    TCP 83 8081 → 47420 [PSH, ACK] Seq=885 Ack=902 Win=65152 Len=17 TSval=3171298881 TSecr=1047039171
1711548699.544164658   453 0.576324298    10.10.1.2 → 10.10.1.1    TCP 83 47420 → 8081 [PSH, ACK] Seq=902 Ack=902 Win=64256 Len=17 TSval=1047039172 TSecr=3171298881
1711548701.544164658   455 0.576358883    10.10.1.1 → 10.10.1.2    TCP 83 8081 → 47420 [PSH, ACK] Seq=902 Ack=919 Win=65152 Len=17 TSval=3171298883 TSecr=1047039172
1711548707.544164658   461 0.577522775    10.10.1.2 → 10.10.1.1    TCP 83 47420 → 8081 [PSH, ACK] Seq=919 Ack=919 Win=64256 Len=17 TSval=1047039173 TSecr=3171298883
1711548709.544164658   463 0.577552996    10.10.1.1 → 10.10.1.2    TCP 83 8081 → 47420 [PSH, ACK] Seq=919 Ack=936 Win=65152 Len=17 TSval=3171298884 TSecr=1047039173
1711548715.544164658   469 0.578703773    10.10.1.2 → 10.10.1.1    TCP 83 47420 → 8081 [PSH, ACK] Seq=936 Ack=936 Win=64256 Len=17 TSval=1047039174 TSecr=3171298884
1711548717.544164658   471 0.578734325    10.10.1.1 → 10.10.1.2    TCP 83 8081 → 47420 [PSH, ACK] Seq=936 Ack=953 Win=65152 Len=17 TSval=3171298885 TSecr=1047039174
1711548723.544164658   477 0.579903486    10.10.1.2 → 10.10.1.1    TCP 83 47420 → 8081 [PSH, ACK] Seq=953 Ack=953 Win=64256 Len=17 TSval=1047039176 TSecr=3171298885
1711548726.544164658   480 0.579998258    10.10.1.1 → 10.10.1.2    TCP 83 8081 → 47420 [PSH, ACK] Seq=953 Ack=970 Win=65152 Len=17 TSval=3171298886 TSecr=1047039176
1711548731.544164658   485 0.581153364    10.10.1.2 → 10.10.1.1    TCP 83 47420 → 8081 [PSH, ACK] Seq=970 Ack=970 Win=64256 Len=17 TSval=1047039177 TSecr=3171298886
1711548733.544164658   487 0.581185651    10.10.1.1 → 10.10.1.2    TCP 83 8081 → 47420 [PSH, ACK] Seq=970 Ack=987 Win=65152 Len=17 TSval=3171298887 TSecr=1047039177
1711548739.544164658   493 0.582354503    10.10.1.2 → 10.10.1.1    TCP 83 47420 → 8081 [PSH, ACK] Seq=987 Ack=987 Win=64256 Len=17 TSval=1047039178 TSecr=3171298887
1711548741.544164658   495 0.582385263    10.10.1.1 → 10.10.1.2    TCP 83 8081 → 47420 [PSH, ACK] Seq=987 Ack=1004 Win=65152 Len=17 TSval=3171298889 TSecr=1047039178
1711548747.544164658   501 0.583537027    10.10.1.2 → 10.10.1.1    TCP 83 47420 → 8081 [PSH, ACK] Seq=1004 Ack=1004 Win=64256 Len=17 TSval=1047039179 TSecr=3171298889
1711548749.544164658   503 0.583573914    10.10.1.1 → 10.10.1.2    TCP 83 8081 → 47420 [PSH, ACK] Seq=1004 Ack=1021 Win=65152 Len=17 TSval=3171298890 TSecr=1047039179
1711548755.544164658   509 0.584738188    10.10.1.2 → 10.10.1.1    TCP 83 47420 → 8081 [PSH, ACK] Seq=1021 Ack=1021 Win=64256 Len=17 TSval=1047039180 TSecr=3171298890
1711548757.544164658   511 0.584769161    10.10.1.1 → 10.10.1.2    TCP 83 8081 → 47420 [PSH, ACK] Seq=1021 Ack=1038 Win=65152 Len=17 TSval=3171298891 TSecr=1047039180
1711548763.544164658   517 0.585922829    10.10.1.2 → 10.10.1.1    TCP 83 47420 → 8081 [PSH, ACK] Seq=1038 Ack=1038 Win=64256 Len=17 TSval=1047039182 TSecr=3171298891
1711548765.544164658   519 0.585953606    10.10.1.1 → 10.10.1.2    TCP 83 8081 → 47420 [PSH, ACK] Seq=1038 Ack=1055 Win=65152 Len=17 TSval=3171298892 TSecr=1047039182
1711548771.544164658   525 0.587126088    10.10.1.2 → 10.10.1.1    TCP 83 47420 → 8081 [PSH, ACK] Seq=1055 Ack=1055 Win=64256 Len=17 TSval=1047039183 TSecr=3171298892
1711548773.544164658   527 0.587156507    10.10.1.1 → 10.10.1.2    TCP 83 8081 → 47420 [PSH, ACK] Seq=1055 Ack=1072 Win=65152 Len=17 TSval=3171298893 TSecr=1047039183
1711548779.544164658   533 0.588307519    10.10.1.2 → 10.10.1.1    TCP 83 47420 → 8081 [PSH, ACK] Seq=1072 Ack=1072 Win=64256 Len=17 TSval=1047039184 TSecr=3171298893
1711548781.544164658   535 0.588342099    10.10.1.1 → 10.10.1.2    TCP 83 8081 → 47420 [PSH, ACK] Seq=1072 Ack=1089 Win=65152 Len=17 TSval=3171298895 TSecr=1047039184
1711548787.544164658   541 0.589516208    10.10.1.2 → 10.10.1.1    TCP 83 47420 → 8081 [PSH, ACK] Seq=1089 Ack=1089 Win=64256 Len=17 TSval=1047039185 TSecr=3171298895
1711548789.544164658   543 0.589546734    10.10.1.1 → 10.10.1.2    TCP 83 8081 → 47420 [PSH, ACK] Seq=1089 Ack=1106 Win=65152 Len=17 TSval=3171298896 TSecr=1047039185
1711548795.544164658   549 0.590697515    10.10.1.2 → 10.10.1.1    TCP 83 47420 → 8081 [PSH, ACK] Seq=1106 Ack=1106 Win=64256 Len=17 TSval=1047039186 TSecr=3171298896
1711548797.544164658   551 0.590728079    10.10.1.1 → 10.10.1.2    TCP 83 8081 → 47420 [PSH, ACK] Seq=1106 Ack=1123 Win=65152 Len=17 TSval=3171298897 TSecr=1047039186
1711548803.544164658   557 0.591904298    10.10.1.2 → 10.10.1.1    TCP 83 47420 → 8081 [PSH, ACK] Seq=1123 Ack=1123 Win=64256 Len=17 TSval=1047039188 TSecr=3171298897
1711548805.544164658   559 0.591939163    10.10.1.1 → 10.10.1.2    TCP 83 8081 → 47420 [PSH, ACK] Seq=1123 Ack=1140 Win=65152 Len=17 TSval=3171298898 TSecr=1047039188
1711548811.544164658   565 0.593093530    10.10.1.2 → 10.10.1.1    TCP 83 47420 → 8081 [PSH, ACK] Seq=1140 Ack=1140 Win=64256 Len=17 TSval=1047039189 TSecr=3171298898
1711548813.544164658   567 0.593123986    10.10.1.1 → 10.10.1.2    TCP 83 8081 → 47420 [PSH, ACK] Seq=1140 Ack=1157 Win=65152 Len=17 TSval=3171298899 TSecr=1047039189
1711548819.544164658   573 0.594302758    10.10.1.2 → 10.10.1.1    TCP 83 47420 → 8081 [PSH, ACK] Seq=1157 Ack=1157 Win=64256 Len=17 TSval=1047039190 TSecr=3171298899
1711548821.544164658   575 0.594333014    10.10.1.1 → 10.10.1.2    TCP 83 8081 → 47420 [PSH, ACK] Seq=1157 Ack=1174 Win=65152 Len=17 TSval=3171298901 TSecr=1047039190
1711548827.544164658   581 0.595484049    10.10.1.2 → 10.10.1.1    TCP 83 47420 → 8081 [PSH, ACK] Seq=1174 Ack=1174 Win=64256 Len=17 TSval=1047039191 TSecr=3171298901
1711548829.544164658   583 0.595518659    10.10.1.1 → 10.10.1.2    TCP 83 8081 → 47420 [PSH, ACK] Seq=1174 Ack=1191 Win=65152 Len=17 TSval=3171298902 TSecr=1047039191
1711548835.544164658   589 0.596694579    10.10.1.2 → 10.10.1.1    TCP 83 47420 → 8081 [PSH, ACK] Seq=1191 Ack=1191 Win=64256 Len=17 TSval=1047039192 TSecr=3171298902
1711548837.544164658   591 0.596725243    10.10.1.1 → 10.10.1.2    TCP 83 8081 → 47420 [PSH, ACK] Seq=1191 Ack=1208 Win=65152 Len=17 TSval=3171298903 TSecr=1047039192
1711548843.544164658   597 0.597879306    10.10.1.2 → 10.10.1.1    TCP 83 47420 → 8081 [PSH, ACK] Seq=1208 Ack=1208 Win=64256 Len=17 TSval=1047039194 TSecr=3171298903
1711548845.544164658   599 0.597910500    10.10.1.1 → 10.10.1.2    TCP 83 8081 → 47420 [PSH, ACK] Seq=1208 Ack=1225 Win=65152 Len=17 TSval=3171298904 TSecr=1047039194
1711548851.544164658   605 0.599092862    10.10.1.2 → 10.10.1.1    TCP 83 47420 → 8081 [PSH, ACK] Seq=1225 Ack=1225 Win=64256 Len=17 TSval=1047039195 TSecr=3171298904
1711548853.544164658   607 0.599123415    10.10.1.1 → 10.10.1.2    TCP 83 8081 → 47420 [PSH, ACK] Seq=1225 Ack=1242 Win=65152 Len=17 TSval=3171298905 TSecr=1047039195
1711548859.544164658   613 0.600275205    10.10.1.2 → 10.10.1.1    TCP 83 47420 → 8081 [PSH, ACK] Seq=1242 Ack=1242 Win=64256 Len=17 TSval=1047039196 TSecr=3171298905
1711548861.544164658   615 0.600310020    10.10.1.1 → 10.10.1.2    TCP 83 8081 → 47420 [PSH, ACK] Seq=1242 Ack=1259 Win=65152 Len=17 TSval=3171298906 TSecr=1047039196
1711548867.544164658   621 0.601493479    10.10.1.2 → 10.10.1.1    TCP 83 47420 → 8081 [PSH, ACK] Seq=1259 Ack=1259 Win=64256 Len=17 TSval=1047039197 TSecr=3171298906
1711548869.544164658   623 0.601522292    10.10.1.1 → 10.10.1.2    TCP 83 8081 → 47420 [PSH, ACK] Seq=1259 Ack=1276 Win=65152 Len=17 TSval=3171298908 TSecr=1047039197
1711548875.544164658   629 0.602673104    10.10.1.2 → 10.10.1.1    TCP 83 47420 → 8081 [PSH, ACK] Seq=1276 Ack=1276 Win=64256 Len=17 TSval=1047039198 TSecr=3171298908
1711548877.544164658   631 0.602701577    10.10.1.1 → 10.10.1.2    TCP 83 8081 → 47420 [PSH, ACK] Seq=1276 Ack=1293 Win=65152 Len=17 TSval=3171298909 TSecr=1047039198
1711548883.544164658   637 0.603891973    10.10.1.2 → 10.10.1.1    TCP 83 47420 → 8081 [PSH, ACK] Seq=1293 Ack=1293 Win=64256 Len=17 TSval=1047039200 TSecr=3171298909
1711548885.544164658   639 0.603924899    10.10.1.1 → 10.10.1.2    TCP 83 8081 → 47420 [PSH, ACK] Seq=1293 Ack=1310 Win=65152 Len=17 TSval=3171298910 TSecr=1047039200
1711548891.544164658   645 0.605078850    10.10.1.2 → 10.10.1.1    TCP 83 47420 → 8081 [PSH, ACK] Seq=1310 Ack=1310 Win=64256 Len=17 TSval=1047039201 TSecr=3171298910
1711548893.544164658   647 0.605109832    10.10.1.1 → 10.10.1.2    TCP 83 8081 → 47420 [PSH, ACK] Seq=1310 Ack=1327 Win=65152 Len=17 TSval=3171298911 TSecr=1047039201
1711548899.544164658   653 0.606299068    10.10.1.2 → 10.10.1.1    TCP 83 47420 → 8081 [PSH, ACK] Seq=1327 Ack=1327 Win=64256 Len=17 TSval=1047039202 TSecr=3171298911
1711548901.544164658   655 0.606329805    10.10.1.1 → 10.10.1.2    TCP 83 8081 → 47420 [PSH, ACK] Seq=1327 Ack=1344 Win=65152 Len=17 TSval=3171298912 TSecr=1047039202
1711548907.544164658   661 0.607481005    10.10.1.2 → 10.10.1.1    TCP 83 47420 → 8081 [PSH, ACK] Seq=1344 Ack=1344 Win=64256 Len=17 TSval=1047039203 TSecr=3171298912
1711548909.544164658   663 0.607515631    10.10.1.1 → 10.10.1.2    TCP 83 8081 → 47420 [PSH, ACK] Seq=1344 Ack=1361 Win=65152 Len=17 TSval=3171298914 TSecr=1047039203
1711548915.544164658   669 0.608703725    10.10.1.2 → 10.10.1.1    TCP 83 47420 → 8081 [PSH, ACK] Seq=1361 Ack=1361 Win=64256 Len=17 TSval=1047039204 TSecr=3171298914
1711548917.544164658   671 0.608735220    10.10.1.1 → 10.10.1.2    TCP 83 8081 → 47420 [PSH, ACK] Seq=1361 Ack=1378 Win=65152 Len=17 TSval=3171298915 TSecr=1047039204
1711548923.544164658   677 0.609889650    10.10.1.2 → 10.10.1.1    TCP 83 47420 → 8081 [PSH, ACK] Seq=1378 Ack=1378 Win=64256 Len=17 TSval=1047039206 TSecr=3171298915
1711548925.544164658   679 0.609921393    10.10.1.1 → 10.10.1.2    TCP 83 8081 → 47420 [PSH, ACK] Seq=1378 Ack=1395 Win=65152 Len=17 TSval=3171298916 TSecr=1047039206
1711548931.544164658   685 0.611114028    10.10.1.2 → 10.10.1.1    TCP 83 47420 → 8081 [PSH, ACK] Seq=1395 Ack=1395 Win=64256 Len=17 TSval=1047039207 TSecr=3171298916
1711548933.544164658   687 0.611144868    10.10.1.1 → 10.10.1.2    TCP 83 8081 → 47420 [PSH, ACK] Seq=1395 Ack=1412 Win=65152 Len=17 TSval=3171298917 TSecr=1047039207
1711548939.544164658   693 0.612297382    10.10.1.2 → 10.10.1.1    TCP 83 47420 → 8081 [PSH, ACK] Seq=1412 Ack=1412 Win=64256 Len=17 TSval=1047039208 TSecr=3171298917
1711548941.544164658   695 0.612330432    10.10.1.1 → 10.10.1.2    TCP 83 8081 → 47420 [PSH, ACK] Seq=1412 Ack=1429 Win=65152 Len=17 TSval=3171298919 TSecr=1047039208
1711548947.544164658   701 0.613524896    10.10.1.2 → 10.10.1.1    TCP 83 47420 → 8081 [PSH, ACK] Seq=1429 Ack=1429 Win=64256 Len=17 TSval=1047039209 TSecr=3171298919
1711548949.544164658   703 0.613553491    10.10.1.1 → 10.10.1.2    TCP 83 8081 → 47420 [PSH, ACK] Seq=1429 Ack=1446 Win=65152 Len=17 TSval=3171298920 TSecr=1047039209
1711548955.544164658   709 0.614704017    10.10.1.2 → 10.10.1.1    TCP 83 47420 → 8081 [PSH, ACK] Seq=1446 Ack=1446 Win=64256 Len=17 TSval=1047039210 TSecr=3171298920
1711548957.544164658   711 0.614732663    10.10.1.1 → 10.10.1.2    TCP 83 8081 → 47420 [PSH, ACK] Seq=1446 Ack=1463 Win=65152 Len=17 TSval=3171298921 TSecr=1047039210
1711548963.544164658   717 0.615932205    10.10.1.2 → 10.10.1.1    TCP 83 47420 → 8081 [PSH, ACK] Seq=1463 Ack=1463 Win=64256 Len=17 TSval=1047039212 TSecr=3171298921
1711548965.544164658   719 0.615970259    10.10.1.1 → 10.10.1.2    TCP 83 8081 → 47420 [PSH, ACK] Seq=1463 Ack=1480 Win=65152 Len=17 TSval=3171298922 TSecr=1047039212
1711548971.544164658   725 0.617124479    10.10.1.2 → 10.10.1.1    TCP 83 47420 → 8081 [PSH, ACK] Seq=1480 Ack=1480 Win=64256 Len=17 TSval=1047039213 TSecr=3171298922
1711548973.544164658   727 0.617155196    10.10.1.1 → 10.10.1.2    TCP 83 8081 → 47420 [PSH, ACK] Seq=1480 Ack=1497 Win=65152 Len=17 TSval=3171298923 TSecr=1047039213
1711548979.544164658   733 0.618352761    10.10.1.2 → 10.10.1.1    TCP 83 47420 → 8081 [PSH, ACK] Seq=1497 Ack=1497 Win=64256 Len=17 TSval=1047039214 TSecr=3171298923
1711548981.544164658   735 0.618383981    10.10.1.1 → 10.10.1.2    TCP 83 8081 → 47420 [PSH, ACK] Seq=1497 Ack=1514 Win=65152 Len=17 TSval=3171298925 TSecr=1047039214
1711548987.544164658   741 0.619535337    10.10.1.2 → 10.10.1.1    TCP 83 47420 → 8081 [PSH, ACK] Seq=1514 Ack=1514 Win=64256 Len=17 TSval=1047039215 TSecr=3171298925
1711548989.544164658   743 0.619566178    10.10.1.1 → 10.10.1.2    TCP 83 8081 → 47420 [PSH, ACK] Seq=1514 Ack=1531 Win=65152 Len=17 TSval=3171298926 TSecr=1047039215
1711548995.544164658   749 0.620766454    10.10.1.2 → 10.10.1.1    TCP 83 47420 → 8081 [PSH, ACK] Seq=1531 Ack=1531 Win=64256 Len=17 TSval=1047039217 TSecr=3171298926
1711548997.544164658   751 0.620795397    10.10.1.1 → 10.10.1.2    TCP 83 8081 → 47420 [PSH, ACK] Seq=1531 Ack=1548 Win=65152 Len=17 TSval=3171298927 TSecr=1047039217
1711549003.544164658   757 0.621949459    10.10.1.2 → 10.10.1.1    TCP 83 47420 → 8081 [PSH, ACK] Seq=1548 Ack=1548 Win=64256 Len=17 TSval=1047039218 TSecr=3171298927
1711549005.544164658   759 0.621978192    10.10.1.1 → 10.10.1.2    TCP 83 8081 → 47420 [PSH, ACK] Seq=1548 Ack=1565 Win=65152 Len=17 TSval=3171298928 TSecr=1047039218
1711549011.544164658   765 0.623181705    10.10.1.2 → 10.10.1.1    TCP 83 47420 → 8081 [PSH, ACK] Seq=1565 Ack=1565 Win=64256 Len=17 TSval=1047039219 TSecr=3171298928
1711549013.544164658   767 0.623210426    10.10.1.1 → 10.10.1.2    TCP 83 8081 → 47420 [PSH, ACK] Seq=1565 Ack=1582 Win=65152 Len=17 TSval=3171298929 TSecr=1047039219
1711549019.544164658   773 0.624361265    10.10.1.2 → 10.10.1.1    TCP 83 47420 → 8081 [PSH, ACK] Seq=1582 Ack=1582 Win=64256 Len=17 TSval=1047039220 TSecr=3171298929
1711549021.544164658   775 0.624397222    10.10.1.1 → 10.10.1.2    TCP 83 8081 → 47420 [PSH, ACK] Seq=1582 Ack=1599 Win=65152 Len=17 TSval=3171298931 TSecr=1047039220
1711549027.544164658   781 0.625597217    10.10.1.2 → 10.10.1.1    TCP 83 47420 → 8081 [PSH, ACK] Seq=1599 Ack=1599 Win=64256 Len=17 TSval=1047039221 TSecr=3171298931
1711549029.544164658   783 0.625628164    10.10.1.1 → 10.10.1.2    TCP 83 8081 → 47420 [PSH, ACK] Seq=1599 Ack=1616 Win=65152 Len=17 TSval=3171298932 TSecr=1047039221
1711549035.544164658   789 0.626778124    10.10.1.2 → 10.10.1.1    TCP 83 47420 → 8081 [PSH, ACK] Seq=1616 Ack=1616 Win=64256 Len=17 TSval=1047039223 TSecr=3171298932
1711549037.544164658   791 0.626808905    10.10.1.1 → 10.10.1.2    TCP 83 8081 → 47420 [PSH, ACK] Seq=1616 Ack=1633 Win=65152 Len=17 TSval=3171298933 TSecr=1047039223
1711549043.544164658   797 0.628016218    10.10.1.2 → 10.10.1.1    TCP 83 47420 → 8081 [PSH, ACK] Seq=1633 Ack=1633 Win=64256 Len=17 TSval=1047039224 TSecr=3171298933
1711549045.544164658   799 0.628049167    10.10.1.1 → 10.10.1.2    TCP 83 8081 → 47420 [PSH, ACK] Seq=1633 Ack=1650 Win=65152 Len=17 TSval=3171298934 TSecr=1047039224
1711549051.544164658   805 0.629202483    10.10.1.2 → 10.10.1.1    TCP 83 47420 → 8081 [PSH, ACK] Seq=1650 Ack=1650 Win=64256 Len=17 TSval=1047039225 TSecr=3171298934
1711549053.544164658   807 0.629233526    10.10.1.1 → 10.10.1.2    TCP 83 8081 → 47420 [PSH, ACK] Seq=1650 Ack=1667 Win=65152 Len=17 TSval=3171298935 TSecr=1047039225
1711549059.544164658   813 0.630443132    10.10.1.2 → 10.10.1.1    TCP 83 47420 → 8081 [PSH, ACK] Seq=1667 Ack=1667 Win=64256 Len=17 TSval=1047039226 TSecr=3171298935
1711549061.544164658   815 0.630474191    10.10.1.1 → 10.10.1.2    TCP 83 8081 → 47420 [PSH, ACK] Seq=1667 Ack=1684 Win=65152 Len=17 TSval=3171298937 TSecr=1047039226
1711549067.544164658   821 0.631625511    10.10.1.2 → 10.10.1.1    TCP 83 47420 → 8081 [PSH, ACK] Seq=1684 Ack=1684 Win=64256 Len=17 TSval=1047039227 TSecr=3171298937
1711549069.544164658   823 0.631660701    10.10.1.1 → 10.10.1.2    TCP 83 8081 → 47420 [PSH, ACK] Seq=1684 Ack=1701 Win=65152 Len=17 TSval=3171298938 TSecr=1047039227
1711549075.544164658   829 0.632870470    10.10.1.2 → 10.10.1.1    TCP 83 47420 → 8081 [PSH, ACK] Seq=1701 Ack=1701 Win=64256 Len=17 TSval=1047039229 TSecr=3171298938
1711549077.544164658   831 0.632901107    10.10.1.1 → 10.10.1.2    TCP 83 8081 → 47420 [PSH, ACK] Seq=1701 Ack=1718 Win=65152 Len=17 TSval=3171298939 TSecr=1047039229
1711549083.544164658   837 0.634053324    10.10.1.2 → 10.10.1.1    TCP 83 47420 → 8081 [PSH, ACK] Seq=1718 Ack=1718 Win=64256 Len=17 TSval=1047039230 TSecr=3171298939
1711549085.544164658   839 0.634084587    10.10.1.1 → 10.10.1.2    TCP 83 8081 → 47420 [PSH, ACK] Seq=1718 Ack=1735 Win=65152 Len=17 TSval=3171298940 TSecr=1047039230
1711549091.544164658   845 0.635296519    10.10.1.2 → 10.10.1.1    TCP 83 47420 → 8081 [PSH, ACK] Seq=1735 Ack=1735 Win=64256 Len=17 TSval=1047039231 TSecr=3171298940
1711549093.544164658   847 0.635325763    10.10.1.1 → 10.10.1.2    TCP 83 8081 → 47420 [PSH, ACK] Seq=1735 Ack=1752 Win=65152 Len=17 TSval=3171298941 TSecr=1047039231
1711549099.544164658   853 0.636485930    10.10.1.2 → 10.10.1.1    TCP 83 47420 → 8081 [PSH, ACK] Seq=1752 Ack=1752 Win=64256 Len=17 TSval=1047039232 TSecr=3171298941
1711549101.544164658   855 0.636518776    10.10.1.1 → 10.10.1.2    TCP 83 8081 → 47420 [PSH, ACK] Seq=1752 Ack=1769 Win=65152 Len=17 TSval=3171298943 TSecr=1047039232
1711549107.544164658   861 0.637733160    10.10.1.2 → 10.10.1.1    TCP 83 47420 → 8081 [PSH, ACK] Seq=1769 Ack=1769 Win=64256 Len=17 TSval=1047039233 TSecr=3171298943
1711549109.544164658   863 0.637762102    10.10.1.1 → 10.10.1.2    TCP 83 8081 → 47420 [PSH, ACK] Seq=1769 Ack=1786 Win=65152 Len=17 TSval=3171298944 TSecr=1047039233
1711549115.544164658   869 0.638912395    10.10.1.2 → 10.10.1.1    TCP 83 47420 → 8081 [PSH, ACK] Seq=1786 Ack=1786 Win=64256 Len=17 TSval=1047039235 TSecr=3171298944
1711549117.544164658   871 0.638940942    10.10.1.1 → 10.10.1.2    TCP 83 8081 → 47420 [PSH, ACK] Seq=1786 Ack=1803 Win=65152 Len=17 TSval=3171298945 TSecr=1047039235
1711549123.544164658   877 0.640158960    10.10.1.2 → 10.10.1.1    TCP 83 47420 → 8081 [PSH, ACK] Seq=1803 Ack=1803 Win=64256 Len=17 TSval=1047039236 TSecr=3171298945
1711549125.544164658   879 0.640192254    10.10.1.1 → 10.10.1.2    TCP 83 8081 → 47420 [PSH, ACK] Seq=1803 Ack=1820 Win=65152 Len=17 TSval=3171298946 TSecr=1047039236
1711549131.544164658   885 0.641346678    10.10.1.2 → 10.10.1.1    TCP 83 47420 → 8081 [PSH, ACK] Seq=1820 Ack=1820 Win=64256 Len=17 TSval=1047039237 TSecr=3171298946
1711549133.544164658   887 0.641375584    10.10.1.1 → 10.10.1.2    TCP 83 8081 → 47420 [PSH, ACK] Seq=1820 Ack=1837 Win=65152 Len=17 TSval=3171298948 TSecr=1047039237
1711549139.544164658   893 0.642596596    10.10.1.2 → 10.10.1.1    TCP 83 47420 → 8081 [PSH, ACK] Seq=1837 Ack=1837 Win=64256 Len=17 TSval=1047039238 TSecr=3171298948
1711549141.544164658   895 0.642626076    10.10.1.1 → 10.10.1.2    TCP 83 8081 → 47420 [PSH, ACK] Seq=1837 Ack=1854 Win=65152 Len=17 TSval=3171298949 TSecr=1047039238
1711549147.544164658   901 0.643759629    10.10.1.2 → 10.10.1.1    TCP 83 47420 → 8081 [PSH, ACK] Seq=1854 Ack=1854 Win=64256 Len=17 TSval=1047039240 TSecr=3171298949
1711549149.544164658   903 0.643792373    10.10.1.1 → 10.10.1.2    TCP 83 8081 → 47420 [PSH, ACK] Seq=1854 Ack=1871 Win=65152 Len=17 TSval=3171298950 TSecr=1047039240
1711549155.544164658   909 0.645013408    10.10.1.2 → 10.10.1.1    TCP 83 47420 → 8081 [PSH, ACK] Seq=1871 Ack=1871 Win=64256 Len=17 TSval=1047039241 TSecr=3171298950
1711549157.544164658   911 0.645044368    10.10.1.1 → 10.10.1.2    TCP 83 8081 → 47420 [PSH, ACK] Seq=1871 Ack=1888 Win=65152 Len=17 TSval=3171298951 TSecr=1047039241
1711549163.544164658   917 0.646194648    10.10.1.2 → 10.10.1.1    TCP 83 47420 → 8081 [PSH, ACK] Seq=1888 Ack=1888 Win=64256 Len=17 TSval=1047039242 TSecr=3171298951
1711549165.544164658   919 0.646223302    10.10.1.1 → 10.10.1.2    TCP 83 8081 → 47420 [PSH, ACK] Seq=1888 Ack=1905 Win=65152 Len=17 TSval=3171298952 TSecr=1047039242
1711549171.544164658   925 0.647445976    10.10.1.2 → 10.10.1.1    TCP 83 47420 → 8081 [PSH, ACK] Seq=1905 Ack=1905 Win=64256 Len=17 TSval=1047039243 TSecr=3171298952
1711549173.544164658   927 0.647478806    10.10.1.1 → 10.10.1.2    TCP 83 8081 → 47420 [PSH, ACK] Seq=1905 Ack=1922 Win=65152 Len=17 TSval=3171298954 TSecr=1047039243
1711549179.544164658   933 0.648629794    10.10.1.2 → 10.10.1.1    TCP 83 47420 → 8081 [PSH, ACK] Seq=1922 Ack=1922 Win=64256 Len=17 TSval=1047039244 TSecr=3171298954
1711549182.544164658   936 0.648700304    10.10.1.1 → 10.10.1.2    TCP 83 8081 → 47420 [PSH, ACK] Seq=1922 Ack=1939 Win=65152 Len=17 TSval=3171298955 TSecr=1047039244
1711549187.544164658   941 0.649890516    10.10.1.2 → 10.10.1.1    TCP 83 47420 → 8081 [PSH, ACK] Seq=1939 Ack=1939 Win=64256 Len=17 TSval=1047039246 TSecr=3171298955
1711549189.544164658   943 0.649920402    10.10.1.1 → 10.10.1.2    TCP 83 8081 → 47420 [PSH, ACK] Seq=1939 Ack=1956 Win=65152 Len=17 TSval=3171298956 TSecr=1047039246
1711549195.544164658   949 0.651070559    10.10.1.2 → 10.10.1.1    TCP 83 47420 → 8081 [PSH, ACK] Seq=1956 Ack=1956 Win=64256 Len=17 TSval=1047039247 TSecr=3171298956
1711549197.544164658   951 0.651099110    10.10.1.1 → 10.10.1.2    TCP 83 8081 → 47420 [PSH, ACK] Seq=1956 Ack=1973 Win=65152 Len=17 TSval=3171298957 TSecr=1047039247
1711549203.544164658   957 0.652329258    10.10.1.2 → 10.10.1.1    TCP 83 47420 → 8081 [PSH, ACK] Seq=1973 Ack=1973 Win=64256 Len=17 TSval=1047039248 TSecr=3171298957
1711549205.544164658   959 0.652364403    10.10.1.1 → 10.10.1.2    TCP 83 8081 → 47420 [PSH, ACK] Seq=1973 Ack=1990 Win=65152 Len=17 TSval=3171298959 TSecr=1047039248
1711549211.544164658   965 0.653518585    10.10.1.2 → 10.10.1.1    TCP 83 47420 → 8081 [PSH, ACK] Seq=1990 Ack=1990 Win=64256 Len=17 TSval=1047039249 TSecr=3171298959
1711549213.544164658   967 0.653549809    10.10.1.1 → 10.10.1.2    TCP 83 8081 → 47420 [PSH, ACK] Seq=1990 Ack=2007 Win=65152 Len=17 TSval=3171298960 TSecr=1047039249
1711549219.544164658   973 0.654779471    10.10.1.2 → 10.10.1.1    TCP 83 47420 → 8081 [PSH, ACK] Seq=2007 Ack=2007 Win=64256 Len=17 TSval=1047039251 TSecr=3171298960
1711549221.544164658   975 0.654810414    10.10.1.1 → 10.10.1.2    TCP 83 8081 → 47420 [PSH, ACK] Seq=2007 Ack=2024 Win=65152 Len=17 TSval=3171298961 TSecr=1047039251
1711549227.544164658   981 0.656038162    10.10.1.2 → 10.10.1.1    TCP 83 47420 → 8081 [PSH, ACK] Seq=2024 Ack=2024 Win=64256 Len=17 TSval=1047039252 TSecr=3171298961
1711549229.544164658   983 0.656075170    10.10.1.1 → 10.10.1.2    TCP 83 8081 → 47420 [PSH, ACK] Seq=2024 Ack=2041 Win=65152 Len=17 TSval=3171298962 TSecr=1047039252
1711549235.544164658   989 0.657229023    10.10.1.2 → 10.10.1.1    TCP 83 47420 → 8081 [PSH, ACK] Seq=2041 Ack=2041 Win=64256 Len=17 TSval=1047039253 TSecr=3171298962
