1711547053.071962118    22 0.279435565    10.10.1.2 → 10.10.1.1    TCP 74 42994 → 8081 [SYN] Seq=0 Win=64240 Len=0 MSS=1460 SACK_PERM=1 TSval=1045823453 TSecr=0 WS=128
1711547054.071962118    23 0.279477576    10.10.1.1 → 10.10.1.2    TCP 74 8081 → 42994 [SYN, ACK] Seq=0 Ack=1 Win=65160 Len=0 MSS=1460 SACK_PERM=1 TSval=3170083162 TSecr=1045823453 WS=128
1711547055.071962118    24 0.279515470    10.10.1.2 → 10.10.1.1    TCP 66 42994 → 8081 [ACK] Seq=1 Ack=1 Win=64256 Len=0 TSval=1045823453 TSecr=3170083162
1711547059.071962118    28 0.550721430    10.10.1.2 → 10.10.1.1    TCP 83 42994 → 8081 [PSH, ACK] Seq=1 Ack=1 Win=64256 Len=17 TSval=1045823725 TSecr=3170083162
1711547061.071962118    30 0.550749641    10.10.1.1 → 10.10.1.2    TCP 66 8081 → 42994 [ACK] Seq=1 Ack=18 Win=65152 Len=0 TSval=3170083434 TSecr=1045823725
1711547063.071962118    32 0.551048280    10.10.1.1 → 10.10.1.2    TCP 83 8081 → 42994 [PSH, ACK] Seq=1 Ack=18 Win=65152 Len=17 TSval=3170083434 TSecr=1045823725
1711547064.071962118    33 0.551142463    10.10.1.2 → 10.10.1.1    TCP 66 42994 → 8081 [ACK] Seq=18 Ack=18 Win=64256 Len=0 TSval=1045823725 TSecr=3170083434
1711547069.071962118    38 0.590007017    10.10.1.2 → 10.10.1.1    TCP 83 42994 → 8081 [PSH, ACK] Seq=18 Ack=18 Win=64256 Len=17 TSval=1045823764 TSecr=3170083434
1711547072.071962118    41 0.590133150    10.10.1.1 → 10.10.1.2    TCP 83 8081 → 42994 [PSH, ACK] Seq=18 Ack=35 Win=65152 Len=17 TSval=3170083473 TSecr=1045823764
1711547073.071962118    42 0.590163050    10.10.1.2 → 10.10.1.1    TCP 66 42994 → 8081 [ACK] Seq=35 Ack=35 Win=64256 Len=0 TSval=1045823764 TSecr=3170083473
1711547078.071962118    47 0.635615435    10.10.1.2 → 10.10.1.1    TCP 83 42994 → 8081 [PSH, ACK] Seq=35 Ack=35 Win=64256 Len=17 TSval=1045823810 TSecr=3170083473
1711547081.071962118    50 0.635739654    10.10.1.1 → 10.10.1.2    TCP 83 8081 → 42994 [PSH, ACK] Seq=35 Ack=52 Win=65152 Len=17 TSval=3170083518 TSecr=1045823810
1711547082.071962118    51 0.635772154    10.10.1.2 → 10.10.1.1    TCP 66 42994 → 8081 [ACK] Seq=52 Ack=52 Win=64256 Len=0 TSval=1045823810 TSecr=3170083518
1711547087.071962118    56 0.662546665    10.10.1.2 → 10.10.1.1    TCP 83 42994 → 8081 [PSH, ACK] Seq=52 Ack=52 Win=64256 Len=17 TSval=1045823836 TSecr=3170083518
1711547090.071962118    59 0.662671846    10.10.1.1 → 10.10.1.2    TCP 83 8081 → 42994 [PSH, ACK] Seq=52 Ack=69 Win=65152 Len=17 TSval=3170083545 TSecr=1045823836
1711547095.071962118    64 0.709598099    10.10.1.2 → 10.10.1.1    TCP 66 42994 → 8081 [ACK] Seq=69 Ack=69 Win=64256 Len=0 TSval=1045823884 TSecr=3170083545
1711547096.071962118    65 0.715198552    10.10.1.2 → 10.10.1.1    TCP 83 42994 → 8081 [PSH, ACK] Seq=69 Ack=69 Win=64256 Len=17 TSval=1045823889 TSecr=3170083545
1711547099.071962118    68 0.715335238    10.10.1.1 → 10.10.1.2    TCP 83 8081 → 42994 [PSH, ACK] Seq=69 Ack=86 Win=65152 Len=17 TSval=3170083598 TSecr=1045823889
1711547100.071962118    69 0.715365129    10.10.1.2 → 10.10.1.1    TCP 66 42994 → 8081 [ACK] Seq=86 Ack=86 Win=64256 Len=0 TSval=1045823889 TSecr=3170083598
1711547105.071962118    74 0.722319742    10.10.1.2 → 10.10.1.1    TCP 83 42994 → 8081 [PSH, ACK] Seq=86 Ack=86 Win=64256 Len=17 TSval=1045823896 TSecr=3170083598
1711547107.071962118    76 0.722443452    10.10.1.1 → 10.10.1.2    TCP 83 8081 → 42994 [PSH, ACK] Seq=86 Ack=103 Win=65152 Len=17 TSval=3170083605 TSecr=1045823896
1711547113.071962118    82 0.759317456    10.10.1.2 → 10.10.1.1    TCP 83 42994 → 8081 [PSH, ACK] Seq=103 Ack=103 Win=64256 Len=17 TSval=1045823933 TSecr=3170083605
1711547115.071962118    84 0.759449862    10.10.1.1 → 10.10.1.2    TCP 83 8081 → 42994 [PSH, ACK] Seq=103 Ack=120 Win=65152 Len=17 TSval=3170083642 TSecr=1045823933
1711547121.071962118    90 0.805596627    10.10.1.2 → 10.10.1.1    TCP 66 42994 → 8081 [ACK] Seq=120 Ack=120 Win=64256 Len=0 TSval=1045823980 TSecr=3170083642
1711547122.071962118    91 0.855654875    10.10.1.2 → 10.10.1.1    TCP 83 42994 → 8081 [PSH, ACK] Seq=120 Ack=120 Win=64256 Len=17 TSval=1045824030 TSecr=3170083642
1711547124.071962118    93 0.855782648    10.10.1.1 → 10.10.1.2    TCP 83 8081 → 42994 [PSH, ACK] Seq=120 Ack=137 Win=65152 Len=17 TSval=3170083739 TSecr=1045824030
1711547126.071962118    95 0.855813634    10.10.1.2 → 10.10.1.1    TCP 66 42994 → 8081 [ACK] Seq=137 Ack=137 Win=64256 Len=0 TSval=1045824030 TSecr=3170083739
1711547131.071962118   100 0.981814154    10.10.1.2 → 10.10.1.1    TCP 83 42994 → 8081 [PSH, ACK] Seq=137 Ack=137 Win=64256 Len=17 TSval=1045824156 TSecr=3170083739
1711547133.071962118   102 0.981941282    10.10.1.1 → 10.10.1.2    TCP 83 8081 → 42994 [PSH, ACK] Seq=137 Ack=154 Win=65152 Len=17 TSval=3170083865 TSecr=1045824156
1711547135.071962118   104 0.981970987    10.10.1.2 → 10.10.1.1    TCP 66 42994 → 8081 [ACK] Seq=154 Ack=154 Win=64256 Len=0 TSval=1045824156 TSecr=3170083865
1711547140.071962118   109 1.063942219    10.10.1.2 → 10.10.1.1    TCP 83 42994 → 8081 [PSH, ACK] Seq=154 Ack=154 Win=64256 Len=17 TSval=1045824238 TSecr=3170083865
1711547142.071962118   111 1.064068071    10.10.1.1 → 10.10.1.2    TCP 83 8081 → 42994 [PSH, ACK] Seq=154 Ack=171 Win=65152 Len=17 TSval=3170083947 TSecr=1045824238
1711547144.071962118   113 1.064105270    10.10.1.2 → 10.10.1.1    TCP 66 42994 → 8081 [ACK] Seq=171 Ack=171 Win=64256 Len=0 TSval=1045824238 TSecr=3170083947
1711547150.071962118   119 1.185862862    10.10.1.2 → 10.10.1.1    TCP 83 42994 → 8081 [PSH, ACK] Seq=171 Ack=171 Win=64256 Len=17 TSval=1045824360 TSecr=3170083947
1711547152.071962118   121 1.185993539    10.10.1.1 → 10.10.1.2    TCP 83 8081 → 42994 [PSH, ACK] Seq=171 Ack=188 Win=65152 Len=17 TSval=3170084069 TSecr=1045824360
1711547154.071962118   123 1.186031030    10.10.1.2 → 10.10.1.1    TCP 66 42994 → 8081 [ACK] Seq=188 Ack=188 Win=64256 Len=0 TSval=1045824360 TSecr=3170084069
1711547159.071962118   128 1.449070807    10.10.1.2 → 10.10.1.1    TCP 83 42994 → 8081 [PSH, ACK] Seq=188 Ack=188 Win=64256 Len=17 TSval=1045824623 TSecr=3170084069
1711547162.071962118   131 1.449193733    10.10.1.1 → 10.10.1.2    TCP 83 8081 → 42994 [PSH, ACK] Seq=188 Ack=205 Win=65152 Len=17 TSval=3170084332 TSecr=1045824623
1711547163.071962118   132 1.449223339    10.10.1.2 → 10.10.1.1    TCP 66 42994 → 8081 [ACK] Seq=205 Ack=205 Win=64256 Len=0 TSval=1045824623 TSecr=3170084332
1711547168.071962118   137 1.498961793    10.10.1.2 → 10.10.1.1    TCP 83 42994 → 8081 [PSH, ACK] Seq=205 Ack=205 Win=64256 Len=17 TSval=1045824673 TSecr=3170084332
1711547171.071962118   140 1.499086995    10.10.1.1 → 10.10.1.2    TCP 83 8081 → 42994 [PSH, ACK] Seq=205 Ack=222 Win=65152 Len=17 TSval=3170084382 TSecr=1045824673
1711547172.071962118   141 1.499116656    10.10.1.2 → 10.10.1.1    TCP 66 42994 → 8081 [ACK] Seq=222 Ack=222 Win=64256 Len=0 TSval=1045824673 TSecr=3170084382
1711547177.071962118   146 1.517922921    10.10.1.2 → 10.10.1.1    TCP 83 42994 → 8081 [PSH, ACK] Seq=222 Ack=222 Win=64256 Len=17 TSval=1045824692 TSecr=3170084382
1711547180.071962118   149 1.518047885    10.10.1.1 → 10.10.1.2    TCP 83 8081 → 42994 [PSH, ACK] Seq=222 Ack=239 Win=65152 Len=17 TSval=3170084401 TSecr=1045824692
1711547185.071962118   154 1.558710435    10.10.1.2 → 10.10.1.1    TCP 83 42994 → 8081 [PSH, ACK] Seq=239 Ack=239 Win=64256 Len=17 TSval=1045824733 TSecr=3170084401
1711547188.071962118   157 1.558860307    10.10.1.1 → 10.10.1.2    TCP 83 8081 → 42994 [PSH, ACK] Seq=239 Ack=256 Win=65152 Len=17 TSval=3170084442 TSecr=1045824733
1711547193.071962118   162 1.598047686    10.10.1.2 → 10.10.1.1    TCP 83 42994 → 8081 [PSH, ACK] Seq=256 Ack=256 Win=64256 Len=17 TSval=1045824772 TSecr=3170084442
1711547196.071962118   165 1.598180694    10.10.1.1 → 10.10.1.2    TCP 83 8081 → 42994 [PSH, ACK] Seq=256 Ack=273 Win=65152 Len=17 TSval=3170084481 TSecr=1045824772
1711547201.071962118   170 1.641572040    10.10.1.2 → 10.10.1.1    TCP 83 42994 → 8081 [PSH, ACK] Seq=273 Ack=273 Win=64256 Len=17 TSval=1045824815 TSecr=3170084481
1711547204.071962118   173 1.641702137    10.10.1.1 → 10.10.1.2    TCP 83 8081 → 42994 [PSH, ACK] Seq=273 Ack=290 Win=65152 Len=17 TSval=3170084524 TSecr=1045824815
1711547209.071962118   178 1.685593883    10.10.1.2 → 10.10.1.1    TCP 66 42994 → 8081 [ACK] Seq=290 Ack=290 Win=64256 Len=0 TSval=1045824860 TSecr=3170084524
1711547210.071962118   179 1.693123392    10.10.1.2 → 10.10.1.1    TCP 83 42994 → 8081 [PSH, ACK] Seq=290 Ack=290 Win=64256 Len=17 TSval=1045824867 TSecr=3170084524
1711547212.071962118   181 1.693248554    10.10.1.1 → 10.10.1.2    TCP 83 8081 → 42994 [PSH, ACK] Seq=290 Ack=307 Win=65152 Len=17 TSval=3170084576 TSecr=1045824867
1711547214.071962118   183 1.693277663    10.10.1.2 → 10.10.1.1    TCP 66 42994 → 8081 [ACK] Seq=307 Ack=307 Win=64256 Len=0 TSval=1045824867 TSecr=3170084576
1711547219.071962118   188 1.725191018    10.10.1.2 → 10.10.1.1    TCP 83 42994 → 8081 [PSH, ACK] Seq=307 Ack=307 Win=64256 Len=17 TSval=1045824899 TSecr=3170084576
1711547221.071962118   190 1.725316316    10.10.1.1 → 10.10.1.2    TCP 83 8081 → 42994 [PSH, ACK] Seq=307 Ack=324 Win=65152 Len=17 TSval=3170084608 TSecr=1045824899
1711547227.071962118   196 1.748322164    10.10.1.2 → 10.10.1.1    TCP 83 42994 → 8081 [PSH, ACK] Seq=324 Ack=324 Win=64256 Len=17 TSval=1045824922 TSecr=3170084608
1711547229.071962118   198 1.748453244    10.10.1.1 → 10.10.1.2    TCP 83 8081 → 42994 [PSH, ACK] Seq=324 Ack=341 Win=65152 Len=17 TSval=3170084631 TSecr=1045824922
1711547235.071962118   204 1.780654057    10.10.1.2 → 10.10.1.1    TCP 83 42994 → 8081 [PSH, ACK] Seq=341 Ack=341 Win=64256 Len=17 TSval=1045824955 TSecr=3170084631
1711547238.071962118   207 1.780788033    10.10.1.1 → 10.10.1.2    TCP 83 8081 → 42994 [PSH, ACK] Seq=341 Ack=358 Win=65152 Len=17 TSval=3170084664 TSecr=1045824955
1711547243.071962118   212 1.825594369    10.10.1.2 → 10.10.1.1    TCP 66 42994 → 8081 [ACK] Seq=358 Ack=358 Win=64256 Len=0 TSval=1045825000 TSecr=3170084664
1711547245.071962118   214 2.109765521    10.10.1.2 → 10.10.1.1    TCP 83 42994 → 8081 [PSH, ACK] Seq=358 Ack=358 Win=64256 Len=17 TSval=1045825284 TSecr=3170084664
1711547247.071962118   216 2.109896807    10.10.1.1 → 10.10.1.2    TCP 83 8081 → 42994 [PSH, ACK] Seq=358 Ack=375 Win=65152 Len=17 TSval=3170084993 TSecr=1045825284
1711547248.071962118   217 2.109934736    10.10.1.2 → 10.10.1.1    TCP 66 42994 → 8081 [ACK] Seq=375 Ack=375 Win=64256 Len=0 TSval=1045825284 TSecr=3170084993
1711547253.071962118   222 2.176414042    10.10.1.2 → 10.10.1.1    TCP 83 42994 → 8081 [PSH, ACK] Seq=375 Ack=375 Win=64256 Len=17 TSval=1045825350 TSecr=3170084993
1711547256.071962118   225 2.176548994    10.10.1.1 → 10.10.1.2    TCP 83 8081 → 42994 [PSH, ACK] Seq=375 Ack=392 Win=65152 Len=17 TSval=3170085059 TSecr=1045825350
1711547257.071962118   226 2.176587394    10.10.1.2 → 10.10.1.1    TCP 66 42994 → 8081 [ACK] Seq=392 Ack=392 Win=64256 Len=0 TSval=1045825351 TSecr=3170085059
1711547262.071962118   231 2.272121430    10.10.1.2 → 10.10.1.1    TCP 83 42994 → 8081 [PSH, ACK] Seq=392 Ack=392 Win=64256 Len=17 TSval=1045825446 TSecr=3170085059
1711547265.071962118   234 2.272260462    10.10.1.1 → 10.10.1.2    TCP 83 8081 → 42994 [PSH, ACK] Seq=392 Ack=409 Win=65152 Len=17 TSval=3170085155 TSecr=1045825446
1711547266.071962118   235 2.272299196    10.10.1.2 → 10.10.1.1    TCP 66 42994 → 8081 [ACK] Seq=409 Ack=409 Win=64256 Len=0 TSval=1045825446 TSecr=3170085155
1711547271.071962118   240 2.317575426    10.10.1.2 → 10.10.1.1    TCP 83 42994 → 8081 [PSH, ACK] Seq=409 Ack=409 Win=64256 Len=17 TSval=1045825491 TSecr=3170085155
1711547274.071962118   243 2.317711433    10.10.1.1 → 10.10.1.2    TCP 83 8081 → 42994 [PSH, ACK] Seq=409 Ack=426 Win=65152 Len=17 TSval=3170085200 TSecr=1045825491
1711547275.071962118   244 2.317746706    10.10.1.2 → 10.10.1.1    TCP 66 42994 → 8081 [ACK] Seq=426 Ack=426 Win=64256 Len=0 TSval=1045825492 TSecr=3170085200
1711547280.071962118   249 2.670145084    10.10.1.2 → 10.10.1.1    TCP 83 42994 → 8081 [PSH, ACK] Seq=426 Ack=426 Win=64256 Len=17 TSval=1045825844 TSecr=3170085200
1711547283.071962118   252 2.670279320    10.10.1.1 → 10.10.1.2    TCP 83 8081 → 42994 [PSH, ACK] Seq=426 Ack=443 Win=65152 Len=17 TSval=3170085553 TSecr=1045825844
1711547284.071962118   253 2.670315091    10.10.1.2 → 10.10.1.1    TCP 66 42994 → 8081 [ACK] Seq=443 Ack=443 Win=64256 Len=0 TSval=1045825844 TSecr=3170085553
1711547289.071962118   258 2.672392351    10.10.1.2 → 10.10.1.1    TCP 83 42994 → 8081 [PSH, ACK] Seq=443 Ack=443 Win=64256 Len=17 TSval=1045825846 TSecr=3170085553
1711547292.071962118   261 2.672530528    10.10.1.1 → 10.10.1.2    TCP 83 8081 → 42994 [PSH, ACK] Seq=443 Ack=460 Win=65152 Len=17 TSval=3170085555 TSecr=1045825846
1711547297.071962118   266 2.713599122    10.10.1.2 → 10.10.1.1    TCP 66 42994 → 8081 [ACK] Seq=460 Ack=460 Win=64256 Len=0 TSval=1045825888 TSecr=3170085555
1711547298.071962118   267 2.786424539    10.10.1.2 → 10.10.1.1    TCP 83 42994 → 8081 [PSH, ACK] Seq=460 Ack=460 Win=64256 Len=17 TSval=1045825960 TSecr=3170085555
1711547301.071962118   270 2.786561804    10.10.1.1 → 10.10.1.2    TCP 83 8081 → 42994 [PSH, ACK] Seq=460 Ack=477 Win=65152 Len=17 TSval=3170085669 TSecr=1045825960
1711547302.071962118   271 2.786597687    10.10.1.2 → 10.10.1.1    TCP 66 42994 → 8081 [ACK] Seq=477 Ack=477 Win=64256 Len=0 TSval=1045825961 TSecr=3170085669
1711547307.071962118   276 2.802743898    10.10.1.2 → 10.10.1.1    TCP 83 42994 → 8081 [PSH, ACK] Seq=477 Ack=477 Win=64256 Len=17 TSval=1045825977 TSecr=3170085669
1711547310.071962118   279 2.802862456    10.10.1.1 → 10.10.1.2    TCP 83 8081 → 42994 [PSH, ACK] Seq=477 Ack=494 Win=65152 Len=17 TSval=3170085686 TSecr=1045825977
1711547315.071962118   284 2.836571110    10.10.1.2 → 10.10.1.1    TCP 83 42994 → 8081 [PSH, ACK] Seq=494 Ack=494 Win=64256 Len=17 TSval=1045826010 TSecr=3170085686
1711547318.071962118   287 2.836688694    10.10.1.1 → 10.10.1.2    TCP 83 8081 → 42994 [PSH, ACK] Seq=494 Ack=511 Win=65152 Len=17 TSval=3170085719 TSecr=1045826010
1711547323.071962118   292 2.877599048    10.10.1.2 → 10.10.1.1    TCP 66 42994 → 8081 [ACK] Seq=511 Ack=511 Win=64256 Len=0 TSval=1045826052 TSecr=3170085719
1711547324.071962118   293 2.978177667    10.10.1.2 → 10.10.1.1    TCP 83 42994 → 8081 [PSH, ACK] Seq=511 Ack=511 Win=64256 Len=17 TSval=1045826152 TSecr=3170085719
1711547327.071962118   296 2.978298600    10.10.1.1 → 10.10.1.2    TCP 83 8081 → 42994 [PSH, ACK] Seq=511 Ack=528 Win=65152 Len=17 TSval=3170085861 TSecr=1045826152
1711547328.071962118   297 2.978327548    10.10.1.2 → 10.10.1.1    TCP 66 42994 → 8081 [ACK] Seq=528 Ack=528 Win=64256 Len=0 TSval=1045826152 TSecr=3170085861
1711547333.071962118   302 3.022158626    10.10.1.2 → 10.10.1.1    TCP 83 42994 → 8081 [PSH, ACK] Seq=528 Ack=528 Win=64256 Len=17 TSval=1045826196 TSecr=3170085861
1711547335.071962118   304 3.022264689    10.10.1.1 → 10.10.1.2    TCP 83 8081 → 42994 [PSH, ACK] Seq=528 Ack=545 Win=65152 Len=17 TSval=3170085905 TSecr=1045826196
1711547336.071962118   305 3.022299081    10.10.1.2 → 10.10.1.1    TCP 66 42994 → 8081 [ACK] Seq=545 Ack=545 Win=64256 Len=0 TSval=1045826196 TSecr=3170085905
1711547342.071962118   311 3.115577501    10.10.1.2 → 10.10.1.1    TCP 83 42994 → 8081 [PSH, ACK] Seq=545 Ack=545 Win=64256 Len=17 TSval=1045826289 TSecr=3170085905
1711547344.071962118   313 3.115690099    10.10.1.1 → 10.10.1.2    TCP 83 8081 → 42994 [PSH, ACK] Seq=545 Ack=562 Win=65152 Len=17 TSval=3170085998 TSecr=1045826289
1711547345.071962118   314 3.115725164    10.10.1.2 → 10.10.1.1    TCP 66 42994 → 8081 [ACK] Seq=562 Ack=562 Win=64256 Len=0 TSval=1045826290 TSecr=3170085998
1711547351.071962118   320 3.128754004    10.10.1.2 → 10.10.1.1    TCP 83 42994 → 8081 [PSH, ACK] Seq=562 Ack=562 Win=64256 Len=17 TSval=1045826303 TSecr=3170085998
1711547353.071962118   322 3.128857772    10.10.1.1 → 10.10.1.2    TCP 83 8081 → 42994 [PSH, ACK] Seq=562 Ack=579 Win=65152 Len=17 TSval=3170086012 TSecr=1045826303
1711547360.071962118   329 3.169596139    10.10.1.2 → 10.10.1.1    TCP 66 42994 → 8081 [ACK] Seq=579 Ack=579 Win=64256 Len=0 TSval=1045826344 TSecr=3170086012
1711547361.071962118   330 3.217559255    10.10.1.2 → 10.10.1.1    TCP 83 42994 → 8081 [PSH, ACK] Seq=579 Ack=579 Win=64256 Len=17 TSval=1045826391 TSecr=3170086012
1711547363.071962118   332 3.217665247    10.10.1.1 → 10.10.1.2    TCP 83 8081 → 42994 [PSH, ACK] Seq=579 Ack=596 Win=65152 Len=17 TSval=3170086100 TSecr=1045826391
1711547364.071962118   333 3.217700844    10.10.1.2 → 10.10.1.1    TCP 66 42994 → 8081 [ACK] Seq=596 Ack=596 Win=64256 Len=0 TSval=1045826392 TSecr=3170086100
1711547370.071962118   339 3.219203273    10.10.1.2 → 10.10.1.1    TCP 83 42994 → 8081 [PSH, ACK] Seq=596 Ack=596 Win=64256 Len=17 TSval=1045826393 TSecr=3170086100
1711547372.071962118   341 3.219308698    10.10.1.1 → 10.10.1.2    TCP 83 8081 → 42994 [PSH, ACK] Seq=596 Ack=613 Win=65152 Len=17 TSval=3170086102 TSecr=1045826393
1711547378.071962118   347 3.240111627    10.10.1.2 → 10.10.1.1    TCP 83 42994 → 8081 [PSH, ACK] Seq=613 Ack=613 Win=64256 Len=17 TSval=1045826414 TSecr=3170086102
1711547380.071962118   349 3.240216658    10.10.1.1 → 10.10.1.2    TCP 83 8081 → 42994 [PSH, ACK] Seq=613 Ack=630 Win=65152 Len=17 TSval=3170086123 TSecr=1045826414
1711547386.071962118   355 3.285595347    10.10.1.2 → 10.10.1.1    TCP 66 42994 → 8081 [ACK] Seq=630 Ack=630 Win=64256 Len=0 TSval=1045826460 TSecr=3170086123
1711547387.071962118   356 3.465004259    10.10.1.2 → 10.10.1.1    TCP 83 42994 → 8081 [PSH, ACK] Seq=630 Ack=630 Win=64256 Len=17 TSval=1045826639 TSecr=3170086123
1711547390.071962118   359 3.465124764    10.10.1.1 → 10.10.1.2    TCP 83 8081 → 42994 [PSH, ACK] Seq=630 Ack=647 Win=65152 Len=17 TSval=3170086348 TSecr=1045826639
1711547391.071962118   360 3.465160370    10.10.1.2 → 10.10.1.1    TCP 66 42994 → 8081 [ACK] Seq=647 Ack=647 Win=64256 Len=0 TSval=1045826639 TSecr=3170086348
1711547396.071962118   365 3.564824545    10.10.1.2 → 10.10.1.1    TCP 83 42994 → 8081 [PSH, ACK] Seq=647 Ack=647 Win=64256 Len=17 TSval=1045826739 TSecr=3170086348
1711547399.071962118   368 3.564948597    10.10.1.1 → 10.10.1.2    TCP 83 8081 → 42994 [PSH, ACK] Seq=647 Ack=664 Win=65152 Len=17 TSval=3170086448 TSecr=1045826739
1711547400.071962118   369 3.564986412    10.10.1.2 → 10.10.1.1    TCP 66 42994 → 8081 [ACK] Seq=664 Ack=664 Win=64256 Len=0 TSval=1045826739 TSecr=3170086448
1711547405.071962118   374 3.797398633    10.10.1.2 → 10.10.1.1    TCP 83 42994 → 8081 [PSH, ACK] Seq=664 Ack=664 Win=64256 Len=17 TSval=1045826971 TSecr=3170086448
1711547408.071962118   377 3.797518070    10.10.1.1 → 10.10.1.2    TCP 83 8081 → 42994 [PSH, ACK] Seq=664 Ack=681 Win=65152 Len=17 TSval=3170086680 TSecr=1045826971
1711547409.071962118   378 3.797553823    10.10.1.2 → 10.10.1.1    TCP 66 42994 → 8081 [ACK] Seq=681 Ack=681 Win=64256 Len=0 TSval=1045826972 TSecr=3170086680
1711547414.071962118   383 3.858024476    10.10.1.2 → 10.10.1.1    TCP 83 42994 → 8081 [PSH, ACK] Seq=681 Ack=681 Win=64256 Len=17 TSval=1045827032 TSecr=3170086680
1711547417.071962118   386 3.858150015    10.10.1.1 → 10.10.1.2    TCP 83 8081 → 42994 [PSH, ACK] Seq=681 Ack=698 Win=65152 Len=17 TSval=3170086741 TSecr=1045827032
1711547418.071962118   387 3.858187861    10.10.1.2 → 10.10.1.1    TCP 66 42994 → 8081 [ACK] Seq=698 Ack=698 Win=64256 Len=0 TSval=1045827032 TSecr=3170086741
1711547423.071962118   392 3.898926674    10.10.1.2 → 10.10.1.1    TCP 83 42994 → 8081 [PSH, ACK] Seq=698 Ack=698 Win=64256 Len=17 TSval=1045827073 TSecr=3170086741
1711547426.071962118   395 3.899060787    10.10.1.1 → 10.10.1.2    TCP 83 8081 → 42994 [PSH, ACK] Seq=698 Ack=715 Win=65152 Len=17 TSval=3170086782 TSecr=1045827073
1711547427.071962118   396 3.899096333    10.10.1.2 → 10.10.1.1    TCP 66 42994 → 8081 [ACK] Seq=715 Ack=715 Win=64256 Len=0 TSval=1045827073 TSecr=3170086782
1711547432.071962118   401 4.076341584    10.10.1.2 → 10.10.1.1    TCP 83 42994 → 8081 [PSH, ACK] Seq=715 Ack=715 Win=64256 Len=17 TSval=1045827250 TSecr=3170086782
1711547435.071962118   404 4.076471111    10.10.1.1 → 10.10.1.2    TCP 83 8081 → 42994 [PSH, ACK] Seq=715 Ack=732 Win=65152 Len=17 TSval=3170086959 TSecr=1045827250
1711547436.071962118   405 4.076506165    10.10.1.2 → 10.10.1.1    TCP 66 42994 → 8081 [ACK] Seq=732 Ack=732 Win=64256 Len=0 TSval=1045827250 TSecr=3170086959
1711547441.071962118   410 4.262205924    10.10.1.2 → 10.10.1.1    TCP 83 42994 → 8081 [PSH, ACK] Seq=732 Ack=732 Win=64256 Len=17 TSval=1045827436 TSecr=3170086959
1711547444.071962118   413 4.262331349    10.10.1.1 → 10.10.1.2    TCP 83 8081 → 42994 [PSH, ACK] Seq=732 Ack=749 Win=65152 Len=17 TSval=3170087145 TSecr=1045827436
1711547445.071962118   414 4.262366999    10.10.1.2 → 10.10.1.1    TCP 66 42994 → 8081 [ACK] Seq=749 Ack=749 Win=64256 Len=0 TSval=1045827436 TSecr=3170087145
1711547450.071962118   419 4.332616003    10.10.1.2 → 10.10.1.1    TCP 83 42994 → 8081 [PSH, ACK] Seq=749 Ack=749 Win=64256 Len=17 TSval=1045827507 TSecr=3170087145
1711547453.071962118   422 4.332741874    10.10.1.1 → 10.10.1.2    TCP 83 8081 → 42994 [PSH, ACK] Seq=749 Ack=766 Win=65152 Len=17 TSval=3170087216 TSecr=1045827507
1711547454.071962118   423 4.332778455    10.10.1.2 → 10.10.1.1    TCP 66 42994 → 8081 [ACK] Seq=766 Ack=766 Win=64256 Len=0 TSval=1045827507 TSecr=3170087216
1711547459.071962118   428 4.350680308    10.10.1.2 → 10.10.1.1    TCP 83 42994 → 8081 [PSH, ACK] Seq=766 Ack=766 Win=64256 Len=17 TSval=1045827525 TSecr=3170087216
1711547461.071962118   430 4.350802035    10.10.1.1 → 10.10.1.2    TCP 83 8081 → 42994 [PSH, ACK] Seq=766 Ack=783 Win=65152 Len=17 TSval=3170087234 TSecr=1045827525
1711547467.071962118   436 4.369208724    10.10.1.2 → 10.10.1.1    TCP 83 42994 → 8081 [PSH, ACK] Seq=783 Ack=783 Win=64256 Len=17 TSval=1045827543 TSecr=3170087234
1711547469.071962118   438 4.369344027    10.10.1.1 → 10.10.1.2    TCP 83 8081 → 42994 [PSH, ACK] Seq=783 Ack=800 Win=65152 Len=17 TSval=3170087252 TSecr=1045827543
1711547475.071962118   444 4.409595776    10.10.1.2 → 10.10.1.1    TCP 66 42994 → 8081 [ACK] Seq=800 Ack=800 Win=64256 Len=0 TSval=1045827584 TSecr=3170087252
1711547476.071962118   445 4.562219344    10.10.1.2 → 10.10.1.1    TCP 83 42994 → 8081 [PSH, ACK] Seq=800 Ack=800 Win=64256 Len=17 TSval=1045827736 TSecr=3170087252
1711547478.071962118   447 4.562343750    10.10.1.1 → 10.10.1.2    TCP 83 8081 → 42994 [PSH, ACK] Seq=800 Ack=817 Win=65152 Len=17 TSval=3170087445 TSecr=1045827736
1711547480.071962118   449 4.562381176    10.10.1.2 → 10.10.1.1    TCP 66 42994 → 8081 [ACK] Seq=817 Ack=817 Win=64256 Len=0 TSval=1045827736 TSecr=3170087445
1711547485.071962118   454 4.645386576    10.10.1.2 → 10.10.1.1    TCP 83 42994 → 8081 [PSH, ACK] Seq=817 Ack=817 Win=64256 Len=17 TSval=1045827819 TSecr=3170087445
1711547487.071962118   456 4.645510519    10.10.1.1 → 10.10.1.2    TCP 83 8081 → 42994 [PSH, ACK] Seq=817 Ack=834 Win=65152 Len=17 TSval=3170087528 TSecr=1045827819
1711547489.071962118   458 4.645549784    10.10.1.2 → 10.10.1.1    TCP 66 42994 → 8081 [ACK] Seq=834 Ack=834 Win=64256 Len=0 TSval=1045827820 TSecr=3170087528
1711547494.071962118   463 4.703398217    10.10.1.2 → 10.10.1.1    TCP 83 42994 → 8081 [PSH, ACK] Seq=834 Ack=834 Win=64256 Len=17 TSval=1045827877 TSecr=3170087528
1711547496.071962118   465 4.703521159    10.10.1.1 → 10.10.1.2    TCP 83 8081 → 42994 [PSH, ACK] Seq=834 Ack=851 Win=65152 Len=17 TSval=3170087586 TSecr=1045827877
1711547498.071962118   467 4.703557571    10.10.1.2 → 10.10.1.1    TCP 66 42994 → 8081 [ACK] Seq=851 Ack=851 Win=64256 Len=0 TSval=1045827878 TSecr=3170087586
1711547503.071962118   472 4.709731084    10.10.1.2 → 10.10.1.1    TCP 83 42994 → 8081 [PSH, ACK] Seq=851 Ack=851 Win=64256 Len=17 TSval=1045827884 TSecr=3170087586
1711547505.071962118   474 4.709854288    10.10.1.1 → 10.10.1.2    TCP 83 8081 → 42994 [PSH, ACK] Seq=851 Ack=868 Win=65152 Len=17 TSval=3170087593 TSecr=1045827884
1711547511.071962118   480 4.753595449    10.10.1.2 → 10.10.1.1    TCP 66 42994 → 8081 [ACK] Seq=868 Ack=868 Win=64256 Len=0 TSval=1045827928 TSecr=3170087593
1711547512.071962118   481 4.891463128    10.10.1.2 → 10.10.1.1    TCP 83 42994 → 8081 [PSH, ACK] Seq=868 Ack=868 Win=64256 Len=17 TSval=1045828065 TSecr=3170087593
1711547514.071962118   483 4.891588860    10.10.1.1 → 10.10.1.2    TCP 83 8081 → 42994 [PSH, ACK] Seq=868 Ack=885 Win=65152 Len=17 TSval=3170087774 TSecr=1045828065
1711547516.071962118   485 4.891631145    10.10.1.2 → 10.10.1.1    TCP 66 42994 → 8081 [ACK] Seq=885 Ack=885 Win=64256 Len=0 TSval=1045828066 TSecr=3170087774
1711547521.071962118   490 4.943037064    10.10.1.2 → 10.10.1.1    TCP 83 42994 → 8081 [PSH, ACK] Seq=885 Ack=885 Win=64256 Len=17 TSval=1045828117 TSecr=3170087774
1711547523.071962118   492 4.943162127    10.10.1.1 → 10.10.1.2    TCP 83 8081 → 42994 [PSH, ACK] Seq=885 Ack=902 Win=65152 Len=17 TSval=3170087826 TSecr=1045828117
1711547525.071962118   494 4.943198305    10.10.1.2 → 10.10.1.1    TCP 66 42994 → 8081 [ACK] Seq=902 Ack=902 Win=64256 Len=0 TSval=1045828117 TSecr=3170087826
1711547530.071962118   499 5.021664357    10.10.1.2 → 10.10.1.1    TCP 83 42994 → 8081 [PSH, ACK] Seq=902 Ack=902 Win=64256 Len=17 TSval=1045828196 TSecr=3170087826
1711547532.071962118   501 5.021789309    10.10.1.1 → 10.10.1.2    TCP 83 8081 → 42994 [PSH, ACK] Seq=902 Ack=919 Win=65152 Len=17 TSval=3170087905 TSecr=1045828196
1711547534.071962118   503 5.021825080    10.10.1.2 → 10.10.1.1    TCP 66 42994 → 8081 [ACK] Seq=919 Ack=919 Win=64256 Len=0 TSval=1045828196 TSecr=3170087905
1711547539.071962118   508 5.082085447    10.10.1.2 → 10.10.1.1    TCP 83 42994 → 8081 [PSH, ACK] Seq=919 Ack=919 Win=64256 Len=17 TSval=1045828256 TSecr=3170087905
1711547541.071962118   510 5.082209875    10.10.1.1 → 10.10.1.2    TCP 83 8081 → 42994 [PSH, ACK] Seq=919 Ack=936 Win=65152 Len=17 TSval=3170087965 TSecr=1045828256
1711547543.071962118   512 5.082246304    10.10.1.2 → 10.10.1.1    TCP 66 42994 → 8081 [ACK] Seq=936 Ack=936 Win=64256 Len=0 TSval=1045828256 TSecr=3170087965
1711547549.071962118   518 5.226779517    10.10.1.2 → 10.10.1.1    TCP 83 42994 → 8081 [PSH, ACK] Seq=936 Ack=936 Win=64256 Len=17 TSval=1045828401 TSecr=3170087965
1711547551.071962118   520 5.226903664    10.10.1.1 → 10.10.1.2    TCP 83 8081 → 42994 [PSH, ACK] Seq=936 Ack=953 Win=65152 Len=17 TSval=3170088110 TSecr=1045828401
1711547553.071962118   522 5.226940205    10.10.1.2 → 10.10.1.1    TCP 66 42994 → 8081 [ACK] Seq=953 Ack=953 Win=64256 Len=0 TSval=1045828401 TSecr=3170088110
1711547558.071962118   527 5.299147213    10.10.1.2 → 10.10.1.1    TCP 83 42994 → 8081 [PSH, ACK] Seq=953 Ack=953 Win=64256 Len=17 TSval=1045828473 TSecr=3170088110
1711547561.071962118   530 5.299342691    10.10.1.1 → 10.10.1.2    TCP 83 8081 → 42994 [PSH, ACK] Seq=953 Ack=970 Win=65152 Len=17 TSval=3170088182 TSecr=1045828473
1711547562.071962118   531 5.299378520    10.10.1.2 → 10.10.1.1    TCP 66 42994 → 8081 [ACK] Seq=970 Ack=970 Win=64256 Len=0 TSval=1045828473 TSecr=3170088182
1711547567.071962118   536 5.363131311    10.10.1.2 → 10.10.1.1    TCP 83 42994 → 8081 [PSH, ACK] Seq=970 Ack=970 Win=64256 Len=17 TSval=1045828537 TSecr=3170088182
1711547569.071962118   538 5.363255427    10.10.1.1 → 10.10.1.2    TCP 83 8081 → 42994 [PSH, ACK] Seq=970 Ack=987 Win=65152 Len=17 TSval=3170088246 TSecr=1045828537
1711547571.071962118   540 5.363290548    10.10.1.2 → 10.10.1.1    TCP 66 42994 → 8081 [ACK] Seq=987 Ack=987 Win=64256 Len=0 TSval=1045828537 TSecr=3170088246
1711547576.071962118   545 5.421999598    10.10.1.2 → 10.10.1.1    TCP 83 42994 → 8081 [PSH, ACK] Seq=987 Ack=987 Win=64256 Len=17 TSval=1045828596 TSecr=3170088246
1711547578.071962118   547 5.422123623    10.10.1.1 → 10.10.1.2    TCP 83 8081 → 42994 [PSH, ACK] Seq=987 Ack=1004 Win=65152 Len=17 TSval=3170088305 TSecr=1045828596
1711547580.071962118   549 5.422159553    10.10.1.2 → 10.10.1.1    TCP 66 42994 → 8081 [ACK] Seq=1004 Ack=1004 Win=64256 Len=0 TSval=1045828596 TSecr=3170088305
1711547585.071962118   554 5.530509715    10.10.1.2 → 10.10.1.1    TCP 83 42994 → 8081 [PSH, ACK] Seq=1004 Ack=1004 Win=64256 Len=17 TSval=1045828704 TSecr=3170088305
1711547587.071962118   556 5.530636326    10.10.1.1 → 10.10.1.2    TCP 83 8081 → 42994 [PSH, ACK] Seq=1004 Ack=1021 Win=65152 Len=17 TSval=3170088413 TSecr=1045828704
1711547589.071962118   558 5.530673168    10.10.1.2 → 10.10.1.1    TCP 66 42994 → 8081 [ACK] Seq=1021 Ack=1021 Win=64256 Len=0 TSval=1045828705 TSecr=3170088413
1711547594.071962118   563 5.671549769    10.10.1.2 → 10.10.1.1    TCP 83 42994 → 8081 [PSH, ACK] Seq=1021 Ack=1021 Win=64256 Len=17 TSval=1045828845 TSecr=3170088413
1711547596.071962118   565 5.671674988    10.10.1.1 → 10.10.1.2    TCP 83 8081 → 42994 [PSH, ACK] Seq=1021 Ack=1038 Win=65152 Len=17 TSval=3170088554 TSecr=1045828845
1711547598.071962118   567 5.671711404    10.10.1.2 → 10.10.1.1    TCP 66 42994 → 8081 [ACK] Seq=1038 Ack=1038 Win=64256 Len=0 TSval=1045828846 TSecr=3170088554
1711547603.071962118   572 5.694151406    10.10.1.2 → 10.10.1.1    TCP 83 42994 → 8081 [PSH, ACK] Seq=1038 Ack=1038 Win=64256 Len=17 TSval=1045828868 TSecr=3170088554
1711547605.071962118   574 5.694275498    10.10.1.1 → 10.10.1.2    TCP 83 8081 → 42994 [PSH, ACK] Seq=1038 Ack=1055 Win=65152 Len=17 TSval=3170088577 TSecr=1045828868
1711547611.071962118   580 5.695969123    10.10.1.2 → 10.10.1.1    TCP 83 42994 → 8081 [PSH, ACK] Seq=1055 Ack=1055 Win=64256 Len=17 TSval=1045828870 TSecr=3170088577
1711547613.071962118   582 5.696104155    10.10.1.1 → 10.10.1.2    TCP 83 8081 → 42994 [PSH, ACK] Seq=1055 Ack=1072 Win=65152 Len=17 TSval=3170088579 TSecr=1045828870
1711547619.071962118   588 5.741090928    10.10.1.2 → 10.10.1.1    TCP 83 42994 → 8081 [PSH, ACK] Seq=1072 Ack=1072 Win=64256 Len=17 TSval=1045828915 TSecr=3170088579
1711547621.071962118   590 5.741230010    10.10.1.1 → 10.10.1.2    TCP 83 8081 → 42994 [PSH, ACK] Seq=1072 Ack=1089 Win=65152 Len=17 TSval=3170088624 TSecr=1045828915
1711547627.071962118   596 5.780040844    10.10.1.2 → 10.10.1.1    TCP 83 42994 → 8081 [PSH, ACK] Seq=1089 Ack=1089 Win=64256 Len=17 TSval=1045828954 TSecr=3170088624
1711547629.071962118   598 5.780180277    10.10.1.1 → 10.10.1.2    TCP 83 8081 → 42994 [PSH, ACK] Seq=1089 Ack=1106 Win=65152 Len=17 TSval=3170088663 TSecr=1045828954
1711547635.071962118   604 5.821596177    10.10.1.2 → 10.10.1.1    TCP 66 42994 → 8081 [ACK] Seq=1106 Ack=1106 Win=64256 Len=0 TSval=1045828996 TSecr=3170088663
1711547636.071962118   605 5.872513283    10.10.1.2 → 10.10.1.1    TCP 83 42994 → 8081 [PSH, ACK] Seq=1106 Ack=1106 Win=64256 Len=17 TSval=1045829046 TSecr=3170088663
1711547638.071962118   607 5.872640101    10.10.1.1 → 10.10.1.2    TCP 83 8081 → 42994 [PSH, ACK] Seq=1106 Ack=1123 Win=65152 Len=17 TSval=3170088755 TSecr=1045829046
1711547640.071962118   609 5.872686786    10.10.1.2 → 10.10.1.1    TCP 66 42994 → 8081 [ACK] Seq=1123 Ack=1123 Win=64256 Len=0 TSval=1045829047 TSecr=3170088755
1711547645.071962118   614 5.919714687    10.10.1.2 → 10.10.1.1    TCP 83 42994 → 8081 [PSH, ACK] Seq=1123 Ack=1123 Win=64256 Len=17 TSval=1045829094 TSecr=3170088755
1711547647.071962118   616 5.919838842    10.10.1.1 → 10.10.1.2    TCP 83 8081 → 42994 [PSH, ACK] Seq=1123 Ack=1140 Win=65152 Len=17 TSval=3170088803 TSecr=1045829094
1711547649.071962118   618 5.919876509    10.10.1.2 → 10.10.1.1    TCP 66 42994 → 8081 [ACK] Seq=1140 Ack=1140 Win=64256 Len=0 TSval=1045829094 TSecr=3170088803
1711547654.071962118   623 5.990645104    10.10.1.2 → 10.10.1.1    TCP 83 42994 → 8081 [PSH, ACK] Seq=1140 Ack=1140 Win=64256 Len=17 TSval=1045829165 TSecr=3170088803
1711547656.071962118   625 5.990790459    10.10.1.1 → 10.10.1.2    TCP 83 8081 → 42994 [PSH, ACK] Seq=1140 Ack=1157 Win=65152 Len=17 TSval=3170088874 TSecr=1045829165
1711547658.071962118   627 5.990826452    10.10.1.2 → 10.10.1.1    TCP 66 42994 → 8081 [ACK] Seq=1157 Ack=1157 Win=64256 Len=0 TSval=1045829165 TSecr=3170088874
1711547663.071962118   632 6.059545324    10.10.1.2 → 10.10.1.1    TCP 83 42994 → 8081 [PSH, ACK] Seq=1157 Ack=1157 Win=64256 Len=17 TSval=1045829233 TSecr=3170088874
1711547665.071962118   634 6.059670861    10.10.1.1 → 10.10.1.2    TCP 83 8081 → 42994 [PSH, ACK] Seq=1157 Ack=1174 Win=65152 Len=17 TSval=3170088942 TSecr=1045829233
1711547667.071962118   636 6.059707425    10.10.1.2 → 10.10.1.1    TCP 66 42994 → 8081 [ACK] Seq=1174 Ack=1174 Win=64256 Len=0 TSval=1045829234 TSecr=3170088942
1711547673.071962118   642 6.060319415    10.10.1.2 → 10.10.1.1    TCP 83 42994 → 8081 [PSH, ACK] Seq=1174 Ack=1174 Win=64256 Len=17 TSval=1045829234 TSecr=3170088942
1711547675.071962118   644 6.060438512    10.10.1.1 → 10.10.1.2    TCP 83 8081 → 42994 [PSH, ACK] Seq=1174 Ack=1191 Win=65152 Len=17 TSval=3170088943 TSecr=1045829234
1711547680.071962118   649 6.101597392    10.10.1.2 → 10.10.1.1    TCP 66 42994 → 8081 [ACK] Seq=1191 Ack=1191 Win=64256 Len=0 TSval=1045829276 TSecr=3170088943
1711547681.071962118   650 6.113125075    10.10.1.2 → 10.10.1.1    TCP 83 42994 → 8081 [PSH, ACK] Seq=1191 Ack=1191 Win=64256 Len=17 TSval=1045829287 TSecr=3170088943
1711547683.071962118   652 6.113249457    10.10.1.1 → 10.10.1.2    TCP 83 8081 → 42994 [PSH, ACK] Seq=1191 Ack=1208 Win=65152 Len=17 TSval=3170088996 TSecr=1045829287
1711547685.071962118   654 6.113285956    10.10.1.2 → 10.10.1.1    TCP 66 42994 → 8081 [ACK] Seq=1208 Ack=1208 Win=64256 Len=0 TSval=1045829287 TSecr=3170088996
1711547692.071962118   661 6.410891219    10.10.1.2 → 10.10.1.1    TCP 83 42994 → 8081 [PSH, ACK] Seq=1208 Ack=1208 Win=64256 Len=17 TSval=1045829585 TSecr=3170088996
1711547693.071962118   662 6.411022054    10.10.1.1 → 10.10.1.2    TCP 83 8081 → 42994 [PSH, ACK] Seq=1208 Ack=1225 Win=65152 Len=17 TSval=3170089294 TSecr=1045829585
1711547694.071962118   663 6.411056534    10.10.1.2 → 10.10.1.1    TCP 66 42994 → 8081 [ACK] Seq=1225 Ack=1225 Win=64256 Len=0 TSval=1045829585 TSecr=3170089294
1711547699.071962118   668 6.452507312    10.10.1.2 → 10.10.1.1    TCP 83 42994 → 8081 [PSH, ACK] Seq=1225 Ack=1225 Win=64256 Len=17 TSval=1045829626 TSecr=3170089294
1711547702.071962118   671 6.452632420    10.10.1.1 → 10.10.1.2    TCP 83 8081 → 42994 [PSH, ACK] Seq=1225 Ack=1242 Win=65152 Len=17 TSval=3170089335 TSecr=1045829626
1711547703.071962118   672 6.452669027    10.10.1.2 → 10.10.1.1    TCP 66 42994 → 8081 [ACK] Seq=1242 Ack=1242 Win=64256 Len=0 TSval=1045829627 TSecr=3170089335
1711547708.071962118   677 6.480038001    10.10.1.2 → 10.10.1.1    TCP 83 42994 → 8081 [PSH, ACK] Seq=1242 Ack=1242 Win=64256 Len=17 TSval=1045829654 TSecr=3170089335
1711547711.071962118   680 6.480162803    10.10.1.1 → 10.10.1.2    TCP 83 8081 → 42994 [PSH, ACK] Seq=1242 Ack=1259 Win=65152 Len=17 TSval=3170089363 TSecr=1045829654
1711547716.071962118   685 6.525599319    10.10.1.2 → 10.10.1.1    TCP 66 42994 → 8081 [ACK] Seq=1259 Ack=1259 Win=64256 Len=0 TSval=1045829700 TSecr=3170089363
1711547717.071962118   686 6.637607161    10.10.1.2 → 10.10.1.1    TCP 83 42994 → 8081 [PSH, ACK] Seq=1259 Ack=1259 Win=64256 Len=17 TSval=1045829812 TSecr=3170089363
1711547720.071962118   689 6.637731627    10.10.1.1 → 10.10.1.2    TCP 83 8081 → 42994 [PSH, ACK] Seq=1259 Ack=1276 Win=65152 Len=17 TSval=3170089520 TSecr=1045829812
1711547721.071962118   690 6.637768060    10.10.1.2 → 10.10.1.1    TCP 66 42994 → 8081 [ACK] Seq=1276 Ack=1276 Win=64256 Len=0 TSval=1045829812 TSecr=3170089520
1711547726.071962118   695 6.822374363    10.10.1.2 → 10.10.1.1    TCP 83 42994 → 8081 [PSH, ACK] Seq=1276 Ack=1276 Win=64256 Len=17 TSval=1045829996 TSecr=3170089520
1711547729.071962118   698 6.822500706    10.10.1.1 → 10.10.1.2    TCP 83 8081 → 42994 [PSH, ACK] Seq=1276 Ack=1293 Win=65152 Len=17 TSval=3170089705 TSecr=1045829996
1711547730.071962118   699 6.822535786    10.10.1.2 → 10.10.1.1    TCP 66 42994 → 8081 [ACK] Seq=1293 Ack=1293 Win=64256 Len=0 TSval=1045829996 TSecr=3170089705
1711547735.071962118   704 6.873890561    10.10.1.2 → 10.10.1.1    TCP 83 42994 → 8081 [PSH, ACK] Seq=1293 Ack=1293 Win=64256 Len=17 TSval=1045830048 TSecr=3170089705
1711547738.071962118   707 6.874017330    10.10.1.1 → 10.10.1.2    TCP 83 8081 → 42994 [PSH, ACK] Seq=1293 Ack=1310 Win=65152 Len=17 TSval=3170089757 TSecr=1045830048
1711547739.071962118   708 6.874052164    10.10.1.2 → 10.10.1.1    TCP 66 42994 → 8081 [ACK] Seq=1310 Ack=1310 Win=64256 Len=0 TSval=1045830048 TSecr=3170089757
1711547744.071962118   713 7.193313267    10.10.1.2 → 10.10.1.1    TCP 83 42994 → 8081 [PSH, ACK] Seq=1310 Ack=1310 Win=64256 Len=17 TSval=1045830367 TSecr=3170089757
1711547747.071962118   716 7.193433467    10.10.1.1 → 10.10.1.2    TCP 83 8081 → 42994 [PSH, ACK] Seq=1310 Ack=1327 Win=65152 Len=17 TSval=3170090076 TSecr=1045830367
1711547748.071962118   717 7.193468887    10.10.1.2 → 10.10.1.1    TCP 66 42994 → 8081 [ACK] Seq=1327 Ack=1327 Win=64256 Len=0 TSval=1045830367 TSecr=3170090076
1711547754.071962118   723 7.312794747    10.10.1.2 → 10.10.1.1    TCP 83 42994 → 8081 [PSH, ACK] Seq=1327 Ack=1327 Win=64256 Len=17 TSval=1045830487 TSecr=3170090076
1711547757.071962118   726 7.312920033    10.10.1.1 → 10.10.1.2    TCP 83 8081 → 42994 [PSH, ACK] Seq=1327 Ack=1344 Win=65152 Len=17 TSval=3170090196 TSecr=1045830487
1711547758.071962118   727 7.312955259    10.10.1.2 → 10.10.1.1    TCP 66 42994 → 8081 [ACK] Seq=1344 Ack=1344 Win=64256 Len=0 TSval=1045830487 TSecr=3170090196
1711547763.071962118   732 7.645013663    10.10.1.2 → 10.10.1.1    TCP 83 42994 → 8081 [PSH, ACK] Seq=1344 Ack=1344 Win=64256 Len=17 TSval=1045830819 TSecr=3170090196
1711547766.071962118   735 7.645135666    10.10.1.1 → 10.10.1.2    TCP 83 8081 → 42994 [PSH, ACK] Seq=1344 Ack=1361 Win=65152 Len=17 TSval=3170090528 TSecr=1045830819
1711547767.071962118   736 7.645171598    10.10.1.2 → 10.10.1.1    TCP 66 42994 → 8081 [ACK] Seq=1361 Ack=1361 Win=64256 Len=0 TSval=1045830819 TSecr=3170090528
1711547772.071962118   741 7.695954433    10.10.1.2 → 10.10.1.1    TCP 83 42994 → 8081 [PSH, ACK] Seq=1361 Ack=1361 Win=64256 Len=17 TSval=1045830870 TSecr=3170090528
1711547775.071962118   744 7.696078968    10.10.1.1 → 10.10.1.2    TCP 83 8081 → 42994 [PSH, ACK] Seq=1361 Ack=1378 Win=65152 Len=17 TSval=3170090579 TSecr=1045830870
1711547776.071962118   745 7.696114386    10.10.1.2 → 10.10.1.1    TCP 66 42994 → 8081 [ACK] Seq=1378 Ack=1378 Win=64256 Len=0 TSval=1045830870 TSecr=3170090579
1711547781.071962118   750 7.836707961    10.10.1.2 → 10.10.1.1    TCP 83 42994 → 8081 [PSH, ACK] Seq=1378 Ack=1378 Win=64256 Len=17 TSval=1045831011 TSecr=3170090579
1711547784.071962118   753 7.836834627    10.10.1.1 → 10.10.1.2    TCP 83 8081 → 42994 [PSH, ACK] Seq=1378 Ack=1395 Win=65152 Len=17 TSval=3170090720 TSecr=1045831011
1711547785.071962118   754 7.836870618    10.10.1.2 → 10.10.1.1    TCP 66 42994 → 8081 [ACK] Seq=1395 Ack=1395 Win=64256 Len=0 TSval=1045831011 TSecr=3170090720
1711547790.071962118   759 7.998387365    10.10.1.2 → 10.10.1.1    TCP 83 42994 → 8081 [PSH, ACK] Seq=1395 Ack=1395 Win=64256 Len=17 TSval=1045831172 TSecr=3170090720
1711547793.071962118   762 7.998512725    10.10.1.1 → 10.10.1.2    TCP 83 8081 → 42994 [PSH, ACK] Seq=1395 Ack=1412 Win=65152 Len=17 TSval=3170090881 TSecr=1045831172
1711547794.071962118   763 7.998549533    10.10.1.2 → 10.10.1.1    TCP 66 42994 → 8081 [ACK] Seq=1412 Ack=1412 Win=64256 Len=0 TSval=1045831172 TSecr=3170090881
1711547799.071962118   768 8.158690204    10.10.1.2 → 10.10.1.1    TCP 83 42994 → 8081 [PSH, ACK] Seq=1412 Ack=1412 Win=64256 Len=17 TSval=1045831333 TSecr=3170090881
1711547802.071962118   771 8.158816651    10.10.1.1 → 10.10.1.2    TCP 83 8081 → 42994 [PSH, ACK] Seq=1412 Ack=1429 Win=65152 Len=17 TSval=3170091042 TSecr=1045831333
1711547803.071962118   772 8.158852227    10.10.1.2 → 10.10.1.1    TCP 66 42994 → 8081 [ACK] Seq=1429 Ack=1429 Win=64256 Len=0 TSval=1045831333 TSecr=3170091042
