1712098999.043401957    23 0.273732369    10.10.1.2 → 10.10.1.1    TCP 74 47964 → 8081 [SYN] Seq=0 Win=64240 Len=0 MSS=1460 SACK_PERM=1 TSval=1597768366 TSecr=0 WS=128
1712099000.043401957    24 0.273767789    10.10.1.1 → 10.10.1.2    TCP 74 8081 → 47964 [SYN, ACK] Seq=0 Ack=1 Win=65160 Len=0 MSS=1460 SACK_PERM=1 TSval=3722028074 TSecr=1597768366 WS=128
1712099001.043401957    25 0.273809234    10.10.1.2 → 10.10.1.1    TCP 66 47964 → 8081 [ACK] Seq=1 Ack=1 Win=64256 Len=0 TSval=1597768366 TSecr=3722028074
1712099010.043401957    34 0.534969189    10.10.1.2 → 10.10.1.1    TCP 83 47964 → 8081 [PSH, ACK] Seq=1 Ack=1 Win=64256 Len=17 TSval=1597768627 TSecr=3722028074
1712099011.043401957    35 0.534996596    10.10.1.1 → 10.10.1.2    TCP 66 8081 → 47964 [ACK] Seq=1 Ack=18 Win=65152 Len=0 TSval=3722028336 TSecr=1597768627
1712099013.043401957    37 0.535276719    10.10.1.1 → 10.10.1.2    TCP 83 8081 → 47964 [PSH, ACK] Seq=1 Ack=18 Win=65152 Len=17 TSval=3722028336 TSecr=1597768627
1712099014.043401957    38 0.535312941    10.10.1.2 → 10.10.1.1    TCP 66 47964 → 8081 [ACK] Seq=18 Ack=18 Win=64256 Len=0 TSval=1597768628 TSecr=3722028336
1712099020.043401957    44 0.545499151    10.10.1.2 → 10.10.1.1    TCP 83 47964 → 8081 [PSH, ACK] Seq=18 Ack=18 Win=64256 Len=17 TSval=1597768638 TSecr=3722028336
1712099023.043401957    47 0.545623053    10.10.1.1 → 10.10.1.2    TCP 83 8081 → 47964 [PSH, ACK] Seq=18 Ack=35 Win=65152 Len=17 TSval=3722028346 TSecr=1597768638
1712099029.043401957    53 0.555841098    10.10.1.2 → 10.10.1.1    TCP 83 47964 → 8081 [PSH, ACK] Seq=35 Ack=35 Win=64256 Len=17 TSval=1597768648 TSecr=3722028346
1712099031.043401957    55 0.555971833    10.10.1.1 → 10.10.1.2    TCP 83 8081 → 47964 [PSH, ACK] Seq=35 Ack=52 Win=65152 Len=17 TSval=3722028357 TSecr=1597768648
1712099037.043401957    61 0.566189141    10.10.1.2 → 10.10.1.1    TCP 83 47964 → 8081 [PSH, ACK] Seq=52 Ack=52 Win=64256 Len=17 TSval=1597768658 TSecr=3722028357
1712099040.043401957    64 0.566320137    10.10.1.1 → 10.10.1.2    TCP 83 8081 → 47964 [PSH, ACK] Seq=52 Ack=69 Win=65152 Len=17 TSval=3722028367 TSecr=1597768658
1712099046.043401957    70 0.576540232    10.10.1.2 → 10.10.1.1    TCP 83 47964 → 8081 [PSH, ACK] Seq=69 Ack=69 Win=64256 Len=17 TSval=1597768669 TSecr=3722028367
1712099048.043401957    72 0.576671542    10.10.1.1 → 10.10.1.2    TCP 83 8081 → 47964 [PSH, ACK] Seq=69 Ack=86 Win=65152 Len=17 TSval=3722028377 TSecr=1597768669
1712099054.043401957    78 0.586894399    10.10.1.2 → 10.10.1.1    TCP 83 47964 → 8081 [PSH, ACK] Seq=86 Ack=86 Win=64256 Len=17 TSval=1597768679 TSecr=3722028377
1712099056.043401957    80 0.586982799    10.10.1.1 → 10.10.1.2    TCP 83 8081 → 47964 [PSH, ACK] Seq=86 Ack=103 Win=65152 Len=17 TSval=3722028388 TSecr=1597768679
1712099063.043401957    87 0.597201629    10.10.1.2 → 10.10.1.1    TCP 83 47964 → 8081 [PSH, ACK] Seq=103 Ack=103 Win=64256 Len=17 TSval=1597768689 TSecr=3722028388
1712099065.043401957    89 0.597332894    10.10.1.1 → 10.10.1.2    TCP 83 8081 → 47964 [PSH, ACK] Seq=103 Ack=120 Win=65152 Len=17 TSval=3722028398 TSecr=1597768689
1712099071.043401957    95 0.607548695    10.10.1.2 → 10.10.1.1    TCP 83 47964 → 8081 [PSH, ACK] Seq=120 Ack=120 Win=64256 Len=17 TSval=1597768700 TSecr=3722028398
1712099074.043401957    98 0.607679827    10.10.1.1 → 10.10.1.2    TCP 83 8081 → 47964 [PSH, ACK] Seq=120 Ack=137 Win=65152 Len=17 TSval=3722028408 TSecr=1597768700
1712099080.043401957   104 0.617896078    10.10.1.2 → 10.10.1.1    TCP 83 47964 → 8081 [PSH, ACK] Seq=137 Ack=137 Win=64256 Len=17 TSval=1597768710 TSecr=3722028408
1712099082.043401957   106 0.618028470    10.10.1.1 → 10.10.1.2    TCP 83 8081 → 47964 [PSH, ACK] Seq=137 Ack=154 Win=65152 Len=17 TSval=3722028419 TSecr=1597768710
1712099088.043401957   112 0.628244365    10.10.1.2 → 10.10.1.1    TCP 83 47964 → 8081 [PSH, ACK] Seq=154 Ack=154 Win=64256 Len=17 TSval=1597768720 TSecr=3722028419
1712099091.043401957   115 0.628375630    10.10.1.1 → 10.10.1.2    TCP 83 8081 → 47964 [PSH, ACK] Seq=154 Ack=171 Win=65152 Len=17 TSval=3722028429 TSecr=1597768720
1712099097.043401957   121 0.638591793    10.10.1.2 → 10.10.1.1    TCP 83 47964 → 8081 [PSH, ACK] Seq=171 Ack=171 Win=64256 Len=17 TSval=1597768731 TSecr=3722028429
1712099099.043401957   123 0.638722059    10.10.1.1 → 10.10.1.2    TCP 83 8081 → 47964 [PSH, ACK] Seq=171 Ack=188 Win=65152 Len=17 TSval=3722028439 TSecr=1597768731
1712099105.043401957   129 0.648938962    10.10.1.2 → 10.10.1.1    TCP 83 47964 → 8081 [PSH, ACK] Seq=188 Ack=188 Win=64256 Len=17 TSval=1597768741 TSecr=3722028439
1712099108.043401957   132 0.649069680    10.10.1.1 → 10.10.1.2    TCP 83 8081 → 47964 [PSH, ACK] Seq=188 Ack=205 Win=65152 Len=17 TSval=3722028450 TSecr=1597768741
1712099114.043401957   138 0.659256484    10.10.1.2 → 10.10.1.1    TCP 83 47964 → 8081 [PSH, ACK] Seq=205 Ack=205 Win=64256 Len=17 TSval=1597768752 TSecr=3722028450
1712099116.043401957   140 0.659386559    10.10.1.1 → 10.10.1.2    TCP 83 8081 → 47964 [PSH, ACK] Seq=205 Ack=222 Win=65152 Len=17 TSval=3722028460 TSecr=1597768752
1712099122.043401957   146 0.669604132    10.10.1.2 → 10.10.1.1    TCP 83 47964 → 8081 [PSH, ACK] Seq=222 Ack=222 Win=64256 Len=17 TSval=1597768762 TSecr=3722028460
1712099125.043401957   149 0.669734893    10.10.1.1 → 10.10.1.2    TCP 83 8081 → 47964 [PSH, ACK] Seq=222 Ack=239 Win=65152 Len=17 TSval=3722028470 TSecr=1597768762
1712099131.043401957   155 0.679949643    10.10.1.2 → 10.10.1.1    TCP 83 47964 → 8081 [PSH, ACK] Seq=239 Ack=239 Win=64256 Len=17 TSval=1597768772 TSecr=3722028470
1712099133.043401957   157 0.680078265    10.10.1.1 → 10.10.1.2    TCP 83 8081 → 47964 [PSH, ACK] Seq=239 Ack=256 Win=65152 Len=17 TSval=3722028481 TSecr=1597768772
1712099139.043401957   163 0.690293743    10.10.1.2 → 10.10.1.1    TCP 83 47964 → 8081 [PSH, ACK] Seq=256 Ack=256 Win=64256 Len=17 TSval=1597768783 TSecr=3722028481
1712099142.043401957   166 0.690423814    10.10.1.1 → 10.10.1.2    TCP 83 8081 → 47964 [PSH, ACK] Seq=256 Ack=273 Win=65152 Len=17 TSval=3722028491 TSecr=1597768783
1712099148.043401957   172 0.700641169    10.10.1.2 → 10.10.1.1    TCP 83 47964 → 8081 [PSH, ACK] Seq=273 Ack=273 Win=64256 Len=17 TSval=1597768793 TSecr=3722028491
1712099150.043401957   174 0.700771382    10.10.1.1 → 10.10.1.2    TCP 83 8081 → 47964 [PSH, ACK] Seq=273 Ack=290 Win=65152 Len=17 TSval=3722028501 TSecr=1597768793
1712099156.043401957   180 0.710989691    10.10.1.2 → 10.10.1.1    TCP 83 47964 → 8081 [PSH, ACK] Seq=290 Ack=290 Win=64256 Len=17 TSval=1597768803 TSecr=3722028501
1712099159.043401957   183 0.711118748    10.10.1.1 → 10.10.1.2    TCP 83 8081 → 47964 [PSH, ACK] Seq=290 Ack=307 Win=65152 Len=17 TSval=3722028512 TSecr=1597768803
1712099165.043401957   189 0.721336146    10.10.1.2 → 10.10.1.1    TCP 83 47964 → 8081 [PSH, ACK] Seq=307 Ack=307 Win=64256 Len=17 TSval=1597768814 TSecr=3722028512
1712099167.043401957   191 0.721479062    10.10.1.1 → 10.10.1.2    TCP 83 8081 → 47964 [PSH, ACK] Seq=307 Ack=324 Win=65152 Len=17 TSval=3722028522 TSecr=1597768814
1712099173.043401957   197 0.731694789    10.10.1.2 → 10.10.1.1    TCP 83 47964 → 8081 [PSH, ACK] Seq=324 Ack=324 Win=64256 Len=17 TSval=1597768824 TSecr=3722028522
1712099176.043401957   200 0.731824938    10.10.1.1 → 10.10.1.2    TCP 83 8081 → 47964 [PSH, ACK] Seq=324 Ack=341 Win=65152 Len=17 TSval=3722028532 TSecr=1597768824
1712099182.043401957   206 0.742042134    10.10.1.2 → 10.10.1.1    TCP 83 47964 → 8081 [PSH, ACK] Seq=341 Ack=341 Win=64256 Len=17 TSval=1597768834 TSecr=3722028532
1712099184.043401957   208 0.742171993    10.10.1.1 → 10.10.1.2    TCP 83 8081 → 47964 [PSH, ACK] Seq=341 Ack=358 Win=65152 Len=17 TSval=3722028543 TSecr=1597768834
1712099190.043401957   214 0.752387989    10.10.1.2 → 10.10.1.1    TCP 83 47964 → 8081 [PSH, ACK] Seq=358 Ack=358 Win=64256 Len=17 TSval=1597768845 TSecr=3722028543
1712099193.043401957   217 0.752518014    10.10.1.1 → 10.10.1.2    TCP 83 8081 → 47964 [PSH, ACK] Seq=358 Ack=375 Win=65152 Len=17 TSval=3722028553 TSecr=1597768845
1712099199.043401957   223 0.762735115    10.10.1.2 → 10.10.1.1    TCP 83 47964 → 8081 [PSH, ACK] Seq=375 Ack=375 Win=64256 Len=17 TSval=1597768855 TSecr=3722028553
1712099201.043401957   225 0.762865211    10.10.1.1 → 10.10.1.2    TCP 83 8081 → 47964 [PSH, ACK] Seq=375 Ack=392 Win=65152 Len=17 TSval=3722028563 TSecr=1597768855
1712099207.043401957   231 0.773083926    10.10.1.2 → 10.10.1.1    TCP 83 47964 → 8081 [PSH, ACK] Seq=392 Ack=392 Win=64256 Len=17 TSval=1597768865 TSecr=3722028563
1712099210.043401957   234 0.773213350    10.10.1.1 → 10.10.1.2    TCP 83 8081 → 47964 [PSH, ACK] Seq=392 Ack=409 Win=65152 Len=17 TSval=3722028574 TSecr=1597768865
1712099216.043401957   240 0.783430885    10.10.1.2 → 10.10.1.1    TCP 83 47964 → 8081 [PSH, ACK] Seq=409 Ack=409 Win=64256 Len=17 TSval=1597768876 TSecr=3722028574
1712099218.043401957   242 0.783561641    10.10.1.1 → 10.10.1.2    TCP 83 8081 → 47964 [PSH, ACK] Seq=409 Ack=426 Win=65152 Len=17 TSval=3722028584 TSecr=1597768876
1712099224.043401957   248 0.793780155    10.10.1.2 → 10.10.1.1    TCP 83 47964 → 8081 [PSH, ACK] Seq=426 Ack=426 Win=64256 Len=17 TSval=1597768886 TSecr=3722028584
1712099227.043401957   251 0.793911166    10.10.1.1 → 10.10.1.2    TCP 83 8081 → 47964 [PSH, ACK] Seq=426 Ack=443 Win=65152 Len=17 TSval=3722028595 TSecr=1597768886
1712099233.043401957   257 0.804127892    10.10.1.2 → 10.10.1.1    TCP 83 47964 → 8081 [PSH, ACK] Seq=443 Ack=443 Win=64256 Len=17 TSval=1597768896 TSecr=3722028595
1712099235.043401957   259 0.804258810    10.10.1.1 → 10.10.1.2    TCP 83 8081 → 47964 [PSH, ACK] Seq=443 Ack=460 Win=65152 Len=17 TSval=3722028605 TSecr=1597768896
1712099241.043401957   265 0.814474485    10.10.1.2 → 10.10.1.1    TCP 83 47964 → 8081 [PSH, ACK] Seq=460 Ack=460 Win=64256 Len=17 TSval=1597768907 TSecr=3722028605
1712099244.043401957   268 0.814604566    10.10.1.1 → 10.10.1.2    TCP 83 8081 → 47964 [PSH, ACK] Seq=460 Ack=477 Win=65152 Len=17 TSval=3722028615 TSecr=1597768907
1712099250.043401957   274 0.824819990    10.10.1.2 → 10.10.1.1    TCP 83 47964 → 8081 [PSH, ACK] Seq=477 Ack=477 Win=64256 Len=17 TSval=1597768917 TSecr=3722028615
1712099252.043401957   276 0.824952925    10.10.1.1 → 10.10.1.2    TCP 83 8081 → 47964 [PSH, ACK] Seq=477 Ack=494 Win=65152 Len=17 TSval=3722028626 TSecr=1597768917
1712099258.043401957   282 0.835172868    10.10.1.2 → 10.10.1.1    TCP 83 47964 → 8081 [PSH, ACK] Seq=494 Ack=494 Win=64256 Len=17 TSval=1597768927 TSecr=3722028626
1712099261.043401957   285 0.835302955    10.10.1.1 → 10.10.1.2    TCP 83 8081 → 47964 [PSH, ACK] Seq=494 Ack=511 Win=65152 Len=17 TSval=3722028636 TSecr=1597768927
1712099267.043401957   291 0.845521895    10.10.1.2 → 10.10.1.1    TCP 83 47964 → 8081 [PSH, ACK] Seq=511 Ack=511 Win=64256 Len=17 TSval=1597768938 TSecr=3722028636
1712099269.043401957   293 0.845652140    10.10.1.1 → 10.10.1.2    TCP 83 8081 → 47964 [PSH, ACK] Seq=511 Ack=528 Win=65152 Len=17 TSval=3722028646 TSecr=1597768938
1712099275.043401957   299 0.855868084    10.10.1.2 → 10.10.1.1    TCP 83 47964 → 8081 [PSH, ACK] Seq=528 Ack=528 Win=64256 Len=17 TSval=1597768948 TSecr=3722028646
1712099278.043401957   302 0.855998194    10.10.1.1 → 10.10.1.2    TCP 83 8081 → 47964 [PSH, ACK] Seq=528 Ack=545 Win=65152 Len=17 TSval=3722028657 TSecr=1597768948
1712099284.043401957   308 0.866215924    10.10.1.2 → 10.10.1.1    TCP 83 47964 → 8081 [PSH, ACK] Seq=545 Ack=545 Win=64256 Len=17 TSval=1597768958 TSecr=3722028657
1712099286.043401957   310 0.866345606    10.10.1.1 → 10.10.1.2    TCP 83 8081 → 47964 [PSH, ACK] Seq=545 Ack=562 Win=65152 Len=17 TSval=3722028667 TSecr=1597768958
1712099292.043401957   316 0.876563583    10.10.1.2 → 10.10.1.1    TCP 83 47964 → 8081 [PSH, ACK] Seq=562 Ack=562 Win=64256 Len=17 TSval=1597768969 TSecr=3722028667
1712099295.043401957   319 0.876693520    10.10.1.1 → 10.10.1.2    TCP 83 8081 → 47964 [PSH, ACK] Seq=562 Ack=579 Win=65152 Len=17 TSval=3722028677 TSecr=1597768969
1712099301.043401957   325 0.886907989    10.10.1.2 → 10.10.1.1    TCP 83 47964 → 8081 [PSH, ACK] Seq=579 Ack=579 Win=64256 Len=17 TSval=1597768979 TSecr=3722028677
1712099303.043401957   327 0.887037499    10.10.1.1 → 10.10.1.2    TCP 83 8081 → 47964 [PSH, ACK] Seq=579 Ack=596 Win=65152 Len=17 TSval=3722028688 TSecr=1597768979
1712099309.043401957   333 0.897217857    10.10.1.2 → 10.10.1.1    TCP 83 47964 → 8081 [PSH, ACK] Seq=596 Ack=596 Win=64256 Len=17 TSval=1597768989 TSecr=3722028688
1712099312.043401957   336 0.897348992    10.10.1.1 → 10.10.1.2    TCP 83 8081 → 47964 [PSH, ACK] Seq=596 Ack=613 Win=65152 Len=17 TSval=3722028698 TSecr=1597768989
1712099318.043401957   342 0.907563809    10.10.1.2 → 10.10.1.1    TCP 83 47964 → 8081 [PSH, ACK] Seq=613 Ack=613 Win=64256 Len=17 TSval=1597769000 TSecr=3722028698
1712099320.043401957   344 0.907694407    10.10.1.1 → 10.10.1.2    TCP 83 8081 → 47964 [PSH, ACK] Seq=613 Ack=630 Win=65152 Len=17 TSval=3722028708 TSecr=1597769000
1712099326.043401957   350 0.917912526    10.10.1.2 → 10.10.1.1    TCP 83 47964 → 8081 [PSH, ACK] Seq=630 Ack=630 Win=64256 Len=17 TSval=1597769010 TSecr=3722028708
1712099329.043401957   353 0.918041813    10.10.1.1 → 10.10.1.2    TCP 83 8081 → 47964 [PSH, ACK] Seq=630 Ack=647 Win=65152 Len=17 TSval=3722028719 TSecr=1597769010
1712099335.043401957   359 0.928258991    10.10.1.2 → 10.10.1.1    TCP 83 47964 → 8081 [PSH, ACK] Seq=647 Ack=647 Win=64256 Len=17 TSval=1597769021 TSecr=3722028719
1712099337.043401957   361 0.928389437    10.10.1.1 → 10.10.1.2    TCP 83 8081 → 47964 [PSH, ACK] Seq=647 Ack=664 Win=65152 Len=17 TSval=3722028729 TSecr=1597769021
1712099343.043401957   367 0.938607207    10.10.1.2 → 10.10.1.1    TCP 83 47964 → 8081 [PSH, ACK] Seq=664 Ack=664 Win=64256 Len=17 TSval=1597769031 TSecr=3722028729
1712099346.043401957   370 0.938737866    10.10.1.1 → 10.10.1.2    TCP 83 8081 → 47964 [PSH, ACK] Seq=664 Ack=681 Win=65152 Len=17 TSval=3722028739 TSecr=1597769031
1712099352.043401957   376 0.948955260    10.10.1.2 → 10.10.1.1    TCP 83 47964 → 8081 [PSH, ACK] Seq=681 Ack=681 Win=64256 Len=17 TSval=1597769041 TSecr=3722028739
1712099354.043401957   378 0.949085343    10.10.1.1 → 10.10.1.2    TCP 83 8081 → 47964 [PSH, ACK] Seq=681 Ack=698 Win=65152 Len=17 TSval=3722028750 TSecr=1597769041
1712099360.043401957   384 0.959258774    10.10.1.2 → 10.10.1.1    TCP 83 47964 → 8081 [PSH, ACK] Seq=698 Ack=698 Win=64256 Len=17 TSval=1597769052 TSecr=3722028750
1712099363.043401957   387 0.959388722    10.10.1.1 → 10.10.1.2    TCP 83 8081 → 47964 [PSH, ACK] Seq=698 Ack=715 Win=65152 Len=17 TSval=3722028760 TSecr=1597769052
1712099369.043401957   393 0.969607900    10.10.1.2 → 10.10.1.1    TCP 83 47964 → 8081 [PSH, ACK] Seq=715 Ack=715 Win=64256 Len=17 TSval=1597769062 TSecr=3722028760
1712099371.043401957   395 0.969739025    10.10.1.1 → 10.10.1.2    TCP 83 8081 → 47964 [PSH, ACK] Seq=715 Ack=732 Win=65152 Len=17 TSval=3722028770 TSecr=1597769062
1712099377.043401957   401 0.979957674    10.10.1.2 → 10.10.1.1    TCP 83 47964 → 8081 [PSH, ACK] Seq=732 Ack=732 Win=64256 Len=17 TSval=1597769072 TSecr=3722028770
1712099380.043401957   404 0.980087584    10.10.1.1 → 10.10.1.2    TCP 83 8081 → 47964 [PSH, ACK] Seq=732 Ack=749 Win=65152 Len=17 TSval=3722028781 TSecr=1597769072
1712099386.043401957   410 0.990305598    10.10.1.2 → 10.10.1.1    TCP 83 47964 → 8081 [PSH, ACK] Seq=749 Ack=749 Win=64256 Len=17 TSval=1597769083 TSecr=3722028781
1712099388.043401957   412 0.990435924    10.10.1.1 → 10.10.1.2    TCP 83 8081 → 47964 [PSH, ACK] Seq=749 Ack=766 Win=65152 Len=17 TSval=3722028791 TSecr=1597769083
1712099394.043401957   418 1.000653786    10.10.1.2 → 10.10.1.1    TCP 83 47964 → 8081 [PSH, ACK] Seq=766 Ack=766 Win=64256 Len=17 TSval=1597769093 TSecr=3722028791
1712099397.043401957   421 1.000783821    10.10.1.1 → 10.10.1.2    TCP 83 8081 → 47964 [PSH, ACK] Seq=766 Ack=783 Win=65152 Len=17 TSval=3722028801 TSecr=1597769093
1712099403.043401957   427 1.010999368    10.10.1.2 → 10.10.1.1    TCP 83 47964 → 8081 [PSH, ACK] Seq=783 Ack=783 Win=64256 Len=17 TSval=1597769103 TSecr=3722028801
1712099405.043401957   429 1.011129511    10.10.1.1 → 10.10.1.2    TCP 83 8081 → 47964 [PSH, ACK] Seq=783 Ack=800 Win=65152 Len=17 TSval=3722028812 TSecr=1597769103
1712099411.043401957   435 1.021346082    10.10.1.2 → 10.10.1.1    TCP 83 47964 → 8081 [PSH, ACK] Seq=800 Ack=800 Win=64256 Len=17 TSval=1597769114 TSecr=3722028812
1712099414.043401957   438 1.021476290    10.10.1.1 → 10.10.1.2    TCP 83 8081 → 47964 [PSH, ACK] Seq=800 Ack=817 Win=65152 Len=17 TSval=3722028822 TSecr=1597769114
1712099420.043401957   444 1.031692064    10.10.1.2 → 10.10.1.1    TCP 83 47964 → 8081 [PSH, ACK] Seq=817 Ack=817 Win=64256 Len=17 TSval=1597769124 TSecr=3722028822
1712099422.043401957   446 1.031821704    10.10.1.1 → 10.10.1.2    TCP 83 8081 → 47964 [PSH, ACK] Seq=817 Ack=834 Win=65152 Len=17 TSval=3722028832 TSecr=1597769124
1712099428.043401957   452 1.042042347    10.10.1.2 → 10.10.1.1    TCP 83 47964 → 8081 [PSH, ACK] Seq=834 Ack=834 Win=64256 Len=17 TSval=1597769134 TSecr=3722028832
1712099431.043401957   455 1.042172961    10.10.1.1 → 10.10.1.2    TCP 83 8081 → 47964 [PSH, ACK] Seq=834 Ack=851 Win=65152 Len=17 TSval=3722028843 TSecr=1597769134
1712099437.043401957   461 1.052391028    10.10.1.2 → 10.10.1.1    TCP 83 47964 → 8081 [PSH, ACK] Seq=851 Ack=851 Win=64256 Len=17 TSval=1597769145 TSecr=3722028843
1712099439.043401957   463 1.052519459    10.10.1.1 → 10.10.1.2    TCP 83 8081 → 47964 [PSH, ACK] Seq=851 Ack=868 Win=65152 Len=17 TSval=3722028853 TSecr=1597769145
1712099445.043401957   469 1.062736628    10.10.1.2 → 10.10.1.1    TCP 83 47964 → 8081 [PSH, ACK] Seq=868 Ack=868 Win=64256 Len=17 TSval=1597769155 TSecr=3722028853
1712099448.043401957   472 1.062866987    10.10.1.1 → 10.10.1.2    TCP 83 8081 → 47964 [PSH, ACK] Seq=868 Ack=885 Win=65152 Len=17 TSval=3722028863 TSecr=1597769155
1712099454.043401957   478 1.073084027    10.10.1.2 → 10.10.1.1    TCP 83 47964 → 8081 [PSH, ACK] Seq=885 Ack=885 Win=64256 Len=17 TSval=1597769165 TSecr=3722028863
1712099456.043401957   480 1.073213713    10.10.1.1 → 10.10.1.2    TCP 83 8081 → 47964 [PSH, ACK] Seq=885 Ack=902 Win=65152 Len=17 TSval=3722028874 TSecr=1597769165
1712099462.043401957   486 1.083430053    10.10.1.2 → 10.10.1.1    TCP 83 47964 → 8081 [PSH, ACK] Seq=902 Ack=902 Win=64256 Len=17 TSval=1597769176 TSecr=3722028874
1712099465.043401957   489 1.083560003    10.10.1.1 → 10.10.1.2    TCP 83 8081 → 47964 [PSH, ACK] Seq=902 Ack=919 Win=65152 Len=17 TSval=3722028884 TSecr=1597769176
1712099471.043401957   495 1.093777401    10.10.1.2 → 10.10.1.1    TCP 83 47964 → 8081 [PSH, ACK] Seq=919 Ack=919 Win=64256 Len=17 TSval=1597769186 TSecr=3722028884
1712099473.043401957   497 1.093906493    10.10.1.1 → 10.10.1.2    TCP 83 8081 → 47964 [PSH, ACK] Seq=919 Ack=936 Win=65152 Len=17 TSval=3722028895 TSecr=1597769186
1712099479.043401957   503 1.104123441    10.10.1.2 → 10.10.1.1    TCP 83 47964 → 8081 [PSH, ACK] Seq=936 Ack=936 Win=64256 Len=17 TSval=1597769196 TSecr=3722028895
1712099482.043401957   506 1.104252515    10.10.1.1 → 10.10.1.2    TCP 83 8081 → 47964 [PSH, ACK] Seq=936 Ack=953 Win=65152 Len=17 TSval=3722028905 TSecr=1597769196
1712099488.043401957   512 1.114471239    10.10.1.2 → 10.10.1.1    TCP 83 47964 → 8081 [PSH, ACK] Seq=953 Ack=953 Win=64256 Len=17 TSval=1597769207 TSecr=3722028905
1712099490.043401957   514 1.114657315    10.10.1.1 → 10.10.1.2    TCP 83 8081 → 47964 [PSH, ACK] Seq=953 Ack=970 Win=65152 Len=17 TSval=3722028915 TSecr=1597769207
1712099496.043401957   520 1.124874557    10.10.1.2 → 10.10.1.1    TCP 83 47964 → 8081 [PSH, ACK] Seq=970 Ack=970 Win=64256 Len=17 TSval=1597769217 TSecr=3722028915
1712099499.043401957   523 1.125004928    10.10.1.1 → 10.10.1.2    TCP 83 8081 → 47964 [PSH, ACK] Seq=970 Ack=987 Win=65152 Len=17 TSval=3722028926 TSecr=1597769217
1712099505.043401957   529 1.135222095    10.10.1.2 → 10.10.1.1    TCP 83 47964 → 8081 [PSH, ACK] Seq=987 Ack=987 Win=64256 Len=17 TSval=1597769227 TSecr=3722028926
1712099507.043401957   531 1.135351232    10.10.1.1 → 10.10.1.2    TCP 83 8081 → 47964 [PSH, ACK] Seq=987 Ack=1004 Win=65152 Len=17 TSval=3722028936 TSecr=1597769227
1712099513.043401957   537 1.145569906    10.10.1.2 → 10.10.1.1    TCP 83 47964 → 8081 [PSH, ACK] Seq=1004 Ack=1004 Win=64256 Len=17 TSval=1597769238 TSecr=3722028936
1712099516.043401957   540 1.145700773    10.10.1.1 → 10.10.1.2    TCP 83 8081 → 47964 [PSH, ACK] Seq=1004 Ack=1021 Win=65152 Len=17 TSval=3722028946 TSecr=1597769238
1712099522.043401957   546 1.155918155    10.10.1.2 → 10.10.1.1    TCP 83 47964 → 8081 [PSH, ACK] Seq=1021 Ack=1021 Win=64256 Len=17 TSval=1597769248 TSecr=3722028946
1712099524.043401957   548 1.156046701    10.10.1.1 → 10.10.1.2    TCP 83 8081 → 47964 [PSH, ACK] Seq=1021 Ack=1038 Win=65152 Len=17 TSval=3722028957 TSecr=1597769248
1712099530.043401957   554 1.166263338    10.10.1.2 → 10.10.1.1    TCP 83 47964 → 8081 [PSH, ACK] Seq=1038 Ack=1038 Win=64256 Len=17 TSval=1597769259 TSecr=3722028957
1712099533.043401957   557 1.166394231    10.10.1.1 → 10.10.1.2    TCP 83 8081 → 47964 [PSH, ACK] Seq=1038 Ack=1055 Win=65152 Len=17 TSval=3722028967 TSecr=1597769259
1712099539.043401957   563 1.176612592    10.10.1.2 → 10.10.1.1    TCP 83 47964 → 8081 [PSH, ACK] Seq=1055 Ack=1055 Win=64256 Len=17 TSval=1597769269 TSecr=3722028967
1712099541.043401957   565 1.176742097    10.10.1.1 → 10.10.1.2    TCP 83 8081 → 47964 [PSH, ACK] Seq=1055 Ack=1072 Win=65152 Len=17 TSval=3722028977 TSecr=1597769269
1712099547.043401957   571 1.186959849    10.10.1.2 → 10.10.1.1    TCP 83 47964 → 8081 [PSH, ACK] Seq=1072 Ack=1072 Win=64256 Len=17 TSval=1597769279 TSecr=3722028977
1712099550.043401957   574 1.187090291    10.10.1.1 → 10.10.1.2    TCP 83 8081 → 47964 [PSH, ACK] Seq=1072 Ack=1089 Win=65152 Len=17 TSval=3722028988 TSecr=1597769279
1712099556.043401957   580 1.197305929    10.10.1.2 → 10.10.1.1    TCP 83 47964 → 8081 [PSH, ACK] Seq=1089 Ack=1089 Win=64256 Len=17 TSval=1597769290 TSecr=3722028988
1712099558.043401957   582 1.197386656    10.10.1.1 → 10.10.1.2    TCP 83 8081 → 47964 [PSH, ACK] Seq=1089 Ack=1106 Win=65152 Len=17 TSval=3722028998 TSecr=1597769290
1712099564.043401957   588 1.207602704    10.10.1.2 → 10.10.1.1    TCP 83 47964 → 8081 [PSH, ACK] Seq=1106 Ack=1106 Win=64256 Len=17 TSval=1597769300 TSecr=3722028998
1712099567.043401957   591 1.207731655    10.10.1.1 → 10.10.1.2    TCP 83 8081 → 47964 [PSH, ACK] Seq=1106 Ack=1123 Win=65152 Len=17 TSval=3722029008 TSecr=1597769300
1712099573.043401957   597 1.217947284    10.10.1.2 → 10.10.1.1    TCP 83 47964 → 8081 [PSH, ACK] Seq=1123 Ack=1123 Win=64256 Len=17 TSval=1597769310 TSecr=3722029008
1712099575.043401957   599 1.218075055    10.10.1.1 → 10.10.1.2    TCP 83 8081 → 47964 [PSH, ACK] Seq=1123 Ack=1140 Win=65152 Len=17 TSval=3722029019 TSecr=1597769310
1712099581.043401957   605 1.228293427    10.10.1.2 → 10.10.1.1    TCP 83 47964 → 8081 [PSH, ACK] Seq=1140 Ack=1140 Win=64256 Len=17 TSval=1597769321 TSecr=3722029019
1712099584.043401957   608 1.228422724    10.10.1.1 → 10.10.1.2    TCP 83 8081 → 47964 [PSH, ACK] Seq=1140 Ack=1157 Win=65152 Len=17 TSval=3722029029 TSecr=1597769321
1712099590.043401957   614 1.238637447    10.10.1.2 → 10.10.1.1    TCP 83 47964 → 8081 [PSH, ACK] Seq=1157 Ack=1157 Win=64256 Len=17 TSval=1597769331 TSecr=3722029029
1712099592.043401957   616 1.238767331    10.10.1.1 → 10.10.1.2    TCP 83 8081 → 47964 [PSH, ACK] Seq=1157 Ack=1174 Win=65152 Len=17 TSval=3722029039 TSecr=1597769331
1712099598.043401957   622 1.248984128    10.10.1.2 → 10.10.1.1    TCP 83 47964 → 8081 [PSH, ACK] Seq=1174 Ack=1174 Win=64256 Len=17 TSval=1597769341 TSecr=3722029039
1712099601.043401957   625 1.249114075    10.10.1.1 → 10.10.1.2    TCP 83 8081 → 47964 [PSH, ACK] Seq=1174 Ack=1191 Win=65152 Len=17 TSval=3722029050 TSecr=1597769341
1712099607.043401957   631 1.259329698    10.10.1.2 → 10.10.1.1    TCP 83 47964 → 8081 [PSH, ACK] Seq=1191 Ack=1191 Win=64256 Len=17 TSval=1597769352 TSecr=3722029050
1712099609.043401957   633 1.259459254    10.10.1.1 → 10.10.1.2    TCP 83 8081 → 47964 [PSH, ACK] Seq=1191 Ack=1208 Win=65152 Len=17 TSval=3722029060 TSecr=1597769352
1712099615.043401957   639 1.269677078    10.10.1.2 → 10.10.1.1    TCP 83 47964 → 8081 [PSH, ACK] Seq=1208 Ack=1208 Win=64256 Len=17 TSval=1597769362 TSecr=3722029060
1712099618.043401957   642 1.269808643    10.10.1.1 → 10.10.1.2    TCP 83 8081 → 47964 [PSH, ACK] Seq=1208 Ack=1225 Win=65152 Len=17 TSval=3722029070 TSecr=1597769362
1712099624.043401957   648 1.280024251    10.10.1.2 → 10.10.1.1    TCP 83 47964 → 8081 [PSH, ACK] Seq=1225 Ack=1225 Win=64256 Len=17 TSval=1597769372 TSecr=3722029070
1712099626.043401957   650 1.280154720    10.10.1.1 → 10.10.1.2    TCP 83 8081 → 47964 [PSH, ACK] Seq=1225 Ack=1242 Win=65152 Len=17 TSval=3722029081 TSecr=1597769372
1712099632.043401957   656 1.290370655    10.10.1.2 → 10.10.1.1    TCP 83 47964 → 8081 [PSH, ACK] Seq=1242 Ack=1242 Win=64256 Len=17 TSval=1597769383 TSecr=3722029081
1712099635.043401957   659 1.290500167    10.10.1.1 → 10.10.1.2    TCP 83 8081 → 47964 [PSH, ACK] Seq=1242 Ack=1259 Win=65152 Len=17 TSval=3722029091 TSecr=1597769383
1712099641.043401957   665 1.300718360    10.10.1.2 → 10.10.1.1    TCP 83 47964 → 8081 [PSH, ACK] Seq=1259 Ack=1259 Win=64256 Len=17 TSval=1597769393 TSecr=3722029091
1712099643.043401957   667 1.300849272    10.10.1.1 → 10.10.1.2    TCP 83 8081 → 47964 [PSH, ACK] Seq=1259 Ack=1276 Win=65152 Len=17 TSval=3722029101 TSecr=1597769393
1712099649.043401957   673 1.311064925    10.10.1.2 → 10.10.1.1    TCP 83 47964 → 8081 [PSH, ACK] Seq=1276 Ack=1276 Win=64256 Len=17 TSval=1597769403 TSecr=3722029101
1712099652.043401957   676 1.311195153    10.10.1.1 → 10.10.1.2    TCP 83 8081 → 47964 [PSH, ACK] Seq=1276 Ack=1293 Win=65152 Len=17 TSval=3722029112 TSecr=1597769403
1712099658.043401957   682 1.321410354    10.10.1.2 → 10.10.1.1    TCP 83 47964 → 8081 [PSH, ACK] Seq=1293 Ack=1293 Win=64256 Len=17 TSval=1597769414 TSecr=3722029112
1712099660.043401957   684 1.321540106    10.10.1.1 → 10.10.1.2    TCP 83 8081 → 47964 [PSH, ACK] Seq=1293 Ack=1310 Win=65152 Len=17 TSval=3722029122 TSecr=1597769414
1712099666.043401957   690 1.331757751    10.10.1.2 → 10.10.1.1    TCP 83 47964 → 8081 [PSH, ACK] Seq=1310 Ack=1310 Win=64256 Len=17 TSval=1597769424 TSecr=3722029122
1712099669.043401957   693 1.331887832    10.10.1.1 → 10.10.1.2    TCP 83 8081 → 47964 [PSH, ACK] Seq=1310 Ack=1327 Win=65152 Len=17 TSval=3722029133 TSecr=1597769424
1712099675.043401957   699 1.342105153    10.10.1.2 → 10.10.1.1    TCP 83 47964 → 8081 [PSH, ACK] Seq=1327 Ack=1327 Win=64256 Len=17 TSval=1597769434 TSecr=3722029133
1712099677.043401957   701 1.342235287    10.10.1.1 → 10.10.1.2    TCP 83 8081 → 47964 [PSH, ACK] Seq=1327 Ack=1344 Win=65152 Len=17 TSval=3722029143 TSecr=1597769434
1712099683.043401957   707 1.352451383    10.10.1.2 → 10.10.1.1    TCP 83 47964 → 8081 [PSH, ACK] Seq=1344 Ack=1344 Win=64256 Len=17 TSval=1597769445 TSecr=3722029143
1712099686.043401957   710 1.352581420    10.10.1.1 → 10.10.1.2    TCP 83 8081 → 47964 [PSH, ACK] Seq=1344 Ack=1361 Win=65152 Len=17 TSval=3722029153 TSecr=1597769445
1712099692.043401957   716 1.362800829    10.10.1.2 → 10.10.1.1    TCP 83 47964 → 8081 [PSH, ACK] Seq=1361 Ack=1361 Win=64256 Len=17 TSval=1597769455 TSecr=3722029153
1712099694.043401957   718 1.362931191    10.10.1.1 → 10.10.1.2    TCP 83 8081 → 47964 [PSH, ACK] Seq=1361 Ack=1378 Win=65152 Len=17 TSval=3722029164 TSecr=1597769455
1712099700.043401957   724 1.373149313    10.10.1.2 → 10.10.1.1    TCP 83 47964 → 8081 [PSH, ACK] Seq=1378 Ack=1378 Win=64256 Len=17 TSval=1597769465 TSecr=3722029164
1712099703.043401957   727 1.373279777    10.10.1.1 → 10.10.1.2    TCP 83 8081 → 47964 [PSH, ACK] Seq=1378 Ack=1395 Win=65152 Len=17 TSval=3722029174 TSecr=1597769465
1712099709.043401957   733 1.383495099    10.10.1.2 → 10.10.1.1    TCP 83 47964 → 8081 [PSH, ACK] Seq=1395 Ack=1395 Win=64256 Len=17 TSval=1597769476 TSecr=3722029174
1712099711.043401957   735 1.383625811    10.10.1.1 → 10.10.1.2    TCP 83 8081 → 47964 [PSH, ACK] Seq=1395 Ack=1412 Win=65152 Len=17 TSval=3722029184 TSecr=1597769476
1712099717.043401957   741 1.393843572    10.10.1.2 → 10.10.1.1    TCP 83 47964 → 8081 [PSH, ACK] Seq=1412 Ack=1412 Win=64256 Len=17 TSval=1597769486 TSecr=3722029184
1712099720.043401957   744 1.393973690    10.10.1.1 → 10.10.1.2    TCP 83 8081 → 47964 [PSH, ACK] Seq=1412 Ack=1429 Win=65152 Len=17 TSval=3722029195 TSecr=1597769486
1712099726.043401957   750 1.404187879    10.10.1.2 → 10.10.1.1    TCP 83 47964 → 8081 [PSH, ACK] Seq=1429 Ack=1429 Win=64256 Len=17 TSval=1597769496 TSecr=3722029195
1712099728.043401957   752 1.404318229    10.10.1.1 → 10.10.1.2    TCP 83 8081 → 47964 [PSH, ACK] Seq=1429 Ack=1446 Win=65152 Len=17 TSval=3722029205 TSecr=1597769496
1712099735.043401957   759 1.414535176    10.10.1.2 → 10.10.1.1    TCP 83 47964 → 8081 [PSH, ACK] Seq=1446 Ack=1446 Win=64256 Len=17 TSval=1597769507 TSecr=3722029205
1712099738.043401957   762 1.414667578    10.10.1.1 → 10.10.1.2    TCP 83 8081 → 47964 [PSH, ACK] Seq=1446 Ack=1463 Win=65152 Len=17 TSval=3722029215 TSecr=1597769507
1712099744.043401957   768 1.424885674    10.10.1.2 → 10.10.1.1    TCP 83 47964 → 8081 [PSH, ACK] Seq=1463 Ack=1463 Win=64256 Len=17 TSval=1597769517 TSecr=3722029215
1712099746.043401957   770 1.425015672    10.10.1.1 → 10.10.1.2    TCP 83 8081 → 47964 [PSH, ACK] Seq=1463 Ack=1480 Win=65152 Len=17 TSval=3722029226 TSecr=1597769517
1712099752.043401957   776 1.435232890    10.10.1.2 → 10.10.1.1    TCP 83 47964 → 8081 [PSH, ACK] Seq=1480 Ack=1480 Win=64256 Len=17 TSval=1597769527 TSecr=3722029226
1712099755.043401957   779 1.435363848    10.10.1.1 → 10.10.1.2    TCP 83 8081 → 47964 [PSH, ACK] Seq=1480 Ack=1497 Win=65152 Len=17 TSval=3722029236 TSecr=1597769527
1712099761.043401957   785 1.445582496    10.10.1.2 → 10.10.1.1    TCP 83 47964 → 8081 [PSH, ACK] Seq=1497 Ack=1497 Win=64256 Len=17 TSval=1597769538 TSecr=3722029236
1712099763.043401957   787 1.445714173    10.10.1.1 → 10.10.1.2    TCP 83 8081 → 47964 [PSH, ACK] Seq=1497 Ack=1514 Win=65152 Len=17 TSval=3722029246 TSecr=1597769538
1712099769.043401957   793 1.455929432    10.10.1.2 → 10.10.1.1    TCP 83 47964 → 8081 [PSH, ACK] Seq=1514 Ack=1514 Win=64256 Len=17 TSval=1597769548 TSecr=3722029246
1712099772.043401957   796 1.456058902    10.10.1.1 → 10.10.1.2    TCP 83 8081 → 47964 [PSH, ACK] Seq=1514 Ack=1531 Win=65152 Len=17 TSval=3722029257 TSecr=1597769548
1712099778.043401957   802 1.466280281    10.10.1.2 → 10.10.1.1    TCP 83 47964 → 8081 [PSH, ACK] Seq=1531 Ack=1531 Win=64256 Len=17 TSval=1597769559 TSecr=3722029257
1712099780.043401957   804 1.466410858    10.10.1.1 → 10.10.1.2    TCP 83 8081 → 47964 [PSH, ACK] Seq=1531 Ack=1548 Win=65152 Len=17 TSval=3722029267 TSecr=1597769559
1712099786.043401957   810 1.476626974    10.10.1.2 → 10.10.1.1    TCP 83 47964 → 8081 [PSH, ACK] Seq=1548 Ack=1548 Win=64256 Len=17 TSval=1597769569 TSecr=3722029267
1712099789.043401957   813 1.476757902    10.10.1.1 → 10.10.1.2    TCP 83 8081 → 47964 [PSH, ACK] Seq=1548 Ack=1565 Win=65152 Len=17 TSval=3722029277 TSecr=1597769569
1712099795.043401957   819 1.486974905    10.10.1.2 → 10.10.1.1    TCP 83 47964 → 8081 [PSH, ACK] Seq=1565 Ack=1565 Win=64256 Len=17 TSval=1597769579 TSecr=3722029277
1712099797.043401957   821 1.487105407    10.10.1.1 → 10.10.1.2    TCP 83 8081 → 47964 [PSH, ACK] Seq=1565 Ack=1582 Win=65152 Len=17 TSval=3722029288 TSecr=1597769579
1712099803.043401957   827 1.497323328    10.10.1.2 → 10.10.1.1    TCP 83 47964 → 8081 [PSH, ACK] Seq=1582 Ack=1582 Win=64256 Len=17 TSval=1597769590 TSecr=3722029288
1712099806.043401957   830 1.497453281    10.10.1.1 → 10.10.1.2    TCP 83 8081 → 47964 [PSH, ACK] Seq=1582 Ack=1599 Win=65152 Len=17 TSval=3722029298 TSecr=1597769590
1712099812.043401957   836 1.507669464    10.10.1.2 → 10.10.1.1    TCP 83 47964 → 8081 [PSH, ACK] Seq=1599 Ack=1599 Win=64256 Len=17 TSval=1597769600 TSecr=3722029298
1712099814.043401957   838 1.507800651    10.10.1.1 → 10.10.1.2    TCP 83 8081 → 47964 [PSH, ACK] Seq=1599 Ack=1616 Win=65152 Len=17 TSval=3722029308 TSecr=1597769600
1712099820.043401957   844 1.518016968    10.10.1.2 → 10.10.1.1    TCP 83 47964 → 8081 [PSH, ACK] Seq=1616 Ack=1616 Win=64256 Len=17 TSval=1597769610 TSecr=3722029308
1712099823.043401957   847 1.518146387    10.10.1.1 → 10.10.1.2    TCP 83 8081 → 47964 [PSH, ACK] Seq=1616 Ack=1633 Win=65152 Len=17 TSval=3722029319 TSecr=1597769610
1712099829.043401957   853 1.528365800    10.10.1.2 → 10.10.1.1    TCP 83 47964 → 8081 [PSH, ACK] Seq=1633 Ack=1633 Win=64256 Len=17 TSval=1597769621 TSecr=3722029319
1712099831.043401957   855 1.528496486    10.10.1.1 → 10.10.1.2    TCP 83 8081 → 47964 [PSH, ACK] Seq=1633 Ack=1650 Win=65152 Len=17 TSval=3722029329 TSecr=1597769621
1712099837.043401957   861 1.538711880    10.10.1.2 → 10.10.1.1    TCP 83 47964 → 8081 [PSH, ACK] Seq=1650 Ack=1650 Win=64256 Len=17 TSval=1597769631 TSecr=3722029329
1712099840.043401957   864 1.538854020    10.10.1.1 → 10.10.1.2    TCP 83 8081 → 47964 [PSH, ACK] Seq=1650 Ack=1667 Win=65152 Len=17 TSval=3722029339 TSecr=1597769631
1712099846.043401957   870 1.549071835    10.10.1.2 → 10.10.1.1    TCP 83 47964 → 8081 [PSH, ACK] Seq=1667 Ack=1667 Win=64256 Len=17 TSval=1597769641 TSecr=3722029339
1712099848.043401957   872 1.549205155    10.10.1.1 → 10.10.1.2    TCP 83 8081 → 47964 [PSH, ACK] Seq=1667 Ack=1684 Win=65152 Len=17 TSval=3722029350 TSecr=1597769641
1712099854.043401957   878 1.559421753    10.10.1.2 → 10.10.1.1    TCP 83 47964 → 8081 [PSH, ACK] Seq=1684 Ack=1684 Win=64256 Len=17 TSval=1597769652 TSecr=3722029350
1712099857.043401957   881 1.559552195    10.10.1.1 → 10.10.1.2    TCP 83 8081 → 47964 [PSH, ACK] Seq=1684 Ack=1701 Win=65152 Len=17 TSval=3722029360 TSecr=1597769652
1712099863.043401957   887 1.569769648    10.10.1.2 → 10.10.1.1    TCP 83 47964 → 8081 [PSH, ACK] Seq=1701 Ack=1701 Win=64256 Len=17 TSval=1597769662 TSecr=3722029360
1712099865.043401957   889 1.569899645    10.10.1.1 → 10.10.1.2    TCP 83 8081 → 47964 [PSH, ACK] Seq=1701 Ack=1718 Win=65152 Len=17 TSval=3722029371 TSecr=1597769662
1712099871.043401957   895 1.580117526    10.10.1.2 → 10.10.1.1    TCP 83 47964 → 8081 [PSH, ACK] Seq=1718 Ack=1718 Win=64256 Len=17 TSval=1597769672 TSecr=3722029371
1712099874.043401957   898 1.580247274    10.10.1.1 → 10.10.1.2    TCP 83 8081 → 47964 [PSH, ACK] Seq=1718 Ack=1735 Win=65152 Len=17 TSval=3722029381 TSecr=1597769672
1712099880.043401957   904 1.590464786    10.10.1.2 → 10.10.1.1    TCP 83 47964 → 8081 [PSH, ACK] Seq=1735 Ack=1735 Win=64256 Len=17 TSval=1597769683 TSecr=3722029381
1712099882.043401957   906 1.590595685    10.10.1.1 → 10.10.1.2    TCP 83 8081 → 47964 [PSH, ACK] Seq=1735 Ack=1752 Win=65152 Len=17 TSval=3722029391 TSecr=1597769683
1712099888.043401957   912 1.600811499    10.10.1.2 → 10.10.1.1    TCP 83 47964 → 8081 [PSH, ACK] Seq=1752 Ack=1752 Win=64256 Len=17 TSval=1597769693 TSecr=3722029391
1712099891.043401957   915 1.600942289    10.10.1.1 → 10.10.1.2    TCP 83 8081 → 47964 [PSH, ACK] Seq=1752 Ack=1769 Win=65152 Len=17 TSval=3722029402 TSecr=1597769693
1712099897.043401957   921 1.611156952    10.10.1.2 → 10.10.1.1    TCP 83 47964 → 8081 [PSH, ACK] Seq=1769 Ack=1769 Win=64256 Len=17 TSval=1597769703 TSecr=3722029402
1712099899.043401957   923 1.611287771    10.10.1.1 → 10.10.1.2    TCP 83 8081 → 47964 [PSH, ACK] Seq=1769 Ack=1786 Win=65152 Len=17 TSval=3722029412 TSecr=1597769703
1712099905.043401957   929 1.621503596    10.10.1.2 → 10.10.1.1    TCP 83 47964 → 8081 [PSH, ACK] Seq=1786 Ack=1786 Win=64256 Len=17 TSval=1597769714 TSecr=3722029412
1712099908.043401957   932 1.621633784    10.10.1.1 → 10.10.1.2    TCP 83 8081 → 47964 [PSH, ACK] Seq=1786 Ack=1803 Win=65152 Len=17 TSval=3722029422 TSecr=1597769714
1712099914.043401957   938 1.631848078    10.10.1.2 → 10.10.1.1    TCP 83 47964 → 8081 [PSH, ACK] Seq=1803 Ack=1803 Win=64256 Len=17 TSval=1597769724 TSecr=3722029422
1712099916.043401957   940 1.631978827    10.10.1.1 → 10.10.1.2    TCP 83 8081 → 47964 [PSH, ACK] Seq=1803 Ack=1820 Win=65152 Len=17 TSval=3722029433 TSecr=1597769724
1712099922.043401957   946 1.642193998    10.10.1.2 → 10.10.1.1    TCP 83 47964 → 8081 [PSH, ACK] Seq=1820 Ack=1820 Win=64256 Len=17 TSval=1597769734 TSecr=3722029433
1712099925.043401957   949 1.642325108    10.10.1.1 → 10.10.1.2    TCP 83 8081 → 47964 [PSH, ACK] Seq=1820 Ack=1837 Win=65152 Len=17 TSval=3722029443 TSecr=1597769734
1712099931.043401957   955 1.652539416    10.10.1.2 → 10.10.1.1    TCP 83 47964 → 8081 [PSH, ACK] Seq=1837 Ack=1837 Win=64256 Len=17 TSval=1597769745 TSecr=3722029443
1712099933.043401957   957 1.652670347    10.10.1.1 → 10.10.1.2    TCP 83 8081 → 47964 [PSH, ACK] Seq=1837 Ack=1854 Win=65152 Len=17 TSval=3722029453 TSecr=1597769745
1712099939.043401957   963 1.662888197    10.10.1.2 → 10.10.1.1    TCP 83 47964 → 8081 [PSH, ACK] Seq=1854 Ack=1854 Win=64256 Len=17 TSval=1597769755 TSecr=3722029453
1712099942.043401957   966 1.663017806    10.10.1.1 → 10.10.1.2    TCP 83 8081 → 47964 [PSH, ACK] Seq=1854 Ack=1871 Win=65152 Len=17 TSval=3722029464 TSecr=1597769755
1712099948.043401957   972 1.673217160    10.10.1.2 → 10.10.1.1    TCP 83 47964 → 8081 [PSH, ACK] Seq=1871 Ack=1871 Win=64256 Len=17 TSval=1597769765 TSecr=3722029464
1712099950.043401957   974 1.673347726    10.10.1.1 → 10.10.1.2    TCP 83 8081 → 47964 [PSH, ACK] Seq=1871 Ack=1888 Win=65152 Len=17 TSval=3722029474 TSecr=1597769765
1712099956.043401957   980 1.683562776    10.10.1.2 → 10.10.1.1    TCP 83 47964 → 8081 [PSH, ACK] Seq=1888 Ack=1888 Win=64256 Len=17 TSval=1597769776 TSecr=3722029474
1712099959.043401957   983 1.683694708    10.10.1.1 → 10.10.1.2    TCP 83 8081 → 47964 [PSH, ACK] Seq=1888 Ack=1905 Win=65152 Len=17 TSval=3722029484 TSecr=1597769776
1712099965.043401957   989 1.693910227    10.10.1.2 → 10.10.1.1    TCP 83 47964 → 8081 [PSH, ACK] Seq=1905 Ack=1905 Win=64256 Len=17 TSval=1597769786 TSecr=3722029484
1712099967.043401957   991 1.694039002    10.10.1.1 → 10.10.1.2    TCP 83 8081 → 47964 [PSH, ACK] Seq=1905 Ack=1922 Win=65152 Len=17 TSval=3722029495 TSecr=1597769786
1712099973.043401957   997 1.704255336    10.10.1.2 → 10.10.1.1    TCP 83 47964 → 8081 [PSH, ACK] Seq=1922 Ack=1922 Win=64256 Len=17 TSval=1597769797 TSecr=3722029495
1712099976.043401957  1000 1.704437866    10.10.1.1 → 10.10.1.2    TCP 83 8081 → 47964 [PSH, ACK] Seq=1922 Ack=1939 Win=65152 Len=17 TSval=3722029505 TSecr=1597769797
1712099982.043401957  1006 1.714652816    10.10.1.2 → 10.10.1.1    TCP 83 47964 → 8081 [PSH, ACK] Seq=1939 Ack=1939 Win=64256 Len=17 TSval=1597769807 TSecr=3722029505
1712099984.043401957  1008 1.714780966    10.10.1.1 → 10.10.1.2    TCP 83 8081 → 47964 [PSH, ACK] Seq=1939 Ack=1956 Win=65152 Len=17 TSval=3722029515 TSecr=1597769807
1712099990.043401957  1014 1.724996336    10.10.1.2 → 10.10.1.1    TCP 83 47964 → 8081 [PSH, ACK] Seq=1956 Ack=1956 Win=64256 Len=17 TSval=1597769817 TSecr=3722029515
1712099993.043401957  1017 1.725125328    10.10.1.1 → 10.10.1.2    TCP 83 8081 → 47964 [PSH, ACK] Seq=1956 Ack=1973 Win=65152 Len=17 TSval=3722029526 TSecr=1597769817
1712099999.043401957  1023 1.735340520    10.10.1.2 → 10.10.1.1    TCP 83 47964 → 8081 [PSH, ACK] Seq=1973 Ack=1973 Win=64256 Len=17 TSval=1597769828 TSecr=3722029526
1712100001.043401957  1025 1.735469935    10.10.1.1 → 10.10.1.2    TCP 83 8081 → 47964 [PSH, ACK] Seq=1973 Ack=1990 Win=65152 Len=17 TSval=3722029536 TSecr=1597769828
1712100007.043401957  1031 1.745685353    10.10.1.2 → 10.10.1.1    TCP 83 47964 → 8081 [PSH, ACK] Seq=1990 Ack=1990 Win=64256 Len=17 TSval=1597769838 TSecr=3722029536
1712100010.043401957  1034 1.745816381    10.10.1.1 → 10.10.1.2    TCP 83 8081 → 47964 [PSH, ACK] Seq=1990 Ack=2007 Win=65152 Len=17 TSval=3722029546 TSecr=1597769838
