1711548732.627875566    35 0.531193156    10.10.1.2 → 10.10.1.1    TCP 83 47406 → 8081 [PSH, ACK] Seq=1 Ack=1 Win=64256 Len=17 TSval=1047490208 TSecr=3171749666
1711548736.627875566    39 0.531502546    10.10.1.1 → 10.10.1.2    TCP 83 8081 → 47406 [PSH, ACK] Seq=1 Ack=18 Win=65152 Len=17 TSval=3171749920 TSecr=1047490208
1711548744.627875566    47 0.532721079    10.10.1.2 → 10.10.1.1    TCP 83 47406 → 8081 [PSH, ACK] Seq=18 Ack=18 Win=64256 Len=17 TSval=1047490210 TSecr=3171749920
1711548747.627875566    50 0.532845365    10.10.1.1 → 10.10.1.2    TCP 83 8081 → 47406 [PSH, ACK] Seq=18 Ack=35 Win=65152 Len=17 TSval=3171749921 TSecr=1047490210
1711548754.627875566    57 0.534071326    10.10.1.2 → 10.10.1.1    TCP 83 47406 → 8081 [PSH, ACK] Seq=35 Ack=35 Win=64256 Len=17 TSval=1047490211 TSecr=3171749921
1711548757.627875566    60 0.534201128    10.10.1.1 → 10.10.1.2    TCP 83 8081 → 47406 [PSH, ACK] Seq=35 Ack=52 Win=65152 Len=17 TSval=3171749922 TSecr=1047490211
1711548764.627875566    67 0.535413858    10.10.1.2 → 10.10.1.1    TCP 83 47406 → 8081 [PSH, ACK] Seq=52 Ack=52 Win=64256 Len=17 TSval=1047490213 TSecr=3171749922
1711548767.627875566    70 0.535538013    10.10.1.1 → 10.10.1.2    TCP 83 8081 → 47406 [PSH, ACK] Seq=52 Ack=69 Win=65152 Len=17 TSval=3171749924 TSecr=1047490213
1711548775.627875566    78 0.536756417    10.10.1.2 → 10.10.1.1    TCP 83 47406 → 8081 [PSH, ACK] Seq=69 Ack=69 Win=64256 Len=17 TSval=1047490214 TSecr=3171749924
1711548777.627875566    80 0.536889490    10.10.1.1 → 10.10.1.2    TCP 83 8081 → 47406 [PSH, ACK] Seq=69 Ack=86 Win=65152 Len=17 TSval=3171749925 TSecr=1047490214
1711548784.627875566    87 0.538105714    10.10.1.2 → 10.10.1.1    TCP 83 47406 → 8081 [PSH, ACK] Seq=86 Ack=86 Win=64256 Len=17 TSval=1047490215 TSecr=3171749925
1711548787.627875566    90 0.538238025    10.10.1.1 → 10.10.1.2    TCP 83 8081 → 47406 [PSH, ACK] Seq=86 Ack=103 Win=65152 Len=17 TSval=3171749926 TSecr=1047490215
1711548794.627875566    97 0.539456362    10.10.1.2 → 10.10.1.1    TCP 83 47406 → 8081 [PSH, ACK] Seq=103 Ack=103 Win=64256 Len=17 TSval=1047490217 TSecr=3171749926
1711548797.627875566   100 0.539582535    10.10.1.1 → 10.10.1.2    TCP 83 8081 → 47406 [PSH, ACK] Seq=103 Ack=120 Win=65152 Len=17 TSval=3171749928 TSecr=1047490217
1711548805.627875566   108 0.540799827    10.10.1.2 → 10.10.1.1    TCP 83 47406 → 8081 [PSH, ACK] Seq=120 Ack=120 Win=64256 Len=17 TSval=1047490218 TSecr=3171749928
1711548807.627875566   110 0.540926223    10.10.1.1 → 10.10.1.2    TCP 83 8081 → 47406 [PSH, ACK] Seq=120 Ack=137 Win=65152 Len=17 TSval=3171749929 TSecr=1047490218
1711548815.627875566   118 0.542140268    10.10.1.2 → 10.10.1.1    TCP 83 47406 → 8081 [PSH, ACK] Seq=137 Ack=137 Win=64256 Len=17 TSval=1047490219 TSecr=3171749929
1711548817.627875566   120 0.542272303    10.10.1.1 → 10.10.1.2    TCP 83 8081 → 47406 [PSH, ACK] Seq=137 Ack=154 Win=65152 Len=17 TSval=3171749930 TSecr=1047490219
1711548824.627875566   127 0.543490156    10.10.1.2 → 10.10.1.1    TCP 83 47406 → 8081 [PSH, ACK] Seq=154 Ack=154 Win=64256 Len=17 TSval=1047490221 TSecr=3171749930
1711548826.627875566   129 0.543615792    10.10.1.1 → 10.10.1.2    TCP 83 8081 → 47406 [PSH, ACK] Seq=154 Ack=171 Win=65152 Len=17 TSval=3171749932 TSecr=1047490221
1711548834.627875566   137 0.544829695    10.10.1.2 → 10.10.1.1    TCP 83 47406 → 8081 [PSH, ACK] Seq=171 Ack=171 Win=64256 Len=17 TSval=1047490222 TSecr=3171749932
1711548836.627875566   139 0.544954126    10.10.1.1 → 10.10.1.2    TCP 83 8081 → 47406 [PSH, ACK] Seq=171 Ack=188 Win=65152 Len=17 TSval=3171749933 TSecr=1047490222
1711548844.627875566   147 0.546166821    10.10.1.2 → 10.10.1.1    TCP 83 47406 → 8081 [PSH, ACK] Seq=188 Ack=188 Win=64256 Len=17 TSval=1047490223 TSecr=3171749933
1711548846.627875566   149 0.546297167    10.10.1.1 → 10.10.1.2    TCP 83 8081 → 47406 [PSH, ACK] Seq=188 Ack=205 Win=65152 Len=17 TSval=3171749934 TSecr=1047490223
1711548854.627875566   157 0.547513414    10.10.1.2 → 10.10.1.1    TCP 83 47406 → 8081 [PSH, ACK] Seq=205 Ack=205 Win=64256 Len=17 TSval=1047490225 TSecr=3171749934
1711548856.627875566   159 0.547639366    10.10.1.1 → 10.10.1.2    TCP 83 8081 → 47406 [PSH, ACK] Seq=205 Ack=222 Win=65152 Len=17 TSval=3171749936 TSecr=1047490225
1711548864.627875566   167 0.548851268    10.10.1.2 → 10.10.1.1    TCP 83 47406 → 8081 [PSH, ACK] Seq=222 Ack=222 Win=64256 Len=17 TSval=1047490226 TSecr=3171749936
1711548866.627875566   169 0.548976330    10.10.1.1 → 10.10.1.2    TCP 83 8081 → 47406 [PSH, ACK] Seq=222 Ack=239 Win=65152 Len=17 TSval=3171749937 TSecr=1047490226
1711548874.627875566   177 0.550188391    10.10.1.2 → 10.10.1.1    TCP 83 47406 → 8081 [PSH, ACK] Seq=239 Ack=239 Win=64256 Len=17 TSval=1047490227 TSecr=3171749937
1711548876.627875566   179 0.550317956    10.10.1.1 → 10.10.1.2    TCP 83 8081 → 47406 [PSH, ACK] Seq=239 Ack=256 Win=65152 Len=17 TSval=3171749938 TSecr=1047490227
1711548884.627875566   187 0.551534391    10.10.1.2 → 10.10.1.1    TCP 83 47406 → 8081 [PSH, ACK] Seq=256 Ack=256 Win=64256 Len=17 TSval=1047490229 TSecr=3171749938
1711548886.627875566   189 0.551658478    10.10.1.1 → 10.10.1.2    TCP 83 8081 → 47406 [PSH, ACK] Seq=256 Ack=273 Win=65152 Len=17 TSval=3171749940 TSecr=1047490229
1711548894.627875566   197 0.552869865    10.10.1.2 → 10.10.1.1    TCP 83 47406 → 8081 [PSH, ACK] Seq=273 Ack=273 Win=64256 Len=17 TSval=1047490230 TSecr=3171749940
1711548896.627875566   199 0.552995278    10.10.1.1 → 10.10.1.2    TCP 83 8081 → 47406 [PSH, ACK] Seq=273 Ack=290 Win=65152 Len=17 TSval=3171749941 TSecr=1047490230
1711548904.627875566   207 0.554207217    10.10.1.2 → 10.10.1.1    TCP 83 47406 → 8081 [PSH, ACK] Seq=290 Ack=290 Win=64256 Len=17 TSval=1047490231 TSecr=3171749941
1711548906.627875566   209 0.554337231    10.10.1.1 → 10.10.1.2    TCP 83 8081 → 47406 [PSH, ACK] Seq=290 Ack=307 Win=65152 Len=17 TSval=3171749942 TSecr=1047490231
1711548914.627875566   217 0.555551876    10.10.1.2 → 10.10.1.1    TCP 83 47406 → 8081 [PSH, ACK] Seq=307 Ack=307 Win=64256 Len=17 TSval=1047490233 TSecr=3171749942
1711548916.627875566   219 0.555673255    10.10.1.1 → 10.10.1.2    TCP 83 8081 → 47406 [PSH, ACK] Seq=307 Ack=324 Win=65152 Len=17 TSval=3171749944 TSecr=1047490233
1711548924.627875566   227 0.556884560    10.10.1.2 → 10.10.1.1    TCP 83 47406 → 8081 [PSH, ACK] Seq=324 Ack=324 Win=64256 Len=17 TSval=1047490234 TSecr=3171749944
1711548926.627875566   229 0.557005851    10.10.1.1 → 10.10.1.2    TCP 83 8081 → 47406 [PSH, ACK] Seq=324 Ack=341 Win=65152 Len=17 TSval=3171749945 TSecr=1047490234
1711548934.627875566   237 0.558217045    10.10.1.2 → 10.10.1.1    TCP 83 47406 → 8081 [PSH, ACK] Seq=341 Ack=341 Win=64256 Len=17 TSval=1047490235 TSecr=3171749945
1711548936.627875566   239 0.558346070    10.10.1.1 → 10.10.1.2    TCP 83 8081 → 47406 [PSH, ACK] Seq=341 Ack=358 Win=65152 Len=17 TSval=3171749946 TSecr=1047490235
1711548944.627875566   247 0.559562733    10.10.1.2 → 10.10.1.1    TCP 83 47406 → 8081 [PSH, ACK] Seq=358 Ack=358 Win=64256 Len=17 TSval=1047490237 TSecr=3171749946
1711548946.627875566   249 0.559687842    10.10.1.1 → 10.10.1.2    TCP 83 8081 → 47406 [PSH, ACK] Seq=358 Ack=375 Win=65152 Len=17 TSval=3171749948 TSecr=1047490237
1711548955.627875566   258 0.560898626    10.10.1.2 → 10.10.1.1    TCP 83 47406 → 8081 [PSH, ACK] Seq=375 Ack=375 Win=64256 Len=17 TSval=1047490238 TSecr=3171749948
1711548957.627875566   260 0.561023359    10.10.1.1 → 10.10.1.2    TCP 83 8081 → 47406 [PSH, ACK] Seq=375 Ack=392 Win=65152 Len=17 TSval=3171749949 TSecr=1047490238
1711548964.627875566   267 0.562234525    10.10.1.2 → 10.10.1.1    TCP 83 47406 → 8081 [PSH, ACK] Seq=392 Ack=392 Win=64256 Len=17 TSval=1047490239 TSecr=3171749949
1711548966.627875566   269 0.562364047    10.10.1.1 → 10.10.1.2    TCP 83 8081 → 47406 [PSH, ACK] Seq=392 Ack=409 Win=65152 Len=17 TSval=3171749950 TSecr=1047490239
1711548974.627875566   277 0.563579664    10.10.1.2 → 10.10.1.1    TCP 83 47406 → 8081 [PSH, ACK] Seq=409 Ack=409 Win=64256 Len=17 TSval=1047490241 TSecr=3171749950
1711548976.627875566   279 0.563705563    10.10.1.1 → 10.10.1.2    TCP 83 8081 → 47406 [PSH, ACK] Seq=409 Ack=426 Win=65152 Len=17 TSval=3171749952 TSecr=1047490241
1711548984.627875566   287 0.564916096    10.10.1.2 → 10.10.1.1    TCP 83 47406 → 8081 [PSH, ACK] Seq=426 Ack=426 Win=64256 Len=17 TSval=1047490242 TSecr=3171749952
1711548986.627875566   289 0.565040916    10.10.1.1 → 10.10.1.2    TCP 83 8081 → 47406 [PSH, ACK] Seq=426 Ack=443 Win=65152 Len=17 TSval=3171749953 TSecr=1047490242
1711548994.627875566   297 0.566252146    10.10.1.2 → 10.10.1.1    TCP 83 47406 → 8081 [PSH, ACK] Seq=443 Ack=443 Win=64256 Len=17 TSval=1047490243 TSecr=3171749953
1711548996.627875566   299 0.566381562    10.10.1.1 → 10.10.1.2    TCP 83 8081 → 47406 [PSH, ACK] Seq=443 Ack=460 Win=65152 Len=17 TSval=3171749954 TSecr=1047490243
1711549004.627875566   307 0.567597634    10.10.1.2 → 10.10.1.1    TCP 83 47406 → 8081 [PSH, ACK] Seq=460 Ack=460 Win=64256 Len=17 TSval=1047490245 TSecr=3171749954
1711549006.627875566   309 0.567722369    10.10.1.1 → 10.10.1.2    TCP 83 8081 → 47406 [PSH, ACK] Seq=460 Ack=477 Win=65152 Len=17 TSval=3171749956 TSecr=1047490245
1711549014.627875566   317 0.568933568    10.10.1.2 → 10.10.1.1    TCP 83 47406 → 8081 [PSH, ACK] Seq=477 Ack=477 Win=64256 Len=17 TSval=1047490246 TSecr=3171749956
1711549016.627875566   319 0.569059462    10.10.1.1 → 10.10.1.2    TCP 83 8081 → 47406 [PSH, ACK] Seq=477 Ack=494 Win=65152 Len=17 TSval=3171749957 TSecr=1047490246
1711549024.627875566   327 0.570270919    10.10.1.2 → 10.10.1.1    TCP 83 47406 → 8081 [PSH, ACK] Seq=494 Ack=494 Win=64256 Len=17 TSval=1047490247 TSecr=3171749957
1711549026.627875566   329 0.570400474    10.10.1.1 → 10.10.1.2    TCP 83 8081 → 47406 [PSH, ACK] Seq=494 Ack=511 Win=65152 Len=17 TSval=3171749958 TSecr=1047490247
1711549034.627875566   337 0.571616205    10.10.1.2 → 10.10.1.1    TCP 83 47406 → 8081 [PSH, ACK] Seq=511 Ack=511 Win=64256 Len=17 TSval=1047490249 TSecr=3171749958
1711549036.627875566   339 0.571736780    10.10.1.1 → 10.10.1.2    TCP 83 8081 → 47406 [PSH, ACK] Seq=511 Ack=528 Win=65152 Len=17 TSval=3171749960 TSecr=1047490249
1711549044.627875566   347 0.572948370    10.10.1.2 → 10.10.1.1    TCP 83 47406 → 8081 [PSH, ACK] Seq=528 Ack=528 Win=64256 Len=17 TSval=1047490250 TSecr=3171749960
1711549046.627875566   349 0.573069210    10.10.1.1 → 10.10.1.2    TCP 83 8081 → 47406 [PSH, ACK] Seq=528 Ack=545 Win=65152 Len=17 TSval=3171749961 TSecr=1047490250
1711549054.627875566   357 0.574279394    10.10.1.2 → 10.10.1.1    TCP 83 47406 → 8081 [PSH, ACK] Seq=545 Ack=545 Win=64256 Len=17 TSval=1047490251 TSecr=3171749961
1711549056.627875566   359 0.574409269    10.10.1.1 → 10.10.1.2    TCP 83 8081 → 47406 [PSH, ACK] Seq=545 Ack=562 Win=65152 Len=17 TSval=3171749962 TSecr=1047490251
1711549064.627875566   367 0.575624826    10.10.1.2 → 10.10.1.1    TCP 83 47406 → 8081 [PSH, ACK] Seq=562 Ack=562 Win=64256 Len=17 TSval=1047490253 TSecr=3171749962
1711549066.627875566   369 0.575749770    10.10.1.1 → 10.10.1.2    TCP 83 8081 → 47406 [PSH, ACK] Seq=562 Ack=579 Win=65152 Len=17 TSval=3171749964 TSecr=1047490253
1711549074.627875566   377 0.576959871    10.10.1.2 → 10.10.1.1    TCP 83 47406 → 8081 [PSH, ACK] Seq=579 Ack=579 Win=64256 Len=17 TSval=1047490254 TSecr=3171749964
1711549076.627875566   379 0.577086336    10.10.1.1 → 10.10.1.2    TCP 83 8081 → 47406 [PSH, ACK] Seq=579 Ack=596 Win=65152 Len=17 TSval=3171749965 TSecr=1047490254
1711549084.627875566   387 0.578296810    10.10.1.2 → 10.10.1.1    TCP 83 47406 → 8081 [PSH, ACK] Seq=596 Ack=596 Win=64256 Len=17 TSval=1047490255 TSecr=3171749965
1711549086.627875566   389 0.578426531    10.10.1.1 → 10.10.1.2    TCP 83 8081 → 47406 [PSH, ACK] Seq=596 Ack=613 Win=65152 Len=17 TSval=3171749966 TSecr=1047490255
1711549094.627875566   397 0.579642052    10.10.1.2 → 10.10.1.1    TCP 83 47406 → 8081 [PSH, ACK] Seq=613 Ack=613 Win=64256 Len=17 TSval=1047490257 TSecr=3171749966
1711549096.627875566   399 0.579767311    10.10.1.1 → 10.10.1.2    TCP 83 8081 → 47406 [PSH, ACK] Seq=613 Ack=630 Win=65152 Len=17 TSval=3171749968 TSecr=1047490257
1711549104.627875566   407 0.580978324    10.10.1.2 → 10.10.1.1    TCP 83 47406 → 8081 [PSH, ACK] Seq=630 Ack=630 Win=64256 Len=17 TSval=1047490258 TSecr=3171749968
1711549106.627875566   409 0.581102479    10.10.1.1 → 10.10.1.2    TCP 83 8081 → 47406 [PSH, ACK] Seq=630 Ack=647 Win=65152 Len=17 TSval=3171749969 TSecr=1047490258
1711549114.627875566   417 0.582312881    10.10.1.2 → 10.10.1.1    TCP 83 47406 → 8081 [PSH, ACK] Seq=647 Ack=647 Win=64256 Len=17 TSval=1047490259 TSecr=3171749969
1711549116.627875566   419 0.582443212    10.10.1.1 → 10.10.1.2    TCP 83 8081 → 47406 [PSH, ACK] Seq=647 Ack=664 Win=65152 Len=17 TSval=3171749970 TSecr=1047490259
1711549124.627875566   427 0.583658697    10.10.1.2 → 10.10.1.1    TCP 83 47406 → 8081 [PSH, ACK] Seq=664 Ack=664 Win=64256 Len=17 TSval=1047490261 TSecr=3171749970
1711549126.627875566   429 0.583782758    10.10.1.1 → 10.10.1.2    TCP 83 8081 → 47406 [PSH, ACK] Seq=664 Ack=681 Win=65152 Len=17 TSval=3171749972 TSecr=1047490261
1711549134.627875566   437 0.584993101    10.10.1.2 → 10.10.1.1    TCP 83 47406 → 8081 [PSH, ACK] Seq=681 Ack=681 Win=64256 Len=17 TSval=1047490262 TSecr=3171749972
1711549136.627875566   439 0.585117686    10.10.1.1 → 10.10.1.2    TCP 83 8081 → 47406 [PSH, ACK] Seq=681 Ack=698 Win=65152 Len=17 TSval=3171749973 TSecr=1047490262
1711549144.627875566   447 0.586327404    10.10.1.2 → 10.10.1.1    TCP 83 47406 → 8081 [PSH, ACK] Seq=698 Ack=698 Win=64256 Len=17 TSval=1047490263 TSecr=3171749973
1711549146.627875566   449 0.586458073    10.10.1.1 → 10.10.1.2    TCP 83 8081 → 47406 [PSH, ACK] Seq=698 Ack=715 Win=65152 Len=17 TSval=3171749975 TSecr=1047490263
1711549154.627875566   457 0.587673547    10.10.1.2 → 10.10.1.1    TCP 83 47406 → 8081 [PSH, ACK] Seq=715 Ack=715 Win=64256 Len=17 TSval=1047490265 TSecr=3171749975
1711549156.627875566   459 0.587794693    10.10.1.1 → 10.10.1.2    TCP 83 8081 → 47406 [PSH, ACK] Seq=715 Ack=732 Win=65152 Len=17 TSval=3171749976 TSecr=1047490265
1711549164.627875566   467 0.589004932    10.10.1.2 → 10.10.1.1    TCP 83 47406 → 8081 [PSH, ACK] Seq=732 Ack=732 Win=64256 Len=17 TSval=1047490266 TSecr=3171749976
1711549166.627875566   469 0.589126274    10.10.1.1 → 10.10.1.2    TCP 83 8081 → 47406 [PSH, ACK] Seq=732 Ack=749 Win=65152 Len=17 TSval=3171749977 TSecr=1047490266
1711549175.627875566   478 0.590337084    10.10.1.2 → 10.10.1.1    TCP 83 47406 → 8081 [PSH, ACK] Seq=749 Ack=749 Win=64256 Len=17 TSval=1047490267 TSecr=3171749977
1711549177.627875566   480 0.590468529    10.10.1.1 → 10.10.1.2    TCP 83 8081 → 47406 [PSH, ACK] Seq=749 Ack=766 Win=65152 Len=17 TSval=3171749979 TSecr=1047490267
1711549185.627875566   488 0.591683289    10.10.1.2 → 10.10.1.1    TCP 83 47406 → 8081 [PSH, ACK] Seq=766 Ack=766 Win=64256 Len=17 TSval=1047490269 TSecr=3171749979
1711549187.627875566   490 0.591804277    10.10.1.1 → 10.10.1.2    TCP 83 8081 → 47406 [PSH, ACK] Seq=766 Ack=783 Win=65152 Len=17 TSval=3171749980 TSecr=1047490269
1711549194.627875566   497 0.593015503    10.10.1.2 → 10.10.1.1    TCP 83 47406 → 8081 [PSH, ACK] Seq=783 Ack=783 Win=64256 Len=17 TSval=1047490270 TSecr=3171749980
1711549196.627875566   499 0.593136167    10.10.1.1 → 10.10.1.2    TCP 83 8081 → 47406 [PSH, ACK] Seq=783 Ack=800 Win=65152 Len=17 TSval=3171749981 TSecr=1047490270
1711549204.627875566   507 0.594345888    10.10.1.2 → 10.10.1.1    TCP 83 47406 → 8081 [PSH, ACK] Seq=800 Ack=800 Win=64256 Len=17 TSval=1047490271 TSecr=3171749981
1711549206.627875566   509 0.594476268    10.10.1.1 → 10.10.1.2    TCP 83 8081 → 47406 [PSH, ACK] Seq=800 Ack=817 Win=65152 Len=17 TSval=3171749983 TSecr=1047490271
1711549214.627875566   517 0.595691653    10.10.1.2 → 10.10.1.1    TCP 83 47406 → 8081 [PSH, ACK] Seq=817 Ack=817 Win=64256 Len=17 TSval=1047490273 TSecr=3171749983
1711549216.627875566   519 0.595815967    10.10.1.1 → 10.10.1.2    TCP 83 8081 → 47406 [PSH, ACK] Seq=817 Ack=834 Win=65152 Len=17 TSval=3171749984 TSecr=1047490273
1711549224.627875566   527 0.597025771    10.10.1.2 → 10.10.1.1    TCP 83 47406 → 8081 [PSH, ACK] Seq=834 Ack=834 Win=64256 Len=17 TSval=1047490274 TSecr=3171749984
1711549226.627875566   529 0.597150751    10.10.1.1 → 10.10.1.2    TCP 83 8081 → 47406 [PSH, ACK] Seq=834 Ack=851 Win=65152 Len=17 TSval=3171749985 TSecr=1047490274
1711549234.627875566   537 0.598366605    10.10.1.2 → 10.10.1.1    TCP 83 47406 → 8081 [PSH, ACK] Seq=851 Ack=851 Win=64256 Len=17 TSval=1047490276 TSecr=3171749985
1711549236.627875566   539 0.598497552    10.10.1.1 → 10.10.1.2    TCP 83 8081 → 47406 [PSH, ACK] Seq=851 Ack=868 Win=65152 Len=17 TSval=3171749987 TSecr=1047490276
1711549244.627875566   547 0.599711261    10.10.1.2 → 10.10.1.1    TCP 83 47406 → 8081 [PSH, ACK] Seq=868 Ack=868 Win=64256 Len=17 TSval=1047490277 TSecr=3171749987
1711549246.627875566   549 0.599836490    10.10.1.1 → 10.10.1.2    TCP 83 8081 → 47406 [PSH, ACK] Seq=868 Ack=885 Win=65152 Len=17 TSval=3171749988 TSecr=1047490277
1711549254.627875566   557 0.601047241    10.10.1.2 → 10.10.1.1    TCP 83 47406 → 8081 [PSH, ACK] Seq=885 Ack=885 Win=64256 Len=17 TSval=1047490278 TSecr=3171749988
1711549256.627875566   559 0.601172478    10.10.1.1 → 10.10.1.2    TCP 83 8081 → 47406 [PSH, ACK] Seq=885 Ack=902 Win=65152 Len=17 TSval=3171749989 TSecr=1047490278
1711549264.627875566   567 0.602366615    10.10.1.2 → 10.10.1.1    TCP 83 47406 → 8081 [PSH, ACK] Seq=902 Ack=902 Win=64256 Len=17 TSval=1047490280 TSecr=3171749989
1711549266.627875566   569 0.602495403    10.10.1.1 → 10.10.1.2    TCP 83 8081 → 47406 [PSH, ACK] Seq=902 Ack=919 Win=65152 Len=17 TSval=3171749991 TSecr=1047490280
1711549274.627875566   577 0.603709135    10.10.1.2 → 10.10.1.1    TCP 83 47406 → 8081 [PSH, ACK] Seq=919 Ack=919 Win=64256 Len=17 TSval=1047490281 TSecr=3171749991
1711549276.627875566   579 0.603834155    10.10.1.1 → 10.10.1.2    TCP 83 8081 → 47406 [PSH, ACK] Seq=919 Ack=936 Win=65152 Len=17 TSval=3171749992 TSecr=1047490281
1711549284.627875566   587 0.605044205    10.10.1.2 → 10.10.1.1    TCP 83 47406 → 8081 [PSH, ACK] Seq=936 Ack=936 Win=64256 Len=17 TSval=1047490282 TSecr=3171749992
1711549286.627875566   589 0.605169220    10.10.1.1 → 10.10.1.2    TCP 83 8081 → 47406 [PSH, ACK] Seq=936 Ack=953 Win=65152 Len=17 TSval=3171749993 TSecr=1047490282
1711549294.627875566   597 0.606365702    10.10.1.2 → 10.10.1.1    TCP 83 47406 → 8081 [PSH, ACK] Seq=953 Ack=953 Win=64256 Len=17 TSval=1047490284 TSecr=3171749993
1711549297.627875566   600 0.606549927    10.10.1.1 → 10.10.1.2    TCP 83 8081 → 47406 [PSH, ACK] Seq=953 Ack=970 Win=65152 Len=17 TSval=3171749995 TSecr=1047490284
1711549304.627875566   607 0.607764178    10.10.1.2 → 10.10.1.1    TCP 83 47406 → 8081 [PSH, ACK] Seq=970 Ack=970 Win=64256 Len=17 TSval=1047490285 TSecr=3171749995
1711549306.627875566   609 0.607886057    10.10.1.1 → 10.10.1.2    TCP 83 8081 → 47406 [PSH, ACK] Seq=970 Ack=987 Win=65152 Len=17 TSval=3171749996 TSecr=1047490285
1711549314.627875566   617 0.609096276    10.10.1.2 → 10.10.1.1    TCP 83 47406 → 8081 [PSH, ACK] Seq=987 Ack=987 Win=64256 Len=17 TSval=1047490286 TSecr=3171749996
1711549316.627875566   619 0.609217493    10.10.1.1 → 10.10.1.2    TCP 83 8081 → 47406 [PSH, ACK] Seq=987 Ack=1004 Win=65152 Len=17 TSval=3171749997 TSecr=1047490286
1711549324.627875566   627 0.610429096    10.10.1.2 → 10.10.1.1    TCP 83 47406 → 8081 [PSH, ACK] Seq=1004 Ack=1004 Win=64256 Len=17 TSval=1047490288 TSecr=3171749997
1711549326.627875566   629 0.610559216    10.10.1.1 → 10.10.1.2    TCP 83 8081 → 47406 [PSH, ACK] Seq=1004 Ack=1021 Win=65152 Len=17 TSval=3171749999 TSecr=1047490288
1711549334.627875566   637 0.611774595    10.10.1.2 → 10.10.1.1    TCP 83 47406 → 8081 [PSH, ACK] Seq=1021 Ack=1021 Win=64256 Len=17 TSval=1047490289 TSecr=3171749999
1711549336.627875566   639 0.611899373    10.10.1.1 → 10.10.1.2    TCP 83 8081 → 47406 [PSH, ACK] Seq=1021 Ack=1038 Win=65152 Len=17 TSval=3171750000 TSecr=1047490289
1711549344.627875566   647 0.613110474    10.10.1.2 → 10.10.1.1    TCP 83 47406 → 8081 [PSH, ACK] Seq=1038 Ack=1038 Win=64256 Len=17 TSval=1047490290 TSecr=3171750000
1711549346.627875566   649 0.613235180    10.10.1.1 → 10.10.1.2    TCP 83 8081 → 47406 [PSH, ACK] Seq=1038 Ack=1055 Win=65152 Len=17 TSval=3171750001 TSecr=1047490290
1711549354.627875566   657 0.614446322    10.10.1.2 → 10.10.1.1    TCP 83 47406 → 8081 [PSH, ACK] Seq=1055 Ack=1055 Win=64256 Len=17 TSval=1047490292 TSecr=3171750001
1711549356.627875566   659 0.614575884    10.10.1.1 → 10.10.1.2    TCP 83 8081 → 47406 [PSH, ACK] Seq=1055 Ack=1072 Win=65152 Len=17 TSval=3171750003 TSecr=1047490292
1711549364.627875566   667 0.615791712    10.10.1.2 → 10.10.1.1    TCP 83 47406 → 8081 [PSH, ACK] Seq=1072 Ack=1072 Win=64256 Len=17 TSval=1047490293 TSecr=3171750003
1711549366.627875566   669 0.615916219    10.10.1.1 → 10.10.1.2    TCP 83 8081 → 47406 [PSH, ACK] Seq=1072 Ack=1089 Win=65152 Len=17 TSval=3171750004 TSecr=1047490293
1711549374.627875566   677 0.617127570    10.10.1.2 → 10.10.1.1    TCP 83 47406 → 8081 [PSH, ACK] Seq=1089 Ack=1089 Win=64256 Len=17 TSval=1047490294 TSecr=3171750004
1711549376.627875566   679 0.617252025    10.10.1.1 → 10.10.1.2    TCP 83 8081 → 47406 [PSH, ACK] Seq=1089 Ack=1106 Win=65152 Len=17 TSval=3171750005 TSecr=1047490294
1711549384.627875566   687 0.618462408    10.10.1.2 → 10.10.1.1    TCP 83 47406 → 8081 [PSH, ACK] Seq=1106 Ack=1106 Win=64256 Len=17 TSval=1047490296 TSecr=3171750005
1711549386.627875566   689 0.618592347    10.10.1.1 → 10.10.1.2    TCP 83 8081 → 47406 [PSH, ACK] Seq=1106 Ack=1123 Win=65152 Len=17 TSval=3171750007 TSecr=1047490296
1711549394.627875566   697 0.619806373    10.10.1.2 → 10.10.1.1    TCP 83 47406 → 8081 [PSH, ACK] Seq=1123 Ack=1123 Win=64256 Len=17 TSval=1047490297 TSecr=3171750007
1711549396.627875566   699 0.619930641    10.10.1.1 → 10.10.1.2    TCP 83 8081 → 47406 [PSH, ACK] Seq=1123 Ack=1140 Win=65152 Len=17 TSval=3171750008 TSecr=1047490297
1711549404.627875566   707 0.621140557    10.10.1.2 → 10.10.1.1    TCP 83 47406 → 8081 [PSH, ACK] Seq=1140 Ack=1140 Win=64256 Len=17 TSval=1047490298 TSecr=3171750008
1711549406.627875566   709 0.621264919    10.10.1.1 → 10.10.1.2    TCP 83 8081 → 47406 [PSH, ACK] Seq=1140 Ack=1157 Win=65152 Len=17 TSval=3171750009 TSecr=1047490298
1711549414.627875566   717 0.622476907    10.10.1.2 → 10.10.1.1    TCP 83 47406 → 8081 [PSH, ACK] Seq=1157 Ack=1157 Win=64256 Len=17 TSval=1047490300 TSecr=3171750009
1711549416.627875566   719 0.622617724    10.10.1.1 → 10.10.1.2    TCP 83 8081 → 47406 [PSH, ACK] Seq=1157 Ack=1174 Win=65152 Len=17 TSval=3171750011 TSecr=1047490300
1711549424.627875566   727 0.623832012    10.10.1.2 → 10.10.1.1    TCP 83 47406 → 8081 [PSH, ACK] Seq=1174 Ack=1174 Win=64256 Len=17 TSval=1047490301 TSecr=3171750011
1711549426.627875566   729 0.623957288    10.10.1.1 → 10.10.1.2    TCP 83 8081 → 47406 [PSH, ACK] Seq=1174 Ack=1191 Win=65152 Len=17 TSval=3171750012 TSecr=1047490301
1711549434.627875566   737 0.625167538    10.10.1.2 → 10.10.1.1    TCP 83 47406 → 8081 [PSH, ACK] Seq=1191 Ack=1191 Win=64256 Len=17 TSval=1047490302 TSecr=3171750012
1711549436.627875566   739 0.625293507    10.10.1.1 → 10.10.1.2    TCP 83 8081 → 47406 [PSH, ACK] Seq=1191 Ack=1208 Win=65152 Len=17 TSval=3171750013 TSecr=1047490302
1711549444.627875566   747 0.626505454    10.10.1.2 → 10.10.1.1    TCP 83 47406 → 8081 [PSH, ACK] Seq=1208 Ack=1208 Win=64256 Len=17 TSval=1047490304 TSecr=3171750013
1711549446.627875566   749 0.626636151    10.10.1.1 → 10.10.1.2    TCP 83 8081 → 47406 [PSH, ACK] Seq=1208 Ack=1225 Win=65152 Len=17 TSval=3171750015 TSecr=1047490304
1711549454.627875566   757 0.627849127    10.10.1.2 → 10.10.1.1    TCP 83 47406 → 8081 [PSH, ACK] Seq=1225 Ack=1225 Win=64256 Len=17 TSval=1047490305 TSecr=3171750015
1711549456.627875566   759 0.627970555    10.10.1.1 → 10.10.1.2    TCP 83 8081 → 47406 [PSH, ACK] Seq=1225 Ack=1242 Win=65152 Len=17 TSval=3171750016 TSecr=1047490305
1711549464.627875566   767 0.629180482    10.10.1.2 → 10.10.1.1    TCP 83 47406 → 8081 [PSH, ACK] Seq=1242 Ack=1242 Win=64256 Len=17 TSval=1047490306 TSecr=3171750016
1711549466.627875566   769 0.629301604    10.10.1.1 → 10.10.1.2    TCP 83 8081 → 47406 [PSH, ACK] Seq=1242 Ack=1259 Win=65152 Len=17 TSval=3171750017 TSecr=1047490306
1711549474.627875566   777 0.630512630    10.10.1.2 → 10.10.1.1    TCP 83 47406 → 8081 [PSH, ACK] Seq=1259 Ack=1259 Win=64256 Len=17 TSval=1047490308 TSecr=3171750017
1711549476.627875566   779 0.630642282    10.10.1.1 → 10.10.1.2    TCP 83 8081 → 47406 [PSH, ACK] Seq=1259 Ack=1276 Win=65152 Len=17 TSval=3171750019 TSecr=1047490308
1711549484.627875566   787 0.631856518    10.10.1.2 → 10.10.1.1    TCP 83 47406 → 8081 [PSH, ACK] Seq=1276 Ack=1276 Win=64256 Len=17 TSval=1047490309 TSecr=3171750019
1711549486.627875566   789 0.631982111    10.10.1.1 → 10.10.1.2    TCP 83 8081 → 47406 [PSH, ACK] Seq=1276 Ack=1293 Win=65152 Len=17 TSval=3171750020 TSecr=1047490309
1711549494.627875566   797 0.633193874    10.10.1.2 → 10.10.1.1    TCP 83 47406 → 8081 [PSH, ACK] Seq=1293 Ack=1293 Win=64256 Len=17 TSval=1047490310 TSecr=3171750020
1711549496.627875566   799 0.633319146    10.10.1.1 → 10.10.1.2    TCP 83 8081 → 47406 [PSH, ACK] Seq=1293 Ack=1310 Win=65152 Len=17 TSval=3171750021 TSecr=1047490310
1711549504.627875566   807 0.634531551    10.10.1.2 → 10.10.1.1    TCP 83 47406 → 8081 [PSH, ACK] Seq=1310 Ack=1310 Win=64256 Len=17 TSval=1047490312 TSecr=3171750021
1711549506.627875566   809 0.634660893    10.10.1.1 → 10.10.1.2    TCP 83 8081 → 47406 [PSH, ACK] Seq=1310 Ack=1327 Win=65152 Len=17 TSval=3171750023 TSecr=1047490312
1711549514.627875566   817 0.635874996    10.10.1.2 → 10.10.1.1    TCP 83 47406 → 8081 [PSH, ACK] Seq=1327 Ack=1327 Win=64256 Len=17 TSval=1047490313 TSecr=3171750023
1711549516.627875566   819 0.636003417    10.10.1.1 → 10.10.1.2    TCP 83 8081 → 47406 [PSH, ACK] Seq=1327 Ack=1344 Win=65152 Len=17 TSval=3171750024 TSecr=1047490313
1711549524.627875566   827 0.637214222    10.10.1.2 → 10.10.1.1    TCP 83 47406 → 8081 [PSH, ACK] Seq=1344 Ack=1344 Win=64256 Len=17 TSval=1047490314 TSecr=3171750024
1711549526.627875566   829 0.637338663    10.10.1.1 → 10.10.1.2    TCP 83 8081 → 47406 [PSH, ACK] Seq=1344 Ack=1361 Win=65152 Len=17 TSval=3171750025 TSecr=1047490314
1711549534.627875566   837 0.638549539    10.10.1.2 → 10.10.1.1    TCP 83 47406 → 8081 [PSH, ACK] Seq=1361 Ack=1361 Win=64256 Len=17 TSval=1047490316 TSecr=3171750025
1711549536.627875566   839 0.638679566    10.10.1.1 → 10.10.1.2    TCP 83 8081 → 47406 [PSH, ACK] Seq=1361 Ack=1378 Win=65152 Len=17 TSval=3171750027 TSecr=1047490316
1711549544.627875566   847 0.639893974    10.10.1.2 → 10.10.1.1    TCP 83 47406 → 8081 [PSH, ACK] Seq=1378 Ack=1378 Win=64256 Len=17 TSval=1047490317 TSecr=3171750027
1711549546.627875566   849 0.640015259    10.10.1.1 → 10.10.1.2    TCP 83 8081 → 47406 [PSH, ACK] Seq=1378 Ack=1395 Win=65152 Len=17 TSval=3171750028 TSecr=1047490317
1711549554.627875566   857 0.641226153    10.10.1.2 → 10.10.1.1    TCP 83 47406 → 8081 [PSH, ACK] Seq=1395 Ack=1395 Win=64256 Len=17 TSval=1047490318 TSecr=3171750028
1711549556.627875566   859 0.641346684    10.10.1.1 → 10.10.1.2    TCP 83 8081 → 47406 [PSH, ACK] Seq=1395 Ack=1412 Win=65152 Len=17 TSval=3171750029 TSecr=1047490318
1711549564.627875566   867 0.642558441    10.10.1.2 → 10.10.1.1    TCP 83 47406 → 8081 [PSH, ACK] Seq=1412 Ack=1412 Win=64256 Len=17 TSval=1047490320 TSecr=3171750029
1711549566.627875566   869 0.642684644    10.10.1.1 → 10.10.1.2    TCP 83 8081 → 47406 [PSH, ACK] Seq=1412 Ack=1429 Win=65152 Len=17 TSval=3171750031 TSecr=1047490320
1711549574.627875566   877 0.643899194    10.10.1.2 → 10.10.1.1    TCP 83 47406 → 8081 [PSH, ACK] Seq=1429 Ack=1429 Win=64256 Len=17 TSval=1047490321 TSecr=3171750031
1711549576.627875566   879 0.644020352    10.10.1.1 → 10.10.1.2    TCP 83 8081 → 47406 [PSH, ACK] Seq=1429 Ack=1446 Win=65152 Len=17 TSval=3171750032 TSecr=1047490321
1711549584.627875566   887 0.645230519    10.10.1.2 → 10.10.1.1    TCP 83 47406 → 8081 [PSH, ACK] Seq=1446 Ack=1446 Win=64256 Len=17 TSval=1047490322 TSecr=3171750032
1711549586.627875566   889 0.645350730    10.10.1.1 → 10.10.1.2    TCP 83 8081 → 47406 [PSH, ACK] Seq=1446 Ack=1463 Win=65152 Len=17 TSval=3171750033 TSecr=1047490322
1711549594.627875566   897 0.646561742    10.10.1.2 → 10.10.1.1    TCP 83 47406 → 8081 [PSH, ACK] Seq=1463 Ack=1463 Win=64256 Len=17 TSval=1047490324 TSecr=3171750033
1711549596.627875566   899 0.646687563    10.10.1.1 → 10.10.1.2    TCP 83 8081 → 47406 [PSH, ACK] Seq=1463 Ack=1480 Win=65152 Len=17 TSval=3171750035 TSecr=1047490324
1711549604.627875566   907 0.647900888    10.10.1.2 → 10.10.1.1    TCP 83 47406 → 8081 [PSH, ACK] Seq=1480 Ack=1480 Win=64256 Len=17 TSval=1047490325 TSecr=3171750035
1711549606.627875566   909 0.648024266    10.10.1.1 → 10.10.1.2    TCP 83 8081 → 47406 [PSH, ACK] Seq=1480 Ack=1497 Win=65152 Len=17 TSval=3171750036 TSecr=1047490325
1711549614.627875566   917 0.649234836    10.10.1.2 → 10.10.1.1    TCP 83 47406 → 8081 [PSH, ACK] Seq=1497 Ack=1497 Win=64256 Len=17 TSval=1047490326 TSecr=3171750036
1711549616.627875566   919 0.649356217    10.10.1.1 → 10.10.1.2    TCP 83 8081 → 47406 [PSH, ACK] Seq=1497 Ack=1514 Win=65152 Len=17 TSval=3171750037 TSecr=1047490326
1711549624.627875566   927 0.650567065    10.10.1.2 → 10.10.1.1    TCP 83 47406 → 8081 [PSH, ACK] Seq=1514 Ack=1514 Win=64256 Len=17 TSval=1047490328 TSecr=3171750037
1711549626.627875566   929 0.650693281    10.10.1.1 → 10.10.1.2    TCP 83 8081 → 47406 [PSH, ACK] Seq=1514 Ack=1531 Win=65152 Len=17 TSval=3171750039 TSecr=1047490328
1711549634.627875566   937 0.651907403    10.10.1.2 → 10.10.1.1    TCP 83 47406 → 8081 [PSH, ACK] Seq=1531 Ack=1531 Win=64256 Len=17 TSval=1047490329 TSecr=3171750039
1711549636.627875566   939 0.652028022    10.10.1.1 → 10.10.1.2    TCP 83 8081 → 47406 [PSH, ACK] Seq=1531 Ack=1548 Win=65152 Len=17 TSval=3171750040 TSecr=1047490329
1711549644.627875566   947 0.653238849    10.10.1.2 → 10.10.1.1    TCP 83 47406 → 8081 [PSH, ACK] Seq=1548 Ack=1548 Win=64256 Len=17 TSval=1047490330 TSecr=3171750040
1711549646.627875566   949 0.653359509    10.10.1.1 → 10.10.1.2    TCP 83 8081 → 47406 [PSH, ACK] Seq=1548 Ack=1565 Win=65152 Len=17 TSval=3171750041 TSecr=1047490330
1711549654.627875566   957 0.654570675    10.10.1.2 → 10.10.1.1    TCP 83 47406 → 8081 [PSH, ACK] Seq=1565 Ack=1565 Win=64256 Len=17 TSval=1047490332 TSecr=3171750041
1711549656.627875566   959 0.654696322    10.10.1.1 → 10.10.1.2    TCP 83 8081 → 47406 [PSH, ACK] Seq=1565 Ack=1582 Win=65152 Len=17 TSval=3171750043 TSecr=1047490332
1711549664.627875566   967 0.655910419    10.10.1.2 → 10.10.1.1    TCP 83 47406 → 8081 [PSH, ACK] Seq=1582 Ack=1582 Win=64256 Len=17 TSval=1047490333 TSecr=3171750043
1711549666.627875566   969 0.656031296    10.10.1.1 → 10.10.1.2    TCP 83 8081 → 47406 [PSH, ACK] Seq=1582 Ack=1599 Win=65152 Len=17 TSval=3171750044 TSecr=1047490333
1711549674.627875566   977 0.657242419    10.10.1.2 → 10.10.1.1    TCP 83 47406 → 8081 [PSH, ACK] Seq=1599 Ack=1599 Win=64256 Len=17 TSval=1047490334 TSecr=3171750044
1711549676.627875566   979 0.657362715    10.10.1.1 → 10.10.1.2    TCP 83 8081 → 47406 [PSH, ACK] Seq=1599 Ack=1616 Win=65152 Len=17 TSval=3171750045 TSecr=1047490334
1711549684.627875566   987 0.658574845    10.10.1.2 → 10.10.1.1    TCP 83 47406 → 8081 [PSH, ACK] Seq=1616 Ack=1616 Win=64256 Len=17 TSval=1047490336 TSecr=3171750045
1711549686.627875566   989 0.658700130    10.10.1.1 → 10.10.1.2    TCP 83 8081 → 47406 [PSH, ACK] Seq=1616 Ack=1633 Win=65152 Len=17 TSval=3171750047 TSecr=1047490336
1711549694.627875566   997 0.659914658    10.10.1.2 → 10.10.1.1    TCP 83 47406 → 8081 [PSH, ACK] Seq=1633 Ack=1633 Win=64256 Len=17 TSval=1047490337 TSecr=3171750047
1711549696.627875566   999 0.660036400    10.10.1.1 → 10.10.1.2    TCP 83 8081 → 47406 [PSH, ACK] Seq=1633 Ack=1650 Win=65152 Len=17 TSval=3171750048 TSecr=1047490337
1711549704.627875566  1007 0.661247330    10.10.1.2 → 10.10.1.1    TCP 83 47406 → 8081 [PSH, ACK] Seq=1650 Ack=1650 Win=64256 Len=17 TSval=1047490338 TSecr=3171750048
1711549706.627875566  1009 0.661368211    10.10.1.1 → 10.10.1.2    TCP 83 8081 → 47406 [PSH, ACK] Seq=1650 Ack=1667 Win=65152 Len=17 TSval=3171750049 TSecr=1047490338
1711549714.627875566  1017 0.662579339    10.10.1.2 → 10.10.1.1    TCP 83 47406 → 8081 [PSH, ACK] Seq=1667 Ack=1667 Win=64256 Len=17 TSval=1047490340 TSecr=3171750049
1711549716.627875566  1019 0.662709547    10.10.1.1 → 10.10.1.2    TCP 83 8081 → 47406 [PSH, ACK] Seq=1667 Ack=1684 Win=65152 Len=17 TSval=3171750051 TSecr=1047490340
1711549724.627875566  1027 0.663922940    10.10.1.2 → 10.10.1.1    TCP 83 47406 → 8081 [PSH, ACK] Seq=1684 Ack=1684 Win=64256 Len=17 TSval=1047490341 TSecr=3171750051
1711549726.627875566  1029 0.664047472    10.10.1.1 → 10.10.1.2    TCP 83 8081 → 47406 [PSH, ACK] Seq=1684 Ack=1701 Win=65152 Len=17 TSval=3171750052 TSecr=1047490341
1711549734.627875566  1037 0.665258283    10.10.1.2 → 10.10.1.1    TCP 83 47406 → 8081 [PSH, ACK] Seq=1701 Ack=1701 Win=64256 Len=17 TSval=1047490342 TSecr=3171750052
1711549736.627875566  1039 0.665385713    10.10.1.1 → 10.10.1.2    TCP 83 8081 → 47406 [PSH, ACK] Seq=1701 Ack=1718 Win=65152 Len=17 TSval=3171750053 TSecr=1047490342
1711549744.627875566  1047 0.666596703    10.10.1.2 → 10.10.1.1    TCP 83 47406 → 8081 [PSH, ACK] Seq=1718 Ack=1718 Win=64256 Len=17 TSval=1047490344 TSecr=3171750053
1711549746.627875566  1049 0.666723167    10.10.1.1 → 10.10.1.2    TCP 83 8081 → 47406 [PSH, ACK] Seq=1718 Ack=1735 Win=65152 Len=17 TSval=3171750055 TSecr=1047490344
1711549754.627875566  1057 0.667936805    10.10.1.2 → 10.10.1.1    TCP 83 47406 → 8081 [PSH, ACK] Seq=1735 Ack=1735 Win=64256 Len=17 TSval=1047490345 TSecr=3171750055
1711549756.627875566  1059 0.668057512    10.10.1.1 → 10.10.1.2    TCP 83 8081 → 47406 [PSH, ACK] Seq=1735 Ack=1752 Win=65152 Len=17 TSval=3171750056 TSecr=1047490345
1711549764.627875566  1067 0.669267666    10.10.1.2 → 10.10.1.1    TCP 83 47406 → 8081 [PSH, ACK] Seq=1752 Ack=1752 Win=64256 Len=17 TSval=1047490346 TSecr=3171750056
1711549766.627875566  1069 0.669389205    10.10.1.1 → 10.10.1.2    TCP 83 8081 → 47406 [PSH, ACK] Seq=1752 Ack=1769 Win=65152 Len=17 TSval=3171750057 TSecr=1047490346
1711549774.627875566  1077 0.670601453    10.10.1.2 → 10.10.1.1    TCP 83 47406 → 8081 [PSH, ACK] Seq=1769 Ack=1769 Win=64256 Len=17 TSval=1047490348 TSecr=3171750057
1711549776.627875566  1079 0.670730984    10.10.1.1 → 10.10.1.2    TCP 83 8081 → 47406 [PSH, ACK] Seq=1769 Ack=1786 Win=65152 Len=17 TSval=3171750059 TSecr=1047490348
1711549784.627875566  1087 0.671944372    10.10.1.2 → 10.10.1.1    TCP 83 47406 → 8081 [PSH, ACK] Seq=1786 Ack=1786 Win=64256 Len=17 TSval=1047490349 TSecr=3171750059
1711549786.627875566  1089 0.672069568    10.10.1.1 → 10.10.1.2    TCP 83 8081 → 47406 [PSH, ACK] Seq=1786 Ack=1803 Win=65152 Len=17 TSval=3171750060 TSecr=1047490349
1711549794.627875566  1097 0.673279936    10.10.1.2 → 10.10.1.1    TCP 83 47406 → 8081 [PSH, ACK] Seq=1803 Ack=1803 Win=64256 Len=17 TSval=1047490350 TSecr=3171750060
1711549796.627875566  1099 0.673404622    10.10.1.1 → 10.10.1.2    TCP 83 8081 → 47406 [PSH, ACK] Seq=1803 Ack=1820 Win=65152 Len=17 TSval=3171750061 TSecr=1047490350
1711549804.627875566  1107 0.674616205    10.10.1.2 → 10.10.1.1    TCP 83 47406 → 8081 [PSH, ACK] Seq=1820 Ack=1820 Win=64256 Len=17 TSval=1047490352 TSecr=3171750061
1711549806.627875566  1109 0.674746281    10.10.1.1 → 10.10.1.2    TCP 83 8081 → 47406 [PSH, ACK] Seq=1820 Ack=1837 Win=65152 Len=17 TSval=3171750063 TSecr=1047490352
1711549814.627875566  1117 0.675960761    10.10.1.2 → 10.10.1.1    TCP 83 47406 → 8081 [PSH, ACK] Seq=1837 Ack=1837 Win=64256 Len=17 TSval=1047490353 TSecr=3171750063
1711549816.627875566  1119 0.676085785    10.10.1.1 → 10.10.1.2    TCP 83 8081 → 47406 [PSH, ACK] Seq=1837 Ack=1854 Win=65152 Len=17 TSval=3171750064 TSecr=1047490353
1711549824.627875566  1127 0.677296345    10.10.1.2 → 10.10.1.1    TCP 83 47406 → 8081 [PSH, ACK] Seq=1854 Ack=1854 Win=64256 Len=17 TSval=1047490354 TSecr=3171750064
1711549826.627875566  1129 0.677424855    10.10.1.1 → 10.10.1.2    TCP 83 8081 → 47406 [PSH, ACK] Seq=1854 Ack=1871 Win=65152 Len=17 TSval=3171750065 TSecr=1047490354
1711549834.627875566  1137 0.678637204    10.10.1.2 → 10.10.1.1    TCP 83 47406 → 8081 [PSH, ACK] Seq=1871 Ack=1871 Win=64256 Len=17 TSval=1047490356 TSecr=3171750065
1711549836.627875566  1139 0.678767269    10.10.1.1 → 10.10.1.2    TCP 83 8081 → 47406 [PSH, ACK] Seq=1871 Ack=1888 Win=65152 Len=17 TSval=3171750067 TSecr=1047490356
1711549844.627875566  1147 0.679981228    10.10.1.2 → 10.10.1.1    TCP 83 47406 → 8081 [PSH, ACK] Seq=1888 Ack=1888 Win=64256 Len=17 TSval=1047490357 TSecr=3171750067
1711549846.627875566  1149 0.680102228    10.10.1.1 → 10.10.1.2    TCP 83 8081 → 47406 [PSH, ACK] Seq=1888 Ack=1905 Win=65152 Len=17 TSval=3171750068 TSecr=1047490357
1711549854.627875566  1157 0.681312774    10.10.1.2 → 10.10.1.1    TCP 83 47406 → 8081 [PSH, ACK] Seq=1905 Ack=1905 Win=64256 Len=17 TSval=1047490358 TSecr=3171750068
1711549856.627875566  1159 0.681456429    10.10.1.1 → 10.10.1.2    TCP 83 8081 → 47406 [PSH, ACK] Seq=1905 Ack=1922 Win=65152 Len=17 TSval=3171750069 TSecr=1047490358
1711549864.627875566  1167 0.682667346    10.10.1.2 → 10.10.1.1    TCP 83 47406 → 8081 [PSH, ACK] Seq=1922 Ack=1922 Win=64256 Len=17 TSval=1047490360 TSecr=3171750069
1711549867.627875566  1170 0.682844867    10.10.1.1 → 10.10.1.2    TCP 83 8081 → 47406 [PSH, ACK] Seq=1922 Ack=1939 Win=65152 Len=17 TSval=3171750071 TSecr=1047490360
1711549874.627875566  1177 0.684070991    10.10.1.2 → 10.10.1.1    TCP 83 47406 → 8081 [PSH, ACK] Seq=1939 Ack=1939 Win=64256 Len=17 TSval=1047490361 TSecr=3171750071
1711549876.627875566  1179 0.684192441    10.10.1.1 → 10.10.1.2    TCP 83 8081 → 47406 [PSH, ACK] Seq=1939 Ack=1956 Win=65152 Len=17 TSval=3171750072 TSecr=1047490361
1711549884.627875566  1187 0.685402958    10.10.1.2 → 10.10.1.1    TCP 83 47406 → 8081 [PSH, ACK] Seq=1956 Ack=1956 Win=64256 Len=17 TSval=1047490363 TSecr=3171750072
1711549886.627875566  1189 0.685540318    10.10.1.1 → 10.10.1.2    TCP 83 8081 → 47406 [PSH, ACK] Seq=1956 Ack=1973 Win=65152 Len=17 TSval=3171750074 TSecr=1047490363
1711549894.627875566  1197 0.686752032    10.10.1.2 → 10.10.1.1    TCP 83 47406 → 8081 [PSH, ACK] Seq=1973 Ack=1973 Win=64256 Len=17 TSval=1047490364 TSecr=3171750074
1711549896.627875566  1199 0.686882613    10.10.1.1 → 10.10.1.2    TCP 83 8081 → 47406 [PSH, ACK] Seq=1973 Ack=1990 Win=65152 Len=17 TSval=3171750075 TSecr=1047490364
1711549904.627875566  1207 0.688096510    10.10.1.2 → 10.10.1.1    TCP 83 47406 → 8081 [PSH, ACK] Seq=1990 Ack=1990 Win=64256 Len=17 TSval=1047490365 TSecr=3171750075
1711549906.627875566  1209 0.688222959    10.10.1.1 → 10.10.1.2    TCP 83 8081 → 47406 [PSH, ACK] Seq=1990 Ack=2007 Win=65152 Len=17 TSval=3171750076 TSecr=1047490365
1711549914.627875566  1217 0.689434442    10.10.1.2 → 10.10.1.1    TCP 83 47406 → 8081 [PSH, ACK] Seq=2007 Ack=2007 Win=64256 Len=17 TSval=1047490367 TSecr=3171750076
1711549916.627875566  1219 0.689557007    10.10.1.1 → 10.10.1.2    TCP 83 8081 → 47406 [PSH, ACK] Seq=2007 Ack=2024 Win=65152 Len=17 TSval=3171750078 TSecr=1047490367
1711549924.627875566  1227 0.690769365    10.10.1.2 → 10.10.1.1    TCP 83 47406 → 8081 [PSH, ACK] Seq=2024 Ack=2024 Win=64256 Len=17 TSval=1047490368 TSecr=3171750078
1711549926.627875566  1229 0.690894856    10.10.1.1 → 10.10.1.2    TCP 83 8081 → 47406 [PSH, ACK] Seq=2024 Ack=2041 Win=65152 Len=17 TSval=3171750079 TSecr=1047490368
1711549934.627875566  1237 0.692108774    10.10.1.2 → 10.10.1.1    TCP 83 47406 → 8081 [PSH, ACK] Seq=2041 Ack=2041 Win=64256 Len=17 TSval=1047490369 TSecr=3171750079
