1712098961.803476095    28 0.518694618    10.10.1.2 → 10.10.1.1    TCP 83 56128 → 8081 [PSH, ACK] Seq=1 Ack=1 Win=64256 Len=17 TSval=1597726371 TSecr=3721985830
1712098965.803476095    32 0.519019298    10.10.1.1 → 10.10.1.2    TCP 83 8081 → 56128 [PSH, ACK] Seq=1 Ack=18 Win=65152 Len=17 TSval=3721986080 TSecr=1597726371
1712098970.803476095    37 0.520240715    10.10.1.2 → 10.10.1.1    TCP 83 56128 → 8081 [PSH, ACK] Seq=18 Ack=18 Win=64256 Len=17 TSval=1597726373 TSecr=3721986080
1712098972.803476095    39 0.520364593    10.10.1.1 → 10.10.1.2    TCP 83 8081 → 56128 [PSH, ACK] Seq=18 Ack=35 Win=65152 Len=17 TSval=3721986081 TSecr=1597726373
1712098976.803476095    43 0.521576204    10.10.1.2 → 10.10.1.1    TCP 83 56128 → 8081 [PSH, ACK] Seq=35 Ack=35 Win=64256 Len=17 TSval=1597726374 TSecr=3721986081
1712098978.803476095    45 0.521712495    10.10.1.1 → 10.10.1.2    TCP 83 8081 → 56128 [PSH, ACK] Seq=35 Ack=52 Win=65152 Len=17 TSval=3721986082 TSecr=1597726374
1712098983.803476095    50 0.522918524    10.10.1.2 → 10.10.1.1    TCP 83 56128 → 8081 [PSH, ACK] Seq=52 Ack=52 Win=64256 Len=17 TSval=1597726375 TSecr=3721986082
1712098985.803476095    52 0.523053989    10.10.1.1 → 10.10.1.2    TCP 83 8081 → 56128 [PSH, ACK] Seq=52 Ack=69 Win=65152 Len=17 TSval=3721986084 TSecr=1597726375
1712098989.803476095    56 0.524260222    10.10.1.2 → 10.10.1.1    TCP 83 56128 → 8081 [PSH, ACK] Seq=69 Ack=69 Win=64256 Len=17 TSval=1597726377 TSecr=3721986084
1712098991.803476095    58 0.524386518    10.10.1.1 → 10.10.1.2    TCP 83 8081 → 56128 [PSH, ACK] Seq=69 Ack=86 Win=65152 Len=17 TSval=3721986085 TSecr=1597726377
1712098996.803476095    63 0.525595507    10.10.1.2 → 10.10.1.1    TCP 83 56128 → 8081 [PSH, ACK] Seq=86 Ack=86 Win=64256 Len=17 TSval=1597726378 TSecr=3721986085
1712098998.803476095    65 0.525735154    10.10.1.1 → 10.10.1.2    TCP 83 8081 → 56128 [PSH, ACK] Seq=86 Ack=103 Win=65152 Len=17 TSval=3721986086 TSecr=1597726378
1712099002.803476095    69 0.526941056    10.10.1.2 → 10.10.1.1    TCP 83 56128 → 8081 [PSH, ACK] Seq=103 Ack=103 Win=64256 Len=17 TSval=1597726379 TSecr=3721986086
1712099004.803476095    71 0.527067833    10.10.1.1 → 10.10.1.2    TCP 83 8081 → 56128 [PSH, ACK] Seq=103 Ack=120 Win=65152 Len=17 TSval=3721986088 TSecr=1597726379
1712099009.803476095    76 0.528273999    10.10.1.2 → 10.10.1.1    TCP 83 56128 → 8081 [PSH, ACK] Seq=120 Ack=120 Win=64256 Len=17 TSval=1597726381 TSecr=3721986088
1712099011.803476095    78 0.528408526    10.10.1.1 → 10.10.1.2    TCP 83 8081 → 56128 [PSH, ACK] Seq=120 Ack=137 Win=65152 Len=17 TSval=3721986089 TSecr=1597726381
1712099015.803476095    82 0.529616837    10.10.1.2 → 10.10.1.1    TCP 83 56128 → 8081 [PSH, ACK] Seq=137 Ack=137 Win=64256 Len=17 TSval=1597726382 TSecr=3721986089
1712099017.803476095    84 0.529749030    10.10.1.1 → 10.10.1.2    TCP 83 8081 → 56128 [PSH, ACK] Seq=137 Ack=154 Win=65152 Len=17 TSval=3721986090 TSecr=1597726382
1712099022.803476095    89 0.530954832    10.10.1.2 → 10.10.1.1    TCP 83 56128 → 8081 [PSH, ACK] Seq=154 Ack=154 Win=64256 Len=17 TSval=1597726383 TSecr=3721986090
1712099024.803476095    91 0.531087061    10.10.1.1 → 10.10.1.2    TCP 83 8081 → 56128 [PSH, ACK] Seq=154 Ack=171 Win=65152 Len=17 TSval=3721986092 TSecr=1597726383
1712099028.803476095    95 0.532293530    10.10.1.2 → 10.10.1.1    TCP 83 56128 → 8081 [PSH, ACK] Seq=171 Ack=171 Win=64256 Len=17 TSval=1597726385 TSecr=3721986092
1712099030.803476095    97 0.532424039    10.10.1.1 → 10.10.1.2    TCP 83 8081 → 56128 [PSH, ACK] Seq=171 Ack=188 Win=65152 Len=17 TSval=3721986093 TSecr=1597726385
1712099035.803476095   102 0.533631958    10.10.1.2 → 10.10.1.1    TCP 83 56128 → 8081 [PSH, ACK] Seq=188 Ack=188 Win=64256 Len=17 TSval=1597726386 TSecr=3721986093
1712099037.803476095   104 0.533765550    10.10.1.1 → 10.10.1.2    TCP 83 8081 → 56128 [PSH, ACK] Seq=188 Ack=205 Win=65152 Len=17 TSval=3721986094 TSecr=1597726386
1712099041.803476095   108 0.534971314    10.10.1.2 → 10.10.1.1    TCP 83 56128 → 8081 [PSH, ACK] Seq=205 Ack=205 Win=64256 Len=17 TSval=1597726387 TSecr=3721986094
1712099043.803476095   110 0.535107423    10.10.1.1 → 10.10.1.2    TCP 83 8081 → 56128 [PSH, ACK] Seq=205 Ack=222 Win=65152 Len=17 TSval=3721986096 TSecr=1597726387
1712099048.803476095   115 0.536321273    10.10.1.2 → 10.10.1.1    TCP 83 56128 → 8081 [PSH, ACK] Seq=222 Ack=222 Win=64256 Len=17 TSval=1597726389 TSecr=3721986096
1712099050.803476095   117 0.536447294    10.10.1.1 → 10.10.1.2    TCP 83 8081 → 56128 [PSH, ACK] Seq=222 Ack=239 Win=65152 Len=17 TSval=3721986097 TSecr=1597726389
1712099054.803476095   121 0.537658321    10.10.1.2 → 10.10.1.1    TCP 83 56128 → 8081 [PSH, ACK] Seq=239 Ack=239 Win=64256 Len=17 TSval=1597726390 TSecr=3721986097
1712099056.803476095   123 0.537795803    10.10.1.1 → 10.10.1.2    TCP 83 8081 → 56128 [PSH, ACK] Seq=239 Ack=256 Win=65152 Len=17 TSval=3721986098 TSecr=1597726390
1712099061.803476095   128 0.538953594    10.10.1.2 → 10.10.1.1    TCP 83 56128 → 8081 [PSH, ACK] Seq=256 Ack=256 Win=64256 Len=17 TSval=1597726391 TSecr=3721986098
1712099063.803476095   130 0.539072689    10.10.1.1 → 10.10.1.2    TCP 83 8081 → 56128 [PSH, ACK] Seq=256 Ack=273 Win=65152 Len=17 TSval=3721986100 TSecr=1597726391
1712099067.803476095   134 0.540278678    10.10.1.2 → 10.10.1.1    TCP 83 56128 → 8081 [PSH, ACK] Seq=273 Ack=273 Win=64256 Len=17 TSval=1597726393 TSecr=3721986100
1712099069.803476095   136 0.540410192    10.10.1.1 → 10.10.1.2    TCP 83 8081 → 56128 [PSH, ACK] Seq=273 Ack=290 Win=65152 Len=17 TSval=3721986101 TSecr=1597726393
1712099074.803476095   141 0.541619574    10.10.1.2 → 10.10.1.1    TCP 83 56128 → 8081 [PSH, ACK] Seq=290 Ack=290 Win=64256 Len=17 TSval=1597726394 TSecr=3721986101
1712099076.803476095   143 0.541752596    10.10.1.1 → 10.10.1.2    TCP 83 8081 → 56128 [PSH, ACK] Seq=290 Ack=307 Win=65152 Len=17 TSval=3721986102 TSecr=1597726394
1712099080.803476095   147 0.542910958    10.10.1.2 → 10.10.1.1    TCP 83 56128 → 8081 [PSH, ACK] Seq=307 Ack=307 Win=64256 Len=17 TSval=1597726395 TSecr=3721986102
1712099082.803476095   149 0.543039948    10.10.1.1 → 10.10.1.2    TCP 83 8081 → 56128 [PSH, ACK] Seq=307 Ack=324 Win=65152 Len=17 TSval=3721986104 TSecr=1597726395
1712099088.803476095   155 0.544249762    10.10.1.2 → 10.10.1.1    TCP 83 56128 → 8081 [PSH, ACK] Seq=324 Ack=324 Win=64256 Len=17 TSval=1597726397 TSecr=3721986104
1712099089.803476095   156 0.544368208    10.10.1.1 → 10.10.1.2    TCP 83 8081 → 56128 [PSH, ACK] Seq=324 Ack=341 Win=65152 Len=17 TSval=3721986105 TSecr=1597726397
1712099094.803476095   161 0.545578158    10.10.1.2 → 10.10.1.1    TCP 83 56128 → 8081 [PSH, ACK] Seq=341 Ack=341 Win=64256 Len=17 TSval=1597726398 TSecr=3721986105
1712099096.803476095   163 0.545706949    10.10.1.1 → 10.10.1.2    TCP 83 8081 → 56128 [PSH, ACK] Seq=341 Ack=358 Win=65152 Len=17 TSval=3721986106 TSecr=1597726398
1712099100.803476095   167 0.546911406    10.10.1.2 → 10.10.1.1    TCP 83 56128 → 8081 [PSH, ACK] Seq=358 Ack=358 Win=64256 Len=17 TSval=1597726399 TSecr=3721986106
1712099102.803476095   169 0.547046289    10.10.1.1 → 10.10.1.2    TCP 83 8081 → 56128 [PSH, ACK] Seq=358 Ack=375 Win=65152 Len=17 TSval=3721986108 TSecr=1597726399
1712099106.803476095   173 0.548251674    10.10.1.2 → 10.10.1.1    TCP 83 56128 → 8081 [PSH, ACK] Seq=375 Ack=375 Win=64256 Len=17 TSval=1597726401 TSecr=3721986108
1712099108.803476095   175 0.548386088    10.10.1.1 → 10.10.1.2    TCP 83 8081 → 56128 [PSH, ACK] Seq=375 Ack=392 Win=65152 Len=17 TSval=3721986109 TSecr=1597726401
1712099113.803476095   180 0.549593738    10.10.1.2 → 10.10.1.1    TCP 83 56128 → 8081 [PSH, ACK] Seq=392 Ack=392 Win=64256 Len=17 TSval=1597726402 TSecr=3721986109
1712099115.803476095   182 0.549723749    10.10.1.1 → 10.10.1.2    TCP 83 8081 → 56128 [PSH, ACK] Seq=392 Ack=409 Win=65152 Len=17 TSval=3721986110 TSecr=1597726402
1712099119.803476095   186 0.550928813    10.10.1.2 → 10.10.1.1    TCP 83 56128 → 8081 [PSH, ACK] Seq=409 Ack=409 Win=64256 Len=17 TSval=1597726403 TSecr=3721986110
1712099121.803476095   188 0.551054407    10.10.1.1 → 10.10.1.2    TCP 83 8081 → 56128 [PSH, ACK] Seq=409 Ack=426 Win=65152 Len=17 TSval=3721986112 TSecr=1597726403
1712099126.803476095   193 0.552260580    10.10.1.2 → 10.10.1.1    TCP 83 56128 → 8081 [PSH, ACK] Seq=426 Ack=426 Win=64256 Len=17 TSval=1597726405 TSecr=3721986112
1712099128.803476095   195 0.552395636    10.10.1.1 → 10.10.1.2    TCP 83 8081 → 56128 [PSH, ACK] Seq=426 Ack=443 Win=65152 Len=17 TSval=3721986113 TSecr=1597726405
1712099132.803476095   199 0.553603272    10.10.1.2 → 10.10.1.1    TCP 83 56128 → 8081 [PSH, ACK] Seq=443 Ack=443 Win=64256 Len=17 TSval=1597726406 TSecr=3721986113
1712099134.803476095   201 0.553735931    10.10.1.1 → 10.10.1.2    TCP 83 8081 → 56128 [PSH, ACK] Seq=443 Ack=460 Win=65152 Len=17 TSval=3721986114 TSecr=1597726406
1712099139.803476095   206 0.554939810    10.10.1.2 → 10.10.1.1    TCP 83 56128 → 8081 [PSH, ACK] Seq=460 Ack=460 Win=64256 Len=17 TSval=1597726407 TSecr=3721986114
1712099141.803476095   208 0.555074510    10.10.1.1 → 10.10.1.2    TCP 83 8081 → 56128 [PSH, ACK] Seq=460 Ack=477 Win=65152 Len=17 TSval=3721986116 TSecr=1597726407
1712099145.803476095   212 0.556281721    10.10.1.2 → 10.10.1.1    TCP 83 56128 → 8081 [PSH, ACK] Seq=477 Ack=477 Win=64256 Len=17 TSval=1597726409 TSecr=3721986116
1712099147.803476095   214 0.556410514    10.10.1.1 → 10.10.1.2    TCP 83 8081 → 56128 [PSH, ACK] Seq=477 Ack=494 Win=65152 Len=17 TSval=3721986117 TSecr=1597726409
1712099153.803476095   220 0.557618440    10.10.1.2 → 10.10.1.1    TCP 83 56128 → 8081 [PSH, ACK] Seq=494 Ack=494 Win=64256 Len=17 TSval=1597726410 TSecr=3721986117
1712099154.803476095   221 0.557745337    10.10.1.1 → 10.10.1.2    TCP 83 8081 → 56128 [PSH, ACK] Seq=494 Ack=511 Win=65152 Len=17 TSval=3721986118 TSecr=1597726410
1712099159.803476095   226 0.558950044    10.10.1.2 → 10.10.1.1    TCP 83 56128 → 8081 [PSH, ACK] Seq=511 Ack=511 Win=64256 Len=17 TSval=1597726411 TSecr=3721986118
1712099161.803476095   228 0.559075532    10.10.1.1 → 10.10.1.2    TCP 83 8081 → 56128 [PSH, ACK] Seq=511 Ack=528 Win=65152 Len=17 TSval=3721986120 TSecr=1597726411
1712099166.803476095   233 0.560280928    10.10.1.2 → 10.10.1.1    TCP 83 56128 → 8081 [PSH, ACK] Seq=528 Ack=528 Win=64256 Len=17 TSval=1597726413 TSecr=3721986120
1712099167.803476095   234 0.560409273    10.10.1.1 → 10.10.1.2    TCP 83 8081 → 56128 [PSH, ACK] Seq=528 Ack=545 Win=65152 Len=17 TSval=3721986121 TSecr=1597726413
1712099171.803476095   238 0.561617553    10.10.1.2 → 10.10.1.1    TCP 83 56128 → 8081 [PSH, ACK] Seq=545 Ack=545 Win=64256 Len=17 TSval=1597726414 TSecr=3721986121
1712099173.803476095   240 0.561746896    10.10.1.1 → 10.10.1.2    TCP 83 8081 → 56128 [PSH, ACK] Seq=545 Ack=562 Win=65152 Len=17 TSval=3721986122 TSecr=1597726414
1712099178.803476095   245 0.562951459    10.10.1.2 → 10.10.1.1    TCP 83 56128 → 8081 [PSH, ACK] Seq=562 Ack=562 Win=64256 Len=17 TSval=1597726415 TSecr=3721986122
1712099180.803476095   247 0.563076413    10.10.1.1 → 10.10.1.2    TCP 83 8081 → 56128 [PSH, ACK] Seq=562 Ack=579 Win=65152 Len=17 TSval=3721986124 TSecr=1597726415
1712099184.803476095   251 0.564280416    10.10.1.2 → 10.10.1.1    TCP 83 56128 → 8081 [PSH, ACK] Seq=579 Ack=579 Win=64256 Len=17 TSval=1597726417 TSecr=3721986124
1712099186.803476095   253 0.564403014    10.10.1.1 → 10.10.1.2    TCP 83 8081 → 56128 [PSH, ACK] Seq=579 Ack=596 Win=65152 Len=17 TSval=3721986125 TSecr=1597726417
1712099191.803476095   258 0.565610567    10.10.1.2 → 10.10.1.1    TCP 83 56128 → 8081 [PSH, ACK] Seq=596 Ack=596 Win=64256 Len=17 TSval=1597726418 TSecr=3721986125
1712099193.803476095   260 0.565734645    10.10.1.1 → 10.10.1.2    TCP 83 8081 → 56128 [PSH, ACK] Seq=596 Ack=613 Win=65152 Len=17 TSval=3721986126 TSecr=1597726418
1712099197.803476095   264 0.566938953    10.10.1.2 → 10.10.1.1    TCP 83 56128 → 8081 [PSH, ACK] Seq=613 Ack=613 Win=64256 Len=17 TSval=1597726419 TSecr=3721986126
1712099199.803476095   266 0.567065323    10.10.1.1 → 10.10.1.2    TCP 83 8081 → 56128 [PSH, ACK] Seq=613 Ack=630 Win=65152 Len=17 TSval=3721986128 TSecr=1597726419
1712099204.803476095   271 0.568270296    10.10.1.2 → 10.10.1.1    TCP 83 56128 → 8081 [PSH, ACK] Seq=630 Ack=630 Win=64256 Len=17 TSval=1597726421 TSecr=3721986128
1712099206.803476095   273 0.568401245    10.10.1.1 → 10.10.1.2    TCP 83 8081 → 56128 [PSH, ACK] Seq=630 Ack=647 Win=65152 Len=17 TSval=3721986129 TSecr=1597726421
1712099210.803476095   277 0.569609212    10.10.1.2 → 10.10.1.1    TCP 83 56128 → 8081 [PSH, ACK] Seq=647 Ack=647 Win=64256 Len=17 TSval=1597726422 TSecr=3721986129
1712099212.803476095   279 0.569742600    10.10.1.1 → 10.10.1.2    TCP 83 8081 → 56128 [PSH, ACK] Seq=647 Ack=664 Win=65152 Len=17 TSval=3721986130 TSecr=1597726422
1712099217.803476095   284 0.570947119    10.10.1.2 → 10.10.1.1    TCP 83 56128 → 8081 [PSH, ACK] Seq=664 Ack=664 Win=64256 Len=17 TSval=1597726423 TSecr=3721986130
1712099219.803476095   286 0.571073477    10.10.1.1 → 10.10.1.2    TCP 83 8081 → 56128 [PSH, ACK] Seq=664 Ack=681 Win=65152 Len=17 TSval=3721986132 TSecr=1597726423
1712099223.803476095   290 0.572277598    10.10.1.2 → 10.10.1.1    TCP 83 56128 → 8081 [PSH, ACK] Seq=681 Ack=681 Win=64256 Len=17 TSval=1597726425 TSecr=3721986132
1712099225.803476095   292 0.572403506    10.10.1.1 → 10.10.1.2    TCP 83 8081 → 56128 [PSH, ACK] Seq=681 Ack=698 Win=65152 Len=17 TSval=3721986133 TSecr=1597726425
1712099230.803476095   297 0.573610862    10.10.1.2 → 10.10.1.1    TCP 83 56128 → 8081 [PSH, ACK] Seq=698 Ack=698 Win=64256 Len=17 TSval=1597726426 TSecr=3721986133
1712099232.803476095   299 0.573739613    10.10.1.1 → 10.10.1.2    TCP 83 8081 → 56128 [PSH, ACK] Seq=698 Ack=715 Win=65152 Len=17 TSval=3721986134 TSecr=1597726426
1712099236.803476095   303 0.574945070    10.10.1.2 → 10.10.1.1    TCP 83 56128 → 8081 [PSH, ACK] Seq=715 Ack=715 Win=64256 Len=17 TSval=1597726427 TSecr=3721986134
1712099238.803476095   305 0.575070701    10.10.1.1 → 10.10.1.2    TCP 83 8081 → 56128 [PSH, ACK] Seq=715 Ack=732 Win=65152 Len=17 TSval=3721986136 TSecr=1597726427
1712099243.803476095   310 0.576275488    10.10.1.2 → 10.10.1.1    TCP 83 56128 → 8081 [PSH, ACK] Seq=732 Ack=732 Win=64256 Len=17 TSval=1597726429 TSecr=3721986136
1712099245.803476095   312 0.576398701    10.10.1.1 → 10.10.1.2    TCP 83 8081 → 56128 [PSH, ACK] Seq=732 Ack=749 Win=65152 Len=17 TSval=3721986137 TSecr=1597726429
1712099249.803476095   316 0.577606290    10.10.1.2 → 10.10.1.1    TCP 83 56128 → 8081 [PSH, ACK] Seq=749 Ack=749 Win=64256 Len=17 TSval=1597726430 TSecr=3721986137
1712099251.803476095   318 0.577732051    10.10.1.1 → 10.10.1.2    TCP 83 8081 → 56128 [PSH, ACK] Seq=749 Ack=766 Win=65152 Len=17 TSval=3721986138 TSecr=1597726430
1712099256.803476095   323 0.578936107    10.10.1.2 → 10.10.1.1    TCP 83 56128 → 8081 [PSH, ACK] Seq=766 Ack=766 Win=64256 Len=17 TSval=1597726431 TSecr=3721986138
1712099258.803476095   325 0.579061566    10.10.1.1 → 10.10.1.2    TCP 83 8081 → 56128 [PSH, ACK] Seq=766 Ack=783 Win=65152 Len=17 TSval=3721986140 TSecr=1597726431
1712099262.803476095   329 0.580268165    10.10.1.2 → 10.10.1.1    TCP 83 56128 → 8081 [PSH, ACK] Seq=783 Ack=783 Win=64256 Len=17 TSval=1597726433 TSecr=3721986140
1712099264.803476095   331 0.580398304    10.10.1.1 → 10.10.1.2    TCP 83 8081 → 56128 [PSH, ACK] Seq=783 Ack=800 Win=65152 Len=17 TSval=3721986141 TSecr=1597726433
1712099269.803476095   336 0.581606774    10.10.1.2 → 10.10.1.1    TCP 83 56128 → 8081 [PSH, ACK] Seq=800 Ack=800 Win=64256 Len=17 TSval=1597726434 TSecr=3721986141
1712099271.803476095   338 0.581747322    10.10.1.1 → 10.10.1.2    TCP 83 8081 → 56128 [PSH, ACK] Seq=800 Ack=817 Win=65152 Len=17 TSval=3721986142 TSecr=1597726434
1712099275.803476095   342 0.582952029    10.10.1.2 → 10.10.1.1    TCP 83 56128 → 8081 [PSH, ACK] Seq=817 Ack=817 Win=64256 Len=17 TSval=1597726435 TSecr=3721986142
1712099277.803476095   344 0.583086851    10.10.1.1 → 10.10.1.2    TCP 83 8081 → 56128 [PSH, ACK] Seq=817 Ack=834 Win=65152 Len=17 TSval=3721986144 TSecr=1597726435
1712099282.803476095   349 0.584292736    10.10.1.2 → 10.10.1.1    TCP 83 56128 → 8081 [PSH, ACK] Seq=834 Ack=834 Win=64256 Len=17 TSval=1597726437 TSecr=3721986144
1712099284.803476095   351 0.584418804    10.10.1.1 → 10.10.1.2    TCP 83 8081 → 56128 [PSH, ACK] Seq=834 Ack=851 Win=65152 Len=17 TSval=3721986145 TSecr=1597726437
1712099288.803476095   355 0.585625605    10.10.1.2 → 10.10.1.1    TCP 83 56128 → 8081 [PSH, ACK] Seq=851 Ack=851 Win=64256 Len=17 TSval=1597726438 TSecr=3721986145
1712099290.803476095   357 0.585768780    10.10.1.1 → 10.10.1.2    TCP 83 8081 → 56128 [PSH, ACK] Seq=851 Ack=868 Win=65152 Len=17 TSval=3721986146 TSecr=1597726438
1712099295.803476095   362 0.586973277    10.10.1.2 → 10.10.1.1    TCP 83 56128 → 8081 [PSH, ACK] Seq=868 Ack=868 Win=64256 Len=17 TSval=1597726439 TSecr=3721986146
1712099297.803476095   364 0.587108774    10.10.1.1 → 10.10.1.2    TCP 83 8081 → 56128 [PSH, ACK] Seq=868 Ack=885 Win=65152 Len=17 TSval=3721986148 TSecr=1597726439
1712099301.803476095   368 0.588321765    10.10.1.2 → 10.10.1.1    TCP 83 56128 → 8081 [PSH, ACK] Seq=885 Ack=885 Win=64256 Len=17 TSval=1597726441 TSecr=3721986148
1712099303.803476095   370 0.588453161    10.10.1.1 → 10.10.1.2    TCP 83 8081 → 56128 [PSH, ACK] Seq=885 Ack=902 Win=65152 Len=17 TSval=3721986149 TSecr=1597726441
1712099308.803476095   375 0.589661688    10.10.1.2 → 10.10.1.1    TCP 83 56128 → 8081 [PSH, ACK] Seq=902 Ack=902 Win=64256 Len=17 TSval=1597726442 TSecr=3721986149
1712099310.803476095   377 0.589795774    10.10.1.1 → 10.10.1.2    TCP 83 8081 → 56128 [PSH, ACK] Seq=902 Ack=919 Win=65152 Len=17 TSval=3721986150 TSecr=1597726442
1712099314.803476095   381 0.591000710    10.10.1.2 → 10.10.1.1    TCP 83 56128 → 8081 [PSH, ACK] Seq=919 Ack=919 Win=64256 Len=17 TSval=1597726443 TSecr=3721986150
1712099316.803476095   383 0.591122613    10.10.1.1 → 10.10.1.2    TCP 83 8081 → 56128 [PSH, ACK] Seq=919 Ack=936 Win=65152 Len=17 TSval=3721986152 TSecr=1597726443
1712099321.803476095   388 0.592330648    10.10.1.2 → 10.10.1.1    TCP 83 56128 → 8081 [PSH, ACK] Seq=936 Ack=936 Win=64256 Len=17 TSval=1597726445 TSecr=3721986152
1712099323.803476095   390 0.592452307    10.10.1.1 → 10.10.1.2    TCP 83 8081 → 56128 [PSH, ACK] Seq=936 Ack=953 Win=65152 Len=17 TSval=3721986153 TSecr=1597726445
1712099327.803476095   394 0.593655847    10.10.1.2 → 10.10.1.1    TCP 83 56128 → 8081 [PSH, ACK] Seq=953 Ack=953 Win=64256 Len=17 TSval=1597726446 TSecr=3721986153
1712099330.803476095   397 0.593847890    10.10.1.1 → 10.10.1.2    TCP 83 8081 → 56128 [PSH, ACK] Seq=953 Ack=970 Win=65152 Len=17 TSval=3721986155 TSecr=1597726446
1712099334.803476095   401 0.595051536    10.10.1.2 → 10.10.1.1    TCP 83 56128 → 8081 [PSH, ACK] Seq=970 Ack=970 Win=64256 Len=17 TSval=1597726447 TSecr=3721986155
1712099336.803476095   403 0.595182280    10.10.1.1 → 10.10.1.2    TCP 83 8081 → 56128 [PSH, ACK] Seq=970 Ack=987 Win=65152 Len=17 TSval=3721986156 TSecr=1597726447
1712099340.803476095   407 0.596389189    10.10.1.2 → 10.10.1.1    TCP 83 56128 → 8081 [PSH, ACK] Seq=987 Ack=987 Win=64256 Len=17 TSval=1597726449 TSecr=3721986156
1712099342.803476095   409 0.596510776    10.10.1.1 → 10.10.1.2    TCP 83 8081 → 56128 [PSH, ACK] Seq=987 Ack=1004 Win=65152 Len=17 TSval=3721986157 TSecr=1597726449
1712099347.803476095   414 0.597668806    10.10.1.2 → 10.10.1.1    TCP 83 56128 → 8081 [PSH, ACK] Seq=1004 Ack=1004 Win=64256 Len=17 TSval=1597726450 TSecr=3721986157
1712099349.803476095   416 0.597798288    10.10.1.1 → 10.10.1.2    TCP 83 8081 → 56128 [PSH, ACK] Seq=1004 Ack=1021 Win=65152 Len=17 TSval=3721986158 TSecr=1597726450
1712099353.803476095   420 0.599003302    10.10.1.2 → 10.10.1.1    TCP 83 56128 → 8081 [PSH, ACK] Seq=1021 Ack=1021 Win=64256 Len=17 TSval=1597726451 TSecr=3721986158
1712099355.803476095   422 0.599132447    10.10.1.1 → 10.10.1.2    TCP 83 8081 → 56128 [PSH, ACK] Seq=1021 Ack=1038 Win=65152 Len=17 TSval=3721986160 TSecr=1597726451
1712099361.803476095   428 0.600339899    10.10.1.2 → 10.10.1.1    TCP 83 56128 → 8081 [PSH, ACK] Seq=1038 Ack=1038 Win=64256 Len=17 TSval=1597726453 TSecr=3721986160
1712099362.803476095   429 0.600461154    10.10.1.1 → 10.10.1.2    TCP 83 8081 → 56128 [PSH, ACK] Seq=1038 Ack=1055 Win=65152 Len=17 TSval=3721986161 TSecr=1597726453
1712099366.803476095   433 0.601665435    10.10.1.2 → 10.10.1.1    TCP 83 56128 → 8081 [PSH, ACK] Seq=1055 Ack=1055 Win=64256 Len=17 TSval=1597726454 TSecr=3721986161
1712099368.803476095   435 0.601799509    10.10.1.1 → 10.10.1.2    TCP 83 8081 → 56128 [PSH, ACK] Seq=1055 Ack=1072 Win=65152 Len=17 TSval=3721986162 TSecr=1597726454
1712099373.803476095   440 0.603002638    10.10.1.2 → 10.10.1.1    TCP 83 56128 → 8081 [PSH, ACK] Seq=1072 Ack=1072 Win=64256 Len=17 TSval=1597726455 TSecr=3721986162
1712099375.803476095   442 0.603124010    10.10.1.1 → 10.10.1.2    TCP 83 8081 → 56128 [PSH, ACK] Seq=1072 Ack=1089 Win=65152 Len=17 TSval=3721986164 TSecr=1597726455
1712099380.803476095   447 0.604331526    10.10.1.2 → 10.10.1.1    TCP 83 56128 → 8081 [PSH, ACK] Seq=1089 Ack=1089 Win=64256 Len=17 TSval=1597726457 TSecr=3721986164
1712099382.803476095   449 0.604453119    10.10.1.1 → 10.10.1.2    TCP 83 8081 → 56128 [PSH, ACK] Seq=1089 Ack=1106 Win=65152 Len=17 TSval=3721986165 TSecr=1597726457
1712099386.803476095   453 0.605657828    10.10.1.2 → 10.10.1.1    TCP 83 56128 → 8081 [PSH, ACK] Seq=1106 Ack=1106 Win=64256 Len=17 TSval=1597726458 TSecr=3721986165
1712099388.803476095   455 0.605783542    10.10.1.1 → 10.10.1.2    TCP 83 8081 → 56128 [PSH, ACK] Seq=1106 Ack=1123 Win=65152 Len=17 TSval=3721986166 TSecr=1597726458
1712099392.803476095   459 0.606987406    10.10.1.2 → 10.10.1.1    TCP 83 56128 → 8081 [PSH, ACK] Seq=1123 Ack=1123 Win=64256 Len=17 TSval=1597726459 TSecr=3721986166
1712099394.803476095   461 0.607109484    10.10.1.1 → 10.10.1.2    TCP 83 8081 → 56128 [PSH, ACK] Seq=1123 Ack=1140 Win=65152 Len=17 TSval=3721986168 TSecr=1597726459
1712099399.803476095   466 0.608316801    10.10.1.2 → 10.10.1.1    TCP 83 56128 → 8081 [PSH, ACK] Seq=1140 Ack=1140 Win=64256 Len=17 TSval=1597726461 TSecr=3721986168
1712099401.803476095   468 0.608448083    10.10.1.1 → 10.10.1.2    TCP 83 8081 → 56128 [PSH, ACK] Seq=1140 Ack=1157 Win=65152 Len=17 TSval=3721986169 TSecr=1597726461
1712099405.803476095   472 0.609655230    10.10.1.2 → 10.10.1.1    TCP 83 56128 → 8081 [PSH, ACK] Seq=1157 Ack=1157 Win=64256 Len=17 TSval=1597726462 TSecr=3721986169
1712099407.803476095   474 0.609781500    10.10.1.1 → 10.10.1.2    TCP 83 8081 → 56128 [PSH, ACK] Seq=1157 Ack=1174 Win=65152 Len=17 TSval=3721986170 TSecr=1597726462
1712099412.803476095   479 0.610985508    10.10.1.2 → 10.10.1.1    TCP 83 56128 → 8081 [PSH, ACK] Seq=1174 Ack=1174 Win=64256 Len=17 TSval=1597726463 TSecr=3721986170
1712099414.803476095   481 0.611116529    10.10.1.1 → 10.10.1.2    TCP 83 8081 → 56128 [PSH, ACK] Seq=1174 Ack=1191 Win=65152 Len=17 TSval=3721986172 TSecr=1597726463
1712099418.803476095   485 0.612325638    10.10.1.2 → 10.10.1.1    TCP 83 56128 → 8081 [PSH, ACK] Seq=1191 Ack=1191 Win=64256 Len=17 TSval=1597726465 TSecr=3721986172
1712099420.803476095   487 0.612447617    10.10.1.1 → 10.10.1.2    TCP 83 8081 → 56128 [PSH, ACK] Seq=1191 Ack=1208 Win=65152 Len=17 TSval=3721986173 TSecr=1597726465
1712099425.803476095   492 0.613652729    10.10.1.2 → 10.10.1.1    TCP 83 56128 → 8081 [PSH, ACK] Seq=1208 Ack=1208 Win=64256 Len=17 TSval=1597726466 TSecr=3721986173
1712099427.803476095   494 0.613793635    10.10.1.1 → 10.10.1.2    TCP 83 8081 → 56128 [PSH, ACK] Seq=1208 Ack=1225 Win=65152 Len=17 TSval=3721986174 TSecr=1597726466
1712099431.803476095   498 0.614997891    10.10.1.2 → 10.10.1.1    TCP 83 56128 → 8081 [PSH, ACK] Seq=1225 Ack=1225 Win=64256 Len=17 TSval=1597726467 TSecr=3721986174
1712099433.803476095   500 0.615120116    10.10.1.1 → 10.10.1.2    TCP 83 8081 → 56128 [PSH, ACK] Seq=1225 Ack=1242 Win=65152 Len=17 TSval=3721986176 TSecr=1597726467
1712099438.803476095   505 0.616328919    10.10.1.2 → 10.10.1.1    TCP 83 56128 → 8081 [PSH, ACK] Seq=1242 Ack=1242 Win=64256 Len=17 TSval=1597726469 TSecr=3721986176
1712099440.803476095   507 0.616459101    10.10.1.1 → 10.10.1.2    TCP 83 8081 → 56128 [PSH, ACK] Seq=1242 Ack=1259 Win=65152 Len=17 TSval=3721986177 TSecr=1597726469
1712099444.803476095   511 0.617663347    10.10.1.2 → 10.10.1.1    TCP 83 56128 → 8081 [PSH, ACK] Seq=1259 Ack=1259 Win=64256 Len=17 TSval=1597726470 TSecr=3721986177
1712099446.803476095   513 0.617787978    10.10.1.1 → 10.10.1.2    TCP 83 8081 → 56128 [PSH, ACK] Seq=1259 Ack=1276 Win=65152 Len=17 TSval=3721986178 TSecr=1597726470
1712099451.803476095   518 0.618991648    10.10.1.2 → 10.10.1.1    TCP 83 56128 → 8081 [PSH, ACK] Seq=1276 Ack=1276 Win=64256 Len=17 TSval=1597726471 TSecr=3721986178
1712099453.803476095   520 0.619122135    10.10.1.1 → 10.10.1.2    TCP 83 8081 → 56128 [PSH, ACK] Seq=1276 Ack=1293 Win=65152 Len=17 TSval=3721986180 TSecr=1597726471
1712099457.803476095   524 0.620329693    10.10.1.2 → 10.10.1.1    TCP 83 56128 → 8081 [PSH, ACK] Seq=1293 Ack=1293 Win=64256 Len=17 TSval=1597726473 TSecr=3721986180
1712099459.803476095   526 0.620450831    10.10.1.1 → 10.10.1.2    TCP 83 8081 → 56128 [PSH, ACK] Seq=1293 Ack=1310 Win=65152 Len=17 TSval=3721986181 TSecr=1597726473
1712099464.803476095   531 0.621654697    10.10.1.2 → 10.10.1.1    TCP 83 56128 → 8081 [PSH, ACK] Seq=1310 Ack=1310 Win=64256 Len=17 TSval=1597726474 TSecr=3721986181
1712099466.803476095   533 0.621781373    10.10.1.1 → 10.10.1.2    TCP 83 8081 → 56128 [PSH, ACK] Seq=1310 Ack=1327 Win=65152 Len=17 TSval=3721986182 TSecr=1597726474
1712099470.803476095   537 0.622985209    10.10.1.2 → 10.10.1.1    TCP 83 56128 → 8081 [PSH, ACK] Seq=1327 Ack=1327 Win=64256 Len=17 TSval=1597726475 TSecr=3721986182
1712099472.803476095   539 0.623114951    10.10.1.1 → 10.10.1.2    TCP 83 8081 → 56128 [PSH, ACK] Seq=1327 Ack=1344 Win=65152 Len=17 TSval=3721986184 TSecr=1597726475
1712099477.803476095   544 0.624349632    10.10.1.2 → 10.10.1.1    TCP 83 56128 → 8081 [PSH, ACK] Seq=1344 Ack=1344 Win=64256 Len=17 TSval=1597726477 TSecr=3721986184
1712099479.803476095   546 0.624476442    10.10.1.1 → 10.10.1.2    TCP 83 8081 → 56128 [PSH, ACK] Seq=1344 Ack=1361 Win=65152 Len=17 TSval=3721986185 TSecr=1597726477
1712099483.803476095   550 0.625682350    10.10.1.2 → 10.10.1.1    TCP 83 56128 → 8081 [PSH, ACK] Seq=1361 Ack=1361 Win=64256 Len=17 TSval=1597726478 TSecr=3721986185
1712099485.803476095   552 0.625812308    10.10.1.1 → 10.10.1.2    TCP 83 8081 → 56128 [PSH, ACK] Seq=1361 Ack=1378 Win=65152 Len=17 TSval=3721986186 TSecr=1597726478
1712099490.803476095   557 0.627016534    10.10.1.2 → 10.10.1.1    TCP 83 56128 → 8081 [PSH, ACK] Seq=1378 Ack=1378 Win=64256 Len=17 TSval=1597726479 TSecr=3721986186
1712099492.803476095   559 0.627137515    10.10.1.1 → 10.10.1.2    TCP 83 8081 → 56128 [PSH, ACK] Seq=1378 Ack=1395 Win=65152 Len=17 TSval=3721986188 TSecr=1597726479
1712099496.803476095   563 0.628344001    10.10.1.2 → 10.10.1.1    TCP 83 56128 → 8081 [PSH, ACK] Seq=1395 Ack=1395 Win=64256 Len=17 TSval=1597726481 TSecr=3721986188
1712099498.803476095   565 0.628474667    10.10.1.1 → 10.10.1.2    TCP 83 8081 → 56128 [PSH, ACK] Seq=1395 Ack=1412 Win=65152 Len=17 TSval=3721986189 TSecr=1597726481
1712099503.803476095   570 0.629678445    10.10.1.2 → 10.10.1.1    TCP 83 56128 → 8081 [PSH, ACK] Seq=1412 Ack=1412 Win=64256 Len=17 TSval=1597726482 TSecr=3721986189
1712099505.803476095   572 0.629803434    10.10.1.1 → 10.10.1.2    TCP 83 8081 → 56128 [PSH, ACK] Seq=1412 Ack=1429 Win=65152 Len=17 TSval=3721986190 TSecr=1597726482
1712099509.803476095   576 0.631006788    10.10.1.2 → 10.10.1.1    TCP 83 56128 → 8081 [PSH, ACK] Seq=1429 Ack=1429 Win=64256 Len=17 TSval=1597726483 TSecr=3721986190
1712099511.803476095   578 0.631138303    10.10.1.1 → 10.10.1.2    TCP 83 8081 → 56128 [PSH, ACK] Seq=1429 Ack=1446 Win=65152 Len=17 TSval=3721986192 TSecr=1597726483
1712099516.803476095   583 0.632346011    10.10.1.2 → 10.10.1.1    TCP 83 56128 → 8081 [PSH, ACK] Seq=1446 Ack=1446 Win=64256 Len=17 TSval=1597726485 TSecr=3721986192
1712099518.803476095   585 0.632467381    10.10.1.1 → 10.10.1.2    TCP 83 8081 → 56128 [PSH, ACK] Seq=1446 Ack=1463 Win=65152 Len=17 TSval=3721986193 TSecr=1597726485
1712099522.803476095   589 0.633672650    10.10.1.2 → 10.10.1.1    TCP 83 56128 → 8081 [PSH, ACK] Seq=1463 Ack=1463 Win=64256 Len=17 TSval=1597726486 TSecr=3721986193
1712099524.803476095   591 0.633806288    10.10.1.1 → 10.10.1.2    TCP 83 8081 → 56128 [PSH, ACK] Seq=1463 Ack=1480 Win=65152 Len=17 TSval=3721986194 TSecr=1597726486
1712099529.803476095   596 0.635017461    10.10.1.2 → 10.10.1.1    TCP 83 56128 → 8081 [PSH, ACK] Seq=1480 Ack=1480 Win=64256 Len=17 TSval=1597726487 TSecr=3721986194
1712099531.803476095   598 0.635138243    10.10.1.1 → 10.10.1.2    TCP 83 8081 → 56128 [PSH, ACK] Seq=1480 Ack=1497 Win=65152 Len=17 TSval=3721986196 TSecr=1597726487
1712099535.803476095   602 0.636346530    10.10.1.2 → 10.10.1.1    TCP 83 56128 → 8081 [PSH, ACK] Seq=1497 Ack=1497 Win=64256 Len=17 TSval=1597726489 TSecr=3721986196
1712099537.803476095   604 0.636476481    10.10.1.1 → 10.10.1.2    TCP 83 8081 → 56128 [PSH, ACK] Seq=1497 Ack=1514 Win=65152 Len=17 TSval=3721986197 TSecr=1597726489
1712099542.803476095   609 0.637695134    10.10.1.2 → 10.10.1.1    TCP 83 56128 → 8081 [PSH, ACK] Seq=1514 Ack=1514 Win=64256 Len=17 TSval=1597726490 TSecr=3721986197
1712099544.803476095   611 0.637824510    10.10.1.1 → 10.10.1.2    TCP 83 8081 → 56128 [PSH, ACK] Seq=1514 Ack=1531 Win=65152 Len=17 TSval=3721986198 TSecr=1597726490
1712099548.803476095   615 0.639029390    10.10.1.2 → 10.10.1.1    TCP 83 56128 → 8081 [PSH, ACK] Seq=1531 Ack=1531 Win=64256 Len=17 TSval=1597726491 TSecr=3721986198
1712099550.803476095   617 0.639150717    10.10.1.1 → 10.10.1.2    TCP 83 8081 → 56128 [PSH, ACK] Seq=1531 Ack=1548 Win=65152 Len=17 TSval=3721986200 TSecr=1597726491
1712099555.803476095   622 0.640359461    10.10.1.2 → 10.10.1.1    TCP 83 56128 → 8081 [PSH, ACK] Seq=1548 Ack=1548 Win=64256 Len=17 TSval=1597726493 TSecr=3721986200
1712099557.803476095   624 0.640481171    10.10.1.1 → 10.10.1.2    TCP 83 8081 → 56128 [PSH, ACK] Seq=1548 Ack=1565 Win=65152 Len=17 TSval=3721986201 TSecr=1597726493
1712099561.803476095   628 0.641688911    10.10.1.2 → 10.10.1.1    TCP 83 56128 → 8081 [PSH, ACK] Seq=1565 Ack=1565 Win=64256 Len=17 TSval=1597726494 TSecr=3721986201
1712099563.803476095   630 0.641822373    10.10.1.1 → 10.10.1.2    TCP 83 8081 → 56128 [PSH, ACK] Seq=1565 Ack=1582 Win=65152 Len=17 TSval=3721986202 TSecr=1597726494
1712099568.803476095   635 0.643027044    10.10.1.2 → 10.10.1.1    TCP 83 56128 → 8081 [PSH, ACK] Seq=1582 Ack=1582 Win=64256 Len=17 TSval=1597726495 TSecr=3721986202
1712099570.803476095   637 0.643148691    10.10.1.1 → 10.10.1.2    TCP 83 8081 → 56128 [PSH, ACK] Seq=1582 Ack=1599 Win=65152 Len=17 TSval=3721986204 TSecr=1597726495
1712099574.803476095   641 0.644358138    10.10.1.2 → 10.10.1.1    TCP 83 56128 → 8081 [PSH, ACK] Seq=1599 Ack=1599 Win=64256 Len=17 TSval=1597726497 TSecr=3721986204
1712099576.803476095   643 0.644489745    10.10.1.1 → 10.10.1.2    TCP 83 8081 → 56128 [PSH, ACK] Seq=1599 Ack=1616 Win=65152 Len=17 TSval=3721986205 TSecr=1597726497
1712099581.803476095   648 0.645694569    10.10.1.2 → 10.10.1.1    TCP 83 56128 → 8081 [PSH, ACK] Seq=1616 Ack=1616 Win=64256 Len=17 TSval=1597726498 TSecr=3721986205
1712099583.803476095   650 0.645826342    10.10.1.1 → 10.10.1.2    TCP 83 8081 → 56128 [PSH, ACK] Seq=1616 Ack=1633 Win=65152 Len=17 TSval=3721986206 TSecr=1597726498
1712099587.803476095   654 0.647030460    10.10.1.2 → 10.10.1.1    TCP 83 56128 → 8081 [PSH, ACK] Seq=1633 Ack=1633 Win=64256 Len=17 TSval=1597726499 TSecr=3721986206
1712099589.803476095   656 0.647161705    10.10.1.1 → 10.10.1.2    TCP 83 8081 → 56128 [PSH, ACK] Seq=1633 Ack=1650 Win=65152 Len=17 TSval=3721986208 TSecr=1597726499
1712099594.803476095   661 0.648369558    10.10.1.2 → 10.10.1.1    TCP 83 56128 → 8081 [PSH, ACK] Seq=1650 Ack=1650 Win=64256 Len=17 TSval=1597726501 TSecr=3721986208
1712099596.803476095   663 0.648491063    10.10.1.1 → 10.10.1.2    TCP 83 8081 → 56128 [PSH, ACK] Seq=1650 Ack=1667 Win=65152 Len=17 TSval=3721986209 TSecr=1597726501
1712099600.803476095   667 0.649695254    10.10.1.2 → 10.10.1.1    TCP 83 56128 → 8081 [PSH, ACK] Seq=1667 Ack=1667 Win=64256 Len=17 TSval=1597726502 TSecr=3721986209
1712099603.803476095   670 0.649841510    10.10.1.1 → 10.10.1.2    TCP 83 8081 → 56128 [PSH, ACK] Seq=1667 Ack=1684 Win=65152 Len=17 TSval=3721986211 TSecr=1597726502
1712099607.803476095   674 0.651046528    10.10.1.2 → 10.10.1.1    TCP 83 56128 → 8081 [PSH, ACK] Seq=1684 Ack=1684 Win=64256 Len=17 TSval=1597726503 TSecr=3721986211
1712099609.803476095   676 0.651168699    10.10.1.1 → 10.10.1.2    TCP 83 8081 → 56128 [PSH, ACK] Seq=1684 Ack=1701 Win=65152 Len=17 TSval=3721986212 TSecr=1597726503
1712099613.803476095   680 0.652376190    10.10.1.2 → 10.10.1.1    TCP 83 56128 → 8081 [PSH, ACK] Seq=1701 Ack=1701 Win=64256 Len=17 TSval=1597726505 TSecr=3721986212
1712099615.803476095   682 0.652505865    10.10.1.1 → 10.10.1.2    TCP 83 8081 → 56128 [PSH, ACK] Seq=1701 Ack=1718 Win=65152 Len=17 TSval=3721986213 TSecr=1597726505
1712099620.803476095   687 0.653710650    10.10.1.2 → 10.10.1.1    TCP 83 56128 → 8081 [PSH, ACK] Seq=1718 Ack=1718 Win=64256 Len=17 TSval=1597726506 TSecr=3721986213
1712099622.803476095   689 0.653843479    10.10.1.1 → 10.10.1.2    TCP 83 8081 → 56128 [PSH, ACK] Seq=1718 Ack=1735 Win=65152 Len=17 TSval=3721986215 TSecr=1597726506
1712099626.803476095   693 0.655047796    10.10.1.2 → 10.10.1.1    TCP 83 56128 → 8081 [PSH, ACK] Seq=1735 Ack=1735 Win=64256 Len=17 TSval=1597726507 TSecr=3721986215
1712099628.803476095   695 0.655169817    10.10.1.1 → 10.10.1.2    TCP 83 8081 → 56128 [PSH, ACK] Seq=1735 Ack=1752 Win=65152 Len=17 TSval=3721986216 TSecr=1597726507
1712099633.803476095   700 0.656378214    10.10.1.2 → 10.10.1.1    TCP 83 56128 → 8081 [PSH, ACK] Seq=1752 Ack=1752 Win=64256 Len=17 TSval=1597726509 TSecr=3721986216
1712099635.803476095   702 0.656499591    10.10.1.1 → 10.10.1.2    TCP 83 8081 → 56128 [PSH, ACK] Seq=1752 Ack=1769 Win=65152 Len=17 TSval=3721986217 TSecr=1597726509
1712099639.803476095   706 0.657703767    10.10.1.2 → 10.10.1.1    TCP 83 56128 → 8081 [PSH, ACK] Seq=1769 Ack=1769 Win=64256 Len=17 TSval=1597726510 TSecr=3721986217
1712099641.803476095   708 0.657835864    10.10.1.1 → 10.10.1.2    TCP 83 8081 → 56128 [PSH, ACK] Seq=1769 Ack=1786 Win=65152 Len=17 TSval=3721986219 TSecr=1597726510
1712099646.803476095   713 0.659040316    10.10.1.2 → 10.10.1.1    TCP 83 56128 → 8081 [PSH, ACK] Seq=1786 Ack=1786 Win=64256 Len=17 TSval=1597726511 TSecr=3721986219
1712099648.803476095   715 0.659170267    10.10.1.1 → 10.10.1.2    TCP 83 8081 → 56128 [PSH, ACK] Seq=1786 Ack=1803 Win=65152 Len=17 TSval=3721986220 TSecr=1597726511
1712099652.803476095   719 0.660378207    10.10.1.2 → 10.10.1.1    TCP 83 56128 → 8081 [PSH, ACK] Seq=1803 Ack=1803 Win=64256 Len=17 TSval=1597726513 TSecr=3721986220
1712099654.803476095   721 0.660509865    10.10.1.1 → 10.10.1.2    TCP 83 8081 → 56128 [PSH, ACK] Seq=1803 Ack=1820 Win=65152 Len=17 TSval=3721986221 TSecr=1597726513
1712099659.803476095   726 0.661714498    10.10.1.2 → 10.10.1.1    TCP 83 56128 → 8081 [PSH, ACK] Seq=1820 Ack=1820 Win=64256 Len=17 TSval=1597726514 TSecr=3721986221
1712099661.803476095   728 0.661847987    10.10.1.1 → 10.10.1.2    TCP 83 8081 → 56128 [PSH, ACK] Seq=1820 Ack=1837 Win=65152 Len=17 TSval=3721986223 TSecr=1597726514
1712099665.803476095   732 0.663052876    10.10.1.2 → 10.10.1.1    TCP 83 56128 → 8081 [PSH, ACK] Seq=1837 Ack=1837 Win=64256 Len=17 TSval=1597726515 TSecr=3721986223
1712099667.803476095   734 0.663174281    10.10.1.1 → 10.10.1.2    TCP 83 8081 → 56128 [PSH, ACK] Seq=1837 Ack=1854 Win=65152 Len=17 TSval=3721986224 TSecr=1597726515
1712099672.803476095   739 0.664381968    10.10.1.2 → 10.10.1.1    TCP 83 56128 → 8081 [PSH, ACK] Seq=1854 Ack=1854 Win=64256 Len=17 TSval=1597726517 TSecr=3721986224
1712099674.803476095   741 0.664511566    10.10.1.1 → 10.10.1.2    TCP 83 8081 → 56128 [PSH, ACK] Seq=1854 Ack=1871 Win=65152 Len=17 TSval=3721986225 TSecr=1597726517
1712099678.803476095   745 0.665726860    10.10.1.2 → 10.10.1.1    TCP 83 56128 → 8081 [PSH, ACK] Seq=1871 Ack=1871 Win=64256 Len=17 TSval=1597726518 TSecr=3721986225
1712099680.803476095   747 0.665855942    10.10.1.1 → 10.10.1.2    TCP 83 8081 → 56128 [PSH, ACK] Seq=1871 Ack=1888 Win=65152 Len=17 TSval=3721986227 TSecr=1597726518
1712099685.803476095   752 0.667060985    10.10.1.2 → 10.10.1.1    TCP 83 56128 → 8081 [PSH, ACK] Seq=1888 Ack=1888 Win=64256 Len=17 TSval=1597726519 TSecr=3721986227
1712099687.803476095   754 0.667183042    10.10.1.1 → 10.10.1.2    TCP 83 8081 → 56128 [PSH, ACK] Seq=1888 Ack=1905 Win=65152 Len=17 TSval=3721986228 TSecr=1597726519
1712099691.803476095   758 0.668392403    10.10.1.2 → 10.10.1.1    TCP 83 56128 → 8081 [PSH, ACK] Seq=1905 Ack=1905 Win=64256 Len=17 TSval=1597726521 TSecr=3721986228
1712099693.803476095   760 0.668513298    10.10.1.1 → 10.10.1.2    TCP 83 8081 → 56128 [PSH, ACK] Seq=1905 Ack=1922 Win=65152 Len=17 TSval=3721986229 TSecr=1597726521
1712099698.803476095   765 0.669718394    10.10.1.2 → 10.10.1.1    TCP 83 56128 → 8081 [PSH, ACK] Seq=1922 Ack=1922 Win=64256 Len=17 TSval=1597726522 TSecr=3721986229
1712099700.803476095   767 0.669900562    10.10.1.1 → 10.10.1.2    TCP 83 8081 → 56128 [PSH, ACK] Seq=1922 Ack=1939 Win=65152 Len=17 TSval=3721986231 TSecr=1597726522
1712099704.803476095   771 0.671105752    10.10.1.2 → 10.10.1.1    TCP 83 56128 → 8081 [PSH, ACK] Seq=1939 Ack=1939 Win=64256 Len=17 TSval=1597726523 TSecr=3721986231
1712099706.803476095   773 0.671236438    10.10.1.1 → 10.10.1.2    TCP 83 8081 → 56128 [PSH, ACK] Seq=1939 Ack=1956 Win=65152 Len=17 TSval=3721986232 TSecr=1597726523
1712099711.803476095   778 0.672444683    10.10.1.2 → 10.10.1.1    TCP 83 56128 → 8081 [PSH, ACK] Seq=1956 Ack=1956 Win=64256 Len=17 TSval=1597726525 TSecr=3721986232
1712099713.803476095   780 0.672566375    10.10.1.1 → 10.10.1.2    TCP 83 8081 → 56128 [PSH, ACK] Seq=1956 Ack=1973 Win=65152 Len=17 TSval=3721986233 TSecr=1597726525
1712099717.803476095   784 0.673771519    10.10.1.2 → 10.10.1.1    TCP 83 56128 → 8081 [PSH, ACK] Seq=1973 Ack=1973 Win=64256 Len=17 TSval=1597726526 TSecr=3721986233
1712099719.803476095   786 0.673901166    10.10.1.1 → 10.10.1.2    TCP 83 8081 → 56128 [PSH, ACK] Seq=1973 Ack=1990 Win=65152 Len=17 TSval=3721986235 TSecr=1597726526
1712099724.803476095   791 0.675106086    10.10.1.2 → 10.10.1.1    TCP 83 56128 → 8081 [PSH, ACK] Seq=1990 Ack=1990 Win=64256 Len=17 TSval=1597726527 TSecr=3721986235
1712099726.803476095   793 0.675234679    10.10.1.1 → 10.10.1.2    TCP 83 8081 → 56128 [PSH, ACK] Seq=1990 Ack=2007 Win=65152 Len=17 TSval=3721986236 TSecr=1597726527
1712099730.803476095   797 0.676442795    10.10.1.2 → 10.10.1.1    TCP 83 56128 → 8081 [PSH, ACK] Seq=2007 Ack=2007 Win=64256 Len=17 TSval=1597726529 TSecr=3721986236
1712099732.803476095   799 0.676574479    10.10.1.1 → 10.10.1.2    TCP 83 8081 → 56128 [PSH, ACK] Seq=2007 Ack=2024 Win=65152 Len=17 TSval=3721986237 TSecr=1597726529
1712099737.803476095   804 0.677779195    10.10.1.2 → 10.10.1.1    TCP 83 56128 → 8081 [PSH, ACK] Seq=2024 Ack=2024 Win=64256 Len=17 TSval=1597726530 TSecr=3721986237
1712099739.803476095   806 0.677912284    10.10.1.1 → 10.10.1.2    TCP 83 8081 → 56128 [PSH, ACK] Seq=2024 Ack=2041 Win=65152 Len=17 TSval=3721986239 TSecr=1597726530
1712099743.803476095   810 0.679116420    10.10.1.2 → 10.10.1.1    TCP 83 56128 → 8081 [PSH, ACK] Seq=2041 Ack=2041 Win=64256 Len=17 TSval=1597726531 TSecr=3721986239
