1711548360.768132925    22 0.283606798    10.10.1.2 → 10.10.1.1    TCP 74 34002 → 8081 [SYN] Seq=0 Win=64240 Len=0 MSS=1460 SACK_PERM=1 TSval=1047131100 TSecr=0 WS=128
1711548361.768132925    23 0.283636915    10.10.1.1 → 10.10.1.2    TCP 74 8081 → 34002 [SYN, ACK] Seq=0 Ack=1 Win=65160 Len=0 MSS=1460 SACK_PERM=1 TSval=3171390810 TSecr=1047131100 WS=128
1711548362.768132925    24 0.283673495    10.10.1.2 → 10.10.1.1    TCP 66 34002 → 8081 [ACK] Seq=1 Ack=1 Win=64256 Len=0 TSval=1047131100 TSecr=3171390810
1711548380.768132925    42 0.543156332    10.10.1.2 → 10.10.1.1    TCP 83 34002 → 8081 [PSH, ACK] Seq=1 Ack=1 Win=64256 Len=17 TSval=1047131359 TSecr=3171390810
1711548381.768132925    43 0.543170837    10.10.1.1 → 10.10.1.2    TCP 66 8081 → 34002 [ACK] Seq=1 Ack=18 Win=65152 Len=0 TSval=3171391070 TSecr=1047131359
1711548384.768132925    46 0.543337574    10.10.1.1 → 10.10.1.2    TCP 83 8081 → 34002 [PSH, ACK] Seq=1 Ack=18 Win=65152 Len=17 TSval=3171391070 TSecr=1047131359
1711548385.768132925    47 0.543363773    10.10.1.2 → 10.10.1.1    TCP 66 34002 → 8081 [ACK] Seq=18 Ack=18 Win=64256 Len=0 TSval=1047131359 TSecr=3171391070
1711548392.768132925    54 0.553504140    10.10.1.2 → 10.10.1.1    TCP 83 34002 → 8081 [PSH, ACK] Seq=18 Ack=18 Win=64256 Len=17 TSval=1047131369 TSecr=3171391070
1711548395.768132925    57 0.553542724    10.10.1.1 → 10.10.1.2    TCP 83 8081 → 34002 [PSH, ACK] Seq=18 Ack=35 Win=65152 Len=17 TSval=3171391080 TSecr=1047131369
1711548402.768132925    64 0.563709417    10.10.1.2 → 10.10.1.1    TCP 83 34002 → 8081 [PSH, ACK] Seq=35 Ack=35 Win=64256 Len=17 TSval=1047131380 TSecr=3171391080
1711548405.768132925    67 0.563746741    10.10.1.1 → 10.10.1.2    TCP 83 8081 → 34002 [PSH, ACK] Seq=35 Ack=52 Win=65152 Len=17 TSval=3171391090 TSecr=1047131380
1711548412.768132925    74 0.573910872    10.10.1.2 → 10.10.1.1    TCP 83 34002 → 8081 [PSH, ACK] Seq=52 Ack=52 Win=64256 Len=17 TSval=1047131390 TSecr=3171391090
1711548415.768132925    77 0.573946743    10.10.1.1 → 10.10.1.2    TCP 83 8081 → 34002 [PSH, ACK] Seq=52 Ack=69 Win=65152 Len=17 TSval=3171391100 TSecr=1047131390
1711548422.768132925    84 0.584112385    10.10.1.2 → 10.10.1.1    TCP 83 34002 → 8081 [PSH, ACK] Seq=69 Ack=69 Win=64256 Len=17 TSval=1047131400 TSecr=3171391100
1711548425.768132925    87 0.584150332    10.10.1.1 → 10.10.1.2    TCP 83 8081 → 34002 [PSH, ACK] Seq=69 Ack=86 Win=65152 Len=17 TSval=3171391111 TSecr=1047131400
1711548432.768132925    94 0.594315769    10.10.1.2 → 10.10.1.1    TCP 83 34002 → 8081 [PSH, ACK] Seq=86 Ack=86 Win=64256 Len=17 TSval=1047131410 TSecr=3171391111
1711548434.768132925    96 0.594353326    10.10.1.1 → 10.10.1.2    TCP 83 8081 → 34002 [PSH, ACK] Seq=86 Ack=103 Win=65152 Len=17 TSval=3171391121 TSecr=1047131410
1711548442.768132925   104 0.604516917    10.10.1.2 → 10.10.1.1    TCP 83 34002 → 8081 [PSH, ACK] Seq=103 Ack=103 Win=64256 Len=17 TSval=1047131420 TSecr=3171391121
1711548444.768132925   106 0.604554411    10.10.1.1 → 10.10.1.2    TCP 83 8081 → 34002 [PSH, ACK] Seq=103 Ack=120 Win=65152 Len=17 TSval=3171391131 TSecr=1047131420
1711548452.768132925   114 0.614718663    10.10.1.2 → 10.10.1.1    TCP 83 34002 → 8081 [PSH, ACK] Seq=120 Ack=120 Win=64256 Len=17 TSval=1047131431 TSecr=3171391131
1711548454.768132925   116 0.614754738    10.10.1.1 → 10.10.1.2    TCP 83 8081 → 34002 [PSH, ACK] Seq=120 Ack=137 Win=65152 Len=17 TSval=3171391141 TSecr=1047131431
1711548462.768132925   124 0.624917979    10.10.1.2 → 10.10.1.1    TCP 83 34002 → 8081 [PSH, ACK] Seq=137 Ack=137 Win=64256 Len=17 TSval=1047131441 TSecr=3171391141
1711548464.768132925   126 0.624954863    10.10.1.1 → 10.10.1.2    TCP 83 8081 → 34002 [PSH, ACK] Seq=137 Ack=154 Win=65152 Len=17 TSval=3171391151 TSecr=1047131441
1711548472.768132925   134 0.635117990    10.10.1.2 → 10.10.1.1    TCP 83 34002 → 8081 [PSH, ACK] Seq=154 Ack=154 Win=64256 Len=17 TSval=1047131451 TSecr=3171391151
1711548474.768132925   136 0.635153243    10.10.1.1 → 10.10.1.2    TCP 83 8081 → 34002 [PSH, ACK] Seq=154 Ack=171 Win=65152 Len=17 TSval=3171391162 TSecr=1047131451
1711548482.768132925   144 0.645314266    10.10.1.2 → 10.10.1.1    TCP 83 34002 → 8081 [PSH, ACK] Seq=171 Ack=171 Win=64256 Len=17 TSval=1047131461 TSecr=3171391162
1711548484.768132925   146 0.645351162    10.10.1.1 → 10.10.1.2    TCP 83 8081 → 34002 [PSH, ACK] Seq=171 Ack=188 Win=65152 Len=17 TSval=3171391172 TSecr=1047131461
1711548492.768132925   154 0.655513911    10.10.1.2 → 10.10.1.1    TCP 83 34002 → 8081 [PSH, ACK] Seq=188 Ack=188 Win=64256 Len=17 TSval=1047131471 TSecr=3171391172
1711548494.768132925   156 0.655548386    10.10.1.1 → 10.10.1.2    TCP 83 8081 → 34002 [PSH, ACK] Seq=188 Ack=205 Win=65152 Len=17 TSval=3171391182 TSecr=1047131471
1711548502.768132925   164 0.665711496    10.10.1.2 → 10.10.1.1    TCP 83 34002 → 8081 [PSH, ACK] Seq=205 Ack=205 Win=64256 Len=17 TSval=1047131482 TSecr=3171391182
1711548504.768132925   166 0.665746751    10.10.1.1 → 10.10.1.2    TCP 83 8081 → 34002 [PSH, ACK] Seq=205 Ack=222 Win=65152 Len=17 TSval=3171391192 TSecr=1047131482
1711548512.768132925   174 0.675911011    10.10.1.2 → 10.10.1.1    TCP 83 34002 → 8081 [PSH, ACK] Seq=222 Ack=222 Win=64256 Len=17 TSval=1047131492 TSecr=3171391192
1711548514.768132925   176 0.675946164    10.10.1.1 → 10.10.1.2    TCP 83 8081 → 34002 [PSH, ACK] Seq=222 Ack=239 Win=65152 Len=17 TSval=3171391202 TSecr=1047131492
1711548522.768132925   184 0.686108888    10.10.1.2 → 10.10.1.1    TCP 83 34002 → 8081 [PSH, ACK] Seq=239 Ack=239 Win=64256 Len=17 TSval=1047131502 TSecr=3171391202
1711548524.768132925   186 0.686144433    10.10.1.1 → 10.10.1.2    TCP 83 8081 → 34002 [PSH, ACK] Seq=239 Ack=256 Win=65152 Len=17 TSval=3171391213 TSecr=1047131502
1711548532.768132925   194 0.696307228    10.10.1.2 → 10.10.1.1    TCP 83 34002 → 8081 [PSH, ACK] Seq=256 Ack=256 Win=64256 Len=17 TSval=1047131512 TSecr=3171391213
1711548534.768132925   196 0.696342532    10.10.1.1 → 10.10.1.2    TCP 83 8081 → 34002 [PSH, ACK] Seq=256 Ack=273 Win=65152 Len=17 TSval=3171391223 TSecr=1047131512
1711548542.768132925   204 0.706502893    10.10.1.2 → 10.10.1.1    TCP 83 34002 → 8081 [PSH, ACK] Seq=273 Ack=273 Win=64256 Len=17 TSval=1047131522 TSecr=3171391223
1711548544.768132925   206 0.706536967    10.10.1.1 → 10.10.1.2    TCP 83 8081 → 34002 [PSH, ACK] Seq=273 Ack=290 Win=65152 Len=17 TSval=3171391233 TSecr=1047131522
1711548552.768132925   214 0.716698185    10.10.1.2 → 10.10.1.1    TCP 83 34002 → 8081 [PSH, ACK] Seq=290 Ack=290 Win=64256 Len=17 TSval=1047131533 TSecr=3171391233
1711548554.768132925   216 0.716734904    10.10.1.1 → 10.10.1.2    TCP 83 8081 → 34002 [PSH, ACK] Seq=290 Ack=307 Win=65152 Len=17 TSval=3171391243 TSecr=1047131533
1711548562.768132925   224 0.726894911    10.10.1.2 → 10.10.1.1    TCP 83 34002 → 8081 [PSH, ACK] Seq=307 Ack=307 Win=64256 Len=17 TSval=1047131543 TSecr=3171391243
1711548564.768132925   226 0.726930155    10.10.1.1 → 10.10.1.2    TCP 83 8081 → 34002 [PSH, ACK] Seq=307 Ack=324 Win=65152 Len=17 TSval=3171391253 TSecr=1047131543
1711548572.768132925   234 0.737090845    10.10.1.2 → 10.10.1.1    TCP 83 34002 → 8081 [PSH, ACK] Seq=324 Ack=324 Win=64256 Len=17 TSval=1047131553 TSecr=3171391253
1711548574.768132925   236 0.737126529    10.10.1.1 → 10.10.1.2    TCP 83 8081 → 34002 [PSH, ACK] Seq=324 Ack=341 Win=65152 Len=17 TSval=3171391264 TSecr=1047131553
1711548582.768132925   244 0.747290215    10.10.1.2 → 10.10.1.1    TCP 83 34002 → 8081 [PSH, ACK] Seq=341 Ack=341 Win=64256 Len=17 TSval=1047131563 TSecr=3171391264
1711548584.768132925   246 0.747325463    10.10.1.1 → 10.10.1.2    TCP 83 8081 → 34002 [PSH, ACK] Seq=341 Ack=358 Win=65152 Len=17 TSval=3171391274 TSecr=1047131563
1711548592.768132925   254 0.757487036    10.10.1.2 → 10.10.1.1    TCP 83 34002 → 8081 [PSH, ACK] Seq=358 Ack=358 Win=64256 Len=17 TSval=1047131573 TSecr=3171391274
1711548594.768132925   256 0.757521489    10.10.1.1 → 10.10.1.2    TCP 83 8081 → 34002 [PSH, ACK] Seq=358 Ack=375 Win=65152 Len=17 TSval=3171391284 TSecr=1047131573
1711548602.768132925   264 0.767683540    10.10.1.2 → 10.10.1.1    TCP 83 34002 → 8081 [PSH, ACK] Seq=375 Ack=375 Win=64256 Len=17 TSval=1047131584 TSecr=3171391284
1711548604.768132925   266 0.767719168    10.10.1.1 → 10.10.1.2    TCP 83 8081 → 34002 [PSH, ACK] Seq=375 Ack=392 Win=65152 Len=17 TSval=3171391294 TSecr=1047131584
1711548612.768132925   274 0.777881581    10.10.1.2 → 10.10.1.1    TCP 83 34002 → 8081 [PSH, ACK] Seq=392 Ack=392 Win=64256 Len=17 TSval=1047131594 TSecr=3171391294
1711548614.768132925   276 0.777916026    10.10.1.1 → 10.10.1.2    TCP 83 8081 → 34002 [PSH, ACK] Seq=392 Ack=409 Win=65152 Len=17 TSval=3171391304 TSecr=1047131594
1711548622.768132925   284 0.788078766    10.10.1.2 → 10.10.1.1    TCP 83 34002 → 8081 [PSH, ACK] Seq=409 Ack=409 Win=64256 Len=17 TSval=1047131604 TSecr=3171391304
1711548624.768132925   286 0.788114549    10.10.1.1 → 10.10.1.2    TCP 83 8081 → 34002 [PSH, ACK] Seq=409 Ack=426 Win=65152 Len=17 TSval=3171391315 TSecr=1047131604
1711548632.768132925   294 0.798275336    10.10.1.2 → 10.10.1.1    TCP 83 34002 → 8081 [PSH, ACK] Seq=426 Ack=426 Win=64256 Len=17 TSval=1047131614 TSecr=3171391315
1711548634.768132925   296 0.798310449    10.10.1.1 → 10.10.1.2    TCP 83 8081 → 34002 [PSH, ACK] Seq=426 Ack=443 Win=65152 Len=17 TSval=3171391325 TSecr=1047131614
1711548642.768132925   304 0.808471236    10.10.1.2 → 10.10.1.1    TCP 83 34002 → 8081 [PSH, ACK] Seq=443 Ack=443 Win=64256 Len=17 TSval=1047131624 TSecr=3171391325
1711548644.768132925   306 0.808505950    10.10.1.1 → 10.10.1.2    TCP 83 8081 → 34002 [PSH, ACK] Seq=443 Ack=460 Win=65152 Len=17 TSval=3171391335 TSecr=1047131624
1711548652.768132925   314 0.818665997    10.10.1.2 → 10.10.1.1    TCP 83 34002 → 8081 [PSH, ACK] Seq=460 Ack=460 Win=64256 Len=17 TSval=1047131635 TSecr=3171391335
1711548654.768132925   316 0.818705044    10.10.1.1 → 10.10.1.2    TCP 83 8081 → 34002 [PSH, ACK] Seq=460 Ack=477 Win=65152 Len=17 TSval=3171391345 TSecr=1047131635
1711548662.768132925   324 0.828865392    10.10.1.2 → 10.10.1.1    TCP 83 34002 → 8081 [PSH, ACK] Seq=477 Ack=477 Win=64256 Len=17 TSval=1047131645 TSecr=3171391345
1711548664.768132925   326 0.828901147    10.10.1.1 → 10.10.1.2    TCP 83 8081 → 34002 [PSH, ACK] Seq=477 Ack=494 Win=65152 Len=17 TSval=3171391355 TSecr=1047131645
1711548672.768132925   334 0.839062562    10.10.1.2 → 10.10.1.1    TCP 83 34002 → 8081 [PSH, ACK] Seq=494 Ack=494 Win=64256 Len=17 TSval=1047131655 TSecr=3171391355
1711548674.768132925   336 0.839097531    10.10.1.1 → 10.10.1.2    TCP 83 8081 → 34002 [PSH, ACK] Seq=494 Ack=511 Win=65152 Len=17 TSval=3171391366 TSecr=1047131655
1711548682.768132925   344 0.849257979    10.10.1.2 → 10.10.1.1    TCP 83 34002 → 8081 [PSH, ACK] Seq=511 Ack=511 Win=64256 Len=17 TSval=1047131665 TSecr=3171391366
1711548684.768132925   346 0.849293520    10.10.1.1 → 10.10.1.2    TCP 83 8081 → 34002 [PSH, ACK] Seq=511 Ack=528 Win=65152 Len=17 TSval=3171391376 TSecr=1047131665
1711548692.768132925   354 0.859454265    10.10.1.2 → 10.10.1.1    TCP 83 34002 → 8081 [PSH, ACK] Seq=528 Ack=528 Win=64256 Len=17 TSval=1047131675 TSecr=3171391376
1711548694.768132925   356 0.859488769    10.10.1.1 → 10.10.1.2    TCP 83 8081 → 34002 [PSH, ACK] Seq=528 Ack=545 Win=65152 Len=17 TSval=3171391386 TSecr=1047131675
1711548702.768132925   364 0.869649528    10.10.1.2 → 10.10.1.1    TCP 83 34002 → 8081 [PSH, ACK] Seq=545 Ack=545 Win=64256 Len=17 TSval=1047131686 TSecr=3171391386
1711548704.768132925   366 0.869684633    10.10.1.1 → 10.10.1.2    TCP 83 8081 → 34002 [PSH, ACK] Seq=545 Ack=562 Win=65152 Len=17 TSval=3171391396 TSecr=1047131686
1711548712.768132925   374 0.879845417    10.10.1.2 → 10.10.1.1    TCP 83 34002 → 8081 [PSH, ACK] Seq=562 Ack=562 Win=64256 Len=17 TSval=1047131696 TSecr=3171391396
1711548714.768132925   376 0.879880372    10.10.1.1 → 10.10.1.2    TCP 83 8081 → 34002 [PSH, ACK] Seq=562 Ack=579 Win=65152 Len=17 TSval=3171391406 TSecr=1047131696
1711548722.768132925   384 0.890043787    10.10.1.2 → 10.10.1.1    TCP 83 34002 → 8081 [PSH, ACK] Seq=579 Ack=579 Win=64256 Len=17 TSval=1047131706 TSecr=3171391406
1711548724.768132925   386 0.890078563    10.10.1.1 → 10.10.1.2    TCP 83 8081 → 34002 [PSH, ACK] Seq=579 Ack=596 Win=65152 Len=17 TSval=3171391417 TSecr=1047131706
1711548732.768132925   394 0.900240265    10.10.1.2 → 10.10.1.1    TCP 83 34002 → 8081 [PSH, ACK] Seq=596 Ack=596 Win=64256 Len=17 TSval=1047131716 TSecr=3171391417
1711548734.768132925   396 0.900276482    10.10.1.1 → 10.10.1.2    TCP 83 8081 → 34002 [PSH, ACK] Seq=596 Ack=613 Win=65152 Len=17 TSval=3171391427 TSecr=1047131716
1711548742.768132925   404 0.910438602    10.10.1.2 → 10.10.1.1    TCP 83 34002 → 8081 [PSH, ACK] Seq=613 Ack=613 Win=64256 Len=17 TSval=1047131726 TSecr=3171391427
1711548744.768132925   406 0.910474872    10.10.1.1 → 10.10.1.2    TCP 83 8081 → 34002 [PSH, ACK] Seq=613 Ack=630 Win=65152 Len=17 TSval=3171391437 TSecr=1047131726
1711548752.768132925   414 0.920635195    10.10.1.2 → 10.10.1.1    TCP 83 34002 → 8081 [PSH, ACK] Seq=630 Ack=630 Win=64256 Len=17 TSval=1047131737 TSecr=3171391437
1711548754.768132925   416 0.920670644    10.10.1.1 → 10.10.1.2    TCP 83 8081 → 34002 [PSH, ACK] Seq=630 Ack=647 Win=65152 Len=17 TSval=3171391447 TSecr=1047131737
1711548762.768132925   424 0.930831771    10.10.1.2 → 10.10.1.1    TCP 83 34002 → 8081 [PSH, ACK] Seq=647 Ack=647 Win=64256 Len=17 TSval=1047131747 TSecr=3171391447
1711548764.768132925   426 0.930867048    10.10.1.1 → 10.10.1.2    TCP 83 8081 → 34002 [PSH, ACK] Seq=647 Ack=664 Win=65152 Len=17 TSval=3171391457 TSecr=1047131747
1711548772.768132925   434 0.941028968    10.10.1.2 → 10.10.1.1    TCP 83 34002 → 8081 [PSH, ACK] Seq=664 Ack=664 Win=64256 Len=17 TSval=1047131757 TSecr=3171391457
1711548774.768132925   436 0.941065152    10.10.1.1 → 10.10.1.2    TCP 83 8081 → 34002 [PSH, ACK] Seq=664 Ack=681 Win=65152 Len=17 TSval=3171391468 TSecr=1047131757
1711548782.768132925   444 0.951229246    10.10.1.2 → 10.10.1.1    TCP 83 34002 → 8081 [PSH, ACK] Seq=681 Ack=681 Win=64256 Len=17 TSval=1047131767 TSecr=3171391468
1711548784.768132925   446 0.951264376    10.10.1.1 → 10.10.1.2    TCP 83 8081 → 34002 [PSH, ACK] Seq=681 Ack=698 Win=65152 Len=17 TSval=3171391478 TSecr=1047131767
1711548792.768132925   454 0.961424559    10.10.1.2 → 10.10.1.1    TCP 83 34002 → 8081 [PSH, ACK] Seq=698 Ack=698 Win=64256 Len=17 TSval=1047131777 TSecr=3171391478
1711548794.768132925   456 0.961459491    10.10.1.1 → 10.10.1.2    TCP 83 8081 → 34002 [PSH, ACK] Seq=698 Ack=715 Win=65152 Len=17 TSval=3171391488 TSecr=1047131777
1711548802.768132925   464 0.971622783    10.10.1.2 → 10.10.1.1    TCP 83 34002 → 8081 [PSH, ACK] Seq=715 Ack=715 Win=64256 Len=17 TSval=1047131788 TSecr=3171391488
1711548804.768132925   466 0.971660295    10.10.1.1 → 10.10.1.2    TCP 83 8081 → 34002 [PSH, ACK] Seq=715 Ack=732 Win=65152 Len=17 TSval=3171391498 TSecr=1047131788
1711548812.768132925   474 0.981819060    10.10.1.2 → 10.10.1.1    TCP 83 34002 → 8081 [PSH, ACK] Seq=732 Ack=732 Win=64256 Len=17 TSval=1047131798 TSecr=3171391498
1711548814.768132925   476 0.981854171    10.10.1.1 → 10.10.1.2    TCP 83 8081 → 34002 [PSH, ACK] Seq=732 Ack=749 Win=65152 Len=17 TSval=3171391508 TSecr=1047131798
1711548823.768132925   485 0.992016996    10.10.1.2 → 10.10.1.1    TCP 83 34002 → 8081 [PSH, ACK] Seq=749 Ack=749 Win=64256 Len=17 TSval=1047131808 TSecr=3171391508
1711548825.768132925   487 0.992052945    10.10.1.1 → 10.10.1.2    TCP 83 8081 → 34002 [PSH, ACK] Seq=749 Ack=766 Win=65152 Len=17 TSval=3171391519 TSecr=1047131808
1711548833.768132925   495 1.002214416    10.10.1.2 → 10.10.1.1    TCP 83 34002 → 8081 [PSH, ACK] Seq=766 Ack=766 Win=64256 Len=17 TSval=1047131818 TSecr=3171391519
1711548835.768132925   497 1.002249709    10.10.1.1 → 10.10.1.2    TCP 83 8081 → 34002 [PSH, ACK] Seq=766 Ack=783 Win=65152 Len=17 TSval=3171391529 TSecr=1047131818
1711548843.768132925   505 1.012413684    10.10.1.2 → 10.10.1.1    TCP 83 34002 → 8081 [PSH, ACK] Seq=783 Ack=783 Win=64256 Len=17 TSval=1047131828 TSecr=3171391529
1711548845.768132925   507 1.012448731    10.10.1.1 → 10.10.1.2    TCP 83 8081 → 34002 [PSH, ACK] Seq=783 Ack=800 Win=65152 Len=17 TSval=3171391539 TSecr=1047131828
1711548853.768132925   515 1.022610351    10.10.1.2 → 10.10.1.1    TCP 83 34002 → 8081 [PSH, ACK] Seq=800 Ack=800 Win=64256 Len=17 TSval=1047131839 TSecr=3171391539
1711548855.768132925   517 1.022644865    10.10.1.1 → 10.10.1.2    TCP 83 8081 → 34002 [PSH, ACK] Seq=800 Ack=817 Win=65152 Len=17 TSval=3171391549 TSecr=1047131839
1711548863.768132925   525 1.032805639    10.10.1.2 → 10.10.1.1    TCP 83 34002 → 8081 [PSH, ACK] Seq=817 Ack=817 Win=64256 Len=17 TSval=1047131849 TSecr=3171391549
1711548865.768132925   527 1.032840440    10.10.1.1 → 10.10.1.2    TCP 83 8081 → 34002 [PSH, ACK] Seq=817 Ack=834 Win=65152 Len=17 TSval=3171391559 TSecr=1047131849
1711548873.768132925   535 1.043002980    10.10.1.2 → 10.10.1.1    TCP 83 34002 → 8081 [PSH, ACK] Seq=834 Ack=834 Win=64256 Len=17 TSval=1047131859 TSecr=3171391559
1711548875.768132925   537 1.043038790    10.10.1.1 → 10.10.1.2    TCP 83 8081 → 34002 [PSH, ACK] Seq=834 Ack=851 Win=65152 Len=17 TSval=3171391570 TSecr=1047131859
1711548883.768132925   545 1.053201454    10.10.1.2 → 10.10.1.1    TCP 83 34002 → 8081 [PSH, ACK] Seq=851 Ack=851 Win=64256 Len=17 TSval=1047131869 TSecr=3171391570
1711548885.768132925   547 1.053236229    10.10.1.1 → 10.10.1.2    TCP 83 8081 → 34002 [PSH, ACK] Seq=851 Ack=868 Win=65152 Len=17 TSval=3171391580 TSecr=1047131869
1711548893.768132925   555 1.063398738    10.10.1.2 → 10.10.1.1    TCP 83 34002 → 8081 [PSH, ACK] Seq=868 Ack=868 Win=64256 Len=17 TSval=1047131879 TSecr=3171391580
1711548895.768132925   557 1.063434583    10.10.1.1 → 10.10.1.2    TCP 83 8081 → 34002 [PSH, ACK] Seq=868 Ack=885 Win=65152 Len=17 TSval=3171391590 TSecr=1047131879
1711548903.768132925   565 1.073567488    10.10.1.2 → 10.10.1.1    TCP 83 34002 → 8081 [PSH, ACK] Seq=885 Ack=885 Win=64256 Len=17 TSval=1047131890 TSecr=3171391590
1711548905.768132925   567 1.073602577    10.10.1.1 → 10.10.1.2    TCP 83 8081 → 34002 [PSH, ACK] Seq=885 Ack=902 Win=65152 Len=17 TSval=3171391600 TSecr=1047131890
1711548913.768132925   575 1.083764557    10.10.1.2 → 10.10.1.1    TCP 83 34002 → 8081 [PSH, ACK] Seq=902 Ack=902 Win=64256 Len=17 TSval=1047131900 TSecr=3171391600
1711548915.768132925   577 1.083799951    10.10.1.1 → 10.10.1.2    TCP 83 8081 → 34002 [PSH, ACK] Seq=902 Ack=919 Win=65152 Len=17 TSval=3171391610 TSecr=1047131900
1711548923.768132925   585 1.093963454    10.10.1.2 → 10.10.1.1    TCP 83 34002 → 8081 [PSH, ACK] Seq=919 Ack=919 Win=64256 Len=17 TSval=1047131910 TSecr=3171391610
1711548925.768132925   587 1.093998354    10.10.1.1 → 10.10.1.2    TCP 83 8081 → 34002 [PSH, ACK] Seq=919 Ack=936 Win=65152 Len=17 TSval=3171391620 TSecr=1047131910
1711548933.768132925   595 1.104159588    10.10.1.2 → 10.10.1.1    TCP 83 34002 → 8081 [PSH, ACK] Seq=936 Ack=936 Win=64256 Len=17 TSval=1047131920 TSecr=3171391620
1711548935.768132925   597 1.104199234    10.10.1.1 → 10.10.1.2    TCP 83 8081 → 34002 [PSH, ACK] Seq=936 Ack=953 Win=65152 Len=17 TSval=3171391631 TSecr=1047131920
1711548943.768132925   605 1.114360765    10.10.1.2 → 10.10.1.1    TCP 83 34002 → 8081 [PSH, ACK] Seq=953 Ack=953 Win=64256 Len=17 TSval=1047131930 TSecr=3171391631
1711548946.768132925   608 1.114433829    10.10.1.1 → 10.10.1.2    TCP 83 8081 → 34002 [PSH, ACK] Seq=953 Ack=970 Win=65152 Len=17 TSval=3171391641 TSecr=1047131930
1711548953.768132925   615 1.124596710    10.10.1.2 → 10.10.1.1    TCP 83 34002 → 8081 [PSH, ACK] Seq=970 Ack=970 Win=64256 Len=17 TSval=1047131941 TSecr=3171391641
1711548955.768132925   617 1.124632234    10.10.1.1 → 10.10.1.2    TCP 83 8081 → 34002 [PSH, ACK] Seq=970 Ack=987 Win=65152 Len=17 TSval=3171391651 TSecr=1047131941
1711548963.768132925   625 1.134793123    10.10.1.2 → 10.10.1.1    TCP 83 34002 → 8081 [PSH, ACK] Seq=987 Ack=987 Win=64256 Len=17 TSval=1047131951 TSecr=3171391651
1711548965.768132925   627 1.134830148    10.10.1.1 → 10.10.1.2    TCP 83 8081 → 34002 [PSH, ACK] Seq=987 Ack=1004 Win=65152 Len=17 TSval=3171391661 TSecr=1047131951
1711548973.768132925   635 1.144990920    10.10.1.2 → 10.10.1.1    TCP 83 34002 → 8081 [PSH, ACK] Seq=1004 Ack=1004 Win=64256 Len=17 TSval=1047131961 TSecr=3171391661
1711548975.768132925   637 1.145026446    10.10.1.1 → 10.10.1.2    TCP 83 8081 → 34002 [PSH, ACK] Seq=1004 Ack=1021 Win=65152 Len=17 TSval=3171391672 TSecr=1047131961
1711548983.768132925   645 1.155189292    10.10.1.2 → 10.10.1.1    TCP 83 34002 → 8081 [PSH, ACK] Seq=1021 Ack=1021 Win=64256 Len=17 TSval=1047131971 TSecr=3171391672
1711548985.768132925   647 1.155224366    10.10.1.1 → 10.10.1.2    TCP 83 8081 → 34002 [PSH, ACK] Seq=1021 Ack=1038 Win=65152 Len=17 TSval=3171391682 TSecr=1047131971
1711548993.768132925   655 1.165386659    10.10.1.2 → 10.10.1.1    TCP 83 34002 → 8081 [PSH, ACK] Seq=1038 Ack=1038 Win=64256 Len=17 TSval=1047131981 TSecr=3171391682
1711548995.768132925   657 1.165424280    10.10.1.1 → 10.10.1.2    TCP 83 8081 → 34002 [PSH, ACK] Seq=1038 Ack=1055 Win=65152 Len=17 TSval=3171391692 TSecr=1047131981
1711549003.768132925   665 1.175558832    10.10.1.2 → 10.10.1.1    TCP 83 34002 → 8081 [PSH, ACK] Seq=1055 Ack=1055 Win=64256 Len=17 TSval=1047131992 TSecr=3171391692
1711549005.768132925   667 1.175593818    10.10.1.1 → 10.10.1.2    TCP 83 8081 → 34002 [PSH, ACK] Seq=1055 Ack=1072 Win=65152 Len=17 TSval=3171391702 TSecr=1047131992
1711549013.768132925   675 1.185754561    10.10.1.2 → 10.10.1.1    TCP 83 34002 → 8081 [PSH, ACK] Seq=1072 Ack=1072 Win=64256 Len=17 TSval=1047132002 TSecr=3171391702
1711549015.768132925   677 1.185790317    10.10.1.1 → 10.10.1.2    TCP 83 8081 → 34002 [PSH, ACK] Seq=1072 Ack=1089 Win=65152 Len=17 TSval=3171391712 TSecr=1047132002
1711549023.768132925   685 1.195951017    10.10.1.2 → 10.10.1.1    TCP 83 34002 → 8081 [PSH, ACK] Seq=1089 Ack=1089 Win=64256 Len=17 TSval=1047132012 TSecr=3171391712
1711549025.768132925   687 1.195985772    10.10.1.1 → 10.10.1.2    TCP 83 8081 → 34002 [PSH, ACK] Seq=1089 Ack=1106 Win=65152 Len=17 TSval=3171391722 TSecr=1047132012
1711549033.768132925   695 1.206146206    10.10.1.2 → 10.10.1.1    TCP 83 34002 → 8081 [PSH, ACK] Seq=1106 Ack=1106 Win=64256 Len=17 TSval=1047132022 TSecr=3171391722
1711549035.768132925   697 1.206180996    10.10.1.1 → 10.10.1.2    TCP 83 8081 → 34002 [PSH, ACK] Seq=1106 Ack=1123 Win=65152 Len=17 TSval=3171391733 TSecr=1047132022
1711549043.768132925   705 1.216343130    10.10.1.2 → 10.10.1.1    TCP 83 34002 → 8081 [PSH, ACK] Seq=1123 Ack=1123 Win=64256 Len=17 TSval=1047132032 TSecr=3171391733
1711549045.768132925   707 1.216377924    10.10.1.1 → 10.10.1.2    TCP 83 8081 → 34002 [PSH, ACK] Seq=1123 Ack=1140 Win=65152 Len=17 TSval=3171391743 TSecr=1047132032
1711549053.768132925   715 1.226538210    10.10.1.2 → 10.10.1.1    TCP 83 34002 → 8081 [PSH, ACK] Seq=1140 Ack=1140 Win=64256 Len=17 TSval=1047132042 TSecr=3171391743
1711549055.768132925   717 1.226572099    10.10.1.1 → 10.10.1.2    TCP 83 8081 → 34002 [PSH, ACK] Seq=1140 Ack=1157 Win=65152 Len=17 TSval=3171391753 TSecr=1047132042
1711549063.768132925   725 1.236733577    10.10.1.2 → 10.10.1.1    TCP 83 34002 → 8081 [PSH, ACK] Seq=1157 Ack=1157 Win=64256 Len=17 TSval=1047132053 TSecr=3171391753
1711549065.768132925   727 1.236769358    10.10.1.1 → 10.10.1.2    TCP 83 8081 → 34002 [PSH, ACK] Seq=1157 Ack=1174 Win=65152 Len=17 TSval=3171391763 TSecr=1047132053
1711549073.768132925   735 1.246930226    10.10.1.2 → 10.10.1.1    TCP 83 34002 → 8081 [PSH, ACK] Seq=1174 Ack=1174 Win=64256 Len=17 TSval=1047132063 TSecr=3171391763
1711549075.768132925   737 1.246966023    10.10.1.1 → 10.10.1.2    TCP 83 8081 → 34002 [PSH, ACK] Seq=1174 Ack=1191 Win=65152 Len=17 TSval=3171391773 TSecr=1047132063
1711549083.768132925   745 1.257127946    10.10.1.2 → 10.10.1.1    TCP 83 34002 → 8081 [PSH, ACK] Seq=1191 Ack=1191 Win=64256 Len=17 TSval=1047132073 TSecr=3171391773
1711549085.768132925   747 1.257162821    10.10.1.1 → 10.10.1.2    TCP 83 8081 → 34002 [PSH, ACK] Seq=1191 Ack=1208 Win=65152 Len=17 TSval=3171391784 TSecr=1047132073
1711549093.768132925   755 1.267324515    10.10.1.2 → 10.10.1.1    TCP 83 34002 → 8081 [PSH, ACK] Seq=1208 Ack=1208 Win=64256 Len=17 TSval=1047132083 TSecr=3171391784
1711549095.768132925   757 1.267361170    10.10.1.1 → 10.10.1.2    TCP 83 8081 → 34002 [PSH, ACK] Seq=1208 Ack=1225 Win=65152 Len=17 TSval=3171391794 TSecr=1047132083
1711549103.768132925   765 1.277523828    10.10.1.2 → 10.10.1.1    TCP 83 34002 → 8081 [PSH, ACK] Seq=1225 Ack=1225 Win=64256 Len=17 TSval=1047132093 TSecr=3171391794
1711549105.768132925   767 1.277558921    10.10.1.1 → 10.10.1.2    TCP 83 8081 → 34002 [PSH, ACK] Seq=1225 Ack=1242 Win=65152 Len=17 TSval=3171391804 TSecr=1047132093
1711549113.768132925   775 1.287719643    10.10.1.2 → 10.10.1.1    TCP 83 34002 → 8081 [PSH, ACK] Seq=1242 Ack=1242 Win=64256 Len=17 TSval=1047132104 TSecr=3171391804
1711549115.768132925   777 1.287754554    10.10.1.1 → 10.10.1.2    TCP 83 8081 → 34002 [PSH, ACK] Seq=1242 Ack=1259 Win=65152 Len=17 TSval=3171391814 TSecr=1047132104
1711549123.768132925   785 1.297915269    10.10.1.2 → 10.10.1.1    TCP 83 34002 → 8081 [PSH, ACK] Seq=1259 Ack=1259 Win=64256 Len=17 TSval=1047132114 TSecr=3171391814
1711549125.768132925   787 1.297950173    10.10.1.1 → 10.10.1.2    TCP 83 8081 → 34002 [PSH, ACK] Seq=1259 Ack=1276 Win=65152 Len=17 TSval=3171391824 TSecr=1047132114
1711549133.768132925   795 1.308110278    10.10.1.2 → 10.10.1.1    TCP 83 34002 → 8081 [PSH, ACK] Seq=1276 Ack=1276 Win=64256 Len=17 TSval=1047132124 TSecr=3171391824
1711549135.768132925   797 1.308145341    10.10.1.1 → 10.10.1.2    TCP 83 8081 → 34002 [PSH, ACK] Seq=1276 Ack=1293 Win=65152 Len=17 TSval=3171391835 TSecr=1047132124
1711549143.768132925   805 1.318308164    10.10.1.2 → 10.10.1.1    TCP 83 34002 → 8081 [PSH, ACK] Seq=1293 Ack=1293 Win=64256 Len=17 TSval=1047132134 TSecr=3171391835
1711549145.768132925   807 1.318343516    10.10.1.1 → 10.10.1.2    TCP 83 8081 → 34002 [PSH, ACK] Seq=1293 Ack=1310 Win=65152 Len=17 TSval=3171391845 TSecr=1047132134
1711549153.768132925   815 1.328505816    10.10.1.2 → 10.10.1.1    TCP 83 34002 → 8081 [PSH, ACK] Seq=1310 Ack=1310 Win=64256 Len=17 TSval=1047132144 TSecr=3171391845
1711549155.768132925   817 1.328543749    10.10.1.1 → 10.10.1.2    TCP 83 8081 → 34002 [PSH, ACK] Seq=1310 Ack=1327 Win=65152 Len=17 TSval=3171391855 TSecr=1047132144
1711549163.768132925   825 1.338705812    10.10.1.2 → 10.10.1.1    TCP 83 34002 → 8081 [PSH, ACK] Seq=1327 Ack=1327 Win=64256 Len=17 TSval=1047132155 TSecr=3171391855
1711549165.768132925   827 1.338740790    10.10.1.1 → 10.10.1.2    TCP 83 8081 → 34002 [PSH, ACK] Seq=1327 Ack=1344 Win=65152 Len=17 TSval=3171391865 TSecr=1047132155
1711549173.768132925   835 1.348903429    10.10.1.2 → 10.10.1.1    TCP 83 34002 → 8081 [PSH, ACK] Seq=1344 Ack=1344 Win=64256 Len=17 TSval=1047132165 TSecr=3171391865
1711549175.768132925   837 1.348938490    10.10.1.1 → 10.10.1.2    TCP 83 8081 → 34002 [PSH, ACK] Seq=1344 Ack=1361 Win=65152 Len=17 TSval=3171391875 TSecr=1047132165
1711549183.768132925   845 1.359102426    10.10.1.2 → 10.10.1.1    TCP 83 34002 → 8081 [PSH, ACK] Seq=1361 Ack=1361 Win=64256 Len=17 TSval=1047132175 TSecr=3171391875
1711549185.768132925   847 1.359137352    10.10.1.1 → 10.10.1.2    TCP 83 8081 → 34002 [PSH, ACK] Seq=1361 Ack=1378 Win=65152 Len=17 TSval=3171391886 TSecr=1047132175
1711549193.768132925   855 1.369299041    10.10.1.2 → 10.10.1.1    TCP 83 34002 → 8081 [PSH, ACK] Seq=1378 Ack=1378 Win=64256 Len=17 TSval=1047132185 TSecr=3171391886
1711549195.768132925   857 1.369334018    10.10.1.1 → 10.10.1.2    TCP 83 8081 → 34002 [PSH, ACK] Seq=1378 Ack=1395 Win=65152 Len=17 TSval=3171391896 TSecr=1047132185
1711549203.768132925   865 1.379495389    10.10.1.2 → 10.10.1.1    TCP 83 34002 → 8081 [PSH, ACK] Seq=1395 Ack=1395 Win=64256 Len=17 TSval=1047132195 TSecr=3171391896
1711549205.768132925   867 1.379530309    10.10.1.1 → 10.10.1.2    TCP 83 8081 → 34002 [PSH, ACK] Seq=1395 Ack=1412 Win=65152 Len=17 TSval=3171391906 TSecr=1047132195
1711549213.768132925   875 1.389693544    10.10.1.2 → 10.10.1.1    TCP 83 34002 → 8081 [PSH, ACK] Seq=1412 Ack=1412 Win=64256 Len=17 TSval=1047132206 TSecr=3171391906
1711549215.768132925   877 1.389728613    10.10.1.1 → 10.10.1.2    TCP 83 8081 → 34002 [PSH, ACK] Seq=1412 Ack=1429 Win=65152 Len=17 TSval=3171391916 TSecr=1047132206
1711549223.768132925   885 1.399889708    10.10.1.2 → 10.10.1.1    TCP 83 34002 → 8081 [PSH, ACK] Seq=1429 Ack=1429 Win=64256 Len=17 TSval=1047132216 TSecr=3171391916
1711549225.768132925   887 1.399924397    10.10.1.1 → 10.10.1.2    TCP 83 8081 → 34002 [PSH, ACK] Seq=1429 Ack=1446 Win=65152 Len=17 TSval=3171391926 TSecr=1047132216
1711549233.768132925   895 1.410087437    10.10.1.2 → 10.10.1.1    TCP 83 34002 → 8081 [PSH, ACK] Seq=1446 Ack=1446 Win=64256 Len=17 TSval=1047132226 TSecr=3171391926
1711549235.768132925   897 1.410122129    10.10.1.1 → 10.10.1.2    TCP 83 8081 → 34002 [PSH, ACK] Seq=1446 Ack=1463 Win=65152 Len=17 TSval=3171391937 TSecr=1047132226
1711549243.768132925   905 1.420286409    10.10.1.2 → 10.10.1.1    TCP 83 34002 → 8081 [PSH, ACK] Seq=1463 Ack=1463 Win=64256 Len=17 TSval=1047132236 TSecr=3171391937
1711549245.768132925   907 1.420321303    10.10.1.1 → 10.10.1.2    TCP 83 8081 → 34002 [PSH, ACK] Seq=1463 Ack=1480 Win=65152 Len=17 TSval=3171391947 TSecr=1047132236
1711549253.768132925   915 1.430482251    10.10.1.2 → 10.10.1.1    TCP 83 34002 → 8081 [PSH, ACK] Seq=1480 Ack=1480 Win=64256 Len=17 TSval=1047132246 TSecr=3171391947
1711549255.768132925   917 1.430517098    10.10.1.1 → 10.10.1.2    TCP 83 8081 → 34002 [PSH, ACK] Seq=1480 Ack=1497 Win=65152 Len=17 TSval=3171391957 TSecr=1047132246
1711549263.768132925   925 1.440678707    10.10.1.2 → 10.10.1.1    TCP 83 34002 → 8081 [PSH, ACK] Seq=1497 Ack=1497 Win=64256 Len=17 TSval=1047132257 TSecr=3171391957
1711549265.768132925   927 1.440713352    10.10.1.1 → 10.10.1.2    TCP 83 8081 → 34002 [PSH, ACK] Seq=1497 Ack=1514 Win=65152 Len=17 TSval=3171391967 TSecr=1047132257
1711549273.768132925   935 1.450875894    10.10.1.2 → 10.10.1.1    TCP 83 34002 → 8081 [PSH, ACK] Seq=1514 Ack=1514 Win=64256 Len=17 TSval=1047132267 TSecr=3171391967
1711549275.768132925   937 1.450911082    10.10.1.1 → 10.10.1.2    TCP 83 8081 → 34002 [PSH, ACK] Seq=1514 Ack=1531 Win=65152 Len=17 TSval=3171391977 TSecr=1047132267
1711549283.768132925   945 1.461072319    10.10.1.2 → 10.10.1.1    TCP 83 34002 → 8081 [PSH, ACK] Seq=1531 Ack=1531 Win=64256 Len=17 TSval=1047132277 TSecr=3171391977
1711549285.768132925   947 1.461106862    10.10.1.1 → 10.10.1.2    TCP 83 8081 → 34002 [PSH, ACK] Seq=1531 Ack=1548 Win=65152 Len=17 TSval=3171391988 TSecr=1047132277
1711549293.768132925   955 1.471270086    10.10.1.2 → 10.10.1.1    TCP 83 34002 → 8081 [PSH, ACK] Seq=1548 Ack=1548 Win=64256 Len=17 TSval=1047132287 TSecr=3171391988
1711549295.768132925   957 1.471305029    10.10.1.1 → 10.10.1.2    TCP 83 8081 → 34002 [PSH, ACK] Seq=1548 Ack=1565 Win=65152 Len=17 TSval=3171391998 TSecr=1047132287
1711549303.768132925   965 1.481466013    10.10.1.2 → 10.10.1.1    TCP 83 34002 → 8081 [PSH, ACK] Seq=1565 Ack=1565 Win=64256 Len=17 TSval=1047132297 TSecr=3171391998
1711549305.768132925   967 1.481502761    10.10.1.1 → 10.10.1.2    TCP 83 8081 → 34002 [PSH, ACK] Seq=1565 Ack=1582 Win=65152 Len=17 TSval=3171392008 TSecr=1047132297
1711549313.768132925   975 1.491666035    10.10.1.2 → 10.10.1.1    TCP 83 34002 → 8081 [PSH, ACK] Seq=1582 Ack=1582 Win=64256 Len=17 TSval=1047132308 TSecr=3171392008
1711549315.768132925   977 1.491701215    10.10.1.1 → 10.10.1.2    TCP 83 8081 → 34002 [PSH, ACK] Seq=1582 Ack=1599 Win=65152 Len=17 TSval=3171392018 TSecr=1047132308
1711549323.768132925   985 1.501863211    10.10.1.2 → 10.10.1.1    TCP 83 34002 → 8081 [PSH, ACK] Seq=1599 Ack=1599 Win=64256 Len=17 TSval=1047132318 TSecr=3171392018
1711549325.768132925   987 1.501898730    10.10.1.1 → 10.10.1.2    TCP 83 8081 → 34002 [PSH, ACK] Seq=1599 Ack=1616 Win=65152 Len=17 TSval=3171392028 TSecr=1047132318
1711549333.768132925   995 1.512061268    10.10.1.2 → 10.10.1.1    TCP 83 34002 → 8081 [PSH, ACK] Seq=1616 Ack=1616 Win=64256 Len=17 TSval=1047132328 TSecr=3171392028
1711549335.768132925   997 1.512096124    10.10.1.1 → 10.10.1.2    TCP 83 8081 → 34002 [PSH, ACK] Seq=1616 Ack=1633 Win=65152 Len=17 TSval=3171392039 TSecr=1047132328
1711549343.768132925  1005 1.522256477    10.10.1.2 → 10.10.1.1    TCP 83 34002 → 8081 [PSH, ACK] Seq=1633 Ack=1633 Win=64256 Len=17 TSval=1047132338 TSecr=3171392039
1711549345.768132925  1007 1.522292087    10.10.1.1 → 10.10.1.2    TCP 83 8081 → 34002 [PSH, ACK] Seq=1633 Ack=1650 Win=65152 Len=17 TSval=3171392049 TSecr=1047132338
1711549353.768132925  1015 1.532453163    10.10.1.2 → 10.10.1.1    TCP 83 34002 → 8081 [PSH, ACK] Seq=1650 Ack=1650 Win=64256 Len=17 TSval=1047132348 TSecr=3171392049
1711549355.768132925  1017 1.532488697    10.10.1.1 → 10.10.1.2    TCP 83 8081 → 34002 [PSH, ACK] Seq=1650 Ack=1667 Win=65152 Len=17 TSval=3171392059 TSecr=1047132348
1711549363.768132925  1025 1.542649485    10.10.1.2 → 10.10.1.1    TCP 83 34002 → 8081 [PSH, ACK] Seq=1667 Ack=1667 Win=64256 Len=17 TSval=1047132359 TSecr=3171392059
1711549365.768132925  1027 1.542684700    10.10.1.1 → 10.10.1.2    TCP 83 8081 → 34002 [PSH, ACK] Seq=1667 Ack=1684 Win=65152 Len=17 TSval=3171392069 TSecr=1047132359
1711549373.768132925  1035 1.552845625    10.10.1.2 → 10.10.1.1    TCP 83 34002 → 8081 [PSH, ACK] Seq=1684 Ack=1684 Win=64256 Len=17 TSval=1047132369 TSecr=3171392069
1711549375.768132925  1037 1.552882096    10.10.1.1 → 10.10.1.2    TCP 83 8081 → 34002 [PSH, ACK] Seq=1684 Ack=1701 Win=65152 Len=17 TSval=3171392079 TSecr=1047132369
1711549383.768132925  1045 1.563044348    10.10.1.2 → 10.10.1.1    TCP 83 34002 → 8081 [PSH, ACK] Seq=1701 Ack=1701 Win=64256 Len=17 TSval=1047132379 TSecr=3171392079
1711549385.768132925  1047 1.563079829    10.10.1.1 → 10.10.1.2    TCP 83 8081 → 34002 [PSH, ACK] Seq=1701 Ack=1718 Win=65152 Len=17 TSval=3171392090 TSecr=1047132379
1711549393.768132925  1055 1.573242418    10.10.1.2 → 10.10.1.1    TCP 83 34002 → 8081 [PSH, ACK] Seq=1718 Ack=1718 Win=64256 Len=17 TSval=1047132389 TSecr=3171392090
1711549395.768132925  1057 1.573278058    10.10.1.1 → 10.10.1.2    TCP 83 8081 → 34002 [PSH, ACK] Seq=1718 Ack=1735 Win=65152 Len=17 TSval=3171392100 TSecr=1047132389
1711549403.768132925  1065 1.583440933    10.10.1.2 → 10.10.1.1    TCP 83 34002 → 8081 [PSH, ACK] Seq=1735 Ack=1735 Win=64256 Len=17 TSval=1047132399 TSecr=3171392100
1711549405.768132925  1067 1.583476671    10.10.1.1 → 10.10.1.2    TCP 83 8081 → 34002 [PSH, ACK] Seq=1735 Ack=1752 Win=65152 Len=17 TSval=3171392110 TSecr=1047132399
1711549413.768132925  1075 1.593639627    10.10.1.2 → 10.10.1.1    TCP 83 34002 → 8081 [PSH, ACK] Seq=1752 Ack=1752 Win=64256 Len=17 TSval=1047132410 TSecr=3171392110
1711549415.768132925  1077 1.593675368    10.10.1.1 → 10.10.1.2    TCP 83 8081 → 34002 [PSH, ACK] Seq=1752 Ack=1769 Win=65152 Len=17 TSval=3171392120 TSecr=1047132410
1711549423.768132925  1085 1.603837737    10.10.1.2 → 10.10.1.1    TCP 83 34002 → 8081 [PSH, ACK] Seq=1769 Ack=1769 Win=64256 Len=17 TSval=1047132420 TSecr=3171392120
1711549425.768132925  1087 1.603872872    10.10.1.1 → 10.10.1.2    TCP 83 8081 → 34002 [PSH, ACK] Seq=1769 Ack=1786 Win=65152 Len=17 TSval=3171392130 TSecr=1047132420
1711549433.768132925  1095 1.614035605    10.10.1.2 → 10.10.1.1    TCP 83 34002 → 8081 [PSH, ACK] Seq=1786 Ack=1786 Win=64256 Len=17 TSval=1047132430 TSecr=3171392130
1711549435.768132925  1097 1.614072296    10.10.1.1 → 10.10.1.2    TCP 83 8081 → 34002 [PSH, ACK] Seq=1786 Ack=1803 Win=65152 Len=17 TSval=3171392141 TSecr=1047132430
1711549443.768132925  1105 1.624234134    10.10.1.2 → 10.10.1.1    TCP 83 34002 → 8081 [PSH, ACK] Seq=1803 Ack=1803 Win=64256 Len=17 TSval=1047132440 TSecr=3171392141
1711549445.768132925  1107 1.624271454    10.10.1.1 → 10.10.1.2    TCP 83 8081 → 34002 [PSH, ACK] Seq=1803 Ack=1820 Win=65152 Len=17 TSval=3171392151 TSecr=1047132440
1711549453.768132925  1115 1.634432943    10.10.1.2 → 10.10.1.1    TCP 83 34002 → 8081 [PSH, ACK] Seq=1820 Ack=1820 Win=64256 Len=17 TSval=1047132450 TSecr=3171392151
1711549455.768132925  1117 1.634468193    10.10.1.1 → 10.10.1.2    TCP 83 8081 → 34002 [PSH, ACK] Seq=1820 Ack=1837 Win=65152 Len=17 TSval=3171392161 TSecr=1047132450
1711549463.768132925  1125 1.644632376    10.10.1.2 → 10.10.1.1    TCP 83 34002 → 8081 [PSH, ACK] Seq=1837 Ack=1837 Win=64256 Len=17 TSval=1047132461 TSecr=3171392161
1711549465.768132925  1127 1.644668433    10.10.1.1 → 10.10.1.2    TCP 83 8081 → 34002 [PSH, ACK] Seq=1837 Ack=1854 Win=65152 Len=17 TSval=3171392171 TSecr=1047132461
1711549473.768132925  1135 1.654831521    10.10.1.2 → 10.10.1.1    TCP 83 34002 → 8081 [PSH, ACK] Seq=1854 Ack=1854 Win=64256 Len=17 TSval=1047132471 TSecr=3171392171
1711549475.768132925  1137 1.654867112    10.10.1.1 → 10.10.1.2    TCP 83 8081 → 34002 [PSH, ACK] Seq=1854 Ack=1871 Win=65152 Len=17 TSval=3171392181 TSecr=1047132471
1711549483.768132925  1145 1.665029536    10.10.1.2 → 10.10.1.1    TCP 83 34002 → 8081 [PSH, ACK] Seq=1871 Ack=1871 Win=64256 Len=17 TSval=1047132481 TSecr=3171392181
1711549485.768132925  1147 1.665065011    10.10.1.1 → 10.10.1.2    TCP 83 8081 → 34002 [PSH, ACK] Seq=1871 Ack=1888 Win=65152 Len=17 TSval=3171392192 TSecr=1047132481
1711549493.768132925  1155 1.675227235    10.10.1.2 → 10.10.1.1    TCP 83 34002 → 8081 [PSH, ACK] Seq=1888 Ack=1888 Win=64256 Len=17 TSval=1047132491 TSecr=3171392192
1711549495.768132925  1157 1.675263376    10.10.1.1 → 10.10.1.2    TCP 83 8081 → 34002 [PSH, ACK] Seq=1888 Ack=1905 Win=65152 Len=17 TSval=3171392202 TSecr=1047132491
1711549503.768132925  1165 1.685425193    10.10.1.2 → 10.10.1.1    TCP 83 34002 → 8081 [PSH, ACK] Seq=1905 Ack=1905 Win=64256 Len=17 TSval=1047132501 TSecr=3171392202
1711549505.768132925  1167 1.685461759    10.10.1.1 → 10.10.1.2    TCP 83 8081 → 34002 [PSH, ACK] Seq=1905 Ack=1922 Win=65152 Len=17 TSval=3171392212 TSecr=1047132501
1711549513.768132925  1175 1.695623644    10.10.1.2 → 10.10.1.1    TCP 83 34002 → 8081 [PSH, ACK] Seq=1922 Ack=1922 Win=64256 Len=17 TSval=1047132512 TSecr=3171392212
1711549516.768132925  1178 1.695687800    10.10.1.1 → 10.10.1.2    TCP 83 8081 → 34002 [PSH, ACK] Seq=1922 Ack=1939 Win=65152 Len=17 TSval=3171392222 TSecr=1047132512
1711549523.768132925  1185 1.705847518    10.10.1.2 → 10.10.1.1    TCP 83 34002 → 8081 [PSH, ACK] Seq=1939 Ack=1939 Win=64256 Len=17 TSval=1047132522 TSecr=3171392222
1711549525.768132925  1187 1.705883108    10.10.1.1 → 10.10.1.2    TCP 83 8081 → 34002 [PSH, ACK] Seq=1939 Ack=1956 Win=65152 Len=17 TSval=3171392232 TSecr=1047132522
1711549533.768132925  1195 1.716045722    10.10.1.2 → 10.10.1.1    TCP 83 34002 → 8081 [PSH, ACK] Seq=1956 Ack=1956 Win=64256 Len=17 TSval=1047132532 TSecr=3171392232
1711549535.768132925  1197 1.716080957    10.10.1.1 → 10.10.1.2    TCP 83 8081 → 34002 [PSH, ACK] Seq=1956 Ack=1973 Win=65152 Len=17 TSval=3171392243 TSecr=1047132532
1711549543.768132925  1205 1.726243215    10.10.1.2 → 10.10.1.1    TCP 83 34002 → 8081 [PSH, ACK] Seq=1973 Ack=1973 Win=64256 Len=17 TSval=1047132542 TSecr=3171392243
1711549545.768132925  1207 1.726279151    10.10.1.1 → 10.10.1.2    TCP 83 8081 → 34002 [PSH, ACK] Seq=1973 Ack=1990 Win=65152 Len=17 TSval=3171392253 TSecr=1047132542
1711549553.768132925  1215 1.736440696    10.10.1.2 → 10.10.1.1    TCP 83 34002 → 8081 [PSH, ACK] Seq=1990 Ack=1990 Win=64256 Len=17 TSval=1047132552 TSecr=3171392253
1711549555.768132925  1217 1.736475227    10.10.1.1 → 10.10.1.2    TCP 83 8081 → 34002 [PSH, ACK] Seq=1990 Ack=2007 Win=65152 Len=17 TSval=3171392263 TSecr=1047132552
