1711546212.703675032    34 0.545677462    10.10.1.2 → 10.10.1.1    TCP 83 46400 → 8081 [PSH, ACK] Seq=1 Ack=1 Win=64256 Len=17 TSval=1044971357 TSecr=3169230798
1711546216.703675032    38 0.545976894    10.10.1.1 → 10.10.1.2    TCP 83 8081 → 46400 [PSH, ACK] Seq=1 Ack=18 Win=65152 Len=17 TSval=3169231065 TSecr=1044971357
1711546224.703675032    46 0.569574427    10.10.1.2 → 10.10.1.1    TCP 83 46400 → 8081 [PSH, ACK] Seq=18 Ack=18 Win=64256 Len=17 TSval=1044971381 TSecr=3169231065
1711546227.703675032    49 0.569707181    10.10.1.1 → 10.10.1.2    TCP 83 8081 → 46400 [PSH, ACK] Seq=18 Ack=35 Win=65152 Len=17 TSval=3169231089 TSecr=1044971381
1711546237.703675032    59 0.621615403    10.10.1.2 → 10.10.1.1    TCP 83 46400 → 8081 [PSH, ACK] Seq=35 Ack=35 Win=64256 Len=17 TSval=1044971433 TSecr=3169231089
1711546240.703675032    62 0.621740224    10.10.1.1 → 10.10.1.2    TCP 83 8081 → 46400 [PSH, ACK] Seq=35 Ack=52 Win=65152 Len=17 TSval=3169231141 TSecr=1044971433
1711546249.703675032    71 0.625992397    10.10.1.2 → 10.10.1.1    TCP 83 46400 → 8081 [PSH, ACK] Seq=52 Ack=52 Win=64256 Len=17 TSval=1044971437 TSecr=3169231141
1711546252.703675032    74 0.626120162    10.10.1.1 → 10.10.1.2    TCP 83 8081 → 46400 [PSH, ACK] Seq=52 Ack=69 Win=65152 Len=17 TSval=3169231146 TSecr=1044971437
1711546261.703675032    83 0.626857494    10.10.1.2 → 10.10.1.1    TCP 83 46400 → 8081 [PSH, ACK] Seq=69 Ack=69 Win=64256 Len=17 TSval=1044971438 TSecr=3169231146
1711546264.703675032    86 0.626995886    10.10.1.1 → 10.10.1.2    TCP 83 8081 → 46400 [PSH, ACK] Seq=69 Ack=86 Win=65152 Len=17 TSval=3169231146 TSecr=1044971438
1711546271.703675032    93 0.636005878    10.10.1.2 → 10.10.1.1    TCP 83 46400 → 8081 [PSH, ACK] Seq=86 Ack=86 Win=64256 Len=17 TSval=1044971447 TSecr=3169231146
1711546273.703675032    95 0.636136529    10.10.1.1 → 10.10.1.2    TCP 83 8081 → 46400 [PSH, ACK] Seq=86 Ack=103 Win=65152 Len=17 TSval=3169231156 TSecr=1044971447
1711546281.703675032   103 0.642531238    10.10.1.2 → 10.10.1.1    TCP 83 46400 → 8081 [PSH, ACK] Seq=103 Ack=103 Win=64256 Len=17 TSval=1044971454 TSecr=3169231156
1711546283.703675032   105 0.642662245    10.10.1.1 → 10.10.1.2    TCP 83 8081 → 46400 [PSH, ACK] Seq=103 Ack=120 Win=65152 Len=17 TSval=3169231162 TSecr=1044971454
1711546293.703675032   115 0.642984646    10.10.1.2 → 10.10.1.1    TCP 83 46400 → 8081 [PSH, ACK] Seq=120 Ack=120 Win=64256 Len=17 TSval=1044971454 TSecr=3169231162
1711546294.703675032   116 0.643029201    10.10.1.1 → 10.10.1.2    TCP 83 8081 → 46400 [PSH, ACK] Seq=120 Ack=137 Win=65152 Len=17 TSval=3169231163 TSecr=1044971454
1711546301.703675032   123 0.673914924    10.10.1.2 → 10.10.1.1    TCP 83 46400 → 8081 [PSH, ACK] Seq=137 Ack=137 Win=64256 Len=17 TSval=1044971485 TSecr=3169231163
1711546303.703675032   125 0.674065573    10.10.1.1 → 10.10.1.2    TCP 83 8081 → 46400 [PSH, ACK] Seq=137 Ack=154 Win=65152 Len=17 TSval=3169231194 TSecr=1044971485
1711546311.703675032   133 0.679045802    10.10.1.2 → 10.10.1.1    TCP 83 46400 → 8081 [PSH, ACK] Seq=154 Ack=154 Win=64256 Len=17 TSval=1044971490 TSecr=3169231194
1711546313.703675032   135 0.679176890    10.10.1.1 → 10.10.1.2    TCP 83 8081 → 46400 [PSH, ACK] Seq=154 Ack=171 Win=65152 Len=17 TSval=3169231199 TSecr=1044971490
1711546321.703675032   143 0.688008007    10.10.1.2 → 10.10.1.1    TCP 83 46400 → 8081 [PSH, ACK] Seq=171 Ack=171 Win=64256 Len=17 TSval=1044971499 TSecr=3169231199
1711546323.703675032   145 0.688139359    10.10.1.1 → 10.10.1.2    TCP 83 8081 → 46400 [PSH, ACK] Seq=171 Ack=188 Win=65152 Len=17 TSval=3169231208 TSecr=1044971499
1711546331.703675032   153 0.690624434    10.10.1.2 → 10.10.1.1    TCP 83 46400 → 8081 [PSH, ACK] Seq=188 Ack=188 Win=64256 Len=17 TSval=1044971502 TSecr=3169231208
1711546333.703675032   155 0.690754585    10.10.1.1 → 10.10.1.2    TCP 83 8081 → 46400 [PSH, ACK] Seq=188 Ack=205 Win=65152 Len=17 TSval=3169231210 TSecr=1044971502
1711546341.703675032   163 0.709094180    10.10.1.2 → 10.10.1.1    TCP 83 46400 → 8081 [PSH, ACK] Seq=205 Ack=205 Win=64256 Len=17 TSval=1044971520 TSecr=3169231210
1711546343.703675032   165 0.709228196    10.10.1.1 → 10.10.1.2    TCP 83 8081 → 46400 [PSH, ACK] Seq=205 Ack=222 Win=65152 Len=17 TSval=3169231229 TSecr=1044971520
1711546351.703675032   173 0.714267332    10.10.1.2 → 10.10.1.1    TCP 83 46400 → 8081 [PSH, ACK] Seq=222 Ack=222 Win=64256 Len=17 TSval=1044971525 TSecr=3169231229
1711546353.703675032   175 0.714399121    10.10.1.1 → 10.10.1.2    TCP 83 8081 → 46400 [PSH, ACK] Seq=222 Ack=239 Win=65152 Len=17 TSval=3169231234 TSecr=1044971525
1711546361.703675032   183 0.720688921    10.10.1.2 → 10.10.1.1    TCP 83 46400 → 8081 [PSH, ACK] Seq=239 Ack=239 Win=64256 Len=17 TSval=1044971532 TSecr=3169231234
1711546363.703675032   185 0.720819358    10.10.1.1 → 10.10.1.2    TCP 83 8081 → 46400 [PSH, ACK] Seq=239 Ack=256 Win=65152 Len=17 TSval=3169231240 TSecr=1044971532
1711546371.703675032   193 0.740509037    10.10.1.2 → 10.10.1.1    TCP 83 46400 → 8081 [PSH, ACK] Seq=256 Ack=256 Win=64256 Len=17 TSval=1044971552 TSecr=3169231240
1711546373.703675032   195 0.740645550    10.10.1.1 → 10.10.1.2    TCP 83 8081 → 46400 [PSH, ACK] Seq=256 Ack=273 Win=65152 Len=17 TSval=3169231260 TSecr=1044971552
1711546382.703675032   204 0.750569153    10.10.1.2 → 10.10.1.1    TCP 83 46400 → 8081 [PSH, ACK] Seq=273 Ack=273 Win=64256 Len=17 TSval=1044971562 TSecr=3169231260
1711546384.703675032   206 0.750702065    10.10.1.1 → 10.10.1.2    TCP 83 8081 → 46400 [PSH, ACK] Seq=273 Ack=290 Win=65152 Len=17 TSval=3169231270 TSecr=1044971562
1711546391.703675032   213 0.757157252    10.10.1.2 → 10.10.1.1    TCP 83 46400 → 8081 [PSH, ACK] Seq=290 Ack=290 Win=64256 Len=17 TSval=1044971568 TSecr=3169231270
1711546393.703675032   215 0.757289115    10.10.1.1 → 10.10.1.2    TCP 83 8081 → 46400 [PSH, ACK] Seq=290 Ack=307 Win=65152 Len=17 TSval=3169231277 TSecr=1044971568
1711546401.703675032   223 0.768880095    10.10.1.2 → 10.10.1.1    TCP 83 46400 → 8081 [PSH, ACK] Seq=307 Ack=307 Win=64256 Len=17 TSval=1044971580 TSecr=3169231277
1711546403.703675032   225 0.769010907    10.10.1.1 → 10.10.1.2    TCP 83 8081 → 46400 [PSH, ACK] Seq=307 Ack=324 Win=65152 Len=17 TSval=3169231289 TSecr=1044971580
1711546411.703675032   233 0.777574026    10.10.1.2 → 10.10.1.1    TCP 83 46400 → 8081 [PSH, ACK] Seq=324 Ack=324 Win=64256 Len=17 TSval=1044971589 TSecr=3169231289
1711546413.703675032   235 0.777704977    10.10.1.1 → 10.10.1.2    TCP 83 8081 → 46400 [PSH, ACK] Seq=324 Ack=341 Win=65152 Len=17 TSval=3169231297 TSecr=1044971589
1711546421.703675032   243 0.801053585    10.10.1.2 → 10.10.1.1    TCP 83 46400 → 8081 [PSH, ACK] Seq=341 Ack=341 Win=64256 Len=17 TSval=1044971612 TSecr=3169231297
1711546423.703675032   245 0.801189699    10.10.1.1 → 10.10.1.2    TCP 83 8081 → 46400 [PSH, ACK] Seq=341 Ack=358 Win=65152 Len=17 TSval=3169231321 TSecr=1044971612
1711546433.703675032   255 0.864817217    10.10.1.2 → 10.10.1.1    TCP 83 46400 → 8081 [PSH, ACK] Seq=358 Ack=358 Win=64256 Len=17 TSval=1044971676 TSecr=3169231321
1711546435.703675032   257 0.864943811    10.10.1.1 → 10.10.1.2    TCP 83 8081 → 46400 [PSH, ACK] Seq=358 Ack=375 Win=65152 Len=17 TSval=3169231384 TSecr=1044971676
1711546444.703675032   266 0.866345368    10.10.1.2 → 10.10.1.1    TCP 83 46400 → 8081 [PSH, ACK] Seq=375 Ack=375 Win=64256 Len=17 TSval=1044971678 TSecr=3169231384
1711546446.703675032   268 0.866472421    10.10.1.1 → 10.10.1.2    TCP 83 8081 → 46400 [PSH, ACK] Seq=375 Ack=392 Win=65152 Len=17 TSval=3169231386 TSecr=1044971678
1711546454.703675032   276 0.871790333    10.10.1.2 → 10.10.1.1    TCP 83 46400 → 8081 [PSH, ACK] Seq=392 Ack=392 Win=64256 Len=17 TSval=1044971683 TSecr=3169231386
1711546456.703675032   278 0.871925237    10.10.1.1 → 10.10.1.2    TCP 83 8081 → 46400 [PSH, ACK] Seq=392 Ack=409 Win=65152 Len=17 TSval=3169231391 TSecr=1044971683
1711546464.703675032   286 0.872932989    10.10.1.2 → 10.10.1.1    TCP 83 46400 → 8081 [PSH, ACK] Seq=409 Ack=409 Win=64256 Len=17 TSval=1044971684 TSecr=3169231391
1711546466.703675032   288 0.873062081    10.10.1.1 → 10.10.1.2    TCP 83 8081 → 46400 [PSH, ACK] Seq=409 Ack=426 Win=65152 Len=17 TSval=3169231393 TSecr=1044971684
1711546474.703675032   296 0.876265425    10.10.1.2 → 10.10.1.1    TCP 83 46400 → 8081 [PSH, ACK] Seq=426 Ack=426 Win=64256 Len=17 TSval=1044971687 TSecr=3169231393
1711546476.703675032   298 0.876398517    10.10.1.1 → 10.10.1.2    TCP 83 8081 → 46400 [PSH, ACK] Seq=426 Ack=443 Win=65152 Len=17 TSval=3169231396 TSecr=1044971687
1711546484.703675032   306 0.883801396    10.10.1.2 → 10.10.1.1    TCP 83 46400 → 8081 [PSH, ACK] Seq=443 Ack=443 Win=64256 Len=17 TSval=1044971695 TSecr=3169231396
1711546486.703675032   308 0.883933397    10.10.1.1 → 10.10.1.2    TCP 83 8081 → 46400 [PSH, ACK] Seq=443 Ack=460 Win=65152 Len=17 TSval=3169231403 TSecr=1044971695
1711546494.703675032   316 0.905746415    10.10.1.2 → 10.10.1.1    TCP 83 46400 → 8081 [PSH, ACK] Seq=460 Ack=460 Win=64256 Len=17 TSval=1044971717 TSecr=3169231403
1711546496.703675032   318 0.905877368    10.10.1.1 → 10.10.1.2    TCP 83 8081 → 46400 [PSH, ACK] Seq=460 Ack=477 Win=65152 Len=17 TSval=3169231425 TSecr=1044971717
1711546504.703675032   326 0.913871940    10.10.1.2 → 10.10.1.1    TCP 83 46400 → 8081 [PSH, ACK] Seq=477 Ack=477 Win=64256 Len=17 TSval=1044971725 TSecr=3169231425
1711546506.703675032   328 0.914016738    10.10.1.1 → 10.10.1.2    TCP 83 8081 → 46400 [PSH, ACK] Seq=477 Ack=494 Win=65152 Len=17 TSval=3169231433 TSecr=1044971725
1711546514.703675032   336 0.924087865    10.10.1.2 → 10.10.1.1    TCP 83 46400 → 8081 [PSH, ACK] Seq=494 Ack=494 Win=64256 Len=17 TSval=1044971735 TSecr=3169231433
1711546516.703675032   338 0.924217992    10.10.1.1 → 10.10.1.2    TCP 83 8081 → 46400 [PSH, ACK] Seq=494 Ack=511 Win=65152 Len=17 TSval=3169231444 TSecr=1044971735
1711546524.703675032   346 0.927195352    10.10.1.2 → 10.10.1.1    TCP 83 46400 → 8081 [PSH, ACK] Seq=511 Ack=511 Win=64256 Len=17 TSval=1044971738 TSecr=3169231444
1711546526.703675032   348 0.927325553    10.10.1.1 → 10.10.1.2    TCP 83 8081 → 46400 [PSH, ACK] Seq=511 Ack=528 Win=65152 Len=17 TSval=3169231447 TSecr=1044971738
1711546534.703675032   356 0.932322207    10.10.1.2 → 10.10.1.1    TCP 83 46400 → 8081 [PSH, ACK] Seq=528 Ack=528 Win=64256 Len=17 TSval=1044971744 TSecr=3169231447
1711546536.703675032   358 0.932453708    10.10.1.1 → 10.10.1.2    TCP 83 8081 → 46400 [PSH, ACK] Seq=528 Ack=545 Win=65152 Len=17 TSval=3169231452 TSecr=1044971744
1711546544.703675032   366 0.940228094    10.10.1.2 → 10.10.1.1    TCP 83 46400 → 8081 [PSH, ACK] Seq=545 Ack=545 Win=64256 Len=17 TSval=1044971751 TSecr=3169231452
1711546546.703675032   368 0.940359175    10.10.1.1 → 10.10.1.2    TCP 83 8081 → 46400 [PSH, ACK] Seq=545 Ack=562 Win=65152 Len=17 TSval=3169231460 TSecr=1044971751
1711546554.703675032   376 0.943261405    10.10.1.2 → 10.10.1.1    TCP 83 46400 → 8081 [PSH, ACK] Seq=562 Ack=562 Win=64256 Len=17 TSval=1044971754 TSecr=3169231460
1711546556.703675032   378 0.943392666    10.10.1.1 → 10.10.1.2    TCP 83 8081 → 46400 [PSH, ACK] Seq=562 Ack=579 Win=65152 Len=17 TSval=3169231463 TSecr=1044971754
1711546564.703675032   386 0.956057220    10.10.1.2 → 10.10.1.1    TCP 83 46400 → 8081 [PSH, ACK] Seq=579 Ack=579 Win=64256 Len=17 TSval=1044971767 TSecr=3169231463
1711546566.703675032   388 0.956189207    10.10.1.1 → 10.10.1.2    TCP 83 8081 → 46400 [PSH, ACK] Seq=579 Ack=596 Win=65152 Len=17 TSval=3169231476 TSecr=1044971767
1711546574.703675032   396 0.965099424    10.10.1.2 → 10.10.1.1    TCP 83 46400 → 8081 [PSH, ACK] Seq=596 Ack=596 Win=64256 Len=17 TSval=1044971776 TSecr=3169231476
1711546576.703675032   398 0.965238656    10.10.1.1 → 10.10.1.2    TCP 83 8081 → 46400 [PSH, ACK] Seq=596 Ack=613 Win=65152 Len=17 TSval=3169231485 TSecr=1044971776
1711546584.703675032   406 0.982631216    10.10.1.2 → 10.10.1.1    TCP 83 46400 → 8081 [PSH, ACK] Seq=613 Ack=613 Win=64256 Len=17 TSval=1044971794 TSecr=3169231485
1711546586.703675032   408 0.982762067    10.10.1.1 → 10.10.1.2    TCP 83 8081 → 46400 [PSH, ACK] Seq=613 Ack=630 Win=65152 Len=17 TSval=3169231502 TSecr=1044971794
1711546594.703675032   416 0.984867473    10.10.1.2 → 10.10.1.1    TCP 83 46400 → 8081 [PSH, ACK] Seq=630 Ack=630 Win=64256 Len=17 TSval=1044971796 TSecr=3169231502
1711546596.703675032   418 0.984993631    10.10.1.1 → 10.10.1.2    TCP 83 8081 → 46400 [PSH, ACK] Seq=630 Ack=647 Win=65152 Len=17 TSval=3169231504 TSecr=1044971796
1711546604.703675032   426 0.994163628    10.10.1.2 → 10.10.1.1    TCP 83 46400 → 8081 [PSH, ACK] Seq=647 Ack=647 Win=64256 Len=17 TSval=1044971805 TSecr=3169231504
1711546606.703675032   428 0.994294687    10.10.1.1 → 10.10.1.2    TCP 83 8081 → 46400 [PSH, ACK] Seq=647 Ack=664 Win=65152 Len=17 TSval=3169231514 TSecr=1044971805
1711546614.703675032   436 1.009380975    10.10.1.2 → 10.10.1.1    TCP 83 46400 → 8081 [PSH, ACK] Seq=664 Ack=664 Win=64256 Len=17 TSval=1044971821 TSecr=3169231514
1711546616.703675032   438 1.009509835    10.10.1.1 → 10.10.1.2    TCP 83 8081 → 46400 [PSH, ACK] Seq=664 Ack=681 Win=65152 Len=17 TSval=3169231529 TSecr=1044971821
1711546624.703675032   446 1.017730681    10.10.1.2 → 10.10.1.1    TCP 83 46400 → 8081 [PSH, ACK] Seq=681 Ack=681 Win=64256 Len=17 TSval=1044971829 TSecr=3169231529
1711546626.703675032   448 1.017862359    10.10.1.1 → 10.10.1.2    TCP 83 8081 → 46400 [PSH, ACK] Seq=681 Ack=698 Win=65152 Len=17 TSval=3169231537 TSecr=1044971829
1711546634.703675032   456 1.019928554    10.10.1.2 → 10.10.1.1    TCP 83 46400 → 8081 [PSH, ACK] Seq=698 Ack=698 Win=64256 Len=17 TSval=1044971831 TSecr=3169231537
1711546636.703675032   458 1.020059214    10.10.1.1 → 10.10.1.2    TCP 83 8081 → 46400 [PSH, ACK] Seq=698 Ack=715 Win=65152 Len=17 TSval=3169231540 TSecr=1044971831
1711546644.703675032   466 1.057966221    10.10.1.2 → 10.10.1.1    TCP 83 46400 → 8081 [PSH, ACK] Seq=715 Ack=715 Win=64256 Len=17 TSval=1044971869 TSecr=3169231540
1711546646.703675032   468 1.058100407    10.10.1.1 → 10.10.1.2    TCP 83 8081 → 46400 [PSH, ACK] Seq=715 Ack=732 Win=65152 Len=17 TSval=3169231578 TSecr=1044971869
1711546654.703675032   476 1.063220758    10.10.1.2 → 10.10.1.1    TCP 83 46400 → 8081 [PSH, ACK] Seq=732 Ack=732 Win=64256 Len=17 TSval=1044971874 TSecr=3169231578
1711546656.703675032   478 1.063352710    10.10.1.1 → 10.10.1.2    TCP 83 8081 → 46400 [PSH, ACK] Seq=732 Ack=749 Win=65152 Len=17 TSval=3169231583 TSecr=1044971874
1711546664.703675032   486 1.071590422    10.10.1.2 → 10.10.1.1    TCP 83 46400 → 8081 [PSH, ACK] Seq=749 Ack=749 Win=64256 Len=17 TSval=1044971883 TSecr=3169231583
1711546666.703675032   488 1.071722463    10.10.1.1 → 10.10.1.2    TCP 83 8081 → 46400 [PSH, ACK] Seq=749 Ack=766 Win=65152 Len=17 TSval=3169231591 TSecr=1044971883
1711546674.703675032   496 1.077598613    10.10.1.2 → 10.10.1.1    TCP 83 46400 → 8081 [PSH, ACK] Seq=766 Ack=766 Win=64256 Len=17 TSval=1044971889 TSecr=3169231591
1711546676.703675032   498 1.077730258    10.10.1.1 → 10.10.1.2    TCP 83 8081 → 46400 [PSH, ACK] Seq=766 Ack=783 Win=65152 Len=17 TSval=3169231597 TSecr=1044971889
1711546684.703675032   506 1.080754960    10.10.1.2 → 10.10.1.1    TCP 83 46400 → 8081 [PSH, ACK] Seq=783 Ack=783 Win=64256 Len=17 TSval=1044971892 TSecr=3169231597
1711546686.703675032   508 1.080885861    10.10.1.1 → 10.10.1.2    TCP 83 8081 → 46400 [PSH, ACK] Seq=783 Ack=800 Win=65152 Len=17 TSval=3169231600 TSecr=1044971892
1711546694.703675032   516 1.082995913    10.10.1.2 → 10.10.1.1    TCP 83 46400 → 8081 [PSH, ACK] Seq=800 Ack=800 Win=64256 Len=17 TSval=1044971894 TSecr=3169231600
1711546696.703675032   518 1.083128214    10.10.1.1 → 10.10.1.2    TCP 83 8081 → 46400 [PSH, ACK] Seq=800 Ack=817 Win=65152 Len=17 TSval=3169231603 TSecr=1044971894
1711546704.703675032   526 1.105994237    10.10.1.2 → 10.10.1.1    TCP 83 46400 → 8081 [PSH, ACK] Seq=817 Ack=817 Win=64256 Len=17 TSval=1044971917 TSecr=3169231603
1711546706.703675032   528 1.106126822    10.10.1.1 → 10.10.1.2    TCP 83 8081 → 46400 [PSH, ACK] Seq=817 Ack=834 Win=65152 Len=17 TSval=3169231626 TSecr=1044971917
1711546714.703675032   536 1.132157009    10.10.1.2 → 10.10.1.1    TCP 83 46400 → 8081 [PSH, ACK] Seq=834 Ack=834 Win=64256 Len=17 TSval=1044971943 TSecr=3169231626
1711546716.703675032   538 1.132288899    10.10.1.1 → 10.10.1.2    TCP 83 8081 → 46400 [PSH, ACK] Seq=834 Ack=851 Win=65152 Len=17 TSval=3169231652 TSecr=1044971943
1711546724.703675032   546 1.145920598    10.10.1.2 → 10.10.1.1    TCP 83 46400 → 8081 [PSH, ACK] Seq=851 Ack=851 Win=64256 Len=17 TSval=1044971957 TSecr=3169231652
1711546726.703675032   548 1.146072971    10.10.1.1 → 10.10.1.2    TCP 83 8081 → 46400 [PSH, ACK] Seq=851 Ack=868 Win=65152 Len=17 TSval=3169231666 TSecr=1044971957
1711546734.703675032   556 1.162246891    10.10.1.2 → 10.10.1.1    TCP 83 46400 → 8081 [PSH, ACK] Seq=868 Ack=868 Win=64256 Len=17 TSval=1044971973 TSecr=3169231666
1711546736.703675032   558 1.162378573    10.10.1.1 → 10.10.1.2    TCP 83 8081 → 46400 [PSH, ACK] Seq=868 Ack=885 Win=65152 Len=17 TSval=3169231682 TSecr=1044971973
1711546744.703675032   566 1.188175257    10.10.1.2 → 10.10.1.1    TCP 83 46400 → 8081 [PSH, ACK] Seq=885 Ack=885 Win=64256 Len=17 TSval=1044971999 TSecr=3169231682
1711546746.703675032   568 1.188307625    10.10.1.1 → 10.10.1.2    TCP 83 8081 → 46400 [PSH, ACK] Seq=885 Ack=902 Win=65152 Len=17 TSval=3169231708 TSecr=1044971999
1711546754.703675032   576 1.207505190    10.10.1.2 → 10.10.1.1    TCP 83 46400 → 8081 [PSH, ACK] Seq=902 Ack=902 Win=64256 Len=17 TSval=1044972019 TSecr=3169231708
1711546756.703675032   578 1.207636397    10.10.1.1 → 10.10.1.2    TCP 83 8081 → 46400 [PSH, ACK] Seq=902 Ack=919 Win=65152 Len=17 TSval=3169231727 TSecr=1044972019
1711546764.703675032   586 1.210048713    10.10.1.2 → 10.10.1.1    TCP 83 46400 → 8081 [PSH, ACK] Seq=919 Ack=919 Win=64256 Len=17 TSval=1044972021 TSecr=3169231727
1711546766.703675032   588 1.210180206    10.10.1.1 → 10.10.1.2    TCP 83 8081 → 46400 [PSH, ACK] Seq=919 Ack=936 Win=65152 Len=17 TSval=3169231730 TSecr=1044972021
1711546776.703675032   598 1.277453562    10.10.1.2 → 10.10.1.1    TCP 83 46400 → 8081 [PSH, ACK] Seq=936 Ack=936 Win=64256 Len=17 TSval=1044972089 TSecr=3169231730
1711546778.703675032   600 1.277579068    10.10.1.1 → 10.10.1.2    TCP 83 8081 → 46400 [PSH, ACK] Seq=936 Ack=953 Win=65152 Len=17 TSval=3169231797 TSecr=1044972089
1711546787.703675032   609 1.278942719    10.10.1.2 → 10.10.1.1    TCP 83 46400 → 8081 [PSH, ACK] Seq=953 Ack=953 Win=64256 Len=17 TSval=1044972090 TSecr=3169231797
1711546790.703675032   612 1.279122934    10.10.1.1 → 10.10.1.2    TCP 83 8081 → 46400 [PSH, ACK] Seq=953 Ack=970 Win=65152 Len=17 TSval=3169231799 TSecr=1044972090
1711546797.703675032   619 1.291707738    10.10.1.2 → 10.10.1.1    TCP 83 46400 → 8081 [PSH, ACK] Seq=970 Ack=970 Win=64256 Len=17 TSval=1044972103 TSecr=3169231799
1711546799.703675032   621 1.291839360    10.10.1.1 → 10.10.1.2    TCP 83 8081 → 46400 [PSH, ACK] Seq=970 Ack=987 Win=65152 Len=17 TSval=3169231811 TSecr=1044972103
1711546807.703675032   629 1.313546586    10.10.1.2 → 10.10.1.1    TCP 83 46400 → 8081 [PSH, ACK] Seq=987 Ack=987 Win=64256 Len=17 TSval=1044972125 TSecr=3169231811
1711546809.703675032   631 1.313677314    10.10.1.1 → 10.10.1.2    TCP 83 8081 → 46400 [PSH, ACK] Seq=987 Ack=1004 Win=65152 Len=17 TSval=3169231833 TSecr=1044972125
1711546817.703675032   639 1.324327570    10.10.1.2 → 10.10.1.1    TCP 83 46400 → 8081 [PSH, ACK] Seq=1004 Ack=1004 Win=64256 Len=17 TSval=1044972136 TSecr=3169231833
1711546819.703675032   641 1.324457652    10.10.1.1 → 10.10.1.2    TCP 83 8081 → 46400 [PSH, ACK] Seq=1004 Ack=1021 Win=65152 Len=17 TSval=3169231844 TSecr=1044972136
1711546827.703675032   649 1.328776046    10.10.1.2 → 10.10.1.1    TCP 83 46400 → 8081 [PSH, ACK] Seq=1021 Ack=1021 Win=64256 Len=17 TSval=1044972140 TSecr=3169231844
1711546829.703675032   651 1.328907097    10.10.1.1 → 10.10.1.2    TCP 83 8081 → 46400 [PSH, ACK] Seq=1021 Ack=1038 Win=65152 Len=17 TSval=3169231848 TSecr=1044972140
1711546837.703675032   659 1.330454129    10.10.1.2 → 10.10.1.1    TCP 83 46400 → 8081 [PSH, ACK] Seq=1038 Ack=1038 Win=64256 Len=17 TSval=1044972142 TSecr=3169231848
1711546839.703675032   661 1.330584538    10.10.1.1 → 10.10.1.2    TCP 83 8081 → 46400 [PSH, ACK] Seq=1038 Ack=1055 Win=65152 Len=17 TSval=3169231850 TSecr=1044972142
1711546849.703675032   671 1.331090390    10.10.1.2 → 10.10.1.1    TCP 83 46400 → 8081 [PSH, ACK] Seq=1055 Ack=1055 Win=64256 Len=17 TSval=1044972142 TSecr=3169231850
1711546850.703675032   672 1.331217462    10.10.1.1 → 10.10.1.2    TCP 83 8081 → 46400 [PSH, ACK] Seq=1055 Ack=1072 Win=65152 Len=17 TSval=3169231851 TSecr=1044972142
1711546857.703675032   679 1.351596324    10.10.1.2 → 10.10.1.1    TCP 83 46400 → 8081 [PSH, ACK] Seq=1072 Ack=1072 Win=64256 Len=17 TSval=1044972163 TSecr=3169231851
1711546859.703675032   681 1.351727959    10.10.1.1 → 10.10.1.2    TCP 83 8081 → 46400 [PSH, ACK] Seq=1072 Ack=1089 Win=65152 Len=17 TSval=3169231871 TSecr=1044972163
1711546867.703675032   689 1.356406672    10.10.1.2 → 10.10.1.1    TCP 83 46400 → 8081 [PSH, ACK] Seq=1089 Ack=1089 Win=64256 Len=17 TSval=1044972168 TSecr=3169231871
1711546869.703675032   691 1.356538630    10.10.1.1 → 10.10.1.2    TCP 83 8081 → 46400 [PSH, ACK] Seq=1089 Ack=1106 Win=65152 Len=17 TSval=3169231876 TSecr=1044972168
1711546877.703675032   699 1.370265406    10.10.1.2 → 10.10.1.1    TCP 83 46400 → 8081 [PSH, ACK] Seq=1106 Ack=1106 Win=64256 Len=17 TSval=1044972181 TSecr=3169231876
1711546879.703675032   701 1.370396368    10.10.1.1 → 10.10.1.2    TCP 83 8081 → 46400 [PSH, ACK] Seq=1106 Ack=1123 Win=65152 Len=17 TSval=3169231890 TSecr=1044972181
1711546887.703675032   709 1.376546784    10.10.1.2 → 10.10.1.1    TCP 83 46400 → 8081 [PSH, ACK] Seq=1123 Ack=1123 Win=64256 Len=17 TSval=1044972188 TSecr=3169231890
1711546889.703675032   711 1.376678849    10.10.1.1 → 10.10.1.2    TCP 83 8081 → 46400 [PSH, ACK] Seq=1123 Ack=1140 Win=65152 Len=17 TSval=3169231896 TSecr=1044972188
1711546897.703675032   719 1.378884959    10.10.1.2 → 10.10.1.1    TCP 83 46400 → 8081 [PSH, ACK] Seq=1140 Ack=1140 Win=64256 Len=17 TSval=1044972190 TSecr=3169231896
1711546899.703675032   721 1.379015641    10.10.1.1 → 10.10.1.2    TCP 83 8081 → 46400 [PSH, ACK] Seq=1140 Ack=1157 Win=65152 Len=17 TSval=3169231899 TSecr=1044972190
1711546907.703675032   729 1.403660995    10.10.1.2 → 10.10.1.1    TCP 83 46400 → 8081 [PSH, ACK] Seq=1157 Ack=1157 Win=64256 Len=17 TSval=1044972215 TSecr=3169231899
1711546909.703675032   731 1.403795217    10.10.1.1 → 10.10.1.2    TCP 83 8081 → 46400 [PSH, ACK] Seq=1157 Ack=1174 Win=65152 Len=17 TSval=3169231923 TSecr=1044972215
1711546919.703675032   741 1.404412156    10.10.1.2 → 10.10.1.1    TCP 83 46400 → 8081 [PSH, ACK] Seq=1174 Ack=1174 Win=64256 Len=17 TSval=1044972216 TSecr=3169231923
1711546920.703675032   742 1.404539144    10.10.1.1 → 10.10.1.2    TCP 83 8081 → 46400 [PSH, ACK] Seq=1174 Ack=1191 Win=65152 Len=17 TSval=3169231924 TSecr=1044972216
1711546928.703675032   750 1.435627160    10.10.1.2 → 10.10.1.1    TCP 83 46400 → 8081 [PSH, ACK] Seq=1191 Ack=1191 Win=64256 Len=17 TSval=1044972247 TSecr=3169231924
1711546930.703675032   752 1.435757909    10.10.1.1 → 10.10.1.2    TCP 83 8081 → 46400 [PSH, ACK] Seq=1191 Ack=1208 Win=65152 Len=17 TSval=3169231955 TSecr=1044972247
1711546937.703675032   759 1.442212169    10.10.1.2 → 10.10.1.1    TCP 83 46400 → 8081 [PSH, ACK] Seq=1208 Ack=1208 Win=64256 Len=17 TSval=1044972253 TSecr=3169231955
1711546939.703675032   761 1.442344089    10.10.1.1 → 10.10.1.2    TCP 83 8081 → 46400 [PSH, ACK] Seq=1208 Ack=1225 Win=65152 Len=17 TSval=3169231962 TSecr=1044972253
1711546947.703675032   769 1.444891127    10.10.1.2 → 10.10.1.1    TCP 83 46400 → 8081 [PSH, ACK] Seq=1225 Ack=1225 Win=64256 Len=17 TSval=1044972256 TSecr=3169231962
1711546949.703675032   771 1.445012298    10.10.1.1 → 10.10.1.2    TCP 83 8081 → 46400 [PSH, ACK] Seq=1225 Ack=1242 Win=65152 Len=17 TSval=3169231965 TSecr=1044972256
1711546957.703675032   779 1.472010299    10.10.1.2 → 10.10.1.1    TCP 83 46400 → 8081 [PSH, ACK] Seq=1242 Ack=1242 Win=64256 Len=17 TSval=1044972283 TSecr=3169231965
1711546959.703675032   781 1.472141027    10.10.1.1 → 10.10.1.2    TCP 83 8081 → 46400 [PSH, ACK] Seq=1242 Ack=1259 Win=65152 Len=17 TSval=3169231992 TSecr=1044972283
1711546967.703675032   789 1.491442738    10.10.1.2 → 10.10.1.1    TCP 83 46400 → 8081 [PSH, ACK] Seq=1259 Ack=1259 Win=64256 Len=17 TSval=1044972303 TSecr=3169231992
1711546969.703675032   791 1.491573832    10.10.1.1 → 10.10.1.2    TCP 83 8081 → 46400 [PSH, ACK] Seq=1259 Ack=1276 Win=65152 Len=17 TSval=3169232011 TSecr=1044972303
1711546977.703675032   799 1.506044686    10.10.1.2 → 10.10.1.1    TCP 83 46400 → 8081 [PSH, ACK] Seq=1276 Ack=1276 Win=64256 Len=17 TSval=1044972317 TSecr=3169232011
1711546979.703675032   801 1.506176385    10.10.1.1 → 10.10.1.2    TCP 83 8081 → 46400 [PSH, ACK] Seq=1276 Ack=1293 Win=65152 Len=17 TSval=3169232026 TSecr=1044972317
1711546987.703675032   809 1.510906957    10.10.1.2 → 10.10.1.1    TCP 83 46400 → 8081 [PSH, ACK] Seq=1293 Ack=1293 Win=64256 Len=17 TSval=1044972322 TSecr=3169232026
1711546989.703675032   811 1.511037702    10.10.1.1 → 10.10.1.2    TCP 83 8081 → 46400 [PSH, ACK] Seq=1293 Ack=1310 Win=65152 Len=17 TSval=3169232031 TSecr=1044972322
1711546997.703675032   819 1.512269811    10.10.1.2 → 10.10.1.1    TCP 83 46400 → 8081 [PSH, ACK] Seq=1310 Ack=1310 Win=64256 Len=17 TSval=1044972323 TSecr=3169232031
1711546999.703675032   821 1.512395321    10.10.1.1 → 10.10.1.2    TCP 83 8081 → 46400 [PSH, ACK] Seq=1310 Ack=1327 Win=65152 Len=17 TSval=3169232032 TSecr=1044972323
1711547007.703675032   829 1.539535281    10.10.1.2 → 10.10.1.1    TCP 83 46400 → 8081 [PSH, ACK] Seq=1327 Ack=1327 Win=64256 Len=17 TSval=1044972351 TSecr=3169232032
1711547009.703675032   831 1.539666252    10.10.1.1 → 10.10.1.2    TCP 83 8081 → 46400 [PSH, ACK] Seq=1327 Ack=1344 Win=65152 Len=17 TSval=3169232059 TSecr=1044972351
1711547017.703675032   839 1.542887883    10.10.1.2 → 10.10.1.1    TCP 83 46400 → 8081 [PSH, ACK] Seq=1344 Ack=1344 Win=64256 Len=17 TSval=1044972354 TSecr=3169232059
1711547019.703675032   841 1.543019521    10.10.1.1 → 10.10.1.2    TCP 83 8081 → 46400 [PSH, ACK] Seq=1344 Ack=1361 Win=65152 Len=17 TSval=3169232063 TSecr=1044972354
1711547028.703675032   850 1.543446102    10.10.1.2 → 10.10.1.1    TCP 83 46400 → 8081 [PSH, ACK] Seq=1361 Ack=1361 Win=64256 Len=17 TSval=1044972355 TSecr=3169232063
1711547030.703675032   852 1.543570338    10.10.1.1 → 10.10.1.2    TCP 83 8081 → 46400 [PSH, ACK] Seq=1361 Ack=1378 Win=65152 Len=17 TSval=3169232063 TSecr=1044972355
1711547037.703675032   859 1.554896930    10.10.1.2 → 10.10.1.1    TCP 83 46400 → 8081 [PSH, ACK] Seq=1378 Ack=1378 Win=64256 Len=17 TSval=1044972366 TSecr=3169232063
1711547039.703675032   861 1.555030034    10.10.1.1 → 10.10.1.2    TCP 83 8081 → 46400 [PSH, ACK] Seq=1378 Ack=1395 Win=65152 Len=17 TSval=3169232075 TSecr=1044972366
1711547047.703675032   869 1.555828476    10.10.1.2 → 10.10.1.1    TCP 83 46400 → 8081 [PSH, ACK] Seq=1395 Ack=1395 Win=64256 Len=17 TSval=1044972367 TSecr=3169232075
1711547049.703675032   871 1.555954386    10.10.1.1 → 10.10.1.2    TCP 83 8081 → 46400 [PSH, ACK] Seq=1395 Ack=1412 Win=65152 Len=17 TSval=3169232075 TSecr=1044972367
1711547057.703675032   879 1.584914623    10.10.1.2 → 10.10.1.1    TCP 83 46400 → 8081 [PSH, ACK] Seq=1412 Ack=1412 Win=64256 Len=17 TSval=1044972396 TSecr=3169232075
1711547059.703675032   881 1.585046577    10.10.1.1 → 10.10.1.2    TCP 83 8081 → 46400 [PSH, ACK] Seq=1412 Ack=1429 Win=65152 Len=17 TSval=3169232105 TSecr=1044972396
1711547067.703675032   889 1.592620544    10.10.1.2 → 10.10.1.1    TCP 83 46400 → 8081 [PSH, ACK] Seq=1429 Ack=1429 Win=64256 Len=17 TSval=1044972404 TSecr=3169232105
1711547069.703675032   891 1.592751882    10.10.1.1 → 10.10.1.2    TCP 83 8081 → 46400 [PSH, ACK] Seq=1429 Ack=1446 Win=65152 Len=17 TSval=3169232112 TSecr=1044972404
1711547077.703675032   899 1.595895523    10.10.1.2 → 10.10.1.1    TCP 83 46400 → 8081 [PSH, ACK] Seq=1446 Ack=1446 Win=64256 Len=17 TSval=1044972407 TSecr=3169232112
1711547079.703675032   901 1.596026755    10.10.1.1 → 10.10.1.2    TCP 83 8081 → 46400 [PSH, ACK] Seq=1446 Ack=1463 Win=65152 Len=17 TSval=3169232116 TSecr=1044972407
1711547087.703675032   909 1.624769231    10.10.1.2 → 10.10.1.1    TCP 83 46400 → 8081 [PSH, ACK] Seq=1463 Ack=1463 Win=64256 Len=17 TSval=1044972436 TSecr=3169232116
1711547089.703675032   911 1.624902108    10.10.1.1 → 10.10.1.2    TCP 83 8081 → 46400 [PSH, ACK] Seq=1463 Ack=1480 Win=65152 Len=17 TSval=3169232144 TSecr=1044972436
1711547097.703675032   919 1.635042599    10.10.1.2 → 10.10.1.1    TCP 83 46400 → 8081 [PSH, ACK] Seq=1480 Ack=1480 Win=64256 Len=17 TSval=1044972446 TSecr=3169232144
1711547099.703675032   921 1.635128164    10.10.1.1 → 10.10.1.2    TCP 83 8081 → 46400 [PSH, ACK] Seq=1480 Ack=1497 Win=65152 Len=17 TSval=3169232155 TSecr=1044972446
1711547107.703675032   929 1.668477748    10.10.1.2 → 10.10.1.1    TCP 83 46400 → 8081 [PSH, ACK] Seq=1497 Ack=1497 Win=64256 Len=17 TSval=1044972480 TSecr=3169232155
1711547110.703675032   932 1.668610129    10.10.1.1 → 10.10.1.2    TCP 83 8081 → 46400 [PSH, ACK] Seq=1497 Ack=1514 Win=65152 Len=17 TSval=3169232188 TSecr=1044972480
1711547117.703675032   939 1.686299455    10.10.1.2 → 10.10.1.1    TCP 83 46400 → 8081 [PSH, ACK] Seq=1514 Ack=1514 Win=64256 Len=17 TSval=1044972497 TSecr=3169232188
1711547120.703675032   942 1.686433586    10.10.1.1 → 10.10.1.2    TCP 83 8081 → 46400 [PSH, ACK] Seq=1514 Ack=1531 Win=65152 Len=17 TSval=3169232206 TSecr=1044972497
1711547127.703675032   949 1.689911368    10.10.1.2 → 10.10.1.1    TCP 83 46400 → 8081 [PSH, ACK] Seq=1531 Ack=1531 Win=64256 Len=17 TSval=1044972501 TSecr=3169232206
1711547130.703675032   952 1.690057163    10.10.1.1 → 10.10.1.2    TCP 83 8081 → 46400 [PSH, ACK] Seq=1531 Ack=1548 Win=65152 Len=17 TSval=3169232210 TSecr=1044972501
1711547137.703675032   959 1.693841704    10.10.1.2 → 10.10.1.1    TCP 83 46400 → 8081 [PSH, ACK] Seq=1548 Ack=1548 Win=64256 Len=17 TSval=1044972505 TSecr=3169232210
1711547140.703675032   962 1.693971277    10.10.1.1 → 10.10.1.2    TCP 83 8081 → 46400 [PSH, ACK] Seq=1548 Ack=1565 Win=65152 Len=17 TSval=3169232213 TSecr=1044972505
1711547147.703675032   969 1.724192251    10.10.1.2 → 10.10.1.1    TCP 83 46400 → 8081 [PSH, ACK] Seq=1565 Ack=1565 Win=64256 Len=17 TSval=1044972535 TSecr=3169232213
1711547150.703675032   972 1.724323217    10.10.1.1 → 10.10.1.2    TCP 83 8081 → 46400 [PSH, ACK] Seq=1565 Ack=1582 Win=65152 Len=17 TSval=3169232244 TSecr=1044972535
1711547157.703675032   979 1.728214929    10.10.1.2 → 10.10.1.1    TCP 83 46400 → 8081 [PSH, ACK] Seq=1582 Ack=1582 Win=64256 Len=17 TSval=1044972539 TSecr=3169232244
1711547160.703675032   982 1.728344353    10.10.1.1 → 10.10.1.2    TCP 83 8081 → 46400 [PSH, ACK] Seq=1582 Ack=1599 Win=65152 Len=17 TSval=3169232248 TSecr=1044972539
1711547167.703675032   989 1.730387472    10.10.1.2 → 10.10.1.1    TCP 83 46400 → 8081 [PSH, ACK] Seq=1599 Ack=1599 Win=64256 Len=17 TSval=1044972542 TSecr=3169232248
1711547170.703675032   992 1.730515597    10.10.1.1 → 10.10.1.2    TCP 83 8081 → 46400 [PSH, ACK] Seq=1599 Ack=1616 Win=65152 Len=17 TSval=3169232250 TSecr=1044972542
1711547177.703675032   999 1.734443982    10.10.1.2 → 10.10.1.1    TCP 83 46400 → 8081 [PSH, ACK] Seq=1616 Ack=1616 Win=64256 Len=17 TSval=1044972546 TSecr=3169232250
1711547179.703675032  1001 1.734582542    10.10.1.1 → 10.10.1.2    TCP 83 8081 → 46400 [PSH, ACK] Seq=1616 Ack=1633 Win=65152 Len=17 TSval=3169232254 TSecr=1044972546
1711547189.703675032  1011 1.735295933    10.10.1.2 → 10.10.1.1    TCP 83 46400 → 8081 [PSH, ACK] Seq=1633 Ack=1633 Win=64256 Len=17 TSval=1044972546 TSecr=3169232254
1711547190.703675032  1012 1.735421202    10.10.1.1 → 10.10.1.2    TCP 83 8081 → 46400 [PSH, ACK] Seq=1633 Ack=1650 Win=65152 Len=17 TSval=3169232255 TSecr=1044972546
1711547197.703675032  1019 1.745168099    10.10.1.2 → 10.10.1.1    TCP 83 46400 → 8081 [PSH, ACK] Seq=1650 Ack=1650 Win=64256 Len=17 TSval=1044972556 TSecr=3169232255
1711547199.703675032  1021 1.745305521    10.10.1.1 → 10.10.1.2    TCP 83 8081 → 46400 [PSH, ACK] Seq=1650 Ack=1667 Win=65152 Len=17 TSval=3169232265 TSecr=1044972556
1711547207.703675032  1029 1.752266817    10.10.1.2 → 10.10.1.1    TCP 83 46400 → 8081 [PSH, ACK] Seq=1667 Ack=1667 Win=64256 Len=17 TSval=1044972563 TSecr=3169232265
1711547209.703675032  1031 1.752405179    10.10.1.1 → 10.10.1.2    TCP 83 8081 → 46400 [PSH, ACK] Seq=1667 Ack=1684 Win=65152 Len=17 TSval=3169232272 TSecr=1044972563
1711547217.703675032  1039 1.785192871    10.10.1.2 → 10.10.1.1    TCP 83 46400 → 8081 [PSH, ACK] Seq=1684 Ack=1684 Win=64256 Len=17 TSval=1044972596 TSecr=3169232272
1711547219.703675032  1041 1.785331647    10.10.1.1 → 10.10.1.2    TCP 83 8081 → 46400 [PSH, ACK] Seq=1684 Ack=1701 Win=65152 Len=17 TSval=3169232305 TSecr=1044972596
1711547227.703675032  1049 1.796149051    10.10.1.2 → 10.10.1.1    TCP 83 46400 → 8081 [PSH, ACK] Seq=1701 Ack=1701 Win=64256 Len=17 TSval=1044972607 TSecr=3169232305
1711547229.703675032  1051 1.796286648    10.10.1.1 → 10.10.1.2    TCP 83 8081 → 46400 [PSH, ACK] Seq=1701 Ack=1718 Win=65152 Len=17 TSval=3169232316 TSecr=1044972607
1711547237.703675032  1059 1.802389799    10.10.1.2 → 10.10.1.1    TCP 83 46400 → 8081 [PSH, ACK] Seq=1718 Ack=1718 Win=64256 Len=17 TSval=1044972614 TSecr=3169232316
1711547239.703675032  1061 1.802530174    10.10.1.1 → 10.10.1.2    TCP 83 8081 → 46400 [PSH, ACK] Seq=1718 Ack=1735 Win=65152 Len=17 TSval=3169232322 TSecr=1044972614
1711547247.703675032  1069 1.808287746    10.10.1.2 → 10.10.1.1    TCP 83 46400 → 8081 [PSH, ACK] Seq=1735 Ack=1735 Win=64256 Len=17 TSval=1044972619 TSecr=3169232322
1711547249.703675032  1071 1.808426112    10.10.1.1 → 10.10.1.2    TCP 83 8081 → 46400 [PSH, ACK] Seq=1735 Ack=1752 Win=65152 Len=17 TSval=3169232328 TSecr=1044972619
1711547257.703675032  1079 1.828423514    10.10.1.2 → 10.10.1.1    TCP 83 46400 → 8081 [PSH, ACK] Seq=1752 Ack=1752 Win=64256 Len=17 TSval=1044972640 TSecr=3169232328
1711547259.703675032  1081 1.828563476    10.10.1.1 → 10.10.1.2    TCP 83 8081 → 46400 [PSH, ACK] Seq=1752 Ack=1769 Win=65152 Len=17 TSval=3169232348 TSecr=1044972640
1711547267.703675032  1089 1.833500215    10.10.1.2 → 10.10.1.1    TCP 83 46400 → 8081 [PSH, ACK] Seq=1769 Ack=1769 Win=64256 Len=17 TSval=1044972645 TSecr=3169232348
1711547269.703675032  1091 1.833638227    10.10.1.1 → 10.10.1.2    TCP 83 8081 → 46400 [PSH, ACK] Seq=1769 Ack=1786 Win=65152 Len=17 TSval=3169232353 TSecr=1044972645
1711547277.703675032  1099 1.837098809    10.10.1.2 → 10.10.1.1    TCP 83 46400 → 8081 [PSH, ACK] Seq=1786 Ack=1786 Win=64256 Len=17 TSval=1044972648 TSecr=3169232353
1711547279.703675032  1101 1.837236436    10.10.1.1 → 10.10.1.2    TCP 83 8081 → 46400 [PSH, ACK] Seq=1786 Ack=1803 Win=65152 Len=17 TSval=3169232357 TSecr=1044972648
1711547287.703675032  1109 1.847160716    10.10.1.2 → 10.10.1.1    TCP 83 46400 → 8081 [PSH, ACK] Seq=1803 Ack=1803 Win=64256 Len=17 TSval=1044972658 TSecr=3169232357
1711547290.703675032  1112 1.847311915    10.10.1.1 → 10.10.1.2    TCP 83 8081 → 46400 [PSH, ACK] Seq=1803 Ack=1820 Win=65152 Len=17 TSval=3169232367 TSecr=1044972658
1711547297.703675032  1119 1.860984328    10.10.1.2 → 10.10.1.1    TCP 83 46400 → 8081 [PSH, ACK] Seq=1820 Ack=1820 Win=64256 Len=17 TSval=1044972672 TSecr=3169232367
1711547299.703675032  1121 1.861122834    10.10.1.1 → 10.10.1.2    TCP 83 8081 → 46400 [PSH, ACK] Seq=1820 Ack=1837 Win=65152 Len=17 TSval=3169232381 TSecr=1044972672
1711547307.703675032  1129 1.866021443    10.10.1.2 → 10.10.1.1    TCP 83 46400 → 8081 [PSH, ACK] Seq=1837 Ack=1837 Win=64256 Len=17 TSval=1044972677 TSecr=3169232381
1711547309.703675032  1131 1.866158148    10.10.1.1 → 10.10.1.2    TCP 83 8081 → 46400 [PSH, ACK] Seq=1837 Ack=1854 Win=65152 Len=17 TSval=3169232386 TSecr=1044972677
1711547317.703675032  1139 1.874449821    10.10.1.2 → 10.10.1.1    TCP 83 46400 → 8081 [PSH, ACK] Seq=1854 Ack=1854 Win=64256 Len=17 TSval=1044972686 TSecr=3169232386
1711547319.703675032  1141 1.874585698    10.10.1.1 → 10.10.1.2    TCP 83 8081 → 46400 [PSH, ACK] Seq=1854 Ack=1871 Win=65152 Len=17 TSval=3169232394 TSecr=1044972686
1711547329.703675032  1151 1.945917695    10.10.1.2 → 10.10.1.1    TCP 83 46400 → 8081 [PSH, ACK] Seq=1871 Ack=1871 Win=64256 Len=17 TSval=1044972757 TSecr=3169232394
1711547331.703675032  1153 1.946062634    10.10.1.1 → 10.10.1.2    TCP 83 8081 → 46400 [PSH, ACK] Seq=1871 Ack=1888 Win=65152 Len=17 TSval=3169232466 TSecr=1044972757
1711547340.703675032  1162 1.951305294    10.10.1.2 → 10.10.1.1    TCP 83 46400 → 8081 [PSH, ACK] Seq=1888 Ack=1888 Win=64256 Len=17 TSval=1044972762 TSecr=3169232466
1711547342.703675032  1164 1.951430341    10.10.1.1 → 10.10.1.2    TCP 83 8081 → 46400 [PSH, ACK] Seq=1888 Ack=1905 Win=65152 Len=17 TSval=3169232471 TSecr=1044972762
1711547350.703675032  1172 1.954188832    10.10.1.2 → 10.10.1.1    TCP 83 46400 → 8081 [PSH, ACK] Seq=1905 Ack=1905 Win=64256 Len=17 TSval=1044972765 TSecr=3169232471
1711547352.703675032  1174 1.954324968    10.10.1.1 → 10.10.1.2    TCP 83 8081 → 46400 [PSH, ACK] Seq=1905 Ack=1922 Win=65152 Len=17 TSval=3169232474 TSecr=1044972765
1711547360.703675032  1182 1.955115917    10.10.1.2 → 10.10.1.1    TCP 83 46400 → 8081 [PSH, ACK] Seq=1922 Ack=1922 Win=64256 Len=17 TSval=1044972766 TSecr=3169232474
1711547363.703675032  1185 1.955300284    10.10.1.1 → 10.10.1.2    TCP 83 8081 → 46400 [PSH, ACK] Seq=1922 Ack=1939 Win=65152 Len=17 TSval=3169232475 TSecr=1044972766
1711547370.703675032  1192 1.959645578    10.10.1.2 → 10.10.1.1    TCP 83 46400 → 8081 [PSH, ACK] Seq=1939 Ack=1939 Win=64256 Len=17 TSval=1044972771 TSecr=3169232475
1711547372.703675032  1194 1.959781683    10.10.1.1 → 10.10.1.2    TCP 83 8081 → 46400 [PSH, ACK] Seq=1939 Ack=1956 Win=65152 Len=17 TSval=3169232479 TSecr=1044972771
1711547380.703675032  1202 1.973674239    10.10.1.2 → 10.10.1.1    TCP 83 46400 → 8081 [PSH, ACK] Seq=1956 Ack=1956 Win=64256 Len=17 TSval=1044972785 TSecr=3169232479
1711547382.703675032  1204 1.973810179    10.10.1.1 → 10.10.1.2    TCP 83 8081 → 46400 [PSH, ACK] Seq=1956 Ack=1973 Win=65152 Len=17 TSval=3169232493 TSecr=1044972785
1711547390.703675032  1212 1.977734257    10.10.1.2 → 10.10.1.1    TCP 83 46400 → 8081 [PSH, ACK] Seq=1973 Ack=1973 Win=64256 Len=17 TSval=1044972789 TSecr=3169232493
1711547392.703675032  1214 1.977869851    10.10.1.1 → 10.10.1.2    TCP 83 8081 → 46400 [PSH, ACK] Seq=1973 Ack=1990 Win=65152 Len=17 TSval=3169232497 TSecr=1044972789
1711547400.703675032  1222 1.981380267    10.10.1.2 → 10.10.1.1    TCP 83 46400 → 8081 [PSH, ACK] Seq=1990 Ack=1990 Win=64256 Len=17 TSval=1044972793 TSecr=3169232497
1711547402.703675032  1224 1.981516672    10.10.1.1 → 10.10.1.2    TCP 83 8081 → 46400 [PSH, ACK] Seq=1990 Ack=2007 Win=65152 Len=17 TSval=3169232501 TSecr=1044972793
1711547410.703675032  1232 1.986426633    10.10.1.2 → 10.10.1.1    TCP 83 46400 → 8081 [PSH, ACK] Seq=2007 Ack=2007 Win=64256 Len=17 TSval=1044972798 TSecr=3169232501
1711547412.703675032  1234 1.986566076    10.10.1.1 → 10.10.1.2    TCP 83 8081 → 46400 [PSH, ACK] Seq=2007 Ack=2024 Win=65152 Len=17 TSval=3169232506 TSecr=1044972798
1711547420.703675032  1242 1.989974917    10.10.1.2 → 10.10.1.1    TCP 83 46400 → 8081 [PSH, ACK] Seq=2024 Ack=2024 Win=64256 Len=17 TSval=1044972801 TSecr=3169232506
1711547423.703675032  1245 1.990125755    10.10.1.1 → 10.10.1.2    TCP 83 8081 → 46400 [PSH, ACK] Seq=2024 Ack=2041 Win=65152 Len=17 TSval=3169232510 TSecr=1044972801
1711547430.703675032  1252 1.991468188    10.10.1.2 → 10.10.1.1    TCP 83 46400 → 8081 [PSH, ACK] Seq=2041 Ack=2041 Win=64256 Len=17 TSval=1044972803 TSecr=3169232510
