1711546173.871603251    22 0.281609982    10.10.1.2 → 10.10.1.1    TCP 74 56584 → 8081 [SYN] Seq=0 Win=64240 Len=0 MSS=1460 SACK_PERM=1 TSval=1044945046 TSecr=0 WS=128
1711546174.871603251    23 0.281646919    10.10.1.1 → 10.10.1.2    TCP 74 8081 → 56584 [SYN, ACK] Seq=0 Ack=1 Win=65160 Len=0 MSS=1460 SACK_PERM=1 TSval=3169204754 TSecr=1044945046 WS=128
1711546175.871603251    24 0.281722208    10.10.1.2 → 10.10.1.1    TCP 66 56584 → 8081 [ACK] Seq=1 Ack=1 Win=64256 Len=0 TSval=1044945046 TSecr=3169204754
1711546188.871603251    37 0.539122474    10.10.1.2 → 10.10.1.1    TCP 83 56584 → 8081 [PSH, ACK] Seq=1 Ack=1 Win=64256 Len=17 TSval=1044945303 TSecr=3169204754
1711546190.871603251    39 0.539151412    10.10.1.1 → 10.10.1.2    TCP 66 8081 → 56584 [ACK] Seq=1 Ack=18 Win=65152 Len=0 TSval=3169205012 TSecr=1044945303
1711546192.871603251    41 0.539408481    10.10.1.1 → 10.10.1.2    TCP 83 8081 → 56584 [PSH, ACK] Seq=1 Ack=18 Win=65152 Len=17 TSval=3169205012 TSecr=1044945303
1711546193.871603251    42 0.539437096    10.10.1.2 → 10.10.1.1    TCP 66 56584 → 8081 [ACK] Seq=18 Ack=18 Win=64256 Len=0 TSval=1044945304 TSecr=3169205012
1711546200.871603251    49 0.542039476    10.10.1.2 → 10.10.1.1    TCP 83 56584 → 8081 [PSH, ACK] Seq=18 Ack=18 Win=64256 Len=17 TSval=1044945306 TSecr=3169205012
1711546203.871603251    52 0.542134863    10.10.1.1 → 10.10.1.2    TCP 83 8081 → 56584 [PSH, ACK] Seq=18 Ack=35 Win=65152 Len=17 TSval=3169205015 TSecr=1044945306
1711546210.871603251    59 0.544020304    10.10.1.2 → 10.10.1.1    TCP 83 56584 → 8081 [PSH, ACK] Seq=35 Ack=35 Win=64256 Len=17 TSval=1044945308 TSecr=3169205015
1711546213.871603251    62 0.544144456    10.10.1.1 → 10.10.1.2    TCP 83 8081 → 56584 [PSH, ACK] Seq=35 Ack=52 Win=65152 Len=17 TSval=3169205017 TSecr=1044945308
1711546220.871603251    69 0.554459479    10.10.1.2 → 10.10.1.1    TCP 83 56584 → 8081 [PSH, ACK] Seq=52 Ack=52 Win=64256 Len=17 TSval=1044945319 TSecr=3169205017
1711546223.871603251    72 0.554588004    10.10.1.1 → 10.10.1.2    TCP 83 8081 → 56584 [PSH, ACK] Seq=52 Ack=69 Win=65152 Len=17 TSval=3169205027 TSecr=1044945319
1711546230.871603251    79 0.557373514    10.10.1.2 → 10.10.1.1    TCP 83 56584 → 8081 [PSH, ACK] Seq=69 Ack=69 Win=64256 Len=17 TSval=1044945322 TSecr=3169205027
1711546233.871603251    82 0.557502643    10.10.1.1 → 10.10.1.2    TCP 83 8081 → 56584 [PSH, ACK] Seq=69 Ack=86 Win=65152 Len=17 TSval=3169205030 TSecr=1044945322
1711546241.871603251    90 0.598999472    10.10.1.2 → 10.10.1.1    TCP 83 56584 → 8081 [PSH, ACK] Seq=86 Ack=86 Win=64256 Len=17 TSval=1044945363 TSecr=3169205030
1711546243.871603251    92 0.599139300    10.10.1.1 → 10.10.1.2    TCP 83 8081 → 56584 [PSH, ACK] Seq=86 Ack=103 Win=65152 Len=17 TSval=3169205072 TSecr=1044945363
1711546253.871603251   102 0.604795983    10.10.1.2 → 10.10.1.1    TCP 83 56584 → 8081 [PSH, ACK] Seq=103 Ack=103 Win=64256 Len=17 TSval=1044945369 TSecr=3169205072
1711546255.871603251   104 0.604954898    10.10.1.1 → 10.10.1.2    TCP 83 8081 → 56584 [PSH, ACK] Seq=103 Ack=120 Win=65152 Len=17 TSval=3169205078 TSecr=1044945369
1711546263.871603251   112 0.609265687    10.10.1.2 → 10.10.1.1    TCP 83 56584 → 8081 [PSH, ACK] Seq=120 Ack=120 Win=64256 Len=17 TSval=1044945374 TSecr=3169205078
1711546265.871603251   114 0.609420545    10.10.1.1 → 10.10.1.2    TCP 83 8081 → 56584 [PSH, ACK] Seq=120 Ack=137 Win=65152 Len=17 TSval=3169205082 TSecr=1044945374
1711546272.871603251   121 0.620374806    10.10.1.2 → 10.10.1.1    TCP 83 56584 → 8081 [PSH, ACK] Seq=137 Ack=137 Win=64256 Len=17 TSval=1044945385 TSecr=3169205082
1711546274.871603251   123 0.620475732    10.10.1.1 → 10.10.1.2    TCP 83 8081 → 56584 [PSH, ACK] Seq=137 Ack=154 Win=65152 Len=17 TSval=3169205093 TSecr=1044945385
1711546282.871603251   131 0.628986956    10.10.1.2 → 10.10.1.1    TCP 83 56584 → 8081 [PSH, ACK] Seq=154 Ack=154 Win=64256 Len=17 TSval=1044945393 TSecr=3169205093
1711546284.871603251   133 0.629088063    10.10.1.1 → 10.10.1.2    TCP 83 8081 → 56584 [PSH, ACK] Seq=154 Ack=171 Win=65152 Len=17 TSval=3169205102 TSecr=1044945393
1711546292.871603251   141 0.634007639    10.10.1.2 → 10.10.1.1    TCP 83 56584 → 8081 [PSH, ACK] Seq=171 Ack=171 Win=64256 Len=17 TSval=1044945398 TSecr=3169205102
1711546294.871603251   143 0.634109481    10.10.1.1 → 10.10.1.2    TCP 83 8081 → 56584 [PSH, ACK] Seq=171 Ack=188 Win=65152 Len=17 TSval=3169205107 TSecr=1044945398
1711546302.871603251   151 0.641648831    10.10.1.2 → 10.10.1.1    TCP 83 56584 → 8081 [PSH, ACK] Seq=188 Ack=188 Win=64256 Len=17 TSval=1044945406 TSecr=3169205107
1711546304.871603251   153 0.641751700    10.10.1.1 → 10.10.1.2    TCP 83 8081 → 56584 [PSH, ACK] Seq=188 Ack=205 Win=65152 Len=17 TSval=3169205114 TSecr=1044945406
1711546314.871603251   163 0.642530197    10.10.1.2 → 10.10.1.1    TCP 83 56584 → 8081 [PSH, ACK] Seq=205 Ack=205 Win=64256 Len=17 TSval=1044945407 TSecr=3169205114
1711546315.871603251   164 0.642579816    10.10.1.1 → 10.10.1.2    TCP 83 8081 → 56584 [PSH, ACK] Seq=205 Ack=222 Win=65152 Len=17 TSval=3169205115 TSecr=1044945407
1711546323.871603251   172 0.645816909    10.10.1.2 → 10.10.1.1    TCP 83 56584 → 8081 [PSH, ACK] Seq=222 Ack=222 Win=64256 Len=17 TSval=1044945410 TSecr=3169205115
1711546325.871603251   174 0.645921545    10.10.1.1 → 10.10.1.2    TCP 83 8081 → 56584 [PSH, ACK] Seq=222 Ack=239 Win=65152 Len=17 TSval=3169205118 TSecr=1044945410
1711546333.871603251   182 0.650351559    10.10.1.2 → 10.10.1.1    TCP 83 56584 → 8081 [PSH, ACK] Seq=239 Ack=239 Win=64256 Len=17 TSval=1044945415 TSecr=3169205118
1711546335.871603251   184 0.650449406    10.10.1.1 → 10.10.1.2    TCP 83 8081 → 56584 [PSH, ACK] Seq=239 Ack=256 Win=65152 Len=17 TSval=3169205123 TSecr=1044945415
1711546343.871603251   192 0.666300306    10.10.1.2 → 10.10.1.1    TCP 83 56584 → 8081 [PSH, ACK] Seq=256 Ack=256 Win=64256 Len=17 TSval=1044945431 TSecr=3169205123
1711546345.871603251   194 0.666403062    10.10.1.1 → 10.10.1.2    TCP 83 8081 → 56584 [PSH, ACK] Seq=256 Ack=273 Win=65152 Len=17 TSval=3169205139 TSecr=1044945431
1711546353.871603251   202 0.703740436    10.10.1.2 → 10.10.1.1    TCP 83 56584 → 8081 [PSH, ACK] Seq=273 Ack=273 Win=64256 Len=17 TSval=1044945468 TSecr=3169205139
1711546355.871603251   204 0.703842581    10.10.1.1 → 10.10.1.2    TCP 83 8081 → 56584 [PSH, ACK] Seq=273 Ack=290 Win=65152 Len=17 TSval=3169205176 TSecr=1044945468
1711546363.871603251   212 0.712071722    10.10.1.2 → 10.10.1.1    TCP 83 56584 → 8081 [PSH, ACK] Seq=290 Ack=290 Win=64256 Len=17 TSval=1044945476 TSecr=3169205176
1711546365.871603251   214 0.712171707    10.10.1.1 → 10.10.1.2    TCP 83 8081 → 56584 [PSH, ACK] Seq=290 Ack=307 Win=65152 Len=17 TSval=3169205185 TSecr=1044945476
1711546373.871603251   222 0.715709895    10.10.1.2 → 10.10.1.1    TCP 83 56584 → 8081 [PSH, ACK] Seq=307 Ack=307 Win=64256 Len=17 TSval=1044945480 TSecr=3169205185
1711546375.871603251   224 0.715816011    10.10.1.1 → 10.10.1.2    TCP 83 8081 → 56584 [PSH, ACK] Seq=307 Ack=324 Win=65152 Len=17 TSval=3169205188 TSecr=1044945480
1711546383.871603251   232 0.721006444    10.10.1.2 → 10.10.1.1    TCP 83 56584 → 8081 [PSH, ACK] Seq=324 Ack=324 Win=64256 Len=17 TSval=1044945485 TSecr=3169205188
1711546386.871603251   235 0.721107619    10.10.1.1 → 10.10.1.2    TCP 83 8081 → 56584 [PSH, ACK] Seq=324 Ack=341 Win=65152 Len=17 TSval=3169205194 TSecr=1044945485
1711546393.871603251   242 0.736325924    10.10.1.2 → 10.10.1.1    TCP 83 56584 → 8081 [PSH, ACK] Seq=341 Ack=341 Win=64256 Len=17 TSval=1044945501 TSecr=3169205194
1711546395.871603251   244 0.736429084    10.10.1.1 → 10.10.1.2    TCP 83 8081 → 56584 [PSH, ACK] Seq=341 Ack=358 Win=65152 Len=17 TSval=3169205209 TSecr=1044945501
1711546403.871603251   252 0.745093066    10.10.1.2 → 10.10.1.1    TCP 83 56584 → 8081 [PSH, ACK] Seq=358 Ack=358 Win=64256 Len=17 TSval=1044945509 TSecr=3169205209
1711546405.871603251   254 0.745195048    10.10.1.1 → 10.10.1.2    TCP 83 8081 → 56584 [PSH, ACK] Seq=358 Ack=375 Win=65152 Len=17 TSval=3169205218 TSecr=1044945509
1711546413.871603251   262 0.747558479    10.10.1.2 → 10.10.1.1    TCP 83 56584 → 8081 [PSH, ACK] Seq=375 Ack=375 Win=64256 Len=17 TSval=1044945512 TSecr=3169205218
1711546415.871603251   264 0.747655788    10.10.1.1 → 10.10.1.2    TCP 83 8081 → 56584 [PSH, ACK] Seq=375 Ack=392 Win=65152 Len=17 TSval=3169205220 TSecr=1044945512
1711546423.871603251   272 0.755451569    10.10.1.2 → 10.10.1.1    TCP 83 56584 → 8081 [PSH, ACK] Seq=392 Ack=392 Win=64256 Len=17 TSval=1044945520 TSecr=3169205220
1711546425.871603251   274 0.755555500    10.10.1.1 → 10.10.1.2    TCP 83 8081 → 56584 [PSH, ACK] Seq=392 Ack=409 Win=65152 Len=17 TSval=3169205228 TSecr=1044945520
1711546433.871603251   282 0.757320677    10.10.1.2 → 10.10.1.1    TCP 83 56584 → 8081 [PSH, ACK] Seq=409 Ack=409 Win=64256 Len=17 TSval=1044945522 TSecr=3169205228
1711546435.871603251   284 0.757424618    10.10.1.1 → 10.10.1.2    TCP 83 8081 → 56584 [PSH, ACK] Seq=409 Ack=426 Win=65152 Len=17 TSval=3169205230 TSecr=1044945522
1711546443.871603251   292 0.764129131    10.10.1.2 → 10.10.1.1    TCP 83 56584 → 8081 [PSH, ACK] Seq=426 Ack=426 Win=64256 Len=17 TSval=1044945528 TSecr=3169205230
1711546445.871603251   294 0.764232104    10.10.1.1 → 10.10.1.2    TCP 83 8081 → 56584 [PSH, ACK] Seq=426 Ack=443 Win=65152 Len=17 TSval=3169205237 TSecr=1044945528
1711546453.871603251   302 0.771092252    10.10.1.2 → 10.10.1.1    TCP 83 56584 → 8081 [PSH, ACK] Seq=443 Ack=443 Win=64256 Len=17 TSval=1044945535 TSecr=3169205237
1711546455.871603251   304 0.771197290    10.10.1.1 → 10.10.1.2    TCP 83 8081 → 56584 [PSH, ACK] Seq=443 Ack=460 Win=65152 Len=17 TSval=3169205244 TSecr=1044945535
1711546463.871603251   312 0.805344866    10.10.1.2 → 10.10.1.1    TCP 83 56584 → 8081 [PSH, ACK] Seq=460 Ack=460 Win=64256 Len=17 TSval=1044945570 TSecr=3169205244
1711546465.871603251   314 0.805450608    10.10.1.1 → 10.10.1.2    TCP 83 8081 → 56584 [PSH, ACK] Seq=460 Ack=477 Win=65152 Len=17 TSval=3169205278 TSecr=1044945570
1711546473.871603251   322 0.805862064    10.10.1.2 → 10.10.1.1    TCP 83 56584 → 8081 [PSH, ACK] Seq=477 Ack=477 Win=64256 Len=17 TSval=1044945570 TSecr=3169205278
1711546475.871603251   324 0.805909581    10.10.1.1 → 10.10.1.2    TCP 83 8081 → 56584 [PSH, ACK] Seq=477 Ack=494 Win=65152 Len=17 TSval=3169205278 TSecr=1044945570
1711546483.871603251   332 0.822126148    10.10.1.2 → 10.10.1.1    TCP 83 56584 → 8081 [PSH, ACK] Seq=494 Ack=494 Win=64256 Len=17 TSval=1044945586 TSecr=3169205278
1711546485.871603251   334 0.822228224    10.10.1.1 → 10.10.1.2    TCP 83 8081 → 56584 [PSH, ACK] Seq=494 Ack=511 Win=65152 Len=17 TSval=3169205295 TSecr=1044945586
1711546493.871603251   342 0.823212810    10.10.1.2 → 10.10.1.1    TCP 83 56584 → 8081 [PSH, ACK] Seq=511 Ack=511 Win=64256 Len=17 TSval=1044945587 TSecr=3169205295
1711546495.871603251   344 0.823310910    10.10.1.1 → 10.10.1.2    TCP 83 8081 → 56584 [PSH, ACK] Seq=511 Ack=528 Win=65152 Len=17 TSval=3169205296 TSecr=1044945587
1711546503.871603251   352 0.832689507    10.10.1.2 → 10.10.1.1    TCP 83 56584 → 8081 [PSH, ACK] Seq=528 Ack=528 Win=64256 Len=17 TSval=1044945597 TSecr=3169205296
1711546505.871603251   354 0.832795138    10.10.1.1 → 10.10.1.2    TCP 83 8081 → 56584 [PSH, ACK] Seq=528 Ack=545 Win=65152 Len=17 TSval=3169205305 TSecr=1044945597
1711546513.871603251   362 0.833084633    10.10.1.2 → 10.10.1.1    TCP 83 56584 → 8081 [PSH, ACK] Seq=545 Ack=545 Win=64256 Len=17 TSval=1044945597 TSecr=3169205305
1711546515.871603251   364 0.833139966    10.10.1.1 → 10.10.1.2    TCP 83 8081 → 56584 [PSH, ACK] Seq=545 Ack=562 Win=65152 Len=17 TSval=3169205306 TSecr=1044945597
1711546523.871603251   372 0.835937284    10.10.1.2 → 10.10.1.1    TCP 83 56584 → 8081 [PSH, ACK] Seq=562 Ack=562 Win=64256 Len=17 TSval=1044945600 TSecr=3169205306
1711546525.871603251   374 0.836033885    10.10.1.1 → 10.10.1.2    TCP 83 8081 → 56584 [PSH, ACK] Seq=562 Ack=579 Win=65152 Len=17 TSval=3169205309 TSecr=1044945600
1711546533.871603251   382 0.838935974    10.10.1.2 → 10.10.1.1    TCP 83 56584 → 8081 [PSH, ACK] Seq=579 Ack=579 Win=64256 Len=17 TSval=1044945603 TSecr=3169205309
1711546535.871603251   384 0.839039911    10.10.1.1 → 10.10.1.2    TCP 83 8081 → 56584 [PSH, ACK] Seq=579 Ack=596 Win=65152 Len=17 TSval=3169205312 TSecr=1044945603
1711546543.871603251   392 0.841989737    10.10.1.2 → 10.10.1.1    TCP 83 56584 → 8081 [PSH, ACK] Seq=596 Ack=596 Win=64256 Len=17 TSval=1044945606 TSecr=3169205312
1711546545.871603251   394 0.842090140    10.10.1.1 → 10.10.1.2    TCP 83 8081 → 56584 [PSH, ACK] Seq=596 Ack=613 Win=65152 Len=17 TSval=3169205315 TSecr=1044945606
1711546553.871603251   402 0.844683063    10.10.1.2 → 10.10.1.1    TCP 83 56584 → 8081 [PSH, ACK] Seq=613 Ack=613 Win=64256 Len=17 TSval=1044945609 TSecr=3169205315
1711546555.871603251   404 0.844775560    10.10.1.1 → 10.10.1.2    TCP 83 8081 → 56584 [PSH, ACK] Seq=613 Ack=630 Win=65152 Len=17 TSval=3169205317 TSecr=1044945609
1711546563.871603251   412 0.855626897    10.10.1.2 → 10.10.1.1    TCP 83 56584 → 8081 [PSH, ACK] Seq=630 Ack=630 Win=64256 Len=17 TSval=1044945620 TSecr=3169205317
1711546565.871603251   414 0.855730626    10.10.1.1 → 10.10.1.2    TCP 83 8081 → 56584 [PSH, ACK] Seq=630 Ack=647 Win=65152 Len=17 TSval=3169205328 TSecr=1044945620
1711546573.871603251   422 0.864499740    10.10.1.2 → 10.10.1.1    TCP 83 56584 → 8081 [PSH, ACK] Seq=647 Ack=647 Win=64256 Len=17 TSval=1044945629 TSecr=3169205328
1711546575.871603251   424 0.864603825    10.10.1.1 → 10.10.1.2    TCP 83 8081 → 56584 [PSH, ACK] Seq=647 Ack=664 Win=65152 Len=17 TSval=3169205337 TSecr=1044945629
1711546583.871603251   432 0.885225155    10.10.1.2 → 10.10.1.1    TCP 83 56584 → 8081 [PSH, ACK] Seq=664 Ack=664 Win=64256 Len=17 TSval=1044945649 TSecr=3169205337
1711546585.871603251   434 0.885328157    10.10.1.1 → 10.10.1.2    TCP 83 8081 → 56584 [PSH, ACK] Seq=664 Ack=681 Win=65152 Len=17 TSval=3169205358 TSecr=1044945649
1711546593.871603251   442 0.888009236    10.10.1.2 → 10.10.1.1    TCP 83 56584 → 8081 [PSH, ACK] Seq=681 Ack=681 Win=64256 Len=17 TSval=1044945652 TSecr=3169205358
1711546595.871603251   444 0.888101383    10.10.1.1 → 10.10.1.2    TCP 83 8081 → 56584 [PSH, ACK] Seq=681 Ack=698 Win=65152 Len=17 TSval=3169205361 TSecr=1044945652
1711546603.871603251   452 0.918328806    10.10.1.2 → 10.10.1.1    TCP 83 56584 → 8081 [PSH, ACK] Seq=698 Ack=698 Win=64256 Len=17 TSval=1044945683 TSecr=3169205361
1711546605.871603251   454 0.918435259    10.10.1.1 → 10.10.1.2    TCP 83 8081 → 56584 [PSH, ACK] Seq=698 Ack=715 Win=65152 Len=17 TSval=3169205391 TSecr=1044945683
1711546613.871603251   462 0.923580727    10.10.1.2 → 10.10.1.1    TCP 83 56584 → 8081 [PSH, ACK] Seq=715 Ack=715 Win=64256 Len=17 TSval=1044945688 TSecr=3169205391
1711546615.871603251   464 0.923684425    10.10.1.1 → 10.10.1.2    TCP 83 8081 → 56584 [PSH, ACK] Seq=715 Ack=732 Win=65152 Len=17 TSval=3169205396 TSecr=1044945688
1711546623.871603251   472 0.927075725    10.10.1.2 → 10.10.1.1    TCP 83 56584 → 8081 [PSH, ACK] Seq=732 Ack=732 Win=64256 Len=17 TSval=1044945691 TSecr=3169205396
1711546625.871603251   474 0.927178635    10.10.1.1 → 10.10.1.2    TCP 83 8081 → 56584 [PSH, ACK] Seq=732 Ack=749 Win=65152 Len=17 TSval=3169205400 TSecr=1044945691
1711546633.871603251   482 0.929770033    10.10.1.2 → 10.10.1.1    TCP 83 56584 → 8081 [PSH, ACK] Seq=749 Ack=749 Win=64256 Len=17 TSval=1044945694 TSecr=3169205400
1711546635.871603251   484 0.929872620    10.10.1.1 → 10.10.1.2    TCP 83 8081 → 56584 [PSH, ACK] Seq=749 Ack=766 Win=65152 Len=17 TSval=3169205402 TSecr=1044945694
1711546643.871603251   492 0.943294093    10.10.1.2 → 10.10.1.1    TCP 83 56584 → 8081 [PSH, ACK] Seq=766 Ack=766 Win=64256 Len=17 TSval=1044945708 TSecr=3169205402
1711546645.871603251   494 0.943398718    10.10.1.1 → 10.10.1.2    TCP 83 8081 → 56584 [PSH, ACK] Seq=766 Ack=783 Win=65152 Len=17 TSval=3169205416 TSecr=1044945708
1711546653.871603251   502 0.944259755    10.10.1.2 → 10.10.1.1    TCP 83 56584 → 8081 [PSH, ACK] Seq=783 Ack=783 Win=64256 Len=17 TSval=1044945709 TSecr=3169205416
1711546655.871603251   504 0.944350662    10.10.1.1 → 10.10.1.2    TCP 83 8081 → 56584 [PSH, ACK] Seq=783 Ack=800 Win=65152 Len=17 TSval=3169205417 TSecr=1044945709
1711546663.871603251   512 0.946630473    10.10.1.2 → 10.10.1.1    TCP 83 56584 → 8081 [PSH, ACK] Seq=800 Ack=800 Win=64256 Len=17 TSval=1044945711 TSecr=3169205417
1711546665.871603251   514 0.946732587    10.10.1.1 → 10.10.1.2    TCP 83 8081 → 56584 [PSH, ACK] Seq=800 Ack=817 Win=65152 Len=17 TSval=3169205419 TSecr=1044945711
1711546673.871603251   522 0.950292194    10.10.1.2 → 10.10.1.1    TCP 83 56584 → 8081 [PSH, ACK] Seq=817 Ack=817 Win=64256 Len=17 TSval=1044945715 TSecr=3169205419
1711546675.871603251   524 0.950393968    10.10.1.1 → 10.10.1.2    TCP 83 8081 → 56584 [PSH, ACK] Seq=817 Ack=834 Win=65152 Len=17 TSval=3169205423 TSecr=1044945715
1711546683.871603251   532 0.954844030    10.10.1.2 → 10.10.1.1    TCP 83 56584 → 8081 [PSH, ACK] Seq=834 Ack=834 Win=64256 Len=17 TSval=1044945719 TSecr=3169205423
1711546685.871603251   534 0.954947028    10.10.1.1 → 10.10.1.2    TCP 83 8081 → 56584 [PSH, ACK] Seq=834 Ack=851 Win=65152 Len=17 TSval=3169205428 TSecr=1044945719
1711546693.871603251   542 0.963808842    10.10.1.2 → 10.10.1.1    TCP 83 56584 → 8081 [PSH, ACK] Seq=851 Ack=851 Win=64256 Len=17 TSval=1044945728 TSecr=3169205428
1711546695.871603251   544 0.963911236    10.10.1.1 → 10.10.1.2    TCP 83 8081 → 56584 [PSH, ACK] Seq=851 Ack=868 Win=65152 Len=17 TSval=3169205436 TSecr=1044945728
1711546704.871603251   553 0.964757408    10.10.1.2 → 10.10.1.1    TCP 83 56584 → 8081 [PSH, ACK] Seq=868 Ack=868 Win=64256 Len=17 TSval=1044945729 TSecr=3169205436
1711546705.871603251   554 0.964811027    10.10.1.1 → 10.10.1.2    TCP 83 8081 → 56584 [PSH, ACK] Seq=868 Ack=885 Win=65152 Len=17 TSval=3169205437 TSecr=1044945729
1711546713.871603251   562 0.989750739    10.10.1.2 → 10.10.1.1    TCP 83 56584 → 8081 [PSH, ACK] Seq=885 Ack=885 Win=64256 Len=17 TSval=1044945754 TSecr=3169205437
1711546715.871603251   564 0.989855151    10.10.1.1 → 10.10.1.2    TCP 83 8081 → 56584 [PSH, ACK] Seq=885 Ack=902 Win=65152 Len=17 TSval=3169205462 TSecr=1044945754
1711546723.871603251   572 1.004857724    10.10.1.2 → 10.10.1.1    TCP 83 56584 → 8081 [PSH, ACK] Seq=902 Ack=902 Win=64256 Len=17 TSval=1044945769 TSecr=3169205462
1711546725.871603251   574 1.004984263    10.10.1.1 → 10.10.1.2    TCP 83 8081 → 56584 [PSH, ACK] Seq=902 Ack=919 Win=65152 Len=17 TSval=3169205478 TSecr=1044945769
1711546733.871603251   582 1.014186011    10.10.1.2 → 10.10.1.1    TCP 83 56584 → 8081 [PSH, ACK] Seq=919 Ack=919 Win=64256 Len=17 TSval=1044945778 TSecr=3169205478
1711546735.871603251   584 1.014286595    10.10.1.1 → 10.10.1.2    TCP 83 8081 → 56584 [PSH, ACK] Seq=919 Ack=936 Win=65152 Len=17 TSval=3169205487 TSecr=1044945778
1711546743.871603251   592 1.015111371    10.10.1.2 → 10.10.1.1    TCP 83 56584 → 8081 [PSH, ACK] Seq=936 Ack=936 Win=64256 Len=17 TSval=1044945779 TSecr=3169205487
1711546745.871603251   594 1.015207959    10.10.1.1 → 10.10.1.2    TCP 83 8081 → 56584 [PSH, ACK] Seq=936 Ack=953 Win=65152 Len=17 TSval=3169205488 TSecr=1044945779
1711546753.871603251   602 1.018297281    10.10.1.2 → 10.10.1.1    TCP 83 56584 → 8081 [PSH, ACK] Seq=953 Ack=953 Win=64256 Len=17 TSval=1044945783 TSecr=3169205488
1711546756.871603251   605 1.018452300    10.10.1.1 → 10.10.1.2    TCP 83 8081 → 56584 [PSH, ACK] Seq=953 Ack=970 Win=65152 Len=17 TSval=3169205491 TSecr=1044945783
1711546763.871603251   612 1.019479342    10.10.1.2 → 10.10.1.1    TCP 83 56584 → 8081 [PSH, ACK] Seq=970 Ack=970 Win=64256 Len=17 TSval=1044945784 TSecr=3169205491
1711546765.871603251   614 1.019576620    10.10.1.1 → 10.10.1.2    TCP 83 8081 → 56584 [PSH, ACK] Seq=970 Ack=987 Win=65152 Len=17 TSval=3169205492 TSecr=1044945784
1711546773.871603251   622 1.019998447    10.10.1.2 → 10.10.1.1    TCP 83 56584 → 8081 [PSH, ACK] Seq=987 Ack=987 Win=64256 Len=17 TSval=1044945784 TSecr=3169205492
1711546775.871603251   624 1.020044820    10.10.1.1 → 10.10.1.2    TCP 83 8081 → 56584 [PSH, ACK] Seq=987 Ack=1004 Win=65152 Len=17 TSval=3169205493 TSecr=1044945784
1711546783.871603251   632 1.023459534    10.10.1.2 → 10.10.1.1    TCP 83 56584 → 8081 [PSH, ACK] Seq=1004 Ack=1004 Win=64256 Len=17 TSval=1044945788 TSecr=3169205493
1711546785.871603251   634 1.023561581    10.10.1.1 → 10.10.1.2    TCP 83 8081 → 56584 [PSH, ACK] Seq=1004 Ack=1021 Win=65152 Len=17 TSval=3169205496 TSecr=1044945788
1711546793.871603251   642 1.044693113    10.10.1.2 → 10.10.1.1    TCP 83 56584 → 8081 [PSH, ACK] Seq=1021 Ack=1021 Win=64256 Len=17 TSval=1044945809 TSecr=3169205496
1711546795.871603251   644 1.044795550    10.10.1.1 → 10.10.1.2    TCP 83 8081 → 56584 [PSH, ACK] Seq=1021 Ack=1038 Win=65152 Len=17 TSval=3169205517 TSecr=1044945809
1711546803.871603251   652 1.046060772    10.10.1.2 → 10.10.1.1    TCP 83 56584 → 8081 [PSH, ACK] Seq=1038 Ack=1038 Win=64256 Len=17 TSval=1044945810 TSecr=3169205517
1711546805.871603251   654 1.046161690    10.10.1.1 → 10.10.1.2    TCP 83 8081 → 56584 [PSH, ACK] Seq=1038 Ack=1055 Win=65152 Len=17 TSval=3169205519 TSecr=1044945810
1711546813.871603251   662 1.067112421    10.10.1.2 → 10.10.1.1    TCP 83 56584 → 8081 [PSH, ACK] Seq=1055 Ack=1055 Win=64256 Len=17 TSval=1044945831 TSecr=3169205519
1711546815.871603251   664 1.067215151    10.10.1.1 → 10.10.1.2    TCP 83 8081 → 56584 [PSH, ACK] Seq=1055 Ack=1072 Win=65152 Len=17 TSval=3169205540 TSecr=1044945831
1711546823.871603251   672 1.089414789    10.10.1.2 → 10.10.1.1    TCP 83 56584 → 8081 [PSH, ACK] Seq=1072 Ack=1072 Win=64256 Len=17 TSval=1044945854 TSecr=3169205540
1711546825.871603251   674 1.089519539    10.10.1.1 → 10.10.1.2    TCP 83 8081 → 56584 [PSH, ACK] Seq=1072 Ack=1089 Win=65152 Len=17 TSval=3169205562 TSecr=1044945854
1711546833.871603251   682 1.093704575    10.10.1.2 → 10.10.1.1    TCP 83 56584 → 8081 [PSH, ACK] Seq=1089 Ack=1089 Win=64256 Len=17 TSval=1044945858 TSecr=3169205562
1711546835.871603251   684 1.093808257    10.10.1.1 → 10.10.1.2    TCP 83 8081 → 56584 [PSH, ACK] Seq=1089 Ack=1106 Win=65152 Len=17 TSval=3169205566 TSecr=1044945858
1711546843.871603251   692 1.095185987    10.10.1.2 → 10.10.1.1    TCP 83 56584 → 8081 [PSH, ACK] Seq=1106 Ack=1106 Win=64256 Len=17 TSval=1044945859 TSecr=3169205566
1711546845.871603251   694 1.095283833    10.10.1.1 → 10.10.1.2    TCP 83 8081 → 56584 [PSH, ACK] Seq=1106 Ack=1123 Win=65152 Len=17 TSval=3169205568 TSecr=1044945859
1711546853.871603251   702 1.096867338    10.10.1.2 → 10.10.1.1    TCP 83 56584 → 8081 [PSH, ACK] Seq=1123 Ack=1123 Win=64256 Len=17 TSval=1044945861 TSecr=3169205568
1711546855.871603251   704 1.096986650    10.10.1.1 → 10.10.1.2    TCP 83 8081 → 56584 [PSH, ACK] Seq=1123 Ack=1140 Win=65152 Len=17 TSval=3169205570 TSecr=1044945861
1711546863.871603251   712 1.104951331    10.10.1.2 → 10.10.1.1    TCP 83 56584 → 8081 [PSH, ACK] Seq=1140 Ack=1140 Win=64256 Len=17 TSval=1044945869 TSecr=3169205570
1711546865.871603251   714 1.105053462    10.10.1.1 → 10.10.1.2    TCP 83 8081 → 56584 [PSH, ACK] Seq=1140 Ack=1157 Win=65152 Len=17 TSval=3169205578 TSecr=1044945869
1711546873.871603251   722 1.119735567    10.10.1.2 → 10.10.1.1    TCP 83 56584 → 8081 [PSH, ACK] Seq=1157 Ack=1157 Win=64256 Len=17 TSval=1044945884 TSecr=3169205578
1711546875.871603251   724 1.119845423    10.10.1.1 → 10.10.1.2    TCP 83 8081 → 56584 [PSH, ACK] Seq=1157 Ack=1174 Win=65152 Len=17 TSval=3169205592 TSecr=1044945884
1711546883.871603251   732 1.132200580    10.10.1.2 → 10.10.1.1    TCP 83 56584 → 8081 [PSH, ACK] Seq=1174 Ack=1174 Win=64256 Len=17 TSval=1044945896 TSecr=3169205592
1711546885.871603251   734 1.132303458    10.10.1.1 → 10.10.1.2    TCP 83 8081 → 56584 [PSH, ACK] Seq=1174 Ack=1191 Win=65152 Len=17 TSval=3169205605 TSecr=1044945896
1711546893.871603251   742 1.137784363    10.10.1.2 → 10.10.1.1    TCP 83 56584 → 8081 [PSH, ACK] Seq=1191 Ack=1191 Win=64256 Len=17 TSval=1044945902 TSecr=3169205605
1711546895.871603251   744 1.137886700    10.10.1.1 → 10.10.1.2    TCP 83 8081 → 56584 [PSH, ACK] Seq=1191 Ack=1208 Win=65152 Len=17 TSval=3169205610 TSecr=1044945902
1711546903.871603251   752 1.178854342    10.10.1.2 → 10.10.1.1    TCP 83 56584 → 8081 [PSH, ACK] Seq=1208 Ack=1208 Win=64256 Len=17 TSval=1044945943 TSecr=3169205610
1711546905.871603251   754 1.178958067    10.10.1.1 → 10.10.1.2    TCP 83 8081 → 56584 [PSH, ACK] Seq=1208 Ack=1225 Win=65152 Len=17 TSval=3169205652 TSecr=1044945943
1711546913.871603251   762 1.189763815    10.10.1.2 → 10.10.1.1    TCP 83 56584 → 8081 [PSH, ACK] Seq=1225 Ack=1225 Win=64256 Len=17 TSval=1044945954 TSecr=3169205652
1711546915.871603251   764 1.189865181    10.10.1.1 → 10.10.1.2    TCP 83 8081 → 56584 [PSH, ACK] Seq=1225 Ack=1242 Win=65152 Len=17 TSval=3169205662 TSecr=1044945954
1711546923.871603251   772 1.206105011    10.10.1.2 → 10.10.1.1    TCP 83 56584 → 8081 [PSH, ACK] Seq=1242 Ack=1242 Win=64256 Len=17 TSval=1044945970 TSecr=3169205662
1711546925.871603251   774 1.206206337    10.10.1.1 → 10.10.1.2    TCP 83 8081 → 56584 [PSH, ACK] Seq=1242 Ack=1259 Win=65152 Len=17 TSval=3169205679 TSecr=1044945970
1711546933.871603251   782 1.209365806    10.10.1.2 → 10.10.1.1    TCP 83 56584 → 8081 [PSH, ACK] Seq=1259 Ack=1259 Win=64256 Len=17 TSval=1044945974 TSecr=3169205679
1711546935.871603251   784 1.209468579    10.10.1.1 → 10.10.1.2    TCP 83 8081 → 56584 [PSH, ACK] Seq=1259 Ack=1276 Win=65152 Len=17 TSval=3169205682 TSecr=1044945974
1711546943.871603251   792 1.229676285    10.10.1.2 → 10.10.1.1    TCP 83 56584 → 8081 [PSH, ACK] Seq=1276 Ack=1276 Win=64256 Len=17 TSval=1044945994 TSecr=3169205682
1711546945.871603251   794 1.229780722    10.10.1.1 → 10.10.1.2    TCP 83 8081 → 56584 [PSH, ACK] Seq=1276 Ack=1293 Win=65152 Len=17 TSval=3169205702 TSecr=1044945994
1711546953.871603251   802 1.237584897    10.10.1.2 → 10.10.1.1    TCP 83 56584 → 8081 [PSH, ACK] Seq=1293 Ack=1293 Win=64256 Len=17 TSval=1044946002 TSecr=3169205702
1711546955.871603251   804 1.237686569    10.10.1.1 → 10.10.1.2    TCP 83 8081 → 56584 [PSH, ACK] Seq=1293 Ack=1310 Win=65152 Len=17 TSval=3169205710 TSecr=1044946002
1711546963.871603251   812 1.241724944    10.10.1.2 → 10.10.1.1    TCP 83 56584 → 8081 [PSH, ACK] Seq=1310 Ack=1310 Win=64256 Len=17 TSval=1044946006 TSecr=3169205710
1711546965.871603251   814 1.241827488    10.10.1.1 → 10.10.1.2    TCP 83 8081 → 56584 [PSH, ACK] Seq=1310 Ack=1327 Win=65152 Len=17 TSval=3169205714 TSecr=1044946006
1711546973.871603251   822 1.242568174    10.10.1.2 → 10.10.1.1    TCP 83 56584 → 8081 [PSH, ACK] Seq=1327 Ack=1327 Win=64256 Len=17 TSval=1044946007 TSecr=3169205714
1711546976.871603251   825 1.242667446    10.10.1.1 → 10.10.1.2    TCP 83 8081 → 56584 [PSH, ACK] Seq=1327 Ack=1344 Win=65152 Len=17 TSval=3169205715 TSecr=1044946007
1711546983.871603251   832 1.259819605    10.10.1.2 → 10.10.1.1    TCP 83 56584 → 8081 [PSH, ACK] Seq=1344 Ack=1344 Win=64256 Len=17 TSval=1044946024 TSecr=3169205715
1711546985.871603251   834 1.259920749    10.10.1.1 → 10.10.1.2    TCP 83 8081 → 56584 [PSH, ACK] Seq=1344 Ack=1361 Win=65152 Len=17 TSval=3169205732 TSecr=1044946024
1711546993.871603251   842 1.271009452    10.10.1.2 → 10.10.1.1    TCP 83 56584 → 8081 [PSH, ACK] Seq=1361 Ack=1361 Win=64256 Len=17 TSval=1044946035 TSecr=3169205732
1711546995.871603251   844 1.271113965    10.10.1.1 → 10.10.1.2    TCP 83 8081 → 56584 [PSH, ACK] Seq=1361 Ack=1378 Win=65152 Len=17 TSval=3169205744 TSecr=1044946035
1711547003.871603251   852 1.281281778    10.10.1.2 → 10.10.1.1    TCP 83 56584 → 8081 [PSH, ACK] Seq=1378 Ack=1378 Win=64256 Len=17 TSval=1044946046 TSecr=3169205744
1711547005.871603251   854 1.281384044    10.10.1.1 → 10.10.1.2    TCP 83 8081 → 56584 [PSH, ACK] Seq=1378 Ack=1395 Win=65152 Len=17 TSval=3169205754 TSecr=1044946046
1711547013.871603251   862 1.302598503    10.10.1.2 → 10.10.1.1    TCP 83 56584 → 8081 [PSH, ACK] Seq=1395 Ack=1395 Win=64256 Len=17 TSval=1044946067 TSecr=3169205754
1711547015.871603251   864 1.302700244    10.10.1.1 → 10.10.1.2    TCP 83 8081 → 56584 [PSH, ACK] Seq=1395 Ack=1412 Win=65152 Len=17 TSval=3169205775 TSecr=1044946067
1711547023.871603251   872 1.311553563    10.10.1.2 → 10.10.1.1    TCP 83 56584 → 8081 [PSH, ACK] Seq=1412 Ack=1412 Win=64256 Len=17 TSval=1044946076 TSecr=3169205775
1711547025.871603251   874 1.311655135    10.10.1.1 → 10.10.1.2    TCP 83 8081 → 56584 [PSH, ACK] Seq=1412 Ack=1429 Win=65152 Len=17 TSval=3169205784 TSecr=1044946076
1711547033.871603251   882 1.317017754    10.10.1.2 → 10.10.1.1    TCP 83 56584 → 8081 [PSH, ACK] Seq=1429 Ack=1429 Win=64256 Len=17 TSval=1044946081 TSecr=3169205784
1711547035.871603251   884 1.317121525    10.10.1.1 → 10.10.1.2    TCP 83 8081 → 56584 [PSH, ACK] Seq=1429 Ack=1446 Win=65152 Len=17 TSval=3169205790 TSecr=1044946081
1711547043.871603251   892 1.323693061    10.10.1.2 → 10.10.1.1    TCP 83 56584 → 8081 [PSH, ACK] Seq=1446 Ack=1446 Win=64256 Len=17 TSval=1044946088 TSecr=3169205790
1711547045.871603251   894 1.323796622    10.10.1.1 → 10.10.1.2    TCP 83 8081 → 56584 [PSH, ACK] Seq=1446 Ack=1463 Win=65152 Len=17 TSval=3169205796 TSecr=1044946088
1711547053.871603251   902 1.334168795    10.10.1.2 → 10.10.1.1    TCP 83 56584 → 8081 [PSH, ACK] Seq=1463 Ack=1463 Win=64256 Len=17 TSval=1044946098 TSecr=3169205796
1711547055.871603251   904 1.334270160    10.10.1.1 → 10.10.1.2    TCP 83 8081 → 56584 [PSH, ACK] Seq=1463 Ack=1480 Win=65152 Len=17 TSval=3169205807 TSecr=1044946098
1711547063.871603251   912 1.345058509    10.10.1.2 → 10.10.1.1    TCP 83 56584 → 8081 [PSH, ACK] Seq=1480 Ack=1480 Win=64256 Len=17 TSval=1044946109 TSecr=3169205807
1711547065.871603251   914 1.345159216    10.10.1.1 → 10.10.1.2    TCP 83 8081 → 56584 [PSH, ACK] Seq=1480 Ack=1497 Win=65152 Len=17 TSval=3169205818 TSecr=1044946109
1711547073.871603251   922 1.353332548    10.10.1.2 → 10.10.1.1    TCP 83 56584 → 8081 [PSH, ACK] Seq=1497 Ack=1497 Win=64256 Len=17 TSval=1044946118 TSecr=3169205818
1711547075.871603251   924 1.353437265    10.10.1.1 → 10.10.1.2    TCP 83 8081 → 56584 [PSH, ACK] Seq=1497 Ack=1514 Win=65152 Len=17 TSval=3169205826 TSecr=1044946118
1711547083.871603251   932 1.364545496    10.10.1.2 → 10.10.1.1    TCP 83 56584 → 8081 [PSH, ACK] Seq=1514 Ack=1514 Win=64256 Len=17 TSval=1044946129 TSecr=3169205826
1711547085.871603251   934 1.364648713    10.10.1.1 → 10.10.1.2    TCP 83 8081 → 56584 [PSH, ACK] Seq=1514 Ack=1531 Win=65152 Len=17 TSval=3169205837 TSecr=1044946129
1711547093.871603251   942 1.390946392    10.10.1.2 → 10.10.1.1    TCP 83 56584 → 8081 [PSH, ACK] Seq=1531 Ack=1531 Win=64256 Len=17 TSval=1044946155 TSecr=3169205837
1711547095.871603251   944 1.391049306    10.10.1.1 → 10.10.1.2    TCP 83 8081 → 56584 [PSH, ACK] Seq=1531 Ack=1548 Win=65152 Len=17 TSval=3169205864 TSecr=1044946155
1711547103.871603251   952 1.396793802    10.10.1.2 → 10.10.1.1    TCP 83 56584 → 8081 [PSH, ACK] Seq=1548 Ack=1548 Win=64256 Len=17 TSval=1044946161 TSecr=3169205864
1711547105.871603251   954 1.396897052    10.10.1.1 → 10.10.1.2    TCP 83 8081 → 56584 [PSH, ACK] Seq=1548 Ack=1565 Win=65152 Len=17 TSval=3169205869 TSecr=1044946161
1711547113.871603251   962 1.411521745    10.10.1.2 → 10.10.1.1    TCP 83 56584 → 8081 [PSH, ACK] Seq=1565 Ack=1565 Win=64256 Len=17 TSval=1044946176 TSecr=3169205869
1711547115.871603251   964 1.411624059    10.10.1.1 → 10.10.1.2    TCP 83 8081 → 56584 [PSH, ACK] Seq=1565 Ack=1582 Win=65152 Len=17 TSval=3169205884 TSecr=1044946176
1711547123.871603251   972 1.427963356    10.10.1.2 → 10.10.1.1    TCP 83 56584 → 8081 [PSH, ACK] Seq=1582 Ack=1582 Win=64256 Len=17 TSval=1044946192 TSecr=3169205884
1711547125.871603251   974 1.428065024    10.10.1.1 → 10.10.1.2    TCP 83 8081 → 56584 [PSH, ACK] Seq=1582 Ack=1599 Win=65152 Len=17 TSval=3169205901 TSecr=1044946192
1711547133.871603251   982 1.432054361    10.10.1.2 → 10.10.1.1    TCP 83 56584 → 8081 [PSH, ACK] Seq=1599 Ack=1599 Win=64256 Len=17 TSval=1044946196 TSecr=3169205901
1711547135.871603251   984 1.432156698    10.10.1.1 → 10.10.1.2    TCP 83 8081 → 56584 [PSH, ACK] Seq=1599 Ack=1616 Win=65152 Len=17 TSval=3169205905 TSecr=1044946196
1711547143.871603251   992 1.433325061    10.10.1.2 → 10.10.1.1    TCP 83 56584 → 8081 [PSH, ACK] Seq=1616 Ack=1616 Win=64256 Len=17 TSval=1044946198 TSecr=3169205905
1711547145.871603251   994 1.433426108    10.10.1.1 → 10.10.1.2    TCP 83 8081 → 56584 [PSH, ACK] Seq=1616 Ack=1633 Win=65152 Len=17 TSval=3169205906 TSecr=1044946198
1711547153.871603251  1002 1.457778046    10.10.1.2 → 10.10.1.1    TCP 83 56584 → 8081 [PSH, ACK] Seq=1633 Ack=1633 Win=64256 Len=17 TSval=1044946222 TSecr=3169205906
1711547155.871603251  1004 1.457881796    10.10.1.1 → 10.10.1.2    TCP 83 8081 → 56584 [PSH, ACK] Seq=1633 Ack=1650 Win=65152 Len=17 TSval=3169205930 TSecr=1044946222
1711547163.871603251  1012 1.463933525    10.10.1.2 → 10.10.1.1    TCP 83 56584 → 8081 [PSH, ACK] Seq=1650 Ack=1650 Win=64256 Len=17 TSval=1044946228 TSecr=3169205930
1711547165.871603251  1014 1.464035696    10.10.1.1 → 10.10.1.2    TCP 83 8081 → 56584 [PSH, ACK] Seq=1650 Ack=1667 Win=65152 Len=17 TSval=3169205937 TSecr=1044946228
1711547173.871603251  1022 1.474197811    10.10.1.2 → 10.10.1.1    TCP 83 56584 → 8081 [PSH, ACK] Seq=1667 Ack=1667 Win=64256 Len=17 TSval=1044946238 TSecr=3169205937
1711547175.871603251  1024 1.474301082    10.10.1.1 → 10.10.1.2    TCP 83 8081 → 56584 [PSH, ACK] Seq=1667 Ack=1684 Win=65152 Len=17 TSval=3169205947 TSecr=1044946238
1711547183.871603251  1032 1.485761551    10.10.1.2 → 10.10.1.1    TCP 83 56584 → 8081 [PSH, ACK] Seq=1684 Ack=1684 Win=64256 Len=17 TSval=1044946250 TSecr=3169205947
1711547185.871603251  1034 1.485864086    10.10.1.1 → 10.10.1.2    TCP 83 8081 → 56584 [PSH, ACK] Seq=1684 Ack=1701 Win=65152 Len=17 TSval=3169205958 TSecr=1044946250
1711547193.871603251  1042 1.487646262    10.10.1.2 → 10.10.1.1    TCP 83 56584 → 8081 [PSH, ACK] Seq=1701 Ack=1701 Win=64256 Len=17 TSval=1044946252 TSecr=3169205958
1711547195.871603251  1044 1.487742378    10.10.1.1 → 10.10.1.2    TCP 83 8081 → 56584 [PSH, ACK] Seq=1701 Ack=1718 Win=65152 Len=17 TSval=3169205960 TSecr=1044946252
1711547204.871603251  1053 1.488357358    10.10.1.2 → 10.10.1.1    TCP 83 56584 → 8081 [PSH, ACK] Seq=1718 Ack=1718 Win=64256 Len=17 TSval=1044946253 TSecr=3169205960
1711547206.871603251  1055 1.488419479    10.10.1.1 → 10.10.1.2    TCP 83 8081 → 56584 [PSH, ACK] Seq=1718 Ack=1735 Win=65152 Len=17 TSval=3169205961 TSecr=1044946253
1711547213.871603251  1062 1.499365414    10.10.1.2 → 10.10.1.1    TCP 83 56584 → 8081 [PSH, ACK] Seq=1735 Ack=1735 Win=64256 Len=17 TSval=1044946264 TSecr=3169205961
1711547215.871603251  1064 1.499468851    10.10.1.1 → 10.10.1.2    TCP 83 8081 → 56584 [PSH, ACK] Seq=1735 Ack=1752 Win=65152 Len=17 TSval=3169205972 TSecr=1044946264
1711547223.871603251  1072 1.515693411    10.10.1.2 → 10.10.1.1    TCP 83 56584 → 8081 [PSH, ACK] Seq=1752 Ack=1752 Win=64256 Len=17 TSval=1044946280 TSecr=3169205972
1711547225.871603251  1074 1.515797338    10.10.1.1 → 10.10.1.2    TCP 83 8081 → 56584 [PSH, ACK] Seq=1752 Ack=1769 Win=65152 Len=17 TSval=3169205988 TSecr=1044946280
1711547233.871603251  1082 1.534215846    10.10.1.2 → 10.10.1.1    TCP 83 56584 → 8081 [PSH, ACK] Seq=1769 Ack=1769 Win=64256 Len=17 TSval=1044946298 TSecr=3169205988
1711547235.871603251  1084 1.534318274    10.10.1.1 → 10.10.1.2    TCP 83 8081 → 56584 [PSH, ACK] Seq=1769 Ack=1786 Win=65152 Len=17 TSval=3169206007 TSecr=1044946298
1711547243.871603251  1092 1.558982969    10.10.1.2 → 10.10.1.1    TCP 83 56584 → 8081 [PSH, ACK] Seq=1786 Ack=1786 Win=64256 Len=17 TSval=1044946323 TSecr=3169206007
1711547245.871603251  1094 1.559084780    10.10.1.1 → 10.10.1.2    TCP 83 8081 → 56584 [PSH, ACK] Seq=1786 Ack=1803 Win=65152 Len=17 TSval=3169206032 TSecr=1044946323
1711547253.871603251  1102 1.570126496    10.10.1.2 → 10.10.1.1    TCP 83 56584 → 8081 [PSH, ACK] Seq=1803 Ack=1803 Win=64256 Len=17 TSval=1044946334 TSecr=3169206032
1711547255.871603251  1104 1.570228544    10.10.1.1 → 10.10.1.2    TCP 83 8081 → 56584 [PSH, ACK] Seq=1803 Ack=1820 Win=65152 Len=17 TSval=3169206043 TSecr=1044946334
1711547263.871603251  1112 1.575058611    10.10.1.2 → 10.10.1.1    TCP 83 56584 → 8081 [PSH, ACK] Seq=1820 Ack=1820 Win=64256 Len=17 TSval=1044946339 TSecr=3169206043
1711547265.871603251  1114 1.575161363    10.10.1.1 → 10.10.1.2    TCP 83 8081 → 56584 [PSH, ACK] Seq=1820 Ack=1837 Win=65152 Len=17 TSval=3169206048 TSecr=1044946339
1711547273.871603251  1122 1.578004544    10.10.1.2 → 10.10.1.1    TCP 83 56584 → 8081 [PSH, ACK] Seq=1837 Ack=1837 Win=64256 Len=17 TSval=1044946342 TSecr=3169206048
1711547275.871603251  1124 1.578106247    10.10.1.1 → 10.10.1.2    TCP 83 8081 → 56584 [PSH, ACK] Seq=1837 Ack=1854 Win=65152 Len=17 TSval=3169206051 TSecr=1044946342
1711547283.871603251  1132 1.590851572    10.10.1.2 → 10.10.1.1    TCP 83 56584 → 8081 [PSH, ACK] Seq=1854 Ack=1854 Win=64256 Len=17 TSval=1044946355 TSecr=3169206051
1711547285.871603251  1134 1.590953071    10.10.1.1 → 10.10.1.2    TCP 83 8081 → 56584 [PSH, ACK] Seq=1854 Ack=1871 Win=65152 Len=17 TSval=3169206064 TSecr=1044946355
1711547293.871603251  1142 1.593226201    10.10.1.2 → 10.10.1.1    TCP 83 56584 → 8081 [PSH, ACK] Seq=1871 Ack=1871 Win=64256 Len=17 TSval=1044946357 TSecr=3169206064
1711547295.871603251  1144 1.593328466    10.10.1.1 → 10.10.1.2    TCP 83 8081 → 56584 [PSH, ACK] Seq=1871 Ack=1888 Win=65152 Len=17 TSval=3169206066 TSecr=1044946357
1711547303.871603251  1152 1.615954901    10.10.1.2 → 10.10.1.1    TCP 83 56584 → 8081 [PSH, ACK] Seq=1888 Ack=1888 Win=64256 Len=17 TSval=1044946380 TSecr=3169206066
1711547305.871603251  1154 1.616058941    10.10.1.1 → 10.10.1.2    TCP 83 8081 → 56584 [PSH, ACK] Seq=1888 Ack=1905 Win=65152 Len=17 TSval=3169206089 TSecr=1044946380
1711547313.871603251  1162 1.620498409    10.10.1.2 → 10.10.1.1    TCP 83 56584 → 8081 [PSH, ACK] Seq=1905 Ack=1905 Win=64256 Len=17 TSval=1044946385 TSecr=3169206089
1711547315.871603251  1164 1.620600061    10.10.1.1 → 10.10.1.2    TCP 83 8081 → 56584 [PSH, ACK] Seq=1905 Ack=1922 Win=65152 Len=17 TSval=3169206093 TSecr=1044946385
1711547323.871603251  1172 1.621424067    10.10.1.2 → 10.10.1.1    TCP 83 56584 → 8081 [PSH, ACK] Seq=1922 Ack=1922 Win=64256 Len=17 TSval=1044946386 TSecr=3169206093
1711547326.871603251  1175 1.621541223    10.10.1.1 → 10.10.1.2    TCP 83 8081 → 56584 [PSH, ACK] Seq=1922 Ack=1939 Win=65152 Len=17 TSval=3169206094 TSecr=1044946386
1711547333.871603251  1182 1.628141941    10.10.1.2 → 10.10.1.1    TCP 83 56584 → 8081 [PSH, ACK] Seq=1939 Ack=1939 Win=64256 Len=17 TSval=1044946392 TSecr=3169206094
1711547335.871603251  1184 1.628243796    10.10.1.1 → 10.10.1.2    TCP 83 8081 → 56584 [PSH, ACK] Seq=1939 Ack=1956 Win=65152 Len=17 TSval=3169206101 TSecr=1044946392
1711547343.871603251  1192 1.642199432    10.10.1.2 → 10.10.1.1    TCP 83 56584 → 8081 [PSH, ACK] Seq=1956 Ack=1956 Win=64256 Len=17 TSval=1044946406 TSecr=3169206101
1711547345.871603251  1194 1.642302539    10.10.1.1 → 10.10.1.2    TCP 83 8081 → 56584 [PSH, ACK] Seq=1956 Ack=1973 Win=65152 Len=17 TSval=3169206115 TSecr=1044946406
1711547353.871603251  1202 1.650148818    10.10.1.2 → 10.10.1.1    TCP 83 56584 → 8081 [PSH, ACK] Seq=1973 Ack=1973 Win=64256 Len=17 TSval=1044946414 TSecr=3169206115
1711547355.871603251  1204 1.650251004    10.10.1.1 → 10.10.1.2    TCP 83 8081 → 56584 [PSH, ACK] Seq=1973 Ack=1990 Win=65152 Len=17 TSval=3169206123 TSecr=1044946414
1711547363.871603251  1212 1.651630046    10.10.1.2 → 10.10.1.1    TCP 83 56584 → 8081 [PSH, ACK] Seq=1990 Ack=1990 Win=64256 Len=17 TSval=1044946416 TSecr=3169206123
1711547365.871603251  1214 1.651727592    10.10.1.1 → 10.10.1.2    TCP 83 8081 → 56584 [PSH, ACK] Seq=1990 Ack=2007 Win=65152 Len=17 TSval=3169206124 TSecr=1044946416
