1711548791.524216652    28 0.532123582    10.10.1.2 → 10.10.1.1    TCP 83 49532 → 8081 [PSH, ACK] Seq=1 Ack=1 Win=64256 Len=17 TSval=1047556066 TSecr=3171815526
1711548795.524216652    32 0.532453125    10.10.1.1 → 10.10.1.2    TCP 83 8081 → 49532 [PSH, ACK] Seq=1 Ack=18 Win=65152 Len=17 TSval=3171815777 TSecr=1047556066
1711548801.524216652    38 0.533668120    10.10.1.2 → 10.10.1.1    TCP 83 49532 → 8081 [PSH, ACK] Seq=18 Ack=18 Win=64256 Len=17 TSval=1047556067 TSecr=3171815777
1711548804.524216652    41 0.533807010    10.10.1.1 → 10.10.1.2    TCP 83 8081 → 49532 [PSH, ACK] Seq=18 Ack=35 Win=65152 Len=17 TSval=3171815778 TSecr=1047556067
1711548809.524216652    46 0.534967936    10.10.1.2 → 10.10.1.1    TCP 83 49532 → 8081 [PSH, ACK] Seq=35 Ack=35 Win=64256 Len=17 TSval=1047556068 TSecr=3171815778
1711548812.524216652    49 0.535102054    10.10.1.1 → 10.10.1.2    TCP 83 8081 → 49532 [PSH, ACK] Seq=35 Ack=52 Win=65152 Len=17 TSval=3171815779 TSecr=1047556068
1711548817.524216652    54 0.536309437    10.10.1.2 → 10.10.1.1    TCP 83 49532 → 8081 [PSH, ACK] Seq=52 Ack=52 Win=64256 Len=17 TSval=1047556070 TSecr=3171815779
1711548820.524216652    57 0.536447142    10.10.1.1 → 10.10.1.2    TCP 83 8081 → 49532 [PSH, ACK] Seq=52 Ack=69 Win=65152 Len=17 TSval=3171815781 TSecr=1047556070
1711548825.524216652    62 0.537654793    10.10.1.2 → 10.10.1.1    TCP 83 49532 → 8081 [PSH, ACK] Seq=69 Ack=69 Win=64256 Len=17 TSval=1047556071 TSecr=3171815781
1711548828.524216652    65 0.537774011    10.10.1.1 → 10.10.1.2    TCP 83 8081 → 49532 [PSH, ACK] Seq=69 Ack=86 Win=65152 Len=17 TSval=3171815782 TSecr=1047556071
1711548833.524216652    70 0.538977645    10.10.1.2 → 10.10.1.1    TCP 83 49532 → 8081 [PSH, ACK] Seq=86 Ack=86 Win=64256 Len=17 TSval=1047556072 TSecr=3171815782
1711548835.524216652    72 0.539084636    10.10.1.1 → 10.10.1.2    TCP 83 8081 → 49532 [PSH, ACK] Seq=86 Ack=103 Win=65152 Len=17 TSval=3171815783 TSecr=1047556072
1711548841.524216652    78 0.540291123    10.10.1.2 → 10.10.1.1    TCP 83 49532 → 8081 [PSH, ACK] Seq=103 Ack=103 Win=64256 Len=17 TSval=1047556074 TSecr=3171815783
1711548843.524216652    80 0.540396768    10.10.1.1 → 10.10.1.2    TCP 83 8081 → 49532 [PSH, ACK] Seq=103 Ack=120 Win=65152 Len=17 TSval=3171815785 TSecr=1047556074
1711548849.524216652    86 0.541603546    10.10.1.2 → 10.10.1.1    TCP 83 49532 → 8081 [PSH, ACK] Seq=120 Ack=120 Win=64256 Len=17 TSval=1047556075 TSecr=3171815785
1711548851.524216652    88 0.541706383    10.10.1.1 → 10.10.1.2    TCP 83 8081 → 49532 [PSH, ACK] Seq=120 Ack=137 Win=65152 Len=17 TSval=3171815786 TSecr=1047556075
1711548857.524216652    94 0.542911720    10.10.1.2 → 10.10.1.1    TCP 83 49532 → 8081 [PSH, ACK] Seq=137 Ack=137 Win=64256 Len=17 TSval=1047556076 TSecr=3171815786
1711548859.524216652    96 0.543016309    10.10.1.1 → 10.10.1.2    TCP 83 8081 → 49532 [PSH, ACK] Seq=137 Ack=154 Win=65152 Len=17 TSval=3171815787 TSecr=1047556076
1711548865.524216652   102 0.544222833    10.10.1.2 → 10.10.1.1    TCP 83 49532 → 8081 [PSH, ACK] Seq=154 Ack=154 Win=64256 Len=17 TSval=1047556078 TSecr=3171815787
1711548867.524216652   104 0.544328305    10.10.1.1 → 10.10.1.2    TCP 83 8081 → 49532 [PSH, ACK] Seq=154 Ack=171 Win=65152 Len=17 TSval=3171815789 TSecr=1047556078
1711548874.524216652   111 0.545533132    10.10.1.2 → 10.10.1.1    TCP 83 49532 → 8081 [PSH, ACK] Seq=171 Ack=171 Win=64256 Len=17 TSval=1047556079 TSecr=3171815789
1711548875.524216652   112 0.545615088    10.10.1.1 → 10.10.1.2    TCP 83 8081 → 49532 [PSH, ACK] Seq=171 Ack=188 Win=65152 Len=17 TSval=3171815790 TSecr=1047556079
1711548881.524216652   118 0.546819603    10.10.1.2 → 10.10.1.1    TCP 83 49532 → 8081 [PSH, ACK] Seq=188 Ack=188 Win=64256 Len=17 TSval=1047556080 TSecr=3171815790
1711548883.524216652   120 0.546925128    10.10.1.1 → 10.10.1.2    TCP 83 8081 → 49532 [PSH, ACK] Seq=188 Ack=205 Win=65152 Len=17 TSval=3171815791 TSecr=1047556080
1711548889.524216652   126 0.548132822    10.10.1.2 → 10.10.1.1    TCP 83 49532 → 8081 [PSH, ACK] Seq=205 Ack=205 Win=64256 Len=17 TSval=1047556082 TSecr=3171815791
1711548891.524216652   128 0.548268871    10.10.1.1 → 10.10.1.2    TCP 83 8081 → 49532 [PSH, ACK] Seq=205 Ack=222 Win=65152 Len=17 TSval=3171815793 TSecr=1047556082
1711548897.524216652   134 0.549474004    10.10.1.2 → 10.10.1.1    TCP 83 49532 → 8081 [PSH, ACK] Seq=222 Ack=222 Win=64256 Len=17 TSval=1047556083 TSecr=3171815793
1711548900.524216652   137 0.549559103    10.10.1.1 → 10.10.1.2    TCP 83 8081 → 49532 [PSH, ACK] Seq=222 Ack=239 Win=65152 Len=17 TSval=3171815794 TSecr=1047556083
1711548905.524216652   142 0.550765263    10.10.1.2 → 10.10.1.1    TCP 83 49532 → 8081 [PSH, ACK] Seq=239 Ack=239 Win=64256 Len=17 TSval=1047556084 TSecr=3171815794
1711548907.524216652   144 0.550898941    10.10.1.1 → 10.10.1.2    TCP 83 8081 → 49532 [PSH, ACK] Seq=239 Ack=256 Win=65152 Len=17 TSval=3171815795 TSecr=1047556084
1711548913.524216652   150 0.552106603    10.10.1.2 → 10.10.1.1    TCP 83 49532 → 8081 [PSH, ACK] Seq=256 Ack=256 Win=64256 Len=17 TSval=1047556086 TSecr=3171815795
1711548915.524216652   152 0.552231981    10.10.1.1 → 10.10.1.2    TCP 83 8081 → 49532 [PSH, ACK] Seq=256 Ack=273 Win=65152 Len=17 TSval=3171815797 TSecr=1047556086
1711548921.524216652   158 0.553439580    10.10.1.2 → 10.10.1.1    TCP 83 49532 → 8081 [PSH, ACK] Seq=273 Ack=273 Win=64256 Len=17 TSval=1047556087 TSecr=3171815797
1711548923.524216652   160 0.553575215    10.10.1.1 → 10.10.1.2    TCP 83 8081 → 49532 [PSH, ACK] Seq=273 Ack=290 Win=65152 Len=17 TSval=3171815798 TSecr=1047556087
1711548929.524216652   166 0.554781080    10.10.1.2 → 10.10.1.1    TCP 83 49532 → 8081 [PSH, ACK] Seq=290 Ack=290 Win=64256 Len=17 TSval=1047556088 TSecr=3171815798
1711548931.524216652   168 0.554906598    10.10.1.1 → 10.10.1.2    TCP 83 8081 → 49532 [PSH, ACK] Seq=290 Ack=307 Win=65152 Len=17 TSval=3171815799 TSecr=1047556088
1711548937.524216652   174 0.556115375    10.10.1.2 → 10.10.1.1    TCP 83 49532 → 8081 [PSH, ACK] Seq=307 Ack=307 Win=64256 Len=17 TSval=1047556090 TSecr=3171815799
1711548939.524216652   176 0.556241889    10.10.1.1 → 10.10.1.2    TCP 83 8081 → 49532 [PSH, ACK] Seq=307 Ack=324 Win=65152 Len=17 TSval=3171815801 TSecr=1047556090
1711548945.524216652   182 0.557449481    10.10.1.2 → 10.10.1.1    TCP 83 49532 → 8081 [PSH, ACK] Seq=324 Ack=324 Win=64256 Len=17 TSval=1047556091 TSecr=3171815801
1711548947.524216652   184 0.557585716    10.10.1.1 → 10.10.1.2    TCP 83 8081 → 49532 [PSH, ACK] Seq=324 Ack=341 Win=65152 Len=17 TSval=3171815802 TSecr=1047556091
1711548953.524216652   190 0.558790920    10.10.1.2 → 10.10.1.1    TCP 83 49532 → 8081 [PSH, ACK] Seq=341 Ack=341 Win=64256 Len=17 TSval=1047556092 TSecr=3171815802
1711548955.524216652   192 0.558911571    10.10.1.1 → 10.10.1.2    TCP 83 8081 → 49532 [PSH, ACK] Seq=341 Ack=358 Win=65152 Len=17 TSval=3171815803 TSecr=1047556092
1711548961.524216652   198 0.560118968    10.10.1.2 → 10.10.1.1    TCP 83 49532 → 8081 [PSH, ACK] Seq=358 Ack=358 Win=64256 Len=17 TSval=1047556094 TSecr=3171815803
1711548963.524216652   200 0.560239940    10.10.1.1 → 10.10.1.2    TCP 83 8081 → 49532 [PSH, ACK] Seq=358 Ack=375 Win=65152 Len=17 TSval=3171815805 TSecr=1047556094
1711548969.524216652   206 0.561444748    10.10.1.2 → 10.10.1.1    TCP 83 49532 → 8081 [PSH, ACK] Seq=375 Ack=375 Win=64256 Len=17 TSval=1047556095 TSecr=3171815805
1711548971.524216652   208 0.561527398    10.10.1.1 → 10.10.1.2    TCP 83 8081 → 49532 [PSH, ACK] Seq=375 Ack=392 Win=65152 Len=17 TSval=3171815806 TSecr=1047556095
1711548977.524216652   214 0.562734229    10.10.1.2 → 10.10.1.1    TCP 83 49532 → 8081 [PSH, ACK] Seq=392 Ack=392 Win=64256 Len=17 TSval=1047556096 TSecr=3171815806
1711548979.524216652   216 0.562868412    10.10.1.1 → 10.10.1.2    TCP 83 8081 → 49532 [PSH, ACK] Seq=392 Ack=409 Win=65152 Len=17 TSval=3171815807 TSecr=1047556096
1711548985.524216652   222 0.564079191    10.10.1.2 → 10.10.1.1    TCP 83 49532 → 8081 [PSH, ACK] Seq=409 Ack=409 Win=64256 Len=17 TSval=1047556097 TSecr=3171815807
1711548987.524216652   224 0.564206377    10.10.1.1 → 10.10.1.2    TCP 83 8081 → 49532 [PSH, ACK] Seq=409 Ack=426 Win=65152 Len=17 TSval=3171815809 TSecr=1047556097
1711548993.524216652   230 0.565413778    10.10.1.2 → 10.10.1.1    TCP 83 49532 → 8081 [PSH, ACK] Seq=426 Ack=426 Win=64256 Len=17 TSval=1047556099 TSecr=3171815809
1711548995.524216652   232 0.565548300    10.10.1.1 → 10.10.1.2    TCP 83 8081 → 49532 [PSH, ACK] Seq=426 Ack=443 Win=65152 Len=17 TSval=3171815810 TSecr=1047556099
1711549001.524216652   238 0.566754509    10.10.1.2 → 10.10.1.1    TCP 83 49532 → 8081 [PSH, ACK] Seq=443 Ack=443 Win=64256 Len=17 TSval=1047556100 TSecr=3171815810
1711549003.524216652   240 0.566879184    10.10.1.1 → 10.10.1.2    TCP 83 8081 → 49532 [PSH, ACK] Seq=443 Ack=460 Win=65152 Len=17 TSval=3171815811 TSecr=1047556100
1711549009.524216652   246 0.568086647    10.10.1.2 → 10.10.1.1    TCP 83 49532 → 8081 [PSH, ACK] Seq=460 Ack=460 Win=64256 Len=17 TSval=1047556101 TSecr=3171815811
1711549011.524216652   248 0.568211797    10.10.1.1 → 10.10.1.2    TCP 83 8081 → 49532 [PSH, ACK] Seq=460 Ack=477 Win=65152 Len=17 TSval=3171815813 TSecr=1047556101
1711549017.524216652   254 0.569416604    10.10.1.2 → 10.10.1.1    TCP 83 49532 → 8081 [PSH, ACK] Seq=477 Ack=477 Win=64256 Len=17 TSval=1047556103 TSecr=3171815813
1711549020.524216652   257 0.569547182    10.10.1.1 → 10.10.1.2    TCP 83 8081 → 49532 [PSH, ACK] Seq=477 Ack=494 Win=65152 Len=17 TSval=3171815814 TSecr=1047556103
1711549025.524216652   262 0.570752930    10.10.1.2 → 10.10.1.1    TCP 83 49532 → 8081 [PSH, ACK] Seq=494 Ack=494 Win=64256 Len=17 TSval=1047556104 TSecr=3171815814
1711549027.524216652   264 0.570874308    10.10.1.1 → 10.10.1.2    TCP 83 8081 → 49532 [PSH, ACK] Seq=494 Ack=511 Win=65152 Len=17 TSval=3171815815 TSecr=1047556104
1711549033.524216652   270 0.572082062    10.10.1.2 → 10.10.1.1    TCP 83 49532 → 8081 [PSH, ACK] Seq=511 Ack=511 Win=64256 Len=17 TSval=1047556105 TSecr=3171815815
1711549035.524216652   272 0.572202634    10.10.1.1 → 10.10.1.2    TCP 83 8081 → 49532 [PSH, ACK] Seq=511 Ack=528 Win=65152 Len=17 TSval=3171815817 TSecr=1047556105
1711549041.524216652   278 0.573407344    10.10.1.2 → 10.10.1.1    TCP 83 49532 → 8081 [PSH, ACK] Seq=528 Ack=528 Win=64256 Len=17 TSval=1047556107 TSecr=3171815817
1711549044.524216652   281 0.573489667    10.10.1.1 → 10.10.1.2    TCP 83 8081 → 49532 [PSH, ACK] Seq=528 Ack=545 Win=65152 Len=17 TSval=3171815818 TSecr=1047556107
1711549049.524216652   286 0.574694659    10.10.1.2 → 10.10.1.1    TCP 83 49532 → 8081 [PSH, ACK] Seq=545 Ack=545 Win=64256 Len=17 TSval=1047556108 TSecr=3171815818
1711549051.524216652   288 0.574819800    10.10.1.1 → 10.10.1.2    TCP 83 8081 → 49532 [PSH, ACK] Seq=545 Ack=562 Win=65152 Len=17 TSval=3171815819 TSecr=1047556108
1711549057.524216652   294 0.576027238    10.10.1.2 → 10.10.1.1    TCP 83 49532 → 8081 [PSH, ACK] Seq=562 Ack=562 Win=64256 Len=17 TSval=1047556109 TSecr=3171815819
1711549059.524216652   296 0.576152635    10.10.1.1 → 10.10.1.2    TCP 83 8081 → 49532 [PSH, ACK] Seq=562 Ack=579 Win=65152 Len=17 TSval=3171815821 TSecr=1047556109
1711549065.524216652   302 0.577357520    10.10.1.2 → 10.10.1.1    TCP 83 49532 → 8081 [PSH, ACK] Seq=579 Ack=579 Win=64256 Len=17 TSval=1047556111 TSecr=3171815821
1711549068.524216652   305 0.577487271    10.10.1.1 → 10.10.1.2    TCP 83 8081 → 49532 [PSH, ACK] Seq=579 Ack=596 Win=65152 Len=17 TSval=3171815822 TSecr=1047556111
1711549073.524216652   310 0.578692731    10.10.1.2 → 10.10.1.1    TCP 83 49532 → 8081 [PSH, ACK] Seq=596 Ack=596 Win=64256 Len=17 TSval=1047556112 TSecr=3171815822
1711549075.524216652   312 0.578826204    10.10.1.1 → 10.10.1.2    TCP 83 8081 → 49532 [PSH, ACK] Seq=596 Ack=613 Win=65152 Len=17 TSval=3171815823 TSecr=1047556112
1711549081.524216652   318 0.580034474    10.10.1.2 → 10.10.1.1    TCP 83 49532 → 8081 [PSH, ACK] Seq=613 Ack=613 Win=64256 Len=17 TSval=1047556113 TSecr=3171815823
1711549083.524216652   320 0.580159099    10.10.1.1 → 10.10.1.2    TCP 83 8081 → 49532 [PSH, ACK] Seq=613 Ack=630 Win=65152 Len=17 TSval=3171815825 TSecr=1047556113
1711549089.524216652   326 0.581364560    10.10.1.2 → 10.10.1.1    TCP 83 49532 → 8081 [PSH, ACK] Seq=630 Ack=630 Win=64256 Len=17 TSval=1047556115 TSecr=3171815825
1711549092.524216652   329 0.581496067    10.10.1.1 → 10.10.1.2    TCP 83 8081 → 49532 [PSH, ACK] Seq=630 Ack=647 Win=65152 Len=17 TSval=3171815826 TSecr=1047556115
1711549097.524216652   334 0.582701379    10.10.1.2 → 10.10.1.1    TCP 83 49532 → 8081 [PSH, ACK] Seq=647 Ack=647 Win=64256 Len=17 TSval=1047556116 TSecr=3171815826
1711549099.524216652   336 0.582822260    10.10.1.1 → 10.10.1.2    TCP 83 8081 → 49532 [PSH, ACK] Seq=647 Ack=664 Win=65152 Len=17 TSval=3171815827 TSecr=1047556116
1711549105.524216652   342 0.584029882    10.10.1.2 → 10.10.1.1    TCP 83 49532 → 8081 [PSH, ACK] Seq=664 Ack=664 Win=64256 Len=17 TSval=1047556117 TSecr=3171815827
1711549107.524216652   344 0.584151904    10.10.1.1 → 10.10.1.2    TCP 83 8081 → 49532 [PSH, ACK] Seq=664 Ack=681 Win=65152 Len=17 TSval=3171815829 TSecr=1047556117
1711549113.524216652   350 0.585357451    10.10.1.2 → 10.10.1.1    TCP 83 49532 → 8081 [PSH, ACK] Seq=681 Ack=681 Win=64256 Len=17 TSval=1047556119 TSecr=3171815829
1711549116.524216652   353 0.585439524    10.10.1.1 → 10.10.1.2    TCP 83 8081 → 49532 [PSH, ACK] Seq=681 Ack=698 Win=65152 Len=17 TSval=3171815830 TSecr=1047556119
1711549121.524216652   358 0.586644825    10.10.1.2 → 10.10.1.1    TCP 83 49532 → 8081 [PSH, ACK] Seq=698 Ack=698 Win=64256 Len=17 TSval=1047556120 TSecr=3171815830
1711549123.524216652   360 0.586778516    10.10.1.1 → 10.10.1.2    TCP 83 8081 → 49532 [PSH, ACK] Seq=698 Ack=715 Win=65152 Len=17 TSval=3171815831 TSecr=1047556120
1711549129.524216652   366 0.587986147    10.10.1.2 → 10.10.1.1    TCP 83 49532 → 8081 [PSH, ACK] Seq=715 Ack=715 Win=64256 Len=17 TSval=1047556121 TSecr=3171815831
1711549131.524216652   368 0.588121545    10.10.1.1 → 10.10.1.2    TCP 83 8081 → 49532 [PSH, ACK] Seq=715 Ack=732 Win=65152 Len=17 TSval=3171815832 TSecr=1047556121
1711549137.524216652   374 0.589325973    10.10.1.2 → 10.10.1.1    TCP 83 49532 → 8081 [PSH, ACK] Seq=732 Ack=732 Win=64256 Len=17 TSval=1047556123 TSecr=3171815832
1711549140.524216652   377 0.589456939    10.10.1.1 → 10.10.1.2    TCP 83 8081 → 49532 [PSH, ACK] Seq=732 Ack=749 Win=65152 Len=17 TSval=3171815834 TSecr=1047556123
1711549145.524216652   382 0.590662968    10.10.1.2 → 10.10.1.1    TCP 83 49532 → 8081 [PSH, ACK] Seq=749 Ack=749 Win=64256 Len=17 TSval=1047556124 TSecr=3171815834
1711549147.524216652   384 0.590787750    10.10.1.1 → 10.10.1.2    TCP 83 8081 → 49532 [PSH, ACK] Seq=749 Ack=766 Win=65152 Len=17 TSval=3171815835 TSecr=1047556124
1711549153.524216652   390 0.591995195    10.10.1.2 → 10.10.1.1    TCP 83 49532 → 8081 [PSH, ACK] Seq=766 Ack=766 Win=64256 Len=17 TSval=1047556125 TSecr=3171815835
1711549155.524216652   392 0.592120598    10.10.1.1 → 10.10.1.2    TCP 83 8081 → 49532 [PSH, ACK] Seq=766 Ack=783 Win=65152 Len=17 TSval=3171815836 TSecr=1047556125
1711549161.524216652   398 0.593326103    10.10.1.2 → 10.10.1.1    TCP 83 49532 → 8081 [PSH, ACK] Seq=783 Ack=783 Win=64256 Len=17 TSval=1047556127 TSecr=3171815836
1711549164.524216652   401 0.593456172    10.10.1.1 → 10.10.1.2    TCP 83 8081 → 49532 [PSH, ACK] Seq=783 Ack=800 Win=65152 Len=17 TSval=3171815838 TSecr=1047556127
1711549169.524216652   406 0.594661189    10.10.1.2 → 10.10.1.1    TCP 83 49532 → 8081 [PSH, ACK] Seq=800 Ack=800 Win=64256 Len=17 TSval=1047556128 TSecr=3171815838
1711549171.524216652   408 0.594791920    10.10.1.1 → 10.10.1.2    TCP 83 8081 → 49532 [PSH, ACK] Seq=800 Ack=817 Win=65152 Len=17 TSval=3171815839 TSecr=1047556128
1711549177.524216652   414 0.595999728    10.10.1.2 → 10.10.1.1    TCP 83 49532 → 8081 [PSH, ACK] Seq=817 Ack=817 Win=64256 Len=17 TSval=1047556129 TSecr=3171815839
1711549179.524216652   416 0.596120603    10.10.1.1 → 10.10.1.2    TCP 83 8081 → 49532 [PSH, ACK] Seq=817 Ack=834 Win=65152 Len=17 TSval=3171815840 TSecr=1047556129
1711549185.524216652   422 0.597325085    10.10.1.2 → 10.10.1.1    TCP 83 49532 → 8081 [PSH, ACK] Seq=834 Ack=834 Win=64256 Len=17 TSval=1047556131 TSecr=3171815840
1711549188.524216652   425 0.597407241    10.10.1.1 → 10.10.1.2    TCP 83 8081 → 49532 [PSH, ACK] Seq=834 Ack=851 Win=65152 Len=17 TSval=3171815842 TSecr=1047556131
1711549193.524216652   430 0.598613129    10.10.1.2 → 10.10.1.1    TCP 83 49532 → 8081 [PSH, ACK] Seq=851 Ack=851 Win=64256 Len=17 TSval=1047556132 TSecr=3171815842
1711549195.524216652   432 0.598746321    10.10.1.1 → 10.10.1.2    TCP 83 8081 → 49532 [PSH, ACK] Seq=851 Ack=868 Win=65152 Len=17 TSval=3171815843 TSecr=1047556132
1711549201.524216652   438 0.599954004    10.10.1.2 → 10.10.1.1    TCP 83 49532 → 8081 [PSH, ACK] Seq=868 Ack=868 Win=64256 Len=17 TSval=1047556133 TSecr=3171815843
1711549203.524216652   440 0.600079759    10.10.1.1 → 10.10.1.2    TCP 83 8081 → 49532 [PSH, ACK] Seq=868 Ack=885 Win=65152 Len=17 TSval=3171815844 TSecr=1047556133
1711549209.524216652   446 0.601284393    10.10.1.2 → 10.10.1.1    TCP 83 49532 → 8081 [PSH, ACK] Seq=885 Ack=885 Win=64256 Len=17 TSval=1047556135 TSecr=3171815844
1711549212.524216652   449 0.601415214    10.10.1.1 → 10.10.1.2    TCP 83 8081 → 49532 [PSH, ACK] Seq=885 Ack=902 Win=65152 Len=17 TSval=3171815846 TSecr=1047556135
1711549217.524216652   454 0.602620767    10.10.1.2 → 10.10.1.1    TCP 83 49532 → 8081 [PSH, ACK] Seq=902 Ack=902 Win=64256 Len=17 TSval=1047556136 TSecr=3171815846
1711549219.524216652   456 0.602746362    10.10.1.1 → 10.10.1.2    TCP 83 8081 → 49532 [PSH, ACK] Seq=902 Ack=919 Win=65152 Len=17 TSval=3171815847 TSecr=1047556136
1711549225.524216652   462 0.603954097    10.10.1.2 → 10.10.1.1    TCP 83 49532 → 8081 [PSH, ACK] Seq=919 Ack=919 Win=64256 Len=17 TSval=1047556137 TSecr=3171815847
1711549227.524216652   464 0.604079979    10.10.1.1 → 10.10.1.2    TCP 83 8081 → 49532 [PSH, ACK] Seq=919 Ack=936 Win=65152 Len=17 TSval=3171815848 TSecr=1047556137
1711549233.524216652   470 0.605287379    10.10.1.2 → 10.10.1.1    TCP 83 49532 → 8081 [PSH, ACK] Seq=936 Ack=936 Win=64256 Len=17 TSval=1047556139 TSecr=3171815848
1711549235.524216652   472 0.605423612    10.10.1.1 → 10.10.1.2    TCP 83 8081 → 49532 [PSH, ACK] Seq=936 Ack=953 Win=65152 Len=17 TSval=3171815850 TSecr=1047556139
1711549241.524216652   478 0.606629419    10.10.1.2 → 10.10.1.1    TCP 83 49532 → 8081 [PSH, ACK] Seq=953 Ack=953 Win=64256 Len=17 TSval=1047556140 TSecr=3171815850
1711549244.524216652   481 0.606808325    10.10.1.1 → 10.10.1.2    TCP 83 8081 → 49532 [PSH, ACK] Seq=953 Ack=970 Win=65152 Len=17 TSval=3171815851 TSecr=1047556140
1711549249.524216652   486 0.608015797    10.10.1.2 → 10.10.1.1    TCP 83 49532 → 8081 [PSH, ACK] Seq=970 Ack=970 Win=64256 Len=17 TSval=1047556141 TSecr=3171815851
1711549251.524216652   488 0.608145690    10.10.1.1 → 10.10.1.2    TCP 83 8081 → 49532 [PSH, ACK] Seq=970 Ack=987 Win=65152 Len=17 TSval=3171815853 TSecr=1047556141
1711549257.524216652   494 0.609367701    10.10.1.2 → 10.10.1.1    TCP 83 49532 → 8081 [PSH, ACK] Seq=987 Ack=987 Win=64256 Len=17 TSval=1047556143 TSecr=3171815853
1711549260.524216652   497 0.609450132    10.10.1.1 → 10.10.1.2    TCP 83 8081 → 49532 [PSH, ACK] Seq=987 Ack=1004 Win=65152 Len=17 TSval=3171815854 TSecr=1047556143
1711549265.524216652   502 0.610655556    10.10.1.2 → 10.10.1.1    TCP 83 49532 → 8081 [PSH, ACK] Seq=1004 Ack=1004 Win=64256 Len=17 TSval=1047556144 TSecr=3171815854
1711549267.524216652   504 0.610781714    10.10.1.1 → 10.10.1.2    TCP 83 8081 → 49532 [PSH, ACK] Seq=1004 Ack=1021 Win=65152 Len=17 TSval=3171815855 TSecr=1047556144
1711549273.524216652   510 0.611988550    10.10.1.2 → 10.10.1.1    TCP 83 49532 → 8081 [PSH, ACK] Seq=1021 Ack=1021 Win=64256 Len=17 TSval=1047556145 TSecr=3171815855
1711549275.524216652   512 0.612114740    10.10.1.1 → 10.10.1.2    TCP 83 8081 → 49532 [PSH, ACK] Seq=1021 Ack=1038 Win=65152 Len=17 TSval=3171815856 TSecr=1047556145
1711549281.524216652   518 0.613319312    10.10.1.2 → 10.10.1.1    TCP 83 49532 → 8081 [PSH, ACK] Seq=1038 Ack=1038 Win=64256 Len=17 TSval=1047556147 TSecr=3171815856
1711549284.524216652   521 0.613449929    10.10.1.1 → 10.10.1.2    TCP 83 8081 → 49532 [PSH, ACK] Seq=1038 Ack=1055 Win=65152 Len=17 TSval=3171815858 TSecr=1047556147
1711549289.524216652   526 0.614655093    10.10.1.2 → 10.10.1.1    TCP 83 49532 → 8081 [PSH, ACK] Seq=1055 Ack=1055 Win=64256 Len=17 TSval=1047556148 TSecr=3171815858
1711549291.524216652   528 0.614788371    10.10.1.1 → 10.10.1.2    TCP 83 8081 → 49532 [PSH, ACK] Seq=1055 Ack=1072 Win=65152 Len=17 TSval=3171815859 TSecr=1047556148
1711549297.524216652   534 0.615995761    10.10.1.2 → 10.10.1.1    TCP 83 49532 → 8081 [PSH, ACK] Seq=1072 Ack=1072 Win=64256 Len=17 TSval=1047556149 TSecr=3171815859
1711549299.524216652   536 0.616131112    10.10.1.1 → 10.10.1.2    TCP 83 8081 → 49532 [PSH, ACK] Seq=1072 Ack=1089 Win=65152 Len=17 TSval=3171815861 TSecr=1047556149
1711549305.524216652   542 0.617335631    10.10.1.2 → 10.10.1.1    TCP 83 49532 → 8081 [PSH, ACK] Seq=1089 Ack=1089 Win=64256 Len=17 TSval=1047556151 TSecr=3171815861
1711549308.524216652   545 0.617465613    10.10.1.1 → 10.10.1.2    TCP 83 8081 → 49532 [PSH, ACK] Seq=1089 Ack=1106 Win=65152 Len=17 TSval=3171815862 TSecr=1047556151
1711549313.524216652   550 0.618670228    10.10.1.2 → 10.10.1.1    TCP 83 49532 → 8081 [PSH, ACK] Seq=1106 Ack=1106 Win=64256 Len=17 TSval=1047556152 TSecr=3171815862
1711549315.524216652   552 0.618791761    10.10.1.1 → 10.10.1.2    TCP 83 8081 → 49532 [PSH, ACK] Seq=1106 Ack=1123 Win=65152 Len=17 TSval=3171815863 TSecr=1047556152
1711549321.524216652   558 0.620000618    10.10.1.2 → 10.10.1.1    TCP 83 49532 → 8081 [PSH, ACK] Seq=1123 Ack=1123 Win=64256 Len=17 TSval=1047556153 TSecr=3171815863
1711549323.524216652   560 0.620122170    10.10.1.1 → 10.10.1.2    TCP 83 8081 → 49532 [PSH, ACK] Seq=1123 Ack=1140 Win=65152 Len=17 TSval=3171815864 TSecr=1047556153
1711549329.524216652   566 0.621326704    10.10.1.2 → 10.10.1.1    TCP 83 49532 → 8081 [PSH, ACK] Seq=1140 Ack=1140 Win=64256 Len=17 TSval=1047556155 TSecr=3171815864
1711549332.524216652   569 0.621408672    10.10.1.1 → 10.10.1.2    TCP 83 8081 → 49532 [PSH, ACK] Seq=1140 Ack=1157 Win=65152 Len=17 TSval=3171815866 TSecr=1047556155
1711549337.524216652   574 0.622613136    10.10.1.2 → 10.10.1.1    TCP 83 49532 → 8081 [PSH, ACK] Seq=1157 Ack=1157 Win=64256 Len=17 TSval=1047556156 TSecr=3171815866
1711549339.524216652   576 0.622746591    10.10.1.1 → 10.10.1.2    TCP 83 8081 → 49532 [PSH, ACK] Seq=1157 Ack=1174 Win=65152 Len=17 TSval=3171815867 TSecr=1047556156
1711549345.524216652   582 0.623954038    10.10.1.2 → 10.10.1.1    TCP 83 49532 → 8081 [PSH, ACK] Seq=1174 Ack=1174 Win=64256 Len=17 TSval=1047556157 TSecr=3171815867
1711549347.524216652   584 0.624080637    10.10.1.1 → 10.10.1.2    TCP 83 8081 → 49532 [PSH, ACK] Seq=1174 Ack=1191 Win=65152 Len=17 TSval=3171815868 TSecr=1047556157
1711549353.524216652   590 0.625286069    10.10.1.2 → 10.10.1.1    TCP 83 49532 → 8081 [PSH, ACK] Seq=1191 Ack=1191 Win=64256 Len=17 TSval=1047556159 TSecr=3171815868
1711549356.524216652   593 0.625417004    10.10.1.1 → 10.10.1.2    TCP 83 8081 → 49532 [PSH, ACK] Seq=1191 Ack=1208 Win=65152 Len=17 TSval=3171815870 TSecr=1047556159
1711549361.524216652   598 0.626622175    10.10.1.2 → 10.10.1.1    TCP 83 49532 → 8081 [PSH, ACK] Seq=1208 Ack=1208 Win=64256 Len=17 TSval=1047556160 TSecr=3171815870
1711549363.524216652   600 0.626746763    10.10.1.1 → 10.10.1.2    TCP 83 8081 → 49532 [PSH, ACK] Seq=1208 Ack=1225 Win=65152 Len=17 TSval=3171815871 TSecr=1047556160
1711549369.524216652   606 0.627965611    10.10.1.2 → 10.10.1.1    TCP 83 49532 → 8081 [PSH, ACK] Seq=1225 Ack=1225 Win=64256 Len=17 TSval=1047556161 TSecr=3171815871
1711549371.524216652   608 0.628096640    10.10.1.1 → 10.10.1.2    TCP 83 8081 → 49532 [PSH, ACK] Seq=1225 Ack=1242 Win=65152 Len=17 TSval=3171815872 TSecr=1047556161
1711549377.524216652   614 0.629314010    10.10.1.2 → 10.10.1.1    TCP 83 49532 → 8081 [PSH, ACK] Seq=1242 Ack=1242 Win=64256 Len=17 TSval=1047556163 TSecr=3171815872
1711549380.524216652   617 0.629444495    10.10.1.1 → 10.10.1.2    TCP 83 8081 → 49532 [PSH, ACK] Seq=1242 Ack=1259 Win=65152 Len=17 TSval=3171815874 TSecr=1047556163
1711549385.524216652   622 0.630649960    10.10.1.2 → 10.10.1.1    TCP 83 49532 → 8081 [PSH, ACK] Seq=1259 Ack=1259 Win=64256 Len=17 TSval=1047556164 TSecr=3171815874
1711549387.524216652   624 0.630770535    10.10.1.1 → 10.10.1.2    TCP 83 8081 → 49532 [PSH, ACK] Seq=1259 Ack=1276 Win=65152 Len=17 TSval=3171815875 TSecr=1047556164
1711549393.524216652   630 0.631978269    10.10.1.2 → 10.10.1.1    TCP 83 49532 → 8081 [PSH, ACK] Seq=1276 Ack=1276 Win=64256 Len=17 TSval=1047556165 TSecr=3171815875
1711549395.524216652   632 0.632108600    10.10.1.1 → 10.10.1.2    TCP 83 8081 → 49532 [PSH, ACK] Seq=1276 Ack=1293 Win=65152 Len=17 TSval=3171815876 TSecr=1047556165
1711549401.524216652   638 0.633313413    10.10.1.2 → 10.10.1.1    TCP 83 49532 → 8081 [PSH, ACK] Seq=1293 Ack=1293 Win=64256 Len=17 TSval=1047556167 TSecr=3171815876
1711549404.524216652   641 0.633395642    10.10.1.1 → 10.10.1.2    TCP 83 8081 → 49532 [PSH, ACK] Seq=1293 Ack=1310 Win=65152 Len=17 TSval=3171815878 TSecr=1047556167
1711549409.524216652   646 0.634600769    10.10.1.2 → 10.10.1.1    TCP 83 49532 → 8081 [PSH, ACK] Seq=1310 Ack=1310 Win=64256 Len=17 TSval=1047556168 TSecr=3171815878
1711549411.524216652   648 0.634726061    10.10.1.1 → 10.10.1.2    TCP 83 8081 → 49532 [PSH, ACK] Seq=1310 Ack=1327 Win=65152 Len=17 TSval=3171815879 TSecr=1047556168
1711549417.524216652   654 0.635935507    10.10.1.2 → 10.10.1.1    TCP 83 49532 → 8081 [PSH, ACK] Seq=1327 Ack=1327 Win=64256 Len=17 TSval=1047556169 TSecr=3171815879
1711549419.524216652   656 0.636060276    10.10.1.1 → 10.10.1.2    TCP 83 8081 → 49532 [PSH, ACK] Seq=1327 Ack=1344 Win=65152 Len=17 TSval=3171815880 TSecr=1047556169
1711549425.524216652   662 0.637264930    10.10.1.2 → 10.10.1.1    TCP 83 49532 → 8081 [PSH, ACK] Seq=1344 Ack=1344 Win=64256 Len=17 TSval=1047556171 TSecr=3171815880
1711549428.524216652   665 0.637395674    10.10.1.1 → 10.10.1.2    TCP 83 8081 → 49532 [PSH, ACK] Seq=1344 Ack=1361 Win=65152 Len=17 TSval=3171815882 TSecr=1047556171
1711549433.524216652   670 0.638601088    10.10.1.2 → 10.10.1.1    TCP 83 49532 → 8081 [PSH, ACK] Seq=1361 Ack=1361 Win=64256 Len=17 TSval=1047556172 TSecr=3171815882
1711549435.524216652   672 0.638727594    10.10.1.1 → 10.10.1.2    TCP 83 8081 → 49532 [PSH, ACK] Seq=1361 Ack=1378 Win=65152 Len=17 TSval=3171815883 TSecr=1047556172
1711549441.524216652   678 0.639935848    10.10.1.2 → 10.10.1.1    TCP 83 49532 → 8081 [PSH, ACK] Seq=1378 Ack=1378 Win=64256 Len=17 TSval=1047556173 TSecr=3171815883
1711549443.524216652   680 0.640061067    10.10.1.1 → 10.10.1.2    TCP 83 8081 → 49532 [PSH, ACK] Seq=1378 Ack=1395 Win=65152 Len=17 TSval=3171815884 TSecr=1047556173
1711549449.524216652   686 0.641266869    10.10.1.2 → 10.10.1.1    TCP 83 49532 → 8081 [PSH, ACK] Seq=1395 Ack=1395 Win=64256 Len=17 TSval=1047556175 TSecr=3171815884
1711549451.524216652   688 0.641403562    10.10.1.1 → 10.10.1.2    TCP 83 8081 → 49532 [PSH, ACK] Seq=1395 Ack=1412 Win=65152 Len=17 TSval=3171815886 TSecr=1047556175
1711549457.524216652   694 0.642607769    10.10.1.2 → 10.10.1.1    TCP 83 49532 → 8081 [PSH, ACK] Seq=1412 Ack=1412 Win=64256 Len=17 TSval=1047556176 TSecr=3171815886
1711549459.524216652   696 0.642739604    10.10.1.1 → 10.10.1.2    TCP 83 8081 → 49532 [PSH, ACK] Seq=1412 Ack=1429 Win=65152 Len=17 TSval=3171815887 TSecr=1047556176
1711549465.524216652   702 0.643947585    10.10.1.2 → 10.10.1.1    TCP 83 49532 → 8081 [PSH, ACK] Seq=1429 Ack=1429 Win=64256 Len=17 TSval=1047556177 TSecr=3171815887
1711549467.524216652   704 0.644068623    10.10.1.1 → 10.10.1.2    TCP 83 8081 → 49532 [PSH, ACK] Seq=1429 Ack=1446 Win=65152 Len=17 TSval=3171815888 TSecr=1047556177
1711549473.524216652   710 0.645273156    10.10.1.2 → 10.10.1.1    TCP 83 49532 → 8081 [PSH, ACK] Seq=1446 Ack=1446 Win=64256 Len=17 TSval=1047556179 TSecr=3171815888
1711549475.524216652   712 0.645356194    10.10.1.1 → 10.10.1.2    TCP 83 8081 → 49532 [PSH, ACK] Seq=1446 Ack=1463 Win=65152 Len=17 TSval=3171815890 TSecr=1047556179
1711549481.524216652   718 0.646562399    10.10.1.2 → 10.10.1.1    TCP 83 49532 → 8081 [PSH, ACK] Seq=1463 Ack=1463 Win=64256 Len=17 TSval=1047556180 TSecr=3171815890
1711549483.524216652   720 0.646687825    10.10.1.1 → 10.10.1.2    TCP 83 8081 → 49532 [PSH, ACK] Seq=1463 Ack=1480 Win=65152 Len=17 TSval=3171815891 TSecr=1047556180
1711549489.524216652   726 0.647896970    10.10.1.2 → 10.10.1.1    TCP 83 49532 → 8081 [PSH, ACK] Seq=1480 Ack=1480 Win=64256 Len=17 TSval=1047556181 TSecr=3171815891
1711549491.524216652   728 0.648022010    10.10.1.1 → 10.10.1.2    TCP 83 8081 → 49532 [PSH, ACK] Seq=1480 Ack=1497 Win=65152 Len=17 TSval=3171815892 TSecr=1047556181
1711549497.524216652   734 0.649226776    10.10.1.2 → 10.10.1.1    TCP 83 49532 → 8081 [PSH, ACK] Seq=1497 Ack=1497 Win=64256 Len=17 TSval=1047556183 TSecr=3171815892
1711549500.524216652   737 0.649356234    10.10.1.1 → 10.10.1.2    TCP 83 8081 → 49532 [PSH, ACK] Seq=1497 Ack=1514 Win=65152 Len=17 TSval=3171815894 TSecr=1047556183
1711549505.524216652   742 0.650561336    10.10.1.2 → 10.10.1.1    TCP 83 49532 → 8081 [PSH, ACK] Seq=1514 Ack=1514 Win=64256 Len=17 TSval=1047556184 TSecr=3171815894
1711549507.524216652   744 0.650686402    10.10.1.1 → 10.10.1.2    TCP 83 8081 → 49532 [PSH, ACK] Seq=1514 Ack=1531 Win=65152 Len=17 TSval=3171815895 TSecr=1047556184
1711549513.524216652   750 0.651893027    10.10.1.2 → 10.10.1.1    TCP 83 49532 → 8081 [PSH, ACK] Seq=1531 Ack=1531 Win=64256 Len=17 TSval=1047556185 TSecr=3171815895
1711549515.524216652   752 0.652018507    10.10.1.1 → 10.10.1.2    TCP 83 8081 → 49532 [PSH, ACK] Seq=1531 Ack=1548 Win=65152 Len=17 TSval=3171815896 TSecr=1047556185
1711549521.524216652   758 0.653225500    10.10.1.2 → 10.10.1.1    TCP 83 49532 → 8081 [PSH, ACK] Seq=1548 Ack=1548 Win=64256 Len=17 TSval=1047556187 TSecr=3171815896
1711549523.524216652   760 0.653362031    10.10.1.1 → 10.10.1.2    TCP 83 8081 → 49532 [PSH, ACK] Seq=1548 Ack=1565 Win=65152 Len=17 TSval=3171815898 TSecr=1047556187
1711549529.524216652   766 0.654567468    10.10.1.2 → 10.10.1.1    TCP 83 49532 → 8081 [PSH, ACK] Seq=1565 Ack=1565 Win=64256 Len=17 TSval=1047556188 TSecr=3171815898
1711549531.524216652   768 0.654697835    10.10.1.1 → 10.10.1.2    TCP 83 8081 → 49532 [PSH, ACK] Seq=1565 Ack=1582 Win=65152 Len=17 TSval=3171815899 TSecr=1047556188
1711549537.524216652   774 0.655906391    10.10.1.2 → 10.10.1.1    TCP 83 49532 → 8081 [PSH, ACK] Seq=1582 Ack=1582 Win=64256 Len=17 TSval=1047556189 TSecr=3171815899
1711549539.524216652   776 0.656027929    10.10.1.1 → 10.10.1.2    TCP 83 8081 → 49532 [PSH, ACK] Seq=1582 Ack=1599 Win=65152 Len=17 TSval=3171815900 TSecr=1047556189
1711549545.524216652   782 0.657232490    10.10.1.2 → 10.10.1.1    TCP 83 49532 → 8081 [PSH, ACK] Seq=1599 Ack=1599 Win=64256 Len=17 TSval=1047556191 TSecr=3171815900
1711549547.524216652   784 0.657315211    10.10.1.1 → 10.10.1.2    TCP 83 8081 → 49532 [PSH, ACK] Seq=1599 Ack=1616 Win=65152 Len=17 TSval=3171815902 TSecr=1047556191
1711549553.524216652   790 0.658523268    10.10.1.2 → 10.10.1.1    TCP 83 49532 → 8081 [PSH, ACK] Seq=1616 Ack=1616 Win=64256 Len=17 TSval=1047556192 TSecr=3171815902
1711549555.524216652   792 0.658648446    10.10.1.1 → 10.10.1.2    TCP 83 8081 → 49532 [PSH, ACK] Seq=1616 Ack=1633 Win=65152 Len=17 TSval=3171815903 TSecr=1047556192
1711549561.524216652   798 0.659856010    10.10.1.2 → 10.10.1.1    TCP 83 49532 → 8081 [PSH, ACK] Seq=1633 Ack=1633 Win=64256 Len=17 TSval=1047556193 TSecr=3171815903
1711549563.524216652   800 0.659990329    10.10.1.1 → 10.10.1.2    TCP 83 8081 → 49532 [PSH, ACK] Seq=1633 Ack=1650 Win=65152 Len=17 TSval=3171815904 TSecr=1047556193
1711549569.524216652   806 0.661209879    10.10.1.2 → 10.10.1.1    TCP 83 49532 → 8081 [PSH, ACK] Seq=1650 Ack=1650 Win=64256 Len=17 TSval=1047556195 TSecr=3171815904
1711549572.524216652   809 0.661341815    10.10.1.1 → 10.10.1.2    TCP 83 8081 → 49532 [PSH, ACK] Seq=1650 Ack=1667 Win=65152 Len=17 TSval=3171815906 TSecr=1047556195
1711549577.524216652   814 0.662546596    10.10.1.2 → 10.10.1.1    TCP 83 49532 → 8081 [PSH, ACK] Seq=1667 Ack=1667 Win=64256 Len=17 TSval=1047556196 TSecr=3171815906
1711549579.524216652   816 0.662681303    10.10.1.1 → 10.10.1.2    TCP 83 8081 → 49532 [PSH, ACK] Seq=1667 Ack=1684 Win=65152 Len=17 TSval=3171815907 TSecr=1047556196
1711549585.524216652   822 0.663888685    10.10.1.2 → 10.10.1.1    TCP 83 49532 → 8081 [PSH, ACK] Seq=1684 Ack=1684 Win=64256 Len=17 TSval=1047556197 TSecr=3171815907
1711549587.524216652   824 0.664009386    10.10.1.1 → 10.10.1.2    TCP 83 8081 → 49532 [PSH, ACK] Seq=1684 Ack=1701 Win=65152 Len=17 TSval=3171815908 TSecr=1047556197
1711549593.524216652   830 0.665218576    10.10.1.2 → 10.10.1.1    TCP 83 49532 → 8081 [PSH, ACK] Seq=1701 Ack=1701 Win=64256 Len=17 TSval=1047556199 TSecr=3171815908
1711549595.524216652   832 0.665304477    10.10.1.1 → 10.10.1.2    TCP 83 8081 → 49532 [PSH, ACK] Seq=1701 Ack=1718 Win=65152 Len=17 TSval=3171815910 TSecr=1047556199
1711549601.524216652   838 0.666510609    10.10.1.2 → 10.10.1.1    TCP 83 49532 → 8081 [PSH, ACK] Seq=1718 Ack=1718 Win=64256 Len=17 TSval=1047556200 TSecr=3171815910
1711549603.524216652   840 0.666643700    10.10.1.1 → 10.10.1.2    TCP 83 8081 → 49532 [PSH, ACK] Seq=1718 Ack=1735 Win=65152 Len=17 TSval=3171815911 TSecr=1047556200
1711549609.524216652   846 0.667851560    10.10.1.2 → 10.10.1.1    TCP 83 49532 → 8081 [PSH, ACK] Seq=1735 Ack=1735 Win=64256 Len=17 TSval=1047556201 TSecr=3171815911
1711549611.524216652   848 0.667976969    10.10.1.1 → 10.10.1.2    TCP 83 8081 → 49532 [PSH, ACK] Seq=1735 Ack=1752 Win=65152 Len=17 TSval=3171815912 TSecr=1047556201
1711549617.524216652   854 0.669184703    10.10.1.2 → 10.10.1.1    TCP 83 49532 → 8081 [PSH, ACK] Seq=1752 Ack=1752 Win=64256 Len=17 TSval=1047556203 TSecr=3171815912
1711549619.524216652   856 0.669322461    10.10.1.1 → 10.10.1.2    TCP 83 8081 → 49532 [PSH, ACK] Seq=1752 Ack=1769 Win=65152 Len=17 TSval=3171815914 TSecr=1047556203
1711549625.524216652   862 0.670527969    10.10.1.2 → 10.10.1.1    TCP 83 49532 → 8081 [PSH, ACK] Seq=1769 Ack=1769 Win=64256 Len=17 TSval=1047556204 TSecr=3171815914
1711549627.524216652   864 0.670648451    10.10.1.1 → 10.10.1.2    TCP 83 8081 → 49532 [PSH, ACK] Seq=1769 Ack=1786 Win=65152 Len=17 TSval=3171815915 TSecr=1047556204
1711549633.524216652   870 0.671855544    10.10.1.2 → 10.10.1.1    TCP 83 49532 → 8081 [PSH, ACK] Seq=1786 Ack=1786 Win=64256 Len=17 TSval=1047556205 TSecr=3171815915
1711549635.524216652   872 0.671976565    10.10.1.1 → 10.10.1.2    TCP 83 8081 → 49532 [PSH, ACK] Seq=1786 Ack=1803 Win=65152 Len=17 TSval=3171815916 TSecr=1047556205
1711549641.524216652   878 0.673196304    10.10.1.2 → 10.10.1.1    TCP 83 49532 → 8081 [PSH, ACK] Seq=1803 Ack=1803 Win=64256 Len=17 TSval=1047556207 TSecr=3171815916
1711549643.524216652   880 0.673281241    10.10.1.1 → 10.10.1.2    TCP 83 8081 → 49532 [PSH, ACK] Seq=1803 Ack=1820 Win=65152 Len=17 TSval=3171815918 TSecr=1047556207
1711549649.524216652   886 0.674486778    10.10.1.2 → 10.10.1.1    TCP 83 49532 → 8081 [PSH, ACK] Seq=1820 Ack=1820 Win=64256 Len=17 TSval=1047556208 TSecr=3171815918
1711549651.524216652   888 0.674611714    10.10.1.1 → 10.10.1.2    TCP 83 8081 → 49532 [PSH, ACK] Seq=1820 Ack=1837 Win=65152 Len=17 TSval=3171815919 TSecr=1047556208
1711549657.524216652   894 0.675818670    10.10.1.2 → 10.10.1.1    TCP 83 49532 → 8081 [PSH, ACK] Seq=1837 Ack=1837 Win=64256 Len=17 TSval=1047556209 TSecr=3171815919
1711549659.524216652   896 0.675943321    10.10.1.1 → 10.10.1.2    TCP 83 8081 → 49532 [PSH, ACK] Seq=1837 Ack=1854 Win=65152 Len=17 TSval=3171815920 TSecr=1047556209
1711549665.524216652   902 0.677151138    10.10.1.2 → 10.10.1.1    TCP 83 49532 → 8081 [PSH, ACK] Seq=1854 Ack=1854 Win=64256 Len=17 TSval=1047556211 TSecr=3171815920
1711549667.524216652   904 0.677252534    10.10.1.1 → 10.10.1.2    TCP 83 8081 → 49532 [PSH, ACK] Seq=1854 Ack=1871 Win=65152 Len=17 TSval=3171815922 TSecr=1047556211
1711549673.524216652   910 0.678458727    10.10.1.2 → 10.10.1.1    TCP 83 49532 → 8081 [PSH, ACK] Seq=1871 Ack=1871 Win=64256 Len=17 TSval=1047556212 TSecr=3171815922
1711549675.524216652   912 0.678583179    10.10.1.1 → 10.10.1.2    TCP 83 8081 → 49532 [PSH, ACK] Seq=1871 Ack=1888 Win=65152 Len=17 TSval=3171815923 TSecr=1047556212
1711549681.524216652   918 0.679791173    10.10.1.2 → 10.10.1.1    TCP 83 49532 → 8081 [PSH, ACK] Seq=1888 Ack=1888 Win=64256 Len=17 TSval=1047556213 TSecr=3171815923
1711549683.524216652   920 0.679916388    10.10.1.1 → 10.10.1.2    TCP 83 8081 → 49532 [PSH, ACK] Seq=1888 Ack=1905 Win=65152 Len=17 TSval=3171815924 TSecr=1047556213
1711549689.524216652   926 0.681120829    10.10.1.2 → 10.10.1.1    TCP 83 49532 → 8081 [PSH, ACK] Seq=1905 Ack=1905 Win=64256 Len=17 TSval=1047556215 TSecr=3171815924
1711549691.524216652   928 0.681234396    10.10.1.1 → 10.10.1.2    TCP 83 8081 → 49532 [PSH, ACK] Seq=1905 Ack=1922 Win=65152 Len=17 TSval=3171815926 TSecr=1047556215
1711549697.524216652   934 0.682439935    10.10.1.2 → 10.10.1.1    TCP 83 49532 → 8081 [PSH, ACK] Seq=1922 Ack=1922 Win=64256 Len=17 TSval=1047556216 TSecr=3171815926
1711549700.524216652   937 0.682615826    10.10.1.1 → 10.10.1.2    TCP 83 8081 → 49532 [PSH, ACK] Seq=1922 Ack=1939 Win=65152 Len=17 TSval=3171815927 TSecr=1047556216
1711549705.524216652   942 0.683825164    10.10.1.2 → 10.10.1.1    TCP 83 49532 → 8081 [PSH, ACK] Seq=1939 Ack=1939 Win=64256 Len=17 TSval=1047556217 TSecr=3171815927
1711549707.524216652   944 0.683950411    10.10.1.1 → 10.10.1.2    TCP 83 8081 → 49532 [PSH, ACK] Seq=1939 Ack=1956 Win=65152 Len=17 TSval=3171815928 TSecr=1047556217
1711549713.524216652   950 0.685158086    10.10.1.2 → 10.10.1.1    TCP 83 49532 → 8081 [PSH, ACK] Seq=1956 Ack=1956 Win=64256 Len=17 TSval=1047556219 TSecr=3171815928
1711549715.524216652   952 0.685250007    10.10.1.1 → 10.10.1.2    TCP 83 8081 → 49532 [PSH, ACK] Seq=1956 Ack=1973 Win=65152 Len=17 TSval=3171815930 TSecr=1047556219
1711549721.524216652   958 0.686455722    10.10.1.2 → 10.10.1.1    TCP 83 49532 → 8081 [PSH, ACK] Seq=1973 Ack=1973 Win=64256 Len=17 TSval=1047556220 TSecr=3171815930
1711549723.524216652   960 0.686580832    10.10.1.1 → 10.10.1.2    TCP 83 8081 → 49532 [PSH, ACK] Seq=1973 Ack=1990 Win=65152 Len=17 TSval=3171815931 TSecr=1047556220
1711549729.524216652   966 0.687787803    10.10.1.2 → 10.10.1.1    TCP 83 49532 → 8081 [PSH, ACK] Seq=1990 Ack=1990 Win=64256 Len=17 TSval=1047556221 TSecr=3171815931
1711549731.524216652   968 0.687908561    10.10.1.1 → 10.10.1.2    TCP 83 8081 → 49532 [PSH, ACK] Seq=1990 Ack=2007 Win=65152 Len=17 TSval=3171815932 TSecr=1047556221
1711549737.524216652   974 0.689113119    10.10.1.2 → 10.10.1.1    TCP 83 49532 → 8081 [PSH, ACK] Seq=2007 Ack=2007 Win=64256 Len=17 TSval=1047556223 TSecr=3171815932
1711549740.524216652   977 0.689233357    10.10.1.1 → 10.10.1.2    TCP 83 8081 → 49532 [PSH, ACK] Seq=2007 Ack=2024 Win=65152 Len=17 TSval=3171815934 TSecr=1047556223
1711549745.524216652   982 0.690438738    10.10.1.2 → 10.10.1.1    TCP 83 49532 → 8081 [PSH, ACK] Seq=2024 Ack=2024 Win=64256 Len=17 TSval=1047556224 TSecr=3171815934
1711549747.524216652   984 0.690564088    10.10.1.1 → 10.10.1.2    TCP 83 8081 → 49532 [PSH, ACK] Seq=2024 Ack=2041 Win=65152 Len=17 TSval=3171815935 TSecr=1047556224
1711549753.524216652   990 0.691771677    10.10.1.2 → 10.10.1.1    TCP 83 49532 → 8081 [PSH, ACK] Seq=2041 Ack=2041 Win=64256 Len=17 TSval=1047556225 TSecr=3171815935
