1711548735.055696726    21 0.279633045    10.10.1.2 → 10.10.1.1    TCP 74 46050 → 8081 [SYN] Seq=0 Win=64240 Len=0 MSS=1460 SACK_PERM=1 TSval=1047506383 TSecr=0 WS=128
1711548736.055696726    22 0.279657289    10.10.1.1 → 10.10.1.2    TCP 74 8081 → 46050 [SYN, ACK] Seq=0 Ack=1 Win=65160 Len=0 MSS=1460 SACK_PERM=1 TSval=3171766094 TSecr=1047506383 WS=128
1711548738.055696726    24 0.279703709    10.10.1.2 → 10.10.1.1    TCP 66 46050 → 8081 [ACK] Seq=1 Ack=1 Win=64256 Len=0 TSval=1047506383 TSecr=3171766094
1711548752.055696726    38 0.533354666    10.10.1.2 → 10.10.1.1    TCP 83 46050 → 8081 [PSH, ACK] Seq=1 Ack=1 Win=64256 Len=17 TSval=1047506637 TSecr=3171766094
1711548753.055696726    39 0.533364847    10.10.1.1 → 10.10.1.2    TCP 66 8081 → 46050 [ACK] Seq=1 Ack=18 Win=65152 Len=0 TSval=3171766348 TSecr=1047506637
1711548754.055696726    40 0.533654182    10.10.1.1 → 10.10.1.2    TCP 83 8081 → 46050 [PSH, ACK] Seq=1 Ack=18 Win=65152 Len=17 TSval=3171766348 TSecr=1047506637
1711548759.055696726    45 0.533777499    10.10.1.2 → 10.10.1.1    TCP 66 46050 → 8081 [ACK] Seq=18 Ack=18 Win=64256 Len=0 TSval=1047506637 TSecr=3171766348
1711548764.055696726    50 0.534917068    10.10.1.2 → 10.10.1.1    TCP 83 46050 → 8081 [PSH, ACK] Seq=18 Ack=18 Win=64256 Len=17 TSval=1047506638 TSecr=3171766348
1711548765.055696726    51 0.535057037    10.10.1.1 → 10.10.1.2    TCP 83 8081 → 46050 [PSH, ACK] Seq=18 Ack=35 Win=65152 Len=17 TSval=3171766350 TSecr=1047506638
1711548774.055696726    60 0.536317606    10.10.1.2 → 10.10.1.1    TCP 83 46050 → 8081 [PSH, ACK] Seq=35 Ack=35 Win=64256 Len=17 TSval=1047506640 TSecr=3171766350
1711548775.055696726    61 0.536449390    10.10.1.1 → 10.10.1.2    TCP 83 8081 → 46050 [PSH, ACK] Seq=35 Ack=52 Win=65152 Len=17 TSval=3171766351 TSecr=1047506640
1711548784.055696726    70 0.537705795    10.10.1.2 → 10.10.1.1    TCP 83 46050 → 8081 [PSH, ACK] Seq=52 Ack=52 Win=64256 Len=17 TSval=1047506641 TSecr=3171766351
1711548785.055696726    71 0.537825961    10.10.1.1 → 10.10.1.2    TCP 83 8081 → 46050 [PSH, ACK] Seq=52 Ack=69 Win=65152 Len=17 TSval=3171766352 TSecr=1047506641
1711548794.055696726    80 0.539089223    10.10.1.2 → 10.10.1.1    TCP 83 46050 → 8081 [PSH, ACK] Seq=69 Ack=69 Win=64256 Len=17 TSval=1047506643 TSecr=3171766352
1711548795.055696726    81 0.539210723    10.10.1.1 → 10.10.1.2    TCP 83 8081 → 46050 [PSH, ACK] Seq=69 Ack=86 Win=65152 Len=17 TSval=3171766354 TSecr=1047506643
1711548803.055696726    89 0.540448592    10.10.1.2 → 10.10.1.1    TCP 83 46050 → 8081 [PSH, ACK] Seq=86 Ack=86 Win=64256 Len=17 TSval=1047506644 TSecr=3171766354
1711548805.055696726    91 0.540564280    10.10.1.1 → 10.10.1.2    TCP 83 8081 → 46050 [PSH, ACK] Seq=86 Ack=103 Win=65152 Len=17 TSval=3171766355 TSecr=1047506644
1711548813.055696726    99 0.541804885    10.10.1.2 → 10.10.1.1    TCP 83 46050 → 8081 [PSH, ACK] Seq=103 Ack=103 Win=64256 Len=17 TSval=1047506645 TSecr=3171766355
1711548815.055696726   101 0.541920487    10.10.1.1 → 10.10.1.2    TCP 83 8081 → 46050 [PSH, ACK] Seq=103 Ack=120 Win=65152 Len=17 TSval=3171766356 TSecr=1047506645
1711548823.055696726   109 0.543165350    10.10.1.2 → 10.10.1.1    TCP 83 46050 → 8081 [PSH, ACK] Seq=120 Ack=120 Win=64256 Len=17 TSval=1047506647 TSecr=3171766356
1711548825.055696726   111 0.543287228    10.10.1.1 → 10.10.1.2    TCP 83 8081 → 46050 [PSH, ACK] Seq=120 Ack=137 Win=65152 Len=17 TSval=3171766358 TSecr=1047506647
1711548833.055696726   119 0.544524759    10.10.1.2 → 10.10.1.1    TCP 83 46050 → 8081 [PSH, ACK] Seq=137 Ack=137 Win=64256 Len=17 TSval=1047506648 TSecr=3171766358
1711548835.055696726   121 0.544639844    10.10.1.1 → 10.10.1.2    TCP 83 8081 → 46050 [PSH, ACK] Seq=137 Ack=154 Win=65152 Len=17 TSval=3171766359 TSecr=1047506648
1711548843.055696726   129 0.545881749    10.10.1.2 → 10.10.1.1    TCP 83 46050 → 8081 [PSH, ACK] Seq=154 Ack=154 Win=64256 Len=17 TSval=1047506649 TSecr=3171766359
1711548845.055696726   131 0.545997652    10.10.1.1 → 10.10.1.2    TCP 83 8081 → 46050 [PSH, ACK] Seq=154 Ack=171 Win=65152 Len=17 TSval=3171766360 TSecr=1047506649
1711548852.055696726   138 0.547210633    10.10.1.2 → 10.10.1.1    TCP 83 46050 → 8081 [PSH, ACK] Seq=171 Ack=171 Win=64256 Len=17 TSval=1047506651 TSecr=3171766360
1711548854.055696726   140 0.547342545    10.10.1.1 → 10.10.1.2    TCP 83 8081 → 46050 [PSH, ACK] Seq=171 Ack=188 Win=65152 Len=17 TSval=3171766362 TSecr=1047506651
1711548862.055696726   148 0.548557567    10.10.1.2 → 10.10.1.1    TCP 83 46050 → 8081 [PSH, ACK] Seq=188 Ack=188 Win=64256 Len=17 TSval=1047506652 TSecr=3171766362
1711548864.055696726   150 0.548683665    10.10.1.1 → 10.10.1.2    TCP 83 8081 → 46050 [PSH, ACK] Seq=188 Ack=205 Win=65152 Len=17 TSval=3171766363 TSecr=1047506652
1711548872.055696726   158 0.549900568    10.10.1.2 → 10.10.1.1    TCP 83 46050 → 8081 [PSH, ACK] Seq=205 Ack=205 Win=64256 Len=17 TSval=1047506653 TSecr=3171766363
1711548874.055696726   160 0.550026378    10.10.1.1 → 10.10.1.2    TCP 83 8081 → 46050 [PSH, ACK] Seq=205 Ack=222 Win=65152 Len=17 TSval=3171766365 TSecr=1047506653
1711548882.055696726   168 0.551238459    10.10.1.2 → 10.10.1.1    TCP 83 46050 → 8081 [PSH, ACK] Seq=222 Ack=222 Win=64256 Len=17 TSval=1047506655 TSecr=3171766365
1711548885.055696726   171 0.551369362    10.10.1.1 → 10.10.1.2    TCP 83 8081 → 46050 [PSH, ACK] Seq=222 Ack=239 Win=65152 Len=17 TSval=3171766366 TSecr=1047506655
1711548892.055696726   178 0.552581764    10.10.1.2 → 10.10.1.1    TCP 83 46050 → 8081 [PSH, ACK] Seq=239 Ack=239 Win=64256 Len=17 TSval=1047506656 TSecr=3171766366
1711548894.055696726   180 0.552708955    10.10.1.1 → 10.10.1.2    TCP 83 8081 → 46050 [PSH, ACK] Seq=239 Ack=256 Win=65152 Len=17 TSval=3171766367 TSecr=1047506656
1711548902.055696726   188 0.553923243    10.10.1.2 → 10.10.1.1    TCP 83 46050 → 8081 [PSH, ACK] Seq=256 Ack=256 Win=64256 Len=17 TSval=1047506657 TSecr=3171766367
1711548904.055696726   190 0.554048494    10.10.1.1 → 10.10.1.2    TCP 83 8081 → 46050 [PSH, ACK] Seq=256 Ack=273 Win=65152 Len=17 TSval=3171766369 TSecr=1047506657
1711548912.055696726   198 0.555260372    10.10.1.2 → 10.10.1.1    TCP 83 46050 → 8081 [PSH, ACK] Seq=273 Ack=273 Win=64256 Len=17 TSval=1047506659 TSecr=3171766369
1711548915.055696726   201 0.555392014    10.10.1.1 → 10.10.1.2    TCP 83 8081 → 46050 [PSH, ACK] Seq=273 Ack=290 Win=65152 Len=17 TSval=3171766370 TSecr=1047506659
1711548922.055696726   208 0.556604703    10.10.1.2 → 10.10.1.1    TCP 83 46050 → 8081 [PSH, ACK] Seq=290 Ack=290 Win=64256 Len=17 TSval=1047506660 TSecr=3171766370
1711548924.055696726   210 0.556731212    10.10.1.1 → 10.10.1.2    TCP 83 8081 → 46050 [PSH, ACK] Seq=290 Ack=307 Win=65152 Len=17 TSval=3171766371 TSecr=1047506660
1711548932.055696726   218 0.557947916    10.10.1.2 → 10.10.1.1    TCP 83 46050 → 8081 [PSH, ACK] Seq=307 Ack=307 Win=64256 Len=17 TSval=1047506662 TSecr=3171766371
1711548934.055696726   220 0.558069471    10.10.1.1 → 10.10.1.2    TCP 83 8081 → 46050 [PSH, ACK] Seq=307 Ack=324 Win=65152 Len=17 TSval=3171766373 TSecr=1047506662
1711548942.055696726   228 0.559281579    10.10.1.2 → 10.10.1.1    TCP 83 46050 → 8081 [PSH, ACK] Seq=324 Ack=324 Win=64256 Len=17 TSval=1047506663 TSecr=3171766373
1711548945.055696726   231 0.559367310    10.10.1.1 → 10.10.1.2    TCP 83 8081 → 46050 [PSH, ACK] Seq=324 Ack=341 Win=65152 Len=17 TSval=3171766374 TSecr=1047506663
1711548952.055696726   238 0.560580614    10.10.1.2 → 10.10.1.1    TCP 83 46050 → 8081 [PSH, ACK] Seq=341 Ack=341 Win=64256 Len=17 TSval=1047506664 TSecr=3171766374
1711548954.055696726   240 0.560706788    10.10.1.1 → 10.10.1.2    TCP 83 8081 → 46050 [PSH, ACK] Seq=341 Ack=358 Win=65152 Len=17 TSval=3171766375 TSecr=1047506664
1711548962.055696726   248 0.561921822    10.10.1.2 → 10.10.1.1    TCP 83 46050 → 8081 [PSH, ACK] Seq=358 Ack=358 Win=64256 Len=17 TSval=1047506665 TSecr=3171766375
1711548964.055696726   250 0.562046503    10.10.1.1 → 10.10.1.2    TCP 83 8081 → 46050 [PSH, ACK] Seq=358 Ack=375 Win=65152 Len=17 TSval=3171766377 TSecr=1047506665
1711548972.055696726   258 0.563259584    10.10.1.2 → 10.10.1.1    TCP 83 46050 → 8081 [PSH, ACK] Seq=375 Ack=375 Win=64256 Len=17 TSval=1047506667 TSecr=3171766377
1711548975.055696726   261 0.563345345    10.10.1.1 → 10.10.1.2    TCP 83 8081 → 46050 [PSH, ACK] Seq=375 Ack=392 Win=65152 Len=17 TSval=3171766378 TSecr=1047506667
1711548982.055696726   268 0.564558446    10.10.1.2 → 10.10.1.1    TCP 83 46050 → 8081 [PSH, ACK] Seq=392 Ack=392 Win=64256 Len=17 TSval=1047506668 TSecr=3171766378
1711548984.055696726   270 0.564684095    10.10.1.1 → 10.10.1.2    TCP 83 8081 → 46050 [PSH, ACK] Seq=392 Ack=409 Win=65152 Len=17 TSval=3171766379 TSecr=1047506668
1711548992.055696726   278 0.565898598    10.10.1.2 → 10.10.1.1    TCP 83 46050 → 8081 [PSH, ACK] Seq=409 Ack=409 Win=64256 Len=17 TSval=1047506669 TSecr=3171766379
1711548994.055696726   280 0.566024521    10.10.1.1 → 10.10.1.2    TCP 83 8081 → 46050 [PSH, ACK] Seq=409 Ack=426 Win=65152 Len=17 TSval=3171766381 TSecr=1047506669
1711549002.055696726   288 0.567237001    10.10.1.2 → 10.10.1.1    TCP 83 46050 → 8081 [PSH, ACK] Seq=426 Ack=426 Win=64256 Len=17 TSval=1047506671 TSecr=3171766381
1711549005.055696726   291 0.567322509    10.10.1.1 → 10.10.1.2    TCP 83 8081 → 46050 [PSH, ACK] Seq=426 Ack=443 Win=65152 Len=17 TSval=3171766382 TSecr=1047506671
1711549012.055696726   298 0.568534640    10.10.1.2 → 10.10.1.1    TCP 83 46050 → 8081 [PSH, ACK] Seq=443 Ack=443 Win=64256 Len=17 TSval=1047506672 TSecr=3171766382
1711549014.055696726   300 0.568659892    10.10.1.1 → 10.10.1.2    TCP 83 8081 → 46050 [PSH, ACK] Seq=443 Ack=460 Win=65152 Len=17 TSval=3171766383 TSecr=1047506672
1711549022.055696726   308 0.569874181    10.10.1.2 → 10.10.1.1    TCP 83 46050 → 8081 [PSH, ACK] Seq=460 Ack=460 Win=64256 Len=17 TSval=1047506673 TSecr=3171766383
1711549024.055696726   310 0.569999056    10.10.1.1 → 10.10.1.2    TCP 83 8081 → 46050 [PSH, ACK] Seq=460 Ack=477 Win=65152 Len=17 TSval=3171766384 TSecr=1047506673
1711549032.055696726   318 0.571209977    10.10.1.2 → 10.10.1.1    TCP 83 46050 → 8081 [PSH, ACK] Seq=477 Ack=477 Win=64256 Len=17 TSval=1047506675 TSecr=3171766384
1711549035.055696726   321 0.571342446    10.10.1.1 → 10.10.1.2    TCP 83 8081 → 46050 [PSH, ACK] Seq=477 Ack=494 Win=65152 Len=17 TSval=3171766386 TSecr=1047506675
1711549042.055696726   328 0.572554703    10.10.1.2 → 10.10.1.1    TCP 83 46050 → 8081 [PSH, ACK] Seq=494 Ack=494 Win=64256 Len=17 TSval=1047506676 TSecr=3171766386
1711549044.055696726   330 0.572676895    10.10.1.1 → 10.10.1.2    TCP 83 8081 → 46050 [PSH, ACK] Seq=494 Ack=511 Win=65152 Len=17 TSval=3171766387 TSecr=1047506676
1711549052.055696726   338 0.573891356    10.10.1.2 → 10.10.1.1    TCP 83 46050 → 8081 [PSH, ACK] Seq=511 Ack=511 Win=64256 Len=17 TSval=1047506677 TSecr=3171766387
1711549054.055696726   340 0.574013350    10.10.1.1 → 10.10.1.2    TCP 83 8081 → 46050 [PSH, ACK] Seq=511 Ack=528 Win=65152 Len=17 TSval=3171766389 TSecr=1047506677
1711549062.055696726   348 0.575226725    10.10.1.2 → 10.10.1.1    TCP 83 46050 → 8081 [PSH, ACK] Seq=528 Ack=528 Win=64256 Len=17 TSval=1047506679 TSecr=3171766389
1711549065.055696726   351 0.575312706    10.10.1.1 → 10.10.1.2    TCP 83 8081 → 46050 [PSH, ACK] Seq=528 Ack=545 Win=65152 Len=17 TSval=3171766390 TSecr=1047506679
1711549072.055696726   358 0.576524189    10.10.1.2 → 10.10.1.1    TCP 83 46050 → 8081 [PSH, ACK] Seq=545 Ack=545 Win=64256 Len=17 TSval=1047506680 TSecr=3171766390
1711549074.055696726   360 0.576650471    10.10.1.1 → 10.10.1.2    TCP 83 8081 → 46050 [PSH, ACK] Seq=545 Ack=562 Win=65152 Len=17 TSval=3171766391 TSecr=1047506680
1711549082.055696726   368 0.577864208    10.10.1.2 → 10.10.1.1    TCP 83 46050 → 8081 [PSH, ACK] Seq=562 Ack=562 Win=64256 Len=17 TSval=1047506681 TSecr=3171766391
1711549084.055696726   370 0.577989153    10.10.1.1 → 10.10.1.2    TCP 83 8081 → 46050 [PSH, ACK] Seq=562 Ack=579 Win=65152 Len=17 TSval=3171766392 TSecr=1047506681
1711549092.055696726   378 0.579199976    10.10.1.2 → 10.10.1.1    TCP 83 46050 → 8081 [PSH, ACK] Seq=579 Ack=579 Win=64256 Len=17 TSval=1047506683 TSecr=3171766392
1711549095.055696726   381 0.579285444    10.10.1.1 → 10.10.1.2    TCP 83 8081 → 46050 [PSH, ACK] Seq=579 Ack=596 Win=65152 Len=17 TSval=3171766394 TSecr=1047506683
1711549102.055696726   388 0.580498352    10.10.1.2 → 10.10.1.1    TCP 83 46050 → 8081 [PSH, ACK] Seq=596 Ack=596 Win=64256 Len=17 TSval=1047506684 TSecr=3171766394
1711549104.055696726   390 0.580624097    10.10.1.1 → 10.10.1.2    TCP 83 8081 → 46050 [PSH, ACK] Seq=596 Ack=613 Win=65152 Len=17 TSval=3171766395 TSecr=1047506684
1711549112.055696726   398 0.581838573    10.10.1.2 → 10.10.1.1    TCP 83 46050 → 8081 [PSH, ACK] Seq=613 Ack=613 Win=64256 Len=17 TSval=1047506685 TSecr=3171766395
1711549114.055696726   400 0.581963895    10.10.1.1 → 10.10.1.2    TCP 83 8081 → 46050 [PSH, ACK] Seq=613 Ack=630 Win=65152 Len=17 TSval=3171766396 TSecr=1047506685
1711549122.055696726   408 0.583174231    10.10.1.2 → 10.10.1.1    TCP 83 46050 → 8081 [PSH, ACK] Seq=630 Ack=630 Win=64256 Len=17 TSval=1047506687 TSecr=3171766396
1711549124.055696726   410 0.583260199    10.10.1.1 → 10.10.1.2    TCP 83 8081 → 46050 [PSH, ACK] Seq=630 Ack=647 Win=65152 Len=17 TSval=3171766398 TSecr=1047506687
1711549132.055696726   418 0.584471569    10.10.1.2 → 10.10.1.1    TCP 83 46050 → 8081 [PSH, ACK] Seq=647 Ack=647 Win=64256 Len=17 TSval=1047506688 TSecr=3171766398
1711549134.055696726   420 0.584596068    10.10.1.1 → 10.10.1.2    TCP 83 8081 → 46050 [PSH, ACK] Seq=647 Ack=664 Win=65152 Len=17 TSval=3171766399 TSecr=1047506688
1711549142.055696726   428 0.585809801    10.10.1.2 → 10.10.1.1    TCP 83 46050 → 8081 [PSH, ACK] Seq=664 Ack=664 Win=64256 Len=17 TSval=1047506689 TSecr=3171766399
1711549144.055696726   430 0.585935471    10.10.1.1 → 10.10.1.2    TCP 83 8081 → 46050 [PSH, ACK] Seq=664 Ack=681 Win=65152 Len=17 TSval=3171766400 TSecr=1047506689
1711549152.055696726   438 0.587146149    10.10.1.2 → 10.10.1.1    TCP 83 46050 → 8081 [PSH, ACK] Seq=681 Ack=681 Win=64256 Len=17 TSval=1047506691 TSecr=3171766400
1711549154.055696726   440 0.587231612    10.10.1.1 → 10.10.1.2    TCP 83 8081 → 46050 [PSH, ACK] Seq=681 Ack=698 Win=65152 Len=17 TSval=3171766402 TSecr=1047506691
1711549162.055696726   448 0.588394832    10.10.1.2 → 10.10.1.1    TCP 83 46050 → 8081 [PSH, ACK] Seq=698 Ack=698 Win=64256 Len=17 TSval=1047506692 TSecr=3171766402
1711549164.055696726   450 0.588512539    10.10.1.1 → 10.10.1.2    TCP 83 8081 → 46050 [PSH, ACK] Seq=698 Ack=715 Win=65152 Len=17 TSval=3171766403 TSecr=1047506692
1711549171.055696726   457 0.589726543    10.10.1.2 → 10.10.1.1    TCP 83 46050 → 8081 [PSH, ACK] Seq=715 Ack=715 Win=64256 Len=17 TSval=1047506693 TSecr=3171766403
1711549173.055696726   459 0.589852549    10.10.1.1 → 10.10.1.2    TCP 83 8081 → 46050 [PSH, ACK] Seq=715 Ack=732 Win=65152 Len=17 TSval=3171766404 TSecr=1047506693
1711549181.055696726   467 0.591064926    10.10.1.2 → 10.10.1.1    TCP 83 46050 → 8081 [PSH, ACK] Seq=732 Ack=732 Win=64256 Len=17 TSval=1047506695 TSecr=3171766404
1711549184.055696726   470 0.591196887    10.10.1.1 → 10.10.1.2    TCP 83 8081 → 46050 [PSH, ACK] Seq=732 Ack=749 Win=65152 Len=17 TSval=3171766406 TSecr=1047506695
1711549191.055696726   477 0.592423551    10.10.1.2 → 10.10.1.1    TCP 83 46050 → 8081 [PSH, ACK] Seq=749 Ack=749 Win=64256 Len=17 TSval=1047506696 TSecr=3171766406
1711549193.055696726   479 0.592545353    10.10.1.1 → 10.10.1.2    TCP 83 8081 → 46050 [PSH, ACK] Seq=749 Ack=766 Win=65152 Len=17 TSval=3171766407 TSecr=1047506696
1711549201.055696726   487 0.593760394    10.10.1.2 → 10.10.1.1    TCP 83 46050 → 8081 [PSH, ACK] Seq=766 Ack=766 Win=64256 Len=17 TSval=1047506697 TSecr=3171766407
1711549203.055696726   489 0.593882436    10.10.1.1 → 10.10.1.2    TCP 83 8081 → 46050 [PSH, ACK] Seq=766 Ack=783 Win=65152 Len=17 TSval=3171766408 TSecr=1047506697
1711549211.055696726   497 0.595093532    10.10.1.2 → 10.10.1.1    TCP 83 46050 → 8081 [PSH, ACK] Seq=783 Ack=783 Win=64256 Len=17 TSval=1047506699 TSecr=3171766408
1711549213.055696726   499 0.595179134    10.10.1.1 → 10.10.1.2    TCP 83 8081 → 46050 [PSH, ACK] Seq=783 Ack=800 Win=65152 Len=17 TSval=3171766410 TSecr=1047506699
1711549221.055696726   507 0.596405171    10.10.1.2 → 10.10.1.1    TCP 83 46050 → 8081 [PSH, ACK] Seq=800 Ack=800 Win=64256 Len=17 TSval=1047506700 TSecr=3171766410
1711549223.055696726   509 0.596530256    10.10.1.1 → 10.10.1.2    TCP 83 8081 → 46050 [PSH, ACK] Seq=800 Ack=817 Win=65152 Len=17 TSval=3171766411 TSecr=1047506700
1711549231.055696726   517 0.597743901    10.10.1.2 → 10.10.1.1    TCP 83 46050 → 8081 [PSH, ACK] Seq=817 Ack=817 Win=64256 Len=17 TSval=1047506701 TSecr=3171766411
1711549233.055696726   519 0.597869422    10.10.1.1 → 10.10.1.2    TCP 83 8081 → 46050 [PSH, ACK] Seq=817 Ack=834 Win=65152 Len=17 TSval=3171766412 TSecr=1047506701
1711549242.055696726   528 0.599082363    10.10.1.2 → 10.10.1.1    TCP 83 46050 → 8081 [PSH, ACK] Seq=834 Ack=834 Win=64256 Len=17 TSval=1047506703 TSecr=3171766412
1711549244.055696726   530 0.599167111    10.10.1.1 → 10.10.1.2    TCP 83 8081 → 46050 [PSH, ACK] Seq=834 Ack=851 Win=65152 Len=17 TSval=3171766414 TSecr=1047506703
1711549251.055696726   537 0.600378956    10.10.1.2 → 10.10.1.1    TCP 83 46050 → 8081 [PSH, ACK] Seq=851 Ack=851 Win=64256 Len=17 TSval=1047506704 TSecr=3171766414
1711549253.055696726   539 0.600500263    10.10.1.1 → 10.10.1.2    TCP 83 8081 → 46050 [PSH, ACK] Seq=851 Ack=868 Win=65152 Len=17 TSval=3171766415 TSecr=1047506704
1711549261.055696726   547 0.601715116    10.10.1.2 → 10.10.1.1    TCP 83 46050 → 8081 [PSH, ACK] Seq=868 Ack=868 Win=64256 Len=17 TSval=1047506705 TSecr=3171766415
1711549263.055696726   549 0.601835899    10.10.1.1 → 10.10.1.2    TCP 83 8081 → 46050 [PSH, ACK] Seq=868 Ack=885 Win=65152 Len=17 TSval=3171766416 TSecr=1047506705
1711549271.055696726   557 0.603050149    10.10.1.2 → 10.10.1.1    TCP 83 46050 → 8081 [PSH, ACK] Seq=885 Ack=885 Win=64256 Len=17 TSval=1047506707 TSecr=3171766416
1711549273.055696726   559 0.603141291    10.10.1.1 → 10.10.1.2    TCP 83 8081 → 46050 [PSH, ACK] Seq=885 Ack=902 Win=65152 Len=17 TSval=3171766418 TSecr=1047506707
1711549281.055696726   567 0.604352064    10.10.1.2 → 10.10.1.1    TCP 83 46050 → 8081 [PSH, ACK] Seq=902 Ack=902 Win=64256 Len=17 TSval=1047506708 TSecr=3171766418
1711549283.055696726   569 0.604477689    10.10.1.1 → 10.10.1.2    TCP 83 8081 → 46050 [PSH, ACK] Seq=902 Ack=919 Win=65152 Len=17 TSval=3171766419 TSecr=1047506708
1711549291.055696726   577 0.605691026    10.10.1.2 → 10.10.1.1    TCP 83 46050 → 8081 [PSH, ACK] Seq=919 Ack=919 Win=64256 Len=17 TSval=1047506709 TSecr=3171766419
1711549293.055696726   579 0.605816014    10.10.1.1 → 10.10.1.2    TCP 83 8081 → 46050 [PSH, ACK] Seq=919 Ack=936 Win=65152 Len=17 TSval=3171766420 TSecr=1047506709
1711549301.055696726   587 0.607029330    10.10.1.2 → 10.10.1.1    TCP 83 46050 → 8081 [PSH, ACK] Seq=936 Ack=936 Win=64256 Len=17 TSval=1047506711 TSecr=3171766420
1711549303.055696726   589 0.607128406    10.10.1.1 → 10.10.1.2    TCP 83 8081 → 46050 [PSH, ACK] Seq=936 Ack=953 Win=65152 Len=17 TSval=3171766422 TSecr=1047506711
1711549311.055696726   597 0.608339645    10.10.1.2 → 10.10.1.1    TCP 83 46050 → 8081 [PSH, ACK] Seq=953 Ack=953 Win=64256 Len=17 TSval=1047506712 TSecr=3171766422
1711549314.055696726   600 0.608518043    10.10.1.1 → 10.10.1.2    TCP 83 8081 → 46050 [PSH, ACK] Seq=953 Ack=970 Win=65152 Len=17 TSval=3171766423 TSecr=1047506712
1711549321.055696726   607 0.609733556    10.10.1.2 → 10.10.1.1    TCP 83 46050 → 8081 [PSH, ACK] Seq=970 Ack=970 Win=64256 Len=17 TSval=1047506713 TSecr=3171766423
1711549323.055696726   609 0.609857388    10.10.1.1 → 10.10.1.2    TCP 83 8081 → 46050 [PSH, ACK] Seq=970 Ack=987 Win=65152 Len=17 TSval=3171766424 TSecr=1047506713
1711549331.055696726   617 0.611071165    10.10.1.2 → 10.10.1.1    TCP 83 46050 → 8081 [PSH, ACK] Seq=987 Ack=987 Win=64256 Len=17 TSval=1047506715 TSecr=3171766424
1711549333.055696726   619 0.611156851    10.10.1.1 → 10.10.1.2    TCP 83 8081 → 46050 [PSH, ACK] Seq=987 Ack=1004 Win=65152 Len=17 TSval=3171766426 TSecr=1047506715
1711549341.055696726   627 0.612368641    10.10.1.2 → 10.10.1.1    TCP 83 46050 → 8081 [PSH, ACK] Seq=1004 Ack=1004 Win=64256 Len=17 TSval=1047506716 TSecr=3171766426
1711549343.055696726   629 0.612494304    10.10.1.1 → 10.10.1.2    TCP 83 8081 → 46050 [PSH, ACK] Seq=1004 Ack=1021 Win=65152 Len=17 TSval=3171766427 TSecr=1047506716
1711549351.055696726   637 0.613708707    10.10.1.2 → 10.10.1.1    TCP 83 46050 → 8081 [PSH, ACK] Seq=1021 Ack=1021 Win=64256 Len=17 TSval=1047506717 TSecr=3171766427
1711549353.055696726   639 0.613835323    10.10.1.1 → 10.10.1.2    TCP 83 8081 → 46050 [PSH, ACK] Seq=1021 Ack=1038 Win=65152 Len=17 TSval=3171766428 TSecr=1047506717
1711549361.055696726   647 0.615048615    10.10.1.2 → 10.10.1.1    TCP 83 46050 → 8081 [PSH, ACK] Seq=1038 Ack=1038 Win=64256 Len=17 TSval=1047506719 TSecr=3171766428
1711549363.055696726   649 0.615180012    10.10.1.1 → 10.10.1.2    TCP 83 8081 → 46050 [PSH, ACK] Seq=1038 Ack=1055 Win=65152 Len=17 TSval=3171766430 TSecr=1047506719
1711549371.055696726   657 0.616391429    10.10.1.2 → 10.10.1.1    TCP 83 46050 → 8081 [PSH, ACK] Seq=1055 Ack=1055 Win=64256 Len=17 TSval=1047506720 TSecr=3171766430
1711549373.055696726   659 0.616512606    10.10.1.1 → 10.10.1.2    TCP 83 8081 → 46050 [PSH, ACK] Seq=1055 Ack=1072 Win=65152 Len=17 TSval=3171766431 TSecr=1047506720
1711549381.055696726   667 0.617725490    10.10.1.2 → 10.10.1.1    TCP 83 46050 → 8081 [PSH, ACK] Seq=1072 Ack=1072 Win=64256 Len=17 TSval=1047506721 TSecr=3171766431
1711549383.055696726   669 0.617847011    10.10.1.1 → 10.10.1.2    TCP 83 8081 → 46050 [PSH, ACK] Seq=1072 Ack=1089 Win=65152 Len=17 TSval=3171766432 TSecr=1047506721
1711549391.055696726   677 0.619081024    10.10.1.2 → 10.10.1.1    TCP 83 46050 → 8081 [PSH, ACK] Seq=1089 Ack=1089 Win=64256 Len=17 TSval=1047506723 TSecr=3171766432
1711549394.055696726   680 0.619167303    10.10.1.1 → 10.10.1.2    TCP 83 8081 → 46050 [PSH, ACK] Seq=1089 Ack=1106 Win=65152 Len=17 TSval=3171766434 TSecr=1047506723
1711549401.055696726   687 0.620378715    10.10.1.2 → 10.10.1.1    TCP 83 46050 → 8081 [PSH, ACK] Seq=1106 Ack=1106 Win=64256 Len=17 TSval=1047506724 TSecr=3171766434
1711549403.055696726   689 0.620502784    10.10.1.1 → 10.10.1.2    TCP 83 8081 → 46050 [PSH, ACK] Seq=1106 Ack=1123 Win=65152 Len=17 TSval=3171766435 TSecr=1047506724
1711549411.055696726   697 0.621716501    10.10.1.2 → 10.10.1.1    TCP 83 46050 → 8081 [PSH, ACK] Seq=1123 Ack=1123 Win=64256 Len=17 TSval=1047506725 TSecr=3171766435
1711549413.055696726   699 0.621841716    10.10.1.1 → 10.10.1.2    TCP 83 8081 → 46050 [PSH, ACK] Seq=1123 Ack=1140 Win=65152 Len=17 TSval=3171766436 TSecr=1047506725
1711549421.055696726   707 0.623054890    10.10.1.2 → 10.10.1.1    TCP 83 46050 → 8081 [PSH, ACK] Seq=1140 Ack=1140 Win=64256 Len=17 TSval=1047506727 TSecr=3171766436
1711549423.055696726   709 0.623143660    10.10.1.1 → 10.10.1.2    TCP 83 8081 → 46050 [PSH, ACK] Seq=1140 Ack=1157 Win=65152 Len=17 TSval=3171766438 TSecr=1047506727
1711549431.055696726   717 0.624355104    10.10.1.2 → 10.10.1.1    TCP 83 46050 → 8081 [PSH, ACK] Seq=1157 Ack=1157 Win=64256 Len=17 TSval=1047506728 TSecr=3171766438
1711549433.055696726   719 0.624480098    10.10.1.1 → 10.10.1.2    TCP 83 8081 → 46050 [PSH, ACK] Seq=1157 Ack=1174 Win=65152 Len=17 TSval=3171766439 TSecr=1047506728
1711549441.055696726   727 0.625694070    10.10.1.2 → 10.10.1.1    TCP 83 46050 → 8081 [PSH, ACK] Seq=1174 Ack=1174 Win=64256 Len=17 TSval=1047506729 TSecr=3171766439
1711549443.055696726   729 0.625820637    10.10.1.1 → 10.10.1.2    TCP 83 8081 → 46050 [PSH, ACK] Seq=1174 Ack=1191 Win=65152 Len=17 TSval=3171766440 TSecr=1047506729
1711549451.055696726   737 0.627034226    10.10.1.2 → 10.10.1.1    TCP 83 46050 → 8081 [PSH, ACK] Seq=1191 Ack=1191 Win=64256 Len=17 TSval=1047506731 TSecr=3171766440
1711549453.055696726   739 0.627131223    10.10.1.1 → 10.10.1.2    TCP 83 8081 → 46050 [PSH, ACK] Seq=1191 Ack=1208 Win=65152 Len=17 TSval=3171766442 TSecr=1047506731
1711549461.055696726   747 0.628343113    10.10.1.2 → 10.10.1.1    TCP 83 46050 → 8081 [PSH, ACK] Seq=1208 Ack=1208 Win=64256 Len=17 TSval=1047506732 TSecr=3171766442
1711549463.055696726   749 0.628468837    10.10.1.1 → 10.10.1.2    TCP 83 8081 → 46050 [PSH, ACK] Seq=1208 Ack=1225 Win=65152 Len=17 TSval=3171766443 TSecr=1047506732
1711549471.055696726   757 0.629684039    10.10.1.2 → 10.10.1.1    TCP 83 46050 → 8081 [PSH, ACK] Seq=1225 Ack=1225 Win=64256 Len=17 TSval=1047506733 TSecr=3171766443
1711549473.055696726   759 0.629809561    10.10.1.1 → 10.10.1.2    TCP 83 8081 → 46050 [PSH, ACK] Seq=1225 Ack=1242 Win=65152 Len=17 TSval=3171766444 TSecr=1047506733
1711549481.055696726   767 0.631022033    10.10.1.2 → 10.10.1.1    TCP 83 46050 → 8081 [PSH, ACK] Seq=1242 Ack=1242 Win=64256 Len=17 TSval=1047506735 TSecr=3171766444
1711549484.055696726   770 0.631153520    10.10.1.1 → 10.10.1.2    TCP 83 8081 → 46050 [PSH, ACK] Seq=1242 Ack=1259 Win=65152 Len=17 TSval=3171766446 TSecr=1047506735
1711549491.055696726   777 0.632365252    10.10.1.2 → 10.10.1.1    TCP 83 46050 → 8081 [PSH, ACK] Seq=1259 Ack=1259 Win=64256 Len=17 TSval=1047506736 TSecr=3171766446
1711549493.055696726   779 0.632486707    10.10.1.1 → 10.10.1.2    TCP 83 8081 → 46050 [PSH, ACK] Seq=1259 Ack=1276 Win=65152 Len=17 TSval=3171766447 TSecr=1047506736
1711549501.055696726   787 0.633702314    10.10.1.2 → 10.10.1.1    TCP 83 46050 → 8081 [PSH, ACK] Seq=1276 Ack=1276 Win=64256 Len=17 TSval=1047506737 TSecr=3171766447
1711549503.055696726   789 0.633824032    10.10.1.1 → 10.10.1.2    TCP 83 8081 → 46050 [PSH, ACK] Seq=1276 Ack=1293 Win=65152 Len=17 TSval=3171766448 TSecr=1047506737
1711549511.055696726   797 0.635038088    10.10.1.2 → 10.10.1.1    TCP 83 46050 → 8081 [PSH, ACK] Seq=1293 Ack=1293 Win=64256 Len=17 TSval=1047506739 TSecr=3171766448
1711549513.055696726   799 0.635130030    10.10.1.1 → 10.10.1.2    TCP 83 8081 → 46050 [PSH, ACK] Seq=1293 Ack=1310 Win=65152 Len=17 TSval=3171766450 TSecr=1047506739
1711549521.055696726   807 0.636342288    10.10.1.2 → 10.10.1.1    TCP 83 46050 → 8081 [PSH, ACK] Seq=1310 Ack=1310 Win=64256 Len=17 TSval=1047506740 TSecr=3171766450
1711549523.055696726   809 0.636467474    10.10.1.1 → 10.10.1.2    TCP 83 8081 → 46050 [PSH, ACK] Seq=1310 Ack=1327 Win=65152 Len=17 TSval=3171766451 TSecr=1047506740
1711549531.055696726   817 0.637683107    10.10.1.2 → 10.10.1.1    TCP 83 46050 → 8081 [PSH, ACK] Seq=1327 Ack=1327 Win=64256 Len=17 TSval=1047506741 TSecr=3171766451
1711549533.055696726   819 0.637808293    10.10.1.1 → 10.10.1.2    TCP 83 8081 → 46050 [PSH, ACK] Seq=1327 Ack=1344 Win=65152 Len=17 TSval=3171766452 TSecr=1047506741
1711549541.055696726   827 0.639022155    10.10.1.2 → 10.10.1.1    TCP 83 46050 → 8081 [PSH, ACK] Seq=1344 Ack=1344 Win=64256 Len=17 TSval=1047506743 TSecr=3171766452
1711549543.055696726   829 0.639123951    10.10.1.1 → 10.10.1.2    TCP 83 8081 → 46050 [PSH, ACK] Seq=1344 Ack=1361 Win=65152 Len=17 TSval=3171766454 TSecr=1047506743
1711549551.055696726   837 0.640335899    10.10.1.2 → 10.10.1.1    TCP 83 46050 → 8081 [PSH, ACK] Seq=1361 Ack=1361 Win=64256 Len=17 TSval=1047506744 TSecr=3171766454
1711549553.055696726   839 0.640461132    10.10.1.1 → 10.10.1.2    TCP 83 8081 → 46050 [PSH, ACK] Seq=1361 Ack=1378 Win=65152 Len=17 TSval=3171766455 TSecr=1047506744
1711549561.055696726   847 0.641675702    10.10.1.2 → 10.10.1.1    TCP 83 46050 → 8081 [PSH, ACK] Seq=1378 Ack=1378 Win=64256 Len=17 TSval=1047506745 TSecr=3171766455
1711549563.055696726   849 0.641801018    10.10.1.1 → 10.10.1.2    TCP 83 8081 → 46050 [PSH, ACK] Seq=1378 Ack=1395 Win=65152 Len=17 TSval=3171766456 TSecr=1047506745
1711549571.055696726   857 0.643014372    10.10.1.2 → 10.10.1.1    TCP 83 46050 → 8081 [PSH, ACK] Seq=1395 Ack=1395 Win=64256 Len=17 TSval=1047506747 TSecr=3171766456
1711549574.055696726   860 0.643144424    10.10.1.1 → 10.10.1.2    TCP 83 8081 → 46050 [PSH, ACK] Seq=1395 Ack=1412 Win=65152 Len=17 TSval=3171766458 TSecr=1047506747
1711549581.055696726   867 0.644357331    10.10.1.2 → 10.10.1.1    TCP 83 46050 → 8081 [PSH, ACK] Seq=1412 Ack=1412 Win=64256 Len=17 TSval=1047506748 TSecr=3171766458
1711549583.055696726   869 0.644478104    10.10.1.1 → 10.10.1.2    TCP 83 8081 → 46050 [PSH, ACK] Seq=1412 Ack=1429 Win=65152 Len=17 TSval=3171766459 TSecr=1047506748
1711549591.055696726   877 0.645692917    10.10.1.2 → 10.10.1.1    TCP 83 46050 → 8081 [PSH, ACK] Seq=1429 Ack=1429 Win=64256 Len=17 TSval=1047506749 TSecr=3171766459
1711549593.055696726   879 0.645815601    10.10.1.1 → 10.10.1.2    TCP 83 8081 → 46050 [PSH, ACK] Seq=1429 Ack=1446 Win=65152 Len=17 TSval=3171766460 TSecr=1047506749
1711549601.055696726   887 0.647028449    10.10.1.2 → 10.10.1.1    TCP 83 46050 → 8081 [PSH, ACK] Seq=1446 Ack=1446 Win=64256 Len=17 TSval=1047506751 TSecr=3171766460
1711549603.055696726   889 0.647129195    10.10.1.1 → 10.10.1.2    TCP 83 8081 → 46050 [PSH, ACK] Seq=1446 Ack=1463 Win=65152 Len=17 TSval=3171766462 TSecr=1047506751
1711549611.055696726   897 0.648340758    10.10.1.2 → 10.10.1.1    TCP 83 46050 → 8081 [PSH, ACK] Seq=1463 Ack=1463 Win=64256 Len=17 TSval=1047506752 TSecr=3171766462
1711549613.055696726   899 0.648466570    10.10.1.1 → 10.10.1.2    TCP 83 8081 → 46050 [PSH, ACK] Seq=1463 Ack=1480 Win=65152 Len=17 TSval=3171766463 TSecr=1047506752
1711549621.055696726   907 0.649680663    10.10.1.2 → 10.10.1.1    TCP 83 46050 → 8081 [PSH, ACK] Seq=1480 Ack=1480 Win=64256 Len=17 TSval=1047506753 TSecr=3171766463
1711549623.055696726   909 0.649804488    10.10.1.1 → 10.10.1.2    TCP 83 8081 → 46050 [PSH, ACK] Seq=1480 Ack=1497 Win=65152 Len=17 TSval=3171766464 TSecr=1047506753
1711549631.055696726   917 0.651018132    10.10.1.2 → 10.10.1.1    TCP 83 46050 → 8081 [PSH, ACK] Seq=1497 Ack=1497 Win=64256 Len=17 TSval=1047506755 TSecr=3171766464
1711549634.055696726   920 0.651148012    10.10.1.1 → 10.10.1.2    TCP 83 8081 → 46050 [PSH, ACK] Seq=1497 Ack=1514 Win=65152 Len=17 TSval=3171766466 TSecr=1047506755
1711549641.055696726   927 0.652360021    10.10.1.2 → 10.10.1.1    TCP 83 46050 → 8081 [PSH, ACK] Seq=1514 Ack=1514 Win=64256 Len=17 TSval=1047506756 TSecr=3171766466
1711549643.055696726   929 0.652484796    10.10.1.1 → 10.10.1.2    TCP 83 8081 → 46050 [PSH, ACK] Seq=1514 Ack=1531 Win=65152 Len=17 TSval=3171766467 TSecr=1047506756
1711549651.055696726   937 0.653698187    10.10.1.2 → 10.10.1.1    TCP 83 46050 → 8081 [PSH, ACK] Seq=1531 Ack=1531 Win=64256 Len=17 TSval=1047506757 TSecr=3171766467
1711549653.055696726   939 0.653823400    10.10.1.1 → 10.10.1.2    TCP 83 8081 → 46050 [PSH, ACK] Seq=1531 Ack=1548 Win=65152 Len=17 TSval=3171766468 TSecr=1047506757
1711549661.055696726   947 0.655035873    10.10.1.2 → 10.10.1.1    TCP 83 46050 → 8081 [PSH, ACK] Seq=1548 Ack=1548 Win=64256 Len=17 TSval=1047506759 TSecr=3171766468
1711549663.055696726   949 0.655131288    10.10.1.1 → 10.10.1.2    TCP 83 8081 → 46050 [PSH, ACK] Seq=1548 Ack=1565 Win=65152 Len=17 TSval=3171766470 TSecr=1047506759
1711549671.055696726   957 0.656343872    10.10.1.2 → 10.10.1.1    TCP 83 46050 → 8081 [PSH, ACK] Seq=1565 Ack=1565 Win=64256 Len=17 TSval=1047506760 TSecr=3171766470
1711549673.055696726   959 0.656468712    10.10.1.1 → 10.10.1.2    TCP 83 8081 → 46050 [PSH, ACK] Seq=1565 Ack=1582 Win=65152 Len=17 TSval=3171766471 TSecr=1047506760
1711549681.055696726   967 0.657682649    10.10.1.2 → 10.10.1.1    TCP 83 46050 → 8081 [PSH, ACK] Seq=1582 Ack=1582 Win=64256 Len=17 TSval=1047506761 TSecr=3171766471
1711549683.055696726   969 0.657807805    10.10.1.1 → 10.10.1.2    TCP 83 8081 → 46050 [PSH, ACK] Seq=1582 Ack=1599 Win=65152 Len=17 TSval=3171766472 TSecr=1047506761
1711549691.055696726   977 0.659021386    10.10.1.2 → 10.10.1.1    TCP 83 46050 → 8081 [PSH, ACK] Seq=1599 Ack=1599 Win=64256 Len=17 TSval=1047506763 TSecr=3171766472
1711549694.055696726   980 0.659151541    10.10.1.1 → 10.10.1.2    TCP 83 8081 → 46050 [PSH, ACK] Seq=1599 Ack=1616 Win=65152 Len=17 TSval=3171766474 TSecr=1047506763
1711549701.055696726   987 0.660375869    10.10.1.2 → 10.10.1.1    TCP 83 46050 → 8081 [PSH, ACK] Seq=1616 Ack=1616 Win=64256 Len=17 TSval=1047506764 TSecr=3171766474
1711549703.055696726   989 0.660496771    10.10.1.1 → 10.10.1.2    TCP 83 8081 → 46050 [PSH, ACK] Seq=1616 Ack=1633 Win=65152 Len=17 TSval=3171766475 TSecr=1047506764
1711549711.055696726   997 0.661711181    10.10.1.2 → 10.10.1.1    TCP 83 46050 → 8081 [PSH, ACK] Seq=1633 Ack=1633 Win=64256 Len=17 TSval=1047506765 TSecr=3171766475
1711549713.055696726   999 0.661833129    10.10.1.1 → 10.10.1.2    TCP 83 8081 → 46050 [PSH, ACK] Seq=1633 Ack=1650 Win=65152 Len=17 TSval=3171766476 TSecr=1047506765
1711549721.055696726  1007 0.663046300    10.10.1.2 → 10.10.1.1    TCP 83 46050 → 8081 [PSH, ACK] Seq=1650 Ack=1650 Win=64256 Len=17 TSval=1047506767 TSecr=3171766476
1711549723.055696726  1009 0.663135833    10.10.1.1 → 10.10.1.2    TCP 83 8081 → 46050 [PSH, ACK] Seq=1650 Ack=1667 Win=65152 Len=17 TSval=3171766478 TSecr=1047506767
1711549731.055696726  1017 0.664359742    10.10.1.2 → 10.10.1.1    TCP 83 46050 → 8081 [PSH, ACK] Seq=1667 Ack=1667 Win=64256 Len=17 TSval=1047506768 TSecr=3171766478
1711549733.055696726  1019 0.664485425    10.10.1.1 → 10.10.1.2    TCP 83 8081 → 46050 [PSH, ACK] Seq=1667 Ack=1684 Win=65152 Len=17 TSval=3171766479 TSecr=1047506768
1711549741.055696726  1027 0.665699978    10.10.1.2 → 10.10.1.1    TCP 83 46050 → 8081 [PSH, ACK] Seq=1684 Ack=1684 Win=64256 Len=17 TSval=1047506769 TSecr=3171766479
1711549743.055696726  1029 0.665825776    10.10.1.1 → 10.10.1.2    TCP 83 8081 → 46050 [PSH, ACK] Seq=1684 Ack=1701 Win=65152 Len=17 TSval=3171766480 TSecr=1047506769
1711549751.055696726  1037 0.667041180    10.10.1.2 → 10.10.1.1    TCP 83 46050 → 8081 [PSH, ACK] Seq=1701 Ack=1701 Win=64256 Len=17 TSval=1047506771 TSecr=3171766480
1711549753.055696726  1039 0.667131069    10.10.1.1 → 10.10.1.2    TCP 83 8081 → 46050 [PSH, ACK] Seq=1701 Ack=1718 Win=65152 Len=17 TSval=3171766482 TSecr=1047506771
1711549761.055696726  1047 0.668342816    10.10.1.2 → 10.10.1.1    TCP 83 46050 → 8081 [PSH, ACK] Seq=1718 Ack=1718 Win=64256 Len=17 TSval=1047506772 TSecr=3171766482
1711549763.055696726  1049 0.668467947    10.10.1.1 → 10.10.1.2    TCP 83 8081 → 46050 [PSH, ACK] Seq=1718 Ack=1735 Win=65152 Len=17 TSval=3171766483 TSecr=1047506772
1711549771.055696726  1057 0.669682166    10.10.1.2 → 10.10.1.1    TCP 83 46050 → 8081 [PSH, ACK] Seq=1735 Ack=1735 Win=64256 Len=17 TSval=1047506773 TSecr=3171766483
1711549773.055696726  1059 0.669807796    10.10.1.1 → 10.10.1.2    TCP 83 8081 → 46050 [PSH, ACK] Seq=1735 Ack=1752 Win=65152 Len=17 TSval=3171766484 TSecr=1047506773
1711549781.055696726  1067 0.671021659    10.10.1.2 → 10.10.1.1    TCP 83 46050 → 8081 [PSH, ACK] Seq=1752 Ack=1752 Win=64256 Len=17 TSval=1047506775 TSecr=3171766484
1711549784.055696726  1070 0.671152115    10.10.1.1 → 10.10.1.2    TCP 83 8081 → 46050 [PSH, ACK] Seq=1752 Ack=1769 Win=65152 Len=17 TSval=3171766486 TSecr=1047506775
1711549791.055696726  1077 0.672363283    10.10.1.2 → 10.10.1.1    TCP 83 46050 → 8081 [PSH, ACK] Seq=1769 Ack=1769 Win=64256 Len=17 TSval=1047506776 TSecr=3171766486
1711549793.055696726  1079 0.672485030    10.10.1.1 → 10.10.1.2    TCP 83 8081 → 46050 [PSH, ACK] Seq=1769 Ack=1786 Win=65152 Len=17 TSval=3171766487 TSecr=1047506776
1711549801.055696726  1087 0.673698938    10.10.1.2 → 10.10.1.1    TCP 83 46050 → 8081 [PSH, ACK] Seq=1786 Ack=1786 Win=64256 Len=17 TSval=1047506777 TSecr=3171766487
1711549803.055696726  1089 0.673820189    10.10.1.1 → 10.10.1.2    TCP 83 8081 → 46050 [PSH, ACK] Seq=1786 Ack=1803 Win=65152 Len=17 TSval=3171766488 TSecr=1047506777
1711549811.055696726  1097 0.675033370    10.10.1.2 → 10.10.1.1    TCP 83 46050 → 8081 [PSH, ACK] Seq=1803 Ack=1803 Win=64256 Len=17 TSval=1047506779 TSecr=3171766488
1711549813.055696726  1099 0.675134759    10.10.1.1 → 10.10.1.2    TCP 83 8081 → 46050 [PSH, ACK] Seq=1803 Ack=1820 Win=65152 Len=17 TSval=3171766490 TSecr=1047506779
1711549821.055696726  1107 0.676363606    10.10.1.2 → 10.10.1.1    TCP 83 46050 → 8081 [PSH, ACK] Seq=1820 Ack=1820 Win=64256 Len=17 TSval=1047506780 TSecr=3171766490
1711549823.055696726  1109 0.676485150    10.10.1.1 → 10.10.1.2    TCP 83 8081 → 46050 [PSH, ACK] Seq=1820 Ack=1837 Win=65152 Len=17 TSval=3171766491 TSecr=1047506780
1711549831.055696726  1117 0.677700275    10.10.1.2 → 10.10.1.1    TCP 83 46050 → 8081 [PSH, ACK] Seq=1837 Ack=1837 Win=64256 Len=17 TSval=1047506781 TSecr=3171766491
1711549833.055696726  1119 0.677821720    10.10.1.1 → 10.10.1.2    TCP 83 8081 → 46050 [PSH, ACK] Seq=1837 Ack=1854 Win=65152 Len=17 TSval=3171766492 TSecr=1047506781
1711549841.055696726  1127 0.679035123    10.10.1.2 → 10.10.1.1    TCP 83 46050 → 8081 [PSH, ACK] Seq=1854 Ack=1854 Win=64256 Len=17 TSval=1047506783 TSecr=3171766492
1711549844.055696726  1130 0.679165348    10.10.1.1 → 10.10.1.2    TCP 83 8081 → 46050 [PSH, ACK] Seq=1854 Ack=1871 Win=65152 Len=17 TSval=3171766494 TSecr=1047506783
1711549851.055696726  1137 0.680377022    10.10.1.2 → 10.10.1.1    TCP 83 46050 → 8081 [PSH, ACK] Seq=1871 Ack=1871 Win=64256 Len=17 TSval=1047506784 TSecr=3171766494
1711549853.055696726  1139 0.680503095    10.10.1.1 → 10.10.1.2    TCP 83 8081 → 46050 [PSH, ACK] Seq=1871 Ack=1888 Win=65152 Len=17 TSval=3171766495 TSecr=1047506784
1711549861.055696726  1147 0.681717108    10.10.1.2 → 10.10.1.1    TCP 83 46050 → 8081 [PSH, ACK] Seq=1888 Ack=1888 Win=64256 Len=17 TSval=1047506785 TSecr=3171766495
1711549863.055696726  1149 0.681838426    10.10.1.1 → 10.10.1.2    TCP 83 8081 → 46050 [PSH, ACK] Seq=1888 Ack=1905 Win=65152 Len=17 TSval=3171766496 TSecr=1047506785
1711549871.055696726  1157 0.683052120    10.10.1.2 → 10.10.1.1    TCP 83 46050 → 8081 [PSH, ACK] Seq=1905 Ack=1905 Win=64256 Len=17 TSval=1047506787 TSecr=3171766496
1711549873.055696726  1159 0.683142045    10.10.1.1 → 10.10.1.2    TCP 83 8081 → 46050 [PSH, ACK] Seq=1905 Ack=1922 Win=65152 Len=17 TSval=3171766498 TSecr=1047506787
1711549881.055696726  1167 0.684353906    10.10.1.2 → 10.10.1.1    TCP 83 46050 → 8081 [PSH, ACK] Seq=1922 Ack=1922 Win=64256 Len=17 TSval=1047506788 TSecr=3171766498
1711549884.055696726  1170 0.684531801    10.10.1.1 → 10.10.1.2    TCP 83 8081 → 46050 [PSH, ACK] Seq=1922 Ack=1939 Win=65152 Len=17 TSval=3171766499 TSecr=1047506788
1711549891.055696726  1177 0.685745779    10.10.1.2 → 10.10.1.1    TCP 83 46050 → 8081 [PSH, ACK] Seq=1939 Ack=1939 Win=64256 Len=17 TSval=1047506789 TSecr=3171766499
1711549893.055696726  1179 0.685871360    10.10.1.1 → 10.10.1.2    TCP 83 8081 → 46050 [PSH, ACK] Seq=1939 Ack=1956 Win=65152 Len=17 TSval=3171766500 TSecr=1047506789
1711549901.055696726  1187 0.687083768    10.10.1.2 → 10.10.1.1    TCP 83 46050 → 8081 [PSH, ACK] Seq=1956 Ack=1956 Win=64256 Len=17 TSval=1047506791 TSecr=3171766500
1711549904.055696726  1190 0.687217819    10.10.1.1 → 10.10.1.2    TCP 83 8081 → 46050 [PSH, ACK] Seq=1956 Ack=1973 Win=65152 Len=17 TSval=3171766502 TSecr=1047506791
1711549911.055696726  1197 0.688433871    10.10.1.2 → 10.10.1.1    TCP 83 46050 → 8081 [PSH, ACK] Seq=1973 Ack=1973 Win=64256 Len=17 TSval=1047506792 TSecr=3171766502
1711549913.055696726  1199 0.688555802    10.10.1.1 → 10.10.1.2    TCP 83 8081 → 46050 [PSH, ACK] Seq=1973 Ack=1990 Win=65152 Len=17 TSval=3171766503 TSecr=1047506792
1711549921.055696726  1207 0.689773735    10.10.1.2 → 10.10.1.1    TCP 83 46050 → 8081 [PSH, ACK] Seq=1990 Ack=1990 Win=64256 Len=17 TSval=1047506793 TSecr=3171766503
1711549923.055696726  1209 0.689895817    10.10.1.1 → 10.10.1.2    TCP 83 8081 → 46050 [PSH, ACK] Seq=1990 Ack=2007 Win=65152 Len=17 TSval=3171766504 TSecr=1047506793
