1711548881.504164457    34 0.543372504    10.10.1.2 → 10.10.1.1    TCP 83 36254 → 8081 [PSH, ACK] Seq=1 Ack=1 Win=64256 Len=17 TSval=1047640090 TSecr=3171899538
1711548885.504164457    38 0.543654223    10.10.1.1 → 10.10.1.2    TCP 83 8081 → 36254 [PSH, ACK] Seq=1 Ack=18 Win=65152 Len=17 TSval=3171899802 TSecr=1047640090
1711548894.504164457    47 0.553875681    10.10.1.2 → 10.10.1.1    TCP 83 36254 → 8081 [PSH, ACK] Seq=18 Ack=18 Win=64256 Len=17 TSval=1047640101 TSecr=3171899802
1711548896.504164457    49 0.553967906    10.10.1.1 → 10.10.1.2    TCP 83 8081 → 36254 [PSH, ACK] Seq=18 Ack=35 Win=65152 Len=17 TSval=3171899812 TSecr=1047640101
1711548903.504164457    56 0.564186288    10.10.1.2 → 10.10.1.1    TCP 83 36254 → 8081 [PSH, ACK] Seq=35 Ack=35 Win=64256 Len=17 TSval=1047640111 TSecr=3171899812
1711548906.504164457    59 0.564283337    10.10.1.1 → 10.10.1.2    TCP 83 8081 → 36254 [PSH, ACK] Seq=35 Ack=52 Win=65152 Len=17 TSval=3171899822 TSecr=1047640111
1711548913.504164457    66 0.574502399    10.10.1.2 → 10.10.1.1    TCP 83 36254 → 8081 [PSH, ACK] Seq=52 Ack=52 Win=64256 Len=17 TSval=1047640122 TSecr=3171899822
1711548916.504164457    69 0.574600249    10.10.1.1 → 10.10.1.2    TCP 83 8081 → 36254 [PSH, ACK] Seq=52 Ack=69 Win=65152 Len=17 TSval=3171899833 TSecr=1047640122
1711548923.504164457    76 0.584816709    10.10.1.2 → 10.10.1.1    TCP 83 36254 → 8081 [PSH, ACK] Seq=69 Ack=69 Win=64256 Len=17 TSval=1047640132 TSecr=3171899833
1711548926.504164457    79 0.584901693    10.10.1.1 → 10.10.1.2    TCP 83 8081 → 36254 [PSH, ACK] Seq=69 Ack=86 Win=65152 Len=17 TSval=3171899843 TSecr=1047640132
1711548933.504164457    86 0.595119199    10.10.1.2 → 10.10.1.1    TCP 83 36254 → 8081 [PSH, ACK] Seq=86 Ack=86 Win=64256 Len=17 TSval=1047640142 TSecr=3171899843
1711548935.504164457    88 0.595204257    10.10.1.1 → 10.10.1.2    TCP 83 8081 → 36254 [PSH, ACK] Seq=86 Ack=103 Win=65152 Len=17 TSval=3171899853 TSecr=1047640142
1711548943.504164457    96 0.605420744    10.10.1.2 → 10.10.1.1    TCP 83 36254 → 8081 [PSH, ACK] Seq=103 Ack=103 Win=64256 Len=17 TSval=1047640153 TSecr=3171899853
1711548945.504164457    98 0.605505974    10.10.1.1 → 10.10.1.2    TCP 83 8081 → 36254 [PSH, ACK] Seq=103 Ack=120 Win=65152 Len=17 TSval=3171899864 TSecr=1047640153
1711548953.504164457   106 0.615736305    10.10.1.2 → 10.10.1.1    TCP 83 36254 → 8081 [PSH, ACK] Seq=120 Ack=120 Win=64256 Len=17 TSval=1047640163 TSecr=3171899864
1711548955.504164457   108 0.615821630    10.10.1.1 → 10.10.1.2    TCP 83 8081 → 36254 [PSH, ACK] Seq=120 Ack=137 Win=65152 Len=17 TSval=3171899874 TSecr=1047640163
1711548964.504164457   117 0.626039826    10.10.1.2 → 10.10.1.1    TCP 83 36254 → 8081 [PSH, ACK] Seq=137 Ack=137 Win=64256 Len=17 TSval=1047640173 TSecr=3171899874
1711548965.504164457   118 0.626136568    10.10.1.1 → 10.10.1.2    TCP 83 8081 → 36254 [PSH, ACK] Seq=137 Ack=154 Win=65152 Len=17 TSval=3171899884 TSecr=1047640173
1711548973.504164457   126 0.636351712    10.10.1.2 → 10.10.1.1    TCP 83 36254 → 8081 [PSH, ACK] Seq=154 Ack=154 Win=64256 Len=17 TSval=1047640183 TSecr=3171899884
1711548975.504164457   128 0.636455181    10.10.1.1 → 10.10.1.2    TCP 83 8081 → 36254 [PSH, ACK] Seq=154 Ack=171 Win=65152 Len=17 TSval=3171899895 TSecr=1047640183
1711548983.504164457   136 0.646675423    10.10.1.2 → 10.10.1.1    TCP 83 36254 → 8081 [PSH, ACK] Seq=171 Ack=171 Win=64256 Len=17 TSval=1047640194 TSecr=3171899895
1711548985.504164457   138 0.646778179    10.10.1.1 → 10.10.1.2    TCP 83 8081 → 36254 [PSH, ACK] Seq=171 Ack=188 Win=65152 Len=17 TSval=3171899905 TSecr=1047640194
1711548993.504164457   146 0.656997929    10.10.1.2 → 10.10.1.1    TCP 83 36254 → 8081 [PSH, ACK] Seq=188 Ack=188 Win=64256 Len=17 TSval=1047640204 TSecr=3171899905
1711548995.504164457   148 0.657099961    10.10.1.1 → 10.10.1.2    TCP 83 8081 → 36254 [PSH, ACK] Seq=188 Ack=205 Win=65152 Len=17 TSval=3171899915 TSecr=1047640204
1711549003.504164457   156 0.667316665    10.10.1.2 → 10.10.1.1    TCP 83 36254 → 8081 [PSH, ACK] Seq=205 Ack=205 Win=64256 Len=17 TSval=1047640214 TSecr=3171899915
1711549005.504164457   158 0.667420857    10.10.1.1 → 10.10.1.2    TCP 83 8081 → 36254 [PSH, ACK] Seq=205 Ack=222 Win=65152 Len=17 TSval=3171899926 TSecr=1047640214
1711549013.504164457   166 0.677639093    10.10.1.2 → 10.10.1.1    TCP 83 36254 → 8081 [PSH, ACK] Seq=222 Ack=222 Win=64256 Len=17 TSval=1047640225 TSecr=3171899926
1711549015.504164457   168 0.677741293    10.10.1.1 → 10.10.1.2    TCP 83 8081 → 36254 [PSH, ACK] Seq=222 Ack=239 Win=65152 Len=17 TSval=3171899936 TSecr=1047640225
1711549023.504164457   176 0.687957658    10.10.1.2 → 10.10.1.1    TCP 83 36254 → 8081 [PSH, ACK] Seq=239 Ack=239 Win=64256 Len=17 TSval=1047640235 TSecr=3171899936
1711549025.504164457   178 0.688059239    10.10.1.1 → 10.10.1.2    TCP 83 8081 → 36254 [PSH, ACK] Seq=239 Ack=256 Win=65152 Len=17 TSval=3171899946 TSecr=1047640235
1711549033.504164457   186 0.698273422    10.10.1.2 → 10.10.1.1    TCP 83 36254 → 8081 [PSH, ACK] Seq=256 Ack=256 Win=64256 Len=17 TSval=1047640245 TSecr=3171899946
1711549035.504164457   188 0.698374666    10.10.1.1 → 10.10.1.2    TCP 83 8081 → 36254 [PSH, ACK] Seq=256 Ack=273 Win=65152 Len=17 TSval=3171899957 TSecr=1047640245
1711549043.504164457   196 0.708591182    10.10.1.2 → 10.10.1.1    TCP 83 36254 → 8081 [PSH, ACK] Seq=273 Ack=273 Win=64256 Len=17 TSval=1047640256 TSecr=3171899957
1711549045.504164457   198 0.708692959    10.10.1.1 → 10.10.1.2    TCP 83 8081 → 36254 [PSH, ACK] Seq=273 Ack=290 Win=65152 Len=17 TSval=3171899967 TSecr=1047640256
1711549053.504164457   206 0.718914072    10.10.1.2 → 10.10.1.1    TCP 83 36254 → 8081 [PSH, ACK] Seq=290 Ack=290 Win=64256 Len=17 TSval=1047640266 TSecr=3171899967
1711549055.504164457   208 0.719018153    10.10.1.1 → 10.10.1.2    TCP 83 8081 → 36254 [PSH, ACK] Seq=290 Ack=307 Win=65152 Len=17 TSval=3171899977 TSecr=1047640266
1711549063.504164457   216 0.729233451    10.10.1.2 → 10.10.1.1    TCP 83 36254 → 8081 [PSH, ACK] Seq=307 Ack=307 Win=64256 Len=17 TSval=1047640276 TSecr=3171899977
1711549065.504164457   218 0.729335076    10.10.1.1 → 10.10.1.2    TCP 83 8081 → 36254 [PSH, ACK] Seq=307 Ack=324 Win=65152 Len=17 TSval=3171899987 TSecr=1047640276
1711549073.504164457   226 0.739552532    10.10.1.2 → 10.10.1.1    TCP 83 36254 → 8081 [PSH, ACK] Seq=324 Ack=324 Win=64256 Len=17 TSval=1047640287 TSecr=3171899987
1711549075.504164457   228 0.739655599    10.10.1.1 → 10.10.1.2    TCP 83 8081 → 36254 [PSH, ACK] Seq=324 Ack=341 Win=65152 Len=17 TSval=3171899998 TSecr=1047640287
1711549083.504164457   236 0.749870124    10.10.1.2 → 10.10.1.1    TCP 83 36254 → 8081 [PSH, ACK] Seq=341 Ack=341 Win=64256 Len=17 TSval=1047640297 TSecr=3171899998
1711549085.504164457   238 0.749976685    10.10.1.1 → 10.10.1.2    TCP 83 8081 → 36254 [PSH, ACK] Seq=341 Ack=358 Win=65152 Len=17 TSval=3171900008 TSecr=1047640297
1711549093.504164457   246 0.760193013    10.10.1.2 → 10.10.1.1    TCP 83 36254 → 8081 [PSH, ACK] Seq=358 Ack=358 Win=64256 Len=17 TSval=1047640307 TSecr=3171900008
1711549095.504164457   248 0.760295526    10.10.1.1 → 10.10.1.2    TCP 83 8081 → 36254 [PSH, ACK] Seq=358 Ack=375 Win=65152 Len=17 TSval=3171900018 TSecr=1047640307
1711549103.504164457   256 0.770511124    10.10.1.2 → 10.10.1.1    TCP 83 36254 → 8081 [PSH, ACK] Seq=375 Ack=375 Win=64256 Len=17 TSval=1047640318 TSecr=3171900018
1711549105.504164457   258 0.770613926    10.10.1.1 → 10.10.1.2    TCP 83 8081 → 36254 [PSH, ACK] Seq=375 Ack=392 Win=65152 Len=17 TSval=3171900029 TSecr=1047640318
1711549113.504164457   266 0.780831791    10.10.1.2 → 10.10.1.1    TCP 83 36254 → 8081 [PSH, ACK] Seq=392 Ack=392 Win=64256 Len=17 TSval=1047640328 TSecr=3171900029
1711549115.504164457   268 0.780934258    10.10.1.1 → 10.10.1.2    TCP 83 8081 → 36254 [PSH, ACK] Seq=392 Ack=409 Win=65152 Len=17 TSval=3171900039 TSecr=1047640328
1711549123.504164457   276 0.791149480    10.10.1.2 → 10.10.1.1    TCP 83 36254 → 8081 [PSH, ACK] Seq=409 Ack=409 Win=64256 Len=17 TSval=1047640338 TSecr=3171900039
1711549125.504164457   278 0.791252539    10.10.1.1 → 10.10.1.2    TCP 83 8081 → 36254 [PSH, ACK] Seq=409 Ack=426 Win=65152 Len=17 TSval=3171900049 TSecr=1047640338
1711549133.504164457   286 0.801468244    10.10.1.2 → 10.10.1.1    TCP 83 36254 → 8081 [PSH, ACK] Seq=426 Ack=426 Win=64256 Len=17 TSval=1047640349 TSecr=3171900049
1711549135.504164457   288 0.801570333    10.10.1.1 → 10.10.1.2    TCP 83 8081 → 36254 [PSH, ACK] Seq=426 Ack=443 Win=65152 Len=17 TSval=3171900060 TSecr=1047640349
1711549143.504164457   296 0.811787141    10.10.1.2 → 10.10.1.1    TCP 83 36254 → 8081 [PSH, ACK] Seq=443 Ack=443 Win=64256 Len=17 TSval=1047640359 TSecr=3171900060
1711549145.504164457   298 0.811892973    10.10.1.1 → 10.10.1.2    TCP 83 8081 → 36254 [PSH, ACK] Seq=443 Ack=460 Win=65152 Len=17 TSval=3171900070 TSecr=1047640359
1711549153.504164457   306 0.822110010    10.10.1.2 → 10.10.1.1    TCP 83 36254 → 8081 [PSH, ACK] Seq=460 Ack=460 Win=64256 Len=17 TSval=1047640369 TSecr=3171900070
1711549155.504164457   308 0.822213275    10.10.1.1 → 10.10.1.2    TCP 83 8081 → 36254 [PSH, ACK] Seq=460 Ack=477 Win=65152 Len=17 TSval=3171900080 TSecr=1047640369
1711549163.504164457   316 0.832416306    10.10.1.2 → 10.10.1.1    TCP 83 36254 → 8081 [PSH, ACK] Seq=477 Ack=477 Win=64256 Len=17 TSval=1047640380 TSecr=3171900080
1711549165.504164457   318 0.832518511    10.10.1.1 → 10.10.1.2    TCP 83 8081 → 36254 [PSH, ACK] Seq=477 Ack=494 Win=65152 Len=17 TSval=3171900091 TSecr=1047640380
1711549173.504164457   326 0.842734866    10.10.1.2 → 10.10.1.1    TCP 83 36254 → 8081 [PSH, ACK] Seq=494 Ack=494 Win=64256 Len=17 TSval=1047640390 TSecr=3171900091
1711549175.504164457   328 0.842866157    10.10.1.1 → 10.10.1.2    TCP 83 8081 → 36254 [PSH, ACK] Seq=494 Ack=511 Win=65152 Len=17 TSval=3171900101 TSecr=1047640390
1711549183.504164457   336 0.853084133    10.10.1.2 → 10.10.1.1    TCP 83 36254 → 8081 [PSH, ACK] Seq=511 Ack=511 Win=64256 Len=17 TSval=1047640400 TSecr=3171900101
1711549185.504164457   338 0.853215264    10.10.1.1 → 10.10.1.2    TCP 83 8081 → 36254 [PSH, ACK] Seq=511 Ack=528 Win=65152 Len=17 TSval=3171900111 TSecr=1047640400
1711549193.504164457   346 0.863432465    10.10.1.2 → 10.10.1.1    TCP 83 36254 → 8081 [PSH, ACK] Seq=528 Ack=528 Win=64256 Len=17 TSval=1047640411 TSecr=3171900111
1711549195.504164457   348 0.863563839    10.10.1.1 → 10.10.1.2    TCP 83 8081 → 36254 [PSH, ACK] Seq=528 Ack=545 Win=65152 Len=17 TSval=3171900122 TSecr=1047640411
1711549203.504164457   356 0.873778328    10.10.1.2 → 10.10.1.1    TCP 83 36254 → 8081 [PSH, ACK] Seq=545 Ack=545 Win=64256 Len=17 TSval=1047640421 TSecr=3171900122
1711549205.504164457   358 0.873908436    10.10.1.1 → 10.10.1.2    TCP 83 8081 → 36254 [PSH, ACK] Seq=545 Ack=562 Win=65152 Len=17 TSval=3171900132 TSecr=1047640421
1711549213.504164457   366 0.884124799    10.10.1.2 → 10.10.1.1    TCP 83 36254 → 8081 [PSH, ACK] Seq=562 Ack=562 Win=64256 Len=17 TSval=1047640431 TSecr=3171900132
1711549215.504164457   368 0.884255716    10.10.1.1 → 10.10.1.2    TCP 83 8081 → 36254 [PSH, ACK] Seq=562 Ack=579 Win=65152 Len=17 TSval=3171900142 TSecr=1047640431
1711549223.504164457   376 0.894477857    10.10.1.2 → 10.10.1.1    TCP 83 36254 → 8081 [PSH, ACK] Seq=579 Ack=579 Win=64256 Len=17 TSval=1047640442 TSecr=3171900142
1711549225.504164457   378 0.894609743    10.10.1.1 → 10.10.1.2    TCP 83 8081 → 36254 [PSH, ACK] Seq=579 Ack=596 Win=65152 Len=17 TSval=3171900153 TSecr=1047640442
1711549233.504164457   386 0.904827192    10.10.1.2 → 10.10.1.1    TCP 83 36254 → 8081 [PSH, ACK] Seq=596 Ack=596 Win=64256 Len=17 TSval=1047640452 TSecr=3171900153
1711549235.504164457   388 0.904957907    10.10.1.1 → 10.10.1.2    TCP 83 8081 → 36254 [PSH, ACK] Seq=596 Ack=613 Win=65152 Len=17 TSval=3171900163 TSecr=1047640452
1711549243.504164457   396 0.915175477    10.10.1.2 → 10.10.1.1    TCP 83 36254 → 8081 [PSH, ACK] Seq=613 Ack=613 Win=64256 Len=17 TSval=1047640462 TSecr=3171900163
1711549245.504164457   398 0.915306929    10.10.1.1 → 10.10.1.2    TCP 83 8081 → 36254 [PSH, ACK] Seq=613 Ack=630 Win=65152 Len=17 TSval=3171900173 TSecr=1047640462
1711549253.504164457   406 0.925522317    10.10.1.2 → 10.10.1.1    TCP 83 36254 → 8081 [PSH, ACK] Seq=630 Ack=630 Win=64256 Len=17 TSval=1047640473 TSecr=3171900173
1711549255.504164457   408 0.925653608    10.10.1.1 → 10.10.1.2    TCP 83 8081 → 36254 [PSH, ACK] Seq=630 Ack=647 Win=65152 Len=17 TSval=3171900184 TSecr=1047640473
1711549263.504164457   416 0.935870400    10.10.1.2 → 10.10.1.1    TCP 83 36254 → 8081 [PSH, ACK] Seq=647 Ack=647 Win=64256 Len=17 TSval=1047640483 TSecr=3171900184
1711549265.504164457   418 0.936001657    10.10.1.1 → 10.10.1.2    TCP 83 8081 → 36254 [PSH, ACK] Seq=647 Ack=664 Win=65152 Len=17 TSval=3171900194 TSecr=1047640483
1711549273.504164457   426 0.946219340    10.10.1.2 → 10.10.1.1    TCP 83 36254 → 8081 [PSH, ACK] Seq=664 Ack=664 Win=64256 Len=17 TSval=1047640493 TSecr=3171900194
1711549275.504164457   428 0.946351759    10.10.1.1 → 10.10.1.2    TCP 83 8081 → 36254 [PSH, ACK] Seq=664 Ack=681 Win=65152 Len=17 TSval=3171900204 TSecr=1047640493
1711549283.504164457   436 0.956569978    10.10.1.2 → 10.10.1.1    TCP 83 36254 → 8081 [PSH, ACK] Seq=681 Ack=681 Win=64256 Len=17 TSval=1047640504 TSecr=3171900204
1711549285.504164457   438 0.956701750    10.10.1.1 → 10.10.1.2    TCP 83 8081 → 36254 [PSH, ACK] Seq=681 Ack=698 Win=65152 Len=17 TSval=3171900215 TSecr=1047640504
1711549293.504164457   446 0.966917159    10.10.1.2 → 10.10.1.1    TCP 83 36254 → 8081 [PSH, ACK] Seq=698 Ack=698 Win=64256 Len=17 TSval=1047640514 TSecr=3171900215
1711549295.504164457   448 0.967047583    10.10.1.1 → 10.10.1.2    TCP 83 8081 → 36254 [PSH, ACK] Seq=698 Ack=715 Win=65152 Len=17 TSval=3171900225 TSecr=1047640514
1711549303.504164457   456 0.977262826    10.10.1.2 → 10.10.1.1    TCP 83 36254 → 8081 [PSH, ACK] Seq=715 Ack=715 Win=64256 Len=17 TSval=1047640524 TSecr=3171900225
1711549305.504164457   458 0.977393799    10.10.1.1 → 10.10.1.2    TCP 83 8081 → 36254 [PSH, ACK] Seq=715 Ack=732 Win=65152 Len=17 TSval=3171900236 TSecr=1047640524
1711549313.504164457   466 0.987609681    10.10.1.2 → 10.10.1.1    TCP 83 36254 → 8081 [PSH, ACK] Seq=732 Ack=732 Win=64256 Len=17 TSval=1047640535 TSecr=3171900236
1711549315.504164457   468 0.987741117    10.10.1.1 → 10.10.1.2    TCP 83 8081 → 36254 [PSH, ACK] Seq=732 Ack=749 Win=65152 Len=17 TSval=3171900246 TSecr=1047640535
1711549323.504164457   476 0.997959755    10.10.1.2 → 10.10.1.1    TCP 83 36254 → 8081 [PSH, ACK] Seq=749 Ack=749 Win=64256 Len=17 TSval=1047640545 TSecr=3171900246
1711549325.504164457   478 0.998092264    10.10.1.1 → 10.10.1.2    TCP 83 8081 → 36254 [PSH, ACK] Seq=749 Ack=766 Win=65152 Len=17 TSval=3171900256 TSecr=1047640545
1711549333.504164457   486 1.008310958    10.10.1.2 → 10.10.1.1    TCP 83 36254 → 8081 [PSH, ACK] Seq=766 Ack=766 Win=64256 Len=17 TSval=1047640555 TSecr=3171900256
1711549335.504164457   488 1.008442989    10.10.1.1 → 10.10.1.2    TCP 83 8081 → 36254 [PSH, ACK] Seq=766 Ack=783 Win=65152 Len=17 TSval=3171900267 TSecr=1047640555
1711549343.504164457   496 1.018661382    10.10.1.2 → 10.10.1.1    TCP 83 36254 → 8081 [PSH, ACK] Seq=783 Ack=783 Win=64256 Len=17 TSval=1047640566 TSecr=3171900267
1711549345.504164457   498 1.018792528    10.10.1.1 → 10.10.1.2    TCP 83 8081 → 36254 [PSH, ACK] Seq=783 Ack=800 Win=65152 Len=17 TSval=3171900277 TSecr=1047640566
1711549353.504164457   506 1.029007792    10.10.1.2 → 10.10.1.1    TCP 83 36254 → 8081 [PSH, ACK] Seq=800 Ack=800 Win=64256 Len=17 TSval=1047640576 TSecr=3171900277
1711549355.504164457   508 1.029138681    10.10.1.1 → 10.10.1.2    TCP 83 8081 → 36254 [PSH, ACK] Seq=800 Ack=817 Win=65152 Len=17 TSval=3171900287 TSecr=1047640576
1711549363.504164457   516 1.039354576    10.10.1.2 → 10.10.1.1    TCP 83 36254 → 8081 [PSH, ACK] Seq=817 Ack=817 Win=64256 Len=17 TSval=1047640586 TSecr=3171900287
1711549365.504164457   518 1.039485681    10.10.1.1 → 10.10.1.2    TCP 83 8081 → 36254 [PSH, ACK] Seq=817 Ack=834 Win=65152 Len=17 TSval=3171900298 TSecr=1047640586
1711549373.504164457   526 1.049705010    10.10.1.2 → 10.10.1.1    TCP 83 36254 → 8081 [PSH, ACK] Seq=834 Ack=834 Win=64256 Len=17 TSval=1047640597 TSecr=3171900298
1711549375.504164457   528 1.049836056    10.10.1.1 → 10.10.1.2    TCP 83 8081 → 36254 [PSH, ACK] Seq=834 Ack=851 Win=65152 Len=17 TSval=3171900308 TSecr=1047640597
1711549383.504164457   536 1.060055683    10.10.1.2 → 10.10.1.1    TCP 83 36254 → 8081 [PSH, ACK] Seq=851 Ack=851 Win=64256 Len=17 TSval=1047640607 TSecr=3171900308
1711549385.504164457   538 1.060186775    10.10.1.1 → 10.10.1.2    TCP 83 8081 → 36254 [PSH, ACK] Seq=851 Ack=868 Win=65152 Len=17 TSval=3171900318 TSecr=1047640607
1711549393.504164457   546 1.070372681    10.10.1.2 → 10.10.1.1    TCP 83 36254 → 8081 [PSH, ACK] Seq=868 Ack=868 Win=64256 Len=17 TSval=1047640617 TSecr=3171900318
1711549395.504164457   548 1.070504096    10.10.1.1 → 10.10.1.2    TCP 83 8081 → 36254 [PSH, ACK] Seq=868 Ack=885 Win=65152 Len=17 TSval=3171900329 TSecr=1047640617
1711549403.504164457   556 1.080722071    10.10.1.2 → 10.10.1.1    TCP 83 36254 → 8081 [PSH, ACK] Seq=885 Ack=885 Win=64256 Len=17 TSval=1047640628 TSecr=3171900329
1711549405.504164457   558 1.080853109    10.10.1.1 → 10.10.1.2    TCP 83 8081 → 36254 [PSH, ACK] Seq=885 Ack=902 Win=65152 Len=17 TSval=3171900339 TSecr=1047640628
1711549413.504164457   566 1.091068357    10.10.1.2 → 10.10.1.1    TCP 83 36254 → 8081 [PSH, ACK] Seq=902 Ack=902 Win=64256 Len=17 TSval=1047640638 TSecr=3171900339
1711549415.504164457   568 1.091197605    10.10.1.1 → 10.10.1.2    TCP 83 8081 → 36254 [PSH, ACK] Seq=902 Ack=919 Win=65152 Len=17 TSval=3171900349 TSecr=1047640638
1711549423.504164457   576 1.101412511    10.10.1.2 → 10.10.1.1    TCP 83 36254 → 8081 [PSH, ACK] Seq=919 Ack=919 Win=64256 Len=17 TSval=1047640649 TSecr=3171900349
1711549425.504164457   578 1.101544033    10.10.1.1 → 10.10.1.2    TCP 83 8081 → 36254 [PSH, ACK] Seq=919 Ack=936 Win=65152 Len=17 TSval=3171900360 TSecr=1047640649
1711549433.504164457   586 1.111759478    10.10.1.2 → 10.10.1.1    TCP 83 36254 → 8081 [PSH, ACK] Seq=936 Ack=936 Win=64256 Len=17 TSval=1047640659 TSecr=3171900360
1711549435.504164457   588 1.111888653    10.10.1.1 → 10.10.1.2    TCP 83 8081 → 36254 [PSH, ACK] Seq=936 Ack=953 Win=65152 Len=17 TSval=3171900370 TSecr=1047640659
1711549443.504164457   596 1.122104819    10.10.1.2 → 10.10.1.1    TCP 83 36254 → 8081 [PSH, ACK] Seq=953 Ack=953 Win=64256 Len=17 TSval=1047640669 TSecr=3171900370
1711549446.504164457   599 1.122291458    10.10.1.1 → 10.10.1.2    TCP 83 8081 → 36254 [PSH, ACK] Seq=953 Ack=970 Win=65152 Len=17 TSval=3171900380 TSecr=1047640669
1711549453.504164457   606 1.132506977    10.10.1.2 → 10.10.1.1    TCP 83 36254 → 8081 [PSH, ACK] Seq=970 Ack=970 Win=64256 Len=17 TSval=1047640680 TSecr=3171900380
1711549455.504164457   608 1.132637468    10.10.1.1 → 10.10.1.2    TCP 83 8081 → 36254 [PSH, ACK] Seq=970 Ack=987 Win=65152 Len=17 TSval=3171900391 TSecr=1047640680
1711549463.504164457   616 1.142852599    10.10.1.2 → 10.10.1.1    TCP 83 36254 → 8081 [PSH, ACK] Seq=987 Ack=987 Win=64256 Len=17 TSval=1047640690 TSecr=3171900391
1711549465.504164457   618 1.142983615    10.10.1.1 → 10.10.1.2    TCP 83 8081 → 36254 [PSH, ACK] Seq=987 Ack=1004 Win=65152 Len=17 TSval=3171900401 TSecr=1047640690
1711549473.504164457   626 1.153198391    10.10.1.2 → 10.10.1.1    TCP 83 36254 → 8081 [PSH, ACK] Seq=1004 Ack=1004 Win=64256 Len=17 TSval=1047640700 TSecr=3171900401
1711549475.504164457   628 1.153329842    10.10.1.1 → 10.10.1.2    TCP 83 8081 → 36254 [PSH, ACK] Seq=1004 Ack=1021 Win=65152 Len=17 TSval=3171900411 TSecr=1047640700
1711549483.504164457   636 1.163544844    10.10.1.2 → 10.10.1.1    TCP 83 36254 → 8081 [PSH, ACK] Seq=1021 Ack=1021 Win=64256 Len=17 TSval=1047640711 TSecr=3171900411
1711549485.504164457   638 1.163676079    10.10.1.1 → 10.10.1.2    TCP 83 8081 → 36254 [PSH, ACK] Seq=1021 Ack=1038 Win=65152 Len=17 TSval=3171900422 TSecr=1047640711
1711549493.504164457   646 1.173892396    10.10.1.2 → 10.10.1.1    TCP 83 36254 → 8081 [PSH, ACK] Seq=1038 Ack=1038 Win=64256 Len=17 TSval=1047640721 TSecr=3171900422
1711549495.504164457   648 1.174022723    10.10.1.1 → 10.10.1.2    TCP 83 8081 → 36254 [PSH, ACK] Seq=1038 Ack=1055 Win=65152 Len=17 TSval=3171900432 TSecr=1047640721
1711549503.504164457   656 1.184237808    10.10.1.2 → 10.10.1.1    TCP 83 36254 → 8081 [PSH, ACK] Seq=1055 Ack=1055 Win=64256 Len=17 TSval=1047640731 TSecr=3171900432
1711549505.504164457   658 1.184367939    10.10.1.1 → 10.10.1.2    TCP 83 8081 → 36254 [PSH, ACK] Seq=1055 Ack=1072 Win=65152 Len=17 TSval=3171900443 TSecr=1047640731
1711549513.504164457   666 1.194583934    10.10.1.2 → 10.10.1.1    TCP 83 36254 → 8081 [PSH, ACK] Seq=1072 Ack=1072 Win=64256 Len=17 TSval=1047640742 TSecr=3171900443
1711549515.504164457   668 1.194714396    10.10.1.1 → 10.10.1.2    TCP 83 8081 → 36254 [PSH, ACK] Seq=1072 Ack=1089 Win=65152 Len=17 TSval=3171900453 TSecr=1047640742
1711549523.504164457   676 1.204930667    10.10.1.2 → 10.10.1.1    TCP 83 36254 → 8081 [PSH, ACK] Seq=1089 Ack=1089 Win=64256 Len=17 TSval=1047640752 TSecr=3171900453
1711549525.504164457   678 1.205058923    10.10.1.1 → 10.10.1.2    TCP 83 8081 → 36254 [PSH, ACK] Seq=1089 Ack=1106 Win=65152 Len=17 TSval=3171900463 TSecr=1047640752
1711549533.504164457   686 1.215274148    10.10.1.2 → 10.10.1.1    TCP 83 36254 → 8081 [PSH, ACK] Seq=1106 Ack=1106 Win=64256 Len=17 TSval=1047640762 TSecr=3171900463
1711549535.504164457   688 1.215423007    10.10.1.1 → 10.10.1.2    TCP 83 8081 → 36254 [PSH, ACK] Seq=1106 Ack=1123 Win=65152 Len=17 TSval=3171900474 TSecr=1047640762
1711549543.504164457   696 1.225642921    10.10.1.2 → 10.10.1.1    TCP 83 36254 → 8081 [PSH, ACK] Seq=1123 Ack=1123 Win=64256 Len=17 TSval=1047640773 TSecr=3171900474
1711549545.504164457   698 1.225774218    10.10.1.1 → 10.10.1.2    TCP 83 8081 → 36254 [PSH, ACK] Seq=1123 Ack=1140 Win=65152 Len=17 TSval=3171900484 TSecr=1047640773
1711549553.504164457   706 1.235989212    10.10.1.2 → 10.10.1.1    TCP 83 36254 → 8081 [PSH, ACK] Seq=1140 Ack=1140 Win=64256 Len=17 TSval=1047640783 TSecr=3171900484
1711549555.504164457   708 1.236119897    10.10.1.1 → 10.10.1.2    TCP 83 8081 → 36254 [PSH, ACK] Seq=1140 Ack=1157 Win=65152 Len=17 TSval=3171900494 TSecr=1047640783
1711549563.504164457   716 1.246336299    10.10.1.2 → 10.10.1.1    TCP 83 36254 → 8081 [PSH, ACK] Seq=1157 Ack=1157 Win=64256 Len=17 TSval=1047640793 TSecr=3171900494
1711549565.504164457   718 1.246466532    10.10.1.1 → 10.10.1.2    TCP 83 8081 → 36254 [PSH, ACK] Seq=1157 Ack=1174 Win=65152 Len=17 TSval=3171900505 TSecr=1047640793
1711549574.504164457   727 1.256681927    10.10.1.2 → 10.10.1.1    TCP 83 36254 → 8081 [PSH, ACK] Seq=1174 Ack=1174 Win=64256 Len=17 TSval=1047640804 TSecr=3171900505
1711549576.504164457   729 1.256812748    10.10.1.1 → 10.10.1.2    TCP 83 8081 → 36254 [PSH, ACK] Seq=1174 Ack=1191 Win=65152 Len=17 TSval=3171900515 TSecr=1047640804
1711549584.504164457   737 1.267028189    10.10.1.2 → 10.10.1.1    TCP 83 36254 → 8081 [PSH, ACK] Seq=1191 Ack=1191 Win=64256 Len=17 TSval=1047640814 TSecr=3171900515
1711549586.504164457   739 1.267158836    10.10.1.1 → 10.10.1.2    TCP 83 8081 → 36254 [PSH, ACK] Seq=1191 Ack=1208 Win=65152 Len=17 TSval=3171900525 TSecr=1047640814
1711549594.504164457   747 1.277374620    10.10.1.2 → 10.10.1.1    TCP 83 36254 → 8081 [PSH, ACK] Seq=1208 Ack=1208 Win=64256 Len=17 TSval=1047640824 TSecr=3171900525
1711549596.504164457   749 1.277506562    10.10.1.1 → 10.10.1.2    TCP 83 8081 → 36254 [PSH, ACK] Seq=1208 Ack=1225 Win=65152 Len=17 TSval=3171900536 TSecr=1047640824
1711549604.504164457   757 1.287726378    10.10.1.2 → 10.10.1.1    TCP 83 36254 → 8081 [PSH, ACK] Seq=1225 Ack=1225 Win=64256 Len=17 TSval=1047640835 TSecr=3171900536
1711549606.504164457   759 1.287857063    10.10.1.1 → 10.10.1.2    TCP 83 8081 → 36254 [PSH, ACK] Seq=1225 Ack=1242 Win=65152 Len=17 TSval=3171900546 TSecr=1047640835
1711549614.504164457   767 1.298072120    10.10.1.2 → 10.10.1.1    TCP 83 36254 → 8081 [PSH, ACK] Seq=1242 Ack=1242 Win=64256 Len=17 TSval=1047640845 TSecr=3171900546
1711549616.504164457   769 1.298202280    10.10.1.1 → 10.10.1.2    TCP 83 8081 → 36254 [PSH, ACK] Seq=1242 Ack=1259 Win=65152 Len=17 TSval=3171900556 TSecr=1047640845
1711549624.504164457   777 1.308417234    10.10.1.2 → 10.10.1.1    TCP 83 36254 → 8081 [PSH, ACK] Seq=1259 Ack=1259 Win=64256 Len=17 TSval=1047640856 TSecr=3171900556
1711549626.504164457   779 1.308548449    10.10.1.1 → 10.10.1.2    TCP 83 8081 → 36254 [PSH, ACK] Seq=1259 Ack=1276 Win=65152 Len=17 TSval=3171900567 TSecr=1047640856
1711549634.504164457   787 1.318763824    10.10.1.2 → 10.10.1.1    TCP 83 36254 → 8081 [PSH, ACK] Seq=1276 Ack=1276 Win=64256 Len=17 TSval=1047640866 TSecr=3171900567
1711549636.504164457   789 1.318893896    10.10.1.1 → 10.10.1.2    TCP 83 8081 → 36254 [PSH, ACK] Seq=1276 Ack=1293 Win=65152 Len=17 TSval=3171900577 TSecr=1047640866
1711549644.504164457   797 1.329109871    10.10.1.2 → 10.10.1.1    TCP 83 36254 → 8081 [PSH, ACK] Seq=1293 Ack=1293 Win=64256 Len=17 TSval=1047640876 TSecr=3171900577
1711549646.504164457   799 1.329239766    10.10.1.1 → 10.10.1.2    TCP 83 8081 → 36254 [PSH, ACK] Seq=1293 Ack=1310 Win=65152 Len=17 TSval=3171900587 TSecr=1047640876
1711549655.504164457   808 1.339454812    10.10.1.2 → 10.10.1.1    TCP 83 36254 → 8081 [PSH, ACK] Seq=1310 Ack=1310 Win=64256 Len=17 TSval=1047640887 TSecr=3171900587
1711549657.504164457   810 1.339584607    10.10.1.1 → 10.10.1.2    TCP 83 8081 → 36254 [PSH, ACK] Seq=1310 Ack=1327 Win=65152 Len=17 TSval=3171900598 TSecr=1047640887
1711549664.504164457   817 1.349801423    10.10.1.2 → 10.10.1.1    TCP 83 36254 → 8081 [PSH, ACK] Seq=1327 Ack=1327 Win=64256 Len=17 TSval=1047640897 TSecr=3171900598
1711549666.504164457   819 1.349932794    10.10.1.1 → 10.10.1.2    TCP 83 8081 → 36254 [PSH, ACK] Seq=1327 Ack=1344 Win=65152 Len=17 TSval=3171900608 TSecr=1047640897
1711549674.504164457   827 1.360148670    10.10.1.2 → 10.10.1.1    TCP 83 36254 → 8081 [PSH, ACK] Seq=1344 Ack=1344 Win=64256 Len=17 TSval=1047640907 TSecr=3171900608
1711549676.504164457   829 1.360279882    10.10.1.1 → 10.10.1.2    TCP 83 8081 → 36254 [PSH, ACK] Seq=1344 Ack=1361 Win=65152 Len=17 TSval=3171900618 TSecr=1047640907
1711549684.504164457   837 1.370494131    10.10.1.2 → 10.10.1.1    TCP 83 36254 → 8081 [PSH, ACK] Seq=1361 Ack=1361 Win=64256 Len=17 TSval=1047640918 TSecr=3171900618
1711549686.504164457   839 1.370625053    10.10.1.1 → 10.10.1.2    TCP 83 8081 → 36254 [PSH, ACK] Seq=1361 Ack=1378 Win=65152 Len=17 TSval=3171900629 TSecr=1047640918
1711549694.504164457   847 1.380840215    10.10.1.2 → 10.10.1.1    TCP 83 36254 → 8081 [PSH, ACK] Seq=1378 Ack=1378 Win=64256 Len=17 TSval=1047640928 TSecr=3171900629
1711549696.504164457   849 1.380970907    10.10.1.1 → 10.10.1.2    TCP 83 8081 → 36254 [PSH, ACK] Seq=1378 Ack=1395 Win=65152 Len=17 TSval=3171900639 TSecr=1047640928
1711549704.504164457   857 1.391186663    10.10.1.2 → 10.10.1.1    TCP 83 36254 → 8081 [PSH, ACK] Seq=1395 Ack=1395 Win=64256 Len=17 TSval=1047640938 TSecr=3171900639
1711549706.504164457   859 1.391317968    10.10.1.1 → 10.10.1.2    TCP 83 8081 → 36254 [PSH, ACK] Seq=1395 Ack=1412 Win=65152 Len=17 TSval=3171900649 TSecr=1047640938
1711549714.504164457   867 1.401535469    10.10.1.2 → 10.10.1.1    TCP 83 36254 → 8081 [PSH, ACK] Seq=1412 Ack=1412 Win=64256 Len=17 TSval=1047640949 TSecr=3171900649
1711549716.504164457   869 1.401666516    10.10.1.1 → 10.10.1.2    TCP 83 8081 → 36254 [PSH, ACK] Seq=1412 Ack=1429 Win=65152 Len=17 TSval=3171900660 TSecr=1047640949
1711549724.504164457   877 1.411884190    10.10.1.2 → 10.10.1.1    TCP 83 36254 → 8081 [PSH, ACK] Seq=1429 Ack=1429 Win=64256 Len=17 TSval=1047640959 TSecr=3171900660
1711549726.504164457   879 1.412015332    10.10.1.1 → 10.10.1.2    TCP 83 8081 → 36254 [PSH, ACK] Seq=1429 Ack=1446 Win=65152 Len=17 TSval=3171900670 TSecr=1047640959
1711549734.504164457   887 1.422233198    10.10.1.2 → 10.10.1.1    TCP 83 36254 → 8081 [PSH, ACK] Seq=1446 Ack=1446 Win=64256 Len=17 TSval=1047640969 TSecr=3171900670
1711549736.504164457   889 1.422363819    10.10.1.1 → 10.10.1.2    TCP 83 8081 → 36254 [PSH, ACK] Seq=1446 Ack=1463 Win=65152 Len=17 TSval=3171900681 TSecr=1047640969
1711549744.504164457   897 1.432580274    10.10.1.2 → 10.10.1.1    TCP 83 36254 → 8081 [PSH, ACK] Seq=1463 Ack=1463 Win=64256 Len=17 TSval=1047640980 TSecr=3171900681
1711549746.504164457   899 1.432712837    10.10.1.1 → 10.10.1.2    TCP 83 8081 → 36254 [PSH, ACK] Seq=1463 Ack=1480 Win=65152 Len=17 TSval=3171900691 TSecr=1047640980
1711549754.504164457   907 1.442928615    10.10.1.2 → 10.10.1.1    TCP 83 36254 → 8081 [PSH, ACK] Seq=1480 Ack=1480 Win=64256 Len=17 TSval=1047640990 TSecr=3171900691
1711549756.504164457   909 1.443059253    10.10.1.1 → 10.10.1.2    TCP 83 8081 → 36254 [PSH, ACK] Seq=1480 Ack=1497 Win=65152 Len=17 TSval=3171900701 TSecr=1047640990
1711549764.504164457   917 1.453277329    10.10.1.2 → 10.10.1.1    TCP 83 36254 → 8081 [PSH, ACK] Seq=1497 Ack=1497 Win=64256 Len=17 TSval=1047641000 TSecr=3171900701
1711549766.504164457   919 1.453408460    10.10.1.1 → 10.10.1.2    TCP 83 8081 → 36254 [PSH, ACK] Seq=1497 Ack=1514 Win=65152 Len=17 TSval=3171900712 TSecr=1047641000
1711549774.504164457   927 1.463626596    10.10.1.2 → 10.10.1.1    TCP 83 36254 → 8081 [PSH, ACK] Seq=1514 Ack=1514 Win=64256 Len=17 TSval=1047641011 TSecr=3171900712
1711549776.504164457   929 1.463758063    10.10.1.1 → 10.10.1.2    TCP 83 8081 → 36254 [PSH, ACK] Seq=1514 Ack=1531 Win=65152 Len=17 TSval=3171900722 TSecr=1047641011
1711549784.504164457   937 1.473975195    10.10.1.2 → 10.10.1.1    TCP 83 36254 → 8081 [PSH, ACK] Seq=1531 Ack=1531 Win=64256 Len=17 TSval=1047641021 TSecr=3171900722
1711549786.504164457   939 1.474106464    10.10.1.1 → 10.10.1.2    TCP 83 8081 → 36254 [PSH, ACK] Seq=1531 Ack=1548 Win=65152 Len=17 TSval=3171900732 TSecr=1047641021
1711549794.504164457   947 1.484322433    10.10.1.2 → 10.10.1.1    TCP 83 36254 → 8081 [PSH, ACK] Seq=1548 Ack=1548 Win=64256 Len=17 TSval=1047641031 TSecr=3171900732
1711549796.504164457   949 1.484455067    10.10.1.1 → 10.10.1.2    TCP 83 8081 → 36254 [PSH, ACK] Seq=1548 Ack=1565 Win=65152 Len=17 TSval=3171900743 TSecr=1047641031
1711549804.504164457   957 1.494688769    10.10.1.2 → 10.10.1.1    TCP 83 36254 → 8081 [PSH, ACK] Seq=1565 Ack=1565 Win=64256 Len=17 TSval=1047641042 TSecr=3171900743
1711549806.504164457   959 1.494818691    10.10.1.1 → 10.10.1.2    TCP 83 8081 → 36254 [PSH, ACK] Seq=1565 Ack=1582 Win=65152 Len=17 TSval=3171900753 TSecr=1047641042
1711549814.504164457   967 1.505036127    10.10.1.2 → 10.10.1.1    TCP 83 36254 → 8081 [PSH, ACK] Seq=1582 Ack=1582 Win=64256 Len=17 TSval=1047641052 TSecr=3171900753
1711549816.504164457   969 1.505167311    10.10.1.1 → 10.10.1.2    TCP 83 8081 → 36254 [PSH, ACK] Seq=1582 Ack=1599 Win=65152 Len=17 TSval=3171900763 TSecr=1047641052
1711549824.504164457   977 1.515384054    10.10.1.2 → 10.10.1.1    TCP 83 36254 → 8081 [PSH, ACK] Seq=1599 Ack=1599 Win=64256 Len=17 TSval=1047641062 TSecr=3171900763
1711549826.504164457   979 1.515517498    10.10.1.1 → 10.10.1.2    TCP 83 8081 → 36254 [PSH, ACK] Seq=1599 Ack=1616 Win=65152 Len=17 TSval=3171900774 TSecr=1047641062
1711549834.504164457   987 1.525732431    10.10.1.2 → 10.10.1.1    TCP 83 36254 → 8081 [PSH, ACK] Seq=1616 Ack=1616 Win=64256 Len=17 TSval=1047641073 TSecr=3171900774
1711549836.504164457   989 1.525864012    10.10.1.1 → 10.10.1.2    TCP 83 8081 → 36254 [PSH, ACK] Seq=1616 Ack=1633 Win=65152 Len=17 TSval=3171900784 TSecr=1047641073
1711549844.504164457   997 1.536079521    10.10.1.2 → 10.10.1.1    TCP 83 36254 → 8081 [PSH, ACK] Seq=1633 Ack=1633 Win=64256 Len=17 TSval=1047641083 TSecr=3171900784
1711549846.504164457   999 1.536210470    10.10.1.1 → 10.10.1.2    TCP 83 8081 → 36254 [PSH, ACK] Seq=1633 Ack=1650 Win=65152 Len=17 TSval=3171900794 TSecr=1047641083
1711549854.504164457  1007 1.546427241    10.10.1.2 → 10.10.1.1    TCP 83 36254 → 8081 [PSH, ACK] Seq=1650 Ack=1650 Win=64256 Len=17 TSval=1047641094 TSecr=3171900794
1711549856.504164457  1009 1.546558012    10.10.1.1 → 10.10.1.2    TCP 83 8081 → 36254 [PSH, ACK] Seq=1650 Ack=1667 Win=65152 Len=17 TSval=3171900805 TSecr=1047641094
1711549864.504164457  1017 1.556777131    10.10.1.2 → 10.10.1.1    TCP 83 36254 → 8081 [PSH, ACK] Seq=1667 Ack=1667 Win=64256 Len=17 TSval=1047641104 TSecr=3171900805
1711549866.504164457  1019 1.556908173    10.10.1.1 → 10.10.1.2    TCP 83 8081 → 36254 [PSH, ACK] Seq=1667 Ack=1684 Win=65152 Len=17 TSval=3171900815 TSecr=1047641104
1711549874.504164457  1027 1.567125474    10.10.1.2 → 10.10.1.1    TCP 83 36254 → 8081 [PSH, ACK] Seq=1684 Ack=1684 Win=64256 Len=17 TSval=1047641114 TSecr=3171900815
1711549876.504164457  1029 1.567255426    10.10.1.1 → 10.10.1.2    TCP 83 8081 → 36254 [PSH, ACK] Seq=1684 Ack=1701 Win=65152 Len=17 TSval=3171900825 TSecr=1047641114
1711549884.504164457  1037 1.577469527    10.10.1.2 → 10.10.1.1    TCP 83 36254 → 8081 [PSH, ACK] Seq=1701 Ack=1701 Win=64256 Len=17 TSval=1047641125 TSecr=3171900825
1711549886.504164457  1039 1.577600977    10.10.1.1 → 10.10.1.2    TCP 83 8081 → 36254 [PSH, ACK] Seq=1701 Ack=1718 Win=65152 Len=17 TSval=3171900836 TSecr=1047641125
1711549894.504164457  1047 1.587818017    10.10.1.2 → 10.10.1.1    TCP 83 36254 → 8081 [PSH, ACK] Seq=1718 Ack=1718 Win=64256 Len=17 TSval=1047641135 TSecr=3171900836
1711549896.504164457  1049 1.587948400    10.10.1.1 → 10.10.1.2    TCP 83 8081 → 36254 [PSH, ACK] Seq=1718 Ack=1735 Win=65152 Len=17 TSval=3171900846 TSecr=1047641135
1711549904.504164457  1057 1.598162746    10.10.1.2 → 10.10.1.1    TCP 83 36254 → 8081 [PSH, ACK] Seq=1735 Ack=1735 Win=64256 Len=17 TSval=1047641145 TSecr=3171900846
1711549906.504164457  1059 1.598293471    10.10.1.1 → 10.10.1.2    TCP 83 8081 → 36254 [PSH, ACK] Seq=1735 Ack=1752 Win=65152 Len=17 TSval=3171900856 TSecr=1047641145
1711549914.504164457  1067 1.608509128    10.10.1.2 → 10.10.1.1    TCP 83 36254 → 8081 [PSH, ACK] Seq=1752 Ack=1752 Win=64256 Len=17 TSval=1047641156 TSecr=3171900856
1711549916.504164457  1069 1.608641528    10.10.1.1 → 10.10.1.2    TCP 83 8081 → 36254 [PSH, ACK] Seq=1752 Ack=1769 Win=65152 Len=17 TSval=3171900867 TSecr=1047641156
1711549924.504164457  1077 1.618861149    10.10.1.2 → 10.10.1.1    TCP 83 36254 → 8081 [PSH, ACK] Seq=1769 Ack=1769 Win=64256 Len=17 TSval=1047641166 TSecr=3171900867
1711549926.504164457  1079 1.618992058    10.10.1.1 → 10.10.1.2    TCP 83 8081 → 36254 [PSH, ACK] Seq=1769 Ack=1786 Win=65152 Len=17 TSval=3171900877 TSecr=1047641166
1711549934.504164457  1087 1.629210016    10.10.1.2 → 10.10.1.1    TCP 83 36254 → 8081 [PSH, ACK] Seq=1786 Ack=1786 Win=64256 Len=17 TSval=1047641176 TSecr=3171900877
1711549936.504164457  1089 1.629340877    10.10.1.1 → 10.10.1.2    TCP 83 8081 → 36254 [PSH, ACK] Seq=1786 Ack=1803 Win=65152 Len=17 TSval=3171900887 TSecr=1047641176
1711549944.504164457  1097 1.639558034    10.10.1.2 → 10.10.1.1    TCP 83 36254 → 8081 [PSH, ACK] Seq=1803 Ack=1803 Win=64256 Len=17 TSval=1047641187 TSecr=3171900887
1711549946.504164457  1099 1.639689108    10.10.1.1 → 10.10.1.2    TCP 83 8081 → 36254 [PSH, ACK] Seq=1803 Ack=1820 Win=65152 Len=17 TSval=3171900898 TSecr=1047641187
1711549954.504164457  1107 1.649905115    10.10.1.2 → 10.10.1.1    TCP 83 36254 → 8081 [PSH, ACK] Seq=1820 Ack=1820 Win=64256 Len=17 TSval=1047641197 TSecr=3171900898
1711549956.504164457  1109 1.650035045    10.10.1.1 → 10.10.1.2    TCP 83 8081 → 36254 [PSH, ACK] Seq=1820 Ack=1837 Win=65152 Len=17 TSval=3171900908 TSecr=1047641197
1711549964.504164457  1117 1.660252867    10.10.1.2 → 10.10.1.1    TCP 83 36254 → 8081 [PSH, ACK] Seq=1837 Ack=1837 Win=64256 Len=17 TSval=1047641207 TSecr=3171900908
1711549966.504164457  1119 1.660384398    10.10.1.1 → 10.10.1.2    TCP 83 8081 → 36254 [PSH, ACK] Seq=1837 Ack=1854 Win=65152 Len=17 TSval=3171900919 TSecr=1047641207
1711549974.504164457  1127 1.670603483    10.10.1.2 → 10.10.1.1    TCP 83 36254 → 8081 [PSH, ACK] Seq=1854 Ack=1854 Win=64256 Len=17 TSval=1047641218 TSecr=3171900919
1711549976.504164457  1129 1.670734508    10.10.1.1 → 10.10.1.2    TCP 83 8081 → 36254 [PSH, ACK] Seq=1854 Ack=1871 Win=65152 Len=17 TSval=3171900929 TSecr=1047641218
1711549984.504164457  1137 1.680951905    10.10.1.2 → 10.10.1.1    TCP 83 36254 → 8081 [PSH, ACK] Seq=1871 Ack=1871 Win=64256 Len=17 TSval=1047641228 TSecr=3171900929
1711549986.504164457  1139 1.681083376    10.10.1.1 → 10.10.1.2    TCP 83 8081 → 36254 [PSH, ACK] Seq=1871 Ack=1888 Win=65152 Len=17 TSval=3171900939 TSecr=1047641228
1711549994.504164457  1147 1.691301165    10.10.1.2 → 10.10.1.1    TCP 83 36254 → 8081 [PSH, ACK] Seq=1888 Ack=1888 Win=64256 Len=17 TSval=1047641238 TSecr=3171900939
1711549996.504164457  1149 1.691433383    10.10.1.1 → 10.10.1.2    TCP 83 8081 → 36254 [PSH, ACK] Seq=1888 Ack=1905 Win=65152 Len=17 TSval=3171900950 TSecr=1047641238
1711550004.504164457  1157 1.701651778    10.10.1.2 → 10.10.1.1    TCP 83 36254 → 8081 [PSH, ACK] Seq=1905 Ack=1905 Win=64256 Len=17 TSval=1047641249 TSecr=3171900950
1711550006.504164457  1159 1.701780800    10.10.1.1 → 10.10.1.2    TCP 83 8081 → 36254 [PSH, ACK] Seq=1905 Ack=1922 Win=65152 Len=17 TSval=3171900960 TSecr=1047641249
1711550014.504164457  1167 1.712001922    10.10.1.2 → 10.10.1.1    TCP 83 36254 → 8081 [PSH, ACK] Seq=1922 Ack=1922 Win=64256 Len=17 TSval=1047641259 TSecr=3171900960
1711550017.504164457  1170 1.712183994    10.10.1.1 → 10.10.1.2    TCP 83 8081 → 36254 [PSH, ACK] Seq=1922 Ack=1939 Win=65152 Len=17 TSval=3171900970 TSecr=1047641259
1711550024.504164457  1177 1.722374833    10.10.1.2 → 10.10.1.1    TCP 83 36254 → 8081 [PSH, ACK] Seq=1939 Ack=1939 Win=64256 Len=17 TSval=1047641269 TSecr=3171900970
1711550026.504164457  1179 1.722507211    10.10.1.1 → 10.10.1.2    TCP 83 8081 → 36254 [PSH, ACK] Seq=1939 Ack=1956 Win=65152 Len=17 TSval=3171900981 TSecr=1047641269
1711550034.504164457  1187 1.732722017    10.10.1.2 → 10.10.1.1    TCP 83 36254 → 8081 [PSH, ACK] Seq=1956 Ack=1956 Win=64256 Len=17 TSval=1047641280 TSecr=3171900981
1711550036.504164457  1189 1.732852699    10.10.1.1 → 10.10.1.2    TCP 83 8081 → 36254 [PSH, ACK] Seq=1956 Ack=1973 Win=65152 Len=17 TSval=3171900991 TSecr=1047641280
1711550044.504164457  1197 1.743069296    10.10.1.2 → 10.10.1.1    TCP 83 36254 → 8081 [PSH, ACK] Seq=1973 Ack=1973 Win=64256 Len=17 TSval=1047641290 TSecr=3171900991
1711550046.504164457  1199 1.743200334    10.10.1.1 → 10.10.1.2    TCP 83 8081 → 36254 [PSH, ACK] Seq=1973 Ack=1990 Win=65152 Len=17 TSval=3171901001 TSecr=1047641290
1711550054.504164457  1207 1.753418075    10.10.1.2 → 10.10.1.1    TCP 83 36254 → 8081 [PSH, ACK] Seq=1990 Ack=1990 Win=64256 Len=17 TSval=1047641301 TSecr=3171901001
1711550056.504164457  1209 1.753547661    10.10.1.1 → 10.10.1.2    TCP 83 8081 → 36254 [PSH, ACK] Seq=1990 Ack=2007 Win=65152 Len=17 TSval=3171901012 TSecr=1047641301
1711550064.504164457  1217 1.763765927    10.10.1.2 → 10.10.1.1    TCP 83 36254 → 8081 [PSH, ACK] Seq=2007 Ack=2007 Win=64256 Len=17 TSval=1047641311 TSecr=3171901012
1711550066.504164457  1219 1.763896312    10.10.1.1 → 10.10.1.2    TCP 83 8081 → 36254 [PSH, ACK] Seq=2007 Ack=2024 Win=65152 Len=17 TSval=3171901022 TSecr=1047641311
1711550074.504164457  1227 1.774113462    10.10.1.2 → 10.10.1.1    TCP 83 36254 → 8081 [PSH, ACK] Seq=2024 Ack=2024 Win=64256 Len=17 TSval=1047641321 TSecr=3171901022
1711550076.504164457  1229 1.774243199    10.10.1.1 → 10.10.1.2    TCP 83 8081 → 36254 [PSH, ACK] Seq=2024 Ack=2041 Win=65152 Len=17 TSval=3171901032 TSecr=1047641321
1711550084.504164457  1237 1.784418088    10.10.1.2 → 10.10.1.1    TCP 83 36254 → 8081 [PSH, ACK] Seq=2041 Ack=2041 Win=64256 Len=17 TSval=1047641332 TSecr=3171901032
