1711548971.191550493    22 0.262072432    10.10.1.2 → 10.10.1.1    TCP 74 53410 → 8081 [SYN] Seq=0 Win=64240 Len=0 MSS=1460 SACK_PERM=1 TSval=1047741487 TSecr=0 WS=128
1711548972.191550493    23 0.262108554    10.10.1.1 → 10.10.1.2    TCP 74 8081 → 53410 [SYN, ACK] Seq=0 Ack=1 Win=65160 Len=0 MSS=1460 SACK_PERM=1 TSval=3172001198 TSecr=1047741487 WS=128
1711548973.191550493    24 0.262144593    10.10.1.2 → 10.10.1.1    TCP 66 53410 → 8081 [ACK] Seq=1 Ack=1 Win=64256 Len=0 TSval=1047741487 TSecr=3172001198
1711548977.191550493    28 0.521265134    10.10.1.2 → 10.10.1.1    TCP 83 53410 → 8081 [PSH, ACK] Seq=1 Ack=1 Win=64256 Len=17 TSval=1047741746 TSecr=3172001198
1711548979.191550493    30 0.521292414    10.10.1.1 → 10.10.1.2    TCP 66 8081 → 53410 [ACK] Seq=1 Ack=18 Win=65152 Len=0 TSval=3172001458 TSecr=1047741746
1711548981.191550493    32 0.521577735    10.10.1.1 → 10.10.1.2    TCP 83 8081 → 53410 [PSH, ACK] Seq=1 Ack=18 Win=65152 Len=17 TSval=3172001458 TSecr=1047741746
1711548982.191550493    33 0.521610640    10.10.1.2 → 10.10.1.1    TCP 66 53410 → 8081 [ACK] Seq=18 Ack=18 Win=64256 Len=0 TSval=1047741747 TSecr=3172001458
1711548987.191550493    38 0.531796964    10.10.1.2 → 10.10.1.1    TCP 83 53410 → 8081 [PSH, ACK] Seq=18 Ack=18 Win=64256 Len=17 TSval=1047741757 TSecr=3172001458
1711548990.191550493    41 0.531921879    10.10.1.1 → 10.10.1.2    TCP 83 8081 → 53410 [PSH, ACK] Seq=18 Ack=35 Win=65152 Len=17 TSval=3172001468 TSecr=1047741757
1711548995.191550493    46 0.542135352    10.10.1.2 → 10.10.1.1    TCP 83 53410 → 8081 [PSH, ACK] Seq=35 Ack=35 Win=64256 Len=17 TSval=1047741767 TSecr=3172001468
1711548998.191550493    49 0.542267266    10.10.1.1 → 10.10.1.2    TCP 83 8081 → 53410 [PSH, ACK] Seq=35 Ack=52 Win=65152 Len=17 TSval=3172001479 TSecr=1047741767
1711549003.191550493    54 0.552484151    10.10.1.2 → 10.10.1.1    TCP 83 53410 → 8081 [PSH, ACK] Seq=52 Ack=52 Win=64256 Len=17 TSval=1047741778 TSecr=3172001479
1711549006.191550493    57 0.552614077    10.10.1.1 → 10.10.1.2    TCP 83 8081 → 53410 [PSH, ACK] Seq=52 Ack=69 Win=65152 Len=17 TSval=3172001489 TSecr=1047741778
1711549011.191550493    62 0.562828903    10.10.1.2 → 10.10.1.1    TCP 83 53410 → 8081 [PSH, ACK] Seq=69 Ack=69 Win=64256 Len=17 TSval=1047741788 TSecr=3172001489
1711549014.191550493    65 0.562959324    10.10.1.1 → 10.10.1.2    TCP 83 8081 → 53410 [PSH, ACK] Seq=69 Ack=86 Win=65152 Len=17 TSval=3172001499 TSecr=1047741788
1711549019.191550493    70 0.573171392    10.10.1.2 → 10.10.1.1    TCP 83 53410 → 8081 [PSH, ACK] Seq=86 Ack=86 Win=64256 Len=17 TSval=1047741798 TSecr=3172001499
1711549022.191550493    73 0.573342480    10.10.1.1 → 10.10.1.2    TCP 83 8081 → 53410 [PSH, ACK] Seq=86 Ack=103 Win=65152 Len=17 TSval=3172001510 TSecr=1047741798
1711549027.191550493    78 0.583556183    10.10.1.2 → 10.10.1.1    TCP 83 53410 → 8081 [PSH, ACK] Seq=103 Ack=103 Win=64256 Len=17 TSval=1047741809 TSecr=3172001510
1711549029.191550493    80 0.583686119    10.10.1.1 → 10.10.1.2    TCP 83 8081 → 53410 [PSH, ACK] Seq=103 Ack=120 Win=65152 Len=17 TSval=3172001520 TSecr=1047741809
1711549035.191550493    86 0.593897153    10.10.1.2 → 10.10.1.1    TCP 83 53410 → 8081 [PSH, ACK] Seq=120 Ack=120 Win=64256 Len=17 TSval=1047741819 TSecr=3172001520
1711549037.191550493    88 0.594027614    10.10.1.1 → 10.10.1.2    TCP 83 8081 → 53410 [PSH, ACK] Seq=120 Ack=137 Win=65152 Len=17 TSval=3172001530 TSecr=1047741819
1711549043.191550493    94 0.604241877    10.10.1.2 → 10.10.1.1    TCP 83 53410 → 8081 [PSH, ACK] Seq=137 Ack=137 Win=64256 Len=17 TSval=1047741829 TSecr=3172001530
1711549045.191550493    96 0.604372123    10.10.1.1 → 10.10.1.2    TCP 83 8081 → 53410 [PSH, ACK] Seq=137 Ack=154 Win=65152 Len=17 TSval=3172001541 TSecr=1047741829
1711549051.191550493   102 0.614587148    10.10.1.2 → 10.10.1.1    TCP 83 53410 → 8081 [PSH, ACK] Seq=154 Ack=154 Win=64256 Len=17 TSval=1047741840 TSecr=3172001541
1711549053.191550493   104 0.614717382    10.10.1.1 → 10.10.1.2    TCP 83 8081 → 53410 [PSH, ACK] Seq=154 Ack=171 Win=65152 Len=17 TSval=3172001551 TSecr=1047741840
1711549059.191550493   110 0.624929451    10.10.1.2 → 10.10.1.1    TCP 83 53410 → 8081 [PSH, ACK] Seq=171 Ack=171 Win=64256 Len=17 TSval=1047741850 TSecr=3172001551
1711549061.191550493   112 0.625060791    10.10.1.1 → 10.10.1.2    TCP 83 8081 → 53410 [PSH, ACK] Seq=171 Ack=188 Win=65152 Len=17 TSval=3172001561 TSecr=1047741850
1711549067.191550493   118 0.635272891    10.10.1.2 → 10.10.1.1    TCP 83 53410 → 8081 [PSH, ACK] Seq=188 Ack=188 Win=64256 Len=17 TSval=1047741860 TSecr=3172001561
1711549069.191550493   120 0.635403464    10.10.1.1 → 10.10.1.2    TCP 83 8081 → 53410 [PSH, ACK] Seq=188 Ack=205 Win=65152 Len=17 TSval=3172001572 TSecr=1047741860
1711549075.191550493   126 0.645621738    10.10.1.2 → 10.10.1.1    TCP 83 53410 → 8081 [PSH, ACK] Seq=205 Ack=205 Win=64256 Len=17 TSval=1047741871 TSecr=3172001572
1711549077.191550493   128 0.645752275    10.10.1.1 → 10.10.1.2    TCP 83 8081 → 53410 [PSH, ACK] Seq=205 Ack=222 Win=65152 Len=17 TSval=3172001582 TSecr=1047741871
1711549085.191550493   136 0.655972059    10.10.1.2 → 10.10.1.1    TCP 83 53410 → 8081 [PSH, ACK] Seq=222 Ack=222 Win=64256 Len=17 TSval=1047741881 TSecr=3172001582
1711549087.191550493   138 0.656102335    10.10.1.1 → 10.10.1.2    TCP 83 8081 → 53410 [PSH, ACK] Seq=222 Ack=239 Win=65152 Len=17 TSval=3172001592 TSecr=1047741881
1711549093.191550493   144 0.666312356    10.10.1.2 → 10.10.1.1    TCP 83 53410 → 8081 [PSH, ACK] Seq=239 Ack=239 Win=64256 Len=17 TSval=1047741891 TSecr=3172001592
1711549095.191550493   146 0.666442634    10.10.1.1 → 10.10.1.2    TCP 83 8081 → 53410 [PSH, ACK] Seq=239 Ack=256 Win=65152 Len=17 TSval=3172001603 TSecr=1047741891
1711549103.191550493   154 0.676658360    10.10.1.2 → 10.10.1.1    TCP 83 53410 → 8081 [PSH, ACK] Seq=256 Ack=256 Win=64256 Len=17 TSval=1047741902 TSecr=3172001603
1711549105.191550493   156 0.676787721    10.10.1.1 → 10.10.1.2    TCP 83 8081 → 53410 [PSH, ACK] Seq=256 Ack=273 Win=65152 Len=17 TSval=3172001613 TSecr=1047741902
1711549111.191550493   162 0.686998135    10.10.1.2 → 10.10.1.1    TCP 83 53410 → 8081 [PSH, ACK] Seq=273 Ack=273 Win=64256 Len=17 TSval=1047741912 TSecr=3172001613
1711549113.191550493   164 0.687128469    10.10.1.1 → 10.10.1.2    TCP 83 8081 → 53410 [PSH, ACK] Seq=273 Ack=290 Win=65152 Len=17 TSval=3172001623 TSecr=1047741912
1711549119.191550493   170 0.697339853    10.10.1.2 → 10.10.1.1    TCP 83 53410 → 8081 [PSH, ACK] Seq=290 Ack=290 Win=64256 Len=17 TSval=1047741922 TSecr=3172001623
1711549121.191550493   172 0.697470555    10.10.1.1 → 10.10.1.2    TCP 83 8081 → 53410 [PSH, ACK] Seq=290 Ack=307 Win=65152 Len=17 TSval=3172001634 TSecr=1047741922
1711549129.191550493   180 0.707688864    10.10.1.2 → 10.10.1.1    TCP 83 53410 → 8081 [PSH, ACK] Seq=307 Ack=307 Win=64256 Len=17 TSval=1047741933 TSecr=3172001634
1711549131.191550493   182 0.707819957    10.10.1.1 → 10.10.1.2    TCP 83 8081 → 53410 [PSH, ACK] Seq=307 Ack=324 Win=65152 Len=17 TSval=3172001644 TSecr=1047741933
1711549139.191550493   190 0.718036067    10.10.1.2 → 10.10.1.1    TCP 83 53410 → 8081 [PSH, ACK] Seq=324 Ack=324 Win=64256 Len=17 TSval=1047741943 TSecr=3172001644
1711549141.191550493   192 0.718166103    10.10.1.1 → 10.10.1.2    TCP 83 8081 → 53410 [PSH, ACK] Seq=324 Ack=341 Win=65152 Len=17 TSval=3172001654 TSecr=1047741943
1711549148.191550493   199 0.728407586    10.10.1.2 → 10.10.1.1    TCP 83 53410 → 8081 [PSH, ACK] Seq=341 Ack=341 Win=64256 Len=17 TSval=1047741953 TSecr=3172001654
1711549150.191550493   201 0.728526433    10.10.1.1 → 10.10.1.2    TCP 83 8081 → 53410 [PSH, ACK] Seq=341 Ack=358 Win=65152 Len=17 TSval=3172001665 TSecr=1047741953
1711549156.191550493   207 0.738768505    10.10.1.2 → 10.10.1.1    TCP 83 53410 → 8081 [PSH, ACK] Seq=358 Ack=358 Win=64256 Len=17 TSval=1047741964 TSecr=3172001665
1711549158.191550493   209 0.738888627    10.10.1.1 → 10.10.1.2    TCP 83 8081 → 53410 [PSH, ACK] Seq=358 Ack=375 Win=65152 Len=17 TSval=3172001675 TSecr=1047741964
1711549164.191550493   215 0.749128964    10.10.1.2 → 10.10.1.1    TCP 83 53410 → 8081 [PSH, ACK] Seq=375 Ack=375 Win=64256 Len=17 TSval=1047741974 TSecr=3172001675
1711549166.191550493   217 0.749247285    10.10.1.1 → 10.10.1.2    TCP 83 8081 → 53410 [PSH, ACK] Seq=375 Ack=392 Win=65152 Len=17 TSval=3172001685 TSecr=1047741974
1711549172.191550493   223 0.759490552    10.10.1.2 → 10.10.1.1    TCP 83 53410 → 8081 [PSH, ACK] Seq=392 Ack=392 Win=64256 Len=17 TSval=1047741985 TSecr=3172001685
1711549174.191550493   225 0.759609114    10.10.1.1 → 10.10.1.2    TCP 83 8081 → 53410 [PSH, ACK] Seq=392 Ack=409 Win=65152 Len=17 TSval=3172001696 TSecr=1047741985
1711549180.191550493   231 0.769852384    10.10.1.2 → 10.10.1.1    TCP 83 53410 → 8081 [PSH, ACK] Seq=409 Ack=409 Win=64256 Len=17 TSval=1047741995 TSecr=3172001696
1711549182.191550493   233 0.769971389    10.10.1.1 → 10.10.1.2    TCP 83 8081 → 53410 [PSH, ACK] Seq=409 Ack=426 Win=65152 Len=17 TSval=3172001706 TSecr=1047741995
1711549188.191550493   239 0.780214065    10.10.1.2 → 10.10.1.1    TCP 83 53410 → 8081 [PSH, ACK] Seq=426 Ack=426 Win=64256 Len=17 TSval=1047742005 TSecr=3172001706
1711549190.191550493   241 0.780332781    10.10.1.1 → 10.10.1.2    TCP 83 8081 → 53410 [PSH, ACK] Seq=426 Ack=443 Win=65152 Len=17 TSval=3172001717 TSecr=1047742005
1711549196.191550493   247 0.790576972    10.10.1.2 → 10.10.1.1    TCP 83 53410 → 8081 [PSH, ACK] Seq=443 Ack=443 Win=64256 Len=17 TSval=1047742016 TSecr=3172001717
1711549198.191550493   249 0.790696843    10.10.1.1 → 10.10.1.2    TCP 83 8081 → 53410 [PSH, ACK] Seq=443 Ack=460 Win=65152 Len=17 TSval=3172001727 TSecr=1047742016
1711549204.191550493   255 0.800939239    10.10.1.2 → 10.10.1.1    TCP 83 53410 → 8081 [PSH, ACK] Seq=460 Ack=460 Win=64256 Len=17 TSval=1047742026 TSecr=3172001727
1711549206.191550493   257 0.801057976    10.10.1.1 → 10.10.1.2    TCP 83 8081 → 53410 [PSH, ACK] Seq=460 Ack=477 Win=65152 Len=17 TSval=3172001737 TSecr=1047742026
1711549212.191550493   263 0.811298503    10.10.1.2 → 10.10.1.1    TCP 83 53410 → 8081 [PSH, ACK] Seq=477 Ack=477 Win=64256 Len=17 TSval=1047742036 TSecr=3172001737
1711549214.191550493   265 0.811418603    10.10.1.1 → 10.10.1.2    TCP 83 8081 → 53410 [PSH, ACK] Seq=477 Ack=494 Win=65152 Len=17 TSval=3172001748 TSecr=1047742036
1711549220.191550493   271 0.821659789    10.10.1.2 → 10.10.1.1    TCP 83 53410 → 8081 [PSH, ACK] Seq=494 Ack=494 Win=64256 Len=17 TSval=1047742047 TSecr=3172001748
1711549222.191550493   273 0.821779484    10.10.1.1 → 10.10.1.2    TCP 83 8081 → 53410 [PSH, ACK] Seq=494 Ack=511 Win=65152 Len=17 TSval=3172001758 TSecr=1047742047
1711549228.191550493   279 0.832019646    10.10.1.2 → 10.10.1.1    TCP 83 53410 → 8081 [PSH, ACK] Seq=511 Ack=511 Win=64256 Len=17 TSval=1047742057 TSecr=3172001758
1711549230.191550493   281 0.832139998    10.10.1.1 → 10.10.1.2    TCP 83 8081 → 53410 [PSH, ACK] Seq=511 Ack=528 Win=65152 Len=17 TSval=3172001768 TSecr=1047742057
1711549236.191550493   287 0.842380977    10.10.1.2 → 10.10.1.1    TCP 83 53410 → 8081 [PSH, ACK] Seq=528 Ack=528 Win=64256 Len=17 TSval=1047742067 TSecr=3172001768
1711549238.191550493   289 0.842500286    10.10.1.1 → 10.10.1.2    TCP 83 8081 → 53410 [PSH, ACK] Seq=528 Ack=545 Win=65152 Len=17 TSval=3172001779 TSecr=1047742067
1711549244.191550493   295 0.852741291    10.10.1.2 → 10.10.1.1    TCP 83 53410 → 8081 [PSH, ACK] Seq=545 Ack=545 Win=64256 Len=17 TSval=1047742078 TSecr=3172001779
1711549246.191550493   297 0.852859891    10.10.1.1 → 10.10.1.2    TCP 83 8081 → 53410 [PSH, ACK] Seq=545 Ack=562 Win=65152 Len=17 TSval=3172001789 TSecr=1047742078
1711549252.191550493   303 0.863103047    10.10.1.2 → 10.10.1.1    TCP 83 53410 → 8081 [PSH, ACK] Seq=562 Ack=562 Win=64256 Len=17 TSval=1047742088 TSecr=3172001789
1711549254.191550493   305 0.863222272    10.10.1.1 → 10.10.1.2    TCP 83 8081 → 53410 [PSH, ACK] Seq=562 Ack=579 Win=65152 Len=17 TSval=3172001799 TSecr=1047742088
1711549260.191550493   311 0.873461778    10.10.1.2 → 10.10.1.1    TCP 83 53410 → 8081 [PSH, ACK] Seq=579 Ack=579 Win=64256 Len=17 TSval=1047742099 TSecr=3172001799
1711549262.191550493   313 0.873580232    10.10.1.1 → 10.10.1.2    TCP 83 8081 → 53410 [PSH, ACK] Seq=579 Ack=596 Win=65152 Len=17 TSval=3172001810 TSecr=1047742099
1711549268.191550493   319 0.883821169    10.10.1.2 → 10.10.1.1    TCP 83 53410 → 8081 [PSH, ACK] Seq=596 Ack=596 Win=64256 Len=17 TSval=1047742109 TSecr=3172001810
1711549270.191550493   321 0.883940133    10.10.1.1 → 10.10.1.2    TCP 83 8081 → 53410 [PSH, ACK] Seq=596 Ack=613 Win=65152 Len=17 TSval=3172001820 TSecr=1047742109
1711549276.191550493   327 0.894181325    10.10.1.2 → 10.10.1.1    TCP 83 53410 → 8081 [PSH, ACK] Seq=613 Ack=613 Win=64256 Len=17 TSval=1047742119 TSecr=3172001820
1711549278.191550493   329 0.894301011    10.10.1.1 → 10.10.1.2    TCP 83 8081 → 53410 [PSH, ACK] Seq=613 Ack=630 Win=65152 Len=17 TSval=3172001831 TSecr=1047742119
1711549284.191550493   335 0.904542420    10.10.1.2 → 10.10.1.1    TCP 83 53410 → 8081 [PSH, ACK] Seq=630 Ack=630 Win=64256 Len=17 TSval=1047742130 TSecr=3172001831
1711549286.191550493   337 0.904661128    10.10.1.1 → 10.10.1.2    TCP 83 8081 → 53410 [PSH, ACK] Seq=630 Ack=647 Win=65152 Len=17 TSval=3172001841 TSecr=1047742130
1711549292.191550493   343 0.914902058    10.10.1.2 → 10.10.1.1    TCP 83 53410 → 8081 [PSH, ACK] Seq=647 Ack=647 Win=64256 Len=17 TSval=1047742140 TSecr=3172001841
1711549294.191550493   345 0.915021076    10.10.1.1 → 10.10.1.2    TCP 83 8081 → 53410 [PSH, ACK] Seq=647 Ack=664 Win=65152 Len=17 TSval=3172001851 TSecr=1047742140
1711549300.191550493   351 0.925260005    10.10.1.2 → 10.10.1.1    TCP 83 53410 → 8081 [PSH, ACK] Seq=664 Ack=664 Win=64256 Len=17 TSval=1047742150 TSecr=3172001851
1711549302.191550493   353 0.925378561    10.10.1.1 → 10.10.1.2    TCP 83 8081 → 53410 [PSH, ACK] Seq=664 Ack=681 Win=65152 Len=17 TSval=3172001862 TSecr=1047742150
1711549308.191550493   359 0.935618958    10.10.1.2 → 10.10.1.1    TCP 83 53410 → 8081 [PSH, ACK] Seq=681 Ack=681 Win=64256 Len=17 TSval=1047742161 TSecr=3172001862
1711549310.191550493   361 0.935738114    10.10.1.1 → 10.10.1.2    TCP 83 8081 → 53410 [PSH, ACK] Seq=681 Ack=698 Win=65152 Len=17 TSval=3172001872 TSecr=1047742161
1711549316.191550493   367 0.945981134    10.10.1.2 → 10.10.1.1    TCP 83 53410 → 8081 [PSH, ACK] Seq=698 Ack=698 Win=64256 Len=17 TSval=1047742171 TSecr=3172001872
1711549318.191550493   369 0.946099837    10.10.1.1 → 10.10.1.2    TCP 83 8081 → 53410 [PSH, ACK] Seq=698 Ack=715 Win=65152 Len=17 TSval=3172001882 TSecr=1047742171
1711549324.191550493   375 0.956339432    10.10.1.2 → 10.10.1.1    TCP 83 53410 → 8081 [PSH, ACK] Seq=715 Ack=715 Win=64256 Len=17 TSval=1047742181 TSecr=3172001882
1711549326.191550493   377 0.956458375    10.10.1.1 → 10.10.1.2    TCP 83 8081 → 53410 [PSH, ACK] Seq=715 Ack=732 Win=65152 Len=17 TSval=3172001893 TSecr=1047742181
1711549332.191550493   383 0.966700365    10.10.1.2 → 10.10.1.1    TCP 83 53410 → 8081 [PSH, ACK] Seq=732 Ack=732 Win=64256 Len=17 TSval=1047742192 TSecr=3172001893
1711549334.191550493   385 0.966819243    10.10.1.1 → 10.10.1.2    TCP 83 8081 → 53410 [PSH, ACK] Seq=732 Ack=749 Win=65152 Len=17 TSval=3172001903 TSecr=1047742192
1711549340.191550493   391 0.977069161    10.10.1.2 → 10.10.1.1    TCP 83 53410 → 8081 [PSH, ACK] Seq=749 Ack=749 Win=64256 Len=17 TSval=1047742202 TSecr=3172001903
1711549342.191550493   393 0.977187385    10.10.1.1 → 10.10.1.2    TCP 83 8081 → 53410 [PSH, ACK] Seq=749 Ack=766 Win=65152 Len=17 TSval=3172001913 TSecr=1047742202
1711549348.191550493   399 0.987430009    10.10.1.2 → 10.10.1.1    TCP 83 53410 → 8081 [PSH, ACK] Seq=766 Ack=766 Win=64256 Len=17 TSval=1047742212 TSecr=3172001913
1711549350.191550493   401 0.987549466    10.10.1.1 → 10.10.1.2    TCP 83 8081 → 53410 [PSH, ACK] Seq=766 Ack=783 Win=65152 Len=17 TSval=3172001924 TSecr=1047742212
1711549356.191550493   407 0.997792453    10.10.1.2 → 10.10.1.1    TCP 83 53410 → 8081 [PSH, ACK] Seq=783 Ack=783 Win=64256 Len=17 TSval=1047742223 TSecr=3172001924
1711549358.191550493   409 0.997912044    10.10.1.1 → 10.10.1.2    TCP 83 8081 → 53410 [PSH, ACK] Seq=783 Ack=800 Win=65152 Len=17 TSval=3172001934 TSecr=1047742223
1711549364.191550493   415 1.008153234    10.10.1.2 → 10.10.1.1    TCP 83 53410 → 8081 [PSH, ACK] Seq=800 Ack=800 Win=64256 Len=17 TSval=1047742233 TSecr=3172001934
1711549366.191550493   417 1.008272661    10.10.1.1 → 10.10.1.2    TCP 83 8081 → 53410 [PSH, ACK] Seq=800 Ack=817 Win=65152 Len=17 TSval=3172001945 TSecr=1047742233
1711549372.191550493   423 1.018515232    10.10.1.2 → 10.10.1.1    TCP 83 53410 → 8081 [PSH, ACK] Seq=817 Ack=817 Win=64256 Len=17 TSval=1047742244 TSecr=3172001945
1711549374.191550493   425 1.018634361    10.10.1.1 → 10.10.1.2    TCP 83 8081 → 53410 [PSH, ACK] Seq=817 Ack=834 Win=65152 Len=17 TSval=3172001955 TSecr=1047742244
1711549380.191550493   431 1.028874834    10.10.1.2 → 10.10.1.1    TCP 83 53410 → 8081 [PSH, ACK] Seq=834 Ack=834 Win=64256 Len=17 TSval=1047742254 TSecr=3172001955
1711549382.191550493   433 1.028994381    10.10.1.1 → 10.10.1.2    TCP 83 8081 → 53410 [PSH, ACK] Seq=834 Ack=851 Win=65152 Len=17 TSval=3172001965 TSecr=1047742254
1711549388.191550493   439 1.039238431    10.10.1.2 → 10.10.1.1    TCP 83 53410 → 8081 [PSH, ACK] Seq=851 Ack=851 Win=64256 Len=17 TSval=1047742264 TSecr=3172001965
1711549390.191550493   441 1.039357021    10.10.1.1 → 10.10.1.2    TCP 83 8081 → 53410 [PSH, ACK] Seq=851 Ack=868 Win=65152 Len=17 TSval=3172001976 TSecr=1047742264
1711549396.191550493   447 1.049597138    10.10.1.2 → 10.10.1.1    TCP 83 53410 → 8081 [PSH, ACK] Seq=868 Ack=868 Win=64256 Len=17 TSval=1047742275 TSecr=3172001976
1711549398.191550493   449 1.049715313    10.10.1.1 → 10.10.1.2    TCP 83 8081 → 53410 [PSH, ACK] Seq=868 Ack=885 Win=65152 Len=17 TSval=3172001986 TSecr=1047742275
1711549404.191550493   455 1.059957001    10.10.1.2 → 10.10.1.1    TCP 83 53410 → 8081 [PSH, ACK] Seq=885 Ack=885 Win=64256 Len=17 TSval=1047742285 TSecr=3172001986
1711549406.191550493   457 1.060076755    10.10.1.1 → 10.10.1.2    TCP 83 8081 → 53410 [PSH, ACK] Seq=885 Ack=902 Win=65152 Len=17 TSval=3172001996 TSecr=1047742285
1711549412.191550493   463 1.070316108    10.10.1.2 → 10.10.1.1    TCP 83 53410 → 8081 [PSH, ACK] Seq=902 Ack=902 Win=64256 Len=17 TSval=1047742295 TSecr=3172001996
1711549414.191550493   465 1.070435288    10.10.1.1 → 10.10.1.2    TCP 83 8081 → 53410 [PSH, ACK] Seq=902 Ack=919 Win=65152 Len=17 TSval=3172002007 TSecr=1047742295
1711549420.191550493   471 1.080675315    10.10.1.2 → 10.10.1.1    TCP 83 53410 → 8081 [PSH, ACK] Seq=919 Ack=919 Win=64256 Len=17 TSval=1047742306 TSecr=3172002007
1711549422.191550493   473 1.080794204    10.10.1.1 → 10.10.1.2    TCP 83 8081 → 53410 [PSH, ACK] Seq=919 Ack=936 Win=65152 Len=17 TSval=3172002017 TSecr=1047742306
1711549428.191550493   479 1.091034786    10.10.1.2 → 10.10.1.1    TCP 83 53410 → 8081 [PSH, ACK] Seq=936 Ack=936 Win=64256 Len=17 TSval=1047742316 TSecr=3172002017
1711549430.191550493   481 1.091154311    10.10.1.1 → 10.10.1.2    TCP 83 8081 → 53410 [PSH, ACK] Seq=936 Ack=953 Win=65152 Len=17 TSval=3172002027 TSecr=1047742316
1711549436.191550493   487 1.101397461    10.10.1.2 → 10.10.1.1    TCP 83 53410 → 8081 [PSH, ACK] Seq=953 Ack=953 Win=64256 Len=17 TSval=1047742326 TSecr=3172002027
1711549438.191550493   489 1.102300946    10.10.1.1 → 10.10.1.2    TCP 83 8081 → 53410 [PSH, ACK] Seq=953 Ack=970 Win=65152 Len=17 TSval=3172002039 TSecr=1047742326
1711549444.191550493   495 1.112545122    10.10.1.2 → 10.10.1.1    TCP 83 53410 → 8081 [PSH, ACK] Seq=970 Ack=970 Win=64256 Len=17 TSval=1047742338 TSecr=3172002039
1711549446.191550493   497 1.112663688    10.10.1.1 → 10.10.1.2    TCP 83 8081 → 53410 [PSH, ACK] Seq=970 Ack=987 Win=65152 Len=17 TSval=3172002049 TSecr=1047742338
1711549452.191550493   503 1.122908039    10.10.1.2 → 10.10.1.1    TCP 83 53410 → 8081 [PSH, ACK] Seq=987 Ack=987 Win=64256 Len=17 TSval=1047742348 TSecr=3172002049
1711549454.191550493   505 1.123027645    10.10.1.1 → 10.10.1.2    TCP 83 8081 → 53410 [PSH, ACK] Seq=987 Ack=1004 Win=65152 Len=17 TSval=3172002059 TSecr=1047742348
1711549460.191550493   511 1.133269760    10.10.1.2 → 10.10.1.1    TCP 83 53410 → 8081 [PSH, ACK] Seq=1004 Ack=1004 Win=64256 Len=17 TSval=1047742358 TSecr=3172002059
1711549462.191550493   513 1.133389838    10.10.1.1 → 10.10.1.2    TCP 83 8081 → 53410 [PSH, ACK] Seq=1004 Ack=1021 Win=65152 Len=17 TSval=3172002070 TSecr=1047742358
1711549468.191550493   519 1.143629243    10.10.1.2 → 10.10.1.1    TCP 83 53410 → 8081 [PSH, ACK] Seq=1021 Ack=1021 Win=64256 Len=17 TSval=1047742369 TSecr=3172002070
1711549470.191550493   521 1.143747925    10.10.1.1 → 10.10.1.2    TCP 83 8081 → 53410 [PSH, ACK] Seq=1021 Ack=1038 Win=65152 Len=17 TSval=3172002080 TSecr=1047742369
1711549476.191550493   527 1.153990541    10.10.1.2 → 10.10.1.1    TCP 83 53410 → 8081 [PSH, ACK] Seq=1038 Ack=1038 Win=64256 Len=17 TSval=1047742379 TSecr=3172002080
1711549478.191550493   529 1.154110623    10.10.1.1 → 10.10.1.2    TCP 83 8081 → 53410 [PSH, ACK] Seq=1038 Ack=1055 Win=65152 Len=17 TSval=3172002090 TSecr=1047742379
1711549484.191550493   535 1.164350648    10.10.1.2 → 10.10.1.1    TCP 83 53410 → 8081 [PSH, ACK] Seq=1055 Ack=1055 Win=64256 Len=17 TSval=1047742389 TSecr=3172002090
1711549486.191550493   537 1.164470284    10.10.1.1 → 10.10.1.2    TCP 83 8081 → 53410 [PSH, ACK] Seq=1055 Ack=1072 Win=65152 Len=17 TSval=3172002101 TSecr=1047742389
1711549492.191550493   543 1.174712222    10.10.1.2 → 10.10.1.1    TCP 83 53410 → 8081 [PSH, ACK] Seq=1072 Ack=1072 Win=64256 Len=17 TSval=1047742400 TSecr=3172002101
1711549494.191550493   545 1.174831161    10.10.1.1 → 10.10.1.2    TCP 83 8081 → 53410 [PSH, ACK] Seq=1072 Ack=1089 Win=65152 Len=17 TSval=3172002111 TSecr=1047742400
1711549500.191550493   551 1.185071173    10.10.1.2 → 10.10.1.1    TCP 83 53410 → 8081 [PSH, ACK] Seq=1089 Ack=1089 Win=64256 Len=17 TSval=1047742410 TSecr=3172002111
1711549502.191550493   553 1.185189740    10.10.1.1 → 10.10.1.2    TCP 83 8081 → 53410 [PSH, ACK] Seq=1089 Ack=1106 Win=65152 Len=17 TSval=3172002121 TSecr=1047742410
1711549508.191550493   559 1.195429105    10.10.1.2 → 10.10.1.1    TCP 83 53410 → 8081 [PSH, ACK] Seq=1106 Ack=1106 Win=64256 Len=17 TSval=1047742420 TSecr=3172002121
1711549510.191550493   561 1.195547885    10.10.1.1 → 10.10.1.2    TCP 83 8081 → 53410 [PSH, ACK] Seq=1106 Ack=1123 Win=65152 Len=17 TSval=3172002132 TSecr=1047742420
1711549516.191550493   567 1.205787081    10.10.1.2 → 10.10.1.1    TCP 83 53410 → 8081 [PSH, ACK] Seq=1123 Ack=1123 Win=64256 Len=17 TSval=1047742431 TSecr=3172002132
1711549518.191550493   569 1.205906213    10.10.1.1 → 10.10.1.2    TCP 83 8081 → 53410 [PSH, ACK] Seq=1123 Ack=1140 Win=65152 Len=17 TSval=3172002142 TSecr=1047742431
1711549524.191550493   575 1.216159444    10.10.1.2 → 10.10.1.1    TCP 83 53410 → 8081 [PSH, ACK] Seq=1140 Ack=1140 Win=64256 Len=17 TSval=1047742441 TSecr=3172002142
1711549526.191550493   577 1.216278817    10.10.1.1 → 10.10.1.2    TCP 83 8081 → 53410 [PSH, ACK] Seq=1140 Ack=1157 Win=65152 Len=17 TSval=3172002153 TSecr=1047742441
1711549532.191550493   583 1.226521355    10.10.1.2 → 10.10.1.1    TCP 83 53410 → 8081 [PSH, ACK] Seq=1157 Ack=1157 Win=64256 Len=17 TSval=1047742452 TSecr=3172002153
1711549534.191550493   585 1.226640917    10.10.1.1 → 10.10.1.2    TCP 83 8081 → 53410 [PSH, ACK] Seq=1157 Ack=1174 Win=65152 Len=17 TSval=3172002163 TSecr=1047742452
1711549540.191550493   591 1.236879738    10.10.1.2 → 10.10.1.1    TCP 83 53410 → 8081 [PSH, ACK] Seq=1174 Ack=1174 Win=64256 Len=17 TSval=1047742462 TSecr=3172002163
1711549542.191550493   593 1.236998835    10.10.1.1 → 10.10.1.2    TCP 83 8081 → 53410 [PSH, ACK] Seq=1174 Ack=1191 Win=65152 Len=17 TSval=3172002173 TSecr=1047742462
1711549548.191550493   599 1.247238867    10.10.1.2 → 10.10.1.1    TCP 83 53410 → 8081 [PSH, ACK] Seq=1191 Ack=1191 Win=64256 Len=17 TSval=1047742472 TSecr=3172002173
1711549550.191550493   601 1.247357964    10.10.1.1 → 10.10.1.2    TCP 83 8081 → 53410 [PSH, ACK] Seq=1191 Ack=1208 Win=65152 Len=17 TSval=3172002184 TSecr=1047742472
1711549556.191550493   607 1.257598409    10.10.1.2 → 10.10.1.1    TCP 83 53410 → 8081 [PSH, ACK] Seq=1208 Ack=1208 Win=64256 Len=17 TSval=1047742483 TSecr=3172002184
1711549558.191550493   609 1.257718084    10.10.1.1 → 10.10.1.2    TCP 83 8081 → 53410 [PSH, ACK] Seq=1208 Ack=1225 Win=65152 Len=17 TSval=3172002194 TSecr=1047742483
1711549564.191550493   615 1.267957291    10.10.1.2 → 10.10.1.1    TCP 83 53410 → 8081 [PSH, ACK] Seq=1225 Ack=1225 Win=64256 Len=17 TSval=1047742493 TSecr=3172002194
1711549566.191550493   617 1.268075705    10.10.1.1 → 10.10.1.2    TCP 83 8081 → 53410 [PSH, ACK] Seq=1225 Ack=1242 Win=65152 Len=17 TSval=3172002204 TSecr=1047742493
1711549572.191550493   623 1.278314807    10.10.1.2 → 10.10.1.1    TCP 83 53410 → 8081 [PSH, ACK] Seq=1242 Ack=1242 Win=64256 Len=17 TSval=1047742503 TSecr=3172002204
1711549574.191550493   625 1.278434043    10.10.1.1 → 10.10.1.2    TCP 83 8081 → 53410 [PSH, ACK] Seq=1242 Ack=1259 Win=65152 Len=17 TSval=3172002215 TSecr=1047742503
1711549580.191550493   631 1.288674169    10.10.1.2 → 10.10.1.1    TCP 83 53410 → 8081 [PSH, ACK] Seq=1259 Ack=1259 Win=64256 Len=17 TSval=1047742514 TSecr=3172002215
1711549582.191550493   633 1.288793200    10.10.1.1 → 10.10.1.2    TCP 83 8081 → 53410 [PSH, ACK] Seq=1259 Ack=1276 Win=65152 Len=17 TSval=3172002225 TSecr=1047742514
1711549588.191550493   639 1.299033012    10.10.1.2 → 10.10.1.1    TCP 83 53410 → 8081 [PSH, ACK] Seq=1276 Ack=1276 Win=64256 Len=17 TSval=1047742524 TSecr=3172002225
1711549590.191550493   641 1.299152324    10.10.1.1 → 10.10.1.2    TCP 83 8081 → 53410 [PSH, ACK] Seq=1276 Ack=1293 Win=65152 Len=17 TSval=3172002235 TSecr=1047742524
1711549596.191550493   647 1.309394333    10.10.1.2 → 10.10.1.1    TCP 83 53410 → 8081 [PSH, ACK] Seq=1293 Ack=1293 Win=64256 Len=17 TSval=1047742534 TSecr=3172002235
1711549598.191550493   649 1.309512747    10.10.1.1 → 10.10.1.2    TCP 83 8081 → 53410 [PSH, ACK] Seq=1293 Ack=1310 Win=65152 Len=17 TSval=3172002246 TSecr=1047742534
1711549604.191550493   655 1.319754765    10.10.1.2 → 10.10.1.1    TCP 83 53410 → 8081 [PSH, ACK] Seq=1310 Ack=1310 Win=64256 Len=17 TSval=1047742545 TSecr=3172002246
1711549606.191550493   657 1.319874908    10.10.1.1 → 10.10.1.2    TCP 83 8081 → 53410 [PSH, ACK] Seq=1310 Ack=1327 Win=65152 Len=17 TSval=3172002256 TSecr=1047742545
1711549612.191550493   663 1.330116297    10.10.1.2 → 10.10.1.1    TCP 83 53410 → 8081 [PSH, ACK] Seq=1327 Ack=1327 Win=64256 Len=17 TSval=1047742555 TSecr=3172002256
1711549614.191550493   665 1.330236061    10.10.1.1 → 10.10.1.2    TCP 83 8081 → 53410 [PSH, ACK] Seq=1327 Ack=1344 Win=65152 Len=17 TSval=3172002266 TSecr=1047742555
1711549620.191550493   671 1.340476539    10.10.1.2 → 10.10.1.1    TCP 83 53410 → 8081 [PSH, ACK] Seq=1344 Ack=1344 Win=64256 Len=17 TSval=1047742566 TSecr=3172002266
1711549622.191550493   673 1.340595637    10.10.1.1 → 10.10.1.2    TCP 83 8081 → 53410 [PSH, ACK] Seq=1344 Ack=1361 Win=65152 Len=17 TSval=3172002277 TSecr=1047742566
1711549628.191550493   679 1.350835063    10.10.1.2 → 10.10.1.1    TCP 83 53410 → 8081 [PSH, ACK] Seq=1361 Ack=1361 Win=64256 Len=17 TSval=1047742576 TSecr=3172002277
1711549630.191550493   681 1.350954581    10.10.1.1 → 10.10.1.2    TCP 83 8081 → 53410 [PSH, ACK] Seq=1361 Ack=1378 Win=65152 Len=17 TSval=3172002287 TSecr=1047742576
1711549636.191550493   687 1.361195256    10.10.1.2 → 10.10.1.1    TCP 83 53410 → 8081 [PSH, ACK] Seq=1378 Ack=1378 Win=64256 Len=17 TSval=1047742586 TSecr=3172002287
1711549638.191550493   689 1.361335568    10.10.1.1 → 10.10.1.2    TCP 83 8081 → 53410 [PSH, ACK] Seq=1378 Ack=1395 Win=65152 Len=17 TSval=3172002298 TSecr=1047742586
1711549644.191550493   695 1.371579062    10.10.1.2 → 10.10.1.1    TCP 83 53410 → 8081 [PSH, ACK] Seq=1395 Ack=1395 Win=64256 Len=17 TSval=1047742597 TSecr=3172002298
1711549646.191550493   697 1.371697831    10.10.1.1 → 10.10.1.2    TCP 83 8081 → 53410 [PSH, ACK] Seq=1395 Ack=1412 Win=65152 Len=17 TSval=3172002308 TSecr=1047742597
1711549652.191550493   703 1.381938567    10.10.1.2 → 10.10.1.1    TCP 83 53410 → 8081 [PSH, ACK] Seq=1412 Ack=1412 Win=64256 Len=17 TSval=1047742607 TSecr=3172002308
1711549654.191550493   705 1.382057571    10.10.1.1 → 10.10.1.2    TCP 83 8081 → 53410 [PSH, ACK] Seq=1412 Ack=1429 Win=65152 Len=17 TSval=3172002318 TSecr=1047742607
1711549660.191550493   711 1.392300667    10.10.1.2 → 10.10.1.1    TCP 83 53410 → 8081 [PSH, ACK] Seq=1429 Ack=1429 Win=64256 Len=17 TSval=1047742617 TSecr=3172002318
1711549662.191550493   713 1.392420312    10.10.1.1 → 10.10.1.2    TCP 83 8081 → 53410 [PSH, ACK] Seq=1429 Ack=1446 Win=65152 Len=17 TSval=3172002329 TSecr=1047742617
1711549668.191550493   719 1.402659982    10.10.1.2 → 10.10.1.1    TCP 83 53410 → 8081 [PSH, ACK] Seq=1446 Ack=1446 Win=64256 Len=17 TSval=1047742628 TSecr=3172002329
1711549670.191550493   721 1.402779813    10.10.1.1 → 10.10.1.2    TCP 83 8081 → 53410 [PSH, ACK] Seq=1446 Ack=1463 Win=65152 Len=17 TSval=3172002339 TSecr=1047742628
1711549676.191550493   727 1.413019786    10.10.1.2 → 10.10.1.1    TCP 83 53410 → 8081 [PSH, ACK] Seq=1463 Ack=1463 Win=64256 Len=17 TSval=1047742638 TSecr=3172002339
1711549678.191550493   729 1.413138878    10.10.1.1 → 10.10.1.2    TCP 83 8081 → 53410 [PSH, ACK] Seq=1463 Ack=1480 Win=65152 Len=17 TSval=3172002349 TSecr=1047742638
1711549684.191550493   735 1.423382459    10.10.1.2 → 10.10.1.1    TCP 83 53410 → 8081 [PSH, ACK] Seq=1480 Ack=1480 Win=64256 Len=17 TSval=1047742648 TSecr=3172002349
1711549686.191550493   737 1.423501811    10.10.1.1 → 10.10.1.2    TCP 83 8081 → 53410 [PSH, ACK] Seq=1480 Ack=1497 Win=65152 Len=17 TSval=3172002360 TSecr=1047742648
1711549692.191550493   743 1.433745587    10.10.1.2 → 10.10.1.1    TCP 83 53410 → 8081 [PSH, ACK] Seq=1497 Ack=1497 Win=64256 Len=17 TSval=1047742659 TSecr=3172002360
1711549694.191550493   745 1.433864609    10.10.1.1 → 10.10.1.2    TCP 83 8081 → 53410 [PSH, ACK] Seq=1497 Ack=1514 Win=65152 Len=17 TSval=3172002370 TSecr=1047742659
1711549700.191550493   751 1.444105874    10.10.1.2 → 10.10.1.1    TCP 83 53410 → 8081 [PSH, ACK] Seq=1514 Ack=1514 Win=64256 Len=17 TSval=1047742669 TSecr=3172002370
1711549702.191550493   753 1.444224454    10.10.1.1 → 10.10.1.2    TCP 83 8081 → 53410 [PSH, ACK] Seq=1514 Ack=1531 Win=65152 Len=17 TSval=3172002380 TSecr=1047742669
1711549708.191550493   759 1.454454931    10.10.1.2 → 10.10.1.1    TCP 83 53410 → 8081 [PSH, ACK] Seq=1531 Ack=1531 Win=64256 Len=17 TSval=1047742680 TSecr=3172002380
1711549710.191550493   761 1.454574581    10.10.1.1 → 10.10.1.2    TCP 83 8081 → 53410 [PSH, ACK] Seq=1531 Ack=1548 Win=65152 Len=17 TSval=3172002391 TSecr=1047742680
1711549716.191550493   767 1.464815337    10.10.1.2 → 10.10.1.1    TCP 83 53410 → 8081 [PSH, ACK] Seq=1548 Ack=1548 Win=64256 Len=17 TSval=1047742690 TSecr=3172002391
1711549718.191550493   769 1.464934535    10.10.1.1 → 10.10.1.2    TCP 83 8081 → 53410 [PSH, ACK] Seq=1548 Ack=1565 Win=65152 Len=17 TSval=3172002401 TSecr=1047742690
1711549724.191550493   775 1.475174475    10.10.1.2 → 10.10.1.1    TCP 83 53410 → 8081 [PSH, ACK] Seq=1565 Ack=1565 Win=64256 Len=17 TSval=1047742700 TSecr=3172002401
1711549726.191550493   777 1.475293137    10.10.1.1 → 10.10.1.2    TCP 83 8081 → 53410 [PSH, ACK] Seq=1565 Ack=1582 Win=65152 Len=17 TSval=3172002412 TSecr=1047742700
1711549732.191550493   783 1.485538243    10.10.1.2 → 10.10.1.1    TCP 83 53410 → 8081 [PSH, ACK] Seq=1582 Ack=1582 Win=64256 Len=17 TSval=1047742711 TSecr=3172002412
1711549734.191550493   785 1.485657757    10.10.1.1 → 10.10.1.2    TCP 83 8081 → 53410 [PSH, ACK] Seq=1582 Ack=1599 Win=65152 Len=17 TSval=3172002422 TSecr=1047742711
1711549740.191550493   791 1.495900599    10.10.1.2 → 10.10.1.1    TCP 83 53410 → 8081 [PSH, ACK] Seq=1599 Ack=1599 Win=64256 Len=17 TSval=1047742721 TSecr=3172002422
1711549742.191550493   793 1.496021798    10.10.1.1 → 10.10.1.2    TCP 83 8081 → 53410 [PSH, ACK] Seq=1599 Ack=1616 Win=65152 Len=17 TSval=3172002432 TSecr=1047742721
1711549748.191550493   799 1.506269850    10.10.1.2 → 10.10.1.1    TCP 83 53410 → 8081 [PSH, ACK] Seq=1616 Ack=1616 Win=64256 Len=17 TSval=1047742731 TSecr=3172002432
1711549750.191550493   801 1.506389638    10.10.1.1 → 10.10.1.2    TCP 83 8081 → 53410 [PSH, ACK] Seq=1616 Ack=1633 Win=65152 Len=17 TSval=3172002443 TSecr=1047742731
1711549756.191550493   807 1.516632321    10.10.1.2 → 10.10.1.1    TCP 83 53410 → 8081 [PSH, ACK] Seq=1633 Ack=1633 Win=64256 Len=17 TSval=1047742742 TSecr=3172002443
1711549758.191550493   809 1.516751791    10.10.1.1 → 10.10.1.2    TCP 83 8081 → 53410 [PSH, ACK] Seq=1633 Ack=1650 Win=65152 Len=17 TSval=3172002453 TSecr=1047742742
1711549764.191550493   815 1.526991416    10.10.1.2 → 10.10.1.1    TCP 83 53410 → 8081 [PSH, ACK] Seq=1650 Ack=1650 Win=64256 Len=17 TSval=1047742752 TSecr=3172002453
1711549766.191550493   817 1.527110487    10.10.1.1 → 10.10.1.2    TCP 83 8081 → 53410 [PSH, ACK] Seq=1650 Ack=1667 Win=65152 Len=17 TSval=3172002463 TSecr=1047742752
1711549772.191550493   823 1.537355412    10.10.1.2 → 10.10.1.1    TCP 83 53410 → 8081 [PSH, ACK] Seq=1667 Ack=1667 Win=64256 Len=17 TSval=1047742762 TSecr=3172002463
1711549773.191550493   824 1.537438389    10.10.1.1 → 10.10.1.2    TCP 83 8081 → 53410 [PSH, ACK] Seq=1667 Ack=1684 Win=65152 Len=17 TSval=3172002474 TSecr=1047742762
1711549780.191550493   831 1.547687411    10.10.1.2 → 10.10.1.1    TCP 83 53410 → 8081 [PSH, ACK] Seq=1684 Ack=1684 Win=64256 Len=17 TSval=1047742773 TSecr=3172002474
1711549782.191550493   833 1.547806753    10.10.1.1 → 10.10.1.2    TCP 83 8081 → 53410 [PSH, ACK] Seq=1684 Ack=1701 Win=65152 Len=17 TSval=3172002484 TSecr=1047742773
1711549788.191550493   839 1.558050013    10.10.1.2 → 10.10.1.1    TCP 83 53410 → 8081 [PSH, ACK] Seq=1701 Ack=1701 Win=64256 Len=17 TSval=1047742783 TSecr=3172002484
1711549790.191550493   841 1.558169235    10.10.1.1 → 10.10.1.2    TCP 83 8081 → 53410 [PSH, ACK] Seq=1701 Ack=1718 Win=65152 Len=17 TSval=3172002494 TSecr=1047742783
1711549796.191550493   847 1.568408599    10.10.1.2 → 10.10.1.1    TCP 83 53410 → 8081 [PSH, ACK] Seq=1718 Ack=1718 Win=64256 Len=17 TSval=1047742793 TSecr=3172002494
1711549798.191550493   849 1.568528465    10.10.1.1 → 10.10.1.2    TCP 83 8081 → 53410 [PSH, ACK] Seq=1718 Ack=1735 Win=65152 Len=17 TSval=3172002505 TSecr=1047742793
1711549804.191550493   855 1.578770903    10.10.1.2 → 10.10.1.1    TCP 83 53410 → 8081 [PSH, ACK] Seq=1735 Ack=1735 Win=64256 Len=17 TSval=1047742804 TSecr=3172002505
1711549806.191550493   857 1.578891642    10.10.1.1 → 10.10.1.2    TCP 83 8081 → 53410 [PSH, ACK] Seq=1735 Ack=1752 Win=65152 Len=17 TSval=3172002515 TSecr=1047742804
1711549812.191550493   863 1.589133538    10.10.1.2 → 10.10.1.1    TCP 83 53410 → 8081 [PSH, ACK] Seq=1752 Ack=1752 Win=64256 Len=17 TSval=1047742814 TSecr=3172002515
1711549814.191550493   865 1.589252250    10.10.1.1 → 10.10.1.2    TCP 83 8081 → 53410 [PSH, ACK] Seq=1752 Ack=1769 Win=65152 Len=17 TSval=3172002525 TSecr=1047742814
1711549820.191550493   871 1.599508355    10.10.1.2 → 10.10.1.1    TCP 83 53410 → 8081 [PSH, ACK] Seq=1769 Ack=1769 Win=64256 Len=17 TSval=1047742825 TSecr=3172002525
1711549822.191550493   873 1.599628127    10.10.1.1 → 10.10.1.2    TCP 83 8081 → 53410 [PSH, ACK] Seq=1769 Ack=1786 Win=65152 Len=17 TSval=3172002536 TSecr=1047742825
1711549828.191550493   879 1.609870045    10.10.1.2 → 10.10.1.1    TCP 83 53410 → 8081 [PSH, ACK] Seq=1786 Ack=1786 Win=64256 Len=17 TSval=1047742835 TSecr=3172002536
1711549830.191550493   881 1.609989288    10.10.1.1 → 10.10.1.2    TCP 83 8081 → 53410 [PSH, ACK] Seq=1786 Ack=1803 Win=65152 Len=17 TSval=3172002546 TSecr=1047742835
1711549836.191550493   887 1.620232245    10.10.1.2 → 10.10.1.1    TCP 83 53410 → 8081 [PSH, ACK] Seq=1803 Ack=1803 Win=64256 Len=17 TSval=1047742845 TSecr=3172002546
1711549838.191550493   889 1.620351081    10.10.1.1 → 10.10.1.2    TCP 83 8081 → 53410 [PSH, ACK] Seq=1803 Ack=1820 Win=65152 Len=17 TSval=3172002557 TSecr=1047742845
1711549844.191550493   895 1.630593683    10.10.1.2 → 10.10.1.1    TCP 83 53410 → 8081 [PSH, ACK] Seq=1820 Ack=1820 Win=64256 Len=17 TSval=1047742856 TSecr=3172002557
1711549846.191550493   897 1.630713249    10.10.1.1 → 10.10.1.2    TCP 83 8081 → 53410 [PSH, ACK] Seq=1820 Ack=1837 Win=65152 Len=17 TSval=3172002567 TSecr=1047742856
1711549852.191550493   903 1.640966592    10.10.1.2 → 10.10.1.1    TCP 83 53410 → 8081 [PSH, ACK] Seq=1837 Ack=1837 Win=64256 Len=17 TSval=1047742866 TSecr=3172002567
1711549854.191550493   905 1.641086131    10.10.1.1 → 10.10.1.2    TCP 83 8081 → 53410 [PSH, ACK] Seq=1837 Ack=1854 Win=65152 Len=17 TSval=3172002577 TSecr=1047742866
1711549860.191550493   911 1.651328283    10.10.1.2 → 10.10.1.1    TCP 83 53410 → 8081 [PSH, ACK] Seq=1854 Ack=1854 Win=64256 Len=17 TSval=1047742876 TSecr=3172002577
1711549862.191550493   913 1.651447605    10.10.1.1 → 10.10.1.2    TCP 83 8081 → 53410 [PSH, ACK] Seq=1854 Ack=1871 Win=65152 Len=17 TSval=3172002588 TSecr=1047742876
1711549868.191550493   919 1.661687858    10.10.1.2 → 10.10.1.1    TCP 83 53410 → 8081 [PSH, ACK] Seq=1871 Ack=1871 Win=64256 Len=17 TSval=1047742887 TSecr=3172002588
1711549870.191550493   921 1.661809260    10.10.1.1 → 10.10.1.2    TCP 83 8081 → 53410 [PSH, ACK] Seq=1871 Ack=1888 Win=65152 Len=17 TSval=3172002598 TSecr=1047742887
1711549876.191550493   927 1.672049285    10.10.1.2 → 10.10.1.1    TCP 83 53410 → 8081 [PSH, ACK] Seq=1888 Ack=1888 Win=64256 Len=17 TSval=1047742897 TSecr=3172002598
1711549878.191550493   929 1.672167727    10.10.1.1 → 10.10.1.2    TCP 83 8081 → 53410 [PSH, ACK] Seq=1888 Ack=1905 Win=65152 Len=17 TSval=3172002608 TSecr=1047742897
1711549884.191550493   935 1.682409903    10.10.1.2 → 10.10.1.1    TCP 83 53410 → 8081 [PSH, ACK] Seq=1905 Ack=1905 Win=64256 Len=17 TSval=1047742907 TSecr=3172002608
1711549886.191550493   937 1.682528478    10.10.1.1 → 10.10.1.2    TCP 83 8081 → 53410 [PSH, ACK] Seq=1905 Ack=1922 Win=65152 Len=17 TSval=3172002619 TSecr=1047742907
1711549892.191550493   943 1.692767867    10.10.1.2 → 10.10.1.1    TCP 83 53410 → 8081 [PSH, ACK] Seq=1922 Ack=1922 Win=64256 Len=17 TSval=1047742918 TSecr=3172002619
1711549894.191550493   945 1.692940019    10.10.1.1 → 10.10.1.2    TCP 83 8081 → 53410 [PSH, ACK] Seq=1922 Ack=1939 Win=65152 Len=17 TSval=3172002629 TSecr=1047742918
1711549900.191550493   951 1.703182629    10.10.1.2 → 10.10.1.1    TCP 83 53410 → 8081 [PSH, ACK] Seq=1939 Ack=1939 Win=64256 Len=17 TSval=1047742928 TSecr=3172002629
1711549902.191550493   953 1.703302281    10.10.1.1 → 10.10.1.2    TCP 83 8081 → 53410 [PSH, ACK] Seq=1939 Ack=1956 Win=65152 Len=17 TSval=3172002640 TSecr=1047742928
1711549908.191550493   959 1.713541999    10.10.1.2 → 10.10.1.1    TCP 83 53410 → 8081 [PSH, ACK] Seq=1956 Ack=1956 Win=64256 Len=17 TSval=1047742939 TSecr=3172002640
1711549910.191550493   961 1.713661543    10.10.1.1 → 10.10.1.2    TCP 83 8081 → 53410 [PSH, ACK] Seq=1956 Ack=1973 Win=65152 Len=17 TSval=3172002650 TSecr=1047742939
1711549916.191550493   967 1.723902650    10.10.1.2 → 10.10.1.1    TCP 83 53410 → 8081 [PSH, ACK] Seq=1973 Ack=1973 Win=64256 Len=17 TSval=1047742949 TSecr=3172002650
1711549918.191550493   969 1.724022275    10.10.1.1 → 10.10.1.2    TCP 83 8081 → 53410 [PSH, ACK] Seq=1973 Ack=1990 Win=65152 Len=17 TSval=3172002660 TSecr=1047742949
1711549924.191550493   975 1.734264522    10.10.1.2 → 10.10.1.1    TCP 83 53410 → 8081 [PSH, ACK] Seq=1990 Ack=1990 Win=64256 Len=17 TSval=1047742959 TSecr=3172002660
1711549926.191550493   977 1.734384939    10.10.1.1 → 10.10.1.2    TCP 83 8081 → 53410 [PSH, ACK] Seq=1990 Ack=2007 Win=65152 Len=17 TSval=3172002671 TSecr=1047742959
