1712183034.863349438    21 0.282630082    10.10.1.2 → 10.10.1.1    TCP 74 50872 → 8081 [SYN] Seq=0 Win=64240 Len=0 MSS=1460 SACK_PERM=1 TSval=1681806241 TSecr=0 WS=128
1712183035.863349438    22 0.282643248    10.10.1.1 → 10.10.1.2    TCP 74 8081 → 50872 [SYN, ACK] Seq=0 Ack=1 Win=65160 Len=0 MSS=1460 SACK_PERM=1 TSval=3806065950 TSecr=1681806241 WS=128
1712183037.863349438    24 0.282675766    10.10.1.2 → 10.10.1.1    TCP 66 50872 → 8081 [ACK] Seq=1 Ack=1 Win=64256 Len=0 TSval=1681806241 TSecr=3806065950
1712183047.863349438    34 0.543018821    10.10.1.2 → 10.10.1.1    TCP 83 50872 → 8081 [PSH, ACK] Seq=1 Ack=1 Win=64256 Len=17 TSval=1681806501 TSecr=3806065950
1712183049.863349438    36 0.543046255    10.10.1.1 → 10.10.1.2    TCP 66 8081 → 50872 [ACK] Seq=1 Ack=18 Win=65152 Len=0 TSval=3806066211 TSecr=1681806501
1712183051.863349438    38 0.543316274    10.10.1.1 → 10.10.1.2    TCP 83 8081 → 50872 [PSH, ACK] Seq=1 Ack=18 Win=65152 Len=17 TSval=3806066211 TSecr=1681806501
1712183052.863349438    39 0.543344261    10.10.1.2 → 10.10.1.1    TCP 66 50872 → 8081 [ACK] Seq=18 Ack=18 Win=64256 Len=0 TSval=1681806502 TSecr=3806066211
1712183059.863349438    46 0.553536716    10.10.1.2 → 10.10.1.1    TCP 83 50872 → 8081 [PSH, ACK] Seq=18 Ack=18 Win=64256 Len=17 TSval=1681806512 TSecr=3806066211
1712183062.863349438    49 0.553663382    10.10.1.1 → 10.10.1.2    TCP 83 8081 → 50872 [PSH, ACK] Seq=18 Ack=35 Win=65152 Len=17 TSval=3806066221 TSecr=1681806512
1712183069.863349438    56 0.563885010    10.10.1.2 → 10.10.1.1    TCP 83 50872 → 8081 [PSH, ACK] Seq=35 Ack=35 Win=64256 Len=17 TSval=1681806522 TSecr=3806066221
1712183072.863349438    59 0.564016201    10.10.1.1 → 10.10.1.2    TCP 83 8081 → 50872 [PSH, ACK] Seq=35 Ack=52 Win=65152 Len=17 TSval=3806066232 TSecr=1681806522
1712183079.863349438    66 0.574235395    10.10.1.2 → 10.10.1.1    TCP 83 50872 → 8081 [PSH, ACK] Seq=52 Ack=52 Win=64256 Len=17 TSval=1681806533 TSecr=3806066232
1712183082.863349438    69 0.574365942    10.10.1.1 → 10.10.1.2    TCP 83 8081 → 50872 [PSH, ACK] Seq=52 Ack=69 Win=65152 Len=17 TSval=3806066242 TSecr=1681806533
1712183089.863349438    76 0.584584222    10.10.1.2 → 10.10.1.1    TCP 83 50872 → 8081 [PSH, ACK] Seq=69 Ack=69 Win=64256 Len=17 TSval=1681806543 TSecr=3806066242
1712183092.863349438    79 0.584713869    10.10.1.1 → 10.10.1.2    TCP 83 8081 → 50872 [PSH, ACK] Seq=69 Ack=86 Win=65152 Len=17 TSval=3806066252 TSecr=1681806543
1712183099.863349438    86 0.594932728    10.10.1.2 → 10.10.1.1    TCP 83 50872 → 8081 [PSH, ACK] Seq=86 Ack=86 Win=64256 Len=17 TSval=1681806553 TSecr=3806066252
1712183101.863349438    88 0.595063784    10.10.1.1 → 10.10.1.2    TCP 83 8081 → 50872 [PSH, ACK] Seq=86 Ack=103 Win=65152 Len=17 TSval=3806066263 TSecr=1681806553
1712183110.863349438    97 0.605281757    10.10.1.2 → 10.10.1.1    TCP 83 50872 → 8081 [PSH, ACK] Seq=103 Ack=103 Win=64256 Len=17 TSval=1681806564 TSecr=3806066263
1712183112.863349438    99 0.605412118    10.10.1.1 → 10.10.1.2    TCP 83 8081 → 50872 [PSH, ACK] Seq=103 Ack=120 Win=65152 Len=17 TSval=3806066273 TSecr=1681806564
1712183119.863349438   106 0.615630583    10.10.1.2 → 10.10.1.1    TCP 83 50872 → 8081 [PSH, ACK] Seq=120 Ack=120 Win=64256 Len=17 TSval=1681806574 TSecr=3806066273
1712183121.863349438   108 0.615761526    10.10.1.1 → 10.10.1.2    TCP 83 8081 → 50872 [PSH, ACK] Seq=120 Ack=137 Win=65152 Len=17 TSval=3806066283 TSecr=1681806574
1712183129.863349438   116 0.625981110    10.10.1.2 → 10.10.1.1    TCP 83 50872 → 8081 [PSH, ACK] Seq=137 Ack=137 Win=64256 Len=17 TSval=1681806584 TSecr=3806066283
1712183131.863349438   118 0.626111485    10.10.1.1 → 10.10.1.2    TCP 83 8081 → 50872 [PSH, ACK] Seq=137 Ack=154 Win=65152 Len=17 TSval=3806066294 TSecr=1681806584
1712183139.863349438   126 0.636329708    10.10.1.2 → 10.10.1.1    TCP 83 50872 → 8081 [PSH, ACK] Seq=154 Ack=154 Win=64256 Len=17 TSval=1681806595 TSecr=3806066294
1712183141.863349438   128 0.636459446    10.10.1.1 → 10.10.1.2    TCP 83 8081 → 50872 [PSH, ACK] Seq=154 Ack=171 Win=65152 Len=17 TSval=3806066304 TSecr=1681806595
1712183149.863349438   136 0.646677176    10.10.1.2 → 10.10.1.1    TCP 83 50872 → 8081 [PSH, ACK] Seq=171 Ack=171 Win=64256 Len=17 TSval=1681806605 TSecr=3806066304
1712183151.863349438   138 0.646809019    10.10.1.1 → 10.10.1.2    TCP 83 8081 → 50872 [PSH, ACK] Seq=171 Ack=188 Win=65152 Len=17 TSval=3806066314 TSecr=1681806605
1712183159.863349438   146 0.657026176    10.10.1.2 → 10.10.1.1    TCP 83 50872 → 8081 [PSH, ACK] Seq=188 Ack=188 Win=64256 Len=17 TSval=1681806615 TSecr=3806066314
1712183161.863349438   148 0.657156357    10.10.1.1 → 10.10.1.2    TCP 83 8081 → 50872 [PSH, ACK] Seq=188 Ack=205 Win=65152 Len=17 TSval=3806066325 TSecr=1681806615
1712183169.863349438   156 0.667373446    10.10.1.2 → 10.10.1.1    TCP 83 50872 → 8081 [PSH, ACK] Seq=205 Ack=205 Win=64256 Len=17 TSval=1681806626 TSecr=3806066325
1712183171.863349438   158 0.667504206    10.10.1.1 → 10.10.1.2    TCP 83 8081 → 50872 [PSH, ACK] Seq=205 Ack=222 Win=65152 Len=17 TSval=3806066335 TSecr=1681806626
1712183179.863349438   166 0.677720044    10.10.1.2 → 10.10.1.1    TCP 83 50872 → 8081 [PSH, ACK] Seq=222 Ack=222 Win=64256 Len=17 TSval=1681806636 TSecr=3806066335
1712183181.863349438   168 0.677877829    10.10.1.1 → 10.10.1.2    TCP 83 8081 → 50872 [PSH, ACK] Seq=222 Ack=239 Win=65152 Len=17 TSval=3806066346 TSecr=1681806636
1712183189.863349438   176 0.688098312    10.10.1.2 → 10.10.1.1    TCP 83 50872 → 8081 [PSH, ACK] Seq=239 Ack=239 Win=64256 Len=17 TSval=1681806647 TSecr=3806066346
1712183191.863349438   178 0.688228899    10.10.1.1 → 10.10.1.2    TCP 83 8081 → 50872 [PSH, ACK] Seq=239 Ack=256 Win=65152 Len=17 TSval=3806066356 TSecr=1681806647
1712183199.863349438   186 0.698445099    10.10.1.2 → 10.10.1.1    TCP 83 50872 → 8081 [PSH, ACK] Seq=256 Ack=256 Win=64256 Len=17 TSval=1681806657 TSecr=3806066356
1712183202.863349438   189 0.698633378    10.10.1.1 → 10.10.1.2    TCP 83 8081 → 50872 [PSH, ACK] Seq=256 Ack=273 Win=65152 Len=17 TSval=3806066366 TSecr=1681806657
1712183209.863349438   196 0.708849586    10.10.1.2 → 10.10.1.1    TCP 83 50872 → 8081 [PSH, ACK] Seq=273 Ack=273 Win=64256 Len=17 TSval=1681806667 TSecr=3806066366
1712183211.863349438   198 0.708980035    10.10.1.1 → 10.10.1.2    TCP 83 8081 → 50872 [PSH, ACK] Seq=273 Ack=290 Win=65152 Len=17 TSval=3806066377 TSecr=1681806667
1712183219.863349438   206 0.719197400    10.10.1.2 → 10.10.1.1    TCP 83 50872 → 8081 [PSH, ACK] Seq=290 Ack=290 Win=64256 Len=17 TSval=1681806678 TSecr=3806066377
1712183221.863349438   208 0.719327426    10.10.1.1 → 10.10.1.2    TCP 83 8081 → 50872 [PSH, ACK] Seq=290 Ack=307 Win=65152 Len=17 TSval=3806066387 TSecr=1681806678
1712183229.863349438   216 0.729543730    10.10.1.2 → 10.10.1.1    TCP 83 50872 → 8081 [PSH, ACK] Seq=307 Ack=307 Win=64256 Len=17 TSval=1681806688 TSecr=3806066387
1712183231.863349438   218 0.729674475    10.10.1.1 → 10.10.1.2    TCP 83 8081 → 50872 [PSH, ACK] Seq=307 Ack=324 Win=65152 Len=17 TSval=3806066397 TSecr=1681806688
1712183239.863349438   226 0.739890837    10.10.1.2 → 10.10.1.1    TCP 83 50872 → 8081 [PSH, ACK] Seq=324 Ack=324 Win=64256 Len=17 TSval=1681806698 TSecr=3806066397
1712183241.863349438   228 0.740021329    10.10.1.1 → 10.10.1.2    TCP 83 8081 → 50872 [PSH, ACK] Seq=324 Ack=341 Win=65152 Len=17 TSval=3806066408 TSecr=1681806698
1712183249.863349438   236 0.750239313    10.10.1.2 → 10.10.1.1    TCP 83 50872 → 8081 [PSH, ACK] Seq=341 Ack=341 Win=64256 Len=17 TSval=1681806709 TSecr=3806066408
1712183251.863349438   238 0.750371080    10.10.1.1 → 10.10.1.2    TCP 83 8081 → 50872 [PSH, ACK] Seq=341 Ack=358 Win=65152 Len=17 TSval=3806066418 TSecr=1681806709
1712183259.863349438   246 0.760591390    10.10.1.2 → 10.10.1.1    TCP 83 50872 → 8081 [PSH, ACK] Seq=358 Ack=358 Win=64256 Len=17 TSval=1681806719 TSecr=3806066418
1712183261.863349438   248 0.760722066    10.10.1.1 → 10.10.1.2    TCP 83 8081 → 50872 [PSH, ACK] Seq=358 Ack=375 Win=65152 Len=17 TSval=3806066428 TSecr=1681806719
1712183269.863349438   256 0.770942656    10.10.1.2 → 10.10.1.1    TCP 83 50872 → 8081 [PSH, ACK] Seq=375 Ack=375 Win=64256 Len=17 TSval=1681806729 TSecr=3806066428
1712183271.863349438   258 0.771073421    10.10.1.1 → 10.10.1.2    TCP 83 8081 → 50872 [PSH, ACK] Seq=375 Ack=392 Win=65152 Len=17 TSval=3806066439 TSecr=1681806729
1712183279.863349438   266 0.781291268    10.10.1.2 → 10.10.1.1    TCP 83 50872 → 8081 [PSH, ACK] Seq=392 Ack=392 Win=64256 Len=17 TSval=1681806740 TSecr=3806066439
1712183281.863349438   268 0.781422475    10.10.1.1 → 10.10.1.2    TCP 83 8081 → 50872 [PSH, ACK] Seq=392 Ack=409 Win=65152 Len=17 TSval=3806066449 TSecr=1681806740
1712183289.863349438   276 0.791642188    10.10.1.2 → 10.10.1.1    TCP 83 50872 → 8081 [PSH, ACK] Seq=409 Ack=409 Win=64256 Len=17 TSval=1681806750 TSecr=3806066449
1712183291.863349438   278 0.791772579    10.10.1.1 → 10.10.1.2    TCP 83 8081 → 50872 [PSH, ACK] Seq=409 Ack=426 Win=65152 Len=17 TSval=3806066459 TSecr=1681806750
1712183300.863349438   287 0.801988531    10.10.1.2 → 10.10.1.1    TCP 83 50872 → 8081 [PSH, ACK] Seq=426 Ack=426 Win=64256 Len=17 TSval=1681806760 TSecr=3806066459
1712183302.863349438   289 0.802118703    10.10.1.1 → 10.10.1.2    TCP 83 8081 → 50872 [PSH, ACK] Seq=426 Ack=443 Win=65152 Len=17 TSval=3806066470 TSecr=1681806760
1712183309.863349438   296 0.812355409    10.10.1.2 → 10.10.1.1    TCP 83 50872 → 8081 [PSH, ACK] Seq=443 Ack=443 Win=64256 Len=17 TSval=1681806771 TSecr=3806066470
1712183311.863349438   298 0.812489147    10.10.1.1 → 10.10.1.2    TCP 83 8081 → 50872 [PSH, ACK] Seq=443 Ack=460 Win=65152 Len=17 TSval=3806066480 TSecr=1681806771
1712183319.863349438   306 0.822711743    10.10.1.2 → 10.10.1.1    TCP 83 50872 → 8081 [PSH, ACK] Seq=460 Ack=460 Win=64256 Len=17 TSval=1681806781 TSecr=3806066480
1712183321.863349438   308 0.822842481    10.10.1.1 → 10.10.1.2    TCP 83 8081 → 50872 [PSH, ACK] Seq=460 Ack=477 Win=65152 Len=17 TSval=3806066491 TSecr=1681806781
1712183329.863349438   316 0.833048043    10.10.1.2 → 10.10.1.1    TCP 83 50872 → 8081 [PSH, ACK] Seq=477 Ack=477 Win=64256 Len=17 TSval=1681806792 TSecr=3806066491
1712183331.863349438   318 0.833178319    10.10.1.1 → 10.10.1.2    TCP 83 8081 → 50872 [PSH, ACK] Seq=477 Ack=494 Win=65152 Len=17 TSval=3806066501 TSecr=1681806792
1712183339.863349438   326 0.843397651    10.10.1.2 → 10.10.1.1    TCP 83 50872 → 8081 [PSH, ACK] Seq=494 Ack=494 Win=64256 Len=17 TSval=1681806802 TSecr=3806066501
1712183341.863349438   328 0.843528156    10.10.1.1 → 10.10.1.2    TCP 83 8081 → 50872 [PSH, ACK] Seq=494 Ack=511 Win=65152 Len=17 TSval=3806066511 TSecr=1681806802
1712183349.863349438   336 0.853746642    10.10.1.2 → 10.10.1.1    TCP 83 50872 → 8081 [PSH, ACK] Seq=511 Ack=511 Win=64256 Len=17 TSval=1681806812 TSecr=3806066511
1712183351.863349438   338 0.853880627    10.10.1.1 → 10.10.1.2    TCP 83 8081 → 50872 [PSH, ACK] Seq=511 Ack=528 Win=65152 Len=17 TSval=3806066522 TSecr=1681806812
1712183359.863349438   346 0.864095999    10.10.1.2 → 10.10.1.1    TCP 83 50872 → 8081 [PSH, ACK] Seq=528 Ack=528 Win=64256 Len=17 TSval=1681806823 TSecr=3806066522
1712183361.863349438   348 0.864226646    10.10.1.1 → 10.10.1.2    TCP 83 8081 → 50872 [PSH, ACK] Seq=528 Ack=545 Win=65152 Len=17 TSval=3806066532 TSecr=1681806823
1712183369.863349438   356 0.874441657    10.10.1.2 → 10.10.1.1    TCP 83 50872 → 8081 [PSH, ACK] Seq=545 Ack=545 Win=64256 Len=17 TSval=1681806833 TSecr=3806066532
1712183371.863349438   358 0.874572858    10.10.1.1 → 10.10.1.2    TCP 83 8081 → 50872 [PSH, ACK] Seq=545 Ack=562 Win=65152 Len=17 TSval=3806066542 TSecr=1681806833
1712183379.863349438   366 0.884791123    10.10.1.2 → 10.10.1.1    TCP 83 50872 → 8081 [PSH, ACK] Seq=562 Ack=562 Win=64256 Len=17 TSval=1681806843 TSecr=3806066542
1712183381.863349438   368 0.884922069    10.10.1.1 → 10.10.1.2    TCP 83 8081 → 50872 [PSH, ACK] Seq=562 Ack=579 Win=65152 Len=17 TSval=3806066553 TSecr=1681806843
1712183389.863349438   376 0.895150521    10.10.1.2 → 10.10.1.1    TCP 83 50872 → 8081 [PSH, ACK] Seq=579 Ack=579 Win=64256 Len=17 TSval=1681806854 TSecr=3806066553
1712183392.863349438   379 0.897234268    10.10.1.1 → 10.10.1.2    TCP 83 8081 → 50872 [PSH, ACK] Seq=579 Ack=596 Win=65152 Len=17 TSval=3806066565 TSecr=1681806854
1712183398.863349438   385 0.907454091    10.10.1.2 → 10.10.1.1    TCP 83 50872 → 8081 [PSH, ACK] Seq=596 Ack=596 Win=64256 Len=17 TSval=1681806866 TSecr=3806066565
1712183400.863349438   387 0.907592048    10.10.1.1 → 10.10.1.2    TCP 83 8081 → 50872 [PSH, ACK] Seq=596 Ack=613 Win=65152 Len=17 TSval=3806066575 TSecr=1681806866
1712183408.863349438   395 0.917810971    10.10.1.2 → 10.10.1.1    TCP 83 50872 → 8081 [PSH, ACK] Seq=613 Ack=613 Win=64256 Len=17 TSval=1681806876 TSecr=3806066575
1712183410.863349438   397 0.917950237    10.10.1.1 → 10.10.1.2    TCP 83 8081 → 50872 [PSH, ACK] Seq=613 Ack=630 Win=65152 Len=17 TSval=3806066586 TSecr=1681806876
1712183418.863349438   405 0.928166054    10.10.1.2 → 10.10.1.1    TCP 83 50872 → 8081 [PSH, ACK] Seq=630 Ack=630 Win=64256 Len=17 TSval=1681806887 TSecr=3806066586
1712183420.863349438   407 0.928304246    10.10.1.1 → 10.10.1.2    TCP 83 8081 → 50872 [PSH, ACK] Seq=630 Ack=647 Win=65152 Len=17 TSval=3806066596 TSecr=1681806887
1712183428.863349438   415 0.938521165    10.10.1.2 → 10.10.1.1    TCP 83 50872 → 8081 [PSH, ACK] Seq=647 Ack=647 Win=64256 Len=17 TSval=1681806897 TSecr=3806066596
1712183430.863349438   417 0.938650563    10.10.1.1 → 10.10.1.2    TCP 83 8081 → 50872 [PSH, ACK] Seq=647 Ack=664 Win=65152 Len=17 TSval=3806066606 TSecr=1681806897
1712183438.863349438   425 0.948870428    10.10.1.2 → 10.10.1.1    TCP 83 50872 → 8081 [PSH, ACK] Seq=664 Ack=664 Win=64256 Len=17 TSval=1681806907 TSecr=3806066606
1712183440.863349438   427 0.949006654    10.10.1.1 → 10.10.1.2    TCP 83 8081 → 50872 [PSH, ACK] Seq=664 Ack=681 Win=65152 Len=17 TSval=3806066617 TSecr=1681806907
1712183448.863349438   435 0.959227837    10.10.1.2 → 10.10.1.1    TCP 83 50872 → 8081 [PSH, ACK] Seq=681 Ack=681 Win=64256 Len=17 TSval=1681806918 TSecr=3806066617
1712183450.863349438   437 0.959363075    10.10.1.1 → 10.10.1.2    TCP 83 8081 → 50872 [PSH, ACK] Seq=681 Ack=698 Win=65152 Len=17 TSval=3806066627 TSecr=1681806918
1712183458.863349438   445 0.969585764    10.10.1.2 → 10.10.1.1    TCP 83 50872 → 8081 [PSH, ACK] Seq=698 Ack=698 Win=64256 Len=17 TSval=1681806928 TSecr=3806066627
1712183460.863349438   447 0.969721811    10.10.1.1 → 10.10.1.2    TCP 83 8081 → 50872 [PSH, ACK] Seq=698 Ack=715 Win=65152 Len=17 TSval=3806066637 TSecr=1681806928
1712183468.863349438   455 0.979942298    10.10.1.2 → 10.10.1.1    TCP 83 50872 → 8081 [PSH, ACK] Seq=715 Ack=715 Win=64256 Len=17 TSval=1681806938 TSecr=3806066637
1712183470.863349438   457 0.980076360    10.10.1.1 → 10.10.1.2    TCP 83 8081 → 50872 [PSH, ACK] Seq=715 Ack=732 Win=65152 Len=17 TSval=3806066648 TSecr=1681806938
1712183478.863349438   465 0.990296489    10.10.1.2 → 10.10.1.1    TCP 83 50872 → 8081 [PSH, ACK] Seq=732 Ack=732 Win=64256 Len=17 TSval=1681806949 TSecr=3806066648
1712183480.863349438   467 0.990430981    10.10.1.1 → 10.10.1.2    TCP 83 8081 → 50872 [PSH, ACK] Seq=732 Ack=749 Win=65152 Len=17 TSval=3806066658 TSecr=1681806949
1712183488.863349438   475 1.000651542    10.10.1.2 → 10.10.1.1    TCP 83 50872 → 8081 [PSH, ACK] Seq=749 Ack=749 Win=64256 Len=17 TSval=1681806959 TSecr=3806066658
1712183490.863349438   477 1.000787848    10.10.1.1 → 10.10.1.2    TCP 83 8081 → 50872 [PSH, ACK] Seq=749 Ack=766 Win=65152 Len=17 TSval=3806066668 TSecr=1681806959
1712183498.863349438   485 1.011008551    10.10.1.2 → 10.10.1.1    TCP 83 50872 → 8081 [PSH, ACK] Seq=766 Ack=766 Win=64256 Len=17 TSval=1681806969 TSecr=3806066668
1712183500.863349438   487 1.011142833    10.10.1.1 → 10.10.1.2    TCP 83 8081 → 50872 [PSH, ACK] Seq=766 Ack=783 Win=65152 Len=17 TSval=3806066679 TSecr=1681806969
1712183508.863349438   495 1.021362575    10.10.1.2 → 10.10.1.1    TCP 83 50872 → 8081 [PSH, ACK] Seq=783 Ack=783 Win=64256 Len=17 TSval=1681806980 TSecr=3806066679
1712183510.863349438   497 1.021497382    10.10.1.1 → 10.10.1.2    TCP 83 8081 → 50872 [PSH, ACK] Seq=783 Ack=800 Win=65152 Len=17 TSval=3806066689 TSecr=1681806980
1712183518.863349438   505 1.031715821    10.10.1.2 → 10.10.1.1    TCP 83 50872 → 8081 [PSH, ACK] Seq=800 Ack=800 Win=64256 Len=17 TSval=1681806990 TSecr=3806066689
1712183520.863349438   507 1.031849671    10.10.1.1 → 10.10.1.2    TCP 83 8081 → 50872 [PSH, ACK] Seq=800 Ack=817 Win=65152 Len=17 TSval=3806066700 TSecr=1681806990
1712183528.863349438   515 1.042071148    10.10.1.2 → 10.10.1.1    TCP 83 50872 → 8081 [PSH, ACK] Seq=817 Ack=817 Win=64256 Len=17 TSval=1681807001 TSecr=3806066700
1712183530.863349438   517 1.042205909    10.10.1.1 → 10.10.1.2    TCP 83 8081 → 50872 [PSH, ACK] Seq=817 Ack=834 Win=65152 Len=17 TSval=3806066710 TSecr=1681807001
1712183538.863349438   525 1.052427880    10.10.1.2 → 10.10.1.1    TCP 83 50872 → 8081 [PSH, ACK] Seq=834 Ack=834 Win=64256 Len=17 TSval=1681807011 TSecr=3806066710
1712183540.863349438   527 1.052564478    10.10.1.1 → 10.10.1.2    TCP 83 8081 → 50872 [PSH, ACK] Seq=834 Ack=851 Win=65152 Len=17 TSval=3806066720 TSecr=1681807011
1712183548.863349438   535 1.062782476    10.10.1.2 → 10.10.1.1    TCP 83 50872 → 8081 [PSH, ACK] Seq=851 Ack=851 Win=64256 Len=17 TSval=1681807021 TSecr=3806066720
1712183550.863349438   537 1.062918257    10.10.1.1 → 10.10.1.2    TCP 83 8081 → 50872 [PSH, ACK] Seq=851 Ack=868 Win=65152 Len=17 TSval=3806066731 TSecr=1681807021
1712183558.863349438   545 1.073136949    10.10.1.2 → 10.10.1.1    TCP 83 50872 → 8081 [PSH, ACK] Seq=868 Ack=868 Win=64256 Len=17 TSval=1681807032 TSecr=3806066731
1712183560.863349438   547 1.073270942    10.10.1.1 → 10.10.1.2    TCP 83 8081 → 50872 [PSH, ACK] Seq=868 Ack=885 Win=65152 Len=17 TSval=3806066741 TSecr=1681807032
1712183568.863349438   555 1.083492949    10.10.1.2 → 10.10.1.1    TCP 83 50872 → 8081 [PSH, ACK] Seq=885 Ack=885 Win=64256 Len=17 TSval=1681807042 TSecr=3806066741
1712183570.863349438   557 1.083626720    10.10.1.1 → 10.10.1.2    TCP 83 8081 → 50872 [PSH, ACK] Seq=885 Ack=902 Win=65152 Len=17 TSval=3806066751 TSecr=1681807042
1712183578.863349438   565 1.093846659    10.10.1.2 → 10.10.1.1    TCP 83 50872 → 8081 [PSH, ACK] Seq=902 Ack=902 Win=64256 Len=17 TSval=1681807052 TSecr=3806066751
1712183580.863349438   567 1.093981361    10.10.1.1 → 10.10.1.2    TCP 83 8081 → 50872 [PSH, ACK] Seq=902 Ack=919 Win=65152 Len=17 TSval=3806066762 TSecr=1681807052
1712183588.863349438   575 1.104200233    10.10.1.2 → 10.10.1.1    TCP 83 50872 → 8081 [PSH, ACK] Seq=919 Ack=919 Win=64256 Len=17 TSval=1681807063 TSecr=3806066762
1712183590.863349438   577 1.104335844    10.10.1.1 → 10.10.1.2    TCP 83 8081 → 50872 [PSH, ACK] Seq=919 Ack=936 Win=65152 Len=17 TSval=3806066772 TSecr=1681807063
1712183598.863349438   585 1.114553777    10.10.1.2 → 10.10.1.1    TCP 83 50872 → 8081 [PSH, ACK] Seq=936 Ack=936 Win=64256 Len=17 TSval=1681807073 TSecr=3806066772
1712183600.863349438   587 1.114691913    10.10.1.1 → 10.10.1.2    TCP 83 8081 → 50872 [PSH, ACK] Seq=936 Ack=953 Win=65152 Len=17 TSval=3806066782 TSecr=1681807073
1712183608.863349438   595 1.124912711    10.10.1.2 → 10.10.1.1    TCP 83 50872 → 8081 [PSH, ACK] Seq=953 Ack=953 Win=64256 Len=17 TSval=1681807083 TSecr=3806066782
1712183611.863349438   598 1.125103313    10.10.1.1 → 10.10.1.2    TCP 83 8081 → 50872 [PSH, ACK] Seq=953 Ack=970 Win=65152 Len=17 TSval=3806066793 TSecr=1681807083
1712183618.863349438   605 1.135324855    10.10.1.2 → 10.10.1.1    TCP 83 50872 → 8081 [PSH, ACK] Seq=970 Ack=970 Win=64256 Len=17 TSval=1681807094 TSecr=3806066793
1712183620.863349438   607 1.135461657    10.10.1.1 → 10.10.1.2    TCP 83 8081 → 50872 [PSH, ACK] Seq=970 Ack=987 Win=65152 Len=17 TSval=3806066803 TSecr=1681807094
1712183628.863349438   615 1.145681732    10.10.1.2 → 10.10.1.1    TCP 83 50872 → 8081 [PSH, ACK] Seq=987 Ack=987 Win=64256 Len=17 TSval=1681807104 TSecr=3806066803
1712183630.863349438   617 1.145831876    10.10.1.1 → 10.10.1.2    TCP 83 8081 → 50872 [PSH, ACK] Seq=987 Ack=1004 Win=65152 Len=17 TSval=3806066813 TSecr=1681807104
1712183638.863349438   625 1.156051259    10.10.1.2 → 10.10.1.1    TCP 83 50872 → 8081 [PSH, ACK] Seq=1004 Ack=1004 Win=64256 Len=17 TSval=1681807115 TSecr=3806066813
1712183640.863349438   627 1.156186488    10.10.1.1 → 10.10.1.2    TCP 83 8081 → 50872 [PSH, ACK] Seq=1004 Ack=1021 Win=65152 Len=17 TSval=3806066824 TSecr=1681807115
1712183648.863349438   635 1.166406030    10.10.1.2 → 10.10.1.1    TCP 83 50872 → 8081 [PSH, ACK] Seq=1021 Ack=1021 Win=64256 Len=17 TSval=1681807125 TSecr=3806066824
1712183650.863349438   637 1.166540848    10.10.1.1 → 10.10.1.2    TCP 83 8081 → 50872 [PSH, ACK] Seq=1021 Ack=1038 Win=65152 Len=17 TSval=3806066834 TSecr=1681807125
1712183658.863349438   645 1.176759160    10.10.1.2 → 10.10.1.1    TCP 83 50872 → 8081 [PSH, ACK] Seq=1038 Ack=1038 Win=64256 Len=17 TSval=1681807135 TSecr=3806066834
1712183660.863349438   647 1.176894162    10.10.1.1 → 10.10.1.2    TCP 83 8081 → 50872 [PSH, ACK] Seq=1038 Ack=1055 Win=65152 Len=17 TSval=3806066845 TSecr=1681807135
1712183668.863349438   655 1.187116371    10.10.1.2 → 10.10.1.1    TCP 83 50872 → 8081 [PSH, ACK] Seq=1055 Ack=1055 Win=64256 Len=17 TSval=1681807146 TSecr=3806066845
1712183670.863349438   657 1.187251196    10.10.1.1 → 10.10.1.2    TCP 83 8081 → 50872 [PSH, ACK] Seq=1055 Ack=1072 Win=65152 Len=17 TSval=3806066855 TSecr=1681807146
1712183678.863349438   665 1.197469516    10.10.1.2 → 10.10.1.1    TCP 83 50872 → 8081 [PSH, ACK] Seq=1072 Ack=1072 Win=64256 Len=17 TSval=1681807156 TSecr=3806066855
1712183680.863349438   667 1.197603710    10.10.1.1 → 10.10.1.2    TCP 83 8081 → 50872 [PSH, ACK] Seq=1072 Ack=1089 Win=65152 Len=17 TSval=3806066865 TSecr=1681807156
1712183688.863349438   675 1.207827097    10.10.1.2 → 10.10.1.1    TCP 83 50872 → 8081 [PSH, ACK] Seq=1089 Ack=1089 Win=64256 Len=17 TSval=1681807166 TSecr=3806066865
1712183690.863349438   677 1.207962379    10.10.1.1 → 10.10.1.2    TCP 83 8081 → 50872 [PSH, ACK] Seq=1089 Ack=1106 Win=65152 Len=17 TSval=3806066876 TSecr=1681807166
1712183698.863349438   685 1.218182283    10.10.1.2 → 10.10.1.1    TCP 83 50872 → 8081 [PSH, ACK] Seq=1106 Ack=1106 Win=64256 Len=17 TSval=1681807177 TSecr=3806066876
1712183700.863349438   687 1.218319713    10.10.1.1 → 10.10.1.2    TCP 83 8081 → 50872 [PSH, ACK] Seq=1106 Ack=1123 Win=65152 Len=17 TSval=3806066886 TSecr=1681807177
1712183708.863349438   695 1.228540758    10.10.1.2 → 10.10.1.1    TCP 83 50872 → 8081 [PSH, ACK] Seq=1123 Ack=1123 Win=64256 Len=17 TSval=1681807187 TSecr=3806066886
1712183710.863349438   697 1.228677212    10.10.1.1 → 10.10.1.2    TCP 83 8081 → 50872 [PSH, ACK] Seq=1123 Ack=1140 Win=65152 Len=17 TSval=3806066896 TSecr=1681807187
1712183718.863349438   705 1.238896012    10.10.1.2 → 10.10.1.1    TCP 83 50872 → 8081 [PSH, ACK] Seq=1140 Ack=1140 Win=64256 Len=17 TSval=1681807197 TSecr=3806066896
1712183720.863349438   707 1.239030193    10.10.1.1 → 10.10.1.2    TCP 83 8081 → 50872 [PSH, ACK] Seq=1140 Ack=1157 Win=65152 Len=17 TSval=3806066907 TSecr=1681807197
1712183728.863349438   715 1.249251228    10.10.1.2 → 10.10.1.1    TCP 83 50872 → 8081 [PSH, ACK] Seq=1157 Ack=1157 Win=64256 Len=17 TSval=1681807208 TSecr=3806066907
1712183730.863349438   717 1.249387395    10.10.1.1 → 10.10.1.2    TCP 83 8081 → 50872 [PSH, ACK] Seq=1157 Ack=1174 Win=65152 Len=17 TSval=3806066917 TSecr=1681807208
1712183738.863349438   725 1.259618894    10.10.1.2 → 10.10.1.1    TCP 83 50872 → 8081 [PSH, ACK] Seq=1174 Ack=1174 Win=64256 Len=17 TSval=1681807218 TSecr=3806066917
1712183740.863349438   727 1.259754019    10.10.1.1 → 10.10.1.2    TCP 83 8081 → 50872 [PSH, ACK] Seq=1174 Ack=1191 Win=65152 Len=17 TSval=3806066927 TSecr=1681807218
1712183748.863349438   735 1.269972193    10.10.1.2 → 10.10.1.1    TCP 83 50872 → 8081 [PSH, ACK] Seq=1191 Ack=1191 Win=64256 Len=17 TSval=1681807228 TSecr=3806066927
1712183750.863349438   737 1.270107538    10.10.1.1 → 10.10.1.2    TCP 83 8081 → 50872 [PSH, ACK] Seq=1191 Ack=1208 Win=65152 Len=17 TSval=3806066938 TSecr=1681807228
1712183758.863349438   745 1.280327601    10.10.1.2 → 10.10.1.1    TCP 83 50872 → 8081 [PSH, ACK] Seq=1208 Ack=1208 Win=64256 Len=17 TSval=1681807239 TSecr=3806066938
1712183760.863349438   747 1.280463287    10.10.1.1 → 10.10.1.2    TCP 83 8081 → 50872 [PSH, ACK] Seq=1208 Ack=1225 Win=65152 Len=17 TSval=3806066948 TSecr=1681807239
1712183768.863349438   755 1.290684351    10.10.1.2 → 10.10.1.1    TCP 83 50872 → 8081 [PSH, ACK] Seq=1225 Ack=1225 Win=64256 Len=17 TSval=1681807249 TSecr=3806066948
1712183770.863349438   757 1.290818396    10.10.1.1 → 10.10.1.2    TCP 83 8081 → 50872 [PSH, ACK] Seq=1225 Ack=1242 Win=65152 Len=17 TSval=3806066958 TSecr=1681807249
1712183778.863349438   765 1.301044390    10.10.1.2 → 10.10.1.1    TCP 83 50872 → 8081 [PSH, ACK] Seq=1242 Ack=1242 Win=64256 Len=17 TSval=1681807260 TSecr=3806066958
1712183780.863349438   767 1.301179430    10.10.1.1 → 10.10.1.2    TCP 83 8081 → 50872 [PSH, ACK] Seq=1242 Ack=1259 Win=65152 Len=17 TSval=3806066969 TSecr=1681807260
1712183788.863349438   775 1.311401164    10.10.1.2 → 10.10.1.1    TCP 83 50872 → 8081 [PSH, ACK] Seq=1259 Ack=1259 Win=64256 Len=17 TSval=1681807270 TSecr=3806066969
1712183790.863349438   777 1.311536801    10.10.1.1 → 10.10.1.2    TCP 83 8081 → 50872 [PSH, ACK] Seq=1259 Ack=1276 Win=65152 Len=17 TSval=3806066979 TSecr=1681807270
1712183798.863349438   785 1.321758081    10.10.1.2 → 10.10.1.1    TCP 83 50872 → 8081 [PSH, ACK] Seq=1276 Ack=1276 Win=64256 Len=17 TSval=1681807280 TSecr=3806066979
1712183800.863349438   787 1.321894473    10.10.1.1 → 10.10.1.2    TCP 83 8081 → 50872 [PSH, ACK] Seq=1276 Ack=1293 Win=65152 Len=17 TSval=3806066990 TSecr=1681807280
1712183808.863349438   795 1.332115832    10.10.1.2 → 10.10.1.1    TCP 83 50872 → 8081 [PSH, ACK] Seq=1293 Ack=1293 Win=64256 Len=17 TSval=1681807291 TSecr=3806066990
1712183810.863349438   797 1.332250393    10.10.1.1 → 10.10.1.2    TCP 83 8081 → 50872 [PSH, ACK] Seq=1293 Ack=1310 Win=65152 Len=17 TSval=3806067000 TSecr=1681807291
1712183818.863349438   805 1.342470576    10.10.1.2 → 10.10.1.1    TCP 83 50872 → 8081 [PSH, ACK] Seq=1310 Ack=1310 Win=64256 Len=17 TSval=1681807301 TSecr=3806067000
1712183820.863349438   807 1.342606461    10.10.1.1 → 10.10.1.2    TCP 83 8081 → 50872 [PSH, ACK] Seq=1310 Ack=1327 Win=65152 Len=17 TSval=3806067010 TSecr=1681807301
1712183828.863349438   815 1.352828780    10.10.1.2 → 10.10.1.1    TCP 83 50872 → 8081 [PSH, ACK] Seq=1327 Ack=1327 Win=64256 Len=17 TSval=1681807311 TSecr=3806067010
1712183830.863349438   817 1.352966770    10.10.1.1 → 10.10.1.2    TCP 83 8081 → 50872 [PSH, ACK] Seq=1327 Ack=1344 Win=65152 Len=17 TSval=3806067021 TSecr=1681807311
1712183838.863349438   825 1.363189243    10.10.1.2 → 10.10.1.1    TCP 83 50872 → 8081 [PSH, ACK] Seq=1344 Ack=1344 Win=64256 Len=17 TSval=1681807322 TSecr=3806067021
1712183840.863349438   827 1.363323155    10.10.1.1 → 10.10.1.2    TCP 83 8081 → 50872 [PSH, ACK] Seq=1344 Ack=1361 Win=65152 Len=17 TSval=3806067031 TSecr=1681807322
1712183848.863349438   835 1.373541288    10.10.1.2 → 10.10.1.1    TCP 83 50872 → 8081 [PSH, ACK] Seq=1361 Ack=1361 Win=64256 Len=17 TSval=1681807332 TSecr=3806067031
1712183850.863349438   837 1.373678929    10.10.1.1 → 10.10.1.2    TCP 83 8081 → 50872 [PSH, ACK] Seq=1361 Ack=1378 Win=65152 Len=17 TSval=3806067041 TSecr=1681807332
1712183858.863349438   845 1.383899205    10.10.1.2 → 10.10.1.1    TCP 83 50872 → 8081 [PSH, ACK] Seq=1378 Ack=1378 Win=64256 Len=17 TSval=1681807342 TSecr=3806067041
1712183860.863349438   847 1.384030443    10.10.1.1 → 10.10.1.2    TCP 83 8081 → 50872 [PSH, ACK] Seq=1378 Ack=1395 Win=65152 Len=17 TSval=3806067052 TSecr=1681807342
1712183868.863349438   855 1.394251911    10.10.1.2 → 10.10.1.1    TCP 83 50872 → 8081 [PSH, ACK] Seq=1395 Ack=1395 Win=64256 Len=17 TSval=1681807353 TSecr=3806067052
1712183870.863349438   857 1.394387241    10.10.1.1 → 10.10.1.2    TCP 83 8081 → 50872 [PSH, ACK] Seq=1395 Ack=1412 Win=65152 Len=17 TSval=3806067062 TSecr=1681807353
1712183878.863349438   865 1.404609045    10.10.1.2 → 10.10.1.1    TCP 83 50872 → 8081 [PSH, ACK] Seq=1412 Ack=1412 Win=64256 Len=17 TSval=1681807363 TSecr=3806067062
1712183880.863349438   867 1.404744851    10.10.1.1 → 10.10.1.2    TCP 83 8081 → 50872 [PSH, ACK] Seq=1412 Ack=1429 Win=65152 Len=17 TSval=3806067072 TSecr=1681807363
1712183888.863349438   875 1.414974868    10.10.1.2 → 10.10.1.1    TCP 83 50872 → 8081 [PSH, ACK] Seq=1429 Ack=1429 Win=64256 Len=17 TSval=1681807373 TSecr=3806067072
1712183890.863349438   877 1.415112801    10.10.1.1 → 10.10.1.2    TCP 83 8081 → 50872 [PSH, ACK] Seq=1429 Ack=1446 Win=65152 Len=17 TSval=3806067083 TSecr=1681807373
1712183898.863349438   885 1.425337727    10.10.1.2 → 10.10.1.1    TCP 83 50872 → 8081 [PSH, ACK] Seq=1446 Ack=1446 Win=64256 Len=17 TSval=1681807384 TSecr=3806067083
1712183900.863349438   887 1.425472986    10.10.1.1 → 10.10.1.2    TCP 83 8081 → 50872 [PSH, ACK] Seq=1446 Ack=1463 Win=65152 Len=17 TSval=3806067093 TSecr=1681807384
1712183908.863349438   895 1.435695172    10.10.1.2 → 10.10.1.1    TCP 83 50872 → 8081 [PSH, ACK] Seq=1463 Ack=1463 Win=64256 Len=17 TSval=1681807394 TSecr=3806067093
1712183910.863349438   897 1.435830796    10.10.1.1 → 10.10.1.2    TCP 83 8081 → 50872 [PSH, ACK] Seq=1463 Ack=1480 Win=65152 Len=17 TSval=3806067104 TSecr=1681807394
1712183918.863349438   905 1.446053235    10.10.1.2 → 10.10.1.1    TCP 83 50872 → 8081 [PSH, ACK] Seq=1480 Ack=1480 Win=64256 Len=17 TSval=1681807405 TSecr=3806067104
1712183920.863349438   907 1.446187631    10.10.1.1 → 10.10.1.2    TCP 83 8081 → 50872 [PSH, ACK] Seq=1480 Ack=1497 Win=65152 Len=17 TSval=3806067114 TSecr=1681807405
1712183928.863349438   915 1.456408628    10.10.1.2 → 10.10.1.1    TCP 83 50872 → 8081 [PSH, ACK] Seq=1497 Ack=1497 Win=64256 Len=17 TSval=1681807415 TSecr=3806067114
1712183930.863349438   917 1.456544197    10.10.1.1 → 10.10.1.2    TCP 83 8081 → 50872 [PSH, ACK] Seq=1497 Ack=1514 Win=65152 Len=17 TSval=3806067124 TSecr=1681807415
1712183938.863349438   925 1.466764090    10.10.1.2 → 10.10.1.1    TCP 83 50872 → 8081 [PSH, ACK] Seq=1514 Ack=1514 Win=64256 Len=17 TSval=1681807425 TSecr=3806067124
1712183940.863349438   927 1.466900119    10.10.1.1 → 10.10.1.2    TCP 83 8081 → 50872 [PSH, ACK] Seq=1514 Ack=1531 Win=65152 Len=17 TSval=3806067135 TSecr=1681807425
1712183948.863349438   935 1.477118807    10.10.1.2 → 10.10.1.1    TCP 83 50872 → 8081 [PSH, ACK] Seq=1531 Ack=1531 Win=64256 Len=17 TSval=1681807436 TSecr=3806067135
1712183950.863349438   937 1.477253634    10.10.1.1 → 10.10.1.2    TCP 83 8081 → 50872 [PSH, ACK] Seq=1531 Ack=1548 Win=65152 Len=17 TSval=3806067145 TSecr=1681807436
1712183958.863349438   945 1.487476437    10.10.1.2 → 10.10.1.1    TCP 83 50872 → 8081 [PSH, ACK] Seq=1548 Ack=1548 Win=64256 Len=17 TSval=1681807446 TSecr=3806067145
1712183960.863349438   947 1.487612146    10.10.1.1 → 10.10.1.2    TCP 83 8081 → 50872 [PSH, ACK] Seq=1548 Ack=1565 Win=65152 Len=17 TSval=3806067155 TSecr=1681807446
1712183968.863349438   955 1.497832606    10.10.1.2 → 10.10.1.1    TCP 83 50872 → 8081 [PSH, ACK] Seq=1565 Ack=1565 Win=64256 Len=17 TSval=1681807456 TSecr=3806067155
1712183970.863349438   957 1.497966357    10.10.1.1 → 10.10.1.2    TCP 83 8081 → 50872 [PSH, ACK] Seq=1565 Ack=1582 Win=65152 Len=17 TSval=3806067166 TSecr=1681807456
1712183978.863349438   965 1.508185824    10.10.1.2 → 10.10.1.1    TCP 83 50872 → 8081 [PSH, ACK] Seq=1582 Ack=1582 Win=64256 Len=17 TSval=1681807467 TSecr=3806067166
1712183980.863349438   967 1.508319722    10.10.1.1 → 10.10.1.2    TCP 83 8081 → 50872 [PSH, ACK] Seq=1582 Ack=1599 Win=65152 Len=17 TSval=3806067176 TSecr=1681807467
1712183988.863349438   975 1.518537667    10.10.1.2 → 10.10.1.1    TCP 83 50872 → 8081 [PSH, ACK] Seq=1599 Ack=1599 Win=64256 Len=17 TSval=1681807477 TSecr=3806067176
1712183990.863349438   977 1.518673255    10.10.1.1 → 10.10.1.2    TCP 83 8081 → 50872 [PSH, ACK] Seq=1599 Ack=1616 Win=65152 Len=17 TSval=3806067186 TSecr=1681807477
1712183998.863349438   985 1.528895058    10.10.1.2 → 10.10.1.1    TCP 83 50872 → 8081 [PSH, ACK] Seq=1616 Ack=1616 Win=64256 Len=17 TSval=1681807487 TSecr=3806067186
1712184000.863349438   987 1.529030065    10.10.1.1 → 10.10.1.2    TCP 83 8081 → 50872 [PSH, ACK] Seq=1616 Ack=1633 Win=65152 Len=17 TSval=3806067197 TSecr=1681807487
1712184008.863349438   995 1.539251526    10.10.1.2 → 10.10.1.1    TCP 83 50872 → 8081 [PSH, ACK] Seq=1633 Ack=1633 Win=64256 Len=17 TSval=1681807498 TSecr=3806067197
1712184010.863349438   997 1.539385017    10.10.1.1 → 10.10.1.2    TCP 83 8081 → 50872 [PSH, ACK] Seq=1633 Ack=1650 Win=65152 Len=17 TSval=3806067207 TSecr=1681807498
1712184018.863349438  1005 1.549605575    10.10.1.2 → 10.10.1.1    TCP 83 50872 → 8081 [PSH, ACK] Seq=1650 Ack=1650 Win=64256 Len=17 TSval=1681807508 TSecr=3806067207
1712184020.863349438  1007 1.549748198    10.10.1.1 → 10.10.1.2    TCP 83 8081 → 50872 [PSH, ACK] Seq=1650 Ack=1667 Win=65152 Len=17 TSval=3806067217 TSecr=1681807508
1712184028.863349438  1015 1.559966754    10.10.1.2 → 10.10.1.1    TCP 83 50872 → 8081 [PSH, ACK] Seq=1667 Ack=1667 Win=64256 Len=17 TSval=1681807518 TSecr=3806067217
1712184030.863349438  1017 1.560102121    10.10.1.1 → 10.10.1.2    TCP 83 8081 → 50872 [PSH, ACK] Seq=1667 Ack=1684 Win=65152 Len=17 TSval=3806067228 TSecr=1681807518
1712184038.863349438  1025 1.570323168    10.10.1.2 → 10.10.1.1    TCP 83 50872 → 8081 [PSH, ACK] Seq=1684 Ack=1684 Win=64256 Len=17 TSval=1681807529 TSecr=3806067228
1712184040.863349438  1027 1.570459185    10.10.1.1 → 10.10.1.2    TCP 83 8081 → 50872 [PSH, ACK] Seq=1684 Ack=1701 Win=65152 Len=17 TSval=3806067238 TSecr=1681807529
1712184048.863349438  1035 1.580679030    10.10.1.2 → 10.10.1.1    TCP 83 50872 → 8081 [PSH, ACK] Seq=1701 Ack=1701 Win=64256 Len=17 TSval=1681807539 TSecr=3806067238
1712184050.863349438  1037 1.580813632    10.10.1.1 → 10.10.1.2    TCP 83 8081 → 50872 [PSH, ACK] Seq=1701 Ack=1718 Win=65152 Len=17 TSval=3806067248 TSecr=1681807539
1712184058.863349438  1045 1.591033790    10.10.1.2 → 10.10.1.1    TCP 83 50872 → 8081 [PSH, ACK] Seq=1718 Ack=1718 Win=64256 Len=17 TSval=1681807549 TSecr=3806067248
1712184060.863349438  1047 1.591169366    10.10.1.1 → 10.10.1.2    TCP 83 8081 → 50872 [PSH, ACK] Seq=1718 Ack=1735 Win=65152 Len=17 TSval=3806067259 TSecr=1681807549
1712184068.863349438  1055 1.601390771    10.10.1.2 → 10.10.1.1    TCP 83 50872 → 8081 [PSH, ACK] Seq=1735 Ack=1735 Win=64256 Len=17 TSval=1681807560 TSecr=3806067259
1712184070.863349438  1057 1.601524425    10.10.1.1 → 10.10.1.2    TCP 83 8081 → 50872 [PSH, ACK] Seq=1735 Ack=1752 Win=65152 Len=17 TSval=3806067269 TSecr=1681807560
1712184078.863349438  1065 1.611745905    10.10.1.2 → 10.10.1.1    TCP 83 50872 → 8081 [PSH, ACK] Seq=1752 Ack=1752 Win=64256 Len=17 TSval=1681807570 TSecr=3806067269
1712184080.863349438  1067 1.611881215    10.10.1.1 → 10.10.1.2    TCP 83 8081 → 50872 [PSH, ACK] Seq=1752 Ack=1769 Win=65152 Len=17 TSval=3806067280 TSecr=1681807570
1712184088.863349438  1075 1.622101297    10.10.1.2 → 10.10.1.1    TCP 83 50872 → 8081 [PSH, ACK] Seq=1769 Ack=1769 Win=64256 Len=17 TSval=1681807581 TSecr=3806067280
1712184090.863349438  1077 1.622237304    10.10.1.1 → 10.10.1.2    TCP 83 8081 → 50872 [PSH, ACK] Seq=1769 Ack=1786 Win=65152 Len=17 TSval=3806067290 TSecr=1681807581
1712184098.863349438  1085 1.632458526    10.10.1.2 → 10.10.1.1    TCP 83 50872 → 8081 [PSH, ACK] Seq=1786 Ack=1786 Win=64256 Len=17 TSval=1681807591 TSecr=3806067290
1712184100.863349438  1087 1.632592813    10.10.1.1 → 10.10.1.2    TCP 83 8081 → 50872 [PSH, ACK] Seq=1786 Ack=1803 Win=65152 Len=17 TSval=3806067300 TSecr=1681807591
1712184108.863349438  1095 1.642814587    10.10.1.2 → 10.10.1.1    TCP 83 50872 → 8081 [PSH, ACK] Seq=1803 Ack=1803 Win=64256 Len=17 TSval=1681807601 TSecr=3806067300
1712184110.863349438  1097 1.642948212    10.10.1.1 → 10.10.1.2    TCP 83 8081 → 50872 [PSH, ACK] Seq=1803 Ack=1820 Win=65152 Len=17 TSval=3806067311 TSecr=1681807601
1712184118.863349438  1105 1.653169879    10.10.1.2 → 10.10.1.1    TCP 83 50872 → 8081 [PSH, ACK] Seq=1820 Ack=1820 Win=64256 Len=17 TSval=1681807612 TSecr=3806067311
1712184120.863349438  1107 1.653303486    10.10.1.1 → 10.10.1.2    TCP 83 8081 → 50872 [PSH, ACK] Seq=1820 Ack=1837 Win=65152 Len=17 TSval=3806067321 TSecr=1681807612
1712184128.863349438  1115 1.663524095    10.10.1.2 → 10.10.1.1    TCP 83 50872 → 8081 [PSH, ACK] Seq=1837 Ack=1837 Win=64256 Len=17 TSval=1681807622 TSecr=3806067321
1712184130.863349438  1117 1.663660891    10.10.1.1 → 10.10.1.2    TCP 83 8081 → 50872 [PSH, ACK] Seq=1837 Ack=1854 Win=65152 Len=17 TSval=3806067331 TSecr=1681807622
1712184138.863349438  1125 1.673891533    10.10.1.2 → 10.10.1.1    TCP 83 50872 → 8081 [PSH, ACK] Seq=1854 Ack=1854 Win=64256 Len=17 TSval=1681807632 TSecr=3806067331
1712184140.863349438  1127 1.674029155    10.10.1.1 → 10.10.1.2    TCP 83 8081 → 50872 [PSH, ACK] Seq=1854 Ack=1871 Win=65152 Len=17 TSval=3806067342 TSecr=1681807632
1712184148.863349438  1135 1.684256422    10.10.1.2 → 10.10.1.1    TCP 83 50872 → 8081 [PSH, ACK] Seq=1871 Ack=1871 Win=64256 Len=17 TSval=1681807643 TSecr=3806067342
1712184150.863349438  1137 1.684391132    10.10.1.1 → 10.10.1.2    TCP 83 8081 → 50872 [PSH, ACK] Seq=1871 Ack=1888 Win=65152 Len=17 TSval=3806067352 TSecr=1681807643
1712184158.863349438  1145 1.694618898    10.10.1.2 → 10.10.1.1    TCP 83 50872 → 8081 [PSH, ACK] Seq=1888 Ack=1888 Win=64256 Len=17 TSval=1681807653 TSecr=3806067352
1712184160.863349438  1147 1.694756133    10.10.1.1 → 10.10.1.2    TCP 83 8081 → 50872 [PSH, ACK] Seq=1888 Ack=1905 Win=65152 Len=17 TSval=3806067362 TSecr=1681807653
1712184168.863349438  1155 1.704976872    10.10.1.2 → 10.10.1.1    TCP 83 50872 → 8081 [PSH, ACK] Seq=1905 Ack=1905 Win=64256 Len=17 TSval=1681807663 TSecr=3806067362
1712184170.863349438  1157 1.705111452    10.10.1.1 → 10.10.1.2    TCP 83 8081 → 50872 [PSH, ACK] Seq=1905 Ack=1922 Win=65152 Len=17 TSval=3806067373 TSecr=1681807663
1712184178.863349438  1165 1.715334137    10.10.1.2 → 10.10.1.1    TCP 83 50872 → 8081 [PSH, ACK] Seq=1922 Ack=1922 Win=64256 Len=17 TSval=1681807674 TSecr=3806067373
1712184181.863349438  1168 1.715521372    10.10.1.1 → 10.10.1.2    TCP 83 8081 → 50872 [PSH, ACK] Seq=1922 Ack=1939 Win=65152 Len=17 TSval=3806067383 TSecr=1681807674
1712184188.863349438  1175 1.725742454    10.10.1.2 → 10.10.1.1    TCP 83 50872 → 8081 [PSH, ACK] Seq=1939 Ack=1939 Win=64256 Len=17 TSval=1681807684 TSecr=3806067383
1712184190.863349438  1177 1.725879812    10.10.1.1 → 10.10.1.2    TCP 83 8081 → 50872 [PSH, ACK] Seq=1939 Ack=1956 Win=65152 Len=17 TSval=3806067394 TSecr=1681807684
1712184198.863349438  1185 1.736103275    10.10.1.2 → 10.10.1.1    TCP 83 50872 → 8081 [PSH, ACK] Seq=1956 Ack=1956 Win=64256 Len=17 TSval=1681807695 TSecr=3806067394
1712184200.863349438  1187 1.736236980    10.10.1.1 → 10.10.1.2    TCP 83 8081 → 50872 [PSH, ACK] Seq=1956 Ack=1973 Win=65152 Len=17 TSval=3806067404 TSecr=1681807695
1712184208.863349438  1195 1.746457621    10.10.1.2 → 10.10.1.1    TCP 83 50872 → 8081 [PSH, ACK] Seq=1973 Ack=1973 Win=64256 Len=17 TSval=1681807705 TSecr=3806067404
1712184210.863349438  1197 1.746592469    10.10.1.1 → 10.10.1.2    TCP 83 8081 → 50872 [PSH, ACK] Seq=1973 Ack=1990 Win=65152 Len=17 TSval=3806067414 TSecr=1681807705
1712184218.863349438  1205 1.756811983    10.10.1.2 → 10.10.1.1    TCP 83 50872 → 8081 [PSH, ACK] Seq=1990 Ack=1990 Win=64256 Len=17 TSval=1681807715 TSecr=3806067414
1712184220.863349438  1207 1.756946499    10.10.1.1 → 10.10.1.2    TCP 83 8081 → 50872 [PSH, ACK] Seq=1990 Ack=2007 Win=65152 Len=17 TSval=3806067425 TSecr=1681807715
