1711548919.371618986    21 0.263125506    10.10.1.2 → 10.10.1.1    TCP 74 37180 → 8081 [SYN] Seq=0 Win=64240 Len=0 MSS=1460 SACK_PERM=1 TSval=1047690679 TSecr=0 WS=128
1711548921.371618986    23 0.263150397    10.10.1.1 → 10.10.1.2    TCP 74 8081 → 37180 [SYN, ACK] Seq=0 Ack=1 Win=65160 Len=0 MSS=1460 SACK_PERM=1 TSval=3171950390 TSecr=1047690679 WS=128
1711548922.371618986    24 0.263251919    10.10.1.2 → 10.10.1.1    TCP 66 37180 → 8081 [ACK] Seq=1 Ack=1 Win=64256 Len=0 TSval=1047690679 TSecr=3171950390
1711548926.371618986    28 0.521871915    10.10.1.2 → 10.10.1.1    TCP 83 37180 → 8081 [PSH, ACK] Seq=1 Ack=1 Win=64256 Len=17 TSval=1047690938 TSecr=3171950390
1711548928.371618986    30 0.521899769    10.10.1.1 → 10.10.1.2    TCP 66 8081 → 37180 [ACK] Seq=1 Ack=18 Win=65152 Len=0 TSval=3171950649 TSecr=1047690938
1711548930.371618986    32 0.522158299    10.10.1.1 → 10.10.1.2    TCP 83 8081 → 37180 [PSH, ACK] Seq=1 Ack=18 Win=65152 Len=17 TSval=3171950649 TSecr=1047690938
1711548931.371618986    33 0.522189510    10.10.1.2 → 10.10.1.1    TCP 66 37180 → 8081 [ACK] Seq=18 Ack=18 Win=64256 Len=0 TSval=1047690938 TSecr=3171950649
1711548936.371618986    38 0.532373474    10.10.1.2 → 10.10.1.1    TCP 83 37180 → 8081 [PSH, ACK] Seq=18 Ack=18 Win=64256 Len=17 TSval=1047690948 TSecr=3171950649
1711548939.371618986    41 0.532470609    10.10.1.1 → 10.10.1.2    TCP 83 8081 → 37180 [PSH, ACK] Seq=18 Ack=35 Win=65152 Len=17 TSval=3171950660 TSecr=1047690948
1711548944.371618986    46 0.542680175    10.10.1.2 → 10.10.1.1    TCP 83 37180 → 8081 [PSH, ACK] Seq=35 Ack=35 Win=64256 Len=17 TSval=1047690959 TSecr=3171950660
1711548947.371618986    49 0.542784936    10.10.1.1 → 10.10.1.2    TCP 83 8081 → 37180 [PSH, ACK] Seq=35 Ack=52 Win=65152 Len=17 TSval=3171950670 TSecr=1047690959
1711548952.371618986    54 0.552995897    10.10.1.2 → 10.10.1.1    TCP 83 37180 → 8081 [PSH, ACK] Seq=52 Ack=52 Win=64256 Len=17 TSval=1047690969 TSecr=3171950670
1711548955.371618986    57 0.553097259    10.10.1.1 → 10.10.1.2    TCP 83 8081 → 37180 [PSH, ACK] Seq=52 Ack=69 Win=65152 Len=17 TSval=3171950680 TSecr=1047690969
1711548960.371618986    62 0.563307667    10.10.1.2 → 10.10.1.1    TCP 83 37180 → 8081 [PSH, ACK] Seq=69 Ack=69 Win=64256 Len=17 TSval=1047690979 TSecr=3171950680
1711548963.371618986    65 0.563439209    10.10.1.1 → 10.10.1.2    TCP 83 8081 → 37180 [PSH, ACK] Seq=69 Ack=86 Win=65152 Len=17 TSval=3171950691 TSecr=1047690979
1711548968.371618986    70 0.573649424    10.10.1.2 → 10.10.1.1    TCP 83 37180 → 8081 [PSH, ACK] Seq=86 Ack=86 Win=64256 Len=17 TSval=1047690990 TSecr=3171950691
1711548970.371618986    72 0.573778287    10.10.1.1 → 10.10.1.2    TCP 83 8081 → 37180 [PSH, ACK] Seq=86 Ack=103 Win=65152 Len=17 TSval=3171950701 TSecr=1047690990
1711548976.371618986    78 0.583987818    10.10.1.2 → 10.10.1.1    TCP 83 37180 → 8081 [PSH, ACK] Seq=103 Ack=103 Win=64256 Len=17 TSval=1047691000 TSecr=3171950701
1711548978.371618986    80 0.584118400    10.10.1.1 → 10.10.1.2    TCP 83 8081 → 37180 [PSH, ACK] Seq=103 Ack=120 Win=65152 Len=17 TSval=3171950711 TSecr=1047691000
1711548984.371618986    86 0.594327215    10.10.1.2 → 10.10.1.1    TCP 83 37180 → 8081 [PSH, ACK] Seq=120 Ack=120 Win=64256 Len=17 TSval=1047691010 TSecr=3171950711
1711548986.371618986    88 0.594459440    10.10.1.1 → 10.10.1.2    TCP 83 8081 → 37180 [PSH, ACK] Seq=120 Ack=137 Win=65152 Len=17 TSval=3171950722 TSecr=1047691010
1711548992.371618986    94 0.604669536    10.10.1.2 → 10.10.1.1    TCP 83 37180 → 8081 [PSH, ACK] Seq=137 Ack=137 Win=64256 Len=17 TSval=1047691021 TSecr=3171950722
1711548994.371618986    96 0.604799217    10.10.1.1 → 10.10.1.2    TCP 83 8081 → 37180 [PSH, ACK] Seq=137 Ack=154 Win=65152 Len=17 TSval=3171950732 TSecr=1047691021
1711549000.371618986   102 0.615012233    10.10.1.2 → 10.10.1.1    TCP 83 37180 → 8081 [PSH, ACK] Seq=154 Ack=154 Win=64256 Len=17 TSval=1047691031 TSecr=3171950732
1711549002.371618986   104 0.615112744    10.10.1.1 → 10.10.1.2    TCP 83 8081 → 37180 [PSH, ACK] Seq=154 Ack=171 Win=65152 Len=17 TSval=3171950742 TSecr=1047691031
1711549008.371618986   110 0.625323524    10.10.1.2 → 10.10.1.1    TCP 83 37180 → 8081 [PSH, ACK] Seq=171 Ack=171 Win=64256 Len=17 TSval=1047691041 TSecr=3171950742
1711549010.371618986   112 0.625426637    10.10.1.1 → 10.10.1.2    TCP 83 8081 → 37180 [PSH, ACK] Seq=171 Ack=188 Win=65152 Len=17 TSval=3171950753 TSecr=1047691041
1711549016.371618986   118 0.635637452    10.10.1.2 → 10.10.1.1    TCP 83 37180 → 8081 [PSH, ACK] Seq=188 Ack=188 Win=64256 Len=17 TSval=1047691052 TSecr=3171950753
1711549018.371618986   120 0.635738428    10.10.1.1 → 10.10.1.2    TCP 83 8081 → 37180 [PSH, ACK] Seq=188 Ack=205 Win=65152 Len=17 TSval=3171950763 TSecr=1047691052
1711549024.371618986   126 0.645949896    10.10.1.2 → 10.10.1.1    TCP 83 37180 → 8081 [PSH, ACK] Seq=205 Ack=205 Win=64256 Len=17 TSval=1047691062 TSecr=3171950763
1711549026.371618986   128 0.646051804    10.10.1.1 → 10.10.1.2    TCP 83 8081 → 37180 [PSH, ACK] Seq=205 Ack=222 Win=65152 Len=17 TSval=3171950773 TSecr=1047691062
1711549032.371618986   134 0.656263793    10.10.1.2 → 10.10.1.1    TCP 83 37180 → 8081 [PSH, ACK] Seq=222 Ack=222 Win=64256 Len=17 TSval=1047691072 TSecr=3171950773
1711549034.371618986   136 0.656365857    10.10.1.1 → 10.10.1.2    TCP 83 8081 → 37180 [PSH, ACK] Seq=222 Ack=239 Win=65152 Len=17 TSval=3171950783 TSecr=1047691072
1711549040.371618986   142 0.666577022    10.10.1.2 → 10.10.1.1    TCP 83 37180 → 8081 [PSH, ACK] Seq=239 Ack=239 Win=64256 Len=17 TSval=1047691083 TSecr=3171950783
1711549042.371618986   144 0.666678578    10.10.1.1 → 10.10.1.2    TCP 83 8081 → 37180 [PSH, ACK] Seq=239 Ack=256 Win=65152 Len=17 TSval=3171950794 TSecr=1047691083
1711549049.371618986   151 0.676886237    10.10.1.2 → 10.10.1.1    TCP 83 37180 → 8081 [PSH, ACK] Seq=256 Ack=256 Win=64256 Len=17 TSval=1047691093 TSecr=3171950794
1711549051.371618986   153 0.676989683    10.10.1.1 → 10.10.1.2    TCP 83 8081 → 37180 [PSH, ACK] Seq=256 Ack=273 Win=65152 Len=17 TSval=3171950804 TSecr=1047691093
1711549057.371618986   159 0.687199389    10.10.1.2 → 10.10.1.1    TCP 83 37180 → 8081 [PSH, ACK] Seq=273 Ack=273 Win=64256 Len=17 TSval=1047691103 TSecr=3171950804
1711549059.371618986   161 0.687302316    10.10.1.1 → 10.10.1.2    TCP 83 8081 → 37180 [PSH, ACK] Seq=273 Ack=290 Win=65152 Len=17 TSval=3171950814 TSecr=1047691103
1711549065.371618986   167 0.697494645    10.10.1.2 → 10.10.1.1    TCP 83 37180 → 8081 [PSH, ACK] Seq=290 Ack=290 Win=64256 Len=17 TSval=1047691114 TSecr=3171950814
1711549067.371618986   169 0.697596199    10.10.1.1 → 10.10.1.2    TCP 83 8081 → 37180 [PSH, ACK] Seq=290 Ack=307 Win=65152 Len=17 TSval=3171950825 TSecr=1047691114
1711549073.371618986   175 0.707807531    10.10.1.2 → 10.10.1.1    TCP 83 37180 → 8081 [PSH, ACK] Seq=307 Ack=307 Win=64256 Len=17 TSval=1047691124 TSecr=3171950825
1711549075.371618986   177 0.707908662    10.10.1.1 → 10.10.1.2    TCP 83 8081 → 37180 [PSH, ACK] Seq=307 Ack=324 Win=65152 Len=17 TSval=3171950835 TSecr=1047691124
1711549081.371618986   183 0.718119742    10.10.1.2 → 10.10.1.1    TCP 83 37180 → 8081 [PSH, ACK] Seq=324 Ack=324 Win=64256 Len=17 TSval=1047691134 TSecr=3171950835
1711549083.371618986   185 0.718220329    10.10.1.1 → 10.10.1.2    TCP 83 8081 → 37180 [PSH, ACK] Seq=324 Ack=341 Win=65152 Len=17 TSval=3171950845 TSecr=1047691134
1711549089.371618986   191 0.728428843    10.10.1.2 → 10.10.1.1    TCP 83 37180 → 8081 [PSH, ACK] Seq=341 Ack=341 Win=64256 Len=17 TSval=1047691144 TSecr=3171950845
1711549091.371618986   193 0.728531946    10.10.1.1 → 10.10.1.2    TCP 83 8081 → 37180 [PSH, ACK] Seq=341 Ack=358 Win=65152 Len=17 TSval=3171950856 TSecr=1047691144
1711549097.371618986   199 0.738743307    10.10.1.2 → 10.10.1.1    TCP 83 37180 → 8081 [PSH, ACK] Seq=358 Ack=358 Win=64256 Len=17 TSval=1047691155 TSecr=3171950856
1711549099.371618986   201 0.738843778    10.10.1.1 → 10.10.1.2    TCP 83 8081 → 37180 [PSH, ACK] Seq=358 Ack=375 Win=65152 Len=17 TSval=3171950866 TSecr=1047691155
1711549105.371618986   207 0.749055623    10.10.1.2 → 10.10.1.1    TCP 83 37180 → 8081 [PSH, ACK] Seq=375 Ack=375 Win=64256 Len=17 TSval=1047691165 TSecr=3171950866
1711549107.371618986   209 0.749158615    10.10.1.1 → 10.10.1.2    TCP 83 8081 → 37180 [PSH, ACK] Seq=375 Ack=392 Win=65152 Len=17 TSval=3171950876 TSecr=1047691165
1711549113.371618986   215 0.759367894    10.10.1.2 → 10.10.1.1    TCP 83 37180 → 8081 [PSH, ACK] Seq=392 Ack=392 Win=64256 Len=17 TSval=1047691175 TSecr=3171950876
1711549115.371618986   217 0.759470358    10.10.1.1 → 10.10.1.2    TCP 83 8081 → 37180 [PSH, ACK] Seq=392 Ack=409 Win=65152 Len=17 TSval=3171950887 TSecr=1047691175
1711549121.371618986   223 0.769681095    10.10.1.2 → 10.10.1.1    TCP 83 37180 → 8081 [PSH, ACK] Seq=409 Ack=409 Win=64256 Len=17 TSval=1047691186 TSecr=3171950887
1711549123.371618986   225 0.769782650    10.10.1.1 → 10.10.1.2    TCP 83 8081 → 37180 [PSH, ACK] Seq=409 Ack=426 Win=65152 Len=17 TSval=3171950897 TSecr=1047691186
1711549129.371618986   231 0.780004762    10.10.1.2 → 10.10.1.1    TCP 83 37180 → 8081 [PSH, ACK] Seq=426 Ack=426 Win=64256 Len=17 TSval=1047691196 TSecr=3171950897
1711549131.371618986   233 0.780103530    10.10.1.1 → 10.10.1.2    TCP 83 8081 → 37180 [PSH, ACK] Seq=426 Ack=443 Win=65152 Len=17 TSval=3171950907 TSecr=1047691196
1711549137.371618986   239 0.790313017    10.10.1.2 → 10.10.1.1    TCP 83 37180 → 8081 [PSH, ACK] Seq=443 Ack=443 Win=64256 Len=17 TSval=1047691206 TSecr=3171950907
1711549139.371618986   241 0.790448650    10.10.1.1 → 10.10.1.2    TCP 83 8081 → 37180 [PSH, ACK] Seq=443 Ack=460 Win=65152 Len=17 TSval=3171950918 TSecr=1047691206
1711549145.371618986   247 0.800658268    10.10.1.2 → 10.10.1.1    TCP 83 37180 → 8081 [PSH, ACK] Seq=460 Ack=460 Win=64256 Len=17 TSval=1047691217 TSecr=3171950918
1711549147.371618986   249 0.800760669    10.10.1.1 → 10.10.1.2    TCP 83 8081 → 37180 [PSH, ACK] Seq=460 Ack=477 Win=65152 Len=17 TSval=3171950928 TSecr=1047691217
1711549153.371618986   255 0.810974082    10.10.1.2 → 10.10.1.1    TCP 83 37180 → 8081 [PSH, ACK] Seq=477 Ack=477 Win=64256 Len=17 TSval=1047691227 TSecr=3171950928
1711549155.371618986   257 0.811075014    10.10.1.1 → 10.10.1.2    TCP 83 8081 → 37180 [PSH, ACK] Seq=477 Ack=494 Win=65152 Len=17 TSval=3171950938 TSecr=1047691227
1711549161.371618986   263 0.821287092    10.10.1.2 → 10.10.1.1    TCP 83 37180 → 8081 [PSH, ACK] Seq=494 Ack=494 Win=64256 Len=17 TSval=1047691237 TSecr=3171950938
1711549163.371618986   265 0.821404739    10.10.1.1 → 10.10.1.2    TCP 83 8081 → 37180 [PSH, ACK] Seq=494 Ack=511 Win=65152 Len=17 TSval=3171950949 TSecr=1047691237
1711549169.371618986   271 0.831616179    10.10.1.2 → 10.10.1.1    TCP 83 37180 → 8081 [PSH, ACK] Seq=511 Ack=511 Win=64256 Len=17 TSval=1047691248 TSecr=3171950949
1711549171.371618986   273 0.831718909    10.10.1.1 → 10.10.1.2    TCP 83 8081 → 37180 [PSH, ACK] Seq=511 Ack=528 Win=65152 Len=17 TSval=3171950959 TSecr=1047691248
1711549177.371618986   279 0.841927266    10.10.1.2 → 10.10.1.1    TCP 83 37180 → 8081 [PSH, ACK] Seq=528 Ack=528 Win=64256 Len=17 TSval=1047691258 TSecr=3171950959
1711549179.371618986   281 0.842026797    10.10.1.1 → 10.10.1.2    TCP 83 8081 → 37180 [PSH, ACK] Seq=528 Ack=545 Win=65152 Len=17 TSval=3171950969 TSecr=1047691258
1711549185.371618986   287 0.852237846    10.10.1.2 → 10.10.1.1    TCP 83 37180 → 8081 [PSH, ACK] Seq=545 Ack=545 Win=64256 Len=17 TSval=1047691268 TSecr=3171950969
1711549187.371618986   289 0.852356614    10.10.1.1 → 10.10.1.2    TCP 83 8081 → 37180 [PSH, ACK] Seq=545 Ack=562 Win=65152 Len=17 TSval=3171950979 TSecr=1047691268
1711549193.371618986   295 0.862568193    10.10.1.2 → 10.10.1.1    TCP 83 37180 → 8081 [PSH, ACK] Seq=562 Ack=562 Win=64256 Len=17 TSval=1047691279 TSecr=3171950979
1711549195.371618986   297 0.862669714    10.10.1.1 → 10.10.1.2    TCP 83 8081 → 37180 [PSH, ACK] Seq=562 Ack=579 Win=65152 Len=17 TSval=3171950990 TSecr=1047691279
1711549201.371618986   303 0.872881390    10.10.1.2 → 10.10.1.1    TCP 83 37180 → 8081 [PSH, ACK] Seq=579 Ack=579 Win=64256 Len=17 TSval=1047691289 TSecr=3171950990
1711549203.371618986   305 0.872984369    10.10.1.1 → 10.10.1.2    TCP 83 8081 → 37180 [PSH, ACK] Seq=579 Ack=596 Win=65152 Len=17 TSval=3171951000 TSecr=1047691289
1711549209.371618986   311 0.883193007    10.10.1.2 → 10.10.1.1    TCP 83 37180 → 8081 [PSH, ACK] Seq=596 Ack=596 Win=64256 Len=17 TSval=1047691299 TSecr=3171951000
1711549211.371618986   313 0.883295617    10.10.1.1 → 10.10.1.2    TCP 83 8081 → 37180 [PSH, ACK] Seq=596 Ack=613 Win=65152 Len=17 TSval=3171951010 TSecr=1047691299
1711549217.371618986   319 0.893499048    10.10.1.2 → 10.10.1.1    TCP 83 37180 → 8081 [PSH, ACK] Seq=613 Ack=613 Win=64256 Len=17 TSval=1047691310 TSecr=3171951010
1711549219.371618986   321 0.893599513    10.10.1.1 → 10.10.1.2    TCP 83 8081 → 37180 [PSH, ACK] Seq=613 Ack=630 Win=65152 Len=17 TSval=3171951021 TSecr=1047691310
1711549225.371618986   327 0.903808110    10.10.1.2 → 10.10.1.1    TCP 83 37180 → 8081 [PSH, ACK] Seq=630 Ack=630 Win=64256 Len=17 TSval=1047691320 TSecr=3171951021
1711549227.371618986   329 0.903910374    10.10.1.1 → 10.10.1.2    TCP 83 8081 → 37180 [PSH, ACK] Seq=630 Ack=647 Win=65152 Len=17 TSval=3171951031 TSecr=1047691320
1711549233.371618986   335 0.914120091    10.10.1.2 → 10.10.1.1    TCP 83 37180 → 8081 [PSH, ACK] Seq=647 Ack=647 Win=64256 Len=17 TSval=1047691330 TSecr=3171951031
1711549235.371618986   337 0.914222012    10.10.1.1 → 10.10.1.2    TCP 83 8081 → 37180 [PSH, ACK] Seq=647 Ack=664 Win=65152 Len=17 TSval=3171951041 TSecr=1047691330
1711549241.371618986   343 0.924434278    10.10.1.2 → 10.10.1.1    TCP 83 37180 → 8081 [PSH, ACK] Seq=664 Ack=664 Win=64256 Len=17 TSval=1047691340 TSecr=3171951041
1711549243.371618986   345 0.924534603    10.10.1.1 → 10.10.1.2    TCP 83 8081 → 37180 [PSH, ACK] Seq=664 Ack=681 Win=65152 Len=17 TSval=3171951052 TSecr=1047691340
1711549249.371618986   351 0.934748208    10.10.1.2 → 10.10.1.1    TCP 83 37180 → 8081 [PSH, ACK] Seq=681 Ack=681 Win=64256 Len=17 TSval=1047691351 TSecr=3171951052
1711549251.371618986   353 0.934850249    10.10.1.1 → 10.10.1.2    TCP 83 8081 → 37180 [PSH, ACK] Seq=681 Ack=698 Win=65152 Len=17 TSval=3171951062 TSecr=1047691351
1711549257.371618986   359 0.945061521    10.10.1.2 → 10.10.1.1    TCP 83 37180 → 8081 [PSH, ACK] Seq=698 Ack=698 Win=64256 Len=17 TSval=1047691361 TSecr=3171951062
1711549259.371618986   361 0.945162241    10.10.1.1 → 10.10.1.2    TCP 83 8081 → 37180 [PSH, ACK] Seq=698 Ack=715 Win=65152 Len=17 TSval=3171951072 TSecr=1047691361
1711549265.371618986   367 0.955369766    10.10.1.2 → 10.10.1.1    TCP 83 37180 → 8081 [PSH, ACK] Seq=715 Ack=715 Win=64256 Len=17 TSval=1047691371 TSecr=3171951072
1711549267.371618986   369 0.955471152    10.10.1.1 → 10.10.1.2    TCP 83 8081 → 37180 [PSH, ACK] Seq=715 Ack=732 Win=65152 Len=17 TSval=3171951083 TSecr=1047691371
1711549273.371618986   375 0.965679494    10.10.1.2 → 10.10.1.1    TCP 83 37180 → 8081 [PSH, ACK] Seq=732 Ack=732 Win=64256 Len=17 TSval=1047691382 TSecr=3171951083
1711549275.371618986   377 0.965782589    10.10.1.1 → 10.10.1.2    TCP 83 8081 → 37180 [PSH, ACK] Seq=732 Ack=749 Win=65152 Len=17 TSval=3171951093 TSecr=1047691382
1711549281.371618986   383 0.975994405    10.10.1.2 → 10.10.1.1    TCP 83 37180 → 8081 [PSH, ACK] Seq=749 Ack=749 Win=64256 Len=17 TSval=1047691392 TSecr=3171951093
1711549283.371618986   385 0.976099588    10.10.1.1 → 10.10.1.2    TCP 83 8081 → 37180 [PSH, ACK] Seq=749 Ack=766 Win=65152 Len=17 TSval=3171951103 TSecr=1047691392
1711549289.371618986   391 0.986308540    10.10.1.2 → 10.10.1.1    TCP 83 37180 → 8081 [PSH, ACK] Seq=766 Ack=766 Win=64256 Len=17 TSval=1047691402 TSecr=3171951103
1711549291.371618986   393 0.986430718    10.10.1.1 → 10.10.1.2    TCP 83 8081 → 37180 [PSH, ACK] Seq=766 Ack=783 Win=65152 Len=17 TSval=3171951114 TSecr=1047691402
1711549297.371618986   399 0.996640114    10.10.1.2 → 10.10.1.1    TCP 83 37180 → 8081 [PSH, ACK] Seq=783 Ack=783 Win=64256 Len=17 TSval=1047691413 TSecr=3171951114
1711549299.371618986   401 0.996739976    10.10.1.1 → 10.10.1.2    TCP 83 8081 → 37180 [PSH, ACK] Seq=783 Ack=800 Win=65152 Len=17 TSval=3171951124 TSecr=1047691413
1711549305.371618986   407 1.006949494    10.10.1.2 → 10.10.1.1    TCP 83 37180 → 8081 [PSH, ACK] Seq=800 Ack=800 Win=64256 Len=17 TSval=1047691423 TSecr=3171951124
1711549307.371618986   409 1.007052698    10.10.1.1 → 10.10.1.2    TCP 83 8081 → 37180 [PSH, ACK] Seq=800 Ack=817 Win=65152 Len=17 TSval=3171951134 TSecr=1047691423
1711549313.371618986   415 1.017262473    10.10.1.2 → 10.10.1.1    TCP 83 37180 → 8081 [PSH, ACK] Seq=817 Ack=817 Win=64256 Len=17 TSval=1047691433 TSecr=3171951134
1711549315.371618986   417 1.017365982    10.10.1.1 → 10.10.1.2    TCP 83 8081 → 37180 [PSH, ACK] Seq=817 Ack=834 Win=65152 Len=17 TSval=3171951144 TSecr=1047691433
1711549321.371618986   423 1.027575194    10.10.1.2 → 10.10.1.1    TCP 83 37180 → 8081 [PSH, ACK] Seq=834 Ack=834 Win=64256 Len=17 TSval=1047691444 TSecr=3171951144
1711549323.371618986   425 1.027676808    10.10.1.1 → 10.10.1.2    TCP 83 8081 → 37180 [PSH, ACK] Seq=834 Ack=851 Win=65152 Len=17 TSval=3171951155 TSecr=1047691444
1711549329.371618986   431 1.037885160    10.10.1.2 → 10.10.1.1    TCP 83 37180 → 8081 [PSH, ACK] Seq=851 Ack=851 Win=64256 Len=17 TSval=1047691454 TSecr=3171951155
1711549331.371618986   433 1.037987222    10.10.1.1 → 10.10.1.2    TCP 83 8081 → 37180 [PSH, ACK] Seq=851 Ack=868 Win=65152 Len=17 TSval=3171951165 TSecr=1047691454
1711549337.371618986   439 1.048194606    10.10.1.2 → 10.10.1.1    TCP 83 37180 → 8081 [PSH, ACK] Seq=868 Ack=868 Win=64256 Len=17 TSval=1047691464 TSecr=3171951165
1711549339.371618986   441 1.048296501    10.10.1.1 → 10.10.1.2    TCP 83 8081 → 37180 [PSH, ACK] Seq=868 Ack=885 Win=65152 Len=17 TSval=3171951175 TSecr=1047691464
1711549345.371618986   447 1.058506166    10.10.1.2 → 10.10.1.1    TCP 83 37180 → 8081 [PSH, ACK] Seq=885 Ack=885 Win=64256 Len=17 TSval=1047691475 TSecr=3171951175
1711549347.371618986   449 1.058609613    10.10.1.1 → 10.10.1.2    TCP 83 8081 → 37180 [PSH, ACK] Seq=885 Ack=902 Win=65152 Len=17 TSval=3171951186 TSecr=1047691475
1711549353.371618986   455 1.068818543    10.10.1.2 → 10.10.1.1    TCP 83 37180 → 8081 [PSH, ACK] Seq=902 Ack=902 Win=64256 Len=17 TSval=1047691485 TSecr=3171951186
1711549355.371618986   457 1.068920278    10.10.1.1 → 10.10.1.2    TCP 83 8081 → 37180 [PSH, ACK] Seq=902 Ack=919 Win=65152 Len=17 TSval=3171951196 TSecr=1047691485
1711549361.371618986   463 1.079129155    10.10.1.2 → 10.10.1.1    TCP 83 37180 → 8081 [PSH, ACK] Seq=919 Ack=919 Win=64256 Len=17 TSval=1047691495 TSecr=3171951196
1711549363.371618986   465 1.079228563    10.10.1.1 → 10.10.1.2    TCP 83 8081 → 37180 [PSH, ACK] Seq=919 Ack=936 Win=65152 Len=17 TSval=3171951206 TSecr=1047691495
1711549369.371618986   471 1.089436518    10.10.1.2 → 10.10.1.1    TCP 83 37180 → 8081 [PSH, ACK] Seq=936 Ack=936 Win=64256 Len=17 TSval=1047691505 TSecr=3171951206
1711549371.371618986   473 1.089540807    10.10.1.1 → 10.10.1.2    TCP 83 8081 → 37180 [PSH, ACK] Seq=936 Ack=953 Win=65152 Len=17 TSval=3171951217 TSecr=1047691505
1711549377.371618986   479 1.099749139    10.10.1.2 → 10.10.1.1    TCP 83 37180 → 8081 [PSH, ACK] Seq=953 Ack=953 Win=64256 Len=17 TSval=1047691516 TSecr=3171951217
1711549380.371618986   482 1.100012592    10.10.1.1 → 10.10.1.2    TCP 83 8081 → 37180 [PSH, ACK] Seq=953 Ack=970 Win=65152 Len=17 TSval=3171951227 TSecr=1047691516
1711549385.371618986   487 1.110222548    10.10.1.2 → 10.10.1.1    TCP 83 37180 → 8081 [PSH, ACK] Seq=970 Ack=970 Win=64256 Len=17 TSval=1047691526 TSecr=3171951227
1711549387.371618986   489 1.110340548    10.10.1.1 → 10.10.1.2    TCP 83 8081 → 37180 [PSH, ACK] Seq=970 Ack=987 Win=65152 Len=17 TSval=3171951237 TSecr=1047691526
1711549393.371618986   495 1.120549144    10.10.1.2 → 10.10.1.1    TCP 83 37180 → 8081 [PSH, ACK] Seq=987 Ack=987 Win=64256 Len=17 TSval=1047691537 TSecr=3171951237
1711549395.371618986   497 1.120651381    10.10.1.1 → 10.10.1.2    TCP 83 8081 → 37180 [PSH, ACK] Seq=987 Ack=1004 Win=65152 Len=17 TSval=3171951248 TSecr=1047691537
1711549401.371618986   503 1.130815569    10.10.1.2 → 10.10.1.1    TCP 83 37180 → 8081 [PSH, ACK] Seq=1004 Ack=1004 Win=64256 Len=17 TSval=1047691547 TSecr=3171951248
1711549403.371618986   505 1.130943875    10.10.1.1 → 10.10.1.2    TCP 83 8081 → 37180 [PSH, ACK] Seq=1004 Ack=1021 Win=65152 Len=17 TSval=3171951258 TSecr=1047691547
1711549409.371618986   511 1.141153620    10.10.1.2 → 10.10.1.1    TCP 83 37180 → 8081 [PSH, ACK] Seq=1021 Ack=1021 Win=64256 Len=17 TSval=1047691557 TSecr=3171951258
1711549411.371618986   513 1.141256502    10.10.1.1 → 10.10.1.2    TCP 83 8081 → 37180 [PSH, ACK] Seq=1021 Ack=1038 Win=65152 Len=17 TSval=3171951268 TSecr=1047691557
1711549417.371618986   519 1.151464210    10.10.1.2 → 10.10.1.1    TCP 83 37180 → 8081 [PSH, ACK] Seq=1038 Ack=1038 Win=64256 Len=17 TSval=1047691567 TSecr=3171951268
1711549419.371618986   521 1.151566692    10.10.1.1 → 10.10.1.2    TCP 83 8081 → 37180 [PSH, ACK] Seq=1038 Ack=1055 Win=65152 Len=17 TSval=3171951279 TSecr=1047691567
1711549425.371618986   527 1.161776113    10.10.1.2 → 10.10.1.1    TCP 83 37180 → 8081 [PSH, ACK] Seq=1055 Ack=1055 Win=64256 Len=17 TSval=1047691578 TSecr=3171951279
1711549427.371618986   529 1.161877182    10.10.1.1 → 10.10.1.2    TCP 83 8081 → 37180 [PSH, ACK] Seq=1055 Ack=1072 Win=65152 Len=17 TSval=3171951289 TSecr=1047691578
1711549433.371618986   535 1.172086117    10.10.1.2 → 10.10.1.1    TCP 83 37180 → 8081 [PSH, ACK] Seq=1072 Ack=1072 Win=64256 Len=17 TSval=1047691588 TSecr=3171951289
1711549435.371618986   537 1.172187025    10.10.1.1 → 10.10.1.2    TCP 83 8081 → 37180 [PSH, ACK] Seq=1072 Ack=1089 Win=65152 Len=17 TSval=3171951299 TSecr=1047691588
1711549441.371618986   543 1.182399202    10.10.1.2 → 10.10.1.1    TCP 83 37180 → 8081 [PSH, ACK] Seq=1089 Ack=1089 Win=64256 Len=17 TSval=1047691598 TSecr=3171951299
1711549443.371618986   545 1.182501100    10.10.1.1 → 10.10.1.2    TCP 83 8081 → 37180 [PSH, ACK] Seq=1089 Ack=1106 Win=65152 Len=17 TSval=3171951310 TSecr=1047691598
1711549449.371618986   551 1.192709798    10.10.1.2 → 10.10.1.1    TCP 83 37180 → 8081 [PSH, ACK] Seq=1106 Ack=1106 Win=64256 Len=17 TSval=1047691609 TSecr=3171951310
1711549451.371618986   553 1.192812135    10.10.1.1 → 10.10.1.2    TCP 83 8081 → 37180 [PSH, ACK] Seq=1106 Ack=1123 Win=65152 Len=17 TSval=3171951320 TSecr=1047691609
1711549457.371618986   559 1.203020139    10.10.1.2 → 10.10.1.1    TCP 83 37180 → 8081 [PSH, ACK] Seq=1123 Ack=1123 Win=64256 Len=17 TSval=1047691619 TSecr=3171951320
1711549459.371618986   561 1.203122900    10.10.1.1 → 10.10.1.2    TCP 83 8081 → 37180 [PSH, ACK] Seq=1123 Ack=1140 Win=65152 Len=17 TSval=3171951330 TSecr=1047691619
1711549465.371618986   567 1.213333976    10.10.1.2 → 10.10.1.1    TCP 83 37180 → 8081 [PSH, ACK] Seq=1140 Ack=1140 Win=64256 Len=17 TSval=1047691629 TSecr=3171951330
1711549467.371618986   569 1.213435833    10.10.1.1 → 10.10.1.2    TCP 83 8081 → 37180 [PSH, ACK] Seq=1140 Ack=1157 Win=65152 Len=17 TSval=3171951341 TSecr=1047691629
1711549473.371618986   575 1.223647223    10.10.1.2 → 10.10.1.1    TCP 83 37180 → 8081 [PSH, ACK] Seq=1157 Ack=1157 Win=64256 Len=17 TSval=1047691640 TSecr=3171951341
1711549475.371618986   577 1.223749597    10.10.1.1 → 10.10.1.2    TCP 83 8081 → 37180 [PSH, ACK] Seq=1157 Ack=1174 Win=65152 Len=17 TSval=3171951351 TSecr=1047691640
1711549481.371618986   583 1.233960058    10.10.1.2 → 10.10.1.1    TCP 83 37180 → 8081 [PSH, ACK] Seq=1174 Ack=1174 Win=64256 Len=17 TSval=1047691650 TSecr=3171951351
1711549483.371618986   585 1.234063082    10.10.1.1 → 10.10.1.2    TCP 83 8081 → 37180 [PSH, ACK] Seq=1174 Ack=1191 Win=65152 Len=17 TSval=3171951361 TSecr=1047691650
1711549489.371618986   591 1.244275072    10.10.1.2 → 10.10.1.1    TCP 83 37180 → 8081 [PSH, ACK] Seq=1191 Ack=1191 Win=64256 Len=17 TSval=1047691660 TSecr=3171951361
1711549491.371618986   593 1.244377492    10.10.1.1 → 10.10.1.2    TCP 83 8081 → 37180 [PSH, ACK] Seq=1191 Ack=1208 Win=65152 Len=17 TSval=3171951371 TSecr=1047691660
1711549497.371618986   599 1.254590607    10.10.1.2 → 10.10.1.1    TCP 83 37180 → 8081 [PSH, ACK] Seq=1208 Ack=1208 Win=64256 Len=17 TSval=1047691671 TSecr=3171951371
1711549499.371618986   601 1.254693465    10.10.1.1 → 10.10.1.2    TCP 83 8081 → 37180 [PSH, ACK] Seq=1208 Ack=1225 Win=65152 Len=17 TSval=3171951382 TSecr=1047691671
1711549505.371618986   607 1.264905639    10.10.1.2 → 10.10.1.1    TCP 83 37180 → 8081 [PSH, ACK] Seq=1225 Ack=1225 Win=64256 Len=17 TSval=1047691681 TSecr=3171951382
1711549507.371618986   609 1.265006543    10.10.1.1 → 10.10.1.2    TCP 83 8081 → 37180 [PSH, ACK] Seq=1225 Ack=1242 Win=65152 Len=17 TSval=3171951392 TSecr=1047691681
1711549513.371618986   615 1.275218060    10.10.1.2 → 10.10.1.1    TCP 83 37180 → 8081 [PSH, ACK] Seq=1242 Ack=1242 Win=64256 Len=17 TSval=1047691691 TSecr=3171951392
1711549515.371618986   617 1.275319222    10.10.1.1 → 10.10.1.2    TCP 83 8081 → 37180 [PSH, ACK] Seq=1242 Ack=1259 Win=65152 Len=17 TSval=3171951402 TSecr=1047691691
1711549521.371618986   623 1.285499167    10.10.1.2 → 10.10.1.1    TCP 83 37180 → 8081 [PSH, ACK] Seq=1259 Ack=1259 Win=64256 Len=17 TSval=1047691702 TSecr=3171951402
1711549523.371618986   625 1.285600338    10.10.1.1 → 10.10.1.2    TCP 83 8081 → 37180 [PSH, ACK] Seq=1259 Ack=1276 Win=65152 Len=17 TSval=3171951413 TSecr=1047691702
1711549529.371618986   631 1.295811224    10.10.1.2 → 10.10.1.1    TCP 83 37180 → 8081 [PSH, ACK] Seq=1276 Ack=1276 Win=64256 Len=17 TSval=1047691712 TSecr=3171951413
1711549531.371618986   633 1.295913609    10.10.1.1 → 10.10.1.2    TCP 83 8081 → 37180 [PSH, ACK] Seq=1276 Ack=1293 Win=65152 Len=17 TSval=3171951423 TSecr=1047691712
1711549537.371618986   639 1.306122076    10.10.1.2 → 10.10.1.1    TCP 83 37180 → 8081 [PSH, ACK] Seq=1293 Ack=1293 Win=64256 Len=17 TSval=1047691722 TSecr=3171951423
1711549539.371618986   641 1.306225081    10.10.1.1 → 10.10.1.2    TCP 83 8081 → 37180 [PSH, ACK] Seq=1293 Ack=1310 Win=65152 Len=17 TSval=3171951433 TSecr=1047691722
1711549546.371618986   648 1.316445303    10.10.1.2 → 10.10.1.1    TCP 83 37180 → 8081 [PSH, ACK] Seq=1310 Ack=1310 Win=64256 Len=17 TSval=1047691732 TSecr=3171951433
1711549547.371618986   649 1.316526812    10.10.1.1 → 10.10.1.2    TCP 83 8081 → 37180 [PSH, ACK] Seq=1310 Ack=1327 Win=65152 Len=17 TSval=3171951444 TSecr=1047691732
1711549554.371618986   656 1.326734797    10.10.1.2 → 10.10.1.1    TCP 83 37180 → 8081 [PSH, ACK] Seq=1327 Ack=1327 Win=64256 Len=17 TSval=1047691743 TSecr=3171951444
1711549555.371618986   657 1.326836968    10.10.1.1 → 10.10.1.2    TCP 83 8081 → 37180 [PSH, ACK] Seq=1327 Ack=1344 Win=65152 Len=17 TSval=3171951454 TSecr=1047691743
1711549561.371618986   663 1.337046253    10.10.1.2 → 10.10.1.1    TCP 83 37180 → 8081 [PSH, ACK] Seq=1344 Ack=1344 Win=64256 Len=17 TSval=1047691753 TSecr=3171951454
1711549563.371618986   665 1.337147455    10.10.1.1 → 10.10.1.2    TCP 83 8081 → 37180 [PSH, ACK] Seq=1344 Ack=1361 Win=65152 Len=17 TSval=3171951464 TSecr=1047691753
1711549569.371618986   671 1.347355953    10.10.1.2 → 10.10.1.1    TCP 83 37180 → 8081 [PSH, ACK] Seq=1361 Ack=1361 Win=64256 Len=17 TSval=1047691763 TSecr=3171951464
1711549571.371618986   673 1.347457867    10.10.1.1 → 10.10.1.2    TCP 83 8081 → 37180 [PSH, ACK] Seq=1361 Ack=1378 Win=65152 Len=17 TSval=3171951475 TSecr=1047691763
1711549577.371618986   679 1.357667116    10.10.1.2 → 10.10.1.1    TCP 83 37180 → 8081 [PSH, ACK] Seq=1378 Ack=1378 Win=64256 Len=17 TSval=1047691774 TSecr=3171951475
1711549579.371618986   681 1.357768493    10.10.1.1 → 10.10.1.2    TCP 83 8081 → 37180 [PSH, ACK] Seq=1378 Ack=1395 Win=65152 Len=17 TSval=3171951485 TSecr=1047691774
1711549585.371618986   687 1.367977068    10.10.1.2 → 10.10.1.1    TCP 83 37180 → 8081 [PSH, ACK] Seq=1395 Ack=1395 Win=64256 Len=17 TSval=1047691784 TSecr=3171951485
1711549587.371618986   689 1.368078871    10.10.1.1 → 10.10.1.2    TCP 83 8081 → 37180 [PSH, ACK] Seq=1395 Ack=1412 Win=65152 Len=17 TSval=3171951495 TSecr=1047691784
1711549593.371618986   695 1.378289579    10.10.1.2 → 10.10.1.1    TCP 83 37180 → 8081 [PSH, ACK] Seq=1412 Ack=1412 Win=64256 Len=17 TSval=1047691794 TSecr=3171951495
1711549595.371618986   697 1.378416234    10.10.1.1 → 10.10.1.2    TCP 83 8081 → 37180 [PSH, ACK] Seq=1412 Ack=1429 Win=65152 Len=17 TSval=3171951506 TSecr=1047691794
1711549601.371618986   703 1.388626632    10.10.1.2 → 10.10.1.1    TCP 83 37180 → 8081 [PSH, ACK] Seq=1429 Ack=1429 Win=64256 Len=17 TSval=1047691805 TSecr=3171951506
1711549603.371618986   705 1.388726603    10.10.1.1 → 10.10.1.2    TCP 83 8081 → 37180 [PSH, ACK] Seq=1429 Ack=1446 Win=65152 Len=17 TSval=3171951516 TSecr=1047691805
1711549609.371618986   711 1.398935703    10.10.1.2 → 10.10.1.1    TCP 83 37180 → 8081 [PSH, ACK] Seq=1446 Ack=1446 Win=64256 Len=17 TSval=1047691815 TSecr=3171951516
1711549611.371618986   713 1.399037683    10.10.1.1 → 10.10.1.2    TCP 83 8081 → 37180 [PSH, ACK] Seq=1446 Ack=1463 Win=65152 Len=17 TSval=3171951526 TSecr=1047691815
1711549617.371618986   719 1.409249319    10.10.1.2 → 10.10.1.1    TCP 83 37180 → 8081 [PSH, ACK] Seq=1463 Ack=1463 Win=64256 Len=17 TSval=1047691825 TSecr=3171951526
1711549619.371618986   721 1.409348682    10.10.1.1 → 10.10.1.2    TCP 83 8081 → 37180 [PSH, ACK] Seq=1463 Ack=1480 Win=65152 Len=17 TSval=3171951536 TSecr=1047691825
1711549625.371618986   727 1.419557236    10.10.1.2 → 10.10.1.1    TCP 83 37180 → 8081 [PSH, ACK] Seq=1480 Ack=1480 Win=64256 Len=17 TSval=1047691836 TSecr=3171951536
1711549627.371618986   729 1.419661856    10.10.1.1 → 10.10.1.2    TCP 83 8081 → 37180 [PSH, ACK] Seq=1480 Ack=1497 Win=65152 Len=17 TSval=3171951547 TSecr=1047691836
1711549633.371618986   735 1.429870309    10.10.1.2 → 10.10.1.1    TCP 83 37180 → 8081 [PSH, ACK] Seq=1497 Ack=1497 Win=64256 Len=17 TSval=1047691846 TSecr=3171951547
1711549635.371618986   737 1.429972265    10.10.1.1 → 10.10.1.2    TCP 83 8081 → 37180 [PSH, ACK] Seq=1497 Ack=1514 Win=65152 Len=17 TSval=3171951557 TSecr=1047691846
1711549641.371618986   743 1.440182313    10.10.1.2 → 10.10.1.1    TCP 83 37180 → 8081 [PSH, ACK] Seq=1514 Ack=1514 Win=64256 Len=17 TSval=1047691856 TSecr=3171951557
1711549643.371618986   745 1.440286336    10.10.1.1 → 10.10.1.2    TCP 83 8081 → 37180 [PSH, ACK] Seq=1514 Ack=1531 Win=65152 Len=17 TSval=3171951567 TSecr=1047691856
1711549649.371618986   751 1.450495705    10.10.1.2 → 10.10.1.1    TCP 83 37180 → 8081 [PSH, ACK] Seq=1531 Ack=1531 Win=64256 Len=17 TSval=1047691867 TSecr=3171951567
1711549651.371618986   753 1.450598532    10.10.1.1 → 10.10.1.2    TCP 83 8081 → 37180 [PSH, ACK] Seq=1531 Ack=1548 Win=65152 Len=17 TSval=3171951578 TSecr=1047691867
1711549657.371618986   759 1.460806841    10.10.1.2 → 10.10.1.1    TCP 83 37180 → 8081 [PSH, ACK] Seq=1548 Ack=1548 Win=64256 Len=17 TSval=1047691877 TSecr=3171951578
1711549659.371618986   761 1.460909242    10.10.1.1 → 10.10.1.2    TCP 83 8081 → 37180 [PSH, ACK] Seq=1548 Ack=1565 Win=65152 Len=17 TSval=3171951588 TSecr=1047691877
1711549665.371618986   767 1.471117991    10.10.1.2 → 10.10.1.1    TCP 83 37180 → 8081 [PSH, ACK] Seq=1565 Ack=1565 Win=64256 Len=17 TSval=1047691887 TSecr=3171951588
1711549667.371618986   769 1.471221232    10.10.1.1 → 10.10.1.2    TCP 83 8081 → 37180 [PSH, ACK] Seq=1565 Ack=1582 Win=65152 Len=17 TSval=3171951598 TSecr=1047691887
1711549673.371618986   775 1.481430421    10.10.1.2 → 10.10.1.1    TCP 83 37180 → 8081 [PSH, ACK] Seq=1582 Ack=1582 Win=64256 Len=17 TSval=1047691897 TSecr=3171951598
1711549675.371618986   777 1.481532735    10.10.1.1 → 10.10.1.2    TCP 83 8081 → 37180 [PSH, ACK] Seq=1582 Ack=1599 Win=65152 Len=17 TSval=3171951609 TSecr=1047691897
1711549681.371618986   783 1.491743550    10.10.1.2 → 10.10.1.1    TCP 83 37180 → 8081 [PSH, ACK] Seq=1599 Ack=1599 Win=64256 Len=17 TSval=1047691908 TSecr=3171951609
1711549683.371618986   785 1.491849805    10.10.1.1 → 10.10.1.2    TCP 83 8081 → 37180 [PSH, ACK] Seq=1599 Ack=1616 Win=65152 Len=17 TSval=3171951619 TSecr=1047691908
1711549689.371618986   791 1.502061414    10.10.1.2 → 10.10.1.1    TCP 83 37180 → 8081 [PSH, ACK] Seq=1616 Ack=1616 Win=64256 Len=17 TSval=1047691918 TSecr=3171951619
1711549691.371618986   793 1.502164811    10.10.1.1 → 10.10.1.2    TCP 83 8081 → 37180 [PSH, ACK] Seq=1616 Ack=1633 Win=65152 Len=17 TSval=3171951629 TSecr=1047691918
1711549697.371618986   799 1.512376843    10.10.1.2 → 10.10.1.1    TCP 83 37180 → 8081 [PSH, ACK] Seq=1633 Ack=1633 Win=64256 Len=17 TSval=1047691928 TSecr=3171951629
1711549699.371618986   801 1.512481101    10.10.1.1 → 10.10.1.2    TCP 83 8081 → 37180 [PSH, ACK] Seq=1633 Ack=1650 Win=65152 Len=17 TSval=3171951640 TSecr=1047691928
1711549705.371618986   807 1.522692577    10.10.1.2 → 10.10.1.1    TCP 83 37180 → 8081 [PSH, ACK] Seq=1650 Ack=1650 Win=64256 Len=17 TSval=1047691939 TSecr=3171951640
1711549707.371618986   809 1.522794201    10.10.1.1 → 10.10.1.2    TCP 83 8081 → 37180 [PSH, ACK] Seq=1650 Ack=1667 Win=65152 Len=17 TSval=3171951650 TSecr=1047691939
1711549713.371618986   815 1.533005219    10.10.1.2 → 10.10.1.1    TCP 83 37180 → 8081 [PSH, ACK] Seq=1667 Ack=1667 Win=64256 Len=17 TSval=1047691949 TSecr=3171951650
1711549715.371618986   817 1.533107667    10.10.1.1 → 10.10.1.2    TCP 83 8081 → 37180 [PSH, ACK] Seq=1667 Ack=1684 Win=65152 Len=17 TSval=3171951660 TSecr=1047691949
1711549721.371618986   823 1.543318413    10.10.1.2 → 10.10.1.1    TCP 83 37180 → 8081 [PSH, ACK] Seq=1684 Ack=1684 Win=64256 Len=17 TSval=1047691959 TSecr=3171951660
1711549723.371618986   825 1.543419965    10.10.1.1 → 10.10.1.2    TCP 83 8081 → 37180 [PSH, ACK] Seq=1684 Ack=1701 Win=65152 Len=17 TSval=3171951671 TSecr=1047691959
1711549729.371618986   831 1.553630217    10.10.1.2 → 10.10.1.1    TCP 83 37180 → 8081 [PSH, ACK] Seq=1701 Ack=1701 Win=64256 Len=17 TSval=1047691970 TSecr=3171951671
1711549731.371618986   833 1.553732988    10.10.1.1 → 10.10.1.2    TCP 83 8081 → 37180 [PSH, ACK] Seq=1701 Ack=1718 Win=65152 Len=17 TSval=3171951681 TSecr=1047691970
1711549737.371618986   839 1.563942883    10.10.1.2 → 10.10.1.1    TCP 83 37180 → 8081 [PSH, ACK] Seq=1718 Ack=1718 Win=64256 Len=17 TSval=1047691980 TSecr=3171951681
1711549739.371618986   841 1.564045671    10.10.1.1 → 10.10.1.2    TCP 83 8081 → 37180 [PSH, ACK] Seq=1718 Ack=1735 Win=65152 Len=17 TSval=3171951691 TSecr=1047691980
1711549745.371618986   847 1.574257176    10.10.1.2 → 10.10.1.1    TCP 83 37180 → 8081 [PSH, ACK] Seq=1735 Ack=1735 Win=64256 Len=17 TSval=1047691990 TSecr=3171951691
1711549747.371618986   849 1.574358970    10.10.1.1 → 10.10.1.2    TCP 83 8081 → 37180 [PSH, ACK] Seq=1735 Ack=1752 Win=65152 Len=17 TSval=3171951701 TSecr=1047691990
1711549753.371618986   855 1.584568892    10.10.1.2 → 10.10.1.1    TCP 83 37180 → 8081 [PSH, ACK] Seq=1752 Ack=1752 Win=64256 Len=17 TSval=1047692001 TSecr=3171951701
1711549755.371618986   857 1.584673761    10.10.1.1 → 10.10.1.2    TCP 83 8081 → 37180 [PSH, ACK] Seq=1752 Ack=1769 Win=65152 Len=17 TSval=3171951712 TSecr=1047692001
1711549761.371618986   863 1.594881812    10.10.1.2 → 10.10.1.1    TCP 83 37180 → 8081 [PSH, ACK] Seq=1769 Ack=1769 Win=64256 Len=17 TSval=1047692011 TSecr=3171951712
1711549763.371618986   865 1.594983992    10.10.1.1 → 10.10.1.2    TCP 83 8081 → 37180 [PSH, ACK] Seq=1769 Ack=1786 Win=65152 Len=17 TSval=3171951722 TSecr=1047692011
1711549769.371618986   871 1.605195698    10.10.1.2 → 10.10.1.1    TCP 83 37180 → 8081 [PSH, ACK] Seq=1786 Ack=1786 Win=64256 Len=17 TSval=1047692021 TSecr=3171951722
1711549771.371618986   873 1.605298144    10.10.1.1 → 10.10.1.2    TCP 83 8081 → 37180 [PSH, ACK] Seq=1786 Ack=1803 Win=65152 Len=17 TSval=3171951732 TSecr=1047692021
1711549777.371618986   879 1.615489238    10.10.1.2 → 10.10.1.1    TCP 83 37180 → 8081 [PSH, ACK] Seq=1803 Ack=1803 Win=64256 Len=17 TSval=1047692032 TSecr=3171951732
1711549779.371618986   881 1.615589750    10.10.1.1 → 10.10.1.2    TCP 83 8081 → 37180 [PSH, ACK] Seq=1803 Ack=1820 Win=65152 Len=17 TSval=3171951743 TSecr=1047692032
1711549785.371618986   887 1.625798276    10.10.1.2 → 10.10.1.1    TCP 83 37180 → 8081 [PSH, ACK] Seq=1820 Ack=1820 Win=64256 Len=17 TSval=1047692042 TSecr=3171951743
1711549787.371618986   889 1.625899830    10.10.1.1 → 10.10.1.2    TCP 83 8081 → 37180 [PSH, ACK] Seq=1820 Ack=1837 Win=65152 Len=17 TSval=3171951753 TSecr=1047692042
1711549793.371618986   895 1.636106717    10.10.1.2 → 10.10.1.1    TCP 83 37180 → 8081 [PSH, ACK] Seq=1837 Ack=1837 Win=64256 Len=17 TSval=1047692052 TSecr=3171951753
1711549795.371618986   897 1.636207698    10.10.1.1 → 10.10.1.2    TCP 83 8081 → 37180 [PSH, ACK] Seq=1837 Ack=1854 Win=65152 Len=17 TSval=3171951763 TSecr=1047692052
1711549801.371618986   903 1.646418989    10.10.1.2 → 10.10.1.1    TCP 83 37180 → 8081 [PSH, ACK] Seq=1854 Ack=1854 Win=64256 Len=17 TSval=1047692062 TSecr=3171951763
1711549803.371618986   905 1.646520239    10.10.1.1 → 10.10.1.2    TCP 83 8081 → 37180 [PSH, ACK] Seq=1854 Ack=1871 Win=65152 Len=17 TSval=3171951774 TSecr=1047692062
1711549809.371618986   911 1.656728350    10.10.1.2 → 10.10.1.1    TCP 83 37180 → 8081 [PSH, ACK] Seq=1871 Ack=1871 Win=64256 Len=17 TSval=1047692073 TSecr=3171951774
1711549811.371618986   913 1.656829607    10.10.1.1 → 10.10.1.2    TCP 83 8081 → 37180 [PSH, ACK] Seq=1871 Ack=1888 Win=65152 Len=17 TSval=3171951784 TSecr=1047692073
1711549817.371618986   919 1.667039697    10.10.1.2 → 10.10.1.1    TCP 83 37180 → 8081 [PSH, ACK] Seq=1888 Ack=1888 Win=64256 Len=17 TSval=1047692083 TSecr=3171951784
1711549819.371618986   921 1.667141617    10.10.1.1 → 10.10.1.2    TCP 83 8081 → 37180 [PSH, ACK] Seq=1888 Ack=1905 Win=65152 Len=17 TSval=3171951794 TSecr=1047692083
1711549825.371618986   927 1.677351077    10.10.1.2 → 10.10.1.1    TCP 83 37180 → 8081 [PSH, ACK] Seq=1905 Ack=1905 Win=64256 Len=17 TSval=1047692093 TSecr=3171951794
1711549827.371618986   929 1.677450919    10.10.1.1 → 10.10.1.2    TCP 83 8081 → 37180 [PSH, ACK] Seq=1905 Ack=1922 Win=65152 Len=17 TSval=3171951805 TSecr=1047692093
1711549833.371618986   935 1.687661921    10.10.1.2 → 10.10.1.1    TCP 83 37180 → 8081 [PSH, ACK] Seq=1922 Ack=1922 Win=64256 Len=17 TSval=1047692104 TSecr=3171951805
1711549836.371618986   938 1.687816742    10.10.1.1 → 10.10.1.2    TCP 83 8081 → 37180 [PSH, ACK] Seq=1922 Ack=1939 Win=65152 Len=17 TSval=3171951815 TSecr=1047692104
1711549841.371618986   943 1.698028123    10.10.1.2 → 10.10.1.1    TCP 83 37180 → 8081 [PSH, ACK] Seq=1939 Ack=1939 Win=64256 Len=17 TSval=1047692114 TSecr=3171951815
1711549843.371618986   945 1.698130205    10.10.1.1 → 10.10.1.2    TCP 83 8081 → 37180 [PSH, ACK] Seq=1939 Ack=1956 Win=65152 Len=17 TSval=3171951825 TSecr=1047692114
1711549849.371618986   951 1.708341779    10.10.1.2 → 10.10.1.1    TCP 83 37180 → 8081 [PSH, ACK] Seq=1956 Ack=1956 Win=64256 Len=17 TSval=1047692124 TSecr=3171951825
1711549851.371618986   953 1.708442494    10.10.1.1 → 10.10.1.2    TCP 83 8081 → 37180 [PSH, ACK] Seq=1956 Ack=1973 Win=65152 Len=17 TSval=3171951836 TSecr=1047692124
1711549857.371618986   959 1.718652561    10.10.1.2 → 10.10.1.1    TCP 83 37180 → 8081 [PSH, ACK] Seq=1973 Ack=1973 Win=64256 Len=17 TSval=1047692135 TSecr=3171951836
1711549859.371618986   961 1.718753750    10.10.1.1 → 10.10.1.2    TCP 83 8081 → 37180 [PSH, ACK] Seq=1973 Ack=1990 Win=65152 Len=17 TSval=3171951846 TSecr=1047692135
1711549865.371618986   967 1.728965223    10.10.1.2 → 10.10.1.1    TCP 83 37180 → 8081 [PSH, ACK] Seq=1990 Ack=1990 Win=64256 Len=17 TSval=1047692145 TSecr=3171951846
1711549867.371618986   969 1.729066222    10.10.1.1 → 10.10.1.2    TCP 83 8081 → 37180 [PSH, ACK] Seq=1990 Ack=2007 Win=65152 Len=17 TSval=3171951856 TSecr=1047692145
