1711508709.170718670    41 0.564518648    10.10.1.2 → 10.10.1.1    TCP 83 53206 → 8081 [PSH, ACK] Seq=1 Ack=1 Win=64256 Len=17 TSval=1007460863 TSecr=3131720314
1711508713.170718670    45 0.564617539    10.10.1.1 → 10.10.1.2    TCP 83 8081 → 53206 [PSH, ACK] Seq=1 Ack=18 Win=65152 Len=17 TSval=3131720570 TSecr=1007460863
1711508719.170718670    51 0.564904928    10.10.1.2 → 10.10.1.1    TCP 83 53206 → 8081 [PSH, ACK] Seq=18 Ack=18 Win=64256 Len=17 TSval=1007460863 TSecr=3131720570
1711508720.170718670    52 0.564918819    10.10.1.1 → 10.10.1.2    TCP 83 8081 → 53206 [PSH, ACK] Seq=18 Ack=35 Win=65152 Len=17 TSval=3131720570 TSecr=1007460863
1711508725.170718670    57 0.565094365    10.10.1.2 → 10.10.1.1    TCP 83 53206 → 8081 [PSH, ACK] Seq=35 Ack=35 Win=64256 Len=17 TSval=1007460863 TSecr=3131720570
1711508726.170718670    58 0.565106370    10.10.1.1 → 10.10.1.2    TCP 83 8081 → 53206 [PSH, ACK] Seq=35 Ack=52 Win=65152 Len=17 TSval=3131720570 TSecr=1007460863
1711508733.170718670    65 0.567287090    10.10.1.2 → 10.10.1.1    TCP 83 53206 → 8081 [PSH, ACK] Seq=52 Ack=52 Win=64256 Len=17 TSval=1007460866 TSecr=3131720570
1711508734.170718670    66 0.567298618    10.10.1.1 → 10.10.1.2    TCP 83 8081 → 53206 [PSH, ACK] Seq=52 Ack=69 Win=65152 Len=17 TSval=3131720572 TSecr=1007460866
1711508739.170718670    71 0.567467406    10.10.1.2 → 10.10.1.1    TCP 83 53206 → 8081 [PSH, ACK] Seq=69 Ack=69 Win=64256 Len=17 TSval=1007460866 TSecr=3131720572
1711508740.170718670    72 0.567478410    10.10.1.1 → 10.10.1.2    TCP 83 8081 → 53206 [PSH, ACK] Seq=69 Ack=86 Win=65152 Len=17 TSval=3131720572 TSecr=1007460866
1711508747.170718670    79 0.567617161    10.10.1.2 → 10.10.1.1    TCP 83 53206 → 8081 [PSH, ACK] Seq=86 Ack=86 Win=64256 Len=17 TSval=1007460866 TSecr=3131720572
1711508748.170718670    80 0.567628067    10.10.1.1 → 10.10.1.2    TCP 83 8081 → 53206 [PSH, ACK] Seq=86 Ack=103 Win=65152 Len=17 TSval=3131720573 TSecr=1007460866
1711508755.170718670    87 0.569986483    10.10.1.2 → 10.10.1.1    TCP 83 53206 → 8081 [PSH, ACK] Seq=103 Ack=103 Win=64256 Len=17 TSval=1007460868 TSecr=3131720573
1711508757.170718670    89 0.570006448    10.10.1.1 → 10.10.1.2    TCP 83 8081 → 53206 [PSH, ACK] Seq=103 Ack=120 Win=65152 Len=17 TSval=3131720575 TSecr=1007460868
1711508763.170718670    95 0.570623123    10.10.1.2 → 10.10.1.1    TCP 83 53206 → 8081 [PSH, ACK] Seq=120 Ack=120 Win=64256 Len=17 TSval=1007460869 TSecr=3131720575
1711508764.170718670    96 0.570634920    10.10.1.1 → 10.10.1.2    TCP 83 8081 → 53206 [PSH, ACK] Seq=120 Ack=137 Win=65152 Len=17 TSval=3131720576 TSecr=1007460869
1711508769.170718670   101 0.570760364    10.10.1.2 → 10.10.1.1    TCP 83 53206 → 8081 [PSH, ACK] Seq=137 Ack=137 Win=64256 Len=17 TSval=1007460869 TSecr=3131720576
1711508770.170718670   102 0.570771426    10.10.1.1 → 10.10.1.2    TCP 83 8081 → 53206 [PSH, ACK] Seq=137 Ack=154 Win=65152 Len=17 TSval=3131720576 TSecr=1007460869
1711508777.170718670   109 0.571974909    10.10.1.2 → 10.10.1.1    TCP 83 53206 → 8081 [PSH, ACK] Seq=154 Ack=154 Win=64256 Len=17 TSval=1007460870 TSecr=3131720576
1711508778.170718670   110 0.571986450    10.10.1.1 → 10.10.1.2    TCP 83 8081 → 53206 [PSH, ACK] Seq=154 Ack=171 Win=65152 Len=17 TSval=3131720577 TSecr=1007460870
1711508785.170718670   117 0.572559806    10.10.1.2 → 10.10.1.1    TCP 83 53206 → 8081 [PSH, ACK] Seq=171 Ack=171 Win=64256 Len=17 TSval=1007460871 TSecr=3131720577
1711508786.170718670   118 0.572574174    10.10.1.1 → 10.10.1.2    TCP 83 8081 → 53206 [PSH, ACK] Seq=171 Ack=188 Win=65152 Len=17 TSval=3131720578 TSecr=1007460871
1711508793.170718670   125 0.572904448    10.10.1.2 → 10.10.1.1    TCP 83 53206 → 8081 [PSH, ACK] Seq=188 Ack=188 Win=64256 Len=17 TSval=1007460871 TSecr=3131720578
1711508794.170718670   126 0.572915582    10.10.1.1 → 10.10.1.2    TCP 83 8081 → 53206 [PSH, ACK] Seq=188 Ack=205 Win=65152 Len=17 TSval=3131720578 TSecr=1007460871
1711508801.170718670   133 0.575418628    10.10.1.2 → 10.10.1.1    TCP 83 53206 → 8081 [PSH, ACK] Seq=205 Ack=205 Win=64256 Len=17 TSval=1007460874 TSecr=3131720578
1711508802.170718670   134 0.575429838    10.10.1.1 → 10.10.1.2    TCP 83 8081 → 53206 [PSH, ACK] Seq=205 Ack=222 Win=65152 Len=17 TSval=3131720580 TSecr=1007460874
1711508809.170718670   141 0.578736733    10.10.1.2 → 10.10.1.1    TCP 83 53206 → 8081 [PSH, ACK] Seq=222 Ack=222 Win=64256 Len=17 TSval=1007460877 TSecr=3131720580
1711508810.170718670   142 0.578751913    10.10.1.1 → 10.10.1.2    TCP 83 8081 → 53206 [PSH, ACK] Seq=222 Ack=239 Win=65152 Len=17 TSval=3131720584 TSecr=1007460877
1711508817.170718670   149 0.581511666    10.10.1.2 → 10.10.1.1    TCP 83 53206 → 8081 [PSH, ACK] Seq=239 Ack=239 Win=64256 Len=17 TSval=1007460880 TSecr=3131720584
1711508818.170718670   150 0.581529801    10.10.1.1 → 10.10.1.2    TCP 83 8081 → 53206 [PSH, ACK] Seq=239 Ack=256 Win=65152 Len=17 TSval=3131720586 TSecr=1007460880
1711508825.170718670   157 0.584142283    10.10.1.2 → 10.10.1.1    TCP 83 53206 → 8081 [PSH, ACK] Seq=256 Ack=256 Win=64256 Len=17 TSval=1007460882 TSecr=3131720586
1711508826.170718670   158 0.584153377    10.10.1.1 → 10.10.1.2    TCP 83 8081 → 53206 [PSH, ACK] Seq=256 Ack=273 Win=65152 Len=17 TSval=3131720589 TSecr=1007460882
1711508833.170718670   165 0.586003424    10.10.1.2 → 10.10.1.1    TCP 83 53206 → 8081 [PSH, ACK] Seq=273 Ack=273 Win=64256 Len=17 TSval=1007460884 TSecr=3131720589
1711508834.170718670   166 0.586017851    10.10.1.1 → 10.10.1.2    TCP 83 8081 → 53206 [PSH, ACK] Seq=273 Ack=290 Win=65152 Len=17 TSval=3131720591 TSecr=1007460884
1711508841.170718670   173 0.587396764    10.10.1.2 → 10.10.1.1    TCP 83 53206 → 8081 [PSH, ACK] Seq=290 Ack=290 Win=64256 Len=17 TSval=1007460886 TSecr=3131720591
1711508842.170718670   174 0.587408364    10.10.1.1 → 10.10.1.2    TCP 83 8081 → 53206 [PSH, ACK] Seq=290 Ack=307 Win=65152 Len=17 TSval=3131720592 TSecr=1007460886
1711508847.170718670   179 0.587578857    10.10.1.2 → 10.10.1.1    TCP 83 53206 → 8081 [PSH, ACK] Seq=307 Ack=307 Win=64256 Len=17 TSval=1007460886 TSecr=3131720592
1711508848.170718670   180 0.587590060    10.10.1.1 → 10.10.1.2    TCP 83 8081 → 53206 [PSH, ACK] Seq=307 Ack=324 Win=65152 Len=17 TSval=3131720593 TSecr=1007460886
1711508855.170718670   187 0.588465137    10.10.1.2 → 10.10.1.1    TCP 83 53206 → 8081 [PSH, ACK] Seq=324 Ack=324 Win=64256 Len=17 TSval=1007460887 TSecr=3131720593
1711508856.170718670   188 0.588476297    10.10.1.1 → 10.10.1.2    TCP 83 8081 → 53206 [PSH, ACK] Seq=324 Ack=341 Win=65152 Len=17 TSval=3131720593 TSecr=1007460887
1711508863.170718670   195 0.590053628    10.10.1.2 → 10.10.1.1    TCP 83 53206 → 8081 [PSH, ACK] Seq=341 Ack=341 Win=64256 Len=17 TSval=1007460888 TSecr=3131720593
1711508864.170718670   196 0.590067628    10.10.1.1 → 10.10.1.2    TCP 83 8081 → 53206 [PSH, ACK] Seq=341 Ack=358 Win=65152 Len=17 TSval=3131720595 TSecr=1007460888
1711508871.170718670   203 0.590968526    10.10.1.2 → 10.10.1.1    TCP 83 53206 → 8081 [PSH, ACK] Seq=358 Ack=358 Win=64256 Len=17 TSval=1007460889 TSecr=3131720595
1711508872.170718670   204 0.590980015    10.10.1.1 → 10.10.1.2    TCP 83 8081 → 53206 [PSH, ACK] Seq=358 Ack=375 Win=65152 Len=17 TSval=3131720596 TSecr=1007460889
1711508879.170718670   211 0.593513652    10.10.1.2 → 10.10.1.1    TCP 83 53206 → 8081 [PSH, ACK] Seq=375 Ack=375 Win=64256 Len=17 TSval=1007460892 TSecr=3131720596
1711508880.170718670   212 0.593527807    10.10.1.1 → 10.10.1.2    TCP 83 8081 → 53206 [PSH, ACK] Seq=375 Ack=392 Win=65152 Len=17 TSval=3131720598 TSecr=1007460892
1711508887.170718670   219 0.593828925    10.10.1.2 → 10.10.1.1    TCP 83 53206 → 8081 [PSH, ACK] Seq=392 Ack=392 Win=64256 Len=17 TSval=1007460892 TSecr=3131720598
1711508888.170718670   220 0.593839822    10.10.1.1 → 10.10.1.2    TCP 83 8081 → 53206 [PSH, ACK] Seq=392 Ack=409 Win=65152 Len=17 TSval=3131720599 TSecr=1007460892
1711508895.170718670   227 0.594504931    10.10.1.2 → 10.10.1.1    TCP 83 53206 → 8081 [PSH, ACK] Seq=409 Ack=409 Win=64256 Len=17 TSval=1007460893 TSecr=3131720599
1711508896.170718670   228 0.594515960    10.10.1.1 → 10.10.1.2    TCP 83 8081 → 53206 [PSH, ACK] Seq=409 Ack=426 Win=65152 Len=17 TSval=3131720599 TSecr=1007460893
1711508903.170718670   235 0.596000733    10.10.1.2 → 10.10.1.1    TCP 83 53206 → 8081 [PSH, ACK] Seq=426 Ack=426 Win=64256 Len=17 TSval=1007460894 TSecr=3131720599
1711508904.170718670   236 0.596011954    10.10.1.1 → 10.10.1.2    TCP 83 8081 → 53206 [PSH, ACK] Seq=426 Ack=443 Win=65152 Len=17 TSval=3131720601 TSecr=1007460894
1711508911.170718670   243 0.596517663    10.10.1.2 → 10.10.1.1    TCP 83 53206 → 8081 [PSH, ACK] Seq=443 Ack=443 Win=64256 Len=17 TSval=1007460895 TSecr=3131720601
1711508912.170718670   244 0.596529065    10.10.1.1 → 10.10.1.2    TCP 83 8081 → 53206 [PSH, ACK] Seq=443 Ack=460 Win=65152 Len=17 TSval=3131720601 TSecr=1007460895
1711508919.170718670   251 0.599534293    10.10.1.2 → 10.10.1.1    TCP 83 53206 → 8081 [PSH, ACK] Seq=460 Ack=460 Win=64256 Len=17 TSval=1007460898 TSecr=3131720601
1711508920.170718670   252 0.599547284    10.10.1.1 → 10.10.1.2    TCP 83 8081 → 53206 [PSH, ACK] Seq=460 Ack=477 Win=65152 Len=17 TSval=3131720605 TSecr=1007460898
1711508927.170718670   259 0.600285844    10.10.1.2 → 10.10.1.1    TCP 83 53206 → 8081 [PSH, ACK] Seq=477 Ack=477 Win=64256 Len=17 TSval=1007460899 TSecr=3131720605
1711508928.170718670   260 0.600296992    10.10.1.1 → 10.10.1.2    TCP 83 8081 → 53206 [PSH, ACK] Seq=477 Ack=494 Win=65152 Len=17 TSval=3131720605 TSecr=1007460899
1711508936.170718670   268 0.603387477    10.10.1.2 → 10.10.1.1    TCP 83 53206 → 8081 [PSH, ACK] Seq=494 Ack=494 Win=64256 Len=17 TSval=1007460902 TSecr=3131720605
1711508937.170718670   269 0.603402759    10.10.1.1 → 10.10.1.2    TCP 83 8081 → 53206 [PSH, ACK] Seq=494 Ack=511 Win=65152 Len=17 TSval=3131720608 TSecr=1007460902
1711508944.170718670   276 0.603915172    10.10.1.2 → 10.10.1.1    TCP 83 53206 → 8081 [PSH, ACK] Seq=511 Ack=511 Win=64256 Len=17 TSval=1007460902 TSecr=3131720608
1711508945.170718670   277 0.603926778    10.10.1.1 → 10.10.1.2    TCP 83 8081 → 53206 [PSH, ACK] Seq=511 Ack=528 Win=65152 Len=17 TSval=3131720609 TSecr=1007460902
1711508952.170718670   284 0.604675913    10.10.1.2 → 10.10.1.1    TCP 83 53206 → 8081 [PSH, ACK] Seq=528 Ack=528 Win=64256 Len=17 TSval=1007460903 TSecr=3131720609
1711508953.170718670   285 0.604687584    10.10.1.1 → 10.10.1.2    TCP 83 8081 → 53206 [PSH, ACK] Seq=528 Ack=545 Win=65152 Len=17 TSval=3131720610 TSecr=1007460903
1711508958.170718670   290 0.604856935    10.10.1.2 → 10.10.1.1    TCP 83 53206 → 8081 [PSH, ACK] Seq=545 Ack=545 Win=64256 Len=17 TSval=1007460903 TSecr=3131720610
1711508959.170718670   291 0.604872668    10.10.1.1 → 10.10.1.2    TCP 83 8081 → 53206 [PSH, ACK] Seq=545 Ack=562 Win=65152 Len=17 TSval=3131720610 TSecr=1007460903
1711508966.170718670   298 0.605516680    10.10.1.2 → 10.10.1.1    TCP 83 53206 → 8081 [PSH, ACK] Seq=562 Ack=562 Win=64256 Len=17 TSval=1007460904 TSecr=3131720610
1711508967.170718670   299 0.605527781    10.10.1.1 → 10.10.1.2    TCP 83 8081 → 53206 [PSH, ACK] Seq=562 Ack=579 Win=65152 Len=17 TSval=3131720610 TSecr=1007460904
1711508974.170718670   306 0.606051514    10.10.1.2 → 10.10.1.1    TCP 83 53206 → 8081 [PSH, ACK] Seq=579 Ack=579 Win=64256 Len=17 TSval=1007460904 TSecr=3131720610
1711508975.170718670   307 0.606063050    10.10.1.1 → 10.10.1.2    TCP 83 8081 → 53206 [PSH, ACK] Seq=579 Ack=596 Win=65152 Len=17 TSval=3131720611 TSecr=1007460904
1711508982.170718670   314 0.606387029    10.10.1.2 → 10.10.1.1    TCP 83 53206 → 8081 [PSH, ACK] Seq=596 Ack=596 Win=64256 Len=17 TSval=1007460905 TSecr=3131720611
1711508983.170718670   315 0.606398092    10.10.1.1 → 10.10.1.2    TCP 83 8081 → 53206 [PSH, ACK] Seq=596 Ack=613 Win=65152 Len=17 TSval=3131720611 TSecr=1007460905
1711508990.170718670   322 0.607106872    10.10.1.2 → 10.10.1.1    TCP 83 53206 → 8081 [PSH, ACK] Seq=613 Ack=613 Win=64256 Len=17 TSval=1007460905 TSecr=3131720611
1711508991.170718670   323 0.607117707    10.10.1.1 → 10.10.1.2    TCP 83 8081 → 53206 [PSH, ACK] Seq=613 Ack=630 Win=65152 Len=17 TSval=3131720612 TSecr=1007460905
1711508998.170718670   330 0.607512205    10.10.1.2 → 10.10.1.1    TCP 83 53206 → 8081 [PSH, ACK] Seq=630 Ack=630 Win=64256 Len=17 TSval=1007460906 TSecr=3131720612
1711508999.170718670   331 0.607523087    10.10.1.1 → 10.10.1.2    TCP 83 8081 → 53206 [PSH, ACK] Seq=630 Ack=647 Win=65152 Len=17 TSval=3131720612 TSecr=1007460906
1711509006.170718670   338 0.608399355    10.10.1.2 → 10.10.1.1    TCP 83 53206 → 8081 [PSH, ACK] Seq=647 Ack=647 Win=64256 Len=17 TSval=1007460907 TSecr=3131720612
1711509007.170718670   339 0.608410253    10.10.1.1 → 10.10.1.2    TCP 83 8081 → 53206 [PSH, ACK] Seq=647 Ack=664 Win=65152 Len=17 TSval=3131720613 TSecr=1007460907
1711509014.170718670   346 0.609194004    10.10.1.2 → 10.10.1.1    TCP 83 53206 → 8081 [PSH, ACK] Seq=664 Ack=664 Win=64256 Len=17 TSval=1007460908 TSecr=3131720613
1711509015.170718670   347 0.609205968    10.10.1.1 → 10.10.1.2    TCP 83 8081 → 53206 [PSH, ACK] Seq=664 Ack=681 Win=65152 Len=17 TSval=3131720614 TSecr=1007460908
1711509022.170718670   354 0.611279674    10.10.1.2 → 10.10.1.1    TCP 83 53206 → 8081 [PSH, ACK] Seq=681 Ack=681 Win=64256 Len=17 TSval=1007460910 TSecr=3131720614
1711509023.170718670   355 0.611290848    10.10.1.1 → 10.10.1.2    TCP 83 8081 → 53206 [PSH, ACK] Seq=681 Ack=698 Win=65152 Len=17 TSval=3131720616 TSecr=1007460910
1711509030.170718670   362 0.613489564    10.10.1.2 → 10.10.1.1    TCP 83 53206 → 8081 [PSH, ACK] Seq=698 Ack=698 Win=64256 Len=17 TSval=1007460912 TSecr=3131720616
1711509031.170718670   363 0.613504448    10.10.1.1 → 10.10.1.2    TCP 83 8081 → 53206 [PSH, ACK] Seq=698 Ack=715 Win=65152 Len=17 TSval=3131720618 TSecr=1007460912
1711509038.170718670   370 0.614662064    10.10.1.2 → 10.10.1.1    TCP 83 53206 → 8081 [PSH, ACK] Seq=715 Ack=715 Win=64256 Len=17 TSval=1007460913 TSecr=3131720618
1711509039.170718670   371 0.614673353    10.10.1.1 → 10.10.1.2    TCP 83 8081 → 53206 [PSH, ACK] Seq=715 Ack=732 Win=65152 Len=17 TSval=3131720620 TSecr=1007460913
1711509046.170718670   378 0.616270882    10.10.1.2 → 10.10.1.1    TCP 83 53206 → 8081 [PSH, ACK] Seq=732 Ack=732 Win=64256 Len=17 TSval=1007460915 TSecr=3131720620
1711509047.170718670   379 0.616281822    10.10.1.1 → 10.10.1.2    TCP 83 8081 → 53206 [PSH, ACK] Seq=732 Ack=749 Win=65152 Len=17 TSval=3131720621 TSecr=1007460915
1711509054.170718670   386 0.618174189    10.10.1.2 → 10.10.1.1    TCP 83 53206 → 8081 [PSH, ACK] Seq=749 Ack=749 Win=64256 Len=17 TSval=1007460916 TSecr=3131720621
1711509055.170718670   387 0.618188952    10.10.1.1 → 10.10.1.2    TCP 83 8081 → 53206 [PSH, ACK] Seq=749 Ack=766 Win=65152 Len=17 TSval=3131720623 TSecr=1007460916
1711509062.170718670   394 0.619191725    10.10.1.2 → 10.10.1.1    TCP 83 53206 → 8081 [PSH, ACK] Seq=766 Ack=766 Win=64256 Len=17 TSval=1007460918 TSecr=3131720623
1711509063.170718670   395 0.619202747    10.10.1.1 → 10.10.1.2    TCP 83 8081 → 53206 [PSH, ACK] Seq=766 Ack=783 Win=65152 Len=17 TSval=3131720624 TSecr=1007460918
1711509070.170718670   402 0.620469591    10.10.1.2 → 10.10.1.1    TCP 83 53206 → 8081 [PSH, ACK] Seq=783 Ack=783 Win=64256 Len=17 TSval=1007460919 TSecr=3131720624
1711509071.170718670   403 0.620480592    10.10.1.1 → 10.10.1.2    TCP 83 8081 → 53206 [PSH, ACK] Seq=783 Ack=800 Win=65152 Len=17 TSval=3131720625 TSecr=1007460919
1711509078.170718670   410 0.621692525    10.10.1.2 → 10.10.1.1    TCP 83 53206 → 8081 [PSH, ACK] Seq=800 Ack=800 Win=64256 Len=17 TSval=1007460920 TSecr=3131720625
1711509079.170718670   411 0.621706921    10.10.1.1 → 10.10.1.2    TCP 83 8081 → 53206 [PSH, ACK] Seq=800 Ack=817 Win=65152 Len=17 TSval=3131720627 TSecr=1007460920
1711509086.170718670   418 0.622167537    10.10.1.2 → 10.10.1.1    TCP 83 53206 → 8081 [PSH, ACK] Seq=817 Ack=817 Win=64256 Len=17 TSval=1007460920 TSecr=3131720627
1711509087.170718670   419 0.622178471    10.10.1.1 → 10.10.1.2    TCP 83 8081 → 53206 [PSH, ACK] Seq=817 Ack=834 Win=65152 Len=17 TSval=3131720627 TSecr=1007460920
1711509094.170718670   426 0.623753664    10.10.1.2 → 10.10.1.1    TCP 83 53206 → 8081 [PSH, ACK] Seq=834 Ack=834 Win=64256 Len=17 TSval=1007460922 TSecr=3131720627
1711509095.170718670   427 0.623765090    10.10.1.1 → 10.10.1.2    TCP 83 8081 → 53206 [PSH, ACK] Seq=834 Ack=851 Win=65152 Len=17 TSval=3131720629 TSecr=1007460922
1711509102.170718670   434 0.624083736    10.10.1.2 → 10.10.1.1    TCP 83 53206 → 8081 [PSH, ACK] Seq=851 Ack=851 Win=64256 Len=17 TSval=1007460922 TSecr=3131720629
1711509103.170718670   435 0.624094524    10.10.1.1 → 10.10.1.2    TCP 83 8081 → 53206 [PSH, ACK] Seq=851 Ack=868 Win=65152 Len=17 TSval=3131720629 TSecr=1007460922
1711509108.170718670   440 0.624250034    10.10.1.2 → 10.10.1.1    TCP 83 53206 → 8081 [PSH, ACK] Seq=868 Ack=868 Win=64256 Len=17 TSval=1007460923 TSecr=3131720629
1711509109.170718670   441 0.624260683    10.10.1.1 → 10.10.1.2    TCP 83 8081 → 53206 [PSH, ACK] Seq=868 Ack=885 Win=65152 Len=17 TSval=3131720629 TSecr=1007460923
1711509116.170718670   448 0.624736331    10.10.1.2 → 10.10.1.1    TCP 83 53206 → 8081 [PSH, ACK] Seq=885 Ack=885 Win=64256 Len=17 TSval=1007460923 TSecr=3131720629
1711509117.170718670   449 0.624750463    10.10.1.1 → 10.10.1.2    TCP 83 8081 → 53206 [PSH, ACK] Seq=885 Ack=902 Win=65152 Len=17 TSval=3131720630 TSecr=1007460923
1711509122.170718670   454 0.624944582    10.10.1.2 → 10.10.1.1    TCP 83 53206 → 8081 [PSH, ACK] Seq=902 Ack=902 Win=64256 Len=17 TSval=1007460923 TSecr=3131720630
1711509123.170718670   455 0.624955783    10.10.1.1 → 10.10.1.2    TCP 83 8081 → 53206 [PSH, ACK] Seq=902 Ack=919 Win=65152 Len=17 TSval=3131720630 TSecr=1007460923
1711509130.170718670   462 0.625283465    10.10.1.2 → 10.10.1.1    TCP 83 53206 → 8081 [PSH, ACK] Seq=919 Ack=919 Win=64256 Len=17 TSval=1007460924 TSecr=3131720630
1711509131.170718670   463 0.625294376    10.10.1.1 → 10.10.1.2    TCP 83 8081 → 53206 [PSH, ACK] Seq=919 Ack=936 Win=65152 Len=17 TSval=3131720630 TSecr=1007460924
1711509138.170718670   470 0.626646115    10.10.1.2 → 10.10.1.1    TCP 83 53206 → 8081 [PSH, ACK] Seq=936 Ack=936 Win=64256 Len=17 TSval=1007460925 TSecr=3131720630
1711509139.170718670   471 0.626657200    10.10.1.1 → 10.10.1.2    TCP 83 8081 → 53206 [PSH, ACK] Seq=936 Ack=953 Win=65152 Len=17 TSval=3131720632 TSecr=1007460925
1711509146.170718670   478 0.628431916    10.10.1.2 → 10.10.1.1    TCP 83 53206 → 8081 [PSH, ACK] Seq=953 Ack=953 Win=64256 Len=17 TSval=1007460927 TSecr=3131720632
1711509149.170718670   481 0.628473904    10.10.1.1 → 10.10.1.2    TCP 83 8081 → 53206 [PSH, ACK] Seq=953 Ack=970 Win=65152 Len=17 TSval=3131720633 TSecr=1007460927
1711509154.170718670   486 0.629264225    10.10.1.2 → 10.10.1.1    TCP 83 53206 → 8081 [PSH, ACK] Seq=970 Ack=970 Win=64256 Len=17 TSval=1007460928 TSecr=3131720633
1711509155.170718670   487 0.629278568    10.10.1.1 → 10.10.1.2    TCP 83 8081 → 53206 [PSH, ACK] Seq=970 Ack=987 Win=65152 Len=17 TSval=3131720634 TSecr=1007460928
1711509162.170718670   494 0.630423479    10.10.1.2 → 10.10.1.1    TCP 83 53206 → 8081 [PSH, ACK] Seq=987 Ack=987 Win=64256 Len=17 TSval=1007460929 TSecr=3131720634
1711509163.170718670   495 0.630434414    10.10.1.1 → 10.10.1.2    TCP 83 8081 → 53206 [PSH, ACK] Seq=987 Ack=1004 Win=65152 Len=17 TSval=3131720635 TSecr=1007460929
1711509170.170718670   502 0.630905674    10.10.1.2 → 10.10.1.1    TCP 83 53206 → 8081 [PSH, ACK] Seq=1004 Ack=1004 Win=64256 Len=17 TSval=1007460929 TSecr=3131720635
1711509171.170718670   503 0.630916550    10.10.1.1 → 10.10.1.2    TCP 83 8081 → 53206 [PSH, ACK] Seq=1004 Ack=1021 Win=65152 Len=17 TSval=3131720636 TSecr=1007460929
1711509178.170718670   510 0.631601087    10.10.1.2 → 10.10.1.1    TCP 83 53206 → 8081 [PSH, ACK] Seq=1021 Ack=1021 Win=64256 Len=17 TSval=1007460930 TSecr=3131720636
1711509179.170718670   511 0.631612002    10.10.1.1 → 10.10.1.2    TCP 83 8081 → 53206 [PSH, ACK] Seq=1021 Ack=1038 Win=65152 Len=17 TSval=3131720637 TSecr=1007460930
1711509186.170718670   518 0.634547410    10.10.1.2 → 10.10.1.1    TCP 83 53206 → 8081 [PSH, ACK] Seq=1038 Ack=1038 Win=64256 Len=17 TSval=1007460933 TSecr=3131720637
1711509187.170718670   519 0.634561786    10.10.1.1 → 10.10.1.2    TCP 83 8081 → 53206 [PSH, ACK] Seq=1038 Ack=1055 Win=65152 Len=17 TSval=3131720640 TSecr=1007460933
1711509194.170718670   526 0.635895036    10.10.1.2 → 10.10.1.1    TCP 83 53206 → 8081 [PSH, ACK] Seq=1055 Ack=1055 Win=64256 Len=17 TSval=1007460934 TSecr=3131720640
1711509195.170718670   527 0.635906261    10.10.1.1 → 10.10.1.2    TCP 83 8081 → 53206 [PSH, ACK] Seq=1055 Ack=1072 Win=65152 Len=17 TSval=3131720641 TSecr=1007460934
1711509202.170718670   534 0.636777147    10.10.1.2 → 10.10.1.1    TCP 83 53206 → 8081 [PSH, ACK] Seq=1072 Ack=1072 Win=64256 Len=17 TSval=1007460935 TSecr=3131720641
1711509203.170718670   535 0.636791464    10.10.1.1 → 10.10.1.2    TCP 83 8081 → 53206 [PSH, ACK] Seq=1072 Ack=1089 Win=65152 Len=17 TSval=3131720642 TSecr=1007460935
1711509210.170718670   542 0.637324224    10.10.1.2 → 10.10.1.1    TCP 83 53206 → 8081 [PSH, ACK] Seq=1089 Ack=1089 Win=64256 Len=17 TSval=1007460936 TSecr=3131720642
1711509211.170718670   543 0.637335422    10.10.1.1 → 10.10.1.2    TCP 83 8081 → 53206 [PSH, ACK] Seq=1089 Ack=1106 Win=65152 Len=17 TSval=3131720642 TSecr=1007460936
1711509216.170718670   548 0.637487875    10.10.1.2 → 10.10.1.1    TCP 83 53206 → 8081 [PSH, ACK] Seq=1106 Ack=1106 Win=64256 Len=17 TSval=1007460936 TSecr=3131720642
1711509217.170718670   549 0.637498684    10.10.1.1 → 10.10.1.2    TCP 83 8081 → 53206 [PSH, ACK] Seq=1106 Ack=1123 Win=65152 Len=17 TSval=3131720642 TSecr=1007460936
1711509224.170718670   556 0.638658920    10.10.1.2 → 10.10.1.1    TCP 83 53206 → 8081 [PSH, ACK] Seq=1123 Ack=1123 Win=64256 Len=17 TSval=1007460937 TSecr=3131720642
1711509225.170718670   557 0.638673279    10.10.1.1 → 10.10.1.2    TCP 83 8081 → 53206 [PSH, ACK] Seq=1123 Ack=1140 Win=65152 Len=17 TSval=3131720644 TSecr=1007460937
1711509232.170718670   564 0.640218216    10.10.1.2 → 10.10.1.1    TCP 83 53206 → 8081 [PSH, ACK] Seq=1140 Ack=1140 Win=64256 Len=17 TSval=1007460939 TSecr=3131720644
1711509233.170718670   565 0.640230164    10.10.1.1 → 10.10.1.2    TCP 83 8081 → 53206 [PSH, ACK] Seq=1140 Ack=1157 Win=65152 Len=17 TSval=3131720645 TSecr=1007460939
1711509240.170718670   572 0.640613369    10.10.1.2 → 10.10.1.1    TCP 83 53206 → 8081 [PSH, ACK] Seq=1157 Ack=1157 Win=64256 Len=17 TSval=1007460939 TSecr=3131720645
1711509241.170718670   573 0.640626356    10.10.1.1 → 10.10.1.2    TCP 83 8081 → 53206 [PSH, ACK] Seq=1157 Ack=1174 Win=65152 Len=17 TSval=3131720646 TSecr=1007460939
1711509248.170718670   580 0.640940603    10.10.1.2 → 10.10.1.1    TCP 83 53206 → 8081 [PSH, ACK] Seq=1174 Ack=1174 Win=64256 Len=17 TSval=1007460939 TSecr=3131720646
1711509249.170718670   581 0.640951593    10.10.1.1 → 10.10.1.2    TCP 83 8081 → 53206 [PSH, ACK] Seq=1174 Ack=1191 Win=65152 Len=17 TSval=3131720646 TSecr=1007460939
1711509256.170718670   588 0.641352404    10.10.1.2 → 10.10.1.1    TCP 83 53206 → 8081 [PSH, ACK] Seq=1191 Ack=1191 Win=64256 Len=17 TSval=1007460940 TSecr=3131720646
1711509257.170718670   589 0.641363041    10.10.1.1 → 10.10.1.2    TCP 83 8081 → 53206 [PSH, ACK] Seq=1191 Ack=1208 Win=65152 Len=17 TSval=3131720646 TSecr=1007460940
1711509262.170718670   594 0.641525583    10.10.1.2 → 10.10.1.1    TCP 83 53206 → 8081 [PSH, ACK] Seq=1208 Ack=1208 Win=64256 Len=17 TSval=1007460940 TSecr=3131720646
1711509263.170718670   595 0.641541828    10.10.1.1 → 10.10.1.2    TCP 83 8081 → 53206 [PSH, ACK] Seq=1208 Ack=1225 Win=65152 Len=17 TSval=3131720647 TSecr=1007460940
1711509270.170718670   602 0.641728221    10.10.1.2 → 10.10.1.1    TCP 83 53206 → 8081 [PSH, ACK] Seq=1225 Ack=1225 Win=64256 Len=17 TSval=1007460940 TSecr=3131720647
1711509271.170718670   603 0.641738697    10.10.1.1 → 10.10.1.2    TCP 83 8081 → 53206 [PSH, ACK] Seq=1225 Ack=1242 Win=65152 Len=17 TSval=3131720647 TSecr=1007460940
1711509276.170718670   608 0.643810721    10.10.1.2 → 10.10.1.1    TCP 83 53206 → 8081 [PSH, ACK] Seq=1242 Ack=1242 Win=64256 Len=17 TSval=1007460942 TSecr=3131720647
1711509277.170718670   609 0.643822753    10.10.1.1 → 10.10.1.2    TCP 83 8081 → 53206 [PSH, ACK] Seq=1242 Ack=1259 Win=65152 Len=17 TSval=3131720649 TSecr=1007460942
1711509284.170718670   616 0.645724861    10.10.1.2 → 10.10.1.1    TCP 83 53206 → 8081 [PSH, ACK] Seq=1259 Ack=1259 Win=64256 Len=17 TSval=1007460944 TSecr=3131720649
1711509285.170718670   617 0.645740798    10.10.1.1 → 10.10.1.2    TCP 83 8081 → 53206 [PSH, ACK] Seq=1259 Ack=1276 Win=65152 Len=17 TSval=3131720651 TSecr=1007460944
1711509292.170718670   624 0.647790475    10.10.1.2 → 10.10.1.1    TCP 83 53206 → 8081 [PSH, ACK] Seq=1276 Ack=1276 Win=64256 Len=17 TSval=1007460946 TSecr=3131720651
1711509293.170718670   625 0.647801847    10.10.1.1 → 10.10.1.2    TCP 83 8081 → 53206 [PSH, ACK] Seq=1276 Ack=1293 Win=65152 Len=17 TSval=3131720653 TSecr=1007460946
1711509300.170718670   632 0.648484759    10.10.1.2 → 10.10.1.1    TCP 83 53206 → 8081 [PSH, ACK] Seq=1293 Ack=1293 Win=64256 Len=17 TSval=1007460947 TSecr=3131720653
1711509301.170718670   633 0.648495744    10.10.1.1 → 10.10.1.2    TCP 83 8081 → 53206 [PSH, ACK] Seq=1293 Ack=1310 Win=65152 Len=17 TSval=3131720653 TSecr=1007460947
1711509308.170718670   640 0.649339027    10.10.1.2 → 10.10.1.1    TCP 83 53206 → 8081 [PSH, ACK] Seq=1310 Ack=1310 Win=64256 Len=17 TSval=1007460948 TSecr=3131720653
1711509309.170718670   641 0.649353308    10.10.1.1 → 10.10.1.2    TCP 83 8081 → 53206 [PSH, ACK] Seq=1310 Ack=1327 Win=65152 Len=17 TSval=3131720654 TSecr=1007460948
1711509316.170718670   648 0.650182649    10.10.1.2 → 10.10.1.1    TCP 83 53206 → 8081 [PSH, ACK] Seq=1327 Ack=1327 Win=64256 Len=17 TSval=1007460949 TSecr=3131720654
1711509317.170718670   649 0.650193658    10.10.1.1 → 10.10.1.2    TCP 83 8081 → 53206 [PSH, ACK] Seq=1327 Ack=1344 Win=65152 Len=17 TSval=3131720655 TSecr=1007460949
1711509324.170718670   656 0.651496585    10.10.1.2 → 10.10.1.1    TCP 83 53206 → 8081 [PSH, ACK] Seq=1344 Ack=1344 Win=64256 Len=17 TSval=1007460950 TSecr=3131720655
1711509325.170718670   657 0.651507831    10.10.1.1 → 10.10.1.2    TCP 83 8081 → 53206 [PSH, ACK] Seq=1344 Ack=1361 Win=65152 Len=17 TSval=3131720656 TSecr=1007460950
1711509332.170718670   664 0.651945796    10.10.1.2 → 10.10.1.1    TCP 83 53206 → 8081 [PSH, ACK] Seq=1361 Ack=1361 Win=64256 Len=17 TSval=1007460950 TSecr=3131720656
1711509333.170718670   665 0.651956668    10.10.1.1 → 10.10.1.2    TCP 83 8081 → 53206 [PSH, ACK] Seq=1361 Ack=1378 Win=65152 Len=17 TSval=3131720657 TSecr=1007460950
1711509340.170718670   672 0.653165075    10.10.1.2 → 10.10.1.1    TCP 83 53206 → 8081 [PSH, ACK] Seq=1378 Ack=1378 Win=64256 Len=17 TSval=1007460951 TSecr=3131720657
1711509341.170718670   673 0.653179462    10.10.1.1 → 10.10.1.2    TCP 83 8081 → 53206 [PSH, ACK] Seq=1378 Ack=1395 Win=65152 Len=17 TSval=3131720658 TSecr=1007460951
1711509348.170718670   680 0.654584744    10.10.1.2 → 10.10.1.1    TCP 83 53206 → 8081 [PSH, ACK] Seq=1395 Ack=1395 Win=64256 Len=17 TSval=1007460953 TSecr=3131720658
1711509349.170718670   681 0.654596023    10.10.1.1 → 10.10.1.2    TCP 83 8081 → 53206 [PSH, ACK] Seq=1395 Ack=1412 Win=65152 Len=17 TSval=3131720660 TSecr=1007460953
1711509356.170718670   688 0.655509189    10.10.1.2 → 10.10.1.1    TCP 83 53206 → 8081 [PSH, ACK] Seq=1412 Ack=1412 Win=64256 Len=17 TSval=1007460954 TSecr=3131720660
1711509357.170718670   689 0.655520365    10.10.1.1 → 10.10.1.2    TCP 83 8081 → 53206 [PSH, ACK] Seq=1412 Ack=1429 Win=65152 Len=17 TSval=3131720660 TSecr=1007460954
1711509364.170718670   696 0.656950147    10.10.1.2 → 10.10.1.1    TCP 83 53206 → 8081 [PSH, ACK] Seq=1429 Ack=1429 Win=64256 Len=17 TSval=1007460955 TSecr=3131720660
1711509365.170718670   697 0.656964670    10.10.1.1 → 10.10.1.2    TCP 83 8081 → 53206 [PSH, ACK] Seq=1429 Ack=1446 Win=65152 Len=17 TSval=3131720662 TSecr=1007460955
1711509372.170718670   704 0.659255829    10.10.1.2 → 10.10.1.1    TCP 83 53206 → 8081 [PSH, ACK] Seq=1446 Ack=1446 Win=64256 Len=17 TSval=1007460958 TSecr=3131720662
1711509373.170718670   705 0.659267312    10.10.1.1 → 10.10.1.2    TCP 83 8081 → 53206 [PSH, ACK] Seq=1446 Ack=1463 Win=65152 Len=17 TSval=3131720664 TSecr=1007460958
1711509380.170718670   712 0.659673431    10.10.1.2 → 10.10.1.1    TCP 83 53206 → 8081 [PSH, ACK] Seq=1463 Ack=1463 Win=64256 Len=17 TSval=1007460958 TSecr=3131720664
1711509381.170718670   713 0.659684458    10.10.1.1 → 10.10.1.2    TCP 83 8081 → 53206 [PSH, ACK] Seq=1463 Ack=1480 Win=65152 Len=17 TSval=3131720665 TSecr=1007460958
1711509388.170718670   720 0.660576600    10.10.1.2 → 10.10.1.1    TCP 83 53206 → 8081 [PSH, ACK] Seq=1480 Ack=1480 Win=64256 Len=17 TSval=1007460959 TSecr=3131720665
1711509389.170718670   721 0.660593244    10.10.1.1 → 10.10.1.2    TCP 83 8081 → 53206 [PSH, ACK] Seq=1480 Ack=1497 Win=65152 Len=17 TSval=3131720666 TSecr=1007460959
1711509396.170718670   728 0.661176207    10.10.1.2 → 10.10.1.1    TCP 83 53206 → 8081 [PSH, ACK] Seq=1497 Ack=1497 Win=64256 Len=17 TSval=1007460959 TSecr=3131720666
1711509397.170718670   729 0.661187225    10.10.1.1 → 10.10.1.2    TCP 83 8081 → 53206 [PSH, ACK] Seq=1497 Ack=1514 Win=65152 Len=17 TSval=3131720666 TSecr=1007460959
1711509404.170718670   736 0.663252884    10.10.1.2 → 10.10.1.1    TCP 83 53206 → 8081 [PSH, ACK] Seq=1514 Ack=1514 Win=64256 Len=17 TSval=1007460962 TSecr=3131720666
1711509405.170718670   737 0.663264050    10.10.1.1 → 10.10.1.2    TCP 83 8081 → 53206 [PSH, ACK] Seq=1514 Ack=1531 Win=65152 Len=17 TSval=3131720668 TSecr=1007460962
1711509412.170718670   744 0.664915905    10.10.1.2 → 10.10.1.1    TCP 83 53206 → 8081 [PSH, ACK] Seq=1531 Ack=1531 Win=64256 Len=17 TSval=1007460963 TSecr=3131720668
1711509413.170718670   745 0.664929151    10.10.1.1 → 10.10.1.2    TCP 83 8081 → 53206 [PSH, ACK] Seq=1531 Ack=1548 Win=65152 Len=17 TSval=3131720670 TSecr=1007460963
1711509420.170718670   752 0.666548628    10.10.1.2 → 10.10.1.1    TCP 83 53206 → 8081 [PSH, ACK] Seq=1548 Ack=1548 Win=64256 Len=17 TSval=1007460965 TSecr=3131720670
1711509421.170718670   753 0.666559904    10.10.1.1 → 10.10.1.2    TCP 83 8081 → 53206 [PSH, ACK] Seq=1548 Ack=1565 Win=65152 Len=17 TSval=3131720672 TSecr=1007460965
1711509428.170718670   760 0.668272680    10.10.1.2 → 10.10.1.1    TCP 83 53206 → 8081 [PSH, ACK] Seq=1565 Ack=1565 Win=64256 Len=17 TSval=1007460967 TSecr=3131720672
1711509429.170718670   761 0.668283874    10.10.1.1 → 10.10.1.2    TCP 83 8081 → 53206 [PSH, ACK] Seq=1565 Ack=1582 Win=65152 Len=17 TSval=3131720673 TSecr=1007460967
1711509436.170718670   768 0.669066815    10.10.1.2 → 10.10.1.1    TCP 83 53206 → 8081 [PSH, ACK] Seq=1582 Ack=1582 Win=64256 Len=17 TSval=1007460967 TSecr=3131720673
1711509437.170718670   769 0.669080812    10.10.1.1 → 10.10.1.2    TCP 83 8081 → 53206 [PSH, ACK] Seq=1582 Ack=1599 Win=65152 Len=17 TSval=3131720674 TSecr=1007460967
1711509444.170718670   776 0.669543622    10.10.1.2 → 10.10.1.1    TCP 83 53206 → 8081 [PSH, ACK] Seq=1599 Ack=1599 Win=64256 Len=17 TSval=1007460968 TSecr=3131720674
1711509445.170718670   777 0.669554598    10.10.1.1 → 10.10.1.2    TCP 83 8081 → 53206 [PSH, ACK] Seq=1599 Ack=1616 Win=65152 Len=17 TSval=3131720675 TSecr=1007460968
1711509452.170718670   784 0.669820269    10.10.1.2 → 10.10.1.1    TCP 83 53206 → 8081 [PSH, ACK] Seq=1616 Ack=1616 Win=64256 Len=17 TSval=1007460968 TSecr=3131720675
1711509453.170718670   785 0.669831223    10.10.1.1 → 10.10.1.2    TCP 83 8081 → 53206 [PSH, ACK] Seq=1616 Ack=1633 Win=65152 Len=17 TSval=3131720675 TSecr=1007460968
1711509460.170718670   792 0.670647433    10.10.1.2 → 10.10.1.1    TCP 83 53206 → 8081 [PSH, ACK] Seq=1633 Ack=1633 Win=64256 Len=17 TSval=1007460969 TSecr=3131720675
1711509461.170718670   793 0.670658247    10.10.1.1 → 10.10.1.2    TCP 83 8081 → 53206 [PSH, ACK] Seq=1633 Ack=1650 Win=65152 Len=17 TSval=3131720676 TSecr=1007460969
1711509468.170718670   800 0.673110296    10.10.1.2 → 10.10.1.1    TCP 83 53206 → 8081 [PSH, ACK] Seq=1650 Ack=1650 Win=64256 Len=17 TSval=1007460971 TSecr=3131720676
1711509469.170718670   801 0.673124985    10.10.1.1 → 10.10.1.2    TCP 83 8081 → 53206 [PSH, ACK] Seq=1650 Ack=1667 Win=65152 Len=17 TSval=3131720678 TSecr=1007460971
1711509476.170718670   808 0.675284339    10.10.1.2 → 10.10.1.1    TCP 83 53206 → 8081 [PSH, ACK] Seq=1667 Ack=1667 Win=64256 Len=17 TSval=1007460974 TSecr=3131720678
1711509477.170718670   809 0.675295318    10.10.1.1 → 10.10.1.2    TCP 83 8081 → 53206 [PSH, ACK] Seq=1667 Ack=1684 Win=65152 Len=17 TSval=3131720680 TSecr=1007460974
1711509484.170718670   816 0.676625914    10.10.1.2 → 10.10.1.1    TCP 83 53206 → 8081 [PSH, ACK] Seq=1684 Ack=1684 Win=64256 Len=17 TSval=1007460975 TSecr=3131720680
1711509485.170718670   817 0.676640182    10.10.1.1 → 10.10.1.2    TCP 83 8081 → 53206 [PSH, ACK] Seq=1684 Ack=1701 Win=65152 Len=17 TSval=3131720682 TSecr=1007460975
1711509492.170718670   824 0.676855807    10.10.1.2 → 10.10.1.1    TCP 83 53206 → 8081 [PSH, ACK] Seq=1701 Ack=1701 Win=64256 Len=17 TSval=1007460975 TSecr=3131720682
1711509493.170718670   825 0.676866242    10.10.1.1 → 10.10.1.2    TCP 83 8081 → 53206 [PSH, ACK] Seq=1701 Ack=1718 Win=65152 Len=17 TSval=3131720682 TSecr=1007460975
1711509496.170718670   828 0.677042578    10.10.1.2 → 10.10.1.1    TCP 83 53206 → 8081 [PSH, ACK] Seq=1718 Ack=1718 Win=64256 Len=17 TSval=1007460975 TSecr=3131720682
1711509497.170718670   829 0.677053689    10.10.1.1 → 10.10.1.2    TCP 83 8081 → 53206 [PSH, ACK] Seq=1718 Ack=1735 Win=65152 Len=17 TSval=3131720682 TSecr=1007460975
1711509504.170718670   836 0.678653033    10.10.1.2 → 10.10.1.1    TCP 83 53206 → 8081 [PSH, ACK] Seq=1735 Ack=1735 Win=64256 Len=17 TSval=1007460977 TSecr=3131720682
1711509505.170718670   837 0.678663962    10.10.1.1 → 10.10.1.2    TCP 83 8081 → 53206 [PSH, ACK] Seq=1735 Ack=1752 Win=65152 Len=17 TSval=3131720684 TSecr=1007460977
1711509510.170718670   842 0.678841708    10.10.1.2 → 10.10.1.1    TCP 83 53206 → 8081 [PSH, ACK] Seq=1752 Ack=1752 Win=64256 Len=17 TSval=1007460977 TSecr=3131720684
1711509511.170718670   843 0.678852589    10.10.1.1 → 10.10.1.2    TCP 83 8081 → 53206 [PSH, ACK] Seq=1752 Ack=1769 Win=65152 Len=17 TSval=3131720684 TSecr=1007460977
1711509518.170718670   850 0.681799703    10.10.1.2 → 10.10.1.1    TCP 83 53206 → 8081 [PSH, ACK] Seq=1769 Ack=1769 Win=64256 Len=17 TSval=1007460980 TSecr=3131720684
1711509519.170718670   851 0.681817451    10.10.1.1 → 10.10.1.2    TCP 83 8081 → 53206 [PSH, ACK] Seq=1769 Ack=1786 Win=65152 Len=17 TSval=3131720687 TSecr=1007460980
1711509526.170718670   858 0.682854488    10.10.1.2 → 10.10.1.1    TCP 83 53206 → 8081 [PSH, ACK] Seq=1786 Ack=1786 Win=64256 Len=17 TSval=1007460981 TSecr=3131720687
1711509527.170718670   859 0.682865634    10.10.1.1 → 10.10.1.2    TCP 83 8081 → 53206 [PSH, ACK] Seq=1786 Ack=1803 Win=65152 Len=17 TSval=3131720688 TSecr=1007460981
1711509534.170718670   866 0.685741689    10.10.1.2 → 10.10.1.1    TCP 83 53206 → 8081 [PSH, ACK] Seq=1803 Ack=1803 Win=64256 Len=17 TSval=1007460984 TSecr=3131720688
1711509535.170718670   867 0.685755984    10.10.1.1 → 10.10.1.2    TCP 83 8081 → 53206 [PSH, ACK] Seq=1803 Ack=1820 Win=65152 Len=17 TSval=3131720691 TSecr=1007460984
1711509542.170718670   874 0.686340776    10.10.1.2 → 10.10.1.1    TCP 83 53206 → 8081 [PSH, ACK] Seq=1820 Ack=1820 Win=64256 Len=17 TSval=1007460985 TSecr=3131720691
1711509543.170718670   875 0.686351839    10.10.1.1 → 10.10.1.2    TCP 83 8081 → 53206 [PSH, ACK] Seq=1820 Ack=1837 Win=65152 Len=17 TSval=3131720691 TSecr=1007460985
1711509548.170718670   880 0.686577006    10.10.1.2 → 10.10.1.1    TCP 83 53206 → 8081 [PSH, ACK] Seq=1837 Ack=1837 Win=64256 Len=17 TSval=1007460985 TSecr=3131720691
1711509550.170718670   882 0.686587815    10.10.1.1 → 10.10.1.2    TCP 83 8081 → 53206 [PSH, ACK] Seq=1837 Ack=1854 Win=65152 Len=17 TSval=3131720692 TSecr=1007460985
1711509556.170718670   888 0.687291085    10.10.1.2 → 10.10.1.1    TCP 83 53206 → 8081 [PSH, ACK] Seq=1854 Ack=1854 Win=64256 Len=17 TSval=1007460986 TSecr=3131720692
1711509557.170718670   889 0.687301982    10.10.1.1 → 10.10.1.2    TCP 83 8081 → 53206 [PSH, ACK] Seq=1854 Ack=1871 Win=65152 Len=17 TSval=3131720692 TSecr=1007460986
1711509564.170718670   896 0.687528359    10.10.1.2 → 10.10.1.1    TCP 83 53206 → 8081 [PSH, ACK] Seq=1871 Ack=1871 Win=64256 Len=17 TSval=1007460986 TSecr=3131720692
1711509565.170718670   897 0.687539404    10.10.1.1 → 10.10.1.2    TCP 83 8081 → 53206 [PSH, ACK] Seq=1871 Ack=1888 Win=65152 Len=17 TSval=3131720693 TSecr=1007460986
1711509570.170718670   902 0.688108385    10.10.1.2 → 10.10.1.1    TCP 83 53206 → 8081 [PSH, ACK] Seq=1888 Ack=1888 Win=64256 Len=17 TSval=1007460986 TSecr=3131720693
1711509571.170718670   903 0.688119157    10.10.1.1 → 10.10.1.2    TCP 83 8081 → 53206 [PSH, ACK] Seq=1888 Ack=1905 Win=65152 Len=17 TSval=3131720693 TSecr=1007460986
1711509577.170718670   909 0.688348412    10.10.1.2 → 10.10.1.1    TCP 83 53206 → 8081 [PSH, ACK] Seq=1905 Ack=1905 Win=64256 Len=17 TSval=1007460987 TSecr=3131720693
1711509579.170718670   911 0.688359553    10.10.1.1 → 10.10.1.2    TCP 83 8081 → 53206 [PSH, ACK] Seq=1905 Ack=1922 Win=65152 Len=17 TSval=3131720693 TSecr=1007460987
1711509584.170718670   916 0.689916100    10.10.1.2 → 10.10.1.1    TCP 83 53206 → 8081 [PSH, ACK] Seq=1922 Ack=1922 Win=64256 Len=17 TSval=1007460988 TSecr=3131720693
1711509587.170718670   919 0.689951897    10.10.1.1 → 10.10.1.2    TCP 83 8081 → 53206 [PSH, ACK] Seq=1922 Ack=1939 Win=65152 Len=17 TSval=3131720695 TSecr=1007460988
1711509592.170718670   924 0.692244349    10.10.1.2 → 10.10.1.1    TCP 83 53206 → 8081 [PSH, ACK] Seq=1939 Ack=1939 Win=64256 Len=17 TSval=1007460991 TSecr=3131720695
1711509593.170718670   925 0.692256221    10.10.1.1 → 10.10.1.2    TCP 83 8081 → 53206 [PSH, ACK] Seq=1939 Ack=1956 Win=65152 Len=17 TSval=3131720697 TSecr=1007460991
1711509600.170718670   932 0.694038544    10.10.1.2 → 10.10.1.1    TCP 83 53206 → 8081 [PSH, ACK] Seq=1956 Ack=1956 Win=64256 Len=17 TSval=1007460992 TSecr=3131720697
1711509601.170718670   933 0.694053079    10.10.1.1 → 10.10.1.2    TCP 83 8081 → 53206 [PSH, ACK] Seq=1956 Ack=1973 Win=65152 Len=17 TSval=3131720699 TSecr=1007460992
1711509608.170718670   940 0.695250393    10.10.1.2 → 10.10.1.1    TCP 83 53206 → 8081 [PSH, ACK] Seq=1973 Ack=1973 Win=64256 Len=17 TSval=1007460994 TSecr=3131720699
1711509609.170718670   941 0.695261299    10.10.1.1 → 10.10.1.2    TCP 83 8081 → 53206 [PSH, ACK] Seq=1973 Ack=1990 Win=65152 Len=17 TSval=3131720700 TSecr=1007460994
1711509616.170718670   948 0.695516989    10.10.1.2 → 10.10.1.1    TCP 83 53206 → 8081 [PSH, ACK] Seq=1990 Ack=1990 Win=64256 Len=17 TSval=1007460994 TSecr=3131720700
1711509617.170718670   949 0.695527798    10.10.1.1 → 10.10.1.2    TCP 83 8081 → 53206 [PSH, ACK] Seq=1990 Ack=2007 Win=65152 Len=17 TSval=3131720700 TSecr=1007460994
1711509624.170718670   956 0.696111391    10.10.1.2 → 10.10.1.1    TCP 83 53206 → 8081 [PSH, ACK] Seq=2007 Ack=2007 Win=64256 Len=17 TSval=1007460994 TSecr=3131720700
1711509625.170718670   957 0.696122764    10.10.1.1 → 10.10.1.2    TCP 83 8081 → 53206 [PSH, ACK] Seq=2007 Ack=2024 Win=65152 Len=17 TSval=3131720701 TSecr=1007460994
1711509632.170718670   964 0.701186381    10.10.1.2 → 10.10.1.1    TCP 83 53206 → 8081 [PSH, ACK] Seq=2024 Ack=2024 Win=64256 Len=17 TSval=1007460999 TSecr=3131720701
1711509633.170718670   965 0.701200679    10.10.1.1 → 10.10.1.2    TCP 83 8081 → 53206 [PSH, ACK] Seq=2024 Ack=2041 Win=65152 Len=17 TSval=3131720706 TSecr=1007460999
1711509640.170718670   972 0.704551756    10.10.1.2 → 10.10.1.1    TCP 83 53206 → 8081 [PSH, ACK] Seq=2041 Ack=2041 Win=64256 Len=17 TSval=1007461003 TSecr=3131720706
