1711545291.002868652    22 0.268401265    10.10.1.2 → 10.10.1.1    TCP 74 46858 → 8081 [SYN] Seq=0 Win=64240 Len=0 MSS=1460 SACK_PERM=1 TSval=1044061661 TSecr=0 WS=128
1711545292.002868652    23 0.268414245    10.10.1.1 → 10.10.1.2    TCP 74 8081 → 46858 [SYN, ACK] Seq=0 Ack=1 Win=65160 Len=0 MSS=1460 SACK_PERM=1 TSval=3168321370 TSecr=1044061661 WS=128
1711545293.002868652    24 0.268443613    10.10.1.2 → 10.10.1.1    TCP 66 46858 → 8081 [ACK] Seq=1 Ack=1 Win=64256 Len=0 TSval=1044061662 TSecr=3168321370
1711545310.002868652    41 0.517038696    10.10.1.2 → 10.10.1.1    TCP 83 46858 → 8081 [PSH, ACK] Seq=1 Ack=1 Win=64256 Len=17 TSval=1044061910 TSecr=3168321370
1711545311.002868652    42 0.517043238    10.10.1.1 → 10.10.1.2    TCP 66 8081 → 46858 [ACK] Seq=1 Ack=18 Win=65152 Len=0 TSval=3168321618 TSecr=1044061910
1711545314.002868652    45 0.517117485    10.10.1.1 → 10.10.1.2    TCP 83 8081 → 46858 [PSH, ACK] Seq=1 Ack=18 Win=65152 Len=17 TSval=3168321618 TSecr=1044061910
1711545315.002868652    46 0.517136494    10.10.1.2 → 10.10.1.1    TCP 66 46858 → 8081 [ACK] Seq=18 Ack=18 Win=64256 Len=0 TSval=1044061910 TSecr=3168321618
1711545320.002868652    51 0.517819000    10.10.1.2 → 10.10.1.1    TCP 83 46858 → 8081 [PSH, ACK] Seq=18 Ack=18 Win=64256 Len=17 TSval=1044061911 TSecr=3168321618
1711545321.002868652    52 0.517832958    10.10.1.1 → 10.10.1.2    TCP 83 8081 → 46858 [PSH, ACK] Seq=18 Ack=35 Win=65152 Len=17 TSval=3168321619 TSecr=1044061911
1711545328.002868652    59 0.518351806    10.10.1.2 → 10.10.1.1    TCP 83 46858 → 8081 [PSH, ACK] Seq=35 Ack=35 Win=64256 Len=17 TSval=1044061911 TSecr=3168321619
1711545329.002868652    60 0.518369348    10.10.1.1 → 10.10.1.2    TCP 83 8081 → 46858 [PSH, ACK] Seq=35 Ack=52 Win=65152 Len=17 TSval=3168321620 TSecr=1044061911
1711545336.002868652    67 0.518640981    10.10.1.2 → 10.10.1.1    TCP 83 46858 → 8081 [PSH, ACK] Seq=52 Ack=52 Win=64256 Len=17 TSval=1044061912 TSecr=3168321620
1711545337.002868652    68 0.518653179    10.10.1.1 → 10.10.1.2    TCP 83 8081 → 46858 [PSH, ACK] Seq=52 Ack=69 Win=65152 Len=17 TSval=3168321620 TSecr=1044061912
1711545344.002868652    75 0.519108014    10.10.1.2 → 10.10.1.1    TCP 83 46858 → 8081 [PSH, ACK] Seq=69 Ack=69 Win=64256 Len=17 TSval=1044061912 TSecr=3168321620
1711545345.002868652    76 0.519120191    10.10.1.1 → 10.10.1.2    TCP 83 8081 → 46858 [PSH, ACK] Seq=69 Ack=86 Win=65152 Len=17 TSval=3168321620 TSecr=1044061912
1711545352.002868652    83 0.522889542    10.10.1.2 → 10.10.1.1    TCP 83 46858 → 8081 [PSH, ACK] Seq=86 Ack=86 Win=64256 Len=17 TSval=1044061916 TSecr=3168321620
1711545353.002868652    84 0.522905461    10.10.1.1 → 10.10.1.2    TCP 83 8081 → 46858 [PSH, ACK] Seq=86 Ack=103 Win=65152 Len=17 TSval=3168321624 TSecr=1044061916
1711545360.002868652    91 0.523325962    10.10.1.2 → 10.10.1.1    TCP 83 46858 → 8081 [PSH, ACK] Seq=103 Ack=103 Win=64256 Len=17 TSval=1044061916 TSecr=3168321624
1711545361.002868652    92 0.523339134    10.10.1.1 → 10.10.1.2    TCP 83 8081 → 46858 [PSH, ACK] Seq=103 Ack=120 Win=65152 Len=17 TSval=3168321625 TSecr=1044061916
1711545368.002868652    99 0.526677836    10.10.1.2 → 10.10.1.1    TCP 83 46858 → 8081 [PSH, ACK] Seq=120 Ack=120 Win=64256 Len=17 TSval=1044061920 TSecr=3168321625
1711545369.002868652   100 0.526694420    10.10.1.1 → 10.10.1.2    TCP 83 8081 → 46858 [PSH, ACK] Seq=120 Ack=137 Win=65152 Len=17 TSval=3168321628 TSecr=1044061920
1711545376.002868652   107 0.527790273    10.10.1.2 → 10.10.1.1    TCP 83 46858 → 8081 [PSH, ACK] Seq=137 Ack=137 Win=64256 Len=17 TSval=1044061921 TSecr=3168321628
1711545377.002868652   108 0.527802690    10.10.1.1 → 10.10.1.2    TCP 83 8081 → 46858 [PSH, ACK] Seq=137 Ack=154 Win=65152 Len=17 TSval=3168321629 TSecr=1044061921
1711545384.002868652   115 0.528573313    10.10.1.2 → 10.10.1.1    TCP 83 46858 → 8081 [PSH, ACK] Seq=154 Ack=154 Win=64256 Len=17 TSval=1044061922 TSecr=3168321629
1711545385.002868652   116 0.528589404    10.10.1.1 → 10.10.1.2    TCP 83 8081 → 46858 [PSH, ACK] Seq=154 Ack=171 Win=65152 Len=17 TSval=3168321630 TSecr=1044061922
1711545392.002868652   123 0.530013749    10.10.1.2 → 10.10.1.1    TCP 83 46858 → 8081 [PSH, ACK] Seq=171 Ack=171 Win=64256 Len=17 TSval=1044061923 TSecr=3168321630
1711545393.002868652   124 0.530026483    10.10.1.1 → 10.10.1.2    TCP 83 8081 → 46858 [PSH, ACK] Seq=171 Ack=188 Win=65152 Len=17 TSval=3168321631 TSecr=1044061923
1711545400.002868652   131 0.531422586    10.10.1.2 → 10.10.1.1    TCP 83 46858 → 8081 [PSH, ACK] Seq=188 Ack=188 Win=64256 Len=17 TSval=1044061925 TSecr=3168321631
1711545401.002868652   132 0.531435322    10.10.1.1 → 10.10.1.2    TCP 83 8081 → 46858 [PSH, ACK] Seq=188 Ack=205 Win=65152 Len=17 TSval=3168321633 TSecr=1044061925
1711545408.002868652   139 0.531820892    10.10.1.2 → 10.10.1.1    TCP 83 46858 → 8081 [PSH, ACK] Seq=205 Ack=205 Win=64256 Len=17 TSval=1044061925 TSecr=3168321633
1711545409.002868652   140 0.531832866    10.10.1.1 → 10.10.1.2    TCP 83 8081 → 46858 [PSH, ACK] Seq=205 Ack=222 Win=65152 Len=17 TSval=3168321633 TSecr=1044061925
1711545416.002868652   147 0.532104788    10.10.1.2 → 10.10.1.1    TCP 83 46858 → 8081 [PSH, ACK] Seq=222 Ack=222 Win=64256 Len=17 TSval=1044061925 TSecr=3168321633
1711545417.002868652   148 0.532117400    10.10.1.1 → 10.10.1.2    TCP 83 8081 → 46858 [PSH, ACK] Seq=222 Ack=239 Win=65152 Len=17 TSval=3168321633 TSecr=1044061925
1711545424.002868652   155 0.532481014    10.10.1.2 → 10.10.1.1    TCP 83 46858 → 8081 [PSH, ACK] Seq=239 Ack=239 Win=64256 Len=17 TSval=1044061926 TSecr=3168321633
1711545425.002868652   156 0.532498519    10.10.1.1 → 10.10.1.2    TCP 83 8081 → 46858 [PSH, ACK] Seq=239 Ack=256 Win=65152 Len=17 TSval=3168321634 TSecr=1044061926
1711545430.002868652   161 0.532594401    10.10.1.2 → 10.10.1.1    TCP 83 46858 → 8081 [PSH, ACK] Seq=256 Ack=256 Win=64256 Len=17 TSval=1044061926 TSecr=3168321634
1711545432.002868652   163 0.532607168    10.10.1.1 → 10.10.1.2    TCP 83 8081 → 46858 [PSH, ACK] Seq=256 Ack=273 Win=65152 Len=17 TSval=3168321634 TSecr=1044061926
1711545440.002868652   171 0.536347247    10.10.1.2 → 10.10.1.1    TCP 83 46858 → 8081 [PSH, ACK] Seq=273 Ack=273 Win=64256 Len=17 TSval=1044061929 TSecr=3168321634
1711545441.002868652   172 0.536366351    10.10.1.1 → 10.10.1.2    TCP 83 8081 → 46858 [PSH, ACK] Seq=273 Ack=290 Win=65152 Len=17 TSval=3168321638 TSecr=1044061929
1711545448.002868652   179 0.538651990    10.10.1.2 → 10.10.1.1    TCP 83 46858 → 8081 [PSH, ACK] Seq=290 Ack=290 Win=64256 Len=17 TSval=1044061932 TSecr=3168321638
1711545449.002868652   180 0.538664683    10.10.1.1 → 10.10.1.2    TCP 83 8081 → 46858 [PSH, ACK] Seq=290 Ack=307 Win=65152 Len=17 TSval=3168321640 TSecr=1044061932
1711545454.002868652   185 0.538825841    10.10.1.2 → 10.10.1.1    TCP 83 46858 → 8081 [PSH, ACK] Seq=307 Ack=307 Win=64256 Len=17 TSval=1044061932 TSecr=3168321640
1711545455.002868652   186 0.538838067    10.10.1.1 → 10.10.1.2    TCP 83 8081 → 46858 [PSH, ACK] Seq=307 Ack=324 Win=65152 Len=17 TSval=3168321640 TSecr=1044061932
1711545462.002868652   193 0.539990938    10.10.1.2 → 10.10.1.1    TCP 83 46858 → 8081 [PSH, ACK] Seq=324 Ack=324 Win=64256 Len=17 TSval=1044061933 TSecr=3168321640
1711545463.002868652   194 0.540006827    10.10.1.1 → 10.10.1.2    TCP 83 8081 → 46858 [PSH, ACK] Seq=324 Ack=341 Win=65152 Len=17 TSval=3168321641 TSecr=1044061933
1711545470.002868652   201 0.541648523    10.10.1.2 → 10.10.1.1    TCP 83 46858 → 8081 [PSH, ACK] Seq=341 Ack=341 Win=64256 Len=17 TSval=1044061935 TSecr=3168321641
1711545471.002868652   202 0.541664121    10.10.1.1 → 10.10.1.2    TCP 83 8081 → 46858 [PSH, ACK] Seq=341 Ack=358 Win=65152 Len=17 TSval=3168321643 TSecr=1044061935
1711545478.002868652   209 0.544022616    10.10.1.2 → 10.10.1.1    TCP 83 46858 → 8081 [PSH, ACK] Seq=358 Ack=358 Win=64256 Len=17 TSval=1044061937 TSecr=3168321643
1711545479.002868652   210 0.544034931    10.10.1.1 → 10.10.1.2    TCP 83 8081 → 46858 [PSH, ACK] Seq=358 Ack=375 Win=65152 Len=17 TSval=3168321645 TSecr=1044061937
1711545486.002868652   217 0.544496027    10.10.1.2 → 10.10.1.1    TCP 83 46858 → 8081 [PSH, ACK] Seq=375 Ack=375 Win=64256 Len=17 TSval=1044061938 TSecr=3168321645
1711545487.002868652   218 0.544510669    10.10.1.1 → 10.10.1.2    TCP 83 8081 → 46858 [PSH, ACK] Seq=375 Ack=392 Win=65152 Len=17 TSval=3168321646 TSecr=1044061938
1711545494.002868652   225 0.544820760    10.10.1.2 → 10.10.1.1    TCP 83 46858 → 8081 [PSH, ACK] Seq=392 Ack=392 Win=64256 Len=17 TSval=1044061938 TSecr=3168321646
1711545495.002868652   226 0.544832834    10.10.1.1 → 10.10.1.2    TCP 83 8081 → 46858 [PSH, ACK] Seq=392 Ack=409 Win=65152 Len=17 TSval=3168321646 TSecr=1044061938
1711545502.002868652   233 0.546352317    10.10.1.2 → 10.10.1.1    TCP 83 46858 → 8081 [PSH, ACK] Seq=409 Ack=409 Win=64256 Len=17 TSval=1044061939 TSecr=3168321646
1711545503.002868652   234 0.546364416    10.10.1.1 → 10.10.1.2    TCP 83 8081 → 46858 [PSH, ACK] Seq=409 Ack=426 Win=65152 Len=17 TSval=3168321648 TSecr=1044061939
1711545510.002868652   241 0.546819244    10.10.1.2 → 10.10.1.1    TCP 83 46858 → 8081 [PSH, ACK] Seq=426 Ack=426 Win=64256 Len=17 TSval=1044061940 TSecr=3168321648
1711545511.002868652   242 0.546831178    10.10.1.1 → 10.10.1.2    TCP 83 8081 → 46858 [PSH, ACK] Seq=426 Ack=443 Win=65152 Len=17 TSval=3168321648 TSecr=1044061940
1711545518.002868652   249 0.548354637    10.10.1.2 → 10.10.1.1    TCP 83 46858 → 8081 [PSH, ACK] Seq=443 Ack=443 Win=64256 Len=17 TSval=1044061941 TSecr=3168321648
1711545519.002868652   250 0.548369959    10.10.1.1 → 10.10.1.2    TCP 83 8081 → 46858 [PSH, ACK] Seq=443 Ack=460 Win=65152 Len=17 TSval=3168321650 TSecr=1044061941
1711545526.002868652   257 0.549228264    10.10.1.2 → 10.10.1.1    TCP 83 46858 → 8081 [PSH, ACK] Seq=460 Ack=460 Win=64256 Len=17 TSval=1044061942 TSecr=3168321650
1711545527.002868652   258 0.549240370    10.10.1.1 → 10.10.1.2    TCP 83 8081 → 46858 [PSH, ACK] Seq=460 Ack=477 Win=65152 Len=17 TSval=3168321651 TSecr=1044061942
1711545534.002868652   265 0.552379405    10.10.1.2 → 10.10.1.1    TCP 83 46858 → 8081 [PSH, ACK] Seq=477 Ack=477 Win=64256 Len=17 TSval=1044061945 TSecr=3168321651
1711545535.002868652   266 0.552395018    10.10.1.1 → 10.10.1.2    TCP 83 8081 → 46858 [PSH, ACK] Seq=477 Ack=494 Win=65152 Len=17 TSval=3168321654 TSecr=1044061945
1711545542.002868652   273 0.554080252    10.10.1.2 → 10.10.1.1    TCP 83 46858 → 8081 [PSH, ACK] Seq=494 Ack=494 Win=64256 Len=17 TSval=1044061947 TSecr=3168321654
1711545543.002868652   274 0.554092590    10.10.1.1 → 10.10.1.2    TCP 83 8081 → 46858 [PSH, ACK] Seq=494 Ack=511 Win=65152 Len=17 TSval=3168321655 TSecr=1044061947
1711545550.002868652   281 0.554729746    10.10.1.2 → 10.10.1.1    TCP 83 46858 → 8081 [PSH, ACK] Seq=511 Ack=511 Win=64256 Len=17 TSval=1044061948 TSecr=3168321655
1711545551.002868652   282 0.554741923    10.10.1.1 → 10.10.1.2    TCP 83 8081 → 46858 [PSH, ACK] Seq=511 Ack=528 Win=65152 Len=17 TSval=3168321656 TSecr=1044061948
1711545558.002868652   289 0.555484893    10.10.1.2 → 10.10.1.1    TCP 83 46858 → 8081 [PSH, ACK] Seq=528 Ack=528 Win=64256 Len=17 TSval=1044061949 TSecr=3168321656
1711545559.002868652   290 0.555496761    10.10.1.1 → 10.10.1.2    TCP 83 8081 → 46858 [PSH, ACK] Seq=528 Ack=545 Win=65152 Len=17 TSval=3168321657 TSecr=1044061949
1711545566.002868652   297 0.555875721    10.10.1.2 → 10.10.1.1    TCP 83 46858 → 8081 [PSH, ACK] Seq=545 Ack=545 Win=64256 Len=17 TSval=1044061949 TSecr=3168321657
1711545567.002868652   298 0.555887785    10.10.1.1 → 10.10.1.2    TCP 83 8081 → 46858 [PSH, ACK] Seq=545 Ack=562 Win=65152 Len=17 TSval=3168321657 TSecr=1044061949
1711545574.002868652   305 0.557224020    10.10.1.2 → 10.10.1.1    TCP 83 46858 → 8081 [PSH, ACK] Seq=562 Ack=562 Win=64256 Len=17 TSval=1044061950 TSecr=3168321657
1711545575.002868652   306 0.557239357    10.10.1.1 → 10.10.1.2    TCP 83 8081 → 46858 [PSH, ACK] Seq=562 Ack=579 Win=65152 Len=17 TSval=3168321659 TSecr=1044061950
1711545582.002868652   313 0.558224859    10.10.1.2 → 10.10.1.1    TCP 83 46858 → 8081 [PSH, ACK] Seq=579 Ack=579 Win=64256 Len=17 TSval=1044061951 TSecr=3168321659
1711545583.002868652   314 0.558237164    10.10.1.1 → 10.10.1.2    TCP 83 8081 → 46858 [PSH, ACK] Seq=579 Ack=596 Win=65152 Len=17 TSval=3168321660 TSecr=1044061951
1711545590.002868652   321 0.559015530    10.10.1.2 → 10.10.1.1    TCP 83 46858 → 8081 [PSH, ACK] Seq=596 Ack=596 Win=64256 Len=17 TSval=1044061952 TSecr=3168321660
1711545591.002868652   322 0.559033183    10.10.1.1 → 10.10.1.2    TCP 83 8081 → 46858 [PSH, ACK] Seq=596 Ack=613 Win=65152 Len=17 TSval=3168321660 TSecr=1044061952
1711545598.002868652   329 0.560288811    10.10.1.2 → 10.10.1.1    TCP 83 46858 → 8081 [PSH, ACK] Seq=613 Ack=613 Win=64256 Len=17 TSval=1044061953 TSecr=3168321660
1711545599.002868652   330 0.560304409    10.10.1.1 → 10.10.1.2    TCP 83 8081 → 46858 [PSH, ACK] Seq=613 Ack=630 Win=65152 Len=17 TSval=3168321662 TSecr=1044061953
1711545606.002868652   337 0.562094028    10.10.1.2 → 10.10.1.1    TCP 83 46858 → 8081 [PSH, ACK] Seq=630 Ack=630 Win=64256 Len=17 TSval=1044061955 TSecr=3168321662
1711545607.002868652   338 0.562106244    10.10.1.1 → 10.10.1.2    TCP 83 8081 → 46858 [PSH, ACK] Seq=630 Ack=647 Win=65152 Len=17 TSval=3168321663 TSecr=1044061955
1711545614.002868652   345 0.562817323    10.10.1.2 → 10.10.1.1    TCP 83 46858 → 8081 [PSH, ACK] Seq=647 Ack=647 Win=64256 Len=17 TSval=1044061956 TSecr=3168321663
1711545615.002868652   346 0.562829179    10.10.1.1 → 10.10.1.2    TCP 83 8081 → 46858 [PSH, ACK] Seq=647 Ack=664 Win=65152 Len=17 TSval=3168321664 TSecr=1044061956
1711545622.002868652   353 0.563307442    10.10.1.2 → 10.10.1.1    TCP 83 46858 → 8081 [PSH, ACK] Seq=664 Ack=664 Win=64256 Len=17 TSval=1044061956 TSecr=3168321664
1711545623.002868652   354 0.563319543    10.10.1.1 → 10.10.1.2    TCP 83 8081 → 46858 [PSH, ACK] Seq=664 Ack=681 Win=65152 Len=17 TSval=3168321665 TSecr=1044061956
1711545630.002868652   361 0.563788550    10.10.1.2 → 10.10.1.1    TCP 83 46858 → 8081 [PSH, ACK] Seq=681 Ack=681 Win=64256 Len=17 TSval=1044061957 TSecr=3168321665
1711545631.002868652   362 0.563801050    10.10.1.1 → 10.10.1.2    TCP 83 8081 → 46858 [PSH, ACK] Seq=681 Ack=698 Win=65152 Len=17 TSval=3168321665 TSecr=1044061957
1711545638.002868652   369 0.564109537    10.10.1.2 → 10.10.1.1    TCP 83 46858 → 8081 [PSH, ACK] Seq=698 Ack=698 Win=64256 Len=17 TSval=1044061957 TSecr=3168321665
1711545639.002868652   370 0.564121905    10.10.1.1 → 10.10.1.2    TCP 83 8081 → 46858 [PSH, ACK] Seq=698 Ack=715 Win=65152 Len=17 TSval=3168321665 TSecr=1044061957
1711545646.002868652   377 0.569601700    10.10.1.2 → 10.10.1.1    TCP 83 46858 → 8081 [PSH, ACK] Seq=715 Ack=715 Win=64256 Len=17 TSval=1044061963 TSecr=3168321665
1711545647.002868652   378 0.569617551    10.10.1.1 → 10.10.1.2    TCP 83 8081 → 46858 [PSH, ACK] Seq=715 Ack=732 Win=65152 Len=17 TSval=3168321671 TSecr=1044061963
1711545654.002868652   385 0.570422579    10.10.1.2 → 10.10.1.1    TCP 83 46858 → 8081 [PSH, ACK] Seq=732 Ack=732 Win=64256 Len=17 TSval=1044061964 TSecr=3168321671
1711545655.002868652   386 0.570434860    10.10.1.1 → 10.10.1.2    TCP 83 8081 → 46858 [PSH, ACK] Seq=732 Ack=749 Win=65152 Len=17 TSval=3168321672 TSecr=1044061964
1711545662.002868652   393 0.570909390    10.10.1.2 → 10.10.1.1    TCP 83 46858 → 8081 [PSH, ACK] Seq=749 Ack=749 Win=64256 Len=17 TSval=1044061964 TSecr=3168321672
1711545663.002868652   394 0.570920742    10.10.1.1 → 10.10.1.2    TCP 83 8081 → 46858 [PSH, ACK] Seq=749 Ack=766 Win=65152 Len=17 TSval=3168321672 TSecr=1044061964
1711545670.002868652   401 0.571278096    10.10.1.2 → 10.10.1.1    TCP 83 46858 → 8081 [PSH, ACK] Seq=766 Ack=766 Win=64256 Len=17 TSval=1044061964 TSecr=3168321672
1711545671.002868652   402 0.571290371    10.10.1.1 → 10.10.1.2    TCP 83 8081 → 46858 [PSH, ACK] Seq=766 Ack=783 Win=65152 Len=17 TSval=3168321673 TSecr=1044061964
1711545678.002868652   409 0.572116423    10.10.1.2 → 10.10.1.1    TCP 83 46858 → 8081 [PSH, ACK] Seq=783 Ack=783 Win=64256 Len=17 TSval=1044061965 TSecr=3168321673
1711545679.002868652   410 0.572128866    10.10.1.1 → 10.10.1.2    TCP 83 8081 → 46858 [PSH, ACK] Seq=783 Ack=800 Win=65152 Len=17 TSval=3168321673 TSecr=1044061965
1711545686.002868652   417 0.572551627    10.10.1.2 → 10.10.1.1    TCP 83 46858 → 8081 [PSH, ACK] Seq=800 Ack=800 Win=64256 Len=17 TSval=1044061966 TSecr=3168321673
1711545687.002868652   418 0.572566184    10.10.1.1 → 10.10.1.2    TCP 83 8081 → 46858 [PSH, ACK] Seq=800 Ack=817 Win=65152 Len=17 TSval=3168321674 TSecr=1044061966
1711545692.002868652   423 0.572743788    10.10.1.2 → 10.10.1.1    TCP 83 46858 → 8081 [PSH, ACK] Seq=817 Ack=817 Win=64256 Len=17 TSval=1044061966 TSecr=3168321674
1711545693.002868652   424 0.572755737    10.10.1.1 → 10.10.1.2    TCP 83 8081 → 46858 [PSH, ACK] Seq=817 Ack=834 Win=65152 Len=17 TSval=3168321674 TSecr=1044061966
1711545700.002868652   431 0.573708077    10.10.1.2 → 10.10.1.1    TCP 83 46858 → 8081 [PSH, ACK] Seq=834 Ack=834 Win=64256 Len=17 TSval=1044061967 TSecr=3168321674
1711545701.002868652   432 0.573720152    10.10.1.1 → 10.10.1.2    TCP 83 8081 → 46858 [PSH, ACK] Seq=834 Ack=851 Win=65152 Len=17 TSval=3168321675 TSecr=1044061967
1711545708.002868652   439 0.575971303    10.10.1.2 → 10.10.1.1    TCP 83 46858 → 8081 [PSH, ACK] Seq=851 Ack=851 Win=64256 Len=17 TSval=1044061969 TSecr=3168321675
1711545709.002868652   440 0.575983195    10.10.1.1 → 10.10.1.2    TCP 83 8081 → 46858 [PSH, ACK] Seq=851 Ack=868 Win=65152 Len=17 TSval=3168321677 TSecr=1044061969
1711545716.002868652   447 0.578025459    10.10.1.2 → 10.10.1.1    TCP 83 46858 → 8081 [PSH, ACK] Seq=868 Ack=868 Win=64256 Len=17 TSval=1044061971 TSecr=3168321677
1711545717.002868652   448 0.578039912    10.10.1.1 → 10.10.1.2    TCP 83 8081 → 46858 [PSH, ACK] Seq=868 Ack=885 Win=65152 Len=17 TSval=3168321679 TSecr=1044061971
1711545724.002868652   455 0.578791710    10.10.1.2 → 10.10.1.1    TCP 83 46858 → 8081 [PSH, ACK] Seq=885 Ack=885 Win=64256 Len=17 TSval=1044061972 TSecr=3168321679
1711545725.002868652   456 0.578803928    10.10.1.1 → 10.10.1.2    TCP 83 8081 → 46858 [PSH, ACK] Seq=885 Ack=902 Win=65152 Len=17 TSval=3168321680 TSecr=1044061972
1711545732.002868652   463 0.579110017    10.10.1.2 → 10.10.1.1    TCP 83 46858 → 8081 [PSH, ACK] Seq=902 Ack=902 Win=64256 Len=17 TSval=1044061972 TSecr=3168321680
1711545733.002868652   464 0.579121541    10.10.1.1 → 10.10.1.2    TCP 83 8081 → 46858 [PSH, ACK] Seq=902 Ack=919 Win=65152 Len=17 TSval=3168321680 TSecr=1044061972
1711545738.002868652   469 0.579233976    10.10.1.2 → 10.10.1.1    TCP 83 46858 → 8081 [PSH, ACK] Seq=919 Ack=919 Win=64256 Len=17 TSval=1044061972 TSecr=3168321680
1711545739.002868652   470 0.579246013    10.10.1.1 → 10.10.1.2    TCP 83 8081 → 46858 [PSH, ACK] Seq=919 Ack=936 Win=65152 Len=17 TSval=3168321681 TSecr=1044061972
1711545746.002868652   477 0.579604471    10.10.1.2 → 10.10.1.1    TCP 83 46858 → 8081 [PSH, ACK] Seq=936 Ack=936 Win=64256 Len=17 TSval=1044061973 TSecr=3168321681
1711545747.002868652   478 0.579616546    10.10.1.1 → 10.10.1.2    TCP 83 8081 → 46858 [PSH, ACK] Seq=936 Ack=953 Win=65152 Len=17 TSval=3168321681 TSecr=1044061973
1711545754.002868652   485 0.580292028    10.10.1.2 → 10.10.1.1    TCP 83 46858 → 8081 [PSH, ACK] Seq=953 Ack=953 Win=64256 Len=17 TSval=1044061973 TSecr=3168321681
1711545757.002868652   488 0.580344854    10.10.1.1 → 10.10.1.2    TCP 83 8081 → 46858 [PSH, ACK] Seq=953 Ack=970 Win=65152 Len=17 TSval=3168321682 TSecr=1044061973
1711545762.002868652   493 0.581872003    10.10.1.2 → 10.10.1.1    TCP 83 46858 → 8081 [PSH, ACK] Seq=970 Ack=970 Win=64256 Len=17 TSval=1044061975 TSecr=3168321682
1711545763.002868652   494 0.581884829    10.10.1.1 → 10.10.1.2    TCP 83 8081 → 46858 [PSH, ACK] Seq=970 Ack=987 Win=65152 Len=17 TSval=3168321683 TSecr=1044061975
1711545770.002868652   501 0.583239623    10.10.1.2 → 10.10.1.1    TCP 83 46858 → 8081 [PSH, ACK] Seq=987 Ack=987 Win=64256 Len=17 TSval=1044061976 TSecr=3168321683
1711545771.002868652   502 0.583252282    10.10.1.1 → 10.10.1.2    TCP 83 8081 → 46858 [PSH, ACK] Seq=987 Ack=1004 Win=65152 Len=17 TSval=3168321685 TSecr=1044061976
1711545778.002868652   509 0.583849927    10.10.1.2 → 10.10.1.1    TCP 83 46858 → 8081 [PSH, ACK] Seq=1004 Ack=1004 Win=64256 Len=17 TSval=1044061977 TSecr=3168321685
1711545779.002868652   510 0.583865248    10.10.1.1 → 10.10.1.2    TCP 83 8081 → 46858 [PSH, ACK] Seq=1004 Ack=1021 Win=65152 Len=17 TSval=3168321685 TSecr=1044061977
1711545786.002868652   517 0.584773092    10.10.1.2 → 10.10.1.1    TCP 83 46858 → 8081 [PSH, ACK] Seq=1021 Ack=1021 Win=64256 Len=17 TSval=1044061978 TSecr=3168321685
1711545787.002868652   518 0.584787460    10.10.1.1 → 10.10.1.2    TCP 83 8081 → 46858 [PSH, ACK] Seq=1021 Ack=1038 Win=65152 Len=17 TSval=3168321686 TSecr=1044061978
1711545792.002868652   523 0.584970391    10.10.1.2 → 10.10.1.1    TCP 83 46858 → 8081 [PSH, ACK] Seq=1038 Ack=1038 Win=64256 Len=17 TSval=1044061978 TSecr=3168321686
1711545793.002868652   524 0.584982817    10.10.1.1 → 10.10.1.2    TCP 83 8081 → 46858 [PSH, ACK] Seq=1038 Ack=1055 Win=65152 Len=17 TSval=3168321686 TSecr=1044061978
1711545800.002868652   531 0.586796348    10.10.1.2 → 10.10.1.1    TCP 83 46858 → 8081 [PSH, ACK] Seq=1055 Ack=1055 Win=64256 Len=17 TSval=1044061980 TSecr=3168321686
1711545801.002868652   532 0.586808870    10.10.1.1 → 10.10.1.2    TCP 83 8081 → 46858 [PSH, ACK] Seq=1055 Ack=1072 Win=65152 Len=17 TSval=3168321688 TSecr=1044061980
1711545808.002868652   539 0.588311481    10.10.1.2 → 10.10.1.1    TCP 83 46858 → 8081 [PSH, ACK] Seq=1072 Ack=1072 Win=64256 Len=17 TSval=1044061981 TSecr=3168321688
1711545809.002868652   540 0.588326764    10.10.1.1 → 10.10.1.2    TCP 83 8081 → 46858 [PSH, ACK] Seq=1072 Ack=1089 Win=65152 Len=17 TSval=3168321690 TSecr=1044061981
1711545816.002868652   547 0.590011038    10.10.1.2 → 10.10.1.1    TCP 83 46858 → 8081 [PSH, ACK] Seq=1089 Ack=1089 Win=64256 Len=17 TSval=1044061983 TSecr=3168321690
1711545817.002868652   548 0.590022958    10.10.1.1 → 10.10.1.2    TCP 83 8081 → 46858 [PSH, ACK] Seq=1089 Ack=1106 Win=65152 Len=17 TSval=3168321691 TSecr=1044061983
1711545824.002868652   555 0.590645226    10.10.1.2 → 10.10.1.1    TCP 83 46858 → 8081 [PSH, ACK] Seq=1106 Ack=1106 Win=64256 Len=17 TSval=1044061984 TSecr=3168321691
1711545825.002868652   556 0.590657067    10.10.1.1 → 10.10.1.2    TCP 83 8081 → 46858 [PSH, ACK] Seq=1106 Ack=1123 Win=65152 Len=17 TSval=3168321692 TSecr=1044061984
1711545832.002868652   563 0.591043728    10.10.1.2 → 10.10.1.1    TCP 83 46858 → 8081 [PSH, ACK] Seq=1123 Ack=1123 Win=64256 Len=17 TSval=1044061984 TSecr=3168321692
1711545833.002868652   564 0.591058879    10.10.1.1 → 10.10.1.2    TCP 83 8081 → 46858 [PSH, ACK] Seq=1123 Ack=1140 Win=65152 Len=17 TSval=3168321692 TSecr=1044061984
1711545840.002868652   571 0.591810573    10.10.1.2 → 10.10.1.1    TCP 83 46858 → 8081 [PSH, ACK] Seq=1140 Ack=1140 Win=64256 Len=17 TSval=1044061985 TSecr=3168321692
1711545841.002868652   572 0.591822593    10.10.1.1 → 10.10.1.2    TCP 83 8081 → 46858 [PSH, ACK] Seq=1140 Ack=1157 Win=65152 Len=17 TSval=3168321693 TSecr=1044061985
1711545848.002868652   579 0.592176835    10.10.1.2 → 10.10.1.1    TCP 83 46858 → 8081 [PSH, ACK] Seq=1157 Ack=1157 Win=64256 Len=17 TSval=1044061985 TSecr=3168321693
1711545849.002868652   580 0.592192726    10.10.1.1 → 10.10.1.2    TCP 83 8081 → 46858 [PSH, ACK] Seq=1157 Ack=1174 Win=65152 Len=17 TSval=3168321694 TSecr=1044061985
1711545856.002868652   587 0.593367584    10.10.1.2 → 10.10.1.1    TCP 83 46858 → 8081 [PSH, ACK] Seq=1174 Ack=1174 Win=64256 Len=17 TSval=1044061986 TSecr=3168321694
1711545857.002868652   588 0.593380113    10.10.1.1 → 10.10.1.2    TCP 83 8081 → 46858 [PSH, ACK] Seq=1174 Ack=1191 Win=65152 Len=17 TSval=3168321695 TSecr=1044061986
1711545864.002868652   595 0.594860580    10.10.1.2 → 10.10.1.1    TCP 83 46858 → 8081 [PSH, ACK] Seq=1191 Ack=1191 Win=64256 Len=17 TSval=1044061988 TSecr=3168321695
1711545865.002868652   596 0.594872687    10.10.1.1 → 10.10.1.2    TCP 83 8081 → 46858 [PSH, ACK] Seq=1191 Ack=1208 Win=65152 Len=17 TSval=3168321696 TSecr=1044061988
1711545872.002868652   603 0.595632574    10.10.1.2 → 10.10.1.1    TCP 83 46858 → 8081 [PSH, ACK] Seq=1208 Ack=1208 Win=64256 Len=17 TSval=1044061989 TSecr=3168321696
1711545873.002868652   604 0.595644446    10.10.1.1 → 10.10.1.2    TCP 83 8081 → 46858 [PSH, ACK] Seq=1208 Ack=1225 Win=65152 Len=17 TSval=3168321697 TSecr=1044061989
1711545880.002868652   611 0.597369842    10.10.1.2 → 10.10.1.1    TCP 83 46858 → 8081 [PSH, ACK] Seq=1225 Ack=1225 Win=64256 Len=17 TSval=1044061990 TSecr=3168321697
1711545881.002868652   612 0.597385526    10.10.1.1 → 10.10.1.2    TCP 83 8081 → 46858 [PSH, ACK] Seq=1225 Ack=1242 Win=65152 Len=17 TSval=3168321699 TSecr=1044061990
1711545888.002868652   619 0.598848033    10.10.1.2 → 10.10.1.1    TCP 83 46858 → 8081 [PSH, ACK] Seq=1242 Ack=1242 Win=64256 Len=17 TSval=1044061992 TSecr=3168321699
1711545889.002868652   620 0.598860675    10.10.1.1 → 10.10.1.2    TCP 83 8081 → 46858 [PSH, ACK] Seq=1242 Ack=1259 Win=65152 Len=17 TSval=3168321700 TSecr=1044061992
1711545896.002868652   627 0.601854648    10.10.1.2 → 10.10.1.1    TCP 83 46858 → 8081 [PSH, ACK] Seq=1259 Ack=1259 Win=64256 Len=17 TSval=1044061995 TSecr=3168321700
1711545897.002868652   628 0.601869736    10.10.1.1 → 10.10.1.2    TCP 83 8081 → 46858 [PSH, ACK] Seq=1259 Ack=1276 Win=65152 Len=17 TSval=3168321703 TSecr=1044061995
1711545902.002868652   633 0.602025515    10.10.1.2 → 10.10.1.1    TCP 83 46858 → 8081 [PSH, ACK] Seq=1276 Ack=1276 Win=64256 Len=17 TSval=1044061995 TSecr=3168321703
1711545903.002868652   634 0.602037380    10.10.1.1 → 10.10.1.2    TCP 83 8081 → 46858 [PSH, ACK] Seq=1276 Ack=1293 Win=65152 Len=17 TSval=3168321703 TSecr=1044061995
1711545910.002868652   641 0.604756684    10.10.1.2 → 10.10.1.1    TCP 83 46858 → 8081 [PSH, ACK] Seq=1293 Ack=1293 Win=64256 Len=17 TSval=1044061998 TSecr=3168321703
1711545911.002868652   642 0.604772409    10.10.1.1 → 10.10.1.2    TCP 83 8081 → 46858 [PSH, ACK] Seq=1293 Ack=1310 Win=65152 Len=17 TSval=3168321706 TSecr=1044061998
1711545918.002868652   649 0.605485104    10.10.1.2 → 10.10.1.1    TCP 83 46858 → 8081 [PSH, ACK] Seq=1310 Ack=1310 Win=64256 Len=17 TSval=1044061999 TSecr=3168321706
1711545919.002868652   650 0.605497541    10.10.1.1 → 10.10.1.2    TCP 83 8081 → 46858 [PSH, ACK] Seq=1310 Ack=1327 Win=65152 Len=17 TSval=3168321707 TSecr=1044061999
1711545926.002868652   657 0.606008315    10.10.1.2 → 10.10.1.1    TCP 83 46858 → 8081 [PSH, ACK] Seq=1327 Ack=1327 Win=64256 Len=17 TSval=1044061999 TSecr=3168321707
1711545927.002868652   658 0.606020393    10.10.1.1 → 10.10.1.2    TCP 83 8081 → 46858 [PSH, ACK] Seq=1327 Ack=1344 Win=65152 Len=17 TSval=3168321707 TSecr=1044061999
1711545934.002868652   665 0.612074191    10.10.1.2 → 10.10.1.1    TCP 83 46858 → 8081 [PSH, ACK] Seq=1344 Ack=1344 Win=64256 Len=17 TSval=1044062005 TSecr=3168321707
1711545935.002868652   666 0.612089473    10.10.1.1 → 10.10.1.2    TCP 83 8081 → 46858 [PSH, ACK] Seq=1344 Ack=1361 Win=65152 Len=17 TSval=3168321713 TSecr=1044062005
1711545942.002868652   673 0.616340505    10.10.1.2 → 10.10.1.1    TCP 83 46858 → 8081 [PSH, ACK] Seq=1361 Ack=1361 Win=64256 Len=17 TSval=1044062009 TSecr=3168321713
1711545943.002868652   674 0.616358627    10.10.1.1 → 10.10.1.2    TCP 83 8081 → 46858 [PSH, ACK] Seq=1361 Ack=1378 Win=65152 Len=17 TSval=3168321718 TSecr=1044062009
1711545950.002868652   681 0.616708040    10.10.1.2 → 10.10.1.1    TCP 83 46858 → 8081 [PSH, ACK] Seq=1378 Ack=1378 Win=64256 Len=17 TSval=1044062010 TSecr=3168321718
1711545951.002868652   682 0.616720009    10.10.1.1 → 10.10.1.2    TCP 83 8081 → 46858 [PSH, ACK] Seq=1378 Ack=1395 Win=65152 Len=17 TSval=3168321718 TSecr=1044062010
1711545958.002868652   689 0.618741954    10.10.1.2 → 10.10.1.1    TCP 83 46858 → 8081 [PSH, ACK] Seq=1395 Ack=1395 Win=64256 Len=17 TSval=1044062012 TSecr=3168321718
1711545959.002868652   690 0.618754165    10.10.1.1 → 10.10.1.2    TCP 83 8081 → 46858 [PSH, ACK] Seq=1395 Ack=1412 Win=65152 Len=17 TSval=3168321720 TSecr=1044062012
1711545966.002868652   697 0.619460149    10.10.1.2 → 10.10.1.1    TCP 83 46858 → 8081 [PSH, ACK] Seq=1412 Ack=1412 Win=64256 Len=17 TSval=1044062013 TSecr=3168321720
1711545967.002868652   698 0.619472186    10.10.1.1 → 10.10.1.2    TCP 83 8081 → 46858 [PSH, ACK] Seq=1412 Ack=1429 Win=65152 Len=17 TSval=3168321721 TSecr=1044062013
1711545974.002868652   705 0.620015977    10.10.1.2 → 10.10.1.1    TCP 83 46858 → 8081 [PSH, ACK] Seq=1429 Ack=1429 Win=64256 Len=17 TSval=1044062013 TSecr=3168321721
1711545975.002868652   706 0.620028083    10.10.1.1 → 10.10.1.2    TCP 83 8081 → 46858 [PSH, ACK] Seq=1429 Ack=1446 Win=65152 Len=17 TSval=3168321721 TSecr=1044062013
1711545982.002868652   713 0.622060379    10.10.1.2 → 10.10.1.1    TCP 83 46858 → 8081 [PSH, ACK] Seq=1446 Ack=1446 Win=64256 Len=17 TSval=1044062015 TSecr=3168321721
1711545983.002868652   714 0.622074671    10.10.1.1 → 10.10.1.2    TCP 83 8081 → 46858 [PSH, ACK] Seq=1446 Ack=1463 Win=65152 Len=17 TSval=3168321723 TSecr=1044062015
1711545990.002868652   721 0.623186739    10.10.1.2 → 10.10.1.1    TCP 83 46858 → 8081 [PSH, ACK] Seq=1463 Ack=1463 Win=64256 Len=17 TSval=1044062016 TSecr=3168321723
1711545991.002868652   722 0.623199528    10.10.1.1 → 10.10.1.2    TCP 83 8081 → 46858 [PSH, ACK] Seq=1463 Ack=1480 Win=65152 Len=17 TSval=3168321725 TSecr=1044062016
1711545998.002868652   729 0.624701284    10.10.1.2 → 10.10.1.1    TCP 83 46858 → 8081 [PSH, ACK] Seq=1480 Ack=1480 Win=64256 Len=17 TSval=1044062018 TSecr=3168321725
1711545999.002868652   730 0.624718804    10.10.1.1 → 10.10.1.2    TCP 83 8081 → 46858 [PSH, ACK] Seq=1480 Ack=1497 Win=65152 Len=17 TSval=3168321726 TSecr=1044062018
1711546006.002868652   737 0.625772793    10.10.1.2 → 10.10.1.1    TCP 83 46858 → 8081 [PSH, ACK] Seq=1497 Ack=1497 Win=64256 Len=17 TSval=1044062019 TSecr=3168321726
1711546007.002868652   738 0.625785318    10.10.1.1 → 10.10.1.2    TCP 83 8081 → 46858 [PSH, ACK] Seq=1497 Ack=1514 Win=65152 Len=17 TSval=3168321727 TSecr=1044062019
1711546014.002868652   745 0.626318163    10.10.1.2 → 10.10.1.1    TCP 83 46858 → 8081 [PSH, ACK] Seq=1514 Ack=1514 Win=64256 Len=17 TSval=1044062019 TSecr=3168321727
1711546015.002868652   746 0.626330354    10.10.1.1 → 10.10.1.2    TCP 83 8081 → 46858 [PSH, ACK] Seq=1514 Ack=1531 Win=65152 Len=17 TSval=3168321728 TSecr=1044062019
1711546022.002868652   753 0.626585759    10.10.1.2 → 10.10.1.1    TCP 83 46858 → 8081 [PSH, ACK] Seq=1531 Ack=1531 Win=64256 Len=17 TSval=1044062020 TSecr=3168321728
1711546023.002868652   754 0.626598182    10.10.1.1 → 10.10.1.2    TCP 83 8081 → 46858 [PSH, ACK] Seq=1531 Ack=1548 Win=65152 Len=17 TSval=3168321728 TSecr=1044062020
1711546030.002868652   761 0.626885892    10.10.1.2 → 10.10.1.1    TCP 83 46858 → 8081 [PSH, ACK] Seq=1548 Ack=1548 Win=64256 Len=17 TSval=1044062020 TSecr=3168321728
1711546031.002868652   762 0.626897717    10.10.1.1 → 10.10.1.2    TCP 83 8081 → 46858 [PSH, ACK] Seq=1548 Ack=1565 Win=65152 Len=17 TSval=3168321728 TSecr=1044062020
1711546038.002868652   769 0.627571994    10.10.1.2 → 10.10.1.1    TCP 83 46858 → 8081 [PSH, ACK] Seq=1565 Ack=1565 Win=64256 Len=17 TSval=1044062021 TSecr=3168321728
1711546039.002868652   770 0.627583816    10.10.1.1 → 10.10.1.2    TCP 83 8081 → 46858 [PSH, ACK] Seq=1565 Ack=1582 Win=65152 Len=17 TSval=3168321729 TSecr=1044062021
1711546046.002868652   777 0.630200228    10.10.1.2 → 10.10.1.1    TCP 83 46858 → 8081 [PSH, ACK] Seq=1582 Ack=1582 Win=64256 Len=17 TSval=1044062023 TSecr=3168321729
1711546047.002868652   778 0.630215775    10.10.1.1 → 10.10.1.2    TCP 83 8081 → 46858 [PSH, ACK] Seq=1582 Ack=1599 Win=65152 Len=17 TSval=3168321732 TSecr=1044062023
1711546054.002868652   785 0.632427864    10.10.1.2 → 10.10.1.1    TCP 83 46858 → 8081 [PSH, ACK] Seq=1599 Ack=1599 Win=64256 Len=17 TSval=1044062026 TSecr=3168321732
1711546055.002868652   786 0.632443701    10.10.1.1 → 10.10.1.2    TCP 83 8081 → 46858 [PSH, ACK] Seq=1599 Ack=1616 Win=65152 Len=17 TSval=3168321734 TSecr=1044062026
1711546062.002868652   793 0.632811019    10.10.1.2 → 10.10.1.1    TCP 83 46858 → 8081 [PSH, ACK] Seq=1616 Ack=1616 Win=64256 Len=17 TSval=1044062026 TSecr=3168321734
1711546063.002868652   794 0.632823586    10.10.1.1 → 10.10.1.2    TCP 83 8081 → 46858 [PSH, ACK] Seq=1616 Ack=1633 Win=65152 Len=17 TSval=3168321734 TSecr=1044062026
1711546070.002868652   801 0.633317192    10.10.1.2 → 10.10.1.1    TCP 83 46858 → 8081 [PSH, ACK] Seq=1633 Ack=1633 Win=64256 Len=17 TSval=1044062026 TSecr=3168321734
1711546071.002868652   802 0.633329834    10.10.1.1 → 10.10.1.2    TCP 83 8081 → 46858 [PSH, ACK] Seq=1633 Ack=1650 Win=65152 Len=17 TSval=3168321735 TSecr=1044062026
1711546076.002868652   807 0.633508143    10.10.1.2 → 10.10.1.1    TCP 83 46858 → 8081 [PSH, ACK] Seq=1650 Ack=1650 Win=64256 Len=17 TSval=1044062027 TSecr=3168321735
1711546077.002868652   808 0.633519861    10.10.1.1 → 10.10.1.2    TCP 83 8081 → 46858 [PSH, ACK] Seq=1650 Ack=1667 Win=65152 Len=17 TSval=3168321735 TSecr=1044062027
1711546084.002868652   815 0.634719722    10.10.1.2 → 10.10.1.1    TCP 83 46858 → 8081 [PSH, ACK] Seq=1667 Ack=1667 Win=64256 Len=17 TSval=1044062028 TSecr=3168321735
1711546085.002868652   816 0.634731943    10.10.1.1 → 10.10.1.2    TCP 83 8081 → 46858 [PSH, ACK] Seq=1667 Ack=1684 Win=65152 Len=17 TSval=3168321736 TSecr=1044062028
1711546092.002868652   823 0.635535400    10.10.1.2 → 10.10.1.1    TCP 83 46858 → 8081 [PSH, ACK] Seq=1684 Ack=1684 Win=64256 Len=17 TSval=1044062029 TSecr=3168321736
1711546093.002868652   824 0.635547430    10.10.1.1 → 10.10.1.2    TCP 83 8081 → 46858 [PSH, ACK] Seq=1684 Ack=1701 Win=65152 Len=17 TSval=3168321737 TSecr=1044062029
1711546100.002868652   831 0.636996475    10.10.1.2 → 10.10.1.1    TCP 83 46858 → 8081 [PSH, ACK] Seq=1701 Ack=1701 Win=64256 Len=17 TSval=1044062030 TSecr=3168321737
1711546101.002868652   832 0.637012310    10.10.1.1 → 10.10.1.2    TCP 83 8081 → 46858 [PSH, ACK] Seq=1701 Ack=1718 Win=65152 Len=17 TSval=3168321738 TSecr=1044062030
1711546108.002868652   839 0.637649776    10.10.1.2 → 10.10.1.1    TCP 83 46858 → 8081 [PSH, ACK] Seq=1718 Ack=1718 Win=64256 Len=17 TSval=1044062031 TSecr=3168321738
1711546109.002868652   840 0.637662290    10.10.1.1 → 10.10.1.2    TCP 83 8081 → 46858 [PSH, ACK] Seq=1718 Ack=1735 Win=65152 Len=17 TSval=3168321739 TSecr=1044062031
1711546116.002868652   847 0.640605741    10.10.1.2 → 10.10.1.1    TCP 83 46858 → 8081 [PSH, ACK] Seq=1735 Ack=1735 Win=64256 Len=17 TSval=1044062034 TSecr=3168321739
1711546117.002868652   848 0.640619695    10.10.1.1 → 10.10.1.2    TCP 83 8081 → 46858 [PSH, ACK] Seq=1735 Ack=1752 Win=65152 Len=17 TSval=3168321742 TSecr=1044062034
1711546124.002868652   855 0.641507359    10.10.1.2 → 10.10.1.1    TCP 83 46858 → 8081 [PSH, ACK] Seq=1752 Ack=1752 Win=64256 Len=17 TSval=1044062035 TSecr=3168321742
1711546125.002868652   856 0.641519562    10.10.1.1 → 10.10.1.2    TCP 83 8081 → 46858 [PSH, ACK] Seq=1752 Ack=1769 Win=65152 Len=17 TSval=3168321743 TSecr=1044062035
1711546132.002868652   863 0.641792134    10.10.1.2 → 10.10.1.1    TCP 83 46858 → 8081 [PSH, ACK] Seq=1769 Ack=1769 Win=64256 Len=17 TSval=1044062035 TSecr=3168321743
1711546133.002868652   864 0.641804016    10.10.1.1 → 10.10.1.2    TCP 83 8081 → 46858 [PSH, ACK] Seq=1769 Ack=1786 Win=65152 Len=17 TSval=3168321743 TSecr=1044062035
1711546140.002868652   871 0.644080332    10.10.1.2 → 10.10.1.1    TCP 83 46858 → 8081 [PSH, ACK] Seq=1786 Ack=1786 Win=64256 Len=17 TSval=1044062037 TSecr=3168321743
1711546141.002868652   872 0.644092999    10.10.1.1 → 10.10.1.2    TCP 83 8081 → 46858 [PSH, ACK] Seq=1786 Ack=1803 Win=65152 Len=17 TSval=3168321745 TSecr=1044062037
1711546148.002868652   879 0.645125491    10.10.1.2 → 10.10.1.1    TCP 83 46858 → 8081 [PSH, ACK] Seq=1803 Ack=1803 Win=64256 Len=17 TSval=1044062038 TSecr=3168321745
1711546150.002868652   881 0.645148611    10.10.1.1 → 10.10.1.2    TCP 83 8081 → 46858 [PSH, ACK] Seq=1803 Ack=1820 Win=65152 Len=17 TSval=3168321746 TSecr=1044062038
1711546154.002868652   885 0.645283253    10.10.1.2 → 10.10.1.1    TCP 83 46858 → 8081 [PSH, ACK] Seq=1820 Ack=1820 Win=64256 Len=17 TSval=1044062038 TSecr=3168321746
1711546155.002868652   886 0.645295414    10.10.1.1 → 10.10.1.2    TCP 83 8081 → 46858 [PSH, ACK] Seq=1820 Ack=1837 Win=65152 Len=17 TSval=3168321747 TSecr=1044062038
1711546162.002868652   893 0.645810968    10.10.1.2 → 10.10.1.1    TCP 83 46858 → 8081 [PSH, ACK] Seq=1837 Ack=1837 Win=64256 Len=17 TSval=1044062039 TSecr=3168321747
1711546163.002868652   894 0.645828756    10.10.1.1 → 10.10.1.2    TCP 83 8081 → 46858 [PSH, ACK] Seq=1837 Ack=1854 Win=65152 Len=17 TSval=3168321747 TSecr=1044062039
1711546170.002868652   901 0.648220819    10.10.1.2 → 10.10.1.1    TCP 83 46858 → 8081 [PSH, ACK] Seq=1854 Ack=1854 Win=64256 Len=17 TSval=1044062041 TSecr=3168321747
1711546171.002868652   902 0.648236223    10.10.1.1 → 10.10.1.2    TCP 83 8081 → 46858 [PSH, ACK] Seq=1854 Ack=1871 Win=65152 Len=17 TSval=3168321750 TSecr=1044062041
1711546178.002868652   909 0.648412353    10.10.1.2 → 10.10.1.1    TCP 83 46858 → 8081 [PSH, ACK] Seq=1871 Ack=1871 Win=64256 Len=17 TSval=1044062041 TSecr=3168321750
1711546179.002868652   910 0.648424503    10.10.1.1 → 10.10.1.2    TCP 83 8081 → 46858 [PSH, ACK] Seq=1871 Ack=1888 Win=65152 Len=17 TSval=3168321750 TSecr=1044062041
1711546184.002868652   915 0.648916483    10.10.1.2 → 10.10.1.1    TCP 83 46858 → 8081 [PSH, ACK] Seq=1888 Ack=1888 Win=64256 Len=17 TSval=1044062042 TSecr=3168321750
1711546185.002868652   916 0.648928915    10.10.1.1 → 10.10.1.2    TCP 83 8081 → 46858 [PSH, ACK] Seq=1888 Ack=1905 Win=65152 Len=17 TSval=3168321750 TSecr=1044062042
1711546190.002868652   921 0.649109124    10.10.1.2 → 10.10.1.1    TCP 83 46858 → 8081 [PSH, ACK] Seq=1905 Ack=1905 Win=64256 Len=17 TSval=1044062042 TSecr=3168321750
1711546192.002868652   923 0.649121026    10.10.1.1 → 10.10.1.2    TCP 83 8081 → 46858 [PSH, ACK] Seq=1905 Ack=1922 Win=65152 Len=17 TSval=3168321750 TSecr=1044062042
1711546198.002868652   929 0.651463727    10.10.1.2 → 10.10.1.1    TCP 83 46858 → 8081 [PSH, ACK] Seq=1922 Ack=1922 Win=64256 Len=17 TSval=1044062045 TSecr=3168321750
1711546200.002868652   931 0.651497019    10.10.1.1 → 10.10.1.2    TCP 83 8081 → 46858 [PSH, ACK] Seq=1922 Ack=1939 Win=65152 Len=17 TSval=3168321753 TSecr=1044062045
1711546206.002868652   937 0.652925746    10.10.1.2 → 10.10.1.1    TCP 83 46858 → 8081 [PSH, ACK] Seq=1939 Ack=1939 Win=64256 Len=17 TSval=1044062046 TSecr=3168321753
1711546207.002868652   938 0.652941760    10.10.1.1 → 10.10.1.2    TCP 83 8081 → 46858 [PSH, ACK] Seq=1939 Ack=1956 Win=65152 Len=17 TSval=3168321754 TSecr=1044062046
1711546214.002868652   945 0.653615677    10.10.1.2 → 10.10.1.1    TCP 83 46858 → 8081 [PSH, ACK] Seq=1956 Ack=1956 Win=64256 Len=17 TSval=1044062047 TSecr=3168321754
1711546215.002868652   946 0.653627587    10.10.1.1 → 10.10.1.2    TCP 83 8081 → 46858 [PSH, ACK] Seq=1956 Ack=1973 Win=65152 Len=17 TSval=3168321755 TSecr=1044062047
1711546222.002868652   953 0.655110718    10.10.1.2 → 10.10.1.1    TCP 83 46858 → 8081 [PSH, ACK] Seq=1973 Ack=1973 Win=64256 Len=17 TSval=1044062048 TSecr=3168321755
1711546223.002868652   954 0.655122690    10.10.1.1 → 10.10.1.2    TCP 83 8081 → 46858 [PSH, ACK] Seq=1973 Ack=1990 Win=65152 Len=17 TSval=3168321756 TSecr=1044062048
1711546230.002868652   961 0.655700654    10.10.1.2 → 10.10.1.1    TCP 83 46858 → 8081 [PSH, ACK] Seq=1990 Ack=1990 Win=64256 Len=17 TSval=1044062049 TSecr=3168321756
1711546231.002868652   962 0.655713103    10.10.1.1 → 10.10.1.2    TCP 83 8081 → 46858 [PSH, ACK] Seq=1990 Ack=2007 Win=65152 Len=17 TSval=3168321757 TSecr=1044062049
