1711548386.188380241    22 0.258142008    10.10.1.2 → 10.10.1.1    TCP 74 38794 → 8081 [SYN] Seq=0 Win=64240 Len=0 MSS=1460 SACK_PERM=1 TSval=1047156483 TSecr=0 WS=128
1711548387.188380241    23 0.258178380    10.10.1.1 → 10.10.1.2    TCP 74 8081 → 38794 [SYN, ACK] Seq=0 Ack=1 Win=65160 Len=0 MSS=1460 SACK_PERM=1 TSval=3171416194 TSecr=1047156483 WS=128
1711548388.188380241    24 0.258216656    10.10.1.2 → 10.10.1.1    TCP 66 38794 → 8081 [ACK] Seq=1 Ack=1 Win=64256 Len=0 TSval=1047156484 TSecr=3171416194
1711548398.188380241    34 0.516362920    10.10.1.2 → 10.10.1.1    TCP 83 38794 → 8081 [PSH, ACK] Seq=1 Ack=1 Win=64256 Len=17 TSval=1047156742 TSecr=3171416194
1711548399.188380241    35 0.516378617    10.10.1.1 → 10.10.1.2    TCP 66 8081 → 38794 [ACK] Seq=1 Ack=18 Win=65152 Len=0 TSval=3171416452 TSecr=1047156742
1711548402.188380241    38 0.516554642    10.10.1.1 → 10.10.1.2    TCP 83 8081 → 38794 [PSH, ACK] Seq=1 Ack=18 Win=65152 Len=17 TSval=3171416452 TSecr=1047156742
1711548403.188380241    39 0.516582213    10.10.1.2 → 10.10.1.1    TCP 66 38794 → 8081 [ACK] Seq=18 Ack=18 Win=64256 Len=0 TSval=1047156742 TSecr=3171416452
1711548410.188380241    46 0.526722370    10.10.1.2 → 10.10.1.1    TCP 83 38794 → 8081 [PSH, ACK] Seq=18 Ack=18 Win=64256 Len=17 TSval=1047156752 TSecr=3171416452
1711548413.188380241    49 0.526760393    10.10.1.1 → 10.10.1.2    TCP 83 8081 → 38794 [PSH, ACK] Seq=18 Ack=35 Win=65152 Len=17 TSval=3171416463 TSecr=1047156752
1711548420.188380241    56 0.536922954    10.10.1.2 → 10.10.1.1    TCP 83 38794 → 8081 [PSH, ACK] Seq=35 Ack=35 Win=64256 Len=17 TSval=1047156762 TSecr=3171416463
1711548423.188380241    59 0.536959697    10.10.1.1 → 10.10.1.2    TCP 83 8081 → 38794 [PSH, ACK] Seq=35 Ack=52 Win=65152 Len=17 TSval=3171416473 TSecr=1047156762
1711548430.188380241    66 0.547124968    10.10.1.2 → 10.10.1.1    TCP 83 38794 → 8081 [PSH, ACK] Seq=52 Ack=52 Win=64256 Len=17 TSval=1047156772 TSecr=3171416473
1711548433.188380241    69 0.547160404    10.10.1.1 → 10.10.1.2    TCP 83 8081 → 38794 [PSH, ACK] Seq=52 Ack=69 Win=65152 Len=17 TSval=3171416483 TSecr=1047156772
1711548440.188380241    76 0.557323593    10.10.1.2 → 10.10.1.1    TCP 83 38794 → 8081 [PSH, ACK] Seq=69 Ack=69 Win=64256 Len=17 TSval=1047156783 TSecr=3171416483
1711548443.188380241    79 0.557359930    10.10.1.1 → 10.10.1.2    TCP 83 8081 → 38794 [PSH, ACK] Seq=69 Ack=86 Win=65152 Len=17 TSval=3171416493 TSecr=1047156783
1711548450.188380241    86 0.567522113    10.10.1.2 → 10.10.1.1    TCP 83 38794 → 8081 [PSH, ACK] Seq=86 Ack=86 Win=64256 Len=17 TSval=1047156793 TSecr=3171416493
1711548452.188380241    88 0.567558353    10.10.1.1 → 10.10.1.2    TCP 83 8081 → 38794 [PSH, ACK] Seq=86 Ack=103 Win=65152 Len=17 TSval=3171416503 TSecr=1047156793
1711548460.188380241    96 0.577721208    10.10.1.2 → 10.10.1.1    TCP 83 38794 → 8081 [PSH, ACK] Seq=103 Ack=103 Win=64256 Len=17 TSval=1047156803 TSecr=3171416503
1711548462.188380241    98 0.577758354    10.10.1.1 → 10.10.1.2    TCP 83 8081 → 38794 [PSH, ACK] Seq=103 Ack=120 Win=65152 Len=17 TSval=3171416514 TSecr=1047156803
1711548470.188380241   106 0.587922997    10.10.1.2 → 10.10.1.1    TCP 83 38794 → 8081 [PSH, ACK] Seq=120 Ack=120 Win=64256 Len=17 TSval=1047156813 TSecr=3171416514
1711548472.188380241   108 0.587959506    10.10.1.1 → 10.10.1.2    TCP 83 8081 → 38794 [PSH, ACK] Seq=120 Ack=137 Win=65152 Len=17 TSval=3171416524 TSecr=1047156813
1711548480.188380241   116 0.598121886    10.10.1.2 → 10.10.1.1    TCP 83 38794 → 8081 [PSH, ACK] Seq=137 Ack=137 Win=64256 Len=17 TSval=1047156823 TSecr=3171416524
1711548482.188380241   118 0.598158827    10.10.1.1 → 10.10.1.2    TCP 83 8081 → 38794 [PSH, ACK] Seq=137 Ack=154 Win=65152 Len=17 TSval=3171416534 TSecr=1047156823
1711548490.188380241   126 0.608322295    10.10.1.2 → 10.10.1.1    TCP 83 38794 → 8081 [PSH, ACK] Seq=154 Ack=154 Win=64256 Len=17 TSval=1047156834 TSecr=3171416534
1711548492.188380241   128 0.608358657    10.10.1.1 → 10.10.1.2    TCP 83 8081 → 38794 [PSH, ACK] Seq=154 Ack=171 Win=65152 Len=17 TSval=3171416544 TSecr=1047156834
1711548500.188380241   136 0.618524725    10.10.1.2 → 10.10.1.1    TCP 83 38794 → 8081 [PSH, ACK] Seq=171 Ack=171 Win=64256 Len=17 TSval=1047156844 TSecr=3171416544
1711548502.188380241   138 0.618562036    10.10.1.1 → 10.10.1.2    TCP 83 8081 → 38794 [PSH, ACK] Seq=171 Ack=188 Win=65152 Len=17 TSval=3171416554 TSecr=1047156844
1711548510.188380241   146 0.628726098    10.10.1.2 → 10.10.1.1    TCP 83 38794 → 8081 [PSH, ACK] Seq=188 Ack=188 Win=64256 Len=17 TSval=1047156854 TSecr=3171416554
1711548512.188380241   148 0.628763079    10.10.1.1 → 10.10.1.2    TCP 83 8081 → 38794 [PSH, ACK] Seq=188 Ack=205 Win=65152 Len=17 TSval=3171416565 TSecr=1047156854
1711548520.188380241   156 0.638929386    10.10.1.2 → 10.10.1.1    TCP 83 38794 → 8081 [PSH, ACK] Seq=205 Ack=205 Win=64256 Len=17 TSval=1047156864 TSecr=3171416565
1711548522.188380241   158 0.638967110    10.10.1.1 → 10.10.1.2    TCP 83 8081 → 38794 [PSH, ACK] Seq=205 Ack=222 Win=65152 Len=17 TSval=3171416575 TSecr=1047156864
1711548530.188380241   166 0.649129661    10.10.1.2 → 10.10.1.1    TCP 83 38794 → 8081 [PSH, ACK] Seq=222 Ack=222 Win=64256 Len=17 TSval=1047156874 TSecr=3171416575
1711548532.188380241   168 0.649166563    10.10.1.1 → 10.10.1.2    TCP 83 8081 → 38794 [PSH, ACK] Seq=222 Ack=239 Win=65152 Len=17 TSval=3171416585 TSecr=1047156874
1711548540.188380241   176 0.659331278    10.10.1.2 → 10.10.1.1    TCP 83 38794 → 8081 [PSH, ACK] Seq=239 Ack=239 Win=64256 Len=17 TSval=1047156885 TSecr=3171416585
1711548542.188380241   178 0.659367918    10.10.1.1 → 10.10.1.2    TCP 83 8081 → 38794 [PSH, ACK] Seq=239 Ack=256 Win=65152 Len=17 TSval=3171416595 TSecr=1047156885
1711548550.188380241   186 0.669533391    10.10.1.2 → 10.10.1.1    TCP 83 38794 → 8081 [PSH, ACK] Seq=256 Ack=256 Win=64256 Len=17 TSval=1047156895 TSecr=3171416595
1711548552.188380241   188 0.669569847    10.10.1.1 → 10.10.1.2    TCP 83 8081 → 38794 [PSH, ACK] Seq=256 Ack=273 Win=65152 Len=17 TSval=3171416605 TSecr=1047156895
1711548560.188380241   196 0.679734987    10.10.1.2 → 10.10.1.1    TCP 83 38794 → 8081 [PSH, ACK] Seq=273 Ack=273 Win=64256 Len=17 TSval=1047156905 TSecr=3171416605
1711548562.188380241   198 0.679771661    10.10.1.1 → 10.10.1.2    TCP 83 8081 → 38794 [PSH, ACK] Seq=273 Ack=290 Win=65152 Len=17 TSval=3171416616 TSecr=1047156905
1711548570.188380241   206 0.689935273    10.10.1.2 → 10.10.1.1    TCP 83 38794 → 8081 [PSH, ACK] Seq=290 Ack=290 Win=64256 Len=17 TSval=1047156915 TSecr=3171416616
1711548572.188380241   208 0.689971145    10.10.1.1 → 10.10.1.2    TCP 83 8081 → 38794 [PSH, ACK] Seq=290 Ack=307 Win=65152 Len=17 TSval=3171416626 TSecr=1047156915
1711548580.188380241   216 0.700132448    10.10.1.2 → 10.10.1.1    TCP 83 38794 → 8081 [PSH, ACK] Seq=307 Ack=307 Win=64256 Len=17 TSval=1047156925 TSecr=3171416626
1711548582.188380241   218 0.700181069    10.10.1.1 → 10.10.1.2    TCP 83 8081 → 38794 [PSH, ACK] Seq=307 Ack=324 Win=65152 Len=17 TSval=3171416636 TSecr=1047156925
1711548590.188380241   226 0.710344703    10.10.1.2 → 10.10.1.1    TCP 83 38794 → 8081 [PSH, ACK] Seq=324 Ack=324 Win=64256 Len=17 TSval=1047156936 TSecr=3171416636
1711548592.188380241   228 0.710394213    10.10.1.1 → 10.10.1.2    TCP 83 8081 → 38794 [PSH, ACK] Seq=324 Ack=341 Win=65152 Len=17 TSval=3171416646 TSecr=1047156936
1711548600.188380241   236 0.720556883    10.10.1.2 → 10.10.1.1    TCP 83 38794 → 8081 [PSH, ACK] Seq=341 Ack=341 Win=64256 Len=17 TSval=1047156946 TSecr=3171416646
1711548602.188380241   238 0.720598442    10.10.1.1 → 10.10.1.2    TCP 83 8081 → 38794 [PSH, ACK] Seq=341 Ack=358 Win=65152 Len=17 TSval=3171416656 TSecr=1047156946
1711548610.188380241   246 0.730760010    10.10.1.2 → 10.10.1.1    TCP 83 38794 → 8081 [PSH, ACK] Seq=358 Ack=358 Win=64256 Len=17 TSval=1047156956 TSecr=3171416656
1711548612.188380241   248 0.730797449    10.10.1.1 → 10.10.1.2    TCP 83 8081 → 38794 [PSH, ACK] Seq=358 Ack=375 Win=65152 Len=17 TSval=3171416667 TSecr=1047156956
1711548620.188380241   256 0.740958481    10.10.1.2 → 10.10.1.1    TCP 83 38794 → 8081 [PSH, ACK] Seq=375 Ack=375 Win=64256 Len=17 TSval=1047156966 TSecr=3171416667
1711548622.188380241   258 0.740995657    10.10.1.1 → 10.10.1.2    TCP 83 8081 → 38794 [PSH, ACK] Seq=375 Ack=392 Win=65152 Len=17 TSval=3171416677 TSecr=1047156966
1711548630.188380241   266 0.751157693    10.10.1.2 → 10.10.1.1    TCP 83 38794 → 8081 [PSH, ACK] Seq=392 Ack=392 Win=64256 Len=17 TSval=1047156976 TSecr=3171416677
1711548632.188380241   268 0.751195310    10.10.1.1 → 10.10.1.2    TCP 83 8081 → 38794 [PSH, ACK] Seq=392 Ack=409 Win=65152 Len=17 TSval=3171416687 TSecr=1047156976
1711548640.188380241   276 0.761356264    10.10.1.2 → 10.10.1.1    TCP 83 38794 → 8081 [PSH, ACK] Seq=409 Ack=409 Win=64256 Len=17 TSval=1047156987 TSecr=3171416687
1711548642.188380241   278 0.761394749    10.10.1.1 → 10.10.1.2    TCP 83 8081 → 38794 [PSH, ACK] Seq=409 Ack=426 Win=65152 Len=17 TSval=3171416697 TSecr=1047156987
1711548650.188380241   286 0.771556448    10.10.1.2 → 10.10.1.1    TCP 83 38794 → 8081 [PSH, ACK] Seq=426 Ack=426 Win=64256 Len=17 TSval=1047156997 TSecr=3171416697
1711548652.188380241   288 0.771592719    10.10.1.1 → 10.10.1.2    TCP 83 8081 → 38794 [PSH, ACK] Seq=426 Ack=443 Win=65152 Len=17 TSval=3171416707 TSecr=1047156997
1711548660.188380241   296 0.781754072    10.10.1.2 → 10.10.1.1    TCP 83 38794 → 8081 [PSH, ACK] Seq=443 Ack=443 Win=64256 Len=17 TSval=1047157007 TSecr=3171416707
1711548662.188380241   298 0.781789930    10.10.1.1 → 10.10.1.2    TCP 83 8081 → 38794 [PSH, ACK] Seq=443 Ack=460 Win=65152 Len=17 TSval=3171416718 TSecr=1047157007
1711548670.188380241   306 0.791951217    10.10.1.2 → 10.10.1.1    TCP 83 38794 → 8081 [PSH, ACK] Seq=460 Ack=460 Win=64256 Len=17 TSval=1047157017 TSecr=3171416718
1711548672.188380241   308 0.791988207    10.10.1.1 → 10.10.1.2    TCP 83 8081 → 38794 [PSH, ACK] Seq=460 Ack=477 Win=65152 Len=17 TSval=3171416728 TSecr=1047157017
1711548680.188380241   316 0.802149145    10.10.1.2 → 10.10.1.1    TCP 83 38794 → 8081 [PSH, ACK] Seq=477 Ack=477 Win=64256 Len=17 TSval=1047157027 TSecr=3171416728
1711548682.188380241   318 0.802185631    10.10.1.1 → 10.10.1.2    TCP 83 8081 → 38794 [PSH, ACK] Seq=477 Ack=494 Win=65152 Len=17 TSval=3171416738 TSecr=1047157027
1711548690.188380241   326 0.812350891    10.10.1.2 → 10.10.1.1    TCP 83 38794 → 8081 [PSH, ACK] Seq=494 Ack=494 Win=64256 Len=17 TSval=1047157038 TSecr=3171416738
1711548692.188380241   328 0.812386662    10.10.1.1 → 10.10.1.2    TCP 83 8081 → 38794 [PSH, ACK] Seq=494 Ack=511 Win=65152 Len=17 TSval=3171416748 TSecr=1047157038
1711548700.188380241   336 0.822549080    10.10.1.2 → 10.10.1.1    TCP 83 38794 → 8081 [PSH, ACK] Seq=511 Ack=511 Win=64256 Len=17 TSval=1047157048 TSecr=3171416748
1711548702.188380241   338 0.822585134    10.10.1.1 → 10.10.1.2    TCP 83 8081 → 38794 [PSH, ACK] Seq=511 Ack=528 Win=65152 Len=17 TSval=3171416758 TSecr=1047157048
1711548710.188380241   346 0.832750087    10.10.1.2 → 10.10.1.1    TCP 83 38794 → 8081 [PSH, ACK] Seq=528 Ack=528 Win=64256 Len=17 TSval=1047157058 TSecr=3171416758
1711548712.188380241   348 0.832787293    10.10.1.1 → 10.10.1.2    TCP 83 8081 → 38794 [PSH, ACK] Seq=528 Ack=545 Win=65152 Len=17 TSval=3171416769 TSecr=1047157058
1711548720.188380241   356 0.842952294    10.10.1.2 → 10.10.1.1    TCP 83 38794 → 8081 [PSH, ACK] Seq=545 Ack=545 Win=64256 Len=17 TSval=1047157068 TSecr=3171416769
1711548722.188380241   358 0.842988879    10.10.1.1 → 10.10.1.2    TCP 83 8081 → 38794 [PSH, ACK] Seq=545 Ack=562 Win=65152 Len=17 TSval=3171416779 TSecr=1047157068
1711548730.188380241   366 0.853150468    10.10.1.2 → 10.10.1.1    TCP 83 38794 → 8081 [PSH, ACK] Seq=562 Ack=562 Win=64256 Len=17 TSval=1047157078 TSecr=3171416779
1711548732.188380241   368 0.853185587    10.10.1.1 → 10.10.1.2    TCP 83 8081 → 38794 [PSH, ACK] Seq=562 Ack=579 Win=65152 Len=17 TSval=3171416789 TSecr=1047157078
1711548740.188380241   376 0.863346247    10.10.1.2 → 10.10.1.1    TCP 83 38794 → 8081 [PSH, ACK] Seq=579 Ack=579 Win=64256 Len=17 TSval=1047157089 TSecr=3171416789
1711548742.188380241   378 0.863382706    10.10.1.1 → 10.10.1.2    TCP 83 8081 → 38794 [PSH, ACK] Seq=579 Ack=596 Win=65152 Len=17 TSval=3171416799 TSecr=1047157089
1711548750.188380241   386 0.873543277    10.10.1.2 → 10.10.1.1    TCP 83 38794 → 8081 [PSH, ACK] Seq=596 Ack=596 Win=64256 Len=17 TSval=1047157099 TSecr=3171416799
1711548752.188380241   388 0.873580531    10.10.1.1 → 10.10.1.2    TCP 83 8081 → 38794 [PSH, ACK] Seq=596 Ack=613 Win=65152 Len=17 TSval=3171416809 TSecr=1047157099
1711548760.188380241   396 0.883742601    10.10.1.2 → 10.10.1.1    TCP 83 38794 → 8081 [PSH, ACK] Seq=613 Ack=613 Win=64256 Len=17 TSval=1047157109 TSecr=3171416809
1711548762.188380241   398 0.883778373    10.10.1.1 → 10.10.1.2    TCP 83 8081 → 38794 [PSH, ACK] Seq=613 Ack=630 Win=65152 Len=17 TSval=3171416820 TSecr=1047157109
1711548770.188380241   406 0.893939509    10.10.1.2 → 10.10.1.1    TCP 83 38794 → 8081 [PSH, ACK] Seq=630 Ack=630 Win=64256 Len=17 TSval=1047157119 TSecr=3171416820
1711548772.188380241   408 0.893976066    10.10.1.1 → 10.10.1.2    TCP 83 8081 → 38794 [PSH, ACK] Seq=630 Ack=647 Win=65152 Len=17 TSval=3171416830 TSecr=1047157119
1711548780.188380241   416 0.904137194    10.10.1.2 → 10.10.1.1    TCP 83 38794 → 8081 [PSH, ACK] Seq=647 Ack=647 Win=64256 Len=17 TSval=1047157129 TSecr=3171416830
1711548782.188380241   418 0.904174790    10.10.1.1 → 10.10.1.2    TCP 83 8081 → 38794 [PSH, ACK] Seq=647 Ack=664 Win=65152 Len=17 TSval=3171416840 TSecr=1047157129
1711548790.188380241   426 0.914334567    10.10.1.2 → 10.10.1.1    TCP 83 38794 → 8081 [PSH, ACK] Seq=664 Ack=664 Win=64256 Len=17 TSval=1047157140 TSecr=3171416840
1711548792.188380241   428 0.914371029    10.10.1.1 → 10.10.1.2    TCP 83 8081 → 38794 [PSH, ACK] Seq=664 Ack=681 Win=65152 Len=17 TSval=3171416850 TSecr=1047157140
1711548800.188380241   436 0.924532153    10.10.1.2 → 10.10.1.1    TCP 83 38794 → 8081 [PSH, ACK] Seq=681 Ack=681 Win=64256 Len=17 TSval=1047157150 TSecr=3171416850
1711548802.188380241   438 0.924567826    10.10.1.1 → 10.10.1.2    TCP 83 8081 → 38794 [PSH, ACK] Seq=681 Ack=698 Win=65152 Len=17 TSval=3171416860 TSecr=1047157150
1711548810.188380241   446 0.934730486    10.10.1.2 → 10.10.1.1    TCP 83 38794 → 8081 [PSH, ACK] Seq=698 Ack=698 Win=64256 Len=17 TSval=1047157160 TSecr=3171416860
1711548812.188380241   448 0.934766173    10.10.1.1 → 10.10.1.2    TCP 83 8081 → 38794 [PSH, ACK] Seq=698 Ack=715 Win=65152 Len=17 TSval=3171416871 TSecr=1047157160
1711548820.188380241   456 0.944927844    10.10.1.2 → 10.10.1.1    TCP 83 38794 → 8081 [PSH, ACK] Seq=715 Ack=715 Win=64256 Len=17 TSval=1047157170 TSecr=3171416871
1711548822.188380241   458 0.944963410    10.10.1.1 → 10.10.1.2    TCP 83 8081 → 38794 [PSH, ACK] Seq=715 Ack=732 Win=65152 Len=17 TSval=3171416881 TSecr=1047157170
1711548830.188380241   466 0.955125018    10.10.1.2 → 10.10.1.1    TCP 83 38794 → 8081 [PSH, ACK] Seq=732 Ack=732 Win=64256 Len=17 TSval=1047157180 TSecr=3171416881
1711548832.188380241   468 0.955160890    10.10.1.1 → 10.10.1.2    TCP 83 8081 → 38794 [PSH, ACK] Seq=732 Ack=749 Win=65152 Len=17 TSval=3171416891 TSecr=1047157180
1711548840.188380241   476 0.965322343    10.10.1.2 → 10.10.1.1    TCP 83 38794 → 8081 [PSH, ACK] Seq=749 Ack=749 Win=64256 Len=17 TSval=1047157191 TSecr=3171416891
1711548842.188380241   478 0.965359203    10.10.1.1 → 10.10.1.2    TCP 83 8081 → 38794 [PSH, ACK] Seq=749 Ack=766 Win=65152 Len=17 TSval=3171416901 TSecr=1047157191
1711548850.188380241   486 0.975520213    10.10.1.2 → 10.10.1.1    TCP 83 38794 → 8081 [PSH, ACK] Seq=766 Ack=766 Win=64256 Len=17 TSval=1047157201 TSecr=3171416901
1711548852.188380241   488 0.975560330    10.10.1.1 → 10.10.1.2    TCP 83 8081 → 38794 [PSH, ACK] Seq=766 Ack=783 Win=65152 Len=17 TSval=3171416911 TSecr=1047157201
1711548860.188380241   496 0.985724867    10.10.1.2 → 10.10.1.1    TCP 83 38794 → 8081 [PSH, ACK] Seq=783 Ack=783 Win=64256 Len=17 TSval=1047157211 TSecr=3171416911
1711548862.188380241   498 0.985760651    10.10.1.1 → 10.10.1.2    TCP 83 8081 → 38794 [PSH, ACK] Seq=783 Ack=800 Win=65152 Len=17 TSval=3171416922 TSecr=1047157211
1711548870.188380241   506 0.995924857    10.10.1.2 → 10.10.1.1    TCP 83 38794 → 8081 [PSH, ACK] Seq=800 Ack=800 Win=64256 Len=17 TSval=1047157221 TSecr=3171416922
1711548872.188380241   508 0.995960476    10.10.1.1 → 10.10.1.2    TCP 83 8081 → 38794 [PSH, ACK] Seq=800 Ack=817 Win=65152 Len=17 TSval=3171416932 TSecr=1047157221
1711548880.188380241   516 1.006124086    10.10.1.2 → 10.10.1.1    TCP 83 38794 → 8081 [PSH, ACK] Seq=817 Ack=817 Win=64256 Len=17 TSval=1047157231 TSecr=3171416932
1711548882.188380241   518 1.006159611    10.10.1.1 → 10.10.1.2    TCP 83 8081 → 38794 [PSH, ACK] Seq=817 Ack=834 Win=65152 Len=17 TSval=3171416942 TSecr=1047157231
1711548890.188380241   526 1.016322560    10.10.1.2 → 10.10.1.1    TCP 83 38794 → 8081 [PSH, ACK] Seq=834 Ack=834 Win=64256 Len=17 TSval=1047157242 TSecr=3171416942
1711548892.188380241   528 1.016358637    10.10.1.1 → 10.10.1.2    TCP 83 8081 → 38794 [PSH, ACK] Seq=834 Ack=851 Win=65152 Len=17 TSval=3171416952 TSecr=1047157242
1711548900.188380241   536 1.026518655    10.10.1.2 → 10.10.1.1    TCP 83 38794 → 8081 [PSH, ACK] Seq=851 Ack=851 Win=64256 Len=17 TSval=1047157252 TSecr=3171416952
1711548902.188380241   538 1.026555405    10.10.1.1 → 10.10.1.2    TCP 83 8081 → 38794 [PSH, ACK] Seq=851 Ack=868 Win=65152 Len=17 TSval=3171416962 TSecr=1047157252
1711548910.188380241   546 1.036717123    10.10.1.2 → 10.10.1.1    TCP 83 38794 → 8081 [PSH, ACK] Seq=868 Ack=868 Win=64256 Len=17 TSval=1047157262 TSecr=3171416962
1711548912.188380241   548 1.036752645    10.10.1.1 → 10.10.1.2    TCP 83 8081 → 38794 [PSH, ACK] Seq=868 Ack=885 Win=65152 Len=17 TSval=3171416973 TSecr=1047157262
1711548920.188380241   556 1.046915569    10.10.1.2 → 10.10.1.1    TCP 83 38794 → 8081 [PSH, ACK] Seq=885 Ack=885 Win=64256 Len=17 TSval=1047157272 TSecr=3171416973
1711548922.188380241   558 1.046951578    10.10.1.1 → 10.10.1.2    TCP 83 8081 → 38794 [PSH, ACK] Seq=885 Ack=902 Win=65152 Len=17 TSval=3171416983 TSecr=1047157272
1711548930.188380241   566 1.057112180    10.10.1.2 → 10.10.1.1    TCP 83 38794 → 8081 [PSH, ACK] Seq=902 Ack=902 Win=64256 Len=17 TSval=1047157282 TSecr=3171416983
1711548932.188380241   568 1.057147266    10.10.1.1 → 10.10.1.2    TCP 83 8081 → 38794 [PSH, ACK] Seq=902 Ack=919 Win=65152 Len=17 TSval=3171416993 TSecr=1047157282
1711548940.188380241   576 1.067308281    10.10.1.2 → 10.10.1.1    TCP 83 38794 → 8081 [PSH, ACK] Seq=919 Ack=919 Win=64256 Len=17 TSval=1047157293 TSecr=3171416993
1711548942.188380241   578 1.067344248    10.10.1.1 → 10.10.1.2    TCP 83 8081 → 38794 [PSH, ACK] Seq=919 Ack=936 Win=65152 Len=17 TSval=3171417003 TSecr=1047157293
1711548950.188380241   586 1.077505535    10.10.1.2 → 10.10.1.1    TCP 83 38794 → 8081 [PSH, ACK] Seq=936 Ack=936 Win=64256 Len=17 TSval=1047157303 TSecr=3171417003
1711548952.188380241   588 1.077543165    10.10.1.1 → 10.10.1.2    TCP 83 8081 → 38794 [PSH, ACK] Seq=936 Ack=953 Win=65152 Len=17 TSval=3171417013 TSecr=1047157303
1711548960.188380241   596 1.087706430    10.10.1.2 → 10.10.1.1    TCP 83 38794 → 8081 [PSH, ACK] Seq=953 Ack=953 Win=64256 Len=17 TSval=1047157313 TSecr=3171417013
1711548963.188380241   599 1.087775890    10.10.1.1 → 10.10.1.2    TCP 83 8081 → 38794 [PSH, ACK] Seq=953 Ack=970 Win=65152 Len=17 TSval=3171417024 TSecr=1047157313
1711548970.188380241   606 1.097939237    10.10.1.2 → 10.10.1.1    TCP 83 38794 → 8081 [PSH, ACK] Seq=970 Ack=970 Win=64256 Len=17 TSval=1047157323 TSecr=3171417024
1711548972.188380241   608 1.097975157    10.10.1.1 → 10.10.1.2    TCP 83 8081 → 38794 [PSH, ACK] Seq=970 Ack=987 Win=65152 Len=17 TSval=3171417034 TSecr=1047157323
1711548980.188380241   616 1.108137821    10.10.1.2 → 10.10.1.1    TCP 83 38794 → 8081 [PSH, ACK] Seq=987 Ack=987 Win=64256 Len=17 TSval=1047157333 TSecr=3171417034
1711548982.188380241   618 1.108175385    10.10.1.1 → 10.10.1.2    TCP 83 8081 → 38794 [PSH, ACK] Seq=987 Ack=1004 Win=65152 Len=17 TSval=3171417044 TSecr=1047157333
1711548990.188380241   626 1.118339091    10.10.1.2 → 10.10.1.1    TCP 83 38794 → 8081 [PSH, ACK] Seq=1004 Ack=1004 Win=64256 Len=17 TSval=1047157344 TSecr=3171417044
1711548992.188380241   628 1.118375479    10.10.1.1 → 10.10.1.2    TCP 83 8081 → 38794 [PSH, ACK] Seq=1004 Ack=1021 Win=65152 Len=17 TSval=3171417054 TSecr=1047157344
1711549000.188380241   636 1.128535997    10.10.1.2 → 10.10.1.1    TCP 83 38794 → 8081 [PSH, ACK] Seq=1021 Ack=1021 Win=64256 Len=17 TSval=1047157354 TSecr=3171417054
1711549002.188380241   638 1.128571761    10.10.1.1 → 10.10.1.2    TCP 83 8081 → 38794 [PSH, ACK] Seq=1021 Ack=1038 Win=65152 Len=17 TSval=3171417064 TSecr=1047157354
1711549010.188380241   646 1.138734501    10.10.1.2 → 10.10.1.1    TCP 83 38794 → 8081 [PSH, ACK] Seq=1038 Ack=1038 Win=64256 Len=17 TSval=1047157364 TSecr=3171417064
1711549012.188380241   648 1.138770997    10.10.1.1 → 10.10.1.2    TCP 83 8081 → 38794 [PSH, ACK] Seq=1038 Ack=1055 Win=65152 Len=17 TSval=3171417075 TSecr=1047157364
1711549020.188380241   656 1.148932626    10.10.1.2 → 10.10.1.1    TCP 83 38794 → 8081 [PSH, ACK] Seq=1055 Ack=1055 Win=64256 Len=17 TSval=1047157374 TSecr=3171417075
1711549022.188380241   658 1.148969215    10.10.1.1 → 10.10.1.2    TCP 83 8081 → 38794 [PSH, ACK] Seq=1055 Ack=1072 Win=65152 Len=17 TSval=3171417085 TSecr=1047157374
1711549030.188380241   666 1.159130462    10.10.1.2 → 10.10.1.1    TCP 83 38794 → 8081 [PSH, ACK] Seq=1072 Ack=1072 Win=64256 Len=17 TSval=1047157384 TSecr=3171417085
1711549032.188380241   668 1.159166924    10.10.1.1 → 10.10.1.2    TCP 83 8081 → 38794 [PSH, ACK] Seq=1072 Ack=1089 Win=65152 Len=17 TSval=3171417095 TSecr=1047157384
1711549040.188380241   676 1.169328334    10.10.1.2 → 10.10.1.1    TCP 83 38794 → 8081 [PSH, ACK] Seq=1089 Ack=1089 Win=64256 Len=17 TSval=1047157395 TSecr=3171417095
1711549042.188380241   678 1.169363868    10.10.1.1 → 10.10.1.2    TCP 83 8081 → 38794 [PSH, ACK] Seq=1089 Ack=1106 Win=65152 Len=17 TSval=3171417105 TSecr=1047157395
1711549050.188380241   686 1.179527031    10.10.1.2 → 10.10.1.1    TCP 83 38794 → 8081 [PSH, ACK] Seq=1106 Ack=1106 Win=64256 Len=17 TSval=1047157405 TSecr=3171417105
1711549052.188380241   688 1.179564682    10.10.1.1 → 10.10.1.2    TCP 83 8081 → 38794 [PSH, ACK] Seq=1106 Ack=1123 Win=65152 Len=17 TSval=3171417115 TSecr=1047157405
1711549060.188380241   696 1.189724540    10.10.1.2 → 10.10.1.1    TCP 83 38794 → 8081 [PSH, ACK] Seq=1123 Ack=1123 Win=64256 Len=17 TSval=1047157415 TSecr=3171417115
1711549062.188380241   698 1.189760648    10.10.1.1 → 10.10.1.2    TCP 83 8081 → 38794 [PSH, ACK] Seq=1123 Ack=1140 Win=65152 Len=17 TSval=3171417126 TSecr=1047157415
1711549070.188380241   706 1.199921260    10.10.1.2 → 10.10.1.1    TCP 83 38794 → 8081 [PSH, ACK] Seq=1140 Ack=1140 Win=64256 Len=17 TSval=1047157425 TSecr=3171417126
1711549072.188380241   708 1.199957101    10.10.1.1 → 10.10.1.2    TCP 83 8081 → 38794 [PSH, ACK] Seq=1140 Ack=1157 Win=65152 Len=17 TSval=3171417136 TSecr=1047157425
1711549080.188380241   716 1.210119983    10.10.1.2 → 10.10.1.1    TCP 83 38794 → 8081 [PSH, ACK] Seq=1157 Ack=1157 Win=64256 Len=17 TSval=1047157435 TSecr=3171417136
1711549082.188380241   718 1.210157587    10.10.1.1 → 10.10.1.2    TCP 83 8081 → 38794 [PSH, ACK] Seq=1157 Ack=1174 Win=65152 Len=17 TSval=3171417146 TSecr=1047157435
1711549090.188380241   726 1.220319514    10.10.1.2 → 10.10.1.1    TCP 83 38794 → 8081 [PSH, ACK] Seq=1174 Ack=1174 Win=64256 Len=17 TSval=1047157446 TSecr=3171417146
1711549092.188380241   728 1.220360681    10.10.1.1 → 10.10.1.2    TCP 83 8081 → 38794 [PSH, ACK] Seq=1174 Ack=1191 Win=65152 Len=17 TSval=3171417156 TSecr=1047157446
1711549100.188380241   736 1.230521959    10.10.1.2 → 10.10.1.1    TCP 83 38794 → 8081 [PSH, ACK] Seq=1191 Ack=1191 Win=64256 Len=17 TSval=1047157456 TSecr=3171417156
1711549102.188380241   738 1.230563876    10.10.1.1 → 10.10.1.2    TCP 83 8081 → 38794 [PSH, ACK] Seq=1191 Ack=1208 Win=65152 Len=17 TSval=3171417166 TSecr=1047157456
1711549110.188380241   746 1.240725529    10.10.1.2 → 10.10.1.1    TCP 83 38794 → 8081 [PSH, ACK] Seq=1208 Ack=1208 Win=64256 Len=17 TSval=1047157466 TSecr=3171417166
1711549112.188380241   748 1.240762877    10.10.1.1 → 10.10.1.2    TCP 83 8081 → 38794 [PSH, ACK] Seq=1208 Ack=1225 Win=65152 Len=17 TSval=3171417177 TSecr=1047157466
1711549120.188380241   756 1.250925551    10.10.1.2 → 10.10.1.1    TCP 83 38794 → 8081 [PSH, ACK] Seq=1225 Ack=1225 Win=64256 Len=17 TSval=1047157476 TSecr=3171417177
1711549122.188380241   758 1.250967073    10.10.1.1 → 10.10.1.2    TCP 83 8081 → 38794 [PSH, ACK] Seq=1225 Ack=1242 Win=65152 Len=17 TSval=3171417187 TSecr=1047157476
1711549130.188380241   766 1.261129321    10.10.1.2 → 10.10.1.1    TCP 83 38794 → 8081 [PSH, ACK] Seq=1242 Ack=1242 Win=64256 Len=17 TSval=1047157486 TSecr=3171417187
1711549132.188380241   768 1.261165256    10.10.1.1 → 10.10.1.2    TCP 83 8081 → 38794 [PSH, ACK] Seq=1242 Ack=1259 Win=65152 Len=17 TSval=3171417197 TSecr=1047157486
1711549140.188380241   776 1.271329680    10.10.1.2 → 10.10.1.1    TCP 83 38794 → 8081 [PSH, ACK] Seq=1259 Ack=1259 Win=64256 Len=17 TSval=1047157497 TSecr=3171417197
1711549142.188380241   778 1.271365672    10.10.1.1 → 10.10.1.2    TCP 83 8081 → 38794 [PSH, ACK] Seq=1259 Ack=1276 Win=65152 Len=17 TSval=3171417207 TSecr=1047157497
1711549150.188380241   786 1.281530073    10.10.1.2 → 10.10.1.1    TCP 83 38794 → 8081 [PSH, ACK] Seq=1276 Ack=1276 Win=64256 Len=17 TSval=1047157507 TSecr=3171417207
1711549152.188380241   788 1.281566136    10.10.1.1 → 10.10.1.2    TCP 83 8081 → 38794 [PSH, ACK] Seq=1276 Ack=1293 Win=65152 Len=17 TSval=3171417217 TSecr=1047157507
1711549160.188380241   796 1.291728137    10.10.1.2 → 10.10.1.1    TCP 83 38794 → 8081 [PSH, ACK] Seq=1293 Ack=1293 Win=64256 Len=17 TSval=1047157517 TSecr=3171417217
1711549162.188380241   798 1.291764543    10.10.1.1 → 10.10.1.2    TCP 83 8081 → 38794 [PSH, ACK] Seq=1293 Ack=1310 Win=65152 Len=17 TSval=3171417228 TSecr=1047157517
1711549170.188380241   806 1.301927694    10.10.1.2 → 10.10.1.1    TCP 83 38794 → 8081 [PSH, ACK] Seq=1310 Ack=1310 Win=64256 Len=17 TSval=1047157527 TSecr=3171417228
1711549172.188380241   808 1.301963938    10.10.1.1 → 10.10.1.2    TCP 83 8081 → 38794 [PSH, ACK] Seq=1310 Ack=1327 Win=65152 Len=17 TSval=3171417238 TSecr=1047157527
1711549180.188380241   816 1.312124751    10.10.1.2 → 10.10.1.1    TCP 83 38794 → 8081 [PSH, ACK] Seq=1327 Ack=1327 Win=64256 Len=17 TSval=1047157537 TSecr=3171417238
1711549182.188380241   818 1.312161470    10.10.1.1 → 10.10.1.2    TCP 83 8081 → 38794 [PSH, ACK] Seq=1327 Ack=1344 Win=65152 Len=17 TSval=3171417248 TSecr=1047157537
1711549190.188380241   826 1.322324397    10.10.1.2 → 10.10.1.1    TCP 83 38794 → 8081 [PSH, ACK] Seq=1344 Ack=1344 Win=64256 Len=17 TSval=1047157548 TSecr=3171417248
1711549192.188380241   828 1.322360256    10.10.1.1 → 10.10.1.2    TCP 83 8081 → 38794 [PSH, ACK] Seq=1344 Ack=1361 Win=65152 Len=17 TSval=3171417258 TSecr=1047157548
1711549200.188380241   836 1.332521927    10.10.1.2 → 10.10.1.1    TCP 83 38794 → 8081 [PSH, ACK] Seq=1361 Ack=1361 Win=64256 Len=17 TSval=1047157558 TSecr=3171417258
1711549202.188380241   838 1.332556868    10.10.1.1 → 10.10.1.2    TCP 83 8081 → 38794 [PSH, ACK] Seq=1361 Ack=1378 Win=65152 Len=17 TSval=3171417268 TSecr=1047157558
1711549210.188380241   846 1.342721024    10.10.1.2 → 10.10.1.1    TCP 83 38794 → 8081 [PSH, ACK] Seq=1378 Ack=1378 Win=64256 Len=17 TSval=1047157568 TSecr=3171417268
1711549212.188380241   848 1.342760082    10.10.1.1 → 10.10.1.2    TCP 83 8081 → 38794 [PSH, ACK] Seq=1378 Ack=1395 Win=65152 Len=17 TSval=3171417279 TSecr=1047157568
1711549220.188380241   856 1.352919665    10.10.1.2 → 10.10.1.1    TCP 83 38794 → 8081 [PSH, ACK] Seq=1395 Ack=1395 Win=64256 Len=17 TSval=1047157578 TSecr=3171417279
1711549222.188380241   858 1.352958349    10.10.1.1 → 10.10.1.2    TCP 83 8081 → 38794 [PSH, ACK] Seq=1395 Ack=1412 Win=65152 Len=17 TSval=3171417289 TSecr=1047157578
1711549230.188380241   866 1.363119947    10.10.1.2 → 10.10.1.1    TCP 83 38794 → 8081 [PSH, ACK] Seq=1412 Ack=1412 Win=64256 Len=17 TSval=1047157588 TSecr=3171417289
1711549232.188380241   868 1.363156224    10.10.1.1 → 10.10.1.2    TCP 83 8081 → 38794 [PSH, ACK] Seq=1412 Ack=1429 Win=65152 Len=17 TSval=3171417299 TSecr=1047157588
1711549240.188380241   876 1.373318142    10.10.1.2 → 10.10.1.1    TCP 83 38794 → 8081 [PSH, ACK] Seq=1429 Ack=1429 Win=64256 Len=17 TSval=1047157599 TSecr=3171417299
1711549242.188380241   878 1.373357232    10.10.1.1 → 10.10.1.2    TCP 83 8081 → 38794 [PSH, ACK] Seq=1429 Ack=1446 Win=65152 Len=17 TSval=3171417309 TSecr=1047157599
1711549250.188380241   886 1.383517920    10.10.1.2 → 10.10.1.1    TCP 83 38794 → 8081 [PSH, ACK] Seq=1446 Ack=1446 Win=64256 Len=17 TSval=1047157609 TSecr=3171417309
1711549252.188380241   888 1.383553728    10.10.1.1 → 10.10.1.2    TCP 83 8081 → 38794 [PSH, ACK] Seq=1446 Ack=1463 Win=65152 Len=17 TSval=3171417319 TSecr=1047157609
1711549260.188380241   896 1.393715987    10.10.1.2 → 10.10.1.1    TCP 83 38794 → 8081 [PSH, ACK] Seq=1463 Ack=1463 Win=64256 Len=17 TSval=1047157619 TSecr=3171417319
1711549262.188380241   898 1.393752211    10.10.1.1 → 10.10.1.2    TCP 83 8081 → 38794 [PSH, ACK] Seq=1463 Ack=1480 Win=65152 Len=17 TSval=3171417330 TSecr=1047157619
1711549270.188380241   906 1.403915211    10.10.1.2 → 10.10.1.1    TCP 83 38794 → 8081 [PSH, ACK] Seq=1480 Ack=1480 Win=64256 Len=17 TSval=1047157629 TSecr=3171417330
1711549272.188380241   908 1.403950827    10.10.1.1 → 10.10.1.2    TCP 83 8081 → 38794 [PSH, ACK] Seq=1480 Ack=1497 Win=65152 Len=17 TSval=3171417340 TSecr=1047157629
1711549280.188380241   916 1.414115868    10.10.1.2 → 10.10.1.1    TCP 83 38794 → 8081 [PSH, ACK] Seq=1497 Ack=1497 Win=64256 Len=17 TSval=1047157639 TSecr=3171417340
1711549282.188380241   918 1.414152272    10.10.1.1 → 10.10.1.2    TCP 83 8081 → 38794 [PSH, ACK] Seq=1497 Ack=1514 Win=65152 Len=17 TSval=3171417350 TSecr=1047157639
1711549290.188380241   926 1.424314838    10.10.1.2 → 10.10.1.1    TCP 83 38794 → 8081 [PSH, ACK] Seq=1514 Ack=1514 Win=64256 Len=17 TSval=1047157650 TSecr=3171417350
1711549292.188380241   928 1.424351023    10.10.1.1 → 10.10.1.2    TCP 83 8081 → 38794 [PSH, ACK] Seq=1514 Ack=1531 Win=65152 Len=17 TSval=3171417360 TSecr=1047157650
1711549300.188380241   936 1.434511663    10.10.1.2 → 10.10.1.1    TCP 83 38794 → 8081 [PSH, ACK] Seq=1531 Ack=1531 Win=64256 Len=17 TSval=1047157660 TSecr=3171417360
1711549302.188380241   938 1.434548577    10.10.1.1 → 10.10.1.2    TCP 83 8081 → 38794 [PSH, ACK] Seq=1531 Ack=1548 Win=65152 Len=17 TSval=3171417370 TSecr=1047157660
1711549310.188380241   946 1.444709307    10.10.1.2 → 10.10.1.1    TCP 83 38794 → 8081 [PSH, ACK] Seq=1548 Ack=1548 Win=64256 Len=17 TSval=1047157670 TSecr=3171417370
1711549312.188380241   948 1.444744877    10.10.1.1 → 10.10.1.2    TCP 83 8081 → 38794 [PSH, ACK] Seq=1548 Ack=1565 Win=65152 Len=17 TSval=3171417381 TSecr=1047157670
1711549320.188380241   956 1.454907288    10.10.1.2 → 10.10.1.1    TCP 83 38794 → 8081 [PSH, ACK] Seq=1565 Ack=1565 Win=64256 Len=17 TSval=1047157680 TSecr=3171417381
1711549322.188380241   958 1.454942956    10.10.1.1 → 10.10.1.2    TCP 83 8081 → 38794 [PSH, ACK] Seq=1565 Ack=1582 Win=65152 Len=17 TSval=3171417391 TSecr=1047157680
1711549330.188380241   966 1.465105034    10.10.1.2 → 10.10.1.1    TCP 83 38794 → 8081 [PSH, ACK] Seq=1582 Ack=1582 Win=64256 Len=17 TSval=1047157690 TSecr=3171417391
1711549332.188380241   968 1.465140792    10.10.1.1 → 10.10.1.2    TCP 83 8081 → 38794 [PSH, ACK] Seq=1582 Ack=1599 Win=65152 Len=17 TSval=3171417401 TSecr=1047157690
1711549340.188380241   976 1.475300616    10.10.1.2 → 10.10.1.1    TCP 83 38794 → 8081 [PSH, ACK] Seq=1599 Ack=1599 Win=64256 Len=17 TSval=1047157701 TSecr=3171417401
1711549342.188380241   978 1.475337544    10.10.1.1 → 10.10.1.2    TCP 83 8081 → 38794 [PSH, ACK] Seq=1599 Ack=1616 Win=65152 Len=17 TSval=3171417411 TSecr=1047157701
1711549350.188380241   986 1.485501433    10.10.1.2 → 10.10.1.1    TCP 83 38794 → 8081 [PSH, ACK] Seq=1616 Ack=1616 Win=64256 Len=17 TSval=1047157711 TSecr=3171417411
1711549352.188380241   988 1.485543163    10.10.1.1 → 10.10.1.2    TCP 83 8081 → 38794 [PSH, ACK] Seq=1616 Ack=1633 Win=65152 Len=17 TSval=3171417421 TSecr=1047157711
1711549360.188380241   996 1.495706194    10.10.1.2 → 10.10.1.1    TCP 83 38794 → 8081 [PSH, ACK] Seq=1633 Ack=1633 Win=64256 Len=17 TSval=1047157721 TSecr=3171417421
1711549362.188380241   998 1.495741912    10.10.1.1 → 10.10.1.2    TCP 83 8081 → 38794 [PSH, ACK] Seq=1633 Ack=1650 Win=65152 Len=17 TSval=3171417432 TSecr=1047157721
1711549370.188380241  1006 1.505903965    10.10.1.2 → 10.10.1.1    TCP 83 38794 → 8081 [PSH, ACK] Seq=1650 Ack=1650 Win=64256 Len=17 TSval=1047157731 TSecr=3171417432
1711549372.188380241  1008 1.505939536    10.10.1.1 → 10.10.1.2    TCP 83 8081 → 38794 [PSH, ACK] Seq=1650 Ack=1667 Win=65152 Len=17 TSval=3171417442 TSecr=1047157731
1711549380.188380241  1016 1.516100607    10.10.1.2 → 10.10.1.1    TCP 83 38794 → 8081 [PSH, ACK] Seq=1667 Ack=1667 Win=64256 Len=17 TSval=1047157741 TSecr=3171417442
1711549382.188380241  1018 1.516137527    10.10.1.1 → 10.10.1.2    TCP 83 8081 → 38794 [PSH, ACK] Seq=1667 Ack=1684 Win=65152 Len=17 TSval=3171417452 TSecr=1047157741
1711549390.188380241  1026 1.526298585    10.10.1.2 → 10.10.1.1    TCP 83 38794 → 8081 [PSH, ACK] Seq=1684 Ack=1684 Win=64256 Len=17 TSval=1047157752 TSecr=3171417452
1711549392.188380241  1028 1.526334127    10.10.1.1 → 10.10.1.2    TCP 83 8081 → 38794 [PSH, ACK] Seq=1684 Ack=1701 Win=65152 Len=17 TSval=3171417462 TSecr=1047157752
1711549400.188380241  1036 1.536496340    10.10.1.2 → 10.10.1.1    TCP 83 38794 → 8081 [PSH, ACK] Seq=1701 Ack=1701 Win=64256 Len=17 TSval=1047157762 TSecr=3171417462
1711549402.188380241  1038 1.536532289    10.10.1.1 → 10.10.1.2    TCP 83 8081 → 38794 [PSH, ACK] Seq=1701 Ack=1718 Win=65152 Len=17 TSval=3171417472 TSecr=1047157762
1711549410.188380241  1046 1.546692838    10.10.1.2 → 10.10.1.1    TCP 83 38794 → 8081 [PSH, ACK] Seq=1718 Ack=1718 Win=64256 Len=17 TSval=1047157772 TSecr=3171417472
1711549412.188380241  1048 1.546729009    10.10.1.1 → 10.10.1.2    TCP 83 8081 → 38794 [PSH, ACK] Seq=1718 Ack=1735 Win=65152 Len=17 TSval=3171417483 TSecr=1047157772
1711549420.188380241  1056 1.556891012    10.10.1.2 → 10.10.1.1    TCP 83 38794 → 8081 [PSH, ACK] Seq=1735 Ack=1735 Win=64256 Len=17 TSval=1047157782 TSecr=3171417483
1711549422.188380241  1058 1.556926683    10.10.1.1 → 10.10.1.2    TCP 83 8081 → 38794 [PSH, ACK] Seq=1735 Ack=1752 Win=65152 Len=17 TSval=3171417493 TSecr=1047157782
1711549430.188380241  1066 1.567088207    10.10.1.2 → 10.10.1.1    TCP 83 38794 → 8081 [PSH, ACK] Seq=1752 Ack=1752 Win=64256 Len=17 TSval=1047157792 TSecr=3171417493
1711549432.188380241  1068 1.567124544    10.10.1.1 → 10.10.1.2    TCP 83 8081 → 38794 [PSH, ACK] Seq=1752 Ack=1769 Win=65152 Len=17 TSval=3171417503 TSecr=1047157792
1711549440.188380241  1076 1.577286302    10.10.1.2 → 10.10.1.1    TCP 83 38794 → 8081 [PSH, ACK] Seq=1769 Ack=1769 Win=64256 Len=17 TSval=1047157803 TSecr=3171417503
1711549442.188380241  1078 1.577321619    10.10.1.1 → 10.10.1.2    TCP 83 8081 → 38794 [PSH, ACK] Seq=1769 Ack=1786 Win=65152 Len=17 TSval=3171417513 TSecr=1047157803
1711549450.188380241  1086 1.587483151    10.10.1.2 → 10.10.1.1    TCP 83 38794 → 8081 [PSH, ACK] Seq=1786 Ack=1786 Win=64256 Len=17 TSval=1047157813 TSecr=3171417513
1711549452.188380241  1088 1.587519290    10.10.1.1 → 10.10.1.2    TCP 83 8081 → 38794 [PSH, ACK] Seq=1786 Ack=1803 Win=65152 Len=17 TSval=3171417523 TSecr=1047157813
1711549460.188380241  1096 1.597679556    10.10.1.2 → 10.10.1.1    TCP 83 38794 → 8081 [PSH, ACK] Seq=1803 Ack=1803 Win=64256 Len=17 TSval=1047157823 TSecr=3171417523
1711549462.188380241  1098 1.597716360    10.10.1.1 → 10.10.1.2    TCP 83 8081 → 38794 [PSH, ACK] Seq=1803 Ack=1820 Win=65152 Len=17 TSval=3171417534 TSecr=1047157823
1711549470.188380241  1106 1.607877538    10.10.1.2 → 10.10.1.1    TCP 83 38794 → 8081 [PSH, ACK] Seq=1820 Ack=1820 Win=64256 Len=17 TSval=1047157833 TSecr=3171417534
1711549472.188380241  1108 1.607913224    10.10.1.1 → 10.10.1.2    TCP 83 8081 → 38794 [PSH, ACK] Seq=1820 Ack=1837 Win=65152 Len=17 TSval=3171417544 TSecr=1047157833
1711549480.188380241  1116 1.618076717    10.10.1.2 → 10.10.1.1    TCP 83 38794 → 8081 [PSH, ACK] Seq=1837 Ack=1837 Win=64256 Len=17 TSval=1047157843 TSecr=3171417544
1711549482.188380241  1118 1.618113805    10.10.1.1 → 10.10.1.2    TCP 83 8081 → 38794 [PSH, ACK] Seq=1837 Ack=1854 Win=65152 Len=17 TSval=3171417554 TSecr=1047157843
1711549490.188380241  1126 1.628276873    10.10.1.2 → 10.10.1.1    TCP 83 38794 → 8081 [PSH, ACK] Seq=1854 Ack=1854 Win=64256 Len=17 TSval=1047157854 TSecr=3171417554
1711549492.188380241  1128 1.628312700    10.10.1.1 → 10.10.1.2    TCP 83 8081 → 38794 [PSH, ACK] Seq=1854 Ack=1871 Win=65152 Len=17 TSval=3171417564 TSecr=1047157854
1711549500.188380241  1136 1.638473951    10.10.1.2 → 10.10.1.1    TCP 83 38794 → 8081 [PSH, ACK] Seq=1871 Ack=1871 Win=64256 Len=17 TSval=1047157864 TSecr=3171417564
1711549502.188380241  1138 1.638509141    10.10.1.1 → 10.10.1.2    TCP 83 8081 → 38794 [PSH, ACK] Seq=1871 Ack=1888 Win=65152 Len=17 TSval=3171417574 TSecr=1047157864
1711549510.188380241  1146 1.648672770    10.10.1.2 → 10.10.1.1    TCP 83 38794 → 8081 [PSH, ACK] Seq=1888 Ack=1888 Win=64256 Len=17 TSval=1047157874 TSecr=3171417574
1711549512.188380241  1148 1.648708421    10.10.1.1 → 10.10.1.2    TCP 83 8081 → 38794 [PSH, ACK] Seq=1888 Ack=1905 Win=65152 Len=17 TSval=3171417585 TSecr=1047157874
1711549520.188380241  1156 1.658869749    10.10.1.2 → 10.10.1.1    TCP 83 38794 → 8081 [PSH, ACK] Seq=1905 Ack=1905 Win=64256 Len=17 TSval=1047157884 TSecr=3171417585
1711549522.188380241  1158 1.658905048    10.10.1.1 → 10.10.1.2    TCP 83 8081 → 38794 [PSH, ACK] Seq=1905 Ack=1922 Win=65152 Len=17 TSval=3171417595 TSecr=1047157884
1711549530.188380241  1166 1.669065423    10.10.1.2 → 10.10.1.1    TCP 83 38794 → 8081 [PSH, ACK] Seq=1922 Ack=1922 Win=64256 Len=17 TSval=1047157894 TSecr=3171417595
1711549533.188380241  1169 1.669129969    10.10.1.1 → 10.10.1.2    TCP 83 8081 → 38794 [PSH, ACK] Seq=1922 Ack=1939 Win=65152 Len=17 TSval=3171417605 TSecr=1047157894
1711549540.188380241  1176 1.679292789    10.10.1.2 → 10.10.1.1    TCP 83 38794 → 8081 [PSH, ACK] Seq=1939 Ack=1939 Win=64256 Len=17 TSval=1047157905 TSecr=3171417605
1711549542.188380241  1178 1.679329029    10.10.1.1 → 10.10.1.2    TCP 83 8081 → 38794 [PSH, ACK] Seq=1939 Ack=1956 Win=65152 Len=17 TSval=3171417615 TSecr=1047157905
1711549550.188380241  1186 1.689491109    10.10.1.2 → 10.10.1.1    TCP 83 38794 → 8081 [PSH, ACK] Seq=1956 Ack=1956 Win=64256 Len=17 TSval=1047157915 TSecr=3171417615
1711549552.188380241  1188 1.689526500    10.10.1.1 → 10.10.1.2    TCP 83 8081 → 38794 [PSH, ACK] Seq=1956 Ack=1973 Win=65152 Len=17 TSval=3171417625 TSecr=1047157915
1711549560.188380241  1196 1.699687247    10.10.1.2 → 10.10.1.1    TCP 83 38794 → 8081 [PSH, ACK] Seq=1973 Ack=1973 Win=64256 Len=17 TSval=1047157925 TSecr=3171417625
1711549562.188380241  1198 1.699723529    10.10.1.1 → 10.10.1.2    TCP 83 8081 → 38794 [PSH, ACK] Seq=1973 Ack=1990 Win=65152 Len=17 TSval=3171417636 TSecr=1047157925
1711549570.188380241  1206 1.709885770    10.10.1.2 → 10.10.1.1    TCP 83 38794 → 8081 [PSH, ACK] Seq=1990 Ack=1990 Win=64256 Len=17 TSval=1047157935 TSecr=3171417636
1711549572.188380241  1208 1.709922847    10.10.1.1 → 10.10.1.2    TCP 83 8081 → 38794 [PSH, ACK] Seq=1990 Ack=2007 Win=65152 Len=17 TSval=3171417646 TSecr=1047157935
