1712183434.683358908    23 0.272020249    10.10.1.2 → 10.10.1.1    TCP 74 33516 → 8081 [SYN] Seq=0 Win=64240 Len=0 MSS=1460 SACK_PERM=1 TSval=1682203985 TSecr=0 WS=128
1712183435.683358908    24 0.272056960    10.10.1.1 → 10.10.1.2    TCP 74 8081 → 33516 [SYN, ACK] Seq=0 Ack=1 Win=65160 Len=0 MSS=1460 SACK_PERM=1 TSval=3806463694 TSecr=1682203985 WS=128
1712183436.683358908    25 0.272093505    10.10.1.2 → 10.10.1.1    TCP 66 33516 → 8081 [ACK] Seq=1 Ack=1 Win=64256 Len=0 TSval=1682203985 TSecr=3806463694
1712183439.683358908    28 0.521525880    10.10.1.2 → 10.10.1.1    TCP 83 33516 → 8081 [PSH, ACK] Seq=1 Ack=1 Win=64256 Len=17 TSval=1682204235 TSecr=3806463694
1712183441.683358908    30 0.521555282    10.10.1.1 → 10.10.1.2    TCP 66 8081 → 33516 [ACK] Seq=1 Ack=18 Win=65152 Len=0 TSval=3806463944 TSecr=1682204235
1712183443.683358908    32 0.521847211    10.10.1.1 → 10.10.1.2    TCP 83 8081 → 33516 [PSH, ACK] Seq=1 Ack=18 Win=65152 Len=17 TSval=3806463944 TSecr=1682204235
1712183444.683358908    33 0.521882279    10.10.1.2 → 10.10.1.1    TCP 66 33516 → 8081 [ACK] Seq=18 Ack=18 Win=64256 Len=0 TSval=1682204235 TSecr=3806463944
1712183448.683358908    37 0.523066615    10.10.1.2 → 10.10.1.1    TCP 83 33516 → 8081 [PSH, ACK] Seq=18 Ack=18 Win=64256 Len=17 TSval=1682204236 TSecr=3806463944
1712183450.683358908    39 0.523192593    10.10.1.1 → 10.10.1.2    TCP 83 8081 → 33516 [PSH, ACK] Seq=18 Ack=35 Win=65152 Len=17 TSval=3806463945 TSecr=1682204236
1712183454.683358908    43 0.524402919    10.10.1.2 → 10.10.1.1    TCP 83 33516 → 8081 [PSH, ACK] Seq=35 Ack=35 Win=64256 Len=17 TSval=1682204237 TSecr=3806463945
1712183456.683358908    45 0.524536219    10.10.1.1 → 10.10.1.2    TCP 83 8081 → 33516 [PSH, ACK] Seq=35 Ack=52 Win=65152 Len=17 TSval=3806463947 TSecr=1682204237
1712183461.683358908    50 0.525741495    10.10.1.2 → 10.10.1.1    TCP 83 33516 → 8081 [PSH, ACK] Seq=52 Ack=52 Win=64256 Len=17 TSval=1682204239 TSecr=3806463947
1712183463.683358908    52 0.525871251    10.10.1.1 → 10.10.1.2    TCP 83 8081 → 33516 [PSH, ACK] Seq=52 Ack=69 Win=65152 Len=17 TSval=3806463948 TSecr=1682204239
1712183467.683358908    56 0.527079626    10.10.1.2 → 10.10.1.1    TCP 83 33516 → 8081 [PSH, ACK] Seq=69 Ack=69 Win=64256 Len=17 TSval=1682204240 TSecr=3806463948
1712183469.683358908    58 0.527209724    10.10.1.1 → 10.10.1.2    TCP 83 8081 → 33516 [PSH, ACK] Seq=69 Ack=86 Win=65152 Len=17 TSval=3806463949 TSecr=1682204240
1712183474.683358908    63 0.528418118    10.10.1.2 → 10.10.1.1    TCP 83 33516 → 8081 [PSH, ACK] Seq=86 Ack=86 Win=64256 Len=17 TSval=1682204241 TSecr=3806463949
1712183476.683358908    65 0.528550806    10.10.1.1 → 10.10.1.2    TCP 83 8081 → 33516 [PSH, ACK] Seq=86 Ack=103 Win=65152 Len=17 TSval=3806463951 TSecr=1682204241
1712183480.683358908    69 0.529755638    10.10.1.2 → 10.10.1.1    TCP 83 33516 → 8081 [PSH, ACK] Seq=103 Ack=103 Win=64256 Len=17 TSval=1682204243 TSecr=3806463951
1712183482.683358908    71 0.529880888    10.10.1.1 → 10.10.1.2    TCP 83 8081 → 33516 [PSH, ACK] Seq=103 Ack=120 Win=65152 Len=17 TSval=3806463952 TSecr=1682204243
1712183487.683358908    76 0.531088006    10.10.1.2 → 10.10.1.1    TCP 83 33516 → 8081 [PSH, ACK] Seq=120 Ack=120 Win=64256 Len=17 TSval=1682204244 TSecr=3806463952
1712183489.683358908    78 0.531214407    10.10.1.1 → 10.10.1.2    TCP 83 8081 → 33516 [PSH, ACK] Seq=120 Ack=137 Win=65152 Len=17 TSval=3806463953 TSecr=1682204244
1712183493.683358908    82 0.532421903    10.10.1.2 → 10.10.1.1    TCP 83 33516 → 8081 [PSH, ACK] Seq=137 Ack=137 Win=64256 Len=17 TSval=1682204245 TSecr=3806463953
1712183495.683358908    84 0.532557663    10.10.1.1 → 10.10.1.2    TCP 83 8081 → 33516 [PSH, ACK] Seq=137 Ack=154 Win=65152 Len=17 TSval=3806463955 TSecr=1682204245
1712183500.683358908    89 0.533763168    10.10.1.2 → 10.10.1.1    TCP 83 33516 → 8081 [PSH, ACK] Seq=154 Ack=154 Win=64256 Len=17 TSval=1682204247 TSecr=3806463955
1712183502.683358908    91 0.533889775    10.10.1.1 → 10.10.1.2    TCP 83 8081 → 33516 [PSH, ACK] Seq=154 Ack=171 Win=65152 Len=17 TSval=3806463956 TSecr=1682204247
1712183506.683358908    95 0.535095345    10.10.1.2 → 10.10.1.1    TCP 83 33516 → 8081 [PSH, ACK] Seq=171 Ack=171 Win=64256 Len=17 TSval=1682204248 TSecr=3806463956
1712183508.683358908    97 0.535221623    10.10.1.1 → 10.10.1.2    TCP 83 8081 → 33516 [PSH, ACK] Seq=171 Ack=188 Win=65152 Len=17 TSval=3806463957 TSecr=1682204248
1712183513.683358908   102 0.536429622    10.10.1.2 → 10.10.1.1    TCP 83 33516 → 8081 [PSH, ACK] Seq=188 Ack=188 Win=64256 Len=17 TSval=1682204250 TSecr=3806463957
1712183515.683358908   104 0.536559360    10.10.1.1 → 10.10.1.2    TCP 83 8081 → 33516 [PSH, ACK] Seq=188 Ack=205 Win=65152 Len=17 TSval=3806463959 TSecr=1682204250
1712183519.683358908   108 0.537763982    10.10.1.2 → 10.10.1.1    TCP 83 33516 → 8081 [PSH, ACK] Seq=205 Ack=205 Win=64256 Len=17 TSval=1682204251 TSecr=3806463959
1712183521.683358908   110 0.537889067    10.10.1.1 → 10.10.1.2    TCP 83 8081 → 33516 [PSH, ACK] Seq=205 Ack=222 Win=65152 Len=17 TSval=3806463960 TSecr=1682204251
1712183526.683358908   115 0.539094220    10.10.1.2 → 10.10.1.1    TCP 83 33516 → 8081 [PSH, ACK] Seq=222 Ack=222 Win=64256 Len=17 TSval=1682204252 TSecr=3806463960
1712183528.683358908   117 0.539219844    10.10.1.1 → 10.10.1.2    TCP 83 8081 → 33516 [PSH, ACK] Seq=222 Ack=239 Win=65152 Len=17 TSval=3806463961 TSecr=1682204252
1712183532.683358908   121 0.540428021    10.10.1.2 → 10.10.1.1    TCP 83 33516 → 8081 [PSH, ACK] Seq=239 Ack=239 Win=64256 Len=17 TSval=1682204254 TSecr=3806463961
1712183534.683358908   123 0.540556741    10.10.1.1 → 10.10.1.2    TCP 83 8081 → 33516 [PSH, ACK] Seq=239 Ack=256 Win=65152 Len=17 TSval=3806463963 TSecr=1682204254
1712183539.683358908   128 0.541761831    10.10.1.2 → 10.10.1.1    TCP 83 33516 → 8081 [PSH, ACK] Seq=256 Ack=256 Win=64256 Len=17 TSval=1682204255 TSecr=3806463963
1712183541.683358908   130 0.541895439    10.10.1.1 → 10.10.1.2    TCP 83 8081 → 33516 [PSH, ACK] Seq=256 Ack=273 Win=65152 Len=17 TSval=3806463964 TSecr=1682204255
1712183545.683358908   134 0.543101381    10.10.1.2 → 10.10.1.1    TCP 83 33516 → 8081 [PSH, ACK] Seq=273 Ack=273 Win=64256 Len=17 TSval=1682204256 TSecr=3806463964
1712183547.683358908   136 0.543236806    10.10.1.1 → 10.10.1.2    TCP 83 8081 → 33516 [PSH, ACK] Seq=273 Ack=290 Win=65152 Len=17 TSval=3806463965 TSecr=1682204256
1712183552.683358908   141 0.544443942    10.10.1.2 → 10.10.1.1    TCP 83 33516 → 8081 [PSH, ACK] Seq=290 Ack=290 Win=64256 Len=17 TSval=1682204258 TSecr=3806463965
1712183554.683358908   143 0.544580080    10.10.1.1 → 10.10.1.2    TCP 83 8081 → 33516 [PSH, ACK] Seq=290 Ack=307 Win=65152 Len=17 TSval=3806463967 TSecr=1682204258
1712183558.683358908   147 0.545784903    10.10.1.2 → 10.10.1.1    TCP 83 33516 → 8081 [PSH, ACK] Seq=307 Ack=307 Win=64256 Len=17 TSval=1682204259 TSecr=3806463967
1712183560.683358908   149 0.545913110    10.10.1.1 → 10.10.1.2    TCP 83 8081 → 33516 [PSH, ACK] Seq=307 Ack=324 Win=65152 Len=17 TSval=3806463968 TSecr=1682204259
1712183565.683358908   154 0.547118423    10.10.1.2 → 10.10.1.1    TCP 83 33516 → 8081 [PSH, ACK] Seq=324 Ack=324 Win=64256 Len=17 TSval=1682204260 TSecr=3806463968
1712183567.683358908   156 0.547245487    10.10.1.1 → 10.10.1.2    TCP 83 8081 → 33516 [PSH, ACK] Seq=324 Ack=341 Win=65152 Len=17 TSval=3806463969 TSecr=1682204260
1712183571.683358908   160 0.548455463    10.10.1.2 → 10.10.1.1    TCP 83 33516 → 8081 [PSH, ACK] Seq=341 Ack=341 Win=64256 Len=17 TSval=1682204262 TSecr=3806463969
1712183573.683358908   162 0.548536805    10.10.1.1 → 10.10.1.2    TCP 83 8081 → 33516 [PSH, ACK] Seq=341 Ack=358 Win=65152 Len=17 TSval=3806463971 TSecr=1682204262
1712183578.683358908   167 0.549743945    10.10.1.2 → 10.10.1.1    TCP 83 33516 → 8081 [PSH, ACK] Seq=358 Ack=358 Win=64256 Len=17 TSval=1682204263 TSecr=3806463971
1712183580.683358908   169 0.549820482    10.10.1.1 → 10.10.1.2    TCP 83 8081 → 33516 [PSH, ACK] Seq=358 Ack=375 Win=65152 Len=17 TSval=3806463972 TSecr=1682204263
1712183584.683358908   173 0.551025616    10.10.1.2 → 10.10.1.1    TCP 83 33516 → 8081 [PSH, ACK] Seq=375 Ack=375 Win=64256 Len=17 TSval=1682204264 TSecr=3806463972
1712183586.683358908   175 0.551101989    10.10.1.1 → 10.10.1.2    TCP 83 8081 → 33516 [PSH, ACK] Seq=375 Ack=392 Win=65152 Len=17 TSval=3806463973 TSecr=1682204264
1712183591.683358908   180 0.552308751    10.10.1.2 → 10.10.1.1    TCP 83 33516 → 8081 [PSH, ACK] Seq=392 Ack=392 Win=64256 Len=17 TSval=1682204265 TSecr=3806463973
1712183593.683358908   182 0.552388428    10.10.1.1 → 10.10.1.2    TCP 83 8081 → 33516 [PSH, ACK] Seq=392 Ack=409 Win=65152 Len=17 TSval=3806463975 TSecr=1682204265
1712183597.683358908   186 0.553593460    10.10.1.2 → 10.10.1.1    TCP 83 33516 → 8081 [PSH, ACK] Seq=409 Ack=409 Win=64256 Len=17 TSval=1682204267 TSecr=3806463975
1712183599.683358908   188 0.553670097    10.10.1.1 → 10.10.1.2    TCP 83 8081 → 33516 [PSH, ACK] Seq=409 Ack=426 Win=65152 Len=17 TSval=3806463976 TSecr=1682204267
1712183604.683358908   193 0.554875140    10.10.1.2 → 10.10.1.1    TCP 83 33516 → 8081 [PSH, ACK] Seq=426 Ack=426 Win=64256 Len=17 TSval=1682204268 TSecr=3806463976
1712183606.683358908   195 0.554951808    10.10.1.1 → 10.10.1.2    TCP 83 8081 → 33516 [PSH, ACK] Seq=426 Ack=443 Win=65152 Len=17 TSval=3806463977 TSecr=1682204268
1712183610.683358908   199 0.556157842    10.10.1.2 → 10.10.1.1    TCP 83 33516 → 8081 [PSH, ACK] Seq=443 Ack=443 Win=64256 Len=17 TSval=1682204269 TSecr=3806463977
1712183612.683358908   201 0.556238219    10.10.1.1 → 10.10.1.2    TCP 83 8081 → 33516 [PSH, ACK] Seq=443 Ack=460 Win=65152 Len=17 TSval=3806463978 TSecr=1682204269
1712183617.683358908   206 0.557441101    10.10.1.2 → 10.10.1.1    TCP 83 33516 → 8081 [PSH, ACK] Seq=460 Ack=460 Win=64256 Len=17 TSval=1682204271 TSecr=3806463978
1712183619.683358908   208 0.557517662    10.10.1.1 → 10.10.1.2    TCP 83 8081 → 33516 [PSH, ACK] Seq=460 Ack=477 Win=65152 Len=17 TSval=3806463980 TSecr=1682204271
1712183623.683358908   212 0.558722281    10.10.1.2 → 10.10.1.1    TCP 83 33516 → 8081 [PSH, ACK] Seq=477 Ack=477 Win=64256 Len=17 TSval=1682204272 TSecr=3806463980
1712183625.683358908   214 0.558798944    10.10.1.1 → 10.10.1.2    TCP 83 8081 → 33516 [PSH, ACK] Seq=477 Ack=494 Win=65152 Len=17 TSval=3806463981 TSecr=1682204272
1712183630.683358908   219 0.560006704    10.10.1.2 → 10.10.1.1    TCP 83 33516 → 8081 [PSH, ACK] Seq=494 Ack=494 Win=64256 Len=17 TSval=1682204273 TSecr=3806463981
1712183632.683358908   221 0.560086105    10.10.1.1 → 10.10.1.2    TCP 83 8081 → 33516 [PSH, ACK] Seq=494 Ack=511 Win=65152 Len=17 TSval=3806463982 TSecr=1682204273
1712183636.683358908   225 0.561292934    10.10.1.2 → 10.10.1.1    TCP 83 33516 → 8081 [PSH, ACK] Seq=511 Ack=511 Win=64256 Len=17 TSval=1682204274 TSecr=3806463982
1712183638.683358908   227 0.561373664    10.10.1.1 → 10.10.1.2    TCP 83 8081 → 33516 [PSH, ACK] Seq=511 Ack=528 Win=65152 Len=17 TSval=3806463984 TSecr=1682204274
1712183643.683358908   232 0.562577582    10.10.1.2 → 10.10.1.1    TCP 83 33516 → 8081 [PSH, ACK] Seq=528 Ack=528 Win=64256 Len=17 TSval=1682204276 TSecr=3806463984
1712183645.683358908   234 0.562657542    10.10.1.1 → 10.10.1.2    TCP 83 8081 → 33516 [PSH, ACK] Seq=528 Ack=545 Win=65152 Len=17 TSval=3806463985 TSecr=1682204276
1712183649.683358908   238 0.563863622    10.10.1.2 → 10.10.1.1    TCP 83 33516 → 8081 [PSH, ACK] Seq=545 Ack=545 Win=64256 Len=17 TSval=1682204277 TSecr=3806463985
1712183651.683358908   240 0.563947617    10.10.1.1 → 10.10.1.2    TCP 83 8081 → 33516 [PSH, ACK] Seq=545 Ack=562 Win=65152 Len=17 TSval=3806463986 TSecr=1682204277
1712183656.683358908   245 0.565151124    10.10.1.2 → 10.10.1.1    TCP 83 33516 → 8081 [PSH, ACK] Seq=562 Ack=562 Win=64256 Len=17 TSval=1682204278 TSecr=3806463986
1712183658.683358908   247 0.565232078    10.10.1.1 → 10.10.1.2    TCP 83 8081 → 33516 [PSH, ACK] Seq=562 Ack=579 Win=65152 Len=17 TSval=3806463987 TSecr=1682204278
1712183662.683358908   251 0.566438886    10.10.1.2 → 10.10.1.1    TCP 83 33516 → 8081 [PSH, ACK] Seq=579 Ack=579 Win=64256 Len=17 TSval=1682204280 TSecr=3806463987
1712183664.683358908   253 0.566515298    10.10.1.1 → 10.10.1.2    TCP 83 8081 → 33516 [PSH, ACK] Seq=579 Ack=596 Win=65152 Len=17 TSval=3806463989 TSecr=1682204280
1712183669.683358908   258 0.567724123    10.10.1.2 → 10.10.1.1    TCP 83 33516 → 8081 [PSH, ACK] Seq=596 Ack=596 Win=64256 Len=17 TSval=1682204281 TSecr=3806463989
1712183671.683358908   260 0.567808534    10.10.1.1 → 10.10.1.2    TCP 83 8081 → 33516 [PSH, ACK] Seq=596 Ack=613 Win=65152 Len=17 TSval=3806463990 TSecr=1682204281
1712183675.683358908   264 0.569013699    10.10.1.2 → 10.10.1.1    TCP 83 33516 → 8081 [PSH, ACK] Seq=613 Ack=613 Win=64256 Len=17 TSval=1682204282 TSecr=3806463990
1712183677.683358908   266 0.569094008    10.10.1.1 → 10.10.1.2    TCP 83 8081 → 33516 [PSH, ACK] Seq=613 Ack=630 Win=65152 Len=17 TSval=3806463991 TSecr=1682204282
1712183682.683358908   271 0.570298179    10.10.1.2 → 10.10.1.1    TCP 83 33516 → 8081 [PSH, ACK] Seq=630 Ack=630 Win=64256 Len=17 TSval=1682204283 TSecr=3806463991
1712183683.683358908   272 0.570378643    10.10.1.1 → 10.10.1.2    TCP 83 8081 → 33516 [PSH, ACK] Seq=630 Ack=647 Win=65152 Len=17 TSval=3806463993 TSecr=1682204283
1712183688.683358908   277 0.571544916    10.10.1.2 → 10.10.1.1    TCP 83 33516 → 8081 [PSH, ACK] Seq=647 Ack=647 Win=64256 Len=17 TSval=1682204285 TSecr=3806463993
1712183690.683358908   279 0.571627584    10.10.1.1 → 10.10.1.2    TCP 83 8081 → 33516 [PSH, ACK] Seq=647 Ack=664 Win=65152 Len=17 TSval=3806463994 TSecr=1682204285
1712183695.683358908   284 0.572832369    10.10.1.2 → 10.10.1.1    TCP 83 33516 → 8081 [PSH, ACK] Seq=664 Ack=664 Win=64256 Len=17 TSval=1682204286 TSecr=3806463994
1712183697.683358908   286 0.572912106    10.10.1.1 → 10.10.1.2    TCP 83 8081 → 33516 [PSH, ACK] Seq=664 Ack=681 Win=65152 Len=17 TSval=3806463995 TSecr=1682204286
1712183701.683358908   290 0.574114669    10.10.1.2 → 10.10.1.1    TCP 83 33516 → 8081 [PSH, ACK] Seq=681 Ack=681 Win=64256 Len=17 TSval=1682204287 TSecr=3806463995
1712183703.683358908   292 0.574195046    10.10.1.1 → 10.10.1.2    TCP 83 8081 → 33516 [PSH, ACK] Seq=681 Ack=698 Win=65152 Len=17 TSval=3806463996 TSecr=1682204287
1712183708.683358908   297 0.575399658    10.10.1.2 → 10.10.1.1    TCP 83 33516 → 8081 [PSH, ACK] Seq=698 Ack=698 Win=64256 Len=17 TSval=1682204288 TSecr=3806463996
1712183710.683358908   299 0.575483892    10.10.1.1 → 10.10.1.2    TCP 83 8081 → 33516 [PSH, ACK] Seq=698 Ack=715 Win=65152 Len=17 TSval=3806463998 TSecr=1682204288
1712183714.683358908   303 0.576691435    10.10.1.2 → 10.10.1.1    TCP 83 33516 → 8081 [PSH, ACK] Seq=715 Ack=715 Win=64256 Len=17 TSval=1682204290 TSecr=3806463998
1712183716.683358908   305 0.576772054    10.10.1.1 → 10.10.1.2    TCP 83 8081 → 33516 [PSH, ACK] Seq=715 Ack=732 Win=65152 Len=17 TSval=3806463999 TSecr=1682204290
1712183721.683358908   310 0.577975745    10.10.1.2 → 10.10.1.1    TCP 83 33516 → 8081 [PSH, ACK] Seq=732 Ack=732 Win=64256 Len=17 TSval=1682204291 TSecr=3806463999
1712183723.683358908   312 0.578056146    10.10.1.1 → 10.10.1.2    TCP 83 8081 → 33516 [PSH, ACK] Seq=732 Ack=749 Win=65152 Len=17 TSval=3806464000 TSecr=1682204291
1712183727.683358908   316 0.579260362    10.10.1.2 → 10.10.1.1    TCP 83 33516 → 8081 [PSH, ACK] Seq=749 Ack=749 Win=64256 Len=17 TSval=1682204292 TSecr=3806464000
1712183729.683358908   318 0.579373497    10.10.1.1 → 10.10.1.2    TCP 83 8081 → 33516 [PSH, ACK] Seq=749 Ack=766 Win=65152 Len=17 TSval=3806464002 TSecr=1682204292
1712183734.683358908   323 0.580581225    10.10.1.2 → 10.10.1.1    TCP 83 33516 → 8081 [PSH, ACK] Seq=766 Ack=766 Win=64256 Len=17 TSval=1682204294 TSecr=3806464002
1712183736.683358908   325 0.580661981    10.10.1.1 → 10.10.1.2    TCP 83 8081 → 33516 [PSH, ACK] Seq=766 Ack=783 Win=65152 Len=17 TSval=3806464003 TSecr=1682204294
1712183740.683358908   329 0.581866312    10.10.1.2 → 10.10.1.1    TCP 83 33516 → 8081 [PSH, ACK] Seq=783 Ack=783 Win=64256 Len=17 TSval=1682204295 TSecr=3806464003
1712183742.683358908   331 0.581946416    10.10.1.1 → 10.10.1.2    TCP 83 8081 → 33516 [PSH, ACK] Seq=783 Ack=800 Win=65152 Len=17 TSval=3806464004 TSecr=1682204295
1712183747.683358908   336 0.583150162    10.10.1.2 → 10.10.1.1    TCP 83 33516 → 8081 [PSH, ACK] Seq=800 Ack=800 Win=64256 Len=17 TSval=1682204296 TSecr=3806464004
1712183749.683358908   338 0.583225854    10.10.1.1 → 10.10.1.2    TCP 83 8081 → 33516 [PSH, ACK] Seq=800 Ack=817 Win=65152 Len=17 TSval=3806464005 TSecr=1682204296
1712183753.683358908   342 0.584431509    10.10.1.2 → 10.10.1.1    TCP 83 33516 → 8081 [PSH, ACK] Seq=817 Ack=817 Win=64256 Len=17 TSval=1682204298 TSecr=3806464005
1712183755.683358908   344 0.584511270    10.10.1.1 → 10.10.1.2    TCP 83 8081 → 33516 [PSH, ACK] Seq=817 Ack=834 Win=65152 Len=17 TSval=3806464007 TSecr=1682204298
1712183760.683358908   349 0.585714665    10.10.1.2 → 10.10.1.1    TCP 83 33516 → 8081 [PSH, ACK] Seq=834 Ack=834 Win=64256 Len=17 TSval=1682204299 TSecr=3806464007
1712183762.683358908   351 0.585791533    10.10.1.1 → 10.10.1.2    TCP 83 8081 → 33516 [PSH, ACK] Seq=834 Ack=851 Win=65152 Len=17 TSval=3806464008 TSecr=1682204299
1712183766.683358908   355 0.586995321    10.10.1.2 → 10.10.1.1    TCP 83 33516 → 8081 [PSH, ACK] Seq=851 Ack=851 Win=64256 Len=17 TSval=1682204300 TSecr=3806464008
1712183768.683358908   357 0.587072029    10.10.1.1 → 10.10.1.2    TCP 83 8081 → 33516 [PSH, ACK] Seq=851 Ack=868 Win=65152 Len=17 TSval=3806464009 TSecr=1682204300
1712183773.683358908   362 0.588278998    10.10.1.2 → 10.10.1.1    TCP 83 33516 → 8081 [PSH, ACK] Seq=868 Ack=868 Win=64256 Len=17 TSval=1682204301 TSecr=3806464009
1712183775.683358908   364 0.588359106    10.10.1.1 → 10.10.1.2    TCP 83 8081 → 33516 [PSH, ACK] Seq=868 Ack=885 Win=65152 Len=17 TSval=3806464011 TSecr=1682204301
1712183779.683358908   368 0.589563816    10.10.1.2 → 10.10.1.1    TCP 83 33516 → 8081 [PSH, ACK] Seq=885 Ack=885 Win=64256 Len=17 TSval=1682204303 TSecr=3806464011
1712183781.683358908   370 0.589640270    10.10.1.1 → 10.10.1.2    TCP 83 8081 → 33516 [PSH, ACK] Seq=885 Ack=902 Win=65152 Len=17 TSval=3806464012 TSecr=1682204303
1712183786.683358908   375 0.590845685    10.10.1.2 → 10.10.1.1    TCP 83 33516 → 8081 [PSH, ACK] Seq=902 Ack=902 Win=64256 Len=17 TSval=1682204304 TSecr=3806464012
1712183788.683358908   377 0.590922213    10.10.1.1 → 10.10.1.2    TCP 83 8081 → 33516 [PSH, ACK] Seq=902 Ack=919 Win=65152 Len=17 TSval=3806464013 TSecr=1682204304
1712183792.683358908   381 0.592127758    10.10.1.2 → 10.10.1.1    TCP 83 33516 → 8081 [PSH, ACK] Seq=919 Ack=919 Win=64256 Len=17 TSval=1682204305 TSecr=3806464013
1712183794.683358908   383 0.592207943    10.10.1.1 → 10.10.1.2    TCP 83 8081 → 33516 [PSH, ACK] Seq=919 Ack=936 Win=65152 Len=17 TSval=3806464014 TSecr=1682204305
1712183799.683358908   388 0.593411869    10.10.1.2 → 10.10.1.1    TCP 83 33516 → 8081 [PSH, ACK] Seq=936 Ack=936 Win=64256 Len=17 TSval=1682204306 TSecr=3806464014
1712183801.683358908   390 0.593487759    10.10.1.1 → 10.10.1.2    TCP 83 8081 → 33516 [PSH, ACK] Seq=936 Ack=953 Win=65152 Len=17 TSval=3806464016 TSecr=1682204306
1712183805.683358908   394 0.594693988    10.10.1.2 → 10.10.1.1    TCP 83 33516 → 8081 [PSH, ACK] Seq=953 Ack=953 Win=64256 Len=17 TSval=1682204308 TSecr=3806464016
1712183808.683358908   397 0.594832497    10.10.1.1 → 10.10.1.2    TCP 83 8081 → 33516 [PSH, ACK] Seq=953 Ack=970 Win=65152 Len=17 TSval=3806464017 TSecr=1682204308
1712183812.683358908   401 0.596039983    10.10.1.2 → 10.10.1.1    TCP 83 33516 → 8081 [PSH, ACK] Seq=970 Ack=970 Win=64256 Len=17 TSval=1682204309 TSecr=3806464017
1712183814.683358908   403 0.596120119    10.10.1.1 → 10.10.1.2    TCP 83 8081 → 33516 [PSH, ACK] Seq=970 Ack=987 Win=65152 Len=17 TSval=3806464018 TSecr=1682204309
1712183818.683358908   407 0.597325156    10.10.1.2 → 10.10.1.1    TCP 83 33516 → 8081 [PSH, ACK] Seq=987 Ack=987 Win=64256 Len=17 TSval=1682204310 TSecr=3806464018
1712183820.683358908   409 0.597404774    10.10.1.1 → 10.10.1.2    TCP 83 8081 → 33516 [PSH, ACK] Seq=987 Ack=1004 Win=65152 Len=17 TSval=3806464020 TSecr=1682204310
1712183825.683358908   414 0.598610502    10.10.1.2 → 10.10.1.1    TCP 83 33516 → 8081 [PSH, ACK] Seq=1004 Ack=1004 Win=64256 Len=17 TSval=1682204312 TSecr=3806464020
1712183827.683358908   416 0.598690187    10.10.1.1 → 10.10.1.2    TCP 83 8081 → 33516 [PSH, ACK] Seq=1004 Ack=1021 Win=65152 Len=17 TSval=3806464021 TSecr=1682204312
1712183831.683358908   420 0.599900199    10.10.1.2 → 10.10.1.1    TCP 83 33516 → 8081 [PSH, ACK] Seq=1021 Ack=1021 Win=64256 Len=17 TSval=1682204313 TSecr=3806464021
1712183833.683358908   422 0.599984289    10.10.1.1 → 10.10.1.2    TCP 83 8081 → 33516 [PSH, ACK] Seq=1021 Ack=1038 Win=65152 Len=17 TSval=3806464022 TSecr=1682204313
1712183838.683358908   427 0.601189845    10.10.1.2 → 10.10.1.1    TCP 83 33516 → 8081 [PSH, ACK] Seq=1038 Ack=1038 Win=64256 Len=17 TSval=1682204314 TSecr=3806464022
1712183840.683358908   429 0.601269313    10.10.1.1 → 10.10.1.2    TCP 83 8081 → 33516 [PSH, ACK] Seq=1038 Ack=1055 Win=65152 Len=17 TSval=3806464023 TSecr=1682204314
1712183844.683358908   433 0.602438475    10.10.1.2 → 10.10.1.1    TCP 83 33516 → 8081 [PSH, ACK] Seq=1055 Ack=1055 Win=64256 Len=17 TSval=1682204316 TSecr=3806464023
1712183846.683358908   435 0.602515152    10.10.1.1 → 10.10.1.2    TCP 83 8081 → 33516 [PSH, ACK] Seq=1055 Ack=1072 Win=65152 Len=17 TSval=3806464025 TSecr=1682204316
1712183851.683358908   440 0.603677455    10.10.1.2 → 10.10.1.1    TCP 83 33516 → 8081 [PSH, ACK] Seq=1072 Ack=1072 Win=64256 Len=17 TSval=1682204317 TSecr=3806464025
1712183853.683358908   442 0.603754372    10.10.1.1 → 10.10.1.2    TCP 83 8081 → 33516 [PSH, ACK] Seq=1072 Ack=1089 Win=65152 Len=17 TSval=3806464026 TSecr=1682204317
1712183857.683358908   446 0.604957991    10.10.1.2 → 10.10.1.1    TCP 83 33516 → 8081 [PSH, ACK] Seq=1089 Ack=1089 Win=64256 Len=17 TSval=1682204318 TSecr=3806464026
1712183859.683358908   448 0.605037495    10.10.1.1 → 10.10.1.2    TCP 83 8081 → 33516 [PSH, ACK] Seq=1089 Ack=1106 Win=65152 Len=17 TSval=3806464027 TSecr=1682204318
1712183864.683358908   453 0.606241855    10.10.1.2 → 10.10.1.1    TCP 83 33516 → 8081 [PSH, ACK] Seq=1106 Ack=1106 Win=64256 Len=17 TSval=1682204319 TSecr=3806464027
1712183866.683358908   455 0.606317851    10.10.1.1 → 10.10.1.2    TCP 83 8081 → 33516 [PSH, ACK] Seq=1106 Ack=1123 Win=65152 Len=17 TSval=3806464029 TSecr=1682204319
1712183870.683358908   459 0.607477038    10.10.1.2 → 10.10.1.1    TCP 83 33516 → 8081 [PSH, ACK] Seq=1123 Ack=1123 Win=64256 Len=17 TSval=1682204321 TSecr=3806464029
1712183872.683358908   461 0.607559354    10.10.1.1 → 10.10.1.2    TCP 83 8081 → 33516 [PSH, ACK] Seq=1123 Ack=1140 Win=65152 Len=17 TSval=3806464030 TSecr=1682204321
1712183877.683358908   466 0.608765854    10.10.1.2 → 10.10.1.1    TCP 83 33516 → 8081 [PSH, ACK] Seq=1140 Ack=1140 Win=64256 Len=17 TSval=1682204322 TSecr=3806464030
1712183879.683358908   468 0.608845831    10.10.1.1 → 10.10.1.2    TCP 83 8081 → 33516 [PSH, ACK] Seq=1140 Ack=1157 Win=65152 Len=17 TSval=3806464031 TSecr=1682204322
1712183883.683358908   472 0.610049916    10.10.1.2 → 10.10.1.1    TCP 83 33516 → 8081 [PSH, ACK] Seq=1157 Ack=1157 Win=64256 Len=17 TSval=1682204323 TSecr=3806464031
1712183885.683358908   474 0.610125462    10.10.1.1 → 10.10.1.2    TCP 83 8081 → 33516 [PSH, ACK] Seq=1157 Ack=1174 Win=65152 Len=17 TSval=3806464032 TSecr=1682204323
1712183890.683358908   479 0.611294273    10.10.1.2 → 10.10.1.1    TCP 83 33516 → 8081 [PSH, ACK] Seq=1174 Ack=1174 Win=64256 Len=17 TSval=1682204324 TSecr=3806464032
1712183891.683358908   480 0.611355981    10.10.1.1 → 10.10.1.2    TCP 83 8081 → 33516 [PSH, ACK] Seq=1174 Ack=1191 Win=65152 Len=17 TSval=3806464034 TSecr=1682204324
1712183896.683358908   485 0.612562183    10.10.1.2 → 10.10.1.1    TCP 83 33516 → 8081 [PSH, ACK] Seq=1191 Ack=1191 Win=64256 Len=17 TSval=1682204326 TSecr=3806464034
1712183898.683358908   487 0.612638954    10.10.1.1 → 10.10.1.2    TCP 83 8081 → 33516 [PSH, ACK] Seq=1191 Ack=1208 Win=65152 Len=17 TSval=3806464035 TSecr=1682204326
1712183903.683358908   492 0.613842765    10.10.1.2 → 10.10.1.1    TCP 83 33516 → 8081 [PSH, ACK] Seq=1208 Ack=1208 Win=64256 Len=17 TSval=1682204327 TSecr=3806464035
1712183905.683358908   494 0.613918543    10.10.1.1 → 10.10.1.2    TCP 83 8081 → 33516 [PSH, ACK] Seq=1208 Ack=1225 Win=65152 Len=17 TSval=3806464036 TSecr=1682204327
1712183909.683358908   498 0.615122082    10.10.1.2 → 10.10.1.1    TCP 83 33516 → 8081 [PSH, ACK] Seq=1225 Ack=1225 Win=64256 Len=17 TSval=1682204328 TSecr=3806464036
1712183911.683358908   500 0.615198377    10.10.1.1 → 10.10.1.2    TCP 83 8081 → 33516 [PSH, ACK] Seq=1225 Ack=1242 Win=65152 Len=17 TSval=3806464037 TSecr=1682204328
1712183916.683358908   505 0.616403421    10.10.1.2 → 10.10.1.1    TCP 83 33516 → 8081 [PSH, ACK] Seq=1242 Ack=1242 Win=64256 Len=17 TSval=1682204329 TSecr=3806464037
1712183918.683358908   507 0.616483193    10.10.1.1 → 10.10.1.2    TCP 83 8081 → 33516 [PSH, ACK] Seq=1242 Ack=1259 Win=65152 Len=17 TSval=3806464039 TSecr=1682204329
1712183922.683358908   511 0.617686455    10.10.1.2 → 10.10.1.1    TCP 83 33516 → 8081 [PSH, ACK] Seq=1259 Ack=1259 Win=64256 Len=17 TSval=1682204331 TSecr=3806464039
1712183924.683358908   513 0.617763100    10.10.1.1 → 10.10.1.2    TCP 83 8081 → 33516 [PSH, ACK] Seq=1259 Ack=1276 Win=65152 Len=17 TSval=3806464040 TSecr=1682204331
1712183929.683358908   518 0.618967421    10.10.1.2 → 10.10.1.1    TCP 83 33516 → 8081 [PSH, ACK] Seq=1276 Ack=1276 Win=64256 Len=17 TSval=1682204332 TSecr=3806464040
1712183931.683358908   520 0.619044169    10.10.1.1 → 10.10.1.2    TCP 83 8081 → 33516 [PSH, ACK] Seq=1276 Ack=1293 Win=65152 Len=17 TSval=3806464041 TSecr=1682204332
1712183935.683358908   524 0.620250366    10.10.1.2 → 10.10.1.1    TCP 83 33516 → 8081 [PSH, ACK] Seq=1293 Ack=1293 Win=64256 Len=17 TSval=1682204333 TSecr=3806464041
1712183937.683358908   526 0.620330903    10.10.1.1 → 10.10.1.2    TCP 83 8081 → 33516 [PSH, ACK] Seq=1293 Ack=1310 Win=65152 Len=17 TSval=3806464043 TSecr=1682204333
1712183942.683358908   531 0.621534989    10.10.1.2 → 10.10.1.1    TCP 83 33516 → 8081 [PSH, ACK] Seq=1310 Ack=1310 Win=64256 Len=17 TSval=1682204335 TSecr=3806464043
1712183944.683358908   533 0.621611224    10.10.1.1 → 10.10.1.2    TCP 83 8081 → 33516 [PSH, ACK] Seq=1310 Ack=1327 Win=65152 Len=17 TSval=3806464044 TSecr=1682204335
1712183948.683358908   537 0.622815535    10.10.1.2 → 10.10.1.1    TCP 83 33516 → 8081 [PSH, ACK] Seq=1327 Ack=1327 Win=64256 Len=17 TSval=1682204336 TSecr=3806464044
1712183950.683358908   539 0.622891437    10.10.1.1 → 10.10.1.2    TCP 83 8081 → 33516 [PSH, ACK] Seq=1327 Ack=1344 Win=65152 Len=17 TSval=3806464045 TSecr=1682204336
1712183955.683358908   544 0.624098631    10.10.1.2 → 10.10.1.1    TCP 83 33516 → 8081 [PSH, ACK] Seq=1344 Ack=1344 Win=64256 Len=17 TSval=1682204337 TSecr=3806464045
1712183957.683358908   546 0.624177321    10.10.1.1 → 10.10.1.2    TCP 83 8081 → 33516 [PSH, ACK] Seq=1344 Ack=1361 Win=65152 Len=17 TSval=3806464046 TSecr=1682204337
1712183961.683358908   550 0.625336895    10.10.1.2 → 10.10.1.1    TCP 83 33516 → 8081 [PSH, ACK] Seq=1361 Ack=1361 Win=64256 Len=17 TSval=1682204338 TSecr=3806464046
1712183962.683358908   551 0.625405839    10.10.1.1 → 10.10.1.2    TCP 83 8081 → 33516 [PSH, ACK] Seq=1361 Ack=1378 Win=65152 Len=17 TSval=3806464048 TSecr=1682204338
1712183967.683358908   556 0.626610067    10.10.1.2 → 10.10.1.1    TCP 83 33516 → 8081 [PSH, ACK] Seq=1378 Ack=1378 Win=64256 Len=17 TSval=1682204340 TSecr=3806464048
1712183969.683358908   558 0.626686371    10.10.1.1 → 10.10.1.2    TCP 83 8081 → 33516 [PSH, ACK] Seq=1378 Ack=1395 Win=65152 Len=17 TSval=3806464049 TSecr=1682204340
1712183974.683358908   563 0.627894821    10.10.1.2 → 10.10.1.1    TCP 83 33516 → 8081 [PSH, ACK] Seq=1395 Ack=1395 Win=64256 Len=17 TSval=1682204341 TSecr=3806464049
1712183976.683358908   565 0.627978908    10.10.1.1 → 10.10.1.2    TCP 83 8081 → 33516 [PSH, ACK] Seq=1395 Ack=1412 Win=65152 Len=17 TSval=3806464050 TSecr=1682204341
1712183980.683358908   569 0.629182904    10.10.1.2 → 10.10.1.1    TCP 83 33516 → 8081 [PSH, ACK] Seq=1412 Ack=1412 Win=64256 Len=17 TSval=1682204342 TSecr=3806464050
1712183982.683358908   571 0.629258649    10.10.1.1 → 10.10.1.2    TCP 83 8081 → 33516 [PSH, ACK] Seq=1412 Ack=1429 Win=65152 Len=17 TSval=3806464051 TSecr=1682204342
1712183987.683358908   576 0.630461514    10.10.1.2 → 10.10.1.1    TCP 83 33516 → 8081 [PSH, ACK] Seq=1429 Ack=1429 Win=64256 Len=17 TSval=1682204344 TSecr=3806464051
1712183989.683358908   578 0.630537004    10.10.1.1 → 10.10.1.2    TCP 83 8081 → 33516 [PSH, ACK] Seq=1429 Ack=1446 Win=65152 Len=17 TSval=3806464053 TSecr=1682204344
1712183993.683358908   582 0.631706911    10.10.1.2 → 10.10.1.1    TCP 83 33516 → 8081 [PSH, ACK] Seq=1446 Ack=1446 Win=64256 Len=17 TSval=1682204345 TSecr=3806464053
1712183995.683358908   584 0.631789618    10.10.1.1 → 10.10.1.2    TCP 83 8081 → 33516 [PSH, ACK] Seq=1446 Ack=1463 Win=65152 Len=17 TSval=3806464054 TSecr=1682204345
1712183999.683358908   588 0.632995251    10.10.1.2 → 10.10.1.1    TCP 83 33516 → 8081 [PSH, ACK] Seq=1463 Ack=1463 Win=64256 Len=17 TSval=1682204346 TSecr=3806464054
1712184001.683358908   590 0.633071511    10.10.1.1 → 10.10.1.2    TCP 83 8081 → 33516 [PSH, ACK] Seq=1463 Ack=1480 Win=65152 Len=17 TSval=3806464055 TSecr=1682204346
1712184006.683358908   595 0.634276953    10.10.1.2 → 10.10.1.1    TCP 83 33516 → 8081 [PSH, ACK] Seq=1480 Ack=1480 Win=64256 Len=17 TSval=1682204347 TSecr=3806464055
1712184008.683358908   597 0.634353440    10.10.1.1 → 10.10.1.2    TCP 83 8081 → 33516 [PSH, ACK] Seq=1480 Ack=1497 Win=65152 Len=17 TSval=3806464057 TSecr=1682204347
1712184012.683358908   601 0.635520826    10.10.1.2 → 10.10.1.1    TCP 83 33516 → 8081 [PSH, ACK] Seq=1497 Ack=1497 Win=64256 Len=17 TSval=1682204349 TSecr=3806464057
1712184014.683358908   603 0.635600010    10.10.1.1 → 10.10.1.2    TCP 83 8081 → 33516 [PSH, ACK] Seq=1497 Ack=1514 Win=65152 Len=17 TSval=3806464058 TSecr=1682204349
1712184019.683358908   608 0.636805296    10.10.1.2 → 10.10.1.1    TCP 83 33516 → 8081 [PSH, ACK] Seq=1514 Ack=1514 Win=64256 Len=17 TSval=1682204350 TSecr=3806464058
1712184021.683358908   610 0.636881858    10.10.1.1 → 10.10.1.2    TCP 83 8081 → 33516 [PSH, ACK] Seq=1514 Ack=1531 Win=65152 Len=17 TSval=3806464059 TSecr=1682204350
1712184025.683358908   614 0.638086981    10.10.1.2 → 10.10.1.1    TCP 83 33516 → 8081 [PSH, ACK] Seq=1531 Ack=1531 Win=64256 Len=17 TSval=1682204351 TSecr=3806464059
1712184027.683358908   616 0.638163038    10.10.1.1 → 10.10.1.2    TCP 83 8081 → 33516 [PSH, ACK] Seq=1531 Ack=1548 Win=65152 Len=17 TSval=3806464060 TSecr=1682204351
1712184032.683358908   621 0.639370260    10.10.1.2 → 10.10.1.1    TCP 83 33516 → 8081 [PSH, ACK] Seq=1548 Ack=1548 Win=64256 Len=17 TSval=1682204352 TSecr=3806464060
1712184034.683358908   623 0.639454745    10.10.1.1 → 10.10.1.2    TCP 83 8081 → 33516 [PSH, ACK] Seq=1548 Ack=1565 Win=65152 Len=17 TSval=3806464062 TSecr=1682204352
1712184038.683358908   627 0.640662400    10.10.1.2 → 10.10.1.1    TCP 83 33516 → 8081 [PSH, ACK] Seq=1565 Ack=1565 Win=64256 Len=17 TSval=1682204354 TSecr=3806464062
1712184040.683358908   629 0.640738530    10.10.1.1 → 10.10.1.2    TCP 83 8081 → 33516 [PSH, ACK] Seq=1565 Ack=1582 Win=65152 Len=17 TSval=3806464063 TSecr=1682204354
1712184045.683358908   634 0.641943591    10.10.1.2 → 10.10.1.1    TCP 83 33516 → 8081 [PSH, ACK] Seq=1582 Ack=1582 Win=64256 Len=17 TSval=1682204355 TSecr=3806464063
1712184047.683358908   636 0.642019417    10.10.1.1 → 10.10.1.2    TCP 83 8081 → 33516 [PSH, ACK] Seq=1582 Ack=1599 Win=65152 Len=17 TSval=3806464064 TSecr=1682204355
1712184051.683358908   640 0.643226047    10.10.1.2 → 10.10.1.1    TCP 83 33516 → 8081 [PSH, ACK] Seq=1599 Ack=1599 Win=64256 Len=17 TSval=1682204356 TSecr=3806464064
1712184053.683358908   642 0.643322483    10.10.1.1 → 10.10.1.2    TCP 83 8081 → 33516 [PSH, ACK] Seq=1599 Ack=1616 Win=65152 Len=17 TSval=3806464066 TSecr=1682204356
1712184058.683358908   647 0.644530006    10.10.1.2 → 10.10.1.1    TCP 83 33516 → 8081 [PSH, ACK] Seq=1616 Ack=1616 Win=64256 Len=17 TSval=1682204358 TSecr=3806464066
1712184060.683358908   649 0.644609843    10.10.1.1 → 10.10.1.2    TCP 83 8081 → 33516 [PSH, ACK] Seq=1616 Ack=1633 Win=65152 Len=17 TSval=3806464067 TSecr=1682204358
1712184064.683358908   653 0.645814303    10.10.1.2 → 10.10.1.1    TCP 83 33516 → 8081 [PSH, ACK] Seq=1633 Ack=1633 Win=64256 Len=17 TSval=1682204359 TSecr=3806464067
1712184066.683358908   655 0.645890784    10.10.1.1 → 10.10.1.2    TCP 83 8081 → 33516 [PSH, ACK] Seq=1633 Ack=1650 Win=65152 Len=17 TSval=3806464068 TSecr=1682204359
1712184071.683358908   660 0.647093905    10.10.1.2 → 10.10.1.1    TCP 83 33516 → 8081 [PSH, ACK] Seq=1650 Ack=1650 Win=64256 Len=17 TSval=1682204360 TSecr=3806464068
1712184073.683358908   662 0.647169420    10.10.1.1 → 10.10.1.2    TCP 83 8081 → 33516 [PSH, ACK] Seq=1650 Ack=1667 Win=65152 Len=17 TSval=3806464069 TSecr=1682204360
1712184077.683358908   666 0.648328075    10.10.1.2 → 10.10.1.1    TCP 83 33516 → 8081 [PSH, ACK] Seq=1667 Ack=1667 Win=64256 Len=17 TSval=1682204361 TSecr=3806464069
1712184079.683358908   668 0.648413166    10.10.1.1 → 10.10.1.2    TCP 83 8081 → 33516 [PSH, ACK] Seq=1667 Ack=1684 Win=65152 Len=17 TSval=3806464071 TSecr=1682204361
1712184083.683358908   672 0.649608744    10.10.1.2 → 10.10.1.1    TCP 83 33516 → 8081 [PSH, ACK] Seq=1684 Ack=1684 Win=64256 Len=17 TSval=1682204363 TSecr=3806464071
1712184085.683358908   674 0.649663457    10.10.1.1 → 10.10.1.2    TCP 83 8081 → 33516 [PSH, ACK] Seq=1684 Ack=1701 Win=65152 Len=17 TSval=3806464072 TSecr=1682204363
1712184089.683358908   678 0.650855153    10.10.1.2 → 10.10.1.1    TCP 83 33516 → 8081 [PSH, ACK] Seq=1701 Ack=1701 Win=64256 Len=17 TSval=1682204364 TSecr=3806464072
1712184091.683358908   680 0.650901930    10.10.1.1 → 10.10.1.2    TCP 83 8081 → 33516 [PSH, ACK] Seq=1701 Ack=1718 Win=65152 Len=17 TSval=3806464073 TSecr=1682204364
1712184095.683358908   684 0.652058313    10.10.1.2 → 10.10.1.1    TCP 83 33516 → 8081 [PSH, ACK] Seq=1718 Ack=1718 Win=64256 Len=17 TSval=1682204365 TSecr=3806464073
1712184096.683358908   685 0.652102620    10.10.1.1 → 10.10.1.2    TCP 83 8081 → 33516 [PSH, ACK] Seq=1718 Ack=1735 Win=65152 Len=17 TSval=3806464074 TSecr=1682204365
1712184101.683358908   690 0.653305163    10.10.1.2 → 10.10.1.1    TCP 83 33516 → 8081 [PSH, ACK] Seq=1735 Ack=1735 Win=64256 Len=17 TSval=1682204366 TSecr=3806464074
1712184104.683358908   693 0.653381070    10.10.1.1 → 10.10.1.2    TCP 83 8081 → 33516 [PSH, ACK] Seq=1735 Ack=1752 Win=65152 Len=17 TSval=3806464076 TSecr=1682204366
1712184108.683358908   697 0.654583302    10.10.1.2 → 10.10.1.1    TCP 83 33516 → 8081 [PSH, ACK] Seq=1752 Ack=1752 Win=64256 Len=17 TSval=1682204368 TSecr=3806464076
1712184110.683358908   699 0.654659303    10.10.1.1 → 10.10.1.2    TCP 83 8081 → 33516 [PSH, ACK] Seq=1752 Ack=1769 Win=65152 Len=17 TSval=3806464077 TSecr=1682204368
1712184114.683358908   703 0.655883291    10.10.1.2 → 10.10.1.1    TCP 83 33516 → 8081 [PSH, ACK] Seq=1769 Ack=1769 Win=64256 Len=17 TSval=1682204369 TSecr=3806464077
1712184116.683358908   705 0.655965531    10.10.1.1 → 10.10.1.2    TCP 83 8081 → 33516 [PSH, ACK] Seq=1769 Ack=1786 Win=65152 Len=17 TSval=3806464078 TSecr=1682204369
1712184121.683358908   710 0.657169833    10.10.1.2 → 10.10.1.1    TCP 83 33516 → 8081 [PSH, ACK] Seq=1786 Ack=1786 Win=64256 Len=17 TSval=1682204370 TSecr=3806464078
1712184123.683358908   712 0.657249886    10.10.1.1 → 10.10.1.2    TCP 83 8081 → 33516 [PSH, ACK] Seq=1786 Ack=1803 Win=65152 Len=17 TSval=3806464079 TSecr=1682204370
1712184127.683358908   716 0.658393551    10.10.1.2 → 10.10.1.1    TCP 83 33516 → 8081 [PSH, ACK] Seq=1803 Ack=1803 Win=64256 Len=17 TSval=1682204372 TSecr=3806464079
1712184128.683358908   717 0.658457919    10.10.1.1 → 10.10.1.2    TCP 83 8081 → 33516 [PSH, ACK] Seq=1803 Ack=1820 Win=65152 Len=17 TSval=3806464081 TSecr=1682204372
1712184133.683358908   722 0.659612629    10.10.1.2 → 10.10.1.1    TCP 83 33516 → 8081 [PSH, ACK] Seq=1820 Ack=1820 Win=64256 Len=17 TSval=1682204373 TSecr=3806464081
1712184134.683358908   723 0.659635539    10.10.1.1 → 10.10.1.2    TCP 83 8081 → 33516 [PSH, ACK] Seq=1820 Ack=1837 Win=65152 Len=17 TSval=3806464082 TSecr=1682204373
1712184140.683358908   729 0.660830355    10.10.1.2 → 10.10.1.1    TCP 83 33516 → 8081 [PSH, ACK] Seq=1837 Ack=1837 Win=64256 Len=17 TSval=1682204374 TSecr=3806464082
1712184142.683358908   731 0.660879602    10.10.1.1 → 10.10.1.2    TCP 83 8081 → 33516 [PSH, ACK] Seq=1837 Ack=1854 Win=65152 Len=17 TSval=3806464083 TSecr=1682204374
1712184146.683358908   735 0.662068231    10.10.1.2 → 10.10.1.1    TCP 83 33516 → 8081 [PSH, ACK] Seq=1854 Ack=1854 Win=64256 Len=17 TSval=1682204375 TSecr=3806464083
1712184148.683358908   737 0.662115144    10.10.1.1 → 10.10.1.2    TCP 83 8081 → 33516 [PSH, ACK] Seq=1854 Ack=1871 Win=65152 Len=17 TSval=3806464084 TSecr=1682204375
1712184152.683358908   741 0.663311529    10.10.1.2 → 10.10.1.1    TCP 83 33516 → 8081 [PSH, ACK] Seq=1871 Ack=1871 Win=64256 Len=17 TSval=1682204376 TSecr=3806464084
1712184154.683358908   743 0.663360588    10.10.1.1 → 10.10.1.2    TCP 83 8081 → 33516 [PSH, ACK] Seq=1871 Ack=1888 Win=65152 Len=17 TSval=3806464086 TSecr=1682204376
1712184158.683358908   747 0.664567371    10.10.1.2 → 10.10.1.1    TCP 83 33516 → 8081 [PSH, ACK] Seq=1888 Ack=1888 Win=64256 Len=17 TSval=1682204378 TSecr=3806464086
1712184160.683358908   749 0.664634822    10.10.1.1 → 10.10.1.2    TCP 83 8081 → 33516 [PSH, ACK] Seq=1888 Ack=1905 Win=65152 Len=17 TSval=3806464087 TSecr=1682204378
1712184165.683358908   754 0.665836632    10.10.1.2 → 10.10.1.1    TCP 83 33516 → 8081 [PSH, ACK] Seq=1905 Ack=1905 Win=64256 Len=17 TSval=1682204379 TSecr=3806464087
1712184167.683358908   756 0.665912467    10.10.1.1 → 10.10.1.2    TCP 83 8081 → 33516 [PSH, ACK] Seq=1905 Ack=1922 Win=65152 Len=17 TSval=3806464088 TSecr=1682204379
1712184171.683358908   760 0.667117332    10.10.1.2 → 10.10.1.1    TCP 83 33516 → 8081 [PSH, ACK] Seq=1922 Ack=1922 Win=64256 Len=17 TSval=1682204380 TSecr=3806464088
1712184173.683358908   762 0.667248798    10.10.1.1 → 10.10.1.2    TCP 83 8081 → 33516 [PSH, ACK] Seq=1922 Ack=1939 Win=65152 Len=17 TSval=3806464089 TSecr=1682204380
1712184178.683358908   767 0.668456711    10.10.1.2 → 10.10.1.1    TCP 83 33516 → 8081 [PSH, ACK] Seq=1939 Ack=1939 Win=64256 Len=17 TSval=1682204382 TSecr=3806464089
1712184180.683358908   769 0.668536590    10.10.1.1 → 10.10.1.2    TCP 83 8081 → 33516 [PSH, ACK] Seq=1939 Ack=1956 Win=65152 Len=17 TSval=3806464091 TSecr=1682204382
1712184184.683358908   773 0.669740376    10.10.1.2 → 10.10.1.1    TCP 83 33516 → 8081 [PSH, ACK] Seq=1956 Ack=1956 Win=64256 Len=17 TSval=1682204383 TSecr=3806464091
1712184186.683358908   775 0.669816710    10.10.1.1 → 10.10.1.2    TCP 83 8081 → 33516 [PSH, ACK] Seq=1956 Ack=1973 Win=65152 Len=17 TSval=3806464092 TSecr=1682204383
1712184191.683358908   780 0.671020287    10.10.1.2 → 10.10.1.1    TCP 83 33516 → 8081 [PSH, ACK] Seq=1973 Ack=1973 Win=64256 Len=17 TSval=1682204384 TSecr=3806464092
1712184193.683358908   782 0.671096305    10.10.1.1 → 10.10.1.2    TCP 83 8081 → 33516 [PSH, ACK] Seq=1973 Ack=1990 Win=65152 Len=17 TSval=3806464093 TSecr=1682204384
1712184197.683358908   786 0.672304444    10.10.1.2 → 10.10.1.1    TCP 83 33516 → 8081 [PSH, ACK] Seq=1990 Ack=1990 Win=64256 Len=17 TSval=1682204385 TSecr=3806464093
1712184199.683358908   788 0.672384263    10.10.1.1 → 10.10.1.2    TCP 83 8081 → 33516 [PSH, ACK] Seq=1990 Ack=2007 Win=65152 Len=17 TSval=3806464095 TSecr=1682204385
