1712182994.383616447    34 0.530509122    10.10.1.2 → 10.10.1.1    TCP 83 50820 → 8081 [PSH, ACK] Seq=1 Ack=1 Win=64256 Len=17 TSval=1681753687 TSecr=3806013146
1712182998.383616447    38 0.530811834    10.10.1.1 → 10.10.1.2    TCP 83 8081 → 50820 [PSH, ACK] Seq=1 Ack=18 Win=65152 Len=17 TSval=3806013397 TSecr=1681753687
1712183006.383616447    46 0.532049222    10.10.1.2 → 10.10.1.1    TCP 83 50820 → 8081 [PSH, ACK] Seq=18 Ack=18 Win=64256 Len=17 TSval=1681753689 TSecr=3806013397
1712183009.383616447    49 0.532173286    10.10.1.1 → 10.10.1.2    TCP 83 8081 → 50820 [PSH, ACK] Seq=18 Ack=35 Win=65152 Len=17 TSval=3806013398 TSecr=1681753689
1712183016.383616447    56 0.533390262    10.10.1.2 → 10.10.1.1    TCP 83 50820 → 8081 [PSH, ACK] Seq=35 Ack=35 Win=64256 Len=17 TSval=1681753690 TSecr=3806013398
1712183019.383616447    59 0.533519909    10.10.1.1 → 10.10.1.2    TCP 83 8081 → 50820 [PSH, ACK] Seq=35 Ack=52 Win=65152 Len=17 TSval=3806013399 TSecr=1681753690
1712183026.383616447    66 0.534731187    10.10.1.2 → 10.10.1.1    TCP 83 50820 → 8081 [PSH, ACK] Seq=52 Ack=52 Win=64256 Len=17 TSval=1681753691 TSecr=3806013399
1712183029.383616447    69 0.534858937    10.10.1.1 → 10.10.1.2    TCP 83 8081 → 50820 [PSH, ACK] Seq=52 Ack=69 Win=65152 Len=17 TSval=3806013401 TSecr=1681753691
1712183036.383616447    76 0.536078279    10.10.1.2 → 10.10.1.1    TCP 83 50820 → 8081 [PSH, ACK] Seq=69 Ack=69 Win=64256 Len=17 TSval=1681753693 TSecr=3806013401
1712183039.383616447    79 0.536211055    10.10.1.1 → 10.10.1.2    TCP 83 8081 → 50820 [PSH, ACK] Seq=69 Ack=86 Win=65152 Len=17 TSval=3806013402 TSecr=1681753693
1712183046.383616447    86 0.537422521    10.10.1.2 → 10.10.1.1    TCP 83 50820 → 8081 [PSH, ACK] Seq=86 Ack=86 Win=64256 Len=17 TSval=1681753694 TSecr=3806013402
1712183048.383616447    88 0.537549778    10.10.1.1 → 10.10.1.2    TCP 83 8081 → 50820 [PSH, ACK] Seq=86 Ack=103 Win=65152 Len=17 TSval=3806013403 TSecr=1681753694
1712183056.383616447    96 0.538760982    10.10.1.2 → 10.10.1.1    TCP 83 50820 → 8081 [PSH, ACK] Seq=103 Ack=103 Win=64256 Len=17 TSval=1681753695 TSecr=3806013403
1712183058.383616447    98 0.538884674    10.10.1.1 → 10.10.1.2    TCP 83 8081 → 50820 [PSH, ACK] Seq=103 Ack=120 Win=65152 Len=17 TSval=3806013405 TSecr=1681753695
1712183066.383616447   106 0.540099992    10.10.1.2 → 10.10.1.1    TCP 83 50820 → 8081 [PSH, ACK] Seq=120 Ack=120 Win=64256 Len=17 TSval=1681753697 TSecr=3806013405
1712183068.383616447   108 0.540182296    10.10.1.1 → 10.10.1.2    TCP 83 8081 → 50820 [PSH, ACK] Seq=120 Ack=137 Win=65152 Len=17 TSval=3806013406 TSecr=1681753697
1712183076.383616447   116 0.541392646    10.10.1.2 → 10.10.1.1    TCP 83 50820 → 8081 [PSH, ACK] Seq=137 Ack=137 Win=64256 Len=17 TSval=1681753698 TSecr=3806013406
1712183078.383616447   118 0.541519744    10.10.1.1 → 10.10.1.2    TCP 83 8081 → 50820 [PSH, ACK] Seq=137 Ack=154 Win=65152 Len=17 TSval=3806013407 TSecr=1681753698
1712183086.383616447   126 0.542730524    10.10.1.2 → 10.10.1.1    TCP 83 50820 → 8081 [PSH, ACK] Seq=154 Ack=154 Win=64256 Len=17 TSval=1681753699 TSecr=3806013407
1712183088.383616447   128 0.542857637    10.10.1.1 → 10.10.1.2    TCP 83 8081 → 50820 [PSH, ACK] Seq=154 Ack=171 Win=65152 Len=17 TSval=3806013409 TSecr=1681753699
1712183096.383616447   136 0.544073467    10.10.1.2 → 10.10.1.1    TCP 83 50820 → 8081 [PSH, ACK] Seq=171 Ack=171 Win=64256 Len=17 TSval=1681753701 TSecr=3806013409
1712183099.383616447   139 0.544203908    10.10.1.1 → 10.10.1.2    TCP 83 8081 → 50820 [PSH, ACK] Seq=171 Ack=188 Win=65152 Len=17 TSval=3806013410 TSecr=1681753701
1712183106.383616447   146 0.545414805    10.10.1.2 → 10.10.1.1    TCP 83 50820 → 8081 [PSH, ACK] Seq=188 Ack=188 Win=64256 Len=17 TSval=1681753702 TSecr=3806013410
1712183108.383616447   148 0.545541246    10.10.1.1 → 10.10.1.2    TCP 83 8081 → 50820 [PSH, ACK] Seq=188 Ack=205 Win=65152 Len=17 TSval=3806013411 TSecr=1681753702
1712183116.383616447   156 0.546751898    10.10.1.2 → 10.10.1.1    TCP 83 50820 → 8081 [PSH, ACK] Seq=205 Ack=205 Win=64256 Len=17 TSval=1681753703 TSecr=3806013411
1712183118.383616447   158 0.546878282    10.10.1.1 → 10.10.1.2    TCP 83 8081 → 50820 [PSH, ACK] Seq=205 Ack=222 Win=65152 Len=17 TSval=3806013413 TSecr=1681753703
1712183126.383616447   166 0.548097635    10.10.1.2 → 10.10.1.1    TCP 83 50820 → 8081 [PSH, ACK] Seq=222 Ack=222 Win=64256 Len=17 TSval=1681753705 TSecr=3806013413
1712183129.383616447   169 0.548227625    10.10.1.1 → 10.10.1.2    TCP 83 8081 → 50820 [PSH, ACK] Seq=222 Ack=239 Win=65152 Len=17 TSval=3806013414 TSecr=1681753705
1712183136.383616447   176 0.549439561    10.10.1.2 → 10.10.1.1    TCP 83 50820 → 8081 [PSH, ACK] Seq=239 Ack=239 Win=64256 Len=17 TSval=1681753706 TSecr=3806013414
1712183138.383616447   178 0.549565351    10.10.1.1 → 10.10.1.2    TCP 83 8081 → 50820 [PSH, ACK] Seq=239 Ack=256 Win=65152 Len=17 TSval=3806013415 TSecr=1681753706
1712183146.383616447   186 0.550777034    10.10.1.2 → 10.10.1.1    TCP 83 50820 → 8081 [PSH, ACK] Seq=256 Ack=256 Win=64256 Len=17 TSval=1681753707 TSecr=3806013415
1712183148.383616447   188 0.550899609    10.10.1.1 → 10.10.1.2    TCP 83 8081 → 50820 [PSH, ACK] Seq=256 Ack=273 Win=65152 Len=17 TSval=3806013417 TSecr=1681753707
1712183156.383616447   196 0.552116401    10.10.1.2 → 10.10.1.1    TCP 83 50820 → 8081 [PSH, ACK] Seq=273 Ack=273 Win=64256 Len=17 TSval=1681753709 TSecr=3806013417
1712183159.383616447   199 0.552201966    10.10.1.1 → 10.10.1.2    TCP 83 8081 → 50820 [PSH, ACK] Seq=273 Ack=290 Win=65152 Len=17 TSval=3806013418 TSecr=1681753709
1712183166.383616447   206 0.553413788    10.10.1.2 → 10.10.1.1    TCP 83 50820 → 8081 [PSH, ACK] Seq=290 Ack=290 Win=64256 Len=17 TSval=1681753710 TSecr=3806013418
1712183168.383616447   208 0.553539603    10.10.1.1 → 10.10.1.2    TCP 83 8081 → 50820 [PSH, ACK] Seq=290 Ack=307 Win=65152 Len=17 TSval=3806013419 TSecr=1681753710
1712183176.383616447   216 0.554750169    10.10.1.2 → 10.10.1.1    TCP 83 50820 → 8081 [PSH, ACK] Seq=307 Ack=307 Win=64256 Len=17 TSval=1681753711 TSecr=3806013419
1712183178.383616447   218 0.554876626    10.10.1.1 → 10.10.1.2    TCP 83 8081 → 50820 [PSH, ACK] Seq=307 Ack=324 Win=65152 Len=17 TSval=3806013421 TSecr=1681753711
1712183186.383616447   226 0.556092663    10.10.1.2 → 10.10.1.1    TCP 83 50820 → 8081 [PSH, ACK] Seq=324 Ack=324 Win=64256 Len=17 TSval=1681753713 TSecr=3806013421
1712183188.383616447   228 0.556177642    10.10.1.1 → 10.10.1.2    TCP 83 8081 → 50820 [PSH, ACK] Seq=324 Ack=341 Win=65152 Len=17 TSval=3806013422 TSecr=1681753713
1712183196.383616447   236 0.557388104    10.10.1.2 → 10.10.1.1    TCP 83 50820 → 8081 [PSH, ACK] Seq=341 Ack=341 Win=64256 Len=17 TSval=1681753714 TSecr=3806013422
1712183198.383616447   238 0.557514847    10.10.1.1 → 10.10.1.2    TCP 83 8081 → 50820 [PSH, ACK] Seq=341 Ack=358 Win=65152 Len=17 TSval=3806013423 TSecr=1681753714
1712183206.383616447   246 0.558724954    10.10.1.2 → 10.10.1.1    TCP 83 50820 → 8081 [PSH, ACK] Seq=358 Ack=358 Win=64256 Len=17 TSval=1681753715 TSecr=3806013423
1712183208.383616447   248 0.558850884    10.10.1.1 → 10.10.1.2    TCP 83 8081 → 50820 [PSH, ACK] Seq=358 Ack=375 Win=65152 Len=17 TSval=3806013425 TSecr=1681753715
1712183216.383616447   256 0.560065133    10.10.1.2 → 10.10.1.1    TCP 83 50820 → 8081 [PSH, ACK] Seq=375 Ack=375 Win=64256 Len=17 TSval=1681753717 TSecr=3806013425
1712183218.383616447   258 0.560149328    10.10.1.1 → 10.10.1.2    TCP 83 8081 → 50820 [PSH, ACK] Seq=375 Ack=392 Win=65152 Len=17 TSval=3806013426 TSecr=1681753717
1712183226.383616447   266 0.561359440    10.10.1.2 → 10.10.1.1    TCP 83 50820 → 8081 [PSH, ACK] Seq=392 Ack=392 Win=64256 Len=17 TSval=1681753718 TSecr=3806013426
1712183228.383616447   268 0.561485702    10.10.1.1 → 10.10.1.2    TCP 83 8081 → 50820 [PSH, ACK] Seq=392 Ack=409 Win=65152 Len=17 TSval=3806013427 TSecr=1681753718
1712183236.383616447   276 0.562697392    10.10.1.2 → 10.10.1.1    TCP 83 50820 → 8081 [PSH, ACK] Seq=409 Ack=409 Win=64256 Len=17 TSval=1681753719 TSecr=3806013427
1712183238.383616447   278 0.562823310    10.10.1.1 → 10.10.1.2    TCP 83 8081 → 50820 [PSH, ACK] Seq=409 Ack=426 Win=65152 Len=17 TSval=3806013429 TSecr=1681753719
1712183246.383616447   286 0.564040276    10.10.1.2 → 10.10.1.1    TCP 83 50820 → 8081 [PSH, ACK] Seq=426 Ack=426 Win=64256 Len=17 TSval=1681753721 TSecr=3806013429
1712183249.383616447   289 0.564170681    10.10.1.1 → 10.10.1.2    TCP 83 8081 → 50820 [PSH, ACK] Seq=426 Ack=443 Win=65152 Len=17 TSval=3806013430 TSecr=1681753721
1712183256.383616447   296 0.565383252    10.10.1.2 → 10.10.1.1    TCP 83 50820 → 8081 [PSH, ACK] Seq=443 Ack=443 Win=64256 Len=17 TSval=1681753722 TSecr=3806013430
1712183258.383616447   298 0.565504384    10.10.1.1 → 10.10.1.2    TCP 83 8081 → 50820 [PSH, ACK] Seq=443 Ack=460 Win=65152 Len=17 TSval=3806013431 TSecr=1681753722
1712183266.383616447   306 0.566715281    10.10.1.2 → 10.10.1.1    TCP 83 50820 → 8081 [PSH, ACK] Seq=460 Ack=460 Win=64256 Len=17 TSval=1681753723 TSecr=3806013431
1712183268.383616447   308 0.566837700    10.10.1.1 → 10.10.1.2    TCP 83 8081 → 50820 [PSH, ACK] Seq=460 Ack=477 Win=65152 Len=17 TSval=3806013433 TSecr=1681753723
1712183276.383616447   316 0.568052538    10.10.1.2 → 10.10.1.1    TCP 83 50820 → 8081 [PSH, ACK] Seq=477 Ack=477 Win=64256 Len=17 TSval=1681753725 TSecr=3806013433
1712183278.383616447   318 0.568138428    10.10.1.1 → 10.10.1.2    TCP 83 8081 → 50820 [PSH, ACK] Seq=477 Ack=494 Win=65152 Len=17 TSval=3806013434 TSecr=1681753725
1712183286.383616447   326 0.569350613    10.10.1.2 → 10.10.1.1    TCP 83 50820 → 8081 [PSH, ACK] Seq=494 Ack=494 Win=64256 Len=17 TSval=1681753726 TSecr=3806013434
1712183288.383616447   328 0.569476672    10.10.1.1 → 10.10.1.2    TCP 83 8081 → 50820 [PSH, ACK] Seq=494 Ack=511 Win=65152 Len=17 TSval=3806013435 TSecr=1681753726
1712183296.383616447   336 0.570687447    10.10.1.2 → 10.10.1.1    TCP 83 50820 → 8081 [PSH, ACK] Seq=511 Ack=511 Win=64256 Len=17 TSval=1681753727 TSecr=3806013435
1712183298.383616447   338 0.570813270    10.10.1.1 → 10.10.1.2    TCP 83 8081 → 50820 [PSH, ACK] Seq=511 Ack=528 Win=65152 Len=17 TSval=3806013437 TSecr=1681753727
1712183306.383616447   346 0.572028522    10.10.1.2 → 10.10.1.1    TCP 83 50820 → 8081 [PSH, ACK] Seq=528 Ack=528 Win=64256 Len=17 TSval=1681753729 TSecr=3806013437
1712183308.383616447   348 0.572114141    10.10.1.1 → 10.10.1.2    TCP 83 8081 → 50820 [PSH, ACK] Seq=528 Ack=545 Win=65152 Len=17 TSval=3806013438 TSecr=1681753729
1712183316.383616447   356 0.573326975    10.10.1.2 → 10.10.1.1    TCP 83 50820 → 8081 [PSH, ACK] Seq=545 Ack=545 Win=64256 Len=17 TSval=1681753730 TSecr=3806013438
1712183318.383616447   358 0.573453291    10.10.1.1 → 10.10.1.2    TCP 83 8081 → 50820 [PSH, ACK] Seq=545 Ack=562 Win=65152 Len=17 TSval=3806013439 TSecr=1681753730
1712183326.383616447   366 0.574664659    10.10.1.2 → 10.10.1.1    TCP 83 50820 → 8081 [PSH, ACK] Seq=562 Ack=562 Win=64256 Len=17 TSval=1681753731 TSecr=3806013439
1712183328.383616447   368 0.574790931    10.10.1.1 → 10.10.1.2    TCP 83 8081 → 50820 [PSH, ACK] Seq=562 Ack=579 Win=65152 Len=17 TSval=3806013441 TSecr=1681753731
1712183336.383616447   376 0.576002619    10.10.1.2 → 10.10.1.1    TCP 83 50820 → 8081 [PSH, ACK] Seq=579 Ack=579 Win=64256 Len=17 TSval=1681753733 TSecr=3806013441
1712183338.383616447   378 0.576088366    10.10.1.1 → 10.10.1.2    TCP 83 8081 → 50820 [PSH, ACK] Seq=579 Ack=596 Win=65152 Len=17 TSval=3806013442 TSecr=1681753733
1712183346.383616447   386 0.577300670    10.10.1.2 → 10.10.1.1    TCP 83 50820 → 8081 [PSH, ACK] Seq=596 Ack=596 Win=64256 Len=17 TSval=1681753734 TSecr=3806013442
1712183348.383616447   388 0.577425752    10.10.1.1 → 10.10.1.2    TCP 83 8081 → 50820 [PSH, ACK] Seq=596 Ack=613 Win=65152 Len=17 TSval=3806013443 TSecr=1681753734
1712183356.383616447   396 0.578636764    10.10.1.2 → 10.10.1.1    TCP 83 50820 → 8081 [PSH, ACK] Seq=613 Ack=613 Win=64256 Len=17 TSval=1681753735 TSecr=3806013443
1712183358.383616447   398 0.578762386    10.10.1.1 → 10.10.1.2    TCP 83 8081 → 50820 [PSH, ACK] Seq=613 Ack=630 Win=65152 Len=17 TSval=3806013445 TSecr=1681753735
1712183366.383616447   406 0.579931295    10.10.1.2 → 10.10.1.1    TCP 83 50820 → 8081 [PSH, ACK] Seq=630 Ack=630 Win=64256 Len=17 TSval=1681753737 TSecr=3806013445
1712183368.383616447   408 0.580064679    10.10.1.1 → 10.10.1.2    TCP 83 8081 → 50820 [PSH, ACK] Seq=630 Ack=647 Win=65152 Len=17 TSval=3806013446 TSecr=1681753737
1712183376.383616447   416 0.581276653    10.10.1.2 → 10.10.1.1    TCP 83 50820 → 8081 [PSH, ACK] Seq=647 Ack=647 Win=64256 Len=17 TSval=1681753738 TSecr=3806013446
1712183378.383616447   418 0.581398456    10.10.1.1 → 10.10.1.2    TCP 83 8081 → 50820 [PSH, ACK] Seq=647 Ack=664 Win=65152 Len=17 TSval=3806013447 TSecr=1681753738
1712183386.383616447   426 0.582609132    10.10.1.2 → 10.10.1.1    TCP 83 50820 → 8081 [PSH, ACK] Seq=664 Ack=664 Win=64256 Len=17 TSval=1681753739 TSecr=3806013447
1712183388.383616447   428 0.582731163    10.10.1.1 → 10.10.1.2    TCP 83 8081 → 50820 [PSH, ACK] Seq=664 Ack=681 Win=65152 Len=17 TSval=3806013449 TSecr=1681753739
1712183396.383616447   436 0.583941774    10.10.1.2 → 10.10.1.1    TCP 83 50820 → 8081 [PSH, ACK] Seq=681 Ack=681 Win=64256 Len=17 TSval=1681753741 TSecr=3806013449
1712183398.383616447   438 0.584026121    10.10.1.1 → 10.10.1.2    TCP 83 8081 → 50820 [PSH, ACK] Seq=681 Ack=698 Win=65152 Len=17 TSval=3806013450 TSecr=1681753741
1712183406.383616447   446 0.585239520    10.10.1.2 → 10.10.1.1    TCP 83 50820 → 8081 [PSH, ACK] Seq=698 Ack=698 Win=64256 Len=17 TSval=1681753742 TSecr=3806013450
1712183408.383616447   448 0.585365728    10.10.1.1 → 10.10.1.2    TCP 83 8081 → 50820 [PSH, ACK] Seq=698 Ack=715 Win=65152 Len=17 TSval=3806013451 TSecr=1681753742
1712183416.383616447   456 0.586575578    10.10.1.2 → 10.10.1.1    TCP 83 50820 → 8081 [PSH, ACK] Seq=715 Ack=715 Win=64256 Len=17 TSval=1681753743 TSecr=3806013451
1712183418.383616447   458 0.586701775    10.10.1.1 → 10.10.1.2    TCP 83 8081 → 50820 [PSH, ACK] Seq=715 Ack=732 Win=65152 Len=17 TSval=3806013453 TSecr=1681753743
1712183426.383616447   466 0.587830344    10.10.1.2 → 10.10.1.1    TCP 83 50820 → 8081 [PSH, ACK] Seq=732 Ack=732 Win=64256 Len=17 TSval=1681753744 TSecr=3806013453
1712183428.383616447   468 0.587916319    10.10.1.1 → 10.10.1.2    TCP 83 8081 → 50820 [PSH, ACK] Seq=732 Ack=749 Win=65152 Len=17 TSval=3806013454 TSecr=1681753744
1712183436.383616447   476 0.589078639    10.10.1.2 → 10.10.1.1    TCP 83 50820 → 8081 [PSH, ACK] Seq=749 Ack=749 Win=64256 Len=17 TSval=1681753746 TSecr=3806013454
1712183438.383616447   478 0.589194788    10.10.1.1 → 10.10.1.2    TCP 83 8081 → 50820 [PSH, ACK] Seq=749 Ack=766 Win=65152 Len=17 TSval=3806013455 TSecr=1681753746
1712183445.383616447   485 0.590355236    10.10.1.2 → 10.10.1.1    TCP 83 50820 → 8081 [PSH, ACK] Seq=766 Ack=766 Win=64256 Len=17 TSval=1681753747 TSecr=3806013455
1712183447.383616447   487 0.590476357    10.10.1.1 → 10.10.1.2    TCP 83 8081 → 50820 [PSH, ACK] Seq=766 Ack=783 Win=65152 Len=17 TSval=3806013456 TSecr=1681753747
1712183454.383616447   494 0.591636549    10.10.1.2 → 10.10.1.1    TCP 83 50820 → 8081 [PSH, ACK] Seq=783 Ack=783 Win=64256 Len=17 TSval=1681753748 TSecr=3806013456
1712183456.383616447   496 0.591762800    10.10.1.1 → 10.10.1.2    TCP 83 8081 → 50820 [PSH, ACK] Seq=783 Ack=800 Win=65152 Len=17 TSval=3806013458 TSecr=1681753748
1712183464.383616447   504 0.592976654    10.10.1.2 → 10.10.1.1    TCP 83 50820 → 8081 [PSH, ACK] Seq=800 Ack=800 Win=64256 Len=17 TSval=1681753750 TSecr=3806013458
1712183466.383616447   506 0.593106532    10.10.1.1 → 10.10.1.2    TCP 83 8081 → 50820 [PSH, ACK] Seq=800 Ack=817 Win=65152 Len=17 TSval=3806013459 TSecr=1681753750
1712183474.383616447   514 0.594316917    10.10.1.2 → 10.10.1.1    TCP 83 50820 → 8081 [PSH, ACK] Seq=817 Ack=817 Win=64256 Len=17 TSval=1681753751 TSecr=3806013459
1712183476.383616447   516 0.594443040    10.10.1.1 → 10.10.1.2    TCP 83 8081 → 50820 [PSH, ACK] Seq=817 Ack=834 Win=65152 Len=17 TSval=3806013460 TSecr=1681753751
1712183484.383616447   524 0.595656049    10.10.1.2 → 10.10.1.1    TCP 83 50820 → 8081 [PSH, ACK] Seq=834 Ack=834 Win=64256 Len=17 TSval=1681753752 TSecr=3806013460
1712183486.383616447   526 0.595790593    10.10.1.1 → 10.10.1.2    TCP 83 8081 → 50820 [PSH, ACK] Seq=834 Ack=851 Win=65152 Len=17 TSval=3806013462 TSecr=1681753752
1712183494.383616447   534 0.597004485    10.10.1.2 → 10.10.1.1    TCP 83 50820 → 8081 [PSH, ACK] Seq=851 Ack=851 Win=64256 Len=17 TSval=1681753754 TSecr=3806013462
1712183496.383616447   536 0.597129527    10.10.1.1 → 10.10.1.2    TCP 83 8081 → 50820 [PSH, ACK] Seq=851 Ack=868 Win=65152 Len=17 TSval=3806013463 TSecr=1681753754
1712183504.383616447   544 0.598339835    10.10.1.2 → 10.10.1.1    TCP 83 50820 → 8081 [PSH, ACK] Seq=868 Ack=868 Win=64256 Len=17 TSval=1681753755 TSecr=3806013463
1712183506.383616447   546 0.598462281    10.10.1.1 → 10.10.1.2    TCP 83 8081 → 50820 [PSH, ACK] Seq=868 Ack=885 Win=65152 Len=17 TSval=3806013464 TSecr=1681753755
1712183514.383616447   554 0.599674287    10.10.1.2 → 10.10.1.1    TCP 83 50820 → 8081 [PSH, ACK] Seq=885 Ack=885 Win=64256 Len=17 TSval=1681753756 TSecr=3806013464
1712183516.383616447   556 0.599794028    10.10.1.1 → 10.10.1.2    TCP 83 8081 → 50820 [PSH, ACK] Seq=885 Ack=902 Win=65152 Len=17 TSval=3806013466 TSecr=1681753756
1712183524.383616447   564 0.601007297    10.10.1.2 → 10.10.1.1    TCP 83 50820 → 8081 [PSH, ACK] Seq=902 Ack=902 Win=64256 Len=17 TSval=1681753758 TSecr=3806013466
1712183526.383616447   566 0.601134055    10.10.1.1 → 10.10.1.2    TCP 83 8081 → 50820 [PSH, ACK] Seq=902 Ack=919 Win=65152 Len=17 TSval=3806013467 TSecr=1681753758
1712183534.383616447   574 0.602344292    10.10.1.2 → 10.10.1.1    TCP 83 50820 → 8081 [PSH, ACK] Seq=919 Ack=919 Win=64256 Len=17 TSval=1681753759 TSecr=3806013467
1712183536.383616447   576 0.602470673    10.10.1.1 → 10.10.1.2    TCP 83 8081 → 50820 [PSH, ACK] Seq=919 Ack=936 Win=65152 Len=17 TSval=3806013468 TSecr=1681753759
1712183544.383616447   584 0.603683843    10.10.1.2 → 10.10.1.1    TCP 83 50820 → 8081 [PSH, ACK] Seq=936 Ack=936 Win=64256 Len=17 TSval=1681753760 TSecr=3806013468
1712183547.383616447   587 0.603798406    10.10.1.1 → 10.10.1.2    TCP 83 8081 → 50820 [PSH, ACK] Seq=936 Ack=953 Win=65152 Len=17 TSval=3806013470 TSecr=1681753760
1712183554.383616447   594 0.605013170    10.10.1.2 → 10.10.1.1    TCP 83 50820 → 8081 [PSH, ACK] Seq=953 Ack=953 Win=64256 Len=17 TSval=1681753762 TSecr=3806013470
1712183557.383616447   597 0.605195052    10.10.1.1 → 10.10.1.2    TCP 83 8081 → 50820 [PSH, ACK] Seq=953 Ack=970 Win=65152 Len=17 TSval=3806013471 TSecr=1681753762
1712183564.383616447   604 0.606406044    10.10.1.2 → 10.10.1.1    TCP 83 50820 → 8081 [PSH, ACK] Seq=970 Ack=970 Win=64256 Len=17 TSval=1681753763 TSecr=3806013471
1712183566.383616447   606 0.606531605    10.10.1.1 → 10.10.1.2    TCP 83 8081 → 50820 [PSH, ACK] Seq=970 Ack=987 Win=65152 Len=17 TSval=3806013472 TSecr=1681753763
1712183574.383616447   614 0.607744905    10.10.1.2 → 10.10.1.1    TCP 83 50820 → 8081 [PSH, ACK] Seq=987 Ack=987 Win=64256 Len=17 TSval=1681753764 TSecr=3806013472
1712183577.383616447   617 0.607875489    10.10.1.1 → 10.10.1.2    TCP 83 8081 → 50820 [PSH, ACK] Seq=987 Ack=1004 Win=65152 Len=17 TSval=3806013474 TSecr=1681753764
1712183584.383616447   624 0.609089669    10.10.1.2 → 10.10.1.1    TCP 83 50820 → 8081 [PSH, ACK] Seq=1004 Ack=1004 Win=64256 Len=17 TSval=1681753766 TSecr=3806013474
1712183586.383616447   626 0.609211020    10.10.1.1 → 10.10.1.2    TCP 83 8081 → 50820 [PSH, ACK] Seq=1004 Ack=1021 Win=65152 Len=17 TSval=3806013475 TSecr=1681753766
1712183594.383616447   634 0.610422052    10.10.1.2 → 10.10.1.1    TCP 83 50820 → 8081 [PSH, ACK] Seq=1021 Ack=1021 Win=64256 Len=17 TSval=1681753767 TSecr=3806013475
1712183596.383616447   636 0.610543472    10.10.1.1 → 10.10.1.2    TCP 83 8081 → 50820 [PSH, ACK] Seq=1021 Ack=1038 Win=65152 Len=17 TSval=3806013476 TSecr=1681753767
1712183604.383616447   644 0.611771562    10.10.1.2 → 10.10.1.1    TCP 83 50820 → 8081 [PSH, ACK] Seq=1038 Ack=1038 Win=64256 Len=17 TSval=1681753768 TSecr=3806013476
1712183606.383616447   646 0.611855349    10.10.1.1 → 10.10.1.2    TCP 83 8081 → 50820 [PSH, ACK] Seq=1038 Ack=1055 Win=65152 Len=17 TSval=3806013478 TSecr=1681753768
1712183616.383616447   656 0.613085711    10.10.1.2 → 10.10.1.1    TCP 83 50820 → 8081 [PSH, ACK] Seq=1055 Ack=1055 Win=64256 Len=17 TSval=1681753770 TSecr=3806013478
1712183618.383616447   658 0.613212368    10.10.1.1 → 10.10.1.2    TCP 83 8081 → 50820 [PSH, ACK] Seq=1055 Ack=1072 Win=65152 Len=17 TSval=3806013479 TSecr=1681753770
1712183626.383616447   666 0.614424271    10.10.1.2 → 10.10.1.1    TCP 83 50820 → 8081 [PSH, ACK] Seq=1072 Ack=1072 Win=64256 Len=17 TSval=1681753771 TSecr=3806013479
1712183628.383616447   668 0.614546029    10.10.1.1 → 10.10.1.2    TCP 83 8081 → 50820 [PSH, ACK] Seq=1072 Ack=1089 Win=65152 Len=17 TSval=3806013480 TSecr=1681753771
1712183636.383616447   676 0.615759885    10.10.1.2 → 10.10.1.1    TCP 83 50820 → 8081 [PSH, ACK] Seq=1089 Ack=1089 Win=64256 Len=17 TSval=1681753772 TSecr=3806013480
1712183638.383616447   678 0.615845620    10.10.1.1 → 10.10.1.2    TCP 83 8081 → 50820 [PSH, ACK] Seq=1089 Ack=1106 Win=65152 Len=17 TSval=3806013482 TSecr=1681753772
1712183646.383616447   686 0.617058761    10.10.1.2 → 10.10.1.1    TCP 83 50820 → 8081 [PSH, ACK] Seq=1106 Ack=1106 Win=64256 Len=17 TSval=1681753774 TSecr=3806013482
1712183648.383616447   688 0.617185594    10.10.1.1 → 10.10.1.2    TCP 83 8081 → 50820 [PSH, ACK] Seq=1106 Ack=1123 Win=65152 Len=17 TSval=3806013483 TSecr=1681753774
1712183656.383616447   696 0.618396482    10.10.1.2 → 10.10.1.1    TCP 83 50820 → 8081 [PSH, ACK] Seq=1123 Ack=1123 Win=64256 Len=17 TSval=1681753775 TSecr=3806013483
1712183658.383616447   698 0.618518955    10.10.1.1 → 10.10.1.2    TCP 83 8081 → 50820 [PSH, ACK] Seq=1123 Ack=1140 Win=65152 Len=17 TSval=3806013484 TSecr=1681753775
1712183666.383616447   706 0.619733867    10.10.1.2 → 10.10.1.1    TCP 83 50820 → 8081 [PSH, ACK] Seq=1140 Ack=1140 Win=64256 Len=17 TSval=1681753776 TSecr=3806013484
1712183668.383616447   708 0.619818057    10.10.1.1 → 10.10.1.2    TCP 83 8081 → 50820 [PSH, ACK] Seq=1140 Ack=1157 Win=65152 Len=17 TSval=3806013486 TSecr=1681753776
1712183676.383616447   716 0.621055957    10.10.1.2 → 10.10.1.1    TCP 83 50820 → 8081 [PSH, ACK] Seq=1157 Ack=1157 Win=64256 Len=17 TSval=1681753778 TSecr=3806013486
1712183678.383616447   718 0.621137689    10.10.1.1 → 10.10.1.2    TCP 83 8081 → 50820 [PSH, ACK] Seq=1157 Ack=1174 Win=65152 Len=17 TSval=3806013487 TSecr=1681753778
1712183686.383616447   726 0.622348360    10.10.1.2 → 10.10.1.1    TCP 83 50820 → 8081 [PSH, ACK] Seq=1174 Ack=1174 Win=64256 Len=17 TSval=1681753779 TSecr=3806013487
1712183688.383616447   728 0.622470236    10.10.1.1 → 10.10.1.2    TCP 83 8081 → 50820 [PSH, ACK] Seq=1174 Ack=1191 Win=65152 Len=17 TSval=3806013488 TSecr=1681753779
1712183696.383616447   736 0.623682274    10.10.1.2 → 10.10.1.1    TCP 83 50820 → 8081 [PSH, ACK] Seq=1191 Ack=1191 Win=64256 Len=17 TSval=1681753780 TSecr=3806013488
1712183699.383616447   739 0.623803552    10.10.1.1 → 10.10.1.2    TCP 83 8081 → 50820 [PSH, ACK] Seq=1191 Ack=1208 Win=65152 Len=17 TSval=3806013490 TSecr=1681753780
1712183706.383616447   746 0.625019311    10.10.1.2 → 10.10.1.1    TCP 83 50820 → 8081 [PSH, ACK] Seq=1208 Ack=1208 Win=64256 Len=17 TSval=1681753782 TSecr=3806013490
1712183708.383616447   748 0.625141166    10.10.1.1 → 10.10.1.2    TCP 83 8081 → 50820 [PSH, ACK] Seq=1208 Ack=1225 Win=65152 Len=17 TSval=3806013491 TSecr=1681753782
1712183716.383616447   756 0.626304642    10.10.1.2 → 10.10.1.1    TCP 83 50820 → 8081 [PSH, ACK] Seq=1225 Ack=1225 Win=64256 Len=17 TSval=1681753783 TSecr=3806013491
1712183718.383616447   758 0.626421613    10.10.1.1 → 10.10.1.2    TCP 83 8081 → 50820 [PSH, ACK] Seq=1225 Ack=1242 Win=65152 Len=17 TSval=3806013492 TSecr=1681753783
1712183725.383616447   765 0.627583184    10.10.1.2 → 10.10.1.1    TCP 83 50820 → 8081 [PSH, ACK] Seq=1242 Ack=1242 Win=64256 Len=17 TSval=1681753784 TSecr=3806013492
1712183727.383616447   767 0.627649649    10.10.1.1 → 10.10.1.2    TCP 83 8081 → 50820 [PSH, ACK] Seq=1242 Ack=1259 Win=65152 Len=17 TSval=3806013493 TSecr=1681753784
1712183735.383616447   775 0.628863119    10.10.1.2 → 10.10.1.1    TCP 83 50820 → 8081 [PSH, ACK] Seq=1259 Ack=1259 Win=64256 Len=17 TSval=1681753785 TSecr=3806013493
1712183737.383616447   777 0.628988406    10.10.1.1 → 10.10.1.2    TCP 83 8081 → 50820 [PSH, ACK] Seq=1259 Ack=1276 Win=65152 Len=17 TSval=3806013495 TSecr=1681753785
1712183745.383616447   785 0.630199799    10.10.1.2 → 10.10.1.1    TCP 83 50820 → 8081 [PSH, ACK] Seq=1276 Ack=1276 Win=64256 Len=17 TSval=1681753787 TSecr=3806013495
1712183747.383616447   787 0.630321433    10.10.1.1 → 10.10.1.2    TCP 83 8081 → 50820 [PSH, ACK] Seq=1276 Ack=1293 Win=65152 Len=17 TSval=3806013496 TSecr=1681753787
1712183755.383616447   795 0.631532429    10.10.1.2 → 10.10.1.1    TCP 83 50820 → 8081 [PSH, ACK] Seq=1293 Ack=1293 Win=64256 Len=17 TSval=1681753788 TSecr=3806013496
1712183757.383616447   797 0.631654790    10.10.1.1 → 10.10.1.2    TCP 83 8081 → 50820 [PSH, ACK] Seq=1293 Ack=1310 Win=65152 Len=17 TSval=3806013497 TSecr=1681753788
1712183765.383616447   805 0.632869166    10.10.1.2 → 10.10.1.1    TCP 83 50820 → 8081 [PSH, ACK] Seq=1310 Ack=1310 Win=64256 Len=17 TSval=1681753789 TSecr=3806013497
1712183767.383616447   807 0.632994528    10.10.1.1 → 10.10.1.2    TCP 83 8081 → 50820 [PSH, ACK] Seq=1310 Ack=1327 Win=65152 Len=17 TSval=3806013499 TSecr=1681753789
1712183775.383616447   815 0.634204860    10.10.1.2 → 10.10.1.1    TCP 83 50820 → 8081 [PSH, ACK] Seq=1327 Ack=1327 Win=64256 Len=17 TSval=1681753791 TSecr=3806013499
1712183777.383616447   817 0.634326630    10.10.1.1 → 10.10.1.2    TCP 83 8081 → 50820 [PSH, ACK] Seq=1327 Ack=1344 Win=65152 Len=17 TSval=3806013500 TSecr=1681753791
1712183785.383616447   825 0.635537927    10.10.1.2 → 10.10.1.1    TCP 83 50820 → 8081 [PSH, ACK] Seq=1344 Ack=1344 Win=64256 Len=17 TSval=1681753792 TSecr=3806013500
1712183787.383616447   827 0.635663957    10.10.1.1 → 10.10.1.2    TCP 83 8081 → 50820 [PSH, ACK] Seq=1344 Ack=1361 Win=65152 Len=17 TSval=3806013501 TSecr=1681753792
1712183795.383616447   835 0.636879809    10.10.1.2 → 10.10.1.1    TCP 83 50820 → 8081 [PSH, ACK] Seq=1361 Ack=1361 Win=64256 Len=17 TSval=1681753793 TSecr=3806013501
1712183797.383616447   837 0.637009466    10.10.1.1 → 10.10.1.2    TCP 83 8081 → 50820 [PSH, ACK] Seq=1361 Ack=1378 Win=65152 Len=17 TSval=3806013503 TSecr=1681753793
1712183805.383616447   845 0.638219383    10.10.1.2 → 10.10.1.1    TCP 83 50820 → 8081 [PSH, ACK] Seq=1378 Ack=1378 Win=64256 Len=17 TSval=1681753795 TSecr=3806013503
1712183807.383616447   847 0.638341522    10.10.1.1 → 10.10.1.2    TCP 83 8081 → 50820 [PSH, ACK] Seq=1378 Ack=1395 Win=65152 Len=17 TSval=3806013504 TSecr=1681753795
1712183815.383616447   855 0.639565947    10.10.1.2 → 10.10.1.1    TCP 83 50820 → 8081 [PSH, ACK] Seq=1395 Ack=1395 Win=64256 Len=17 TSval=1681753796 TSecr=3806013504
1712183817.383616447   857 0.639705949    10.10.1.1 → 10.10.1.2    TCP 83 8081 → 50820 [PSH, ACK] Seq=1395 Ack=1412 Win=65152 Len=17 TSval=3806013505 TSecr=1681753796
1712183825.383616447   865 0.640921865    10.10.1.2 → 10.10.1.1    TCP 83 50820 → 8081 [PSH, ACK] Seq=1412 Ack=1412 Win=64256 Len=17 TSval=1681753798 TSecr=3806013505
1712183827.383616447   867 0.641046872    10.10.1.1 → 10.10.1.2    TCP 83 8081 → 50820 [PSH, ACK] Seq=1412 Ack=1429 Win=65152 Len=17 TSval=3806013507 TSecr=1681753798
1712183835.383616447   875 0.642256711    10.10.1.2 → 10.10.1.1    TCP 83 50820 → 8081 [PSH, ACK] Seq=1429 Ack=1429 Win=64256 Len=17 TSval=1681753799 TSecr=3806013507
1712183837.383616447   877 0.642379360    10.10.1.1 → 10.10.1.2    TCP 83 8081 → 50820 [PSH, ACK] Seq=1429 Ack=1446 Win=65152 Len=17 TSval=3806013508 TSecr=1681753799
1712183845.383616447   885 0.643606121    10.10.1.2 → 10.10.1.1    TCP 83 50820 → 8081 [PSH, ACK] Seq=1446 Ack=1446 Win=64256 Len=17 TSval=1681753800 TSecr=3806013508
1712183847.383616447   887 0.643653070    10.10.1.1 → 10.10.1.2    TCP 83 8081 → 50820 [PSH, ACK] Seq=1446 Ack=1463 Win=65152 Len=17 TSval=3806013509 TSecr=1681753800
1712183854.383616447   894 0.644863757    10.10.1.2 → 10.10.1.1    TCP 83 50820 → 8081 [PSH, ACK] Seq=1463 Ack=1463 Win=64256 Len=17 TSval=1681753801 TSecr=3806013509
1712183856.383616447   896 0.644992977    10.10.1.1 → 10.10.1.2    TCP 83 8081 → 50820 [PSH, ACK] Seq=1463 Ack=1480 Win=65152 Len=17 TSval=3806013511 TSecr=1681753801
1712183864.383616447   904 0.646202945    10.10.1.2 → 10.10.1.1    TCP 83 50820 → 8081 [PSH, ACK] Seq=1480 Ack=1480 Win=64256 Len=17 TSval=1681753803 TSecr=3806013511
1712183866.383616447   906 0.646325520    10.10.1.1 → 10.10.1.2    TCP 83 8081 → 50820 [PSH, ACK] Seq=1480 Ack=1497 Win=65152 Len=17 TSval=3806013512 TSecr=1681753803
1712183874.383616447   914 0.647485742    10.10.1.2 → 10.10.1.1    TCP 83 50820 → 8081 [PSH, ACK] Seq=1497 Ack=1497 Win=64256 Len=17 TSval=1681753804 TSecr=3806013512
1712183876.383616447   916 0.647597665    10.10.1.1 → 10.10.1.2    TCP 83 8081 → 50820 [PSH, ACK] Seq=1497 Ack=1514 Win=65152 Len=17 TSval=3806013513 TSecr=1681753804
1712183883.383616447   923 0.648760946    10.10.1.2 → 10.10.1.1    TCP 83 50820 → 8081 [PSH, ACK] Seq=1514 Ack=1514 Win=64256 Len=17 TSval=1681753805 TSecr=3806013513
1712183885.383616447   925 0.648879884    10.10.1.1 → 10.10.1.2    TCP 83 8081 → 50820 [PSH, ACK] Seq=1514 Ack=1531 Win=65152 Len=17 TSval=3806013515 TSecr=1681753805
1712183892.383616447   932 0.650040022    10.10.1.2 → 10.10.1.1    TCP 83 50820 → 8081 [PSH, ACK] Seq=1531 Ack=1531 Win=64256 Len=17 TSval=1681753807 TSecr=3806013515
1712183894.383616447   934 0.650158609    10.10.1.1 → 10.10.1.2    TCP 83 8081 → 50820 [PSH, ACK] Seq=1531 Ack=1548 Win=65152 Len=17 TSval=3806013516 TSecr=1681753807
1712183902.383616447   942 0.651319348    10.10.1.2 → 10.10.1.1    TCP 83 50820 → 8081 [PSH, ACK] Seq=1548 Ack=1548 Win=64256 Len=17 TSval=1681753808 TSecr=3806013516
1712183904.383616447   944 0.651435826    10.10.1.1 → 10.10.1.2    TCP 83 8081 → 50820 [PSH, ACK] Seq=1548 Ack=1565 Win=65152 Len=17 TSval=3806013517 TSecr=1681753808
1712183912.383616447   952 0.652649712    10.10.1.2 → 10.10.1.1    TCP 83 50820 → 8081 [PSH, ACK] Seq=1565 Ack=1565 Win=64256 Len=17 TSval=1681753809 TSecr=3806013517
1712183914.383616447   954 0.652779683    10.10.1.1 → 10.10.1.2    TCP 83 8081 → 50820 [PSH, ACK] Seq=1565 Ack=1582 Win=65152 Len=17 TSval=3806013519 TSecr=1681753809
1712183922.383616447   962 0.653989915    10.10.1.2 → 10.10.1.1    TCP 83 50820 → 8081 [PSH, ACK] Seq=1582 Ack=1582 Win=64256 Len=17 TSval=1681753811 TSecr=3806013519
1712183924.383616447   964 0.654111481    10.10.1.1 → 10.10.1.2    TCP 83 8081 → 50820 [PSH, ACK] Seq=1582 Ack=1599 Win=65152 Len=17 TSval=3806013520 TSecr=1681753811
1712183932.383616447   972 0.655323480    10.10.1.2 → 10.10.1.1    TCP 83 50820 → 8081 [PSH, ACK] Seq=1599 Ack=1599 Win=64256 Len=17 TSval=1681753812 TSecr=3806013520
1712183934.383616447   974 0.655445618    10.10.1.1 → 10.10.1.2    TCP 83 8081 → 50820 [PSH, ACK] Seq=1599 Ack=1616 Win=65152 Len=17 TSval=3806013521 TSecr=1681753812
1712183942.383616447   982 0.656658661    10.10.1.2 → 10.10.1.1    TCP 83 50820 → 8081 [PSH, ACK] Seq=1616 Ack=1616 Win=64256 Len=17 TSval=1681753813 TSecr=3806013521
1712183944.383616447   984 0.656787962    10.10.1.1 → 10.10.1.2    TCP 83 8081 → 50820 [PSH, ACK] Seq=1616 Ack=1633 Win=65152 Len=17 TSval=3806013523 TSecr=1681753813
1712183952.383616447   992 0.657998755    10.10.1.2 → 10.10.1.1    TCP 83 50820 → 8081 [PSH, ACK] Seq=1633 Ack=1633 Win=64256 Len=17 TSval=1681753815 TSecr=3806013523
1712183954.383616447   994 0.658124913    10.10.1.1 → 10.10.1.2    TCP 83 8081 → 50820 [PSH, ACK] Seq=1633 Ack=1650 Win=65152 Len=17 TSval=3806013524 TSecr=1681753815
1712183962.383616447  1002 0.659336275    10.10.1.2 → 10.10.1.1    TCP 83 50820 → 8081 [PSH, ACK] Seq=1650 Ack=1650 Win=64256 Len=17 TSval=1681753816 TSecr=3806013524
1712183964.383616447  1004 0.659458561    10.10.1.1 → 10.10.1.2    TCP 83 8081 → 50820 [PSH, ACK] Seq=1650 Ack=1667 Win=65152 Len=17 TSval=3806013525 TSecr=1681753816
1712183972.383616447  1012 0.660672340    10.10.1.2 → 10.10.1.1    TCP 83 50820 → 8081 [PSH, ACK] Seq=1667 Ack=1667 Win=64256 Len=17 TSval=1681753817 TSecr=3806013525
1712183974.383616447  1014 0.660804014    10.10.1.1 → 10.10.1.2    TCP 83 8081 → 50820 [PSH, ACK] Seq=1667 Ack=1684 Win=65152 Len=17 TSval=3806013527 TSecr=1681753817
1712183982.383616447  1022 0.662014514    10.10.1.2 → 10.10.1.1    TCP 83 50820 → 8081 [PSH, ACK] Seq=1684 Ack=1684 Win=64256 Len=17 TSval=1681753819 TSecr=3806013527
1712183984.383616447  1024 0.662140719    10.10.1.1 → 10.10.1.2    TCP 83 8081 → 50820 [PSH, ACK] Seq=1684 Ack=1701 Win=65152 Len=17 TSval=3806013528 TSecr=1681753819
1712183992.383616447  1032 0.663351481    10.10.1.2 → 10.10.1.1    TCP 83 50820 → 8081 [PSH, ACK] Seq=1701 Ack=1701 Win=64256 Len=17 TSval=1681753820 TSecr=3806013528
1712183994.383616447  1034 0.663477793    10.10.1.1 → 10.10.1.2    TCP 83 8081 → 50820 [PSH, ACK] Seq=1701 Ack=1718 Win=65152 Len=17 TSval=3806013529 TSecr=1681753820
1712184002.383616447  1042 0.664691967    10.10.1.2 → 10.10.1.1    TCP 83 50820 → 8081 [PSH, ACK] Seq=1718 Ack=1718 Win=64256 Len=17 TSval=1681753821 TSecr=3806013529
1712184004.383616447  1044 0.664820939    10.10.1.1 → 10.10.1.2    TCP 83 8081 → 50820 [PSH, ACK] Seq=1718 Ack=1735 Win=65152 Len=17 TSval=3806013531 TSecr=1681753821
1712184012.383616447  1052 0.666030675    10.10.1.2 → 10.10.1.1    TCP 83 50820 → 8081 [PSH, ACK] Seq=1735 Ack=1735 Win=64256 Len=17 TSval=1681753823 TSecr=3806013531
1712184014.383616447  1054 0.666157117    10.10.1.1 → 10.10.1.2    TCP 83 8081 → 50820 [PSH, ACK] Seq=1735 Ack=1752 Win=65152 Len=17 TSval=3806013532 TSecr=1681753823
1712184022.383616447  1062 0.667367796    10.10.1.2 → 10.10.1.1    TCP 83 50820 → 8081 [PSH, ACK] Seq=1752 Ack=1752 Win=64256 Len=17 TSval=1681753824 TSecr=3806013532
1712184024.383616447  1064 0.667493974    10.10.1.1 → 10.10.1.2    TCP 83 8081 → 50820 [PSH, ACK] Seq=1752 Ack=1769 Win=65152 Len=17 TSval=3806013533 TSecr=1681753824
1712184032.383616447  1072 0.668706740    10.10.1.2 → 10.10.1.1    TCP 83 50820 → 8081 [PSH, ACK] Seq=1769 Ack=1769 Win=64256 Len=17 TSval=1681753825 TSecr=3806013533
1712184034.383616447  1074 0.668836831    10.10.1.1 → 10.10.1.2    TCP 83 8081 → 50820 [PSH, ACK] Seq=1769 Ack=1786 Win=65152 Len=17 TSval=3806013535 TSecr=1681753825
1712184042.383616447  1082 0.670047823    10.10.1.2 → 10.10.1.1    TCP 83 50820 → 8081 [PSH, ACK] Seq=1786 Ack=1786 Win=64256 Len=17 TSval=1681753827 TSecr=3806013535
1712184044.383616447  1084 0.670169363    10.10.1.1 → 10.10.1.2    TCP 83 8081 → 50820 [PSH, ACK] Seq=1786 Ack=1803 Win=65152 Len=17 TSval=3806013536 TSecr=1681753827
1712184052.383616447  1092 0.671380004    10.10.1.2 → 10.10.1.1    TCP 83 50820 → 8081 [PSH, ACK] Seq=1803 Ack=1803 Win=64256 Len=17 TSval=1681753828 TSecr=3806013536
1712184054.383616447  1094 0.671501717    10.10.1.1 → 10.10.1.2    TCP 83 8081 → 50820 [PSH, ACK] Seq=1803 Ack=1820 Win=65152 Len=17 TSval=3806013537 TSecr=1681753828
1712184062.383616447  1102 0.672715368    10.10.1.2 → 10.10.1.1    TCP 83 50820 → 8081 [PSH, ACK] Seq=1820 Ack=1820 Win=64256 Len=17 TSval=1681753829 TSecr=3806013537
1712184064.383616447  1104 0.672844883    10.10.1.1 → 10.10.1.2    TCP 83 8081 → 50820 [PSH, ACK] Seq=1820 Ack=1837 Win=65152 Len=17 TSval=3806013539 TSecr=1681753829
1712184072.383616447  1112 0.674055926    10.10.1.2 → 10.10.1.1    TCP 83 50820 → 8081 [PSH, ACK] Seq=1837 Ack=1837 Win=64256 Len=17 TSval=1681753831 TSecr=3806013539
1712184074.383616447  1114 0.674182951    10.10.1.1 → 10.10.1.2    TCP 83 8081 → 50820 [PSH, ACK] Seq=1837 Ack=1854 Win=65152 Len=17 TSval=3806013540 TSecr=1681753831
1712184082.383616447  1122 0.675393500    10.10.1.2 → 10.10.1.1    TCP 83 50820 → 8081 [PSH, ACK] Seq=1854 Ack=1854 Win=64256 Len=17 TSval=1681753832 TSecr=3806013540
1712184084.383616447  1124 0.675519614    10.10.1.1 → 10.10.1.2    TCP 83 8081 → 50820 [PSH, ACK] Seq=1854 Ack=1871 Win=65152 Len=17 TSval=3806013541 TSecr=1681753832
1712184092.383616447  1132 0.676733153    10.10.1.2 → 10.10.1.1    TCP 83 50820 → 8081 [PSH, ACK] Seq=1871 Ack=1871 Win=64256 Len=17 TSval=1681753833 TSecr=3806013541
1712184094.383616447  1134 0.676863159    10.10.1.1 → 10.10.1.2    TCP 83 8081 → 50820 [PSH, ACK] Seq=1871 Ack=1888 Win=65152 Len=17 TSval=3806013543 TSecr=1681753833
1712184102.383616447  1142 0.678073054    10.10.1.2 → 10.10.1.1    TCP 83 50820 → 8081 [PSH, ACK] Seq=1888 Ack=1888 Win=64256 Len=17 TSval=1681753835 TSecr=3806013543
1712184104.383616447  1144 0.678198482    10.10.1.1 → 10.10.1.2    TCP 83 8081 → 50820 [PSH, ACK] Seq=1888 Ack=1905 Win=65152 Len=17 TSval=3806013544 TSecr=1681753835
1712184112.383616447  1152 0.679410804    10.10.1.2 → 10.10.1.1    TCP 83 50820 → 8081 [PSH, ACK] Seq=1905 Ack=1905 Win=64256 Len=17 TSval=1681753836 TSecr=3806013544
1712184115.383616447  1155 0.679537879    10.10.1.1 → 10.10.1.2    TCP 83 8081 → 50820 [PSH, ACK] Seq=1905 Ack=1922 Win=65152 Len=17 TSval=3806013545 TSecr=1681753836
1712184122.383616447  1162 0.680750965    10.10.1.2 → 10.10.1.1    TCP 83 50820 → 8081 [PSH, ACK] Seq=1922 Ack=1922 Win=64256 Len=17 TSval=1681753837 TSecr=3806013545
1712184125.383616447  1165 0.680933055    10.10.1.1 → 10.10.1.2    TCP 83 8081 → 50820 [PSH, ACK] Seq=1922 Ack=1939 Win=65152 Len=17 TSval=3806013547 TSecr=1681753837
1712184132.383616447  1172 0.682144538    10.10.1.2 → 10.10.1.1    TCP 83 50820 → 8081 [PSH, ACK] Seq=1939 Ack=1939 Win=64256 Len=17 TSval=1681753839 TSecr=3806013547
1712184134.383616447  1174 0.682266456    10.10.1.1 → 10.10.1.2    TCP 83 8081 → 50820 [PSH, ACK] Seq=1939 Ack=1956 Win=65152 Len=17 TSval=3806013548 TSecr=1681753839
1712184142.383616447  1182 0.683478244    10.10.1.2 → 10.10.1.1    TCP 83 50820 → 8081 [PSH, ACK] Seq=1956 Ack=1956 Win=64256 Len=17 TSval=1681753840 TSecr=3806013548
1712184144.383616447  1184 0.683600206    10.10.1.1 → 10.10.1.2    TCP 83 8081 → 50820 [PSH, ACK] Seq=1956 Ack=1973 Win=65152 Len=17 TSval=3806013549 TSecr=1681753840
1712184152.383616447  1192 0.684814425    10.10.1.2 → 10.10.1.1    TCP 83 50820 → 8081 [PSH, ACK] Seq=1973 Ack=1973 Win=64256 Len=17 TSval=1681753841 TSecr=3806013549
1712184154.383616447  1194 0.684940180    10.10.1.1 → 10.10.1.2    TCP 83 8081 → 50820 [PSH, ACK] Seq=1973 Ack=1990 Win=65152 Len=17 TSval=3806013551 TSecr=1681753841
1712184162.383616447  1202 0.686150650    10.10.1.2 → 10.10.1.1    TCP 83 50820 → 8081 [PSH, ACK] Seq=1990 Ack=1990 Win=64256 Len=17 TSval=1681753843 TSecr=3806013551
1712184164.383616447  1204 0.686272608    10.10.1.1 → 10.10.1.2    TCP 83 8081 → 50820 [PSH, ACK] Seq=1990 Ack=2007 Win=65152 Len=17 TSval=3806013552 TSecr=1681753843
1712184172.383616447  1212 0.687483639    10.10.1.2 → 10.10.1.1    TCP 83 50820 → 8081 [PSH, ACK] Seq=2007 Ack=2007 Win=64256 Len=17 TSval=1681753844 TSecr=3806013552
1712184174.383616447  1214 0.687605461    10.10.1.1 → 10.10.1.2    TCP 83 8081 → 50820 [PSH, ACK] Seq=2007 Ack=2024 Win=65152 Len=17 TSval=3806013553 TSecr=1681753844
1712184182.383616447  1222 0.688819414    10.10.1.2 → 10.10.1.1    TCP 83 50820 → 8081 [PSH, ACK] Seq=2024 Ack=2024 Win=64256 Len=17 TSval=1681753845 TSecr=3806013553
1712184184.383616447  1224 0.688944768    10.10.1.1 → 10.10.1.2    TCP 83 8081 → 50820 [PSH, ACK] Seq=2024 Ack=2041 Win=65152 Len=17 TSval=3806013555 TSecr=1681753845
1712184192.383616447  1232 0.690155702    10.10.1.2 → 10.10.1.1    TCP 83 50820 → 8081 [PSH, ACK] Seq=2041 Ack=2041 Win=64256 Len=17 TSval=1681753847 TSecr=3806013555
