1712183027.147430658    30 0.522083671    10.10.1.2 → 10.10.1.1    TCP 83 38090 → 8081 [PSH, ACK] Seq=1 Ack=1 Win=64256 Len=17 TSval=1681789753 TSecr=3806049210
1712183029.147430658    32 0.522405169    10.10.1.1 → 10.10.1.2    TCP 83 8081 → 38090 [PSH, ACK] Seq=1 Ack=18 Win=65152 Len=17 TSval=3806049462 TSecr=1681789753
1712183035.147430658    38 0.523619684    10.10.1.2 → 10.10.1.1    TCP 83 38090 → 8081 [PSH, ACK] Seq=18 Ack=18 Win=64256 Len=17 TSval=1681789754 TSecr=3806049462
1712183038.147430658    41 0.523742781    10.10.1.1 → 10.10.1.2    TCP 83 8081 → 38090 [PSH, ACK] Seq=18 Ack=35 Win=65152 Len=17 TSval=3806049464 TSecr=1681789754
1712183043.147430658    46 0.524952136    10.10.1.2 → 10.10.1.1    TCP 83 38090 → 8081 [PSH, ACK] Seq=35 Ack=35 Win=64256 Len=17 TSval=1681789756 TSecr=3806049464
1712183046.147430658    49 0.525077334    10.10.1.1 → 10.10.1.2    TCP 83 8081 → 38090 [PSH, ACK] Seq=35 Ack=52 Win=65152 Len=17 TSval=3806049465 TSecr=1681789756
1712183051.147430658    54 0.526287784    10.10.1.2 → 10.10.1.1    TCP 83 38090 → 8081 [PSH, ACK] Seq=52 Ack=52 Win=64256 Len=17 TSval=1681789757 TSecr=3806049465
1712183054.147430658    57 0.526417671    10.10.1.1 → 10.10.1.2    TCP 83 8081 → 38090 [PSH, ACK] Seq=52 Ack=69 Win=65152 Len=17 TSval=3806049466 TSecr=1681789757
1712183059.147430658    62 0.527623711    10.10.1.2 → 10.10.1.1    TCP 83 38090 → 8081 [PSH, ACK] Seq=69 Ack=69 Win=64256 Len=17 TSval=1681789758 TSecr=3806049466
1712183062.147430658    65 0.527749535    10.10.1.1 → 10.10.1.2    TCP 83 8081 → 38090 [PSH, ACK] Seq=69 Ack=86 Win=65152 Len=17 TSval=3806049468 TSecr=1681789758
1712183067.147430658    70 0.528955718    10.10.1.2 → 10.10.1.1    TCP 83 38090 → 8081 [PSH, ACK] Seq=86 Ack=86 Win=64256 Len=17 TSval=1681789760 TSecr=3806049468
1712183069.147430658    72 0.529082042    10.10.1.1 → 10.10.1.2    TCP 83 8081 → 38090 [PSH, ACK] Seq=86 Ack=103 Win=65152 Len=17 TSval=3806049469 TSecr=1681789760
1712183075.147430658    78 0.530294057    10.10.1.2 → 10.10.1.1    TCP 83 38090 → 8081 [PSH, ACK] Seq=103 Ack=103 Win=64256 Len=17 TSval=1681789761 TSecr=3806049469
1712183077.147430658    80 0.530429243    10.10.1.1 → 10.10.1.2    TCP 83 8081 → 38090 [PSH, ACK] Seq=103 Ack=120 Win=65152 Len=17 TSval=3806049470 TSecr=1681789761
1712183083.147430658    86 0.531635203    10.10.1.2 → 10.10.1.1    TCP 83 38090 → 8081 [PSH, ACK] Seq=120 Ack=120 Win=64256 Len=17 TSval=1681789762 TSecr=3806049470
1712183085.147430658    88 0.531768989    10.10.1.1 → 10.10.1.2    TCP 83 8081 → 38090 [PSH, ACK] Seq=120 Ack=137 Win=65152 Len=17 TSval=3806049472 TSecr=1681789762
1712183091.147430658    94 0.532975532    10.10.1.2 → 10.10.1.1    TCP 83 38090 → 8081 [PSH, ACK] Seq=137 Ack=137 Win=64256 Len=17 TSval=1681789764 TSecr=3806049472
1712183093.147430658    96 0.533101057    10.10.1.1 → 10.10.1.2    TCP 83 8081 → 38090 [PSH, ACK] Seq=137 Ack=154 Win=65152 Len=17 TSval=3806049473 TSecr=1681789764
1712183100.147430658   103 0.534336874    10.10.1.2 → 10.10.1.1    TCP 83 38090 → 8081 [PSH, ACK] Seq=154 Ack=154 Win=64256 Len=17 TSval=1681789765 TSecr=3806049473
1712183102.147430658   105 0.534457695    10.10.1.1 → 10.10.1.2    TCP 83 8081 → 38090 [PSH, ACK] Seq=154 Ack=171 Win=65152 Len=17 TSval=3806049474 TSecr=1681789765
1712183108.147430658   111 0.535684435    10.10.1.2 → 10.10.1.1    TCP 83 38090 → 8081 [PSH, ACK] Seq=171 Ack=171 Win=64256 Len=17 TSval=1681789766 TSecr=3806049474
1712183110.147430658   113 0.535803783    10.10.1.1 → 10.10.1.2    TCP 83 8081 → 38090 [PSH, ACK] Seq=171 Ack=188 Win=65152 Len=17 TSval=3806049476 TSecr=1681789766
1712183116.147430658   119 0.537031238    10.10.1.2 → 10.10.1.1    TCP 83 38090 → 8081 [PSH, ACK] Seq=188 Ack=188 Win=64256 Len=17 TSval=1681789768 TSecr=3806049476
1712183118.147430658   121 0.537148914    10.10.1.1 → 10.10.1.2    TCP 83 8081 → 38090 [PSH, ACK] Seq=188 Ack=205 Win=65152 Len=17 TSval=3806049477 TSecr=1681789768
1712183124.147430658   127 0.538384932    10.10.1.2 → 10.10.1.1    TCP 83 38090 → 8081 [PSH, ACK] Seq=205 Ack=205 Win=64256 Len=17 TSval=1681789769 TSecr=3806049477
1712183126.147430658   129 0.538503462    10.10.1.1 → 10.10.1.2    TCP 83 8081 → 38090 [PSH, ACK] Seq=205 Ack=222 Win=65152 Len=17 TSval=3806049478 TSecr=1681789769
1712183132.147430658   135 0.539730163    10.10.1.2 → 10.10.1.1    TCP 83 38090 → 8081 [PSH, ACK] Seq=222 Ack=222 Win=64256 Len=17 TSval=1681789770 TSecr=3806049478
1712183134.147430658   137 0.539847325    10.10.1.1 → 10.10.1.2    TCP 83 8081 → 38090 [PSH, ACK] Seq=222 Ack=239 Win=65152 Len=17 TSval=3806049480 TSecr=1681789770
1712183140.147430658   143 0.541076144    10.10.1.2 → 10.10.1.1    TCP 83 38090 → 8081 [PSH, ACK] Seq=239 Ack=239 Win=64256 Len=17 TSval=1681789772 TSecr=3806049480
1712183142.147430658   145 0.541195889    10.10.1.1 → 10.10.1.2    TCP 83 8081 → 38090 [PSH, ACK] Seq=239 Ack=256 Win=65152 Len=17 TSval=3806049481 TSecr=1681789772
1712183148.147430658   151 0.542428659    10.10.1.2 → 10.10.1.1    TCP 83 38090 → 8081 [PSH, ACK] Seq=256 Ack=256 Win=64256 Len=17 TSval=1681789773 TSecr=3806049481
1712183150.147430658   153 0.542543390    10.10.1.1 → 10.10.1.2    TCP 83 8081 → 38090 [PSH, ACK] Seq=256 Ack=273 Win=65152 Len=17 TSval=3806049482 TSecr=1681789773
1712183156.147430658   159 0.543769286    10.10.1.2 → 10.10.1.1    TCP 83 38090 → 8081 [PSH, ACK] Seq=273 Ack=273 Win=64256 Len=17 TSval=1681789774 TSecr=3806049482
1712183158.147430658   161 0.543883857    10.10.1.1 → 10.10.1.2    TCP 83 8081 → 38090 [PSH, ACK] Seq=273 Ack=290 Win=65152 Len=17 TSval=3806049484 TSecr=1681789774
1712183164.147430658   167 0.545110663    10.10.1.2 → 10.10.1.1    TCP 83 38090 → 8081 [PSH, ACK] Seq=290 Ack=290 Win=64256 Len=17 TSval=1681789776 TSecr=3806049484
1712183166.147430658   169 0.545225038    10.10.1.1 → 10.10.1.2    TCP 83 8081 → 38090 [PSH, ACK] Seq=290 Ack=307 Win=65152 Len=17 TSval=3806049485 TSecr=1681789776
1712183172.147430658   175 0.546460147    10.10.1.2 → 10.10.1.1    TCP 83 38090 → 8081 [PSH, ACK] Seq=307 Ack=307 Win=64256 Len=17 TSval=1681789777 TSecr=3806049485
1712183174.147430658   177 0.546576356    10.10.1.1 → 10.10.1.2    TCP 83 8081 → 38090 [PSH, ACK] Seq=307 Ack=324 Win=65152 Len=17 TSval=3806049486 TSecr=1681789777
1712183180.147430658   183 0.547803168    10.10.1.2 → 10.10.1.1    TCP 83 38090 → 8081 [PSH, ACK] Seq=324 Ack=324 Win=64256 Len=17 TSval=1681789778 TSecr=3806049486
1712183182.147430658   185 0.547921059    10.10.1.1 → 10.10.1.2    TCP 83 8081 → 38090 [PSH, ACK] Seq=324 Ack=341 Win=65152 Len=17 TSval=3806049488 TSecr=1681789778
1712183187.147430658   190 0.549126579    10.10.1.2 → 10.10.1.1    TCP 83 38090 → 8081 [PSH, ACK] Seq=341 Ack=341 Win=64256 Len=17 TSval=1681789780 TSecr=3806049488
1712183189.147430658   192 0.549252287    10.10.1.1 → 10.10.1.2    TCP 83 8081 → 38090 [PSH, ACK] Seq=341 Ack=358 Win=65152 Len=17 TSval=3806049489 TSecr=1681789780
1712183195.147430658   198 0.550461302    10.10.1.2 → 10.10.1.1    TCP 83 38090 → 8081 [PSH, ACK] Seq=358 Ack=358 Win=64256 Len=17 TSval=1681789781 TSecr=3806049489
1712183197.147430658   200 0.550600004    10.10.1.1 → 10.10.1.2    TCP 83 8081 → 38090 [PSH, ACK] Seq=358 Ack=375 Win=65152 Len=17 TSval=3806049490 TSecr=1681789781
1712183203.147430658   206 0.551804880    10.10.1.2 → 10.10.1.1    TCP 83 38090 → 8081 [PSH, ACK] Seq=375 Ack=375 Win=64256 Len=17 TSval=1681789782 TSecr=3806049490
1712183205.147430658   208 0.551934586    10.10.1.1 → 10.10.1.2    TCP 83 8081 → 38090 [PSH, ACK] Seq=375 Ack=392 Win=65152 Len=17 TSval=3806049492 TSecr=1681789782
1712183211.147430658   214 0.553139361    10.10.1.2 → 10.10.1.1    TCP 83 38090 → 8081 [PSH, ACK] Seq=392 Ack=392 Win=64256 Len=17 TSval=1681789784 TSecr=3806049492
1712183213.147430658   216 0.553270539    10.10.1.1 → 10.10.1.2    TCP 83 8081 → 38090 [PSH, ACK] Seq=392 Ack=409 Win=65152 Len=17 TSval=3806049493 TSecr=1681789784
1712183219.147430658   222 0.554478064    10.10.1.2 → 10.10.1.1    TCP 83 38090 → 8081 [PSH, ACK] Seq=409 Ack=409 Win=64256 Len=17 TSval=1681789785 TSecr=3806049493
1712183221.147430658   224 0.554612336    10.10.1.1 → 10.10.1.2    TCP 83 8081 → 38090 [PSH, ACK] Seq=409 Ack=426 Win=65152 Len=17 TSval=3806049494 TSecr=1681789785
1712183227.147430658   230 0.555816972    10.10.1.2 → 10.10.1.1    TCP 83 38090 → 8081 [PSH, ACK] Seq=426 Ack=426 Win=64256 Len=17 TSval=1681789786 TSecr=3806049494
1712183229.147430658   232 0.555947693    10.10.1.1 → 10.10.1.2    TCP 83 8081 → 38090 [PSH, ACK] Seq=426 Ack=443 Win=65152 Len=17 TSval=3806049496 TSecr=1681789786
1712183235.147430658   238 0.557153969    10.10.1.2 → 10.10.1.1    TCP 83 38090 → 8081 [PSH, ACK] Seq=443 Ack=443 Win=64256 Len=17 TSval=1681789788 TSecr=3806049496
1712183237.147430658   240 0.557276290    10.10.1.1 → 10.10.1.2    TCP 83 8081 → 38090 [PSH, ACK] Seq=443 Ack=460 Win=65152 Len=17 TSval=3806049497 TSecr=1681789788
1712183243.147430658   246 0.558483946    10.10.1.2 → 10.10.1.1    TCP 83 38090 → 8081 [PSH, ACK] Seq=460 Ack=460 Win=64256 Len=17 TSval=1681789789 TSecr=3806049497
1712183245.147430658   248 0.558614962    10.10.1.1 → 10.10.1.2    TCP 83 8081 → 38090 [PSH, ACK] Seq=460 Ack=477 Win=65152 Len=17 TSval=3806049498 TSecr=1681789789
1712183251.147430658   254 0.559819911    10.10.1.2 → 10.10.1.1    TCP 83 38090 → 8081 [PSH, ACK] Seq=477 Ack=477 Win=64256 Len=17 TSval=1681789790 TSecr=3806049498
1712183253.147430658   256 0.559949881    10.10.1.1 → 10.10.1.2    TCP 83 8081 → 38090 [PSH, ACK] Seq=477 Ack=494 Win=65152 Len=17 TSval=3806049500 TSecr=1681789790
1712183259.147430658   262 0.561156657    10.10.1.2 → 10.10.1.1    TCP 83 38090 → 8081 [PSH, ACK] Seq=494 Ack=494 Win=64256 Len=17 TSval=1681789792 TSecr=3806049500
1712183261.147430658   264 0.561277933    10.10.1.1 → 10.10.1.2    TCP 83 8081 → 38090 [PSH, ACK] Seq=494 Ack=511 Win=65152 Len=17 TSval=3806049501 TSecr=1681789792
1712183267.147430658   270 0.562486434    10.10.1.2 → 10.10.1.1    TCP 83 38090 → 8081 [PSH, ACK] Seq=511 Ack=511 Win=64256 Len=17 TSval=1681789793 TSecr=3806049501
1712183269.147430658   272 0.562620174    10.10.1.1 → 10.10.1.2    TCP 83 8081 → 38090 [PSH, ACK] Seq=511 Ack=528 Win=65152 Len=17 TSval=3806049502 TSecr=1681789793
1712183275.147430658   278 0.563825715    10.10.1.2 → 10.10.1.1    TCP 83 38090 → 8081 [PSH, ACK] Seq=528 Ack=528 Win=64256 Len=17 TSval=1681789794 TSecr=3806049502
1712183277.147430658   280 0.563946568    10.10.1.1 → 10.10.1.2    TCP 83 8081 → 38090 [PSH, ACK] Seq=528 Ack=545 Win=65152 Len=17 TSval=3806049504 TSecr=1681789794
1712183283.147430658   286 0.565152207    10.10.1.2 → 10.10.1.1    TCP 83 38090 → 8081 [PSH, ACK] Seq=545 Ack=545 Win=64256 Len=17 TSval=1681789796 TSecr=3806049504
1712183285.147430658   288 0.565273185    10.10.1.1 → 10.10.1.2    TCP 83 8081 → 38090 [PSH, ACK] Seq=545 Ack=562 Win=65152 Len=17 TSval=3806049505 TSecr=1681789796
1712183291.147430658   294 0.566480570    10.10.1.2 → 10.10.1.1    TCP 83 38090 → 8081 [PSH, ACK] Seq=562 Ack=562 Win=64256 Len=17 TSval=1681789797 TSecr=3806049505
1712183293.147430658   296 0.566613675    10.10.1.1 → 10.10.1.2    TCP 83 8081 → 38090 [PSH, ACK] Seq=562 Ack=579 Win=65152 Len=17 TSval=3806049506 TSecr=1681789797
1712183299.147430658   302 0.567818107    10.10.1.2 → 10.10.1.1    TCP 83 38090 → 8081 [PSH, ACK] Seq=579 Ack=579 Win=64256 Len=17 TSval=1681789798 TSecr=3806049506
1712183301.147430658   304 0.567939843    10.10.1.1 → 10.10.1.2    TCP 83 8081 → 38090 [PSH, ACK] Seq=579 Ack=596 Win=65152 Len=17 TSval=3806049508 TSecr=1681789798
1712183307.147430658   310 0.569145113    10.10.1.2 → 10.10.1.1    TCP 83 38090 → 8081 [PSH, ACK] Seq=596 Ack=596 Win=64256 Len=17 TSval=1681789800 TSecr=3806049508
1712183309.147430658   312 0.569275197    10.10.1.1 → 10.10.1.2    TCP 83 8081 → 38090 [PSH, ACK] Seq=596 Ack=613 Win=65152 Len=17 TSval=3806049509 TSecr=1681789800
1712183315.147430658   318 0.570483329    10.10.1.2 → 10.10.1.1    TCP 83 38090 → 8081 [PSH, ACK] Seq=613 Ack=613 Win=64256 Len=17 TSval=1681789801 TSecr=3806049509
1712183317.147430658   320 0.570617374    10.10.1.1 → 10.10.1.2    TCP 83 8081 → 38090 [PSH, ACK] Seq=613 Ack=630 Win=65152 Len=17 TSval=3806049510 TSecr=1681789801
1712183324.147430658   327 0.571821873    10.10.1.2 → 10.10.1.1    TCP 83 38090 → 8081 [PSH, ACK] Seq=630 Ack=630 Win=64256 Len=17 TSval=1681789802 TSecr=3806049510
1712183326.147430658   329 0.571943605    10.10.1.1 → 10.10.1.2    TCP 83 8081 → 38090 [PSH, ACK] Seq=630 Ack=647 Win=65152 Len=17 TSval=3806049512 TSecr=1681789802
1712183332.147430658   335 0.573149016    10.10.1.2 → 10.10.1.1    TCP 83 38090 → 8081 [PSH, ACK] Seq=647 Ack=647 Win=64256 Len=17 TSval=1681789804 TSecr=3806049512
1712183334.147430658   337 0.573270957    10.10.1.1 → 10.10.1.2    TCP 83 8081 → 38090 [PSH, ACK] Seq=647 Ack=664 Win=65152 Len=17 TSval=3806049513 TSecr=1681789804
1712183340.147430658   343 0.574478358    10.10.1.2 → 10.10.1.1    TCP 83 38090 → 8081 [PSH, ACK] Seq=664 Ack=664 Win=64256 Len=17 TSval=1681789805 TSecr=3806049513
1712183342.147430658   345 0.574602858    10.10.1.1 → 10.10.1.2    TCP 83 8081 → 38090 [PSH, ACK] Seq=664 Ack=681 Win=65152 Len=17 TSval=3806049514 TSecr=1681789805
1712183348.147430658   351 0.575807801    10.10.1.2 → 10.10.1.1    TCP 83 38090 → 8081 [PSH, ACK] Seq=681 Ack=681 Win=64256 Len=17 TSval=1681789806 TSecr=3806049514
1712183350.147430658   353 0.575929626    10.10.1.1 → 10.10.1.2    TCP 83 8081 → 38090 [PSH, ACK] Seq=681 Ack=698 Win=65152 Len=17 TSval=3806049516 TSecr=1681789806
1712183356.147430658   359 0.577134971    10.10.1.2 → 10.10.1.1    TCP 83 38090 → 8081 [PSH, ACK] Seq=698 Ack=698 Win=64256 Len=17 TSval=1681789808 TSecr=3806049516
1712183358.147430658   361 0.577257754    10.10.1.1 → 10.10.1.2    TCP 83 8081 → 38090 [PSH, ACK] Seq=698 Ack=715 Win=65152 Len=17 TSval=3806049517 TSecr=1681789808
1712183363.147430658   366 0.578464708    10.10.1.2 → 10.10.1.1    TCP 83 38090 → 8081 [PSH, ACK] Seq=715 Ack=715 Win=64256 Len=17 TSval=1681789809 TSecr=3806049517
1712183365.147430658   368 0.578598916    10.10.1.1 → 10.10.1.2    TCP 83 8081 → 38090 [PSH, ACK] Seq=715 Ack=732 Win=65152 Len=17 TSval=3806049518 TSecr=1681789809
1712183371.147430658   374 0.579803209    10.10.1.2 → 10.10.1.1    TCP 83 38090 → 8081 [PSH, ACK] Seq=732 Ack=732 Win=64256 Len=17 TSval=1681789810 TSecr=3806049518
1712183373.147430658   376 0.579925004    10.10.1.1 → 10.10.1.2    TCP 83 8081 → 38090 [PSH, ACK] Seq=732 Ack=749 Win=65152 Len=17 TSval=3806049520 TSecr=1681789810
1712183379.147430658   382 0.581131227    10.10.1.2 → 10.10.1.1    TCP 83 38090 → 8081 [PSH, ACK] Seq=749 Ack=749 Win=64256 Len=17 TSval=1681789812 TSecr=3806049520
1712183381.147430658   384 0.581253051    10.10.1.1 → 10.10.1.2    TCP 83 8081 → 38090 [PSH, ACK] Seq=749 Ack=766 Win=65152 Len=17 TSval=3806049521 TSecr=1681789812
1712183387.147430658   390 0.582460080    10.10.1.2 → 10.10.1.1    TCP 83 38090 → 8081 [PSH, ACK] Seq=766 Ack=766 Win=64256 Len=17 TSval=1681789813 TSecr=3806049521
1712183389.147430658   392 0.582594285    10.10.1.1 → 10.10.1.2    TCP 83 8081 → 38090 [PSH, ACK] Seq=766 Ack=783 Win=65152 Len=17 TSval=3806049522 TSecr=1681789813
1712183395.147430658   398 0.583799638    10.10.1.2 → 10.10.1.1    TCP 83 38090 → 8081 [PSH, ACK] Seq=783 Ack=783 Win=64256 Len=17 TSval=1681789814 TSecr=3806049522
1712183397.147430658   400 0.583930526    10.10.1.1 → 10.10.1.2    TCP 83 8081 → 38090 [PSH, ACK] Seq=783 Ack=800 Win=65152 Len=17 TSval=3806049524 TSecr=1681789814
1712183403.147430658   406 0.585135411    10.10.1.2 → 10.10.1.1    TCP 83 38090 → 8081 [PSH, ACK] Seq=800 Ack=800 Win=64256 Len=17 TSval=1681789816 TSecr=3806049524
1712183405.147430658   408 0.585267153    10.10.1.1 → 10.10.1.2    TCP 83 8081 → 38090 [PSH, ACK] Seq=800 Ack=817 Win=65152 Len=17 TSval=3806049525 TSecr=1681789816
1712183411.147430658   414 0.586474318    10.10.1.2 → 10.10.1.1    TCP 83 38090 → 8081 [PSH, ACK] Seq=817 Ack=817 Win=64256 Len=17 TSval=1681789817 TSecr=3806049525
1712183413.147430658   416 0.586605590    10.10.1.1 → 10.10.1.2    TCP 83 8081 → 38090 [PSH, ACK] Seq=817 Ack=834 Win=65152 Len=17 TSval=3806049526 TSecr=1681789817
1712183419.147430658   422 0.587810456    10.10.1.2 → 10.10.1.1    TCP 83 38090 → 8081 [PSH, ACK] Seq=834 Ack=834 Win=64256 Len=17 TSval=1681789818 TSecr=3806049526
1712183421.147430658   424 0.587932653    10.10.1.1 → 10.10.1.2    TCP 83 8081 → 38090 [PSH, ACK] Seq=834 Ack=851 Win=65152 Len=17 TSval=3806049528 TSecr=1681789818
1712183427.147430658   430 0.589137427    10.10.1.2 → 10.10.1.1    TCP 83 38090 → 8081 [PSH, ACK] Seq=851 Ack=851 Win=64256 Len=17 TSval=1681789820 TSecr=3806049528
1712183429.147430658   432 0.589259904    10.10.1.1 → 10.10.1.2    TCP 83 8081 → 38090 [PSH, ACK] Seq=851 Ack=868 Win=65152 Len=17 TSval=3806049529 TSecr=1681789820
1712183435.147430658   438 0.590467130    10.10.1.2 → 10.10.1.1    TCP 83 38090 → 8081 [PSH, ACK] Seq=868 Ack=868 Win=64256 Len=17 TSval=1681789821 TSecr=3806049529
1712183437.147430658   440 0.590591362    10.10.1.1 → 10.10.1.2    TCP 83 8081 → 38090 [PSH, ACK] Seq=868 Ack=885 Win=65152 Len=17 TSval=3806049530 TSecr=1681789821
1712183443.147430658   446 0.591795577    10.10.1.2 → 10.10.1.1    TCP 83 38090 → 8081 [PSH, ACK] Seq=885 Ack=885 Win=64256 Len=17 TSval=1681789822 TSecr=3806049530
1712183445.147430658   448 0.591917098    10.10.1.1 → 10.10.1.2    TCP 83 8081 → 38090 [PSH, ACK] Seq=885 Ack=902 Win=65152 Len=17 TSval=3806049532 TSecr=1681789822
1712183451.147430658   454 0.593122724    10.10.1.2 → 10.10.1.1    TCP 83 38090 → 8081 [PSH, ACK] Seq=902 Ack=902 Win=64256 Len=17 TSval=1681789824 TSecr=3806049532
1712183453.147430658   456 0.593244623    10.10.1.1 → 10.10.1.2    TCP 83 8081 → 38090 [PSH, ACK] Seq=902 Ack=919 Win=65152 Len=17 TSval=3806049533 TSecr=1681789824
1712183459.147430658   462 0.594451795    10.10.1.2 → 10.10.1.1    TCP 83 38090 → 8081 [PSH, ACK] Seq=919 Ack=919 Win=64256 Len=17 TSval=1681789825 TSecr=3806049533
1712183461.147430658   464 0.594576082    10.10.1.1 → 10.10.1.2    TCP 83 8081 → 38090 [PSH, ACK] Seq=919 Ack=936 Win=65152 Len=17 TSval=3806049534 TSecr=1681789825
1712183467.147430658   470 0.595781473    10.10.1.2 → 10.10.1.1    TCP 83 38090 → 8081 [PSH, ACK] Seq=936 Ack=936 Win=64256 Len=17 TSval=1681789826 TSecr=3806049534
1712183469.147430658   472 0.595913350    10.10.1.1 → 10.10.1.2    TCP 83 8081 → 38090 [PSH, ACK] Seq=936 Ack=953 Win=65152 Len=17 TSval=3806049536 TSecr=1681789826
1712183475.147430658   478 0.597118073    10.10.1.2 → 10.10.1.1    TCP 83 38090 → 8081 [PSH, ACK] Seq=953 Ack=953 Win=64256 Len=17 TSval=1681789828 TSecr=3806049536
1712183478.147430658   481 0.597303312    10.10.1.1 → 10.10.1.2    TCP 83 8081 → 38090 [PSH, ACK] Seq=953 Ack=970 Win=65152 Len=17 TSval=3806049537 TSecr=1681789828
1712183483.147430658   486 0.598509858    10.10.1.2 → 10.10.1.1    TCP 83 38090 → 8081 [PSH, ACK] Seq=970 Ack=970 Win=64256 Len=17 TSval=1681789829 TSecr=3806049537
1712183485.147430658   488 0.598643125    10.10.1.1 → 10.10.1.2    TCP 83 8081 → 38090 [PSH, ACK] Seq=970 Ack=987 Win=65152 Len=17 TSval=3806049539 TSecr=1681789829
1712183491.147430658   494 0.599847757    10.10.1.2 → 10.10.1.1    TCP 83 38090 → 8081 [PSH, ACK] Seq=987 Ack=987 Win=64256 Len=17 TSval=1681789831 TSecr=3806049539
1712183494.147430658   497 0.599969763    10.10.1.1 → 10.10.1.2    TCP 83 8081 → 38090 [PSH, ACK] Seq=987 Ack=1004 Win=65152 Len=17 TSval=3806049540 TSecr=1681789831
1712183499.147430658   502 0.601175183    10.10.1.2 → 10.10.1.1    TCP 83 38090 → 8081 [PSH, ACK] Seq=1004 Ack=1004 Win=64256 Len=17 TSval=1681789832 TSecr=3806049540
1712183501.147430658   504 0.601297596    10.10.1.1 → 10.10.1.2    TCP 83 8081 → 38090 [PSH, ACK] Seq=1004 Ack=1021 Win=65152 Len=17 TSval=3806049541 TSecr=1681789832
1712183507.147430658   510 0.602504150    10.10.1.2 → 10.10.1.1    TCP 83 38090 → 8081 [PSH, ACK] Seq=1021 Ack=1021 Win=64256 Len=17 TSval=1681789833 TSecr=3806049541
1712183509.147430658   512 0.602628317    10.10.1.1 → 10.10.1.2    TCP 83 8081 → 38090 [PSH, ACK] Seq=1021 Ack=1038 Win=65152 Len=17 TSval=3806049542 TSecr=1681789833
1712183515.147430658   518 0.603834156    10.10.1.2 → 10.10.1.1    TCP 83 38090 → 8081 [PSH, ACK] Seq=1038 Ack=1038 Win=64256 Len=17 TSval=1681789834 TSecr=3806049542
1712183517.147430658   520 0.603964414    10.10.1.1 → 10.10.1.2    TCP 83 8081 → 38090 [PSH, ACK] Seq=1038 Ack=1055 Win=65152 Len=17 TSval=3806049544 TSecr=1681789834
1712183523.147430658   526 0.605169164    10.10.1.2 → 10.10.1.1    TCP 83 38090 → 8081 [PSH, ACK] Seq=1055 Ack=1055 Win=64256 Len=17 TSval=1681789836 TSecr=3806049544
1712183525.147430658   528 0.605302815    10.10.1.1 → 10.10.1.2    TCP 83 8081 → 38090 [PSH, ACK] Seq=1055 Ack=1072 Win=65152 Len=17 TSval=3806049545 TSecr=1681789836
1712183531.147430658   534 0.606510294    10.10.1.2 → 10.10.1.1    TCP 83 38090 → 8081 [PSH, ACK] Seq=1072 Ack=1072 Win=64256 Len=17 TSval=1681789837 TSecr=3806049545
1712183533.147430658   536 0.606643454    10.10.1.1 → 10.10.1.2    TCP 83 8081 → 38090 [PSH, ACK] Seq=1072 Ack=1089 Win=65152 Len=17 TSval=3806049547 TSecr=1681789837
1712183539.147430658   542 0.607848039    10.10.1.2 → 10.10.1.1    TCP 83 38090 → 8081 [PSH, ACK] Seq=1089 Ack=1089 Win=64256 Len=17 TSval=1681789839 TSecr=3806049547
1712183541.147430658   544 0.607969277    10.10.1.1 → 10.10.1.2    TCP 83 8081 → 38090 [PSH, ACK] Seq=1089 Ack=1106 Win=65152 Len=17 TSval=3806049548 TSecr=1681789839
1712183547.147430658   550 0.609174526    10.10.1.2 → 10.10.1.1    TCP 83 38090 → 8081 [PSH, ACK] Seq=1106 Ack=1106 Win=64256 Len=17 TSval=1681789840 TSecr=3806049548
1712183549.147430658   552 0.609296848    10.10.1.1 → 10.10.1.2    TCP 83 8081 → 38090 [PSH, ACK] Seq=1106 Ack=1123 Win=65152 Len=17 TSval=3806049549 TSecr=1681789840
1712183555.147430658   558 0.610503575    10.10.1.2 → 10.10.1.1    TCP 83 38090 → 8081 [PSH, ACK] Seq=1123 Ack=1123 Win=64256 Len=17 TSval=1681789841 TSecr=3806049549
1712183557.147430658   560 0.610636328    10.10.1.1 → 10.10.1.2    TCP 83 8081 → 38090 [PSH, ACK] Seq=1123 Ack=1140 Win=65152 Len=17 TSval=3806049551 TSecr=1681789841
1712183563.147430658   566 0.611840911    10.10.1.2 → 10.10.1.1    TCP 83 38090 → 8081 [PSH, ACK] Seq=1140 Ack=1140 Win=64256 Len=17 TSval=1681789842 TSecr=3806049551
1712183565.147430658   568 0.611962187    10.10.1.1 → 10.10.1.2    TCP 83 8081 → 38090 [PSH, ACK] Seq=1140 Ack=1157 Win=65152 Len=17 TSval=3806049552 TSecr=1681789842
1712183571.147430658   574 0.613166997    10.10.1.2 → 10.10.1.1    TCP 83 38090 → 8081 [PSH, ACK] Seq=1157 Ack=1157 Win=64256 Len=17 TSval=1681789844 TSecr=3806049552
1712183573.147430658   576 0.613297526    10.10.1.1 → 10.10.1.2    TCP 83 8081 → 38090 [PSH, ACK] Seq=1157 Ack=1174 Win=65152 Len=17 TSval=3806049553 TSecr=1681789844
1712183579.147430658   582 0.614506180    10.10.1.2 → 10.10.1.1    TCP 83 38090 → 8081 [PSH, ACK] Seq=1174 Ack=1174 Win=64256 Len=17 TSval=1681789845 TSecr=3806049553
1712183581.147430658   584 0.614638407    10.10.1.1 → 10.10.1.2    TCP 83 8081 → 38090 [PSH, ACK] Seq=1174 Ack=1191 Win=65152 Len=17 TSval=3806049555 TSecr=1681789845
1712183587.147430658   590 0.615841868    10.10.1.2 → 10.10.1.1    TCP 83 38090 → 8081 [PSH, ACK] Seq=1191 Ack=1191 Win=64256 Len=17 TSval=1681789847 TSecr=3806049555
1712183589.147430658   592 0.615963300    10.10.1.1 → 10.10.1.2    TCP 83 8081 → 38090 [PSH, ACK] Seq=1191 Ack=1208 Win=65152 Len=17 TSval=3806049556 TSecr=1681789847
1712183595.147430658   598 0.617168176    10.10.1.2 → 10.10.1.1    TCP 83 38090 → 8081 [PSH, ACK] Seq=1208 Ack=1208 Win=64256 Len=17 TSval=1681789848 TSecr=3806049556
1712183597.147430658   600 0.617228671    10.10.1.1 → 10.10.1.2    TCP 83 8081 → 38090 [PSH, ACK] Seq=1208 Ack=1225 Win=65152 Len=17 TSval=3806049557 TSecr=1681789848
1712183603.147430658   606 0.618435648    10.10.1.2 → 10.10.1.1    TCP 83 38090 → 8081 [PSH, ACK] Seq=1225 Ack=1225 Win=64256 Len=17 TSval=1681789849 TSecr=3806049557
1712183605.147430658   608 0.618559351    10.10.1.1 → 10.10.1.2    TCP 83 8081 → 38090 [PSH, ACK] Seq=1225 Ack=1242 Win=65152 Len=17 TSval=3806049558 TSecr=1681789849
1712183610.147430658   613 0.619764563    10.10.1.2 → 10.10.1.1    TCP 83 38090 → 8081 [PSH, ACK] Seq=1242 Ack=1242 Win=64256 Len=17 TSval=1681789850 TSecr=3806049558
1712183612.147430658   615 0.619885575    10.10.1.1 → 10.10.1.2    TCP 83 8081 → 38090 [PSH, ACK] Seq=1242 Ack=1259 Win=65152 Len=17 TSval=3806049560 TSecr=1681789850
1712183619.147430658   622 0.621090131    10.10.1.2 → 10.10.1.1    TCP 83 38090 → 8081 [PSH, ACK] Seq=1259 Ack=1259 Win=64256 Len=17 TSval=1681789852 TSecr=3806049560
1712183621.147430658   624 0.621211058    10.10.1.1 → 10.10.1.2    TCP 83 8081 → 38090 [PSH, ACK] Seq=1259 Ack=1276 Win=65152 Len=17 TSval=3806049561 TSecr=1681789852
1712183626.147430658   629 0.622417762    10.10.1.2 → 10.10.1.1    TCP 83 38090 → 8081 [PSH, ACK] Seq=1276 Ack=1276 Win=64256 Len=17 TSval=1681789853 TSecr=3806049561
1712183628.147430658   631 0.622551289    10.10.1.1 → 10.10.1.2    TCP 83 8081 → 38090 [PSH, ACK] Seq=1276 Ack=1293 Win=65152 Len=17 TSval=3806049562 TSecr=1681789853
1712183635.147430658   638 0.623754785    10.10.1.2 → 10.10.1.1    TCP 83 38090 → 8081 [PSH, ACK] Seq=1293 Ack=1293 Win=64256 Len=17 TSval=1681789854 TSecr=3806049562
1712183637.147430658   640 0.623875528    10.10.1.1 → 10.10.1.2    TCP 83 8081 → 38090 [PSH, ACK] Seq=1293 Ack=1310 Win=65152 Len=17 TSval=3806049564 TSecr=1681789854
1712183643.147430658   646 0.625080302    10.10.1.2 → 10.10.1.1    TCP 83 38090 → 8081 [PSH, ACK] Seq=1310 Ack=1310 Win=64256 Len=17 TSval=1681789856 TSecr=3806049564
1712183645.147430658   648 0.625201758    10.10.1.1 → 10.10.1.2    TCP 83 8081 → 38090 [PSH, ACK] Seq=1310 Ack=1327 Win=65152 Len=17 TSval=3806049565 TSecr=1681789856
1712183650.147430658   653 0.626423311    10.10.1.2 → 10.10.1.1    TCP 83 38090 → 8081 [PSH, ACK] Seq=1327 Ack=1327 Win=64256 Len=17 TSval=1681789857 TSecr=3806049565
1712183652.147430658   655 0.626553803    10.10.1.1 → 10.10.1.2    TCP 83 8081 → 38090 [PSH, ACK] Seq=1327 Ack=1344 Win=65152 Len=17 TSval=3806049566 TSecr=1681789857
1712183659.147430658   662 0.627758803    10.10.1.2 → 10.10.1.1    TCP 83 38090 → 8081 [PSH, ACK] Seq=1344 Ack=1344 Win=64256 Len=17 TSval=1681789858 TSecr=3806049566
1712183661.147430658   664 0.627879958    10.10.1.1 → 10.10.1.2    TCP 83 8081 → 38090 [PSH, ACK] Seq=1344 Ack=1361 Win=65152 Len=17 TSval=3806049568 TSecr=1681789858
1712183667.147430658   670 0.629084306    10.10.1.2 → 10.10.1.1    TCP 83 38090 → 8081 [PSH, ACK] Seq=1361 Ack=1361 Win=64256 Len=17 TSval=1681789860 TSecr=3806049568
1712183669.147430658   672 0.629204911    10.10.1.1 → 10.10.1.2    TCP 83 8081 → 38090 [PSH, ACK] Seq=1361 Ack=1378 Win=65152 Len=17 TSval=3806049569 TSecr=1681789860
1712183675.147430658   678 0.630411820    10.10.1.2 → 10.10.1.1    TCP 83 38090 → 8081 [PSH, ACK] Seq=1378 Ack=1378 Win=64256 Len=17 TSval=1681789861 TSecr=3806049569
1712183677.147430658   680 0.630535718    10.10.1.1 → 10.10.1.2    TCP 83 8081 → 38090 [PSH, ACK] Seq=1378 Ack=1395 Win=65152 Len=17 TSval=3806049570 TSecr=1681789861
1712183682.147430658   685 0.631741024    10.10.1.2 → 10.10.1.1    TCP 83 38090 → 8081 [PSH, ACK] Seq=1395 Ack=1395 Win=64256 Len=17 TSval=1681789862 TSecr=3806049570
1712183684.147430658   687 0.631863226    10.10.1.1 → 10.10.1.2    TCP 83 8081 → 38090 [PSH, ACK] Seq=1395 Ack=1412 Win=65152 Len=17 TSval=3806049572 TSecr=1681789862
1712183690.147430658   693 0.633068186    10.10.1.2 → 10.10.1.1    TCP 83 38090 → 8081 [PSH, ACK] Seq=1412 Ack=1412 Win=64256 Len=17 TSval=1681789864 TSecr=3806049572
1712183692.147430658   695 0.633198704    10.10.1.1 → 10.10.1.2    TCP 83 8081 → 38090 [PSH, ACK] Seq=1412 Ack=1429 Win=65152 Len=17 TSval=3806049573 TSecr=1681789864
1712183698.147430658   701 0.634405503    10.10.1.2 → 10.10.1.1    TCP 83 38090 → 8081 [PSH, ACK] Seq=1429 Ack=1429 Win=64256 Len=17 TSval=1681789865 TSecr=3806049573
1712183700.147430658   703 0.634535620    10.10.1.1 → 10.10.1.2    TCP 83 8081 → 38090 [PSH, ACK] Seq=1429 Ack=1446 Win=65152 Len=17 TSval=3806049574 TSecr=1681789865
1712183706.147430658   709 0.635739710    10.10.1.2 → 10.10.1.1    TCP 83 38090 → 8081 [PSH, ACK] Seq=1446 Ack=1446 Win=64256 Len=17 TSval=1681789866 TSecr=3806049574
1712183708.147430658   711 0.635865851    10.10.1.1 → 10.10.1.2    TCP 83 8081 → 38090 [PSH, ACK] Seq=1446 Ack=1463 Win=65152 Len=17 TSval=3806049576 TSecr=1681789866
1712183714.147430658   717 0.637070983    10.10.1.2 → 10.10.1.1    TCP 83 38090 → 8081 [PSH, ACK] Seq=1463 Ack=1463 Win=64256 Len=17 TSval=1681789868 TSecr=3806049576
1712183716.147430658   719 0.637201296    10.10.1.1 → 10.10.1.2    TCP 83 8081 → 38090 [PSH, ACK] Seq=1463 Ack=1480 Win=65152 Len=17 TSval=3806049577 TSecr=1681789868
1712183722.147430658   725 0.638410945    10.10.1.2 → 10.10.1.1    TCP 83 38090 → 8081 [PSH, ACK] Seq=1480 Ack=1480 Win=64256 Len=17 TSval=1681789869 TSecr=3806049577
1712183724.147430658   727 0.638548166    10.10.1.1 → 10.10.1.2    TCP 83 8081 → 38090 [PSH, ACK] Seq=1480 Ack=1497 Win=65152 Len=17 TSval=3806049578 TSecr=1681789869
1712183730.147430658   733 0.639752764    10.10.1.2 → 10.10.1.1    TCP 83 38090 → 8081 [PSH, ACK] Seq=1497 Ack=1497 Win=64256 Len=17 TSval=1681789870 TSecr=3806049578
1712183732.147430658   735 0.639878983    10.10.1.1 → 10.10.1.2    TCP 83 8081 → 38090 [PSH, ACK] Seq=1497 Ack=1514 Win=65152 Len=17 TSval=3806049580 TSecr=1681789870
1712183738.147430658   741 0.641084726    10.10.1.2 → 10.10.1.1    TCP 83 38090 → 8081 [PSH, ACK] Seq=1514 Ack=1514 Win=64256 Len=17 TSval=1681789872 TSecr=3806049580
1712183740.147430658   743 0.641215657    10.10.1.1 → 10.10.1.2    TCP 83 8081 → 38090 [PSH, ACK] Seq=1514 Ack=1531 Win=65152 Len=17 TSval=3806049581 TSecr=1681789872
1712183746.147430658   749 0.642423463    10.10.1.2 → 10.10.1.1    TCP 83 38090 → 8081 [PSH, ACK] Seq=1531 Ack=1531 Win=64256 Len=17 TSval=1681789873 TSecr=3806049581
1712183748.147430658   751 0.642561745    10.10.1.1 → 10.10.1.2    TCP 83 8081 → 38090 [PSH, ACK] Seq=1531 Ack=1548 Win=65152 Len=17 TSval=3806049582 TSecr=1681789873
1712183754.147430658   757 0.643766016    10.10.1.2 → 10.10.1.1    TCP 83 38090 → 8081 [PSH, ACK] Seq=1548 Ack=1548 Win=64256 Len=17 TSval=1681789874 TSecr=3806049582
1712183756.147430658   759 0.643890788    10.10.1.1 → 10.10.1.2    TCP 83 8081 → 38090 [PSH, ACK] Seq=1548 Ack=1565 Win=65152 Len=17 TSval=3806049584 TSecr=1681789874
1712183762.147430658   765 0.645096170    10.10.1.2 → 10.10.1.1    TCP 83 38090 → 8081 [PSH, ACK] Seq=1565 Ack=1565 Win=64256 Len=17 TSval=1681789876 TSecr=3806049584
1712183764.147430658   767 0.645217419    10.10.1.1 → 10.10.1.2    TCP 83 8081 → 38090 [PSH, ACK] Seq=1565 Ack=1582 Win=65152 Len=17 TSval=3806049585 TSecr=1681789876
1712183770.147430658   773 0.646425690    10.10.1.2 → 10.10.1.1    TCP 83 38090 → 8081 [PSH, ACK] Seq=1582 Ack=1582 Win=64256 Len=17 TSval=1681789877 TSecr=3806049585
1712183772.147430658   775 0.646558306    10.10.1.1 → 10.10.1.2    TCP 83 8081 → 38090 [PSH, ACK] Seq=1582 Ack=1599 Win=65152 Len=17 TSval=3806049586 TSecr=1681789877
1712183778.147430658   781 0.647763130    10.10.1.2 → 10.10.1.1    TCP 83 38090 → 8081 [PSH, ACK] Seq=1599 Ack=1599 Win=64256 Len=17 TSval=1681789878 TSecr=3806049586
1712183780.147430658   783 0.647884007    10.10.1.1 → 10.10.1.2    TCP 83 8081 → 38090 [PSH, ACK] Seq=1599 Ack=1616 Win=65152 Len=17 TSval=3806049588 TSecr=1681789878
1712183786.147430658   789 0.649090342    10.10.1.2 → 10.10.1.1    TCP 83 38090 → 8081 [PSH, ACK] Seq=1616 Ack=1616 Win=64256 Len=17 TSval=1681789880 TSecr=3806049588
1712183788.147430658   791 0.649224669    10.10.1.1 → 10.10.1.2    TCP 83 8081 → 38090 [PSH, ACK] Seq=1616 Ack=1633 Win=65152 Len=17 TSval=3806049589 TSecr=1681789880
1712183794.147430658   797 0.650431657    10.10.1.2 → 10.10.1.1    TCP 83 38090 → 8081 [PSH, ACK] Seq=1633 Ack=1633 Win=64256 Len=17 TSval=1681789881 TSecr=3806049589
1712183796.147430658   799 0.650568178    10.10.1.1 → 10.10.1.2    TCP 83 8081 → 38090 [PSH, ACK] Seq=1633 Ack=1650 Win=65152 Len=17 TSval=3806049590 TSecr=1681789881
1712183802.147430658   805 0.651772422    10.10.1.2 → 10.10.1.1    TCP 83 38090 → 8081 [PSH, ACK] Seq=1650 Ack=1650 Win=64256 Len=17 TSval=1681789882 TSecr=3806049590
1712183804.147430658   807 0.651894315    10.10.1.1 → 10.10.1.2    TCP 83 8081 → 38090 [PSH, ACK] Seq=1650 Ack=1667 Win=65152 Len=17 TSval=3806049592 TSecr=1681789882
1712183810.147430658   813 0.653099701    10.10.1.2 → 10.10.1.1    TCP 83 38090 → 8081 [PSH, ACK] Seq=1667 Ack=1667 Win=64256 Len=17 TSval=1681789884 TSecr=3806049592
1712183812.147430658   815 0.653230276    10.10.1.1 → 10.10.1.2    TCP 83 8081 → 38090 [PSH, ACK] Seq=1667 Ack=1684 Win=65152 Len=17 TSval=3806049593 TSecr=1681789884
1712183818.147430658   821 0.654438971    10.10.1.2 → 10.10.1.1    TCP 83 38090 → 8081 [PSH, ACK] Seq=1684 Ack=1684 Win=64256 Len=17 TSval=1681789885 TSecr=3806049593
1712183820.147430658   823 0.654570399    10.10.1.1 → 10.10.1.2    TCP 83 8081 → 38090 [PSH, ACK] Seq=1684 Ack=1701 Win=65152 Len=17 TSval=3806049594 TSecr=1681789885
1712183826.147430658   829 0.655774980    10.10.1.2 → 10.10.1.1    TCP 83 38090 → 8081 [PSH, ACK] Seq=1701 Ack=1701 Win=64256 Len=17 TSval=1681789886 TSecr=3806049594
1712183828.147430658   831 0.655895977    10.10.1.1 → 10.10.1.2    TCP 83 8081 → 38090 [PSH, ACK] Seq=1701 Ack=1718 Win=65152 Len=17 TSval=3806049596 TSecr=1681789886
1712183834.147430658   837 0.657100227    10.10.1.2 → 10.10.1.1    TCP 83 38090 → 8081 [PSH, ACK] Seq=1718 Ack=1718 Win=64256 Len=17 TSval=1681789888 TSecr=3806049596
1712183836.147430658   839 0.657230164    10.10.1.1 → 10.10.1.2    TCP 83 8081 → 38090 [PSH, ACK] Seq=1718 Ack=1735 Win=65152 Len=17 TSval=3806049597 TSecr=1681789888
1712183842.147430658   845 0.658437783    10.10.1.2 → 10.10.1.1    TCP 83 38090 → 8081 [PSH, ACK] Seq=1735 Ack=1735 Win=64256 Len=17 TSval=1681789889 TSecr=3806049597
1712183844.147430658   847 0.658572421    10.10.1.1 → 10.10.1.2    TCP 83 8081 → 38090 [PSH, ACK] Seq=1735 Ack=1752 Win=65152 Len=17 TSval=3806049598 TSecr=1681789889
1712183850.147430658   853 0.659776677    10.10.1.2 → 10.10.1.1    TCP 83 38090 → 8081 [PSH, ACK] Seq=1752 Ack=1752 Win=64256 Len=17 TSval=1681789890 TSecr=3806049598
1712183852.147430658   855 0.659907208    10.10.1.1 → 10.10.1.2    TCP 83 8081 → 38090 [PSH, ACK] Seq=1752 Ack=1769 Win=65152 Len=17 TSval=3806049600 TSecr=1681789890
1712183859.147430658   862 0.661112374    10.10.1.2 → 10.10.1.1    TCP 83 38090 → 8081 [PSH, ACK] Seq=1769 Ack=1769 Win=64256 Len=17 TSval=1681789892 TSecr=3806049600
1712183861.147430658   864 0.661235099    10.10.1.1 → 10.10.1.2    TCP 83 8081 → 38090 [PSH, ACK] Seq=1769 Ack=1786 Win=65152 Len=17 TSval=3806049601 TSecr=1681789892
1712183867.147430658   870 0.662446399    10.10.1.2 → 10.10.1.1    TCP 83 38090 → 8081 [PSH, ACK] Seq=1786 Ack=1786 Win=64256 Len=17 TSval=1681789893 TSecr=3806049601
1712183869.147430658   872 0.662571109    10.10.1.1 → 10.10.1.2    TCP 83 8081 → 38090 [PSH, ACK] Seq=1786 Ack=1803 Win=65152 Len=17 TSval=3806049602 TSecr=1681789893
1712183875.147430658   878 0.663776812    10.10.1.2 → 10.10.1.1    TCP 83 38090 → 8081 [PSH, ACK] Seq=1803 Ack=1803 Win=64256 Len=17 TSval=1681789894 TSecr=3806049602
1712183877.147430658   880 0.663907614    10.10.1.1 → 10.10.1.2    TCP 83 8081 → 38090 [PSH, ACK] Seq=1803 Ack=1820 Win=65152 Len=17 TSval=3806049604 TSecr=1681789894
1712183883.147430658   886 0.665112313    10.10.1.2 → 10.10.1.1    TCP 83 38090 → 8081 [PSH, ACK] Seq=1820 Ack=1820 Win=64256 Len=17 TSval=1681789896 TSecr=3806049604
1712183885.147430658   888 0.665234127    10.10.1.1 → 10.10.1.2    TCP 83 8081 → 38090 [PSH, ACK] Seq=1820 Ack=1837 Win=65152 Len=17 TSval=3806049605 TSecr=1681789896
1712183890.147430658   893 0.666441784    10.10.1.2 → 10.10.1.1    TCP 83 38090 → 8081 [PSH, ACK] Seq=1837 Ack=1837 Win=64256 Len=17 TSval=1681789897 TSecr=3806049605
1712183892.147430658   895 0.666504434    10.10.1.1 → 10.10.1.2    TCP 83 8081 → 38090 [PSH, ACK] Seq=1837 Ack=1854 Win=65152 Len=17 TSval=3806049606 TSecr=1681789897
1712183898.147430658   901 0.667706666    10.10.1.2 → 10.10.1.1    TCP 83 38090 → 8081 [PSH, ACK] Seq=1854 Ack=1854 Win=64256 Len=17 TSval=1681789898 TSecr=3806049606
1712183899.147430658   902 0.667760361    10.10.1.1 → 10.10.1.2    TCP 83 8081 → 38090 [PSH, ACK] Seq=1854 Ack=1871 Win=65152 Len=17 TSval=3806049608 TSecr=1681789898
1712183906.147430658   909 0.668964625    10.10.1.2 → 10.10.1.1    TCP 83 38090 → 8081 [PSH, ACK] Seq=1871 Ack=1871 Win=64256 Len=17 TSval=1681789900 TSecr=3806049608
1712183907.147430658   910 0.669018096    10.10.1.1 → 10.10.1.2    TCP 83 8081 → 38090 [PSH, ACK] Seq=1871 Ack=1888 Win=65152 Len=17 TSval=3806049609 TSecr=1681789900
1712183913.147430658   916 0.670242648    10.10.1.2 → 10.10.1.1    TCP 83 38090 → 8081 [PSH, ACK] Seq=1888 Ack=1888 Win=64256 Len=17 TSval=1681789901 TSecr=3806049609
1712183915.147430658   918 0.670297273    10.10.1.1 → 10.10.1.2    TCP 83 8081 → 38090 [PSH, ACK] Seq=1888 Ack=1905 Win=65152 Len=17 TSval=3806049610 TSecr=1681789901
1712183921.147430658   924 0.671499308    10.10.1.2 → 10.10.1.1    TCP 83 38090 → 8081 [PSH, ACK] Seq=1905 Ack=1905 Win=64256 Len=17 TSval=1681789902 TSecr=3806049610
1712183922.147430658   925 0.671552609    10.10.1.1 → 10.10.1.2    TCP 83 8081 → 38090 [PSH, ACK] Seq=1905 Ack=1922 Win=65152 Len=17 TSval=3806049611 TSecr=1681789902
1712183929.147430658   932 0.672753711    10.10.1.2 → 10.10.1.1    TCP 83 38090 → 8081 [PSH, ACK] Seq=1922 Ack=1922 Win=64256 Len=17 TSval=1681789903 TSecr=3806049611
1712183931.147430658   934 0.672930947    10.10.1.1 → 10.10.1.2    TCP 83 8081 → 38090 [PSH, ACK] Seq=1922 Ack=1939 Win=65152 Len=17 TSval=3806049613 TSecr=1681789903
1712183937.147430658   940 0.674139099    10.10.1.2 → 10.10.1.1    TCP 83 38090 → 8081 [PSH, ACK] Seq=1939 Ack=1939 Win=64256 Len=17 TSval=1681789905 TSecr=3806049613
1712183939.147430658   942 0.674267358    10.10.1.1 → 10.10.1.2    TCP 83 8081 → 38090 [PSH, ACK] Seq=1939 Ack=1956 Win=65152 Len=17 TSval=3806049614 TSecr=1681789905
1712183945.147430658   948 0.675472316    10.10.1.2 → 10.10.1.1    TCP 83 38090 → 8081 [PSH, ACK] Seq=1956 Ack=1956 Win=64256 Len=17 TSval=1681789906 TSecr=3806049614
1712183947.147430658   950 0.675598532    10.10.1.1 → 10.10.1.2    TCP 83 8081 → 38090 [PSH, ACK] Seq=1956 Ack=1973 Win=65152 Len=17 TSval=3806049615 TSecr=1681789906
1712183953.147430658   956 0.676802906    10.10.1.2 → 10.10.1.1    TCP 83 38090 → 8081 [PSH, ACK] Seq=1973 Ack=1973 Win=64256 Len=17 TSval=1681789907 TSecr=3806049615
1712183955.147430658   958 0.676928389    10.10.1.1 → 10.10.1.2    TCP 83 8081 → 38090 [PSH, ACK] Seq=1973 Ack=1990 Win=65152 Len=17 TSval=3806049617 TSecr=1681789907
1712183962.147430658   965 0.678135609    10.10.1.2 → 10.10.1.1    TCP 83 38090 → 8081 [PSH, ACK] Seq=1990 Ack=1990 Win=64256 Len=17 TSval=1681789909 TSecr=3806049617
1712183963.147430658   966 0.678263302    10.10.1.1 → 10.10.1.2    TCP 83 8081 → 38090 [PSH, ACK] Seq=1990 Ack=2007 Win=65152 Len=17 TSval=3806049618 TSecr=1681789909
1712183968.147430658   971 0.679467539    10.10.1.2 → 10.10.1.1    TCP 83 38090 → 8081 [PSH, ACK] Seq=2007 Ack=2007 Win=64256 Len=17 TSval=1681789910 TSecr=3806049618
1712183970.147430658   973 0.679593167    10.10.1.1 → 10.10.1.2    TCP 83 8081 → 38090 [PSH, ACK] Seq=2007 Ack=2024 Win=65152 Len=17 TSval=3806049619 TSecr=1681789910
1712183976.147430658   979 0.680797818    10.10.1.2 → 10.10.1.1    TCP 83 38090 → 8081 [PSH, ACK] Seq=2024 Ack=2024 Win=64256 Len=17 TSval=1681789911 TSecr=3806049619
1712183978.147430658   981 0.680923425    10.10.1.1 → 10.10.1.2    TCP 83 8081 → 38090 [PSH, ACK] Seq=2024 Ack=2041 Win=65152 Len=17 TSval=3806049621 TSecr=1681789911
1712183984.147430658   987 0.682131726    10.10.1.2 → 10.10.1.1    TCP 83 38090 → 8081 [PSH, ACK] Seq=2041 Ack=2041 Win=64256 Len=17 TSval=1681789913 TSecr=3806049621
