1711548996.655812502    22 0.272838831    10.10.1.2 → 10.10.1.1    TCP 74 39932 → 8081 [SYN] Seq=0 Win=64240 Len=0 MSS=1460 SACK_PERM=1 TSval=1047767015 TSecr=0 WS=128
1711548997.655812502    23 0.272890831    10.10.1.1 → 10.10.1.2    TCP 74 8081 → 39932 [SYN, ACK] Seq=0 Ack=1 Win=65160 Len=0 MSS=1460 SACK_PERM=1 TSval=3172026726 TSecr=1047767015 WS=128
1711548998.655812502    24 0.272964285    10.10.1.2 → 10.10.1.1    TCP 66 39932 → 8081 [ACK] Seq=1 Ack=1 Win=64256 Len=0 TSval=1047767015 TSecr=3172026726
1711549008.655812502    34 0.531960449    10.10.1.2 → 10.10.1.1    TCP 83 39932 → 8081 [PSH, ACK] Seq=1 Ack=1 Win=64256 Len=17 TSval=1047767274 TSecr=3172026726
1711549009.655812502    35 0.531988116    10.10.1.1 → 10.10.1.2    TCP 66 8081 → 39932 [ACK] Seq=1 Ack=18 Win=65152 Len=0 TSval=3172026985 TSecr=1047767274
1711549012.655812502    38 0.532284037    10.10.1.1 → 10.10.1.2    TCP 83 8081 → 39932 [PSH, ACK] Seq=1 Ack=18 Win=65152 Len=17 TSval=3172026986 TSecr=1047767274
1711549013.655812502    39 0.532384865    10.10.1.2 → 10.10.1.1    TCP 66 39932 → 8081 [ACK] Seq=18 Ack=18 Win=64256 Len=0 TSval=1047767275 TSecr=3172026986
1711549018.655812502    44 0.542498553    10.10.1.2 → 10.10.1.1    TCP 83 39932 → 8081 [PSH, ACK] Seq=18 Ack=18 Win=64256 Len=17 TSval=1047767285 TSecr=3172026986
1711549021.655812502    47 0.542624381    10.10.1.1 → 10.10.1.2    TCP 83 8081 → 39932 [PSH, ACK] Seq=18 Ack=35 Win=65152 Len=17 TSval=3172026996 TSecr=1047767285
1711549026.655812502    52 0.552838946    10.10.1.2 → 10.10.1.1    TCP 83 39932 → 8081 [PSH, ACK] Seq=35 Ack=35 Win=64256 Len=17 TSval=1047767295 TSecr=3172026996
1711549029.655812502    55 0.552968575    10.10.1.1 → 10.10.1.2    TCP 83 8081 → 39932 [PSH, ACK] Seq=35 Ack=52 Win=65152 Len=17 TSval=3172027006 TSecr=1047767295
1711549034.655812502    60 0.563183368    10.10.1.2 → 10.10.1.1    TCP 83 39932 → 8081 [PSH, ACK] Seq=52 Ack=52 Win=64256 Len=17 TSval=1047767305 TSecr=3172027006
1711549037.655812502    63 0.563314490    10.10.1.1 → 10.10.1.2    TCP 83 8081 → 39932 [PSH, ACK] Seq=52 Ack=69 Win=65152 Len=17 TSval=3172027017 TSecr=1047767305
1711549042.655812502    68 0.573526247    10.10.1.2 → 10.10.1.1    TCP 83 39932 → 8081 [PSH, ACK] Seq=69 Ack=69 Win=64256 Len=17 TSval=1047767316 TSecr=3172027017
1711549045.655812502    71 0.573656513    10.10.1.1 → 10.10.1.2    TCP 83 8081 → 39932 [PSH, ACK] Seq=69 Ack=86 Win=65152 Len=17 TSval=3172027027 TSecr=1047767316
1711549050.655812502    76 0.583866311    10.10.1.2 → 10.10.1.1    TCP 83 39932 → 8081 [PSH, ACK] Seq=86 Ack=86 Win=64256 Len=17 TSval=1047767326 TSecr=3172027027
1711549052.655812502    78 0.583995985    10.10.1.1 → 10.10.1.2    TCP 83 8081 → 39932 [PSH, ACK] Seq=86 Ack=103 Win=65152 Len=17 TSval=3172027037 TSecr=1047767326
1711549058.655812502    84 0.594205514    10.10.1.2 → 10.10.1.1    TCP 83 39932 → 8081 [PSH, ACK] Seq=103 Ack=103 Win=64256 Len=17 TSval=1047767336 TSecr=3172027037
1711549060.655812502    86 0.594335645    10.10.1.1 → 10.10.1.2    TCP 83 8081 → 39932 [PSH, ACK] Seq=103 Ack=120 Win=65152 Len=17 TSval=3172027048 TSecr=1047767336
1711549066.655812502    92 0.604545181    10.10.1.2 → 10.10.1.1    TCP 83 39932 → 8081 [PSH, ACK] Seq=120 Ack=120 Win=64256 Len=17 TSval=1047767347 TSecr=3172027048
1711549068.655812502    94 0.604675763    10.10.1.1 → 10.10.1.2    TCP 83 8081 → 39932 [PSH, ACK] Seq=120 Ack=137 Win=65152 Len=17 TSval=3172027058 TSecr=1047767347
1711549074.655812502   100 0.614884594    10.10.1.2 → 10.10.1.1    TCP 83 39932 → 8081 [PSH, ACK] Seq=137 Ack=137 Win=64256 Len=17 TSval=1047767357 TSecr=3172027058
1711549076.655812502   102 0.615014619    10.10.1.1 → 10.10.1.2    TCP 83 8081 → 39932 [PSH, ACK] Seq=137 Ack=154 Win=65152 Len=17 TSval=3172027068 TSecr=1047767357
1711549082.655812502   108 0.625227123    10.10.1.2 → 10.10.1.1    TCP 83 39932 → 8081 [PSH, ACK] Seq=154 Ack=154 Win=64256 Len=17 TSval=1047767367 TSecr=3172027068
1711549084.655812502   110 0.625358807    10.10.1.1 → 10.10.1.2    TCP 83 8081 → 39932 [PSH, ACK] Seq=154 Ack=171 Win=65152 Len=17 TSval=3172027079 TSecr=1047767367
1711549090.655812502   116 0.635570532    10.10.1.2 → 10.10.1.1    TCP 83 39932 → 8081 [PSH, ACK] Seq=171 Ack=171 Win=64256 Len=17 TSval=1047767378 TSecr=3172027079
1711549092.655812502   118 0.635700448    10.10.1.1 → 10.10.1.2    TCP 83 8081 → 39932 [PSH, ACK] Seq=171 Ack=188 Win=65152 Len=17 TSval=3172027089 TSecr=1047767378
1711549098.655812502   124 0.645914319    10.10.1.2 → 10.10.1.1    TCP 83 39932 → 8081 [PSH, ACK] Seq=188 Ack=188 Win=64256 Len=17 TSval=1047767388 TSecr=3172027089
1711549100.655812502   126 0.646045162    10.10.1.1 → 10.10.1.2    TCP 83 8081 → 39932 [PSH, ACK] Seq=188 Ack=205 Win=65152 Len=17 TSval=3172027099 TSecr=1047767388
1711549106.655812502   132 0.656258330    10.10.1.2 → 10.10.1.1    TCP 83 39932 → 8081 [PSH, ACK] Seq=205 Ack=205 Win=64256 Len=17 TSval=1047767398 TSecr=3172027099
1711549108.655812502   134 0.656388684    10.10.1.1 → 10.10.1.2    TCP 83 8081 → 39932 [PSH, ACK] Seq=205 Ack=222 Win=65152 Len=17 TSval=3172027110 TSecr=1047767398
1711549114.655812502   140 0.666601023    10.10.1.2 → 10.10.1.1    TCP 83 39932 → 8081 [PSH, ACK] Seq=222 Ack=222 Win=64256 Len=17 TSval=1047767409 TSecr=3172027110
1711549116.655812502   142 0.666731171    10.10.1.1 → 10.10.1.2    TCP 83 8081 → 39932 [PSH, ACK] Seq=222 Ack=239 Win=65152 Len=17 TSval=3172027120 TSecr=1047767409
1711549122.655812502   148 0.676944590    10.10.1.2 → 10.10.1.1    TCP 83 39932 → 8081 [PSH, ACK] Seq=239 Ack=239 Win=64256 Len=17 TSval=1047767419 TSecr=3172027120
1711549124.655812502   150 0.677075779    10.10.1.1 → 10.10.1.2    TCP 83 8081 → 39932 [PSH, ACK] Seq=239 Ack=256 Win=65152 Len=17 TSval=3172027130 TSecr=1047767419
1711549130.655812502   156 0.687261800    10.10.1.2 → 10.10.1.1    TCP 83 39932 → 8081 [PSH, ACK] Seq=256 Ack=256 Win=64256 Len=17 TSval=1047767429 TSecr=3172027130
1711549132.655812502   158 0.687391765    10.10.1.1 → 10.10.1.2    TCP 83 8081 → 39932 [PSH, ACK] Seq=256 Ack=273 Win=65152 Len=17 TSval=3172027141 TSecr=1047767429
1711549138.655812502   164 0.697603317    10.10.1.2 → 10.10.1.1    TCP 83 39932 → 8081 [PSH, ACK] Seq=273 Ack=273 Win=64256 Len=17 TSval=1047767440 TSecr=3172027141
1711549140.655812502   166 0.697733992    10.10.1.1 → 10.10.1.2    TCP 83 8081 → 39932 [PSH, ACK] Seq=273 Ack=290 Win=65152 Len=17 TSval=3172027151 TSecr=1047767440
1711549146.655812502   172 0.707946129    10.10.1.2 → 10.10.1.1    TCP 83 39932 → 8081 [PSH, ACK] Seq=290 Ack=290 Win=64256 Len=17 TSval=1047767450 TSecr=3172027151
1711549148.655812502   174 0.708076418    10.10.1.1 → 10.10.1.2    TCP 83 8081 → 39932 [PSH, ACK] Seq=290 Ack=307 Win=65152 Len=17 TSval=3172027161 TSecr=1047767450
1711549154.655812502   180 0.718285991    10.10.1.2 → 10.10.1.1    TCP 83 39932 → 8081 [PSH, ACK] Seq=307 Ack=307 Win=64256 Len=17 TSval=1047767460 TSecr=3172027161
1711549156.655812502   182 0.718415705    10.10.1.1 → 10.10.1.2    TCP 83 8081 → 39932 [PSH, ACK] Seq=307 Ack=324 Win=65152 Len=17 TSval=3172027172 TSecr=1047767460
1711549162.655812502   188 0.728624815    10.10.1.2 → 10.10.1.1    TCP 83 39932 → 8081 [PSH, ACK] Seq=324 Ack=324 Win=64256 Len=17 TSval=1047767471 TSecr=3172027172
1711549164.655812502   190 0.728755676    10.10.1.1 → 10.10.1.2    TCP 83 8081 → 39932 [PSH, ACK] Seq=324 Ack=341 Win=65152 Len=17 TSval=3172027182 TSecr=1047767471
1711549170.655812502   196 0.738965800    10.10.1.2 → 10.10.1.1    TCP 83 39932 → 8081 [PSH, ACK] Seq=341 Ack=341 Win=64256 Len=17 TSval=1047767481 TSecr=3172027182
1711549172.655812502   198 0.739097063    10.10.1.1 → 10.10.1.2    TCP 83 8081 → 39932 [PSH, ACK] Seq=341 Ack=358 Win=65152 Len=17 TSval=3172027192 TSecr=1047767481
1711549178.655812502   204 0.749303532    10.10.1.2 → 10.10.1.1    TCP 83 39932 → 8081 [PSH, ACK] Seq=358 Ack=358 Win=64256 Len=17 TSval=1047767492 TSecr=3172027192
1711549180.655812502   206 0.749433859    10.10.1.1 → 10.10.1.2    TCP 83 8081 → 39932 [PSH, ACK] Seq=358 Ack=375 Win=65152 Len=17 TSval=3172027203 TSecr=1047767492
1711549186.655812502   212 0.759647008    10.10.1.2 → 10.10.1.1    TCP 83 39932 → 8081 [PSH, ACK] Seq=375 Ack=375 Win=64256 Len=17 TSval=1047767502 TSecr=3172027203
1711549188.655812502   214 0.759776815    10.10.1.1 → 10.10.1.2    TCP 83 8081 → 39932 [PSH, ACK] Seq=375 Ack=392 Win=65152 Len=17 TSval=3172027213 TSecr=1047767502
1711549194.655812502   220 0.769986371    10.10.1.2 → 10.10.1.1    TCP 83 39932 → 8081 [PSH, ACK] Seq=392 Ack=392 Win=64256 Len=17 TSval=1047767512 TSecr=3172027213
1711549196.655812502   222 0.770116944    10.10.1.1 → 10.10.1.2    TCP 83 8081 → 39932 [PSH, ACK] Seq=392 Ack=409 Win=65152 Len=17 TSval=3172027223 TSecr=1047767512
1711549203.655812502   229 0.780327274    10.10.1.2 → 10.10.1.1    TCP 83 39932 → 8081 [PSH, ACK] Seq=409 Ack=409 Win=64256 Len=17 TSval=1047767523 TSecr=3172027223
1711549204.655812502   230 0.780408194    10.10.1.1 → 10.10.1.2    TCP 83 8081 → 39932 [PSH, ACK] Seq=409 Ack=426 Win=65152 Len=17 TSval=3172027234 TSecr=1047767523
1711549210.655812502   236 0.790619360    10.10.1.2 → 10.10.1.1    TCP 83 39932 → 8081 [PSH, ACK] Seq=426 Ack=426 Win=64256 Len=17 TSval=1047767533 TSecr=3172027234
1711549212.655812502   238 0.790749456    10.10.1.1 → 10.10.1.2    TCP 83 8081 → 39932 [PSH, ACK] Seq=426 Ack=443 Win=65152 Len=17 TSval=3172027244 TSecr=1047767533
1711549219.655812502   245 0.800959491    10.10.1.2 → 10.10.1.1    TCP 83 39932 → 8081 [PSH, ACK] Seq=443 Ack=443 Win=64256 Len=17 TSval=1047767543 TSecr=3172027244
1711549221.655812502   247 0.801089022    10.10.1.1 → 10.10.1.2    TCP 83 8081 → 39932 [PSH, ACK] Seq=443 Ack=460 Win=65152 Len=17 TSval=3172027254 TSecr=1047767543
1711549227.655812502   253 0.811263765    10.10.1.2 → 10.10.1.1    TCP 83 39932 → 8081 [PSH, ACK] Seq=460 Ack=460 Win=64256 Len=17 TSval=1047767553 TSecr=3172027254
1711549229.655812502   255 0.811393660    10.10.1.1 → 10.10.1.2    TCP 83 8081 → 39932 [PSH, ACK] Seq=460 Ack=477 Win=65152 Len=17 TSval=3172027265 TSecr=1047767553
1711549235.655812502   261 0.821606939    10.10.1.2 → 10.10.1.1    TCP 83 39932 → 8081 [PSH, ACK] Seq=477 Ack=477 Win=64256 Len=17 TSval=1047767564 TSecr=3172027265
1711549237.655812502   263 0.821738318    10.10.1.1 → 10.10.1.2    TCP 83 8081 → 39932 [PSH, ACK] Seq=477 Ack=494 Win=65152 Len=17 TSval=3172027275 TSecr=1047767564
1711549243.655812502   269 0.831950627    10.10.1.2 → 10.10.1.1    TCP 83 39932 → 8081 [PSH, ACK] Seq=494 Ack=494 Win=64256 Len=17 TSval=1047767574 TSecr=3172027275
1711549245.655812502   271 0.832081625    10.10.1.1 → 10.10.1.2    TCP 83 8081 → 39932 [PSH, ACK] Seq=494 Ack=511 Win=65152 Len=17 TSval=3172027285 TSecr=1047767574
1711549251.655812502   277 0.842294740    10.10.1.2 → 10.10.1.1    TCP 83 39932 → 8081 [PSH, ACK] Seq=511 Ack=511 Win=64256 Len=17 TSval=1047767585 TSecr=3172027285
1711549253.655812502   279 0.842427473    10.10.1.1 → 10.10.1.2    TCP 83 8081 → 39932 [PSH, ACK] Seq=511 Ack=528 Win=65152 Len=17 TSval=3172027296 TSecr=1047767585
1711549259.655812502   285 0.852638386    10.10.1.2 → 10.10.1.1    TCP 83 39932 → 8081 [PSH, ACK] Seq=528 Ack=528 Win=64256 Len=17 TSval=1047767595 TSecr=3172027296
1711549261.655812502   287 0.852768988    10.10.1.1 → 10.10.1.2    TCP 83 8081 → 39932 [PSH, ACK] Seq=528 Ack=545 Win=65152 Len=17 TSval=3172027306 TSecr=1047767595
1711549267.655812502   293 0.862978610    10.10.1.2 → 10.10.1.1    TCP 83 39932 → 8081 [PSH, ACK] Seq=545 Ack=545 Win=64256 Len=17 TSval=1047767605 TSecr=3172027306
1711549269.655812502   295 0.863109481    10.10.1.1 → 10.10.1.2    TCP 83 8081 → 39932 [PSH, ACK] Seq=545 Ack=562 Win=65152 Len=17 TSval=3172027316 TSecr=1047767605
1711549275.655812502   301 0.873306203    10.10.1.2 → 10.10.1.1    TCP 83 39932 → 8081 [PSH, ACK] Seq=562 Ack=562 Win=64256 Len=17 TSval=1047767616 TSecr=3172027316
1711549277.655812502   303 0.873437788    10.10.1.1 → 10.10.1.2    TCP 83 8081 → 39932 [PSH, ACK] Seq=562 Ack=579 Win=65152 Len=17 TSval=3172027327 TSecr=1047767616
1711549283.655812502   309 0.883646847    10.10.1.2 → 10.10.1.1    TCP 83 39932 → 8081 [PSH, ACK] Seq=579 Ack=579 Win=64256 Len=17 TSval=1047767626 TSecr=3172027327
1711549285.655812502   311 0.883776215    10.10.1.1 → 10.10.1.2    TCP 83 8081 → 39932 [PSH, ACK] Seq=579 Ack=596 Win=65152 Len=17 TSval=3172027337 TSecr=1047767626
1711549291.655812502   317 0.893985248    10.10.1.2 → 10.10.1.1    TCP 83 39932 → 8081 [PSH, ACK] Seq=596 Ack=596 Win=64256 Len=17 TSval=1047767636 TSecr=3172027337
1711549293.655812502   319 0.894115910    10.10.1.1 → 10.10.1.2    TCP 83 8081 → 39932 [PSH, ACK] Seq=596 Ack=613 Win=65152 Len=17 TSval=3172027347 TSecr=1047767636
1711549300.655812502   326 0.904324888    10.10.1.2 → 10.10.1.1    TCP 83 39932 → 8081 [PSH, ACK] Seq=613 Ack=613 Win=64256 Len=17 TSval=1047767647 TSecr=3172027347
1711549302.655812502   328 0.904454926    10.10.1.1 → 10.10.1.2    TCP 83 8081 → 39932 [PSH, ACK] Seq=613 Ack=630 Win=65152 Len=17 TSval=3172027358 TSecr=1047767647
1711549307.655812502   333 0.914664538    10.10.1.2 → 10.10.1.1    TCP 83 39932 → 8081 [PSH, ACK] Seq=630 Ack=630 Win=64256 Len=17 TSval=1047767657 TSecr=3172027358
1711549309.655812502   335 0.914794219    10.10.1.1 → 10.10.1.2    TCP 83 8081 → 39932 [PSH, ACK] Seq=630 Ack=647 Win=65152 Len=17 TSval=3172027368 TSecr=1047767657
1711549315.655812502   341 0.925003279    10.10.1.2 → 10.10.1.1    TCP 83 39932 → 8081 [PSH, ACK] Seq=647 Ack=647 Win=64256 Len=17 TSval=1047767667 TSecr=3172027368
1711549317.655812502   343 0.925133566    10.10.1.1 → 10.10.1.2    TCP 83 8081 → 39932 [PSH, ACK] Seq=647 Ack=664 Win=65152 Len=17 TSval=3172027379 TSecr=1047767667
1711549323.655812502   349 0.935342730    10.10.1.2 → 10.10.1.1    TCP 83 39932 → 8081 [PSH, ACK] Seq=664 Ack=664 Win=64256 Len=17 TSval=1047767678 TSecr=3172027379
1711549325.655812502   351 0.935472578    10.10.1.1 → 10.10.1.2    TCP 83 8081 → 39932 [PSH, ACK] Seq=664 Ack=681 Win=65152 Len=17 TSval=3172027389 TSecr=1047767678
1711549331.655812502   357 0.945683956    10.10.1.2 → 10.10.1.1    TCP 83 39932 → 8081 [PSH, ACK] Seq=681 Ack=681 Win=64256 Len=17 TSval=1047767688 TSecr=3172027389
1711549333.655812502   359 0.945814651    10.10.1.1 → 10.10.1.2    TCP 83 8081 → 39932 [PSH, ACK] Seq=681 Ack=698 Win=65152 Len=17 TSval=3172027399 TSecr=1047767688
1711549339.655812502   365 0.956027047    10.10.1.2 → 10.10.1.1    TCP 83 39932 → 8081 [PSH, ACK] Seq=698 Ack=698 Win=64256 Len=17 TSval=1047767698 TSecr=3172027399
1711549342.655812502   368 0.956195209    10.10.1.1 → 10.10.1.2    TCP 83 8081 → 39932 [PSH, ACK] Seq=698 Ack=715 Win=65152 Len=17 TSval=3172027410 TSecr=1047767698
1711549347.655812502   373 0.966406446    10.10.1.2 → 10.10.1.1    TCP 83 39932 → 8081 [PSH, ACK] Seq=715 Ack=715 Win=64256 Len=17 TSval=1047767709 TSecr=3172027410
1711549349.655812502   375 0.966536452    10.10.1.1 → 10.10.1.2    TCP 83 8081 → 39932 [PSH, ACK] Seq=715 Ack=732 Win=65152 Len=17 TSval=3172027420 TSecr=1047767709
1711549355.655812502   381 0.976746405    10.10.1.2 → 10.10.1.1    TCP 83 39932 → 8081 [PSH, ACK] Seq=732 Ack=732 Win=64256 Len=17 TSval=1047767719 TSecr=3172027420
1711549357.655812502   383 0.976876026    10.10.1.1 → 10.10.1.2    TCP 83 8081 → 39932 [PSH, ACK] Seq=732 Ack=749 Win=65152 Len=17 TSval=3172027430 TSecr=1047767719
1711549363.655812502   389 0.987085012    10.10.1.2 → 10.10.1.1    TCP 83 39932 → 8081 [PSH, ACK] Seq=749 Ack=749 Win=64256 Len=17 TSval=1047767729 TSecr=3172027430
1711549365.655812502   391 0.987214583    10.10.1.1 → 10.10.1.2    TCP 83 8081 → 39932 [PSH, ACK] Seq=749 Ack=766 Win=65152 Len=17 TSval=3172027441 TSecr=1047767729
1711549371.655812502   397 0.997424066    10.10.1.2 → 10.10.1.1    TCP 83 39932 → 8081 [PSH, ACK] Seq=766 Ack=766 Win=64256 Len=17 TSval=1047767740 TSecr=3172027441
1711549373.655812502   399 0.997553947    10.10.1.1 → 10.10.1.2    TCP 83 8081 → 39932 [PSH, ACK] Seq=766 Ack=783 Win=65152 Len=17 TSval=3172027451 TSecr=1047767740
1711549379.655812502   405 1.007763252    10.10.1.2 → 10.10.1.1    TCP 83 39932 → 8081 [PSH, ACK] Seq=783 Ack=783 Win=64256 Len=17 TSval=1047767750 TSecr=3172027451
1711549381.655812502   407 1.007894510    10.10.1.1 → 10.10.1.2    TCP 83 8081 → 39932 [PSH, ACK] Seq=783 Ack=800 Win=65152 Len=17 TSval=3172027461 TSecr=1047767750
1711549387.655812502   413 1.018105622    10.10.1.2 → 10.10.1.1    TCP 83 39932 → 8081 [PSH, ACK] Seq=800 Ack=800 Win=64256 Len=17 TSval=1047767760 TSecr=3172027461
1711549389.655812502   415 1.018235335    10.10.1.1 → 10.10.1.2    TCP 83 8081 → 39932 [PSH, ACK] Seq=800 Ack=817 Win=65152 Len=17 TSval=3172027472 TSecr=1047767760
1711549395.655812502   421 1.028444060    10.10.1.2 → 10.10.1.1    TCP 83 39932 → 8081 [PSH, ACK] Seq=817 Ack=817 Win=64256 Len=17 TSval=1047767771 TSecr=3172027472
1711549397.655812502   423 1.028574162    10.10.1.1 → 10.10.1.2    TCP 83 8081 → 39932 [PSH, ACK] Seq=817 Ack=834 Win=65152 Len=17 TSval=3172027482 TSecr=1047767771
1711549403.655812502   429 1.038783613    10.10.1.2 → 10.10.1.1    TCP 83 39932 → 8081 [PSH, ACK] Seq=834 Ack=834 Win=64256 Len=17 TSval=1047767781 TSecr=3172027482
1711549405.655812502   431 1.038913603    10.10.1.1 → 10.10.1.2    TCP 83 8081 → 39932 [PSH, ACK] Seq=834 Ack=851 Win=65152 Len=17 TSval=3172027492 TSecr=1047767781
1711549411.655812502   437 1.049137290    10.10.1.2 → 10.10.1.1    TCP 83 39932 → 8081 [PSH, ACK] Seq=851 Ack=851 Win=64256 Len=17 TSval=1047767791 TSecr=3172027492
1711549413.655812502   439 1.049267612    10.10.1.1 → 10.10.1.2    TCP 83 8081 → 39932 [PSH, ACK] Seq=851 Ack=868 Win=65152 Len=17 TSval=3172027503 TSecr=1047767791
1711549419.655812502   445 1.059478846    10.10.1.2 → 10.10.1.1    TCP 83 39932 → 8081 [PSH, ACK] Seq=868 Ack=868 Win=64256 Len=17 TSval=1047767802 TSecr=3172027503
1711549421.655812502   447 1.059608655    10.10.1.1 → 10.10.1.2    TCP 83 8081 → 39932 [PSH, ACK] Seq=868 Ack=885 Win=65152 Len=17 TSval=3172027513 TSecr=1047767802
1711549427.655812502   453 1.069820877    10.10.1.2 → 10.10.1.1    TCP 83 39932 → 8081 [PSH, ACK] Seq=885 Ack=885 Win=64256 Len=17 TSval=1047767812 TSecr=3172027513
1711549429.655812502   455 1.069951586    10.10.1.1 → 10.10.1.2    TCP 83 8081 → 39932 [PSH, ACK] Seq=885 Ack=902 Win=65152 Len=17 TSval=3172027523 TSecr=1047767812
1711549435.655812502   461 1.080163294    10.10.1.2 → 10.10.1.1    TCP 83 39932 → 8081 [PSH, ACK] Seq=902 Ack=902 Win=64256 Len=17 TSval=1047767822 TSecr=3172027523
1711549437.655812502   463 1.080293203    10.10.1.1 → 10.10.1.2    TCP 83 8081 → 39932 [PSH, ACK] Seq=902 Ack=919 Win=65152 Len=17 TSval=3172027534 TSecr=1047767822
1711549443.655812502   469 1.090502192    10.10.1.2 → 10.10.1.1    TCP 83 39932 → 8081 [PSH, ACK] Seq=919 Ack=919 Win=64256 Len=17 TSval=1047767833 TSecr=3172027534
1711549445.655812502   471 1.090632190    10.10.1.1 → 10.10.1.2    TCP 83 8081 → 39932 [PSH, ACK] Seq=919 Ack=936 Win=65152 Len=17 TSval=3172027544 TSecr=1047767833
1711549451.655812502   477 1.100842921    10.10.1.2 → 10.10.1.1    TCP 83 39932 → 8081 [PSH, ACK] Seq=936 Ack=936 Win=64256 Len=17 TSval=1047767843 TSecr=3172027544
1711549453.655812502   479 1.100973159    10.10.1.1 → 10.10.1.2    TCP 83 8081 → 39932 [PSH, ACK] Seq=936 Ack=953 Win=65152 Len=17 TSval=3172027554 TSecr=1047767843
1711549459.655812502   485 1.111185232    10.10.1.2 → 10.10.1.1    TCP 83 39932 → 8081 [PSH, ACK] Seq=953 Ack=953 Win=64256 Len=17 TSval=1047767853 TSecr=3172027554
1711549462.655812502   488 1.111621728    10.10.1.1 → 10.10.1.2    TCP 83 8081 → 39932 [PSH, ACK] Seq=953 Ack=970 Win=65152 Len=17 TSval=3172027565 TSecr=1047767853
1711549467.655812502   493 1.121831364    10.10.1.2 → 10.10.1.1    TCP 83 39932 → 8081 [PSH, ACK] Seq=970 Ack=970 Win=64256 Len=17 TSval=1047767864 TSecr=3172027565
1711549469.655812502   495 1.121960658    10.10.1.1 → 10.10.1.2    TCP 83 8081 → 39932 [PSH, ACK] Seq=970 Ack=987 Win=65152 Len=17 TSval=3172027575 TSecr=1047767864
1711549475.655812502   501 1.132173270    10.10.1.2 → 10.10.1.1    TCP 83 39932 → 8081 [PSH, ACK] Seq=987 Ack=987 Win=64256 Len=17 TSval=1047767874 TSecr=3172027575
1711549477.655812502   503 1.132306902    10.10.1.1 → 10.10.1.2    TCP 83 8081 → 39932 [PSH, ACK] Seq=987 Ack=1004 Win=65152 Len=17 TSval=3172027586 TSecr=1047767874
1711549483.655812502   509 1.142517118    10.10.1.2 → 10.10.1.1    TCP 83 39932 → 8081 [PSH, ACK] Seq=1004 Ack=1004 Win=64256 Len=17 TSval=1047767885 TSecr=3172027586
1711549485.655812502   511 1.142647309    10.10.1.1 → 10.10.1.2    TCP 83 8081 → 39932 [PSH, ACK] Seq=1004 Ack=1021 Win=65152 Len=17 TSval=3172027596 TSecr=1047767885
1711549491.655812502   517 1.152858194    10.10.1.2 → 10.10.1.1    TCP 83 39932 → 8081 [PSH, ACK] Seq=1021 Ack=1021 Win=64256 Len=17 TSval=1047767895 TSecr=3172027596
1711549493.655812502   519 1.152987636    10.10.1.1 → 10.10.1.2    TCP 83 8081 → 39932 [PSH, ACK] Seq=1021 Ack=1038 Win=65152 Len=17 TSval=3172027606 TSecr=1047767895
1711549499.655812502   525 1.163199080    10.10.1.2 → 10.10.1.1    TCP 83 39932 → 8081 [PSH, ACK] Seq=1038 Ack=1038 Win=64256 Len=17 TSval=1047767905 TSecr=3172027606
1711549501.655812502   527 1.163330849    10.10.1.1 → 10.10.1.2    TCP 83 8081 → 39932 [PSH, ACK] Seq=1038 Ack=1055 Win=65152 Len=17 TSval=3172027617 TSecr=1047767905
1711549507.655812502   533 1.173541887    10.10.1.2 → 10.10.1.1    TCP 83 39932 → 8081 [PSH, ACK] Seq=1055 Ack=1055 Win=64256 Len=17 TSval=1047767916 TSecr=3172027617
1711549509.655812502   535 1.173673290    10.10.1.1 → 10.10.1.2    TCP 83 8081 → 39932 [PSH, ACK] Seq=1055 Ack=1072 Win=65152 Len=17 TSval=3172027627 TSecr=1047767916
1711549515.655812502   541 1.183883823    10.10.1.2 → 10.10.1.1    TCP 83 39932 → 8081 [PSH, ACK] Seq=1072 Ack=1072 Win=64256 Len=17 TSval=1047767926 TSecr=3172027627
1711549517.655812502   543 1.184013757    10.10.1.1 → 10.10.1.2    TCP 83 8081 → 39932 [PSH, ACK] Seq=1072 Ack=1089 Win=65152 Len=17 TSval=3172027637 TSecr=1047767926
1711549523.655812502   549 1.194222938    10.10.1.2 → 10.10.1.1    TCP 83 39932 → 8081 [PSH, ACK] Seq=1089 Ack=1089 Win=64256 Len=17 TSval=1047767936 TSecr=3172027637
1711549525.655812502   551 1.194352167    10.10.1.1 → 10.10.1.2    TCP 83 8081 → 39932 [PSH, ACK] Seq=1089 Ack=1106 Win=65152 Len=17 TSval=3172027648 TSecr=1047767936
1711549531.655812502   557 1.204565199    10.10.1.2 → 10.10.1.1    TCP 83 39932 → 8081 [PSH, ACK] Seq=1106 Ack=1106 Win=64256 Len=17 TSval=1047767947 TSecr=3172027648
1711549533.655812502   559 1.204654190    10.10.1.1 → 10.10.1.2    TCP 83 8081 → 39932 [PSH, ACK] Seq=1106 Ack=1123 Win=65152 Len=17 TSval=3172027658 TSecr=1047767947
1711549539.655812502   565 1.214862378    10.10.1.2 → 10.10.1.1    TCP 83 39932 → 8081 [PSH, ACK] Seq=1123 Ack=1123 Win=64256 Len=17 TSval=1047767957 TSecr=3172027658
1711549541.655812502   567 1.214992260    10.10.1.1 → 10.10.1.2    TCP 83 8081 → 39932 [PSH, ACK] Seq=1123 Ack=1140 Win=65152 Len=17 TSval=3172027668 TSecr=1047767957
1711549547.655812502   573 1.225212765    10.10.1.2 → 10.10.1.1    TCP 83 39932 → 8081 [PSH, ACK] Seq=1140 Ack=1140 Win=64256 Len=17 TSval=1047767967 TSecr=3172027668
1711549549.655812502   575 1.225342178    10.10.1.1 → 10.10.1.2    TCP 83 8081 → 39932 [PSH, ACK] Seq=1140 Ack=1157 Win=65152 Len=17 TSval=3172027679 TSecr=1047767967
1711549555.655812502   581 1.235551093    10.10.1.2 → 10.10.1.1    TCP 83 39932 → 8081 [PSH, ACK] Seq=1157 Ack=1157 Win=64256 Len=17 TSval=1047767978 TSecr=3172027679
1711549557.655812502   583 1.235680358    10.10.1.1 → 10.10.1.2    TCP 83 8081 → 39932 [PSH, ACK] Seq=1157 Ack=1174 Win=65152 Len=17 TSval=3172027689 TSecr=1047767978
1711549563.655812502   589 1.245890127    10.10.1.2 → 10.10.1.1    TCP 83 39932 → 8081 [PSH, ACK] Seq=1174 Ack=1174 Win=64256 Len=17 TSval=1047767988 TSecr=3172027689
1711549565.655812502   591 1.246020072    10.10.1.1 → 10.10.1.2    TCP 83 8081 → 39932 [PSH, ACK] Seq=1174 Ack=1191 Win=65152 Len=17 TSval=3172027699 TSecr=1047767988
1711549572.655812502   598 1.256229294    10.10.1.2 → 10.10.1.1    TCP 83 39932 → 8081 [PSH, ACK] Seq=1191 Ack=1191 Win=64256 Len=17 TSval=1047767998 TSecr=3172027699
1711549573.655812502   599 1.256318630    10.10.1.1 → 10.10.1.2    TCP 83 8081 → 39932 [PSH, ACK] Seq=1191 Ack=1208 Win=65152 Len=17 TSval=3172027710 TSecr=1047767998
1711549579.655812502   605 1.266526644    10.10.1.2 → 10.10.1.1    TCP 83 39932 → 8081 [PSH, ACK] Seq=1208 Ack=1208 Win=64256 Len=17 TSval=1047768009 TSecr=3172027710
1711549581.655812502   607 1.266658051    10.10.1.1 → 10.10.1.2    TCP 83 8081 → 39932 [PSH, ACK] Seq=1208 Ack=1225 Win=65152 Len=17 TSval=3172027720 TSecr=1047768009
1711549587.655812502   613 1.276870272    10.10.1.2 → 10.10.1.1    TCP 83 39932 → 8081 [PSH, ACK] Seq=1225 Ack=1225 Win=64256 Len=17 TSval=1047768019 TSecr=3172027720
1711549589.655812502   615 1.277000464    10.10.1.1 → 10.10.1.2    TCP 83 8081 → 39932 [PSH, ACK] Seq=1225 Ack=1242 Win=65152 Len=17 TSval=3172027730 TSecr=1047768019
1711549595.655812502   621 1.287211024    10.10.1.2 → 10.10.1.1    TCP 83 39932 → 8081 [PSH, ACK] Seq=1242 Ack=1242 Win=64256 Len=17 TSval=1047768029 TSecr=3172027730
1711549597.655812502   623 1.287297728    10.10.1.1 → 10.10.1.2    TCP 83 8081 → 39932 [PSH, ACK] Seq=1242 Ack=1259 Win=65152 Len=17 TSval=3172027741 TSecr=1047768029
1711549603.655812502   629 1.297460780    10.10.1.2 → 10.10.1.1    TCP 83 39932 → 8081 [PSH, ACK] Seq=1259 Ack=1259 Win=64256 Len=17 TSval=1047768040 TSecr=3172027741
1711549605.655812502   631 1.297591022    10.10.1.1 → 10.10.1.2    TCP 83 8081 → 39932 [PSH, ACK] Seq=1259 Ack=1276 Win=65152 Len=17 TSval=3172027751 TSecr=1047768040
1711549611.655812502   637 1.307799591    10.10.1.2 → 10.10.1.1    TCP 83 39932 → 8081 [PSH, ACK] Seq=1276 Ack=1276 Win=64256 Len=17 TSval=1047768050 TSecr=3172027751
1711549613.655812502   639 1.307929048    10.10.1.1 → 10.10.1.2    TCP 83 8081 → 39932 [PSH, ACK] Seq=1276 Ack=1293 Win=65152 Len=17 TSval=3172027761 TSecr=1047768050
1711549619.655812502   645 1.318137034    10.10.1.2 → 10.10.1.1    TCP 83 39932 → 8081 [PSH, ACK] Seq=1293 Ack=1293 Win=64256 Len=17 TSval=1047768060 TSecr=3172027761
1711549621.655812502   647 1.318268671    10.10.1.1 → 10.10.1.2    TCP 83 8081 → 39932 [PSH, ACK] Seq=1293 Ack=1310 Win=65152 Len=17 TSval=3172027772 TSecr=1047768060
1711549627.655812502   653 1.328478217    10.10.1.2 → 10.10.1.1    TCP 83 39932 → 8081 [PSH, ACK] Seq=1310 Ack=1310 Win=64256 Len=17 TSval=1047768071 TSecr=3172027772
1711549629.655812502   655 1.328609342    10.10.1.1 → 10.10.1.2    TCP 83 8081 → 39932 [PSH, ACK] Seq=1310 Ack=1327 Win=65152 Len=17 TSval=3172027782 TSecr=1047768071
1711549635.655812502   661 1.338820147    10.10.1.2 → 10.10.1.1    TCP 83 39932 → 8081 [PSH, ACK] Seq=1327 Ack=1327 Win=64256 Len=17 TSval=1047768081 TSecr=3172027782
1711549637.655812502   663 1.338951330    10.10.1.1 → 10.10.1.2    TCP 83 8081 → 39932 [PSH, ACK] Seq=1327 Ack=1344 Win=65152 Len=17 TSval=3172027792 TSecr=1047768081
1711549643.655812502   669 1.349177198    10.10.1.2 → 10.10.1.1    TCP 83 39932 → 8081 [PSH, ACK] Seq=1344 Ack=1344 Win=64256 Len=17 TSval=1047768091 TSecr=3172027792
1711549645.655812502   671 1.349306933    10.10.1.1 → 10.10.1.2    TCP 83 8081 → 39932 [PSH, ACK] Seq=1344 Ack=1361 Win=65152 Len=17 TSval=3172027803 TSecr=1047768091
1711549651.655812502   677 1.359516242    10.10.1.2 → 10.10.1.1    TCP 83 39932 → 8081 [PSH, ACK] Seq=1361 Ack=1361 Win=64256 Len=17 TSval=1047768102 TSecr=3172027803
1711549653.655812502   679 1.359646128    10.10.1.1 → 10.10.1.2    TCP 83 8081 → 39932 [PSH, ACK] Seq=1361 Ack=1378 Win=65152 Len=17 TSval=3172027813 TSecr=1047768102
1711549659.655812502   685 1.369857335    10.10.1.2 → 10.10.1.1    TCP 83 39932 → 8081 [PSH, ACK] Seq=1378 Ack=1378 Win=64256 Len=17 TSval=1047768112 TSecr=3172027813
1711549661.655812502   687 1.369988287    10.10.1.1 → 10.10.1.2    TCP 83 8081 → 39932 [PSH, ACK] Seq=1378 Ack=1395 Win=65152 Len=17 TSval=3172027823 TSecr=1047768112
1711549667.655812502   693 1.380200157    10.10.1.2 → 10.10.1.1    TCP 83 39932 → 8081 [PSH, ACK] Seq=1395 Ack=1395 Win=64256 Len=17 TSval=1047768122 TSecr=3172027823
1711549669.655812502   695 1.380329664    10.10.1.1 → 10.10.1.2    TCP 83 8081 → 39932 [PSH, ACK] Seq=1395 Ack=1412 Win=65152 Len=17 TSval=3172027834 TSecr=1047768122
1711549675.655812502   701 1.390539756    10.10.1.2 → 10.10.1.1    TCP 83 39932 → 8081 [PSH, ACK] Seq=1412 Ack=1412 Win=64256 Len=17 TSval=1047768133 TSecr=3172027834
1711549677.655812502   703 1.390669735    10.10.1.1 → 10.10.1.2    TCP 83 8081 → 39932 [PSH, ACK] Seq=1412 Ack=1429 Win=65152 Len=17 TSval=3172027844 TSecr=1047768133
1711549683.655812502   709 1.400879670    10.10.1.2 → 10.10.1.1    TCP 83 39932 → 8081 [PSH, ACK] Seq=1429 Ack=1429 Win=64256 Len=17 TSval=1047768143 TSecr=3172027844
1711549685.655812502   711 1.401010498    10.10.1.1 → 10.10.1.2    TCP 83 8081 → 39932 [PSH, ACK] Seq=1429 Ack=1446 Win=65152 Len=17 TSval=3172027854 TSecr=1047768143
1711549691.655812502   717 1.411219054    10.10.1.2 → 10.10.1.1    TCP 83 39932 → 8081 [PSH, ACK] Seq=1446 Ack=1446 Win=64256 Len=17 TSval=1047768153 TSecr=3172027854
1711549693.655812502   719 1.411348536    10.10.1.1 → 10.10.1.2    TCP 83 8081 → 39932 [PSH, ACK] Seq=1446 Ack=1463 Win=65152 Len=17 TSval=3172027865 TSecr=1047768153
1711549699.655812502   725 1.421559285    10.10.1.2 → 10.10.1.1    TCP 83 39932 → 8081 [PSH, ACK] Seq=1463 Ack=1463 Win=64256 Len=17 TSval=1047768164 TSecr=3172027865
1711549701.655812502   727 1.421689250    10.10.1.1 → 10.10.1.2    TCP 83 8081 → 39932 [PSH, ACK] Seq=1463 Ack=1480 Win=65152 Len=17 TSval=3172027875 TSecr=1047768164
1711549707.655812502   733 1.431898104    10.10.1.2 → 10.10.1.1    TCP 83 39932 → 8081 [PSH, ACK] Seq=1480 Ack=1480 Win=64256 Len=17 TSval=1047768174 TSecr=3172027875
1711549709.655812502   735 1.432029509    10.10.1.1 → 10.10.1.2    TCP 83 8081 → 39932 [PSH, ACK] Seq=1480 Ack=1497 Win=65152 Len=17 TSval=3172027885 TSecr=1047768174
1711549715.655812502   741 1.442242248    10.10.1.2 → 10.10.1.1    TCP 83 39932 → 8081 [PSH, ACK] Seq=1497 Ack=1497 Win=64256 Len=17 TSval=1047768184 TSecr=3172027885
1711549717.655812502   743 1.442376804    10.10.1.1 → 10.10.1.2    TCP 83 8081 → 39932 [PSH, ACK] Seq=1497 Ack=1514 Win=65152 Len=17 TSval=3172027896 TSecr=1047768184
1711549723.655812502   749 1.452585202    10.10.1.2 → 10.10.1.1    TCP 83 39932 → 8081 [PSH, ACK] Seq=1514 Ack=1514 Win=64256 Len=17 TSval=1047768195 TSecr=3172027896
1711549725.655812502   751 1.452715761    10.10.1.1 → 10.10.1.2    TCP 83 8081 → 39932 [PSH, ACK] Seq=1514 Ack=1531 Win=65152 Len=17 TSval=3172027906 TSecr=1047768195
1711549731.655812502   757 1.462926453    10.10.1.2 → 10.10.1.1    TCP 83 39932 → 8081 [PSH, ACK] Seq=1531 Ack=1531 Win=64256 Len=17 TSval=1047768205 TSecr=3172027906
1711549733.655812502   759 1.463056405    10.10.1.1 → 10.10.1.2    TCP 83 8081 → 39932 [PSH, ACK] Seq=1531 Ack=1548 Win=65152 Len=17 TSval=3172027916 TSecr=1047768205
1711549739.655812502   765 1.473280868    10.10.1.2 → 10.10.1.1    TCP 83 39932 → 8081 [PSH, ACK] Seq=1548 Ack=1548 Win=64256 Len=17 TSval=1047768215 TSecr=3172027916
1711549741.655812502   767 1.473410785    10.10.1.1 → 10.10.1.2    TCP 83 8081 → 39932 [PSH, ACK] Seq=1548 Ack=1565 Win=65152 Len=17 TSval=3172027927 TSecr=1047768215
1711549747.655812502   773 1.483621102    10.10.1.2 → 10.10.1.1    TCP 83 39932 → 8081 [PSH, ACK] Seq=1565 Ack=1565 Win=64256 Len=17 TSval=1047768226 TSecr=3172027927
1711549749.655812502   775 1.483752198    10.10.1.1 → 10.10.1.2    TCP 83 8081 → 39932 [PSH, ACK] Seq=1565 Ack=1582 Win=65152 Len=17 TSval=3172027937 TSecr=1047768226
1711549755.655812502   781 1.493969058    10.10.1.2 → 10.10.1.1    TCP 83 39932 → 8081 [PSH, ACK] Seq=1582 Ack=1582 Win=64256 Len=17 TSval=1047768236 TSecr=3172027937
1711549757.655812502   783 1.494100206    10.10.1.1 → 10.10.1.2    TCP 83 8081 → 39932 [PSH, ACK] Seq=1582 Ack=1599 Win=65152 Len=17 TSval=3172027947 TSecr=1047768236
1711549763.655812502   789 1.504308659    10.10.1.2 → 10.10.1.1    TCP 83 39932 → 8081 [PSH, ACK] Seq=1599 Ack=1599 Win=64256 Len=17 TSval=1047768247 TSecr=3172027947
1711549765.655812502   791 1.504438489    10.10.1.1 → 10.10.1.2    TCP 83 8081 → 39932 [PSH, ACK] Seq=1599 Ack=1616 Win=65152 Len=17 TSval=3172027958 TSecr=1047768247
1711549771.655812502   797 1.514648036    10.10.1.2 → 10.10.1.1    TCP 83 39932 → 8081 [PSH, ACK] Seq=1616 Ack=1616 Win=64256 Len=17 TSval=1047768257 TSecr=3172027958
1711549773.655812502   799 1.514777809    10.10.1.1 → 10.10.1.2    TCP 83 8081 → 39932 [PSH, ACK] Seq=1616 Ack=1633 Win=65152 Len=17 TSval=3172027968 TSecr=1047768257
1711549779.655812502   805 1.524986210    10.10.1.2 → 10.10.1.1    TCP 83 39932 → 8081 [PSH, ACK] Seq=1633 Ack=1633 Win=64256 Len=17 TSval=1047768267 TSecr=3172027968
1711549781.655812502   807 1.525116782    10.10.1.1 → 10.10.1.2    TCP 83 8081 → 39932 [PSH, ACK] Seq=1633 Ack=1650 Win=65152 Len=17 TSval=3172027978 TSecr=1047768267
1711549787.655812502   813 1.535325531    10.10.1.2 → 10.10.1.1    TCP 83 39932 → 8081 [PSH, ACK] Seq=1650 Ack=1650 Win=64256 Len=17 TSval=1047768278 TSecr=3172027978
1711549789.655812502   815 1.535455638    10.10.1.1 → 10.10.1.2    TCP 83 8081 → 39932 [PSH, ACK] Seq=1650 Ack=1667 Win=65152 Len=17 TSval=3172027989 TSecr=1047768278
1711549795.655812502   821 1.545666509    10.10.1.2 → 10.10.1.1    TCP 83 39932 → 8081 [PSH, ACK] Seq=1667 Ack=1667 Win=64256 Len=17 TSval=1047768288 TSecr=3172027989
1711549797.655812502   823 1.545796851    10.10.1.1 → 10.10.1.2    TCP 83 8081 → 39932 [PSH, ACK] Seq=1667 Ack=1684 Win=65152 Len=17 TSval=3172027999 TSecr=1047768288
1711549803.655812502   829 1.556005765    10.10.1.2 → 10.10.1.1    TCP 83 39932 → 8081 [PSH, ACK] Seq=1684 Ack=1684 Win=64256 Len=17 TSval=1047768298 TSecr=3172027999
1711549805.655812502   831 1.556161887    10.10.1.1 → 10.10.1.2    TCP 83 8081 → 39932 [PSH, ACK] Seq=1684 Ack=1701 Win=65152 Len=17 TSval=3172028010 TSecr=1047768298
1711549811.655812502   837 1.566374996    10.10.1.2 → 10.10.1.1    TCP 83 39932 → 8081 [PSH, ACK] Seq=1701 Ack=1701 Win=64256 Len=17 TSval=1047768309 TSecr=3172028010
1711549813.655812502   839 1.566506004    10.10.1.1 → 10.10.1.2    TCP 83 8081 → 39932 [PSH, ACK] Seq=1701 Ack=1718 Win=65152 Len=17 TSval=3172028020 TSecr=1047768309
1711549819.655812502   845 1.576717674    10.10.1.2 → 10.10.1.1    TCP 83 39932 → 8081 [PSH, ACK] Seq=1718 Ack=1718 Win=64256 Len=17 TSval=1047768319 TSecr=3172028020
1711549821.655812502   847 1.576848168    10.10.1.1 → 10.10.1.2    TCP 83 8081 → 39932 [PSH, ACK] Seq=1718 Ack=1735 Win=65152 Len=17 TSval=3172028030 TSecr=1047768319
1711549827.655812502   853 1.587060437    10.10.1.2 → 10.10.1.1    TCP 83 39932 → 8081 [PSH, ACK] Seq=1735 Ack=1735 Win=64256 Len=17 TSval=1047768329 TSecr=3172028030
1711549829.655812502   855 1.587190459    10.10.1.1 → 10.10.1.2    TCP 83 8081 → 39932 [PSH, ACK] Seq=1735 Ack=1752 Win=65152 Len=17 TSval=3172028041 TSecr=1047768329
1711549835.655812502   861 1.597400638    10.10.1.2 → 10.10.1.1    TCP 83 39932 → 8081 [PSH, ACK] Seq=1752 Ack=1752 Win=64256 Len=17 TSval=1047768340 TSecr=3172028041
1711549837.655812502   863 1.597532264    10.10.1.1 → 10.10.1.2    TCP 83 8081 → 39932 [PSH, ACK] Seq=1752 Ack=1769 Win=65152 Len=17 TSval=3172028051 TSecr=1047768340
1711549843.655812502   869 1.607739211    10.10.1.2 → 10.10.1.1    TCP 83 39932 → 8081 [PSH, ACK] Seq=1769 Ack=1769 Win=64256 Len=17 TSval=1047768350 TSecr=3172028051
1711549845.655812502   871 1.607868877    10.10.1.1 → 10.10.1.2    TCP 83 8081 → 39932 [PSH, ACK] Seq=1769 Ack=1786 Win=65152 Len=17 TSval=3172028061 TSecr=1047768350
1711549851.655812502   877 1.618076596    10.10.1.2 → 10.10.1.1    TCP 83 39932 → 8081 [PSH, ACK] Seq=1786 Ack=1786 Win=64256 Len=17 TSval=1047768360 TSecr=3172028061
1711549853.655812502   879 1.618210609    10.10.1.1 → 10.10.1.2    TCP 83 8081 → 39932 [PSH, ACK] Seq=1786 Ack=1803 Win=65152 Len=17 TSval=3172028072 TSecr=1047768360
1711549859.655812502   885 1.628420291    10.10.1.2 → 10.10.1.1    TCP 83 39932 → 8081 [PSH, ACK] Seq=1803 Ack=1803 Win=64256 Len=17 TSval=1047768371 TSecr=3172028072
1711549861.655812502   887 1.628550905    10.10.1.1 → 10.10.1.2    TCP 83 8081 → 39932 [PSH, ACK] Seq=1803 Ack=1820 Win=65152 Len=17 TSval=3172028082 TSecr=1047768371
1711549867.655812502   893 1.638763172    10.10.1.2 → 10.10.1.1    TCP 83 39932 → 8081 [PSH, ACK] Seq=1820 Ack=1820 Win=64256 Len=17 TSval=1047768381 TSecr=3172028082
1711549869.655812502   895 1.638893134    10.10.1.1 → 10.10.1.2    TCP 83 8081 → 39932 [PSH, ACK] Seq=1820 Ack=1837 Win=65152 Len=17 TSval=3172028092 TSecr=1047768381
1711549875.655812502   901 1.649105529    10.10.1.2 → 10.10.1.1    TCP 83 39932 → 8081 [PSH, ACK] Seq=1837 Ack=1837 Win=64256 Len=17 TSval=1047768391 TSecr=3172028092
1711549877.655812502   903 1.649236390    10.10.1.1 → 10.10.1.2    TCP 83 8081 → 39932 [PSH, ACK] Seq=1837 Ack=1854 Win=65152 Len=17 TSval=3172028103 TSecr=1047768391
1711549883.655812502   909 1.659450039    10.10.1.2 → 10.10.1.1    TCP 83 39932 → 8081 [PSH, ACK] Seq=1854 Ack=1854 Win=64256 Len=17 TSval=1047768402 TSecr=3172028103
1711549885.655812502   911 1.659580247    10.10.1.1 → 10.10.1.2    TCP 83 8081 → 39932 [PSH, ACK] Seq=1854 Ack=1871 Win=65152 Len=17 TSval=3172028113 TSecr=1047768402
1711549891.655812502   917 1.669791059    10.10.1.2 → 10.10.1.1    TCP 83 39932 → 8081 [PSH, ACK] Seq=1871 Ack=1871 Win=64256 Len=17 TSval=1047768412 TSecr=3172028113
1711549893.655812502   919 1.669922745    10.10.1.1 → 10.10.1.2    TCP 83 8081 → 39932 [PSH, ACK] Seq=1871 Ack=1888 Win=65152 Len=17 TSval=3172028123 TSecr=1047768412
1711549899.655812502   925 1.680135088    10.10.1.2 → 10.10.1.1    TCP 83 39932 → 8081 [PSH, ACK] Seq=1888 Ack=1888 Win=64256 Len=17 TSval=1047768422 TSecr=3172028123
1711549901.655812502   927 1.680265725    10.10.1.1 → 10.10.1.2    TCP 83 8081 → 39932 [PSH, ACK] Seq=1888 Ack=1905 Win=65152 Len=17 TSval=3172028134 TSecr=1047768422
1711549907.655812502   933 1.690473730    10.10.1.2 → 10.10.1.1    TCP 83 39932 → 8081 [PSH, ACK] Seq=1905 Ack=1905 Win=64256 Len=17 TSval=1047768433 TSecr=3172028134
1711549909.655812502   935 1.690604025    10.10.1.1 → 10.10.1.2    TCP 83 8081 → 39932 [PSH, ACK] Seq=1905 Ack=1922 Win=65152 Len=17 TSval=3172028144 TSecr=1047768433
1711549915.655812502   941 1.700815037    10.10.1.2 → 10.10.1.1    TCP 83 39932 → 8081 [PSH, ACK] Seq=1922 Ack=1922 Win=64256 Len=17 TSval=1047768443 TSecr=3172028144
1711549918.655812502   944 1.700997494    10.10.1.1 → 10.10.1.2    TCP 83 8081 → 39932 [PSH, ACK] Seq=1922 Ack=1939 Win=65152 Len=17 TSval=3172028154 TSecr=1047768443
1711549923.655812502   949 1.711205967    10.10.1.2 → 10.10.1.1    TCP 83 39932 → 8081 [PSH, ACK] Seq=1939 Ack=1939 Win=64256 Len=17 TSval=1047768453 TSecr=3172028154
1711549925.655812502   951 1.711337142    10.10.1.1 → 10.10.1.2    TCP 83 8081 → 39932 [PSH, ACK] Seq=1939 Ack=1956 Win=65152 Len=17 TSval=3172028165 TSecr=1047768453
1711549931.655812502   957 1.721547954    10.10.1.2 → 10.10.1.1    TCP 83 39932 → 8081 [PSH, ACK] Seq=1956 Ack=1956 Win=64256 Len=17 TSval=1047768464 TSecr=3172028165
1711549933.655812502   959 1.721677979    10.10.1.1 → 10.10.1.2    TCP 83 8081 → 39932 [PSH, ACK] Seq=1956 Ack=1973 Win=65152 Len=17 TSval=3172028175 TSecr=1047768464
1711549939.655812502   965 1.731888698    10.10.1.2 → 10.10.1.1    TCP 83 39932 → 8081 [PSH, ACK] Seq=1973 Ack=1973 Win=64256 Len=17 TSval=1047768474 TSecr=3172028175
1711549941.655812502   967 1.732020026    10.10.1.1 → 10.10.1.2    TCP 83 8081 → 39932 [PSH, ACK] Seq=1973 Ack=1990 Win=65152 Len=17 TSval=3172028185 TSecr=1047768474
1711549947.655812502   973 1.742230696    10.10.1.2 → 10.10.1.1    TCP 83 39932 → 8081 [PSH, ACK] Seq=1990 Ack=1990 Win=64256 Len=17 TSval=1047768484 TSecr=3172028185
1711549949.655812502   975 1.742360733    10.10.1.1 → 10.10.1.2    TCP 83 8081 → 39932 [PSH, ACK] Seq=1990 Ack=2007 Win=65152 Len=17 TSval=3172028196 TSecr=1047768484
