1712183120.883143187    28 0.531154175    10.10.1.2 → 10.10.1.1    TCP 83 47436 → 8081 [PSH, ACK] Seq=1 Ack=1 Win=64256 Len=17 TSval=1681885489 TSecr=3806144938
1712183124.883143187    32 0.531472469    10.10.1.1 → 10.10.1.2    TCP 83 8081 → 47436 [PSH, ACK] Seq=1 Ack=18 Win=65152 Len=17 TSval=3806145199 TSecr=1681885489
1712183130.883143187    38 0.541688485    10.10.1.2 → 10.10.1.1    TCP 83 47436 → 8081 [PSH, ACK] Seq=18 Ack=18 Win=64256 Len=17 TSval=1681885500 TSecr=3806145199
1712183133.883143187    41 0.541812233    10.10.1.1 → 10.10.1.2    TCP 83 8081 → 47436 [PSH, ACK] Seq=18 Ack=35 Win=65152 Len=17 TSval=3806145209 TSecr=1681885500
1712183138.883143187    46 0.552025015    10.10.1.2 → 10.10.1.1    TCP 83 47436 → 8081 [PSH, ACK] Seq=35 Ack=35 Win=64256 Len=17 TSval=1681885510 TSecr=3806145209
1712183141.883143187    49 0.552155380    10.10.1.1 → 10.10.1.2    TCP 83 8081 → 47436 [PSH, ACK] Seq=35 Ack=52 Win=65152 Len=17 TSval=3806145219 TSecr=1681885510
1712183146.883143187    54 0.562371694    10.10.1.2 → 10.10.1.1    TCP 83 47436 → 8081 [PSH, ACK] Seq=52 Ack=52 Win=64256 Len=17 TSval=1681885520 TSecr=3806145219
1712183149.883143187    57 0.562501963    10.10.1.1 → 10.10.1.2    TCP 83 8081 → 47436 [PSH, ACK] Seq=52 Ack=69 Win=65152 Len=17 TSval=3806145230 TSecr=1681885520
1712183154.883143187    62 0.572712042    10.10.1.2 → 10.10.1.1    TCP 83 47436 → 8081 [PSH, ACK] Seq=69 Ack=69 Win=64256 Len=17 TSval=1681885531 TSecr=3806145230
1712183157.883143187    65 0.572842153    10.10.1.1 → 10.10.1.2    TCP 83 8081 → 47436 [PSH, ACK] Seq=69 Ack=86 Win=65152 Len=17 TSval=3806145240 TSecr=1681885531
1712183162.883143187    70 0.583053340    10.10.1.2 → 10.10.1.1    TCP 83 47436 → 8081 [PSH, ACK] Seq=86 Ack=86 Win=64256 Len=17 TSval=1681885541 TSecr=3806145240
1712183164.883143187    72 0.583182911    10.10.1.1 → 10.10.1.2    TCP 83 8081 → 47436 [PSH, ACK] Seq=86 Ack=103 Win=65152 Len=17 TSval=3806145250 TSecr=1681885541
1712183170.883143187    78 0.593395009    10.10.1.2 → 10.10.1.1    TCP 83 47436 → 8081 [PSH, ACK] Seq=103 Ack=103 Win=64256 Len=17 TSval=1681885551 TSecr=3806145250
1712183172.883143187    80 0.593533176    10.10.1.1 → 10.10.1.2    TCP 83 8081 → 47436 [PSH, ACK] Seq=103 Ack=120 Win=65152 Len=17 TSval=3806145261 TSecr=1681885551
1712183178.883143187    86 0.603747781    10.10.1.2 → 10.10.1.1    TCP 83 47436 → 8081 [PSH, ACK] Seq=120 Ack=120 Win=64256 Len=17 TSval=1681885562 TSecr=3806145261
1712183180.883143187    88 0.603884930    10.10.1.1 → 10.10.1.2    TCP 83 8081 → 47436 [PSH, ACK] Seq=120 Ack=137 Win=65152 Len=17 TSval=3806145271 TSecr=1681885562
1712183186.883143187    94 0.614097715    10.10.1.2 → 10.10.1.1    TCP 83 47436 → 8081 [PSH, ACK] Seq=137 Ack=137 Win=64256 Len=17 TSval=1681885572 TSecr=3806145271
1712183188.883143187    96 0.614234549    10.10.1.1 → 10.10.1.2    TCP 83 8081 → 47436 [PSH, ACK] Seq=137 Ack=154 Win=65152 Len=17 TSval=3806145281 TSecr=1681885572
1712183194.883143187   102 0.624447325    10.10.1.2 → 10.10.1.1    TCP 83 47436 → 8081 [PSH, ACK] Seq=154 Ack=154 Win=64256 Len=17 TSval=1681885582 TSecr=3806145281
1712183196.883143187   104 0.624585113    10.10.1.1 → 10.10.1.2    TCP 83 8081 → 47436 [PSH, ACK] Seq=154 Ack=171 Win=65152 Len=17 TSval=3806145292 TSecr=1681885582
1712183202.883143187   110 0.634794682    10.10.1.2 → 10.10.1.1    TCP 83 47436 → 8081 [PSH, ACK] Seq=171 Ack=171 Win=64256 Len=17 TSval=1681885593 TSecr=3806145292
1712183204.883143187   112 0.634933866    10.10.1.1 → 10.10.1.2    TCP 83 8081 → 47436 [PSH, ACK] Seq=171 Ack=188 Win=65152 Len=17 TSval=3806145302 TSecr=1681885593
1712183210.883143187   118 0.645142328    10.10.1.2 → 10.10.1.1    TCP 83 47436 → 8081 [PSH, ACK] Seq=188 Ack=188 Win=64256 Len=17 TSval=1681885603 TSecr=3806145302
1712183212.883143187   120 0.645271530    10.10.1.1 → 10.10.1.2    TCP 83 8081 → 47436 [PSH, ACK] Seq=188 Ack=205 Win=65152 Len=17 TSval=3806145313 TSecr=1681885603
1712183218.883143187   126 0.655480929    10.10.1.2 → 10.10.1.1    TCP 83 47436 → 8081 [PSH, ACK] Seq=205 Ack=205 Win=64256 Len=17 TSval=1681885614 TSecr=3806145313
1712183220.883143187   128 0.655609908    10.10.1.1 → 10.10.1.2    TCP 83 8081 → 47436 [PSH, ACK] Seq=205 Ack=222 Win=65152 Len=17 TSval=3806145323 TSecr=1681885614
1712183226.883143187   134 0.665819379    10.10.1.2 → 10.10.1.1    TCP 83 47436 → 8081 [PSH, ACK] Seq=222 Ack=222 Win=64256 Len=17 TSval=1681885624 TSecr=3806145323
1712183228.883143187   136 0.665949172    10.10.1.1 → 10.10.1.2    TCP 83 8081 → 47436 [PSH, ACK] Seq=222 Ack=239 Win=65152 Len=17 TSval=3806145333 TSecr=1681885624
1712183234.883143187   142 0.676160491    10.10.1.2 → 10.10.1.1    TCP 83 47436 → 8081 [PSH, ACK] Seq=239 Ack=239 Win=64256 Len=17 TSval=1681885634 TSecr=3806145333
1712183236.883143187   144 0.676289480    10.10.1.1 → 10.10.1.2    TCP 83 8081 → 47436 [PSH, ACK] Seq=239 Ack=256 Win=65152 Len=17 TSval=3806145344 TSecr=1681885634
1712183242.883143187   150 0.686458069    10.10.1.2 → 10.10.1.1    TCP 83 47436 → 8081 [PSH, ACK] Seq=256 Ack=256 Win=64256 Len=17 TSval=1681885645 TSecr=3806145344
1712183244.883143187   152 0.686590685    10.10.1.1 → 10.10.1.2    TCP 83 8081 → 47436 [PSH, ACK] Seq=256 Ack=273 Win=65152 Len=17 TSval=3806145354 TSecr=1681885645
1712183250.883143187   158 0.696803473    10.10.1.2 → 10.10.1.1    TCP 83 47436 → 8081 [PSH, ACK] Seq=273 Ack=273 Win=64256 Len=17 TSval=1681885655 TSecr=3806145354
1712183253.883143187   161 0.697003034    10.10.1.1 → 10.10.1.2    TCP 83 8081 → 47436 [PSH, ACK] Seq=273 Ack=290 Win=65152 Len=17 TSval=3806145364 TSecr=1681885655
1712183258.883143187   166 0.707214483    10.10.1.2 → 10.10.1.1    TCP 83 47436 → 8081 [PSH, ACK] Seq=290 Ack=290 Win=64256 Len=17 TSval=1681885665 TSecr=3806145364
1712183260.883143187   168 0.707352563    10.10.1.1 → 10.10.1.2    TCP 83 8081 → 47436 [PSH, ACK] Seq=290 Ack=307 Win=65152 Len=17 TSval=3806145375 TSecr=1681885665
1712183266.883143187   174 0.717560786    10.10.1.2 → 10.10.1.1    TCP 83 47436 → 8081 [PSH, ACK] Seq=307 Ack=307 Win=64256 Len=17 TSval=1681885676 TSecr=3806145375
1712183268.883143187   176 0.717690022    10.10.1.1 → 10.10.1.2    TCP 83 8081 → 47436 [PSH, ACK] Seq=307 Ack=324 Win=65152 Len=17 TSval=3806145385 TSecr=1681885676
1712183274.883143187   182 0.727899819    10.10.1.2 → 10.10.1.1    TCP 83 47436 → 8081 [PSH, ACK] Seq=324 Ack=324 Win=64256 Len=17 TSval=1681885686 TSecr=3806145385
1712183276.883143187   184 0.728028710    10.10.1.1 → 10.10.1.2    TCP 83 8081 → 47436 [PSH, ACK] Seq=324 Ack=341 Win=65152 Len=17 TSval=3806145395 TSecr=1681885686
1712183282.883143187   190 0.738238463    10.10.1.2 → 10.10.1.1    TCP 83 47436 → 8081 [PSH, ACK] Seq=341 Ack=341 Win=64256 Len=17 TSval=1681885696 TSecr=3806145395
1712183285.883143187   193 0.738390079    10.10.1.1 → 10.10.1.2    TCP 83 8081 → 47436 [PSH, ACK] Seq=341 Ack=358 Win=65152 Len=17 TSval=3806145406 TSecr=1681885696
1712183290.883143187   198 0.748600508    10.10.1.2 → 10.10.1.1    TCP 83 47436 → 8081 [PSH, ACK] Seq=358 Ack=358 Win=64256 Len=17 TSval=1681885707 TSecr=3806145406
1712183292.883143187   200 0.748738834    10.10.1.1 → 10.10.1.2    TCP 83 8081 → 47436 [PSH, ACK] Seq=358 Ack=375 Win=65152 Len=17 TSval=3806145416 TSecr=1681885707
1712183298.883143187   206 0.758951041    10.10.1.2 → 10.10.1.1    TCP 83 47436 → 8081 [PSH, ACK] Seq=375 Ack=375 Win=64256 Len=17 TSval=1681885717 TSecr=3806145416
1712183300.883143187   208 0.759087253    10.10.1.1 → 10.10.1.2    TCP 83 8081 → 47436 [PSH, ACK] Seq=375 Ack=392 Win=65152 Len=17 TSval=3806145426 TSecr=1681885717
1712183306.883143187   214 0.769301532    10.10.1.2 → 10.10.1.1    TCP 83 47436 → 8081 [PSH, ACK] Seq=392 Ack=392 Win=64256 Len=17 TSval=1681885727 TSecr=3806145426
1712183308.883143187   216 0.769438192    10.10.1.1 → 10.10.1.2    TCP 83 8081 → 47436 [PSH, ACK] Seq=392 Ack=409 Win=65152 Len=17 TSval=3806145437 TSecr=1681885727
1712183314.883143187   222 0.779648956    10.10.1.2 → 10.10.1.1    TCP 83 47436 → 8081 [PSH, ACK] Seq=409 Ack=409 Win=64256 Len=17 TSval=1681885738 TSecr=3806145437
1712183316.883143187   224 0.779787271    10.10.1.1 → 10.10.1.2    TCP 83 8081 → 47436 [PSH, ACK] Seq=409 Ack=426 Win=65152 Len=17 TSval=3806145447 TSecr=1681885738
1712183322.883143187   230 0.789997474    10.10.1.2 → 10.10.1.1    TCP 83 47436 → 8081 [PSH, ACK] Seq=426 Ack=426 Win=64256 Len=17 TSval=1681885748 TSecr=3806145447
1712183324.883143187   232 0.790127605    10.10.1.1 → 10.10.1.2    TCP 83 8081 → 47436 [PSH, ACK] Seq=426 Ack=443 Win=65152 Len=17 TSval=3806145457 TSecr=1681885748
1712183330.883143187   238 0.800335088    10.10.1.2 → 10.10.1.1    TCP 83 47436 → 8081 [PSH, ACK] Seq=443 Ack=443 Win=64256 Len=17 TSval=1681885758 TSecr=3806145457
1712183332.883143187   240 0.800472762    10.10.1.1 → 10.10.1.2    TCP 83 8081 → 47436 [PSH, ACK] Seq=443 Ack=460 Win=65152 Len=17 TSval=3806145468 TSecr=1681885758
1712183338.883143187   246 0.810685311    10.10.1.2 → 10.10.1.1    TCP 83 47436 → 8081 [PSH, ACK] Seq=460 Ack=460 Win=64256 Len=17 TSval=1681885769 TSecr=3806145468
1712183340.883143187   248 0.810823420    10.10.1.1 → 10.10.1.2    TCP 83 8081 → 47436 [PSH, ACK] Seq=460 Ack=477 Win=65152 Len=17 TSval=3806145478 TSecr=1681885769
1712183346.883143187   254 0.821033948    10.10.1.2 → 10.10.1.1    TCP 83 47436 → 8081 [PSH, ACK] Seq=477 Ack=477 Win=64256 Len=17 TSval=1681885779 TSecr=3806145478
1712183348.883143187   256 0.821171750    10.10.1.1 → 10.10.1.2    TCP 83 8081 → 47436 [PSH, ACK] Seq=477 Ack=494 Win=65152 Len=17 TSval=3806145488 TSecr=1681885779
1712183354.883143187   262 0.831384510    10.10.1.2 → 10.10.1.1    TCP 83 47436 → 8081 [PSH, ACK] Seq=494 Ack=494 Win=64256 Len=17 TSval=1681885789 TSecr=3806145488
1712183356.883143187   264 0.831518964    10.10.1.1 → 10.10.1.2    TCP 83 8081 → 47436 [PSH, ACK] Seq=494 Ack=511 Win=65152 Len=17 TSval=3806145499 TSecr=1681885789
1712183362.883143187   270 0.841730380    10.10.1.2 → 10.10.1.1    TCP 83 47436 → 8081 [PSH, ACK] Seq=511 Ack=511 Win=64256 Len=17 TSval=1681885800 TSecr=3806145499
1712183364.883143187   272 0.841867178    10.10.1.1 → 10.10.1.2    TCP 83 8081 → 47436 [PSH, ACK] Seq=511 Ack=528 Win=65152 Len=17 TSval=3806145509 TSecr=1681885800
1712183370.883143187   278 0.852078921    10.10.1.2 → 10.10.1.1    TCP 83 47436 → 8081 [PSH, ACK] Seq=528 Ack=528 Win=64256 Len=17 TSval=1681885810 TSecr=3806145509
1712183372.883143187   280 0.852208218    10.10.1.1 → 10.10.1.2    TCP 83 8081 → 47436 [PSH, ACK] Seq=528 Ack=545 Win=65152 Len=17 TSval=3806145519 TSecr=1681885810
1712183378.883143187   286 0.862375719    10.10.1.2 → 10.10.1.1    TCP 83 47436 → 8081 [PSH, ACK] Seq=545 Ack=545 Win=64256 Len=17 TSval=1681885820 TSecr=3806145519
1712183381.883143187   289 0.862519996    10.10.1.1 → 10.10.1.2    TCP 83 8081 → 47436 [PSH, ACK] Seq=545 Ack=562 Win=65152 Len=17 TSval=3806145530 TSecr=1681885820
1712183386.883143187   294 0.872729163    10.10.1.2 → 10.10.1.1    TCP 83 47436 → 8081 [PSH, ACK] Seq=562 Ack=562 Win=64256 Len=17 TSval=1681885831 TSecr=3806145530
1712183388.883143187   296 0.872867446    10.10.1.1 → 10.10.1.2    TCP 83 8081 → 47436 [PSH, ACK] Seq=562 Ack=579 Win=65152 Len=17 TSval=3806145540 TSecr=1681885831
1712183394.883143187   302 0.883078304    10.10.1.2 → 10.10.1.1    TCP 83 47436 → 8081 [PSH, ACK] Seq=579 Ack=579 Win=64256 Len=17 TSval=1681885841 TSecr=3806145540
1712183396.883143187   304 0.883217259    10.10.1.1 → 10.10.1.2    TCP 83 8081 → 47436 [PSH, ACK] Seq=579 Ack=596 Win=65152 Len=17 TSval=3806145550 TSecr=1681885841
1712183402.883143187   310 0.893427986    10.10.1.2 → 10.10.1.1    TCP 83 47436 → 8081 [PSH, ACK] Seq=596 Ack=596 Win=64256 Len=17 TSval=1681885851 TSecr=3806145550
1712183404.883143187   312 0.893566967    10.10.1.1 → 10.10.1.2    TCP 83 8081 → 47436 [PSH, ACK] Seq=596 Ack=613 Win=65152 Len=17 TSval=3806145561 TSecr=1681885851
1712183410.883143187   318 0.903778463    10.10.1.2 → 10.10.1.1    TCP 83 47436 → 8081 [PSH, ACK] Seq=613 Ack=613 Win=64256 Len=17 TSval=1681885862 TSecr=3806145561
1712183412.883143187   320 0.903917592    10.10.1.1 → 10.10.1.2    TCP 83 8081 → 47436 [PSH, ACK] Seq=613 Ack=630 Win=65152 Len=17 TSval=3806145571 TSecr=1681885862
1712183418.883143187   326 0.914129043    10.10.1.2 → 10.10.1.1    TCP 83 47436 → 8081 [PSH, ACK] Seq=630 Ack=630 Win=64256 Len=17 TSval=1681885872 TSecr=3806145571
1712183421.883143187   329 0.914299225    10.10.1.1 → 10.10.1.2    TCP 83 8081 → 47436 [PSH, ACK] Seq=630 Ack=647 Win=65152 Len=17 TSval=3806145582 TSecr=1681885872
1712183426.883143187   334 0.924510322    10.10.1.2 → 10.10.1.1    TCP 83 47436 → 8081 [PSH, ACK] Seq=647 Ack=647 Win=64256 Len=17 TSval=1681885883 TSecr=3806145582
1712183428.883143187   336 0.924648794    10.10.1.1 → 10.10.1.2    TCP 83 8081 → 47436 [PSH, ACK] Seq=647 Ack=664 Win=65152 Len=17 TSval=3806145592 TSecr=1681885883
1712183434.883143187   342 0.934857027    10.10.1.2 → 10.10.1.1    TCP 83 47436 → 8081 [PSH, ACK] Seq=664 Ack=664 Win=64256 Len=17 TSval=1681885893 TSecr=3806145592
1712183436.883143187   344 0.934996923    10.10.1.1 → 10.10.1.2    TCP 83 8081 → 47436 [PSH, ACK] Seq=664 Ack=681 Win=65152 Len=17 TSval=3806145602 TSecr=1681885893
1712183442.883143187   350 0.945207147    10.10.1.2 → 10.10.1.1    TCP 83 47436 → 8081 [PSH, ACK] Seq=681 Ack=681 Win=64256 Len=17 TSval=1681885903 TSecr=3806145602
1712183444.883143187   352 0.945345607    10.10.1.1 → 10.10.1.2    TCP 83 8081 → 47436 [PSH, ACK] Seq=681 Ack=698 Win=65152 Len=17 TSval=3806145613 TSecr=1681885903
1712183450.883143187   358 0.955557488    10.10.1.2 → 10.10.1.1    TCP 83 47436 → 8081 [PSH, ACK] Seq=698 Ack=698 Win=64256 Len=17 TSval=1681885914 TSecr=3806145613
1712183452.883143187   360 0.955694036    10.10.1.1 → 10.10.1.2    TCP 83 8081 → 47436 [PSH, ACK] Seq=698 Ack=715 Win=65152 Len=17 TSval=3806145623 TSecr=1681885914
1712183458.883143187   366 0.965904645    10.10.1.2 → 10.10.1.1    TCP 83 47436 → 8081 [PSH, ACK] Seq=715 Ack=715 Win=64256 Len=17 TSval=1681885924 TSecr=3806145623
1712183460.883143187   368 0.966033191    10.10.1.1 → 10.10.1.2    TCP 83 8081 → 47436 [PSH, ACK] Seq=715 Ack=732 Win=65152 Len=17 TSval=3806145633 TSecr=1681885924
1712183466.883143187   374 0.976243507    10.10.1.2 → 10.10.1.1    TCP 83 47436 → 8081 [PSH, ACK] Seq=732 Ack=732 Win=64256 Len=17 TSval=1681885934 TSecr=3806145633
1712183468.883143187   376 0.976379375    10.10.1.1 → 10.10.1.2    TCP 83 8081 → 47436 [PSH, ACK] Seq=732 Ack=749 Win=65152 Len=17 TSval=3806145644 TSecr=1681885934
1712183475.883143187   383 0.986588777    10.10.1.2 → 10.10.1.1    TCP 83 47436 → 8081 [PSH, ACK] Seq=749 Ack=749 Win=64256 Len=17 TSval=1681885945 TSecr=3806145644
1712183476.883143187   384 0.986667148    10.10.1.1 → 10.10.1.2    TCP 83 8081 → 47436 [PSH, ACK] Seq=749 Ack=766 Win=65152 Len=17 TSval=3806145654 TSecr=1681885945
1712183482.883143187   390 0.996875908    10.10.1.2 → 10.10.1.1    TCP 83 47436 → 8081 [PSH, ACK] Seq=766 Ack=766 Win=64256 Len=17 TSval=1681885955 TSecr=3806145654
1712183484.883143187   392 0.997004896    10.10.1.1 → 10.10.1.2    TCP 83 8081 → 47436 [PSH, ACK] Seq=766 Ack=783 Win=65152 Len=17 TSval=3806145664 TSecr=1681885955
1712183490.883143187   398 1.007215944    10.10.1.2 → 10.10.1.1    TCP 83 47436 → 8081 [PSH, ACK] Seq=783 Ack=783 Win=64256 Len=17 TSval=1681885965 TSecr=3806145664
1712183492.883143187   400 1.007353999    10.10.1.1 → 10.10.1.2    TCP 83 8081 → 47436 [PSH, ACK] Seq=783 Ack=800 Win=65152 Len=17 TSval=3806145675 TSecr=1681885965
1712183498.883143187   406 1.017539096    10.10.1.2 → 10.10.1.1    TCP 83 47436 → 8081 [PSH, ACK] Seq=800 Ack=800 Win=64256 Len=17 TSval=1681885976 TSecr=3806145675
1712183500.883143187   408 1.017621391    10.10.1.1 → 10.10.1.2    TCP 83 8081 → 47436 [PSH, ACK] Seq=800 Ack=817 Win=65152 Len=17 TSval=3806145685 TSecr=1681885976
1712183506.883143187   414 1.027838182    10.10.1.2 → 10.10.1.1    TCP 83 47436 → 8081 [PSH, ACK] Seq=817 Ack=817 Win=64256 Len=17 TSval=1681885986 TSecr=3806145685
1712183508.883143187   416 1.027976041    10.10.1.1 → 10.10.1.2    TCP 83 8081 → 47436 [PSH, ACK] Seq=817 Ack=834 Win=65152 Len=17 TSval=3806145695 TSecr=1681885986
1712183514.883143187   422 1.038196717    10.10.1.2 → 10.10.1.1    TCP 83 47436 → 8081 [PSH, ACK] Seq=834 Ack=834 Win=64256 Len=17 TSval=1681885996 TSecr=3806145695
1712183516.883143187   424 1.038333522    10.10.1.1 → 10.10.1.2    TCP 83 8081 → 47436 [PSH, ACK] Seq=834 Ack=851 Win=65152 Len=17 TSval=3806145706 TSecr=1681885996
1712183522.883143187   430 1.048559007    10.10.1.2 → 10.10.1.1    TCP 83 47436 → 8081 [PSH, ACK] Seq=851 Ack=851 Win=64256 Len=17 TSval=1681886007 TSecr=3806145706
1712183524.883143187   432 1.048692976    10.10.1.1 → 10.10.1.2    TCP 83 8081 → 47436 [PSH, ACK] Seq=851 Ack=868 Win=65152 Len=17 TSval=3806145716 TSecr=1681886007
1712183530.883143187   438 1.058902652    10.10.1.2 → 10.10.1.1    TCP 83 47436 → 8081 [PSH, ACK] Seq=868 Ack=868 Win=64256 Len=17 TSval=1681886017 TSecr=3806145716
1712183532.883143187   440 1.059031454    10.10.1.1 → 10.10.1.2    TCP 83 8081 → 47436 [PSH, ACK] Seq=868 Ack=885 Win=65152 Len=17 TSval=3806145726 TSecr=1681886017
1712183538.883143187   446 1.069242962    10.10.1.2 → 10.10.1.1    TCP 83 47436 → 8081 [PSH, ACK] Seq=885 Ack=885 Win=64256 Len=17 TSval=1681886027 TSecr=3806145726
1712183540.883143187   448 1.069379604    10.10.1.1 → 10.10.1.2    TCP 83 8081 → 47436 [PSH, ACK] Seq=885 Ack=902 Win=65152 Len=17 TSval=3806145737 TSecr=1681886027
1712183546.883143187   454 1.079597820    10.10.1.2 → 10.10.1.1    TCP 83 47436 → 8081 [PSH, ACK] Seq=902 Ack=902 Win=64256 Len=17 TSval=1681886038 TSecr=3806145737
1712183548.883143187   456 1.079732282    10.10.1.1 → 10.10.1.2    TCP 83 8081 → 47436 [PSH, ACK] Seq=902 Ack=919 Win=65152 Len=17 TSval=3806145747 TSecr=1681886038
1712183554.883143187   462 1.089942834    10.10.1.2 → 10.10.1.1    TCP 83 47436 → 8081 [PSH, ACK] Seq=919 Ack=919 Win=64256 Len=17 TSval=1681886048 TSecr=3806145747
1712183556.883143187   464 1.090079055    10.10.1.1 → 10.10.1.2    TCP 83 8081 → 47436 [PSH, ACK] Seq=919 Ack=936 Win=65152 Len=17 TSval=3806145757 TSecr=1681886048
1712183562.883143187   470 1.100290968    10.10.1.2 → 10.10.1.1    TCP 83 47436 → 8081 [PSH, ACK] Seq=936 Ack=936 Win=64256 Len=17 TSval=1681886058 TSecr=3806145757
1712183564.883143187   472 1.100427006    10.10.1.1 → 10.10.1.2    TCP 83 8081 → 47436 [PSH, ACK] Seq=936 Ack=953 Win=65152 Len=17 TSval=3806145768 TSecr=1681886058
1712183570.883143187   478 1.110635734    10.10.1.2 → 10.10.1.1    TCP 83 47436 → 8081 [PSH, ACK] Seq=953 Ack=953 Win=64256 Len=17 TSval=1681886069 TSecr=3806145768
1712183573.883143187   481 1.110838529    10.10.1.1 → 10.10.1.2    TCP 83 8081 → 47436 [PSH, ACK] Seq=953 Ack=970 Win=65152 Len=17 TSval=3806145778 TSecr=1681886069
1712183578.883143187   486 1.121045451    10.10.1.2 → 10.10.1.1    TCP 83 47436 → 8081 [PSH, ACK] Seq=970 Ack=970 Win=64256 Len=17 TSval=1681886079 TSecr=3806145778
1712183580.883143187   488 1.121175562    10.10.1.1 → 10.10.1.2    TCP 83 8081 → 47436 [PSH, ACK] Seq=970 Ack=987 Win=65152 Len=17 TSval=3806145788 TSecr=1681886079
1712183586.883143187   494 1.131384118    10.10.1.2 → 10.10.1.1    TCP 83 47436 → 8081 [PSH, ACK] Seq=987 Ack=987 Win=64256 Len=17 TSval=1681886089 TSecr=3806145788
1712183588.883143187   496 1.131522541    10.10.1.1 → 10.10.1.2    TCP 83 8081 → 47436 [PSH, ACK] Seq=987 Ack=1004 Win=65152 Len=17 TSval=3806145799 TSecr=1681886089
1712183594.883143187   502 1.141746329    10.10.1.2 → 10.10.1.1    TCP 83 47436 → 8081 [PSH, ACK] Seq=1004 Ack=1004 Win=64256 Len=17 TSval=1681886100 TSecr=3806145799
1712183596.883143187   504 1.141879955    10.10.1.1 → 10.10.1.2    TCP 83 8081 → 47436 [PSH, ACK] Seq=1004 Ack=1021 Win=65152 Len=17 TSval=3806145809 TSecr=1681886100
1712183602.883143187   510 1.152092670    10.10.1.2 → 10.10.1.1    TCP 83 47436 → 8081 [PSH, ACK] Seq=1021 Ack=1021 Win=64256 Len=17 TSval=1681886110 TSecr=3806145809
1712183605.883143187   513 1.152247552    10.10.1.1 → 10.10.1.2    TCP 83 8081 → 47436 [PSH, ACK] Seq=1021 Ack=1038 Win=65152 Len=17 TSval=3806145819 TSecr=1681886110
1712183610.883143187   518 1.162458095    10.10.1.2 → 10.10.1.1    TCP 83 47436 → 8081 [PSH, ACK] Seq=1038 Ack=1038 Win=64256 Len=17 TSval=1681886120 TSecr=3806145819
1712183612.883143187   520 1.162595617    10.10.1.1 → 10.10.1.2    TCP 83 8081 → 47436 [PSH, ACK] Seq=1038 Ack=1055 Win=65152 Len=17 TSval=3806145830 TSecr=1681886120
1712183618.883143187   526 1.172804451    10.10.1.2 → 10.10.1.1    TCP 83 47436 → 8081 [PSH, ACK] Seq=1055 Ack=1055 Win=64256 Len=17 TSval=1681886131 TSecr=3806145830
1712183620.883143187   528 1.172932700    10.10.1.1 → 10.10.1.2    TCP 83 8081 → 47436 [PSH, ACK] Seq=1055 Ack=1072 Win=65152 Len=17 TSval=3806145840 TSecr=1681886131
1712183626.883143187   534 1.183142208    10.10.1.2 → 10.10.1.1    TCP 83 47436 → 8081 [PSH, ACK] Seq=1072 Ack=1072 Win=64256 Len=17 TSval=1681886141 TSecr=3806145840
1712183628.883143187   536 1.183271750    10.10.1.1 → 10.10.1.2    TCP 83 8081 → 47436 [PSH, ACK] Seq=1072 Ack=1089 Win=65152 Len=17 TSval=3806145851 TSecr=1681886141
1712183634.883143187   542 1.193476486    10.10.1.2 → 10.10.1.1    TCP 83 47436 → 8081 [PSH, ACK] Seq=1089 Ack=1089 Win=64256 Len=17 TSval=1681886152 TSecr=3806145851
1712183636.883143187   544 1.193613018    10.10.1.1 → 10.10.1.2    TCP 83 8081 → 47436 [PSH, ACK] Seq=1089 Ack=1106 Win=65152 Len=17 TSval=3806145861 TSecr=1681886152
1712183642.883143187   550 1.203822392    10.10.1.2 → 10.10.1.1    TCP 83 47436 → 8081 [PSH, ACK] Seq=1106 Ack=1106 Win=64256 Len=17 TSval=1681886162 TSecr=3806145861
1712183644.883143187   552 1.203951394    10.10.1.1 → 10.10.1.2    TCP 83 8081 → 47436 [PSH, ACK] Seq=1106 Ack=1123 Win=65152 Len=17 TSval=3806145871 TSecr=1681886162
1712183650.883143187   558 1.214161784    10.10.1.2 → 10.10.1.1    TCP 83 47436 → 8081 [PSH, ACK] Seq=1123 Ack=1123 Win=64256 Len=17 TSval=1681886172 TSecr=3806145871
1712183652.883143187   560 1.214313288    10.10.1.1 → 10.10.1.2    TCP 83 8081 → 47436 [PSH, ACK] Seq=1123 Ack=1140 Win=65152 Len=17 TSval=3806145882 TSecr=1681886172
1712183658.883143187   566 1.224524708    10.10.1.2 → 10.10.1.1    TCP 83 47436 → 8081 [PSH, ACK] Seq=1140 Ack=1140 Win=64256 Len=17 TSval=1681886183 TSecr=3806145882
1712183660.883143187   568 1.224662631    10.10.1.1 → 10.10.1.2    TCP 83 8081 → 47436 [PSH, ACK] Seq=1140 Ack=1157 Win=65152 Len=17 TSval=3806145892 TSecr=1681886183
1712183666.883143187   574 1.234871066    10.10.1.2 → 10.10.1.1    TCP 83 47436 → 8081 [PSH, ACK] Seq=1157 Ack=1157 Win=64256 Len=17 TSval=1681886193 TSecr=3806145892
1712183668.883143187   576 1.234999828    10.10.1.1 → 10.10.1.2    TCP 83 8081 → 47436 [PSH, ACK] Seq=1157 Ack=1174 Win=65152 Len=17 TSval=3806145902 TSecr=1681886193
1712183674.883143187   582 1.245225346    10.10.1.2 → 10.10.1.1    TCP 83 47436 → 8081 [PSH, ACK] Seq=1174 Ack=1174 Win=64256 Len=17 TSval=1681886203 TSecr=3806145902
1712183676.883143187   584 1.245359654    10.10.1.1 → 10.10.1.2    TCP 83 8081 → 47436 [PSH, ACK] Seq=1174 Ack=1191 Win=65152 Len=17 TSval=3806145913 TSecr=1681886203
1712183682.883143187   590 1.255572129    10.10.1.2 → 10.10.1.1    TCP 83 47436 → 8081 [PSH, ACK] Seq=1191 Ack=1191 Win=64256 Len=17 TSval=1681886214 TSecr=3806145913
1712183684.883143187   592 1.255701371    10.10.1.1 → 10.10.1.2    TCP 83 8081 → 47436 [PSH, ACK] Seq=1191 Ack=1208 Win=65152 Len=17 TSval=3806145923 TSecr=1681886214
1712183690.883143187   598 1.265910103    10.10.1.2 → 10.10.1.1    TCP 83 47436 → 8081 [PSH, ACK] Seq=1208 Ack=1208 Win=64256 Len=17 TSval=1681886224 TSecr=3806145923
1712183692.883143187   600 1.266038881    10.10.1.1 → 10.10.1.2    TCP 83 8081 → 47436 [PSH, ACK] Seq=1208 Ack=1225 Win=65152 Len=17 TSval=3806145933 TSecr=1681886224
1712183698.883143187   606 1.276250297    10.10.1.2 → 10.10.1.1    TCP 83 47436 → 8081 [PSH, ACK] Seq=1225 Ack=1225 Win=64256 Len=17 TSval=1681886234 TSecr=3806145933
1712183700.883143187   608 1.276387721    10.10.1.1 → 10.10.1.2    TCP 83 8081 → 47436 [PSH, ACK] Seq=1225 Ack=1242 Win=65152 Len=17 TSval=3806145944 TSecr=1681886234
1712183707.883143187   615 1.286597301    10.10.1.2 → 10.10.1.1    TCP 83 47436 → 8081 [PSH, ACK] Seq=1242 Ack=1242 Win=64256 Len=17 TSval=1681886245 TSecr=3806145944
1712183709.883143187   617 1.286725512    10.10.1.1 → 10.10.1.2    TCP 83 8081 → 47436 [PSH, ACK] Seq=1242 Ack=1259 Win=65152 Len=17 TSval=3806145954 TSecr=1681886245
1712183714.883143187   622 1.296936504    10.10.1.2 → 10.10.1.1    TCP 83 47436 → 8081 [PSH, ACK] Seq=1259 Ack=1259 Win=64256 Len=17 TSval=1681886255 TSecr=3806145954
1712183716.883143187   624 1.297074168    10.10.1.1 → 10.10.1.2    TCP 83 8081 → 47436 [PSH, ACK] Seq=1259 Ack=1276 Win=65152 Len=17 TSval=3806145964 TSecr=1681886255
1712183722.883143187   630 1.307285521    10.10.1.2 → 10.10.1.1    TCP 83 47436 → 8081 [PSH, ACK] Seq=1276 Ack=1276 Win=64256 Len=17 TSval=1681886265 TSecr=3806145964
1712183724.883143187   632 1.307414639    10.10.1.1 → 10.10.1.2    TCP 83 8081 → 47436 [PSH, ACK] Seq=1276 Ack=1293 Win=65152 Len=17 TSval=3806145975 TSecr=1681886265
1712183730.883143187   638 1.317625402    10.10.1.2 → 10.10.1.1    TCP 83 47436 → 8081 [PSH, ACK] Seq=1293 Ack=1293 Win=64256 Len=17 TSval=1681886276 TSecr=3806145975
1712183732.883143187   640 1.317762640    10.10.1.1 → 10.10.1.2    TCP 83 8081 → 47436 [PSH, ACK] Seq=1293 Ack=1310 Win=65152 Len=17 TSval=3806145985 TSecr=1681886276
1712183738.883143187   646 1.327971248    10.10.1.2 → 10.10.1.1    TCP 83 47436 → 8081 [PSH, ACK] Seq=1310 Ack=1310 Win=64256 Len=17 TSval=1681886286 TSecr=3806145985
1712183740.883143187   648 1.328099528    10.10.1.1 → 10.10.1.2    TCP 83 8081 → 47436 [PSH, ACK] Seq=1310 Ack=1327 Win=65152 Len=17 TSval=3806145995 TSecr=1681886286
1712183746.883143187   654 1.338310472    10.10.1.2 → 10.10.1.1    TCP 83 47436 → 8081 [PSH, ACK] Seq=1327 Ack=1327 Win=64256 Len=17 TSval=1681886296 TSecr=3806145995
1712183748.883143187   656 1.338447154    10.10.1.1 → 10.10.1.2    TCP 83 8081 → 47436 [PSH, ACK] Seq=1327 Ack=1344 Win=65152 Len=17 TSval=3806146006 TSecr=1681886296
1712183754.883143187   662 1.348654750    10.10.1.2 → 10.10.1.1    TCP 83 47436 → 8081 [PSH, ACK] Seq=1344 Ack=1344 Win=64256 Len=17 TSval=1681886307 TSecr=3806146006
1712183756.883143187   664 1.348792681    10.10.1.1 → 10.10.1.2    TCP 83 8081 → 47436 [PSH, ACK] Seq=1344 Ack=1361 Win=65152 Len=17 TSval=3806146016 TSecr=1681886307
1712183762.883143187   670 1.359001860    10.10.1.2 → 10.10.1.1    TCP 83 47436 → 8081 [PSH, ACK] Seq=1361 Ack=1361 Win=64256 Len=17 TSval=1681886317 TSecr=3806146016
1712183764.883143187   672 1.359131300    10.10.1.1 → 10.10.1.2    TCP 83 8081 → 47436 [PSH, ACK] Seq=1361 Ack=1378 Win=65152 Len=17 TSval=3806146026 TSecr=1681886317
1712183770.883143187   678 1.369341881    10.10.1.2 → 10.10.1.1    TCP 83 47436 → 8081 [PSH, ACK] Seq=1378 Ack=1378 Win=64256 Len=17 TSval=1681886327 TSecr=3806146026
1712183772.883143187   680 1.369478483    10.10.1.1 → 10.10.1.2    TCP 83 8081 → 47436 [PSH, ACK] Seq=1378 Ack=1395 Win=65152 Len=17 TSval=3806146037 TSecr=1681886327
1712183778.883143187   686 1.379687465    10.10.1.2 → 10.10.1.1    TCP 83 47436 → 8081 [PSH, ACK] Seq=1395 Ack=1395 Win=64256 Len=17 TSval=1681886338 TSecr=3806146037
1712183780.883143187   688 1.379817593    10.10.1.1 → 10.10.1.2    TCP 83 8081 → 47436 [PSH, ACK] Seq=1395 Ack=1412 Win=65152 Len=17 TSval=3806146047 TSecr=1681886338
1712183786.883143187   694 1.390026009    10.10.1.2 → 10.10.1.1    TCP 83 47436 → 8081 [PSH, ACK] Seq=1412 Ack=1412 Win=64256 Len=17 TSval=1681886348 TSecr=3806146047
1712183788.883143187   696 1.390155070    10.10.1.1 → 10.10.1.2    TCP 83 8081 → 47436 [PSH, ACK] Seq=1412 Ack=1429 Win=65152 Len=17 TSval=3806146057 TSecr=1681886348
1712183794.883143187   702 1.400366993    10.10.1.2 → 10.10.1.1    TCP 83 47436 → 8081 [PSH, ACK] Seq=1429 Ack=1429 Win=64256 Len=17 TSval=1681886358 TSecr=3806146057
1712183796.883143187   704 1.400505670    10.10.1.1 → 10.10.1.2    TCP 83 8081 → 47436 [PSH, ACK] Seq=1429 Ack=1446 Win=65152 Len=17 TSval=3806146068 TSecr=1681886358
1712183802.883143187   710 1.410716576    10.10.1.2 → 10.10.1.1    TCP 83 47436 → 8081 [PSH, ACK] Seq=1446 Ack=1446 Win=64256 Len=17 TSval=1681886369 TSecr=3806146068
1712183804.883143187   712 1.410855039    10.10.1.1 → 10.10.1.2    TCP 83 8081 → 47436 [PSH, ACK] Seq=1446 Ack=1463 Win=65152 Len=17 TSval=3806146078 TSecr=1681886369
1712183810.883143187   718 1.421071497    10.10.1.2 → 10.10.1.1    TCP 83 47436 → 8081 [PSH, ACK] Seq=1463 Ack=1463 Win=64256 Len=17 TSval=1681886379 TSecr=3806146078
1712183812.883143187   720 1.421210992    10.10.1.1 → 10.10.1.2    TCP 83 8081 → 47436 [PSH, ACK] Seq=1463 Ack=1480 Win=65152 Len=17 TSval=3806146088 TSecr=1681886379
1712183818.883143187   726 1.431423390    10.10.1.2 → 10.10.1.1    TCP 83 47436 → 8081 [PSH, ACK] Seq=1480 Ack=1480 Win=64256 Len=17 TSval=1681886389 TSecr=3806146088
1712183820.883143187   728 1.431562926    10.10.1.1 → 10.10.1.2    TCP 83 8081 → 47436 [PSH, ACK] Seq=1480 Ack=1497 Win=65152 Len=17 TSval=3806146099 TSecr=1681886389
1712183826.883143187   734 1.441774409    10.10.1.2 → 10.10.1.1    TCP 83 47436 → 8081 [PSH, ACK] Seq=1497 Ack=1497 Win=64256 Len=17 TSval=1681886400 TSecr=3806146099
1712183828.883143187   736 1.441910618    10.10.1.1 → 10.10.1.2    TCP 83 8081 → 47436 [PSH, ACK] Seq=1497 Ack=1514 Win=65152 Len=17 TSval=3806146109 TSecr=1681886400
1712183834.883143187   742 1.452120076    10.10.1.2 → 10.10.1.1    TCP 83 47436 → 8081 [PSH, ACK] Seq=1514 Ack=1514 Win=64256 Len=17 TSval=1681886410 TSecr=3806146109
1712183836.883143187   744 1.452253112    10.10.1.1 → 10.10.1.2    TCP 83 8081 → 47436 [PSH, ACK] Seq=1514 Ack=1531 Win=65152 Len=17 TSval=3806146119 TSecr=1681886410
1712183842.883143187   750 1.462462281    10.10.1.2 → 10.10.1.1    TCP 83 47436 → 8081 [PSH, ACK] Seq=1531 Ack=1531 Win=64256 Len=17 TSval=1681886420 TSecr=3806146119
1712183844.883143187   752 1.462601814    10.10.1.1 → 10.10.1.2    TCP 83 8081 → 47436 [PSH, ACK] Seq=1531 Ack=1548 Win=65152 Len=17 TSval=3806146130 TSecr=1681886420
1712183850.883143187   758 1.472811209    10.10.1.2 → 10.10.1.1    TCP 83 47436 → 8081 [PSH, ACK] Seq=1548 Ack=1548 Win=64256 Len=17 TSval=1681886431 TSecr=3806146130
1712183852.883143187   760 1.472940443    10.10.1.1 → 10.10.1.2    TCP 83 8081 → 47436 [PSH, ACK] Seq=1548 Ack=1565 Win=65152 Len=17 TSval=3806146140 TSecr=1681886431
1712183858.883143187   766 1.483153180    10.10.1.2 → 10.10.1.1    TCP 83 47436 → 8081 [PSH, ACK] Seq=1565 Ack=1565 Win=64256 Len=17 TSval=1681886441 TSecr=3806146140
1712183860.883143187   768 1.483283410    10.10.1.1 → 10.10.1.2    TCP 83 8081 → 47436 [PSH, ACK] Seq=1565 Ack=1582 Win=65152 Len=17 TSval=3806146151 TSecr=1681886441
1712183866.883143187   774 1.493475771    10.10.1.2 → 10.10.1.1    TCP 83 47436 → 8081 [PSH, ACK] Seq=1582 Ack=1582 Win=64256 Len=17 TSval=1681886452 TSecr=3806146151
1712183868.883143187   776 1.493613848    10.10.1.1 → 10.10.1.2    TCP 83 8081 → 47436 [PSH, ACK] Seq=1582 Ack=1599 Win=65152 Len=17 TSval=3806146161 TSecr=1681886452
1712183874.883143187   782 1.503822745    10.10.1.2 → 10.10.1.1    TCP 83 47436 → 8081 [PSH, ACK] Seq=1599 Ack=1599 Win=64256 Len=17 TSval=1681886462 TSecr=3806146161
1712183876.883143187   784 1.503960919    10.10.1.1 → 10.10.1.2    TCP 83 8081 → 47436 [PSH, ACK] Seq=1599 Ack=1616 Win=65152 Len=17 TSval=3806146171 TSecr=1681886462
1712183882.883143187   790 1.514173881    10.10.1.2 → 10.10.1.1    TCP 83 47436 → 8081 [PSH, ACK] Seq=1616 Ack=1616 Win=64256 Len=17 TSval=1681886472 TSecr=3806146171
1712183885.883143187   793 1.514322436    10.10.1.1 → 10.10.1.2    TCP 83 8081 → 47436 [PSH, ACK] Seq=1616 Ack=1633 Win=65152 Len=17 TSval=3806146182 TSecr=1681886472
1712183890.883143187   798 1.524535669    10.10.1.2 → 10.10.1.1    TCP 83 47436 → 8081 [PSH, ACK] Seq=1633 Ack=1633 Win=64256 Len=17 TSval=1681886483 TSecr=3806146182
1712183892.883143187   800 1.524665130    10.10.1.1 → 10.10.1.2    TCP 83 8081 → 47436 [PSH, ACK] Seq=1633 Ack=1650 Win=65152 Len=17 TSval=3806146192 TSecr=1681886483
1712183898.883143187   806 1.534875306    10.10.1.2 → 10.10.1.1    TCP 83 47436 → 8081 [PSH, ACK] Seq=1650 Ack=1650 Win=64256 Len=17 TSval=1681886493 TSecr=3806146192
1712183900.883143187   808 1.535013035    10.10.1.1 → 10.10.1.2    TCP 83 8081 → 47436 [PSH, ACK] Seq=1650 Ack=1667 Win=65152 Len=17 TSval=3806146202 TSecr=1681886493
1712183906.883143187   814 1.545235668    10.10.1.2 → 10.10.1.1    TCP 83 47436 → 8081 [PSH, ACK] Seq=1667 Ack=1667 Win=64256 Len=17 TSval=1681886503 TSecr=3806146202
1712183908.883143187   816 1.545369483    10.10.1.1 → 10.10.1.2    TCP 83 8081 → 47436 [PSH, ACK] Seq=1667 Ack=1684 Win=65152 Len=17 TSval=3806146213 TSecr=1681886503
1712183914.883143187   822 1.555580630    10.10.1.2 → 10.10.1.1    TCP 83 47436 → 8081 [PSH, ACK] Seq=1684 Ack=1684 Win=64256 Len=17 TSval=1681886514 TSecr=3806146213
1712183916.883143187   824 1.555719262    10.10.1.1 → 10.10.1.2    TCP 83 8081 → 47436 [PSH, ACK] Seq=1684 Ack=1701 Win=65152 Len=17 TSval=3806146223 TSecr=1681886514
1712183922.883143187   830 1.565926884    10.10.1.2 → 10.10.1.1    TCP 83 47436 → 8081 [PSH, ACK] Seq=1701 Ack=1701 Win=64256 Len=17 TSval=1681886524 TSecr=3806146223
1712183924.883143187   832 1.566055696    10.10.1.1 → 10.10.1.2    TCP 83 8081 → 47436 [PSH, ACK] Seq=1701 Ack=1718 Win=65152 Len=17 TSval=3806146233 TSecr=1681886524
1712183930.883143187   838 1.576266677    10.10.1.2 → 10.10.1.1    TCP 83 47436 → 8081 [PSH, ACK] Seq=1718 Ack=1718 Win=64256 Len=17 TSval=1681886534 TSecr=3806146233
1712183932.883143187   840 1.576402692    10.10.1.1 → 10.10.1.2    TCP 83 8081 → 47436 [PSH, ACK] Seq=1718 Ack=1735 Win=65152 Len=17 TSval=3806146244 TSecr=1681886534
1712183939.883143187   847 1.586611712    10.10.1.2 → 10.10.1.1    TCP 83 47436 → 8081 [PSH, ACK] Seq=1735 Ack=1735 Win=64256 Len=17 TSval=1681886545 TSecr=3806146244
1712183941.883143187   849 1.586741700    10.10.1.1 → 10.10.1.2    TCP 83 8081 → 47436 [PSH, ACK] Seq=1735 Ack=1752 Win=65152 Len=17 TSval=3806146254 TSecr=1681886545
1712183946.883143187   854 1.596951356    10.10.1.2 → 10.10.1.1    TCP 83 47436 → 8081 [PSH, ACK] Seq=1752 Ack=1752 Win=64256 Len=17 TSval=1681886555 TSecr=3806146254
1712183948.883143187   856 1.597089832    10.10.1.1 → 10.10.1.2    TCP 83 8081 → 47436 [PSH, ACK] Seq=1752 Ack=1769 Win=65152 Len=17 TSval=3806146264 TSecr=1681886555
1712183954.883143187   862 1.607300500    10.10.1.2 → 10.10.1.1    TCP 83 47436 → 8081 [PSH, ACK] Seq=1769 Ack=1769 Win=64256 Len=17 TSval=1681886565 TSecr=3806146264
1712183956.883143187   864 1.607436461    10.10.1.1 → 10.10.1.2    TCP 83 8081 → 47436 [PSH, ACK] Seq=1769 Ack=1786 Win=65152 Len=17 TSval=3806146275 TSecr=1681886565
1712183962.883143187   870 1.617647693    10.10.1.2 → 10.10.1.1    TCP 83 47436 → 8081 [PSH, ACK] Seq=1786 Ack=1786 Win=64256 Len=17 TSval=1681886576 TSecr=3806146275
1712183964.883143187   872 1.617784632    10.10.1.1 → 10.10.1.2    TCP 83 8081 → 47436 [PSH, ACK] Seq=1786 Ack=1803 Win=65152 Len=17 TSval=3806146285 TSecr=1681886576
1712183970.883143187   878 1.627995684    10.10.1.2 → 10.10.1.1    TCP 83 47436 → 8081 [PSH, ACK] Seq=1803 Ack=1803 Win=64256 Len=17 TSval=1681886586 TSecr=3806146285
1712183972.883143187   880 1.628124845    10.10.1.1 → 10.10.1.2    TCP 83 8081 → 47436 [PSH, ACK] Seq=1803 Ack=1820 Win=65152 Len=17 TSval=3806146295 TSecr=1681886586
1712183978.883143187   886 1.638335661    10.10.1.2 → 10.10.1.1    TCP 83 47436 → 8081 [PSH, ACK] Seq=1820 Ack=1820 Win=64256 Len=17 TSval=1681886596 TSecr=3806146295
1712183980.883143187   888 1.638474429    10.10.1.1 → 10.10.1.2    TCP 83 8081 → 47436 [PSH, ACK] Seq=1820 Ack=1837 Win=65152 Len=17 TSval=3806146306 TSecr=1681886596
1712183986.883143187   894 1.648683960    10.10.1.2 → 10.10.1.1    TCP 83 47436 → 8081 [PSH, ACK] Seq=1837 Ack=1837 Win=64256 Len=17 TSval=1681886607 TSecr=3806146306
1712183988.883143187   896 1.648821638    10.10.1.1 → 10.10.1.2    TCP 83 8081 → 47436 [PSH, ACK] Seq=1837 Ack=1854 Win=65152 Len=17 TSval=3806146316 TSecr=1681886607
1712183994.883143187   902 1.659034264    10.10.1.2 → 10.10.1.1    TCP 83 47436 → 8081 [PSH, ACK] Seq=1854 Ack=1854 Win=64256 Len=17 TSval=1681886617 TSecr=3806146316
1712183996.883143187   904 1.659163515    10.10.1.1 → 10.10.1.2    TCP 83 8081 → 47436 [PSH, ACK] Seq=1854 Ack=1871 Win=65152 Len=17 TSval=3806146326 TSecr=1681886617
1712184002.883143187   910 1.669373758    10.10.1.2 → 10.10.1.1    TCP 83 47436 → 8081 [PSH, ACK] Seq=1871 Ack=1871 Win=64256 Len=17 TSval=1681886627 TSecr=3806146326
1712184004.883143187   912 1.669512110    10.10.1.1 → 10.10.1.2    TCP 83 8081 → 47436 [PSH, ACK] Seq=1871 Ack=1888 Win=65152 Len=17 TSval=3806146337 TSecr=1681886627
1712184010.883143187   918 1.679723162    10.10.1.2 → 10.10.1.1    TCP 83 47436 → 8081 [PSH, ACK] Seq=1888 Ack=1888 Win=64256 Len=17 TSval=1681886638 TSecr=3806146337
1712184012.883143187   920 1.679860968    10.10.1.1 → 10.10.1.2    TCP 83 8081 → 47436 [PSH, ACK] Seq=1888 Ack=1905 Win=65152 Len=17 TSval=3806146347 TSecr=1681886638
1712184018.883143187   926 1.690084057    10.10.1.2 → 10.10.1.1    TCP 83 47436 → 8081 [PSH, ACK] Seq=1905 Ack=1905 Win=64256 Len=17 TSval=1681886648 TSecr=3806146347
1712184020.883143187   928 1.690224072    10.10.1.1 → 10.10.1.2    TCP 83 8081 → 47436 [PSH, ACK] Seq=1905 Ack=1922 Win=65152 Len=17 TSval=3806146357 TSecr=1681886648
1712184026.883143187   934 1.700438496    10.10.1.2 → 10.10.1.1    TCP 83 47436 → 8081 [PSH, ACK] Seq=1922 Ack=1922 Win=64256 Len=17 TSval=1681886658 TSecr=3806146357
1712184029.883143187   937 1.700619588    10.10.1.1 → 10.10.1.2    TCP 83 8081 → 47436 [PSH, ACK] Seq=1922 Ack=1939 Win=65152 Len=17 TSval=3806146368 TSecr=1681886658
1712184035.883143187   943 1.710830463    10.10.1.2 → 10.10.1.1    TCP 83 47436 → 8081 [PSH, ACK] Seq=1939 Ack=1939 Win=64256 Len=17 TSval=1681886669 TSecr=3806146368
1712184037.883143187   945 1.710961406    10.10.1.1 → 10.10.1.2    TCP 83 8081 → 47436 [PSH, ACK] Seq=1939 Ack=1956 Win=65152 Len=17 TSval=3806146378 TSecr=1681886669
1712184042.883143187   950 1.721172788    10.10.1.2 → 10.10.1.1    TCP 83 47436 → 8081 [PSH, ACK] Seq=1956 Ack=1956 Win=64256 Len=17 TSval=1681886679 TSecr=3806146378
1712184044.883143187   952 1.721302204    10.10.1.1 → 10.10.1.2    TCP 83 8081 → 47436 [PSH, ACK] Seq=1956 Ack=1973 Win=65152 Len=17 TSval=3806146389 TSecr=1681886679
1712184050.883143187   958 1.731511986    10.10.1.2 → 10.10.1.1    TCP 83 47436 → 8081 [PSH, ACK] Seq=1973 Ack=1973 Win=64256 Len=17 TSval=1681886690 TSecr=3806146389
1712184052.883143187   960 1.731640064    10.10.1.1 → 10.10.1.2    TCP 83 8081 → 47436 [PSH, ACK] Seq=1973 Ack=1990 Win=65152 Len=17 TSval=3806146399 TSecr=1681886690
1712184058.883143187   966 1.741850765    10.10.1.2 → 10.10.1.1    TCP 83 47436 → 8081 [PSH, ACK] Seq=1990 Ack=1990 Win=64256 Len=17 TSval=1681886700 TSecr=3806146399
1712184060.883143187   968 1.741979644    10.10.1.1 → 10.10.1.2    TCP 83 8081 → 47436 [PSH, ACK] Seq=1990 Ack=2007 Win=65152 Len=17 TSval=3806146409 TSecr=1681886700
1712184067.883143187   975 1.752189304    10.10.1.2 → 10.10.1.1    TCP 83 47436 → 8081 [PSH, ACK] Seq=2007 Ack=2007 Win=64256 Len=17 TSval=1681886710 TSecr=3806146409
1712184069.883143187   977 1.752318852    10.10.1.1 → 10.10.1.2    TCP 83 8081 → 47436 [PSH, ACK] Seq=2007 Ack=2024 Win=65152 Len=17 TSval=3806146420 TSecr=1681886710
1712184075.883143187   983 1.762528652    10.10.1.2 → 10.10.1.1    TCP 83 47436 → 8081 [PSH, ACK] Seq=2024 Ack=2024 Win=64256 Len=17 TSval=1681886721 TSecr=3806146420
1712184077.883143187   985 1.762658088    10.10.1.1 → 10.10.1.2    TCP 83 8081 → 47436 [PSH, ACK] Seq=2024 Ack=2041 Win=65152 Len=17 TSval=3806146430 TSecr=1681886721
1712184083.883143187   991 1.772867558    10.10.1.2 → 10.10.1.1    TCP 83 47436 → 8081 [PSH, ACK] Seq=2041 Ack=2041 Win=64256 Len=17 TSval=1681886731 TSecr=3806146430
