1711546330.811681032    23 0.281550365    10.10.1.2 → 10.10.1.1    TCP 74 48956 → 8081 [SYN] Seq=0 Win=64240 Len=0 MSS=1460 SACK_PERM=1 TSval=1045100186 TSecr=0 WS=128
1711546331.811681032    24 0.281587093    10.10.1.1 → 10.10.1.2    TCP 74 8081 → 48956 [SYN, ACK] Seq=0 Ack=1 Win=65160 Len=0 MSS=1460 SACK_PERM=1 TSval=3169359894 TSecr=1045100186 WS=128
1711546332.811681032    25 0.281663153    10.10.1.2 → 10.10.1.1    TCP 66 48956 → 8081 [ACK] Seq=1 Ack=1 Win=64256 Len=0 TSval=1045100186 TSecr=3169359894
1711546342.811681032    35 0.576969540    10.10.1.2 → 10.10.1.1    TCP 83 48956 → 8081 [PSH, ACK] Seq=1 Ack=1 Win=64256 Len=17 TSval=1045100481 TSecr=3169359894
1711546344.811681032    37 0.576998644    10.10.1.1 → 10.10.1.2    TCP 66 8081 → 48956 [ACK] Seq=1 Ack=18 Win=65152 Len=0 TSval=3169360190 TSecr=1045100481
1711546346.811681032    39 0.577291808    10.10.1.1 → 10.10.1.2    TCP 83 8081 → 48956 [PSH, ACK] Seq=1 Ack=18 Win=65152 Len=17 TSval=3169360190 TSecr=1045100481
1711546347.811681032    40 0.577341094    10.10.1.2 → 10.10.1.1    TCP 66 48956 → 8081 [ACK] Seq=18 Ack=18 Win=64256 Len=0 TSval=1045100482 TSecr=3169360190
1711546352.811681032    45 0.583191551    10.10.1.2 → 10.10.1.1    TCP 83 48956 → 8081 [PSH, ACK] Seq=18 Ack=18 Win=64256 Len=17 TSval=1045100488 TSecr=3169360190
1711546355.811681032    48 0.583316166    10.10.1.1 → 10.10.1.2    TCP 83 8081 → 48956 [PSH, ACK] Seq=18 Ack=35 Win=65152 Len=17 TSval=3169360196 TSecr=1045100488
1711546360.811681032    53 0.585782905    10.10.1.2 → 10.10.1.1    TCP 83 48956 → 8081 [PSH, ACK] Seq=35 Ack=35 Win=64256 Len=17 TSval=1045100490 TSecr=3169360196
1711546363.811681032    56 0.585876548    10.10.1.1 → 10.10.1.2    TCP 83 8081 → 48956 [PSH, ACK] Seq=35 Ack=52 Win=65152 Len=17 TSval=3169360199 TSecr=1045100490
1711546368.811681032    61 0.608456926    10.10.1.2 → 10.10.1.1    TCP 83 48956 → 8081 [PSH, ACK] Seq=52 Ack=52 Win=64256 Len=17 TSval=1045100513 TSecr=3169360199
1711546371.811681032    64 0.608586116    10.10.1.1 → 10.10.1.2    TCP 83 8081 → 48956 [PSH, ACK] Seq=52 Ack=69 Win=65152 Len=17 TSval=3169360221 TSecr=1045100513
1711546376.811681032    69 0.612963087    10.10.1.2 → 10.10.1.1    TCP 83 48956 → 8081 [PSH, ACK] Seq=69 Ack=69 Win=64256 Len=17 TSval=1045100517 TSecr=3169360221
1711546379.811681032    72 0.613092678    10.10.1.1 → 10.10.1.2    TCP 83 8081 → 48956 [PSH, ACK] Seq=69 Ack=86 Win=65152 Len=17 TSval=3169360226 TSecr=1045100517
1711546384.811681032    77 0.632007841    10.10.1.2 → 10.10.1.1    TCP 83 48956 → 8081 [PSH, ACK] Seq=86 Ack=86 Win=64256 Len=17 TSval=1045100536 TSecr=3169360226
1711546386.811681032    79 0.632141807    10.10.1.1 → 10.10.1.2    TCP 83 8081 → 48956 [PSH, ACK] Seq=86 Ack=103 Win=65152 Len=17 TSval=3169360245 TSecr=1045100536
1711546392.811681032    85 0.636539652    10.10.1.2 → 10.10.1.1    TCP 83 48956 → 8081 [PSH, ACK] Seq=103 Ack=103 Win=64256 Len=17 TSval=1045100541 TSecr=3169360245
1711546394.811681032    87 0.636676767    10.10.1.1 → 10.10.1.2    TCP 83 8081 → 48956 [PSH, ACK] Seq=103 Ack=120 Win=65152 Len=17 TSval=3169360249 TSecr=1045100541
1711546400.811681032    93 0.657254881    10.10.1.2 → 10.10.1.1    TCP 83 48956 → 8081 [PSH, ACK] Seq=120 Ack=120 Win=64256 Len=17 TSval=1045100562 TSecr=3169360249
1711546402.811681032    95 0.657392541    10.10.1.1 → 10.10.1.2    TCP 83 8081 → 48956 [PSH, ACK] Seq=120 Ack=137 Win=65152 Len=17 TSval=3169360270 TSecr=1045100562
1711546408.811681032   101 0.664944737    10.10.1.2 → 10.10.1.1    TCP 83 48956 → 8081 [PSH, ACK] Seq=137 Ack=137 Win=64256 Len=17 TSval=1045100569 TSecr=3169360270
1711546410.811681032   103 0.665076274    10.10.1.1 → 10.10.1.2    TCP 83 8081 → 48956 [PSH, ACK] Seq=137 Ack=154 Win=65152 Len=17 TSval=3169360278 TSecr=1045100569
1711546416.811681032   109 0.668281776    10.10.1.2 → 10.10.1.1    TCP 83 48956 → 8081 [PSH, ACK] Seq=154 Ack=154 Win=64256 Len=17 TSval=1045100573 TSecr=3169360278
1711546418.811681032   111 0.668406138    10.10.1.1 → 10.10.1.2    TCP 83 8081 → 48956 [PSH, ACK] Seq=154 Ack=171 Win=65152 Len=17 TSval=3169360281 TSecr=1045100573
1711546424.811681032   117 0.671794578    10.10.1.2 → 10.10.1.1    TCP 83 48956 → 8081 [PSH, ACK] Seq=171 Ack=171 Win=64256 Len=17 TSval=1045100576 TSecr=3169360281
1711546426.811681032   119 0.671933129    10.10.1.1 → 10.10.1.2    TCP 83 8081 → 48956 [PSH, ACK] Seq=171 Ack=188 Win=65152 Len=17 TSval=3169360285 TSecr=1045100576
1711546433.811681032   126 0.672600479    10.10.1.2 → 10.10.1.1    TCP 83 48956 → 8081 [PSH, ACK] Seq=188 Ack=188 Win=64256 Len=17 TSval=1045100577 TSecr=3169360285
1711546435.811681032   128 0.672725775    10.10.1.1 → 10.10.1.2    TCP 83 8081 → 48956 [PSH, ACK] Seq=188 Ack=205 Win=65152 Len=17 TSval=3169360285 TSecr=1045100577
1711546440.811681032   133 0.689881539    10.10.1.2 → 10.10.1.1    TCP 83 48956 → 8081 [PSH, ACK] Seq=205 Ack=205 Win=64256 Len=17 TSval=1045100594 TSecr=3169360285
1711546442.811681032   135 0.690011414    10.10.1.1 → 10.10.1.2    TCP 83 8081 → 48956 [PSH, ACK] Seq=205 Ack=222 Win=65152 Len=17 TSval=3169360303 TSecr=1045100594
1711546448.811681032   141 0.694009464    10.10.1.2 → 10.10.1.1    TCP 83 48956 → 8081 [PSH, ACK] Seq=222 Ack=222 Win=64256 Len=17 TSval=1045100598 TSecr=3169360303
1711546450.811681032   143 0.694139448    10.10.1.1 → 10.10.1.2    TCP 83 8081 → 48956 [PSH, ACK] Seq=222 Ack=239 Win=65152 Len=17 TSval=3169360307 TSecr=1045100598
1711546456.811681032   149 0.712083884    10.10.1.2 → 10.10.1.1    TCP 83 48956 → 8081 [PSH, ACK] Seq=239 Ack=239 Win=64256 Len=17 TSval=1045100616 TSecr=3169360307
1711546458.811681032   151 0.712213420    10.10.1.1 → 10.10.1.2    TCP 83 8081 → 48956 [PSH, ACK] Seq=239 Ack=256 Win=65152 Len=17 TSval=3169360325 TSecr=1045100616
1711546464.811681032   157 0.726178414    10.10.1.2 → 10.10.1.1    TCP 83 48956 → 8081 [PSH, ACK] Seq=256 Ack=256 Win=64256 Len=17 TSval=1045100631 TSecr=3169360325
1711546466.811681032   159 0.726315017    10.10.1.1 → 10.10.1.2    TCP 83 8081 → 48956 [PSH, ACK] Seq=256 Ack=273 Win=65152 Len=17 TSval=3169360339 TSecr=1045100631
1711546472.811681032   165 0.771118662    10.10.1.2 → 10.10.1.1    TCP 66 48956 → 8081 [ACK] Seq=273 Ack=273 Win=64256 Len=0 TSval=1045100676 TSecr=3169360339
1711546473.811681032   166 0.774632249    10.10.1.2 → 10.10.1.1    TCP 83 48956 → 8081 [PSH, ACK] Seq=273 Ack=273 Win=64256 Len=17 TSval=1045100679 TSecr=3169360339
1711546475.811681032   168 0.774756782    10.10.1.1 → 10.10.1.2    TCP 83 8081 → 48956 [PSH, ACK] Seq=273 Ack=290 Win=65152 Len=17 TSval=3169360387 TSecr=1045100679
1711546477.811681032   170 0.774794590    10.10.1.2 → 10.10.1.1    TCP 66 48956 → 8081 [ACK] Seq=290 Ack=290 Win=64256 Len=0 TSval=1045100679 TSecr=3169360387
1711546482.811681032   175 0.788060567    10.10.1.2 → 10.10.1.1    TCP 83 48956 → 8081 [PSH, ACK] Seq=290 Ack=290 Win=64256 Len=17 TSval=1045100692 TSecr=3169360387
1711546484.811681032   177 0.788185763    10.10.1.1 → 10.10.1.2    TCP 83 8081 → 48956 [PSH, ACK] Seq=290 Ack=307 Win=65152 Len=17 TSval=3169360401 TSecr=1045100692
1711546490.811681032   183 0.795602255    10.10.1.2 → 10.10.1.1    TCP 83 48956 → 8081 [PSH, ACK] Seq=307 Ack=307 Win=64256 Len=17 TSval=1045100700 TSecr=3169360401
1711546492.811681032   185 0.795740923    10.10.1.1 → 10.10.1.2    TCP 83 8081 → 48956 [PSH, ACK] Seq=307 Ack=324 Win=65152 Len=17 TSval=3169360408 TSecr=1045100700
1711546498.811681032   191 0.823127069    10.10.1.2 → 10.10.1.1    TCP 83 48956 → 8081 [PSH, ACK] Seq=324 Ack=324 Win=64256 Len=17 TSval=1045100728 TSecr=3169360408
1711546500.811681032   193 0.823266260    10.10.1.1 → 10.10.1.2    TCP 83 8081 → 48956 [PSH, ACK] Seq=324 Ack=341 Win=65152 Len=17 TSval=3169360436 TSecr=1045100728
1711546506.811681032   199 0.824193965    10.10.1.2 → 10.10.1.1    TCP 83 48956 → 8081 [PSH, ACK] Seq=341 Ack=341 Win=64256 Len=17 TSval=1045100729 TSecr=3169360436
1711546508.811681032   201 0.824327687    10.10.1.1 → 10.10.1.2    TCP 83 8081 → 48956 [PSH, ACK] Seq=341 Ack=358 Win=65152 Len=17 TSval=3169360437 TSecr=1045100729
1711546514.811681032   207 0.839127423    10.10.1.2 → 10.10.1.1    TCP 83 48956 → 8081 [PSH, ACK] Seq=358 Ack=358 Win=64256 Len=17 TSval=1045100744 TSecr=3169360437
1711546516.811681032   209 0.839263401    10.10.1.1 → 10.10.1.2    TCP 83 8081 → 48956 [PSH, ACK] Seq=358 Ack=375 Win=65152 Len=17 TSval=3169360452 TSecr=1045100744
1711546522.811681032   215 0.841370716    10.10.1.2 → 10.10.1.1    TCP 83 48956 → 8081 [PSH, ACK] Seq=375 Ack=375 Win=64256 Len=17 TSval=1045100746 TSecr=3169360452
1711546524.811681032   217 0.841508773    10.10.1.1 → 10.10.1.2    TCP 83 8081 → 48956 [PSH, ACK] Seq=375 Ack=392 Win=65152 Len=17 TSval=3169360454 TSecr=1045100746
1711546530.811681032   223 0.854559110    10.10.1.2 → 10.10.1.1    TCP 83 48956 → 8081 [PSH, ACK] Seq=392 Ack=392 Win=64256 Len=17 TSval=1045100759 TSecr=3169360454
1711546532.811681032   225 0.854697378    10.10.1.1 → 10.10.1.2    TCP 83 8081 → 48956 [PSH, ACK] Seq=392 Ack=409 Win=65152 Len=17 TSval=3169360467 TSecr=1045100759
1711546538.811681032   231 0.867943786    10.10.1.2 → 10.10.1.1    TCP 83 48956 → 8081 [PSH, ACK] Seq=409 Ack=409 Win=64256 Len=17 TSval=1045100772 TSecr=3169360467
1711546540.811681032   233 0.868080793    10.10.1.1 → 10.10.1.2    TCP 83 8081 → 48956 [PSH, ACK] Seq=409 Ack=426 Win=65152 Len=17 TSval=3169360481 TSecr=1045100772
1711546546.811681032   239 0.883571040    10.10.1.2 → 10.10.1.1    TCP 83 48956 → 8081 [PSH, ACK] Seq=426 Ack=426 Win=64256 Len=17 TSval=1045100788 TSecr=3169360481
1711546548.811681032   241 0.883706189    10.10.1.1 → 10.10.1.2    TCP 83 8081 → 48956 [PSH, ACK] Seq=426 Ack=443 Win=65152 Len=17 TSval=3169360496 TSecr=1045100788
1711546554.811681032   247 0.891070764    10.10.1.2 → 10.10.1.1    TCP 83 48956 → 8081 [PSH, ACK] Seq=443 Ack=443 Win=64256 Len=17 TSval=1045100795 TSecr=3169360496
1711546556.811681032   249 0.891207556    10.10.1.1 → 10.10.1.2    TCP 83 8081 → 48956 [PSH, ACK] Seq=443 Ack=460 Win=65152 Len=17 TSval=3169360504 TSecr=1045100795
1711546562.811681032   255 0.897619462    10.10.1.2 → 10.10.1.1    TCP 83 48956 → 8081 [PSH, ACK] Seq=460 Ack=460 Win=64256 Len=17 TSval=1045100802 TSecr=3169360504
1711546564.811681032   257 0.897757548    10.10.1.1 → 10.10.1.2    TCP 83 8081 → 48956 [PSH, ACK] Seq=460 Ack=477 Win=65152 Len=17 TSval=3169360510 TSecr=1045100802
1711546570.811681032   263 0.900570664    10.10.1.2 → 10.10.1.1    TCP 83 48956 → 8081 [PSH, ACK] Seq=477 Ack=477 Win=64256 Len=17 TSval=1045100805 TSecr=3169360510
1711546572.811681032   265 0.900700467    10.10.1.1 → 10.10.1.2    TCP 83 8081 → 48956 [PSH, ACK] Seq=477 Ack=494 Win=65152 Len=17 TSval=3169360513 TSecr=1045100805
1711546578.811681032   271 0.903324786    10.10.1.2 → 10.10.1.1    TCP 83 48956 → 8081 [PSH, ACK] Seq=494 Ack=494 Win=64256 Len=17 TSval=1045100808 TSecr=3169360513
1711546580.811681032   273 0.903459306    10.10.1.1 → 10.10.1.2    TCP 83 8081 → 48956 [PSH, ACK] Seq=494 Ack=511 Win=65152 Len=17 TSval=3169360516 TSecr=1045100808
1711546586.811681032   279 0.907736079    10.10.1.2 → 10.10.1.1    TCP 83 48956 → 8081 [PSH, ACK] Seq=511 Ack=511 Win=64256 Len=17 TSval=1045100812 TSecr=3169360516
1711546588.811681032   281 0.907865860    10.10.1.1 → 10.10.1.2    TCP 83 8081 → 48956 [PSH, ACK] Seq=511 Ack=528 Win=65152 Len=17 TSval=3169360521 TSecr=1045100812
1711546594.811681032   287 0.910470258    10.10.1.2 → 10.10.1.1    TCP 83 48956 → 8081 [PSH, ACK] Seq=528 Ack=528 Win=64256 Len=17 TSval=1045100815 TSecr=3169360521
1711546596.811681032   289 0.910607820    10.10.1.1 → 10.10.1.2    TCP 83 8081 → 48956 [PSH, ACK] Seq=528 Ack=545 Win=65152 Len=17 TSval=3169360523 TSecr=1045100815
1711546602.811681032   295 0.921238343    10.10.1.2 → 10.10.1.1    TCP 83 48956 → 8081 [PSH, ACK] Seq=545 Ack=545 Win=64256 Len=17 TSval=1045100826 TSecr=3169360523
1711546604.811681032   297 0.921374164    10.10.1.1 → 10.10.1.2    TCP 83 8081 → 48956 [PSH, ACK] Seq=545 Ack=562 Win=65152 Len=17 TSval=3169360534 TSecr=1045100826
1711546610.811681032   303 0.929263899    10.10.1.2 → 10.10.1.1    TCP 83 48956 → 8081 [PSH, ACK] Seq=562 Ack=562 Win=64256 Len=17 TSval=1045100834 TSecr=3169360534
1711546612.811681032   305 0.929401436    10.10.1.1 → 10.10.1.2    TCP 83 8081 → 48956 [PSH, ACK] Seq=562 Ack=579 Win=65152 Len=17 TSval=3169360542 TSecr=1045100834
1711546618.811681032   311 0.930733537    10.10.1.2 → 10.10.1.1    TCP 83 48956 → 8081 [PSH, ACK] Seq=579 Ack=579 Win=64256 Len=17 TSval=1045100835 TSecr=3169360542
1711546620.811681032   313 0.930857842    10.10.1.1 → 10.10.1.2    TCP 83 8081 → 48956 [PSH, ACK] Seq=579 Ack=596 Win=65152 Len=17 TSval=3169360544 TSecr=1045100835
1711546626.811681032   319 0.971114914    10.10.1.2 → 10.10.1.1    TCP 66 48956 → 8081 [ACK] Seq=596 Ack=596 Win=64256 Len=0 TSval=1045100876 TSecr=3169360544
1711546627.811681032   320 0.975124285    10.10.1.2 → 10.10.1.1    TCP 83 48956 → 8081 [PSH, ACK] Seq=596 Ack=596 Win=64256 Len=17 TSval=1045100880 TSecr=3169360544
1711546629.811681032   322 0.975248394    10.10.1.1 → 10.10.1.2    TCP 83 8081 → 48956 [PSH, ACK] Seq=596 Ack=613 Win=65152 Len=17 TSval=3169360588 TSecr=1045100880
1711546631.811681032   324 0.975293390    10.10.1.2 → 10.10.1.1    TCP 66 48956 → 8081 [ACK] Seq=613 Ack=613 Win=64256 Len=0 TSval=1045100880 TSecr=3169360588
1711546636.811681032   329 0.980282006    10.10.1.2 → 10.10.1.1    TCP 83 48956 → 8081 [PSH, ACK] Seq=613 Ack=613 Win=64256 Len=17 TSval=1045100885 TSecr=3169360588
1711546638.811681032   331 0.980406499    10.10.1.1 → 10.10.1.2    TCP 83 8081 → 48956 [PSH, ACK] Seq=613 Ack=630 Win=65152 Len=17 TSval=3169360593 TSecr=1045100885
1711546644.811681032   337 0.986561623    10.10.1.2 → 10.10.1.1    TCP 83 48956 → 8081 [PSH, ACK] Seq=630 Ack=630 Win=64256 Len=17 TSval=1045100891 TSecr=3169360593
1711546646.811681032   339 0.986697420    10.10.1.1 → 10.10.1.2    TCP 83 8081 → 48956 [PSH, ACK] Seq=630 Ack=647 Win=65152 Len=17 TSval=3169360599 TSecr=1045100891
1711546652.811681032   345 1.006389210    10.10.1.2 → 10.10.1.1    TCP 83 48956 → 8081 [PSH, ACK] Seq=647 Ack=647 Win=64256 Len=17 TSval=1045100911 TSecr=3169360599
1711546654.811681032   347 1.006528141    10.10.1.1 → 10.10.1.2    TCP 83 8081 → 48956 [PSH, ACK] Seq=647 Ack=664 Win=65152 Len=17 TSval=3169360619 TSecr=1045100911
1711546660.811681032   353 1.030141027    10.10.1.2 → 10.10.1.1    TCP 83 48956 → 8081 [PSH, ACK] Seq=664 Ack=664 Win=64256 Len=17 TSval=1045100935 TSecr=3169360619
1711546662.811681032   355 1.030275910    10.10.1.1 → 10.10.1.2    TCP 83 8081 → 48956 [PSH, ACK] Seq=664 Ack=681 Win=65152 Len=17 TSval=3169360643 TSecr=1045100935
1711546668.811681032   361 1.042758875    10.10.1.2 → 10.10.1.1    TCP 83 48956 → 8081 [PSH, ACK] Seq=681 Ack=681 Win=64256 Len=17 TSval=1045100947 TSecr=3169360643
1711546670.811681032   363 1.042895163    10.10.1.1 → 10.10.1.2    TCP 83 8081 → 48956 [PSH, ACK] Seq=681 Ack=698 Win=65152 Len=17 TSval=3169360656 TSecr=1045100947
1711546676.811681032   369 1.044469220    10.10.1.2 → 10.10.1.1    TCP 83 48956 → 8081 [PSH, ACK] Seq=698 Ack=698 Win=64256 Len=17 TSval=1045100949 TSecr=3169360656
1711546678.811681032   371 1.044593335    10.10.1.1 → 10.10.1.2    TCP 83 8081 → 48956 [PSH, ACK] Seq=698 Ack=715 Win=65152 Len=17 TSval=3169360657 TSecr=1045100949
1711546684.811681032   377 1.074251203    10.10.1.2 → 10.10.1.1    TCP 83 48956 → 8081 [PSH, ACK] Seq=715 Ack=715 Win=64256 Len=17 TSval=1045100979 TSecr=3169360657
1711546686.811681032   379 1.074390579    10.10.1.1 → 10.10.1.2    TCP 83 8081 → 48956 [PSH, ACK] Seq=715 Ack=732 Win=65152 Len=17 TSval=3169360687 TSecr=1045100979
1711546692.811681032   385 1.082009736    10.10.1.2 → 10.10.1.1    TCP 83 48956 → 8081 [PSH, ACK] Seq=732 Ack=732 Win=64256 Len=17 TSval=1045100986 TSecr=3169360687
1711546694.811681032   387 1.082140113    10.10.1.1 → 10.10.1.2    TCP 83 8081 → 48956 [PSH, ACK] Seq=732 Ack=749 Win=65152 Len=17 TSval=3169360695 TSecr=1045100986
1711546700.811681032   393 1.088238204    10.10.1.2 → 10.10.1.1    TCP 83 48956 → 8081 [PSH, ACK] Seq=749 Ack=749 Win=64256 Len=17 TSval=1045100993 TSecr=3169360695
1711546702.811681032   395 1.088375255    10.10.1.1 → 10.10.1.2    TCP 83 8081 → 48956 [PSH, ACK] Seq=749 Ack=766 Win=65152 Len=17 TSval=3169360701 TSecr=1045100993
1711546708.811681032   401 1.103617851    10.10.1.2 → 10.10.1.1    TCP 83 48956 → 8081 [PSH, ACK] Seq=766 Ack=766 Win=64256 Len=17 TSval=1045101008 TSecr=3169360701
1711546710.811681032   403 1.103753576    10.10.1.1 → 10.10.1.2    TCP 83 8081 → 48956 [PSH, ACK] Seq=766 Ack=783 Win=65152 Len=17 TSval=3169360716 TSecr=1045101008
1711546716.811681032   409 1.107124246    10.10.1.2 → 10.10.1.1    TCP 83 48956 → 8081 [PSH, ACK] Seq=783 Ack=783 Win=64256 Len=17 TSval=1045101012 TSecr=3169360716
1711546718.811681032   411 1.107261593    10.10.1.1 → 10.10.1.2    TCP 83 8081 → 48956 [PSH, ACK] Seq=783 Ack=800 Win=65152 Len=17 TSval=3169360720 TSecr=1045101012
1711546724.811681032   417 1.113218169    10.10.1.2 → 10.10.1.1    TCP 83 48956 → 8081 [PSH, ACK] Seq=800 Ack=800 Win=64256 Len=17 TSval=1045101018 TSecr=3169360720
1711546726.811681032   419 1.113353221    10.10.1.1 → 10.10.1.2    TCP 83 8081 → 48956 [PSH, ACK] Seq=800 Ack=817 Win=65152 Len=17 TSval=3169360726 TSecr=1045101018
1711546732.811681032   425 1.120649936    10.10.1.2 → 10.10.1.1    TCP 83 48956 → 8081 [PSH, ACK] Seq=817 Ack=817 Win=64256 Len=17 TSval=1045101025 TSecr=3169360726
1711546734.811681032   427 1.120808670    10.10.1.1 → 10.10.1.2    TCP 83 8081 → 48956 [PSH, ACK] Seq=817 Ack=834 Win=65152 Len=17 TSval=3169360734 TSecr=1045101025
1711546740.811681032   433 1.136347187    10.10.1.2 → 10.10.1.1    TCP 83 48956 → 8081 [PSH, ACK] Seq=834 Ack=834 Win=64256 Len=17 TSval=1045101041 TSecr=3169360734
1711546742.811681032   435 1.136483195    10.10.1.1 → 10.10.1.2    TCP 83 8081 → 48956 [PSH, ACK] Seq=834 Ack=851 Win=65152 Len=17 TSval=3169360749 TSecr=1045101041
1711546748.811681032   441 1.141335100    10.10.1.2 → 10.10.1.1    TCP 83 48956 → 8081 [PSH, ACK] Seq=851 Ack=851 Win=64256 Len=17 TSval=1045101046 TSecr=3169360749
1711546750.811681032   443 1.141469534    10.10.1.1 → 10.10.1.2    TCP 83 8081 → 48956 [PSH, ACK] Seq=851 Ack=868 Win=65152 Len=17 TSval=3169360754 TSecr=1045101046
1711546756.811681032   449 1.150272894    10.10.1.2 → 10.10.1.1    TCP 83 48956 → 8081 [PSH, ACK] Seq=868 Ack=868 Win=64256 Len=17 TSval=1045101055 TSecr=3169360754
1711546758.811681032   451 1.150409070    10.10.1.1 → 10.10.1.2    TCP 83 8081 → 48956 [PSH, ACK] Seq=868 Ack=885 Win=65152 Len=17 TSval=3169360763 TSecr=1045101055
1711546764.811681032   457 1.158659253    10.10.1.2 → 10.10.1.1    TCP 83 48956 → 8081 [PSH, ACK] Seq=885 Ack=885 Win=64256 Len=17 TSval=1045101063 TSecr=3169360763
1711546766.811681032   459 1.158795392    10.10.1.1 → 10.10.1.2    TCP 83 8081 → 48956 [PSH, ACK] Seq=885 Ack=902 Win=65152 Len=17 TSval=3169360772 TSecr=1045101063
1711546772.811681032   465 1.166859881    10.10.1.2 → 10.10.1.1    TCP 83 48956 → 8081 [PSH, ACK] Seq=902 Ack=902 Win=64256 Len=17 TSval=1045101071 TSecr=3169360772
1711546774.811681032   467 1.166990673    10.10.1.1 → 10.10.1.2    TCP 83 8081 → 48956 [PSH, ACK] Seq=902 Ack=919 Win=65152 Len=17 TSval=3169360780 TSecr=1045101071
1711546780.811681032   473 1.170767297    10.10.1.2 → 10.10.1.1    TCP 83 48956 → 8081 [PSH, ACK] Seq=919 Ack=919 Win=64256 Len=17 TSval=1045101075 TSecr=3169360780
1711546782.811681032   475 1.170901804    10.10.1.1 → 10.10.1.2    TCP 83 8081 → 48956 [PSH, ACK] Seq=919 Ack=936 Win=65152 Len=17 TSval=3169360784 TSecr=1045101075
1711546788.811681032   481 1.174374380    10.10.1.2 → 10.10.1.1    TCP 83 48956 → 8081 [PSH, ACK] Seq=936 Ack=936 Win=64256 Len=17 TSval=1045101079 TSecr=3169360784
1711546790.811681032   483 1.174509553    10.10.1.1 → 10.10.1.2    TCP 83 8081 → 48956 [PSH, ACK] Seq=936 Ack=953 Win=65152 Len=17 TSval=3169360787 TSecr=1045101079
1711546796.811681032   489 1.178680523    10.10.1.2 → 10.10.1.1    TCP 83 48956 → 8081 [PSH, ACK] Seq=953 Ack=953 Win=64256 Len=17 TSval=1045101083 TSecr=3169360787
1711546799.811681032   492 1.179096364    10.10.1.1 → 10.10.1.2    TCP 83 8081 → 48956 [PSH, ACK] Seq=953 Ack=970 Win=65152 Len=17 TSval=3169360792 TSecr=1045101083
1711546804.811681032   497 1.195939730    10.10.1.2 → 10.10.1.1    TCP 83 48956 → 8081 [PSH, ACK] Seq=970 Ack=970 Win=64256 Len=17 TSval=1045101100 TSecr=3169360792
1711546806.811681032   499 1.196077842    10.10.1.1 → 10.10.1.2    TCP 83 8081 → 48956 [PSH, ACK] Seq=970 Ack=987 Win=65152 Len=17 TSval=3169360809 TSecr=1045101100
1711546812.811681032   505 1.209856167    10.10.1.2 → 10.10.1.1    TCP 83 48956 → 8081 [PSH, ACK] Seq=987 Ack=987 Win=64256 Len=17 TSval=1045101114 TSecr=3169360809
1711546814.811681032   507 1.209993942    10.10.1.1 → 10.10.1.2    TCP 83 8081 → 48956 [PSH, ACK] Seq=987 Ack=1004 Win=65152 Len=17 TSval=3169360823 TSecr=1045101114
1711546820.811681032   513 1.218274158    10.10.1.2 → 10.10.1.1    TCP 83 48956 → 8081 [PSH, ACK] Seq=1004 Ack=1004 Win=64256 Len=17 TSval=1045101123 TSecr=3169360823
1711546822.811681032   515 1.218409005    10.10.1.1 → 10.10.1.2    TCP 83 8081 → 48956 [PSH, ACK] Seq=1004 Ack=1021 Win=65152 Len=17 TSval=3169360831 TSecr=1045101123
1711546830.811681032   523 1.218866083    10.10.1.2 → 10.10.1.1    TCP 83 48956 → 8081 [PSH, ACK] Seq=1021 Ack=1021 Win=64256 Len=17 TSval=1045101123 TSecr=3169360831
1711546831.811681032   524 1.218990968    10.10.1.1 → 10.10.1.2    TCP 83 8081 → 48956 [PSH, ACK] Seq=1021 Ack=1038 Win=65152 Len=17 TSval=3169360832 TSecr=1045101123
1711546836.811681032   529 1.219989963    10.10.1.2 → 10.10.1.1    TCP 83 48956 → 8081 [PSH, ACK] Seq=1038 Ack=1038 Win=64256 Len=17 TSval=1045101124 TSecr=3169360832
1711546839.811681032   532 1.220115185    10.10.1.1 → 10.10.1.2    TCP 83 8081 → 48956 [PSH, ACK] Seq=1038 Ack=1055 Win=65152 Len=17 TSval=3169360833 TSecr=1045101124
1711546844.811681032   537 1.234866023    10.10.1.2 → 10.10.1.1    TCP 83 48956 → 8081 [PSH, ACK] Seq=1055 Ack=1055 Win=64256 Len=17 TSval=1045101139 TSecr=3169360833
1711546846.811681032   539 1.235005457    10.10.1.1 → 10.10.1.2    TCP 83 8081 → 48956 [PSH, ACK] Seq=1055 Ack=1072 Win=65152 Len=17 TSval=3169360848 TSecr=1045101139
1711546852.811681032   545 1.246343863    10.10.1.2 → 10.10.1.1    TCP 83 48956 → 8081 [PSH, ACK] Seq=1072 Ack=1072 Win=64256 Len=17 TSval=1045101151 TSecr=3169360848
1711546854.811681032   547 1.246483196    10.10.1.1 → 10.10.1.2    TCP 83 8081 → 48956 [PSH, ACK] Seq=1072 Ack=1089 Win=65152 Len=17 TSval=3169360859 TSecr=1045101151
1711546860.811681032   553 1.256163058    10.10.1.2 → 10.10.1.1    TCP 83 48956 → 8081 [PSH, ACK] Seq=1089 Ack=1089 Win=64256 Len=17 TSval=1045101161 TSecr=3169360859
1711546862.811681032   555 1.256300505    10.10.1.1 → 10.10.1.2    TCP 83 8081 → 48956 [PSH, ACK] Seq=1089 Ack=1106 Win=65152 Len=17 TSval=3169360869 TSecr=1045101161
1711546868.811681032   561 1.277094509    10.10.1.2 → 10.10.1.1    TCP 83 48956 → 8081 [PSH, ACK] Seq=1106 Ack=1106 Win=64256 Len=17 TSval=1045101181 TSecr=3169360869
1711546870.811681032   563 1.277230310    10.10.1.1 → 10.10.1.2    TCP 83 8081 → 48956 [PSH, ACK] Seq=1106 Ack=1123 Win=65152 Len=17 TSval=3169360890 TSecr=1045101181
1711546876.811681032   569 1.288208144    10.10.1.2 → 10.10.1.1    TCP 83 48956 → 8081 [PSH, ACK] Seq=1123 Ack=1123 Win=64256 Len=17 TSval=1045101193 TSecr=3169360890
1711546878.811681032   571 1.288342781    10.10.1.1 → 10.10.1.2    TCP 83 8081 → 48956 [PSH, ACK] Seq=1123 Ack=1140 Win=65152 Len=17 TSval=3169360901 TSecr=1045101193
1711546884.811681032   577 1.331118140    10.10.1.2 → 10.10.1.1    TCP 66 48956 → 8081 [ACK] Seq=1140 Ack=1140 Win=64256 Len=0 TSval=1045101236 TSecr=3169360901
1711546885.811681032   578 1.338748273    10.10.1.2 → 10.10.1.1    TCP 83 48956 → 8081 [PSH, ACK] Seq=1140 Ack=1140 Win=64256 Len=17 TSval=1045101243 TSecr=3169360901
1711546887.811681032   580 1.338881214    10.10.1.1 → 10.10.1.2    TCP 83 8081 → 48956 [PSH, ACK] Seq=1140 Ack=1157 Win=65152 Len=17 TSval=3169360952 TSecr=1045101243
1711546889.811681032   582 1.338923075    10.10.1.2 → 10.10.1.1    TCP 66 48956 → 8081 [ACK] Seq=1157 Ack=1157 Win=64256 Len=0 TSval=1045101243 TSecr=3169360952
1711546894.811681032   587 1.342943984    10.10.1.2 → 10.10.1.1    TCP 83 48956 → 8081 [PSH, ACK] Seq=1157 Ack=1157 Win=64256 Len=17 TSval=1045101247 TSecr=3169360952
1711546896.811681032   589 1.343068748    10.10.1.1 → 10.10.1.2    TCP 83 8081 → 48956 [PSH, ACK] Seq=1157 Ack=1174 Win=65152 Len=17 TSval=3169360956 TSecr=1045101247
1711546902.811681032   595 1.350554552    10.10.1.2 → 10.10.1.1    TCP 83 48956 → 8081 [PSH, ACK] Seq=1174 Ack=1174 Win=64256 Len=17 TSval=1045101255 TSecr=3169360956
1711546904.811681032   597 1.350690738    10.10.1.1 → 10.10.1.2    TCP 83 8081 → 48956 [PSH, ACK] Seq=1174 Ack=1191 Win=65152 Len=17 TSval=3169360963 TSecr=1045101255
1711546910.811681032   603 1.373639073    10.10.1.2 → 10.10.1.1    TCP 83 48956 → 8081 [PSH, ACK] Seq=1191 Ack=1191 Win=64256 Len=17 TSval=1045101278 TSecr=3169360963
1711546912.811681032   605 1.373775347    10.10.1.1 → 10.10.1.2    TCP 83 8081 → 48956 [PSH, ACK] Seq=1191 Ack=1208 Win=65152 Len=17 TSval=3169360987 TSecr=1045101278
1711546920.811681032   613 1.374262331    10.10.1.2 → 10.10.1.1    TCP 83 48956 → 8081 [PSH, ACK] Seq=1208 Ack=1208 Win=64256 Len=17 TSval=1045101279 TSecr=3169360987
1711546921.811681032   614 1.374387790    10.10.1.1 → 10.10.1.2    TCP 83 8081 → 48956 [PSH, ACK] Seq=1208 Ack=1225 Win=65152 Len=17 TSval=3169360987 TSecr=1045101279
1711546926.811681032   619 1.384939314    10.10.1.2 → 10.10.1.1    TCP 83 48956 → 8081 [PSH, ACK] Seq=1225 Ack=1225 Win=64256 Len=17 TSval=1045101289 TSecr=3169360987
1711546928.811681032   621 1.385076830    10.10.1.1 → 10.10.1.2    TCP 83 8081 → 48956 [PSH, ACK] Seq=1225 Ack=1242 Win=65152 Len=17 TSval=3169360998 TSecr=1045101289
1711546934.811681032   627 1.403893569    10.10.1.2 → 10.10.1.1    TCP 83 48956 → 8081 [PSH, ACK] Seq=1242 Ack=1242 Win=64256 Len=17 TSval=1045101308 TSecr=3169360998
1711546936.811681032   629 1.404033095    10.10.1.1 → 10.10.1.2    TCP 83 8081 → 48956 [PSH, ACK] Seq=1242 Ack=1259 Win=65152 Len=17 TSval=3169361017 TSecr=1045101308
1711546942.811681032   635 1.412236915    10.10.1.2 → 10.10.1.1    TCP 83 48956 → 8081 [PSH, ACK] Seq=1259 Ack=1259 Win=64256 Len=17 TSval=1045101317 TSecr=3169361017
1711546944.811681032   637 1.412371862    10.10.1.1 → 10.10.1.2    TCP 83 8081 → 48956 [PSH, ACK] Seq=1259 Ack=1276 Win=65152 Len=17 TSval=3169361025 TSecr=1045101317
1711546950.811681032   643 1.413539714    10.10.1.2 → 10.10.1.1    TCP 83 48956 → 8081 [PSH, ACK] Seq=1276 Ack=1276 Win=64256 Len=17 TSval=1045101318 TSecr=3169361025
1711546952.811681032   645 1.413674761    10.10.1.1 → 10.10.1.2    TCP 83 8081 → 48956 [PSH, ACK] Seq=1276 Ack=1293 Win=65152 Len=17 TSval=3169361026 TSecr=1045101318
1711546958.811681032   651 1.423614911    10.10.1.2 → 10.10.1.1    TCP 83 48956 → 8081 [PSH, ACK] Seq=1293 Ack=1293 Win=64256 Len=17 TSval=1045101328 TSecr=3169361026
1711546960.811681032   653 1.423751153    10.10.1.1 → 10.10.1.2    TCP 83 8081 → 48956 [PSH, ACK] Seq=1293 Ack=1310 Win=65152 Len=17 TSval=3169361036 TSecr=1045101328
1711546966.811681032   659 1.441145338    10.10.1.2 → 10.10.1.1    TCP 83 48956 → 8081 [PSH, ACK] Seq=1310 Ack=1310 Win=64256 Len=17 TSval=1045101346 TSecr=3169361036
1711546968.811681032   661 1.441284240    10.10.1.1 → 10.10.1.2    TCP 83 8081 → 48956 [PSH, ACK] Seq=1310 Ack=1327 Win=65152 Len=17 TSval=3169361054 TSecr=1045101346
1711546974.811681032   667 1.449003343    10.10.1.2 → 10.10.1.1    TCP 83 48956 → 8081 [PSH, ACK] Seq=1327 Ack=1327 Win=64256 Len=17 TSval=1045101353 TSecr=3169361054
1711546977.811681032   670 1.449134099    10.10.1.1 → 10.10.1.2    TCP 83 8081 → 48956 [PSH, ACK] Seq=1327 Ack=1344 Win=65152 Len=17 TSval=3169361062 TSecr=1045101353
1711546982.811681032   675 1.450727642    10.10.1.2 → 10.10.1.1    TCP 83 48956 → 8081 [PSH, ACK] Seq=1344 Ack=1344 Win=64256 Len=17 TSval=1045101355 TSecr=3169361062
1711546984.811681032   677 1.450852459    10.10.1.1 → 10.10.1.2    TCP 83 8081 → 48956 [PSH, ACK] Seq=1344 Ack=1361 Win=65152 Len=17 TSval=3169361064 TSecr=1045101355
1711546990.811681032   683 1.460340213    10.10.1.2 → 10.10.1.1    TCP 83 48956 → 8081 [PSH, ACK] Seq=1361 Ack=1361 Win=64256 Len=17 TSval=1045101365 TSecr=3169361064
1711546992.811681032   685 1.460470345    10.10.1.1 → 10.10.1.2    TCP 83 8081 → 48956 [PSH, ACK] Seq=1361 Ack=1378 Win=65152 Len=17 TSval=3169361073 TSecr=1045101365
1711546998.811681032   691 1.483581933    10.10.1.2 → 10.10.1.1    TCP 83 48956 → 8081 [PSH, ACK] Seq=1378 Ack=1378 Win=64256 Len=17 TSval=1045101388 TSecr=3169361073
1711547000.811681032   693 1.483721411    10.10.1.1 → 10.10.1.2    TCP 83 8081 → 48956 [PSH, ACK] Seq=1378 Ack=1395 Win=65152 Len=17 TSval=3169361096 TSecr=1045101388
1711547006.811681032   699 1.496166423    10.10.1.2 → 10.10.1.1    TCP 83 48956 → 8081 [PSH, ACK] Seq=1395 Ack=1395 Win=64256 Len=17 TSval=1045101401 TSecr=3169361096
1711547008.811681032   701 1.496306180    10.10.1.1 → 10.10.1.2    TCP 83 8081 → 48956 [PSH, ACK] Seq=1395 Ack=1412 Win=65152 Len=17 TSval=3169361109 TSecr=1045101401
1711547014.811681032   707 1.498222690    10.10.1.2 → 10.10.1.1    TCP 83 48956 → 8081 [PSH, ACK] Seq=1412 Ack=1412 Win=64256 Len=17 TSval=1045101403 TSecr=3169361109
1711547016.811681032   709 1.498359257    10.10.1.1 → 10.10.1.2    TCP 83 8081 → 48956 [PSH, ACK] Seq=1412 Ack=1429 Win=65152 Len=17 TSval=3169361111 TSecr=1045101403
1711547022.811681032   715 1.504416631    10.10.1.2 → 10.10.1.1    TCP 83 48956 → 8081 [PSH, ACK] Seq=1429 Ack=1429 Win=64256 Len=17 TSval=1045101409 TSecr=3169361111
1711547024.811681032   717 1.504546816    10.10.1.1 → 10.10.1.2    TCP 83 8081 → 48956 [PSH, ACK] Seq=1429 Ack=1446 Win=65152 Len=17 TSval=3169361117 TSecr=1045101409
1711547028.811681032   721 1.504705653    10.10.1.2 → 10.10.1.1    TCP 83 48956 → 8081 [PSH, ACK] Seq=1446 Ack=1446 Win=64256 Len=17 TSval=1045101409 TSecr=3169361117
1711547030.811681032   723 1.504742163    10.10.1.1 → 10.10.1.2    TCP 83 8081 → 48956 [PSH, ACK] Seq=1446 Ack=1463 Win=65152 Len=17 TSval=3169361117 TSecr=1045101409
1711547036.811681032   729 1.510693633    10.10.1.2 → 10.10.1.1    TCP 83 48956 → 8081 [PSH, ACK] Seq=1463 Ack=1463 Win=64256 Len=17 TSval=1045101415 TSecr=3169361117
1711547038.811681032   731 1.510831092    10.10.1.1 → 10.10.1.2    TCP 83 8081 → 48956 [PSH, ACK] Seq=1463 Ack=1480 Win=65152 Len=17 TSval=3169361124 TSecr=1045101415
1711547044.811681032   737 1.525725493    10.10.1.2 → 10.10.1.1    TCP 83 48956 → 8081 [PSH, ACK] Seq=1480 Ack=1480 Win=64256 Len=17 TSval=1045101430 TSecr=3169361124
1711547046.811681032   739 1.525864329    10.10.1.1 → 10.10.1.2    TCP 83 8081 → 48956 [PSH, ACK] Seq=1480 Ack=1497 Win=65152 Len=17 TSval=3169361139 TSecr=1045101430
1711547052.811681032   745 1.542985666    10.10.1.2 → 10.10.1.1    TCP 83 48956 → 8081 [PSH, ACK] Seq=1497 Ack=1497 Win=64256 Len=17 TSval=1045101447 TSecr=3169361139
1711547054.811681032   747 1.543114636    10.10.1.1 → 10.10.1.2    TCP 83 8081 → 48956 [PSH, ACK] Seq=1497 Ack=1514 Win=65152 Len=17 TSval=3169361156 TSecr=1045101447
1711547060.811681032   753 1.545302950    10.10.1.2 → 10.10.1.1    TCP 83 48956 → 8081 [PSH, ACK] Seq=1514 Ack=1514 Win=64256 Len=17 TSval=1045101450 TSecr=3169361156
1711547062.811681032   755 1.545441270    10.10.1.1 → 10.10.1.2    TCP 83 8081 → 48956 [PSH, ACK] Seq=1514 Ack=1531 Win=65152 Len=17 TSval=3169361158 TSecr=1045101450
1711547068.811681032   761 1.549555047    10.10.1.2 → 10.10.1.1    TCP 83 48956 → 8081 [PSH, ACK] Seq=1531 Ack=1531 Win=64256 Len=17 TSval=1045101454 TSecr=3169361158
1711547070.811681032   763 1.549693501    10.10.1.1 → 10.10.1.2    TCP 83 8081 → 48956 [PSH, ACK] Seq=1531 Ack=1548 Win=65152 Len=17 TSval=3169361162 TSecr=1045101454
1711547076.811681032   769 1.568215336    10.10.1.2 → 10.10.1.1    TCP 83 48956 → 8081 [PSH, ACK] Seq=1548 Ack=1548 Win=64256 Len=17 TSval=1045101473 TSecr=3169361162
1711547078.811681032   771 1.568352935    10.10.1.1 → 10.10.1.2    TCP 83 8081 → 48956 [PSH, ACK] Seq=1548 Ack=1565 Win=65152 Len=17 TSval=3169361181 TSecr=1045101473
1711547084.811681032   777 1.571522261    10.10.1.2 → 10.10.1.1    TCP 83 48956 → 8081 [PSH, ACK] Seq=1565 Ack=1565 Win=64256 Len=17 TSval=1045101476 TSecr=3169361181
1711547086.811681032   779 1.571659554    10.10.1.1 → 10.10.1.2    TCP 83 8081 → 48956 [PSH, ACK] Seq=1565 Ack=1582 Win=65152 Len=17 TSval=3169361184 TSecr=1045101476
1711547092.811681032   785 1.572809767    10.10.1.2 → 10.10.1.1    TCP 83 48956 → 8081 [PSH, ACK] Seq=1582 Ack=1582 Win=64256 Len=17 TSval=1045101477 TSecr=3169361184
1711547095.811681032   788 1.572939242    10.10.1.1 → 10.10.1.2    TCP 83 8081 → 48956 [PSH, ACK] Seq=1582 Ack=1599 Win=65152 Len=17 TSval=3169361186 TSecr=1045101477
1711547100.811681032   793 1.580302366    10.10.1.2 → 10.10.1.1    TCP 83 48956 → 8081 [PSH, ACK] Seq=1599 Ack=1599 Win=64256 Len=17 TSval=1045101485 TSecr=3169361186
1711547102.811681032   795 1.580437639    10.10.1.1 → 10.10.1.2    TCP 83 8081 → 48956 [PSH, ACK] Seq=1599 Ack=1616 Win=65152 Len=17 TSval=3169361193 TSecr=1045101485
1711547108.811681032   801 1.600879878    10.10.1.2 → 10.10.1.1    TCP 83 48956 → 8081 [PSH, ACK] Seq=1616 Ack=1616 Win=64256 Len=17 TSval=1045101505 TSecr=3169361193
1711547110.811681032   803 1.601015560    10.10.1.1 → 10.10.1.2    TCP 83 8081 → 48956 [PSH, ACK] Seq=1616 Ack=1633 Win=65152 Len=17 TSval=3169361214 TSecr=1045101505
1711547116.811681032   809 1.633863707    10.10.1.2 → 10.10.1.1    TCP 83 48956 → 8081 [PSH, ACK] Seq=1633 Ack=1633 Win=64256 Len=17 TSval=1045101538 TSecr=3169361214
1711547118.811681032   811 1.634001862    10.10.1.1 → 10.10.1.2    TCP 83 8081 → 48956 [PSH, ACK] Seq=1633 Ack=1650 Win=65152 Len=17 TSval=3169361247 TSecr=1045101538
1711547124.811681032   817 1.636081120    10.10.1.2 → 10.10.1.1    TCP 83 48956 → 8081 [PSH, ACK] Seq=1650 Ack=1650 Win=64256 Len=17 TSval=1045101540 TSecr=3169361247
1711547126.811681032   819 1.636205195    10.10.1.1 → 10.10.1.2    TCP 83 8081 → 48956 [PSH, ACK] Seq=1650 Ack=1667 Win=65152 Len=17 TSval=3169361249 TSecr=1045101540
1711547132.811681032   825 1.656152522    10.10.1.2 → 10.10.1.1    TCP 83 48956 → 8081 [PSH, ACK] Seq=1667 Ack=1667 Win=64256 Len=17 TSval=1045101561 TSecr=3169361249
1711547134.811681032   827 1.656292129    10.10.1.1 → 10.10.1.2    TCP 83 8081 → 48956 [PSH, ACK] Seq=1667 Ack=1684 Win=65152 Len=17 TSval=3169361269 TSecr=1045101561
1711547140.811681032   833 1.659817341    10.10.1.2 → 10.10.1.1    TCP 83 48956 → 8081 [PSH, ACK] Seq=1684 Ack=1684 Win=64256 Len=17 TSval=1045101564 TSecr=3169361269
1711547142.811681032   835 1.659953488    10.10.1.1 → 10.10.1.2    TCP 83 8081 → 48956 [PSH, ACK] Seq=1684 Ack=1701 Win=65152 Len=17 TSval=3169361273 TSecr=1045101564
1711547148.811681032   841 1.671766293    10.10.1.2 → 10.10.1.1    TCP 83 48956 → 8081 [PSH, ACK] Seq=1701 Ack=1701 Win=64256 Len=17 TSval=1045101576 TSecr=3169361273
1711547150.811681032   843 1.671904728    10.10.1.1 → 10.10.1.2    TCP 83 8081 → 48956 [PSH, ACK] Seq=1701 Ack=1718 Win=65152 Len=17 TSval=3169361285 TSecr=1045101576
1711547156.811681032   849 1.686309754    10.10.1.2 → 10.10.1.1    TCP 83 48956 → 8081 [PSH, ACK] Seq=1718 Ack=1718 Win=64256 Len=17 TSval=1045101591 TSecr=3169361285
1711547158.811681032   851 1.686447608    10.10.1.1 → 10.10.1.2    TCP 83 8081 → 48956 [PSH, ACK] Seq=1718 Ack=1735 Win=65152 Len=17 TSval=3169361299 TSecr=1045101591
1711547164.811681032   857 1.690357293    10.10.1.2 → 10.10.1.1    TCP 83 48956 → 8081 [PSH, ACK] Seq=1735 Ack=1735 Win=64256 Len=17 TSval=1045101595 TSecr=3169361299
1711547166.811681032   859 1.690493764    10.10.1.1 → 10.10.1.2    TCP 83 8081 → 48956 [PSH, ACK] Seq=1735 Ack=1752 Win=65152 Len=17 TSval=3169361303 TSecr=1045101595
1711547172.811681032   865 1.694753994    10.10.1.2 → 10.10.1.1    TCP 83 48956 → 8081 [PSH, ACK] Seq=1752 Ack=1752 Win=64256 Len=17 TSval=1045101599 TSecr=3169361303
1711547174.811681032   867 1.694891646    10.10.1.1 → 10.10.1.2    TCP 83 8081 → 48956 [PSH, ACK] Seq=1752 Ack=1769 Win=65152 Len=17 TSval=3169361308 TSecr=1045101599
1711547180.811681032   873 1.704305583    10.10.1.2 → 10.10.1.1    TCP 83 48956 → 8081 [PSH, ACK] Seq=1769 Ack=1769 Win=64256 Len=17 TSval=1045101609 TSecr=3169361308
1711547182.811681032   875 1.704442328    10.10.1.1 → 10.10.1.2    TCP 83 8081 → 48956 [PSH, ACK] Seq=1769 Ack=1786 Win=65152 Len=17 TSval=3169361317 TSecr=1045101609
1711547188.811681032   881 1.724262721    10.10.1.2 → 10.10.1.1    TCP 83 48956 → 8081 [PSH, ACK] Seq=1786 Ack=1786 Win=64256 Len=17 TSval=1045101629 TSecr=3169361317
1711547190.811681032   883 1.724400906    10.10.1.1 → 10.10.1.2    TCP 83 8081 → 48956 [PSH, ACK] Seq=1786 Ack=1803 Win=65152 Len=17 TSval=3169361337 TSecr=1045101629
1711547196.811681032   889 1.730129517    10.10.1.2 → 10.10.1.1    TCP 83 48956 → 8081 [PSH, ACK] Seq=1803 Ack=1803 Win=64256 Len=17 TSval=1045101635 TSecr=3169361337
1711547198.811681032   891 1.730266557    10.10.1.1 → 10.10.1.2    TCP 83 8081 → 48956 [PSH, ACK] Seq=1803 Ack=1820 Win=65152 Len=17 TSval=3169361343 TSecr=1045101635
1711547204.811681032   897 1.732982022    10.10.1.2 → 10.10.1.1    TCP 83 48956 → 8081 [PSH, ACK] Seq=1820 Ack=1820 Win=64256 Len=17 TSval=1045101637 TSecr=3169361343
1711547206.811681032   899 1.733112411    10.10.1.1 → 10.10.1.2    TCP 83 8081 → 48956 [PSH, ACK] Seq=1820 Ack=1837 Win=65152 Len=17 TSval=3169361346 TSecr=1045101637
1711547212.811681032   905 1.744710762    10.10.1.2 → 10.10.1.1    TCP 83 48956 → 8081 [PSH, ACK] Seq=1837 Ack=1837 Win=64256 Len=17 TSval=1045101649 TSecr=3169361346
1711547214.811681032   907 1.744843496    10.10.1.1 → 10.10.1.2    TCP 83 8081 → 48956 [PSH, ACK] Seq=1837 Ack=1854 Win=65152 Len=17 TSval=3169361358 TSecr=1045101649
1711547220.811681032   913 1.775356990    10.10.1.2 → 10.10.1.1    TCP 83 48956 → 8081 [PSH, ACK] Seq=1854 Ack=1854 Win=64256 Len=17 TSval=1045101680 TSecr=3169361358
1711547222.811681032   915 1.775495110    10.10.1.1 → 10.10.1.2    TCP 83 8081 → 48956 [PSH, ACK] Seq=1854 Ack=1871 Win=65152 Len=17 TSval=3169361388 TSecr=1045101680
1711547228.811681032   921 1.780076720    10.10.1.2 → 10.10.1.1    TCP 83 48956 → 8081 [PSH, ACK] Seq=1871 Ack=1871 Win=64256 Len=17 TSval=1045101684 TSecr=3169361388
1711547230.811681032   923 1.780207869    10.10.1.1 → 10.10.1.2    TCP 83 8081 → 48956 [PSH, ACK] Seq=1871 Ack=1888 Win=65152 Len=17 TSval=3169361393 TSecr=1045101684
1711547236.811681032   929 1.783762106    10.10.1.2 → 10.10.1.1    TCP 83 48956 → 8081 [PSH, ACK] Seq=1888 Ack=1888 Win=64256 Len=17 TSval=1045101688 TSecr=3169361393
1711547238.811681032   931 1.783900998    10.10.1.1 → 10.10.1.2    TCP 83 8081 → 48956 [PSH, ACK] Seq=1888 Ack=1905 Win=65152 Len=17 TSval=3169361397 TSecr=1045101688
1711547244.811681032   937 1.803122577    10.10.1.2 → 10.10.1.1    TCP 83 48956 → 8081 [PSH, ACK] Seq=1905 Ack=1905 Win=64256 Len=17 TSval=1045101708 TSecr=3169361397
1711547246.811681032   939 1.803252141    10.10.1.1 → 10.10.1.2    TCP 83 8081 → 48956 [PSH, ACK] Seq=1905 Ack=1922 Win=65152 Len=17 TSval=3169361416 TSecr=1045101708
1711547254.811681032   947 1.804076511    10.10.1.2 → 10.10.1.1    TCP 83 48956 → 8081 [PSH, ACK] Seq=1922 Ack=1922 Win=64256 Len=17 TSval=1045101708 TSecr=3169361416
1711547255.811681032   948 1.804254367    10.10.1.1 → 10.10.1.2    TCP 83 8081 → 48956 [PSH, ACK] Seq=1922 Ack=1939 Win=65152 Len=17 TSval=3169361417 TSecr=1045101708
1711547260.811681032   953 1.810276835    10.10.1.2 → 10.10.1.1    TCP 83 48956 → 8081 [PSH, ACK] Seq=1939 Ack=1939 Win=64256 Len=17 TSval=1045101715 TSecr=3169361417
1711547262.811681032   955 1.810414471    10.10.1.1 → 10.10.1.2    TCP 83 8081 → 48956 [PSH, ACK] Seq=1939 Ack=1956 Win=65152 Len=17 TSval=3169361423 TSecr=1045101715
