1711546948.696017981    34 0.604757554    10.10.1.2 → 10.10.1.1    TCP 83 53846 → 8081 [PSH, ACK] Seq=1 Ack=1 Win=64256 Len=17 TSval=1045707390 TSecr=3169966774
1711546952.696017981    38 0.605071008    10.10.1.1 → 10.10.1.2    TCP 83 8081 → 53846 [PSH, ACK] Seq=1 Ack=18 Win=65152 Len=17 TSval=3169967099 TSecr=1045707390
1711546958.696017981    44 0.610504358    10.10.1.2 → 10.10.1.1    TCP 83 53846 → 8081 [PSH, ACK] Seq=18 Ack=18 Win=64256 Len=17 TSval=1045707396 TSecr=3169967099
1711546961.696017981    47 0.610641390    10.10.1.1 → 10.10.1.2    TCP 83 8081 → 53846 [PSH, ACK] Seq=18 Ack=35 Win=65152 Len=17 TSval=3169967105 TSecr=1045707396
1711546967.696017981    53 0.674165747    10.10.1.2 → 10.10.1.1    TCP 83 53846 → 8081 [PSH, ACK] Seq=35 Ack=35 Win=64256 Len=17 TSval=1045707459 TSecr=3169967105
1711546970.696017981    56 0.674303727    10.10.1.1 → 10.10.1.2    TCP 83 8081 → 53846 [PSH, ACK] Seq=35 Ack=52 Win=65152 Len=17 TSval=3169967168 TSecr=1045707459
1711546977.696017981    63 0.951814604    10.10.1.2 → 10.10.1.1    TCP 83 53846 → 8081 [PSH, ACK] Seq=52 Ack=52 Win=64256 Len=17 TSval=1045707737 TSecr=3169967168
1711546980.696017981    66 0.951937622    10.10.1.1 → 10.10.1.2    TCP 83 8081 → 53846 [PSH, ACK] Seq=52 Ack=69 Win=65152 Len=17 TSval=3169967446 TSecr=1045707737
1711546986.696017981    72 1.121593816    10.10.1.2 → 10.10.1.1    TCP 83 53846 → 8081 [PSH, ACK] Seq=69 Ack=69 Win=64256 Len=17 TSval=1045707907 TSecr=3169967446
1711546989.696017981    75 1.121711603    10.10.1.1 → 10.10.1.2    TCP 83 8081 → 53846 [PSH, ACK] Seq=69 Ack=86 Win=65152 Len=17 TSval=3169967616 TSecr=1045707907
1711546995.696017981    81 1.505874475    10.10.1.2 → 10.10.1.1    TCP 83 53846 → 8081 [PSH, ACK] Seq=86 Ack=86 Win=64256 Len=17 TSval=1045708291 TSecr=3169967616
1711546998.696017981    84 1.505993492    10.10.1.1 → 10.10.1.2    TCP 83 8081 → 53846 [PSH, ACK] Seq=86 Ack=103 Win=65152 Len=17 TSval=3169968000 TSecr=1045708291
1711547004.696017981    90 1.538526798    10.10.1.2 → 10.10.1.1    TCP 83 53846 → 8081 [PSH, ACK] Seq=103 Ack=103 Win=64256 Len=17 TSval=1045708324 TSecr=3169968000
1711547007.696017981    93 1.538641326    10.10.1.1 → 10.10.1.2    TCP 83 8081 → 53846 [PSH, ACK] Seq=103 Ack=120 Win=65152 Len=17 TSval=3169968033 TSecr=1045708324
1711547013.696017981    99 1.765227893    10.10.1.2 → 10.10.1.1    TCP 83 53846 → 8081 [PSH, ACK] Seq=120 Ack=120 Win=64256 Len=17 TSval=1045708550 TSecr=3169968033
1711547016.696017981   102 1.765343316    10.10.1.1 → 10.10.1.2    TCP 83 8081 → 53846 [PSH, ACK] Seq=120 Ack=137 Win=65152 Len=17 TSval=3169968259 TSecr=1045708550
1711547022.696017981   108 2.103665099    10.10.1.2 → 10.10.1.1    TCP 83 53846 → 8081 [PSH, ACK] Seq=137 Ack=137 Win=64256 Len=17 TSval=1045708889 TSecr=3169968259
1711547025.696017981   111 2.103783902    10.10.1.1 → 10.10.1.2    TCP 83 8081 → 53846 [PSH, ACK] Seq=137 Ack=154 Win=65152 Len=17 TSval=3169968598 TSecr=1045708889
1711547031.696017981   117 2.325607369    10.10.1.2 → 10.10.1.1    TCP 83 53846 → 8081 [PSH, ACK] Seq=154 Ack=154 Win=64256 Len=17 TSval=1045709111 TSecr=3169968598
1711547034.696017981   120 2.325724044    10.10.1.1 → 10.10.1.2    TCP 83 8081 → 53846 [PSH, ACK] Seq=154 Ack=171 Win=65152 Len=17 TSval=3169968820 TSecr=1045709111
1711547040.696017981   126 2.456861497    10.10.1.2 → 10.10.1.1    TCP 83 53846 → 8081 [PSH, ACK] Seq=171 Ack=171 Win=64256 Len=17 TSval=1045709242 TSecr=3169968820
1711547043.696017981   129 2.456988413    10.10.1.1 → 10.10.1.2    TCP 83 8081 → 53846 [PSH, ACK] Seq=171 Ack=188 Win=65152 Len=17 TSval=3169968951 TSecr=1045709242
1711547049.696017981   135 2.548551654    10.10.1.2 → 10.10.1.1    TCP 83 53846 → 8081 [PSH, ACK] Seq=188 Ack=188 Win=64256 Len=17 TSval=1045709334 TSecr=3169968951
1711547052.696017981   138 2.548665508    10.10.1.1 → 10.10.1.2    TCP 83 8081 → 53846 [PSH, ACK] Seq=188 Ack=205 Win=65152 Len=17 TSval=3169969043 TSecr=1045709334
1711547058.696017981   144 2.647016413    10.10.1.2 → 10.10.1.1    TCP 83 53846 → 8081 [PSH, ACK] Seq=205 Ack=205 Win=64256 Len=17 TSval=1045709432 TSecr=3169969043
1711547061.696017981   147 2.647132960    10.10.1.1 → 10.10.1.2    TCP 83 8081 → 53846 [PSH, ACK] Seq=205 Ack=222 Win=65152 Len=17 TSval=3169969141 TSecr=1045709432
1711547067.696017981   153 2.746411940    10.10.1.2 → 10.10.1.1    TCP 83 53846 → 8081 [PSH, ACK] Seq=222 Ack=222 Win=64256 Len=17 TSval=1045709532 TSecr=3169969141
1711547070.696017981   156 2.746529600    10.10.1.1 → 10.10.1.2    TCP 83 8081 → 53846 [PSH, ACK] Seq=222 Ack=239 Win=65152 Len=17 TSval=3169969240 TSecr=1045709532
1711547076.696017981   162 2.807413134    10.10.1.2 → 10.10.1.1    TCP 83 53846 → 8081 [PSH, ACK] Seq=239 Ack=239 Win=64256 Len=17 TSval=1045709593 TSecr=3169969240
1711547079.696017981   165 2.807532069    10.10.1.1 → 10.10.1.2    TCP 83 8081 → 53846 [PSH, ACK] Seq=239 Ack=256 Win=65152 Len=17 TSval=3169969301 TSecr=1045709593
1711547086.696017981   172 2.914784815    10.10.1.2 → 10.10.1.1    TCP 83 53846 → 8081 [PSH, ACK] Seq=256 Ack=256 Win=64256 Len=17 TSval=1045709700 TSecr=3169969301
1711547088.696017981   174 2.914890075    10.10.1.1 → 10.10.1.2    TCP 83 8081 → 53846 [PSH, ACK] Seq=256 Ack=273 Win=65152 Len=17 TSval=3169969409 TSecr=1045709700
1711547095.696017981   181 3.014286876    10.10.1.2 → 10.10.1.1    TCP 83 53846 → 8081 [PSH, ACK] Seq=273 Ack=273 Win=64256 Len=17 TSval=1045709799 TSecr=3169969409
1711547097.696017981   183 3.014394609    10.10.1.1 → 10.10.1.2    TCP 83 8081 → 53846 [PSH, ACK] Seq=273 Ack=290 Win=65152 Len=17 TSval=3169969508 TSecr=1045709799
1711547104.696017981   190 3.037075745    10.10.1.2 → 10.10.1.1    TCP 83 53846 → 8081 [PSH, ACK] Seq=290 Ack=290 Win=64256 Len=17 TSval=1045709822 TSecr=3169969508
1711547106.696017981   192 3.037180415    10.10.1.1 → 10.10.1.2    TCP 83 8081 → 53846 [PSH, ACK] Seq=290 Ack=307 Win=65152 Len=17 TSval=3169969531 TSecr=1045709822
1711547113.696017981   199 3.125895366    10.10.1.2 → 10.10.1.1    TCP 83 53846 → 8081 [PSH, ACK] Seq=307 Ack=307 Win=64256 Len=17 TSval=1045709911 TSecr=3169969531
1711547115.696017981   201 3.126000903    10.10.1.1 → 10.10.1.2    TCP 83 8081 → 53846 [PSH, ACK] Seq=307 Ack=324 Win=65152 Len=17 TSval=3169969620 TSecr=1045709911
1711547122.696017981   208 3.226518835    10.10.1.2 → 10.10.1.1    TCP 83 53846 → 8081 [PSH, ACK] Seq=324 Ack=324 Win=64256 Len=17 TSval=1045710012 TSecr=3169969620
1711547124.696017981   210 3.226623842    10.10.1.1 → 10.10.1.2    TCP 83 8081 → 53846 [PSH, ACK] Seq=324 Ack=341 Win=65152 Len=17 TSval=3169969721 TSecr=1045710012
1711547131.696017981   217 3.527164401    10.10.1.2 → 10.10.1.1    TCP 83 53846 → 8081 [PSH, ACK] Seq=341 Ack=341 Win=64256 Len=17 TSval=1045710312 TSecr=3169969721
1711547134.696017981   220 3.527281130    10.10.1.1 → 10.10.1.2    TCP 83 8081 → 53846 [PSH, ACK] Seq=341 Ack=358 Win=65152 Len=17 TSval=3169970021 TSecr=1045710312
1711547140.696017981   226 3.579613644    10.10.1.2 → 10.10.1.1    TCP 83 53846 → 8081 [PSH, ACK] Seq=358 Ack=358 Win=64256 Len=17 TSval=1045710365 TSecr=3169970021
1711547143.696017981   229 3.579738402    10.10.1.1 → 10.10.1.2    TCP 83 8081 → 53846 [PSH, ACK] Seq=358 Ack=375 Win=65152 Len=17 TSval=3169970074 TSecr=1045710365
1711547149.696017981   235 3.580180083    10.10.1.2 → 10.10.1.1    TCP 83 53846 → 8081 [PSH, ACK] Seq=375 Ack=375 Win=64256 Len=17 TSval=1045710365 TSecr=3169970074
1711547152.696017981   238 3.580288151    10.10.1.1 → 10.10.1.2    TCP 83 8081 → 53846 [PSH, ACK] Seq=375 Ack=392 Win=65152 Len=17 TSval=3169970074 TSecr=1045710365
1711547157.696017981   243 3.622071062    10.10.1.2 → 10.10.1.1    TCP 83 53846 → 8081 [PSH, ACK] Seq=392 Ack=392 Win=64256 Len=17 TSval=1045710407 TSecr=3169970074
1711547160.696017981   246 3.622201045    10.10.1.1 → 10.10.1.2    TCP 83 8081 → 53846 [PSH, ACK] Seq=392 Ack=409 Win=65152 Len=17 TSval=3169970116 TSecr=1045710407
1711547165.696017981   251 3.658059037    10.10.1.2 → 10.10.1.1    TCP 83 53846 → 8081 [PSH, ACK] Seq=409 Ack=409 Win=64256 Len=17 TSval=1045710443 TSecr=3169970116
1711547168.696017981   254 3.658186051    10.10.1.1 → 10.10.1.2    TCP 83 8081 → 53846 [PSH, ACK] Seq=409 Ack=426 Win=65152 Len=17 TSval=3169970152 TSecr=1045710443
1711547174.696017981   260 3.855293701    10.10.1.2 → 10.10.1.1    TCP 83 53846 → 8081 [PSH, ACK] Seq=426 Ack=426 Win=64256 Len=17 TSval=1045710640 TSecr=3169970152
1711547177.696017981   263 3.855421442    10.10.1.1 → 10.10.1.2    TCP 83 8081 → 53846 [PSH, ACK] Seq=426 Ack=443 Win=65152 Len=17 TSval=3169970349 TSecr=1045710640
1711547183.696017981   269 3.970834170    10.10.1.2 → 10.10.1.1    TCP 83 53846 → 8081 [PSH, ACK] Seq=443 Ack=443 Win=64256 Len=17 TSval=1045710756 TSecr=3169970349
1711547185.696017981   271 3.970965387    10.10.1.1 → 10.10.1.2    TCP 83 8081 → 53846 [PSH, ACK] Seq=443 Ack=460 Win=65152 Len=17 TSval=3169970465 TSecr=1045710756
1711547192.696017981   278 4.077972144    10.10.1.2 → 10.10.1.1    TCP 83 53846 → 8081 [PSH, ACK] Seq=460 Ack=460 Win=64256 Len=17 TSval=1045710863 TSecr=3169970465
1711547194.696017981   280 4.078097386    10.10.1.1 → 10.10.1.2    TCP 83 8081 → 53846 [PSH, ACK] Seq=460 Ack=477 Win=65152 Len=17 TSval=3169970572 TSecr=1045710863
1711547201.696017981   287 4.206726202    10.10.1.2 → 10.10.1.1    TCP 83 53846 → 8081 [PSH, ACK] Seq=477 Ack=477 Win=64256 Len=17 TSval=1045710992 TSecr=3169970572
1711547203.696017981   289 4.206853061    10.10.1.1 → 10.10.1.2    TCP 83 8081 → 53846 [PSH, ACK] Seq=477 Ack=494 Win=65152 Len=17 TSval=3169970701 TSecr=1045710992
1711547210.696017981   296 4.319050909    10.10.1.2 → 10.10.1.1    TCP 83 53846 → 8081 [PSH, ACK] Seq=494 Ack=494 Win=64256 Len=17 TSval=1045711104 TSecr=3169970701
1711547212.696017981   298 4.319175171    10.10.1.1 → 10.10.1.2    TCP 83 8081 → 53846 [PSH, ACK] Seq=494 Ack=511 Win=65152 Len=17 TSval=3169970813 TSecr=1045711104
1711547219.696017981   305 4.455402033    10.10.1.2 → 10.10.1.1    TCP 83 53846 → 8081 [PSH, ACK] Seq=511 Ack=511 Win=64256 Len=17 TSval=1045711241 TSecr=3169970813
1711547221.696017981   307 4.455527878    10.10.1.1 → 10.10.1.2    TCP 83 8081 → 53846 [PSH, ACK] Seq=511 Ack=528 Win=65152 Len=17 TSval=3169970949 TSecr=1045711241
1711547228.696017981   314 4.485220418    10.10.1.2 → 10.10.1.1    TCP 83 53846 → 8081 [PSH, ACK] Seq=528 Ack=528 Win=64256 Len=17 TSval=1045711270 TSecr=3169970949
1711547230.696017981   316 4.485344515    10.10.1.1 → 10.10.1.2    TCP 83 8081 → 53846 [PSH, ACK] Seq=528 Ack=545 Win=65152 Len=17 TSval=3169970979 TSecr=1045711270
1711547237.696017981   323 4.614496637    10.10.1.2 → 10.10.1.1    TCP 83 53846 → 8081 [PSH, ACK] Seq=545 Ack=545 Win=64256 Len=17 TSval=1045711400 TSecr=3169970979
1711547239.696017981   325 4.614622900    10.10.1.1 → 10.10.1.2    TCP 83 8081 → 53846 [PSH, ACK] Seq=545 Ack=562 Win=65152 Len=17 TSval=3169971109 TSecr=1045711400
1711547246.696017981   332 4.638719486    10.10.1.2 → 10.10.1.1    TCP 83 53846 → 8081 [PSH, ACK] Seq=562 Ack=562 Win=64256 Len=17 TSval=1045711424 TSecr=3169971109
1711547248.696017981   334 4.638844284    10.10.1.1 → 10.10.1.2    TCP 83 8081 → 53846 [PSH, ACK] Seq=562 Ack=579 Win=65152 Len=17 TSval=3169971133 TSecr=1045711424
1711547254.696017981   340 4.660476621    10.10.1.2 → 10.10.1.1    TCP 83 53846 → 8081 [PSH, ACK] Seq=579 Ack=579 Win=64256 Len=17 TSval=1045711446 TSecr=3169971133
1711547256.696017981   342 4.660613932    10.10.1.1 → 10.10.1.2    TCP 83 8081 → 53846 [PSH, ACK] Seq=579 Ack=596 Win=65152 Len=17 TSval=3169971155 TSecr=1045711446
1711547263.696017981   349 4.738653372    10.10.1.2 → 10.10.1.1    TCP 83 53846 → 8081 [PSH, ACK] Seq=596 Ack=596 Win=64256 Len=17 TSval=1045711524 TSecr=3169971155
1711547265.696017981   351 4.738778169    10.10.1.1 → 10.10.1.2    TCP 83 8081 → 53846 [PSH, ACK] Seq=596 Ack=613 Win=65152 Len=17 TSval=3169971233 TSecr=1045711524
1711547272.696017981   358 4.760176879    10.10.1.2 → 10.10.1.1    TCP 83 53846 → 8081 [PSH, ACK] Seq=613 Ack=613 Win=64256 Len=17 TSval=1045711545 TSecr=3169971233
1711547274.696017981   360 4.760301228    10.10.1.1 → 10.10.1.2    TCP 83 8081 → 53846 [PSH, ACK] Seq=613 Ack=630 Win=65152 Len=17 TSval=3169971254 TSecr=1045711545
1711547281.696017981   367 4.823821345    10.10.1.2 → 10.10.1.1    TCP 83 53846 → 8081 [PSH, ACK] Seq=630 Ack=630 Win=64256 Len=17 TSval=1045711609 TSecr=3169971254
1711547283.696017981   369 4.823945884    10.10.1.1 → 10.10.1.2    TCP 83 8081 → 53846 [PSH, ACK] Seq=630 Ack=647 Win=65152 Len=17 TSval=3169971318 TSecr=1045711609
1711547290.696017981   376 4.881576405    10.10.1.2 → 10.10.1.1    TCP 83 53846 → 8081 [PSH, ACK] Seq=647 Ack=647 Win=64256 Len=17 TSval=1045711667 TSecr=3169971318
1711547292.696017981   378 4.881701127    10.10.1.1 → 10.10.1.2    TCP 83 8081 → 53846 [PSH, ACK] Seq=647 Ack=664 Win=65152 Len=17 TSval=3169971376 TSecr=1045711667
1711547299.696017981   385 4.898983467    10.10.1.2 → 10.10.1.1    TCP 83 53846 → 8081 [PSH, ACK] Seq=664 Ack=664 Win=64256 Len=17 TSval=1045711684 TSecr=3169971376
1711547301.696017981   387 4.899107293    10.10.1.1 → 10.10.1.2    TCP 83 8081 → 53846 [PSH, ACK] Seq=664 Ack=681 Win=65152 Len=17 TSval=3169971393 TSecr=1045711684
1711547308.696017981   394 4.943951411    10.10.1.2 → 10.10.1.1    TCP 83 53846 → 8081 [PSH, ACK] Seq=681 Ack=681 Win=64256 Len=17 TSval=1045711729 TSecr=3169971393
1711547310.696017981   396 4.944086428    10.10.1.1 → 10.10.1.2    TCP 83 8081 → 53846 [PSH, ACK] Seq=681 Ack=698 Win=65152 Len=17 TSval=3169971438 TSecr=1045711729
1711547316.696017981   402 4.962549568    10.10.1.2 → 10.10.1.1    TCP 83 53846 → 8081 [PSH, ACK] Seq=698 Ack=698 Win=64256 Len=17 TSval=1045711748 TSecr=3169971438
1711547318.696017981   404 4.962684660    10.10.1.1 → 10.10.1.2    TCP 83 8081 → 53846 [PSH, ACK] Seq=698 Ack=715 Win=65152 Len=17 TSval=3169971457 TSecr=1045711748
1711547325.696017981   411 5.103863193    10.10.1.2 → 10.10.1.1    TCP 83 53846 → 8081 [PSH, ACK] Seq=715 Ack=715 Win=64256 Len=17 TSval=1045711889 TSecr=3169971457
1711547327.696017981   413 5.103987406    10.10.1.1 → 10.10.1.2    TCP 83 8081 → 53846 [PSH, ACK] Seq=715 Ack=732 Win=65152 Len=17 TSval=3169971598 TSecr=1045711889
1711547334.696017981   420 5.525748528    10.10.1.2 → 10.10.1.1    TCP 83 53846 → 8081 [PSH, ACK] Seq=732 Ack=732 Win=64256 Len=17 TSval=1045712311 TSecr=3169971598
1711547337.696017981   423 5.525872730    10.10.1.1 → 10.10.1.2    TCP 83 8081 → 53846 [PSH, ACK] Seq=732 Ack=749 Win=65152 Len=17 TSval=3169972020 TSecr=1045712311
1711547343.696017981   429 5.684818197    10.10.1.2 → 10.10.1.1    TCP 83 53846 → 8081 [PSH, ACK] Seq=749 Ack=749 Win=64256 Len=17 TSval=1045712470 TSecr=3169972020
1711547346.696017981   432 5.684942465    10.10.1.1 → 10.10.1.2    TCP 83 8081 → 53846 [PSH, ACK] Seq=749 Ack=766 Win=65152 Len=17 TSval=3169972179 TSecr=1045712470
1711547352.696017981   438 5.708810858    10.10.1.2 → 10.10.1.1    TCP 83 53846 → 8081 [PSH, ACK] Seq=766 Ack=766 Win=64256 Len=17 TSval=1045712494 TSecr=3169972179
1711547355.696017981   441 5.708935230    10.10.1.1 → 10.10.1.2    TCP 83 8081 → 53846 [PSH, ACK] Seq=766 Ack=783 Win=65152 Len=17 TSval=3169972203 TSecr=1045712494
1711547361.696017981   447 5.811973778    10.10.1.2 → 10.10.1.1    TCP 83 53846 → 8081 [PSH, ACK] Seq=783 Ack=783 Win=64256 Len=17 TSval=1045712597 TSecr=3169972203
1711547364.696017981   450 5.812099589    10.10.1.1 → 10.10.1.2    TCP 83 8081 → 53846 [PSH, ACK] Seq=783 Ack=800 Win=65152 Len=17 TSval=3169972306 TSecr=1045712597
1711547370.696017981   456 5.867588976    10.10.1.2 → 10.10.1.1    TCP 83 53846 → 8081 [PSH, ACK] Seq=800 Ack=800 Win=64256 Len=17 TSval=1045712653 TSecr=3169972306
1711547373.696017981   459 5.867716454    10.10.1.1 → 10.10.1.2    TCP 83 8081 → 53846 [PSH, ACK] Seq=800 Ack=817 Win=65152 Len=17 TSval=3169972362 TSecr=1045712653
1711547379.696017981   465 5.921014259    10.10.1.2 → 10.10.1.1    TCP 83 53846 → 8081 [PSH, ACK] Seq=817 Ack=817 Win=64256 Len=17 TSval=1045712706 TSecr=3169972362
1711547382.696017981   468 5.921138131    10.10.1.1 → 10.10.1.2    TCP 83 8081 → 53846 [PSH, ACK] Seq=817 Ack=834 Win=65152 Len=17 TSval=3169972415 TSecr=1045712706
1711547388.696017981   474 5.947447596    10.10.1.2 → 10.10.1.1    TCP 83 53846 → 8081 [PSH, ACK] Seq=834 Ack=834 Win=64256 Len=17 TSval=1045712733 TSecr=3169972415
1711547390.696017981   476 5.947595508    10.10.1.1 → 10.10.1.2    TCP 83 8081 → 53846 [PSH, ACK] Seq=834 Ack=851 Win=65152 Len=17 TSval=3169972442 TSecr=1045712733
1711547396.696017981   482 5.953770819    10.10.1.2 → 10.10.1.1    TCP 83 53846 → 8081 [PSH, ACK] Seq=851 Ack=851 Win=64256 Len=17 TSval=1045712739 TSecr=3169972442
1711547398.696017981   484 5.953906764    10.10.1.1 → 10.10.1.2    TCP 83 8081 → 53846 [PSH, ACK] Seq=851 Ack=868 Win=65152 Len=17 TSval=3169972448 TSecr=1045712739
1711547405.696017981   491 5.999101666    10.10.1.2 → 10.10.1.1    TCP 83 53846 → 8081 [PSH, ACK] Seq=868 Ack=868 Win=64256 Len=17 TSval=1045712784 TSecr=3169972448
1711547407.696017981   493 5.999226588    10.10.1.1 → 10.10.1.2    TCP 83 8081 → 53846 [PSH, ACK] Seq=868 Ack=885 Win=65152 Len=17 TSval=3169972493 TSecr=1045712784
1711547414.696017981   500 6.100466233    10.10.1.2 → 10.10.1.1    TCP 83 53846 → 8081 [PSH, ACK] Seq=885 Ack=885 Win=64256 Len=17 TSval=1045712886 TSecr=3169972493
1711547416.696017981   502 6.100591180    10.10.1.1 → 10.10.1.2    TCP 83 8081 → 53846 [PSH, ACK] Seq=885 Ack=902 Win=65152 Len=17 TSval=3169972595 TSecr=1045712886
1711547423.696017981   509 6.107071620    10.10.1.2 → 10.10.1.1    TCP 83 53846 → 8081 [PSH, ACK] Seq=902 Ack=902 Win=64256 Len=17 TSval=1045712892 TSecr=3169972595
1711547425.696017981   511 6.107195013    10.10.1.1 → 10.10.1.2    TCP 83 8081 → 53846 [PSH, ACK] Seq=902 Ack=919 Win=65152 Len=17 TSval=3169972601 TSecr=1045712892
1711547432.696017981   518 6.228611578    10.10.1.2 → 10.10.1.1    TCP 83 53846 → 8081 [PSH, ACK] Seq=919 Ack=919 Win=64256 Len=17 TSval=1045713014 TSecr=3169972601
1711547434.696017981   520 6.228737827    10.10.1.1 → 10.10.1.2    TCP 83 8081 → 53846 [PSH, ACK] Seq=919 Ack=936 Win=65152 Len=17 TSval=3169972723 TSecr=1045713014
1711547441.696017981   527 6.503440372    10.10.1.2 → 10.10.1.1    TCP 83 53846 → 8081 [PSH, ACK] Seq=936 Ack=936 Win=64256 Len=17 TSval=1045713289 TSecr=3169972723
1711547444.696017981   530 6.503579109    10.10.1.1 → 10.10.1.2    TCP 83 8081 → 53846 [PSH, ACK] Seq=936 Ack=953 Win=65152 Len=17 TSval=3169972997 TSecr=1045713289
1711547450.696017981   536 6.757868554    10.10.1.2 → 10.10.1.1    TCP 83 53846 → 8081 [PSH, ACK] Seq=953 Ack=953 Win=64256 Len=17 TSval=1045713543 TSecr=3169972997
1711547453.696017981   539 6.758053192    10.10.1.1 → 10.10.1.2    TCP 83 8081 → 53846 [PSH, ACK] Seq=953 Ack=970 Win=65152 Len=17 TSval=3169973252 TSecr=1045713543
1711547459.696017981   545 6.807108532    10.10.1.2 → 10.10.1.1    TCP 83 53846 → 8081 [PSH, ACK] Seq=970 Ack=970 Win=64256 Len=17 TSval=1045713592 TSecr=3169973252
1711547462.696017981   548 6.807232623    10.10.1.1 → 10.10.1.2    TCP 83 8081 → 53846 [PSH, ACK] Seq=970 Ack=987 Win=65152 Len=17 TSval=3169973301 TSecr=1045713592
1711547468.696017981   554 6.897101634    10.10.1.2 → 10.10.1.1    TCP 83 53846 → 8081 [PSH, ACK] Seq=987 Ack=987 Win=64256 Len=17 TSval=1045713682 TSecr=3169973301
1711547471.696017981   557 6.897225488    10.10.1.1 → 10.10.1.2    TCP 83 8081 → 53846 [PSH, ACK] Seq=987 Ack=1004 Win=65152 Len=17 TSval=3169973391 TSecr=1045713682
1711547478.696017981   564 7.000804539    10.10.1.2 → 10.10.1.1    TCP 83 53846 → 8081 [PSH, ACK] Seq=1004 Ack=1004 Win=64256 Len=17 TSval=1045713786 TSecr=3169973391
1711547481.696017981   567 7.000931315    10.10.1.1 → 10.10.1.2    TCP 83 8081 → 53846 [PSH, ACK] Seq=1004 Ack=1021 Win=65152 Len=17 TSval=3169973495 TSecr=1045713786
1711547487.696017981   573 7.007337416    10.10.1.2 → 10.10.1.1    TCP 83 53846 → 8081 [PSH, ACK] Seq=1021 Ack=1021 Win=64256 Len=17 TSval=1045713793 TSecr=3169973495
1711547490.696017981   576 7.007461931    10.10.1.1 → 10.10.1.2    TCP 83 8081 → 53846 [PSH, ACK] Seq=1021 Ack=1038 Win=65152 Len=17 TSval=3169973501 TSecr=1045713793
1711547495.696017981   581 7.048531349    10.10.1.2 → 10.10.1.1    TCP 83 53846 → 8081 [PSH, ACK] Seq=1038 Ack=1038 Win=64256 Len=17 TSval=1045713834 TSecr=3169973501
1711547498.696017981   584 7.048660731    10.10.1.1 → 10.10.1.2    TCP 83 8081 → 53846 [PSH, ACK] Seq=1038 Ack=1055 Win=65152 Len=17 TSval=3169973543 TSecr=1045713834
1711547504.696017981   590 7.278769522    10.10.1.2 → 10.10.1.1    TCP 83 53846 → 8081 [PSH, ACK] Seq=1055 Ack=1055 Win=64256 Len=17 TSval=1045714064 TSecr=3169973543
1711547507.696017981   593 7.278892857    10.10.1.1 → 10.10.1.2    TCP 83 8081 → 53846 [PSH, ACK] Seq=1055 Ack=1072 Win=65152 Len=17 TSval=3169973773 TSecr=1045714064
1711547513.696017981   599 7.432629575    10.10.1.2 → 10.10.1.1    TCP 83 53846 → 8081 [PSH, ACK] Seq=1072 Ack=1072 Win=64256 Len=17 TSval=1045714218 TSecr=3169973773
1711547516.696017981   602 7.432755165    10.10.1.1 → 10.10.1.2    TCP 83 8081 → 53846 [PSH, ACK] Seq=1072 Ack=1089 Win=65152 Len=17 TSval=3169973927 TSecr=1045714218
1711547522.696017981   608 7.512340832    10.10.1.2 → 10.10.1.1    TCP 83 53846 → 8081 [PSH, ACK] Seq=1089 Ack=1089 Win=64256 Len=17 TSval=1045714298 TSecr=3169973927
1711547525.696017981   611 7.512467669    10.10.1.1 → 10.10.1.2    TCP 83 8081 → 53846 [PSH, ACK] Seq=1089 Ack=1106 Win=65152 Len=17 TSval=3169974006 TSecr=1045714298
1711547531.696017981   617 7.522346186    10.10.1.2 → 10.10.1.1    TCP 83 53846 → 8081 [PSH, ACK] Seq=1106 Ack=1106 Win=64256 Len=17 TSval=1045714308 TSecr=3169974006
1711547534.696017981   620 7.522470685    10.10.1.1 → 10.10.1.2    TCP 83 8081 → 53846 [PSH, ACK] Seq=1106 Ack=1123 Win=65152 Len=17 TSval=3169974016 TSecr=1045714308
1711547539.696017981   625 7.562044701    10.10.1.2 → 10.10.1.1    TCP 83 53846 → 8081 [PSH, ACK] Seq=1123 Ack=1123 Win=64256 Len=17 TSval=1045714347 TSecr=3169974016
1711547542.696017981   628 7.562175290    10.10.1.1 → 10.10.1.2    TCP 83 8081 → 53846 [PSH, ACK] Seq=1123 Ack=1140 Win=65152 Len=17 TSval=3169974056 TSecr=1045714347
1711547548.696017981   634 7.696595516    10.10.1.2 → 10.10.1.1    TCP 83 53846 → 8081 [PSH, ACK] Seq=1140 Ack=1140 Win=64256 Len=17 TSval=1045714482 TSecr=3169974056
1711547551.696017981   637 7.696721042    10.10.1.1 → 10.10.1.2    TCP 83 8081 → 53846 [PSH, ACK] Seq=1140 Ack=1157 Win=65152 Len=17 TSval=3169974191 TSecr=1045714482
1711547557.696017981   643 7.779378805    10.10.1.2 → 10.10.1.1    TCP 83 53846 → 8081 [PSH, ACK] Seq=1157 Ack=1157 Win=64256 Len=17 TSval=1045714565 TSecr=3169974191
1711547559.696017981   645 7.779505623    10.10.1.1 → 10.10.1.2    TCP 83 8081 → 53846 [PSH, ACK] Seq=1157 Ack=1174 Win=65152 Len=17 TSval=3169974273 TSecr=1045714565
1711547566.696017981   652 7.923374804    10.10.1.2 → 10.10.1.1    TCP 83 53846 → 8081 [PSH, ACK] Seq=1174 Ack=1174 Win=64256 Len=17 TSval=1045714709 TSecr=3169974273
1711547568.696017981   654 7.923499901    10.10.1.1 → 10.10.1.2    TCP 83 8081 → 53846 [PSH, ACK] Seq=1174 Ack=1191 Win=65152 Len=17 TSval=3169974417 TSecr=1045714709
1711547575.696017981   661 8.149774581    10.10.1.2 → 10.10.1.1    TCP 83 53846 → 8081 [PSH, ACK] Seq=1191 Ack=1191 Win=64256 Len=17 TSval=1045714935 TSecr=3169974417
1711547578.696017981   664 8.149897739    10.10.1.1 → 10.10.1.2    TCP 83 8081 → 53846 [PSH, ACK] Seq=1191 Ack=1208 Win=65152 Len=17 TSval=3169974644 TSecr=1045714935
1711547584.696017981   670 8.404652784    10.10.1.2 → 10.10.1.1    TCP 83 53846 → 8081 [PSH, ACK] Seq=1208 Ack=1208 Win=64256 Len=17 TSval=1045715190 TSecr=3169974644
1711547587.696017981   673 8.404774170    10.10.1.1 → 10.10.1.2    TCP 83 8081 → 53846 [PSH, ACK] Seq=1208 Ack=1225 Win=65152 Len=17 TSval=3169974899 TSecr=1045715190
1711547593.696017981   679 8.669632592    10.10.1.2 → 10.10.1.1    TCP 83 53846 → 8081 [PSH, ACK] Seq=1225 Ack=1225 Win=64256 Len=17 TSval=1045715455 TSecr=3169974899
1711547596.696017981   682 8.669753338    10.10.1.1 → 10.10.1.2    TCP 83 8081 → 53846 [PSH, ACK] Seq=1225 Ack=1242 Win=65152 Len=17 TSval=3169975164 TSecr=1045715455
1711547602.696017981   688 8.775374831    10.10.1.2 → 10.10.1.1    TCP 83 53846 → 8081 [PSH, ACK] Seq=1242 Ack=1242 Win=64256 Len=17 TSval=1045715561 TSecr=3169975164
1711547605.696017981   691 8.775499735    10.10.1.1 → 10.10.1.2    TCP 83 8081 → 53846 [PSH, ACK] Seq=1242 Ack=1259 Win=65152 Len=17 TSval=3169975269 TSecr=1045715561
1711547612.696017981   698 9.013007049    10.10.1.2 → 10.10.1.1    TCP 83 53846 → 8081 [PSH, ACK] Seq=1259 Ack=1259 Win=64256 Len=17 TSval=1045715798 TSecr=3169975269
1711547615.696017981   701 9.013128270    10.10.1.1 → 10.10.1.2    TCP 83 8081 → 53846 [PSH, ACK] Seq=1259 Ack=1276 Win=65152 Len=17 TSval=3169975507 TSecr=1045715798
1711547621.696017981   707 9.142299866    10.10.1.2 → 10.10.1.1    TCP 83 53846 → 8081 [PSH, ACK] Seq=1276 Ack=1276 Win=64256 Len=17 TSval=1045715927 TSecr=3169975507
1711547624.696017981   710 9.142423732    10.10.1.1 → 10.10.1.2    TCP 83 8081 → 53846 [PSH, ACK] Seq=1276 Ack=1293 Win=65152 Len=17 TSval=3169975636 TSecr=1045715927
1711547630.696017981   716 9.340796425    10.10.1.2 → 10.10.1.1    TCP 83 53846 → 8081 [PSH, ACK] Seq=1293 Ack=1293 Win=64256 Len=17 TSval=1045716126 TSecr=3169975636
1711547633.696017981   719 9.340921297    10.10.1.1 → 10.10.1.2    TCP 83 8081 → 53846 [PSH, ACK] Seq=1293 Ack=1310 Win=65152 Len=17 TSval=3169975835 TSecr=1045716126
1711547639.696017981   725 9.420798361    10.10.1.2 → 10.10.1.1    TCP 83 53846 → 8081 [PSH, ACK] Seq=1310 Ack=1310 Win=64256 Len=17 TSval=1045716206 TSecr=3169975835
1711547642.696017981   728 9.420925539    10.10.1.1 → 10.10.1.2    TCP 83 8081 → 53846 [PSH, ACK] Seq=1310 Ack=1327 Win=65152 Len=17 TSval=3169975915 TSecr=1045716206
1711547648.696017981   734 9.437303052    10.10.1.2 → 10.10.1.1    TCP 83 53846 → 8081 [PSH, ACK] Seq=1327 Ack=1327 Win=64256 Len=17 TSval=1045716222 TSecr=3169975915
1711547651.696017981   737 9.437426861    10.10.1.1 → 10.10.1.2    TCP 83 8081 → 53846 [PSH, ACK] Seq=1327 Ack=1344 Win=65152 Len=17 TSval=3169975931 TSecr=1045716222
1711547656.696017981   742 9.469667077    10.10.1.2 → 10.10.1.1    TCP 83 53846 → 8081 [PSH, ACK] Seq=1344 Ack=1344 Win=64256 Len=17 TSval=1045716255 TSecr=3169975931
1711547659.696017981   745 9.469796928    10.10.1.1 → 10.10.1.2    TCP 83 8081 → 53846 [PSH, ACK] Seq=1344 Ack=1361 Win=65152 Len=17 TSval=3169975964 TSecr=1045716255
1711547665.696017981   751 9.620896982    10.10.1.2 → 10.10.1.1    TCP 83 53846 → 8081 [PSH, ACK] Seq=1361 Ack=1361 Win=64256 Len=17 TSval=1045716406 TSecr=3169975964
1711547667.696017981   753 9.621023291    10.10.1.1 → 10.10.1.2    TCP 83 8081 → 53846 [PSH, ACK] Seq=1361 Ack=1378 Win=65152 Len=17 TSval=3169976115 TSecr=1045716406
1711547674.696017981   760 9.644449303    10.10.1.2 → 10.10.1.1    TCP 83 53846 → 8081 [PSH, ACK] Seq=1378 Ack=1378 Win=64256 Len=17 TSval=1045716430 TSecr=3169976115
1711547676.696017981   762 9.644574174    10.10.1.1 → 10.10.1.2    TCP 83 8081 → 53846 [PSH, ACK] Seq=1378 Ack=1395 Win=65152 Len=17 TSval=3169976139 TSecr=1045716430
1711547683.696017981   769 9.745939271    10.10.1.2 → 10.10.1.1    TCP 83 53846 → 8081 [PSH, ACK] Seq=1395 Ack=1395 Win=64256 Len=17 TSval=1045716531 TSecr=3169976139
1711547685.696017981   771 9.746064403    10.10.1.1 → 10.10.1.2    TCP 83 8081 → 53846 [PSH, ACK] Seq=1395 Ack=1412 Win=65152 Len=17 TSval=3169976240 TSecr=1045716531
1711547692.696017981   778 9.799845044    10.10.1.2 → 10.10.1.1    TCP 83 53846 → 8081 [PSH, ACK] Seq=1412 Ack=1412 Win=64256 Len=17 TSval=1045716585 TSecr=3169976240
1711547694.696017981   780 9.799969453    10.10.1.1 → 10.10.1.2    TCP 83 8081 → 53846 [PSH, ACK] Seq=1412 Ack=1429 Win=65152 Len=17 TSval=3169976294 TSecr=1045716585
1711547701.696017981   787 9.831367093    10.10.1.2 → 10.10.1.1    TCP 83 53846 → 8081 [PSH, ACK] Seq=1429 Ack=1429 Win=64256 Len=17 TSval=1045716617 TSecr=3169976294
1711547703.696017981   789 9.831491374    10.10.1.1 → 10.10.1.2    TCP 83 8081 → 53846 [PSH, ACK] Seq=1429 Ack=1446 Win=65152 Len=17 TSval=3169976325 TSecr=1045716617
1711547709.696017981   795 9.873062683    10.10.1.2 → 10.10.1.1    TCP 83 53846 → 8081 [PSH, ACK] Seq=1446 Ack=1446 Win=64256 Len=17 TSval=1045716658 TSecr=3169976325
1711547711.696017981   797 9.873192735    10.10.1.1 → 10.10.1.2    TCP 83 8081 → 53846 [PSH, ACK] Seq=1446 Ack=1463 Win=65152 Len=17 TSval=3169976367 TSecr=1045716658
1711547718.696017981   804 9.916551767    10.10.1.2 → 10.10.1.1    TCP 83 53846 → 8081 [PSH, ACK] Seq=1463 Ack=1463 Win=64256 Len=17 TSval=1045716702 TSecr=3169976367
1711547720.696017981   806 9.916676072    10.10.1.1 → 10.10.1.2    TCP 83 8081 → 53846 [PSH, ACK] Seq=1463 Ack=1480 Win=65152 Len=17 TSval=3169976411 TSecr=1045716702
1711547727.696017981   813 9.937845862    10.10.1.2 → 10.10.1.1    TCP 83 53846 → 8081 [PSH, ACK] Seq=1480 Ack=1480 Win=64256 Len=17 TSval=1045716723 TSecr=3169976411
1711547729.696017981   815 9.937970009    10.10.1.1 → 10.10.1.2    TCP 83 8081 → 53846 [PSH, ACK] Seq=1480 Ack=1497 Win=65152 Len=17 TSval=3169976432 TSecr=1045716723
1711547736.696017981   822 10.067344040    10.10.1.2 → 10.10.1.1    TCP 83 53846 → 8081 [PSH, ACK] Seq=1497 Ack=1497 Win=64256 Len=17 TSval=1045716853 TSecr=3169976432
1711547738.696017981   824 10.067470245    10.10.1.1 → 10.10.1.2    TCP 83 8081 → 53846 [PSH, ACK] Seq=1497 Ack=1514 Win=65152 Len=17 TSval=3169976561 TSecr=1045716853
1711547745.696017981   831 10.353297791    10.10.1.2 → 10.10.1.1    TCP 83 53846 → 8081 [PSH, ACK] Seq=1514 Ack=1514 Win=64256 Len=17 TSval=1045717138 TSecr=3169976561
1711547748.696017981   834 10.353419424    10.10.1.1 → 10.10.1.2    TCP 83 8081 → 53846 [PSH, ACK] Seq=1514 Ack=1531 Win=65152 Len=17 TSval=3169976847 TSecr=1045717138
1711547754.696017981   840 10.532833830    10.10.1.2 → 10.10.1.1    TCP 83 53846 → 8081 [PSH, ACK] Seq=1531 Ack=1531 Win=64256 Len=17 TSval=1045717318 TSecr=3169976847
1711547757.696017981   843 10.532959004    10.10.1.1 → 10.10.1.2    TCP 83 8081 → 53846 [PSH, ACK] Seq=1531 Ack=1548 Win=65152 Len=17 TSval=3169977027 TSecr=1045717318
1711547763.696017981   849 10.687007006    10.10.1.2 → 10.10.1.1    TCP 83 53846 → 8081 [PSH, ACK] Seq=1548 Ack=1548 Win=64256 Len=17 TSval=1045717472 TSecr=3169977027
1711547766.696017981   852 10.687132091    10.10.1.1 → 10.10.1.2    TCP 83 8081 → 53846 [PSH, ACK] Seq=1548 Ack=1565 Win=65152 Len=17 TSval=3169977181 TSecr=1045717472
1711547772.696017981   858 10.719905488    10.10.1.2 → 10.10.1.1    TCP 83 53846 → 8081 [PSH, ACK] Seq=1565 Ack=1565 Win=64256 Len=17 TSval=1045717505 TSecr=3169977181
1711547775.696017981   861 10.720030746    10.10.1.1 → 10.10.1.2    TCP 83 8081 → 53846 [PSH, ACK] Seq=1565 Ack=1582 Win=65152 Len=17 TSval=3169977214 TSecr=1045717505
1711547781.696017981   867 10.852299508    10.10.1.2 → 10.10.1.1    TCP 83 53846 → 8081 [PSH, ACK] Seq=1582 Ack=1582 Win=64256 Len=17 TSval=1045717637 TSecr=3169977214
1711547784.696017981   870 10.852424486    10.10.1.1 → 10.10.1.2    TCP 83 8081 → 53846 [PSH, ACK] Seq=1582 Ack=1599 Win=65152 Len=17 TSval=3169977346 TSecr=1045717637
1711547790.696017981   876 10.937002509    10.10.1.2 → 10.10.1.1    TCP 83 53846 → 8081 [PSH, ACK] Seq=1599 Ack=1599 Win=64256 Len=17 TSval=1045717722 TSecr=3169977346
1711547793.696017981   879 10.937128522    10.10.1.1 → 10.10.1.2    TCP 83 8081 → 53846 [PSH, ACK] Seq=1599 Ack=1616 Win=65152 Len=17 TSval=3169977431 TSecr=1045717722
1711547800.696017981   886 11.112082458    10.10.1.2 → 10.10.1.1    TCP 83 53846 → 8081 [PSH, ACK] Seq=1616 Ack=1616 Win=64256 Len=17 TSval=1045717897 TSecr=3169977431
1711547802.696017981   888 11.112207198    10.10.1.1 → 10.10.1.2    TCP 83 8081 → 53846 [PSH, ACK] Seq=1616 Ack=1633 Win=65152 Len=17 TSval=3169977606 TSecr=1045717897
1711547809.696017981   895 11.287004126    10.10.1.2 → 10.10.1.1    TCP 83 53846 → 8081 [PSH, ACK] Seq=1633 Ack=1633 Win=64256 Len=17 TSval=1045718072 TSecr=3169977606
1711547811.696017981   897 11.287129497    10.10.1.1 → 10.10.1.2    TCP 83 8081 → 53846 [PSH, ACK] Seq=1633 Ack=1650 Win=65152 Len=17 TSval=3169977781 TSecr=1045718072
1711547818.696017981   904 11.512994133    10.10.1.2 → 10.10.1.1    TCP 83 53846 → 8081 [PSH, ACK] Seq=1650 Ack=1650 Win=64256 Len=17 TSval=1045718298 TSecr=3169977781
1711547821.696017981   907 11.513117645    10.10.1.1 → 10.10.1.2    TCP 83 8081 → 53846 [PSH, ACK] Seq=1650 Ack=1667 Win=65152 Len=17 TSval=3169978007 TSecr=1045718298
1711547827.696017981   913 11.596467286    10.10.1.2 → 10.10.1.1    TCP 83 53846 → 8081 [PSH, ACK] Seq=1667 Ack=1667 Win=64256 Len=17 TSval=1045718382 TSecr=3169978007
1711547830.696017981   916 11.596592894    10.10.1.1 → 10.10.1.2    TCP 83 8081 → 53846 [PSH, ACK] Seq=1667 Ack=1684 Win=65152 Len=17 TSval=3169978091 TSecr=1045718382
1711547836.696017981   922 11.645748294    10.10.1.2 → 10.10.1.1    TCP 83 53846 → 8081 [PSH, ACK] Seq=1684 Ack=1684 Win=64256 Len=17 TSval=1045718431 TSecr=3169978091
1711547839.696017981   925 11.645873890    10.10.1.1 → 10.10.1.2    TCP 83 8081 → 53846 [PSH, ACK] Seq=1684 Ack=1701 Win=65152 Len=17 TSval=3169978140 TSecr=1045718431
1711547845.696017981   931 11.753245072    10.10.1.2 → 10.10.1.1    TCP 83 53846 → 8081 [PSH, ACK] Seq=1701 Ack=1701 Win=64256 Len=17 TSval=1045718538 TSecr=3169978140
1711547848.696017981   934 11.753372007    10.10.1.1 → 10.10.1.2    TCP 83 8081 → 53846 [PSH, ACK] Seq=1701 Ack=1718 Win=65152 Len=17 TSval=3169978247 TSecr=1045718538
1711547854.696017981   940 11.815252777    10.10.1.2 → 10.10.1.1    TCP 83 53846 → 8081 [PSH, ACK] Seq=1718 Ack=1718 Win=64256 Len=17 TSval=1045718600 TSecr=3169978247
1711547857.696017981   943 11.815377874    10.10.1.1 → 10.10.1.2    TCP 83 8081 → 53846 [PSH, ACK] Seq=1718 Ack=1735 Win=65152 Len=17 TSval=3169978309 TSecr=1045718600
1711547863.696017981   949 11.852493067    10.10.1.2 → 10.10.1.1    TCP 83 53846 → 8081 [PSH, ACK] Seq=1735 Ack=1735 Win=64256 Len=17 TSval=1045718638 TSecr=3169978309
1711547866.696017981   952 11.852617292    10.10.1.1 → 10.10.1.2    TCP 83 8081 → 53846 [PSH, ACK] Seq=1735 Ack=1752 Win=65152 Len=17 TSval=3169978347 TSecr=1045718638
1711547872.696017981   958 11.941172702    10.10.1.2 → 10.10.1.1    TCP 83 53846 → 8081 [PSH, ACK] Seq=1752 Ack=1752 Win=64256 Len=17 TSval=1045718726 TSecr=3169978347
1711547874.696017981   960 11.941296655    10.10.1.1 → 10.10.1.2    TCP 83 8081 → 53846 [PSH, ACK] Seq=1752 Ack=1769 Win=65152 Len=17 TSval=3169978435 TSecr=1045718726
1711547881.696017981   967 11.953360491    10.10.1.2 → 10.10.1.1    TCP 83 53846 → 8081 [PSH, ACK] Seq=1769 Ack=1769 Win=64256 Len=17 TSval=1045718739 TSecr=3169978435
1711547883.696017981   969 11.953484632    10.10.1.1 → 10.10.1.2    TCP 83 8081 → 53846 [PSH, ACK] Seq=1769 Ack=1786 Win=65152 Len=17 TSval=3169978447 TSecr=1045718739
1711547889.696017981   975 11.977952250    10.10.1.2 → 10.10.1.1    TCP 83 53846 → 8081 [PSH, ACK] Seq=1786 Ack=1786 Win=64256 Len=17 TSval=1045718763 TSecr=3169978447
1711547891.696017981   977 11.978088817    10.10.1.1 → 10.10.1.2    TCP 83 8081 → 53846 [PSH, ACK] Seq=1786 Ack=1803 Win=65152 Len=17 TSval=3169978472 TSecr=1045718763
1711547897.696017981   983 12.015589863    10.10.1.2 → 10.10.1.1    TCP 83 53846 → 8081 [PSH, ACK] Seq=1803 Ack=1803 Win=64256 Len=17 TSval=1045718801 TSecr=3169978472
1711547899.696017981   985 12.015698763    10.10.1.1 → 10.10.1.2    TCP 83 8081 → 53846 [PSH, ACK] Seq=1803 Ack=1820 Win=65152 Len=17 TSval=3169978510 TSecr=1045718801
1711547906.696017981   992 12.380623197    10.10.1.2 → 10.10.1.1    TCP 83 53846 → 8081 [PSH, ACK] Seq=1820 Ack=1820 Win=64256 Len=17 TSval=1045719166 TSecr=3169978510
1711547909.696017981   995 12.380745801    10.10.1.1 → 10.10.1.2    TCP 83 8081 → 53846 [PSH, ACK] Seq=1820 Ack=1837 Win=65152 Len=17 TSval=3169978875 TSecr=1045719166
1711547915.696017981  1001 12.525587012    10.10.1.2 → 10.10.1.1    TCP 83 53846 → 8081 [PSH, ACK] Seq=1837 Ack=1837 Win=64256 Len=17 TSval=1045719311 TSecr=3169978875
1711547918.696017981  1004 12.525713380    10.10.1.1 → 10.10.1.2    TCP 83 8081 → 53846 [PSH, ACK] Seq=1837 Ack=1854 Win=65152 Len=17 TSval=3169979020 TSecr=1045719311
1711547924.696017981  1010 12.587640351    10.10.1.2 → 10.10.1.1    TCP 83 53846 → 8081 [PSH, ACK] Seq=1854 Ack=1854 Win=64256 Len=17 TSval=1045719373 TSecr=3169979020
1711547927.696017981  1013 12.587764549    10.10.1.1 → 10.10.1.2    TCP 83 8081 → 53846 [PSH, ACK] Seq=1854 Ack=1871 Win=65152 Len=17 TSval=3169979082 TSecr=1045719373
1711547933.696017981  1019 12.616474416    10.10.1.2 → 10.10.1.1    TCP 83 53846 → 8081 [PSH, ACK] Seq=1871 Ack=1871 Win=64256 Len=17 TSval=1045719402 TSecr=3169979082
1711547936.696017981  1022 12.616598450    10.10.1.1 → 10.10.1.2    TCP 83 8081 → 53846 [PSH, ACK] Seq=1871 Ack=1888 Win=65152 Len=17 TSval=3169979111 TSecr=1045719402
1711547942.696017981  1028 12.695204344    10.10.1.2 → 10.10.1.1    TCP 83 53846 → 8081 [PSH, ACK] Seq=1888 Ack=1888 Win=64256 Len=17 TSval=1045719480 TSecr=3169979111
1711547945.696017981  1031 12.695330114    10.10.1.1 → 10.10.1.2    TCP 83 8081 → 53846 [PSH, ACK] Seq=1888 Ack=1905 Win=65152 Len=17 TSval=3169979189 TSecr=1045719480
1711547951.696017981  1037 12.805707176    10.10.1.2 → 10.10.1.1    TCP 83 53846 → 8081 [PSH, ACK] Seq=1905 Ack=1905 Win=64256 Len=17 TSval=1045719591 TSecr=3169979189
1711547954.696017981  1040 12.805833258    10.10.1.1 → 10.10.1.2    TCP 83 8081 → 53846 [PSH, ACK] Seq=1905 Ack=1922 Win=65152 Len=17 TSval=3169979300 TSecr=1045719591
1711547961.696017981  1047 13.021742529    10.10.1.2 → 10.10.1.1    TCP 83 53846 → 8081 [PSH, ACK] Seq=1922 Ack=1922 Win=64256 Len=17 TSval=1045719807 TSecr=3169979300
1711547964.696017981  1050 13.021926111    10.10.1.1 → 10.10.1.2    TCP 83 8081 → 53846 [PSH, ACK] Seq=1922 Ack=1939 Win=65152 Len=17 TSval=3169979516 TSecr=1045719807
1711547970.696017981  1056 13.339450735    10.10.1.2 → 10.10.1.1    TCP 83 53846 → 8081 [PSH, ACK] Seq=1939 Ack=1939 Win=64256 Len=17 TSval=1045720125 TSecr=3169979516
1711547973.696017981  1059 13.339593506    10.10.1.1 → 10.10.1.2    TCP 83 8081 → 53846 [PSH, ACK] Seq=1939 Ack=1956 Win=65152 Len=17 TSval=3169979834 TSecr=1045720125
1711547979.696017981  1065 13.614018538    10.10.1.2 → 10.10.1.1    TCP 83 53846 → 8081 [PSH, ACK] Seq=1956 Ack=1956 Win=64256 Len=17 TSval=1045720399 TSecr=3169979834
1711547982.696017981  1068 13.614139300    10.10.1.1 → 10.10.1.2    TCP 83 8081 → 53846 [PSH, ACK] Seq=1956 Ack=1973 Win=65152 Len=17 TSval=3169980108 TSecr=1045720399
1711547988.696017981  1074 13.639598134    10.10.1.2 → 10.10.1.1    TCP 83 53846 → 8081 [PSH, ACK] Seq=1973 Ack=1973 Win=64256 Len=17 TSval=1045720425 TSecr=3169980108
1711547991.696017981  1077 13.639723495    10.10.1.1 → 10.10.1.2    TCP 83 8081 → 53846 [PSH, ACK] Seq=1973 Ack=1990 Win=65152 Len=17 TSval=3169980134 TSecr=1045720425
1711547996.696017981  1082 13.676838149    10.10.1.2 → 10.10.1.1    TCP 83 53846 → 8081 [PSH, ACK] Seq=1990 Ack=1990 Win=64256 Len=17 TSval=1045720462 TSecr=3169980134
1711547999.696017981  1085 13.676976224    10.10.1.1 → 10.10.1.2    TCP 83 8081 → 53846 [PSH, ACK] Seq=1990 Ack=2007 Win=65152 Len=17 TSval=3169980171 TSecr=1045720462
1711548004.696017981  1090 13.690499062    10.10.1.2 → 10.10.1.1    TCP 83 53846 → 8081 [PSH, ACK] Seq=2007 Ack=2007 Win=64256 Len=17 TSval=1045720476 TSecr=3169980171
1711548007.696017981  1093 13.690629247    10.10.1.1 → 10.10.1.2    TCP 83 8081 → 53846 [PSH, ACK] Seq=2007 Ack=2024 Win=65152 Len=17 TSval=3169980185 TSecr=1045720476
1711548013.696017981  1099 13.986986145    10.10.1.2 → 10.10.1.1    TCP 83 53846 → 8081 [PSH, ACK] Seq=2024 Ack=2024 Win=64256 Len=17 TSval=1045720772 TSecr=3169980185
1711548016.696017981  1102 13.987112503    10.10.1.1 → 10.10.1.2    TCP 83 8081 → 53846 [PSH, ACK] Seq=2024 Ack=2041 Win=65152 Len=17 TSval=3169980481 TSecr=1045720772
