1711548531.971879959    38 0.536561686    10.10.1.2 → 10.10.1.1    TCP 83 42040 → 8081 [PSH, ACK] Seq=1 Ack=1 Win=64256 Len=17 TSval=1047286538 TSecr=3171545986
1711548535.971879959    42 0.536764190    10.10.1.1 → 10.10.1.2    TCP 83 8081 → 42040 [PSH, ACK] Seq=1 Ack=18 Win=65152 Len=17 TSval=3171546249 TSecr=1047286538
1711548541.971879959    48 0.546922609    10.10.1.2 → 10.10.1.1    TCP 83 42040 → 8081 [PSH, ACK] Seq=18 Ack=18 Win=64256 Len=17 TSval=1047286548 TSecr=3171546249
1711548544.971879959    51 0.546959001    10.10.1.1 → 10.10.1.2    TCP 83 8081 → 42040 [PSH, ACK] Seq=18 Ack=35 Win=65152 Len=17 TSval=3171546259 TSecr=1047286548
1711548549.971879959    56 0.557117002    10.10.1.2 → 10.10.1.1    TCP 83 42040 → 8081 [PSH, ACK] Seq=35 Ack=35 Win=64256 Len=17 TSval=1047286558 TSecr=3171546259
1711548551.971879959    58 0.557153145    10.10.1.1 → 10.10.1.2    TCP 83 8081 → 42040 [PSH, ACK] Seq=35 Ack=52 Win=65152 Len=17 TSval=3171546269 TSecr=1047286558
1711548557.971879959    64 0.567313452    10.10.1.2 → 10.10.1.1    TCP 83 42040 → 8081 [PSH, ACK] Seq=52 Ack=52 Win=64256 Len=17 TSval=1047286569 TSecr=3171546269
1711548559.971879959    66 0.567347546    10.10.1.1 → 10.10.1.2    TCP 83 8081 → 42040 [PSH, ACK] Seq=52 Ack=69 Win=65152 Len=17 TSval=3171546279 TSecr=1047286569
1711548565.971879959    72 0.577504557    10.10.1.2 → 10.10.1.1    TCP 83 42040 → 8081 [PSH, ACK] Seq=69 Ack=69 Win=64256 Len=17 TSval=1047286579 TSecr=3171546279
1711548568.971879959    75 0.577554074    10.10.1.1 → 10.10.1.2    TCP 83 8081 → 42040 [PSH, ACK] Seq=69 Ack=86 Win=65152 Len=17 TSval=3171546289 TSecr=1047286579
1711548573.971879959    80 0.587709761    10.10.1.2 → 10.10.1.1    TCP 83 42040 → 8081 [PSH, ACK] Seq=86 Ack=86 Win=64256 Len=17 TSval=1047286589 TSecr=3171546289
1711548575.971879959    82 0.587744058    10.10.1.1 → 10.10.1.2    TCP 83 8081 → 42040 [PSH, ACK] Seq=86 Ack=103 Win=65152 Len=17 TSval=3171546300 TSecr=1047286589
1711548581.971879959    88 0.597901158    10.10.1.2 → 10.10.1.1    TCP 83 42040 → 8081 [PSH, ACK] Seq=103 Ack=103 Win=64256 Len=17 TSval=1047286599 TSecr=3171546300
1711548583.971879959    90 0.597936375    10.10.1.1 → 10.10.1.2    TCP 83 8081 → 42040 [PSH, ACK] Seq=103 Ack=120 Win=65152 Len=17 TSval=3171546310 TSecr=1047286599
1711548589.971879959    96 0.608095789    10.10.1.2 → 10.10.1.1    TCP 83 42040 → 8081 [PSH, ACK] Seq=120 Ack=120 Win=64256 Len=17 TSval=1047286609 TSecr=3171546310
1711548591.971879959    98 0.608129466    10.10.1.1 → 10.10.1.2    TCP 83 8081 → 42040 [PSH, ACK] Seq=120 Ack=137 Win=65152 Len=17 TSval=3171546320 TSecr=1047286609
1711548597.971879959   104 0.618288858    10.10.1.2 → 10.10.1.1    TCP 83 42040 → 8081 [PSH, ACK] Seq=137 Ack=137 Win=64256 Len=17 TSval=1047286620 TSecr=3171546320
1711548599.971879959   106 0.618336624    10.10.1.1 → 10.10.1.2    TCP 83 8081 → 42040 [PSH, ACK] Seq=137 Ack=154 Win=65152 Len=17 TSval=3171546330 TSecr=1047286620
1711548605.971879959   112 0.628493384    10.10.1.2 → 10.10.1.1    TCP 83 42040 → 8081 [PSH, ACK] Seq=154 Ack=154 Win=64256 Len=17 TSval=1047286630 TSecr=3171546330
1711548607.971879959   114 0.628528138    10.10.1.1 → 10.10.1.2    TCP 83 8081 → 42040 [PSH, ACK] Seq=154 Ack=171 Win=65152 Len=17 TSval=3171546340 TSecr=1047286630
1711548613.971879959   120 0.638684581    10.10.1.2 → 10.10.1.1    TCP 83 42040 → 8081 [PSH, ACK] Seq=171 Ack=171 Win=64256 Len=17 TSval=1047286640 TSecr=3171546340
1711548615.971879959   122 0.638720157    10.10.1.1 → 10.10.1.2    TCP 83 8081 → 42040 [PSH, ACK] Seq=171 Ack=188 Win=65152 Len=17 TSval=3171546351 TSecr=1047286640
1711548621.971879959   128 0.648875091    10.10.1.2 → 10.10.1.1    TCP 83 42040 → 8081 [PSH, ACK] Seq=188 Ack=188 Win=64256 Len=17 TSval=1047286650 TSecr=3171546351
1711548623.971879959   130 0.648909501    10.10.1.1 → 10.10.1.2    TCP 83 8081 → 42040 [PSH, ACK] Seq=188 Ack=205 Win=65152 Len=17 TSval=3171546361 TSecr=1047286650
1711548629.971879959   136 0.659065860    10.10.1.2 → 10.10.1.1    TCP 83 42040 → 8081 [PSH, ACK] Seq=205 Ack=205 Win=64256 Len=17 TSval=1047286660 TSecr=3171546361
1711548631.971879959   138 0.659099657    10.10.1.1 → 10.10.1.2    TCP 83 8081 → 42040 [PSH, ACK] Seq=205 Ack=222 Win=65152 Len=17 TSval=3171546371 TSecr=1047286660
1711548637.971879959   144 0.669255666    10.10.1.2 → 10.10.1.1    TCP 83 42040 → 8081 [PSH, ACK] Seq=222 Ack=222 Win=64256 Len=17 TSval=1047286671 TSecr=3171546371
1711548639.971879959   146 0.669289955    10.10.1.1 → 10.10.1.2    TCP 83 8081 → 42040 [PSH, ACK] Seq=222 Ack=239 Win=65152 Len=17 TSval=3171546381 TSecr=1047286671
1711548645.971879959   152 0.679446724    10.10.1.2 → 10.10.1.1    TCP 83 42040 → 8081 [PSH, ACK] Seq=239 Ack=239 Win=64256 Len=17 TSval=1047286681 TSecr=3171546381
1711548647.971879959   154 0.679480406    10.10.1.1 → 10.10.1.2    TCP 83 8081 → 42040 [PSH, ACK] Seq=239 Ack=256 Win=65152 Len=17 TSval=3171546391 TSecr=1047286681
1711548653.971879959   160 0.689634883    10.10.1.2 → 10.10.1.1    TCP 83 42040 → 8081 [PSH, ACK] Seq=256 Ack=256 Win=64256 Len=17 TSval=1047286691 TSecr=3171546391
1711548655.971879959   162 0.689669445    10.10.1.1 → 10.10.1.2    TCP 83 8081 → 42040 [PSH, ACK] Seq=256 Ack=273 Win=65152 Len=17 TSval=3171546402 TSecr=1047286691
1711548661.971879959   168 0.699824668    10.10.1.2 → 10.10.1.1    TCP 83 42040 → 8081 [PSH, ACK] Seq=273 Ack=273 Win=64256 Len=17 TSval=1047286701 TSecr=3171546402
1711548663.971879959   170 0.699860065    10.10.1.1 → 10.10.1.2    TCP 83 8081 → 42040 [PSH, ACK] Seq=273 Ack=290 Win=65152 Len=17 TSval=3171546412 TSecr=1047286701
1711548669.971879959   176 0.710017916    10.10.1.2 → 10.10.1.1    TCP 83 42040 → 8081 [PSH, ACK] Seq=290 Ack=290 Win=64256 Len=17 TSval=1047286711 TSecr=3171546412
1711548671.971879959   178 0.710051689    10.10.1.1 → 10.10.1.2    TCP 83 8081 → 42040 [PSH, ACK] Seq=290 Ack=307 Win=65152 Len=17 TSval=3171546422 TSecr=1047286711
1711548678.971879959   185 0.720187061    10.10.1.2 → 10.10.1.1    TCP 83 42040 → 8081 [PSH, ACK] Seq=307 Ack=307 Win=64256 Len=17 TSval=1047286721 TSecr=3171546422
1711548680.971879959   187 0.720220336    10.10.1.1 → 10.10.1.2    TCP 83 8081 → 42040 [PSH, ACK] Seq=307 Ack=324 Win=65152 Len=17 TSval=3171546432 TSecr=1047286721
1711548686.971879959   193 0.730376681    10.10.1.2 → 10.10.1.1    TCP 83 42040 → 8081 [PSH, ACK] Seq=324 Ack=324 Win=64256 Len=17 TSval=1047286732 TSecr=3171546432
1711548688.971879959   195 0.730413318    10.10.1.1 → 10.10.1.2    TCP 83 8081 → 42040 [PSH, ACK] Seq=324 Ack=341 Win=65152 Len=17 TSval=3171546442 TSecr=1047286732
1711548694.971879959   201 0.740568231    10.10.1.2 → 10.10.1.1    TCP 83 42040 → 8081 [PSH, ACK] Seq=341 Ack=341 Win=64256 Len=17 TSval=1047286742 TSecr=3171546442
1711548696.971879959   203 0.740602931    10.10.1.1 → 10.10.1.2    TCP 83 8081 → 42040 [PSH, ACK] Seq=341 Ack=358 Win=65152 Len=17 TSval=3171546453 TSecr=1047286742
1711548702.971879959   209 0.750757145    10.10.1.2 → 10.10.1.1    TCP 83 42040 → 8081 [PSH, ACK] Seq=358 Ack=358 Win=64256 Len=17 TSval=1047286752 TSecr=3171546453
1711548704.971879959   211 0.750790759    10.10.1.1 → 10.10.1.2    TCP 83 8081 → 42040 [PSH, ACK] Seq=358 Ack=375 Win=65152 Len=17 TSval=3171546463 TSecr=1047286752
1711548710.971879959   217 0.760945270    10.10.1.2 → 10.10.1.1    TCP 83 42040 → 8081 [PSH, ACK] Seq=375 Ack=375 Win=64256 Len=17 TSval=1047286762 TSecr=3171546463
1711548712.971879959   219 0.760978843    10.10.1.1 → 10.10.1.2    TCP 83 8081 → 42040 [PSH, ACK] Seq=375 Ack=392 Win=65152 Len=17 TSval=3171546473 TSecr=1047286762
1711548718.971879959   225 0.771133778    10.10.1.2 → 10.10.1.1    TCP 83 42040 → 8081 [PSH, ACK] Seq=392 Ack=392 Win=64256 Len=17 TSval=1047286772 TSecr=3171546473
1711548720.971879959   227 0.771169628    10.10.1.1 → 10.10.1.2    TCP 83 8081 → 42040 [PSH, ACK] Seq=392 Ack=409 Win=65152 Len=17 TSval=3171546483 TSecr=1047286772
1711548726.971879959   233 0.781322951    10.10.1.2 → 10.10.1.1    TCP 83 42040 → 8081 [PSH, ACK] Seq=409 Ack=409 Win=64256 Len=17 TSval=1047286783 TSecr=3171546483
1711548728.971879959   235 0.781356872    10.10.1.1 → 10.10.1.2    TCP 83 8081 → 42040 [PSH, ACK] Seq=409 Ack=426 Win=65152 Len=17 TSval=3171546493 TSecr=1047286783
1711548734.971879959   241 0.791513027    10.10.1.2 → 10.10.1.1    TCP 83 42040 → 8081 [PSH, ACK] Seq=426 Ack=426 Win=64256 Len=17 TSval=1047286793 TSecr=3171546493
1711548736.971879959   243 0.791546332    10.10.1.1 → 10.10.1.2    TCP 83 8081 → 42040 [PSH, ACK] Seq=426 Ack=443 Win=65152 Len=17 TSval=3171546504 TSecr=1047286793
1711548742.971879959   249 0.801702315    10.10.1.2 → 10.10.1.1    TCP 83 42040 → 8081 [PSH, ACK] Seq=443 Ack=443 Win=64256 Len=17 TSval=1047286803 TSecr=3171546504
1711548744.971879959   251 0.801735395    10.10.1.1 → 10.10.1.2    TCP 83 8081 → 42040 [PSH, ACK] Seq=443 Ack=460 Win=65152 Len=17 TSval=3171546514 TSecr=1047286803
1711548750.971879959   257 0.811890875    10.10.1.2 → 10.10.1.1    TCP 83 42040 → 8081 [PSH, ACK] Seq=460 Ack=460 Win=64256 Len=17 TSval=1047286813 TSecr=3171546514
1711548752.971879959   259 0.811925108    10.10.1.1 → 10.10.1.2    TCP 83 8081 → 42040 [PSH, ACK] Seq=460 Ack=477 Win=65152 Len=17 TSval=3171546524 TSecr=1047286813
1711548758.971879959   265 0.822082433    10.10.1.2 → 10.10.1.1    TCP 83 42040 → 8081 [PSH, ACK] Seq=477 Ack=477 Win=64256 Len=17 TSval=1047286823 TSecr=3171546524
1711548760.971879959   267 0.822115288    10.10.1.1 → 10.10.1.2    TCP 83 8081 → 42040 [PSH, ACK] Seq=477 Ack=494 Win=65152 Len=17 TSval=3171546534 TSecr=1047286823
1711548766.971879959   273 0.832270327    10.10.1.2 → 10.10.1.1    TCP 83 42040 → 8081 [PSH, ACK] Seq=494 Ack=494 Win=64256 Len=17 TSval=1047286834 TSecr=3171546534
1711548768.971879959   275 0.832303900    10.10.1.1 → 10.10.1.2    TCP 83 8081 → 42040 [PSH, ACK] Seq=494 Ack=511 Win=65152 Len=17 TSval=3171546544 TSecr=1047286834
1711548774.971879959   281 0.842460091    10.10.1.2 → 10.10.1.1    TCP 83 42040 → 8081 [PSH, ACK] Seq=511 Ack=511 Win=64256 Len=17 TSval=1047286844 TSecr=3171546544
1711548776.971879959   283 0.842493346    10.10.1.1 → 10.10.1.2    TCP 83 8081 → 42040 [PSH, ACK] Seq=511 Ack=528 Win=65152 Len=17 TSval=3171546554 TSecr=1047286844
1711548782.971879959   289 0.852649168    10.10.1.2 → 10.10.1.1    TCP 83 42040 → 8081 [PSH, ACK] Seq=528 Ack=528 Win=64256 Len=17 TSval=1047286854 TSecr=3171546554
1711548784.971879959   291 0.852683311    10.10.1.1 → 10.10.1.2    TCP 83 8081 → 42040 [PSH, ACK] Seq=528 Ack=545 Win=65152 Len=17 TSval=3171546565 TSecr=1047286854
1711548790.971879959   297 0.862839469    10.10.1.2 → 10.10.1.1    TCP 83 42040 → 8081 [PSH, ACK] Seq=545 Ack=545 Win=64256 Len=17 TSval=1047286864 TSecr=3171546565
1711548792.971879959   299 0.862873680    10.10.1.1 → 10.10.1.2    TCP 83 8081 → 42040 [PSH, ACK] Seq=545 Ack=562 Win=65152 Len=17 TSval=3171546575 TSecr=1047286864
1711548798.971879959   305 0.873027813    10.10.1.2 → 10.10.1.1    TCP 83 42040 → 8081 [PSH, ACK] Seq=562 Ack=562 Win=64256 Len=17 TSval=1047286874 TSecr=3171546575
1711548800.971879959   307 0.873061146    10.10.1.1 → 10.10.1.2    TCP 83 8081 → 42040 [PSH, ACK] Seq=562 Ack=579 Win=65152 Len=17 TSval=3171546585 TSecr=1047286874
1711548806.971879959   313 0.883216810    10.10.1.2 → 10.10.1.1    TCP 83 42040 → 8081 [PSH, ACK] Seq=579 Ack=579 Win=64256 Len=17 TSval=1047286885 TSecr=3171546585
1711548808.971879959   315 0.883251930    10.10.1.1 → 10.10.1.2    TCP 83 8081 → 42040 [PSH, ACK] Seq=579 Ack=596 Win=65152 Len=17 TSval=3171546595 TSecr=1047286885
1711548814.971879959   321 0.893408065    10.10.1.2 → 10.10.1.1    TCP 83 42040 → 8081 [PSH, ACK] Seq=596 Ack=596 Win=64256 Len=17 TSval=1047286895 TSecr=3171546595
1711548816.971879959   323 0.893441369    10.10.1.1 → 10.10.1.2    TCP 83 8081 → 42040 [PSH, ACK] Seq=596 Ack=613 Win=65152 Len=17 TSval=3171546605 TSecr=1047286895
1711548822.971879959   329 0.903597683    10.10.1.2 → 10.10.1.1    TCP 83 42040 → 8081 [PSH, ACK] Seq=613 Ack=613 Win=64256 Len=17 TSval=1047286905 TSecr=3171546605
1711548824.971879959   331 0.903630860    10.10.1.1 → 10.10.1.2    TCP 83 8081 → 42040 [PSH, ACK] Seq=613 Ack=630 Win=65152 Len=17 TSval=3171546616 TSecr=1047286905
1711548830.971879959   337 0.913786830    10.10.1.2 → 10.10.1.1    TCP 83 42040 → 8081 [PSH, ACK] Seq=630 Ack=630 Win=64256 Len=17 TSval=1047286915 TSecr=3171546616
1711548832.971879959   339 0.913820391    10.10.1.1 → 10.10.1.2    TCP 83 8081 → 42040 [PSH, ACK] Seq=630 Ack=647 Win=65152 Len=17 TSval=3171546626 TSecr=1047286915
1711548838.971879959   345 0.923975220    10.10.1.2 → 10.10.1.1    TCP 83 42040 → 8081 [PSH, ACK] Seq=647 Ack=647 Win=64256 Len=17 TSval=1047286925 TSecr=3171546626
1711548840.971879959   347 0.924008019    10.10.1.1 → 10.10.1.2    TCP 83 8081 → 42040 [PSH, ACK] Seq=647 Ack=664 Win=65152 Len=17 TSval=3171546636 TSecr=1047286925
1711548846.971879959   353 0.934161964    10.10.1.2 → 10.10.1.1    TCP 83 42040 → 8081 [PSH, ACK] Seq=664 Ack=664 Win=64256 Len=17 TSval=1047286935 TSecr=3171546636
1711548848.971879959   355 0.934195416    10.10.1.1 → 10.10.1.2    TCP 83 8081 → 42040 [PSH, ACK] Seq=664 Ack=681 Win=65152 Len=17 TSval=3171546646 TSecr=1047286935
1711548854.971879959   361 0.944356969    10.10.1.2 → 10.10.1.1    TCP 83 42040 → 8081 [PSH, ACK] Seq=681 Ack=681 Win=64256 Len=17 TSval=1047286946 TSecr=3171546646
1711548856.971879959   363 0.944390614    10.10.1.1 → 10.10.1.2    TCP 83 8081 → 42040 [PSH, ACK] Seq=681 Ack=698 Win=65152 Len=17 TSval=3171546656 TSecr=1047286946
1711548862.971879959   369 0.954544155    10.10.1.2 → 10.10.1.1    TCP 83 42040 → 8081 [PSH, ACK] Seq=698 Ack=698 Win=64256 Len=17 TSval=1047286956 TSecr=3171546656
1711548864.971879959   371 0.954579954    10.10.1.1 → 10.10.1.2    TCP 83 8081 → 42040 [PSH, ACK] Seq=698 Ack=715 Win=65152 Len=17 TSval=3171546667 TSecr=1047286956
1711548870.971879959   377 0.964734739    10.10.1.2 → 10.10.1.1    TCP 83 42040 → 8081 [PSH, ACK] Seq=715 Ack=715 Win=64256 Len=17 TSval=1047286966 TSecr=3171546667
1711548872.971879959   379 0.964768589    10.10.1.1 → 10.10.1.2    TCP 83 8081 → 42040 [PSH, ACK] Seq=715 Ack=732 Win=65152 Len=17 TSval=3171546677 TSecr=1047286966
1711548878.971879959   385 0.974924568    10.10.1.2 → 10.10.1.1    TCP 83 42040 → 8081 [PSH, ACK] Seq=732 Ack=732 Win=64256 Len=17 TSval=1047286976 TSecr=3171546677
1711548880.971879959   387 0.974958587    10.10.1.1 → 10.10.1.2    TCP 83 8081 → 42040 [PSH, ACK] Seq=732 Ack=749 Win=65152 Len=17 TSval=3171546687 TSecr=1047286976
1711548886.971879959   393 0.985115101    10.10.1.2 → 10.10.1.1    TCP 83 42040 → 8081 [PSH, ACK] Seq=749 Ack=749 Win=64256 Len=17 TSval=1047286986 TSecr=3171546687
1711548888.971879959   395 0.985150391    10.10.1.1 → 10.10.1.2    TCP 83 8081 → 42040 [PSH, ACK] Seq=749 Ack=766 Win=65152 Len=17 TSval=3171546697 TSecr=1047286986
1711548894.971879959   401 0.995306251    10.10.1.2 → 10.10.1.1    TCP 83 42040 → 8081 [PSH, ACK] Seq=766 Ack=766 Win=64256 Len=17 TSval=1047286997 TSecr=3171546697
1711548896.971879959   403 0.995339811    10.10.1.1 → 10.10.1.2    TCP 83 8081 → 42040 [PSH, ACK] Seq=766 Ack=783 Win=65152 Len=17 TSval=3171546707 TSecr=1047286997
1711548902.971879959   409 1.005495435    10.10.1.2 → 10.10.1.1    TCP 83 42040 → 8081 [PSH, ACK] Seq=783 Ack=783 Win=64256 Len=17 TSval=1047287007 TSecr=3171546707
1711548904.971879959   411 1.005528185    10.10.1.1 → 10.10.1.2    TCP 83 8081 → 42040 [PSH, ACK] Seq=783 Ack=800 Win=65152 Len=17 TSval=3171546717 TSecr=1047287007
1711548910.971879959   417 1.015683994    10.10.1.2 → 10.10.1.1    TCP 83 42040 → 8081 [PSH, ACK] Seq=800 Ack=800 Win=64256 Len=17 TSval=1047287017 TSecr=3171546717
1711548912.971879959   419 1.015718514    10.10.1.1 → 10.10.1.2    TCP 83 8081 → 42040 [PSH, ACK] Seq=800 Ack=817 Win=65152 Len=17 TSval=3171546728 TSecr=1047287017
1711548918.971879959   425 1.025873229    10.10.1.2 → 10.10.1.1    TCP 83 42040 → 8081 [PSH, ACK] Seq=817 Ack=817 Win=64256 Len=17 TSval=1047287027 TSecr=3171546728
1711548920.971879959   427 1.025907249    10.10.1.1 → 10.10.1.2    TCP 83 8081 → 42040 [PSH, ACK] Seq=817 Ack=834 Win=65152 Len=17 TSval=3171546738 TSecr=1047287027
1711548926.971879959   433 1.036060607    10.10.1.2 → 10.10.1.1    TCP 83 42040 → 8081 [PSH, ACK] Seq=834 Ack=834 Win=64256 Len=17 TSval=1047287037 TSecr=3171546738
1711548928.971879959   435 1.036094126    10.10.1.1 → 10.10.1.2    TCP 83 8081 → 42040 [PSH, ACK] Seq=834 Ack=851 Win=65152 Len=17 TSval=3171546748 TSecr=1047287037
1711548934.971879959   441 1.046234229    10.10.1.2 → 10.10.1.1    TCP 83 42040 → 8081 [PSH, ACK] Seq=851 Ack=851 Win=64256 Len=17 TSval=1047287048 TSecr=3171546748
1711548936.971879959   443 1.046267949    10.10.1.1 → 10.10.1.2    TCP 83 8081 → 42040 [PSH, ACK] Seq=851 Ack=868 Win=65152 Len=17 TSval=3171546758 TSecr=1047287048
1711548942.971879959   449 1.056423821    10.10.1.2 → 10.10.1.1    TCP 83 42040 → 8081 [PSH, ACK] Seq=868 Ack=868 Win=64256 Len=17 TSval=1047287058 TSecr=3171546758
1711548944.971879959   451 1.056457282    10.10.1.1 → 10.10.1.2    TCP 83 8081 → 42040 [PSH, ACK] Seq=868 Ack=885 Win=65152 Len=17 TSval=3171546768 TSecr=1047287058
1711548950.971879959   457 1.066611702    10.10.1.2 → 10.10.1.1    TCP 83 42040 → 8081 [PSH, ACK] Seq=885 Ack=885 Win=64256 Len=17 TSval=1047287068 TSecr=3171546768
1711548952.971879959   459 1.066645412    10.10.1.1 → 10.10.1.2    TCP 83 8081 → 42040 [PSH, ACK] Seq=885 Ack=902 Win=65152 Len=17 TSval=3171546779 TSecr=1047287068
1711548958.971879959   465 1.076801775    10.10.1.2 → 10.10.1.1    TCP 83 42040 → 8081 [PSH, ACK] Seq=902 Ack=902 Win=64256 Len=17 TSval=1047287078 TSecr=3171546779
1711548960.971879959   467 1.076835526    10.10.1.1 → 10.10.1.2    TCP 83 8081 → 42040 [PSH, ACK] Seq=902 Ack=919 Win=65152 Len=17 TSval=3171546789 TSecr=1047287078
1711548966.971879959   473 1.086993002    10.10.1.2 → 10.10.1.1    TCP 83 42040 → 8081 [PSH, ACK] Seq=919 Ack=919 Win=64256 Len=17 TSval=1047287088 TSecr=3171546789
1711548968.971879959   475 1.087027066    10.10.1.1 → 10.10.1.2    TCP 83 8081 → 42040 [PSH, ACK] Seq=919 Ack=936 Win=65152 Len=17 TSval=3171546799 TSecr=1047287088
1711548974.971879959   481 1.097181350    10.10.1.2 → 10.10.1.1    TCP 83 42040 → 8081 [PSH, ACK] Seq=936 Ack=936 Win=64256 Len=17 TSval=1047287098 TSecr=3171546799
1711548976.971879959   483 1.097214694    10.10.1.1 → 10.10.1.2    TCP 83 8081 → 42040 [PSH, ACK] Seq=936 Ack=953 Win=65152 Len=17 TSval=3171546809 TSecr=1047287098
1711548982.971879959   489 1.107371087    10.10.1.2 → 10.10.1.1    TCP 83 42040 → 8081 [PSH, ACK] Seq=953 Ack=953 Win=64256 Len=17 TSval=1047287109 TSecr=3171546809
1711548985.971879959   492 1.107615265    10.10.1.1 → 10.10.1.2    TCP 83 8081 → 42040 [PSH, ACK] Seq=953 Ack=970 Win=65152 Len=17 TSval=3171546820 TSecr=1047287109
1711548990.971879959   497 1.117770661    10.10.1.2 → 10.10.1.1    TCP 83 42040 → 8081 [PSH, ACK] Seq=970 Ack=970 Win=64256 Len=17 TSval=1047287119 TSecr=3171546820
1711548992.971879959   499 1.117806404    10.10.1.1 → 10.10.1.2    TCP 83 8081 → 42040 [PSH, ACK] Seq=970 Ack=987 Win=65152 Len=17 TSval=3171546830 TSecr=1047287119
1711548998.971879959   505 1.127959702    10.10.1.2 → 10.10.1.1    TCP 83 42040 → 8081 [PSH, ACK] Seq=987 Ack=987 Win=64256 Len=17 TSval=1047287129 TSecr=3171546830
1711549000.971879959   507 1.127994199    10.10.1.1 → 10.10.1.2    TCP 83 8081 → 42040 [PSH, ACK] Seq=987 Ack=1004 Win=65152 Len=17 TSval=3171546840 TSecr=1047287129
1711549006.971879959   513 1.138149738    10.10.1.2 → 10.10.1.1    TCP 83 42040 → 8081 [PSH, ACK] Seq=1004 Ack=1004 Win=64256 Len=17 TSval=1047287139 TSecr=3171546840
1711549008.971879959   515 1.138183211    10.10.1.1 → 10.10.1.2    TCP 83 8081 → 42040 [PSH, ACK] Seq=1004 Ack=1021 Win=65152 Len=17 TSval=3171546850 TSecr=1047287139
1711549014.971879959   521 1.148345947    10.10.1.2 → 10.10.1.1    TCP 83 42040 → 8081 [PSH, ACK] Seq=1021 Ack=1021 Win=64256 Len=17 TSval=1047287150 TSecr=3171546850
1711549016.971879959   523 1.148383188    10.10.1.1 → 10.10.1.2    TCP 83 8081 → 42040 [PSH, ACK] Seq=1021 Ack=1038 Win=65152 Len=17 TSval=3171546860 TSecr=1047287150
1711549022.971879959   529 1.158538012    10.10.1.2 → 10.10.1.1    TCP 83 42040 → 8081 [PSH, ACK] Seq=1038 Ack=1038 Win=64256 Len=17 TSval=1047287160 TSecr=3171546860
1711549024.971879959   531 1.158574548    10.10.1.1 → 10.10.1.2    TCP 83 8081 → 42040 [PSH, ACK] Seq=1038 Ack=1055 Win=65152 Len=17 TSval=3171546871 TSecr=1047287160
1711549030.971879959   537 1.168728843    10.10.1.2 → 10.10.1.1    TCP 83 42040 → 8081 [PSH, ACK] Seq=1055 Ack=1055 Win=64256 Len=17 TSval=1047287170 TSecr=3171546871
1711549032.971879959   539 1.168762365    10.10.1.1 → 10.10.1.2    TCP 83 8081 → 42040 [PSH, ACK] Seq=1055 Ack=1072 Win=65152 Len=17 TSval=3171546881 TSecr=1047287170
1711549038.971879959   545 1.178917424    10.10.1.2 → 10.10.1.1    TCP 83 42040 → 8081 [PSH, ACK] Seq=1072 Ack=1072 Win=64256 Len=17 TSval=1047287180 TSecr=3171546881
1711549040.971879959   547 1.178950664    10.10.1.1 → 10.10.1.2    TCP 83 8081 → 42040 [PSH, ACK] Seq=1072 Ack=1089 Win=65152 Len=17 TSval=3171546891 TSecr=1047287180
1711549046.971879959   553 1.189105168    10.10.1.2 → 10.10.1.1    TCP 83 42040 → 8081 [PSH, ACK] Seq=1089 Ack=1089 Win=64256 Len=17 TSval=1047287190 TSecr=3171546891
1711549048.971879959   555 1.189139229    10.10.1.1 → 10.10.1.2    TCP 83 8081 → 42040 [PSH, ACK] Seq=1089 Ack=1106 Win=65152 Len=17 TSval=3171546901 TSecr=1047287190
1711549054.971879959   561 1.199293069    10.10.1.2 → 10.10.1.1    TCP 83 42040 → 8081 [PSH, ACK] Seq=1106 Ack=1106 Win=64256 Len=17 TSval=1047287201 TSecr=3171546901
1711549056.971879959   563 1.199326500    10.10.1.1 → 10.10.1.2    TCP 83 8081 → 42040 [PSH, ACK] Seq=1106 Ack=1123 Win=65152 Len=17 TSval=3171546911 TSecr=1047287201
1711549062.971879959   569 1.209480656    10.10.1.2 → 10.10.1.1    TCP 83 42040 → 8081 [PSH, ACK] Seq=1123 Ack=1123 Win=64256 Len=17 TSval=1047287211 TSecr=3171546911
1711549064.971879959   571 1.209514340    10.10.1.1 → 10.10.1.2    TCP 83 8081 → 42040 [PSH, ACK] Seq=1123 Ack=1140 Win=65152 Len=17 TSval=3171546921 TSecr=1047287211
1711549070.971879959   577 1.219667844    10.10.1.2 → 10.10.1.1    TCP 83 42040 → 8081 [PSH, ACK] Seq=1140 Ack=1140 Win=64256 Len=17 TSval=1047287221 TSecr=3171546921
1711549072.971879959   579 1.219700734    10.10.1.1 → 10.10.1.2    TCP 83 8081 → 42040 [PSH, ACK] Seq=1140 Ack=1157 Win=65152 Len=17 TSval=3171546932 TSecr=1047287221
1711549078.971879959   585 1.229857085    10.10.1.2 → 10.10.1.1    TCP 83 42040 → 8081 [PSH, ACK] Seq=1157 Ack=1157 Win=64256 Len=17 TSval=1047287231 TSecr=3171546932
1711549080.971879959   587 1.229891331    10.10.1.1 → 10.10.1.2    TCP 83 8081 → 42040 [PSH, ACK] Seq=1157 Ack=1174 Win=65152 Len=17 TSval=3171546942 TSecr=1047287231
1711549086.971879959   593 1.240045480    10.10.1.2 → 10.10.1.1    TCP 83 42040 → 8081 [PSH, ACK] Seq=1174 Ack=1174 Win=64256 Len=17 TSval=1047287241 TSecr=3171546942
1711549088.971879959   595 1.240079152    10.10.1.1 → 10.10.1.2    TCP 83 8081 → 42040 [PSH, ACK] Seq=1174 Ack=1191 Win=65152 Len=17 TSval=3171546952 TSecr=1047287241
1711549094.971879959   601 1.250228656    10.10.1.2 → 10.10.1.1    TCP 83 42040 → 8081 [PSH, ACK] Seq=1191 Ack=1191 Win=64256 Len=17 TSval=1047287252 TSecr=3171546952
1711549096.971879959   603 1.250262986    10.10.1.1 → 10.10.1.2    TCP 83 8081 → 42040 [PSH, ACK] Seq=1191 Ack=1208 Win=65152 Len=17 TSval=3171546962 TSecr=1047287252
1711549102.971879959   609 1.260417154    10.10.1.2 → 10.10.1.1    TCP 83 42040 → 8081 [PSH, ACK] Seq=1208 Ack=1208 Win=64256 Len=17 TSval=1047287262 TSecr=3171546962
1711549104.971879959   611 1.260452418    10.10.1.1 → 10.10.1.2    TCP 83 8081 → 42040 [PSH, ACK] Seq=1208 Ack=1225 Win=65152 Len=17 TSval=3171546972 TSecr=1047287262
1711549110.971879959   617 1.270608165    10.10.1.2 → 10.10.1.1    TCP 83 42040 → 8081 [PSH, ACK] Seq=1225 Ack=1225 Win=64256 Len=17 TSval=1047287272 TSecr=3171546972
1711549112.971879959   619 1.270641069    10.10.1.1 → 10.10.1.2    TCP 83 8081 → 42040 [PSH, ACK] Seq=1225 Ack=1242 Win=65152 Len=17 TSval=3171546983 TSecr=1047287272
1711549118.971879959   625 1.280795166    10.10.1.2 → 10.10.1.1    TCP 83 42040 → 8081 [PSH, ACK] Seq=1242 Ack=1242 Win=64256 Len=17 TSval=1047287282 TSecr=3171546983
1711549120.971879959   627 1.280828597    10.10.1.1 → 10.10.1.2    TCP 83 8081 → 42040 [PSH, ACK] Seq=1242 Ack=1259 Win=65152 Len=17 TSval=3171546993 TSecr=1047287282
1711549126.971879959   633 1.290983957    10.10.1.2 → 10.10.1.1    TCP 83 42040 → 8081 [PSH, ACK] Seq=1259 Ack=1259 Win=64256 Len=17 TSval=1047287292 TSecr=3171546993
1711549128.971879959   635 1.291016970    10.10.1.1 → 10.10.1.2    TCP 83 8081 → 42040 [PSH, ACK] Seq=1259 Ack=1276 Win=65152 Len=17 TSval=3171547003 TSecr=1047287292
1711549134.971879959   641 1.301172372    10.10.1.2 → 10.10.1.1    TCP 83 42040 → 8081 [PSH, ACK] Seq=1276 Ack=1276 Win=64256 Len=17 TSval=1047287302 TSecr=3171547003
1711549136.971879959   643 1.301206079    10.10.1.1 → 10.10.1.2    TCP 83 8081 → 42040 [PSH, ACK] Seq=1276 Ack=1293 Win=65152 Len=17 TSval=3171547013 TSecr=1047287302
1711549142.971879959   649 1.311361680    10.10.1.2 → 10.10.1.1    TCP 83 42040 → 8081 [PSH, ACK] Seq=1293 Ack=1293 Win=64256 Len=17 TSval=1047287313 TSecr=3171547013
1711549144.971879959   651 1.311394812    10.10.1.1 → 10.10.1.2    TCP 83 8081 → 42040 [PSH, ACK] Seq=1293 Ack=1310 Win=65152 Len=17 TSval=3171547023 TSecr=1047287313
1711549150.971879959   657 1.321550403    10.10.1.2 → 10.10.1.1    TCP 83 42040 → 8081 [PSH, ACK] Seq=1310 Ack=1310 Win=64256 Len=17 TSval=1047287323 TSecr=3171547023
1711549152.971879959   659 1.321584914    10.10.1.1 → 10.10.1.2    TCP 83 8081 → 42040 [PSH, ACK] Seq=1310 Ack=1327 Win=65152 Len=17 TSval=3171547034 TSecr=1047287323
1711549158.971879959   665 1.331740573    10.10.1.2 → 10.10.1.1    TCP 83 42040 → 8081 [PSH, ACK] Seq=1327 Ack=1327 Win=64256 Len=17 TSval=1047287333 TSecr=3171547034
1711549160.971879959   667 1.331773803    10.10.1.1 → 10.10.1.2    TCP 83 8081 → 42040 [PSH, ACK] Seq=1327 Ack=1344 Win=65152 Len=17 TSval=3171547044 TSecr=1047287333
1711549166.971879959   673 1.341926462    10.10.1.2 → 10.10.1.1    TCP 83 42040 → 8081 [PSH, ACK] Seq=1344 Ack=1344 Win=64256 Len=17 TSval=1047287343 TSecr=3171547044
1711549168.971879959   675 1.341957924    10.10.1.1 → 10.10.1.2    TCP 83 8081 → 42040 [PSH, ACK] Seq=1344 Ack=1361 Win=65152 Len=17 TSval=3171547054 TSecr=1047287343
1711549174.971879959   681 1.352111720    10.10.1.2 → 10.10.1.1    TCP 83 42040 → 8081 [PSH, ACK] Seq=1361 Ack=1361 Win=64256 Len=17 TSval=1047287353 TSecr=3171547054
1711549176.971879959   683 1.352145548    10.10.1.1 → 10.10.1.2    TCP 83 8081 → 42040 [PSH, ACK] Seq=1361 Ack=1378 Win=65152 Len=17 TSval=3171547064 TSecr=1047287353
1711549182.971879959   689 1.362300356    10.10.1.2 → 10.10.1.1    TCP 83 42040 → 8081 [PSH, ACK] Seq=1378 Ack=1378 Win=64256 Len=17 TSval=1047287364 TSecr=3171547064
1711549184.971879959   691 1.362335785    10.10.1.1 → 10.10.1.2    TCP 83 8081 → 42040 [PSH, ACK] Seq=1378 Ack=1395 Win=65152 Len=17 TSval=3171547074 TSecr=1047287364
1711549190.971879959   697 1.372490039    10.10.1.2 → 10.10.1.1    TCP 83 42040 → 8081 [PSH, ACK] Seq=1395 Ack=1395 Win=64256 Len=17 TSval=1047287374 TSecr=3171547074
1711549192.971879959   699 1.372523380    10.10.1.1 → 10.10.1.2    TCP 83 8081 → 42040 [PSH, ACK] Seq=1395 Ack=1412 Win=65152 Len=17 TSval=3171547084 TSecr=1047287374
1711549198.971879959   705 1.382680400    10.10.1.2 → 10.10.1.1    TCP 83 42040 → 8081 [PSH, ACK] Seq=1412 Ack=1412 Win=64256 Len=17 TSval=1047287384 TSecr=3171547084
1711549200.971879959   707 1.382713633    10.10.1.1 → 10.10.1.2    TCP 83 8081 → 42040 [PSH, ACK] Seq=1412 Ack=1429 Win=65152 Len=17 TSval=3171547095 TSecr=1047287384
1711549206.971879959   713 1.392868748    10.10.1.2 → 10.10.1.1    TCP 83 42040 → 8081 [PSH, ACK] Seq=1429 Ack=1429 Win=64256 Len=17 TSval=1047287394 TSecr=3171547095
1711549208.971879959   715 1.392902555    10.10.1.1 → 10.10.1.2    TCP 83 8081 → 42040 [PSH, ACK] Seq=1429 Ack=1446 Win=65152 Len=17 TSval=3171547105 TSecr=1047287394
1711549214.971879959   721 1.403057619    10.10.1.2 → 10.10.1.1    TCP 83 42040 → 8081 [PSH, ACK] Seq=1446 Ack=1446 Win=64256 Len=17 TSval=1047287404 TSecr=3171547105
1711549216.971879959   723 1.403092287    10.10.1.1 → 10.10.1.2    TCP 83 8081 → 42040 [PSH, ACK] Seq=1446 Ack=1463 Win=65152 Len=17 TSval=3171547115 TSecr=1047287404
1711549222.971879959   729 1.413246087    10.10.1.2 → 10.10.1.1    TCP 83 42040 → 8081 [PSH, ACK] Seq=1463 Ack=1463 Win=64256 Len=17 TSval=1047287415 TSecr=3171547115
1711549224.971879959   731 1.413279608    10.10.1.1 → 10.10.1.2    TCP 83 8081 → 42040 [PSH, ACK] Seq=1463 Ack=1480 Win=65152 Len=17 TSval=3171547125 TSecr=1047287415
1711549230.971879959   737 1.423434655    10.10.1.2 → 10.10.1.1    TCP 83 42040 → 8081 [PSH, ACK] Seq=1480 Ack=1480 Win=64256 Len=17 TSval=1047287425 TSecr=3171547125
1711549232.971879959   739 1.423467461    10.10.1.1 → 10.10.1.2    TCP 83 8081 → 42040 [PSH, ACK] Seq=1480 Ack=1497 Win=65152 Len=17 TSval=3171547135 TSecr=1047287425
1711549238.971879959   745 1.433621554    10.10.1.2 → 10.10.1.1    TCP 83 42040 → 8081 [PSH, ACK] Seq=1497 Ack=1497 Win=64256 Len=17 TSval=1047287435 TSecr=3171547135
1711549240.971879959   747 1.433656496    10.10.1.1 → 10.10.1.2    TCP 83 8081 → 42040 [PSH, ACK] Seq=1497 Ack=1514 Win=65152 Len=17 TSval=3171547146 TSecr=1047287435
1711549246.971879959   753 1.443812149    10.10.1.2 → 10.10.1.1    TCP 83 42040 → 8081 [PSH, ACK] Seq=1514 Ack=1514 Win=64256 Len=17 TSval=1047287445 TSecr=3171547146
1711549248.971879959   755 1.443845200    10.10.1.1 → 10.10.1.2    TCP 83 8081 → 42040 [PSH, ACK] Seq=1514 Ack=1531 Win=65152 Len=17 TSval=3171547156 TSecr=1047287445
1711549254.971879959   761 1.453999933    10.10.1.2 → 10.10.1.1    TCP 83 42040 → 8081 [PSH, ACK] Seq=1531 Ack=1531 Win=64256 Len=17 TSval=1047287455 TSecr=3171547156
1711549256.971879959   763 1.454032717    10.10.1.1 → 10.10.1.2    TCP 83 8081 → 42040 [PSH, ACK] Seq=1531 Ack=1548 Win=65152 Len=17 TSval=3171547166 TSecr=1047287455
1711549262.971879959   769 1.464187473    10.10.1.2 → 10.10.1.1    TCP 83 42040 → 8081 [PSH, ACK] Seq=1548 Ack=1548 Win=64256 Len=17 TSval=1047287465 TSecr=3171547166
1711549264.971879959   771 1.464221466    10.10.1.1 → 10.10.1.2    TCP 83 8081 → 42040 [PSH, ACK] Seq=1548 Ack=1565 Win=65152 Len=17 TSval=3171547176 TSecr=1047287465
1711549270.971879959   777 1.474378699    10.10.1.2 → 10.10.1.1    TCP 83 42040 → 8081 [PSH, ACK] Seq=1565 Ack=1565 Win=64256 Len=17 TSval=1047287476 TSecr=3171547176
1711549272.971879959   779 1.474412370    10.10.1.1 → 10.10.1.2    TCP 83 8081 → 42040 [PSH, ACK] Seq=1565 Ack=1582 Win=65152 Len=17 TSval=3171547186 TSecr=1047287476
1711549278.971879959   785 1.484568251    10.10.1.2 → 10.10.1.1    TCP 83 42040 → 8081 [PSH, ACK] Seq=1582 Ack=1582 Win=64256 Len=17 TSval=1047287486 TSecr=3171547186
1711549280.971879959   787 1.484601954    10.10.1.1 → 10.10.1.2    TCP 83 8081 → 42040 [PSH, ACK] Seq=1582 Ack=1599 Win=65152 Len=17 TSval=3171547197 TSecr=1047287486
1711549286.971879959   793 1.494756320    10.10.1.2 → 10.10.1.1    TCP 83 42040 → 8081 [PSH, ACK] Seq=1599 Ack=1599 Win=64256 Len=17 TSval=1047287496 TSecr=3171547197
1711549288.971879959   795 1.494791734    10.10.1.1 → 10.10.1.2    TCP 83 8081 → 42040 [PSH, ACK] Seq=1599 Ack=1616 Win=65152 Len=17 TSval=3171547207 TSecr=1047287496
1711549294.971879959   801 1.504945166    10.10.1.2 → 10.10.1.1    TCP 83 42040 → 8081 [PSH, ACK] Seq=1616 Ack=1616 Win=64256 Len=17 TSval=1047287506 TSecr=3171547207
1711549296.971879959   803 1.504978350    10.10.1.1 → 10.10.1.2    TCP 83 8081 → 42040 [PSH, ACK] Seq=1616 Ack=1633 Win=65152 Len=17 TSval=3171547217 TSecr=1047287506
1711549302.971879959   809 1.515131266    10.10.1.2 → 10.10.1.1    TCP 83 42040 → 8081 [PSH, ACK] Seq=1633 Ack=1633 Win=64256 Len=17 TSval=1047287516 TSecr=3171547217
1711549304.971879959   811 1.515164376    10.10.1.1 → 10.10.1.2    TCP 83 8081 → 42040 [PSH, ACK] Seq=1633 Ack=1650 Win=65152 Len=17 TSval=3171547227 TSecr=1047287516
1711549310.971879959   817 1.525318727    10.10.1.2 → 10.10.1.1    TCP 83 42040 → 8081 [PSH, ACK] Seq=1650 Ack=1650 Win=64256 Len=17 TSval=1047287527 TSecr=3171547227
1711549312.971879959   819 1.525351778    10.10.1.1 → 10.10.1.2    TCP 83 8081 → 42040 [PSH, ACK] Seq=1650 Ack=1667 Win=65152 Len=17 TSval=3171547237 TSecr=1047287527
1711549318.971879959   825 1.535507397    10.10.1.2 → 10.10.1.1    TCP 83 42040 → 8081 [PSH, ACK] Seq=1667 Ack=1667 Win=64256 Len=17 TSval=1047287537 TSecr=3171547237
1711549320.971879959   827 1.535540955    10.10.1.1 → 10.10.1.2    TCP 83 8081 → 42040 [PSH, ACK] Seq=1667 Ack=1684 Win=65152 Len=17 TSval=3171547248 TSecr=1047287537
1711549326.971879959   833 1.545696139    10.10.1.2 → 10.10.1.1    TCP 83 42040 → 8081 [PSH, ACK] Seq=1684 Ack=1684 Win=64256 Len=17 TSval=1047287547 TSecr=3171547248
1711549328.971879959   835 1.545730286    10.10.1.1 → 10.10.1.2    TCP 83 8081 → 42040 [PSH, ACK] Seq=1684 Ack=1701 Win=65152 Len=17 TSval=3171547258 TSecr=1047287547
1711549334.971879959   841 1.555884725    10.10.1.2 → 10.10.1.1    TCP 83 42040 → 8081 [PSH, ACK] Seq=1701 Ack=1701 Win=64256 Len=17 TSval=1047287557 TSecr=3171547258
1711549336.971879959   843 1.555917861    10.10.1.1 → 10.10.1.2    TCP 83 8081 → 42040 [PSH, ACK] Seq=1701 Ack=1718 Win=65152 Len=17 TSval=3171547268 TSecr=1047287557
1711549342.971879959   849 1.566074540    10.10.1.2 → 10.10.1.1    TCP 83 42040 → 8081 [PSH, ACK] Seq=1718 Ack=1718 Win=64256 Len=17 TSval=1047287567 TSecr=3171547268
1711549344.971879959   851 1.566107957    10.10.1.1 → 10.10.1.2    TCP 83 8081 → 42040 [PSH, ACK] Seq=1718 Ack=1735 Win=65152 Len=17 TSval=3171547278 TSecr=1047287567
1711549350.971879959   857 1.576264415    10.10.1.2 → 10.10.1.1    TCP 83 42040 → 8081 [PSH, ACK] Seq=1735 Ack=1735 Win=64256 Len=17 TSval=1047287578 TSecr=3171547278
1711549352.971879959   859 1.576298039    10.10.1.1 → 10.10.1.2    TCP 83 8081 → 42040 [PSH, ACK] Seq=1735 Ack=1752 Win=65152 Len=17 TSval=3171547288 TSecr=1047287578
1711549358.971879959   865 1.586452809    10.10.1.2 → 10.10.1.1    TCP 83 42040 → 8081 [PSH, ACK] Seq=1752 Ack=1752 Win=64256 Len=17 TSval=1047287588 TSecr=3171547288
1711549360.971879959   867 1.586486480    10.10.1.1 → 10.10.1.2    TCP 83 8081 → 42040 [PSH, ACK] Seq=1752 Ack=1769 Win=65152 Len=17 TSval=3171547298 TSecr=1047287588
1711549366.971879959   873 1.596641553    10.10.1.2 → 10.10.1.1    TCP 83 42040 → 8081 [PSH, ACK] Seq=1769 Ack=1769 Win=64256 Len=17 TSval=1047287598 TSecr=3171547298
1711549368.971879959   875 1.596674964    10.10.1.1 → 10.10.1.2    TCP 83 8081 → 42040 [PSH, ACK] Seq=1769 Ack=1786 Win=65152 Len=17 TSval=3171547309 TSecr=1047287598
1711549374.971879959   881 1.606831081    10.10.1.2 → 10.10.1.1    TCP 83 42040 → 8081 [PSH, ACK] Seq=1786 Ack=1786 Win=64256 Len=17 TSval=1047287608 TSecr=3171547309
1711549376.971879959   883 1.606864674    10.10.1.1 → 10.10.1.2    TCP 83 8081 → 42040 [PSH, ACK] Seq=1786 Ack=1803 Win=65152 Len=17 TSval=3171547319 TSecr=1047287608
1711549382.971879959   889 1.617019942    10.10.1.2 → 10.10.1.1    TCP 83 42040 → 8081 [PSH, ACK] Seq=1803 Ack=1803 Win=64256 Len=17 TSval=1047287618 TSecr=3171547319
1711549384.971879959   891 1.617053408    10.10.1.1 → 10.10.1.2    TCP 83 8081 → 42040 [PSH, ACK] Seq=1803 Ack=1820 Win=65152 Len=17 TSval=3171547329 TSecr=1047287618
1711549390.971879959   897 1.627207570    10.10.1.2 → 10.10.1.1    TCP 83 42040 → 8081 [PSH, ACK] Seq=1820 Ack=1820 Win=64256 Len=17 TSval=1047287628 TSecr=3171547329
1711549392.971879959   899 1.627242903    10.10.1.1 → 10.10.1.2    TCP 83 8081 → 42040 [PSH, ACK] Seq=1820 Ack=1837 Win=65152 Len=17 TSval=3171547339 TSecr=1047287628
1711549398.971879959   905 1.637399055    10.10.1.2 → 10.10.1.1    TCP 83 42040 → 8081 [PSH, ACK] Seq=1837 Ack=1837 Win=64256 Len=17 TSval=1047287639 TSecr=3171547339
1711549400.971879959   907 1.637432657    10.10.1.1 → 10.10.1.2    TCP 83 8081 → 42040 [PSH, ACK] Seq=1837 Ack=1854 Win=65152 Len=17 TSval=3171547349 TSecr=1047287639
1711549406.971879959   913 1.647591239    10.10.1.2 → 10.10.1.1    TCP 83 42040 → 8081 [PSH, ACK] Seq=1854 Ack=1854 Win=64256 Len=17 TSval=1047287649 TSecr=3171547349
1711549408.971879959   915 1.647625022    10.10.1.1 → 10.10.1.2    TCP 83 8081 → 42040 [PSH, ACK] Seq=1854 Ack=1871 Win=65152 Len=17 TSval=3171547360 TSecr=1047287649
1711549414.971879959   921 1.657779145    10.10.1.2 → 10.10.1.1    TCP 83 42040 → 8081 [PSH, ACK] Seq=1871 Ack=1871 Win=64256 Len=17 TSval=1047287659 TSecr=3171547360
1711549416.971879959   923 1.657812830    10.10.1.1 → 10.10.1.2    TCP 83 8081 → 42040 [PSH, ACK] Seq=1871 Ack=1888 Win=65152 Len=17 TSval=3171547370 TSecr=1047287659
1711549422.971879959   929 1.667968343    10.10.1.2 → 10.10.1.1    TCP 83 42040 → 8081 [PSH, ACK] Seq=1888 Ack=1888 Win=64256 Len=17 TSval=1047287669 TSecr=3171547370
1711549424.971879959   931 1.668001850    10.10.1.1 → 10.10.1.2    TCP 83 8081 → 42040 [PSH, ACK] Seq=1888 Ack=1905 Win=65152 Len=17 TSval=3171547380 TSecr=1047287669
1711549430.971879959   937 1.678157927    10.10.1.2 → 10.10.1.1    TCP 83 42040 → 8081 [PSH, ACK] Seq=1905 Ack=1905 Win=64256 Len=17 TSval=1047287679 TSecr=3171547380
1711549432.971879959   939 1.678192004    10.10.1.1 → 10.10.1.2    TCP 83 8081 → 42040 [PSH, ACK] Seq=1905 Ack=1922 Win=65152 Len=17 TSval=3171547390 TSecr=1047287679
1711549438.971879959   945 1.688352399    10.10.1.2 → 10.10.1.1    TCP 83 42040 → 8081 [PSH, ACK] Seq=1922 Ack=1922 Win=64256 Len=17 TSval=1047287690 TSecr=3171547390
1711549441.971879959   948 1.688448633    10.10.1.1 → 10.10.1.2    TCP 83 8081 → 42040 [PSH, ACK] Seq=1922 Ack=1939 Win=65152 Len=17 TSval=3171547400 TSecr=1047287690
1711549446.971879959   953 1.698602437    10.10.1.2 → 10.10.1.1    TCP 83 42040 → 8081 [PSH, ACK] Seq=1939 Ack=1939 Win=64256 Len=17 TSval=1047287700 TSecr=3171547400
1711549448.971879959   955 1.698636547    10.10.1.1 → 10.10.1.2    TCP 83 8081 → 42040 [PSH, ACK] Seq=1939 Ack=1956 Win=65152 Len=17 TSval=3171547411 TSecr=1047287700
1711549454.971879959   961 1.708791375    10.10.1.2 → 10.10.1.1    TCP 83 42040 → 8081 [PSH, ACK] Seq=1956 Ack=1956 Win=64256 Len=17 TSval=1047287710 TSecr=3171547411
1711549456.971879959   963 1.708824816    10.10.1.1 → 10.10.1.2    TCP 83 8081 → 42040 [PSH, ACK] Seq=1956 Ack=1973 Win=65152 Len=17 TSval=3171547421 TSecr=1047287710
1711549462.971879959   969 1.718981759    10.10.1.2 → 10.10.1.1    TCP 83 42040 → 8081 [PSH, ACK] Seq=1973 Ack=1973 Win=64256 Len=17 TSval=1047287720 TSecr=3171547421
1711549464.971879959   971 1.719015702    10.10.1.1 → 10.10.1.2    TCP 83 8081 → 42040 [PSH, ACK] Seq=1973 Ack=1990 Win=65152 Len=17 TSval=3171547431 TSecr=1047287720
1711549470.971879959   977 1.729169396    10.10.1.2 → 10.10.1.1    TCP 83 42040 → 8081 [PSH, ACK] Seq=1990 Ack=1990 Win=64256 Len=17 TSval=1047287730 TSecr=3171547431
1711549472.971879959   979 1.729202785    10.10.1.1 → 10.10.1.2    TCP 83 8081 → 42040 [PSH, ACK] Seq=1990 Ack=2007 Win=65152 Len=17 TSval=3171547441 TSecr=1047287730
1711549478.971879959   985 1.739357574    10.10.1.2 → 10.10.1.1    TCP 83 42040 → 8081 [PSH, ACK] Seq=2007 Ack=2007 Win=64256 Len=17 TSval=1047287741 TSecr=3171547441
1711549480.971879959   987 1.739391281    10.10.1.1 → 10.10.1.2    TCP 83 8081 → 42040 [PSH, ACK] Seq=2007 Ack=2024 Win=65152 Len=17 TSval=3171547451 TSecr=1047287741
1711549486.971879959   993 1.749547444    10.10.1.2 → 10.10.1.1    TCP 83 42040 → 8081 [PSH, ACK] Seq=2024 Ack=2024 Win=64256 Len=17 TSval=1047287751 TSecr=3171547451
1711549488.971879959   995 1.749583635    10.10.1.1 → 10.10.1.2    TCP 83 8081 → 42040 [PSH, ACK] Seq=2024 Ack=2041 Win=65152 Len=17 TSval=3171547462 TSecr=1047287751
1711549494.971879959  1001 1.759738379    10.10.1.2 → 10.10.1.1    TCP 83 42040 → 8081 [PSH, ACK] Seq=2041 Ack=2041 Win=64256 Len=17 TSval=1047287761 TSecr=3171547462
