1711548818.424000263    22 0.302708156    10.10.1.2 → 10.10.1.1    TCP 74 57262 → 8081 [SYN] Seq=0 Win=64240 Len=0 MSS=1460 SACK_PERM=1 TSval=1047588751 TSecr=0 WS=128
1711548819.424000263    23 0.302745691    10.10.1.1 → 10.10.1.2    TCP 74 8081 → 57262 [SYN, ACK] Seq=0 Ack=1 Win=65160 Len=0 MSS=1460 SACK_PERM=1 TSval=3171848462 TSecr=1047588751 WS=128
1711548820.424000263    24 0.302790308    10.10.1.2 → 10.10.1.1    TCP 66 57262 → 8081 [ACK] Seq=1 Ack=1 Win=64256 Len=0 TSval=1047588751 TSecr=3171848462
1711548830.424000263    34 0.565729664    10.10.1.2 → 10.10.1.1    TCP 83 57262 → 8081 [PSH, ACK] Seq=1 Ack=1 Win=64256 Len=17 TSval=1047589014 TSecr=3171848462
1711548831.424000263    35 0.565757776    10.10.1.1 → 10.10.1.2    TCP 66 8081 → 57262 [ACK] Seq=1 Ack=18 Win=65152 Len=0 TSval=3171848725 TSecr=1047589014
1711548834.424000263    38 0.566079180    10.10.1.1 → 10.10.1.2    TCP 83 8081 → 57262 [PSH, ACK] Seq=1 Ack=18 Win=65152 Len=17 TSval=3171848726 TSecr=1047589014
1711548835.424000263    39 0.566107824    10.10.1.2 → 10.10.1.1    TCP 66 57262 → 8081 [ACK] Seq=18 Ack=18 Win=64256 Len=0 TSval=1047589015 TSecr=3171848726
1711548842.424000263    46 0.576298999    10.10.1.2 → 10.10.1.1    TCP 83 57262 → 8081 [PSH, ACK] Seq=18 Ack=18 Win=64256 Len=17 TSval=1047589025 TSecr=3171848726
1711548845.424000263    49 0.576425348    10.10.1.1 → 10.10.1.2    TCP 83 8081 → 57262 [PSH, ACK] Seq=18 Ack=35 Win=65152 Len=17 TSval=3171848736 TSecr=1047589025
1711548852.424000263    56 0.586643192    10.10.1.2 → 10.10.1.1    TCP 83 57262 → 8081 [PSH, ACK] Seq=35 Ack=35 Win=64256 Len=17 TSval=1047589035 TSecr=3171848736
1711548855.424000263    59 0.586774398    10.10.1.1 → 10.10.1.2    TCP 83 8081 → 57262 [PSH, ACK] Seq=35 Ack=52 Win=65152 Len=17 TSval=3171848746 TSecr=1047589035
1711548862.424000263    66 0.596992167    10.10.1.2 → 10.10.1.1    TCP 83 57262 → 8081 [PSH, ACK] Seq=52 Ack=52 Win=64256 Len=17 TSval=1047589045 TSecr=3171848746
1711548865.424000263    69 0.597124235    10.10.1.1 → 10.10.1.2    TCP 83 8081 → 57262 [PSH, ACK] Seq=52 Ack=69 Win=65152 Len=17 TSval=3171848757 TSecr=1047589045
1711548872.424000263    76 0.607341281    10.10.1.2 → 10.10.1.1    TCP 83 57262 → 8081 [PSH, ACK] Seq=69 Ack=69 Win=64256 Len=17 TSval=1047589056 TSecr=3171848757
1711548875.424000263    79 0.607472412    10.10.1.1 → 10.10.1.2    TCP 83 8081 → 57262 [PSH, ACK] Seq=69 Ack=86 Win=65152 Len=17 TSval=3171848767 TSecr=1047589056
1711548882.424000263    86 0.617689576    10.10.1.2 → 10.10.1.1    TCP 83 57262 → 8081 [PSH, ACK] Seq=86 Ack=86 Win=64256 Len=17 TSval=1047589066 TSecr=3171848767
1711548884.424000263    88 0.617820769    10.10.1.1 → 10.10.1.2    TCP 83 8081 → 57262 [PSH, ACK] Seq=86 Ack=103 Win=65152 Len=17 TSval=3171848777 TSecr=1047589066
1711548892.424000263    96 0.628039433    10.10.1.2 → 10.10.1.1    TCP 83 57262 → 8081 [PSH, ACK] Seq=103 Ack=103 Win=64256 Len=17 TSval=1047589077 TSecr=3171848777
1711548894.424000263    98 0.628170342    10.10.1.1 → 10.10.1.2    TCP 83 8081 → 57262 [PSH, ACK] Seq=103 Ack=120 Win=65152 Len=17 TSval=3171848788 TSecr=1047589077
1711548902.424000263   106 0.638400317    10.10.1.2 → 10.10.1.1    TCP 83 57262 → 8081 [PSH, ACK] Seq=120 Ack=120 Win=64256 Len=17 TSval=1047589087 TSecr=3171848788
1711548904.424000263   108 0.638530830    10.10.1.1 → 10.10.1.2    TCP 83 8081 → 57262 [PSH, ACK] Seq=120 Ack=137 Win=65152 Len=17 TSval=3171848798 TSecr=1047589087
1711548912.424000263   116 0.648749067    10.10.1.2 → 10.10.1.1    TCP 83 57262 → 8081 [PSH, ACK] Seq=137 Ack=137 Win=64256 Len=17 TSval=1047589097 TSecr=3171848798
1711548914.424000263   118 0.648880498    10.10.1.1 → 10.10.1.2    TCP 83 8081 → 57262 [PSH, ACK] Seq=137 Ack=154 Win=65152 Len=17 TSval=3171848808 TSecr=1047589097
1711548922.424000263   126 0.659099986    10.10.1.2 → 10.10.1.1    TCP 83 57262 → 8081 [PSH, ACK] Seq=154 Ack=154 Win=64256 Len=17 TSval=1047589108 TSecr=3171848808
1711548924.424000263   128 0.659230821    10.10.1.1 → 10.10.1.2    TCP 83 8081 → 57262 [PSH, ACK] Seq=154 Ack=171 Win=65152 Len=17 TSval=3171848819 TSecr=1047589108
1711548932.424000263   136 0.669452207    10.10.1.2 → 10.10.1.1    TCP 83 57262 → 8081 [PSH, ACK] Seq=171 Ack=171 Win=64256 Len=17 TSval=1047589118 TSecr=3171848819
1711548935.424000263   139 0.669586727    10.10.1.1 → 10.10.1.2    TCP 83 8081 → 57262 [PSH, ACK] Seq=171 Ack=188 Win=65152 Len=17 TSval=3171848829 TSecr=1047589118
1711548942.424000263   146 0.679806319    10.10.1.2 → 10.10.1.1    TCP 83 57262 → 8081 [PSH, ACK] Seq=188 Ack=188 Win=64256 Len=17 TSval=1047589128 TSecr=3171848829
1711548945.424000263   149 0.679939035    10.10.1.1 → 10.10.1.2    TCP 83 8081 → 57262 [PSH, ACK] Seq=188 Ack=205 Win=65152 Len=17 TSval=3171848839 TSecr=1047589128
1711548953.424000263   157 0.690159262    10.10.1.2 → 10.10.1.1    TCP 83 57262 → 8081 [PSH, ACK] Seq=205 Ack=205 Win=64256 Len=17 TSval=1047589139 TSecr=3171848839
1711548955.424000263   159 0.690293362    10.10.1.1 → 10.10.1.2    TCP 83 8081 → 57262 [PSH, ACK] Seq=205 Ack=222 Win=65152 Len=17 TSval=3171848850 TSecr=1047589139
1711548962.424000263   166 0.700511682    10.10.1.2 → 10.10.1.1    TCP 83 57262 → 8081 [PSH, ACK] Seq=222 Ack=222 Win=64256 Len=17 TSval=1047589149 TSecr=3171848850
1711548965.424000263   169 0.700649814    10.10.1.1 → 10.10.1.2    TCP 83 8081 → 57262 [PSH, ACK] Seq=222 Ack=239 Win=65152 Len=17 TSval=3171848860 TSecr=1047589149
1711548973.424000263   177 0.710868861    10.10.1.2 → 10.10.1.1    TCP 83 57262 → 8081 [PSH, ACK] Seq=239 Ack=239 Win=64256 Len=17 TSval=1047589159 TSecr=3171848860
1711548975.424000263   179 0.711002152    10.10.1.1 → 10.10.1.2    TCP 83 8081 → 57262 [PSH, ACK] Seq=239 Ack=256 Win=65152 Len=17 TSval=3171848870 TSecr=1047589159
1711548982.424000263   186 0.721226848    10.10.1.2 → 10.10.1.1    TCP 83 57262 → 8081 [PSH, ACK] Seq=256 Ack=256 Win=64256 Len=17 TSval=1047589170 TSecr=3171848870
1711548985.424000263   189 0.721359673    10.10.1.1 → 10.10.1.2    TCP 83 8081 → 57262 [PSH, ACK] Seq=256 Ack=273 Win=65152 Len=17 TSval=3171848881 TSecr=1047589170
1711548993.424000263   197 0.731590867    10.10.1.2 → 10.10.1.1    TCP 83 57262 → 8081 [PSH, ACK] Seq=273 Ack=273 Win=64256 Len=17 TSval=1047589180 TSecr=3171848881
1711548995.424000263   199 0.731723536    10.10.1.1 → 10.10.1.2    TCP 83 8081 → 57262 [PSH, ACK] Seq=273 Ack=290 Win=65152 Len=17 TSval=3171848891 TSecr=1047589180
1711549003.424000263   207 0.741945165    10.10.1.2 → 10.10.1.1    TCP 83 57262 → 8081 [PSH, ACK] Seq=290 Ack=290 Win=64256 Len=17 TSval=1047589190 TSecr=3171848891
1711549005.424000263   209 0.742099477    10.10.1.1 → 10.10.1.2    TCP 83 8081 → 57262 [PSH, ACK] Seq=290 Ack=307 Win=65152 Len=17 TSval=3171848902 TSecr=1047589190
1711549013.424000263   217 0.752323334    10.10.1.2 → 10.10.1.1    TCP 83 57262 → 8081 [PSH, ACK] Seq=307 Ack=307 Win=64256 Len=17 TSval=1047589201 TSecr=3171848902
1711549015.424000263   219 0.752454003    10.10.1.1 → 10.10.1.2    TCP 83 8081 → 57262 [PSH, ACK] Seq=307 Ack=324 Win=65152 Len=17 TSval=3171848912 TSecr=1047589201
1711549023.424000263   227 0.762675249    10.10.1.2 → 10.10.1.1    TCP 83 57262 → 8081 [PSH, ACK] Seq=324 Ack=324 Win=64256 Len=17 TSval=1047589211 TSecr=3171848912
1711549024.424000263   228 0.762808201    10.10.1.1 → 10.10.1.2    TCP 83 8081 → 57262 [PSH, ACK] Seq=324 Ack=341 Win=65152 Len=17 TSval=3171848922 TSecr=1047589211
1711549033.424000263   237 0.773028379    10.10.1.2 → 10.10.1.1    TCP 83 57262 → 8081 [PSH, ACK] Seq=341 Ack=341 Win=64256 Len=17 TSval=1047589221 TSecr=3171848922
1711549035.424000263   239 0.773162754    10.10.1.1 → 10.10.1.2    TCP 83 8081 → 57262 [PSH, ACK] Seq=341 Ack=358 Win=65152 Len=17 TSval=3171848933 TSecr=1047589221
1711549043.424000263   247 0.783383002    10.10.1.2 → 10.10.1.1    TCP 83 57262 → 8081 [PSH, ACK] Seq=358 Ack=358 Win=64256 Len=17 TSval=1047589232 TSecr=3171848933
1711549045.424000263   249 0.783517585    10.10.1.1 → 10.10.1.2    TCP 83 8081 → 57262 [PSH, ACK] Seq=358 Ack=375 Win=65152 Len=17 TSval=3171848943 TSecr=1047589232
1711549053.424000263   257 0.793737509    10.10.1.2 → 10.10.1.1    TCP 83 57262 → 8081 [PSH, ACK] Seq=375 Ack=375 Win=64256 Len=17 TSval=1047589242 TSecr=3171848943
1711549055.424000263   259 0.793870718    10.10.1.1 → 10.10.1.2    TCP 83 8081 → 57262 [PSH, ACK] Seq=375 Ack=392 Win=65152 Len=17 TSval=3171848953 TSecr=1047589242
1711549063.424000263   267 0.804093261    10.10.1.2 → 10.10.1.1    TCP 83 57262 → 8081 [PSH, ACK] Seq=392 Ack=392 Win=64256 Len=17 TSval=1047589253 TSecr=3171848953
1711549065.424000263   269 0.804227349    10.10.1.1 → 10.10.1.2    TCP 83 8081 → 57262 [PSH, ACK] Seq=392 Ack=409 Win=65152 Len=17 TSval=3171848964 TSecr=1047589253
1711549072.424000263   276 0.814447654    10.10.1.2 → 10.10.1.1    TCP 83 57262 → 8081 [PSH, ACK] Seq=409 Ack=409 Win=64256 Len=17 TSval=1047589263 TSecr=3171848964
1711549075.424000263   279 0.814581045    10.10.1.1 → 10.10.1.2    TCP 83 8081 → 57262 [PSH, ACK] Seq=409 Ack=426 Win=65152 Len=17 TSval=3171848974 TSecr=1047589263
1711549082.424000263   286 0.824801566    10.10.1.2 → 10.10.1.1    TCP 83 57262 → 8081 [PSH, ACK] Seq=426 Ack=426 Win=64256 Len=17 TSval=1047589273 TSecr=3171848974
1711549085.424000263   289 0.824935432    10.10.1.1 → 10.10.1.2    TCP 83 8081 → 57262 [PSH, ACK] Seq=426 Ack=443 Win=65152 Len=17 TSval=3171848984 TSecr=1047589273
1711549093.424000263   297 0.835153897    10.10.1.2 → 10.10.1.1    TCP 83 57262 → 8081 [PSH, ACK] Seq=443 Ack=443 Win=64256 Len=17 TSval=1047589284 TSecr=3171848984
1711549095.424000263   299 0.835287551    10.10.1.1 → 10.10.1.2    TCP 83 8081 → 57262 [PSH, ACK] Seq=443 Ack=460 Win=65152 Len=17 TSval=3171848995 TSecr=1047589284
1711549103.424000263   307 0.845508161    10.10.1.2 → 10.10.1.1    TCP 83 57262 → 8081 [PSH, ACK] Seq=460 Ack=460 Win=64256 Len=17 TSval=1047589294 TSecr=3171848995
1711549105.424000263   309 0.845641189    10.10.1.1 → 10.10.1.2    TCP 83 8081 → 57262 [PSH, ACK] Seq=460 Ack=477 Win=65152 Len=17 TSval=3171849005 TSecr=1047589294
1711549113.424000263   317 0.855860977    10.10.1.2 → 10.10.1.1    TCP 83 57262 → 8081 [PSH, ACK] Seq=477 Ack=477 Win=64256 Len=17 TSval=1047589304 TSecr=3171849005
1711549115.424000263   319 0.855994025    10.10.1.1 → 10.10.1.2    TCP 83 8081 → 57262 [PSH, ACK] Seq=477 Ack=494 Win=65152 Len=17 TSval=3171849015 TSecr=1047589304
1711549123.424000263   327 0.866212994    10.10.1.2 → 10.10.1.1    TCP 83 57262 → 8081 [PSH, ACK] Seq=494 Ack=494 Win=64256 Len=17 TSval=1047589315 TSecr=3171849015
1711549124.424000263   328 0.866345771    10.10.1.1 → 10.10.1.2    TCP 83 8081 → 57262 [PSH, ACK] Seq=494 Ack=511 Win=65152 Len=17 TSval=3171849026 TSecr=1047589315
1711549132.424000263   336 0.876567605    10.10.1.2 → 10.10.1.1    TCP 83 57262 → 8081 [PSH, ACK] Seq=511 Ack=511 Win=64256 Len=17 TSval=1047589325 TSecr=3171849026
1711549134.424000263   338 0.876698873    10.10.1.1 → 10.10.1.2    TCP 83 8081 → 57262 [PSH, ACK] Seq=511 Ack=528 Win=65152 Len=17 TSval=3171849036 TSecr=1047589325
1711549143.424000263   347 0.886916922    10.10.1.2 → 10.10.1.1    TCP 83 57262 → 8081 [PSH, ACK] Seq=528 Ack=528 Win=64256 Len=17 TSval=1047589335 TSecr=3171849036
1711549144.424000263   348 0.887048520    10.10.1.1 → 10.10.1.2    TCP 83 8081 → 57262 [PSH, ACK] Seq=528 Ack=545 Win=65152 Len=17 TSval=3171849047 TSecr=1047589335
1711549153.424000263   357 0.897268716    10.10.1.2 → 10.10.1.1    TCP 83 57262 → 8081 [PSH, ACK] Seq=545 Ack=545 Win=64256 Len=17 TSval=1047589346 TSecr=3171849047
1711549154.424000263   358 0.897402146    10.10.1.1 → 10.10.1.2    TCP 83 8081 → 57262 [PSH, ACK] Seq=545 Ack=562 Win=65152 Len=17 TSval=3171849057 TSecr=1047589346
1711549162.424000263   366 0.907577867    10.10.1.2 → 10.10.1.1    TCP 83 57262 → 8081 [PSH, ACK] Seq=562 Ack=562 Win=64256 Len=17 TSval=1047589356 TSecr=3171849057
1711549164.424000263   368 0.907713923    10.10.1.1 → 10.10.1.2    TCP 83 8081 → 57262 [PSH, ACK] Seq=562 Ack=579 Win=65152 Len=17 TSval=3171849067 TSecr=1047589356
1711549172.424000263   376 0.917932399    10.10.1.2 → 10.10.1.1    TCP 83 57262 → 8081 [PSH, ACK] Seq=579 Ack=579 Win=64256 Len=17 TSval=1047589366 TSecr=3171849067
1711549174.424000263   378 0.918087265    10.10.1.1 → 10.10.1.2    TCP 83 8081 → 57262 [PSH, ACK] Seq=579 Ack=596 Win=65152 Len=17 TSval=3171849078 TSecr=1047589366
1711549182.424000263   386 0.928307095    10.10.1.2 → 10.10.1.1    TCP 83 57262 → 8081 [PSH, ACK] Seq=596 Ack=596 Win=64256 Len=17 TSval=1047589377 TSecr=3171849078
1711549185.424000263   389 0.928440477    10.10.1.1 → 10.10.1.2    TCP 83 8081 → 57262 [PSH, ACK] Seq=596 Ack=613 Win=65152 Len=17 TSval=3171849088 TSecr=1047589377
1711549193.424000263   397 0.938659387    10.10.1.2 → 10.10.1.1    TCP 83 57262 → 8081 [PSH, ACK] Seq=613 Ack=613 Win=64256 Len=17 TSval=1047589387 TSecr=3171849088
1711549195.424000263   399 0.938793575    10.10.1.1 → 10.10.1.2    TCP 83 8081 → 57262 [PSH, ACK] Seq=613 Ack=630 Win=65152 Len=17 TSval=3171849098 TSecr=1047589387
1711549202.424000263   406 0.949014512    10.10.1.2 → 10.10.1.1    TCP 83 57262 → 8081 [PSH, ACK] Seq=630 Ack=630 Win=64256 Len=17 TSval=1047589397 TSecr=3171849098
1711549205.424000263   409 0.949148754    10.10.1.1 → 10.10.1.2    TCP 83 8081 → 57262 [PSH, ACK] Seq=630 Ack=647 Win=65152 Len=17 TSval=3171849109 TSecr=1047589397
1711549213.424000263   417 0.959365456    10.10.1.2 → 10.10.1.1    TCP 83 57262 → 8081 [PSH, ACK] Seq=647 Ack=647 Win=64256 Len=17 TSval=1047589408 TSecr=3171849109
1711549215.424000263   419 0.959499909    10.10.1.1 → 10.10.1.2    TCP 83 8081 → 57262 [PSH, ACK] Seq=647 Ack=664 Win=65152 Len=17 TSval=3171849119 TSecr=1047589408
1711549223.424000263   427 0.969721087    10.10.1.2 → 10.10.1.1    TCP 83 57262 → 8081 [PSH, ACK] Seq=664 Ack=664 Win=64256 Len=17 TSval=1047589418 TSecr=3171849119
1711549225.424000263   429 0.969855377    10.10.1.1 → 10.10.1.2    TCP 83 8081 → 57262 [PSH, ACK] Seq=664 Ack=681 Win=65152 Len=17 TSval=3171849129 TSecr=1047589418
1711549233.424000263   437 0.980072401    10.10.1.2 → 10.10.1.1    TCP 83 57262 → 8081 [PSH, ACK] Seq=681 Ack=681 Win=64256 Len=17 TSval=1047589429 TSecr=3171849129
1711549235.424000263   439 0.980253187    10.10.1.1 → 10.10.1.2    TCP 83 8081 → 57262 [PSH, ACK] Seq=681 Ack=698 Win=65152 Len=17 TSval=3171849140 TSecr=1047589429
1711549243.424000263   447 0.990472749    10.10.1.2 → 10.10.1.1    TCP 83 57262 → 8081 [PSH, ACK] Seq=698 Ack=698 Win=64256 Len=17 TSval=1047589439 TSecr=3171849140
1711549245.424000263   449 0.990607267    10.10.1.1 → 10.10.1.2    TCP 83 8081 → 57262 [PSH, ACK] Seq=698 Ack=715 Win=65152 Len=17 TSval=3171849150 TSecr=1047589439
1711549253.424000263   457 1.000829541    10.10.1.2 → 10.10.1.1    TCP 83 57262 → 8081 [PSH, ACK] Seq=715 Ack=715 Win=64256 Len=17 TSval=1047589449 TSecr=3171849150
1711549255.424000263   459 1.000963043    10.10.1.1 → 10.10.1.2    TCP 83 8081 → 57262 [PSH, ACK] Seq=715 Ack=732 Win=65152 Len=17 TSval=3171849160 TSecr=1047589449
1711549262.424000263   466 1.011181639    10.10.1.2 → 10.10.1.1    TCP 83 57262 → 8081 [PSH, ACK] Seq=732 Ack=732 Win=64256 Len=17 TSval=1047589460 TSecr=3171849160
1711549265.424000263   469 1.011311705    10.10.1.1 → 10.10.1.2    TCP 83 8081 → 57262 [PSH, ACK] Seq=732 Ack=749 Win=65152 Len=17 TSval=3171849171 TSecr=1047589460
1711549272.424000263   476 1.021531250    10.10.1.2 → 10.10.1.1    TCP 83 57262 → 8081 [PSH, ACK] Seq=749 Ack=749 Win=64256 Len=17 TSval=1047589470 TSecr=3171849171
1711549275.424000263   479 1.021664557    10.10.1.1 → 10.10.1.2    TCP 83 8081 → 57262 [PSH, ACK] Seq=749 Ack=766 Win=65152 Len=17 TSval=3171849181 TSecr=1047589470
1711549283.424000263   487 1.031883246    10.10.1.2 → 10.10.1.1    TCP 83 57262 → 8081 [PSH, ACK] Seq=766 Ack=766 Win=64256 Len=17 TSval=1047589480 TSecr=3171849181
1711549285.424000263   489 1.032017371    10.10.1.1 → 10.10.1.2    TCP 83 8081 → 57262 [PSH, ACK] Seq=766 Ack=783 Win=65152 Len=17 TSval=3171849191 TSecr=1047589480
1711549292.424000263   496 1.042235792    10.10.1.2 → 10.10.1.1    TCP 83 57262 → 8081 [PSH, ACK] Seq=783 Ack=783 Win=64256 Len=17 TSval=1047589491 TSecr=3171849191
1711549295.424000263   499 1.042369665    10.10.1.1 → 10.10.1.2    TCP 83 8081 → 57262 [PSH, ACK] Seq=783 Ack=800 Win=65152 Len=17 TSval=3171849202 TSecr=1047589491
1711549303.424000263   507 1.052588263    10.10.1.2 → 10.10.1.1    TCP 83 57262 → 8081 [PSH, ACK] Seq=800 Ack=800 Win=64256 Len=17 TSval=1047589501 TSecr=3171849202
1711549305.424000263   509 1.052721771    10.10.1.1 → 10.10.1.2    TCP 83 8081 → 57262 [PSH, ACK] Seq=800 Ack=817 Win=65152 Len=17 TSval=3171849212 TSecr=1047589501
1711549312.424000263   516 1.062941321    10.10.1.2 → 10.10.1.1    TCP 83 57262 → 8081 [PSH, ACK] Seq=817 Ack=817 Win=64256 Len=17 TSval=1047589511 TSecr=3171849212
1711549315.424000263   519 1.063073315    10.10.1.1 → 10.10.1.2    TCP 83 8081 → 57262 [PSH, ACK] Seq=817 Ack=834 Win=65152 Len=17 TSval=3171849223 TSecr=1047589511
1711549323.424000263   527 1.073293637    10.10.1.2 → 10.10.1.1    TCP 83 57262 → 8081 [PSH, ACK] Seq=834 Ack=834 Win=64256 Len=17 TSval=1047589522 TSecr=3171849223
1711549325.424000263   529 1.073426982    10.10.1.1 → 10.10.1.2    TCP 83 8081 → 57262 [PSH, ACK] Seq=834 Ack=851 Win=65152 Len=17 TSval=3171849233 TSecr=1047589522
1711549333.424000263   537 1.083645926    10.10.1.2 → 10.10.1.1    TCP 83 57262 → 8081 [PSH, ACK] Seq=851 Ack=851 Win=64256 Len=17 TSval=1047589532 TSecr=3171849233
1711549335.424000263   539 1.083778196    10.10.1.1 → 10.10.1.2    TCP 83 8081 → 57262 [PSH, ACK] Seq=851 Ack=868 Win=65152 Len=17 TSval=3171849243 TSecr=1047589532
1711549343.424000263   547 1.093996442    10.10.1.2 → 10.10.1.1    TCP 83 57262 → 8081 [PSH, ACK] Seq=868 Ack=868 Win=64256 Len=17 TSval=1047589542 TSecr=3171849243
1711549345.424000263   549 1.094131675    10.10.1.1 → 10.10.1.2    TCP 83 8081 → 57262 [PSH, ACK] Seq=868 Ack=885 Win=65152 Len=17 TSval=3171849254 TSecr=1047589542
1711549352.424000263   556 1.104350678    10.10.1.2 → 10.10.1.1    TCP 83 57262 → 8081 [PSH, ACK] Seq=885 Ack=885 Win=64256 Len=17 TSval=1047589553 TSecr=3171849254
1711549355.424000263   559 1.104484811    10.10.1.1 → 10.10.1.2    TCP 83 8081 → 57262 [PSH, ACK] Seq=885 Ack=902 Win=65152 Len=17 TSval=3171849264 TSecr=1047589553
1711549362.424000263   566 1.114703830    10.10.1.2 → 10.10.1.1    TCP 83 57262 → 8081 [PSH, ACK] Seq=902 Ack=902 Win=64256 Len=17 TSval=1047589563 TSecr=3171849264
1711549365.424000263   569 1.114836863    10.10.1.1 → 10.10.1.2    TCP 83 8081 → 57262 [PSH, ACK] Seq=902 Ack=919 Win=65152 Len=17 TSval=3171849274 TSecr=1047589563
1711549372.424000263   576 1.125054007    10.10.1.2 → 10.10.1.1    TCP 83 57262 → 8081 [PSH, ACK] Seq=919 Ack=919 Win=64256 Len=17 TSval=1047589574 TSecr=3171849274
1711549375.424000263   579 1.125187769    10.10.1.1 → 10.10.1.2    TCP 83 8081 → 57262 [PSH, ACK] Seq=919 Ack=936 Win=65152 Len=17 TSval=3171849285 TSecr=1047589574
1711549382.424000263   586 1.135406215    10.10.1.2 → 10.10.1.1    TCP 83 57262 → 8081 [PSH, ACK] Seq=936 Ack=936 Win=64256 Len=17 TSval=1047589584 TSecr=3171849285
1711549385.424000263   589 1.135539376    10.10.1.1 → 10.10.1.2    TCP 83 8081 → 57262 [PSH, ACK] Seq=936 Ack=953 Win=65152 Len=17 TSval=3171849295 TSecr=1047589584
1711549393.424000263   597 1.145759629    10.10.1.2 → 10.10.1.1    TCP 83 57262 → 8081 [PSH, ACK] Seq=953 Ack=953 Win=64256 Len=17 TSval=1047589594 TSecr=3171849295
1711549395.424000263   599 1.145946868    10.10.1.1 → 10.10.1.2    TCP 83 8081 → 57262 [PSH, ACK] Seq=953 Ack=970 Win=65152 Len=17 TSval=3171849305 TSecr=1047589594
1711549403.424000263   607 1.156166396    10.10.1.2 → 10.10.1.1    TCP 83 57262 → 8081 [PSH, ACK] Seq=970 Ack=970 Win=64256 Len=17 TSval=1047589605 TSecr=3171849305
1711549404.424000263   608 1.156300591    10.10.1.1 → 10.10.1.2    TCP 83 8081 → 57262 [PSH, ACK] Seq=970 Ack=987 Win=65152 Len=17 TSval=3171849316 TSecr=1047589605
1711549413.424000263   617 1.166520972    10.10.1.2 → 10.10.1.1    TCP 83 57262 → 8081 [PSH, ACK] Seq=987 Ack=987 Win=64256 Len=17 TSval=1047589615 TSecr=3171849316
1711549415.424000263   619 1.166655068    10.10.1.1 → 10.10.1.2    TCP 83 8081 → 57262 [PSH, ACK] Seq=987 Ack=1004 Win=65152 Len=17 TSval=3171849326 TSecr=1047589615
1711549423.424000263   627 1.176874813    10.10.1.2 → 10.10.1.1    TCP 83 57262 → 8081 [PSH, ACK] Seq=1004 Ack=1004 Win=64256 Len=17 TSval=1047589625 TSecr=3171849326
1711549424.424000263   628 1.177007370    10.10.1.1 → 10.10.1.2    TCP 83 8081 → 57262 [PSH, ACK] Seq=1004 Ack=1021 Win=65152 Len=17 TSval=3171849336 TSecr=1047589625
1711549432.424000263   636 1.187226395    10.10.1.2 → 10.10.1.1    TCP 83 57262 → 8081 [PSH, ACK] Seq=1021 Ack=1021 Win=64256 Len=17 TSval=1047589636 TSecr=3171849336
1711549435.424000263   639 1.187367923    10.10.1.1 → 10.10.1.2    TCP 83 8081 → 57262 [PSH, ACK] Seq=1021 Ack=1038 Win=65152 Len=17 TSval=3171849347 TSecr=1047589636
1711549443.424000263   647 1.197585673    10.10.1.2 → 10.10.1.1    TCP 83 57262 → 8081 [PSH, ACK] Seq=1038 Ack=1038 Win=64256 Len=17 TSval=1047589646 TSecr=3171849347
1711549445.424000263   649 1.197721783    10.10.1.1 → 10.10.1.2    TCP 83 8081 → 57262 [PSH, ACK] Seq=1038 Ack=1055 Win=65152 Len=17 TSval=3171849357 TSecr=1047589646
1711549453.424000263   657 1.207940104    10.10.1.2 → 10.10.1.1    TCP 83 57262 → 8081 [PSH, ACK] Seq=1055 Ack=1055 Win=64256 Len=17 TSval=1047589656 TSecr=3171849357
1711549455.424000263   659 1.208072586    10.10.1.1 → 10.10.1.2    TCP 83 8081 → 57262 [PSH, ACK] Seq=1055 Ack=1072 Win=65152 Len=17 TSval=3171849368 TSecr=1047589656
1711549462.424000263   666 1.218290975    10.10.1.2 → 10.10.1.1    TCP 83 57262 → 8081 [PSH, ACK] Seq=1072 Ack=1072 Win=64256 Len=17 TSval=1047589667 TSecr=3171849368
1711549465.424000263   669 1.218424268    10.10.1.1 → 10.10.1.2    TCP 83 8081 → 57262 [PSH, ACK] Seq=1072 Ack=1089 Win=65152 Len=17 TSval=3171849378 TSecr=1047589667
1711549473.424000263   677 1.228643169    10.10.1.2 → 10.10.1.1    TCP 83 57262 → 8081 [PSH, ACK] Seq=1089 Ack=1089 Win=64256 Len=17 TSval=1047589677 TSecr=3171849378
1711549475.424000263   679 1.228775920    10.10.1.1 → 10.10.1.2    TCP 83 8081 → 57262 [PSH, ACK] Seq=1089 Ack=1106 Win=65152 Len=17 TSval=3171849388 TSecr=1047589677
1711549483.424000263   687 1.238995295    10.10.1.2 → 10.10.1.1    TCP 83 57262 → 8081 [PSH, ACK] Seq=1106 Ack=1106 Win=64256 Len=17 TSval=1047589687 TSecr=3171849388
1711549485.424000263   689 1.239129176    10.10.1.1 → 10.10.1.2    TCP 83 8081 → 57262 [PSH, ACK] Seq=1106 Ack=1123 Win=65152 Len=17 TSval=3171849399 TSecr=1047589687
1711549492.424000263   696 1.249347446    10.10.1.2 → 10.10.1.1    TCP 83 57262 → 8081 [PSH, ACK] Seq=1123 Ack=1123 Win=64256 Len=17 TSval=1047589698 TSecr=3171849399
1711549495.424000263   699 1.249480475    10.10.1.1 → 10.10.1.2    TCP 83 8081 → 57262 [PSH, ACK] Seq=1123 Ack=1140 Win=65152 Len=17 TSval=3171849409 TSecr=1047589698
1711549503.424000263   707 1.259697103    10.10.1.2 → 10.10.1.1    TCP 83 57262 → 8081 [PSH, ACK] Seq=1140 Ack=1140 Win=64256 Len=17 TSval=1047589708 TSecr=3171849409
1711549505.424000263   709 1.259832197    10.10.1.1 → 10.10.1.2    TCP 83 8081 → 57262 [PSH, ACK] Seq=1140 Ack=1157 Win=65152 Len=17 TSval=3171849419 TSecr=1047589708
1711549512.424000263   716 1.270051100    10.10.1.2 → 10.10.1.1    TCP 83 57262 → 8081 [PSH, ACK] Seq=1157 Ack=1157 Win=64256 Len=17 TSval=1047589719 TSecr=3171849419
1711549515.424000263   719 1.270184071    10.10.1.1 → 10.10.1.2    TCP 83 8081 → 57262 [PSH, ACK] Seq=1157 Ack=1174 Win=65152 Len=17 TSval=3171849430 TSecr=1047589719
1711549522.424000263   726 1.280404152    10.10.1.2 → 10.10.1.1    TCP 83 57262 → 8081 [PSH, ACK] Seq=1174 Ack=1174 Win=64256 Len=17 TSval=1047589729 TSecr=3171849430
1711549525.424000263   729 1.280536764    10.10.1.1 → 10.10.1.2    TCP 83 8081 → 57262 [PSH, ACK] Seq=1174 Ack=1191 Win=65152 Len=17 TSval=3171849440 TSecr=1047589729
1711549532.424000263   736 1.290758779    10.10.1.2 → 10.10.1.1    TCP 83 57262 → 8081 [PSH, ACK] Seq=1191 Ack=1191 Win=64256 Len=17 TSval=1047589739 TSecr=3171849440
1711549535.424000263   739 1.290892250    10.10.1.1 → 10.10.1.2    TCP 83 8081 → 57262 [PSH, ACK] Seq=1191 Ack=1208 Win=65152 Len=17 TSval=3171849450 TSecr=1047589739
1711549542.424000263   746 1.301111230    10.10.1.2 → 10.10.1.1    TCP 83 57262 → 8081 [PSH, ACK] Seq=1208 Ack=1208 Win=64256 Len=17 TSval=1047589750 TSecr=3171849450
1711549545.424000263   749 1.301245298    10.10.1.1 → 10.10.1.2    TCP 83 8081 → 57262 [PSH, ACK] Seq=1208 Ack=1225 Win=65152 Len=17 TSval=3171849461 TSecr=1047589750
1711549552.424000263   756 1.311465302    10.10.1.2 → 10.10.1.1    TCP 83 57262 → 8081 [PSH, ACK] Seq=1225 Ack=1225 Win=64256 Len=17 TSval=1047589760 TSecr=3171849461
1711549555.424000263   759 1.311600138    10.10.1.1 → 10.10.1.2    TCP 83 8081 → 57262 [PSH, ACK] Seq=1225 Ack=1242 Win=65152 Len=17 TSval=3171849471 TSecr=1047589760
1711549563.424000263   767 1.321817677    10.10.1.2 → 10.10.1.1    TCP 83 57262 → 8081 [PSH, ACK] Seq=1242 Ack=1242 Win=64256 Len=17 TSval=1047589770 TSecr=3171849471
1711549565.424000263   769 1.321951823    10.10.1.1 → 10.10.1.2    TCP 83 8081 → 57262 [PSH, ACK] Seq=1242 Ack=1259 Win=65152 Len=17 TSval=3171849481 TSecr=1047589770
1711549572.424000263   776 1.332170731    10.10.1.2 → 10.10.1.1    TCP 83 57262 → 8081 [PSH, ACK] Seq=1259 Ack=1259 Win=64256 Len=17 TSval=1047589781 TSecr=3171849481
1711549575.424000263   779 1.332304309    10.10.1.1 → 10.10.1.2    TCP 83 8081 → 57262 [PSH, ACK] Seq=1259 Ack=1276 Win=65152 Len=17 TSval=3171849492 TSecr=1047589781
1711549583.424000263   787 1.342524094    10.10.1.2 → 10.10.1.1    TCP 83 57262 → 8081 [PSH, ACK] Seq=1276 Ack=1276 Win=64256 Len=17 TSval=1047589791 TSecr=3171849492
1711549585.424000263   789 1.342658840    10.10.1.1 → 10.10.1.2    TCP 83 8081 → 57262 [PSH, ACK] Seq=1276 Ack=1293 Win=65152 Len=17 TSval=3171849502 TSecr=1047589791
1711549593.424000263   797 1.352878502    10.10.1.2 → 10.10.1.1    TCP 83 57262 → 8081 [PSH, ACK] Seq=1293 Ack=1293 Win=64256 Len=17 TSval=1047589801 TSecr=3171849502
1711549594.424000263   798 1.353011574    10.10.1.1 → 10.10.1.2    TCP 83 8081 → 57262 [PSH, ACK] Seq=1293 Ack=1310 Win=65152 Len=17 TSval=3171849512 TSecr=1047589801
1711549603.424000263   807 1.363232729    10.10.1.2 → 10.10.1.1    TCP 83 57262 → 8081 [PSH, ACK] Seq=1310 Ack=1310 Win=64256 Len=17 TSval=1047589812 TSecr=3171849512
1711549605.424000263   809 1.363367350    10.10.1.1 → 10.10.1.2    TCP 83 8081 → 57262 [PSH, ACK] Seq=1310 Ack=1327 Win=65152 Len=17 TSval=3171849523 TSecr=1047589812
1711549613.424000263   817 1.373587135    10.10.1.2 → 10.10.1.1    TCP 83 57262 → 8081 [PSH, ACK] Seq=1327 Ack=1327 Win=64256 Len=17 TSval=1047589822 TSecr=3171849523
1711549615.424000263   819 1.373720868    10.10.1.1 → 10.10.1.2    TCP 83 8081 → 57262 [PSH, ACK] Seq=1327 Ack=1344 Win=65152 Len=17 TSval=3171849533 TSecr=1047589822
1711549622.424000263   826 1.383938733    10.10.1.2 → 10.10.1.1    TCP 83 57262 → 8081 [PSH, ACK] Seq=1344 Ack=1344 Win=64256 Len=17 TSval=1047589832 TSecr=3171849533
1711549625.424000263   829 1.384071635    10.10.1.1 → 10.10.1.2    TCP 83 8081 → 57262 [PSH, ACK] Seq=1344 Ack=1361 Win=65152 Len=17 TSval=3171849544 TSecr=1047589832
1711549632.424000263   836 1.394290300    10.10.1.2 → 10.10.1.1    TCP 83 57262 → 8081 [PSH, ACK] Seq=1361 Ack=1361 Win=64256 Len=17 TSval=1047589843 TSecr=3171849544
1711549635.424000263   839 1.394423995    10.10.1.1 → 10.10.1.2    TCP 83 8081 → 57262 [PSH, ACK] Seq=1361 Ack=1378 Win=65152 Len=17 TSval=3171849554 TSecr=1047589843
1711549643.424000263   847 1.404642270    10.10.1.2 → 10.10.1.1    TCP 83 57262 → 8081 [PSH, ACK] Seq=1378 Ack=1378 Win=64256 Len=17 TSval=1047589853 TSecr=3171849554
1711549644.424000263   848 1.404775557    10.10.1.1 → 10.10.1.2    TCP 83 8081 → 57262 [PSH, ACK] Seq=1378 Ack=1395 Win=65152 Len=17 TSval=3171849564 TSecr=1047589853
1711549653.424000263   857 1.414996063    10.10.1.2 → 10.10.1.1    TCP 83 57262 → 8081 [PSH, ACK] Seq=1395 Ack=1395 Win=64256 Len=17 TSval=1047589863 TSecr=3171849564
1711549655.424000263   859 1.415128734    10.10.1.1 → 10.10.1.2    TCP 83 8081 → 57262 [PSH, ACK] Seq=1395 Ack=1412 Win=65152 Len=17 TSval=3171849575 TSecr=1047589863
1711549662.424000263   866 1.425348780    10.10.1.2 → 10.10.1.1    TCP 83 57262 → 8081 [PSH, ACK] Seq=1412 Ack=1412 Win=64256 Len=17 TSval=1047589874 TSecr=3171849575
1711549665.424000263   869 1.425482442    10.10.1.1 → 10.10.1.2    TCP 83 8081 → 57262 [PSH, ACK] Seq=1412 Ack=1429 Win=65152 Len=17 TSval=3171849585 TSecr=1047589874
1711549672.424000263   876 1.435707381    10.10.1.2 → 10.10.1.1    TCP 83 57262 → 8081 [PSH, ACK] Seq=1429 Ack=1429 Win=64256 Len=17 TSval=1047589884 TSecr=3171849585
1711549674.424000263   878 1.435839530    10.10.1.1 → 10.10.1.2    TCP 83 8081 → 57262 [PSH, ACK] Seq=1429 Ack=1446 Win=65152 Len=17 TSval=3171849595 TSecr=1047589884
1711549683.424000263   887 1.446059304    10.10.1.2 → 10.10.1.1    TCP 83 57262 → 8081 [PSH, ACK] Seq=1446 Ack=1446 Win=64256 Len=17 TSval=1047589895 TSecr=3171849595
1711549685.424000263   889 1.446193740    10.10.1.1 → 10.10.1.2    TCP 83 8081 → 57262 [PSH, ACK] Seq=1446 Ack=1463 Win=65152 Len=17 TSval=3171849606 TSecr=1047589895
1711549692.424000263   896 1.456413959    10.10.1.2 → 10.10.1.1    TCP 83 57262 → 8081 [PSH, ACK] Seq=1463 Ack=1463 Win=64256 Len=17 TSval=1047589905 TSecr=3171849606
1711549694.424000263   898 1.456547058    10.10.1.1 → 10.10.1.2    TCP 83 8081 → 57262 [PSH, ACK] Seq=1463 Ack=1480 Win=65152 Len=17 TSval=3171849616 TSecr=1047589905
1711549703.424000263   907 1.466764612    10.10.1.2 → 10.10.1.1    TCP 83 57262 → 8081 [PSH, ACK] Seq=1480 Ack=1480 Win=64256 Len=17 TSval=1047589915 TSecr=3171849616
1711549705.424000263   909 1.466897324    10.10.1.1 → 10.10.1.2    TCP 83 8081 → 57262 [PSH, ACK] Seq=1480 Ack=1497 Win=65152 Len=17 TSval=3171849626 TSecr=1047589915
1711549712.424000263   916 1.477116956    10.10.1.2 → 10.10.1.1    TCP 83 57262 → 8081 [PSH, ACK] Seq=1497 Ack=1497 Win=64256 Len=17 TSval=1047589926 TSecr=3171849626
1711549715.424000263   919 1.477250077    10.10.1.1 → 10.10.1.2    TCP 83 8081 → 57262 [PSH, ACK] Seq=1497 Ack=1514 Win=65152 Len=17 TSval=3171849637 TSecr=1047589926
1711549723.424000263   927 1.487468886    10.10.1.2 → 10.10.1.1    TCP 83 57262 → 8081 [PSH, ACK] Seq=1514 Ack=1514 Win=64256 Len=17 TSval=1047589936 TSecr=3171849637
1711549725.424000263   929 1.487605824    10.10.1.1 → 10.10.1.2    TCP 83 8081 → 57262 [PSH, ACK] Seq=1514 Ack=1531 Win=65152 Len=17 TSval=3171849647 TSecr=1047589936
1711549733.424000263   937 1.497823739    10.10.1.2 → 10.10.1.1    TCP 83 57262 → 8081 [PSH, ACK] Seq=1531 Ack=1531 Win=64256 Len=17 TSval=1047589946 TSecr=3171849647
1711549735.424000263   939 1.497957864    10.10.1.1 → 10.10.1.2    TCP 83 8081 → 57262 [PSH, ACK] Seq=1531 Ack=1548 Win=65152 Len=17 TSval=3171849657 TSecr=1047589946
1711549743.424000263   947 1.508176925    10.10.1.2 → 10.10.1.1    TCP 83 57262 → 8081 [PSH, ACK] Seq=1548 Ack=1548 Win=64256 Len=17 TSval=1047589957 TSecr=3171849657
1711549744.424000263   948 1.508310604    10.10.1.1 → 10.10.1.2    TCP 83 8081 → 57262 [PSH, ACK] Seq=1548 Ack=1565 Win=65152 Len=17 TSval=3171849668 TSecr=1047589957
1711549753.424000263   957 1.518530201    10.10.1.2 → 10.10.1.1    TCP 83 57262 → 8081 [PSH, ACK] Seq=1565 Ack=1565 Win=64256 Len=17 TSval=1047589967 TSecr=3171849668
1711549755.424000263   959 1.518664645    10.10.1.1 → 10.10.1.2    TCP 83 8081 → 57262 [PSH, ACK] Seq=1565 Ack=1582 Win=65152 Len=17 TSval=3171849678 TSecr=1047589967
1711549762.424000263   966 1.528881503    10.10.1.2 → 10.10.1.1    TCP 83 57262 → 8081 [PSH, ACK] Seq=1582 Ack=1582 Win=64256 Len=17 TSval=1047589977 TSecr=3171849678
1711549765.424000263   969 1.529014612    10.10.1.1 → 10.10.1.2    TCP 83 8081 → 57262 [PSH, ACK] Seq=1582 Ack=1599 Win=65152 Len=17 TSval=3171849688 TSecr=1047589977
1711549772.424000263   976 1.539232890    10.10.1.2 → 10.10.1.1    TCP 83 57262 → 8081 [PSH, ACK] Seq=1599 Ack=1599 Win=64256 Len=17 TSval=1047589988 TSecr=3171849688
1711549775.424000263   979 1.539366519    10.10.1.1 → 10.10.1.2    TCP 83 8081 → 57262 [PSH, ACK] Seq=1599 Ack=1616 Win=65152 Len=17 TSval=3171849699 TSecr=1047589988
1711549783.424000263   987 1.549585383    10.10.1.2 → 10.10.1.1    TCP 83 57262 → 8081 [PSH, ACK] Seq=1616 Ack=1616 Win=64256 Len=17 TSval=1047589998 TSecr=3171849699
1711549785.424000263   989 1.549718275    10.10.1.1 → 10.10.1.2    TCP 83 8081 → 57262 [PSH, ACK] Seq=1616 Ack=1633 Win=65152 Len=17 TSval=3171849709 TSecr=1047589998
1711549793.424000263   997 1.559937800    10.10.1.2 → 10.10.1.1    TCP 83 57262 → 8081 [PSH, ACK] Seq=1633 Ack=1633 Win=64256 Len=17 TSval=1047590008 TSecr=3171849709
1711549795.424000263   999 1.560071552    10.10.1.1 → 10.10.1.2    TCP 83 8081 → 57262 [PSH, ACK] Seq=1633 Ack=1650 Win=65152 Len=17 TSval=3171849720 TSecr=1047590008
1711549802.424000263  1006 1.570291397    10.10.1.2 → 10.10.1.1    TCP 83 57262 → 8081 [PSH, ACK] Seq=1650 Ack=1650 Win=64256 Len=17 TSval=1047590019 TSecr=3171849720
1711549805.424000263  1009 1.570425679    10.10.1.1 → 10.10.1.2    TCP 83 8081 → 57262 [PSH, ACK] Seq=1650 Ack=1667 Win=65152 Len=17 TSval=3171849730 TSecr=1047590019
1711549812.424000263  1016 1.580644218    10.10.1.2 → 10.10.1.1    TCP 83 57262 → 8081 [PSH, ACK] Seq=1667 Ack=1667 Win=64256 Len=17 TSval=1047590029 TSecr=3171849730
1711549815.424000263  1019 1.580779519    10.10.1.1 → 10.10.1.2    TCP 83 8081 → 57262 [PSH, ACK] Seq=1667 Ack=1684 Win=65152 Len=17 TSval=3171849740 TSecr=1047590029
1711549823.424000263  1027 1.590998717    10.10.1.2 → 10.10.1.1    TCP 83 57262 → 8081 [PSH, ACK] Seq=1684 Ack=1684 Win=64256 Len=17 TSval=1047590039 TSecr=3171849740
1711549825.424000263  1029 1.591132117    10.10.1.1 → 10.10.1.2    TCP 83 8081 → 57262 [PSH, ACK] Seq=1684 Ack=1701 Win=65152 Len=17 TSval=3171849751 TSecr=1047590039
1711549833.424000263  1037 1.601351417    10.10.1.2 → 10.10.1.1    TCP 83 57262 → 8081 [PSH, ACK] Seq=1701 Ack=1701 Win=64256 Len=17 TSval=1047590050 TSecr=3171849751
1711549835.424000263  1039 1.601485459    10.10.1.1 → 10.10.1.2    TCP 83 8081 → 57262 [PSH, ACK] Seq=1701 Ack=1718 Win=65152 Len=17 TSval=3171849761 TSecr=1047590050
1711549843.424000263  1047 1.611706071    10.10.1.2 → 10.10.1.1    TCP 83 57262 → 8081 [PSH, ACK] Seq=1718 Ack=1718 Win=64256 Len=17 TSval=1047590060 TSecr=3171849761
1711549845.424000263  1049 1.611839217    10.10.1.1 → 10.10.1.2    TCP 83 8081 → 57262 [PSH, ACK] Seq=1718 Ack=1735 Win=65152 Len=17 TSval=3171849771 TSecr=1047590060
1711549853.424000263  1057 1.622057152    10.10.1.2 → 10.10.1.1    TCP 83 57262 → 8081 [PSH, ACK] Seq=1735 Ack=1735 Win=64256 Len=17 TSval=1047590071 TSecr=3171849771
1711549855.424000263  1059 1.622190674    10.10.1.1 → 10.10.1.2    TCP 83 8081 → 57262 [PSH, ACK] Seq=1735 Ack=1752 Win=65152 Len=17 TSval=3171849782 TSecr=1047590071
1711549863.424000263  1067 1.632409303    10.10.1.2 → 10.10.1.1    TCP 83 57262 → 8081 [PSH, ACK] Seq=1752 Ack=1752 Win=64256 Len=17 TSval=1047590081 TSecr=3171849782
1711549865.424000263  1069 1.632543481    10.10.1.1 → 10.10.1.2    TCP 83 8081 → 57262 [PSH, ACK] Seq=1752 Ack=1769 Win=65152 Len=17 TSval=3171849792 TSecr=1047590081
1711549872.424000263  1076 1.642762106    10.10.1.2 → 10.10.1.1    TCP 83 57262 → 8081 [PSH, ACK] Seq=1769 Ack=1769 Win=64256 Len=17 TSval=1047590091 TSecr=3171849792
1711549875.424000263  1079 1.642895497    10.10.1.1 → 10.10.1.2    TCP 83 8081 → 57262 [PSH, ACK] Seq=1769 Ack=1786 Win=65152 Len=17 TSval=3171849802 TSecr=1047590091
1711549882.424000263  1086 1.653116111    10.10.1.2 → 10.10.1.1    TCP 83 57262 → 8081 [PSH, ACK] Seq=1786 Ack=1786 Win=64256 Len=17 TSval=1047590102 TSecr=3171849802
1711549885.424000263  1089 1.653249748    10.10.1.1 → 10.10.1.2    TCP 83 8081 → 57262 [PSH, ACK] Seq=1786 Ack=1803 Win=65152 Len=17 TSval=3171849813 TSecr=1047590102
1711549893.424000263  1097 1.663468729    10.10.1.2 → 10.10.1.1    TCP 83 57262 → 8081 [PSH, ACK] Seq=1803 Ack=1803 Win=64256 Len=17 TSval=1047590112 TSecr=3171849813
1711549895.424000263  1099 1.663603214    10.10.1.1 → 10.10.1.2    TCP 83 8081 → 57262 [PSH, ACK] Seq=1803 Ack=1820 Win=65152 Len=17 TSval=3171849823 TSecr=1047590112
1711549902.424000263  1106 1.673822236    10.10.1.2 → 10.10.1.1    TCP 83 57262 → 8081 [PSH, ACK] Seq=1820 Ack=1820 Win=64256 Len=17 TSval=1047590122 TSecr=3171849823
1711549905.424000263  1109 1.673954952    10.10.1.1 → 10.10.1.2    TCP 83 8081 → 57262 [PSH, ACK] Seq=1820 Ack=1837 Win=65152 Len=17 TSval=3171849833 TSecr=1047590122
1711549913.424000263  1117 1.684174311    10.10.1.2 → 10.10.1.1    TCP 83 57262 → 8081 [PSH, ACK] Seq=1837 Ack=1837 Win=64256 Len=17 TSval=1047590133 TSecr=3171849833
1711549915.424000263  1119 1.684307544    10.10.1.1 → 10.10.1.2    TCP 83 8081 → 57262 [PSH, ACK] Seq=1837 Ack=1854 Win=65152 Len=17 TSval=3171849844 TSecr=1047590133
1711549922.424000263  1126 1.694526133    10.10.1.2 → 10.10.1.1    TCP 83 57262 → 8081 [PSH, ACK] Seq=1854 Ack=1854 Win=64256 Len=17 TSval=1047590143 TSecr=3171849844
1711549925.424000263  1129 1.694659242    10.10.1.1 → 10.10.1.2    TCP 83 8081 → 57262 [PSH, ACK] Seq=1854 Ack=1871 Win=65152 Len=17 TSval=3171849854 TSecr=1047590143
1711549933.424000263  1137 1.704877444    10.10.1.2 → 10.10.1.1    TCP 83 57262 → 8081 [PSH, ACK] Seq=1871 Ack=1871 Win=64256 Len=17 TSval=1047590153 TSecr=3171849854
1711549934.424000263  1138 1.705010813    10.10.1.1 → 10.10.1.2    TCP 83 8081 → 57262 [PSH, ACK] Seq=1871 Ack=1888 Win=65152 Len=17 TSval=3171849864 TSecr=1047590153
1711549942.424000263  1146 1.715229770    10.10.1.2 → 10.10.1.1    TCP 83 57262 → 8081 [PSH, ACK] Seq=1888 Ack=1888 Win=64256 Len=17 TSval=1047590164 TSecr=3171849864
1711549945.424000263  1149 1.715362255    10.10.1.1 → 10.10.1.2    TCP 83 8081 → 57262 [PSH, ACK] Seq=1888 Ack=1905 Win=65152 Len=17 TSval=3171849875 TSecr=1047590164
1711549952.424000263  1156 1.725581139    10.10.1.2 → 10.10.1.1    TCP 83 57262 → 8081 [PSH, ACK] Seq=1905 Ack=1905 Win=64256 Len=17 TSval=1047590174 TSecr=3171849875
1711549955.424000263  1159 1.725714248    10.10.1.1 → 10.10.1.2    TCP 83 8081 → 57262 [PSH, ACK] Seq=1905 Ack=1922 Win=65152 Len=17 TSval=3171849885 TSecr=1047590174
1711549962.424000263  1166 1.735932926    10.10.1.2 → 10.10.1.1    TCP 83 57262 → 8081 [PSH, ACK] Seq=1922 Ack=1922 Win=64256 Len=17 TSval=1047590184 TSecr=3171849885
1711549965.424000263  1169 1.736119556    10.10.1.1 → 10.10.1.2    TCP 83 8081 → 57262 [PSH, ACK] Seq=1922 Ack=1939 Win=65152 Len=17 TSval=3171849896 TSecr=1047590184
1711549972.424000263  1176 1.746339525    10.10.1.2 → 10.10.1.1    TCP 83 57262 → 8081 [PSH, ACK] Seq=1939 Ack=1939 Win=64256 Len=17 TSval=1047590195 TSecr=3171849896
1711549975.424000263  1179 1.746471058    10.10.1.1 → 10.10.1.2    TCP 83 8081 → 57262 [PSH, ACK] Seq=1939 Ack=1956 Win=65152 Len=17 TSval=3171849906 TSecr=1047590195
1711549982.424000263  1186 1.756690588    10.10.1.2 → 10.10.1.1    TCP 83 57262 → 8081 [PSH, ACK] Seq=1956 Ack=1956 Win=64256 Len=17 TSval=1047590205 TSecr=3171849906
1711549984.424000263  1188 1.756824448    10.10.1.1 → 10.10.1.2    TCP 83 8081 → 57262 [PSH, ACK] Seq=1956 Ack=1973 Win=65152 Len=17 TSval=3171849916 TSecr=1047590205
1711549993.424000263  1197 1.767047781    10.10.1.2 → 10.10.1.1    TCP 83 57262 → 8081 [PSH, ACK] Seq=1973 Ack=1973 Win=64256 Len=17 TSval=1047590216 TSecr=3171849916
1711549995.424000263  1199 1.767181508    10.10.1.1 → 10.10.1.2    TCP 83 8081 → 57262 [PSH, ACK] Seq=1973 Ack=1990 Win=65152 Len=17 TSval=3171849927 TSecr=1047590216
1711550003.424000263  1207 1.777405982    10.10.1.2 → 10.10.1.1    TCP 83 57262 → 8081 [PSH, ACK] Seq=1990 Ack=1990 Win=64256 Len=17 TSval=1047590226 TSecr=3171849927
1711550005.424000263  1209 1.777540271    10.10.1.1 → 10.10.1.2    TCP 83 8081 → 57262 [PSH, ACK] Seq=1990 Ack=2007 Win=65152 Len=17 TSval=3171849937 TSecr=1047590226
