1712098973.383427382    23 0.256941350    10.10.1.2 → 10.10.1.1    TCP 74 50378 → 8081 [SYN] Seq=0 Win=64240 Len=0 MSS=1460 SACK_PERM=1 TSval=1597742670 TSecr=0 WS=128
1712098974.383427382    24 0.256976733    10.10.1.1 → 10.10.1.2    TCP 74 8081 → 50378 [SYN, ACK] Seq=0 Ack=1 Win=65160 Len=0 MSS=1460 SACK_PERM=1 TSval=3722002378 TSecr=1597742670 WS=128
1712098975.383427382    25 0.257050987    10.10.1.2 → 10.10.1.1    TCP 66 50378 → 8081 [ACK] Seq=1 Ack=1 Win=64256 Len=0 TSval=1597742670 TSecr=3722002378
1712098984.383427382    34 0.516582731    10.10.1.2 → 10.10.1.1    TCP 83 50378 → 8081 [PSH, ACK] Seq=1 Ack=1 Win=64256 Len=17 TSval=1597742930 TSecr=3722002378
1712098986.383427382    36 0.516610219    10.10.1.1 → 10.10.1.2    TCP 66 8081 → 50378 [ACK] Seq=1 Ack=18 Win=65152 Len=0 TSval=3722002638 TSecr=1597742930
1712098987.383427382    37 0.516898295    10.10.1.1 → 10.10.1.2    TCP 83 8081 → 50378 [PSH, ACK] Seq=1 Ack=18 Win=65152 Len=17 TSval=3722002638 TSecr=1597742930
1712098989.383427382    39 0.517006462    10.10.1.2 → 10.10.1.1    TCP 66 50378 → 8081 [ACK] Seq=18 Ack=18 Win=64256 Len=0 TSval=1597742930 TSecr=3722002638
1712098994.383427382    44 0.527120971    10.10.1.2 → 10.10.1.1    TCP 83 50378 → 8081 [PSH, ACK] Seq=18 Ack=18 Win=64256 Len=17 TSval=1597742940 TSecr=3722002638
1712098996.383427382    46 0.527244532    10.10.1.1 → 10.10.1.2    TCP 83 8081 → 50378 [PSH, ACK] Seq=18 Ack=35 Win=65152 Len=17 TSval=3722002649 TSecr=1597742940
1712099003.383427382    53 0.537465374    10.10.1.2 → 10.10.1.1    TCP 83 50378 → 8081 [PSH, ACK] Seq=35 Ack=35 Win=64256 Len=17 TSval=1597742951 TSecr=3722002649
1712099005.383427382    55 0.537604379    10.10.1.1 → 10.10.1.2    TCP 83 8081 → 50378 [PSH, ACK] Seq=35 Ack=52 Win=65152 Len=17 TSval=3722002659 TSecr=1597742951
1712099011.383427382    61 0.547823601    10.10.1.2 → 10.10.1.1    TCP 83 50378 → 8081 [PSH, ACK] Seq=52 Ack=52 Win=64256 Len=17 TSval=1597742961 TSecr=3722002659
1712099013.383427382    63 0.547959666    10.10.1.1 → 10.10.1.2    TCP 83 8081 → 50378 [PSH, ACK] Seq=52 Ack=69 Win=65152 Len=17 TSval=3722002669 TSecr=1597742961
1712099020.383427382    70 0.558180576    10.10.1.2 → 10.10.1.1    TCP 83 50378 → 8081 [PSH, ACK] Seq=69 Ack=69 Win=64256 Len=17 TSval=1597742971 TSecr=3722002669
1712099022.383427382    72 0.558317427    10.10.1.1 → 10.10.1.2    TCP 83 8081 → 50378 [PSH, ACK] Seq=69 Ack=86 Win=65152 Len=17 TSval=3722002680 TSecr=1597742971
1712099028.383427382    78 0.568537560    10.10.1.2 → 10.10.1.1    TCP 83 50378 → 8081 [PSH, ACK] Seq=86 Ack=86 Win=64256 Len=17 TSval=1597742982 TSecr=3722002680
1712099030.383427382    80 0.568672935    10.10.1.1 → 10.10.1.2    TCP 83 8081 → 50378 [PSH, ACK] Seq=86 Ack=103 Win=65152 Len=17 TSval=3722002690 TSecr=1597742982
1712099037.383427382    87 0.578891189    10.10.1.2 → 10.10.1.1    TCP 83 50378 → 8081 [PSH, ACK] Seq=103 Ack=103 Win=64256 Len=17 TSval=1597742992 TSecr=3722002690
1712099039.383427382    89 0.579031622    10.10.1.1 → 10.10.1.2    TCP 83 8081 → 50378 [PSH, ACK] Seq=103 Ack=120 Win=65152 Len=17 TSval=3722002700 TSecr=1597742992
1712099045.383427382    95 0.589251530    10.10.1.2 → 10.10.1.1    TCP 83 50378 → 8081 [PSH, ACK] Seq=120 Ack=120 Win=64256 Len=17 TSval=1597743002 TSecr=3722002700
1712099047.383427382    97 0.589386320    10.10.1.1 → 10.10.1.2    TCP 83 8081 → 50378 [PSH, ACK] Seq=120 Ack=137 Win=65152 Len=17 TSval=3722002711 TSecr=1597743002
1712099054.383427382   104 0.599605839    10.10.1.2 → 10.10.1.1    TCP 83 50378 → 8081 [PSH, ACK] Seq=137 Ack=137 Win=64256 Len=17 TSval=1597743013 TSecr=3722002711
1712099056.383427382   106 0.599735422    10.10.1.1 → 10.10.1.2    TCP 83 8081 → 50378 [PSH, ACK] Seq=137 Ack=154 Win=65152 Len=17 TSval=3722002721 TSecr=1597743013
1712099062.383427382   112 0.609955516    10.10.1.2 → 10.10.1.1    TCP 83 50378 → 8081 [PSH, ACK] Seq=154 Ack=154 Win=64256 Len=17 TSval=1597743023 TSecr=3722002721
1712099064.383427382   114 0.610092777    10.10.1.1 → 10.10.1.2    TCP 83 8081 → 50378 [PSH, ACK] Seq=154 Ack=171 Win=65152 Len=17 TSval=3722002732 TSecr=1597743023
1712099071.383427382   121 0.620313663    10.10.1.2 → 10.10.1.1    TCP 83 50378 → 8081 [PSH, ACK] Seq=171 Ack=171 Win=64256 Len=17 TSval=1597743033 TSecr=3722002732
1712099073.383427382   123 0.620443960    10.10.1.1 → 10.10.1.2    TCP 83 8081 → 50378 [PSH, ACK] Seq=171 Ack=188 Win=65152 Len=17 TSval=3722002742 TSecr=1597743033
1712099079.383427382   129 0.630663391    10.10.1.2 → 10.10.1.1    TCP 83 50378 → 8081 [PSH, ACK] Seq=188 Ack=188 Win=64256 Len=17 TSval=1597743044 TSecr=3722002742
1712099081.383427382   131 0.630799789    10.10.1.1 → 10.10.1.2    TCP 83 8081 → 50378 [PSH, ACK] Seq=188 Ack=205 Win=65152 Len=17 TSval=3722002752 TSecr=1597743044
1712099088.383427382   138 0.641019632    10.10.1.2 → 10.10.1.1    TCP 83 50378 → 8081 [PSH, ACK] Seq=205 Ack=205 Win=64256 Len=17 TSval=1597743054 TSecr=3722002752
1712099090.383427382   140 0.641156916    10.10.1.1 → 10.10.1.2    TCP 83 8081 → 50378 [PSH, ACK] Seq=205 Ack=222 Win=65152 Len=17 TSval=3722002763 TSecr=1597743054
1712099096.383427382   146 0.651374067    10.10.1.2 → 10.10.1.1    TCP 83 50378 → 8081 [PSH, ACK] Seq=222 Ack=222 Win=64256 Len=17 TSval=1597743064 TSecr=3722002763
1712099098.383427382   148 0.651510489    10.10.1.1 → 10.10.1.2    TCP 83 8081 → 50378 [PSH, ACK] Seq=222 Ack=239 Win=65152 Len=17 TSval=3722002773 TSecr=1597743064
1712099105.383427382   155 0.661727458    10.10.1.2 → 10.10.1.1    TCP 83 50378 → 8081 [PSH, ACK] Seq=239 Ack=239 Win=64256 Len=17 TSval=1597743075 TSecr=3722002773
1712099107.383427382   157 0.661856720    10.10.1.1 → 10.10.1.2    TCP 83 8081 → 50378 [PSH, ACK] Seq=239 Ack=256 Win=65152 Len=17 TSval=3722002783 TSecr=1597743075
1712099113.383427382   163 0.672075701    10.10.1.2 → 10.10.1.1    TCP 83 50378 → 8081 [PSH, ACK] Seq=256 Ack=256 Win=64256 Len=17 TSval=1597743085 TSecr=3722002783
1712099115.383427382   165 0.672206559    10.10.1.1 → 10.10.1.2    TCP 83 8081 → 50378 [PSH, ACK] Seq=256 Ack=273 Win=65152 Len=17 TSval=3722002794 TSecr=1597743085
1712099122.383427382   172 0.682425487    10.10.1.2 → 10.10.1.1    TCP 83 50378 → 8081 [PSH, ACK] Seq=273 Ack=273 Win=64256 Len=17 TSval=1597743095 TSecr=3722002794
1712099124.383427382   174 0.682554953    10.10.1.1 → 10.10.1.2    TCP 83 8081 → 50378 [PSH, ACK] Seq=273 Ack=290 Win=65152 Len=17 TSval=3722002804 TSecr=1597743095
1712099130.383427382   180 0.692770834    10.10.1.2 → 10.10.1.1    TCP 83 50378 → 8081 [PSH, ACK] Seq=290 Ack=290 Win=64256 Len=17 TSval=1597743106 TSecr=3722002804
1712099132.383427382   182 0.692907419    10.10.1.1 → 10.10.1.2    TCP 83 8081 → 50378 [PSH, ACK] Seq=290 Ack=307 Win=65152 Len=17 TSval=3722002814 TSecr=1597743106
1712099139.383427382   189 0.703127536    10.10.1.2 → 10.10.1.1    TCP 83 50378 → 8081 [PSH, ACK] Seq=307 Ack=307 Win=64256 Len=17 TSval=1597743116 TSecr=3722002814
1712099141.383427382   191 0.703263758    10.10.1.1 → 10.10.1.2    TCP 83 8081 → 50378 [PSH, ACK] Seq=307 Ack=324 Win=65152 Len=17 TSval=3722002825 TSecr=1597743116
1712099147.383427382   197 0.713482262    10.10.1.2 → 10.10.1.1    TCP 83 50378 → 8081 [PSH, ACK] Seq=324 Ack=324 Win=64256 Len=17 TSval=1597743127 TSecr=3722002825
1712099149.383427382   199 0.713616831    10.10.1.1 → 10.10.1.2    TCP 83 8081 → 50378 [PSH, ACK] Seq=324 Ack=341 Win=65152 Len=17 TSval=3722002835 TSecr=1597743127
1712099156.383427382   206 0.723834010    10.10.1.2 → 10.10.1.1    TCP 83 50378 → 8081 [PSH, ACK] Seq=341 Ack=341 Win=64256 Len=17 TSval=1597743137 TSecr=3722002835
1712099158.383427382   208 0.723964137    10.10.1.1 → 10.10.1.2    TCP 83 8081 → 50378 [PSH, ACK] Seq=341 Ack=358 Win=65152 Len=17 TSval=3722002845 TSecr=1597743137
1712099164.383427382   214 0.734180675    10.10.1.2 → 10.10.1.1    TCP 83 50378 → 8081 [PSH, ACK] Seq=358 Ack=358 Win=64256 Len=17 TSval=1597743147 TSecr=3722002845
1712099166.383427382   216 0.734319195    10.10.1.1 → 10.10.1.2    TCP 83 8081 → 50378 [PSH, ACK] Seq=358 Ack=375 Win=65152 Len=17 TSval=3722002856 TSecr=1597743147
1712099173.383427382   223 0.744537235    10.10.1.2 → 10.10.1.1    TCP 83 50378 → 8081 [PSH, ACK] Seq=375 Ack=375 Win=64256 Len=17 TSval=1597743158 TSecr=3722002856
1712099175.383427382   225 0.744668122    10.10.1.1 → 10.10.1.2    TCP 83 8081 → 50378 [PSH, ACK] Seq=375 Ack=392 Win=65152 Len=17 TSval=3722002866 TSecr=1597743158
1712099181.383427382   231 0.754884305    10.10.1.2 → 10.10.1.1    TCP 83 50378 → 8081 [PSH, ACK] Seq=392 Ack=392 Win=64256 Len=17 TSval=1597743168 TSecr=3722002866
1712099183.383427382   233 0.755013278    10.10.1.1 → 10.10.1.2    TCP 83 8081 → 50378 [PSH, ACK] Seq=392 Ack=409 Win=65152 Len=17 TSval=3722002876 TSecr=1597743168
1712099190.383427382   240 0.765230782    10.10.1.2 → 10.10.1.1    TCP 83 50378 → 8081 [PSH, ACK] Seq=409 Ack=409 Win=64256 Len=17 TSval=1597743178 TSecr=3722002876
1712099192.383427382   242 0.765360291    10.10.1.1 → 10.10.1.2    TCP 83 8081 → 50378 [PSH, ACK] Seq=409 Ack=426 Win=65152 Len=17 TSval=3722002887 TSecr=1597743178
1712099198.383427382   248 0.775575072    10.10.1.2 → 10.10.1.1    TCP 83 50378 → 8081 [PSH, ACK] Seq=426 Ack=426 Win=64256 Len=17 TSval=1597743189 TSecr=3722002887
1712099200.383427382   250 0.775706994    10.10.1.1 → 10.10.1.2    TCP 83 8081 → 50378 [PSH, ACK] Seq=426 Ack=443 Win=65152 Len=17 TSval=3722002897 TSecr=1597743189
1712099207.383427382   257 0.785924141    10.10.1.2 → 10.10.1.1    TCP 83 50378 → 8081 [PSH, ACK] Seq=443 Ack=443 Win=64256 Len=17 TSval=1597743199 TSecr=3722002897
1712099209.383427382   259 0.796130002    10.10.1.1 → 10.10.1.2    TCP 83 8081 → 50378 [PSH, ACK] Seq=443 Ack=460 Win=65152 Len=17 TSval=3722002918 TSecr=1597743199
1712099215.383427382   265 0.806347435    10.10.1.2 → 10.10.1.1    TCP 83 50378 → 8081 [PSH, ACK] Seq=460 Ack=460 Win=64256 Len=17 TSval=1597743219 TSecr=3722002918
1712099217.383427382   267 0.806449703    10.10.1.1 → 10.10.1.2    TCP 83 8081 → 50378 [PSH, ACK] Seq=460 Ack=477 Win=65152 Len=17 TSval=3722002928 TSecr=1597743219
1712099224.383427382   274 0.816665726    10.10.1.2 → 10.10.1.1    TCP 83 50378 → 8081 [PSH, ACK] Seq=477 Ack=477 Win=64256 Len=17 TSval=1597743230 TSecr=3722002928
1712099226.383427382   276 0.816738443    10.10.1.1 → 10.10.1.2    TCP 83 8081 → 50378 [PSH, ACK] Seq=477 Ack=494 Win=65152 Len=17 TSval=3722002938 TSecr=1597743230
1712099232.383427382   282 0.826953589    10.10.1.2 → 10.10.1.1    TCP 83 50378 → 8081 [PSH, ACK] Seq=494 Ack=494 Win=64256 Len=17 TSval=1597743240 TSecr=3722002938
1712099234.383427382   284 0.827089025    10.10.1.1 → 10.10.1.2    TCP 83 8081 → 50378 [PSH, ACK] Seq=494 Ack=511 Win=65152 Len=17 TSval=3722002949 TSecr=1597743240
1712099241.383427382   291 0.837307165    10.10.1.2 → 10.10.1.1    TCP 83 50378 → 8081 [PSH, ACK] Seq=511 Ack=511 Win=64256 Len=17 TSval=1597743250 TSecr=3722002949
1712099243.383427382   293 0.837441765    10.10.1.1 → 10.10.1.2    TCP 83 8081 → 50378 [PSH, ACK] Seq=511 Ack=528 Win=65152 Len=17 TSval=3722002959 TSecr=1597743250
1712099249.383427382   299 0.847659824    10.10.1.2 → 10.10.1.1    TCP 83 50378 → 8081 [PSH, ACK] Seq=528 Ack=528 Win=64256 Len=17 TSval=1597743261 TSecr=3722002959
1712099251.383427382   301 0.847791851    10.10.1.1 → 10.10.1.2    TCP 83 8081 → 50378 [PSH, ACK] Seq=528 Ack=545 Win=65152 Len=17 TSval=3722002969 TSecr=1597743261
1712099258.383427382   308 0.858007848    10.10.1.2 → 10.10.1.1    TCP 83 50378 → 8081 [PSH, ACK] Seq=545 Ack=545 Win=64256 Len=17 TSval=1597743271 TSecr=3722002969
1712099260.383427382   310 0.858143100    10.10.1.1 → 10.10.1.2    TCP 83 8081 → 50378 [PSH, ACK] Seq=545 Ack=562 Win=65152 Len=17 TSval=3722002980 TSecr=1597743271
1712099266.383427382   316 0.868359352    10.10.1.2 → 10.10.1.1    TCP 83 50378 → 8081 [PSH, ACK] Seq=562 Ack=562 Win=64256 Len=17 TSval=1597743281 TSecr=3722002980
1712099268.383427382   318 0.868442153    10.10.1.1 → 10.10.1.2    TCP 83 8081 → 50378 [PSH, ACK] Seq=562 Ack=579 Win=65152 Len=17 TSval=3722002990 TSecr=1597743281
1712099274.383427382   324 0.878658377    10.10.1.2 → 10.10.1.1    TCP 83 50378 → 8081 [PSH, ACK] Seq=579 Ack=579 Win=64256 Len=17 TSval=1597743292 TSecr=3722002990
1712099276.383427382   326 0.878794659    10.10.1.1 → 10.10.1.2    TCP 83 8081 → 50378 [PSH, ACK] Seq=579 Ack=596 Win=65152 Len=17 TSval=3722003000 TSecr=1597743292
1712099283.383427382   333 0.889012216    10.10.1.2 → 10.10.1.1    TCP 83 50378 → 8081 [PSH, ACK] Seq=596 Ack=596 Win=64256 Len=17 TSval=1597743302 TSecr=3722003000
1712099285.383427382   335 0.889141703    10.10.1.1 → 10.10.1.2    TCP 83 8081 → 50378 [PSH, ACK] Seq=596 Ack=613 Win=65152 Len=17 TSval=3722003011 TSecr=1597743302
1712099291.383427382   341 0.899357726    10.10.1.2 → 10.10.1.1    TCP 83 50378 → 8081 [PSH, ACK] Seq=613 Ack=613 Win=64256 Len=17 TSval=1597743312 TSecr=3722003011
1712099293.383427382   343 0.899496349    10.10.1.1 → 10.10.1.2    TCP 83 8081 → 50378 [PSH, ACK] Seq=613 Ack=630 Win=65152 Len=17 TSval=3722003021 TSecr=1597743312
1712099301.383427382   351 0.909715787    10.10.1.2 → 10.10.1.1    TCP 83 50378 → 8081 [PSH, ACK] Seq=630 Ack=630 Win=64256 Len=17 TSval=1597743323 TSecr=3722003021
1712099303.383427382   353 0.909854522    10.10.1.1 → 10.10.1.2    TCP 83 8081 → 50378 [PSH, ACK] Seq=630 Ack=647 Win=65152 Len=17 TSval=3722003031 TSecr=1597743323
1712099309.383427382   359 0.920072326    10.10.1.2 → 10.10.1.1    TCP 83 50378 → 8081 [PSH, ACK] Seq=647 Ack=647 Win=64256 Len=17 TSval=1597743333 TSecr=3722003031
1712099311.383427382   361 0.920209249    10.10.1.1 → 10.10.1.2    TCP 83 8081 → 50378 [PSH, ACK] Seq=647 Ack=664 Win=65152 Len=17 TSval=3722003042 TSecr=1597743333
1712099318.383427382   368 0.930428400    10.10.1.2 → 10.10.1.1    TCP 83 50378 → 8081 [PSH, ACK] Seq=664 Ack=664 Win=64256 Len=17 TSval=1597743343 TSecr=3722003042
1712099320.383427382   370 0.930569749    10.10.1.1 → 10.10.1.2    TCP 83 8081 → 50378 [PSH, ACK] Seq=664 Ack=681 Win=65152 Len=17 TSval=3722003052 TSecr=1597743343
1712099326.383427382   376 0.940788526    10.10.1.2 → 10.10.1.1    TCP 83 50378 → 8081 [PSH, ACK] Seq=681 Ack=681 Win=64256 Len=17 TSval=1597743354 TSecr=3722003052
1712099328.383427382   378 0.940925758    10.10.1.1 → 10.10.1.2    TCP 83 8081 → 50378 [PSH, ACK] Seq=681 Ack=698 Win=65152 Len=17 TSval=3722003062 TSecr=1597743354
1712099335.383427382   385 0.951143662    10.10.1.2 → 10.10.1.1    TCP 83 50378 → 8081 [PSH, ACK] Seq=698 Ack=698 Win=64256 Len=17 TSval=1597743364 TSecr=3722003062
1712099337.383427382   387 0.951273018    10.10.1.1 → 10.10.1.2    TCP 83 8081 → 50378 [PSH, ACK] Seq=698 Ack=715 Win=65152 Len=17 TSval=3722003073 TSecr=1597743364
1712099343.383427382   393 0.961488006    10.10.1.2 → 10.10.1.1    TCP 83 50378 → 8081 [PSH, ACK] Seq=715 Ack=715 Win=64256 Len=17 TSval=1597743375 TSecr=3722003073
1712099345.383427382   395 0.961625897    10.10.1.1 → 10.10.1.2    TCP 83 8081 → 50378 [PSH, ACK] Seq=715 Ack=732 Win=65152 Len=17 TSval=3722003083 TSecr=1597743375
1712099352.383427382   402 0.971843446    10.10.1.2 → 10.10.1.1    TCP 83 50378 → 8081 [PSH, ACK] Seq=732 Ack=732 Win=64256 Len=17 TSval=1597743385 TSecr=3722003083
1712099354.383427382   404 0.971983382    10.10.1.1 → 10.10.1.2    TCP 83 8081 → 50378 [PSH, ACK] Seq=732 Ack=749 Win=65152 Len=17 TSval=3722003093 TSecr=1597743385
1712099360.383427382   410 0.982201179    10.10.1.2 → 10.10.1.1    TCP 83 50378 → 8081 [PSH, ACK] Seq=749 Ack=749 Win=64256 Len=17 TSval=1597743395 TSecr=3722003093
1712099362.383427382   412 0.982284620    10.10.1.1 → 10.10.1.2    TCP 83 8081 → 50378 [PSH, ACK] Seq=749 Ack=766 Win=65152 Len=17 TSval=3722003104 TSecr=1597743395
1712099369.383427382   419 0.992461215    10.10.1.2 → 10.10.1.1    TCP 83 50378 → 8081 [PSH, ACK] Seq=766 Ack=766 Win=64256 Len=17 TSval=1597743406 TSecr=3722003104
1712099371.383427382   421 0.992598675    10.10.1.1 → 10.10.1.2    TCP 83 8081 → 50378 [PSH, ACK] Seq=766 Ack=783 Win=65152 Len=17 TSval=3722003114 TSecr=1597743406
1712099377.383427382   427 1.002816154    10.10.1.2 → 10.10.1.1    TCP 83 50378 → 8081 [PSH, ACK] Seq=783 Ack=783 Win=64256 Len=17 TSval=1597743416 TSecr=3722003114
1712099379.383427382   429 1.002951750    10.10.1.1 → 10.10.1.2    TCP 83 8081 → 50378 [PSH, ACK] Seq=783 Ack=800 Win=65152 Len=17 TSval=3722003124 TSecr=1597743416
1712099386.383427382   436 1.013170384    10.10.1.2 → 10.10.1.1    TCP 83 50378 → 8081 [PSH, ACK] Seq=800 Ack=800 Win=64256 Len=17 TSval=1597743426 TSecr=3722003124
1712099388.383427382   438 1.013307846    10.10.1.1 → 10.10.1.2    TCP 83 8081 → 50378 [PSH, ACK] Seq=800 Ack=817 Win=65152 Len=17 TSval=3722003135 TSecr=1597743426
1712099394.383427382   444 1.023524685    10.10.1.2 → 10.10.1.1    TCP 83 50378 → 8081 [PSH, ACK] Seq=817 Ack=817 Win=64256 Len=17 TSval=1597743437 TSecr=3722003135
1712099396.383427382   446 1.023661590    10.10.1.1 → 10.10.1.2    TCP 83 8081 → 50378 [PSH, ACK] Seq=817 Ack=834 Win=65152 Len=17 TSval=3722003145 TSecr=1597743437
1712099403.383427382   453 1.033880098    10.10.1.2 → 10.10.1.1    TCP 83 50378 → 8081 [PSH, ACK] Seq=834 Ack=834 Win=64256 Len=17 TSval=1597743447 TSecr=3722003145
1712099405.383427382   455 1.034011244    10.10.1.1 → 10.10.1.2    TCP 83 8081 → 50378 [PSH, ACK] Seq=834 Ack=851 Win=65152 Len=17 TSval=3722003155 TSecr=1597743447
1712099411.383427382   461 1.044229902    10.10.1.2 → 10.10.1.1    TCP 83 50378 → 8081 [PSH, ACK] Seq=851 Ack=851 Win=64256 Len=17 TSval=1597743457 TSecr=3722003155
1712099413.383427382   463 1.044365840    10.10.1.1 → 10.10.1.2    TCP 83 8081 → 50378 [PSH, ACK] Seq=851 Ack=868 Win=65152 Len=17 TSval=3722003166 TSecr=1597743457
1712099420.383427382   470 1.054581684    10.10.1.2 → 10.10.1.1    TCP 83 50378 → 8081 [PSH, ACK] Seq=868 Ack=868 Win=64256 Len=17 TSval=1597743468 TSecr=3722003166
1712099422.383427382   472 1.054712419    10.10.1.1 → 10.10.1.2    TCP 83 8081 → 50378 [PSH, ACK] Seq=868 Ack=885 Win=65152 Len=17 TSval=3722003176 TSecr=1597743468
1712099428.383427382   478 1.064930989    10.10.1.2 → 10.10.1.1    TCP 83 50378 → 8081 [PSH, ACK] Seq=885 Ack=885 Win=64256 Len=17 TSval=1597743478 TSecr=3722003176
1712099430.383427382   480 1.065066724    10.10.1.1 → 10.10.1.2    TCP 83 8081 → 50378 [PSH, ACK] Seq=885 Ack=902 Win=65152 Len=17 TSval=3722003186 TSecr=1597743478
1712099437.383427382   487 1.075283389    10.10.1.2 → 10.10.1.1    TCP 83 50378 → 8081 [PSH, ACK] Seq=902 Ack=902 Win=64256 Len=17 TSval=1597743488 TSecr=3722003186
1712099439.383427382   489 1.075411465    10.10.1.1 → 10.10.1.2    TCP 83 8081 → 50378 [PSH, ACK] Seq=902 Ack=919 Win=65152 Len=17 TSval=3722003197 TSecr=1597743488
1712099445.383427382   495 1.085629741    10.10.1.2 → 10.10.1.1    TCP 83 50378 → 8081 [PSH, ACK] Seq=919 Ack=919 Win=64256 Len=17 TSval=1597743499 TSecr=3722003197
1712099447.383427382   497 1.085764634    10.10.1.1 → 10.10.1.2    TCP 83 8081 → 50378 [PSH, ACK] Seq=919 Ack=936 Win=65152 Len=17 TSval=3722003207 TSecr=1597743499
1712099454.383427382   504 1.095981666    10.10.1.2 → 10.10.1.1    TCP 83 50378 → 8081 [PSH, ACK] Seq=936 Ack=936 Win=64256 Len=17 TSval=1597743509 TSecr=3722003207
1712099456.383427382   506 1.096138705    10.10.1.1 → 10.10.1.2    TCP 83 8081 → 50378 [PSH, ACK] Seq=936 Ack=953 Win=65152 Len=17 TSval=3722003218 TSecr=1597743509
1712099462.383427382   512 1.106354636    10.10.1.2 → 10.10.1.1    TCP 83 50378 → 8081 [PSH, ACK] Seq=953 Ack=953 Win=64256 Len=17 TSval=1597743519 TSecr=3722003218
1712099465.383427382   515 1.106540721    10.10.1.1 → 10.10.1.2    TCP 83 8081 → 50378 [PSH, ACK] Seq=953 Ack=970 Win=65152 Len=17 TSval=3722003228 TSecr=1597743519
1712099471.383427382   521 1.116759938    10.10.1.2 → 10.10.1.1    TCP 83 50378 → 8081 [PSH, ACK] Seq=970 Ack=970 Win=64256 Len=17 TSval=1597743530 TSecr=3722003228
1712099473.383427382   523 1.116896970    10.10.1.1 → 10.10.1.2    TCP 83 8081 → 50378 [PSH, ACK] Seq=970 Ack=987 Win=65152 Len=17 TSval=3722003238 TSecr=1597743530
1712099479.383427382   529 1.127114432    10.10.1.2 → 10.10.1.1    TCP 83 50378 → 8081 [PSH, ACK] Seq=987 Ack=987 Win=64256 Len=17 TSval=1597743540 TSecr=3722003238
1712099481.383427382   531 1.127251414    10.10.1.1 → 10.10.1.2    TCP 83 8081 → 50378 [PSH, ACK] Seq=987 Ack=1004 Win=65152 Len=17 TSval=3722003249 TSecr=1597743540
1712099488.383427382   538 1.137470982    10.10.1.2 → 10.10.1.1    TCP 83 50378 → 8081 [PSH, ACK] Seq=1004 Ack=1004 Win=64256 Len=17 TSval=1597743551 TSecr=3722003249
1712099490.383427382   540 1.137606531    10.10.1.1 → 10.10.1.2    TCP 83 8081 → 50378 [PSH, ACK] Seq=1004 Ack=1021 Win=65152 Len=17 TSval=3722003259 TSecr=1597743551
1712099496.383427382   546 1.147776712    10.10.1.2 → 10.10.1.1    TCP 83 50378 → 8081 [PSH, ACK] Seq=1021 Ack=1021 Win=64256 Len=17 TSval=1597743561 TSecr=3722003259
1712099498.383427382   548 1.147897873    10.10.1.1 → 10.10.1.2    TCP 83 8081 → 50378 [PSH, ACK] Seq=1021 Ack=1038 Win=65152 Len=17 TSval=3722003269 TSecr=1597743561
1712099504.383427382   554 1.158066450    10.10.1.2 → 10.10.1.1    TCP 83 50378 → 8081 [PSH, ACK] Seq=1038 Ack=1038 Win=64256 Len=17 TSval=1597743571 TSecr=3722003269
1712099506.383427382   556 1.158203188    10.10.1.1 → 10.10.1.2    TCP 83 8081 → 50378 [PSH, ACK] Seq=1038 Ack=1055 Win=65152 Len=17 TSval=3722003280 TSecr=1597743571
1712099513.383427382   563 1.168422017    10.10.1.2 → 10.10.1.1    TCP 83 50378 → 8081 [PSH, ACK] Seq=1055 Ack=1055 Win=64256 Len=17 TSval=1597743581 TSecr=3722003280
1712099515.383427382   565 1.168558666    10.10.1.1 → 10.10.1.2    TCP 83 8081 → 50378 [PSH, ACK] Seq=1055 Ack=1072 Win=65152 Len=17 TSval=3722003290 TSecr=1597743581
1712099521.383427382   571 1.178775873    10.10.1.2 → 10.10.1.1    TCP 83 50378 → 8081 [PSH, ACK] Seq=1072 Ack=1072 Win=64256 Len=17 TSval=1597743592 TSecr=3722003290
1712099523.383427382   573 1.178912326    10.10.1.1 → 10.10.1.2    TCP 83 8081 → 50378 [PSH, ACK] Seq=1072 Ack=1089 Win=65152 Len=17 TSval=3722003300 TSecr=1597743592
1712099530.383427382   580 1.189129501    10.10.1.2 → 10.10.1.1    TCP 83 50378 → 8081 [PSH, ACK] Seq=1089 Ack=1089 Win=64256 Len=17 TSval=1597743602 TSecr=3722003300
1712099532.383427382   582 1.189258695    10.10.1.1 → 10.10.1.2    TCP 83 8081 → 50378 [PSH, ACK] Seq=1089 Ack=1106 Win=65152 Len=17 TSval=3722003311 TSecr=1597743602
1712099538.383427382   588 1.199474998    10.10.1.2 → 10.10.1.1    TCP 83 50378 → 8081 [PSH, ACK] Seq=1106 Ack=1106 Win=64256 Len=17 TSval=1597743613 TSecr=3722003311
1712099540.383427382   590 1.199613631    10.10.1.1 → 10.10.1.2    TCP 83 8081 → 50378 [PSH, ACK] Seq=1106 Ack=1123 Win=65152 Len=17 TSval=3722003321 TSecr=1597743613
1712099547.383427382   597 1.209833052    10.10.1.2 → 10.10.1.1    TCP 83 50378 → 8081 [PSH, ACK] Seq=1123 Ack=1123 Win=64256 Len=17 TSval=1597743623 TSecr=3722003321
1712099549.383427382   599 1.209970807    10.10.1.1 → 10.10.1.2    TCP 83 8081 → 50378 [PSH, ACK] Seq=1123 Ack=1140 Win=65152 Len=17 TSval=3722003331 TSecr=1597743623
1712099555.383427382   605 1.220191378    10.10.1.2 → 10.10.1.1    TCP 83 50378 → 8081 [PSH, ACK] Seq=1140 Ack=1140 Win=64256 Len=17 TSval=1597743633 TSecr=3722003331
1712099557.383427382   607 1.220326565    10.10.1.1 → 10.10.1.2    TCP 83 8081 → 50378 [PSH, ACK] Seq=1140 Ack=1157 Win=65152 Len=17 TSval=3722003342 TSecr=1597743633
1712099564.383427382   614 1.230543303    10.10.1.2 → 10.10.1.1    TCP 83 50378 → 8081 [PSH, ACK] Seq=1157 Ack=1157 Win=64256 Len=17 TSval=1597743644 TSecr=3722003342
1712099566.383427382   616 1.230680520    10.10.1.1 → 10.10.1.2    TCP 83 8081 → 50378 [PSH, ACK] Seq=1157 Ack=1174 Win=65152 Len=17 TSval=3722003352 TSecr=1597743644
1712099572.383427382   622 1.240898089    10.10.1.2 → 10.10.1.1    TCP 83 50378 → 8081 [PSH, ACK] Seq=1174 Ack=1174 Win=64256 Len=17 TSval=1597743654 TSecr=3722003352
1712099574.383427382   624 1.241033850    10.10.1.1 → 10.10.1.2    TCP 83 8081 → 50378 [PSH, ACK] Seq=1174 Ack=1191 Win=65152 Len=17 TSval=3722003362 TSecr=1597743654
1712099582.383427382   632 1.251251932    10.10.1.2 → 10.10.1.1    TCP 83 50378 → 8081 [PSH, ACK] Seq=1191 Ack=1191 Win=64256 Len=17 TSval=1597743664 TSecr=3722003362
1712099583.383427382   633 1.251380941    10.10.1.1 → 10.10.1.2    TCP 83 8081 → 50378 [PSH, ACK] Seq=1191 Ack=1208 Win=65152 Len=17 TSval=3722003373 TSecr=1597743664
1712099589.383427382   639 1.261599432    10.10.1.2 → 10.10.1.1    TCP 83 50378 → 8081 [PSH, ACK] Seq=1208 Ack=1208 Win=64256 Len=17 TSval=1597743675 TSecr=3722003373
1712099591.383427382   641 1.261733534    10.10.1.1 → 10.10.1.2    TCP 83 8081 → 50378 [PSH, ACK] Seq=1208 Ack=1225 Win=65152 Len=17 TSval=3722003383 TSecr=1597743675
1712099598.383427382   648 1.271948524    10.10.1.2 → 10.10.1.1    TCP 83 50378 → 8081 [PSH, ACK] Seq=1225 Ack=1225 Win=64256 Len=17 TSval=1597743685 TSecr=3722003383
1712099600.383427382   650 1.272098314    10.10.1.1 → 10.10.1.2    TCP 83 8081 → 50378 [PSH, ACK] Seq=1225 Ack=1242 Win=65152 Len=17 TSval=3722003394 TSecr=1597743685
1712099606.383427382   656 1.282314808    10.10.1.2 → 10.10.1.1    TCP 83 50378 → 8081 [PSH, ACK] Seq=1242 Ack=1242 Win=64256 Len=17 TSval=1597743695 TSecr=3722003394
1712099608.383427382   658 1.282452469    10.10.1.1 → 10.10.1.2    TCP 83 8081 → 50378 [PSH, ACK] Seq=1242 Ack=1259 Win=65152 Len=17 TSval=3722003404 TSecr=1597743695
1712099615.383427382   665 1.292671382    10.10.1.2 → 10.10.1.1    TCP 83 50378 → 8081 [PSH, ACK] Seq=1259 Ack=1259 Win=64256 Len=17 TSval=1597743706 TSecr=3722003404
1712099617.383427382   667 1.292803360    10.10.1.1 → 10.10.1.2    TCP 83 8081 → 50378 [PSH, ACK] Seq=1259 Ack=1276 Win=65152 Len=17 TSval=3722003414 TSecr=1597743706
1712099623.383427382   673 1.303024403    10.10.1.2 → 10.10.1.1    TCP 83 50378 → 8081 [PSH, ACK] Seq=1276 Ack=1276 Win=64256 Len=17 TSval=1597743716 TSecr=3722003414
1712099625.383427382   675 1.303161053    10.10.1.1 → 10.10.1.2    TCP 83 8081 → 50378 [PSH, ACK] Seq=1276 Ack=1293 Win=65152 Len=17 TSval=3722003425 TSecr=1597743716
1712099632.383427382   682 1.313381628    10.10.1.2 → 10.10.1.1    TCP 83 50378 → 8081 [PSH, ACK] Seq=1293 Ack=1293 Win=64256 Len=17 TSval=1597743726 TSecr=3722003425
1712099634.383427382   684 1.313519400    10.10.1.1 → 10.10.1.2    TCP 83 8081 → 50378 [PSH, ACK] Seq=1293 Ack=1310 Win=65152 Len=17 TSval=3722003435 TSecr=1597743726
1712099640.383427382   690 1.323737264    10.10.1.2 → 10.10.1.1    TCP 83 50378 → 8081 [PSH, ACK] Seq=1310 Ack=1310 Win=64256 Len=17 TSval=1597743737 TSecr=3722003435
1712099642.383427382   692 1.323873349    10.10.1.1 → 10.10.1.2    TCP 83 8081 → 50378 [PSH, ACK] Seq=1310 Ack=1327 Win=65152 Len=17 TSval=3722003445 TSecr=1597743737
1712099649.383427382   699 1.334092548    10.10.1.2 → 10.10.1.1    TCP 83 50378 → 8081 [PSH, ACK] Seq=1327 Ack=1327 Win=64256 Len=17 TSval=1597743747 TSecr=3722003445
1712099651.383427382   701 1.334231649    10.10.1.1 → 10.10.1.2    TCP 83 8081 → 50378 [PSH, ACK] Seq=1327 Ack=1344 Win=65152 Len=17 TSval=3722003456 TSecr=1597743747
1712099657.383427382   707 1.344458803    10.10.1.2 → 10.10.1.1    TCP 83 50378 → 8081 [PSH, ACK] Seq=1344 Ack=1344 Win=64256 Len=17 TSval=1597743758 TSecr=3722003456
1712099659.383427382   709 1.344594349    10.10.1.1 → 10.10.1.2    TCP 83 8081 → 50378 [PSH, ACK] Seq=1344 Ack=1361 Win=65152 Len=17 TSval=3722003466 TSecr=1597743758
1712099666.383427382   716 1.354810918    10.10.1.2 → 10.10.1.1    TCP 83 50378 → 8081 [PSH, ACK] Seq=1361 Ack=1361 Win=64256 Len=17 TSval=1597743768 TSecr=3722003466
1712099668.383427382   718 1.354950993    10.10.1.1 → 10.10.1.2    TCP 83 8081 → 50378 [PSH, ACK] Seq=1361 Ack=1378 Win=65152 Len=17 TSval=3722003476 TSecr=1597743768
1712099674.383427382   724 1.365169451    10.10.1.2 → 10.10.1.1    TCP 83 50378 → 8081 [PSH, ACK] Seq=1378 Ack=1378 Win=64256 Len=17 TSval=1597743778 TSecr=3722003476
1712099676.383427382   726 1.365305848    10.10.1.1 → 10.10.1.2    TCP 83 8081 → 50378 [PSH, ACK] Seq=1378 Ack=1395 Win=65152 Len=17 TSval=3722003487 TSecr=1597743778
1712099683.383427382   733 1.375522337    10.10.1.2 → 10.10.1.1    TCP 83 50378 → 8081 [PSH, ACK] Seq=1395 Ack=1395 Win=64256 Len=17 TSval=1597743789 TSecr=3722003487
1712099685.383427382   735 1.375651379    10.10.1.1 → 10.10.1.2    TCP 83 8081 → 50378 [PSH, ACK] Seq=1395 Ack=1412 Win=65152 Len=17 TSval=3722003497 TSecr=1597743789
1712099691.383427382   741 1.385870480    10.10.1.2 → 10.10.1.1    TCP 83 50378 → 8081 [PSH, ACK] Seq=1412 Ack=1412 Win=64256 Len=17 TSval=1597743799 TSecr=3722003497
1712099693.383427382   743 1.386006902    10.10.1.1 → 10.10.1.2    TCP 83 8081 → 50378 [PSH, ACK] Seq=1412 Ack=1429 Win=65152 Len=17 TSval=3722003507 TSecr=1597743799
1712099700.383427382   750 1.396224195    10.10.1.2 → 10.10.1.1    TCP 83 50378 → 8081 [PSH, ACK] Seq=1429 Ack=1429 Win=64256 Len=17 TSval=1597743809 TSecr=3722003507
1712099702.383427382   752 1.396353387    10.10.1.1 → 10.10.1.2    TCP 83 8081 → 50378 [PSH, ACK] Seq=1429 Ack=1446 Win=65152 Len=17 TSval=3722003518 TSecr=1597743809
1712099708.383427382   758 1.406569130    10.10.1.2 → 10.10.1.1    TCP 83 50378 → 8081 [PSH, ACK] Seq=1446 Ack=1446 Win=64256 Len=17 TSval=1597743820 TSecr=3722003518
1712099710.383427382   760 1.406706332    10.10.1.1 → 10.10.1.2    TCP 83 8081 → 50378 [PSH, ACK] Seq=1446 Ack=1463 Win=65152 Len=17 TSval=3722003528 TSecr=1597743820
1712099717.383427382   767 1.416925001    10.10.1.2 → 10.10.1.1    TCP 83 50378 → 8081 [PSH, ACK] Seq=1463 Ack=1463 Win=64256 Len=17 TSval=1597743830 TSecr=3722003528
1712099719.383427382   769 1.417063408    10.10.1.1 → 10.10.1.2    TCP 83 8081 → 50378 [PSH, ACK] Seq=1463 Ack=1480 Win=65152 Len=17 TSval=3722003538 TSecr=1597743830
1712099725.383427382   775 1.427280560    10.10.1.2 → 10.10.1.1    TCP 83 50378 → 8081 [PSH, ACK] Seq=1480 Ack=1480 Win=64256 Len=17 TSval=1597743840 TSecr=3722003538
1712099727.383427382   777 1.427418388    10.10.1.1 → 10.10.1.2    TCP 83 8081 → 50378 [PSH, ACK] Seq=1480 Ack=1497 Win=65152 Len=17 TSval=3722003549 TSecr=1597743840
1712099734.383427382   784 1.437634146    10.10.1.2 → 10.10.1.1    TCP 83 50378 → 8081 [PSH, ACK] Seq=1497 Ack=1497 Win=64256 Len=17 TSval=1597743851 TSecr=3722003549
1712099736.383427382   786 1.437763232    10.10.1.1 → 10.10.1.2    TCP 83 8081 → 50378 [PSH, ACK] Seq=1497 Ack=1514 Win=65152 Len=17 TSval=3722003559 TSecr=1597743851
1712099742.383427382   792 1.447978411    10.10.1.2 → 10.10.1.1    TCP 83 50378 → 8081 [PSH, ACK] Seq=1514 Ack=1514 Win=64256 Len=17 TSval=1597743861 TSecr=3722003559
1712099745.383427382   795 1.448135347    10.10.1.1 → 10.10.1.2    TCP 83 8081 → 50378 [PSH, ACK] Seq=1514 Ack=1531 Win=65152 Len=17 TSval=3722003570 TSecr=1597743861
1712099751.383427382   801 1.458352534    10.10.1.2 → 10.10.1.1    TCP 83 50378 → 8081 [PSH, ACK] Seq=1531 Ack=1531 Win=64256 Len=17 TSval=1597743871 TSecr=3722003570
1712099753.383427382   803 1.458482067    10.10.1.1 → 10.10.1.2    TCP 83 8081 → 50378 [PSH, ACK] Seq=1531 Ack=1548 Win=65152 Len=17 TSval=3722003580 TSecr=1597743871
1712099759.383427382   809 1.468700081    10.10.1.2 → 10.10.1.1    TCP 83 50378 → 8081 [PSH, ACK] Seq=1548 Ack=1548 Win=64256 Len=17 TSval=1597743882 TSecr=3722003580
1712099761.383427382   811 1.468835556    10.10.1.1 → 10.10.1.2    TCP 83 8081 → 50378 [PSH, ACK] Seq=1548 Ack=1565 Win=65152 Len=17 TSval=3722003590 TSecr=1597743882
1712099768.383427382   818 1.479055932    10.10.1.2 → 10.10.1.1    TCP 83 50378 → 8081 [PSH, ACK] Seq=1565 Ack=1565 Win=64256 Len=17 TSval=1597743892 TSecr=3722003590
1712099770.383427382   820 1.479192090    10.10.1.1 → 10.10.1.2    TCP 83 8081 → 50378 [PSH, ACK] Seq=1565 Ack=1582 Win=65152 Len=17 TSval=3722003601 TSecr=1597743892
1712099776.383427382   826 1.489408934    10.10.1.2 → 10.10.1.1    TCP 83 50378 → 8081 [PSH, ACK] Seq=1582 Ack=1582 Win=64256 Len=17 TSval=1597743902 TSecr=3722003601
1712099778.383427382   828 1.489543986    10.10.1.1 → 10.10.1.2    TCP 83 8081 → 50378 [PSH, ACK] Seq=1582 Ack=1599 Win=65152 Len=17 TSval=3722003611 TSecr=1597743902
1712099785.383427382   835 1.499763208    10.10.1.2 → 10.10.1.1    TCP 83 50378 → 8081 [PSH, ACK] Seq=1599 Ack=1599 Win=64256 Len=17 TSval=1597743913 TSecr=3722003611
1712099787.383427382   837 1.499900086    10.10.1.1 → 10.10.1.2    TCP 83 8081 → 50378 [PSH, ACK] Seq=1599 Ack=1616 Win=65152 Len=17 TSval=3722003621 TSecr=1597743913
1712099793.383427382   843 1.510117451    10.10.1.2 → 10.10.1.1    TCP 83 50378 → 8081 [PSH, ACK] Seq=1616 Ack=1616 Win=64256 Len=17 TSval=1597743923 TSecr=3722003621
1712099795.383427382   845 1.510254306    10.10.1.1 → 10.10.1.2    TCP 83 8081 → 50378 [PSH, ACK] Seq=1616 Ack=1633 Win=65152 Len=17 TSval=3722003632 TSecr=1597743923
1712099802.383427382   852 1.520462173    10.10.1.2 → 10.10.1.1    TCP 83 50378 → 8081 [PSH, ACK] Seq=1633 Ack=1633 Win=64256 Len=17 TSval=1597743934 TSecr=3722003632
1712099804.383427382   854 1.520599792    10.10.1.1 → 10.10.1.2    TCP 83 8081 → 50378 [PSH, ACK] Seq=1633 Ack=1650 Win=65152 Len=17 TSval=3722003642 TSecr=1597743934
1712099810.383427382   860 1.530817580    10.10.1.2 → 10.10.1.1    TCP 83 50378 → 8081 [PSH, ACK] Seq=1650 Ack=1650 Win=64256 Len=17 TSval=1597743944 TSecr=3722003642
1712099812.383427382   862 1.530956386    10.10.1.1 → 10.10.1.2    TCP 83 8081 → 50378 [PSH, ACK] Seq=1650 Ack=1667 Win=65152 Len=17 TSval=3722003652 TSecr=1597743944
1712099819.383427382   869 1.541177095    10.10.1.2 → 10.10.1.1    TCP 83 50378 → 8081 [PSH, ACK] Seq=1667 Ack=1667 Win=64256 Len=17 TSval=1597743954 TSecr=3722003652
1712099821.383427382   871 1.541305426    10.10.1.1 → 10.10.1.2    TCP 83 8081 → 50378 [PSH, ACK] Seq=1667 Ack=1684 Win=65152 Len=17 TSval=3722003663 TSecr=1597743954
1712099827.383427382   877 1.551522004    10.10.1.2 → 10.10.1.1    TCP 83 50378 → 8081 [PSH, ACK] Seq=1684 Ack=1684 Win=64256 Len=17 TSval=1597743965 TSecr=3722003663
1712099829.383427382   879 1.551659610    10.10.1.1 → 10.10.1.2    TCP 83 8081 → 50378 [PSH, ACK] Seq=1684 Ack=1701 Win=65152 Len=17 TSval=3722003673 TSecr=1597743965
1712099836.383427382   886 1.561877980    10.10.1.2 → 10.10.1.1    TCP 83 50378 → 8081 [PSH, ACK] Seq=1701 Ack=1701 Win=64256 Len=17 TSval=1597743975 TSecr=3722003673
1712099838.383427382   888 1.562015122    10.10.1.1 → 10.10.1.2    TCP 83 8081 → 50378 [PSH, ACK] Seq=1701 Ack=1718 Win=65152 Len=17 TSval=3722003683 TSecr=1597743975
1712099844.383427382   894 1.572231974    10.10.1.2 → 10.10.1.1    TCP 83 50378 → 8081 [PSH, ACK] Seq=1718 Ack=1718 Win=64256 Len=17 TSval=1597743985 TSecr=3722003683
1712099846.383427382   896 1.572315784    10.10.1.1 → 10.10.1.2    TCP 83 8081 → 50378 [PSH, ACK] Seq=1718 Ack=1735 Win=65152 Len=17 TSval=3722003694 TSecr=1597743985
1712099853.383427382   903 1.582532213    10.10.1.2 → 10.10.1.1    TCP 83 50378 → 8081 [PSH, ACK] Seq=1735 Ack=1735 Win=64256 Len=17 TSval=1597743996 TSecr=3722003694
1712099855.383427382   905 1.582670155    10.10.1.1 → 10.10.1.2    TCP 83 8081 → 50378 [PSH, ACK] Seq=1735 Ack=1752 Win=65152 Len=17 TSval=3722003704 TSecr=1597743996
1712099861.383427382   911 1.592890086    10.10.1.2 → 10.10.1.1    TCP 83 50378 → 8081 [PSH, ACK] Seq=1752 Ack=1752 Win=64256 Len=17 TSval=1597744006 TSecr=3722003704
1712099863.383427382   913 1.593024980    10.10.1.1 → 10.10.1.2    TCP 83 8081 → 50378 [PSH, ACK] Seq=1752 Ack=1769 Win=65152 Len=17 TSval=3722003714 TSecr=1597744006
1712099870.383427382   920 1.603240471    10.10.1.2 → 10.10.1.1    TCP 83 50378 → 8081 [PSH, ACK] Seq=1769 Ack=1769 Win=64256 Len=17 TSval=1597744016 TSecr=3722003714
1712099872.383427382   922 1.603368913    10.10.1.1 → 10.10.1.2    TCP 83 8081 → 50378 [PSH, ACK] Seq=1769 Ack=1786 Win=65152 Len=17 TSval=3722003725 TSecr=1597744016
1712099878.383427382   928 1.613586845    10.10.1.2 → 10.10.1.1    TCP 83 50378 → 8081 [PSH, ACK] Seq=1786 Ack=1786 Win=64256 Len=17 TSval=1597744027 TSecr=3722003725
1712099880.383427382   930 1.613721703    10.10.1.1 → 10.10.1.2    TCP 83 8081 → 50378 [PSH, ACK] Seq=1786 Ack=1803 Win=65152 Len=17 TSval=3722003735 TSecr=1597744027
1712099887.383427382   937 1.623940296    10.10.1.2 → 10.10.1.1    TCP 83 50378 → 8081 [PSH, ACK] Seq=1803 Ack=1803 Win=64256 Len=17 TSval=1597744037 TSecr=3722003735
1712099889.383427382   939 1.624096918    10.10.1.1 → 10.10.1.2    TCP 83 8081 → 50378 [PSH, ACK] Seq=1803 Ack=1820 Win=65152 Len=17 TSval=3722003745 TSecr=1597744037
1712099895.383427382   945 1.634318331    10.10.1.2 → 10.10.1.1    TCP 83 50378 → 8081 [PSH, ACK] Seq=1820 Ack=1820 Win=64256 Len=17 TSval=1597744047 TSecr=3722003745
1712099897.383427382   947 1.634453590    10.10.1.1 → 10.10.1.2    TCP 83 8081 → 50378 [PSH, ACK] Seq=1820 Ack=1837 Win=65152 Len=17 TSval=3722003756 TSecr=1597744047
1712099904.383427382   954 1.644673391    10.10.1.2 → 10.10.1.1    TCP 83 50378 → 8081 [PSH, ACK] Seq=1837 Ack=1837 Win=64256 Len=17 TSval=1597744058 TSecr=3722003756
1712099906.383427382   956 1.644811086    10.10.1.1 → 10.10.1.2    TCP 83 8081 → 50378 [PSH, ACK] Seq=1837 Ack=1854 Win=65152 Len=17 TSval=3722003766 TSecr=1597744058
1712099912.383427382   962 1.655028455    10.10.1.2 → 10.10.1.1    TCP 83 50378 → 8081 [PSH, ACK] Seq=1854 Ack=1854 Win=64256 Len=17 TSval=1597744068 TSecr=3722003766
1712099914.383427382   964 1.655167813    10.10.1.1 → 10.10.1.2    TCP 83 8081 → 50378 [PSH, ACK] Seq=1854 Ack=1871 Win=65152 Len=17 TSval=3722003777 TSecr=1597744068
1712099921.383427382   971 1.665385969    10.10.1.2 → 10.10.1.1    TCP 83 50378 → 8081 [PSH, ACK] Seq=1871 Ack=1871 Win=64256 Len=17 TSval=1597744078 TSecr=3722003777
1712099923.383427382   973 1.665524433    10.10.1.1 → 10.10.1.2    TCP 83 8081 → 50378 [PSH, ACK] Seq=1871 Ack=1888 Win=65152 Len=17 TSval=3722003787 TSecr=1597744078
1712099929.383427382   979 1.675743872    10.10.1.2 → 10.10.1.1    TCP 83 50378 → 8081 [PSH, ACK] Seq=1888 Ack=1888 Win=64256 Len=17 TSval=1597744089 TSecr=3722003787
1712099931.383427382   981 1.675880223    10.10.1.1 → 10.10.1.2    TCP 83 8081 → 50378 [PSH, ACK] Seq=1888 Ack=1905 Win=65152 Len=17 TSval=3722003797 TSecr=1597744089
1712099938.383427382   988 1.686096757    10.10.1.2 → 10.10.1.1    TCP 83 50378 → 8081 [PSH, ACK] Seq=1905 Ack=1905 Win=64256 Len=17 TSval=1597744099 TSecr=3722003797
1712099940.383427382   990 1.686225702    10.10.1.1 → 10.10.1.2    TCP 83 8081 → 50378 [PSH, ACK] Seq=1905 Ack=1922 Win=65152 Len=17 TSval=3722003808 TSecr=1597744099
1712099946.383427382   996 1.696443747    10.10.1.2 → 10.10.1.1    TCP 83 50378 → 8081 [PSH, ACK] Seq=1922 Ack=1922 Win=64256 Len=17 TSval=1597744110 TSecr=3722003808
1712099949.383427382   999 1.696633149    10.10.1.1 → 10.10.1.2    TCP 83 8081 → 50378 [PSH, ACK] Seq=1922 Ack=1939 Win=65152 Len=17 TSval=3722003818 TSecr=1597744110
1712099955.383427382  1005 1.706850065    10.10.1.2 → 10.10.1.1    TCP 83 50378 → 8081 [PSH, ACK] Seq=1939 Ack=1939 Win=64256 Len=17 TSval=1597744120 TSecr=3722003818
1712099957.383427382  1007 1.706978976    10.10.1.1 → 10.10.1.2    TCP 83 8081 → 50378 [PSH, ACK] Seq=1939 Ack=1956 Win=65152 Len=17 TSval=3722003828 TSecr=1597744120
1712099963.383427382  1013 1.717196543    10.10.1.2 → 10.10.1.1    TCP 83 50378 → 8081 [PSH, ACK] Seq=1956 Ack=1956 Win=64256 Len=17 TSval=1597744130 TSecr=3722003828
1712099965.383427382  1015 1.717333616    10.10.1.1 → 10.10.1.2    TCP 83 8081 → 50378 [PSH, ACK] Seq=1956 Ack=1973 Win=65152 Len=17 TSval=3722003839 TSecr=1597744130
1712099972.383427382  1022 1.727550306    10.10.1.2 → 10.10.1.1    TCP 83 50378 → 8081 [PSH, ACK] Seq=1973 Ack=1973 Win=64256 Len=17 TSval=1597744141 TSecr=3722003839
1712099974.383427382  1024 1.727678211    10.10.1.1 → 10.10.1.2    TCP 83 8081 → 50378 [PSH, ACK] Seq=1973 Ack=1990 Win=65152 Len=17 TSval=3722003849 TSecr=1597744141
1712099980.383427382  1030 1.737897350    10.10.1.2 → 10.10.1.1    TCP 83 50378 → 8081 [PSH, ACK] Seq=1990 Ack=1990 Win=64256 Len=17 TSval=1597744151 TSecr=3722003849
1712099982.383427382  1032 1.738035036    10.10.1.1 → 10.10.1.2    TCP 83 8081 → 50378 [PSH, ACK] Seq=1990 Ack=2007 Win=65152 Len=17 TSval=3722003859 TSecr=1597744151
