1711546596.175762892    34 0.764590903    10.10.1.2 → 10.10.1.1    TCP 83 55526 → 8081 [PSH, ACK] Seq=1 Ack=1 Win=64256 Len=17 TSval=1045355028 TSecr=3169614266
1711546600.175762892    38 0.764880158    10.10.1.1 → 10.10.1.2    TCP 83 8081 → 55526 [PSH, ACK] Seq=1 Ack=18 Win=65152 Len=17 TSval=3169614737 TSecr=1045355028
1711546609.175762892    47 0.799638162    10.10.1.2 → 10.10.1.1    TCP 83 55526 → 8081 [PSH, ACK] Seq=18 Ack=18 Win=64256 Len=17 TSval=1045355063 TSecr=3169614737
1711546612.175762892    50 0.799762758    10.10.1.1 → 10.10.1.2    TCP 83 8081 → 55526 [PSH, ACK] Seq=18 Ack=35 Win=65152 Len=17 TSval=3169614771 TSecr=1045355063
1711546619.175762892    57 0.812743245    10.10.1.2 → 10.10.1.1    TCP 83 55526 → 8081 [PSH, ACK] Seq=35 Ack=35 Win=64256 Len=17 TSval=1045355076 TSecr=3169614771
1711546622.175762892    60 0.812872931    10.10.1.1 → 10.10.1.2    TCP 83 8081 → 55526 [PSH, ACK] Seq=35 Ack=52 Win=65152 Len=17 TSval=3169614785 TSecr=1045355076
1711546631.175762892    69 0.936506367    10.10.1.2 → 10.10.1.1    TCP 83 55526 → 8081 [PSH, ACK] Seq=52 Ack=52 Win=64256 Len=17 TSval=1045355200 TSecr=3169614785
1711546634.175762892    72 0.936630708    10.10.1.1 → 10.10.1.2    TCP 83 8081 → 55526 [PSH, ACK] Seq=52 Ack=69 Win=65152 Len=17 TSval=3169614908 TSecr=1045355200
1711546643.175762892    81 0.982667772    10.10.1.2 → 10.10.1.1    TCP 83 55526 → 8081 [PSH, ACK] Seq=69 Ack=69 Win=64256 Len=17 TSval=1045355246 TSecr=3169614908
1711546646.175762892    84 0.982791814    10.10.1.1 → 10.10.1.2    TCP 83 8081 → 55526 [PSH, ACK] Seq=69 Ack=86 Win=65152 Len=17 TSval=3169614954 TSecr=1045355246
1711546656.175762892    94 1.677569146    10.10.1.2 → 10.10.1.1    TCP 83 55526 → 8081 [PSH, ACK] Seq=86 Ack=86 Win=64256 Len=17 TSval=1045355941 TSecr=3169614954
1711546659.175762892    97 1.677691088    10.10.1.1 → 10.10.1.2    TCP 83 8081 → 55526 [PSH, ACK] Seq=86 Ack=103 Win=65152 Len=17 TSval=3169615649 TSecr=1045355941
1711546668.175762892   106 2.012287495    10.10.1.2 → 10.10.1.1    TCP 83 55526 → 8081 [PSH, ACK] Seq=103 Ack=103 Win=64256 Len=17 TSval=1045356275 TSecr=3169615649
1711546671.175762892   109 2.012408996    10.10.1.1 → 10.10.1.2    TCP 83 8081 → 55526 [PSH, ACK] Seq=103 Ack=120 Win=65152 Len=17 TSval=3169615984 TSecr=1045356275
1711546680.175762892   118 2.044407285    10.10.1.2 → 10.10.1.1    TCP 83 55526 → 8081 [PSH, ACK] Seq=120 Ack=120 Win=64256 Len=17 TSval=1045356308 TSecr=3169615984
1711546683.175762892   121 2.044532016    10.10.1.1 → 10.10.1.2    TCP 83 8081 → 55526 [PSH, ACK] Seq=120 Ack=137 Win=65152 Len=17 TSval=3169616016 TSecr=1045356308
1711546690.175762892   128 2.052249927    10.10.1.2 → 10.10.1.1    TCP 83 55526 → 8081 [PSH, ACK] Seq=137 Ack=137 Win=64256 Len=17 TSval=1045356315 TSecr=3169616016
1711546693.175762892   131 2.052383613    10.10.1.1 → 10.10.1.2    TCP 83 8081 → 55526 [PSH, ACK] Seq=137 Ack=154 Win=65152 Len=17 TSval=3169616024 TSecr=1045356315
1711546702.175762892   140 2.252869526    10.10.1.2 → 10.10.1.1    TCP 83 55526 → 8081 [PSH, ACK] Seq=154 Ack=154 Win=64256 Len=17 TSval=1045356516 TSecr=3169616024
1711546705.175762892   143 2.252994312    10.10.1.1 → 10.10.1.2    TCP 83 8081 → 55526 [PSH, ACK] Seq=154 Ack=171 Win=65152 Len=17 TSval=3169616225 TSecr=1045356516
1711546716.175762892   154 2.255667911    10.10.1.2 → 10.10.1.1    TCP 83 55526 → 8081 [PSH, ACK] Seq=171 Ack=171 Win=64256 Len=17 TSval=1045356519 TSecr=3169616225
1711546719.175762892   157 2.255792902    10.10.1.1 → 10.10.1.2    TCP 83 8081 → 55526 [PSH, ACK] Seq=171 Ack=188 Win=65152 Len=17 TSval=3169616227 TSecr=1045356519
1711546728.175762892   166 2.411810418    10.10.1.2 → 10.10.1.1    TCP 83 55526 → 8081 [PSH, ACK] Seq=188 Ack=188 Win=64256 Len=17 TSval=1045356675 TSecr=3169616227
1711546731.175762892   169 2.411947494    10.10.1.1 → 10.10.1.2    TCP 83 8081 → 55526 [PSH, ACK] Seq=188 Ack=205 Win=65152 Len=17 TSval=3169616384 TSecr=1045356675
1711546740.175762892   178 2.435952996    10.10.1.2 → 10.10.1.1    TCP 83 55526 → 8081 [PSH, ACK] Seq=205 Ack=205 Win=64256 Len=17 TSval=1045356699 TSecr=3169616384
1711546743.175762892   181 2.436076863    10.10.1.1 → 10.10.1.2    TCP 83 8081 → 55526 [PSH, ACK] Seq=205 Ack=222 Win=65152 Len=17 TSval=3169616408 TSecr=1045356699
1711546752.175762892   190 2.495478977    10.10.1.2 → 10.10.1.1    TCP 83 55526 → 8081 [PSH, ACK] Seq=222 Ack=222 Win=64256 Len=17 TSval=1045356759 TSecr=3169616408
1711546755.175762892   193 2.495604095    10.10.1.1 → 10.10.1.2    TCP 83 8081 → 55526 [PSH, ACK] Seq=222 Ack=239 Win=65152 Len=17 TSval=3169616467 TSecr=1045356759
1711546764.175762892   202 2.637557991    10.10.1.2 → 10.10.1.1    TCP 83 55526 → 8081 [PSH, ACK] Seq=239 Ack=239 Win=64256 Len=17 TSval=1045356901 TSecr=3169616467
1711546767.175762892   205 2.637682731    10.10.1.1 → 10.10.1.2    TCP 83 8081 → 55526 [PSH, ACK] Seq=239 Ack=256 Win=65152 Len=17 TSval=3169616609 TSecr=1045356901
1711546776.175762892   214 2.705725132    10.10.1.2 → 10.10.1.1    TCP 83 55526 → 8081 [PSH, ACK] Seq=256 Ack=256 Win=64256 Len=17 TSval=1045356969 TSecr=3169616609
1711546779.175762892   217 2.705872821    10.10.1.1 → 10.10.1.2    TCP 83 8081 → 55526 [PSH, ACK] Seq=256 Ack=273 Win=65152 Len=17 TSval=3169616677 TSecr=1045356969
1711546788.175762892   226 2.779030184    10.10.1.2 → 10.10.1.1    TCP 83 55526 → 8081 [PSH, ACK] Seq=273 Ack=273 Win=64256 Len=17 TSval=1045357042 TSecr=3169616677
1711546791.175762892   229 2.779155260    10.10.1.1 → 10.10.1.2    TCP 83 8081 → 55526 [PSH, ACK] Seq=273 Ack=290 Win=65152 Len=17 TSval=3169616751 TSecr=1045357042
1711546799.175762892   237 2.781195276    10.10.1.2 → 10.10.1.1    TCP 83 55526 → 8081 [PSH, ACK] Seq=290 Ack=290 Win=64256 Len=17 TSval=1045357044 TSecr=3169616751
1711546802.175762892   240 2.781314463    10.10.1.1 → 10.10.1.2    TCP 83 8081 → 55526 [PSH, ACK] Seq=290 Ack=307 Win=65152 Len=17 TSval=3169616753 TSecr=1045357044
1711546811.175762892   249 2.868273067    10.10.1.2 → 10.10.1.1    TCP 83 55526 → 8081 [PSH, ACK] Seq=307 Ack=307 Win=64256 Len=17 TSval=1045357131 TSecr=3169616753
1711546814.175762892   252 2.868399926    10.10.1.1 → 10.10.1.2    TCP 83 8081 → 55526 [PSH, ACK] Seq=307 Ack=324 Win=65152 Len=17 TSval=3169616840 TSecr=1045357131
1711546823.175762892   261 3.007629703    10.10.1.2 → 10.10.1.1    TCP 83 55526 → 8081 [PSH, ACK] Seq=324 Ack=324 Win=64256 Len=17 TSval=1045357271 TSecr=3169616840
1711546826.175762892   264 3.007753131    10.10.1.1 → 10.10.1.2    TCP 83 8081 → 55526 [PSH, ACK] Seq=324 Ack=341 Win=65152 Len=17 TSval=3169616979 TSecr=1045357271
1711546834.175762892   272 3.021678669    10.10.1.2 → 10.10.1.1    TCP 83 55526 → 8081 [PSH, ACK] Seq=341 Ack=341 Win=64256 Len=17 TSval=1045357285 TSecr=3169616979
1711546837.175762892   275 3.021803566    10.10.1.1 → 10.10.1.2    TCP 83 8081 → 55526 [PSH, ACK] Seq=341 Ack=358 Win=65152 Len=17 TSval=3169616993 TSecr=1045357285
1711546846.175762892   284 3.275819918    10.10.1.2 → 10.10.1.1    TCP 83 55526 → 8081 [PSH, ACK] Seq=358 Ack=358 Win=64256 Len=17 TSval=1045357539 TSecr=3169616993
1711546849.175762892   287 3.275941719    10.10.1.1 → 10.10.1.2    TCP 83 8081 → 55526 [PSH, ACK] Seq=358 Ack=375 Win=65152 Len=17 TSval=3169617248 TSecr=1045357539
1711546859.175762892   297 3.445888590    10.10.1.2 → 10.10.1.1    TCP 83 55526 → 8081 [PSH, ACK] Seq=375 Ack=375 Win=64256 Len=17 TSval=1045357709 TSecr=3169617248
1711546862.175762892   300 3.446013437    10.10.1.1 → 10.10.1.2    TCP 83 8081 → 55526 [PSH, ACK] Seq=375 Ack=392 Win=65152 Len=17 TSval=3169617418 TSecr=1045357709
1711546871.175762892   309 3.559550484    10.10.1.2 → 10.10.1.1    TCP 83 55526 → 8081 [PSH, ACK] Seq=392 Ack=392 Win=64256 Len=17 TSval=1045357823 TSecr=3169617418
1711546874.175762892   312 3.559676090    10.10.1.1 → 10.10.1.2    TCP 83 8081 → 55526 [PSH, ACK] Seq=392 Ack=409 Win=65152 Len=17 TSval=3169617531 TSecr=1045357823
1711546883.175762892   321 3.645577685    10.10.1.2 → 10.10.1.1    TCP 83 55526 → 8081 [PSH, ACK] Seq=409 Ack=409 Win=64256 Len=17 TSval=1045357909 TSecr=3169617531
1711546886.175762892   324 3.645701677    10.10.1.1 → 10.10.1.2    TCP 83 8081 → 55526 [PSH, ACK] Seq=409 Ack=426 Win=65152 Len=17 TSval=3169617617 TSecr=1045357909
1711546895.175762892   333 3.935009100    10.10.1.2 → 10.10.1.1    TCP 83 55526 → 8081 [PSH, ACK] Seq=426 Ack=426 Win=64256 Len=17 TSval=1045358198 TSecr=3169617617
1711546898.175762892   336 3.935130110    10.10.1.1 → 10.10.1.2    TCP 83 8081 → 55526 [PSH, ACK] Seq=426 Ack=443 Win=65152 Len=17 TSval=3169617907 TSecr=1045358198
1711546907.175762892   345 4.024174421    10.10.1.2 → 10.10.1.1    TCP 83 55526 → 8081 [PSH, ACK] Seq=443 Ack=443 Win=64256 Len=17 TSval=1045358287 TSecr=3169617907
1711546910.175762892   348 4.024300619    10.10.1.1 → 10.10.1.2    TCP 83 8081 → 55526 [PSH, ACK] Seq=443 Ack=460 Win=65152 Len=17 TSval=3169617996 TSecr=1045358287
1711546919.175762892   357 4.132550005    10.10.1.2 → 10.10.1.1    TCP 83 55526 → 8081 [PSH, ACK] Seq=460 Ack=460 Win=64256 Len=17 TSval=1045358396 TSecr=3169617996
1711546922.175762892   360 4.132675339    10.10.1.1 → 10.10.1.2    TCP 83 8081 → 55526 [PSH, ACK] Seq=460 Ack=477 Win=65152 Len=17 TSval=3169618104 TSecr=1045358396
1711546931.175762892   369 4.200514968    10.10.1.2 → 10.10.1.1    TCP 83 55526 → 8081 [PSH, ACK] Seq=477 Ack=477 Win=64256 Len=17 TSval=1045358464 TSecr=3169618104
1711546934.175762892   372 4.200639479    10.10.1.1 → 10.10.1.2    TCP 83 8081 → 55526 [PSH, ACK] Seq=477 Ack=494 Win=65152 Len=17 TSval=3169618172 TSecr=1045358464
1711546943.175762892   381 4.300113860    10.10.1.2 → 10.10.1.1    TCP 83 55526 → 8081 [PSH, ACK] Seq=494 Ack=494 Win=64256 Len=17 TSval=1045358563 TSecr=3169618172
1711546946.175762892   384 4.300244218    10.10.1.1 → 10.10.1.2    TCP 83 8081 → 55526 [PSH, ACK] Seq=494 Ack=511 Win=65152 Len=17 TSval=3169618272 TSecr=1045358563
1711546955.175762892   393 4.325673935    10.10.1.2 → 10.10.1.1    TCP 83 55526 → 8081 [PSH, ACK] Seq=511 Ack=511 Win=64256 Len=17 TSval=1045358589 TSecr=3169618272
1711546958.175762892   396 4.325800796    10.10.1.1 → 10.10.1.2    TCP 83 8081 → 55526 [PSH, ACK] Seq=511 Ack=528 Win=65152 Len=17 TSval=3169618297 TSecr=1045358589
1711546967.175762892   405 4.374032095    10.10.1.2 → 10.10.1.1    TCP 83 55526 → 8081 [PSH, ACK] Seq=528 Ack=528 Win=64256 Len=17 TSval=1045358637 TSecr=3169618297
1711546970.175762892   408 4.374158055    10.10.1.1 → 10.10.1.2    TCP 83 8081 → 55526 [PSH, ACK] Seq=528 Ack=545 Win=65152 Len=17 TSval=3169618346 TSecr=1045358637
1711546979.175762892   417 4.628727910    10.10.1.2 → 10.10.1.1    TCP 83 55526 → 8081 [PSH, ACK] Seq=545 Ack=545 Win=64256 Len=17 TSval=1045358892 TSecr=3169618346
1711546982.175762892   420 4.628849203    10.10.1.1 → 10.10.1.2    TCP 83 8081 → 55526 [PSH, ACK] Seq=545 Ack=562 Win=65152 Len=17 TSval=3169618600 TSecr=1045358892
1711546991.175762892   429 4.671015284    10.10.1.2 → 10.10.1.1    TCP 83 55526 → 8081 [PSH, ACK] Seq=562 Ack=562 Win=64256 Len=17 TSval=1045358934 TSecr=3169618600
1711546994.175762892   432 4.671139335    10.10.1.1 → 10.10.1.2    TCP 83 8081 → 55526 [PSH, ACK] Seq=562 Ack=579 Win=65152 Len=17 TSval=3169618643 TSecr=1045358934
1711547003.175762892   441 4.680808623    10.10.1.2 → 10.10.1.1    TCP 83 55526 → 8081 [PSH, ACK] Seq=579 Ack=579 Win=64256 Len=17 TSval=1045358944 TSecr=3169618643
1711547006.175762892   444 4.680934350    10.10.1.1 → 10.10.1.2    TCP 83 8081 → 55526 [PSH, ACK] Seq=579 Ack=596 Win=65152 Len=17 TSval=3169618653 TSecr=1045358944
1711547013.175762892   451 4.715254759    10.10.1.2 → 10.10.1.1    TCP 83 55526 → 8081 [PSH, ACK] Seq=596 Ack=596 Win=64256 Len=17 TSval=1045358978 TSecr=3169618653
1711547016.175762892   454 4.715386996    10.10.1.1 → 10.10.1.2    TCP 83 8081 → 55526 [PSH, ACK] Seq=596 Ack=613 Win=65152 Len=17 TSval=3169618687 TSecr=1045358978
1711547025.175762892   463 4.757407912    10.10.1.2 → 10.10.1.1    TCP 83 55526 → 8081 [PSH, ACK] Seq=613 Ack=613 Win=64256 Len=17 TSval=1045359021 TSecr=3169618687
1711547028.175762892   466 4.757532587    10.10.1.1 → 10.10.1.2    TCP 83 8081 → 55526 [PSH, ACK] Seq=613 Ack=630 Win=65152 Len=17 TSval=3169618729 TSecr=1045359021
1711547037.175762892   475 4.763393948    10.10.1.2 → 10.10.1.1    TCP 83 55526 → 8081 [PSH, ACK] Seq=630 Ack=630 Win=64256 Len=17 TSval=1045359026 TSecr=3169618729
1711547040.175762892   478 4.763519325    10.10.1.1 → 10.10.1.2    TCP 83 8081 → 55526 [PSH, ACK] Seq=630 Ack=647 Win=65152 Len=17 TSval=3169618735 TSecr=1045359026
1711547049.175762892   487 4.846167780    10.10.1.2 → 10.10.1.1    TCP 83 55526 → 8081 [PSH, ACK] Seq=647 Ack=647 Win=64256 Len=17 TSval=1045359109 TSecr=3169618735
1711547052.175762892   490 4.846294358    10.10.1.1 → 10.10.1.2    TCP 83 8081 → 55526 [PSH, ACK] Seq=647 Ack=664 Win=65152 Len=17 TSval=3169618818 TSecr=1045359109
1711547061.175762892   499 4.899942324    10.10.1.2 → 10.10.1.1    TCP 83 55526 → 8081 [PSH, ACK] Seq=664 Ack=664 Win=64256 Len=17 TSval=1045359163 TSecr=3169618818
1711547064.175762892   502 4.900067666    10.10.1.1 → 10.10.1.2    TCP 83 8081 → 55526 [PSH, ACK] Seq=664 Ack=681 Win=65152 Len=17 TSval=3169618872 TSecr=1045359163
1711547073.175762892   511 5.152742328    10.10.1.2 → 10.10.1.1    TCP 83 55526 → 8081 [PSH, ACK] Seq=681 Ack=681 Win=64256 Len=17 TSval=1045359416 TSecr=3169618872
1711547076.175762892   514 5.152864233    10.10.1.1 → 10.10.1.2    TCP 83 8081 → 55526 [PSH, ACK] Seq=681 Ack=698 Win=65152 Len=17 TSval=3169619125 TSecr=1045359416
1711547085.175762892   523 5.241186091    10.10.1.2 → 10.10.1.1    TCP 83 55526 → 8081 [PSH, ACK] Seq=698 Ack=698 Win=64256 Len=17 TSval=1045359504 TSecr=3169619125
1711547088.175762892   526 5.241309995    10.10.1.1 → 10.10.1.2    TCP 83 8081 → 55526 [PSH, ACK] Seq=698 Ack=715 Win=65152 Len=17 TSval=3169619213 TSecr=1045359504
1711547097.175762892   535 5.264260246    10.10.1.2 → 10.10.1.1    TCP 83 55526 → 8081 [PSH, ACK] Seq=715 Ack=715 Win=64256 Len=17 TSval=1045359527 TSecr=3169619213
1711547100.175762892   538 5.264385203    10.10.1.1 → 10.10.1.2    TCP 83 8081 → 55526 [PSH, ACK] Seq=715 Ack=732 Win=65152 Len=17 TSval=3169619236 TSecr=1045359527
1711547107.175762892   545 5.278712704    10.10.1.2 → 10.10.1.1    TCP 83 55526 → 8081 [PSH, ACK] Seq=732 Ack=732 Win=64256 Len=17 TSval=1045359542 TSecr=3169619236
1711547110.175762892   548 5.278842595    10.10.1.1 → 10.10.1.2    TCP 83 8081 → 55526 [PSH, ACK] Seq=732 Ack=749 Win=65152 Len=17 TSval=3169619250 TSecr=1045359542
1711547117.175762892   555 5.282296396    10.10.1.2 → 10.10.1.1    TCP 83 55526 → 8081 [PSH, ACK] Seq=749 Ack=749 Win=64256 Len=17 TSval=1045359545 TSecr=3169619250
1711547120.175762892   558 5.282423587    10.10.1.1 → 10.10.1.2    TCP 83 8081 → 55526 [PSH, ACK] Seq=749 Ack=766 Win=65152 Len=17 TSval=3169619254 TSecr=1045359545
1711547130.175762892   568 5.607037411    10.10.1.2 → 10.10.1.1    TCP 83 55526 → 8081 [PSH, ACK] Seq=766 Ack=766 Win=64256 Len=17 TSval=1045359870 TSecr=3169619254
1711547133.175762892   571 5.607157849    10.10.1.1 → 10.10.1.2    TCP 83 8081 → 55526 [PSH, ACK] Seq=766 Ack=783 Win=65152 Len=17 TSval=3169619579 TSecr=1045359870
1711547142.175762892   580 5.705214342    10.10.1.2 → 10.10.1.1    TCP 83 55526 → 8081 [PSH, ACK] Seq=783 Ack=783 Win=64256 Len=17 TSval=1045359968 TSecr=3169619579
1711547145.175762892   583 5.705339420    10.10.1.1 → 10.10.1.2    TCP 83 8081 → 55526 [PSH, ACK] Seq=783 Ack=800 Win=65152 Len=17 TSval=3169619677 TSecr=1045359968
1711547154.175762892   592 5.785434422    10.10.1.2 → 10.10.1.1    TCP 83 55526 → 8081 [PSH, ACK] Seq=800 Ack=800 Win=64256 Len=17 TSval=1045360049 TSecr=3169619677
1711547157.175762892   595 5.785561151    10.10.1.1 → 10.10.1.2    TCP 83 8081 → 55526 [PSH, ACK] Seq=800 Ack=817 Win=65152 Len=17 TSval=3169619757 TSecr=1045360049
1711547166.175762892   604 6.172309250    10.10.1.2 → 10.10.1.1    TCP 83 55526 → 8081 [PSH, ACK] Seq=817 Ack=817 Win=64256 Len=17 TSval=1045360435 TSecr=3169619757
1711547169.175762892   607 6.172429394    10.10.1.1 → 10.10.1.2    TCP 83 8081 → 55526 [PSH, ACK] Seq=817 Ack=834 Win=65152 Len=17 TSval=3169620144 TSecr=1045360435
1711547178.175762892   616 6.195468582    10.10.1.2 → 10.10.1.1    TCP 83 55526 → 8081 [PSH, ACK] Seq=834 Ack=834 Win=64256 Len=17 TSval=1045360459 TSecr=3169620144
1711547181.175762892   619 6.195593683    10.10.1.1 → 10.10.1.2    TCP 83 8081 → 55526 [PSH, ACK] Seq=834 Ack=851 Win=65152 Len=17 TSval=3169620167 TSecr=1045360459
1711547188.175762892   626 6.231630724    10.10.1.2 → 10.10.1.1    TCP 83 55526 → 8081 [PSH, ACK] Seq=851 Ack=851 Win=64256 Len=17 TSval=1045360495 TSecr=3169620167
1711547191.175762892   629 6.231761853    10.10.1.1 → 10.10.1.2    TCP 83 8081 → 55526 [PSH, ACK] Seq=851 Ack=868 Win=65152 Len=17 TSval=3169620203 TSecr=1045360495
1711547198.175762892   636 6.243309708    10.10.1.2 → 10.10.1.1    TCP 83 55526 → 8081 [PSH, ACK] Seq=868 Ack=868 Win=64256 Len=17 TSval=1045360506 TSecr=3169620203
1711547201.175762892   639 6.243440150    10.10.1.1 → 10.10.1.2    TCP 83 8081 → 55526 [PSH, ACK] Seq=868 Ack=885 Win=65152 Len=17 TSval=3169620215 TSecr=1045360506
1711547208.175762892   646 6.257016073    10.10.1.2 → 10.10.1.1    TCP 83 55526 → 8081 [PSH, ACK] Seq=885 Ack=885 Win=64256 Len=17 TSval=1045360520 TSecr=3169620215
1711547211.175762892   649 6.257147801    10.10.1.1 → 10.10.1.2    TCP 83 8081 → 55526 [PSH, ACK] Seq=885 Ack=902 Win=65152 Len=17 TSval=3169620229 TSecr=1045360520
1711547218.175762892   656 6.269908904    10.10.1.2 → 10.10.1.1    TCP 83 55526 → 8081 [PSH, ACK] Seq=902 Ack=902 Win=64256 Len=17 TSval=1045360533 TSecr=3169620229
1711547221.175762892   659 6.270039986    10.10.1.1 → 10.10.1.2    TCP 83 8081 → 55526 [PSH, ACK] Seq=902 Ack=919 Win=65152 Len=17 TSval=3169620242 TSecr=1045360533
1711547230.175762892   668 6.424014255    10.10.1.2 → 10.10.1.1    TCP 83 55526 → 8081 [PSH, ACK] Seq=919 Ack=919 Win=64256 Len=17 TSval=1045360687 TSecr=3169620242
1711547233.175762892   671 6.424140417    10.10.1.1 → 10.10.1.2    TCP 83 8081 → 55526 [PSH, ACK] Seq=919 Ack=936 Win=65152 Len=17 TSval=3169620396 TSecr=1045360687
1711547242.175762892   680 6.544922538    10.10.1.2 → 10.10.1.1    TCP 83 55526 → 8081 [PSH, ACK] Seq=936 Ack=936 Win=64256 Len=17 TSval=1045360808 TSecr=3169620396
1711547245.175762892   683 6.545048352    10.10.1.1 → 10.10.1.2    TCP 83 8081 → 55526 [PSH, ACK] Seq=936 Ack=953 Win=65152 Len=17 TSval=3169620517 TSecr=1045360808
1711547254.175762892   692 6.551703377    10.10.1.2 → 10.10.1.1    TCP 83 55526 → 8081 [PSH, ACK] Seq=953 Ack=953 Win=64256 Len=17 TSval=1045360815 TSecr=3169620517
1711547257.175762892   695 6.551883039    10.10.1.1 → 10.10.1.2    TCP 83 8081 → 55526 [PSH, ACK] Seq=953 Ack=970 Win=65152 Len=17 TSval=3169620524 TSecr=1045360815
1711547266.175762892   704 6.598897268    10.10.1.2 → 10.10.1.1    TCP 83 55526 → 8081 [PSH, ACK] Seq=970 Ack=970 Win=64256 Len=17 TSval=1045360862 TSecr=3169620524
1711547269.175762892   707 6.599022914    10.10.1.1 → 10.10.1.2    TCP 83 8081 → 55526 [PSH, ACK] Seq=970 Ack=987 Win=65152 Len=17 TSval=3169620571 TSecr=1045360862
1711547278.175762892   716 6.644021860    10.10.1.2 → 10.10.1.1    TCP 83 55526 → 8081 [PSH, ACK] Seq=987 Ack=987 Win=64256 Len=17 TSval=1045360907 TSecr=3169620571
1711547281.175762892   719 6.644146570    10.10.1.1 → 10.10.1.2    TCP 83 8081 → 55526 [PSH, ACK] Seq=987 Ack=1004 Win=65152 Len=17 TSval=3169620616 TSecr=1045360907
1711547290.175762892   728 6.725068936    10.10.1.2 → 10.10.1.1    TCP 83 55526 → 8081 [PSH, ACK] Seq=1004 Ack=1004 Win=64256 Len=17 TSval=1045360988 TSecr=3169620616
1711547293.175762892   731 6.725197872    10.10.1.1 → 10.10.1.2    TCP 83 8081 → 55526 [PSH, ACK] Seq=1004 Ack=1021 Win=65152 Len=17 TSval=3169620697 TSecr=1045360988
1711547301.175762892   739 6.725674764    10.10.1.2 → 10.10.1.1    TCP 83 55526 → 8081 [PSH, ACK] Seq=1021 Ack=1021 Win=64256 Len=17 TSval=1045360989 TSecr=3169620697
1711547303.175762892   741 6.725706595    10.10.1.1 → 10.10.1.2    TCP 83 8081 → 55526 [PSH, ACK] Seq=1021 Ack=1038 Win=65152 Len=17 TSval=3169620697 TSecr=1045360989
1711547313.175762892   751 6.813583037    10.10.1.2 → 10.10.1.1    TCP 83 55526 → 8081 [PSH, ACK] Seq=1038 Ack=1038 Win=64256 Len=17 TSval=1045361077 TSecr=3169620697
1711547316.175762892   754 6.813708636    10.10.1.1 → 10.10.1.2    TCP 83 8081 → 55526 [PSH, ACK] Seq=1038 Ack=1055 Win=65152 Len=17 TSval=3169620785 TSecr=1045361077
1711547325.175762892   763 7.087380623    10.10.1.2 → 10.10.1.1    TCP 83 55526 → 8081 [PSH, ACK] Seq=1055 Ack=1055 Win=64256 Len=17 TSval=1045361350 TSecr=3169620785
1711547328.175762892   766 7.087502037    10.10.1.1 → 10.10.1.2    TCP 83 8081 → 55526 [PSH, ACK] Seq=1055 Ack=1072 Win=65152 Len=17 TSval=3169621059 TSecr=1045361350
1711547337.175762892   775 7.346070179    10.10.1.2 → 10.10.1.1    TCP 83 55526 → 8081 [PSH, ACK] Seq=1072 Ack=1072 Win=64256 Len=17 TSval=1045361609 TSecr=3169621059
1711547340.175762892   778 7.346194420    10.10.1.1 → 10.10.1.2    TCP 83 8081 → 55526 [PSH, ACK] Seq=1072 Ack=1089 Win=65152 Len=17 TSval=3169621318 TSecr=1045361609
1711547350.175762892   788 7.607366229    10.10.1.2 → 10.10.1.1    TCP 83 55526 → 8081 [PSH, ACK] Seq=1089 Ack=1089 Win=64256 Len=17 TSval=1045361870 TSecr=3169621318
1711547353.175762892   791 7.607486949    10.10.1.1 → 10.10.1.2    TCP 83 8081 → 55526 [PSH, ACK] Seq=1089 Ack=1106 Win=65152 Len=17 TSval=3169621579 TSecr=1045361870
1711547362.175762892   800 7.610263992    10.10.1.2 → 10.10.1.1    TCP 83 55526 → 8081 [PSH, ACK] Seq=1106 Ack=1106 Win=64256 Len=17 TSval=1045361873 TSecr=3169621579
1711547365.175762892   803 7.610388041    10.10.1.1 → 10.10.1.2    TCP 83 8081 → 55526 [PSH, ACK] Seq=1106 Ack=1123 Win=65152 Len=17 TSval=3169621582 TSecr=1045361873
1711547372.175762892   810 7.634617247    10.10.1.2 → 10.10.1.1    TCP 83 55526 → 8081 [PSH, ACK] Seq=1123 Ack=1123 Win=64256 Len=17 TSval=1045361898 TSecr=3169621582
1711547375.175762892   813 7.634747624    10.10.1.1 → 10.10.1.2    TCP 83 8081 → 55526 [PSH, ACK] Seq=1123 Ack=1140 Win=65152 Len=17 TSval=3169621606 TSecr=1045361898
1711547382.175762892   820 7.666175389    10.10.1.2 → 10.10.1.1    TCP 83 55526 → 8081 [PSH, ACK] Seq=1140 Ack=1140 Win=64256 Len=17 TSval=1045361929 TSecr=3169621606
1711547385.175762892   823 7.666306037    10.10.1.1 → 10.10.1.2    TCP 83 8081 → 55526 [PSH, ACK] Seq=1140 Ack=1157 Win=65152 Len=17 TSval=3169621638 TSecr=1045361929
1711547392.175762892   830 7.674877802    10.10.1.2 → 10.10.1.1    TCP 83 55526 → 8081 [PSH, ACK] Seq=1157 Ack=1157 Win=64256 Len=17 TSval=1045361938 TSecr=3169621638
1711547395.175762892   833 7.675007838    10.10.1.1 → 10.10.1.2    TCP 83 8081 → 55526 [PSH, ACK] Seq=1157 Ack=1174 Win=65152 Len=17 TSval=3169621647 TSecr=1045361938
1711547404.175762892   842 7.824347783    10.10.1.2 → 10.10.1.1    TCP 83 55526 → 8081 [PSH, ACK] Seq=1174 Ack=1174 Win=64256 Len=17 TSval=1045362087 TSecr=3169621647
1711547407.175762892   845 7.824473337    10.10.1.1 → 10.10.1.2    TCP 83 8081 → 55526 [PSH, ACK] Seq=1174 Ack=1191 Win=65152 Len=17 TSval=3169621796 TSecr=1045362087
1711547416.175762892   854 7.939268271    10.10.1.2 → 10.10.1.1    TCP 83 55526 → 8081 [PSH, ACK] Seq=1191 Ack=1191 Win=64256 Len=17 TSval=1045362202 TSecr=3169621796
1711547419.175762892   857 7.939393185    10.10.1.1 → 10.10.1.2    TCP 83 8081 → 55526 [PSH, ACK] Seq=1191 Ack=1208 Win=65152 Len=17 TSval=3169621911 TSecr=1045362202
1711547423.175762892   861 7.939503050    10.10.1.2 → 10.10.1.1    TCP 83 55526 → 8081 [PSH, ACK] Seq=1208 Ack=1208 Win=64256 Len=17 TSval=1045362203 TSecr=3169621911
1711547425.175762892   863 7.939537967    10.10.1.1 → 10.10.1.2    TCP 83 8081 → 55526 [PSH, ACK] Seq=1208 Ack=1225 Win=65152 Len=17 TSval=3169621911 TSecr=1045362203
1711547435.175762892   873 7.984427059    10.10.1.2 → 10.10.1.1    TCP 83 55526 → 8081 [PSH, ACK] Seq=1225 Ack=1225 Win=64256 Len=17 TSval=1045362248 TSecr=3169621911
1711547437.175762892   875 7.984554163    10.10.1.1 → 10.10.1.2    TCP 83 8081 → 55526 [PSH, ACK] Seq=1225 Ack=1242 Win=65152 Len=17 TSval=3169621956 TSecr=1045362248
1711547447.175762892   885 8.201346482    10.10.1.2 → 10.10.1.1    TCP 83 55526 → 8081 [PSH, ACK] Seq=1242 Ack=1242 Win=64256 Len=17 TSval=1045362464 TSecr=3169621956
1711547450.175762892   888 8.201472101    10.10.1.1 → 10.10.1.2    TCP 83 8081 → 55526 [PSH, ACK] Seq=1242 Ack=1259 Win=65152 Len=17 TSval=3169622173 TSecr=1045362464
1711547459.175762892   897 8.215805802    10.10.1.2 → 10.10.1.1    TCP 83 55526 → 8081 [PSH, ACK] Seq=1259 Ack=1259 Win=64256 Len=17 TSval=1045362479 TSecr=3169622173
1711547462.175762892   900 8.215932064    10.10.1.1 → 10.10.1.2    TCP 83 8081 → 55526 [PSH, ACK] Seq=1259 Ack=1276 Win=65152 Len=17 TSval=3169622188 TSecr=1045362479
1711547471.175762892   909 8.266053428    10.10.1.2 → 10.10.1.1    TCP 83 55526 → 8081 [PSH, ACK] Seq=1276 Ack=1276 Win=64256 Len=17 TSval=1045362529 TSecr=3169622188
1711547474.175762892   912 8.266179333    10.10.1.1 → 10.10.1.2    TCP 83 8081 → 55526 [PSH, ACK] Seq=1276 Ack=1293 Win=65152 Len=17 TSval=3169622238 TSecr=1045362529
1711547483.175762892   921 8.453688497    10.10.1.2 → 10.10.1.1    TCP 83 55526 → 8081 [PSH, ACK] Seq=1293 Ack=1293 Win=64256 Len=17 TSval=1045362717 TSecr=3169622238
1711547486.175762892   924 8.453814966    10.10.1.1 → 10.10.1.2    TCP 83 8081 → 55526 [PSH, ACK] Seq=1293 Ack=1310 Win=65152 Len=17 TSval=3169622425 TSecr=1045362717
1711547495.175762892   933 8.594968670    10.10.1.2 → 10.10.1.1    TCP 83 55526 → 8081 [PSH, ACK] Seq=1310 Ack=1310 Win=64256 Len=17 TSval=1045362858 TSecr=3169622425
1711547498.175762892   936 8.595093605    10.10.1.1 → 10.10.1.2    TCP 83 8081 → 55526 [PSH, ACK] Seq=1310 Ack=1327 Win=65152 Len=17 TSval=3169622567 TSecr=1045362858
1711547507.175762892   945 8.881758975    10.10.1.2 → 10.10.1.1    TCP 83 55526 → 8081 [PSH, ACK] Seq=1327 Ack=1327 Win=64256 Len=17 TSval=1045363145 TSecr=3169622567
1711547510.175762892   948 8.881901903    10.10.1.1 → 10.10.1.2    TCP 83 8081 → 55526 [PSH, ACK] Seq=1327 Ack=1344 Win=65152 Len=17 TSval=3169622854 TSecr=1045363145
1711547519.175762892   957 9.056627531    10.10.1.2 → 10.10.1.1    TCP 83 55526 → 8081 [PSH, ACK] Seq=1344 Ack=1344 Win=64256 Len=17 TSval=1045363320 TSecr=3169622854
1711547522.175762892   960 9.056753700    10.10.1.1 → 10.10.1.2    TCP 83 8081 → 55526 [PSH, ACK] Seq=1344 Ack=1361 Win=65152 Len=17 TSval=3169623028 TSecr=1045363320
1711547531.175762892   969 9.378176648    10.10.1.2 → 10.10.1.1    TCP 83 55526 → 8081 [PSH, ACK] Seq=1361 Ack=1361 Win=64256 Len=17 TSval=1045363641 TSecr=3169623028
1711547534.175762892   972 9.378299795    10.10.1.1 → 10.10.1.2    TCP 83 8081 → 55526 [PSH, ACK] Seq=1361 Ack=1378 Win=65152 Len=17 TSval=3169623350 TSecr=1045363641
1711547543.175762892   981 9.406495477    10.10.1.2 → 10.10.1.1    TCP 83 55526 → 8081 [PSH, ACK] Seq=1378 Ack=1378 Win=64256 Len=17 TSval=1045363670 TSecr=3169623350
1711547546.175762892   984 9.406619461    10.10.1.1 → 10.10.1.2    TCP 83 8081 → 55526 [PSH, ACK] Seq=1378 Ack=1395 Win=65152 Len=17 TSval=3169623378 TSecr=1045363670
1711547556.175762892   994 9.676366112    10.10.1.2 → 10.10.1.1    TCP 83 55526 → 8081 [PSH, ACK] Seq=1395 Ack=1395 Win=64256 Len=17 TSval=1045363939 TSecr=3169623378
1711547559.175762892   997 9.676487450    10.10.1.1 → 10.10.1.2    TCP 83 8081 → 55526 [PSH, ACK] Seq=1395 Ack=1412 Win=65152 Len=17 TSval=3169623648 TSecr=1045363939
1711547568.175762892  1006 9.685556203    10.10.1.2 → 10.10.1.1    TCP 83 55526 → 8081 [PSH, ACK] Seq=1412 Ack=1412 Win=64256 Len=17 TSval=1045363949 TSecr=3169623648
1711547571.175762892  1009 9.685680671    10.10.1.1 → 10.10.1.2    TCP 83 8081 → 55526 [PSH, ACK] Seq=1412 Ack=1429 Win=65152 Len=17 TSval=3169623657 TSecr=1045363949
1711547580.175762892  1018 9.730825113    10.10.1.2 → 10.10.1.1    TCP 83 55526 → 8081 [PSH, ACK] Seq=1429 Ack=1429 Win=64256 Len=17 TSval=1045363994 TSecr=3169623657
1711547583.175762892  1021 9.730948898    10.10.1.1 → 10.10.1.2    TCP 83 8081 → 55526 [PSH, ACK] Seq=1429 Ack=1446 Win=65152 Len=17 TSval=3169623703 TSecr=1045363994
1711547592.175762892  1030 9.857600930    10.10.1.2 → 10.10.1.1    TCP 83 55526 → 8081 [PSH, ACK] Seq=1446 Ack=1446 Win=64256 Len=17 TSval=1045364121 TSecr=3169623703
1711547595.175762892  1033 9.857726574    10.10.1.1 → 10.10.1.2    TCP 83 8081 → 55526 [PSH, ACK] Seq=1446 Ack=1463 Win=65152 Len=17 TSval=3169623829 TSecr=1045364121
1711547604.175762892  1042 10.011754737    10.10.1.2 → 10.10.1.1    TCP 83 55526 → 8081 [PSH, ACK] Seq=1463 Ack=1463 Win=64256 Len=17 TSval=1045364275 TSecr=3169623829
1711547607.175762892  1045 10.011879764    10.10.1.1 → 10.10.1.2    TCP 83 8081 → 55526 [PSH, ACK] Seq=1463 Ack=1480 Win=65152 Len=17 TSval=3169623984 TSecr=1045364275
1711547616.175762892  1054 10.067310287    10.10.1.2 → 10.10.1.1    TCP 83 55526 → 8081 [PSH, ACK] Seq=1480 Ack=1480 Win=64256 Len=17 TSval=1045364330 TSecr=3169623984
1711547619.175762892  1057 10.067434134    10.10.1.1 → 10.10.1.2    TCP 83 8081 → 55526 [PSH, ACK] Seq=1480 Ack=1497 Win=65152 Len=17 TSval=3169624039 TSecr=1045364330
1711547628.175762892  1066 10.077223711    10.10.1.2 → 10.10.1.1    TCP 83 55526 → 8081 [PSH, ACK] Seq=1497 Ack=1497 Win=64256 Len=17 TSval=1045364340 TSecr=3169624039
1711547631.175762892  1069 10.077348503    10.10.1.1 → 10.10.1.2    TCP 83 8081 → 55526 [PSH, ACK] Seq=1497 Ack=1514 Win=65152 Len=17 TSval=3169624049 TSecr=1045364340
1711547638.175762892  1076 10.093373083    10.10.1.2 → 10.10.1.1    TCP 83 55526 → 8081 [PSH, ACK] Seq=1514 Ack=1514 Win=64256 Len=17 TSval=1045364356 TSecr=3169624049
1711547641.175762892  1079 10.093502951    10.10.1.1 → 10.10.1.2    TCP 83 8081 → 55526 [PSH, ACK] Seq=1514 Ack=1531 Win=65152 Len=17 TSval=3169624065 TSecr=1045364356
1711547650.175762892  1088 10.475723255    10.10.1.2 → 10.10.1.1    TCP 83 55526 → 8081 [PSH, ACK] Seq=1531 Ack=1531 Win=64256 Len=17 TSval=1045364739 TSecr=3169624065
1711547653.175762892  1091 10.475844842    10.10.1.1 → 10.10.1.2    TCP 83 8081 → 55526 [PSH, ACK] Seq=1531 Ack=1548 Win=65152 Len=17 TSval=3169624447 TSecr=1045364739
1711547662.175762892  1100 10.485974494    10.10.1.2 → 10.10.1.1    TCP 83 55526 → 8081 [PSH, ACK] Seq=1548 Ack=1548 Win=64256 Len=17 TSval=1045364749 TSecr=3169624447
1711547665.175762892  1103 10.486098607    10.10.1.1 → 10.10.1.2    TCP 83 8081 → 55526 [PSH, ACK] Seq=1548 Ack=1565 Win=65152 Len=17 TSval=3169624458 TSecr=1045364749
1711547674.175762892  1112 10.617250169    10.10.1.2 → 10.10.1.1    TCP 83 55526 → 8081 [PSH, ACK] Seq=1565 Ack=1565 Win=64256 Len=17 TSval=1045364880 TSecr=3169624458
1711547677.175762892  1115 10.617374530    10.10.1.1 → 10.10.1.2    TCP 83 8081 → 55526 [PSH, ACK] Seq=1565 Ack=1582 Win=65152 Len=17 TSval=3169624589 TSecr=1045364880
1711547686.175762892  1124 10.861949690    10.10.1.2 → 10.10.1.1    TCP 83 55526 → 8081 [PSH, ACK] Seq=1582 Ack=1582 Win=64256 Len=17 TSval=1045365125 TSecr=3169624589
1711547689.175762892  1127 10.862070121    10.10.1.1 → 10.10.1.2    TCP 83 8081 → 55526 [PSH, ACK] Seq=1582 Ack=1599 Win=65152 Len=17 TSval=3169624834 TSecr=1045365125
1711547698.175762892  1136 10.864190812    10.10.1.2 → 10.10.1.1    TCP 83 55526 → 8081 [PSH, ACK] Seq=1599 Ack=1599 Win=64256 Len=17 TSval=1045365127 TSecr=3169624834
1711547701.175762892  1139 10.864306499    10.10.1.1 → 10.10.1.2    TCP 83 8081 → 55526 [PSH, ACK] Seq=1599 Ack=1616 Win=65152 Len=17 TSval=3169624836 TSecr=1045365127
1711547710.175762892  1148 10.971366543    10.10.1.2 → 10.10.1.1    TCP 83 55526 → 8081 [PSH, ACK] Seq=1616 Ack=1616 Win=64256 Len=17 TSval=1045365234 TSecr=3169624836
1711547713.175762892  1151 10.971490881    10.10.1.1 → 10.10.1.2    TCP 83 8081 → 55526 [PSH, ACK] Seq=1616 Ack=1633 Win=65152 Len=17 TSval=3169624943 TSecr=1045365234
1711547722.175762892  1160 11.250436863    10.10.1.2 → 10.10.1.1    TCP 83 55526 → 8081 [PSH, ACK] Seq=1633 Ack=1633 Win=64256 Len=17 TSval=1045365514 TSecr=3169624943
1711547725.175762892  1163 11.250557885    10.10.1.1 → 10.10.1.2    TCP 83 8081 → 55526 [PSH, ACK] Seq=1633 Ack=1650 Win=65152 Len=17 TSval=3169625222 TSecr=1045365514
1711547734.175762892  1172 11.277213625    10.10.1.2 → 10.10.1.1    TCP 83 55526 → 8081 [PSH, ACK] Seq=1650 Ack=1650 Win=64256 Len=17 TSval=1045365540 TSecr=3169625222
1711547737.175762892  1175 11.277338793    10.10.1.1 → 10.10.1.2    TCP 83 8081 → 55526 [PSH, ACK] Seq=1650 Ack=1667 Win=65152 Len=17 TSval=3169625249 TSecr=1045365540
1711547747.175762892  1185 11.535935799    10.10.1.2 → 10.10.1.1    TCP 83 55526 → 8081 [PSH, ACK] Seq=1667 Ack=1667 Win=64256 Len=17 TSval=1045365799 TSecr=3169625249
1711547750.175762892  1188 11.536059080    10.10.1.1 → 10.10.1.2    TCP 83 8081 → 55526 [PSH, ACK] Seq=1667 Ack=1684 Win=65152 Len=17 TSval=3169625508 TSecr=1045365799
1711547759.175762892  1197 11.538149007    10.10.1.2 → 10.10.1.1    TCP 83 55526 → 8081 [PSH, ACK] Seq=1684 Ack=1684 Win=64256 Len=17 TSval=1045365801 TSecr=3169625508
1711547762.175762892  1200 11.538275660    10.10.1.1 → 10.10.1.2    TCP 83 8081 → 55526 [PSH, ACK] Seq=1684 Ack=1701 Win=65152 Len=17 TSval=3169625510 TSecr=1045365801
1711547769.175762892  1207 11.539215167    10.10.1.2 → 10.10.1.1    TCP 83 55526 → 8081 [PSH, ACK] Seq=1701 Ack=1701 Win=64256 Len=17 TSval=1045365802 TSecr=3169625510
1711547772.175762892  1210 11.539339768    10.10.1.1 → 10.10.1.2    TCP 83 8081 → 55526 [PSH, ACK] Seq=1701 Ack=1718 Win=65152 Len=17 TSval=3169625511 TSecr=1045365802
1711547781.175762892  1219 11.632823445    10.10.1.2 → 10.10.1.1    TCP 83 55526 → 8081 [PSH, ACK] Seq=1718 Ack=1718 Win=64256 Len=17 TSval=1045365896 TSecr=3169625511
1711547784.175762892  1222 11.632948156    10.10.1.1 → 10.10.1.2    TCP 83 8081 → 55526 [PSH, ACK] Seq=1718 Ack=1735 Win=65152 Len=17 TSval=3169625605 TSecr=1045365896
1711547793.175762892  1231 11.635042151    10.10.1.2 → 10.10.1.1    TCP 83 55526 → 8081 [PSH, ACK] Seq=1735 Ack=1735 Win=64256 Len=17 TSval=1045365898 TSecr=3169625605
1711547796.175762892  1234 11.635165995    10.10.1.1 → 10.10.1.2    TCP 83 8081 → 55526 [PSH, ACK] Seq=1735 Ack=1752 Win=65152 Len=17 TSval=3169625607 TSecr=1045365898
1711547805.175762892  1243 11.681229214    10.10.1.2 → 10.10.1.1    TCP 83 55526 → 8081 [PSH, ACK] Seq=1752 Ack=1752 Win=64256 Len=17 TSval=1045365944 TSecr=3169625607
1711547808.175762892  1246 11.681354110    10.10.1.1 → 10.10.1.2    TCP 83 8081 → 55526 [PSH, ACK] Seq=1752 Ack=1769 Win=65152 Len=17 TSval=3169625653 TSecr=1045365944
1711547817.175762892  1255 11.749268425    10.10.1.2 → 10.10.1.1    TCP 83 55526 → 8081 [PSH, ACK] Seq=1769 Ack=1769 Win=64256 Len=17 TSval=1045366012 TSecr=3169625653
1711547820.175762892  1258 11.749392662    10.10.1.1 → 10.10.1.2    TCP 83 8081 → 55526 [PSH, ACK] Seq=1769 Ack=1786 Win=65152 Len=17 TSval=3169625721 TSecr=1045366012
1711547829.175762892  1267 11.765887358    10.10.1.2 → 10.10.1.1    TCP 83 55526 → 8081 [PSH, ACK] Seq=1786 Ack=1786 Win=64256 Len=17 TSval=1045366029 TSecr=3169625721
1711547832.175762892  1270 11.766013870    10.10.1.1 → 10.10.1.2    TCP 83 8081 → 55526 [PSH, ACK] Seq=1786 Ack=1803 Win=65152 Len=17 TSval=3169625738 TSecr=1045366029
1711547841.175762892  1279 11.909203953    10.10.1.2 → 10.10.1.1    TCP 83 55526 → 8081 [PSH, ACK] Seq=1803 Ack=1803 Win=64256 Len=17 TSval=1045366172 TSecr=3169625738
1711547844.175762892  1282 11.909329665    10.10.1.1 → 10.10.1.2    TCP 83 8081 → 55526 [PSH, ACK] Seq=1803 Ack=1820 Win=65152 Len=17 TSval=3169625881 TSecr=1045366172
1711547853.175762892  1291 11.950819404    10.10.1.2 → 10.10.1.1    TCP 83 55526 → 8081 [PSH, ACK] Seq=1820 Ack=1820 Win=64256 Len=17 TSval=1045366214 TSecr=3169625881
1711547856.175762892  1294 11.950944119    10.10.1.1 → 10.10.1.2    TCP 83 8081 → 55526 [PSH, ACK] Seq=1820 Ack=1837 Win=65152 Len=17 TSval=3169625923 TSecr=1045366214
1711547865.175762892  1303 12.187531608    10.10.1.2 → 10.10.1.1    TCP 83 55526 → 8081 [PSH, ACK] Seq=1837 Ack=1837 Win=64256 Len=17 TSval=1045366451 TSecr=3169625923
1711547868.175762892  1306 12.187652205    10.10.1.1 → 10.10.1.2    TCP 83 8081 → 55526 [PSH, ACK] Seq=1837 Ack=1854 Win=65152 Len=17 TSval=3169626159 TSecr=1045366451
1711547877.175762892  1315 12.309478341    10.10.1.2 → 10.10.1.1    TCP 83 55526 → 8081 [PSH, ACK] Seq=1854 Ack=1854 Win=64256 Len=17 TSval=1045366573 TSecr=3169626159
1711547880.175762892  1318 12.309604072    10.10.1.1 → 10.10.1.2    TCP 83 8081 → 55526 [PSH, ACK] Seq=1854 Ack=1871 Win=65152 Len=17 TSval=3169626281 TSecr=1045366573
1711547889.175762892  1327 12.327677867    10.10.1.2 → 10.10.1.1    TCP 83 55526 → 8081 [PSH, ACK] Seq=1871 Ack=1871 Win=64256 Len=17 TSval=1045366591 TSecr=3169626281
1711547892.175762892  1330 12.327803478    10.10.1.1 → 10.10.1.2    TCP 83 8081 → 55526 [PSH, ACK] Seq=1871 Ack=1888 Win=65152 Len=17 TSval=3169626299 TSecr=1045366591
1711547901.175762892  1339 12.528752313    10.10.1.2 → 10.10.1.1    TCP 83 55526 → 8081 [PSH, ACK] Seq=1888 Ack=1888 Win=64256 Len=17 TSval=1045366792 TSecr=3169626299
1711547904.175762892  1342 12.528879130    10.10.1.1 → 10.10.1.2    TCP 83 8081 → 55526 [PSH, ACK] Seq=1888 Ack=1905 Win=65152 Len=17 TSval=3169626501 TSecr=1045366792
1711547913.175762892  1351 12.824091909    10.10.1.2 → 10.10.1.1    TCP 83 55526 → 8081 [PSH, ACK] Seq=1905 Ack=1905 Win=64256 Len=17 TSval=1045367087 TSecr=3169626501
1711547916.175762892  1354 12.824214261    10.10.1.1 → 10.10.1.2    TCP 83 8081 → 55526 [PSH, ACK] Seq=1905 Ack=1922 Win=65152 Len=17 TSval=3169626796 TSecr=1045367087
1711547925.175762892  1363 12.834526506    10.10.1.2 → 10.10.1.1    TCP 83 55526 → 8081 [PSH, ACK] Seq=1922 Ack=1922 Win=64256 Len=17 TSval=1045367098 TSecr=3169626796
1711547928.175762892  1366 12.834714881    10.10.1.1 → 10.10.1.2    TCP 83 8081 → 55526 [PSH, ACK] Seq=1922 Ack=1939 Win=65152 Len=17 TSval=3169626806 TSecr=1045367098
1711547937.175762892  1375 13.135257082    10.10.1.2 → 10.10.1.1    TCP 83 55526 → 8081 [PSH, ACK] Seq=1939 Ack=1939 Win=64256 Len=17 TSval=1045367398 TSecr=3169626806
1711547940.175762892  1378 13.135379264    10.10.1.1 → 10.10.1.2    TCP 83 8081 → 55526 [PSH, ACK] Seq=1939 Ack=1956 Win=65152 Len=17 TSval=3169627107 TSecr=1045367398
1711547949.175762892  1387 13.172645890    10.10.1.2 → 10.10.1.1    TCP 83 55526 → 8081 [PSH, ACK] Seq=1956 Ack=1956 Win=64256 Len=17 TSval=1045367436 TSecr=3169627107
1711547952.175762892  1390 13.172770705    10.10.1.1 → 10.10.1.2    TCP 83 8081 → 55526 [PSH, ACK] Seq=1956 Ack=1973 Win=65152 Len=17 TSval=3169627144 TSecr=1045367436
1711547961.175762892  1399 13.340959262    10.10.1.2 → 10.10.1.1    TCP 83 55526 → 8081 [PSH, ACK] Seq=1973 Ack=1973 Win=64256 Len=17 TSval=1045367604 TSecr=3169627144
1711547964.175762892  1402 13.341085531    10.10.1.1 → 10.10.1.2    TCP 83 8081 → 55526 [PSH, ACK] Seq=1973 Ack=1990 Win=65152 Len=17 TSval=3169627313 TSecr=1045367604
1711547974.175762892  1412 13.474326040    10.10.1.2 → 10.10.1.1    TCP 83 55526 → 8081 [PSH, ACK] Seq=1990 Ack=1990 Win=64256 Len=17 TSval=1045367737 TSecr=3169627313
1711547977.175762892  1415 13.474451087    10.10.1.1 → 10.10.1.2    TCP 83 8081 → 55526 [PSH, ACK] Seq=1990 Ack=2007 Win=65152 Len=17 TSval=3169627446 TSecr=1045367737
1711547986.175762892  1424 13.607045551    10.10.1.2 → 10.10.1.1    TCP 83 55526 → 8081 [PSH, ACK] Seq=2007 Ack=2007 Win=64256 Len=17 TSval=1045367870 TSecr=3169627446
1711547989.175762892  1427 13.607173399    10.10.1.1 → 10.10.1.2    TCP 83 8081 → 55526 [PSH, ACK] Seq=2007 Ack=2024 Win=65152 Len=17 TSval=3169627579 TSecr=1045367870
1711547998.175762892  1436 13.842629769    10.10.1.2 → 10.10.1.1    TCP 83 55526 → 8081 [PSH, ACK] Seq=2024 Ack=2024 Win=64256 Len=17 TSval=1045368106 TSecr=3169627579
1711548001.175762892  1439 13.842751054    10.10.1.1 → 10.10.1.2    TCP 83 8081 → 55526 [PSH, ACK] Seq=2024 Ack=2041 Win=65152 Len=17 TSval=3169627814 TSecr=1045368106
