1712183451.219603777    23 0.260539376    10.10.1.2 → 10.10.1.1    TCP 74 45330 → 8081 [SYN] Seq=0 Win=64240 Len=0 MSS=1460 SACK_PERM=1 TSval=1682220513 TSecr=0 WS=128
1712183452.219603777    24 0.260578799    10.10.1.1 → 10.10.1.2    TCP 74 8081 → 45330 [SYN, ACK] Seq=0 Ack=1 Win=65160 Len=0 MSS=1460 SACK_PERM=1 TSval=3806480222 TSecr=1682220513 WS=128
1712183453.219603777    25 0.260676075    10.10.1.2 → 10.10.1.1    TCP 66 45330 → 8081 [ACK] Seq=1 Ack=1 Win=64256 Len=0 TSval=1682220513 TSecr=3806480222
1712183457.219603777    29 0.509812962    10.10.1.2 → 10.10.1.1    TCP 83 45330 → 8081 [PSH, ACK] Seq=1 Ack=1 Win=64256 Len=17 TSval=1682220762 TSecr=3806480222
1712183459.219603777    31 0.509842277    10.10.1.1 → 10.10.1.2    TCP 66 8081 → 45330 [ACK] Seq=1 Ack=18 Win=65152 Len=0 TSval=3806480472 TSecr=1682220762
1712183461.219603777    33 0.510150338    10.10.1.1 → 10.10.1.2    TCP 83 8081 → 45330 [PSH, ACK] Seq=1 Ack=18 Win=65152 Len=17 TSval=3806480472 TSecr=1682220762
1712183462.219603777    34 0.510182578    10.10.1.2 → 10.10.1.1    TCP 66 45330 → 8081 [ACK] Seq=18 Ack=18 Win=64256 Len=0 TSval=1682220763 TSecr=3806480472
1712183466.219603777    38 0.511366542    10.10.1.2 → 10.10.1.1    TCP 83 45330 → 8081 [PSH, ACK] Seq=18 Ack=18 Win=64256 Len=17 TSval=1682220764 TSecr=3806480472
1712183468.219603777    40 0.511495029    10.10.1.1 → 10.10.1.2    TCP 83 8081 → 45330 [PSH, ACK] Seq=18 Ack=35 Win=65152 Len=17 TSval=3806480473 TSecr=1682220764
1712183472.219603777    44 0.512706406    10.10.1.2 → 10.10.1.1    TCP 83 45330 → 8081 [PSH, ACK] Seq=35 Ack=35 Win=64256 Len=17 TSval=1682220765 TSecr=3806480473
1712183474.219603777    46 0.512840192    10.10.1.1 → 10.10.1.2    TCP 83 8081 → 45330 [PSH, ACK] Seq=35 Ack=52 Win=65152 Len=17 TSval=3806480475 TSecr=1682220765
1712183479.219603777    51 0.514046891    10.10.1.2 → 10.10.1.1    TCP 83 45330 → 8081 [PSH, ACK] Seq=52 Ack=52 Win=64256 Len=17 TSval=1682220767 TSecr=3806480475
1712183481.219603777    53 0.514179333    10.10.1.1 → 10.10.1.2    TCP 83 8081 → 45330 [PSH, ACK] Seq=52 Ack=69 Win=65152 Len=17 TSval=3806480476 TSecr=1682220767
1712183485.219603777    57 0.515386474    10.10.1.2 → 10.10.1.1    TCP 83 45330 → 8081 [PSH, ACK] Seq=69 Ack=69 Win=64256 Len=17 TSval=1682220768 TSecr=3806480476
1712183487.219603777    59 0.515516663    10.10.1.1 → 10.10.1.2    TCP 83 8081 → 45330 [PSH, ACK] Seq=69 Ack=86 Win=65152 Len=17 TSval=3806480477 TSecr=1682220768
1712183492.219603777    64 0.516729143    10.10.1.2 → 10.10.1.1    TCP 83 45330 → 8081 [PSH, ACK] Seq=86 Ack=86 Win=64256 Len=17 TSval=1682220769 TSecr=3806480477
1712183494.219603777    66 0.516863518    10.10.1.1 → 10.10.1.2    TCP 83 8081 → 45330 [PSH, ACK] Seq=86 Ack=103 Win=65152 Len=17 TSval=3806480479 TSecr=1682220769
1712183498.219603777    70 0.518069550    10.10.1.2 → 10.10.1.1    TCP 83 45330 → 8081 [PSH, ACK] Seq=103 Ack=103 Win=64256 Len=17 TSval=1682220771 TSecr=3806480479
1712183500.219603777    72 0.518202145    10.10.1.1 → 10.10.1.2    TCP 83 8081 → 45330 [PSH, ACK] Seq=103 Ack=120 Win=65152 Len=17 TSval=3806480480 TSecr=1682220771
1712183505.219603777    77 0.519409088    10.10.1.2 → 10.10.1.1    TCP 83 45330 → 8081 [PSH, ACK] Seq=120 Ack=120 Win=64256 Len=17 TSval=1682220772 TSecr=3806480480
1712183507.219603777    79 0.519536593    10.10.1.1 → 10.10.1.2    TCP 83 8081 → 45330 [PSH, ACK] Seq=120 Ack=137 Win=65152 Len=17 TSval=3806480481 TSecr=1682220772
1712183511.219603777    83 0.520747121    10.10.1.2 → 10.10.1.1    TCP 83 45330 → 8081 [PSH, ACK] Seq=137 Ack=137 Win=64256 Len=17 TSval=1682220773 TSecr=3806480481
1712183513.219603777    85 0.520879080    10.10.1.1 → 10.10.1.2    TCP 83 8081 → 45330 [PSH, ACK] Seq=137 Ack=154 Win=65152 Len=17 TSval=3806480483 TSecr=1682220773
1712183518.219603777    90 0.522084595    10.10.1.2 → 10.10.1.1    TCP 83 45330 → 8081 [PSH, ACK] Seq=154 Ack=154 Win=64256 Len=17 TSval=1682220775 TSecr=3806480483
1712183520.219603777    92 0.522212020    10.10.1.1 → 10.10.1.2    TCP 83 8081 → 45330 [PSH, ACK] Seq=154 Ack=171 Win=65152 Len=17 TSval=3806480484 TSecr=1682220775
1712183524.219603777    96 0.523418983    10.10.1.2 → 10.10.1.1    TCP 83 45330 → 8081 [PSH, ACK] Seq=171 Ack=171 Win=64256 Len=17 TSval=1682220776 TSecr=3806480484
1712183526.219603777    98 0.523546300    10.10.1.1 → 10.10.1.2    TCP 83 8081 → 45330 [PSH, ACK] Seq=171 Ack=188 Win=65152 Len=17 TSval=3806480485 TSecr=1682220776
1712183531.219603777   103 0.524755430    10.10.1.2 → 10.10.1.1    TCP 83 45330 → 8081 [PSH, ACK] Seq=188 Ack=188 Win=64256 Len=17 TSval=1682220777 TSecr=3806480485
1712183533.219603777   105 0.524885782    10.10.1.1 → 10.10.1.2    TCP 83 8081 → 45330 [PSH, ACK] Seq=188 Ack=205 Win=65152 Len=17 TSval=3806480487 TSecr=1682220777
1712183537.219603777   109 0.526090593    10.10.1.2 → 10.10.1.1    TCP 83 45330 → 8081 [PSH, ACK] Seq=205 Ack=205 Win=64256 Len=17 TSval=1682220779 TSecr=3806480487
1712183539.219603777   111 0.526217934    10.10.1.1 → 10.10.1.2    TCP 83 8081 → 45330 [PSH, ACK] Seq=205 Ack=222 Win=65152 Len=17 TSval=3806480488 TSecr=1682220779
1712183544.219603777   116 0.527423390    10.10.1.2 → 10.10.1.1    TCP 83 45330 → 8081 [PSH, ACK] Seq=222 Ack=222 Win=64256 Len=17 TSval=1682220780 TSecr=3806480488
1712183546.219603777   118 0.527550283    10.10.1.1 → 10.10.1.2    TCP 83 8081 → 45330 [PSH, ACK] Seq=222 Ack=239 Win=65152 Len=17 TSval=3806480489 TSecr=1682220780
1712183550.219603777   122 0.528759609    10.10.1.2 → 10.10.1.1    TCP 83 45330 → 8081 [PSH, ACK] Seq=239 Ack=239 Win=64256 Len=17 TSval=1682220781 TSecr=3806480489
1712183552.219603777   124 0.528891243    10.10.1.1 → 10.10.1.2    TCP 83 8081 → 45330 [PSH, ACK] Seq=239 Ack=256 Win=65152 Len=17 TSval=3806480491 TSecr=1682220781
1712183557.219603777   129 0.530096755    10.10.1.2 → 10.10.1.1    TCP 83 45330 → 8081 [PSH, ACK] Seq=256 Ack=256 Win=64256 Len=17 TSval=1682220783 TSecr=3806480491
1712183559.219603777   131 0.530223491    10.10.1.1 → 10.10.1.2    TCP 83 8081 → 45330 [PSH, ACK] Seq=256 Ack=273 Win=65152 Len=17 TSval=3806480492 TSecr=1682220783
1712183563.219603777   135 0.531430583    10.10.1.2 → 10.10.1.1    TCP 83 45330 → 8081 [PSH, ACK] Seq=273 Ack=273 Win=64256 Len=17 TSval=1682220784 TSecr=3806480492
1712183565.219603777   137 0.531557429    10.10.1.1 → 10.10.1.2    TCP 83 8081 → 45330 [PSH, ACK] Seq=273 Ack=290 Win=65152 Len=17 TSval=3806480493 TSecr=1682220784
1712183570.219603777   142 0.532766001    10.10.1.2 → 10.10.1.1    TCP 83 45330 → 8081 [PSH, ACK] Seq=290 Ack=290 Win=64256 Len=17 TSval=1682220785 TSecr=3806480493
1712183572.219603777   144 0.532898548    10.10.1.1 → 10.10.1.2    TCP 83 8081 → 45330 [PSH, ACK] Seq=290 Ack=307 Win=65152 Len=17 TSval=3806480495 TSecr=1682220785
1712183576.219603777   148 0.534103002    10.10.1.2 → 10.10.1.1    TCP 83 45330 → 8081 [PSH, ACK] Seq=307 Ack=307 Win=64256 Len=17 TSval=1682220787 TSecr=3806480495
1712183578.219603777   150 0.534229603    10.10.1.1 → 10.10.1.2    TCP 83 8081 → 45330 [PSH, ACK] Seq=307 Ack=324 Win=65152 Len=17 TSval=3806480496 TSecr=1682220787
1712183583.219603777   155 0.535435745    10.10.1.2 → 10.10.1.1    TCP 83 45330 → 8081 [PSH, ACK] Seq=324 Ack=324 Win=64256 Len=17 TSval=1682220788 TSecr=3806480496
1712183585.219603777   157 0.535561930    10.10.1.1 → 10.10.1.2    TCP 83 8081 → 45330 [PSH, ACK] Seq=324 Ack=341 Win=65152 Len=17 TSval=3806480497 TSecr=1682220788
1712183589.219603777   161 0.536768362    10.10.1.2 → 10.10.1.1    TCP 83 45330 → 8081 [PSH, ACK] Seq=341 Ack=341 Win=64256 Len=17 TSval=1682220789 TSecr=3806480497
1712183591.219603777   163 0.536849443    10.10.1.1 → 10.10.1.2    TCP 83 8081 → 45330 [PSH, ACK] Seq=341 Ack=358 Win=65152 Len=17 TSval=3806480499 TSecr=1682220789
1712183596.219603777   168 0.538052578    10.10.1.2 → 10.10.1.1    TCP 83 45330 → 8081 [PSH, ACK] Seq=358 Ack=358 Win=64256 Len=17 TSval=1682220791 TSecr=3806480499
1712183598.219603777   170 0.538129328    10.10.1.1 → 10.10.1.2    TCP 83 8081 → 45330 [PSH, ACK] Seq=358 Ack=375 Win=65152 Len=17 TSval=3806480500 TSecr=1682220791
1712183602.219603777   174 0.539334311    10.10.1.2 → 10.10.1.1    TCP 83 45330 → 8081 [PSH, ACK] Seq=375 Ack=375 Win=64256 Len=17 TSval=1682220792 TSecr=3806480500
1712183604.219603777   176 0.539411105    10.10.1.1 → 10.10.1.2    TCP 83 8081 → 45330 [PSH, ACK] Seq=375 Ack=392 Win=65152 Len=17 TSval=3806480501 TSecr=1682220792
1712183609.219603777   181 0.540618635    10.10.1.2 → 10.10.1.1    TCP 83 45330 → 8081 [PSH, ACK] Seq=392 Ack=392 Win=64256 Len=17 TSval=1682220793 TSecr=3806480501
1712183611.219603777   183 0.540699302    10.10.1.1 → 10.10.1.2    TCP 83 8081 → 45330 [PSH, ACK] Seq=392 Ack=409 Win=65152 Len=17 TSval=3806480502 TSecr=1682220793
1712183615.219603777   187 0.541901337    10.10.1.2 → 10.10.1.1    TCP 83 45330 → 8081 [PSH, ACK] Seq=409 Ack=409 Win=64256 Len=17 TSval=1682220795 TSecr=3806480502
1712183617.219603777   189 0.541977864    10.10.1.1 → 10.10.1.2    TCP 83 8081 → 45330 [PSH, ACK] Seq=409 Ack=426 Win=65152 Len=17 TSval=3806480504 TSecr=1682220795
1712183622.219603777   194 0.543181952    10.10.1.2 → 10.10.1.1    TCP 83 45330 → 8081 [PSH, ACK] Seq=426 Ack=426 Win=64256 Len=17 TSval=1682220796 TSecr=3806480504
1712183624.219603777   196 0.543258842    10.10.1.1 → 10.10.1.2    TCP 83 8081 → 45330 [PSH, ACK] Seq=426 Ack=443 Win=65152 Len=17 TSval=3806480505 TSecr=1682220796
1712183628.219603777   200 0.544464296    10.10.1.2 → 10.10.1.1    TCP 83 45330 → 8081 [PSH, ACK] Seq=443 Ack=443 Win=64256 Len=17 TSval=1682220797 TSecr=3806480505
1712183630.219603777   202 0.544544850    10.10.1.1 → 10.10.1.2    TCP 83 8081 → 45330 [PSH, ACK] Seq=443 Ack=460 Win=65152 Len=17 TSval=3806480506 TSecr=1682220797
1712183635.219603777   207 0.545747672    10.10.1.2 → 10.10.1.1    TCP 83 45330 → 8081 [PSH, ACK] Seq=460 Ack=460 Win=64256 Len=17 TSval=1682220798 TSecr=3806480506
1712183637.219603777   209 0.545828880    10.10.1.1 → 10.10.1.2    TCP 83 8081 → 45330 [PSH, ACK] Seq=460 Ack=477 Win=65152 Len=17 TSval=3806480508 TSecr=1682220798
1712183641.219603777   213 0.547031455    10.10.1.2 → 10.10.1.1    TCP 83 45330 → 8081 [PSH, ACK] Seq=477 Ack=477 Win=64256 Len=17 TSval=1682220800 TSecr=3806480508
1712183643.219603777   215 0.547112230    10.10.1.1 → 10.10.1.2    TCP 83 8081 → 45330 [PSH, ACK] Seq=477 Ack=494 Win=65152 Len=17 TSval=3806480509 TSecr=1682220800
1712183648.219603777   220 0.548321055    10.10.1.2 → 10.10.1.1    TCP 83 45330 → 8081 [PSH, ACK] Seq=494 Ack=494 Win=64256 Len=17 TSval=1682220801 TSecr=3806480509
1712183650.219603777   222 0.548405277    10.10.1.1 → 10.10.1.2    TCP 83 8081 → 45330 [PSH, ACK] Seq=494 Ack=511 Win=65152 Len=17 TSval=3806480510 TSecr=1682220801
1712183654.219603777   226 0.549608602    10.10.1.2 → 10.10.1.1    TCP 83 45330 → 8081 [PSH, ACK] Seq=511 Ack=511 Win=64256 Len=17 TSval=1682220802 TSecr=3806480510
1712183656.219603777   228 0.549689535    10.10.1.1 → 10.10.1.2    TCP 83 8081 → 45330 [PSH, ACK] Seq=511 Ack=528 Win=65152 Len=17 TSval=3806480511 TSecr=1682220802
1712183661.219603777   233 0.550880121    10.10.1.2 → 10.10.1.1    TCP 83 45330 → 8081 [PSH, ACK] Seq=528 Ack=528 Win=64256 Len=17 TSval=1682220804 TSecr=3806480511
1712183663.219603777   235 0.550956670    10.10.1.1 → 10.10.1.2    TCP 83 8081 → 45330 [PSH, ACK] Seq=528 Ack=545 Win=65152 Len=17 TSval=3806480513 TSecr=1682220804
1712183667.219603777   239 0.552118401    10.10.1.2 → 10.10.1.1    TCP 83 45330 → 8081 [PSH, ACK] Seq=545 Ack=545 Win=64256 Len=17 TSval=1682220805 TSecr=3806480513
1712183669.219603777   241 0.552198161    10.10.1.1 → 10.10.1.2    TCP 83 8081 → 45330 [PSH, ACK] Seq=545 Ack=562 Win=65152 Len=17 TSval=3806480514 TSecr=1682220805
1712183674.219603777   246 0.553401617    10.10.1.2 → 10.10.1.1    TCP 83 45330 → 8081 [PSH, ACK] Seq=562 Ack=562 Win=64256 Len=17 TSval=1682220806 TSecr=3806480514
1712183676.219603777   248 0.553483024    10.10.1.1 → 10.10.1.2    TCP 83 8081 → 45330 [PSH, ACK] Seq=562 Ack=579 Win=65152 Len=17 TSval=3806480515 TSecr=1682220806
1712183680.219603777   252 0.554685790    10.10.1.2 → 10.10.1.1    TCP 83 45330 → 8081 [PSH, ACK] Seq=579 Ack=579 Win=64256 Len=17 TSval=1682220807 TSecr=3806480515
1712183682.219603777   254 0.554766418    10.10.1.1 → 10.10.1.2    TCP 83 8081 → 45330 [PSH, ACK] Seq=579 Ack=596 Win=65152 Len=17 TSval=3806480517 TSecr=1682220807
1712183687.219603777   259 0.555971967    10.10.1.2 → 10.10.1.1    TCP 83 45330 → 8081 [PSH, ACK] Seq=596 Ack=596 Win=64256 Len=17 TSval=1682220809 TSecr=3806480517
1712183689.219603777   261 0.556056821    10.10.1.1 → 10.10.1.2    TCP 83 8081 → 45330 [PSH, ACK] Seq=596 Ack=613 Win=65152 Len=17 TSval=3806480518 TSecr=1682220809
1712183693.219603777   265 0.557263247    10.10.1.2 → 10.10.1.1    TCP 83 45330 → 8081 [PSH, ACK] Seq=613 Ack=613 Win=64256 Len=17 TSval=1682220810 TSecr=3806480518
1712183695.219603777   267 0.557344223    10.10.1.1 → 10.10.1.2    TCP 83 8081 → 45330 [PSH, ACK] Seq=613 Ack=630 Win=65152 Len=17 TSval=3806480519 TSecr=1682220810
1712183700.219603777   272 0.558547160    10.10.1.2 → 10.10.1.1    TCP 83 45330 → 8081 [PSH, ACK] Seq=630 Ack=630 Win=64256 Len=17 TSval=1682220811 TSecr=3806480519
1712183702.219603777   274 0.558628419    10.10.1.1 → 10.10.1.2    TCP 83 8081 → 45330 [PSH, ACK] Seq=630 Ack=647 Win=65152 Len=17 TSval=3806480520 TSecr=1682220811
1712183706.219603777   278 0.559837061    10.10.1.2 → 10.10.1.1    TCP 83 45330 → 8081 [PSH, ACK] Seq=647 Ack=647 Win=64256 Len=17 TSval=1682220812 TSecr=3806480520
1712183708.219603777   280 0.559922216    10.10.1.1 → 10.10.1.2    TCP 83 8081 → 45330 [PSH, ACK] Seq=647 Ack=664 Win=65152 Len=17 TSval=3806480522 TSecr=1682220812
1712183713.219603777   285 0.561127357    10.10.1.2 → 10.10.1.1    TCP 83 45330 → 8081 [PSH, ACK] Seq=664 Ack=664 Win=64256 Len=17 TSval=1682220814 TSecr=3806480522
1712183715.219603777   287 0.561208342    10.10.1.1 → 10.10.1.2    TCP 83 8081 → 45330 [PSH, ACK] Seq=664 Ack=681 Win=65152 Len=17 TSval=3806480523 TSecr=1682220814
1712183719.219603777   291 0.562410814    10.10.1.2 → 10.10.1.1    TCP 83 45330 → 8081 [PSH, ACK] Seq=681 Ack=681 Win=64256 Len=17 TSval=1682220815 TSecr=3806480523
1712183721.219603777   293 0.562491522    10.10.1.1 → 10.10.1.2    TCP 83 8081 → 45330 [PSH, ACK] Seq=681 Ack=698 Win=65152 Len=17 TSval=3806480524 TSecr=1682220815
1712183726.219603777   298 0.563695065    10.10.1.2 → 10.10.1.1    TCP 83 45330 → 8081 [PSH, ACK] Seq=698 Ack=698 Win=64256 Len=17 TSval=1682220816 TSecr=3806480524
1712183728.219603777   300 0.563804762    10.10.1.1 → 10.10.1.2    TCP 83 8081 → 45330 [PSH, ACK] Seq=698 Ack=715 Win=65152 Len=17 TSval=3806480526 TSecr=1682220816
1712183732.219603777   304 0.565010467    10.10.1.2 → 10.10.1.1    TCP 83 45330 → 8081 [PSH, ACK] Seq=715 Ack=715 Win=64256 Len=17 TSval=1682220818 TSecr=3806480526
1712183734.219603777   306 0.565090145    10.10.1.1 → 10.10.1.2    TCP 83 8081 → 45330 [PSH, ACK] Seq=715 Ack=732 Win=65152 Len=17 TSval=3806480527 TSecr=1682220818
1712183739.219603777   311 0.566292424    10.10.1.2 → 10.10.1.1    TCP 83 45330 → 8081 [PSH, ACK] Seq=732 Ack=732 Win=64256 Len=17 TSval=1682220819 TSecr=3806480527
1712183741.219603777   313 0.566369536    10.10.1.1 → 10.10.1.2    TCP 83 8081 → 45330 [PSH, ACK] Seq=732 Ack=749 Win=65152 Len=17 TSval=3806480528 TSecr=1682220819
1712183745.219603777   317 0.567572904    10.10.1.2 → 10.10.1.1    TCP 83 45330 → 8081 [PSH, ACK] Seq=749 Ack=749 Win=64256 Len=17 TSval=1682220820 TSecr=3806480528
1712183747.219603777   319 0.567649029    10.10.1.1 → 10.10.1.2    TCP 83 8081 → 45330 [PSH, ACK] Seq=749 Ack=766 Win=65152 Len=17 TSval=3806480529 TSecr=1682220820
1712183752.219603777   324 0.568855498    10.10.1.2 → 10.10.1.1    TCP 83 45330 → 8081 [PSH, ACK] Seq=766 Ack=766 Win=64256 Len=17 TSval=1682220821 TSecr=3806480529
1712183754.219603777   326 0.568935562    10.10.1.1 → 10.10.1.2    TCP 83 8081 → 45330 [PSH, ACK] Seq=766 Ack=783 Win=65152 Len=17 TSval=3806480531 TSecr=1682220821
1712183758.219603777   330 0.570140084    10.10.1.2 → 10.10.1.1    TCP 83 45330 → 8081 [PSH, ACK] Seq=783 Ack=783 Win=64256 Len=17 TSval=1682220823 TSecr=3806480531
1712183760.219603777   332 0.570217018    10.10.1.1 → 10.10.1.2    TCP 83 8081 → 45330 [PSH, ACK] Seq=783 Ack=800 Win=65152 Len=17 TSval=3806480532 TSecr=1682220823
1712183765.219603777   337 0.571420170    10.10.1.2 → 10.10.1.1    TCP 83 45330 → 8081 [PSH, ACK] Seq=800 Ack=800 Win=64256 Len=17 TSval=1682220824 TSecr=3806480532
1712183767.219603777   339 0.571497308    10.10.1.1 → 10.10.1.2    TCP 83 8081 → 45330 [PSH, ACK] Seq=800 Ack=817 Win=65152 Len=17 TSval=3806480533 TSecr=1682220824
1712183771.219603777   343 0.572702974    10.10.1.2 → 10.10.1.1    TCP 83 45330 → 8081 [PSH, ACK] Seq=817 Ack=817 Win=64256 Len=17 TSval=1682220825 TSecr=3806480533
1712183773.219603777   345 0.572782988    10.10.1.1 → 10.10.1.2    TCP 83 8081 → 45330 [PSH, ACK] Seq=817 Ack=834 Win=65152 Len=17 TSval=3806480535 TSecr=1682220825
1712183778.219603777   350 0.573985160    10.10.1.2 → 10.10.1.1    TCP 83 45330 → 8081 [PSH, ACK] Seq=834 Ack=834 Win=64256 Len=17 TSval=1682220827 TSecr=3806480535
1712183780.219603777   352 0.574062205    10.10.1.1 → 10.10.1.2    TCP 83 8081 → 45330 [PSH, ACK] Seq=834 Ack=851 Win=65152 Len=17 TSval=3806480536 TSecr=1682220827
1712183784.219603777   356 0.575265284    10.10.1.2 → 10.10.1.1    TCP 83 45330 → 8081 [PSH, ACK] Seq=851 Ack=851 Win=64256 Len=17 TSval=1682220828 TSecr=3806480536
1712183786.219603777   358 0.575341688    10.10.1.1 → 10.10.1.2    TCP 83 8081 → 45330 [PSH, ACK] Seq=851 Ack=868 Win=65152 Len=17 TSval=3806480537 TSecr=1682220828
1712183791.219603777   363 0.576549057    10.10.1.2 → 10.10.1.1    TCP 83 45330 → 8081 [PSH, ACK] Seq=868 Ack=868 Win=64256 Len=17 TSval=1682220829 TSecr=3806480537
1712183793.219603777   365 0.576634094    10.10.1.1 → 10.10.1.2    TCP 83 8081 → 45330 [PSH, ACK] Seq=868 Ack=885 Win=65152 Len=17 TSval=3806480538 TSecr=1682220829
1712183797.219603777   369 0.577836630    10.10.1.2 → 10.10.1.1    TCP 83 45330 → 8081 [PSH, ACK] Seq=885 Ack=885 Win=64256 Len=17 TSval=1682220830 TSecr=3806480538
1712183799.219603777   371 0.577917602    10.10.1.1 → 10.10.1.2    TCP 83 8081 → 45330 [PSH, ACK] Seq=885 Ack=902 Win=65152 Len=17 TSval=3806480540 TSecr=1682220830
1712183804.219603777   376 0.579120381    10.10.1.2 → 10.10.1.1    TCP 83 45330 → 8081 [PSH, ACK] Seq=902 Ack=902 Win=64256 Len=17 TSval=1682220832 TSecr=3806480540
1712183806.219603777   378 0.579197592    10.10.1.1 → 10.10.1.2    TCP 83 8081 → 45330 [PSH, ACK] Seq=902 Ack=919 Win=65152 Len=17 TSval=3806480541 TSecr=1682220832
1712183810.219603777   382 0.580404363    10.10.1.2 → 10.10.1.1    TCP 83 45330 → 8081 [PSH, ACK] Seq=919 Ack=919 Win=64256 Len=17 TSval=1682220833 TSecr=3806480541
1712183812.219603777   384 0.580488524    10.10.1.1 → 10.10.1.2    TCP 83 8081 → 45330 [PSH, ACK] Seq=919 Ack=936 Win=65152 Len=17 TSval=3806480542 TSecr=1682220833
1712183817.219603777   389 0.581691868    10.10.1.2 → 10.10.1.1    TCP 83 45330 → 8081 [PSH, ACK] Seq=936 Ack=936 Win=64256 Len=17 TSval=1682220834 TSecr=3806480542
1712183819.219603777   391 0.581773064    10.10.1.1 → 10.10.1.2    TCP 83 8081 → 45330 [PSH, ACK] Seq=936 Ack=953 Win=65152 Len=17 TSval=3806480544 TSecr=1682220834
1712183823.219603777   395 0.582976316    10.10.1.2 → 10.10.1.1    TCP 83 45330 → 8081 [PSH, ACK] Seq=953 Ack=953 Win=64256 Len=17 TSval=1682220836 TSecr=3806480544
1712183825.219603777   397 0.583127316    10.10.1.1 → 10.10.1.2    TCP 83 8081 → 45330 [PSH, ACK] Seq=953 Ack=970 Win=65152 Len=17 TSval=3806480545 TSecr=1682220836
1712183830.219603777   402 0.584334006    10.10.1.2 → 10.10.1.1    TCP 83 45330 → 8081 [PSH, ACK] Seq=970 Ack=970 Win=64256 Len=17 TSval=1682220837 TSecr=3806480545
1712183832.219603777   404 0.584418628    10.10.1.1 → 10.10.1.2    TCP 83 8081 → 45330 [PSH, ACK] Seq=970 Ack=987 Win=65152 Len=17 TSval=3806480546 TSecr=1682220837
1712183836.219603777   408 0.585621164    10.10.1.2 → 10.10.1.1    TCP 83 45330 → 8081 [PSH, ACK] Seq=987 Ack=987 Win=64256 Len=17 TSval=1682220838 TSecr=3806480546
1712183838.219603777   410 0.585702156    10.10.1.1 → 10.10.1.2    TCP 83 8081 → 45330 [PSH, ACK] Seq=987 Ack=1004 Win=65152 Len=17 TSval=3806480547 TSecr=1682220838
1712183843.219603777   415 0.586879815    10.10.1.2 → 10.10.1.1    TCP 83 45330 → 8081 [PSH, ACK] Seq=1004 Ack=1004 Win=64256 Len=17 TSval=1682220840 TSecr=3806480547
1712183845.219603777   417 0.586956482    10.10.1.1 → 10.10.1.2    TCP 83 8081 → 45330 [PSH, ACK] Seq=1004 Ack=1021 Win=65152 Len=17 TSval=3806480549 TSecr=1682220840
1712183849.219603777   421 0.588113946    10.10.1.2 → 10.10.1.1    TCP 83 45330 → 8081 [PSH, ACK] Seq=1021 Ack=1021 Win=64256 Len=17 TSval=1682220841 TSecr=3806480549
1712183850.219603777   422 0.588160487    10.10.1.1 → 10.10.1.2    TCP 83 8081 → 45330 [PSH, ACK] Seq=1021 Ack=1038 Win=65152 Len=17 TSval=3806480550 TSecr=1682220841
1712183856.219603777   428 0.589360877    10.10.1.2 → 10.10.1.1    TCP 83 45330 → 8081 [PSH, ACK] Seq=1038 Ack=1038 Win=64256 Len=17 TSval=1682220842 TSecr=3806480550
1712183858.219603777   430 0.589437191    10.10.1.1 → 10.10.1.2    TCP 83 8081 → 45330 [PSH, ACK] Seq=1038 Ack=1055 Win=65152 Len=17 TSval=3806480551 TSecr=1682220842
1712183862.219603777   434 0.590639806    10.10.1.2 → 10.10.1.1    TCP 83 45330 → 8081 [PSH, ACK] Seq=1055 Ack=1055 Win=64256 Len=17 TSval=1682220843 TSecr=3806480551
1712183864.219603777   436 0.590716531    10.10.1.1 → 10.10.1.2    TCP 83 8081 → 45330 [PSH, ACK] Seq=1055 Ack=1072 Win=65152 Len=17 TSval=3806480552 TSecr=1682220843
1712183869.219603777   441 0.591875551    10.10.1.2 → 10.10.1.1    TCP 83 45330 → 8081 [PSH, ACK] Seq=1072 Ack=1072 Win=64256 Len=17 TSval=1682220845 TSecr=3806480552
1712183871.219603777   443 0.591954671    10.10.1.1 → 10.10.1.2    TCP 83 8081 → 45330 [PSH, ACK] Seq=1072 Ack=1089 Win=65152 Len=17 TSval=3806480554 TSecr=1682220845
1712183875.219603777   447 0.593161121    10.10.1.2 → 10.10.1.1    TCP 83 45330 → 8081 [PSH, ACK] Seq=1089 Ack=1089 Win=64256 Len=17 TSval=1682220846 TSecr=3806480554
1712183877.219603777   449 0.593236956    10.10.1.1 → 10.10.1.2    TCP 83 8081 → 45330 [PSH, ACK] Seq=1089 Ack=1106 Win=65152 Len=17 TSval=3806480555 TSecr=1682220846
1712183882.219603777   454 0.594438777    10.10.1.2 → 10.10.1.1    TCP 83 45330 → 8081 [PSH, ACK] Seq=1106 Ack=1106 Win=64256 Len=17 TSval=1682220847 TSecr=3806480555
1712183884.219603777   456 0.594515546    10.10.1.1 → 10.10.1.2    TCP 83 8081 → 45330 [PSH, ACK] Seq=1106 Ack=1123 Win=65152 Len=17 TSval=3806480556 TSecr=1682220847
1712183888.219603777   460 0.595718335    10.10.1.2 → 10.10.1.1    TCP 83 45330 → 8081 [PSH, ACK] Seq=1123 Ack=1123 Win=64256 Len=17 TSval=1682220848 TSecr=3806480556
1712183890.219603777   462 0.595803097    10.10.1.1 → 10.10.1.2    TCP 83 8081 → 45330 [PSH, ACK] Seq=1123 Ack=1140 Win=65152 Len=17 TSval=3806480558 TSecr=1682220848
1712183895.219603777   467 0.597009251    10.10.1.2 → 10.10.1.1    TCP 83 45330 → 8081 [PSH, ACK] Seq=1140 Ack=1140 Win=64256 Len=17 TSval=1682220850 TSecr=3806480558
1712183897.219603777   469 0.597089653    10.10.1.1 → 10.10.1.2    TCP 83 8081 → 45330 [PSH, ACK] Seq=1140 Ack=1157 Win=65152 Len=17 TSval=3806480559 TSecr=1682220850
1712183901.219603777   473 0.598292382    10.10.1.2 → 10.10.1.1    TCP 83 45330 → 8081 [PSH, ACK] Seq=1157 Ack=1157 Win=64256 Len=17 TSval=1682220851 TSecr=3806480559
1712183903.219603777   475 0.598372320    10.10.1.1 → 10.10.1.2    TCP 83 8081 → 45330 [PSH, ACK] Seq=1157 Ack=1174 Win=65152 Len=17 TSval=3806480560 TSecr=1682220851
1712183908.219603777   480 0.599576066    10.10.1.2 → 10.10.1.1    TCP 83 45330 → 8081 [PSH, ACK] Seq=1174 Ack=1174 Win=64256 Len=17 TSval=1682220852 TSecr=3806480560
1712183910.219603777   482 0.599653090    10.10.1.1 → 10.10.1.2    TCP 83 8081 → 45330 [PSH, ACK] Seq=1174 Ack=1191 Win=65152 Len=17 TSval=3806480561 TSecr=1682220852
1712183914.219603777   486 0.600858695    10.10.1.2 → 10.10.1.1    TCP 83 45330 → 8081 [PSH, ACK] Seq=1191 Ack=1191 Win=64256 Len=17 TSval=1682220853 TSecr=3806480561
1712183916.219603777   488 0.600938809    10.10.1.1 → 10.10.1.2    TCP 83 8081 → 45330 [PSH, ACK] Seq=1191 Ack=1208 Win=65152 Len=17 TSval=3806480563 TSecr=1682220853
1712183921.219603777   493 0.602140722    10.10.1.2 → 10.10.1.1    TCP 83 45330 → 8081 [PSH, ACK] Seq=1208 Ack=1208 Win=64256 Len=17 TSval=1682220855 TSecr=3806480563
1712183923.219603777   495 0.602217198    10.10.1.1 → 10.10.1.2    TCP 83 8081 → 45330 [PSH, ACK] Seq=1208 Ack=1225 Win=65152 Len=17 TSval=3806480564 TSecr=1682220855
1712183927.219603777   499 0.603420904    10.10.1.2 → 10.10.1.1    TCP 83 45330 → 8081 [PSH, ACK] Seq=1225 Ack=1225 Win=64256 Len=17 TSval=1682220856 TSecr=3806480564
1712183929.219603777   501 0.603497715    10.10.1.1 → 10.10.1.2    TCP 83 8081 → 45330 [PSH, ACK] Seq=1225 Ack=1242 Win=65152 Len=17 TSval=3806480565 TSecr=1682220856
1712183934.219603777   506 0.604704081    10.10.1.2 → 10.10.1.1    TCP 83 45330 → 8081 [PSH, ACK] Seq=1242 Ack=1242 Win=64256 Len=17 TSval=1682220857 TSecr=3806480565
1712183936.219603777   508 0.604788039    10.10.1.1 → 10.10.1.2    TCP 83 8081 → 45330 [PSH, ACK] Seq=1242 Ack=1259 Win=65152 Len=17 TSval=3806480567 TSecr=1682220857
1712183940.219603777   512 0.605991561    10.10.1.2 → 10.10.1.1    TCP 83 45330 → 8081 [PSH, ACK] Seq=1259 Ack=1259 Win=64256 Len=17 TSval=1682220859 TSecr=3806480567
1712183942.219603777   514 0.606072530    10.10.1.1 → 10.10.1.2    TCP 83 8081 → 45330 [PSH, ACK] Seq=1259 Ack=1276 Win=65152 Len=17 TSval=3806480568 TSecr=1682220859
1712183947.219603777   519 0.607275463    10.10.1.2 → 10.10.1.1    TCP 83 45330 → 8081 [PSH, ACK] Seq=1276 Ack=1276 Win=64256 Len=17 TSval=1682220860 TSecr=3806480568
1712183949.219603777   521 0.607356746    10.10.1.1 → 10.10.1.2    TCP 83 8081 → 45330 [PSH, ACK] Seq=1276 Ack=1293 Win=65152 Len=17 TSval=3806480569 TSecr=1682220860
1712183953.219603777   525 0.608562421    10.10.1.2 → 10.10.1.1    TCP 83 45330 → 8081 [PSH, ACK] Seq=1293 Ack=1293 Win=64256 Len=17 TSval=1682220861 TSecr=3806480569
1712183955.219603777   527 0.608646707    10.10.1.1 → 10.10.1.2    TCP 83 8081 → 45330 [PSH, ACK] Seq=1293 Ack=1310 Win=65152 Len=17 TSval=3806480570 TSecr=1682220861
1712183960.219603777   532 0.609849238    10.10.1.2 → 10.10.1.1    TCP 83 45330 → 8081 [PSH, ACK] Seq=1310 Ack=1310 Win=64256 Len=17 TSval=1682220862 TSecr=3806480570
1712183962.219603777   534 0.609930640    10.10.1.1 → 10.10.1.2    TCP 83 8081 → 45330 [PSH, ACK] Seq=1310 Ack=1327 Win=65152 Len=17 TSval=3806480572 TSecr=1682220862
1712183966.219603777   538 0.611135051    10.10.1.2 → 10.10.1.1    TCP 83 45330 → 8081 [PSH, ACK] Seq=1327 Ack=1327 Win=64256 Len=17 TSval=1682220864 TSecr=3806480572
1712183968.219603777   540 0.611215926    10.10.1.1 → 10.10.1.2    TCP 83 8081 → 45330 [PSH, ACK] Seq=1327 Ack=1344 Win=65152 Len=17 TSval=3806480573 TSecr=1682220864
1712183973.219603777   545 0.612421577    10.10.1.2 → 10.10.1.1    TCP 83 45330 → 8081 [PSH, ACK] Seq=1344 Ack=1344 Win=64256 Len=17 TSval=1682220865 TSecr=3806480573
1712183975.219603777   547 0.612506862    10.10.1.1 → 10.10.1.2    TCP 83 8081 → 45330 [PSH, ACK] Seq=1344 Ack=1361 Win=65152 Len=17 TSval=3806480574 TSecr=1682220865
1712183979.219603777   551 0.613709448    10.10.1.2 → 10.10.1.1    TCP 83 45330 → 8081 [PSH, ACK] Seq=1361 Ack=1361 Win=64256 Len=17 TSval=1682220866 TSecr=3806480574
1712183981.219603777   553 0.613790479    10.10.1.1 → 10.10.1.2    TCP 83 8081 → 45330 [PSH, ACK] Seq=1361 Ack=1378 Win=65152 Len=17 TSval=3806480576 TSecr=1682220866
1712183986.219603777   558 0.614993803    10.10.1.2 → 10.10.1.1    TCP 83 45330 → 8081 [PSH, ACK] Seq=1378 Ack=1378 Win=64256 Len=17 TSval=1682220868 TSecr=3806480576
1712183988.219603777   560 0.615070955    10.10.1.1 → 10.10.1.2    TCP 83 8081 → 45330 [PSH, ACK] Seq=1378 Ack=1395 Win=65152 Len=17 TSval=3806480577 TSecr=1682220868
1712183992.219603777   564 0.616276917    10.10.1.2 → 10.10.1.1    TCP 83 45330 → 8081 [PSH, ACK] Seq=1395 Ack=1395 Win=64256 Len=17 TSval=1682220869 TSecr=3806480577
1712183994.219603777   566 0.616361872    10.10.1.1 → 10.10.1.2    TCP 83 8081 → 45330 [PSH, ACK] Seq=1395 Ack=1412 Win=65152 Len=17 TSval=3806480578 TSecr=1682220869
1712183999.219603777   571 0.617564124    10.10.1.2 → 10.10.1.1    TCP 83 45330 → 8081 [PSH, ACK] Seq=1412 Ack=1412 Win=64256 Len=17 TSval=1682220870 TSecr=3806480578
1712184001.219603777   573 0.617644392    10.10.1.1 → 10.10.1.2    TCP 83 8081 → 45330 [PSH, ACK] Seq=1412 Ack=1429 Win=65152 Len=17 TSval=3806480579 TSecr=1682220870
1712184005.219603777   577 0.618846944    10.10.1.2 → 10.10.1.1    TCP 83 45330 → 8081 [PSH, ACK] Seq=1429 Ack=1429 Win=64256 Len=17 TSval=1682220871 TSecr=3806480579
1712184007.219603777   579 0.618928245    10.10.1.1 → 10.10.1.2    TCP 83 8081 → 45330 [PSH, ACK] Seq=1429 Ack=1446 Win=65152 Len=17 TSval=3806480581 TSecr=1682220871
1712184012.219603777   584 0.620091325    10.10.1.2 → 10.10.1.1    TCP 83 45330 → 8081 [PSH, ACK] Seq=1446 Ack=1446 Win=64256 Len=17 TSval=1682220873 TSecr=3806480581
1712184014.219603777   586 0.620172185    10.10.1.1 → 10.10.1.2    TCP 83 8081 → 45330 [PSH, ACK] Seq=1446 Ack=1463 Win=65152 Len=17 TSval=3806480582 TSecr=1682220873
1712184018.219603777   590 0.621375168    10.10.1.2 → 10.10.1.1    TCP 83 45330 → 8081 [PSH, ACK] Seq=1463 Ack=1463 Win=64256 Len=17 TSval=1682220874 TSecr=3806480582
1712184020.219603777   592 0.621456445    10.10.1.1 → 10.10.1.2    TCP 83 8081 → 45330 [PSH, ACK] Seq=1463 Ack=1480 Win=65152 Len=17 TSval=3806480583 TSecr=1682220874
1712184025.219603777   597 0.622658577    10.10.1.2 → 10.10.1.1    TCP 83 45330 → 8081 [PSH, ACK] Seq=1480 Ack=1480 Win=64256 Len=17 TSval=1682220875 TSecr=3806480583
1712184027.219603777   599 0.622739561    10.10.1.1 → 10.10.1.2    TCP 83 8081 → 45330 [PSH, ACK] Seq=1480 Ack=1497 Win=65152 Len=17 TSval=3806480585 TSecr=1682220875
1712184031.219603777   603 0.623943990    10.10.1.2 → 10.10.1.1    TCP 83 45330 → 8081 [PSH, ACK] Seq=1497 Ack=1497 Win=64256 Len=17 TSval=1682220877 TSecr=3806480585
1712184033.219603777   605 0.624029358    10.10.1.1 → 10.10.1.2    TCP 83 8081 → 45330 [PSH, ACK] Seq=1497 Ack=1514 Win=65152 Len=17 TSval=3806480586 TSecr=1682220877
1712184038.219603777   610 0.625236850    10.10.1.2 → 10.10.1.1    TCP 83 45330 → 8081 [PSH, ACK] Seq=1514 Ack=1514 Win=64256 Len=17 TSval=1682220878 TSecr=3806480586
1712184040.219603777   612 0.625318709    10.10.1.1 → 10.10.1.2    TCP 83 8081 → 45330 [PSH, ACK] Seq=1514 Ack=1531 Win=65152 Len=17 TSval=3806480587 TSecr=1682220878
1712184044.219603777   616 0.626522354    10.10.1.2 → 10.10.1.1    TCP 83 45330 → 8081 [PSH, ACK] Seq=1531 Ack=1531 Win=64256 Len=17 TSval=1682220879 TSecr=3806480587
1712184046.219603777   618 0.626602969    10.10.1.1 → 10.10.1.2    TCP 83 8081 → 45330 [PSH, ACK] Seq=1531 Ack=1548 Win=65152 Len=17 TSval=3806480588 TSecr=1682220879
1712184051.219603777   623 0.627807344    10.10.1.2 → 10.10.1.1    TCP 83 45330 → 8081 [PSH, ACK] Seq=1548 Ack=1548 Win=64256 Len=17 TSval=1682220880 TSecr=3806480588
1712184053.219603777   625 0.627891535    10.10.1.1 → 10.10.1.2    TCP 83 8081 → 45330 [PSH, ACK] Seq=1548 Ack=1565 Win=65152 Len=17 TSval=3806480590 TSecr=1682220880
1712184057.219603777   629 0.629096203    10.10.1.2 → 10.10.1.1    TCP 83 45330 → 8081 [PSH, ACK] Seq=1565 Ack=1565 Win=64256 Len=17 TSval=1682220882 TSecr=3806480590
1712184059.219603777   631 0.629177164    10.10.1.1 → 10.10.1.2    TCP 83 8081 → 45330 [PSH, ACK] Seq=1565 Ack=1582 Win=65152 Len=17 TSval=3806480591 TSecr=1682220882
1712184064.219603777   636 0.630380254    10.10.1.2 → 10.10.1.1    TCP 83 45330 → 8081 [PSH, ACK] Seq=1582 Ack=1582 Win=64256 Len=17 TSval=1682220883 TSecr=3806480591
1712184066.219603777   638 0.630456294    10.10.1.1 → 10.10.1.2    TCP 83 8081 → 45330 [PSH, ACK] Seq=1582 Ack=1599 Win=65152 Len=17 TSval=3806480592 TSecr=1682220883
1712184070.219603777   642 0.631659564    10.10.1.2 → 10.10.1.1    TCP 83 45330 → 8081 [PSH, ACK] Seq=1599 Ack=1599 Win=64256 Len=17 TSval=1682220884 TSecr=3806480592
1712184072.219603777   644 0.631754745    10.10.1.1 → 10.10.1.2    TCP 83 8081 → 45330 [PSH, ACK] Seq=1599 Ack=1616 Win=65152 Len=17 TSval=3806480594 TSecr=1682220884
1712184077.219603777   649 0.632961361    10.10.1.2 → 10.10.1.1    TCP 83 45330 → 8081 [PSH, ACK] Seq=1616 Ack=1616 Win=64256 Len=17 TSval=1682220886 TSecr=3806480594
1712184079.219603777   651 0.633041436    10.10.1.1 → 10.10.1.2    TCP 83 8081 → 45330 [PSH, ACK] Seq=1616 Ack=1633 Win=65152 Len=17 TSval=3806480595 TSecr=1682220886
1712184083.219603777   655 0.634243838    10.10.1.2 → 10.10.1.1    TCP 83 45330 → 8081 [PSH, ACK] Seq=1633 Ack=1633 Win=64256 Len=17 TSval=1682220887 TSecr=3806480595
1712184085.219603777   657 0.634320204    10.10.1.1 → 10.10.1.2    TCP 83 8081 → 45330 [PSH, ACK] Seq=1633 Ack=1650 Win=65152 Len=17 TSval=3806480596 TSecr=1682220887
1712184090.219603777   662 0.635523789    10.10.1.2 → 10.10.1.1    TCP 83 45330 → 8081 [PSH, ACK] Seq=1650 Ack=1650 Win=64256 Len=17 TSval=1682220888 TSecr=3806480596
1712184092.219603777   664 0.635599870    10.10.1.1 → 10.10.1.2    TCP 83 8081 → 45330 [PSH, ACK] Seq=1650 Ack=1667 Win=65152 Len=17 TSval=3806480597 TSecr=1682220888
1712184096.219603777   668 0.636805205    10.10.1.2 → 10.10.1.1    TCP 83 45330 → 8081 [PSH, ACK] Seq=1667 Ack=1667 Win=64256 Len=17 TSval=1682220889 TSecr=3806480597
1712184098.219603777   670 0.636885538    10.10.1.1 → 10.10.1.2    TCP 83 8081 → 45330 [PSH, ACK] Seq=1667 Ack=1684 Win=65152 Len=17 TSval=3806480599 TSecr=1682220889
1712184103.219603777   675 0.638087587    10.10.1.2 → 10.10.1.1    TCP 83 45330 → 8081 [PSH, ACK] Seq=1684 Ack=1684 Win=64256 Len=17 TSval=1682220891 TSecr=3806480599
1712184105.219603777   677 0.638165028    10.10.1.1 → 10.10.1.2    TCP 83 8081 → 45330 [PSH, ACK] Seq=1684 Ack=1701 Win=65152 Len=17 TSval=3806480600 TSecr=1682220891
1712184109.219603777   681 0.639368984    10.10.1.2 → 10.10.1.1    TCP 83 45330 → 8081 [PSH, ACK] Seq=1701 Ack=1701 Win=64256 Len=17 TSval=1682220892 TSecr=3806480600
1712184111.219603777   683 0.639445335    10.10.1.1 → 10.10.1.2    TCP 83 8081 → 45330 [PSH, ACK] Seq=1701 Ack=1718 Win=65152 Len=17 TSval=3806480601 TSecr=1682220892
1712184116.219603777   688 0.640649422    10.10.1.2 → 10.10.1.1    TCP 83 45330 → 8081 [PSH, ACK] Seq=1718 Ack=1718 Win=64256 Len=17 TSval=1682220893 TSecr=3806480601
1712184118.219603777   690 0.640729867    10.10.1.1 → 10.10.1.2    TCP 83 8081 → 45330 [PSH, ACK] Seq=1718 Ack=1735 Win=65152 Len=17 TSval=3806480603 TSecr=1682220893
1712184122.219603777   694 0.641932099    10.10.1.2 → 10.10.1.1    TCP 83 45330 → 8081 [PSH, ACK] Seq=1735 Ack=1735 Win=64256 Len=17 TSval=1682220895 TSecr=3806480603
1712184124.219603777   696 0.642008674    10.10.1.1 → 10.10.1.2    TCP 83 8081 → 45330 [PSH, ACK] Seq=1735 Ack=1752 Win=65152 Len=17 TSval=3806480604 TSecr=1682220895
1712184129.219603777   701 0.643212128    10.10.1.2 → 10.10.1.1    TCP 83 45330 → 8081 [PSH, ACK] Seq=1752 Ack=1752 Win=64256 Len=17 TSval=1682220896 TSecr=3806480604
1712184131.219603777   703 0.643288791    10.10.1.1 → 10.10.1.2    TCP 83 8081 → 45330 [PSH, ACK] Seq=1752 Ack=1769 Win=65152 Len=17 TSval=3806480605 TSecr=1682220896
1712184135.219603777   707 0.644493766    10.10.1.2 → 10.10.1.1    TCP 83 45330 → 8081 [PSH, ACK] Seq=1769 Ack=1769 Win=64256 Len=17 TSval=1682220897 TSecr=3806480605
1712184137.219603777   709 0.644573368    10.10.1.1 → 10.10.1.2    TCP 83 8081 → 45330 [PSH, ACK] Seq=1769 Ack=1786 Win=65152 Len=17 TSval=3806480606 TSecr=1682220897
1712184142.219603777   714 0.645775332    10.10.1.2 → 10.10.1.1    TCP 83 45330 → 8081 [PSH, ACK] Seq=1786 Ack=1786 Win=64256 Len=17 TSval=1682220898 TSecr=3806480606
1712184144.219603777   716 0.645856168    10.10.1.1 → 10.10.1.2    TCP 83 8081 → 45330 [PSH, ACK] Seq=1786 Ack=1803 Win=65152 Len=17 TSval=3806480608 TSecr=1682220898
1712184148.219603777   720 0.647058669    10.10.1.2 → 10.10.1.1    TCP 83 45330 → 8081 [PSH, ACK] Seq=1803 Ack=1803 Win=64256 Len=17 TSval=1682220900 TSecr=3806480608
1712184150.219603777   722 0.647139641    10.10.1.1 → 10.10.1.2    TCP 83 8081 → 45330 [PSH, ACK] Seq=1803 Ack=1820 Win=65152 Len=17 TSval=3806480609 TSecr=1682220900
1712184155.219603777   727 0.648345465    10.10.1.2 → 10.10.1.1    TCP 83 45330 → 8081 [PSH, ACK] Seq=1820 Ack=1820 Win=64256 Len=17 TSval=1682220901 TSecr=3806480609
1712184157.219603777   729 0.648429830    10.10.1.1 → 10.10.1.2    TCP 83 8081 → 45330 [PSH, ACK] Seq=1820 Ack=1837 Win=65152 Len=17 TSval=3806480610 TSecr=1682220901
1712184161.219603777   733 0.649631778    10.10.1.2 → 10.10.1.1    TCP 83 45330 → 8081 [PSH, ACK] Seq=1837 Ack=1837 Win=64256 Len=17 TSval=1682220902 TSecr=3806480610
1712184163.219603777   735 0.649709007    10.10.1.1 → 10.10.1.2    TCP 83 8081 → 45330 [PSH, ACK] Seq=1837 Ack=1854 Win=65152 Len=17 TSval=3806480611 TSecr=1682220902
1712184168.219603777   740 0.650878932    10.10.1.2 → 10.10.1.1    TCP 83 45330 → 8081 [PSH, ACK] Seq=1854 Ack=1854 Win=64256 Len=17 TSval=1682220904 TSecr=3806480611
1712184170.219603777   742 0.650956095    10.10.1.1 → 10.10.1.2    TCP 83 8081 → 45330 [PSH, ACK] Seq=1854 Ack=1871 Win=65152 Len=17 TSval=3806480613 TSecr=1682220904
1712184174.219603777   746 0.652163904    10.10.1.2 → 10.10.1.1    TCP 83 45330 → 8081 [PSH, ACK] Seq=1871 Ack=1871 Win=64256 Len=17 TSval=1682220905 TSecr=3806480613
1712184176.219603777   748 0.652248239    10.10.1.1 → 10.10.1.2    TCP 83 8081 → 45330 [PSH, ACK] Seq=1871 Ack=1888 Win=65152 Len=17 TSval=3806480614 TSecr=1682220905
1712184181.219603777   753 0.653451491    10.10.1.2 → 10.10.1.1    TCP 83 45330 → 8081 [PSH, ACK] Seq=1888 Ack=1888 Win=64256 Len=17 TSval=1682220906 TSecr=3806480614
1712184183.219603777   755 0.653532953    10.10.1.1 → 10.10.1.2    TCP 83 8081 → 45330 [PSH, ACK] Seq=1888 Ack=1905 Win=65152 Len=17 TSval=3806480615 TSecr=1682220906
1712184187.219603777   759 0.654736059    10.10.1.2 → 10.10.1.1    TCP 83 45330 → 8081 [PSH, ACK] Seq=1905 Ack=1905 Win=64256 Len=17 TSval=1682220907 TSecr=3806480615
1712184189.219603777   761 0.654816676    10.10.1.1 → 10.10.1.2    TCP 83 8081 → 45330 [PSH, ACK] Seq=1905 Ack=1922 Win=65152 Len=17 TSval=3806480617 TSecr=1682220907
1712184194.219603777   766 0.655979300    10.10.1.2 → 10.10.1.1    TCP 83 45330 → 8081 [PSH, ACK] Seq=1922 Ack=1922 Win=64256 Len=17 TSval=1682220909 TSecr=3806480617
1712184196.219603777   768 0.656114796    10.10.1.1 → 10.10.1.2    TCP 83 8081 → 45330 [PSH, ACK] Seq=1922 Ack=1939 Win=65152 Len=17 TSval=3806480618 TSecr=1682220909
1712184200.219603777   772 0.657317282    10.10.1.2 → 10.10.1.1    TCP 83 45330 → 8081 [PSH, ACK] Seq=1939 Ack=1939 Win=64256 Len=17 TSval=1682220910 TSecr=3806480618
1712184202.219603777   774 0.657398203    10.10.1.1 → 10.10.1.2    TCP 83 8081 → 45330 [PSH, ACK] Seq=1939 Ack=1956 Win=65152 Len=17 TSval=3806480619 TSecr=1682220910
1712184207.219603777   779 0.658601527    10.10.1.2 → 10.10.1.1    TCP 83 45330 → 8081 [PSH, ACK] Seq=1956 Ack=1956 Win=64256 Len=17 TSval=1682220911 TSecr=3806480619
1712184209.219603777   781 0.658682225    10.10.1.1 → 10.10.1.2    TCP 83 8081 → 45330 [PSH, ACK] Seq=1956 Ack=1973 Win=65152 Len=17 TSval=3806480620 TSecr=1682220911
1712184213.219603777   785 0.659887234    10.10.1.2 → 10.10.1.1    TCP 83 45330 → 8081 [PSH, ACK] Seq=1973 Ack=1973 Win=64256 Len=17 TSval=1682220913 TSecr=3806480620
1712184215.219603777   787 0.659972019    10.10.1.1 → 10.10.1.2    TCP 83 8081 → 45330 [PSH, ACK] Seq=1973 Ack=1990 Win=65152 Len=17 TSval=3806480622 TSecr=1682220913
1712184220.219603777   792 0.661177486    10.10.1.2 → 10.10.1.1    TCP 83 45330 → 8081 [PSH, ACK] Seq=1990 Ack=1990 Win=64256 Len=17 TSval=1682220914 TSecr=3806480622
1712184222.219603777   794 0.661258709    10.10.1.1 → 10.10.1.2    TCP 83 8081 → 45330 [PSH, ACK] Seq=1990 Ack=2007 Win=65152 Len=17 TSval=3806480623 TSecr=1682220914
