1711546226.791707993    22 0.294918693    10.10.1.2 → 10.10.1.1    TCP 74 52592 → 8081 [SYN] Seq=0 Win=64240 Len=0 MSS=1460 SACK_PERM=1 TSval=1044997158 TSecr=0 WS=128
1711546227.791707993    23 0.294956567    10.10.1.1 → 10.10.1.2    TCP 74 8081 → 52592 [SYN, ACK] Seq=0 Ack=1 Win=65160 Len=0 MSS=1460 SACK_PERM=1 TSval=3169256866 TSecr=1044997158 WS=128
1711546228.791707993    24 0.295030721    10.10.1.2 → 10.10.1.1    TCP 66 52592 → 8081 [ACK] Seq=1 Ack=1 Win=64256 Len=0 TSval=1044997158 TSecr=3169256866
1711546242.791707993    38 0.581570507    10.10.1.2 → 10.10.1.1    TCP 83 52592 → 8081 [PSH, ACK] Seq=1 Ack=1 Win=64256 Len=17 TSval=1044997445 TSecr=3169256866
1711546243.791707993    39 0.581598919    10.10.1.1 → 10.10.1.2    TCP 66 8081 → 52592 [ACK] Seq=1 Ack=18 Win=65152 Len=0 TSval=3169257153 TSecr=1044997445
1711546246.791707993    42 0.581861043    10.10.1.1 → 10.10.1.2    TCP 83 8081 → 52592 [PSH, ACK] Seq=1 Ack=18 Win=65152 Len=17 TSval=3169257153 TSecr=1044997445
1711546247.791707993    43 0.581890369    10.10.1.2 → 10.10.1.1    TCP 66 52592 → 8081 [ACK] Seq=18 Ack=18 Win=64256 Len=0 TSval=1044997445 TSecr=3169257153
1711546255.791707993    51 0.595790537    10.10.1.2 → 10.10.1.1    TCP 83 52592 → 8081 [PSH, ACK] Seq=18 Ack=18 Win=64256 Len=17 TSval=1044997459 TSecr=3169257153
1711546258.791707993    54 0.595915620    10.10.1.1 → 10.10.1.2    TCP 83 8081 → 52592 [PSH, ACK] Seq=18 Ack=35 Win=65152 Len=17 TSval=3169257167 TSecr=1044997459
1711546265.791707993    61 0.597179136    10.10.1.2 → 10.10.1.1    TCP 83 52592 → 8081 [PSH, ACK] Seq=35 Ack=35 Win=64256 Len=17 TSval=1044997460 TSecr=3169257167
1711546268.791707993    64 0.597299599    10.10.1.1 → 10.10.1.2    TCP 83 8081 → 52592 [PSH, ACK] Seq=35 Ack=52 Win=65152 Len=17 TSval=3169257169 TSecr=1044997460
1711546275.791707993    71 0.601138766    10.10.1.2 → 10.10.1.1    TCP 83 52592 → 8081 [PSH, ACK] Seq=52 Ack=52 Win=64256 Len=17 TSval=1044997464 TSecr=3169257169
1711546278.791707993    74 0.601268182    10.10.1.1 → 10.10.1.2    TCP 83 8081 → 52592 [PSH, ACK] Seq=52 Ack=69 Win=65152 Len=17 TSval=3169257173 TSecr=1044997464
1711546286.791707993    82 0.610508893    10.10.1.2 → 10.10.1.1    TCP 83 52592 → 8081 [PSH, ACK] Seq=69 Ack=69 Win=64256 Len=17 TSval=1044997474 TSecr=3169257173
1711546288.791707993    84 0.610649040    10.10.1.1 → 10.10.1.2    TCP 83 8081 → 52592 [PSH, ACK] Seq=69 Ack=86 Win=65152 Len=17 TSval=3169257182 TSecr=1044997474
1711546296.791707993    92 0.619082799    10.10.1.2 → 10.10.1.1    TCP 83 52592 → 8081 [PSH, ACK] Seq=86 Ack=86 Win=64256 Len=17 TSval=1044997482 TSecr=3169257182
1711546298.791707993    94 0.619214780    10.10.1.1 → 10.10.1.2    TCP 83 8081 → 52592 [PSH, ACK] Seq=86 Ack=103 Win=65152 Len=17 TSval=3169257191 TSecr=1044997482
1711546305.791707993   101 0.626275331    10.10.1.2 → 10.10.1.1    TCP 83 52592 → 8081 [PSH, ACK] Seq=103 Ack=103 Win=64256 Len=17 TSval=1044997489 TSecr=3169257191
1711546307.791707993   103 0.626405880    10.10.1.1 → 10.10.1.2    TCP 83 8081 → 52592 [PSH, ACK] Seq=103 Ack=120 Win=65152 Len=17 TSval=3169257198 TSecr=1044997489
1711546316.791707993   112 0.626892211    10.10.1.2 → 10.10.1.1    TCP 83 52592 → 8081 [PSH, ACK] Seq=120 Ack=120 Win=64256 Len=17 TSval=1044997490 TSecr=3169257198
1711546319.791707993   115 0.627006030    10.10.1.1 → 10.10.1.2    TCP 83 8081 → 52592 [PSH, ACK] Seq=120 Ack=137 Win=65152 Len=17 TSval=3169257198 TSecr=1044997490
1711546327.791707993   123 0.639273754    10.10.1.2 → 10.10.1.1    TCP 83 52592 → 8081 [PSH, ACK] Seq=137 Ack=137 Win=64256 Len=17 TSval=1044997502 TSecr=3169257198
1711546329.791707993   125 0.639391270    10.10.1.1 → 10.10.1.2    TCP 83 8081 → 52592 [PSH, ACK] Seq=137 Ack=154 Win=65152 Len=17 TSval=3169257211 TSecr=1044997502
1711546337.791707993   133 0.644543037    10.10.1.2 → 10.10.1.1    TCP 83 52592 → 8081 [PSH, ACK] Seq=154 Ack=154 Win=64256 Len=17 TSval=1044997508 TSecr=3169257211
1711546339.791707993   135 0.644661348    10.10.1.1 → 10.10.1.2    TCP 83 8081 → 52592 [PSH, ACK] Seq=154 Ack=171 Win=65152 Len=17 TSval=3169257216 TSecr=1044997508
1711546347.791707993   143 0.647432916    10.10.1.2 → 10.10.1.1    TCP 83 52592 → 8081 [PSH, ACK] Seq=171 Ack=171 Win=64256 Len=17 TSval=1044997511 TSecr=3169257216
1711546349.791707993   145 0.647552136    10.10.1.1 → 10.10.1.2    TCP 83 8081 → 52592 [PSH, ACK] Seq=171 Ack=188 Win=65152 Len=17 TSval=3169257219 TSecr=1044997511
1711546357.791707993   153 0.652392798    10.10.1.2 → 10.10.1.1    TCP 83 52592 → 8081 [PSH, ACK] Seq=188 Ack=188 Win=64256 Len=17 TSval=1044997515 TSecr=3169257219
1711546359.791707993   155 0.652511259    10.10.1.1 → 10.10.1.2    TCP 83 8081 → 52592 [PSH, ACK] Seq=188 Ack=205 Win=65152 Len=17 TSval=3169257224 TSecr=1044997515
1711546367.791707993   163 0.656169847    10.10.1.2 → 10.10.1.1    TCP 83 52592 → 8081 [PSH, ACK] Seq=205 Ack=205 Win=64256 Len=17 TSval=1044997519 TSecr=3169257224
1711546369.791707993   165 0.656288869    10.10.1.1 → 10.10.1.2    TCP 83 8081 → 52592 [PSH, ACK] Seq=205 Ack=222 Win=65152 Len=17 TSval=3169257228 TSecr=1044997519
1711546376.791707993   172 0.656888407    10.10.1.2 → 10.10.1.1    TCP 83 52592 → 8081 [PSH, ACK] Seq=222 Ack=222 Win=64256 Len=17 TSval=1044997520 TSecr=3169257228
1711546379.791707993   175 0.656998636    10.10.1.1 → 10.10.1.2    TCP 83 8081 → 52592 [PSH, ACK] Seq=222 Ack=239 Win=65152 Len=17 TSval=3169257228 TSecr=1044997520
1711546387.791707993   183 0.662070603    10.10.1.2 → 10.10.1.1    TCP 83 52592 → 8081 [PSH, ACK] Seq=239 Ack=239 Win=64256 Len=17 TSval=1044997525 TSecr=3169257228
1711546389.791707993   185 0.662192369    10.10.1.1 → 10.10.1.2    TCP 83 8081 → 52592 [PSH, ACK] Seq=239 Ack=256 Win=65152 Len=17 TSval=3169257234 TSecr=1044997525
1711546397.791707993   193 0.666215657    10.10.1.2 → 10.10.1.1    TCP 83 52592 → 8081 [PSH, ACK] Seq=256 Ack=256 Win=64256 Len=17 TSval=1044997529 TSecr=3169257234
1711546399.791707993   195 0.666335262    10.10.1.1 → 10.10.1.2    TCP 83 8081 → 52592 [PSH, ACK] Seq=256 Ack=273 Win=65152 Len=17 TSval=3169257238 TSecr=1044997529
1711546408.791707993   204 0.670354387    10.10.1.2 → 10.10.1.1    TCP 83 52592 → 8081 [PSH, ACK] Seq=273 Ack=273 Win=64256 Len=17 TSval=1044997533 TSecr=3169257238
1711546410.791707993   206 0.670473214    10.10.1.1 → 10.10.1.2    TCP 83 8081 → 52592 [PSH, ACK] Seq=273 Ack=290 Win=65152 Len=17 TSval=3169257242 TSecr=1044997533
1711546418.791707993   214 0.671882551    10.10.1.2 → 10.10.1.1    TCP 83 52592 → 8081 [PSH, ACK] Seq=290 Ack=290 Win=64256 Len=17 TSval=1044997535 TSecr=3169257242
1711546420.791707993   216 0.671997326    10.10.1.1 → 10.10.1.2    TCP 83 8081 → 52592 [PSH, ACK] Seq=290 Ack=307 Win=65152 Len=17 TSval=3169257243 TSecr=1044997535
1711546428.791707993   224 0.682281247    10.10.1.2 → 10.10.1.1    TCP 83 52592 → 8081 [PSH, ACK] Seq=307 Ack=307 Win=64256 Len=17 TSval=1044997545 TSecr=3169257243
1711546430.791707993   226 0.682401323    10.10.1.1 → 10.10.1.2    TCP 83 8081 → 52592 [PSH, ACK] Seq=307 Ack=324 Win=65152 Len=17 TSval=3169257254 TSecr=1044997545
1711546438.791707993   234 0.685185303    10.10.1.2 → 10.10.1.1    TCP 83 52592 → 8081 [PSH, ACK] Seq=324 Ack=324 Win=64256 Len=17 TSval=1044997548 TSecr=3169257254
1711546440.791707993   236 0.685301185    10.10.1.1 → 10.10.1.2    TCP 83 8081 → 52592 [PSH, ACK] Seq=324 Ack=341 Win=65152 Len=17 TSval=3169257257 TSecr=1044997548
1711546448.791707993   244 0.690512237    10.10.1.2 → 10.10.1.1    TCP 83 52592 → 8081 [PSH, ACK] Seq=341 Ack=341 Win=64256 Len=17 TSval=1044997554 TSecr=3169257257
1711546450.791707993   246 0.690631410    10.10.1.1 → 10.10.1.2    TCP 83 8081 → 52592 [PSH, ACK] Seq=341 Ack=358 Win=65152 Len=17 TSval=3169257262 TSecr=1044997554
1711546458.791707993   254 0.705774530    10.10.1.2 → 10.10.1.1    TCP 83 52592 → 8081 [PSH, ACK] Seq=358 Ack=358 Win=64256 Len=17 TSval=1044997569 TSecr=3169257262
1711546460.791707993   256 0.705893784    10.10.1.1 → 10.10.1.2    TCP 83 8081 → 52592 [PSH, ACK] Seq=358 Ack=375 Win=65152 Len=17 TSval=3169257277 TSecr=1044997569
1711546467.791707993   263 0.725859456    10.10.1.2 → 10.10.1.1    TCP 83 52592 → 8081 [PSH, ACK] Seq=375 Ack=375 Win=64256 Len=17 TSval=1044997589 TSecr=3169257277
1711546469.791707993   265 0.725994799    10.10.1.1 → 10.10.1.2    TCP 83 8081 → 52592 [PSH, ACK] Seq=375 Ack=392 Win=65152 Len=17 TSval=3169257297 TSecr=1044997589
1711546478.791707993   274 0.754832878    10.10.1.2 → 10.10.1.1    TCP 83 52592 → 8081 [PSH, ACK] Seq=392 Ack=392 Win=64256 Len=17 TSval=1044997618 TSecr=3169257297
1711546480.791707993   276 0.754952414    10.10.1.1 → 10.10.1.2    TCP 83 8081 → 52592 [PSH, ACK] Seq=392 Ack=409 Win=65152 Len=17 TSval=3169257326 TSecr=1044997618
1711546488.791707993   284 0.757388083    10.10.1.2 → 10.10.1.1    TCP 83 52592 → 8081 [PSH, ACK] Seq=409 Ack=409 Win=64256 Len=17 TSval=1044997620 TSecr=3169257326
1711546490.791707993   286 0.757503595    10.10.1.1 → 10.10.1.2    TCP 83 8081 → 52592 [PSH, ACK] Seq=409 Ack=426 Win=65152 Len=17 TSval=3169257329 TSecr=1044997620
1711546498.791707993   294 0.804402079    10.10.1.2 → 10.10.1.1    TCP 66 52592 → 8081 [ACK] Seq=426 Ack=426 Win=64256 Len=0 TSval=1044997668 TSecr=3169257329
1711546500.791707993   296 0.810162150    10.10.1.2 → 10.10.1.1    TCP 83 52592 → 8081 [PSH, ACK] Seq=426 Ack=426 Win=64256 Len=17 TSval=1044997673 TSecr=3169257329
1711546502.791707993   298 0.810278859    10.10.1.1 → 10.10.1.2    TCP 83 8081 → 52592 [PSH, ACK] Seq=426 Ack=443 Win=65152 Len=17 TSval=3169257382 TSecr=1044997673
1711546503.791707993   299 0.810326336    10.10.1.2 → 10.10.1.1    TCP 66 52592 → 8081 [ACK] Seq=443 Ack=443 Win=64256 Len=0 TSval=1044997673 TSecr=3169257382
1711546512.791707993   308 0.864782933    10.10.1.2 → 10.10.1.1    TCP 83 52592 → 8081 [PSH, ACK] Seq=443 Ack=443 Win=64256 Len=17 TSval=1044997728 TSecr=3169257382
1711546514.791707993   310 0.864897129    10.10.1.1 → 10.10.1.2    TCP 83 8081 → 52592 [PSH, ACK] Seq=443 Ack=460 Win=65152 Len=17 TSval=3169257436 TSecr=1044997728
1711546515.791707993   311 0.864942643    10.10.1.2 → 10.10.1.1    TCP 66 52592 → 8081 [ACK] Seq=460 Ack=460 Win=64256 Len=0 TSval=1044997728 TSecr=3169257436
1711546523.791707993   319 0.911725829    10.10.1.2 → 10.10.1.1    TCP 83 52592 → 8081 [PSH, ACK] Seq=460 Ack=460 Win=64256 Len=17 TSval=1044997775 TSecr=3169257436
1711546525.791707993   321 0.911841062    10.10.1.1 → 10.10.1.2    TCP 83 8081 → 52592 [PSH, ACK] Seq=460 Ack=477 Win=65152 Len=17 TSval=3169257483 TSecr=1044997775
1711546526.791707993   322 0.911882173    10.10.1.2 → 10.10.1.1    TCP 66 52592 → 8081 [ACK] Seq=477 Ack=477 Win=64256 Len=0 TSval=1044997775 TSecr=3169257483
1711546534.791707993   330 0.930769541    10.10.1.2 → 10.10.1.1    TCP 83 52592 → 8081 [PSH, ACK] Seq=477 Ack=477 Win=64256 Len=17 TSval=1044997794 TSecr=3169257483
1711546536.791707993   332 0.930883341    10.10.1.1 → 10.10.1.2    TCP 83 8081 → 52592 [PSH, ACK] Seq=477 Ack=494 Win=65152 Len=17 TSval=3169257502 TSecr=1044997794
1711546544.791707993   340 0.933447755    10.10.1.2 → 10.10.1.1    TCP 83 52592 → 8081 [PSH, ACK] Seq=494 Ack=494 Win=64256 Len=17 TSval=1044997797 TSecr=3169257502
1711546546.791707993   342 0.933562546    10.10.1.1 → 10.10.1.2    TCP 83 8081 → 52592 [PSH, ACK] Seq=494 Ack=511 Win=65152 Len=17 TSval=3169257505 TSecr=1044997797
1711546553.791707993   349 0.934159701    10.10.1.2 → 10.10.1.1    TCP 83 52592 → 8081 [PSH, ACK] Seq=511 Ack=511 Win=64256 Len=17 TSval=1044997797 TSecr=3169257505
1711546556.791707993   352 0.934276276    10.10.1.1 → 10.10.1.2    TCP 83 8081 → 52592 [PSH, ACK] Seq=511 Ack=528 Win=65152 Len=17 TSval=3169257506 TSecr=1044997797
1711546564.791707993   360 0.951901639    10.10.1.2 → 10.10.1.1    TCP 83 52592 → 8081 [PSH, ACK] Seq=528 Ack=528 Win=64256 Len=17 TSval=1044997815 TSecr=3169257506
1711546566.791707993   362 0.952021197    10.10.1.1 → 10.10.1.2    TCP 83 8081 → 52592 [PSH, ACK] Seq=528 Ack=545 Win=65152 Len=17 TSval=3169257523 TSecr=1044997815
1711546574.791707993   370 0.982940796    10.10.1.2 → 10.10.1.1    TCP 83 52592 → 8081 [PSH, ACK] Seq=545 Ack=545 Win=64256 Len=17 TSval=1044997846 TSecr=3169257523
1711546576.791707993   372 0.983061015    10.10.1.1 → 10.10.1.2    TCP 83 8081 → 52592 [PSH, ACK] Seq=545 Ack=562 Win=65152 Len=17 TSval=3169257554 TSecr=1044997846
1711546584.791707993   380 0.984827846    10.10.1.2 → 10.10.1.1    TCP 83 52592 → 8081 [PSH, ACK] Seq=562 Ack=562 Win=64256 Len=17 TSval=1044997848 TSecr=3169257554
1711546586.791707993   382 0.984943452    10.10.1.1 → 10.10.1.2    TCP 83 8081 → 52592 [PSH, ACK] Seq=562 Ack=579 Win=65152 Len=17 TSval=3169257556 TSecr=1044997848
1711546594.791707993   390 0.986560122    10.10.1.2 → 10.10.1.1    TCP 83 52592 → 8081 [PSH, ACK] Seq=579 Ack=579 Win=64256 Len=17 TSval=1044997850 TSecr=3169257556
1711546596.791707993   392 0.986679338    10.10.1.1 → 10.10.1.2    TCP 83 8081 → 52592 [PSH, ACK] Seq=579 Ack=596 Win=65152 Len=17 TSval=3169257558 TSecr=1044997850
1711546604.791707993   400 0.994868414    10.10.1.2 → 10.10.1.1    TCP 83 52592 → 8081 [PSH, ACK] Seq=596 Ack=596 Win=64256 Len=17 TSval=1044997858 TSecr=3169257558
1711546606.791707993   402 0.994987830    10.10.1.1 → 10.10.1.2    TCP 83 8081 → 52592 [PSH, ACK] Seq=596 Ack=613 Win=65152 Len=17 TSval=3169257566 TSecr=1044997858
1711546614.791707993   410 1.007326940    10.10.1.2 → 10.10.1.1    TCP 83 52592 → 8081 [PSH, ACK] Seq=613 Ack=613 Win=64256 Len=17 TSval=1044997870 TSecr=3169257566
1711546616.791707993   412 1.007447172    10.10.1.1 → 10.10.1.2    TCP 83 8081 → 52592 [PSH, ACK] Seq=613 Ack=630 Win=65152 Len=17 TSval=3169257579 TSecr=1044997870
1711546624.791707993   420 1.017457465    10.10.1.2 → 10.10.1.1    TCP 83 52592 → 8081 [PSH, ACK] Seq=630 Ack=630 Win=64256 Len=17 TSval=1044997881 TSecr=3169257579
1711546626.791707993   422 1.017577343    10.10.1.1 → 10.10.1.2    TCP 83 8081 → 52592 [PSH, ACK] Seq=630 Ack=647 Win=65152 Len=17 TSval=3169257589 TSecr=1044997881
1711546634.791707993   430 1.026460806    10.10.1.2 → 10.10.1.1    TCP 83 52592 → 8081 [PSH, ACK] Seq=647 Ack=647 Win=64256 Len=17 TSval=1044997890 TSecr=3169257589
1711546636.791707993   432 1.026579515    10.10.1.1 → 10.10.1.2    TCP 83 8081 → 52592 [PSH, ACK] Seq=647 Ack=664 Win=65152 Len=17 TSval=3169257598 TSecr=1044997890
1711546644.791707993   440 1.031953554    10.10.1.2 → 10.10.1.1    TCP 83 52592 → 8081 [PSH, ACK] Seq=664 Ack=664 Win=64256 Len=17 TSval=1044997895 TSecr=3169257598
1711546646.791707993   442 1.032071392    10.10.1.1 → 10.10.1.2    TCP 83 8081 → 52592 [PSH, ACK] Seq=664 Ack=681 Win=65152 Len=17 TSval=3169257603 TSecr=1044997895
1711546653.791707993   449 1.032341261    10.10.1.2 → 10.10.1.1    TCP 83 52592 → 8081 [PSH, ACK] Seq=681 Ack=681 Win=64256 Len=17 TSval=1044997896 TSecr=3169257603
1711546655.791707993   451 1.032374831    10.10.1.1 → 10.10.1.2    TCP 83 8081 → 52592 [PSH, ACK] Seq=681 Ack=698 Win=65152 Len=17 TSval=3169257604 TSecr=1044997896
1711546664.791707993   460 1.048799334    10.10.1.2 → 10.10.1.1    TCP 83 52592 → 8081 [PSH, ACK] Seq=698 Ack=698 Win=64256 Len=17 TSval=1044997912 TSecr=3169257604
1711546666.791707993   462 1.048918269    10.10.1.1 → 10.10.1.2    TCP 83 8081 → 52592 [PSH, ACK] Seq=698 Ack=715 Win=65152 Len=17 TSval=3169257620 TSecr=1044997912
1711546674.791707993   470 1.063851354    10.10.1.2 → 10.10.1.1    TCP 83 52592 → 8081 [PSH, ACK] Seq=715 Ack=715 Win=64256 Len=17 TSval=1044997927 TSecr=3169257620
1711546676.791707993   472 1.063970250    10.10.1.1 → 10.10.1.2    TCP 83 8081 → 52592 [PSH, ACK] Seq=715 Ack=732 Win=65152 Len=17 TSval=3169257635 TSecr=1044997927
1711546684.791707993   480 1.067787346    10.10.1.2 → 10.10.1.1    TCP 83 52592 → 8081 [PSH, ACK] Seq=732 Ack=732 Win=64256 Len=17 TSval=1044997931 TSecr=3169257635
1711546686.791707993   482 1.067908607    10.10.1.1 → 10.10.1.2    TCP 83 8081 → 52592 [PSH, ACK] Seq=732 Ack=749 Win=65152 Len=17 TSval=3169257639 TSecr=1044997931
1711546694.791707993   490 1.086706018    10.10.1.2 → 10.10.1.1    TCP 83 52592 → 8081 [PSH, ACK] Seq=749 Ack=749 Win=64256 Len=17 TSval=1044997950 TSecr=3169257639
1711546696.791707993   492 1.086825146    10.10.1.1 → 10.10.1.2    TCP 83 8081 → 52592 [PSH, ACK] Seq=749 Ack=766 Win=65152 Len=17 TSval=3169257658 TSecr=1044997950
1711546704.791707993   500 1.088720404    10.10.1.2 → 10.10.1.1    TCP 83 52592 → 8081 [PSH, ACK] Seq=766 Ack=766 Win=64256 Len=17 TSval=1044997952 TSecr=3169257658
1711546706.791707993   502 1.088836021    10.10.1.1 → 10.10.1.2    TCP 83 8081 → 52592 [PSH, ACK] Seq=766 Ack=783 Win=65152 Len=17 TSval=3169257660 TSecr=1044997952
1711546714.791707993   510 1.098621559    10.10.1.2 → 10.10.1.1    TCP 83 52592 → 8081 [PSH, ACK] Seq=783 Ack=783 Win=64256 Len=17 TSval=1044997962 TSecr=3169257660
1711546716.791707993   512 1.098740545    10.10.1.1 → 10.10.1.2    TCP 83 8081 → 52592 [PSH, ACK] Seq=783 Ack=800 Win=65152 Len=17 TSval=3169257670 TSecr=1044997962
1711546724.791707993   520 1.100698199    10.10.1.2 → 10.10.1.1    TCP 83 52592 → 8081 [PSH, ACK] Seq=800 Ack=800 Win=64256 Len=17 TSval=1044997964 TSecr=3169257670
1711546726.791707993   522 1.100814617    10.10.1.1 → 10.10.1.2    TCP 83 8081 → 52592 [PSH, ACK] Seq=800 Ack=817 Win=65152 Len=17 TSval=3169257672 TSecr=1044997964
1711546734.791707993   530 1.104100529    10.10.1.2 → 10.10.1.1    TCP 83 52592 → 8081 [PSH, ACK] Seq=817 Ack=817 Win=64256 Len=17 TSval=1044997967 TSecr=3169257672
1711546736.791707993   532 1.104219076    10.10.1.1 → 10.10.1.2    TCP 83 8081 → 52592 [PSH, ACK] Seq=817 Ack=834 Win=65152 Len=17 TSval=3169257676 TSecr=1044997967
1711546744.791707993   540 1.107317700    10.10.1.2 → 10.10.1.1    TCP 83 52592 → 8081 [PSH, ACK] Seq=834 Ack=834 Win=64256 Len=17 TSval=1044997970 TSecr=3169257676
1711546746.791707993   542 1.107436907    10.10.1.1 → 10.10.1.2    TCP 83 8081 → 52592 [PSH, ACK] Seq=834 Ack=851 Win=65152 Len=17 TSval=3169257679 TSecr=1044997970
1711546754.791707993   550 1.112498474    10.10.1.2 → 10.10.1.1    TCP 83 52592 → 8081 [PSH, ACK] Seq=851 Ack=851 Win=64256 Len=17 TSval=1044997976 TSecr=3169257679
1711546756.791707993   552 1.112618199    10.10.1.1 → 10.10.1.2    TCP 83 8081 → 52592 [PSH, ACK] Seq=851 Ack=868 Win=65152 Len=17 TSval=3169257684 TSecr=1044997976
1711546764.791707993   560 1.123464377    10.10.1.2 → 10.10.1.1    TCP 83 52592 → 8081 [PSH, ACK] Seq=868 Ack=868 Win=64256 Len=17 TSval=1044997987 TSecr=3169257684
1711546766.791707993   562 1.123583306    10.10.1.1 → 10.10.1.2    TCP 83 8081 → 52592 [PSH, ACK] Seq=868 Ack=885 Win=65152 Len=17 TSval=3169257695 TSecr=1044997987
1711546773.791707993   569 1.123979676    10.10.1.2 → 10.10.1.1    TCP 83 52592 → 8081 [PSH, ACK] Seq=885 Ack=885 Win=64256 Len=17 TSval=1044997987 TSecr=3169257695
1711546775.791707993   571 1.124024727    10.10.1.1 → 10.10.1.2    TCP 83 8081 → 52592 [PSH, ACK] Seq=885 Ack=902 Win=65152 Len=17 TSval=3169257695 TSecr=1044997987
1711546786.791707993   582 1.127066417    10.10.1.2 → 10.10.1.1    TCP 83 52592 → 8081 [PSH, ACK] Seq=902 Ack=902 Win=64256 Len=17 TSval=1044997990 TSecr=3169257695
1711546788.791707993   584 1.127184483    10.10.1.1 → 10.10.1.2    TCP 83 8081 → 52592 [PSH, ACK] Seq=902 Ack=919 Win=65152 Len=17 TSval=3169257699 TSecr=1044997990
1711546796.791707993   592 1.136497859    10.10.1.2 → 10.10.1.1    TCP 83 52592 → 8081 [PSH, ACK] Seq=919 Ack=919 Win=64256 Len=17 TSval=1044998000 TSecr=3169257699
1711546798.791707993   594 1.136617063    10.10.1.1 → 10.10.1.2    TCP 83 8081 → 52592 [PSH, ACK] Seq=919 Ack=936 Win=65152 Len=17 TSval=3169257708 TSecr=1044998000
1711546806.791707993   602 1.139350361    10.10.1.2 → 10.10.1.1    TCP 83 52592 → 8081 [PSH, ACK] Seq=936 Ack=936 Win=64256 Len=17 TSval=1044998002 TSecr=3169257708
1711546808.791707993   604 1.139468843    10.10.1.1 → 10.10.1.2    TCP 83 8081 → 52592 [PSH, ACK] Seq=936 Ack=953 Win=65152 Len=17 TSval=3169257711 TSecr=1044998002
1711546816.791707993   612 1.142439063    10.10.1.2 → 10.10.1.1    TCP 83 52592 → 8081 [PSH, ACK] Seq=953 Ack=953 Win=64256 Len=17 TSval=1044998006 TSecr=3169257711
1711546818.791707993   614 1.142612584    10.10.1.1 → 10.10.1.2    TCP 83 8081 → 52592 [PSH, ACK] Seq=953 Ack=970 Win=65152 Len=17 TSval=3169257714 TSecr=1044998006
1711546826.791707993   622 1.151817264    10.10.1.2 → 10.10.1.1    TCP 83 52592 → 8081 [PSH, ACK] Seq=970 Ack=970 Win=64256 Len=17 TSval=1044998015 TSecr=3169257714
1711546828.791707993   624 1.151936271    10.10.1.1 → 10.10.1.2    TCP 83 8081 → 52592 [PSH, ACK] Seq=970 Ack=987 Win=65152 Len=17 TSval=3169257723 TSecr=1044998015
1711546836.791707993   632 1.154547214    10.10.1.2 → 10.10.1.1    TCP 83 52592 → 8081 [PSH, ACK] Seq=987 Ack=987 Win=64256 Len=17 TSval=1044998018 TSecr=3169257723
1711546838.791707993   634 1.154666720    10.10.1.1 → 10.10.1.2    TCP 83 8081 → 52592 [PSH, ACK] Seq=987 Ack=1004 Win=65152 Len=17 TSval=3169257726 TSecr=1044998018
1711546846.791707993   642 1.155787735    10.10.1.2 → 10.10.1.1    TCP 83 52592 → 8081 [PSH, ACK] Seq=1004 Ack=1004 Win=64256 Len=17 TSval=1044998019 TSecr=3169257726
1711546848.791707993   644 1.155903326    10.10.1.1 → 10.10.1.2    TCP 83 8081 → 52592 [PSH, ACK] Seq=1004 Ack=1021 Win=65152 Len=17 TSval=3169257727 TSecr=1044998019
1711546856.791707993   652 1.172194004    10.10.1.2 → 10.10.1.1    TCP 83 52592 → 8081 [PSH, ACK] Seq=1021 Ack=1021 Win=64256 Len=17 TSval=1044998035 TSecr=3169257727
1711546858.791707993   654 1.172312682    10.10.1.1 → 10.10.1.2    TCP 83 8081 → 52592 [PSH, ACK] Seq=1021 Ack=1038 Win=65152 Len=17 TSval=3169257744 TSecr=1044998035
1711546866.791707993   662 1.175474447    10.10.1.2 → 10.10.1.1    TCP 83 52592 → 8081 [PSH, ACK] Seq=1038 Ack=1038 Win=64256 Len=17 TSval=1044998039 TSecr=3169257744
1711546868.791707993   664 1.175592959    10.10.1.1 → 10.10.1.2    TCP 83 8081 → 52592 [PSH, ACK] Seq=1038 Ack=1055 Win=65152 Len=17 TSval=3169257747 TSecr=1044998039
1711546876.791707993   672 1.199732213    10.10.1.2 → 10.10.1.1    TCP 83 52592 → 8081 [PSH, ACK] Seq=1055 Ack=1055 Win=64256 Len=17 TSval=1044998063 TSecr=3169257747
1711546878.791707993   674 1.199851644    10.10.1.1 → 10.10.1.2    TCP 83 8081 → 52592 [PSH, ACK] Seq=1055 Ack=1072 Win=65152 Len=17 TSval=3169257771 TSecr=1044998063
1711546886.791707993   682 1.214059160    10.10.1.2 → 10.10.1.1    TCP 83 52592 → 8081 [PSH, ACK] Seq=1072 Ack=1072 Win=64256 Len=17 TSval=1044998077 TSecr=3169257771
1711546888.791707993   684 1.214178890    10.10.1.1 → 10.10.1.2    TCP 83 8081 → 52592 [PSH, ACK] Seq=1072 Ack=1089 Win=65152 Len=17 TSval=3169257786 TSecr=1044998077
1711546896.791707993   692 1.219440123    10.10.1.2 → 10.10.1.1    TCP 83 52592 → 8081 [PSH, ACK] Seq=1089 Ack=1089 Win=64256 Len=17 TSval=1044998083 TSecr=3169257786
1711546898.791707993   694 1.219555014    10.10.1.1 → 10.10.1.2    TCP 83 8081 → 52592 [PSH, ACK] Seq=1089 Ack=1106 Win=65152 Len=17 TSval=3169257791 TSecr=1044998083
1711546905.791707993   701 1.220086772    10.10.1.2 → 10.10.1.1    TCP 83 52592 → 8081 [PSH, ACK] Seq=1106 Ack=1106 Win=64256 Len=17 TSval=1044998083 TSecr=3169257791
1711546907.791707993   703 1.220118987    10.10.1.1 → 10.10.1.2    TCP 83 8081 → 52592 [PSH, ACK] Seq=1106 Ack=1123 Win=65152 Len=17 TSval=3169257792 TSecr=1044998083
1711546916.791707993   712 1.223924804    10.10.1.2 → 10.10.1.1    TCP 83 52592 → 8081 [PSH, ACK] Seq=1123 Ack=1123 Win=64256 Len=17 TSval=1044998087 TSecr=3169257792
1711546918.791707993   714 1.224039034    10.10.1.1 → 10.10.1.2    TCP 83 8081 → 52592 [PSH, ACK] Seq=1123 Ack=1140 Win=65152 Len=17 TSval=3169257795 TSecr=1044998087
1711546926.791707993   722 1.225286344    10.10.1.2 → 10.10.1.1    TCP 83 52592 → 8081 [PSH, ACK] Seq=1140 Ack=1140 Win=64256 Len=17 TSval=1044998088 TSecr=3169257795
1711546928.791707993   724 1.225397110    10.10.1.1 → 10.10.1.2    TCP 83 8081 → 52592 [PSH, ACK] Seq=1140 Ack=1157 Win=65152 Len=17 TSval=3169257797 TSecr=1044998088
1711546936.791707993   732 1.236422742    10.10.1.2 → 10.10.1.1    TCP 83 52592 → 8081 [PSH, ACK] Seq=1157 Ack=1157 Win=64256 Len=17 TSval=1044998100 TSecr=3169257797
1711546938.791707993   734 1.236542069    10.10.1.1 → 10.10.1.2    TCP 83 8081 → 52592 [PSH, ACK] Seq=1157 Ack=1174 Win=65152 Len=17 TSval=3169257808 TSecr=1044998100
1711546946.791707993   742 1.257865601    10.10.1.2 → 10.10.1.1    TCP 83 52592 → 8081 [PSH, ACK] Seq=1174 Ack=1174 Win=64256 Len=17 TSval=1044998121 TSecr=3169257808
1711546948.791707993   744 1.257985898    10.10.1.1 → 10.10.1.2    TCP 83 8081 → 52592 [PSH, ACK] Seq=1174 Ack=1191 Win=65152 Len=17 TSval=3169257829 TSecr=1044998121
1711546956.791707993   752 1.265107460    10.10.1.2 → 10.10.1.1    TCP 83 52592 → 8081 [PSH, ACK] Seq=1191 Ack=1191 Win=64256 Len=17 TSval=1044998128 TSecr=3169257829
1711546958.791707993   754 1.265226475    10.10.1.1 → 10.10.1.2    TCP 83 8081 → 52592 [PSH, ACK] Seq=1191 Ack=1208 Win=65152 Len=17 TSval=3169257837 TSecr=1044998128
1711546966.791707993   762 1.276580472    10.10.1.2 → 10.10.1.1    TCP 83 52592 → 8081 [PSH, ACK] Seq=1208 Ack=1208 Win=64256 Len=17 TSval=1044998140 TSecr=3169257837
1711546968.791707993   764 1.276699963    10.10.1.1 → 10.10.1.2    TCP 83 8081 → 52592 [PSH, ACK] Seq=1208 Ack=1225 Win=65152 Len=17 TSval=3169257848 TSecr=1044998140
1711546976.791707993   772 1.288341834    10.10.1.2 → 10.10.1.1    TCP 83 52592 → 8081 [PSH, ACK] Seq=1225 Ack=1225 Win=64256 Len=17 TSval=1044998151 TSecr=3169257848
1711546978.791707993   774 1.288461860    10.10.1.1 → 10.10.1.2    TCP 83 8081 → 52592 [PSH, ACK] Seq=1225 Ack=1242 Win=65152 Len=17 TSval=3169257860 TSecr=1044998151
1711546986.791707993   782 1.291809521    10.10.1.2 → 10.10.1.1    TCP 83 52592 → 8081 [PSH, ACK] Seq=1242 Ack=1242 Win=64256 Len=17 TSval=1044998155 TSecr=3169257860
1711546988.791707993   784 1.291929896    10.10.1.1 → 10.10.1.2    TCP 83 8081 → 52592 [PSH, ACK] Seq=1242 Ack=1259 Win=65152 Len=17 TSval=3169257863 TSecr=1044998155
1711546996.791707993   792 1.327512613    10.10.1.2 → 10.10.1.1    TCP 83 52592 → 8081 [PSH, ACK] Seq=1259 Ack=1259 Win=64256 Len=17 TSval=1044998191 TSecr=3169257863
1711546998.791707993   794 1.327634641    10.10.1.1 → 10.10.1.2    TCP 83 8081 → 52592 [PSH, ACK] Seq=1259 Ack=1276 Win=65152 Len=17 TSval=3169257899 TSecr=1044998191
1711547006.791707993   802 1.335297983    10.10.1.2 → 10.10.1.1    TCP 83 52592 → 8081 [PSH, ACK] Seq=1276 Ack=1276 Win=64256 Len=17 TSval=1044998198 TSecr=3169257899
1711547008.791707993   804 1.335417159    10.10.1.1 → 10.10.1.2    TCP 83 8081 → 52592 [PSH, ACK] Seq=1276 Ack=1293 Win=65152 Len=17 TSval=3169257907 TSecr=1044998198
1711547016.791707993   812 1.341097763    10.10.1.2 → 10.10.1.1    TCP 83 52592 → 8081 [PSH, ACK] Seq=1293 Ack=1293 Win=64256 Len=17 TSval=1044998204 TSecr=3169257907
1711547018.791707993   814 1.341216090    10.10.1.1 → 10.10.1.2    TCP 83 8081 → 52592 [PSH, ACK] Seq=1293 Ack=1310 Win=65152 Len=17 TSval=3169257913 TSecr=1044998204
1711547026.791707993   822 1.350271232    10.10.1.2 → 10.10.1.1    TCP 83 52592 → 8081 [PSH, ACK] Seq=1310 Ack=1310 Win=64256 Len=17 TSval=1044998213 TSecr=3169257913
1711547028.791707993   824 1.350389449    10.10.1.1 → 10.10.1.2    TCP 83 8081 → 52592 [PSH, ACK] Seq=1310 Ack=1327 Win=65152 Len=17 TSval=3169257922 TSecr=1044998213
1711547036.791707993   832 1.362072267    10.10.1.2 → 10.10.1.1    TCP 83 52592 → 8081 [PSH, ACK] Seq=1327 Ack=1327 Win=64256 Len=17 TSval=1044998225 TSecr=3169257922
1711547038.791707993   834 1.362191473    10.10.1.1 → 10.10.1.2    TCP 83 8081 → 52592 [PSH, ACK] Seq=1327 Ack=1344 Win=65152 Len=17 TSval=3169257934 TSecr=1044998225
1711547046.791707993   842 1.373880617    10.10.1.2 → 10.10.1.1    TCP 83 52592 → 8081 [PSH, ACK] Seq=1344 Ack=1344 Win=64256 Len=17 TSval=1044998237 TSecr=3169257934
1711547048.791707993   844 1.373999672    10.10.1.1 → 10.10.1.2    TCP 83 8081 → 52592 [PSH, ACK] Seq=1344 Ack=1361 Win=65152 Len=17 TSval=3169257945 TSecr=1044998237
1711547056.791707993   852 1.392206808    10.10.1.2 → 10.10.1.1    TCP 83 52592 → 8081 [PSH, ACK] Seq=1361 Ack=1361 Win=64256 Len=17 TSval=1044998255 TSecr=3169257945
1711547058.791707993   854 1.392326897    10.10.1.1 → 10.10.1.2    TCP 83 8081 → 52592 [PSH, ACK] Seq=1361 Ack=1378 Win=65152 Len=17 TSval=3169257964 TSecr=1044998255
1711547065.791707993   861 1.393147159    10.10.1.2 → 10.10.1.1    TCP 83 52592 → 8081 [PSH, ACK] Seq=1378 Ack=1378 Win=64256 Len=17 TSval=1044998256 TSecr=3169257964
1711547067.791707993   863 1.393257675    10.10.1.1 → 10.10.1.2    TCP 83 8081 → 52592 [PSH, ACK] Seq=1378 Ack=1395 Win=65152 Len=17 TSval=3169257965 TSecr=1044998256
1711547076.791707993   872 1.397579572    10.10.1.2 → 10.10.1.1    TCP 83 52592 → 8081 [PSH, ACK] Seq=1395 Ack=1395 Win=64256 Len=17 TSval=1044998261 TSecr=3169257965
1711547078.791707993   874 1.397701264    10.10.1.1 → 10.10.1.2    TCP 83 8081 → 52592 [PSH, ACK] Seq=1395 Ack=1412 Win=65152 Len=17 TSval=3169257969 TSecr=1044998261
1711547086.791707993   882 1.417404478    10.10.1.2 → 10.10.1.1    TCP 83 52592 → 8081 [PSH, ACK] Seq=1412 Ack=1412 Win=64256 Len=17 TSval=1044998280 TSecr=3169257969
1711547088.791707993   884 1.417523694    10.10.1.1 → 10.10.1.2    TCP 83 8081 → 52592 [PSH, ACK] Seq=1412 Ack=1429 Win=65152 Len=17 TSval=3169257989 TSecr=1044998280
1711547096.791707993   892 1.421443859    10.10.1.2 → 10.10.1.1    TCP 83 52592 → 8081 [PSH, ACK] Seq=1429 Ack=1429 Win=64256 Len=17 TSval=1044998285 TSecr=3169257989
1711547098.791707993   894 1.421564774    10.10.1.1 → 10.10.1.2    TCP 83 8081 → 52592 [PSH, ACK] Seq=1429 Ack=1446 Win=65152 Len=17 TSval=3169257993 TSecr=1044998285
1711547106.791707993   902 1.448549429    10.10.1.2 → 10.10.1.1    TCP 83 52592 → 8081 [PSH, ACK] Seq=1446 Ack=1446 Win=64256 Len=17 TSval=1044998312 TSecr=3169257993
1711547108.791707993   904 1.448668397    10.10.1.1 → 10.10.1.2    TCP 83 8081 → 52592 [PSH, ACK] Seq=1446 Ack=1463 Win=65152 Len=17 TSval=3169258020 TSecr=1044998312
1711547116.791707993   912 1.449712370    10.10.1.2 → 10.10.1.1    TCP 83 52592 → 8081 [PSH, ACK] Seq=1463 Ack=1463 Win=64256 Len=17 TSval=1044998313 TSecr=3169258020
1711547118.791707993   914 1.449826279    10.10.1.1 → 10.10.1.2    TCP 83 8081 → 52592 [PSH, ACK] Seq=1463 Ack=1480 Win=65152 Len=17 TSval=3169258021 TSecr=1044998313
1711547126.791707993   922 1.457975710    10.10.1.2 → 10.10.1.1    TCP 83 52592 → 8081 [PSH, ACK] Seq=1480 Ack=1480 Win=64256 Len=17 TSval=1044998321 TSecr=3169258021
1711547128.791707993   924 1.458113022    10.10.1.1 → 10.10.1.2    TCP 83 8081 → 52592 [PSH, ACK] Seq=1480 Ack=1497 Win=65152 Len=17 TSval=3169258030 TSecr=1044998321
1711547136.791707993   932 1.465761046    10.10.1.2 → 10.10.1.1    TCP 83 52592 → 8081 [PSH, ACK] Seq=1497 Ack=1497 Win=64256 Len=17 TSval=1044998329 TSecr=3169258030
1711547138.791707993   934 1.465880244    10.10.1.1 → 10.10.1.2    TCP 83 8081 → 52592 [PSH, ACK] Seq=1497 Ack=1514 Win=65152 Len=17 TSval=3169258037 TSecr=1044998329
1711547146.791707993   942 1.469512618    10.10.1.2 → 10.10.1.1    TCP 83 52592 → 8081 [PSH, ACK] Seq=1514 Ack=1514 Win=64256 Len=17 TSval=1044998333 TSecr=3169258037
1711547148.791707993   944 1.469632877    10.10.1.1 → 10.10.1.2    TCP 83 8081 → 52592 [PSH, ACK] Seq=1514 Ack=1531 Win=65152 Len=17 TSval=3169258041 TSecr=1044998333
1711547156.791707993   952 1.479832641    10.10.1.2 → 10.10.1.1    TCP 83 52592 → 8081 [PSH, ACK] Seq=1531 Ack=1531 Win=64256 Len=17 TSval=1044998343 TSecr=3169258041
1711547158.791707993   954 1.479953283    10.10.1.1 → 10.10.1.2    TCP 83 8081 → 52592 [PSH, ACK] Seq=1531 Ack=1548 Win=65152 Len=17 TSval=3169258051 TSecr=1044998343
1711547166.791707993   962 1.484081995    10.10.1.2 → 10.10.1.1    TCP 83 52592 → 8081 [PSH, ACK] Seq=1548 Ack=1548 Win=64256 Len=17 TSval=1044998347 TSecr=3169258051
1711547168.791707993   964 1.484202273    10.10.1.1 → 10.10.1.2    TCP 83 8081 → 52592 [PSH, ACK] Seq=1548 Ack=1565 Win=65152 Len=17 TSval=3169258056 TSecr=1044998347
1711547176.791707993   972 1.492226213    10.10.1.2 → 10.10.1.1    TCP 83 52592 → 8081 [PSH, ACK] Seq=1565 Ack=1565 Win=64256 Len=17 TSval=1044998355 TSecr=3169258056
1711547178.791707993   974 1.492346163    10.10.1.1 → 10.10.1.2    TCP 83 8081 → 52592 [PSH, ACK] Seq=1565 Ack=1582 Win=65152 Len=17 TSval=3169258064 TSecr=1044998355
1711547186.791707993   982 1.500330537    10.10.1.2 → 10.10.1.1    TCP 83 52592 → 8081 [PSH, ACK] Seq=1582 Ack=1582 Win=64256 Len=17 TSval=1044998363 TSecr=3169258064
1711547188.791707993   984 1.500450077    10.10.1.1 → 10.10.1.2    TCP 83 8081 → 52592 [PSH, ACK] Seq=1582 Ack=1599 Win=65152 Len=17 TSval=3169258072 TSecr=1044998363
1711547196.791707993   992 1.501461239    10.10.1.2 → 10.10.1.1    TCP 83 52592 → 8081 [PSH, ACK] Seq=1599 Ack=1599 Win=64256 Len=17 TSval=1044998365 TSecr=3169258072
1711547198.791707993   994 1.501576688    10.10.1.1 → 10.10.1.2    TCP 83 8081 → 52592 [PSH, ACK] Seq=1599 Ack=1616 Win=65152 Len=17 TSval=3169258073 TSecr=1044998365
1711547206.791707993  1002 1.529114805    10.10.1.2 → 10.10.1.1    TCP 83 52592 → 8081 [PSH, ACK] Seq=1616 Ack=1616 Win=64256 Len=17 TSval=1044998392 TSecr=3169258073
1711547208.791707993  1004 1.529233195    10.10.1.1 → 10.10.1.2    TCP 83 8081 → 52592 [PSH, ACK] Seq=1616 Ack=1633 Win=65152 Len=17 TSval=3169258101 TSecr=1044998392
1711547216.791707993  1012 1.538032387    10.10.1.2 → 10.10.1.1    TCP 83 52592 → 8081 [PSH, ACK] Seq=1633 Ack=1633 Win=64256 Len=17 TSval=1044998401 TSecr=3169258101
1711547218.791707993  1014 1.538151776    10.10.1.1 → 10.10.1.2    TCP 83 8081 → 52592 [PSH, ACK] Seq=1633 Ack=1650 Win=65152 Len=17 TSval=3169258110 TSecr=1044998401
1711547226.791707993  1022 1.543087208    10.10.1.2 → 10.10.1.1    TCP 83 52592 → 8081 [PSH, ACK] Seq=1650 Ack=1650 Win=64256 Len=17 TSval=1044998406 TSecr=3169258110
1711547228.791707993  1024 1.543206115    10.10.1.1 → 10.10.1.2    TCP 83 8081 → 52592 [PSH, ACK] Seq=1650 Ack=1667 Win=65152 Len=17 TSval=3169258115 TSecr=1044998406
1711547235.791707993  1031 1.543682431    10.10.1.2 → 10.10.1.1    TCP 83 52592 → 8081 [PSH, ACK] Seq=1667 Ack=1667 Win=64256 Len=17 TSval=1044998407 TSecr=3169258115
1711547238.791707993  1034 1.543792591    10.10.1.1 → 10.10.1.2    TCP 83 8081 → 52592 [PSH, ACK] Seq=1667 Ack=1684 Win=65152 Len=17 TSval=3169258115 TSecr=1044998407
1711547246.791707993  1042 1.546710347    10.10.1.2 → 10.10.1.1    TCP 83 52592 → 8081 [PSH, ACK] Seq=1684 Ack=1684 Win=64256 Len=17 TSval=1044998410 TSecr=3169258115
1711547248.791707993  1044 1.546830933    10.10.1.1 → 10.10.1.2    TCP 83 8081 → 52592 [PSH, ACK] Seq=1684 Ack=1701 Win=65152 Len=17 TSval=3169258118 TSecr=1044998410
1711547256.791707993  1052 1.549984999    10.10.1.2 → 10.10.1.1    TCP 83 52592 → 8081 [PSH, ACK] Seq=1701 Ack=1701 Win=64256 Len=17 TSval=1044998413 TSecr=3169258118
1711547258.791707993  1054 1.550119446    10.10.1.1 → 10.10.1.2    TCP 83 8081 → 52592 [PSH, ACK] Seq=1701 Ack=1718 Win=65152 Len=17 TSval=3169258122 TSecr=1044998413
1711547265.791707993  1061 1.557792317    10.10.1.2 → 10.10.1.1    TCP 83 52592 → 8081 [PSH, ACK] Seq=1718 Ack=1718 Win=64256 Len=17 TSval=1044998421 TSecr=3169258122
1711547267.791707993  1063 1.557927128    10.10.1.1 → 10.10.1.2    TCP 83 8081 → 52592 [PSH, ACK] Seq=1718 Ack=1735 Win=65152 Len=17 TSval=3169258129 TSecr=1044998421
1711547276.791707993  1072 1.581718152    10.10.1.2 → 10.10.1.1    TCP 83 52592 → 8081 [PSH, ACK] Seq=1735 Ack=1735 Win=64256 Len=17 TSval=1044998445 TSecr=3169258129
1711547278.791707993  1074 1.581837627    10.10.1.1 → 10.10.1.2    TCP 83 8081 → 52592 [PSH, ACK] Seq=1735 Ack=1752 Win=65152 Len=17 TSval=3169258153 TSecr=1044998445
1711547286.791707993  1082 1.609057710    10.10.1.2 → 10.10.1.1    TCP 83 52592 → 8081 [PSH, ACK] Seq=1752 Ack=1752 Win=64256 Len=17 TSval=1044998472 TSecr=3169258153
1711547288.791707993  1084 1.609176948    10.10.1.1 → 10.10.1.2    TCP 83 8081 → 52592 [PSH, ACK] Seq=1752 Ack=1769 Win=65152 Len=17 TSval=3169258181 TSecr=1044998472
1711547296.791707993  1092 1.625245882    10.10.1.2 → 10.10.1.1    TCP 83 52592 → 8081 [PSH, ACK] Seq=1769 Ack=1769 Win=64256 Len=17 TSval=1044998488 TSecr=3169258181
1711547298.791707993  1094 1.625365467    10.10.1.1 → 10.10.1.2    TCP 83 8081 → 52592 [PSH, ACK] Seq=1769 Ack=1786 Win=65152 Len=17 TSval=3169258197 TSecr=1044998488
1711547306.791707993  1102 1.646470867    10.10.1.2 → 10.10.1.1    TCP 83 52592 → 8081 [PSH, ACK] Seq=1786 Ack=1786 Win=64256 Len=17 TSval=1044998510 TSecr=3169258197
1711547308.791707993  1104 1.646589879    10.10.1.1 → 10.10.1.2    TCP 83 8081 → 52592 [PSH, ACK] Seq=1786 Ack=1803 Win=65152 Len=17 TSval=3169258218 TSecr=1044998510
1711547316.791707993  1112 1.652930778    10.10.1.2 → 10.10.1.1    TCP 83 52592 → 8081 [PSH, ACK] Seq=1803 Ack=1803 Win=64256 Len=17 TSval=1044998516 TSecr=3169258218
1711547318.791707993  1114 1.653049099    10.10.1.1 → 10.10.1.2    TCP 83 8081 → 52592 [PSH, ACK] Seq=1803 Ack=1820 Win=65152 Len=17 TSval=3169258224 TSecr=1044998516
1711547326.791707993  1122 1.655701899    10.10.1.2 → 10.10.1.1    TCP 83 52592 → 8081 [PSH, ACK] Seq=1820 Ack=1820 Win=64256 Len=17 TSval=1044998519 TSecr=3169258224
1711547328.791707993  1124 1.655822606    10.10.1.1 → 10.10.1.2    TCP 83 8081 → 52592 [PSH, ACK] Seq=1820 Ack=1837 Win=65152 Len=17 TSval=3169258227 TSecr=1044998519
1711547336.791707993  1132 1.662255105    10.10.1.2 → 10.10.1.1    TCP 83 52592 → 8081 [PSH, ACK] Seq=1837 Ack=1837 Win=64256 Len=17 TSval=1044998525 TSecr=3169258227
1711547338.791707993  1134 1.662374846    10.10.1.1 → 10.10.1.2    TCP 83 8081 → 52592 [PSH, ACK] Seq=1837 Ack=1854 Win=65152 Len=17 TSval=3169258234 TSecr=1044998525
1711547346.791707993  1142 1.664093057    10.10.1.2 → 10.10.1.1    TCP 83 52592 → 8081 [PSH, ACK] Seq=1854 Ack=1854 Win=64256 Len=17 TSval=1044998527 TSecr=3169258234
1711547348.791707993  1144 1.664207993    10.10.1.1 → 10.10.1.2    TCP 83 8081 → 52592 [PSH, ACK] Seq=1854 Ack=1871 Win=65152 Len=17 TSval=3169258236 TSecr=1044998527
1711547356.791707993  1152 1.687015143    10.10.1.2 → 10.10.1.1    TCP 83 52592 → 8081 [PSH, ACK] Seq=1871 Ack=1871 Win=64256 Len=17 TSval=1044998550 TSecr=3169258236
1711547358.791707993  1154 1.687135251    10.10.1.1 → 10.10.1.2    TCP 83 8081 → 52592 [PSH, ACK] Seq=1871 Ack=1888 Win=65152 Len=17 TSval=3169258259 TSecr=1044998550
1711547366.791707993  1162 1.690885280    10.10.1.2 → 10.10.1.1    TCP 83 52592 → 8081 [PSH, ACK] Seq=1888 Ack=1888 Win=64256 Len=17 TSval=1044998554 TSecr=3169258259
1711547368.791707993  1164 1.691004974    10.10.1.1 → 10.10.1.2    TCP 83 8081 → 52592 [PSH, ACK] Seq=1888 Ack=1905 Win=65152 Len=17 TSval=3169258262 TSecr=1044998554
1711547376.791707993  1172 1.693489435    10.10.1.2 → 10.10.1.1    TCP 83 52592 → 8081 [PSH, ACK] Seq=1905 Ack=1905 Win=64256 Len=17 TSval=1044998557 TSecr=3169258262
1711547378.791707993  1174 1.693605549    10.10.1.1 → 10.10.1.2    TCP 83 8081 → 52592 [PSH, ACK] Seq=1905 Ack=1922 Win=65152 Len=17 TSval=3169258265 TSecr=1044998557
1711547386.791707993  1182 1.696423470    10.10.1.2 → 10.10.1.1    TCP 83 52592 → 8081 [PSH, ACK] Seq=1922 Ack=1922 Win=64256 Len=17 TSval=1044998560 TSecr=3169258265
1711547388.791707993  1184 1.696596379    10.10.1.1 → 10.10.1.2    TCP 83 8081 → 52592 [PSH, ACK] Seq=1922 Ack=1939 Win=65152 Len=17 TSval=3169258268 TSecr=1044998560
1711547396.791707993  1192 1.698495438    10.10.1.2 → 10.10.1.1    TCP 83 52592 → 8081 [PSH, ACK] Seq=1939 Ack=1939 Win=64256 Len=17 TSval=1044998562 TSecr=3169258268
1711547398.791707993  1194 1.698613586    10.10.1.1 → 10.10.1.2    TCP 83 8081 → 52592 [PSH, ACK] Seq=1939 Ack=1956 Win=65152 Len=17 TSval=3169258270 TSecr=1044998562
1711547406.791707993  1202 1.705953823    10.10.1.2 → 10.10.1.1    TCP 83 52592 → 8081 [PSH, ACK] Seq=1956 Ack=1956 Win=64256 Len=17 TSval=1044998569 TSecr=3169258270
1711547408.791707993  1204 1.706091788    10.10.1.1 → 10.10.1.2    TCP 83 8081 → 52592 [PSH, ACK] Seq=1956 Ack=1973 Win=65152 Len=17 TSval=3169258277 TSecr=1044998569
