1711548768.952409744    22 0.284479387    10.10.1.2 → 10.10.1.1    TCP 74 59950 → 8081 [SYN] Seq=0 Win=64240 Len=0 MSS=1460 SACK_PERM=1 TSval=1047539287 TSecr=0 WS=128
1711548769.952409744    23 0.284545241    10.10.1.1 → 10.10.1.2    TCP 74 8081 → 59950 [SYN, ACK] Seq=0 Ack=1 Win=65160 Len=0 MSS=1460 SACK_PERM=1 TSval=3171798998 TSecr=1047539287 WS=128
1711548770.952409744    24 0.284593939    10.10.1.2 → 10.10.1.1    TCP 66 59950 → 8081 [ACK] Seq=1 Ack=1 Win=64256 Len=0 TSval=1047539287 TSecr=3171798998
1711548780.952409744    34 0.537660319    10.10.1.2 → 10.10.1.1    TCP 83 59950 → 8081 [PSH, ACK] Seq=1 Ack=1 Win=64256 Len=17 TSval=1047539540 TSecr=3171798998
1711548782.952409744    36 0.537689855    10.10.1.1 → 10.10.1.2    TCP 66 8081 → 59950 [ACK] Seq=1 Ack=18 Win=65152 Len=0 TSval=3171799251 TSecr=1047539540
1711548784.952409744    38 0.537983857    10.10.1.1 → 10.10.1.2    TCP 83 8081 → 59950 [PSH, ACK] Seq=1 Ack=18 Win=65152 Len=17 TSval=3171799252 TSecr=1047539540
1711548785.952409744    39 0.538012360    10.10.1.2 → 10.10.1.1    TCP 66 59950 → 8081 [ACK] Seq=18 Ack=18 Win=64256 Len=0 TSval=1047539541 TSecr=3171799252
1711548790.952409744    44 0.539195556    10.10.1.2 → 10.10.1.1    TCP 83 59950 → 8081 [PSH, ACK] Seq=18 Ack=18 Win=64256 Len=17 TSval=1047539542 TSecr=3171799252
1711548793.952409744    47 0.539319602    10.10.1.1 → 10.10.1.2    TCP 83 8081 → 59950 [PSH, ACK] Seq=18 Ack=35 Win=65152 Len=17 TSval=3171799253 TSecr=1047539542
1711548798.952409744    52 0.540530443    10.10.1.2 → 10.10.1.1    TCP 83 59950 → 8081 [PSH, ACK] Seq=35 Ack=35 Win=64256 Len=17 TSval=1047539543 TSecr=3171799253
1711548801.952409744    55 0.540660570    10.10.1.1 → 10.10.1.2    TCP 83 8081 → 59950 [PSH, ACK] Seq=35 Ack=52 Win=65152 Len=17 TSval=3171799254 TSecr=1047539543
1711548806.952409744    60 0.541870571    10.10.1.2 → 10.10.1.1    TCP 83 59950 → 8081 [PSH, ACK] Seq=52 Ack=52 Win=64256 Len=17 TSval=1047539545 TSecr=3171799254
1711548809.952409744    63 0.541995194    10.10.1.1 → 10.10.1.2    TCP 83 8081 → 59950 [PSH, ACK] Seq=52 Ack=69 Win=65152 Len=17 TSval=3171799256 TSecr=1047539545
1711548814.952409744    68 0.543201197    10.10.1.2 → 10.10.1.1    TCP 83 59950 → 8081 [PSH, ACK] Seq=69 Ack=69 Win=64256 Len=17 TSval=1047539546 TSecr=3171799256
1711548817.952409744    71 0.543325768    10.10.1.1 → 10.10.1.2    TCP 83 8081 → 59950 [PSH, ACK] Seq=69 Ack=86 Win=65152 Len=17 TSval=3171799257 TSecr=1047539546
1711548822.952409744    76 0.544532540    10.10.1.2 → 10.10.1.1    TCP 83 59950 → 8081 [PSH, ACK] Seq=86 Ack=86 Win=64256 Len=17 TSval=1047539547 TSecr=3171799257
1711548824.952409744    78 0.544662535    10.10.1.1 → 10.10.1.2    TCP 83 8081 → 59950 [PSH, ACK] Seq=86 Ack=103 Win=65152 Len=17 TSval=3171799258 TSecr=1047539547
1711548830.952409744    84 0.545872285    10.10.1.2 → 10.10.1.1    TCP 83 59950 → 8081 [PSH, ACK] Seq=103 Ack=103 Win=64256 Len=17 TSval=1047539549 TSecr=3171799258
1711548832.952409744    86 0.545997057    10.10.1.1 → 10.10.1.2    TCP 83 8081 → 59950 [PSH, ACK] Seq=103 Ack=120 Win=65152 Len=17 TSval=3171799260 TSecr=1047539549
1711548838.952409744    92 0.547203254    10.10.1.2 → 10.10.1.1    TCP 83 59950 → 8081 [PSH, ACK] Seq=120 Ack=120 Win=64256 Len=17 TSval=1047539550 TSecr=3171799260
1711548840.952409744    94 0.547324809    10.10.1.1 → 10.10.1.2    TCP 83 8081 → 59950 [PSH, ACK] Seq=120 Ack=137 Win=65152 Len=17 TSval=3171799261 TSecr=1047539550
1711548846.952409744   100 0.548533843    10.10.1.2 → 10.10.1.1    TCP 83 59950 → 8081 [PSH, ACK] Seq=137 Ack=137 Win=64256 Len=17 TSval=1047539551 TSecr=3171799261
1711548848.952409744   102 0.548664338    10.10.1.1 → 10.10.1.2    TCP 83 8081 → 59950 [PSH, ACK] Seq=137 Ack=154 Win=65152 Len=17 TSval=3171799262 TSecr=1047539551
1711548854.952409744   108 0.549873937    10.10.1.2 → 10.10.1.1    TCP 83 59950 → 8081 [PSH, ACK] Seq=154 Ack=154 Win=64256 Len=17 TSval=1047539553 TSecr=3171799262
1711548856.952409744   110 0.549998594    10.10.1.1 → 10.10.1.2    TCP 83 8081 → 59950 [PSH, ACK] Seq=154 Ack=171 Win=65152 Len=17 TSval=3171799264 TSecr=1047539553
1711548862.952409744   116 0.551205896    10.10.1.2 → 10.10.1.1    TCP 83 59950 → 8081 [PSH, ACK] Seq=171 Ack=171 Win=64256 Len=17 TSval=1047539554 TSecr=3171799264
1711548864.952409744   118 0.551331176    10.10.1.1 → 10.10.1.2    TCP 83 8081 → 59950 [PSH, ACK] Seq=171 Ack=188 Win=65152 Len=17 TSval=3171799265 TSecr=1047539554
1711548870.952409744   124 0.552539450    10.10.1.2 → 10.10.1.1    TCP 83 59950 → 8081 [PSH, ACK] Seq=188 Ack=188 Win=64256 Len=17 TSval=1047539555 TSecr=3171799265
1711548872.952409744   126 0.552669285    10.10.1.1 → 10.10.1.2    TCP 83 8081 → 59950 [PSH, ACK] Seq=188 Ack=205 Win=65152 Len=17 TSval=3171799266 TSecr=1047539555
1711548878.952409744   132 0.553878589    10.10.1.2 → 10.10.1.1    TCP 83 59950 → 8081 [PSH, ACK] Seq=205 Ack=205 Win=64256 Len=17 TSval=1047539557 TSecr=3171799266
1711548880.952409744   134 0.554003940    10.10.1.1 → 10.10.1.2    TCP 83 8081 → 59950 [PSH, ACK] Seq=205 Ack=222 Win=65152 Len=17 TSval=3171799268 TSecr=1047539557
1711548886.952409744   140 0.555210627    10.10.1.2 → 10.10.1.1    TCP 83 59950 → 8081 [PSH, ACK] Seq=222 Ack=222 Win=64256 Len=17 TSval=1047539558 TSecr=3171799268
1711548888.952409744   142 0.555335162    10.10.1.1 → 10.10.1.2    TCP 83 8081 → 59950 [PSH, ACK] Seq=222 Ack=239 Win=65152 Len=17 TSval=3171799269 TSecr=1047539558
1711548894.952409744   148 0.556541712    10.10.1.2 → 10.10.1.1    TCP 83 59950 → 8081 [PSH, ACK] Seq=239 Ack=239 Win=64256 Len=17 TSval=1047539559 TSecr=3171799269
1711548896.952409744   150 0.556671487    10.10.1.1 → 10.10.1.2    TCP 83 8081 → 59950 [PSH, ACK] Seq=239 Ack=256 Win=65152 Len=17 TSval=3171799270 TSecr=1047539559
1711548902.952409744   156 0.557882179    10.10.1.2 → 10.10.1.1    TCP 83 59950 → 8081 [PSH, ACK] Seq=256 Ack=256 Win=64256 Len=17 TSval=1047539561 TSecr=3171799270
1711548904.952409744   158 0.558006360    10.10.1.1 → 10.10.1.2    TCP 83 8081 → 59950 [PSH, ACK] Seq=256 Ack=273 Win=65152 Len=17 TSval=3171799272 TSecr=1047539561
1711548910.952409744   164 0.559212088    10.10.1.2 → 10.10.1.1    TCP 83 59950 → 8081 [PSH, ACK] Seq=273 Ack=273 Win=64256 Len=17 TSval=1047539562 TSecr=3171799272
1711548912.952409744   166 0.559332200    10.10.1.1 → 10.10.1.2    TCP 83 8081 → 59950 [PSH, ACK] Seq=273 Ack=290 Win=65152 Len=17 TSval=3171799273 TSecr=1047539562
1711548918.952409744   172 0.560539512    10.10.1.2 → 10.10.1.1    TCP 83 59950 → 8081 [PSH, ACK] Seq=290 Ack=290 Win=64256 Len=17 TSval=1047539563 TSecr=3171799273
1711548920.952409744   174 0.560672245    10.10.1.1 → 10.10.1.2    TCP 83 8081 → 59950 [PSH, ACK] Seq=290 Ack=307 Win=65152 Len=17 TSval=3171799274 TSecr=1047539563
1711548926.952409744   180 0.561884948    10.10.1.2 → 10.10.1.1    TCP 83 59950 → 8081 [PSH, ACK] Seq=307 Ack=307 Win=64256 Len=17 TSval=1047539565 TSecr=3171799274
1711548928.952409744   182 0.562010348    10.10.1.1 → 10.10.1.2    TCP 83 8081 → 59950 [PSH, ACK] Seq=307 Ack=324 Win=65152 Len=17 TSval=3171799276 TSecr=1047539565
1711548934.952409744   188 0.563216245    10.10.1.2 → 10.10.1.1    TCP 83 59950 → 8081 [PSH, ACK] Seq=324 Ack=324 Win=64256 Len=17 TSval=1047539566 TSecr=3171799276
1711548936.952409744   190 0.563337143    10.10.1.1 → 10.10.1.2    TCP 83 8081 → 59950 [PSH, ACK] Seq=324 Ack=341 Win=65152 Len=17 TSval=3171799277 TSecr=1047539566
1711548942.952409744   196 0.564542416    10.10.1.2 → 10.10.1.1    TCP 83 59950 → 8081 [PSH, ACK] Seq=341 Ack=341 Win=64256 Len=17 TSval=1047539567 TSecr=3171799277
1711548944.952409744   198 0.564673766    10.10.1.1 → 10.10.1.2    TCP 83 8081 → 59950 [PSH, ACK] Seq=341 Ack=358 Win=65152 Len=17 TSval=3171799278 TSecr=1047539567
1711548950.952409744   204 0.565881818    10.10.1.2 → 10.10.1.1    TCP 83 59950 → 8081 [PSH, ACK] Seq=358 Ack=358 Win=64256 Len=17 TSval=1047539569 TSecr=3171799278
1711548952.952409744   206 0.566007300    10.10.1.1 → 10.10.1.2    TCP 83 8081 → 59950 [PSH, ACK] Seq=358 Ack=375 Win=65152 Len=17 TSval=3171799280 TSecr=1047539569
1711548958.952409744   212 0.567213113    10.10.1.2 → 10.10.1.1    TCP 83 59950 → 8081 [PSH, ACK] Seq=375 Ack=375 Win=64256 Len=17 TSval=1047539570 TSecr=3171799280
1711548960.952409744   214 0.567338769    10.10.1.1 → 10.10.1.2    TCP 83 8081 → 59950 [PSH, ACK] Seq=375 Ack=392 Win=65152 Len=17 TSval=3171799281 TSecr=1047539570
1711548966.952409744   220 0.568544926    10.10.1.2 → 10.10.1.1    TCP 83 59950 → 8081 [PSH, ACK] Seq=392 Ack=392 Win=64256 Len=17 TSval=1047539571 TSecr=3171799281
1711548968.952409744   222 0.568683732    10.10.1.1 → 10.10.1.2    TCP 83 8081 → 59950 [PSH, ACK] Seq=392 Ack=409 Win=65152 Len=17 TSval=3171799282 TSecr=1047539571
1711548974.952409744   228 0.569894329    10.10.1.2 → 10.10.1.1    TCP 83 59950 → 8081 [PSH, ACK] Seq=409 Ack=409 Win=64256 Len=17 TSval=1047539573 TSecr=3171799282
1711548976.952409744   230 0.570019267    10.10.1.1 → 10.10.1.2    TCP 83 8081 → 59950 [PSH, ACK] Seq=409 Ack=426 Win=65152 Len=17 TSval=3171799284 TSecr=1047539573
1711548982.952409744   236 0.571225713    10.10.1.2 → 10.10.1.1    TCP 83 59950 → 8081 [PSH, ACK] Seq=426 Ack=426 Win=64256 Len=17 TSval=1047539574 TSecr=3171799284
1711548984.952409744   238 0.571350282    10.10.1.1 → 10.10.1.2    TCP 83 8081 → 59950 [PSH, ACK] Seq=426 Ack=443 Win=65152 Len=17 TSval=3171799285 TSecr=1047539574
1711548990.952409744   244 0.572556323    10.10.1.2 → 10.10.1.1    TCP 83 59950 → 8081 [PSH, ACK] Seq=443 Ack=443 Win=64256 Len=17 TSval=1047539575 TSecr=3171799285
1711548992.952409744   246 0.572686736    10.10.1.1 → 10.10.1.2    TCP 83 8081 → 59950 [PSH, ACK] Seq=443 Ack=460 Win=65152 Len=17 TSval=3171799286 TSecr=1047539575
1711548998.952409744   252 0.573895498    10.10.1.2 → 10.10.1.1    TCP 83 59950 → 8081 [PSH, ACK] Seq=460 Ack=460 Win=64256 Len=17 TSval=1047539577 TSecr=3171799286
1711549000.952409744   254 0.574015538    10.10.1.1 → 10.10.1.2    TCP 83 8081 → 59950 [PSH, ACK] Seq=460 Ack=477 Win=65152 Len=17 TSval=3171799288 TSecr=1047539577
1711549006.952409744   260 0.575220587    10.10.1.2 → 10.10.1.1    TCP 83 59950 → 8081 [PSH, ACK] Seq=477 Ack=477 Win=64256 Len=17 TSval=1047539578 TSecr=3171799288
1711549008.952409744   262 0.575341333    10.10.1.1 → 10.10.1.2    TCP 83 8081 → 59950 [PSH, ACK] Seq=477 Ack=494 Win=65152 Len=17 TSval=3171799289 TSecr=1047539578
1711549014.952409744   268 0.576546110    10.10.1.2 → 10.10.1.1    TCP 83 59950 → 8081 [PSH, ACK] Seq=494 Ack=494 Win=64256 Len=17 TSval=1047539579 TSecr=3171799289
1711549016.952409744   270 0.576675316    10.10.1.1 → 10.10.1.2    TCP 83 8081 → 59950 [PSH, ACK] Seq=494 Ack=511 Win=65152 Len=17 TSval=3171799290 TSecr=1047539579
1711549022.952409744   276 0.577884555    10.10.1.2 → 10.10.1.1    TCP 83 59950 → 8081 [PSH, ACK] Seq=511 Ack=511 Win=64256 Len=17 TSval=1047539581 TSecr=3171799290
1711549024.952409744   278 0.578009569    10.10.1.1 → 10.10.1.2    TCP 83 8081 → 59950 [PSH, ACK] Seq=511 Ack=528 Win=65152 Len=17 TSval=3171799292 TSecr=1047539581
1711549030.952409744   284 0.579215324    10.10.1.2 → 10.10.1.1    TCP 83 59950 → 8081 [PSH, ACK] Seq=528 Ack=528 Win=64256 Len=17 TSval=1047539582 TSecr=3171799292
1711549032.952409744   286 0.579340684    10.10.1.1 → 10.10.1.2    TCP 83 8081 → 59950 [PSH, ACK] Seq=528 Ack=545 Win=65152 Len=17 TSval=3171799293 TSecr=1047539582
1711549038.952409744   292 0.580546697    10.10.1.2 → 10.10.1.1    TCP 83 59950 → 8081 [PSH, ACK] Seq=545 Ack=545 Win=64256 Len=17 TSval=1047539583 TSecr=3171799293
1711549040.952409744   294 0.580676958    10.10.1.1 → 10.10.1.2    TCP 83 8081 → 59950 [PSH, ACK] Seq=545 Ack=562 Win=65152 Len=17 TSval=3171799294 TSecr=1047539583
1711549046.952409744   300 0.581885246    10.10.1.2 → 10.10.1.1    TCP 83 59950 → 8081 [PSH, ACK] Seq=562 Ack=562 Win=64256 Len=17 TSval=1047539585 TSecr=3171799294
1711549048.952409744   302 0.582009931    10.10.1.1 → 10.10.1.2    TCP 83 8081 → 59950 [PSH, ACK] Seq=562 Ack=579 Win=65152 Len=17 TSval=3171799296 TSecr=1047539585
1711549054.952409744   308 0.583215641    10.10.1.2 → 10.10.1.1    TCP 83 59950 → 8081 [PSH, ACK] Seq=579 Ack=579 Win=64256 Len=17 TSval=1047539586 TSecr=3171799296
1711549056.952409744   310 0.583340382    10.10.1.1 → 10.10.1.2    TCP 83 8081 → 59950 [PSH, ACK] Seq=579 Ack=596 Win=65152 Len=17 TSval=3171799297 TSecr=1047539586
1711549062.952409744   316 0.584545803    10.10.1.2 → 10.10.1.1    TCP 83 59950 → 8081 [PSH, ACK] Seq=596 Ack=596 Win=64256 Len=17 TSval=1047539587 TSecr=3171799297
1711549064.952409744   318 0.584675575    10.10.1.1 → 10.10.1.2    TCP 83 8081 → 59950 [PSH, ACK] Seq=596 Ack=613 Win=65152 Len=17 TSval=3171799298 TSecr=1047539587
1711549070.952409744   324 0.585885692    10.10.1.2 → 10.10.1.1    TCP 83 59950 → 8081 [PSH, ACK] Seq=613 Ack=613 Win=64256 Len=17 TSval=1047539589 TSecr=3171799298
1711549072.952409744   326 0.586010594    10.10.1.1 → 10.10.1.2    TCP 83 8081 → 59950 [PSH, ACK] Seq=613 Ack=630 Win=65152 Len=17 TSval=3171799300 TSecr=1047539589
1711549078.952409744   332 0.587215072    10.10.1.2 → 10.10.1.1    TCP 83 59950 → 8081 [PSH, ACK] Seq=630 Ack=630 Win=64256 Len=17 TSval=1047539590 TSecr=3171799300
1711549080.952409744   334 0.587340527    10.10.1.1 → 10.10.1.2    TCP 83 8081 → 59950 [PSH, ACK] Seq=630 Ack=647 Win=65152 Len=17 TSval=3171799301 TSecr=1047539590
1711549086.952409744   340 0.588545433    10.10.1.2 → 10.10.1.1    TCP 83 59950 → 8081 [PSH, ACK] Seq=647 Ack=647 Win=64256 Len=17 TSval=1047539591 TSecr=3171799301
1711549088.952409744   342 0.588675212    10.10.1.1 → 10.10.1.2    TCP 83 8081 → 59950 [PSH, ACK] Seq=647 Ack=664 Win=65152 Len=17 TSval=3171799302 TSecr=1047539591
1711549094.952409744   348 0.589882020    10.10.1.2 → 10.10.1.1    TCP 83 59950 → 8081 [PSH, ACK] Seq=664 Ack=664 Win=64256 Len=17 TSval=1047539593 TSecr=3171799302
1711549096.952409744   350 0.590006077    10.10.1.1 → 10.10.1.2    TCP 83 8081 → 59950 [PSH, ACK] Seq=664 Ack=681 Win=65152 Len=17 TSval=3171799304 TSecr=1047539593
1711549102.952409744   356 0.591213262    10.10.1.2 → 10.10.1.1    TCP 83 59950 → 8081 [PSH, ACK] Seq=681 Ack=681 Win=64256 Len=17 TSval=1047539594 TSecr=3171799304
1711549104.952409744   358 0.591338686    10.10.1.1 → 10.10.1.2    TCP 83 8081 → 59950 [PSH, ACK] Seq=681 Ack=698 Win=65152 Len=17 TSval=3171799305 TSecr=1047539594
1711549110.952409744   364 0.592545561    10.10.1.2 → 10.10.1.1    TCP 83 59950 → 8081 [PSH, ACK] Seq=698 Ack=698 Win=64256 Len=17 TSval=1047539595 TSecr=3171799305
1711549112.952409744   366 0.592675805    10.10.1.1 → 10.10.1.2    TCP 83 8081 → 59950 [PSH, ACK] Seq=698 Ack=715 Win=65152 Len=17 TSval=3171799306 TSecr=1047539595
1711549118.952409744   372 0.593885194    10.10.1.2 → 10.10.1.1    TCP 83 59950 → 8081 [PSH, ACK] Seq=715 Ack=715 Win=64256 Len=17 TSval=1047539597 TSecr=3171799306
1711549120.952409744   374 0.594006418    10.10.1.1 → 10.10.1.2    TCP 83 8081 → 59950 [PSH, ACK] Seq=715 Ack=732 Win=65152 Len=17 TSval=3171799308 TSecr=1047539597
1711549126.952409744   380 0.595212674    10.10.1.2 → 10.10.1.1    TCP 83 59950 → 8081 [PSH, ACK] Seq=732 Ack=732 Win=64256 Len=17 TSval=1047539598 TSecr=3171799308
1711549128.952409744   382 0.595333261    10.10.1.1 → 10.10.1.2    TCP 83 8081 → 59950 [PSH, ACK] Seq=732 Ack=749 Win=65152 Len=17 TSval=3171799309 TSecr=1047539598
1711549134.952409744   388 0.596550728    10.10.1.2 → 10.10.1.1    TCP 83 59950 → 8081 [PSH, ACK] Seq=749 Ack=749 Win=64256 Len=17 TSval=1047539599 TSecr=3171799309
1711549136.952409744   390 0.596679120    10.10.1.1 → 10.10.1.2    TCP 83 8081 → 59950 [PSH, ACK] Seq=749 Ack=766 Win=65152 Len=17 TSval=3171799310 TSecr=1047539599
1711549142.952409744   396 0.597891410    10.10.1.2 → 10.10.1.1    TCP 83 59950 → 8081 [PSH, ACK] Seq=766 Ack=766 Win=64256 Len=17 TSval=1047539601 TSecr=3171799310
1711549144.952409744   398 0.598016104    10.10.1.1 → 10.10.1.2    TCP 83 8081 → 59950 [PSH, ACK] Seq=766 Ack=783 Win=65152 Len=17 TSval=3171799312 TSecr=1047539601
1711549150.952409744   404 0.599221468    10.10.1.2 → 10.10.1.1    TCP 83 59950 → 8081 [PSH, ACK] Seq=783 Ack=783 Win=64256 Len=17 TSval=1047539602 TSecr=3171799312
1711549152.952409744   406 0.599345994    10.10.1.1 → 10.10.1.2    TCP 83 8081 → 59950 [PSH, ACK] Seq=783 Ack=800 Win=65152 Len=17 TSval=3171799313 TSecr=1047539602
1711549158.952409744   412 0.600552146    10.10.1.2 → 10.10.1.1    TCP 83 59950 → 8081 [PSH, ACK] Seq=800 Ack=800 Win=64256 Len=17 TSval=1047539603 TSecr=3171799313
1711549160.952409744   414 0.600682522    10.10.1.1 → 10.10.1.2    TCP 83 8081 → 59950 [PSH, ACK] Seq=800 Ack=817 Win=65152 Len=17 TSval=3171799314 TSecr=1047539603
1711549166.952409744   420 0.601891850    10.10.1.2 → 10.10.1.1    TCP 83 59950 → 8081 [PSH, ACK] Seq=817 Ack=817 Win=64256 Len=17 TSval=1047539605 TSecr=3171799314
1711549168.952409744   422 0.602018021    10.10.1.1 → 10.10.1.2    TCP 83 8081 → 59950 [PSH, ACK] Seq=817 Ack=834 Win=65152 Len=17 TSval=3171799316 TSecr=1047539605
1711549175.952409744   429 0.603223045    10.10.1.2 → 10.10.1.1    TCP 83 59950 → 8081 [PSH, ACK] Seq=834 Ack=834 Win=64256 Len=17 TSval=1047539606 TSecr=3171799316
1711549177.952409744   431 0.603347803    10.10.1.1 → 10.10.1.2    TCP 83 8081 → 59950 [PSH, ACK] Seq=834 Ack=851 Win=65152 Len=17 TSval=3171799317 TSecr=1047539606
1711549182.952409744   436 0.604553101    10.10.1.2 → 10.10.1.1    TCP 83 59950 → 8081 [PSH, ACK] Seq=851 Ack=851 Win=64256 Len=17 TSval=1047539607 TSecr=3171799317
1711549184.952409744   438 0.604680179    10.10.1.1 → 10.10.1.2    TCP 83 8081 → 59950 [PSH, ACK] Seq=851 Ack=868 Win=65152 Len=17 TSval=3171799318 TSecr=1047539607
1711549190.952409744   444 0.605889610    10.10.1.2 → 10.10.1.1    TCP 83 59950 → 8081 [PSH, ACK] Seq=868 Ack=868 Win=64256 Len=17 TSval=1047539609 TSecr=3171799318
1711549192.952409744   446 0.606014561    10.10.1.1 → 10.10.1.2    TCP 83 8081 → 59950 [PSH, ACK] Seq=868 Ack=885 Win=65152 Len=17 TSval=3171799320 TSecr=1047539609
1711549198.952409744   452 0.607220395    10.10.1.2 → 10.10.1.1    TCP 83 59950 → 8081 [PSH, ACK] Seq=885 Ack=885 Win=64256 Len=17 TSval=1047539610 TSecr=3171799320
1711549200.952409744   454 0.607342220    10.10.1.1 → 10.10.1.2    TCP 83 8081 → 59950 [PSH, ACK] Seq=885 Ack=902 Win=65152 Len=17 TSval=3171799321 TSecr=1047539610
1711549206.952409744   460 0.608547140    10.10.1.2 → 10.10.1.1    TCP 83 59950 → 8081 [PSH, ACK] Seq=902 Ack=902 Win=64256 Len=17 TSval=1047539611 TSecr=3171799321
1711549208.952409744   462 0.608672710    10.10.1.1 → 10.10.1.2    TCP 83 8081 → 59950 [PSH, ACK] Seq=902 Ack=919 Win=65152 Len=17 TSval=3171799322 TSecr=1047539611
1711549214.952409744   468 0.609881567    10.10.1.2 → 10.10.1.1    TCP 83 59950 → 8081 [PSH, ACK] Seq=919 Ack=919 Win=64256 Len=17 TSval=1047539613 TSecr=3171799322
1711549216.952409744   470 0.610007254    10.10.1.1 → 10.10.1.2    TCP 83 8081 → 59950 [PSH, ACK] Seq=919 Ack=936 Win=65152 Len=17 TSval=3171799324 TSecr=1047539613
1711549222.952409744   476 0.611212816    10.10.1.2 → 10.10.1.1    TCP 83 59950 → 8081 [PSH, ACK] Seq=936 Ack=936 Win=64256 Len=17 TSval=1047539614 TSecr=3171799324
1711549224.952409744   478 0.611336993    10.10.1.1 → 10.10.1.2    TCP 83 8081 → 59950 [PSH, ACK] Seq=936 Ack=953 Win=65152 Len=17 TSval=3171799325 TSecr=1047539614
1711549230.952409744   484 0.612542275    10.10.1.2 → 10.10.1.1    TCP 83 59950 → 8081 [PSH, ACK] Seq=953 Ack=953 Win=64256 Len=17 TSval=1047539615 TSecr=3171799325
1711549233.952409744   487 0.612739474    10.10.1.1 → 10.10.1.2    TCP 83 8081 → 59950 [PSH, ACK] Seq=953 Ack=970 Win=65152 Len=17 TSval=3171799326 TSecr=1047539615
1711549238.952409744   492 0.613947660    10.10.1.2 → 10.10.1.1    TCP 83 59950 → 8081 [PSH, ACK] Seq=970 Ack=970 Win=64256 Len=17 TSval=1047539617 TSecr=3171799326
1711549240.952409744   494 0.614073108    10.10.1.1 → 10.10.1.2    TCP 83 8081 → 59950 [PSH, ACK] Seq=970 Ack=987 Win=65152 Len=17 TSval=3171799328 TSecr=1047539617
1711549246.952409744   500 0.615279123    10.10.1.2 → 10.10.1.1    TCP 83 59950 → 8081 [PSH, ACK] Seq=987 Ack=987 Win=64256 Len=17 TSval=1047539618 TSecr=3171799328
1711549248.952409744   502 0.615400605    10.10.1.1 → 10.10.1.2    TCP 83 8081 → 59950 [PSH, ACK] Seq=987 Ack=1004 Win=65152 Len=17 TSval=3171799329 TSecr=1047539618
1711549254.952409744   508 0.616606077    10.10.1.2 → 10.10.1.1    TCP 83 59950 → 8081 [PSH, ACK] Seq=1004 Ack=1004 Win=64256 Len=17 TSval=1047539619 TSecr=3171799329
1711549256.952409744   510 0.616731679    10.10.1.1 → 10.10.1.2    TCP 83 8081 → 59950 [PSH, ACK] Seq=1004 Ack=1021 Win=65152 Len=17 TSval=3171799330 TSecr=1047539619
1711549262.952409744   516 0.617941321    10.10.1.2 → 10.10.1.1    TCP 83 59950 → 8081 [PSH, ACK] Seq=1021 Ack=1021 Win=64256 Len=17 TSval=1047539621 TSecr=3171799330
1711549264.952409744   518 0.618062823    10.10.1.1 → 10.10.1.2    TCP 83 8081 → 59950 [PSH, ACK] Seq=1021 Ack=1038 Win=65152 Len=17 TSval=3171799332 TSecr=1047539621
1711549270.952409744   524 0.619267530    10.10.1.2 → 10.10.1.1    TCP 83 59950 → 8081 [PSH, ACK] Seq=1038 Ack=1038 Win=64256 Len=17 TSval=1047539622 TSecr=3171799332
1711549272.952409744   526 0.619388292    10.10.1.1 → 10.10.1.2    TCP 83 8081 → 59950 [PSH, ACK] Seq=1038 Ack=1055 Win=65152 Len=17 TSval=3171799333 TSecr=1047539622
1711549278.952409744   532 0.620593799    10.10.1.2 → 10.10.1.1    TCP 83 59950 → 8081 [PSH, ACK] Seq=1055 Ack=1055 Win=64256 Len=17 TSval=1047539623 TSecr=3171799333
1711549281.952409744   535 0.620743687    10.10.1.1 → 10.10.1.2    TCP 83 8081 → 59950 [PSH, ACK] Seq=1055 Ack=1072 Win=65152 Len=17 TSval=3171799334 TSecr=1047539623
1711549286.952409744   540 0.621953427    10.10.1.2 → 10.10.1.1    TCP 83 59950 → 8081 [PSH, ACK] Seq=1072 Ack=1072 Win=64256 Len=17 TSval=1047539625 TSecr=3171799334
1711549288.952409744   542 0.622073480    10.10.1.1 → 10.10.1.2    TCP 83 8081 → 59950 [PSH, ACK] Seq=1072 Ack=1089 Win=65152 Len=17 TSval=3171799336 TSecr=1047539625
1711549294.952409744   548 0.623279246    10.10.1.2 → 10.10.1.1    TCP 83 59950 → 8081 [PSH, ACK] Seq=1089 Ack=1089 Win=64256 Len=17 TSval=1047539626 TSecr=3171799336
1711549296.952409744   550 0.623399919    10.10.1.1 → 10.10.1.2    TCP 83 8081 → 59950 [PSH, ACK] Seq=1089 Ack=1106 Win=65152 Len=17 TSval=3171799337 TSecr=1047539626
1711549302.952409744   556 0.624605602    10.10.1.2 → 10.10.1.1    TCP 83 59950 → 8081 [PSH, ACK] Seq=1106 Ack=1106 Win=64256 Len=17 TSval=1047539627 TSecr=3171799337
1711549304.952409744   558 0.624735383    10.10.1.1 → 10.10.1.2    TCP 83 8081 → 59950 [PSH, ACK] Seq=1106 Ack=1123 Win=65152 Len=17 TSval=3171799338 TSecr=1047539627
1711549310.952409744   564 0.625943684    10.10.1.2 → 10.10.1.1    TCP 83 59950 → 8081 [PSH, ACK] Seq=1123 Ack=1123 Win=64256 Len=17 TSval=1047539629 TSecr=3171799338
1711549312.952409744   566 0.626068788    10.10.1.1 → 10.10.1.2    TCP 83 8081 → 59950 [PSH, ACK] Seq=1123 Ack=1140 Win=65152 Len=17 TSval=3171799340 TSecr=1047539629
1711549318.952409744   572 0.627273213    10.10.1.2 → 10.10.1.1    TCP 83 59950 → 8081 [PSH, ACK] Seq=1140 Ack=1140 Win=64256 Len=17 TSval=1047539630 TSecr=3171799340
1711549320.952409744   574 0.627398041    10.10.1.1 → 10.10.1.2    TCP 83 8081 → 59950 [PSH, ACK] Seq=1140 Ack=1157 Win=65152 Len=17 TSval=3171799341 TSecr=1047539630
1711549326.952409744   580 0.628603721    10.10.1.2 → 10.10.1.1    TCP 83 59950 → 8081 [PSH, ACK] Seq=1157 Ack=1157 Win=64256 Len=17 TSval=1047539631 TSecr=3171799341
1711549328.952409744   582 0.628733374    10.10.1.1 → 10.10.1.2    TCP 83 8081 → 59950 [PSH, ACK] Seq=1157 Ack=1174 Win=65152 Len=17 TSval=3171799342 TSecr=1047539631
1711549334.952409744   588 0.629942318    10.10.1.2 → 10.10.1.1    TCP 83 59950 → 8081 [PSH, ACK] Seq=1174 Ack=1174 Win=64256 Len=17 TSval=1047539633 TSecr=3171799342
1711549336.952409744   590 0.630063113    10.10.1.1 → 10.10.1.2    TCP 83 8081 → 59950 [PSH, ACK] Seq=1174 Ack=1191 Win=65152 Len=17 TSval=3171799344 TSecr=1047539633
1711549342.952409744   596 0.631268852    10.10.1.2 → 10.10.1.1    TCP 83 59950 → 8081 [PSH, ACK] Seq=1191 Ack=1191 Win=64256 Len=17 TSval=1047539634 TSecr=3171799344
1711549344.952409744   598 0.631389007    10.10.1.1 → 10.10.1.2    TCP 83 8081 → 59950 [PSH, ACK] Seq=1191 Ack=1208 Win=65152 Len=17 TSval=3171799345 TSecr=1047539634
1711549350.952409744   604 0.632594738    10.10.1.2 → 10.10.1.1    TCP 83 59950 → 8081 [PSH, ACK] Seq=1208 Ack=1208 Win=64256 Len=17 TSval=1047539635 TSecr=3171799345
1711549352.952409744   606 0.632725587    10.10.1.1 → 10.10.1.2    TCP 83 8081 → 59950 [PSH, ACK] Seq=1208 Ack=1225 Win=65152 Len=17 TSval=3171799346 TSecr=1047539635
1711549358.952409744   612 0.633935508    10.10.1.2 → 10.10.1.1    TCP 83 59950 → 8081 [PSH, ACK] Seq=1225 Ack=1225 Win=64256 Len=17 TSval=1047539637 TSecr=3171799346
1711549360.952409744   614 0.634060395    10.10.1.1 → 10.10.1.2    TCP 83 8081 → 59950 [PSH, ACK] Seq=1225 Ack=1242 Win=65152 Len=17 TSval=3171799348 TSecr=1047539637
1711549366.952409744   620 0.635266153    10.10.1.2 → 10.10.1.1    TCP 83 59950 → 8081 [PSH, ACK] Seq=1242 Ack=1242 Win=64256 Len=17 TSval=1047539638 TSecr=3171799348
1711549368.952409744   622 0.635386729    10.10.1.1 → 10.10.1.2    TCP 83 8081 → 59950 [PSH, ACK] Seq=1242 Ack=1259 Win=65152 Len=17 TSval=3171799349 TSecr=1047539638
1711549374.952409744   628 0.636607128    10.10.1.2 → 10.10.1.1    TCP 83 59950 → 8081 [PSH, ACK] Seq=1259 Ack=1259 Win=64256 Len=17 TSval=1047539639 TSecr=3171799349
1711549376.952409744   630 0.636737054    10.10.1.1 → 10.10.1.2    TCP 83 8081 → 59950 [PSH, ACK] Seq=1259 Ack=1276 Win=65152 Len=17 TSval=3171799350 TSecr=1047539639
1711549382.952409744   636 0.637945858    10.10.1.2 → 10.10.1.1    TCP 83 59950 → 8081 [PSH, ACK] Seq=1276 Ack=1276 Win=64256 Len=17 TSval=1047539641 TSecr=3171799350
1711549384.952409744   638 0.638066129    10.10.1.1 → 10.10.1.2    TCP 83 8081 → 59950 [PSH, ACK] Seq=1276 Ack=1293 Win=65152 Len=17 TSval=3171799352 TSecr=1047539641
1711549390.952409744   644 0.639271553    10.10.1.2 → 10.10.1.1    TCP 83 59950 → 8081 [PSH, ACK] Seq=1293 Ack=1293 Win=64256 Len=17 TSval=1047539642 TSecr=3171799352
1711549392.952409744   646 0.639392731    10.10.1.1 → 10.10.1.2    TCP 83 8081 → 59950 [PSH, ACK] Seq=1293 Ack=1310 Win=65152 Len=17 TSval=3171799353 TSecr=1047539642
1711549398.952409744   652 0.640597975    10.10.1.2 → 10.10.1.1    TCP 83 59950 → 8081 [PSH, ACK] Seq=1310 Ack=1310 Win=64256 Len=17 TSval=1047539643 TSecr=3171799353
1711549400.952409744   654 0.640724154    10.10.1.1 → 10.10.1.2    TCP 83 8081 → 59950 [PSH, ACK] Seq=1310 Ack=1327 Win=65152 Len=17 TSval=3171799354 TSecr=1047539643
1711549406.952409744   660 0.641935474    10.10.1.2 → 10.10.1.1    TCP 83 59950 → 8081 [PSH, ACK] Seq=1327 Ack=1327 Win=64256 Len=17 TSval=1047539645 TSecr=3171799354
1711549408.952409744   662 0.642057029    10.10.1.1 → 10.10.1.2    TCP 83 8081 → 59950 [PSH, ACK] Seq=1327 Ack=1344 Win=65152 Len=17 TSval=3171799356 TSecr=1047539645
1711549414.952409744   668 0.643261402    10.10.1.2 → 10.10.1.1    TCP 83 59950 → 8081 [PSH, ACK] Seq=1344 Ack=1344 Win=64256 Len=17 TSval=1047539646 TSecr=3171799356
1711549416.952409744   670 0.643386338    10.10.1.1 → 10.10.1.2    TCP 83 8081 → 59950 [PSH, ACK] Seq=1344 Ack=1361 Win=65152 Len=17 TSval=3171799357 TSecr=1047539646
1711549422.952409744   676 0.644592708    10.10.1.2 → 10.10.1.1    TCP 83 59950 → 8081 [PSH, ACK] Seq=1361 Ack=1361 Win=64256 Len=17 TSval=1047539647 TSecr=3171799357
1711549424.952409744   678 0.644721891    10.10.1.1 → 10.10.1.2    TCP 83 8081 → 59950 [PSH, ACK] Seq=1361 Ack=1378 Win=65152 Len=17 TSval=3171799358 TSecr=1047539647
1711549430.952409744   684 0.645929074    10.10.1.2 → 10.10.1.1    TCP 83 59950 → 8081 [PSH, ACK] Seq=1378 Ack=1378 Win=64256 Len=17 TSval=1047539649 TSecr=3171799358
1711549432.952409744   686 0.646054476    10.10.1.1 → 10.10.1.2    TCP 83 8081 → 59950 [PSH, ACK] Seq=1378 Ack=1395 Win=65152 Len=17 TSval=3171799360 TSecr=1047539649
1711549438.952409744   692 0.647259623    10.10.1.2 → 10.10.1.1    TCP 83 59950 → 8081 [PSH, ACK] Seq=1395 Ack=1395 Win=64256 Len=17 TSval=1047539650 TSecr=3171799360
1711549440.952409744   694 0.647380664    10.10.1.1 → 10.10.1.2    TCP 83 8081 → 59950 [PSH, ACK] Seq=1395 Ack=1412 Win=65152 Len=17 TSval=3171799361 TSecr=1047539650
1711549446.952409744   700 0.648585531    10.10.1.2 → 10.10.1.1    TCP 83 59950 → 8081 [PSH, ACK] Seq=1412 Ack=1412 Win=64256 Len=17 TSval=1047539651 TSecr=3171799361
1711549448.952409744   702 0.648712287    10.10.1.1 → 10.10.1.2    TCP 83 8081 → 59950 [PSH, ACK] Seq=1412 Ack=1429 Win=65152 Len=17 TSval=3171799362 TSecr=1047539651
1711549454.952409744   708 0.649921517    10.10.1.2 → 10.10.1.1    TCP 83 59950 → 8081 [PSH, ACK] Seq=1429 Ack=1429 Win=64256 Len=17 TSval=1047539653 TSecr=3171799362
1711549456.952409744   710 0.650041652    10.10.1.1 → 10.10.1.2    TCP 83 8081 → 59950 [PSH, ACK] Seq=1429 Ack=1446 Win=65152 Len=17 TSval=3171799364 TSecr=1047539653
1711549462.952409744   716 0.651246135    10.10.1.2 → 10.10.1.1    TCP 83 59950 → 8081 [PSH, ACK] Seq=1446 Ack=1446 Win=64256 Len=17 TSval=1047539654 TSecr=3171799364
1711549464.952409744   718 0.651366321    10.10.1.1 → 10.10.1.2    TCP 83 8081 → 59950 [PSH, ACK] Seq=1446 Ack=1463 Win=65152 Len=17 TSval=3171799365 TSecr=1047539654
1711549470.952409744   724 0.652523637    10.10.1.2 → 10.10.1.1    TCP 83 59950 → 8081 [PSH, ACK] Seq=1463 Ack=1463 Win=64256 Len=17 TSval=1047539655 TSecr=3171799365
1711549472.952409744   726 0.652652769    10.10.1.1 → 10.10.1.2    TCP 83 8081 → 59950 [PSH, ACK] Seq=1463 Ack=1480 Win=65152 Len=17 TSval=3171799366 TSecr=1047539655
1711549478.952409744   732 0.653865787    10.10.1.2 → 10.10.1.1    TCP 83 59950 → 8081 [PSH, ACK] Seq=1480 Ack=1480 Win=64256 Len=17 TSval=1047539657 TSecr=3171799366
1711549480.952409744   734 0.653985889    10.10.1.1 → 10.10.1.2    TCP 83 8081 → 59950 [PSH, ACK] Seq=1480 Ack=1497 Win=65152 Len=17 TSval=3171799368 TSecr=1047539657
1711549486.952409744   740 0.655191386    10.10.1.2 → 10.10.1.1    TCP 83 59950 → 8081 [PSH, ACK] Seq=1497 Ack=1497 Win=64256 Len=17 TSval=1047539658 TSecr=3171799368
1711549488.952409744   742 0.655311937    10.10.1.1 → 10.10.1.2    TCP 83 8081 → 59950 [PSH, ACK] Seq=1497 Ack=1514 Win=65152 Len=17 TSval=3171799369 TSecr=1047539658
1711549494.952409744   748 0.656537243    10.10.1.2 → 10.10.1.1    TCP 83 59950 → 8081 [PSH, ACK] Seq=1514 Ack=1514 Win=64256 Len=17 TSval=1047539659 TSecr=3171799369
1711549496.952409744   750 0.656664193    10.10.1.1 → 10.10.1.2    TCP 83 8081 → 59950 [PSH, ACK] Seq=1514 Ack=1531 Win=65152 Len=17 TSval=3171799370 TSecr=1047539659
1711549502.952409744   756 0.657878353    10.10.1.2 → 10.10.1.1    TCP 83 59950 → 8081 [PSH, ACK] Seq=1531 Ack=1531 Win=64256 Len=17 TSval=1047539661 TSecr=3171799370
1711549504.952409744   758 0.657998996    10.10.1.1 → 10.10.1.2    TCP 83 8081 → 59950 [PSH, ACK] Seq=1531 Ack=1548 Win=65152 Len=17 TSval=3171799372 TSecr=1047539661
1711549510.952409744   764 0.659208178    10.10.1.2 → 10.10.1.1    TCP 83 59950 → 8081 [PSH, ACK] Seq=1548 Ack=1548 Win=64256 Len=17 TSval=1047539662 TSecr=3171799372
1711549512.952409744   766 0.659332705    10.10.1.1 → 10.10.1.2    TCP 83 8081 → 59950 [PSH, ACK] Seq=1548 Ack=1565 Win=65152 Len=17 TSval=3171799373 TSecr=1047539662
1711549518.952409744   772 0.660539391    10.10.1.2 → 10.10.1.1    TCP 83 59950 → 8081 [PSH, ACK] Seq=1565 Ack=1565 Win=64256 Len=17 TSval=1047539663 TSecr=3171799373
1711549520.952409744   774 0.660670244    10.10.1.1 → 10.10.1.2    TCP 83 8081 → 59950 [PSH, ACK] Seq=1565 Ack=1582 Win=65152 Len=17 TSval=3171799374 TSecr=1047539663
1711549526.952409744   780 0.661878521    10.10.1.2 → 10.10.1.1    TCP 83 59950 → 8081 [PSH, ACK] Seq=1582 Ack=1582 Win=64256 Len=17 TSval=1047539665 TSecr=3171799374
1711549528.952409744   782 0.661998778    10.10.1.1 → 10.10.1.2    TCP 83 8081 → 59950 [PSH, ACK] Seq=1582 Ack=1599 Win=65152 Len=17 TSval=3171799376 TSecr=1047539665
1711549534.952409744   788 0.663203629    10.10.1.2 → 10.10.1.1    TCP 83 59950 → 8081 [PSH, ACK] Seq=1599 Ack=1599 Win=64256 Len=17 TSval=1047539666 TSecr=3171799376
1711549536.952409744   790 0.663323401    10.10.1.1 → 10.10.1.2    TCP 83 8081 → 59950 [PSH, ACK] Seq=1599 Ack=1616 Win=65152 Len=17 TSval=3171799377 TSecr=1047539666
1711549542.952409744   796 0.664528979    10.10.1.2 → 10.10.1.1    TCP 83 59950 → 8081 [PSH, ACK] Seq=1616 Ack=1616 Win=64256 Len=17 TSval=1047539667 TSecr=3171799377
1711549544.952409744   798 0.664654800    10.10.1.1 → 10.10.1.2    TCP 83 8081 → 59950 [PSH, ACK] Seq=1616 Ack=1633 Win=65152 Len=17 TSval=3171799378 TSecr=1047539667
1711549550.952409744   804 0.665864170    10.10.1.2 → 10.10.1.1    TCP 83 59950 → 8081 [PSH, ACK] Seq=1633 Ack=1633 Win=64256 Len=17 TSval=1047539669 TSecr=3171799378
1711549552.952409744   806 0.665984393    10.10.1.1 → 10.10.1.2    TCP 83 8081 → 59950 [PSH, ACK] Seq=1633 Ack=1650 Win=65152 Len=17 TSval=3171799380 TSecr=1047539669
1711549558.952409744   812 0.667189055    10.10.1.2 → 10.10.1.1    TCP 83 59950 → 8081 [PSH, ACK] Seq=1650 Ack=1650 Win=64256 Len=17 TSval=1047539670 TSecr=3171799380
1711549560.952409744   814 0.667309758    10.10.1.1 → 10.10.1.2    TCP 83 8081 → 59950 [PSH, ACK] Seq=1650 Ack=1667 Win=65152 Len=17 TSval=3171799381 TSecr=1047539670
1711549566.952409744   820 0.668514815    10.10.1.2 → 10.10.1.1    TCP 83 59950 → 8081 [PSH, ACK] Seq=1667 Ack=1667 Win=64256 Len=17 TSval=1047539671 TSecr=3171799381
1711549568.952409744   822 0.668647182    10.10.1.1 → 10.10.1.2    TCP 83 8081 → 59950 [PSH, ACK] Seq=1667 Ack=1684 Win=65152 Len=17 TSval=3171799382 TSecr=1047539671
1711549574.952409744   828 0.669856783    10.10.1.2 → 10.10.1.1    TCP 83 59950 → 8081 [PSH, ACK] Seq=1684 Ack=1684 Win=64256 Len=17 TSval=1047539673 TSecr=3171799382
1711549576.952409744   830 0.669981685    10.10.1.1 → 10.10.1.2    TCP 83 8081 → 59950 [PSH, ACK] Seq=1684 Ack=1701 Win=65152 Len=17 TSval=3171799384 TSecr=1047539673
1711549582.952409744   836 0.671186753    10.10.1.2 → 10.10.1.1    TCP 83 59950 → 8081 [PSH, ACK] Seq=1701 Ack=1701 Win=64256 Len=17 TSval=1047539674 TSecr=3171799384
1711549584.952409744   838 0.671311594    10.10.1.1 → 10.10.1.2    TCP 83 8081 → 59950 [PSH, ACK] Seq=1701 Ack=1718 Win=65152 Len=17 TSval=3171799385 TSecr=1047539674
1711549591.952409744   845 0.672541345    10.10.1.2 → 10.10.1.1    TCP 83 59950 → 8081 [PSH, ACK] Seq=1718 Ack=1718 Win=64256 Len=17 TSval=1047539675 TSecr=3171799385
1711549593.952409744   847 0.672672187    10.10.1.1 → 10.10.1.2    TCP 83 8081 → 59950 [PSH, ACK] Seq=1718 Ack=1735 Win=65152 Len=17 TSval=3171799386 TSecr=1047539675
1711549598.952409744   852 0.673881021    10.10.1.2 → 10.10.1.1    TCP 83 59950 → 8081 [PSH, ACK] Seq=1735 Ack=1735 Win=64256 Len=17 TSval=1047539677 TSecr=3171799386
1711549600.952409744   854 0.674005869    10.10.1.1 → 10.10.1.2    TCP 83 8081 → 59950 [PSH, ACK] Seq=1735 Ack=1752 Win=65152 Len=17 TSval=3171799388 TSecr=1047539677
1711549607.952409744   861 0.675210550    10.10.1.2 → 10.10.1.1    TCP 83 59950 → 8081 [PSH, ACK] Seq=1752 Ack=1752 Win=64256 Len=17 TSval=1047539678 TSecr=3171799388
1711549609.952409744   863 0.675336321    10.10.1.1 → 10.10.1.2    TCP 83 8081 → 59950 [PSH, ACK] Seq=1752 Ack=1769 Win=65152 Len=17 TSval=3171799389 TSecr=1047539678
1711549615.952409744   869 0.676542383    10.10.1.2 → 10.10.1.1    TCP 83 59950 → 8081 [PSH, ACK] Seq=1769 Ack=1769 Win=64256 Len=17 TSval=1047539679 TSecr=3171799389
1711549617.952409744   871 0.676673480    10.10.1.1 → 10.10.1.2    TCP 83 8081 → 59950 [PSH, ACK] Seq=1769 Ack=1786 Win=65152 Len=17 TSval=3171799390 TSecr=1047539679
1711549622.952409744   876 0.677880906    10.10.1.2 → 10.10.1.1    TCP 83 59950 → 8081 [PSH, ACK] Seq=1786 Ack=1786 Win=64256 Len=17 TSval=1047539681 TSecr=3171799390
1711549624.952409744   878 0.678005969    10.10.1.1 → 10.10.1.2    TCP 83 8081 → 59950 [PSH, ACK] Seq=1786 Ack=1803 Win=65152 Len=17 TSval=3171799392 TSecr=1047539681
1711549630.952409744   884 0.679211240    10.10.1.2 → 10.10.1.1    TCP 83 59950 → 8081 [PSH, ACK] Seq=1803 Ack=1803 Win=64256 Len=17 TSval=1047539682 TSecr=3171799392
1711549632.952409744   886 0.679332738    10.10.1.1 → 10.10.1.2    TCP 83 8081 → 59950 [PSH, ACK] Seq=1803 Ack=1820 Win=65152 Len=17 TSval=3171799393 TSecr=1047539682
1711549638.952409744   892 0.680538139    10.10.1.2 → 10.10.1.1    TCP 83 59950 → 8081 [PSH, ACK] Seq=1820 Ack=1820 Win=64256 Len=17 TSval=1047539683 TSecr=3171799393
1711549640.952409744   894 0.680663437    10.10.1.1 → 10.10.1.2    TCP 83 8081 → 59950 [PSH, ACK] Seq=1820 Ack=1837 Win=65152 Len=17 TSval=3171799394 TSecr=1047539683
1711549646.952409744   900 0.681872430    10.10.1.2 → 10.10.1.1    TCP 83 59950 → 8081 [PSH, ACK] Seq=1837 Ack=1837 Win=64256 Len=17 TSval=1047539685 TSecr=3171799394
1711549648.952409744   902 0.681992620    10.10.1.1 → 10.10.1.2    TCP 83 8081 → 59950 [PSH, ACK] Seq=1837 Ack=1854 Win=65152 Len=17 TSval=3171799396 TSecr=1047539685
1711549654.952409744   908 0.683197117    10.10.1.2 → 10.10.1.1    TCP 83 59950 → 8081 [PSH, ACK] Seq=1854 Ack=1854 Win=64256 Len=17 TSval=1047539686 TSecr=3171799396
1711549656.952409744   910 0.683317822    10.10.1.1 → 10.10.1.2    TCP 83 8081 → 59950 [PSH, ACK] Seq=1854 Ack=1871 Win=65152 Len=17 TSval=3171799397 TSecr=1047539686
1711549662.952409744   916 0.684523715    10.10.1.2 → 10.10.1.1    TCP 83 59950 → 8081 [PSH, ACK] Seq=1871 Ack=1871 Win=64256 Len=17 TSval=1047539687 TSecr=3171799397
1711549664.952409744   918 0.684654294    10.10.1.1 → 10.10.1.2    TCP 83 8081 → 59950 [PSH, ACK] Seq=1871 Ack=1888 Win=65152 Len=17 TSval=3171799398 TSecr=1047539687
1711549670.952409744   924 0.685862437    10.10.1.2 → 10.10.1.1    TCP 83 59950 → 8081 [PSH, ACK] Seq=1888 Ack=1888 Win=64256 Len=17 TSval=1047539689 TSecr=3171799398
1711549672.952409744   926 0.685983772    10.10.1.1 → 10.10.1.2    TCP 83 8081 → 59950 [PSH, ACK] Seq=1888 Ack=1905 Win=65152 Len=17 TSval=3171799400 TSecr=1047539689
1711549678.952409744   932 0.687189073    10.10.1.2 → 10.10.1.1    TCP 83 59950 → 8081 [PSH, ACK] Seq=1905 Ack=1905 Win=64256 Len=17 TSval=1047539690 TSecr=3171799400
1711549680.952409744   934 0.687309576    10.10.1.1 → 10.10.1.2    TCP 83 8081 → 59950 [PSH, ACK] Seq=1905 Ack=1922 Win=65152 Len=17 TSval=3171799401 TSecr=1047539690
1711549686.952409744   940 0.688514228    10.10.1.2 → 10.10.1.1    TCP 83 59950 → 8081 [PSH, ACK] Seq=1922 Ack=1922 Win=64256 Len=17 TSval=1047539691 TSecr=3171799401
1711549689.952409744   943 0.688696700    10.10.1.1 → 10.10.1.2    TCP 83 8081 → 59950 [PSH, ACK] Seq=1922 Ack=1939 Win=65152 Len=17 TSval=3171799402 TSecr=1047539691
1711549694.952409744   948 0.689906174    10.10.1.2 → 10.10.1.1    TCP 83 59950 → 8081 [PSH, ACK] Seq=1939 Ack=1939 Win=64256 Len=17 TSval=1047539693 TSecr=3171799402
1711549696.952409744   950 0.690030986    10.10.1.1 → 10.10.1.2    TCP 83 8081 → 59950 [PSH, ACK] Seq=1939 Ack=1956 Win=65152 Len=17 TSval=3171799404 TSecr=1047539693
1711549702.952409744   956 0.691235391    10.10.1.2 → 10.10.1.1    TCP 83 59950 → 8081 [PSH, ACK] Seq=1956 Ack=1956 Win=64256 Len=17 TSval=1047539694 TSecr=3171799404
1711549704.952409744   958 0.691360105    10.10.1.1 → 10.10.1.2    TCP 83 8081 → 59950 [PSH, ACK] Seq=1956 Ack=1973 Win=65152 Len=17 TSval=3171799405 TSecr=1047539694
1711549710.952409744   964 0.692582202    10.10.1.2 → 10.10.1.1    TCP 83 59950 → 8081 [PSH, ACK] Seq=1973 Ack=1973 Win=64256 Len=17 TSval=1047539695 TSecr=3171799405
1711549712.952409744   966 0.692712568    10.10.1.1 → 10.10.1.2    TCP 83 8081 → 59950 [PSH, ACK] Seq=1973 Ack=1990 Win=65152 Len=17 TSval=3171799406 TSecr=1047539695
1711549718.952409744   972 0.693920979    10.10.1.2 → 10.10.1.1    TCP 83 59950 → 8081 [PSH, ACK] Seq=1990 Ack=1990 Win=64256 Len=17 TSval=1047539697 TSecr=3171799406
1711549720.952409744   974 0.694046641    10.10.1.1 → 10.10.1.2    TCP 83 8081 → 59950 [PSH, ACK] Seq=1990 Ack=2007 Win=65152 Len=17 TSval=3171799408 TSecr=1047539697
