1711548957.743465900    34 0.515929941    10.10.1.2 → 10.10.1.1    TCP 83 55272 → 8081 [PSH, ACK] Seq=1 Ack=1 Win=64256 Len=17 TSval=1047716305 TSecr=3171975758
1711548961.743465900    38 0.516258609    10.10.1.1 → 10.10.1.2    TCP 83 8081 → 55272 [PSH, ACK] Seq=1 Ack=18 Win=65152 Len=17 TSval=3171976017 TSecr=1047716305
1711548967.743465900    44 0.526471750    10.10.1.2 → 10.10.1.1    TCP 83 55272 → 8081 [PSH, ACK] Seq=18 Ack=18 Win=64256 Len=17 TSval=1047716316 TSecr=3171976017
1711548970.743465900    47 0.526564146    10.10.1.1 → 10.10.1.2    TCP 83 8081 → 55272 [PSH, ACK] Seq=18 Ack=35 Win=65152 Len=17 TSval=3171976027 TSecr=1047716316
1711548975.743465900    52 0.536774642    10.10.1.2 → 10.10.1.1    TCP 83 55272 → 8081 [PSH, ACK] Seq=35 Ack=35 Win=64256 Len=17 TSval=1047716326 TSecr=3171976027
1711548978.743465900    55 0.536939122    10.10.1.1 → 10.10.1.2    TCP 83 8081 → 55272 [PSH, ACK] Seq=35 Ack=52 Win=65152 Len=17 TSval=3171976038 TSecr=1047716326
1711548983.743465900    60 0.547151097    10.10.1.2 → 10.10.1.1    TCP 83 55272 → 8081 [PSH, ACK] Seq=52 Ack=52 Win=64256 Len=17 TSval=1047716337 TSecr=3171976038
1711548986.743465900    63 0.547292796    10.10.1.1 → 10.10.1.2    TCP 83 8081 → 55272 [PSH, ACK] Seq=52 Ack=69 Win=65152 Len=17 TSval=3171976048 TSecr=1047716337
1711548991.743465900    68 0.557505809    10.10.1.2 → 10.10.1.1    TCP 83 55272 → 8081 [PSH, ACK] Seq=69 Ack=69 Win=64256 Len=17 TSval=1047716347 TSecr=3171976048
1711548994.743465900    71 0.557646747    10.10.1.1 → 10.10.1.2    TCP 83 8081 → 55272 [PSH, ACK] Seq=69 Ack=86 Win=65152 Len=17 TSval=3171976058 TSecr=1047716347
1711548999.743465900    76 0.567860887    10.10.1.2 → 10.10.1.1    TCP 83 55272 → 8081 [PSH, ACK] Seq=86 Ack=86 Win=64256 Len=17 TSval=1047716357 TSecr=3171976058
1711549002.743465900    79 0.567995836    10.10.1.1 → 10.10.1.2    TCP 83 8081 → 55272 [PSH, ACK] Seq=86 Ack=103 Win=65152 Len=17 TSval=3171976069 TSecr=1047716357
1711549007.743465900    84 0.578205781    10.10.1.2 → 10.10.1.1    TCP 83 55272 → 8081 [PSH, ACK] Seq=103 Ack=103 Win=64256 Len=17 TSval=1047716368 TSecr=3171976069
1711549010.743465900    87 0.578353007    10.10.1.1 → 10.10.1.2    TCP 83 8081 → 55272 [PSH, ACK] Seq=103 Ack=120 Win=65152 Len=17 TSval=3171976079 TSecr=1047716368
1711549015.743465900    92 0.588561702    10.10.1.2 → 10.10.1.1    TCP 83 55272 → 8081 [PSH, ACK] Seq=120 Ack=120 Win=64256 Len=17 TSval=1047716378 TSecr=3171976079
1711549018.743465900    95 0.588696219    10.10.1.1 → 10.10.1.2    TCP 83 8081 → 55272 [PSH, ACK] Seq=120 Ack=137 Win=65152 Len=17 TSval=3171976089 TSecr=1047716378
1711549023.743465900   100 0.598905972    10.10.1.2 → 10.10.1.1    TCP 83 55272 → 8081 [PSH, ACK] Seq=137 Ack=137 Win=64256 Len=17 TSval=1047716388 TSecr=3171976089
1711549025.743465900   102 0.599040844    10.10.1.1 → 10.10.1.2    TCP 83 8081 → 55272 [PSH, ACK] Seq=137 Ack=154 Win=65152 Len=17 TSval=3171976100 TSecr=1047716388
1711549031.743465900   108 0.609253182    10.10.1.2 → 10.10.1.1    TCP 83 55272 → 8081 [PSH, ACK] Seq=154 Ack=154 Win=64256 Len=17 TSval=1047716399 TSecr=3171976100
1711549033.743465900   110 0.609386664    10.10.1.1 → 10.10.1.2    TCP 83 8081 → 55272 [PSH, ACK] Seq=154 Ack=171 Win=65152 Len=17 TSval=3171976110 TSecr=1047716399
1711549039.743465900   116 0.619599277    10.10.1.2 → 10.10.1.1    TCP 83 55272 → 8081 [PSH, ACK] Seq=171 Ack=171 Win=64256 Len=17 TSval=1047716409 TSecr=3171976110
1711549042.743465900   119 0.619733920    10.10.1.1 → 10.10.1.2    TCP 83 8081 → 55272 [PSH, ACK] Seq=171 Ack=188 Win=65152 Len=17 TSval=3171976120 TSecr=1047716409
1711549047.743465900   124 0.629945699    10.10.1.2 → 10.10.1.1    TCP 83 55272 → 8081 [PSH, ACK] Seq=188 Ack=188 Win=64256 Len=17 TSval=1047716419 TSecr=3171976120
1711549049.743465900   126 0.630081187    10.10.1.1 → 10.10.1.2    TCP 83 8081 → 55272 [PSH, ACK] Seq=188 Ack=205 Win=65152 Len=17 TSval=3171976131 TSecr=1047716419
1711549056.743465900   133 0.640291396    10.10.1.2 → 10.10.1.1    TCP 83 55272 → 8081 [PSH, ACK] Seq=205 Ack=205 Win=64256 Len=17 TSval=1047716430 TSecr=3171976131
1711549058.743465900   135 0.640397301    10.10.1.1 → 10.10.1.2    TCP 83 8081 → 55272 [PSH, ACK] Seq=205 Ack=222 Win=65152 Len=17 TSval=3171976141 TSecr=1047716430
1711549063.743465900   140 0.650607080    10.10.1.2 → 10.10.1.1    TCP 83 55272 → 8081 [PSH, ACK] Seq=222 Ack=222 Win=64256 Len=17 TSval=1047716440 TSecr=3171976141
1711549065.743465900   142 0.650741836    10.10.1.1 → 10.10.1.2    TCP 83 8081 → 55272 [PSH, ACK] Seq=222 Ack=239 Win=65152 Len=17 TSval=3171976151 TSecr=1047716440
1711549071.743465900   148 0.660954481    10.10.1.2 → 10.10.1.1    TCP 83 55272 → 8081 [PSH, ACK] Seq=239 Ack=239 Win=64256 Len=17 TSval=1047716450 TSecr=3171976151
1711549074.743465900   151 0.661089155    10.10.1.1 → 10.10.1.2    TCP 83 8081 → 55272 [PSH, ACK] Seq=239 Ack=256 Win=65152 Len=17 TSval=3171976162 TSecr=1047716450
1711549079.743465900   156 0.671301681    10.10.1.2 → 10.10.1.1    TCP 83 55272 → 8081 [PSH, ACK] Seq=256 Ack=256 Win=64256 Len=17 TSval=1047716461 TSecr=3171976162
1711549081.743465900   158 0.671436815    10.10.1.1 → 10.10.1.2    TCP 83 8081 → 55272 [PSH, ACK] Seq=256 Ack=273 Win=65152 Len=17 TSval=3171976172 TSecr=1047716461
1711549087.743465900   164 0.681649678    10.10.1.2 → 10.10.1.1    TCP 83 55272 → 8081 [PSH, ACK] Seq=273 Ack=273 Win=64256 Len=17 TSval=1047716471 TSecr=3171976172
1711549090.743465900   167 0.681784415    10.10.1.1 → 10.10.1.2    TCP 83 8081 → 55272 [PSH, ACK] Seq=273 Ack=290 Win=65152 Len=17 TSval=3171976182 TSecr=1047716471
1711549095.743465900   172 0.691996801    10.10.1.2 → 10.10.1.1    TCP 83 55272 → 8081 [PSH, ACK] Seq=290 Ack=290 Win=64256 Len=17 TSval=1047716481 TSecr=3171976182
1711549098.743465900   175 0.692131316    10.10.1.1 → 10.10.1.2    TCP 83 8081 → 55272 [PSH, ACK] Seq=290 Ack=307 Win=65152 Len=17 TSval=3171976193 TSecr=1047716481
1711549103.743465900   180 0.702342838    10.10.1.2 → 10.10.1.1    TCP 83 55272 → 8081 [PSH, ACK] Seq=307 Ack=307 Win=64256 Len=17 TSval=1047716492 TSecr=3171976193
1711549105.743465900   182 0.702479676    10.10.1.1 → 10.10.1.2    TCP 83 8081 → 55272 [PSH, ACK] Seq=307 Ack=324 Win=65152 Len=17 TSval=3171976203 TSecr=1047716492
1711549111.743465900   188 0.712688133    10.10.1.2 → 10.10.1.1    TCP 83 55272 → 8081 [PSH, ACK] Seq=324 Ack=324 Win=64256 Len=17 TSval=1047716502 TSecr=3171976203
1711549113.743465900   190 0.712824316    10.10.1.1 → 10.10.1.2    TCP 83 8081 → 55272 [PSH, ACK] Seq=324 Ack=341 Win=65152 Len=17 TSval=3171976213 TSecr=1047716502
1711549119.743465900   196 0.723033675    10.10.1.2 → 10.10.1.1    TCP 83 55272 → 8081 [PSH, ACK] Seq=341 Ack=341 Win=64256 Len=17 TSval=1047716513 TSecr=3171976213
1711549122.743465900   199 0.723170728    10.10.1.1 → 10.10.1.2    TCP 83 8081 → 55272 [PSH, ACK] Seq=341 Ack=358 Win=65152 Len=17 TSval=3171976224 TSecr=1047716513
1711549127.743465900   204 0.733379383    10.10.1.2 → 10.10.1.1    TCP 83 55272 → 8081 [PSH, ACK] Seq=358 Ack=358 Win=64256 Len=17 TSval=1047716523 TSecr=3171976224
1711549130.743465900   207 0.733513775    10.10.1.1 → 10.10.1.2    TCP 83 8081 → 55272 [PSH, ACK] Seq=358 Ack=375 Win=65152 Len=17 TSval=3171976234 TSecr=1047716523
1711549135.743465900   212 0.743724052    10.10.1.2 → 10.10.1.1    TCP 83 55272 → 8081 [PSH, ACK] Seq=375 Ack=375 Win=64256 Len=17 TSval=1047716533 TSecr=3171976234
1711549138.743465900   215 0.743858934    10.10.1.1 → 10.10.1.2    TCP 83 8081 → 55272 [PSH, ACK] Seq=375 Ack=392 Win=65152 Len=17 TSval=3171976244 TSecr=1047716533
1711549143.743465900   220 0.754039462    10.10.1.2 → 10.10.1.1    TCP 83 55272 → 8081 [PSH, ACK] Seq=392 Ack=392 Win=64256 Len=17 TSval=1047716544 TSecr=3171976244
1711549146.743465900   223 0.754175914    10.10.1.1 → 10.10.1.2    TCP 83 8081 → 55272 [PSH, ACK] Seq=392 Ack=409 Win=65152 Len=17 TSval=3171976255 TSecr=1047716544
1711549151.743465900   228 0.764384600    10.10.1.2 → 10.10.1.1    TCP 83 55272 → 8081 [PSH, ACK] Seq=409 Ack=409 Win=64256 Len=17 TSval=1047716554 TSecr=3171976255
1711549153.743465900   230 0.764519757    10.10.1.1 → 10.10.1.2    TCP 83 8081 → 55272 [PSH, ACK] Seq=409 Ack=426 Win=65152 Len=17 TSval=3171976265 TSecr=1047716554
1711549159.743465900   236 0.774731466    10.10.1.2 → 10.10.1.1    TCP 83 55272 → 8081 [PSH, ACK] Seq=426 Ack=426 Win=64256 Len=17 TSval=1047716564 TSecr=3171976265
1711549162.743465900   239 0.774866509    10.10.1.1 → 10.10.1.2    TCP 83 8081 → 55272 [PSH, ACK] Seq=426 Ack=443 Win=65152 Len=17 TSval=3171976275 TSecr=1047716564
1711549167.743465900   244 0.785078756    10.10.1.2 → 10.10.1.1    TCP 83 55272 → 8081 [PSH, ACK] Seq=443 Ack=443 Win=64256 Len=17 TSval=1047716575 TSecr=3171976275
1711549169.743465900   246 0.785213939    10.10.1.1 → 10.10.1.2    TCP 83 8081 → 55272 [PSH, ACK] Seq=443 Ack=460 Win=65152 Len=17 TSval=3171976286 TSecr=1047716575
1711549176.743465900   253 0.795423554    10.10.1.2 → 10.10.1.1    TCP 83 55272 → 8081 [PSH, ACK] Seq=460 Ack=460 Win=64256 Len=17 TSval=1047716585 TSecr=3171976286
1711549177.743465900   254 0.795529910    10.10.1.1 → 10.10.1.2    TCP 83 8081 → 55272 [PSH, ACK] Seq=460 Ack=477 Win=65152 Len=17 TSval=3171976296 TSecr=1047716585
1711549183.743465900   260 0.805740730    10.10.1.2 → 10.10.1.1    TCP 83 55272 → 8081 [PSH, ACK] Seq=477 Ack=477 Win=64256 Len=17 TSval=1047716595 TSecr=3171976296
1711549186.743465900   263 0.805877705    10.10.1.1 → 10.10.1.2    TCP 83 8081 → 55272 [PSH, ACK] Seq=477 Ack=494 Win=65152 Len=17 TSval=3171976306 TSecr=1047716595
1711549191.743465900   268 0.816040549    10.10.1.2 → 10.10.1.1    TCP 83 55272 → 8081 [PSH, ACK] Seq=494 Ack=494 Win=64256 Len=17 TSval=1047716606 TSecr=3171976306
1711549193.743465900   270 0.816173906    10.10.1.1 → 10.10.1.2    TCP 83 8081 → 55272 [PSH, ACK] Seq=494 Ack=511 Win=65152 Len=17 TSval=3171976317 TSecr=1047716606
1711549199.743465900   276 0.826382966    10.10.1.2 → 10.10.1.1    TCP 83 55272 → 8081 [PSH, ACK] Seq=511 Ack=511 Win=64256 Len=17 TSval=1047716616 TSecr=3171976317
1711549201.743465900   278 0.826517556    10.10.1.1 → 10.10.1.2    TCP 83 8081 → 55272 [PSH, ACK] Seq=511 Ack=528 Win=65152 Len=17 TSval=3171976327 TSecr=1047716616
1711549207.743465900   284 0.836725178    10.10.1.2 → 10.10.1.1    TCP 83 55272 → 8081 [PSH, ACK] Seq=528 Ack=528 Win=64256 Len=17 TSval=1047716626 TSecr=3171976327
1711549209.743465900   286 0.836859018    10.10.1.1 → 10.10.1.2    TCP 83 8081 → 55272 [PSH, ACK] Seq=528 Ack=545 Win=65152 Len=17 TSval=3171976337 TSecr=1047716626
1711549215.743465900   292 0.847070320    10.10.1.2 → 10.10.1.1    TCP 83 55272 → 8081 [PSH, ACK] Seq=545 Ack=545 Win=64256 Len=17 TSval=1047716637 TSecr=3171976337
1711549217.743465900   294 0.847205798    10.10.1.1 → 10.10.1.2    TCP 83 8081 → 55272 [PSH, ACK] Seq=545 Ack=562 Win=65152 Len=17 TSval=3171976348 TSecr=1047716637
1711549223.743465900   300 0.857415375    10.10.1.2 → 10.10.1.1    TCP 83 55272 → 8081 [PSH, ACK] Seq=562 Ack=562 Win=64256 Len=17 TSval=1047716647 TSecr=3171976348
1711549225.743465900   302 0.857548937    10.10.1.1 → 10.10.1.2    TCP 83 8081 → 55272 [PSH, ACK] Seq=562 Ack=579 Win=65152 Len=17 TSval=3171976358 TSecr=1047716647
1711549231.743465900   308 0.867760731    10.10.1.2 → 10.10.1.1    TCP 83 55272 → 8081 [PSH, ACK] Seq=579 Ack=579 Win=64256 Len=17 TSval=1047716657 TSecr=3171976358
1711549234.743465900   311 0.867897093    10.10.1.1 → 10.10.1.2    TCP 83 8081 → 55272 [PSH, ACK] Seq=579 Ack=596 Win=65152 Len=17 TSval=3171976368 TSecr=1047716657
1711549239.743465900   316 0.878104339    10.10.1.2 → 10.10.1.1    TCP 83 55272 → 8081 [PSH, ACK] Seq=596 Ack=596 Win=64256 Len=17 TSval=1047716668 TSecr=3171976368
1711549242.743465900   319 0.878239520    10.10.1.1 → 10.10.1.2    TCP 83 8081 → 55272 [PSH, ACK] Seq=596 Ack=613 Win=65152 Len=17 TSval=3171976379 TSecr=1047716668
1711549247.743465900   324 0.888448429    10.10.1.2 → 10.10.1.1    TCP 83 55272 → 8081 [PSH, ACK] Seq=613 Ack=613 Win=64256 Len=17 TSval=1047716678 TSecr=3171976379
1711549250.743465900   327 0.888583360    10.10.1.1 → 10.10.1.2    TCP 83 8081 → 55272 [PSH, ACK] Seq=613 Ack=630 Win=65152 Len=17 TSval=3171976389 TSecr=1047716678
1711549255.743465900   332 0.898794023    10.10.1.2 → 10.10.1.1    TCP 83 55272 → 8081 [PSH, ACK] Seq=630 Ack=630 Win=64256 Len=17 TSval=1047716688 TSecr=3171976389
1711549257.743465900   334 0.898928974    10.10.1.1 → 10.10.1.2    TCP 83 8081 → 55272 [PSH, ACK] Seq=630 Ack=647 Win=65152 Len=17 TSval=3171976400 TSecr=1047716688
1711549263.743465900   340 0.909139239    10.10.1.2 → 10.10.1.1    TCP 83 55272 → 8081 [PSH, ACK] Seq=647 Ack=647 Win=64256 Len=17 TSval=1047716699 TSecr=3171976400
1711549266.743465900   343 0.909275121    10.10.1.1 → 10.10.1.2    TCP 83 8081 → 55272 [PSH, ACK] Seq=647 Ack=664 Win=65152 Len=17 TSval=3171976410 TSecr=1047716699
1711549272.743465900   349 0.919483487    10.10.1.2 → 10.10.1.1    TCP 83 55272 → 8081 [PSH, ACK] Seq=664 Ack=664 Win=64256 Len=17 TSval=1047716709 TSecr=3171976410
1711549274.743465900   351 0.919591188    10.10.1.1 → 10.10.1.2    TCP 83 8081 → 55272 [PSH, ACK] Seq=664 Ack=681 Win=65152 Len=17 TSval=3171976420 TSecr=1047716709
1711549279.743465900   356 0.929801704    10.10.1.2 → 10.10.1.1    TCP 83 55272 → 8081 [PSH, ACK] Seq=681 Ack=681 Win=64256 Len=17 TSval=1047716719 TSecr=3171976420
1711549281.743465900   358 0.929937541    10.10.1.1 → 10.10.1.2    TCP 83 8081 → 55272 [PSH, ACK] Seq=681 Ack=698 Win=65152 Len=17 TSval=3171976431 TSecr=1047716719
1711549287.743465900   364 0.940149612    10.10.1.2 → 10.10.1.1    TCP 83 55272 → 8081 [PSH, ACK] Seq=698 Ack=698 Win=64256 Len=17 TSval=1047716730 TSecr=3171976431
1711549290.743465900   367 0.940284487    10.10.1.1 → 10.10.1.2    TCP 83 8081 → 55272 [PSH, ACK] Seq=698 Ack=715 Win=65152 Len=17 TSval=3171976441 TSecr=1047716730
1711549295.743465900   372 0.950494998    10.10.1.2 → 10.10.1.1    TCP 83 55272 → 8081 [PSH, ACK] Seq=715 Ack=715 Win=64256 Len=17 TSval=1047716740 TSecr=3171976441
1711549297.743465900   374 0.950629772    10.10.1.1 → 10.10.1.2    TCP 83 8081 → 55272 [PSH, ACK] Seq=715 Ack=732 Win=65152 Len=17 TSval=3171976451 TSecr=1047716740
1711549303.743465900   380 0.960839840    10.10.1.2 → 10.10.1.1    TCP 83 55272 → 8081 [PSH, ACK] Seq=732 Ack=732 Win=64256 Len=17 TSval=1047716750 TSecr=3171976451
1711549306.743465900   383 0.960974312    10.10.1.1 → 10.10.1.2    TCP 83 8081 → 55272 [PSH, ACK] Seq=732 Ack=749 Win=65152 Len=17 TSval=3171976462 TSecr=1047716750
1711549311.743465900   388 0.971185787    10.10.1.2 → 10.10.1.1    TCP 83 55272 → 8081 [PSH, ACK] Seq=749 Ack=749 Win=64256 Len=17 TSval=1047716761 TSecr=3171976462
1711549314.743465900   391 0.971322366    10.10.1.1 → 10.10.1.2    TCP 83 8081 → 55272 [PSH, ACK] Seq=749 Ack=766 Win=65152 Len=17 TSval=3171976472 TSecr=1047716761
1711549319.743465900   396 0.981533895    10.10.1.2 → 10.10.1.1    TCP 83 55272 → 8081 [PSH, ACK] Seq=766 Ack=766 Win=64256 Len=17 TSval=1047716771 TSecr=3171976472
1711549321.743465900   398 0.981668390    10.10.1.1 → 10.10.1.2    TCP 83 8081 → 55272 [PSH, ACK] Seq=766 Ack=783 Win=65152 Len=17 TSval=3171976482 TSecr=1047716771
1711549327.743465900   404 0.991881139    10.10.1.2 → 10.10.1.1    TCP 83 55272 → 8081 [PSH, ACK] Seq=783 Ack=783 Win=64256 Len=17 TSval=1047716781 TSecr=3171976482
1711549330.743465900   407 0.992015394    10.10.1.1 → 10.10.1.2    TCP 83 8081 → 55272 [PSH, ACK] Seq=783 Ack=800 Win=65152 Len=17 TSval=3171976493 TSecr=1047716781
1711549335.743465900   412 1.002229806    10.10.1.2 → 10.10.1.1    TCP 83 55272 → 8081 [PSH, ACK] Seq=800 Ack=800 Win=64256 Len=17 TSval=1047716792 TSecr=3171976493
1711549338.743465900   415 1.002365655    10.10.1.1 → 10.10.1.2    TCP 83 8081 → 55272 [PSH, ACK] Seq=800 Ack=817 Win=65152 Len=17 TSval=3171976503 TSecr=1047716792
1711549344.743465900   421 1.012579029    10.10.1.2 → 10.10.1.1    TCP 83 55272 → 8081 [PSH, ACK] Seq=817 Ack=817 Win=64256 Len=17 TSval=1047716802 TSecr=3171976503
1711549345.743465900   422 1.012689328    10.10.1.1 → 10.10.1.2    TCP 83 8081 → 55272 [PSH, ACK] Seq=817 Ack=834 Win=65152 Len=17 TSval=3171976513 TSecr=1047716802
1711549351.743465900   428 1.022899108    10.10.1.2 → 10.10.1.1    TCP 83 55272 → 8081 [PSH, ACK] Seq=834 Ack=834 Win=64256 Len=17 TSval=1047716812 TSecr=3171976513
1711549353.743465900   430 1.023036250    10.10.1.1 → 10.10.1.2    TCP 83 8081 → 55272 [PSH, ACK] Seq=834 Ack=851 Win=65152 Len=17 TSval=3171976524 TSecr=1047716812
1711549360.743465900   437 1.033245249    10.10.1.2 → 10.10.1.1    TCP 83 55272 → 8081 [PSH, ACK] Seq=851 Ack=851 Win=64256 Len=17 TSval=1047716823 TSecr=3171976524
1711549362.743465900   439 1.033349500    10.10.1.1 → 10.10.1.2    TCP 83 8081 → 55272 [PSH, ACK] Seq=851 Ack=868 Win=65152 Len=17 TSval=3171976534 TSecr=1047716823
1711549367.743465900   444 1.043558905    10.10.1.2 → 10.10.1.1    TCP 83 55272 → 8081 [PSH, ACK] Seq=868 Ack=868 Win=64256 Len=17 TSval=1047716833 TSecr=3171976534
1711549369.743465900   446 1.043694823    10.10.1.1 → 10.10.1.2    TCP 83 8081 → 55272 [PSH, ACK] Seq=868 Ack=885 Win=65152 Len=17 TSval=3171976544 TSecr=1047716833
1711549375.743465900   452 1.053903866    10.10.1.2 → 10.10.1.1    TCP 83 55272 → 8081 [PSH, ACK] Seq=885 Ack=885 Win=64256 Len=17 TSval=1047716843 TSecr=3171976544
1711549378.743465900   455 1.054035821    10.10.1.1 → 10.10.1.2    TCP 83 8081 → 55272 [PSH, ACK] Seq=885 Ack=902 Win=65152 Len=17 TSval=3171976555 TSecr=1047716843
1711549383.743465900   460 1.064244508    10.10.1.2 → 10.10.1.1    TCP 83 55272 → 8081 [PSH, ACK] Seq=902 Ack=902 Win=64256 Len=17 TSval=1047716854 TSecr=3171976555
1711549386.743465900   463 1.064379769    10.10.1.1 → 10.10.1.2    TCP 83 8081 → 55272 [PSH, ACK] Seq=902 Ack=919 Win=65152 Len=17 TSval=3171976565 TSecr=1047716854
1711549391.743465900   468 1.074590592    10.10.1.2 → 10.10.1.1    TCP 83 55272 → 8081 [PSH, ACK] Seq=919 Ack=919 Win=64256 Len=17 TSval=1047716864 TSecr=3171976565
1711549393.743465900   470 1.074724831    10.10.1.1 → 10.10.1.2    TCP 83 8081 → 55272 [PSH, ACK] Seq=919 Ack=936 Win=65152 Len=17 TSval=3171976575 TSecr=1047716864
1711549399.743465900   476 1.084954860    10.10.1.2 → 10.10.1.1    TCP 83 55272 → 8081 [PSH, ACK] Seq=936 Ack=936 Win=64256 Len=17 TSval=1047716874 TSecr=3171976575
1711549402.743465900   479 1.085086999    10.10.1.1 → 10.10.1.2    TCP 83 8081 → 55272 [PSH, ACK] Seq=936 Ack=953 Win=65152 Len=17 TSval=3171976586 TSecr=1047716874
1711549407.743465900   484 1.095296056    10.10.1.2 → 10.10.1.1    TCP 83 55272 → 8081 [PSH, ACK] Seq=953 Ack=953 Win=64256 Len=17 TSval=1047716885 TSecr=3171976586
1711549410.743465900   487 1.095934478    10.10.1.1 → 10.10.1.2    TCP 83 8081 → 55272 [PSH, ACK] Seq=953 Ack=970 Win=65152 Len=17 TSval=3171976597 TSecr=1047716885
1711549415.743465900   492 1.106142220    10.10.1.2 → 10.10.1.1    TCP 83 55272 → 8081 [PSH, ACK] Seq=970 Ack=970 Win=64256 Len=17 TSval=1047716896 TSecr=3171976597
1711549417.743465900   494 1.106277776    10.10.1.1 → 10.10.1.2    TCP 83 8081 → 55272 [PSH, ACK] Seq=970 Ack=987 Win=65152 Len=17 TSval=3171976607 TSecr=1047716896
1711549423.743465900   500 1.116486255    10.10.1.2 → 10.10.1.1    TCP 83 55272 → 8081 [PSH, ACK] Seq=987 Ack=987 Win=64256 Len=17 TSval=1047716906 TSecr=3171976607
1711549426.743465900   503 1.116620539    10.10.1.1 → 10.10.1.2    TCP 83 8081 → 55272 [PSH, ACK] Seq=987 Ack=1004 Win=65152 Len=17 TSval=3171976617 TSecr=1047716906
1711549431.743465900   508 1.126829402    10.10.1.2 → 10.10.1.1    TCP 83 55272 → 8081 [PSH, ACK] Seq=1004 Ack=1004 Win=64256 Len=17 TSval=1047716916 TSecr=3171976617
1711549433.743465900   510 1.126963966    10.10.1.1 → 10.10.1.2    TCP 83 8081 → 55272 [PSH, ACK] Seq=1004 Ack=1021 Win=65152 Len=17 TSval=3171976628 TSecr=1047716916
1711549439.743465900   516 1.137173549    10.10.1.2 → 10.10.1.1    TCP 83 55272 → 8081 [PSH, ACK] Seq=1021 Ack=1021 Win=64256 Len=17 TSval=1047716927 TSecr=3171976628
1711549441.743465900   518 1.137308076    10.10.1.1 → 10.10.1.2    TCP 83 8081 → 55272 [PSH, ACK] Seq=1021 Ack=1038 Win=65152 Len=17 TSval=3171976638 TSecr=1047716927
1711549447.743465900   524 1.147516908    10.10.1.2 → 10.10.1.1    TCP 83 55272 → 8081 [PSH, ACK] Seq=1038 Ack=1038 Win=64256 Len=17 TSval=1047716937 TSecr=3171976638
1711549450.743465900   527 1.147651289    10.10.1.1 → 10.10.1.2    TCP 83 8081 → 55272 [PSH, ACK] Seq=1038 Ack=1055 Win=65152 Len=17 TSval=3171976648 TSecr=1047716937
1711549455.743465900   532 1.157859782    10.10.1.2 → 10.10.1.1    TCP 83 55272 → 8081 [PSH, ACK] Seq=1055 Ack=1055 Win=64256 Len=17 TSval=1047716947 TSecr=3171976648
1711549457.743465900   534 1.157993330    10.10.1.1 → 10.10.1.2    TCP 83 8081 → 55272 [PSH, ACK] Seq=1055 Ack=1072 Win=65152 Len=17 TSval=3171976659 TSecr=1047716947
1711549463.743465900   540 1.168204451    10.10.1.2 → 10.10.1.1    TCP 83 55272 → 8081 [PSH, ACK] Seq=1072 Ack=1072 Win=64256 Len=17 TSval=1047716958 TSecr=3171976659
1711549465.743465900   542 1.168338417    10.10.1.1 → 10.10.1.2    TCP 83 8081 → 55272 [PSH, ACK] Seq=1072 Ack=1089 Win=65152 Len=17 TSval=3171976669 TSecr=1047716958
1711549471.743465900   548 1.178549948    10.10.1.2 → 10.10.1.1    TCP 83 55272 → 8081 [PSH, ACK] Seq=1089 Ack=1089 Win=64256 Len=17 TSval=1047716968 TSecr=3171976669
1711549474.743465900   551 1.178684913    10.10.1.1 → 10.10.1.2    TCP 83 8081 → 55272 [PSH, ACK] Seq=1089 Ack=1106 Win=65152 Len=17 TSval=3171976679 TSecr=1047716968
1711549480.743465900   557 1.188893242    10.10.1.2 → 10.10.1.1    TCP 83 55272 → 8081 [PSH, ACK] Seq=1106 Ack=1106 Win=64256 Len=17 TSval=1047716978 TSecr=3171976679
1711549482.743465900   559 1.189002529    10.10.1.1 → 10.10.1.2    TCP 83 8081 → 55272 [PSH, ACK] Seq=1106 Ack=1123 Win=65152 Len=17 TSval=3171976690 TSecr=1047716978
1711549487.743465900   564 1.199212219    10.10.1.2 → 10.10.1.1    TCP 83 55272 → 8081 [PSH, ACK] Seq=1123 Ack=1123 Win=64256 Len=17 TSval=1047716989 TSecr=3171976690
1711549489.743465900   566 1.199348226    10.10.1.1 → 10.10.1.2    TCP 83 8081 → 55272 [PSH, ACK] Seq=1123 Ack=1140 Win=65152 Len=17 TSval=3171976700 TSecr=1047716989
1711549495.743465900   572 1.209568591    10.10.1.2 → 10.10.1.1    TCP 83 55272 → 8081 [PSH, ACK] Seq=1140 Ack=1140 Win=64256 Len=17 TSval=1047716999 TSecr=3171976700
1711549497.743465900   574 1.209702744    10.10.1.1 → 10.10.1.2    TCP 83 8081 → 55272 [PSH, ACK] Seq=1140 Ack=1157 Win=65152 Len=17 TSval=3171976710 TSecr=1047716999
1711549503.743465900   580 1.219911464    10.10.1.2 → 10.10.1.1    TCP 83 55272 → 8081 [PSH, ACK] Seq=1157 Ack=1157 Win=64256 Len=17 TSval=1047717009 TSecr=3171976710
1711549506.743465900   583 1.220045460    10.10.1.1 → 10.10.1.2    TCP 83 8081 → 55272 [PSH, ACK] Seq=1157 Ack=1174 Win=65152 Len=17 TSval=3171976721 TSecr=1047717009
1711549511.743465900   588 1.230264876    10.10.1.2 → 10.10.1.1    TCP 83 55272 → 8081 [PSH, ACK] Seq=1174 Ack=1174 Win=64256 Len=17 TSval=1047717020 TSecr=3171976721
1711549513.743465900   590 1.230399032    10.10.1.1 → 10.10.1.2    TCP 83 8081 → 55272 [PSH, ACK] Seq=1174 Ack=1191 Win=65152 Len=17 TSval=3171976731 TSecr=1047717020
1711549519.743465900   596 1.240611037    10.10.1.2 → 10.10.1.1    TCP 83 55272 → 8081 [PSH, ACK] Seq=1191 Ack=1191 Win=64256 Len=17 TSval=1047717030 TSecr=3171976731
1711549521.743465900   598 1.240745911    10.10.1.1 → 10.10.1.2    TCP 83 8081 → 55272 [PSH, ACK] Seq=1191 Ack=1208 Win=65152 Len=17 TSval=3171976741 TSecr=1047717030
1711549527.743465900   604 1.250954770    10.10.1.2 → 10.10.1.1    TCP 83 55272 → 8081 [PSH, ACK] Seq=1208 Ack=1208 Win=64256 Len=17 TSval=1047717040 TSecr=3171976741
1711549530.743465900   607 1.251090476    10.10.1.1 → 10.10.1.2    TCP 83 8081 → 55272 [PSH, ACK] Seq=1208 Ack=1225 Win=65152 Len=17 TSval=3171976752 TSecr=1047717040
1711549535.743465900   612 1.261301846    10.10.1.2 → 10.10.1.1    TCP 83 55272 → 8081 [PSH, ACK] Seq=1225 Ack=1225 Win=64256 Len=17 TSval=1047717051 TSecr=3171976752
1711549537.743465900   614 1.261435850    10.10.1.1 → 10.10.1.2    TCP 83 8081 → 55272 [PSH, ACK] Seq=1225 Ack=1242 Win=65152 Len=17 TSval=3171976762 TSecr=1047717051
1711549543.743465900   620 1.271646748    10.10.1.2 → 10.10.1.1    TCP 83 55272 → 8081 [PSH, ACK] Seq=1242 Ack=1242 Win=64256 Len=17 TSval=1047717061 TSecr=3171976762
1711549546.743465900   623 1.271780835    10.10.1.1 → 10.10.1.2    TCP 83 8081 → 55272 [PSH, ACK] Seq=1242 Ack=1259 Win=65152 Len=17 TSval=3171976772 TSecr=1047717061
1711549551.743465900   628 1.281992112    10.10.1.2 → 10.10.1.1    TCP 83 55272 → 8081 [PSH, ACK] Seq=1259 Ack=1259 Win=64256 Len=17 TSval=1047717071 TSecr=3171976772
1711549554.743465900   631 1.282127717    10.10.1.1 → 10.10.1.2    TCP 83 8081 → 55272 [PSH, ACK] Seq=1259 Ack=1276 Win=65152 Len=17 TSval=3171976783 TSecr=1047717071
1711549559.743465900   636 1.292337972    10.10.1.2 → 10.10.1.1    TCP 83 55272 → 8081 [PSH, ACK] Seq=1276 Ack=1276 Win=64256 Len=17 TSval=1047717082 TSecr=3171976783
1711549562.743465900   639 1.292472060    10.10.1.1 → 10.10.1.2    TCP 83 8081 → 55272 [PSH, ACK] Seq=1276 Ack=1293 Win=65152 Len=17 TSval=3171976793 TSecr=1047717082
1711549567.743465900   644 1.302682908    10.10.1.2 → 10.10.1.1    TCP 83 55272 → 8081 [PSH, ACK] Seq=1293 Ack=1293 Win=64256 Len=17 TSval=1047717092 TSecr=3171976793
1711549569.743465900   646 1.302816861    10.10.1.1 → 10.10.1.2    TCP 83 8081 → 55272 [PSH, ACK] Seq=1293 Ack=1310 Win=65152 Len=17 TSval=3171976803 TSecr=1047717092
1711549575.743465900   652 1.313028117    10.10.1.2 → 10.10.1.1    TCP 83 55272 → 8081 [PSH, ACK] Seq=1310 Ack=1310 Win=64256 Len=17 TSval=1047717103 TSecr=3171976803
1711549577.743465900   654 1.313163223    10.10.1.1 → 10.10.1.2    TCP 83 8081 → 55272 [PSH, ACK] Seq=1310 Ack=1327 Win=65152 Len=17 TSval=3171976814 TSecr=1047717103
1711549583.743465900   660 1.323374154    10.10.1.2 → 10.10.1.1    TCP 83 55272 → 8081 [PSH, ACK] Seq=1327 Ack=1327 Win=64256 Len=17 TSval=1047717113 TSecr=3171976814
1711549585.743465900   662 1.323509011    10.10.1.1 → 10.10.1.2    TCP 83 8081 → 55272 [PSH, ACK] Seq=1327 Ack=1344 Win=65152 Len=17 TSval=3171976824 TSecr=1047717113
1711549591.743465900   668 1.333720354    10.10.1.2 → 10.10.1.1    TCP 83 55272 → 8081 [PSH, ACK] Seq=1344 Ack=1344 Win=64256 Len=17 TSval=1047717123 TSecr=3171976824
1711549594.743465900   671 1.333856048    10.10.1.1 → 10.10.1.2    TCP 83 8081 → 55272 [PSH, ACK] Seq=1344 Ack=1361 Win=65152 Len=17 TSval=3171976834 TSecr=1047717123
1711549599.743465900   676 1.344042492    10.10.1.2 → 10.10.1.1    TCP 83 55272 → 8081 [PSH, ACK] Seq=1361 Ack=1361 Win=64256 Len=17 TSval=1047717134 TSecr=3171976834
1711549601.743465900   678 1.344178657    10.10.1.1 → 10.10.1.2    TCP 83 8081 → 55272 [PSH, ACK] Seq=1361 Ack=1378 Win=65152 Len=17 TSval=3171976845 TSecr=1047717134
1711549607.743465900   684 1.354385975    10.10.1.2 → 10.10.1.1    TCP 83 55272 → 8081 [PSH, ACK] Seq=1378 Ack=1378 Win=64256 Len=17 TSval=1047717144 TSecr=3171976845
1711549610.743465900   687 1.354521360    10.10.1.1 → 10.10.1.2    TCP 83 8081 → 55272 [PSH, ACK] Seq=1378 Ack=1395 Win=65152 Len=17 TSval=3171976855 TSecr=1047717144
1711549615.743465900   692 1.364732865    10.10.1.2 → 10.10.1.1    TCP 83 55272 → 8081 [PSH, ACK] Seq=1395 Ack=1395 Win=64256 Len=17 TSval=1047717154 TSecr=3171976855
1711549618.743465900   695 1.364868848    10.10.1.1 → 10.10.1.2    TCP 83 8081 → 55272 [PSH, ACK] Seq=1395 Ack=1412 Win=65152 Len=17 TSval=3171976865 TSecr=1047717154
1711549623.743465900   700 1.375079244    10.10.1.2 → 10.10.1.1    TCP 83 55272 → 8081 [PSH, ACK] Seq=1412 Ack=1412 Win=64256 Len=17 TSval=1047717165 TSecr=3171976865
1711549626.743465900   703 1.375216226    10.10.1.1 → 10.10.1.2    TCP 83 8081 → 55272 [PSH, ACK] Seq=1412 Ack=1429 Win=65152 Len=17 TSval=3171976876 TSecr=1047717165
1711549631.743465900   708 1.385426296    10.10.1.2 → 10.10.1.1    TCP 83 55272 → 8081 [PSH, ACK] Seq=1429 Ack=1429 Win=64256 Len=17 TSval=1047717175 TSecr=3171976876
1711549633.743465900   710 1.385560197    10.10.1.1 → 10.10.1.2    TCP 83 8081 → 55272 [PSH, ACK] Seq=1429 Ack=1446 Win=65152 Len=17 TSval=3171976886 TSecr=1047717175
1711549639.743465900   716 1.395772443    10.10.1.2 → 10.10.1.1    TCP 83 55272 → 8081 [PSH, ACK] Seq=1446 Ack=1446 Win=64256 Len=17 TSval=1047717185 TSecr=3171976886
1711549641.743465900   718 1.395908525    10.10.1.1 → 10.10.1.2    TCP 83 8081 → 55272 [PSH, ACK] Seq=1446 Ack=1463 Win=65152 Len=17 TSval=3171976897 TSecr=1047717185
1711549647.743465900   724 1.406121530    10.10.1.2 → 10.10.1.1    TCP 83 55272 → 8081 [PSH, ACK] Seq=1463 Ack=1463 Win=64256 Len=17 TSval=1047717196 TSecr=3171976897
1711549649.743465900   726 1.406258196    10.10.1.1 → 10.10.1.2    TCP 83 8081 → 55272 [PSH, ACK] Seq=1463 Ack=1480 Win=65152 Len=17 TSval=3171976907 TSecr=1047717196
1711549655.743465900   732 1.416469151    10.10.1.2 → 10.10.1.1    TCP 83 55272 → 8081 [PSH, ACK] Seq=1480 Ack=1480 Win=64256 Len=17 TSval=1047717206 TSecr=3171976907
1711549658.743465900   735 1.416604706    10.10.1.1 → 10.10.1.2    TCP 83 8081 → 55272 [PSH, ACK] Seq=1480 Ack=1497 Win=65152 Len=17 TSval=3171976917 TSecr=1047717206
1711549663.743465900   740 1.426815282    10.10.1.2 → 10.10.1.1    TCP 83 55272 → 8081 [PSH, ACK] Seq=1497 Ack=1497 Win=64256 Len=17 TSval=1047717216 TSecr=3171976917
1711549665.743465900   742 1.426950073    10.10.1.1 → 10.10.1.2    TCP 83 8081 → 55272 [PSH, ACK] Seq=1497 Ack=1514 Win=65152 Len=17 TSval=3171976928 TSecr=1047717216
1711549671.743465900   748 1.437159918    10.10.1.2 → 10.10.1.1    TCP 83 55272 → 8081 [PSH, ACK] Seq=1514 Ack=1514 Win=64256 Len=17 TSval=1047717227 TSecr=3171976928
1711549674.743465900   751 1.437294926    10.10.1.1 → 10.10.1.2    TCP 83 8081 → 55272 [PSH, ACK] Seq=1514 Ack=1531 Win=65152 Len=17 TSval=3171976938 TSecr=1047717227
1711549679.743465900   756 1.447504037    10.10.1.2 → 10.10.1.1    TCP 83 55272 → 8081 [PSH, ACK] Seq=1531 Ack=1531 Win=64256 Len=17 TSval=1047717237 TSecr=3171976938
1711549681.743465900   758 1.447637267    10.10.1.1 → 10.10.1.2    TCP 83 8081 → 55272 [PSH, ACK] Seq=1531 Ack=1548 Win=65152 Len=17 TSval=3171976948 TSecr=1047717237
1711549687.743465900   764 1.457846828    10.10.1.2 → 10.10.1.1    TCP 83 55272 → 8081 [PSH, ACK] Seq=1548 Ack=1548 Win=64256 Len=17 TSval=1047717247 TSecr=3171976948
1711549689.743465900   766 1.457979797    10.10.1.1 → 10.10.1.2    TCP 83 8081 → 55272 [PSH, ACK] Seq=1548 Ack=1565 Win=65152 Len=17 TSval=3171976959 TSecr=1047717247
1711549696.743465900   773 1.468188991    10.10.1.2 → 10.10.1.1    TCP 83 55272 → 8081 [PSH, ACK] Seq=1565 Ack=1565 Win=64256 Len=17 TSval=1047717258 TSecr=3171976959
1711549698.743465900   775 1.468323803    10.10.1.1 → 10.10.1.2    TCP 83 8081 → 55272 [PSH, ACK] Seq=1565 Ack=1582 Win=65152 Len=17 TSval=3171976969 TSecr=1047717258
1711549704.743465900   781 1.478532913    10.10.1.2 → 10.10.1.1    TCP 83 55272 → 8081 [PSH, ACK] Seq=1582 Ack=1582 Win=64256 Len=17 TSval=1047717268 TSecr=3171976969
1711549706.743465900   783 1.478667604    10.10.1.1 → 10.10.1.2    TCP 83 8081 → 55272 [PSH, ACK] Seq=1582 Ack=1599 Win=65152 Len=17 TSval=3171976979 TSecr=1047717268
1711549712.743465900   789 1.488875992    10.10.1.2 → 10.10.1.1    TCP 83 55272 → 8081 [PSH, ACK] Seq=1599 Ack=1599 Win=64256 Len=17 TSval=1047717278 TSecr=3171976979
1711549715.743465900   792 1.489011091    10.10.1.1 → 10.10.1.2    TCP 83 8081 → 55272 [PSH, ACK] Seq=1599 Ack=1616 Win=65152 Len=17 TSval=3171976990 TSecr=1047717278
1711549720.743465900   797 1.499220681    10.10.1.2 → 10.10.1.1    TCP 83 55272 → 8081 [PSH, ACK] Seq=1616 Ack=1616 Win=64256 Len=17 TSval=1047717289 TSecr=3171976990
1711549722.743465900   799 1.499354908    10.10.1.1 → 10.10.1.2    TCP 83 8081 → 55272 [PSH, ACK] Seq=1616 Ack=1633 Win=65152 Len=17 TSval=3171977000 TSecr=1047717289
1711549728.743465900   805 1.509563873    10.10.1.2 → 10.10.1.1    TCP 83 55272 → 8081 [PSH, ACK] Seq=1633 Ack=1633 Win=64256 Len=17 TSval=1047717299 TSecr=3171977000
1711549731.743465900   808 1.509698888    10.10.1.1 → 10.10.1.2    TCP 83 8081 → 55272 [PSH, ACK] Seq=1633 Ack=1650 Win=65152 Len=17 TSval=3171977010 TSecr=1047717299
1711549737.743465900   814 1.519907611    10.10.1.2 → 10.10.1.1    TCP 83 55272 → 8081 [PSH, ACK] Seq=1650 Ack=1650 Win=64256 Len=17 TSval=1047717309 TSecr=3171977010
1711549738.743465900   815 1.520011726    10.10.1.1 → 10.10.1.2    TCP 83 8081 → 55272 [PSH, ACK] Seq=1650 Ack=1667 Win=65152 Len=17 TSval=3171977021 TSecr=1047717309
1711549744.743465900   821 1.530223459    10.10.1.2 → 10.10.1.1    TCP 83 55272 → 8081 [PSH, ACK] Seq=1667 Ack=1667 Win=64256 Len=17 TSval=1047717320 TSecr=3171977021
1711549746.743465900   823 1.530358578    10.10.1.1 → 10.10.1.2    TCP 83 8081 → 55272 [PSH, ACK] Seq=1667 Ack=1684 Win=65152 Len=17 TSval=3171977031 TSecr=1047717320
1711549752.743465900   829 1.540566813    10.10.1.2 → 10.10.1.1    TCP 83 55272 → 8081 [PSH, ACK] Seq=1684 Ack=1684 Win=64256 Len=17 TSval=1047717330 TSecr=3171977031
1711549755.743465900   832 1.540701664    10.10.1.1 → 10.10.1.2    TCP 83 8081 → 55272 [PSH, ACK] Seq=1684 Ack=1701 Win=65152 Len=17 TSval=3171977041 TSecr=1047717330
1711549760.743465900   837 1.550911944    10.10.1.2 → 10.10.1.1    TCP 83 55272 → 8081 [PSH, ACK] Seq=1701 Ack=1701 Win=64256 Len=17 TSval=1047717340 TSecr=3171977041
1711549763.743465900   840 1.551045995    10.10.1.1 → 10.10.1.2    TCP 83 8081 → 55272 [PSH, ACK] Seq=1701 Ack=1718 Win=65152 Len=17 TSval=3171977052 TSecr=1047717340
1711549769.743465900   846 1.561254651    10.10.1.2 → 10.10.1.1    TCP 83 55272 → 8081 [PSH, ACK] Seq=1718 Ack=1718 Win=64256 Len=17 TSval=1047717351 TSecr=3171977052
1711549771.743465900   848 1.561360248    10.10.1.1 → 10.10.1.2    TCP 83 8081 → 55272 [PSH, ACK] Seq=1718 Ack=1735 Win=65152 Len=17 TSval=3171977062 TSecr=1047717351
1711549776.743465900   853 1.571527979    10.10.1.2 → 10.10.1.1    TCP 83 55272 → 8081 [PSH, ACK] Seq=1735 Ack=1735 Win=64256 Len=17 TSval=1047717361 TSecr=3171977062
1711549778.743465900   855 1.571665248    10.10.1.1 → 10.10.1.2    TCP 83 8081 → 55272 [PSH, ACK] Seq=1735 Ack=1752 Win=65152 Len=17 TSval=3171977072 TSecr=1047717361
1711549784.743465900   861 1.581873096    10.10.1.2 → 10.10.1.1    TCP 83 55272 → 8081 [PSH, ACK] Seq=1752 Ack=1752 Win=64256 Len=17 TSval=1047717371 TSecr=3171977072
1711549787.743465900   864 1.582007372    10.10.1.1 → 10.10.1.2    TCP 83 8081 → 55272 [PSH, ACK] Seq=1752 Ack=1769 Win=65152 Len=17 TSval=3171977083 TSecr=1047717371
1711549792.743465900   869 1.592217483    10.10.1.2 → 10.10.1.1    TCP 83 55272 → 8081 [PSH, ACK] Seq=1769 Ack=1769 Win=64256 Len=17 TSval=1047717382 TSecr=3171977083
1711549794.743465900   871 1.592352593    10.10.1.1 → 10.10.1.2    TCP 83 8081 → 55272 [PSH, ACK] Seq=1769 Ack=1786 Win=65152 Len=17 TSval=3171977093 TSecr=1047717382
1711549800.743465900   877 1.602563724    10.10.1.2 → 10.10.1.1    TCP 83 55272 → 8081 [PSH, ACK] Seq=1786 Ack=1786 Win=64256 Len=17 TSval=1047717392 TSecr=3171977093
1711549803.743465900   880 1.602697622    10.10.1.1 → 10.10.1.2    TCP 83 8081 → 55272 [PSH, ACK] Seq=1786 Ack=1803 Win=65152 Len=17 TSval=3171977103 TSecr=1047717392
1711549808.743465900   885 1.612910568    10.10.1.2 → 10.10.1.1    TCP 83 55272 → 8081 [PSH, ACK] Seq=1803 Ack=1803 Win=64256 Len=17 TSval=1047717402 TSecr=3171977103
1711549811.743465900   888 1.613046240    10.10.1.1 → 10.10.1.2    TCP 83 8081 → 55272 [PSH, ACK] Seq=1803 Ack=1820 Win=65152 Len=17 TSval=3171977114 TSecr=1047717402
1711549816.743465900   893 1.623257734    10.10.1.2 → 10.10.1.1    TCP 83 55272 → 8081 [PSH, ACK] Seq=1820 Ack=1820 Win=64256 Len=17 TSval=1047717413 TSecr=3171977114
1711549819.743465900   896 1.623391947    10.10.1.1 → 10.10.1.2    TCP 83 8081 → 55272 [PSH, ACK] Seq=1820 Ack=1837 Win=65152 Len=17 TSval=3171977124 TSecr=1047717413
1711549824.743465900   901 1.633603129    10.10.1.2 → 10.10.1.1    TCP 83 55272 → 8081 [PSH, ACK] Seq=1837 Ack=1837 Win=64256 Len=17 TSval=1047717423 TSecr=3171977124
1711549827.743465900   904 1.633738214    10.10.1.1 → 10.10.1.2    TCP 83 8081 → 55272 [PSH, ACK] Seq=1837 Ack=1854 Win=65152 Len=17 TSval=3171977134 TSecr=1047717423
1711549832.743465900   909 1.643946583    10.10.1.2 → 10.10.1.1    TCP 83 55272 → 8081 [PSH, ACK] Seq=1854 Ack=1854 Win=64256 Len=17 TSval=1047717433 TSecr=3171977134
1711549835.743465900   912 1.644081290    10.10.1.1 → 10.10.1.2    TCP 83 8081 → 55272 [PSH, ACK] Seq=1854 Ack=1871 Win=65152 Len=17 TSval=3171977145 TSecr=1047717433
1711549840.743465900   917 1.654291004    10.10.1.2 → 10.10.1.1    TCP 83 55272 → 8081 [PSH, ACK] Seq=1871 Ack=1871 Win=64256 Len=17 TSval=1047717444 TSecr=3171977145
1711549843.743465900   920 1.654425385    10.10.1.1 → 10.10.1.2    TCP 83 8081 → 55272 [PSH, ACK] Seq=1871 Ack=1888 Win=65152 Len=17 TSval=3171977155 TSecr=1047717444
1711549848.743465900   925 1.664634390    10.10.1.2 → 10.10.1.1    TCP 83 55272 → 8081 [PSH, ACK] Seq=1888 Ack=1888 Win=64256 Len=17 TSval=1047717454 TSecr=3171977155
1711549851.743465900   928 1.664771496    10.10.1.1 → 10.10.1.2    TCP 83 8081 → 55272 [PSH, ACK] Seq=1888 Ack=1905 Win=65152 Len=17 TSval=3171977165 TSecr=1047717454
1711549856.743465900   933 1.674980241    10.10.1.2 → 10.10.1.1    TCP 83 55272 → 8081 [PSH, ACK] Seq=1905 Ack=1905 Win=64256 Len=17 TSval=1047717464 TSecr=3171977165
1711549859.743465900   936 1.675115363    10.10.1.1 → 10.10.1.2    TCP 83 8081 → 55272 [PSH, ACK] Seq=1905 Ack=1922 Win=65152 Len=17 TSval=3171977176 TSecr=1047717464
1711549864.743465900   941 1.685325041    10.10.1.2 → 10.10.1.1    TCP 83 55272 → 8081 [PSH, ACK] Seq=1922 Ack=1922 Win=64256 Len=17 TSval=1047717475 TSecr=3171977176
1711549867.743465900   944 1.685533403    10.10.1.1 → 10.10.1.2    TCP 83 8081 → 55272 [PSH, ACK] Seq=1922 Ack=1939 Win=65152 Len=17 TSval=3171977186 TSecr=1047717475
1711549872.743465900   949 1.695743432    10.10.1.2 → 10.10.1.1    TCP 83 55272 → 8081 [PSH, ACK] Seq=1939 Ack=1939 Win=64256 Len=17 TSval=1047717485 TSecr=3171977186
1711549874.743465900   951 1.695878234    10.10.1.1 → 10.10.1.2    TCP 83 8081 → 55272 [PSH, ACK] Seq=1939 Ack=1956 Win=65152 Len=17 TSval=3171977196 TSecr=1047717485
1711549880.743465900   957 1.706089778    10.10.1.2 → 10.10.1.1    TCP 83 55272 → 8081 [PSH, ACK] Seq=1956 Ack=1956 Win=64256 Len=17 TSval=1047717496 TSecr=3171977196
1711549883.743465900   960 1.706224452    10.10.1.1 → 10.10.1.2    TCP 83 8081 → 55272 [PSH, ACK] Seq=1956 Ack=1973 Win=65152 Len=17 TSval=3171977207 TSecr=1047717496
1711549888.743465900   965 1.716433016    10.10.1.2 → 10.10.1.1    TCP 83 55272 → 8081 [PSH, ACK] Seq=1973 Ack=1973 Win=64256 Len=17 TSval=1047717506 TSecr=3171977207
1711549891.743465900   968 1.716567530    10.10.1.1 → 10.10.1.2    TCP 83 8081 → 55272 [PSH, ACK] Seq=1973 Ack=1990 Win=65152 Len=17 TSval=3171977217 TSecr=1047717506
1711549896.743465900   973 1.726776864    10.10.1.2 → 10.10.1.1    TCP 83 55272 → 8081 [PSH, ACK] Seq=1990 Ack=1990 Win=64256 Len=17 TSval=1047717516 TSecr=3171977217
1711549899.743465900   976 1.726913733    10.10.1.1 → 10.10.1.2    TCP 83 8081 → 55272 [PSH, ACK] Seq=1990 Ack=2007 Win=65152 Len=17 TSval=3171977228 TSecr=1047717516
1711549904.743465900   981 1.737125732    10.10.1.2 → 10.10.1.1    TCP 83 55272 → 8081 [PSH, ACK] Seq=2007 Ack=2007 Win=64256 Len=17 TSval=1047717527 TSecr=3171977228
1711549906.743465900   983 1.737270281    10.10.1.1 → 10.10.1.2    TCP 83 8081 → 55272 [PSH, ACK] Seq=2007 Ack=2024 Win=65152 Len=17 TSval=3171977238 TSecr=1047717527
1711549912.743465900   989 1.747479417    10.10.1.2 → 10.10.1.1    TCP 83 55272 → 8081 [PSH, ACK] Seq=2024 Ack=2024 Win=64256 Len=17 TSval=1047717537 TSecr=3171977238
1711549914.743465900   991 1.747614496    10.10.1.1 → 10.10.1.2    TCP 83 8081 → 55272 [PSH, ACK] Seq=2024 Ack=2041 Win=65152 Len=17 TSval=3171977248 TSecr=1047717537
1711549920.743465900   997 1.757828874    10.10.1.2 → 10.10.1.1    TCP 83 55272 → 8081 [PSH, ACK] Seq=2041 Ack=2041 Win=64256 Len=17 TSval=1047717547 TSecr=3171977248
