1711548813.956266642    34 0.518671682    10.10.1.2 → 10.10.1.1    TCP 83 55018 → 8081 [PSH, ACK] Seq=1 Ack=1 Win=64256 Len=17 TSval=1047572529 TSecr=3171831986
1711548817.956266642    38 0.518979104    10.10.1.1 → 10.10.1.2    TCP 83 8081 → 55018 [PSH, ACK] Seq=1 Ack=18 Win=65152 Len=17 TSval=3171832241 TSecr=1047572529
1711548823.956266642    44 0.520145277    10.10.1.2 → 10.10.1.1    TCP 83 55018 → 8081 [PSH, ACK] Seq=18 Ack=18 Win=64256 Len=17 TSval=1047572531 TSecr=3171832241
1711548826.956266642    47 0.520278728    10.10.1.1 → 10.10.1.2    TCP 83 8081 → 55018 [PSH, ACK] Seq=18 Ack=35 Win=65152 Len=17 TSval=3171832242 TSecr=1047572531
1711548831.956266642    52 0.521489640    10.10.1.2 → 10.10.1.1    TCP 83 55018 → 8081 [PSH, ACK] Seq=35 Ack=35 Win=64256 Len=17 TSval=1047572532 TSecr=3171832242
1711548834.956266642    55 0.521614962    10.10.1.1 → 10.10.1.2    TCP 83 8081 → 55018 [PSH, ACK] Seq=35 Ack=52 Win=65152 Len=17 TSval=3171832243 TSecr=1047572532
1711548839.956266642    60 0.522824108    10.10.1.2 → 10.10.1.1    TCP 83 55018 → 8081 [PSH, ACK] Seq=52 Ack=52 Win=64256 Len=17 TSval=1047572533 TSecr=3171832243
1711548842.956266642    63 0.522948470    10.10.1.1 → 10.10.1.2    TCP 83 8081 → 55018 [PSH, ACK] Seq=52 Ack=69 Win=65152 Len=17 TSval=3171832245 TSecr=1047572533
1711548849.956266642    70 0.524155874    10.10.1.2 → 10.10.1.1    TCP 83 55018 → 8081 [PSH, ACK] Seq=69 Ack=69 Win=64256 Len=17 TSval=1047572535 TSecr=3171832245
1711548850.956266642    71 0.524234599    10.10.1.1 → 10.10.1.2    TCP 83 8081 → 55018 [PSH, ACK] Seq=69 Ack=86 Win=65152 Len=17 TSval=3171832246 TSecr=1047572535
1711548855.956266642    76 0.525441173    10.10.1.2 → 10.10.1.1    TCP 83 55018 → 8081 [PSH, ACK] Seq=86 Ack=86 Win=64256 Len=17 TSval=1047572536 TSecr=3171832246
1711548857.956266642    78 0.525565130    10.10.1.1 → 10.10.1.2    TCP 83 8081 → 55018 [PSH, ACK] Seq=86 Ack=103 Win=65152 Len=17 TSval=3171832247 TSecr=1047572536
1711548863.956266642    84 0.526773071    10.10.1.2 → 10.10.1.1    TCP 83 55018 → 8081 [PSH, ACK] Seq=103 Ack=103 Win=64256 Len=17 TSval=1047572537 TSecr=3171832247
1711548865.956266642    86 0.526906646    10.10.1.1 → 10.10.1.2    TCP 83 8081 → 55018 [PSH, ACK] Seq=103 Ack=120 Win=65152 Len=17 TSval=3171832249 TSecr=1047572537
1711548871.956266642    92 0.528112343    10.10.1.2 → 10.10.1.1    TCP 83 55018 → 8081 [PSH, ACK] Seq=120 Ack=120 Win=64256 Len=17 TSval=1047572539 TSecr=3171832249
1711548874.956266642    95 0.528242656    10.10.1.1 → 10.10.1.2    TCP 83 8081 → 55018 [PSH, ACK] Seq=120 Ack=137 Win=65152 Len=17 TSval=3171832250 TSecr=1047572539
1711548879.956266642   100 0.529449606    10.10.1.2 → 10.10.1.1    TCP 83 55018 → 8081 [PSH, ACK] Seq=137 Ack=137 Win=64256 Len=17 TSval=1047572540 TSecr=3171832250
1711548881.956266642   102 0.529580150    10.10.1.1 → 10.10.1.2    TCP 83 8081 → 55018 [PSH, ACK] Seq=137 Ack=154 Win=65152 Len=17 TSval=3171832251 TSecr=1047572540
1711548887.956266642   108 0.530788985    10.10.1.2 → 10.10.1.1    TCP 83 55018 → 8081 [PSH, ACK] Seq=154 Ack=154 Win=64256 Len=17 TSval=1047572541 TSecr=3171832251
1711548889.956266642   110 0.530913096    10.10.1.1 → 10.10.1.2    TCP 83 8081 → 55018 [PSH, ACK] Seq=154 Ack=171 Win=65152 Len=17 TSval=3171832253 TSecr=1047572541
1711548895.956266642   116 0.532118046    10.10.1.2 → 10.10.1.1    TCP 83 55018 → 8081 [PSH, ACK] Seq=171 Ack=171 Win=64256 Len=17 TSval=1047572543 TSecr=3171832253
1711548898.956266642   119 0.532247865    10.10.1.1 → 10.10.1.2    TCP 83 8081 → 55018 [PSH, ACK] Seq=171 Ack=188 Win=65152 Len=17 TSval=3171832254 TSecr=1047572543
1711548903.956266642   124 0.533453779    10.10.1.2 → 10.10.1.1    TCP 83 55018 → 8081 [PSH, ACK] Seq=188 Ack=188 Win=64256 Len=17 TSval=1047572544 TSecr=3171832254
1711548905.956266642   126 0.533585214    10.10.1.1 → 10.10.1.2    TCP 83 8081 → 55018 [PSH, ACK] Seq=188 Ack=205 Win=65152 Len=17 TSval=3171832255 TSecr=1047572544
1711548911.956266642   132 0.534794494    10.10.1.2 → 10.10.1.1    TCP 83 55018 → 8081 [PSH, ACK] Seq=205 Ack=205 Win=64256 Len=17 TSval=1047572545 TSecr=3171832255
1711548914.956266642   135 0.534919876    10.10.1.1 → 10.10.1.2    TCP 83 8081 → 55018 [PSH, ACK] Seq=205 Ack=222 Win=65152 Len=17 TSval=3171832257 TSecr=1047572545
1711548919.956266642   140 0.536126033    10.10.1.2 → 10.10.1.1    TCP 83 55018 → 8081 [PSH, ACK] Seq=222 Ack=222 Win=64256 Len=17 TSval=1047572547 TSecr=3171832257
1711548921.956266642   142 0.536208001    10.10.1.1 → 10.10.1.2    TCP 83 8081 → 55018 [PSH, ACK] Seq=222 Ack=239 Win=65152 Len=17 TSval=3171832258 TSecr=1047572547
1711548927.956266642   148 0.537413926    10.10.1.2 → 10.10.1.1    TCP 83 55018 → 8081 [PSH, ACK] Seq=239 Ack=239 Win=64256 Len=17 TSval=1047572548 TSecr=3171832258
1711548929.956266642   150 0.537538048    10.10.1.1 → 10.10.1.2    TCP 83 8081 → 55018 [PSH, ACK] Seq=239 Ack=256 Win=65152 Len=17 TSval=3171832259 TSecr=1047572548
1711548935.956266642   156 0.538746334    10.10.1.2 → 10.10.1.1    TCP 83 55018 → 8081 [PSH, ACK] Seq=256 Ack=256 Win=64256 Len=17 TSval=1047572549 TSecr=3171832259
1711548937.956266642   158 0.538879736    10.10.1.1 → 10.10.1.2    TCP 83 8081 → 55018 [PSH, ACK] Seq=256 Ack=273 Win=65152 Len=17 TSval=3171832260 TSecr=1047572549
1711548943.956266642   164 0.540087134    10.10.1.2 → 10.10.1.1    TCP 83 55018 → 8081 [PSH, ACK] Seq=273 Ack=273 Win=64256 Len=17 TSval=1047572551 TSecr=3171832260
1711548946.956266642   167 0.540217686    10.10.1.1 → 10.10.1.2    TCP 83 8081 → 55018 [PSH, ACK] Seq=273 Ack=290 Win=65152 Len=17 TSval=3171832262 TSecr=1047572551
1711548951.956266642   172 0.541424009    10.10.1.2 → 10.10.1.1    TCP 83 55018 → 8081 [PSH, ACK] Seq=290 Ack=290 Win=64256 Len=17 TSval=1047572552 TSecr=3171832262
1711548953.956266642   174 0.541556418    10.10.1.1 → 10.10.1.2    TCP 83 8081 → 55018 [PSH, ACK] Seq=290 Ack=307 Win=65152 Len=17 TSval=3171832263 TSecr=1047572552
1711548959.956266642   180 0.542765157    10.10.1.2 → 10.10.1.1    TCP 83 55018 → 8081 [PSH, ACK] Seq=307 Ack=307 Win=64256 Len=17 TSval=1047572553 TSecr=3171832263
1711548961.956266642   182 0.542897054    10.10.1.1 → 10.10.1.2    TCP 83 8081 → 55018 [PSH, ACK] Seq=307 Ack=324 Win=65152 Len=17 TSval=3171832265 TSecr=1047572553
1711548967.956266642   188 0.544104174    10.10.1.2 → 10.10.1.1    TCP 83 55018 → 8081 [PSH, ACK] Seq=324 Ack=324 Win=64256 Len=17 TSval=1047572555 TSecr=3171832265
1711548970.956266642   191 0.544236017    10.10.1.1 → 10.10.1.2    TCP 83 8081 → 55018 [PSH, ACK] Seq=324 Ack=341 Win=65152 Len=17 TSval=3171832266 TSecr=1047572555
1711548975.956266642   196 0.545440450    10.10.1.2 → 10.10.1.1    TCP 83 55018 → 8081 [PSH, ACK] Seq=341 Ack=341 Win=64256 Len=17 TSval=1047572556 TSecr=3171832266
1711548977.956266642   198 0.545573987    10.10.1.1 → 10.10.1.2    TCP 83 8081 → 55018 [PSH, ACK] Seq=341 Ack=358 Win=65152 Len=17 TSval=3171832267 TSecr=1047572556
1711548983.956266642   204 0.546783088    10.10.1.2 → 10.10.1.1    TCP 83 55018 → 8081 [PSH, ACK] Seq=358 Ack=358 Win=64256 Len=17 TSval=1047572557 TSecr=3171832267
1711548985.956266642   206 0.546912167    10.10.1.1 → 10.10.1.2    TCP 83 8081 → 55018 [PSH, ACK] Seq=358 Ack=375 Win=65152 Len=17 TSval=3171832269 TSecr=1047572557
1711548991.956266642   212 0.548117205    10.10.1.2 → 10.10.1.1    TCP 83 55018 → 8081 [PSH, ACK] Seq=375 Ack=375 Win=64256 Len=17 TSval=1047572559 TSecr=3171832269
1711548993.956266642   214 0.548198981    10.10.1.1 → 10.10.1.2    TCP 83 8081 → 55018 [PSH, ACK] Seq=375 Ack=392 Win=65152 Len=17 TSval=3171832270 TSecr=1047572559
1711548999.956266642   220 0.549405078    10.10.1.2 → 10.10.1.1    TCP 83 55018 → 8081 [PSH, ACK] Seq=392 Ack=392 Win=64256 Len=17 TSval=1047572560 TSecr=3171832270
1711549001.956266642   222 0.549538504    10.10.1.1 → 10.10.1.2    TCP 83 8081 → 55018 [PSH, ACK] Seq=392 Ack=409 Win=65152 Len=17 TSval=3171832271 TSecr=1047572560
1711549007.956266642   228 0.550747035    10.10.1.2 → 10.10.1.1    TCP 83 55018 → 8081 [PSH, ACK] Seq=409 Ack=409 Win=64256 Len=17 TSval=1047572561 TSecr=3171832271
1711549009.956266642   230 0.550870952    10.10.1.1 → 10.10.1.2    TCP 83 8081 → 55018 [PSH, ACK] Seq=409 Ack=426 Win=65152 Len=17 TSval=3171832272 TSecr=1047572561
1711549015.956266642   236 0.552076531    10.10.1.2 → 10.10.1.1    TCP 83 55018 → 8081 [PSH, ACK] Seq=426 Ack=426 Win=64256 Len=17 TSval=1047572563 TSecr=3171832272
1711549018.956266642   239 0.552206405    10.10.1.1 → 10.10.1.2    TCP 83 8081 → 55018 [PSH, ACK] Seq=426 Ack=443 Win=65152 Len=17 TSval=3171832274 TSecr=1047572563
1711549023.956266642   244 0.553411306    10.10.1.2 → 10.10.1.1    TCP 83 55018 → 8081 [PSH, ACK] Seq=443 Ack=443 Win=64256 Len=17 TSval=1047572564 TSecr=3171832274
1711549025.956266642   246 0.553535735    10.10.1.1 → 10.10.1.2    TCP 83 8081 → 55018 [PSH, ACK] Seq=443 Ack=460 Win=65152 Len=17 TSval=3171832275 TSecr=1047572564
1711549031.956266642   252 0.554742932    10.10.1.2 → 10.10.1.1    TCP 83 55018 → 8081 [PSH, ACK] Seq=460 Ack=460 Win=64256 Len=17 TSval=1047572565 TSecr=3171832275
1711549034.956266642   255 0.554867344    10.10.1.1 → 10.10.1.2    TCP 83 8081 → 55018 [PSH, ACK] Seq=460 Ack=477 Win=65152 Len=17 TSval=3171832276 TSecr=1047572565
1711549039.956266642   260 0.556070761    10.10.1.2 → 10.10.1.1    TCP 83 55018 → 8081 [PSH, ACK] Seq=477 Ack=477 Win=64256 Len=17 TSval=1047572567 TSecr=3171832276
1711549042.956266642   263 0.556201098    10.10.1.1 → 10.10.1.2    TCP 83 8081 → 55018 [PSH, ACK] Seq=477 Ack=494 Win=65152 Len=17 TSval=3171832278 TSecr=1047572567
1711549047.956266642   268 0.557406606    10.10.1.2 → 10.10.1.1    TCP 83 55018 → 8081 [PSH, ACK] Seq=494 Ack=494 Win=64256 Len=17 TSval=1047572568 TSecr=3171832278
1711549049.956266642   270 0.557532377    10.10.1.1 → 10.10.1.2    TCP 83 8081 → 55018 [PSH, ACK] Seq=494 Ack=511 Win=65152 Len=17 TSval=3171832279 TSecr=1047572568
1711549055.956266642   276 0.558739921    10.10.1.2 → 10.10.1.1    TCP 83 55018 → 8081 [PSH, ACK] Seq=511 Ack=511 Win=64256 Len=17 TSval=1047572569 TSecr=3171832279
1711549057.956266642   278 0.558869276    10.10.1.1 → 10.10.1.2    TCP 83 8081 → 55018 [PSH, ACK] Seq=511 Ack=528 Win=65152 Len=17 TSval=3171832280 TSecr=1047572569
1711549063.956266642   284 0.560073978    10.10.1.2 → 10.10.1.1    TCP 83 55018 → 8081 [PSH, ACK] Seq=528 Ack=528 Win=64256 Len=17 TSval=1047572571 TSecr=3171832280
1711549065.956266642   286 0.560155723    10.10.1.1 → 10.10.1.2    TCP 83 8081 → 55018 [PSH, ACK] Seq=528 Ack=545 Win=65152 Len=17 TSval=3171832282 TSecr=1047572571
1711549071.956266642   292 0.561360921    10.10.1.2 → 10.10.1.1    TCP 83 55018 → 8081 [PSH, ACK] Seq=545 Ack=545 Win=64256 Len=17 TSval=1047572572 TSecr=3171832282
1711549073.956266642   294 0.561494341    10.10.1.1 → 10.10.1.2    TCP 83 8081 → 55018 [PSH, ACK] Seq=545 Ack=562 Win=65152 Len=17 TSval=3171832283 TSecr=1047572572
1711549079.956266642   300 0.562701365    10.10.1.2 → 10.10.1.1    TCP 83 55018 → 8081 [PSH, ACK] Seq=562 Ack=562 Win=64256 Len=17 TSval=1047572573 TSecr=3171832283
1711549081.956266642   302 0.562835617    10.10.1.1 → 10.10.1.2    TCP 83 8081 → 55018 [PSH, ACK] Seq=562 Ack=579 Win=65152 Len=17 TSval=3171832284 TSecr=1047572573
1711549087.956266642   308 0.564039733    10.10.1.2 → 10.10.1.1    TCP 83 55018 → 8081 [PSH, ACK] Seq=579 Ack=579 Win=64256 Len=17 TSval=1047572575 TSecr=3171832284
1711549090.956266642   311 0.564169682    10.10.1.1 → 10.10.1.2    TCP 83 8081 → 55018 [PSH, ACK] Seq=579 Ack=596 Win=65152 Len=17 TSval=3171832286 TSecr=1047572575
1711549095.956266642   316 0.565374303    10.10.1.2 → 10.10.1.1    TCP 83 55018 → 8081 [PSH, ACK] Seq=596 Ack=596 Win=64256 Len=17 TSval=1047572576 TSecr=3171832286
1711549097.956266642   318 0.565499025    10.10.1.1 → 10.10.1.2    TCP 83 8081 → 55018 [PSH, ACK] Seq=596 Ack=613 Win=65152 Len=17 TSval=3171832287 TSecr=1047572576
1711549103.956266642   324 0.566706535    10.10.1.2 → 10.10.1.1    TCP 83 55018 → 8081 [PSH, ACK] Seq=613 Ack=613 Win=64256 Len=17 TSval=1047572577 TSecr=3171832287
1711549105.956266642   326 0.566830644    10.10.1.1 → 10.10.1.2    TCP 83 8081 → 55018 [PSH, ACK] Seq=613 Ack=630 Win=65152 Len=17 TSval=3171832288 TSecr=1047572577
1711549111.956266642   332 0.568035216    10.10.1.2 → 10.10.1.1    TCP 83 55018 → 8081 [PSH, ACK] Seq=630 Ack=630 Win=64256 Len=17 TSval=1047572579 TSecr=3171832288
1711549113.956266642   334 0.568119542    10.10.1.1 → 10.10.1.2    TCP 83 8081 → 55018 [PSH, ACK] Seq=630 Ack=647 Win=65152 Len=17 TSval=3171832290 TSecr=1047572579
1711549119.956266642   340 0.569324319    10.10.1.2 → 10.10.1.1    TCP 83 55018 → 8081 [PSH, ACK] Seq=647 Ack=647 Win=64256 Len=17 TSval=1047572580 TSecr=3171832290
1711549121.956266642   342 0.569449471    10.10.1.1 → 10.10.1.2    TCP 83 8081 → 55018 [PSH, ACK] Seq=647 Ack=664 Win=65152 Len=17 TSval=3171832291 TSecr=1047572580
1711549127.956266642   348 0.570656633    10.10.1.2 → 10.10.1.1    TCP 83 55018 → 8081 [PSH, ACK] Seq=664 Ack=664 Win=64256 Len=17 TSval=1047572581 TSecr=3171832291
1711549129.956266642   350 0.570781445    10.10.1.1 → 10.10.1.2    TCP 83 8081 → 55018 [PSH, ACK] Seq=664 Ack=681 Win=65152 Len=17 TSval=3171832292 TSecr=1047572581
1711549135.956266642   356 0.571985782    10.10.1.2 → 10.10.1.1    TCP 83 55018 → 8081 [PSH, ACK] Seq=681 Ack=681 Win=64256 Len=17 TSval=1047572583 TSecr=3171832292
1711549138.956266642   359 0.572115659    10.10.1.1 → 10.10.1.2    TCP 83 8081 → 55018 [PSH, ACK] Seq=681 Ack=698 Win=65152 Len=17 TSval=3171832294 TSecr=1047572583
1711549143.956266642   364 0.573321196    10.10.1.2 → 10.10.1.1    TCP 83 55018 → 8081 [PSH, ACK] Seq=698 Ack=698 Win=64256 Len=17 TSval=1047572584 TSecr=3171832294
1711549145.956266642   366 0.573445323    10.10.1.1 → 10.10.1.2    TCP 83 8081 → 55018 [PSH, ACK] Seq=698 Ack=715 Win=65152 Len=17 TSval=3171832295 TSecr=1047572584
1711549151.956266642   372 0.574652924    10.10.1.2 → 10.10.1.1    TCP 83 55018 → 8081 [PSH, ACK] Seq=715 Ack=715 Win=64256 Len=17 TSval=1047572585 TSecr=3171832295
1711549153.956266642   374 0.574782249    10.10.1.1 → 10.10.1.2    TCP 83 8081 → 55018 [PSH, ACK] Seq=715 Ack=732 Win=65152 Len=17 TSval=3171832296 TSecr=1047572585
1711549159.956266642   380 0.575987113    10.10.1.2 → 10.10.1.1    TCP 83 55018 → 8081 [PSH, ACK] Seq=732 Ack=732 Win=64256 Len=17 TSval=1047572587 TSecr=3171832296
1711549161.956266642   382 0.576067876    10.10.1.1 → 10.10.1.2    TCP 83 8081 → 55018 [PSH, ACK] Seq=732 Ack=749 Win=65152 Len=17 TSval=3171832298 TSecr=1047572587
1711549167.956266642   388 0.577272768    10.10.1.2 → 10.10.1.1    TCP 83 55018 → 8081 [PSH, ACK] Seq=749 Ack=749 Win=64256 Len=17 TSval=1047572588 TSecr=3171832298
1711549169.956266642   390 0.577397199    10.10.1.1 → 10.10.1.2    TCP 83 8081 → 55018 [PSH, ACK] Seq=749 Ack=766 Win=65152 Len=17 TSval=3171832299 TSecr=1047572588
1711549175.956266642   396 0.578616367    10.10.1.2 → 10.10.1.1    TCP 83 55018 → 8081 [PSH, ACK] Seq=766 Ack=766 Win=64256 Len=17 TSval=1047572589 TSecr=3171832299
1711549177.956266642   398 0.578746382    10.10.1.1 → 10.10.1.2    TCP 83 8081 → 55018 [PSH, ACK] Seq=766 Ack=783 Win=65152 Len=17 TSval=3171832300 TSecr=1047572589
1711549183.956266642   404 0.579962940    10.10.1.2 → 10.10.1.1    TCP 83 55018 → 8081 [PSH, ACK] Seq=783 Ack=783 Win=64256 Len=17 TSval=1047572591 TSecr=3171832300
1711549186.956266642   407 0.580095485    10.10.1.1 → 10.10.1.2    TCP 83 8081 → 55018 [PSH, ACK] Seq=783 Ack=800 Win=65152 Len=17 TSval=3171832302 TSecr=1047572591
1711549191.956266642   412 0.581299611    10.10.1.2 → 10.10.1.1    TCP 83 55018 → 8081 [PSH, ACK] Seq=800 Ack=800 Win=64256 Len=17 TSval=1047572592 TSecr=3171832302
1711549193.956266642   414 0.581419926    10.10.1.1 → 10.10.1.2    TCP 83 8081 → 55018 [PSH, ACK] Seq=800 Ack=817 Win=65152 Len=17 TSval=3171832303 TSecr=1047572592
1711549199.956266642   420 0.582626884    10.10.1.2 → 10.10.1.1    TCP 83 55018 → 8081 [PSH, ACK] Seq=817 Ack=817 Win=64256 Len=17 TSval=1047572593 TSecr=3171832303
1711549201.956266642   422 0.582747175    10.10.1.1 → 10.10.1.2    TCP 83 8081 → 55018 [PSH, ACK] Seq=817 Ack=834 Win=65152 Len=17 TSval=3171832304 TSecr=1047572593
1711549207.956266642   428 0.583954322    10.10.1.2 → 10.10.1.1    TCP 83 55018 → 8081 [PSH, ACK] Seq=834 Ack=834 Win=64256 Len=17 TSval=1047572595 TSecr=3171832304
1711549209.956266642   430 0.584039450    10.10.1.1 → 10.10.1.2    TCP 83 8081 → 55018 [PSH, ACK] Seq=834 Ack=851 Win=65152 Len=17 TSval=3171832306 TSecr=1047572595
1711549215.956266642   436 0.585244310    10.10.1.2 → 10.10.1.1    TCP 83 55018 → 8081 [PSH, ACK] Seq=851 Ack=851 Win=64256 Len=17 TSval=1047572596 TSecr=3171832306
1711549217.956266642   438 0.585376427    10.10.1.1 → 10.10.1.2    TCP 83 8081 → 55018 [PSH, ACK] Seq=851 Ack=868 Win=65152 Len=17 TSval=3171832307 TSecr=1047572596
1711549223.956266642   444 0.586583853    10.10.1.2 → 10.10.1.1    TCP 83 55018 → 8081 [PSH, ACK] Seq=868 Ack=868 Win=64256 Len=17 TSval=1047572597 TSecr=3171832307
1711549225.956266642   446 0.586704540    10.10.1.1 → 10.10.1.2    TCP 83 8081 → 55018 [PSH, ACK] Seq=868 Ack=885 Win=65152 Len=17 TSval=3171832308 TSecr=1047572597
1711549231.956266642   452 0.587912478    10.10.1.2 → 10.10.1.1    TCP 83 55018 → 8081 [PSH, ACK] Seq=885 Ack=885 Win=64256 Len=17 TSval=1047572599 TSecr=3171832308
1711549233.956266642   454 0.588000290    10.10.1.1 → 10.10.1.2    TCP 83 8081 → 55018 [PSH, ACK] Seq=885 Ack=902 Win=65152 Len=17 TSval=3171832310 TSecr=1047572599
1711549239.956266642   460 0.589207438    10.10.1.2 → 10.10.1.1    TCP 83 55018 → 8081 [PSH, ACK] Seq=902 Ack=902 Win=64256 Len=17 TSval=1047572600 TSecr=3171832310
1711549241.956266642   462 0.589342060    10.10.1.1 → 10.10.1.2    TCP 83 8081 → 55018 [PSH, ACK] Seq=902 Ack=919 Win=65152 Len=17 TSval=3171832311 TSecr=1047572600
1711549247.956266642   468 0.590551087    10.10.1.2 → 10.10.1.1    TCP 83 55018 → 8081 [PSH, ACK] Seq=919 Ack=919 Win=64256 Len=17 TSval=1047572601 TSecr=3171832311
1711549249.956266642   470 0.590671938    10.10.1.1 → 10.10.1.2    TCP 83 8081 → 55018 [PSH, ACK] Seq=919 Ack=936 Win=65152 Len=17 TSval=3171832312 TSecr=1047572601
1711549255.956266642   476 0.591876865    10.10.1.2 → 10.10.1.1    TCP 83 55018 → 8081 [PSH, ACK] Seq=936 Ack=936 Win=64256 Len=17 TSval=1047572603 TSecr=3171832312
1711549257.956266642   478 0.591989373    10.10.1.1 → 10.10.1.2    TCP 83 8081 → 55018 [PSH, ACK] Seq=936 Ack=953 Win=65152 Len=17 TSval=3171832314 TSecr=1047572603
1711549263.956266642   484 0.593195138    10.10.1.2 → 10.10.1.1    TCP 83 55018 → 8081 [PSH, ACK] Seq=953 Ack=953 Win=64256 Len=17 TSval=1047572604 TSecr=3171832314
1711549266.956266642   487 0.593512224    10.10.1.1 → 10.10.1.2    TCP 83 8081 → 55018 [PSH, ACK] Seq=953 Ack=970 Win=65152 Len=17 TSval=3171832315 TSecr=1047572604
1711549271.956266642   492 0.594719191    10.10.1.2 → 10.10.1.1    TCP 83 55018 → 8081 [PSH, ACK] Seq=970 Ack=970 Win=64256 Len=17 TSval=1047572605 TSecr=3171832315
1711549273.956266642   494 0.594839890    10.10.1.1 → 10.10.1.2    TCP 83 8081 → 55018 [PSH, ACK] Seq=970 Ack=987 Win=65152 Len=17 TSval=3171832316 TSecr=1047572605
1711549279.956266642   500 0.596044128    10.10.1.2 → 10.10.1.1    TCP 83 55018 → 8081 [PSH, ACK] Seq=987 Ack=987 Win=64256 Len=17 TSval=1047572607 TSecr=3171832316
1711549281.956266642   502 0.596128505    10.10.1.1 → 10.10.1.2    TCP 83 8081 → 55018 [PSH, ACK] Seq=987 Ack=1004 Win=65152 Len=17 TSval=3171832318 TSecr=1047572607
1711549287.956266642   508 0.597334326    10.10.1.2 → 10.10.1.1    TCP 83 55018 → 8081 [PSH, ACK] Seq=1004 Ack=1004 Win=64256 Len=17 TSval=1047572608 TSecr=3171832318
1711549289.956266642   510 0.597458308    10.10.1.1 → 10.10.1.2    TCP 83 8081 → 55018 [PSH, ACK] Seq=1004 Ack=1021 Win=65152 Len=17 TSval=3171832319 TSecr=1047572608
1711549295.956266642   516 0.598665042    10.10.1.2 → 10.10.1.1    TCP 83 55018 → 8081 [PSH, ACK] Seq=1021 Ack=1021 Win=64256 Len=17 TSval=1047572609 TSecr=3171832319
1711549297.956266642   518 0.598790230    10.10.1.1 → 10.10.1.2    TCP 83 8081 → 55018 [PSH, ACK] Seq=1021 Ack=1038 Win=65152 Len=17 TSval=3171832320 TSecr=1047572609
1711549303.956266642   524 0.599994409    10.10.1.2 → 10.10.1.1    TCP 83 55018 → 8081 [PSH, ACK] Seq=1038 Ack=1038 Win=64256 Len=17 TSval=1047572611 TSecr=3171832320
1711549305.956266642   526 0.600076328    10.10.1.1 → 10.10.1.2    TCP 83 8081 → 55018 [PSH, ACK] Seq=1038 Ack=1055 Win=65152 Len=17 TSval=3171832322 TSecr=1047572611
1711549311.956266642   532 0.601280278    10.10.1.2 → 10.10.1.1    TCP 83 55018 → 8081 [PSH, ACK] Seq=1055 Ack=1055 Win=64256 Len=17 TSval=1047572612 TSecr=3171832322
1711549313.956266642   534 0.601400650    10.10.1.1 → 10.10.1.2    TCP 83 8081 → 55018 [PSH, ACK] Seq=1055 Ack=1072 Win=65152 Len=17 TSval=3171832323 TSecr=1047572612
1711549319.956266642   540 0.602608623    10.10.1.2 → 10.10.1.1    TCP 83 55018 → 8081 [PSH, ACK] Seq=1072 Ack=1072 Win=64256 Len=17 TSval=1047572613 TSecr=3171832323
1711549321.956266642   542 0.602729279    10.10.1.1 → 10.10.1.2    TCP 83 8081 → 55018 [PSH, ACK] Seq=1072 Ack=1089 Win=65152 Len=17 TSval=3171832324 TSecr=1047572613
1711549328.956266642   549 0.603956731    10.10.1.2 → 10.10.1.1    TCP 83 55018 → 8081 [PSH, ACK] Seq=1089 Ack=1089 Win=64256 Len=17 TSval=1047572615 TSecr=3171832324
1711549329.956266642   550 0.604030442    10.10.1.1 → 10.10.1.2    TCP 83 8081 → 55018 [PSH, ACK] Seq=1089 Ack=1106 Win=65152 Len=17 TSval=3171832326 TSecr=1047572615
1711549335.956266642   556 0.605234601    10.10.1.2 → 10.10.1.1    TCP 83 55018 → 8081 [PSH, ACK] Seq=1106 Ack=1106 Win=64256 Len=17 TSval=1047572616 TSecr=3171832326
1711549338.956266642   559 0.605359142    10.10.1.1 → 10.10.1.2    TCP 83 8081 → 55018 [PSH, ACK] Seq=1106 Ack=1123 Win=65152 Len=17 TSval=3171832327 TSecr=1047572616
1711549343.956266642   564 0.606567148    10.10.1.2 → 10.10.1.1    TCP 83 55018 → 8081 [PSH, ACK] Seq=1123 Ack=1123 Win=64256 Len=17 TSval=1047572617 TSecr=3171832327
1711549346.956266642   567 0.606691765    10.10.1.1 → 10.10.1.2    TCP 83 8081 → 55018 [PSH, ACK] Seq=1123 Ack=1140 Win=65152 Len=17 TSval=3171832328 TSecr=1047572617
1711549351.956266642   572 0.607898452    10.10.1.2 → 10.10.1.1    TCP 83 55018 → 8081 [PSH, ACK] Seq=1140 Ack=1140 Win=64256 Len=17 TSval=1047572619 TSecr=3171832328
1711549353.956266642   574 0.608028948    10.10.1.1 → 10.10.1.2    TCP 83 8081 → 55018 [PSH, ACK] Seq=1140 Ack=1157 Win=65152 Len=17 TSval=3171832330 TSecr=1047572619
1711549359.956266642   580 0.609233574    10.10.1.2 → 10.10.1.1    TCP 83 55018 → 8081 [PSH, ACK] Seq=1157 Ack=1157 Win=64256 Len=17 TSval=1047572620 TSecr=3171832330
1711549361.956266642   582 0.609367724    10.10.1.1 → 10.10.1.2    TCP 83 8081 → 55018 [PSH, ACK] Seq=1157 Ack=1174 Win=65152 Len=17 TSval=3171832331 TSecr=1047572620
1711549367.956266642   588 0.610574594    10.10.1.2 → 10.10.1.1    TCP 83 55018 → 8081 [PSH, ACK] Seq=1174 Ack=1174 Win=64256 Len=17 TSval=1047572621 TSecr=3171832331
1711549369.956266642   590 0.610699066    10.10.1.1 → 10.10.1.2    TCP 83 8081 → 55018 [PSH, ACK] Seq=1174 Ack=1191 Win=65152 Len=17 TSval=3171832332 TSecr=1047572621
1711549375.956266642   596 0.611904305    10.10.1.2 → 10.10.1.1    TCP 83 55018 → 8081 [PSH, ACK] Seq=1191 Ack=1191 Win=64256 Len=17 TSval=1047572623 TSecr=3171832332
1711549377.956266642   598 0.612034091    10.10.1.1 → 10.10.1.2    TCP 83 8081 → 55018 [PSH, ACK] Seq=1191 Ack=1208 Win=65152 Len=17 TSval=3171832334 TSecr=1047572623
1711549383.956266642   604 0.613238344    10.10.1.2 → 10.10.1.1    TCP 83 55018 → 8081 [PSH, ACK] Seq=1208 Ack=1208 Win=64256 Len=17 TSval=1047572624 TSecr=3171832334
1711549385.956266642   606 0.613372214    10.10.1.1 → 10.10.1.2    TCP 83 8081 → 55018 [PSH, ACK] Seq=1208 Ack=1225 Win=65152 Len=17 TSval=3171832335 TSecr=1047572624
1711549392.956266642   613 0.614579221    10.10.1.2 → 10.10.1.1    TCP 83 55018 → 8081 [PSH, ACK] Seq=1225 Ack=1225 Win=64256 Len=17 TSval=1047572625 TSecr=3171832335
1711549394.956266642   615 0.614720039    10.10.1.1 → 10.10.1.2    TCP 83 8081 → 55018 [PSH, ACK] Seq=1225 Ack=1242 Win=65152 Len=17 TSval=3171832336 TSecr=1047572625
1711549399.956266642   620 0.615930650    10.10.1.2 → 10.10.1.1    TCP 83 55018 → 8081 [PSH, ACK] Seq=1242 Ack=1242 Win=64256 Len=17 TSval=1047572627 TSecr=3171832336
1711549401.956266642   622 0.616068917    10.10.1.1 → 10.10.1.2    TCP 83 8081 → 55018 [PSH, ACK] Seq=1242 Ack=1259 Win=65152 Len=17 TSval=3171832338 TSecr=1047572627
1711549407.956266642   628 0.617274461    10.10.1.2 → 10.10.1.1    TCP 83 55018 → 8081 [PSH, ACK] Seq=1259 Ack=1259 Win=64256 Len=17 TSval=1047572628 TSecr=3171832338
1711549409.956266642   630 0.617371503    10.10.1.1 → 10.10.1.2    TCP 83 8081 → 55018 [PSH, ACK] Seq=1259 Ack=1276 Win=65152 Len=17 TSval=3171832339 TSecr=1047572628
1711549416.956266642   637 0.618578254    10.10.1.2 → 10.10.1.1    TCP 83 55018 → 8081 [PSH, ACK] Seq=1276 Ack=1276 Win=64256 Len=17 TSval=1047572629 TSecr=3171832339
1711549417.956266642   638 0.618628741    10.10.1.1 → 10.10.1.2    TCP 83 8081 → 55018 [PSH, ACK] Seq=1276 Ack=1293 Win=65152 Len=17 TSval=3171832340 TSecr=1047572629
1711549423.956266642   644 0.619829452    10.10.1.2 → 10.10.1.1    TCP 83 55018 → 8081 [PSH, ACK] Seq=1293 Ack=1293 Win=64256 Len=17 TSval=1047572630 TSecr=3171832340
1711549425.956266642   646 0.619954094    10.10.1.1 → 10.10.1.2    TCP 83 8081 → 55018 [PSH, ACK] Seq=1293 Ack=1310 Win=65152 Len=17 TSval=3171832342 TSecr=1047572630
1711549431.956266642   652 0.621158507    10.10.1.2 → 10.10.1.1    TCP 83 55018 → 8081 [PSH, ACK] Seq=1310 Ack=1310 Win=64256 Len=17 TSval=1047572632 TSecr=3171832342
1711549433.956266642   654 0.621261156    10.10.1.1 → 10.10.1.2    TCP 83 8081 → 55018 [PSH, ACK] Seq=1310 Ack=1327 Win=65152 Len=17 TSval=3171832343 TSecr=1047572632
1711549439.956266642   660 0.622467340    10.10.1.2 → 10.10.1.1    TCP 83 55018 → 8081 [PSH, ACK] Seq=1327 Ack=1327 Win=64256 Len=17 TSval=1047572633 TSecr=3171832343
1711549441.956266642   662 0.622567180    10.10.1.1 → 10.10.1.2    TCP 83 8081 → 55018 [PSH, ACK] Seq=1327 Ack=1344 Win=65152 Len=17 TSval=3171832344 TSecr=1047572633
1711549447.956266642   668 0.623769781    10.10.1.2 → 10.10.1.1    TCP 83 55018 → 8081 [PSH, ACK] Seq=1344 Ack=1344 Win=64256 Len=17 TSval=1047572634 TSecr=3171832344
1711549449.956266642   670 0.623869719    10.10.1.1 → 10.10.1.2    TCP 83 8081 → 55018 [PSH, ACK] Seq=1344 Ack=1361 Win=65152 Len=17 TSval=3171832345 TSecr=1047572634
1711549455.956266642   676 0.625087132    10.10.1.2 → 10.10.1.1    TCP 83 55018 → 8081 [PSH, ACK] Seq=1361 Ack=1361 Win=64256 Len=17 TSval=1047572636 TSecr=3171832345
1711549457.956266642   678 0.625194668    10.10.1.1 → 10.10.1.2    TCP 83 8081 → 55018 [PSH, ACK] Seq=1361 Ack=1378 Win=65152 Len=17 TSval=3171832347 TSecr=1047572636
1711549463.956266642   684 0.626400931    10.10.1.2 → 10.10.1.1    TCP 83 55018 → 8081 [PSH, ACK] Seq=1378 Ack=1378 Win=64256 Len=17 TSval=1047572637 TSecr=3171832347
1711549465.956266642   686 0.626505966    10.10.1.1 → 10.10.1.2    TCP 83 8081 → 55018 [PSH, ACK] Seq=1378 Ack=1395 Win=65152 Len=17 TSval=3171832348 TSecr=1047572637
1711549471.956266642   692 0.627708544    10.10.1.2 → 10.10.1.1    TCP 83 55018 → 8081 [PSH, ACK] Seq=1395 Ack=1395 Win=64256 Len=17 TSval=1047572638 TSecr=3171832348
1711549473.956266642   694 0.627808195    10.10.1.1 → 10.10.1.2    TCP 83 8081 → 55018 [PSH, ACK] Seq=1395 Ack=1412 Win=65152 Len=17 TSval=3171832349 TSecr=1047572638
1711549479.956266642   700 0.629012186    10.10.1.2 → 10.10.1.1    TCP 83 55018 → 8081 [PSH, ACK] Seq=1412 Ack=1412 Win=64256 Len=17 TSval=1047572640 TSecr=3171832349
1711549481.956266642   702 0.629118177    10.10.1.1 → 10.10.1.2    TCP 83 8081 → 55018 [PSH, ACK] Seq=1412 Ack=1429 Win=65152 Len=17 TSval=3171832351 TSecr=1047572640
1711549487.956266642   708 0.630323927    10.10.1.2 → 10.10.1.1    TCP 83 55018 → 8081 [PSH, ACK] Seq=1429 Ack=1429 Win=64256 Len=17 TSval=1047572641 TSecr=3171832351
1711549489.956266642   710 0.630425475    10.10.1.1 → 10.10.1.2    TCP 83 8081 → 55018 [PSH, ACK] Seq=1429 Ack=1446 Win=65152 Len=17 TSval=3171832352 TSecr=1047572641
1711549495.956266642   716 0.631630000    10.10.1.2 → 10.10.1.1    TCP 83 55018 → 8081 [PSH, ACK] Seq=1446 Ack=1446 Win=64256 Len=17 TSval=1047572642 TSecr=3171832352
1711549497.956266642   718 0.631727490    10.10.1.1 → 10.10.1.2    TCP 83 8081 → 55018 [PSH, ACK] Seq=1446 Ack=1463 Win=65152 Len=17 TSval=3171832353 TSecr=1047572642
1711549503.956266642   724 0.632930682    10.10.1.2 → 10.10.1.1    TCP 83 55018 → 8081 [PSH, ACK] Seq=1463 Ack=1463 Win=64256 Len=17 TSval=1047572644 TSecr=3171832353
1711549505.956266642   726 0.633035980    10.10.1.1 → 10.10.1.2    TCP 83 8081 → 55018 [PSH, ACK] Seq=1463 Ack=1480 Win=65152 Len=17 TSval=3171832355 TSecr=1047572644
1711549511.956266642   732 0.634241877    10.10.1.2 → 10.10.1.1    TCP 83 55018 → 8081 [PSH, ACK] Seq=1480 Ack=1480 Win=64256 Len=17 TSval=1047572645 TSecr=3171832355
1711549513.956266642   734 0.634341535    10.10.1.1 → 10.10.1.2    TCP 83 8081 → 55018 [PSH, ACK] Seq=1480 Ack=1497 Win=65152 Len=17 TSval=3171832356 TSecr=1047572645
1711549519.956266642   740 0.635544348    10.10.1.2 → 10.10.1.1    TCP 83 55018 → 8081 [PSH, ACK] Seq=1497 Ack=1497 Win=64256 Len=17 TSval=1047572646 TSecr=3171832356
1711549521.956266642   742 0.635644142    10.10.1.1 → 10.10.1.2    TCP 83 8081 → 55018 [PSH, ACK] Seq=1497 Ack=1514 Win=65152 Len=17 TSval=3171832357 TSecr=1047572646
1711549527.956266642   748 0.636848370    10.10.1.2 → 10.10.1.1    TCP 83 55018 → 8081 [PSH, ACK] Seq=1514 Ack=1514 Win=64256 Len=17 TSval=1047572647 TSecr=3171832357
1711549529.956266642   750 0.636959101    10.10.1.1 → 10.10.1.2    TCP 83 8081 → 55018 [PSH, ACK] Seq=1514 Ack=1531 Win=65152 Len=17 TSval=3171832359 TSecr=1047572647
1711549535.956266642   756 0.638166418    10.10.1.2 → 10.10.1.1    TCP 83 55018 → 8081 [PSH, ACK] Seq=1531 Ack=1531 Win=64256 Len=17 TSval=1047572649 TSecr=3171832359
1711549537.956266642   758 0.638270889    10.10.1.1 → 10.10.1.2    TCP 83 8081 → 55018 [PSH, ACK] Seq=1531 Ack=1548 Win=65152 Len=17 TSval=3171832360 TSecr=1047572649
1711549543.956266642   764 0.639473540    10.10.1.2 → 10.10.1.1    TCP 83 55018 → 8081 [PSH, ACK] Seq=1548 Ack=1548 Win=64256 Len=17 TSval=1047572650 TSecr=3171832360
1711549545.956266642   766 0.639575325    10.10.1.1 → 10.10.1.2    TCP 83 8081 → 55018 [PSH, ACK] Seq=1548 Ack=1565 Win=65152 Len=17 TSval=3171832361 TSecr=1047572650
1711549551.956266642   772 0.640778098    10.10.1.2 → 10.10.1.1    TCP 83 55018 → 8081 [PSH, ACK] Seq=1565 Ack=1565 Win=64256 Len=17 TSval=1047572651 TSecr=3171832361
1711549553.956266642   774 0.640885401    10.10.1.1 → 10.10.1.2    TCP 83 8081 → 55018 [PSH, ACK] Seq=1565 Ack=1582 Win=65152 Len=17 TSval=3171832363 TSecr=1047572651
1711549560.956266642   781 0.642115041    10.10.1.2 → 10.10.1.1    TCP 83 55018 → 8081 [PSH, ACK] Seq=1582 Ack=1582 Win=64256 Len=17 TSval=1047572653 TSecr=3171832363
1711549561.956266642   782 0.642193870    10.10.1.1 → 10.10.1.2    TCP 83 8081 → 55018 [PSH, ACK] Seq=1582 Ack=1599 Win=65152 Len=17 TSval=3171832364 TSecr=1047572653
1711549567.956266642   788 0.643396270    10.10.1.2 → 10.10.1.1    TCP 83 55018 → 8081 [PSH, ACK] Seq=1599 Ack=1599 Win=64256 Len=17 TSval=1047572654 TSecr=3171832364
1711549569.956266642   790 0.643496117    10.10.1.1 → 10.10.1.2    TCP 83 8081 → 55018 [PSH, ACK] Seq=1599 Ack=1616 Win=65152 Len=17 TSval=3171832365 TSecr=1047572654
1711549575.956266642   796 0.644699758    10.10.1.2 → 10.10.1.1    TCP 83 55018 → 8081 [PSH, ACK] Seq=1616 Ack=1616 Win=64256 Len=17 TSval=1047572655 TSecr=3171832365
1711549577.956266642   798 0.644805982    10.10.1.1 → 10.10.1.2    TCP 83 8081 → 55018 [PSH, ACK] Seq=1616 Ack=1633 Win=65152 Len=17 TSval=3171832366 TSecr=1047572655
1711549583.956266642   804 0.646013029    10.10.1.2 → 10.10.1.1    TCP 83 55018 → 8081 [PSH, ACK] Seq=1633 Ack=1633 Win=64256 Len=17 TSval=1047572657 TSecr=3171832366
1711549585.956266642   806 0.646118329    10.10.1.1 → 10.10.1.2    TCP 83 8081 → 55018 [PSH, ACK] Seq=1633 Ack=1650 Win=65152 Len=17 TSval=3171832368 TSecr=1047572657
1711549591.956266642   812 0.647320995    10.10.1.2 → 10.10.1.1    TCP 83 55018 → 8081 [PSH, ACK] Seq=1650 Ack=1650 Win=64256 Len=17 TSval=1047572658 TSecr=3171832368
1711549593.956266642   814 0.647421383    10.10.1.1 → 10.10.1.2    TCP 83 8081 → 55018 [PSH, ACK] Seq=1650 Ack=1667 Win=65152 Len=17 TSval=3171832369 TSecr=1047572658
1711549599.956266642   820 0.648624111    10.10.1.2 → 10.10.1.1    TCP 83 55018 → 8081 [PSH, ACK] Seq=1667 Ack=1667 Win=64256 Len=17 TSval=1047572659 TSecr=3171832369
1711549601.956266642   822 0.648727100    10.10.1.1 → 10.10.1.2    TCP 83 8081 → 55018 [PSH, ACK] Seq=1667 Ack=1684 Win=65152 Len=17 TSval=3171832370 TSecr=1047572659
1711549607.956266642   828 0.649931032    10.10.1.2 → 10.10.1.1    TCP 83 55018 → 8081 [PSH, ACK] Seq=1684 Ack=1684 Win=64256 Len=17 TSval=1047572661 TSecr=3171832370
1711549609.956266642   830 0.650033754    10.10.1.1 → 10.10.1.2    TCP 83 8081 → 55018 [PSH, ACK] Seq=1684 Ack=1701 Win=65152 Len=17 TSval=3171832372 TSecr=1047572661
1711549615.956266642   836 0.651238602    10.10.1.2 → 10.10.1.1    TCP 83 55018 → 8081 [PSH, ACK] Seq=1701 Ack=1701 Win=64256 Len=17 TSval=1047572662 TSecr=3171832372
1711549617.956266642   838 0.651337793    10.10.1.1 → 10.10.1.2    TCP 83 8081 → 55018 [PSH, ACK] Seq=1701 Ack=1718 Win=65152 Len=17 TSval=3171832373 TSecr=1047572662
1711549623.956266642   844 0.652540586    10.10.1.2 → 10.10.1.1    TCP 83 55018 → 8081 [PSH, ACK] Seq=1718 Ack=1718 Win=64256 Len=17 TSval=1047572663 TSecr=3171832373
1711549625.956266642   846 0.652645537    10.10.1.1 → 10.10.1.2    TCP 83 8081 → 55018 [PSH, ACK] Seq=1718 Ack=1735 Win=65152 Len=17 TSval=3171832374 TSecr=1047572663
1711549631.956266642   852 0.653830588    10.10.1.2 → 10.10.1.1    TCP 83 55018 → 8081 [PSH, ACK] Seq=1735 Ack=1735 Win=64256 Len=17 TSval=1047572664 TSecr=3171832374
1711549633.956266642   854 0.653935696    10.10.1.1 → 10.10.1.2    TCP 83 8081 → 55018 [PSH, ACK] Seq=1735 Ack=1752 Win=65152 Len=17 TSval=3171832376 TSecr=1047572664
1711549639.956266642   860 0.655142230    10.10.1.2 → 10.10.1.1    TCP 83 55018 → 8081 [PSH, ACK] Seq=1752 Ack=1752 Win=64256 Len=17 TSval=1047572666 TSecr=3171832376
1711549641.956266642   862 0.655243233    10.10.1.1 → 10.10.1.2    TCP 83 8081 → 55018 [PSH, ACK] Seq=1752 Ack=1769 Win=65152 Len=17 TSval=3171832377 TSecr=1047572666
1711549648.956266642   869 0.656446081    10.10.1.2 → 10.10.1.1    TCP 83 55018 → 8081 [PSH, ACK] Seq=1769 Ack=1769 Win=64256 Len=17 TSval=1047572667 TSecr=3171832377
1711549649.956266642   870 0.656505068    10.10.1.1 → 10.10.1.2    TCP 83 8081 → 55018 [PSH, ACK] Seq=1769 Ack=1786 Win=65152 Len=17 TSval=3171832378 TSecr=1047572667
1711549655.956266642   876 0.657706030    10.10.1.2 → 10.10.1.1    TCP 83 55018 → 8081 [PSH, ACK] Seq=1786 Ack=1786 Win=64256 Len=17 TSval=1047572668 TSecr=3171832378
1711549657.956266642   878 0.657810120    10.10.1.1 → 10.10.1.2    TCP 83 8081 → 55018 [PSH, ACK] Seq=1786 Ack=1803 Win=65152 Len=17 TSval=3171832379 TSecr=1047572668
1711549663.956266642   884 0.659015702    10.10.1.2 → 10.10.1.1    TCP 83 55018 → 8081 [PSH, ACK] Seq=1803 Ack=1803 Win=64256 Len=17 TSval=1047572670 TSecr=3171832379
1711549665.956266642   886 0.659115150    10.10.1.1 → 10.10.1.2    TCP 83 8081 → 55018 [PSH, ACK] Seq=1803 Ack=1820 Win=65152 Len=17 TSval=3171832381 TSecr=1047572670
1711549672.956266642   893 0.660319726    10.10.1.2 → 10.10.1.1    TCP 83 55018 → 8081 [PSH, ACK] Seq=1820 Ack=1820 Win=64256 Len=17 TSval=1047572671 TSecr=3171832381
1711549674.956266642   895 0.660378104    10.10.1.1 → 10.10.1.2    TCP 83 8081 → 55018 [PSH, ACK] Seq=1820 Ack=1837 Win=65152 Len=17 TSval=3171832382 TSecr=1047572671
1711549679.956266642   900 0.661580028    10.10.1.2 → 10.10.1.1    TCP 83 55018 → 8081 [PSH, ACK] Seq=1837 Ack=1837 Win=64256 Len=17 TSval=1047572672 TSecr=3171832382
1711549681.956266642   902 0.661685275    10.10.1.1 → 10.10.1.2    TCP 83 8081 → 55018 [PSH, ACK] Seq=1837 Ack=1854 Win=65152 Len=17 TSval=3171832383 TSecr=1047572672
1711549687.956266642   908 0.662892223    10.10.1.2 → 10.10.1.1    TCP 83 55018 → 8081 [PSH, ACK] Seq=1854 Ack=1854 Win=64256 Len=17 TSval=1047572674 TSecr=3171832383
1711549689.956266642   910 0.662991381    10.10.1.1 → 10.10.1.2    TCP 83 8081 → 55018 [PSH, ACK] Seq=1854 Ack=1871 Win=65152 Len=17 TSval=3171832385 TSecr=1047572674
1711549696.956266642   917 0.664197025    10.10.1.2 → 10.10.1.1    TCP 83 55018 → 8081 [PSH, ACK] Seq=1871 Ack=1871 Win=64256 Len=17 TSval=1047572675 TSecr=3171832385
1711549698.956266642   919 0.664278893    10.10.1.1 → 10.10.1.2    TCP 83 8081 → 55018 [PSH, ACK] Seq=1871 Ack=1888 Win=65152 Len=17 TSval=3171832386 TSecr=1047572675
1711549703.956266642   924 0.665482800    10.10.1.2 → 10.10.1.1    TCP 83 55018 → 8081 [PSH, ACK] Seq=1888 Ack=1888 Win=64256 Len=17 TSval=1047572676 TSecr=3171832386
1711549705.956266642   926 0.665585731    10.10.1.1 → 10.10.1.2    TCP 83 8081 → 55018 [PSH, ACK] Seq=1888 Ack=1905 Win=65152 Len=17 TSval=3171832387 TSecr=1047572676
1711549711.956266642   932 0.666791734    10.10.1.2 → 10.10.1.1    TCP 83 55018 → 8081 [PSH, ACK] Seq=1905 Ack=1905 Win=64256 Len=17 TSval=1047572677 TSecr=3171832387
1711549713.956266642   934 0.666891436    10.10.1.1 → 10.10.1.2    TCP 83 8081 → 55018 [PSH, ACK] Seq=1905 Ack=1922 Win=65152 Len=17 TSval=3171832389 TSecr=1047572677
1711549720.956266642   941 0.668095134    10.10.1.2 → 10.10.1.1    TCP 83 55018 → 8081 [PSH, ACK] Seq=1922 Ack=1922 Win=64256 Len=17 TSval=1047572679 TSecr=3171832389
1711549722.956266642   943 0.668236403    10.10.1.1 → 10.10.1.2    TCP 83 8081 → 55018 [PSH, ACK] Seq=1922 Ack=1939 Win=65152 Len=17 TSval=3171832390 TSecr=1047572679
1711549727.956266642   948 0.669440696    10.10.1.2 → 10.10.1.1    TCP 83 55018 → 8081 [PSH, ACK] Seq=1939 Ack=1939 Win=64256 Len=17 TSval=1047572680 TSecr=3171832390
1711549729.956266642   950 0.669544487    10.10.1.1 → 10.10.1.2    TCP 83 8081 → 55018 [PSH, ACK] Seq=1939 Ack=1956 Win=65152 Len=17 TSval=3171832391 TSecr=1047572680
1711549735.956266642   956 0.670752380    10.10.1.2 → 10.10.1.1    TCP 83 55018 → 8081 [PSH, ACK] Seq=1956 Ack=1956 Win=64256 Len=17 TSval=1047572681 TSecr=3171832391
1711549737.956266642   958 0.670850635    10.10.1.1 → 10.10.1.2    TCP 83 8081 → 55018 [PSH, ACK] Seq=1956 Ack=1973 Win=65152 Len=17 TSval=3171832392 TSecr=1047572681
1711549744.956266642   965 0.672055289    10.10.1.2 → 10.10.1.1    TCP 83 55018 → 8081 [PSH, ACK] Seq=1973 Ack=1973 Win=64256 Len=17 TSval=1047572683 TSecr=3171832392
1711549746.956266642   967 0.672137427    10.10.1.1 → 10.10.1.2    TCP 83 8081 → 55018 [PSH, ACK] Seq=1973 Ack=1990 Win=65152 Len=17 TSval=3171832394 TSecr=1047572683
1711549751.956266642   972 0.673342961    10.10.1.2 → 10.10.1.1    TCP 83 55018 → 8081 [PSH, ACK] Seq=1990 Ack=1990 Win=64256 Len=17 TSval=1047572684 TSecr=3171832394
1711549753.956266642   974 0.673444862    10.10.1.1 → 10.10.1.2    TCP 83 8081 → 55018 [PSH, ACK] Seq=1990 Ack=2007 Win=65152 Len=17 TSval=3171832395 TSecr=1047572684
1711549759.956266642   980 0.674650894    10.10.1.2 → 10.10.1.1    TCP 83 55018 → 8081 [PSH, ACK] Seq=2007 Ack=2007 Win=64256 Len=17 TSval=1047572685 TSecr=3171832395
1711549761.956266642   982 0.674750561    10.10.1.1 → 10.10.1.2    TCP 83 8081 → 55018 [PSH, ACK] Seq=2007 Ack=2024 Win=65152 Len=17 TSval=3171832396 TSecr=1047572685
1711549768.956266642   989 0.675955914    10.10.1.2 → 10.10.1.1    TCP 83 55018 → 8081 [PSH, ACK] Seq=2024 Ack=2024 Win=64256 Len=17 TSval=1047572687 TSecr=3171832396
1711549770.956266642   991 0.676038509    10.10.1.1 → 10.10.1.2    TCP 83 8081 → 55018 [PSH, ACK] Seq=2024 Ack=2041 Win=65152 Len=17 TSval=3171832398 TSecr=1047572687
1711549775.956266642   996 0.677253477    10.10.1.2 → 10.10.1.1    TCP 83 55018 → 8081 [PSH, ACK] Seq=2041 Ack=2041 Win=64256 Len=17 TSval=1047572688 TSecr=3171832398
