1712183478.831527948    34 0.527193866    10.10.1.2 → 10.10.1.1    TCP 83 36154 → 8081 [PSH, ACK] Seq=1 Ack=1 Win=64256 Len=17 TSval=1682237388 TSecr=3806496838
1712183481.831527948    37 0.527514856    10.10.1.1 → 10.10.1.2    TCP 83 8081 → 36154 [PSH, ACK] Seq=1 Ack=18 Win=65152 Len=17 TSval=3806497098 TSecr=1682237388
1712183488.831527948    44 0.537734779    10.10.1.2 → 10.10.1.1    TCP 83 36154 → 8081 [PSH, ACK] Seq=18 Ack=18 Win=64256 Len=17 TSval=1682237399 TSecr=3806497098
1712183491.831527948    47 0.537862814    10.10.1.1 → 10.10.1.2    TCP 83 8081 → 36154 [PSH, ACK] Seq=18 Ack=35 Win=65152 Len=17 TSval=3806497108 TSecr=1682237399
1712183497.831527948    53 0.548084324    10.10.1.2 → 10.10.1.1    TCP 83 36154 → 8081 [PSH, ACK] Seq=35 Ack=35 Win=64256 Len=17 TSval=1682237409 TSecr=3806497108
1712183499.831527948    55 0.548221526    10.10.1.1 → 10.10.1.2    TCP 83 8081 → 36154 [PSH, ACK] Seq=35 Ack=52 Win=65152 Len=17 TSval=3806497118 TSecr=1682237409
1712183505.831527948    61 0.558442676    10.10.1.2 → 10.10.1.1    TCP 83 36154 → 8081 [PSH, ACK] Seq=52 Ack=52 Win=64256 Len=17 TSval=1682237419 TSecr=3806497118
1712183508.831527948    64 0.558578220    10.10.1.1 → 10.10.1.2    TCP 83 8081 → 36154 [PSH, ACK] Seq=52 Ack=69 Win=65152 Len=17 TSval=3806497129 TSecr=1682237419
1712183514.831527948    70 0.568799579    10.10.1.2 → 10.10.1.1    TCP 83 36154 → 8081 [PSH, ACK] Seq=69 Ack=69 Win=64256 Len=17 TSval=1682237430 TSecr=3806497129
1712183516.831527948    72 0.568934221    10.10.1.1 → 10.10.1.2    TCP 83 8081 → 36154 [PSH, ACK] Seq=69 Ack=86 Win=65152 Len=17 TSval=3806497139 TSecr=1682237430
1712183522.831527948    78 0.579155904    10.10.1.2 → 10.10.1.1    TCP 83 36154 → 8081 [PSH, ACK] Seq=86 Ack=86 Win=64256 Len=17 TSval=1682237440 TSecr=3806497139
1712183524.831527948    80 0.579292379    10.10.1.1 → 10.10.1.2    TCP 83 8081 → 36154 [PSH, ACK] Seq=86 Ack=103 Win=65152 Len=17 TSval=3806497149 TSecr=1682237440
1712183532.831527948    88 0.589567404    10.10.1.2 → 10.10.1.1    TCP 83 36154 → 8081 [PSH, ACK] Seq=103 Ack=103 Win=64256 Len=17 TSval=1682237450 TSecr=3806497149
1712183533.831527948    89 0.589702349    10.10.1.1 → 10.10.1.2    TCP 83 8081 → 36154 [PSH, ACK] Seq=103 Ack=120 Win=65152 Len=17 TSval=3806497160 TSecr=1682237450
1712183539.831527948    95 0.599919742    10.10.1.2 → 10.10.1.1    TCP 83 36154 → 8081 [PSH, ACK] Seq=120 Ack=120 Win=64256 Len=17 TSval=1682237461 TSecr=3806497160
1712183542.831527948    98 0.600066575    10.10.1.1 → 10.10.1.2    TCP 83 8081 → 36154 [PSH, ACK] Seq=120 Ack=137 Win=65152 Len=17 TSval=3806497170 TSecr=1682237461
1712183548.831527948   104 0.610283700    10.10.1.2 → 10.10.1.1    TCP 83 36154 → 8081 [PSH, ACK] Seq=137 Ack=137 Win=64256 Len=17 TSval=1682237471 TSecr=3806497170
1712183550.831527948   106 0.610417834    10.10.1.1 → 10.10.1.2    TCP 83 8081 → 36154 [PSH, ACK] Seq=137 Ack=154 Win=65152 Len=17 TSval=3806497181 TSecr=1682237471
1712183556.831527948   112 0.620637663    10.10.1.2 → 10.10.1.1    TCP 83 36154 → 8081 [PSH, ACK] Seq=154 Ack=154 Win=64256 Len=17 TSval=1682237482 TSecr=3806497181
1712183558.831527948   114 0.620773571    10.10.1.1 → 10.10.1.2    TCP 83 8081 → 36154 [PSH, ACK] Seq=154 Ack=171 Win=65152 Len=17 TSval=3806497191 TSecr=1682237482
1712183565.831527948   121 0.630990997    10.10.1.2 → 10.10.1.1    TCP 83 36154 → 8081 [PSH, ACK] Seq=171 Ack=171 Win=64256 Len=17 TSval=1682237492 TSecr=3806497191
1712183567.831527948   123 0.631125206    10.10.1.1 → 10.10.1.2    TCP 83 8081 → 36154 [PSH, ACK] Seq=171 Ack=188 Win=65152 Len=17 TSval=3806497201 TSecr=1682237492
1712183573.831527948   129 0.641342811    10.10.1.2 → 10.10.1.1    TCP 83 36154 → 8081 [PSH, ACK] Seq=188 Ack=188 Win=64256 Len=17 TSval=1682237502 TSecr=3806497201
1712183575.831527948   131 0.641478024    10.10.1.1 → 10.10.1.2    TCP 83 8081 → 36154 [PSH, ACK] Seq=188 Ack=205 Win=65152 Len=17 TSval=3806497212 TSecr=1682237502
1712183582.831527948   138 0.651695471    10.10.1.2 → 10.10.1.1    TCP 83 36154 → 8081 [PSH, ACK] Seq=205 Ack=205 Win=64256 Len=17 TSval=1682237513 TSecr=3806497212
1712183584.831527948   140 0.651832852    10.10.1.1 → 10.10.1.2    TCP 83 8081 → 36154 [PSH, ACK] Seq=205 Ack=222 Win=65152 Len=17 TSval=3806497222 TSecr=1682237513
1712183590.831527948   146 0.662052609    10.10.1.2 → 10.10.1.1    TCP 83 36154 → 8081 [PSH, ACK] Seq=222 Ack=222 Win=64256 Len=17 TSval=1682237523 TSecr=3806497222
1712183592.831527948   148 0.662188466    10.10.1.1 → 10.10.1.2    TCP 83 8081 → 36154 [PSH, ACK] Seq=222 Ack=239 Win=65152 Len=17 TSval=3806497232 TSecr=1682237523
1712183599.831527948   155 0.672406252    10.10.1.2 → 10.10.1.1    TCP 83 36154 → 8081 [PSH, ACK] Seq=239 Ack=239 Win=64256 Len=17 TSval=1682237533 TSecr=3806497232
1712183601.831527948   157 0.672540355    10.10.1.1 → 10.10.1.2    TCP 83 8081 → 36154 [PSH, ACK] Seq=239 Ack=256 Win=65152 Len=17 TSval=3806497243 TSecr=1682237533
1712183607.831527948   163 0.682756466    10.10.1.2 → 10.10.1.1    TCP 83 36154 → 8081 [PSH, ACK] Seq=256 Ack=256 Win=64256 Len=17 TSval=1682237544 TSecr=3806497243
1712183609.831527948   165 0.682892134    10.10.1.1 → 10.10.1.2    TCP 83 8081 → 36154 [PSH, ACK] Seq=256 Ack=273 Win=65152 Len=17 TSval=3806497253 TSecr=1682237544
1712183616.831527948   172 0.693108853    10.10.1.2 → 10.10.1.1    TCP 83 36154 → 8081 [PSH, ACK] Seq=273 Ack=273 Win=64256 Len=17 TSval=1682237554 TSecr=3806497253
1712183618.831527948   174 0.693242619    10.10.1.1 → 10.10.1.2    TCP 83 8081 → 36154 [PSH, ACK] Seq=273 Ack=290 Win=65152 Len=17 TSval=3806497263 TSecr=1682237554
1712183624.831527948   180 0.703460044    10.10.1.2 → 10.10.1.1    TCP 83 36154 → 8081 [PSH, ACK] Seq=290 Ack=290 Win=64256 Len=17 TSval=1682237564 TSecr=3806497263
1712183627.831527948   183 0.703595796    10.10.1.1 → 10.10.1.2    TCP 83 8081 → 36154 [PSH, ACK] Seq=290 Ack=307 Win=65152 Len=17 TSval=3806497274 TSecr=1682237564
1712183633.831527948   189 0.713811940    10.10.1.2 → 10.10.1.1    TCP 83 36154 → 8081 [PSH, ACK] Seq=307 Ack=307 Win=64256 Len=17 TSval=1682237575 TSecr=3806497274
1712183635.831527948   191 0.713947445    10.10.1.1 → 10.10.1.2    TCP 83 8081 → 36154 [PSH, ACK] Seq=307 Ack=324 Win=65152 Len=17 TSval=3806497284 TSecr=1682237575
1712183641.831527948   197 0.724167223    10.10.1.2 → 10.10.1.1    TCP 83 36154 → 8081 [PSH, ACK] Seq=324 Ack=324 Win=64256 Len=17 TSval=1682237585 TSecr=3806497284
1712183643.831527948   199 0.724302659    10.10.1.1 → 10.10.1.2    TCP 83 8081 → 36154 [PSH, ACK] Seq=324 Ack=341 Win=65152 Len=17 TSval=3806497294 TSecr=1682237585
1712183650.831527948   206 0.734521147    10.10.1.2 → 10.10.1.1    TCP 83 36154 → 8081 [PSH, ACK] Seq=341 Ack=341 Win=64256 Len=17 TSval=1682237595 TSecr=3806497294
1712183652.831527948   208 0.734656917    10.10.1.1 → 10.10.1.2    TCP 83 8081 → 36154 [PSH, ACK] Seq=341 Ack=358 Win=65152 Len=17 TSval=3806497305 TSecr=1682237595
1712183658.831527948   214 0.744877451    10.10.1.2 → 10.10.1.1    TCP 83 36154 → 8081 [PSH, ACK] Seq=358 Ack=358 Win=64256 Len=17 TSval=1682237606 TSecr=3806497305
1712183660.831527948   216 0.745013376    10.10.1.1 → 10.10.1.2    TCP 83 8081 → 36154 [PSH, ACK] Seq=358 Ack=375 Win=65152 Len=17 TSval=3806497315 TSecr=1682237606
1712183667.831527948   223 0.755242109    10.10.1.2 → 10.10.1.1    TCP 83 36154 → 8081 [PSH, ACK] Seq=375 Ack=375 Win=64256 Len=17 TSval=1682237616 TSecr=3806497315
1712183669.831527948   225 0.755376410    10.10.1.1 → 10.10.1.2    TCP 83 8081 → 36154 [PSH, ACK] Seq=375 Ack=392 Win=65152 Len=17 TSval=3806497325 TSecr=1682237616
1712183675.831527948   231 0.765597573    10.10.1.2 → 10.10.1.1    TCP 83 36154 → 8081 [PSH, ACK] Seq=392 Ack=392 Win=64256 Len=17 TSval=1682237627 TSecr=3806497325
1712183677.831527948   233 0.765734156    10.10.1.1 → 10.10.1.2    TCP 83 8081 → 36154 [PSH, ACK] Seq=392 Ack=409 Win=65152 Len=17 TSval=3806497336 TSecr=1682237627
1712183684.831527948   240 0.775953017    10.10.1.2 → 10.10.1.1    TCP 83 36154 → 8081 [PSH, ACK] Seq=409 Ack=409 Win=64256 Len=17 TSval=1682237637 TSecr=3806497336
1712183686.831527948   242 0.776088677    10.10.1.1 → 10.10.1.2    TCP 83 8081 → 36154 [PSH, ACK] Seq=409 Ack=426 Win=65152 Len=17 TSval=3806497346 TSecr=1682237637
1712183693.831527948   249 0.786304395    10.10.1.2 → 10.10.1.1    TCP 83 36154 → 8081 [PSH, ACK] Seq=426 Ack=426 Win=64256 Len=17 TSval=1682237647 TSecr=3806497346
1712183695.831527948   251 0.786436738    10.10.1.1 → 10.10.1.2    TCP 83 8081 → 36154 [PSH, ACK] Seq=426 Ack=443 Win=65152 Len=17 TSval=3806497357 TSecr=1682237647
1712183701.831527948   257 0.796657305    10.10.1.2 → 10.10.1.1    TCP 83 36154 → 8081 [PSH, ACK] Seq=443 Ack=443 Win=64256 Len=17 TSval=1682237658 TSecr=3806497357
1712183703.831527948   259 0.796793290    10.10.1.1 → 10.10.1.2    TCP 83 8081 → 36154 [PSH, ACK] Seq=443 Ack=460 Win=65152 Len=17 TSval=3806497367 TSecr=1682237658
1712183709.831527948   265 0.807010311    10.10.1.2 → 10.10.1.1    TCP 83 36154 → 8081 [PSH, ACK] Seq=460 Ack=460 Win=64256 Len=17 TSval=1682237668 TSecr=3806497367
1712183711.831527948   267 0.807144709    10.10.1.1 → 10.10.1.2    TCP 83 8081 → 36154 [PSH, ACK] Seq=460 Ack=477 Win=65152 Len=17 TSval=3806497377 TSecr=1682237668
1712183718.831527948   274 0.817361666    10.10.1.2 → 10.10.1.1    TCP 83 36154 → 8081 [PSH, ACK] Seq=477 Ack=477 Win=64256 Len=17 TSval=1682237678 TSecr=3806497377
1712183720.831527948   276 0.817497318    10.10.1.1 → 10.10.1.2    TCP 83 8081 → 36154 [PSH, ACK] Seq=477 Ack=494 Win=65152 Len=17 TSval=3806497388 TSecr=1682237678
1712183727.831527948   283 0.827713276    10.10.1.2 → 10.10.1.1    TCP 83 36154 → 8081 [PSH, ACK] Seq=494 Ack=494 Win=64256 Len=17 TSval=1682237689 TSecr=3806497388
1712183729.831527948   285 0.827847078    10.10.1.1 → 10.10.1.2    TCP 83 8081 → 36154 [PSH, ACK] Seq=494 Ack=511 Win=65152 Len=17 TSval=3806497398 TSecr=1682237689
1712183735.831527948   291 0.838064290    10.10.1.2 → 10.10.1.1    TCP 83 36154 → 8081 [PSH, ACK] Seq=511 Ack=511 Win=64256 Len=17 TSval=1682237699 TSecr=3806497398
1712183737.831527948   293 0.838198216    10.10.1.1 → 10.10.1.2    TCP 83 8081 → 36154 [PSH, ACK] Seq=511 Ack=528 Win=65152 Len=17 TSval=3806497408 TSecr=1682237699
1712183743.831527948   299 0.848419183    10.10.1.2 → 10.10.1.1    TCP 83 36154 → 8081 [PSH, ACK] Seq=528 Ack=528 Win=64256 Len=17 TSval=1682237709 TSecr=3806497408
1712183745.831527948   301 0.848555105    10.10.1.1 → 10.10.1.2    TCP 83 8081 → 36154 [PSH, ACK] Seq=528 Ack=545 Win=65152 Len=17 TSval=3806497419 TSecr=1682237709
1712183752.831527948   308 0.858773313    10.10.1.2 → 10.10.1.1    TCP 83 36154 → 8081 [PSH, ACK] Seq=545 Ack=545 Win=64256 Len=17 TSval=1682237720 TSecr=3806497419
1712183754.831527948   310 0.858908948    10.10.1.1 → 10.10.1.2    TCP 83 8081 → 36154 [PSH, ACK] Seq=545 Ack=562 Win=65152 Len=17 TSval=3806497429 TSecr=1682237720
1712183760.831527948   316 0.869128398    10.10.1.2 → 10.10.1.1    TCP 83 36154 → 8081 [PSH, ACK] Seq=562 Ack=562 Win=64256 Len=17 TSval=1682237730 TSecr=3806497429
1712183762.831527948   318 0.869265293    10.10.1.1 → 10.10.1.2    TCP 83 8081 → 36154 [PSH, ACK] Seq=562 Ack=579 Win=65152 Len=17 TSval=3806497439 TSecr=1682237730
1712183769.831527948   325 0.879483574    10.10.1.2 → 10.10.1.1    TCP 83 36154 → 8081 [PSH, ACK] Seq=579 Ack=579 Win=64256 Len=17 TSval=1682237740 TSecr=3806497439
1712183771.831527948   327 0.879618202    10.10.1.1 → 10.10.1.2    TCP 83 8081 → 36154 [PSH, ACK] Seq=579 Ack=596 Win=65152 Len=17 TSval=3806497450 TSecr=1682237740
1712183777.831527948   333 0.889838196    10.10.1.2 → 10.10.1.1    TCP 83 36154 → 8081 [PSH, ACK] Seq=596 Ack=596 Win=64256 Len=17 TSval=1682237751 TSecr=3806497450
1712183779.831527948   335 0.889974190    10.10.1.1 → 10.10.1.2    TCP 83 8081 → 36154 [PSH, ACK] Seq=596 Ack=613 Win=65152 Len=17 TSval=3806497460 TSecr=1682237751
1712183786.831527948   342 0.900191620    10.10.1.2 → 10.10.1.1    TCP 83 36154 → 8081 [PSH, ACK] Seq=613 Ack=613 Win=64256 Len=17 TSval=1682237761 TSecr=3806497460
1712183788.831527948   344 0.900326359    10.10.1.1 → 10.10.1.2    TCP 83 8081 → 36154 [PSH, ACK] Seq=613 Ack=630 Win=65152 Len=17 TSval=3806497470 TSecr=1682237761
1712183794.831527948   350 0.910548335    10.10.1.2 → 10.10.1.1    TCP 83 36154 → 8081 [PSH, ACK] Seq=630 Ack=630 Win=64256 Len=17 TSval=1682237772 TSecr=3806497470
1712183796.831527948   352 0.910683312    10.10.1.1 → 10.10.1.2    TCP 83 8081 → 36154 [PSH, ACK] Seq=630 Ack=647 Win=65152 Len=17 TSval=3806497481 TSecr=1682237772
1712183804.831527948   360 0.920958744    10.10.1.2 → 10.10.1.1    TCP 83 36154 → 8081 [PSH, ACK] Seq=647 Ack=647 Win=64256 Len=17 TSval=1682237782 TSecr=3806497481
1712183805.831527948   361 0.921092977    10.10.1.1 → 10.10.1.2    TCP 83 8081 → 36154 [PSH, ACK] Seq=647 Ack=664 Win=65152 Len=17 TSval=3806497491 TSecr=1682237782
1712183811.831527948   367 0.931309362    10.10.1.2 → 10.10.1.1    TCP 83 36154 → 8081 [PSH, ACK] Seq=664 Ack=664 Win=64256 Len=17 TSval=1682237792 TSecr=3806497491
1712183814.831527948   370 0.931460748    10.10.1.1 → 10.10.1.2    TCP 83 8081 → 36154 [PSH, ACK] Seq=664 Ack=681 Win=65152 Len=17 TSval=3806497502 TSecr=1682237792
1712183820.831527948   376 0.941677835    10.10.1.2 → 10.10.1.1    TCP 83 36154 → 8081 [PSH, ACK] Seq=681 Ack=681 Win=64256 Len=17 TSval=1682237803 TSecr=3806497502
1712183822.831527948   378 0.941812715    10.10.1.1 → 10.10.1.2    TCP 83 8081 → 36154 [PSH, ACK] Seq=681 Ack=698 Win=65152 Len=17 TSval=3806497512 TSecr=1682237803
1712183828.831527948   384 0.952031397    10.10.1.2 → 10.10.1.1    TCP 83 36154 → 8081 [PSH, ACK] Seq=698 Ack=698 Win=64256 Len=17 TSval=1682237813 TSecr=3806497512
1712183830.831527948   386 0.952167569    10.10.1.1 → 10.10.1.2    TCP 83 8081 → 36154 [PSH, ACK] Seq=698 Ack=715 Win=65152 Len=17 TSval=3806497522 TSecr=1682237813
1712183837.831527948   393 0.962382197    10.10.1.2 → 10.10.1.1    TCP 83 36154 → 8081 [PSH, ACK] Seq=715 Ack=715 Win=64256 Len=17 TSval=1682237823 TSecr=3806497522
1712183839.831527948   395 0.962516759    10.10.1.1 → 10.10.1.2    TCP 83 8081 → 36154 [PSH, ACK] Seq=715 Ack=732 Win=65152 Len=17 TSval=3806497533 TSecr=1682237823
1712183845.831527948   401 0.972733597    10.10.1.2 → 10.10.1.1    TCP 83 36154 → 8081 [PSH, ACK] Seq=732 Ack=732 Win=64256 Len=17 TSval=1682237834 TSecr=3806497533
1712183848.831527948   404 0.972867622    10.10.1.1 → 10.10.1.2    TCP 83 8081 → 36154 [PSH, ACK] Seq=732 Ack=749 Win=65152 Len=17 TSval=3806497543 TSecr=1682237834
1712183854.831527948   410 0.983084674    10.10.1.2 → 10.10.1.1    TCP 83 36154 → 8081 [PSH, ACK] Seq=749 Ack=749 Win=64256 Len=17 TSval=1682237844 TSecr=3806497543
1712183856.831527948   412 0.983219030    10.10.1.1 → 10.10.1.2    TCP 83 8081 → 36154 [PSH, ACK] Seq=749 Ack=766 Win=65152 Len=17 TSval=3806497553 TSecr=1682237844
1712183862.831527948   418 0.993437773    10.10.1.2 → 10.10.1.1    TCP 83 36154 → 8081 [PSH, ACK] Seq=766 Ack=766 Win=64256 Len=17 TSval=1682237854 TSecr=3806497553
1712183864.831527948   420 0.993574195    10.10.1.1 → 10.10.1.2    TCP 83 8081 → 36154 [PSH, ACK] Seq=766 Ack=783 Win=65152 Len=17 TSval=3806497564 TSecr=1682237854
1712183871.831527948   427 1.003748415    10.10.1.2 → 10.10.1.1    TCP 83 36154 → 8081 [PSH, ACK] Seq=783 Ack=783 Win=64256 Len=17 TSval=1682237865 TSecr=3806497564
1712183873.831527948   429 1.003883773    10.10.1.1 → 10.10.1.2    TCP 83 8081 → 36154 [PSH, ACK] Seq=783 Ack=800 Win=65152 Len=17 TSval=3806497574 TSecr=1682237865
1712183879.831527948   435 1.014101880    10.10.1.2 → 10.10.1.1    TCP 83 36154 → 8081 [PSH, ACK] Seq=800 Ack=800 Win=64256 Len=17 TSval=1682237875 TSecr=3806497574
1712183881.831527948   437 1.014237876    10.10.1.1 → 10.10.1.2    TCP 83 8081 → 36154 [PSH, ACK] Seq=800 Ack=817 Win=65152 Len=17 TSval=3806497584 TSecr=1682237875
1712183888.831527948   444 1.024456959    10.10.1.2 → 10.10.1.1    TCP 83 36154 → 8081 [PSH, ACK] Seq=817 Ack=817 Win=64256 Len=17 TSval=1682237885 TSecr=3806497584
1712183890.831527948   446 1.024591876    10.10.1.1 → 10.10.1.2    TCP 83 8081 → 36154 [PSH, ACK] Seq=817 Ack=834 Win=65152 Len=17 TSval=3806497595 TSecr=1682237885
1712183896.831527948   452 1.034809882    10.10.1.2 → 10.10.1.1    TCP 83 36154 → 8081 [PSH, ACK] Seq=834 Ack=834 Win=64256 Len=17 TSval=1682237896 TSecr=3806497595
1712183898.831527948   454 1.034945657    10.10.1.1 → 10.10.1.2    TCP 83 8081 → 36154 [PSH, ACK] Seq=834 Ack=851 Win=65152 Len=17 TSval=3806497605 TSecr=1682237896
1712183905.831527948   461 1.045161066    10.10.1.2 → 10.10.1.1    TCP 83 36154 → 8081 [PSH, ACK] Seq=851 Ack=851 Win=64256 Len=17 TSval=1682237906 TSecr=3806497605
1712183907.831527948   463 1.045294511    10.10.1.1 → 10.10.1.2    TCP 83 8081 → 36154 [PSH, ACK] Seq=851 Ack=868 Win=65152 Len=17 TSval=3806497615 TSecr=1682237906
1712183913.831527948   469 1.055513404    10.10.1.2 → 10.10.1.1    TCP 83 36154 → 8081 [PSH, ACK] Seq=868 Ack=868 Win=64256 Len=17 TSval=1682237916 TSecr=3806497615
1712183915.831527948   471 1.055649211    10.10.1.1 → 10.10.1.2    TCP 83 8081 → 36154 [PSH, ACK] Seq=868 Ack=885 Win=65152 Len=17 TSval=3806497626 TSecr=1682237916
1712183922.831527948   478 1.065868355    10.10.1.2 → 10.10.1.1    TCP 83 36154 → 8081 [PSH, ACK] Seq=885 Ack=885 Win=64256 Len=17 TSval=1682237927 TSecr=3806497626
1712183924.831527948   480 1.066003310    10.10.1.1 → 10.10.1.2    TCP 83 8081 → 36154 [PSH, ACK] Seq=885 Ack=902 Win=65152 Len=17 TSval=3806497636 TSecr=1682237927
1712183930.831527948   486 1.076221524    10.10.1.2 → 10.10.1.1    TCP 83 36154 → 8081 [PSH, ACK] Seq=902 Ack=902 Win=64256 Len=17 TSval=1682237937 TSecr=3806497636
1712183932.831527948   488 1.076357504    10.10.1.1 → 10.10.1.2    TCP 83 8081 → 36154 [PSH, ACK] Seq=902 Ack=919 Win=65152 Len=17 TSval=3806497646 TSecr=1682237937
1712183939.831527948   495 1.086557982    10.10.1.2 → 10.10.1.1    TCP 83 36154 → 8081 [PSH, ACK] Seq=919 Ack=919 Win=64256 Len=17 TSval=1682237948 TSecr=3806497646
1712183941.831527948   497 1.086693978    10.10.1.1 → 10.10.1.2    TCP 83 8081 → 36154 [PSH, ACK] Seq=919 Ack=936 Win=65152 Len=17 TSval=3806497657 TSecr=1682237948
1712183947.831527948   503 1.096910520    10.10.1.2 → 10.10.1.1    TCP 83 36154 → 8081 [PSH, ACK] Seq=936 Ack=936 Win=64256 Len=17 TSval=1682237958 TSecr=3806497657
1712183949.831527948   505 1.097046632    10.10.1.1 → 10.10.1.2    TCP 83 8081 → 36154 [PSH, ACK] Seq=936 Ack=953 Win=65152 Len=17 TSval=3806497667 TSecr=1682237958
1712183956.831527948   512 1.107267285    10.10.1.2 → 10.10.1.1    TCP 83 36154 → 8081 [PSH, ACK] Seq=953 Ack=953 Win=64256 Len=17 TSval=1682237968 TSecr=3806497667
1712183958.831527948   514 1.107474781    10.10.1.1 → 10.10.1.2    TCP 83 8081 → 36154 [PSH, ACK] Seq=953 Ack=970 Win=65152 Len=17 TSval=3806497678 TSecr=1682237968
1712183964.831527948   520 1.117691553    10.10.1.2 → 10.10.1.1    TCP 83 36154 → 8081 [PSH, ACK] Seq=970 Ack=970 Win=64256 Len=17 TSval=1682237979 TSecr=3806497678
1712183966.831527948   522 1.117827590    10.10.1.1 → 10.10.1.2    TCP 83 8081 → 36154 [PSH, ACK] Seq=970 Ack=987 Win=65152 Len=17 TSval=3806497688 TSecr=1682237979
1712183973.831527948   529 1.128043887    10.10.1.2 → 10.10.1.1    TCP 83 36154 → 8081 [PSH, ACK] Seq=987 Ack=987 Win=64256 Len=17 TSval=1682237989 TSecr=3806497688
1712183975.831527948   531 1.128178680    10.10.1.1 → 10.10.1.2    TCP 83 8081 → 36154 [PSH, ACK] Seq=987 Ack=1004 Win=65152 Len=17 TSval=3806497698 TSecr=1682237989
1712183981.831527948   537 1.138396188    10.10.1.2 → 10.10.1.1    TCP 83 36154 → 8081 [PSH, ACK] Seq=1004 Ack=1004 Win=64256 Len=17 TSval=1682237999 TSecr=3806497698
1712183983.831527948   539 1.138531903    10.10.1.1 → 10.10.1.2    TCP 83 8081 → 36154 [PSH, ACK] Seq=1004 Ack=1021 Win=65152 Len=17 TSval=3806497709 TSecr=1682237999
1712183990.831527948   546 1.148751582    10.10.1.2 → 10.10.1.1    TCP 83 36154 → 8081 [PSH, ACK] Seq=1021 Ack=1021 Win=64256 Len=17 TSval=1682238010 TSecr=3806497709
1712183992.831527948   548 1.148887907    10.10.1.1 → 10.10.1.2    TCP 83 8081 → 36154 [PSH, ACK] Seq=1021 Ack=1038 Win=65152 Len=17 TSval=3806497719 TSecr=1682238010
1712183999.831527948   555 1.159103330    10.10.1.2 → 10.10.1.1    TCP 83 36154 → 8081 [PSH, ACK] Seq=1038 Ack=1038 Win=64256 Len=17 TSval=1682238020 TSecr=3806497719
1712184000.831527948   556 1.159180850    10.10.1.1 → 10.10.1.2    TCP 83 8081 → 36154 [PSH, ACK] Seq=1038 Ack=1055 Win=65152 Len=17 TSval=3806497729 TSecr=1682238020
1712184007.831527948   563 1.169395738    10.10.1.2 → 10.10.1.1    TCP 83 36154 → 8081 [PSH, ACK] Seq=1055 Ack=1055 Win=64256 Len=17 TSval=1682238030 TSecr=3806497729
1712184009.831527948   565 1.169534970    10.10.1.1 → 10.10.1.2    TCP 83 8081 → 36154 [PSH, ACK] Seq=1055 Ack=1072 Win=65152 Len=17 TSval=3806497740 TSecr=1682238030
1712184015.831527948   571 1.179750800    10.10.1.2 → 10.10.1.1    TCP 83 36154 → 8081 [PSH, ACK] Seq=1072 Ack=1072 Win=64256 Len=17 TSval=1682238041 TSecr=3806497740
1712184017.831527948   573 1.179892451    10.10.1.1 → 10.10.1.2    TCP 83 8081 → 36154 [PSH, ACK] Seq=1072 Ack=1089 Win=65152 Len=17 TSval=3806497750 TSecr=1682238041
1712184024.831527948   580 1.190108463    10.10.1.2 → 10.10.1.1    TCP 83 36154 → 8081 [PSH, ACK] Seq=1089 Ack=1089 Win=64256 Len=17 TSval=1682238051 TSecr=3806497750
1712184026.831527948   582 1.190246230    10.10.1.1 → 10.10.1.2    TCP 83 8081 → 36154 [PSH, ACK] Seq=1089 Ack=1106 Win=65152 Len=17 TSval=3806497760 TSecr=1682238051
1712184032.831527948   588 1.200461504    10.10.1.2 → 10.10.1.1    TCP 83 36154 → 8081 [PSH, ACK] Seq=1106 Ack=1106 Win=64256 Len=17 TSval=1682238061 TSecr=3806497760
1712184034.831527948   590 1.200604290    10.10.1.1 → 10.10.1.2    TCP 83 8081 → 36154 [PSH, ACK] Seq=1106 Ack=1123 Win=65152 Len=17 TSval=3806497771 TSecr=1682238061
1712184041.831527948   597 1.210820038    10.10.1.2 → 10.10.1.1    TCP 83 36154 → 8081 [PSH, ACK] Seq=1123 Ack=1123 Win=64256 Len=17 TSval=1682238072 TSecr=3806497771
1712184043.831527948   599 1.210961274    10.10.1.1 → 10.10.1.2    TCP 83 8081 → 36154 [PSH, ACK] Seq=1123 Ack=1140 Win=65152 Len=17 TSval=3806497781 TSecr=1682238072
1712184049.831527948   605 1.221179381    10.10.1.2 → 10.10.1.1    TCP 83 36154 → 8081 [PSH, ACK] Seq=1140 Ack=1140 Win=64256 Len=17 TSval=1682238082 TSecr=3806497781
1712184051.831527948   607 1.221319764    10.10.1.1 → 10.10.1.2    TCP 83 8081 → 36154 [PSH, ACK] Seq=1140 Ack=1157 Win=65152 Len=17 TSval=3806497791 TSecr=1682238082
1712184058.831527948   614 1.231535595    10.10.1.2 → 10.10.1.1    TCP 83 36154 → 8081 [PSH, ACK] Seq=1157 Ack=1157 Win=64256 Len=17 TSval=1682238092 TSecr=3806497791
1712184060.831527948   616 1.231670051    10.10.1.1 → 10.10.1.2    TCP 83 8081 → 36154 [PSH, ACK] Seq=1157 Ack=1174 Win=65152 Len=17 TSval=3806497802 TSecr=1682238092
1712184066.831527948   622 1.241885565    10.10.1.2 → 10.10.1.1    TCP 83 36154 → 8081 [PSH, ACK] Seq=1174 Ack=1174 Win=64256 Len=17 TSval=1682238103 TSecr=3806497802
1712184069.831527948   625 1.242019654    10.10.1.1 → 10.10.1.2    TCP 83 8081 → 36154 [PSH, ACK] Seq=1174 Ack=1191 Win=65152 Len=17 TSval=3806497812 TSecr=1682238103
1712184076.831527948   632 1.252293347    10.10.1.2 → 10.10.1.1    TCP 83 36154 → 8081 [PSH, ACK] Seq=1191 Ack=1191 Win=64256 Len=17 TSval=1682238113 TSecr=3806497812
1712184077.831527948   633 1.252428314    10.10.1.1 → 10.10.1.2    TCP 83 8081 → 36154 [PSH, ACK] Seq=1191 Ack=1208 Win=65152 Len=17 TSval=3806497823 TSecr=1682238113
1712184083.831527948   639 1.262647114    10.10.1.2 → 10.10.1.1    TCP 83 36154 → 8081 [PSH, ACK] Seq=1208 Ack=1208 Win=64256 Len=17 TSval=1682238124 TSecr=3806497823
1712184086.831527948   642 1.262785665    10.10.1.1 → 10.10.1.2    TCP 83 8081 → 36154 [PSH, ACK] Seq=1208 Ack=1225 Win=65152 Len=17 TSval=3806497833 TSecr=1682238124
1712184092.831527948   648 1.273002962    10.10.1.2 → 10.10.1.1    TCP 83 36154 → 8081 [PSH, ACK] Seq=1225 Ack=1225 Win=64256 Len=17 TSval=1682238134 TSecr=3806497833
1712184094.831527948   650 1.273137273    10.10.1.1 → 10.10.1.2    TCP 83 8081 → 36154 [PSH, ACK] Seq=1225 Ack=1242 Win=65152 Len=17 TSval=3806497843 TSecr=1682238134
1712184100.831527948   656 1.283354939    10.10.1.2 → 10.10.1.1    TCP 83 36154 → 8081 [PSH, ACK] Seq=1242 Ack=1242 Win=64256 Len=17 TSval=1682238144 TSecr=3806497843
1712184103.831527948   659 1.283489906    10.10.1.1 → 10.10.1.2    TCP 83 8081 → 36154 [PSH, ACK] Seq=1242 Ack=1259 Win=65152 Len=17 TSval=3806497854 TSecr=1682238144
1712184109.831527948   665 1.293708722    10.10.1.2 → 10.10.1.1    TCP 83 36154 → 8081 [PSH, ACK] Seq=1259 Ack=1259 Win=64256 Len=17 TSval=1682238155 TSecr=3806497854
1712184111.831527948   667 1.293844304    10.10.1.1 → 10.10.1.2    TCP 83 8081 → 36154 [PSH, ACK] Seq=1259 Ack=1276 Win=65152 Len=17 TSval=3806497864 TSecr=1682238155
1712184117.831527948   673 1.304062522    10.10.1.2 → 10.10.1.1    TCP 83 36154 → 8081 [PSH, ACK] Seq=1276 Ack=1276 Win=64256 Len=17 TSval=1682238165 TSecr=3806497864
1712184120.831527948   676 1.304197004    10.10.1.1 → 10.10.1.2    TCP 83 8081 → 36154 [PSH, ACK] Seq=1276 Ack=1293 Win=65152 Len=17 TSval=3806497874 TSecr=1682238165
1712184126.831527948   682 1.314414590    10.10.1.2 → 10.10.1.1    TCP 83 36154 → 8081 [PSH, ACK] Seq=1293 Ack=1293 Win=64256 Len=17 TSval=1682238175 TSecr=3806497874
1712184128.831527948   684 1.314549004    10.10.1.1 → 10.10.1.2    TCP 83 8081 → 36154 [PSH, ACK] Seq=1293 Ack=1310 Win=65152 Len=17 TSval=3806497885 TSecr=1682238175
1712184134.831527948   690 1.324767957    10.10.1.2 → 10.10.1.1    TCP 83 36154 → 8081 [PSH, ACK] Seq=1310 Ack=1310 Win=64256 Len=17 TSval=1682238186 TSecr=3806497885
1712184137.831527948   693 1.324903742    10.10.1.1 → 10.10.1.2    TCP 83 8081 → 36154 [PSH, ACK] Seq=1310 Ack=1327 Win=65152 Len=17 TSval=3806497895 TSecr=1682238186
1712184143.831527948   699 1.335121759    10.10.1.2 → 10.10.1.1    TCP 83 36154 → 8081 [PSH, ACK] Seq=1327 Ack=1327 Win=64256 Len=17 TSval=1682238196 TSecr=3806497895
1712184145.831527948   701 1.335256938    10.10.1.1 → 10.10.1.2    TCP 83 8081 → 36154 [PSH, ACK] Seq=1327 Ack=1344 Win=65152 Len=17 TSval=3806497905 TSecr=1682238196
1712184151.831527948   707 1.345473354    10.10.1.2 → 10.10.1.1    TCP 83 36154 → 8081 [PSH, ACK] Seq=1344 Ack=1344 Win=64256 Len=17 TSval=1682238206 TSecr=3806497905
1712184154.831527948   710 1.345609112    10.10.1.1 → 10.10.1.2    TCP 83 8081 → 36154 [PSH, ACK] Seq=1344 Ack=1361 Win=65152 Len=17 TSval=3806497916 TSecr=1682238206
1712184160.831527948   716 1.355825821    10.10.1.2 → 10.10.1.1    TCP 83 36154 → 8081 [PSH, ACK] Seq=1361 Ack=1361 Win=64256 Len=17 TSval=1682238217 TSecr=3806497916
1712184162.831527948   718 1.355960414    10.10.1.1 → 10.10.1.2    TCP 83 8081 → 36154 [PSH, ACK] Seq=1361 Ack=1378 Win=65152 Len=17 TSval=3806497926 TSecr=1682238217
1712184168.831527948   724 1.366174835    10.10.1.2 → 10.10.1.1    TCP 83 36154 → 8081 [PSH, ACK] Seq=1378 Ack=1378 Win=64256 Len=17 TSval=1682238227 TSecr=3806497926
1712184171.831527948   727 1.366309500    10.10.1.1 → 10.10.1.2    TCP 83 8081 → 36154 [PSH, ACK] Seq=1378 Ack=1395 Win=65152 Len=17 TSval=3806497936 TSecr=1682238227
1712184177.831527948   733 1.376524432    10.10.1.2 → 10.10.1.1    TCP 83 36154 → 8081 [PSH, ACK] Seq=1395 Ack=1395 Win=64256 Len=17 TSval=1682238237 TSecr=3806497936
1712184179.831527948   735 1.376659785    10.10.1.1 → 10.10.1.2    TCP 83 8081 → 36154 [PSH, ACK] Seq=1395 Ack=1412 Win=65152 Len=17 TSval=3806497947 TSecr=1682238237
1712184185.831527948   741 1.386880096    10.10.1.2 → 10.10.1.1    TCP 83 36154 → 8081 [PSH, ACK] Seq=1412 Ack=1412 Win=64256 Len=17 TSval=1682238248 TSecr=3806497947
1712184188.831527948   744 1.387015018    10.10.1.1 → 10.10.1.2    TCP 83 8081 → 36154 [PSH, ACK] Seq=1412 Ack=1429 Win=65152 Len=17 TSval=3806497957 TSecr=1682238248
1712184194.831527948   750 1.397233960    10.10.1.2 → 10.10.1.1    TCP 83 36154 → 8081 [PSH, ACK] Seq=1429 Ack=1429 Win=64256 Len=17 TSval=1682238258 TSecr=3806497957
1712184196.831527948   752 1.397370018    10.10.1.1 → 10.10.1.2    TCP 83 8081 → 36154 [PSH, ACK] Seq=1429 Ack=1446 Win=65152 Len=17 TSval=3806497967 TSecr=1682238258
1712184202.831527948   758 1.407540357    10.10.1.2 → 10.10.1.1    TCP 83 36154 → 8081 [PSH, ACK] Seq=1446 Ack=1446 Win=64256 Len=17 TSval=1682238269 TSecr=3806497967
1712184204.831527948   760 1.407678635    10.10.1.1 → 10.10.1.2    TCP 83 8081 → 36154 [PSH, ACK] Seq=1446 Ack=1463 Win=65152 Len=17 TSval=3806497978 TSecr=1682238269
1712184211.831527948   767 1.417895480    10.10.1.2 → 10.10.1.1    TCP 83 36154 → 8081 [PSH, ACK] Seq=1463 Ack=1463 Win=64256 Len=17 TSval=1682238279 TSecr=3806497978
1712184213.831527948   769 1.418031595    10.10.1.1 → 10.10.1.2    TCP 83 8081 → 36154 [PSH, ACK] Seq=1463 Ack=1480 Win=65152 Len=17 TSval=3806497988 TSecr=1682238279
1712184219.831527948   775 1.428249132    10.10.1.2 → 10.10.1.1    TCP 83 36154 → 8081 [PSH, ACK] Seq=1480 Ack=1480 Win=64256 Len=17 TSval=1682238289 TSecr=3806497988
1712184222.831527948   778 1.428384294    10.10.1.1 → 10.10.1.2    TCP 83 8081 → 36154 [PSH, ACK] Seq=1480 Ack=1497 Win=65152 Len=17 TSval=3806497998 TSecr=1682238289
1712184228.831527948   784 1.438600075    10.10.1.2 → 10.10.1.1    TCP 83 36154 → 8081 [PSH, ACK] Seq=1497 Ack=1497 Win=64256 Len=17 TSval=1682238300 TSecr=3806497998
1712184230.831527948   786 1.438735229    10.10.1.1 → 10.10.1.2    TCP 83 8081 → 36154 [PSH, ACK] Seq=1497 Ack=1514 Win=65152 Len=17 TSval=3806498009 TSecr=1682238300
1712184236.831527948   792 1.448953916    10.10.1.2 → 10.10.1.1    TCP 83 36154 → 8081 [PSH, ACK] Seq=1514 Ack=1514 Win=64256 Len=17 TSval=1682238310 TSecr=3806498009
1712184239.831527948   795 1.449090256    10.10.1.1 → 10.10.1.2    TCP 83 8081 → 36154 [PSH, ACK] Seq=1514 Ack=1531 Win=65152 Len=17 TSval=3806498019 TSecr=1682238310
1712184245.831527948   801 1.459307533    10.10.1.2 → 10.10.1.1    TCP 83 36154 → 8081 [PSH, ACK] Seq=1531 Ack=1531 Win=64256 Len=17 TSval=1682238320 TSecr=3806498019
1712184247.831527948   803 1.459460708    10.10.1.1 → 10.10.1.2    TCP 83 8081 → 36154 [PSH, ACK] Seq=1531 Ack=1548 Win=65152 Len=17 TSval=3806498030 TSecr=1682238320
1712184253.831527948   809 1.469679179    10.10.1.2 → 10.10.1.1    TCP 83 36154 → 8081 [PSH, ACK] Seq=1548 Ack=1548 Win=64256 Len=17 TSval=1682238331 TSecr=3806498030
1712184256.831527948   812 1.469815091    10.10.1.1 → 10.10.1.2    TCP 83 8081 → 36154 [PSH, ACK] Seq=1548 Ack=1565 Win=65152 Len=17 TSval=3806498040 TSecr=1682238331
1712184262.831527948   818 1.480030151    10.10.1.2 → 10.10.1.1    TCP 83 36154 → 8081 [PSH, ACK] Seq=1565 Ack=1565 Win=64256 Len=17 TSval=1682238341 TSecr=3806498040
1712184264.831527948   820 1.480163988    10.10.1.1 → 10.10.1.2    TCP 83 8081 → 36154 [PSH, ACK] Seq=1565 Ack=1582 Win=65152 Len=17 TSval=3806498050 TSecr=1682238341
1712184270.831527948   826 1.490379191    10.10.1.2 → 10.10.1.1    TCP 83 36154 → 8081 [PSH, ACK] Seq=1582 Ack=1582 Win=64256 Len=17 TSval=1682238351 TSecr=3806498050
1712184273.831527948   829 1.490513683    10.10.1.1 → 10.10.1.2    TCP 83 8081 → 36154 [PSH, ACK] Seq=1582 Ack=1599 Win=65152 Len=17 TSval=3806498061 TSecr=1682238351
1712184279.831527948   835 1.500730129    10.10.1.2 → 10.10.1.1    TCP 83 36154 → 8081 [PSH, ACK] Seq=1599 Ack=1599 Win=64256 Len=17 TSval=1682238362 TSecr=3806498061
1712184281.831527948   837 1.500866222    10.10.1.1 → 10.10.1.2    TCP 83 8081 → 36154 [PSH, ACK] Seq=1599 Ack=1616 Win=65152 Len=17 TSval=3806498071 TSecr=1682238362
1712184287.831527948   843 1.511082398    10.10.1.2 → 10.10.1.1    TCP 83 36154 → 8081 [PSH, ACK] Seq=1616 Ack=1616 Win=64256 Len=17 TSval=1682238372 TSecr=3806498071
1712184290.831527948   846 1.511219244    10.10.1.1 → 10.10.1.2    TCP 83 8081 → 36154 [PSH, ACK] Seq=1616 Ack=1633 Win=65152 Len=17 TSval=3806498081 TSecr=1682238372
1712184296.831527948   852 1.521438812    10.10.1.2 → 10.10.1.1    TCP 83 36154 → 8081 [PSH, ACK] Seq=1633 Ack=1633 Win=64256 Len=17 TSval=1682238382 TSecr=3806498081
1712184298.831527948   854 1.521575667    10.10.1.1 → 10.10.1.2    TCP 83 8081 → 36154 [PSH, ACK] Seq=1633 Ack=1650 Win=65152 Len=17 TSval=3806498092 TSecr=1682238382
1712184304.831527948   860 1.531792085    10.10.1.2 → 10.10.1.1    TCP 83 36154 → 8081 [PSH, ACK] Seq=1650 Ack=1650 Win=64256 Len=17 TSval=1682238393 TSecr=3806498092
1712184307.831527948   863 1.531928601    10.10.1.1 → 10.10.1.2    TCP 83 8081 → 36154 [PSH, ACK] Seq=1650 Ack=1667 Win=65152 Len=17 TSval=3806498102 TSecr=1682238393
1712184313.831527948   869 1.542146080    10.10.1.2 → 10.10.1.1    TCP 83 36154 → 8081 [PSH, ACK] Seq=1667 Ack=1667 Win=64256 Len=17 TSval=1682238403 TSecr=3806498102
1712184315.831527948   871 1.542280825    10.10.1.1 → 10.10.1.2    TCP 83 8081 → 36154 [PSH, ACK] Seq=1667 Ack=1684 Win=65152 Len=17 TSval=3806498112 TSecr=1682238403
1712184321.831527948   877 1.552499123    10.10.1.2 → 10.10.1.1    TCP 83 36154 → 8081 [PSH, ACK] Seq=1684 Ack=1684 Win=64256 Len=17 TSval=1682238413 TSecr=3806498112
1712184324.831527948   880 1.552635188    10.10.1.1 → 10.10.1.2    TCP 83 8081 → 36154 [PSH, ACK] Seq=1684 Ack=1701 Win=65152 Len=17 TSval=3806498123 TSecr=1682238413
1712184330.831527948   886 1.562853564    10.10.1.2 → 10.10.1.1    TCP 83 36154 → 8081 [PSH, ACK] Seq=1701 Ack=1701 Win=64256 Len=17 TSval=1682238424 TSecr=3806498123
1712184332.831527948   888 1.562990469    10.10.1.1 → 10.10.1.2    TCP 83 8081 → 36154 [PSH, ACK] Seq=1701 Ack=1718 Win=65152 Len=17 TSval=3806498133 TSecr=1682238424
1712184338.831527948   894 1.573205861    10.10.1.2 → 10.10.1.1    TCP 83 36154 → 8081 [PSH, ACK] Seq=1718 Ack=1718 Win=64256 Len=17 TSval=1682238434 TSecr=3806498133
1712184341.831527948   897 1.573341581    10.10.1.1 → 10.10.1.2    TCP 83 8081 → 36154 [PSH, ACK] Seq=1718 Ack=1735 Win=65152 Len=17 TSval=3806498143 TSecr=1682238434
1712184348.831527948   904 1.583612286    10.10.1.2 → 10.10.1.1    TCP 83 36154 → 8081 [PSH, ACK] Seq=1735 Ack=1735 Win=64256 Len=17 TSval=1682238445 TSecr=3806498143
1712184349.831527948   905 1.583745661    10.10.1.1 → 10.10.1.2    TCP 83 8081 → 36154 [PSH, ACK] Seq=1735 Ack=1752 Win=65152 Len=17 TSval=3806498154 TSecr=1682238445
1712184355.831527948   911 1.593961513    10.10.1.2 → 10.10.1.1    TCP 83 36154 → 8081 [PSH, ACK] Seq=1752 Ack=1752 Win=64256 Len=17 TSval=1682238455 TSecr=3806498154
1712184358.831527948   914 1.594094950    10.10.1.1 → 10.10.1.2    TCP 83 8081 → 36154 [PSH, ACK] Seq=1752 Ack=1769 Win=65152 Len=17 TSval=3806498164 TSecr=1682238455
1712184364.831527948   920 1.604310077    10.10.1.2 → 10.10.1.1    TCP 83 36154 → 8081 [PSH, ACK] Seq=1769 Ack=1769 Win=64256 Len=17 TSval=1682238465 TSecr=3806498164
1712184366.831527948   922 1.604443114    10.10.1.1 → 10.10.1.2    TCP 83 8081 → 36154 [PSH, ACK] Seq=1769 Ack=1786 Win=65152 Len=17 TSval=3806498175 TSecr=1682238465
1712184372.831527948   928 1.614657750    10.10.1.2 → 10.10.1.1    TCP 83 36154 → 8081 [PSH, ACK] Seq=1786 Ack=1786 Win=64256 Len=17 TSval=1682238476 TSecr=3806498175
1712184375.831527948   931 1.614792922    10.10.1.1 → 10.10.1.2    TCP 83 8081 → 36154 [PSH, ACK] Seq=1786 Ack=1803 Win=65152 Len=17 TSval=3806498185 TSecr=1682238476
1712184381.831527948   937 1.625010900    10.10.1.2 → 10.10.1.1    TCP 83 36154 → 8081 [PSH, ACK] Seq=1803 Ack=1803 Win=64256 Len=17 TSval=1682238486 TSecr=3806498185
1712184383.831527948   939 1.625145196    10.10.1.1 → 10.10.1.2    TCP 83 8081 → 36154 [PSH, ACK] Seq=1803 Ack=1820 Win=65152 Len=17 TSval=3806498195 TSecr=1682238486
1712184389.831527948   945 1.635361074    10.10.1.2 → 10.10.1.1    TCP 83 36154 → 8081 [PSH, ACK] Seq=1820 Ack=1820 Win=64256 Len=17 TSval=1682238496 TSecr=3806498195
1712184392.831527948   948 1.635493750    10.10.1.1 → 10.10.1.2    TCP 83 8081 → 36154 [PSH, ACK] Seq=1820 Ack=1837 Win=65152 Len=17 TSval=3806498206 TSecr=1682238496
1712184398.831527948   954 1.645712414    10.10.1.2 → 10.10.1.1    TCP 83 36154 → 8081 [PSH, ACK] Seq=1837 Ack=1837 Win=64256 Len=17 TSval=1682238507 TSecr=3806498206
1712184400.831527948   956 1.645846758    10.10.1.1 → 10.10.1.2    TCP 83 8081 → 36154 [PSH, ACK] Seq=1837 Ack=1854 Win=65152 Len=17 TSval=3806498216 TSecr=1682238507
1712184406.831527948   962 1.656064752    10.10.1.2 → 10.10.1.1    TCP 83 36154 → 8081 [PSH, ACK] Seq=1854 Ack=1854 Win=64256 Len=17 TSval=1682238517 TSecr=3806498216
1712184409.831527948   965 1.656200313    10.10.1.1 → 10.10.1.2    TCP 83 8081 → 36154 [PSH, ACK] Seq=1854 Ack=1871 Win=65152 Len=17 TSval=3806498226 TSecr=1682238517
1712184415.831527948   971 1.666415771    10.10.1.2 → 10.10.1.1    TCP 83 36154 → 8081 [PSH, ACK] Seq=1871 Ack=1871 Win=64256 Len=17 TSval=1682238527 TSecr=3806498226
1712184417.831527948   973 1.666551367    10.10.1.1 → 10.10.1.2    TCP 83 8081 → 36154 [PSH, ACK] Seq=1871 Ack=1888 Win=65152 Len=17 TSval=3806498237 TSecr=1682238527
1712184423.831527948   979 1.676769636    10.10.1.2 → 10.10.1.1    TCP 83 36154 → 8081 [PSH, ACK] Seq=1888 Ack=1888 Win=64256 Len=17 TSval=1682238538 TSecr=3806498237
1712184426.831527948   982 1.676905661    10.10.1.1 → 10.10.1.2    TCP 83 8081 → 36154 [PSH, ACK] Seq=1888 Ack=1905 Win=65152 Len=17 TSval=3806498247 TSecr=1682238538
1712184432.831527948   988 1.687123107    10.10.1.2 → 10.10.1.1    TCP 83 36154 → 8081 [PSH, ACK] Seq=1905 Ack=1905 Win=64256 Len=17 TSval=1682238548 TSecr=3806498247
1712184434.831527948   990 1.687258554    10.10.1.1 → 10.10.1.2    TCP 83 8081 → 36154 [PSH, ACK] Seq=1905 Ack=1922 Win=65152 Len=17 TSval=3806498257 TSecr=1682238548
1712184440.831527948   996 1.697478973    10.10.1.2 → 10.10.1.1    TCP 83 36154 → 8081 [PSH, ACK] Seq=1922 Ack=1922 Win=64256 Len=17 TSval=1682238558 TSecr=3806498257
1712184443.831527948   999 1.697665153    10.10.1.1 → 10.10.1.2    TCP 83 8081 → 36154 [PSH, ACK] Seq=1922 Ack=1939 Win=65152 Len=17 TSval=3806498268 TSecr=1682238558
1712184449.831527948  1005 1.707880705    10.10.1.2 → 10.10.1.1    TCP 83 36154 → 8081 [PSH, ACK] Seq=1939 Ack=1939 Win=64256 Len=17 TSval=1682238569 TSecr=3806498268
1712184451.831527948  1007 1.708016983    10.10.1.1 → 10.10.1.2    TCP 83 8081 → 36154 [PSH, ACK] Seq=1939 Ack=1956 Win=65152 Len=17 TSval=3806498278 TSecr=1682238569
1712184457.831527948  1013 1.718236155    10.10.1.2 → 10.10.1.1    TCP 83 36154 → 8081 [PSH, ACK] Seq=1956 Ack=1956 Win=64256 Len=17 TSval=1682238579 TSecr=3806498278
1712184460.831527948  1016 1.718371226    10.10.1.1 → 10.10.1.2    TCP 83 8081 → 36154 [PSH, ACK] Seq=1956 Ack=1973 Win=65152 Len=17 TSval=3806498288 TSecr=1682238579
1712184466.831527948  1022 1.728561319    10.10.1.2 → 10.10.1.1    TCP 83 36154 → 8081 [PSH, ACK] Seq=1973 Ack=1973 Win=64256 Len=17 TSval=1682238590 TSecr=3806498288
1712184468.831527948  1024 1.728696509    10.10.1.1 → 10.10.1.2    TCP 83 8081 → 36154 [PSH, ACK] Seq=1973 Ack=1990 Win=65152 Len=17 TSval=3806498299 TSecr=1682238590
1712184474.831527948  1030 1.738911228    10.10.1.2 → 10.10.1.1    TCP 83 36154 → 8081 [PSH, ACK] Seq=1990 Ack=1990 Win=64256 Len=17 TSval=1682238600 TSecr=3806498299
1712184477.831527948  1033 1.739046053    10.10.1.1 → 10.10.1.2    TCP 83 8081 → 36154 [PSH, ACK] Seq=1990 Ack=2007 Win=65152 Len=17 TSval=3806498309 TSecr=1682238600
1712184483.831527948  1039 1.749263266    10.10.1.2 → 10.10.1.1    TCP 83 36154 → 8081 [PSH, ACK] Seq=2007 Ack=2007 Win=64256 Len=17 TSval=1682238610 TSecr=3806498309
1712184485.831527948  1041 1.749397507    10.10.1.1 → 10.10.1.2    TCP 83 8081 → 36154 [PSH, ACK] Seq=2007 Ack=2024 Win=65152 Len=17 TSval=3806498320 TSecr=1682238610
1712184491.831527948  1047 1.759614880    10.10.1.2 → 10.10.1.1    TCP 83 36154 → 8081 [PSH, ACK] Seq=2024 Ack=2024 Win=64256 Len=17 TSval=1682238621 TSecr=3806498320
1712184494.831527948  1050 1.759751161    10.10.1.1 → 10.10.1.2    TCP 83 8081 → 36154 [PSH, ACK] Seq=2024 Ack=2041 Win=65152 Len=17 TSval=3806498330 TSecr=1682238621
1712184500.831527948  1056 1.769968961    10.10.1.2 → 10.10.1.1    TCP 83 36154 → 8081 [PSH, ACK] Seq=2041 Ack=2041 Win=64256 Len=17 TSval=1682238631 TSecr=3806498330
