1711547935.194610357    34 0.545027757    10.10.1.2 → 10.10.1.1    TCP 83 44652 → 8081 [PSH, ACK] Seq=1 Ack=1 Win=64256 Len=17 TSval=1046693862 TSecr=3170953298
1711547938.194610357    37 0.545245081    10.10.1.1 → 10.10.1.2    TCP 83 8081 → 44652 [PSH, ACK] Seq=1 Ack=18 Win=65152 Len=17 TSval=3170953572 TSecr=1046693862
1711547945.194610357    44 0.555775532    10.10.1.2 → 10.10.1.1    TCP 83 44652 → 8081 [PSH, ACK] Seq=18 Ack=18 Win=64256 Len=17 TSval=1046693873 TSecr=3170953572
1711547948.194610357    47 0.555832323    10.10.1.1 → 10.10.1.2    TCP 83 8081 → 44652 [PSH, ACK] Seq=18 Ack=35 Win=65152 Len=17 TSval=3170953583 TSecr=1046693873
1711547954.194610357    53 0.575648686    10.10.1.2 → 10.10.1.1    TCP 83 44652 → 8081 [PSH, ACK] Seq=35 Ack=35 Win=64256 Len=17 TSval=1046693893 TSecr=3170953583
1711547956.194610357    55 0.575707834    10.10.1.1 → 10.10.1.2    TCP 83 8081 → 44652 [PSH, ACK] Seq=35 Ack=52 Win=65152 Len=17 TSval=3170953603 TSecr=1046693893
1711547962.194610357    61 0.585538755    10.10.1.2 → 10.10.1.1    TCP 83 44652 → 8081 [PSH, ACK] Seq=52 Ack=52 Win=64256 Len=17 TSval=1046693903 TSecr=3170953603
1711547964.194610357    63 0.585586883    10.10.1.1 → 10.10.1.2    TCP 83 8081 → 44652 [PSH, ACK] Seq=52 Ack=69 Win=65152 Len=17 TSval=3170953613 TSecr=1046693903
1711547971.194610357    70 0.586201397    10.10.1.2 → 10.10.1.1    TCP 83 44652 → 8081 [PSH, ACK] Seq=69 Ack=69 Win=64256 Len=17 TSval=1046693903 TSecr=3170953613
1711547973.194610357    72 0.586243208    10.10.1.1 → 10.10.1.2    TCP 83 8081 → 44652 [PSH, ACK] Seq=69 Ack=86 Win=65152 Len=17 TSval=3170953613 TSecr=1046693903
1711547979.194610357    78 0.604053790    10.10.1.2 → 10.10.1.1    TCP 83 44652 → 8081 [PSH, ACK] Seq=86 Ack=86 Win=64256 Len=17 TSval=1046693921 TSecr=3170953613
1711547981.194610357    80 0.604107521    10.10.1.1 → 10.10.1.2    TCP 83 8081 → 44652 [PSH, ACK] Seq=86 Ack=103 Win=65152 Len=17 TSval=3170953631 TSecr=1046693921
1711547988.194610357    87 0.630445280    10.10.1.2 → 10.10.1.1    TCP 83 44652 → 8081 [PSH, ACK] Seq=103 Ack=103 Win=64256 Len=17 TSval=1046693948 TSecr=3170953631
1711547990.194610357    89 0.630515498    10.10.1.1 → 10.10.1.2    TCP 83 8081 → 44652 [PSH, ACK] Seq=103 Ack=120 Win=65152 Len=17 TSval=3170953658 TSecr=1046693948
1711547996.194610357    95 0.633918761    10.10.1.2 → 10.10.1.1    TCP 83 44652 → 8081 [PSH, ACK] Seq=120 Ack=120 Win=64256 Len=17 TSval=1046693951 TSecr=3170953658
1711547998.194610357    97 0.633964692    10.10.1.1 → 10.10.1.2    TCP 83 8081 → 44652 [PSH, ACK] Seq=120 Ack=137 Win=65152 Len=17 TSval=3170953661 TSecr=1046693951
1711548005.194610357   104 0.648560835    10.10.1.2 → 10.10.1.1    TCP 83 44652 → 8081 [PSH, ACK] Seq=137 Ack=137 Win=64256 Len=17 TSval=1046693966 TSecr=3170953661
1711548007.194610357   106 0.648619832    10.10.1.1 → 10.10.1.2    TCP 83 8081 → 44652 [PSH, ACK] Seq=137 Ack=154 Win=65152 Len=17 TSval=3170953676 TSecr=1046693966
1711548013.194610357   112 0.669034418    10.10.1.2 → 10.10.1.1    TCP 83 44652 → 8081 [PSH, ACK] Seq=154 Ack=154 Win=64256 Len=17 TSval=1046693986 TSecr=3170953676
1711548016.194610357   115 0.669093023    10.10.1.1 → 10.10.1.2    TCP 83 8081 → 44652 [PSH, ACK] Seq=154 Ack=171 Win=65152 Len=17 TSval=3170953696 TSecr=1046693986
1711548022.194610357   121 0.674613923    10.10.1.2 → 10.10.1.1    TCP 83 44652 → 8081 [PSH, ACK] Seq=171 Ack=171 Win=64256 Len=17 TSval=1046693992 TSecr=3170953696
1711548024.194610357   123 0.674664825    10.10.1.1 → 10.10.1.2    TCP 83 8081 → 44652 [PSH, ACK] Seq=171 Ack=188 Win=65152 Len=17 TSval=3170953702 TSecr=1046693992
1711548030.194610357   129 0.677622814    10.10.1.2 → 10.10.1.1    TCP 83 44652 → 8081 [PSH, ACK] Seq=188 Ack=188 Win=64256 Len=17 TSval=1046693995 TSecr=3170953702
1711548032.194610357   131 0.677660689    10.10.1.1 → 10.10.1.2    TCP 83 8081 → 44652 [PSH, ACK] Seq=188 Ack=205 Win=65152 Len=17 TSval=3170953705 TSecr=1046693995
1711548039.194610357   138 0.680442844    10.10.1.2 → 10.10.1.1    TCP 83 44652 → 8081 [PSH, ACK] Seq=205 Ack=205 Win=64256 Len=17 TSval=1046693998 TSecr=3170953705
1711548041.194610357   140 0.680496214    10.10.1.1 → 10.10.1.2    TCP 83 8081 → 44652 [PSH, ACK] Seq=205 Ack=222 Win=65152 Len=17 TSval=3170953708 TSecr=1046693998
1711548047.194610357   146 0.704804991    10.10.1.2 → 10.10.1.1    TCP 83 44652 → 8081 [PSH, ACK] Seq=222 Ack=222 Win=64256 Len=17 TSval=1046694022 TSecr=3170953708
1711548049.194610357   148 0.704856401    10.10.1.1 → 10.10.1.2    TCP 83 8081 → 44652 [PSH, ACK] Seq=222 Ack=239 Win=65152 Len=17 TSval=3170953732 TSecr=1046694022
1711548056.194610357   155 0.716837080    10.10.1.2 → 10.10.1.1    TCP 83 44652 → 8081 [PSH, ACK] Seq=239 Ack=239 Win=64256 Len=17 TSval=1046694034 TSecr=3170953732
1711548058.194610357   157 0.716899117    10.10.1.1 → 10.10.1.2    TCP 83 8081 → 44652 [PSH, ACK] Seq=239 Ack=256 Win=65152 Len=17 TSval=3170953744 TSecr=1046694034
1711548064.194610357   163 0.718213816    10.10.1.2 → 10.10.1.1    TCP 83 44652 → 8081 [PSH, ACK] Seq=256 Ack=256 Win=64256 Len=17 TSval=1046694035 TSecr=3170953744
1711548066.194610357   165 0.718251657    10.10.1.1 → 10.10.1.2    TCP 83 8081 → 44652 [PSH, ACK] Seq=256 Ack=273 Win=65152 Len=17 TSval=3170953745 TSecr=1046694035
1711548073.194610357   172 0.730129893    10.10.1.2 → 10.10.1.1    TCP 83 44652 → 8081 [PSH, ACK] Seq=273 Ack=273 Win=64256 Len=17 TSval=1046694047 TSecr=3170953745
1711548075.194610357   174 0.730184677    10.10.1.1 → 10.10.1.2    TCP 83 8081 → 44652 [PSH, ACK] Seq=273 Ack=290 Win=65152 Len=17 TSval=3170953757 TSecr=1046694047
1711548081.194610357   180 0.731881973    10.10.1.2 → 10.10.1.1    TCP 83 44652 → 8081 [PSH, ACK] Seq=290 Ack=290 Win=64256 Len=17 TSval=1046694049 TSecr=3170953757
1711548084.194610357   183 0.731942168    10.10.1.1 → 10.10.1.2    TCP 83 8081 → 44652 [PSH, ACK] Seq=290 Ack=307 Win=65152 Len=17 TSval=3170953759 TSecr=1046694049
1711548090.194610357   189 0.747809337    10.10.1.2 → 10.10.1.1    TCP 83 44652 → 8081 [PSH, ACK] Seq=307 Ack=307 Win=64256 Len=17 TSval=1046694065 TSecr=3170953759
1711548092.194610357   191 0.747871202    10.10.1.1 → 10.10.1.2    TCP 83 8081 → 44652 [PSH, ACK] Seq=307 Ack=324 Win=65152 Len=17 TSval=3170953775 TSecr=1046694065
1711548098.194610357   197 0.756129064    10.10.1.2 → 10.10.1.1    TCP 83 44652 → 8081 [PSH, ACK] Seq=324 Ack=324 Win=64256 Len=17 TSval=1046694073 TSecr=3170953775
1711548100.194610357   199 0.756176612    10.10.1.1 → 10.10.1.2    TCP 83 8081 → 44652 [PSH, ACK] Seq=324 Ack=341 Win=65152 Len=17 TSval=3170953783 TSecr=1046694073
1711548107.194610357   206 0.757690967    10.10.1.2 → 10.10.1.1    TCP 83 44652 → 8081 [PSH, ACK] Seq=341 Ack=341 Win=64256 Len=17 TSval=1046694075 TSecr=3170953783
1711548109.194610357   208 0.757728536    10.10.1.1 → 10.10.1.2    TCP 83 8081 → 44652 [PSH, ACK] Seq=341 Ack=358 Win=65152 Len=17 TSval=3170953785 TSecr=1046694075
1711548115.194610357   214 0.764823326    10.10.1.2 → 10.10.1.1    TCP 83 44652 → 8081 [PSH, ACK] Seq=358 Ack=358 Win=64256 Len=17 TSval=1046694082 TSecr=3170953785
1711548117.194610357   216 0.764877767    10.10.1.1 → 10.10.1.2    TCP 83 8081 → 44652 [PSH, ACK] Seq=358 Ack=375 Win=65152 Len=17 TSval=3170953792 TSecr=1046694082
1711548124.194610357   223 0.771428324    10.10.1.2 → 10.10.1.1    TCP 83 44652 → 8081 [PSH, ACK] Seq=375 Ack=375 Win=64256 Len=17 TSval=1046694089 TSecr=3170953792
1711548126.194610357   225 0.771481424    10.10.1.1 → 10.10.1.2    TCP 83 8081 → 44652 [PSH, ACK] Seq=375 Ack=392 Win=65152 Len=17 TSval=3170953799 TSecr=1046694089
1711548132.194610357   231 0.779932041    10.10.1.2 → 10.10.1.1    TCP 83 44652 → 8081 [PSH, ACK] Seq=392 Ack=392 Win=64256 Len=17 TSval=1046694097 TSecr=3170953799
1711548134.194610357   233 0.779985673    10.10.1.1 → 10.10.1.2    TCP 83 8081 → 44652 [PSH, ACK] Seq=392 Ack=409 Win=65152 Len=17 TSval=3170953807 TSecr=1046694097
1711548141.194610357   240 0.793033410    10.10.1.2 → 10.10.1.1    TCP 83 44652 → 8081 [PSH, ACK] Seq=409 Ack=409 Win=64256 Len=17 TSval=1046694110 TSecr=3170953807
1711548143.194610357   242 0.793085170    10.10.1.1 → 10.10.1.2    TCP 83 8081 → 44652 [PSH, ACK] Seq=409 Ack=426 Win=65152 Len=17 TSval=3170953820 TSecr=1046694110
1711548149.194610357   248 0.795901802    10.10.1.2 → 10.10.1.1    TCP 83 44652 → 8081 [PSH, ACK] Seq=426 Ack=426 Win=64256 Len=17 TSval=1046694113 TSecr=3170953820
1711548152.194610357   251 0.795964783    10.10.1.1 → 10.10.1.2    TCP 83 8081 → 44652 [PSH, ACK] Seq=426 Ack=443 Win=65152 Len=17 TSval=3170953823 TSecr=1046694113
1711548158.194610357   257 0.802761381    10.10.1.2 → 10.10.1.1    TCP 83 44652 → 8081 [PSH, ACK] Seq=443 Ack=443 Win=64256 Len=17 TSval=1046694120 TSecr=3170953823
1711548160.194610357   259 0.802819609    10.10.1.1 → 10.10.1.2    TCP 83 8081 → 44652 [PSH, ACK] Seq=443 Ack=460 Win=65152 Len=17 TSval=3170953830 TSecr=1046694120
1711548166.194610357   265 0.804878353    10.10.1.2 → 10.10.1.1    TCP 83 44652 → 8081 [PSH, ACK] Seq=460 Ack=460 Win=64256 Len=17 TSval=1046694122 TSecr=3170953830
1711548168.194610357   267 0.804916174    10.10.1.1 → 10.10.1.2    TCP 83 8081 → 44652 [PSH, ACK] Seq=460 Ack=477 Win=65152 Len=17 TSval=3170953832 TSecr=1046694122
1711548175.194610357   274 0.820593533    10.10.1.2 → 10.10.1.1    TCP 83 44652 → 8081 [PSH, ACK] Seq=477 Ack=477 Win=64256 Len=17 TSval=1046694138 TSecr=3170953832
1711548177.194610357   276 0.820645228    10.10.1.1 → 10.10.1.2    TCP 83 8081 → 44652 [PSH, ACK] Seq=477 Ack=494 Win=65152 Len=17 TSval=3170953848 TSecr=1046694138
1711548183.194610357   282 0.822085111    10.10.1.2 → 10.10.1.1    TCP 83 44652 → 8081 [PSH, ACK] Seq=494 Ack=494 Win=64256 Len=17 TSval=1046694139 TSecr=3170953848
1711548185.194610357   284 0.822122470    10.10.1.1 → 10.10.1.2    TCP 83 8081 → 44652 [PSH, ACK] Seq=494 Ack=511 Win=65152 Len=17 TSval=3170953849 TSecr=1046694139
1711548192.194610357   291 0.828012846    10.10.1.2 → 10.10.1.1    TCP 83 44652 → 8081 [PSH, ACK] Seq=511 Ack=511 Win=64256 Len=17 TSval=1046694145 TSecr=3170953849
1711548194.194610357   293 0.828064007    10.10.1.1 → 10.10.1.2    TCP 83 8081 → 44652 [PSH, ACK] Seq=511 Ack=528 Win=65152 Len=17 TSval=3170953855 TSecr=1046694145
1711548200.194610357   299 0.840361366    10.10.1.2 → 10.10.1.1    TCP 83 44652 → 8081 [PSH, ACK] Seq=528 Ack=528 Win=64256 Len=17 TSval=1046694158 TSecr=3170953855
1711548203.194610357   302 0.840425174    10.10.1.1 → 10.10.1.2    TCP 83 8081 → 44652 [PSH, ACK] Seq=528 Ack=545 Win=65152 Len=17 TSval=3170953868 TSecr=1046694158
1711548209.194610357   308 0.855080605    10.10.1.2 → 10.10.1.1    TCP 83 44652 → 8081 [PSH, ACK] Seq=545 Ack=545 Win=64256 Len=17 TSval=1046694172 TSecr=3170953868
1711548211.194610357   310 0.855160556    10.10.1.1 → 10.10.1.2    TCP 83 8081 → 44652 [PSH, ACK] Seq=545 Ack=562 Win=65152 Len=17 TSval=3170953882 TSecr=1046694172
1711548217.194610357   316 0.858853869    10.10.1.2 → 10.10.1.1    TCP 83 44652 → 8081 [PSH, ACK] Seq=562 Ack=562 Win=64256 Len=17 TSval=1046694176 TSecr=3170953882
1711548219.194610357   318 0.858893358    10.10.1.1 → 10.10.1.2    TCP 83 8081 → 44652 [PSH, ACK] Seq=562 Ack=579 Win=65152 Len=17 TSval=3170953886 TSecr=1046694176
1711548226.194610357   325 0.862957091    10.10.1.2 → 10.10.1.1    TCP 83 44652 → 8081 [PSH, ACK] Seq=579 Ack=579 Win=64256 Len=17 TSval=1046694180 TSecr=3170953886
1711548228.194610357   327 0.863011436    10.10.1.1 → 10.10.1.2    TCP 83 8081 → 44652 [PSH, ACK] Seq=579 Ack=596 Win=65152 Len=17 TSval=3170953890 TSecr=1046694180
1711548234.194610357   333 0.879745856    10.10.1.2 → 10.10.1.1    TCP 83 44652 → 8081 [PSH, ACK] Seq=596 Ack=596 Win=64256 Len=17 TSval=1046694197 TSecr=3170953890
1711548236.194610357   335 0.879802070    10.10.1.1 → 10.10.1.2    TCP 83 8081 → 44652 [PSH, ACK] Seq=596 Ack=613 Win=65152 Len=17 TSval=3170953907 TSecr=1046694197
1711548243.194610357   342 0.881312047    10.10.1.2 → 10.10.1.1    TCP 83 44652 → 8081 [PSH, ACK] Seq=613 Ack=613 Win=64256 Len=17 TSval=1046694199 TSecr=3170953907
1711548245.194610357   344 0.881349655    10.10.1.1 → 10.10.1.2    TCP 83 8081 → 44652 [PSH, ACK] Seq=613 Ack=630 Win=65152 Len=17 TSval=3170953909 TSecr=1046694199
1711548251.194610357   350 0.884383789    10.10.1.2 → 10.10.1.1    TCP 83 44652 → 8081 [PSH, ACK] Seq=630 Ack=630 Win=64256 Len=17 TSval=1046694202 TSecr=3170953909
1711548253.194610357   352 0.884433799    10.10.1.1 → 10.10.1.2    TCP 83 8081 → 44652 [PSH, ACK] Seq=630 Ack=647 Win=65152 Len=17 TSval=3170953912 TSecr=1046694202
1711548260.194610357   359 0.885496839    10.10.1.2 → 10.10.1.1    TCP 83 44652 → 8081 [PSH, ACK] Seq=647 Ack=647 Win=64256 Len=17 TSval=1046694203 TSecr=3170953912
1711548262.194610357   361 0.885541032    10.10.1.1 → 10.10.1.2    TCP 83 8081 → 44652 [PSH, ACK] Seq=647 Ack=664 Win=65152 Len=17 TSval=3170953913 TSecr=1046694203
1711548268.194610357   367 0.907782345    10.10.1.2 → 10.10.1.1    TCP 83 44652 → 8081 [PSH, ACK] Seq=664 Ack=664 Win=64256 Len=17 TSval=1046694225 TSecr=3170953913
1711548270.194610357   369 0.907846646    10.10.1.1 → 10.10.1.2    TCP 83 8081 → 44652 [PSH, ACK] Seq=664 Ack=681 Win=65152 Len=17 TSval=3170953935 TSecr=1046694225
1711548277.194610357   376 0.909258736    10.10.1.2 → 10.10.1.1    TCP 83 44652 → 8081 [PSH, ACK] Seq=681 Ack=681 Win=64256 Len=17 TSval=1046694227 TSecr=3170953935
1711548279.194610357   378 0.909296293    10.10.1.1 → 10.10.1.2    TCP 83 8081 → 44652 [PSH, ACK] Seq=681 Ack=698 Win=65152 Len=17 TSval=3170953936 TSecr=1046694227
1711548285.194610357   384 0.916413748    10.10.1.2 → 10.10.1.1    TCP 83 44652 → 8081 [PSH, ACK] Seq=698 Ack=698 Win=64256 Len=17 TSval=1046694234 TSecr=3170953936
1711548287.194610357   386 0.916468668    10.10.1.1 → 10.10.1.2    TCP 83 8081 → 44652 [PSH, ACK] Seq=698 Ack=715 Win=65152 Len=17 TSval=3170953944 TSecr=1046694234
1711548294.194610357   393 0.918066669    10.10.1.2 → 10.10.1.1    TCP 83 44652 → 8081 [PSH, ACK] Seq=715 Ack=715 Win=64256 Len=17 TSval=1046694235 TSecr=3170953944
1711548296.194610357   395 0.918101826    10.10.1.1 → 10.10.1.2    TCP 83 8081 → 44652 [PSH, ACK] Seq=715 Ack=732 Win=65152 Len=17 TSval=3170953945 TSecr=1046694235
1711548302.194610357   401 0.922528348    10.10.1.2 → 10.10.1.1    TCP 83 44652 → 8081 [PSH, ACK] Seq=732 Ack=732 Win=64256 Len=17 TSval=1046694240 TSecr=3170953945
1711548304.194610357   403 0.922579379    10.10.1.1 → 10.10.1.2    TCP 83 8081 → 44652 [PSH, ACK] Seq=732 Ack=749 Win=65152 Len=17 TSval=3170953950 TSecr=1046694240
1711548311.194610357   410 0.928043828    10.10.1.2 → 10.10.1.1    TCP 83 44652 → 8081 [PSH, ACK] Seq=749 Ack=749 Win=64256 Len=17 TSval=1046694245 TSecr=3170953950
1711548313.194610357   412 0.928094498    10.10.1.1 → 10.10.1.2    TCP 83 8081 → 44652 [PSH, ACK] Seq=749 Ack=766 Win=65152 Len=17 TSval=3170953955 TSecr=1046694245
1711548319.194610357   418 0.945813615    10.10.1.2 → 10.10.1.1    TCP 83 44652 → 8081 [PSH, ACK] Seq=766 Ack=766 Win=64256 Len=17 TSval=1046694263 TSecr=3170953955
1711548321.194610357   420 0.945870026    10.10.1.1 → 10.10.1.2    TCP 83 8081 → 44652 [PSH, ACK] Seq=766 Ack=783 Win=65152 Len=17 TSval=3170953973 TSecr=1046694263
1711548328.194610357   427 0.952133102    10.10.1.2 → 10.10.1.1    TCP 83 44652 → 8081 [PSH, ACK] Seq=783 Ack=783 Win=64256 Len=17 TSval=1046694269 TSecr=3170953973
1711548330.194610357   429 0.952192246    10.10.1.1 → 10.10.1.2    TCP 83 8081 → 44652 [PSH, ACK] Seq=783 Ack=800 Win=65152 Len=17 TSval=3170953979 TSecr=1046694269
1711548336.194610357   435 0.953422931    10.10.1.2 → 10.10.1.1    TCP 83 44652 → 8081 [PSH, ACK] Seq=800 Ack=800 Win=64256 Len=17 TSval=1046694271 TSecr=3170953979
1711548338.194610357   437 0.953460875    10.10.1.1 → 10.10.1.2    TCP 83 8081 → 44652 [PSH, ACK] Seq=800 Ack=817 Win=65152 Len=17 TSval=3170953981 TSecr=1046694271
1711548345.194610357   444 0.988575881    10.10.1.2 → 10.10.1.1    TCP 83 44652 → 8081 [PSH, ACK] Seq=817 Ack=817 Win=64256 Len=17 TSval=1046694306 TSecr=3170953981
1711548347.194610357   446 0.988632846    10.10.1.1 → 10.10.1.2    TCP 83 8081 → 44652 [PSH, ACK] Seq=817 Ack=834 Win=65152 Len=17 TSval=3170954016 TSecr=1046694306
1711548353.194610357   452 0.991652469    10.10.1.2 → 10.10.1.1    TCP 83 44652 → 8081 [PSH, ACK] Seq=834 Ack=834 Win=64256 Len=17 TSval=1046694309 TSecr=3170954016
1711548355.194610357   454 0.991700075    10.10.1.1 → 10.10.1.2    TCP 83 8081 → 44652 [PSH, ACK] Seq=834 Ack=851 Win=65152 Len=17 TSval=3170954019 TSecr=1046694309
1711548362.194610357   461 1.002552760    10.10.1.2 → 10.10.1.1    TCP 83 44652 → 8081 [PSH, ACK] Seq=851 Ack=851 Win=64256 Len=17 TSval=1046694320 TSecr=3170954019
1711548364.194610357   463 1.002604805    10.10.1.1 → 10.10.1.2    TCP 83 8081 → 44652 [PSH, ACK] Seq=851 Ack=868 Win=65152 Len=17 TSval=3170954030 TSecr=1046694320
1711548370.194610357   469 1.003777108    10.10.1.2 → 10.10.1.1    TCP 83 44652 → 8081 [PSH, ACK] Seq=868 Ack=868 Win=64256 Len=17 TSval=1046694321 TSecr=3170954030
1711548372.194610357   471 1.003814189    10.10.1.1 → 10.10.1.2    TCP 83 8081 → 44652 [PSH, ACK] Seq=868 Ack=885 Win=65152 Len=17 TSval=3170954031 TSecr=1046694321
1711548379.194610357   478 1.017791708    10.10.1.2 → 10.10.1.1    TCP 83 44652 → 8081 [PSH, ACK] Seq=885 Ack=885 Win=64256 Len=17 TSval=1046694335 TSecr=3170954031
1711548381.194610357   480 1.017841638    10.10.1.1 → 10.10.1.2    TCP 83 8081 → 44652 [PSH, ACK] Seq=885 Ack=902 Win=65152 Len=17 TSval=3170954045 TSecr=1046694335
1711548387.194610357   486 1.019381263    10.10.1.2 → 10.10.1.1    TCP 83 44652 → 8081 [PSH, ACK] Seq=902 Ack=902 Win=64256 Len=17 TSval=1046694337 TSecr=3170954045
1711548389.194610357   488 1.019430128    10.10.1.1 → 10.10.1.2    TCP 83 8081 → 44652 [PSH, ACK] Seq=902 Ack=919 Win=65152 Len=17 TSval=3170954047 TSecr=1046694337
1711548396.194610357   495 1.030370939    10.10.1.2 → 10.10.1.1    TCP 83 44652 → 8081 [PSH, ACK] Seq=919 Ack=919 Win=64256 Len=17 TSval=1046694348 TSecr=3170954047
1711548398.194610357   497 1.030422339    10.10.1.1 → 10.10.1.2    TCP 83 8081 → 44652 [PSH, ACK] Seq=919 Ack=936 Win=65152 Len=17 TSval=3170954058 TSecr=1046694348
1711548404.194610357   503 1.036988715    10.10.1.2 → 10.10.1.1    TCP 83 44652 → 8081 [PSH, ACK] Seq=936 Ack=936 Win=64256 Len=17 TSval=1046694354 TSecr=3170954058
1711548406.194610357   505 1.037035169    10.10.1.1 → 10.10.1.2    TCP 83 8081 → 44652 [PSH, ACK] Seq=936 Ack=953 Win=65152 Len=17 TSval=3170954064 TSecr=1046694354
1711548413.194610357   512 1.041691314    10.10.1.2 → 10.10.1.1    TCP 83 44652 → 8081 [PSH, ACK] Seq=953 Ack=953 Win=64256 Len=17 TSval=1046694359 TSecr=3170954064
1711548415.194610357   514 1.041784251    10.10.1.1 → 10.10.1.2    TCP 83 8081 → 44652 [PSH, ACK] Seq=953 Ack=970 Win=65152 Len=17 TSval=3170954069 TSecr=1046694359
1711548421.194610357   520 1.043508595    10.10.1.2 → 10.10.1.1    TCP 83 44652 → 8081 [PSH, ACK] Seq=970 Ack=970 Win=64256 Len=17 TSval=1046694361 TSecr=3170954069
1711548423.194610357   522 1.043562478    10.10.1.1 → 10.10.1.2    TCP 83 8081 → 44652 [PSH, ACK] Seq=970 Ack=987 Win=65152 Len=17 TSval=3170954071 TSecr=1046694361
1711548430.194610357   529 1.054104287    10.10.1.2 → 10.10.1.1    TCP 83 44652 → 8081 [PSH, ACK] Seq=987 Ack=987 Win=64256 Len=17 TSval=1046694371 TSecr=3170954071
1711548432.194610357   531 1.054149207    10.10.1.1 → 10.10.1.2    TCP 83 8081 → 44652 [PSH, ACK] Seq=987 Ack=1004 Win=65152 Len=17 TSval=3170954081 TSecr=1046694371
1711548438.194610357   537 1.055935717    10.10.1.2 → 10.10.1.1    TCP 83 44652 → 8081 [PSH, ACK] Seq=1004 Ack=1004 Win=64256 Len=17 TSval=1046694373 TSecr=3170954081
1711548440.194610357   539 1.055988360    10.10.1.1 → 10.10.1.2    TCP 83 8081 → 44652 [PSH, ACK] Seq=1004 Ack=1021 Win=65152 Len=17 TSval=3170954083 TSecr=1046694373
1711548447.194610357   546 1.059222802    10.10.1.2 → 10.10.1.1    TCP 83 44652 → 8081 [PSH, ACK] Seq=1021 Ack=1021 Win=64256 Len=17 TSval=1046694376 TSecr=3170954083
1711548449.194610357   548 1.059276046    10.10.1.1 → 10.10.1.2    TCP 83 8081 → 44652 [PSH, ACK] Seq=1021 Ack=1038 Win=65152 Len=17 TSval=3170954086 TSecr=1046694376
1711548455.194610357   554 1.060309147    10.10.1.2 → 10.10.1.1    TCP 83 44652 → 8081 [PSH, ACK] Seq=1038 Ack=1038 Win=64256 Len=17 TSval=1046694378 TSecr=3170954086
1711548457.194610357   556 1.060346354    10.10.1.1 → 10.10.1.2    TCP 83 8081 → 44652 [PSH, ACK] Seq=1038 Ack=1055 Win=65152 Len=17 TSval=3170954088 TSecr=1046694378
1711548464.194610357   563 1.079665100    10.10.1.2 → 10.10.1.1    TCP 83 44652 → 8081 [PSH, ACK] Seq=1055 Ack=1055 Win=64256 Len=17 TSval=1046694397 TSecr=3170954088
1711548466.194610357   565 1.079720785    10.10.1.1 → 10.10.1.2    TCP 83 8081 → 44652 [PSH, ACK] Seq=1055 Ack=1072 Win=65152 Len=17 TSval=3170954107 TSecr=1046694397
1711548472.194610357   571 1.080182918    10.10.1.2 → 10.10.1.1    TCP 83 44652 → 8081 [PSH, ACK] Seq=1072 Ack=1072 Win=64256 Len=17 TSval=1046694397 TSecr=3170954107
1711548474.194610357   573 1.080224293    10.10.1.1 → 10.10.1.2    TCP 83 8081 → 44652 [PSH, ACK] Seq=1072 Ack=1089 Win=65152 Len=17 TSval=3170954107 TSecr=1046694397
1711548481.194610357   580 1.085182127    10.10.1.2 → 10.10.1.1    TCP 83 44652 → 8081 [PSH, ACK] Seq=1089 Ack=1089 Win=64256 Len=17 TSval=1046694402 TSecr=3170954107
1711548483.194610357   582 1.085234881    10.10.1.1 → 10.10.1.2    TCP 83 8081 → 44652 [PSH, ACK] Seq=1089 Ack=1106 Win=65152 Len=17 TSval=3170954112 TSecr=1046694402
1711548489.194610357   588 1.087322999    10.10.1.2 → 10.10.1.1    TCP 83 44652 → 8081 [PSH, ACK] Seq=1106 Ack=1106 Win=64256 Len=17 TSval=1046694405 TSecr=3170954112
1711548491.194610357   590 1.087372798    10.10.1.1 → 10.10.1.2    TCP 83 8081 → 44652 [PSH, ACK] Seq=1106 Ack=1123 Win=65152 Len=17 TSval=3170954115 TSecr=1046694405
1711548498.194610357   597 1.105805982    10.10.1.2 → 10.10.1.1    TCP 83 44652 → 8081 [PSH, ACK] Seq=1123 Ack=1123 Win=64256 Len=17 TSval=1046694423 TSecr=3170954115
1711548500.194610357   599 1.105873595    10.10.1.1 → 10.10.1.2    TCP 83 8081 → 44652 [PSH, ACK] Seq=1123 Ack=1140 Win=65152 Len=17 TSval=3170954133 TSecr=1046694423
1711548506.194610357   605 1.113115477    10.10.1.2 → 10.10.1.1    TCP 83 44652 → 8081 [PSH, ACK] Seq=1140 Ack=1140 Win=64256 Len=17 TSval=1046694430 TSecr=3170954133
1711548508.194610357   607 1.113166098    10.10.1.1 → 10.10.1.2    TCP 83 8081 → 44652 [PSH, ACK] Seq=1140 Ack=1157 Win=65152 Len=17 TSval=3170954140 TSecr=1046694430
1711548515.194610357   614 1.118860755    10.10.1.2 → 10.10.1.1    TCP 83 44652 → 8081 [PSH, ACK] Seq=1157 Ack=1157 Win=64256 Len=17 TSval=1046694436 TSecr=3170954140
1711548517.194610357   616 1.118902282    10.10.1.1 → 10.10.1.2    TCP 83 8081 → 44652 [PSH, ACK] Seq=1157 Ack=1174 Win=65152 Len=17 TSval=3170954146 TSecr=1046694436
1711548523.194610357   622 1.145078370    10.10.1.2 → 10.10.1.1    TCP 83 44652 → 8081 [PSH, ACK] Seq=1174 Ack=1174 Win=64256 Len=17 TSval=1046694462 TSecr=3170954146
1711548526.194610357   625 1.145146874    10.10.1.1 → 10.10.1.2    TCP 83 8081 → 44652 [PSH, ACK] Seq=1174 Ack=1191 Win=65152 Len=17 TSval=3170954172 TSecr=1046694462
1711548532.194610357   631 1.150378378    10.10.1.2 → 10.10.1.1    TCP 83 44652 → 8081 [PSH, ACK] Seq=1191 Ack=1191 Win=64256 Len=17 TSval=1046694468 TSecr=3170954172
1711548534.194610357   633 1.150436831    10.10.1.1 → 10.10.1.2    TCP 83 8081 → 44652 [PSH, ACK] Seq=1191 Ack=1208 Win=65152 Len=17 TSval=3170954178 TSecr=1046694468
1711548540.194610357   639 1.158415988    10.10.1.2 → 10.10.1.1    TCP 83 44652 → 8081 [PSH, ACK] Seq=1208 Ack=1208 Win=64256 Len=17 TSval=1046694476 TSecr=3170954178
1711548542.194610357   641 1.158468165    10.10.1.1 → 10.10.1.2    TCP 83 8081 → 44652 [PSH, ACK] Seq=1208 Ack=1225 Win=65152 Len=17 TSval=3170954186 TSecr=1046694476
1711548549.194610357   648 1.164185365    10.10.1.2 → 10.10.1.1    TCP 83 44652 → 8081 [PSH, ACK] Seq=1225 Ack=1225 Win=64256 Len=17 TSval=1046694481 TSecr=3170954186
1711548551.194610357   650 1.164234793    10.10.1.1 → 10.10.1.2    TCP 83 8081 → 44652 [PSH, ACK] Seq=1225 Ack=1242 Win=65152 Len=17 TSval=3170954191 TSecr=1046694481
1711548557.194610357   656 1.171978350    10.10.1.2 → 10.10.1.1    TCP 83 44652 → 8081 [PSH, ACK] Seq=1242 Ack=1242 Win=64256 Len=17 TSval=1046694489 TSecr=3170954191
1711548559.194610357   658 1.172032015    10.10.1.1 → 10.10.1.2    TCP 83 8081 → 44652 [PSH, ACK] Seq=1242 Ack=1259 Win=65152 Len=17 TSval=3170954199 TSecr=1046694489
1711548566.194610357   665 1.194248096    10.10.1.2 → 10.10.1.1    TCP 83 44652 → 8081 [PSH, ACK] Seq=1259 Ack=1259 Win=64256 Len=17 TSval=1046694512 TSecr=3170954199
1711548568.194610357   667 1.194301982    10.10.1.1 → 10.10.1.2    TCP 83 8081 → 44652 [PSH, ACK] Seq=1259 Ack=1276 Win=65152 Len=17 TSval=3170954221 TSecr=1046694512
1711548574.194610357   673 1.212658374    10.10.1.2 → 10.10.1.1    TCP 83 44652 → 8081 [PSH, ACK] Seq=1276 Ack=1276 Win=64256 Len=17 TSval=1046694530 TSecr=3170954221
1711548577.194610357   676 1.212719535    10.10.1.1 → 10.10.1.2    TCP 83 8081 → 44652 [PSH, ACK] Seq=1276 Ack=1293 Win=65152 Len=17 TSval=3170954240 TSecr=1046694530
1711548583.194610357   682 1.217322248    10.10.1.2 → 10.10.1.1    TCP 83 44652 → 8081 [PSH, ACK] Seq=1293 Ack=1293 Win=64256 Len=17 TSval=1046694535 TSecr=3170954240
1711548585.194610357   684 1.217372840    10.10.1.1 → 10.10.1.2    TCP 83 8081 → 44652 [PSH, ACK] Seq=1293 Ack=1310 Win=65152 Len=17 TSval=3170954245 TSecr=1046694535
1711548591.194610357   690 1.221794557    10.10.1.2 → 10.10.1.1    TCP 83 44652 → 8081 [PSH, ACK] Seq=1310 Ack=1310 Win=64256 Len=17 TSval=1046694539 TSecr=3170954245
1711548593.194610357   692 1.221850478    10.10.1.1 → 10.10.1.2    TCP 83 8081 → 44652 [PSH, ACK] Seq=1310 Ack=1327 Win=65152 Len=17 TSval=3170954249 TSecr=1046694539
1711548600.194610357   699 1.250063737    10.10.1.2 → 10.10.1.1    TCP 83 44652 → 8081 [PSH, ACK] Seq=1327 Ack=1327 Win=64256 Len=17 TSval=1046694567 TSecr=3170954249
1711548602.194610357   701 1.250120859    10.10.1.1 → 10.10.1.2    TCP 83 8081 → 44652 [PSH, ACK] Seq=1327 Ack=1344 Win=65152 Len=17 TSval=3170954277 TSecr=1046694567
1711548608.194610357   707 1.254260344    10.10.1.2 → 10.10.1.1    TCP 83 44652 → 8081 [PSH, ACK] Seq=1344 Ack=1344 Win=64256 Len=17 TSval=1046694572 TSecr=3170954277
1711548611.194610357   710 1.254307559    10.10.1.1 → 10.10.1.2    TCP 83 8081 → 44652 [PSH, ACK] Seq=1344 Ack=1361 Win=65152 Len=17 TSval=3170954281 TSecr=1046694572
1711548617.194610357   716 1.263522066    10.10.1.2 → 10.10.1.1    TCP 83 44652 → 8081 [PSH, ACK] Seq=1361 Ack=1361 Win=64256 Len=17 TSval=1046694581 TSecr=3170954281
1711548619.194610357   718 1.263577992    10.10.1.1 → 10.10.1.2    TCP 83 8081 → 44652 [PSH, ACK] Seq=1361 Ack=1378 Win=65152 Len=17 TSval=3170954291 TSecr=1046694581
1711548625.194610357   724 1.272805977    10.10.1.2 → 10.10.1.1    TCP 83 44652 → 8081 [PSH, ACK] Seq=1378 Ack=1378 Win=64256 Len=17 TSval=1046694590 TSecr=3170954291
1711548628.194610357   727 1.272865083    10.10.1.1 → 10.10.1.2    TCP 83 8081 → 44652 [PSH, ACK] Seq=1378 Ack=1395 Win=65152 Len=17 TSval=3170954300 TSecr=1046694590
1711548634.194610357   733 1.278554865    10.10.1.2 → 10.10.1.1    TCP 83 44652 → 8081 [PSH, ACK] Seq=1395 Ack=1395 Win=64256 Len=17 TSval=1046694596 TSecr=3170954300
1711548636.194610357   735 1.278608981    10.10.1.1 → 10.10.1.2    TCP 83 8081 → 44652 [PSH, ACK] Seq=1395 Ack=1412 Win=65152 Len=17 TSval=3170954306 TSecr=1046694596
1711548642.194610357   741 1.282991425    10.10.1.2 → 10.10.1.1    TCP 83 44652 → 8081 [PSH, ACK] Seq=1412 Ack=1412 Win=64256 Len=17 TSval=1046694600 TSecr=3170954306
1711548644.194610357   743 1.283042215    10.10.1.1 → 10.10.1.2    TCP 83 8081 → 44652 [PSH, ACK] Seq=1412 Ack=1429 Win=65152 Len=17 TSval=3170954310 TSecr=1046694600
1711548651.194610357   750 1.296112054    10.10.1.2 → 10.10.1.1    TCP 83 44652 → 8081 [PSH, ACK] Seq=1429 Ack=1429 Win=64256 Len=17 TSval=1046694613 TSecr=3170954310
1711548653.194610357   752 1.296166524    10.10.1.1 → 10.10.1.2    TCP 83 8081 → 44652 [PSH, ACK] Seq=1429 Ack=1446 Win=65152 Len=17 TSval=3170954323 TSecr=1046694613
1711548659.194610357   758 1.297206910    10.10.1.2 → 10.10.1.1    TCP 83 44652 → 8081 [PSH, ACK] Seq=1446 Ack=1446 Win=64256 Len=17 TSval=1046694614 TSecr=3170954323
1711548661.194610357   760 1.297244787    10.10.1.1 → 10.10.1.2    TCP 83 8081 → 44652 [PSH, ACK] Seq=1446 Ack=1463 Win=65152 Len=17 TSval=3170954324 TSecr=1046694614
1711548668.194610357   767 1.314412092    10.10.1.2 → 10.10.1.1    TCP 83 44652 → 8081 [PSH, ACK] Seq=1463 Ack=1463 Win=64256 Len=17 TSval=1046694632 TSecr=3170954324
1711548670.194610357   769 1.314461075    10.10.1.1 → 10.10.1.2    TCP 83 8081 → 44652 [PSH, ACK] Seq=1463 Ack=1480 Win=65152 Len=17 TSval=3170954342 TSecr=1046694632
1711548676.194610357   775 1.315531632    10.10.1.2 → 10.10.1.1    TCP 83 44652 → 8081 [PSH, ACK] Seq=1480 Ack=1480 Win=64256 Len=17 TSval=1046694633 TSecr=3170954342
1711548678.194610357   777 1.315569399    10.10.1.1 → 10.10.1.2    TCP 83 8081 → 44652 [PSH, ACK] Seq=1480 Ack=1497 Win=65152 Len=17 TSval=3170954343 TSecr=1046694633
1711548685.194610357   784 1.318333443    10.10.1.2 → 10.10.1.1    TCP 83 44652 → 8081 [PSH, ACK] Seq=1497 Ack=1497 Win=64256 Len=17 TSval=1046694636 TSecr=3170954343
1711548687.194610357   786 1.318390169    10.10.1.1 → 10.10.1.2    TCP 83 8081 → 44652 [PSH, ACK] Seq=1497 Ack=1514 Win=65152 Len=17 TSval=3170954346 TSecr=1046694636
1711548693.194610357   792 1.324774752    10.10.1.2 → 10.10.1.1    TCP 83 44652 → 8081 [PSH, ACK] Seq=1514 Ack=1514 Win=64256 Len=17 TSval=1046694642 TSecr=3170954346
1711548696.194610357   795 1.324831867    10.10.1.1 → 10.10.1.2    TCP 83 8081 → 44652 [PSH, ACK] Seq=1514 Ack=1531 Win=65152 Len=17 TSval=3170954352 TSecr=1046694642
1711548702.194610357   801 1.327697362    10.10.1.2 → 10.10.1.1    TCP 83 44652 → 8081 [PSH, ACK] Seq=1531 Ack=1531 Win=64256 Len=17 TSval=1046694645 TSecr=3170954352
1711548704.194610357   803 1.327748781    10.10.1.1 → 10.10.1.2    TCP 83 8081 → 44652 [PSH, ACK] Seq=1531 Ack=1548 Win=65152 Len=17 TSval=3170954355 TSecr=1046694645
1711548710.194610357   809 1.334713979    10.10.1.2 → 10.10.1.1    TCP 83 44652 → 8081 [PSH, ACK] Seq=1548 Ack=1548 Win=64256 Len=17 TSval=1046694652 TSecr=3170954355
1711548712.194610357   811 1.334766809    10.10.1.1 → 10.10.1.2    TCP 83 8081 → 44652 [PSH, ACK] Seq=1548 Ack=1565 Win=65152 Len=17 TSval=3170954362 TSecr=1046694652
1711548719.194610357   818 1.342844244    10.10.1.2 → 10.10.1.1    TCP 83 44652 → 8081 [PSH, ACK] Seq=1565 Ack=1565 Win=64256 Len=17 TSval=1046694660 TSecr=3170954362
1711548721.194610357   820 1.342897679    10.10.1.1 → 10.10.1.2    TCP 83 8081 → 44652 [PSH, ACK] Seq=1565 Ack=1582 Win=65152 Len=17 TSval=3170954370 TSecr=1046694660
1711548727.194610357   826 1.343997504    10.10.1.2 → 10.10.1.1    TCP 83 44652 → 8081 [PSH, ACK] Seq=1582 Ack=1582 Win=64256 Len=17 TSval=1046694661 TSecr=3170954370
1711548729.194610357   828 1.344034726    10.10.1.1 → 10.10.1.2    TCP 83 8081 → 44652 [PSH, ACK] Seq=1582 Ack=1599 Win=65152 Len=17 TSval=3170954371 TSecr=1046694661
1711548736.194610357   835 1.351609030    10.10.1.2 → 10.10.1.1    TCP 83 44652 → 8081 [PSH, ACK] Seq=1599 Ack=1599 Win=64256 Len=17 TSval=1046694669 TSecr=3170954371
1711548738.194610357   837 1.351658921    10.10.1.1 → 10.10.1.2    TCP 83 8081 → 44652 [PSH, ACK] Seq=1599 Ack=1616 Win=65152 Len=17 TSval=3170954379 TSecr=1046694669
1711548744.194610357   843 1.378144541    10.10.1.2 → 10.10.1.1    TCP 83 44652 → 8081 [PSH, ACK] Seq=1616 Ack=1616 Win=64256 Len=17 TSval=1046694695 TSecr=3170954379
1711548746.194610357   845 1.378198107    10.10.1.1 → 10.10.1.2    TCP 83 8081 → 44652 [PSH, ACK] Seq=1616 Ack=1633 Win=65152 Len=17 TSval=3170954405 TSecr=1046694695
1711548753.194610357   852 1.381441070    10.10.1.2 → 10.10.1.1    TCP 83 44652 → 8081 [PSH, ACK] Seq=1633 Ack=1633 Win=64256 Len=17 TSval=1046694699 TSecr=3170954405
1711548755.194610357   854 1.381490805    10.10.1.1 → 10.10.1.2    TCP 83 8081 → 44652 [PSH, ACK] Seq=1633 Ack=1650 Win=65152 Len=17 TSval=3170954409 TSecr=1046694699
1711548761.194610357   860 1.386153183    10.10.1.2 → 10.10.1.1    TCP 83 44652 → 8081 [PSH, ACK] Seq=1650 Ack=1650 Win=64256 Len=17 TSval=1046694703 TSecr=3170954409
1711548763.194610357   862 1.386207398    10.10.1.1 → 10.10.1.2    TCP 83 8081 → 44652 [PSH, ACK] Seq=1650 Ack=1667 Win=65152 Len=17 TSval=3170954413 TSecr=1046694703
1711548770.194610357   869 1.392094386    10.10.1.2 → 10.10.1.1    TCP 83 44652 → 8081 [PSH, ACK] Seq=1667 Ack=1667 Win=64256 Len=17 TSval=1046694709 TSecr=3170954413
1711548772.194610357   871 1.392146161    10.10.1.1 → 10.10.1.2    TCP 83 8081 → 44652 [PSH, ACK] Seq=1667 Ack=1684 Win=65152 Len=17 TSval=3170954419 TSecr=1046694709
1711548778.194610357   877 1.404011600    10.10.1.2 → 10.10.1.1    TCP 83 44652 → 8081 [PSH, ACK] Seq=1684 Ack=1684 Win=64256 Len=17 TSval=1046694721 TSecr=3170954419
1711548780.194610357   879 1.404061936    10.10.1.1 → 10.10.1.2    TCP 83 8081 → 44652 [PSH, ACK] Seq=1684 Ack=1701 Win=65152 Len=17 TSval=3170954431 TSecr=1046694721
1711548787.194610357   886 1.407615153    10.10.1.2 → 10.10.1.1    TCP 83 44652 → 8081 [PSH, ACK] Seq=1701 Ack=1701 Win=64256 Len=17 TSval=1046694725 TSecr=3170954431
1711548789.194610357   888 1.407667614    10.10.1.1 → 10.10.1.2    TCP 83 8081 → 44652 [PSH, ACK] Seq=1701 Ack=1718 Win=65152 Len=17 TSval=3170954435 TSecr=1046694725
1711548795.194610357   894 1.425728786    10.10.1.2 → 10.10.1.1    TCP 83 44652 → 8081 [PSH, ACK] Seq=1718 Ack=1718 Win=64256 Len=17 TSval=1046694743 TSecr=3170954435
1711548798.194610357   897 1.425788312    10.10.1.1 → 10.10.1.2    TCP 83 8081 → 44652 [PSH, ACK] Seq=1718 Ack=1735 Win=65152 Len=17 TSval=3170954453 TSecr=1046694743
1711548804.194610357   903 1.428592744    10.10.1.2 → 10.10.1.1    TCP 83 44652 → 8081 [PSH, ACK] Seq=1735 Ack=1735 Win=64256 Len=17 TSval=1046694746 TSecr=3170954453
1711548806.194610357   905 1.428651290    10.10.1.1 → 10.10.1.2    TCP 83 8081 → 44652 [PSH, ACK] Seq=1735 Ack=1752 Win=65152 Len=17 TSval=3170954456 TSecr=1046694746
1711548812.194610357   911 1.441327211    10.10.1.2 → 10.10.1.1    TCP 83 44652 → 8081 [PSH, ACK] Seq=1752 Ack=1752 Win=64256 Len=17 TSval=1046694759 TSecr=3170954456
1711548814.194610357   913 1.441377175    10.10.1.1 → 10.10.1.2    TCP 83 8081 → 44652 [PSH, ACK] Seq=1752 Ack=1769 Win=65152 Len=17 TSval=3170954469 TSecr=1046694759
1711548821.194610357   920 1.446074307    10.10.1.2 → 10.10.1.1    TCP 83 44652 → 8081 [PSH, ACK] Seq=1769 Ack=1769 Win=64256 Len=17 TSval=1046694763 TSecr=3170954469
1711548823.194610357   922 1.446113757    10.10.1.1 → 10.10.1.2    TCP 83 8081 → 44652 [PSH, ACK] Seq=1769 Ack=1786 Win=65152 Len=17 TSval=3170954473 TSecr=1046694763
1711548829.194610357   928 1.447559879    10.10.1.2 → 10.10.1.1    TCP 83 44652 → 8081 [PSH, ACK] Seq=1786 Ack=1786 Win=64256 Len=17 TSval=1046694765 TSecr=3170954473
1711548831.194610357   930 1.447608059    10.10.1.1 → 10.10.1.2    TCP 83 8081 → 44652 [PSH, ACK] Seq=1786 Ack=1803 Win=65152 Len=17 TSval=3170954475 TSecr=1046694765
1711548838.194610357   937 1.455793827    10.10.1.2 → 10.10.1.1    TCP 83 44652 → 8081 [PSH, ACK] Seq=1803 Ack=1803 Win=64256 Len=17 TSval=1046694773 TSecr=3170954475
1711548840.194610357   939 1.455833584    10.10.1.1 → 10.10.1.2    TCP 83 8081 → 44652 [PSH, ACK] Seq=1803 Ack=1820 Win=65152 Len=17 TSval=3170954483 TSecr=1046694773
1711548846.194610357   945 1.468863349    10.10.1.2 → 10.10.1.1    TCP 83 44652 → 8081 [PSH, ACK] Seq=1820 Ack=1820 Win=64256 Len=17 TSval=1046694786 TSecr=3170954483
1711548848.194610357   947 1.468913579    10.10.1.1 → 10.10.1.2    TCP 83 8081 → 44652 [PSH, ACK] Seq=1820 Ack=1837 Win=65152 Len=17 TSval=3170954496 TSecr=1046694786
1711548855.194610357   954 1.475407661    10.10.1.2 → 10.10.1.1    TCP 83 44652 → 8081 [PSH, ACK] Seq=1837 Ack=1837 Win=64256 Len=17 TSval=1046694793 TSecr=3170954496
1711548857.194610357   956 1.475463856    10.10.1.1 → 10.10.1.2    TCP 83 8081 → 44652 [PSH, ACK] Seq=1837 Ack=1854 Win=65152 Len=17 TSval=3170954503 TSecr=1046694793
1711548863.194610357   962 1.482381853    10.10.1.2 → 10.10.1.1    TCP 83 44652 → 8081 [PSH, ACK] Seq=1854 Ack=1854 Win=64256 Len=17 TSval=1046694800 TSecr=3170954503
1711548865.194610357   964 1.482438208    10.10.1.1 → 10.10.1.2    TCP 83 8081 → 44652 [PSH, ACK] Seq=1854 Ack=1871 Win=65152 Len=17 TSval=3170954510 TSecr=1046694800
1711548872.194610357   971 1.483128753    10.10.1.2 → 10.10.1.1    TCP 83 44652 → 8081 [PSH, ACK] Seq=1871 Ack=1871 Win=64256 Len=17 TSval=1046694800 TSecr=3170954510
1711548874.194610357   973 1.483166255    10.10.1.1 → 10.10.1.2    TCP 83 8081 → 44652 [PSH, ACK] Seq=1871 Ack=1888 Win=65152 Len=17 TSval=3170954510 TSecr=1046694800
1711548880.194610357   979 1.483995080    10.10.1.2 → 10.10.1.1    TCP 83 44652 → 8081 [PSH, ACK] Seq=1888 Ack=1888 Win=64256 Len=17 TSval=1046694801 TSecr=3170954510
1711548882.194610357   981 1.484029797    10.10.1.1 → 10.10.1.2    TCP 83 8081 → 44652 [PSH, ACK] Seq=1888 Ack=1905 Win=65152 Len=17 TSval=3170954511 TSecr=1046694801
1711548889.194610357   988 1.485103667    10.10.1.2 → 10.10.1.1    TCP 83 44652 → 8081 [PSH, ACK] Seq=1905 Ack=1905 Win=64256 Len=17 TSval=1046694802 TSecr=3170954511
1711548891.194610357   990 1.485138928    10.10.1.1 → 10.10.1.2    TCP 83 8081 → 44652 [PSH, ACK] Seq=1905 Ack=1922 Win=65152 Len=17 TSval=3170954512 TSecr=1046694802
1711548897.194610357   996 1.491766105    10.10.1.2 → 10.10.1.1    TCP 83 44652 → 8081 [PSH, ACK] Seq=1922 Ack=1922 Win=64256 Len=17 TSval=1046694809 TSecr=3170954512
1711548900.194610357   999 1.491857686    10.10.1.1 → 10.10.1.2    TCP 83 8081 → 44652 [PSH, ACK] Seq=1922 Ack=1939 Win=65152 Len=17 TSval=3170954519 TSecr=1046694809
1711548906.194610357  1005 1.497278406    10.10.1.2 → 10.10.1.1    TCP 83 44652 → 8081 [PSH, ACK] Seq=1939 Ack=1939 Win=64256 Len=17 TSval=1046694815 TSecr=3170954519
1711548908.194610357  1007 1.497327563    10.10.1.1 → 10.10.1.2    TCP 83 8081 → 44652 [PSH, ACK] Seq=1939 Ack=1956 Win=65152 Len=17 TSval=3170954524 TSecr=1046694815
1711548914.194610357  1013 1.514216179    10.10.1.2 → 10.10.1.1    TCP 83 44652 → 8081 [PSH, ACK] Seq=1956 Ack=1956 Win=64256 Len=17 TSval=1046694831 TSecr=3170954524
1711548916.194610357  1015 1.514256600    10.10.1.1 → 10.10.1.2    TCP 83 8081 → 44652 [PSH, ACK] Seq=1956 Ack=1973 Win=65152 Len=17 TSval=3170954541 TSecr=1046694831
1711548923.194610357  1022 1.522643503    10.10.1.2 → 10.10.1.1    TCP 83 44652 → 8081 [PSH, ACK] Seq=1973 Ack=1973 Win=64256 Len=17 TSval=1046694840 TSecr=3170954541
1711548925.194610357  1024 1.522693908    10.10.1.1 → 10.10.1.2    TCP 83 8081 → 44652 [PSH, ACK] Seq=1973 Ack=1990 Win=65152 Len=17 TSval=3170954550 TSecr=1046694840
1711548931.194610357  1030 1.525420251    10.10.1.2 → 10.10.1.1    TCP 83 44652 → 8081 [PSH, ACK] Seq=1990 Ack=1990 Win=64256 Len=17 TSval=1046694843 TSecr=3170954550
1711548933.194610357  1032 1.525458453    10.10.1.1 → 10.10.1.2    TCP 83 8081 → 44652 [PSH, ACK] Seq=1990 Ack=2007 Win=65152 Len=17 TSval=3170954553 TSecr=1046694843
1711548940.194610357  1039 1.548561923    10.10.1.2 → 10.10.1.1    TCP 83 44652 → 8081 [PSH, ACK] Seq=2007 Ack=2007 Win=64256 Len=17 TSval=1046694866 TSecr=3170954553
1711548942.194610357  1041 1.548613450    10.10.1.1 → 10.10.1.2    TCP 83 8081 → 44652 [PSH, ACK] Seq=2007 Ack=2024 Win=65152 Len=17 TSval=3170954576 TSecr=1046694866
1711548948.194610357  1047 1.564362719    10.10.1.2 → 10.10.1.1    TCP 83 44652 → 8081 [PSH, ACK] Seq=2024 Ack=2024 Win=64256 Len=17 TSval=1046694882 TSecr=3170954576
1711548950.194610357  1049 1.564413521    10.10.1.1 → 10.10.1.2    TCP 83 8081 → 44652 [PSH, ACK] Seq=2024 Ack=2041 Win=65152 Len=17 TSval=3170954592 TSecr=1046694882
1711548957.194610357  1056 1.576276285    10.10.1.2 → 10.10.1.1    TCP 83 44652 → 8081 [PSH, ACK] Seq=2041 Ack=2041 Win=64256 Len=17 TSval=1046694894 TSecr=3170954592
