1711548444.175963163    29 0.541388854    10.10.1.2 → 10.10.1.1    TCP 83 52288 → 8081 [PSH, ACK] Seq=1 Ack=1 Win=64256 Len=17 TSval=1047207769 TSecr=3171467218
1711548447.175963163    32 0.541639581    10.10.1.1 → 10.10.1.2    TCP 83 8081 → 52288 [PSH, ACK] Seq=1 Ack=18 Win=65152 Len=17 TSval=3171467479 TSecr=1047207769
1711548453.175963163    38 0.551804719    10.10.1.2 → 10.10.1.1    TCP 83 52288 → 8081 [PSH, ACK] Seq=18 Ack=18 Win=64256 Len=17 TSval=1047207779 TSecr=3171467479
1711548456.175963163    41 0.551842981    10.10.1.1 → 10.10.1.2    TCP 83 8081 → 52288 [PSH, ACK] Seq=18 Ack=35 Win=65152 Len=17 TSval=3171467490 TSecr=1047207779
1711548461.175963163    46 0.562003894    10.10.1.2 → 10.10.1.1    TCP 83 52288 → 8081 [PSH, ACK] Seq=35 Ack=35 Win=64256 Len=17 TSval=1047207789 TSecr=3171467490
1711548464.175963163    49 0.562040902    10.10.1.1 → 10.10.1.2    TCP 83 8081 → 52288 [PSH, ACK] Seq=35 Ack=52 Win=65152 Len=17 TSval=3171467500 TSecr=1047207789
1711548469.175963163    54 0.572197162    10.10.1.2 → 10.10.1.1    TCP 83 52288 → 8081 [PSH, ACK] Seq=52 Ack=52 Win=64256 Len=17 TSval=1047207799 TSecr=3171467500
1711548472.175963163    57 0.572230669    10.10.1.1 → 10.10.1.2    TCP 83 8081 → 52288 [PSH, ACK] Seq=52 Ack=69 Win=65152 Len=17 TSval=3171467510 TSecr=1047207799
1711548477.175963163    62 0.582374643    10.10.1.2 → 10.10.1.1    TCP 83 52288 → 8081 [PSH, ACK] Seq=69 Ack=69 Win=64256 Len=17 TSval=1047207810 TSecr=3171467510
1711548480.175963163    65 0.582407826    10.10.1.1 → 10.10.1.2    TCP 83 8081 → 52288 [PSH, ACK] Seq=69 Ack=86 Win=65152 Len=17 TSval=3171467520 TSecr=1047207810
1711548485.175963163    70 0.592567343    10.10.1.2 → 10.10.1.1    TCP 83 52288 → 8081 [PSH, ACK] Seq=86 Ack=86 Win=64256 Len=17 TSval=1047207820 TSecr=3171467520
1711548487.175963163    72 0.592603023    10.10.1.1 → 10.10.1.2    TCP 83 8081 → 52288 [PSH, ACK] Seq=86 Ack=103 Win=65152 Len=17 TSval=3171467530 TSecr=1047207820
1711548493.175963163    78 0.602758370    10.10.1.2 → 10.10.1.1    TCP 83 52288 → 8081 [PSH, ACK] Seq=103 Ack=103 Win=64256 Len=17 TSval=1047207830 TSecr=3171467530
1711548495.175963163    80 0.602792391    10.10.1.1 → 10.10.1.2    TCP 83 8081 → 52288 [PSH, ACK] Seq=103 Ack=120 Win=65152 Len=17 TSval=3171467541 TSecr=1047207830
1711548501.175963163    86 0.612948609    10.10.1.2 → 10.10.1.1    TCP 83 52288 → 8081 [PSH, ACK] Seq=120 Ack=120 Win=64256 Len=17 TSval=1047207840 TSecr=3171467541
1711548503.175963163    88 0.612982226    10.10.1.1 → 10.10.1.2    TCP 83 8081 → 52288 [PSH, ACK] Seq=120 Ack=137 Win=65152 Len=17 TSval=3171467551 TSecr=1047207840
1711548509.175963163    94 0.623137562    10.10.1.2 → 10.10.1.1    TCP 83 52288 → 8081 [PSH, ACK] Seq=137 Ack=137 Win=64256 Len=17 TSval=1047207850 TSecr=3171467551
1711548511.175963163    96 0.623171299    10.10.1.1 → 10.10.1.2    TCP 83 8081 → 52288 [PSH, ACK] Seq=137 Ack=154 Win=65152 Len=17 TSval=3171467561 TSecr=1047207850
1711548517.175963163   102 0.633327019    10.10.1.2 → 10.10.1.1    TCP 83 52288 → 8081 [PSH, ACK] Seq=154 Ack=154 Win=64256 Len=17 TSval=1047207860 TSecr=3171467561
1711548519.175963163   104 0.633361994    10.10.1.1 → 10.10.1.2    TCP 83 8081 → 52288 [PSH, ACK] Seq=154 Ack=171 Win=65152 Len=17 TSval=3171467571 TSecr=1047207860
1711548525.175963163   110 0.643516776    10.10.1.2 → 10.10.1.1    TCP 83 52288 → 8081 [PSH, ACK] Seq=171 Ack=171 Win=64256 Len=17 TSval=1047207871 TSecr=3171467571
1711548527.175963163   112 0.643550242    10.10.1.1 → 10.10.1.2    TCP 83 8081 → 52288 [PSH, ACK] Seq=171 Ack=188 Win=65152 Len=17 TSval=3171467581 TSecr=1047207871
1711548533.175963163   118 0.653705078    10.10.1.2 → 10.10.1.1    TCP 83 52288 → 8081 [PSH, ACK] Seq=188 Ack=188 Win=64256 Len=17 TSval=1047207881 TSecr=3171467581
1711548535.175963163   120 0.653738566    10.10.1.1 → 10.10.1.2    TCP 83 8081 → 52288 [PSH, ACK] Seq=188 Ack=205 Win=65152 Len=17 TSval=3171467591 TSecr=1047207881
1711548541.175963163   126 0.663893430    10.10.1.2 → 10.10.1.1    TCP 83 52288 → 8081 [PSH, ACK] Seq=205 Ack=205 Win=64256 Len=17 TSval=1047207891 TSecr=3171467591
1711548543.175963163   128 0.663927072    10.10.1.1 → 10.10.1.2    TCP 83 8081 → 52288 [PSH, ACK] Seq=205 Ack=222 Win=65152 Len=17 TSval=3171467602 TSecr=1047207891
1711548549.175963163   134 0.674083515    10.10.1.2 → 10.10.1.1    TCP 83 52288 → 8081 [PSH, ACK] Seq=222 Ack=222 Win=64256 Len=17 TSval=1047207901 TSecr=3171467602
1711548551.175963163   136 0.674117666    10.10.1.1 → 10.10.1.2    TCP 83 8081 → 52288 [PSH, ACK] Seq=222 Ack=239 Win=65152 Len=17 TSval=3171467612 TSecr=1047207901
1711548557.175963163   142 0.684273534    10.10.1.2 → 10.10.1.1    TCP 83 52288 → 8081 [PSH, ACK] Seq=239 Ack=239 Win=64256 Len=17 TSval=1047207911 TSecr=3171467612
1711548559.175963163   144 0.684308180    10.10.1.1 → 10.10.1.2    TCP 83 8081 → 52288 [PSH, ACK] Seq=239 Ack=256 Win=65152 Len=17 TSval=3171467622 TSecr=1047207911
1711548565.175963163   150 0.694465567    10.10.1.2 → 10.10.1.1    TCP 83 52288 → 8081 [PSH, ACK] Seq=256 Ack=256 Win=64256 Len=17 TSval=1047207922 TSecr=3171467622
1711548567.175963163   152 0.694498579    10.10.1.1 → 10.10.1.2    TCP 83 8081 → 52288 [PSH, ACK] Seq=256 Ack=273 Win=65152 Len=17 TSval=3171467632 TSecr=1047207922
1711548573.175963163   158 0.704653436    10.10.1.2 → 10.10.1.1    TCP 83 52288 → 8081 [PSH, ACK] Seq=273 Ack=273 Win=64256 Len=17 TSval=1047207932 TSecr=3171467632
1711548575.175963163   160 0.704687097    10.10.1.1 → 10.10.1.2    TCP 83 8081 → 52288 [PSH, ACK] Seq=273 Ack=290 Win=65152 Len=17 TSval=3171467642 TSecr=1047207932
1711548581.175963163   166 0.714841523    10.10.1.2 → 10.10.1.1    TCP 83 52288 → 8081 [PSH, ACK] Seq=290 Ack=290 Win=64256 Len=17 TSval=1047207942 TSecr=3171467642
1711548583.175963163   168 0.714876331    10.10.1.1 → 10.10.1.2    TCP 83 8081 → 52288 [PSH, ACK] Seq=290 Ack=307 Win=65152 Len=17 TSval=3171467653 TSecr=1047207942
1711548589.175963163   174 0.725030940    10.10.1.2 → 10.10.1.1    TCP 83 52288 → 8081 [PSH, ACK] Seq=307 Ack=307 Win=64256 Len=17 TSval=1047207952 TSecr=3171467653
1711548591.175963163   176 0.725065035    10.10.1.1 → 10.10.1.2    TCP 83 8081 → 52288 [PSH, ACK] Seq=307 Ack=324 Win=65152 Len=17 TSval=3171467663 TSecr=1047207952
1711548597.175963163   182 0.735219014    10.10.1.2 → 10.10.1.1    TCP 83 52288 → 8081 [PSH, ACK] Seq=324 Ack=324 Win=64256 Len=17 TSval=1047207962 TSecr=3171467663
1711548599.175963163   184 0.735253561    10.10.1.1 → 10.10.1.2    TCP 83 8081 → 52288 [PSH, ACK] Seq=324 Ack=341 Win=65152 Len=17 TSval=3171467673 TSecr=1047207962
1711548605.175963163   190 0.745411919    10.10.1.2 → 10.10.1.1    TCP 83 52288 → 8081 [PSH, ACK] Seq=341 Ack=341 Win=64256 Len=17 TSval=1047207973 TSecr=3171467673
1711548607.175963163   192 0.745453729    10.10.1.1 → 10.10.1.2    TCP 83 8081 → 52288 [PSH, ACK] Seq=341 Ack=358 Win=65152 Len=17 TSval=3171467683 TSecr=1047207973
1711548613.175963163   198 0.755612097    10.10.1.2 → 10.10.1.1    TCP 83 52288 → 8081 [PSH, ACK] Seq=358 Ack=358 Win=64256 Len=17 TSval=1047207983 TSecr=3171467683
1711548615.175963163   200 0.755648523    10.10.1.1 → 10.10.1.2    TCP 83 8081 → 52288 [PSH, ACK] Seq=358 Ack=375 Win=65152 Len=17 TSval=3171467693 TSecr=1047207983
1711548621.175963163   206 0.765805237    10.10.1.2 → 10.10.1.1    TCP 83 52288 → 8081 [PSH, ACK] Seq=375 Ack=375 Win=64256 Len=17 TSval=1047207993 TSecr=3171467693
1711548623.175963163   208 0.765841581    10.10.1.1 → 10.10.1.2    TCP 83 8081 → 52288 [PSH, ACK] Seq=375 Ack=392 Win=65152 Len=17 TSval=3171467704 TSecr=1047207993
1711548629.175963163   214 0.775995170    10.10.1.2 → 10.10.1.1    TCP 83 52288 → 8081 [PSH, ACK] Seq=392 Ack=392 Win=64256 Len=17 TSval=1047208003 TSecr=3171467704
1711548631.175963163   216 0.776027916    10.10.1.1 → 10.10.1.2    TCP 83 8081 → 52288 [PSH, ACK] Seq=392 Ack=409 Win=65152 Len=17 TSval=3171467714 TSecr=1047208003
1711548637.175963163   222 0.786184922    10.10.1.2 → 10.10.1.1    TCP 83 52288 → 8081 [PSH, ACK] Seq=409 Ack=409 Win=64256 Len=17 TSval=1047208013 TSecr=3171467714
1711548639.175963163   224 0.786218817    10.10.1.1 → 10.10.1.2    TCP 83 8081 → 52288 [PSH, ACK] Seq=409 Ack=426 Win=65152 Len=17 TSval=3171467724 TSecr=1047208013
1711548645.175963163   230 0.796361705    10.10.1.2 → 10.10.1.1    TCP 83 52288 → 8081 [PSH, ACK] Seq=426 Ack=426 Win=64256 Len=17 TSval=1047208024 TSecr=3171467724
1711548647.175963163   232 0.796413924    10.10.1.1 → 10.10.1.2    TCP 83 8081 → 52288 [PSH, ACK] Seq=426 Ack=443 Win=65152 Len=17 TSval=3171467734 TSecr=1047208024
1711548653.175963163   238 0.806570278    10.10.1.2 → 10.10.1.1    TCP 83 52288 → 8081 [PSH, ACK] Seq=443 Ack=443 Win=64256 Len=17 TSval=1047208034 TSecr=3171467734
1711548655.175963163   240 0.806607949    10.10.1.1 → 10.10.1.2    TCP 83 8081 → 52288 [PSH, ACK] Seq=443 Ack=460 Win=65152 Len=17 TSval=3171467744 TSecr=1047208034
1711548661.175963163   246 0.816761804    10.10.1.2 → 10.10.1.1    TCP 83 52288 → 8081 [PSH, ACK] Seq=460 Ack=460 Win=64256 Len=17 TSval=1047208044 TSecr=3171467744
1711548663.175963163   248 0.816794963    10.10.1.1 → 10.10.1.2    TCP 83 8081 → 52288 [PSH, ACK] Seq=460 Ack=477 Win=65152 Len=17 TSval=3171467755 TSecr=1047208044
1711548669.175963163   254 0.826949178    10.10.1.2 → 10.10.1.1    TCP 83 52288 → 8081 [PSH, ACK] Seq=477 Ack=477 Win=64256 Len=17 TSval=1047208054 TSecr=3171467755
1711548671.175963163   256 0.826984417    10.10.1.1 → 10.10.1.2    TCP 83 8081 → 52288 [PSH, ACK] Seq=477 Ack=494 Win=65152 Len=17 TSval=3171467765 TSecr=1047208054
1711548677.175963163   262 0.837139126    10.10.1.2 → 10.10.1.1    TCP 83 52288 → 8081 [PSH, ACK] Seq=494 Ack=494 Win=64256 Len=17 TSval=1047208064 TSecr=3171467765
1711548679.175963163   264 0.837173670    10.10.1.1 → 10.10.1.2    TCP 83 8081 → 52288 [PSH, ACK] Seq=494 Ack=511 Win=65152 Len=17 TSval=3171467775 TSecr=1047208064
1711548685.175963163   270 0.847329659    10.10.1.2 → 10.10.1.1    TCP 83 52288 → 8081 [PSH, ACK] Seq=511 Ack=511 Win=64256 Len=17 TSval=1047208074 TSecr=3171467775
1711548687.175963163   272 0.847364231    10.10.1.1 → 10.10.1.2    TCP 83 8081 → 52288 [PSH, ACK] Seq=511 Ack=528 Win=65152 Len=17 TSval=3171467785 TSecr=1047208074
1711548693.175963163   278 0.857519401    10.10.1.2 → 10.10.1.1    TCP 83 52288 → 8081 [PSH, ACK] Seq=528 Ack=528 Win=64256 Len=17 TSval=1047208085 TSecr=3171467785
1711548695.175963163   280 0.857554295    10.10.1.1 → 10.10.1.2    TCP 83 8081 → 52288 [PSH, ACK] Seq=528 Ack=545 Win=65152 Len=17 TSval=3171467795 TSecr=1047208085
1711548701.175963163   286 0.867708459    10.10.1.2 → 10.10.1.1    TCP 83 52288 → 8081 [PSH, ACK] Seq=545 Ack=545 Win=64256 Len=17 TSval=1047208095 TSecr=3171467795
1711548703.175963163   288 0.867752103    10.10.1.1 → 10.10.1.2    TCP 83 8081 → 52288 [PSH, ACK] Seq=545 Ack=562 Win=65152 Len=17 TSval=3171467805 TSecr=1047208095
1711548709.175963163   294 0.877906147    10.10.1.2 → 10.10.1.1    TCP 83 52288 → 8081 [PSH, ACK] Seq=562 Ack=562 Win=64256 Len=17 TSval=1047208105 TSecr=3171467805
1711548711.175963163   296 0.877943014    10.10.1.1 → 10.10.1.2    TCP 83 8081 → 52288 [PSH, ACK] Seq=562 Ack=579 Win=65152 Len=17 TSval=3171467816 TSecr=1047208105
1711548717.175963163   302 0.888098582    10.10.1.2 → 10.10.1.1    TCP 83 52288 → 8081 [PSH, ACK] Seq=579 Ack=579 Win=64256 Len=17 TSval=1047208115 TSecr=3171467816
1711548719.175963163   304 0.888132671    10.10.1.1 → 10.10.1.2    TCP 83 8081 → 52288 [PSH, ACK] Seq=579 Ack=596 Win=65152 Len=17 TSval=3171467826 TSecr=1047208115
1711548725.175963163   310 0.898288407    10.10.1.2 → 10.10.1.1    TCP 83 52288 → 8081 [PSH, ACK] Seq=596 Ack=596 Win=64256 Len=17 TSval=1047208125 TSecr=3171467826
1711548727.175963163   312 0.898322002    10.10.1.1 → 10.10.1.2    TCP 83 8081 → 52288 [PSH, ACK] Seq=596 Ack=613 Win=65152 Len=17 TSval=3171467836 TSecr=1047208125
1711548733.175963163   318 0.908478190    10.10.1.2 → 10.10.1.1    TCP 83 52288 → 8081 [PSH, ACK] Seq=613 Ack=613 Win=64256 Len=17 TSval=1047208136 TSecr=3171467836
1711548735.175963163   320 0.908514702    10.10.1.1 → 10.10.1.2    TCP 83 8081 → 52288 [PSH, ACK] Seq=613 Ack=630 Win=65152 Len=17 TSval=3171467846 TSecr=1047208136
1711548741.175963163   326 0.918670749    10.10.1.2 → 10.10.1.1    TCP 83 52288 → 8081 [PSH, ACK] Seq=630 Ack=630 Win=64256 Len=17 TSval=1047208146 TSecr=3171467846
1711548743.175963163   328 0.918706640    10.10.1.1 → 10.10.1.2    TCP 83 8081 → 52288 [PSH, ACK] Seq=630 Ack=647 Win=65152 Len=17 TSval=3171467856 TSecr=1047208146
1711548749.175963163   334 0.928862887    10.10.1.2 → 10.10.1.1    TCP 83 52288 → 8081 [PSH, ACK] Seq=647 Ack=647 Win=64256 Len=17 TSval=1047208156 TSecr=3171467856
1711548751.175963163   336 0.928898920    10.10.1.1 → 10.10.1.2    TCP 83 8081 → 52288 [PSH, ACK] Seq=647 Ack=664 Win=65152 Len=17 TSval=3171467867 TSecr=1047208156
1711548757.175963163   342 0.939053284    10.10.1.2 → 10.10.1.1    TCP 83 52288 → 8081 [PSH, ACK] Seq=664 Ack=664 Win=64256 Len=17 TSval=1047208166 TSecr=3171467867
1711548759.175963163   344 0.939086475    10.10.1.1 → 10.10.1.2    TCP 83 8081 → 52288 [PSH, ACK] Seq=664 Ack=681 Win=65152 Len=17 TSval=3171467877 TSecr=1047208166
1711548765.175963163   350 0.949240062    10.10.1.2 → 10.10.1.1    TCP 83 52288 → 8081 [PSH, ACK] Seq=681 Ack=681 Win=64256 Len=17 TSval=1047208176 TSecr=3171467877
1711548767.175963163   352 0.949273977    10.10.1.1 → 10.10.1.2    TCP 83 8081 → 52288 [PSH, ACK] Seq=681 Ack=698 Win=65152 Len=17 TSval=3171467887 TSecr=1047208176
1711548773.175963163   358 0.959428873    10.10.1.2 → 10.10.1.1    TCP 83 52288 → 8081 [PSH, ACK] Seq=698 Ack=698 Win=64256 Len=17 TSval=1047208187 TSecr=3171467887
1711548775.175963163   360 0.959464481    10.10.1.1 → 10.10.1.2    TCP 83 8081 → 52288 [PSH, ACK] Seq=698 Ack=715 Win=65152 Len=17 TSval=3171467897 TSecr=1047208187
1711548781.175963163   366 0.969620104    10.10.1.2 → 10.10.1.1    TCP 83 52288 → 8081 [PSH, ACK] Seq=715 Ack=715 Win=64256 Len=17 TSval=1047208197 TSecr=3171467897
1711548783.175963163   368 0.969654331    10.10.1.1 → 10.10.1.2    TCP 83 8081 → 52288 [PSH, ACK] Seq=715 Ack=732 Win=65152 Len=17 TSval=3171467907 TSecr=1047208197
1711548789.175963163   374 0.979809714    10.10.1.2 → 10.10.1.1    TCP 83 52288 → 8081 [PSH, ACK] Seq=732 Ack=732 Win=64256 Len=17 TSval=1047208207 TSecr=3171467907
1711548791.175963163   376 0.979843545    10.10.1.1 → 10.10.1.2    TCP 83 8081 → 52288 [PSH, ACK] Seq=732 Ack=749 Win=65152 Len=17 TSval=3171467918 TSecr=1047208207
1711548797.175963163   382 0.989999472    10.10.1.2 → 10.10.1.1    TCP 83 52288 → 8081 [PSH, ACK] Seq=749 Ack=749 Win=64256 Len=17 TSval=1047208217 TSecr=3171467918
1711548799.175963163   384 0.990033220    10.10.1.1 → 10.10.1.2    TCP 83 8081 → 52288 [PSH, ACK] Seq=749 Ack=766 Win=65152 Len=17 TSval=3171467928 TSecr=1047208217
1711548805.175963163   390 1.000188884    10.10.1.2 → 10.10.1.1    TCP 83 52288 → 8081 [PSH, ACK] Seq=766 Ack=766 Win=64256 Len=17 TSval=1047208227 TSecr=3171467928
1711548807.175963163   392 1.000222235    10.10.1.1 → 10.10.1.2    TCP 83 8081 → 52288 [PSH, ACK] Seq=766 Ack=783 Win=65152 Len=17 TSval=3171467938 TSecr=1047208227
1711548813.175963163   398 1.010374045    10.10.1.2 → 10.10.1.1    TCP 83 52288 → 8081 [PSH, ACK] Seq=783 Ack=783 Win=64256 Len=17 TSval=1047208238 TSecr=3171467938
1711548815.175963163   400 1.010409325    10.10.1.1 → 10.10.1.2    TCP 83 8081 → 52288 [PSH, ACK] Seq=783 Ack=800 Win=65152 Len=17 TSval=3171467948 TSecr=1047208238
1711548821.175963163   406 1.020564478    10.10.1.2 → 10.10.1.1    TCP 83 52288 → 8081 [PSH, ACK] Seq=800 Ack=800 Win=64256 Len=17 TSval=1047208248 TSecr=3171467948
1711548823.175963163   408 1.020599897    10.10.1.1 → 10.10.1.2    TCP 83 8081 → 52288 [PSH, ACK] Seq=800 Ack=817 Win=65152 Len=17 TSval=3171467958 TSecr=1047208248
1711548830.175963163   415 1.030754620    10.10.1.2 → 10.10.1.1    TCP 83 52288 → 8081 [PSH, ACK] Seq=817 Ack=817 Win=64256 Len=17 TSval=1047208258 TSecr=3171467958
1711548832.175963163   417 1.030788760    10.10.1.1 → 10.10.1.2    TCP 83 8081 → 52288 [PSH, ACK] Seq=817 Ack=834 Win=65152 Len=17 TSval=3171467969 TSecr=1047208258
1711548838.175963163   423 1.040943050    10.10.1.2 → 10.10.1.1    TCP 83 52288 → 8081 [PSH, ACK] Seq=834 Ack=834 Win=64256 Len=17 TSval=1047208268 TSecr=3171467969
1711548840.175963163   425 1.040977411    10.10.1.1 → 10.10.1.2    TCP 83 8081 → 52288 [PSH, ACK] Seq=834 Ack=851 Win=65152 Len=17 TSval=3171467979 TSecr=1047208268
1711548846.175963163   431 1.051130414    10.10.1.2 → 10.10.1.1    TCP 83 52288 → 8081 [PSH, ACK] Seq=851 Ack=851 Win=64256 Len=17 TSval=1047208278 TSecr=3171467979
1711548848.175963163   433 1.051164026    10.10.1.1 → 10.10.1.2    TCP 83 8081 → 52288 [PSH, ACK] Seq=851 Ack=868 Win=65152 Len=17 TSval=3171467989 TSecr=1047208278
1711548854.175963163   439 1.061322263    10.10.1.2 → 10.10.1.1    TCP 83 52288 → 8081 [PSH, ACK] Seq=868 Ack=868 Win=64256 Len=17 TSval=1047208288 TSecr=3171467989
1711548856.175963163   441 1.061359230    10.10.1.1 → 10.10.1.2    TCP 83 8081 → 52288 [PSH, ACK] Seq=868 Ack=885 Win=65152 Len=17 TSval=3171467999 TSecr=1047208288
1711548862.175963163   447 1.071516737    10.10.1.2 → 10.10.1.1    TCP 83 52288 → 8081 [PSH, ACK] Seq=885 Ack=885 Win=64256 Len=17 TSval=1047208299 TSecr=3171467999
1711548864.175963163   449 1.071553159    10.10.1.1 → 10.10.1.2    TCP 83 8081 → 52288 [PSH, ACK] Seq=885 Ack=902 Win=65152 Len=17 TSval=3171468009 TSecr=1047208299
1711548870.175963163   455 1.081707356    10.10.1.2 → 10.10.1.1    TCP 83 52288 → 8081 [PSH, ACK] Seq=902 Ack=902 Win=64256 Len=17 TSval=1047208309 TSecr=3171468009
1711548872.175963163   457 1.081741678    10.10.1.1 → 10.10.1.2    TCP 83 8081 → 52288 [PSH, ACK] Seq=902 Ack=919 Win=65152 Len=17 TSval=3171468019 TSecr=1047208309
1711548878.175963163   463 1.091897295    10.10.1.2 → 10.10.1.1    TCP 83 52288 → 8081 [PSH, ACK] Seq=919 Ack=919 Win=64256 Len=17 TSval=1047208319 TSecr=3171468019
1711548880.175963163   465 1.091930411    10.10.1.1 → 10.10.1.2    TCP 83 8081 → 52288 [PSH, ACK] Seq=919 Ack=936 Win=65152 Len=17 TSval=3171468030 TSecr=1047208319
1711548886.175963163   471 1.102085599    10.10.1.2 → 10.10.1.1    TCP 83 52288 → 8081 [PSH, ACK] Seq=936 Ack=936 Win=64256 Len=17 TSval=1047208329 TSecr=3171468030
1711548888.175963163   473 1.102119810    10.10.1.1 → 10.10.1.2    TCP 83 8081 → 52288 [PSH, ACK] Seq=936 Ack=953 Win=65152 Len=17 TSval=3171468040 TSecr=1047208329
1711548894.175963163   479 1.112275469    10.10.1.2 → 10.10.1.1    TCP 83 52288 → 8081 [PSH, ACK] Seq=953 Ack=953 Win=64256 Len=17 TSval=1047208339 TSecr=3171468040
1711548897.175963163   482 1.112372124    10.10.1.1 → 10.10.1.2    TCP 83 8081 → 52288 [PSH, ACK] Seq=953 Ack=970 Win=65152 Len=17 TSval=3171468050 TSecr=1047208339
1711548902.175963163   487 1.122528408    10.10.1.2 → 10.10.1.1    TCP 83 52288 → 8081 [PSH, ACK] Seq=970 Ack=970 Win=64256 Len=17 TSval=1047208350 TSecr=3171468050
1711548904.175963163   489 1.122563235    10.10.1.1 → 10.10.1.2    TCP 83 8081 → 52288 [PSH, ACK] Seq=970 Ack=987 Win=65152 Len=17 TSval=3171468060 TSecr=1047208350
1711548910.175963163   495 1.132716792    10.10.1.2 → 10.10.1.1    TCP 83 52288 → 8081 [PSH, ACK] Seq=987 Ack=987 Win=64256 Len=17 TSval=1047208360 TSecr=3171468060
1711548912.175963163   497 1.132751113    10.10.1.1 → 10.10.1.2    TCP 83 8081 → 52288 [PSH, ACK] Seq=987 Ack=1004 Win=65152 Len=17 TSval=3171468071 TSecr=1047208360
1711548918.175963163   503 1.142907578    10.10.1.2 → 10.10.1.1    TCP 83 52288 → 8081 [PSH, ACK] Seq=1004 Ack=1004 Win=64256 Len=17 TSval=1047208370 TSecr=3171468071
1711548920.175963163   505 1.142941961    10.10.1.1 → 10.10.1.2    TCP 83 8081 → 52288 [PSH, ACK] Seq=1004 Ack=1021 Win=65152 Len=17 TSval=3171468081 TSecr=1047208370
1711548926.175963163   511 1.153098916    10.10.1.2 → 10.10.1.1    TCP 83 52288 → 8081 [PSH, ACK] Seq=1021 Ack=1021 Win=64256 Len=17 TSval=1047208380 TSecr=3171468081
1711548928.175963163   513 1.153133957    10.10.1.1 → 10.10.1.2    TCP 83 8081 → 52288 [PSH, ACK] Seq=1021 Ack=1038 Win=65152 Len=17 TSval=3171468091 TSecr=1047208380
1711548934.175963163   519 1.163291807    10.10.1.2 → 10.10.1.1    TCP 83 52288 → 8081 [PSH, ACK] Seq=1038 Ack=1038 Win=64256 Len=17 TSval=1047208390 TSecr=3171468091
1711548936.175963163   521 1.163325737    10.10.1.1 → 10.10.1.2    TCP 83 8081 → 52288 [PSH, ACK] Seq=1038 Ack=1055 Win=65152 Len=17 TSval=3171468101 TSecr=1047208390
1711548942.175963163   527 1.173484055    10.10.1.2 → 10.10.1.1    TCP 83 52288 → 8081 [PSH, ACK] Seq=1055 Ack=1055 Win=64256 Len=17 TSval=1047208401 TSecr=3171468101
1711548944.175963163   529 1.173519312    10.10.1.1 → 10.10.1.2    TCP 83 8081 → 52288 [PSH, ACK] Seq=1055 Ack=1072 Win=65152 Len=17 TSval=3171468111 TSecr=1047208401
1711548950.175963163   535 1.183673504    10.10.1.2 → 10.10.1.1    TCP 83 52288 → 8081 [PSH, ACK] Seq=1072 Ack=1072 Win=64256 Len=17 TSval=1047208411 TSecr=3171468111
1711548952.175963163   537 1.183706566    10.10.1.1 → 10.10.1.2    TCP 83 8081 → 52288 [PSH, ACK] Seq=1072 Ack=1089 Win=65152 Len=17 TSval=3171468121 TSecr=1047208411
1711548958.175963163   543 1.193861928    10.10.1.2 → 10.10.1.1    TCP 83 52288 → 8081 [PSH, ACK] Seq=1089 Ack=1089 Win=64256 Len=17 TSval=1047208421 TSecr=3171468121
1711548960.175963163   545 1.193895648    10.10.1.1 → 10.10.1.2    TCP 83 8081 → 52288 [PSH, ACK] Seq=1089 Ack=1106 Win=65152 Len=17 TSval=3171468132 TSecr=1047208421
1711548966.175963163   551 1.204050708    10.10.1.2 → 10.10.1.1    TCP 83 52288 → 8081 [PSH, ACK] Seq=1106 Ack=1106 Win=64256 Len=17 TSval=1047208431 TSecr=3171468132
1711548968.175963163   553 1.204082767    10.10.1.1 → 10.10.1.2    TCP 83 8081 → 52288 [PSH, ACK] Seq=1106 Ack=1123 Win=65152 Len=17 TSval=3171468142 TSecr=1047208431
1711548974.175963163   559 1.214239342    10.10.1.2 → 10.10.1.1    TCP 83 52288 → 8081 [PSH, ACK] Seq=1123 Ack=1123 Win=64256 Len=17 TSval=1047208441 TSecr=3171468142
1711548976.175963163   561 1.214274062    10.10.1.1 → 10.10.1.2    TCP 83 8081 → 52288 [PSH, ACK] Seq=1123 Ack=1140 Win=65152 Len=17 TSval=3171468152 TSecr=1047208441
1711548982.175963163   567 1.224429735    10.10.1.2 → 10.10.1.1    TCP 83 52288 → 8081 [PSH, ACK] Seq=1140 Ack=1140 Win=64256 Len=17 TSval=1047208452 TSecr=3171468152
1711548984.175963163   569 1.224466756    10.10.1.1 → 10.10.1.2    TCP 83 8081 → 52288 [PSH, ACK] Seq=1140 Ack=1157 Win=65152 Len=17 TSval=3171468162 TSecr=1047208452
1711548990.175963163   575 1.234623204    10.10.1.2 → 10.10.1.1    TCP 83 52288 → 8081 [PSH, ACK] Seq=1157 Ack=1157 Win=64256 Len=17 TSval=1047208462 TSecr=3171468162
1711548992.175963163   577 1.234659150    10.10.1.1 → 10.10.1.2    TCP 83 8081 → 52288 [PSH, ACK] Seq=1157 Ack=1174 Win=65152 Len=17 TSval=3171468172 TSecr=1047208462
1711548998.175963163   583 1.244813458    10.10.1.2 → 10.10.1.1    TCP 83 52288 → 8081 [PSH, ACK] Seq=1174 Ack=1174 Win=64256 Len=17 TSval=1047208472 TSecr=3171468172
1711549000.175963163   585 1.244848114    10.10.1.1 → 10.10.1.2    TCP 83 8081 → 52288 [PSH, ACK] Seq=1174 Ack=1191 Win=65152 Len=17 TSval=3171468183 TSecr=1047208472
1711549006.175963163   591 1.255003407    10.10.1.2 → 10.10.1.1    TCP 83 52288 → 8081 [PSH, ACK] Seq=1191 Ack=1191 Win=64256 Len=17 TSval=1047208482 TSecr=3171468183
1711549008.175963163   593 1.255037058    10.10.1.1 → 10.10.1.2    TCP 83 8081 → 52288 [PSH, ACK] Seq=1191 Ack=1208 Win=65152 Len=17 TSval=3171468193 TSecr=1047208482
1711549014.175963163   599 1.265191986    10.10.1.2 → 10.10.1.1    TCP 83 52288 → 8081 [PSH, ACK] Seq=1208 Ack=1208 Win=64256 Len=17 TSval=1047208492 TSecr=3171468193
1711549016.175963163   601 1.265226347    10.10.1.1 → 10.10.1.2    TCP 83 8081 → 52288 [PSH, ACK] Seq=1208 Ack=1225 Win=65152 Len=17 TSval=3171468203 TSecr=1047208492
1711549022.175963163   607 1.275380370    10.10.1.2 → 10.10.1.1    TCP 83 52288 → 8081 [PSH, ACK] Seq=1225 Ack=1225 Win=64256 Len=17 TSval=1047208503 TSecr=3171468203
1711549024.175963163   609 1.275413350    10.10.1.1 → 10.10.1.2    TCP 83 8081 → 52288 [PSH, ACK] Seq=1225 Ack=1242 Win=65152 Len=17 TSval=3171468213 TSecr=1047208503
1711549030.175963163   615 1.285569254    10.10.1.2 → 10.10.1.1    TCP 83 52288 → 8081 [PSH, ACK] Seq=1242 Ack=1242 Win=64256 Len=17 TSval=1047208513 TSecr=3171468213
1711549032.175963163   617 1.285604161    10.10.1.1 → 10.10.1.2    TCP 83 8081 → 52288 [PSH, ACK] Seq=1242 Ack=1259 Win=65152 Len=17 TSval=3171468223 TSecr=1047208513
1711549039.175963163   624 1.295759758    10.10.1.2 → 10.10.1.1    TCP 83 52288 → 8081 [PSH, ACK] Seq=1259 Ack=1259 Win=64256 Len=17 TSval=1047208523 TSecr=3171468223
1711549041.175963163   626 1.295834090    10.10.1.1 → 10.10.1.2    TCP 83 8081 → 52288 [PSH, ACK] Seq=1259 Ack=1276 Win=65152 Len=17 TSval=3171468234 TSecr=1047208523
1711549046.175963163   631 1.305990259    10.10.1.2 → 10.10.1.1    TCP 83 52288 → 8081 [PSH, ACK] Seq=1276 Ack=1276 Win=64256 Len=17 TSval=1047208533 TSecr=3171468234
1711549048.175963163   633 1.306024556    10.10.1.1 → 10.10.1.2    TCP 83 8081 → 52288 [PSH, ACK] Seq=1276 Ack=1293 Win=65152 Len=17 TSval=3171468244 TSecr=1047208533
1711549054.175963163   639 1.316179972    10.10.1.2 → 10.10.1.1    TCP 83 52288 → 8081 [PSH, ACK] Seq=1293 Ack=1293 Win=64256 Len=17 TSval=1047208543 TSecr=3171468244
1711549056.175963163   641 1.316213673    10.10.1.1 → 10.10.1.2    TCP 83 8081 → 52288 [PSH, ACK] Seq=1293 Ack=1310 Win=65152 Len=17 TSval=3171468254 TSecr=1047208543
1711549062.175963163   647 1.326371910    10.10.1.2 → 10.10.1.1    TCP 83 52288 → 8081 [PSH, ACK] Seq=1310 Ack=1310 Win=64256 Len=17 TSval=1047208554 TSecr=3171468254
1711549064.175963163   649 1.326405382    10.10.1.1 → 10.10.1.2    TCP 83 8081 → 52288 [PSH, ACK] Seq=1310 Ack=1327 Win=65152 Len=17 TSval=3171468264 TSecr=1047208554
1711549070.175963163   655 1.336560745    10.10.1.2 → 10.10.1.1    TCP 83 52288 → 8081 [PSH, ACK] Seq=1327 Ack=1327 Win=64256 Len=17 TSval=1047208564 TSecr=3171468264
1711549072.175963163   657 1.336594632    10.10.1.1 → 10.10.1.2    TCP 83 8081 → 52288 [PSH, ACK] Seq=1327 Ack=1344 Win=65152 Len=17 TSval=3171468274 TSecr=1047208564
1711549078.175963163   663 1.346749791    10.10.1.2 → 10.10.1.1    TCP 83 52288 → 8081 [PSH, ACK] Seq=1344 Ack=1344 Win=64256 Len=17 TSval=1047208574 TSecr=3171468274
1711549080.175963163   665 1.346783516    10.10.1.1 → 10.10.1.2    TCP 83 8081 → 52288 [PSH, ACK] Seq=1344 Ack=1361 Win=65152 Len=17 TSval=3171468285 TSecr=1047208574
1711549086.175963163   671 1.356940030    10.10.1.2 → 10.10.1.1    TCP 83 52288 → 8081 [PSH, ACK] Seq=1361 Ack=1361 Win=64256 Len=17 TSval=1047208584 TSecr=3171468285
1711549088.175963163   673 1.356974789    10.10.1.1 → 10.10.1.2    TCP 83 8081 → 52288 [PSH, ACK] Seq=1361 Ack=1378 Win=65152 Len=17 TSval=3171468295 TSecr=1047208584
1711549094.175963163   679 1.367132855    10.10.1.2 → 10.10.1.1    TCP 83 52288 → 8081 [PSH, ACK] Seq=1378 Ack=1378 Win=64256 Len=17 TSval=1047208594 TSecr=3171468295
1711549096.175963163   681 1.367168229    10.10.1.1 → 10.10.1.2    TCP 83 8081 → 52288 [PSH, ACK] Seq=1378 Ack=1395 Win=65152 Len=17 TSval=3171468305 TSecr=1047208594
1711549102.175963163   687 1.377323112    10.10.1.2 → 10.10.1.1    TCP 83 52288 → 8081 [PSH, ACK] Seq=1395 Ack=1395 Win=64256 Len=17 TSval=1047208604 TSecr=3171468305
1711549104.175963163   689 1.377357209    10.10.1.1 → 10.10.1.2    TCP 83 8081 → 52288 [PSH, ACK] Seq=1395 Ack=1412 Win=65152 Len=17 TSval=3171468315 TSecr=1047208604
1711549110.175963163   695 1.387512126    10.10.1.2 → 10.10.1.1    TCP 83 52288 → 8081 [PSH, ACK] Seq=1412 Ack=1412 Win=64256 Len=17 TSval=1047208615 TSecr=3171468315
1711549112.175963163   697 1.387547163    10.10.1.1 → 10.10.1.2    TCP 83 8081 → 52288 [PSH, ACK] Seq=1412 Ack=1429 Win=65152 Len=17 TSval=3171468325 TSecr=1047208615
1711549118.175963163   703 1.397704079    10.10.1.2 → 10.10.1.1    TCP 83 52288 → 8081 [PSH, ACK] Seq=1429 Ack=1429 Win=64256 Len=17 TSval=1047208625 TSecr=3171468325
1711549120.175963163   705 1.397740360    10.10.1.1 → 10.10.1.2    TCP 83 8081 → 52288 [PSH, ACK] Seq=1429 Ack=1446 Win=65152 Len=17 TSval=3171468335 TSecr=1047208625
1711549126.175963163   711 1.407893900    10.10.1.2 → 10.10.1.1    TCP 83 52288 → 8081 [PSH, ACK] Seq=1446 Ack=1446 Win=64256 Len=17 TSval=1047208635 TSecr=3171468335
1711549128.175963163   713 1.407928024    10.10.1.1 → 10.10.1.2    TCP 83 8081 → 52288 [PSH, ACK] Seq=1446 Ack=1463 Win=65152 Len=17 TSval=3171468346 TSecr=1047208635
1711549134.175963163   719 1.418081453    10.10.1.2 → 10.10.1.1    TCP 83 52288 → 8081 [PSH, ACK] Seq=1463 Ack=1463 Win=64256 Len=17 TSval=1047208645 TSecr=3171468346
1711549136.175963163   721 1.418115165    10.10.1.1 → 10.10.1.2    TCP 83 8081 → 52288 [PSH, ACK] Seq=1463 Ack=1480 Win=65152 Len=17 TSval=3171468356 TSecr=1047208645
1711549142.175963163   727 1.428269574    10.10.1.2 → 10.10.1.1    TCP 83 52288 → 8081 [PSH, ACK] Seq=1480 Ack=1480 Win=64256 Len=17 TSval=1047208655 TSecr=3171468356
1711549144.175963163   729 1.428305160    10.10.1.1 → 10.10.1.2    TCP 83 8081 → 52288 [PSH, ACK] Seq=1480 Ack=1497 Win=65152 Len=17 TSval=3171468366 TSecr=1047208655
1711549150.175963163   735 1.438460347    10.10.1.2 → 10.10.1.1    TCP 83 52288 → 8081 [PSH, ACK] Seq=1497 Ack=1497 Win=64256 Len=17 TSval=1047208666 TSecr=3171468366
1711549152.175963163   737 1.438494576    10.10.1.1 → 10.10.1.2    TCP 83 8081 → 52288 [PSH, ACK] Seq=1497 Ack=1514 Win=65152 Len=17 TSval=3171468376 TSecr=1047208666
1711549158.175963163   743 1.448648733    10.10.1.2 → 10.10.1.1    TCP 83 52288 → 8081 [PSH, ACK] Seq=1514 Ack=1514 Win=64256 Len=17 TSval=1047208676 TSecr=3171468376
1711549160.175963163   745 1.448682637    10.10.1.1 → 10.10.1.2    TCP 83 8081 → 52288 [PSH, ACK] Seq=1514 Ack=1531 Win=65152 Len=17 TSval=3171468386 TSecr=1047208676
1711549166.175963163   751 1.458835975    10.10.1.2 → 10.10.1.1    TCP 83 52288 → 8081 [PSH, ACK] Seq=1531 Ack=1531 Win=64256 Len=17 TSval=1047208686 TSecr=3171468386
1711549168.175963163   753 1.458870217    10.10.1.1 → 10.10.1.2    TCP 83 8081 → 52288 [PSH, ACK] Seq=1531 Ack=1548 Win=65152 Len=17 TSval=3171468397 TSecr=1047208686
1711549174.175963163   759 1.469025720    10.10.1.2 → 10.10.1.1    TCP 83 52288 → 8081 [PSH, ACK] Seq=1548 Ack=1548 Win=64256 Len=17 TSval=1047208696 TSecr=3171468397
1711549176.175963163   761 1.469059655    10.10.1.1 → 10.10.1.2    TCP 83 8081 → 52288 [PSH, ACK] Seq=1548 Ack=1565 Win=65152 Len=17 TSval=3171468407 TSecr=1047208696
1711549182.175963163   767 1.479215224    10.10.1.2 → 10.10.1.1    TCP 83 52288 → 8081 [PSH, ACK] Seq=1565 Ack=1565 Win=64256 Len=17 TSval=1047208706 TSecr=3171468407
1711549184.175963163   769 1.479248896    10.10.1.1 → 10.10.1.2    TCP 83 8081 → 52288 [PSH, ACK] Seq=1565 Ack=1582 Win=65152 Len=17 TSval=3171468417 TSecr=1047208706
1711549190.175963163   775 1.489403349    10.10.1.2 → 10.10.1.1    TCP 83 52288 → 8081 [PSH, ACK] Seq=1582 Ack=1582 Win=64256 Len=17 TSval=1047208717 TSecr=3171468417
1711549192.175963163   777 1.489437514    10.10.1.1 → 10.10.1.2    TCP 83 8081 → 52288 [PSH, ACK] Seq=1582 Ack=1599 Win=65152 Len=17 TSval=3171468427 TSecr=1047208717
1711549198.175963163   783 1.499595538    10.10.1.2 → 10.10.1.1    TCP 83 52288 → 8081 [PSH, ACK] Seq=1599 Ack=1599 Win=64256 Len=17 TSval=1047208727 TSecr=3171468427
1711549200.175963163   785 1.499629703    10.10.1.1 → 10.10.1.2    TCP 83 8081 → 52288 [PSH, ACK] Seq=1599 Ack=1616 Win=65152 Len=17 TSval=3171468437 TSecr=1047208727
1711549206.175963163   791 1.509785391    10.10.1.2 → 10.10.1.1    TCP 83 52288 → 8081 [PSH, ACK] Seq=1616 Ack=1616 Win=64256 Len=17 TSval=1047208737 TSecr=3171468437
1711549208.175963163   793 1.509819083    10.10.1.1 → 10.10.1.2    TCP 83 8081 → 52288 [PSH, ACK] Seq=1616 Ack=1633 Win=65152 Len=17 TSval=3171468448 TSecr=1047208737
1711549214.175963163   799 1.519975472    10.10.1.2 → 10.10.1.1    TCP 83 52288 → 8081 [PSH, ACK] Seq=1633 Ack=1633 Win=64256 Len=17 TSval=1047208747 TSecr=3171468448
1711549216.175963163   801 1.520009215    10.10.1.1 → 10.10.1.2    TCP 83 8081 → 52288 [PSH, ACK] Seq=1633 Ack=1650 Win=65152 Len=17 TSval=3171468458 TSecr=1047208747
1711549222.175963163   807 1.530163091    10.10.1.2 → 10.10.1.1    TCP 83 52288 → 8081 [PSH, ACK] Seq=1650 Ack=1650 Win=64256 Len=17 TSval=1047208757 TSecr=3171468458
1711549224.175963163   809 1.530196050    10.10.1.1 → 10.10.1.2    TCP 83 8081 → 52288 [PSH, ACK] Seq=1650 Ack=1667 Win=65152 Len=17 TSval=3171468468 TSecr=1047208757
1711549230.175963163   815 1.540354370    10.10.1.2 → 10.10.1.1    TCP 83 52288 → 8081 [PSH, ACK] Seq=1667 Ack=1667 Win=64256 Len=17 TSval=1047208767 TSecr=3171468468
1711549232.175963163   817 1.540387663    10.10.1.1 → 10.10.1.2    TCP 83 8081 → 52288 [PSH, ACK] Seq=1667 Ack=1684 Win=65152 Len=17 TSval=3171468478 TSecr=1047208767
1711549238.175963163   823 1.550543805    10.10.1.2 → 10.10.1.1    TCP 83 52288 → 8081 [PSH, ACK] Seq=1684 Ack=1684 Win=64256 Len=17 TSval=1047208778 TSecr=3171468478
1711549240.175963163   825 1.550578820    10.10.1.1 → 10.10.1.2    TCP 83 8081 → 52288 [PSH, ACK] Seq=1684 Ack=1701 Win=65152 Len=17 TSval=3171468488 TSecr=1047208778
1711549246.175963163   831 1.560734266    10.10.1.2 → 10.10.1.1    TCP 83 52288 → 8081 [PSH, ACK] Seq=1701 Ack=1701 Win=64256 Len=17 TSval=1047208788 TSecr=3171468488
1711549248.175963163   833 1.560768426    10.10.1.1 → 10.10.1.2    TCP 83 8081 → 52288 [PSH, ACK] Seq=1701 Ack=1718 Win=65152 Len=17 TSval=3171468499 TSecr=1047208788
1711549254.175963163   839 1.570923667    10.10.1.2 → 10.10.1.1    TCP 83 52288 → 8081 [PSH, ACK] Seq=1718 Ack=1718 Win=64256 Len=17 TSval=1047208798 TSecr=3171468499
1711549256.175963163   841 1.570957687    10.10.1.1 → 10.10.1.2    TCP 83 8081 → 52288 [PSH, ACK] Seq=1718 Ack=1735 Win=65152 Len=17 TSval=3171468509 TSecr=1047208798
1711549262.175963163   847 1.581112848    10.10.1.2 → 10.10.1.1    TCP 83 52288 → 8081 [PSH, ACK] Seq=1735 Ack=1735 Win=64256 Len=17 TSval=1047208808 TSecr=3171468509
1711549264.175963163   849 1.581147032    10.10.1.1 → 10.10.1.2    TCP 83 8081 → 52288 [PSH, ACK] Seq=1735 Ack=1752 Win=65152 Len=17 TSval=3171468519 TSecr=1047208808
1711549270.175963163   855 1.591302532    10.10.1.2 → 10.10.1.1    TCP 83 52288 → 8081 [PSH, ACK] Seq=1752 Ack=1752 Win=64256 Len=17 TSval=1047208818 TSecr=3171468519
1711549272.175963163   857 1.591336259    10.10.1.1 → 10.10.1.2    TCP 83 8081 → 52288 [PSH, ACK] Seq=1752 Ack=1769 Win=65152 Len=17 TSval=3171468529 TSecr=1047208818
1711549278.175963163   863 1.601493048    10.10.1.2 → 10.10.1.1    TCP 83 52288 → 8081 [PSH, ACK] Seq=1769 Ack=1769 Win=64256 Len=17 TSval=1047208829 TSecr=3171468529
1711549280.175963163   865 1.601527134    10.10.1.1 → 10.10.1.2    TCP 83 8081 → 52288 [PSH, ACK] Seq=1769 Ack=1786 Win=65152 Len=17 TSval=3171468539 TSecr=1047208829
1711549286.175963163   871 1.611681453    10.10.1.2 → 10.10.1.1    TCP 83 52288 → 8081 [PSH, ACK] Seq=1786 Ack=1786 Win=64256 Len=17 TSval=1047208839 TSecr=3171468539
1711549288.175963163   873 1.611715233    10.10.1.1 → 10.10.1.2    TCP 83 8081 → 52288 [PSH, ACK] Seq=1786 Ack=1803 Win=65152 Len=17 TSval=3171468549 TSecr=1047208839
1711549294.175963163   879 1.621868787    10.10.1.2 → 10.10.1.1    TCP 83 52288 → 8081 [PSH, ACK] Seq=1803 Ack=1803 Win=64256 Len=17 TSval=1047208849 TSecr=3171468549
1711549296.175963163   881 1.621902839    10.10.1.1 → 10.10.1.2    TCP 83 8081 → 52288 [PSH, ACK] Seq=1803 Ack=1820 Win=65152 Len=17 TSval=3171468560 TSecr=1047208849
1711549302.175963163   887 1.632057355    10.10.1.2 → 10.10.1.1    TCP 83 52288 → 8081 [PSH, ACK] Seq=1820 Ack=1820 Win=64256 Len=17 TSval=1047208859 TSecr=3171468560
1711549304.175963163   889 1.632091187    10.10.1.1 → 10.10.1.2    TCP 83 8081 → 52288 [PSH, ACK] Seq=1820 Ack=1837 Win=65152 Len=17 TSval=3171468570 TSecr=1047208859
1711549310.175963163   895 1.642246096    10.10.1.2 → 10.10.1.1    TCP 83 52288 → 8081 [PSH, ACK] Seq=1837 Ack=1837 Win=64256 Len=17 TSval=1047208869 TSecr=3171468570
1711549312.175963163   897 1.642278832    10.10.1.1 → 10.10.1.2    TCP 83 8081 → 52288 [PSH, ACK] Seq=1837 Ack=1854 Win=65152 Len=17 TSval=3171468580 TSecr=1047208869
1711549318.175963163   903 1.652434956    10.10.1.2 → 10.10.1.1    TCP 83 52288 → 8081 [PSH, ACK] Seq=1854 Ack=1854 Win=64256 Len=17 TSval=1047208880 TSecr=3171468580
1711549320.175963163   905 1.652468495    10.10.1.1 → 10.10.1.2    TCP 83 8081 → 52288 [PSH, ACK] Seq=1854 Ack=1871 Win=65152 Len=17 TSval=3171468590 TSecr=1047208880
1711549326.175963163   911 1.662623810    10.10.1.2 → 10.10.1.1    TCP 83 52288 → 8081 [PSH, ACK] Seq=1871 Ack=1871 Win=64256 Len=17 TSval=1047208890 TSecr=3171468590
1711549328.175963163   913 1.662657635    10.10.1.1 → 10.10.1.2    TCP 83 8081 → 52288 [PSH, ACK] Seq=1871 Ack=1888 Win=65152 Len=17 TSval=3171468600 TSecr=1047208890
1711549334.175963163   919 1.672812029    10.10.1.2 → 10.10.1.1    TCP 83 52288 → 8081 [PSH, ACK] Seq=1888 Ack=1888 Win=64256 Len=17 TSval=1047208900 TSecr=3171468600
1711549336.175963163   921 1.672845559    10.10.1.1 → 10.10.1.2    TCP 83 8081 → 52288 [PSH, ACK] Seq=1888 Ack=1905 Win=65152 Len=17 TSval=3171468611 TSecr=1047208900
1711549342.175963163   927 1.683000647    10.10.1.2 → 10.10.1.1    TCP 83 52288 → 8081 [PSH, ACK] Seq=1905 Ack=1905 Win=64256 Len=17 TSval=1047208910 TSecr=3171468611
1711549344.175963163   929 1.683034044    10.10.1.1 → 10.10.1.2    TCP 83 8081 → 52288 [PSH, ACK] Seq=1905 Ack=1922 Win=65152 Len=17 TSval=3171468621 TSecr=1047208910
1711549350.175963163   935 1.693192076    10.10.1.2 → 10.10.1.1    TCP 83 52288 → 8081 [PSH, ACK] Seq=1922 Ack=1922 Win=64256 Len=17 TSval=1047208920 TSecr=3171468621
1711549353.175963163   938 1.693264842    10.10.1.1 → 10.10.1.2    TCP 83 8081 → 52288 [PSH, ACK] Seq=1922 Ack=1939 Win=65152 Len=17 TSval=3171468631 TSecr=1047208920
1711549358.175963163   943 1.703422296    10.10.1.2 → 10.10.1.1    TCP 83 52288 → 8081 [PSH, ACK] Seq=1939 Ack=1939 Win=64256 Len=17 TSval=1047208931 TSecr=3171468631
1711549360.175963163   945 1.703457151    10.10.1.1 → 10.10.1.2    TCP 83 8081 → 52288 [PSH, ACK] Seq=1939 Ack=1956 Win=65152 Len=17 TSval=3171468641 TSecr=1047208931
1711549366.175963163   951 1.713613000    10.10.1.2 → 10.10.1.1    TCP 83 52288 → 8081 [PSH, ACK] Seq=1956 Ack=1956 Win=64256 Len=17 TSval=1047208941 TSecr=3171468641
1711549368.175963163   953 1.713646715    10.10.1.1 → 10.10.1.2    TCP 83 8081 → 52288 [PSH, ACK] Seq=1956 Ack=1973 Win=65152 Len=17 TSval=3171468651 TSecr=1047208941
1711549374.175963163   959 1.723801180    10.10.1.2 → 10.10.1.1    TCP 83 52288 → 8081 [PSH, ACK] Seq=1973 Ack=1973 Win=64256 Len=17 TSval=1047208951 TSecr=3171468651
1711549376.175963163   961 1.723835173    10.10.1.1 → 10.10.1.2    TCP 83 8081 → 52288 [PSH, ACK] Seq=1973 Ack=1990 Win=65152 Len=17 TSval=3171468662 TSecr=1047208951
1711549382.175963163   967 1.733990188    10.10.1.2 → 10.10.1.1    TCP 83 52288 → 8081 [PSH, ACK] Seq=1990 Ack=1990 Win=64256 Len=17 TSval=1047208961 TSecr=3171468662
1711549384.175963163   969 1.734023474    10.10.1.1 → 10.10.1.2    TCP 83 8081 → 52288 [PSH, ACK] Seq=1990 Ack=2007 Win=65152 Len=17 TSval=3171468672 TSecr=1047208961
1711549390.175963163   975 1.744179203    10.10.1.2 → 10.10.1.1    TCP 83 52288 → 8081 [PSH, ACK] Seq=2007 Ack=2007 Win=64256 Len=17 TSval=1047208971 TSecr=3171468672
1711549392.175963163   977 1.744213652    10.10.1.1 → 10.10.1.2    TCP 83 8081 → 52288 [PSH, ACK] Seq=2007 Ack=2024 Win=65152 Len=17 TSval=3171468682 TSecr=1047208971
1711549398.175963163   983 1.754371147    10.10.1.2 → 10.10.1.1    TCP 83 52288 → 8081 [PSH, ACK] Seq=2024 Ack=2024 Win=64256 Len=17 TSval=1047208982 TSecr=3171468682
1711549400.175963163   985 1.754404691    10.10.1.1 → 10.10.1.2    TCP 83 8081 → 52288 [PSH, ACK] Seq=2024 Ack=2041 Win=65152 Len=17 TSval=3171468692 TSecr=1047208982
1711549406.175963163   991 1.764559440    10.10.1.2 → 10.10.1.1    TCP 83 52288 → 8081 [PSH, ACK] Seq=2041 Ack=2041 Win=64256 Len=17 TSval=1047208992 TSecr=3171468692
