1711546290.435640574    34 0.532427562    10.10.1.2 → 10.10.1.1    TCP 83 53746 → 8081 [PSH, ACK] Seq=1 Ack=1 Win=64256 Len=17 TSval=1045049046 TSecr=3169308494
1711546294.435640574    38 0.532738544    10.10.1.1 → 10.10.1.2    TCP 83 8081 → 53746 [PSH, ACK] Seq=1 Ack=18 Win=65152 Len=17 TSval=3169308755 TSecr=1045049046
1711546300.435640574    44 0.536682129    10.10.1.2 → 10.10.1.1    TCP 83 53746 → 8081 [PSH, ACK] Seq=18 Ack=18 Win=64256 Len=17 TSval=1045049050 TSecr=3169308755
1711546303.435640574    47 0.536806980    10.10.1.1 → 10.10.1.2    TCP 83 8081 → 53746 [PSH, ACK] Seq=18 Ack=35 Win=65152 Len=17 TSval=3169308759 TSecr=1045049050
1711546308.435640574    52 0.537505241    10.10.1.2 → 10.10.1.1    TCP 83 53746 → 8081 [PSH, ACK] Seq=35 Ack=35 Win=64256 Len=17 TSval=1045049051 TSecr=3169308759
1711546311.435640574    55 0.537629762    10.10.1.1 → 10.10.1.2    TCP 83 8081 → 53746 [PSH, ACK] Seq=35 Ack=52 Win=65152 Len=17 TSval=3169308760 TSecr=1045049051
1711546316.435640574    60 0.549517207    10.10.1.2 → 10.10.1.1    TCP 83 53746 → 8081 [PSH, ACK] Seq=52 Ack=52 Win=64256 Len=17 TSval=1045049063 TSecr=3169308760
1711546319.435640574    63 0.549647437    10.10.1.1 → 10.10.1.2    TCP 83 8081 → 53746 [PSH, ACK] Seq=52 Ack=69 Win=65152 Len=17 TSval=3169308772 TSecr=1045049063
1711546324.435640574    68 0.552035299    10.10.1.2 → 10.10.1.1    TCP 83 53746 → 8081 [PSH, ACK] Seq=69 Ack=69 Win=64256 Len=17 TSval=1045049066 TSecr=3169308772
1711546327.435640574    71 0.552165028    10.10.1.1 → 10.10.1.2    TCP 83 8081 → 53746 [PSH, ACK] Seq=69 Ack=86 Win=65152 Len=17 TSval=3169308774 TSecr=1045049066
1711546332.435640574    76 0.570654116    10.10.1.2 → 10.10.1.1    TCP 83 53746 → 8081 [PSH, ACK] Seq=86 Ack=86 Win=64256 Len=17 TSval=1045049084 TSecr=3169308774
1711546334.435640574    78 0.570786112    10.10.1.1 → 10.10.1.2    TCP 83 8081 → 53746 [PSH, ACK] Seq=86 Ack=103 Win=65152 Len=17 TSval=3169308793 TSecr=1045049084
1711546340.435640574    84 0.578285278    10.10.1.2 → 10.10.1.1    TCP 83 53746 → 8081 [PSH, ACK] Seq=103 Ack=103 Win=64256 Len=17 TSval=1045049092 TSecr=3169308793
1711546342.435640574    86 0.578416298    10.10.1.1 → 10.10.1.2    TCP 83 8081 → 53746 [PSH, ACK] Seq=103 Ack=120 Win=65152 Len=17 TSval=3169308801 TSecr=1045049092
1711546348.435640574    92 0.580157691    10.10.1.2 → 10.10.1.1    TCP 83 53746 → 8081 [PSH, ACK] Seq=120 Ack=120 Win=64256 Len=17 TSval=1045049094 TSecr=3169308801
1711546350.435640574    94 0.580289933    10.10.1.1 → 10.10.1.2    TCP 83 8081 → 53746 [PSH, ACK] Seq=120 Ack=137 Win=65152 Len=17 TSval=3169308802 TSecr=1045049094
1711546356.435640574   100 0.586351036    10.10.1.2 → 10.10.1.1    TCP 83 53746 → 8081 [PSH, ACK] Seq=137 Ack=137 Win=64256 Len=17 TSval=1045049100 TSecr=3169308802
1711546358.435640574   102 0.586481948    10.10.1.1 → 10.10.1.2    TCP 83 8081 → 53746 [PSH, ACK] Seq=137 Ack=154 Win=65152 Len=17 TSval=3169308809 TSecr=1045049100
1711546364.435640574   108 0.591872490    10.10.1.2 → 10.10.1.1    TCP 83 53746 → 8081 [PSH, ACK] Seq=154 Ack=154 Win=64256 Len=17 TSval=1045049106 TSecr=3169308809
1711546366.435640574   110 0.592003349    10.10.1.1 → 10.10.1.2    TCP 83 8081 → 53746 [PSH, ACK] Seq=154 Ack=171 Win=65152 Len=17 TSval=3169308814 TSecr=1045049106
1711546374.435640574   118 0.592364217    10.10.1.2 → 10.10.1.1    TCP 83 53746 → 8081 [PSH, ACK] Seq=171 Ack=171 Win=64256 Len=17 TSval=1045049106 TSecr=3169308814
1711546375.435640574   119 0.592488690    10.10.1.1 → 10.10.1.2    TCP 83 8081 → 53746 [PSH, ACK] Seq=171 Ack=188 Win=65152 Len=17 TSval=3169308815 TSecr=1045049106
1711546380.435640574   124 0.607784287    10.10.1.2 → 10.10.1.1    TCP 83 53746 → 8081 [PSH, ACK] Seq=188 Ack=188 Win=64256 Len=17 TSval=1045049122 TSecr=3169308815
1711546382.435640574   126 0.607914471    10.10.1.1 → 10.10.1.2    TCP 83 8081 → 53746 [PSH, ACK] Seq=188 Ack=205 Win=65152 Len=17 TSval=3169308830 TSecr=1045049122
1711546388.435640574   132 0.624962602    10.10.1.2 → 10.10.1.1    TCP 83 53746 → 8081 [PSH, ACK] Seq=205 Ack=205 Win=64256 Len=17 TSval=1045049139 TSecr=3169308830
1711546390.435640574   134 0.625094502    10.10.1.1 → 10.10.1.2    TCP 83 8081 → 53746 [PSH, ACK] Seq=205 Ack=222 Win=65152 Len=17 TSval=3169308847 TSecr=1045049139
1711546396.435640574   140 0.641913854    10.10.1.2 → 10.10.1.1    TCP 83 53746 → 8081 [PSH, ACK] Seq=222 Ack=222 Win=64256 Len=17 TSval=1045049156 TSecr=3169308847
1711546398.435640574   142 0.642045116    10.10.1.1 → 10.10.1.2    TCP 83 8081 → 53746 [PSH, ACK] Seq=222 Ack=239 Win=65152 Len=17 TSval=3169308864 TSecr=1045049156
1711546404.435640574   148 0.649440016    10.10.1.2 → 10.10.1.1    TCP 83 53746 → 8081 [PSH, ACK] Seq=239 Ack=239 Win=64256 Len=17 TSval=1045049163 TSecr=3169308864
1711546406.435640574   150 0.649570601    10.10.1.1 → 10.10.1.2    TCP 83 8081 → 53746 [PSH, ACK] Seq=239 Ack=256 Win=65152 Len=17 TSval=3169308872 TSecr=1045049163
1711546412.435640574   156 0.659536428    10.10.1.2 → 10.10.1.1    TCP 83 53746 → 8081 [PSH, ACK] Seq=256 Ack=256 Win=64256 Len=17 TSval=1045049173 TSecr=3169308872
1711546414.435640574   158 0.659667464    10.10.1.1 → 10.10.1.2    TCP 83 8081 → 53746 [PSH, ACK] Seq=256 Ack=273 Win=65152 Len=17 TSval=3169308882 TSecr=1045049173
1711546421.435640574   165 0.663928709    10.10.1.2 → 10.10.1.1    TCP 83 53746 → 8081 [PSH, ACK] Seq=273 Ack=273 Win=64256 Len=17 TSval=1045049178 TSecr=3169308882
1711546423.435640574   167 0.664058803    10.10.1.1 → 10.10.1.2    TCP 83 8081 → 53746 [PSH, ACK] Seq=273 Ack=290 Win=65152 Len=17 TSval=3169308886 TSecr=1045049178
1711546428.435640574   172 0.666568961    10.10.1.2 → 10.10.1.1    TCP 83 53746 → 8081 [PSH, ACK] Seq=290 Ack=290 Win=64256 Len=17 TSval=1045049180 TSecr=3169308886
1711546430.435640574   174 0.666693946    10.10.1.1 → 10.10.1.2    TCP 83 8081 → 53746 [PSH, ACK] Seq=290 Ack=307 Win=65152 Len=17 TSval=3169308889 TSecr=1045049180
1711546436.435640574   180 0.669102894    10.10.1.2 → 10.10.1.1    TCP 83 53746 → 8081 [PSH, ACK] Seq=307 Ack=307 Win=64256 Len=17 TSval=1045049183 TSecr=3169308889
1711546438.435640574   182 0.669233290    10.10.1.1 → 10.10.1.2    TCP 83 8081 → 53746 [PSH, ACK] Seq=307 Ack=324 Win=65152 Len=17 TSval=3169308891 TSecr=1045049183
1711546444.435640574   188 0.683465642    10.10.1.2 → 10.10.1.1    TCP 83 53746 → 8081 [PSH, ACK] Seq=324 Ack=324 Win=64256 Len=17 TSval=1045049197 TSecr=3169308891
1711546447.435640574   191 0.683597837    10.10.1.1 → 10.10.1.2    TCP 83 8081 → 53746 [PSH, ACK] Seq=324 Ack=341 Win=65152 Len=17 TSval=3169308906 TSecr=1045049197
1711546452.435640574   196 0.687034200    10.10.1.2 → 10.10.1.1    TCP 83 53746 → 8081 [PSH, ACK] Seq=341 Ack=341 Win=64256 Len=17 TSval=1045049201 TSecr=3169308906
1711546454.435640574   198 0.687159576    10.10.1.1 → 10.10.1.2    TCP 83 8081 → 53746 [PSH, ACK] Seq=341 Ack=358 Win=65152 Len=17 TSval=3169308909 TSecr=1045049201
1711546460.435640574   204 0.704271437    10.10.1.2 → 10.10.1.1    TCP 83 53746 → 8081 [PSH, ACK] Seq=358 Ack=358 Win=64256 Len=17 TSval=1045049218 TSecr=3169308909
1711546462.435640574   206 0.704405749    10.10.1.1 → 10.10.1.2    TCP 83 8081 → 53746 [PSH, ACK] Seq=358 Ack=375 Win=65152 Len=17 TSval=3169308927 TSecr=1045049218
1711546468.435640574   212 0.712998965    10.10.1.2 → 10.10.1.1    TCP 83 53746 → 8081 [PSH, ACK] Seq=375 Ack=375 Win=64256 Len=17 TSval=1045049227 TSecr=3169308927
1711546470.435640574   214 0.713129710    10.10.1.1 → 10.10.1.2    TCP 83 8081 → 53746 [PSH, ACK] Seq=375 Ack=392 Win=65152 Len=17 TSval=3169308935 TSecr=1045049227
1711546476.435640574   220 0.731780096    10.10.1.2 → 10.10.1.1    TCP 83 53746 → 8081 [PSH, ACK] Seq=392 Ack=392 Win=64256 Len=17 TSval=1045049246 TSecr=3169308935
1711546478.435640574   222 0.731911021    10.10.1.1 → 10.10.1.2    TCP 83 8081 → 53746 [PSH, ACK] Seq=392 Ack=409 Win=65152 Len=17 TSval=3169308954 TSecr=1045049246
1711546484.435640574   228 0.758268097    10.10.1.2 → 10.10.1.1    TCP 83 53746 → 8081 [PSH, ACK] Seq=409 Ack=409 Win=64256 Len=17 TSval=1045049272 TSecr=3169308954
1711546486.435640574   230 0.758391485    10.10.1.1 → 10.10.1.2    TCP 83 8081 → 53746 [PSH, ACK] Seq=409 Ack=426 Win=65152 Len=17 TSval=3169308980 TSecr=1045049272
1711546491.435640574   235 0.778638517    10.10.1.2 → 10.10.1.1    TCP 83 53746 → 8081 [PSH, ACK] Seq=426 Ack=426 Win=64256 Len=17 TSval=1045049292 TSecr=3169308980
1711546493.435640574   237 0.778769320    10.10.1.1 → 10.10.1.2    TCP 83 8081 → 53746 [PSH, ACK] Seq=426 Ack=443 Win=65152 Len=17 TSval=3169309001 TSecr=1045049292
1711546499.435640574   243 0.782416948    10.10.1.2 → 10.10.1.1    TCP 83 53746 → 8081 [PSH, ACK] Seq=443 Ack=443 Win=64256 Len=17 TSval=1045049296 TSecr=3169309001
1711546501.435640574   245 0.782546469    10.10.1.1 → 10.10.1.2    TCP 83 8081 → 53746 [PSH, ACK] Seq=443 Ack=460 Win=65152 Len=17 TSval=3169309005 TSecr=1045049296
1711546508.435640574   252 0.783254466    10.10.1.2 → 10.10.1.1    TCP 83 53746 → 8081 [PSH, ACK] Seq=460 Ack=460 Win=64256 Len=17 TSval=1045049297 TSecr=3169309005
1711546510.435640574   254 0.783378961    10.10.1.1 → 10.10.1.2    TCP 83 8081 → 53746 [PSH, ACK] Seq=460 Ack=477 Win=65152 Len=17 TSval=3169309005 TSecr=1045049297
1711546515.435640574   259 0.805195952    10.10.1.2 → 10.10.1.1    TCP 83 53746 → 8081 [PSH, ACK] Seq=477 Ack=477 Win=64256 Len=17 TSval=1045049319 TSecr=3169309005
1711546517.435640574   261 0.805326020    10.10.1.1 → 10.10.1.2    TCP 83 8081 → 53746 [PSH, ACK] Seq=477 Ack=494 Win=65152 Len=17 TSval=3169309027 TSecr=1045049319
1711546523.435640574   267 0.812247002    10.10.1.2 → 10.10.1.1    TCP 83 53746 → 8081 [PSH, ACK] Seq=494 Ack=494 Win=64256 Len=17 TSval=1045049326 TSecr=3169309027
1711546525.435640574   269 0.812377720    10.10.1.1 → 10.10.1.2    TCP 83 8081 → 53746 [PSH, ACK] Seq=494 Ack=511 Win=65152 Len=17 TSval=3169309034 TSecr=1045049326
1711546531.435640574   275 0.813692432    10.10.1.2 → 10.10.1.1    TCP 83 53746 → 8081 [PSH, ACK] Seq=511 Ack=511 Win=64256 Len=17 TSval=1045049327 TSecr=3169309034
1711546533.435640574   277 0.813813506    10.10.1.1 → 10.10.1.2    TCP 83 8081 → 53746 [PSH, ACK] Seq=511 Ack=528 Win=65152 Len=17 TSval=3169309036 TSecr=1045049327
1711546539.435640574   283 0.822338262    10.10.1.2 → 10.10.1.1    TCP 83 53746 → 8081 [PSH, ACK] Seq=528 Ack=528 Win=64256 Len=17 TSval=1045049336 TSecr=3169309036
1711546541.435640574   285 0.822469561    10.10.1.1 → 10.10.1.2    TCP 83 8081 → 53746 [PSH, ACK] Seq=528 Ack=545 Win=65152 Len=17 TSval=3169309045 TSecr=1045049336
1711546547.435640574   291 0.838771564    10.10.1.2 → 10.10.1.1    TCP 83 53746 → 8081 [PSH, ACK] Seq=545 Ack=545 Win=64256 Len=17 TSval=1045049353 TSecr=3169309045
1711546549.435640574   293 0.838902672    10.10.1.1 → 10.10.1.2    TCP 83 8081 → 53746 [PSH, ACK] Seq=545 Ack=562 Win=65152 Len=17 TSval=3169309061 TSecr=1045049353
1711546555.435640574   299 0.840751101    10.10.1.2 → 10.10.1.1    TCP 83 53746 → 8081 [PSH, ACK] Seq=562 Ack=562 Win=64256 Len=17 TSval=1045049355 TSecr=3169309061
1711546557.435640574   301 0.840881690    10.10.1.1 → 10.10.1.2    TCP 83 8081 → 53746 [PSH, ACK] Seq=562 Ack=579 Win=65152 Len=17 TSval=3169309063 TSecr=1045049355
1711546563.435640574   307 0.844006436    10.10.1.2 → 10.10.1.1    TCP 83 53746 → 8081 [PSH, ACK] Seq=579 Ack=579 Win=64256 Len=17 TSval=1045049358 TSecr=3169309063
1711546565.435640574   309 0.844136048    10.10.1.1 → 10.10.1.2    TCP 83 8081 → 53746 [PSH, ACK] Seq=579 Ack=596 Win=65152 Len=17 TSval=3169309066 TSecr=1045049358
1711546572.435640574   316 0.898530154    10.10.1.2 → 10.10.1.1    TCP 83 53746 → 8081 [PSH, ACK] Seq=596 Ack=596 Win=64256 Len=17 TSval=1045049412 TSecr=3169309066
1711546574.435640574   318 0.898650636    10.10.1.1 → 10.10.1.2    TCP 83 8081 → 53746 [PSH, ACK] Seq=596 Ack=613 Win=65152 Len=17 TSval=3169309121 TSecr=1045049412
1711546581.435640574   325 0.945314970    10.10.1.2 → 10.10.1.1    TCP 83 53746 → 8081 [PSH, ACK] Seq=613 Ack=613 Win=64256 Len=17 TSval=1045049459 TSecr=3169309121
1711546583.435640574   327 0.945440010    10.10.1.1 → 10.10.1.2    TCP 83 8081 → 53746 [PSH, ACK] Seq=613 Ack=630 Win=65152 Len=17 TSval=3169309168 TSecr=1045049459
1711546590.435640574   334 0.960369520    10.10.1.2 → 10.10.1.1    TCP 83 53746 → 8081 [PSH, ACK] Seq=630 Ack=630 Win=64256 Len=17 TSval=1045049474 TSecr=3169309168
1711546592.435640574   336 0.960494437    10.10.1.1 → 10.10.1.2    TCP 83 8081 → 53746 [PSH, ACK] Seq=630 Ack=647 Win=65152 Len=17 TSval=3169309183 TSecr=1045049474
1711546598.435640574   342 0.962182200    10.10.1.2 → 10.10.1.1    TCP 83 53746 → 8081 [PSH, ACK] Seq=647 Ack=647 Win=64256 Len=17 TSval=1045049476 TSecr=3169309183
1711546600.435640574   344 0.962308156    10.10.1.1 → 10.10.1.2    TCP 83 8081 → 53746 [PSH, ACK] Seq=647 Ack=664 Win=65152 Len=17 TSval=3169309184 TSecr=1045049476
1711546606.435640574   350 0.968198970    10.10.1.2 → 10.10.1.1    TCP 83 53746 → 8081 [PSH, ACK] Seq=664 Ack=664 Win=64256 Len=17 TSval=1045049482 TSecr=3169309184
1711546608.435640574   352 0.968329412    10.10.1.1 → 10.10.1.2    TCP 83 8081 → 53746 [PSH, ACK] Seq=664 Ack=681 Win=65152 Len=17 TSval=3169309190 TSecr=1045049482
1711546614.435640574   358 0.970458032    10.10.1.2 → 10.10.1.1    TCP 83 53746 → 8081 [PSH, ACK] Seq=681 Ack=681 Win=64256 Len=17 TSval=1045049484 TSecr=3169309190
1711546616.435640574   360 0.970583077    10.10.1.1 → 10.10.1.2    TCP 83 8081 → 53746 [PSH, ACK] Seq=681 Ack=698 Win=65152 Len=17 TSval=3169309193 TSecr=1045049484
1711546622.435640574   366 0.972445372    10.10.1.2 → 10.10.1.1    TCP 83 53746 → 8081 [PSH, ACK] Seq=698 Ack=698 Win=64256 Len=17 TSval=1045049486 TSecr=3169309193
1711546624.435640574   368 0.972575986    10.10.1.1 → 10.10.1.2    TCP 83 8081 → 53746 [PSH, ACK] Seq=698 Ack=715 Win=65152 Len=17 TSval=3169309195 TSecr=1045049486
1711546630.435640574   374 0.975167632    10.10.1.2 → 10.10.1.1    TCP 83 53746 → 8081 [PSH, ACK] Seq=715 Ack=715 Win=64256 Len=17 TSval=1045049489 TSecr=3169309195
1711546632.435640574   376 0.975293152    10.10.1.1 → 10.10.1.2    TCP 83 8081 → 53746 [PSH, ACK] Seq=715 Ack=732 Win=65152 Len=17 TSval=3169309197 TSecr=1045049489
1711546638.435640574   382 1.020580422    10.10.1.2 → 10.10.1.1    TCP 83 53746 → 8081 [PSH, ACK] Seq=732 Ack=732 Win=64256 Len=17 TSval=1045049534 TSecr=3169309197
1711546640.435640574   384 1.020710963    10.10.1.1 → 10.10.1.2    TCP 83 8081 → 53746 [PSH, ACK] Seq=732 Ack=749 Win=65152 Len=17 TSval=3169309243 TSecr=1045049534
1711546646.435640574   390 1.053736488    10.10.1.2 → 10.10.1.1    TCP 83 53746 → 8081 [PSH, ACK] Seq=749 Ack=749 Win=64256 Len=17 TSval=1045049568 TSecr=3169309243
1711546648.435640574   392 1.053868875    10.10.1.1 → 10.10.1.2    TCP 83 8081 → 53746 [PSH, ACK] Seq=749 Ack=766 Win=65152 Len=17 TSval=3169309276 TSecr=1045049568
1711546654.435640574   398 1.066980090    10.10.1.2 → 10.10.1.1    TCP 83 53746 → 8081 [PSH, ACK] Seq=766 Ack=766 Win=64256 Len=17 TSval=1045049581 TSecr=3169309276
1711546656.435640574   400 1.067111177    10.10.1.1 → 10.10.1.2    TCP 83 8081 → 53746 [PSH, ACK] Seq=766 Ack=783 Win=65152 Len=17 TSval=3169309289 TSecr=1045049581
1711546662.435640574   406 1.076826327    10.10.1.2 → 10.10.1.1    TCP 83 53746 → 8081 [PSH, ACK] Seq=783 Ack=783 Win=64256 Len=17 TSval=1045049591 TSecr=3169309289
1711546665.435640574   409 1.076973422    10.10.1.1 → 10.10.1.2    TCP 83 8081 → 53746 [PSH, ACK] Seq=783 Ack=800 Win=65152 Len=17 TSval=3169309299 TSecr=1045049591
1711546670.435640574   414 1.080686410    10.10.1.2 → 10.10.1.1    TCP 83 53746 → 8081 [PSH, ACK] Seq=800 Ack=800 Win=64256 Len=17 TSval=1045049594 TSecr=3169309299
1711546672.435640574   416 1.080817372    10.10.1.1 → 10.10.1.2    TCP 83 8081 → 53746 [PSH, ACK] Seq=800 Ack=817 Win=65152 Len=17 TSval=3169309303 TSecr=1045049594
1711546678.435640574   422 1.107667689    10.10.1.2 → 10.10.1.1    TCP 83 53746 → 8081 [PSH, ACK] Seq=817 Ack=817 Win=64256 Len=17 TSval=1045049621 TSecr=3169309303
1711546680.435640574   424 1.107799035    10.10.1.1 → 10.10.1.2    TCP 83 8081 → 53746 [PSH, ACK] Seq=817 Ack=834 Win=65152 Len=17 TSval=3169309330 TSecr=1045049621
1711546686.435640574   430 1.124669167    10.10.1.2 → 10.10.1.1    TCP 83 53746 → 8081 [PSH, ACK] Seq=834 Ack=834 Win=64256 Len=17 TSval=1045049638 TSecr=3169309330
1711546688.435640574   432 1.124800429    10.10.1.1 → 10.10.1.2    TCP 83 8081 → 53746 [PSH, ACK] Seq=834 Ack=851 Win=65152 Len=17 TSval=3169309347 TSecr=1045049638
1711546695.435640574   439 1.125512660    10.10.1.2 → 10.10.1.1    TCP 83 53746 → 8081 [PSH, ACK] Seq=851 Ack=851 Win=64256 Len=17 TSval=1045049639 TSecr=3169309347
1711546697.435640574   441 1.125637680    10.10.1.1 → 10.10.1.2    TCP 83 8081 → 53746 [PSH, ACK] Seq=851 Ack=868 Win=65152 Len=17 TSval=3169309348 TSecr=1045049639
1711546702.435640574   446 1.128156523    10.10.1.2 → 10.10.1.1    TCP 83 53746 → 8081 [PSH, ACK] Seq=868 Ack=868 Win=64256 Len=17 TSval=1045049642 TSecr=3169309348
1711546704.435640574   448 1.128287031    10.10.1.1 → 10.10.1.2    TCP 83 8081 → 53746 [PSH, ACK] Seq=868 Ack=885 Win=65152 Len=17 TSval=3169309350 TSecr=1045049642
1711546710.435640574   454 1.138368821    10.10.1.2 → 10.10.1.1    TCP 83 53746 → 8081 [PSH, ACK] Seq=885 Ack=885 Win=64256 Len=17 TSval=1045049652 TSecr=3169309350
1711546712.435640574   456 1.138499800    10.10.1.1 → 10.10.1.2    TCP 83 8081 → 53746 [PSH, ACK] Seq=885 Ack=902 Win=65152 Len=17 TSval=3169309361 TSecr=1045049652
1711546718.435640574   462 1.148282588    10.10.1.2 → 10.10.1.1    TCP 83 53746 → 8081 [PSH, ACK] Seq=902 Ack=902 Win=64256 Len=17 TSval=1045049662 TSecr=3169309361
1711546720.435640574   464 1.148412733    10.10.1.1 → 10.10.1.2    TCP 83 8081 → 53746 [PSH, ACK] Seq=902 Ack=919 Win=65152 Len=17 TSval=3169309371 TSecr=1045049662
1711546728.435640574   472 1.149110166    10.10.1.2 → 10.10.1.1    TCP 83 53746 → 8081 [PSH, ACK] Seq=919 Ack=919 Win=64256 Len=17 TSval=1045049663 TSecr=3169309371
1711546729.435640574   473 1.149236055    10.10.1.1 → 10.10.1.2    TCP 83 8081 → 53746 [PSH, ACK] Seq=919 Ack=936 Win=65152 Len=17 TSval=3169309371 TSecr=1045049663
1711546734.435640574   478 1.157529273    10.10.1.2 → 10.10.1.1    TCP 83 53746 → 8081 [PSH, ACK] Seq=936 Ack=936 Win=64256 Len=17 TSval=1045049671 TSecr=3169309371
1711546736.435640574   480 1.157660835    10.10.1.1 → 10.10.1.2    TCP 83 8081 → 53746 [PSH, ACK] Seq=936 Ack=953 Win=65152 Len=17 TSval=3169309380 TSecr=1045049671
1711546742.435640574   486 1.164432922    10.10.1.2 → 10.10.1.1    TCP 83 53746 → 8081 [PSH, ACK] Seq=953 Ack=953 Win=64256 Len=17 TSval=1045049678 TSecr=3169309380
1711546745.435640574   489 1.164984725    10.10.1.1 → 10.10.1.2    TCP 83 8081 → 53746 [PSH, ACK] Seq=953 Ack=970 Win=65152 Len=17 TSval=3169309387 TSecr=1045049678
1711546749.435640574   493 1.169279294    10.10.1.2 → 10.10.1.1    TCP 83 53746 → 8081 [PSH, ACK] Seq=970 Ack=970 Win=64256 Len=17 TSval=1045049683 TSecr=3169309387
1711546751.435640574   495 1.169412075    10.10.1.1 → 10.10.1.2    TCP 83 8081 → 53746 [PSH, ACK] Seq=970 Ack=987 Win=65152 Len=17 TSval=3169309392 TSecr=1045049683
1711546757.435640574   501 1.178869201    10.10.1.2 → 10.10.1.1    TCP 83 53746 → 8081 [PSH, ACK] Seq=987 Ack=987 Win=64256 Len=17 TSval=1045049693 TSecr=3169309392
1711546760.435640574   504 1.178998501    10.10.1.1 → 10.10.1.2    TCP 83 8081 → 53746 [PSH, ACK] Seq=987 Ack=1004 Win=65152 Len=17 TSval=3169309401 TSecr=1045049693
1711546765.435640574   509 1.183715765    10.10.1.2 → 10.10.1.1    TCP 83 53746 → 8081 [PSH, ACK] Seq=1004 Ack=1004 Win=64256 Len=17 TSval=1045049698 TSecr=3169309401
1711546767.435640574   511 1.183850152    10.10.1.1 → 10.10.1.2    TCP 83 8081 → 53746 [PSH, ACK] Seq=1004 Ack=1021 Win=65152 Len=17 TSval=3169309406 TSecr=1045049698
1711546773.435640574   517 1.201630369    10.10.1.2 → 10.10.1.1    TCP 83 53746 → 8081 [PSH, ACK] Seq=1021 Ack=1021 Win=64256 Len=17 TSval=1045049715 TSecr=3169309406
1711546775.435640574   519 1.201762700    10.10.1.1 → 10.10.1.2    TCP 83 8081 → 53746 [PSH, ACK] Seq=1021 Ack=1038 Win=65152 Len=17 TSval=3169309424 TSecr=1045049715
1711546781.435640574   525 1.214286120    10.10.1.2 → 10.10.1.1    TCP 83 53746 → 8081 [PSH, ACK] Seq=1038 Ack=1038 Win=64256 Len=17 TSval=1045049728 TSecr=3169309424
1711546783.435640574   527 1.214414950    10.10.1.1 → 10.10.1.2    TCP 83 8081 → 53746 [PSH, ACK] Seq=1038 Ack=1055 Win=65152 Len=17 TSval=3169309437 TSecr=1045049728
1711546789.435640574   533 1.241278660    10.10.1.2 → 10.10.1.1    TCP 83 53746 → 8081 [PSH, ACK] Seq=1055 Ack=1055 Win=64256 Len=17 TSval=1045049755 TSecr=3169309437
1711546791.435640574   535 1.241408547    10.10.1.1 → 10.10.1.2    TCP 83 8081 → 53746 [PSH, ACK] Seq=1055 Ack=1072 Win=65152 Len=17 TSval=3169309464 TSecr=1045049755
1711546797.435640574   541 1.251493065    10.10.1.2 → 10.10.1.1    TCP 83 53746 → 8081 [PSH, ACK] Seq=1072 Ack=1072 Win=64256 Len=17 TSval=1045049765 TSecr=3169309464
1711546799.435640574   543 1.251622394    10.10.1.1 → 10.10.1.2    TCP 83 8081 → 53746 [PSH, ACK] Seq=1072 Ack=1089 Win=65152 Len=17 TSval=3169309474 TSecr=1045049765
1711546805.435640574   549 1.271442591    10.10.1.2 → 10.10.1.1    TCP 83 53746 → 8081 [PSH, ACK] Seq=1089 Ack=1089 Win=64256 Len=17 TSval=1045049785 TSecr=3169309474
1711546807.435640574   551 1.271573212    10.10.1.1 → 10.10.1.2    TCP 83 8081 → 53746 [PSH, ACK] Seq=1089 Ack=1106 Win=65152 Len=17 TSval=3169309494 TSecr=1045049785
1711546813.435640574   557 1.273809883    10.10.1.2 → 10.10.1.1    TCP 83 53746 → 8081 [PSH, ACK] Seq=1106 Ack=1106 Win=64256 Len=17 TSval=1045049788 TSecr=3169309494
1711546815.435640574   559 1.273934761    10.10.1.1 → 10.10.1.2    TCP 83 8081 → 53746 [PSH, ACK] Seq=1106 Ack=1123 Win=65152 Len=17 TSval=3169309496 TSecr=1045049788
1711546821.435640574   565 1.283902960    10.10.1.2 → 10.10.1.1    TCP 83 53746 → 8081 [PSH, ACK] Seq=1123 Ack=1123 Win=64256 Len=17 TSval=1045049798 TSecr=3169309496
1711546823.435640574   567 1.284033202    10.10.1.1 → 10.10.1.2    TCP 83 8081 → 53746 [PSH, ACK] Seq=1123 Ack=1140 Win=65152 Len=17 TSval=3169309506 TSecr=1045049798
1711546829.435640574   573 1.303191341    10.10.1.2 → 10.10.1.1    TCP 83 53746 → 8081 [PSH, ACK] Seq=1140 Ack=1140 Win=64256 Len=17 TSval=1045049817 TSecr=3169309506
1711546831.435640574   575 1.303321079    10.10.1.1 → 10.10.1.2    TCP 83 8081 → 53746 [PSH, ACK] Seq=1140 Ack=1157 Win=65152 Len=17 TSval=3169309525 TSecr=1045049817
1711546837.435640574   581 1.334333943    10.10.1.2 → 10.10.1.1    TCP 83 53746 → 8081 [PSH, ACK] Seq=1157 Ack=1157 Win=64256 Len=17 TSval=1045049848 TSecr=3169309525
1711546839.435640574   583 1.334464834    10.10.1.1 → 10.10.1.2    TCP 83 8081 → 53746 [PSH, ACK] Seq=1157 Ack=1174 Win=65152 Len=17 TSval=3169309557 TSecr=1045049848
1711546846.435640574   590 1.348972693    10.10.1.2 → 10.10.1.1    TCP 83 53746 → 8081 [PSH, ACK] Seq=1174 Ack=1174 Win=64256 Len=17 TSval=1045049863 TSecr=3169309557
1711546848.435640574   592 1.349103188    10.10.1.1 → 10.10.1.2    TCP 83 8081 → 53746 [PSH, ACK] Seq=1174 Ack=1191 Win=65152 Len=17 TSval=3169309571 TSecr=1045049863
1711546854.435640574   598 1.352638107    10.10.1.2 → 10.10.1.1    TCP 83 53746 → 8081 [PSH, ACK] Seq=1191 Ack=1191 Win=64256 Len=17 TSval=1045049866 TSecr=3169309571
1711546856.435640574   600 1.352769876    10.10.1.1 → 10.10.1.2    TCP 83 8081 → 53746 [PSH, ACK] Seq=1191 Ack=1208 Win=65152 Len=17 TSval=3169309575 TSecr=1045049866
1711546862.435640574   606 1.354355712    10.10.1.2 → 10.10.1.1    TCP 83 53746 → 8081 [PSH, ACK] Seq=1208 Ack=1208 Win=64256 Len=17 TSval=1045049868 TSecr=3169309575
1711546864.435640574   608 1.354480901    10.10.1.1 → 10.10.1.2    TCP 83 8081 → 53746 [PSH, ACK] Seq=1208 Ack=1225 Win=65152 Len=17 TSval=3169309577 TSecr=1045049868
1711546870.435640574   614 1.379121188    10.10.1.2 → 10.10.1.1    TCP 83 53746 → 8081 [PSH, ACK] Seq=1225 Ack=1225 Win=64256 Len=17 TSval=1045049893 TSecr=3169309577
1711546872.435640574   616 1.379252191    10.10.1.1 → 10.10.1.2    TCP 83 8081 → 53746 [PSH, ACK] Seq=1225 Ack=1242 Win=65152 Len=17 TSval=3169309601 TSecr=1045049893
1711546878.435640574   622 1.386299938    10.10.1.2 → 10.10.1.1    TCP 83 53746 → 8081 [PSH, ACK] Seq=1242 Ack=1242 Win=64256 Len=17 TSval=1045049900 TSecr=3169309601
1711546880.435640574   624 1.386429185    10.10.1.1 → 10.10.1.2    TCP 83 8081 → 53746 [PSH, ACK] Seq=1242 Ack=1259 Win=65152 Len=17 TSval=3169309609 TSecr=1045049900
1711546886.435640574   630 1.387891183    10.10.1.2 → 10.10.1.1    TCP 83 53746 → 8081 [PSH, ACK] Seq=1259 Ack=1259 Win=64256 Len=17 TSval=1045049902 TSecr=3169309609
1711546888.435640574   632 1.388020823    10.10.1.1 → 10.10.1.2    TCP 83 8081 → 53746 [PSH, ACK] Seq=1259 Ack=1276 Win=65152 Len=17 TSval=3169309610 TSecr=1045049902
1711546894.435640574   638 1.409074468    10.10.1.2 → 10.10.1.1    TCP 83 53746 → 8081 [PSH, ACK] Seq=1276 Ack=1276 Win=64256 Len=17 TSval=1045049923 TSecr=3169309610
1711546896.435640574   640 1.409204543    10.10.1.1 → 10.10.1.2    TCP 83 8081 → 53746 [PSH, ACK] Seq=1276 Ack=1293 Win=65152 Len=17 TSval=3169309631 TSecr=1045049923
1711546902.435640574   646 1.411897874    10.10.1.2 → 10.10.1.1    TCP 83 53746 → 8081 [PSH, ACK] Seq=1293 Ack=1293 Win=64256 Len=17 TSval=1045049926 TSecr=3169309631
1711546904.435640574   648 1.412027589    10.10.1.1 → 10.10.1.2    TCP 83 8081 → 53746 [PSH, ACK] Seq=1293 Ack=1310 Win=65152 Len=17 TSval=3169309634 TSecr=1045049926
1711546910.435640574   654 1.425373086    10.10.1.2 → 10.10.1.1    TCP 83 53746 → 8081 [PSH, ACK] Seq=1310 Ack=1310 Win=64256 Len=17 TSval=1045049939 TSecr=3169309634
1711546912.435640574   656 1.425504712    10.10.1.1 → 10.10.1.2    TCP 83 8081 → 53746 [PSH, ACK] Seq=1310 Ack=1327 Win=65152 Len=17 TSval=3169309648 TSecr=1045049939
1711546918.435640574   662 1.427591524    10.10.1.2 → 10.10.1.1    TCP 83 53746 → 8081 [PSH, ACK] Seq=1327 Ack=1327 Win=64256 Len=17 TSval=1045049941 TSecr=3169309648
1711546920.435640574   664 1.427722204    10.10.1.1 → 10.10.1.2    TCP 83 8081 → 53746 [PSH, ACK] Seq=1327 Ack=1344 Win=65152 Len=17 TSval=3169309650 TSecr=1045049941
1711546926.435640574   670 1.429559871    10.10.1.2 → 10.10.1.1    TCP 83 53746 → 8081 [PSH, ACK] Seq=1344 Ack=1344 Win=64256 Len=17 TSval=1045049943 TSecr=3169309650
1711546928.435640574   672 1.429685402    10.10.1.1 → 10.10.1.2    TCP 83 8081 → 53746 [PSH, ACK] Seq=1344 Ack=1361 Win=65152 Len=17 TSval=3169309652 TSecr=1045049943
1711546934.435640574   678 1.437711346    10.10.1.2 → 10.10.1.1    TCP 83 53746 → 8081 [PSH, ACK] Seq=1361 Ack=1361 Win=64256 Len=17 TSval=1045049951 TSecr=3169309652
1711546936.435640574   680 1.437843383    10.10.1.1 → 10.10.1.2    TCP 83 8081 → 53746 [PSH, ACK] Seq=1361 Ack=1378 Win=65152 Len=17 TSval=3169309660 TSecr=1045049951
1711546942.435640574   686 1.440540681    10.10.1.2 → 10.10.1.1    TCP 83 53746 → 8081 [PSH, ACK] Seq=1378 Ack=1378 Win=64256 Len=17 TSval=1045049954 TSecr=3169309660
1711546944.435640574   688 1.440670716    10.10.1.1 → 10.10.1.2    TCP 83 8081 → 53746 [PSH, ACK] Seq=1378 Ack=1395 Win=65152 Len=17 TSval=3169309663 TSecr=1045049954
1711546950.435640574   694 1.445283596    10.10.1.2 → 10.10.1.1    TCP 83 53746 → 8081 [PSH, ACK] Seq=1395 Ack=1395 Win=64256 Len=17 TSval=1045049959 TSecr=3169309663
1711546952.435640574   696 1.445413539    10.10.1.1 → 10.10.1.2    TCP 83 8081 → 53746 [PSH, ACK] Seq=1395 Ack=1412 Win=65152 Len=17 TSval=3169309668 TSecr=1045049959
1711546958.435640574   702 1.447483456    10.10.1.2 → 10.10.1.1    TCP 83 53746 → 8081 [PSH, ACK] Seq=1412 Ack=1412 Win=64256 Len=17 TSval=1045049961 TSecr=3169309668
1711546960.435640574   704 1.447613625    10.10.1.1 → 10.10.1.2    TCP 83 8081 → 53746 [PSH, ACK] Seq=1412 Ack=1429 Win=65152 Len=17 TSval=3169309670 TSecr=1045049961
1711546966.435640574   710 1.465927204    10.10.1.2 → 10.10.1.1    TCP 83 53746 → 8081 [PSH, ACK] Seq=1429 Ack=1429 Win=64256 Len=17 TSval=1045049980 TSecr=3169309670
1711546968.435640574   712 1.466057526    10.10.1.1 → 10.10.1.2    TCP 83 8081 → 53746 [PSH, ACK] Seq=1429 Ack=1446 Win=65152 Len=17 TSval=3169309688 TSecr=1045049980
1711546974.435640574   718 1.471464442    10.10.1.2 → 10.10.1.1    TCP 83 53746 → 8081 [PSH, ACK] Seq=1446 Ack=1446 Win=64256 Len=17 TSval=1045049985 TSecr=3169309688
1711546976.435640574   720 1.471593982    10.10.1.1 → 10.10.1.2    TCP 83 8081 → 53746 [PSH, ACK] Seq=1446 Ack=1463 Win=65152 Len=17 TSval=3169309694 TSecr=1045049985
1711546982.435640574   726 1.484686441    10.10.1.2 → 10.10.1.1    TCP 83 53746 → 8081 [PSH, ACK] Seq=1463 Ack=1463 Win=64256 Len=17 TSval=1045049998 TSecr=3169309694
1711546984.435640574   728 1.484816415    10.10.1.1 → 10.10.1.2    TCP 83 8081 → 53746 [PSH, ACK] Seq=1463 Ack=1480 Win=65152 Len=17 TSval=3169309707 TSecr=1045049998
1711546990.435640574   734 1.488848949    10.10.1.2 → 10.10.1.1    TCP 83 53746 → 8081 [PSH, ACK] Seq=1480 Ack=1480 Win=64256 Len=17 TSval=1045050003 TSecr=3169309707
1711546992.435640574   736 1.488978631    10.10.1.1 → 10.10.1.2    TCP 83 8081 → 53746 [PSH, ACK] Seq=1480 Ack=1497 Win=65152 Len=17 TSval=3169309711 TSecr=1045050003
1711546998.435640574   742 1.502771970    10.10.1.2 → 10.10.1.1    TCP 83 53746 → 8081 [PSH, ACK] Seq=1497 Ack=1497 Win=64256 Len=17 TSval=1045050017 TSecr=3169309711
1711547000.435640574   744 1.502904252    10.10.1.1 → 10.10.1.2    TCP 83 8081 → 53746 [PSH, ACK] Seq=1497 Ack=1514 Win=65152 Len=17 TSval=3169309725 TSecr=1045050017
1711547006.435640574   750 1.507083479    10.10.1.2 → 10.10.1.1    TCP 83 53746 → 8081 [PSH, ACK] Seq=1514 Ack=1514 Win=64256 Len=17 TSval=1045050021 TSecr=3169309725
1711547008.435640574   752 1.507215578    10.10.1.1 → 10.10.1.2    TCP 83 8081 → 53746 [PSH, ACK] Seq=1514 Ack=1531 Win=65152 Len=17 TSval=3169309729 TSecr=1045050021
1711547014.435640574   758 1.518941630    10.10.1.2 → 10.10.1.1    TCP 83 53746 → 8081 [PSH, ACK] Seq=1531 Ack=1531 Win=64256 Len=17 TSval=1045050033 TSecr=3169309729
1711547016.435640574   760 1.519073319    10.10.1.1 → 10.10.1.2    TCP 83 8081 → 53746 [PSH, ACK] Seq=1531 Ack=1548 Win=65152 Len=17 TSval=3169309741 TSecr=1045050033
1711547022.435640574   766 1.527731345    10.10.1.2 → 10.10.1.1    TCP 83 53746 → 8081 [PSH, ACK] Seq=1548 Ack=1548 Win=64256 Len=17 TSval=1045050042 TSecr=3169309741
1711547024.435640574   768 1.527862417    10.10.1.1 → 10.10.1.2    TCP 83 8081 → 53746 [PSH, ACK] Seq=1548 Ack=1565 Win=65152 Len=17 TSval=3169309750 TSecr=1045050042
1711547031.435640574   775 1.528434242    10.10.1.2 → 10.10.1.1    TCP 83 53746 → 8081 [PSH, ACK] Seq=1565 Ack=1565 Win=64256 Len=17 TSval=1045050042 TSecr=3169309750
1711547033.435640574   777 1.528559517    10.10.1.1 → 10.10.1.2    TCP 83 8081 → 53746 [PSH, ACK] Seq=1565 Ack=1582 Win=65152 Len=17 TSval=3169309751 TSecr=1045050042
1711547038.435640574   782 1.538290026    10.10.1.2 → 10.10.1.1    TCP 83 53746 → 8081 [PSH, ACK] Seq=1582 Ack=1582 Win=64256 Len=17 TSval=1045050052 TSecr=3169309751
1711547040.435640574   784 1.538421083    10.10.1.1 → 10.10.1.2    TCP 83 8081 → 53746 [PSH, ACK] Seq=1582 Ack=1599 Win=65152 Len=17 TSval=3169309761 TSecr=1045050052
1711547046.435640574   790 1.540833252    10.10.1.2 → 10.10.1.1    TCP 83 53746 → 8081 [PSH, ACK] Seq=1599 Ack=1599 Win=64256 Len=17 TSval=1045050055 TSecr=3169309761
1711547048.435640574   792 1.540961259    10.10.1.1 → 10.10.1.2    TCP 83 8081 → 53746 [PSH, ACK] Seq=1599 Ack=1616 Win=65152 Len=17 TSval=3169309763 TSecr=1045050055
1711547054.435640574   798 1.563718872    10.10.1.2 → 10.10.1.1    TCP 83 53746 → 8081 [PSH, ACK] Seq=1616 Ack=1616 Win=64256 Len=17 TSval=1045050077 TSecr=3169309763
1711547056.435640574   800 1.563851679    10.10.1.1 → 10.10.1.2    TCP 83 8081 → 53746 [PSH, ACK] Seq=1616 Ack=1633 Win=65152 Len=17 TSval=3169309786 TSecr=1045050077
1711547062.435640574   806 1.580044116    10.10.1.2 → 10.10.1.1    TCP 83 53746 → 8081 [PSH, ACK] Seq=1633 Ack=1633 Win=64256 Len=17 TSval=1045050094 TSecr=3169309786
1711547064.435640574   808 1.580175513    10.10.1.1 → 10.10.1.2    TCP 83 8081 → 53746 [PSH, ACK] Seq=1633 Ack=1650 Win=65152 Len=17 TSval=3169309802 TSecr=1045050094
1711547070.435640574   814 1.597579968    10.10.1.2 → 10.10.1.1    TCP 83 53746 → 8081 [PSH, ACK] Seq=1650 Ack=1650 Win=64256 Len=17 TSval=1045050111 TSecr=3169309802
1711547072.435640574   816 1.597711641    10.10.1.1 → 10.10.1.2    TCP 83 8081 → 53746 [PSH, ACK] Seq=1650 Ack=1667 Win=65152 Len=17 TSval=3169309820 TSecr=1045050111
1711547078.435640574   822 1.611559900    10.10.1.2 → 10.10.1.1    TCP 83 53746 → 8081 [PSH, ACK] Seq=1667 Ack=1667 Win=64256 Len=17 TSval=1045050125 TSecr=3169309820
1711547080.435640574   824 1.611689082    10.10.1.1 → 10.10.1.2    TCP 83 8081 → 53746 [PSH, ACK] Seq=1667 Ack=1684 Win=65152 Len=17 TSval=3169309834 TSecr=1045050125
1711547086.435640574   830 1.625833029    10.10.1.2 → 10.10.1.1    TCP 83 53746 → 8081 [PSH, ACK] Seq=1684 Ack=1684 Win=64256 Len=17 TSval=1045050140 TSecr=3169309834
1711547088.435640574   832 1.625963664    10.10.1.1 → 10.10.1.2    TCP 83 8081 → 53746 [PSH, ACK] Seq=1684 Ack=1701 Win=65152 Len=17 TSval=3169309848 TSecr=1045050140
1711547094.435640574   838 1.634884689    10.10.1.2 → 10.10.1.1    TCP 83 53746 → 8081 [PSH, ACK] Seq=1701 Ack=1701 Win=64256 Len=17 TSval=1045050149 TSecr=3169309848
1711547096.435640574   840 1.635015621    10.10.1.1 → 10.10.1.2    TCP 83 8081 → 53746 [PSH, ACK] Seq=1701 Ack=1718 Win=65152 Len=17 TSval=3169309857 TSecr=1045050149
1711547103.435640574   847 1.635505679    10.10.1.2 → 10.10.1.1    TCP 83 53746 → 8081 [PSH, ACK] Seq=1718 Ack=1718 Win=64256 Len=17 TSval=1045050149 TSecr=3169309857
1711547105.435640574   849 1.635635846    10.10.1.1 → 10.10.1.2    TCP 83 8081 → 53746 [PSH, ACK] Seq=1718 Ack=1735 Win=65152 Len=17 TSval=3169309858 TSecr=1045050149
1711547110.435640574   854 1.657083791    10.10.1.2 → 10.10.1.1    TCP 83 53746 → 8081 [PSH, ACK] Seq=1735 Ack=1735 Win=64256 Len=17 TSval=1045050171 TSecr=3169309858
1711547112.435640574   856 1.657214379    10.10.1.1 → 10.10.1.2    TCP 83 8081 → 53746 [PSH, ACK] Seq=1735 Ack=1752 Win=65152 Len=17 TSval=3169309879 TSecr=1045050171
1711547118.435640574   862 1.664248816    10.10.1.2 → 10.10.1.1    TCP 83 53746 → 8081 [PSH, ACK] Seq=1752 Ack=1752 Win=64256 Len=17 TSval=1045050178 TSecr=3169309879
1711547120.435640574   864 1.664379432    10.10.1.1 → 10.10.1.2    TCP 83 8081 → 53746 [PSH, ACK] Seq=1752 Ack=1769 Win=65152 Len=17 TSval=3169309886 TSecr=1045050178
1711547126.435640574   870 1.671994199    10.10.1.2 → 10.10.1.1    TCP 83 53746 → 8081 [PSH, ACK] Seq=1769 Ack=1769 Win=64256 Len=17 TSval=1045050186 TSecr=3169309886
1711547128.435640574   872 1.672125130    10.10.1.1 → 10.10.1.2    TCP 83 8081 → 53746 [PSH, ACK] Seq=1769 Ack=1786 Win=65152 Len=17 TSval=3169309894 TSecr=1045050186
1711547135.435640574   879 1.735242974    10.10.1.2 → 10.10.1.1    TCP 83 53746 → 8081 [PSH, ACK] Seq=1786 Ack=1786 Win=64256 Len=17 TSval=1045050249 TSecr=3169309894
1711547137.435640574   881 1.735368712    10.10.1.1 → 10.10.1.2    TCP 83 8081 → 53746 [PSH, ACK] Seq=1786 Ack=1803 Win=65152 Len=17 TSval=3169309957 TSecr=1045050249
1711547144.435640574   888 1.740205927    10.10.1.2 → 10.10.1.1    TCP 83 53746 → 8081 [PSH, ACK] Seq=1803 Ack=1803 Win=64256 Len=17 TSval=1045050254 TSecr=3169309957
1711547146.435640574   890 1.740330370    10.10.1.1 → 10.10.1.2    TCP 83 8081 → 53746 [PSH, ACK] Seq=1803 Ack=1820 Win=65152 Len=17 TSval=3169309962 TSecr=1045050254
1711547152.435640574   896 1.754131962    10.10.1.2 → 10.10.1.1    TCP 83 53746 → 8081 [PSH, ACK] Seq=1820 Ack=1820 Win=64256 Len=17 TSval=1045050268 TSecr=3169309962
1711547154.435640574   898 1.754262753    10.10.1.1 → 10.10.1.2    TCP 83 8081 → 53746 [PSH, ACK] Seq=1820 Ack=1837 Win=65152 Len=17 TSval=3169309976 TSecr=1045050268
1711547160.435640574   904 1.767540044    10.10.1.2 → 10.10.1.1    TCP 83 53746 → 8081 [PSH, ACK] Seq=1837 Ack=1837 Win=64256 Len=17 TSval=1045050281 TSecr=3169309976
1711547162.435640574   906 1.767670419    10.10.1.1 → 10.10.1.2    TCP 83 8081 → 53746 [PSH, ACK] Seq=1837 Ack=1854 Win=65152 Len=17 TSval=3169309990 TSecr=1045050281
1711547168.435640574   912 1.775629553    10.10.1.2 → 10.10.1.1    TCP 83 53746 → 8081 [PSH, ACK] Seq=1854 Ack=1854 Win=64256 Len=17 TSval=1045050289 TSecr=3169309990
1711547170.435640574   914 1.775762232    10.10.1.1 → 10.10.1.2    TCP 83 8081 → 53746 [PSH, ACK] Seq=1854 Ack=1871 Win=65152 Len=17 TSval=3169309998 TSecr=1045050289
1711547176.435640574   920 1.798367269    10.10.1.2 → 10.10.1.1    TCP 83 53746 → 8081 [PSH, ACK] Seq=1871 Ack=1871 Win=64256 Len=17 TSval=1045050312 TSecr=3169309998
1711547178.435640574   922 1.798496930    10.10.1.1 → 10.10.1.2    TCP 83 8081 → 53746 [PSH, ACK] Seq=1871 Ack=1888 Win=65152 Len=17 TSval=3169310021 TSecr=1045050312
1711547184.435640574   928 1.801830101    10.10.1.2 → 10.10.1.1    TCP 83 53746 → 8081 [PSH, ACK] Seq=1888 Ack=1888 Win=64256 Len=17 TSval=1045050316 TSecr=3169310021
1711547186.435640574   930 1.801963553    10.10.1.1 → 10.10.1.2    TCP 83 8081 → 53746 [PSH, ACK] Seq=1888 Ack=1905 Win=65152 Len=17 TSval=3169310024 TSecr=1045050316
1711547192.435640574   936 1.816514072    10.10.1.2 → 10.10.1.1    TCP 83 53746 → 8081 [PSH, ACK] Seq=1905 Ack=1905 Win=64256 Len=17 TSval=1045050330 TSecr=3169310024
1711547194.435640574   938 1.816645061    10.10.1.1 → 10.10.1.2    TCP 83 8081 → 53746 [PSH, ACK] Seq=1905 Ack=1922 Win=65152 Len=17 TSval=3169310039 TSecr=1045050330
1711547200.435640574   944 1.819730488    10.10.1.2 → 10.10.1.1    TCP 83 53746 → 8081 [PSH, ACK] Seq=1922 Ack=1922 Win=64256 Len=17 TSval=1045050334 TSecr=3169310039
1711547203.435640574   947 1.819922809    10.10.1.1 → 10.10.1.2    TCP 83 8081 → 53746 [PSH, ACK] Seq=1922 Ack=1939 Win=65152 Len=17 TSval=3169310042 TSecr=1045050334
1711547208.435640574   952 1.825951873    10.10.1.2 → 10.10.1.1    TCP 83 53746 → 8081 [PSH, ACK] Seq=1939 Ack=1939 Win=64256 Len=17 TSval=1045050340 TSecr=3169310042
1711547210.435640574   954 1.826081125    10.10.1.1 → 10.10.1.2    TCP 83 8081 → 53746 [PSH, ACK] Seq=1939 Ack=1956 Win=65152 Len=17 TSval=3169310048 TSecr=1045050340
1711547216.435640574   960 1.835411243    10.10.1.2 → 10.10.1.1    TCP 83 53746 → 8081 [PSH, ACK] Seq=1956 Ack=1956 Win=64256 Len=17 TSval=1045050349 TSecr=3169310048
1711547218.435640574   962 1.835540898    10.10.1.1 → 10.10.1.2    TCP 83 8081 → 53746 [PSH, ACK] Seq=1956 Ack=1973 Win=65152 Len=17 TSval=3169310058 TSecr=1045050349
1711547224.435640574   968 1.846369137    10.10.1.2 → 10.10.1.1    TCP 83 53746 → 8081 [PSH, ACK] Seq=1973 Ack=1973 Win=64256 Len=17 TSval=1045050360 TSecr=3169310058
1711547226.435640574   970 1.846499241    10.10.1.1 → 10.10.1.2    TCP 83 8081 → 53746 [PSH, ACK] Seq=1973 Ack=1990 Win=65152 Len=17 TSval=3169310069 TSecr=1045050360
1711547232.435640574   976 1.848515028    10.10.1.2 → 10.10.1.1    TCP 83 53746 → 8081 [PSH, ACK] Seq=1990 Ack=1990 Win=64256 Len=17 TSval=1045050362 TSecr=3169310069
1711547234.435640574   978 1.848644810    10.10.1.1 → 10.10.1.2    TCP 83 8081 → 53746 [PSH, ACK] Seq=1990 Ack=2007 Win=65152 Len=17 TSval=3169310071 TSecr=1045050362
1711547240.435640574   984 1.873597691    10.10.1.2 → 10.10.1.1    TCP 83 53746 → 8081 [PSH, ACK] Seq=2007 Ack=2007 Win=64256 Len=17 TSval=1045050387 TSecr=3169310071
1711547242.435640574   986 1.873727307    10.10.1.1 → 10.10.1.2    TCP 83 8081 → 53746 [PSH, ACK] Seq=2007 Ack=2024 Win=65152 Len=17 TSval=3169310096 TSecr=1045050387
1711547248.435640574   992 1.878997180    10.10.1.2 → 10.10.1.1    TCP 83 53746 → 8081 [PSH, ACK] Seq=2024 Ack=2024 Win=64256 Len=17 TSval=1045050393 TSecr=3169310096
1711547250.435640574   994 1.879126289    10.10.1.1 → 10.10.1.2    TCP 83 8081 → 53746 [PSH, ACK] Seq=2024 Ack=2041 Win=65152 Len=17 TSval=3169310101 TSecr=1045050393
1711547256.435640574  1000 1.886129861    10.10.1.2 → 10.10.1.1    TCP 83 53746 → 8081 [PSH, ACK] Seq=2041 Ack=2041 Win=64256 Len=17 TSval=1045050400 TSecr=3169310101
