1712098945.280755758    28 0.528957457    10.10.1.2 → 10.10.1.1    TCP 83 45708 → 8081 [PSH, ACK] Seq=1 Ack=1 Win=64256 Len=17 TSval=1597709821 TSecr=3721969278
1712098949.280755758    32 0.529291234    10.10.1.1 → 10.10.1.2    TCP 83 8081 → 45708 [PSH, ACK] Seq=1 Ack=18 Win=65152 Len=17 TSval=3721969530 TSecr=1597709821
1712098954.280755758    37 0.530505951    10.10.1.2 → 10.10.1.1    TCP 83 45708 → 8081 [PSH, ACK] Seq=18 Ack=18 Win=64256 Len=17 TSval=1597709823 TSecr=3721969530
1712098956.280755758    39 0.530633666    10.10.1.1 → 10.10.1.2    TCP 83 8081 → 45708 [PSH, ACK] Seq=18 Ack=35 Win=65152 Len=17 TSval=3721969531 TSecr=1597709823
1712098960.280755758    43 0.531844489    10.10.1.2 → 10.10.1.1    TCP 83 45708 → 8081 [PSH, ACK] Seq=35 Ack=35 Win=64256 Len=17 TSval=1597709824 TSecr=3721969531
1712098962.280755758    45 0.531976291    10.10.1.1 → 10.10.1.2    TCP 83 8081 → 45708 [PSH, ACK] Seq=35 Ack=52 Win=65152 Len=17 TSval=3721969533 TSecr=1597709824
1712098967.280755758    50 0.533185907    10.10.1.2 → 10.10.1.1    TCP 83 45708 → 8081 [PSH, ACK] Seq=52 Ack=52 Win=64256 Len=17 TSval=1597709826 TSecr=3721969533
1712098969.280755758    52 0.533316733    10.10.1.1 → 10.10.1.2    TCP 83 8081 → 45708 [PSH, ACK] Seq=52 Ack=69 Win=65152 Len=17 TSval=3721969534 TSecr=1597709826
1712098973.280755758    56 0.534526470    10.10.1.2 → 10.10.1.1    TCP 83 45708 → 8081 [PSH, ACK] Seq=69 Ack=69 Win=64256 Len=17 TSval=1597709827 TSecr=3721969534
1712098975.280755758    58 0.534658660    10.10.1.1 → 10.10.1.2    TCP 83 8081 → 45708 [PSH, ACK] Seq=69 Ack=86 Win=65152 Len=17 TSval=3721969535 TSecr=1597709827
1712098980.280755758    63 0.535865333    10.10.1.2 → 10.10.1.1    TCP 83 45708 → 8081 [PSH, ACK] Seq=86 Ack=86 Win=64256 Len=17 TSval=1597709828 TSecr=3721969535
1712098982.280755758    65 0.535991905    10.10.1.1 → 10.10.1.2    TCP 83 8081 → 45708 [PSH, ACK] Seq=86 Ack=103 Win=65152 Len=17 TSval=3721969537 TSecr=1597709828
1712098986.280755758    69 0.537203336    10.10.1.2 → 10.10.1.1    TCP 83 45708 → 8081 [PSH, ACK] Seq=103 Ack=103 Win=64256 Len=17 TSval=1597709830 TSecr=3721969537
1712098988.280755758    71 0.537342357    10.10.1.1 → 10.10.1.2    TCP 83 8081 → 45708 [PSH, ACK] Seq=103 Ack=120 Win=65152 Len=17 TSval=3721969538 TSecr=1597709830
1712098993.280755758    76 0.538549187    10.10.1.2 → 10.10.1.1    TCP 83 45708 → 8081 [PSH, ACK] Seq=120 Ack=120 Win=64256 Len=17 TSval=1597709831 TSecr=3721969538
1712098995.280755758    78 0.538677479    10.10.1.1 → 10.10.1.2    TCP 83 8081 → 45708 [PSH, ACK] Seq=120 Ack=137 Win=65152 Len=17 TSval=3721969539 TSecr=1597709831
1712098999.280755758    82 0.539883621    10.10.1.2 → 10.10.1.1    TCP 83 45708 → 8081 [PSH, ACK] Seq=137 Ack=137 Win=64256 Len=17 TSval=1597709832 TSecr=3721969539
1712099001.280755758    84 0.540010423    10.10.1.1 → 10.10.1.2    TCP 83 8081 → 45708 [PSH, ACK] Seq=137 Ack=154 Win=65152 Len=17 TSval=3721969541 TSecr=1597709832
1712099006.280755758    89 0.541219626    10.10.1.2 → 10.10.1.1    TCP 83 45708 → 8081 [PSH, ACK] Seq=154 Ack=154 Win=64256 Len=17 TSval=1597709834 TSecr=3721969541
1712099008.280755758    91 0.541346270    10.10.1.1 → 10.10.1.2    TCP 83 8081 → 45708 [PSH, ACK] Seq=154 Ack=171 Win=65152 Len=17 TSval=3721969542 TSecr=1597709834
1712099012.280755758    95 0.542552902    10.10.1.2 → 10.10.1.1    TCP 83 45708 → 8081 [PSH, ACK] Seq=171 Ack=171 Win=64256 Len=17 TSval=1597709835 TSecr=3721969542
1712099014.280755758    97 0.542684294    10.10.1.1 → 10.10.1.2    TCP 83 8081 → 45708 [PSH, ACK] Seq=171 Ack=188 Win=65152 Len=17 TSval=3721969543 TSecr=1597709835
1712099019.280755758   102 0.543891366    10.10.1.2 → 10.10.1.1    TCP 83 45708 → 8081 [PSH, ACK] Seq=188 Ack=188 Win=64256 Len=17 TSval=1597709836 TSecr=3721969543
1712099021.280755758   104 0.544023061    10.10.1.1 → 10.10.1.2    TCP 83 8081 → 45708 [PSH, ACK] Seq=188 Ack=205 Win=65152 Len=17 TSval=3721969545 TSecr=1597709836
1712099025.280755758   108 0.545235401    10.10.1.2 → 10.10.1.1    TCP 83 45708 → 8081 [PSH, ACK] Seq=205 Ack=205 Win=64256 Len=17 TSval=1597709838 TSecr=3721969545
1712099027.280755758   110 0.545370456    10.10.1.1 → 10.10.1.2    TCP 83 8081 → 45708 [PSH, ACK] Seq=205 Ack=222 Win=65152 Len=17 TSval=3721969546 TSecr=1597709838
1712099032.280755758   115 0.546575972    10.10.1.2 → 10.10.1.1    TCP 83 45708 → 8081 [PSH, ACK] Seq=222 Ack=222 Win=64256 Len=17 TSval=1597709839 TSecr=3721969546
1712099034.280755758   117 0.546702377    10.10.1.1 → 10.10.1.2    TCP 83 8081 → 45708 [PSH, ACK] Seq=222 Ack=239 Win=65152 Len=17 TSval=3721969547 TSecr=1597709839
1712099038.280755758   121 0.547909039    10.10.1.2 → 10.10.1.1    TCP 83 45708 → 8081 [PSH, ACK] Seq=239 Ack=239 Win=64256 Len=17 TSval=1597709840 TSecr=3721969547
1712099040.280755758   123 0.548041586    10.10.1.1 → 10.10.1.2    TCP 83 8081 → 45708 [PSH, ACK] Seq=239 Ack=256 Win=65152 Len=17 TSval=3721969549 TSecr=1597709840
1712099045.280755758   128 0.549249942    10.10.1.2 → 10.10.1.1    TCP 83 45708 → 8081 [PSH, ACK] Seq=256 Ack=256 Win=64256 Len=17 TSval=1597709842 TSecr=3721969549
1712099047.280755758   130 0.549380591    10.10.1.1 → 10.10.1.2    TCP 83 8081 → 45708 [PSH, ACK] Seq=256 Ack=273 Win=65152 Len=17 TSval=3721969550 TSecr=1597709842
1712099051.280755758   134 0.550585866    10.10.1.2 → 10.10.1.1    TCP 83 45708 → 8081 [PSH, ACK] Seq=273 Ack=273 Win=64256 Len=17 TSval=1597709843 TSecr=3721969550
1712099053.280755758   136 0.550712898    10.10.1.1 → 10.10.1.2    TCP 83 8081 → 45708 [PSH, ACK] Seq=273 Ack=290 Win=65152 Len=17 TSval=3721969551 TSecr=1597709843
1712099058.280755758   141 0.551919195    10.10.1.2 → 10.10.1.1    TCP 83 45708 → 8081 [PSH, ACK] Seq=290 Ack=290 Win=64256 Len=17 TSval=1597709844 TSecr=3721969551
1712099060.280755758   143 0.552046500    10.10.1.1 → 10.10.1.2    TCP 83 8081 → 45708 [PSH, ACK] Seq=290 Ack=307 Win=65152 Len=17 TSval=3721969553 TSecr=1597709844
1712099064.280755758   147 0.553254688    10.10.1.2 → 10.10.1.1    TCP 83 45708 → 8081 [PSH, ACK] Seq=307 Ack=307 Win=64256 Len=17 TSval=1597709846 TSecr=3721969553
1712099066.280755758   149 0.553381278    10.10.1.1 → 10.10.1.2    TCP 83 8081 → 45708 [PSH, ACK] Seq=307 Ack=324 Win=65152 Len=17 TSval=3721969554 TSecr=1597709846
1712099071.280755758   154 0.554588396    10.10.1.2 → 10.10.1.1    TCP 83 45708 → 8081 [PSH, ACK] Seq=324 Ack=324 Win=64256 Len=17 TSval=1597709847 TSecr=3721969554
1712099073.280755758   156 0.554724472    10.10.1.1 → 10.10.1.2    TCP 83 8081 → 45708 [PSH, ACK] Seq=324 Ack=341 Win=65152 Len=17 TSval=3721969555 TSecr=1597709847
1712099077.280755758   160 0.555931329    10.10.1.2 → 10.10.1.1    TCP 83 45708 → 8081 [PSH, ACK] Seq=341 Ack=341 Win=64256 Len=17 TSval=1597709848 TSecr=3721969555
1712099079.280755758   162 0.556057754    10.10.1.1 → 10.10.1.2    TCP 83 8081 → 45708 [PSH, ACK] Seq=341 Ack=358 Win=65152 Len=17 TSval=3721969557 TSecr=1597709848
1712099084.280755758   167 0.557265416    10.10.1.2 → 10.10.1.1    TCP 83 45708 → 8081 [PSH, ACK] Seq=358 Ack=358 Win=64256 Len=17 TSval=1597709850 TSecr=3721969557
1712099086.280755758   169 0.557395961    10.10.1.1 → 10.10.1.2    TCP 83 8081 → 45708 [PSH, ACK] Seq=358 Ack=375 Win=65152 Len=17 TSval=3721969558 TSecr=1597709850
1712099090.280755758   173 0.558602698    10.10.1.2 → 10.10.1.1    TCP 83 45708 → 8081 [PSH, ACK] Seq=375 Ack=375 Win=64256 Len=17 TSval=1597709851 TSecr=3721969558
1712099092.280755758   175 0.558729732    10.10.1.1 → 10.10.1.2    TCP 83 8081 → 45708 [PSH, ACK] Seq=375 Ack=392 Win=65152 Len=17 TSval=3721969559 TSecr=1597709851
1712099097.280755758   180 0.559936372    10.10.1.2 → 10.10.1.1    TCP 83 45708 → 8081 [PSH, ACK] Seq=392 Ack=392 Win=64256 Len=17 TSval=1597709852 TSecr=3721969559
1712099099.280755758   182 0.560062054    10.10.1.1 → 10.10.1.2    TCP 83 8081 → 45708 [PSH, ACK] Seq=392 Ack=409 Win=65152 Len=17 TSval=3721969561 TSecr=1597709852
1712099103.280755758   186 0.561269711    10.10.1.2 → 10.10.1.1    TCP 83 45708 → 8081 [PSH, ACK] Seq=409 Ack=409 Win=64256 Len=17 TSval=1597709854 TSecr=3721969561
1712099105.280755758   188 0.561405987    10.10.1.1 → 10.10.1.2    TCP 83 8081 → 45708 [PSH, ACK] Seq=409 Ack=426 Win=65152 Len=17 TSval=3721969562 TSecr=1597709854
1712099110.280755758   193 0.562612917    10.10.1.2 → 10.10.1.1    TCP 83 45708 → 8081 [PSH, ACK] Seq=426 Ack=426 Win=64256 Len=17 TSval=1597709855 TSecr=3721969562
1712099112.280755758   195 0.562739825    10.10.1.1 → 10.10.1.2    TCP 83 8081 → 45708 [PSH, ACK] Seq=426 Ack=443 Win=65152 Len=17 TSval=3721969563 TSecr=1597709855
1712099116.280755758   199 0.563948495    10.10.1.2 → 10.10.1.1    TCP 83 45708 → 8081 [PSH, ACK] Seq=443 Ack=443 Win=64256 Len=17 TSval=1597709856 TSecr=3721969563
1712099118.280755758   201 0.564083269    10.10.1.1 → 10.10.1.2    TCP 83 8081 → 45708 [PSH, ACK] Seq=443 Ack=460 Win=65152 Len=17 TSval=3721969565 TSecr=1597709856
1712099123.280755758   206 0.565292079    10.10.1.2 → 10.10.1.1    TCP 83 45708 → 8081 [PSH, ACK] Seq=460 Ack=460 Win=64256 Len=17 TSval=1597709858 TSecr=3721969565
1712099125.280755758   208 0.565434981    10.10.1.1 → 10.10.1.2    TCP 83 8081 → 45708 [PSH, ACK] Seq=460 Ack=477 Win=65152 Len=17 TSval=3721969566 TSecr=1597709858
1712099129.280755758   212 0.566640534    10.10.1.2 → 10.10.1.1    TCP 83 45708 → 8081 [PSH, ACK] Seq=477 Ack=477 Win=64256 Len=17 TSval=1597709859 TSecr=3721969566
1712099131.280755758   214 0.566767019    10.10.1.1 → 10.10.1.2    TCP 83 8081 → 45708 [PSH, ACK] Seq=477 Ack=494 Win=65152 Len=17 TSval=3721969567 TSecr=1597709859
1712099136.280755758   219 0.567973341    10.10.1.2 → 10.10.1.1    TCP 83 45708 → 8081 [PSH, ACK] Seq=494 Ack=494 Win=64256 Len=17 TSval=1597709860 TSecr=3721969567
1712099138.280755758   221 0.568099830    10.10.1.1 → 10.10.1.2    TCP 83 8081 → 45708 [PSH, ACK] Seq=494 Ack=511 Win=65152 Len=17 TSval=3721969569 TSecr=1597709860
1712099142.280755758   225 0.569309345    10.10.1.2 → 10.10.1.1    TCP 83 45708 → 8081 [PSH, ACK] Seq=511 Ack=511 Win=64256 Len=17 TSval=1597709862 TSecr=3721969569
1712099145.280755758   228 0.569393511    10.10.1.1 → 10.10.1.2    TCP 83 8081 → 45708 [PSH, ACK] Seq=511 Ack=528 Win=65152 Len=17 TSval=3721969570 TSecr=1597709862
1712099149.280755758   232 0.570598780    10.10.1.2 → 10.10.1.1    TCP 83 45708 → 8081 [PSH, ACK] Seq=528 Ack=528 Win=64256 Len=17 TSval=1597709863 TSecr=3721969570
1712099151.280755758   234 0.570724688    10.10.1.1 → 10.10.1.2    TCP 83 8081 → 45708 [PSH, ACK] Seq=528 Ack=545 Win=65152 Len=17 TSval=3721969571 TSecr=1597709863
1712099155.280755758   238 0.571930398    10.10.1.2 → 10.10.1.1    TCP 83 45708 → 8081 [PSH, ACK] Seq=545 Ack=545 Win=64256 Len=17 TSval=1597709864 TSecr=3721969571
1712099157.280755758   240 0.572056272    10.10.1.1 → 10.10.1.2    TCP 83 8081 → 45708 [PSH, ACK] Seq=545 Ack=562 Win=65152 Len=17 TSval=3721969573 TSecr=1597709864
1712099162.280755758   245 0.573264403    10.10.1.2 → 10.10.1.1    TCP 83 45708 → 8081 [PSH, ACK] Seq=562 Ack=562 Win=64256 Len=17 TSval=1597709866 TSecr=3721969573
1712099164.280755758   247 0.573402640    10.10.1.1 → 10.10.1.2    TCP 83 8081 → 45708 [PSH, ACK] Seq=562 Ack=579 Win=65152 Len=17 TSval=3721969574 TSecr=1597709866
1712099168.280755758   251 0.574608667    10.10.1.2 → 10.10.1.1    TCP 83 45708 → 8081 [PSH, ACK] Seq=579 Ack=579 Win=64256 Len=17 TSval=1597709867 TSecr=3721969574
1712099170.280755758   253 0.574735321    10.10.1.1 → 10.10.1.2    TCP 83 8081 → 45708 [PSH, ACK] Seq=579 Ack=596 Win=65152 Len=17 TSval=3721969575 TSecr=1597709867
1712099175.280755758   258 0.575942268    10.10.1.2 → 10.10.1.1    TCP 83 45708 → 8081 [PSH, ACK] Seq=596 Ack=596 Win=64256 Len=17 TSval=1597709868 TSecr=3721969575
1712099177.280755758   260 0.576067865    10.10.1.1 → 10.10.1.2    TCP 83 8081 → 45708 [PSH, ACK] Seq=596 Ack=613 Win=65152 Len=17 TSval=3721969577 TSecr=1597709868
1712099181.280755758   264 0.577279436    10.10.1.2 → 10.10.1.1    TCP 83 45708 → 8081 [PSH, ACK] Seq=613 Ack=613 Win=64256 Len=17 TSval=1597709870 TSecr=3721969577
1712099183.280755758   266 0.577416163    10.10.1.1 → 10.10.1.2    TCP 83 8081 → 45708 [PSH, ACK] Seq=613 Ack=630 Win=65152 Len=17 TSval=3721969578 TSecr=1597709870
1712099188.280755758   271 0.578621408    10.10.1.2 → 10.10.1.1    TCP 83 45708 → 8081 [PSH, ACK] Seq=630 Ack=630 Win=64256 Len=17 TSval=1597709871 TSecr=3721969578
1712099190.280755758   273 0.578747130    10.10.1.1 → 10.10.1.2    TCP 83 8081 → 45708 [PSH, ACK] Seq=630 Ack=647 Win=65152 Len=17 TSval=3721969579 TSecr=1597709871
1712099194.280755758   277 0.579954353    10.10.1.2 → 10.10.1.1    TCP 83 45708 → 8081 [PSH, ACK] Seq=647 Ack=647 Win=64256 Len=17 TSval=1597709872 TSecr=3721969579
1712099196.280755758   279 0.580080654    10.10.1.1 → 10.10.1.2    TCP 83 8081 → 45708 [PSH, ACK] Seq=647 Ack=664 Win=65152 Len=17 TSval=3721969581 TSecr=1597709872
1712099201.280755758   284 0.581289524    10.10.1.2 → 10.10.1.1    TCP 83 45708 → 8081 [PSH, ACK] Seq=664 Ack=664 Win=64256 Len=17 TSval=1597709874 TSecr=3721969581
1712099203.280755758   286 0.581414942    10.10.1.1 → 10.10.1.2    TCP 83 8081 → 45708 [PSH, ACK] Seq=664 Ack=681 Win=65152 Len=17 TSval=3721969582 TSecr=1597709874
1712099207.280755758   290 0.582619508    10.10.1.2 → 10.10.1.1    TCP 83 45708 → 8081 [PSH, ACK] Seq=681 Ack=681 Win=64256 Len=17 TSval=1597709875 TSecr=3721969582
1712099209.280755758   292 0.582746255    10.10.1.1 → 10.10.1.2    TCP 83 8081 → 45708 [PSH, ACK] Seq=681 Ack=698 Win=65152 Len=17 TSval=3721969583 TSecr=1597709875
1712099214.280755758   297 0.583952687    10.10.1.2 → 10.10.1.1    TCP 83 45708 → 8081 [PSH, ACK] Seq=698 Ack=698 Win=64256 Len=17 TSval=1597709876 TSecr=3721969583
1712099216.280755758   299 0.584078668    10.10.1.1 → 10.10.1.2    TCP 83 8081 → 45708 [PSH, ACK] Seq=698 Ack=715 Win=65152 Len=17 TSval=3721969585 TSecr=1597709876
1712099220.280755758   303 0.585287662    10.10.1.2 → 10.10.1.1    TCP 83 45708 → 8081 [PSH, ACK] Seq=715 Ack=715 Win=64256 Len=17 TSval=1597709878 TSecr=3721969585
1712099222.280755758   305 0.585347899    10.10.1.1 → 10.10.1.2    TCP 83 8081 → 45708 [PSH, ACK] Seq=715 Ack=732 Win=65152 Len=17 TSval=3721969586 TSecr=1597709878
1712099227.280755758   310 0.586550559    10.10.1.2 → 10.10.1.1    TCP 83 45708 → 8081 [PSH, ACK] Seq=732 Ack=732 Win=64256 Len=17 TSval=1597709879 TSecr=3721969586
1712099229.280755758   312 0.586677423    10.10.1.1 → 10.10.1.2    TCP 83 8081 → 45708 [PSH, ACK] Seq=732 Ack=749 Win=65152 Len=17 TSval=3721969587 TSecr=1597709879
1712099233.280755758   316 0.587883737    10.10.1.2 → 10.10.1.1    TCP 83 45708 → 8081 [PSH, ACK] Seq=749 Ack=749 Win=64256 Len=17 TSval=1597709880 TSecr=3721969587
1712099235.280755758   318 0.588009926    10.10.1.1 → 10.10.1.2    TCP 83 8081 → 45708 [PSH, ACK] Seq=749 Ack=766 Win=65152 Len=17 TSval=3721969589 TSecr=1597709880
1712099240.280755758   323 0.589217384    10.10.1.2 → 10.10.1.1    TCP 83 45708 → 8081 [PSH, ACK] Seq=766 Ack=766 Win=64256 Len=17 TSval=1597709882 TSecr=3721969589
1712099242.280755758   325 0.589346790    10.10.1.1 → 10.10.1.2    TCP 83 8081 → 45708 [PSH, ACK] Seq=766 Ack=783 Win=65152 Len=17 TSval=3721969590 TSecr=1597709882
1712099246.280755758   329 0.590552637    10.10.1.2 → 10.10.1.1    TCP 83 45708 → 8081 [PSH, ACK] Seq=783 Ack=783 Win=64256 Len=17 TSval=1597709883 TSecr=3721969590
1712099248.280755758   331 0.590678722    10.10.1.1 → 10.10.1.2    TCP 83 8081 → 45708 [PSH, ACK] Seq=783 Ack=800 Win=65152 Len=17 TSval=3721969591 TSecr=1597709883
1712099254.280755758   337 0.591885227    10.10.1.2 → 10.10.1.1    TCP 83 45708 → 8081 [PSH, ACK] Seq=800 Ack=800 Win=64256 Len=17 TSval=1597709884 TSecr=3721969591
1712099255.280755758   338 0.592012109    10.10.1.1 → 10.10.1.2    TCP 83 8081 → 45708 [PSH, ACK] Seq=800 Ack=817 Win=65152 Len=17 TSval=3721969593 TSecr=1597709884
1712099260.280755758   343 0.593219863    10.10.1.2 → 10.10.1.1    TCP 83 45708 → 8081 [PSH, ACK] Seq=817 Ack=817 Win=64256 Len=17 TSval=1597709886 TSecr=3721969593
1712099262.280755758   345 0.593347958    10.10.1.1 → 10.10.1.2    TCP 83 8081 → 45708 [PSH, ACK] Seq=817 Ack=834 Win=65152 Len=17 TSval=3721969594 TSecr=1597709886
1712099266.280755758   349 0.594554241    10.10.1.2 → 10.10.1.1    TCP 83 45708 → 8081 [PSH, ACK] Seq=834 Ack=834 Win=64256 Len=17 TSval=1597709887 TSecr=3721969594
1712099268.280755758   351 0.594679831    10.10.1.1 → 10.10.1.2    TCP 83 8081 → 45708 [PSH, ACK] Seq=834 Ack=851 Win=65152 Len=17 TSval=3721969595 TSecr=1597709887
1712099273.280755758   356 0.595887281    10.10.1.2 → 10.10.1.1    TCP 83 45708 → 8081 [PSH, ACK] Seq=851 Ack=851 Win=64256 Len=17 TSval=1597709888 TSecr=3721969595
1712099275.280755758   358 0.596013959    10.10.1.1 → 10.10.1.2    TCP 83 8081 → 45708 [PSH, ACK] Seq=851 Ack=868 Win=65152 Len=17 TSval=3721969597 TSecr=1597709888
1712099280.280755758   363 0.597223463    10.10.1.2 → 10.10.1.1    TCP 83 45708 → 8081 [PSH, ACK] Seq=868 Ack=868 Win=64256 Len=17 TSval=1597709890 TSecr=3721969597
1712099281.280755758   364 0.597303191    10.10.1.1 → 10.10.1.2    TCP 83 8081 → 45708 [PSH, ACK] Seq=868 Ack=885 Win=65152 Len=17 TSval=3721969598 TSecr=1597709890
1712099285.280755758   368 0.598508157    10.10.1.2 → 10.10.1.1    TCP 83 45708 → 8081 [PSH, ACK] Seq=885 Ack=885 Win=64256 Len=17 TSval=1597709891 TSecr=3721969598
1712099287.280755758   370 0.598634444    10.10.1.1 → 10.10.1.2    TCP 83 8081 → 45708 [PSH, ACK] Seq=885 Ack=902 Win=65152 Len=17 TSval=3721969599 TSecr=1597709891
1712099293.280755758   376 0.599840157    10.10.1.2 → 10.10.1.1    TCP 83 45708 → 8081 [PSH, ACK] Seq=902 Ack=902 Win=64256 Len=17 TSval=1597709892 TSecr=3721969599
1712099294.280755758   377 0.599966083    10.10.1.1 → 10.10.1.2    TCP 83 8081 → 45708 [PSH, ACK] Seq=902 Ack=919 Win=65152 Len=17 TSval=3721969601 TSecr=1597709892
1712099299.280755758   382 0.601173695    10.10.1.2 → 10.10.1.1    TCP 83 45708 → 8081 [PSH, ACK] Seq=919 Ack=919 Win=64256 Len=17 TSval=1597709893 TSecr=3721969601
1712099301.280755758   384 0.601302407    10.10.1.1 → 10.10.1.2    TCP 83 8081 → 45708 [PSH, ACK] Seq=919 Ack=936 Win=65152 Len=17 TSval=3721969602 TSecr=1597709893
1712099305.280755758   388 0.602507588    10.10.1.2 → 10.10.1.1    TCP 83 45708 → 8081 [PSH, ACK] Seq=936 Ack=936 Win=64256 Len=17 TSval=1597709895 TSecr=3721969602
1712099307.280755758   390 0.602635185    10.10.1.1 → 10.10.1.2    TCP 83 8081 → 45708 [PSH, ACK] Seq=936 Ack=953 Win=65152 Len=17 TSval=3721969603 TSecr=1597709895
1712099312.280755758   395 0.603840935    10.10.1.2 → 10.10.1.1    TCP 83 45708 → 8081 [PSH, ACK] Seq=953 Ack=953 Win=64256 Len=17 TSval=1597709896 TSecr=3721969603
1712099314.280755758   397 0.604023612    10.10.1.1 → 10.10.1.2    TCP 83 8081 → 45708 [PSH, ACK] Seq=953 Ack=970 Win=65152 Len=17 TSval=3721969605 TSecr=1597709896
1712099319.280755758   402 0.605233399    10.10.1.2 → 10.10.1.1    TCP 83 45708 → 8081 [PSH, ACK] Seq=970 Ack=970 Win=64256 Len=17 TSval=1597709898 TSecr=3721969605
1712099320.280755758   403 0.605363100    10.10.1.1 → 10.10.1.2    TCP 83 8081 → 45708 [PSH, ACK] Seq=970 Ack=987 Win=65152 Len=17 TSval=3721969606 TSecr=1597709898
1712099325.280755758   408 0.606569837    10.10.1.2 → 10.10.1.1    TCP 83 45708 → 8081 [PSH, ACK] Seq=987 Ack=987 Win=64256 Len=17 TSval=1597709899 TSecr=3721969606
1712099327.280755758   410 0.606697153    10.10.1.1 → 10.10.1.2    TCP 83 8081 → 45708 [PSH, ACK] Seq=987 Ack=1004 Win=65152 Len=17 TSval=3721969607 TSecr=1597709899
1712099332.280755758   415 0.607903425    10.10.1.2 → 10.10.1.1    TCP 83 45708 → 8081 [PSH, ACK] Seq=1004 Ack=1004 Win=64256 Len=17 TSval=1597709900 TSecr=3721969607
1712099333.280755758   416 0.608029456    10.10.1.1 → 10.10.1.2    TCP 83 8081 → 45708 [PSH, ACK] Seq=1004 Ack=1021 Win=65152 Len=17 TSval=3721969609 TSecr=1597709900
1712099338.280755758   421 0.609237862    10.10.1.2 → 10.10.1.1    TCP 83 45708 → 8081 [PSH, ACK] Seq=1021 Ack=1021 Win=64256 Len=17 TSval=1597709902 TSecr=3721969609
1712099340.280755758   423 0.609320120    10.10.1.1 → 10.10.1.2    TCP 83 8081 → 45708 [PSH, ACK] Seq=1021 Ack=1038 Win=65152 Len=17 TSval=3721969610 TSecr=1597709902
1712099344.280755758   427 0.610526342    10.10.1.2 → 10.10.1.1    TCP 83 45708 → 8081 [PSH, ACK] Seq=1038 Ack=1038 Win=64256 Len=17 TSval=1597709903 TSecr=3721969610
1712099346.280755758   429 0.610652597    10.10.1.1 → 10.10.1.2    TCP 83 8081 → 45708 [PSH, ACK] Seq=1038 Ack=1055 Win=65152 Len=17 TSval=3721969611 TSecr=1597709903
1712099351.280755758   434 0.611858170    10.10.1.2 → 10.10.1.1    TCP 83 45708 → 8081 [PSH, ACK] Seq=1055 Ack=1055 Win=64256 Len=17 TSval=1597709904 TSecr=3721969611
1712099353.280755758   436 0.611984735    10.10.1.1 → 10.10.1.2    TCP 83 8081 → 45708 [PSH, ACK] Seq=1055 Ack=1072 Win=65152 Len=17 TSval=3721969613 TSecr=1597709904
1712099358.280755758   441 0.613193668    10.10.1.2 → 10.10.1.1    TCP 83 45708 → 8081 [PSH, ACK] Seq=1072 Ack=1072 Win=64256 Len=17 TSval=1597709906 TSecr=3721969613
1712099359.280755758   442 0.613321808    10.10.1.1 → 10.10.1.2    TCP 83 8081 → 45708 [PSH, ACK] Seq=1072 Ack=1089 Win=65152 Len=17 TSval=3721969614 TSecr=1597709906
1712099363.280755758   446 0.614527880    10.10.1.2 → 10.10.1.1    TCP 83 45708 → 8081 [PSH, ACK] Seq=1089 Ack=1089 Win=64256 Len=17 TSval=1597709907 TSecr=3721969614
1712099365.280755758   448 0.614654706    10.10.1.1 → 10.10.1.2    TCP 83 8081 → 45708 [PSH, ACK] Seq=1089 Ack=1106 Win=65152 Len=17 TSval=3721969615 TSecr=1597709907
1712099370.280755758   453 0.615860538    10.10.1.2 → 10.10.1.1    TCP 83 45708 → 8081 [PSH, ACK] Seq=1106 Ack=1106 Win=64256 Len=17 TSval=1597709908 TSecr=3721969615
1712099372.280755758   455 0.615986785    10.10.1.1 → 10.10.1.2    TCP 83 8081 → 45708 [PSH, ACK] Seq=1106 Ack=1123 Win=65152 Len=17 TSval=3721969617 TSecr=1597709908
1712099377.280755758   460 0.617194706    10.10.1.2 → 10.10.1.1    TCP 83 45708 → 8081 [PSH, ACK] Seq=1123 Ack=1123 Win=64256 Len=17 TSval=1597709910 TSecr=3721969617
1712099379.280755758   462 0.617324197    10.10.1.1 → 10.10.1.2    TCP 83 8081 → 45708 [PSH, ACK] Seq=1123 Ack=1140 Win=65152 Len=17 TSval=3721969618 TSecr=1597709910
1712099384.280755758   467 0.618529604    10.10.1.2 → 10.10.1.1    TCP 83 45708 → 8081 [PSH, ACK] Seq=1140 Ack=1140 Win=64256 Len=17 TSval=1597709911 TSecr=3721969618
1712099385.280755758   468 0.618655040    10.10.1.1 → 10.10.1.2    TCP 83 8081 → 45708 [PSH, ACK] Seq=1140 Ack=1157 Win=65152 Len=17 TSval=3721969619 TSecr=1597709911
1712099389.280755758   472 0.619861845    10.10.1.2 → 10.10.1.1    TCP 83 45708 → 8081 [PSH, ACK] Seq=1157 Ack=1157 Win=64256 Len=17 TSval=1597709912 TSecr=3721969619
1712099391.280755758   474 0.619987708    10.10.1.1 → 10.10.1.2    TCP 83 8081 → 45708 [PSH, ACK] Seq=1157 Ack=1174 Win=65152 Len=17 TSval=3721969621 TSecr=1597709912
1712099397.280755758   480 0.621195751    10.10.1.2 → 10.10.1.1    TCP 83 45708 → 8081 [PSH, ACK] Seq=1174 Ack=1174 Win=64256 Len=17 TSval=1597709914 TSecr=3721969621
1712099398.280755758   481 0.621320545    10.10.1.1 → 10.10.1.2    TCP 83 8081 → 45708 [PSH, ACK] Seq=1174 Ack=1191 Win=65152 Len=17 TSval=3721969622 TSecr=1597709914
1712099402.280755758   485 0.622526744    10.10.1.2 → 10.10.1.1    TCP 83 45708 → 8081 [PSH, ACK] Seq=1191 Ack=1191 Win=64256 Len=17 TSval=1597709915 TSecr=3721969622
1712099404.280755758   487 0.622652494    10.10.1.1 → 10.10.1.2    TCP 83 8081 → 45708 [PSH, ACK] Seq=1191 Ack=1208 Win=65152 Len=17 TSval=3721969623 TSecr=1597709915
1712099409.280755758   492 0.623858906    10.10.1.2 → 10.10.1.1    TCP 83 45708 → 8081 [PSH, ACK] Seq=1208 Ack=1208 Win=64256 Len=17 TSval=1597709916 TSecr=3721969623
1712099411.280755758   494 0.623994647    10.10.1.1 → 10.10.1.2    TCP 83 8081 → 45708 [PSH, ACK] Seq=1208 Ack=1225 Win=65152 Len=17 TSval=3721969625 TSecr=1597709916
1712099415.280755758   498 0.625202361    10.10.1.2 → 10.10.1.1    TCP 83 45708 → 8081 [PSH, ACK] Seq=1225 Ack=1225 Win=64256 Len=17 TSval=1597709918 TSecr=3721969625
1712099417.280755758   500 0.625331910    10.10.1.1 → 10.10.1.2    TCP 83 8081 → 45708 [PSH, ACK] Seq=1225 Ack=1242 Win=65152 Len=17 TSval=3721969626 TSecr=1597709918
1712099422.280755758   505 0.626537261    10.10.1.2 → 10.10.1.1    TCP 83 45708 → 8081 [PSH, ACK] Seq=1242 Ack=1242 Win=64256 Len=17 TSval=1597709919 TSecr=3721969626
1712099424.280755758   507 0.626663723    10.10.1.1 → 10.10.1.2    TCP 83 8081 → 45708 [PSH, ACK] Seq=1242 Ack=1259 Win=65152 Len=17 TSval=3721969627 TSecr=1597709919
1712099429.280755758   512 0.627869624    10.10.1.2 → 10.10.1.1    TCP 83 45708 → 8081 [PSH, ACK] Seq=1259 Ack=1259 Win=64256 Len=17 TSval=1597709920 TSecr=3721969627
1712099431.280755758   514 0.627995806    10.10.1.1 → 10.10.1.2    TCP 83 8081 → 45708 [PSH, ACK] Seq=1259 Ack=1276 Win=65152 Len=17 TSval=3721969629 TSecr=1597709920
1712099436.280755758   519 0.629203691    10.10.1.2 → 10.10.1.1    TCP 83 45708 → 8081 [PSH, ACK] Seq=1276 Ack=1276 Win=64256 Len=17 TSval=1597709922 TSecr=3721969629
1712099437.280755758   520 0.629331693    10.10.1.1 → 10.10.1.2    TCP 83 8081 → 45708 [PSH, ACK] Seq=1276 Ack=1293 Win=65152 Len=17 TSval=3721969630 TSecr=1597709922
1712099441.280755758   524 0.630537817    10.10.1.2 → 10.10.1.1    TCP 83 45708 → 8081 [PSH, ACK] Seq=1293 Ack=1293 Win=64256 Len=17 TSval=1597709923 TSecr=3721969630
1712099443.280755758   526 0.630664042    10.10.1.1 → 10.10.1.2    TCP 83 8081 → 45708 [PSH, ACK] Seq=1293 Ack=1310 Win=65152 Len=17 TSval=3721969631 TSecr=1597709923
1712099449.280755758   532 0.631869860    10.10.1.2 → 10.10.1.1    TCP 83 45708 → 8081 [PSH, ACK] Seq=1310 Ack=1310 Win=64256 Len=17 TSval=1597709924 TSecr=3721969631
1712099450.280755758   533 0.631991940    10.10.1.1 → 10.10.1.2    TCP 83 8081 → 45708 [PSH, ACK] Seq=1310 Ack=1327 Win=65152 Len=17 TSval=3721969633 TSecr=1597709924
1712099455.280755758   538 0.633201882    10.10.1.2 → 10.10.1.1    TCP 83 45708 → 8081 [PSH, ACK] Seq=1327 Ack=1327 Win=64256 Len=17 TSval=1597709926 TSecr=3721969633
1712099457.280755758   540 0.633283764    10.10.1.1 → 10.10.1.2    TCP 83 8081 → 45708 [PSH, ACK] Seq=1327 Ack=1344 Win=65152 Len=17 TSval=3721969634 TSecr=1597709926
1712099461.280755758   544 0.634488979    10.10.1.2 → 10.10.1.1    TCP 83 45708 → 8081 [PSH, ACK] Seq=1344 Ack=1344 Win=64256 Len=17 TSval=1597709927 TSecr=3721969634
1712099463.280755758   546 0.634616021    10.10.1.1 → 10.10.1.2    TCP 83 8081 → 45708 [PSH, ACK] Seq=1344 Ack=1361 Win=65152 Len=17 TSval=3721969635 TSecr=1597709927
1712099468.280755758   551 0.635822508    10.10.1.2 → 10.10.1.1    TCP 83 45708 → 8081 [PSH, ACK] Seq=1361 Ack=1361 Win=64256 Len=17 TSval=1597709928 TSecr=3721969635
1712099470.280755758   553 0.635948908    10.10.1.1 → 10.10.1.2    TCP 83 8081 → 45708 [PSH, ACK] Seq=1361 Ack=1378 Win=65152 Len=17 TSval=3721969637 TSecr=1597709928
1712099475.280755758   558 0.637156410    10.10.1.2 → 10.10.1.1    TCP 83 45708 → 8081 [PSH, ACK] Seq=1378 Ack=1378 Win=64256 Len=17 TSval=1597709929 TSecr=3721969637
1712099476.280755758   559 0.637284477    10.10.1.1 → 10.10.1.2    TCP 83 8081 → 45708 [PSH, ACK] Seq=1378 Ack=1395 Win=65152 Len=17 TSval=3721969638 TSecr=1597709929
1712099480.280755758   563 0.638490324    10.10.1.2 → 10.10.1.1    TCP 83 45708 → 8081 [PSH, ACK] Seq=1395 Ack=1395 Win=64256 Len=17 TSval=1597709931 TSecr=3721969638
1712099482.280755758   565 0.638615978    10.10.1.1 → 10.10.1.2    TCP 83 8081 → 45708 [PSH, ACK] Seq=1395 Ack=1412 Win=65152 Len=17 TSval=3721969639 TSecr=1597709931
1712099487.280755758   570 0.639822480    10.10.1.2 → 10.10.1.1    TCP 83 45708 → 8081 [PSH, ACK] Seq=1412 Ack=1412 Win=64256 Len=17 TSval=1597709932 TSecr=3721969639
1712099489.280755758   572 0.639958667    10.10.1.1 → 10.10.1.2    TCP 83 8081 → 45708 [PSH, ACK] Seq=1412 Ack=1429 Win=65152 Len=17 TSval=3721969641 TSecr=1597709932
1712099493.280755758   576 0.641166324    10.10.1.2 → 10.10.1.1    TCP 83 45708 → 8081 [PSH, ACK] Seq=1429 Ack=1429 Win=64256 Len=17 TSval=1597709933 TSecr=3721969641
1712099496.280755758   579 0.641296095    10.10.1.1 → 10.10.1.2    TCP 83 8081 → 45708 [PSH, ACK] Seq=1429 Ack=1446 Win=65152 Len=17 TSval=3721969642 TSecr=1597709933
1712099500.280755758   583 0.642501902    10.10.1.2 → 10.10.1.1    TCP 83 45708 → 8081 [PSH, ACK] Seq=1446 Ack=1446 Win=64256 Len=17 TSval=1597709935 TSecr=3721969642
1712099502.280755758   585 0.642628303    10.10.1.1 → 10.10.1.2    TCP 83 8081 → 45708 [PSH, ACK] Seq=1446 Ack=1463 Win=65152 Len=17 TSval=3721969643 TSecr=1597709935
1712099506.280755758   589 0.643833805    10.10.1.2 → 10.10.1.1    TCP 83 45708 → 8081 [PSH, ACK] Seq=1463 Ack=1463 Win=64256 Len=17 TSval=1597709936 TSecr=3721969643
1712099508.280755758   591 0.643955810    10.10.1.1 → 10.10.1.2    TCP 83 8081 → 45708 [PSH, ACK] Seq=1463 Ack=1480 Win=65152 Len=17 TSval=3721969645 TSecr=1597709936
1712099513.280755758   596 0.645163383    10.10.1.2 → 10.10.1.1    TCP 83 45708 → 8081 [PSH, ACK] Seq=1480 Ack=1480 Win=64256 Len=17 TSval=1597709937 TSecr=3721969645
1712099515.280755758   598 0.645287581    10.10.1.1 → 10.10.1.2    TCP 83 8081 → 45708 [PSH, ACK] Seq=1480 Ack=1497 Win=65152 Len=17 TSval=3721969646 TSecr=1597709937
1712099519.280755758   602 0.646504551    10.10.1.2 → 10.10.1.1    TCP 83 45708 → 8081 [PSH, ACK] Seq=1497 Ack=1497 Win=64256 Len=17 TSval=1597709939 TSecr=3721969646
1712099521.280755758   604 0.646634843    10.10.1.1 → 10.10.1.2    TCP 83 8081 → 45708 [PSH, ACK] Seq=1497 Ack=1514 Win=65152 Len=17 TSval=3721969647 TSecr=1597709939
1712099526.280755758   609 0.647851943    10.10.1.2 → 10.10.1.1    TCP 83 45708 → 8081 [PSH, ACK] Seq=1514 Ack=1514 Win=64256 Len=17 TSval=1597709940 TSecr=3721969647
1712099528.280755758   611 0.647979812    10.10.1.1 → 10.10.1.2    TCP 83 8081 → 45708 [PSH, ACK] Seq=1514 Ack=1531 Win=65152 Len=17 TSval=3721969649 TSecr=1597709940
1712099532.280755758   615 0.649189967    10.10.1.2 → 10.10.1.1    TCP 83 45708 → 8081 [PSH, ACK] Seq=1531 Ack=1531 Win=64256 Len=17 TSval=1597709942 TSecr=3721969649
1712099534.280755758   617 0.649320660    10.10.1.1 → 10.10.1.2    TCP 83 8081 → 45708 [PSH, ACK] Seq=1531 Ack=1548 Win=65152 Len=17 TSval=3721969650 TSecr=1597709942
1712099539.280755758   622 0.650525870    10.10.1.2 → 10.10.1.1    TCP 83 45708 → 8081 [PSH, ACK] Seq=1548 Ack=1548 Win=64256 Len=17 TSval=1597709943 TSecr=3721969650
1712099541.280755758   624 0.650652141    10.10.1.1 → 10.10.1.2    TCP 83 8081 → 45708 [PSH, ACK] Seq=1548 Ack=1565 Win=65152 Len=17 TSval=3721969651 TSecr=1597709943
1712099545.280755758   628 0.651857984    10.10.1.2 → 10.10.1.1    TCP 83 45708 → 8081 [PSH, ACK] Seq=1565 Ack=1565 Win=64256 Len=17 TSval=1597709944 TSecr=3721969651
1712099548.280755758   631 0.651993639    10.10.1.1 → 10.10.1.2    TCP 83 8081 → 45708 [PSH, ACK] Seq=1565 Ack=1582 Win=65152 Len=17 TSval=3721969653 TSecr=1597709944
1712099552.280755758   635 0.653202802    10.10.1.2 → 10.10.1.1    TCP 83 45708 → 8081 [PSH, ACK] Seq=1582 Ack=1582 Win=64256 Len=17 TSval=1597709946 TSecr=3721969653
1712099554.280755758   637 0.653331774    10.10.1.1 → 10.10.1.2    TCP 83 8081 → 45708 [PSH, ACK] Seq=1582 Ack=1599 Win=65152 Len=17 TSval=3721969654 TSecr=1597709946
1712099558.280755758   641 0.654537633    10.10.1.2 → 10.10.1.1    TCP 83 45708 → 8081 [PSH, ACK] Seq=1599 Ack=1599 Win=64256 Len=17 TSval=1597709947 TSecr=3721969654
1712099560.280755758   643 0.654673161    10.10.1.1 → 10.10.1.2    TCP 83 8081 → 45708 [PSH, ACK] Seq=1599 Ack=1616 Win=65152 Len=17 TSval=3721969655 TSecr=1597709947
1712099565.280755758   648 0.655879072    10.10.1.2 → 10.10.1.1    TCP 83 45708 → 8081 [PSH, ACK] Seq=1616 Ack=1616 Win=64256 Len=17 TSval=1597709948 TSecr=3721969655
1712099567.280755758   650 0.656006690    10.10.1.1 → 10.10.1.2    TCP 83 8081 → 45708 [PSH, ACK] Seq=1616 Ack=1633 Win=65152 Len=17 TSval=3721969657 TSecr=1597709948
1712099571.280755758   654 0.657216990    10.10.1.2 → 10.10.1.1    TCP 83 45708 → 8081 [PSH, ACK] Seq=1633 Ack=1633 Win=64256 Len=17 TSval=1597709950 TSecr=3721969657
1712099573.280755758   656 0.657352877    10.10.1.1 → 10.10.1.2    TCP 83 8081 → 45708 [PSH, ACK] Seq=1633 Ack=1650 Win=65152 Len=17 TSval=3721969658 TSecr=1597709950
1712099578.280755758   661 0.658558644    10.10.1.2 → 10.10.1.1    TCP 83 45708 → 8081 [PSH, ACK] Seq=1650 Ack=1650 Win=64256 Len=17 TSval=1597709951 TSecr=3721969658
1712099580.280755758   663 0.658684476    10.10.1.1 → 10.10.1.2    TCP 83 8081 → 45708 [PSH, ACK] Seq=1650 Ack=1667 Win=65152 Len=17 TSval=3721969659 TSecr=1597709951
1712099584.280755758   667 0.659889926    10.10.1.2 → 10.10.1.1    TCP 83 45708 → 8081 [PSH, ACK] Seq=1667 Ack=1667 Win=64256 Len=17 TSval=1597709952 TSecr=3721969659
1712099586.280755758   669 0.660016107    10.10.1.1 → 10.10.1.2    TCP 83 8081 → 45708 [PSH, ACK] Seq=1667 Ack=1684 Win=65152 Len=17 TSval=3721969661 TSecr=1597709952
1712099591.280755758   674 0.661238764    10.10.1.2 → 10.10.1.1    TCP 83 45708 → 8081 [PSH, ACK] Seq=1684 Ack=1684 Win=64256 Len=17 TSval=1597709954 TSecr=3721969661
1712099593.280755758   676 0.661371437    10.10.1.1 → 10.10.1.2    TCP 83 8081 → 45708 [PSH, ACK] Seq=1684 Ack=1701 Win=65152 Len=17 TSval=3721969662 TSecr=1597709954
1712099597.280755758   680 0.662576375    10.10.1.2 → 10.10.1.1    TCP 83 45708 → 8081 [PSH, ACK] Seq=1701 Ack=1701 Win=64256 Len=17 TSval=1597709955 TSecr=3721969662
1712099599.280755758   682 0.662702880    10.10.1.1 → 10.10.1.2    TCP 83 8081 → 45708 [PSH, ACK] Seq=1701 Ack=1718 Win=65152 Len=17 TSval=3721969663 TSecr=1597709955
1712099604.280755758   687 0.663909480    10.10.1.2 → 10.10.1.1    TCP 83 45708 → 8081 [PSH, ACK] Seq=1718 Ack=1718 Win=64256 Len=17 TSval=1597709956 TSecr=3721969663
1712099606.280755758   689 0.664031693    10.10.1.1 → 10.10.1.2    TCP 83 8081 → 45708 [PSH, ACK] Seq=1718 Ack=1735 Win=65152 Len=17 TSval=3721969665 TSecr=1597709956
1712099610.280755758   693 0.665240235    10.10.1.2 → 10.10.1.1    TCP 83 45708 → 8081 [PSH, ACK] Seq=1735 Ack=1735 Win=64256 Len=17 TSval=1597709958 TSecr=3721969665
1712099612.280755758   695 0.665368401    10.10.1.1 → 10.10.1.2    TCP 83 8081 → 45708 [PSH, ACK] Seq=1735 Ack=1752 Win=65152 Len=17 TSval=3721969666 TSecr=1597709958
1712099617.280755758   700 0.666573387    10.10.1.2 → 10.10.1.1    TCP 83 45708 → 8081 [PSH, ACK] Seq=1752 Ack=1752 Win=64256 Len=17 TSval=1597709959 TSecr=3721969666
1712099619.280755758   702 0.666700694    10.10.1.1 → 10.10.1.2    TCP 83 8081 → 45708 [PSH, ACK] Seq=1752 Ack=1769 Win=65152 Len=17 TSval=3721969667 TSecr=1597709959
1712099623.280755758   706 0.667906007    10.10.1.2 → 10.10.1.1    TCP 83 45708 → 8081 [PSH, ACK] Seq=1769 Ack=1769 Win=64256 Len=17 TSval=1597709960 TSecr=3721969667
1712099625.280755758   708 0.668031547    10.10.1.1 → 10.10.1.2    TCP 83 8081 → 45708 [PSH, ACK] Seq=1769 Ack=1786 Win=65152 Len=17 TSval=3721969669 TSecr=1597709960
1712099630.280755758   713 0.669241565    10.10.1.2 → 10.10.1.1    TCP 83 45708 → 8081 [PSH, ACK] Seq=1786 Ack=1786 Win=64256 Len=17 TSval=1597709962 TSecr=3721969669
1712099632.280755758   715 0.669381405    10.10.1.1 → 10.10.1.2    TCP 83 8081 → 45708 [PSH, ACK] Seq=1786 Ack=1803 Win=65152 Len=17 TSval=3721969670 TSecr=1597709962
1712099636.280755758   719 0.670587947    10.10.1.2 → 10.10.1.1    TCP 83 45708 → 8081 [PSH, ACK] Seq=1803 Ack=1803 Win=64256 Len=17 TSval=1597709963 TSecr=3721969670
1712099638.280755758   721 0.670723617    10.10.1.1 → 10.10.1.2    TCP 83 8081 → 45708 [PSH, ACK] Seq=1803 Ack=1820 Win=65152 Len=17 TSval=3721969671 TSecr=1597709963
1712099643.280755758   726 0.671929114    10.10.1.2 → 10.10.1.1    TCP 83 45708 → 8081 [PSH, ACK] Seq=1820 Ack=1820 Win=64256 Len=17 TSval=1597709964 TSecr=3721969671
1712099645.280755758   728 0.672054896    10.10.1.1 → 10.10.1.2    TCP 83 8081 → 45708 [PSH, ACK] Seq=1820 Ack=1837 Win=65152 Len=17 TSval=3721969673 TSecr=1597709964
1712099649.280755758   732 0.673265290    10.10.1.2 → 10.10.1.1    TCP 83 45708 → 8081 [PSH, ACK] Seq=1837 Ack=1837 Win=64256 Len=17 TSval=1597709966 TSecr=3721969673
1712099651.280755758   734 0.673400928    10.10.1.1 → 10.10.1.2    TCP 83 8081 → 45708 [PSH, ACK] Seq=1837 Ack=1854 Win=65152 Len=17 TSval=3721969674 TSecr=1597709966
1712099656.280755758   739 0.674607247    10.10.1.2 → 10.10.1.1    TCP 83 45708 → 8081 [PSH, ACK] Seq=1854 Ack=1854 Win=64256 Len=17 TSval=1597709967 TSecr=3721969674
1712099658.280755758   741 0.674733577    10.10.1.1 → 10.10.1.2    TCP 83 8081 → 45708 [PSH, ACK] Seq=1854 Ack=1871 Win=65152 Len=17 TSval=3721969675 TSecr=1597709967
1712099662.280755758   745 0.675939974    10.10.1.2 → 10.10.1.1    TCP 83 45708 → 8081 [PSH, ACK] Seq=1871 Ack=1871 Win=64256 Len=17 TSval=1597709968 TSecr=3721969675
1712099664.280755758   747 0.676066317    10.10.1.1 → 10.10.1.2    TCP 83 8081 → 45708 [PSH, ACK] Seq=1871 Ack=1888 Win=65152 Len=17 TSval=3721969677 TSecr=1597709968
1712099669.280755758   752 0.677274558    10.10.1.2 → 10.10.1.1    TCP 83 45708 → 8081 [PSH, ACK] Seq=1888 Ack=1888 Win=64256 Len=17 TSval=1597709970 TSecr=3721969677
1712099671.280755758   754 0.677357919    10.10.1.1 → 10.10.1.2    TCP 83 8081 → 45708 [PSH, ACK] Seq=1888 Ack=1905 Win=65152 Len=17 TSval=3721969678 TSecr=1597709970
1712099675.280755758   758 0.678563445    10.10.1.2 → 10.10.1.1    TCP 83 45708 → 8081 [PSH, ACK] Seq=1905 Ack=1905 Win=64256 Len=17 TSval=1597709971 TSecr=3721969678
1712099677.280755758   760 0.678689026    10.10.1.1 → 10.10.1.2    TCP 83 8081 → 45708 [PSH, ACK] Seq=1905 Ack=1922 Win=65152 Len=17 TSval=3721969679 TSecr=1597709971
1712099682.280755758   765 0.679894833    10.10.1.2 → 10.10.1.1    TCP 83 45708 → 8081 [PSH, ACK] Seq=1922 Ack=1922 Win=64256 Len=17 TSval=1597709972 TSecr=3721969679
1712099684.280755758   767 0.680066815    10.10.1.1 → 10.10.1.2    TCP 83 8081 → 45708 [PSH, ACK] Seq=1922 Ack=1939 Win=65152 Len=17 TSval=3721969681 TSecr=1597709972
1712099688.280755758   771 0.681275547    10.10.1.2 → 10.10.1.1    TCP 83 45708 → 8081 [PSH, ACK] Seq=1939 Ack=1939 Win=64256 Len=17 TSval=1597709974 TSecr=3721969681
1712099690.280755758   773 0.681415733    10.10.1.1 → 10.10.1.2    TCP 83 8081 → 45708 [PSH, ACK] Seq=1939 Ack=1956 Win=65152 Len=17 TSval=3721969682 TSecr=1597709974
1712099695.280755758   778 0.682621406    10.10.1.2 → 10.10.1.1    TCP 83 45708 → 8081 [PSH, ACK] Seq=1956 Ack=1956 Win=64256 Len=17 TSval=1597709975 TSecr=3721969682
1712099697.280755758   780 0.682747587    10.10.1.1 → 10.10.1.2    TCP 83 8081 → 45708 [PSH, ACK] Seq=1956 Ack=1973 Win=65152 Len=17 TSval=3721969683 TSecr=1597709975
1712099701.280755758   784 0.683952682    10.10.1.2 → 10.10.1.1    TCP 83 45708 → 8081 [PSH, ACK] Seq=1973 Ack=1973 Win=64256 Len=17 TSval=1597709976 TSecr=3721969683
1712099703.280755758   786 0.684079330    10.10.1.1 → 10.10.1.2    TCP 83 8081 → 45708 [PSH, ACK] Seq=1973 Ack=1990 Win=65152 Len=17 TSval=3721969685 TSecr=1597709976
1712099708.280755758   791 0.685288289    10.10.1.2 → 10.10.1.1    TCP 83 45708 → 8081 [PSH, ACK] Seq=1990 Ack=1990 Win=64256 Len=17 TSval=1597709978 TSecr=3721969685
1712099710.280755758   793 0.685419028    10.10.1.1 → 10.10.1.2    TCP 83 8081 → 45708 [PSH, ACK] Seq=1990 Ack=2007 Win=65152 Len=17 TSval=3721969686 TSecr=1597709978
1712099714.280755758   797 0.686624783    10.10.1.2 → 10.10.1.1    TCP 83 45708 → 8081 [PSH, ACK] Seq=2007 Ack=2007 Win=64256 Len=17 TSval=1597709979 TSecr=3721969686
1712099716.280755758   799 0.686759919    10.10.1.1 → 10.10.1.2    TCP 83 8081 → 45708 [PSH, ACK] Seq=2007 Ack=2024 Win=65152 Len=17 TSval=3721969687 TSecr=1597709979
1712099721.280755758   804 0.687966668    10.10.1.2 → 10.10.1.1    TCP 83 45708 → 8081 [PSH, ACK] Seq=2024 Ack=2024 Win=64256 Len=17 TSval=1597709980 TSecr=3721969687
1712099723.280755758   806 0.688092387    10.10.1.1 → 10.10.1.2    TCP 83 8081 → 45708 [PSH, ACK] Seq=2024 Ack=2041 Win=65152 Len=17 TSval=3721969689 TSecr=1597709980
1712099727.280755758   810 0.689303183    10.10.1.2 → 10.10.1.1    TCP 83 45708 → 8081 [PSH, ACK] Seq=2041 Ack=2041 Win=64256 Len=17 TSval=1597709982 TSecr=3721969689
