1711548295.472070217    16 0.264150452    10.10.1.2 → 10.10.1.1    TCP 74 40142 → 8081 [SYN] Seq=0 Win=64240 Len=0 MSS=1460 SACK_PERM=1 TSval=1047071764 TSecr=0 WS=128
1711548296.472070217    17 0.264181809    10.10.1.1 → 10.10.1.2    TCP 74 8081 → 40142 [SYN, ACK] Seq=0 Ack=1 Win=65160 Len=0 MSS=1460 SACK_PERM=1 TSval=3171331474 TSecr=1047071764 WS=128
1711548297.472070217    18 0.264219203    10.10.1.2 → 10.10.1.1    TCP 66 40142 → 8081 [ACK] Seq=1 Ack=1 Win=64256 Len=0 TSval=1047071764 TSecr=3171331474
1711548301.472070217    22 0.513794733    10.10.1.2 → 10.10.1.1    TCP 83 40142 → 8081 [PSH, ACK] Seq=1 Ack=1 Win=64256 Len=17 TSval=1047072013 TSecr=3171331474
1711548304.472070217    25 0.513814858    10.10.1.1 → 10.10.1.2    TCP 66 8081 → 40142 [ACK] Seq=1 Ack=18 Win=65152 Len=0 TSval=3171331724 TSecr=1047072013
1711548305.472070217    26 0.514042833    10.10.1.1 → 10.10.1.2    TCP 83 8081 → 40142 [PSH, ACK] Seq=1 Ack=18 Win=65152 Len=17 TSval=3171331724 TSecr=1047072013
1711548306.472070217    27 0.514074391    10.10.1.2 → 10.10.1.1    TCP 66 40142 → 8081 [ACK] Seq=18 Ack=18 Win=64256 Len=0 TSval=1047072013 TSecr=3171331724
1711548311.472070217    32 0.515207697    10.10.1.2 → 10.10.1.1    TCP 83 40142 → 8081 [PSH, ACK] Seq=18 Ack=18 Win=64256 Len=17 TSval=1047072015 TSecr=3171331724
1711548314.472070217    35 0.515245685    10.10.1.1 → 10.10.1.2    TCP 83 8081 → 40142 [PSH, ACK] Seq=18 Ack=35 Win=65152 Len=17 TSval=3171331725 TSecr=1047072015
1711548319.472070217    40 0.516402332    10.10.1.2 → 10.10.1.1    TCP 83 40142 → 8081 [PSH, ACK] Seq=35 Ack=35 Win=64256 Len=17 TSval=1047072016 TSecr=3171331725
1711548322.472070217    43 0.516437976    10.10.1.1 → 10.10.1.2    TCP 83 8081 → 40142 [PSH, ACK] Seq=35 Ack=52 Win=65152 Len=17 TSval=3171331726 TSecr=1047072016
1711548327.472070217    48 0.517594417    10.10.1.2 → 10.10.1.1    TCP 83 40142 → 8081 [PSH, ACK] Seq=52 Ack=52 Win=64256 Len=17 TSval=1047072017 TSecr=3171331726
1711548330.472070217    51 0.517624873    10.10.1.1 → 10.10.1.2    TCP 83 8081 → 40142 [PSH, ACK] Seq=52 Ack=69 Win=65152 Len=17 TSval=3171331727 TSecr=1047072017
1711548335.472070217    56 0.518776202    10.10.1.2 → 10.10.1.1    TCP 83 40142 → 8081 [PSH, ACK] Seq=69 Ack=69 Win=64256 Len=17 TSval=1047072018 TSecr=3171331727
1711548338.472070217    59 0.518805762    10.10.1.1 → 10.10.1.2    TCP 83 8081 → 40142 [PSH, ACK] Seq=69 Ack=86 Win=65152 Len=17 TSval=3171331729 TSecr=1047072018
1711548343.472070217    64 0.519959332    10.10.1.2 → 10.10.1.1    TCP 83 40142 → 8081 [PSH, ACK] Seq=86 Ack=86 Win=64256 Len=17 TSval=1047072019 TSecr=3171331729
1711548345.472070217    66 0.519994053    10.10.1.1 → 10.10.1.2    TCP 83 8081 → 40142 [PSH, ACK] Seq=86 Ack=103 Win=65152 Len=17 TSval=3171331730 TSecr=1047072019
1711548351.472070217    72 0.521145630    10.10.1.2 → 10.10.1.1    TCP 83 40142 → 8081 [PSH, ACK] Seq=103 Ack=103 Win=64256 Len=17 TSval=1047072021 TSecr=3171331730
1711548353.472070217    74 0.521175821    10.10.1.1 → 10.10.1.2    TCP 83 8081 → 40142 [PSH, ACK] Seq=103 Ack=120 Win=65152 Len=17 TSval=3171331731 TSecr=1047072021
1711548359.472070217    80 0.522330429    10.10.1.2 → 10.10.1.1    TCP 83 40142 → 8081 [PSH, ACK] Seq=120 Ack=120 Win=64256 Len=17 TSval=1047072022 TSecr=3171331731
1711548361.472070217    82 0.522359842    10.10.1.1 → 10.10.1.2    TCP 83 8081 → 40142 [PSH, ACK] Seq=120 Ack=137 Win=65152 Len=17 TSval=3171331732 TSecr=1047072022
1711548367.472070217    88 0.523510586    10.10.1.2 → 10.10.1.1    TCP 83 40142 → 8081 [PSH, ACK] Seq=137 Ack=137 Win=64256 Len=17 TSval=1047072023 TSecr=3171331732
1711548369.472070217    90 0.523538730    10.10.1.1 → 10.10.1.2    TCP 83 8081 → 40142 [PSH, ACK] Seq=137 Ack=154 Win=65152 Len=17 TSval=3171331733 TSecr=1047072023
1711548375.472070217    96 0.524690447    10.10.1.2 → 10.10.1.1    TCP 83 40142 → 8081 [PSH, ACK] Seq=154 Ack=154 Win=64256 Len=17 TSval=1047072024 TSecr=3171331733
1711548377.472070217    98 0.524723017    10.10.1.1 → 10.10.1.2    TCP 83 8081 → 40142 [PSH, ACK] Seq=154 Ack=171 Win=65152 Len=17 TSval=3171331735 TSecr=1047072024
1711548383.472070217   104 0.525878726    10.10.1.2 → 10.10.1.1    TCP 83 40142 → 8081 [PSH, ACK] Seq=171 Ack=171 Win=64256 Len=17 TSval=1047072025 TSecr=3171331735
1711548385.472070217   106 0.525906730    10.10.1.1 → 10.10.1.2    TCP 83 8081 → 40142 [PSH, ACK] Seq=171 Ack=188 Win=65152 Len=17 TSval=3171331736 TSecr=1047072025
1711548391.472070217   112 0.527057754    10.10.1.2 → 10.10.1.1    TCP 83 40142 → 8081 [PSH, ACK] Seq=188 Ack=188 Win=64256 Len=17 TSval=1047072026 TSecr=3171331736
1711548393.472070217   114 0.527085111    10.10.1.1 → 10.10.1.2    TCP 83 8081 → 40142 [PSH, ACK] Seq=188 Ack=205 Win=65152 Len=17 TSval=3171331737 TSecr=1047072026
1711548399.472070217   120 0.528236768    10.10.1.2 → 10.10.1.1    TCP 83 40142 → 8081 [PSH, ACK] Seq=205 Ack=205 Win=64256 Len=17 TSval=1047072028 TSecr=3171331737
1711548401.472070217   122 0.528268905    10.10.1.1 → 10.10.1.2    TCP 83 8081 → 40142 [PSH, ACK] Seq=205 Ack=222 Win=65152 Len=17 TSval=3171331738 TSecr=1047072028
1711548407.472070217   128 0.529423189    10.10.1.2 → 10.10.1.1    TCP 83 40142 → 8081 [PSH, ACK] Seq=222 Ack=222 Win=64256 Len=17 TSval=1047072029 TSecr=3171331738
1711548409.472070217   130 0.529453511    10.10.1.1 → 10.10.1.2    TCP 83 8081 → 40142 [PSH, ACK] Seq=222 Ack=239 Win=65152 Len=17 TSval=3171331739 TSecr=1047072029
1711548415.472070217   136 0.530604474    10.10.1.2 → 10.10.1.1    TCP 83 40142 → 8081 [PSH, ACK] Seq=239 Ack=239 Win=64256 Len=17 TSval=1047072030 TSecr=3171331739
1711548417.472070217   138 0.530634559    10.10.1.1 → 10.10.1.2    TCP 83 8081 → 40142 [PSH, ACK] Seq=239 Ack=256 Win=65152 Len=17 TSval=3171331741 TSecr=1047072030
1711548423.472070217   144 0.531787213    10.10.1.2 → 10.10.1.1    TCP 83 40142 → 8081 [PSH, ACK] Seq=256 Ack=256 Win=64256 Len=17 TSval=1047072031 TSecr=3171331741
1711548425.472070217   146 0.531821413    10.10.1.1 → 10.10.1.2    TCP 83 8081 → 40142 [PSH, ACK] Seq=256 Ack=273 Win=65152 Len=17 TSval=3171331742 TSecr=1047072031
1711548431.472070217   152 0.532973365    10.10.1.2 → 10.10.1.1    TCP 83 40142 → 8081 [PSH, ACK] Seq=273 Ack=273 Win=64256 Len=17 TSval=1047072032 TSecr=3171331742
1711548433.472070217   154 0.533003465    10.10.1.1 → 10.10.1.2    TCP 83 8081 → 40142 [PSH, ACK] Seq=273 Ack=290 Win=65152 Len=17 TSval=3171331743 TSecr=1047072032
1711548439.472070217   160 0.534157521    10.10.1.2 → 10.10.1.1    TCP 83 40142 → 8081 [PSH, ACK] Seq=290 Ack=290 Win=64256 Len=17 TSval=1047072034 TSecr=3171331743
1711548441.472070217   162 0.534187181    10.10.1.1 → 10.10.1.2    TCP 83 8081 → 40142 [PSH, ACK] Seq=290 Ack=307 Win=65152 Len=17 TSval=3171331744 TSecr=1047072034
1711548447.472070217   168 0.535338076    10.10.1.2 → 10.10.1.1    TCP 83 40142 → 8081 [PSH, ACK] Seq=307 Ack=307 Win=64256 Len=17 TSval=1047072035 TSecr=3171331744
1711548449.472070217   170 0.535367432    10.10.1.1 → 10.10.1.2    TCP 83 8081 → 40142 [PSH, ACK] Seq=307 Ack=324 Win=65152 Len=17 TSval=3171331745 TSecr=1047072035
1711548455.472070217   176 0.536519152    10.10.1.2 → 10.10.1.1    TCP 83 40142 → 8081 [PSH, ACK] Seq=324 Ack=324 Win=64256 Len=17 TSval=1047072036 TSecr=3171331745
1711548457.472070217   178 0.536553151    10.10.1.1 → 10.10.1.2    TCP 83 8081 → 40142 [PSH, ACK] Seq=324 Ack=341 Win=65152 Len=17 TSval=3171331746 TSecr=1047072036
1711548463.472070217   184 0.537708808    10.10.1.2 → 10.10.1.1    TCP 83 40142 → 8081 [PSH, ACK] Seq=341 Ack=341 Win=64256 Len=17 TSval=1047072037 TSecr=3171331746
1711548465.472070217   186 0.537747747    10.10.1.1 → 10.10.1.2    TCP 83 8081 → 40142 [PSH, ACK] Seq=341 Ack=358 Win=65152 Len=17 TSval=3171331748 TSecr=1047072037
1711548471.472070217   192 0.538898815    10.10.1.2 → 10.10.1.1    TCP 83 40142 → 8081 [PSH, ACK] Seq=358 Ack=358 Win=64256 Len=17 TSval=1047072038 TSecr=3171331748
1711548473.472070217   194 0.538927675    10.10.1.1 → 10.10.1.2    TCP 83 8081 → 40142 [PSH, ACK] Seq=358 Ack=375 Win=65152 Len=17 TSval=3171331749 TSecr=1047072038
1711548479.472070217   200 0.540078759    10.10.1.2 → 10.10.1.1    TCP 83 40142 → 8081 [PSH, ACK] Seq=375 Ack=375 Win=64256 Len=17 TSval=1047072039 TSecr=3171331749
1711548481.472070217   202 0.540112405    10.10.1.1 → 10.10.1.2    TCP 83 8081 → 40142 [PSH, ACK] Seq=375 Ack=392 Win=65152 Len=17 TSval=3171331750 TSecr=1047072039
1711548487.472070217   208 0.541267010    10.10.1.2 → 10.10.1.1    TCP 83 40142 → 8081 [PSH, ACK] Seq=392 Ack=392 Win=64256 Len=17 TSval=1047072041 TSecr=3171331750
1711548489.472070217   210 0.541297472    10.10.1.1 → 10.10.1.2    TCP 83 8081 → 40142 [PSH, ACK] Seq=392 Ack=409 Win=65152 Len=17 TSval=3171331751 TSecr=1047072041
1711548495.472070217   216 0.542447816    10.10.1.2 → 10.10.1.1    TCP 83 40142 → 8081 [PSH, ACK] Seq=409 Ack=409 Win=64256 Len=17 TSval=1047072042 TSecr=3171331751
1711548497.472070217   218 0.542477249    10.10.1.1 → 10.10.1.2    TCP 83 8081 → 40142 [PSH, ACK] Seq=409 Ack=426 Win=65152 Len=17 TSval=3171331752 TSecr=1047072042
1711548503.472070217   224 0.543627094    10.10.1.2 → 10.10.1.1    TCP 83 40142 → 8081 [PSH, ACK] Seq=426 Ack=426 Win=64256 Len=17 TSval=1047072043 TSecr=3171331752
1711548505.472070217   226 0.543661547    10.10.1.1 → 10.10.1.2    TCP 83 8081 → 40142 [PSH, ACK] Seq=426 Ack=443 Win=65152 Len=17 TSval=3171331754 TSecr=1047072043
1711548511.472070217   232 0.544812842    10.10.1.2 → 10.10.1.1    TCP 83 40142 → 8081 [PSH, ACK] Seq=443 Ack=443 Win=64256 Len=17 TSval=1047072044 TSecr=3171331754
1711548513.472070217   234 0.544846582    10.10.1.1 → 10.10.1.2    TCP 83 8081 → 40142 [PSH, ACK] Seq=443 Ack=460 Win=65152 Len=17 TSval=3171331755 TSecr=1047072044
1711548519.472070217   240 0.546000575    10.10.1.2 → 10.10.1.1    TCP 83 40142 → 8081 [PSH, ACK] Seq=460 Ack=460 Win=64256 Len=17 TSval=1047072045 TSecr=3171331755
1711548521.472070217   242 0.546030905    10.10.1.1 → 10.10.1.2    TCP 83 8081 → 40142 [PSH, ACK] Seq=460 Ack=477 Win=65152 Len=17 TSval=3171331756 TSecr=1047072045
1711548527.472070217   248 0.547180913    10.10.1.2 → 10.10.1.1    TCP 83 40142 → 8081 [PSH, ACK] Seq=477 Ack=477 Win=64256 Len=17 TSval=1047072047 TSecr=3171331756
1711548529.472070217   250 0.547210402    10.10.1.1 → 10.10.1.2    TCP 83 8081 → 40142 [PSH, ACK] Seq=477 Ack=494 Win=65152 Len=17 TSval=3171331757 TSecr=1047072047
1711548535.472070217   256 0.548362186    10.10.1.2 → 10.10.1.1    TCP 83 40142 → 8081 [PSH, ACK] Seq=494 Ack=494 Win=64256 Len=17 TSval=1047072048 TSecr=3171331757
1711548537.472070217   258 0.548397063    10.10.1.1 → 10.10.1.2    TCP 83 8081 → 40142 [PSH, ACK] Seq=494 Ack=511 Win=65152 Len=17 TSval=3171331758 TSecr=1047072048
1711548543.472070217   264 0.549550307    10.10.1.2 → 10.10.1.1    TCP 83 40142 → 8081 [PSH, ACK] Seq=511 Ack=511 Win=64256 Len=17 TSval=1047072049 TSecr=3171331758
1711548545.472070217   266 0.549578383    10.10.1.1 → 10.10.1.2    TCP 83 8081 → 40142 [PSH, ACK] Seq=511 Ack=528 Win=65152 Len=17 TSval=3171331759 TSecr=1047072049
1711548551.472070217   272 0.550729301    10.10.1.2 → 10.10.1.1    TCP 83 40142 → 8081 [PSH, ACK] Seq=528 Ack=528 Win=64256 Len=17 TSval=1047072050 TSecr=3171331759
1711548553.472070217   274 0.550757954    10.10.1.1 → 10.10.1.2    TCP 83 8081 → 40142 [PSH, ACK] Seq=528 Ack=545 Win=65152 Len=17 TSval=3171331761 TSecr=1047072050
1711548559.472070217   280 0.551908452    10.10.1.2 → 10.10.1.1    TCP 83 40142 → 8081 [PSH, ACK] Seq=545 Ack=545 Win=64256 Len=17 TSval=1047072051 TSecr=3171331761
1711548561.472070217   282 0.551940628    10.10.1.1 → 10.10.1.2    TCP 83 8081 → 40142 [PSH, ACK] Seq=545 Ack=562 Win=65152 Len=17 TSval=3171331762 TSecr=1047072051
1711548567.472070217   288 0.553067668    10.10.1.2 → 10.10.1.1    TCP 83 40142 → 8081 [PSH, ACK] Seq=562 Ack=562 Win=64256 Len=17 TSval=1047072052 TSecr=3171331762
1711548569.472070217   290 0.553097263    10.10.1.1 → 10.10.1.2    TCP 83 8081 → 40142 [PSH, ACK] Seq=562 Ack=579 Win=65152 Len=17 TSval=3171331763 TSecr=1047072052
1711548575.472070217   296 0.554249572    10.10.1.2 → 10.10.1.1    TCP 83 40142 → 8081 [PSH, ACK] Seq=579 Ack=579 Win=64256 Len=17 TSval=1047072054 TSecr=3171331763
1711548577.472070217   298 0.554279029    10.10.1.1 → 10.10.1.2    TCP 83 8081 → 40142 [PSH, ACK] Seq=579 Ack=596 Win=65152 Len=17 TSval=3171331764 TSecr=1047072054
1711548583.472070217   304 0.555429149    10.10.1.2 → 10.10.1.1    TCP 83 40142 → 8081 [PSH, ACK] Seq=596 Ack=596 Win=64256 Len=17 TSval=1047072055 TSecr=3171331764
1711548585.472070217   306 0.555458730    10.10.1.1 → 10.10.1.2    TCP 83 8081 → 40142 [PSH, ACK] Seq=596 Ack=613 Win=65152 Len=17 TSval=3171331765 TSecr=1047072055
1711548591.472070217   312 0.556609271    10.10.1.2 → 10.10.1.1    TCP 83 40142 → 8081 [PSH, ACK] Seq=613 Ack=613 Win=64256 Len=17 TSval=1047072056 TSecr=3171331765
1711548593.472070217   314 0.556642231    10.10.1.1 → 10.10.1.2    TCP 83 8081 → 40142 [PSH, ACK] Seq=613 Ack=630 Win=65152 Len=17 TSval=3171331767 TSecr=1047072056
1711548599.472070217   320 0.557795452    10.10.1.2 → 10.10.1.1    TCP 83 40142 → 8081 [PSH, ACK] Seq=630 Ack=630 Win=64256 Len=17 TSval=1047072057 TSecr=3171331767
1711548601.472070217   322 0.557825582    10.10.1.1 → 10.10.1.2    TCP 83 8081 → 40142 [PSH, ACK] Seq=630 Ack=647 Win=65152 Len=17 TSval=3171331768 TSecr=1047072057
1711548607.472070217   328 0.558975766    10.10.1.2 → 10.10.1.1    TCP 83 40142 → 8081 [PSH, ACK] Seq=647 Ack=647 Win=64256 Len=17 TSval=1047072058 TSecr=3171331768
1711548609.472070217   330 0.559005610    10.10.1.1 → 10.10.1.2    TCP 83 8081 → 40142 [PSH, ACK] Seq=647 Ack=664 Win=65152 Len=17 TSval=3171331769 TSecr=1047072058
1711548615.472070217   336 0.560157148    10.10.1.2 → 10.10.1.1    TCP 83 40142 → 8081 [PSH, ACK] Seq=664 Ack=664 Win=64256 Len=17 TSval=1047072060 TSecr=3171331769
1711548617.472070217   338 0.560191657    10.10.1.1 → 10.10.1.2    TCP 83 8081 → 40142 [PSH, ACK] Seq=664 Ack=681 Win=65152 Len=17 TSval=3171331770 TSecr=1047072060
1711548623.472070217   344 0.561347257    10.10.1.2 → 10.10.1.1    TCP 83 40142 → 8081 [PSH, ACK] Seq=681 Ack=681 Win=64256 Len=17 TSval=1047072061 TSecr=3171331770
1711548625.472070217   346 0.561377174    10.10.1.1 → 10.10.1.2    TCP 83 8081 → 40142 [PSH, ACK] Seq=681 Ack=698 Win=65152 Len=17 TSval=3171331771 TSecr=1047072061
1711548631.472070217   352 0.562527474    10.10.1.2 → 10.10.1.1    TCP 83 40142 → 8081 [PSH, ACK] Seq=698 Ack=698 Win=64256 Len=17 TSval=1047072062 TSecr=3171331771
1711548633.472070217   354 0.562555564    10.10.1.1 → 10.10.1.2    TCP 83 8081 → 40142 [PSH, ACK] Seq=698 Ack=715 Win=65152 Len=17 TSval=3171331772 TSecr=1047072062
1711548639.472070217   360 0.563713999    10.10.1.2 → 10.10.1.1    TCP 83 40142 → 8081 [PSH, ACK] Seq=715 Ack=715 Win=64256 Len=17 TSval=1047072063 TSecr=3171331772
1711548641.472070217   362 0.563746285    10.10.1.1 → 10.10.1.2    TCP 83 8081 → 40142 [PSH, ACK] Seq=715 Ack=732 Win=65152 Len=17 TSval=3171331774 TSecr=1047072063
1711548647.472070217   368 0.564897643    10.10.1.2 → 10.10.1.1    TCP 83 40142 → 8081 [PSH, ACK] Seq=732 Ack=732 Win=64256 Len=17 TSval=1047072064 TSecr=3171331774
1711548649.472070217   370 0.564928471    10.10.1.1 → 10.10.1.2    TCP 83 8081 → 40142 [PSH, ACK] Seq=732 Ack=749 Win=65152 Len=17 TSval=3171331775 TSecr=1047072064
1711548655.472070217   376 0.566085060    10.10.1.2 → 10.10.1.1    TCP 83 40142 → 8081 [PSH, ACK] Seq=749 Ack=749 Win=64256 Len=17 TSval=1047072065 TSecr=3171331775
1711548657.472070217   378 0.566114960    10.10.1.1 → 10.10.1.2    TCP 83 8081 → 40142 [PSH, ACK] Seq=749 Ack=766 Win=65152 Len=17 TSval=3171331776 TSecr=1047072065
1711548663.472070217   384 0.567265853    10.10.1.2 → 10.10.1.1    TCP 83 40142 → 8081 [PSH, ACK] Seq=766 Ack=766 Win=64256 Len=17 TSval=1047072067 TSecr=3171331776
1711548665.472070217   386 0.567295493    10.10.1.1 → 10.10.1.2    TCP 83 8081 → 40142 [PSH, ACK] Seq=766 Ack=783 Win=65152 Len=17 TSval=3171331777 TSecr=1047072067
1711548671.472070217   392 0.568453729    10.10.1.2 → 10.10.1.1    TCP 83 40142 → 8081 [PSH, ACK] Seq=783 Ack=783 Win=64256 Len=17 TSval=1047072068 TSecr=3171331777
1711548673.472070217   394 0.568487191    10.10.1.1 → 10.10.1.2    TCP 83 8081 → 40142 [PSH, ACK] Seq=783 Ack=800 Win=65152 Len=17 TSval=3171331778 TSecr=1047072068
1711548679.472070217   400 0.569639991    10.10.1.2 → 10.10.1.1    TCP 83 40142 → 8081 [PSH, ACK] Seq=800 Ack=800 Win=64256 Len=17 TSval=1047072069 TSecr=3171331778
1711548681.472070217   402 0.569669512    10.10.1.1 → 10.10.1.2    TCP 83 8081 → 40142 [PSH, ACK] Seq=800 Ack=817 Win=65152 Len=17 TSval=3171331780 TSecr=1047072069
1711548687.472070217   408 0.570829323    10.10.1.2 → 10.10.1.1    TCP 83 40142 → 8081 [PSH, ACK] Seq=817 Ack=817 Win=64256 Len=17 TSval=1047072070 TSecr=3171331780
1711548689.472070217   410 0.570858604    10.10.1.1 → 10.10.1.2    TCP 83 8081 → 40142 [PSH, ACK] Seq=817 Ack=834 Win=65152 Len=17 TSval=3171331781 TSecr=1047072070
1711548695.472070217   416 0.572009507    10.10.1.2 → 10.10.1.1    TCP 83 40142 → 8081 [PSH, ACK] Seq=834 Ack=834 Win=64256 Len=17 TSval=1047072071 TSecr=3171331781
1711548697.472070217   418 0.572044591    10.10.1.1 → 10.10.1.2    TCP 83 8081 → 40142 [PSH, ACK] Seq=834 Ack=851 Win=65152 Len=17 TSval=3171331782 TSecr=1047072071
1711548703.472070217   424 0.573200170    10.10.1.2 → 10.10.1.1    TCP 83 40142 → 8081 [PSH, ACK] Seq=851 Ack=851 Win=64256 Len=17 TSval=1047072073 TSecr=3171331782
1711548705.472070217   426 0.573230593    10.10.1.1 → 10.10.1.2    TCP 83 8081 → 40142 [PSH, ACK] Seq=851 Ack=868 Win=65152 Len=17 TSval=3171331783 TSecr=1047072073
1711548711.472070217   432 0.574384261    10.10.1.2 → 10.10.1.1    TCP 83 40142 → 8081 [PSH, ACK] Seq=868 Ack=868 Win=64256 Len=17 TSval=1047072074 TSecr=3171331783
1711548713.472070217   434 0.574412858    10.10.1.1 → 10.10.1.2    TCP 83 8081 → 40142 [PSH, ACK] Seq=868 Ack=885 Win=65152 Len=17 TSval=3171331784 TSecr=1047072074
1711548719.472070217   440 0.575576239    10.10.1.2 → 10.10.1.1    TCP 83 40142 → 8081 [PSH, ACK] Seq=885 Ack=885 Win=64256 Len=17 TSval=1047072075 TSecr=3171331784
1711548721.472070217   442 0.575603988    10.10.1.1 → 10.10.1.2    TCP 83 8081 → 40142 [PSH, ACK] Seq=885 Ack=902 Win=65152 Len=17 TSval=3171331785 TSecr=1047072075
1711548727.472070217   448 0.576755176    10.10.1.2 → 10.10.1.1    TCP 83 40142 → 8081 [PSH, ACK] Seq=902 Ack=902 Win=64256 Len=17 TSval=1047072076 TSecr=3171331785
1711548729.472070217   450 0.576787471    10.10.1.1 → 10.10.1.2    TCP 83 8081 → 40142 [PSH, ACK] Seq=902 Ack=919 Win=65152 Len=17 TSval=3171331787 TSecr=1047072076
1711548735.472070217   456 0.577956600    10.10.1.2 → 10.10.1.1    TCP 83 40142 → 8081 [PSH, ACK] Seq=919 Ack=919 Win=64256 Len=17 TSval=1047072077 TSecr=3171331787
1711548737.472070217   458 0.577985430    10.10.1.1 → 10.10.1.2    TCP 83 8081 → 40142 [PSH, ACK] Seq=919 Ack=936 Win=65152 Len=17 TSval=3171331788 TSecr=1047072077
1711548743.472070217   464 0.579135811    10.10.1.2 → 10.10.1.1    TCP 83 40142 → 8081 [PSH, ACK] Seq=936 Ack=936 Win=64256 Len=17 TSval=1047072079 TSecr=3171331788
1711548745.472070217   466 0.579162931    10.10.1.1 → 10.10.1.2    TCP 83 8081 → 40142 [PSH, ACK] Seq=936 Ack=953 Win=65152 Len=17 TSval=3171331789 TSecr=1047072079
1711548751.472070217   472 0.580334812    10.10.1.2 → 10.10.1.1    TCP 83 40142 → 8081 [PSH, ACK] Seq=953 Ack=953 Win=64256 Len=17 TSval=1047072080 TSecr=3171331789
1711548754.472070217   475 0.580434526    10.10.1.1 → 10.10.1.2    TCP 83 8081 → 40142 [PSH, ACK] Seq=953 Ack=970 Win=65152 Len=17 TSval=3171331790 TSecr=1047072080
1711548759.472070217   480 0.581588190    10.10.1.2 → 10.10.1.1    TCP 83 40142 → 8081 [PSH, ACK] Seq=970 Ack=970 Win=64256 Len=17 TSval=1047072081 TSecr=3171331790
1711548761.472070217   482 0.581617248    10.10.1.1 → 10.10.1.2    TCP 83 8081 → 40142 [PSH, ACK] Seq=970 Ack=987 Win=65152 Len=17 TSval=3171331791 TSecr=1047072081
1711548767.472070217   488 0.582786634    10.10.1.2 → 10.10.1.1    TCP 83 40142 → 8081 [PSH, ACK] Seq=987 Ack=987 Win=64256 Len=17 TSval=1047072082 TSecr=3171331791
1711548769.472070217   490 0.582813779    10.10.1.1 → 10.10.1.2    TCP 83 8081 → 40142 [PSH, ACK] Seq=987 Ack=1004 Win=65152 Len=17 TSval=3171331793 TSecr=1047072082
1711548775.472070217   496 0.583964901    10.10.1.2 → 10.10.1.1    TCP 83 40142 → 8081 [PSH, ACK] Seq=1004 Ack=1004 Win=64256 Len=17 TSval=1047072083 TSecr=3171331793
1711548777.472070217   498 0.583996646    10.10.1.1 → 10.10.1.2    TCP 83 8081 → 40142 [PSH, ACK] Seq=1004 Ack=1021 Win=65152 Len=17 TSval=3171331794 TSecr=1047072083
1711548783.472070217   504 0.585165803    10.10.1.2 → 10.10.1.1    TCP 83 40142 → 8081 [PSH, ACK] Seq=1021 Ack=1021 Win=64256 Len=17 TSval=1047072085 TSecr=3171331794
1711548785.472070217   506 0.585196064    10.10.1.1 → 10.10.1.2    TCP 83 8081 → 40142 [PSH, ACK] Seq=1021 Ack=1038 Win=65152 Len=17 TSval=3171331795 TSecr=1047072085
1711548791.472070217   512 0.586348953    10.10.1.2 → 10.10.1.1    TCP 83 40142 → 8081 [PSH, ACK] Seq=1038 Ack=1038 Win=64256 Len=17 TSval=1047072086 TSecr=3171331795
1711548793.472070217   514 0.586378786    10.10.1.1 → 10.10.1.2    TCP 83 8081 → 40142 [PSH, ACK] Seq=1038 Ack=1055 Win=65152 Len=17 TSval=3171331796 TSecr=1047072086
1711548799.472070217   520 0.587552688    10.10.1.2 → 10.10.1.1    TCP 83 40142 → 8081 [PSH, ACK] Seq=1055 Ack=1055 Win=64256 Len=17 TSval=1047072087 TSecr=3171331796
1711548801.472070217   522 0.587582409    10.10.1.1 → 10.10.1.2    TCP 83 8081 → 40142 [PSH, ACK] Seq=1055 Ack=1072 Win=65152 Len=17 TSval=3171331797 TSecr=1047072087
1711548807.472070217   528 0.588732566    10.10.1.2 → 10.10.1.1    TCP 83 40142 → 8081 [PSH, ACK] Seq=1072 Ack=1072 Win=64256 Len=17 TSval=1047072088 TSecr=3171331797
1711548809.472070217   530 0.588767259    10.10.1.1 → 10.10.1.2    TCP 83 8081 → 40142 [PSH, ACK] Seq=1072 Ack=1089 Win=65152 Len=17 TSval=3171331799 TSecr=1047072088
1711548815.472070217   536 0.589940735    10.10.1.2 → 10.10.1.1    TCP 83 40142 → 8081 [PSH, ACK] Seq=1089 Ack=1089 Win=64256 Len=17 TSval=1047072089 TSecr=3171331799
1711548817.472070217   538 0.589970166    10.10.1.1 → 10.10.1.2    TCP 83 8081 → 40142 [PSH, ACK] Seq=1089 Ack=1106 Win=65152 Len=17 TSval=3171331800 TSecr=1047072089
1711548823.472070217   544 0.591121902    10.10.1.2 → 10.10.1.1    TCP 83 40142 → 8081 [PSH, ACK] Seq=1106 Ack=1106 Win=64256 Len=17 TSval=1047072091 TSecr=3171331800
1711548825.472070217   546 0.591151337    10.10.1.1 → 10.10.1.2    TCP 83 8081 → 40142 [PSH, ACK] Seq=1106 Ack=1123 Win=65152 Len=17 TSval=3171331801 TSecr=1047072091
1711548831.472070217   552 0.592329364    10.10.1.2 → 10.10.1.1    TCP 83 40142 → 8081 [PSH, ACK] Seq=1123 Ack=1123 Win=64256 Len=17 TSval=1047072092 TSecr=3171331801
1711548833.472070217   554 0.592362755    10.10.1.1 → 10.10.1.2    TCP 83 8081 → 40142 [PSH, ACK] Seq=1123 Ack=1140 Win=65152 Len=17 TSval=3171331802 TSecr=1047072092
1711548839.472070217   560 0.593516238    10.10.1.2 → 10.10.1.1    TCP 83 40142 → 8081 [PSH, ACK] Seq=1140 Ack=1140 Win=64256 Len=17 TSval=1047072093 TSecr=3171331802
1711548841.472070217   562 0.593545882    10.10.1.1 → 10.10.1.2    TCP 83 8081 → 40142 [PSH, ACK] Seq=1140 Ack=1157 Win=65152 Len=17 TSval=3171331803 TSecr=1047072093
1711548847.472070217   568 0.594725323    10.10.1.2 → 10.10.1.1    TCP 83 40142 → 8081 [PSH, ACK] Seq=1157 Ack=1157 Win=64256 Len=17 TSval=1047072094 TSecr=3171331803
1711548849.472070217   570 0.594752606    10.10.1.1 → 10.10.1.2    TCP 83 8081 → 40142 [PSH, ACK] Seq=1157 Ack=1174 Win=65152 Len=17 TSval=3171331805 TSecr=1047072094
1711548855.472070217   576 0.595903221    10.10.1.2 → 10.10.1.1    TCP 83 40142 → 8081 [PSH, ACK] Seq=1174 Ack=1174 Win=64256 Len=17 TSval=1047072095 TSecr=3171331805
1711548857.472070217   578 0.595935907    10.10.1.1 → 10.10.1.2    TCP 83 8081 → 40142 [PSH, ACK] Seq=1174 Ack=1191 Win=65152 Len=17 TSval=3171331806 TSecr=1047072095
1711548863.472070217   584 0.597115250    10.10.1.2 → 10.10.1.1    TCP 83 40142 → 8081 [PSH, ACK] Seq=1191 Ack=1191 Win=64256 Len=17 TSval=1047072097 TSecr=3171331806
1711548865.472070217   586 0.597145654    10.10.1.1 → 10.10.1.2    TCP 83 8081 → 40142 [PSH, ACK] Seq=1191 Ack=1208 Win=65152 Len=17 TSval=3171331807 TSecr=1047072097
1711548871.472070217   592 0.598298778    10.10.1.2 → 10.10.1.1    TCP 83 40142 → 8081 [PSH, ACK] Seq=1208 Ack=1208 Win=64256 Len=17 TSval=1047072098 TSecr=3171331807
1711548873.472070217   594 0.598328012    10.10.1.1 → 10.10.1.2    TCP 83 8081 → 40142 [PSH, ACK] Seq=1208 Ack=1225 Win=65152 Len=17 TSval=3171331808 TSecr=1047072098
1711548879.472070217   600 0.599511529    10.10.1.2 → 10.10.1.1    TCP 83 40142 → 8081 [PSH, ACK] Seq=1225 Ack=1225 Win=64256 Len=17 TSval=1047072099 TSecr=3171331808
1711548881.472070217   602 0.599541133    10.10.1.1 → 10.10.1.2    TCP 83 8081 → 40142 [PSH, ACK] Seq=1225 Ack=1242 Win=65152 Len=17 TSval=3171331809 TSecr=1047072099
1711548887.472070217   608 0.600691761    10.10.1.2 → 10.10.1.1    TCP 83 40142 → 8081 [PSH, ACK] Seq=1242 Ack=1242 Win=64256 Len=17 TSval=1047072100 TSecr=3171331809
1711548889.472070217   610 0.600724651    10.10.1.1 → 10.10.1.2    TCP 83 8081 → 40142 [PSH, ACK] Seq=1242 Ack=1259 Win=65152 Len=17 TSval=3171331811 TSecr=1047072100
1711548895.472070217   616 0.601910453    10.10.1.2 → 10.10.1.1    TCP 83 40142 → 8081 [PSH, ACK] Seq=1259 Ack=1259 Win=64256 Len=17 TSval=1047072101 TSecr=3171331811
1711548897.472070217   618 0.601940292    10.10.1.1 → 10.10.1.2    TCP 83 8081 → 40142 [PSH, ACK] Seq=1259 Ack=1276 Win=65152 Len=17 TSval=3171331812 TSecr=1047072101
1711548903.472070217   624 0.603090368    10.10.1.2 → 10.10.1.1    TCP 83 40142 → 8081 [PSH, ACK] Seq=1276 Ack=1276 Win=64256 Len=17 TSval=1047072102 TSecr=3171331812
1711548905.472070217   626 0.603119658    10.10.1.1 → 10.10.1.2    TCP 83 8081 → 40142 [PSH, ACK] Seq=1276 Ack=1293 Win=65152 Len=17 TSval=3171331813 TSecr=1047072102
1711548911.472070217   632 0.604309576    10.10.1.2 → 10.10.1.1    TCP 83 40142 → 8081 [PSH, ACK] Seq=1293 Ack=1293 Win=64256 Len=17 TSval=1047072104 TSecr=3171331813
1711548913.472070217   634 0.604344616    10.10.1.1 → 10.10.1.2    TCP 83 8081 → 40142 [PSH, ACK] Seq=1293 Ack=1310 Win=65152 Len=17 TSval=3171331814 TSecr=1047072104
1711548919.472070217   640 0.605497620    10.10.1.2 → 10.10.1.1    TCP 83 40142 → 8081 [PSH, ACK] Seq=1310 Ack=1310 Win=64256 Len=17 TSval=1047072105 TSecr=3171331814
1711548921.472070217   642 0.605527874    10.10.1.1 → 10.10.1.2    TCP 83 8081 → 40142 [PSH, ACK] Seq=1310 Ack=1327 Win=65152 Len=17 TSval=3171331815 TSecr=1047072105
1711548927.472070217   648 0.606718469    10.10.1.2 → 10.10.1.1    TCP 83 40142 → 8081 [PSH, ACK] Seq=1327 Ack=1327 Win=64256 Len=17 TSval=1047072106 TSecr=3171331815
1711548929.472070217   650 0.606745964    10.10.1.1 → 10.10.1.2    TCP 83 8081 → 40142 [PSH, ACK] Seq=1327 Ack=1344 Win=65152 Len=17 TSval=3171331817 TSecr=1047072106
1711548935.472070217   656 0.607897546    10.10.1.2 → 10.10.1.1    TCP 83 40142 → 8081 [PSH, ACK] Seq=1344 Ack=1344 Win=64256 Len=17 TSval=1047072107 TSecr=3171331817
1711548937.472070217   658 0.607928016    10.10.1.1 → 10.10.1.2    TCP 83 8081 → 40142 [PSH, ACK] Seq=1344 Ack=1361 Win=65152 Len=17 TSval=3171331818 TSecr=1047072107
1711548943.472070217   664 0.609115504    10.10.1.2 → 10.10.1.1    TCP 83 40142 → 8081 [PSH, ACK] Seq=1361 Ack=1361 Win=64256 Len=17 TSval=1047072109 TSecr=3171331818
1711548945.472070217   666 0.609145154    10.10.1.1 → 10.10.1.2    TCP 83 8081 → 40142 [PSH, ACK] Seq=1361 Ack=1378 Win=65152 Len=17 TSval=3171331819 TSecr=1047072109
1711548951.472070217   672 0.610297882    10.10.1.2 → 10.10.1.1    TCP 83 40142 → 8081 [PSH, ACK] Seq=1378 Ack=1378 Win=64256 Len=17 TSval=1047072110 TSecr=3171331819
1711548953.472070217   674 0.610327497    10.10.1.1 → 10.10.1.2    TCP 83 8081 → 40142 [PSH, ACK] Seq=1378 Ack=1395 Win=65152 Len=17 TSval=3171331820 TSecr=1047072110
1711548959.472070217   680 0.611522931    10.10.1.2 → 10.10.1.1    TCP 83 40142 → 8081 [PSH, ACK] Seq=1395 Ack=1395 Win=64256 Len=17 TSval=1047072111 TSecr=3171331820
1711548961.472070217   682 0.611552869    10.10.1.1 → 10.10.1.2    TCP 83 8081 → 40142 [PSH, ACK] Seq=1395 Ack=1412 Win=65152 Len=17 TSval=3171331821 TSecr=1047072111
1711548967.472070217   688 0.612704251    10.10.1.2 → 10.10.1.1    TCP 83 40142 → 8081 [PSH, ACK] Seq=1412 Ack=1412 Win=64256 Len=17 TSval=1047072112 TSecr=3171331821
1711548969.472070217   690 0.612738246    10.10.1.1 → 10.10.1.2    TCP 83 8081 → 40142 [PSH, ACK] Seq=1412 Ack=1429 Win=65152 Len=17 TSval=3171331823 TSecr=1047072112
1711548975.472070217   696 0.613931157    10.10.1.2 → 10.10.1.1    TCP 83 40142 → 8081 [PSH, ACK] Seq=1429 Ack=1429 Win=64256 Len=17 TSval=1047072113 TSecr=3171331823
1711548977.472070217   698 0.613961584    10.10.1.1 → 10.10.1.2    TCP 83 8081 → 40142 [PSH, ACK] Seq=1429 Ack=1446 Win=65152 Len=17 TSval=3171331824 TSecr=1047072113
1711548983.472070217   704 0.615111782    10.10.1.2 → 10.10.1.1    TCP 83 40142 → 8081 [PSH, ACK] Seq=1446 Ack=1446 Win=64256 Len=17 TSval=1047072115 TSecr=3171331824
1711548985.472070217   706 0.615141442    10.10.1.1 → 10.10.1.2    TCP 83 8081 → 40142 [PSH, ACK] Seq=1446 Ack=1463 Win=65152 Len=17 TSval=3171331825 TSecr=1047072115
1711548991.472070217   712 0.616342736    10.10.1.2 → 10.10.1.1    TCP 83 40142 → 8081 [PSH, ACK] Seq=1463 Ack=1463 Win=64256 Len=17 TSval=1047072116 TSecr=3171331825
1711548993.472070217   714 0.616377373    10.10.1.1 → 10.10.1.2    TCP 83 8081 → 40142 [PSH, ACK] Seq=1463 Ack=1480 Win=65152 Len=17 TSval=3171331826 TSecr=1047072116
1711548999.472070217   720 0.617530362    10.10.1.2 → 10.10.1.1    TCP 83 40142 → 8081 [PSH, ACK] Seq=1480 Ack=1480 Win=64256 Len=17 TSval=1047072117 TSecr=3171331826
1711549001.472070217   722 0.617560250    10.10.1.1 → 10.10.1.2    TCP 83 8081 → 40142 [PSH, ACK] Seq=1480 Ack=1497 Win=65152 Len=17 TSval=3171331827 TSecr=1047072117
1711549007.472070217   728 0.618759608    10.10.1.2 → 10.10.1.1    TCP 83 40142 → 8081 [PSH, ACK] Seq=1497 Ack=1497 Win=64256 Len=17 TSval=1047072118 TSecr=3171331827
1711549009.472070217   730 0.618786848    10.10.1.1 → 10.10.1.2    TCP 83 8081 → 40142 [PSH, ACK] Seq=1497 Ack=1514 Win=65152 Len=17 TSval=3171331829 TSecr=1047072118
1711549015.472070217   736 0.619937460    10.10.1.2 → 10.10.1.1    TCP 83 40142 → 8081 [PSH, ACK] Seq=1514 Ack=1514 Win=64256 Len=17 TSval=1047072119 TSecr=3171331829
1711549017.472070217   738 0.619969353    10.10.1.1 → 10.10.1.2    TCP 83 8081 → 40142 [PSH, ACK] Seq=1514 Ack=1531 Win=65152 Len=17 TSval=3171331830 TSecr=1047072119
1711549023.472070217   744 0.621169271    10.10.1.2 → 10.10.1.1    TCP 83 40142 → 8081 [PSH, ACK] Seq=1531 Ack=1531 Win=64256 Len=17 TSval=1047072121 TSecr=3171331830
1711549025.472070217   746 0.621199277    10.10.1.1 → 10.10.1.2    TCP 83 8081 → 40142 [PSH, ACK] Seq=1531 Ack=1548 Win=65152 Len=17 TSval=3171331831 TSecr=1047072121
1711549031.472070217   752 0.622352424    10.10.1.2 → 10.10.1.1    TCP 83 40142 → 8081 [PSH, ACK] Seq=1548 Ack=1548 Win=64256 Len=17 TSval=1047072122 TSecr=3171331831
1711549033.472070217   754 0.622382726    10.10.1.1 → 10.10.1.2    TCP 83 8081 → 40142 [PSH, ACK] Seq=1548 Ack=1565 Win=65152 Len=17 TSval=3171331832 TSecr=1047072122
1711549039.472070217   760 0.623587013    10.10.1.2 → 10.10.1.1    TCP 83 40142 → 8081 [PSH, ACK] Seq=1565 Ack=1565 Win=64256 Len=17 TSval=1047072123 TSecr=3171331832
1711549041.472070217   762 0.623616932    10.10.1.1 → 10.10.1.2    TCP 83 8081 → 40142 [PSH, ACK] Seq=1565 Ack=1582 Win=65152 Len=17 TSval=3171331833 TSecr=1047072123
1711549047.472070217   768 0.624768160    10.10.1.2 → 10.10.1.1    TCP 83 40142 → 8081 [PSH, ACK] Seq=1582 Ack=1582 Win=64256 Len=17 TSval=1047072124 TSecr=3171331833
1711549049.472070217   770 0.624802391    10.10.1.1 → 10.10.1.2    TCP 83 8081 → 40142 [PSH, ACK] Seq=1582 Ack=1599 Win=65152 Len=17 TSval=3171331835 TSecr=1047072124
1711549055.472070217   776 0.626005832    10.10.1.2 → 10.10.1.1    TCP 83 40142 → 8081 [PSH, ACK] Seq=1599 Ack=1599 Win=64256 Len=17 TSval=1047072125 TSecr=3171331835
1711549057.472070217   778 0.626035419    10.10.1.1 → 10.10.1.2    TCP 83 8081 → 40142 [PSH, ACK] Seq=1599 Ack=1616 Win=65152 Len=17 TSval=3171331836 TSecr=1047072125
1711549063.472070217   784 0.627186299    10.10.1.2 → 10.10.1.1    TCP 83 40142 → 8081 [PSH, ACK] Seq=1616 Ack=1616 Win=64256 Len=17 TSval=1047072127 TSecr=3171331836
1711549065.472070217   786 0.627215545    10.10.1.1 → 10.10.1.2    TCP 83 8081 → 40142 [PSH, ACK] Seq=1616 Ack=1633 Win=65152 Len=17 TSval=3171331837 TSecr=1047072127
1711549071.472070217   792 0.628426797    10.10.1.2 → 10.10.1.1    TCP 83 40142 → 8081 [PSH, ACK] Seq=1633 Ack=1633 Win=64256 Len=17 TSval=1047072128 TSecr=3171331837
1711549073.472070217   794 0.628460410    10.10.1.1 → 10.10.1.2    TCP 83 8081 → 40142 [PSH, ACK] Seq=1633 Ack=1650 Win=65152 Len=17 TSval=3171331838 TSecr=1047072128
1711549079.472070217   800 0.629615432    10.10.1.2 → 10.10.1.1    TCP 83 40142 → 8081 [PSH, ACK] Seq=1650 Ack=1650 Win=64256 Len=17 TSval=1047072129 TSecr=3171331838
1711549081.472070217   802 0.629645167    10.10.1.1 → 10.10.1.2    TCP 83 8081 → 40142 [PSH, ACK] Seq=1650 Ack=1667 Win=65152 Len=17 TSval=3171331840 TSecr=1047072129
1711549087.472070217   808 0.630854975    10.10.1.2 → 10.10.1.1    TCP 83 40142 → 8081 [PSH, ACK] Seq=1667 Ack=1667 Win=64256 Len=17 TSval=1047072130 TSecr=3171331840
1711549089.472070217   810 0.630884486    10.10.1.1 → 10.10.1.2    TCP 83 8081 → 40142 [PSH, ACK] Seq=1667 Ack=1684 Win=65152 Len=17 TSval=3171331841 TSecr=1047072130
1711549095.472070217   816 0.632034987    10.10.1.2 → 10.10.1.1    TCP 83 40142 → 8081 [PSH, ACK] Seq=1684 Ack=1684 Win=64256 Len=17 TSval=1047072131 TSecr=3171331841
1711549097.472070217   818 0.632069303    10.10.1.1 → 10.10.1.2    TCP 83 8081 → 40142 [PSH, ACK] Seq=1684 Ack=1701 Win=65152 Len=17 TSval=3171331842 TSecr=1047072131
1711549103.472070217   824 0.633278095    10.10.1.2 → 10.10.1.1    TCP 83 40142 → 8081 [PSH, ACK] Seq=1701 Ack=1701 Win=64256 Len=17 TSval=1047072133 TSecr=3171331842
1711549105.472070217   826 0.633307712    10.10.1.1 → 10.10.1.2    TCP 83 8081 → 40142 [PSH, ACK] Seq=1701 Ack=1718 Win=65152 Len=17 TSval=3171331843 TSecr=1047072133
1711549111.472070217   832 0.634458925    10.10.1.2 → 10.10.1.1    TCP 83 40142 → 8081 [PSH, ACK] Seq=1718 Ack=1718 Win=64256 Len=17 TSval=1047072134 TSecr=3171331843
1711549113.472070217   834 0.634488249    10.10.1.1 → 10.10.1.2    TCP 83 8081 → 40142 [PSH, ACK] Seq=1718 Ack=1735 Win=65152 Len=17 TSval=3171331844 TSecr=1047072134
1711549119.472070217   840 0.635703291    10.10.1.2 → 10.10.1.1    TCP 83 40142 → 8081 [PSH, ACK] Seq=1735 Ack=1735 Win=64256 Len=17 TSval=1047072135 TSecr=3171331844
1711549121.472070217   842 0.635737068    10.10.1.1 → 10.10.1.2    TCP 83 8081 → 40142 [PSH, ACK] Seq=1735 Ack=1752 Win=65152 Len=17 TSval=3171331846 TSecr=1047072135
1711549127.472070217   848 0.636888914    10.10.1.2 → 10.10.1.1    TCP 83 40142 → 8081 [PSH, ACK] Seq=1752 Ack=1752 Win=64256 Len=17 TSval=1047072136 TSecr=3171331846
1711549129.472070217   850 0.636918584    10.10.1.1 → 10.10.1.2    TCP 83 8081 → 40142 [PSH, ACK] Seq=1752 Ack=1769 Win=65152 Len=17 TSval=3171331847 TSecr=1047072136
1711549135.472070217   856 0.638138832    10.10.1.2 → 10.10.1.1    TCP 83 40142 → 8081 [PSH, ACK] Seq=1769 Ack=1769 Win=64256 Len=17 TSval=1047072138 TSecr=3171331847
1711549137.472070217   858 0.638168476    10.10.1.1 → 10.10.1.2    TCP 83 8081 → 40142 [PSH, ACK] Seq=1769 Ack=1786 Win=65152 Len=17 TSval=3171331848 TSecr=1047072138
1711549143.472070217   864 0.639319619    10.10.1.2 → 10.10.1.1    TCP 83 40142 → 8081 [PSH, ACK] Seq=1786 Ack=1786 Win=64256 Len=17 TSval=1047072139 TSecr=3171331848
1711549145.472070217   866 0.639349628    10.10.1.1 → 10.10.1.2    TCP 83 8081 → 40142 [PSH, ACK] Seq=1786 Ack=1803 Win=65152 Len=17 TSval=3171331849 TSecr=1047072139
1711549151.472070217   872 0.640569671    10.10.1.2 → 10.10.1.1    TCP 83 40142 → 8081 [PSH, ACK] Seq=1803 Ack=1803 Win=64256 Len=17 TSval=1047072140 TSecr=3171331849
1711549153.472070217   874 0.640603486    10.10.1.1 → 10.10.1.2    TCP 83 8081 → 40142 [PSH, ACK] Seq=1803 Ack=1820 Win=65152 Len=17 TSval=3171331850 TSecr=1047072140
1711549159.472070217   880 0.641758775    10.10.1.2 → 10.10.1.1    TCP 83 40142 → 8081 [PSH, ACK] Seq=1820 Ack=1820 Win=64256 Len=17 TSval=1047072141 TSecr=3171331850
1711549161.472070217   882 0.641787193    10.10.1.1 → 10.10.1.2    TCP 83 8081 → 40142 [PSH, ACK] Seq=1820 Ack=1837 Win=65152 Len=17 TSval=3171331852 TSecr=1047072141
1711549167.472070217   888 0.643007174    10.10.1.2 → 10.10.1.1    TCP 83 40142 → 8081 [PSH, ACK] Seq=1837 Ack=1837 Win=64256 Len=17 TSval=1047072142 TSecr=3171331852
1711549169.472070217   890 0.643035227    10.10.1.1 → 10.10.1.2    TCP 83 8081 → 40142 [PSH, ACK] Seq=1837 Ack=1854 Win=65152 Len=17 TSval=3171331853 TSecr=1047072142
1711549175.472070217   896 0.644186689    10.10.1.2 → 10.10.1.1    TCP 83 40142 → 8081 [PSH, ACK] Seq=1854 Ack=1854 Win=64256 Len=17 TSval=1047072144 TSecr=3171331853
1711549177.472070217   898 0.644219255    10.10.1.1 → 10.10.1.2    TCP 83 8081 → 40142 [PSH, ACK] Seq=1854 Ack=1871 Win=65152 Len=17 TSval=3171331854 TSecr=1047072144
1711549183.472070217   904 0.645440153    10.10.1.2 → 10.10.1.1    TCP 83 40142 → 8081 [PSH, ACK] Seq=1871 Ack=1871 Win=64256 Len=17 TSval=1047072145 TSecr=3171331854
1711549185.472070217   906 0.645470743    10.10.1.1 → 10.10.1.2    TCP 83 8081 → 40142 [PSH, ACK] Seq=1871 Ack=1888 Win=65152 Len=17 TSval=3171331855 TSecr=1047072145
1711549191.472070217   912 0.646621361    10.10.1.2 → 10.10.1.1    TCP 83 40142 → 8081 [PSH, ACK] Seq=1888 Ack=1888 Win=64256 Len=17 TSval=1047072146 TSecr=3171331855
1711549193.472070217   914 0.646651935    10.10.1.1 → 10.10.1.2    TCP 83 8081 → 40142 [PSH, ACK] Seq=1888 Ack=1905 Win=65152 Len=17 TSval=3171331857 TSecr=1047072146
1711549199.472070217   920 0.647874113    10.10.1.2 → 10.10.1.1    TCP 83 40142 → 8081 [PSH, ACK] Seq=1905 Ack=1905 Win=64256 Len=17 TSval=1047072147 TSecr=3171331857
1711549201.472070217   922 0.647907383    10.10.1.1 → 10.10.1.2    TCP 83 8081 → 40142 [PSH, ACK] Seq=1905 Ack=1922 Win=65152 Len=17 TSval=3171331858 TSecr=1047072147
1711549207.472070217   928 0.649062440    10.10.1.2 → 10.10.1.1    TCP 83 40142 → 8081 [PSH, ACK] Seq=1922 Ack=1922 Win=64256 Len=17 TSval=1047072148 TSecr=3171331858
1711549210.472070217   931 0.649385765    10.10.1.1 → 10.10.1.2    TCP 83 8081 → 40142 [PSH, ACK] Seq=1922 Ack=1939 Win=65152 Len=17 TSval=3171331859 TSecr=1047072148
1711549215.472070217   936 0.650539888    10.10.1.2 → 10.10.1.1    TCP 83 40142 → 8081 [PSH, ACK] Seq=1939 Ack=1939 Win=64256 Len=17 TSval=1047072150 TSecr=3171331859
1711549217.472070217   938 0.650571378    10.10.1.1 → 10.10.1.2    TCP 83 8081 → 40142 [PSH, ACK] Seq=1939 Ack=1956 Win=65152 Len=17 TSval=3171331860 TSecr=1047072150
1711549223.472070217   944 0.651721474    10.10.1.2 → 10.10.1.1    TCP 83 40142 → 8081 [PSH, ACK] Seq=1956 Ack=1956 Win=64256 Len=17 TSval=1047072151 TSecr=3171331860
1711549225.472070217   946 0.651755870    10.10.1.1 → 10.10.1.2    TCP 83 8081 → 40142 [PSH, ACK] Seq=1956 Ack=1973 Win=65152 Len=17 TSval=3171331862 TSecr=1047072151
1711549231.472070217   952 0.652978453    10.10.1.2 → 10.10.1.1    TCP 83 40142 → 8081 [PSH, ACK] Seq=1973 Ack=1973 Win=64256 Len=17 TSval=1047072152 TSecr=3171331862
1711549233.472070217   954 0.653007900    10.10.1.1 → 10.10.1.2    TCP 83 8081 → 40142 [PSH, ACK] Seq=1973 Ack=1990 Win=65152 Len=17 TSval=3171331863 TSecr=1047072152
1711549239.472070217   960 0.654160821    10.10.1.2 → 10.10.1.1    TCP 83 40142 → 8081 [PSH, ACK] Seq=1990 Ack=1990 Win=64256 Len=17 TSval=1047072154 TSecr=3171331863
1711549241.472070217   962 0.654191131    10.10.1.1 → 10.10.1.2    TCP 83 8081 → 40142 [PSH, ACK] Seq=1990 Ack=2007 Win=65152 Len=17 TSval=3171331864 TSecr=1047072154
