1712098934.899011135    34 0.525153110    10.10.1.2 → 10.10.1.1    TCP 83 60334 → 8081 [PSH, ACK] Seq=1 Ack=1 Win=64256 Len=17 TSval=1597693444 TSecr=3721952902
1712098937.899011135    37 0.525453508    10.10.1.1 → 10.10.1.2    TCP 83 8081 → 60334 [PSH, ACK] Seq=1 Ack=18 Win=65152 Len=17 TSval=3721953152 TSecr=1597693444
1712098944.899011135    44 0.526672037    10.10.1.2 → 10.10.1.1    TCP 83 60334 → 8081 [PSH, ACK] Seq=18 Ack=18 Win=64256 Len=17 TSval=1597693445 TSecr=3721953152
1712098947.899011135    47 0.526810026    10.10.1.1 → 10.10.1.2    TCP 83 8081 → 60334 [PSH, ACK] Seq=18 Ack=35 Win=65152 Len=17 TSval=3721953154 TSecr=1597693445
1712098953.899011135    53 0.528027079    10.10.1.2 → 10.10.1.1    TCP 83 60334 → 8081 [PSH, ACK] Seq=35 Ack=35 Win=64256 Len=17 TSval=1597693446 TSecr=3721953154
1712098955.899011135    55 0.528154637    10.10.1.1 → 10.10.1.2    TCP 83 8081 → 60334 [PSH, ACK] Seq=35 Ack=52 Win=65152 Len=17 TSval=3721953155 TSecr=1597693446
1712098961.899011135    61 0.529369383    10.10.1.2 → 10.10.1.1    TCP 83 60334 → 8081 [PSH, ACK] Seq=52 Ack=52 Win=64256 Len=17 TSval=1597693448 TSecr=3721953155
1712098964.899011135    64 0.529495739    10.10.1.1 → 10.10.1.2    TCP 83 8081 → 60334 [PSH, ACK] Seq=52 Ack=69 Win=65152 Len=17 TSval=3721953156 TSecr=1597693448
1712098970.899011135    70 0.530716745    10.10.1.2 → 10.10.1.1    TCP 83 60334 → 8081 [PSH, ACK] Seq=69 Ack=69 Win=64256 Len=17 TSval=1597693449 TSecr=3721953156
1712098972.899011135    72 0.530847178    10.10.1.1 → 10.10.1.2    TCP 83 8081 → 60334 [PSH, ACK] Seq=69 Ack=86 Win=65152 Len=17 TSval=3721953158 TSecr=1597693449
1712098980.899011135    80 0.532060719    10.10.1.2 → 10.10.1.1    TCP 83 60334 → 8081 [PSH, ACK] Seq=86 Ack=86 Win=64256 Len=17 TSval=1597693451 TSecr=3721953158
1712098981.899011135    81 0.532194261    10.10.1.1 → 10.10.1.2    TCP 83 8081 → 60334 [PSH, ACK] Seq=86 Ack=103 Win=65152 Len=17 TSval=3721953159 TSecr=1597693451
1712098987.899011135    87 0.533409605    10.10.1.2 → 10.10.1.1    TCP 83 60334 → 8081 [PSH, ACK] Seq=103 Ack=103 Win=64256 Len=17 TSval=1597693452 TSecr=3721953159
1712098989.899011135    89 0.533531723    10.10.1.1 → 10.10.1.2    TCP 83 8081 → 60334 [PSH, ACK] Seq=103 Ack=120 Win=65152 Len=17 TSval=3721953160 TSecr=1597693452
1712098995.899011135    95 0.534764076    10.10.1.2 → 10.10.1.1    TCP 83 60334 → 8081 [PSH, ACK] Seq=120 Ack=120 Win=64256 Len=17 TSval=1597693453 TSecr=3721953160
1712098998.899011135    98 0.534849367    10.10.1.1 → 10.10.1.2    TCP 83 8081 → 60334 [PSH, ACK] Seq=120 Ack=137 Win=65152 Len=17 TSval=3721953162 TSecr=1597693453
1712099004.899011135   104 0.536063757    10.10.1.2 → 10.10.1.1    TCP 83 60334 → 8081 [PSH, ACK] Seq=137 Ack=137 Win=64256 Len=17 TSval=1597693455 TSecr=3721953162
1712099006.899011135   106 0.536189893    10.10.1.1 → 10.10.1.2    TCP 83 8081 → 60334 [PSH, ACK] Seq=137 Ack=154 Win=65152 Len=17 TSval=3721953163 TSecr=1597693455
1712099012.899011135   112 0.537404731    10.10.1.2 → 10.10.1.1    TCP 83 60334 → 8081 [PSH, ACK] Seq=154 Ack=154 Win=64256 Len=17 TSval=1597693456 TSecr=3721953163
1712099015.899011135   115 0.537532384    10.10.1.1 → 10.10.1.2    TCP 83 8081 → 60334 [PSH, ACK] Seq=154 Ack=171 Win=65152 Len=17 TSval=3721953164 TSecr=1597693456
1712099021.899011135   121 0.538765721    10.10.1.2 → 10.10.1.1    TCP 83 60334 → 8081 [PSH, ACK] Seq=171 Ack=171 Win=64256 Len=17 TSval=1597693457 TSecr=3721953164
1712099023.899011135   123 0.538895395    10.10.1.1 → 10.10.1.2    TCP 83 8081 → 60334 [PSH, ACK] Seq=171 Ack=188 Win=65152 Len=17 TSval=3721953166 TSecr=1597693457
1712099029.899011135   129 0.540109539    10.10.1.2 → 10.10.1.1    TCP 83 60334 → 8081 [PSH, ACK] Seq=188 Ack=188 Win=64256 Len=17 TSval=1597693459 TSecr=3721953166
1712099032.899011135   132 0.540237221    10.10.1.1 → 10.10.1.2    TCP 83 8081 → 60334 [PSH, ACK] Seq=188 Ack=205 Win=65152 Len=17 TSval=3721953167 TSecr=1597693459
1712099038.899011135   138 0.541450994    10.10.1.2 → 10.10.1.1    TCP 83 60334 → 8081 [PSH, ACK] Seq=205 Ack=205 Win=64256 Len=17 TSval=1597693460 TSecr=3721953167
1712099040.899011135   140 0.541573228    10.10.1.1 → 10.10.1.2    TCP 83 8081 → 60334 [PSH, ACK] Seq=205 Ack=222 Win=65152 Len=17 TSval=3721953168 TSecr=1597693460
1712099046.899011135   146 0.542789503    10.10.1.2 → 10.10.1.1    TCP 83 60334 → 8081 [PSH, ACK] Seq=222 Ack=222 Win=64256 Len=17 TSval=1597693461 TSecr=3721953168
1712099048.899011135   148 0.542875479    10.10.1.1 → 10.10.1.2    TCP 83 8081 → 60334 [PSH, ACK] Seq=222 Ack=239 Win=65152 Len=17 TSval=3721953170 TSecr=1597693461
1712099055.899011135   155 0.544091469    10.10.1.2 → 10.10.1.1    TCP 83 60334 → 8081 [PSH, ACK] Seq=239 Ack=239 Win=64256 Len=17 TSval=1597693463 TSecr=3721953170
1712099057.899011135   157 0.544217894    10.10.1.1 → 10.10.1.2    TCP 83 8081 → 60334 [PSH, ACK] Seq=239 Ack=256 Win=65152 Len=17 TSval=3721953171 TSecr=1597693463
1712099063.899011135   163 0.545432495    10.10.1.2 → 10.10.1.1    TCP 83 60334 → 8081 [PSH, ACK] Seq=256 Ack=256 Win=64256 Len=17 TSval=1597693464 TSecr=3721953171
1712099065.899011135   165 0.545568636    10.10.1.1 → 10.10.1.2    TCP 83 8081 → 60334 [PSH, ACK] Seq=256 Ack=273 Win=65152 Len=17 TSval=3721953172 TSecr=1597693464
1712099072.899011135   172 0.546786417    10.10.1.2 → 10.10.1.1    TCP 83 60334 → 8081 [PSH, ACK] Seq=273 Ack=273 Win=64256 Len=17 TSval=1597693465 TSecr=3721953172
1712099074.899011135   174 0.546872974    10.10.1.1 → 10.10.1.2    TCP 83 8081 → 60334 [PSH, ACK] Seq=273 Ack=290 Win=65152 Len=17 TSval=3721953174 TSecr=1597693465
1712099080.899011135   180 0.548085896    10.10.1.2 → 10.10.1.1    TCP 83 60334 → 8081 [PSH, ACK] Seq=290 Ack=290 Win=64256 Len=17 TSval=1597693467 TSecr=3721953174
1712099082.899011135   182 0.548212292    10.10.1.1 → 10.10.1.2    TCP 83 8081 → 60334 [PSH, ACK] Seq=290 Ack=307 Win=65152 Len=17 TSval=3721953175 TSecr=1597693467
1712099089.899011135   189 0.549426514    10.10.1.2 → 10.10.1.1    TCP 83 60334 → 8081 [PSH, ACK] Seq=307 Ack=307 Win=64256 Len=17 TSval=1597693468 TSecr=3721953175
1712099091.899011135   191 0.549554159    10.10.1.1 → 10.10.1.2    TCP 83 8081 → 60334 [PSH, ACK] Seq=307 Ack=324 Win=65152 Len=17 TSval=3721953176 TSecr=1597693468
1712099097.899011135   197 0.550771725    10.10.1.2 → 10.10.1.1    TCP 83 60334 → 8081 [PSH, ACK] Seq=324 Ack=324 Win=64256 Len=17 TSval=1597693469 TSecr=3721953176
1712099099.899011135   199 0.550857686    10.10.1.1 → 10.10.1.2    TCP 83 8081 → 60334 [PSH, ACK] Seq=324 Ack=341 Win=65152 Len=17 TSval=3721953178 TSecr=1597693469
1712099106.899011135   206 0.552072297    10.10.1.2 → 10.10.1.1    TCP 83 60334 → 8081 [PSH, ACK] Seq=341 Ack=341 Win=64256 Len=17 TSval=1597693471 TSecr=3721953178
1712099108.899011135   208 0.552197859    10.10.1.1 → 10.10.1.2    TCP 83 8081 → 60334 [PSH, ACK] Seq=341 Ack=358 Win=65152 Len=17 TSval=3721953179 TSecr=1597693471
1712099114.899011135   214 0.553412972    10.10.1.2 → 10.10.1.1    TCP 83 60334 → 8081 [PSH, ACK] Seq=358 Ack=358 Win=64256 Len=17 TSval=1597693472 TSecr=3721953179
1712099116.899011135   216 0.553539437    10.10.1.1 → 10.10.1.2    TCP 83 8081 → 60334 [PSH, ACK] Seq=358 Ack=375 Win=65152 Len=17 TSval=3721953180 TSecr=1597693472
1712099123.899011135   223 0.554759510    10.10.1.2 → 10.10.1.1    TCP 83 60334 → 8081 [PSH, ACK] Seq=375 Ack=375 Win=64256 Len=17 TSval=1597693473 TSecr=3721953180
1712099125.899011135   225 0.554889375    10.10.1.1 → 10.10.1.2    TCP 83 8081 → 60334 [PSH, ACK] Seq=375 Ack=392 Win=65152 Len=17 TSval=3721953182 TSecr=1597693473
1712099131.899011135   231 0.556101539    10.10.1.2 → 10.10.1.1    TCP 83 60334 → 8081 [PSH, ACK] Seq=392 Ack=392 Win=64256 Len=17 TSval=1597693475 TSecr=3721953182
1712099133.899011135   233 0.556223574    10.10.1.1 → 10.10.1.2    TCP 83 8081 → 60334 [PSH, ACK] Seq=392 Ack=409 Win=65152 Len=17 TSval=3721953183 TSecr=1597693475
1712099140.899011135   240 0.557436797    10.10.1.2 → 10.10.1.1    TCP 83 60334 → 8081 [PSH, ACK] Seq=409 Ack=409 Win=64256 Len=17 TSval=1597693476 TSecr=3721953183
1712099142.899011135   242 0.557559297    10.10.1.1 → 10.10.1.2    TCP 83 8081 → 60334 [PSH, ACK] Seq=409 Ack=426 Win=65152 Len=17 TSval=3721953184 TSecr=1597693476
1712099148.899011135   248 0.558774604    10.10.1.2 → 10.10.1.1    TCP 83 60334 → 8081 [PSH, ACK] Seq=426 Ack=426 Win=64256 Len=17 TSval=1597693477 TSecr=3721953184
1712099150.899011135   250 0.558858432    10.10.1.1 → 10.10.1.2    TCP 83 8081 → 60334 [PSH, ACK] Seq=426 Ack=443 Win=65152 Len=17 TSval=3721953186 TSecr=1597693477
1712099157.899011135   257 0.560071058    10.10.1.2 → 10.10.1.1    TCP 83 60334 → 8081 [PSH, ACK] Seq=443 Ack=443 Win=64256 Len=17 TSval=1597693479 TSecr=3721953186
1712099159.899011135   259 0.560196958    10.10.1.1 → 10.10.1.2    TCP 83 8081 → 60334 [PSH, ACK] Seq=443 Ack=460 Win=65152 Len=17 TSval=3721953187 TSecr=1597693479
1712099165.899011135   265 0.561411260    10.10.1.2 → 10.10.1.1    TCP 83 60334 → 8081 [PSH, ACK] Seq=460 Ack=460 Win=64256 Len=17 TSval=1597693480 TSecr=3721953187
1712099167.899011135   267 0.561537681    10.10.1.1 → 10.10.1.2    TCP 83 8081 → 60334 [PSH, ACK] Seq=460 Ack=477 Win=65152 Len=17 TSval=3721953188 TSecr=1597693480
1712099174.899011135   274 0.562756788    10.10.1.2 → 10.10.1.1    TCP 83 60334 → 8081 [PSH, ACK] Seq=477 Ack=477 Win=64256 Len=17 TSval=1597693481 TSecr=3721953188
1712099176.899011135   276 0.562885359    10.10.1.1 → 10.10.1.2    TCP 83 8081 → 60334 [PSH, ACK] Seq=477 Ack=494 Win=65152 Len=17 TSval=3721953190 TSecr=1597693481
1712099182.899011135   282 0.564098503    10.10.1.2 → 10.10.1.1    TCP 83 60334 → 8081 [PSH, ACK] Seq=494 Ack=494 Win=64256 Len=17 TSval=1597693483 TSecr=3721953190
1712099184.899011135   284 0.564225127    10.10.1.1 → 10.10.1.2    TCP 83 8081 → 60334 [PSH, ACK] Seq=494 Ack=511 Win=65152 Len=17 TSval=3721953191 TSecr=1597693483
1712099191.899011135   291 0.565440985    10.10.1.2 → 10.10.1.1    TCP 83 60334 → 8081 [PSH, ACK] Seq=511 Ack=511 Win=64256 Len=17 TSval=1597693484 TSecr=3721953191
1712099193.899011135   293 0.565563140    10.10.1.1 → 10.10.1.2    TCP 83 8081 → 60334 [PSH, ACK] Seq=511 Ack=528 Win=65152 Len=17 TSval=3721953192 TSecr=1597693484
1712099199.899011135   299 0.566779023    10.10.1.2 → 10.10.1.1    TCP 83 60334 → 8081 [PSH, ACK] Seq=528 Ack=528 Win=64256 Len=17 TSval=1597693485 TSecr=3721953192
1712099201.899011135   301 0.566865469    10.10.1.1 → 10.10.1.2    TCP 83 8081 → 60334 [PSH, ACK] Seq=528 Ack=545 Win=65152 Len=17 TSval=3721953194 TSecr=1597693485
1712099208.899011135   308 0.568079286    10.10.1.2 → 10.10.1.1    TCP 83 60334 → 8081 [PSH, ACK] Seq=545 Ack=545 Win=64256 Len=17 TSval=1597693487 TSecr=3721953194
1712099210.899011135   310 0.568205471    10.10.1.1 → 10.10.1.2    TCP 83 8081 → 60334 [PSH, ACK] Seq=545 Ack=562 Win=65152 Len=17 TSval=3721953195 TSecr=1597693487
1712099216.899011135   316 0.569419082    10.10.1.2 → 10.10.1.1    TCP 83 60334 → 8081 [PSH, ACK] Seq=562 Ack=562 Win=64256 Len=17 TSval=1597693488 TSecr=3721953195
1712099218.899011135   318 0.569545653    10.10.1.1 → 10.10.1.2    TCP 83 8081 → 60334 [PSH, ACK] Seq=562 Ack=579 Win=65152 Len=17 TSval=3721953196 TSecr=1597693488
1712099225.899011135   325 0.570765892    10.10.1.2 → 10.10.1.1    TCP 83 60334 → 8081 [PSH, ACK] Seq=579 Ack=579 Win=64256 Len=17 TSval=1597693489 TSecr=3721953196
1712099227.899011135   327 0.570895911    10.10.1.1 → 10.10.1.2    TCP 83 8081 → 60334 [PSH, ACK] Seq=579 Ack=596 Win=65152 Len=17 TSval=3721953198 TSecr=1597693489
1712099233.899011135   333 0.572108655    10.10.1.2 → 10.10.1.1    TCP 83 60334 → 8081 [PSH, ACK] Seq=596 Ack=596 Win=64256 Len=17 TSval=1597693491 TSecr=3721953198
1712099235.899011135   335 0.572235390    10.10.1.1 → 10.10.1.2    TCP 83 8081 → 60334 [PSH, ACK] Seq=596 Ack=613 Win=65152 Len=17 TSval=3721953199 TSecr=1597693491
1712099242.899011135   342 0.573448652    10.10.1.2 → 10.10.1.1    TCP 83 60334 → 8081 [PSH, ACK] Seq=613 Ack=613 Win=64256 Len=17 TSval=1597693492 TSecr=3721953199
1712099244.899011135   344 0.573575628    10.10.1.1 → 10.10.1.2    TCP 83 8081 → 60334 [PSH, ACK] Seq=613 Ack=630 Win=65152 Len=17 TSval=3721953200 TSecr=1597693492
1712099250.899011135   350 0.574792317    10.10.1.2 → 10.10.1.1    TCP 83 60334 → 8081 [PSH, ACK] Seq=630 Ack=630 Win=64256 Len=17 TSval=1597693493 TSecr=3721953200
1712099252.899011135   352 0.574877521    10.10.1.1 → 10.10.1.2    TCP 83 8081 → 60334 [PSH, ACK] Seq=630 Ack=647 Win=65152 Len=17 TSval=3721953202 TSecr=1597693493
1712099259.899011135   359 0.576090981    10.10.1.2 → 10.10.1.1    TCP 83 60334 → 8081 [PSH, ACK] Seq=647 Ack=647 Win=64256 Len=17 TSval=1597693495 TSecr=3721953202
1712099261.899011135   361 0.576217749    10.10.1.1 → 10.10.1.2    TCP 83 8081 → 60334 [PSH, ACK] Seq=647 Ack=664 Win=65152 Len=17 TSval=3721953203 TSecr=1597693495
1712099267.899011135   367 0.577431382    10.10.1.2 → 10.10.1.1    TCP 83 60334 → 8081 [PSH, ACK] Seq=664 Ack=664 Win=64256 Len=17 TSval=1597693496 TSecr=3721953203
1712099269.899011135   369 0.577558207    10.10.1.1 → 10.10.1.2    TCP 83 8081 → 60334 [PSH, ACK] Seq=664 Ack=681 Win=65152 Len=17 TSval=3721953204 TSecr=1597693496
1712099276.899011135   376 0.578775075    10.10.1.2 → 10.10.1.1    TCP 83 60334 → 8081 [PSH, ACK] Seq=681 Ack=681 Win=64256 Len=17 TSval=1597693497 TSecr=3721953204
1712099278.899011135   378 0.578859486    10.10.1.1 → 10.10.1.2    TCP 83 8081 → 60334 [PSH, ACK] Seq=681 Ack=698 Win=65152 Len=17 TSval=3721953206 TSecr=1597693497
1712099284.899011135   384 0.580071816    10.10.1.2 → 10.10.1.1    TCP 83 60334 → 8081 [PSH, ACK] Seq=698 Ack=698 Win=64256 Len=17 TSval=1597693499 TSecr=3721953206
1712099286.899011135   386 0.580197938    10.10.1.1 → 10.10.1.2    TCP 83 8081 → 60334 [PSH, ACK] Seq=698 Ack=715 Win=65152 Len=17 TSval=3721953207 TSecr=1597693499
1712099293.899011135   393 0.581411586    10.10.1.2 → 10.10.1.1    TCP 83 60334 → 8081 [PSH, ACK] Seq=715 Ack=715 Win=64256 Len=17 TSval=1597693500 TSecr=3721953207
1712099295.899011135   395 0.581540681    10.10.1.1 → 10.10.1.2    TCP 83 8081 → 60334 [PSH, ACK] Seq=715 Ack=732 Win=65152 Len=17 TSval=3721953208 TSecr=1597693500
1712099301.899011135   401 0.582759209    10.10.1.2 → 10.10.1.1    TCP 83 60334 → 8081 [PSH, ACK] Seq=732 Ack=732 Win=64256 Len=17 TSval=1597693501 TSecr=3721953208
1712099303.899011135   403 0.582845563    10.10.1.1 → 10.10.1.2    TCP 83 8081 → 60334 [PSH, ACK] Seq=732 Ack=749 Win=65152 Len=17 TSval=3721953210 TSecr=1597693501
1712099310.899011135   410 0.584059666    10.10.1.2 → 10.10.1.1    TCP 83 60334 → 8081 [PSH, ACK] Seq=749 Ack=749 Win=64256 Len=17 TSval=1597693503 TSecr=3721953210
1712099312.899011135   412 0.584187003    10.10.1.1 → 10.10.1.2    TCP 83 8081 → 60334 [PSH, ACK] Seq=749 Ack=766 Win=65152 Len=17 TSval=3721953211 TSecr=1597693503
1712099318.899011135   418 0.585400530    10.10.1.2 → 10.10.1.1    TCP 83 60334 → 8081 [PSH, ACK] Seq=766 Ack=766 Win=64256 Len=17 TSval=1597693504 TSecr=3721953211
1712099320.899011135   420 0.585532932    10.10.1.1 → 10.10.1.2    TCP 83 8081 → 60334 [PSH, ACK] Seq=766 Ack=783 Win=65152 Len=17 TSval=3721953212 TSecr=1597693504
1712099327.899011135   427 0.586756898    10.10.1.2 → 10.10.1.1    TCP 83 60334 → 8081 [PSH, ACK] Seq=783 Ack=783 Win=64256 Len=17 TSval=1597693505 TSecr=3721953212
1712099329.899011135   429 0.586844290    10.10.1.1 → 10.10.1.2    TCP 83 8081 → 60334 [PSH, ACK] Seq=783 Ack=800 Win=65152 Len=17 TSval=3721953214 TSecr=1597693505
1712099335.899011135   435 0.588058549    10.10.1.2 → 10.10.1.1    TCP 83 60334 → 8081 [PSH, ACK] Seq=800 Ack=800 Win=64256 Len=17 TSval=1597693507 TSecr=3721953214
1712099338.899011135   438 0.588193381    10.10.1.1 → 10.10.1.2    TCP 83 8081 → 60334 [PSH, ACK] Seq=800 Ack=817 Win=65152 Len=17 TSval=3721953215 TSecr=1597693507
1712099344.899011135   444 0.589407714    10.10.1.2 → 10.10.1.1    TCP 83 60334 → 8081 [PSH, ACK] Seq=817 Ack=817 Win=64256 Len=17 TSval=1597693508 TSecr=3721953215
1712099346.899011135   446 0.589530179    10.10.1.1 → 10.10.1.2    TCP 83 8081 → 60334 [PSH, ACK] Seq=817 Ack=834 Win=65152 Len=17 TSval=3721953216 TSecr=1597693508
1712099352.899011135   452 0.590760967    10.10.1.2 → 10.10.1.1    TCP 83 60334 → 8081 [PSH, ACK] Seq=834 Ack=834 Win=64256 Len=17 TSval=1597693509 TSecr=3721953216
1712099355.899011135   455 0.590847242    10.10.1.1 → 10.10.1.2    TCP 83 8081 → 60334 [PSH, ACK] Seq=834 Ack=851 Win=65152 Len=17 TSval=3721953218 TSecr=1597693509
1712099361.899011135   461 0.592059390    10.10.1.2 → 10.10.1.1    TCP 83 60334 → 8081 [PSH, ACK] Seq=851 Ack=851 Win=64256 Len=17 TSval=1597693511 TSecr=3721953218
1712099363.899011135   463 0.592181315    10.10.1.1 → 10.10.1.2    TCP 83 8081 → 60334 [PSH, ACK] Seq=851 Ack=868 Win=65152 Len=17 TSval=3721953219 TSecr=1597693511
1712099369.899011135   469 0.593395062    10.10.1.2 → 10.10.1.1    TCP 83 60334 → 8081 [PSH, ACK] Seq=868 Ack=868 Win=64256 Len=17 TSval=1597693512 TSecr=3721953219
1712099371.899011135   471 0.593516729    10.10.1.1 → 10.10.1.2    TCP 83 8081 → 60334 [PSH, ACK] Seq=868 Ack=885 Win=65152 Len=17 TSval=3721953220 TSecr=1597693512
1712099378.899011135   478 0.594735113    10.10.1.2 → 10.10.1.1    TCP 83 60334 → 8081 [PSH, ACK] Seq=885 Ack=885 Win=64256 Len=17 TSval=1597693513 TSecr=3721953220
1712099380.899011135   480 0.594826871    10.10.1.1 → 10.10.1.2    TCP 83 8081 → 60334 [PSH, ACK] Seq=885 Ack=902 Win=65152 Len=17 TSval=3721953222 TSecr=1597693513
1712099386.899011135   486 0.596039878    10.10.1.2 → 10.10.1.1    TCP 83 60334 → 8081 [PSH, ACK] Seq=902 Ack=902 Win=64256 Len=17 TSval=1597693514 TSecr=3721953222
1712099389.899011135   489 0.596162856    10.10.1.1 → 10.10.1.2    TCP 83 8081 → 60334 [PSH, ACK] Seq=902 Ack=919 Win=65152 Len=17 TSval=3721953223 TSecr=1597693514
1712099395.899011135   495 0.597376796    10.10.1.2 → 10.10.1.1    TCP 83 60334 → 8081 [PSH, ACK] Seq=919 Ack=919 Win=64256 Len=17 TSval=1597693516 TSecr=3721953223
1712099397.899011135   497 0.597498947    10.10.1.1 → 10.10.1.2    TCP 83 8081 → 60334 [PSH, ACK] Seq=919 Ack=936 Win=65152 Len=17 TSval=3721953224 TSecr=1597693516
1712099403.899011135   503 0.598715415    10.10.1.2 → 10.10.1.1    TCP 83 60334 → 8081 [PSH, ACK] Seq=936 Ack=936 Win=64256 Len=17 TSval=1597693517 TSecr=3721953224
1712099405.899011135   505 0.598819120    10.10.1.1 → 10.10.1.2    TCP 83 8081 → 60334 [PSH, ACK] Seq=936 Ack=953 Win=65152 Len=17 TSval=3721953226 TSecr=1597693517
1712099412.899011135   512 0.600033488    10.10.1.2 → 10.10.1.1    TCP 83 60334 → 8081 [PSH, ACK] Seq=953 Ack=953 Win=64256 Len=17 TSval=1597693518 TSecr=3721953226
1712099414.899011135   514 0.600214244    10.10.1.1 → 10.10.1.2    TCP 83 8081 → 60334 [PSH, ACK] Seq=953 Ack=970 Win=65152 Len=17 TSval=3721953227 TSecr=1597693518
1712099420.899011135   520 0.601427727    10.10.1.2 → 10.10.1.1    TCP 83 60334 → 8081 [PSH, ACK] Seq=970 Ack=970 Win=64256 Len=17 TSval=1597693520 TSecr=3721953227
1712099423.899011135   523 0.601550378    10.10.1.1 → 10.10.1.2    TCP 83 8081 → 60334 [PSH, ACK] Seq=970 Ack=987 Win=65152 Len=17 TSval=3721953228 TSecr=1597693520
1712099430.899011135   530 0.602768098    10.10.1.2 → 10.10.1.1    TCP 83 60334 → 8081 [PSH, ACK] Seq=987 Ack=987 Win=64256 Len=17 TSval=1597693521 TSecr=3721953228
1712099431.899011135   531 0.602848974    10.10.1.1 → 10.10.1.2    TCP 83 8081 → 60334 [PSH, ACK] Seq=987 Ack=1004 Win=65152 Len=17 TSval=3721953230 TSecr=1597693521
1712099439.899011135   539 0.604062356    10.10.1.2 → 10.10.1.1    TCP 83 60334 → 8081 [PSH, ACK] Seq=1004 Ack=1004 Win=64256 Len=17 TSval=1597693523 TSecr=3721953230
1712099440.899011135   540 0.604200481    10.10.1.1 → 10.10.1.2    TCP 83 8081 → 60334 [PSH, ACK] Seq=1004 Ack=1021 Win=65152 Len=17 TSval=3721953231 TSecr=1597693523
1712099446.899011135   546 0.605414297    10.10.1.2 → 10.10.1.1    TCP 83 60334 → 8081 [PSH, ACK] Seq=1021 Ack=1021 Win=64256 Len=17 TSval=1597693524 TSecr=3721953231
1712099448.899011135   548 0.605536825    10.10.1.1 → 10.10.1.2    TCP 83 8081 → 60334 [PSH, ACK] Seq=1021 Ack=1038 Win=65152 Len=17 TSval=3721953232 TSecr=1597693524
1712099455.899011135   555 0.606757576    10.10.1.2 → 10.10.1.1    TCP 83 60334 → 8081 [PSH, ACK] Seq=1038 Ack=1038 Win=64256 Len=17 TSval=1597693525 TSecr=3721953232
1712099457.899011135   557 0.606840193    10.10.1.1 → 10.10.1.2    TCP 83 8081 → 60334 [PSH, ACK] Seq=1038 Ack=1055 Win=65152 Len=17 TSval=3721953234 TSecr=1597693525
1712099463.899011135   563 0.608055126    10.10.1.2 → 10.10.1.1    TCP 83 60334 → 8081 [PSH, ACK] Seq=1055 Ack=1055 Win=64256 Len=17 TSval=1597693527 TSecr=3721953234
1712099465.899011135   565 0.608177122    10.10.1.1 → 10.10.1.2    TCP 83 8081 → 60334 [PSH, ACK] Seq=1055 Ack=1072 Win=65152 Len=17 TSval=3721953235 TSecr=1597693527
1712099471.899011135   571 0.609389915    10.10.1.2 → 10.10.1.1    TCP 83 60334 → 8081 [PSH, ACK] Seq=1072 Ack=1072 Win=64256 Len=17 TSval=1597693528 TSecr=3721953235
1712099474.899011135   574 0.609512593    10.10.1.1 → 10.10.1.2    TCP 83 8081 → 60334 [PSH, ACK] Seq=1072 Ack=1089 Win=65152 Len=17 TSval=3721953236 TSecr=1597693528
1712099480.899011135   580 0.610739426    10.10.1.2 → 10.10.1.1    TCP 83 60334 → 8081 [PSH, ACK] Seq=1089 Ack=1089 Win=64256 Len=17 TSval=1597693529 TSecr=3721953236
1712099482.899011135   582 0.610823268    10.10.1.1 → 10.10.1.2    TCP 83 8081 → 60334 [PSH, ACK] Seq=1089 Ack=1106 Win=65152 Len=17 TSval=3721953238 TSecr=1597693529
1712099488.899011135   588 0.612050374    10.10.1.2 → 10.10.1.1    TCP 83 60334 → 8081 [PSH, ACK] Seq=1106 Ack=1106 Win=64256 Len=17 TSval=1597693530 TSecr=3721953238
1712099490.899011135   590 0.612177095    10.10.1.1 → 10.10.1.2    TCP 83 8081 → 60334 [PSH, ACK] Seq=1106 Ack=1123 Win=65152 Len=17 TSval=3721953239 TSecr=1597693530
1712099497.899011135   597 0.613391108    10.10.1.2 → 10.10.1.1    TCP 83 60334 → 8081 [PSH, ACK] Seq=1123 Ack=1123 Win=64256 Len=17 TSval=1597693532 TSecr=3721953239
1712099499.899011135   599 0.613514563    10.10.1.1 → 10.10.1.2    TCP 83 8081 → 60334 [PSH, ACK] Seq=1123 Ack=1140 Win=65152 Len=17 TSval=3721953240 TSecr=1597693532
1712099505.899011135   605 0.614733211    10.10.1.2 → 10.10.1.1    TCP 83 60334 → 8081 [PSH, ACK] Seq=1140 Ack=1140 Win=64256 Len=17 TSval=1597693533 TSecr=3721953240
1712099507.899011135   607 0.614834006    10.10.1.1 → 10.10.1.2    TCP 83 8081 → 60334 [PSH, ACK] Seq=1140 Ack=1157 Win=65152 Len=17 TSval=3721953242 TSecr=1597693533
1712099514.899011135   614 0.616046578    10.10.1.2 → 10.10.1.1    TCP 83 60334 → 8081 [PSH, ACK] Seq=1157 Ack=1157 Win=64256 Len=17 TSval=1597693534 TSecr=3721953242
1712099516.899011135   616 0.616168323    10.10.1.1 → 10.10.1.2    TCP 83 8081 → 60334 [PSH, ACK] Seq=1157 Ack=1174 Win=65152 Len=17 TSval=3721953243 TSecr=1597693534
1712099522.899011135   622 0.617382002    10.10.1.2 → 10.10.1.1    TCP 83 60334 → 8081 [PSH, ACK] Seq=1174 Ack=1174 Win=64256 Len=17 TSval=1597693536 TSecr=3721953243
1712099524.899011135   624 0.617505061    10.10.1.1 → 10.10.1.2    TCP 83 8081 → 60334 [PSH, ACK] Seq=1174 Ack=1191 Win=65152 Len=17 TSval=3721953244 TSecr=1597693536
1712099531.899011135   631 0.618724015    10.10.1.2 → 10.10.1.1    TCP 83 60334 → 8081 [PSH, ACK] Seq=1191 Ack=1191 Win=64256 Len=17 TSval=1597693537 TSecr=3721953244
1712099533.899011135   633 0.618812924    10.10.1.1 → 10.10.1.2    TCP 83 8081 → 60334 [PSH, ACK] Seq=1191 Ack=1208 Win=65152 Len=17 TSval=3721953246 TSecr=1597693537
1712099539.899011135   639 0.620025718    10.10.1.2 → 10.10.1.1    TCP 83 60334 → 8081 [PSH, ACK] Seq=1208 Ack=1208 Win=64256 Len=17 TSval=1597693538 TSecr=3721953246
1712099541.899011135   641 0.620149496    10.10.1.1 → 10.10.1.2    TCP 83 8081 → 60334 [PSH, ACK] Seq=1208 Ack=1225 Win=65152 Len=17 TSval=3721953247 TSecr=1597693538
1712099548.899011135   648 0.621362553    10.10.1.2 → 10.10.1.1    TCP 83 60334 → 8081 [PSH, ACK] Seq=1225 Ack=1225 Win=64256 Len=17 TSval=1597693540 TSecr=3721953247
1712099550.899011135   650 0.621485331    10.10.1.1 → 10.10.1.2    TCP 83 8081 → 60334 [PSH, ACK] Seq=1225 Ack=1242 Win=65152 Len=17 TSval=3721953248 TSecr=1597693540
1712099556.899011135   656 0.622703318    10.10.1.2 → 10.10.1.1    TCP 83 60334 → 8081 [PSH, ACK] Seq=1242 Ack=1242 Win=64256 Len=17 TSval=1597693541 TSecr=3721953248
1712099558.899011135   658 0.622806800    10.10.1.1 → 10.10.1.2    TCP 83 8081 → 60334 [PSH, ACK] Seq=1242 Ack=1259 Win=65152 Len=17 TSval=3721953250 TSecr=1597693541
1712099565.899011135   665 0.624036189    10.10.1.2 → 10.10.1.1    TCP 83 60334 → 8081 [PSH, ACK] Seq=1259 Ack=1259 Win=64256 Len=17 TSval=1597693542 TSecr=3721953250
1712099567.899011135   667 0.624163811    10.10.1.1 → 10.10.1.2    TCP 83 8081 → 60334 [PSH, ACK] Seq=1259 Ack=1276 Win=65152 Len=17 TSval=3721953251 TSecr=1597693542
1712099573.899011135   673 0.625376498    10.10.1.2 → 10.10.1.1    TCP 83 60334 → 8081 [PSH, ACK] Seq=1276 Ack=1276 Win=64256 Len=17 TSval=1597693544 TSecr=3721953251
1712099575.899011135   675 0.625498096    10.10.1.1 → 10.10.1.2    TCP 83 8081 → 60334 [PSH, ACK] Seq=1276 Ack=1293 Win=65152 Len=17 TSval=3721953252 TSecr=1597693544
1712099582.899011135   682 0.626717105    10.10.1.2 → 10.10.1.1    TCP 83 60334 → 8081 [PSH, ACK] Seq=1293 Ack=1293 Win=64256 Len=17 TSval=1597693545 TSecr=3721953252
1712099584.899011135   684 0.626817447    10.10.1.1 → 10.10.1.2    TCP 83 8081 → 60334 [PSH, ACK] Seq=1293 Ack=1310 Win=65152 Len=17 TSval=3721953254 TSecr=1597693545
1712099590.899011135   690 0.628030830    10.10.1.2 → 10.10.1.1    TCP 83 60334 → 8081 [PSH, ACK] Seq=1310 Ack=1310 Win=64256 Len=17 TSval=1597693546 TSecr=3721953254
1712099592.899011135   692 0.628153541    10.10.1.1 → 10.10.1.2    TCP 83 8081 → 60334 [PSH, ACK] Seq=1310 Ack=1327 Win=65152 Len=17 TSval=3721953255 TSecr=1597693546
1712099599.899011135   699 0.629368901    10.10.1.2 → 10.10.1.1    TCP 83 60334 → 8081 [PSH, ACK] Seq=1327 Ack=1327 Win=64256 Len=17 TSval=1597693548 TSecr=3721953255
1712099601.899011135   701 0.629491108    10.10.1.1 → 10.10.1.2    TCP 83 8081 → 60334 [PSH, ACK] Seq=1327 Ack=1344 Win=65152 Len=17 TSval=3721953256 TSecr=1597693548
1712099607.899011135   707 0.630709746    10.10.1.2 → 10.10.1.1    TCP 83 60334 → 8081 [PSH, ACK] Seq=1344 Ack=1344 Win=64256 Len=17 TSval=1597693549 TSecr=3721953256
1712099609.899011135   709 0.630813148    10.10.1.1 → 10.10.1.2    TCP 83 8081 → 60334 [PSH, ACK] Seq=1344 Ack=1361 Win=65152 Len=17 TSval=3721953258 TSecr=1597693549
1712099616.899011135   716 0.632026457    10.10.1.2 → 10.10.1.1    TCP 83 60334 → 8081 [PSH, ACK] Seq=1361 Ack=1361 Win=64256 Len=17 TSval=1597693550 TSecr=3721953258
1712099618.899011135   718 0.632149035    10.10.1.1 → 10.10.1.2    TCP 83 8081 → 60334 [PSH, ACK] Seq=1361 Ack=1378 Win=65152 Len=17 TSval=3721953259 TSecr=1597693550
1712099624.899011135   724 0.633362351    10.10.1.2 → 10.10.1.1    TCP 83 60334 → 8081 [PSH, ACK] Seq=1378 Ack=1378 Win=64256 Len=17 TSval=1597693552 TSecr=3721953259
1712099626.899011135   726 0.633484722    10.10.1.1 → 10.10.1.2    TCP 83 8081 → 60334 [PSH, ACK] Seq=1378 Ack=1395 Win=65152 Len=17 TSval=3721953260 TSecr=1597693552
1712099633.899011135   733 0.634703104    10.10.1.2 → 10.10.1.1    TCP 83 60334 → 8081 [PSH, ACK] Seq=1395 Ack=1395 Win=64256 Len=17 TSval=1597693553 TSecr=3721953260
1712099635.899011135   735 0.634762390    10.10.1.1 → 10.10.1.2    TCP 83 8081 → 60334 [PSH, ACK] Seq=1395 Ack=1412 Win=65152 Len=17 TSval=3721953262 TSecr=1597693553
1712099641.899011135   741 0.635973156    10.10.1.2 → 10.10.1.1    TCP 83 60334 → 8081 [PSH, ACK] Seq=1412 Ack=1412 Win=64256 Len=17 TSval=1597693554 TSecr=3721953262
1712099643.899011135   743 0.636099978    10.10.1.1 → 10.10.1.2    TCP 83 8081 → 60334 [PSH, ACK] Seq=1412 Ack=1429 Win=65152 Len=17 TSval=3721953263 TSecr=1597693554
1712099650.899011135   750 0.637313294    10.10.1.2 → 10.10.1.1    TCP 83 60334 → 8081 [PSH, ACK] Seq=1429 Ack=1429 Win=64256 Len=17 TSval=1597693556 TSecr=3721953263
1712099652.899011135   752 0.637435597    10.10.1.1 → 10.10.1.2    TCP 83 8081 → 60334 [PSH, ACK] Seq=1429 Ack=1446 Win=65152 Len=17 TSval=3721953264 TSecr=1597693556
1712099658.899011135   758 0.638652954    10.10.1.2 → 10.10.1.1    TCP 83 60334 → 8081 [PSH, ACK] Seq=1446 Ack=1446 Win=64256 Len=17 TSval=1597693557 TSecr=3721953264
1712099660.899011135   760 0.638790369    10.10.1.1 → 10.10.1.2    TCP 83 8081 → 60334 [PSH, ACK] Seq=1446 Ack=1463 Win=65152 Len=17 TSval=3721953266 TSecr=1597693557
1712099667.899011135   767 0.640004805    10.10.1.2 → 10.10.1.1    TCP 83 60334 → 8081 [PSH, ACK] Seq=1463 Ack=1463 Win=64256 Len=17 TSval=1597693558 TSecr=3721953266
1712099669.899011135   769 0.640142154    10.10.1.1 → 10.10.1.2    TCP 83 8081 → 60334 [PSH, ACK] Seq=1463 Ack=1480 Win=65152 Len=17 TSval=3721953267 TSecr=1597693558
1712099675.899011135   775 0.641355240    10.10.1.2 → 10.10.1.1    TCP 83 60334 → 8081 [PSH, ACK] Seq=1480 Ack=1480 Win=64256 Len=17 TSval=1597693560 TSecr=3721953267
1712099678.899011135   778 0.641491761    10.10.1.1 → 10.10.1.2    TCP 83 8081 → 60334 [PSH, ACK] Seq=1480 Ack=1497 Win=65152 Len=17 TSval=3721953268 TSecr=1597693560
1712099684.899011135   784 0.642710219    10.10.1.2 → 10.10.1.1    TCP 83 60334 → 8081 [PSH, ACK] Seq=1497 Ack=1497 Win=64256 Len=17 TSval=1597693561 TSecr=3721953268
1712099686.899011135   786 0.642841064    10.10.1.1 → 10.10.1.2    TCP 83 8081 → 60334 [PSH, ACK] Seq=1497 Ack=1514 Win=65152 Len=17 TSval=3721953270 TSecr=1597693561
1712099692.899011135   792 0.644054672    10.10.1.2 → 10.10.1.1    TCP 83 60334 → 8081 [PSH, ACK] Seq=1514 Ack=1514 Win=64256 Len=17 TSval=1597693563 TSecr=3721953270
1712099694.899011135   794 0.644178244    10.10.1.1 → 10.10.1.2    TCP 83 8081 → 60334 [PSH, ACK] Seq=1514 Ack=1531 Win=65152 Len=17 TSval=3721953271 TSecr=1597693563
1712099701.899011135   801 0.645391248    10.10.1.2 → 10.10.1.1    TCP 83 60334 → 8081 [PSH, ACK] Seq=1531 Ack=1531 Win=64256 Len=17 TSval=1597693564 TSecr=3721953271
1712099703.899011135   803 0.645513439    10.10.1.1 → 10.10.1.2    TCP 83 8081 → 60334 [PSH, ACK] Seq=1531 Ack=1548 Win=65152 Len=17 TSval=3721953272 TSecr=1597693564
1712099709.899011135   809 0.646731153    10.10.1.2 → 10.10.1.1    TCP 83 60334 → 8081 [PSH, ACK] Seq=1548 Ack=1548 Win=64256 Len=17 TSval=1597693565 TSecr=3721953272
1712099711.899011135   811 0.646816428    10.10.1.1 → 10.10.1.2    TCP 83 8081 → 60334 [PSH, ACK] Seq=1548 Ack=1565 Win=65152 Len=17 TSval=3721953274 TSecr=1597693565
1712099718.899011135   818 0.648030020    10.10.1.2 → 10.10.1.1    TCP 83 60334 → 8081 [PSH, ACK] Seq=1565 Ack=1565 Win=64256 Len=17 TSval=1597693566 TSecr=3721953274
1712099720.899011135   820 0.648157286    10.10.1.1 → 10.10.1.2    TCP 83 8081 → 60334 [PSH, ACK] Seq=1565 Ack=1582 Win=65152 Len=17 TSval=3721953275 TSecr=1597693566
1712099726.899011135   826 0.649370497    10.10.1.2 → 10.10.1.1    TCP 83 60334 → 8081 [PSH, ACK] Seq=1582 Ack=1582 Win=64256 Len=17 TSval=1597693568 TSecr=3721953275
1712099728.899011135   828 0.649496486    10.10.1.1 → 10.10.1.2    TCP 83 8081 → 60334 [PSH, ACK] Seq=1582 Ack=1599 Win=65152 Len=17 TSval=3721953276 TSecr=1597693568
1712099735.899011135   835 0.650717462    10.10.1.2 → 10.10.1.1    TCP 83 60334 → 8081 [PSH, ACK] Seq=1599 Ack=1599 Win=64256 Len=17 TSval=1597693569 TSecr=3721953276
1712099737.899011135   837 0.650815951    10.10.1.1 → 10.10.1.2    TCP 83 8081 → 60334 [PSH, ACK] Seq=1599 Ack=1616 Win=65152 Len=17 TSval=3721953278 TSecr=1597693569
1712099743.899011135   843 0.652028938    10.10.1.2 → 10.10.1.1    TCP 83 60334 → 8081 [PSH, ACK] Seq=1616 Ack=1616 Win=64256 Len=17 TSval=1597693570 TSecr=3721953278
1712099745.899011135   845 0.652154645    10.10.1.1 → 10.10.1.2    TCP 83 8081 → 60334 [PSH, ACK] Seq=1616 Ack=1633 Win=65152 Len=17 TSval=3721953279 TSecr=1597693570
1712099752.899011135   852 0.653368558    10.10.1.2 → 10.10.1.1    TCP 83 60334 → 8081 [PSH, ACK] Seq=1633 Ack=1633 Win=64256 Len=17 TSval=1597693572 TSecr=3721953279
1712099754.899011135   854 0.653495288    10.10.1.1 → 10.10.1.2    TCP 83 8081 → 60334 [PSH, ACK] Seq=1633 Ack=1650 Win=65152 Len=17 TSval=3721953280 TSecr=1597693572
1712099760.899011135   860 0.654713969    10.10.1.2 → 10.10.1.1    TCP 83 60334 → 8081 [PSH, ACK] Seq=1650 Ack=1650 Win=64256 Len=17 TSval=1597693573 TSecr=3721953280
1712099762.899011135   862 0.654849508    10.10.1.1 → 10.10.1.2    TCP 83 8081 → 60334 [PSH, ACK] Seq=1650 Ack=1667 Win=65152 Len=17 TSval=3721953282 TSecr=1597693573
1712099769.899011135   869 0.656062261    10.10.1.2 → 10.10.1.1    TCP 83 60334 → 8081 [PSH, ACK] Seq=1667 Ack=1667 Win=64256 Len=17 TSval=1597693575 TSecr=3721953282
1712099771.899011135   871 0.656187860    10.10.1.1 → 10.10.1.2    TCP 83 8081 → 60334 [PSH, ACK] Seq=1667 Ack=1684 Win=65152 Len=17 TSval=3721953283 TSecr=1597693575
1712099777.899011135   877 0.657402092    10.10.1.2 → 10.10.1.1    TCP 83 60334 → 8081 [PSH, ACK] Seq=1684 Ack=1684 Win=64256 Len=17 TSval=1597693576 TSecr=3721953283
1712099779.899011135   879 0.657524914    10.10.1.1 → 10.10.1.2    TCP 83 8081 → 60334 [PSH, ACK] Seq=1684 Ack=1701 Win=65152 Len=17 TSval=3721953284 TSecr=1597693576
1712099786.899011135   886 0.658760338    10.10.1.2 → 10.10.1.1    TCP 83 60334 → 8081 [PSH, ACK] Seq=1701 Ack=1701 Win=64256 Len=17 TSval=1597693577 TSecr=3721953284
1712099788.899011135   888 0.658844536    10.10.1.1 → 10.10.1.2    TCP 83 8081 → 60334 [PSH, ACK] Seq=1701 Ack=1718 Win=65152 Len=17 TSval=3721953286 TSecr=1597693577
1712099794.899011135   894 0.660057742    10.10.1.2 → 10.10.1.1    TCP 83 60334 → 8081 [PSH, ACK] Seq=1718 Ack=1718 Win=64256 Len=17 TSval=1597693579 TSecr=3721953286
1712099796.899011135   896 0.660183934    10.10.1.1 → 10.10.1.2    TCP 83 8081 → 60334 [PSH, ACK] Seq=1718 Ack=1735 Win=65152 Len=17 TSval=3721953287 TSecr=1597693579
1712099803.899011135   903 0.661397010    10.10.1.2 → 10.10.1.1    TCP 83 60334 → 8081 [PSH, ACK] Seq=1735 Ack=1735 Win=64256 Len=17 TSval=1597693580 TSecr=3721953287
1712099805.899011135   905 0.661523292    10.10.1.1 → 10.10.1.2    TCP 83 8081 → 60334 [PSH, ACK] Seq=1735 Ack=1752 Win=65152 Len=17 TSval=3721953288 TSecr=1597693580
1712099811.899011135   911 0.662743075    10.10.1.2 → 10.10.1.1    TCP 83 60334 → 8081 [PSH, ACK] Seq=1752 Ack=1752 Win=64256 Len=17 TSval=1597693581 TSecr=3721953288
1712099813.899011135   913 0.662829419    10.10.1.1 → 10.10.1.2    TCP 83 8081 → 60334 [PSH, ACK] Seq=1752 Ack=1769 Win=65152 Len=17 TSval=3721953290 TSecr=1597693581
1712099820.899011135   920 0.664043562    10.10.1.2 → 10.10.1.1    TCP 83 60334 → 8081 [PSH, ACK] Seq=1769 Ack=1769 Win=64256 Len=17 TSval=1597693582 TSecr=3721953290
1712099822.899011135   922 0.664169547    10.10.1.1 → 10.10.1.2    TCP 83 8081 → 60334 [PSH, ACK] Seq=1769 Ack=1786 Win=65152 Len=17 TSval=3721953291 TSecr=1597693582
1712099828.899011135   928 0.665382264    10.10.1.2 → 10.10.1.1    TCP 83 60334 → 8081 [PSH, ACK] Seq=1786 Ack=1786 Win=64256 Len=17 TSval=1597693584 TSecr=3721953291
1712099830.899011135   930 0.665508789    10.10.1.1 → 10.10.1.2    TCP 83 8081 → 60334 [PSH, ACK] Seq=1786 Ack=1803 Win=65152 Len=17 TSval=3721953292 TSecr=1597693584
1712099837.899011135   937 0.666727952    10.10.1.2 → 10.10.1.1    TCP 83 60334 → 8081 [PSH, ACK] Seq=1803 Ack=1803 Win=64256 Len=17 TSval=1597693585 TSecr=3721953292
1712099839.899011135   939 0.666859767    10.10.1.1 → 10.10.1.2    TCP 83 8081 → 60334 [PSH, ACK] Seq=1803 Ack=1820 Win=65152 Len=17 TSval=3721953294 TSecr=1597693585
1712099845.899011135   945 0.668073144    10.10.1.2 → 10.10.1.1    TCP 83 60334 → 8081 [PSH, ACK] Seq=1820 Ack=1820 Win=64256 Len=17 TSval=1597693587 TSecr=3721953294
1712099847.899011135   947 0.668195016    10.10.1.1 → 10.10.1.2    TCP 83 8081 → 60334 [PSH, ACK] Seq=1820 Ack=1837 Win=65152 Len=17 TSval=3721953295 TSecr=1597693587
1712099854.899011135   954 0.669407433    10.10.1.2 → 10.10.1.1    TCP 83 60334 → 8081 [PSH, ACK] Seq=1837 Ack=1837 Win=64256 Len=17 TSval=1597693588 TSecr=3721953295
1712099856.899011135   956 0.669539031    10.10.1.1 → 10.10.1.2    TCP 83 8081 → 60334 [PSH, ACK] Seq=1837 Ack=1854 Win=65152 Len=17 TSval=3721953296 TSecr=1597693588
1712099862.899011135   962 0.670756868    10.10.1.2 → 10.10.1.1    TCP 83 60334 → 8081 [PSH, ACK] Seq=1854 Ack=1854 Win=64256 Len=17 TSval=1597693589 TSecr=3721953296
1712099864.899011135   964 0.670843164    10.10.1.1 → 10.10.1.2    TCP 83 8081 → 60334 [PSH, ACK] Seq=1854 Ack=1871 Win=65152 Len=17 TSval=3721953298 TSecr=1597693589
1712099871.899011135   971 0.672056974    10.10.1.2 → 10.10.1.1    TCP 83 60334 → 8081 [PSH, ACK] Seq=1871 Ack=1871 Win=64256 Len=17 TSval=1597693591 TSecr=3721953298
1712099873.899011135   973 0.672183747    10.10.1.1 → 10.10.1.2    TCP 83 8081 → 60334 [PSH, ACK] Seq=1871 Ack=1888 Win=65152 Len=17 TSval=3721953299 TSecr=1597693591
1712099879.899011135   979 0.673397082    10.10.1.2 → 10.10.1.1    TCP 83 60334 → 8081 [PSH, ACK] Seq=1888 Ack=1888 Win=64256 Len=17 TSval=1597693592 TSecr=3721953299
1712099881.899011135   981 0.673522674    10.10.1.1 → 10.10.1.2    TCP 83 8081 → 60334 [PSH, ACK] Seq=1888 Ack=1905 Win=65152 Len=17 TSval=3721953300 TSecr=1597693592
1712099888.899011135   988 0.674741785    10.10.1.2 → 10.10.1.1    TCP 83 60334 → 8081 [PSH, ACK] Seq=1905 Ack=1905 Win=64256 Len=17 TSval=1597693593 TSecr=3721953300
1712099890.899011135   990 0.674828759    10.10.1.1 → 10.10.1.2    TCP 83 8081 → 60334 [PSH, ACK] Seq=1905 Ack=1922 Win=65152 Len=17 TSval=3721953302 TSecr=1597693593
1712099896.899011135   996 0.676040971    10.10.1.2 → 10.10.1.1    TCP 83 60334 → 8081 [PSH, ACK] Seq=1922 Ack=1922 Win=64256 Len=17 TSval=1597693594 TSecr=3721953302
1712099899.899011135   999 0.676234110    10.10.1.1 → 10.10.1.2    TCP 83 8081 → 60334 [PSH, ACK] Seq=1922 Ack=1939 Win=65152 Len=17 TSval=3721953303 TSecr=1597693594
1712099905.899011135  1005 0.677449498    10.10.1.2 → 10.10.1.1    TCP 83 60334 → 8081 [PSH, ACK] Seq=1939 Ack=1939 Win=64256 Len=17 TSval=1597693596 TSecr=3721953303
1712099907.899011135  1007 0.677575683    10.10.1.1 → 10.10.1.2    TCP 83 8081 → 60334 [PSH, ACK] Seq=1939 Ack=1956 Win=65152 Len=17 TSval=3721953304 TSecr=1597693596
1712099913.899011135  1013 0.678793499    10.10.1.2 → 10.10.1.1    TCP 83 60334 → 8081 [PSH, ACK] Seq=1956 Ack=1956 Win=64256 Len=17 TSval=1597693597 TSecr=3721953304
1712099915.899011135  1015 0.678878413    10.10.1.1 → 10.10.1.2    TCP 83 8081 → 60334 [PSH, ACK] Seq=1956 Ack=1973 Win=65152 Len=17 TSval=3721953306 TSecr=1597693597
1712099922.899011135  1022 0.680092367    10.10.1.2 → 10.10.1.1    TCP 83 60334 → 8081 [PSH, ACK] Seq=1973 Ack=1973 Win=64256 Len=17 TSval=1597693599 TSecr=3721953306
1712099924.899011135  1024 0.680219414    10.10.1.1 → 10.10.1.2    TCP 83 8081 → 60334 [PSH, ACK] Seq=1973 Ack=1990 Win=65152 Len=17 TSval=3721953307 TSecr=1597693599
1712099930.899011135  1030 0.681431860    10.10.1.2 → 10.10.1.1    TCP 83 60334 → 8081 [PSH, ACK] Seq=1990 Ack=1990 Win=64256 Len=17 TSval=1597693600 TSecr=3721953307
1712099932.899011135  1032 0.681558126    10.10.1.1 → 10.10.1.2    TCP 83 8081 → 60334 [PSH, ACK] Seq=1990 Ack=2007 Win=65152 Len=17 TSval=3721953308 TSecr=1597693600
1712099939.899011135  1039 0.682776173    10.10.1.2 → 10.10.1.1    TCP 83 60334 → 8081 [PSH, ACK] Seq=2007 Ack=2007 Win=64256 Len=17 TSval=1597693601 TSecr=3721953308
1712099941.899011135  1041 0.682905748    10.10.1.1 → 10.10.1.2    TCP 83 8081 → 60334 [PSH, ACK] Seq=2007 Ack=2024 Win=65152 Len=17 TSval=3721953310 TSecr=1597693601
1712099947.899011135  1047 0.684119497    10.10.1.2 → 10.10.1.1    TCP 83 60334 → 8081 [PSH, ACK] Seq=2024 Ack=2024 Win=64256 Len=17 TSval=1597693603 TSecr=3721953310
1712099949.899011135  1049 0.684241679    10.10.1.1 → 10.10.1.2    TCP 83 8081 → 60334 [PSH, ACK] Seq=2024 Ack=2041 Win=65152 Len=17 TSval=3721953311 TSecr=1597693603
1712099956.899011135  1056 0.685454841    10.10.1.2 → 10.10.1.1    TCP 83 60334 → 8081 [PSH, ACK] Seq=2041 Ack=2041 Win=64256 Len=17 TSval=1597693604 TSecr=3721953311
