1712098918.315551281    34 0.522044777    10.10.1.2 → 10.10.1.1    TCP 83 42560 → 8081 [PSH, ACK] Seq=1 Ack=1 Win=64256 Len=17 TSval=1597676853 TSecr=3721936310
1712098921.315551281    37 0.522367683    10.10.1.1 → 10.10.1.2    TCP 83 8081 → 42560 [PSH, ACK] Seq=1 Ack=18 Win=65152 Len=17 TSval=3721936562 TSecr=1597676853
1712098928.315551281    44 0.523585988    10.10.1.2 → 10.10.1.1    TCP 83 42560 → 8081 [PSH, ACK] Seq=18 Ack=18 Win=64256 Len=17 TSval=1597676854 TSecr=3721936562
1712098930.315551281    46 0.523709914    10.10.1.1 → 10.10.1.2    TCP 83 8081 → 42560 [PSH, ACK] Seq=18 Ack=35 Win=65152 Len=17 TSval=3721936563 TSecr=1597676854
1712098937.315551281    53 0.524932078    10.10.1.2 → 10.10.1.1    TCP 83 42560 → 8081 [PSH, ACK] Seq=35 Ack=35 Win=64256 Len=17 TSval=1597676856 TSecr=3721936563
1712098939.315551281    55 0.525059828    10.10.1.1 → 10.10.1.2    TCP 83 8081 → 42560 [PSH, ACK] Seq=35 Ack=52 Win=65152 Len=17 TSval=3721936564 TSecr=1597676856
1712098945.315551281    61 0.526277215    10.10.1.2 → 10.10.1.1    TCP 83 42560 → 8081 [PSH, ACK] Seq=52 Ack=52 Win=64256 Len=17 TSval=1597676857 TSecr=3721936564
1712098947.315551281    63 0.526408131    10.10.1.1 → 10.10.1.2    TCP 83 8081 → 42560 [PSH, ACK] Seq=52 Ack=69 Win=65152 Len=17 TSval=3721936566 TSecr=1597676857
1712098955.315551281    71 0.527626758    10.10.1.2 → 10.10.1.1    TCP 83 42560 → 8081 [PSH, ACK] Seq=69 Ack=69 Win=64256 Len=17 TSval=1597676858 TSecr=3721936566
1712098957.315551281    73 0.527763414    10.10.1.1 → 10.10.1.2    TCP 83 8081 → 42560 [PSH, ACK] Seq=69 Ack=86 Win=65152 Len=17 TSval=3721936567 TSecr=1597676858
1712098963.315551281    79 0.528976852    10.10.1.2 → 10.10.1.1    TCP 83 42560 → 8081 [PSH, ACK] Seq=86 Ack=86 Win=64256 Len=17 TSval=1597676860 TSecr=3721936567
1712098965.315551281    81 0.529103918    10.10.1.1 → 10.10.1.2    TCP 83 8081 → 42560 [PSH, ACK] Seq=86 Ack=103 Win=65152 Len=17 TSval=3721936568 TSecr=1597676860
1712098973.315551281    89 0.530329620    10.10.1.2 → 10.10.1.1    TCP 83 42560 → 8081 [PSH, ACK] Seq=103 Ack=103 Win=64256 Len=17 TSval=1597676861 TSecr=3721936568
1712098975.315551281    91 0.530466036    10.10.1.1 → 10.10.1.2    TCP 83 8081 → 42560 [PSH, ACK] Seq=103 Ack=120 Win=65152 Len=17 TSval=3721936570 TSecr=1597676861
1712098982.315551281    98 0.531687169    10.10.1.2 → 10.10.1.1    TCP 83 42560 → 8081 [PSH, ACK] Seq=120 Ack=120 Win=64256 Len=17 TSval=1597676863 TSecr=3721936570
1712098984.315551281   100 0.531814774    10.10.1.1 → 10.10.1.2    TCP 83 8081 → 42560 [PSH, ACK] Seq=120 Ack=137 Win=65152 Len=17 TSval=3721936571 TSecr=1597676863
1712098990.315551281   106 0.533027750    10.10.1.2 → 10.10.1.1    TCP 83 42560 → 8081 [PSH, ACK] Seq=137 Ack=137 Win=64256 Len=17 TSval=1597676864 TSecr=3721936571
1712098992.315551281   108 0.533163478    10.10.1.1 → 10.10.1.2    TCP 83 8081 → 42560 [PSH, ACK] Seq=137 Ack=154 Win=65152 Len=17 TSval=3721936572 TSecr=1597676864
1712098999.315551281   115 0.534387239    10.10.1.2 → 10.10.1.1    TCP 83 42560 → 8081 [PSH, ACK] Seq=154 Ack=154 Win=64256 Len=17 TSval=1597676865 TSecr=3721936572
1712099001.315551281   117 0.534473506    10.10.1.1 → 10.10.1.2    TCP 83 8081 → 42560 [PSH, ACK] Seq=154 Ack=171 Win=65152 Len=17 TSval=3721936574 TSecr=1597676865
1712099007.315551281   123 0.535687102    10.10.1.2 → 10.10.1.1    TCP 83 42560 → 8081 [PSH, ACK] Seq=171 Ack=171 Win=64256 Len=17 TSval=1597676867 TSecr=3721936574
1712099009.315551281   125 0.535810178    10.10.1.1 → 10.10.1.2    TCP 83 8081 → 42560 [PSH, ACK] Seq=171 Ack=188 Win=65152 Len=17 TSval=3721936575 TSecr=1597676867
1712099016.315551281   132 0.537028280    10.10.1.2 → 10.10.1.1    TCP 83 42560 → 8081 [PSH, ACK] Seq=188 Ack=188 Win=64256 Len=17 TSval=1597676868 TSecr=3721936575
1712099018.315551281   134 0.537161407    10.10.1.1 → 10.10.1.2    TCP 83 8081 → 42560 [PSH, ACK] Seq=188 Ack=205 Win=65152 Len=17 TSval=3721936576 TSecr=1597676868
1712099024.315551281   140 0.538389752    10.10.1.2 → 10.10.1.1    TCP 83 42560 → 8081 [PSH, ACK] Seq=205 Ack=205 Win=64256 Len=17 TSval=1597676869 TSecr=3721936576
1712099027.315551281   143 0.538475054    10.10.1.1 → 10.10.1.2    TCP 83 8081 → 42560 [PSH, ACK] Seq=205 Ack=222 Win=65152 Len=17 TSval=3721936578 TSecr=1597676869
1712099033.315551281   149 0.539689130    10.10.1.2 → 10.10.1.1    TCP 83 42560 → 8081 [PSH, ACK] Seq=222 Ack=222 Win=64256 Len=17 TSval=1597676871 TSecr=3721936578
1712099035.315551281   151 0.539816044    10.10.1.1 → 10.10.1.2    TCP 83 8081 → 42560 [PSH, ACK] Seq=222 Ack=239 Win=65152 Len=17 TSval=3721936579 TSecr=1597676871
1712099041.315551281   157 0.541028821    10.10.1.2 → 10.10.1.1    TCP 83 42560 → 8081 [PSH, ACK] Seq=239 Ack=239 Win=64256 Len=17 TSval=1597676872 TSecr=3721936579
1712099043.315551281   159 0.541165536    10.10.1.1 → 10.10.1.2    TCP 83 8081 → 42560 [PSH, ACK] Seq=239 Ack=256 Win=65152 Len=17 TSval=3721936580 TSecr=1597676872
1712099050.315551281   166 0.542388113    10.10.1.2 → 10.10.1.1    TCP 83 42560 → 8081 [PSH, ACK] Seq=256 Ack=256 Win=64256 Len=17 TSval=1597676873 TSecr=3721936580
1712099052.315551281   168 0.542519293    10.10.1.1 → 10.10.1.2    TCP 83 8081 → 42560 [PSH, ACK] Seq=256 Ack=273 Win=65152 Len=17 TSval=3721936582 TSecr=1597676873
1712099058.315551281   174 0.543734962    10.10.1.2 → 10.10.1.1    TCP 83 42560 → 8081 [PSH, ACK] Seq=273 Ack=273 Win=64256 Len=17 TSval=1597676875 TSecr=3721936582
1712099060.315551281   176 0.543865222    10.10.1.1 → 10.10.1.2    TCP 83 8081 → 42560 [PSH, ACK] Seq=273 Ack=290 Win=65152 Len=17 TSval=3721936583 TSecr=1597676875
1712099067.315551281   183 0.545085159    10.10.1.2 → 10.10.1.1    TCP 83 42560 → 8081 [PSH, ACK] Seq=290 Ack=290 Win=64256 Len=17 TSval=1597676876 TSecr=3721936583
1712099069.315551281   185 0.545216902    10.10.1.1 → 10.10.1.2    TCP 83 8081 → 42560 [PSH, ACK] Seq=290 Ack=307 Win=65152 Len=17 TSval=3721936584 TSecr=1597676876
1712099075.315551281   191 0.546434673    10.10.1.2 → 10.10.1.1    TCP 83 42560 → 8081 [PSH, ACK] Seq=307 Ack=307 Win=64256 Len=17 TSval=1597676877 TSecr=3721936584
1712099077.315551281   193 0.546520455    10.10.1.1 → 10.10.1.2    TCP 83 8081 → 42560 [PSH, ACK] Seq=307 Ack=324 Win=65152 Len=17 TSval=3721936586 TSecr=1597676877
1712099084.315551281   200 0.547740838    10.10.1.2 → 10.10.1.1    TCP 83 42560 → 8081 [PSH, ACK] Seq=324 Ack=324 Win=64256 Len=17 TSval=1597676879 TSecr=3721936586
1712099086.315551281   202 0.547866765    10.10.1.1 → 10.10.1.2    TCP 83 8081 → 42560 [PSH, ACK] Seq=324 Ack=341 Win=65152 Len=17 TSval=3721936587 TSecr=1597676879
1712099092.315551281   208 0.549082404    10.10.1.2 → 10.10.1.1    TCP 83 42560 → 8081 [PSH, ACK] Seq=341 Ack=341 Win=64256 Len=17 TSval=1597676880 TSecr=3721936587
1712099094.315551281   210 0.549218104    10.10.1.1 → 10.10.1.2    TCP 83 8081 → 42560 [PSH, ACK] Seq=341 Ack=358 Win=65152 Len=17 TSval=3721936588 TSecr=1597676880
1712099101.315551281   217 0.550438715    10.10.1.2 → 10.10.1.1    TCP 83 42560 → 8081 [PSH, ACK] Seq=358 Ack=358 Win=64256 Len=17 TSval=1597676881 TSecr=3721936588
1712099103.315551281   219 0.550569242    10.10.1.1 → 10.10.1.2    TCP 83 8081 → 42560 [PSH, ACK] Seq=358 Ack=375 Win=65152 Len=17 TSval=3721936590 TSecr=1597676881
1712099109.315551281   225 0.551782293    10.10.1.2 → 10.10.1.1    TCP 83 42560 → 8081 [PSH, ACK] Seq=375 Ack=375 Win=64256 Len=17 TSval=1597676883 TSecr=3721936590
1712099111.315551281   227 0.551905531    10.10.1.1 → 10.10.1.2    TCP 83 8081 → 42560 [PSH, ACK] Seq=375 Ack=392 Win=65152 Len=17 TSval=3721936591 TSecr=1597676883
1712099118.315551281   234 0.553124004    10.10.1.2 → 10.10.1.1    TCP 83 42560 → 8081 [PSH, ACK] Seq=392 Ack=392 Win=64256 Len=17 TSval=1597676884 TSecr=3721936591
1712099120.315551281   236 0.553256033    10.10.1.1 → 10.10.1.2    TCP 83 8081 → 42560 [PSH, ACK] Seq=392 Ack=409 Win=65152 Len=17 TSval=3721936592 TSecr=1597676884
1712099126.315551281   242 0.554470980    10.10.1.2 → 10.10.1.1    TCP 83 42560 → 8081 [PSH, ACK] Seq=409 Ack=409 Win=64256 Len=17 TSval=1597676885 TSecr=3721936592
1712099128.315551281   244 0.554557512    10.10.1.1 → 10.10.1.2    TCP 83 8081 → 42560 [PSH, ACK] Seq=409 Ack=426 Win=65152 Len=17 TSval=3721936594 TSecr=1597676885
1712099135.315551281   251 0.555773278    10.10.1.2 → 10.10.1.1    TCP 83 42560 → 8081 [PSH, ACK] Seq=426 Ack=426 Win=64256 Len=17 TSval=1597676887 TSecr=3721936594
1712099137.315551281   253 0.555899840    10.10.1.1 → 10.10.1.2    TCP 83 8081 → 42560 [PSH, ACK] Seq=426 Ack=443 Win=65152 Len=17 TSval=3721936595 TSecr=1597676887
1712099143.315551281   259 0.557113812    10.10.1.2 → 10.10.1.1    TCP 83 42560 → 8081 [PSH, ACK] Seq=443 Ack=443 Win=64256 Len=17 TSval=1597676888 TSecr=3721936595
1712099145.315551281   261 0.557239967    10.10.1.1 → 10.10.1.2    TCP 83 8081 → 42560 [PSH, ACK] Seq=443 Ack=460 Win=65152 Len=17 TSval=3721936596 TSecr=1597676888
1712099153.315551281   269 0.558460734    10.10.1.2 → 10.10.1.1    TCP 83 42560 → 8081 [PSH, ACK] Seq=460 Ack=460 Win=64256 Len=17 TSval=1597676889 TSecr=3721936596
1712099156.315551281   272 0.558592105    10.10.1.1 → 10.10.1.2    TCP 83 8081 → 42560 [PSH, ACK] Seq=460 Ack=477 Win=65152 Len=17 TSval=3721936598 TSecr=1597676889
1712099162.315551281   278 0.559803899    10.10.1.2 → 10.10.1.1    TCP 83 42560 → 8081 [PSH, ACK] Seq=477 Ack=477 Win=64256 Len=17 TSval=1597676891 TSecr=3721936598
1712099164.315551281   280 0.559926146    10.10.1.1 → 10.10.1.2    TCP 83 8081 → 42560 [PSH, ACK] Seq=477 Ack=494 Win=65152 Len=17 TSval=3721936599 TSecr=1597676891
1712099170.315551281   286 0.561138682    10.10.1.2 → 10.10.1.1    TCP 83 42560 → 8081 [PSH, ACK] Seq=494 Ack=494 Win=64256 Len=17 TSval=1597676892 TSecr=3721936599
1712099172.315551281   288 0.561261814    10.10.1.1 → 10.10.1.2    TCP 83 8081 → 42560 [PSH, ACK] Seq=494 Ack=511 Win=65152 Len=17 TSval=3721936600 TSecr=1597676892
1712099179.315551281   295 0.562481161    10.10.1.2 → 10.10.1.1    TCP 83 42560 → 8081 [PSH, ACK] Seq=511 Ack=511 Win=64256 Len=17 TSval=1597676893 TSecr=3721936600
1712099181.315551281   297 0.562565791    10.10.1.1 → 10.10.1.2    TCP 83 8081 → 42560 [PSH, ACK] Seq=511 Ack=528 Win=65152 Len=17 TSval=3721936602 TSecr=1597676893
1712099187.315551281   303 0.563780671    10.10.1.2 → 10.10.1.1    TCP 83 42560 → 8081 [PSH, ACK] Seq=528 Ack=528 Win=64256 Len=17 TSval=1597676895 TSecr=3721936602
1712099189.315551281   305 0.563914702    10.10.1.1 → 10.10.1.2    TCP 83 8081 → 42560 [PSH, ACK] Seq=528 Ack=545 Win=65152 Len=17 TSval=3721936603 TSecr=1597676895
1712099196.315551281   312 0.565135041    10.10.1.2 → 10.10.1.1    TCP 83 42560 → 8081 [PSH, ACK] Seq=545 Ack=545 Win=64256 Len=17 TSval=1597676896 TSecr=3721936603
1712099198.315551281   314 0.565257401    10.10.1.1 → 10.10.1.2    TCP 83 8081 → 42560 [PSH, ACK] Seq=545 Ack=562 Win=65152 Len=17 TSval=3721936604 TSecr=1597676896
1712099204.315551281   320 0.566475383    10.10.1.2 → 10.10.1.1    TCP 83 42560 → 8081 [PSH, ACK] Seq=562 Ack=562 Win=64256 Len=17 TSval=1597676897 TSecr=3721936604
1712099206.315551281   322 0.566561994    10.10.1.1 → 10.10.1.2    TCP 83 8081 → 42560 [PSH, ACK] Seq=562 Ack=579 Win=65152 Len=17 TSval=3721936606 TSecr=1597676897
1712099213.315551281   329 0.567773730    10.10.1.2 → 10.10.1.1    TCP 83 42560 → 8081 [PSH, ACK] Seq=579 Ack=579 Win=64256 Len=17 TSval=1597676899 TSecr=3721936606
1712099215.315551281   331 0.567900488    10.10.1.1 → 10.10.1.2    TCP 83 8081 → 42560 [PSH, ACK] Seq=579 Ack=596 Win=65152 Len=17 TSval=3721936607 TSecr=1597676899
1712099221.315551281   337 0.569112994    10.10.1.2 → 10.10.1.1    TCP 83 42560 → 8081 [PSH, ACK] Seq=596 Ack=596 Win=64256 Len=17 TSval=1597676900 TSecr=3721936607
1712099223.315551281   339 0.569247515    10.10.1.1 → 10.10.1.2    TCP 83 8081 → 42560 [PSH, ACK] Seq=596 Ack=613 Win=65152 Len=17 TSval=3721936608 TSecr=1597676900
1712099230.315551281   346 0.570465172    10.10.1.2 → 10.10.1.1    TCP 83 42560 → 8081 [PSH, ACK] Seq=613 Ack=613 Win=64256 Len=17 TSval=1597676901 TSecr=3721936608
1712099232.315551281   348 0.570594907    10.10.1.1 → 10.10.1.2    TCP 83 8081 → 42560 [PSH, ACK] Seq=613 Ack=630 Win=65152 Len=17 TSval=3721936610 TSecr=1597676901
1712099239.315551281   355 0.571807724    10.10.1.2 → 10.10.1.1    TCP 83 42560 → 8081 [PSH, ACK] Seq=630 Ack=630 Win=64256 Len=17 TSval=1597676903 TSecr=3721936610
1712099241.315551281   357 0.571930058    10.10.1.1 → 10.10.1.2    TCP 83 8081 → 42560 [PSH, ACK] Seq=630 Ack=647 Win=65152 Len=17 TSval=3721936611 TSecr=1597676903
1712099248.315551281   364 0.573142658    10.10.1.2 → 10.10.1.1    TCP 83 42560 → 8081 [PSH, ACK] Seq=647 Ack=647 Win=64256 Len=17 TSval=1597676904 TSecr=3721936611
1712099250.315551281   366 0.573273914    10.10.1.1 → 10.10.1.2    TCP 83 8081 → 42560 [PSH, ACK] Seq=647 Ack=664 Win=65152 Len=17 TSval=3721936612 TSecr=1597676904
1712099256.315551281   372 0.574489537    10.10.1.2 → 10.10.1.1    TCP 83 42560 → 8081 [PSH, ACK] Seq=664 Ack=664 Win=64256 Len=17 TSval=1597676905 TSecr=3721936612
1712099258.315551281   374 0.574575924    10.10.1.1 → 10.10.1.2    TCP 83 8081 → 42560 [PSH, ACK] Seq=664 Ack=681 Win=65152 Len=17 TSval=3721936614 TSecr=1597676905
1712099266.315551281   382 0.575793388    10.10.1.2 → 10.10.1.1    TCP 83 42560 → 8081 [PSH, ACK] Seq=681 Ack=681 Win=64256 Len=17 TSval=1597676907 TSecr=3721936614
1712099268.315551281   384 0.575920750    10.10.1.1 → 10.10.1.2    TCP 83 8081 → 42560 [PSH, ACK] Seq=681 Ack=698 Win=65152 Len=17 TSval=3721936615 TSecr=1597676907
1712099275.315551281   391 0.577138788    10.10.1.2 → 10.10.1.1    TCP 83 42560 → 8081 [PSH, ACK] Seq=698 Ack=698 Win=64256 Len=17 TSval=1597676908 TSecr=3721936615
1712099277.315551281   393 0.577274374    10.10.1.1 → 10.10.1.2    TCP 83 8081 → 42560 [PSH, ACK] Seq=698 Ack=715 Win=65152 Len=17 TSval=3721936616 TSecr=1597676908
1712099283.315551281   399 0.578488591    10.10.1.2 → 10.10.1.1    TCP 83 42560 → 8081 [PSH, ACK] Seq=715 Ack=715 Win=64256 Len=17 TSval=1597676909 TSecr=3721936616
1712099285.315551281   401 0.578574557    10.10.1.1 → 10.10.1.2    TCP 83 8081 → 42560 [PSH, ACK] Seq=715 Ack=732 Win=65152 Len=17 TSval=3721936618 TSecr=1597676909
1712099292.315551281   408 0.579792997    10.10.1.2 → 10.10.1.1    TCP 83 42560 → 8081 [PSH, ACK] Seq=732 Ack=732 Win=64256 Len=17 TSval=1597676911 TSecr=3721936618
1712099294.315551281   410 0.579930094    10.10.1.1 → 10.10.1.2    TCP 83 8081 → 42560 [PSH, ACK] Seq=732 Ack=749 Win=65152 Len=17 TSval=3721936619 TSecr=1597676911
1712099300.315551281   416 0.581142271    10.10.1.2 → 10.10.1.1    TCP 83 42560 → 8081 [PSH, ACK] Seq=749 Ack=749 Win=64256 Len=17 TSval=1597676912 TSecr=3721936619
1712099302.315551281   418 0.581276855    10.10.1.1 → 10.10.1.2    TCP 83 8081 → 42560 [PSH, ACK] Seq=749 Ack=766 Win=65152 Len=17 TSval=3721936620 TSecr=1597676912
1712099309.315551281   425 0.582495388    10.10.1.2 → 10.10.1.1    TCP 83 42560 → 8081 [PSH, ACK] Seq=766 Ack=766 Win=64256 Len=17 TSval=1597676913 TSecr=3721936620
1712099311.315551281   427 0.582580212    10.10.1.1 → 10.10.1.2    TCP 83 8081 → 42560 [PSH, ACK] Seq=766 Ack=783 Win=65152 Len=17 TSval=3721936622 TSecr=1597676913
1712099317.315551281   433 0.583792016    10.10.1.2 → 10.10.1.1    TCP 83 42560 → 8081 [PSH, ACK] Seq=783 Ack=783 Win=64256 Len=17 TSval=1597676915 TSecr=3721936622
1712099319.315551281   435 0.583927444    10.10.1.1 → 10.10.1.2    TCP 83 8081 → 42560 [PSH, ACK] Seq=783 Ack=800 Win=65152 Len=17 TSval=3721936623 TSecr=1597676915
1712099326.315551281   442 0.585146615    10.10.1.2 → 10.10.1.1    TCP 83 42560 → 8081 [PSH, ACK] Seq=800 Ack=800 Win=64256 Len=17 TSval=1597676916 TSecr=3721936623
1712099328.315551281   444 0.585193617    10.10.1.1 → 10.10.1.2    TCP 83 8081 → 42560 [PSH, ACK] Seq=800 Ack=817 Win=65152 Len=17 TSval=3721936624 TSecr=1597676916
1712099334.315551281   450 0.586406888    10.10.1.2 → 10.10.1.1    TCP 83 42560 → 8081 [PSH, ACK] Seq=817 Ack=817 Win=64256 Len=17 TSval=1597676917 TSecr=3721936624
1712099336.315551281   452 0.586492675    10.10.1.1 → 10.10.1.2    TCP 83 8081 → 42560 [PSH, ACK] Seq=817 Ack=834 Win=65152 Len=17 TSval=3721936626 TSecr=1597676917
1712099343.315551281   459 0.587704001    10.10.1.2 → 10.10.1.1    TCP 83 42560 → 8081 [PSH, ACK] Seq=834 Ack=834 Win=64256 Len=17 TSval=1597676919 TSecr=3721936626
1712099345.315551281   461 0.587830871    10.10.1.1 → 10.10.1.2    TCP 83 8081 → 42560 [PSH, ACK] Seq=834 Ack=851 Win=65152 Len=17 TSval=3721936627 TSecr=1597676919
1712099351.315551281   467 0.589053909    10.10.1.2 → 10.10.1.1    TCP 83 42560 → 8081 [PSH, ACK] Seq=851 Ack=851 Win=64256 Len=17 TSval=1597676920 TSecr=3721936627
1712099353.315551281   469 0.589181631    10.10.1.1 → 10.10.1.2    TCP 83 8081 → 42560 [PSH, ACK] Seq=851 Ack=868 Win=65152 Len=17 TSval=3721936628 TSecr=1597676920
1712099360.315551281   476 0.590403935    10.10.1.2 → 10.10.1.1    TCP 83 42560 → 8081 [PSH, ACK] Seq=868 Ack=868 Win=64256 Len=17 TSval=1597676921 TSecr=3721936628
1712099362.315551281   478 0.590491656    10.10.1.1 → 10.10.1.2    TCP 83 8081 → 42560 [PSH, ACK] Seq=868 Ack=885 Win=65152 Len=17 TSval=3721936630 TSecr=1597676921
1712099368.315551281   484 0.591702690    10.10.1.2 → 10.10.1.1    TCP 83 42560 → 8081 [PSH, ACK] Seq=885 Ack=885 Win=64256 Len=17 TSval=1597676923 TSecr=3721936630
1712099370.315551281   486 0.591829130    10.10.1.1 → 10.10.1.2    TCP 83 8081 → 42560 [PSH, ACK] Seq=885 Ack=902 Win=65152 Len=17 TSval=3721936631 TSecr=1597676923
1712099377.315551281   493 0.593046881    10.10.1.2 → 10.10.1.1    TCP 83 42560 → 8081 [PSH, ACK] Seq=902 Ack=902 Win=64256 Len=17 TSval=1597676924 TSecr=3721936631
1712099379.315551281   495 0.593177713    10.10.1.1 → 10.10.1.2    TCP 83 8081 → 42560 [PSH, ACK] Seq=902 Ack=919 Win=65152 Len=17 TSval=3721936632 TSecr=1597676924
1712099385.315551281   501 0.594405340    10.10.1.2 → 10.10.1.1    TCP 83 42560 → 8081 [PSH, ACK] Seq=919 Ack=919 Win=64256 Len=17 TSval=1597676925 TSecr=3721936632
1712099387.315551281   503 0.594489211    10.10.1.1 → 10.10.1.2    TCP 83 8081 → 42560 [PSH, ACK] Seq=919 Ack=936 Win=65152 Len=17 TSval=3721936634 TSecr=1597676925
1712099394.315551281   510 0.595705539    10.10.1.2 → 10.10.1.1    TCP 83 42560 → 8081 [PSH, ACK] Seq=936 Ack=936 Win=64256 Len=17 TSval=1597676927 TSecr=3721936634
1712099396.315551281   512 0.595838035    10.10.1.1 → 10.10.1.2    TCP 83 8081 → 42560 [PSH, ACK] Seq=936 Ack=953 Win=65152 Len=17 TSval=3721936635 TSecr=1597676927
1712099402.315551281   518 0.597050750    10.10.1.2 → 10.10.1.1    TCP 83 42560 → 8081 [PSH, ACK] Seq=953 Ack=953 Win=64256 Len=17 TSval=1597676928 TSecr=3721936635
1712099405.315551281   521 0.597226938    10.10.1.1 → 10.10.1.2    TCP 83 8081 → 42560 [PSH, ACK] Seq=953 Ack=970 Win=65152 Len=17 TSval=3721936636 TSecr=1597676928
1712099411.315551281   527 0.598442807    10.10.1.2 → 10.10.1.1    TCP 83 42560 → 8081 [PSH, ACK] Seq=970 Ack=970 Win=64256 Len=17 TSval=1597676929 TSecr=3721936636
1712099413.315551281   529 0.598521145    10.10.1.1 → 10.10.1.2    TCP 83 8081 → 42560 [PSH, ACK] Seq=970 Ack=987 Win=65152 Len=17 TSval=3721936638 TSecr=1597676929
1712099419.315551281   535 0.599732464    10.10.1.2 → 10.10.1.1    TCP 83 42560 → 8081 [PSH, ACK] Seq=987 Ack=987 Win=64256 Len=17 TSval=1597676931 TSecr=3721936638
1712099421.315551281   537 0.599864835    10.10.1.1 → 10.10.1.2    TCP 83 8081 → 42560 [PSH, ACK] Seq=987 Ack=1004 Win=65152 Len=17 TSval=3721936639 TSecr=1597676931
1712099428.315551281   544 0.601082766    10.10.1.2 → 10.10.1.1    TCP 83 42560 → 8081 [PSH, ACK] Seq=1004 Ack=1004 Win=64256 Len=17 TSval=1597676932 TSecr=3721936639
1712099430.315551281   546 0.601204886    10.10.1.1 → 10.10.1.2    TCP 83 8081 → 42560 [PSH, ACK] Seq=1004 Ack=1021 Win=65152 Len=17 TSval=3721936640 TSecr=1597676932
1712099436.315551281   552 0.602420474    10.10.1.2 → 10.10.1.1    TCP 83 42560 → 8081 [PSH, ACK] Seq=1021 Ack=1021 Win=64256 Len=17 TSval=1597676933 TSecr=3721936640
1712099438.315551281   554 0.602503111    10.10.1.1 → 10.10.1.2    TCP 83 8081 → 42560 [PSH, ACK] Seq=1021 Ack=1038 Win=65152 Len=17 TSval=3721936642 TSecr=1597676933
1712099446.315551281   562 0.603721445    10.10.1.2 → 10.10.1.1    TCP 83 42560 → 8081 [PSH, ACK] Seq=1038 Ack=1038 Win=64256 Len=17 TSval=1597676935 TSecr=3721936642
1712099448.315551281   564 0.603852842    10.10.1.1 → 10.10.1.2    TCP 83 8081 → 42560 [PSH, ACK] Seq=1038 Ack=1055 Win=65152 Len=17 TSval=3721936643 TSecr=1597676935
1712099455.315551281   571 0.605070750    10.10.1.2 → 10.10.1.1    TCP 83 42560 → 8081 [PSH, ACK] Seq=1055 Ack=1055 Win=64256 Len=17 TSval=1597676936 TSecr=3721936643
1712099457.315551281   573 0.605201065    10.10.1.1 → 10.10.1.2    TCP 83 8081 → 42560 [PSH, ACK] Seq=1055 Ack=1072 Win=65152 Len=17 TSval=3721936644 TSecr=1597676936
1712099463.315551281   579 0.606419174    10.10.1.2 → 10.10.1.1    TCP 83 42560 → 8081 [PSH, ACK] Seq=1072 Ack=1072 Win=64256 Len=17 TSval=1597676937 TSecr=3721936644
1712099465.315551281   581 0.606502645    10.10.1.1 → 10.10.1.2    TCP 83 8081 → 42560 [PSH, ACK] Seq=1072 Ack=1089 Win=65152 Len=17 TSval=3721936646 TSecr=1597676937
1712099472.315551281   588 0.607714716    10.10.1.2 → 10.10.1.1    TCP 83 42560 → 8081 [PSH, ACK] Seq=1089 Ack=1089 Win=64256 Len=17 TSval=1597676939 TSecr=3721936646
1712099474.315551281   590 0.607847317    10.10.1.1 → 10.10.1.2    TCP 83 8081 → 42560 [PSH, ACK] Seq=1089 Ack=1106 Win=65152 Len=17 TSval=3721936647 TSecr=1597676939
1712099480.315551281   596 0.609060872    10.10.1.2 → 10.10.1.1    TCP 83 42560 → 8081 [PSH, ACK] Seq=1106 Ack=1106 Win=64256 Len=17 TSval=1597676940 TSecr=3721936647
1712099482.315551281   598 0.609192616    10.10.1.1 → 10.10.1.2    TCP 83 8081 → 42560 [PSH, ACK] Seq=1106 Ack=1123 Win=65152 Len=17 TSval=3721936648 TSecr=1597676940
1712099489.315551281   605 0.610415712    10.10.1.2 → 10.10.1.1    TCP 83 42560 → 8081 [PSH, ACK] Seq=1123 Ack=1123 Win=64256 Len=17 TSval=1597676941 TSecr=3721936648
1712099491.315551281   607 0.610499599    10.10.1.1 → 10.10.1.2    TCP 83 8081 → 42560 [PSH, ACK] Seq=1123 Ack=1140 Win=65152 Len=17 TSval=3721936650 TSecr=1597676941
1712099497.315551281   613 0.611711383    10.10.1.2 → 10.10.1.1    TCP 83 42560 → 8081 [PSH, ACK] Seq=1140 Ack=1140 Win=64256 Len=17 TSval=1597676943 TSecr=3721936650
1712099499.315551281   615 0.611833901    10.10.1.1 → 10.10.1.2    TCP 83 8081 → 42560 [PSH, ACK] Seq=1140 Ack=1157 Win=65152 Len=17 TSval=3721936651 TSecr=1597676943
1712099506.315551281   622 0.613049757    10.10.1.2 → 10.10.1.1    TCP 83 42560 → 8081 [PSH, ACK] Seq=1157 Ack=1157 Win=64256 Len=17 TSval=1597676944 TSecr=3721936651
1712099508.315551281   624 0.613181615    10.10.1.1 → 10.10.1.2    TCP 83 8081 → 42560 [PSH, ACK] Seq=1157 Ack=1174 Win=65152 Len=17 TSval=3721936652 TSecr=1597676944
1712099514.315551281   630 0.614396836    10.10.1.2 → 10.10.1.1    TCP 83 42560 → 8081 [PSH, ACK] Seq=1174 Ack=1174 Win=64256 Len=17 TSval=1597676945 TSecr=3721936652
1712099516.315551281   632 0.614480241    10.10.1.1 → 10.10.1.2    TCP 83 8081 → 42560 [PSH, ACK] Seq=1174 Ack=1191 Win=65152 Len=17 TSval=3721936654 TSecr=1597676945
1712099524.315551281   640 0.615697609    10.10.1.2 → 10.10.1.1    TCP 83 42560 → 8081 [PSH, ACK] Seq=1191 Ack=1191 Win=64256 Len=17 TSval=1597676947 TSecr=3721936654
1712099526.315551281   642 0.615820203    10.10.1.1 → 10.10.1.2    TCP 83 8081 → 42560 [PSH, ACK] Seq=1191 Ack=1208 Win=65152 Len=17 TSval=3721936655 TSecr=1597676947
1712099532.315551281   648 0.617032465    10.10.1.2 → 10.10.1.1    TCP 83 42560 → 8081 [PSH, ACK] Seq=1208 Ack=1208 Win=64256 Len=17 TSval=1597676948 TSecr=3721936655
1712099534.315551281   650 0.617163389    10.10.1.1 → 10.10.1.2    TCP 83 8081 → 42560 [PSH, ACK] Seq=1208 Ack=1225 Win=65152 Len=17 TSval=3721936656 TSecr=1597676948
1712099541.315551281   657 0.618385099    10.10.1.2 → 10.10.1.1    TCP 83 42560 → 8081 [PSH, ACK] Seq=1225 Ack=1225 Win=64256 Len=17 TSval=1597676949 TSecr=3721936656
1712099543.315551281   659 0.618472705    10.10.1.1 → 10.10.1.2    TCP 83 8081 → 42560 [PSH, ACK] Seq=1225 Ack=1242 Win=65152 Len=17 TSval=3721936658 TSecr=1597676949
1712099549.315551281   665 0.619684401    10.10.1.2 → 10.10.1.1    TCP 83 42560 → 8081 [PSH, ACK] Seq=1242 Ack=1242 Win=64256 Len=17 TSval=1597676951 TSecr=3721936658
1712099551.315551281   667 0.619816595    10.10.1.1 → 10.10.1.2    TCP 83 8081 → 42560 [PSH, ACK] Seq=1242 Ack=1259 Win=65152 Len=17 TSval=3721936659 TSecr=1597676951
1712099558.315551281   674 0.621034559    10.10.1.2 → 10.10.1.1    TCP 83 42560 → 8081 [PSH, ACK] Seq=1259 Ack=1259 Win=64256 Len=17 TSval=1597676952 TSecr=3721936659
1712099560.315551281   676 0.621158270    10.10.1.1 → 10.10.1.2    TCP 83 8081 → 42560 [PSH, ACK] Seq=1259 Ack=1276 Win=65152 Len=17 TSval=3721936660 TSecr=1597676952
1712099566.315551281   682 0.622389332    10.10.1.2 → 10.10.1.1    TCP 83 42560 → 8081 [PSH, ACK] Seq=1276 Ack=1276 Win=64256 Len=17 TSval=1597676953 TSecr=3721936660
1712099569.315551281   685 0.622479749    10.10.1.1 → 10.10.1.2    TCP 83 8081 → 42560 [PSH, ACK] Seq=1276 Ack=1293 Win=65152 Len=17 TSval=3721936662 TSecr=1597676953
1712099575.315551281   691 0.623694121    10.10.1.2 → 10.10.1.1    TCP 83 42560 → 8081 [PSH, ACK] Seq=1293 Ack=1293 Win=64256 Len=17 TSval=1597676955 TSecr=3721936662
1712099577.315551281   693 0.623825843    10.10.1.1 → 10.10.1.2    TCP 83 8081 → 42560 [PSH, ACK] Seq=1293 Ack=1310 Win=65152 Len=17 TSval=3721936663 TSecr=1597676955
1712099583.315551281   699 0.625038494    10.10.1.2 → 10.10.1.1    TCP 83 42560 → 8081 [PSH, ACK] Seq=1310 Ack=1310 Win=64256 Len=17 TSval=1597676956 TSecr=3721936663
1712099585.315551281   701 0.625171195    10.10.1.1 → 10.10.1.2    TCP 83 8081 → 42560 [PSH, ACK] Seq=1310 Ack=1327 Win=65152 Len=17 TSval=3721936664 TSecr=1597676956
1712099592.315551281   708 0.626393404    10.10.1.2 → 10.10.1.1    TCP 83 42560 → 8081 [PSH, ACK] Seq=1327 Ack=1327 Win=64256 Len=17 TSval=1597676957 TSecr=3721936664
1712099594.315551281   710 0.626475422    10.10.1.1 → 10.10.1.2    TCP 83 8081 → 42560 [PSH, ACK] Seq=1327 Ack=1344 Win=65152 Len=17 TSval=3721936666 TSecr=1597676957
1712099600.315551281   716 0.627687465    10.10.1.2 → 10.10.1.1    TCP 83 42560 → 8081 [PSH, ACK] Seq=1344 Ack=1344 Win=64256 Len=17 TSval=1597676959 TSecr=3721936666
1712099602.315551281   718 0.627820800    10.10.1.1 → 10.10.1.2    TCP 83 8081 → 42560 [PSH, ACK] Seq=1344 Ack=1361 Win=65152 Len=17 TSval=3721936667 TSecr=1597676959
1712099609.315551281   725 0.629038879    10.10.1.2 → 10.10.1.1    TCP 83 42560 → 8081 [PSH, ACK] Seq=1361 Ack=1361 Win=64256 Len=17 TSval=1597676960 TSecr=3721936667
1712099611.315551281   727 0.629169064    10.10.1.1 → 10.10.1.2    TCP 83 8081 → 42560 [PSH, ACK] Seq=1361 Ack=1378 Win=65152 Len=17 TSval=3721936668 TSecr=1597676960
1712099617.315551281   733 0.630388480    10.10.1.2 → 10.10.1.1    TCP 83 42560 → 8081 [PSH, ACK] Seq=1378 Ack=1378 Win=64256 Len=17 TSval=1597676961 TSecr=3721936668
1712099619.315551281   735 0.630467121    10.10.1.1 → 10.10.1.2    TCP 83 8081 → 42560 [PSH, ACK] Seq=1378 Ack=1395 Win=65152 Len=17 TSval=3721936670 TSecr=1597676961
1712099626.315551281   742 0.631683879    10.10.1.2 → 10.10.1.1    TCP 83 42560 → 8081 [PSH, ACK] Seq=1395 Ack=1395 Win=64256 Len=17 TSval=1597676963 TSecr=3721936670
1712099628.315551281   744 0.631806231    10.10.1.1 → 10.10.1.2    TCP 83 8081 → 42560 [PSH, ACK] Seq=1395 Ack=1412 Win=65152 Len=17 TSval=3721936671 TSecr=1597676963
1712099634.315551281   750 0.633018623    10.10.1.2 → 10.10.1.1    TCP 83 42560 → 8081 [PSH, ACK] Seq=1412 Ack=1412 Win=64256 Len=17 TSval=1597676964 TSecr=3721936671
1712099636.315551281   752 0.633149818    10.10.1.1 → 10.10.1.2    TCP 83 8081 → 42560 [PSH, ACK] Seq=1412 Ack=1429 Win=65152 Len=17 TSval=3721936672 TSecr=1597676964
1712099643.315551281   759 0.634394426    10.10.1.2 → 10.10.1.1    TCP 83 42560 → 8081 [PSH, ACK] Seq=1429 Ack=1429 Win=64256 Len=17 TSval=1597676965 TSecr=3721936672
1712099645.315551281   761 0.634478003    10.10.1.1 → 10.10.1.2    TCP 83 8081 → 42560 [PSH, ACK] Seq=1429 Ack=1446 Win=65152 Len=17 TSval=3721936674 TSecr=1597676965
1712099651.315551281   767 0.635690419    10.10.1.2 → 10.10.1.1    TCP 83 42560 → 8081 [PSH, ACK] Seq=1446 Ack=1446 Win=64256 Len=17 TSval=1597676967 TSecr=3721936674
1712099653.315551281   769 0.635822601    10.10.1.1 → 10.10.1.2    TCP 83 8081 → 42560 [PSH, ACK] Seq=1446 Ack=1463 Win=65152 Len=17 TSval=3721936675 TSecr=1597676967
1712099660.315551281   776 0.637040676    10.10.1.2 → 10.10.1.1    TCP 83 42560 → 8081 [PSH, ACK] Seq=1463 Ack=1463 Win=64256 Len=17 TSval=1597676968 TSecr=3721936675
1712099662.315551281   778 0.637088676    10.10.1.1 → 10.10.1.2    TCP 83 8081 → 42560 [PSH, ACK] Seq=1463 Ack=1480 Win=65152 Len=17 TSval=3721936676 TSecr=1597676968
1712099668.315551281   784 0.638300427    10.10.1.2 → 10.10.1.1    TCP 83 42560 → 8081 [PSH, ACK] Seq=1480 Ack=1480 Win=64256 Len=17 TSval=1597676969 TSecr=3721936676
1712099670.315551281   786 0.638361845    10.10.1.1 → 10.10.1.2    TCP 83 8081 → 42560 [PSH, ACK] Seq=1480 Ack=1497 Win=65152 Len=17 TSval=3721936678 TSecr=1597676969
1712099676.315551281   792 0.639570915    10.10.1.2 → 10.10.1.1    TCP 83 42560 → 8081 [PSH, ACK] Seq=1497 Ack=1497 Win=64256 Len=17 TSval=1597676970 TSecr=3721936678
1712099678.315551281   794 0.639707801    10.10.1.1 → 10.10.1.2    TCP 83 8081 → 42560 [PSH, ACK] Seq=1497 Ack=1514 Win=65152 Len=17 TSval=3721936679 TSecr=1597676970
1712099685.315551281   801 0.640928515    10.10.1.2 → 10.10.1.1    TCP 83 42560 → 8081 [PSH, ACK] Seq=1514 Ack=1514 Win=64256 Len=17 TSval=1597676972 TSecr=3721936679
1712099687.315551281   803 0.641055810    10.10.1.1 → 10.10.1.2    TCP 83 8081 → 42560 [PSH, ACK] Seq=1514 Ack=1531 Win=65152 Len=17 TSval=3721936680 TSecr=1597676972
1712099693.315551281   809 0.642271776    10.10.1.2 → 10.10.1.1    TCP 83 42560 → 8081 [PSH, ACK] Seq=1531 Ack=1531 Win=64256 Len=17 TSval=1597676973 TSecr=3721936680
1712099695.315551281   811 0.642400378    10.10.1.1 → 10.10.1.2    TCP 83 8081 → 42560 [PSH, ACK] Seq=1531 Ack=1548 Win=65152 Len=17 TSval=3721936682 TSecr=1597676973
1712099702.315551281   818 0.643612853    10.10.1.2 → 10.10.1.1    TCP 83 42560 → 8081 [PSH, ACK] Seq=1548 Ack=1548 Win=64256 Len=17 TSval=1597676974 TSecr=3721936682
1712099704.315551281   820 0.643749415    10.10.1.1 → 10.10.1.2    TCP 83 8081 → 42560 [PSH, ACK] Seq=1548 Ack=1565 Win=65152 Len=17 TSval=3721936683 TSecr=1597676974
1712099710.315551281   826 0.644962503    10.10.1.2 → 10.10.1.1    TCP 83 42560 → 8081 [PSH, ACK] Seq=1565 Ack=1565 Win=64256 Len=17 TSval=1597676976 TSecr=3721936683
1712099712.315551281   828 0.645095460    10.10.1.1 → 10.10.1.2    TCP 83 8081 → 42560 [PSH, ACK] Seq=1565 Ack=1582 Win=65152 Len=17 TSval=3721936684 TSecr=1597676976
1712099719.315551281   835 0.646314650    10.10.1.2 → 10.10.1.1    TCP 83 42560 → 8081 [PSH, ACK] Seq=1582 Ack=1582 Win=64256 Len=17 TSval=1597676977 TSecr=3721936684
1712099721.315551281   837 0.646432522    10.10.1.1 → 10.10.1.2    TCP 83 8081 → 42560 [PSH, ACK] Seq=1582 Ack=1599 Win=65152 Len=17 TSval=3721936686 TSecr=1597676977
1712099727.315551281   843 0.647643668    10.10.1.2 → 10.10.1.1    TCP 83 42560 → 8081 [PSH, ACK] Seq=1599 Ack=1599 Win=64256 Len=17 TSval=1597676978 TSecr=3721936686
1712099729.315551281   845 0.647776790    10.10.1.1 → 10.10.1.2    TCP 83 8081 → 42560 [PSH, ACK] Seq=1599 Ack=1616 Win=65152 Len=17 TSval=3721936687 TSecr=1597676978
1712099736.315551281   852 0.648994934    10.10.1.2 → 10.10.1.1    TCP 83 42560 → 8081 [PSH, ACK] Seq=1616 Ack=1616 Win=64256 Len=17 TSval=1597676980 TSecr=3721936687
1712099738.315551281   854 0.649126294    10.10.1.1 → 10.10.1.2    TCP 83 8081 → 42560 [PSH, ACK] Seq=1616 Ack=1633 Win=65152 Len=17 TSval=3721936688 TSecr=1597676980
1712099744.315551281   860 0.650343308    10.10.1.2 → 10.10.1.1    TCP 83 42560 → 8081 [PSH, ACK] Seq=1633 Ack=1633 Win=64256 Len=17 TSval=1597676981 TSecr=3721936688
1712099746.315551281   862 0.650444209    10.10.1.1 → 10.10.1.2    TCP 83 8081 → 42560 [PSH, ACK] Seq=1633 Ack=1650 Win=65152 Len=17 TSval=3721936690 TSecr=1597676981
1712099753.315551281   869 0.651656082    10.10.1.2 → 10.10.1.1    TCP 83 42560 → 8081 [PSH, ACK] Seq=1650 Ack=1650 Win=64256 Len=17 TSval=1597676982 TSecr=3721936690
1712099755.315551281   871 0.651782884    10.10.1.1 → 10.10.1.2    TCP 83 8081 → 42560 [PSH, ACK] Seq=1650 Ack=1667 Win=65152 Len=17 TSval=3721936691 TSecr=1597676982
1712099761.315551281   877 0.652994843    10.10.1.2 → 10.10.1.1    TCP 83 42560 → 8081 [PSH, ACK] Seq=1667 Ack=1667 Win=64256 Len=17 TSval=1597676984 TSecr=3721936691
1712099763.315551281   879 0.653121233    10.10.1.1 → 10.10.1.2    TCP 83 8081 → 42560 [PSH, ACK] Seq=1667 Ack=1684 Win=65152 Len=17 TSval=3721936692 TSecr=1597676984
1712099771.315551281   887 0.654343225    10.10.1.2 → 10.10.1.1    TCP 83 42560 → 8081 [PSH, ACK] Seq=1684 Ack=1684 Win=64256 Len=17 TSval=1597676985 TSecr=3721936692
1712099774.315551281   890 0.654473451    10.10.1.1 → 10.10.1.2    TCP 83 8081 → 42560 [PSH, ACK] Seq=1684 Ack=1701 Win=65152 Len=17 TSval=3721936694 TSecr=1597676985
1712099780.315551281   896 0.655684897    10.10.1.2 → 10.10.1.1    TCP 83 42560 → 8081 [PSH, ACK] Seq=1701 Ack=1701 Win=64256 Len=17 TSval=1597676987 TSecr=3721936694
1712099782.315551281   898 0.655811415    10.10.1.1 → 10.10.1.2    TCP 83 8081 → 42560 [PSH, ACK] Seq=1701 Ack=1718 Win=65152 Len=17 TSval=3721936695 TSecr=1597676987
1712099788.315551281   904 0.657023205    10.10.1.2 → 10.10.1.1    TCP 83 42560 → 8081 [PSH, ACK] Seq=1718 Ack=1718 Win=64256 Len=17 TSval=1597676988 TSecr=3721936695
1712099790.315551281   906 0.657154009    10.10.1.1 → 10.10.1.2    TCP 83 8081 → 42560 [PSH, ACK] Seq=1718 Ack=1735 Win=65152 Len=17 TSval=3721936696 TSecr=1597676988
1712099797.315551281   913 0.658390206    10.10.1.2 → 10.10.1.1    TCP 83 42560 → 8081 [PSH, ACK] Seq=1735 Ack=1735 Win=64256 Len=17 TSval=1597676989 TSecr=3721936696
1712099799.315551281   915 0.658476087    10.10.1.1 → 10.10.1.2    TCP 83 8081 → 42560 [PSH, ACK] Seq=1735 Ack=1752 Win=65152 Len=17 TSval=3721936698 TSecr=1597676989
1712099805.315551281   921 0.659687533    10.10.1.2 → 10.10.1.1    TCP 83 42560 → 8081 [PSH, ACK] Seq=1752 Ack=1752 Win=64256 Len=17 TSval=1597676991 TSecr=3721936698
1712099807.315551281   923 0.659823583    10.10.1.1 → 10.10.1.2    TCP 83 8081 → 42560 [PSH, ACK] Seq=1752 Ack=1769 Win=65152 Len=17 TSval=3721936699 TSecr=1597676991
1712099814.315551281   930 0.661043521    10.10.1.2 → 10.10.1.1    TCP 83 42560 → 8081 [PSH, ACK] Seq=1769 Ack=1769 Win=64256 Len=17 TSval=1597676992 TSecr=3721936699
1712099816.315551281   932 0.661165496    10.10.1.1 → 10.10.1.2    TCP 83 8081 → 42560 [PSH, ACK] Seq=1769 Ack=1786 Win=65152 Len=17 TSval=3721936700 TSecr=1597676992
1712099822.315551281   938 0.662392778    10.10.1.2 → 10.10.1.1    TCP 83 42560 → 8081 [PSH, ACK] Seq=1786 Ack=1786 Win=64256 Len=17 TSval=1597676993 TSecr=3721936700
1712099824.315551281   940 0.662479514    10.10.1.1 → 10.10.1.2    TCP 83 8081 → 42560 [PSH, ACK] Seq=1786 Ack=1803 Win=65152 Len=17 TSval=3721936702 TSecr=1597676993
1712099831.315551281   947 0.663691075    10.10.1.2 → 10.10.1.1    TCP 83 42560 → 8081 [PSH, ACK] Seq=1803 Ack=1803 Win=64256 Len=17 TSval=1597676995 TSecr=3721936702
1712099833.315551281   949 0.663816766    10.10.1.1 → 10.10.1.2    TCP 83 8081 → 42560 [PSH, ACK] Seq=1803 Ack=1820 Win=65152 Len=17 TSval=3721936703 TSecr=1597676995
1712099839.315551281   955 0.665028579    10.10.1.2 → 10.10.1.1    TCP 83 42560 → 8081 [PSH, ACK] Seq=1820 Ack=1820 Win=64256 Len=17 TSval=1597676996 TSecr=3721936703
1712099841.315551281   957 0.665163012    10.10.1.1 → 10.10.1.2    TCP 83 8081 → 42560 [PSH, ACK] Seq=1820 Ack=1837 Win=65152 Len=17 TSval=3721936704 TSecr=1597676996
1712099848.315551281   964 0.666384334    10.10.1.2 → 10.10.1.1    TCP 83 42560 → 8081 [PSH, ACK] Seq=1837 Ack=1837 Win=64256 Len=17 TSval=1597676997 TSecr=3721936704
1712099850.315551281   966 0.666515754    10.10.1.1 → 10.10.1.2    TCP 83 8081 → 42560 [PSH, ACK] Seq=1837 Ack=1854 Win=65152 Len=17 TSval=3721936706 TSecr=1597676997
1712099856.315551281   972 0.667728499    10.10.1.2 → 10.10.1.1    TCP 83 42560 → 8081 [PSH, ACK] Seq=1854 Ack=1854 Win=64256 Len=17 TSval=1597676999 TSecr=3721936706
1712099859.315551281   975 0.667851204    10.10.1.1 → 10.10.1.2    TCP 83 8081 → 42560 [PSH, ACK] Seq=1854 Ack=1871 Win=65152 Len=17 TSval=3721936707 TSecr=1597676999
1712099865.315551281   981 0.669063828    10.10.1.2 → 10.10.1.1    TCP 83 42560 → 8081 [PSH, ACK] Seq=1871 Ack=1871 Win=64256 Len=17 TSval=1597677000 TSecr=3721936707
1712099867.315551281   983 0.669186340    10.10.1.1 → 10.10.1.2    TCP 83 8081 → 42560 [PSH, ACK] Seq=1871 Ack=1888 Win=65152 Len=17 TSval=3721936708 TSecr=1597677000
1712099873.315551281   989 0.670415508    10.10.1.2 → 10.10.1.1    TCP 83 42560 → 8081 [PSH, ACK] Seq=1888 Ack=1888 Win=64256 Len=17 TSval=1597677001 TSecr=3721936708
1712099876.315551281   992 0.670500133    10.10.1.1 → 10.10.1.2    TCP 83 8081 → 42560 [PSH, ACK] Seq=1888 Ack=1905 Win=65152 Len=17 TSval=3721936710 TSecr=1597677001
1712099882.315551281   998 0.671711797    10.10.1.2 → 10.10.1.1    TCP 83 42560 → 8081 [PSH, ACK] Seq=1905 Ack=1905 Win=64256 Len=17 TSval=1597677003 TSecr=3721936710
1712099884.315551281  1000 0.671837581    10.10.1.1 → 10.10.1.2    TCP 83 8081 → 42560 [PSH, ACK] Seq=1905 Ack=1922 Win=65152 Len=17 TSval=3721936711 TSecr=1597677003
1712099890.315551281  1006 0.673049371    10.10.1.2 → 10.10.1.1    TCP 83 42560 → 8081 [PSH, ACK] Seq=1922 Ack=1922 Win=64256 Len=17 TSval=1597677004 TSecr=3721936711
1712099893.315551281  1009 0.673227624    10.10.1.1 → 10.10.1.2    TCP 83 8081 → 42560 [PSH, ACK] Seq=1922 Ack=1939 Win=65152 Len=17 TSval=3721936712 TSecr=1597677004
1712099899.315551281  1015 0.674443613    10.10.1.2 → 10.10.1.1    TCP 83 42560 → 8081 [PSH, ACK] Seq=1939 Ack=1939 Win=64256 Len=17 TSval=1597677005 TSecr=3721936712
1712099901.315551281  1017 0.674574242    10.10.1.1 → 10.10.1.2    TCP 83 8081 → 42560 [PSH, ACK] Seq=1939 Ack=1956 Win=65152 Len=17 TSval=3721936714 TSecr=1597677005
1712099907.315551281  1023 0.675786391    10.10.1.2 → 10.10.1.1    TCP 83 42560 → 8081 [PSH, ACK] Seq=1956 Ack=1956 Win=64256 Len=17 TSval=1597677007 TSecr=3721936714
1712099909.315551281  1025 0.675917970    10.10.1.1 → 10.10.1.2    TCP 83 8081 → 42560 [PSH, ACK] Seq=1956 Ack=1973 Win=65152 Len=17 TSval=3721936715 TSecr=1597677007
1712099916.315551281  1032 0.677137413    10.10.1.2 → 10.10.1.1    TCP 83 42560 → 8081 [PSH, ACK] Seq=1973 Ack=1973 Win=64256 Len=17 TSval=1597677008 TSecr=3721936715
1712099918.315551281  1034 0.677268695    10.10.1.1 → 10.10.1.2    TCP 83 8081 → 42560 [PSH, ACK] Seq=1973 Ack=1990 Win=65152 Len=17 TSval=3721936716 TSecr=1597677008
1712099924.315551281  1040 0.678484401    10.10.1.2 → 10.10.1.1    TCP 83 42560 → 8081 [PSH, ACK] Seq=1990 Ack=1990 Win=64256 Len=17 TSval=1597677009 TSecr=3721936716
1712099926.315551281  1042 0.678568272    10.10.1.1 → 10.10.1.2    TCP 83 8081 → 42560 [PSH, ACK] Seq=1990 Ack=2007 Win=65152 Len=17 TSval=3721936718 TSecr=1597677009
1712099934.315551281  1050 0.679786439    10.10.1.2 → 10.10.1.1    TCP 83 42560 → 8081 [PSH, ACK] Seq=2007 Ack=2007 Win=64256 Len=17 TSval=1597677011 TSecr=3721936718
1712099936.315551281  1052 0.679914104    10.10.1.1 → 10.10.1.2    TCP 83 8081 → 42560 [PSH, ACK] Seq=2007 Ack=2024 Win=65152 Len=17 TSval=3721936719 TSecr=1597677011
1712099943.315551281  1059 0.681131461    10.10.1.2 → 10.10.1.1    TCP 83 42560 → 8081 [PSH, ACK] Seq=2024 Ack=2024 Win=64256 Len=17 TSval=1597677012 TSecr=3721936719
1712099945.315551281  1061 0.681265359    10.10.1.1 → 10.10.1.2    TCP 83 8081 → 42560 [PSH, ACK] Seq=2024 Ack=2041 Win=65152 Len=17 TSval=3721936720 TSecr=1597677012
1712099951.315551281  1067 0.682480206    10.10.1.2 → 10.10.1.1    TCP 83 42560 → 8081 [PSH, ACK] Seq=2041 Ack=2041 Win=64256 Len=17 TSval=1597677013 TSecr=3721936720
