1712183009.811181068    31 0.973040595    10.10.1.2 → 10.10.1.1    TCP 83 54952 → 8081 [PSH, ACK] Seq=1 Ack=1 Win=64256 Len=17 TSval=1681773020 TSecr=3806032478
1712183011.811181068    33 0.973362142    10.10.1.1 → 10.10.1.2    TCP 83 8081 → 54952 [PSH, ACK] Seq=1 Ack=18 Win=65152 Len=17 TSval=3806032729 TSecr=1681773020
1712183017.811181068    39 0.974579003    10.10.1.2 → 10.10.1.1    TCP 83 54952 → 8081 [PSH, ACK] Seq=18 Ack=18 Win=64256 Len=17 TSval=1681773021 TSecr=3806032729
1712183020.811181068    42 0.974701839    10.10.1.1 → 10.10.1.2    TCP 83 8081 → 54952 [PSH, ACK] Seq=18 Ack=35 Win=65152 Len=17 TSval=3806032731 TSecr=1681773021
1712183025.811181068    47 0.975911735    10.10.1.2 → 10.10.1.1    TCP 83 54952 → 8081 [PSH, ACK] Seq=35 Ack=35 Win=64256 Len=17 TSval=1681773023 TSecr=3806032731
1712183028.811181068    50 0.976037940    10.10.1.1 → 10.10.1.2    TCP 83 8081 → 54952 [PSH, ACK] Seq=35 Ack=52 Win=65152 Len=17 TSval=3806032732 TSecr=1681773023
1712183033.811181068    55 0.977244152    10.10.1.2 → 10.10.1.1    TCP 83 54952 → 8081 [PSH, ACK] Seq=52 Ack=52 Win=64256 Len=17 TSval=1681773024 TSecr=3806032732
1712183036.811181068    58 0.977370410    10.10.1.1 → 10.10.1.2    TCP 83 8081 → 54952 [PSH, ACK] Seq=52 Ack=69 Win=65152 Len=17 TSval=3806032733 TSecr=1681773024
1712183041.811181068    63 0.978578333    10.10.1.2 → 10.10.1.1    TCP 83 54952 → 8081 [PSH, ACK] Seq=69 Ack=69 Win=64256 Len=17 TSval=1681773025 TSecr=3806032733
1712183044.811181068    66 0.978707495    10.10.1.1 → 10.10.1.2    TCP 83 8081 → 54952 [PSH, ACK] Seq=69 Ack=86 Win=65152 Len=17 TSval=3806032735 TSecr=1681773025
1712183049.811181068    71 0.979912071    10.10.1.2 → 10.10.1.1    TCP 83 54952 → 8081 [PSH, ACK] Seq=86 Ack=86 Win=64256 Len=17 TSval=1681773027 TSecr=3806032735
1712183052.811181068    74 0.980038761    10.10.1.1 → 10.10.1.2    TCP 83 8081 → 54952 [PSH, ACK] Seq=86 Ack=103 Win=65152 Len=17 TSval=3806032736 TSecr=1681773027
1712183057.811181068    79 0.981243604    10.10.1.2 → 10.10.1.1    TCP 83 54952 → 8081 [PSH, ACK] Seq=103 Ack=103 Win=64256 Len=17 TSval=1681773028 TSecr=3806032736
1712183059.811181068    81 0.981369477    10.10.1.1 → 10.10.1.2    TCP 83 8081 → 54952 [PSH, ACK] Seq=103 Ack=120 Win=65152 Len=17 TSval=3806032737 TSecr=1681773028
1712183065.811181068    87 0.982576558    10.10.1.2 → 10.10.1.1    TCP 83 54952 → 8081 [PSH, ACK] Seq=120 Ack=120 Win=64256 Len=17 TSval=1681773029 TSecr=3806032737
1712183067.811181068    89 0.982708074    10.10.1.1 → 10.10.1.2    TCP 83 8081 → 54952 [PSH, ACK] Seq=120 Ack=137 Win=65152 Len=17 TSval=3806032739 TSecr=1681773029
1712183073.811181068    95 0.983912599    10.10.1.2 → 10.10.1.1    TCP 83 54952 → 8081 [PSH, ACK] Seq=137 Ack=137 Win=64256 Len=17 TSval=1681773031 TSecr=3806032739
1712183075.811181068    97 0.984046888    10.10.1.1 → 10.10.1.2    TCP 83 8081 → 54952 [PSH, ACK] Seq=137 Ack=154 Win=65152 Len=17 TSval=3806032740 TSecr=1681773031
1712183081.811181068   103 0.985250807    10.10.1.2 → 10.10.1.1    TCP 83 54952 → 8081 [PSH, ACK] Seq=154 Ack=154 Win=64256 Len=17 TSval=1681773032 TSecr=3806032740
1712183083.811181068   105 0.985381639    10.10.1.1 → 10.10.1.2    TCP 83 8081 → 54952 [PSH, ACK] Seq=154 Ack=171 Win=65152 Len=17 TSval=3806032741 TSecr=1681773032
1712183089.811181068   111 0.986590353    10.10.1.2 → 10.10.1.1    TCP 83 54952 → 8081 [PSH, ACK] Seq=171 Ack=171 Win=64256 Len=17 TSval=1681773033 TSecr=3806032741
1712183091.811181068   113 0.986715331    10.10.1.1 → 10.10.1.2    TCP 83 8081 → 54952 [PSH, ACK] Seq=171 Ack=188 Win=65152 Len=17 TSval=3806032743 TSecr=1681773033
1712183097.811181068   119 0.987919637    10.10.1.2 → 10.10.1.1    TCP 83 54952 → 8081 [PSH, ACK] Seq=188 Ack=188 Win=64256 Len=17 TSval=1681773035 TSecr=3806032743
1712183099.811181068   121 0.988041435    10.10.1.1 → 10.10.1.2    TCP 83 8081 → 54952 [PSH, ACK] Seq=188 Ack=205 Win=65152 Len=17 TSval=3806032744 TSecr=1681773035
1712183105.811181068   127 0.989248584    10.10.1.2 → 10.10.1.1    TCP 83 54952 → 8081 [PSH, ACK] Seq=205 Ack=205 Win=64256 Len=17 TSval=1681773036 TSecr=3806032744
1712183107.811181068   129 0.989378395    10.10.1.1 → 10.10.1.2    TCP 83 8081 → 54952 [PSH, ACK] Seq=205 Ack=222 Win=65152 Len=17 TSval=3806032745 TSecr=1681773036
1712183113.811181068   135 0.990586291    10.10.1.2 → 10.10.1.1    TCP 83 54952 → 8081 [PSH, ACK] Seq=222 Ack=222 Win=64256 Len=17 TSval=1681773037 TSecr=3806032745
1712183115.811181068   137 0.990710878    10.10.1.1 → 10.10.1.2    TCP 83 8081 → 54952 [PSH, ACK] Seq=222 Ack=239 Win=65152 Len=17 TSval=3806032747 TSecr=1681773037
1712183121.811181068   143 0.991916089    10.10.1.2 → 10.10.1.1    TCP 83 54952 → 8081 [PSH, ACK] Seq=239 Ack=239 Win=64256 Len=17 TSval=1681773039 TSecr=3806032747
1712183123.811181068   145 0.992037965    10.10.1.1 → 10.10.1.2    TCP 83 8081 → 54952 [PSH, ACK] Seq=239 Ack=256 Win=65152 Len=17 TSval=3806032748 TSecr=1681773039
1712183129.811181068   151 0.993243026    10.10.1.2 → 10.10.1.1    TCP 83 54952 → 8081 [PSH, ACK] Seq=256 Ack=256 Win=64256 Len=17 TSval=1681773040 TSecr=3806032748
1712183131.811181068   153 0.993374468    10.10.1.1 → 10.10.1.2    TCP 83 8081 → 54952 [PSH, ACK] Seq=256 Ack=273 Win=65152 Len=17 TSval=3806032749 TSecr=1681773040
1712183137.811181068   159 0.994581188    10.10.1.2 → 10.10.1.1    TCP 83 54952 → 8081 [PSH, ACK] Seq=273 Ack=273 Win=64256 Len=17 TSval=1681773041 TSecr=3806032749
1712183139.811181068   161 0.994711355    10.10.1.1 → 10.10.1.2    TCP 83 8081 → 54952 [PSH, ACK] Seq=273 Ack=290 Win=65152 Len=17 TSval=3806032751 TSecr=1681773041
1712183145.811181068   167 0.995915940    10.10.1.2 → 10.10.1.1    TCP 83 54952 → 8081 [PSH, ACK] Seq=290 Ack=290 Win=64256 Len=17 TSval=1681773043 TSecr=3806032751
1712183147.811181068   169 0.996037892    10.10.1.1 → 10.10.1.2    TCP 83 8081 → 54952 [PSH, ACK] Seq=290 Ack=307 Win=65152 Len=17 TSval=3806032752 TSecr=1681773043
1712183153.811181068   175 0.997242704    10.10.1.2 → 10.10.1.1    TCP 83 54952 → 8081 [PSH, ACK] Seq=307 Ack=307 Win=64256 Len=17 TSval=1681773044 TSecr=3806032752
1712183155.811181068   177 0.997372189    10.10.1.1 → 10.10.1.2    TCP 83 8081 → 54952 [PSH, ACK] Seq=307 Ack=324 Win=65152 Len=17 TSval=3806032753 TSecr=1681773044
1712183161.811181068   183 0.998579860    10.10.1.2 → 10.10.1.1    TCP 83 54952 → 8081 [PSH, ACK] Seq=324 Ack=324 Win=64256 Len=17 TSval=1681773045 TSecr=3806032753
1712183163.811181068   185 0.998711421    10.10.1.1 → 10.10.1.2    TCP 83 8081 → 54952 [PSH, ACK] Seq=324 Ack=341 Win=65152 Len=17 TSval=3806032755 TSecr=1681773045
1712183169.811181068   191 0.999916486    10.10.1.2 → 10.10.1.1    TCP 83 54952 → 8081 [PSH, ACK] Seq=341 Ack=341 Win=64256 Len=17 TSval=1681773047 TSecr=3806032755
1712183171.811181068   193 1.000038264    10.10.1.1 → 10.10.1.2    TCP 83 8081 → 54952 [PSH, ACK] Seq=341 Ack=358 Win=65152 Len=17 TSval=3806032756 TSecr=1681773047
1712183177.811181068   199 1.001243214    10.10.1.2 → 10.10.1.1    TCP 83 54952 → 8081 [PSH, ACK] Seq=358 Ack=358 Win=64256 Len=17 TSval=1681773048 TSecr=3806032756
1712183179.811181068   201 1.001365211    10.10.1.1 → 10.10.1.2    TCP 83 8081 → 54952 [PSH, ACK] Seq=358 Ack=375 Win=65152 Len=17 TSval=3806032757 TSecr=1681773048
1712183185.811181068   207 1.002572724    10.10.1.2 → 10.10.1.1    TCP 83 54952 → 8081 [PSH, ACK] Seq=375 Ack=375 Win=64256 Len=17 TSval=1681773049 TSecr=3806032757
1712183187.811181068   209 1.002705108    10.10.1.1 → 10.10.1.2    TCP 83 8081 → 54952 [PSH, ACK] Seq=375 Ack=392 Win=65152 Len=17 TSval=3806032759 TSecr=1681773049
1712183193.811181068   215 1.003909959    10.10.1.2 → 10.10.1.1    TCP 83 54952 → 8081 [PSH, ACK] Seq=392 Ack=392 Win=64256 Len=17 TSval=1681773051 TSecr=3806032759
1712183195.811181068   217 1.004031379    10.10.1.1 → 10.10.1.2    TCP 83 8081 → 54952 [PSH, ACK] Seq=392 Ack=409 Win=65152 Len=17 TSval=3806032760 TSecr=1681773051
1712183201.811181068   223 1.005246755    10.10.1.2 → 10.10.1.1    TCP 83 54952 → 8081 [PSH, ACK] Seq=409 Ack=409 Win=64256 Len=17 TSval=1681773052 TSecr=3806032760
1712183203.811181068   225 1.005374294    10.10.1.1 → 10.10.1.2    TCP 83 8081 → 54952 [PSH, ACK] Seq=409 Ack=426 Win=65152 Len=17 TSval=3806032761 TSecr=1681773052
1712183209.811181068   231 1.006581539    10.10.1.2 → 10.10.1.1    TCP 83 54952 → 8081 [PSH, ACK] Seq=426 Ack=426 Win=64256 Len=17 TSval=1681773053 TSecr=3806032761
1712183211.811181068   233 1.006714310    10.10.1.1 → 10.10.1.2    TCP 83 8081 → 54952 [PSH, ACK] Seq=426 Ack=443 Win=65152 Len=17 TSval=3806032763 TSecr=1681773053
1712183217.811181068   239 1.007919206    10.10.1.2 → 10.10.1.1    TCP 83 54952 → 8081 [PSH, ACK] Seq=443 Ack=443 Win=64256 Len=17 TSval=1681773055 TSecr=3806032763
1712183219.811181068   241 1.008041118    10.10.1.1 → 10.10.1.2    TCP 83 8081 → 54952 [PSH, ACK] Seq=443 Ack=460 Win=65152 Len=17 TSval=3806032764 TSecr=1681773055
1712183225.811181068   247 1.009247250    10.10.1.2 → 10.10.1.1    TCP 83 54952 → 8081 [PSH, ACK] Seq=460 Ack=460 Win=64256 Len=17 TSval=1681773056 TSecr=3806032764
1712183227.811181068   249 1.009376839    10.10.1.1 → 10.10.1.2    TCP 83 8081 → 54952 [PSH, ACK] Seq=460 Ack=477 Win=65152 Len=17 TSval=3806032765 TSecr=1681773056
1712183233.811181068   255 1.010584041    10.10.1.2 → 10.10.1.1    TCP 83 54952 → 8081 [PSH, ACK] Seq=477 Ack=477 Win=64256 Len=17 TSval=1681773057 TSecr=3806032765
1712183235.811181068   257 1.010717167    10.10.1.1 → 10.10.1.2    TCP 83 8081 → 54952 [PSH, ACK] Seq=477 Ack=494 Win=65152 Len=17 TSval=3806032767 TSecr=1681773057
1712183241.811181068   263 1.011922062    10.10.1.2 → 10.10.1.1    TCP 83 54952 → 8081 [PSH, ACK] Seq=494 Ack=494 Win=64256 Len=17 TSval=1681773059 TSecr=3806032767
1712183243.811181068   265 1.012052799    10.10.1.1 → 10.10.1.2    TCP 83 8081 → 54952 [PSH, ACK] Seq=494 Ack=511 Win=65152 Len=17 TSval=3806032768 TSecr=1681773059
1712183249.811181068   271 1.013258382    10.10.1.2 → 10.10.1.1    TCP 83 54952 → 8081 [PSH, ACK] Seq=511 Ack=511 Win=64256 Len=17 TSval=1681773060 TSecr=3806032768
1712183251.811181068   273 1.013389457    10.10.1.1 → 10.10.1.2    TCP 83 8081 → 54952 [PSH, ACK] Seq=511 Ack=528 Win=65152 Len=17 TSval=3806032769 TSecr=1681773060
1712183257.811181068   279 1.014597361    10.10.1.2 → 10.10.1.1    TCP 83 54952 → 8081 [PSH, ACK] Seq=528 Ack=528 Win=64256 Len=17 TSval=1681773061 TSecr=3806032769
1712183259.811181068   281 1.014729614    10.10.1.1 → 10.10.1.2    TCP 83 8081 → 54952 [PSH, ACK] Seq=528 Ack=545 Win=65152 Len=17 TSval=3806032771 TSecr=1681773061
1712183265.811181068   287 1.015934690    10.10.1.2 → 10.10.1.1    TCP 83 54952 → 8081 [PSH, ACK] Seq=545 Ack=545 Win=64256 Len=17 TSval=1681773063 TSecr=3806032771
1712183267.811181068   289 1.016056886    10.10.1.1 → 10.10.1.2    TCP 83 8081 → 54952 [PSH, ACK] Seq=545 Ack=562 Win=65152 Len=17 TSval=3806032772 TSecr=1681773063
1712183273.811181068   295 1.017262061    10.10.1.2 → 10.10.1.1    TCP 83 54952 → 8081 [PSH, ACK] Seq=562 Ack=562 Win=64256 Len=17 TSval=1681773064 TSecr=3806032772
1712183275.811181068   297 1.017383248    10.10.1.1 → 10.10.1.2    TCP 83 8081 → 54952 [PSH, ACK] Seq=562 Ack=579 Win=65152 Len=17 TSval=3806032773 TSecr=1681773064
1712183281.811181068   303 1.018590424    10.10.1.2 → 10.10.1.1    TCP 83 54952 → 8081 [PSH, ACK] Seq=579 Ack=579 Win=64256 Len=17 TSval=1681773065 TSecr=3806032773
1712183283.811181068   305 1.018721329    10.10.1.1 → 10.10.1.2    TCP 83 8081 → 54952 [PSH, ACK] Seq=579 Ack=596 Win=65152 Len=17 TSval=3806032775 TSecr=1681773065
1712183289.811181068   311 1.019926331    10.10.1.2 → 10.10.1.1    TCP 83 54952 → 8081 [PSH, ACK] Seq=596 Ack=596 Win=64256 Len=17 TSval=1681773067 TSecr=3806032775
1712183291.811181068   313 1.020048133    10.10.1.1 → 10.10.1.2    TCP 83 8081 → 54952 [PSH, ACK] Seq=596 Ack=613 Win=65152 Len=17 TSval=3806032776 TSecr=1681773067
1712183297.811181068   319 1.021254915    10.10.1.2 → 10.10.1.1    TCP 83 54952 → 8081 [PSH, ACK] Seq=613 Ack=613 Win=64256 Len=17 TSval=1681773068 TSecr=3806032776
1712183299.811181068   321 1.021384461    10.10.1.1 → 10.10.1.2    TCP 83 8081 → 54952 [PSH, ACK] Seq=613 Ack=630 Win=65152 Len=17 TSval=3806032777 TSecr=1681773068
1712183305.811181068   327 1.022592776    10.10.1.2 → 10.10.1.1    TCP 83 54952 → 8081 [PSH, ACK] Seq=630 Ack=630 Win=64256 Len=17 TSval=1681773069 TSecr=3806032777
1712183307.811181068   329 1.022724008    10.10.1.1 → 10.10.1.2    TCP 83 8081 → 54952 [PSH, ACK] Seq=630 Ack=647 Win=65152 Len=17 TSval=3806032779 TSecr=1681773069
1712183313.811181068   335 1.023939841    10.10.1.2 → 10.10.1.1    TCP 83 54952 → 8081 [PSH, ACK] Seq=647 Ack=647 Win=64256 Len=17 TSval=1681773071 TSecr=3806032779
1712183315.811181068   337 1.024065679    10.10.1.1 → 10.10.1.2    TCP 83 8081 → 54952 [PSH, ACK] Seq=647 Ack=664 Win=65152 Len=17 TSval=3806032780 TSecr=1681773071
1712183321.811181068   343 1.025270618    10.10.1.2 → 10.10.1.1    TCP 83 54952 → 8081 [PSH, ACK] Seq=664 Ack=664 Win=64256 Len=17 TSval=1681773072 TSecr=3806032780
1712183323.811181068   345 1.025402212    10.10.1.1 → 10.10.1.2    TCP 83 8081 → 54952 [PSH, ACK] Seq=664 Ack=681 Win=65152 Len=17 TSval=3806032781 TSecr=1681773072
1712183329.811181068   351 1.026609871    10.10.1.2 → 10.10.1.1    TCP 83 54952 → 8081 [PSH, ACK] Seq=681 Ack=681 Win=64256 Len=17 TSval=1681773073 TSecr=3806032781
1712183331.811181068   353 1.026733969    10.10.1.1 → 10.10.1.2    TCP 83 8081 → 54952 [PSH, ACK] Seq=681 Ack=698 Win=65152 Len=17 TSval=3806032783 TSecr=1681773073
1712183337.811181068   359 1.027938711    10.10.1.2 → 10.10.1.1    TCP 83 54952 → 8081 [PSH, ACK] Seq=698 Ack=698 Win=64256 Len=17 TSval=1681773075 TSecr=3806032783
1712183339.811181068   361 1.028061031    10.10.1.1 → 10.10.1.2    TCP 83 8081 → 54952 [PSH, ACK] Seq=698 Ack=715 Win=65152 Len=17 TSval=3806032784 TSecr=1681773075
1712183345.811181068   367 1.029266003    10.10.1.2 → 10.10.1.1    TCP 83 54952 → 8081 [PSH, ACK] Seq=715 Ack=715 Win=64256 Len=17 TSval=1681773076 TSecr=3806032784
1712183347.811181068   369 1.029387568    10.10.1.1 → 10.10.1.2    TCP 83 8081 → 54952 [PSH, ACK] Seq=715 Ack=732 Win=65152 Len=17 TSval=3806032785 TSecr=1681773076
1712183353.811181068   375 1.030595650    10.10.1.2 → 10.10.1.1    TCP 83 54952 → 8081 [PSH, ACK] Seq=732 Ack=732 Win=64256 Len=17 TSval=1681773077 TSecr=3806032785
1712183355.811181068   377 1.030726231    10.10.1.1 → 10.10.1.2    TCP 83 8081 → 54952 [PSH, ACK] Seq=732 Ack=749 Win=65152 Len=17 TSval=3806032787 TSecr=1681773077
1712183361.811181068   383 1.031931224    10.10.1.2 → 10.10.1.1    TCP 83 54952 → 8081 [PSH, ACK] Seq=749 Ack=749 Win=64256 Len=17 TSval=1681773079 TSecr=3806032787
1712183363.811181068   385 1.032052678    10.10.1.1 → 10.10.1.2    TCP 83 8081 → 54952 [PSH, ACK] Seq=749 Ack=766 Win=65152 Len=17 TSval=3806032788 TSecr=1681773079
1712183369.811181068   391 1.033257534    10.10.1.2 → 10.10.1.1    TCP 83 54952 → 8081 [PSH, ACK] Seq=766 Ack=766 Win=64256 Len=17 TSval=1681773080 TSecr=3806032788
1712183371.811181068   393 1.033378740    10.10.1.1 → 10.10.1.2    TCP 83 8081 → 54952 [PSH, ACK] Seq=766 Ack=783 Win=65152 Len=17 TSval=3806032789 TSecr=1681773080
1712183377.811181068   399 1.034586411    10.10.1.2 → 10.10.1.1    TCP 83 54952 → 8081 [PSH, ACK] Seq=783 Ack=783 Win=64256 Len=17 TSval=1681773081 TSecr=3806032789
1712183379.811181068   401 1.034719157    10.10.1.1 → 10.10.1.2    TCP 83 8081 → 54952 [PSH, ACK] Seq=783 Ack=800 Win=65152 Len=17 TSval=3806032791 TSecr=1681773081
1712183385.811181068   407 1.035923318    10.10.1.2 → 10.10.1.1    TCP 83 54952 → 8081 [PSH, ACK] Seq=800 Ack=800 Win=64256 Len=17 TSval=1681773083 TSecr=3806032791
1712183387.811181068   409 1.036044736    10.10.1.1 → 10.10.1.2    TCP 83 8081 → 54952 [PSH, ACK] Seq=800 Ack=817 Win=65152 Len=17 TSval=3806032792 TSecr=1681773083
1712183393.811181068   415 1.037249712    10.10.1.2 → 10.10.1.1    TCP 83 54952 → 8081 [PSH, ACK] Seq=817 Ack=817 Win=64256 Len=17 TSval=1681773084 TSecr=3806032792
1712183395.811181068   417 1.037379677    10.10.1.1 → 10.10.1.2    TCP 83 8081 → 54952 [PSH, ACK] Seq=817 Ack=834 Win=65152 Len=17 TSval=3806032793 TSecr=1681773084
1712183401.811181068   423 1.038587059    10.10.1.2 → 10.10.1.1    TCP 83 54952 → 8081 [PSH, ACK] Seq=834 Ack=834 Win=64256 Len=17 TSval=1681773085 TSecr=3806032793
1712183403.811181068   425 1.038719441    10.10.1.1 → 10.10.1.2    TCP 83 8081 → 54952 [PSH, ACK] Seq=834 Ack=851 Win=65152 Len=17 TSval=3806032795 TSecr=1681773085
1712183409.811181068   431 1.039924587    10.10.1.2 → 10.10.1.1    TCP 83 54952 → 8081 [PSH, ACK] Seq=851 Ack=851 Win=64256 Len=17 TSval=1681773087 TSecr=3806032795
1712183411.811181068   433 1.040046165    10.10.1.1 → 10.10.1.2    TCP 83 8081 → 54952 [PSH, ACK] Seq=851 Ack=868 Win=65152 Len=17 TSval=3806032796 TSecr=1681773087
1712183417.811181068   439 1.041251914    10.10.1.2 → 10.10.1.1    TCP 83 54952 → 8081 [PSH, ACK] Seq=868 Ack=868 Win=64256 Len=17 TSval=1681773088 TSecr=3806032796
1712183419.811181068   441 1.041373399    10.10.1.1 → 10.10.1.2    TCP 83 8081 → 54952 [PSH, ACK] Seq=868 Ack=885 Win=65152 Len=17 TSval=3806032797 TSecr=1681773088
1712183425.811181068   447 1.042580486    10.10.1.2 → 10.10.1.1    TCP 83 54952 → 8081 [PSH, ACK] Seq=885 Ack=885 Win=64256 Len=17 TSval=1681773089 TSecr=3806032797
1712183427.811181068   449 1.042711211    10.10.1.1 → 10.10.1.2    TCP 83 8081 → 54952 [PSH, ACK] Seq=885 Ack=902 Win=65152 Len=17 TSval=3806032799 TSecr=1681773089
1712183433.811181068   455 1.043916456    10.10.1.2 → 10.10.1.1    TCP 83 54952 → 8081 [PSH, ACK] Seq=902 Ack=902 Win=64256 Len=17 TSval=1681773091 TSecr=3806032799
1712183435.811181068   457 1.044048617    10.10.1.1 → 10.10.1.2    TCP 83 8081 → 54952 [PSH, ACK] Seq=902 Ack=919 Win=65152 Len=17 TSval=3806032800 TSecr=1681773091
1712183441.811181068   463 1.045253266    10.10.1.2 → 10.10.1.1    TCP 83 54952 → 8081 [PSH, ACK] Seq=919 Ack=919 Win=64256 Len=17 TSval=1681773092 TSecr=3806032800
1712183443.811181068   465 1.045374861    10.10.1.1 → 10.10.1.2    TCP 83 8081 → 54952 [PSH, ACK] Seq=919 Ack=936 Win=65152 Len=17 TSval=3806032801 TSecr=1681773092
1712183449.811181068   471 1.046582097    10.10.1.2 → 10.10.1.1    TCP 83 54952 → 8081 [PSH, ACK] Seq=936 Ack=936 Win=64256 Len=17 TSval=1681773093 TSecr=3806032801
1712183451.811181068   473 1.046712648    10.10.1.1 → 10.10.1.2    TCP 83 8081 → 54952 [PSH, ACK] Seq=936 Ack=953 Win=65152 Len=17 TSval=3806032803 TSecr=1681773093
1712183457.811181068   479 1.047917907    10.10.1.2 → 10.10.1.1    TCP 83 54952 → 8081 [PSH, ACK] Seq=953 Ack=953 Win=64256 Len=17 TSval=1681773095 TSecr=3806032803
1712183460.811181068   482 1.048121541    10.10.1.1 → 10.10.1.2    TCP 83 8081 → 54952 [PSH, ACK] Seq=953 Ack=970 Win=65152 Len=17 TSval=3806032804 TSecr=1681773095
1712183465.811181068   487 1.049326362    10.10.1.2 → 10.10.1.1    TCP 83 54952 → 8081 [PSH, ACK] Seq=970 Ack=970 Win=64256 Len=17 TSval=1681773096 TSecr=3806032804
1712183467.811181068   489 1.049457944    10.10.1.1 → 10.10.1.2    TCP 83 8081 → 54952 [PSH, ACK] Seq=970 Ack=987 Win=65152 Len=17 TSval=3806032805 TSecr=1681773096
1712183474.811181068   496 1.050665120    10.10.1.2 → 10.10.1.1    TCP 83 54952 → 8081 [PSH, ACK] Seq=987 Ack=987 Win=64256 Len=17 TSval=1681773097 TSecr=3806032805
1712183476.811181068   498 1.050788727    10.10.1.1 → 10.10.1.2    TCP 83 8081 → 54952 [PSH, ACK] Seq=987 Ack=1004 Win=65152 Len=17 TSval=3806032807 TSecr=1681773097
1712183482.811181068   504 1.051994821    10.10.1.2 → 10.10.1.1    TCP 83 54952 → 8081 [PSH, ACK] Seq=1004 Ack=1004 Win=64256 Len=17 TSval=1681773099 TSecr=3806032807
1712183484.811181068   506 1.052116098    10.10.1.1 → 10.10.1.2    TCP 83 8081 → 54952 [PSH, ACK] Seq=1004 Ack=1021 Win=65152 Len=17 TSval=3806032808 TSecr=1681773099
1712183490.811181068   512 1.053321508    10.10.1.2 → 10.10.1.1    TCP 83 54952 → 8081 [PSH, ACK] Seq=1021 Ack=1021 Win=64256 Len=17 TSval=1681773100 TSecr=3806032808
1712183492.811181068   514 1.053442539    10.10.1.1 → 10.10.1.2    TCP 83 8081 → 54952 [PSH, ACK] Seq=1021 Ack=1038 Win=65152 Len=17 TSval=3806032809 TSecr=1681773100
1712183497.811181068   519 1.054651598    10.10.1.2 → 10.10.1.1    TCP 83 54952 → 8081 [PSH, ACK] Seq=1038 Ack=1038 Win=64256 Len=17 TSval=1681773101 TSecr=3806032809
1712183500.811181068   522 1.054776432    10.10.1.1 → 10.10.1.2    TCP 83 8081 → 54952 [PSH, ACK] Seq=1038 Ack=1055 Win=65152 Len=17 TSval=3806032811 TSecr=1681773101
1712183505.811181068   527 1.055981042    10.10.1.2 → 10.10.1.1    TCP 83 54952 → 8081 [PSH, ACK] Seq=1055 Ack=1055 Win=64256 Len=17 TSval=1681773103 TSecr=3806032811
1712183508.811181068   530 1.056101858    10.10.1.1 → 10.10.1.2    TCP 83 8081 → 54952 [PSH, ACK] Seq=1055 Ack=1072 Win=65152 Len=17 TSval=3806032812 TSecr=1681773103
1712183513.811181068   535 1.057307074    10.10.1.2 → 10.10.1.1    TCP 83 54952 → 8081 [PSH, ACK] Seq=1072 Ack=1072 Win=64256 Len=17 TSval=1681773104 TSecr=3806032812
1712183516.811181068   538 1.057428981    10.10.1.1 → 10.10.1.2    TCP 83 8081 → 54952 [PSH, ACK] Seq=1072 Ack=1089 Win=65152 Len=17 TSval=3806032813 TSecr=1681773104
1712183521.811181068   543 1.058636922    10.10.1.2 → 10.10.1.1    TCP 83 54952 → 8081 [PSH, ACK] Seq=1089 Ack=1089 Win=64256 Len=17 TSval=1681773105 TSecr=3806032813
1712183524.811181068   546 1.058761564    10.10.1.1 → 10.10.1.2    TCP 83 8081 → 54952 [PSH, ACK] Seq=1089 Ack=1106 Win=65152 Len=17 TSval=3806032815 TSecr=1681773105
1712183529.811181068   551 1.059966746    10.10.1.2 → 10.10.1.1    TCP 83 54952 → 8081 [PSH, ACK] Seq=1106 Ack=1106 Win=64256 Len=17 TSval=1681773107 TSecr=3806032815
1712183532.811181068   554 1.060088087    10.10.1.1 → 10.10.1.2    TCP 83 8081 → 54952 [PSH, ACK] Seq=1106 Ack=1123 Win=65152 Len=17 TSval=3806032816 TSecr=1681773107
1712183537.811181068   559 1.061293044    10.10.1.2 → 10.10.1.1    TCP 83 54952 → 8081 [PSH, ACK] Seq=1123 Ack=1123 Win=64256 Len=17 TSval=1681773108 TSecr=3806032816
1712183540.811181068   562 1.061414618    10.10.1.1 → 10.10.1.2    TCP 83 8081 → 54952 [PSH, ACK] Seq=1123 Ack=1140 Win=65152 Len=17 TSval=3806032817 TSecr=1681773108
1712183545.811181068   567 1.062622023    10.10.1.2 → 10.10.1.1    TCP 83 54952 → 8081 [PSH, ACK] Seq=1140 Ack=1140 Win=64256 Len=17 TSval=1681773109 TSecr=3806032817
1712183548.811181068   570 1.062745325    10.10.1.1 → 10.10.1.2    TCP 83 8081 → 54952 [PSH, ACK] Seq=1140 Ack=1157 Win=65152 Len=17 TSval=3806032819 TSecr=1681773109
1712183553.811181068   575 1.063952045    10.10.1.2 → 10.10.1.1    TCP 83 54952 → 8081 [PSH, ACK] Seq=1157 Ack=1157 Win=64256 Len=17 TSval=1681773111 TSecr=3806032819
1712183556.811181068   578 1.064073263    10.10.1.1 → 10.10.1.2    TCP 83 8081 → 54952 [PSH, ACK] Seq=1157 Ack=1174 Win=65152 Len=17 TSval=3806032820 TSecr=1681773111
1712183561.811181068   583 1.065277482    10.10.1.2 → 10.10.1.1    TCP 83 54952 → 8081 [PSH, ACK] Seq=1174 Ack=1174 Win=64256 Len=17 TSval=1681773112 TSecr=3806032820
1712183564.811181068   586 1.065398509    10.10.1.1 → 10.10.1.2    TCP 83 8081 → 54952 [PSH, ACK] Seq=1174 Ack=1191 Win=65152 Len=17 TSval=3806032821 TSecr=1681773112
1712183569.811181068   591 1.066606531    10.10.1.2 → 10.10.1.1    TCP 83 54952 → 8081 [PSH, ACK] Seq=1191 Ack=1191 Win=64256 Len=17 TSval=1681773113 TSecr=3806032821
1712183572.811181068   594 1.066730881    10.10.1.1 → 10.10.1.2    TCP 83 8081 → 54952 [PSH, ACK] Seq=1191 Ack=1208 Win=65152 Len=17 TSval=3806032823 TSecr=1681773113
1712183577.811181068   599 1.067935063    10.10.1.2 → 10.10.1.1    TCP 83 54952 → 8081 [PSH, ACK] Seq=1208 Ack=1208 Win=64256 Len=17 TSval=1681773115 TSecr=3806032823
1712183580.811181068   602 1.068056784    10.10.1.1 → 10.10.1.2    TCP 83 8081 → 54952 [PSH, ACK] Seq=1208 Ack=1225 Win=65152 Len=17 TSval=3806032824 TSecr=1681773115
1712183585.811181068   607 1.069260930    10.10.1.2 → 10.10.1.1    TCP 83 54952 → 8081 [PSH, ACK] Seq=1225 Ack=1225 Win=64256 Len=17 TSval=1681773116 TSecr=3806032824
1712183588.811181068   610 1.069382661    10.10.1.1 → 10.10.1.2    TCP 83 8081 → 54952 [PSH, ACK] Seq=1225 Ack=1242 Win=65152 Len=17 TSval=3806032825 TSecr=1681773116
1712183593.811181068   615 1.070590360    10.10.1.2 → 10.10.1.1    TCP 83 54952 → 8081 [PSH, ACK] Seq=1242 Ack=1242 Win=64256 Len=17 TSval=1681773117 TSecr=3806032825
1712183595.811181068   617 1.070722569    10.10.1.1 → 10.10.1.2    TCP 83 8081 → 54952 [PSH, ACK] Seq=1242 Ack=1259 Win=65152 Len=17 TSval=3806032827 TSecr=1681773117
1712183601.811181068   623 1.071926759    10.10.1.2 → 10.10.1.1    TCP 83 54952 → 8081 [PSH, ACK] Seq=1259 Ack=1259 Win=64256 Len=17 TSval=1681773119 TSecr=3806032827
1712183603.811181068   625 1.072048036    10.10.1.1 → 10.10.1.2    TCP 83 8081 → 54952 [PSH, ACK] Seq=1259 Ack=1276 Win=65152 Len=17 TSval=3806032828 TSecr=1681773119
1712183609.811181068   631 1.073252600    10.10.1.2 → 10.10.1.1    TCP 83 54952 → 8081 [PSH, ACK] Seq=1276 Ack=1276 Win=64256 Len=17 TSval=1681773120 TSecr=3806032828
1712183611.811181068   633 1.073383836    10.10.1.1 → 10.10.1.2    TCP 83 8081 → 54952 [PSH, ACK] Seq=1276 Ack=1293 Win=65152 Len=17 TSval=3806032829 TSecr=1681773120
1712183617.811181068   639 1.074590989    10.10.1.2 → 10.10.1.1    TCP 83 54952 → 8081 [PSH, ACK] Seq=1293 Ack=1293 Win=64256 Len=17 TSval=1681773121 TSecr=3806032829
1712183619.811181068   641 1.074722920    10.10.1.1 → 10.10.1.2    TCP 83 8081 → 54952 [PSH, ACK] Seq=1293 Ack=1310 Win=65152 Len=17 TSval=3806032831 TSecr=1681773121
1712183625.811181068   647 1.075927216    10.10.1.2 → 10.10.1.1    TCP 83 54952 → 8081 [PSH, ACK] Seq=1310 Ack=1310 Win=64256 Len=17 TSval=1681773123 TSecr=3806032831
1712183627.811181068   649 1.076049204    10.10.1.1 → 10.10.1.2    TCP 83 8081 → 54952 [PSH, ACK] Seq=1310 Ack=1327 Win=65152 Len=17 TSval=3806032832 TSecr=1681773123
1712183633.811181068   655 1.077254789    10.10.1.2 → 10.10.1.1    TCP 83 54952 → 8081 [PSH, ACK] Seq=1327 Ack=1327 Win=64256 Len=17 TSval=1681773124 TSecr=3806032832
1712183635.811181068   657 1.077376999    10.10.1.1 → 10.10.1.2    TCP 83 8081 → 54952 [PSH, ACK] Seq=1327 Ack=1344 Win=65152 Len=17 TSval=3806032833 TSecr=1681773124
1712183641.811181068   663 1.078584891    10.10.1.2 → 10.10.1.1    TCP 83 54952 → 8081 [PSH, ACK] Seq=1344 Ack=1344 Win=64256 Len=17 TSval=1681773125 TSecr=3806032833
1712183643.811181068   665 1.078717033    10.10.1.1 → 10.10.1.2    TCP 83 8081 → 54952 [PSH, ACK] Seq=1344 Ack=1361 Win=65152 Len=17 TSval=3806032835 TSecr=1681773125
1712183649.811181068   671 1.079921332    10.10.1.2 → 10.10.1.1    TCP 83 54952 → 8081 [PSH, ACK] Seq=1361 Ack=1361 Win=64256 Len=17 TSval=1681773127 TSecr=3806032835
1712183651.811181068   673 1.080044624    10.10.1.1 → 10.10.1.2    TCP 83 8081 → 54952 [PSH, ACK] Seq=1361 Ack=1378 Win=65152 Len=17 TSval=3806032836 TSecr=1681773127
1712183657.811181068   679 1.081249698    10.10.1.2 → 10.10.1.1    TCP 83 54952 → 8081 [PSH, ACK] Seq=1378 Ack=1378 Win=64256 Len=17 TSval=1681773128 TSecr=3806032836
1712183659.811181068   681 1.081370776    10.10.1.1 → 10.10.1.2    TCP 83 8081 → 54952 [PSH, ACK] Seq=1378 Ack=1395 Win=65152 Len=17 TSval=3806032837 TSecr=1681773128
1712183665.811181068   687 1.082578626    10.10.1.2 → 10.10.1.1    TCP 83 54952 → 8081 [PSH, ACK] Seq=1395 Ack=1395 Win=64256 Len=17 TSval=1681773129 TSecr=3806032837
1712183667.811181068   689 1.082710677    10.10.1.1 → 10.10.1.2    TCP 83 8081 → 54952 [PSH, ACK] Seq=1395 Ack=1412 Win=65152 Len=17 TSval=3806032839 TSecr=1681773129
1712183673.811181068   695 1.083914800    10.10.1.2 → 10.10.1.1    TCP 83 54952 → 8081 [PSH, ACK] Seq=1412 Ack=1412 Win=64256 Len=17 TSval=1681773131 TSecr=3806032839
1712183675.811181068   697 1.084036391    10.10.1.1 → 10.10.1.2    TCP 83 8081 → 54952 [PSH, ACK] Seq=1412 Ack=1429 Win=65152 Len=17 TSval=3806032840 TSecr=1681773131
1712183681.811181068   703 1.085240201    10.10.1.2 → 10.10.1.1    TCP 83 54952 → 8081 [PSH, ACK] Seq=1429 Ack=1429 Win=64256 Len=17 TSval=1681773132 TSecr=3806032840
1712183683.811181068   705 1.085361818    10.10.1.1 → 10.10.1.2    TCP 83 8081 → 54952 [PSH, ACK] Seq=1429 Ack=1446 Win=65152 Len=17 TSval=3806032841 TSecr=1681773132
1712183689.811181068   711 1.086568398    10.10.1.2 → 10.10.1.1    TCP 83 54952 → 8081 [PSH, ACK] Seq=1446 Ack=1446 Win=64256 Len=17 TSval=1681773133 TSecr=3806032841
1712183691.811181068   713 1.086698625    10.10.1.1 → 10.10.1.2    TCP 83 8081 → 54952 [PSH, ACK] Seq=1446 Ack=1463 Win=65152 Len=17 TSval=3806032843 TSecr=1681773133
1712183697.811181068   719 1.087902537    10.10.1.2 → 10.10.1.1    TCP 83 54952 → 8081 [PSH, ACK] Seq=1463 Ack=1463 Win=64256 Len=17 TSval=1681773135 TSecr=3806032843
1712183699.811181068   721 1.088024271    10.10.1.1 → 10.10.1.2    TCP 83 8081 → 54952 [PSH, ACK] Seq=1463 Ack=1480 Win=65152 Len=17 TSval=3806032844 TSecr=1681773135
1712183705.811181068   727 1.089228333    10.10.1.2 → 10.10.1.1    TCP 83 54952 → 8081 [PSH, ACK] Seq=1480 Ack=1480 Win=64256 Len=17 TSval=1681773136 TSecr=3806032844
1712183707.811181068   729 1.089358723    10.10.1.1 → 10.10.1.2    TCP 83 8081 → 54952 [PSH, ACK] Seq=1480 Ack=1497 Win=65152 Len=17 TSval=3806032845 TSecr=1681773136
1712183713.811181068   735 1.090568805    10.10.1.2 → 10.10.1.1    TCP 83 54952 → 8081 [PSH, ACK] Seq=1497 Ack=1497 Win=64256 Len=17 TSval=1681773137 TSecr=3806032845
1712183715.811181068   737 1.090699197    10.10.1.1 → 10.10.1.2    TCP 83 8081 → 54952 [PSH, ACK] Seq=1497 Ack=1514 Win=65152 Len=17 TSval=3806032847 TSecr=1681773137
1712183721.811181068   743 1.091903773    10.10.1.2 → 10.10.1.1    TCP 83 54952 → 8081 [PSH, ACK] Seq=1514 Ack=1514 Win=64256 Len=17 TSval=1681773139 TSecr=3806032847
1712183723.811181068   745 1.092025485    10.10.1.1 → 10.10.1.2    TCP 83 8081 → 54952 [PSH, ACK] Seq=1514 Ack=1531 Win=65152 Len=17 TSval=3806032848 TSecr=1681773139
1712183729.811181068   751 1.093230733    10.10.1.2 → 10.10.1.1    TCP 83 54952 → 8081 [PSH, ACK] Seq=1531 Ack=1531 Win=64256 Len=17 TSval=1681773140 TSecr=3806032848
1712183731.811181068   753 1.093351716    10.10.1.1 → 10.10.1.2    TCP 83 8081 → 54952 [PSH, ACK] Seq=1531 Ack=1548 Win=65152 Len=17 TSval=3806032849 TSecr=1681773140
1712183737.811181068   759 1.094558267    10.10.1.2 → 10.10.1.1    TCP 83 54952 → 8081 [PSH, ACK] Seq=1548 Ack=1548 Win=64256 Len=17 TSval=1681773141 TSecr=3806032849
1712183739.811181068   761 1.094690463    10.10.1.1 → 10.10.1.2    TCP 83 8081 → 54952 [PSH, ACK] Seq=1548 Ack=1565 Win=65152 Len=17 TSval=3806032851 TSecr=1681773141
1712183745.811181068   767 1.095895972    10.10.1.2 → 10.10.1.1    TCP 83 54952 → 8081 [PSH, ACK] Seq=1565 Ack=1565 Win=64256 Len=17 TSval=1681773143 TSecr=3806032851
1712183747.811181068   769 1.096017196    10.10.1.1 → 10.10.1.2    TCP 83 8081 → 54952 [PSH, ACK] Seq=1565 Ack=1582 Win=65152 Len=17 TSval=3806032852 TSecr=1681773143
1712183753.811181068   775 1.097222718    10.10.1.2 → 10.10.1.1    TCP 83 54952 → 8081 [PSH, ACK] Seq=1582 Ack=1582 Win=64256 Len=17 TSval=1681773144 TSecr=3806032852
1712183755.811181068   777 1.097353528    10.10.1.1 → 10.10.1.2    TCP 83 8081 → 54952 [PSH, ACK] Seq=1582 Ack=1599 Win=65152 Len=17 TSval=3806032853 TSecr=1681773144
1712183761.811181068   783 1.098560895    10.10.1.2 → 10.10.1.1    TCP 83 54952 → 8081 [PSH, ACK] Seq=1599 Ack=1599 Win=64256 Len=17 TSval=1681773145 TSecr=3806032853
1712183763.811181068   785 1.098693444    10.10.1.1 → 10.10.1.2    TCP 83 8081 → 54952 [PSH, ACK] Seq=1599 Ack=1616 Win=65152 Len=17 TSval=3806032855 TSecr=1681773145
1712183769.811181068   791 1.099897385    10.10.1.2 → 10.10.1.1    TCP 83 54952 → 8081 [PSH, ACK] Seq=1616 Ack=1616 Win=64256 Len=17 TSval=1681773147 TSecr=3806032855
1712183771.811181068   793 1.100018941    10.10.1.1 → 10.10.1.2    TCP 83 8081 → 54952 [PSH, ACK] Seq=1616 Ack=1633 Win=65152 Len=17 TSval=3806032856 TSecr=1681773147
1712183777.811181068   799 1.101223484    10.10.1.2 → 10.10.1.1    TCP 83 54952 → 8081 [PSH, ACK] Seq=1633 Ack=1633 Win=64256 Len=17 TSval=1681773148 TSecr=3806032856
1712183779.811181068   801 1.101353575    10.10.1.1 → 10.10.1.2    TCP 83 8081 → 54952 [PSH, ACK] Seq=1633 Ack=1650 Win=65152 Len=17 TSval=3806032857 TSecr=1681773148
1712183785.811181068   807 1.102559995    10.10.1.2 → 10.10.1.1    TCP 83 54952 → 8081 [PSH, ACK] Seq=1650 Ack=1650 Win=64256 Len=17 TSval=1681773149 TSecr=3806032857
1712183787.811181068   809 1.102683957    10.10.1.1 → 10.10.1.2    TCP 83 8081 → 54952 [PSH, ACK] Seq=1650 Ack=1667 Win=65152 Len=17 TSval=3806032859 TSecr=1681773149
1712183793.811181068   815 1.103888468    10.10.1.2 → 10.10.1.1    TCP 83 54952 → 8081 [PSH, ACK] Seq=1667 Ack=1667 Win=64256 Len=17 TSval=1681773151 TSecr=3806032859
1712183795.811181068   817 1.104010489    10.10.1.1 → 10.10.1.2    TCP 83 8081 → 54952 [PSH, ACK] Seq=1667 Ack=1684 Win=65152 Len=17 TSval=3806032860 TSecr=1681773151
1712183801.811181068   823 1.105215919    10.10.1.2 → 10.10.1.1    TCP 83 54952 → 8081 [PSH, ACK] Seq=1684 Ack=1684 Win=64256 Len=17 TSval=1681773152 TSecr=3806032860
1712183803.811181068   825 1.105336991    10.10.1.1 → 10.10.1.2    TCP 83 8081 → 54952 [PSH, ACK] Seq=1684 Ack=1701 Win=65152 Len=17 TSval=3806032861 TSecr=1681773152
1712183809.811181068   831 1.106546102    10.10.1.2 → 10.10.1.1    TCP 83 54952 → 8081 [PSH, ACK] Seq=1701 Ack=1701 Win=64256 Len=17 TSval=1681773153 TSecr=3806032861
1712183811.811181068   833 1.106682513    10.10.1.1 → 10.10.1.2    TCP 83 8081 → 54952 [PSH, ACK] Seq=1701 Ack=1718 Win=65152 Len=17 TSval=3806032863 TSecr=1681773153
1712183817.811181068   839 1.107888830    10.10.1.2 → 10.10.1.1    TCP 83 54952 → 8081 [PSH, ACK] Seq=1718 Ack=1718 Win=64256 Len=17 TSval=1681773155 TSecr=3806032863
1712183819.811181068   841 1.108024466    10.10.1.1 → 10.10.1.2    TCP 83 8081 → 54952 [PSH, ACK] Seq=1718 Ack=1735 Win=65152 Len=17 TSval=3806032864 TSecr=1681773155
1712183825.811181068   847 1.109229131    10.10.1.2 → 10.10.1.1    TCP 83 54952 → 8081 [PSH, ACK] Seq=1735 Ack=1735 Win=64256 Len=17 TSval=1681773156 TSecr=3806032864
1712183827.811181068   849 1.109363559    10.10.1.1 → 10.10.1.2    TCP 83 8081 → 54952 [PSH, ACK] Seq=1735 Ack=1752 Win=65152 Len=17 TSval=3806032865 TSecr=1681773156
1712183833.811181068   855 1.110570878    10.10.1.2 → 10.10.1.1    TCP 83 54952 → 8081 [PSH, ACK] Seq=1752 Ack=1752 Win=64256 Len=17 TSval=1681773157 TSecr=3806032865
1712183835.811181068   857 1.110705807    10.10.1.1 → 10.10.1.2    TCP 83 8081 → 54952 [PSH, ACK] Seq=1752 Ack=1769 Win=65152 Len=17 TSval=3806032867 TSecr=1681773157
1712183841.811181068   863 1.111910303    10.10.1.2 → 10.10.1.1    TCP 83 54952 → 8081 [PSH, ACK] Seq=1769 Ack=1769 Win=64256 Len=17 TSval=1681773159 TSecr=3806032867
1712183843.811181068   865 1.112034653    10.10.1.1 → 10.10.1.2    TCP 83 8081 → 54952 [PSH, ACK] Seq=1769 Ack=1786 Win=65152 Len=17 TSval=3806032868 TSecr=1681773159
1712183849.811181068   871 1.113239165    10.10.1.2 → 10.10.1.1    TCP 83 54952 → 8081 [PSH, ACK] Seq=1786 Ack=1786 Win=64256 Len=17 TSval=1681773160 TSecr=3806032868
1712183851.811181068   873 1.113364150    10.10.1.1 → 10.10.1.2    TCP 83 8081 → 54952 [PSH, ACK] Seq=1786 Ack=1803 Win=65152 Len=17 TSval=3806032869 TSecr=1681773160
1712183857.811181068   879 1.114571695    10.10.1.2 → 10.10.1.1    TCP 83 54952 → 8081 [PSH, ACK] Seq=1803 Ack=1803 Win=64256 Len=17 TSval=1681773161 TSecr=3806032869
1712183859.811181068   881 1.114699291    10.10.1.1 → 10.10.1.2    TCP 83 8081 → 54952 [PSH, ACK] Seq=1803 Ack=1820 Win=65152 Len=17 TSval=3806032871 TSecr=1681773161
1712183865.811181068   887 1.115904720    10.10.1.2 → 10.10.1.1    TCP 83 54952 → 8081 [PSH, ACK] Seq=1820 Ack=1820 Win=64256 Len=17 TSval=1681773163 TSecr=3806032871
1712183867.811181068   889 1.116029335    10.10.1.1 → 10.10.1.2    TCP 83 8081 → 54952 [PSH, ACK] Seq=1820 Ack=1837 Win=65152 Len=17 TSval=3806032872 TSecr=1681773163
1712183873.811181068   895 1.117188854    10.10.1.2 → 10.10.1.1    TCP 83 54952 → 8081 [PSH, ACK] Seq=1837 Ack=1837 Win=64256 Len=17 TSval=1681773164 TSecr=3806032872
1712183875.811181068   897 1.117315296    10.10.1.1 → 10.10.1.2    TCP 83 8081 → 54952 [PSH, ACK] Seq=1837 Ack=1854 Win=65152 Len=17 TSval=3806032873 TSecr=1681773164
1712183881.811181068   903 1.118521381    10.10.1.2 → 10.10.1.1    TCP 83 54952 → 8081 [PSH, ACK] Seq=1854 Ack=1854 Win=64256 Len=17 TSval=1681773165 TSecr=3806032873
1712183883.811181068   905 1.118654508    10.10.1.1 → 10.10.1.2    TCP 83 8081 → 54952 [PSH, ACK] Seq=1854 Ack=1871 Win=65152 Len=17 TSval=3806032875 TSecr=1681773165
1712183889.811181068   911 1.119859505    10.10.1.2 → 10.10.1.1    TCP 83 54952 → 8081 [PSH, ACK] Seq=1871 Ack=1871 Win=64256 Len=17 TSval=1681773167 TSecr=3806032875
1712183891.811181068   913 1.119980772    10.10.1.1 → 10.10.1.2    TCP 83 8081 → 54952 [PSH, ACK] Seq=1871 Ack=1888 Win=65152 Len=17 TSval=3806032876 TSecr=1681773167
1712183897.811181068   919 1.121189606    10.10.1.2 → 10.10.1.1    TCP 83 54952 → 8081 [PSH, ACK] Seq=1888 Ack=1888 Win=64256 Len=17 TSval=1681773168 TSecr=3806032876
1712183899.811181068   921 1.121311733    10.10.1.1 → 10.10.1.2    TCP 83 8081 → 54952 [PSH, ACK] Seq=1888 Ack=1905 Win=65152 Len=17 TSval=3806032877 TSecr=1681773168
1712183905.811181068   927 1.122517805    10.10.1.2 → 10.10.1.1    TCP 83 54952 → 8081 [PSH, ACK] Seq=1905 Ack=1905 Win=64256 Len=17 TSval=1681773169 TSecr=3806032877
1712183907.811181068   929 1.122651251    10.10.1.1 → 10.10.1.2    TCP 83 8081 → 54952 [PSH, ACK] Seq=1905 Ack=1922 Win=65152 Len=17 TSval=3806032879 TSecr=1681773169
1712183913.811181068   935 1.123855843    10.10.1.2 → 10.10.1.1    TCP 83 54952 → 8081 [PSH, ACK] Seq=1922 Ack=1922 Win=64256 Len=17 TSval=1681773171 TSecr=3806032879
1712183916.811181068   938 1.124030298    10.10.1.1 → 10.10.1.2    TCP 83 8081 → 54952 [PSH, ACK] Seq=1922 Ack=1939 Win=65152 Len=17 TSval=3806032880 TSecr=1681773171
1712183921.811181068   943 1.125236365    10.10.1.2 → 10.10.1.1    TCP 83 54952 → 8081 [PSH, ACK] Seq=1939 Ack=1939 Win=64256 Len=17 TSval=1681773172 TSecr=3806032880
1712183923.811181068   945 1.125366346    10.10.1.1 → 10.10.1.2    TCP 83 8081 → 54952 [PSH, ACK] Seq=1939 Ack=1956 Win=65152 Len=17 TSval=3806032881 TSecr=1681773172
1712183929.811181068   951 1.126573788    10.10.1.2 → 10.10.1.1    TCP 83 54952 → 8081 [PSH, ACK] Seq=1956 Ack=1956 Win=64256 Len=17 TSval=1681773173 TSecr=3806032881
1712183931.811181068   953 1.126706623    10.10.1.1 → 10.10.1.2    TCP 83 8081 → 54952 [PSH, ACK] Seq=1956 Ack=1973 Win=65152 Len=17 TSval=3806032883 TSecr=1681773173
1712183937.811181068   959 1.127910965    10.10.1.2 → 10.10.1.1    TCP 83 54952 → 8081 [PSH, ACK] Seq=1973 Ack=1973 Win=64256 Len=17 TSval=1681773175 TSecr=3806032883
1712183939.811181068   961 1.128045991    10.10.1.1 → 10.10.1.2    TCP 83 8081 → 54952 [PSH, ACK] Seq=1973 Ack=1990 Win=65152 Len=17 TSval=3806032884 TSecr=1681773175
1712183945.811181068   967 1.129250445    10.10.1.2 → 10.10.1.1    TCP 83 54952 → 8081 [PSH, ACK] Seq=1990 Ack=1990 Win=64256 Len=17 TSval=1681773176 TSecr=3806032884
1712183947.811181068   969 1.129371918    10.10.1.1 → 10.10.1.2    TCP 83 8081 → 54952 [PSH, ACK] Seq=1990 Ack=2007 Win=65152 Len=17 TSval=3806032885 TSecr=1681773176
1712183953.811181068   975 1.130579053    10.10.1.2 → 10.10.1.1    TCP 83 54952 → 8081 [PSH, ACK] Seq=2007 Ack=2007 Win=64256 Len=17 TSval=1681773177 TSecr=3806032885
1712183955.811181068   977 1.130710395    10.10.1.1 → 10.10.1.2    TCP 83 8081 → 54952 [PSH, ACK] Seq=2007 Ack=2024 Win=65152 Len=17 TSval=3806032887 TSecr=1681773177
1712183961.811181068   983 1.131914971    10.10.1.2 → 10.10.1.1    TCP 83 54952 → 8081 [PSH, ACK] Seq=2024 Ack=2024 Win=64256 Len=17 TSval=1681773179 TSecr=3806032887
1712183963.811181068   985 1.132051880    10.10.1.1 → 10.10.1.2    TCP 83 8081 → 54952 [PSH, ACK] Seq=2024 Ack=2041 Win=65152 Len=17 TSval=3806032888 TSecr=1681773179
1712183969.811181068   991 1.133256869    10.10.1.2 → 10.10.1.1    TCP 83 54952 → 8081 [PSH, ACK] Seq=2041 Ack=2041 Win=64256 Len=17 TSval=1681773180 TSecr=3806032888
