1711548207.408030033    35 0.520633427    10.10.1.2 → 10.10.1.1    TCP 83 55248 → 8081 [PSH, ACK] Seq=1 Ack=1 Win=64256 Len=17 TSval=1046964965 TSecr=3171224426
1711548211.408030033    39 0.520826566    10.10.1.1 → 10.10.1.2    TCP 83 8081 → 55248 [PSH, ACK] Seq=1 Ack=18 Win=65152 Len=17 TSval=3171224676 TSecr=1046964965
1711548219.408030033    47 0.521991398    10.10.1.2 → 10.10.1.1    TCP 83 55248 → 8081 [PSH, ACK] Seq=18 Ack=18 Win=64256 Len=17 TSval=1046964967 TSecr=3171224676
1711548222.408030033    50 0.522026482    10.10.1.1 → 10.10.1.2    TCP 83 8081 → 55248 [PSH, ACK] Seq=18 Ack=35 Win=65152 Len=17 TSval=3171224677 TSecr=1046964967
1711548229.408030033    57 0.523189804    10.10.1.2 → 10.10.1.1    TCP 83 55248 → 8081 [PSH, ACK] Seq=35 Ack=35 Win=64256 Len=17 TSval=1046964968 TSecr=3171224677
1711548232.408030033    60 0.523225749    10.10.1.1 → 10.10.1.2    TCP 83 8081 → 55248 [PSH, ACK] Seq=35 Ack=52 Win=65152 Len=17 TSval=3171224678 TSecr=1046964968
1711548239.408030033    67 0.524388968    10.10.1.2 → 10.10.1.1    TCP 83 55248 → 8081 [PSH, ACK] Seq=52 Ack=52 Win=64256 Len=17 TSval=1046964969 TSecr=3171224678
1711548242.408030033    70 0.524421230    10.10.1.1 → 10.10.1.2    TCP 83 8081 → 55248 [PSH, ACK] Seq=52 Ack=69 Win=65152 Len=17 TSval=3171224679 TSecr=1046964969
1711548249.408030033    77 0.525579374    10.10.1.2 → 10.10.1.1    TCP 83 55248 → 8081 [PSH, ACK] Seq=69 Ack=69 Win=64256 Len=17 TSval=1046964970 TSecr=3171224679
1711548251.408030033    79 0.525610404    10.10.1.1 → 10.10.1.2    TCP 83 8081 → 55248 [PSH, ACK] Seq=69 Ack=86 Win=65152 Len=17 TSval=3171224680 TSecr=1046964970
1711548259.408030033    87 0.526769997    10.10.1.2 → 10.10.1.1    TCP 83 55248 → 8081 [PSH, ACK] Seq=86 Ack=86 Win=64256 Len=17 TSval=1046964971 TSecr=3171224680
1711548261.408030033    89 0.526806112    10.10.1.1 → 10.10.1.2    TCP 83 8081 → 55248 [PSH, ACK] Seq=86 Ack=103 Win=65152 Len=17 TSval=3171224682 TSecr=1046964971
1711548269.408030033    97 0.527998469    10.10.1.2 → 10.10.1.1    TCP 83 55248 → 8081 [PSH, ACK] Seq=103 Ack=103 Win=64256 Len=17 TSval=1046964973 TSecr=3171224682
1711548271.408030033    99 0.528029950    10.10.1.1 → 10.10.1.2    TCP 83 8081 → 55248 [PSH, ACK] Seq=103 Ack=120 Win=65152 Len=17 TSval=3171224683 TSecr=1046964973
1711548279.408030033   107 0.529193489    10.10.1.2 → 10.10.1.1    TCP 83 55248 → 8081 [PSH, ACK] Seq=120 Ack=120 Win=64256 Len=17 TSval=1046964974 TSecr=3171224683
1711548281.408030033   109 0.529225467    10.10.1.1 → 10.10.1.2    TCP 83 8081 → 55248 [PSH, ACK] Seq=120 Ack=137 Win=65152 Len=17 TSval=3171224684 TSecr=1046964974
1711548289.408030033   117 0.530383930    10.10.1.2 → 10.10.1.1    TCP 83 55248 → 8081 [PSH, ACK] Seq=137 Ack=137 Win=64256 Len=17 TSval=1046964975 TSecr=3171224684
1711548291.408030033   119 0.530414965    10.10.1.1 → 10.10.1.2    TCP 83 8081 → 55248 [PSH, ACK] Seq=137 Ack=154 Win=65152 Len=17 TSval=3171224685 TSecr=1046964975
1711548299.408030033   127 0.531573727    10.10.1.2 → 10.10.1.1    TCP 83 55248 → 8081 [PSH, ACK] Seq=154 Ack=154 Win=64256 Len=17 TSval=1046964976 TSecr=3171224685
1711548301.408030033   129 0.531609084    10.10.1.1 → 10.10.1.2    TCP 83 8081 → 55248 [PSH, ACK] Seq=154 Ack=171 Win=65152 Len=17 TSval=3171224686 TSecr=1046964976
1711548309.408030033   137 0.532769674    10.10.1.2 → 10.10.1.1    TCP 83 55248 → 8081 [PSH, ACK] Seq=171 Ack=171 Win=64256 Len=17 TSval=1046964977 TSecr=3171224686
1711548311.408030033   139 0.532801193    10.10.1.1 → 10.10.1.2    TCP 83 8081 → 55248 [PSH, ACK] Seq=171 Ack=188 Win=65152 Len=17 TSval=3171224688 TSecr=1046964977
1711548319.408030033   147 0.533958369    10.10.1.2 → 10.10.1.1    TCP 83 55248 → 8081 [PSH, ACK] Seq=188 Ack=188 Win=64256 Len=17 TSval=1046964979 TSecr=3171224688
1711548321.408030033   149 0.533989979    10.10.1.1 → 10.10.1.2    TCP 83 8081 → 55248 [PSH, ACK] Seq=188 Ack=205 Win=65152 Len=17 TSval=3171224689 TSecr=1046964979
1711548329.408030033   157 0.535149320    10.10.1.2 → 10.10.1.1    TCP 83 55248 → 8081 [PSH, ACK] Seq=205 Ack=205 Win=64256 Len=17 TSval=1046964980 TSecr=3171224689
1711548331.408030033   159 0.535184285    10.10.1.1 → 10.10.1.2    TCP 83 8081 → 55248 [PSH, ACK] Seq=205 Ack=222 Win=65152 Len=17 TSval=3171224690 TSecr=1046964980
1711548339.408030033   167 0.536345837    10.10.1.2 → 10.10.1.1    TCP 83 55248 → 8081 [PSH, ACK] Seq=222 Ack=222 Win=64256 Len=17 TSval=1046964981 TSecr=3171224690
1711548341.408030033   169 0.536377429    10.10.1.1 → 10.10.1.2    TCP 83 8081 → 55248 [PSH, ACK] Seq=222 Ack=239 Win=65152 Len=17 TSval=3171224691 TSecr=1046964981
1711548349.408030033   177 0.537534178    10.10.1.2 → 10.10.1.1    TCP 83 55248 → 8081 [PSH, ACK] Seq=239 Ack=239 Win=64256 Len=17 TSval=1046964982 TSecr=3171224691
1711548351.408030033   179 0.537563531    10.10.1.1 → 10.10.1.2    TCP 83 8081 → 55248 [PSH, ACK] Seq=239 Ack=256 Win=65152 Len=17 TSval=3171224692 TSecr=1046964982
1711548359.408030033   187 0.538721276    10.10.1.2 → 10.10.1.1    TCP 83 55248 → 8081 [PSH, ACK] Seq=256 Ack=256 Win=64256 Len=17 TSval=1046964983 TSecr=3171224692
1711548361.408030033   189 0.538754562    10.10.1.1 → 10.10.1.2    TCP 83 8081 → 55248 [PSH, ACK] Seq=256 Ack=273 Win=65152 Len=17 TSval=3171224694 TSecr=1046964983
1711548369.408030033   197 0.539913004    10.10.1.2 → 10.10.1.1    TCP 83 55248 → 8081 [PSH, ACK] Seq=273 Ack=273 Win=64256 Len=17 TSval=1046964984 TSecr=3171224694
1711548371.408030033   199 0.539945111    10.10.1.1 → 10.10.1.2    TCP 83 8081 → 55248 [PSH, ACK] Seq=273 Ack=290 Win=65152 Len=17 TSval=3171224695 TSecr=1046964984
1711548379.408030033   207 0.541106201    10.10.1.2 → 10.10.1.1    TCP 83 55248 → 8081 [PSH, ACK] Seq=290 Ack=290 Win=64256 Len=17 TSval=1046964986 TSecr=3171224695
1711548381.408030033   209 0.541137558    10.10.1.1 → 10.10.1.2    TCP 83 8081 → 55248 [PSH, ACK] Seq=290 Ack=307 Win=65152 Len=17 TSval=3171224696 TSecr=1046964986
1711548389.408030033   217 0.542295884    10.10.1.2 → 10.10.1.1    TCP 83 55248 → 8081 [PSH, ACK] Seq=307 Ack=307 Win=64256 Len=17 TSval=1046964987 TSecr=3171224696
1711548391.408030033   219 0.542329381    10.10.1.1 → 10.10.1.2    TCP 83 8081 → 55248 [PSH, ACK] Seq=307 Ack=324 Win=65152 Len=17 TSval=3171224697 TSecr=1046964987
1711548399.408030033   227 0.543489208    10.10.1.2 → 10.10.1.1    TCP 83 55248 → 8081 [PSH, ACK] Seq=324 Ack=324 Win=64256 Len=17 TSval=1046964988 TSecr=3171224697
1711548401.408030033   229 0.543525106    10.10.1.1 → 10.10.1.2    TCP 83 8081 → 55248 [PSH, ACK] Seq=324 Ack=341 Win=65152 Len=17 TSval=3171224698 TSecr=1046964988
1711548409.408030033   237 0.544686339    10.10.1.2 → 10.10.1.1    TCP 83 55248 → 8081 [PSH, ACK] Seq=341 Ack=341 Win=64256 Len=17 TSval=1046964989 TSecr=3171224698
1711548411.408030033   239 0.544718101    10.10.1.1 → 10.10.1.2    TCP 83 8081 → 55248 [PSH, ACK] Seq=341 Ack=358 Win=65152 Len=17 TSval=3171224700 TSecr=1046964989
1711548419.408030033   247 0.545876403    10.10.1.2 → 10.10.1.1    TCP 83 55248 → 8081 [PSH, ACK] Seq=358 Ack=358 Win=64256 Len=17 TSval=1046964990 TSecr=3171224700
1711548421.408030033   249 0.545908261    10.10.1.1 → 10.10.1.2    TCP 83 8081 → 55248 [PSH, ACK] Seq=358 Ack=375 Win=65152 Len=17 TSval=3171224701 TSecr=1046964990
1711548429.408030033   257 0.547066565    10.10.1.2 → 10.10.1.1    TCP 83 55248 → 8081 [PSH, ACK] Seq=375 Ack=375 Win=64256 Len=17 TSval=1046964992 TSecr=3171224701
1711548431.408030033   259 0.547100438    10.10.1.1 → 10.10.1.2    TCP 83 8081 → 55248 [PSH, ACK] Seq=375 Ack=392 Win=65152 Len=17 TSval=3171224702 TSecr=1046964992
1711548439.408030033   267 0.548260706    10.10.1.2 → 10.10.1.1    TCP 83 55248 → 8081 [PSH, ACK] Seq=392 Ack=392 Win=64256 Len=17 TSval=1046964993 TSecr=3171224702
1711548441.408030033   269 0.548292887    10.10.1.1 → 10.10.1.2    TCP 83 8081 → 55248 [PSH, ACK] Seq=392 Ack=409 Win=65152 Len=17 TSval=3171224703 TSecr=1046964993
1711548449.408030033   277 0.549449346    10.10.1.2 → 10.10.1.1    TCP 83 55248 → 8081 [PSH, ACK] Seq=409 Ack=409 Win=64256 Len=17 TSval=1046964994 TSecr=3171224703
1711548451.408030033   279 0.549481484    10.10.1.1 → 10.10.1.2    TCP 83 8081 → 55248 [PSH, ACK] Seq=409 Ack=426 Win=65152 Len=17 TSval=3171224704 TSecr=1046964994
1711548459.408030033   287 0.550638650    10.10.1.2 → 10.10.1.1    TCP 83 55248 → 8081 [PSH, ACK] Seq=426 Ack=426 Win=64256 Len=17 TSval=1046964995 TSecr=3171224704
1711548461.408030033   289 0.550679124    10.10.1.1 → 10.10.1.2    TCP 83 8081 → 55248 [PSH, ACK] Seq=426 Ack=443 Win=65152 Len=17 TSval=3171224706 TSecr=1046964995
1711548469.408030033   297 0.551839805    10.10.1.2 → 10.10.1.1    TCP 83 55248 → 8081 [PSH, ACK] Seq=443 Ack=443 Win=64256 Len=17 TSval=1046964996 TSecr=3171224706
1711548471.408030033   299 0.551869809    10.10.1.1 → 10.10.1.2    TCP 83 8081 → 55248 [PSH, ACK] Seq=443 Ack=460 Win=65152 Len=17 TSval=3171224707 TSecr=1046964996
1711548479.408030033   307 0.553029965    10.10.1.2 → 10.10.1.1    TCP 83 55248 → 8081 [PSH, ACK] Seq=460 Ack=460 Win=64256 Len=17 TSval=1046964998 TSecr=3171224707
1711548481.408030033   309 0.553059658    10.10.1.1 → 10.10.1.2    TCP 83 8081 → 55248 [PSH, ACK] Seq=460 Ack=477 Win=65152 Len=17 TSval=3171224708 TSecr=1046964998
1711548489.408030033   317 0.554216830    10.10.1.2 → 10.10.1.1    TCP 83 55248 → 8081 [PSH, ACK] Seq=477 Ack=477 Win=64256 Len=17 TSval=1046964999 TSecr=3171224708
1711548491.408030033   319 0.554246379    10.10.1.1 → 10.10.1.2    TCP 83 8081 → 55248 [PSH, ACK] Seq=477 Ack=494 Win=65152 Len=17 TSval=3171224709 TSecr=1046964999
1711548499.408030033   327 0.555404436    10.10.1.2 → 10.10.1.1    TCP 83 55248 → 8081 [PSH, ACK] Seq=494 Ack=494 Win=64256 Len=17 TSval=1046965000 TSecr=3171224709
1711548501.408030033   329 0.555440537    10.10.1.1 → 10.10.1.2    TCP 83 8081 → 55248 [PSH, ACK] Seq=494 Ack=511 Win=65152 Len=17 TSval=3171224710 TSecr=1046965000
1711548509.408030033   337 0.556600965    10.10.1.2 → 10.10.1.1    TCP 83 55248 → 8081 [PSH, ACK] Seq=511 Ack=511 Win=64256 Len=17 TSval=1046965001 TSecr=3171224710
1711548511.408030033   339 0.556633065    10.10.1.1 → 10.10.1.2    TCP 83 8081 → 55248 [PSH, ACK] Seq=511 Ack=528 Win=65152 Len=17 TSval=3171224711 TSecr=1046965001
1711548519.408030033   347 0.557790421    10.10.1.2 → 10.10.1.1    TCP 83 55248 → 8081 [PSH, ACK] Seq=528 Ack=528 Win=64256 Len=17 TSval=1046965002 TSecr=3171224711
1711548521.408030033   349 0.557821875    10.10.1.1 → 10.10.1.2    TCP 83 8081 → 55248 [PSH, ACK] Seq=528 Ack=545 Win=65152 Len=17 TSval=3171224713 TSecr=1046965002
1711548529.408030033   357 0.558965389    10.10.1.2 → 10.10.1.1    TCP 83 55248 → 8081 [PSH, ACK] Seq=545 Ack=545 Win=64256 Len=17 TSval=1046965004 TSecr=3171224713
1711548531.408030033   359 0.559001693    10.10.1.1 → 10.10.1.2    TCP 83 8081 → 55248 [PSH, ACK] Seq=545 Ack=562 Win=65152 Len=17 TSval=3171224714 TSecr=1046965004
1711548539.408030033   367 0.560161961    10.10.1.2 → 10.10.1.1    TCP 83 55248 → 8081 [PSH, ACK] Seq=562 Ack=562 Win=64256 Len=17 TSval=1046965005 TSecr=3171224714
1711548541.408030033   369 0.560192693    10.10.1.1 → 10.10.1.2    TCP 83 8081 → 55248 [PSH, ACK] Seq=562 Ack=579 Win=65152 Len=17 TSval=3171224715 TSecr=1046965005
1711548549.408030033   377 0.561349920    10.10.1.2 → 10.10.1.1    TCP 83 55248 → 8081 [PSH, ACK] Seq=579 Ack=579 Win=64256 Len=17 TSval=1046965006 TSecr=3171224715
1711548551.408030033   379 0.561379573    10.10.1.1 → 10.10.1.2    TCP 83 8081 → 55248 [PSH, ACK] Seq=579 Ack=596 Win=65152 Len=17 TSval=3171224716 TSecr=1046965006
1711548559.408030033   387 0.562536642    10.10.1.2 → 10.10.1.1    TCP 83 55248 → 8081 [PSH, ACK] Seq=596 Ack=596 Win=64256 Len=17 TSval=1046965007 TSecr=3171224716
1711548561.408030033   389 0.562566110    10.10.1.1 → 10.10.1.2    TCP 83 8081 → 55248 [PSH, ACK] Seq=596 Ack=613 Win=65152 Len=17 TSval=3171224717 TSecr=1046965007
1711548569.408030033   397 0.563724835    10.10.1.2 → 10.10.1.1    TCP 83 55248 → 8081 [PSH, ACK] Seq=613 Ack=613 Win=64256 Len=17 TSval=1046965008 TSecr=3171224717
1711548571.408030033   399 0.563758802    10.10.1.1 → 10.10.1.2    TCP 83 8081 → 55248 [PSH, ACK] Seq=613 Ack=630 Win=65152 Len=17 TSval=3171224719 TSecr=1046965008
1711548579.408030033   407 0.564919802    10.10.1.2 → 10.10.1.1    TCP 83 55248 → 8081 [PSH, ACK] Seq=630 Ack=630 Win=64256 Len=17 TSval=1046965009 TSecr=3171224719
1711548581.408030033   409 0.564951905    10.10.1.1 → 10.10.1.2    TCP 83 8081 → 55248 [PSH, ACK] Seq=630 Ack=647 Win=65152 Len=17 TSval=3171224720 TSecr=1046965009
1711548589.408030033   417 0.566108682    10.10.1.2 → 10.10.1.1    TCP 83 55248 → 8081 [PSH, ACK] Seq=647 Ack=647 Win=64256 Len=17 TSval=1046965011 TSecr=3171224720
1711548591.408030033   419 0.566140580    10.10.1.1 → 10.10.1.2    TCP 83 8081 → 55248 [PSH, ACK] Seq=647 Ack=664 Win=65152 Len=17 TSval=3171224721 TSecr=1046965011
1711548599.408030033   427 0.567299174    10.10.1.2 → 10.10.1.1    TCP 83 55248 → 8081 [PSH, ACK] Seq=664 Ack=664 Win=64256 Len=17 TSval=1046965012 TSecr=3171224721
1711548601.408030033   429 0.567334802    10.10.1.1 → 10.10.1.2    TCP 83 8081 → 55248 [PSH, ACK] Seq=664 Ack=681 Win=65152 Len=17 TSval=3171224722 TSecr=1046965012
1711548609.408030033   437 0.568495565    10.10.1.2 → 10.10.1.1    TCP 83 55248 → 8081 [PSH, ACK] Seq=681 Ack=681 Win=64256 Len=17 TSval=1046965013 TSecr=3171224722
1711548611.408030033   439 0.568525796    10.10.1.1 → 10.10.1.2    TCP 83 8081 → 55248 [PSH, ACK] Seq=681 Ack=698 Win=65152 Len=17 TSval=3171224723 TSecr=1046965013
1711548619.408030033   447 0.569683380    10.10.1.2 → 10.10.1.1    TCP 83 55248 → 8081 [PSH, ACK] Seq=698 Ack=698 Win=64256 Len=17 TSval=1046965014 TSecr=3171224723
1711548621.408030033   449 0.569713335    10.10.1.1 → 10.10.1.2    TCP 83 8081 → 55248 [PSH, ACK] Seq=698 Ack=715 Win=65152 Len=17 TSval=3171224725 TSecr=1046965014
1711548629.408030033   457 0.570870808    10.10.1.2 → 10.10.1.1    TCP 83 55248 → 8081 [PSH, ACK] Seq=715 Ack=715 Win=64256 Len=17 TSval=1046965015 TSecr=3171224725
1711548631.408030033   459 0.570906551    10.10.1.1 → 10.10.1.2    TCP 83 8081 → 55248 [PSH, ACK] Seq=715 Ack=732 Win=65152 Len=17 TSval=3171224726 TSecr=1046965015
1711548639.408030033   467 0.572064940    10.10.1.2 → 10.10.1.1    TCP 83 55248 → 8081 [PSH, ACK] Seq=732 Ack=732 Win=64256 Len=17 TSval=1046965017 TSecr=3171224726
1711548641.408030033   469 0.572097292    10.10.1.1 → 10.10.1.2    TCP 83 8081 → 55248 [PSH, ACK] Seq=732 Ack=749 Win=65152 Len=17 TSval=3171224727 TSecr=1046965017
1711548649.408030033   477 0.573256729    10.10.1.2 → 10.10.1.1    TCP 83 55248 → 8081 [PSH, ACK] Seq=749 Ack=749 Win=64256 Len=17 TSval=1046965018 TSecr=3171224727
1711548651.408030033   479 0.573286375    10.10.1.1 → 10.10.1.2    TCP 83 8081 → 55248 [PSH, ACK] Seq=749 Ack=766 Win=65152 Len=17 TSval=3171224728 TSecr=1046965018
1711548659.408030033   487 0.574443319    10.10.1.2 → 10.10.1.1    TCP 83 55248 → 8081 [PSH, ACK] Seq=766 Ack=766 Win=64256 Len=17 TSval=1046965019 TSecr=3171224728
1711548661.408030033   489 0.574473297    10.10.1.1 → 10.10.1.2    TCP 83 8081 → 55248 [PSH, ACK] Seq=766 Ack=783 Win=65152 Len=17 TSval=3171224729 TSecr=1046965019
1711548669.408030033   497 0.575632896    10.10.1.2 → 10.10.1.1    TCP 83 55248 → 8081 [PSH, ACK] Seq=783 Ack=783 Win=64256 Len=17 TSval=1046965020 TSecr=3171224729
1711548671.408030033   499 0.575668773    10.10.1.1 → 10.10.1.2    TCP 83 8081 → 55248 [PSH, ACK] Seq=783 Ack=800 Win=65152 Len=17 TSval=3171224731 TSecr=1046965020
1711548679.408030033   507 0.576830497    10.10.1.2 → 10.10.1.1    TCP 83 55248 → 8081 [PSH, ACK] Seq=800 Ack=800 Win=64256 Len=17 TSval=1046965021 TSecr=3171224731
1711548681.408030033   509 0.576861805    10.10.1.1 → 10.10.1.2    TCP 83 8081 → 55248 [PSH, ACK] Seq=800 Ack=817 Win=65152 Len=17 TSval=3171224732 TSecr=1046965021
1711548689.408030033   517 0.578019142    10.10.1.2 → 10.10.1.1    TCP 83 55248 → 8081 [PSH, ACK] Seq=817 Ack=817 Win=64256 Len=17 TSval=1046965023 TSecr=3171224732
1711548691.408030033   519 0.578051335    10.10.1.1 → 10.10.1.2    TCP 83 8081 → 55248 [PSH, ACK] Seq=817 Ack=834 Win=65152 Len=17 TSval=3171224733 TSecr=1046965023
1711548699.408030033   527 0.579209145    10.10.1.2 → 10.10.1.1    TCP 83 55248 → 8081 [PSH, ACK] Seq=834 Ack=834 Win=64256 Len=17 TSval=1046965024 TSecr=3171224733
1711548701.408030033   529 0.579244656    10.10.1.1 → 10.10.1.2    TCP 83 8081 → 55248 [PSH, ACK] Seq=834 Ack=851 Win=65152 Len=17 TSval=3171224734 TSecr=1046965024
1711548709.408030033   537 0.580404966    10.10.1.2 → 10.10.1.1    TCP 83 55248 → 8081 [PSH, ACK] Seq=851 Ack=851 Win=64256 Len=17 TSval=1046965025 TSecr=3171224734
1711548711.408030033   539 0.580437343    10.10.1.1 → 10.10.1.2    TCP 83 8081 → 55248 [PSH, ACK] Seq=851 Ack=868 Win=65152 Len=17 TSval=3171224735 TSecr=1046965025
1711548719.408030033   547 0.581594836    10.10.1.2 → 10.10.1.1    TCP 83 55248 → 8081 [PSH, ACK] Seq=868 Ack=868 Win=64256 Len=17 TSval=1046965026 TSecr=3171224735
1711548721.408030033   549 0.581626371    10.10.1.1 → 10.10.1.2    TCP 83 8081 → 55248 [PSH, ACK] Seq=868 Ack=885 Win=65152 Len=17 TSval=3171224736 TSecr=1046965026
1711548729.408030033   557 0.582784348    10.10.1.2 → 10.10.1.1    TCP 83 55248 → 8081 [PSH, ACK] Seq=885 Ack=885 Win=64256 Len=17 TSval=1046965027 TSecr=3171224736
1711548731.408030033   559 0.582820569    10.10.1.1 → 10.10.1.2    TCP 83 8081 → 55248 [PSH, ACK] Seq=885 Ack=902 Win=65152 Len=17 TSval=3171224738 TSecr=1046965027
1711548739.408030033   567 0.583970899    10.10.1.2 → 10.10.1.1    TCP 83 55248 → 8081 [PSH, ACK] Seq=902 Ack=902 Win=64256 Len=17 TSval=1046965029 TSecr=3171224738
1711548741.408030033   569 0.584003099    10.10.1.1 → 10.10.1.2    TCP 83 8081 → 55248 [PSH, ACK] Seq=902 Ack=919 Win=65152 Len=17 TSval=3171224739 TSecr=1046965029
1711548749.408030033   577 0.585163107    10.10.1.2 → 10.10.1.1    TCP 83 55248 → 8081 [PSH, ACK] Seq=919 Ack=919 Win=64256 Len=17 TSval=1046965030 TSecr=3171224739
1711548751.408030033   579 0.585194854    10.10.1.1 → 10.10.1.2    TCP 83 8081 → 55248 [PSH, ACK] Seq=919 Ack=936 Win=65152 Len=17 TSval=3171224740 TSecr=1046965030
1711548759.408030033   587 0.586351476    10.10.1.2 → 10.10.1.1    TCP 83 55248 → 8081 [PSH, ACK] Seq=936 Ack=936 Win=64256 Len=17 TSval=1046965031 TSecr=3171224740
1711548761.408030033   589 0.586381151    10.10.1.1 → 10.10.1.2    TCP 83 8081 → 55248 [PSH, ACK] Seq=936 Ack=953 Win=65152 Len=17 TSval=3171224741 TSecr=1046965031
1711548769.408030033   597 0.587538827    10.10.1.2 → 10.10.1.1    TCP 83 55248 → 8081 [PSH, ACK] Seq=953 Ack=953 Win=64256 Len=17 TSval=1046965032 TSecr=3171224741
1711548772.408030033   600 0.587610098    10.10.1.1 → 10.10.1.2    TCP 83 8081 → 55248 [PSH, ACK] Seq=953 Ack=970 Win=65152 Len=17 TSval=3171224742 TSecr=1046965032
1711548779.408030033   607 0.588771315    10.10.1.2 → 10.10.1.1    TCP 83 55248 → 8081 [PSH, ACK] Seq=970 Ack=970 Win=64256 Len=17 TSval=1046965033 TSecr=3171224742
1711548781.408030033   609 0.588802922    10.10.1.1 → 10.10.1.2    TCP 83 8081 → 55248 [PSH, ACK] Seq=970 Ack=987 Win=65152 Len=17 TSval=3171224744 TSecr=1046965033
1711548789.408030033   617 0.589961383    10.10.1.2 → 10.10.1.1    TCP 83 55248 → 8081 [PSH, ACK] Seq=987 Ack=987 Win=64256 Len=17 TSval=1046965035 TSecr=3171224744
1711548791.408030033   619 0.589992798    10.10.1.1 → 10.10.1.2    TCP 83 8081 → 55248 [PSH, ACK] Seq=987 Ack=1004 Win=65152 Len=17 TSval=3171224745 TSecr=1046965035
1711548799.408030033   627 0.591151964    10.10.1.2 → 10.10.1.1    TCP 83 55248 → 8081 [PSH, ACK] Seq=1004 Ack=1004 Win=64256 Len=17 TSval=1046965036 TSecr=3171224745
1711548801.408030033   629 0.591185641    10.10.1.1 → 10.10.1.2    TCP 83 8081 → 55248 [PSH, ACK] Seq=1004 Ack=1021 Win=65152 Len=17 TSval=3171224746 TSecr=1046965036
1711548809.408030033   637 0.592346069    10.10.1.2 → 10.10.1.1    TCP 83 55248 → 8081 [PSH, ACK] Seq=1021 Ack=1021 Win=64256 Len=17 TSval=1046965037 TSecr=3171224746
1711548811.408030033   639 0.592378003    10.10.1.1 → 10.10.1.2    TCP 83 8081 → 55248 [PSH, ACK] Seq=1021 Ack=1038 Win=65152 Len=17 TSval=3171224747 TSecr=1046965037
1711548819.408030033   647 0.593534940    10.10.1.2 → 10.10.1.1    TCP 83 55248 → 8081 [PSH, ACK] Seq=1038 Ack=1038 Win=64256 Len=17 TSval=1046965038 TSecr=3171224747
1711548821.408030033   649 0.593566306    10.10.1.1 → 10.10.1.2    TCP 83 8081 → 55248 [PSH, ACK] Seq=1038 Ack=1055 Win=65152 Len=17 TSval=3171224748 TSecr=1046965038
1711548829.408030033   657 0.594724256    10.10.1.2 → 10.10.1.1    TCP 83 55248 → 8081 [PSH, ACK] Seq=1055 Ack=1055 Win=64256 Len=17 TSval=1046965039 TSecr=3171224748
1711548831.408030033   659 0.594759488    10.10.1.1 → 10.10.1.2    TCP 83 8081 → 55248 [PSH, ACK] Seq=1055 Ack=1072 Win=65152 Len=17 TSval=3171224750 TSecr=1046965039
1711548839.408030033   667 0.595917624    10.10.1.2 → 10.10.1.1    TCP 83 55248 → 8081 [PSH, ACK] Seq=1072 Ack=1072 Win=64256 Len=17 TSval=1046965040 TSecr=3171224750
1711548841.408030033   669 0.595947495    10.10.1.1 → 10.10.1.2    TCP 83 8081 → 55248 [PSH, ACK] Seq=1072 Ack=1089 Win=65152 Len=17 TSval=3171224751 TSecr=1046965040
1711548849.408030033   677 0.597107918    10.10.1.2 → 10.10.1.1    TCP 83 55248 → 8081 [PSH, ACK] Seq=1089 Ack=1089 Win=64256 Len=17 TSval=1046965042 TSecr=3171224751
1711548851.408030033   679 0.597138657    10.10.1.1 → 10.10.1.2    TCP 83 8081 → 55248 [PSH, ACK] Seq=1089 Ack=1106 Win=65152 Len=17 TSval=3171224752 TSecr=1046965042
1711548859.408030033   687 0.598295816    10.10.1.2 → 10.10.1.1    TCP 83 55248 → 8081 [PSH, ACK] Seq=1106 Ack=1106 Win=64256 Len=17 TSval=1046965043 TSecr=3171224752
1711548861.408030033   689 0.598325596    10.10.1.1 → 10.10.1.2    TCP 83 8081 → 55248 [PSH, ACK] Seq=1106 Ack=1123 Win=65152 Len=17 TSval=3171224753 TSecr=1046965043
1711548869.408030033   697 0.599483651    10.10.1.2 → 10.10.1.1    TCP 83 55248 → 8081 [PSH, ACK] Seq=1123 Ack=1123 Win=64256 Len=17 TSval=1046965044 TSecr=3171224753
1711548871.408030033   699 0.599519509    10.10.1.1 → 10.10.1.2    TCP 83 8081 → 55248 [PSH, ACK] Seq=1123 Ack=1140 Win=65152 Len=17 TSval=3171224754 TSecr=1046965044
1711548879.408030033   707 0.600680591    10.10.1.2 → 10.10.1.1    TCP 83 55248 → 8081 [PSH, ACK] Seq=1140 Ack=1140 Win=64256 Len=17 TSval=1046965045 TSecr=3171224754
1711548881.408030033   709 0.600712377    10.10.1.1 → 10.10.1.2    TCP 83 8081 → 55248 [PSH, ACK] Seq=1140 Ack=1157 Win=65152 Len=17 TSval=3171224756 TSecr=1046965045
1711548889.408030033   717 0.601869248    10.10.1.2 → 10.10.1.1    TCP 83 55248 → 8081 [PSH, ACK] Seq=1157 Ack=1157 Win=64256 Len=17 TSval=1046965046 TSecr=3171224756
1711548891.408030033   719 0.601900652    10.10.1.1 → 10.10.1.2    TCP 83 8081 → 55248 [PSH, ACK] Seq=1157 Ack=1174 Win=65152 Len=17 TSval=3171224757 TSecr=1046965046
1711548899.408030033   727 0.603058125    10.10.1.2 → 10.10.1.1    TCP 83 55248 → 8081 [PSH, ACK] Seq=1174 Ack=1174 Win=64256 Len=17 TSval=1046965048 TSecr=3171224757
1711548901.408030033   729 0.603094504    10.10.1.1 → 10.10.1.2    TCP 83 8081 → 55248 [PSH, ACK] Seq=1174 Ack=1191 Win=65152 Len=17 TSval=3171224758 TSecr=1046965048
1711548909.408030033   737 0.604254796    10.10.1.2 → 10.10.1.1    TCP 83 55248 → 8081 [PSH, ACK] Seq=1191 Ack=1191 Win=64256 Len=17 TSval=1046965049 TSecr=3171224758
1711548911.408030033   739 0.604286453    10.10.1.1 → 10.10.1.2    TCP 83 8081 → 55248 [PSH, ACK] Seq=1191 Ack=1208 Win=65152 Len=17 TSval=3171224759 TSecr=1046965049
1711548919.408030033   747 0.605443846    10.10.1.2 → 10.10.1.1    TCP 83 55248 → 8081 [PSH, ACK] Seq=1208 Ack=1208 Win=64256 Len=17 TSval=1046965050 TSecr=3171224759
1711548921.408030033   749 0.605475734    10.10.1.1 → 10.10.1.2    TCP 83 8081 → 55248 [PSH, ACK] Seq=1208 Ack=1225 Win=65152 Len=17 TSval=3171224760 TSecr=1046965050
1711548929.408030033   757 0.606633227    10.10.1.2 → 10.10.1.1    TCP 83 55248 → 8081 [PSH, ACK] Seq=1225 Ack=1225 Win=64256 Len=17 TSval=1046965051 TSecr=3171224760
1711548931.408030033   759 0.606675698    10.10.1.1 → 10.10.1.2    TCP 83 8081 → 55248 [PSH, ACK] Seq=1225 Ack=1242 Win=65152 Len=17 TSval=3171224762 TSecr=1046965051
1711548939.408030033   767 0.607833819    10.10.1.2 → 10.10.1.1    TCP 83 55248 → 8081 [PSH, ACK] Seq=1242 Ack=1242 Win=64256 Len=17 TSval=1046965052 TSecr=3171224762
1711548941.408030033   769 0.607868950    10.10.1.1 → 10.10.1.2    TCP 83 8081 → 55248 [PSH, ACK] Seq=1242 Ack=1259 Win=65152 Len=17 TSval=3171224763 TSecr=1046965052
1711548949.408030033   777 0.609029357    10.10.1.2 → 10.10.1.1    TCP 83 55248 → 8081 [PSH, ACK] Seq=1259 Ack=1259 Win=64256 Len=17 TSval=1046965054 TSecr=3171224763
1711548951.408030033   779 0.609061706    10.10.1.1 → 10.10.1.2    TCP 83 8081 → 55248 [PSH, ACK] Seq=1259 Ack=1276 Win=65152 Len=17 TSval=3171224764 TSecr=1046965054
1711548959.408030033   787 0.610218869    10.10.1.2 → 10.10.1.1    TCP 83 55248 → 8081 [PSH, ACK] Seq=1276 Ack=1276 Win=64256 Len=17 TSval=1046965055 TSecr=3171224764
1711548961.408030033   789 0.610250774    10.10.1.1 → 10.10.1.2    TCP 83 8081 → 55248 [PSH, ACK] Seq=1276 Ack=1293 Win=65152 Len=17 TSval=3171224765 TSecr=1046965055
1711548969.408030033   797 0.611409381    10.10.1.2 → 10.10.1.1    TCP 83 55248 → 8081 [PSH, ACK] Seq=1293 Ack=1293 Win=64256 Len=17 TSval=1046965056 TSecr=3171224765
1711548971.408030033   799 0.611445317    10.10.1.1 → 10.10.1.2    TCP 83 8081 → 55248 [PSH, ACK] Seq=1293 Ack=1310 Win=65152 Len=17 TSval=3171224766 TSecr=1046965056
1711548979.408030033   807 0.612606334    10.10.1.2 → 10.10.1.1    TCP 83 55248 → 8081 [PSH, ACK] Seq=1310 Ack=1310 Win=64256 Len=17 TSval=1046965057 TSecr=3171224766
1711548981.408030033   809 0.612637919    10.10.1.1 → 10.10.1.2    TCP 83 8081 → 55248 [PSH, ACK] Seq=1310 Ack=1327 Win=65152 Len=17 TSval=3171224767 TSecr=1046965057
1711548989.408030033   817 0.613794596    10.10.1.2 → 10.10.1.1    TCP 83 55248 → 8081 [PSH, ACK] Seq=1327 Ack=1327 Win=64256 Len=17 TSval=1046965058 TSecr=3171224767
1711548991.408030033   819 0.613826283    10.10.1.1 → 10.10.1.2    TCP 83 8081 → 55248 [PSH, ACK] Seq=1327 Ack=1344 Win=65152 Len=17 TSval=3171224769 TSecr=1046965058
1711548999.408030033   827 0.614962918    10.10.1.2 → 10.10.1.1    TCP 83 55248 → 8081 [PSH, ACK] Seq=1344 Ack=1344 Win=64256 Len=17 TSval=1046965060 TSecr=3171224769
1711549001.408030033   829 0.614998804    10.10.1.1 → 10.10.1.2    TCP 83 8081 → 55248 [PSH, ACK] Seq=1344 Ack=1361 Win=65152 Len=17 TSval=3171224770 TSecr=1046965060
1711549009.408030033   837 0.616161147    10.10.1.2 → 10.10.1.1    TCP 83 55248 → 8081 [PSH, ACK] Seq=1361 Ack=1361 Win=64256 Len=17 TSval=1046965061 TSecr=3171224770
1711549011.408030033   839 0.616194291    10.10.1.1 → 10.10.1.2    TCP 83 8081 → 55248 [PSH, ACK] Seq=1361 Ack=1378 Win=65152 Len=17 TSval=3171224771 TSecr=1046965061
1711549019.408030033   847 0.617351410    10.10.1.2 → 10.10.1.1    TCP 83 55248 → 8081 [PSH, ACK] Seq=1378 Ack=1378 Win=64256 Len=17 TSval=1046965062 TSecr=3171224771
1711549021.408030033   849 0.617383148    10.10.1.1 → 10.10.1.2    TCP 83 8081 → 55248 [PSH, ACK] Seq=1378 Ack=1395 Win=65152 Len=17 TSval=3171224772 TSecr=1046965062
1711549029.408030033   857 0.618540321    10.10.1.2 → 10.10.1.1    TCP 83 55248 → 8081 [PSH, ACK] Seq=1395 Ack=1395 Win=64256 Len=17 TSval=1046965063 TSecr=3171224772
1711549031.408030033   859 0.618571902    10.10.1.1 → 10.10.1.2    TCP 83 8081 → 55248 [PSH, ACK] Seq=1395 Ack=1412 Win=65152 Len=17 TSval=3171224773 TSecr=1046965063
1711549039.408030033   867 0.619729822    10.10.1.2 → 10.10.1.1    TCP 83 55248 → 8081 [PSH, ACK] Seq=1412 Ack=1412 Win=64256 Len=17 TSval=1046965064 TSecr=3171224773
1711549041.408030033   869 0.619764039    10.10.1.1 → 10.10.1.2    TCP 83 8081 → 55248 [PSH, ACK] Seq=1412 Ack=1429 Win=65152 Len=17 TSval=3171224775 TSecr=1046965064
1711549049.408030033   877 0.620924996    10.10.1.2 → 10.10.1.1    TCP 83 55248 → 8081 [PSH, ACK] Seq=1429 Ack=1429 Win=64256 Len=17 TSval=1046965065 TSecr=3171224775
1711549051.408030033   879 0.620954977    10.10.1.1 → 10.10.1.2    TCP 83 8081 → 55248 [PSH, ACK] Seq=1429 Ack=1446 Win=65152 Len=17 TSval=3171224776 TSecr=1046965065
1711549059.408030033   887 0.622112004    10.10.1.2 → 10.10.1.1    TCP 83 55248 → 8081 [PSH, ACK] Seq=1446 Ack=1446 Win=64256 Len=17 TSval=1046965067 TSecr=3171224776
1711549061.408030033   889 0.622141814    10.10.1.1 → 10.10.1.2    TCP 83 8081 → 55248 [PSH, ACK] Seq=1446 Ack=1463 Win=65152 Len=17 TSval=3171224777 TSecr=1046965067
1711549069.408030033   897 0.623299631    10.10.1.2 → 10.10.1.1    TCP 83 55248 → 8081 [PSH, ACK] Seq=1463 Ack=1463 Win=64256 Len=17 TSval=1046965068 TSecr=3171224777
1711549071.408030033   899 0.623334768    10.10.1.1 → 10.10.1.2    TCP 83 8081 → 55248 [PSH, ACK] Seq=1463 Ack=1480 Win=65152 Len=17 TSval=3171224778 TSecr=1046965068
1711549079.408030033   907 0.624495383    10.10.1.2 → 10.10.1.1    TCP 83 55248 → 8081 [PSH, ACK] Seq=1480 Ack=1480 Win=64256 Len=17 TSval=1046965069 TSecr=3171224778
1711549081.408030033   909 0.624525475    10.10.1.1 → 10.10.1.2    TCP 83 8081 → 55248 [PSH, ACK] Seq=1480 Ack=1497 Win=65152 Len=17 TSval=3171224779 TSecr=1046965069
1711549089.408030033   917 0.625682586    10.10.1.2 → 10.10.1.1    TCP 83 55248 → 8081 [PSH, ACK] Seq=1497 Ack=1497 Win=64256 Len=17 TSval=1046965070 TSecr=3171224779
1711549091.408030033   919 0.625713007    10.10.1.1 → 10.10.1.2    TCP 83 8081 → 55248 [PSH, ACK] Seq=1497 Ack=1514 Win=65152 Len=17 TSval=3171224781 TSecr=1046965070
1711549099.408030033   927 0.626870727    10.10.1.2 → 10.10.1.1    TCP 83 55248 → 8081 [PSH, ACK] Seq=1514 Ack=1514 Win=64256 Len=17 TSval=1046965071 TSecr=3171224781
1711549101.408030033   929 0.626906278    10.10.1.1 → 10.10.1.2    TCP 83 8081 → 55248 [PSH, ACK] Seq=1514 Ack=1531 Win=65152 Len=17 TSval=3171224782 TSecr=1046965071
1711549109.408030033   937 0.628064632    10.10.1.2 → 10.10.1.1    TCP 83 55248 → 8081 [PSH, ACK] Seq=1531 Ack=1531 Win=64256 Len=17 TSval=1046965073 TSecr=3171224782
1711549111.408030033   939 0.628096425    10.10.1.1 → 10.10.1.2    TCP 83 8081 → 55248 [PSH, ACK] Seq=1531 Ack=1548 Win=65152 Len=17 TSval=3171224783 TSecr=1046965073
1711549119.408030033   947 0.629255607    10.10.1.2 → 10.10.1.1    TCP 83 55248 → 8081 [PSH, ACK] Seq=1548 Ack=1548 Win=64256 Len=17 TSval=1046965074 TSecr=3171224783
1711549121.408030033   949 0.629288019    10.10.1.1 → 10.10.1.2    TCP 83 8081 → 55248 [PSH, ACK] Seq=1548 Ack=1565 Win=65152 Len=17 TSval=3171224784 TSecr=1046965074
1711549129.408030033   957 0.630445063    10.10.1.2 → 10.10.1.1    TCP 83 55248 → 8081 [PSH, ACK] Seq=1565 Ack=1565 Win=64256 Len=17 TSval=1046965075 TSecr=3171224784
1711549131.408030033   959 0.630474871    10.10.1.1 → 10.10.1.2    TCP 83 8081 → 55248 [PSH, ACK] Seq=1565 Ack=1582 Win=65152 Len=17 TSval=3171224785 TSecr=1046965075
1711549139.408030033   967 0.631632378    10.10.1.2 → 10.10.1.1    TCP 83 55248 → 8081 [PSH, ACK] Seq=1582 Ack=1582 Win=64256 Len=17 TSval=1046965076 TSecr=3171224785
1711549141.408030033   969 0.631668628    10.10.1.1 → 10.10.1.2    TCP 83 8081 → 55248 [PSH, ACK] Seq=1582 Ack=1599 Win=65152 Len=17 TSval=3171224787 TSecr=1046965076
1711549149.408030033   977 0.632828940    10.10.1.2 → 10.10.1.1    TCP 83 55248 → 8081 [PSH, ACK] Seq=1599 Ack=1599 Win=64256 Len=17 TSval=1046965077 TSecr=3171224787
1711549151.408030033   979 0.632861055    10.10.1.1 → 10.10.1.2    TCP 83 8081 → 55248 [PSH, ACK] Seq=1599 Ack=1616 Win=65152 Len=17 TSval=3171224788 TSecr=1046965077
1711549159.408030033   987 0.634018392    10.10.1.2 → 10.10.1.1    TCP 83 55248 → 8081 [PSH, ACK] Seq=1616 Ack=1616 Win=64256 Len=17 TSval=1046965079 TSecr=3171224788
1711549161.408030033   989 0.634050565    10.10.1.1 → 10.10.1.2    TCP 83 8081 → 55248 [PSH, ACK] Seq=1616 Ack=1633 Win=65152 Len=17 TSval=3171224789 TSecr=1046965079
1711549169.408030033   997 0.635209289    10.10.1.2 → 10.10.1.1    TCP 83 55248 → 8081 [PSH, ACK] Seq=1633 Ack=1633 Win=64256 Len=17 TSval=1046965080 TSecr=3171224789
1711549171.408030033   999 0.635245151    10.10.1.1 → 10.10.1.2    TCP 83 8081 → 55248 [PSH, ACK] Seq=1633 Ack=1650 Win=65152 Len=17 TSval=3171224790 TSecr=1046965080
1711549179.408030033  1007 0.636405554    10.10.1.2 → 10.10.1.1    TCP 83 55248 → 8081 [PSH, ACK] Seq=1650 Ack=1650 Win=64256 Len=17 TSval=1046965081 TSecr=3171224790
1711549181.408030033  1009 0.636437753    10.10.1.1 → 10.10.1.2    TCP 83 8081 → 55248 [PSH, ACK] Seq=1650 Ack=1667 Win=65152 Len=17 TSval=3171224791 TSecr=1046965081
1711549189.408030033  1017 0.637594591    10.10.1.2 → 10.10.1.1    TCP 83 55248 → 8081 [PSH, ACK] Seq=1667 Ack=1667 Win=64256 Len=17 TSval=1046965082 TSecr=3171224791
1711549191.408030033  1019 0.637627050    10.10.1.1 → 10.10.1.2    TCP 83 8081 → 55248 [PSH, ACK] Seq=1667 Ack=1684 Win=65152 Len=17 TSval=3171224792 TSecr=1046965082
1711549199.408030033  1027 0.638784933    10.10.1.2 → 10.10.1.1    TCP 83 55248 → 8081 [PSH, ACK] Seq=1684 Ack=1684 Win=64256 Len=17 TSval=1046965083 TSecr=3171224792
1711549201.408030033  1029 0.638820582    10.10.1.1 → 10.10.1.2    TCP 83 8081 → 55248 [PSH, ACK] Seq=1684 Ack=1701 Win=65152 Len=17 TSval=3171224794 TSecr=1046965083
1711549209.408030033  1037 0.639969820    10.10.1.2 → 10.10.1.1    TCP 83 55248 → 8081 [PSH, ACK] Seq=1701 Ack=1701 Win=64256 Len=17 TSval=1046965085 TSecr=3171224794
1711549211.408030033  1039 0.640002519    10.10.1.1 → 10.10.1.2    TCP 83 8081 → 55248 [PSH, ACK] Seq=1701 Ack=1718 Win=65152 Len=17 TSval=3171224795 TSecr=1046965085
1711549219.408030033  1047 0.641162964    10.10.1.2 → 10.10.1.1    TCP 83 55248 → 8081 [PSH, ACK] Seq=1718 Ack=1718 Win=64256 Len=17 TSval=1046965086 TSecr=3171224795
1711549221.408030033  1049 0.641194777    10.10.1.1 → 10.10.1.2    TCP 83 8081 → 55248 [PSH, ACK] Seq=1718 Ack=1735 Win=65152 Len=17 TSval=3171224796 TSecr=1046965086
1711549229.408030033  1057 0.642352554    10.10.1.2 → 10.10.1.1    TCP 83 55248 → 8081 [PSH, ACK] Seq=1735 Ack=1735 Win=64256 Len=17 TSval=1046965087 TSecr=3171224796
1711549231.408030033  1059 0.642382751    10.10.1.1 → 10.10.1.2    TCP 83 8081 → 55248 [PSH, ACK] Seq=1735 Ack=1752 Win=65152 Len=17 TSval=3171224797 TSecr=1046965087
1711549239.408030033  1067 0.643541268    10.10.1.2 → 10.10.1.1    TCP 83 55248 → 8081 [PSH, ACK] Seq=1752 Ack=1752 Win=64256 Len=17 TSval=1046965088 TSecr=3171224797
1711549241.408030033  1069 0.643576723    10.10.1.1 → 10.10.1.2    TCP 83 8081 → 55248 [PSH, ACK] Seq=1752 Ack=1769 Win=65152 Len=17 TSval=3171224798 TSecr=1046965088
1711549249.408030033  1077 0.644737290    10.10.1.2 → 10.10.1.1    TCP 83 55248 → 8081 [PSH, ACK] Seq=1769 Ack=1769 Win=64256 Len=17 TSval=1046965089 TSecr=3171224798
1711549251.408030033  1079 0.644769690    10.10.1.1 → 10.10.1.2    TCP 83 8081 → 55248 [PSH, ACK] Seq=1769 Ack=1786 Win=65152 Len=17 TSval=3171224800 TSecr=1046965089
1711549259.408030033  1087 0.645926614    10.10.1.2 → 10.10.1.1    TCP 83 55248 → 8081 [PSH, ACK] Seq=1786 Ack=1786 Win=64256 Len=17 TSval=1046965090 TSecr=3171224800
1711549261.408030033  1089 0.645959034    10.10.1.1 → 10.10.1.2    TCP 83 8081 → 55248 [PSH, ACK] Seq=1786 Ack=1803 Win=65152 Len=17 TSval=3171224801 TSecr=1046965090
1711549269.408030033  1097 0.647117251    10.10.1.2 → 10.10.1.1    TCP 83 55248 → 8081 [PSH, ACK] Seq=1803 Ack=1803 Win=64256 Len=17 TSval=1046965092 TSecr=3171224801
1711549271.408030033  1099 0.647152927    10.10.1.1 → 10.10.1.2    TCP 83 8081 → 55248 [PSH, ACK] Seq=1803 Ack=1820 Win=65152 Len=17 TSval=3171224802 TSecr=1046965092
1711549279.408030033  1107 0.648313767    10.10.1.2 → 10.10.1.1    TCP 83 55248 → 8081 [PSH, ACK] Seq=1820 Ack=1820 Win=64256 Len=17 TSval=1046965093 TSecr=3171224802
1711549281.408030033  1109 0.648345562    10.10.1.1 → 10.10.1.2    TCP 83 8081 → 55248 [PSH, ACK] Seq=1820 Ack=1837 Win=65152 Len=17 TSval=3171224803 TSecr=1046965093
1711549289.408030033  1117 0.649502955    10.10.1.2 → 10.10.1.1    TCP 83 55248 → 8081 [PSH, ACK] Seq=1837 Ack=1837 Win=64256 Len=17 TSval=1046965094 TSecr=3171224803
1711549291.408030033  1119 0.649534482    10.10.1.1 → 10.10.1.2    TCP 83 8081 → 55248 [PSH, ACK] Seq=1837 Ack=1854 Win=65152 Len=17 TSval=3171224804 TSecr=1046965094
1711549299.408030033  1127 0.650692029    10.10.1.2 → 10.10.1.1    TCP 83 55248 → 8081 [PSH, ACK] Seq=1854 Ack=1854 Win=64256 Len=17 TSval=1046965095 TSecr=3171224804
1711549301.408030033  1129 0.650728097    10.10.1.1 → 10.10.1.2    TCP 83 8081 → 55248 [PSH, ACK] Seq=1854 Ack=1871 Win=65152 Len=17 TSval=3171224806 TSecr=1046965095
1711549309.408030033  1137 0.651885730    10.10.1.2 → 10.10.1.1    TCP 83 55248 → 8081 [PSH, ACK] Seq=1871 Ack=1871 Win=64256 Len=17 TSval=1046965096 TSecr=3171224806
1711549311.408030033  1139 0.651915181    10.10.1.1 → 10.10.1.2    TCP 83 8081 → 55248 [PSH, ACK] Seq=1871 Ack=1888 Win=65152 Len=17 TSval=3171224807 TSecr=1046965096
1711549319.408030033  1147 0.653074311    10.10.1.2 → 10.10.1.1    TCP 83 55248 → 8081 [PSH, ACK] Seq=1888 Ack=1888 Win=64256 Len=17 TSval=1046965098 TSecr=3171224807
1711549321.408030033  1149 0.653104019    10.10.1.1 → 10.10.1.2    TCP 83 8081 → 55248 [PSH, ACK] Seq=1888 Ack=1905 Win=65152 Len=17 TSval=3171224808 TSecr=1046965098
1711549329.408030033  1157 0.654260845    10.10.1.2 → 10.10.1.1    TCP 83 55248 → 8081 [PSH, ACK] Seq=1905 Ack=1905 Win=64256 Len=17 TSval=1046965099 TSecr=3171224808
1711549331.408030033  1159 0.654290426    10.10.1.1 → 10.10.1.2    TCP 83 8081 → 55248 [PSH, ACK] Seq=1905 Ack=1922 Win=65152 Len=17 TSval=3171224809 TSecr=1046965099
1711549339.408030033  1167 0.655448442    10.10.1.2 → 10.10.1.1    TCP 83 55248 → 8081 [PSH, ACK] Seq=1922 Ack=1922 Win=64256 Len=17 TSval=1046965100 TSecr=3171224809
1711549342.408030033  1170 0.655515190    10.10.1.1 → 10.10.1.2    TCP 83 8081 → 55248 [PSH, ACK] Seq=1922 Ack=1939 Win=65152 Len=17 TSval=3171224810 TSecr=1046965100
1711549349.408030033  1177 0.656675696    10.10.1.2 → 10.10.1.1    TCP 83 55248 → 8081 [PSH, ACK] Seq=1939 Ack=1939 Win=64256 Len=17 TSval=1046965101 TSecr=3171224810
1711549351.408030033  1179 0.656707657    10.10.1.1 → 10.10.1.2    TCP 83 8081 → 55248 [PSH, ACK] Seq=1939 Ack=1956 Win=65152 Len=17 TSval=3171224812 TSecr=1046965101
1711549359.408030033  1187 0.657865458    10.10.1.2 → 10.10.1.1    TCP 83 55248 → 8081 [PSH, ACK] Seq=1956 Ack=1956 Win=64256 Len=17 TSval=1046965102 TSecr=3171224812
1711549361.408030033  1189 0.657897313    10.10.1.1 → 10.10.1.2    TCP 83 8081 → 55248 [PSH, ACK] Seq=1956 Ack=1973 Win=65152 Len=17 TSval=3171224813 TSecr=1046965102
1711549369.408030033  1197 0.659054981    10.10.1.2 → 10.10.1.1    TCP 83 55248 → 8081 [PSH, ACK] Seq=1973 Ack=1973 Win=64256 Len=17 TSval=1046965104 TSecr=3171224813
1711549371.408030033  1199 0.659090119    10.10.1.1 → 10.10.1.2    TCP 83 8081 → 55248 [PSH, ACK] Seq=1973 Ack=1990 Win=65152 Len=17 TSval=3171224814 TSecr=1046965104
1711549379.408030033  1207 0.660249867    10.10.1.2 → 10.10.1.1    TCP 83 55248 → 8081 [PSH, ACK] Seq=1990 Ack=1990 Win=64256 Len=17 TSval=1046965105 TSecr=3171224814
1711549381.408030033  1209 0.660282079    10.10.1.1 → 10.10.1.2    TCP 83 8081 → 55248 [PSH, ACK] Seq=1990 Ack=2007 Win=65152 Len=17 TSval=3171224815 TSecr=1046965105
1711549389.408030033  1217 0.661438804    10.10.1.2 → 10.10.1.1    TCP 83 55248 → 8081 [PSH, ACK] Seq=2007 Ack=2007 Win=64256 Len=17 TSval=1046965106 TSecr=3171224815
1711549391.408030033  1219 0.661470420    10.10.1.1 → 10.10.1.2    TCP 83 8081 → 55248 [PSH, ACK] Seq=2007 Ack=2024 Win=65152 Len=17 TSval=3171224816 TSecr=1046965106
1711549399.408030033  1227 0.662627735    10.10.1.2 → 10.10.1.1    TCP 83 55248 → 8081 [PSH, ACK] Seq=2024 Ack=2024 Win=64256 Len=17 TSval=1046965107 TSecr=3171224816
1711549401.408030033  1229 0.662667828    10.10.1.1 → 10.10.1.2    TCP 83 8081 → 55248 [PSH, ACK] Seq=2024 Ack=2041 Win=65152 Len=17 TSval=3171224818 TSecr=1046965107
1711549409.408030033  1237 0.663825274    10.10.1.2 → 10.10.1.1    TCP 83 55248 → 8081 [PSH, ACK] Seq=2041 Ack=2041 Win=64256 Len=17 TSval=1046965108 TSecr=3171224818
