1711548483.588397503    15 0.232615128    10.10.1.2 → 10.10.1.1    TCP 74 39790 → 8081 [SYN] Seq=0 Win=64240 Len=0 MSS=1460 SACK_PERM=1 TSval=1047260887 TSecr=0 WS=128
1711548484.588397503    16 0.232651683    10.10.1.1 → 10.10.1.2    TCP 74 8081 → 39790 [SYN, ACK] Seq=0 Ack=1 Win=65160 Len=0 MSS=1460 SACK_PERM=1 TSval=3171520598 TSecr=1047260887 WS=128
1711548485.588397503    17 0.232686198    10.10.1.2 → 10.10.1.1    TCP 66 39790 → 8081 [ACK] Seq=1 Ack=1 Win=64256 Len=0 TSval=1047260888 TSecr=3171520598
1711548490.588397503    22 0.494813662    10.10.1.2 → 10.10.1.1    TCP 83 39790 → 8081 [PSH, ACK] Seq=1 Ack=1 Win=64256 Len=17 TSval=1047261150 TSecr=3171520598
1711548492.588397503    24 0.494831748    10.10.1.1 → 10.10.1.2    TCP 66 8081 → 39790 [ACK] Seq=1 Ack=18 Win=65152 Len=0 TSval=3171520860 TSecr=1047261150
1711548493.588397503    25 0.495040945    10.10.1.1 → 10.10.1.2    TCP 83 8081 → 39790 [PSH, ACK] Seq=1 Ack=18 Win=65152 Len=17 TSval=3171520861 TSecr=1047261150
1711548494.588397503    26 0.495072007    10.10.1.2 → 10.10.1.1    TCP 66 39790 → 8081 [ACK] Seq=18 Ack=18 Win=64256 Len=0 TSval=1047261150 TSecr=3171520861
1711548499.588397503    31 0.505207922    10.10.1.2 → 10.10.1.1    TCP 83 39790 → 8081 [PSH, ACK] Seq=18 Ack=18 Win=64256 Len=17 TSval=1047261160 TSecr=3171520861
1711548502.588397503    34 0.505245482    10.10.1.1 → 10.10.1.2    TCP 83 8081 → 39790 [PSH, ACK] Seq=18 Ack=35 Win=65152 Len=17 TSval=3171520871 TSecr=1047261160
1711548507.588397503    39 0.515403644    10.10.1.2 → 10.10.1.1    TCP 83 39790 → 8081 [PSH, ACK] Seq=35 Ack=35 Win=64256 Len=17 TSval=1047261170 TSecr=3171520871
1711548510.588397503    42 0.515441154    10.10.1.1 → 10.10.1.2    TCP 83 8081 → 39790 [PSH, ACK] Seq=35 Ack=52 Win=65152 Len=17 TSval=3171520881 TSecr=1047261170
1711548515.588397503    47 0.525597893    10.10.1.2 → 10.10.1.1    TCP 83 39790 → 8081 [PSH, ACK] Seq=52 Ack=52 Win=64256 Len=17 TSval=1047261180 TSecr=3171520881
1711548518.588397503    50 0.525635910    10.10.1.1 → 10.10.1.2    TCP 83 8081 → 39790 [PSH, ACK] Seq=52 Ack=69 Win=65152 Len=17 TSval=3171520891 TSecr=1047261180
1711548523.588397503    55 0.535791645    10.10.1.2 → 10.10.1.1    TCP 83 39790 → 8081 [PSH, ACK] Seq=69 Ack=69 Win=64256 Len=17 TSval=1047261191 TSecr=3171520891
1711548526.588397503    58 0.535825783    10.10.1.1 → 10.10.1.2    TCP 83 8081 → 39790 [PSH, ACK] Seq=69 Ack=86 Win=65152 Len=17 TSval=3171520901 TSecr=1047261191
1711548531.588397503    63 0.545982465    10.10.1.2 → 10.10.1.1    TCP 83 39790 → 8081 [PSH, ACK] Seq=86 Ack=86 Win=64256 Len=17 TSval=1047261201 TSecr=3171520901
1711548533.588397503    65 0.546018047    10.10.1.1 → 10.10.1.2    TCP 83 8081 → 39790 [PSH, ACK] Seq=86 Ack=103 Win=65152 Len=17 TSval=3171520912 TSecr=1047261201
1711548539.588397503    71 0.556172961    10.10.1.2 → 10.10.1.1    TCP 83 39790 → 8081 [PSH, ACK] Seq=103 Ack=103 Win=64256 Len=17 TSval=1047261211 TSecr=3171520912
1711548541.588397503    73 0.556207214    10.10.1.1 → 10.10.1.2    TCP 83 8081 → 39790 [PSH, ACK] Seq=103 Ack=120 Win=65152 Len=17 TSval=3171520922 TSecr=1047261211
1711548547.588397503    79 0.566363065    10.10.1.2 → 10.10.1.1    TCP 83 39790 → 8081 [PSH, ACK] Seq=120 Ack=120 Win=64256 Len=17 TSval=1047261221 TSecr=3171520922
1711548549.588397503    81 0.566397407    10.10.1.1 → 10.10.1.2    TCP 83 8081 → 39790 [PSH, ACK] Seq=120 Ack=137 Win=65152 Len=17 TSval=3171520932 TSecr=1047261221
1711548555.588397503    87 0.576553360    10.10.1.2 → 10.10.1.1    TCP 83 39790 → 8081 [PSH, ACK] Seq=137 Ack=137 Win=64256 Len=17 TSval=1047261231 TSecr=3171520932
1711548557.588397503    89 0.576586419    10.10.1.1 → 10.10.1.2    TCP 83 8081 → 39790 [PSH, ACK] Seq=137 Ack=154 Win=65152 Len=17 TSval=3171520942 TSecr=1047261231
1711548563.588397503    95 0.586743995    10.10.1.2 → 10.10.1.1    TCP 83 39790 → 8081 [PSH, ACK] Seq=154 Ack=154 Win=64256 Len=17 TSval=1047261242 TSecr=3171520942
1711548565.588397503    97 0.586781346    10.10.1.1 → 10.10.1.2    TCP 83 8081 → 39790 [PSH, ACK] Seq=154 Ack=171 Win=65152 Len=17 TSval=3171520952 TSecr=1047261242
1711548571.588397503   103 0.596936393    10.10.1.2 → 10.10.1.1    TCP 83 39790 → 8081 [PSH, ACK] Seq=171 Ack=171 Win=64256 Len=17 TSval=1047261252 TSecr=3171520952
1711548573.588397503   105 0.596970228    10.10.1.1 → 10.10.1.2    TCP 83 8081 → 39790 [PSH, ACK] Seq=171 Ack=188 Win=65152 Len=17 TSval=3171520962 TSecr=1047261252
1711548579.588397503   111 0.607127759    10.10.1.2 → 10.10.1.1    TCP 83 39790 → 8081 [PSH, ACK] Seq=188 Ack=188 Win=64256 Len=17 TSval=1047261262 TSecr=3171520962
1711548581.588397503   113 0.607161736    10.10.1.1 → 10.10.1.2    TCP 83 8081 → 39790 [PSH, ACK] Seq=188 Ack=205 Win=65152 Len=17 TSval=3171520973 TSecr=1047261262
1711548587.588397503   119 0.617317632    10.10.1.2 → 10.10.1.1    TCP 83 39790 → 8081 [PSH, ACK] Seq=205 Ack=205 Win=64256 Len=17 TSval=1047261272 TSecr=3171520973
1711548589.588397503   121 0.617351893    10.10.1.1 → 10.10.1.2    TCP 83 8081 → 39790 [PSH, ACK] Seq=205 Ack=222 Win=65152 Len=17 TSval=3171520983 TSecr=1047261272
1711548595.588397503   127 0.627507260    10.10.1.2 → 10.10.1.1    TCP 83 39790 → 8081 [PSH, ACK] Seq=222 Ack=222 Win=64256 Len=17 TSval=1047261282 TSecr=3171520983
1711548597.588397503   129 0.627542883    10.10.1.1 → 10.10.1.2    TCP 83 8081 → 39790 [PSH, ACK] Seq=222 Ack=239 Win=65152 Len=17 TSval=3171520993 TSecr=1047261282
1711548603.588397503   135 0.637698877    10.10.1.2 → 10.10.1.1    TCP 83 39790 → 8081 [PSH, ACK] Seq=239 Ack=239 Win=64256 Len=17 TSval=1047261293 TSecr=3171520993
1711548605.588397503   137 0.637734797    10.10.1.1 → 10.10.1.2    TCP 83 8081 → 39790 [PSH, ACK] Seq=239 Ack=256 Win=65152 Len=17 TSval=3171521003 TSecr=1047261293
1711548611.588397503   143 0.647889394    10.10.1.2 → 10.10.1.1    TCP 83 39790 → 8081 [PSH, ACK] Seq=256 Ack=256 Win=64256 Len=17 TSval=1047261303 TSecr=3171521003
1711548613.588397503   145 0.647922556    10.10.1.1 → 10.10.1.2    TCP 83 8081 → 39790 [PSH, ACK] Seq=256 Ack=273 Win=65152 Len=17 TSval=3171521013 TSecr=1047261303
1711548619.588397503   151 0.658077003    10.10.1.2 → 10.10.1.1    TCP 83 39790 → 8081 [PSH, ACK] Seq=273 Ack=273 Win=64256 Len=17 TSval=1047261313 TSecr=3171521013
1711548621.588397503   153 0.658109629    10.10.1.1 → 10.10.1.2    TCP 83 8081 → 39790 [PSH, ACK] Seq=273 Ack=290 Win=65152 Len=17 TSval=3171521024 TSecr=1047261313
1711548627.588397503   159 0.668265428    10.10.1.2 → 10.10.1.1    TCP 83 39790 → 8081 [PSH, ACK] Seq=290 Ack=290 Win=64256 Len=17 TSval=1047261323 TSecr=3171521024
1711548629.588397503   161 0.668303670    10.10.1.1 → 10.10.1.2    TCP 83 8081 → 39790 [PSH, ACK] Seq=290 Ack=307 Win=65152 Len=17 TSval=3171521034 TSecr=1047261323
1711548635.588397503   167 0.678460522    10.10.1.2 → 10.10.1.1    TCP 83 39790 → 8081 [PSH, ACK] Seq=307 Ack=307 Win=64256 Len=17 TSval=1047261333 TSecr=3171521034
1711548637.588397503   169 0.678497894    10.10.1.1 → 10.10.1.2    TCP 83 8081 → 39790 [PSH, ACK] Seq=307 Ack=324 Win=65152 Len=17 TSval=3171521044 TSecr=1047261333
1711548643.588397503   175 0.688643521    10.10.1.2 → 10.10.1.1    TCP 83 39790 → 8081 [PSH, ACK] Seq=324 Ack=324 Win=64256 Len=17 TSval=1047261344 TSecr=3171521044
1711548645.588397503   177 0.688678049    10.10.1.1 → 10.10.1.2    TCP 83 8081 → 39790 [PSH, ACK] Seq=324 Ack=341 Win=65152 Len=17 TSval=3171521054 TSecr=1047261344
1711548651.588397503   183 0.698837353    10.10.1.2 → 10.10.1.1    TCP 83 39790 → 8081 [PSH, ACK] Seq=341 Ack=341 Win=64256 Len=17 TSval=1047261354 TSecr=3171521054
1711548653.588397503   185 0.698885750    10.10.1.1 → 10.10.1.2    TCP 83 8081 → 39790 [PSH, ACK] Seq=341 Ack=358 Win=65152 Len=17 TSval=3171521064 TSecr=1047261354
1711548659.588397503   191 0.709041725    10.10.1.2 → 10.10.1.1    TCP 83 39790 → 8081 [PSH, ACK] Seq=358 Ack=358 Win=64256 Len=17 TSval=1047261364 TSecr=3171521064
1711548661.588397503   193 0.709081898    10.10.1.1 → 10.10.1.2    TCP 83 8081 → 39790 [PSH, ACK] Seq=358 Ack=375 Win=65152 Len=17 TSval=3171521075 TSecr=1047261364
1711548667.588397503   199 0.719235750    10.10.1.2 → 10.10.1.1    TCP 83 39790 → 8081 [PSH, ACK] Seq=375 Ack=375 Win=64256 Len=17 TSval=1047261374 TSecr=3171521075
1711548669.588397503   201 0.719271731    10.10.1.1 → 10.10.1.2    TCP 83 8081 → 39790 [PSH, ACK] Seq=375 Ack=392 Win=65152 Len=17 TSval=3171521085 TSecr=1047261374
1711548675.588397503   207 0.729425959    10.10.1.2 → 10.10.1.1    TCP 83 39790 → 8081 [PSH, ACK] Seq=392 Ack=392 Win=64256 Len=17 TSval=1047261384 TSecr=3171521085
1711548677.588397503   209 0.729461759    10.10.1.1 → 10.10.1.2    TCP 83 8081 → 39790 [PSH, ACK] Seq=392 Ack=409 Win=65152 Len=17 TSval=3171521095 TSecr=1047261384
1711548683.588397503   215 0.739619690    10.10.1.2 → 10.10.1.1    TCP 83 39790 → 8081 [PSH, ACK] Seq=409 Ack=409 Win=64256 Len=17 TSval=1047261394 TSecr=3171521095
1711548685.588397503   217 0.739654043    10.10.1.1 → 10.10.1.2    TCP 83 8081 → 39790 [PSH, ACK] Seq=409 Ack=426 Win=65152 Len=17 TSval=3171521105 TSecr=1047261394
1711548691.588397503   223 0.749809174    10.10.1.2 → 10.10.1.1    TCP 83 39790 → 8081 [PSH, ACK] Seq=426 Ack=426 Win=64256 Len=17 TSval=1047261405 TSecr=3171521105
1711548693.588397503   225 0.749846344    10.10.1.1 → 10.10.1.2    TCP 83 8081 → 39790 [PSH, ACK] Seq=426 Ack=443 Win=65152 Len=17 TSval=3171521115 TSecr=1047261405
1711548699.588397503   231 0.760003826    10.10.1.2 → 10.10.1.1    TCP 83 39790 → 8081 [PSH, ACK] Seq=443 Ack=443 Win=64256 Len=17 TSval=1047261415 TSecr=3171521115
1711548701.588397503   233 0.760037415    10.10.1.1 → 10.10.1.2    TCP 83 8081 → 39790 [PSH, ACK] Seq=443 Ack=460 Win=65152 Len=17 TSval=3171521126 TSecr=1047261415
1711548707.588397503   239 0.770192999    10.10.1.2 → 10.10.1.1    TCP 83 39790 → 8081 [PSH, ACK] Seq=460 Ack=460 Win=64256 Len=17 TSval=1047261425 TSecr=3171521126
1711548709.588397503   241 0.770226752    10.10.1.1 → 10.10.1.2    TCP 83 8081 → 39790 [PSH, ACK] Seq=460 Ack=477 Win=65152 Len=17 TSval=3171521136 TSecr=1047261425
1711548715.588397503   247 0.780382394    10.10.1.2 → 10.10.1.1    TCP 83 39790 → 8081 [PSH, ACK] Seq=477 Ack=477 Win=64256 Len=17 TSval=1047261435 TSecr=3171521136
1711548717.588397503   249 0.780417200    10.10.1.1 → 10.10.1.2    TCP 83 8081 → 39790 [PSH, ACK] Seq=477 Ack=494 Win=65152 Len=17 TSval=3171521146 TSecr=1047261435
1711548723.588397503   255 0.790571532    10.10.1.2 → 10.10.1.1    TCP 83 39790 → 8081 [PSH, ACK] Seq=494 Ack=494 Win=64256 Len=17 TSval=1047261445 TSecr=3171521146
1711548725.588397503   257 0.790604696    10.10.1.1 → 10.10.1.2    TCP 83 8081 → 39790 [PSH, ACK] Seq=494 Ack=511 Win=65152 Len=17 TSval=3171521156 TSecr=1047261445
1711548731.588397503   263 0.800760133    10.10.1.2 → 10.10.1.1    TCP 83 39790 → 8081 [PSH, ACK] Seq=511 Ack=511 Win=64256 Len=17 TSval=1047261456 TSecr=3171521156
1711548733.588397503   265 0.800794484    10.10.1.1 → 10.10.1.2    TCP 83 8081 → 39790 [PSH, ACK] Seq=511 Ack=528 Win=65152 Len=17 TSval=3171521166 TSecr=1047261456
1711548739.588397503   271 0.810949388    10.10.1.2 → 10.10.1.1    TCP 83 39790 → 8081 [PSH, ACK] Seq=528 Ack=528 Win=64256 Len=17 TSval=1047261466 TSecr=3171521166
1711548741.588397503   273 0.810983004    10.10.1.1 → 10.10.1.2    TCP 83 8081 → 39790 [PSH, ACK] Seq=528 Ack=545 Win=65152 Len=17 TSval=3171521177 TSecr=1047261466
1711548747.588397503   279 0.821139961    10.10.1.2 → 10.10.1.1    TCP 83 39790 → 8081 [PSH, ACK] Seq=545 Ack=545 Win=64256 Len=17 TSval=1047261476 TSecr=3171521177
1711548749.588397503   281 0.821174318    10.10.1.1 → 10.10.1.2    TCP 83 8081 → 39790 [PSH, ACK] Seq=545 Ack=562 Win=65152 Len=17 TSval=3171521187 TSecr=1047261476
1711548755.588397503   287 0.831331081    10.10.1.2 → 10.10.1.1    TCP 83 39790 → 8081 [PSH, ACK] Seq=562 Ack=562 Win=64256 Len=17 TSval=1047261486 TSecr=3171521187
1711548757.588397503   289 0.831364972    10.10.1.1 → 10.10.1.2    TCP 83 8081 → 39790 [PSH, ACK] Seq=562 Ack=579 Win=65152 Len=17 TSval=3171521197 TSecr=1047261486
1711548763.588397503   295 0.841521609    10.10.1.2 → 10.10.1.1    TCP 83 39790 → 8081 [PSH, ACK] Seq=579 Ack=579 Win=64256 Len=17 TSval=1047261496 TSecr=3171521197
1711548765.588397503   297 0.841559191    10.10.1.1 → 10.10.1.2    TCP 83 8081 → 39790 [PSH, ACK] Seq=579 Ack=596 Win=65152 Len=17 TSval=3171521207 TSecr=1047261496
1711548771.588397503   303 0.851713925    10.10.1.2 → 10.10.1.1    TCP 83 39790 → 8081 [PSH, ACK] Seq=596 Ack=596 Win=64256 Len=17 TSval=1047261507 TSecr=3171521207
1711548773.588397503   305 0.851747791    10.10.1.1 → 10.10.1.2    TCP 83 8081 → 39790 [PSH, ACK] Seq=596 Ack=613 Win=65152 Len=17 TSval=3171521217 TSecr=1047261507
1711548779.588397503   311 0.861902839    10.10.1.2 → 10.10.1.1    TCP 83 39790 → 8081 [PSH, ACK] Seq=613 Ack=613 Win=64256 Len=17 TSval=1047261517 TSecr=3171521217
1711548781.588397503   313 0.861939782    10.10.1.1 → 10.10.1.2    TCP 83 8081 → 39790 [PSH, ACK] Seq=613 Ack=630 Win=65152 Len=17 TSval=3171521227 TSecr=1047261517
1711548787.588397503   319 0.872095029    10.10.1.2 → 10.10.1.1    TCP 83 39790 → 8081 [PSH, ACK] Seq=630 Ack=630 Win=64256 Len=17 TSval=1047261527 TSecr=3171521227
1711548789.588397503   321 0.872131395    10.10.1.1 → 10.10.1.2    TCP 83 8081 → 39790 [PSH, ACK] Seq=630 Ack=647 Win=65152 Len=17 TSval=3171521238 TSecr=1047261527
1711548795.588397503   327 0.882286386    10.10.1.2 → 10.10.1.1    TCP 83 39790 → 8081 [PSH, ACK] Seq=647 Ack=647 Win=64256 Len=17 TSval=1047261537 TSecr=3171521238
1711548797.588397503   329 0.882320027    10.10.1.1 → 10.10.1.2    TCP 83 8081 → 39790 [PSH, ACK] Seq=647 Ack=664 Win=65152 Len=17 TSval=3171521248 TSecr=1047261537
1711548803.588397503   335 0.892477083    10.10.1.2 → 10.10.1.1    TCP 83 39790 → 8081 [PSH, ACK] Seq=664 Ack=664 Win=64256 Len=17 TSval=1047261547 TSecr=3171521248
1711548805.588397503   337 0.892511698    10.10.1.1 → 10.10.1.2    TCP 83 8081 → 39790 [PSH, ACK] Seq=664 Ack=681 Win=65152 Len=17 TSval=3171521258 TSecr=1047261547
1711548811.588397503   343 0.902667595    10.10.1.2 → 10.10.1.1    TCP 83 39790 → 8081 [PSH, ACK] Seq=681 Ack=681 Win=64256 Len=17 TSval=1047261558 TSecr=3171521258
1711548813.588397503   345 0.902701795    10.10.1.1 → 10.10.1.2    TCP 83 8081 → 39790 [PSH, ACK] Seq=681 Ack=698 Win=65152 Len=17 TSval=3171521268 TSecr=1047261558
1711548819.588397503   351 0.912857419    10.10.1.2 → 10.10.1.1    TCP 83 39790 → 8081 [PSH, ACK] Seq=698 Ack=698 Win=64256 Len=17 TSval=1047261568 TSecr=3171521268
1711548821.588397503   353 0.912891543    10.10.1.1 → 10.10.1.2    TCP 83 8081 → 39790 [PSH, ACK] Seq=698 Ack=715 Win=65152 Len=17 TSval=3171521278 TSecr=1047261568
1711548827.588397503   359 0.923048360    10.10.1.2 → 10.10.1.1    TCP 83 39790 → 8081 [PSH, ACK] Seq=715 Ack=715 Win=64256 Len=17 TSval=1047261578 TSecr=3171521278
1711548829.588397503   361 0.923085620    10.10.1.1 → 10.10.1.2    TCP 83 8081 → 39790 [PSH, ACK] Seq=715 Ack=732 Win=65152 Len=17 TSval=3171521289 TSecr=1047261578
1711548835.588397503   367 0.933242130    10.10.1.2 → 10.10.1.1    TCP 83 39790 → 8081 [PSH, ACK] Seq=732 Ack=732 Win=64256 Len=17 TSval=1047261588 TSecr=3171521289
1711548837.588397503   369 0.933275953    10.10.1.1 → 10.10.1.2    TCP 83 8081 → 39790 [PSH, ACK] Seq=732 Ack=749 Win=65152 Len=17 TSval=3171521299 TSecr=1047261588
1711548843.588397503   375 0.943430657    10.10.1.2 → 10.10.1.1    TCP 83 39790 → 8081 [PSH, ACK] Seq=749 Ack=749 Win=64256 Len=17 TSval=1047261598 TSecr=3171521299
1711548845.588397503   377 0.943464365    10.10.1.1 → 10.10.1.2    TCP 83 8081 → 39790 [PSH, ACK] Seq=749 Ack=766 Win=65152 Len=17 TSval=3171521309 TSecr=1047261598
1711548851.588397503   383 0.953618942    10.10.1.2 → 10.10.1.1    TCP 83 39790 → 8081 [PSH, ACK] Seq=766 Ack=766 Win=64256 Len=17 TSval=1047261608 TSecr=3171521309
1711548853.588397503   385 0.953652379    10.10.1.1 → 10.10.1.2    TCP 83 8081 → 39790 [PSH, ACK] Seq=766 Ack=783 Win=65152 Len=17 TSval=3171521319 TSecr=1047261608
1711548859.588397503   391 0.963808612    10.10.1.2 → 10.10.1.1    TCP 83 39790 → 8081 [PSH, ACK] Seq=783 Ack=783 Win=64256 Len=17 TSval=1047261619 TSecr=3171521319
1711548861.588397503   393 0.963842784    10.10.1.1 → 10.10.1.2    TCP 83 8081 → 39790 [PSH, ACK] Seq=783 Ack=800 Win=65152 Len=17 TSval=3171521329 TSecr=1047261619
1711548867.588397503   399 0.973998111    10.10.1.2 → 10.10.1.1    TCP 83 39790 → 8081 [PSH, ACK] Seq=800 Ack=800 Win=64256 Len=17 TSval=1047261629 TSecr=3171521329
1711548869.588397503   401 0.974032757    10.10.1.1 → 10.10.1.2    TCP 83 8081 → 39790 [PSH, ACK] Seq=800 Ack=817 Win=65152 Len=17 TSval=3171521340 TSecr=1047261629
1711548875.588397503   407 0.984186499    10.10.1.2 → 10.10.1.1    TCP 83 39790 → 8081 [PSH, ACK] Seq=817 Ack=817 Win=64256 Len=17 TSval=1047261639 TSecr=3171521340
1711548877.588397503   409 0.984223069    10.10.1.1 → 10.10.1.2    TCP 83 8081 → 39790 [PSH, ACK] Seq=817 Ack=834 Win=65152 Len=17 TSval=3171521350 TSecr=1047261639
1711548883.588397503   415 0.994377759    10.10.1.2 → 10.10.1.1    TCP 83 39790 → 8081 [PSH, ACK] Seq=834 Ack=834 Win=64256 Len=17 TSval=1047261649 TSecr=3171521350
1711548885.588397503   417 0.994415240    10.10.1.1 → 10.10.1.2    TCP 83 8081 → 39790 [PSH, ACK] Seq=834 Ack=851 Win=65152 Len=17 TSval=3171521360 TSecr=1047261649
1711548891.588397503   423 1.004569908    10.10.1.2 → 10.10.1.1    TCP 83 39790 → 8081 [PSH, ACK] Seq=851 Ack=851 Win=64256 Len=17 TSval=1047261659 TSecr=3171521360
1711548893.588397503   425 1.004604169    10.10.1.1 → 10.10.1.2    TCP 83 8081 → 39790 [PSH, ACK] Seq=851 Ack=868 Win=65152 Len=17 TSval=3171521370 TSecr=1047261659
1711548899.588397503   431 1.014765348    10.10.1.2 → 10.10.1.1    TCP 83 39790 → 8081 [PSH, ACK] Seq=868 Ack=868 Win=64256 Len=17 TSval=1047261670 TSecr=3171521370
1711548901.588397503   433 1.014799545    10.10.1.1 → 10.10.1.2    TCP 83 8081 → 39790 [PSH, ACK] Seq=868 Ack=885 Win=65152 Len=17 TSval=3171521380 TSecr=1047261670
1711548907.588397503   439 1.024956818    10.10.1.2 → 10.10.1.1    TCP 83 39790 → 8081 [PSH, ACK] Seq=885 Ack=885 Win=64256 Len=17 TSval=1047261680 TSecr=3171521380
1711548909.588397503   441 1.024990929    10.10.1.1 → 10.10.1.2    TCP 83 8081 → 39790 [PSH, ACK] Seq=885 Ack=902 Win=65152 Len=17 TSval=3171521391 TSecr=1047261680
1711548915.588397503   447 1.035145000    10.10.1.2 → 10.10.1.1    TCP 83 39790 → 8081 [PSH, ACK] Seq=902 Ack=902 Win=64256 Len=17 TSval=1047261690 TSecr=3171521391
1711548917.588397503   449 1.035179477    10.10.1.1 → 10.10.1.2    TCP 83 8081 → 39790 [PSH, ACK] Seq=902 Ack=919 Win=65152 Len=17 TSval=3171521401 TSecr=1047261690
1711548923.588397503   455 1.045333779    10.10.1.2 → 10.10.1.1    TCP 83 39790 → 8081 [PSH, ACK] Seq=919 Ack=919 Win=64256 Len=17 TSval=1047261700 TSecr=3171521401
1711548925.588397503   457 1.045368075    10.10.1.1 → 10.10.1.2    TCP 83 8081 → 39790 [PSH, ACK] Seq=919 Ack=936 Win=65152 Len=17 TSval=3171521411 TSecr=1047261700
1711548931.588397503   463 1.055521845    10.10.1.2 → 10.10.1.1    TCP 83 39790 → 8081 [PSH, ACK] Seq=936 Ack=936 Win=64256 Len=17 TSval=1047261710 TSecr=3171521411
1711548933.588397503   465 1.055555425    10.10.1.1 → 10.10.1.2    TCP 83 8081 → 39790 [PSH, ACK] Seq=936 Ack=953 Win=65152 Len=17 TSval=3171521421 TSecr=1047261710
1711548939.588397503   471 1.065711353    10.10.1.2 → 10.10.1.1    TCP 83 39790 → 8081 [PSH, ACK] Seq=953 Ack=953 Win=64256 Len=17 TSval=1047261721 TSecr=3171521421
1711548942.588397503   474 1.066107974    10.10.1.1 → 10.10.1.2    TCP 83 8081 → 39790 [PSH, ACK] Seq=953 Ack=970 Win=65152 Len=17 TSval=3171521432 TSecr=1047261721
1711548947.588397503   479 1.076264882    10.10.1.2 → 10.10.1.1    TCP 83 39790 → 8081 [PSH, ACK] Seq=970 Ack=970 Win=64256 Len=17 TSval=1047261731 TSecr=3171521432
1711548949.588397503   481 1.076303945    10.10.1.1 → 10.10.1.2    TCP 83 8081 → 39790 [PSH, ACK] Seq=970 Ack=987 Win=65152 Len=17 TSval=3171521442 TSecr=1047261731
1711548955.588397503   487 1.086460127    10.10.1.2 → 10.10.1.1    TCP 83 39790 → 8081 [PSH, ACK] Seq=987 Ack=987 Win=64256 Len=17 TSval=1047261741 TSecr=3171521442
1711548957.588397503   489 1.086494573    10.10.1.1 → 10.10.1.2    TCP 83 8081 → 39790 [PSH, ACK] Seq=987 Ack=1004 Win=65152 Len=17 TSval=3171521452 TSecr=1047261741
1711548963.588397503   495 1.096644253    10.10.1.2 → 10.10.1.1    TCP 83 39790 → 8081 [PSH, ACK] Seq=1004 Ack=1004 Win=64256 Len=17 TSval=1047261752 TSecr=3171521452
1711548965.588397503   497 1.096678324    10.10.1.1 → 10.10.1.2    TCP 83 8081 → 39790 [PSH, ACK] Seq=1004 Ack=1021 Win=65152 Len=17 TSval=3171521462 TSecr=1047261752
1711548971.588397503   503 1.106834252    10.10.1.2 → 10.10.1.1    TCP 83 39790 → 8081 [PSH, ACK] Seq=1021 Ack=1021 Win=64256 Len=17 TSval=1047261762 TSecr=3171521462
1711548973.588397503   505 1.106868058    10.10.1.1 → 10.10.1.2    TCP 83 8081 → 39790 [PSH, ACK] Seq=1021 Ack=1038 Win=65152 Len=17 TSval=3171521472 TSecr=1047261762
1711548979.588397503   511 1.117023815    10.10.1.2 → 10.10.1.1    TCP 83 39790 → 8081 [PSH, ACK] Seq=1038 Ack=1038 Win=64256 Len=17 TSval=1047261772 TSecr=3171521472
1711548981.588397503   513 1.117058842    10.10.1.1 → 10.10.1.2    TCP 83 8081 → 39790 [PSH, ACK] Seq=1038 Ack=1055 Win=65152 Len=17 TSval=3171521483 TSecr=1047261772
1711548987.588397503   519 1.127212572    10.10.1.2 → 10.10.1.1    TCP 83 39790 → 8081 [PSH, ACK] Seq=1055 Ack=1055 Win=64256 Len=17 TSval=1047261782 TSecr=3171521483
1711548989.588397503   521 1.127246165    10.10.1.1 → 10.10.1.2    TCP 83 8081 → 39790 [PSH, ACK] Seq=1055 Ack=1072 Win=65152 Len=17 TSval=3171521493 TSecr=1047261782
1711548995.588397503   527 1.137400933    10.10.1.2 → 10.10.1.1    TCP 83 39790 → 8081 [PSH, ACK] Seq=1072 Ack=1072 Win=64256 Len=17 TSval=1047261792 TSecr=3171521493
1711548997.588397503   529 1.137434688    10.10.1.1 → 10.10.1.2    TCP 83 8081 → 39790 [PSH, ACK] Seq=1072 Ack=1089 Win=65152 Len=17 TSval=3171521503 TSecr=1047261792
1711549003.588397503   535 1.147590154    10.10.1.2 → 10.10.1.1    TCP 83 39790 → 8081 [PSH, ACK] Seq=1089 Ack=1089 Win=64256 Len=17 TSval=1047261802 TSecr=3171521503
1711549005.588397503   537 1.147626332    10.10.1.1 → 10.10.1.2    TCP 83 8081 → 39790 [PSH, ACK] Seq=1089 Ack=1106 Win=65152 Len=17 TSval=3171521513 TSecr=1047261802
1711549011.588397503   543 1.157780816    10.10.1.2 → 10.10.1.1    TCP 83 39790 → 8081 [PSH, ACK] Seq=1106 Ack=1106 Win=64256 Len=17 TSval=1047261813 TSecr=3171521513
1711549013.588397503   545 1.157814878    10.10.1.1 → 10.10.1.2    TCP 83 8081 → 39790 [PSH, ACK] Seq=1106 Ack=1123 Win=65152 Len=17 TSval=3171521523 TSecr=1047261813
1711549019.588397503   551 1.167971335    10.10.1.2 → 10.10.1.1    TCP 83 39790 → 8081 [PSH, ACK] Seq=1123 Ack=1123 Win=64256 Len=17 TSval=1047261823 TSecr=3171521523
1711549021.588397503   553 1.168006155    10.10.1.1 → 10.10.1.2    TCP 83 8081 → 39790 [PSH, ACK] Seq=1123 Ack=1140 Win=65152 Len=17 TSval=3171521534 TSecr=1047261823
1711549027.588397503   559 1.178159870    10.10.1.2 → 10.10.1.1    TCP 83 39790 → 8081 [PSH, ACK] Seq=1140 Ack=1140 Win=64256 Len=17 TSval=1047261833 TSecr=3171521534
1711549029.588397503   561 1.178194550    10.10.1.1 → 10.10.1.2    TCP 83 8081 → 39790 [PSH, ACK] Seq=1140 Ack=1157 Win=65152 Len=17 TSval=3171521544 TSecr=1047261833
1711549035.588397503   567 1.188348264    10.10.1.2 → 10.10.1.1    TCP 83 39790 → 8081 [PSH, ACK] Seq=1157 Ack=1157 Win=64256 Len=17 TSval=1047261843 TSecr=3171521544
1711549037.588397503   569 1.188382891    10.10.1.1 → 10.10.1.2    TCP 83 8081 → 39790 [PSH, ACK] Seq=1157 Ack=1174 Win=65152 Len=17 TSval=3171521554 TSecr=1047261843
1711549043.588397503   575 1.198538728    10.10.1.2 → 10.10.1.1    TCP 83 39790 → 8081 [PSH, ACK] Seq=1174 Ack=1174 Win=64256 Len=17 TSval=1047261853 TSecr=3171521554
1711549045.588397503   577 1.198572429    10.10.1.1 → 10.10.1.2    TCP 83 8081 → 39790 [PSH, ACK] Seq=1174 Ack=1191 Win=65152 Len=17 TSval=3171521564 TSecr=1047261853
1711549051.588397503   583 1.208727038    10.10.1.2 → 10.10.1.1    TCP 83 39790 → 8081 [PSH, ACK] Seq=1191 Ack=1191 Win=64256 Len=17 TSval=1047261864 TSecr=3171521564
1711549053.588397503   585 1.208761439    10.10.1.1 → 10.10.1.2    TCP 83 8081 → 39790 [PSH, ACK] Seq=1191 Ack=1208 Win=65152 Len=17 TSval=3171521574 TSecr=1047261864
1711549059.588397503   591 1.218916230    10.10.1.2 → 10.10.1.1    TCP 83 39790 → 8081 [PSH, ACK] Seq=1208 Ack=1208 Win=64256 Len=17 TSval=1047261874 TSecr=3171521574
1711549061.588397503   593 1.218949418    10.10.1.1 → 10.10.1.2    TCP 83 8081 → 39790 [PSH, ACK] Seq=1208 Ack=1225 Win=65152 Len=17 TSval=3171521584 TSecr=1047261874
1711549067.588397503   599 1.229103010    10.10.1.2 → 10.10.1.1    TCP 83 39790 → 8081 [PSH, ACK] Seq=1225 Ack=1225 Win=64256 Len=17 TSval=1047261884 TSecr=3171521584
1711549069.588397503   601 1.229138167    10.10.1.1 → 10.10.1.2    TCP 83 8081 → 39790 [PSH, ACK] Seq=1225 Ack=1242 Win=65152 Len=17 TSval=3171521595 TSecr=1047261884
1711549075.588397503   607 1.239294181    10.10.1.2 → 10.10.1.1    TCP 83 39790 → 8081 [PSH, ACK] Seq=1242 Ack=1242 Win=64256 Len=17 TSval=1047261894 TSecr=3171521595
1711549077.588397503   609 1.239328452    10.10.1.1 → 10.10.1.2    TCP 83 8081 → 39790 [PSH, ACK] Seq=1242 Ack=1259 Win=65152 Len=17 TSval=3171521605 TSecr=1047261894
1711549083.588397503   615 1.249483834    10.10.1.2 → 10.10.1.1    TCP 83 39790 → 8081 [PSH, ACK] Seq=1259 Ack=1259 Win=64256 Len=17 TSval=1047261904 TSecr=3171521605
1711549085.588397503   617 1.249518210    10.10.1.1 → 10.10.1.2    TCP 83 8081 → 39790 [PSH, ACK] Seq=1259 Ack=1276 Win=65152 Len=17 TSval=3171521615 TSecr=1047261904
1711549091.588397503   623 1.259673287    10.10.1.2 → 10.10.1.1    TCP 83 39790 → 8081 [PSH, ACK] Seq=1276 Ack=1276 Win=64256 Len=17 TSval=1047261915 TSecr=3171521615
1711549093.588397503   625 1.259707607    10.10.1.1 → 10.10.1.2    TCP 83 8081 → 39790 [PSH, ACK] Seq=1276 Ack=1293 Win=65152 Len=17 TSval=3171521625 TSecr=1047261915
1711549099.588397503   631 1.269862813    10.10.1.2 → 10.10.1.1    TCP 83 39790 → 8081 [PSH, ACK] Seq=1293 Ack=1293 Win=64256 Len=17 TSval=1047261925 TSecr=3171521625
1711549101.588397503   633 1.269896427    10.10.1.1 → 10.10.1.2    TCP 83 8081 → 39790 [PSH, ACK] Seq=1293 Ack=1310 Win=65152 Len=17 TSval=3171521635 TSecr=1047261925
1711549107.588397503   639 1.280052283    10.10.1.2 → 10.10.1.1    TCP 83 39790 → 8081 [PSH, ACK] Seq=1310 Ack=1310 Win=64256 Len=17 TSval=1047261935 TSecr=3171521635
1711549109.588397503   641 1.280086239    10.10.1.1 → 10.10.1.2    TCP 83 8081 → 39790 [PSH, ACK] Seq=1310 Ack=1327 Win=65152 Len=17 TSval=3171521646 TSecr=1047261935
1711549115.588397503   647 1.290242450    10.10.1.2 → 10.10.1.1    TCP 83 39790 → 8081 [PSH, ACK] Seq=1327 Ack=1327 Win=64256 Len=17 TSval=1047261945 TSecr=3171521646
1711549117.588397503   649 1.290276503    10.10.1.1 → 10.10.1.2    TCP 83 8081 → 39790 [PSH, ACK] Seq=1327 Ack=1344 Win=65152 Len=17 TSval=3171521656 TSecr=1047261945
1711549123.588397503   655 1.300432436    10.10.1.2 → 10.10.1.1    TCP 83 39790 → 8081 [PSH, ACK] Seq=1344 Ack=1344 Win=64256 Len=17 TSval=1047261955 TSecr=3171521656
1711549125.588397503   657 1.300465925    10.10.1.1 → 10.10.1.2    TCP 83 8081 → 39790 [PSH, ACK] Seq=1344 Ack=1361 Win=65152 Len=17 TSval=3171521666 TSecr=1047261955
1711549131.588397503   663 1.310601567    10.10.1.2 → 10.10.1.1    TCP 83 39790 → 8081 [PSH, ACK] Seq=1361 Ack=1361 Win=64256 Len=17 TSval=1047261965 TSecr=3171521666
1711549133.588397503   665 1.310639280    10.10.1.1 → 10.10.1.2    TCP 83 8081 → 39790 [PSH, ACK] Seq=1361 Ack=1378 Win=65152 Len=17 TSval=3171521676 TSecr=1047261965
1711549139.588397503   671 1.320794629    10.10.1.2 → 10.10.1.1    TCP 83 39790 → 8081 [PSH, ACK] Seq=1378 Ack=1378 Win=64256 Len=17 TSval=1047261976 TSecr=3171521676
1711549141.588397503   673 1.320828146    10.10.1.1 → 10.10.1.2    TCP 83 8081 → 39790 [PSH, ACK] Seq=1378 Ack=1395 Win=65152 Len=17 TSval=3171521686 TSecr=1047261976
1711549147.588397503   679 1.330985049    10.10.1.2 → 10.10.1.1    TCP 83 39790 → 8081 [PSH, ACK] Seq=1395 Ack=1395 Win=64256 Len=17 TSval=1047261986 TSecr=3171521686
1711549149.588397503   681 1.331018820    10.10.1.1 → 10.10.1.2    TCP 83 8081 → 39790 [PSH, ACK] Seq=1395 Ack=1412 Win=65152 Len=17 TSval=3171521697 TSecr=1047261986
1711549155.588397503   687 1.341173640    10.10.1.2 → 10.10.1.1    TCP 83 39790 → 8081 [PSH, ACK] Seq=1412 Ack=1412 Win=64256 Len=17 TSval=1047261996 TSecr=3171521697
1711549157.588397503   689 1.341210227    10.10.1.1 → 10.10.1.2    TCP 83 8081 → 39790 [PSH, ACK] Seq=1412 Ack=1429 Win=65152 Len=17 TSval=3171521707 TSecr=1047261996
1711549163.588397503   695 1.351365635    10.10.1.2 → 10.10.1.1    TCP 83 39790 → 8081 [PSH, ACK] Seq=1429 Ack=1429 Win=64256 Len=17 TSval=1047262006 TSecr=3171521707
1711549165.588397503   697 1.351399790    10.10.1.1 → 10.10.1.2    TCP 83 8081 → 39790 [PSH, ACK] Seq=1429 Ack=1446 Win=65152 Len=17 TSval=3171521717 TSecr=1047262006
1711549171.588397503   703 1.361555226    10.10.1.2 → 10.10.1.1    TCP 83 39790 → 8081 [PSH, ACK] Seq=1446 Ack=1446 Win=64256 Len=17 TSval=1047262016 TSecr=3171521717
1711549173.588397503   705 1.361588613    10.10.1.1 → 10.10.1.2    TCP 83 8081 → 39790 [PSH, ACK] Seq=1446 Ack=1463 Win=65152 Len=17 TSval=3171521727 TSecr=1047262016
1711549179.588397503   711 1.371744200    10.10.1.2 → 10.10.1.1    TCP 83 39790 → 8081 [PSH, ACK] Seq=1463 Ack=1463 Win=64256 Len=17 TSval=1047262027 TSecr=3171521727
1711549181.588397503   713 1.371778614    10.10.1.1 → 10.10.1.2    TCP 83 8081 → 39790 [PSH, ACK] Seq=1463 Ack=1480 Win=65152 Len=17 TSval=3171521737 TSecr=1047262027
1711549187.588397503   719 1.381932383    10.10.1.2 → 10.10.1.1    TCP 83 39790 → 8081 [PSH, ACK] Seq=1480 Ack=1480 Win=64256 Len=17 TSval=1047262037 TSecr=3171521737
1711549189.588397503   721 1.381965895    10.10.1.1 → 10.10.1.2    TCP 83 8081 → 39790 [PSH, ACK] Seq=1480 Ack=1497 Win=65152 Len=17 TSval=3171521747 TSecr=1047262037
1711549195.588397503   727 1.392122013    10.10.1.2 → 10.10.1.1    TCP 83 39790 → 8081 [PSH, ACK] Seq=1497 Ack=1497 Win=64256 Len=17 TSval=1047262047 TSecr=3171521747
1711549197.588397503   729 1.392155530    10.10.1.1 → 10.10.1.2    TCP 83 8081 → 39790 [PSH, ACK] Seq=1497 Ack=1514 Win=65152 Len=17 TSval=3171521758 TSecr=1047262047
1711549203.588397503   735 1.402311026    10.10.1.2 → 10.10.1.1    TCP 83 39790 → 8081 [PSH, ACK] Seq=1514 Ack=1514 Win=64256 Len=17 TSval=1047262057 TSecr=3171521758
1711549205.588397503   737 1.402344659    10.10.1.1 → 10.10.1.2    TCP 83 8081 → 39790 [PSH, ACK] Seq=1514 Ack=1531 Win=65152 Len=17 TSval=3171521768 TSecr=1047262057
1711549211.588397503   743 1.412500097    10.10.1.2 → 10.10.1.1    TCP 83 39790 → 8081 [PSH, ACK] Seq=1531 Ack=1531 Win=64256 Len=17 TSval=1047262067 TSecr=3171521768
1711549213.588397503   745 1.412534087    10.10.1.1 → 10.10.1.2    TCP 83 8081 → 39790 [PSH, ACK] Seq=1531 Ack=1548 Win=65152 Len=17 TSval=3171521778 TSecr=1047262067
1711549219.588397503   751 1.422688987    10.10.1.2 → 10.10.1.1    TCP 83 39790 → 8081 [PSH, ACK] Seq=1548 Ack=1548 Win=64256 Len=17 TSval=1047262078 TSecr=3171521778
1711549221.588397503   753 1.422722286    10.10.1.1 → 10.10.1.2    TCP 83 8081 → 39790 [PSH, ACK] Seq=1548 Ack=1565 Win=65152 Len=17 TSval=3171521788 TSecr=1047262078
1711549227.588397503   759 1.432877349    10.10.1.2 → 10.10.1.1    TCP 83 39790 → 8081 [PSH, ACK] Seq=1565 Ack=1565 Win=64256 Len=17 TSval=1047262088 TSecr=3171521788
1711549229.588397503   761 1.432909955    10.10.1.1 → 10.10.1.2    TCP 83 8081 → 39790 [PSH, ACK] Seq=1565 Ack=1582 Win=65152 Len=17 TSval=3171521798 TSecr=1047262088
1711549235.588397503   767 1.443065749    10.10.1.2 → 10.10.1.1    TCP 83 39790 → 8081 [PSH, ACK] Seq=1582 Ack=1582 Win=64256 Len=17 TSval=1047262098 TSecr=3171521798
1711549237.588397503   769 1.443099554    10.10.1.1 → 10.10.1.2    TCP 83 8081 → 39790 [PSH, ACK] Seq=1582 Ack=1599 Win=65152 Len=17 TSval=3171521809 TSecr=1047262098
1711549243.588397503   775 1.453253884    10.10.1.2 → 10.10.1.1    TCP 83 39790 → 8081 [PSH, ACK] Seq=1599 Ack=1599 Win=64256 Len=17 TSval=1047262108 TSecr=3171521809
1711549245.588397503   777 1.453290033    10.10.1.1 → 10.10.1.2    TCP 83 8081 → 39790 [PSH, ACK] Seq=1599 Ack=1616 Win=65152 Len=17 TSval=3171521819 TSecr=1047262108
1711549251.588397503   783 1.463444422    10.10.1.2 → 10.10.1.1    TCP 83 39790 → 8081 [PSH, ACK] Seq=1616 Ack=1616 Win=64256 Len=17 TSval=1047262118 TSecr=3171521819
1711549253.588397503   785 1.463481448    10.10.1.1 → 10.10.1.2    TCP 83 8081 → 39790 [PSH, ACK] Seq=1616 Ack=1633 Win=65152 Len=17 TSval=3171521829 TSecr=1047262118
1711549259.588397503   791 1.473637323    10.10.1.2 → 10.10.1.1    TCP 83 39790 → 8081 [PSH, ACK] Seq=1633 Ack=1633 Win=64256 Len=17 TSval=1047262129 TSecr=3171521829
1711549261.588397503   793 1.473673684    10.10.1.1 → 10.10.1.2    TCP 83 8081 → 39790 [PSH, ACK] Seq=1633 Ack=1650 Win=65152 Len=17 TSval=3171521839 TSecr=1047262129
1711549267.588397503   799 1.483829276    10.10.1.2 → 10.10.1.1    TCP 83 39790 → 8081 [PSH, ACK] Seq=1650 Ack=1650 Win=64256 Len=17 TSval=1047262139 TSecr=3171521839
1711549269.588397503   801 1.483862913    10.10.1.1 → 10.10.1.2    TCP 83 8081 → 39790 [PSH, ACK] Seq=1650 Ack=1667 Win=65152 Len=17 TSval=3171521849 TSecr=1047262139
1711549275.588397503   807 1.494016215    10.10.1.2 → 10.10.1.1    TCP 83 39790 → 8081 [PSH, ACK] Seq=1667 Ack=1667 Win=64256 Len=17 TSval=1047262149 TSecr=3171521849
1711549277.588397503   809 1.494050008    10.10.1.1 → 10.10.1.2    TCP 83 8081 → 39790 [PSH, ACK] Seq=1667 Ack=1684 Win=65152 Len=17 TSval=3171521860 TSecr=1047262149
1711549283.588397503   815 1.504205435    10.10.1.2 → 10.10.1.1    TCP 83 39790 → 8081 [PSH, ACK] Seq=1684 Ack=1684 Win=64256 Len=17 TSval=1047262159 TSecr=3171521860
1711549285.588397503   817 1.504239681    10.10.1.1 → 10.10.1.2    TCP 83 8081 → 39790 [PSH, ACK] Seq=1684 Ack=1701 Win=65152 Len=17 TSval=3171521870 TSecr=1047262159
1711549291.588397503   823 1.514394252    10.10.1.2 → 10.10.1.1    TCP 83 39790 → 8081 [PSH, ACK] Seq=1701 Ack=1701 Win=64256 Len=17 TSval=1047262169 TSecr=3171521870
1711549293.588397503   825 1.514428456    10.10.1.1 → 10.10.1.2    TCP 83 8081 → 39790 [PSH, ACK] Seq=1701 Ack=1718 Win=65152 Len=17 TSval=3171521880 TSecr=1047262169
1711549299.588397503   831 1.524585117    10.10.1.2 → 10.10.1.1    TCP 83 39790 → 8081 [PSH, ACK] Seq=1718 Ack=1718 Win=64256 Len=17 TSval=1047262179 TSecr=3171521880
1711549301.588397503   833 1.524619109    10.10.1.1 → 10.10.1.2    TCP 83 8081 → 39790 [PSH, ACK] Seq=1718 Ack=1735 Win=65152 Len=17 TSval=3171521890 TSecr=1047262179
1711549307.588397503   839 1.534775581    10.10.1.2 → 10.10.1.1    TCP 83 39790 → 8081 [PSH, ACK] Seq=1735 Ack=1735 Win=64256 Len=17 TSval=1047262190 TSecr=3171521890
1711549309.588397503   841 1.534809044    10.10.1.1 → 10.10.1.2    TCP 83 8081 → 39790 [PSH, ACK] Seq=1735 Ack=1752 Win=65152 Len=17 TSval=3171521900 TSecr=1047262190
1711549315.588397503   847 1.544964658    10.10.1.2 → 10.10.1.1    TCP 83 39790 → 8081 [PSH, ACK] Seq=1752 Ack=1752 Win=64256 Len=17 TSval=1047262200 TSecr=3171521900
1711549317.588397503   849 1.544998938    10.10.1.1 → 10.10.1.2    TCP 83 8081 → 39790 [PSH, ACK] Seq=1752 Ack=1769 Win=65152 Len=17 TSval=3171521911 TSecr=1047262200
1711549323.588397503   855 1.555153149    10.10.1.2 → 10.10.1.1    TCP 83 39790 → 8081 [PSH, ACK] Seq=1769 Ack=1769 Win=64256 Len=17 TSval=1047262210 TSecr=3171521911
1711549325.588397503   857 1.555187002    10.10.1.1 → 10.10.1.2    TCP 83 8081 → 39790 [PSH, ACK] Seq=1769 Ack=1786 Win=65152 Len=17 TSval=3171521921 TSecr=1047262210
1711549331.588397503   863 1.565342390    10.10.1.2 → 10.10.1.1    TCP 83 39790 → 8081 [PSH, ACK] Seq=1786 Ack=1786 Win=64256 Len=17 TSval=1047262220 TSecr=3171521921
1711549333.588397503   865 1.565376796    10.10.1.1 → 10.10.1.2    TCP 83 8081 → 39790 [PSH, ACK] Seq=1786 Ack=1803 Win=65152 Len=17 TSval=3171521931 TSecr=1047262220
1711549339.588397503   871 1.575532288    10.10.1.2 → 10.10.1.1    TCP 83 39790 → 8081 [PSH, ACK] Seq=1803 Ack=1803 Win=64256 Len=17 TSval=1047262230 TSecr=3171521931
1711549341.588397503   873 1.575565961    10.10.1.1 → 10.10.1.2    TCP 83 8081 → 39790 [PSH, ACK] Seq=1803 Ack=1820 Win=65152 Len=17 TSval=3171521941 TSecr=1047262230
1711549347.588397503   879 1.585721612    10.10.1.2 → 10.10.1.1    TCP 83 39790 → 8081 [PSH, ACK] Seq=1820 Ack=1820 Win=64256 Len=17 TSval=1047262241 TSecr=3171521941
1711549349.588397503   881 1.585755124    10.10.1.1 → 10.10.1.2    TCP 83 8081 → 39790 [PSH, ACK] Seq=1820 Ack=1837 Win=65152 Len=17 TSval=3171521951 TSecr=1047262241
1711549355.588397503   887 1.595909582    10.10.1.2 → 10.10.1.1    TCP 83 39790 → 8081 [PSH, ACK] Seq=1837 Ack=1837 Win=64256 Len=17 TSval=1047262251 TSecr=3171521951
1711549357.588397503   889 1.595944672    10.10.1.1 → 10.10.1.2    TCP 83 8081 → 39790 [PSH, ACK] Seq=1837 Ack=1854 Win=65152 Len=17 TSval=3171521961 TSecr=1047262251
1711549363.588397503   895 1.606098393    10.10.1.2 → 10.10.1.1    TCP 83 39790 → 8081 [PSH, ACK] Seq=1854 Ack=1854 Win=64256 Len=17 TSval=1047262261 TSecr=3171521961
1711549365.588397503   897 1.606134074    10.10.1.1 → 10.10.1.2    TCP 83 8081 → 39790 [PSH, ACK] Seq=1854 Ack=1871 Win=65152 Len=17 TSval=3171521972 TSecr=1047262261
1711549371.588397503   903 1.616290355    10.10.1.2 → 10.10.1.1    TCP 83 39790 → 8081 [PSH, ACK] Seq=1871 Ack=1871 Win=64256 Len=17 TSval=1047262271 TSecr=3171521972
1711549373.588397503   905 1.616327801    10.10.1.1 → 10.10.1.2    TCP 83 8081 → 39790 [PSH, ACK] Seq=1871 Ack=1888 Win=65152 Len=17 TSval=3171521982 TSecr=1047262271
1711549379.588397503   911 1.626482731    10.10.1.2 → 10.10.1.1    TCP 83 39790 → 8081 [PSH, ACK] Seq=1888 Ack=1888 Win=64256 Len=17 TSval=1047262281 TSecr=3171521982
1711549381.588397503   913 1.626517412    10.10.1.1 → 10.10.1.2    TCP 83 8081 → 39790 [PSH, ACK] Seq=1888 Ack=1905 Win=65152 Len=17 TSval=3171521992 TSecr=1047262281
1711549387.588397503   919 1.636643789    10.10.1.2 → 10.10.1.1    TCP 83 39790 → 8081 [PSH, ACK] Seq=1905 Ack=1905 Win=64256 Len=17 TSval=1047262292 TSecr=3171521992
1711549389.588397503   921 1.636680666    10.10.1.1 → 10.10.1.2    TCP 83 8081 → 39790 [PSH, ACK] Seq=1905 Ack=1922 Win=65152 Len=17 TSval=3171522002 TSecr=1047262292
1711549395.588397503   927 1.646836233    10.10.1.2 → 10.10.1.1    TCP 83 39790 → 8081 [PSH, ACK] Seq=1922 Ack=1922 Win=64256 Len=17 TSval=1047262302 TSecr=3171522002
1711549398.588397503   930 1.646916280    10.10.1.1 → 10.10.1.2    TCP 83 8081 → 39790 [PSH, ACK] Seq=1922 Ack=1939 Win=65152 Len=17 TSval=3171522012 TSecr=1047262302
1711549403.588397503   935 1.657069344    10.10.1.2 → 10.10.1.1    TCP 83 39790 → 8081 [PSH, ACK] Seq=1939 Ack=1939 Win=64256 Len=17 TSval=1047262312 TSecr=3171522012
1711549405.588397503   937 1.657105036    10.10.1.1 → 10.10.1.2    TCP 83 8081 → 39790 [PSH, ACK] Seq=1939 Ack=1956 Win=65152 Len=17 TSval=3171522023 TSecr=1047262312
1711549411.588397503   943 1.667259753    10.10.1.2 → 10.10.1.1    TCP 83 39790 → 8081 [PSH, ACK] Seq=1956 Ack=1956 Win=64256 Len=17 TSval=1047262322 TSecr=3171522023
1711549413.588397503   945 1.667295709    10.10.1.1 → 10.10.1.2    TCP 83 8081 → 39790 [PSH, ACK] Seq=1956 Ack=1973 Win=65152 Len=17 TSval=3171522033 TSecr=1047262322
1711549419.588397503   951 1.677450827    10.10.1.2 → 10.10.1.1    TCP 83 39790 → 8081 [PSH, ACK] Seq=1973 Ack=1973 Win=64256 Len=17 TSval=1047262332 TSecr=3171522033
1711549421.588397503   953 1.677484151    10.10.1.1 → 10.10.1.2    TCP 83 8081 → 39790 [PSH, ACK] Seq=1973 Ack=1990 Win=65152 Len=17 TSval=3171522043 TSecr=1047262332
1711549427.588397503   959 1.687639856    10.10.1.2 → 10.10.1.1    TCP 83 39790 → 8081 [PSH, ACK] Seq=1990 Ack=1990 Win=64256 Len=17 TSval=1047262343 TSecr=3171522043
1711549429.588397503   961 1.687673527    10.10.1.1 → 10.10.1.2    TCP 83 8081 → 39790 [PSH, ACK] Seq=1990 Ack=2007 Win=65152 Len=17 TSval=3171522053 TSecr=1047262343
