1711546258.459599733    28 0.539306954    10.10.1.2 → 10.10.1.1    TCP 83 34754 → 8081 [PSH, ACK] Seq=1 Ack=1 Win=64256 Len=17 TSval=1045023061 TSecr=3169282506
1711546262.459599733    32 0.539657297    10.10.1.1 → 10.10.1.2    TCP 83 8081 → 34754 [PSH, ACK] Seq=1 Ack=18 Win=65152 Len=17 TSval=3169282770 TSecr=1045023061
1711546268.459599733    38 0.573745167    10.10.1.2 → 10.10.1.1    TCP 83 34754 → 8081 [PSH, ACK] Seq=18 Ack=18 Win=64256 Len=17 TSval=1045023095 TSecr=3169282770
1711546271.459599733    41 0.573870192    10.10.1.1 → 10.10.1.2    TCP 83 8081 → 34754 [PSH, ACK] Seq=18 Ack=35 Win=65152 Len=17 TSval=3169282804 TSecr=1045023095
1711546276.459599733    46 0.589947449    10.10.1.2 → 10.10.1.1    TCP 83 34754 → 8081 [PSH, ACK] Seq=35 Ack=35 Win=64256 Len=17 TSval=1045023112 TSecr=3169282804
1711546279.459599733    49 0.590077668    10.10.1.1 → 10.10.1.2    TCP 83 8081 → 34754 [PSH, ACK] Seq=35 Ack=52 Win=65152 Len=17 TSval=3169282820 TSecr=1045023112
1711546284.459599733    54 0.605813029    10.10.1.2 → 10.10.1.1    TCP 83 34754 → 8081 [PSH, ACK] Seq=52 Ack=52 Win=64256 Len=17 TSval=1045023127 TSecr=3169282820
1711546287.459599733    57 0.605942820    10.10.1.1 → 10.10.1.2    TCP 83 8081 → 34754 [PSH, ACK] Seq=52 Ack=69 Win=65152 Len=17 TSval=3169282836 TSecr=1045023127
1711546292.459599733    62 0.609568199    10.10.1.2 → 10.10.1.1    TCP 83 34754 → 8081 [PSH, ACK] Seq=69 Ack=69 Win=64256 Len=17 TSval=1045023131 TSecr=3169282836
1711546295.459599733    65 0.609698962    10.10.1.1 → 10.10.1.2    TCP 83 8081 → 34754 [PSH, ACK] Seq=69 Ack=86 Win=65152 Len=17 TSval=3169282840 TSecr=1045023131
1711546300.459599733    70 0.625706251    10.10.1.2 → 10.10.1.1    TCP 83 34754 → 8081 [PSH, ACK] Seq=86 Ack=86 Win=64256 Len=17 TSval=1045023147 TSecr=3169282840
1711546302.459599733    72 0.625836352    10.10.1.1 → 10.10.1.2    TCP 83 8081 → 34754 [PSH, ACK] Seq=86 Ack=103 Win=65152 Len=17 TSval=3169282856 TSecr=1045023147
1711546308.459599733    78 0.640012885    10.10.1.2 → 10.10.1.1    TCP 83 34754 → 8081 [PSH, ACK] Seq=103 Ack=103 Win=64256 Len=17 TSval=1045023162 TSecr=3169282856
1711546310.459599733    80 0.640143314    10.10.1.1 → 10.10.1.2    TCP 83 8081 → 34754 [PSH, ACK] Seq=103 Ack=120 Win=65152 Len=17 TSval=3169282870 TSecr=1045023162
1711546316.459599733    86 0.649748933    10.10.1.2 → 10.10.1.1    TCP 83 34754 → 8081 [PSH, ACK] Seq=120 Ack=120 Win=64256 Len=17 TSval=1045023171 TSecr=3169282870
1711546318.459599733    88 0.649879869    10.10.1.1 → 10.10.1.2    TCP 83 8081 → 34754 [PSH, ACK] Seq=120 Ack=137 Win=65152 Len=17 TSval=3169282880 TSecr=1045023171
1711546324.459599733    94 0.680224797    10.10.1.2 → 10.10.1.1    TCP 83 34754 → 8081 [PSH, ACK] Seq=137 Ack=137 Win=64256 Len=17 TSval=1045023202 TSecr=3169282880
1711546326.459599733    96 0.680354653    10.10.1.1 → 10.10.1.2    TCP 83 8081 → 34754 [PSH, ACK] Seq=137 Ack=154 Win=65152 Len=17 TSval=3169282910 TSecr=1045023202
1711546332.459599733   102 0.681311531    10.10.1.2 → 10.10.1.1    TCP 83 34754 → 8081 [PSH, ACK] Seq=154 Ack=154 Win=64256 Len=17 TSval=1045023203 TSecr=3169282910
1711546334.459599733   104 0.681436215    10.10.1.1 → 10.10.1.2    TCP 83 8081 → 34754 [PSH, ACK] Seq=154 Ack=171 Win=65152 Len=17 TSval=3169282911 TSecr=1045023203
1711546340.459599733   110 0.684079098    10.10.1.2 → 10.10.1.1    TCP 83 34754 → 8081 [PSH, ACK] Seq=171 Ack=171 Win=64256 Len=17 TSval=1045023206 TSecr=3169282911
1711546342.459599733   112 0.684209012    10.10.1.1 → 10.10.1.2    TCP 83 8081 → 34754 [PSH, ACK] Seq=171 Ack=188 Win=65152 Len=17 TSval=3169282914 TSecr=1045023206
1711546348.459599733   118 0.713713126    10.10.1.2 → 10.10.1.1    TCP 83 34754 → 8081 [PSH, ACK] Seq=188 Ack=188 Win=64256 Len=17 TSval=1045023235 TSecr=3169282914
1711546350.459599733   120 0.713843311    10.10.1.1 → 10.10.1.2    TCP 83 8081 → 34754 [PSH, ACK] Seq=188 Ack=205 Win=65152 Len=17 TSval=3169282944 TSecr=1045023235
1711546356.459599733   126 0.722989676    10.10.1.2 → 10.10.1.1    TCP 83 34754 → 8081 [PSH, ACK] Seq=205 Ack=205 Win=64256 Len=17 TSval=1045023245 TSecr=3169282944
1711546358.459599733   128 0.723120137    10.10.1.1 → 10.10.1.2    TCP 83 8081 → 34754 [PSH, ACK] Seq=205 Ack=222 Win=65152 Len=17 TSval=3169282953 TSecr=1045023245
1711546364.459599733   134 0.739075898    10.10.1.2 → 10.10.1.1    TCP 83 34754 → 8081 [PSH, ACK] Seq=222 Ack=222 Win=64256 Len=17 TSval=1045023261 TSecr=3169282953
1711546366.459599733   136 0.739206060    10.10.1.1 → 10.10.1.2    TCP 83 8081 → 34754 [PSH, ACK] Seq=222 Ack=239 Win=65152 Len=17 TSval=3169282969 TSecr=1045023261
1711546372.459599733   142 0.744890651    10.10.1.2 → 10.10.1.1    TCP 83 34754 → 8081 [PSH, ACK] Seq=239 Ack=239 Win=64256 Len=17 TSval=1045023267 TSecr=3169282969
1711546374.459599733   144 0.745021278    10.10.1.1 → 10.10.1.2    TCP 83 8081 → 34754 [PSH, ACK] Seq=239 Ack=256 Win=65152 Len=17 TSval=3169282975 TSecr=1045023267
1711546380.459599733   150 0.746871756    10.10.1.2 → 10.10.1.1    TCP 83 34754 → 8081 [PSH, ACK] Seq=256 Ack=256 Win=64256 Len=17 TSval=1045023268 TSecr=3169282975
1711546382.459599733   152 0.746995512    10.10.1.1 → 10.10.1.2    TCP 83 8081 → 34754 [PSH, ACK] Seq=256 Ack=273 Win=65152 Len=17 TSval=3169282977 TSecr=1045023268
1711546388.459599733   158 0.747985282    10.10.1.2 → 10.10.1.1    TCP 83 34754 → 8081 [PSH, ACK] Seq=273 Ack=273 Win=64256 Len=17 TSval=1045023270 TSecr=3169282977
1711546390.459599733   160 0.748115635    10.10.1.1 → 10.10.1.2    TCP 83 8081 → 34754 [PSH, ACK] Seq=273 Ack=290 Win=65152 Len=17 TSval=3169282978 TSecr=1045023270
1711546396.459599733   166 0.769583935    10.10.1.2 → 10.10.1.1    TCP 83 34754 → 8081 [PSH, ACK] Seq=290 Ack=290 Win=64256 Len=17 TSval=1045023291 TSecr=3169282978
1711546398.459599733   168 0.769713947    10.10.1.1 → 10.10.1.2    TCP 83 8081 → 34754 [PSH, ACK] Seq=290 Ack=307 Win=65152 Len=17 TSval=3169283000 TSecr=1045023291
1711546404.459599733   174 0.791672740    10.10.1.2 → 10.10.1.1    TCP 83 34754 → 8081 [PSH, ACK] Seq=307 Ack=307 Win=64256 Len=17 TSval=1045023313 TSecr=3169283000
1711546406.459599733   176 0.791804274    10.10.1.1 → 10.10.1.2    TCP 83 8081 → 34754 [PSH, ACK] Seq=307 Ack=324 Win=65152 Len=17 TSval=3169283022 TSecr=1045023313
1711546412.459599733   182 0.803892312    10.10.1.2 → 10.10.1.1    TCP 83 34754 → 8081 [PSH, ACK] Seq=324 Ack=324 Win=64256 Len=17 TSval=1045023326 TSecr=3169283022
1711546414.459599733   184 0.804021785    10.10.1.1 → 10.10.1.2    TCP 83 8081 → 34754 [PSH, ACK] Seq=324 Ack=341 Win=65152 Len=17 TSval=3169283034 TSecr=1045023326
1711546420.459599733   190 0.840355589    10.10.1.2 → 10.10.1.1    TCP 83 34754 → 8081 [PSH, ACK] Seq=341 Ack=341 Win=64256 Len=17 TSval=1045023362 TSecr=3169283034
1711546422.459599733   192 0.840486957    10.10.1.1 → 10.10.1.2    TCP 83 8081 → 34754 [PSH, ACK] Seq=341 Ack=358 Win=65152 Len=17 TSval=3169283070 TSecr=1045023362
1711546428.459599733   198 0.842820051    10.10.1.2 → 10.10.1.1    TCP 83 34754 → 8081 [PSH, ACK] Seq=358 Ack=358 Win=64256 Len=17 TSval=1045023364 TSecr=3169283070
1711546430.459599733   200 0.842945336    10.10.1.1 → 10.10.1.2    TCP 83 8081 → 34754 [PSH, ACK] Seq=358 Ack=375 Win=65152 Len=17 TSval=3169283073 TSecr=1045023364
1711546436.459599733   206 0.870451046    10.10.1.2 → 10.10.1.1    TCP 83 34754 → 8081 [PSH, ACK] Seq=375 Ack=375 Win=64256 Len=17 TSval=1045023392 TSecr=3169283073
1711546438.459599733   208 0.870581905    10.10.1.1 → 10.10.1.2    TCP 83 8081 → 34754 [PSH, ACK] Seq=375 Ack=392 Win=65152 Len=17 TSval=3169283101 TSecr=1045023392
1711546444.459599733   214 0.872941345    10.10.1.2 → 10.10.1.1    TCP 83 34754 → 8081 [PSH, ACK] Seq=392 Ack=392 Win=64256 Len=17 TSval=1045023395 TSecr=3169283101
1711546446.459599733   216 0.873071025    10.10.1.1 → 10.10.1.2    TCP 83 8081 → 34754 [PSH, ACK] Seq=392 Ack=409 Win=65152 Len=17 TSval=3169283103 TSecr=1045023395
1711546452.459599733   222 0.880913942    10.10.1.2 → 10.10.1.1    TCP 83 34754 → 8081 [PSH, ACK] Seq=409 Ack=409 Win=64256 Len=17 TSval=1045023403 TSecr=3169283103
1711546454.459599733   224 0.881043684    10.10.1.1 → 10.10.1.2    TCP 83 8081 → 34754 [PSH, ACK] Seq=409 Ack=426 Win=65152 Len=17 TSval=3169283111 TSecr=1045023403
1711546460.459599733   230 0.889014712    10.10.1.2 → 10.10.1.1    TCP 83 34754 → 8081 [PSH, ACK] Seq=426 Ack=426 Win=64256 Len=17 TSval=1045023411 TSecr=3169283111
1711546462.459599733   232 0.889144648    10.10.1.1 → 10.10.1.2    TCP 83 8081 → 34754 [PSH, ACK] Seq=426 Ack=443 Win=65152 Len=17 TSval=3169283119 TSecr=1045023411
1711546468.459599733   238 0.903183627    10.10.1.2 → 10.10.1.1    TCP 83 34754 → 8081 [PSH, ACK] Seq=443 Ack=443 Win=64256 Len=17 TSval=1045023425 TSecr=3169283119
1711546470.459599733   240 0.903314006    10.10.1.1 → 10.10.1.2    TCP 83 8081 → 34754 [PSH, ACK] Seq=443 Ack=460 Win=65152 Len=17 TSval=3169283133 TSecr=1045023425
1711546476.459599733   246 0.942999773    10.10.1.2 → 10.10.1.1    TCP 83 34754 → 8081 [PSH, ACK] Seq=460 Ack=460 Win=64256 Len=17 TSval=1045023465 TSecr=3169283133
1711546478.459599733   248 0.943130502    10.10.1.1 → 10.10.1.2    TCP 83 8081 → 34754 [PSH, ACK] Seq=460 Ack=477 Win=65152 Len=17 TSval=3169283173 TSecr=1045023465
1711546484.459599733   254 0.963769744    10.10.1.2 → 10.10.1.1    TCP 83 34754 → 8081 [PSH, ACK] Seq=477 Ack=477 Win=64256 Len=17 TSval=1045023485 TSecr=3169283173
1711546486.459599733   256 0.963900017    10.10.1.1 → 10.10.1.2    TCP 83 8081 → 34754 [PSH, ACK] Seq=477 Ack=494 Win=65152 Len=17 TSval=3169283194 TSecr=1045023485
1711546492.459599733   262 0.968702158    10.10.1.2 → 10.10.1.1    TCP 83 34754 → 8081 [PSH, ACK] Seq=494 Ack=494 Win=64256 Len=17 TSval=1045023490 TSecr=3169283194
1711546494.459599733   264 0.968833078    10.10.1.1 → 10.10.1.2    TCP 83 8081 → 34754 [PSH, ACK] Seq=494 Ack=511 Win=65152 Len=17 TSval=3169283199 TSecr=1045023490
1711546500.459599733   270 0.980459579    10.10.1.2 → 10.10.1.1    TCP 83 34754 → 8081 [PSH, ACK] Seq=511 Ack=511 Win=64256 Len=17 TSval=1045023502 TSecr=3169283199
1711546502.459599733   272 0.980591040    10.10.1.1 → 10.10.1.2    TCP 83 8081 → 34754 [PSH, ACK] Seq=511 Ack=528 Win=65152 Len=17 TSval=3169283211 TSecr=1045023502
1711546508.459599733   278 0.990985525    10.10.1.2 → 10.10.1.1    TCP 83 34754 → 8081 [PSH, ACK] Seq=528 Ack=528 Win=64256 Len=17 TSval=1045023513 TSecr=3169283211
1711546510.459599733   280 0.991116660    10.10.1.1 → 10.10.1.2    TCP 83 8081 → 34754 [PSH, ACK] Seq=528 Ack=545 Win=65152 Len=17 TSval=3169283221 TSecr=1045023513
1711546516.459599733   286 0.995399177    10.10.1.2 → 10.10.1.1    TCP 83 34754 → 8081 [PSH, ACK] Seq=545 Ack=545 Win=64256 Len=17 TSval=1045023517 TSecr=3169283221
1711546518.459599733   288 0.995529115    10.10.1.1 → 10.10.1.2    TCP 83 8081 → 34754 [PSH, ACK] Seq=545 Ack=562 Win=65152 Len=17 TSval=3169283225 TSecr=1045023517
1711546524.459599733   294 1.002201247    10.10.1.2 → 10.10.1.1    TCP 83 34754 → 8081 [PSH, ACK] Seq=562 Ack=562 Win=64256 Len=17 TSval=1045023524 TSecr=3169283225
1711546526.459599733   296 1.002331579    10.10.1.1 → 10.10.1.2    TCP 83 8081 → 34754 [PSH, ACK] Seq=562 Ack=579 Win=65152 Len=17 TSval=3169283232 TSecr=1045023524
1711546532.459599733   302 1.008110506    10.10.1.2 → 10.10.1.1    TCP 83 34754 → 8081 [PSH, ACK] Seq=579 Ack=579 Win=64256 Len=17 TSval=1045023530 TSecr=3169283232
1711546535.459599733   305 1.008242183    10.10.1.1 → 10.10.1.2    TCP 83 8081 → 34754 [PSH, ACK] Seq=579 Ack=596 Win=65152 Len=17 TSval=3169283238 TSecr=1045023530
1711546540.459599733   310 1.018228529    10.10.1.2 → 10.10.1.1    TCP 83 34754 → 8081 [PSH, ACK] Seq=596 Ack=596 Win=64256 Len=17 TSval=1045023540 TSecr=3169283238
1711546542.459599733   312 1.018358670    10.10.1.1 → 10.10.1.2    TCP 83 8081 → 34754 [PSH, ACK] Seq=596 Ack=613 Win=65152 Len=17 TSval=3169283248 TSecr=1045023540
1711546548.459599733   318 1.021727687    10.10.1.2 → 10.10.1.1    TCP 83 34754 → 8081 [PSH, ACK] Seq=613 Ack=613 Win=64256 Len=17 TSval=1045023543 TSecr=3169283248
1711546550.459599733   320 1.021858685    10.10.1.1 → 10.10.1.2    TCP 83 8081 → 34754 [PSH, ACK] Seq=613 Ack=630 Win=65152 Len=17 TSval=3169283252 TSecr=1045023543
1711546556.459599733   326 1.024046939    10.10.1.2 → 10.10.1.1    TCP 83 34754 → 8081 [PSH, ACK] Seq=630 Ack=630 Win=64256 Len=17 TSval=1045023546 TSecr=3169283252
1711546558.459599733   328 1.024176986    10.10.1.1 → 10.10.1.2    TCP 83 8081 → 34754 [PSH, ACK] Seq=630 Ack=647 Win=65152 Len=17 TSval=3169283254 TSecr=1045023546
1711546564.459599733   334 1.027032858    10.10.1.2 → 10.10.1.1    TCP 83 34754 → 8081 [PSH, ACK] Seq=647 Ack=647 Win=64256 Len=17 TSval=1045023549 TSecr=3169283254
1711546566.459599733   336 1.027157795    10.10.1.1 → 10.10.1.2    TCP 83 8081 → 34754 [PSH, ACK] Seq=647 Ack=664 Win=65152 Len=17 TSval=3169283257 TSecr=1045023549
1711546572.459599733   342 1.029864764    10.10.1.2 → 10.10.1.1    TCP 83 34754 → 8081 [PSH, ACK] Seq=664 Ack=664 Win=64256 Len=17 TSval=1045023551 TSecr=3169283257
1711546574.459599733   344 1.029996352    10.10.1.1 → 10.10.1.2    TCP 83 8081 → 34754 [PSH, ACK] Seq=664 Ack=681 Win=65152 Len=17 TSval=3169283260 TSecr=1045023551
1711546580.459599733   350 1.033105418    10.10.1.2 → 10.10.1.1    TCP 83 34754 → 8081 [PSH, ACK] Seq=681 Ack=681 Win=64256 Len=17 TSval=1045023555 TSecr=3169283260
1711546582.459599733   352 1.033234853    10.10.1.1 → 10.10.1.2    TCP 83 8081 → 34754 [PSH, ACK] Seq=681 Ack=698 Win=65152 Len=17 TSval=3169283263 TSecr=1045023555
1711546588.459599733   358 1.039402206    10.10.1.2 → 10.10.1.1    TCP 83 34754 → 8081 [PSH, ACK] Seq=698 Ack=698 Win=64256 Len=17 TSval=1045023561 TSecr=3169283263
1711546590.459599733   360 1.039532476    10.10.1.1 → 10.10.1.2    TCP 83 8081 → 34754 [PSH, ACK] Seq=698 Ack=715 Win=65152 Len=17 TSval=3169283269 TSecr=1045023561
1711546596.459599733   366 1.041574488    10.10.1.2 → 10.10.1.1    TCP 83 34754 → 8081 [PSH, ACK] Seq=715 Ack=715 Win=64256 Len=17 TSval=1045023563 TSecr=3169283269
1711546598.459599733   368 1.041703078    10.10.1.1 → 10.10.1.2    TCP 83 8081 → 34754 [PSH, ACK] Seq=715 Ack=732 Win=65152 Len=17 TSval=3169283272 TSecr=1045023563
1711546604.459599733   374 1.060380371    10.10.1.2 → 10.10.1.1    TCP 83 34754 → 8081 [PSH, ACK] Seq=732 Ack=732 Win=64256 Len=17 TSval=1045023582 TSecr=3169283272
1711546606.459599733   376 1.060511538    10.10.1.1 → 10.10.1.2    TCP 83 8081 → 34754 [PSH, ACK] Seq=732 Ack=749 Win=65152 Len=17 TSval=3169283290 TSecr=1045023582
1711546612.459599733   382 1.063491417    10.10.1.2 → 10.10.1.1    TCP 83 34754 → 8081 [PSH, ACK] Seq=749 Ack=749 Win=64256 Len=17 TSval=1045023585 TSecr=3169283290
1711546614.459599733   384 1.063629805    10.10.1.1 → 10.10.1.2    TCP 83 8081 → 34754 [PSH, ACK] Seq=749 Ack=766 Win=65152 Len=17 TSval=3169283294 TSecr=1045023585
1711546620.459599733   390 1.072727365    10.10.1.2 → 10.10.1.1    TCP 83 34754 → 8081 [PSH, ACK] Seq=766 Ack=766 Win=64256 Len=17 TSval=1045023594 TSecr=3169283294
1711546622.459599733   392 1.072858834    10.10.1.1 → 10.10.1.2    TCP 83 8081 → 34754 [PSH, ACK] Seq=766 Ack=783 Win=65152 Len=17 TSval=3169283303 TSecr=1045023594
1711546629.459599733   399 1.123844570    10.10.1.2 → 10.10.1.1    TCP 83 34754 → 8081 [PSH, ACK] Seq=783 Ack=783 Win=64256 Len=17 TSval=1045023645 TSecr=3169283303
1711546631.459599733   401 1.123969172    10.10.1.1 → 10.10.1.2    TCP 83 8081 → 34754 [PSH, ACK] Seq=783 Ack=800 Win=65152 Len=17 TSval=3169283354 TSecr=1045023645
1711546638.459599733   408 1.127995795    10.10.1.2 → 10.10.1.1    TCP 83 34754 → 8081 [PSH, ACK] Seq=800 Ack=800 Win=64256 Len=17 TSval=1045023650 TSecr=3169283354
1711546640.459599733   410 1.128120219    10.10.1.1 → 10.10.1.2    TCP 83 8081 → 34754 [PSH, ACK] Seq=800 Ack=817 Win=65152 Len=17 TSval=3169283358 TSecr=1045023650
1711546646.459599733   416 1.134669874    10.10.1.2 → 10.10.1.1    TCP 83 34754 → 8081 [PSH, ACK] Seq=817 Ack=817 Win=64256 Len=17 TSval=1045023656 TSecr=3169283358
1711546648.459599733   418 1.134800531    10.10.1.1 → 10.10.1.2    TCP 83 8081 → 34754 [PSH, ACK] Seq=817 Ack=834 Win=65152 Len=17 TSval=3169283365 TSecr=1045023656
1711546654.459599733   424 1.156245925    10.10.1.2 → 10.10.1.1    TCP 83 34754 → 8081 [PSH, ACK] Seq=834 Ack=834 Win=64256 Len=17 TSval=1045023678 TSecr=3169283365
1711546656.459599733   426 1.156376380    10.10.1.1 → 10.10.1.2    TCP 83 8081 → 34754 [PSH, ACK] Seq=834 Ack=851 Win=65152 Len=17 TSval=3169283386 TSecr=1045023678
1711546662.459599733   432 1.156654469    10.10.1.2 → 10.10.1.1    TCP 83 34754 → 8081 [PSH, ACK] Seq=851 Ack=851 Win=64256 Len=17 TSval=1045023678 TSecr=3169283386
1711546664.459599733   434 1.156690581    10.10.1.1 → 10.10.1.2    TCP 83 8081 → 34754 [PSH, ACK] Seq=851 Ack=868 Win=65152 Len=17 TSval=3169283387 TSecr=1045023678
1711546670.459599733   440 1.162740865    10.10.1.2 → 10.10.1.1    TCP 83 34754 → 8081 [PSH, ACK] Seq=868 Ack=868 Win=64256 Len=17 TSval=1045023684 TSecr=3169283387
1711546673.459599733   443 1.162871543    10.10.1.1 → 10.10.1.2    TCP 83 8081 → 34754 [PSH, ACK] Seq=868 Ack=885 Win=65152 Len=17 TSval=3169283393 TSecr=1045023684
1711546678.459599733   448 1.163823890    10.10.1.2 → 10.10.1.1    TCP 83 34754 → 8081 [PSH, ACK] Seq=885 Ack=885 Win=64256 Len=17 TSval=1045023685 TSecr=3169283393
1711546680.459599733   450 1.163882814    10.10.1.1 → 10.10.1.2    TCP 83 8081 → 34754 [PSH, ACK] Seq=885 Ack=902 Win=65152 Len=17 TSval=3169283394 TSecr=1045023685
1711546686.459599733   456 1.193401557    10.10.1.2 → 10.10.1.1    TCP 83 34754 → 8081 [PSH, ACK] Seq=902 Ack=902 Win=64256 Len=17 TSval=1045023715 TSecr=3169283394
1711546688.459599733   458 1.193531132    10.10.1.1 → 10.10.1.2    TCP 83 8081 → 34754 [PSH, ACK] Seq=902 Ack=919 Win=65152 Len=17 TSval=3169283423 TSecr=1045023715
1711546694.459599733   464 1.203850554    10.10.1.2 → 10.10.1.1    TCP 83 34754 → 8081 [PSH, ACK] Seq=919 Ack=919 Win=64256 Len=17 TSval=1045023725 TSecr=3169283423
1711546696.459599733   466 1.203980186    10.10.1.1 → 10.10.1.2    TCP 83 8081 → 34754 [PSH, ACK] Seq=919 Ack=936 Win=65152 Len=17 TSval=3169283434 TSecr=1045023725
1711546702.459599733   472 1.213498526    10.10.1.2 → 10.10.1.1    TCP 83 34754 → 8081 [PSH, ACK] Seq=936 Ack=936 Win=64256 Len=17 TSval=1045023735 TSecr=3169283434
1711546704.459599733   474 1.213628122    10.10.1.1 → 10.10.1.2    TCP 83 8081 → 34754 [PSH, ACK] Seq=936 Ack=953 Win=65152 Len=17 TSval=3169283444 TSecr=1045023735
1711546710.459599733   480 1.220504846    10.10.1.2 → 10.10.1.1    TCP 83 34754 → 8081 [PSH, ACK] Seq=953 Ack=953 Win=64256 Len=17 TSval=1045023742 TSecr=3169283444
1711546713.459599733   483 1.220700371    10.10.1.1 → 10.10.1.2    TCP 83 8081 → 34754 [PSH, ACK] Seq=953 Ack=970 Win=65152 Len=17 TSval=3169283451 TSecr=1045023742
1711546718.459599733   488 1.225777840    10.10.1.2 → 10.10.1.1    TCP 83 34754 → 8081 [PSH, ACK] Seq=970 Ack=970 Win=64256 Len=17 TSval=1045023747 TSecr=3169283451
1711546720.459599733   490 1.225908388    10.10.1.1 → 10.10.1.2    TCP 83 8081 → 34754 [PSH, ACK] Seq=970 Ack=987 Win=65152 Len=17 TSval=3169283456 TSecr=1045023747
1711546726.459599733   496 1.234949542    10.10.1.2 → 10.10.1.1    TCP 83 34754 → 8081 [PSH, ACK] Seq=987 Ack=987 Win=64256 Len=17 TSval=1045023757 TSecr=3169283456
1711546728.459599733   498 1.235080203    10.10.1.1 → 10.10.1.2    TCP 83 8081 → 34754 [PSH, ACK] Seq=987 Ack=1004 Win=65152 Len=17 TSval=3169283465 TSecr=1045023757
1711546734.459599733   504 1.239704787    10.10.1.2 → 10.10.1.1    TCP 83 34754 → 8081 [PSH, ACK] Seq=1004 Ack=1004 Win=64256 Len=17 TSval=1045023761 TSecr=3169283465
1711546736.459599733   506 1.239835093    10.10.1.1 → 10.10.1.2    TCP 83 8081 → 34754 [PSH, ACK] Seq=1004 Ack=1021 Win=65152 Len=17 TSval=3169283470 TSecr=1045023761
1711546742.459599733   512 1.254052340    10.10.1.2 → 10.10.1.1    TCP 83 34754 → 8081 [PSH, ACK] Seq=1021 Ack=1021 Win=64256 Len=17 TSval=1045023776 TSecr=3169283470
1711546744.459599733   514 1.254182822    10.10.1.1 → 10.10.1.2    TCP 83 8081 → 34754 [PSH, ACK] Seq=1021 Ack=1038 Win=65152 Len=17 TSval=3169283484 TSecr=1045023776
1711546750.459599733   520 1.257499705    10.10.1.2 → 10.10.1.1    TCP 83 34754 → 8081 [PSH, ACK] Seq=1038 Ack=1038 Win=64256 Len=17 TSval=1045023779 TSecr=3169283484
1711546752.459599733   522 1.257629570    10.10.1.1 → 10.10.1.2    TCP 83 8081 → 34754 [PSH, ACK] Seq=1038 Ack=1055 Win=65152 Len=17 TSval=3169283488 TSecr=1045023779
1711546759.459599733   529 1.312413991    10.10.1.2 → 10.10.1.1    TCP 83 34754 → 8081 [PSH, ACK] Seq=1055 Ack=1055 Win=64256 Len=17 TSval=1045023834 TSecr=3169283488
1711546761.459599733   531 1.312537998    10.10.1.1 → 10.10.1.2    TCP 83 8081 → 34754 [PSH, ACK] Seq=1055 Ack=1072 Win=65152 Len=17 TSval=3169283542 TSecr=1045023834
1711546768.459599733   538 1.313669676    10.10.1.2 → 10.10.1.1    TCP 83 34754 → 8081 [PSH, ACK] Seq=1072 Ack=1072 Win=64256 Len=17 TSval=1045023835 TSecr=3169283542
1711546770.459599733   540 1.313788429    10.10.1.1 → 10.10.1.2    TCP 83 8081 → 34754 [PSH, ACK] Seq=1072 Ack=1089 Win=65152 Len=17 TSval=3169283544 TSecr=1045023835
1711546776.459599733   546 1.327585160    10.10.1.2 → 10.10.1.1    TCP 83 34754 → 8081 [PSH, ACK] Seq=1089 Ack=1089 Win=64256 Len=17 TSval=1045023849 TSecr=3169283544
1711546778.459599733   548 1.327721876    10.10.1.1 → 10.10.1.2    TCP 83 8081 → 34754 [PSH, ACK] Seq=1089 Ack=1106 Win=65152 Len=17 TSval=3169283558 TSecr=1045023849
1711546784.459599733   554 1.333429033    10.10.1.2 → 10.10.1.1    TCP 83 34754 → 8081 [PSH, ACK] Seq=1106 Ack=1106 Win=64256 Len=17 TSval=1045023855 TSecr=3169283558
1711546786.459599733   556 1.333560262    10.10.1.1 → 10.10.1.2    TCP 83 8081 → 34754 [PSH, ACK] Seq=1106 Ack=1123 Win=65152 Len=17 TSval=3169283563 TSecr=1045023855
1711546792.459599733   562 1.346208144    10.10.1.2 → 10.10.1.1    TCP 83 34754 → 8081 [PSH, ACK] Seq=1123 Ack=1123 Win=64256 Len=17 TSval=1045023868 TSecr=3169283563
1711546794.459599733   564 1.346337750    10.10.1.1 → 10.10.1.2    TCP 83 8081 → 34754 [PSH, ACK] Seq=1123 Ack=1140 Win=65152 Len=17 TSval=3169283576 TSecr=1045023868
1711546800.459599733   570 1.346631066    10.10.1.2 → 10.10.1.1    TCP 83 34754 → 8081 [PSH, ACK] Seq=1140 Ack=1140 Win=64256 Len=17 TSval=1045023868 TSecr=3169283576
1711546802.459599733   572 1.346675071    10.10.1.1 → 10.10.1.2    TCP 83 8081 → 34754 [PSH, ACK] Seq=1140 Ack=1157 Win=65152 Len=17 TSval=3169283577 TSecr=1045023868
1711546808.459599733   578 1.356102725    10.10.1.2 → 10.10.1.1    TCP 83 34754 → 8081 [PSH, ACK] Seq=1157 Ack=1157 Win=64256 Len=17 TSval=1045023878 TSecr=3169283577
1711546810.459599733   580 1.356232801    10.10.1.1 → 10.10.1.2    TCP 83 8081 → 34754 [PSH, ACK] Seq=1157 Ack=1174 Win=65152 Len=17 TSval=3169283586 TSecr=1045023878
1711546816.459599733   586 1.385377387    10.10.1.2 → 10.10.1.1    TCP 83 34754 → 8081 [PSH, ACK] Seq=1174 Ack=1174 Win=64256 Len=17 TSval=1045023907 TSecr=3169283586
1711546818.459599733   588 1.385508451    10.10.1.1 → 10.10.1.2    TCP 83 8081 → 34754 [PSH, ACK] Seq=1174 Ack=1191 Win=65152 Len=17 TSval=3169283615 TSecr=1045023907
1711546824.459599733   594 1.388382620    10.10.1.2 → 10.10.1.1    TCP 83 34754 → 8081 [PSH, ACK] Seq=1191 Ack=1191 Win=64256 Len=17 TSval=1045023910 TSecr=3169283615
1711546826.459599733   596 1.388513930    10.10.1.1 → 10.10.1.2    TCP 83 8081 → 34754 [PSH, ACK] Seq=1191 Ack=1208 Win=65152 Len=17 TSval=3169283618 TSecr=1045023910
1711546832.459599733   602 1.407965215    10.10.1.2 → 10.10.1.1    TCP 83 34754 → 8081 [PSH, ACK] Seq=1208 Ack=1208 Win=64256 Len=17 TSval=1045023930 TSecr=3169283618
1711546834.459599733   604 1.408096528    10.10.1.1 → 10.10.1.2    TCP 83 8081 → 34754 [PSH, ACK] Seq=1208 Ack=1225 Win=65152 Len=17 TSval=3169283638 TSecr=1045023930
1711546840.459599733   610 1.413309170    10.10.1.2 → 10.10.1.1    TCP 83 34754 → 8081 [PSH, ACK] Seq=1225 Ack=1225 Win=64256 Len=17 TSval=1045023935 TSecr=3169283638
1711546842.459599733   612 1.413439886    10.10.1.1 → 10.10.1.2    TCP 83 8081 → 34754 [PSH, ACK] Seq=1225 Ack=1242 Win=65152 Len=17 TSval=3169283643 TSecr=1045023935
1711546848.459599733   618 1.418777438    10.10.1.2 → 10.10.1.1    TCP 83 34754 → 8081 [PSH, ACK] Seq=1242 Ack=1242 Win=64256 Len=17 TSval=1045023940 TSecr=3169283643
1711546850.459599733   620 1.418908548    10.10.1.1 → 10.10.1.2    TCP 83 8081 → 34754 [PSH, ACK] Seq=1242 Ack=1259 Win=65152 Len=17 TSval=3169283649 TSecr=1045023940
1711546856.459599733   626 1.431034829    10.10.1.2 → 10.10.1.1    TCP 83 34754 → 8081 [PSH, ACK] Seq=1259 Ack=1259 Win=64256 Len=17 TSval=1045023953 TSecr=3169283649
1711546859.459599733   629 1.431165147    10.10.1.1 → 10.10.1.2    TCP 83 8081 → 34754 [PSH, ACK] Seq=1259 Ack=1276 Win=65152 Len=17 TSval=3169283661 TSecr=1045023953
1711546864.459599733   634 1.441469183    10.10.1.2 → 10.10.1.1    TCP 83 34754 → 8081 [PSH, ACK] Seq=1276 Ack=1276 Win=64256 Len=17 TSval=1045023963 TSecr=3169283661
1711546866.459599733   636 1.441599430    10.10.1.1 → 10.10.1.2    TCP 83 8081 → 34754 [PSH, ACK] Seq=1276 Ack=1293 Win=65152 Len=17 TSval=3169283672 TSecr=1045023963
1711546873.459599733   643 1.488031896    10.10.1.2 → 10.10.1.1    TCP 83 34754 → 8081 [PSH, ACK] Seq=1293 Ack=1293 Win=64256 Len=17 TSval=1045024010 TSecr=3169283672
1711546875.459599733   645 1.488156251    10.10.1.1 → 10.10.1.2    TCP 83 8081 → 34754 [PSH, ACK] Seq=1293 Ack=1310 Win=65152 Len=17 TSval=3169283718 TSecr=1045024010
1711546882.459599733   652 1.500083102    10.10.1.2 → 10.10.1.1    TCP 83 34754 → 8081 [PSH, ACK] Seq=1310 Ack=1310 Win=64256 Len=17 TSval=1045024022 TSecr=3169283718
1711546884.459599733   654 1.500208049    10.10.1.1 → 10.10.1.2    TCP 83 8081 → 34754 [PSH, ACK] Seq=1310 Ack=1327 Win=65152 Len=17 TSval=3169283730 TSecr=1045024022
1711546890.459599733   660 1.530873518    10.10.1.2 → 10.10.1.1    TCP 83 34754 → 8081 [PSH, ACK] Seq=1327 Ack=1327 Win=64256 Len=17 TSval=1045024052 TSecr=3169283730
1711546892.459599733   662 1.531005276    10.10.1.1 → 10.10.1.2    TCP 83 8081 → 34754 [PSH, ACK] Seq=1327 Ack=1344 Win=65152 Len=17 TSval=3169283761 TSecr=1045024052
1711546898.459599733   668 1.537372316    10.10.1.2 → 10.10.1.1    TCP 83 34754 → 8081 [PSH, ACK] Seq=1344 Ack=1344 Win=64256 Len=17 TSval=1045024059 TSecr=3169283761
1711546900.459599733   670 1.537502836    10.10.1.1 → 10.10.1.2    TCP 83 8081 → 34754 [PSH, ACK] Seq=1344 Ack=1361 Win=65152 Len=17 TSval=3169283767 TSecr=1045024059
1711546906.459599733   676 1.546161210    10.10.1.2 → 10.10.1.1    TCP 83 34754 → 8081 [PSH, ACK] Seq=1361 Ack=1361 Win=64256 Len=17 TSval=1045024068 TSecr=3169283767
1711546908.459599733   678 1.546291331    10.10.1.1 → 10.10.1.2    TCP 83 8081 → 34754 [PSH, ACK] Seq=1361 Ack=1378 Win=65152 Len=17 TSval=3169283776 TSecr=1045024068
1711546914.459599733   684 1.579847454    10.10.1.2 → 10.10.1.1    TCP 83 34754 → 8081 [PSH, ACK] Seq=1378 Ack=1378 Win=64256 Len=17 TSval=1045024101 TSecr=3169283776
1711546916.459599733   686 1.579978742    10.10.1.1 → 10.10.1.2    TCP 83 8081 → 34754 [PSH, ACK] Seq=1378 Ack=1395 Win=65152 Len=17 TSval=3169283810 TSecr=1045024101
1711546922.459599733   692 1.603450778    10.10.1.2 → 10.10.1.1    TCP 83 34754 → 8081 [PSH, ACK] Seq=1395 Ack=1395 Win=64256 Len=17 TSval=1045024125 TSecr=3169283810
1711546924.459599733   694 1.603608488    10.10.1.1 → 10.10.1.2    TCP 83 8081 → 34754 [PSH, ACK] Seq=1395 Ack=1412 Win=65152 Len=17 TSval=3169283834 TSecr=1045024125
1711546930.459599733   700 1.614092688    10.10.1.2 → 10.10.1.1    TCP 83 34754 → 8081 [PSH, ACK] Seq=1412 Ack=1412 Win=64256 Len=17 TSval=1045024136 TSecr=3169283834
1711546932.459599733   702 1.614222480    10.10.1.1 → 10.10.1.2    TCP 83 8081 → 34754 [PSH, ACK] Seq=1412 Ack=1429 Win=65152 Len=17 TSval=3169283844 TSecr=1045024136
1711546938.459599733   708 1.638626374    10.10.1.2 → 10.10.1.1    TCP 83 34754 → 8081 [PSH, ACK] Seq=1429 Ack=1429 Win=64256 Len=17 TSval=1045024160 TSecr=3169283844
1711546940.459599733   710 1.638756516    10.10.1.1 → 10.10.1.2    TCP 83 8081 → 34754 [PSH, ACK] Seq=1429 Ack=1446 Win=65152 Len=17 TSval=3169283869 TSecr=1045024160
1711546946.459599733   716 1.646697899    10.10.1.2 → 10.10.1.1    TCP 83 34754 → 8081 [PSH, ACK] Seq=1446 Ack=1446 Win=64256 Len=17 TSval=1045024168 TSecr=3169283869
1711546948.459599733   718 1.646828118    10.10.1.1 → 10.10.1.2    TCP 83 8081 → 34754 [PSH, ACK] Seq=1446 Ack=1463 Win=65152 Len=17 TSval=3169283877 TSecr=1045024168
1711546954.459599733   724 1.649890466    10.10.1.2 → 10.10.1.1    TCP 83 34754 → 8081 [PSH, ACK] Seq=1463 Ack=1463 Win=64256 Len=17 TSval=1045024172 TSecr=3169283877
1711546956.459599733   726 1.650021856    10.10.1.1 → 10.10.1.2    TCP 83 8081 → 34754 [PSH, ACK] Seq=1463 Ack=1480 Win=65152 Len=17 TSval=3169283880 TSecr=1045024172
1711546962.459599733   732 1.655298193    10.10.1.2 → 10.10.1.1    TCP 83 34754 → 8081 [PSH, ACK] Seq=1480 Ack=1480 Win=64256 Len=17 TSval=1045024177 TSecr=3169283880
1711546964.459599733   734 1.655428245    10.10.1.1 → 10.10.1.2    TCP 83 8081 → 34754 [PSH, ACK] Seq=1480 Ack=1497 Win=65152 Len=17 TSval=3169283885 TSecr=1045024177
1711546970.459599733   740 1.681356168    10.10.1.2 → 10.10.1.1    TCP 83 34754 → 8081 [PSH, ACK] Seq=1497 Ack=1497 Win=64256 Len=17 TSval=1045024203 TSecr=3169283885
1711546972.459599733   742 1.681487540    10.10.1.1 → 10.10.1.2    TCP 83 8081 → 34754 [PSH, ACK] Seq=1497 Ack=1514 Win=65152 Len=17 TSval=3169283911 TSecr=1045024203
1711546978.459599733   748 1.699666704    10.10.1.2 → 10.10.1.1    TCP 83 34754 → 8081 [PSH, ACK] Seq=1514 Ack=1514 Win=64256 Len=17 TSval=1045024221 TSecr=3169283911
1711546980.459599733   750 1.699797666    10.10.1.1 → 10.10.1.2    TCP 83 8081 → 34754 [PSH, ACK] Seq=1514 Ack=1531 Win=65152 Len=17 TSval=3169283930 TSecr=1045024221
1711546986.459599733   756 1.714051728    10.10.1.2 → 10.10.1.1    TCP 83 34754 → 8081 [PSH, ACK] Seq=1531 Ack=1531 Win=64256 Len=17 TSval=1045024236 TSecr=3169283930
1711546988.459599733   758 1.714184117    10.10.1.1 → 10.10.1.2    TCP 83 8081 → 34754 [PSH, ACK] Seq=1531 Ack=1548 Win=65152 Len=17 TSval=3169283944 TSecr=1045024236
1711546994.459599733   764 1.725700076    10.10.1.2 → 10.10.1.1    TCP 83 34754 → 8081 [PSH, ACK] Seq=1548 Ack=1548 Win=64256 Len=17 TSval=1045024247 TSecr=3169283944
1711546996.459599733   766 1.725830911    10.10.1.1 → 10.10.1.2    TCP 83 8081 → 34754 [PSH, ACK] Seq=1548 Ack=1565 Win=65152 Len=17 TSval=3169283956 TSecr=1045024247
1711547002.459599733   772 1.727109763    10.10.1.2 → 10.10.1.1    TCP 83 34754 → 8081 [PSH, ACK] Seq=1565 Ack=1565 Win=64256 Len=17 TSval=1045024249 TSecr=3169283956
1711547004.459599733   774 1.727233987    10.10.1.1 → 10.10.1.2    TCP 83 8081 → 34754 [PSH, ACK] Seq=1565 Ack=1582 Win=65152 Len=17 TSval=3169283957 TSecr=1045024249
1711547010.459599733   780 1.741312364    10.10.1.2 → 10.10.1.1    TCP 83 34754 → 8081 [PSH, ACK] Seq=1582 Ack=1582 Win=64256 Len=17 TSval=1045024263 TSecr=3169283957
1711547012.459599733   782 1.741442947    10.10.1.1 → 10.10.1.2    TCP 83 8081 → 34754 [PSH, ACK] Seq=1582 Ack=1599 Win=65152 Len=17 TSval=3169283971 TSecr=1045024263
1711547018.459599733   788 1.756138033    10.10.1.2 → 10.10.1.1    TCP 83 34754 → 8081 [PSH, ACK] Seq=1599 Ack=1599 Win=64256 Len=17 TSval=1045024278 TSecr=3169283971
1711547020.459599733   790 1.756269579    10.10.1.1 → 10.10.1.2    TCP 83 8081 → 34754 [PSH, ACK] Seq=1599 Ack=1616 Win=65152 Len=17 TSval=3169283986 TSecr=1045024278
1711547026.459599733   796 1.775076220    10.10.1.2 → 10.10.1.1    TCP 83 34754 → 8081 [PSH, ACK] Seq=1616 Ack=1616 Win=64256 Len=17 TSval=1045024297 TSecr=3169283986
1711547028.459599733   798 1.775206431    10.10.1.1 → 10.10.1.2    TCP 83 8081 → 34754 [PSH, ACK] Seq=1616 Ack=1633 Win=65152 Len=17 TSval=3169284005 TSecr=1045024297
1711547034.459599733   804 1.777313696    10.10.1.2 → 10.10.1.1    TCP 83 34754 → 8081 [PSH, ACK] Seq=1633 Ack=1633 Win=64256 Len=17 TSval=1045024299 TSecr=3169284005
1711547036.459599733   806 1.777444449    10.10.1.1 → 10.10.1.2    TCP 83 8081 → 34754 [PSH, ACK] Seq=1633 Ack=1650 Win=65152 Len=17 TSval=3169284007 TSecr=1045024299
1711547042.459599733   812 1.784132340    10.10.1.2 → 10.10.1.1    TCP 83 34754 → 8081 [PSH, ACK] Seq=1650 Ack=1650 Win=64256 Len=17 TSval=1045024306 TSecr=3169284007
1711547044.459599733   814 1.784263102    10.10.1.1 → 10.10.1.2    TCP 83 8081 → 34754 [PSH, ACK] Seq=1650 Ack=1667 Win=65152 Len=17 TSval=3169284014 TSecr=1045024306
1711547050.459599733   820 1.803895314    10.10.1.2 → 10.10.1.1    TCP 83 34754 → 8081 [PSH, ACK] Seq=1667 Ack=1667 Win=64256 Len=17 TSval=1045024326 TSecr=3169284014
1711547052.459599733   822 1.804050369    10.10.1.1 → 10.10.1.2    TCP 83 8081 → 34754 [PSH, ACK] Seq=1667 Ack=1684 Win=65152 Len=17 TSval=3169284034 TSecr=1045024326
1711547058.459599733   828 1.819193338    10.10.1.2 → 10.10.1.1    TCP 83 34754 → 8081 [PSH, ACK] Seq=1684 Ack=1684 Win=64256 Len=17 TSval=1045024341 TSecr=3169284034
1711547060.459599733   830 1.819324086    10.10.1.1 → 10.10.1.2    TCP 83 8081 → 34754 [PSH, ACK] Seq=1684 Ack=1701 Win=65152 Len=17 TSval=3169284049 TSecr=1045024341
1711547066.459599733   836 1.825005880    10.10.1.2 → 10.10.1.1    TCP 83 34754 → 8081 [PSH, ACK] Seq=1701 Ack=1701 Win=64256 Len=17 TSval=1045024347 TSecr=3169284049
1711547068.459599733   838 1.825135509    10.10.1.1 → 10.10.1.2    TCP 83 8081 → 34754 [PSH, ACK] Seq=1701 Ack=1718 Win=65152 Len=17 TSval=3169284055 TSecr=1045024347
1711547074.459599733   844 1.826300421    10.10.1.2 → 10.10.1.1    TCP 83 34754 → 8081 [PSH, ACK] Seq=1718 Ack=1718 Win=64256 Len=17 TSval=1045024348 TSecr=3169284055
1711547076.459599733   846 1.826424754    10.10.1.1 → 10.10.1.2    TCP 83 8081 → 34754 [PSH, ACK] Seq=1718 Ack=1735 Win=65152 Len=17 TSval=3169284056 TSecr=1045024348
1711547082.459599733   852 1.836559759    10.10.1.2 → 10.10.1.1    TCP 83 34754 → 8081 [PSH, ACK] Seq=1735 Ack=1735 Win=64256 Len=17 TSval=1045024358 TSecr=3169284056
1711547084.459599733   854 1.836691373    10.10.1.1 → 10.10.1.2    TCP 83 8081 → 34754 [PSH, ACK] Seq=1735 Ack=1752 Win=65152 Len=17 TSval=3169284067 TSecr=1045024358
1711547090.459599733   860 1.853780970    10.10.1.2 → 10.10.1.1    TCP 83 34754 → 8081 [PSH, ACK] Seq=1752 Ack=1752 Win=64256 Len=17 TSval=1045024375 TSecr=3169284067
1711547092.459599733   862 1.853910666    10.10.1.1 → 10.10.1.2    TCP 83 8081 → 34754 [PSH, ACK] Seq=1752 Ack=1769 Win=65152 Len=17 TSval=3169284084 TSecr=1045024375
1711547098.459599733   868 1.860901626    10.10.1.2 → 10.10.1.1    TCP 83 34754 → 8081 [PSH, ACK] Seq=1769 Ack=1769 Win=64256 Len=17 TSval=1045024383 TSecr=3169284084
1711547100.459599733   870 1.861031986    10.10.1.1 → 10.10.1.2    TCP 83 8081 → 34754 [PSH, ACK] Seq=1769 Ack=1786 Win=65152 Len=17 TSval=3169284091 TSecr=1045024383
1711547106.459599733   876 1.865180843    10.10.1.2 → 10.10.1.1    TCP 83 34754 → 8081 [PSH, ACK] Seq=1786 Ack=1786 Win=64256 Len=17 TSval=1045024387 TSecr=3169284091
1711547108.459599733   878 1.865311639    10.10.1.1 → 10.10.1.2    TCP 83 8081 → 34754 [PSH, ACK] Seq=1786 Ack=1803 Win=65152 Len=17 TSval=3169284095 TSecr=1045024387
1711547114.459599733   884 1.871510782    10.10.1.2 → 10.10.1.1    TCP 83 34754 → 8081 [PSH, ACK] Seq=1803 Ack=1803 Win=64256 Len=17 TSval=1045024393 TSecr=3169284095
1711547116.459599733   886 1.871639972    10.10.1.1 → 10.10.1.2    TCP 83 8081 → 34754 [PSH, ACK] Seq=1803 Ack=1820 Win=65152 Len=17 TSval=3169284102 TSecr=1045024393
1711547122.459599733   892 1.878440221    10.10.1.2 → 10.10.1.1    TCP 83 34754 → 8081 [PSH, ACK] Seq=1820 Ack=1820 Win=64256 Len=17 TSval=1045024400 TSecr=3169284102
1711547124.459599733   894 1.878568786    10.10.1.1 → 10.10.1.2    TCP 83 8081 → 34754 [PSH, ACK] Seq=1820 Ack=1837 Win=65152 Len=17 TSval=3169284109 TSecr=1045024400
1711547130.459599733   900 1.878884294    10.10.1.2 → 10.10.1.1    TCP 83 34754 → 8081 [PSH, ACK] Seq=1837 Ack=1837 Win=64256 Len=17 TSval=1045024401 TSecr=3169284109
1711547132.459599733   902 1.878920894    10.10.1.1 → 10.10.1.2    TCP 83 8081 → 34754 [PSH, ACK] Seq=1837 Ack=1854 Win=65152 Len=17 TSval=3169284109 TSecr=1045024401
1711547138.459599733   908 1.884285099    10.10.1.2 → 10.10.1.1    TCP 83 34754 → 8081 [PSH, ACK] Seq=1854 Ack=1854 Win=64256 Len=17 TSval=1045024406 TSecr=3169284109
1711547140.459599733   910 1.884413268    10.10.1.1 → 10.10.1.2    TCP 83 8081 → 34754 [PSH, ACK] Seq=1854 Ack=1871 Win=65152 Len=17 TSval=3169284114 TSecr=1045024406
1711547146.459599733   916 1.913161091    10.10.1.2 → 10.10.1.1    TCP 83 34754 → 8081 [PSH, ACK] Seq=1871 Ack=1871 Win=64256 Len=17 TSval=1045024435 TSecr=3169284114
1711547148.459599733   918 1.913292504    10.10.1.1 → 10.10.1.2    TCP 83 8081 → 34754 [PSH, ACK] Seq=1871 Ack=1888 Win=65152 Len=17 TSval=3169284143 TSecr=1045024435
1711547154.459599733   924 1.922328052    10.10.1.2 → 10.10.1.1    TCP 83 34754 → 8081 [PSH, ACK] Seq=1888 Ack=1888 Win=64256 Len=17 TSval=1045024444 TSecr=3169284143
1711547156.459599733   926 1.922457524    10.10.1.1 → 10.10.1.2    TCP 83 8081 → 34754 [PSH, ACK] Seq=1888 Ack=1905 Win=65152 Len=17 TSval=3169284152 TSecr=1045024444
1711547162.459599733   932 1.927246150    10.10.1.2 → 10.10.1.1    TCP 83 34754 → 8081 [PSH, ACK] Seq=1905 Ack=1905 Win=64256 Len=17 TSval=1045024449 TSecr=3169284152
1711547164.459599733   934 1.927376325    10.10.1.1 → 10.10.1.2    TCP 83 8081 → 34754 [PSH, ACK] Seq=1905 Ack=1922 Win=65152 Len=17 TSval=3169284157 TSecr=1045024449
1711547170.459599733   940 1.946209368    10.10.1.2 → 10.10.1.1    TCP 83 34754 → 8081 [PSH, ACK] Seq=1922 Ack=1922 Win=64256 Len=17 TSval=1045024468 TSecr=3169284157
1711547173.459599733   943 1.946393818    10.10.1.1 → 10.10.1.2    TCP 83 8081 → 34754 [PSH, ACK] Seq=1922 Ack=1939 Win=65152 Len=17 TSval=3169284176 TSecr=1045024468
1711547178.459599733   948 1.949195687    10.10.1.2 → 10.10.1.1    TCP 83 34754 → 8081 [PSH, ACK] Seq=1939 Ack=1939 Win=64256 Len=17 TSval=1045024471 TSecr=3169284176
1711547180.459599733   950 1.949325422    10.10.1.1 → 10.10.1.2    TCP 83 8081 → 34754 [PSH, ACK] Seq=1939 Ack=1956 Win=65152 Len=17 TSval=3169284179 TSecr=1045024471
1711547186.459599733   956 1.952797758    10.10.1.2 → 10.10.1.1    TCP 83 34754 → 8081 [PSH, ACK] Seq=1956 Ack=1956 Win=64256 Len=17 TSval=1045024474 TSecr=3169284179
1711547188.459599733   958 1.952928751    10.10.1.1 → 10.10.1.2    TCP 83 8081 → 34754 [PSH, ACK] Seq=1956 Ack=1973 Win=65152 Len=17 TSval=3169284183 TSecr=1045024474
1711547194.459599733   964 1.957966675    10.10.1.2 → 10.10.1.1    TCP 83 34754 → 8081 [PSH, ACK] Seq=1973 Ack=1973 Win=64256 Len=17 TSval=1045024480 TSecr=3169284183
1711547196.459599733   966 1.958096973    10.10.1.1 → 10.10.1.2    TCP 83 8081 → 34754 [PSH, ACK] Seq=1973 Ack=1990 Win=65152 Len=17 TSval=3169284188 TSecr=1045024480
1711547202.459599733   972 1.964775013    10.10.1.2 → 10.10.1.1    TCP 83 34754 → 8081 [PSH, ACK] Seq=1990 Ack=1990 Win=64256 Len=17 TSval=1045024486 TSecr=3169284188
1711547204.459599733   974 1.964905575    10.10.1.1 → 10.10.1.2    TCP 83 8081 → 34754 [PSH, ACK] Seq=1990 Ack=2007 Win=65152 Len=17 TSval=3169284195 TSecr=1045024486
1711547210.459599733   980 1.976390265    10.10.1.2 → 10.10.1.1    TCP 83 34754 → 8081 [PSH, ACK] Seq=2007 Ack=2007 Win=64256 Len=17 TSval=1045024498 TSecr=3169284195
1711547212.459599733   982 1.976520877    10.10.1.1 → 10.10.1.2    TCP 83 8081 → 34754 [PSH, ACK] Seq=2007 Ack=2024 Win=65152 Len=17 TSval=3169284206 TSecr=1045024498
1711547218.459599733   988 1.980396215    10.10.1.2 → 10.10.1.1    TCP 83 34754 → 8081 [PSH, ACK] Seq=2024 Ack=2024 Win=64256 Len=17 TSval=1045024502 TSecr=3169284206
1711547220.459599733   990 1.980526645    10.10.1.1 → 10.10.1.2    TCP 83 8081 → 34754 [PSH, ACK] Seq=2024 Ack=2041 Win=65152 Len=17 TSval=3169284210 TSecr=1045024502
1711547226.459599733   996 1.984453440    10.10.1.2 → 10.10.1.1    TCP 83 34754 → 8081 [PSH, ACK] Seq=2041 Ack=2041 Win=64256 Len=17 TSval=1045024506 TSecr=3169284210
