1711548238.780033350    42 0.543863139    10.10.1.2 → 10.10.1.1    TCP 83 46898 → 8081 [PSH, ACK] Seq=1 Ack=1 Win=64256 Len=17 TSval=1046989368 TSecr=3171248826
1711548242.780033350    46 0.544055085    10.10.1.1 → 10.10.1.2    TCP 83 8081 → 46898 [PSH, ACK] Seq=1 Ack=18 Win=65152 Len=17 TSval=3171249078 TSecr=1046989368
1711548250.780033350    54 0.545219884    10.10.1.2 → 10.10.1.1    TCP 83 46898 → 8081 [PSH, ACK] Seq=18 Ack=18 Win=64256 Len=17 TSval=1046989369 TSecr=3171249078
1711548253.780033350    57 0.545256573    10.10.1.1 → 10.10.1.2    TCP 83 8081 → 46898 [PSH, ACK] Seq=18 Ack=35 Win=65152 Len=17 TSval=3171249079 TSecr=1046989369
1711548260.780033350    64 0.546418079    10.10.1.2 → 10.10.1.1    TCP 83 46898 → 8081 [PSH, ACK] Seq=35 Ack=35 Win=64256 Len=17 TSval=1046989370 TSecr=3171249079
1711548263.780033350    67 0.546450763    10.10.1.1 → 10.10.1.2    TCP 83 8081 → 46898 [PSH, ACK] Seq=35 Ack=52 Win=65152 Len=17 TSval=3171249081 TSecr=1046989370
1711548270.780033350    74 0.547609224    10.10.1.2 → 10.10.1.1    TCP 83 46898 → 8081 [PSH, ACK] Seq=52 Ack=52 Win=64256 Len=17 TSval=1046989371 TSecr=3171249081
1711548273.780033350    77 0.547645884    10.10.1.1 → 10.10.1.2    TCP 83 8081 → 46898 [PSH, ACK] Seq=52 Ack=69 Win=65152 Len=17 TSval=3171249082 TSecr=1046989371
1711548280.780033350    84 0.548776860    10.10.1.2 → 10.10.1.1    TCP 83 46898 → 8081 [PSH, ACK] Seq=69 Ack=69 Win=64256 Len=17 TSval=1046989373 TSecr=3171249082
1711548283.780033350    87 0.548808551    10.10.1.1 → 10.10.1.2    TCP 83 8081 → 46898 [PSH, ACK] Seq=69 Ack=86 Win=65152 Len=17 TSval=3171249083 TSecr=1046989373
1711548290.780033350    94 0.549969348    10.10.1.2 → 10.10.1.1    TCP 83 46898 → 8081 [PSH, ACK] Seq=86 Ack=86 Win=64256 Len=17 TSval=1046989374 TSecr=3171249083
1711548292.780033350    96 0.550001383    10.10.1.1 → 10.10.1.2    TCP 83 8081 → 46898 [PSH, ACK] Seq=86 Ack=103 Win=65152 Len=17 TSval=3171249084 TSecr=1046989374
1711548300.780033350   104 0.551157594    10.10.1.2 → 10.10.1.1    TCP 83 46898 → 8081 [PSH, ACK] Seq=103 Ack=103 Win=64256 Len=17 TSval=1046989375 TSecr=3171249084
1711548302.780033350   106 0.551190525    10.10.1.1 → 10.10.1.2    TCP 83 8081 → 46898 [PSH, ACK] Seq=103 Ack=120 Win=65152 Len=17 TSval=3171249085 TSecr=1046989375
1711548310.780033350   114 0.552347330    10.10.1.2 → 10.10.1.1    TCP 83 46898 → 8081 [PSH, ACK] Seq=120 Ack=120 Win=64256 Len=17 TSval=1046989376 TSecr=3171249085
1711548312.780033350   116 0.552383063    10.10.1.1 → 10.10.1.2    TCP 83 8081 → 46898 [PSH, ACK] Seq=120 Ack=137 Win=65152 Len=17 TSval=3171249086 TSecr=1046989376
1711548320.780033350   124 0.553543560    10.10.1.2 → 10.10.1.1    TCP 83 46898 → 8081 [PSH, ACK] Seq=137 Ack=137 Win=64256 Len=17 TSval=1046989377 TSecr=3171249086
1711548322.780033350   126 0.553576450    10.10.1.1 → 10.10.1.2    TCP 83 8081 → 46898 [PSH, ACK] Seq=137 Ack=154 Win=65152 Len=17 TSval=3171249088 TSecr=1046989377
1711548330.780033350   134 0.554733018    10.10.1.2 → 10.10.1.1    TCP 83 46898 → 8081 [PSH, ACK] Seq=154 Ack=154 Win=64256 Len=17 TSval=1046989378 TSecr=3171249088
1711548332.780033350   136 0.554764849    10.10.1.1 → 10.10.1.2    TCP 83 8081 → 46898 [PSH, ACK] Seq=154 Ack=171 Win=65152 Len=17 TSval=3171249089 TSecr=1046989378
1711548340.780033350   144 0.555925169    10.10.1.2 → 10.10.1.1    TCP 83 46898 → 8081 [PSH, ACK] Seq=171 Ack=171 Win=64256 Len=17 TSval=1046989380 TSecr=3171249089
1711548342.780033350   146 0.555974570    10.10.1.1 → 10.10.1.2    TCP 83 8081 → 46898 [PSH, ACK] Seq=171 Ack=188 Win=65152 Len=17 TSval=3171249090 TSecr=1046989380
1711548350.780033350   154 0.557134122    10.10.1.2 → 10.10.1.1    TCP 83 46898 → 8081 [PSH, ACK] Seq=188 Ack=188 Win=64256 Len=17 TSval=1046989381 TSecr=3171249090
1711548352.780033350   156 0.557166842    10.10.1.1 → 10.10.1.2    TCP 83 8081 → 46898 [PSH, ACK] Seq=188 Ack=205 Win=65152 Len=17 TSval=3171249091 TSecr=1046989381
1711548360.780033350   164 0.558324080    10.10.1.2 → 10.10.1.1    TCP 83 46898 → 8081 [PSH, ACK] Seq=205 Ack=205 Win=64256 Len=17 TSval=1046989382 TSecr=3171249091
1711548362.780033350   166 0.558355600    10.10.1.1 → 10.10.1.2    TCP 83 8081 → 46898 [PSH, ACK] Seq=205 Ack=222 Win=65152 Len=17 TSval=3171249092 TSecr=1046989382
1711548370.780033350   174 0.559513551    10.10.1.2 → 10.10.1.1    TCP 83 46898 → 8081 [PSH, ACK] Seq=222 Ack=222 Win=64256 Len=17 TSval=1046989383 TSecr=3171249092
1711548372.780033350   176 0.559550592    10.10.1.1 → 10.10.1.2    TCP 83 8081 → 46898 [PSH, ACK] Seq=222 Ack=239 Win=65152 Len=17 TSval=3171249094 TSecr=1046989383
1711548380.780033350   184 0.560709029    10.10.1.2 → 10.10.1.1    TCP 83 46898 → 8081 [PSH, ACK] Seq=239 Ack=239 Win=64256 Len=17 TSval=1046989384 TSecr=3171249094
1711548382.780033350   186 0.560739282    10.10.1.1 → 10.10.1.2    TCP 83 8081 → 46898 [PSH, ACK] Seq=239 Ack=256 Win=65152 Len=17 TSval=3171249095 TSecr=1046989384
1711548390.780033350   194 0.561899777    10.10.1.2 → 10.10.1.1    TCP 83 46898 → 8081 [PSH, ACK] Seq=256 Ack=256 Win=64256 Len=17 TSval=1046989386 TSecr=3171249095
1711548392.780033350   196 0.561930084    10.10.1.1 → 10.10.1.2    TCP 83 8081 → 46898 [PSH, ACK] Seq=256 Ack=273 Win=65152 Len=17 TSval=3171249096 TSecr=1046989386
1711548400.780033350   204 0.563087016    10.10.1.2 → 10.10.1.1    TCP 83 46898 → 8081 [PSH, ACK] Seq=273 Ack=273 Win=64256 Len=17 TSval=1046989387 TSecr=3171249096
1711548402.780033350   206 0.563116195    10.10.1.1 → 10.10.1.2    TCP 83 8081 → 46898 [PSH, ACK] Seq=273 Ack=290 Win=65152 Len=17 TSval=3171249097 TSecr=1046989387
1711548410.780033350   214 0.564274878    10.10.1.2 → 10.10.1.1    TCP 83 46898 → 8081 [PSH, ACK] Seq=290 Ack=290 Win=64256 Len=17 TSval=1046989388 TSecr=3171249097
1711548412.780033350   216 0.564311178    10.10.1.1 → 10.10.1.2    TCP 83 8081 → 46898 [PSH, ACK] Seq=290 Ack=307 Win=65152 Len=17 TSval=3171249098 TSecr=1046989388
1711548420.780033350   224 0.565471471    10.10.1.2 → 10.10.1.1    TCP 83 46898 → 8081 [PSH, ACK] Seq=307 Ack=307 Win=64256 Len=17 TSval=1046989389 TSecr=3171249098
1711548422.780033350   226 0.565503839    10.10.1.1 → 10.10.1.2    TCP 83 8081 → 46898 [PSH, ACK] Seq=307 Ack=324 Win=65152 Len=17 TSval=3171249100 TSecr=1046989389
1711548430.780033350   234 0.566660517    10.10.1.2 → 10.10.1.1    TCP 83 46898 → 8081 [PSH, ACK] Seq=324 Ack=324 Win=64256 Len=17 TSval=1046989390 TSecr=3171249100
1711548432.780033350   236 0.566692456    10.10.1.1 → 10.10.1.2    TCP 83 8081 → 46898 [PSH, ACK] Seq=324 Ack=341 Win=65152 Len=17 TSval=3171249101 TSecr=1046989390
1711548440.780033350   244 0.567849713    10.10.1.2 → 10.10.1.1    TCP 83 46898 → 8081 [PSH, ACK] Seq=341 Ack=341 Win=64256 Len=17 TSval=1046989392 TSecr=3171249101
1711548442.780033350   246 0.567885255    10.10.1.1 → 10.10.1.2    TCP 83 8081 → 46898 [PSH, ACK] Seq=341 Ack=358 Win=65152 Len=17 TSval=3171249102 TSecr=1046989392
1711548450.780033350   254 0.569044134    10.10.1.2 → 10.10.1.1    TCP 83 46898 → 8081 [PSH, ACK] Seq=358 Ack=358 Win=64256 Len=17 TSval=1046989393 TSecr=3171249102
1711548452.780033350   256 0.569076194    10.10.1.1 → 10.10.1.2    TCP 83 8081 → 46898 [PSH, ACK] Seq=358 Ack=375 Win=65152 Len=17 TSval=3171249103 TSecr=1046989393
1711548460.780033350   264 0.570231849    10.10.1.2 → 10.10.1.1    TCP 83 46898 → 8081 [PSH, ACK] Seq=375 Ack=375 Win=64256 Len=17 TSval=1046989394 TSecr=3171249103
1711548462.780033350   266 0.570263476    10.10.1.1 → 10.10.1.2    TCP 83 8081 → 46898 [PSH, ACK] Seq=375 Ack=392 Win=65152 Len=17 TSval=3171249104 TSecr=1046989394
1711548470.780033350   274 0.571419616    10.10.1.2 → 10.10.1.1    TCP 83 46898 → 8081 [PSH, ACK] Seq=392 Ack=392 Win=64256 Len=17 TSval=1046989395 TSecr=3171249104
1711548472.780033350   276 0.571461686    10.10.1.1 → 10.10.1.2    TCP 83 8081 → 46898 [PSH, ACK] Seq=392 Ack=409 Win=65152 Len=17 TSval=3171249106 TSecr=1046989395
1711548480.780033350   284 0.572619108    10.10.1.2 → 10.10.1.1    TCP 83 46898 → 8081 [PSH, ACK] Seq=409 Ack=409 Win=64256 Len=17 TSval=1046989396 TSecr=3171249106
1711548482.780033350   286 0.572650831    10.10.1.1 → 10.10.1.2    TCP 83 8081 → 46898 [PSH, ACK] Seq=409 Ack=426 Win=65152 Len=17 TSval=3171249107 TSecr=1046989396
1711548490.780033350   294 0.573810973    10.10.1.2 → 10.10.1.1    TCP 83 46898 → 8081 [PSH, ACK] Seq=426 Ack=426 Win=64256 Len=17 TSval=1046989398 TSecr=3171249107
1711548492.780033350   296 0.573843058    10.10.1.1 → 10.10.1.2    TCP 83 8081 → 46898 [PSH, ACK] Seq=426 Ack=443 Win=65152 Len=17 TSval=3171249108 TSecr=1046989398
1711548500.780033350   304 0.574998919    10.10.1.2 → 10.10.1.1    TCP 83 46898 → 8081 [PSH, ACK] Seq=443 Ack=443 Win=64256 Len=17 TSval=1046989399 TSecr=3171249108
1711548502.780033350   306 0.575030685    10.10.1.1 → 10.10.1.2    TCP 83 8081 → 46898 [PSH, ACK] Seq=443 Ack=460 Win=65152 Len=17 TSval=3171249109 TSecr=1046989399
1711548510.780033350   314 0.576188083    10.10.1.2 → 10.10.1.1    TCP 83 46898 → 8081 [PSH, ACK] Seq=460 Ack=460 Win=64256 Len=17 TSval=1046989400 TSecr=3171249109
1711548512.780033350   316 0.576224269    10.10.1.1 → 10.10.1.2    TCP 83 8081 → 46898 [PSH, ACK] Seq=460 Ack=477 Win=65152 Len=17 TSval=3171249110 TSecr=1046989400
1711548520.780033350   324 0.577382933    10.10.1.2 → 10.10.1.1    TCP 83 46898 → 8081 [PSH, ACK] Seq=477 Ack=477 Win=64256 Len=17 TSval=1046989401 TSecr=3171249110
1711548522.780033350   326 0.577414299    10.10.1.1 → 10.10.1.2    TCP 83 8081 → 46898 [PSH, ACK] Seq=477 Ack=494 Win=65152 Len=17 TSval=3171249112 TSecr=1046989401
1711548530.780033350   334 0.578571283    10.10.1.2 → 10.10.1.1    TCP 83 46898 → 8081 [PSH, ACK] Seq=494 Ack=494 Win=64256 Len=17 TSval=1046989402 TSecr=3171249112
1711548532.780033350   336 0.578602777    10.10.1.1 → 10.10.1.2    TCP 83 8081 → 46898 [PSH, ACK] Seq=494 Ack=511 Win=65152 Len=17 TSval=3171249113 TSecr=1046989402
1711548540.780033350   344 0.579768928    10.10.1.2 → 10.10.1.1    TCP 83 46898 → 8081 [PSH, ACK] Seq=511 Ack=511 Win=64256 Len=17 TSval=1046989404 TSecr=3171249113
1711548542.780033350   346 0.579804141    10.10.1.1 → 10.10.1.2    TCP 83 8081 → 46898 [PSH, ACK] Seq=511 Ack=528 Win=65152 Len=17 TSval=3171249114 TSecr=1046989404
1711548550.780033350   354 0.580964549    10.10.1.2 → 10.10.1.1    TCP 83 46898 → 8081 [PSH, ACK] Seq=528 Ack=528 Win=64256 Len=17 TSval=1046989405 TSecr=3171249114
1711548552.780033350   356 0.580995953    10.10.1.1 → 10.10.1.2    TCP 83 8081 → 46898 [PSH, ACK] Seq=528 Ack=545 Win=65152 Len=17 TSval=3171249115 TSecr=1046989405
1711548560.780033350   364 0.582152620    10.10.1.2 → 10.10.1.1    TCP 83 46898 → 8081 [PSH, ACK] Seq=545 Ack=545 Win=64256 Len=17 TSval=1046989406 TSecr=3171249115
1711548562.780033350   366 0.582184367    10.10.1.1 → 10.10.1.2    TCP 83 8081 → 46898 [PSH, ACK] Seq=545 Ack=562 Win=65152 Len=17 TSval=3171249116 TSecr=1046989406
1711548570.780033350   374 0.583340251    10.10.1.2 → 10.10.1.1    TCP 83 46898 → 8081 [PSH, ACK] Seq=562 Ack=562 Win=64256 Len=17 TSval=1046989407 TSecr=3171249116
1711548572.780033350   376 0.583372308    10.10.1.1 → 10.10.1.2    TCP 83 8081 → 46898 [PSH, ACK] Seq=562 Ack=579 Win=65152 Len=17 TSval=3171249117 TSecr=1046989407
1711548580.780033350   384 0.584529561    10.10.1.2 → 10.10.1.1    TCP 83 46898 → 8081 [PSH, ACK] Seq=579 Ack=579 Win=64256 Len=17 TSval=1046989408 TSecr=3171249117
1711548582.780033350   386 0.584564939    10.10.1.1 → 10.10.1.2    TCP 83 8081 → 46898 [PSH, ACK] Seq=579 Ack=596 Win=65152 Len=17 TSval=3171249119 TSecr=1046989408
1711548590.780033350   394 0.585723512    10.10.1.2 → 10.10.1.1    TCP 83 46898 → 8081 [PSH, ACK] Seq=596 Ack=596 Win=64256 Len=17 TSval=1046989409 TSecr=3171249119
1711548592.780033350   396 0.585754486    10.10.1.1 → 10.10.1.2    TCP 83 8081 → 46898 [PSH, ACK] Seq=596 Ack=613 Win=65152 Len=17 TSval=3171249120 TSecr=1046989409
1711548600.780033350   404 0.586910405    10.10.1.2 → 10.10.1.1    TCP 83 46898 → 8081 [PSH, ACK] Seq=613 Ack=613 Win=64256 Len=17 TSval=1046989411 TSecr=3171249120
1711548602.780033350   406 0.586942426    10.10.1.1 → 10.10.1.2    TCP 83 8081 → 46898 [PSH, ACK] Seq=613 Ack=630 Win=65152 Len=17 TSval=3171249121 TSecr=1046989411
1711548610.780033350   414 0.588099261    10.10.1.2 → 10.10.1.1    TCP 83 46898 → 8081 [PSH, ACK] Seq=630 Ack=630 Win=64256 Len=17 TSval=1046989412 TSecr=3171249121
1711548612.780033350   416 0.588134896    10.10.1.1 → 10.10.1.2    TCP 83 8081 → 46898 [PSH, ACK] Seq=630 Ack=647 Win=65152 Len=17 TSval=3171249122 TSecr=1046989412
1711548620.780033350   424 0.589294254    10.10.1.2 → 10.10.1.1    TCP 83 46898 → 8081 [PSH, ACK] Seq=647 Ack=647 Win=64256 Len=17 TSval=1046989413 TSecr=3171249122
1711548622.780033350   426 0.589326191    10.10.1.1 → 10.10.1.2    TCP 83 8081 → 46898 [PSH, ACK] Seq=647 Ack=664 Win=65152 Len=17 TSval=3171249123 TSecr=1046989413
1711548630.780033350   434 0.590483827    10.10.1.2 → 10.10.1.1    TCP 83 46898 → 8081 [PSH, ACK] Seq=664 Ack=664 Win=64256 Len=17 TSval=1046989414 TSecr=3171249123
1711548632.780033350   436 0.590515602    10.10.1.1 → 10.10.1.2    TCP 83 8081 → 46898 [PSH, ACK] Seq=664 Ack=681 Win=65152 Len=17 TSval=3171249125 TSecr=1046989414
1711548640.780033350   444 0.591672266    10.10.1.2 → 10.10.1.1    TCP 83 46898 → 8081 [PSH, ACK] Seq=681 Ack=681 Win=64256 Len=17 TSval=1046989415 TSecr=3171249125
1711548642.780033350   446 0.591708343    10.10.1.1 → 10.10.1.2    TCP 83 8081 → 46898 [PSH, ACK] Seq=681 Ack=698 Win=65152 Len=17 TSval=3171249126 TSecr=1046989415
1711548650.780033350   454 0.592865276    10.10.1.2 → 10.10.1.1    TCP 83 46898 → 8081 [PSH, ACK] Seq=698 Ack=698 Win=64256 Len=17 TSval=1046989417 TSecr=3171249126
1711548652.780033350   456 0.592895106    10.10.1.1 → 10.10.1.2    TCP 83 8081 → 46898 [PSH, ACK] Seq=698 Ack=715 Win=65152 Len=17 TSval=3171249127 TSecr=1046989417
1711548660.780033350   464 0.594053164    10.10.1.2 → 10.10.1.1    TCP 83 46898 → 8081 [PSH, ACK] Seq=715 Ack=715 Win=64256 Len=17 TSval=1046989418 TSecr=3171249127
1711548662.780033350   466 0.594083000    10.10.1.1 → 10.10.1.2    TCP 83 8081 → 46898 [PSH, ACK] Seq=715 Ack=732 Win=65152 Len=17 TSval=3171249128 TSecr=1046989418
1711548670.780033350   474 0.595238862    10.10.1.2 → 10.10.1.1    TCP 83 46898 → 8081 [PSH, ACK] Seq=732 Ack=732 Win=64256 Len=17 TSval=1046989419 TSecr=3171249128
1711548672.780033350   476 0.595268786    10.10.1.1 → 10.10.1.2    TCP 83 8081 → 46898 [PSH, ACK] Seq=732 Ack=749 Win=65152 Len=17 TSval=3171249129 TSecr=1046989419
1711548680.780033350   484 0.596424953    10.10.1.2 → 10.10.1.1    TCP 83 46898 → 8081 [PSH, ACK] Seq=749 Ack=749 Win=64256 Len=17 TSval=1046989420 TSecr=3171249129
1711548682.780033350   486 0.596459913    10.10.1.1 → 10.10.1.2    TCP 83 8081 → 46898 [PSH, ACK] Seq=749 Ack=766 Win=65152 Len=17 TSval=3171249131 TSecr=1046989420
1711548690.780033350   494 0.597619722    10.10.1.2 → 10.10.1.1    TCP 83 46898 → 8081 [PSH, ACK] Seq=766 Ack=766 Win=64256 Len=17 TSval=1046989421 TSecr=3171249131
1711548692.780033350   496 0.597651851    10.10.1.1 → 10.10.1.2    TCP 83 8081 → 46898 [PSH, ACK] Seq=766 Ack=783 Win=65152 Len=17 TSval=3171249132 TSecr=1046989421
1711548700.780033350   504 0.598808214    10.10.1.2 → 10.10.1.1    TCP 83 46898 → 8081 [PSH, ACK] Seq=783 Ack=783 Win=64256 Len=17 TSval=1046989423 TSecr=3171249132
1711548702.780033350   506 0.598839554    10.10.1.1 → 10.10.1.2    TCP 83 8081 → 46898 [PSH, ACK] Seq=783 Ack=800 Win=65152 Len=17 TSval=3171249133 TSecr=1046989423
1711548710.780033350   514 0.599996500    10.10.1.2 → 10.10.1.1    TCP 83 46898 → 8081 [PSH, ACK] Seq=800 Ack=800 Win=64256 Len=17 TSval=1046989424 TSecr=3171249133
1711548712.780033350   516 0.600032901    10.10.1.1 → 10.10.1.2    TCP 83 8081 → 46898 [PSH, ACK] Seq=800 Ack=817 Win=65152 Len=17 TSval=3171249134 TSecr=1046989424
1711548720.780033350   524 0.601192593    10.10.1.2 → 10.10.1.1    TCP 83 46898 → 8081 [PSH, ACK] Seq=817 Ack=817 Win=64256 Len=17 TSval=1046989425 TSecr=3171249134
1711548722.780033350   526 0.601224568    10.10.1.1 → 10.10.1.2    TCP 83 8081 → 46898 [PSH, ACK] Seq=817 Ack=834 Win=65152 Len=17 TSval=3171249135 TSecr=1046989425
1711548730.780033350   534 0.602380555    10.10.1.2 → 10.10.1.1    TCP 83 46898 → 8081 [PSH, ACK] Seq=834 Ack=834 Win=64256 Len=17 TSval=1046989426 TSecr=3171249135
1711548732.780033350   536 0.602412716    10.10.1.1 → 10.10.1.2    TCP 83 8081 → 46898 [PSH, ACK] Seq=834 Ack=851 Win=65152 Len=17 TSval=3171249137 TSecr=1046989426
1711548740.780033350   544 0.603568624    10.10.1.2 → 10.10.1.1    TCP 83 46898 → 8081 [PSH, ACK] Seq=851 Ack=851 Win=64256 Len=17 TSval=1046989427 TSecr=3171249137
1711548742.780033350   546 0.603603733    10.10.1.1 → 10.10.1.2    TCP 83 8081 → 46898 [PSH, ACK] Seq=851 Ack=868 Win=65152 Len=17 TSval=3171249138 TSecr=1046989427
1711548750.780033350   554 0.604760285    10.10.1.2 → 10.10.1.1    TCP 83 46898 → 8081 [PSH, ACK] Seq=868 Ack=868 Win=64256 Len=17 TSval=1046989429 TSecr=3171249138
1711548752.780033350   556 0.604792295    10.10.1.1 → 10.10.1.2    TCP 83 8081 → 46898 [PSH, ACK] Seq=868 Ack=885 Win=65152 Len=17 TSval=3171249139 TSecr=1046989429
1711548760.780033350   564 0.605950619    10.10.1.2 → 10.10.1.1    TCP 83 46898 → 8081 [PSH, ACK] Seq=885 Ack=885 Win=64256 Len=17 TSval=1046989430 TSecr=3171249139
1711548762.780033350   566 0.605982439    10.10.1.1 → 10.10.1.2    TCP 83 8081 → 46898 [PSH, ACK] Seq=885 Ack=902 Win=65152 Len=17 TSval=3171249140 TSecr=1046989430
1711548770.780033350   574 0.607138729    10.10.1.2 → 10.10.1.1    TCP 83 46898 → 8081 [PSH, ACK] Seq=902 Ack=902 Win=64256 Len=17 TSval=1046989431 TSecr=3171249140
1711548772.780033350   576 0.607168581    10.10.1.1 → 10.10.1.2    TCP 83 8081 → 46898 [PSH, ACK] Seq=902 Ack=919 Win=65152 Len=17 TSval=3171249141 TSecr=1046989431
1711548780.780033350   584 0.608324783    10.10.1.2 → 10.10.1.1    TCP 83 46898 → 8081 [PSH, ACK] Seq=919 Ack=919 Win=64256 Len=17 TSval=1046989432 TSecr=3171249141
1711548782.780033350   586 0.608359968    10.10.1.1 → 10.10.1.2    TCP 83 8081 → 46898 [PSH, ACK] Seq=919 Ack=936 Win=65152 Len=17 TSval=3171249142 TSecr=1046989432
1711548790.780033350   594 0.609518897    10.10.1.2 → 10.10.1.1    TCP 83 46898 → 8081 [PSH, ACK] Seq=936 Ack=936 Win=64256 Len=17 TSval=1046989433 TSecr=3171249142
1711548792.780033350   596 0.609553021    10.10.1.1 → 10.10.1.2    TCP 83 8081 → 46898 [PSH, ACK] Seq=936 Ack=953 Win=65152 Len=17 TSval=3171249144 TSecr=1046989433
1711548800.780033350   604 0.610708888    10.10.1.2 → 10.10.1.1    TCP 83 46898 → 8081 [PSH, ACK] Seq=953 Ack=953 Win=64256 Len=17 TSval=1046989434 TSecr=3171249144
1711548803.780033350   607 0.610775870    10.10.1.1 → 10.10.1.2    TCP 83 8081 → 46898 [PSH, ACK] Seq=953 Ack=970 Win=65152 Len=17 TSval=3171249145 TSecr=1046989434
1711548810.780033350   614 0.611933102    10.10.1.2 → 10.10.1.1    TCP 83 46898 → 8081 [PSH, ACK] Seq=970 Ack=970 Win=64256 Len=17 TSval=1046989436 TSecr=3171249145
1711548812.780033350   616 0.611968331    10.10.1.1 → 10.10.1.2    TCP 83 8081 → 46898 [PSH, ACK] Seq=970 Ack=987 Win=65152 Len=17 TSval=3171249146 TSecr=1046989436
1711548820.780033350   624 0.613127030    10.10.1.2 → 10.10.1.1    TCP 83 46898 → 8081 [PSH, ACK] Seq=987 Ack=987 Win=64256 Len=17 TSval=1046989437 TSecr=3171249146
1711548822.780033350   626 0.613160928    10.10.1.1 → 10.10.1.2    TCP 83 8081 → 46898 [PSH, ACK] Seq=987 Ack=1004 Win=65152 Len=17 TSval=3171249147 TSecr=1046989437
1711548830.780033350   634 0.614317160    10.10.1.2 → 10.10.1.1    TCP 83 46898 → 8081 [PSH, ACK] Seq=1004 Ack=1004 Win=64256 Len=17 TSval=1046989438 TSecr=3171249147
1711548832.780033350   636 0.614349279    10.10.1.1 → 10.10.1.2    TCP 83 8081 → 46898 [PSH, ACK] Seq=1004 Ack=1021 Win=65152 Len=17 TSval=3171249148 TSecr=1046989438
1711548840.780033350   644 0.615505368    10.10.1.2 → 10.10.1.1    TCP 83 46898 → 8081 [PSH, ACK] Seq=1021 Ack=1021 Win=64256 Len=17 TSval=1046989439 TSecr=3171249148
1711548842.780033350   646 0.615540839    10.10.1.1 → 10.10.1.2    TCP 83 8081 → 46898 [PSH, ACK] Seq=1021 Ack=1038 Win=65152 Len=17 TSval=3171249150 TSecr=1046989439
1711548850.780033350   654 0.616697250    10.10.1.2 → 10.10.1.1    TCP 83 46898 → 8081 [PSH, ACK] Seq=1038 Ack=1038 Win=64256 Len=17 TSval=1046989440 TSecr=3171249150
1711548852.780033350   656 0.616728643    10.10.1.1 → 10.10.1.2    TCP 83 8081 → 46898 [PSH, ACK] Seq=1038 Ack=1055 Win=65152 Len=17 TSval=3171249151 TSecr=1046989440
1711548860.780033350   664 0.617887570    10.10.1.2 → 10.10.1.1    TCP 83 46898 → 8081 [PSH, ACK] Seq=1055 Ack=1055 Win=64256 Len=17 TSval=1046989442 TSecr=3171249151
1711548862.780033350   666 0.617919011    10.10.1.1 → 10.10.1.2    TCP 83 8081 → 46898 [PSH, ACK] Seq=1055 Ack=1072 Win=65152 Len=17 TSval=3171249152 TSecr=1046989442
1711548870.780033350   674 0.619074761    10.10.1.2 → 10.10.1.1    TCP 83 46898 → 8081 [PSH, ACK] Seq=1072 Ack=1072 Win=64256 Len=17 TSval=1046989443 TSecr=3171249152
1711548872.780033350   676 0.619104935    10.10.1.1 → 10.10.1.2    TCP 83 8081 → 46898 [PSH, ACK] Seq=1072 Ack=1089 Win=65152 Len=17 TSval=3171249153 TSecr=1046989443
1711548880.780033350   684 0.620261818    10.10.1.2 → 10.10.1.1    TCP 83 46898 → 8081 [PSH, ACK] Seq=1089 Ack=1089 Win=64256 Len=17 TSval=1046989444 TSecr=3171249153
1711548882.780033350   686 0.620296229    10.10.1.1 → 10.10.1.2    TCP 83 8081 → 46898 [PSH, ACK] Seq=1089 Ack=1106 Win=65152 Len=17 TSval=3171249154 TSecr=1046989444
1711548890.780033350   694 0.621455472    10.10.1.2 → 10.10.1.1    TCP 83 46898 → 8081 [PSH, ACK] Seq=1106 Ack=1106 Win=64256 Len=17 TSval=1046989445 TSecr=3171249154
1711548892.780033350   696 0.621487442    10.10.1.1 → 10.10.1.2    TCP 83 8081 → 46898 [PSH, ACK] Seq=1106 Ack=1123 Win=65152 Len=17 TSval=3171249156 TSecr=1046989445
1711548900.780033350   704 0.622643516    10.10.1.2 → 10.10.1.1    TCP 83 46898 → 8081 [PSH, ACK] Seq=1123 Ack=1123 Win=64256 Len=17 TSval=1046989446 TSecr=3171249156
1711548902.780033350   706 0.622675764    10.10.1.1 → 10.10.1.2    TCP 83 8081 → 46898 [PSH, ACK] Seq=1123 Ack=1140 Win=65152 Len=17 TSval=3171249157 TSecr=1046989446
1711548910.780033350   714 0.623833705    10.10.1.2 → 10.10.1.1    TCP 83 46898 → 8081 [PSH, ACK] Seq=1140 Ack=1140 Win=64256 Len=17 TSval=1046989448 TSecr=3171249157
1711548912.780033350   716 0.623869437    10.10.1.1 → 10.10.1.2    TCP 83 8081 → 46898 [PSH, ACK] Seq=1140 Ack=1157 Win=65152 Len=17 TSval=3171249158 TSecr=1046989448
1711548920.780033350   724 0.625030488    10.10.1.2 → 10.10.1.1    TCP 83 46898 → 8081 [PSH, ACK] Seq=1157 Ack=1157 Win=64256 Len=17 TSval=1046989449 TSecr=3171249158
1711548922.780033350   726 0.625063459    10.10.1.1 → 10.10.1.2    TCP 83 8081 → 46898 [PSH, ACK] Seq=1157 Ack=1174 Win=65152 Len=17 TSval=3171249159 TSecr=1046989449
1711548930.780033350   734 0.626219322    10.10.1.2 → 10.10.1.1    TCP 83 46898 → 8081 [PSH, ACK] Seq=1174 Ack=1174 Win=64256 Len=17 TSval=1046989450 TSecr=3171249159
1711548932.780033350   736 0.626251495    10.10.1.1 → 10.10.1.2    TCP 83 8081 → 46898 [PSH, ACK] Seq=1174 Ack=1191 Win=65152 Len=17 TSval=3171249160 TSecr=1046989450
1711548940.780033350   744 0.627407643    10.10.1.2 → 10.10.1.1    TCP 83 46898 → 8081 [PSH, ACK] Seq=1191 Ack=1191 Win=64256 Len=17 TSval=1046989451 TSecr=3171249160
1711548942.780033350   746 0.627447520    10.10.1.1 → 10.10.1.2    TCP 83 8081 → 46898 [PSH, ACK] Seq=1191 Ack=1208 Win=65152 Len=17 TSval=3171249162 TSecr=1046989451
1711548950.780033350   754 0.628605055    10.10.1.2 → 10.10.1.1    TCP 83 46898 → 8081 [PSH, ACK] Seq=1208 Ack=1208 Win=64256 Len=17 TSval=1046989452 TSecr=3171249162
1711548952.780033350   756 0.628636915    10.10.1.1 → 10.10.1.2    TCP 83 8081 → 46898 [PSH, ACK] Seq=1208 Ack=1225 Win=65152 Len=17 TSval=3171249163 TSecr=1046989452
1711548960.780033350   764 0.629796372    10.10.1.2 → 10.10.1.1    TCP 83 46898 → 8081 [PSH, ACK] Seq=1225 Ack=1225 Win=64256 Len=17 TSval=1046989454 TSecr=3171249163
1711548962.780033350   766 0.629827698    10.10.1.1 → 10.10.1.2    TCP 83 8081 → 46898 [PSH, ACK] Seq=1225 Ack=1242 Win=65152 Len=17 TSval=3171249164 TSecr=1046989454
1711548970.780033350   774 0.630983879    10.10.1.2 → 10.10.1.1    TCP 83 46898 → 8081 [PSH, ACK] Seq=1242 Ack=1242 Win=64256 Len=17 TSval=1046989455 TSecr=3171249164
1711548972.780033350   776 0.631015666    10.10.1.1 → 10.10.1.2    TCP 83 8081 → 46898 [PSH, ACK] Seq=1242 Ack=1259 Win=65152 Len=17 TSval=3171249165 TSecr=1046989455
1711548980.780033350   784 0.632172752    10.10.1.2 → 10.10.1.1    TCP 83 46898 → 8081 [PSH, ACK] Seq=1259 Ack=1259 Win=64256 Len=17 TSval=1046989456 TSecr=3171249165
1711548982.780033350   786 0.632207617    10.10.1.1 → 10.10.1.2    TCP 83 8081 → 46898 [PSH, ACK] Seq=1259 Ack=1276 Win=65152 Len=17 TSval=3171249166 TSecr=1046989456
1711548990.780033350   794 0.633365674    10.10.1.2 → 10.10.1.1    TCP 83 46898 → 8081 [PSH, ACK] Seq=1276 Ack=1276 Win=64256 Len=17 TSval=1046989457 TSecr=3171249166
1711548992.780033350   796 0.633397330    10.10.1.1 → 10.10.1.2    TCP 83 8081 → 46898 [PSH, ACK] Seq=1276 Ack=1293 Win=65152 Len=17 TSval=3171249167 TSecr=1046989457
1711549000.780033350   804 0.634553962    10.10.1.2 → 10.10.1.1    TCP 83 46898 → 8081 [PSH, ACK] Seq=1293 Ack=1293 Win=64256 Len=17 TSval=1046989458 TSecr=3171249167
1711549002.780033350   806 0.634585712    10.10.1.1 → 10.10.1.2    TCP 83 8081 → 46898 [PSH, ACK] Seq=1293 Ack=1310 Win=65152 Len=17 TSval=3171249169 TSecr=1046989458
1711549010.780033350   814 0.635743674    10.10.1.2 → 10.10.1.1    TCP 83 46898 → 8081 [PSH, ACK] Seq=1310 Ack=1310 Win=64256 Len=17 TSval=1046989459 TSecr=3171249169
1711549012.780033350   816 0.635777874    10.10.1.1 → 10.10.1.2    TCP 83 8081 → 46898 [PSH, ACK] Seq=1310 Ack=1327 Win=65152 Len=17 TSval=3171249170 TSecr=1046989459
1711549020.780033350   824 0.636938206    10.10.1.2 → 10.10.1.1    TCP 83 46898 → 8081 [PSH, ACK] Seq=1327 Ack=1327 Win=64256 Len=17 TSval=1046989461 TSecr=3171249170
1711549022.780033350   826 0.636969999    10.10.1.1 → 10.10.1.2    TCP 83 8081 → 46898 [PSH, ACK] Seq=1327 Ack=1344 Win=65152 Len=17 TSval=3171249171 TSecr=1046989461
1711549030.780033350   834 0.638126216    10.10.1.2 → 10.10.1.1    TCP 83 46898 → 8081 [PSH, ACK] Seq=1344 Ack=1344 Win=64256 Len=17 TSval=1046989462 TSecr=3171249171
1711549032.780033350   836 0.638158896    10.10.1.1 → 10.10.1.2    TCP 83 8081 → 46898 [PSH, ACK] Seq=1344 Ack=1361 Win=65152 Len=17 TSval=3171249172 TSecr=1046989462
1711549040.780033350   844 0.639314892    10.10.1.2 → 10.10.1.1    TCP 83 46898 → 8081 [PSH, ACK] Seq=1361 Ack=1361 Win=64256 Len=17 TSval=1046989463 TSecr=3171249172
1711549042.780033350   846 0.639346944    10.10.1.1 → 10.10.1.2    TCP 83 8081 → 46898 [PSH, ACK] Seq=1361 Ack=1378 Win=65152 Len=17 TSval=3171249173 TSecr=1046989463
1711549050.780033350   854 0.640503804    10.10.1.2 → 10.10.1.1    TCP 83 46898 → 8081 [PSH, ACK] Seq=1378 Ack=1378 Win=64256 Len=17 TSval=1046989464 TSecr=3171249173
1711549052.780033350   856 0.640536026    10.10.1.1 → 10.10.1.2    TCP 83 8081 → 46898 [PSH, ACK] Seq=1378 Ack=1395 Win=65152 Len=17 TSval=3171249175 TSecr=1046989464
1711549060.780033350   864 0.641694308    10.10.1.2 → 10.10.1.1    TCP 83 46898 → 8081 [PSH, ACK] Seq=1395 Ack=1395 Win=64256 Len=17 TSval=1046989465 TSecr=3171249175
1711549062.780033350   866 0.641725243    10.10.1.1 → 10.10.1.2    TCP 83 8081 → 46898 [PSH, ACK] Seq=1395 Ack=1412 Win=65152 Len=17 TSval=3171249176 TSecr=1046989465
1711549070.780033350   874 0.642880956    10.10.1.2 → 10.10.1.1    TCP 83 46898 → 8081 [PSH, ACK] Seq=1412 Ack=1412 Win=64256 Len=17 TSval=1046989467 TSecr=3171249176
1711549072.780033350   876 0.642911001    10.10.1.1 → 10.10.1.2    TCP 83 8081 → 46898 [PSH, ACK] Seq=1412 Ack=1429 Win=65152 Len=17 TSval=3171249177 TSecr=1046989467
1711549080.780033350   884 0.644067821    10.10.1.2 → 10.10.1.1    TCP 83 46898 → 8081 [PSH, ACK] Seq=1429 Ack=1429 Win=64256 Len=17 TSval=1046989468 TSecr=3171249177
1711549082.780033350   886 0.644102812    10.10.1.1 → 10.10.1.2    TCP 83 8081 → 46898 [PSH, ACK] Seq=1429 Ack=1446 Win=65152 Len=17 TSval=3171249178 TSecr=1046989468
1711549090.780033350   894 0.645261955    10.10.1.2 → 10.10.1.1    TCP 83 46898 → 8081 [PSH, ACK] Seq=1446 Ack=1446 Win=64256 Len=17 TSval=1046989469 TSecr=3171249178
1711549092.780033350   896 0.645292421    10.10.1.1 → 10.10.1.2    TCP 83 8081 → 46898 [PSH, ACK] Seq=1446 Ack=1463 Win=65152 Len=17 TSval=3171249179 TSecr=1046989469
1711549100.780033350   904 0.646448465    10.10.1.2 → 10.10.1.1    TCP 83 46898 → 8081 [PSH, ACK] Seq=1463 Ack=1463 Win=64256 Len=17 TSval=1046989470 TSecr=3171249179
1711549102.780033350   906 0.646478417    10.10.1.1 → 10.10.1.2    TCP 83 8081 → 46898 [PSH, ACK] Seq=1463 Ack=1480 Win=65152 Len=17 TSval=3171249181 TSecr=1046989470
1711549110.780033350   914 0.647634143    10.10.1.2 → 10.10.1.1    TCP 83 46898 → 8081 [PSH, ACK] Seq=1480 Ack=1480 Win=64256 Len=17 TSval=1046989471 TSecr=3171249181
1711549112.780033350   916 0.647668154    10.10.1.1 → 10.10.1.2    TCP 83 8081 → 46898 [PSH, ACK] Seq=1480 Ack=1497 Win=65152 Len=17 TSval=3171249182 TSecr=1046989471
1711549120.780033350   924 0.648824411    10.10.1.2 → 10.10.1.1    TCP 83 46898 → 8081 [PSH, ACK] Seq=1497 Ack=1497 Win=64256 Len=17 TSval=1046989473 TSecr=3171249182
1711549122.780033350   926 0.648856151    10.10.1.1 → 10.10.1.2    TCP 83 8081 → 46898 [PSH, ACK] Seq=1497 Ack=1514 Win=65152 Len=17 TSval=3171249183 TSecr=1046989473
1711549130.780033350   934 0.650014394    10.10.1.2 → 10.10.1.1    TCP 83 46898 → 8081 [PSH, ACK] Seq=1514 Ack=1514 Win=64256 Len=17 TSval=1046989474 TSecr=3171249183
1711549132.780033350   936 0.650045974    10.10.1.1 → 10.10.1.2    TCP 83 8081 → 46898 [PSH, ACK] Seq=1514 Ack=1531 Win=65152 Len=17 TSval=3171249184 TSecr=1046989474
1711549140.780033350   944 0.651202038    10.10.1.2 → 10.10.1.1    TCP 83 46898 → 8081 [PSH, ACK] Seq=1531 Ack=1531 Win=64256 Len=17 TSval=1046989475 TSecr=3171249184
1711549142.780033350   946 0.651232203    10.10.1.1 → 10.10.1.2    TCP 83 8081 → 46898 [PSH, ACK] Seq=1531 Ack=1548 Win=65152 Len=17 TSval=3171249185 TSecr=1046989475
1711549150.780033350   954 0.652389085    10.10.1.2 → 10.10.1.1    TCP 83 46898 → 8081 [PSH, ACK] Seq=1548 Ack=1548 Win=64256 Len=17 TSval=1046989476 TSecr=3171249185
1711549152.780033350   956 0.652423233    10.10.1.1 → 10.10.1.2    TCP 83 8081 → 46898 [PSH, ACK] Seq=1548 Ack=1565 Win=65152 Len=17 TSval=3171249187 TSecr=1046989476
1711549160.780033350   964 0.653582467    10.10.1.2 → 10.10.1.1    TCP 83 46898 → 8081 [PSH, ACK] Seq=1565 Ack=1565 Win=64256 Len=17 TSval=1046989477 TSecr=3171249187
1711549162.780033350   966 0.653613930    10.10.1.1 → 10.10.1.2    TCP 83 8081 → 46898 [PSH, ACK] Seq=1565 Ack=1582 Win=65152 Len=17 TSval=3171249188 TSecr=1046989477
1711549170.780033350   974 0.654770183    10.10.1.2 → 10.10.1.1    TCP 83 46898 → 8081 [PSH, ACK] Seq=1582 Ack=1582 Win=64256 Len=17 TSval=1046989479 TSecr=3171249188
1711549172.780033350   976 0.654802044    10.10.1.1 → 10.10.1.2    TCP 83 8081 → 46898 [PSH, ACK] Seq=1582 Ack=1599 Win=65152 Len=17 TSval=3171249189 TSecr=1046989479
1711549180.780033350   984 0.655958785    10.10.1.2 → 10.10.1.1    TCP 83 46898 → 8081 [PSH, ACK] Seq=1599 Ack=1599 Win=64256 Len=17 TSval=1046989480 TSecr=3171249189
1711549182.780033350   986 0.655992632    10.10.1.1 → 10.10.1.2    TCP 83 8081 → 46898 [PSH, ACK] Seq=1599 Ack=1616 Win=65152 Len=17 TSval=3171249190 TSecr=1046989480
1711549190.780033350   994 0.657151593    10.10.1.2 → 10.10.1.1    TCP 83 46898 → 8081 [PSH, ACK] Seq=1616 Ack=1616 Win=64256 Len=17 TSval=1046989481 TSecr=3171249190
1711549192.780033350   996 0.657182746    10.10.1.1 → 10.10.1.2    TCP 83 8081 → 46898 [PSH, ACK] Seq=1616 Ack=1633 Win=65152 Len=17 TSval=3171249191 TSecr=1046989481
1711549200.780033350  1004 0.658338925    10.10.1.2 → 10.10.1.1    TCP 83 46898 → 8081 [PSH, ACK] Seq=1633 Ack=1633 Win=64256 Len=17 TSval=1046989482 TSecr=3171249191
1711549202.780033350  1006 0.658370283    10.10.1.1 → 10.10.1.2    TCP 83 8081 → 46898 [PSH, ACK] Seq=1633 Ack=1650 Win=65152 Len=17 TSval=3171249192 TSecr=1046989482
1711549210.780033350  1014 0.659526468    10.10.1.2 → 10.10.1.1    TCP 83 46898 → 8081 [PSH, ACK] Seq=1650 Ack=1650 Win=64256 Len=17 TSval=1046989483 TSecr=3171249192
1711549212.780033350  1016 0.659561038    10.10.1.1 → 10.10.1.2    TCP 83 8081 → 46898 [PSH, ACK] Seq=1650 Ack=1667 Win=65152 Len=17 TSval=3171249194 TSecr=1046989483
1711549220.780033350  1024 0.660718105    10.10.1.2 → 10.10.1.1    TCP 83 46898 → 8081 [PSH, ACK] Seq=1667 Ack=1667 Win=64256 Len=17 TSval=1046989484 TSecr=3171249194
1711549222.780033350  1026 0.660750447    10.10.1.1 → 10.10.1.2    TCP 83 8081 → 46898 [PSH, ACK] Seq=1667 Ack=1684 Win=65152 Len=17 TSval=3171249195 TSecr=1046989484
1711549230.780033350  1034 0.661910095    10.10.1.2 → 10.10.1.1    TCP 83 46898 → 8081 [PSH, ACK] Seq=1684 Ack=1684 Win=64256 Len=17 TSval=1046989486 TSecr=3171249195
1711549232.780033350  1036 0.661941659    10.10.1.1 → 10.10.1.2    TCP 83 8081 → 46898 [PSH, ACK] Seq=1684 Ack=1701 Win=65152 Len=17 TSval=3171249196 TSecr=1046989486
1711549240.780033350  1044 0.663097930    10.10.1.2 → 10.10.1.1    TCP 83 46898 → 8081 [PSH, ACK] Seq=1701 Ack=1701 Win=64256 Len=17 TSval=1046989487 TSecr=3171249196
1711549242.780033350  1046 0.663129650    10.10.1.1 → 10.10.1.2    TCP 83 8081 → 46898 [PSH, ACK] Seq=1701 Ack=1718 Win=65152 Len=17 TSval=3171249197 TSecr=1046989487
1711549250.780033350  1054 0.664285863    10.10.1.2 → 10.10.1.1    TCP 83 46898 → 8081 [PSH, ACK] Seq=1718 Ack=1718 Win=64256 Len=17 TSval=1046989488 TSecr=3171249197
1711549252.780033350  1056 0.664320954    10.10.1.1 → 10.10.1.2    TCP 83 8081 → 46898 [PSH, ACK] Seq=1718 Ack=1735 Win=65152 Len=17 TSval=3171249198 TSecr=1046989488
1711549260.780033350  1064 0.665479817    10.10.1.2 → 10.10.1.1    TCP 83 46898 → 8081 [PSH, ACK] Seq=1735 Ack=1735 Win=64256 Len=17 TSval=1046989489 TSecr=3171249198
1711549262.780033350  1066 0.665511705    10.10.1.1 → 10.10.1.2    TCP 83 8081 → 46898 [PSH, ACK] Seq=1735 Ack=1752 Win=65152 Len=17 TSval=3171249200 TSecr=1046989489
1711549270.780033350  1074 0.666668585    10.10.1.2 → 10.10.1.1    TCP 83 46898 → 8081 [PSH, ACK] Seq=1752 Ack=1752 Win=64256 Len=17 TSval=1046989490 TSecr=3171249200
1711549272.780033350  1076 0.666700010    10.10.1.1 → 10.10.1.2    TCP 83 8081 → 46898 [PSH, ACK] Seq=1752 Ack=1769 Win=65152 Len=17 TSval=3171249201 TSecr=1046989490
1711549280.780033350  1084 0.667856979    10.10.1.2 → 10.10.1.1    TCP 83 46898 → 8081 [PSH, ACK] Seq=1769 Ack=1769 Win=64256 Len=17 TSval=1046989492 TSecr=3171249201
1711549282.780033350  1086 0.667890947    10.10.1.1 → 10.10.1.2    TCP 83 8081 → 46898 [PSH, ACK] Seq=1769 Ack=1786 Win=65152 Len=17 TSval=3171249202 TSecr=1046989492
1711549290.780033350  1094 0.669050204    10.10.1.2 → 10.10.1.1    TCP 83 46898 → 8081 [PSH, ACK] Seq=1786 Ack=1786 Win=64256 Len=17 TSval=1046989493 TSecr=3171249202
1711549292.780033350  1096 0.669082277    10.10.1.1 → 10.10.1.2    TCP 83 8081 → 46898 [PSH, ACK] Seq=1786 Ack=1803 Win=65152 Len=17 TSval=3171249203 TSecr=1046989493
1711549300.780033350  1104 0.670238482    10.10.1.2 → 10.10.1.1    TCP 83 46898 → 8081 [PSH, ACK] Seq=1803 Ack=1803 Win=64256 Len=17 TSval=1046989494 TSecr=3171249203
1711549302.780033350  1106 0.670270442    10.10.1.1 → 10.10.1.2    TCP 83 8081 → 46898 [PSH, ACK] Seq=1803 Ack=1820 Win=65152 Len=17 TSval=3171249204 TSecr=1046989494
1711549310.780033350  1114 0.671427483    10.10.1.2 → 10.10.1.1    TCP 83 46898 → 8081 [PSH, ACK] Seq=1820 Ack=1820 Win=64256 Len=17 TSval=1046989495 TSecr=3171249204
1711549312.780033350  1116 0.671462158    10.10.1.1 → 10.10.1.2    TCP 83 8081 → 46898 [PSH, ACK] Seq=1820 Ack=1837 Win=65152 Len=17 TSval=3171249206 TSecr=1046989495
1711549320.780033350  1124 0.672618302    10.10.1.2 → 10.10.1.1    TCP 83 46898 → 8081 [PSH, ACK] Seq=1837 Ack=1837 Win=64256 Len=17 TSval=1046989496 TSecr=3171249206
1711549322.780033350  1126 0.672647895    10.10.1.1 → 10.10.1.2    TCP 83 8081 → 46898 [PSH, ACK] Seq=1837 Ack=1854 Win=65152 Len=17 TSval=3171249207 TSecr=1046989496
1711549330.780033350  1134 0.673807459    10.10.1.2 → 10.10.1.1    TCP 83 46898 → 8081 [PSH, ACK] Seq=1854 Ack=1854 Win=64256 Len=17 TSval=1046989498 TSecr=3171249207
1711549332.780033350  1136 0.673837894    10.10.1.1 → 10.10.1.2    TCP 83 8081 → 46898 [PSH, ACK] Seq=1854 Ack=1871 Win=65152 Len=17 TSval=3171249208 TSecr=1046989498
1711549340.780033350  1144 0.674993764    10.10.1.2 → 10.10.1.1    TCP 83 46898 → 8081 [PSH, ACK] Seq=1871 Ack=1871 Win=64256 Len=17 TSval=1046989499 TSecr=3171249208
1711549342.780033350  1146 0.675024097    10.10.1.1 → 10.10.1.2    TCP 83 8081 → 46898 [PSH, ACK] Seq=1871 Ack=1888 Win=65152 Len=17 TSval=3171249209 TSecr=1046989499
1711549350.780033350  1154 0.676181025    10.10.1.2 → 10.10.1.1    TCP 83 46898 → 8081 [PSH, ACK] Seq=1888 Ack=1888 Win=64256 Len=17 TSval=1046989500 TSecr=3171249209
1711549352.780033350  1156 0.676215229    10.10.1.1 → 10.10.1.2    TCP 83 8081 → 46898 [PSH, ACK] Seq=1888 Ack=1905 Win=65152 Len=17 TSval=3171249210 TSecr=1046989500
1711549360.780033350  1164 0.677374010    10.10.1.2 → 10.10.1.1    TCP 83 46898 → 8081 [PSH, ACK] Seq=1905 Ack=1905 Win=64256 Len=17 TSval=1046989501 TSecr=3171249210
1711549362.780033350  1166 0.677407330    10.10.1.1 → 10.10.1.2    TCP 83 8081 → 46898 [PSH, ACK] Seq=1905 Ack=1922 Win=65152 Len=17 TSval=3171249211 TSecr=1046989501
1711549370.780033350  1174 0.678563437    10.10.1.2 → 10.10.1.1    TCP 83 46898 → 8081 [PSH, ACK] Seq=1922 Ack=1922 Win=64256 Len=17 TSval=1046989502 TSecr=3171249211
1711549373.780033350  1177 0.678622543    10.10.1.1 → 10.10.1.2    TCP 83 8081 → 46898 [PSH, ACK] Seq=1922 Ack=1939 Win=65152 Len=17 TSval=3171249213 TSecr=1046989502
1711549380.780033350  1184 0.679770405    10.10.1.2 → 10.10.1.1    TCP 83 46898 → 8081 [PSH, ACK] Seq=1939 Ack=1939 Win=64256 Len=17 TSval=1046989504 TSecr=3171249213
1711549382.780033350  1186 0.679804935    10.10.1.1 → 10.10.1.2    TCP 83 8081 → 46898 [PSH, ACK] Seq=1939 Ack=1956 Win=65152 Len=17 TSval=3171249214 TSecr=1046989504
1711549390.780033350  1194 0.680963749    10.10.1.2 → 10.10.1.1    TCP 83 46898 → 8081 [PSH, ACK] Seq=1956 Ack=1956 Win=64256 Len=17 TSval=1046989505 TSecr=3171249214
1711549392.780033350  1196 0.680995303    10.10.1.1 → 10.10.1.2    TCP 83 8081 → 46898 [PSH, ACK] Seq=1956 Ack=1973 Win=65152 Len=17 TSval=3171249215 TSecr=1046989505
1711549400.780033350  1204 0.682151152    10.10.1.2 → 10.10.1.1    TCP 83 46898 → 8081 [PSH, ACK] Seq=1973 Ack=1973 Win=64256 Len=17 TSval=1046989506 TSecr=3171249215
1711549402.780033350  1206 0.682182395    10.10.1.1 → 10.10.1.2    TCP 83 8081 → 46898 [PSH, ACK] Seq=1973 Ack=1990 Win=65152 Len=17 TSval=3171249216 TSecr=1046989506
1711549410.780033350  1214 0.683337977    10.10.1.2 → 10.10.1.1    TCP 83 46898 → 8081 [PSH, ACK] Seq=1990 Ack=1990 Win=64256 Len=17 TSval=1046989507 TSecr=3171249216
1711549412.780033350  1216 0.683367879    10.10.1.1 → 10.10.1.2    TCP 83 8081 → 46898 [PSH, ACK] Seq=1990 Ack=2007 Win=65152 Len=17 TSval=3171249217 TSecr=1046989507
1711549420.780033350  1224 0.684524636    10.10.1.2 → 10.10.1.1    TCP 83 46898 → 8081 [PSH, ACK] Seq=2007 Ack=2007 Win=64256 Len=17 TSval=1046989508 TSecr=3171249217
1711549422.780033350  1226 0.684558695    10.10.1.1 → 10.10.1.2    TCP 83 8081 → 46898 [PSH, ACK] Seq=2007 Ack=2024 Win=65152 Len=17 TSval=3171249219 TSecr=1046989508
1711549430.780033350  1234 0.685718028    10.10.1.2 → 10.10.1.1    TCP 83 46898 → 8081 [PSH, ACK] Seq=2024 Ack=2024 Win=64256 Len=17 TSval=1046989509 TSecr=3171249219
1711549432.780033350  1236 0.685749369    10.10.1.1 → 10.10.1.2    TCP 83 8081 → 46898 [PSH, ACK] Seq=2024 Ack=2041 Win=65152 Len=17 TSval=3171249220 TSecr=1046989509
1711549440.780033350  1244 0.686905596    10.10.1.2 → 10.10.1.1    TCP 83 46898 → 8081 [PSH, ACK] Seq=2041 Ack=2041 Win=64256 Len=17 TSval=1046989511 TSecr=3171249220
