1711548334.740092516    22 0.259565872    10.10.1.2 → 10.10.1.1    TCP 74 39588 → 8081 [SYN] Seq=0 Win=64240 Len=0 MSS=1460 SACK_PERM=1 TSval=1047105032 TSecr=0 WS=128
1711548335.740092516    23 0.259600707    10.10.1.1 → 10.10.1.2    TCP 74 8081 → 39588 [SYN, ACK] Seq=0 Ack=1 Win=65160 Len=0 MSS=1460 SACK_PERM=1 TSval=3171364742 TSecr=1047105032 WS=128
1711548336.740092516    24 0.259635367    10.10.1.2 → 10.10.1.1    TCP 66 39588 → 8081 [ACK] Seq=1 Ack=1 Win=64256 Len=0 TSval=1047105032 TSecr=3171364742
1711548346.740092516    34 0.520294431    10.10.1.2 → 10.10.1.1    TCP 83 39588 → 8081 [PSH, ACK] Seq=1 Ack=1 Win=64256 Len=17 TSval=1047105292 TSecr=3171364742
1711548347.740092516    35 0.520310499    10.10.1.1 → 10.10.1.2    TCP 66 8081 → 39588 [ACK] Seq=1 Ack=18 Win=65152 Len=0 TSval=3171365003 TSecr=1047105292
1711548350.740092516    38 0.520488697    10.10.1.1 → 10.10.1.2    TCP 83 8081 → 39588 [PSH, ACK] Seq=1 Ack=18 Win=65152 Len=17 TSval=3171365003 TSecr=1047105292
1711548351.740092516    39 0.520514836    10.10.1.2 → 10.10.1.1    TCP 66 39588 → 8081 [ACK] Seq=18 Ack=18 Win=64256 Len=0 TSval=1047105292 TSecr=3171365003
1711548358.740092516    46 0.530656892    10.10.1.2 → 10.10.1.1    TCP 83 39588 → 8081 [PSH, ACK] Seq=18 Ack=18 Win=64256 Len=17 TSval=1047105303 TSecr=3171365003
1711548361.740092516    49 0.530690968    10.10.1.1 → 10.10.1.2    TCP 83 8081 → 39588 [PSH, ACK] Seq=18 Ack=35 Win=65152 Len=17 TSval=3171365013 TSecr=1047105303
1711548368.740092516    56 0.540860523    10.10.1.2 → 10.10.1.1    TCP 83 39588 → 8081 [PSH, ACK] Seq=35 Ack=35 Win=64256 Len=17 TSval=1047105313 TSecr=3171365013
1711548371.740092516    59 0.540902298    10.10.1.1 → 10.10.1.2    TCP 83 8081 → 39588 [PSH, ACK] Seq=35 Ack=52 Win=65152 Len=17 TSval=3171365023 TSecr=1047105313
1711548378.740092516    66 0.551065716    10.10.1.2 → 10.10.1.1    TCP 83 39588 → 8081 [PSH, ACK] Seq=52 Ack=52 Win=64256 Len=17 TSval=1047105323 TSecr=3171365023
1711548381.740092516    69 0.551116568    10.10.1.1 → 10.10.1.2    TCP 83 8081 → 39588 [PSH, ACK] Seq=52 Ack=69 Win=65152 Len=17 TSval=3171365034 TSecr=1047105323
1711548388.740092516    76 0.561280087    10.10.1.2 → 10.10.1.1    TCP 83 39588 → 8081 [PSH, ACK] Seq=69 Ack=69 Win=64256 Len=17 TSval=1047105333 TSecr=3171365034
1711548391.740092516    79 0.561338727    10.10.1.1 → 10.10.1.2    TCP 83 8081 → 39588 [PSH, ACK] Seq=69 Ack=86 Win=65152 Len=17 TSval=3171365044 TSecr=1047105333
1711548398.740092516    86 0.571499876    10.10.1.2 → 10.10.1.1    TCP 83 39588 → 8081 [PSH, ACK] Seq=86 Ack=86 Win=64256 Len=17 TSval=1047105343 TSecr=3171365044
1711548400.740092516    88 0.571548820    10.10.1.1 → 10.10.1.2    TCP 83 8081 → 39588 [PSH, ACK] Seq=86 Ack=103 Win=65152 Len=17 TSval=3171365054 TSecr=1047105343
1711548408.740092516    96 0.581710932    10.10.1.2 → 10.10.1.1    TCP 83 39588 → 8081 [PSH, ACK] Seq=103 Ack=103 Win=64256 Len=17 TSval=1047105354 TSecr=3171365054
1711548410.740092516    98 0.581757757    10.10.1.1 → 10.10.1.2    TCP 83 8081 → 39588 [PSH, ACK] Seq=103 Ack=120 Win=65152 Len=17 TSval=3171365064 TSecr=1047105354
1711548418.740092516   106 0.591920371    10.10.1.2 → 10.10.1.1    TCP 83 39588 → 8081 [PSH, ACK] Seq=120 Ack=120 Win=64256 Len=17 TSval=1047105364 TSecr=3171365064
1711548420.740092516   108 0.591969050    10.10.1.1 → 10.10.1.2    TCP 83 8081 → 39588 [PSH, ACK] Seq=120 Ack=137 Win=65152 Len=17 TSval=3171365074 TSecr=1047105364
1711548428.740092516   116 0.602129559    10.10.1.2 → 10.10.1.1    TCP 83 39588 → 8081 [PSH, ACK] Seq=137 Ack=137 Win=64256 Len=17 TSval=1047105374 TSecr=3171365074
1711548430.740092516   118 0.602176589    10.10.1.1 → 10.10.1.2    TCP 83 8081 → 39588 [PSH, ACK] Seq=137 Ack=154 Win=65152 Len=17 TSval=3171365085 TSecr=1047105374
1711548438.740092516   126 0.612337395    10.10.1.2 → 10.10.1.1    TCP 83 39588 → 8081 [PSH, ACK] Seq=154 Ack=154 Win=64256 Len=17 TSval=1047105384 TSecr=3171365085
1711548440.740092516   128 0.612384955    10.10.1.1 → 10.10.1.2    TCP 83 8081 → 39588 [PSH, ACK] Seq=154 Ack=171 Win=65152 Len=17 TSval=3171365095 TSecr=1047105384
1711548448.740092516   136 0.622558238    10.10.1.2 → 10.10.1.1    TCP 83 39588 → 8081 [PSH, ACK] Seq=171 Ack=171 Win=64256 Len=17 TSval=1047105395 TSecr=3171365095
1711548451.740092516   139 0.622616641    10.10.1.1 → 10.10.1.2    TCP 83 8081 → 39588 [PSH, ACK] Seq=171 Ack=188 Win=65152 Len=17 TSval=3171365105 TSecr=1047105395
1711548458.740092516   146 0.632785081    10.10.1.2 → 10.10.1.1    TCP 83 39588 → 8081 [PSH, ACK] Seq=188 Ack=188 Win=64256 Len=17 TSval=1047105405 TSecr=3171365105
1711548460.740092516   148 0.632826964    10.10.1.1 → 10.10.1.2    TCP 83 8081 → 39588 [PSH, ACK] Seq=188 Ack=205 Win=65152 Len=17 TSval=3171365115 TSecr=1047105405
1711548468.740092516   156 0.642991994    10.10.1.2 → 10.10.1.1    TCP 83 39588 → 8081 [PSH, ACK] Seq=205 Ack=205 Win=64256 Len=17 TSval=1047105415 TSecr=3171365115
1711548471.740092516   159 0.643040639    10.10.1.1 → 10.10.1.2    TCP 83 8081 → 39588 [PSH, ACK] Seq=205 Ack=222 Win=65152 Len=17 TSval=3171365126 TSecr=1047105415
1711548478.740092516   166 0.653211758    10.10.1.2 → 10.10.1.1    TCP 83 39588 → 8081 [PSH, ACK] Seq=222 Ack=222 Win=64256 Len=17 TSval=1047105425 TSecr=3171365126
1711548480.740092516   168 0.653261359    10.10.1.1 → 10.10.1.2    TCP 83 8081 → 39588 [PSH, ACK] Seq=222 Ack=239 Win=65152 Len=17 TSval=3171365136 TSecr=1047105425
1711548488.740092516   176 0.663424469    10.10.1.2 → 10.10.1.1    TCP 83 39588 → 8081 [PSH, ACK] Seq=239 Ack=239 Win=64256 Len=17 TSval=1047105435 TSecr=3171365136
1711548490.740092516   178 0.663460052    10.10.1.1 → 10.10.1.2    TCP 83 8081 → 39588 [PSH, ACK] Seq=239 Ack=256 Win=65152 Len=17 TSval=3171365146 TSecr=1047105435
1711548498.740092516   186 0.673624297    10.10.1.2 → 10.10.1.1    TCP 83 39588 → 8081 [PSH, ACK] Seq=256 Ack=256 Win=64256 Len=17 TSval=1047105446 TSecr=3171365146
1711548500.740092516   188 0.673659179    10.10.1.1 → 10.10.1.2    TCP 83 8081 → 39588 [PSH, ACK] Seq=256 Ack=273 Win=65152 Len=17 TSval=3171365156 TSecr=1047105446
1711548508.740092516   196 0.683820138    10.10.1.2 → 10.10.1.1    TCP 83 39588 → 8081 [PSH, ACK] Seq=273 Ack=273 Win=64256 Len=17 TSval=1047105456 TSecr=3171365156
1711548510.740092516   198 0.683855586    10.10.1.1 → 10.10.1.2    TCP 83 8081 → 39588 [PSH, ACK] Seq=273 Ack=290 Win=65152 Len=17 TSval=3171365166 TSecr=1047105456
1711548518.740092516   206 0.694018363    10.10.1.2 → 10.10.1.1    TCP 83 39588 → 8081 [PSH, ACK] Seq=290 Ack=290 Win=64256 Len=17 TSval=1047105466 TSecr=3171365166
1711548520.740092516   208 0.694054277    10.10.1.1 → 10.10.1.2    TCP 83 8081 → 39588 [PSH, ACK] Seq=290 Ack=307 Win=65152 Len=17 TSval=3171365177 TSecr=1047105466
1711548528.740092516   216 0.704217045    10.10.1.2 → 10.10.1.1    TCP 83 39588 → 8081 [PSH, ACK] Seq=307 Ack=307 Win=64256 Len=17 TSval=1047105476 TSecr=3171365177
1711548530.740092516   218 0.704251272    10.10.1.1 → 10.10.1.2    TCP 83 8081 → 39588 [PSH, ACK] Seq=307 Ack=324 Win=65152 Len=17 TSval=3171365187 TSecr=1047105476
1711548538.740092516   226 0.714413255    10.10.1.2 → 10.10.1.1    TCP 83 39588 → 8081 [PSH, ACK] Seq=324 Ack=324 Win=64256 Len=17 TSval=1047105486 TSecr=3171365187
1711548540.740092516   228 0.714449595    10.10.1.1 → 10.10.1.2    TCP 83 8081 → 39588 [PSH, ACK] Seq=324 Ack=341 Win=65152 Len=17 TSval=3171365197 TSecr=1047105486
1711548548.740092516   236 0.724611983    10.10.1.2 → 10.10.1.1    TCP 83 39588 → 8081 [PSH, ACK] Seq=341 Ack=341 Win=64256 Len=17 TSval=1047105497 TSecr=3171365197
1711548550.740092516   238 0.724649311    10.10.1.1 → 10.10.1.2    TCP 83 8081 → 39588 [PSH, ACK] Seq=341 Ack=358 Win=65152 Len=17 TSval=3171365207 TSecr=1047105497
1711548558.740092516   246 0.734811474    10.10.1.2 → 10.10.1.1    TCP 83 39588 → 8081 [PSH, ACK] Seq=358 Ack=358 Win=64256 Len=17 TSval=1047105507 TSecr=3171365207
1711548560.740092516   248 0.734845624    10.10.1.1 → 10.10.1.2    TCP 83 8081 → 39588 [PSH, ACK] Seq=358 Ack=375 Win=65152 Len=17 TSval=3171365217 TSecr=1047105507
1711548568.740092516   256 0.745010128    10.10.1.2 → 10.10.1.1    TCP 83 39588 → 8081 [PSH, ACK] Seq=375 Ack=375 Win=64256 Len=17 TSval=1047105517 TSecr=3171365217
1711548570.740092516   258 0.745048830    10.10.1.1 → 10.10.1.2    TCP 83 8081 → 39588 [PSH, ACK] Seq=375 Ack=392 Win=65152 Len=17 TSval=3171365228 TSecr=1047105517
1711548578.740092516   266 0.755212838    10.10.1.2 → 10.10.1.1    TCP 83 39588 → 8081 [PSH, ACK] Seq=392 Ack=392 Win=64256 Len=17 TSval=1047105527 TSecr=3171365228
1711548580.740092516   268 0.755251993    10.10.1.1 → 10.10.1.2    TCP 83 8081 → 39588 [PSH, ACK] Seq=392 Ack=409 Win=65152 Len=17 TSval=3171365238 TSecr=1047105527
1711548588.740092516   276 0.765413514    10.10.1.2 → 10.10.1.1    TCP 83 39588 → 8081 [PSH, ACK] Seq=409 Ack=409 Win=64256 Len=17 TSval=1047105537 TSecr=3171365238
1711548590.740092516   278 0.765449459    10.10.1.1 → 10.10.1.2    TCP 83 8081 → 39588 [PSH, ACK] Seq=409 Ack=426 Win=65152 Len=17 TSval=3171365248 TSecr=1047105537
1711548598.740092516   286 0.775611918    10.10.1.2 → 10.10.1.1    TCP 83 39588 → 8081 [PSH, ACK] Seq=426 Ack=426 Win=64256 Len=17 TSval=1047105548 TSecr=3171365248
1711548600.740092516   288 0.775649457    10.10.1.1 → 10.10.1.2    TCP 83 8081 → 39588 [PSH, ACK] Seq=426 Ack=443 Win=65152 Len=17 TSval=3171365258 TSecr=1047105548
1711548608.740092516   296 0.785811917    10.10.1.2 → 10.10.1.1    TCP 83 39588 → 8081 [PSH, ACK] Seq=443 Ack=443 Win=64256 Len=17 TSval=1047105558 TSecr=3171365258
1711548610.740092516   298 0.785849408    10.10.1.1 → 10.10.1.2    TCP 83 8081 → 39588 [PSH, ACK] Seq=443 Ack=460 Win=65152 Len=17 TSval=3171365268 TSecr=1047105558
1711548618.740092516   306 0.796011878    10.10.1.2 → 10.10.1.1    TCP 83 39588 → 8081 [PSH, ACK] Seq=460 Ack=460 Win=64256 Len=17 TSval=1047105568 TSecr=3171365268
1711548620.740092516   308 0.796047527    10.10.1.1 → 10.10.1.2    TCP 83 8081 → 39588 [PSH, ACK] Seq=460 Ack=477 Win=65152 Len=17 TSval=3171365279 TSecr=1047105568
1711548628.740092516   316 0.806208063    10.10.1.2 → 10.10.1.1    TCP 83 39588 → 8081 [PSH, ACK] Seq=477 Ack=477 Win=64256 Len=17 TSval=1047105578 TSecr=3171365279
1711548630.740092516   318 0.806245397    10.10.1.1 → 10.10.1.2    TCP 83 8081 → 39588 [PSH, ACK] Seq=477 Ack=494 Win=65152 Len=17 TSval=3171365289 TSecr=1047105578
1711548638.740092516   326 0.816408580    10.10.1.2 → 10.10.1.1    TCP 83 39588 → 8081 [PSH, ACK] Seq=494 Ack=494 Win=64256 Len=17 TSval=1047105588 TSecr=3171365289
1711548640.740092516   328 0.816446090    10.10.1.1 → 10.10.1.2    TCP 83 8081 → 39588 [PSH, ACK] Seq=494 Ack=511 Win=65152 Len=17 TSval=3171365299 TSecr=1047105588
1711548648.740092516   336 0.826606790    10.10.1.2 → 10.10.1.1    TCP 83 39588 → 8081 [PSH, ACK] Seq=511 Ack=511 Win=64256 Len=17 TSval=1047105599 TSecr=3171365299
1711548650.740092516   338 0.826641382    10.10.1.1 → 10.10.1.2    TCP 83 8081 → 39588 [PSH, ACK] Seq=511 Ack=528 Win=65152 Len=17 TSval=3171365309 TSecr=1047105599
1711548658.740092516   346 0.836804814    10.10.1.2 → 10.10.1.1    TCP 83 39588 → 8081 [PSH, ACK] Seq=528 Ack=528 Win=64256 Len=17 TSval=1047105609 TSecr=3171365309
1711548660.740092516   348 0.836840379    10.10.1.1 → 10.10.1.2    TCP 83 8081 → 39588 [PSH, ACK] Seq=528 Ack=545 Win=65152 Len=17 TSval=3171365319 TSecr=1047105609
1711548668.740092516   356 0.847008611    10.10.1.2 → 10.10.1.1    TCP 83 39588 → 8081 [PSH, ACK] Seq=545 Ack=545 Win=64256 Len=17 TSval=1047105619 TSecr=3171365319
1711548671.740092516   359 0.847052826    10.10.1.1 → 10.10.1.2    TCP 83 8081 → 39588 [PSH, ACK] Seq=545 Ack=562 Win=65152 Len=17 TSval=3171365330 TSecr=1047105619
1711548678.740092516   366 0.857220094    10.10.1.2 → 10.10.1.1    TCP 83 39588 → 8081 [PSH, ACK] Seq=562 Ack=562 Win=64256 Len=17 TSval=1047105629 TSecr=3171365330
1711548680.740092516   368 0.857270489    10.10.1.1 → 10.10.1.2    TCP 83 8081 → 39588 [PSH, ACK] Seq=562 Ack=579 Win=65152 Len=17 TSval=3171365340 TSecr=1047105629
1711548688.740092516   376 0.867433054    10.10.1.2 → 10.10.1.1    TCP 83 39588 → 8081 [PSH, ACK] Seq=579 Ack=579 Win=64256 Len=17 TSval=1047105639 TSecr=3171365340
1711548690.740092516   378 0.867471209    10.10.1.1 → 10.10.1.2    TCP 83 8081 → 39588 [PSH, ACK] Seq=579 Ack=596 Win=65152 Len=17 TSval=3171365350 TSecr=1047105639
1711548698.740092516   386 0.877639707    10.10.1.2 → 10.10.1.1    TCP 83 39588 → 8081 [PSH, ACK] Seq=596 Ack=596 Win=64256 Len=17 TSval=1047105650 TSecr=3171365350
1711548700.740092516   388 0.877684481    10.10.1.1 → 10.10.1.2    TCP 83 8081 → 39588 [PSH, ACK] Seq=596 Ack=613 Win=65152 Len=17 TSval=3171365360 TSecr=1047105650
1711548709.740092516   397 0.887847644    10.10.1.2 → 10.10.1.1    TCP 83 39588 → 8081 [PSH, ACK] Seq=613 Ack=613 Win=64256 Len=17 TSval=1047105660 TSecr=3171365360
1711548711.740092516   399 0.887892734    10.10.1.1 → 10.10.1.2    TCP 83 8081 → 39588 [PSH, ACK] Seq=613 Ack=630 Win=65152 Len=17 TSval=3171365370 TSecr=1047105660
1711548719.740092516   407 0.898054317    10.10.1.2 → 10.10.1.1    TCP 83 39588 → 8081 [PSH, ACK] Seq=630 Ack=630 Win=64256 Len=17 TSval=1047105670 TSecr=3171365370
1711548721.740092516   409 0.898090854    10.10.1.1 → 10.10.1.2    TCP 83 8081 → 39588 [PSH, ACK] Seq=630 Ack=647 Win=65152 Len=17 TSval=3171365381 TSecr=1047105670
1711548729.740092516   417 0.908252322    10.10.1.2 → 10.10.1.1    TCP 83 39588 → 8081 [PSH, ACK] Seq=647 Ack=647 Win=64256 Len=17 TSval=1047105680 TSecr=3171365381
1711548731.740092516   419 0.908289562    10.10.1.1 → 10.10.1.2    TCP 83 8081 → 39588 [PSH, ACK] Seq=647 Ack=664 Win=65152 Len=17 TSval=3171365391 TSecr=1047105680
1711548739.740092516   427 0.918450403    10.10.1.2 → 10.10.1.1    TCP 83 39588 → 8081 [PSH, ACK] Seq=664 Ack=664 Win=64256 Len=17 TSval=1047105690 TSecr=3171365391
1711548741.740092516   429 0.918485333    10.10.1.1 → 10.10.1.2    TCP 83 8081 → 39588 [PSH, ACK] Seq=664 Ack=681 Win=65152 Len=17 TSval=3171365401 TSecr=1047105690
1711548749.740092516   437 0.928646786    10.10.1.2 → 10.10.1.1    TCP 83 39588 → 8081 [PSH, ACK] Seq=681 Ack=681 Win=64256 Len=17 TSval=1047105701 TSecr=3171365401
1711548751.740092516   439 0.928685588    10.10.1.1 → 10.10.1.2    TCP 83 8081 → 39588 [PSH, ACK] Seq=681 Ack=698 Win=65152 Len=17 TSval=3171365411 TSecr=1047105701
1711548759.740092516   447 0.938847525    10.10.1.2 → 10.10.1.1    TCP 83 39588 → 8081 [PSH, ACK] Seq=698 Ack=698 Win=64256 Len=17 TSval=1047105711 TSecr=3171365411
1711548761.740092516   449 0.938888851    10.10.1.1 → 10.10.1.2    TCP 83 8081 → 39588 [PSH, ACK] Seq=698 Ack=715 Win=65152 Len=17 TSval=3171365421 TSecr=1047105711
1711548769.740092516   457 0.949051434    10.10.1.2 → 10.10.1.1    TCP 83 39588 → 8081 [PSH, ACK] Seq=715 Ack=715 Win=64256 Len=17 TSval=1047105721 TSecr=3171365421
1711548771.740092516   459 0.949088821    10.10.1.1 → 10.10.1.2    TCP 83 8081 → 39588 [PSH, ACK] Seq=715 Ack=732 Win=65152 Len=17 TSval=3171365432 TSecr=1047105721
1711548779.740092516   467 0.959251490    10.10.1.2 → 10.10.1.1    TCP 83 39588 → 8081 [PSH, ACK] Seq=732 Ack=732 Win=64256 Len=17 TSval=1047105731 TSecr=3171365432
1711548781.740092516   469 0.959288395    10.10.1.1 → 10.10.1.2    TCP 83 8081 → 39588 [PSH, ACK] Seq=732 Ack=749 Win=65152 Len=17 TSval=3171365442 TSecr=1047105731
1711548789.740092516   477 0.969449617    10.10.1.2 → 10.10.1.1    TCP 83 39588 → 8081 [PSH, ACK] Seq=749 Ack=749 Win=64256 Len=17 TSval=1047105741 TSecr=3171365442
1711548791.740092516   479 0.969486139    10.10.1.1 → 10.10.1.2    TCP 83 8081 → 39588 [PSH, ACK] Seq=749 Ack=766 Win=65152 Len=17 TSval=3171365452 TSecr=1047105741
1711548799.740092516   487 0.979647776    10.10.1.2 → 10.10.1.1    TCP 83 39588 → 8081 [PSH, ACK] Seq=766 Ack=766 Win=64256 Len=17 TSval=1047105752 TSecr=3171365452
1711548801.740092516   489 0.979685209    10.10.1.1 → 10.10.1.2    TCP 83 8081 → 39588 [PSH, ACK] Seq=766 Ack=783 Win=65152 Len=17 TSval=3171365462 TSecr=1047105752
1711548809.740092516   497 0.989846379    10.10.1.2 → 10.10.1.1    TCP 83 39588 → 8081 [PSH, ACK] Seq=783 Ack=783 Win=64256 Len=17 TSval=1047105762 TSecr=3171365462
1711548811.740092516   499 0.989882478    10.10.1.1 → 10.10.1.2    TCP 83 8081 → 39588 [PSH, ACK] Seq=783 Ack=800 Win=65152 Len=17 TSval=3171365472 TSecr=1047105762
1711548819.740092516   507 1.000044429    10.10.1.2 → 10.10.1.1    TCP 83 39588 → 8081 [PSH, ACK] Seq=800 Ack=800 Win=64256 Len=17 TSval=1047105772 TSecr=3171365472
1711548821.740092516   509 1.000080163    10.10.1.1 → 10.10.1.2    TCP 83 8081 → 39588 [PSH, ACK] Seq=800 Ack=817 Win=65152 Len=17 TSval=3171365483 TSecr=1047105772
1711548829.740092516   517 1.010240644    10.10.1.2 → 10.10.1.1    TCP 83 39588 → 8081 [PSH, ACK] Seq=817 Ack=817 Win=64256 Len=17 TSval=1047105782 TSecr=3171365483
1711548831.740092516   519 1.010275602    10.10.1.1 → 10.10.1.2    TCP 83 8081 → 39588 [PSH, ACK] Seq=817 Ack=834 Win=65152 Len=17 TSval=3171365493 TSecr=1047105782
1711548839.740092516   527 1.020437184    10.10.1.2 → 10.10.1.1    TCP 83 39588 → 8081 [PSH, ACK] Seq=834 Ack=834 Win=64256 Len=17 TSval=1047105792 TSecr=3171365493
1711548841.740092516   529 1.020471961    10.10.1.1 → 10.10.1.2    TCP 83 8081 → 39588 [PSH, ACK] Seq=834 Ack=851 Win=65152 Len=17 TSval=3171365503 TSecr=1047105792
1711548849.740092516   537 1.030633728    10.10.1.2 → 10.10.1.1    TCP 83 39588 → 8081 [PSH, ACK] Seq=851 Ack=851 Win=64256 Len=17 TSval=1047105803 TSecr=3171365503
1711548851.740092516   539 1.030669247    10.10.1.1 → 10.10.1.2    TCP 83 8081 → 39588 [PSH, ACK] Seq=851 Ack=868 Win=65152 Len=17 TSval=3171365513 TSecr=1047105803
1711548859.740092516   547 1.040830145    10.10.1.2 → 10.10.1.1    TCP 83 39588 → 8081 [PSH, ACK] Seq=868 Ack=868 Win=64256 Len=17 TSval=1047105813 TSecr=3171365513
1711548861.740092516   549 1.040864963    10.10.1.1 → 10.10.1.2    TCP 83 8081 → 39588 [PSH, ACK] Seq=868 Ack=885 Win=65152 Len=17 TSval=3171365523 TSecr=1047105813
1711548869.740092516   557 1.051026615    10.10.1.2 → 10.10.1.1    TCP 83 39588 → 8081 [PSH, ACK] Seq=885 Ack=885 Win=64256 Len=17 TSval=1047105823 TSecr=3171365523
1711548871.740092516   559 1.051061762    10.10.1.1 → 10.10.1.2    TCP 83 8081 → 39588 [PSH, ACK] Seq=885 Ack=902 Win=65152 Len=17 TSval=3171365534 TSecr=1047105823
1711548879.740092516   567 1.061223466    10.10.1.2 → 10.10.1.1    TCP 83 39588 → 8081 [PSH, ACK] Seq=902 Ack=902 Win=64256 Len=17 TSval=1047105833 TSecr=3171365534
1711548881.740092516   569 1.061258586    10.10.1.1 → 10.10.1.2    TCP 83 8081 → 39588 [PSH, ACK] Seq=902 Ack=919 Win=65152 Len=17 TSval=3171365544 TSecr=1047105833
1711548889.740092516   577 1.071419042    10.10.1.2 → 10.10.1.1    TCP 83 39588 → 8081 [PSH, ACK] Seq=919 Ack=919 Win=64256 Len=17 TSval=1047105843 TSecr=3171365544
1711548891.740092516   579 1.071454189    10.10.1.1 → 10.10.1.2    TCP 83 8081 → 39588 [PSH, ACK] Seq=919 Ack=936 Win=65152 Len=17 TSval=3171365554 TSecr=1047105843
1711548899.740092516   587 1.081614725    10.10.1.2 → 10.10.1.1    TCP 83 39588 → 8081 [PSH, ACK] Seq=936 Ack=936 Win=64256 Len=17 TSval=1047105854 TSecr=3171365554
1711548901.740092516   589 1.081650059    10.10.1.1 → 10.10.1.2    TCP 83 8081 → 39588 [PSH, ACK] Seq=936 Ack=953 Win=65152 Len=17 TSval=3171365564 TSecr=1047105854
1711548909.740092516   597 1.091810425    10.10.1.2 → 10.10.1.1    TCP 83 39588 → 8081 [PSH, ACK] Seq=953 Ack=953 Win=64256 Len=17 TSval=1047105864 TSecr=3171365564
1711548912.740092516   600 1.091879350    10.10.1.1 → 10.10.1.2    TCP 83 8081 → 39588 [PSH, ACK] Seq=953 Ack=970 Win=65152 Len=17 TSval=3171365574 TSecr=1047105864
1711548919.740092516   607 1.102041578    10.10.1.2 → 10.10.1.1    TCP 83 39588 → 8081 [PSH, ACK] Seq=970 Ack=970 Win=64256 Len=17 TSval=1047105874 TSecr=3171365574
1711548921.740092516   609 1.102080779    10.10.1.1 → 10.10.1.2    TCP 83 8081 → 39588 [PSH, ACK] Seq=970 Ack=987 Win=65152 Len=17 TSval=3171365585 TSecr=1047105874
1711548929.740092516   617 1.112242107    10.10.1.2 → 10.10.1.1    TCP 83 39588 → 8081 [PSH, ACK] Seq=987 Ack=987 Win=64256 Len=17 TSval=1047105884 TSecr=3171365585
1711548931.740092516   619 1.112279614    10.10.1.1 → 10.10.1.2    TCP 83 8081 → 39588 [PSH, ACK] Seq=987 Ack=1004 Win=65152 Len=17 TSval=3171365595 TSecr=1047105884
1711548939.740092516   627 1.122441984    10.10.1.2 → 10.10.1.1    TCP 83 39588 → 8081 [PSH, ACK] Seq=1004 Ack=1004 Win=64256 Len=17 TSval=1047105894 TSecr=3171365595
1711548941.740092516   629 1.122477410    10.10.1.1 → 10.10.1.2    TCP 83 8081 → 39588 [PSH, ACK] Seq=1004 Ack=1021 Win=65152 Len=17 TSval=3171365605 TSecr=1047105894
1711548949.740092516   637 1.132642479    10.10.1.2 → 10.10.1.1    TCP 83 39588 → 8081 [PSH, ACK] Seq=1021 Ack=1021 Win=64256 Len=17 TSval=1047105905 TSecr=3171365605
1711548951.740092516   639 1.132677292    10.10.1.1 → 10.10.1.2    TCP 83 8081 → 39588 [PSH, ACK] Seq=1021 Ack=1038 Win=65152 Len=17 TSval=3171365615 TSecr=1047105905
1711548959.740092516   647 1.142838732    10.10.1.2 → 10.10.1.1    TCP 83 39588 → 8081 [PSH, ACK] Seq=1038 Ack=1038 Win=64256 Len=17 TSval=1047105915 TSecr=3171365615
1711548961.740092516   649 1.142877556    10.10.1.1 → 10.10.1.2    TCP 83 8081 → 39588 [PSH, ACK] Seq=1038 Ack=1055 Win=65152 Len=17 TSval=3171365625 TSecr=1047105915
1711548969.740092516   657 1.153037891    10.10.1.2 → 10.10.1.1    TCP 83 39588 → 8081 [PSH, ACK] Seq=1055 Ack=1055 Win=64256 Len=17 TSval=1047105925 TSecr=3171365625
1711548971.740092516   659 1.153073592    10.10.1.1 → 10.10.1.2    TCP 83 8081 → 39588 [PSH, ACK] Seq=1055 Ack=1072 Win=65152 Len=17 TSval=3171365636 TSecr=1047105925
1711548979.740092516   667 1.163235779    10.10.1.2 → 10.10.1.1    TCP 83 39588 → 8081 [PSH, ACK] Seq=1072 Ack=1072 Win=64256 Len=17 TSval=1047105935 TSecr=3171365636
1711548981.740092516   669 1.163270665    10.10.1.1 → 10.10.1.2    TCP 83 8081 → 39588 [PSH, ACK] Seq=1072 Ack=1089 Win=65152 Len=17 TSval=3171365646 TSecr=1047105935
1711548989.740092516   677 1.173433131    10.10.1.2 → 10.10.1.1    TCP 83 39588 → 8081 [PSH, ACK] Seq=1089 Ack=1089 Win=64256 Len=17 TSval=1047105945 TSecr=3171365646
1711548991.740092516   679 1.173469180    10.10.1.1 → 10.10.1.2    TCP 83 8081 → 39588 [PSH, ACK] Seq=1089 Ack=1106 Win=65152 Len=17 TSval=3171365656 TSecr=1047105945
1711548999.740092516   687 1.183630709    10.10.1.2 → 10.10.1.1    TCP 83 39588 → 8081 [PSH, ACK] Seq=1106 Ack=1106 Win=64256 Len=17 TSval=1047105956 TSecr=3171365656
1711549001.740092516   689 1.183666990    10.10.1.1 → 10.10.1.2    TCP 83 8081 → 39588 [PSH, ACK] Seq=1106 Ack=1123 Win=65152 Len=17 TSval=3171365666 TSecr=1047105956
1711549009.740092516   697 1.193828628    10.10.1.2 → 10.10.1.1    TCP 83 39588 → 8081 [PSH, ACK] Seq=1123 Ack=1123 Win=64256 Len=17 TSval=1047105966 TSecr=3171365666
1711549011.740092516   699 1.193864294    10.10.1.1 → 10.10.1.2    TCP 83 8081 → 39588 [PSH, ACK] Seq=1123 Ack=1140 Win=65152 Len=17 TSval=3171365676 TSecr=1047105966
1711549019.740092516   707 1.204026485    10.10.1.2 → 10.10.1.1    TCP 83 39588 → 8081 [PSH, ACK] Seq=1140 Ack=1140 Win=64256 Len=17 TSval=1047105976 TSecr=3171365676
1711549021.740092516   709 1.204062670    10.10.1.1 → 10.10.1.2    TCP 83 8081 → 39588 [PSH, ACK] Seq=1140 Ack=1157 Win=65152 Len=17 TSval=3171365687 TSecr=1047105976
1711549029.740092516   717 1.214224669    10.10.1.2 → 10.10.1.1    TCP 83 39588 → 8081 [PSH, ACK] Seq=1157 Ack=1157 Win=64256 Len=17 TSval=1047105986 TSecr=3171365687
1711549031.740092516   719 1.214261642    10.10.1.1 → 10.10.1.2    TCP 83 8081 → 39588 [PSH, ACK] Seq=1157 Ack=1174 Win=65152 Len=17 TSval=3171365697 TSecr=1047105986
1711549039.740092516   727 1.224423876    10.10.1.2 → 10.10.1.1    TCP 83 39588 → 8081 [PSH, ACK] Seq=1174 Ack=1174 Win=64256 Len=17 TSval=1047105996 TSecr=3171365697
1711549041.740092516   729 1.224461064    10.10.1.1 → 10.10.1.2    TCP 83 8081 → 39588 [PSH, ACK] Seq=1174 Ack=1191 Win=65152 Len=17 TSval=3171365707 TSecr=1047105996
1711549049.740092516   737 1.234621746    10.10.1.2 → 10.10.1.1    TCP 83 39588 → 8081 [PSH, ACK] Seq=1191 Ack=1191 Win=64256 Len=17 TSval=1047106007 TSecr=3171365707
1711549051.740092516   739 1.234657952    10.10.1.1 → 10.10.1.2    TCP 83 8081 → 39588 [PSH, ACK] Seq=1191 Ack=1208 Win=65152 Len=17 TSval=3171365717 TSecr=1047106007
1711549059.740092516   747 1.244818366    10.10.1.2 → 10.10.1.1    TCP 83 39588 → 8081 [PSH, ACK] Seq=1208 Ack=1208 Win=64256 Len=17 TSval=1047106017 TSecr=3171365717
1711549061.740092516   749 1.244854571    10.10.1.1 → 10.10.1.2    TCP 83 8081 → 39588 [PSH, ACK] Seq=1208 Ack=1225 Win=65152 Len=17 TSval=3171365727 TSecr=1047106017
1711549069.740092516   757 1.255015639    10.10.1.2 → 10.10.1.1    TCP 83 39588 → 8081 [PSH, ACK] Seq=1225 Ack=1225 Win=64256 Len=17 TSval=1047106027 TSecr=3171365727
1711549071.740092516   759 1.255054256    10.10.1.1 → 10.10.1.2    TCP 83 8081 → 39588 [PSH, ACK] Seq=1225 Ack=1242 Win=65152 Len=17 TSval=3171365738 TSecr=1047106027
1711549079.740092516   767 1.265215360    10.10.1.2 → 10.10.1.1    TCP 83 39588 → 8081 [PSH, ACK] Seq=1242 Ack=1242 Win=64256 Len=17 TSval=1047106037 TSecr=3171365738
1711549081.740092516   769 1.265250549    10.10.1.1 → 10.10.1.2    TCP 83 8081 → 39588 [PSH, ACK] Seq=1242 Ack=1259 Win=65152 Len=17 TSval=3171365748 TSecr=1047106037
1711549089.740092516   777 1.275410946    10.10.1.2 → 10.10.1.1    TCP 83 39588 → 8081 [PSH, ACK] Seq=1259 Ack=1259 Win=64256 Len=17 TSval=1047106047 TSecr=3171365748
1711549091.740092516   779 1.275448846    10.10.1.1 → 10.10.1.2    TCP 83 8081 → 39588 [PSH, ACK] Seq=1259 Ack=1276 Win=65152 Len=17 TSval=3171365758 TSecr=1047106047
1711549099.740092516   787 1.285610211    10.10.1.2 → 10.10.1.1    TCP 83 39588 → 8081 [PSH, ACK] Seq=1276 Ack=1276 Win=64256 Len=17 TSval=1047106058 TSecr=3171365758
1711549101.740092516   789 1.285645475    10.10.1.1 → 10.10.1.2    TCP 83 8081 → 39588 [PSH, ACK] Seq=1276 Ack=1293 Win=65152 Len=17 TSval=3171365768 TSecr=1047106058
1711549109.740092516   797 1.295805785    10.10.1.2 → 10.10.1.1    TCP 83 39588 → 8081 [PSH, ACK] Seq=1293 Ack=1293 Win=64256 Len=17 TSval=1047106068 TSecr=3171365768
1711549111.740092516   799 1.295841771    10.10.1.1 → 10.10.1.2    TCP 83 8081 → 39588 [PSH, ACK] Seq=1293 Ack=1310 Win=65152 Len=17 TSval=3171365778 TSecr=1047106068
1711549119.740092516   807 1.306004387    10.10.1.2 → 10.10.1.1    TCP 83 39588 → 8081 [PSH, ACK] Seq=1310 Ack=1310 Win=64256 Len=17 TSval=1047106078 TSecr=3171365778
1711549121.740092516   809 1.306040378    10.10.1.1 → 10.10.1.2    TCP 83 8081 → 39588 [PSH, ACK] Seq=1310 Ack=1327 Win=65152 Len=17 TSval=3171365789 TSecr=1047106078
1711549129.740092516   817 1.316202209    10.10.1.2 → 10.10.1.1    TCP 83 39588 → 8081 [PSH, ACK] Seq=1327 Ack=1327 Win=64256 Len=17 TSval=1047106088 TSecr=3171365789
1711549131.740092516   819 1.316237520    10.10.1.1 → 10.10.1.2    TCP 83 8081 → 39588 [PSH, ACK] Seq=1327 Ack=1344 Win=65152 Len=17 TSval=3171365799 TSecr=1047106088
1711549139.740092516   827 1.326400259    10.10.1.2 → 10.10.1.1    TCP 83 39588 → 8081 [PSH, ACK] Seq=1344 Ack=1344 Win=64256 Len=17 TSval=1047106098 TSecr=3171365799
1711549141.740092516   829 1.326435046    10.10.1.1 → 10.10.1.2    TCP 83 8081 → 39588 [PSH, ACK] Seq=1344 Ack=1361 Win=65152 Len=17 TSval=3171365809 TSecr=1047106098
1711549149.740092516   837 1.336596166    10.10.1.2 → 10.10.1.1    TCP 83 39588 → 8081 [PSH, ACK] Seq=1361 Ack=1361 Win=64256 Len=17 TSval=1047106109 TSecr=3171365809
1711549151.740092516   839 1.336631803    10.10.1.1 → 10.10.1.2    TCP 83 8081 → 39588 [PSH, ACK] Seq=1361 Ack=1378 Win=65152 Len=17 TSval=3171365819 TSecr=1047106109
1711549159.740092516   847 1.346792771    10.10.1.2 → 10.10.1.1    TCP 83 39588 → 8081 [PSH, ACK] Seq=1378 Ack=1378 Win=64256 Len=17 TSval=1047106119 TSecr=3171365819
1711549161.740092516   849 1.346828857    10.10.1.1 → 10.10.1.2    TCP 83 8081 → 39588 [PSH, ACK] Seq=1378 Ack=1395 Win=65152 Len=17 TSval=3171365829 TSecr=1047106119
1711549169.740092516   857 1.356990672    10.10.1.2 → 10.10.1.1    TCP 83 39588 → 8081 [PSH, ACK] Seq=1395 Ack=1395 Win=64256 Len=17 TSval=1047106129 TSecr=3171365829
1711549171.740092516   859 1.357026822    10.10.1.1 → 10.10.1.2    TCP 83 8081 → 39588 [PSH, ACK] Seq=1395 Ack=1412 Win=65152 Len=17 TSval=3171365840 TSecr=1047106129
1711549179.740092516   867 1.367189630    10.10.1.2 → 10.10.1.1    TCP 83 39588 → 8081 [PSH, ACK] Seq=1412 Ack=1412 Win=64256 Len=17 TSval=1047106139 TSecr=3171365840
1711549181.740092516   869 1.367224524    10.10.1.1 → 10.10.1.2    TCP 83 8081 → 39588 [PSH, ACK] Seq=1412 Ack=1429 Win=65152 Len=17 TSval=3171365850 TSecr=1047106139
1711549189.740092516   877 1.377385330    10.10.1.2 → 10.10.1.1    TCP 83 39588 → 8081 [PSH, ACK] Seq=1429 Ack=1429 Win=64256 Len=17 TSval=1047106149 TSecr=3171365850
1711549191.740092516   879 1.377420215    10.10.1.1 → 10.10.1.2    TCP 83 8081 → 39588 [PSH, ACK] Seq=1429 Ack=1446 Win=65152 Len=17 TSval=3171365860 TSecr=1047106149
1711549199.740092516   887 1.387543818    10.10.1.2 → 10.10.1.1    TCP 83 39588 → 8081 [PSH, ACK] Seq=1446 Ack=1446 Win=64256 Len=17 TSval=1047106160 TSecr=3171365860
1711549201.740092516   889 1.387579409    10.10.1.1 → 10.10.1.2    TCP 83 8081 → 39588 [PSH, ACK] Seq=1446 Ack=1463 Win=65152 Len=17 TSval=3171365870 TSecr=1047106160
1711549209.740092516   897 1.397740579    10.10.1.2 → 10.10.1.1    TCP 83 39588 → 8081 [PSH, ACK] Seq=1463 Ack=1463 Win=64256 Len=17 TSval=1047106170 TSecr=3171365870
1711549211.740092516   899 1.397775852    10.10.1.1 → 10.10.1.2    TCP 83 8081 → 39588 [PSH, ACK] Seq=1463 Ack=1480 Win=65152 Len=17 TSval=3171365880 TSecr=1047106170
1711549219.740092516   907 1.407936965    10.10.1.2 → 10.10.1.1    TCP 83 39588 → 8081 [PSH, ACK] Seq=1480 Ack=1480 Win=64256 Len=17 TSval=1047106180 TSecr=3171365880
1711549221.740092516   909 1.407972247    10.10.1.1 → 10.10.1.2    TCP 83 8081 → 39588 [PSH, ACK] Seq=1480 Ack=1497 Win=65152 Len=17 TSval=3171365890 TSecr=1047106180
1711549229.740092516   917 1.418134387    10.10.1.2 → 10.10.1.1    TCP 83 39588 → 8081 [PSH, ACK] Seq=1497 Ack=1497 Win=64256 Len=17 TSval=1047106190 TSecr=3171365890
1711549231.740092516   919 1.418169178    10.10.1.1 → 10.10.1.2    TCP 83 8081 → 39588 [PSH, ACK] Seq=1497 Ack=1514 Win=65152 Len=17 TSval=3171365901 TSecr=1047106190
1711549239.740092516   927 1.428331437    10.10.1.2 → 10.10.1.1    TCP 83 39588 → 8081 [PSH, ACK] Seq=1514 Ack=1514 Win=64256 Len=17 TSval=1047106200 TSecr=3171365901
1711549241.740092516   929 1.428366501    10.10.1.1 → 10.10.1.2    TCP 83 8081 → 39588 [PSH, ACK] Seq=1514 Ack=1531 Win=65152 Len=17 TSval=3171365911 TSecr=1047106200
1711549249.740092516   937 1.438526711    10.10.1.2 → 10.10.1.1    TCP 83 39588 → 8081 [PSH, ACK] Seq=1531 Ack=1531 Win=64256 Len=17 TSval=1047106210 TSecr=3171365911
1711549251.740092516   939 1.438562197    10.10.1.1 → 10.10.1.2    TCP 83 8081 → 39588 [PSH, ACK] Seq=1531 Ack=1548 Win=65152 Len=17 TSval=3171365921 TSecr=1047106210
1711549259.740092516   947 1.448725319    10.10.1.2 → 10.10.1.1    TCP 83 39588 → 8081 [PSH, ACK] Seq=1548 Ack=1548 Win=64256 Len=17 TSval=1047106221 TSecr=3171365921
1711549261.740092516   949 1.448761866    10.10.1.1 → 10.10.1.2    TCP 83 8081 → 39588 [PSH, ACK] Seq=1548 Ack=1565 Win=65152 Len=17 TSval=3171365931 TSecr=1047106221
1711549269.740092516   957 1.458923550    10.10.1.2 → 10.10.1.1    TCP 83 39588 → 8081 [PSH, ACK] Seq=1565 Ack=1565 Win=64256 Len=17 TSval=1047106231 TSecr=3171365931
1711549271.740092516   959 1.458958443    10.10.1.1 → 10.10.1.2    TCP 83 8081 → 39588 [PSH, ACK] Seq=1565 Ack=1582 Win=65152 Len=17 TSval=3171365941 TSecr=1047106231
1711549279.740092516   967 1.469119850    10.10.1.2 → 10.10.1.1    TCP 83 39588 → 8081 [PSH, ACK] Seq=1582 Ack=1582 Win=64256 Len=17 TSval=1047106241 TSecr=3171365941
1711549281.740092516   969 1.469156471    10.10.1.1 → 10.10.1.2    TCP 83 8081 → 39588 [PSH, ACK] Seq=1582 Ack=1599 Win=65152 Len=17 TSval=3171365952 TSecr=1047106241
1711549289.740092516   977 1.479317945    10.10.1.2 → 10.10.1.1    TCP 83 39588 → 8081 [PSH, ACK] Seq=1599 Ack=1599 Win=64256 Len=17 TSval=1047106251 TSecr=3171365952
1711549291.740092516   979 1.479353480    10.10.1.1 → 10.10.1.2    TCP 83 8081 → 39588 [PSH, ACK] Seq=1599 Ack=1616 Win=65152 Len=17 TSval=3171365962 TSecr=1047106251
1711549299.740092516   987 1.489514261    10.10.1.2 → 10.10.1.1    TCP 83 39588 → 8081 [PSH, ACK] Seq=1616 Ack=1616 Win=64256 Len=17 TSval=1047106261 TSecr=3171365962
1711549301.740092516   989 1.489550075    10.10.1.1 → 10.10.1.2    TCP 83 8081 → 39588 [PSH, ACK] Seq=1616 Ack=1633 Win=65152 Len=17 TSval=3171365972 TSecr=1047106261
1711549309.740092516   997 1.499711574    10.10.1.2 → 10.10.1.1    TCP 83 39588 → 8081 [PSH, ACK] Seq=1633 Ack=1633 Win=64256 Len=17 TSval=1047106272 TSecr=3171365972
1711549311.740092516   999 1.499746999    10.10.1.1 → 10.10.1.2    TCP 83 8081 → 39588 [PSH, ACK] Seq=1633 Ack=1650 Win=65152 Len=17 TSval=3171365982 TSecr=1047106272
1711549319.740092516  1007 1.509909788    10.10.1.2 → 10.10.1.1    TCP 83 39588 → 8081 [PSH, ACK] Seq=1650 Ack=1650 Win=64256 Len=17 TSval=1047106282 TSecr=3171365982
1711549321.740092516  1009 1.509946134    10.10.1.1 → 10.10.1.2    TCP 83 8081 → 39588 [PSH, ACK] Seq=1650 Ack=1667 Win=65152 Len=17 TSval=3171365992 TSecr=1047106282
1711549329.740092516  1017 1.520106623    10.10.1.2 → 10.10.1.1    TCP 83 39588 → 8081 [PSH, ACK] Seq=1667 Ack=1667 Win=64256 Len=17 TSval=1047106292 TSecr=3171365992
1711549331.740092516  1019 1.520141699    10.10.1.1 → 10.10.1.2    TCP 83 8081 → 39588 [PSH, ACK] Seq=1667 Ack=1684 Win=65152 Len=17 TSval=3171366003 TSecr=1047106292
1711549339.740092516  1027 1.530303376    10.10.1.2 → 10.10.1.1    TCP 83 39588 → 8081 [PSH, ACK] Seq=1684 Ack=1684 Win=64256 Len=17 TSval=1047106302 TSecr=3171366003
1711549341.740092516  1029 1.530338143    10.10.1.1 → 10.10.1.2    TCP 83 8081 → 39588 [PSH, ACK] Seq=1684 Ack=1701 Win=65152 Len=17 TSval=3171366013 TSecr=1047106302
1711549349.740092516  1037 1.540500731    10.10.1.2 → 10.10.1.1    TCP 83 39588 → 8081 [PSH, ACK] Seq=1701 Ack=1701 Win=64256 Len=17 TSval=1047106312 TSecr=3171366013
1711549351.740092516  1039 1.540539406    10.10.1.1 → 10.10.1.2    TCP 83 8081 → 39588 [PSH, ACK] Seq=1701 Ack=1718 Win=65152 Len=17 TSval=3171366023 TSecr=1047106312
1711549359.740092516  1047 1.550701277    10.10.1.2 → 10.10.1.1    TCP 83 39588 → 8081 [PSH, ACK] Seq=1718 Ack=1718 Win=64256 Len=17 TSval=1047106323 TSecr=3171366023
1711549361.740092516  1049 1.550737001    10.10.1.1 → 10.10.1.2    TCP 83 8081 → 39588 [PSH, ACK] Seq=1718 Ack=1735 Win=65152 Len=17 TSval=3171366033 TSecr=1047106323
1711549369.740092516  1057 1.560898741    10.10.1.2 → 10.10.1.1    TCP 83 39588 → 8081 [PSH, ACK] Seq=1735 Ack=1735 Win=64256 Len=17 TSval=1047106333 TSecr=3171366033
1711549371.740092516  1059 1.560935142    10.10.1.1 → 10.10.1.2    TCP 83 8081 → 39588 [PSH, ACK] Seq=1735 Ack=1752 Win=65152 Len=17 TSval=3171366043 TSecr=1047106333
1711549379.740092516  1067 1.571097234    10.10.1.2 → 10.10.1.1    TCP 83 39588 → 8081 [PSH, ACK] Seq=1752 Ack=1752 Win=64256 Len=17 TSval=1047106343 TSecr=3171366043
1711549381.740092516  1069 1.571132656    10.10.1.1 → 10.10.1.2    TCP 83 8081 → 39588 [PSH, ACK] Seq=1752 Ack=1769 Win=65152 Len=17 TSval=3171366054 TSecr=1047106343
1711549389.740092516  1077 1.581293864    10.10.1.2 → 10.10.1.1    TCP 83 39588 → 8081 [PSH, ACK] Seq=1769 Ack=1769 Win=64256 Len=17 TSval=1047106353 TSecr=3171366054
1711549391.740092516  1079 1.581329237    10.10.1.1 → 10.10.1.2    TCP 83 8081 → 39588 [PSH, ACK] Seq=1769 Ack=1786 Win=65152 Len=17 TSval=3171366064 TSecr=1047106353
1711549399.740092516  1087 1.591490893    10.10.1.2 → 10.10.1.1    TCP 83 39588 → 8081 [PSH, ACK] Seq=1786 Ack=1786 Win=64256 Len=17 TSval=1047106363 TSecr=3171366064
1711549401.740092516  1089 1.591525501    10.10.1.1 → 10.10.1.2    TCP 83 8081 → 39588 [PSH, ACK] Seq=1786 Ack=1803 Win=65152 Len=17 TSval=3171366074 TSecr=1047106363
1711549409.740092516  1097 1.601688210    10.10.1.2 → 10.10.1.1    TCP 83 39588 → 8081 [PSH, ACK] Seq=1803 Ack=1803 Win=64256 Len=17 TSval=1047106374 TSecr=3171366074
1711549411.740092516  1099 1.601723094    10.10.1.1 → 10.10.1.2    TCP 83 8081 → 39588 [PSH, ACK] Seq=1803 Ack=1820 Win=65152 Len=17 TSval=3171366084 TSecr=1047106374
1711549419.740092516  1107 1.611885345    10.10.1.2 → 10.10.1.1    TCP 83 39588 → 8081 [PSH, ACK] Seq=1820 Ack=1820 Win=64256 Len=17 TSval=1047106384 TSecr=3171366084
1711549421.740092516  1109 1.611920389    10.10.1.1 → 10.10.1.2    TCP 83 8081 → 39588 [PSH, ACK] Seq=1820 Ack=1837 Win=65152 Len=17 TSval=3171366094 TSecr=1047106384
1711549429.740092516  1117 1.622080667    10.10.1.2 → 10.10.1.1    TCP 83 39588 → 8081 [PSH, ACK] Seq=1837 Ack=1837 Win=64256 Len=17 TSval=1047106394 TSecr=3171366094
1711549431.740092516  1119 1.622115189    10.10.1.1 → 10.10.1.2    TCP 83 8081 → 39588 [PSH, ACK] Seq=1837 Ack=1854 Win=65152 Len=17 TSval=3171366105 TSecr=1047106394
1711549439.740092516  1127 1.632277428    10.10.1.2 → 10.10.1.1    TCP 83 39588 → 8081 [PSH, ACK] Seq=1854 Ack=1854 Win=64256 Len=17 TSval=1047106404 TSecr=3171366105
1711549441.740092516  1129 1.632313251    10.10.1.1 → 10.10.1.2    TCP 83 8081 → 39588 [PSH, ACK] Seq=1854 Ack=1871 Win=65152 Len=17 TSval=3171366115 TSecr=1047106404
1711549449.740092516  1137 1.642473445    10.10.1.2 → 10.10.1.1    TCP 83 39588 → 8081 [PSH, ACK] Seq=1871 Ack=1871 Win=64256 Len=17 TSval=1047106414 TSecr=3171366115
1711549451.740092516  1139 1.642508321    10.10.1.1 → 10.10.1.2    TCP 83 8081 → 39588 [PSH, ACK] Seq=1871 Ack=1888 Win=65152 Len=17 TSval=3171366125 TSecr=1047106414
1711549459.740092516  1147 1.652671877    10.10.1.2 → 10.10.1.1    TCP 83 39588 → 8081 [PSH, ACK] Seq=1888 Ack=1888 Win=64256 Len=17 TSval=1047106425 TSecr=3171366125
1711549461.740092516  1149 1.652706990    10.10.1.1 → 10.10.1.2    TCP 83 8081 → 39588 [PSH, ACK] Seq=1888 Ack=1905 Win=65152 Len=17 TSval=3171366135 TSecr=1047106425
1711549469.740092516  1157 1.662867405    10.10.1.2 → 10.10.1.1    TCP 83 39588 → 8081 [PSH, ACK] Seq=1905 Ack=1905 Win=64256 Len=17 TSval=1047106435 TSecr=3171366135
1711549471.740092516  1159 1.662903130    10.10.1.1 → 10.10.1.2    TCP 83 8081 → 39588 [PSH, ACK] Seq=1905 Ack=1922 Win=65152 Len=17 TSval=3171366145 TSecr=1047106435
1711549479.740092516  1167 1.673064732    10.10.1.2 → 10.10.1.1    TCP 83 39588 → 8081 [PSH, ACK] Seq=1922 Ack=1922 Win=64256 Len=17 TSval=1047106445 TSecr=3171366145
1711549482.740092516  1170 1.673130940    10.10.1.1 → 10.10.1.2    TCP 83 8081 → 39588 [PSH, ACK] Seq=1922 Ack=1939 Win=65152 Len=17 TSval=3171366156 TSecr=1047106445
1711549489.740092516  1177 1.683292826    10.10.1.2 → 10.10.1.1    TCP 83 39588 → 8081 [PSH, ACK] Seq=1939 Ack=1939 Win=64256 Len=17 TSval=1047106455 TSecr=3171366156
1711549491.740092516  1179 1.683328020    10.10.1.1 → 10.10.1.2    TCP 83 8081 → 39588 [PSH, ACK] Seq=1939 Ack=1956 Win=65152 Len=17 TSval=3171366166 TSecr=1047106455
1711549499.740092516  1187 1.693488992    10.10.1.2 → 10.10.1.1    TCP 83 39588 → 8081 [PSH, ACK] Seq=1956 Ack=1956 Win=64256 Len=17 TSval=1047106465 TSecr=3171366166
1711549501.740092516  1189 1.693523735    10.10.1.1 → 10.10.1.2    TCP 83 8081 → 39588 [PSH, ACK] Seq=1956 Ack=1973 Win=65152 Len=17 TSval=3171366176 TSecr=1047106465
1711549509.740092516  1197 1.703688014    10.10.1.2 → 10.10.1.1    TCP 83 39588 → 8081 [PSH, ACK] Seq=1973 Ack=1973 Win=64256 Len=17 TSval=1047106476 TSecr=3171366176
1711549511.740092516  1199 1.703723302    10.10.1.1 → 10.10.1.2    TCP 83 8081 → 39588 [PSH, ACK] Seq=1973 Ack=1990 Win=65152 Len=17 TSval=3171366186 TSecr=1047106476
1711549519.740092516  1207 1.713884133    10.10.1.2 → 10.10.1.1    TCP 83 39588 → 8081 [PSH, ACK] Seq=1990 Ack=1990 Win=64256 Len=17 TSval=1047106486 TSecr=3171366186
1711549521.740092516  1209 1.713919379    10.10.1.1 → 10.10.1.2    TCP 83 8081 → 39588 [PSH, ACK] Seq=1990 Ack=2007 Win=65152 Len=17 TSval=3171366196 TSecr=1047106486
