1712183418.222799301    23 0.276430517    10.10.1.2 → 10.10.1.1    TCP 74 38114 → 8081 [SYN] Seq=0 Win=64240 Len=0 MSS=1460 SACK_PERM=1 TSval=1682187525 TSecr=0 WS=128
1712183419.222799301    24 0.276469116    10.10.1.1 → 10.10.1.2    TCP 74 8081 → 38114 [SYN, ACK] Seq=0 Ack=1 Win=65160 Len=0 MSS=1460 SACK_PERM=1 TSval=3806447234 TSecr=1682187525 WS=128
1712183420.222799301    25 0.276505172    10.10.1.2 → 10.10.1.1    TCP 66 38114 → 8081 [ACK] Seq=1 Ack=1 Win=64256 Len=0 TSval=1682187525 TSecr=3806447234
1712183429.222799301    34 0.526713736    10.10.1.2 → 10.10.1.1    TCP 83 38114 → 8081 [PSH, ACK] Seq=1 Ack=1 Win=64256 Len=17 TSval=1682187776 TSecr=3806447234
1712183431.222799301    36 0.526742412    10.10.1.1 → 10.10.1.2    TCP 66 8081 → 38114 [ACK] Seq=1 Ack=18 Win=65152 Len=0 TSval=3806447485 TSecr=1682187776
1712183432.222799301    37 0.527014460    10.10.1.1 → 10.10.1.2    TCP 83 8081 → 38114 [PSH, ACK] Seq=1 Ack=18 Win=65152 Len=17 TSval=3806447485 TSecr=1682187776
1712183433.222799301    38 0.527058030    10.10.1.2 → 10.10.1.1    TCP 66 38114 → 8081 [ACK] Seq=18 Ack=18 Win=64256 Len=0 TSval=1682187776 TSecr=3806447485
1712183439.222799301    44 0.528236408    10.10.1.2 → 10.10.1.1    TCP 83 38114 → 8081 [PSH, ACK] Seq=18 Ack=18 Win=64256 Len=17 TSval=1682187777 TSecr=3806447485
1712183441.222799301    46 0.528366147    10.10.1.1 → 10.10.1.2    TCP 83 8081 → 38114 [PSH, ACK] Seq=18 Ack=35 Win=65152 Len=17 TSval=3806447486 TSecr=1682187777
1712183448.222799301    53 0.529582106    10.10.1.2 → 10.10.1.1    TCP 83 38114 → 8081 [PSH, ACK] Seq=35 Ack=35 Win=64256 Len=17 TSval=1682187778 TSecr=3806447486
1712183450.222799301    55 0.529712760    10.10.1.1 → 10.10.1.2    TCP 83 8081 → 38114 [PSH, ACK] Seq=35 Ack=52 Win=65152 Len=17 TSval=3806447488 TSecr=1682187778
1712183456.222799301    61 0.530927963    10.10.1.2 → 10.10.1.1    TCP 83 38114 → 8081 [PSH, ACK] Seq=52 Ack=52 Win=64256 Len=17 TSval=1682187780 TSecr=3806447488
1712183458.222799301    63 0.531061238    10.10.1.1 → 10.10.1.2    TCP 83 8081 → 38114 [PSH, ACK] Seq=52 Ack=69 Win=65152 Len=17 TSval=3806447489 TSecr=1682187780
1712183465.222799301    70 0.532279810    10.10.1.2 → 10.10.1.1    TCP 83 38114 → 8081 [PSH, ACK] Seq=69 Ack=69 Win=64256 Len=17 TSval=1682187781 TSecr=3806447489
1712183467.222799301    72 0.532414664    10.10.1.1 → 10.10.1.2    TCP 83 8081 → 38114 [PSH, ACK] Seq=69 Ack=86 Win=65152 Len=17 TSval=3806447490 TSecr=1682187781
1712183474.222799301    79 0.533673972    10.10.1.2 → 10.10.1.1    TCP 83 38114 → 8081 [PSH, ACK] Seq=86 Ack=86 Win=64256 Len=17 TSval=1682187782 TSecr=3806447490
1712183476.222799301    81 0.533805162    10.10.1.1 → 10.10.1.2    TCP 83 8081 → 38114 [PSH, ACK] Seq=86 Ack=103 Win=65152 Len=17 TSval=3806447492 TSecr=1682187782
1712183482.222799301    87 0.535020213    10.10.1.2 → 10.10.1.1    TCP 83 38114 → 8081 [PSH, ACK] Seq=103 Ack=103 Win=64256 Len=17 TSval=1682187784 TSecr=3806447492
1712183484.222799301    89 0.535151020    10.10.1.1 → 10.10.1.2    TCP 83 8081 → 38114 [PSH, ACK] Seq=103 Ack=120 Win=65152 Len=17 TSval=3806447493 TSecr=1682187784
1712183490.222799301    95 0.536367936    10.10.1.2 → 10.10.1.1    TCP 83 38114 → 8081 [PSH, ACK] Seq=120 Ack=120 Win=64256 Len=17 TSval=1682187785 TSecr=3806447493
1712183492.222799301    97 0.536500683    10.10.1.1 → 10.10.1.2    TCP 83 8081 → 38114 [PSH, ACK] Seq=120 Ack=137 Win=65152 Len=17 TSval=3806447494 TSecr=1682187785
1712183499.222799301   104 0.537713718    10.10.1.2 → 10.10.1.1    TCP 83 38114 → 8081 [PSH, ACK] Seq=137 Ack=137 Win=64256 Len=17 TSval=1682187787 TSecr=3806447494
1712183501.222799301   106 0.537844569    10.10.1.1 → 10.10.1.2    TCP 83 8081 → 38114 [PSH, ACK] Seq=137 Ack=154 Win=65152 Len=17 TSval=3806447496 TSecr=1682187787
1712183507.222799301   112 0.539058241    10.10.1.2 → 10.10.1.1    TCP 83 38114 → 8081 [PSH, ACK] Seq=154 Ack=154 Win=64256 Len=17 TSval=1682187788 TSecr=3806447496
1712183509.222799301   114 0.539190072    10.10.1.1 → 10.10.1.2    TCP 83 8081 → 38114 [PSH, ACK] Seq=154 Ack=171 Win=65152 Len=17 TSval=3806447497 TSecr=1682187788
1712183516.222799301   121 0.540407303    10.10.1.2 → 10.10.1.1    TCP 83 38114 → 8081 [PSH, ACK] Seq=171 Ack=171 Win=64256 Len=17 TSval=1682187789 TSecr=3806447497
1712183518.222799301   123 0.540541420    10.10.1.1 → 10.10.1.2    TCP 83 8081 → 38114 [PSH, ACK] Seq=171 Ack=188 Win=65152 Len=17 TSval=3806447498 TSecr=1682187789
1712183524.222799301   129 0.541754356    10.10.1.2 → 10.10.1.1    TCP 83 38114 → 8081 [PSH, ACK] Seq=188 Ack=188 Win=64256 Len=17 TSval=1682187791 TSecr=3806447498
1712183526.222799301   131 0.541885894    10.10.1.1 → 10.10.1.2    TCP 83 8081 → 38114 [PSH, ACK] Seq=188 Ack=205 Win=65152 Len=17 TSval=3806447500 TSecr=1682187791
1712183533.222799301   138 0.543101224    10.10.1.2 → 10.10.1.1    TCP 83 38114 → 8081 [PSH, ACK] Seq=205 Ack=205 Win=64256 Len=17 TSval=1682187792 TSecr=3806447500
1712183535.222799301   140 0.543231310    10.10.1.1 → 10.10.1.2    TCP 83 8081 → 38114 [PSH, ACK] Seq=205 Ack=222 Win=65152 Len=17 TSval=3806447501 TSecr=1682187792
1712183541.222799301   146 0.544447462    10.10.1.2 → 10.10.1.1    TCP 83 38114 → 8081 [PSH, ACK] Seq=222 Ack=222 Win=64256 Len=17 TSval=1682187793 TSecr=3806447501
1712183543.222799301   148 0.544504403    10.10.1.1 → 10.10.1.2    TCP 83 8081 → 38114 [PSH, ACK] Seq=222 Ack=239 Win=65152 Len=17 TSval=3806447502 TSecr=1682187793
1712183549.222799301   154 0.545713332    10.10.1.2 → 10.10.1.1    TCP 83 38114 → 8081 [PSH, ACK] Seq=239 Ack=239 Win=64256 Len=17 TSval=1682187795 TSecr=3806447502
1712183551.222799301   156 0.545843010    10.10.1.1 → 10.10.1.2    TCP 83 8081 → 38114 [PSH, ACK] Seq=239 Ack=256 Win=65152 Len=17 TSval=3806447504 TSecr=1682187795
1712183558.222799301   163 0.547057248    10.10.1.2 → 10.10.1.1    TCP 83 38114 → 8081 [PSH, ACK] Seq=256 Ack=256 Win=64256 Len=17 TSval=1682187796 TSecr=3806447504
1712183560.222799301   165 0.547188166    10.10.1.1 → 10.10.1.2    TCP 83 8081 → 38114 [PSH, ACK] Seq=256 Ack=273 Win=65152 Len=17 TSval=3806447505 TSecr=1682187796
1712183566.222799301   171 0.548405213    10.10.1.2 → 10.10.1.1    TCP 83 38114 → 8081 [PSH, ACK] Seq=273 Ack=273 Win=64256 Len=17 TSval=1682187797 TSecr=3806447505
1712183568.222799301   173 0.548539289    10.10.1.1 → 10.10.1.2    TCP 83 8081 → 38114 [PSH, ACK] Seq=273 Ack=290 Win=65152 Len=17 TSval=3806447506 TSecr=1682187797
1712183575.222799301   180 0.549755751    10.10.1.2 → 10.10.1.1    TCP 83 38114 → 8081 [PSH, ACK] Seq=290 Ack=290 Win=64256 Len=17 TSval=1682187799 TSecr=3806447506
1712183577.222799301   182 0.549886801    10.10.1.1 → 10.10.1.2    TCP 83 8081 → 38114 [PSH, ACK] Seq=290 Ack=307 Win=65152 Len=17 TSval=3806447508 TSecr=1682187799
1712183583.222799301   188 0.551100144    10.10.1.2 → 10.10.1.1    TCP 83 38114 → 8081 [PSH, ACK] Seq=307 Ack=307 Win=64256 Len=17 TSval=1682187800 TSecr=3806447508
1712183585.222799301   190 0.551226422    10.10.1.1 → 10.10.1.2    TCP 83 8081 → 38114 [PSH, ACK] Seq=307 Ack=324 Win=65152 Len=17 TSval=3806447509 TSecr=1682187800
1712183592.222799301   197 0.552444031    10.10.1.2 → 10.10.1.1    TCP 83 38114 → 8081 [PSH, ACK] Seq=324 Ack=324 Win=64256 Len=17 TSval=1682187801 TSecr=3806447509
1712183594.222799301   199 0.552578026    10.10.1.1 → 10.10.1.2    TCP 83 8081 → 38114 [PSH, ACK] Seq=324 Ack=341 Win=65152 Len=17 TSval=3806447511 TSecr=1682187801
1712183600.222799301   205 0.553790536    10.10.1.2 → 10.10.1.1    TCP 83 38114 → 8081 [PSH, ACK] Seq=341 Ack=341 Win=64256 Len=17 TSval=1682187803 TSecr=3806447511
1712183602.222799301   207 0.553921368    10.10.1.1 → 10.10.1.2    TCP 83 8081 → 38114 [PSH, ACK] Seq=341 Ack=358 Win=65152 Len=17 TSval=3806447512 TSecr=1682187803
1712183609.222799301   214 0.555134669    10.10.1.2 → 10.10.1.1    TCP 83 38114 → 8081 [PSH, ACK] Seq=358 Ack=358 Win=64256 Len=17 TSval=1682187804 TSecr=3806447512
1712183611.222799301   216 0.555265800    10.10.1.1 → 10.10.1.2    TCP 83 8081 → 38114 [PSH, ACK] Seq=358 Ack=375 Win=65152 Len=17 TSval=3806447513 TSecr=1682187804
1712183617.222799301   222 0.556483191    10.10.1.2 → 10.10.1.1    TCP 83 38114 → 8081 [PSH, ACK] Seq=375 Ack=375 Win=64256 Len=17 TSval=1682187805 TSecr=3806447513
1712183620.222799301   225 0.556619665    10.10.1.1 → 10.10.1.2    TCP 83 8081 → 38114 [PSH, ACK] Seq=375 Ack=392 Win=65152 Len=17 TSval=3806447515 TSecr=1682187805
1712183626.222799301   231 0.557835273    10.10.1.2 → 10.10.1.1    TCP 83 38114 → 8081 [PSH, ACK] Seq=392 Ack=392 Win=64256 Len=17 TSval=1682187807 TSecr=3806447515
1712183628.222799301   233 0.557966155    10.10.1.1 → 10.10.1.2    TCP 83 8081 → 38114 [PSH, ACK] Seq=392 Ack=409 Win=65152 Len=17 TSval=3806447516 TSecr=1682187807
1712183634.222799301   239 0.559181022    10.10.1.2 → 10.10.1.1    TCP 83 38114 → 8081 [PSH, ACK] Seq=409 Ack=409 Win=64256 Len=17 TSval=1682187808 TSecr=3806447516
1712183636.222799301   241 0.559312668    10.10.1.1 → 10.10.1.2    TCP 83 8081 → 38114 [PSH, ACK] Seq=409 Ack=426 Win=65152 Len=17 TSval=3806447517 TSecr=1682187808
1712183643.222799301   248 0.560531256    10.10.1.2 → 10.10.1.1    TCP 83 38114 → 8081 [PSH, ACK] Seq=426 Ack=426 Win=64256 Len=17 TSval=1682187809 TSecr=3806447517
1712183645.222799301   250 0.560666785    10.10.1.1 → 10.10.1.2    TCP 83 8081 → 38114 [PSH, ACK] Seq=426 Ack=443 Win=65152 Len=17 TSval=3806447519 TSecr=1682187809
1712183651.222799301   256 0.561880783    10.10.1.2 → 10.10.1.1    TCP 83 38114 → 8081 [PSH, ACK] Seq=443 Ack=443 Win=64256 Len=17 TSval=1682187811 TSecr=3806447519
1712183653.222799301   258 0.562011689    10.10.1.1 → 10.10.1.2    TCP 83 8081 → 38114 [PSH, ACK] Seq=443 Ack=460 Win=65152 Len=17 TSval=3806447520 TSecr=1682187811
1712183660.222799301   265 0.563225945    10.10.1.2 → 10.10.1.1    TCP 83 38114 → 8081 [PSH, ACK] Seq=460 Ack=460 Win=64256 Len=17 TSval=1682187812 TSecr=3806447520
1712183662.222799301   267 0.563357516    10.10.1.1 → 10.10.1.2    TCP 83 8081 → 38114 [PSH, ACK] Seq=460 Ack=477 Win=65152 Len=17 TSval=3806447521 TSecr=1682187812
1712183668.222799301   273 0.564574888    10.10.1.2 → 10.10.1.1    TCP 83 38114 → 8081 [PSH, ACK] Seq=477 Ack=477 Win=64256 Len=17 TSval=1682187813 TSecr=3806447521
1712183670.222799301   275 0.564630499    10.10.1.1 → 10.10.1.2    TCP 83 8081 → 38114 [PSH, ACK] Seq=477 Ack=494 Win=65152 Len=17 TSval=3806447523 TSecr=1682187813
1712183676.222799301   281 0.565839709    10.10.1.2 → 10.10.1.1    TCP 83 38114 → 8081 [PSH, ACK] Seq=494 Ack=494 Win=64256 Len=17 TSval=1682187815 TSecr=3806447523
1712183678.222799301   283 0.565970184    10.10.1.1 → 10.10.1.2    TCP 83 8081 → 38114 [PSH, ACK] Seq=494 Ack=511 Win=65152 Len=17 TSval=3806447524 TSecr=1682187815
1712183685.222799301   290 0.567184233    10.10.1.2 → 10.10.1.1    TCP 83 38114 → 8081 [PSH, ACK] Seq=511 Ack=511 Win=64256 Len=17 TSval=1682187816 TSecr=3806447524
1712183687.222799301   292 0.567315527    10.10.1.1 → 10.10.1.2    TCP 83 8081 → 38114 [PSH, ACK] Seq=511 Ack=528 Win=65152 Len=17 TSval=3806447525 TSecr=1682187816
1712183693.222799301   298 0.568531363    10.10.1.2 → 10.10.1.1    TCP 83 38114 → 8081 [PSH, ACK] Seq=528 Ack=528 Win=64256 Len=17 TSval=1682187817 TSecr=3806447525
1712183695.222799301   300 0.568666345    10.10.1.1 → 10.10.1.2    TCP 83 8081 → 38114 [PSH, ACK] Seq=528 Ack=545 Win=65152 Len=17 TSval=3806447527 TSecr=1682187817
1712183702.222799301   307 0.569880864    10.10.1.2 → 10.10.1.1    TCP 83 38114 → 8081 [PSH, ACK] Seq=545 Ack=545 Win=64256 Len=17 TSval=1682187819 TSecr=3806447527
1712183704.222799301   309 0.570015637    10.10.1.1 → 10.10.1.2    TCP 83 8081 → 38114 [PSH, ACK] Seq=545 Ack=562 Win=65152 Len=17 TSval=3806447528 TSecr=1682187819
1712183710.222799301   315 0.571228869    10.10.1.2 → 10.10.1.1    TCP 83 38114 → 8081 [PSH, ACK] Seq=562 Ack=562 Win=64256 Len=17 TSval=1682187820 TSecr=3806447528
1712183712.222799301   317 0.571360069    10.10.1.1 → 10.10.1.2    TCP 83 8081 → 38114 [PSH, ACK] Seq=562 Ack=579 Win=65152 Len=17 TSval=3806447529 TSecr=1682187820
1712183719.222799301   324 0.572577826    10.10.1.2 → 10.10.1.1    TCP 83 38114 → 8081 [PSH, ACK] Seq=579 Ack=579 Win=64256 Len=17 TSval=1682187821 TSecr=3806447529
1712183721.222799301   326 0.572713357    10.10.1.1 → 10.10.1.2    TCP 83 8081 → 38114 [PSH, ACK] Seq=579 Ack=596 Win=65152 Len=17 TSval=3806447531 TSecr=1682187821
1712183727.222799301   332 0.573926524    10.10.1.2 → 10.10.1.1    TCP 83 38114 → 8081 [PSH, ACK] Seq=596 Ack=596 Win=64256 Len=17 TSval=1682187823 TSecr=3806447531
1712183729.222799301   334 0.574057451    10.10.1.1 → 10.10.1.2    TCP 83 8081 → 38114 [PSH, ACK] Seq=596 Ack=613 Win=65152 Len=17 TSval=3806447532 TSecr=1682187823
1712183736.222799301   341 0.575271939    10.10.1.2 → 10.10.1.1    TCP 83 38114 → 8081 [PSH, ACK] Seq=613 Ack=613 Win=64256 Len=17 TSval=1682187824 TSecr=3806447532
1712183738.222799301   343 0.575403156    10.10.1.1 → 10.10.1.2    TCP 83 8081 → 38114 [PSH, ACK] Seq=613 Ack=630 Win=65152 Len=17 TSval=3806447533 TSecr=1682187824
1712183745.222799301   350 0.576674449    10.10.1.2 → 10.10.1.1    TCP 83 38114 → 8081 [PSH, ACK] Seq=630 Ack=630 Win=64256 Len=17 TSval=1682187825 TSecr=3806447533
1712183747.222799301   352 0.576808260    10.10.1.1 → 10.10.1.2    TCP 83 8081 → 38114 [PSH, ACK] Seq=630 Ack=647 Win=65152 Len=17 TSval=3806447535 TSecr=1682187825
1712183753.222799301   358 0.578021445    10.10.1.2 → 10.10.1.1    TCP 83 38114 → 8081 [PSH, ACK] Seq=647 Ack=647 Win=64256 Len=17 TSval=1682187827 TSecr=3806447535
1712183755.222799301   360 0.578152157    10.10.1.1 → 10.10.1.2    TCP 83 8081 → 38114 [PSH, ACK] Seq=647 Ack=664 Win=65152 Len=17 TSval=3806447536 TSecr=1682187827
1712183761.222799301   366 0.579365986    10.10.1.2 → 10.10.1.1    TCP 83 38114 → 8081 [PSH, ACK] Seq=664 Ack=664 Win=64256 Len=17 TSval=1682187828 TSecr=3806447536
1712183763.222799301   368 0.579498548    10.10.1.1 → 10.10.1.2    TCP 83 8081 → 38114 [PSH, ACK] Seq=664 Ack=681 Win=65152 Len=17 TSval=3806447537 TSecr=1682187828
1712183770.222799301   375 0.580716275    10.10.1.2 → 10.10.1.1    TCP 83 38114 → 8081 [PSH, ACK] Seq=681 Ack=681 Win=64256 Len=17 TSval=1682187830 TSecr=3806447537
1712183772.222799301   377 0.580850462    10.10.1.1 → 10.10.1.2    TCP 83 8081 → 38114 [PSH, ACK] Seq=681 Ack=698 Win=65152 Len=17 TSval=3806447539 TSecr=1682187830
1712183778.222799301   383 0.582064025    10.10.1.2 → 10.10.1.1    TCP 83 38114 → 8081 [PSH, ACK] Seq=698 Ack=698 Win=64256 Len=17 TSval=1682187831 TSecr=3806447539
1712183780.222799301   385 0.582195114    10.10.1.1 → 10.10.1.2    TCP 83 8081 → 38114 [PSH, ACK] Seq=698 Ack=715 Win=65152 Len=17 TSval=3806447540 TSecr=1682187831
1712183787.222799301   392 0.583410415    10.10.1.2 → 10.10.1.1    TCP 83 38114 → 8081 [PSH, ACK] Seq=715 Ack=715 Win=64256 Len=17 TSval=1682187832 TSecr=3806447540
1712183789.222799301   394 0.583558913    10.10.1.1 → 10.10.1.2    TCP 83 8081 → 38114 [PSH, ACK] Seq=715 Ack=732 Win=65152 Len=17 TSval=3806447541 TSecr=1682187832
1712183795.222799301   400 0.584775689    10.10.1.2 → 10.10.1.1    TCP 83 38114 → 8081 [PSH, ACK] Seq=732 Ack=732 Win=64256 Len=17 TSval=1682187834 TSecr=3806447541
1712183797.222799301   402 0.584905138    10.10.1.1 → 10.10.1.2    TCP 83 8081 → 38114 [PSH, ACK] Seq=732 Ack=749 Win=65152 Len=17 TSval=3806447543 TSecr=1682187834
1712183804.222799301   409 0.586119085    10.10.1.2 → 10.10.1.1    TCP 83 38114 → 8081 [PSH, ACK] Seq=749 Ack=749 Win=64256 Len=17 TSval=1682187835 TSecr=3806447543
1712183806.222799301   411 0.586169661    10.10.1.1 → 10.10.1.2    TCP 83 8081 → 38114 [PSH, ACK] Seq=749 Ack=766 Win=65152 Len=17 TSval=3806447544 TSecr=1682187835
1712183812.222799301   417 0.587379157    10.10.1.2 → 10.10.1.1    TCP 83 38114 → 8081 [PSH, ACK] Seq=766 Ack=766 Win=64256 Len=17 TSval=1682187836 TSecr=3806447544
1712183814.222799301   419 0.587429511    10.10.1.1 → 10.10.1.2    TCP 83 8081 → 38114 [PSH, ACK] Seq=766 Ack=783 Win=65152 Len=17 TSval=3806447545 TSecr=1682187836
1712183820.222799301   425 0.588641990    10.10.1.2 → 10.10.1.1    TCP 83 38114 → 8081 [PSH, ACK] Seq=783 Ack=783 Win=64256 Len=17 TSval=1682187837 TSecr=3806447545
1712183822.222799301   427 0.588776645    10.10.1.1 → 10.10.1.2    TCP 83 8081 → 38114 [PSH, ACK] Seq=783 Ack=800 Win=65152 Len=17 TSval=3806447547 TSecr=1682187837
1712183829.222799301   434 0.589990505    10.10.1.2 → 10.10.1.1    TCP 83 38114 → 8081 [PSH, ACK] Seq=800 Ack=800 Win=64256 Len=17 TSval=1682187839 TSecr=3806447547
1712183831.222799301   436 0.590120925    10.10.1.1 → 10.10.1.2    TCP 83 8081 → 38114 [PSH, ACK] Seq=800 Ack=817 Win=65152 Len=17 TSval=3806447548 TSecr=1682187839
1712183837.222799301   442 0.591334381    10.10.1.2 → 10.10.1.1    TCP 83 38114 → 8081 [PSH, ACK] Seq=817 Ack=817 Win=64256 Len=17 TSval=1682187840 TSecr=3806447548
1712183839.222799301   444 0.591464354    10.10.1.1 → 10.10.1.2    TCP 83 8081 → 38114 [PSH, ACK] Seq=817 Ack=834 Win=65152 Len=17 TSval=3806447549 TSecr=1682187840
1712183846.222799301   451 0.592681175    10.10.1.2 → 10.10.1.1    TCP 83 38114 → 8081 [PSH, ACK] Seq=834 Ack=834 Win=64256 Len=17 TSval=1682187841 TSecr=3806447549
1712183848.222799301   453 0.592816381    10.10.1.1 → 10.10.1.2    TCP 83 8081 → 38114 [PSH, ACK] Seq=834 Ack=851 Win=65152 Len=17 TSval=3806447551 TSecr=1682187841
1712183854.222799301   459 0.594029002    10.10.1.2 → 10.10.1.1    TCP 83 38114 → 8081 [PSH, ACK] Seq=851 Ack=851 Win=64256 Len=17 TSval=1682187843 TSecr=3806447551
1712183856.222799301   461 0.594160105    10.10.1.1 → 10.10.1.2    TCP 83 8081 → 38114 [PSH, ACK] Seq=851 Ack=868 Win=65152 Len=17 TSval=3806447552 TSecr=1682187843
1712183863.222799301   468 0.595374370    10.10.1.2 → 10.10.1.1    TCP 83 38114 → 8081 [PSH, ACK] Seq=868 Ack=868 Win=64256 Len=17 TSval=1682187844 TSecr=3806447552
1712183865.222799301   470 0.595504771    10.10.1.1 → 10.10.1.2    TCP 83 8081 → 38114 [PSH, ACK] Seq=868 Ack=885 Win=65152 Len=17 TSval=3806447553 TSecr=1682187844
1712183871.222799301   476 0.596721192    10.10.1.2 → 10.10.1.1    TCP 83 38114 → 8081 [PSH, ACK] Seq=885 Ack=885 Win=64256 Len=17 TSval=1682187846 TSecr=3806447553
1712183873.222799301   478 0.596855729    10.10.1.1 → 10.10.1.2    TCP 83 8081 → 38114 [PSH, ACK] Seq=885 Ack=902 Win=65152 Len=17 TSval=3806447555 TSecr=1682187846
1712183880.222799301   485 0.598068434    10.10.1.2 → 10.10.1.1    TCP 83 38114 → 8081 [PSH, ACK] Seq=902 Ack=902 Win=64256 Len=17 TSval=1682187847 TSecr=3806447555
1712183882.222799301   487 0.598200246    10.10.1.1 → 10.10.1.2    TCP 83 8081 → 38114 [PSH, ACK] Seq=902 Ack=919 Win=65152 Len=17 TSval=3806447556 TSecr=1682187847
1712183888.222799301   493 0.599370862    10.10.1.2 → 10.10.1.1    TCP 83 38114 → 8081 [PSH, ACK] Seq=919 Ack=919 Win=64256 Len=17 TSval=1682187848 TSecr=3806447556
1712183889.222799301   494 0.599421451    10.10.1.1 → 10.10.1.2    TCP 83 8081 → 38114 [PSH, ACK] Seq=919 Ack=936 Win=65152 Len=17 TSval=3806447557 TSecr=1682187848
1712183896.222799301   501 0.600633164    10.10.1.2 → 10.10.1.1    TCP 83 38114 → 8081 [PSH, ACK] Seq=936 Ack=936 Win=64256 Len=17 TSval=1682187849 TSecr=3806447557
1712183898.222799301   503 0.600767284    10.10.1.1 → 10.10.1.2    TCP 83 8081 → 38114 [PSH, ACK] Seq=936 Ack=953 Win=65152 Len=17 TSval=3806447559 TSecr=1682187849
1712183905.222799301   510 0.601981079    10.10.1.2 → 10.10.1.1    TCP 83 38114 → 8081 [PSH, ACK] Seq=953 Ack=953 Win=64256 Len=17 TSval=1682187851 TSecr=3806447559
1712183907.222799301   512 0.602084566    10.10.1.1 → 10.10.1.2    TCP 83 8081 → 38114 [PSH, ACK] Seq=953 Ack=970 Win=65152 Len=17 TSval=3806447560 TSecr=1682187851
1712183913.222799301   518 0.603295229    10.10.1.2 → 10.10.1.1    TCP 83 38114 → 8081 [PSH, ACK] Seq=970 Ack=970 Win=64256 Len=17 TSval=1682187852 TSecr=3806447560
1712183915.222799301   520 0.603426804    10.10.1.1 → 10.10.1.2    TCP 83 8081 → 38114 [PSH, ACK] Seq=970 Ack=987 Win=65152 Len=17 TSval=3806447561 TSecr=1682187852
1712183922.222799301   527 0.604643980    10.10.1.2 → 10.10.1.1    TCP 83 38114 → 8081 [PSH, ACK] Seq=987 Ack=987 Win=64256 Len=17 TSval=1682187853 TSecr=3806447561
1712183924.222799301   529 0.604774701    10.10.1.1 → 10.10.1.2    TCP 83 8081 → 38114 [PSH, ACK] Seq=987 Ack=1004 Win=65152 Len=17 TSval=3806447563 TSecr=1682187853
1712183930.222799301   535 0.605987023    10.10.1.2 → 10.10.1.1    TCP 83 38114 → 8081 [PSH, ACK] Seq=1004 Ack=1004 Win=64256 Len=17 TSval=1682187855 TSecr=3806447563
1712183932.222799301   537 0.606114398    10.10.1.1 → 10.10.1.2    TCP 83 8081 → 38114 [PSH, ACK] Seq=1004 Ack=1021 Win=65152 Len=17 TSval=3806447564 TSecr=1682187855
1712183939.222799301   544 0.607328268    10.10.1.2 → 10.10.1.1    TCP 83 38114 → 8081 [PSH, ACK] Seq=1021 Ack=1021 Win=64256 Len=17 TSval=1682187856 TSecr=3806447564
1712183941.222799301   546 0.607454447    10.10.1.1 → 10.10.1.2    TCP 83 8081 → 38114 [PSH, ACK] Seq=1021 Ack=1038 Win=65152 Len=17 TSval=3806447565 TSecr=1682187856
1712183947.222799301   552 0.608670778    10.10.1.2 → 10.10.1.1    TCP 83 38114 → 8081 [PSH, ACK] Seq=1038 Ack=1038 Win=64256 Len=17 TSval=1682187857 TSecr=3806447565
1712183949.222799301   554 0.608805458    10.10.1.1 → 10.10.1.2    TCP 83 8081 → 38114 [PSH, ACK] Seq=1038 Ack=1055 Win=65152 Len=17 TSval=3806447567 TSecr=1682187857
1712183956.222799301   561 0.610019113    10.10.1.2 → 10.10.1.1    TCP 83 38114 → 8081 [PSH, ACK] Seq=1055 Ack=1055 Win=64256 Len=17 TSval=1682187859 TSecr=3806447567
1712183958.222799301   563 0.610145060    10.10.1.1 → 10.10.1.2    TCP 83 8081 → 38114 [PSH, ACK] Seq=1055 Ack=1072 Win=65152 Len=17 TSval=3806447568 TSecr=1682187859
1712183964.222799301   569 0.611359276    10.10.1.2 → 10.10.1.1    TCP 83 38114 → 8081 [PSH, ACK] Seq=1072 Ack=1072 Win=64256 Len=17 TSval=1682187860 TSecr=3806447568
1712183966.222799301   571 0.611486441    10.10.1.1 → 10.10.1.2    TCP 83 8081 → 38114 [PSH, ACK] Seq=1072 Ack=1089 Win=65152 Len=17 TSval=3806447569 TSecr=1682187860
1712183973.222799301   578 0.612703644    10.10.1.2 → 10.10.1.1    TCP 83 38114 → 8081 [PSH, ACK] Seq=1089 Ack=1089 Win=64256 Len=17 TSval=1682187862 TSecr=3806447569
1712183975.222799301   580 0.612838716    10.10.1.1 → 10.10.1.2    TCP 83 8081 → 38114 [PSH, ACK] Seq=1089 Ack=1106 Win=65152 Len=17 TSval=3806447571 TSecr=1682187862
1712183981.222799301   586 0.614052096    10.10.1.2 → 10.10.1.1    TCP 83 38114 → 8081 [PSH, ACK] Seq=1106 Ack=1106 Win=64256 Len=17 TSval=1682187863 TSecr=3806447571
1712183983.222799301   588 0.614182922    10.10.1.1 → 10.10.1.2    TCP 83 8081 → 38114 [PSH, ACK] Seq=1106 Ack=1123 Win=65152 Len=17 TSval=3806447572 TSecr=1682187863
1712183990.222799301   595 0.615397376    10.10.1.2 → 10.10.1.1    TCP 83 38114 → 8081 [PSH, ACK] Seq=1123 Ack=1123 Win=64256 Len=17 TSval=1682187864 TSecr=3806447572
1712183992.222799301   597 0.615523626    10.10.1.1 → 10.10.1.2    TCP 83 8081 → 38114 [PSH, ACK] Seq=1123 Ack=1140 Win=65152 Len=17 TSval=3806447573 TSecr=1682187864
1712183998.222799301   603 0.616740487    10.10.1.2 → 10.10.1.1    TCP 83 38114 → 8081 [PSH, ACK] Seq=1140 Ack=1140 Win=64256 Len=17 TSval=1682187866 TSecr=3806447573
1712184000.222799301   605 0.616874997    10.10.1.1 → 10.10.1.2    TCP 83 8081 → 38114 [PSH, ACK] Seq=1140 Ack=1157 Win=65152 Len=17 TSval=3806447575 TSecr=1682187866
1712184007.222799301   612 0.618088452    10.10.1.2 → 10.10.1.1    TCP 83 38114 → 8081 [PSH, ACK] Seq=1157 Ack=1157 Win=64256 Len=17 TSval=1682187867 TSecr=3806447575
1712184009.222799301   614 0.618219129    10.10.1.1 → 10.10.1.2    TCP 83 8081 → 38114 [PSH, ACK] Seq=1157 Ack=1174 Win=65152 Len=17 TSval=3806447576 TSecr=1682187867
1712184016.222799301   621 0.619488966    10.10.1.2 → 10.10.1.1    TCP 83 38114 → 8081 [PSH, ACK] Seq=1174 Ack=1174 Win=64256 Len=17 TSval=1682187868 TSecr=3806447576
1712184018.222799301   623 0.619633044    10.10.1.1 → 10.10.1.2    TCP 83 8081 → 38114 [PSH, ACK] Seq=1174 Ack=1191 Win=65152 Len=17 TSval=3806447578 TSecr=1682187868
1712184024.222799301   629 0.620850935    10.10.1.2 → 10.10.1.1    TCP 83 38114 → 8081 [PSH, ACK] Seq=1191 Ack=1191 Win=64256 Len=17 TSval=1682187870 TSecr=3806447578
1712184026.222799301   631 0.620981345    10.10.1.1 → 10.10.1.2    TCP 83 8081 → 38114 [PSH, ACK] Seq=1191 Ack=1208 Win=65152 Len=17 TSval=3806447579 TSecr=1682187870
1712184032.222799301   637 0.622193587    10.10.1.2 → 10.10.1.1    TCP 83 38114 → 8081 [PSH, ACK] Seq=1208 Ack=1208 Win=64256 Len=17 TSval=1682187871 TSecr=3806447579
1712184034.222799301   639 0.622320378    10.10.1.1 → 10.10.1.2    TCP 83 8081 → 38114 [PSH, ACK] Seq=1208 Ack=1225 Win=65152 Len=17 TSval=3806447580 TSecr=1682187871
1712184041.222799301   646 0.623534690    10.10.1.2 → 10.10.1.1    TCP 83 38114 → 8081 [PSH, ACK] Seq=1225 Ack=1225 Win=64256 Len=17 TSval=1682187872 TSecr=3806447580
1712184043.222799301   648 0.623661895    10.10.1.1 → 10.10.1.2    TCP 83 8081 → 38114 [PSH, ACK] Seq=1225 Ack=1242 Win=65152 Len=17 TSval=3806447582 TSecr=1682187872
1712184049.222799301   654 0.624878282    10.10.1.2 → 10.10.1.1    TCP 83 38114 → 8081 [PSH, ACK] Seq=1242 Ack=1242 Win=64256 Len=17 TSval=1682187874 TSecr=3806447582
1712184051.222799301   656 0.625008493    10.10.1.1 → 10.10.1.2    TCP 83 8081 → 38114 [PSH, ACK] Seq=1242 Ack=1259 Win=65152 Len=17 TSval=3806447583 TSecr=1682187874
1712184058.222799301   663 0.626221836    10.10.1.2 → 10.10.1.1    TCP 83 38114 → 8081 [PSH, ACK] Seq=1259 Ack=1259 Win=64256 Len=17 TSval=1682187875 TSecr=3806447583
1712184060.222799301   665 0.626272746    10.10.1.1 → 10.10.1.2    TCP 83 8081 → 38114 [PSH, ACK] Seq=1259 Ack=1276 Win=65152 Len=17 TSval=3806447584 TSecr=1682187875
1712184066.222799301   671 0.627482589    10.10.1.2 → 10.10.1.1    TCP 83 38114 → 8081 [PSH, ACK] Seq=1276 Ack=1276 Win=64256 Len=17 TSval=1682187876 TSecr=3806447584
1712184068.222799301   673 0.627532836    10.10.1.1 → 10.10.1.2    TCP 83 8081 → 38114 [PSH, ACK] Seq=1276 Ack=1293 Win=65152 Len=17 TSval=3806447585 TSecr=1682187876
1712184074.222799301   679 0.628745252    10.10.1.2 → 10.10.1.1    TCP 83 38114 → 8081 [PSH, ACK] Seq=1293 Ack=1293 Win=64256 Len=17 TSval=1682187878 TSecr=3806447585
1712184076.222799301   681 0.628798671    10.10.1.1 → 10.10.1.2    TCP 83 8081 → 38114 [PSH, ACK] Seq=1293 Ack=1310 Win=65152 Len=17 TSval=3806447587 TSecr=1682187878
1712184082.222799301   687 0.630007161    10.10.1.2 → 10.10.1.1    TCP 83 38114 → 8081 [PSH, ACK] Seq=1310 Ack=1310 Win=64256 Len=17 TSval=1682187879 TSecr=3806447587
1712184084.222799301   689 0.630137894    10.10.1.1 → 10.10.1.2    TCP 83 8081 → 38114 [PSH, ACK] Seq=1310 Ack=1327 Win=65152 Len=17 TSval=3806447588 TSecr=1682187879
1712184091.222799301   696 0.631352196    10.10.1.2 → 10.10.1.1    TCP 83 38114 → 8081 [PSH, ACK] Seq=1327 Ack=1327 Win=64256 Len=17 TSval=1682187880 TSecr=3806447588
1712184093.222799301   698 0.631482493    10.10.1.1 → 10.10.1.2    TCP 83 8081 → 38114 [PSH, ACK] Seq=1327 Ack=1344 Win=65152 Len=17 TSval=3806447589 TSecr=1682187880
1712184099.222799301   704 0.632698769    10.10.1.2 → 10.10.1.1    TCP 83 38114 → 8081 [PSH, ACK] Seq=1344 Ack=1344 Win=64256 Len=17 TSval=1682187881 TSecr=3806447589
1712184101.222799301   706 0.632833935    10.10.1.1 → 10.10.1.2    TCP 83 8081 → 38114 [PSH, ACK] Seq=1344 Ack=1361 Win=65152 Len=17 TSval=3806447591 TSecr=1682187881
1712184108.222799301   713 0.634048486    10.10.1.2 → 10.10.1.1    TCP 83 38114 → 8081 [PSH, ACK] Seq=1361 Ack=1361 Win=64256 Len=17 TSval=1682187883 TSecr=3806447591
1712184110.222799301   715 0.634192521    10.10.1.1 → 10.10.1.2    TCP 83 8081 → 38114 [PSH, ACK] Seq=1361 Ack=1378 Win=65152 Len=17 TSval=3806447592 TSecr=1682187883
1712184116.222799301   721 0.635405911    10.10.1.2 → 10.10.1.1    TCP 83 38114 → 8081 [PSH, ACK] Seq=1378 Ack=1378 Win=64256 Len=17 TSval=1682187884 TSecr=3806447592
1712184118.222799301   723 0.635538003    10.10.1.1 → 10.10.1.2    TCP 83 8081 → 38114 [PSH, ACK] Seq=1378 Ack=1395 Win=65152 Len=17 TSval=3806447593 TSecr=1682187884
1712184125.222799301   730 0.636770054    10.10.1.2 → 10.10.1.1    TCP 83 38114 → 8081 [PSH, ACK] Seq=1395 Ack=1395 Win=64256 Len=17 TSval=1682187886 TSecr=3806447593
1712184127.222799301   732 0.636899883    10.10.1.1 → 10.10.1.2    TCP 83 8081 → 38114 [PSH, ACK] Seq=1395 Ack=1412 Win=65152 Len=17 TSval=3806447595 TSecr=1682187886
1712184133.222799301   738 0.638112458    10.10.1.2 → 10.10.1.1    TCP 83 38114 → 8081 [PSH, ACK] Seq=1412 Ack=1412 Win=64256 Len=17 TSval=1682187887 TSecr=3806447595
1712184135.222799301   740 0.638238978    10.10.1.1 → 10.10.1.2    TCP 83 8081 → 38114 [PSH, ACK] Seq=1412 Ack=1429 Win=65152 Len=17 TSval=3806447596 TSecr=1682187887
1712184142.222799301   747 0.639454184    10.10.1.2 → 10.10.1.1    TCP 83 38114 → 8081 [PSH, ACK] Seq=1429 Ack=1429 Win=64256 Len=17 TSval=1682187888 TSecr=3806447596
1712184144.222799301   749 0.639598370    10.10.1.1 → 10.10.1.2    TCP 83 8081 → 38114 [PSH, ACK] Seq=1429 Ack=1446 Win=65152 Len=17 TSval=3806447598 TSecr=1682187888
1712184150.222799301   755 0.640815278    10.10.1.2 → 10.10.1.1    TCP 83 38114 → 8081 [PSH, ACK] Seq=1446 Ack=1446 Win=64256 Len=17 TSval=1682187890 TSecr=3806447598
1712184152.222799301   757 0.640870554    10.10.1.1 → 10.10.1.2    TCP 83 8081 → 38114 [PSH, ACK] Seq=1446 Ack=1463 Win=65152 Len=17 TSval=3806447599 TSecr=1682187890
1712184158.222799301   763 0.642080048    10.10.1.2 → 10.10.1.1    TCP 83 38114 → 8081 [PSH, ACK] Seq=1463 Ack=1463 Win=64256 Len=17 TSval=1682187891 TSecr=3806447599
1712184160.222799301   765 0.642206044    10.10.1.1 → 10.10.1.2    TCP 83 8081 → 38114 [PSH, ACK] Seq=1463 Ack=1480 Win=65152 Len=17 TSval=3806447600 TSecr=1682187891
1712184167.222799301   772 0.643419987    10.10.1.2 → 10.10.1.1    TCP 83 38114 → 8081 [PSH, ACK] Seq=1480 Ack=1480 Win=64256 Len=17 TSval=1682187892 TSecr=3806447600
1712184169.222799301   774 0.643563567    10.10.1.1 → 10.10.1.2    TCP 83 8081 → 38114 [PSH, ACK] Seq=1480 Ack=1497 Win=65152 Len=17 TSval=3806447601 TSecr=1682187892
1712184175.222799301   780 0.644780632    10.10.1.2 → 10.10.1.1    TCP 83 38114 → 8081 [PSH, ACK] Seq=1497 Ack=1497 Win=64256 Len=17 TSval=1682187894 TSecr=3806447601
1712184177.222799301   782 0.644836940    10.10.1.1 → 10.10.1.2    TCP 83 8081 → 38114 [PSH, ACK] Seq=1497 Ack=1514 Win=65152 Len=17 TSval=3806447603 TSecr=1682187894
1712184183.222799301   788 0.646047096    10.10.1.2 → 10.10.1.1    TCP 83 38114 → 8081 [PSH, ACK] Seq=1514 Ack=1514 Win=64256 Len=17 TSval=1682187895 TSecr=3806447603
1712184185.222799301   790 0.646097096    10.10.1.1 → 10.10.1.2    TCP 83 8081 → 38114 [PSH, ACK] Seq=1514 Ack=1531 Win=65152 Len=17 TSval=3806447604 TSecr=1682187895
1712184191.222799301   796 0.647306945    10.10.1.2 → 10.10.1.1    TCP 83 38114 → 8081 [PSH, ACK] Seq=1531 Ack=1531 Win=64256 Len=17 TSval=1682187896 TSecr=3806447604
1712184193.222799301   798 0.647357156    10.10.1.1 → 10.10.1.2    TCP 83 8081 → 38114 [PSH, ACK] Seq=1531 Ack=1548 Win=65152 Len=17 TSval=3806447605 TSecr=1682187896
1712184199.222799301   804 0.648569794    10.10.1.2 → 10.10.1.1    TCP 83 38114 → 8081 [PSH, ACK] Seq=1548 Ack=1548 Win=64256 Len=17 TSval=1682187897 TSecr=3806447605
1712184201.222799301   806 0.648704719    10.10.1.1 → 10.10.1.2    TCP 83 8081 → 38114 [PSH, ACK] Seq=1548 Ack=1565 Win=65152 Len=17 TSval=3806447607 TSecr=1682187897
1712184208.222799301   813 0.649919129    10.10.1.2 → 10.10.1.1    TCP 83 38114 → 8081 [PSH, ACK] Seq=1565 Ack=1565 Win=64256 Len=17 TSval=1682187899 TSecr=3806447607
1712184210.222799301   815 0.650048967    10.10.1.1 → 10.10.1.2    TCP 83 8081 → 38114 [PSH, ACK] Seq=1565 Ack=1582 Win=65152 Len=17 TSval=3806447608 TSecr=1682187899
1712184216.222799301   821 0.651262749    10.10.1.2 → 10.10.1.1    TCP 83 38114 → 8081 [PSH, ACK] Seq=1582 Ack=1582 Win=64256 Len=17 TSval=1682187900 TSecr=3806447608
1712184218.222799301   823 0.651389434    10.10.1.1 → 10.10.1.2    TCP 83 8081 → 38114 [PSH, ACK] Seq=1582 Ack=1599 Win=65152 Len=17 TSval=3806447609 TSecr=1682187900
1712184225.222799301   830 0.652607826    10.10.1.2 → 10.10.1.1    TCP 83 38114 → 8081 [PSH, ACK] Seq=1599 Ack=1599 Win=64256 Len=17 TSval=1682187901 TSecr=3806447609
1712184227.222799301   832 0.652742295    10.10.1.1 → 10.10.1.2    TCP 83 8081 → 38114 [PSH, ACK] Seq=1599 Ack=1616 Win=65152 Len=17 TSval=3806447611 TSecr=1682187901
1712184233.222799301   838 0.653955408    10.10.1.2 → 10.10.1.1    TCP 83 38114 → 8081 [PSH, ACK] Seq=1616 Ack=1616 Win=64256 Len=17 TSval=1682187903 TSecr=3806447611
1712184235.222799301   840 0.654082545    10.10.1.1 → 10.10.1.2    TCP 83 8081 → 38114 [PSH, ACK] Seq=1616 Ack=1633 Win=65152 Len=17 TSval=3806447612 TSecr=1682187903
1712184242.222799301   847 0.655297431    10.10.1.2 → 10.10.1.1    TCP 83 38114 → 8081 [PSH, ACK] Seq=1633 Ack=1633 Win=64256 Len=17 TSval=1682187904 TSecr=3806447612
1712184244.222799301   849 0.655423996    10.10.1.1 → 10.10.1.2    TCP 83 8081 → 38114 [PSH, ACK] Seq=1633 Ack=1650 Win=65152 Len=17 TSval=3806447613 TSecr=1682187904
1712184250.222799301   855 0.656641311    10.10.1.2 → 10.10.1.1    TCP 83 38114 → 8081 [PSH, ACK] Seq=1650 Ack=1650 Win=64256 Len=17 TSval=1682187905 TSecr=3806447613
1712184252.222799301   857 0.656770564    10.10.1.1 → 10.10.1.2    TCP 83 8081 → 38114 [PSH, ACK] Seq=1650 Ack=1667 Win=65152 Len=17 TSval=3806447615 TSecr=1682187905
1712184259.222799301   864 0.657984208    10.10.1.2 → 10.10.1.1    TCP 83 38114 → 8081 [PSH, ACK] Seq=1667 Ack=1667 Win=64256 Len=17 TSval=1682187907 TSecr=3806447615
1712184261.222799301   866 0.658115892    10.10.1.1 → 10.10.1.2    TCP 83 8081 → 38114 [PSH, ACK] Seq=1667 Ack=1684 Win=65152 Len=17 TSval=3806447616 TSecr=1682187907
1712184267.222799301   872 0.659329593    10.10.1.2 → 10.10.1.1    TCP 83 38114 → 8081 [PSH, ACK] Seq=1684 Ack=1684 Win=64256 Len=17 TSval=1682187908 TSecr=3806447616
1712184269.222799301   874 0.659461668    10.10.1.1 → 10.10.1.2    TCP 83 8081 → 38114 [PSH, ACK] Seq=1684 Ack=1701 Win=65152 Len=17 TSval=3806447617 TSecr=1682187908
1712184276.222799301   881 0.660679774    10.10.1.2 → 10.10.1.1    TCP 83 38114 → 8081 [PSH, ACK] Seq=1701 Ack=1701 Win=64256 Len=17 TSval=1682187909 TSecr=3806447617
1712184278.222799301   883 0.660761030    10.10.1.1 → 10.10.1.2    TCP 83 8081 → 38114 [PSH, ACK] Seq=1701 Ack=1718 Win=65152 Len=17 TSval=3806447619 TSecr=1682187909
1712184285.222799301   890 0.662031222    10.10.1.2 → 10.10.1.1    TCP 83 38114 → 8081 [PSH, ACK] Seq=1718 Ack=1718 Win=64256 Len=17 TSval=1682187911 TSecr=3806447619
1712184286.222799301   891 0.662086901    10.10.1.1 → 10.10.1.2    TCP 83 8081 → 38114 [PSH, ACK] Seq=1718 Ack=1735 Win=65152 Len=17 TSval=3806447620 TSecr=1682187911
1712184293.222799301   898 0.663297511    10.10.1.2 → 10.10.1.1    TCP 83 38114 → 8081 [PSH, ACK] Seq=1735 Ack=1735 Win=64256 Len=17 TSval=1682187912 TSecr=3806447620
1712184295.222799301   900 0.663347825    10.10.1.1 → 10.10.1.2    TCP 83 8081 → 38114 [PSH, ACK] Seq=1735 Ack=1752 Win=65152 Len=17 TSval=3806447621 TSecr=1682187912
1712184301.222799301   906 0.664561820    10.10.1.2 → 10.10.1.1    TCP 83 38114 → 8081 [PSH, ACK] Seq=1752 Ack=1752 Win=64256 Len=17 TSval=1682187913 TSecr=3806447621
1712184303.222799301   908 0.664696260    10.10.1.1 → 10.10.1.2    TCP 83 8081 → 38114 [PSH, ACK] Seq=1752 Ack=1769 Win=65152 Len=17 TSval=3806447623 TSecr=1682187913
1712184310.222799301   915 0.665910648    10.10.1.2 → 10.10.1.1    TCP 83 38114 → 8081 [PSH, ACK] Seq=1769 Ack=1769 Win=64256 Len=17 TSval=1682187915 TSecr=3806447623
1712184312.222799301   917 0.666042912    10.10.1.1 → 10.10.1.2    TCP 83 8081 → 38114 [PSH, ACK] Seq=1769 Ack=1786 Win=65152 Len=17 TSval=3806447624 TSecr=1682187915
1712184318.222799301   923 0.667258875    10.10.1.2 → 10.10.1.1    TCP 83 38114 → 8081 [PSH, ACK] Seq=1786 Ack=1786 Win=64256 Len=17 TSval=1682187916 TSecr=3806447624
1712184320.222799301   925 0.667389855    10.10.1.1 → 10.10.1.2    TCP 83 8081 → 38114 [PSH, ACK] Seq=1786 Ack=1803 Win=65152 Len=17 TSval=3806447625 TSecr=1682187916
1712184327.222799301   932 0.668605864    10.10.1.2 → 10.10.1.1    TCP 83 38114 → 8081 [PSH, ACK] Seq=1803 Ack=1803 Win=64256 Len=17 TSval=1682187917 TSecr=3806447625
1712184329.222799301   934 0.668741408    10.10.1.1 → 10.10.1.2    TCP 83 8081 → 38114 [PSH, ACK] Seq=1803 Ack=1820 Win=65152 Len=17 TSval=3806447627 TSecr=1682187917
1712184335.222799301   940 0.669954483    10.10.1.2 → 10.10.1.1    TCP 83 38114 → 8081 [PSH, ACK] Seq=1820 Ack=1820 Win=64256 Len=17 TSval=1682187919 TSecr=3806447627
1712184337.222799301   942 0.670085110    10.10.1.1 → 10.10.1.2    TCP 83 8081 → 38114 [PSH, ACK] Seq=1820 Ack=1837 Win=65152 Len=17 TSval=3806447628 TSecr=1682187919
1712184344.222799301   949 0.671299351    10.10.1.2 → 10.10.1.1    TCP 83 38114 → 8081 [PSH, ACK] Seq=1837 Ack=1837 Win=64256 Len=17 TSval=1682187920 TSecr=3806447628
1712184346.222799301   951 0.671426227    10.10.1.1 → 10.10.1.2    TCP 83 8081 → 38114 [PSH, ACK] Seq=1837 Ack=1854 Win=65152 Len=17 TSval=3806447629 TSecr=1682187920
1712184352.222799301   957 0.672642472    10.10.1.2 → 10.10.1.1    TCP 83 38114 → 8081 [PSH, ACK] Seq=1854 Ack=1854 Win=64256 Len=17 TSval=1682187921 TSecr=3806447629
1712184354.222799301   959 0.672772830    10.10.1.1 → 10.10.1.2    TCP 83 8081 → 38114 [PSH, ACK] Seq=1854 Ack=1871 Win=65152 Len=17 TSval=3806447631 TSecr=1682187921
1712184361.222799301   966 0.673986350    10.10.1.2 → 10.10.1.1    TCP 83 38114 → 8081 [PSH, ACK] Seq=1871 Ack=1871 Win=64256 Len=17 TSval=1682187923 TSecr=3806447631
1712184363.222799301   968 0.674118268    10.10.1.1 → 10.10.1.2    TCP 83 8081 → 38114 [PSH, ACK] Seq=1871 Ack=1888 Win=65152 Len=17 TSval=3806447632 TSecr=1682187923
1712184369.222799301   974 0.675331238    10.10.1.2 → 10.10.1.1    TCP 83 38114 → 8081 [PSH, ACK] Seq=1888 Ack=1888 Win=64256 Len=17 TSval=1682187924 TSecr=3806447632
1712184371.222799301   976 0.675382295    10.10.1.1 → 10.10.1.2    TCP 83 8081 → 38114 [PSH, ACK] Seq=1888 Ack=1905 Win=65152 Len=17 TSval=3806447633 TSecr=1682187924
1712184377.222799301   982 0.676595114    10.10.1.2 → 10.10.1.1    TCP 83 38114 → 8081 [PSH, ACK] Seq=1905 Ack=1905 Win=64256 Len=17 TSval=1682187925 TSecr=3806447633
1712184379.222799301   984 0.676729791    10.10.1.1 → 10.10.1.2    TCP 83 8081 → 38114 [PSH, ACK] Seq=1905 Ack=1922 Win=65152 Len=17 TSval=3806447635 TSecr=1682187925
1712184386.222799301   991 0.677943461    10.10.1.2 → 10.10.1.1    TCP 83 38114 → 8081 [PSH, ACK] Seq=1922 Ack=1922 Win=64256 Len=17 TSval=1682187927 TSecr=3806447635
1712184388.222799301   993 0.678128170    10.10.1.1 → 10.10.1.2    TCP 83 8081 → 38114 [PSH, ACK] Seq=1922 Ack=1939 Win=65152 Len=17 TSval=3806447636 TSecr=1682187927
1712184394.222799301   999 0.679341719    10.10.1.2 → 10.10.1.1    TCP 83 38114 → 8081 [PSH, ACK] Seq=1939 Ack=1939 Win=64256 Len=17 TSval=1682187928 TSecr=3806447636
1712184396.222799301  1001 0.679473728    10.10.1.1 → 10.10.1.2    TCP 83 8081 → 38114 [PSH, ACK] Seq=1939 Ack=1956 Win=65152 Len=17 TSval=3806447637 TSecr=1682187928
1712184403.222799301  1008 0.680689589    10.10.1.2 → 10.10.1.1    TCP 83 38114 → 8081 [PSH, ACK] Seq=1956 Ack=1956 Win=64256 Len=17 TSval=1682187929 TSecr=3806447637
1712184405.222799301  1010 0.680825594    10.10.1.1 → 10.10.1.2    TCP 83 8081 → 38114 [PSH, ACK] Seq=1956 Ack=1973 Win=65152 Len=17 TSval=3806447639 TSecr=1682187929
1712184411.222799301  1016 0.682038461    10.10.1.2 → 10.10.1.1    TCP 83 38114 → 8081 [PSH, ACK] Seq=1973 Ack=1973 Win=64256 Len=17 TSval=1682187931 TSecr=3806447639
1712184413.222799301  1018 0.682165426    10.10.1.1 → 10.10.1.2    TCP 83 8081 → 38114 [PSH, ACK] Seq=1973 Ack=1990 Win=65152 Len=17 TSval=3806447640 TSecr=1682187931
1712184420.222799301  1025 0.683379282    10.10.1.2 → 10.10.1.1    TCP 83 38114 → 8081 [PSH, ACK] Seq=1990 Ack=1990 Win=64256 Len=17 TSval=1682187932 TSecr=3806447640
1712184422.222799301  1027 0.683505058    10.10.1.1 → 10.10.1.2    TCP 83 8081 → 38114 [PSH, ACK] Seq=1990 Ack=2007 Win=65152 Len=17 TSval=3806447641 TSecr=1682187932
