1712183551.250875950    29 0.542985255    10.10.1.2 → 10.10.1.1    TCP 83 37032 → 8081 [PSH, ACK] Seq=1 Ack=1 Win=64256 Len=17 TSval=1682314829 TSecr=3806574278
1712183554.250875950    32 0.543320289    10.10.1.1 → 10.10.1.2    TCP 83 8081 → 37032 [PSH, ACK] Seq=1 Ack=18 Win=65152 Len=17 TSval=3806574539 TSecr=1682314829
1712183559.250875950    37 0.553540601    10.10.1.2 → 10.10.1.1    TCP 83 37032 → 8081 [PSH, ACK] Seq=18 Ack=18 Win=64256 Len=17 TSval=1682314840 TSecr=3806574539
1712183561.250875950    39 0.553667816    10.10.1.1 → 10.10.1.2    TCP 83 8081 → 37032 [PSH, ACK] Seq=18 Ack=35 Win=65152 Len=17 TSval=3806574549 TSecr=1682314840
1712183565.250875950    43 0.563881628    10.10.1.2 → 10.10.1.1    TCP 83 37032 → 8081 [PSH, ACK] Seq=35 Ack=35 Win=64256 Len=17 TSval=1682314850 TSecr=3806574549
1712183567.250875950    45 0.564020636    10.10.1.1 → 10.10.1.2    TCP 83 8081 → 37032 [PSH, ACK] Seq=35 Ack=52 Win=65152 Len=17 TSval=3806574559 TSecr=1682314850
1712183572.250875950    50 0.574235852    10.10.1.2 → 10.10.1.1    TCP 83 37032 → 8081 [PSH, ACK] Seq=52 Ack=52 Win=64256 Len=17 TSval=1682314861 TSecr=3806574559
1712183574.250875950    52 0.574373623    10.10.1.1 → 10.10.1.2    TCP 83 8081 → 37032 [PSH, ACK] Seq=52 Ack=69 Win=65152 Len=17 TSval=3806574570 TSecr=1682314861
1712183578.250875950    56 0.584588394    10.10.1.2 → 10.10.1.1    TCP 83 37032 → 8081 [PSH, ACK] Seq=69 Ack=69 Win=64256 Len=17 TSval=1682314871 TSecr=3806574570
1712183581.250875950    59 0.584730018    10.10.1.1 → 10.10.1.2    TCP 83 8081 → 37032 [PSH, ACK] Seq=69 Ack=86 Win=65152 Len=17 TSval=3806574580 TSecr=1682314871
1712183585.250875950    63 0.594941130    10.10.1.2 → 10.10.1.1    TCP 83 37032 → 8081 [PSH, ACK] Seq=86 Ack=86 Win=64256 Len=17 TSval=1682314881 TSecr=3806574580
1712183587.250875950    65 0.595079812    10.10.1.1 → 10.10.1.2    TCP 83 8081 → 37032 [PSH, ACK] Seq=86 Ack=103 Win=65152 Len=17 TSval=3806574591 TSecr=1682314881
1712183591.250875950    69 0.605293358    10.10.1.2 → 10.10.1.1    TCP 83 37032 → 8081 [PSH, ACK] Seq=103 Ack=103 Win=64256 Len=17 TSval=1682314892 TSecr=3806574591
1712183593.250875950    71 0.605434704    10.10.1.1 → 10.10.1.2    TCP 83 8081 → 37032 [PSH, ACK] Seq=103 Ack=120 Win=65152 Len=17 TSval=3806574601 TSecr=1682314892
1712183598.250875950    76 0.615649747    10.10.1.2 → 10.10.1.1    TCP 83 37032 → 8081 [PSH, ACK] Seq=120 Ack=120 Win=64256 Len=17 TSval=1682314902 TSecr=3806574601
1712183600.250875950    78 0.615790263    10.10.1.1 → 10.10.1.2    TCP 83 8081 → 37032 [PSH, ACK] Seq=120 Ack=137 Win=65152 Len=17 TSval=3806574611 TSecr=1682314902
1712183604.250875950    82 0.626000435    10.10.1.2 → 10.10.1.1    TCP 83 37032 → 8081 [PSH, ACK] Seq=137 Ack=137 Win=64256 Len=17 TSval=1682314912 TSecr=3806574611
1712183607.250875950    85 0.626144043    10.10.1.1 → 10.10.1.2    TCP 83 8081 → 37032 [PSH, ACK] Seq=137 Ack=154 Win=65152 Len=17 TSval=3806574622 TSecr=1682314912
1712183611.250875950    89 0.636354911    10.10.1.2 → 10.10.1.1    TCP 83 37032 → 8081 [PSH, ACK] Seq=154 Ack=154 Win=64256 Len=17 TSval=1682314923 TSecr=3806574622
1712183613.250875950    91 0.636489911    10.10.1.1 → 10.10.1.2    TCP 83 8081 → 37032 [PSH, ACK] Seq=154 Ack=171 Win=65152 Len=17 TSval=3806574632 TSecr=1682314923
1712183617.250875950    95 0.646704919    10.10.1.2 → 10.10.1.1    TCP 83 37032 → 8081 [PSH, ACK] Seq=171 Ack=171 Win=64256 Len=17 TSval=1682314933 TSecr=3806574632
1712183619.250875950    97 0.646844279    10.10.1.1 → 10.10.1.2    TCP 83 8081 → 37032 [PSH, ACK] Seq=171 Ack=188 Win=65152 Len=17 TSval=3806574642 TSecr=1682314933
1712183624.250875950   102 0.657056057    10.10.1.2 → 10.10.1.1    TCP 83 37032 → 8081 [PSH, ACK] Seq=188 Ack=188 Win=64256 Len=17 TSval=1682314943 TSecr=3806574642
1712183626.250875950   104 0.657192013    10.10.1.1 → 10.10.1.2    TCP 83 8081 → 37032 [PSH, ACK] Seq=188 Ack=205 Win=65152 Len=17 TSval=3806574653 TSecr=1682314943
1712183630.250875950   108 0.667402362    10.10.1.2 → 10.10.1.1    TCP 83 37032 → 8081 [PSH, ACK] Seq=205 Ack=205 Win=64256 Len=17 TSval=1682314954 TSecr=3806574653
1712183632.250875950   110 0.667485265    10.10.1.1 → 10.10.1.2    TCP 83 8081 → 37032 [PSH, ACK] Seq=205 Ack=222 Win=65152 Len=17 TSval=3806574663 TSecr=1682314954
1712183637.250875950   115 0.677701019    10.10.1.2 → 10.10.1.1    TCP 83 37032 → 8081 [PSH, ACK] Seq=222 Ack=222 Win=64256 Len=17 TSval=1682314964 TSecr=3806574663
1712183639.250875950   117 0.677811075    10.10.1.1 → 10.10.1.2    TCP 83 8081 → 37032 [PSH, ACK] Seq=222 Ack=239 Win=65152 Len=17 TSval=3806574673 TSecr=1682314964
1712183643.250875950   121 0.688022597    10.10.1.2 → 10.10.1.1    TCP 83 37032 → 8081 [PSH, ACK] Seq=239 Ack=239 Win=64256 Len=17 TSval=1682314974 TSecr=3806574673
1712183645.250875950   123 0.688163179    10.10.1.1 → 10.10.1.2    TCP 83 8081 → 37032 [PSH, ACK] Seq=239 Ack=256 Win=65152 Len=17 TSval=3806574684 TSecr=1682314974
1712183650.250875950   128 0.698374463    10.10.1.2 → 10.10.1.1    TCP 83 37032 → 8081 [PSH, ACK] Seq=256 Ack=256 Win=64256 Len=17 TSval=1682314985 TSecr=3806574684
1712183652.250875950   130 0.698513287    10.10.1.1 → 10.10.1.2    TCP 83 8081 → 37032 [PSH, ACK] Seq=256 Ack=273 Win=65152 Len=17 TSval=3806574694 TSecr=1682314985
1712183656.250875950   134 0.708722557    10.10.1.2 → 10.10.1.1    TCP 83 37032 → 8081 [PSH, ACK] Seq=273 Ack=273 Win=64256 Len=17 TSval=1682314995 TSecr=3806574694
1712183658.250875950   136 0.708863242    10.10.1.1 → 10.10.1.2    TCP 83 8081 → 37032 [PSH, ACK] Seq=273 Ack=290 Win=65152 Len=17 TSval=3806574704 TSecr=1682314995
1712183663.250875950   141 0.719076278    10.10.1.2 → 10.10.1.1    TCP 83 37032 → 8081 [PSH, ACK] Seq=290 Ack=290 Win=64256 Len=17 TSval=1682315005 TSecr=3806574704
1712183665.250875950   143 0.719216620    10.10.1.1 → 10.10.1.2    TCP 83 8081 → 37032 [PSH, ACK] Seq=290 Ack=307 Win=65152 Len=17 TSval=3806574715 TSecr=1682315005
1712183669.250875950   147 0.729426973    10.10.1.2 → 10.10.1.1    TCP 83 37032 → 8081 [PSH, ACK] Seq=307 Ack=307 Win=64256 Len=17 TSval=1682315016 TSecr=3806574715
1712183671.250875950   149 0.729565049    10.10.1.1 → 10.10.1.2    TCP 83 8081 → 37032 [PSH, ACK] Seq=307 Ack=324 Win=65152 Len=17 TSval=3806574725 TSecr=1682315016
1712183676.250875950   154 0.739781160    10.10.1.2 → 10.10.1.1    TCP 83 37032 → 8081 [PSH, ACK] Seq=324 Ack=324 Win=64256 Len=17 TSval=1682315026 TSecr=3806574725
1712183678.250875950   156 0.739920236    10.10.1.1 → 10.10.1.2    TCP 83 8081 → 37032 [PSH, ACK] Seq=324 Ack=341 Win=65152 Len=17 TSval=3806574735 TSecr=1682315026
1712183682.250875950   160 0.750097174    10.10.1.2 → 10.10.1.1    TCP 83 37032 → 8081 [PSH, ACK] Seq=341 Ack=341 Win=64256 Len=17 TSval=1682315036 TSecr=3806574735
1712183684.250875950   162 0.750176066    10.10.1.1 → 10.10.1.2    TCP 83 8081 → 37032 [PSH, ACK] Seq=341 Ack=358 Win=65152 Len=17 TSval=3806574746 TSecr=1682315036
1712183688.250875950   166 0.760386594    10.10.1.2 → 10.10.1.1    TCP 83 37032 → 8081 [PSH, ACK] Seq=358 Ack=358 Win=64256 Len=17 TSval=1682315047 TSecr=3806574746
1712183690.250875950   168 0.760469529    10.10.1.1 → 10.10.1.2    TCP 83 8081 → 37032 [PSH, ACK] Seq=358 Ack=375 Win=65152 Len=17 TSval=3806574756 TSecr=1682315047
1712183695.250875950   173 0.770676587    10.10.1.2 → 10.10.1.1    TCP 83 37032 → 8081 [PSH, ACK] Seq=375 Ack=375 Win=64256 Len=17 TSval=1682315057 TSecr=3806574756
1712183697.250875950   175 0.770761666    10.10.1.1 → 10.10.1.2    TCP 83 8081 → 37032 [PSH, ACK] Seq=375 Ack=392 Win=65152 Len=17 TSval=3806574766 TSecr=1682315057
1712183701.250875950   179 0.780969164    10.10.1.2 → 10.10.1.1    TCP 83 37032 → 8081 [PSH, ACK] Seq=392 Ack=392 Win=64256 Len=17 TSval=1682315067 TSecr=3806574766
1712183703.250875950   181 0.781054321    10.10.1.1 → 10.10.1.2    TCP 83 8081 → 37032 [PSH, ACK] Seq=392 Ack=409 Win=65152 Len=17 TSval=3806574777 TSecr=1682315067
1712183708.250875950   186 0.791264563    10.10.1.2 → 10.10.1.1    TCP 83 37032 → 8081 [PSH, ACK] Seq=409 Ack=409 Win=64256 Len=17 TSval=1682315078 TSecr=3806574777
1712183710.250875950   188 0.791349265    10.10.1.1 → 10.10.1.2    TCP 83 8081 → 37032 [PSH, ACK] Seq=409 Ack=426 Win=65152 Len=17 TSval=3806574787 TSecr=1682315078
1712183714.250875950   192 0.801559029    10.10.1.2 → 10.10.1.1    TCP 83 37032 → 8081 [PSH, ACK] Seq=426 Ack=426 Win=64256 Len=17 TSval=1682315088 TSecr=3806574787
1712183716.250875950   194 0.801643033    10.10.1.1 → 10.10.1.2    TCP 83 8081 → 37032 [PSH, ACK] Seq=426 Ack=443 Win=65152 Len=17 TSval=3806574797 TSecr=1682315088
1712183721.250875950   199 0.811852342    10.10.1.2 → 10.10.1.1    TCP 83 37032 → 8081 [PSH, ACK] Seq=443 Ack=443 Win=64256 Len=17 TSval=1682315098 TSecr=3806574797
1712183723.250875950   201 0.811936633    10.10.1.1 → 10.10.1.2    TCP 83 8081 → 37032 [PSH, ACK] Seq=443 Ack=460 Win=65152 Len=17 TSval=3806574807 TSecr=1682315098
1712183727.250875950   205 0.822145842    10.10.1.2 → 10.10.1.1    TCP 83 37032 → 8081 [PSH, ACK] Seq=460 Ack=460 Win=64256 Len=17 TSval=1682315108 TSecr=3806574807
1712183729.250875950   207 0.822230424    10.10.1.1 → 10.10.1.2    TCP 83 8081 → 37032 [PSH, ACK] Seq=460 Ack=477 Win=65152 Len=17 TSval=3806574818 TSecr=1682315108
1712183734.250875950   212 0.832438029    10.10.1.2 → 10.10.1.1    TCP 83 37032 → 8081 [PSH, ACK] Seq=477 Ack=477 Win=64256 Len=17 TSval=1682315119 TSecr=3806574818
1712183736.250875950   214 0.832523301    10.10.1.1 → 10.10.1.2    TCP 83 8081 → 37032 [PSH, ACK] Seq=477 Ack=494 Win=65152 Len=17 TSval=3806574828 TSecr=1682315119
1712183740.250875950   218 0.842731943    10.10.1.2 → 10.10.1.1    TCP 83 37032 → 8081 [PSH, ACK] Seq=494 Ack=494 Win=64256 Len=17 TSval=1682315129 TSecr=3806574828
1712183742.250875950   220 0.842817077    10.10.1.1 → 10.10.1.2    TCP 83 8081 → 37032 [PSH, ACK] Seq=494 Ack=511 Win=65152 Len=17 TSval=3806574838 TSecr=1682315129
1712183747.250875950   225 0.853025622    10.10.1.2 → 10.10.1.1    TCP 83 37032 → 8081 [PSH, ACK] Seq=511 Ack=511 Win=64256 Len=17 TSval=1682315139 TSecr=3806574838
1712183749.250875950   227 0.853109686    10.10.1.1 → 10.10.1.2    TCP 83 8081 → 37032 [PSH, ACK] Seq=511 Ack=528 Win=65152 Len=17 TSval=3806574849 TSecr=1682315139
1712183753.250875950   231 0.863318729    10.10.1.2 → 10.10.1.1    TCP 83 37032 → 8081 [PSH, ACK] Seq=528 Ack=528 Win=64256 Len=17 TSval=1682315150 TSecr=3806574849
1712183755.250875950   233 0.863403339    10.10.1.1 → 10.10.1.2    TCP 83 8081 → 37032 [PSH, ACK] Seq=528 Ack=545 Win=65152 Len=17 TSval=3806574859 TSecr=1682315150
1712183760.250875950   238 0.873610262    10.10.1.2 → 10.10.1.1    TCP 83 37032 → 8081 [PSH, ACK] Seq=545 Ack=545 Win=64256 Len=17 TSval=1682315160 TSecr=3806574859
1712183762.250875950   240 0.873695326    10.10.1.1 → 10.10.1.2    TCP 83 8081 → 37032 [PSH, ACK] Seq=545 Ack=562 Win=65152 Len=17 TSval=3806574869 TSecr=1682315160
1712183766.250875950   244 0.883906011    10.10.1.2 → 10.10.1.1    TCP 83 37032 → 8081 [PSH, ACK] Seq=562 Ack=562 Win=64256 Len=17 TSval=1682315170 TSecr=3806574869
1712183768.250875950   246 0.883989930    10.10.1.1 → 10.10.1.2    TCP 83 8081 → 37032 [PSH, ACK] Seq=562 Ack=579 Win=65152 Len=17 TSval=3806574879 TSecr=1682315170
1712183773.250875950   251 0.894197598    10.10.1.2 → 10.10.1.1    TCP 83 37032 → 8081 [PSH, ACK] Seq=579 Ack=579 Win=64256 Len=17 TSval=1682315181 TSecr=3806574879
1712183775.250875950   253 0.894284204    10.10.1.1 → 10.10.1.2    TCP 83 8081 → 37032 [PSH, ACK] Seq=579 Ack=596 Win=65152 Len=17 TSval=3806574890 TSecr=1682315181
1712183779.250875950   257 0.904493820    10.10.1.2 → 10.10.1.1    TCP 83 37032 → 8081 [PSH, ACK] Seq=596 Ack=596 Win=64256 Len=17 TSval=1682315191 TSecr=3806574890
1712183781.250875950   259 0.904579172    10.10.1.1 → 10.10.1.2    TCP 83 8081 → 37032 [PSH, ACK] Seq=596 Ack=613 Win=65152 Len=17 TSval=3806574900 TSecr=1682315191
1712183787.250875950   265 0.914789453    10.10.1.2 → 10.10.1.1    TCP 83 37032 → 8081 [PSH, ACK] Seq=613 Ack=613 Win=64256 Len=17 TSval=1682315201 TSecr=3806574900
1712183789.250875950   267 0.914873834    10.10.1.1 → 10.10.1.2    TCP 83 8081 → 37032 [PSH, ACK] Seq=613 Ack=630 Win=65152 Len=17 TSval=3806574910 TSecr=1682315201
1712183793.250875950   271 0.925081733    10.10.1.2 → 10.10.1.1    TCP 83 37032 → 8081 [PSH, ACK] Seq=630 Ack=630 Win=64256 Len=17 TSval=1682315211 TSecr=3806574910
1712183795.250875950   273 0.925166678    10.10.1.1 → 10.10.1.2    TCP 83 8081 → 37032 [PSH, ACK] Seq=630 Ack=647 Win=65152 Len=17 TSval=3806574921 TSecr=1682315211
1712183800.250875950   278 0.935375926    10.10.1.2 → 10.10.1.1    TCP 83 37032 → 8081 [PSH, ACK] Seq=647 Ack=647 Win=64256 Len=17 TSval=1682315222 TSecr=3806574921
1712183802.250875950   280 0.935460764    10.10.1.1 → 10.10.1.2    TCP 83 8081 → 37032 [PSH, ACK] Seq=647 Ack=664 Win=65152 Len=17 TSval=3806574931 TSecr=1682315222
1712183806.250875950   284 0.945667136    10.10.1.2 → 10.10.1.1    TCP 83 37032 → 8081 [PSH, ACK] Seq=664 Ack=664 Win=64256 Len=17 TSval=1682315232 TSecr=3806574931
1712183808.250875950   286 0.945751514    10.10.1.1 → 10.10.1.2    TCP 83 8081 → 37032 [PSH, ACK] Seq=664 Ack=681 Win=65152 Len=17 TSval=3806574941 TSecr=1682315232
1712183813.250875950   291 0.955962641    10.10.1.2 → 10.10.1.1    TCP 83 37032 → 8081 [PSH, ACK] Seq=681 Ack=681 Win=64256 Len=17 TSval=1682315242 TSecr=3806574941
1712183815.250875950   293 0.956046913    10.10.1.1 → 10.10.1.2    TCP 83 8081 → 37032 [PSH, ACK] Seq=681 Ack=698 Win=65152 Len=17 TSval=3806574952 TSecr=1682315242
1712183820.250875950   298 0.966255549    10.10.1.2 → 10.10.1.1    TCP 83 37032 → 8081 [PSH, ACK] Seq=698 Ack=698 Win=64256 Len=17 TSval=1682315253 TSecr=3806574952
1712183821.250875950   299 0.966339394    10.10.1.1 → 10.10.1.2    TCP 83 8081 → 37032 [PSH, ACK] Seq=698 Ack=715 Win=65152 Len=17 TSval=3806574962 TSecr=1682315253
1712183826.250875950   304 0.976549128    10.10.1.2 → 10.10.1.1    TCP 83 37032 → 8081 [PSH, ACK] Seq=715 Ack=715 Win=64256 Len=17 TSval=1682315263 TSecr=3806574962
1712183828.250875950   306 0.976634183    10.10.1.1 → 10.10.1.2    TCP 83 8081 → 37032 [PSH, ACK] Seq=715 Ack=732 Win=65152 Len=17 TSval=3806574972 TSecr=1682315263
1712183832.250875950   310 0.986840799    10.10.1.2 → 10.10.1.1    TCP 83 37032 → 8081 [PSH, ACK] Seq=732 Ack=732 Win=64256 Len=17 TSval=1682315273 TSecr=3806574972
1712183834.250875950   312 0.986925313    10.10.1.1 → 10.10.1.2    TCP 83 8081 → 37032 [PSH, ACK] Seq=732 Ack=749 Win=65152 Len=17 TSval=3806574982 TSecr=1682315273
1712183839.250875950   317 0.997086381    10.10.1.2 → 10.10.1.1    TCP 83 37032 → 8081 [PSH, ACK] Seq=749 Ack=749 Win=64256 Len=17 TSval=1682315283 TSecr=3806574982
1712183841.250875950   319 0.997162574    10.10.1.1 → 10.10.1.2    TCP 83 8081 → 37032 [PSH, ACK] Seq=749 Ack=766 Win=65152 Len=17 TSval=3806574993 TSecr=1682315283
1712183845.250875950   323 1.007372373    10.10.1.2 → 10.10.1.1    TCP 83 37032 → 8081 [PSH, ACK] Seq=766 Ack=766 Win=64256 Len=17 TSval=1682315294 TSecr=3806574993
1712183847.250875950   325 1.007456307    10.10.1.1 → 10.10.1.2    TCP 83 8081 → 37032 [PSH, ACK] Seq=766 Ack=783 Win=65152 Len=17 TSval=3806575003 TSecr=1682315294
1712183852.250875950   330 1.017663537    10.10.1.2 → 10.10.1.1    TCP 83 37032 → 8081 [PSH, ACK] Seq=783 Ack=783 Win=64256 Len=17 TSval=1682315304 TSecr=3806575003
1712183854.250875950   332 1.017748193    10.10.1.1 → 10.10.1.2    TCP 83 8081 → 37032 [PSH, ACK] Seq=783 Ack=800 Win=65152 Len=17 TSval=3806575013 TSecr=1682315304
1712183858.250875950   336 1.027956956    10.10.1.2 → 10.10.1.1    TCP 83 37032 → 8081 [PSH, ACK] Seq=800 Ack=800 Win=64256 Len=17 TSval=1682315314 TSecr=3806575013
1712183860.250875950   338 1.028041524    10.10.1.1 → 10.10.1.2    TCP 83 8081 → 37032 [PSH, ACK] Seq=800 Ack=817 Win=65152 Len=17 TSval=3806575024 TSecr=1682315314
1712183865.250875950   343 1.038248589    10.10.1.2 → 10.10.1.1    TCP 83 37032 → 8081 [PSH, ACK] Seq=817 Ack=817 Win=64256 Len=17 TSval=1682315325 TSecr=3806575024
1712183867.250875950   345 1.038333001    10.10.1.1 → 10.10.1.2    TCP 83 8081 → 37032 [PSH, ACK] Seq=817 Ack=834 Win=65152 Len=17 TSval=3806575034 TSecr=1682315325
1712183871.250875950   349 1.048542802    10.10.1.2 → 10.10.1.1    TCP 83 37032 → 8081 [PSH, ACK] Seq=834 Ack=834 Win=64256 Len=17 TSval=1682315335 TSecr=3806575034
1712183873.250875950   351 1.048627199    10.10.1.1 → 10.10.1.2    TCP 83 8081 → 37032 [PSH, ACK] Seq=834 Ack=851 Win=65152 Len=17 TSval=3806575044 TSecr=1682315335
1712183878.250875950   356 1.058837539    10.10.1.2 → 10.10.1.1    TCP 83 37032 → 8081 [PSH, ACK] Seq=851 Ack=851 Win=64256 Len=17 TSval=1682315345 TSecr=3806575044
1712183880.250875950   358 1.058922466    10.10.1.1 → 10.10.1.2    TCP 83 8081 → 37032 [PSH, ACK] Seq=851 Ack=868 Win=65152 Len=17 TSval=3806575054 TSecr=1682315345
1712183884.250875950   362 1.069132524    10.10.1.2 → 10.10.1.1    TCP 83 37032 → 8081 [PSH, ACK] Seq=868 Ack=868 Win=64256 Len=17 TSval=1682315355 TSecr=3806575054
1712183886.250875950   364 1.069216658    10.10.1.1 → 10.10.1.2    TCP 83 8081 → 37032 [PSH, ACK] Seq=868 Ack=885 Win=65152 Len=17 TSval=3806575065 TSecr=1682315355
1712183891.250875950   369 1.079429441    10.10.1.2 → 10.10.1.1    TCP 83 37032 → 8081 [PSH, ACK] Seq=885 Ack=885 Win=64256 Len=17 TSval=1682315366 TSecr=3806575065
1712183893.250875950   371 1.079515009    10.10.1.1 → 10.10.1.2    TCP 83 8081 → 37032 [PSH, ACK] Seq=885 Ack=902 Win=65152 Len=17 TSval=3806575075 TSecr=1682315366
1712183897.250875950   375 1.089722730    10.10.1.2 → 10.10.1.1    TCP 83 37032 → 8081 [PSH, ACK] Seq=902 Ack=902 Win=64256 Len=17 TSval=1682315376 TSecr=3806575075
1712183899.250875950   377 1.089805266    10.10.1.1 → 10.10.1.2    TCP 83 8081 → 37032 [PSH, ACK] Seq=902 Ack=919 Win=65152 Len=17 TSval=3806575085 TSecr=1682315376
1712183904.250875950   382 1.100012158    10.10.1.2 → 10.10.1.1    TCP 83 37032 → 8081 [PSH, ACK] Seq=919 Ack=919 Win=64256 Len=17 TSval=1682315386 TSecr=3806575085
1712183906.250875950   384 1.100096105    10.10.1.1 → 10.10.1.2    TCP 83 8081 → 37032 [PSH, ACK] Seq=919 Ack=936 Win=65152 Len=17 TSval=3806575096 TSecr=1682315386
1712183910.250875950   388 1.110304235    10.10.1.2 → 10.10.1.1    TCP 83 37032 → 8081 [PSH, ACK] Seq=936 Ack=936 Win=64256 Len=17 TSval=1682315397 TSecr=3806575096
1712183912.250875950   390 1.110388985    10.10.1.1 → 10.10.1.2    TCP 83 8081 → 37032 [PSH, ACK] Seq=936 Ack=953 Win=65152 Len=17 TSval=3806575106 TSecr=1682315397
1712183917.250875950   395 1.120599197    10.10.1.2 → 10.10.1.1    TCP 83 37032 → 8081 [PSH, ACK] Seq=953 Ack=953 Win=64256 Len=17 TSval=1682315407 TSecr=3806575106
1712183919.250875950   397 1.120744745    10.10.1.1 → 10.10.1.2    TCP 83 8081 → 37032 [PSH, ACK] Seq=953 Ack=970 Win=65152 Len=17 TSval=3806575116 TSecr=1682315407
1712183923.250875950   401 1.130952382    10.10.1.2 → 10.10.1.1    TCP 83 37032 → 8081 [PSH, ACK] Seq=970 Ack=970 Win=64256 Len=17 TSval=1682315417 TSecr=3806575116
1712183925.250875950   403 1.131037023    10.10.1.1 → 10.10.1.2    TCP 83 8081 → 37032 [PSH, ACK] Seq=970 Ack=987 Win=65152 Len=17 TSval=3806575127 TSecr=1682315417
1712183930.250875950   408 1.141244060    10.10.1.2 → 10.10.1.1    TCP 83 37032 → 8081 [PSH, ACK] Seq=987 Ack=987 Win=64256 Len=17 TSval=1682315428 TSecr=3806575127
1712183932.250875950   410 1.141328416    10.10.1.1 → 10.10.1.2    TCP 83 8081 → 37032 [PSH, ACK] Seq=987 Ack=1004 Win=65152 Len=17 TSval=3806575137 TSecr=1682315428
1712183936.250875950   414 1.151538940    10.10.1.2 → 10.10.1.1    TCP 83 37032 → 8081 [PSH, ACK] Seq=1004 Ack=1004 Win=64256 Len=17 TSval=1682315438 TSecr=3806575137
1712183938.250875950   416 1.151623824    10.10.1.1 → 10.10.1.2    TCP 83 8081 → 37032 [PSH, ACK] Seq=1004 Ack=1021 Win=65152 Len=17 TSval=3806575147 TSecr=1682315438
1712183943.250875950   421 1.161834157    10.10.1.2 → 10.10.1.1    TCP 83 37032 → 8081 [PSH, ACK] Seq=1021 Ack=1021 Win=64256 Len=17 TSval=1682315448 TSecr=3806575147
1712183945.250875950   423 1.161918771    10.10.1.1 → 10.10.1.2    TCP 83 8081 → 37032 [PSH, ACK] Seq=1021 Ack=1038 Win=65152 Len=17 TSval=3806575157 TSecr=1682315448
1712183949.250875950   427 1.172129245    10.10.1.2 → 10.10.1.1    TCP 83 37032 → 8081 [PSH, ACK] Seq=1038 Ack=1038 Win=64256 Len=17 TSval=1682315458 TSecr=3806575157
1712183951.250875950   429 1.172213316    10.10.1.1 → 10.10.1.2    TCP 83 8081 → 37032 [PSH, ACK] Seq=1038 Ack=1055 Win=65152 Len=17 TSval=3806575168 TSecr=1682315458
1712183956.250875950   434 1.182422742    10.10.1.2 → 10.10.1.1    TCP 83 37032 → 8081 [PSH, ACK] Seq=1055 Ack=1055 Win=64256 Len=17 TSval=1682315469 TSecr=3806575168
1712183958.250875950   436 1.182507289    10.10.1.1 → 10.10.1.2    TCP 83 8081 → 37032 [PSH, ACK] Seq=1055 Ack=1072 Win=65152 Len=17 TSval=3806575178 TSecr=1682315469
1712183962.250875950   440 1.192716412    10.10.1.2 → 10.10.1.1    TCP 83 37032 → 8081 [PSH, ACK] Seq=1072 Ack=1072 Win=64256 Len=17 TSval=1682315479 TSecr=3806575178
1712183964.250875950   442 1.192799522    10.10.1.1 → 10.10.1.2    TCP 83 8081 → 37032 [PSH, ACK] Seq=1072 Ack=1089 Win=65152 Len=17 TSval=3806575188 TSecr=1682315479
1712183969.250875950   447 1.203009455    10.10.1.2 → 10.10.1.1    TCP 83 37032 → 8081 [PSH, ACK] Seq=1089 Ack=1089 Win=64256 Len=17 TSval=1682315489 TSecr=3806575188
1712183971.250875950   449 1.203092348    10.10.1.1 → 10.10.1.2    TCP 83 8081 → 37032 [PSH, ACK] Seq=1089 Ack=1106 Win=65152 Len=17 TSval=3806575199 TSecr=1682315489
1712183975.250875950   453 1.213298538    10.10.1.2 → 10.10.1.1    TCP 83 37032 → 8081 [PSH, ACK] Seq=1106 Ack=1106 Win=64256 Len=17 TSval=1682315500 TSecr=3806575199
1712183977.250875950   455 1.213383813    10.10.1.1 → 10.10.1.2    TCP 83 8081 → 37032 [PSH, ACK] Seq=1106 Ack=1123 Win=65152 Len=17 TSval=3806575209 TSecr=1682315500
1712183982.250875950   460 1.223593341    10.10.1.2 → 10.10.1.1    TCP 83 37032 → 8081 [PSH, ACK] Seq=1123 Ack=1123 Win=64256 Len=17 TSval=1682315510 TSecr=3806575209
1712183984.250875950   462 1.223678236    10.10.1.1 → 10.10.1.2    TCP 83 8081 → 37032 [PSH, ACK] Seq=1123 Ack=1140 Win=65152 Len=17 TSval=3806575219 TSecr=1682315510
1712183988.250875950   466 1.233884747    10.10.1.2 → 10.10.1.1    TCP 83 37032 → 8081 [PSH, ACK] Seq=1140 Ack=1140 Win=64256 Len=17 TSval=1682315520 TSecr=3806575219
1712183990.250875950   468 1.233968850    10.10.1.1 → 10.10.1.2    TCP 83 8081 → 37032 [PSH, ACK] Seq=1140 Ack=1157 Win=65152 Len=17 TSval=3806575229 TSecr=1682315520
1712183995.250875950   473 1.244179257    10.10.1.2 → 10.10.1.1    TCP 83 37032 → 8081 [PSH, ACK] Seq=1157 Ack=1157 Win=64256 Len=17 TSval=1682315531 TSecr=3806575229
1712183997.250875950   475 1.244263322    10.10.1.1 → 10.10.1.2    TCP 83 8081 → 37032 [PSH, ACK] Seq=1157 Ack=1174 Win=65152 Len=17 TSval=3806575240 TSecr=1682315531
1712184001.250875950   479 1.254475139    10.10.1.2 → 10.10.1.1    TCP 83 37032 → 8081 [PSH, ACK] Seq=1174 Ack=1174 Win=64256 Len=17 TSval=1682315541 TSecr=3806575240
1712184003.250875950   481 1.254559375    10.10.1.1 → 10.10.1.2    TCP 83 8081 → 37032 [PSH, ACK] Seq=1174 Ack=1191 Win=65152 Len=17 TSval=3806575250 TSecr=1682315541
1712184008.250875950   486 1.264767956    10.10.1.2 → 10.10.1.1    TCP 83 37032 → 8081 [PSH, ACK] Seq=1191 Ack=1191 Win=64256 Len=17 TSval=1682315551 TSecr=3806575250
1712184010.250875950   488 1.264852292    10.10.1.1 → 10.10.1.2    TCP 83 8081 → 37032 [PSH, ACK] Seq=1191 Ack=1208 Win=65152 Len=17 TSval=3806575260 TSecr=1682315551
1712184014.250875950   492 1.275059966    10.10.1.2 → 10.10.1.1    TCP 83 37032 → 8081 [PSH, ACK] Seq=1208 Ack=1208 Win=64256 Len=17 TSval=1682315561 TSecr=3806575260
1712184016.250875950   494 1.275145307    10.10.1.1 → 10.10.1.2    TCP 83 8081 → 37032 [PSH, ACK] Seq=1208 Ack=1225 Win=65152 Len=17 TSval=3806575271 TSecr=1682315561
1712184021.250875950   499 1.285354002    10.10.1.2 → 10.10.1.1    TCP 83 37032 → 8081 [PSH, ACK] Seq=1225 Ack=1225 Win=64256 Len=17 TSval=1682315572 TSecr=3806575271
1712184023.250875950   501 1.285438269    10.10.1.1 → 10.10.1.2    TCP 83 8081 → 37032 [PSH, ACK] Seq=1225 Ack=1242 Win=65152 Len=17 TSval=3806575281 TSecr=1682315572
1712184027.250875950   505 1.295644392    10.10.1.2 → 10.10.1.1    TCP 83 37032 → 8081 [PSH, ACK] Seq=1242 Ack=1242 Win=64256 Len=17 TSval=1682315582 TSecr=3806575281
1712184029.250875950   507 1.295730545    10.10.1.1 → 10.10.1.2    TCP 83 8081 → 37032 [PSH, ACK] Seq=1242 Ack=1259 Win=65152 Len=17 TSval=3806575291 TSecr=1682315582
1712184034.250875950   512 1.305938316    10.10.1.2 → 10.10.1.1    TCP 83 37032 → 8081 [PSH, ACK] Seq=1259 Ack=1259 Win=64256 Len=17 TSval=1682315592 TSecr=3806575291
1712184036.250875950   514 1.306036981    10.10.1.1 → 10.10.1.2    TCP 83 8081 → 37032 [PSH, ACK] Seq=1259 Ack=1276 Win=65152 Len=17 TSval=3806575301 TSecr=1682315592
1712184040.250875950   518 1.316248537    10.10.1.2 → 10.10.1.1    TCP 83 37032 → 8081 [PSH, ACK] Seq=1276 Ack=1276 Win=64256 Len=17 TSval=1682315603 TSecr=3806575301
1712184042.250875950   520 1.316332407    10.10.1.1 → 10.10.1.2    TCP 83 8081 → 37032 [PSH, ACK] Seq=1276 Ack=1293 Win=65152 Len=17 TSval=3806575312 TSecr=1682315603
1712184047.250875950   525 1.326544425    10.10.1.2 → 10.10.1.1    TCP 83 37032 → 8081 [PSH, ACK] Seq=1293 Ack=1293 Win=64256 Len=17 TSval=1682315613 TSecr=3806575312
1712184049.250875950   527 1.326628375    10.10.1.1 → 10.10.1.2    TCP 83 8081 → 37032 [PSH, ACK] Seq=1293 Ack=1310 Win=65152 Len=17 TSval=3806575322 TSecr=1682315613
1712184053.250875950   531 1.336838116    10.10.1.2 → 10.10.1.1    TCP 83 37032 → 8081 [PSH, ACK] Seq=1310 Ack=1310 Win=64256 Len=17 TSval=1682315623 TSecr=3806575322
1712184055.250875950   533 1.336922378    10.10.1.1 → 10.10.1.2    TCP 83 8081 → 37032 [PSH, ACK] Seq=1310 Ack=1327 Win=65152 Len=17 TSval=3806575332 TSecr=1682315623
1712184060.250875950   538 1.347131684    10.10.1.2 → 10.10.1.1    TCP 83 37032 → 8081 [PSH, ACK] Seq=1327 Ack=1327 Win=64256 Len=17 TSval=1682315633 TSecr=3806575332
1712184062.250875950   540 1.347215906    10.10.1.1 → 10.10.1.2    TCP 83 8081 → 37032 [PSH, ACK] Seq=1327 Ack=1344 Win=65152 Len=17 TSval=3806575343 TSecr=1682315633
1712184066.250875950   544 1.357425004    10.10.1.2 → 10.10.1.1    TCP 83 37032 → 8081 [PSH, ACK] Seq=1344 Ack=1344 Win=64256 Len=17 TSval=1682315644 TSecr=3806575343
1712184068.250875950   546 1.357508969    10.10.1.1 → 10.10.1.2    TCP 83 8081 → 37032 [PSH, ACK] Seq=1344 Ack=1361 Win=65152 Len=17 TSval=3806575353 TSecr=1682315644
1712184073.250875950   551 1.367717461    10.10.1.2 → 10.10.1.1    TCP 83 37032 → 8081 [PSH, ACK] Seq=1361 Ack=1361 Win=64256 Len=17 TSval=1682315654 TSecr=3806575353
1712184075.250875950   553 1.367801631    10.10.1.1 → 10.10.1.2    TCP 83 8081 → 37032 [PSH, ACK] Seq=1361 Ack=1378 Win=65152 Len=17 TSval=3806575363 TSecr=1682315654
1712184079.250875950   557 1.378009483    10.10.1.2 → 10.10.1.1    TCP 83 37032 → 8081 [PSH, ACK] Seq=1378 Ack=1378 Win=64256 Len=17 TSval=1682315664 TSecr=3806575363
1712184081.250875950   559 1.378094101    10.10.1.1 → 10.10.1.2    TCP 83 8081 → 37032 [PSH, ACK] Seq=1378 Ack=1395 Win=65152 Len=17 TSval=3806575374 TSecr=1682315664
1712184086.250875950   564 1.388303549    10.10.1.2 → 10.10.1.1    TCP 83 37032 → 8081 [PSH, ACK] Seq=1395 Ack=1395 Win=64256 Len=17 TSval=1682315675 TSecr=3806575374
1712184088.250875950   566 1.388387245    10.10.1.1 → 10.10.1.2    TCP 83 8081 → 37032 [PSH, ACK] Seq=1395 Ack=1412 Win=65152 Len=17 TSval=3806575384 TSecr=1682315675
1712184092.250875950   570 1.398595836    10.10.1.2 → 10.10.1.1    TCP 83 37032 → 8081 [PSH, ACK] Seq=1412 Ack=1412 Win=64256 Len=17 TSval=1682315685 TSecr=3806575384
1712184094.250875950   572 1.398681316    10.10.1.1 → 10.10.1.2    TCP 83 8081 → 37032 [PSH, ACK] Seq=1412 Ack=1429 Win=65152 Len=17 TSval=3806575394 TSecr=1682315685
1712184099.250875950   577 1.408888219    10.10.1.2 → 10.10.1.1    TCP 83 37032 → 8081 [PSH, ACK] Seq=1429 Ack=1429 Win=64256 Len=17 TSval=1682315695 TSecr=3806575394
1712184101.250875950   579 1.408972080    10.10.1.1 → 10.10.1.2    TCP 83 8081 → 37032 [PSH, ACK] Seq=1429 Ack=1446 Win=65152 Len=17 TSval=3806575404 TSecr=1682315695
1712184105.250875950   583 1.419183819    10.10.1.2 → 10.10.1.1    TCP 83 37032 → 8081 [PSH, ACK] Seq=1446 Ack=1446 Win=64256 Len=17 TSval=1682315706 TSecr=3806575404
1712184107.250875950   585 1.419268273    10.10.1.1 → 10.10.1.2    TCP 83 8081 → 37032 [PSH, ACK] Seq=1446 Ack=1463 Win=65152 Len=17 TSval=3806575415 TSecr=1682315706
1712184112.250875950   590 1.429492654    10.10.1.2 → 10.10.1.1    TCP 83 37032 → 8081 [PSH, ACK] Seq=1463 Ack=1463 Win=64256 Len=17 TSval=1682315716 TSecr=3806575415
1712184114.250875950   592 1.429576912    10.10.1.1 → 10.10.1.2    TCP 83 8081 → 37032 [PSH, ACK] Seq=1463 Ack=1480 Win=65152 Len=17 TSval=3806575425 TSecr=1682315716
1712184118.250875950   596 1.439785977    10.10.1.2 → 10.10.1.1    TCP 83 37032 → 8081 [PSH, ACK] Seq=1480 Ack=1480 Win=64256 Len=17 TSval=1682315726 TSecr=3806575425
1712184120.250875950   598 1.439871498    10.10.1.1 → 10.10.1.2    TCP 83 8081 → 37032 [PSH, ACK] Seq=1480 Ack=1497 Win=65152 Len=17 TSval=3806575435 TSecr=1682315726
1712184125.250875950   603 1.450081300    10.10.1.2 → 10.10.1.1    TCP 83 37032 → 8081 [PSH, ACK] Seq=1497 Ack=1497 Win=64256 Len=17 TSval=1682315736 TSecr=3806575435
1712184127.250875950   605 1.450165501    10.10.1.1 → 10.10.1.2    TCP 83 8081 → 37032 [PSH, ACK] Seq=1497 Ack=1514 Win=65152 Len=17 TSval=3806575446 TSecr=1682315736
1712184131.250875950   609 1.460374774    10.10.1.2 → 10.10.1.1    TCP 83 37032 → 8081 [PSH, ACK] Seq=1514 Ack=1514 Win=64256 Len=17 TSval=1682315747 TSecr=3806575446
1712184133.250875950   611 1.460458975    10.10.1.1 → 10.10.1.2    TCP 83 8081 → 37032 [PSH, ACK] Seq=1514 Ack=1531 Win=65152 Len=17 TSval=3806575456 TSecr=1682315747
1712184138.250875950   616 1.470666657    10.10.1.2 → 10.10.1.1    TCP 83 37032 → 8081 [PSH, ACK] Seq=1531 Ack=1531 Win=64256 Len=17 TSval=1682315757 TSecr=3806575456
1712184140.250875950   618 1.470750973    10.10.1.1 → 10.10.1.2    TCP 83 8081 → 37032 [PSH, ACK] Seq=1531 Ack=1548 Win=65152 Len=17 TSval=3806575466 TSecr=1682315757
1712184144.250875950   622 1.480960831    10.10.1.2 → 10.10.1.1    TCP 83 37032 → 8081 [PSH, ACK] Seq=1548 Ack=1548 Win=64256 Len=17 TSval=1682315767 TSecr=3806575466
1712184146.250875950   624 1.481045521    10.10.1.1 → 10.10.1.2    TCP 83 8081 → 37032 [PSH, ACK] Seq=1548 Ack=1565 Win=65152 Len=17 TSval=3806575477 TSecr=1682315767
1712184151.250875950   629 1.491255522    10.10.1.2 → 10.10.1.1    TCP 83 37032 → 8081 [PSH, ACK] Seq=1565 Ack=1565 Win=64256 Len=17 TSval=1682315778 TSecr=3806575477
1712184153.250875950   631 1.491339951    10.10.1.1 → 10.10.1.2    TCP 83 8081 → 37032 [PSH, ACK] Seq=1565 Ack=1582 Win=65152 Len=17 TSval=3806575487 TSecr=1682315778
1712184157.250875950   635 1.501548266    10.10.1.2 → 10.10.1.1    TCP 83 37032 → 8081 [PSH, ACK] Seq=1582 Ack=1582 Win=64256 Len=17 TSval=1682315788 TSecr=3806575487
1712184159.250875950   637 1.501632538    10.10.1.1 → 10.10.1.2    TCP 83 8081 → 37032 [PSH, ACK] Seq=1582 Ack=1599 Win=65152 Len=17 TSval=3806575497 TSecr=1682315788
1712184164.250875950   642 1.511841559    10.10.1.2 → 10.10.1.1    TCP 83 37032 → 8081 [PSH, ACK] Seq=1599 Ack=1599 Win=64256 Len=17 TSval=1682315798 TSecr=3806575497
1712184166.250875950   644 1.511927579    10.10.1.1 → 10.10.1.2    TCP 83 8081 → 37032 [PSH, ACK] Seq=1599 Ack=1616 Win=65152 Len=17 TSval=3806575507 TSecr=1682315798
1712184170.250875950   648 1.522138292    10.10.1.2 → 10.10.1.1    TCP 83 37032 → 8081 [PSH, ACK] Seq=1616 Ack=1616 Win=64256 Len=17 TSval=1682315808 TSecr=3806575507
1712184172.250875950   650 1.522222360    10.10.1.1 → 10.10.1.2    TCP 83 8081 → 37032 [PSH, ACK] Seq=1616 Ack=1633 Win=65152 Len=17 TSval=3806575518 TSecr=1682315808
1712184177.250875950   655 1.532430209    10.10.1.2 → 10.10.1.1    TCP 83 37032 → 8081 [PSH, ACK] Seq=1633 Ack=1633 Win=64256 Len=17 TSval=1682315819 TSecr=3806575518
1712184179.250875950   657 1.532515400    10.10.1.1 → 10.10.1.2    TCP 83 8081 → 37032 [PSH, ACK] Seq=1633 Ack=1650 Win=65152 Len=17 TSval=3806575528 TSecr=1682315819
1712184184.250875950   662 1.542723335    10.10.1.2 → 10.10.1.1    TCP 83 37032 → 8081 [PSH, ACK] Seq=1650 Ack=1650 Win=64256 Len=17 TSval=1682315829 TSecr=3806575528
1712184185.250875950   663 1.542807714    10.10.1.1 → 10.10.1.2    TCP 83 8081 → 37032 [PSH, ACK] Seq=1650 Ack=1667 Win=65152 Len=17 TSval=3806575538 TSecr=1682315829
1712184190.250875950   668 1.553014465    10.10.1.2 → 10.10.1.1    TCP 83 37032 → 8081 [PSH, ACK] Seq=1667 Ack=1667 Win=64256 Len=17 TSval=1682315839 TSecr=3806575538
1712184192.250875950   670 1.553099709    10.10.1.1 → 10.10.1.2    TCP 83 8081 → 37032 [PSH, ACK] Seq=1667 Ack=1684 Win=65152 Len=17 TSval=3806575549 TSecr=1682315839
1712184196.250875950   674 1.563306264    10.10.1.2 → 10.10.1.1    TCP 83 37032 → 8081 [PSH, ACK] Seq=1684 Ack=1684 Win=64256 Len=17 TSval=1682315850 TSecr=3806575549
1712184198.250875950   676 1.563390701    10.10.1.1 → 10.10.1.2    TCP 83 8081 → 37032 [PSH, ACK] Seq=1684 Ack=1701 Win=65152 Len=17 TSval=3806575559 TSecr=1682315850
1712184203.250875950   681 1.573600281    10.10.1.2 → 10.10.1.1    TCP 83 37032 → 8081 [PSH, ACK] Seq=1701 Ack=1701 Win=64256 Len=17 TSval=1682315860 TSecr=3806575559
1712184205.250875950   683 1.573684617    10.10.1.1 → 10.10.1.2    TCP 83 8081 → 37032 [PSH, ACK] Seq=1701 Ack=1718 Win=65152 Len=17 TSval=3806575569 TSecr=1682315860
1712184209.250875950   687 1.583894860    10.10.1.2 → 10.10.1.1    TCP 83 37032 → 8081 [PSH, ACK] Seq=1718 Ack=1718 Win=64256 Len=17 TSval=1682315870 TSecr=3806575569
1712184211.250875950   689 1.583978727    10.10.1.1 → 10.10.1.2    TCP 83 8081 → 37032 [PSH, ACK] Seq=1718 Ack=1735 Win=65152 Len=17 TSval=3806575579 TSecr=1682315870
1712184216.250875950   694 1.594188913    10.10.1.2 → 10.10.1.1    TCP 83 37032 → 8081 [PSH, ACK] Seq=1735 Ack=1735 Win=64256 Len=17 TSval=1682315881 TSecr=3806575579
1712184218.250875950   696 1.594272962    10.10.1.1 → 10.10.1.2    TCP 83 8081 → 37032 [PSH, ACK] Seq=1735 Ack=1752 Win=65152 Len=17 TSval=3806575590 TSecr=1682315881
1712184222.250875950   700 1.604483385    10.10.1.2 → 10.10.1.1    TCP 83 37032 → 8081 [PSH, ACK] Seq=1752 Ack=1752 Win=64256 Len=17 TSval=1682315891 TSecr=3806575590
1712184224.250875950   702 1.604567683    10.10.1.1 → 10.10.1.2    TCP 83 8081 → 37032 [PSH, ACK] Seq=1752 Ack=1769 Win=65152 Len=17 TSval=3806575600 TSecr=1682315891
1712184229.250875950   707 1.614775702    10.10.1.2 → 10.10.1.1    TCP 83 37032 → 8081 [PSH, ACK] Seq=1769 Ack=1769 Win=64256 Len=17 TSval=1682315901 TSecr=3806575600
1712184231.250875950   709 1.614859884    10.10.1.1 → 10.10.1.2    TCP 83 8081 → 37032 [PSH, ACK] Seq=1769 Ack=1786 Win=65152 Len=17 TSval=3806575610 TSecr=1682315901
1712184235.250875950   713 1.625070612    10.10.1.2 → 10.10.1.1    TCP 83 37032 → 8081 [PSH, ACK] Seq=1786 Ack=1786 Win=64256 Len=17 TSval=1682315911 TSecr=3806575610
1712184237.250875950   715 1.625153529    10.10.1.1 → 10.10.1.2    TCP 83 8081 → 37032 [PSH, ACK] Seq=1786 Ack=1803 Win=65152 Len=17 TSval=3806575621 TSecr=1682315911
1712184242.250875950   720 1.635363301    10.10.1.2 → 10.10.1.1    TCP 83 37032 → 8081 [PSH, ACK] Seq=1803 Ack=1803 Win=64256 Len=17 TSval=1682315922 TSecr=3806575621
1712184244.250875950   722 1.635446330    10.10.1.1 → 10.10.1.2    TCP 83 8081 → 37032 [PSH, ACK] Seq=1803 Ack=1820 Win=65152 Len=17 TSval=3806575631 TSecr=1682315922
1712184248.250875950   726 1.645654102    10.10.1.2 → 10.10.1.1    TCP 83 37032 → 8081 [PSH, ACK] Seq=1820 Ack=1820 Win=64256 Len=17 TSval=1682315932 TSecr=3806575631
1712184250.250875950   728 1.645737263    10.10.1.1 → 10.10.1.2    TCP 83 8081 → 37032 [PSH, ACK] Seq=1820 Ack=1837 Win=65152 Len=17 TSval=3806575641 TSecr=1682315932
1712184255.250875950   733 1.655946635    10.10.1.2 → 10.10.1.1    TCP 83 37032 → 8081 [PSH, ACK] Seq=1837 Ack=1837 Win=64256 Len=17 TSval=1682315942 TSecr=3806575641
1712184257.250875950   735 1.656029040    10.10.1.1 → 10.10.1.2    TCP 83 8081 → 37032 [PSH, ACK] Seq=1837 Ack=1854 Win=65152 Len=17 TSval=3806575652 TSecr=1682315942
1712184261.250875950   739 1.666242561    10.10.1.2 → 10.10.1.1    TCP 83 37032 → 8081 [PSH, ACK] Seq=1854 Ack=1854 Win=64256 Len=17 TSval=1682315953 TSecr=3806575652
1712184263.250875950   741 1.666327853    10.10.1.1 → 10.10.1.2    TCP 83 8081 → 37032 [PSH, ACK] Seq=1854 Ack=1871 Win=65152 Len=17 TSval=3806575662 TSecr=1682315953
1712184268.250875950   746 1.676538061    10.10.1.2 → 10.10.1.1    TCP 83 37032 → 8081 [PSH, ACK] Seq=1871 Ack=1871 Win=64256 Len=17 TSval=1682315963 TSecr=3806575662
1712184270.250875950   748 1.676622668    10.10.1.1 → 10.10.1.2    TCP 83 8081 → 37032 [PSH, ACK] Seq=1871 Ack=1888 Win=65152 Len=17 TSval=3806575672 TSecr=1682315963
1712184274.250875950   752 1.686832162    10.10.1.2 → 10.10.1.1    TCP 83 37032 → 8081 [PSH, ACK] Seq=1888 Ack=1888 Win=64256 Len=17 TSval=1682315973 TSecr=3806575672
1712184276.250875950   754 1.686916756    10.10.1.1 → 10.10.1.2    TCP 83 8081 → 37032 [PSH, ACK] Seq=1888 Ack=1905 Win=65152 Len=17 TSval=3806575682 TSecr=1682315973
1712184281.250875950   759 1.697124270    10.10.1.2 → 10.10.1.1    TCP 83 37032 → 8081 [PSH, ACK] Seq=1905 Ack=1905 Win=64256 Len=17 TSval=1682315983 TSecr=3806575682
1712184283.250875950   761 1.697210589    10.10.1.1 → 10.10.1.2    TCP 83 8081 → 37032 [PSH, ACK] Seq=1905 Ack=1922 Win=65152 Len=17 TSval=3806575693 TSecr=1682315983
1712184287.250875950   765 1.707419412    10.10.1.2 → 10.10.1.1    TCP 83 37032 → 8081 [PSH, ACK] Seq=1922 Ack=1922 Win=64256 Len=17 TSval=1682315994 TSecr=3806575693
1712184289.250875950   767 1.707555729    10.10.1.1 → 10.10.1.2    TCP 83 8081 → 37032 [PSH, ACK] Seq=1922 Ack=1939 Win=65152 Len=17 TSval=3806575703 TSecr=1682315994
1712184294.250875950   772 1.717765895    10.10.1.2 → 10.10.1.1    TCP 83 37032 → 8081 [PSH, ACK] Seq=1939 Ack=1939 Win=64256 Len=17 TSval=1682316004 TSecr=3806575703
1712184296.250875950   774 1.717850521    10.10.1.1 → 10.10.1.2    TCP 83 8081 → 37032 [PSH, ACK] Seq=1939 Ack=1956 Win=65152 Len=17 TSval=3806575713 TSecr=1682316004
1712184300.250875950   778 1.728058824    10.10.1.2 → 10.10.1.1    TCP 83 37032 → 8081 [PSH, ACK] Seq=1956 Ack=1956 Win=64256 Len=17 TSval=1682316014 TSecr=3806575713
1712184302.250875950   780 1.728143893    10.10.1.1 → 10.10.1.2    TCP 83 8081 → 37032 [PSH, ACK] Seq=1956 Ack=1973 Win=65152 Len=17 TSval=3806575724 TSecr=1682316014
1712184307.250875950   785 1.738353047    10.10.1.2 → 10.10.1.1    TCP 83 37032 → 8081 [PSH, ACK] Seq=1973 Ack=1973 Win=64256 Len=17 TSval=1682316025 TSecr=3806575724
1712184309.250875950   787 1.738436002    10.10.1.1 → 10.10.1.2    TCP 83 8081 → 37032 [PSH, ACK] Seq=1973 Ack=1990 Win=65152 Len=17 TSval=3806575734 TSecr=1682316025
1712184314.250875950   792 1.748643124    10.10.1.2 → 10.10.1.1    TCP 83 37032 → 8081 [PSH, ACK] Seq=1990 Ack=1990 Win=64256 Len=17 TSval=1682316035 TSecr=3806575734
1712184315.250875950   793 1.748726245    10.10.1.1 → 10.10.1.2    TCP 83 8081 → 37032 [PSH, ACK] Seq=1990 Ack=2007 Win=65152 Len=17 TSval=3806575744 TSecr=1682316035
1712184320.250875950   798 1.758935442    10.10.1.2 → 10.10.1.1    TCP 83 37032 → 8081 [PSH, ACK] Seq=2007 Ack=2007 Win=64256 Len=17 TSval=1682316045 TSecr=3806575744
1712184322.250875950   800 1.759017954    10.10.1.1 → 10.10.1.2    TCP 83 8081 → 37032 [PSH, ACK] Seq=2007 Ack=2024 Win=65152 Len=17 TSval=3806575754 TSecr=1682316045
1712184326.250875950   804 1.769181504    10.10.1.2 → 10.10.1.1    TCP 83 37032 → 8081 [PSH, ACK] Seq=2024 Ack=2024 Win=64256 Len=17 TSval=1682316056 TSecr=3806575754
1712184328.250875950   806 1.769252402    10.10.1.1 → 10.10.1.2    TCP 83 8081 → 37032 [PSH, ACK] Seq=2024 Ack=2041 Win=65152 Len=17 TSval=3806575765 TSecr=1682316056
1712184332.250875950   810 1.779462459    10.10.1.2 → 10.10.1.1    TCP 83 37032 → 8081 [PSH, ACK] Seq=2041 Ack=2041 Win=64256 Len=17 TSval=1682316066 TSecr=3806575765
