1711546722.703629971    40 0.649863608    10.10.1.2 → 10.10.1.1    TCP 83 37438 → 8081 [PSH, ACK] Seq=1 Ack=1 Win=64256 Len=17 TSval=1045475482 TSecr=3169734838
1711546726.703629971    44 0.650150107    10.10.1.1 → 10.10.1.2    TCP 83 8081 → 37438 [PSH, ACK] Seq=1 Ack=18 Win=65152 Len=17 TSval=3169735191 TSecr=1045475482
1711546735.703629971    53 0.687806397    10.10.1.2 → 10.10.1.1    TCP 83 37438 → 8081 [PSH, ACK] Seq=18 Ack=18 Win=64256 Len=17 TSval=1045475520 TSecr=3169735191
1711546738.703629971    56 0.687902811    10.10.1.1 → 10.10.1.2    TCP 83 8081 → 37438 [PSH, ACK] Seq=18 Ack=35 Win=65152 Len=17 TSval=3169735229 TSecr=1045475520
1711546747.703629971    65 0.689353146    10.10.1.2 → 10.10.1.1    TCP 83 37438 → 8081 [PSH, ACK] Seq=35 Ack=35 Win=64256 Len=17 TSval=1045475522 TSecr=3169735229
1711546750.703629971    68 0.689451151    10.10.1.1 → 10.10.1.2    TCP 83 8081 → 37438 [PSH, ACK] Seq=35 Ack=52 Win=65152 Len=17 TSval=3169735230 TSecr=1045475522
1711546759.703629971    77 0.735390367    10.10.1.2 → 10.10.1.1    TCP 83 37438 → 8081 [PSH, ACK] Seq=52 Ack=52 Win=64256 Len=17 TSval=1045475568 TSecr=3169735230
1711546762.703629971    80 0.735532962    10.10.1.1 → 10.10.1.2    TCP 83 8081 → 37438 [PSH, ACK] Seq=52 Ack=69 Win=65152 Len=17 TSval=3169735276 TSecr=1045475568
1711546771.703629971    89 0.779459260    10.10.1.2 → 10.10.1.1    TCP 83 37438 → 8081 [PSH, ACK] Seq=69 Ack=69 Win=64256 Len=17 TSval=1045475612 TSecr=3169735276
1711546774.703629971    92 0.779583702    10.10.1.1 → 10.10.1.2    TCP 83 8081 → 37438 [PSH, ACK] Seq=69 Ack=86 Win=65152 Len=17 TSval=3169735321 TSecr=1045475612
1711546783.703629971   101 0.804509902    10.10.1.2 → 10.10.1.1    TCP 83 37438 → 8081 [PSH, ACK] Seq=86 Ack=86 Win=64256 Len=17 TSval=1045475637 TSecr=3169735321
1711546785.703629971   103 0.804635902    10.10.1.1 → 10.10.1.2    TCP 83 8081 → 37438 [PSH, ACK] Seq=86 Ack=103 Win=65152 Len=17 TSval=3169735346 TSecr=1045475637
1711546795.703629971   113 0.873130684    10.10.1.2 → 10.10.1.1    TCP 83 37438 → 8081 [PSH, ACK] Seq=103 Ack=103 Win=64256 Len=17 TSval=1045475705 TSecr=3169735346
1711546797.703629971   115 0.873257100    10.10.1.1 → 10.10.1.2    TCP 83 8081 → 37438 [PSH, ACK] Seq=103 Ack=120 Win=65152 Len=17 TSval=3169735414 TSecr=1045475705
1711546807.703629971   125 0.888350128    10.10.1.2 → 10.10.1.1    TCP 83 37438 → 8081 [PSH, ACK] Seq=120 Ack=120 Win=64256 Len=17 TSval=1045475721 TSecr=3169735414
1711546809.703629971   127 0.888475299    10.10.1.1 → 10.10.1.2    TCP 83 8081 → 37438 [PSH, ACK] Seq=120 Ack=137 Win=65152 Len=17 TSval=3169735429 TSecr=1045475721
1711546819.703629971   137 1.102085222    10.10.1.2 → 10.10.1.1    TCP 83 37438 → 8081 [PSH, ACK] Seq=137 Ack=137 Win=64256 Len=17 TSval=1045475934 TSecr=3169735429
1711546821.703629971   139 1.102179978    10.10.1.1 → 10.10.1.2    TCP 83 8081 → 37438 [PSH, ACK] Seq=137 Ack=154 Win=65152 Len=17 TSval=3169735643 TSecr=1045475934
1711546831.703629971   149 1.257267538    10.10.1.2 → 10.10.1.1    TCP 83 37438 → 8081 [PSH, ACK] Seq=154 Ack=154 Win=64256 Len=17 TSval=1045476090 TSecr=3169735643
1711546833.703629971   151 1.257366145    10.10.1.1 → 10.10.1.2    TCP 83 8081 → 37438 [PSH, ACK] Seq=154 Ack=171 Win=65152 Len=17 TSval=3169735798 TSecr=1045476090
1711546843.703629971   161 1.291991205    10.10.1.2 → 10.10.1.1    TCP 83 37438 → 8081 [PSH, ACK] Seq=171 Ack=171 Win=64256 Len=17 TSval=1045476124 TSecr=3169735798
1711546845.703629971   163 1.292088468    10.10.1.1 → 10.10.1.2    TCP 83 8081 → 37438 [PSH, ACK] Seq=171 Ack=188 Win=65152 Len=17 TSval=3169735833 TSecr=1045476124
1711546853.703629971   171 1.319639631    10.10.1.2 → 10.10.1.1    TCP 83 37438 → 8081 [PSH, ACK] Seq=188 Ack=188 Win=64256 Len=17 TSval=1045476152 TSecr=3169735833
1711546855.703629971   173 1.319743078    10.10.1.1 → 10.10.1.2    TCP 83 8081 → 37438 [PSH, ACK] Seq=188 Ack=205 Win=65152 Len=17 TSval=3169735861 TSecr=1045476152
1711546863.703629971   181 1.359513811    10.10.1.2 → 10.10.1.1    TCP 83 37438 → 8081 [PSH, ACK] Seq=205 Ack=205 Win=64256 Len=17 TSval=1045476192 TSecr=3169735861
1711546865.703629971   183 1.359617606    10.10.1.1 → 10.10.1.2    TCP 83 8081 → 37438 [PSH, ACK] Seq=205 Ack=222 Win=65152 Len=17 TSval=3169735901 TSecr=1045476192
1711546875.703629971   193 1.451659920    10.10.1.2 → 10.10.1.1    TCP 83 37438 → 8081 [PSH, ACK] Seq=222 Ack=222 Win=64256 Len=17 TSval=1045476284 TSecr=3169735901
1711546877.703629971   195 1.451766037    10.10.1.1 → 10.10.1.2    TCP 83 8081 → 37438 [PSH, ACK] Seq=222 Ack=239 Win=65152 Len=17 TSval=3169735993 TSecr=1045476284
1711546888.703629971   206 1.652889221    10.10.1.2 → 10.10.1.1    TCP 83 37438 → 8081 [PSH, ACK] Seq=239 Ack=239 Win=64256 Len=17 TSval=1045476485 TSecr=3169735993
1711546890.703629971   208 1.652986370    10.10.1.1 → 10.10.1.2    TCP 83 8081 → 37438 [PSH, ACK] Seq=239 Ack=256 Win=65152 Len=17 TSval=3169736194 TSecr=1045476485
1711546900.703629971   218 1.666536124    10.10.1.2 → 10.10.1.1    TCP 83 37438 → 8081 [PSH, ACK] Seq=256 Ack=256 Win=64256 Len=17 TSval=1045476499 TSecr=3169736194
1711546902.703629971   220 1.666631697    10.10.1.1 → 10.10.1.2    TCP 83 8081 → 37438 [PSH, ACK] Seq=256 Ack=273 Win=65152 Len=17 TSval=3169736208 TSecr=1045476499
1711546912.703629971   230 1.765666513    10.10.1.2 → 10.10.1.1    TCP 83 37438 → 8081 [PSH, ACK] Seq=273 Ack=273 Win=64256 Len=17 TSval=1045476598 TSecr=3169736208
1711546914.703629971   232 1.765764243    10.10.1.1 → 10.10.1.2    TCP 83 8081 → 37438 [PSH, ACK] Seq=273 Ack=290 Win=65152 Len=17 TSval=3169736307 TSecr=1045476598
1711546924.703629971   242 1.794336131    10.10.1.2 → 10.10.1.1    TCP 83 37438 → 8081 [PSH, ACK] Seq=290 Ack=290 Win=64256 Len=17 TSval=1045476627 TSecr=3169736307
1711546926.703629971   244 1.794435343    10.10.1.1 → 10.10.1.2    TCP 83 8081 → 37438 [PSH, ACK] Seq=290 Ack=307 Win=65152 Len=17 TSval=3169736335 TSecr=1045476627
1711546935.703629971   253 1.795007337    10.10.1.2 → 10.10.1.1    TCP 83 37438 → 8081 [PSH, ACK] Seq=307 Ack=307 Win=64256 Len=17 TSval=1045476627 TSecr=3169736335
1711546937.703629971   255 1.795057122    10.10.1.1 → 10.10.1.2    TCP 83 8081 → 37438 [PSH, ACK] Seq=307 Ack=324 Win=65152 Len=17 TSval=3169736336 TSecr=1045476627
1711546946.703629971   264 2.049860417    10.10.1.2 → 10.10.1.1    TCP 83 37438 → 8081 [PSH, ACK] Seq=324 Ack=324 Win=64256 Len=17 TSval=1045476882 TSecr=3169736336
1711546949.703629971   267 2.049959299    10.10.1.1 → 10.10.1.2    TCP 83 8081 → 37438 [PSH, ACK] Seq=324 Ack=341 Win=65152 Len=17 TSval=3169736591 TSecr=1045476882
1711546958.703629971   276 2.447325551    10.10.1.2 → 10.10.1.1    TCP 83 37438 → 8081 [PSH, ACK] Seq=341 Ack=341 Win=64256 Len=17 TSval=1045477280 TSecr=3169736591
1711546961.703629971   279 2.447420210    10.10.1.1 → 10.10.1.2    TCP 83 8081 → 37438 [PSH, ACK] Seq=341 Ack=358 Win=65152 Len=17 TSval=3169736988 TSecr=1045477280
1711546970.703629971   288 2.696002124    10.10.1.2 → 10.10.1.1    TCP 83 37438 → 8081 [PSH, ACK] Seq=358 Ack=358 Win=64256 Len=17 TSval=1045477528 TSecr=3169736988
1711546973.703629971   291 2.696097965    10.10.1.1 → 10.10.1.2    TCP 83 8081 → 37438 [PSH, ACK] Seq=358 Ack=375 Win=65152 Len=17 TSval=3169737237 TSecr=1045477528
1711546982.703629971   300 2.700735339    10.10.1.2 → 10.10.1.1    TCP 83 37438 → 8081 [PSH, ACK] Seq=375 Ack=375 Win=64256 Len=17 TSval=1045477533 TSecr=3169737237
1711546985.703629971   303 2.700831124    10.10.1.1 → 10.10.1.2    TCP 83 8081 → 37438 [PSH, ACK] Seq=375 Ack=392 Win=65152 Len=17 TSval=3169737242 TSecr=1045477533
1711546994.703629971   312 2.816996711    10.10.1.2 → 10.10.1.1    TCP 83 37438 → 8081 [PSH, ACK] Seq=392 Ack=392 Win=64256 Len=17 TSval=1045477649 TSecr=3169737242
1711546997.703629971   315 2.817094820    10.10.1.1 → 10.10.1.2    TCP 83 8081 → 37438 [PSH, ACK] Seq=392 Ack=409 Win=65152 Len=17 TSval=3169737358 TSecr=1045477649
1711547006.703629971   324 2.884663302    10.10.1.2 → 10.10.1.1    TCP 83 37438 → 8081 [PSH, ACK] Seq=409 Ack=409 Win=64256 Len=17 TSval=1045477717 TSecr=3169737358
1711547009.703629971   327 2.884758279    10.10.1.1 → 10.10.1.2    TCP 83 8081 → 37438 [PSH, ACK] Seq=409 Ack=426 Win=65152 Len=17 TSval=3169737426 TSecr=1045477717
1711547018.703629971   336 2.887918962    10.10.1.2 → 10.10.1.1    TCP 83 37438 → 8081 [PSH, ACK] Seq=426 Ack=426 Win=64256 Len=17 TSval=1045477720 TSecr=3169737426
1711547021.703629971   339 2.888010843    10.10.1.1 → 10.10.1.2    TCP 83 8081 → 37438 [PSH, ACK] Seq=426 Ack=443 Win=65152 Len=17 TSval=3169737429 TSecr=1045477720
1711547030.703629971   348 2.952983584    10.10.1.2 → 10.10.1.1    TCP 83 37438 → 8081 [PSH, ACK] Seq=443 Ack=443 Win=64256 Len=17 TSval=1045477785 TSecr=3169737429
1711547033.703629971   351 2.953080363    10.10.1.1 → 10.10.1.2    TCP 83 8081 → 37438 [PSH, ACK] Seq=443 Ack=460 Win=65152 Len=17 TSval=3169737494 TSecr=1045477785
1711547042.703629971   360 3.368634985    10.10.1.2 → 10.10.1.1    TCP 83 37438 → 8081 [PSH, ACK] Seq=460 Ack=460 Win=64256 Len=17 TSval=1045478201 TSecr=3169737494
1711547045.703629971   363 3.368756938    10.10.1.1 → 10.10.1.2    TCP 83 8081 → 37438 [PSH, ACK] Seq=460 Ack=477 Win=65152 Len=17 TSval=3169737910 TSecr=1045478201
1711547054.703629971   372 3.373237559    10.10.1.2 → 10.10.1.1    TCP 83 37438 → 8081 [PSH, ACK] Seq=477 Ack=477 Win=64256 Len=17 TSval=1045478206 TSecr=3169737910
1711547057.703629971   375 3.373361889    10.10.1.1 → 10.10.1.2    TCP 83 8081 → 37438 [PSH, ACK] Seq=477 Ack=494 Win=65152 Len=17 TSval=3169737914 TSecr=1045478206
1711547064.703629971   382 3.409940478    10.10.1.2 → 10.10.1.1    TCP 83 37438 → 8081 [PSH, ACK] Seq=494 Ack=494 Win=64256 Len=17 TSval=1045478242 TSecr=3169737914
1711547067.703629971   385 3.410071463    10.10.1.1 → 10.10.1.2    TCP 83 8081 → 37438 [PSH, ACK] Seq=494 Ack=511 Win=65152 Len=17 TSval=3169737951 TSecr=1045478242
1711547076.703629971   394 3.471152042    10.10.1.2 → 10.10.1.1    TCP 83 37438 → 8081 [PSH, ACK] Seq=511 Ack=511 Win=64256 Len=17 TSval=1045478303 TSecr=3169737951
1711547079.703629971   397 3.471278109    10.10.1.1 → 10.10.1.2    TCP 83 8081 → 37438 [PSH, ACK] Seq=511 Ack=528 Win=65152 Len=17 TSval=3169738012 TSecr=1045478303
1711547089.703629971   407 3.588157742    10.10.1.2 → 10.10.1.1    TCP 83 37438 → 8081 [PSH, ACK] Seq=528 Ack=528 Win=64256 Len=17 TSval=1045478420 TSecr=3169738012
1711547092.703629971   410 3.588284931    10.10.1.1 → 10.10.1.2    TCP 83 8081 → 37438 [PSH, ACK] Seq=528 Ack=545 Win=65152 Len=17 TSval=3169738129 TSecr=1045478420
1711547101.703629971   419 3.684503825    10.10.1.2 → 10.10.1.1    TCP 83 37438 → 8081 [PSH, ACK] Seq=545 Ack=545 Win=64256 Len=17 TSval=1045478517 TSecr=3169738129
1711547104.703629971   422 3.684630512    10.10.1.1 → 10.10.1.2    TCP 83 8081 → 37438 [PSH, ACK] Seq=545 Ack=562 Win=65152 Len=17 TSval=3169738226 TSecr=1045478517
1711547113.703629971   431 3.747992748    10.10.1.2 → 10.10.1.1    TCP 83 37438 → 8081 [PSH, ACK] Seq=562 Ack=562 Win=64256 Len=17 TSval=1045478580 TSecr=3169738226
1711547115.703629971   433 3.748118562    10.10.1.1 → 10.10.1.2    TCP 83 8081 → 37438 [PSH, ACK] Seq=562 Ack=579 Win=65152 Len=17 TSval=3169738289 TSecr=1045478580
1711547125.703629971   443 3.754085970    10.10.1.2 → 10.10.1.1    TCP 83 37438 → 8081 [PSH, ACK] Seq=579 Ack=579 Win=64256 Len=17 TSval=1045478586 TSecr=3169738289
1711547127.703629971   445 3.754182482    10.10.1.1 → 10.10.1.2    TCP 83 8081 → 37438 [PSH, ACK] Seq=579 Ack=596 Win=65152 Len=17 TSval=3169738295 TSecr=1045478586
1711547137.703629971   455 4.109124959    10.10.1.2 → 10.10.1.1    TCP 83 37438 → 8081 [PSH, ACK] Seq=596 Ack=596 Win=64256 Len=17 TSval=1045478941 TSecr=3169738295
1711547140.703629971   458 4.109220493    10.10.1.1 → 10.10.1.2    TCP 83 8081 → 37438 [PSH, ACK] Seq=596 Ack=613 Win=65152 Len=17 TSval=3169738650 TSecr=1045478941
1711547149.703629971   467 4.225618479    10.10.1.2 → 10.10.1.1    TCP 83 37438 → 8081 [PSH, ACK] Seq=613 Ack=613 Win=64256 Len=17 TSval=1045479058 TSecr=3169738650
1711547152.703629971   470 4.225714254    10.10.1.1 → 10.10.1.2    TCP 83 8081 → 37438 [PSH, ACK] Seq=613 Ack=630 Win=65152 Len=17 TSval=3169738767 TSecr=1045479058
1711547161.703629971   479 4.305925048    10.10.1.2 → 10.10.1.1    TCP 83 37438 → 8081 [PSH, ACK] Seq=630 Ack=630 Win=64256 Len=17 TSval=1045479138 TSecr=3169738767
1711547164.703629971   482 4.306022510    10.10.1.1 → 10.10.1.2    TCP 83 8081 → 37438 [PSH, ACK] Seq=630 Ack=647 Win=65152 Len=17 TSval=3169738847 TSecr=1045479138
1711547173.703629971   491 4.317826020    10.10.1.2 → 10.10.1.1    TCP 83 37438 → 8081 [PSH, ACK] Seq=647 Ack=647 Win=64256 Len=17 TSval=1045479150 TSecr=3169738847
1711547176.703629971   494 4.317921271    10.10.1.1 → 10.10.1.2    TCP 83 8081 → 37438 [PSH, ACK] Seq=647 Ack=664 Win=65152 Len=17 TSval=3169738859 TSecr=1045479150
1711547185.703629971   503 4.402235030    10.10.1.2 → 10.10.1.1    TCP 83 37438 → 8081 [PSH, ACK] Seq=664 Ack=664 Win=64256 Len=17 TSval=1045479235 TSecr=3169738859
1711547188.703629971   506 4.402332498    10.10.1.1 → 10.10.1.2    TCP 83 8081 → 37438 [PSH, ACK] Seq=664 Ack=681 Win=65152 Len=17 TSval=3169738943 TSecr=1045479235
1711547197.703629971   515 4.443814383    10.10.1.2 → 10.10.1.1    TCP 83 37438 → 8081 [PSH, ACK] Seq=681 Ack=681 Win=64256 Len=17 TSval=1045479276 TSecr=3169738943
1711547200.703629971   518 4.443912189    10.10.1.1 → 10.10.1.2    TCP 83 8081 → 37438 [PSH, ACK] Seq=681 Ack=698 Win=65152 Len=17 TSval=3169738985 TSecr=1045479276
1711547209.703629971   527 4.495301061    10.10.1.2 → 10.10.1.1    TCP 83 37438 → 8081 [PSH, ACK] Seq=698 Ack=698 Win=64256 Len=17 TSval=1045479328 TSecr=3169738985
1711547211.703629971   529 4.495399596    10.10.1.1 → 10.10.1.2    TCP 83 8081 → 37438 [PSH, ACK] Seq=698 Ack=715 Win=65152 Len=17 TSval=3169739036 TSecr=1045479328
1711547221.703629971   539 4.660572461    10.10.1.2 → 10.10.1.1    TCP 83 37438 → 8081 [PSH, ACK] Seq=715 Ack=715 Win=64256 Len=17 TSval=1045479493 TSecr=3169739036
1711547223.703629971   541 4.660669440    10.10.1.1 → 10.10.1.2    TCP 83 8081 → 37438 [PSH, ACK] Seq=715 Ack=732 Win=65152 Len=17 TSval=3169739202 TSecr=1045479493
1711547233.703629971   551 4.770183158    10.10.1.2 → 10.10.1.1    TCP 83 37438 → 8081 [PSH, ACK] Seq=732 Ack=732 Win=64256 Len=17 TSval=1045479602 TSecr=3169739202
1711547235.703629971   553 4.770281292    10.10.1.1 → 10.10.1.2    TCP 83 8081 → 37438 [PSH, ACK] Seq=732 Ack=749 Win=65152 Len=17 TSval=3169739311 TSecr=1045479602
1711547244.703629971   562 4.770579298    10.10.1.2 → 10.10.1.1    TCP 83 37438 → 8081 [PSH, ACK] Seq=749 Ack=749 Win=64256 Len=17 TSval=1045479603 TSecr=3169739311
1711547246.703629971   564 4.770618478    10.10.1.1 → 10.10.1.2    TCP 83 8081 → 37438 [PSH, ACK] Seq=749 Ack=766 Win=65152 Len=17 TSval=3169739312 TSecr=1045479603
1711547256.703629971   574 4.882842317    10.10.1.2 → 10.10.1.1    TCP 83 37438 → 8081 [PSH, ACK] Seq=766 Ack=766 Win=64256 Len=17 TSval=1045479715 TSecr=3169739312
1711547258.703629971   576 4.882937901    10.10.1.1 → 10.10.1.2    TCP 83 8081 → 37438 [PSH, ACK] Seq=766 Ack=783 Win=65152 Len=17 TSval=3169739424 TSecr=1045479715
1711547268.703629971   586 5.039029368    10.10.1.2 → 10.10.1.1    TCP 83 37438 → 8081 [PSH, ACK] Seq=783 Ack=783 Win=64256 Len=17 TSval=1045479871 TSecr=3169739424
1711547270.703629971   588 5.039126898    10.10.1.1 → 10.10.1.2    TCP 83 8081 → 37438 [PSH, ACK] Seq=783 Ack=800 Win=65152 Len=17 TSval=3169739580 TSecr=1045479871
1711547280.703629971   598 5.138517240    10.10.1.2 → 10.10.1.1    TCP 83 37438 → 8081 [PSH, ACK] Seq=800 Ack=800 Win=64256 Len=17 TSval=1045479971 TSecr=3169739580
1711547282.703629971   600 5.138616885    10.10.1.1 → 10.10.1.2    TCP 83 8081 → 37438 [PSH, ACK] Seq=800 Ack=817 Win=65152 Len=17 TSval=3169739680 TSecr=1045479971
1711547292.703629971   610 5.392229313    10.10.1.2 → 10.10.1.1    TCP 83 37438 → 8081 [PSH, ACK] Seq=817 Ack=817 Win=64256 Len=17 TSval=1045480225 TSecr=3169739680
1711547295.703629971   613 5.392325833    10.10.1.1 → 10.10.1.2    TCP 83 8081 → 37438 [PSH, ACK] Seq=817 Ack=834 Win=65152 Len=17 TSval=3169739933 TSecr=1045480225
1711547305.703629971   623 5.550124651    10.10.1.2 → 10.10.1.1    TCP 83 37438 → 8081 [PSH, ACK] Seq=834 Ack=834 Win=64256 Len=17 TSval=1045480382 TSecr=3169739933
1711547308.703629971   626 5.550221648    10.10.1.1 → 10.10.1.2    TCP 83 8081 → 37438 [PSH, ACK] Seq=834 Ack=851 Win=65152 Len=17 TSval=3169740091 TSecr=1045480382
1711547317.703629971   635 5.630435667    10.10.1.2 → 10.10.1.1    TCP 83 37438 → 8081 [PSH, ACK] Seq=851 Ack=851 Win=64256 Len=17 TSval=1045480463 TSecr=3169740091
1711547320.703629971   638 5.630566520    10.10.1.1 → 10.10.1.2    TCP 83 8081 → 37438 [PSH, ACK] Seq=851 Ack=868 Win=65152 Len=17 TSval=3169740172 TSecr=1045480463
1711547329.703629971   647 5.862869820    10.10.1.2 → 10.10.1.1    TCP 83 37438 → 8081 [PSH, ACK] Seq=868 Ack=868 Win=64256 Len=17 TSval=1045480695 TSecr=3169740172
1711547332.703629971   650 5.862990251    10.10.1.1 → 10.10.1.2    TCP 83 8081 → 37438 [PSH, ACK] Seq=868 Ack=885 Win=65152 Len=17 TSval=3169740404 TSecr=1045480695
1711547341.703629971   659 5.986856824    10.10.1.2 → 10.10.1.1    TCP 83 37438 → 8081 [PSH, ACK] Seq=885 Ack=885 Win=64256 Len=17 TSval=1045480819 TSecr=3169740404
1711547344.703629971   662 5.986980816    10.10.1.1 → 10.10.1.2    TCP 83 8081 → 37438 [PSH, ACK] Seq=885 Ack=902 Win=65152 Len=17 TSval=3169740528 TSecr=1045480819
1711547353.703629971   671 6.077277794    10.10.1.2 → 10.10.1.1    TCP 83 37438 → 8081 [PSH, ACK] Seq=902 Ack=902 Win=64256 Len=17 TSval=1045480910 TSecr=3169740528
1711547356.703629971   674 6.077405421    10.10.1.1 → 10.10.1.2    TCP 83 8081 → 37438 [PSH, ACK] Seq=902 Ack=919 Win=65152 Len=17 TSval=3169740618 TSecr=1045480910
1711547365.703629971   683 6.166336639    10.10.1.2 → 10.10.1.1    TCP 83 37438 → 8081 [PSH, ACK] Seq=919 Ack=919 Win=64256 Len=17 TSval=1045480999 TSecr=3169740618
1711547368.703629971   686 6.166464887    10.10.1.1 → 10.10.1.2    TCP 83 8081 → 37438 [PSH, ACK] Seq=919 Ack=936 Win=65152 Len=17 TSval=3169740707 TSecr=1045480999
1711547377.703629971   695 6.188973751    10.10.1.2 → 10.10.1.1    TCP 83 37438 → 8081 [PSH, ACK] Seq=936 Ack=936 Win=64256 Len=17 TSval=1045481021 TSecr=3169740707
1711547380.703629971   698 6.189099089    10.10.1.1 → 10.10.1.2    TCP 83 8081 → 37438 [PSH, ACK] Seq=936 Ack=953 Win=65152 Len=17 TSval=3169740730 TSecr=1045481021
1711547389.703629971   707 6.286853546    10.10.1.2 → 10.10.1.1    TCP 83 37438 → 8081 [PSH, ACK] Seq=953 Ack=953 Win=64256 Len=17 TSval=1045481119 TSecr=3169740730
1711547392.703629971   710 6.287033712    10.10.1.1 → 10.10.1.2    TCP 83 8081 → 37438 [PSH, ACK] Seq=953 Ack=970 Win=65152 Len=17 TSval=3169740828 TSecr=1045481119
1711547401.703629971   719 6.293956386    10.10.1.2 → 10.10.1.1    TCP 83 37438 → 8081 [PSH, ACK] Seq=970 Ack=970 Win=64256 Len=17 TSval=1045481126 TSecr=3169740828
1711547403.703629971   721 6.294082282    10.10.1.1 → 10.10.1.2    TCP 83 8081 → 37438 [PSH, ACK] Seq=970 Ack=987 Win=65152 Len=17 TSval=3169740835 TSecr=1045481126
1711547411.703629971   729 6.314647179    10.10.1.2 → 10.10.1.1    TCP 83 37438 → 8081 [PSH, ACK] Seq=987 Ack=987 Win=64256 Len=17 TSval=1045481147 TSecr=3169740835
1711547413.703629971   731 6.314778139    10.10.1.1 → 10.10.1.2    TCP 83 8081 → 37438 [PSH, ACK] Seq=987 Ack=1004 Win=65152 Len=17 TSval=3169740856 TSecr=1045481147
1711547423.703629971   741 6.424267351    10.10.1.2 → 10.10.1.1    TCP 83 37438 → 8081 [PSH, ACK] Seq=1004 Ack=1004 Win=64256 Len=17 TSval=1045481257 TSecr=3169740856
1711547425.703629971   743 6.424392582    10.10.1.1 → 10.10.1.2    TCP 83 8081 → 37438 [PSH, ACK] Seq=1004 Ack=1021 Win=65152 Len=17 TSval=3169740965 TSecr=1045481257
1711547435.703629971   753 6.470757965    10.10.1.2 → 10.10.1.1    TCP 83 37438 → 8081 [PSH, ACK] Seq=1021 Ack=1021 Win=64256 Len=17 TSval=1045481303 TSecr=3169740965
1711547437.703629971   755 6.470883227    10.10.1.1 → 10.10.1.2    TCP 83 8081 → 37438 [PSH, ACK] Seq=1021 Ack=1038 Win=65152 Len=17 TSval=3169741012 TSecr=1045481303
1711547447.703629971   765 6.573272417    10.10.1.2 → 10.10.1.1    TCP 83 37438 → 8081 [PSH, ACK] Seq=1038 Ack=1038 Win=64256 Len=17 TSval=1045481406 TSecr=3169741012
1711547449.703629971   767 6.573369913    10.10.1.1 → 10.10.1.2    TCP 83 8081 → 37438 [PSH, ACK] Seq=1038 Ack=1055 Win=65152 Len=17 TSval=3169741114 TSecr=1045481406
1711547459.703629971   777 6.617169141    10.10.1.2 → 10.10.1.1    TCP 83 37438 → 8081 [PSH, ACK] Seq=1055 Ack=1055 Win=64256 Len=17 TSval=1045481449 TSecr=3169741114
1711547461.703629971   779 6.617266718    10.10.1.1 → 10.10.1.2    TCP 83 8081 → 37438 [PSH, ACK] Seq=1055 Ack=1072 Win=65152 Len=17 TSval=3169741158 TSecr=1045481449
1711547471.703629971   789 7.050062035    10.10.1.2 → 10.10.1.1    TCP 83 37438 → 8081 [PSH, ACK] Seq=1072 Ack=1072 Win=64256 Len=17 TSval=1045481882 TSecr=3169741158
1711547474.703629971   792 7.050158254    10.10.1.1 → 10.10.1.2    TCP 83 8081 → 37438 [PSH, ACK] Seq=1072 Ack=1089 Win=65152 Len=17 TSval=3169741591 TSecr=1045481882
1711547483.703629971   801 7.061822953    10.10.1.2 → 10.10.1.1    TCP 83 37438 → 8081 [PSH, ACK] Seq=1089 Ack=1089 Win=64256 Len=17 TSval=1045481894 TSecr=3169741591
1711547486.703629971   804 7.061918712    10.10.1.1 → 10.10.1.2    TCP 83 8081 → 37438 [PSH, ACK] Seq=1089 Ack=1106 Win=65152 Len=17 TSval=3169741603 TSecr=1045481894
1711547495.703629971   813 7.114753521    10.10.1.2 → 10.10.1.1    TCP 83 37438 → 8081 [PSH, ACK] Seq=1106 Ack=1106 Win=64256 Len=17 TSval=1045481947 TSecr=3169741603
1711547498.703629971   816 7.114849648    10.10.1.1 → 10.10.1.2    TCP 83 8081 → 37438 [PSH, ACK] Seq=1106 Ack=1123 Win=65152 Len=17 TSval=3169741656 TSecr=1045481947
1711547507.703629971   825 7.432007613    10.10.1.2 → 10.10.1.1    TCP 83 37438 → 8081 [PSH, ACK] Seq=1123 Ack=1123 Win=64256 Len=17 TSval=1045482264 TSecr=3169741656
1711547510.703629971   828 7.432102517    10.10.1.1 → 10.10.1.2    TCP 83 8081 → 37438 [PSH, ACK] Seq=1123 Ack=1140 Win=65152 Len=17 TSval=3169741973 TSecr=1045482264
1711547520.703629971   838 7.590932345    10.10.1.2 → 10.10.1.1    TCP 83 37438 → 8081 [PSH, ACK] Seq=1140 Ack=1140 Win=64256 Len=17 TSval=1045482423 TSecr=3169741973
1711547523.703629971   841 7.591030432    10.10.1.1 → 10.10.1.2    TCP 83 8081 → 37438 [PSH, ACK] Seq=1140 Ack=1157 Win=65152 Len=17 TSval=3169742132 TSecr=1045482423
1711547532.703629971   850 7.912630138    10.10.1.2 → 10.10.1.1    TCP 83 37438 → 8081 [PSH, ACK] Seq=1157 Ack=1157 Win=64256 Len=17 TSval=1045482745 TSecr=3169742132
1711547535.703629971   853 7.912728030    10.10.1.1 → 10.10.1.2    TCP 83 8081 → 37438 [PSH, ACK] Seq=1157 Ack=1174 Win=65152 Len=17 TSval=3169742454 TSecr=1045482745
1711547544.703629971   862 7.919921626    10.10.1.2 → 10.10.1.1    TCP 83 37438 → 8081 [PSH, ACK] Seq=1174 Ack=1174 Win=64256 Len=17 TSval=1045482752 TSecr=3169742454
1711547547.703629971   865 7.920018111    10.10.1.1 → 10.10.1.2    TCP 83 8081 → 37438 [PSH, ACK] Seq=1174 Ack=1191 Win=65152 Len=17 TSval=3169742461 TSecr=1045482752
1711547556.703629971   874 7.965490283    10.10.1.2 → 10.10.1.1    TCP 83 37438 → 8081 [PSH, ACK] Seq=1191 Ack=1191 Win=64256 Len=17 TSval=1045482798 TSecr=3169742461
1711547559.703629971   877 7.965617474    10.10.1.1 → 10.10.1.2    TCP 83 8081 → 37438 [PSH, ACK] Seq=1191 Ack=1208 Win=65152 Len=17 TSval=3169742507 TSecr=1045482798
1711547568.703629971   886 8.001207723    10.10.1.2 → 10.10.1.1    TCP 83 37438 → 8081 [PSH, ACK] Seq=1208 Ack=1208 Win=64256 Len=17 TSval=1045482834 TSecr=3169742507
1711547571.703629971   889 8.001332575    10.10.1.1 → 10.10.1.2    TCP 83 8081 → 37438 [PSH, ACK] Seq=1208 Ack=1225 Win=65152 Len=17 TSval=3169742542 TSecr=1045482834
1711547580.703629971   898 8.064648883    10.10.1.2 → 10.10.1.1    TCP 83 37438 → 8081 [PSH, ACK] Seq=1225 Ack=1225 Win=64256 Len=17 TSval=1045482897 TSecr=3169742542
1711547583.703629971   901 8.064775189    10.10.1.1 → 10.10.1.2    TCP 83 8081 → 37438 [PSH, ACK] Seq=1225 Ack=1242 Win=65152 Len=17 TSval=3169742606 TSecr=1045482897
1711547592.703629971   910 8.083849338    10.10.1.2 → 10.10.1.1    TCP 83 37438 → 8081 [PSH, ACK] Seq=1242 Ack=1242 Win=64256 Len=17 TSval=1045482916 TSecr=3169742606
1711547595.703629971   913 8.083974759    10.10.1.1 → 10.10.1.2    TCP 83 8081 → 37438 [PSH, ACK] Seq=1242 Ack=1259 Win=65152 Len=17 TSval=3169742625 TSecr=1045482916
1711547604.703629971   922 8.413098803    10.10.1.2 → 10.10.1.1    TCP 83 37438 → 8081 [PSH, ACK] Seq=1259 Ack=1259 Win=64256 Len=17 TSval=1045483245 TSecr=3169742625
1711547607.703629971   925 8.413222844    10.10.1.1 → 10.10.1.2    TCP 83 8081 → 37438 [PSH, ACK] Seq=1259 Ack=1276 Win=65152 Len=17 TSval=3169742954 TSecr=1045483245
1711547616.703629971   934 8.476785832    10.10.1.2 → 10.10.1.1    TCP 83 37438 → 8081 [PSH, ACK] Seq=1276 Ack=1276 Win=64256 Len=17 TSval=1045483309 TSecr=3169742954
1711547619.703629971   937 8.476910577    10.10.1.1 → 10.10.1.2    TCP 83 8081 → 37438 [PSH, ACK] Seq=1276 Ack=1293 Win=65152 Len=17 TSval=3169743018 TSecr=1045483309
1711547628.703629971   946 8.663955012    10.10.1.2 → 10.10.1.1    TCP 83 37438 → 8081 [PSH, ACK] Seq=1293 Ack=1293 Win=64256 Len=17 TSval=1045483496 TSecr=3169743018
1711547631.703629971   949 8.664081470    10.10.1.1 → 10.10.1.2    TCP 83 8081 → 37438 [PSH, ACK] Seq=1293 Ack=1310 Win=65152 Len=17 TSval=3169743205 TSecr=1045483496
1711547640.703629971   958 8.803855073    10.10.1.2 → 10.10.1.1    TCP 83 37438 → 8081 [PSH, ACK] Seq=1310 Ack=1310 Win=64256 Len=17 TSval=1045483636 TSecr=3169743205
1711547643.703629971   961 8.803980465    10.10.1.1 → 10.10.1.2    TCP 83 8081 → 37438 [PSH, ACK] Seq=1310 Ack=1327 Win=65152 Len=17 TSval=3169743345 TSecr=1045483636
1711547652.703629971   970 8.814546137    10.10.1.2 → 10.10.1.1    TCP 83 37438 → 8081 [PSH, ACK] Seq=1327 Ack=1327 Win=64256 Len=17 TSval=1045483647 TSecr=3169743345
1711547655.703629971   973 8.814670974    10.10.1.1 → 10.10.1.2    TCP 83 8081 → 37438 [PSH, ACK] Seq=1327 Ack=1344 Win=65152 Len=17 TSval=3169743356 TSecr=1045483647
1711547664.703629971   982 8.960242404    10.10.1.2 → 10.10.1.1    TCP 83 37438 → 8081 [PSH, ACK] Seq=1344 Ack=1344 Win=64256 Len=17 TSval=1045483793 TSecr=3169743356
1711547667.703629971   985 8.960368178    10.10.1.1 → 10.10.1.2    TCP 83 8081 → 37438 [PSH, ACK] Seq=1344 Ack=1361 Win=65152 Len=17 TSval=3169743501 TSecr=1045483793
1711547676.703629971   994 9.039435331    10.10.1.2 → 10.10.1.1    TCP 83 37438 → 8081 [PSH, ACK] Seq=1361 Ack=1361 Win=64256 Len=17 TSval=1045483872 TSecr=3169743501
1711547678.703629971   996 9.039561872    10.10.1.1 → 10.10.1.2    TCP 83 8081 → 37438 [PSH, ACK] Seq=1361 Ack=1378 Win=65152 Len=17 TSval=3169743580 TSecr=1045483872
1711547688.703629971  1006 9.144461506    10.10.1.2 → 10.10.1.1    TCP 83 37438 → 8081 [PSH, ACK] Seq=1378 Ack=1378 Win=64256 Len=17 TSval=1045483977 TSecr=3169743580
1711547690.703629971  1008 9.144609138    10.10.1.1 → 10.10.1.2    TCP 83 8081 → 37438 [PSH, ACK] Seq=1378 Ack=1395 Win=65152 Len=17 TSval=3169743686 TSecr=1045483977
1711547700.703629971  1018 9.255109700    10.10.1.2 → 10.10.1.1    TCP 83 37438 → 8081 [PSH, ACK] Seq=1395 Ack=1395 Win=64256 Len=17 TSval=1045484087 TSecr=3169743686
1711547702.703629971  1020 9.255236433    10.10.1.1 → 10.10.1.2    TCP 83 8081 → 37438 [PSH, ACK] Seq=1395 Ack=1412 Win=65152 Len=17 TSval=3169743796 TSecr=1045484087
1711547711.703629971  1029 9.284921253    10.10.1.2 → 10.10.1.1    TCP 83 37438 → 8081 [PSH, ACK] Seq=1412 Ack=1412 Win=64256 Len=17 TSval=1045484117 TSecr=3169743796
1711547713.703629971  1031 9.285019263    10.10.1.1 → 10.10.1.2    TCP 83 8081 → 37438 [PSH, ACK] Seq=1412 Ack=1429 Win=65152 Len=17 TSval=3169743826 TSecr=1045484117
1711547721.703629971  1039 9.313054845    10.10.1.2 → 10.10.1.1    TCP 83 37438 → 8081 [PSH, ACK] Seq=1429 Ack=1429 Win=64256 Len=17 TSval=1045484145 TSecr=3169743826
1711547723.703629971  1041 9.313156085    10.10.1.1 → 10.10.1.2    TCP 83 8081 → 37438 [PSH, ACK] Seq=1429 Ack=1446 Win=65152 Len=17 TSval=3169743854 TSecr=1045484145
1711547731.703629971  1049 9.342973767    10.10.1.2 → 10.10.1.1    TCP 83 37438 → 8081 [PSH, ACK] Seq=1446 Ack=1446 Win=64256 Len=17 TSval=1045484175 TSecr=3169743854
1711547733.703629971  1051 9.343076460    10.10.1.1 → 10.10.1.2    TCP 83 8081 → 37438 [PSH, ACK] Seq=1446 Ack=1463 Win=65152 Len=17 TSval=3169743884 TSecr=1045484175
1711547743.703629971  1061 9.403991012    10.10.1.2 → 10.10.1.1    TCP 83 37438 → 8081 [PSH, ACK] Seq=1463 Ack=1463 Win=64256 Len=17 TSval=1045484236 TSecr=3169743884
1711547745.703629971  1063 9.404090017    10.10.1.1 → 10.10.1.2    TCP 83 8081 → 37438 [PSH, ACK] Seq=1463 Ack=1480 Win=65152 Len=17 TSval=3169743945 TSecr=1045484236
1711547756.703629971  1074 9.605139408    10.10.1.2 → 10.10.1.1    TCP 83 37438 → 8081 [PSH, ACK] Seq=1480 Ack=1480 Win=64256 Len=17 TSval=1045484437 TSecr=3169743945
1711547758.703629971  1076 9.605236384    10.10.1.1 → 10.10.1.2    TCP 83 8081 → 37438 [PSH, ACK] Seq=1480 Ack=1497 Win=65152 Len=17 TSval=3169744146 TSecr=1045484437
1711547767.703629971  1085 9.644180464    10.10.1.2 → 10.10.1.1    TCP 83 37438 → 8081 [PSH, ACK] Seq=1497 Ack=1497 Win=64256 Len=17 TSval=1045484476 TSecr=3169744146
1711547769.703629971  1087 9.644276853    10.10.1.1 → 10.10.1.2    TCP 83 8081 → 37438 [PSH, ACK] Seq=1497 Ack=1514 Win=65152 Len=17 TSval=3169744185 TSecr=1045484476
1711547779.703629971  1097 9.746413704    10.10.1.2 → 10.10.1.1    TCP 83 37438 → 8081 [PSH, ACK] Seq=1514 Ack=1514 Win=64256 Len=17 TSval=1045484579 TSecr=3169744185
1711547781.703629971  1099 9.746509915    10.10.1.1 → 10.10.1.2    TCP 83 8081 → 37438 [PSH, ACK] Seq=1514 Ack=1531 Win=65152 Len=17 TSval=3169744287 TSecr=1045484579
1711547791.703629971  1109 9.822330722    10.10.1.2 → 10.10.1.1    TCP 83 37438 → 8081 [PSH, ACK] Seq=1531 Ack=1531 Win=64256 Len=17 TSval=1045484655 TSecr=3169744287
1711547793.703629971  1111 9.822429760    10.10.1.1 → 10.10.1.2    TCP 83 8081 → 37438 [PSH, ACK] Seq=1531 Ack=1548 Win=65152 Len=17 TSval=3169744363 TSecr=1045484655
1711547803.703629971  1121 9.940009326    10.10.1.2 → 10.10.1.1    TCP 83 37438 → 8081 [PSH, ACK] Seq=1548 Ack=1548 Win=64256 Len=17 TSval=1045484772 TSecr=3169744363
1711547805.703629971  1123 9.940106357    10.10.1.1 → 10.10.1.2    TCP 83 8081 → 37438 [PSH, ACK] Seq=1548 Ack=1565 Win=65152 Len=17 TSval=3169744481 TSecr=1045484772
1711547814.703629971  1132 9.973053190    10.10.1.2 → 10.10.1.1    TCP 83 37438 → 8081 [PSH, ACK] Seq=1565 Ack=1565 Win=64256 Len=17 TSval=1045484805 TSecr=3169744481
1711547816.703629971  1134 9.973154061    10.10.1.1 → 10.10.1.2    TCP 83 8081 → 37438 [PSH, ACK] Seq=1565 Ack=1582 Win=65152 Len=17 TSval=3169744514 TSecr=1045484805
1711547826.703629971  1144 10.188569899    10.10.1.2 → 10.10.1.1    TCP 83 37438 → 8081 [PSH, ACK] Seq=1582 Ack=1582 Win=64256 Len=17 TSval=1045485021 TSecr=3169744514
1711547829.703629971  1147 10.188665679    10.10.1.1 → 10.10.1.2    TCP 83 8081 → 37438 [PSH, ACK] Seq=1582 Ack=1599 Win=65152 Len=17 TSval=3169744730 TSecr=1045485021
1711547838.703629971  1156 10.302053281    10.10.1.2 → 10.10.1.1    TCP 83 37438 → 8081 [PSH, ACK] Seq=1599 Ack=1599 Win=64256 Len=17 TSval=1045485134 TSecr=3169744730
1711547841.703629971  1159 10.302149862    10.10.1.1 → 10.10.1.2    TCP 83 8081 → 37438 [PSH, ACK] Seq=1599 Ack=1616 Win=65152 Len=17 TSval=3169744843 TSecr=1045485134
1711547850.703629971  1168 10.351355079    10.10.1.2 → 10.10.1.1    TCP 83 37438 → 8081 [PSH, ACK] Seq=1616 Ack=1616 Win=64256 Len=17 TSval=1045485184 TSecr=3169744843
1711547853.703629971  1171 10.351451649    10.10.1.1 → 10.10.1.2    TCP 83 8081 → 37438 [PSH, ACK] Seq=1616 Ack=1633 Win=65152 Len=17 TSval=3169744892 TSecr=1045485184
1711547862.703629971  1180 10.386325592    10.10.1.2 → 10.10.1.1    TCP 83 37438 → 8081 [PSH, ACK] Seq=1633 Ack=1633 Win=64256 Len=17 TSval=1045485219 TSecr=3169744892
1711547865.703629971  1183 10.386422603    10.10.1.1 → 10.10.1.2    TCP 83 8081 → 37438 [PSH, ACK] Seq=1633 Ack=1650 Win=65152 Len=17 TSval=3169744927 TSecr=1045485219
1711547874.703629971  1192 10.487557215    10.10.1.2 → 10.10.1.1    TCP 83 37438 → 8081 [PSH, ACK] Seq=1650 Ack=1650 Win=64256 Len=17 TSval=1045485320 TSecr=3169744927
1711547877.703629971  1195 10.487654001    10.10.1.1 → 10.10.1.2    TCP 83 8081 → 37438 [PSH, ACK] Seq=1650 Ack=1667 Win=65152 Len=17 TSval=3169745029 TSecr=1045485320
1711547886.703629971  1204 10.508030570    10.10.1.2 → 10.10.1.1    TCP 83 37438 → 8081 [PSH, ACK] Seq=1667 Ack=1667 Win=64256 Len=17 TSval=1045485340 TSecr=3169745029
1711547889.703629971  1207 10.508126925    10.10.1.1 → 10.10.1.2    TCP 83 8081 → 37438 [PSH, ACK] Seq=1667 Ack=1684 Win=65152 Len=17 TSval=3169745049 TSecr=1045485340
1711547896.703629971  1214 10.537468714    10.10.1.2 → 10.10.1.1    TCP 83 37438 → 8081 [PSH, ACK] Seq=1684 Ack=1684 Win=64256 Len=17 TSval=1045485370 TSecr=3169745049
1711547898.703629971  1216 10.537571292    10.10.1.1 → 10.10.1.2    TCP 83 8081 → 37438 [PSH, ACK] Seq=1684 Ack=1701 Win=65152 Len=17 TSval=3169745079 TSecr=1045485370
1711547908.703629971  1226 10.659149857    10.10.1.2 → 10.10.1.1    TCP 83 37438 → 8081 [PSH, ACK] Seq=1701 Ack=1701 Win=64256 Len=17 TSval=1045485491 TSecr=3169745079
1711547910.703629971  1228 10.659246276    10.10.1.1 → 10.10.1.2    TCP 83 8081 → 37438 [PSH, ACK] Seq=1701 Ack=1718 Win=65152 Len=17 TSval=3169745200 TSecr=1045485491
1711547920.703629971  1238 10.738562432    10.10.1.2 → 10.10.1.1    TCP 83 37438 → 8081 [PSH, ACK] Seq=1718 Ack=1718 Win=64256 Len=17 TSval=1045485571 TSecr=3169745200
1711547922.703629971  1240 10.738659049    10.10.1.1 → 10.10.1.2    TCP 83 8081 → 37438 [PSH, ACK] Seq=1718 Ack=1735 Win=65152 Len=17 TSval=3169745280 TSecr=1045485571
1711547932.703629971  1250 10.818865833    10.10.1.2 → 10.10.1.1    TCP 83 37438 → 8081 [PSH, ACK] Seq=1735 Ack=1735 Win=64256 Len=17 TSval=1045485651 TSecr=3169745280
1711547934.703629971  1252 10.818964791    10.10.1.1 → 10.10.1.2    TCP 83 8081 → 37438 [PSH, ACK] Seq=1735 Ack=1752 Win=65152 Len=17 TSval=3169745360 TSecr=1045485651
1711547943.703629971  1261 10.837894773    10.10.1.2 → 10.10.1.1    TCP 83 37438 → 8081 [PSH, ACK] Seq=1752 Ack=1752 Win=64256 Len=17 TSval=1045485670 TSecr=3169745360
1711547945.703629971  1263 10.837991074    10.10.1.1 → 10.10.1.2    TCP 83 8081 → 37438 [PSH, ACK] Seq=1752 Ack=1769 Win=65152 Len=17 TSval=3169745379 TSecr=1045485670
1711547955.703629971  1273 10.964957922    10.10.1.2 → 10.10.1.1    TCP 83 37438 → 8081 [PSH, ACK] Seq=1769 Ack=1769 Win=64256 Len=17 TSval=1045485797 TSecr=3169745379
1711547957.703629971  1275 10.965055105    10.10.1.1 → 10.10.1.2    TCP 83 8081 → 37438 [PSH, ACK] Seq=1769 Ack=1786 Win=65152 Len=17 TSval=3169745506 TSecr=1045485797
1711547967.703629971  1285 11.037290359    10.10.1.2 → 10.10.1.1    TCP 83 37438 → 8081 [PSH, ACK] Seq=1786 Ack=1786 Win=64256 Len=17 TSval=1045485870 TSecr=3169745506
1711547969.703629971  1287 11.037389168    10.10.1.1 → 10.10.1.2    TCP 83 8081 → 37438 [PSH, ACK] Seq=1786 Ack=1803 Win=65152 Len=17 TSval=3169745578 TSecr=1045485870
1711547979.703629971  1297 11.139785164    10.10.1.2 → 10.10.1.1    TCP 83 37438 → 8081 [PSH, ACK] Seq=1803 Ack=1803 Win=64256 Len=17 TSval=1045485972 TSecr=3169745578
1711547981.703629971  1299 11.139882219    10.10.1.1 → 10.10.1.2    TCP 83 8081 → 37438 [PSH, ACK] Seq=1803 Ack=1820 Win=65152 Len=17 TSval=3169745681 TSecr=1045485972
1711547991.703629971  1309 11.223126659    10.10.1.2 → 10.10.1.1    TCP 83 37438 → 8081 [PSH, ACK] Seq=1820 Ack=1820 Win=64256 Len=17 TSval=1045486055 TSecr=3169745681
1711547993.703629971  1311 11.223223120    10.10.1.1 → 10.10.1.2    TCP 83 8081 → 37438 [PSH, ACK] Seq=1820 Ack=1837 Win=65152 Len=17 TSval=3169745764 TSecr=1045486055
1711548002.703629971  1320 11.254316352    10.10.1.2 → 10.10.1.1    TCP 83 37438 → 8081 [PSH, ACK] Seq=1837 Ack=1837 Win=64256 Len=17 TSval=1045486087 TSecr=3169745764
1711548004.703629971  1322 11.254426123    10.10.1.1 → 10.10.1.2    TCP 83 8081 → 37438 [PSH, ACK] Seq=1837 Ack=1854 Win=65152 Len=17 TSval=3169745795 TSecr=1045486087
1711548014.703629971  1332 11.388715369    10.10.1.2 → 10.10.1.1    TCP 83 37438 → 8081 [PSH, ACK] Seq=1854 Ack=1854 Win=64256 Len=17 TSval=1045486221 TSecr=3169745795
1711548016.703629971  1334 11.388810309    10.10.1.1 → 10.10.1.2    TCP 83 8081 → 37438 [PSH, ACK] Seq=1854 Ack=1871 Win=65152 Len=17 TSval=3169745930 TSecr=1045486221
1711548025.703629971  1343 11.429125563    10.10.1.2 → 10.10.1.1    TCP 83 37438 → 8081 [PSH, ACK] Seq=1871 Ack=1871 Win=64256 Len=17 TSval=1045486261 TSecr=3169745930
1711548027.703629971  1345 11.429227187    10.10.1.1 → 10.10.1.2    TCP 83 8081 → 37438 [PSH, ACK] Seq=1871 Ack=1888 Win=65152 Len=17 TSval=3169745970 TSecr=1045486261
1711548038.703629971  1356 11.596105087    10.10.1.2 → 10.10.1.1    TCP 83 37438 → 8081 [PSH, ACK] Seq=1888 Ack=1888 Win=64256 Len=17 TSval=1045486428 TSecr=3169745970
1711548040.703629971  1358 11.596203031    10.10.1.1 → 10.10.1.2    TCP 83 8081 → 37438 [PSH, ACK] Seq=1888 Ack=1905 Win=65152 Len=17 TSval=3169746137 TSecr=1045486428
1711548050.703629971  1368 11.645410260    10.10.1.2 → 10.10.1.1    TCP 83 37438 → 8081 [PSH, ACK] Seq=1905 Ack=1905 Win=64256 Len=17 TSval=1045486478 TSecr=3169746137
1711548052.703629971  1370 11.645506647    10.10.1.1 → 10.10.1.2    TCP 83 8081 → 37438 [PSH, ACK] Seq=1905 Ack=1922 Win=65152 Len=17 TSval=3169746186 TSecr=1045486478
1711548062.703629971  1380 12.289296502    10.10.1.2 → 10.10.1.1    TCP 83 37438 → 8081 [PSH, ACK] Seq=1922 Ack=1922 Win=64256 Len=17 TSval=1045487122 TSecr=3169746186
1711548065.703629971  1383 12.289462064    10.10.1.1 → 10.10.1.2    TCP 83 8081 → 37438 [PSH, ACK] Seq=1922 Ack=1939 Win=65152 Len=17 TSval=3169746830 TSecr=1045487122
1711548074.703629971  1392 12.296537643    10.10.1.2 → 10.10.1.1    TCP 83 37438 → 8081 [PSH, ACK] Seq=1939 Ack=1939 Win=64256 Len=17 TSval=1045487129 TSecr=3169746830
1711548077.703629971  1395 12.296637730    10.10.1.1 → 10.10.1.2    TCP 83 8081 → 37438 [PSH, ACK] Seq=1939 Ack=1956 Win=65152 Len=17 TSval=3169746838 TSecr=1045487129
1711548086.703629971  1404 12.396319701    10.10.1.2 → 10.10.1.1    TCP 83 37438 → 8081 [PSH, ACK] Seq=1956 Ack=1956 Win=64256 Len=17 TSval=1045487229 TSecr=3169746838
1711548089.703629971  1407 12.396446635    10.10.1.1 → 10.10.1.2    TCP 83 8081 → 37438 [PSH, ACK] Seq=1956 Ack=1973 Win=65152 Len=17 TSval=3169746937 TSecr=1045487229
1711548098.703629971  1416 12.426049180    10.10.1.2 → 10.10.1.1    TCP 83 37438 → 8081 [PSH, ACK] Seq=1973 Ack=1973 Win=64256 Len=17 TSval=1045487258 TSecr=3169746937
1711548101.703629971  1419 12.426173724    10.10.1.1 → 10.10.1.2    TCP 83 8081 → 37438 [PSH, ACK] Seq=1973 Ack=1990 Win=65152 Len=17 TSval=3169746967 TSecr=1045487258
1711548110.703629971  1428 12.500064286    10.10.1.2 → 10.10.1.1    TCP 83 37438 → 8081 [PSH, ACK] Seq=1990 Ack=1990 Win=64256 Len=17 TSval=1045487332 TSecr=3169746967
1711548113.703629971  1431 12.500190632    10.10.1.1 → 10.10.1.2    TCP 83 8081 → 37438 [PSH, ACK] Seq=1990 Ack=2007 Win=65152 Len=17 TSval=3169747041 TSecr=1045487332
1711548122.703629971  1440 12.568909275    10.10.1.2 → 10.10.1.1    TCP 83 37438 → 8081 [PSH, ACK] Seq=2007 Ack=2007 Win=64256 Len=17 TSval=1045487401 TSecr=3169747041
1711548125.703629971  1443 12.569035425    10.10.1.1 → 10.10.1.2    TCP 83 8081 → 37438 [PSH, ACK] Seq=2007 Ack=2024 Win=65152 Len=17 TSval=3169747110 TSecr=1045487401
1711548134.703629971  1452 12.654982210    10.10.1.2 → 10.10.1.1    TCP 83 37438 → 8081 [PSH, ACK] Seq=2024 Ack=2024 Win=64256 Len=17 TSval=1045487487 TSecr=3169747110
1711548136.703629971  1454 12.655106832    10.10.1.1 → 10.10.1.2    TCP 83 8081 → 37438 [PSH, ACK] Seq=2024 Ack=2041 Win=65152 Len=17 TSval=3169747196 TSecr=1045487487
