1712183061.632037401    22 0.274326963    10.10.1.2 → 10.10.1.1    TCP 74 34854 → 8081 [SYN] Seq=0 Win=64240 Len=0 MSS=1460 SACK_PERM=1 TSval=1681831985 TSecr=0 WS=128
1712183062.632037401    23 0.274363826    10.10.1.1 → 10.10.1.2    TCP 74 8081 → 34854 [SYN, ACK] Seq=0 Ack=1 Win=65160 Len=0 MSS=1460 SACK_PERM=1 TSval=3806091694 TSecr=1681831985 WS=128
1712183063.632037401    24 0.274404329    10.10.1.2 → 10.10.1.1    TCP 66 34854 → 8081 [ACK] Seq=1 Ack=1 Win=64256 Len=0 TSval=1681831985 TSecr=3806091694
1712183073.632037401    34 0.534216733    10.10.1.2 → 10.10.1.1    TCP 83 34854 → 8081 [PSH, ACK] Seq=1 Ack=1 Win=64256 Len=17 TSval=1681832245 TSecr=3806091694
1712183074.632037401    35 0.534243134    10.10.1.1 → 10.10.1.2    TCP 66 8081 → 34854 [ACK] Seq=1 Ack=18 Win=65152 Len=0 TSval=3806091954 TSecr=1681832245
1712183077.632037401    38 0.534523871    10.10.1.1 → 10.10.1.2    TCP 83 8081 → 34854 [PSH, ACK] Seq=1 Ack=18 Win=65152 Len=17 TSval=3806091955 TSecr=1681832245
1712183078.632037401    39 0.534554397    10.10.1.2 → 10.10.1.1    TCP 66 34854 → 8081 [ACK] Seq=18 Ack=18 Win=64256 Len=0 TSval=1681832245 TSecr=3806091955
1712183085.632037401    46 0.544742647    10.10.1.2 → 10.10.1.1    TCP 83 34854 → 8081 [PSH, ACK] Seq=18 Ack=18 Win=64256 Len=17 TSval=1681832256 TSecr=3806091955
1712183088.632037401    49 0.544868038    10.10.1.1 → 10.10.1.2    TCP 83 8081 → 34854 [PSH, ACK] Seq=18 Ack=35 Win=65152 Len=17 TSval=3806091965 TSecr=1681832256
1712183095.632037401    56 0.555085590    10.10.1.2 → 10.10.1.1    TCP 83 34854 → 8081 [PSH, ACK] Seq=35 Ack=35 Win=64256 Len=17 TSval=1681832266 TSecr=3806091965
1712183098.632037401    59 0.555215550    10.10.1.1 → 10.10.1.2    TCP 83 8081 → 34854 [PSH, ACK] Seq=35 Ack=52 Win=65152 Len=17 TSval=3806091975 TSecr=1681832266
1712183105.632037401    66 0.565435012    10.10.1.2 → 10.10.1.1    TCP 83 34854 → 8081 [PSH, ACK] Seq=52 Ack=52 Win=64256 Len=17 TSval=1681832276 TSecr=3806091975
1712183108.632037401    69 0.565564890    10.10.1.1 → 10.10.1.2    TCP 83 8081 → 34854 [PSH, ACK] Seq=52 Ack=69 Win=65152 Len=17 TSval=3806091986 TSecr=1681832276
1712183115.632037401    76 0.575785056    10.10.1.2 → 10.10.1.1    TCP 83 34854 → 8081 [PSH, ACK] Seq=69 Ack=69 Win=64256 Len=17 TSval=1681832287 TSecr=3806091986
1712183118.632037401    79 0.575915033    10.10.1.1 → 10.10.1.2    TCP 83 8081 → 34854 [PSH, ACK] Seq=69 Ack=86 Win=65152 Len=17 TSval=3806091996 TSecr=1681832287
1712183125.632037401    86 0.586134480    10.10.1.2 → 10.10.1.1    TCP 83 34854 → 8081 [PSH, ACK] Seq=86 Ack=86 Win=64256 Len=17 TSval=1681832297 TSecr=3806091996
1712183127.632037401    88 0.586271994    10.10.1.1 → 10.10.1.2    TCP 83 8081 → 34854 [PSH, ACK] Seq=86 Ack=103 Win=65152 Len=17 TSval=3806092006 TSecr=1681832297
1712183135.632037401    96 0.596490150    10.10.1.2 → 10.10.1.1    TCP 83 34854 → 8081 [PSH, ACK] Seq=103 Ack=103 Win=64256 Len=17 TSval=1681832307 TSecr=3806092006
1712183137.632037401    98 0.596628199    10.10.1.1 → 10.10.1.2    TCP 83 8081 → 34854 [PSH, ACK] Seq=103 Ack=120 Win=65152 Len=17 TSval=3806092017 TSecr=1681832307
1712183145.632037401   106 0.606846367    10.10.1.2 → 10.10.1.1    TCP 83 34854 → 8081 [PSH, ACK] Seq=120 Ack=120 Win=64256 Len=17 TSval=1681832318 TSecr=3806092017
1712183147.632037401   108 0.606983694    10.10.1.1 → 10.10.1.2    TCP 83 8081 → 34854 [PSH, ACK] Seq=120 Ack=137 Win=65152 Len=17 TSval=3806092027 TSecr=1681832318
1712183155.632037401   116 0.617204318    10.10.1.2 → 10.10.1.1    TCP 83 34854 → 8081 [PSH, ACK] Seq=137 Ack=137 Win=64256 Len=17 TSval=1681832328 TSecr=3806092027
1712183157.632037401   118 0.617339983    10.10.1.1 → 10.10.1.2    TCP 83 8081 → 34854 [PSH, ACK] Seq=137 Ack=154 Win=65152 Len=17 TSval=3806092037 TSecr=1681832328
1712183165.632037401   126 0.627560218    10.10.1.2 → 10.10.1.1    TCP 83 34854 → 8081 [PSH, ACK] Seq=154 Ack=154 Win=64256 Len=17 TSval=1681832338 TSecr=3806092037
1712183167.632037401   128 0.627696264    10.10.1.1 → 10.10.1.2    TCP 83 8081 → 34854 [PSH, ACK] Seq=154 Ack=171 Win=65152 Len=17 TSval=3806092048 TSecr=1681832338
1712183175.632037401   136 0.637913622    10.10.1.2 → 10.10.1.1    TCP 83 34854 → 8081 [PSH, ACK] Seq=171 Ack=171 Win=64256 Len=17 TSval=1681832349 TSecr=3806092048
1712183177.632037401   138 0.638052997    10.10.1.1 → 10.10.1.2    TCP 83 8081 → 34854 [PSH, ACK] Seq=171 Ack=188 Win=65152 Len=17 TSval=3806092058 TSecr=1681832349
1712183185.632037401   146 0.648269814    10.10.1.2 → 10.10.1.1    TCP 83 34854 → 8081 [PSH, ACK] Seq=188 Ack=188 Win=64256 Len=17 TSval=1681832359 TSecr=3806092058
1712183187.632037401   148 0.648399581    10.10.1.1 → 10.10.1.2    TCP 83 8081 → 34854 [PSH, ACK] Seq=188 Ack=205 Win=65152 Len=17 TSval=3806092068 TSecr=1681832359
1712183195.632037401   156 0.658582397    10.10.1.2 → 10.10.1.1    TCP 83 34854 → 8081 [PSH, ACK] Seq=205 Ack=205 Win=64256 Len=17 TSval=1681832369 TSecr=3806092068
1712183197.632037401   158 0.658711929    10.10.1.1 → 10.10.1.2    TCP 83 8081 → 34854 [PSH, ACK] Seq=205 Ack=222 Win=65152 Len=17 TSval=3806092079 TSecr=1681832369
1712183205.632037401   166 0.668928563    10.10.1.2 → 10.10.1.1    TCP 83 34854 → 8081 [PSH, ACK] Seq=222 Ack=222 Win=64256 Len=17 TSval=1681832380 TSecr=3806092079
1712183207.632037401   168 0.669067079    10.10.1.1 → 10.10.1.2    TCP 83 8081 → 34854 [PSH, ACK] Seq=222 Ack=239 Win=65152 Len=17 TSval=3806092089 TSecr=1681832380
1712183215.632037401   176 0.679286455    10.10.1.2 → 10.10.1.1    TCP 83 34854 → 8081 [PSH, ACK] Seq=239 Ack=239 Win=64256 Len=17 TSval=1681832390 TSecr=3806092089
1712183217.632037401   178 0.679424007    10.10.1.1 → 10.10.1.2    TCP 83 8081 → 34854 [PSH, ACK] Seq=239 Ack=256 Win=65152 Len=17 TSval=3806092100 TSecr=1681832390
1712183225.632037401   186 0.689641798    10.10.1.2 → 10.10.1.1    TCP 83 34854 → 8081 [PSH, ACK] Seq=256 Ack=256 Win=64256 Len=17 TSval=1681832401 TSecr=3806092100
1712183227.632037401   188 0.689779531    10.10.1.1 → 10.10.1.2    TCP 83 8081 → 34854 [PSH, ACK] Seq=256 Ack=273 Win=65152 Len=17 TSval=3806092110 TSecr=1681832401
1712183235.632037401   196 0.699996243    10.10.1.2 → 10.10.1.1    TCP 83 34854 → 8081 [PSH, ACK] Seq=273 Ack=273 Win=64256 Len=17 TSval=1681832411 TSecr=3806092110
1712183237.632037401   198 0.700133231    10.10.1.1 → 10.10.1.2    TCP 83 8081 → 34854 [PSH, ACK] Seq=273 Ack=290 Win=65152 Len=17 TSval=3806092120 TSecr=1681832411
1712183246.632037401   207 0.710351453    10.10.1.2 → 10.10.1.1    TCP 83 34854 → 8081 [PSH, ACK] Seq=290 Ack=290 Win=64256 Len=17 TSval=1681832421 TSecr=3806092120
1712183248.632037401   209 0.710487604    10.10.1.1 → 10.10.1.2    TCP 83 8081 → 34854 [PSH, ACK] Seq=290 Ack=307 Win=65152 Len=17 TSval=3806092131 TSecr=1681832421
1712183256.632037401   217 0.720705897    10.10.1.2 → 10.10.1.1    TCP 83 34854 → 8081 [PSH, ACK] Seq=307 Ack=307 Win=64256 Len=17 TSval=1681832432 TSecr=3806092131
1712183258.632037401   219 0.720843179    10.10.1.1 → 10.10.1.2    TCP 83 8081 → 34854 [PSH, ACK] Seq=307 Ack=324 Win=65152 Len=17 TSval=3806092141 TSecr=1681832432
1712183266.632037401   227 0.731061992    10.10.1.2 → 10.10.1.1    TCP 83 34854 → 8081 [PSH, ACK] Seq=324 Ack=324 Win=64256 Len=17 TSval=1681832442 TSecr=3806092141
1712183268.632037401   229 0.731198917    10.10.1.1 → 10.10.1.2    TCP 83 8081 → 34854 [PSH, ACK] Seq=324 Ack=341 Win=65152 Len=17 TSval=3806092151 TSecr=1681832442
1712183276.632037401   237 0.741416224    10.10.1.2 → 10.10.1.1    TCP 83 34854 → 8081 [PSH, ACK] Seq=341 Ack=341 Win=64256 Len=17 TSval=1681832452 TSecr=3806092151
1712183278.632037401   239 0.741552926    10.10.1.1 → 10.10.1.2    TCP 83 8081 → 34854 [PSH, ACK] Seq=341 Ack=358 Win=65152 Len=17 TSval=3806092162 TSecr=1681832452
1712183286.632037401   247 0.751768542    10.10.1.2 → 10.10.1.1    TCP 83 34854 → 8081 [PSH, ACK] Seq=358 Ack=358 Win=64256 Len=17 TSval=1681832463 TSecr=3806092162
1712183288.632037401   249 0.751907144    10.10.1.1 → 10.10.1.2    TCP 83 8081 → 34854 [PSH, ACK] Seq=358 Ack=375 Win=65152 Len=17 TSval=3806092172 TSecr=1681832463
1712183296.632037401   257 0.762122008    10.10.1.2 → 10.10.1.1    TCP 83 34854 → 8081 [PSH, ACK] Seq=375 Ack=375 Win=64256 Len=17 TSval=1681832473 TSecr=3806092172
1712183298.632037401   259 0.762251808    10.10.1.1 → 10.10.1.2    TCP 83 8081 → 34854 [PSH, ACK] Seq=375 Ack=392 Win=65152 Len=17 TSval=3806092182 TSecr=1681832473
1712183306.632037401   267 0.772468060    10.10.1.2 → 10.10.1.1    TCP 83 34854 → 8081 [PSH, ACK] Seq=392 Ack=392 Win=64256 Len=17 TSval=1681832483 TSecr=3806092182
1712183308.632037401   269 0.772597077    10.10.1.1 → 10.10.1.2    TCP 83 8081 → 34854 [PSH, ACK] Seq=392 Ack=409 Win=65152 Len=17 TSval=3806092193 TSecr=1681832483
1712183316.632037401   277 0.782812950    10.10.1.2 → 10.10.1.1    TCP 83 34854 → 8081 [PSH, ACK] Seq=409 Ack=409 Win=64256 Len=17 TSval=1681832494 TSecr=3806092193
1712183318.632037401   279 0.782952222    10.10.1.1 → 10.10.1.2    TCP 83 8081 → 34854 [PSH, ACK] Seq=409 Ack=426 Win=65152 Len=17 TSval=3806092203 TSecr=1681832494
1712183326.632037401   287 0.793166918    10.10.1.2 → 10.10.1.1    TCP 83 34854 → 8081 [PSH, ACK] Seq=426 Ack=426 Win=64256 Len=17 TSval=1681832504 TSecr=3806092203
1712183328.632037401   289 0.793305790    10.10.1.1 → 10.10.1.2    TCP 83 8081 → 34854 [PSH, ACK] Seq=426 Ack=443 Win=65152 Len=17 TSval=3806092213 TSecr=1681832504
1712183336.632037401   297 0.803521132    10.10.1.2 → 10.10.1.1    TCP 83 34854 → 8081 [PSH, ACK] Seq=443 Ack=443 Win=64256 Len=17 TSval=1681832514 TSecr=3806092213
1712183338.632037401   299 0.803649885    10.10.1.1 → 10.10.1.2    TCP 83 8081 → 34854 [PSH, ACK] Seq=443 Ack=460 Win=65152 Len=17 TSval=3806092224 TSecr=1681832514
1712183346.632037401   307 0.813866010    10.10.1.2 → 10.10.1.1    TCP 83 34854 → 8081 [PSH, ACK] Seq=460 Ack=460 Win=64256 Len=17 TSval=1681832525 TSecr=3806092224
1712183348.632037401   309 0.813995138    10.10.1.1 → 10.10.1.2    TCP 83 8081 → 34854 [PSH, ACK] Seq=460 Ack=477 Win=65152 Len=17 TSval=3806092234 TSecr=1681832525
1712183356.632037401   317 0.824214210    10.10.1.2 → 10.10.1.1    TCP 83 34854 → 8081 [PSH, ACK] Seq=477 Ack=477 Win=64256 Len=17 TSval=1681832535 TSecr=3806092234
1712183358.632037401   319 0.824353767    10.10.1.1 → 10.10.1.2    TCP 83 8081 → 34854 [PSH, ACK] Seq=477 Ack=494 Win=65152 Len=17 TSval=3806092244 TSecr=1681832535
1712183366.632037401   327 0.834577046    10.10.1.2 → 10.10.1.1    TCP 83 34854 → 8081 [PSH, ACK] Seq=494 Ack=494 Win=64256 Len=17 TSval=1681832545 TSecr=3806092244
1712183368.632037401   329 0.834713256    10.10.1.1 → 10.10.1.2    TCP 83 8081 → 34854 [PSH, ACK] Seq=494 Ack=511 Win=65152 Len=17 TSval=3806092255 TSecr=1681832545
1712183376.632037401   337 0.844929433    10.10.1.2 → 10.10.1.1    TCP 83 34854 → 8081 [PSH, ACK] Seq=511 Ack=511 Win=64256 Len=17 TSval=1681832556 TSecr=3806092255
1712183378.632037401   339 0.845068094    10.10.1.1 → 10.10.1.2    TCP 83 8081 → 34854 [PSH, ACK] Seq=511 Ack=528 Win=65152 Len=17 TSval=3806092265 TSecr=1681832556
1712183386.632037401   347 0.855285312    10.10.1.2 → 10.10.1.1    TCP 83 34854 → 8081 [PSH, ACK] Seq=528 Ack=528 Win=64256 Len=17 TSval=1681832566 TSecr=3806092265
1712183388.632037401   349 0.855423063    10.10.1.1 → 10.10.1.2    TCP 83 8081 → 34854 [PSH, ACK] Seq=528 Ack=545 Win=65152 Len=17 TSval=3806092276 TSecr=1681832566
1712183396.632037401   357 0.865641456    10.10.1.2 → 10.10.1.1    TCP 83 34854 → 8081 [PSH, ACK] Seq=545 Ack=545 Win=64256 Len=17 TSval=1681832577 TSecr=3806092276
1712183398.632037401   359 0.865770801    10.10.1.1 → 10.10.1.2    TCP 83 8081 → 34854 [PSH, ACK] Seq=545 Ack=562 Win=65152 Len=17 TSval=3806092286 TSecr=1681832577
1712183406.632037401   367 0.875989975    10.10.1.2 → 10.10.1.1    TCP 83 34854 → 8081 [PSH, ACK] Seq=562 Ack=562 Win=64256 Len=17 TSval=1681832587 TSecr=3806092286
1712183408.632037401   369 0.876126241    10.10.1.1 → 10.10.1.2    TCP 83 8081 → 34854 [PSH, ACK] Seq=562 Ack=579 Win=65152 Len=17 TSval=3806092296 TSecr=1681832587
1712183416.632037401   377 0.886343478    10.10.1.2 → 10.10.1.1    TCP 83 34854 → 8081 [PSH, ACK] Seq=579 Ack=579 Win=64256 Len=17 TSval=1681832597 TSecr=3806092296
1712183418.632037401   379 0.886481001    10.10.1.1 → 10.10.1.2    TCP 83 8081 → 34854 [PSH, ACK] Seq=579 Ack=596 Win=65152 Len=17 TSval=3806092307 TSecr=1681832597
1712183426.632037401   387 0.896699441    10.10.1.2 → 10.10.1.1    TCP 83 34854 → 8081 [PSH, ACK] Seq=596 Ack=596 Win=64256 Len=17 TSval=1681832608 TSecr=3806092307
1712183428.632037401   389 0.896836398    10.10.1.1 → 10.10.1.2    TCP 83 8081 → 34854 [PSH, ACK] Seq=596 Ack=613 Win=65152 Len=17 TSval=3806092317 TSecr=1681832608
1712183437.632037401   398 0.907053837    10.10.1.2 → 10.10.1.1    TCP 83 34854 → 8081 [PSH, ACK] Seq=613 Ack=613 Win=64256 Len=17 TSval=1681832618 TSecr=3806092317
1712183439.632037401   400 0.907183048    10.10.1.1 → 10.10.1.2    TCP 83 8081 → 34854 [PSH, ACK] Seq=613 Ack=630 Win=65152 Len=17 TSval=3806092327 TSecr=1681832618
1712183446.632037401   407 0.917397527    10.10.1.2 → 10.10.1.1    TCP 83 34854 → 8081 [PSH, ACK] Seq=630 Ack=630 Win=64256 Len=17 TSval=1681832628 TSecr=3806092327
1712183448.632037401   409 0.917527892    10.10.1.1 → 10.10.1.2    TCP 83 8081 → 34854 [PSH, ACK] Seq=630 Ack=647 Win=65152 Len=17 TSval=3806092338 TSecr=1681832628
1712183456.632037401   417 0.927746125    10.10.1.2 → 10.10.1.1    TCP 83 34854 → 8081 [PSH, ACK] Seq=647 Ack=647 Win=64256 Len=17 TSval=1681832639 TSecr=3806092338
1712183458.632037401   419 0.927880821    10.10.1.1 → 10.10.1.2    TCP 83 8081 → 34854 [PSH, ACK] Seq=647 Ack=664 Win=65152 Len=17 TSval=3806092348 TSecr=1681832639
1712183466.632037401   427 0.938099168    10.10.1.2 → 10.10.1.1    TCP 83 34854 → 8081 [PSH, ACK] Seq=664 Ack=664 Win=64256 Len=17 TSval=1681832649 TSecr=3806092348
1712183468.632037401   429 0.938233770    10.10.1.1 → 10.10.1.2    TCP 83 8081 → 34854 [PSH, ACK] Seq=664 Ack=681 Win=65152 Len=17 TSval=3806092358 TSecr=1681832649
1712183476.632037401   437 0.948450042    10.10.1.2 → 10.10.1.1    TCP 83 34854 → 8081 [PSH, ACK] Seq=681 Ack=681 Win=64256 Len=17 TSval=1681832659 TSecr=3806092358
1712183478.632037401   439 0.948579593    10.10.1.1 → 10.10.1.2    TCP 83 8081 → 34854 [PSH, ACK] Seq=681 Ack=698 Win=65152 Len=17 TSval=3806092369 TSecr=1681832659
1712183486.632037401   447 0.958796653    10.10.1.2 → 10.10.1.1    TCP 83 34854 → 8081 [PSH, ACK] Seq=698 Ack=698 Win=64256 Len=17 TSval=1681832670 TSecr=3806092369
1712183489.632037401   450 0.958952773    10.10.1.1 → 10.10.1.2    TCP 83 8081 → 34854 [PSH, ACK] Seq=698 Ack=715 Win=65152 Len=17 TSval=3806092379 TSecr=1681832670
1712183496.632037401   457 0.969171058    10.10.1.2 → 10.10.1.1    TCP 83 34854 → 8081 [PSH, ACK] Seq=715 Ack=715 Win=64256 Len=17 TSval=1681832680 TSecr=3806092379
1712183498.632037401   459 0.969305197    10.10.1.1 → 10.10.1.2    TCP 83 8081 → 34854 [PSH, ACK] Seq=715 Ack=732 Win=65152 Len=17 TSval=3806092389 TSecr=1681832680
1712183506.632037401   467 0.979523455    10.10.1.2 → 10.10.1.1    TCP 83 34854 → 8081 [PSH, ACK] Seq=732 Ack=732 Win=64256 Len=17 TSval=1681832690 TSecr=3806092389
1712183508.632037401   469 0.979660190    10.10.1.1 → 10.10.1.2    TCP 83 8081 → 34854 [PSH, ACK] Seq=732 Ack=749 Win=65152 Len=17 TSval=3806092400 TSecr=1681832690
1712183516.632037401   477 0.989877215    10.10.1.2 → 10.10.1.1    TCP 83 34854 → 8081 [PSH, ACK] Seq=749 Ack=749 Win=64256 Len=17 TSval=1681832701 TSecr=3806092400
1712183518.632037401   479 0.990012670    10.10.1.1 → 10.10.1.2    TCP 83 8081 → 34854 [PSH, ACK] Seq=749 Ack=766 Win=65152 Len=17 TSval=3806092410 TSecr=1681832701
1712183526.632037401   487 1.000228683    10.10.1.2 → 10.10.1.1    TCP 83 34854 → 8081 [PSH, ACK] Seq=766 Ack=766 Win=64256 Len=17 TSval=1681832711 TSecr=3806092410
1712183528.632037401   489 1.000366269    10.10.1.1 → 10.10.1.2    TCP 83 8081 → 34854 [PSH, ACK] Seq=766 Ack=783 Win=65152 Len=17 TSval=3806092420 TSecr=1681832711
1712183536.632037401   497 1.010584691    10.10.1.2 → 10.10.1.1    TCP 83 34854 → 8081 [PSH, ACK] Seq=783 Ack=783 Win=64256 Len=17 TSval=1681832721 TSecr=3806092420
1712183538.632037401   499 1.010723128    10.10.1.1 → 10.10.1.2    TCP 83 8081 → 34854 [PSH, ACK] Seq=783 Ack=800 Win=65152 Len=17 TSval=3806092431 TSecr=1681832721
1712183546.632037401   507 1.020941244    10.10.1.2 → 10.10.1.1    TCP 83 34854 → 8081 [PSH, ACK] Seq=800 Ack=800 Win=64256 Len=17 TSval=1681832732 TSecr=3806092431
1712183548.632037401   509 1.021076726    10.10.1.1 → 10.10.1.2    TCP 83 8081 → 34854 [PSH, ACK] Seq=800 Ack=817 Win=65152 Len=17 TSval=3806092441 TSecr=1681832732
1712183556.632037401   517 1.031294806    10.10.1.2 → 10.10.1.1    TCP 83 34854 → 8081 [PSH, ACK] Seq=817 Ack=817 Win=64256 Len=17 TSval=1681832742 TSecr=3806092441
1712183558.632037401   519 1.031430031    10.10.1.1 → 10.10.1.2    TCP 83 8081 → 34854 [PSH, ACK] Seq=817 Ack=834 Win=65152 Len=17 TSval=3806092452 TSecr=1681832742
1712183566.632037401   527 1.041647103    10.10.1.2 → 10.10.1.1    TCP 83 34854 → 8081 [PSH, ACK] Seq=834 Ack=834 Win=64256 Len=17 TSval=1681832753 TSecr=3806092452
1712183568.632037401   529 1.041786865    10.10.1.1 → 10.10.1.2    TCP 83 8081 → 34854 [PSH, ACK] Seq=834 Ack=851 Win=65152 Len=17 TSval=3806092462 TSecr=1681832753
1712183576.632037401   537 1.052003107    10.10.1.2 → 10.10.1.1    TCP 83 34854 → 8081 [PSH, ACK] Seq=851 Ack=851 Win=64256 Len=17 TSval=1681832763 TSecr=3806092462
1712183578.632037401   539 1.052141568    10.10.1.1 → 10.10.1.2    TCP 83 8081 → 34854 [PSH, ACK] Seq=851 Ack=868 Win=65152 Len=17 TSval=3806092472 TSecr=1681832763
1712183586.632037401   547 1.062358501    10.10.1.2 → 10.10.1.1    TCP 83 34854 → 8081 [PSH, ACK] Seq=868 Ack=868 Win=64256 Len=17 TSval=1681832773 TSecr=3806092472
1712183588.632037401   549 1.062494819    10.10.1.1 → 10.10.1.2    TCP 83 8081 → 34854 [PSH, ACK] Seq=868 Ack=885 Win=65152 Len=17 TSval=3806092483 TSecr=1681832773
1712183596.632037401   557 1.072709584    10.10.1.2 → 10.10.1.1    TCP 83 34854 → 8081 [PSH, ACK] Seq=885 Ack=885 Win=64256 Len=17 TSval=1681832784 TSecr=3806092483
1712183598.632037401   559 1.072838755    10.10.1.1 → 10.10.1.2    TCP 83 8081 → 34854 [PSH, ACK] Seq=885 Ack=902 Win=65152 Len=17 TSval=3806092493 TSecr=1681832784
1712183606.632037401   567 1.083057148    10.10.1.2 → 10.10.1.1    TCP 83 34854 → 8081 [PSH, ACK] Seq=902 Ack=902 Win=64256 Len=17 TSval=1681832794 TSecr=3806092493
1712183608.632037401   569 1.083192569    10.10.1.1 → 10.10.1.2    TCP 83 8081 → 34854 [PSH, ACK] Seq=902 Ack=919 Win=65152 Len=17 TSval=3806092503 TSecr=1681832794
1712183616.632037401   577 1.093408208    10.10.1.2 → 10.10.1.1    TCP 83 34854 → 8081 [PSH, ACK] Seq=919 Ack=919 Win=64256 Len=17 TSval=1681832804 TSecr=3806092503
1712183618.632037401   579 1.093546410    10.10.1.1 → 10.10.1.2    TCP 83 8081 → 34854 [PSH, ACK] Seq=919 Ack=936 Win=65152 Len=17 TSval=3806092514 TSecr=1681832804
1712183626.632037401   587 1.103762556    10.10.1.2 → 10.10.1.1    TCP 83 34854 → 8081 [PSH, ACK] Seq=936 Ack=936 Win=64256 Len=17 TSval=1681832815 TSecr=3806092514
1712183628.632037401   589 1.103891637    10.10.1.1 → 10.10.1.2    TCP 83 8081 → 34854 [PSH, ACK] Seq=936 Ack=953 Win=65152 Len=17 TSval=3806092524 TSecr=1681832815
1712183636.632037401   597 1.114108022    10.10.1.2 → 10.10.1.1    TCP 83 34854 → 8081 [PSH, ACK] Seq=953 Ack=953 Win=64256 Len=17 TSval=1681832825 TSecr=3806092524
1712183639.632037401   600 1.114291457    10.10.1.1 → 10.10.1.2    TCP 83 8081 → 34854 [PSH, ACK] Seq=953 Ack=970 Win=65152 Len=17 TSval=3806092534 TSecr=1681832825
1712183646.632037401   607 1.124509637    10.10.1.2 → 10.10.1.1    TCP 83 34854 → 8081 [PSH, ACK] Seq=970 Ack=970 Win=64256 Len=17 TSval=1681832835 TSecr=3806092534
1712183648.632037401   609 1.124639111    10.10.1.1 → 10.10.1.2    TCP 83 8081 → 34854 [PSH, ACK] Seq=970 Ack=987 Win=65152 Len=17 TSval=3806092545 TSecr=1681832835
1712183656.632037401   617 1.134861509    10.10.1.2 → 10.10.1.1    TCP 83 34854 → 8081 [PSH, ACK] Seq=987 Ack=987 Win=64256 Len=17 TSval=1681832846 TSecr=3806092545
1712183658.632037401   619 1.135000085    10.10.1.1 → 10.10.1.2    TCP 83 8081 → 34854 [PSH, ACK] Seq=987 Ack=1004 Win=65152 Len=17 TSval=3806092555 TSecr=1681832846
1712183666.632037401   627 1.145217913    10.10.1.2 → 10.10.1.1    TCP 83 34854 → 8081 [PSH, ACK] Seq=1004 Ack=1004 Win=64256 Len=17 TSval=1681832856 TSecr=3806092555
1712183668.632037401   629 1.145355287    10.10.1.1 → 10.10.1.2    TCP 83 8081 → 34854 [PSH, ACK] Seq=1004 Ack=1021 Win=65152 Len=17 TSval=3806092565 TSecr=1681832856
1712183676.632037401   637 1.155571733    10.10.1.2 → 10.10.1.1    TCP 83 34854 → 8081 [PSH, ACK] Seq=1021 Ack=1021 Win=64256 Len=17 TSval=1681832866 TSecr=3806092565
1712183678.632037401   639 1.155712374    10.10.1.1 → 10.10.1.2    TCP 83 8081 → 34854 [PSH, ACK] Seq=1021 Ack=1038 Win=65152 Len=17 TSval=3806092576 TSecr=1681832866
1712183686.632037401   647 1.165939808    10.10.1.2 → 10.10.1.1    TCP 83 34854 → 8081 [PSH, ACK] Seq=1038 Ack=1038 Win=64256 Len=17 TSval=1681832877 TSecr=3806092576
1712183688.632037401   649 1.166075909    10.10.1.1 → 10.10.1.2    TCP 83 8081 → 34854 [PSH, ACK] Seq=1038 Ack=1055 Win=65152 Len=17 TSval=3806092586 TSecr=1681832877
1712183696.632037401   657 1.176290551    10.10.1.2 → 10.10.1.1    TCP 83 34854 → 8081 [PSH, ACK] Seq=1055 Ack=1055 Win=64256 Len=17 TSval=1681832887 TSecr=3806092586
1712183698.632037401   659 1.176419856    10.10.1.1 → 10.10.1.2    TCP 83 8081 → 34854 [PSH, ACK] Seq=1055 Ack=1072 Win=65152 Len=17 TSval=3806092597 TSecr=1681832887
1712183706.632037401   667 1.186634515    10.10.1.2 → 10.10.1.1    TCP 83 34854 → 8081 [PSH, ACK] Seq=1072 Ack=1072 Win=64256 Len=17 TSval=1681832898 TSecr=3806092597
1712183708.632037401   669 1.186763700    10.10.1.1 → 10.10.1.2    TCP 83 8081 → 34854 [PSH, ACK] Seq=1072 Ack=1089 Win=65152 Len=17 TSval=3806092607 TSecr=1681832898
1712183716.632037401   677 1.196979738    10.10.1.2 → 10.10.1.1    TCP 83 34854 → 8081 [PSH, ACK] Seq=1089 Ack=1089 Win=64256 Len=17 TSval=1681832908 TSecr=3806092607
1712183718.632037401   679 1.197109169    10.10.1.1 → 10.10.1.2    TCP 83 8081 → 34854 [PSH, ACK] Seq=1089 Ack=1106 Win=65152 Len=17 TSval=3806092617 TSecr=1681832908
1712183726.632037401   687 1.207326247    10.10.1.2 → 10.10.1.1    TCP 83 34854 → 8081 [PSH, ACK] Seq=1106 Ack=1106 Win=64256 Len=17 TSval=1681832918 TSecr=3806092617
1712183728.632037401   689 1.207462010    10.10.1.1 → 10.10.1.2    TCP 83 8081 → 34854 [PSH, ACK] Seq=1106 Ack=1123 Win=65152 Len=17 TSval=3806092628 TSecr=1681832918
1712183736.632037401   697 1.217679902    10.10.1.2 → 10.10.1.1    TCP 83 34854 → 8081 [PSH, ACK] Seq=1123 Ack=1123 Win=64256 Len=17 TSval=1681832929 TSecr=3806092628
1712183738.632037401   699 1.217818658    10.10.1.1 → 10.10.1.2    TCP 83 8081 → 34854 [PSH, ACK] Seq=1123 Ack=1140 Win=65152 Len=17 TSval=3806092638 TSecr=1681832929
1712183746.632037401   707 1.228037310    10.10.1.2 → 10.10.1.1    TCP 83 34854 → 8081 [PSH, ACK] Seq=1140 Ack=1140 Win=64256 Len=17 TSval=1681832939 TSecr=3806092638
1712183748.632037401   709 1.228175682    10.10.1.1 → 10.10.1.2    TCP 83 8081 → 34854 [PSH, ACK] Seq=1140 Ack=1157 Win=65152 Len=17 TSval=3806092648 TSecr=1681832939
1712183756.632037401   717 1.238394538    10.10.1.2 → 10.10.1.1    TCP 83 34854 → 8081 [PSH, ACK] Seq=1157 Ack=1157 Win=64256 Len=17 TSval=1681832949 TSecr=3806092648
1712183758.632037401   719 1.238532825    10.10.1.1 → 10.10.1.2    TCP 83 8081 → 34854 [PSH, ACK] Seq=1157 Ack=1174 Win=65152 Len=17 TSval=3806092659 TSecr=1681832949
1712183766.632037401   727 1.248751198    10.10.1.2 → 10.10.1.1    TCP 83 34854 → 8081 [PSH, ACK] Seq=1174 Ack=1174 Win=64256 Len=17 TSval=1681832960 TSecr=3806092659
1712183768.632037401   729 1.248889833    10.10.1.1 → 10.10.1.2    TCP 83 8081 → 34854 [PSH, ACK] Seq=1174 Ack=1191 Win=65152 Len=17 TSval=3806092669 TSecr=1681832960
1712183776.632037401   737 1.259109228    10.10.1.2 → 10.10.1.1    TCP 83 34854 → 8081 [PSH, ACK] Seq=1191 Ack=1191 Win=64256 Len=17 TSval=1681832970 TSecr=3806092669
1712183778.632037401   739 1.259246803    10.10.1.1 → 10.10.1.2    TCP 83 8081 → 34854 [PSH, ACK] Seq=1191 Ack=1208 Win=65152 Len=17 TSval=3806092679 TSecr=1681832970
1712183786.632037401   747 1.269470516    10.10.1.2 → 10.10.1.1    TCP 83 34854 → 8081 [PSH, ACK] Seq=1208 Ack=1208 Win=64256 Len=17 TSval=1681832980 TSecr=3806092679
1712183788.632037401   749 1.269599682    10.10.1.1 → 10.10.1.2    TCP 83 8081 → 34854 [PSH, ACK] Seq=1208 Ack=1225 Win=65152 Len=17 TSval=3806092690 TSecr=1681832980
1712183796.632037401   757 1.279813761    10.10.1.2 → 10.10.1.1    TCP 83 34854 → 8081 [PSH, ACK] Seq=1225 Ack=1225 Win=64256 Len=17 TSval=1681832991 TSecr=3806092690
1712183798.632037401   759 1.279943846    10.10.1.1 → 10.10.1.2    TCP 83 8081 → 34854 [PSH, ACK] Seq=1225 Ack=1242 Win=65152 Len=17 TSval=3806092700 TSecr=1681832991
1712183806.632037401   767 1.290161190    10.10.1.2 → 10.10.1.1    TCP 83 34854 → 8081 [PSH, ACK] Seq=1242 Ack=1242 Win=64256 Len=17 TSval=1681833001 TSecr=3806092700
1712183808.632037401   769 1.290299262    10.10.1.1 → 10.10.1.2    TCP 83 8081 → 34854 [PSH, ACK] Seq=1242 Ack=1259 Win=65152 Len=17 TSval=3806092710 TSecr=1681833001
1712183816.632037401   777 1.300516888    10.10.1.2 → 10.10.1.1    TCP 83 34854 → 8081 [PSH, ACK] Seq=1259 Ack=1259 Win=64256 Len=17 TSval=1681833011 TSecr=3806092710
1712183818.632037401   779 1.300656889    10.10.1.1 → 10.10.1.2    TCP 83 8081 → 34854 [PSH, ACK] Seq=1259 Ack=1276 Win=65152 Len=17 TSval=3806092721 TSecr=1681833011
1712183826.632037401   787 1.310872822    10.10.1.2 → 10.10.1.1    TCP 83 34854 → 8081 [PSH, ACK] Seq=1276 Ack=1276 Win=64256 Len=17 TSval=1681833022 TSecr=3806092721
1712183828.632037401   789 1.311011774    10.10.1.1 → 10.10.1.2    TCP 83 8081 → 34854 [PSH, ACK] Seq=1276 Ack=1293 Win=65152 Len=17 TSval=3806092731 TSecr=1681833022
1712183836.632037401   797 1.321231168    10.10.1.2 → 10.10.1.1    TCP 83 34854 → 8081 [PSH, ACK] Seq=1293 Ack=1293 Win=64256 Len=17 TSval=1681833032 TSecr=3806092731
1712183838.632037401   799 1.321366202    10.10.1.1 → 10.10.1.2    TCP 83 8081 → 34854 [PSH, ACK] Seq=1293 Ack=1310 Win=65152 Len=17 TSval=3806092741 TSecr=1681833032
1712183846.632037401   807 1.331583273    10.10.1.2 → 10.10.1.1    TCP 83 34854 → 8081 [PSH, ACK] Seq=1310 Ack=1310 Win=64256 Len=17 TSval=1681833042 TSecr=3806092741
1712183848.632037401   809 1.331718589    10.10.1.1 → 10.10.1.2    TCP 83 8081 → 34854 [PSH, ACK] Seq=1310 Ack=1327 Win=65152 Len=17 TSval=3806092752 TSecr=1681833042
1712183856.632037401   817 1.341935320    10.10.1.2 → 10.10.1.1    TCP 83 34854 → 8081 [PSH, ACK] Seq=1327 Ack=1327 Win=64256 Len=17 TSval=1681833053 TSecr=3806092752
1712183858.632037401   819 1.342072819    10.10.1.1 → 10.10.1.2    TCP 83 8081 → 34854 [PSH, ACK] Seq=1327 Ack=1344 Win=65152 Len=17 TSval=3806092762 TSecr=1681833053
1712183866.632037401   827 1.352287757    10.10.1.2 → 10.10.1.1    TCP 83 34854 → 8081 [PSH, ACK] Seq=1344 Ack=1344 Win=64256 Len=17 TSval=1681833063 TSecr=3806092762
1712183868.632037401   829 1.352417168    10.10.1.1 → 10.10.1.2    TCP 83 8081 → 34854 [PSH, ACK] Seq=1344 Ack=1361 Win=65152 Len=17 TSval=3806092773 TSecr=1681833063
1712183876.632037401   837 1.362634397    10.10.1.2 → 10.10.1.1    TCP 83 34854 → 8081 [PSH, ACK] Seq=1361 Ack=1361 Win=64256 Len=17 TSval=1681833074 TSecr=3806092773
1712183878.632037401   839 1.362771927    10.10.1.1 → 10.10.1.2    TCP 83 8081 → 34854 [PSH, ACK] Seq=1361 Ack=1378 Win=65152 Len=17 TSval=3806092783 TSecr=1681833074
1712183886.632037401   847 1.372988198    10.10.1.2 → 10.10.1.1    TCP 83 34854 → 8081 [PSH, ACK] Seq=1378 Ack=1378 Win=64256 Len=17 TSval=1681833084 TSecr=3806092783
1712183888.632037401   849 1.373117826    10.10.1.1 → 10.10.1.2    TCP 83 8081 → 34854 [PSH, ACK] Seq=1378 Ack=1395 Win=65152 Len=17 TSval=3806092793 TSecr=1681833084
1712183896.632037401   857 1.383334857    10.10.1.2 → 10.10.1.1    TCP 83 34854 → 8081 [PSH, ACK] Seq=1395 Ack=1395 Win=64256 Len=17 TSval=1681833094 TSecr=3806092793
1712183898.632037401   859 1.383464271    10.10.1.1 → 10.10.1.2    TCP 83 8081 → 34854 [PSH, ACK] Seq=1395 Ack=1412 Win=65152 Len=17 TSval=3806092804 TSecr=1681833094
1712183906.632037401   867 1.393682363    10.10.1.2 → 10.10.1.1    TCP 83 34854 → 8081 [PSH, ACK] Seq=1412 Ack=1412 Win=64256 Len=17 TSval=1681833105 TSecr=3806092804
1712183908.632037401   869 1.393821564    10.10.1.1 → 10.10.1.2    TCP 83 8081 → 34854 [PSH, ACK] Seq=1412 Ack=1429 Win=65152 Len=17 TSval=3806092814 TSecr=1681833105
1712183916.632037401   877 1.404038931    10.10.1.2 → 10.10.1.1    TCP 83 34854 → 8081 [PSH, ACK] Seq=1429 Ack=1429 Win=64256 Len=17 TSval=1681833115 TSecr=3806092814
1712183918.632037401   879 1.404174687    10.10.1.1 → 10.10.1.2    TCP 83 8081 → 34854 [PSH, ACK] Seq=1429 Ack=1446 Win=65152 Len=17 TSval=3806092824 TSecr=1681833115
1712183926.632037401   887 1.414392277    10.10.1.2 → 10.10.1.1    TCP 83 34854 → 8081 [PSH, ACK] Seq=1446 Ack=1446 Win=64256 Len=17 TSval=1681833125 TSecr=3806092824
1712183928.632037401   889 1.414528292    10.10.1.1 → 10.10.1.2    TCP 83 8081 → 34854 [PSH, ACK] Seq=1446 Ack=1463 Win=65152 Len=17 TSval=3806092835 TSecr=1681833125
1712183936.632037401   897 1.424746264    10.10.1.2 → 10.10.1.1    TCP 83 34854 → 8081 [PSH, ACK] Seq=1463 Ack=1463 Win=64256 Len=17 TSval=1681833136 TSecr=3806092835
1712183938.632037401   899 1.424884583    10.10.1.1 → 10.10.1.2    TCP 83 8081 → 34854 [PSH, ACK] Seq=1463 Ack=1480 Win=65152 Len=17 TSval=3806092845 TSecr=1681833136
1712183946.632037401   907 1.435106585    10.10.1.2 → 10.10.1.1    TCP 83 34854 → 8081 [PSH, ACK] Seq=1480 Ack=1480 Win=64256 Len=17 TSval=1681833146 TSecr=3806092845
1712183948.632037401   909 1.435244741    10.10.1.1 → 10.10.1.2    TCP 83 8081 → 34854 [PSH, ACK] Seq=1480 Ack=1497 Win=65152 Len=17 TSval=3806092855 TSecr=1681833146
1712183956.632037401   917 1.445462553    10.10.1.2 → 10.10.1.1    TCP 83 34854 → 8081 [PSH, ACK] Seq=1497 Ack=1497 Win=64256 Len=17 TSval=1681833156 TSecr=3806092855
1712183958.632037401   919 1.445602183    10.10.1.1 → 10.10.1.2    TCP 83 8081 → 34854 [PSH, ACK] Seq=1497 Ack=1514 Win=65152 Len=17 TSval=3806092866 TSecr=1681833156
1712183966.632037401   927 1.455820043    10.10.1.2 → 10.10.1.1    TCP 83 34854 → 8081 [PSH, ACK] Seq=1514 Ack=1514 Win=64256 Len=17 TSval=1681833167 TSecr=3806092866
1712183968.632037401   929 1.455950323    10.10.1.1 → 10.10.1.2    TCP 83 8081 → 34854 [PSH, ACK] Seq=1514 Ack=1531 Win=65152 Len=17 TSval=3806092876 TSecr=1681833167
1712183976.632037401   937 1.466168715    10.10.1.2 → 10.10.1.1    TCP 83 34854 → 8081 [PSH, ACK] Seq=1531 Ack=1531 Win=64256 Len=17 TSval=1681833177 TSecr=3806092876
1712183978.632037401   939 1.466307697    10.10.1.1 → 10.10.1.2    TCP 83 8081 → 34854 [PSH, ACK] Seq=1531 Ack=1548 Win=65152 Len=17 TSval=3806092886 TSecr=1681833177
1712183986.632037401   947 1.476521809    10.10.1.2 → 10.10.1.1    TCP 83 34854 → 8081 [PSH, ACK] Seq=1548 Ack=1548 Win=64256 Len=17 TSval=1681833187 TSecr=3806092886
1712183988.632037401   949 1.476650686    10.10.1.1 → 10.10.1.2    TCP 83 8081 → 34854 [PSH, ACK] Seq=1548 Ack=1565 Win=65152 Len=17 TSval=3806092897 TSecr=1681833187
1712183996.632037401   957 1.486867085    10.10.1.2 → 10.10.1.1    TCP 83 34854 → 8081 [PSH, ACK] Seq=1565 Ack=1565 Win=64256 Len=17 TSval=1681833198 TSecr=3806092897
1712183998.632037401   959 1.487002465    10.10.1.1 → 10.10.1.2    TCP 83 8081 → 34854 [PSH, ACK] Seq=1565 Ack=1582 Win=65152 Len=17 TSval=3806092907 TSecr=1681833198
1712184006.632037401   967 1.497220250    10.10.1.2 → 10.10.1.1    TCP 83 34854 → 8081 [PSH, ACK] Seq=1582 Ack=1582 Win=64256 Len=17 TSval=1681833208 TSecr=3806092907
1712184008.632037401   969 1.497356121    10.10.1.1 → 10.10.1.2    TCP 83 8081 → 34854 [PSH, ACK] Seq=1582 Ack=1599 Win=65152 Len=17 TSval=3806092917 TSecr=1681833208
1712184016.632037401   977 1.507526769    10.10.1.2 → 10.10.1.1    TCP 83 34854 → 8081 [PSH, ACK] Seq=1599 Ack=1599 Win=64256 Len=17 TSval=1681833218 TSecr=3806092917
1712184018.632037401   979 1.507658766    10.10.1.1 → 10.10.1.2    TCP 83 8081 → 34854 [PSH, ACK] Seq=1599 Ack=1616 Win=65152 Len=17 TSval=3806092928 TSecr=1681833218
1712184026.632037401   987 1.517874763    10.10.1.2 → 10.10.1.1    TCP 83 34854 → 8081 [PSH, ACK] Seq=1616 Ack=1616 Win=64256 Len=17 TSval=1681833229 TSecr=3806092928
1712184028.632037401   989 1.518012998    10.10.1.1 → 10.10.1.2    TCP 83 8081 → 34854 [PSH, ACK] Seq=1616 Ack=1633 Win=65152 Len=17 TSval=3806092938 TSecr=1681833229
1712184036.632037401   997 1.528231113    10.10.1.2 → 10.10.1.1    TCP 83 34854 → 8081 [PSH, ACK] Seq=1633 Ack=1633 Win=64256 Len=17 TSval=1681833239 TSecr=3806092938
1712184038.632037401   999 1.528360648    10.10.1.1 → 10.10.1.2    TCP 83 8081 → 34854 [PSH, ACK] Seq=1633 Ack=1650 Win=65152 Len=17 TSval=3806092948 TSecr=1681833239
1712184046.632037401  1007 1.538584723    10.10.1.2 → 10.10.1.1    TCP 83 34854 → 8081 [PSH, ACK] Seq=1650 Ack=1650 Win=64256 Len=17 TSval=1681833249 TSecr=3806092948
1712184048.632037401  1009 1.538722653    10.10.1.1 → 10.10.1.2    TCP 83 8081 → 34854 [PSH, ACK] Seq=1650 Ack=1667 Win=65152 Len=17 TSval=3806092959 TSecr=1681833249
1712184056.632037401  1017 1.548937975    10.10.1.2 → 10.10.1.1    TCP 83 34854 → 8081 [PSH, ACK] Seq=1667 Ack=1667 Win=64256 Len=17 TSval=1681833260 TSecr=3806092959
1712184058.632037401  1019 1.549067516    10.10.1.1 → 10.10.1.2    TCP 83 8081 → 34854 [PSH, ACK] Seq=1667 Ack=1684 Win=65152 Len=17 TSval=3806092969 TSecr=1681833260
1712184066.632037401  1027 1.559283088    10.10.1.2 → 10.10.1.1    TCP 83 34854 → 8081 [PSH, ACK] Seq=1684 Ack=1684 Win=64256 Len=17 TSval=1681833270 TSecr=3806092969
1712184068.632037401  1029 1.559412770    10.10.1.1 → 10.10.1.2    TCP 83 8081 → 34854 [PSH, ACK] Seq=1684 Ack=1701 Win=65152 Len=17 TSval=3806092980 TSecr=1681833270
1712184076.632037401  1037 1.569631742    10.10.1.2 → 10.10.1.1    TCP 83 34854 → 8081 [PSH, ACK] Seq=1701 Ack=1701 Win=64256 Len=17 TSval=1681833281 TSecr=3806092980
1712184078.632037401  1039 1.569766321    10.10.1.1 → 10.10.1.2    TCP 83 8081 → 34854 [PSH, ACK] Seq=1701 Ack=1718 Win=65152 Len=17 TSval=3806092990 TSecr=1681833281
1712184086.632037401  1047 1.579980983    10.10.1.2 → 10.10.1.1    TCP 83 34854 → 8081 [PSH, ACK] Seq=1718 Ack=1718 Win=64256 Len=17 TSval=1681833291 TSecr=3806092990
1712184088.632037401  1049 1.580117638    10.10.1.1 → 10.10.1.2    TCP 83 8081 → 34854 [PSH, ACK] Seq=1718 Ack=1735 Win=65152 Len=17 TSval=3806093000 TSecr=1681833291
1712184096.632037401  1057 1.590334273    10.10.1.2 → 10.10.1.1    TCP 83 34854 → 8081 [PSH, ACK] Seq=1735 Ack=1735 Win=64256 Len=17 TSval=1681833301 TSecr=3806093000
1712184098.632037401  1059 1.590471079    10.10.1.1 → 10.10.1.2    TCP 83 8081 → 34854 [PSH, ACK] Seq=1735 Ack=1752 Win=65152 Len=17 TSval=3806093011 TSecr=1681833301
1712184106.632037401  1067 1.600686682    10.10.1.2 → 10.10.1.1    TCP 83 34854 → 8081 [PSH, ACK] Seq=1752 Ack=1752 Win=64256 Len=17 TSval=1681833312 TSecr=3806093011
1712184108.632037401  1069 1.600815012    10.10.1.1 → 10.10.1.2    TCP 83 8081 → 34854 [PSH, ACK] Seq=1752 Ack=1769 Win=65152 Len=17 TSval=3806093021 TSecr=1681833312
1712184116.632037401  1077 1.611032398    10.10.1.2 → 10.10.1.1    TCP 83 34854 → 8081 [PSH, ACK] Seq=1769 Ack=1769 Win=64256 Len=17 TSval=1681833322 TSecr=3806093021
1712184118.632037401  1079 1.611169131    10.10.1.1 → 10.10.1.2    TCP 83 8081 → 34854 [PSH, ACK] Seq=1769 Ack=1786 Win=65152 Len=17 TSval=3806093031 TSecr=1681833322
1712184126.632037401  1087 1.621386360    10.10.1.2 → 10.10.1.1    TCP 83 34854 → 8081 [PSH, ACK] Seq=1786 Ack=1786 Win=64256 Len=17 TSval=1681833332 TSecr=3806093031
1712184128.632037401  1089 1.621526054    10.10.1.1 → 10.10.1.2    TCP 83 8081 → 34854 [PSH, ACK] Seq=1786 Ack=1803 Win=65152 Len=17 TSval=3806093042 TSecr=1681833332
1712184136.632037401  1097 1.631744359    10.10.1.2 → 10.10.1.1    TCP 83 34854 → 8081 [PSH, ACK] Seq=1803 Ack=1803 Win=64256 Len=17 TSval=1681833343 TSecr=3806093042
1712184138.632037401  1099 1.631881634    10.10.1.1 → 10.10.1.2    TCP 83 8081 → 34854 [PSH, ACK] Seq=1803 Ack=1820 Win=65152 Len=17 TSval=3806093052 TSecr=1681833343
1712184146.632037401  1107 1.642099458    10.10.1.2 → 10.10.1.1    TCP 83 34854 → 8081 [PSH, ACK] Seq=1820 Ack=1820 Win=64256 Len=17 TSval=1681833353 TSecr=3806093052
1712184148.632037401  1109 1.642238133    10.10.1.1 → 10.10.1.2    TCP 83 8081 → 34854 [PSH, ACK] Seq=1820 Ack=1837 Win=65152 Len=17 TSval=3806093062 TSecr=1681833353
1712184156.632037401  1117 1.652455827    10.10.1.2 → 10.10.1.1    TCP 83 34854 → 8081 [PSH, ACK] Seq=1837 Ack=1837 Win=64256 Len=17 TSval=1681833363 TSecr=3806093062
1712184158.632037401  1119 1.652586067    10.10.1.1 → 10.10.1.2    TCP 83 8081 → 34854 [PSH, ACK] Seq=1837 Ack=1854 Win=65152 Len=17 TSval=3806093073 TSecr=1681833363
1712184166.632037401  1127 1.662803872    10.10.1.2 → 10.10.1.1    TCP 83 34854 → 8081 [PSH, ACK] Seq=1854 Ack=1854 Win=64256 Len=17 TSval=1681833374 TSecr=3806093073
1712184168.632037401  1129 1.662940790    10.10.1.1 → 10.10.1.2    TCP 83 8081 → 34854 [PSH, ACK] Seq=1854 Ack=1871 Win=65152 Len=17 TSval=3806093083 TSecr=1681833374
1712184176.632037401  1137 1.673115048    10.10.1.2 → 10.10.1.1    TCP 83 34854 → 8081 [PSH, ACK] Seq=1871 Ack=1871 Win=64256 Len=17 TSval=1681833384 TSecr=3806093083
1712184178.632037401  1139 1.673245180    10.10.1.1 → 10.10.1.2    TCP 83 8081 → 34854 [PSH, ACK] Seq=1871 Ack=1888 Win=65152 Len=17 TSval=3806093093 TSecr=1681833384
1712184186.632037401  1147 1.683461912    10.10.1.2 → 10.10.1.1    TCP 83 34854 → 8081 [PSH, ACK] Seq=1888 Ack=1888 Win=64256 Len=17 TSval=1681833394 TSecr=3806093093
1712184188.632037401  1149 1.683590754    10.10.1.1 → 10.10.1.2    TCP 83 8081 → 34854 [PSH, ACK] Seq=1888 Ack=1905 Win=65152 Len=17 TSval=3806093104 TSecr=1681833394
1712184196.632037401  1157 1.693762196    10.10.1.2 → 10.10.1.1    TCP 83 34854 → 8081 [PSH, ACK] Seq=1905 Ack=1905 Win=64256 Len=17 TSval=1681833405 TSecr=3806093104
1712184198.632037401  1159 1.693891888    10.10.1.1 → 10.10.1.2    TCP 83 8081 → 34854 [PSH, ACK] Seq=1905 Ack=1922 Win=65152 Len=17 TSval=3806093114 TSecr=1681833405
1712184206.632037401  1167 1.704108363    10.10.1.2 → 10.10.1.1    TCP 83 34854 → 8081 [PSH, ACK] Seq=1922 Ack=1922 Win=64256 Len=17 TSval=1681833415 TSecr=3806093114
1712184209.632037401  1170 1.704291818    10.10.1.1 → 10.10.1.2    TCP 83 8081 → 34854 [PSH, ACK] Seq=1922 Ack=1939 Win=65152 Len=17 TSval=3806093124 TSecr=1681833415
1712184216.632037401  1177 1.714507600    10.10.1.2 → 10.10.1.1    TCP 83 34854 → 8081 [PSH, ACK] Seq=1939 Ack=1939 Win=64256 Len=17 TSval=1681833425 TSecr=3806093124
1712184218.632037401  1179 1.714636810    10.10.1.1 → 10.10.1.2    TCP 83 8081 → 34854 [PSH, ACK] Seq=1939 Ack=1956 Win=65152 Len=17 TSval=3806093135 TSecr=1681833425
1712184226.632037401  1187 1.724852224    10.10.1.2 → 10.10.1.1    TCP 83 34854 → 8081 [PSH, ACK] Seq=1956 Ack=1956 Win=64256 Len=17 TSval=1681833436 TSecr=3806093135
1712184228.632037401  1189 1.724990254    10.10.1.1 → 10.10.1.2    TCP 83 8081 → 34854 [PSH, ACK] Seq=1956 Ack=1973 Win=65152 Len=17 TSval=3806093145 TSecr=1681833436
1712184236.632037401  1197 1.735206346    10.10.1.2 → 10.10.1.1    TCP 83 34854 → 8081 [PSH, ACK] Seq=1973 Ack=1973 Win=64256 Len=17 TSval=1681833446 TSecr=3806093145
1712184238.632037401  1199 1.735344664    10.10.1.1 → 10.10.1.2    TCP 83 8081 → 34854 [PSH, ACK] Seq=1973 Ack=1990 Win=65152 Len=17 TSval=3806093155 TSecr=1681833446
1712184247.632037401  1208 1.745561362    10.10.1.2 → 10.10.1.1    TCP 83 34854 → 8081 [PSH, ACK] Seq=1990 Ack=1990 Win=64256 Len=17 TSval=1681833456 TSecr=3806093155
1712184249.632037401  1210 1.745690362    10.10.1.1 → 10.10.1.2    TCP 83 8081 → 34854 [PSH, ACK] Seq=1990 Ack=2007 Win=65152 Len=17 TSval=3806093166 TSecr=1681833456
