1712099025.508027792    24 0.266361622    10.10.1.2 → 10.10.1.1    TCP 74 39954 → 8081 [SYN] Seq=0 Win=64240 Len=0 MSS=1460 SACK_PERM=1 TSval=1597793782 TSecr=0 WS=128
1712099026.508027792    25 0.266409553    10.10.1.1 → 10.10.1.2    TCP 74 8081 → 39954 [SYN, ACK] Seq=0 Ack=1 Win=65160 Len=0 MSS=1460 SACK_PERM=1 TSval=3722053490 TSecr=1597793782 WS=128
1712099027.508027792    26 0.266481907    10.10.1.2 → 10.10.1.1    TCP 66 39954 → 8081 [ACK] Seq=1 Ack=1 Win=64256 Len=0 TSval=1597793782 TSecr=3722053490
1712099030.508027792    29 0.525636082    10.10.1.2 → 10.10.1.1    TCP 83 39954 → 8081 [PSH, ACK] Seq=1 Ack=1 Win=64256 Len=17 TSval=1597794041 TSecr=3722053490
1712099032.508027792    31 0.525665191    10.10.1.1 → 10.10.1.2    TCP 66 8081 → 39954 [ACK] Seq=1 Ack=18 Win=65152 Len=0 TSval=3722053750 TSecr=1597794041
1712099034.508027792    33 0.525947008    10.10.1.1 → 10.10.1.2    TCP 83 8081 → 39954 [PSH, ACK] Seq=1 Ack=18 Win=65152 Len=17 TSval=3722053750 TSecr=1597794041
1712099035.508027792    34 0.525996229    10.10.1.2 → 10.10.1.1    TCP 66 39954 → 8081 [ACK] Seq=18 Ack=18 Win=64256 Len=0 TSval=1597794042 TSecr=3722053750
1712099039.508027792    38 0.536164230    10.10.1.2 → 10.10.1.1    TCP 83 39954 → 8081 [PSH, ACK] Seq=18 Ack=18 Win=64256 Len=17 TSval=1597794052 TSecr=3722053750
1712099041.508027792    40 0.536290526    10.10.1.1 → 10.10.1.2    TCP 83 8081 → 39954 [PSH, ACK] Seq=18 Ack=35 Win=65152 Len=17 TSval=3722053760 TSecr=1597794052
1712099045.508027792    44 0.546505650    10.10.1.2 → 10.10.1.1    TCP 83 39954 → 8081 [PSH, ACK] Seq=35 Ack=35 Win=64256 Len=17 TSval=1597794062 TSecr=3722053760
1712099047.508027792    46 0.546636351    10.10.1.1 → 10.10.1.2    TCP 83 8081 → 39954 [PSH, ACK] Seq=35 Ack=52 Win=65152 Len=17 TSval=3722053771 TSecr=1597794062
1712099052.508027792    51 0.556846635    10.10.1.2 → 10.10.1.1    TCP 83 39954 → 8081 [PSH, ACK] Seq=52 Ack=52 Win=64256 Len=17 TSval=1597794072 TSecr=3722053771
1712099054.508027792    53 0.556976734    10.10.1.1 → 10.10.1.2    TCP 83 8081 → 39954 [PSH, ACK] Seq=52 Ack=69 Win=65152 Len=17 TSval=3722053781 TSecr=1597794072
1712099058.508027792    57 0.567188996    10.10.1.2 → 10.10.1.1    TCP 83 39954 → 8081 [PSH, ACK] Seq=69 Ack=69 Win=64256 Len=17 TSval=1597794083 TSecr=3722053781
1712099060.508027792    59 0.567328801    10.10.1.1 → 10.10.1.2    TCP 83 8081 → 39954 [PSH, ACK] Seq=69 Ack=86 Win=65152 Len=17 TSval=3722053791 TSecr=1597794083
1712099065.508027792    64 0.577540248    10.10.1.2 → 10.10.1.1    TCP 83 39954 → 8081 [PSH, ACK] Seq=86 Ack=86 Win=64256 Len=17 TSval=1597794093 TSecr=3722053791
1712099067.508027792    66 0.577679510    10.10.1.1 → 10.10.1.2    TCP 83 8081 → 39954 [PSH, ACK] Seq=86 Ack=103 Win=65152 Len=17 TSval=3722053802 TSecr=1597794093
1712099071.508027792    70 0.587891483    10.10.1.2 → 10.10.1.1    TCP 83 39954 → 8081 [PSH, ACK] Seq=103 Ack=103 Win=64256 Len=17 TSval=1597794103 TSecr=3722053802
1712099073.508027792    72 0.588021345    10.10.1.1 → 10.10.1.2    TCP 83 8081 → 39954 [PSH, ACK] Seq=103 Ack=120 Win=65152 Len=17 TSval=3722053812 TSecr=1597794103
1712099078.508027792    77 0.598234388    10.10.1.2 → 10.10.1.1    TCP 83 39954 → 8081 [PSH, ACK] Seq=120 Ack=120 Win=64256 Len=17 TSval=1597794114 TSecr=3722053812
1712099080.508027792    79 0.598373196    10.10.1.1 → 10.10.1.2    TCP 83 8081 → 39954 [PSH, ACK] Seq=120 Ack=137 Win=65152 Len=17 TSval=3722053822 TSecr=1597794114
1712099085.508027792    84 0.608582784    10.10.1.2 → 10.10.1.1    TCP 83 39954 → 8081 [PSH, ACK] Seq=137 Ack=137 Win=64256 Len=17 TSval=1597794124 TSecr=3722053822
1712099087.508027792    86 0.608712669    10.10.1.1 → 10.10.1.2    TCP 83 8081 → 39954 [PSH, ACK] Seq=137 Ack=154 Win=65152 Len=17 TSval=3722053833 TSecr=1597794124
1712099091.508027792    90 0.618925802    10.10.1.2 → 10.10.1.1    TCP 83 39954 → 8081 [PSH, ACK] Seq=154 Ack=154 Win=64256 Len=17 TSval=1597794135 TSecr=3722053833
1712099093.508027792    92 0.619056289    10.10.1.1 → 10.10.1.2    TCP 83 8081 → 39954 [PSH, ACK] Seq=154 Ack=171 Win=65152 Len=17 TSval=3722053843 TSecr=1597794135
1712099097.508027792    96 0.629268757    10.10.1.2 → 10.10.1.1    TCP 83 39954 → 8081 [PSH, ACK] Seq=171 Ack=171 Win=64256 Len=17 TSval=1597794145 TSecr=3722053843
1712099099.508027792    98 0.629399272    10.10.1.1 → 10.10.1.2    TCP 83 8081 → 39954 [PSH, ACK] Seq=171 Ack=188 Win=65152 Len=17 TSval=3722053853 TSecr=1597794145
1712099104.508027792   103 0.639611170    10.10.1.2 → 10.10.1.1    TCP 83 39954 → 8081 [PSH, ACK] Seq=188 Ack=188 Win=64256 Len=17 TSval=1597794155 TSecr=3722053853
1712099106.508027792   105 0.639741789    10.10.1.1 → 10.10.1.2    TCP 83 8081 → 39954 [PSH, ACK] Seq=188 Ack=205 Win=65152 Len=17 TSval=3722053864 TSecr=1597794155
1712099110.508027792   109 0.649878575    10.10.1.2 → 10.10.1.1    TCP 83 39954 → 8081 [PSH, ACK] Seq=205 Ack=205 Win=64256 Len=17 TSval=1597794166 TSecr=3722053864
1712099112.508027792   111 0.650013910    10.10.1.1 → 10.10.1.2    TCP 83 8081 → 39954 [PSH, ACK] Seq=205 Ack=222 Win=65152 Len=17 TSval=3722053874 TSecr=1597794166
1712099117.508027792   116 0.660224156    10.10.1.2 → 10.10.1.1    TCP 83 39954 → 8081 [PSH, ACK] Seq=222 Ack=222 Win=64256 Len=17 TSval=1597794176 TSecr=3722053874
1712099119.508027792   118 0.660354243    10.10.1.1 → 10.10.1.2    TCP 83 8081 → 39954 [PSH, ACK] Seq=222 Ack=239 Win=65152 Len=17 TSval=3722053884 TSecr=1597794176
1712099123.508027792   122 0.670563014    10.10.1.2 → 10.10.1.1    TCP 83 39954 → 8081 [PSH, ACK] Seq=239 Ack=239 Win=64256 Len=17 TSval=1597794186 TSecr=3722053884
1712099125.508027792   124 0.670701306    10.10.1.1 → 10.10.1.2    TCP 83 8081 → 39954 [PSH, ACK] Seq=239 Ack=256 Win=65152 Len=17 TSval=3722053895 TSecr=1597794186
1712099130.508027792   129 0.680909875    10.10.1.2 → 10.10.1.1    TCP 83 39954 → 8081 [PSH, ACK] Seq=256 Ack=256 Win=64256 Len=17 TSval=1597794197 TSecr=3722053895
1712099132.508027792   131 0.681039242    10.10.1.1 → 10.10.1.2    TCP 83 8081 → 39954 [PSH, ACK] Seq=256 Ack=273 Win=65152 Len=17 TSval=3722053905 TSecr=1597794197
1712099136.508027792   135 0.691248768    10.10.1.2 → 10.10.1.1    TCP 83 39954 → 8081 [PSH, ACK] Seq=273 Ack=273 Win=64256 Len=17 TSval=1597794207 TSecr=3722053905
1712099138.508027792   137 0.691387980    10.10.1.1 → 10.10.1.2    TCP 83 8081 → 39954 [PSH, ACK] Seq=273 Ack=290 Win=65152 Len=17 TSval=3722053915 TSecr=1597794207
1712099143.508027792   142 0.701598028    10.10.1.2 → 10.10.1.1    TCP 83 39954 → 8081 [PSH, ACK] Seq=290 Ack=290 Win=64256 Len=17 TSval=1597794217 TSecr=3722053915
1712099145.508027792   144 0.701737270    10.10.1.1 → 10.10.1.2    TCP 83 8081 → 39954 [PSH, ACK] Seq=290 Ack=307 Win=65152 Len=17 TSval=3722053926 TSecr=1597794217
1712099149.508027792   148 0.711912812    10.10.1.2 → 10.10.1.1    TCP 83 39954 → 8081 [PSH, ACK] Seq=307 Ack=307 Win=64256 Len=17 TSval=1597794228 TSecr=3722053926
1712099151.508027792   150 0.712049734    10.10.1.1 → 10.10.1.2    TCP 83 8081 → 39954 [PSH, ACK] Seq=307 Ack=324 Win=65152 Len=17 TSval=3722053936 TSecr=1597794228
1712099156.508027792   155 0.722261273    10.10.1.2 → 10.10.1.1    TCP 83 39954 → 8081 [PSH, ACK] Seq=324 Ack=324 Win=64256 Len=17 TSval=1597794238 TSecr=3722053936
1712099158.508027792   157 0.722391204    10.10.1.1 → 10.10.1.2    TCP 83 8081 → 39954 [PSH, ACK] Seq=324 Ack=341 Win=65152 Len=17 TSval=3722053946 TSecr=1597794238
1712099162.508027792   161 0.732600516    10.10.1.2 → 10.10.1.1    TCP 83 39954 → 8081 [PSH, ACK] Seq=341 Ack=341 Win=64256 Len=17 TSval=1597794248 TSecr=3722053946
1712099164.508027792   163 0.732738635    10.10.1.1 → 10.10.1.2    TCP 83 8081 → 39954 [PSH, ACK] Seq=341 Ack=358 Win=65152 Len=17 TSval=3722053957 TSecr=1597794248
1712099169.508027792   168 0.742950301    10.10.1.2 → 10.10.1.1    TCP 83 39954 → 8081 [PSH, ACK] Seq=358 Ack=358 Win=64256 Len=17 TSval=1597794259 TSecr=3722053957
1712099171.508027792   170 0.743087487    10.10.1.1 → 10.10.1.2    TCP 83 8081 → 39954 [PSH, ACK] Seq=358 Ack=375 Win=65152 Len=17 TSval=3722053967 TSecr=1597794259
1712099175.508027792   174 0.753296082    10.10.1.2 → 10.10.1.1    TCP 83 39954 → 8081 [PSH, ACK] Seq=375 Ack=375 Win=64256 Len=17 TSval=1597794269 TSecr=3722053967
1712099177.508027792   176 0.753434554    10.10.1.1 → 10.10.1.2    TCP 83 8081 → 39954 [PSH, ACK] Seq=375 Ack=392 Win=65152 Len=17 TSval=3722053977 TSecr=1597794269
1712099182.508027792   181 0.763643180    10.10.1.2 → 10.10.1.1    TCP 83 39954 → 8081 [PSH, ACK] Seq=392 Ack=392 Win=64256 Len=17 TSval=1597794279 TSecr=3722053977
1712099184.508027792   183 0.763781579    10.10.1.1 → 10.10.1.2    TCP 83 8081 → 39954 [PSH, ACK] Seq=392 Ack=409 Win=65152 Len=17 TSval=3722053988 TSecr=1597794279
1712099188.508027792   187 0.773991071    10.10.1.2 → 10.10.1.1    TCP 83 39954 → 8081 [PSH, ACK] Seq=409 Ack=409 Win=64256 Len=17 TSval=1597794290 TSecr=3722053988
1712099190.508027792   189 0.774126509    10.10.1.1 → 10.10.1.2    TCP 83 8081 → 39954 [PSH, ACK] Seq=409 Ack=426 Win=65152 Len=17 TSval=3722053998 TSecr=1597794290
1712099195.508027792   194 0.784337763    10.10.1.2 → 10.10.1.1    TCP 83 39954 → 8081 [PSH, ACK] Seq=426 Ack=426 Win=64256 Len=17 TSval=1597794300 TSecr=3722053998
1712099197.508027792   196 0.784475866    10.10.1.1 → 10.10.1.2    TCP 83 8081 → 39954 [PSH, ACK] Seq=426 Ack=443 Win=65152 Len=17 TSval=3722054008 TSecr=1597794300
1712099201.508027792   200 0.794688211    10.10.1.2 → 10.10.1.1    TCP 83 39954 → 8081 [PSH, ACK] Seq=443 Ack=443 Win=64256 Len=17 TSval=1597794310 TSecr=3722054008
1712099203.508027792   202 0.794823462    10.10.1.1 → 10.10.1.2    TCP 83 8081 → 39954 [PSH, ACK] Seq=443 Ack=460 Win=65152 Len=17 TSval=3722054019 TSecr=1597794310
1712099208.508027792   207 0.805032784    10.10.1.2 → 10.10.1.1    TCP 83 39954 → 8081 [PSH, ACK] Seq=460 Ack=460 Win=64256 Len=17 TSval=1597794321 TSecr=3722054019
1712099210.508027792   209 0.805161929    10.10.1.1 → 10.10.1.2    TCP 83 8081 → 39954 [PSH, ACK] Seq=460 Ack=477 Win=65152 Len=17 TSval=3722054029 TSecr=1597794321
1712099214.508027792   213 0.815371030    10.10.1.2 → 10.10.1.1    TCP 83 39954 → 8081 [PSH, ACK] Seq=477 Ack=477 Win=64256 Len=17 TSval=1597794331 TSecr=3722054029
1712099216.508027792   215 0.815508741    10.10.1.1 → 10.10.1.2    TCP 83 8081 → 39954 [PSH, ACK] Seq=477 Ack=494 Win=65152 Len=17 TSval=3722054039 TSecr=1597794331
1712099221.508027792   220 0.825717922    10.10.1.2 → 10.10.1.1    TCP 83 39954 → 8081 [PSH, ACK] Seq=494 Ack=494 Win=64256 Len=17 TSval=1597794341 TSecr=3722054039
1712099223.508027792   222 0.825856621    10.10.1.1 → 10.10.1.2    TCP 83 8081 → 39954 [PSH, ACK] Seq=494 Ack=511 Win=65152 Len=17 TSval=3722054050 TSecr=1597794341
1712099227.508027792   226 0.836066493    10.10.1.2 → 10.10.1.1    TCP 83 39954 → 8081 [PSH, ACK] Seq=511 Ack=511 Win=64256 Len=17 TSval=1597794352 TSecr=3722054050
1712099229.508027792   228 0.836203730    10.10.1.1 → 10.10.1.2    TCP 83 8081 → 39954 [PSH, ACK] Seq=511 Ack=528 Win=65152 Len=17 TSval=3722054060 TSecr=1597794352
1712099234.508027792   233 0.846414001    10.10.1.2 → 10.10.1.1    TCP 83 39954 → 8081 [PSH, ACK] Seq=528 Ack=528 Win=64256 Len=17 TSval=1597794362 TSecr=3722054060
1712099236.508027792   235 0.846543394    10.10.1.1 → 10.10.1.2    TCP 83 8081 → 39954 [PSH, ACK] Seq=528 Ack=545 Win=65152 Len=17 TSval=3722054071 TSecr=1597794362
1712099240.508027792   239 0.856751718    10.10.1.2 → 10.10.1.1    TCP 83 39954 → 8081 [PSH, ACK] Seq=545 Ack=545 Win=64256 Len=17 TSval=1597794372 TSecr=3722054071
1712099242.508027792   241 0.856888916    10.10.1.1 → 10.10.1.2    TCP 83 8081 → 39954 [PSH, ACK] Seq=545 Ack=562 Win=65152 Len=17 TSval=3722054081 TSecr=1597794372
1712099247.508027792   246 0.867097554    10.10.1.2 → 10.10.1.1    TCP 83 39954 → 8081 [PSH, ACK] Seq=562 Ack=562 Win=64256 Len=17 TSval=1597794383 TSecr=3722054081
1712099249.508027792   248 0.867236851    10.10.1.1 → 10.10.1.2    TCP 83 8081 → 39954 [PSH, ACK] Seq=562 Ack=579 Win=65152 Len=17 TSval=3722054091 TSecr=1597794383
1712099253.508027792   252 0.877445718    10.10.1.2 → 10.10.1.1    TCP 83 39954 → 8081 [PSH, ACK] Seq=579 Ack=579 Win=64256 Len=17 TSval=1597794393 TSecr=3722054091
1712099256.508027792   255 0.877602114    10.10.1.1 → 10.10.1.2    TCP 83 8081 → 39954 [PSH, ACK] Seq=579 Ack=596 Win=65152 Len=17 TSval=3722054102 TSecr=1597794393
1712099260.508027792   259 0.887810228    10.10.1.2 → 10.10.1.1    TCP 83 39954 → 8081 [PSH, ACK] Seq=596 Ack=596 Win=64256 Len=17 TSval=1597794403 TSecr=3722054102
1712099262.508027792   261 0.887939593    10.10.1.1 → 10.10.1.2    TCP 83 8081 → 39954 [PSH, ACK] Seq=596 Ack=613 Win=65152 Len=17 TSval=3722054112 TSecr=1597794403
1712099266.508027792   265 0.898148344    10.10.1.2 → 10.10.1.1    TCP 83 39954 → 8081 [PSH, ACK] Seq=613 Ack=613 Win=64256 Len=17 TSval=1597794414 TSecr=3722054112
1712099268.508027792   267 0.898285053    10.10.1.1 → 10.10.1.2    TCP 83 8081 → 39954 [PSH, ACK] Seq=613 Ack=630 Win=65152 Len=17 TSval=3722054122 TSecr=1597794414
1712099273.508027792   272 0.908495063    10.10.1.2 → 10.10.1.1    TCP 83 39954 → 8081 [PSH, ACK] Seq=630 Ack=630 Win=64256 Len=17 TSval=1597794424 TSecr=3722054122
1712099275.508027792   274 0.908631223    10.10.1.1 → 10.10.1.2    TCP 83 8081 → 39954 [PSH, ACK] Seq=630 Ack=647 Win=65152 Len=17 TSval=3722054133 TSecr=1597794424
1712099279.508027792   278 0.918839383    10.10.1.2 → 10.10.1.1    TCP 83 39954 → 8081 [PSH, ACK] Seq=647 Ack=647 Win=64256 Len=17 TSval=1597794434 TSecr=3722054133
1712099281.508027792   280 0.918973809    10.10.1.1 → 10.10.1.2    TCP 83 8081 → 39954 [PSH, ACK] Seq=647 Ack=664 Win=65152 Len=17 TSval=3722054143 TSecr=1597794434
1712099286.508027792   285 0.929183830    10.10.1.2 → 10.10.1.1    TCP 83 39954 → 8081 [PSH, ACK] Seq=664 Ack=664 Win=64256 Len=17 TSval=1597794445 TSecr=3722054143
1712099288.508027792   287 0.929323548    10.10.1.1 → 10.10.1.2    TCP 83 8081 → 39954 [PSH, ACK] Seq=664 Ack=681 Win=65152 Len=17 TSval=3722054153 TSecr=1597794445
1712099292.508027792   291 0.939533756    10.10.1.2 → 10.10.1.1    TCP 83 39954 → 8081 [PSH, ACK] Seq=681 Ack=681 Win=64256 Len=17 TSval=1597794455 TSecr=3722054153
1712099294.508027792   293 0.939669768    10.10.1.1 → 10.10.1.2    TCP 83 8081 → 39954 [PSH, ACK] Seq=681 Ack=698 Win=65152 Len=17 TSval=3722054164 TSecr=1597794455
1712099299.508027792   298 0.949880959    10.10.1.2 → 10.10.1.1    TCP 83 39954 → 8081 [PSH, ACK] Seq=698 Ack=698 Win=64256 Len=17 TSval=1597794465 TSecr=3722054164
1712099301.508027792   300 0.950018301    10.10.1.1 → 10.10.1.2    TCP 83 8081 → 39954 [PSH, ACK] Seq=698 Ack=715 Win=65152 Len=17 TSval=3722054174 TSecr=1597794465
1712099305.508027792   304 0.960228306    10.10.1.2 → 10.10.1.1    TCP 83 39954 → 8081 [PSH, ACK] Seq=715 Ack=715 Win=64256 Len=17 TSval=1597794476 TSecr=3722054174
1712099307.508027792   306 0.960364952    10.10.1.1 → 10.10.1.2    TCP 83 8081 → 39954 [PSH, ACK] Seq=715 Ack=732 Win=65152 Len=17 TSval=3722054184 TSecr=1597794476
1712099312.508027792   311 0.970574095    10.10.1.2 → 10.10.1.1    TCP 83 39954 → 8081 [PSH, ACK] Seq=732 Ack=732 Win=64256 Len=17 TSval=1597794486 TSecr=3722054184
1712099314.508027792   313 0.970714640    10.10.1.1 → 10.10.1.2    TCP 83 8081 → 39954 [PSH, ACK] Seq=732 Ack=749 Win=65152 Len=17 TSval=3722054195 TSecr=1597794486
1712099318.508027792   317 0.980927254    10.10.1.2 → 10.10.1.1    TCP 83 39954 → 8081 [PSH, ACK] Seq=749 Ack=749 Win=64256 Len=17 TSval=1597794497 TSecr=3722054195
1712099320.508027792   319 0.981065481    10.10.1.1 → 10.10.1.2    TCP 83 8081 → 39954 [PSH, ACK] Seq=749 Ack=766 Win=65152 Len=17 TSval=3722054205 TSecr=1597794497
1712099326.508027792   325 0.991273569    10.10.1.2 → 10.10.1.1    TCP 83 39954 → 8081 [PSH, ACK] Seq=766 Ack=766 Win=64256 Len=17 TSval=1597794507 TSecr=3722054205
1712099327.508027792   326 0.991405831    10.10.1.1 → 10.10.1.2    TCP 83 8081 → 39954 [PSH, ACK] Seq=766 Ack=783 Win=65152 Len=17 TSval=3722054215 TSecr=1597794507
1712099331.508027792   330 1.001616738    10.10.1.2 → 10.10.1.1    TCP 83 39954 → 8081 [PSH, ACK] Seq=783 Ack=783 Win=64256 Len=17 TSval=1597794517 TSecr=3722054215
1712099333.508027792   332 1.001751847    10.10.1.1 → 10.10.1.2    TCP 83 8081 → 39954 [PSH, ACK] Seq=783 Ack=800 Win=65152 Len=17 TSval=3722054226 TSecr=1597794517
1712099338.508027792   337 1.011961818    10.10.1.2 → 10.10.1.1    TCP 83 39954 → 8081 [PSH, ACK] Seq=800 Ack=800 Win=64256 Len=17 TSval=1597794528 TSecr=3722054226
1712099340.508027792   339 1.012099603    10.10.1.1 → 10.10.1.2    TCP 83 8081 → 39954 [PSH, ACK] Seq=800 Ack=817 Win=65152 Len=17 TSval=3722054236 TSecr=1597794528
1712099344.508027792   343 1.022310129    10.10.1.2 → 10.10.1.1    TCP 83 39954 → 8081 [PSH, ACK] Seq=817 Ack=817 Win=64256 Len=17 TSval=1597794538 TSecr=3722054236
1712099346.508027792   345 1.022444267    10.10.1.1 → 10.10.1.2    TCP 83 8081 → 39954 [PSH, ACK] Seq=817 Ack=834 Win=65152 Len=17 TSval=3722054246 TSecr=1597794538
1712099351.508027792   350 1.032652494    10.10.1.2 → 10.10.1.1    TCP 83 39954 → 8081 [PSH, ACK] Seq=834 Ack=834 Win=64256 Len=17 TSval=1597794548 TSecr=3722054246
1712099353.508027792   352 1.032792159    10.10.1.1 → 10.10.1.2    TCP 83 8081 → 39954 [PSH, ACK] Seq=834 Ack=851 Win=65152 Len=17 TSval=3722054257 TSecr=1597794548
1712099357.508027792   356 1.043004203    10.10.1.2 → 10.10.1.1    TCP 83 39954 → 8081 [PSH, ACK] Seq=851 Ack=851 Win=64256 Len=17 TSval=1597794559 TSecr=3722054257
1712099359.508027792   358 1.043139186    10.10.1.1 → 10.10.1.2    TCP 83 8081 → 39954 [PSH, ACK] Seq=851 Ack=868 Win=65152 Len=17 TSval=3722054267 TSecr=1597794559
1712099364.508027792   363 1.053347207    10.10.1.2 → 10.10.1.1    TCP 83 39954 → 8081 [PSH, ACK] Seq=868 Ack=868 Win=64256 Len=17 TSval=1597794569 TSecr=3722054267
1712099366.508027792   365 1.053476415    10.10.1.1 → 10.10.1.2    TCP 83 8081 → 39954 [PSH, ACK] Seq=868 Ack=885 Win=65152 Len=17 TSval=3722054277 TSecr=1597794569
1712099370.508027792   369 1.063688935    10.10.1.2 → 10.10.1.1    TCP 83 39954 → 8081 [PSH, ACK] Seq=885 Ack=885 Win=64256 Len=17 TSval=1597794579 TSecr=3722054277
1712099372.508027792   371 1.063825030    10.10.1.1 → 10.10.1.2    TCP 83 8081 → 39954 [PSH, ACK] Seq=885 Ack=902 Win=65152 Len=17 TSval=3722054288 TSecr=1597794579
1712099377.508027792   376 1.074045139    10.10.1.2 → 10.10.1.1    TCP 83 39954 → 8081 [PSH, ACK] Seq=902 Ack=902 Win=64256 Len=17 TSval=1597794590 TSecr=3722054288
1712099379.508027792   378 1.074175081    10.10.1.1 → 10.10.1.2    TCP 83 8081 → 39954 [PSH, ACK] Seq=902 Ack=919 Win=65152 Len=17 TSval=3722054298 TSecr=1597794590
1712099383.508027792   382 1.084385892    10.10.1.2 → 10.10.1.1    TCP 83 39954 → 8081 [PSH, ACK] Seq=919 Ack=919 Win=64256 Len=17 TSval=1597794600 TSecr=3722054298
1712099385.508027792   384 1.084521554    10.10.1.1 → 10.10.1.2    TCP 83 8081 → 39954 [PSH, ACK] Seq=919 Ack=936 Win=65152 Len=17 TSval=3722054308 TSecr=1597794600
1712099390.508027792   389 1.094730336    10.10.1.2 → 10.10.1.1    TCP 83 39954 → 8081 [PSH, ACK] Seq=936 Ack=936 Win=64256 Len=17 TSval=1597794610 TSecr=3722054308
1712099392.508027792   391 1.094869253    10.10.1.1 → 10.10.1.2    TCP 83 8081 → 39954 [PSH, ACK] Seq=936 Ack=953 Win=65152 Len=17 TSval=3722054319 TSecr=1597794610
1712099396.508027792   395 1.105077735    10.10.1.2 → 10.10.1.1    TCP 83 39954 → 8081 [PSH, ACK] Seq=953 Ack=953 Win=64256 Len=17 TSval=1597794621 TSecr=3722054319
1712099399.508027792   398 1.105441646    10.10.1.1 → 10.10.1.2    TCP 83 8081 → 39954 [PSH, ACK] Seq=953 Ack=970 Win=65152 Len=17 TSval=3722054329 TSecr=1597794621
1712099403.508027792   402 1.115651648    10.10.1.2 → 10.10.1.1    TCP 83 39954 → 8081 [PSH, ACK] Seq=970 Ack=970 Win=64256 Len=17 TSval=1597794631 TSecr=3722054329
1712099405.508027792   404 1.115787615    10.10.1.1 → 10.10.1.2    TCP 83 8081 → 39954 [PSH, ACK] Seq=970 Ack=987 Win=65152 Len=17 TSval=3722054340 TSecr=1597794631
1712099409.508027792   408 1.125999428    10.10.1.2 → 10.10.1.1    TCP 83 39954 → 8081 [PSH, ACK] Seq=987 Ack=987 Win=64256 Len=17 TSval=1597794642 TSecr=3722054340
1712099411.508027792   410 1.126134520    10.10.1.1 → 10.10.1.2    TCP 83 8081 → 39954 [PSH, ACK] Seq=987 Ack=1004 Win=65152 Len=17 TSval=3722054350 TSecr=1597794642
1712099416.508027792   415 1.136341884    10.10.1.2 → 10.10.1.1    TCP 83 39954 → 8081 [PSH, ACK] Seq=1004 Ack=1004 Win=64256 Len=17 TSval=1597794652 TSecr=3722054350
1712099418.508027792   417 1.136479204    10.10.1.1 → 10.10.1.2    TCP 83 8081 → 39954 [PSH, ACK] Seq=1004 Ack=1021 Win=65152 Len=17 TSval=3722054360 TSecr=1597794652
1712099422.508027792   421 1.146690463    10.10.1.2 → 10.10.1.1    TCP 83 39954 → 8081 [PSH, ACK] Seq=1021 Ack=1021 Win=64256 Len=17 TSval=1597794662 TSecr=3722054360
1712099424.508027792   423 1.146825835    10.10.1.1 → 10.10.1.2    TCP 83 8081 → 39954 [PSH, ACK] Seq=1021 Ack=1038 Win=65152 Len=17 TSval=3722054371 TSecr=1597794662
1712099429.508027792   428 1.157035967    10.10.1.2 → 10.10.1.1    TCP 83 39954 → 8081 [PSH, ACK] Seq=1038 Ack=1038 Win=64256 Len=17 TSval=1597794673 TSecr=3722054371
1712099431.508027792   430 1.157165281    10.10.1.1 → 10.10.1.2    TCP 83 8081 → 39954 [PSH, ACK] Seq=1038 Ack=1055 Win=65152 Len=17 TSval=3722054381 TSecr=1597794673
1712099435.508027792   434 1.167375982    10.10.1.2 → 10.10.1.1    TCP 83 39954 → 8081 [PSH, ACK] Seq=1055 Ack=1055 Win=64256 Len=17 TSval=1597794683 TSecr=3722054381
1712099437.508027792   436 1.167510518    10.10.1.1 → 10.10.1.2    TCP 83 8081 → 39954 [PSH, ACK] Seq=1055 Ack=1072 Win=65152 Len=17 TSval=3722054391 TSecr=1597794683
1712099442.508027792   441 1.177719786    10.10.1.2 → 10.10.1.1    TCP 83 39954 → 8081 [PSH, ACK] Seq=1072 Ack=1072 Win=64256 Len=17 TSval=1597794693 TSecr=3722054391
1712099444.508027792   443 1.177854973    10.10.1.1 → 10.10.1.2    TCP 83 8081 → 39954 [PSH, ACK] Seq=1072 Ack=1089 Win=65152 Len=17 TSval=3722054402 TSecr=1597794693
1712099448.508027792   447 1.188066141    10.10.1.2 → 10.10.1.1    TCP 83 39954 → 8081 [PSH, ACK] Seq=1089 Ack=1089 Win=64256 Len=17 TSval=1597794704 TSecr=3722054402
1712099450.508027792   449 1.188203520    10.10.1.1 → 10.10.1.2    TCP 83 8081 → 39954 [PSH, ACK] Seq=1089 Ack=1106 Win=65152 Len=17 TSval=3722054412 TSecr=1597794704
1712099455.508027792   454 1.198414022    10.10.1.2 → 10.10.1.1    TCP 83 39954 → 8081 [PSH, ACK] Seq=1106 Ack=1106 Win=64256 Len=17 TSval=1597794714 TSecr=3722054412
1712099457.508027792   456 1.198551473    10.10.1.1 → 10.10.1.2    TCP 83 8081 → 39954 [PSH, ACK] Seq=1106 Ack=1123 Win=65152 Len=17 TSval=3722054423 TSecr=1597794714
1712099461.508027792   460 1.208758334    10.10.1.2 → 10.10.1.1    TCP 83 39954 → 8081 [PSH, ACK] Seq=1123 Ack=1123 Win=64256 Len=17 TSval=1597794724 TSecr=3722054423
1712099463.508027792   462 1.208895413    10.10.1.1 → 10.10.1.2    TCP 83 8081 → 39954 [PSH, ACK] Seq=1123 Ack=1140 Win=65152 Len=17 TSval=3722054433 TSecr=1597794724
1712099468.508027792   467 1.219108585    10.10.1.2 → 10.10.1.1    TCP 83 39954 → 8081 [PSH, ACK] Seq=1140 Ack=1140 Win=64256 Len=17 TSval=1597794735 TSecr=3722054433
1712099470.508027792   469 1.219243547    10.10.1.1 → 10.10.1.2    TCP 83 8081 → 39954 [PSH, ACK] Seq=1140 Ack=1157 Win=65152 Len=17 TSval=3722054443 TSecr=1597794735
1712099474.508027792   473 1.229452814    10.10.1.2 → 10.10.1.1    TCP 83 39954 → 8081 [PSH, ACK] Seq=1157 Ack=1157 Win=64256 Len=17 TSval=1597794745 TSecr=3722054443
1712099476.508027792   475 1.229593553    10.10.1.1 → 10.10.1.2    TCP 83 8081 → 39954 [PSH, ACK] Seq=1157 Ack=1174 Win=65152 Len=17 TSval=3722054454 TSecr=1597794745
1712099481.508027792   480 1.239802717    10.10.1.2 → 10.10.1.1    TCP 83 39954 → 8081 [PSH, ACK] Seq=1174 Ack=1174 Win=64256 Len=17 TSval=1597794755 TSecr=3722054454
1712099483.508027792   482 1.239942286    10.10.1.1 → 10.10.1.2    TCP 83 8081 → 39954 [PSH, ACK] Seq=1174 Ack=1191 Win=65152 Len=17 TSval=3722054464 TSecr=1597794755
1712099487.508027792   486 1.250163234    10.10.1.2 → 10.10.1.1    TCP 83 39954 → 8081 [PSH, ACK] Seq=1191 Ack=1191 Win=64256 Len=17 TSval=1597794766 TSecr=3722054464
1712099489.508027792   488 1.250298812    10.10.1.1 → 10.10.1.2    TCP 83 8081 → 39954 [PSH, ACK] Seq=1191 Ack=1208 Win=65152 Len=17 TSval=3722054474 TSecr=1597794766
1712099494.508027792   493 1.260507104    10.10.1.2 → 10.10.1.1    TCP 83 39954 → 8081 [PSH, ACK] Seq=1208 Ack=1208 Win=64256 Len=17 TSval=1597794776 TSecr=3722054474
1712099496.508027792   495 1.260645595    10.10.1.1 → 10.10.1.2    TCP 83 8081 → 39954 [PSH, ACK] Seq=1208 Ack=1225 Win=65152 Len=17 TSval=3722054485 TSecr=1597794776
1712099500.508027792   499 1.270856249    10.10.1.2 → 10.10.1.1    TCP 83 39954 → 8081 [PSH, ACK] Seq=1225 Ack=1225 Win=64256 Len=17 TSval=1597794786 TSecr=3722054485
1712099502.508027792   501 1.270992420    10.10.1.1 → 10.10.1.2    TCP 83 8081 → 39954 [PSH, ACK] Seq=1225 Ack=1242 Win=65152 Len=17 TSval=3722054495 TSecr=1597794786
1712099507.508027792   506 1.281201585    10.10.1.2 → 10.10.1.1    TCP 83 39954 → 8081 [PSH, ACK] Seq=1242 Ack=1242 Win=64256 Len=17 TSval=1597794797 TSecr=3722054495
1712099509.508027792   508 1.281317314    10.10.1.1 → 10.10.1.2    TCP 83 8081 → 39954 [PSH, ACK] Seq=1242 Ack=1259 Win=65152 Len=17 TSval=3722054505 TSecr=1597794797
1712099513.508027792   512 1.291528324    10.10.1.2 → 10.10.1.1    TCP 83 39954 → 8081 [PSH, ACK] Seq=1259 Ack=1259 Win=64256 Len=17 TSval=1597794807 TSecr=3722054505
1712099515.508027792   514 1.291663538    10.10.1.1 → 10.10.1.2    TCP 83 8081 → 39954 [PSH, ACK] Seq=1259 Ack=1276 Win=65152 Len=17 TSval=3722054516 TSecr=1597794807
1712099520.508027792   519 1.301873552    10.10.1.2 → 10.10.1.1    TCP 83 39954 → 8081 [PSH, ACK] Seq=1276 Ack=1276 Win=64256 Len=17 TSval=1597794817 TSecr=3722054516
1712099522.508027792   521 1.302008701    10.10.1.1 → 10.10.1.2    TCP 83 8081 → 39954 [PSH, ACK] Seq=1276 Ack=1293 Win=65152 Len=17 TSval=3722054526 TSecr=1597794817
1712099526.508027792   525 1.312218259    10.10.1.2 → 10.10.1.1    TCP 83 39954 → 8081 [PSH, ACK] Seq=1293 Ack=1293 Win=64256 Len=17 TSval=1597794828 TSecr=3722054526
1712099528.508027792   527 1.312358394    10.10.1.1 → 10.10.1.2    TCP 83 8081 → 39954 [PSH, ACK] Seq=1293 Ack=1310 Win=65152 Len=17 TSval=3722054536 TSecr=1597794828
1712099533.508027792   532 1.322568638    10.10.1.2 → 10.10.1.1    TCP 83 39954 → 8081 [PSH, ACK] Seq=1310 Ack=1310 Win=64256 Len=17 TSval=1597794838 TSecr=3722054536
1712099535.508027792   534 1.322703775    10.10.1.1 → 10.10.1.2    TCP 83 8081 → 39954 [PSH, ACK] Seq=1310 Ack=1327 Win=65152 Len=17 TSval=3722054547 TSecr=1597794838
1712099539.508027792   538 1.332914194    10.10.1.2 → 10.10.1.1    TCP 83 39954 → 8081 [PSH, ACK] Seq=1327 Ack=1327 Win=64256 Len=17 TSval=1597794849 TSecr=3722054547
1712099541.508027792   540 1.333049519    10.10.1.1 → 10.10.1.2    TCP 83 8081 → 39954 [PSH, ACK] Seq=1327 Ack=1344 Win=65152 Len=17 TSval=3722054557 TSecr=1597794849
1712099546.508027792   545 1.343260041    10.10.1.2 → 10.10.1.1    TCP 83 39954 → 8081 [PSH, ACK] Seq=1344 Ack=1344 Win=64256 Len=17 TSval=1597794859 TSecr=3722054557
1712099548.508027792   547 1.343390090    10.10.1.1 → 10.10.1.2    TCP 83 8081 → 39954 [PSH, ACK] Seq=1344 Ack=1361 Win=65152 Len=17 TSval=3722054567 TSecr=1597794859
1712099552.508027792   551 1.353598423    10.10.1.2 → 10.10.1.1    TCP 83 39954 → 8081 [PSH, ACK] Seq=1361 Ack=1361 Win=64256 Len=17 TSval=1597794869 TSecr=3722054567
1712099554.508027792   553 1.353737429    10.10.1.1 → 10.10.1.2    TCP 83 8081 → 39954 [PSH, ACK] Seq=1361 Ack=1378 Win=65152 Len=17 TSval=3722054578 TSecr=1597794869
1712099559.508027792   558 1.363914216    10.10.1.2 → 10.10.1.1    TCP 83 39954 → 8081 [PSH, ACK] Seq=1378 Ack=1378 Win=64256 Len=17 TSval=1597794880 TSecr=3722054578
1712099561.508027792   560 1.364051308    10.10.1.1 → 10.10.1.2    TCP 83 8081 → 39954 [PSH, ACK] Seq=1378 Ack=1395 Win=65152 Len=17 TSval=3722054588 TSecr=1597794880
1712099566.508027792   565 1.374260376    10.10.1.2 → 10.10.1.1    TCP 83 39954 → 8081 [PSH, ACK] Seq=1395 Ack=1395 Win=64256 Len=17 TSval=1597794890 TSecr=3722054588
1712099568.508027792   567 1.374388882    10.10.1.1 → 10.10.1.2    TCP 83 8081 → 39954 [PSH, ACK] Seq=1395 Ack=1412 Win=65152 Len=17 TSval=3722054598 TSecr=1597794890
1712099572.508027792   571 1.384597859    10.10.1.2 → 10.10.1.1    TCP 83 39954 → 8081 [PSH, ACK] Seq=1412 Ack=1412 Win=64256 Len=17 TSval=1597794900 TSecr=3722054598
1712099574.508027792   573 1.384734497    10.10.1.1 → 10.10.1.2    TCP 83 8081 → 39954 [PSH, ACK] Seq=1412 Ack=1429 Win=65152 Len=17 TSval=3722054609 TSecr=1597794900
1712099578.508027792   577 1.394945546    10.10.1.2 → 10.10.1.1    TCP 83 39954 → 8081 [PSH, ACK] Seq=1429 Ack=1429 Win=64256 Len=17 TSval=1597794911 TSecr=3722054609
1712099580.508027792   579 1.395081187    10.10.1.1 → 10.10.1.2    TCP 83 8081 → 39954 [PSH, ACK] Seq=1429 Ack=1446 Win=65152 Len=17 TSval=3722054619 TSecr=1597794911
1712099585.508027792   584 1.405290765    10.10.1.2 → 10.10.1.1    TCP 83 39954 → 8081 [PSH, ACK] Seq=1446 Ack=1446 Win=64256 Len=17 TSval=1597794921 TSecr=3722054619
1712099587.508027792   586 1.405427571    10.10.1.1 → 10.10.1.2    TCP 83 8081 → 39954 [PSH, ACK] Seq=1446 Ack=1463 Win=65152 Len=17 TSval=3722054629 TSecr=1597794921
1712099591.508027792   590 1.415636933    10.10.1.2 → 10.10.1.1    TCP 83 39954 → 8081 [PSH, ACK] Seq=1463 Ack=1463 Win=64256 Len=17 TSval=1597794931 TSecr=3722054629
1712099593.508027792   592 1.415772780    10.10.1.1 → 10.10.1.2    TCP 83 8081 → 39954 [PSH, ACK] Seq=1463 Ack=1480 Win=65152 Len=17 TSval=3722054640 TSecr=1597794931
1712099598.508027792   597 1.425981759    10.10.1.2 → 10.10.1.1    TCP 83 39954 → 8081 [PSH, ACK] Seq=1480 Ack=1480 Win=64256 Len=17 TSval=1597794942 TSecr=3722054640
1712099600.508027792   599 1.426110997    10.10.1.1 → 10.10.1.2    TCP 83 8081 → 39954 [PSH, ACK] Seq=1480 Ack=1497 Win=65152 Len=17 TSval=3722054650 TSecr=1597794942
1712099604.508027792   603 1.436319614    10.10.1.2 → 10.10.1.1    TCP 83 39954 → 8081 [PSH, ACK] Seq=1497 Ack=1497 Win=64256 Len=17 TSval=1597794952 TSecr=3722054650
1712099606.508027792   605 1.436457856    10.10.1.1 → 10.10.1.2    TCP 83 8081 → 39954 [PSH, ACK] Seq=1497 Ack=1514 Win=65152 Len=17 TSval=3722054660 TSecr=1597794952
1712099611.508027792   610 1.446667912    10.10.1.2 → 10.10.1.1    TCP 83 39954 → 8081 [PSH, ACK] Seq=1514 Ack=1514 Win=64256 Len=17 TSval=1597794962 TSecr=3722054660
1712099613.508027792   612 1.446803948    10.10.1.1 → 10.10.1.2    TCP 83 8081 → 39954 [PSH, ACK] Seq=1514 Ack=1531 Win=65152 Len=17 TSval=3722054671 TSecr=1597794962
1712099617.508027792   616 1.457015078    10.10.1.2 → 10.10.1.1    TCP 83 39954 → 8081 [PSH, ACK] Seq=1531 Ack=1531 Win=64256 Len=17 TSval=1597794973 TSecr=3722054671
1712099619.508027792   618 1.457149996    10.10.1.1 → 10.10.1.2    TCP 83 8081 → 39954 [PSH, ACK] Seq=1531 Ack=1548 Win=65152 Len=17 TSval=3722054681 TSecr=1597794973
1712099624.508027792   623 1.467359838    10.10.1.2 → 10.10.1.1    TCP 83 39954 → 8081 [PSH, ACK] Seq=1548 Ack=1548 Win=64256 Len=17 TSval=1597794983 TSecr=3722054681
1712099626.508027792   625 1.467498072    10.10.1.1 → 10.10.1.2    TCP 83 8081 → 39954 [PSH, ACK] Seq=1548 Ack=1565 Win=65152 Len=17 TSval=3722054691 TSecr=1597794983
1712099630.508027792   629 1.477707672    10.10.1.2 → 10.10.1.1    TCP 83 39954 → 8081 [PSH, ACK] Seq=1565 Ack=1565 Win=64256 Len=17 TSval=1597794993 TSecr=3722054691
1712099632.508027792   631 1.477842029    10.10.1.1 → 10.10.1.2    TCP 83 8081 → 39954 [PSH, ACK] Seq=1565 Ack=1582 Win=65152 Len=17 TSval=3722054702 TSecr=1597794993
1712099637.508027792   636 1.488052738    10.10.1.2 → 10.10.1.1    TCP 83 39954 → 8081 [PSH, ACK] Seq=1582 Ack=1582 Win=64256 Len=17 TSval=1597795004 TSecr=3722054702
1712099639.508027792   638 1.488191200    10.10.1.1 → 10.10.1.2    TCP 83 8081 → 39954 [PSH, ACK] Seq=1582 Ack=1599 Win=65152 Len=17 TSval=3722054712 TSecr=1597795004
1712099643.508027792   642 1.498400662    10.10.1.2 → 10.10.1.1    TCP 83 39954 → 8081 [PSH, ACK] Seq=1599 Ack=1599 Win=64256 Len=17 TSval=1597795014 TSecr=3722054712
1712099645.508027792   644 1.498537163    10.10.1.1 → 10.10.1.2    TCP 83 8081 → 39954 [PSH, ACK] Seq=1599 Ack=1616 Win=65152 Len=17 TSval=3722054723 TSecr=1597795014
1712099650.508027792   649 1.508745531    10.10.1.2 → 10.10.1.1    TCP 83 39954 → 8081 [PSH, ACK] Seq=1616 Ack=1616 Win=64256 Len=17 TSval=1597795024 TSecr=3722054723
1712099652.508027792   651 1.508883517    10.10.1.1 → 10.10.1.2    TCP 83 8081 → 39954 [PSH, ACK] Seq=1616 Ack=1633 Win=65152 Len=17 TSval=3722054733 TSecr=1597795024
1712099656.508027792   655 1.519092728    10.10.1.2 → 10.10.1.1    TCP 83 39954 → 8081 [PSH, ACK] Seq=1633 Ack=1633 Win=64256 Len=17 TSval=1597795035 TSecr=3722054733
1712099658.508027792   657 1.519229267    10.10.1.1 → 10.10.1.2    TCP 83 8081 → 39954 [PSH, ACK] Seq=1633 Ack=1650 Win=65152 Len=17 TSval=3722054743 TSecr=1597795035
1712099663.508027792   662 1.529440155    10.10.1.2 → 10.10.1.1    TCP 83 39954 → 8081 [PSH, ACK] Seq=1650 Ack=1650 Win=64256 Len=17 TSval=1597795045 TSecr=3722054743
1712099665.508027792   664 1.529594332    10.10.1.1 → 10.10.1.2    TCP 83 8081 → 39954 [PSH, ACK] Seq=1650 Ack=1667 Win=65152 Len=17 TSval=3722054754 TSecr=1597795045
1712099669.508027792   668 1.539800632    10.10.1.2 → 10.10.1.1    TCP 83 39954 → 8081 [PSH, ACK] Seq=1667 Ack=1667 Win=64256 Len=17 TSval=1597795055 TSecr=3722054754
1712099671.508027792   670 1.539937159    10.10.1.1 → 10.10.1.2    TCP 83 8081 → 39954 [PSH, ACK] Seq=1667 Ack=1684 Win=65152 Len=17 TSval=3722054764 TSecr=1597795055
1712099676.508027792   675 1.550149321    10.10.1.2 → 10.10.1.1    TCP 83 39954 → 8081 [PSH, ACK] Seq=1684 Ack=1684 Win=64256 Len=17 TSval=1597795066 TSecr=3722054764
1712099678.508027792   677 1.550286069    10.10.1.1 → 10.10.1.2    TCP 83 8081 → 39954 [PSH, ACK] Seq=1684 Ack=1701 Win=65152 Len=17 TSval=3722054774 TSecr=1597795066
1712099682.508027792   681 1.560508051    10.10.1.2 → 10.10.1.1    TCP 83 39954 → 8081 [PSH, ACK] Seq=1701 Ack=1701 Win=64256 Len=17 TSval=1597795076 TSecr=3722054774
1712099684.508027792   683 1.560642686    10.10.1.1 → 10.10.1.2    TCP 83 8081 → 39954 [PSH, ACK] Seq=1701 Ack=1718 Win=65152 Len=17 TSval=3722054785 TSecr=1597795076
1712099689.508027792   688 1.570853391    10.10.1.2 → 10.10.1.1    TCP 83 39954 → 8081 [PSH, ACK] Seq=1718 Ack=1718 Win=64256 Len=17 TSval=1597795086 TSecr=3722054785
1712099691.508027792   690 1.570991733    10.10.1.1 → 10.10.1.2    TCP 83 8081 → 39954 [PSH, ACK] Seq=1718 Ack=1735 Win=65152 Len=17 TSval=3722054795 TSecr=1597795086
1712099695.508027792   694 1.581202531    10.10.1.2 → 10.10.1.1    TCP 83 39954 → 8081 [PSH, ACK] Seq=1735 Ack=1735 Win=64256 Len=17 TSval=1597795097 TSecr=3722054795
1712099697.508027792   696 1.581338725    10.10.1.1 → 10.10.1.2    TCP 83 8081 → 39954 [PSH, ACK] Seq=1735 Ack=1752 Win=65152 Len=17 TSval=3722054805 TSecr=1597795097
1712099702.508027792   701 1.591546987    10.10.1.2 → 10.10.1.1    TCP 83 39954 → 8081 [PSH, ACK] Seq=1752 Ack=1752 Win=64256 Len=17 TSval=1597795107 TSecr=3722054805
1712099704.508027792   703 1.591676133    10.10.1.1 → 10.10.1.2    TCP 83 8081 → 39954 [PSH, ACK] Seq=1752 Ack=1769 Win=65152 Len=17 TSval=3722054816 TSecr=1597795107
1712099708.508027792   707 1.601885819    10.10.1.2 → 10.10.1.1    TCP 83 39954 → 8081 [PSH, ACK] Seq=1769 Ack=1769 Win=64256 Len=17 TSval=1597795117 TSecr=3722054816
1712099710.508027792   709 1.602022008    10.10.1.1 → 10.10.1.2    TCP 83 8081 → 39954 [PSH, ACK] Seq=1769 Ack=1786 Win=65152 Len=17 TSval=3722054826 TSecr=1597795117
1712099715.508027792   714 1.612229110    10.10.1.2 → 10.10.1.1    TCP 83 39954 → 8081 [PSH, ACK] Seq=1786 Ack=1786 Win=64256 Len=17 TSval=1597795128 TSecr=3722054826
1712099717.508027792   716 1.612359997    10.10.1.1 → 10.10.1.2    TCP 83 8081 → 39954 [PSH, ACK] Seq=1786 Ack=1803 Win=65152 Len=17 TSval=3722054836 TSecr=1597795128
1712099721.508027792   720 1.622570714    10.10.1.2 → 10.10.1.1    TCP 83 39954 → 8081 [PSH, ACK] Seq=1803 Ack=1803 Win=64256 Len=17 TSval=1597795138 TSecr=3722054836
1712099723.508027792   722 1.622704576    10.10.1.1 → 10.10.1.2    TCP 83 8081 → 39954 [PSH, ACK] Seq=1803 Ack=1820 Win=65152 Len=17 TSval=3722054847 TSecr=1597795138
1712099728.508027792   727 1.632912923    10.10.1.2 → 10.10.1.1    TCP 83 39954 → 8081 [PSH, ACK] Seq=1820 Ack=1820 Win=64256 Len=17 TSval=1597795149 TSecr=3722054847
1712099730.508027792   729 1.633049996    10.10.1.1 → 10.10.1.2    TCP 83 8081 → 39954 [PSH, ACK] Seq=1820 Ack=1837 Win=65152 Len=17 TSval=3722054857 TSecr=1597795149
1712099734.508027792   733 1.643261988    10.10.1.2 → 10.10.1.1    TCP 83 39954 → 8081 [PSH, ACK] Seq=1837 Ack=1837 Win=64256 Len=17 TSval=1597795159 TSecr=3722054857
1712099736.508027792   735 1.643397059    10.10.1.1 → 10.10.1.2    TCP 83 8081 → 39954 [PSH, ACK] Seq=1837 Ack=1854 Win=65152 Len=17 TSval=3722054867 TSecr=1597795159
1712099741.508027792   740 1.653607573    10.10.1.2 → 10.10.1.1    TCP 83 39954 → 8081 [PSH, ACK] Seq=1854 Ack=1854 Win=64256 Len=17 TSval=1597795169 TSecr=3722054867
1712099743.508027792   742 1.653744186    10.10.1.1 → 10.10.1.2    TCP 83 8081 → 39954 [PSH, ACK] Seq=1854 Ack=1871 Win=65152 Len=17 TSval=3722054878 TSecr=1597795169
1712099747.508027792   746 1.663914685    10.10.1.2 → 10.10.1.1    TCP 83 39954 → 8081 [PSH, ACK] Seq=1871 Ack=1871 Win=64256 Len=17 TSval=1597795180 TSecr=3722054878
1712099749.508027792   748 1.664049482    10.10.1.1 → 10.10.1.2    TCP 83 8081 → 39954 [PSH, ACK] Seq=1871 Ack=1888 Win=65152 Len=17 TSval=3722054888 TSecr=1597795180
1712099754.508027792   753 1.674261216    10.10.1.2 → 10.10.1.1    TCP 83 39954 → 8081 [PSH, ACK] Seq=1888 Ack=1888 Win=64256 Len=17 TSval=1597795190 TSecr=3722054888
1712099756.508027792   755 1.674398769    10.10.1.1 → 10.10.1.2    TCP 83 8081 → 39954 [PSH, ACK] Seq=1888 Ack=1905 Win=65152 Len=17 TSval=3722054898 TSecr=1597795190
1712099760.508027792   759 1.684610205    10.10.1.2 → 10.10.1.1    TCP 83 39954 → 8081 [PSH, ACK] Seq=1905 Ack=1905 Win=64256 Len=17 TSval=1597795200 TSecr=3722054898
1712099762.508027792   761 1.684744508    10.10.1.1 → 10.10.1.2    TCP 83 8081 → 39954 [PSH, ACK] Seq=1905 Ack=1922 Win=65152 Len=17 TSval=3722054909 TSecr=1597795200
1712099767.508027792   766 1.694954885    10.10.1.2 → 10.10.1.1    TCP 83 39954 → 8081 [PSH, ACK] Seq=1922 Ack=1922 Win=64256 Len=17 TSval=1597795211 TSecr=3722054909
1712099769.508027792   768 1.695142988    10.10.1.1 → 10.10.1.2    TCP 83 8081 → 39954 [PSH, ACK] Seq=1922 Ack=1939 Win=65152 Len=17 TSval=3722054919 TSecr=1597795211
1712099773.508027792   772 1.705368542    10.10.1.2 → 10.10.1.1    TCP 83 39954 → 8081 [PSH, ACK] Seq=1939 Ack=1939 Win=64256 Len=17 TSval=1597795221 TSecr=3722054919
1712099775.508027792   774 1.705503012    10.10.1.1 → 10.10.1.2    TCP 83 8081 → 39954 [PSH, ACK] Seq=1939 Ack=1956 Win=65152 Len=17 TSval=3722054929 TSecr=1597795221
1712099780.508027792   779 1.715711800    10.10.1.2 → 10.10.1.1    TCP 83 39954 → 8081 [PSH, ACK] Seq=1956 Ack=1956 Win=64256 Len=17 TSval=1597795231 TSecr=3722054929
1712099782.508027792   781 1.715850917    10.10.1.1 → 10.10.1.2    TCP 83 8081 → 39954 [PSH, ACK] Seq=1956 Ack=1973 Win=65152 Len=17 TSval=3722054940 TSecr=1597795231
1712099786.508027792   785 1.726059941    10.10.1.2 → 10.10.1.1    TCP 83 39954 → 8081 [PSH, ACK] Seq=1973 Ack=1973 Win=64256 Len=17 TSval=1597795242 TSecr=3722054940
1712099788.508027792   787 1.726196836    10.10.1.1 → 10.10.1.2    TCP 83 8081 → 39954 [PSH, ACK] Seq=1973 Ack=1990 Win=65152 Len=17 TSval=3722054950 TSecr=1597795242
1712099793.508027792   792 1.736406719    10.10.1.2 → 10.10.1.1    TCP 83 39954 → 8081 [PSH, ACK] Seq=1990 Ack=1990 Win=64256 Len=17 TSval=1597795252 TSecr=3722054950
1712099795.508027792   794 1.736542940    10.10.1.1 → 10.10.1.2    TCP 83 8081 → 39954 [PSH, ACK] Seq=1990 Ack=2007 Win=65152 Len=17 TSval=3722054961 TSecr=1597795252
