1711548252.152130604    22 0.260546207    10.10.1.2 → 10.10.1.1    TCP 74 59880 → 8081 [SYN] Seq=0 Win=64240 Len=0 MSS=1460 SACK_PERM=1 TSval=1047022448 TSecr=0 WS=128
1711548253.152130604    23 0.260583207    10.10.1.1 → 10.10.1.2    TCP 74 8081 → 59880 [SYN, ACK] Seq=0 Ack=1 Win=65160 Len=0 MSS=1460 SACK_PERM=1 TSval=3171282158 TSecr=1047022448 WS=128
1711548254.152130604    24 0.260624758    10.10.1.2 → 10.10.1.1    TCP 66 59880 → 8081 [ACK] Seq=1 Ack=1 Win=64256 Len=0 TSval=1047022448 TSecr=3171282158
1711548272.152130604    42 0.510712468    10.10.1.2 → 10.10.1.1    TCP 83 59880 → 8081 [PSH, ACK] Seq=1 Ack=1 Win=64256 Len=17 TSval=1047022698 TSecr=3171282158
1711548275.152130604    45 0.510738023    10.10.1.1 → 10.10.1.2    TCP 66 8081 → 59880 [ACK] Seq=1 Ack=18 Win=65152 Len=0 TSval=3171282408 TSecr=1047022698
1711548276.152130604    46 0.510912577    10.10.1.1 → 10.10.1.2    TCP 83 8081 → 59880 [PSH, ACK] Seq=1 Ack=18 Win=65152 Len=17 TSval=3171282408 TSecr=1047022698
1711548277.152130604    47 0.510938261    10.10.1.2 → 10.10.1.1    TCP 66 59880 → 8081 [ACK] Seq=18 Ack=18 Win=64256 Len=0 TSval=1047022698 TSecr=3171282408
1711548284.152130604    54 0.512077834    10.10.1.2 → 10.10.1.1    TCP 83 59880 → 8081 [PSH, ACK] Seq=18 Ack=18 Win=64256 Len=17 TSval=1047022699 TSecr=3171282408
1711548287.152130604    57 0.512113386    10.10.1.1 → 10.10.1.2    TCP 83 8081 → 59880 [PSH, ACK] Seq=18 Ack=35 Win=65152 Len=17 TSval=3171282410 TSecr=1047022699
1711548294.152130604    64 0.513277047    10.10.1.2 → 10.10.1.1    TCP 83 59880 → 8081 [PSH, ACK] Seq=35 Ack=35 Win=64256 Len=17 TSval=1047022700 TSecr=3171282410
1711548296.152130604    66 0.513308967    10.10.1.1 → 10.10.1.2    TCP 83 8081 → 59880 [PSH, ACK] Seq=35 Ack=52 Win=65152 Len=17 TSval=3171282411 TSecr=1047022700
1711548304.152130604    74 0.514471257    10.10.1.2 → 10.10.1.1    TCP 83 59880 → 8081 [PSH, ACK] Seq=52 Ack=52 Win=64256 Len=17 TSval=1047022702 TSecr=3171282411
1711548306.152130604    76 0.514503190    10.10.1.1 → 10.10.1.2    TCP 83 8081 → 59880 [PSH, ACK] Seq=52 Ack=69 Win=65152 Len=17 TSval=3171282412 TSecr=1047022702
1711548314.152130604    84 0.515661311    10.10.1.2 → 10.10.1.1    TCP 83 59880 → 8081 [PSH, ACK] Seq=69 Ack=69 Win=64256 Len=17 TSval=1047022703 TSecr=3171282412
1711548316.152130604    86 0.515692817    10.10.1.1 → 10.10.1.2    TCP 83 8081 → 59880 [PSH, ACK] Seq=69 Ack=86 Win=65152 Len=17 TSval=3171282413 TSecr=1047022703
1711548324.152130604    94 0.516850619    10.10.1.2 → 10.10.1.1    TCP 83 59880 → 8081 [PSH, ACK] Seq=86 Ack=86 Win=64256 Len=17 TSval=1047022704 TSecr=3171282413
1711548326.152130604    96 0.516886788    10.10.1.1 → 10.10.1.2    TCP 83 8081 → 59880 [PSH, ACK] Seq=86 Ack=103 Win=65152 Len=17 TSval=3171282414 TSecr=1047022704
1711548334.152130604   104 0.518047225    10.10.1.2 → 10.10.1.1    TCP 83 59880 → 8081 [PSH, ACK] Seq=103 Ack=103 Win=64256 Len=17 TSval=1047022705 TSecr=3171282414
1711548336.152130604   106 0.518078807    10.10.1.1 → 10.10.1.2    TCP 83 8081 → 59880 [PSH, ACK] Seq=103 Ack=120 Win=65152 Len=17 TSval=3171282416 TSecr=1047022705
1711548344.152130604   114 0.519236939    10.10.1.2 → 10.10.1.1    TCP 83 59880 → 8081 [PSH, ACK] Seq=120 Ack=120 Win=64256 Len=17 TSval=1047022706 TSecr=3171282416
1711548346.152130604   116 0.519268913    10.10.1.1 → 10.10.1.2    TCP 83 8081 → 59880 [PSH, ACK] Seq=120 Ack=137 Win=65152 Len=17 TSval=3171282417 TSecr=1047022706
1711548354.152130604   124 0.520411827    10.10.1.2 → 10.10.1.1    TCP 83 59880 → 8081 [PSH, ACK] Seq=137 Ack=137 Win=64256 Len=17 TSval=1047022708 TSecr=3171282417
1711548356.152130604   126 0.520446944    10.10.1.1 → 10.10.1.2    TCP 83 8081 → 59880 [PSH, ACK] Seq=137 Ack=154 Win=65152 Len=17 TSval=3171282418 TSecr=1047022708
1711548364.152130604   134 0.521608859    10.10.1.2 → 10.10.1.1    TCP 83 59880 → 8081 [PSH, ACK] Seq=154 Ack=154 Win=64256 Len=17 TSval=1047022709 TSecr=3171282418
1711548366.152130604   136 0.521640378    10.10.1.1 → 10.10.1.2    TCP 83 8081 → 59880 [PSH, ACK] Seq=154 Ack=171 Win=65152 Len=17 TSval=3171282419 TSecr=1047022709
1711548374.152130604   144 0.522799419    10.10.1.2 → 10.10.1.1    TCP 83 59880 → 8081 [PSH, ACK] Seq=171 Ack=171 Win=64256 Len=17 TSval=1047022710 TSecr=3171282419
1711548376.152130604   146 0.522837556    10.10.1.1 → 10.10.1.2    TCP 83 8081 → 59880 [PSH, ACK] Seq=171 Ack=188 Win=65152 Len=17 TSval=3171282420 TSecr=1047022710
1711548384.152130604   154 0.523994642    10.10.1.2 → 10.10.1.1    TCP 83 59880 → 8081 [PSH, ACK] Seq=188 Ack=188 Win=64256 Len=17 TSval=1047022711 TSecr=3171282420
1711548386.152130604   156 0.524029773    10.10.1.1 → 10.10.1.2    TCP 83 8081 → 59880 [PSH, ACK] Seq=188 Ack=205 Win=65152 Len=17 TSval=3171282422 TSecr=1047022711
1711548394.152130604   164 0.525187110    10.10.1.2 → 10.10.1.1    TCP 83 59880 → 8081 [PSH, ACK] Seq=205 Ack=205 Win=64256 Len=17 TSval=1047022712 TSecr=3171282422
1711548396.152130604   166 0.525220745    10.10.1.1 → 10.10.1.2    TCP 83 8081 → 59880 [PSH, ACK] Seq=205 Ack=222 Win=65152 Len=17 TSval=3171282423 TSecr=1047022712
1711548404.152130604   174 0.526380995    10.10.1.2 → 10.10.1.1    TCP 83 59880 → 8081 [PSH, ACK] Seq=222 Ack=222 Win=64256 Len=17 TSval=1047022713 TSecr=3171282423
1711548406.152130604   176 0.526410795    10.10.1.1 → 10.10.1.2    TCP 83 8081 → 59880 [PSH, ACK] Seq=222 Ack=239 Win=65152 Len=17 TSval=3171282424 TSecr=1047022713
1711548414.152130604   184 0.527567700    10.10.1.2 → 10.10.1.1    TCP 83 59880 → 8081 [PSH, ACK] Seq=239 Ack=239 Win=64256 Len=17 TSval=1047022715 TSecr=3171282424
1711548416.152130604   186 0.527596990    10.10.1.1 → 10.10.1.2    TCP 83 8081 → 59880 [PSH, ACK] Seq=239 Ack=256 Win=65152 Len=17 TSval=3171282425 TSecr=1047022715
1711548424.152130604   194 0.528754151    10.10.1.2 → 10.10.1.1    TCP 83 59880 → 8081 [PSH, ACK] Seq=256 Ack=256 Win=64256 Len=17 TSval=1047022716 TSecr=3171282425
1711548426.152130604   196 0.528790707    10.10.1.1 → 10.10.1.2    TCP 83 8081 → 59880 [PSH, ACK] Seq=256 Ack=273 Win=65152 Len=17 TSval=3171282426 TSecr=1047022716
1711548434.152130604   204 0.529951371    10.10.1.2 → 10.10.1.1    TCP 83 59880 → 8081 [PSH, ACK] Seq=273 Ack=273 Win=64256 Len=17 TSval=1047022717 TSecr=3171282426
1711548436.152130604   206 0.529983187    10.10.1.1 → 10.10.1.2    TCP 83 8081 → 59880 [PSH, ACK] Seq=273 Ack=290 Win=65152 Len=17 TSval=3171282427 TSecr=1047022717
1711548444.152130604   214 0.531139934    10.10.1.2 → 10.10.1.1    TCP 83 59880 → 8081 [PSH, ACK] Seq=290 Ack=290 Win=64256 Len=17 TSval=1047022718 TSecr=3171282427
1711548446.152130604   216 0.531170581    10.10.1.1 → 10.10.1.2    TCP 83 8081 → 59880 [PSH, ACK] Seq=290 Ack=307 Win=65152 Len=17 TSval=3171282429 TSecr=1047022718
1711548454.152130604   224 0.532326466    10.10.1.2 → 10.10.1.1    TCP 83 59880 → 8081 [PSH, ACK] Seq=307 Ack=307 Win=64256 Len=17 TSval=1047022719 TSecr=3171282429
1711548456.152130604   226 0.532362866    10.10.1.1 → 10.10.1.2    TCP 83 8081 → 59880 [PSH, ACK] Seq=307 Ack=324 Win=65152 Len=17 TSval=3171282430 TSecr=1047022719
1711548466.152130604   236 0.533531023    10.10.1.2 → 10.10.1.1    TCP 83 59880 → 8081 [PSH, ACK] Seq=324 Ack=324 Win=64256 Len=17 TSval=1047022721 TSecr=3171282430
1711548468.152130604   238 0.533561937    10.10.1.1 → 10.10.1.2    TCP 83 8081 → 59880 [PSH, ACK] Seq=324 Ack=341 Win=65152 Len=17 TSval=3171282431 TSecr=1047022721
1711548476.152130604   246 0.534720465    10.10.1.2 → 10.10.1.1    TCP 83 59880 → 8081 [PSH, ACK] Seq=341 Ack=341 Win=64256 Len=17 TSval=1047022722 TSecr=3171282431
1711548478.152130604   248 0.534752061    10.10.1.1 → 10.10.1.2    TCP 83 8081 → 59880 [PSH, ACK] Seq=341 Ack=358 Win=65152 Len=17 TSval=3171282432 TSecr=1047022722
1711548486.152130604   256 0.535907759    10.10.1.2 → 10.10.1.1    TCP 83 59880 → 8081 [PSH, ACK] Seq=358 Ack=358 Win=64256 Len=17 TSval=1047022723 TSecr=3171282432
1711548488.152130604   258 0.535936657    10.10.1.1 → 10.10.1.2    TCP 83 8081 → 59880 [PSH, ACK] Seq=358 Ack=375 Win=65152 Len=17 TSval=3171282433 TSecr=1047022723
1711548496.152130604   266 0.537094116    10.10.1.2 → 10.10.1.1    TCP 83 59880 → 8081 [PSH, ACK] Seq=375 Ack=375 Win=64256 Len=17 TSval=1047022724 TSecr=3171282433
1711548498.152130604   268 0.537127772    10.10.1.1 → 10.10.1.2    TCP 83 8081 → 59880 [PSH, ACK] Seq=375 Ack=392 Win=65152 Len=17 TSval=3171282435 TSecr=1047022724
1711548506.152130604   276 0.538286513    10.10.1.2 → 10.10.1.1    TCP 83 59880 → 8081 [PSH, ACK] Seq=392 Ack=392 Win=64256 Len=17 TSval=1047022725 TSecr=3171282435
1711548508.152130604   278 0.538317304    10.10.1.1 → 10.10.1.2    TCP 83 8081 → 59880 [PSH, ACK] Seq=392 Ack=409 Win=65152 Len=17 TSval=3171282436 TSecr=1047022725
1711548516.152130604   286 0.539473274    10.10.1.2 → 10.10.1.1    TCP 83 59880 → 8081 [PSH, ACK] Seq=409 Ack=409 Win=64256 Len=17 TSval=1047022727 TSecr=3171282436
1711548518.152130604   288 0.539504477    10.10.1.1 → 10.10.1.2    TCP 83 8081 → 59880 [PSH, ACK] Seq=409 Ack=426 Win=65152 Len=17 TSval=3171282437 TSecr=1047022727
1711548526.152130604   296 0.540660794    10.10.1.2 → 10.10.1.1    TCP 83 59880 → 8081 [PSH, ACK] Seq=426 Ack=426 Win=64256 Len=17 TSval=1047022728 TSecr=3171282437
1711548528.152130604   298 0.540696318    10.10.1.1 → 10.10.1.2    TCP 83 8081 → 59880 [PSH, ACK] Seq=426 Ack=443 Win=65152 Len=17 TSval=3171282438 TSecr=1047022728
1711548536.152130604   306 0.541855405    10.10.1.2 → 10.10.1.1    TCP 83 59880 → 8081 [PSH, ACK] Seq=443 Ack=443 Win=64256 Len=17 TSval=1047022729 TSecr=3171282438
1711548538.152130604   308 0.541883645    10.10.1.1 → 10.10.1.2    TCP 83 8081 → 59880 [PSH, ACK] Seq=443 Ack=460 Win=65152 Len=17 TSval=3171282439 TSecr=1047022729
1711548546.152130604   316 0.543039819    10.10.1.2 → 10.10.1.1    TCP 83 59880 → 8081 [PSH, ACK] Seq=460 Ack=460 Win=64256 Len=17 TSval=1047022730 TSecr=3171282439
1711548548.152130604   318 0.543069444    10.10.1.1 → 10.10.1.2    TCP 83 8081 → 59880 [PSH, ACK] Seq=460 Ack=477 Win=65152 Len=17 TSval=3171282441 TSecr=1047022730
1711548556.152130604   326 0.544226114    10.10.1.2 → 10.10.1.1    TCP 83 59880 → 8081 [PSH, ACK] Seq=477 Ack=477 Win=64256 Len=17 TSval=1047022731 TSecr=3171282441
1711548558.152130604   328 0.544260356    10.10.1.1 → 10.10.1.2    TCP 83 8081 → 59880 [PSH, ACK] Seq=477 Ack=494 Win=65152 Len=17 TSval=3171282442 TSecr=1047022731
1711548566.152130604   336 0.545417732    10.10.1.2 → 10.10.1.1    TCP 83 59880 → 8081 [PSH, ACK] Seq=494 Ack=494 Win=64256 Len=17 TSval=1047022733 TSecr=3171282442
1711548568.152130604   338 0.545448404    10.10.1.1 → 10.10.1.2    TCP 83 8081 → 59880 [PSH, ACK] Seq=494 Ack=511 Win=65152 Len=17 TSval=3171282443 TSecr=1047022733
1711548576.152130604   346 0.546607648    10.10.1.2 → 10.10.1.1    TCP 83 59880 → 8081 [PSH, ACK] Seq=511 Ack=511 Win=64256 Len=17 TSval=1047022734 TSecr=3171282443
1711548578.152130604   348 0.546638539    10.10.1.1 → 10.10.1.2    TCP 83 8081 → 59880 [PSH, ACK] Seq=511 Ack=528 Win=65152 Len=17 TSval=3171282444 TSecr=1047022734
1711548586.152130604   356 0.547794133    10.10.1.2 → 10.10.1.1    TCP 83 59880 → 8081 [PSH, ACK] Seq=528 Ack=528 Win=64256 Len=17 TSval=1047022735 TSecr=3171282444
1711548588.152130604   358 0.547823139    10.10.1.1 → 10.10.1.2    TCP 83 8081 → 59880 [PSH, ACK] Seq=528 Ack=545 Win=65152 Len=17 TSval=3171282445 TSecr=1047022735
1711548596.152130604   366 0.548980174    10.10.1.2 → 10.10.1.1    TCP 83 59880 → 8081 [PSH, ACK] Seq=545 Ack=545 Win=64256 Len=17 TSval=1047022736 TSecr=3171282445
1711548598.152130604   368 0.549015316    10.10.1.1 → 10.10.1.2    TCP 83 8081 → 59880 [PSH, ACK] Seq=545 Ack=562 Win=65152 Len=17 TSval=3171282447 TSecr=1047022736
1711548606.152130604   376 0.550174851    10.10.1.2 → 10.10.1.1    TCP 83 59880 → 8081 [PSH, ACK] Seq=562 Ack=562 Win=64256 Len=17 TSval=1047022737 TSecr=3171282447
1711548608.152130604   378 0.550205148    10.10.1.1 → 10.10.1.2    TCP 83 8081 → 59880 [PSH, ACK] Seq=562 Ack=579 Win=65152 Len=17 TSval=3171282448 TSecr=1047022737
1711548616.152130604   386 0.551360754    10.10.1.2 → 10.10.1.1    TCP 83 59880 → 8081 [PSH, ACK] Seq=579 Ack=579 Win=64256 Len=17 TSval=1047022738 TSecr=3171282448
1711548618.152130604   388 0.551391391    10.10.1.1 → 10.10.1.2    TCP 83 8081 → 59880 [PSH, ACK] Seq=579 Ack=596 Win=65152 Len=17 TSval=3171282449 TSecr=1047022738
1711548626.152130604   396 0.552548081    10.10.1.2 → 10.10.1.1    TCP 83 59880 → 8081 [PSH, ACK] Seq=596 Ack=596 Win=64256 Len=17 TSval=1047022740 TSecr=3171282449
1711548628.152130604   398 0.552583147    10.10.1.1 → 10.10.1.2    TCP 83 8081 → 59880 [PSH, ACK] Seq=596 Ack=613 Win=65152 Len=17 TSval=3171282450 TSecr=1047022740
1711548636.152130604   406 0.553743015    10.10.1.2 → 10.10.1.1    TCP 83 59880 → 8081 [PSH, ACK] Seq=613 Ack=613 Win=64256 Len=17 TSval=1047022741 TSecr=3171282450
1711548638.152130604   408 0.553773839    10.10.1.1 → 10.10.1.2    TCP 83 8081 → 59880 [PSH, ACK] Seq=613 Ack=630 Win=65152 Len=17 TSval=3171282451 TSecr=1047022741
1711548646.152130604   416 0.554930730    10.10.1.2 → 10.10.1.1    TCP 83 59880 → 8081 [PSH, ACK] Seq=630 Ack=630 Win=64256 Len=17 TSval=1047022742 TSecr=3171282451
1711548648.152130604   418 0.554961103    10.10.1.1 → 10.10.1.2    TCP 83 8081 → 59880 [PSH, ACK] Seq=630 Ack=647 Win=65152 Len=17 TSval=3171282452 TSecr=1047022742
1711548656.152130604   426 0.556117187    10.10.1.2 → 10.10.1.1    TCP 83 59880 → 8081 [PSH, ACK] Seq=647 Ack=647 Win=64256 Len=17 TSval=1047022743 TSecr=3171282452
1711548658.152130604   428 0.556152044    10.10.1.1 → 10.10.1.2    TCP 83 8081 → 59880 [PSH, ACK] Seq=647 Ack=664 Win=65152 Len=17 TSval=3171282454 TSecr=1047022743
1711548666.152130604   436 0.557309570    10.10.1.2 → 10.10.1.1    TCP 83 59880 → 8081 [PSH, ACK] Seq=664 Ack=664 Win=64256 Len=17 TSval=1047022744 TSecr=3171282454
1711548668.152130604   438 0.557340333    10.10.1.1 → 10.10.1.2    TCP 83 8081 → 59880 [PSH, ACK] Seq=664 Ack=681 Win=65152 Len=17 TSval=3171282455 TSecr=1047022744
1711548676.152130604   446 0.558499862    10.10.1.2 → 10.10.1.1    TCP 83 59880 → 8081 [PSH, ACK] Seq=681 Ack=681 Win=64256 Len=17 TSval=1047022746 TSecr=3171282455
1711548678.152130604   448 0.558530404    10.10.1.1 → 10.10.1.2    TCP 83 8081 → 59880 [PSH, ACK] Seq=681 Ack=698 Win=65152 Len=17 TSval=3171282456 TSecr=1047022746
1711548686.152130604   456 0.559686627    10.10.1.2 → 10.10.1.1    TCP 83 59880 → 8081 [PSH, ACK] Seq=698 Ack=698 Win=64256 Len=17 TSval=1047022747 TSecr=3171282456
1711548688.152130604   458 0.559715516    10.10.1.1 → 10.10.1.2    TCP 83 8081 → 59880 [PSH, ACK] Seq=698 Ack=715 Win=65152 Len=17 TSval=3171282457 TSecr=1047022747
1711548696.152130604   466 0.560871582    10.10.1.2 → 10.10.1.1    TCP 83 59880 → 8081 [PSH, ACK] Seq=715 Ack=715 Win=64256 Len=17 TSval=1047022748 TSecr=3171282457
1711548698.152130604   468 0.560906005    10.10.1.1 → 10.10.1.2    TCP 83 8081 → 59880 [PSH, ACK] Seq=715 Ack=732 Win=65152 Len=17 TSval=3171282458 TSecr=1047022748
1711548706.152130604   476 0.562066038    10.10.1.2 → 10.10.1.1    TCP 83 59880 → 8081 [PSH, ACK] Seq=732 Ack=732 Win=64256 Len=17 TSval=1047022749 TSecr=3171282458
1711548708.152130604   478 0.562097226    10.10.1.1 → 10.10.1.2    TCP 83 8081 → 59880 [PSH, ACK] Seq=732 Ack=749 Win=65152 Len=17 TSval=3171282460 TSecr=1047022749
1711548716.152130604   486 0.563252198    10.10.1.2 → 10.10.1.1    TCP 83 59880 → 8081 [PSH, ACK] Seq=749 Ack=749 Win=64256 Len=17 TSval=1047022750 TSecr=3171282460
1711548718.152130604   488 0.563283633    10.10.1.1 → 10.10.1.2    TCP 83 8081 → 59880 [PSH, ACK] Seq=749 Ack=766 Win=65152 Len=17 TSval=3171282461 TSecr=1047022750
1711548726.152130604   496 0.564410446    10.10.1.2 → 10.10.1.1    TCP 83 59880 → 8081 [PSH, ACK] Seq=766 Ack=766 Win=64256 Len=17 TSval=1047022752 TSecr=3171282461
1711548728.152130604   498 0.564444995    10.10.1.1 → 10.10.1.2    TCP 83 8081 → 59880 [PSH, ACK] Seq=766 Ack=783 Win=65152 Len=17 TSval=3171282462 TSecr=1047022752
1711548736.152130604   506 0.565604966    10.10.1.2 → 10.10.1.1    TCP 83 59880 → 8081 [PSH, ACK] Seq=783 Ack=783 Win=64256 Len=17 TSval=1047022753 TSecr=3171282462
1711548738.152130604   508 0.565636087    10.10.1.1 → 10.10.1.2    TCP 83 8081 → 59880 [PSH, ACK] Seq=783 Ack=800 Win=65152 Len=17 TSval=3171282463 TSecr=1047022753
1711548746.152130604   516 0.566791580    10.10.1.2 → 10.10.1.1    TCP 83 59880 → 8081 [PSH, ACK] Seq=800 Ack=800 Win=64256 Len=17 TSval=1047022754 TSecr=3171282463
1711548748.152130604   518 0.566822415    10.10.1.1 → 10.10.1.2    TCP 83 8081 → 59880 [PSH, ACK] Seq=800 Ack=817 Win=65152 Len=17 TSval=3171282464 TSecr=1047022754
1711548756.152130604   526 0.567977234    10.10.1.2 → 10.10.1.1    TCP 83 59880 → 8081 [PSH, ACK] Seq=817 Ack=817 Win=64256 Len=17 TSval=1047022755 TSecr=3171282464
1711548758.152130604   528 0.568019669    10.10.1.1 → 10.10.1.2    TCP 83 8081 → 59880 [PSH, ACK] Seq=817 Ack=834 Win=65152 Len=17 TSval=3171282466 TSecr=1047022755
1711548766.152130604   536 0.569176415    10.10.1.2 → 10.10.1.1    TCP 83 59880 → 8081 [PSH, ACK] Seq=834 Ack=834 Win=64256 Len=17 TSval=1047022756 TSecr=3171282466
1711548768.152130604   538 0.569209343    10.10.1.1 → 10.10.1.2    TCP 83 8081 → 59880 [PSH, ACK] Seq=834 Ack=851 Win=65152 Len=17 TSval=3171282467 TSecr=1047022756
1711548776.152130604   546 0.570368953    10.10.1.2 → 10.10.1.1    TCP 83 59880 → 8081 [PSH, ACK] Seq=851 Ack=851 Win=64256 Len=17 TSval=1047022757 TSecr=3171282467
1711548778.152130604   548 0.570398104    10.10.1.1 → 10.10.1.2    TCP 83 8081 → 59880 [PSH, ACK] Seq=851 Ack=868 Win=65152 Len=17 TSval=3171282468 TSecr=1047022757
1711548786.152130604   556 0.571554177    10.10.1.2 → 10.10.1.1    TCP 83 59880 → 8081 [PSH, ACK] Seq=868 Ack=868 Win=64256 Len=17 TSval=1047022759 TSecr=3171282468
1711548788.152130604   558 0.571583395    10.10.1.1 → 10.10.1.2    TCP 83 8081 → 59880 [PSH, ACK] Seq=868 Ack=885 Win=65152 Len=17 TSval=3171282469 TSecr=1047022759
1711548796.152130604   566 0.572740128    10.10.1.2 → 10.10.1.1    TCP 83 59880 → 8081 [PSH, ACK] Seq=885 Ack=885 Win=64256 Len=17 TSval=1047022760 TSecr=3171282469
1711548798.152130604   568 0.572775414    10.10.1.1 → 10.10.1.2    TCP 83 8081 → 59880 [PSH, ACK] Seq=885 Ack=902 Win=65152 Len=17 TSval=3171282470 TSecr=1047022760
1711548806.152130604   576 0.573935586    10.10.1.2 → 10.10.1.1    TCP 83 59880 → 8081 [PSH, ACK] Seq=902 Ack=902 Win=64256 Len=17 TSval=1047022761 TSecr=3171282470
1711548808.152130604   578 0.573966333    10.10.1.1 → 10.10.1.2    TCP 83 8081 → 59880 [PSH, ACK] Seq=902 Ack=919 Win=65152 Len=17 TSval=3171282471 TSecr=1047022761
1711548816.152130604   586 0.575122489    10.10.1.2 → 10.10.1.1    TCP 83 59880 → 8081 [PSH, ACK] Seq=919 Ack=919 Win=64256 Len=17 TSval=1047022762 TSecr=3171282471
1711548818.152130604   588 0.575153283    10.10.1.1 → 10.10.1.2    TCP 83 8081 → 59880 [PSH, ACK] Seq=919 Ack=936 Win=65152 Len=17 TSval=3171282473 TSecr=1047022762
1711548826.152130604   596 0.576309586    10.10.1.2 → 10.10.1.1    TCP 83 59880 → 8081 [PSH, ACK] Seq=936 Ack=936 Win=64256 Len=17 TSval=1047022763 TSecr=3171282473
1711548828.152130604   598 0.576346649    10.10.1.1 → 10.10.1.2    TCP 83 8081 → 59880 [PSH, ACK] Seq=936 Ack=953 Win=65152 Len=17 TSval=3171282474 TSecr=1047022763
1711548836.152130604   606 0.577503753    10.10.1.2 → 10.10.1.1    TCP 83 59880 → 8081 [PSH, ACK] Seq=953 Ack=953 Win=64256 Len=17 TSval=1047022765 TSecr=3171282474
1711548839.152130604   609 0.577573358    10.10.1.1 → 10.10.1.2    TCP 83 8081 → 59880 [PSH, ACK] Seq=953 Ack=970 Win=65152 Len=17 TSval=3171282475 TSecr=1047022765
1711548846.152130604   616 0.578732590    10.10.1.2 → 10.10.1.1    TCP 83 59880 → 8081 [PSH, ACK] Seq=970 Ack=970 Win=64256 Len=17 TSval=1047022766 TSecr=3171282475
1711548848.152130604   618 0.578764462    10.10.1.1 → 10.10.1.2    TCP 83 8081 → 59880 [PSH, ACK] Seq=970 Ack=987 Win=65152 Len=17 TSval=3171282476 TSecr=1047022766
1711548856.152130604   626 0.579920402    10.10.1.2 → 10.10.1.1    TCP 83 59880 → 8081 [PSH, ACK] Seq=987 Ack=987 Win=64256 Len=17 TSval=1047022767 TSecr=3171282476
1711548858.152130604   628 0.579949653    10.10.1.1 → 10.10.1.2    TCP 83 8081 → 59880 [PSH, ACK] Seq=987 Ack=1004 Win=65152 Len=17 TSval=3171282477 TSecr=1047022767
1711548866.152130604   636 0.581106944    10.10.1.2 → 10.10.1.1    TCP 83 59880 → 8081 [PSH, ACK] Seq=1004 Ack=1004 Win=64256 Len=17 TSval=1047022768 TSecr=3171282477
1711548868.152130604   638 0.581139547    10.10.1.1 → 10.10.1.2    TCP 83 8081 → 59880 [PSH, ACK] Seq=1004 Ack=1021 Win=65152 Len=17 TSval=3171282479 TSecr=1047022768
1711548876.152130604   646 0.582300194    10.10.1.2 → 10.10.1.1    TCP 83 59880 → 8081 [PSH, ACK] Seq=1021 Ack=1021 Win=64256 Len=17 TSval=1047022769 TSecr=3171282479
1711548878.152130604   648 0.582330084    10.10.1.1 → 10.10.1.2    TCP 83 8081 → 59880 [PSH, ACK] Seq=1021 Ack=1038 Win=65152 Len=17 TSval=3171282480 TSecr=1047022769
1711548886.152130604   656 0.583486091    10.10.1.2 → 10.10.1.1    TCP 83 59880 → 8081 [PSH, ACK] Seq=1038 Ack=1038 Win=64256 Len=17 TSval=1047022771 TSecr=3171282480
1711548888.152130604   658 0.583515802    10.10.1.1 → 10.10.1.2    TCP 83 8081 → 59880 [PSH, ACK] Seq=1038 Ack=1055 Win=65152 Len=17 TSval=3171282481 TSecr=1047022771
1711548896.152130604   666 0.584672437    10.10.1.2 → 10.10.1.1    TCP 83 59880 → 8081 [PSH, ACK] Seq=1055 Ack=1055 Win=64256 Len=17 TSval=1047022772 TSecr=3171282481
1711548898.152130604   668 0.584707532    10.10.1.1 → 10.10.1.2    TCP 83 8081 → 59880 [PSH, ACK] Seq=1055 Ack=1072 Win=65152 Len=17 TSval=3171282482 TSecr=1047022772
1711548906.152130604   676 0.585866921    10.10.1.2 → 10.10.1.1    TCP 83 59880 → 8081 [PSH, ACK] Seq=1072 Ack=1072 Win=64256 Len=17 TSval=1047022773 TSecr=3171282482
1711548908.152130604   678 0.585897370    10.10.1.1 → 10.10.1.2    TCP 83 8081 → 59880 [PSH, ACK] Seq=1072 Ack=1089 Win=65152 Len=17 TSval=3171282483 TSecr=1047022773
1711548916.152130604   686 0.587053281    10.10.1.2 → 10.10.1.1    TCP 83 59880 → 8081 [PSH, ACK] Seq=1089 Ack=1089 Win=64256 Len=17 TSval=1047022774 TSecr=3171282483
1711548918.152130604   688 0.587084281    10.10.1.1 → 10.10.1.2    TCP 83 8081 → 59880 [PSH, ACK] Seq=1089 Ack=1106 Win=65152 Len=17 TSval=3171282485 TSecr=1047022774
1711548926.152130604   696 0.588240343    10.10.1.2 → 10.10.1.1    TCP 83 59880 → 8081 [PSH, ACK] Seq=1106 Ack=1106 Win=64256 Len=17 TSval=1047022775 TSecr=3171282485
1711548928.152130604   698 0.588275742    10.10.1.1 → 10.10.1.2    TCP 83 8081 → 59880 [PSH, ACK] Seq=1106 Ack=1123 Win=65152 Len=17 TSval=3171282486 TSecr=1047022775
1711548936.152130604   706 0.589432275    10.10.1.2 → 10.10.1.1    TCP 83 59880 → 8081 [PSH, ACK] Seq=1123 Ack=1123 Win=64256 Len=17 TSval=1047022777 TSecr=3171282486
1711548938.152130604   708 0.589463212    10.10.1.1 → 10.10.1.2    TCP 83 8081 → 59880 [PSH, ACK] Seq=1123 Ack=1140 Win=65152 Len=17 TSval=3171282487 TSecr=1047022777
1711548946.152130604   716 0.590622418    10.10.1.2 → 10.10.1.1    TCP 83 59880 → 8081 [PSH, ACK] Seq=1140 Ack=1140 Win=64256 Len=17 TSval=1047022778 TSecr=3171282487
1711548948.152130604   718 0.590654000    10.10.1.1 → 10.10.1.2    TCP 83 8081 → 59880 [PSH, ACK] Seq=1140 Ack=1157 Win=65152 Len=17 TSval=3171282488 TSecr=1047022778
1711548956.152130604   726 0.591809830    10.10.1.2 → 10.10.1.1    TCP 83 59880 → 8081 [PSH, ACK] Seq=1157 Ack=1157 Win=64256 Len=17 TSval=1047022779 TSecr=3171282488
1711548958.152130604   728 0.591839412    10.10.1.1 → 10.10.1.2    TCP 83 8081 → 59880 [PSH, ACK] Seq=1157 Ack=1174 Win=65152 Len=17 TSval=3171282489 TSecr=1047022779
1711548966.152130604   736 0.592996579    10.10.1.2 → 10.10.1.1    TCP 83 59880 → 8081 [PSH, ACK] Seq=1174 Ack=1174 Win=64256 Len=17 TSval=1047022780 TSecr=3171282489
1711548968.152130604   738 0.593031688    10.10.1.1 → 10.10.1.2    TCP 83 8081 → 59880 [PSH, ACK] Seq=1174 Ack=1191 Win=65152 Len=17 TSval=3171282491 TSecr=1047022780
1711548976.152130604   746 0.594191262    10.10.1.2 → 10.10.1.1    TCP 83 59880 → 8081 [PSH, ACK] Seq=1191 Ack=1191 Win=64256 Len=17 TSval=1047022781 TSecr=3171282491
1711548978.152130604   748 0.594222883    10.10.1.1 → 10.10.1.2    TCP 83 8081 → 59880 [PSH, ACK] Seq=1191 Ack=1208 Win=65152 Len=17 TSval=3171282492 TSecr=1047022781
1711548986.152130604   756 0.595379007    10.10.1.2 → 10.10.1.1    TCP 83 59880 → 8081 [PSH, ACK] Seq=1208 Ack=1208 Win=64256 Len=17 TSval=1047022782 TSecr=3171282492
1711548988.152130604   758 0.595409986    10.10.1.1 → 10.10.1.2    TCP 83 8081 → 59880 [PSH, ACK] Seq=1208 Ack=1225 Win=65152 Len=17 TSval=3171282493 TSecr=1047022782
1711548996.152130604   766 0.596567797    10.10.1.2 → 10.10.1.1    TCP 83 59880 → 8081 [PSH, ACK] Seq=1225 Ack=1225 Win=64256 Len=17 TSval=1047022784 TSecr=3171282493
1711548998.152130604   768 0.596603247    10.10.1.1 → 10.10.1.2    TCP 83 8081 → 59880 [PSH, ACK] Seq=1225 Ack=1242 Win=65152 Len=17 TSval=3171282494 TSecr=1047022784
1711549006.152130604   776 0.597762535    10.10.1.2 → 10.10.1.1    TCP 83 59880 → 8081 [PSH, ACK] Seq=1242 Ack=1242 Win=64256 Len=17 TSval=1047022785 TSecr=3171282494
1711549008.152130604   778 0.597794265    10.10.1.1 → 10.10.1.2    TCP 83 8081 → 59880 [PSH, ACK] Seq=1242 Ack=1259 Win=65152 Len=17 TSval=3171282495 TSecr=1047022785
1711549016.152130604   786 0.598949316    10.10.1.2 → 10.10.1.1    TCP 83 59880 → 8081 [PSH, ACK] Seq=1259 Ack=1259 Win=64256 Len=17 TSval=1047022786 TSecr=3171282495
1711549018.152130604   788 0.598980117    10.10.1.1 → 10.10.1.2    TCP 83 8081 → 59880 [PSH, ACK] Seq=1259 Ack=1276 Win=65152 Len=17 TSval=3171282496 TSecr=1047022786
1711549026.152130604   796 0.600135924    10.10.1.2 → 10.10.1.1    TCP 83 59880 → 8081 [PSH, ACK] Seq=1276 Ack=1276 Win=64256 Len=17 TSval=1047022787 TSecr=3171282496
1711549028.152130604   798 0.600171430    10.10.1.1 → 10.10.1.2    TCP 83 8081 → 59880 [PSH, ACK] Seq=1276 Ack=1293 Win=65152 Len=17 TSval=3171282498 TSecr=1047022787
1711549036.152130604   806 0.601328441    10.10.1.2 → 10.10.1.1    TCP 83 59880 → 8081 [PSH, ACK] Seq=1293 Ack=1293 Win=64256 Len=17 TSval=1047022788 TSecr=3171282498
1711549038.152130604   808 0.601360451    10.10.1.1 → 10.10.1.2    TCP 83 8081 → 59880 [PSH, ACK] Seq=1293 Ack=1310 Win=65152 Len=17 TSval=3171282499 TSecr=1047022788
1711549046.152130604   816 0.602519548    10.10.1.2 → 10.10.1.1    TCP 83 59880 → 8081 [PSH, ACK] Seq=1310 Ack=1310 Win=64256 Len=17 TSval=1047022790 TSecr=3171282499
1711549048.152130604   818 0.602550051    10.10.1.1 → 10.10.1.2    TCP 83 8081 → 59880 [PSH, ACK] Seq=1310 Ack=1327 Win=65152 Len=17 TSval=3171282500 TSecr=1047022790
1711549056.152130604   826 0.603705496    10.10.1.2 → 10.10.1.1    TCP 83 59880 → 8081 [PSH, ACK] Seq=1327 Ack=1327 Win=64256 Len=17 TSval=1047022791 TSecr=3171282500
1711549058.152130604   828 0.603736303    10.10.1.1 → 10.10.1.2    TCP 83 8081 → 59880 [PSH, ACK] Seq=1327 Ack=1344 Win=65152 Len=17 TSval=3171282501 TSecr=1047022791
1711549066.152130604   836 0.604893095    10.10.1.2 → 10.10.1.1    TCP 83 59880 → 8081 [PSH, ACK] Seq=1344 Ack=1344 Win=64256 Len=17 TSval=1047022792 TSecr=3171282501
1711549068.152130604   838 0.604927800    10.10.1.1 → 10.10.1.2    TCP 83 8081 → 59880 [PSH, ACK] Seq=1344 Ack=1361 Win=65152 Len=17 TSval=3171282502 TSecr=1047022792
1711549076.152130604   846 0.606087031    10.10.1.2 → 10.10.1.1    TCP 83 59880 → 8081 [PSH, ACK] Seq=1361 Ack=1361 Win=64256 Len=17 TSval=1047022793 TSecr=3171282502
1711549078.152130604   848 0.606118861    10.10.1.1 → 10.10.1.2    TCP 83 8081 → 59880 [PSH, ACK] Seq=1361 Ack=1378 Win=65152 Len=17 TSval=3171282504 TSecr=1047022793
1711549086.152130604   856 0.607274388    10.10.1.2 → 10.10.1.1    TCP 83 59880 → 8081 [PSH, ACK] Seq=1378 Ack=1378 Win=64256 Len=17 TSval=1047022794 TSecr=3171282504
1711549088.152130604   858 0.607305378    10.10.1.1 → 10.10.1.2    TCP 83 8081 → 59880 [PSH, ACK] Seq=1378 Ack=1395 Win=65152 Len=17 TSval=3171282505 TSecr=1047022794
1711549096.152130604   866 0.608461606    10.10.1.2 → 10.10.1.1    TCP 83 59880 → 8081 [PSH, ACK] Seq=1395 Ack=1395 Win=64256 Len=17 TSval=1047022796 TSecr=3171282505
1711549098.152130604   868 0.608497241    10.10.1.1 → 10.10.1.2    TCP 83 8081 → 59880 [PSH, ACK] Seq=1395 Ack=1412 Win=65152 Len=17 TSval=3171282506 TSecr=1047022796
1711549106.152130604   876 0.609656576    10.10.1.2 → 10.10.1.1    TCP 83 59880 → 8081 [PSH, ACK] Seq=1412 Ack=1412 Win=64256 Len=17 TSval=1047022797 TSecr=3171282506
1711549108.152130604   878 0.609688453    10.10.1.1 → 10.10.1.2    TCP 83 8081 → 59880 [PSH, ACK] Seq=1412 Ack=1429 Win=65152 Len=17 TSval=3171282507 TSecr=1047022797
1711549116.152130604   886 0.610844247    10.10.1.2 → 10.10.1.1    TCP 83 59880 → 8081 [PSH, ACK] Seq=1429 Ack=1429 Win=64256 Len=17 TSval=1047022798 TSecr=3171282507
1711549118.152130604   888 0.610875436    10.10.1.1 → 10.10.1.2    TCP 83 8081 → 59880 [PSH, ACK] Seq=1429 Ack=1446 Win=65152 Len=17 TSval=3171282508 TSecr=1047022798
1711549126.152130604   896 0.612032663    10.10.1.2 → 10.10.1.1    TCP 83 59880 → 8081 [PSH, ACK] Seq=1446 Ack=1446 Win=64256 Len=17 TSval=1047022799 TSecr=3171282508
1711549128.152130604   898 0.612068075    10.10.1.1 → 10.10.1.2    TCP 83 8081 → 59880 [PSH, ACK] Seq=1446 Ack=1463 Win=65152 Len=17 TSval=3171282510 TSecr=1047022799
1711549136.152130604   906 0.613224095    10.10.1.2 → 10.10.1.1    TCP 83 59880 → 8081 [PSH, ACK] Seq=1463 Ack=1463 Win=64256 Len=17 TSval=1047022800 TSecr=3171282510
1711549138.152130604   908 0.613253678    10.10.1.1 → 10.10.1.2    TCP 83 8081 → 59880 [PSH, ACK] Seq=1463 Ack=1480 Win=65152 Len=17 TSval=3171282511 TSecr=1047022800
1711549146.152130604   916 0.614413029    10.10.1.2 → 10.10.1.1    TCP 83 59880 → 8081 [PSH, ACK] Seq=1480 Ack=1480 Win=64256 Len=17 TSval=1047022802 TSecr=3171282511
1711549148.152130604   918 0.614441815    10.10.1.1 → 10.10.1.2    TCP 83 8081 → 59880 [PSH, ACK] Seq=1480 Ack=1497 Win=65152 Len=17 TSval=3171282512 TSecr=1047022802
1711549156.152130604   926 0.615597859    10.10.1.2 → 10.10.1.1    TCP 83 59880 → 8081 [PSH, ACK] Seq=1497 Ack=1497 Win=64256 Len=17 TSval=1047022803 TSecr=3171282512
1711549158.152130604   928 0.615626747    10.10.1.1 → 10.10.1.2    TCP 83 8081 → 59880 [PSH, ACK] Seq=1497 Ack=1514 Win=65152 Len=17 TSval=3171282513 TSecr=1047022803
1711549166.152130604   936 0.616784209    10.10.1.2 → 10.10.1.1    TCP 83 59880 → 8081 [PSH, ACK] Seq=1514 Ack=1514 Win=64256 Len=17 TSval=1047022804 TSecr=3171282513
1711549168.152130604   938 0.616819797    10.10.1.1 → 10.10.1.2    TCP 83 8081 → 59880 [PSH, ACK] Seq=1514 Ack=1531 Win=65152 Len=17 TSval=3171282514 TSecr=1047022804
1711549176.152130604   946 0.617979211    10.10.1.2 → 10.10.1.1    TCP 83 59880 → 8081 [PSH, ACK] Seq=1531 Ack=1531 Win=64256 Len=17 TSval=1047022805 TSecr=3171282514
1711549178.152130604   948 0.618009627    10.10.1.1 → 10.10.1.2    TCP 83 8081 → 59880 [PSH, ACK] Seq=1531 Ack=1548 Win=65152 Len=17 TSval=3171282516 TSecr=1047022805
1711549186.152130604   956 0.619165448    10.10.1.2 → 10.10.1.1    TCP 83 59880 → 8081 [PSH, ACK] Seq=1548 Ack=1548 Win=64256 Len=17 TSval=1047022806 TSecr=3171282516
1711549188.152130604   958 0.619196523    10.10.1.1 → 10.10.1.2    TCP 83 8081 → 59880 [PSH, ACK] Seq=1548 Ack=1565 Win=65152 Len=17 TSval=3171282517 TSecr=1047022806
1711549196.152130604   966 0.620352840    10.10.1.2 → 10.10.1.1    TCP 83 59880 → 8081 [PSH, ACK] Seq=1565 Ack=1565 Win=64256 Len=17 TSval=1047022807 TSecr=3171282517
1711549198.152130604   968 0.620388522    10.10.1.1 → 10.10.1.2    TCP 83 8081 → 59880 [PSH, ACK] Seq=1565 Ack=1582 Win=65152 Len=17 TSval=3171282518 TSecr=1047022807
1711549206.152130604   976 0.621548694    10.10.1.2 → 10.10.1.1    TCP 83 59880 → 8081 [PSH, ACK] Seq=1582 Ack=1582 Win=64256 Len=17 TSval=1047022809 TSecr=3171282518
1711549208.152130604   978 0.621579768    10.10.1.1 → 10.10.1.2    TCP 83 8081 → 59880 [PSH, ACK] Seq=1582 Ack=1599 Win=65152 Len=17 TSval=3171282519 TSecr=1047022809
1711549216.152130604   986 0.622735120    10.10.1.2 → 10.10.1.1    TCP 83 59880 → 8081 [PSH, ACK] Seq=1599 Ack=1599 Win=64256 Len=17 TSval=1047022810 TSecr=3171282519
1711549218.152130604   988 0.622765755    10.10.1.1 → 10.10.1.2    TCP 83 8081 → 59880 [PSH, ACK] Seq=1599 Ack=1616 Win=65152 Len=17 TSval=3171282520 TSecr=1047022810
1711549226.152130604   996 0.623921319    10.10.1.2 → 10.10.1.1    TCP 83 59880 → 8081 [PSH, ACK] Seq=1616 Ack=1616 Win=64256 Len=17 TSval=1047022811 TSecr=3171282520
1711549228.152130604   998 0.623950673    10.10.1.1 → 10.10.1.2    TCP 83 8081 → 59880 [PSH, ACK] Seq=1616 Ack=1633 Win=65152 Len=17 TSval=3171282521 TSecr=1047022811
1711549236.152130604  1006 0.625107500    10.10.1.2 → 10.10.1.1    TCP 83 59880 → 8081 [PSH, ACK] Seq=1633 Ack=1633 Win=64256 Len=17 TSval=1047022812 TSecr=3171282521
1711549238.152130604  1008 0.625139742    10.10.1.1 → 10.10.1.2    TCP 83 8081 → 59880 [PSH, ACK] Seq=1633 Ack=1650 Win=65152 Len=17 TSval=3171282523 TSecr=1047022812
1711549246.152130604  1016 0.626298722    10.10.1.2 → 10.10.1.1    TCP 83 59880 → 8081 [PSH, ACK] Seq=1650 Ack=1650 Win=64256 Len=17 TSval=1047022813 TSecr=3171282523
1711549248.152130604  1018 0.626328024    10.10.1.1 → 10.10.1.2    TCP 83 8081 → 59880 [PSH, ACK] Seq=1650 Ack=1667 Win=65152 Len=17 TSval=3171282524 TSecr=1047022813
1711549256.152130604  1026 0.627483661    10.10.1.2 → 10.10.1.1    TCP 83 59880 → 8081 [PSH, ACK] Seq=1667 Ack=1667 Win=64256 Len=17 TSval=1047022815 TSecr=3171282524
1711549258.152130604  1028 0.627512241    10.10.1.1 → 10.10.1.2    TCP 83 8081 → 59880 [PSH, ACK] Seq=1667 Ack=1684 Win=65152 Len=17 TSval=3171282525 TSecr=1047022815
1711549266.152130604  1036 0.628669334    10.10.1.2 → 10.10.1.1    TCP 83 59880 → 8081 [PSH, ACK] Seq=1684 Ack=1684 Win=64256 Len=17 TSval=1047022816 TSecr=3171282525
1711549268.152130604  1038 0.628705535    10.10.1.1 → 10.10.1.2    TCP 83 8081 → 59880 [PSH, ACK] Seq=1684 Ack=1701 Win=65152 Len=17 TSval=3171282526 TSecr=1047022816
1711549276.152130604  1046 0.629864516    10.10.1.2 → 10.10.1.1    TCP 83 59880 → 8081 [PSH, ACK] Seq=1701 Ack=1701 Win=64256 Len=17 TSval=1047022817 TSecr=3171282526
1711549278.152130604  1048 0.629895852    10.10.1.1 → 10.10.1.2    TCP 83 8081 → 59880 [PSH, ACK] Seq=1701 Ack=1718 Win=65152 Len=17 TSval=3171282527 TSecr=1047022817
1711549286.152130604  1056 0.631052726    10.10.1.2 → 10.10.1.1    TCP 83 59880 → 8081 [PSH, ACK] Seq=1718 Ack=1718 Win=64256 Len=17 TSval=1047022818 TSecr=3171282527
1711549288.152130604  1058 0.631083263    10.10.1.1 → 10.10.1.2    TCP 83 8081 → 59880 [PSH, ACK] Seq=1718 Ack=1735 Win=65152 Len=17 TSval=3171282529 TSecr=1047022818
1711549296.152130604  1066 0.632238696    10.10.1.2 → 10.10.1.1    TCP 83 59880 → 8081 [PSH, ACK] Seq=1735 Ack=1735 Win=64256 Len=17 TSval=1047022819 TSecr=3171282529
1711549298.152130604  1068 0.632273680    10.10.1.1 → 10.10.1.2    TCP 83 8081 → 59880 [PSH, ACK] Seq=1735 Ack=1752 Win=65152 Len=17 TSval=3171282530 TSecr=1047022819
1711549306.152130604  1076 0.633430508    10.10.1.2 → 10.10.1.1    TCP 83 59880 → 8081 [PSH, ACK] Seq=1752 Ack=1752 Win=64256 Len=17 TSval=1047022821 TSecr=3171282530
1711549308.152130604  1078 0.633461812    10.10.1.1 → 10.10.1.2    TCP 83 8081 → 59880 [PSH, ACK] Seq=1752 Ack=1769 Win=65152 Len=17 TSval=3171282531 TSecr=1047022821
1711549316.152130604  1086 0.634621284    10.10.1.2 → 10.10.1.1    TCP 83 59880 → 8081 [PSH, ACK] Seq=1769 Ack=1769 Win=64256 Len=17 TSval=1047022822 TSecr=3171282531
1711549318.152130604  1088 0.634652391    10.10.1.1 → 10.10.1.2    TCP 83 8081 → 59880 [PSH, ACK] Seq=1769 Ack=1786 Win=65152 Len=17 TSval=3171282532 TSecr=1047022822
1711549326.152130604  1096 0.635807972    10.10.1.2 → 10.10.1.1    TCP 83 59880 → 8081 [PSH, ACK] Seq=1786 Ack=1786 Win=64256 Len=17 TSval=1047022823 TSecr=3171282532
1711549328.152130604  1098 0.635837292    10.10.1.1 → 10.10.1.2    TCP 83 8081 → 59880 [PSH, ACK] Seq=1786 Ack=1803 Win=65152 Len=17 TSval=3171282533 TSecr=1047022823
1711549336.152130604  1106 0.636993679    10.10.1.2 → 10.10.1.1    TCP 83 59880 → 8081 [PSH, ACK] Seq=1803 Ack=1803 Win=64256 Len=17 TSval=1047022824 TSecr=3171282533
1711549338.152130604  1108 0.637028670    10.10.1.1 → 10.10.1.2    TCP 83 8081 → 59880 [PSH, ACK] Seq=1803 Ack=1820 Win=65152 Len=17 TSval=3171282535 TSecr=1047022824
1711549346.152130604  1116 0.638188076    10.10.1.2 → 10.10.1.1    TCP 83 59880 → 8081 [PSH, ACK] Seq=1820 Ack=1820 Win=64256 Len=17 TSval=1047022825 TSecr=3171282535
1711549348.152130604  1118 0.638217417    10.10.1.1 → 10.10.1.2    TCP 83 8081 → 59880 [PSH, ACK] Seq=1820 Ack=1837 Win=65152 Len=17 TSval=3171282536 TSecr=1047022825
1711549356.152130604  1126 0.639373079    10.10.1.2 → 10.10.1.1    TCP 83 59880 → 8081 [PSH, ACK] Seq=1837 Ack=1837 Win=64256 Len=17 TSval=1047022826 TSecr=3171282536
1711549358.152130604  1128 0.639401739    10.10.1.1 → 10.10.1.2    TCP 83 8081 → 59880 [PSH, ACK] Seq=1837 Ack=1854 Win=65152 Len=17 TSval=3171282537 TSecr=1047022826
1711549366.152130604  1136 0.640558242    10.10.1.2 → 10.10.1.1    TCP 83 59880 → 8081 [PSH, ACK] Seq=1854 Ack=1854 Win=64256 Len=17 TSval=1047022828 TSecr=3171282537
1711549368.152130604  1138 0.640592869    10.10.1.1 → 10.10.1.2    TCP 83 8081 → 59880 [PSH, ACK] Seq=1854 Ack=1871 Win=65152 Len=17 TSval=3171282538 TSecr=1047022828
1711549376.152130604  1146 0.641752246    10.10.1.2 → 10.10.1.1    TCP 83 59880 → 8081 [PSH, ACK] Seq=1871 Ack=1871 Win=64256 Len=17 TSval=1047022829 TSecr=3171282538
1711549378.152130604  1148 0.641783930    10.10.1.1 → 10.10.1.2    TCP 83 8081 → 59880 [PSH, ACK] Seq=1871 Ack=1888 Win=65152 Len=17 TSval=3171282539 TSecr=1047022829
1711549386.152130604  1156 0.642939756    10.10.1.2 → 10.10.1.1    TCP 83 59880 → 8081 [PSH, ACK] Seq=1888 Ack=1888 Win=64256 Len=17 TSval=1047022830 TSecr=3171282539
1711549388.152130604  1158 0.642970593    10.10.1.1 → 10.10.1.2    TCP 83 8081 → 59880 [PSH, ACK] Seq=1888 Ack=1905 Win=65152 Len=17 TSval=3171282540 TSecr=1047022830
1711549396.152130604  1166 0.644126037    10.10.1.2 → 10.10.1.1    TCP 83 59880 → 8081 [PSH, ACK] Seq=1905 Ack=1905 Win=64256 Len=17 TSval=1047022831 TSecr=3171282540
1711549398.152130604  1168 0.644162304    10.10.1.1 → 10.10.1.2    TCP 83 8081 → 59880 [PSH, ACK] Seq=1905 Ack=1922 Win=65152 Len=17 TSval=3171282542 TSecr=1047022831
1711549406.152130604  1176 0.645318611    10.10.1.2 → 10.10.1.1    TCP 83 59880 → 8081 [PSH, ACK] Seq=1922 Ack=1922 Win=64256 Len=17 TSval=1047022832 TSecr=3171282542
1711549409.152130604  1179 0.645379092    10.10.1.1 → 10.10.1.2    TCP 83 8081 → 59880 [PSH, ACK] Seq=1922 Ack=1939 Win=65152 Len=17 TSval=3171282543 TSecr=1047022832
1711549416.152130604  1186 0.646538956    10.10.1.2 → 10.10.1.1    TCP 83 59880 → 8081 [PSH, ACK] Seq=1939 Ack=1939 Win=64256 Len=17 TSval=1047022834 TSecr=3171282543
1711549418.152130604  1188 0.646570044    10.10.1.1 → 10.10.1.2    TCP 83 8081 → 59880 [PSH, ACK] Seq=1939 Ack=1956 Win=65152 Len=17 TSval=3171282544 TSecr=1047022834
1711549426.152130604  1196 0.647725841    10.10.1.2 → 10.10.1.1    TCP 83 59880 → 8081 [PSH, ACK] Seq=1956 Ack=1956 Win=64256 Len=17 TSval=1047022835 TSecr=3171282544
1711549428.152130604  1198 0.647756843    10.10.1.1 → 10.10.1.2    TCP 83 8081 → 59880 [PSH, ACK] Seq=1956 Ack=1973 Win=65152 Len=17 TSval=3171282545 TSecr=1047022835
1711549436.152130604  1206 0.648913174    10.10.1.2 → 10.10.1.1    TCP 83 59880 → 8081 [PSH, ACK] Seq=1973 Ack=1973 Win=64256 Len=17 TSval=1047022836 TSecr=3171282545
1711549438.152130604  1208 0.648947601    10.10.1.1 → 10.10.1.2    TCP 83 8081 → 59880 [PSH, ACK] Seq=1973 Ack=1990 Win=65152 Len=17 TSval=3171282546 TSecr=1047022836
1711549446.152130604  1216 0.650107222    10.10.1.2 → 10.10.1.1    TCP 83 59880 → 8081 [PSH, ACK] Seq=1990 Ack=1990 Win=64256 Len=17 TSval=1047022837 TSecr=3171282546
1711549448.152130604  1218 0.650138348    10.10.1.1 → 10.10.1.2    TCP 83 8081 → 59880 [PSH, ACK] Seq=1990 Ack=2007 Win=65152 Len=17 TSval=3171282548 TSecr=1047022837
