1711548465.056200981    22 0.272760738    10.10.1.2 → 10.10.1.1    TCP 74 48392 → 8081 [SYN] Seq=0 Win=64240 Len=0 MSS=1460 SACK_PERM=1 TSval=1047235447 TSecr=0 WS=128
1711548466.056200981    23 0.272798083    10.10.1.1 → 10.10.1.2    TCP 74 8081 → 48392 [SYN, ACK] Seq=0 Ack=1 Win=65160 Len=0 MSS=1460 SACK_PERM=1 TSval=3171495158 TSecr=1047235447 WS=128
1711548467.056200981    24 0.272831962    10.10.1.2 → 10.10.1.1    TCP 66 48392 → 8081 [ACK] Seq=1 Ack=1 Win=64256 Len=0 TSval=1047235447 TSecr=3171495158
1711548483.056200981    40 0.535238668    10.10.1.2 → 10.10.1.1    TCP 83 48392 → 8081 [PSH, ACK] Seq=1 Ack=1 Win=64256 Len=17 TSval=1047235710 TSecr=3171495158
1711548485.056200981    42 0.535257888    10.10.1.1 → 10.10.1.2    TCP 66 8081 → 48392 [ACK] Seq=1 Ack=18 Win=65152 Len=0 TSval=3171495420 TSecr=1047235710
1711548487.056200981    44 0.535442438    10.10.1.1 → 10.10.1.2    TCP 83 8081 → 48392 [PSH, ACK] Seq=1 Ack=18 Win=65152 Len=17 TSval=3171495421 TSecr=1047235710
1711548488.056200981    45 0.535481800    10.10.1.2 → 10.10.1.1    TCP 66 48392 → 8081 [ACK] Seq=18 Ack=18 Win=64256 Len=0 TSval=1047235710 TSecr=3171495421
1711548493.056200981    50 0.545602920    10.10.1.2 → 10.10.1.1    TCP 83 48392 → 8081 [PSH, ACK] Seq=18 Ack=18 Win=64256 Len=17 TSval=1047235720 TSecr=3171495421
1711548496.056200981    53 0.545637515    10.10.1.1 → 10.10.1.2    TCP 83 8081 → 48392 [PSH, ACK] Seq=18 Ack=35 Win=65152 Len=17 TSval=3171495431 TSecr=1047235720
1711548501.056200981    58 0.555795824    10.10.1.2 → 10.10.1.1    TCP 83 48392 → 8081 [PSH, ACK] Seq=35 Ack=35 Win=64256 Len=17 TSval=1047235730 TSecr=3171495431
1711548504.056200981    61 0.555832911    10.10.1.1 → 10.10.1.2    TCP 83 8081 → 48392 [PSH, ACK] Seq=35 Ack=52 Win=65152 Len=17 TSval=3171495441 TSecr=1047235730
1711548509.056200981    66 0.565989667    10.10.1.2 → 10.10.1.1    TCP 83 48392 → 8081 [PSH, ACK] Seq=52 Ack=52 Win=64256 Len=17 TSval=1047235741 TSecr=3171495441
1711548512.056200981    69 0.566023264    10.10.1.1 → 10.10.1.2    TCP 83 8081 → 48392 [PSH, ACK] Seq=52 Ack=69 Win=65152 Len=17 TSval=3171495451 TSecr=1047235741
1711548517.056200981    74 0.576178051    10.10.1.2 → 10.10.1.1    TCP 83 48392 → 8081 [PSH, ACK] Seq=69 Ack=69 Win=64256 Len=17 TSval=1047235751 TSecr=3171495451
1711548519.056200981    76 0.576210159    10.10.1.1 → 10.10.1.2    TCP 83 8081 → 48392 [PSH, ACK] Seq=69 Ack=86 Win=65152 Len=17 TSval=3171495461 TSecr=1047235751
1711548525.056200981    82 0.586368402    10.10.1.2 → 10.10.1.1    TCP 83 48392 → 8081 [PSH, ACK] Seq=86 Ack=86 Win=64256 Len=17 TSval=1047235761 TSecr=3171495461
1711548527.056200981    84 0.586401723    10.10.1.1 → 10.10.1.2    TCP 83 8081 → 48392 [PSH, ACK] Seq=86 Ack=103 Win=65152 Len=17 TSval=3171495472 TSecr=1047235761
1711548533.056200981    90 0.596559862    10.10.1.2 → 10.10.1.1    TCP 83 48392 → 8081 [PSH, ACK] Seq=103 Ack=103 Win=64256 Len=17 TSval=1047235771 TSecr=3171495472
1711548535.056200981    92 0.596593270    10.10.1.1 → 10.10.1.2    TCP 83 8081 → 48392 [PSH, ACK] Seq=103 Ack=120 Win=65152 Len=17 TSval=3171495482 TSecr=1047235771
1711548541.056200981    98 0.606748624    10.10.1.2 → 10.10.1.1    TCP 83 48392 → 8081 [PSH, ACK] Seq=120 Ack=120 Win=64256 Len=17 TSval=1047235781 TSecr=3171495482
1711548543.056200981   100 0.606780520    10.10.1.1 → 10.10.1.2    TCP 83 8081 → 48392 [PSH, ACK] Seq=120 Ack=137 Win=65152 Len=17 TSval=3171495492 TSecr=1047235781
1711548549.056200981   106 0.616895787    10.10.1.2 → 10.10.1.1    TCP 83 48392 → 8081 [PSH, ACK] Seq=137 Ack=137 Win=64256 Len=17 TSval=1047235792 TSecr=3171495492
1711548551.056200981   108 0.616928120    10.10.1.1 → 10.10.1.2    TCP 83 8081 → 48392 [PSH, ACK] Seq=137 Ack=154 Win=65152 Len=17 TSval=3171495502 TSecr=1047235792
1711548557.056200981   114 0.627082058    10.10.1.2 → 10.10.1.1    TCP 83 48392 → 8081 [PSH, ACK] Seq=154 Ack=154 Win=64256 Len=17 TSval=1047235802 TSecr=3171495502
1711548559.056200981   116 0.627114742    10.10.1.1 → 10.10.1.2    TCP 83 8081 → 48392 [PSH, ACK] Seq=154 Ack=171 Win=65152 Len=17 TSval=3171495512 TSecr=1047235802
1711548565.056200981   122 0.637271999    10.10.1.2 → 10.10.1.1    TCP 83 48392 → 8081 [PSH, ACK] Seq=171 Ack=171 Win=64256 Len=17 TSval=1047235812 TSecr=3171495512
1711548567.056200981   124 0.637312403    10.10.1.1 → 10.10.1.2    TCP 83 8081 → 48392 [PSH, ACK] Seq=171 Ack=188 Win=65152 Len=17 TSval=3171495523 TSecr=1047235812
1711548573.056200981   130 0.647470026    10.10.1.2 → 10.10.1.1    TCP 83 48392 → 8081 [PSH, ACK] Seq=188 Ack=188 Win=64256 Len=17 TSval=1047235822 TSecr=3171495523
1711548575.056200981   132 0.647504602    10.10.1.1 → 10.10.1.2    TCP 83 8081 → 48392 [PSH, ACK] Seq=188 Ack=205 Win=65152 Len=17 TSval=3171495533 TSecr=1047235822
1711548581.056200981   138 0.657659999    10.10.1.2 → 10.10.1.1    TCP 83 48392 → 8081 [PSH, ACK] Seq=205 Ack=205 Win=64256 Len=17 TSval=1047235832 TSecr=3171495533
1711548583.056200981   140 0.657692271    10.10.1.1 → 10.10.1.2    TCP 83 8081 → 48392 [PSH, ACK] Seq=205 Ack=222 Win=65152 Len=17 TSval=3171495543 TSecr=1047235832
1711548589.056200981   146 0.667848553    10.10.1.2 → 10.10.1.1    TCP 83 48392 → 8081 [PSH, ACK] Seq=222 Ack=222 Win=64256 Len=17 TSval=1047235842 TSecr=3171495543
1711548591.056200981   148 0.667880125    10.10.1.1 → 10.10.1.2    TCP 83 8081 → 48392 [PSH, ACK] Seq=222 Ack=239 Win=65152 Len=17 TSval=3171495553 TSecr=1047235842
1711548597.056200981   154 0.678036062    10.10.1.2 → 10.10.1.1    TCP 83 48392 → 8081 [PSH, ACK] Seq=239 Ack=239 Win=64256 Len=17 TSval=1047235853 TSecr=3171495553
1711548599.056200981   156 0.678068103    10.10.1.1 → 10.10.1.2    TCP 83 8081 → 48392 [PSH, ACK] Seq=239 Ack=256 Win=65152 Len=17 TSval=3171495563 TSecr=1047235853
1711548605.056200981   162 0.688225773    10.10.1.2 → 10.10.1.1    TCP 83 48392 → 8081 [PSH, ACK] Seq=256 Ack=256 Win=64256 Len=17 TSval=1047235863 TSecr=3171495563
1711548607.056200981   164 0.688281673    10.10.1.1 → 10.10.1.2    TCP 83 8081 → 48392 [PSH, ACK] Seq=256 Ack=273 Win=65152 Len=17 TSval=3171495574 TSecr=1047235863
1711548613.056200981   170 0.698438043    10.10.1.2 → 10.10.1.1    TCP 83 48392 → 8081 [PSH, ACK] Seq=273 Ack=273 Win=64256 Len=17 TSval=1047235873 TSecr=3171495574
1711548615.056200981   172 0.698470933    10.10.1.1 → 10.10.1.2    TCP 83 8081 → 48392 [PSH, ACK] Seq=273 Ack=290 Win=65152 Len=17 TSval=3171495584 TSecr=1047235873
1711548621.056200981   178 0.708625844    10.10.1.2 → 10.10.1.1    TCP 83 48392 → 8081 [PSH, ACK] Seq=290 Ack=290 Win=64256 Len=17 TSval=1047235883 TSecr=3171495584
1711548623.056200981   180 0.708658209    10.10.1.1 → 10.10.1.2    TCP 83 8081 → 48392 [PSH, ACK] Seq=290 Ack=307 Win=65152 Len=17 TSval=3171495594 TSecr=1047235883
1711548629.056200981   186 0.718816839    10.10.1.2 → 10.10.1.1    TCP 83 48392 → 8081 [PSH, ACK] Seq=307 Ack=307 Win=64256 Len=17 TSval=1047235893 TSecr=3171495594
1711548631.056200981   188 0.718863086    10.10.1.1 → 10.10.1.2    TCP 83 8081 → 48392 [PSH, ACK] Seq=307 Ack=324 Win=65152 Len=17 TSval=3171495604 TSecr=1047235893
1711548637.056200981   194 0.729017653    10.10.1.2 → 10.10.1.1    TCP 83 48392 → 8081 [PSH, ACK] Seq=324 Ack=324 Win=64256 Len=17 TSval=1047235904 TSecr=3171495604
1711548639.056200981   196 0.729052139    10.10.1.1 → 10.10.1.2    TCP 83 8081 → 48392 [PSH, ACK] Seq=324 Ack=341 Win=65152 Len=17 TSval=3171495614 TSecr=1047235904
1711548645.056200981   202 0.739208001    10.10.1.2 → 10.10.1.1    TCP 83 48392 → 8081 [PSH, ACK] Seq=341 Ack=341 Win=64256 Len=17 TSval=1047235914 TSecr=3171495614
1711548647.056200981   204 0.739241157    10.10.1.1 → 10.10.1.2    TCP 83 8081 → 48392 [PSH, ACK] Seq=341 Ack=358 Win=65152 Len=17 TSval=3171495624 TSecr=1047235914
1711548653.056200981   210 0.749395534    10.10.1.2 → 10.10.1.1    TCP 83 48392 → 8081 [PSH, ACK] Seq=358 Ack=358 Win=64256 Len=17 TSval=1047235924 TSecr=3171495624
1711548655.056200981   212 0.749438285    10.10.1.1 → 10.10.1.2    TCP 83 8081 → 48392 [PSH, ACK] Seq=358 Ack=375 Win=65152 Len=17 TSval=3171495635 TSecr=1047235924
1711548661.056200981   218 0.759595136    10.10.1.2 → 10.10.1.1    TCP 83 48392 → 8081 [PSH, ACK] Seq=375 Ack=375 Win=64256 Len=17 TSval=1047235934 TSecr=3171495635
1711548663.056200981   220 0.759630122    10.10.1.1 → 10.10.1.2    TCP 83 8081 → 48392 [PSH, ACK] Seq=375 Ack=392 Win=65152 Len=17 TSval=3171495645 TSecr=1047235934
1711548669.056200981   226 0.769785115    10.10.1.2 → 10.10.1.1    TCP 83 48392 → 8081 [PSH, ACK] Seq=392 Ack=392 Win=64256 Len=17 TSval=1047235944 TSecr=3171495645
1711548671.056200981   228 0.769824923    10.10.1.1 → 10.10.1.2    TCP 83 8081 → 48392 [PSH, ACK] Seq=392 Ack=409 Win=65152 Len=17 TSval=3171495655 TSecr=1047235944
1711548677.056200981   234 0.779981500    10.10.1.2 → 10.10.1.1    TCP 83 48392 → 8081 [PSH, ACK] Seq=409 Ack=409 Win=64256 Len=17 TSval=1047235955 TSecr=3171495655
1711548679.056200981   236 0.780015672    10.10.1.1 → 10.10.1.2    TCP 83 8081 → 48392 [PSH, ACK] Seq=409 Ack=426 Win=65152 Len=17 TSval=3171495665 TSecr=1047235955
1711548685.056200981   242 0.790172330    10.10.1.2 → 10.10.1.1    TCP 83 48392 → 8081 [PSH, ACK] Seq=426 Ack=426 Win=64256 Len=17 TSval=1047235965 TSecr=3171495665
1711548687.056200981   244 0.790206210    10.10.1.1 → 10.10.1.2    TCP 83 8081 → 48392 [PSH, ACK] Seq=426 Ack=443 Win=65152 Len=17 TSval=3171495675 TSecr=1047235965
1711548693.056200981   250 0.800360970    10.10.1.2 → 10.10.1.1    TCP 83 48392 → 8081 [PSH, ACK] Seq=443 Ack=443 Win=64256 Len=17 TSval=1047235975 TSecr=3171495675
1711548695.056200981   252 0.800400131    10.10.1.1 → 10.10.1.2    TCP 83 8081 → 48392 [PSH, ACK] Seq=443 Ack=460 Win=65152 Len=17 TSval=3171495686 TSecr=1047235975
1711548701.056200981   258 0.810555318    10.10.1.2 → 10.10.1.1    TCP 83 48392 → 8081 [PSH, ACK] Seq=460 Ack=460 Win=64256 Len=17 TSval=1047235985 TSecr=3171495686
1711548703.056200981   260 0.810588824    10.10.1.1 → 10.10.1.2    TCP 83 8081 → 48392 [PSH, ACK] Seq=460 Ack=477 Win=65152 Len=17 TSval=3171495696 TSecr=1047235985
1711548709.056200981   266 0.820743492    10.10.1.2 → 10.10.1.1    TCP 83 48392 → 8081 [PSH, ACK] Seq=477 Ack=477 Win=64256 Len=17 TSval=1047235995 TSecr=3171495696
1711548711.056200981   268 0.820780242    10.10.1.1 → 10.10.1.2    TCP 83 8081 → 48392 [PSH, ACK] Seq=477 Ack=494 Win=65152 Len=17 TSval=3171495706 TSecr=1047235995
1711548717.056200981   274 0.830900311    10.10.1.2 → 10.10.1.1    TCP 83 48392 → 8081 [PSH, ACK] Seq=494 Ack=494 Win=64256 Len=17 TSval=1047236006 TSecr=3171495706
1711548719.056200981   276 0.830932836    10.10.1.1 → 10.10.1.2    TCP 83 8081 → 48392 [PSH, ACK] Seq=494 Ack=511 Win=65152 Len=17 TSval=3171495716 TSecr=1047236006
1711548725.056200981   282 0.841088255    10.10.1.2 → 10.10.1.1    TCP 83 48392 → 8081 [PSH, ACK] Seq=511 Ack=511 Win=64256 Len=17 TSval=1047236016 TSecr=3171495716
1711548727.056200981   284 0.841124090    10.10.1.1 → 10.10.1.2    TCP 83 8081 → 48392 [PSH, ACK] Seq=511 Ack=528 Win=65152 Len=17 TSval=3171495726 TSecr=1047236016
1711548733.056200981   290 0.851281619    10.10.1.2 → 10.10.1.1    TCP 83 48392 → 8081 [PSH, ACK] Seq=528 Ack=528 Win=64256 Len=17 TSval=1047236026 TSecr=3171495726
1711548735.056200981   292 0.851317444    10.10.1.1 → 10.10.1.2    TCP 83 8081 → 48392 [PSH, ACK] Seq=528 Ack=545 Win=65152 Len=17 TSval=3171495737 TSecr=1047236026
1711548741.056200981   298 0.861472287    10.10.1.2 → 10.10.1.1    TCP 83 48392 → 8081 [PSH, ACK] Seq=545 Ack=545 Win=64256 Len=17 TSval=1047236036 TSecr=3171495737
1711548743.056200981   300 0.861504600    10.10.1.1 → 10.10.1.2    TCP 83 8081 → 48392 [PSH, ACK] Seq=545 Ack=562 Win=65152 Len=17 TSval=3171495747 TSecr=1047236036
1711548749.056200981   306 0.871658482    10.10.1.2 → 10.10.1.1    TCP 83 48392 → 8081 [PSH, ACK] Seq=562 Ack=562 Win=64256 Len=17 TSval=1047236046 TSecr=3171495747
1711548751.056200981   308 0.871693124    10.10.1.1 → 10.10.1.2    TCP 83 8081 → 48392 [PSH, ACK] Seq=562 Ack=579 Win=65152 Len=17 TSval=3171495757 TSecr=1047236046
1711548757.056200981   314 0.881847895    10.10.1.2 → 10.10.1.1    TCP 83 48392 → 8081 [PSH, ACK] Seq=579 Ack=579 Win=64256 Len=17 TSval=1047236056 TSecr=3171495757
1711548759.056200981   316 0.881881301    10.10.1.1 → 10.10.1.2    TCP 83 8081 → 48392 [PSH, ACK] Seq=579 Ack=596 Win=65152 Len=17 TSval=3171495767 TSecr=1047236056
1711548765.056200981   322 0.892034427    10.10.1.2 → 10.10.1.1    TCP 83 48392 → 8081 [PSH, ACK] Seq=596 Ack=596 Win=64256 Len=17 TSval=1047236067 TSecr=3171495767
1711548767.056200981   324 0.892067531    10.10.1.1 → 10.10.1.2    TCP 83 8081 → 48392 [PSH, ACK] Seq=596 Ack=613 Win=65152 Len=17 TSval=3171495777 TSecr=1047236067
1711548773.056200981   330 0.902219587    10.10.1.2 → 10.10.1.1    TCP 83 48392 → 8081 [PSH, ACK] Seq=613 Ack=613 Win=64256 Len=17 TSval=1047236077 TSecr=3171495777
1711548775.056200981   332 0.902257917    10.10.1.1 → 10.10.1.2    TCP 83 8081 → 48392 [PSH, ACK] Seq=613 Ack=630 Win=65152 Len=17 TSval=3171495788 TSecr=1047236077
1711548781.056200981   338 0.912412841    10.10.1.2 → 10.10.1.1    TCP 83 48392 → 8081 [PSH, ACK] Seq=630 Ack=630 Win=64256 Len=17 TSval=1047236087 TSecr=3171495788
1711548783.056200981   340 0.912447088    10.10.1.1 → 10.10.1.2    TCP 83 8081 → 48392 [PSH, ACK] Seq=630 Ack=647 Win=65152 Len=17 TSval=3171495798 TSecr=1047236087
1711548789.056200981   346 0.922603335    10.10.1.2 → 10.10.1.1    TCP 83 48392 → 8081 [PSH, ACK] Seq=647 Ack=647 Win=64256 Len=17 TSval=1047236097 TSecr=3171495798
1711548791.056200981   348 0.922636683    10.10.1.1 → 10.10.1.2    TCP 83 8081 → 48392 [PSH, ACK] Seq=647 Ack=664 Win=65152 Len=17 TSval=3171495808 TSecr=1047236097
1711548797.056200981   354 0.932791837    10.10.1.2 → 10.10.1.1    TCP 83 48392 → 8081 [PSH, ACK] Seq=664 Ack=664 Win=64256 Len=17 TSval=1047236107 TSecr=3171495808
1711548799.056200981   356 0.932824668    10.10.1.1 → 10.10.1.2    TCP 83 8081 → 48392 [PSH, ACK] Seq=664 Ack=681 Win=65152 Len=17 TSval=3171495818 TSecr=1047236107
1711548805.056200981   362 0.942978724    10.10.1.2 → 10.10.1.1    TCP 83 48392 → 8081 [PSH, ACK] Seq=681 Ack=681 Win=64256 Len=17 TSval=1047236118 TSecr=3171495818
1711548807.056200981   364 0.943009797    10.10.1.1 → 10.10.1.2    TCP 83 8081 → 48392 [PSH, ACK] Seq=681 Ack=698 Win=65152 Len=17 TSval=3171495828 TSecr=1047236118
1711548813.056200981   370 0.953163677    10.10.1.2 → 10.10.1.1    TCP 83 48392 → 8081 [PSH, ACK] Seq=698 Ack=698 Win=64256 Len=17 TSval=1047236128 TSecr=3171495828
1711548815.056200981   372 0.953194545    10.10.1.1 → 10.10.1.2    TCP 83 8081 → 48392 [PSH, ACK] Seq=698 Ack=715 Win=65152 Len=17 TSval=3171495838 TSecr=1047236128
1711548821.056200981   378 0.963347768    10.10.1.2 → 10.10.1.1    TCP 83 48392 → 8081 [PSH, ACK] Seq=715 Ack=715 Win=64256 Len=17 TSval=1047236138 TSecr=3171495838
1711548823.056200981   380 0.963380920    10.10.1.1 → 10.10.1.2    TCP 83 8081 → 48392 [PSH, ACK] Seq=715 Ack=732 Win=65152 Len=17 TSval=3171495849 TSecr=1047236138
1711548829.056200981   386 0.973534576    10.10.1.2 → 10.10.1.1    TCP 83 48392 → 8081 [PSH, ACK] Seq=732 Ack=732 Win=64256 Len=17 TSval=1047236148 TSecr=3171495849
1711548831.056200981   388 0.973574110    10.10.1.1 → 10.10.1.2    TCP 83 8081 → 48392 [PSH, ACK] Seq=732 Ack=749 Win=65152 Len=17 TSval=3171495859 TSecr=1047236148
1711548837.056200981   394 0.983729417    10.10.1.2 → 10.10.1.1    TCP 83 48392 → 8081 [PSH, ACK] Seq=749 Ack=749 Win=64256 Len=17 TSval=1047236158 TSecr=3171495859
1711548839.056200981   396 0.983761884    10.10.1.1 → 10.10.1.2    TCP 83 8081 → 48392 [PSH, ACK] Seq=749 Ack=766 Win=65152 Len=17 TSval=3171495869 TSecr=1047236158
1711548845.056200981   402 0.993917258    10.10.1.2 → 10.10.1.1    TCP 83 48392 → 8081 [PSH, ACK] Seq=766 Ack=766 Win=64256 Len=17 TSval=1047236169 TSecr=3171495869
1711548847.056200981   404 0.993950329    10.10.1.1 → 10.10.1.2    TCP 83 8081 → 48392 [PSH, ACK] Seq=766 Ack=783 Win=65152 Len=17 TSval=3171495879 TSecr=1047236169
1711548853.056200981   410 1.004103869    10.10.1.2 → 10.10.1.1    TCP 83 48392 → 8081 [PSH, ACK] Seq=783 Ack=783 Win=64256 Len=17 TSval=1047236179 TSecr=3171495879
1711548855.056200981   412 1.004141043    10.10.1.1 → 10.10.1.2    TCP 83 8081 → 48392 [PSH, ACK] Seq=783 Ack=800 Win=65152 Len=17 TSval=3171495889 TSecr=1047236179
1711548861.056200981   418 1.014296166    10.10.1.2 → 10.10.1.1    TCP 83 48392 → 8081 [PSH, ACK] Seq=800 Ack=800 Win=64256 Len=17 TSval=1047236189 TSecr=3171495889
1711548863.056200981   420 1.014329477    10.10.1.1 → 10.10.1.2    TCP 83 8081 → 48392 [PSH, ACK] Seq=800 Ack=817 Win=65152 Len=17 TSval=3171495900 TSecr=1047236189
1711548869.056200981   426 1.024483627    10.10.1.2 → 10.10.1.1    TCP 83 48392 → 8081 [PSH, ACK] Seq=817 Ack=817 Win=64256 Len=17 TSval=1047236199 TSecr=3171495900
1711548871.056200981   428 1.024516492    10.10.1.1 → 10.10.1.2    TCP 83 8081 → 48392 [PSH, ACK] Seq=817 Ack=834 Win=65152 Len=17 TSval=3171495910 TSecr=1047236199
1711548877.056200981   434 1.034672329    10.10.1.2 → 10.10.1.1    TCP 83 48392 → 8081 [PSH, ACK] Seq=834 Ack=834 Win=64256 Len=17 TSval=1047236209 TSecr=3171495910
1711548879.056200981   436 1.034709116    10.10.1.1 → 10.10.1.2    TCP 83 8081 → 48392 [PSH, ACK] Seq=834 Ack=851 Win=65152 Len=17 TSval=3171495920 TSecr=1047236209
1711548885.056200981   442 1.044865122    10.10.1.2 → 10.10.1.1    TCP 83 48392 → 8081 [PSH, ACK] Seq=851 Ack=851 Win=64256 Len=17 TSval=1047236219 TSecr=3171495920
1711548887.056200981   444 1.044898589    10.10.1.1 → 10.10.1.2    TCP 83 8081 → 48392 [PSH, ACK] Seq=851 Ack=868 Win=65152 Len=17 TSval=3171495930 TSecr=1047236219
1711548893.056200981   450 1.055054346    10.10.1.2 → 10.10.1.1    TCP 83 48392 → 8081 [PSH, ACK] Seq=868 Ack=868 Win=64256 Len=17 TSval=1047236230 TSecr=3171495930
1711548895.056200981   452 1.055090883    10.10.1.1 → 10.10.1.2    TCP 83 8081 → 48392 [PSH, ACK] Seq=868 Ack=885 Win=65152 Len=17 TSval=3171495940 TSecr=1047236230
1711548901.056200981   458 1.065246087    10.10.1.2 → 10.10.1.1    TCP 83 48392 → 8081 [PSH, ACK] Seq=885 Ack=885 Win=64256 Len=17 TSval=1047236240 TSecr=3171495940
1711548903.056200981   460 1.065283864    10.10.1.1 → 10.10.1.2    TCP 83 8081 → 48392 [PSH, ACK] Seq=885 Ack=902 Win=65152 Len=17 TSval=3171495951 TSecr=1047236240
1711548909.056200981   466 1.075437665    10.10.1.2 → 10.10.1.1    TCP 83 48392 → 8081 [PSH, ACK] Seq=902 Ack=902 Win=64256 Len=17 TSval=1047236250 TSecr=3171495951
1711548911.056200981   468 1.075471520    10.10.1.1 → 10.10.1.2    TCP 83 8081 → 48392 [PSH, ACK] Seq=902 Ack=919 Win=65152 Len=17 TSval=3171495961 TSecr=1047236250
1711548917.056200981   474 1.085627218    10.10.1.2 → 10.10.1.1    TCP 83 48392 → 8081 [PSH, ACK] Seq=919 Ack=919 Win=64256 Len=17 TSval=1047236260 TSecr=3171495961
1711548919.056200981   476 1.085661379    10.10.1.1 → 10.10.1.2    TCP 83 8081 → 48392 [PSH, ACK] Seq=919 Ack=936 Win=65152 Len=17 TSval=3171495971 TSecr=1047236260
1711548925.056200981   482 1.095818394    10.10.1.2 → 10.10.1.1    TCP 83 48392 → 8081 [PSH, ACK] Seq=936 Ack=936 Win=64256 Len=17 TSval=1047236270 TSecr=3171495971
1711548927.056200981   484 1.095852341    10.10.1.1 → 10.10.1.2    TCP 83 8081 → 48392 [PSH, ACK] Seq=936 Ack=953 Win=65152 Len=17 TSval=3171495981 TSecr=1047236270
1711548933.056200981   490 1.106006060    10.10.1.2 → 10.10.1.1    TCP 83 48392 → 8081 [PSH, ACK] Seq=953 Ack=953 Win=64256 Len=17 TSval=1047236281 TSecr=3171495981
1711548936.056200981   493 1.106103895    10.10.1.1 → 10.10.1.2    TCP 83 8081 → 48392 [PSH, ACK] Seq=953 Ack=970 Win=65152 Len=17 TSval=3171495991 TSecr=1047236281
1711548941.056200981   498 1.116258923    10.10.1.2 → 10.10.1.1    TCP 83 48392 → 8081 [PSH, ACK] Seq=970 Ack=970 Win=64256 Len=17 TSval=1047236291 TSecr=3171495991
1711548943.056200981   500 1.116295138    10.10.1.1 → 10.10.1.2    TCP 83 8081 → 48392 [PSH, ACK] Seq=970 Ack=987 Win=65152 Len=17 TSval=3171496002 TSecr=1047236291
1711548949.056200981   506 1.126450533    10.10.1.2 → 10.10.1.1    TCP 83 48392 → 8081 [PSH, ACK] Seq=987 Ack=987 Win=64256 Len=17 TSval=1047236301 TSecr=3171496002
1711548951.056200981   508 1.126484213    10.10.1.1 → 10.10.1.2    TCP 83 8081 → 48392 [PSH, ACK] Seq=987 Ack=1004 Win=65152 Len=17 TSval=3171496012 TSecr=1047236301
1711548957.056200981   514 1.136638424    10.10.1.2 → 10.10.1.1    TCP 83 48392 → 8081 [PSH, ACK] Seq=1004 Ack=1004 Win=64256 Len=17 TSval=1047236311 TSecr=3171496012
1711548959.056200981   516 1.136676812    10.10.1.1 → 10.10.1.2    TCP 83 8081 → 48392 [PSH, ACK] Seq=1004 Ack=1021 Win=65152 Len=17 TSval=3171496022 TSecr=1047236311
1711548965.056200981   522 1.146832825    10.10.1.2 → 10.10.1.1    TCP 83 48392 → 8081 [PSH, ACK] Seq=1021 Ack=1021 Win=64256 Len=17 TSval=1047236321 TSecr=3171496022
1711548967.056200981   524 1.146868036    10.10.1.1 → 10.10.1.2    TCP 83 8081 → 48392 [PSH, ACK] Seq=1021 Ack=1038 Win=65152 Len=17 TSval=3171496032 TSecr=1047236321
1711548973.056200981   530 1.157022210    10.10.1.2 → 10.10.1.1    TCP 83 48392 → 8081 [PSH, ACK] Seq=1038 Ack=1038 Win=64256 Len=17 TSval=1047236332 TSecr=3171496032
1711548975.056200981   532 1.157057970    10.10.1.1 → 10.10.1.2    TCP 83 8081 → 48392 [PSH, ACK] Seq=1038 Ack=1055 Win=65152 Len=17 TSval=3171496042 TSecr=1047236332
1711548981.056200981   538 1.167212493    10.10.1.2 → 10.10.1.1    TCP 83 48392 → 8081 [PSH, ACK] Seq=1055 Ack=1055 Win=64256 Len=17 TSval=1047236342 TSecr=3171496042
1711548983.056200981   540 1.167244646    10.10.1.1 → 10.10.1.2    TCP 83 8081 → 48392 [PSH, ACK] Seq=1055 Ack=1072 Win=65152 Len=17 TSval=3171496052 TSecr=1047236342
1711548989.056200981   546 1.177402774    10.10.1.2 → 10.10.1.1    TCP 83 48392 → 8081 [PSH, ACK] Seq=1072 Ack=1072 Win=64256 Len=17 TSval=1047236352 TSecr=3171496052
1711548991.056200981   548 1.177437054    10.10.1.1 → 10.10.1.2    TCP 83 8081 → 48392 [PSH, ACK] Seq=1072 Ack=1089 Win=65152 Len=17 TSval=3171496063 TSecr=1047236352
1711548997.056200981   554 1.187591524    10.10.1.2 → 10.10.1.1    TCP 83 48392 → 8081 [PSH, ACK] Seq=1089 Ack=1089 Win=64256 Len=17 TSval=1047236362 TSecr=3171496063
1711548999.056200981   556 1.187625382    10.10.1.1 → 10.10.1.2    TCP 83 8081 → 48392 [PSH, ACK] Seq=1089 Ack=1106 Win=65152 Len=17 TSval=3171496073 TSecr=1047236362
1711549005.056200981   562 1.197779082    10.10.1.2 → 10.10.1.1    TCP 83 48392 → 8081 [PSH, ACK] Seq=1106 Ack=1106 Win=64256 Len=17 TSval=1047236372 TSecr=3171496073
1711549007.056200981   564 1.197812867    10.10.1.1 → 10.10.1.2    TCP 83 8081 → 48392 [PSH, ACK] Seq=1106 Ack=1123 Win=65152 Len=17 TSval=3171496083 TSecr=1047236372
1711549013.056200981   570 1.207966442    10.10.1.2 → 10.10.1.1    TCP 83 48392 → 8081 [PSH, ACK] Seq=1123 Ack=1123 Win=64256 Len=17 TSval=1047236383 TSecr=3171496083
1711549015.056200981   572 1.208000797    10.10.1.1 → 10.10.1.2    TCP 83 8081 → 48392 [PSH, ACK] Seq=1123 Ack=1140 Win=65152 Len=17 TSval=3171496093 TSecr=1047236383
1711549021.056200981   578 1.218154157    10.10.1.2 → 10.10.1.1    TCP 83 48392 → 8081 [PSH, ACK] Seq=1140 Ack=1140 Win=64256 Len=17 TSval=1047236393 TSecr=3171496093
1711549023.056200981   580 1.218210327    10.10.1.1 → 10.10.1.2    TCP 83 8081 → 48392 [PSH, ACK] Seq=1140 Ack=1157 Win=65152 Len=17 TSval=3171496103 TSecr=1047236393
1711549029.056200981   586 1.228364746    10.10.1.2 → 10.10.1.1    TCP 83 48392 → 8081 [PSH, ACK] Seq=1157 Ack=1157 Win=64256 Len=17 TSval=1047236403 TSecr=3171496103
1711549031.056200981   588 1.228413987    10.10.1.1 → 10.10.1.2    TCP 83 8081 → 48392 [PSH, ACK] Seq=1157 Ack=1174 Win=65152 Len=17 TSval=3171496114 TSecr=1047236403
1711549037.056200981   594 1.238569428    10.10.1.2 → 10.10.1.1    TCP 83 48392 → 8081 [PSH, ACK] Seq=1174 Ack=1174 Win=64256 Len=17 TSval=1047236413 TSecr=3171496114
1711549039.056200981   596 1.238621744    10.10.1.1 → 10.10.1.2    TCP 83 8081 → 48392 [PSH, ACK] Seq=1174 Ack=1191 Win=65152 Len=17 TSval=3171496124 TSecr=1047236413
1711549045.056200981   602 1.248776807    10.10.1.2 → 10.10.1.1    TCP 83 48392 → 8081 [PSH, ACK] Seq=1191 Ack=1191 Win=64256 Len=17 TSval=1047236423 TSecr=3171496124
1711549047.056200981   604 1.248822893    10.10.1.1 → 10.10.1.2    TCP 83 8081 → 48392 [PSH, ACK] Seq=1191 Ack=1208 Win=65152 Len=17 TSval=3171496134 TSecr=1047236423
1711549053.056200981   610 1.258977635    10.10.1.2 → 10.10.1.1    TCP 83 48392 → 8081 [PSH, ACK] Seq=1208 Ack=1208 Win=64256 Len=17 TSval=1047236434 TSecr=3171496134
1711549055.056200981   612 1.259024299    10.10.1.1 → 10.10.1.2    TCP 83 8081 → 48392 [PSH, ACK] Seq=1208 Ack=1225 Win=65152 Len=17 TSval=3171496144 TSecr=1047236434
1711549062.056200981   619 1.269178802    10.10.1.2 → 10.10.1.1    TCP 83 48392 → 8081 [PSH, ACK] Seq=1225 Ack=1225 Win=64256 Len=17 TSval=1047236444 TSecr=3171496144
1711549064.056200981   621 1.269225069    10.10.1.1 → 10.10.1.2    TCP 83 8081 → 48392 [PSH, ACK] Seq=1225 Ack=1242 Win=65152 Len=17 TSval=3171496154 TSecr=1047236444
1711549070.056200981   627 1.279379520    10.10.1.2 → 10.10.1.1    TCP 83 48392 → 8081 [PSH, ACK] Seq=1242 Ack=1242 Win=64256 Len=17 TSval=1047236454 TSecr=3171496154
1711549072.056200981   629 1.279425681    10.10.1.1 → 10.10.1.2    TCP 83 8081 → 48392 [PSH, ACK] Seq=1242 Ack=1259 Win=65152 Len=17 TSval=3171496165 TSecr=1047236454
1711549078.056200981   635 1.289581709    10.10.1.2 → 10.10.1.1    TCP 83 48392 → 8081 [PSH, ACK] Seq=1259 Ack=1259 Win=64256 Len=17 TSval=1047236464 TSecr=3171496165
1711549080.056200981   637 1.289629716    10.10.1.1 → 10.10.1.2    TCP 83 8081 → 48392 [PSH, ACK] Seq=1259 Ack=1276 Win=65152 Len=17 TSval=3171496175 TSecr=1047236464
1711549086.056200981   643 1.299783116    10.10.1.2 → 10.10.1.1    TCP 83 48392 → 8081 [PSH, ACK] Seq=1276 Ack=1276 Win=64256 Len=17 TSval=1047236474 TSecr=3171496175
1711549088.056200981   645 1.299828726    10.10.1.1 → 10.10.1.2    TCP 83 8081 → 48392 [PSH, ACK] Seq=1276 Ack=1293 Win=65152 Len=17 TSval=3171496185 TSecr=1047236474
1711549094.056200981   651 1.309982210    10.10.1.2 → 10.10.1.1    TCP 83 48392 → 8081 [PSH, ACK] Seq=1293 Ack=1293 Win=64256 Len=17 TSval=1047236485 TSecr=3171496185
1711549096.056200981   653 1.310030895    10.10.1.1 → 10.10.1.2    TCP 83 8081 → 48392 [PSH, ACK] Seq=1293 Ack=1310 Win=65152 Len=17 TSval=3171496195 TSecr=1047236485
1711549102.056200981   659 1.320186128    10.10.1.2 → 10.10.1.1    TCP 83 48392 → 8081 [PSH, ACK] Seq=1310 Ack=1310 Win=64256 Len=17 TSval=1047236495 TSecr=3171496195
1711549104.056200981   661 1.320236285    10.10.1.1 → 10.10.1.2    TCP 83 8081 → 48392 [PSH, ACK] Seq=1310 Ack=1327 Win=65152 Len=17 TSval=3171496205 TSecr=1047236495
1711549110.056200981   667 1.330390998    10.10.1.2 → 10.10.1.1    TCP 83 48392 → 8081 [PSH, ACK] Seq=1327 Ack=1327 Win=64256 Len=17 TSval=1047236505 TSecr=3171496205
1711549112.056200981   669 1.330440739    10.10.1.1 → 10.10.1.2    TCP 83 8081 → 48392 [PSH, ACK] Seq=1327 Ack=1344 Win=65152 Len=17 TSval=3171496216 TSecr=1047236505
1711549118.056200981   675 1.340594272    10.10.1.2 → 10.10.1.1    TCP 83 48392 → 8081 [PSH, ACK] Seq=1344 Ack=1344 Win=64256 Len=17 TSval=1047236515 TSecr=3171496216
1711549120.056200981   677 1.340644529    10.10.1.1 → 10.10.1.2    TCP 83 8081 → 48392 [PSH, ACK] Seq=1344 Ack=1361 Win=65152 Len=17 TSval=3171496226 TSecr=1047236515
1711549126.056200981   683 1.350798771    10.10.1.2 → 10.10.1.1    TCP 83 48392 → 8081 [PSH, ACK] Seq=1361 Ack=1361 Win=64256 Len=17 TSval=1047236525 TSecr=3171496226
1711549128.056200981   685 1.350844384    10.10.1.1 → 10.10.1.2    TCP 83 8081 → 48392 [PSH, ACK] Seq=1361 Ack=1378 Win=65152 Len=17 TSval=3171496236 TSecr=1047236525
1711549134.056200981   691 1.360998958    10.10.1.2 → 10.10.1.1    TCP 83 48392 → 8081 [PSH, ACK] Seq=1378 Ack=1378 Win=64256 Len=17 TSval=1047236536 TSecr=3171496236
1711549136.056200981   693 1.361043903    10.10.1.1 → 10.10.1.2    TCP 83 8081 → 48392 [PSH, ACK] Seq=1378 Ack=1395 Win=65152 Len=17 TSval=3171496246 TSecr=1047236536
1711549142.056200981   699 1.371200032    10.10.1.2 → 10.10.1.1    TCP 83 48392 → 8081 [PSH, ACK] Seq=1395 Ack=1395 Win=64256 Len=17 TSval=1047236546 TSecr=3171496246
1711549144.056200981   701 1.371245500    10.10.1.1 → 10.10.1.2    TCP 83 8081 → 48392 [PSH, ACK] Seq=1395 Ack=1412 Win=65152 Len=17 TSval=3171496256 TSecr=1047236546
1711549150.056200981   707 1.381398495    10.10.1.2 → 10.10.1.1    TCP 83 48392 → 8081 [PSH, ACK] Seq=1412 Ack=1412 Win=64256 Len=17 TSval=1047236556 TSecr=3171496256
1711549152.056200981   709 1.381444015    10.10.1.1 → 10.10.1.2    TCP 83 8081 → 48392 [PSH, ACK] Seq=1412 Ack=1429 Win=65152 Len=17 TSval=3171496267 TSecr=1047236556
1711549158.056200981   715 1.391597644    10.10.1.2 → 10.10.1.1    TCP 83 48392 → 8081 [PSH, ACK] Seq=1429 Ack=1429 Win=64256 Len=17 TSval=1047236566 TSecr=3171496267
1711549160.056200981   717 1.391648569    10.10.1.1 → 10.10.1.2    TCP 83 8081 → 48392 [PSH, ACK] Seq=1429 Ack=1446 Win=65152 Len=17 TSval=3171496277 TSecr=1047236566
1711549166.056200981   723 1.401803910    10.10.1.2 → 10.10.1.1    TCP 83 48392 → 8081 [PSH, ACK] Seq=1446 Ack=1446 Win=64256 Len=17 TSval=1047236576 TSecr=3171496277
1711549168.056200981   725 1.401849887    10.10.1.1 → 10.10.1.2    TCP 83 8081 → 48392 [PSH, ACK] Seq=1446 Ack=1463 Win=65152 Len=17 TSval=3171496287 TSecr=1047236576
1711549174.056200981   731 1.412003608    10.10.1.2 → 10.10.1.1    TCP 83 48392 → 8081 [PSH, ACK] Seq=1463 Ack=1463 Win=64256 Len=17 TSval=1047236587 TSecr=3171496287
1711549176.056200981   733 1.412048845    10.10.1.1 → 10.10.1.2    TCP 83 8081 → 48392 [PSH, ACK] Seq=1463 Ack=1480 Win=65152 Len=17 TSval=3171496297 TSecr=1047236587
1711549182.056200981   739 1.422204194    10.10.1.2 → 10.10.1.1    TCP 83 48392 → 8081 [PSH, ACK] Seq=1480 Ack=1480 Win=64256 Len=17 TSval=1047236597 TSecr=3171496297
1711549184.056200981   741 1.422248803    10.10.1.1 → 10.10.1.2    TCP 83 8081 → 48392 [PSH, ACK] Seq=1480 Ack=1497 Win=65152 Len=17 TSval=3171496307 TSecr=1047236597
1711549190.056200981   747 1.432404238    10.10.1.2 → 10.10.1.1    TCP 83 48392 → 8081 [PSH, ACK] Seq=1497 Ack=1497 Win=64256 Len=17 TSval=1047236607 TSecr=3171496307
1711549192.056200981   749 1.432449173    10.10.1.1 → 10.10.1.2    TCP 83 8081 → 48392 [PSH, ACK] Seq=1497 Ack=1514 Win=65152 Len=17 TSval=3171496318 TSecr=1047236607
1711549198.056200981   755 1.442603597    10.10.1.2 → 10.10.1.1    TCP 83 48392 → 8081 [PSH, ACK] Seq=1514 Ack=1514 Win=64256 Len=17 TSval=1047236617 TSecr=3171496318
1711549200.056200981   757 1.442646568    10.10.1.1 → 10.10.1.2    TCP 83 8081 → 48392 [PSH, ACK] Seq=1514 Ack=1531 Win=65152 Len=17 TSval=3171496328 TSecr=1047236617
1711549206.056200981   763 1.452801436    10.10.1.2 → 10.10.1.1    TCP 83 48392 → 8081 [PSH, ACK] Seq=1531 Ack=1531 Win=64256 Len=17 TSval=1047236627 TSecr=3171496328
1711549208.056200981   765 1.452845809    10.10.1.1 → 10.10.1.2    TCP 83 8081 → 48392 [PSH, ACK] Seq=1531 Ack=1548 Win=65152 Len=17 TSval=3171496338 TSecr=1047236627
1711549214.056200981   771 1.463009187    10.10.1.2 → 10.10.1.1    TCP 83 48392 → 8081 [PSH, ACK] Seq=1548 Ack=1548 Win=64256 Len=17 TSval=1047236638 TSecr=3171496338
1711549216.056200981   773 1.463055426    10.10.1.1 → 10.10.1.2    TCP 83 8081 → 48392 [PSH, ACK] Seq=1548 Ack=1565 Win=65152 Len=17 TSval=3171496348 TSecr=1047236638
1711549222.056200981   779 1.473210650    10.10.1.2 → 10.10.1.1    TCP 83 48392 → 8081 [PSH, ACK] Seq=1565 Ack=1565 Win=64256 Len=17 TSval=1047236648 TSecr=3171496348
1711549224.056200981   781 1.473262697    10.10.1.1 → 10.10.1.2    TCP 83 8081 → 48392 [PSH, ACK] Seq=1565 Ack=1582 Win=65152 Len=17 TSval=3171496359 TSecr=1047236648
1711549230.056200981   787 1.483417811    10.10.1.2 → 10.10.1.1    TCP 83 48392 → 8081 [PSH, ACK] Seq=1582 Ack=1582 Win=64256 Len=17 TSval=1047236658 TSecr=3171496359
1711549232.056200981   789 1.483462426    10.10.1.1 → 10.10.1.2    TCP 83 8081 → 48392 [PSH, ACK] Seq=1582 Ack=1599 Win=65152 Len=17 TSval=3171496369 TSecr=1047236658
1711549238.056200981   795 1.493618248    10.10.1.2 → 10.10.1.1    TCP 83 48392 → 8081 [PSH, ACK] Seq=1599 Ack=1599 Win=64256 Len=17 TSval=1047236668 TSecr=3171496369
1711549240.056200981   797 1.493663380    10.10.1.1 → 10.10.1.2    TCP 83 8081 → 48392 [PSH, ACK] Seq=1599 Ack=1616 Win=65152 Len=17 TSval=3171496379 TSecr=1047236668
1711549246.056200981   803 1.503818821    10.10.1.2 → 10.10.1.1    TCP 83 48392 → 8081 [PSH, ACK] Seq=1616 Ack=1616 Win=64256 Len=17 TSval=1047236678 TSecr=3171496379
1711549248.056200981   805 1.503866408    10.10.1.1 → 10.10.1.2    TCP 83 8081 → 48392 [PSH, ACK] Seq=1616 Ack=1633 Win=65152 Len=17 TSval=3171496389 TSecr=1047236678
1711549254.056200981   811 1.514020921    10.10.1.2 → 10.10.1.1    TCP 83 48392 → 8081 [PSH, ACK] Seq=1633 Ack=1633 Win=64256 Len=17 TSval=1047236689 TSecr=3171496389
1711549256.056200981   813 1.514067234    10.10.1.1 → 10.10.1.2    TCP 83 8081 → 48392 [PSH, ACK] Seq=1633 Ack=1650 Win=65152 Len=17 TSval=3171496399 TSecr=1047236689
1711549262.056200981   819 1.524221238    10.10.1.2 → 10.10.1.1    TCP 83 48392 → 8081 [PSH, ACK] Seq=1650 Ack=1650 Win=64256 Len=17 TSval=1047236699 TSecr=3171496399
1711549265.056200981   822 1.524275238    10.10.1.1 → 10.10.1.2    TCP 83 8081 → 48392 [PSH, ACK] Seq=1650 Ack=1667 Win=65152 Len=17 TSval=3171496410 TSecr=1047236699
1711549270.056200981   827 1.534431463    10.10.1.2 → 10.10.1.1    TCP 83 48392 → 8081 [PSH, ACK] Seq=1667 Ack=1667 Win=64256 Len=17 TSval=1047236709 TSecr=3171496410
1711549272.056200981   829 1.534476138    10.10.1.1 → 10.10.1.2    TCP 83 8081 → 48392 [PSH, ACK] Seq=1667 Ack=1684 Win=65152 Len=17 TSval=3171496420 TSecr=1047236709
1711549278.056200981   835 1.544631274    10.10.1.2 → 10.10.1.1    TCP 83 48392 → 8081 [PSH, ACK] Seq=1684 Ack=1684 Win=64256 Len=17 TSval=1047236719 TSecr=3171496420
1711549280.056200981   837 1.544676531    10.10.1.1 → 10.10.1.2    TCP 83 8081 → 48392 [PSH, ACK] Seq=1684 Ack=1701 Win=65152 Len=17 TSval=3171496430 TSecr=1047236719
1711549286.056200981   843 1.554831218    10.10.1.2 → 10.10.1.1    TCP 83 48392 → 8081 [PSH, ACK] Seq=1701 Ack=1701 Win=64256 Len=17 TSval=1047236729 TSecr=3171496430
1711549288.056200981   845 1.554875476    10.10.1.1 → 10.10.1.2    TCP 83 8081 → 48392 [PSH, ACK] Seq=1701 Ack=1718 Win=65152 Len=17 TSval=3171496440 TSecr=1047236729
1711549294.056200981   851 1.565031849    10.10.1.2 → 10.10.1.1    TCP 83 48392 → 8081 [PSH, ACK] Seq=1718 Ack=1718 Win=64256 Len=17 TSval=1047236740 TSecr=3171496440
1711549296.056200981   853 1.565077826    10.10.1.1 → 10.10.1.2    TCP 83 8081 → 48392 [PSH, ACK] Seq=1718 Ack=1735 Win=65152 Len=17 TSval=3171496450 TSecr=1047236740
1711549302.056200981   859 1.575234679    10.10.1.2 → 10.10.1.1    TCP 83 48392 → 8081 [PSH, ACK] Seq=1735 Ack=1735 Win=64256 Len=17 TSval=1047236750 TSecr=3171496450
1711549304.056200981   861 1.575284707    10.10.1.1 → 10.10.1.2    TCP 83 8081 → 48392 [PSH, ACK] Seq=1735 Ack=1752 Win=65152 Len=17 TSval=3171496461 TSecr=1047236750
1711549310.056200981   867 1.585440112    10.10.1.2 → 10.10.1.1    TCP 83 48392 → 8081 [PSH, ACK] Seq=1752 Ack=1752 Win=64256 Len=17 TSval=1047236760 TSecr=3171496461
1711549312.056200981   869 1.585485913    10.10.1.1 → 10.10.1.2    TCP 83 8081 → 48392 [PSH, ACK] Seq=1752 Ack=1769 Win=65152 Len=17 TSval=3171496471 TSecr=1047236760
1711549318.056200981   875 1.595640051    10.10.1.2 → 10.10.1.1    TCP 83 48392 → 8081 [PSH, ACK] Seq=1769 Ack=1769 Win=64256 Len=17 TSval=1047236770 TSecr=3171496471
1711549320.056200981   877 1.595684559    10.10.1.1 → 10.10.1.2    TCP 83 8081 → 48392 [PSH, ACK] Seq=1769 Ack=1786 Win=65152 Len=17 TSval=3171496481 TSecr=1047236770
1711549326.056200981   883 1.605841556    10.10.1.2 → 10.10.1.1    TCP 83 48392 → 8081 [PSH, ACK] Seq=1786 Ack=1786 Win=64256 Len=17 TSval=1047236780 TSecr=3171496481
1711549328.056200981   885 1.605890257    10.10.1.1 → 10.10.1.2    TCP 83 8081 → 48392 [PSH, ACK] Seq=1786 Ack=1803 Win=65152 Len=17 TSval=3171496491 TSecr=1047236780
1711549334.056200981   891 1.616045489    10.10.1.2 → 10.10.1.1    TCP 83 48392 → 8081 [PSH, ACK] Seq=1803 Ack=1803 Win=64256 Len=17 TSval=1047236791 TSecr=3171496491
1711549336.056200981   893 1.616089577    10.10.1.1 → 10.10.1.2    TCP 83 8081 → 48392 [PSH, ACK] Seq=1803 Ack=1820 Win=65152 Len=17 TSval=3171496501 TSecr=1047236791
1711549342.056200981   899 1.626243026    10.10.1.2 → 10.10.1.1    TCP 83 48392 → 8081 [PSH, ACK] Seq=1820 Ack=1820 Win=64256 Len=17 TSval=1047236801 TSecr=3171496501
1711549344.056200981   901 1.626287286    10.10.1.1 → 10.10.1.2    TCP 83 8081 → 48392 [PSH, ACK] Seq=1820 Ack=1837 Win=65152 Len=17 TSval=3171496512 TSecr=1047236801
1711549350.056200981   907 1.636441850    10.10.1.2 → 10.10.1.1    TCP 83 48392 → 8081 [PSH, ACK] Seq=1837 Ack=1837 Win=64256 Len=17 TSval=1047236811 TSecr=3171496512
1711549352.056200981   909 1.636495921    10.10.1.1 → 10.10.1.2    TCP 83 8081 → 48392 [PSH, ACK] Seq=1837 Ack=1854 Win=65152 Len=17 TSval=3171496522 TSecr=1047236811
1711549358.056200981   915 1.646651610    10.10.1.2 → 10.10.1.1    TCP 83 48392 → 8081 [PSH, ACK] Seq=1854 Ack=1854 Win=64256 Len=17 TSval=1047236821 TSecr=3171496522
1711549360.056200981   917 1.646695965    10.10.1.1 → 10.10.1.2    TCP 83 8081 → 48392 [PSH, ACK] Seq=1854 Ack=1871 Win=65152 Len=17 TSval=3171496532 TSecr=1047236821
1711549366.056200981   923 1.656850774    10.10.1.2 → 10.10.1.1    TCP 83 48392 → 8081 [PSH, ACK] Seq=1871 Ack=1871 Win=64256 Len=17 TSval=1047236831 TSecr=3171496532
1711549368.056200981   925 1.656895275    10.10.1.1 → 10.10.1.2    TCP 83 8081 → 48392 [PSH, ACK] Seq=1871 Ack=1888 Win=65152 Len=17 TSval=3171496542 TSecr=1047236831
1711549374.056200981   931 1.667049303    10.10.1.2 → 10.10.1.1    TCP 83 48392 → 8081 [PSH, ACK] Seq=1888 Ack=1888 Win=64256 Len=17 TSval=1047236842 TSecr=3171496542
1711549376.056200981   933 1.667093878    10.10.1.1 → 10.10.1.2    TCP 83 8081 → 48392 [PSH, ACK] Seq=1888 Ack=1905 Win=65152 Len=17 TSval=3171496552 TSecr=1047236842
1711549382.056200981   939 1.677247448    10.10.1.2 → 10.10.1.1    TCP 83 48392 → 8081 [PSH, ACK] Seq=1905 Ack=1905 Win=64256 Len=17 TSval=1047236852 TSecr=3171496552
1711549384.056200981   941 1.677289464    10.10.1.1 → 10.10.1.2    TCP 83 8081 → 48392 [PSH, ACK] Seq=1905 Ack=1922 Win=65152 Len=17 TSval=3171496563 TSecr=1047236852
1711549390.056200981   947 1.687442391    10.10.1.2 → 10.10.1.1    TCP 83 48392 → 8081 [PSH, ACK] Seq=1922 Ack=1922 Win=64256 Len=17 TSval=1047236862 TSecr=3171496563
1711549393.056200981   950 1.687537082    10.10.1.1 → 10.10.1.2    TCP 83 8081 → 48392 [PSH, ACK] Seq=1922 Ack=1939 Win=65152 Len=17 TSval=3171496573 TSecr=1047236862
1711549398.056200981   955 1.697690931    10.10.1.2 → 10.10.1.1    TCP 83 48392 → 8081 [PSH, ACK] Seq=1939 Ack=1939 Win=64256 Len=17 TSval=1047236872 TSecr=3171496573
1711549400.056200981   957 1.697736153    10.10.1.1 → 10.10.1.2    TCP 83 8081 → 48392 [PSH, ACK] Seq=1939 Ack=1956 Win=65152 Len=17 TSval=3171496583 TSecr=1047236872
1711549406.056200981   963 1.707890360    10.10.1.2 → 10.10.1.1    TCP 83 48392 → 8081 [PSH, ACK] Seq=1956 Ack=1956 Win=64256 Len=17 TSval=1047236883 TSecr=3171496583
1711549408.056200981   965 1.707935621    10.10.1.1 → 10.10.1.2    TCP 83 8081 → 48392 [PSH, ACK] Seq=1956 Ack=1973 Win=65152 Len=17 TSval=3171496593 TSecr=1047236883
1711549414.056200981   971 1.718089485    10.10.1.2 → 10.10.1.1    TCP 83 48392 → 8081 [PSH, ACK] Seq=1973 Ack=1973 Win=64256 Len=17 TSval=1047236893 TSecr=3171496593
1711549416.056200981   973 1.718135782    10.10.1.1 → 10.10.1.2    TCP 83 8081 → 48392 [PSH, ACK] Seq=1973 Ack=1990 Win=65152 Len=17 TSval=3171496603 TSecr=1047236893
1711549422.056200981   979 1.728291533    10.10.1.2 → 10.10.1.1    TCP 83 48392 → 8081 [PSH, ACK] Seq=1990 Ack=1990 Win=64256 Len=17 TSval=1047236903 TSecr=3171496603
1711549424.056200981   981 1.728336016    10.10.1.1 → 10.10.1.2    TCP 83 8081 → 48392 [PSH, ACK] Seq=1990 Ack=2007 Win=65152 Len=17 TSval=3171496614 TSecr=1047236903
