1711548431.859971046    42 0.533699264    10.10.1.2 → 10.10.1.1    TCP 83 39808 → 8081 [PSH, ACK] Seq=1 Ack=1 Win=64256 Len=17 TSval=1047182418 TSecr=3171441870
1711548435.859971046    46 0.533889771    10.10.1.1 → 10.10.1.2    TCP 83 8081 → 39808 [PSH, ACK] Seq=1 Ack=18 Win=65152 Len=17 TSval=3171442129 TSecr=1047182418
1711548443.859971046    54 0.544057789    10.10.1.2 → 10.10.1.1    TCP 83 39808 → 8081 [PSH, ACK] Seq=18 Ack=18 Win=64256 Len=17 TSval=1047182429 TSecr=3171442129
1711548446.859971046    57 0.544099270    10.10.1.1 → 10.10.1.2    TCP 83 8081 → 39808 [PSH, ACK] Seq=18 Ack=35 Win=65152 Len=17 TSval=3171442139 TSecr=1047182429
1711548453.859971046    64 0.554262939    10.10.1.2 → 10.10.1.1    TCP 83 39808 → 8081 [PSH, ACK] Seq=35 Ack=35 Win=64256 Len=17 TSval=1047182439 TSecr=3171442139
1711548456.859971046    67 0.554323452    10.10.1.1 → 10.10.1.2    TCP 83 8081 → 39808 [PSH, ACK] Seq=35 Ack=52 Win=65152 Len=17 TSval=3171442150 TSecr=1047182439
1711548463.859971046    74 0.564486749    10.10.1.2 → 10.10.1.1    TCP 83 39808 → 8081 [PSH, ACK] Seq=52 Ack=52 Win=64256 Len=17 TSval=1047182449 TSecr=3171442150
1711548466.859971046    77 0.564559745    10.10.1.1 → 10.10.1.2    TCP 83 8081 → 39808 [PSH, ACK] Seq=52 Ack=69 Win=65152 Len=17 TSval=3171442160 TSecr=1047182449
1711548473.859971046    84 0.574724208    10.10.1.2 → 10.10.1.1    TCP 83 39808 → 8081 [PSH, ACK] Seq=69 Ack=69 Win=64256 Len=17 TSval=1047182459 TSecr=3171442160
1711548476.859971046    87 0.574779639    10.10.1.1 → 10.10.1.2    TCP 83 8081 → 39808 [PSH, ACK] Seq=69 Ack=86 Win=65152 Len=17 TSval=3171442170 TSecr=1047182459
1711548483.859971046    94 0.584943998    10.10.1.2 → 10.10.1.1    TCP 83 39808 → 8081 [PSH, ACK] Seq=86 Ack=86 Win=64256 Len=17 TSval=1047182470 TSecr=3171442170
1711548485.859971046    96 0.584991710    10.10.1.1 → 10.10.1.2    TCP 83 8081 → 39808 [PSH, ACK] Seq=86 Ack=103 Win=65152 Len=17 TSval=3171442180 TSecr=1047182470
1711548493.859971046   104 0.595158169    10.10.1.2 → 10.10.1.1    TCP 83 39808 → 8081 [PSH, ACK] Seq=103 Ack=103 Win=64256 Len=17 TSval=1047182480 TSecr=3171442180
1711548496.859971046   107 0.595205267    10.10.1.1 → 10.10.1.2    TCP 83 8081 → 39808 [PSH, ACK] Seq=103 Ack=120 Win=65152 Len=17 TSval=3171442190 TSecr=1047182480
1711548503.859971046   114 0.605368011    10.10.1.2 → 10.10.1.1    TCP 83 39808 → 8081 [PSH, ACK] Seq=120 Ack=120 Win=64256 Len=17 TSval=1047182490 TSecr=3171442190
1711548505.859971046   116 0.605416062    10.10.1.1 → 10.10.1.2    TCP 83 8081 → 39808 [PSH, ACK] Seq=120 Ack=137 Win=65152 Len=17 TSval=3171442201 TSecr=1047182490
1711548513.859971046   124 0.615578336    10.10.1.2 → 10.10.1.1    TCP 83 39808 → 8081 [PSH, ACK] Seq=137 Ack=137 Win=64256 Len=17 TSval=1047182500 TSecr=3171442201
1711548515.859971046   126 0.615625287    10.10.1.1 → 10.10.1.2    TCP 83 8081 → 39808 [PSH, ACK] Seq=137 Ack=154 Win=65152 Len=17 TSval=3171442211 TSecr=1047182500
1711548523.859971046   134 0.625788920    10.10.1.2 → 10.10.1.1    TCP 83 39808 → 8081 [PSH, ACK] Seq=154 Ack=154 Win=64256 Len=17 TSval=1047182510 TSecr=3171442211
1711548525.859971046   136 0.625834841    10.10.1.1 → 10.10.1.2    TCP 83 8081 → 39808 [PSH, ACK] Seq=154 Ack=171 Win=65152 Len=17 TSval=3171442221 TSecr=1047182510
1711548533.859971046   144 0.635996925    10.10.1.2 → 10.10.1.1    TCP 83 39808 → 8081 [PSH, ACK] Seq=171 Ack=171 Win=64256 Len=17 TSval=1047182521 TSecr=3171442221
1711548535.859971046   146 0.636032102    10.10.1.1 → 10.10.1.2    TCP 83 8081 → 39808 [PSH, ACK] Seq=171 Ack=188 Win=65152 Len=17 TSval=3171442231 TSecr=1047182521
1711548543.859971046   154 0.646193040    10.10.1.2 → 10.10.1.1    TCP 83 39808 → 8081 [PSH, ACK] Seq=188 Ack=188 Win=64256 Len=17 TSval=1047182531 TSecr=3171442231
1711548545.859971046   156 0.646228140    10.10.1.1 → 10.10.1.2    TCP 83 8081 → 39808 [PSH, ACK] Seq=188 Ack=205 Win=65152 Len=17 TSval=3171442241 TSecr=1047182531
1711548553.859971046   164 0.656388586    10.10.1.2 → 10.10.1.1    TCP 83 39808 → 8081 [PSH, ACK] Seq=205 Ack=205 Win=64256 Len=17 TSval=1047182541 TSecr=3171442241
1711548555.859971046   166 0.656425006    10.10.1.1 → 10.10.1.2    TCP 83 8081 → 39808 [PSH, ACK] Seq=205 Ack=222 Win=65152 Len=17 TSval=3171442252 TSecr=1047182541
1711548563.859971046   174 0.666585273    10.10.1.2 → 10.10.1.1    TCP 83 39808 → 8081 [PSH, ACK] Seq=222 Ack=222 Win=64256 Len=17 TSval=1047182551 TSecr=3171442252
1711548565.859971046   176 0.666620514    10.10.1.1 → 10.10.1.2    TCP 83 8081 → 39808 [PSH, ACK] Seq=222 Ack=239 Win=65152 Len=17 TSval=3171442262 TSecr=1047182551
1711548573.859971046   184 0.676784387    10.10.1.2 → 10.10.1.1    TCP 83 39808 → 8081 [PSH, ACK] Seq=239 Ack=239 Win=64256 Len=17 TSval=1047182561 TSecr=3171442262
1711548575.859971046   186 0.676819794    10.10.1.1 → 10.10.1.2    TCP 83 8081 → 39808 [PSH, ACK] Seq=239 Ack=256 Win=65152 Len=17 TSval=3171442272 TSecr=1047182561
1711548583.859971046   194 0.686983022    10.10.1.2 → 10.10.1.1    TCP 83 39808 → 8081 [PSH, ACK] Seq=256 Ack=256 Win=64256 Len=17 TSval=1047182572 TSecr=3171442272
1711548585.859971046   196 0.687017858    10.10.1.1 → 10.10.1.2    TCP 83 8081 → 39808 [PSH, ACK] Seq=256 Ack=273 Win=65152 Len=17 TSval=3171442282 TSecr=1047182572
1711548593.859971046   204 0.697179900    10.10.1.2 → 10.10.1.1    TCP 83 39808 → 8081 [PSH, ACK] Seq=273 Ack=273 Win=64256 Len=17 TSval=1047182582 TSecr=3171442282
1711548595.859971046   206 0.697214132    10.10.1.1 → 10.10.1.2    TCP 83 8081 → 39808 [PSH, ACK] Seq=273 Ack=290 Win=65152 Len=17 TSval=3171442292 TSecr=1047182582
1711548603.859971046   214 0.707375354    10.10.1.2 → 10.10.1.1    TCP 83 39808 → 8081 [PSH, ACK] Seq=290 Ack=290 Win=64256 Len=17 TSval=1047182592 TSecr=3171442292
1711548605.859971046   216 0.707409825    10.10.1.1 → 10.10.1.2    TCP 83 8081 → 39808 [PSH, ACK] Seq=290 Ack=307 Win=65152 Len=17 TSval=3171442303 TSecr=1047182592
1711548613.859971046   224 0.717572089    10.10.1.2 → 10.10.1.1    TCP 83 39808 → 8081 [PSH, ACK] Seq=307 Ack=307 Win=64256 Len=17 TSval=1047182602 TSecr=3171442303
1711548615.859971046   226 0.717607379    10.10.1.1 → 10.10.1.2    TCP 83 8081 → 39808 [PSH, ACK] Seq=307 Ack=324 Win=65152 Len=17 TSval=3171442313 TSecr=1047182602
1711548623.859971046   234 0.727770693    10.10.1.2 → 10.10.1.1    TCP 83 39808 → 8081 [PSH, ACK] Seq=324 Ack=324 Win=64256 Len=17 TSval=1047182612 TSecr=3171442313
1711548625.859971046   236 0.727803329    10.10.1.1 → 10.10.1.2    TCP 83 8081 → 39808 [PSH, ACK] Seq=324 Ack=341 Win=65152 Len=17 TSval=3171442323 TSecr=1047182612
1711548633.859971046   244 0.737964139    10.10.1.2 → 10.10.1.1    TCP 83 39808 → 8081 [PSH, ACK] Seq=341 Ack=341 Win=64256 Len=17 TSval=1047182623 TSecr=3171442323
1711548635.859971046   246 0.737996467    10.10.1.1 → 10.10.1.2    TCP 83 8081 → 39808 [PSH, ACK] Seq=341 Ack=358 Win=65152 Len=17 TSval=3171442333 TSecr=1047182623
1711548643.859971046   254 0.748157234    10.10.1.2 → 10.10.1.1    TCP 83 39808 → 8081 [PSH, ACK] Seq=358 Ack=358 Win=64256 Len=17 TSval=1047182633 TSecr=3171442333
1711548645.859971046   256 0.748189287    10.10.1.1 → 10.10.1.2    TCP 83 8081 → 39808 [PSH, ACK] Seq=358 Ack=375 Win=65152 Len=17 TSval=3171442343 TSecr=1047182633
1711548653.859971046   264 0.758351054    10.10.1.2 → 10.10.1.1    TCP 83 39808 → 8081 [PSH, ACK] Seq=375 Ack=375 Win=64256 Len=17 TSval=1047182643 TSecr=3171442343
1711548655.859971046   266 0.758391020    10.10.1.1 → 10.10.1.2    TCP 83 8081 → 39808 [PSH, ACK] Seq=375 Ack=392 Win=65152 Len=17 TSval=3171442354 TSecr=1047182643
1711548663.859971046   274 0.768552042    10.10.1.2 → 10.10.1.1    TCP 83 39808 → 8081 [PSH, ACK] Seq=392 Ack=392 Win=64256 Len=17 TSval=1047182653 TSecr=3171442354
1711548665.859971046   276 0.768588950    10.10.1.1 → 10.10.1.2    TCP 83 8081 → 39808 [PSH, ACK] Seq=392 Ack=409 Win=65152 Len=17 TSval=3171442364 TSecr=1047182653
1711548673.859971046   284 0.778750359    10.10.1.2 → 10.10.1.1    TCP 83 39808 → 8081 [PSH, ACK] Seq=409 Ack=409 Win=64256 Len=17 TSval=1047182663 TSecr=3171442364
1711548675.859971046   286 0.778785239    10.10.1.1 → 10.10.1.2    TCP 83 8081 → 39808 [PSH, ACK] Seq=409 Ack=426 Win=65152 Len=17 TSval=3171442374 TSecr=1047182663
1711548683.859971046   294 0.788945918    10.10.1.2 → 10.10.1.1    TCP 83 39808 → 8081 [PSH, ACK] Seq=426 Ack=426 Win=64256 Len=17 TSval=1047182674 TSecr=3171442374
1711548685.859971046   296 0.788980024    10.10.1.1 → 10.10.1.2    TCP 83 8081 → 39808 [PSH, ACK] Seq=426 Ack=443 Win=65152 Len=17 TSval=3171442384 TSecr=1047182674
1711548693.859971046   304 0.799140258    10.10.1.2 → 10.10.1.1    TCP 83 39808 → 8081 [PSH, ACK] Seq=443 Ack=443 Win=64256 Len=17 TSval=1047182684 TSecr=3171442384
1711548695.859971046   306 0.799174658    10.10.1.1 → 10.10.1.2    TCP 83 8081 → 39808 [PSH, ACK] Seq=443 Ack=460 Win=65152 Len=17 TSval=3171442394 TSecr=1047182684
1711548703.859971046   314 0.809335511    10.10.1.2 → 10.10.1.1    TCP 83 39808 → 8081 [PSH, ACK] Seq=460 Ack=460 Win=64256 Len=17 TSval=1047182694 TSecr=3171442394
1711548705.859971046   316 0.809370219    10.10.1.1 → 10.10.1.2    TCP 83 8081 → 39808 [PSH, ACK] Seq=460 Ack=477 Win=65152 Len=17 TSval=3171442405 TSecr=1047182694
1711548713.859971046   324 0.819530512    10.10.1.2 → 10.10.1.1    TCP 83 39808 → 8081 [PSH, ACK] Seq=477 Ack=477 Win=64256 Len=17 TSval=1047182704 TSecr=3171442405
1711548715.859971046   326 0.819565153    10.10.1.1 → 10.10.1.2    TCP 83 8081 → 39808 [PSH, ACK] Seq=477 Ack=494 Win=65152 Len=17 TSval=3171442415 TSecr=1047182704
1711548723.859971046   334 0.829725835    10.10.1.2 → 10.10.1.1    TCP 83 39808 → 8081 [PSH, ACK] Seq=494 Ack=494 Win=64256 Len=17 TSval=1047182714 TSecr=3171442415
1711548725.859971046   336 0.829760040    10.10.1.1 → 10.10.1.2    TCP 83 8081 → 39808 [PSH, ACK] Seq=494 Ack=511 Win=65152 Len=17 TSval=3171442425 TSecr=1047182714
1711548733.859971046   344 0.839920253    10.10.1.2 → 10.10.1.1    TCP 83 39808 → 8081 [PSH, ACK] Seq=511 Ack=511 Win=64256 Len=17 TSval=1047182725 TSecr=3171442425
1711548735.859971046   346 0.839954311    10.10.1.1 → 10.10.1.2    TCP 83 8081 → 39808 [PSH, ACK] Seq=511 Ack=528 Win=65152 Len=17 TSval=3171442435 TSecr=1047182725
1711548743.859971046   354 0.850114565    10.10.1.2 → 10.10.1.1    TCP 83 39808 → 8081 [PSH, ACK] Seq=528 Ack=528 Win=64256 Len=17 TSval=1047182735 TSecr=3171442435
1711548745.859971046   356 0.850146760    10.10.1.1 → 10.10.1.2    TCP 83 8081 → 39808 [PSH, ACK] Seq=528 Ack=545 Win=65152 Len=17 TSval=3171442445 TSecr=1047182735
1711548753.859971046   364 0.860306483    10.10.1.2 → 10.10.1.1    TCP 83 39808 → 8081 [PSH, ACK] Seq=545 Ack=545 Win=64256 Len=17 TSval=1047182745 TSecr=3171442445
1711548755.859971046   366 0.860338869    10.10.1.1 → 10.10.1.2    TCP 83 8081 → 39808 [PSH, ACK] Seq=545 Ack=562 Win=65152 Len=17 TSval=3171442456 TSecr=1047182745
1711548763.859971046   374 0.870501137    10.10.1.2 → 10.10.1.1    TCP 83 39808 → 8081 [PSH, ACK] Seq=562 Ack=562 Win=64256 Len=17 TSval=1047182755 TSecr=3171442456
1711548765.859971046   376 0.870535613    10.10.1.1 → 10.10.1.2    TCP 83 8081 → 39808 [PSH, ACK] Seq=562 Ack=579 Win=65152 Len=17 TSval=3171442466 TSecr=1047182755
1711548773.859971046   384 0.880698705    10.10.1.2 → 10.10.1.1    TCP 83 39808 → 8081 [PSH, ACK] Seq=579 Ack=579 Win=64256 Len=17 TSval=1047182765 TSecr=3171442466
1711548775.859971046   386 0.880733836    10.10.1.1 → 10.10.1.2    TCP 83 8081 → 39808 [PSH, ACK] Seq=579 Ack=596 Win=65152 Len=17 TSval=3171442476 TSecr=1047182765
1711548783.859971046   394 0.890878311    10.10.1.2 → 10.10.1.1    TCP 83 39808 → 8081 [PSH, ACK] Seq=596 Ack=596 Win=64256 Len=17 TSval=1047182776 TSecr=3171442476
1711548785.859971046   396 0.890912262    10.10.1.1 → 10.10.1.2    TCP 83 8081 → 39808 [PSH, ACK] Seq=596 Ack=613 Win=65152 Len=17 TSval=3171442486 TSecr=1047182776
1711548793.859971046   404 0.901074505    10.10.1.2 → 10.10.1.1    TCP 83 39808 → 8081 [PSH, ACK] Seq=613 Ack=613 Win=64256 Len=17 TSval=1047182786 TSecr=3171442486
1711548795.859971046   406 0.901108964    10.10.1.1 → 10.10.1.2    TCP 83 8081 → 39808 [PSH, ACK] Seq=613 Ack=630 Win=65152 Len=17 TSval=3171442496 TSecr=1047182786
1711548803.859971046   414 0.911270903    10.10.1.2 → 10.10.1.1    TCP 83 39808 → 8081 [PSH, ACK] Seq=630 Ack=630 Win=64256 Len=17 TSval=1047182796 TSecr=3171442496
1711548805.859971046   416 0.911307635    10.10.1.1 → 10.10.1.2    TCP 83 8081 → 39808 [PSH, ACK] Seq=630 Ack=647 Win=65152 Len=17 TSval=3171442507 TSecr=1047182796
1711548813.859971046   424 0.921469104    10.10.1.2 → 10.10.1.1    TCP 83 39808 → 8081 [PSH, ACK] Seq=647 Ack=647 Win=64256 Len=17 TSval=1047182806 TSecr=3171442507
1711548815.859971046   426 0.921503238    10.10.1.1 → 10.10.1.2    TCP 83 8081 → 39808 [PSH, ACK] Seq=647 Ack=664 Win=65152 Len=17 TSval=3171442517 TSecr=1047182806
1711548823.859971046   434 0.931662042    10.10.1.2 → 10.10.1.1    TCP 83 39808 → 8081 [PSH, ACK] Seq=664 Ack=664 Win=64256 Len=17 TSval=1047182816 TSecr=3171442517
1711548825.859971046   436 0.931696327    10.10.1.1 → 10.10.1.2    TCP 83 8081 → 39808 [PSH, ACK] Seq=664 Ack=681 Win=65152 Len=17 TSval=3171442527 TSecr=1047182816
1711548833.859971046   444 0.941856662    10.10.1.2 → 10.10.1.1    TCP 83 39808 → 8081 [PSH, ACK] Seq=681 Ack=681 Win=64256 Len=17 TSval=1047182826 TSecr=3171442527
1711548835.859971046   446 0.941891121    10.10.1.1 → 10.10.1.2    TCP 83 8081 → 39808 [PSH, ACK] Seq=681 Ack=698 Win=65152 Len=17 TSval=3171442537 TSecr=1047182826
1711548843.859971046   454 0.952053385    10.10.1.2 → 10.10.1.1    TCP 83 39808 → 8081 [PSH, ACK] Seq=698 Ack=698 Win=64256 Len=17 TSval=1047182837 TSecr=3171442537
1711548845.859971046   456 0.952087825    10.10.1.1 → 10.10.1.2    TCP 83 8081 → 39808 [PSH, ACK] Seq=698 Ack=715 Win=65152 Len=17 TSval=3171442547 TSecr=1047182837
1711548853.859971046   464 0.962248491    10.10.1.2 → 10.10.1.1    TCP 83 39808 → 8081 [PSH, ACK] Seq=715 Ack=715 Win=64256 Len=17 TSval=1047182847 TSecr=3171442547
1711548855.859971046   466 0.962299049    10.10.1.1 → 10.10.1.2    TCP 83 8081 → 39808 [PSH, ACK] Seq=715 Ack=732 Win=65152 Len=17 TSval=3171442558 TSecr=1047182847
1711548863.859971046   474 0.972459535    10.10.1.2 → 10.10.1.1    TCP 83 39808 → 8081 [PSH, ACK] Seq=732 Ack=732 Win=64256 Len=17 TSval=1047182857 TSecr=3171442558
1711548865.859971046   476 0.972495443    10.10.1.1 → 10.10.1.2    TCP 83 8081 → 39808 [PSH, ACK] Seq=732 Ack=749 Win=65152 Len=17 TSval=3171442568 TSecr=1047182857
1711548873.859971046   484 0.982656343    10.10.1.2 → 10.10.1.1    TCP 83 39808 → 8081 [PSH, ACK] Seq=749 Ack=749 Win=64256 Len=17 TSval=1047182867 TSecr=3171442568
1711548876.859971046   487 0.983876895    10.10.1.1 → 10.10.1.2    TCP 83 8081 → 39808 [PSH, ACK] Seq=749 Ack=766 Win=65152 Len=17 TSval=3171442579 TSecr=1047182867
1711548883.859971046   494 0.994040427    10.10.1.2 → 10.10.1.1    TCP 83 39808 → 8081 [PSH, ACK] Seq=766 Ack=766 Win=64256 Len=17 TSval=1047182879 TSecr=3171442579
1711548885.859971046   496 0.994074059    10.10.1.1 → 10.10.1.2    TCP 83 8081 → 39808 [PSH, ACK] Seq=766 Ack=783 Win=65152 Len=17 TSval=3171442589 TSecr=1047182879
1711548893.859971046   504 1.004234612    10.10.1.2 → 10.10.1.1    TCP 83 39808 → 8081 [PSH, ACK] Seq=783 Ack=783 Win=64256 Len=17 TSval=1047182889 TSecr=3171442589
1711548895.859971046   506 1.004268593    10.10.1.1 → 10.10.1.2    TCP 83 8081 → 39808 [PSH, ACK] Seq=783 Ack=800 Win=65152 Len=17 TSval=3171442599 TSecr=1047182889
1711548903.859971046   514 1.014428321    10.10.1.2 → 10.10.1.1    TCP 83 39808 → 8081 [PSH, ACK] Seq=800 Ack=800 Win=64256 Len=17 TSval=1047182899 TSecr=3171442599
1711548906.859971046   517 1.014478504    10.10.1.1 → 10.10.1.2    TCP 83 8081 → 39808 [PSH, ACK] Seq=800 Ack=817 Win=65152 Len=17 TSval=3171442610 TSecr=1047182899
1711548913.859971046   524 1.024643071    10.10.1.2 → 10.10.1.1    TCP 83 39808 → 8081 [PSH, ACK] Seq=817 Ack=817 Win=64256 Len=17 TSval=1047182909 TSecr=3171442610
1711548915.859971046   526 1.024680501    10.10.1.1 → 10.10.1.2    TCP 83 8081 → 39808 [PSH, ACK] Seq=817 Ack=834 Win=65152 Len=17 TSval=3171442620 TSecr=1047182909
1711548923.859971046   534 1.034840035    10.10.1.2 → 10.10.1.1    TCP 83 39808 → 8081 [PSH, ACK] Seq=834 Ack=834 Win=64256 Len=17 TSval=1047182919 TSecr=3171442620
1711548925.859971046   536 1.034872706    10.10.1.1 → 10.10.1.2    TCP 83 8081 → 39808 [PSH, ACK] Seq=834 Ack=851 Win=65152 Len=17 TSval=3171442630 TSecr=1047182919
1711548933.859971046   544 1.045033735    10.10.1.2 → 10.10.1.1    TCP 83 39808 → 8081 [PSH, ACK] Seq=851 Ack=851 Win=64256 Len=17 TSval=1047182930 TSecr=3171442630
1711548935.859971046   546 1.045069153    10.10.1.1 → 10.10.1.2    TCP 83 8081 → 39808 [PSH, ACK] Seq=851 Ack=868 Win=65152 Len=17 TSval=3171442640 TSecr=1047182930
1711548943.859971046   554 1.055230020    10.10.1.2 → 10.10.1.1    TCP 83 39808 → 8081 [PSH, ACK] Seq=868 Ack=868 Win=64256 Len=17 TSval=1047182940 TSecr=3171442640
1711548945.859971046   556 1.055264606    10.10.1.1 → 10.10.1.2    TCP 83 8081 → 39808 [PSH, ACK] Seq=868 Ack=885 Win=65152 Len=17 TSval=3171442650 TSecr=1047182940
1711548953.859971046   564 1.065424420    10.10.1.2 → 10.10.1.1    TCP 83 39808 → 8081 [PSH, ACK] Seq=885 Ack=885 Win=64256 Len=17 TSval=1047182950 TSecr=3171442650
1711548955.859971046   566 1.065459517    10.10.1.1 → 10.10.1.2    TCP 83 8081 → 39808 [PSH, ACK] Seq=885 Ack=902 Win=65152 Len=17 TSval=3171442661 TSecr=1047182950
1711548963.859971046   574 1.075619672    10.10.1.2 → 10.10.1.1    TCP 83 39808 → 8081 [PSH, ACK] Seq=902 Ack=902 Win=64256 Len=17 TSval=1047182960 TSecr=3171442661
1711548965.859971046   576 1.075653958    10.10.1.1 → 10.10.1.2    TCP 83 8081 → 39808 [PSH, ACK] Seq=902 Ack=919 Win=65152 Len=17 TSval=3171442671 TSecr=1047182960
1711548973.859971046   584 1.085813506    10.10.1.2 → 10.10.1.1    TCP 83 39808 → 8081 [PSH, ACK] Seq=919 Ack=919 Win=64256 Len=17 TSval=1047182970 TSecr=3171442671
1711548975.859971046   586 1.085848347    10.10.1.1 → 10.10.1.2    TCP 83 8081 → 39808 [PSH, ACK] Seq=919 Ack=936 Win=65152 Len=17 TSval=3171442681 TSecr=1047182970
1711548983.859971046   594 1.096009176    10.10.1.2 → 10.10.1.1    TCP 83 39808 → 8081 [PSH, ACK] Seq=936 Ack=936 Win=64256 Len=17 TSval=1047182981 TSecr=3171442681
1711548985.859971046   596 1.096047590    10.10.1.1 → 10.10.1.2    TCP 83 8081 → 39808 [PSH, ACK] Seq=936 Ack=953 Win=65152 Len=17 TSval=3171442691 TSecr=1047182981
1711548993.859971046   604 1.106207985    10.10.1.2 → 10.10.1.1    TCP 83 39808 → 8081 [PSH, ACK] Seq=953 Ack=953 Win=64256 Len=17 TSval=1047182991 TSecr=3171442691
1711548996.859971046   607 1.106309821    10.10.1.1 → 10.10.1.2    TCP 83 8081 → 39808 [PSH, ACK] Seq=953 Ack=970 Win=65152 Len=17 TSval=3171442702 TSecr=1047182991
1711549003.859971046   614 1.116470305    10.10.1.2 → 10.10.1.1    TCP 83 39808 → 8081 [PSH, ACK] Seq=970 Ack=970 Win=64256 Len=17 TSval=1047183001 TSecr=3171442702
1711549005.859971046   616 1.116505337    10.10.1.1 → 10.10.1.2    TCP 83 8081 → 39808 [PSH, ACK] Seq=970 Ack=987 Win=65152 Len=17 TSval=3171442712 TSecr=1047183001
1711549013.859971046   624 1.126665788    10.10.1.2 → 10.10.1.1    TCP 83 39808 → 8081 [PSH, ACK] Seq=987 Ack=987 Win=64256 Len=17 TSval=1047183011 TSecr=3171442712
1711549015.859971046   626 1.126701961    10.10.1.1 → 10.10.1.2    TCP 83 8081 → 39808 [PSH, ACK] Seq=987 Ack=1004 Win=65152 Len=17 TSval=3171442722 TSecr=1047183011
1711549023.859971046   634 1.136836474    10.10.1.2 → 10.10.1.1    TCP 83 39808 → 8081 [PSH, ACK] Seq=1004 Ack=1004 Win=64256 Len=17 TSval=1047183021 TSecr=3171442722
1711549025.859971046   636 1.136870039    10.10.1.1 → 10.10.1.2    TCP 83 8081 → 39808 [PSH, ACK] Seq=1004 Ack=1021 Win=65152 Len=17 TSval=3171442732 TSecr=1047183021
1711549033.859971046   644 1.147030228    10.10.1.2 → 10.10.1.1    TCP 83 39808 → 8081 [PSH, ACK] Seq=1021 Ack=1021 Win=64256 Len=17 TSval=1047183032 TSecr=3171442732
1711549035.859971046   646 1.147064693    10.10.1.1 → 10.10.1.2    TCP 83 8081 → 39808 [PSH, ACK] Seq=1021 Ack=1038 Win=65152 Len=17 TSval=3171442742 TSecr=1047183032
1711549043.859971046   654 1.157225142    10.10.1.2 → 10.10.1.1    TCP 83 39808 → 8081 [PSH, ACK] Seq=1038 Ack=1038 Win=64256 Len=17 TSval=1047183042 TSecr=3171442742
1711549045.859971046   656 1.157259507    10.10.1.1 → 10.10.1.2    TCP 83 8081 → 39808 [PSH, ACK] Seq=1038 Ack=1055 Win=65152 Len=17 TSval=3171442752 TSecr=1047183042
1711549053.859971046   664 1.167418711    10.10.1.2 → 10.10.1.1    TCP 83 39808 → 8081 [PSH, ACK] Seq=1055 Ack=1055 Win=64256 Len=17 TSval=1047183052 TSecr=3171442752
1711549055.859971046   666 1.167453366    10.10.1.1 → 10.10.1.2    TCP 83 8081 → 39808 [PSH, ACK] Seq=1055 Ack=1072 Win=65152 Len=17 TSval=3171442763 TSecr=1047183052
1711549063.859971046   674 1.177613566    10.10.1.2 → 10.10.1.1    TCP 83 39808 → 8081 [PSH, ACK] Seq=1072 Ack=1072 Win=64256 Len=17 TSval=1047183062 TSecr=3171442763
1711549065.859971046   676 1.177647624    10.10.1.1 → 10.10.1.2    TCP 83 8081 → 39808 [PSH, ACK] Seq=1072 Ack=1089 Win=65152 Len=17 TSval=3171442773 TSecr=1047183062
1711549073.859971046   684 1.187808204    10.10.1.2 → 10.10.1.1    TCP 83 39808 → 8081 [PSH, ACK] Seq=1089 Ack=1089 Win=64256 Len=17 TSval=1047183072 TSecr=3171442773
1711549075.859971046   686 1.187842909    10.10.1.1 → 10.10.1.2    TCP 83 8081 → 39808 [PSH, ACK] Seq=1089 Ack=1106 Win=65152 Len=17 TSval=3171442783 TSecr=1047183072
1711549083.859971046   694 1.198003165    10.10.1.2 → 10.10.1.1    TCP 83 39808 → 8081 [PSH, ACK] Seq=1106 Ack=1106 Win=64256 Len=17 TSval=1047183083 TSecr=3171442783
1711549085.859971046   696 1.198039116    10.10.1.1 → 10.10.1.2    TCP 83 8081 → 39808 [PSH, ACK] Seq=1106 Ack=1123 Win=65152 Len=17 TSval=3171442793 TSecr=1047183083
1711549093.859971046   704 1.208199587    10.10.1.2 → 10.10.1.1    TCP 83 39808 → 8081 [PSH, ACK] Seq=1123 Ack=1123 Win=64256 Len=17 TSval=1047183093 TSecr=3171442793
1711549095.859971046   706 1.208233984    10.10.1.1 → 10.10.1.2    TCP 83 8081 → 39808 [PSH, ACK] Seq=1123 Ack=1140 Win=65152 Len=17 TSval=3171442803 TSecr=1047183093
1711549103.859971046   714 1.218394928    10.10.1.2 → 10.10.1.1    TCP 83 39808 → 8081 [PSH, ACK] Seq=1140 Ack=1140 Win=64256 Len=17 TSval=1047183103 TSecr=3171442803
1711549105.859971046   716 1.218429277    10.10.1.1 → 10.10.1.2    TCP 83 8081 → 39808 [PSH, ACK] Seq=1140 Ack=1157 Win=65152 Len=17 TSval=3171442814 TSecr=1047183103
1711549113.859971046   724 1.228589652    10.10.1.2 → 10.10.1.1    TCP 83 39808 → 8081 [PSH, ACK] Seq=1157 Ack=1157 Win=64256 Len=17 TSval=1047183113 TSecr=3171442814
1711549115.859971046   726 1.228625589    10.10.1.1 → 10.10.1.2    TCP 83 8081 → 39808 [PSH, ACK] Seq=1157 Ack=1174 Win=65152 Len=17 TSval=3171442824 TSecr=1047183113
1711549123.859971046   734 1.238788105    10.10.1.2 → 10.10.1.1    TCP 83 39808 → 8081 [PSH, ACK] Seq=1174 Ack=1174 Win=64256 Len=17 TSval=1047183123 TSecr=3171442824
1711549125.859971046   736 1.238822653    10.10.1.1 → 10.10.1.2    TCP 83 8081 → 39808 [PSH, ACK] Seq=1174 Ack=1191 Win=65152 Len=17 TSval=3171442834 TSecr=1047183123
1711549133.859971046   744 1.248990526    10.10.1.2 → 10.10.1.1    TCP 83 39808 → 8081 [PSH, ACK] Seq=1191 Ack=1191 Win=64256 Len=17 TSval=1047183134 TSecr=3171442834
1711549135.859971046   746 1.249024624    10.10.1.1 → 10.10.1.2    TCP 83 8081 → 39808 [PSH, ACK] Seq=1191 Ack=1208 Win=65152 Len=17 TSval=3171442844 TSecr=1047183134
1711549143.859971046   754 1.259186560    10.10.1.2 → 10.10.1.1    TCP 83 39808 → 8081 [PSH, ACK] Seq=1208 Ack=1208 Win=64256 Len=17 TSval=1047183144 TSecr=3171442844
1711549145.859971046   756 1.259222010    10.10.1.1 → 10.10.1.2    TCP 83 8081 → 39808 [PSH, ACK] Seq=1208 Ack=1225 Win=65152 Len=17 TSval=3171442854 TSecr=1047183144
1711549153.859971046   764 1.269382388    10.10.1.2 → 10.10.1.1    TCP 83 39808 → 8081 [PSH, ACK] Seq=1225 Ack=1225 Win=64256 Len=17 TSval=1047183154 TSecr=3171442854
1711549155.859971046   766 1.269416807    10.10.1.1 → 10.10.1.2    TCP 83 8081 → 39808 [PSH, ACK] Seq=1225 Ack=1242 Win=65152 Len=17 TSval=3171442865 TSecr=1047183154
1711549163.859971046   774 1.279577802    10.10.1.2 → 10.10.1.1    TCP 83 39808 → 8081 [PSH, ACK] Seq=1242 Ack=1242 Win=64256 Len=17 TSval=1047183164 TSecr=3171442865
1711549165.859971046   776 1.279612670    10.10.1.1 → 10.10.1.2    TCP 83 8081 → 39808 [PSH, ACK] Seq=1242 Ack=1259 Win=65152 Len=17 TSval=3171442875 TSecr=1047183164
1711549173.859971046   784 1.289773517    10.10.1.2 → 10.10.1.1    TCP 83 39808 → 8081 [PSH, ACK] Seq=1259 Ack=1259 Win=64256 Len=17 TSval=1047183174 TSecr=3171442875
1711549175.859971046   786 1.289807676    10.10.1.1 → 10.10.1.2    TCP 83 8081 → 39808 [PSH, ACK] Seq=1259 Ack=1276 Win=65152 Len=17 TSval=3171442885 TSecr=1047183174
1711549183.859971046   794 1.299968947    10.10.1.2 → 10.10.1.1    TCP 83 39808 → 8081 [PSH, ACK] Seq=1276 Ack=1276 Win=64256 Len=17 TSval=1047183185 TSecr=3171442885
1711549185.859971046   796 1.300005337    10.10.1.1 → 10.10.1.2    TCP 83 8081 → 39808 [PSH, ACK] Seq=1276 Ack=1293 Win=65152 Len=17 TSval=3171442895 TSecr=1047183185
1711549193.859971046   804 1.310166138    10.10.1.2 → 10.10.1.1    TCP 83 39808 → 8081 [PSH, ACK] Seq=1293 Ack=1293 Win=64256 Len=17 TSval=1047183195 TSecr=3171442895
1711549195.859971046   806 1.310200424    10.10.1.1 → 10.10.1.2    TCP 83 8081 → 39808 [PSH, ACK] Seq=1293 Ack=1310 Win=65152 Len=17 TSval=3171442905 TSecr=1047183195
1711549203.859971046   814 1.320361453    10.10.1.2 → 10.10.1.1    TCP 83 39808 → 8081 [PSH, ACK] Seq=1310 Ack=1310 Win=64256 Len=17 TSval=1047183205 TSecr=3171442905
1711549205.859971046   816 1.320396934    10.10.1.1 → 10.10.1.2    TCP 83 8081 → 39808 [PSH, ACK] Seq=1310 Ack=1327 Win=65152 Len=17 TSval=3171442916 TSecr=1047183205
1711549213.859971046   824 1.330558020    10.10.1.2 → 10.10.1.1    TCP 83 39808 → 8081 [PSH, ACK] Seq=1327 Ack=1327 Win=64256 Len=17 TSval=1047183215 TSecr=3171442916
1711549215.859971046   826 1.330593553    10.10.1.1 → 10.10.1.2    TCP 83 8081 → 39808 [PSH, ACK] Seq=1327 Ack=1344 Win=65152 Len=17 TSval=3171442926 TSecr=1047183215
1711549223.859971046   834 1.340755958    10.10.1.2 → 10.10.1.1    TCP 83 39808 → 8081 [PSH, ACK] Seq=1344 Ack=1344 Win=64256 Len=17 TSval=1047183225 TSecr=3171442926
1711549225.859971046   836 1.340789644    10.10.1.1 → 10.10.1.2    TCP 83 8081 → 39808 [PSH, ACK] Seq=1344 Ack=1361 Win=65152 Len=17 TSval=3171442936 TSecr=1047183225
1711549233.859971046   844 1.350950588    10.10.1.2 → 10.10.1.1    TCP 83 39808 → 8081 [PSH, ACK] Seq=1361 Ack=1361 Win=64256 Len=17 TSval=1047183236 TSecr=3171442936
1711549235.859971046   846 1.350984399    10.10.1.1 → 10.10.1.2    TCP 83 8081 → 39808 [PSH, ACK] Seq=1361 Ack=1378 Win=65152 Len=17 TSval=3171442946 TSecr=1047183236
1711549243.859971046   854 1.361145891    10.10.1.2 → 10.10.1.1    TCP 83 39808 → 8081 [PSH, ACK] Seq=1378 Ack=1378 Win=64256 Len=17 TSval=1047183246 TSecr=3171442946
1711549245.859971046   856 1.361180826    10.10.1.1 → 10.10.1.2    TCP 83 8081 → 39808 [PSH, ACK] Seq=1378 Ack=1395 Win=65152 Len=17 TSval=3171442956 TSecr=1047183246
1711549253.859971046   864 1.371340609    10.10.1.2 → 10.10.1.1    TCP 83 39808 → 8081 [PSH, ACK] Seq=1395 Ack=1395 Win=64256 Len=17 TSval=1047183256 TSecr=3171442956
1711549255.859971046   866 1.371374915    10.10.1.1 → 10.10.1.2    TCP 83 8081 → 39808 [PSH, ACK] Seq=1395 Ack=1412 Win=65152 Len=17 TSval=3171442967 TSecr=1047183256
1711549263.859971046   874 1.381536764    10.10.1.2 → 10.10.1.1    TCP 83 39808 → 8081 [PSH, ACK] Seq=1412 Ack=1412 Win=64256 Len=17 TSval=1047183266 TSecr=3171442967
1711549265.859971046   876 1.381571148    10.10.1.1 → 10.10.1.2    TCP 83 8081 → 39808 [PSH, ACK] Seq=1412 Ack=1429 Win=65152 Len=17 TSval=3171442977 TSecr=1047183266
1711549273.859971046   884 1.391736723    10.10.1.2 → 10.10.1.1    TCP 83 39808 → 8081 [PSH, ACK] Seq=1429 Ack=1429 Win=64256 Len=17 TSval=1047183276 TSecr=3171442977
1711549276.859971046   887 1.391790285    10.10.1.1 → 10.10.1.2    TCP 83 8081 → 39808 [PSH, ACK] Seq=1429 Ack=1446 Win=65152 Len=17 TSval=3171442987 TSecr=1047183276
1711549283.859971046   894 1.401950847    10.10.1.2 → 10.10.1.1    TCP 83 39808 → 8081 [PSH, ACK] Seq=1446 Ack=1446 Win=64256 Len=17 TSval=1047183287 TSecr=3171442987
1711549285.859971046   896 1.401987108    10.10.1.1 → 10.10.1.2    TCP 83 8081 → 39808 [PSH, ACK] Seq=1446 Ack=1463 Win=65152 Len=17 TSval=3171442997 TSecr=1047183287
1711549293.859971046   904 1.412146331    10.10.1.2 → 10.10.1.1    TCP 83 39808 → 8081 [PSH, ACK] Seq=1463 Ack=1463 Win=64256 Len=17 TSval=1047183297 TSecr=3171442997
1711549295.859971046   906 1.412180437    10.10.1.1 → 10.10.1.2    TCP 83 8081 → 39808 [PSH, ACK] Seq=1463 Ack=1480 Win=65152 Len=17 TSval=3171443007 TSecr=1047183297
1711549303.859971046   914 1.422341645    10.10.1.2 → 10.10.1.1    TCP 83 39808 → 8081 [PSH, ACK] Seq=1480 Ack=1480 Win=64256 Len=17 TSval=1047183307 TSecr=3171443007
1711549305.859971046   916 1.422377022    10.10.1.1 → 10.10.1.2    TCP 83 8081 → 39808 [PSH, ACK] Seq=1480 Ack=1497 Win=65152 Len=17 TSval=3171443018 TSecr=1047183307
1711549313.859971046   924 1.432540200    10.10.1.2 → 10.10.1.1    TCP 83 39808 → 8081 [PSH, ACK] Seq=1497 Ack=1497 Win=64256 Len=17 TSval=1047183317 TSecr=3171443018
1711549315.859971046   926 1.432574742    10.10.1.1 → 10.10.1.2    TCP 83 8081 → 39808 [PSH, ACK] Seq=1497 Ack=1514 Win=65152 Len=17 TSval=3171443028 TSecr=1047183317
1711549323.859971046   934 1.442737004    10.10.1.2 → 10.10.1.1    TCP 83 39808 → 8081 [PSH, ACK] Seq=1514 Ack=1514 Win=64256 Len=17 TSval=1047183327 TSecr=3171443028
1711549325.859971046   936 1.442771506    10.10.1.1 → 10.10.1.2    TCP 83 8081 → 39808 [PSH, ACK] Seq=1514 Ack=1531 Win=65152 Len=17 TSval=3171443038 TSecr=1047183327
1711549333.859971046   944 1.452934094    10.10.1.2 → 10.10.1.1    TCP 83 39808 → 8081 [PSH, ACK] Seq=1531 Ack=1531 Win=64256 Len=17 TSval=1047183338 TSecr=3171443038
1711549335.859971046   946 1.452968744    10.10.1.1 → 10.10.1.2    TCP 83 8081 → 39808 [PSH, ACK] Seq=1531 Ack=1548 Win=65152 Len=17 TSval=3171443048 TSecr=1047183338
1711549343.859971046   954 1.463131062    10.10.1.2 → 10.10.1.1    TCP 83 39808 → 8081 [PSH, ACK] Seq=1548 Ack=1548 Win=64256 Len=17 TSval=1047183348 TSecr=3171443048
1711549345.859971046   956 1.463167485    10.10.1.1 → 10.10.1.2    TCP 83 8081 → 39808 [PSH, ACK] Seq=1548 Ack=1565 Win=65152 Len=17 TSval=3171443058 TSecr=1047183348
1711549353.859971046   964 1.473328577    10.10.1.2 → 10.10.1.1    TCP 83 39808 → 8081 [PSH, ACK] Seq=1565 Ack=1565 Win=64256 Len=17 TSval=1047183358 TSecr=3171443058
1711549355.859971046   966 1.473362859    10.10.1.1 → 10.10.1.2    TCP 83 8081 → 39808 [PSH, ACK] Seq=1565 Ack=1582 Win=65152 Len=17 TSval=3171443069 TSecr=1047183358
1711549363.859971046   974 1.483523990    10.10.1.2 → 10.10.1.1    TCP 83 39808 → 8081 [PSH, ACK] Seq=1582 Ack=1582 Win=64256 Len=17 TSval=1047183368 TSecr=3171443069
1711549365.859971046   976 1.483558194    10.10.1.1 → 10.10.1.2    TCP 83 8081 → 39808 [PSH, ACK] Seq=1582 Ack=1599 Win=65152 Len=17 TSval=3171443079 TSecr=1047183368
1711549373.859971046   984 1.493720631    10.10.1.2 → 10.10.1.1    TCP 83 39808 → 8081 [PSH, ACK] Seq=1599 Ack=1599 Win=64256 Len=17 TSval=1047183378 TSecr=3171443079
1711549375.859971046   986 1.493756487    10.10.1.1 → 10.10.1.2    TCP 83 8081 → 39808 [PSH, ACK] Seq=1599 Ack=1616 Win=65152 Len=17 TSval=3171443089 TSecr=1047183378
1711549383.859971046   994 1.503919724    10.10.1.2 → 10.10.1.1    TCP 83 39808 → 8081 [PSH, ACK] Seq=1616 Ack=1616 Win=64256 Len=17 TSval=1047183389 TSecr=3171443089
1711549385.859971046   996 1.503954665    10.10.1.1 → 10.10.1.2    TCP 83 8081 → 39808 [PSH, ACK] Seq=1616 Ack=1633 Win=65152 Len=17 TSval=3171443099 TSecr=1047183389
1711549393.859971046  1004 1.514118439    10.10.1.2 → 10.10.1.1    TCP 83 39808 → 8081 [PSH, ACK] Seq=1633 Ack=1633 Win=64256 Len=17 TSval=1047183399 TSecr=3171443099
1711549395.859971046  1006 1.514153023    10.10.1.1 → 10.10.1.2    TCP 83 8081 → 39808 [PSH, ACK] Seq=1633 Ack=1650 Win=65152 Len=17 TSval=3171443109 TSecr=1047183399
1711549403.859971046  1014 1.524317664    10.10.1.2 → 10.10.1.1    TCP 83 39808 → 8081 [PSH, ACK] Seq=1650 Ack=1650 Win=64256 Len=17 TSval=1047183409 TSecr=3171443109
1711549405.859971046  1016 1.524351668    10.10.1.1 → 10.10.1.2    TCP 83 8081 → 39808 [PSH, ACK] Seq=1650 Ack=1667 Win=65152 Len=17 TSval=3171443120 TSecr=1047183409
1711549413.859971046  1024 1.534511482    10.10.1.2 → 10.10.1.1    TCP 83 39808 → 8081 [PSH, ACK] Seq=1667 Ack=1667 Win=64256 Len=17 TSval=1047183419 TSecr=3171443120
1711549415.859971046  1026 1.534546637    10.10.1.1 → 10.10.1.2    TCP 83 8081 → 39808 [PSH, ACK] Seq=1667 Ack=1684 Win=65152 Len=17 TSval=3171443130 TSecr=1047183419
1711549423.859971046  1034 1.544708779    10.10.1.2 → 10.10.1.1    TCP 83 39808 → 8081 [PSH, ACK] Seq=1684 Ack=1684 Win=64256 Len=17 TSval=1047183429 TSecr=3171443130
1711549425.859971046  1036 1.544740728    10.10.1.1 → 10.10.1.2    TCP 83 8081 → 39808 [PSH, ACK] Seq=1684 Ack=1701 Win=65152 Len=17 TSval=3171443140 TSecr=1047183429
1711549433.859971046  1044 1.554877066    10.10.1.2 → 10.10.1.1    TCP 83 39808 → 8081 [PSH, ACK] Seq=1701 Ack=1701 Win=64256 Len=17 TSval=1047183440 TSecr=3171443140
1711549435.859971046  1046 1.554912617    10.10.1.1 → 10.10.1.2    TCP 83 8081 → 39808 [PSH, ACK] Seq=1701 Ack=1718 Win=65152 Len=17 TSval=3171443150 TSecr=1047183440
1711549443.859971046  1054 1.565073063    10.10.1.2 → 10.10.1.1    TCP 83 39808 → 8081 [PSH, ACK] Seq=1718 Ack=1718 Win=64256 Len=17 TSval=1047183450 TSecr=3171443150
1711549445.859971046  1056 1.565107616    10.10.1.1 → 10.10.1.2    TCP 83 8081 → 39808 [PSH, ACK] Seq=1718 Ack=1735 Win=65152 Len=17 TSval=3171443160 TSecr=1047183450
1711549453.859971046  1064 1.575269225    10.10.1.2 → 10.10.1.1    TCP 83 39808 → 8081 [PSH, ACK] Seq=1735 Ack=1735 Win=64256 Len=17 TSval=1047183460 TSecr=3171443160
1711549455.859971046  1066 1.575303390    10.10.1.1 → 10.10.1.2    TCP 83 8081 → 39808 [PSH, ACK] Seq=1735 Ack=1752 Win=65152 Len=17 TSval=3171443171 TSecr=1047183460
1711549463.859971046  1074 1.585465769    10.10.1.2 → 10.10.1.1    TCP 83 39808 → 8081 [PSH, ACK] Seq=1752 Ack=1752 Win=64256 Len=17 TSval=1047183470 TSecr=3171443171
1711549465.859971046  1076 1.585500000    10.10.1.1 → 10.10.1.2    TCP 83 8081 → 39808 [PSH, ACK] Seq=1752 Ack=1769 Win=65152 Len=17 TSval=3171443181 TSecr=1047183470
1711549473.859971046  1084 1.595664229    10.10.1.2 → 10.10.1.1    TCP 83 39808 → 8081 [PSH, ACK] Seq=1769 Ack=1769 Win=64256 Len=17 TSval=1047183480 TSecr=3171443181
1711549475.859971046  1086 1.595699064    10.10.1.1 → 10.10.1.2    TCP 83 8081 → 39808 [PSH, ACK] Seq=1769 Ack=1786 Win=65152 Len=17 TSval=3171443191 TSecr=1047183480
1711549483.859971046  1094 1.605861793    10.10.1.2 → 10.10.1.1    TCP 83 39808 → 8081 [PSH, ACK] Seq=1786 Ack=1786 Win=64256 Len=17 TSval=1047183490 TSecr=3171443191
1711549485.859971046  1096 1.605896331    10.10.1.1 → 10.10.1.2    TCP 83 8081 → 39808 [PSH, ACK] Seq=1786 Ack=1803 Win=65152 Len=17 TSval=3171443201 TSecr=1047183490
1711549493.859971046  1104 1.616058585    10.10.1.2 → 10.10.1.1    TCP 83 39808 → 8081 [PSH, ACK] Seq=1803 Ack=1803 Win=64256 Len=17 TSval=1047183501 TSecr=3171443201
1711549495.859971046  1106 1.616094869    10.10.1.1 → 10.10.1.2    TCP 83 8081 → 39808 [PSH, ACK] Seq=1803 Ack=1820 Win=65152 Len=17 TSval=3171443211 TSecr=1047183501
1711549503.859971046  1114 1.626257601    10.10.1.2 → 10.10.1.1    TCP 83 39808 → 8081 [PSH, ACK] Seq=1820 Ack=1820 Win=64256 Len=17 TSval=1047183511 TSecr=3171443211
1711549506.859971046  1117 1.626305446    10.10.1.1 → 10.10.1.2    TCP 83 8081 → 39808 [PSH, ACK] Seq=1820 Ack=1837 Win=65152 Len=17 TSval=3171443222 TSecr=1047183511
1711549513.859971046  1124 1.636468090    10.10.1.2 → 10.10.1.1    TCP 83 39808 → 8081 [PSH, ACK] Seq=1837 Ack=1837 Win=64256 Len=17 TSval=1047183521 TSecr=3171443222
1711549515.859971046  1126 1.636503014    10.10.1.1 → 10.10.1.2    TCP 83 8081 → 39808 [PSH, ACK] Seq=1837 Ack=1854 Win=65152 Len=17 TSval=3171443232 TSecr=1047183521
1711549523.859971046  1134 1.646664809    10.10.1.2 → 10.10.1.1    TCP 83 39808 → 8081 [PSH, ACK] Seq=1854 Ack=1854 Win=64256 Len=17 TSval=1047183531 TSecr=3171443232
1711549525.859971046  1136 1.646699509    10.10.1.1 → 10.10.1.2    TCP 83 8081 → 39808 [PSH, ACK] Seq=1854 Ack=1871 Win=65152 Len=17 TSval=3171443242 TSecr=1047183531
1711549533.859971046  1144 1.656838019    10.10.1.2 → 10.10.1.1    TCP 83 39808 → 8081 [PSH, ACK] Seq=1871 Ack=1871 Win=64256 Len=17 TSval=1047183541 TSecr=3171443242
1711549535.859971046  1146 1.656872848    10.10.1.1 → 10.10.1.2    TCP 83 8081 → 39808 [PSH, ACK] Seq=1871 Ack=1888 Win=65152 Len=17 TSval=3171443252 TSecr=1047183541
1711549543.859971046  1154 1.667033982    10.10.1.2 → 10.10.1.1    TCP 83 39808 → 8081 [PSH, ACK] Seq=1888 Ack=1888 Win=64256 Len=17 TSval=1047183552 TSecr=3171443252
1711549545.859971046  1156 1.667069007    10.10.1.1 → 10.10.1.2    TCP 83 8081 → 39808 [PSH, ACK] Seq=1888 Ack=1905 Win=65152 Len=17 TSval=3171443262 TSecr=1047183552
1711549553.859971046  1164 1.677231392    10.10.1.2 → 10.10.1.1    TCP 83 39808 → 8081 [PSH, ACK] Seq=1905 Ack=1905 Win=64256 Len=17 TSval=1047183562 TSecr=3171443262
1711549555.859971046  1166 1.677267690    10.10.1.1 → 10.10.1.2    TCP 83 8081 → 39808 [PSH, ACK] Seq=1905 Ack=1922 Win=65152 Len=17 TSval=3171443272 TSecr=1047183562
1711549563.859971046  1174 1.687431037    10.10.1.2 → 10.10.1.1    TCP 83 39808 → 8081 [PSH, ACK] Seq=1922 Ack=1922 Win=64256 Len=17 TSval=1047183572 TSecr=3171443272
1711549566.859971046  1177 1.687495331    10.10.1.1 → 10.10.1.2    TCP 83 8081 → 39808 [PSH, ACK] Seq=1922 Ack=1939 Win=65152 Len=17 TSval=3171443283 TSecr=1047183572
1711549573.859971046  1184 1.697658356    10.10.1.2 → 10.10.1.1    TCP 83 39808 → 8081 [PSH, ACK] Seq=1939 Ack=1939 Win=64256 Len=17 TSval=1047183582 TSecr=3171443283
1711549575.859971046  1186 1.697693731    10.10.1.1 → 10.10.1.2    TCP 83 8081 → 39808 [PSH, ACK] Seq=1939 Ack=1956 Win=65152 Len=17 TSval=3171443293 TSecr=1047183582
1711549583.859971046  1194 1.707855309    10.10.1.2 → 10.10.1.1    TCP 83 39808 → 8081 [PSH, ACK] Seq=1956 Ack=1956 Win=64256 Len=17 TSval=1047183592 TSecr=3171443293
1711549585.859971046  1196 1.707890199    10.10.1.1 → 10.10.1.2    TCP 83 8081 → 39808 [PSH, ACK] Seq=1956 Ack=1973 Win=65152 Len=17 TSval=3171443303 TSecr=1047183592
1711549593.859971046  1204 1.718050574    10.10.1.2 → 10.10.1.1    TCP 83 39808 → 8081 [PSH, ACK] Seq=1973 Ack=1973 Win=64256 Len=17 TSval=1047183603 TSecr=3171443303
1711549595.859971046  1206 1.718085388    10.10.1.1 → 10.10.1.2    TCP 83 8081 → 39808 [PSH, ACK] Seq=1973 Ack=1990 Win=65152 Len=17 TSval=3171443313 TSecr=1047183603
1711549603.859971046  1214 1.728245983    10.10.1.2 → 10.10.1.1    TCP 83 39808 → 8081 [PSH, ACK] Seq=1990 Ack=1990 Win=64256 Len=17 TSval=1047183613 TSecr=3171443313
1711549605.859971046  1216 1.728280875    10.10.1.1 → 10.10.1.2    TCP 83 8081 → 39808 [PSH, ACK] Seq=1990 Ack=2007 Win=65152 Len=17 TSval=3171443323 TSecr=1047183613
1711549613.859971046  1224 1.738441716    10.10.1.2 → 10.10.1.1    TCP 83 39808 → 8081 [PSH, ACK] Seq=2007 Ack=2007 Win=64256 Len=17 TSval=1047183623 TSecr=3171443323
1711549615.859971046  1226 1.738478562    10.10.1.1 → 10.10.1.2    TCP 83 8081 → 39808 [PSH, ACK] Seq=2007 Ack=2024 Win=65152 Len=17 TSval=3171443334 TSecr=1047183623
1711549623.859971046  1234 1.748639527    10.10.1.2 → 10.10.1.1    TCP 83 39808 → 8081 [PSH, ACK] Seq=2024 Ack=2024 Win=64256 Len=17 TSval=1047183633 TSecr=3171443334
1711549625.859971046  1236 1.748675628    10.10.1.1 → 10.10.1.2    TCP 83 8081 → 39808 [PSH, ACK] Seq=2024 Ack=2041 Win=65152 Len=17 TSval=3171443344 TSecr=1047183633
1711549633.859971046  1244 1.758837185    10.10.1.2 → 10.10.1.1    TCP 83 39808 → 8081 [PSH, ACK] Seq=2041 Ack=2041 Win=64256 Len=17 TSval=1047183643 TSecr=3171443344
