1712183519.403017282    23 0.276727658    10.10.1.2 → 10.10.1.1    TCP 74 47078 → 8081 [SYN] Seq=0 Win=64240 Len=0 MSS=1460 SACK_PERM=1 TSval=1682288705 TSecr=0 WS=128
1712183520.403017282    24 0.276764999    10.10.1.1 → 10.10.1.2    TCP 74 8081 → 47078 [SYN, ACK] Seq=0 Ack=1 Win=65160 Len=0 MSS=1460 SACK_PERM=1 TSval=3806548415 TSecr=1682288705 WS=128
1712183521.403017282    25 0.276840389    10.10.1.2 → 10.10.1.1    TCP 66 47078 → 8081 [ACK] Seq=1 Ack=1 Win=64256 Len=0 TSval=1682288705 TSecr=3806548415
1712183524.403017282    28 0.535968644    10.10.1.2 → 10.10.1.1    TCP 83 47078 → 8081 [PSH, ACK] Seq=1 Ack=1 Win=64256 Len=17 TSval=1682288965 TSecr=3806548415
1712183526.403017282    30 0.535997467    10.10.1.1 → 10.10.1.2    TCP 66 8081 → 47078 [ACK] Seq=1 Ack=18 Win=65152 Len=0 TSval=3806548674 TSecr=1682288965
1712183528.403017282    32 0.536294857    10.10.1.1 → 10.10.1.2    TCP 83 8081 → 47078 [PSH, ACK] Seq=1 Ack=18 Win=65152 Len=17 TSval=3806548674 TSecr=1682288965
1712183530.403017282    34 0.536380751    10.10.1.2 → 10.10.1.1    TCP 66 47078 → 8081 [ACK] Seq=18 Ack=18 Win=64256 Len=0 TSval=1682288965 TSecr=3806548674
1712183533.403017282    37 0.546516615    10.10.1.2 → 10.10.1.1    TCP 83 47078 → 8081 [PSH, ACK] Seq=18 Ack=18 Win=64256 Len=17 TSval=1682288975 TSecr=3806548674
1712183535.403017282    39 0.546646836    10.10.1.1 → 10.10.1.2    TCP 83 8081 → 47078 [PSH, ACK] Seq=18 Ack=35 Win=65152 Len=17 TSval=3806548684 TSecr=1682288975
1712183539.403017282    43 0.556860984    10.10.1.2 → 10.10.1.1    TCP 83 47078 → 8081 [PSH, ACK] Seq=35 Ack=35 Win=64256 Len=17 TSval=1682288985 TSecr=3806548684
1712183541.403017282    45 0.556995434    10.10.1.1 → 10.10.1.2    TCP 83 8081 → 47078 [PSH, ACK] Seq=35 Ack=52 Win=65152 Len=17 TSval=3806548695 TSecr=1682288985
1712183546.403017282    50 0.567210133    10.10.1.2 → 10.10.1.1    TCP 83 47078 → 8081 [PSH, ACK] Seq=52 Ack=52 Win=64256 Len=17 TSval=1682288996 TSecr=3806548695
1712183548.403017282    52 0.567345387    10.10.1.1 → 10.10.1.2    TCP 83 8081 → 47078 [PSH, ACK] Seq=52 Ack=69 Win=65152 Len=17 TSval=3806548705 TSecr=1682288996
1712183552.403017282    56 0.577557300    10.10.1.2 → 10.10.1.1    TCP 83 47078 → 8081 [PSH, ACK] Seq=69 Ack=69 Win=64256 Len=17 TSval=1682289006 TSecr=3806548705
1712183554.403017282    58 0.577693521    10.10.1.1 → 10.10.1.2    TCP 83 8081 → 47078 [PSH, ACK] Seq=69 Ack=86 Win=65152 Len=17 TSval=3806548715 TSecr=1682289006
1712183559.403017282    63 0.587905863    10.10.1.2 → 10.10.1.1    TCP 83 47078 → 8081 [PSH, ACK] Seq=86 Ack=86 Win=64256 Len=17 TSval=1682289017 TSecr=3806548715
1712183561.403017282    65 0.588041922    10.10.1.1 → 10.10.1.2    TCP 83 8081 → 47078 [PSH, ACK] Seq=86 Ack=103 Win=65152 Len=17 TSval=3806548726 TSecr=1682289017
1712183565.403017282    69 0.598258053    10.10.1.2 → 10.10.1.1    TCP 83 47078 → 8081 [PSH, ACK] Seq=103 Ack=103 Win=64256 Len=17 TSval=1682289027 TSecr=3806548726
1712183568.403017282    72 0.598393425    10.10.1.1 → 10.10.1.2    TCP 83 8081 → 47078 [PSH, ACK] Seq=103 Ack=120 Win=65152 Len=17 TSval=3806548736 TSecr=1682289027
1712183572.403017282    76 0.608605628    10.10.1.2 → 10.10.1.1    TCP 83 47078 → 8081 [PSH, ACK] Seq=120 Ack=120 Win=64256 Len=17 TSval=1682289037 TSecr=3806548736
1712183574.403017282    78 0.608740038    10.10.1.1 → 10.10.1.2    TCP 83 8081 → 47078 [PSH, ACK] Seq=120 Ack=137 Win=65152 Len=17 TSval=3806548746 TSecr=1682289037
1712183578.403017282    82 0.618909506    10.10.1.2 → 10.10.1.1    TCP 83 47078 → 8081 [PSH, ACK] Seq=137 Ack=137 Win=64256 Len=17 TSval=1682289048 TSecr=3806548746
1712183580.403017282    84 0.619044935    10.10.1.1 → 10.10.1.2    TCP 83 8081 → 47078 [PSH, ACK] Seq=137 Ack=154 Win=65152 Len=17 TSval=3806548757 TSecr=1682289048
1712183586.403017282    90 0.629260060    10.10.1.2 → 10.10.1.1    TCP 83 47078 → 8081 [PSH, ACK] Seq=154 Ack=154 Win=64256 Len=17 TSval=1682289058 TSecr=3806548757
1712183588.403017282    92 0.629395962    10.10.1.1 → 10.10.1.2    TCP 83 8081 → 47078 [PSH, ACK] Seq=154 Ack=171 Win=65152 Len=17 TSval=3806548767 TSecr=1682289058
1712183592.403017282    96 0.639605401    10.10.1.2 → 10.10.1.1    TCP 83 47078 → 8081 [PSH, ACK] Seq=171 Ack=171 Win=64256 Len=17 TSval=1682289068 TSecr=3806548767
1712183594.403017282    98 0.639741483    10.10.1.1 → 10.10.1.2    TCP 83 8081 → 47078 [PSH, ACK] Seq=171 Ack=188 Win=65152 Len=17 TSval=3806548777 TSecr=1682289068
1712183599.403017282   103 0.649971460    10.10.1.2 → 10.10.1.1    TCP 83 47078 → 8081 [PSH, ACK] Seq=188 Ack=188 Win=64256 Len=17 TSval=1682289079 TSecr=3806548777
1712183601.403017282   105 0.650107209    10.10.1.1 → 10.10.1.2    TCP 83 8081 → 47078 [PSH, ACK] Seq=188 Ack=205 Win=65152 Len=17 TSval=3806548788 TSecr=1682289079
1712183605.403017282   109 0.660319713    10.10.1.2 → 10.10.1.1    TCP 83 47078 → 8081 [PSH, ACK] Seq=205 Ack=205 Win=64256 Len=17 TSval=1682289089 TSecr=3806548788
1712183608.403017282   112 0.660455847    10.10.1.1 → 10.10.1.2    TCP 83 8081 → 47078 [PSH, ACK] Seq=205 Ack=222 Win=65152 Len=17 TSval=3806548798 TSecr=1682289089
1712183612.403017282   116 0.670667126    10.10.1.2 → 10.10.1.1    TCP 83 47078 → 8081 [PSH, ACK] Seq=222 Ack=222 Win=64256 Len=17 TSval=1682289099 TSecr=3806548798
1712183614.403017282   118 0.670802260    10.10.1.1 → 10.10.1.2    TCP 83 8081 → 47078 [PSH, ACK] Seq=222 Ack=239 Win=65152 Len=17 TSval=3806548809 TSecr=1682289099
1712183618.403017282   122 0.681020477    10.10.1.2 → 10.10.1.1    TCP 83 47078 → 8081 [PSH, ACK] Seq=239 Ack=239 Win=64256 Len=17 TSval=1682289110 TSecr=3806548809
1712183620.403017282   124 0.681154799    10.10.1.1 → 10.10.1.2    TCP 83 8081 → 47078 [PSH, ACK] Seq=239 Ack=256 Win=65152 Len=17 TSval=3806548819 TSecr=1682289110
1712183625.403017282   129 0.691369743    10.10.1.2 → 10.10.1.1    TCP 83 47078 → 8081 [PSH, ACK] Seq=256 Ack=256 Win=64256 Len=17 TSval=1682289120 TSecr=3806548819
1712183627.403017282   131 0.691506003    10.10.1.1 → 10.10.1.2    TCP 83 8081 → 47078 [PSH, ACK] Seq=256 Ack=273 Win=65152 Len=17 TSval=3806548829 TSecr=1682289120
1712183632.403017282   136 0.701785941    10.10.1.2 → 10.10.1.1    TCP 83 47078 → 8081 [PSH, ACK] Seq=273 Ack=273 Win=64256 Len=17 TSval=1682289130 TSecr=3806548829
1712183634.403017282   138 0.701921414    10.10.1.1 → 10.10.1.2    TCP 83 8081 → 47078 [PSH, ACK] Seq=273 Ack=290 Win=65152 Len=17 TSval=3806548840 TSecr=1682289130
1712183638.403017282   142 0.712132038    10.10.1.2 → 10.10.1.1    TCP 83 47078 → 8081 [PSH, ACK] Seq=290 Ack=290 Win=64256 Len=17 TSval=1682289141 TSecr=3806548840
1712183640.403017282   144 0.712268760    10.10.1.1 → 10.10.1.2    TCP 83 8081 → 47078 [PSH, ACK] Seq=290 Ack=307 Win=65152 Len=17 TSval=3806548850 TSecr=1682289141
1712183644.403017282   148 0.722478797    10.10.1.2 → 10.10.1.1    TCP 83 47078 → 8081 [PSH, ACK] Seq=307 Ack=307 Win=64256 Len=17 TSval=1682289151 TSecr=3806548850
1712183646.403017282   150 0.722564960    10.10.1.1 → 10.10.1.2    TCP 83 8081 → 47078 [PSH, ACK] Seq=307 Ack=324 Win=65152 Len=17 TSval=3806548860 TSecr=1682289151
1712183651.403017282   155 0.732773746    10.10.1.2 → 10.10.1.1    TCP 83 47078 → 8081 [PSH, ACK] Seq=324 Ack=324 Win=64256 Len=17 TSval=1682289161 TSecr=3806548860
1712183653.403017282   157 0.732858337    10.10.1.1 → 10.10.1.2    TCP 83 8081 → 47078 [PSH, ACK] Seq=324 Ack=341 Win=65152 Len=17 TSval=3806548871 TSecr=1682289161
1712183657.403017282   161 0.743069943    10.10.1.2 → 10.10.1.1    TCP 83 47078 → 8081 [PSH, ACK] Seq=341 Ack=341 Win=64256 Len=17 TSval=1682289172 TSecr=3806548871
1712183659.403017282   163 0.743155435    10.10.1.1 → 10.10.1.2    TCP 83 8081 → 47078 [PSH, ACK] Seq=341 Ack=358 Win=65152 Len=17 TSval=3806548881 TSecr=1682289172
1712183664.403017282   168 0.753366614    10.10.1.2 → 10.10.1.1    TCP 83 47078 → 8081 [PSH, ACK] Seq=358 Ack=358 Win=64256 Len=17 TSval=1682289182 TSecr=3806548881
1712183666.403017282   170 0.753451836    10.10.1.1 → 10.10.1.2    TCP 83 8081 → 47078 [PSH, ACK] Seq=358 Ack=375 Win=65152 Len=17 TSval=3806548891 TSecr=1682289182
1712183670.403017282   174 0.763660323    10.10.1.2 → 10.10.1.1    TCP 83 47078 → 8081 [PSH, ACK] Seq=375 Ack=375 Win=64256 Len=17 TSval=1682289192 TSecr=3806548891
1712183672.403017282   176 0.763745185    10.10.1.1 → 10.10.1.2    TCP 83 8081 → 47078 [PSH, ACK] Seq=375 Ack=392 Win=65152 Len=17 TSval=3806548901 TSecr=1682289192
1712183677.403017282   181 0.773967468    10.10.1.2 → 10.10.1.1    TCP 83 47078 → 8081 [PSH, ACK] Seq=392 Ack=392 Win=64256 Len=17 TSval=1682289203 TSecr=3806548901
1712183679.403017282   183 0.774052841    10.10.1.1 → 10.10.1.2    TCP 83 8081 → 47078 [PSH, ACK] Seq=392 Ack=409 Win=65152 Len=17 TSval=3806548912 TSecr=1682289203
1712183683.403017282   187 0.784263283    10.10.1.2 → 10.10.1.1    TCP 83 47078 → 8081 [PSH, ACK] Seq=409 Ack=409 Win=64256 Len=17 TSval=1682289213 TSecr=3806548912
1712183685.403017282   189 0.784348048    10.10.1.1 → 10.10.1.2    TCP 83 8081 → 47078 [PSH, ACK] Seq=409 Ack=426 Win=65152 Len=17 TSval=3806548922 TSecr=1682289213
1712183690.403017282   194 0.794559390    10.10.1.2 → 10.10.1.1    TCP 83 47078 → 8081 [PSH, ACK] Seq=426 Ack=426 Win=64256 Len=17 TSval=1682289223 TSecr=3806548922
1712183692.403017282   196 0.794644672    10.10.1.1 → 10.10.1.2    TCP 83 8081 → 47078 [PSH, ACK] Seq=426 Ack=443 Win=65152 Len=17 TSval=3806548932 TSecr=1682289223
1712183696.403017282   200 0.804855158    10.10.1.2 → 10.10.1.1    TCP 83 47078 → 8081 [PSH, ACK] Seq=443 Ack=443 Win=64256 Len=17 TSval=1682289233 TSecr=3806548932
1712183698.403017282   202 0.804940185    10.10.1.1 → 10.10.1.2    TCP 83 8081 → 47078 [PSH, ACK] Seq=443 Ack=460 Win=65152 Len=17 TSval=3806548943 TSecr=1682289233
1712183703.403017282   207 0.815148246    10.10.1.2 → 10.10.1.1    TCP 83 47078 → 8081 [PSH, ACK] Seq=460 Ack=460 Win=64256 Len=17 TSval=1682289244 TSecr=3806548943
1712183705.403017282   209 0.815233447    10.10.1.1 → 10.10.1.2    TCP 83 8081 → 47078 [PSH, ACK] Seq=460 Ack=477 Win=65152 Len=17 TSval=3806548953 TSecr=1682289244
1712183709.403017282   213 0.825444016    10.10.1.2 → 10.10.1.1    TCP 83 47078 → 8081 [PSH, ACK] Seq=477 Ack=477 Win=64256 Len=17 TSval=1682289254 TSecr=3806548953
1712183711.403017282   215 0.825528951    10.10.1.1 → 10.10.1.2    TCP 83 8081 → 47078 [PSH, ACK] Seq=477 Ack=494 Win=65152 Len=17 TSval=3806548963 TSecr=1682289254
1712183716.403017282   220 0.835742978    10.10.1.2 → 10.10.1.1    TCP 83 47078 → 8081 [PSH, ACK] Seq=494 Ack=494 Win=64256 Len=17 TSval=1682289264 TSecr=3806548963
1712183718.403017282   222 0.835828803    10.10.1.1 → 10.10.1.2    TCP 83 8081 → 47078 [PSH, ACK] Seq=494 Ack=511 Win=65152 Len=17 TSval=3806548974 TSecr=1682289264
1712183722.403017282   226 0.846039034    10.10.1.2 → 10.10.1.1    TCP 83 47078 → 8081 [PSH, ACK] Seq=511 Ack=511 Win=64256 Len=17 TSval=1682289275 TSecr=3806548974
1712183724.403017282   228 0.846124236    10.10.1.1 → 10.10.1.2    TCP 83 8081 → 47078 [PSH, ACK] Seq=511 Ack=528 Win=65152 Len=17 TSval=3806548984 TSecr=1682289275
1712183729.403017282   233 0.856333988    10.10.1.2 → 10.10.1.1    TCP 83 47078 → 8081 [PSH, ACK] Seq=528 Ack=528 Win=64256 Len=17 TSval=1682289285 TSecr=3806548984
1712183731.403017282   235 0.856418762    10.10.1.1 → 10.10.1.2    TCP 83 8081 → 47078 [PSH, ACK] Seq=528 Ack=545 Win=65152 Len=17 TSval=3806548994 TSecr=1682289285
1712183735.403017282   239 0.866629106    10.10.1.2 → 10.10.1.1    TCP 83 47078 → 8081 [PSH, ACK] Seq=545 Ack=545 Win=64256 Len=17 TSval=1682289295 TSecr=3806548994
1712183737.403017282   241 0.866714947    10.10.1.1 → 10.10.1.2    TCP 83 8081 → 47078 [PSH, ACK] Seq=545 Ack=562 Win=65152 Len=17 TSval=3806549004 TSecr=1682289295
1712183742.403017282   246 0.876918158    10.10.1.2 → 10.10.1.1    TCP 83 47078 → 8081 [PSH, ACK] Seq=562 Ack=562 Win=64256 Len=17 TSval=1682289306 TSecr=3806549004
1712183744.403017282   248 0.877002731    10.10.1.1 → 10.10.1.2    TCP 83 8081 → 47078 [PSH, ACK] Seq=562 Ack=579 Win=65152 Len=17 TSval=3806549015 TSecr=1682289306
1712183748.403017282   252 0.887211052    10.10.1.2 → 10.10.1.1    TCP 83 47078 → 8081 [PSH, ACK] Seq=579 Ack=579 Win=64256 Len=17 TSval=1682289316 TSecr=3806549015
1712183750.403017282   254 0.887294673    10.10.1.1 → 10.10.1.2    TCP 83 8081 → 47078 [PSH, ACK] Seq=579 Ack=596 Win=65152 Len=17 TSval=3806549025 TSecr=1682289316
1712183755.403017282   259 0.897504779    10.10.1.2 → 10.10.1.1    TCP 83 47078 → 8081 [PSH, ACK] Seq=596 Ack=596 Win=64256 Len=17 TSval=1682289326 TSecr=3806549025
1712183757.403017282   261 0.897588722    10.10.1.1 → 10.10.1.2    TCP 83 8081 → 47078 [PSH, ACK] Seq=596 Ack=613 Win=65152 Len=17 TSval=3806549035 TSecr=1682289326
1712183761.403017282   265 0.907799779    10.10.1.2 → 10.10.1.1    TCP 83 47078 → 8081 [PSH, ACK] Seq=613 Ack=613 Win=64256 Len=17 TSval=1682289336 TSecr=3806549035
1712183763.403017282   267 0.907884608    10.10.1.1 → 10.10.1.2    TCP 83 8081 → 47078 [PSH, ACK] Seq=613 Ack=630 Win=65152 Len=17 TSval=3806549046 TSecr=1682289336
1712183768.403017282   272 0.918093919    10.10.1.2 → 10.10.1.1    TCP 83 47078 → 8081 [PSH, ACK] Seq=630 Ack=630 Win=64256 Len=17 TSval=1682289347 TSecr=3806549046
1712183770.403017282   274 0.918179051    10.10.1.1 → 10.10.1.2    TCP 83 8081 → 47078 [PSH, ACK] Seq=630 Ack=647 Win=65152 Len=17 TSval=3806549056 TSecr=1682289347
1712183774.403017282   278 0.928389452    10.10.1.2 → 10.10.1.1    TCP 83 47078 → 8081 [PSH, ACK] Seq=647 Ack=647 Win=64256 Len=17 TSval=1682289357 TSecr=3806549056
1712183776.403017282   280 0.928474194    10.10.1.1 → 10.10.1.2    TCP 83 8081 → 47078 [PSH, ACK] Seq=647 Ack=664 Win=65152 Len=17 TSval=3806549066 TSecr=1682289357
1712183781.403017282   285 0.938686873    10.10.1.2 → 10.10.1.1    TCP 83 47078 → 8081 [PSH, ACK] Seq=664 Ack=664 Win=64256 Len=17 TSval=1682289367 TSecr=3806549066
1712183783.403017282   287 0.938772663    10.10.1.1 → 10.10.1.2    TCP 83 8081 → 47078 [PSH, ACK] Seq=664 Ack=681 Win=65152 Len=17 TSval=3806549077 TSecr=1682289367
1712183787.403017282   291 0.948990315    10.10.1.2 → 10.10.1.1    TCP 83 47078 → 8081 [PSH, ACK] Seq=681 Ack=681 Win=64256 Len=17 TSval=1682289378 TSecr=3806549077
1712183789.403017282   293 0.949075500    10.10.1.1 → 10.10.1.2    TCP 83 8081 → 47078 [PSH, ACK] Seq=681 Ack=698 Win=65152 Len=17 TSval=3806549087 TSecr=1682289378
1712183794.403017282   298 0.959286678    10.10.1.2 → 10.10.1.1    TCP 83 47078 → 8081 [PSH, ACK] Seq=698 Ack=698 Win=64256 Len=17 TSval=1682289388 TSecr=3806549087
1712183796.403017282   300 0.959371609    10.10.1.1 → 10.10.1.2    TCP 83 8081 → 47078 [PSH, ACK] Seq=698 Ack=715 Win=65152 Len=17 TSval=3806549097 TSecr=1682289388
1712183800.403017282   304 0.969582584    10.10.1.2 → 10.10.1.1    TCP 83 47078 → 8081 [PSH, ACK] Seq=715 Ack=715 Win=64256 Len=17 TSval=1682289398 TSecr=3806549097
1712183802.403017282   306 0.969667653    10.10.1.1 → 10.10.1.2    TCP 83 8081 → 47078 [PSH, ACK] Seq=715 Ack=732 Win=65152 Len=17 TSval=3806549107 TSecr=1682289398
1712183807.403017282   311 0.979874785    10.10.1.2 → 10.10.1.1    TCP 83 47078 → 8081 [PSH, ACK] Seq=732 Ack=732 Win=64256 Len=17 TSval=1682289408 TSecr=3806549107
1712183809.403017282   313 0.979960086    10.10.1.1 → 10.10.1.2    TCP 83 8081 → 47078 [PSH, ACK] Seq=732 Ack=749 Win=65152 Len=17 TSval=3806549118 TSecr=1682289408
1712183813.403017282   317 0.990123873    10.10.1.2 → 10.10.1.1    TCP 83 47078 → 8081 [PSH, ACK] Seq=749 Ack=749 Win=64256 Len=17 TSval=1682289419 TSecr=3806549118
1712183815.403017282   319 0.990196817    10.10.1.1 → 10.10.1.2    TCP 83 8081 → 47078 [PSH, ACK] Seq=749 Ack=766 Win=65152 Len=17 TSval=3806549128 TSecr=1682289419
1712183819.403017282   323 1.000405536    10.10.1.2 → 10.10.1.1    TCP 83 47078 → 8081 [PSH, ACK] Seq=766 Ack=766 Win=64256 Len=17 TSval=1682289429 TSecr=3806549128
1712183821.403017282   325 1.000486215    10.10.1.1 → 10.10.1.2    TCP 83 8081 → 47078 [PSH, ACK] Seq=766 Ack=783 Win=65152 Len=17 TSval=3806549138 TSecr=1682289429
1712183826.403017282   330 1.010694739    10.10.1.2 → 10.10.1.1    TCP 83 47078 → 8081 [PSH, ACK] Seq=783 Ack=783 Win=64256 Len=17 TSval=1682289439 TSecr=3806549138
1712183828.403017282   332 1.010778794    10.10.1.1 → 10.10.1.2    TCP 83 8081 → 47078 [PSH, ACK] Seq=783 Ack=800 Win=65152 Len=17 TSval=3806549149 TSecr=1682289439
1712183832.403017282   336 1.020991813    10.10.1.2 → 10.10.1.1    TCP 83 47078 → 8081 [PSH, ACK] Seq=800 Ack=800 Win=64256 Len=17 TSval=1682289450 TSecr=3806549149
1712183834.403017282   338 1.021076642    10.10.1.1 → 10.10.1.2    TCP 83 8081 → 47078 [PSH, ACK] Seq=800 Ack=817 Win=65152 Len=17 TSval=3806549159 TSecr=1682289450
1712183839.403017282   343 1.031284950    10.10.1.2 → 10.10.1.1    TCP 83 47078 → 8081 [PSH, ACK] Seq=817 Ack=817 Win=64256 Len=17 TSval=1682289460 TSecr=3806549159
1712183841.403017282   345 1.031369914    10.10.1.1 → 10.10.1.2    TCP 83 8081 → 47078 [PSH, ACK] Seq=817 Ack=834 Win=65152 Len=17 TSval=3806549169 TSecr=1682289460
1712183845.403017282   349 1.041579137    10.10.1.2 → 10.10.1.1    TCP 83 47078 → 8081 [PSH, ACK] Seq=834 Ack=834 Win=64256 Len=17 TSval=1682289470 TSecr=3806549169
1712183847.403017282   351 1.041663533    10.10.1.1 → 10.10.1.2    TCP 83 8081 → 47078 [PSH, ACK] Seq=834 Ack=851 Win=65152 Len=17 TSval=3806549179 TSecr=1682289470
1712183852.403017282   356 1.051872146    10.10.1.2 → 10.10.1.1    TCP 83 47078 → 8081 [PSH, ACK] Seq=851 Ack=851 Win=64256 Len=17 TSval=1682289480 TSecr=3806549179
1712183854.403017282   358 1.051956746    10.10.1.1 → 10.10.1.2    TCP 83 8081 → 47078 [PSH, ACK] Seq=851 Ack=868 Win=65152 Len=17 TSval=3806549190 TSecr=1682289480
1712183858.403017282   362 1.062165587    10.10.1.2 → 10.10.1.1    TCP 83 47078 → 8081 [PSH, ACK] Seq=868 Ack=868 Win=64256 Len=17 TSval=1682289491 TSecr=3806549190
1712183860.403017282   364 1.062250966    10.10.1.1 → 10.10.1.2    TCP 83 8081 → 47078 [PSH, ACK] Seq=868 Ack=885 Win=65152 Len=17 TSval=3806549200 TSecr=1682289491
1712183865.403017282   369 1.072463332    10.10.1.2 → 10.10.1.1    TCP 83 47078 → 8081 [PSH, ACK] Seq=885 Ack=885 Win=64256 Len=17 TSval=1682289501 TSecr=3806549200
1712183867.403017282   371 1.072548532    10.10.1.1 → 10.10.1.2    TCP 83 8081 → 47078 [PSH, ACK] Seq=885 Ack=902 Win=65152 Len=17 TSval=3806549210 TSecr=1682289501
1712183871.403017282   375 1.082756911    10.10.1.2 → 10.10.1.1    TCP 83 47078 → 8081 [PSH, ACK] Seq=902 Ack=902 Win=64256 Len=17 TSval=1682289511 TSecr=3806549210
1712183873.403017282   377 1.082842049    10.10.1.1 → 10.10.1.2    TCP 83 8081 → 47078 [PSH, ACK] Seq=902 Ack=919 Win=65152 Len=17 TSval=3806549221 TSecr=1682289511
1712183878.403017282   382 1.093052794    10.10.1.2 → 10.10.1.1    TCP 83 47078 → 8081 [PSH, ACK] Seq=919 Ack=919 Win=64256 Len=17 TSval=1682289522 TSecr=3806549221
1712183880.403017282   384 1.093138058    10.10.1.1 → 10.10.1.2    TCP 83 8081 → 47078 [PSH, ACK] Seq=919 Ack=936 Win=65152 Len=17 TSval=3806549231 TSecr=1682289522
1712183884.403017282   388 1.103346055    10.10.1.2 → 10.10.1.1    TCP 83 47078 → 8081 [PSH, ACK] Seq=936 Ack=936 Win=64256 Len=17 TSval=1682289532 TSecr=3806549231
1712183886.403017282   390 1.103431782    10.10.1.1 → 10.10.1.2    TCP 83 8081 → 47078 [PSH, ACK] Seq=936 Ack=953 Win=65152 Len=17 TSval=3806549241 TSecr=1682289532
1712183891.403017282   395 1.113640433    10.10.1.2 → 10.10.1.1    TCP 83 47078 → 8081 [PSH, ACK] Seq=953 Ack=953 Win=64256 Len=17 TSval=1682289542 TSecr=3806549241
1712183893.403017282   397 1.113787302    10.10.1.1 → 10.10.1.2    TCP 83 8081 → 47078 [PSH, ACK] Seq=953 Ack=970 Win=65152 Len=17 TSval=3806549252 TSecr=1682289542
1712183897.403017282   401 1.123998734    10.10.1.2 → 10.10.1.1    TCP 83 47078 → 8081 [PSH, ACK] Seq=970 Ack=970 Win=64256 Len=17 TSval=1682289553 TSecr=3806549252
1712183899.403017282   403 1.124084909    10.10.1.1 → 10.10.1.2    TCP 83 8081 → 47078 [PSH, ACK] Seq=970 Ack=987 Win=65152 Len=17 TSval=3806549262 TSecr=1682289553
1712183904.403017282   408 1.134296207    10.10.1.2 → 10.10.1.1    TCP 83 47078 → 8081 [PSH, ACK] Seq=987 Ack=987 Win=64256 Len=17 TSval=1682289563 TSecr=3806549262
1712183906.403017282   410 1.134380923    10.10.1.1 → 10.10.1.2    TCP 83 8081 → 47078 [PSH, ACK] Seq=987 Ack=1004 Win=65152 Len=17 TSval=3806549272 TSecr=1682289563
1712183910.403017282   414 1.144591707    10.10.1.2 → 10.10.1.1    TCP 83 47078 → 8081 [PSH, ACK] Seq=1004 Ack=1004 Win=64256 Len=17 TSval=1682289573 TSecr=3806549272
1712183912.403017282   416 1.144676695    10.10.1.1 → 10.10.1.2    TCP 83 8081 → 47078 [PSH, ACK] Seq=1004 Ack=1021 Win=65152 Len=17 TSval=3806549282 TSecr=1682289573
1712183917.403017282   421 1.154889112    10.10.1.2 → 10.10.1.1    TCP 83 47078 → 8081 [PSH, ACK] Seq=1021 Ack=1021 Win=64256 Len=17 TSval=1682289583 TSecr=3806549282
1712183919.403017282   423 1.154973968    10.10.1.1 → 10.10.1.2    TCP 83 8081 → 47078 [PSH, ACK] Seq=1021 Ack=1038 Win=65152 Len=17 TSval=3806549293 TSecr=1682289583
1712183923.403017282   427 1.165185890    10.10.1.2 → 10.10.1.1    TCP 83 47078 → 8081 [PSH, ACK] Seq=1038 Ack=1038 Win=64256 Len=17 TSval=1682289594 TSecr=3806549293
1712183925.403017282   429 1.165271041    10.10.1.1 → 10.10.1.2    TCP 83 8081 → 47078 [PSH, ACK] Seq=1038 Ack=1055 Win=65152 Len=17 TSval=3806549303 TSecr=1682289594
1712183930.403017282   434 1.175482353    10.10.1.2 → 10.10.1.1    TCP 83 47078 → 8081 [PSH, ACK] Seq=1055 Ack=1055 Win=64256 Len=17 TSval=1682289604 TSecr=3806549303
1712183932.403017282   436 1.175568007    10.10.1.1 → 10.10.1.2    TCP 83 8081 → 47078 [PSH, ACK] Seq=1055 Ack=1072 Win=65152 Len=17 TSval=3806549313 TSecr=1682289604
1712183936.403017282   440 1.185775970    10.10.1.2 → 10.10.1.1    TCP 83 47078 → 8081 [PSH, ACK] Seq=1072 Ack=1072 Win=64256 Len=17 TSval=1682289614 TSecr=3806549313
1712183938.403017282   442 1.185860836    10.10.1.1 → 10.10.1.2    TCP 83 8081 → 47078 [PSH, ACK] Seq=1072 Ack=1089 Win=65152 Len=17 TSval=3806549324 TSecr=1682289614
1712183943.403017282   447 1.196069499    10.10.1.2 → 10.10.1.1    TCP 83 47078 → 8081 [PSH, ACK] Seq=1089 Ack=1089 Win=64256 Len=17 TSval=1682289625 TSecr=3806549324
1712183945.403017282   449 1.196154199    10.10.1.1 → 10.10.1.2    TCP 83 8081 → 47078 [PSH, ACK] Seq=1089 Ack=1106 Win=65152 Len=17 TSval=3806549334 TSecr=1682289625
1712183949.403017282   453 1.206365018    10.10.1.2 → 10.10.1.1    TCP 83 47078 → 8081 [PSH, ACK] Seq=1106 Ack=1106 Win=64256 Len=17 TSval=1682289635 TSecr=3806549334
1712183951.403017282   455 1.206449457    10.10.1.1 → 10.10.1.2    TCP 83 8081 → 47078 [PSH, ACK] Seq=1106 Ack=1123 Win=65152 Len=17 TSval=3806549344 TSecr=1682289635
1712183956.403017282   460 1.216660545    10.10.1.2 → 10.10.1.1    TCP 83 47078 → 8081 [PSH, ACK] Seq=1123 Ack=1123 Win=64256 Len=17 TSval=1682289645 TSecr=3806549344
1712183958.403017282   462 1.216745459    10.10.1.1 → 10.10.1.2    TCP 83 8081 → 47078 [PSH, ACK] Seq=1123 Ack=1140 Win=65152 Len=17 TSval=3806549354 TSecr=1682289645
1712183962.403017282   466 1.226908638    10.10.1.2 → 10.10.1.1    TCP 83 47078 → 8081 [PSH, ACK] Seq=1140 Ack=1140 Win=64256 Len=17 TSval=1682289656 TSecr=3806549354
1712183964.403017282   468 1.226993978    10.10.1.1 → 10.10.1.2    TCP 83 8081 → 47078 [PSH, ACK] Seq=1140 Ack=1157 Win=65152 Len=17 TSval=3806549365 TSecr=1682289656
1712183969.403017282   473 1.237203649    10.10.1.2 → 10.10.1.1    TCP 83 47078 → 8081 [PSH, ACK] Seq=1157 Ack=1157 Win=64256 Len=17 TSval=1682289666 TSecr=3806549365
1712183971.403017282   475 1.237288906    10.10.1.1 → 10.10.1.2    TCP 83 8081 → 47078 [PSH, ACK] Seq=1157 Ack=1174 Win=65152 Len=17 TSval=3806549375 TSecr=1682289666
1712183975.403017282   479 1.247498860    10.10.1.2 → 10.10.1.1    TCP 83 47078 → 8081 [PSH, ACK] Seq=1174 Ack=1174 Win=64256 Len=17 TSval=1682289676 TSecr=3806549375
1712183977.403017282   481 1.247583465    10.10.1.1 → 10.10.1.2    TCP 83 8081 → 47078 [PSH, ACK] Seq=1174 Ack=1191 Win=65152 Len=17 TSval=3806549385 TSecr=1682289676
1712183982.403017282   486 1.257797513    10.10.1.2 → 10.10.1.1    TCP 83 47078 → 8081 [PSH, ACK] Seq=1191 Ack=1191 Win=64256 Len=17 TSval=1682289686 TSecr=3806549385
1712183984.403017282   488 1.257883122    10.10.1.1 → 10.10.1.2    TCP 83 8081 → 47078 [PSH, ACK] Seq=1191 Ack=1208 Win=65152 Len=17 TSval=3806549396 TSecr=1682289686
1712183988.403017282   492 1.268097603    10.10.1.2 → 10.10.1.1    TCP 83 47078 → 8081 [PSH, ACK] Seq=1208 Ack=1208 Win=64256 Len=17 TSval=1682289697 TSecr=3806549396
1712183990.403017282   494 1.268182311    10.10.1.1 → 10.10.1.2    TCP 83 8081 → 47078 [PSH, ACK] Seq=1208 Ack=1225 Win=65152 Len=17 TSval=3806549406 TSecr=1682289697
1712183995.403017282   499 1.278393357    10.10.1.2 → 10.10.1.1    TCP 83 47078 → 8081 [PSH, ACK] Seq=1225 Ack=1225 Win=64256 Len=17 TSval=1682289707 TSecr=3806549406
1712183997.403017282   501 1.278477863    10.10.1.1 → 10.10.1.2    TCP 83 8081 → 47078 [PSH, ACK] Seq=1225 Ack=1242 Win=65152 Len=17 TSval=3806549416 TSecr=1682289707
1712184001.403017282   505 1.288685926    10.10.1.2 → 10.10.1.1    TCP 83 47078 → 8081 [PSH, ACK] Seq=1242 Ack=1242 Win=64256 Len=17 TSval=1682289717 TSecr=3806549416
1712184003.403017282   507 1.288771021    10.10.1.1 → 10.10.1.2    TCP 83 8081 → 47078 [PSH, ACK] Seq=1242 Ack=1259 Win=65152 Len=17 TSval=3806549427 TSecr=1682289717
1712184008.403017282   512 1.298978950    10.10.1.2 → 10.10.1.1    TCP 83 47078 → 8081 [PSH, ACK] Seq=1259 Ack=1259 Win=64256 Len=17 TSval=1682289728 TSecr=3806549427
1712184010.403017282   514 1.299063986    10.10.1.1 → 10.10.1.2    TCP 83 8081 → 47078 [PSH, ACK] Seq=1259 Ack=1276 Win=65152 Len=17 TSval=3806549437 TSecr=1682289728
1712184014.403017282   518 1.309275660    10.10.1.2 → 10.10.1.1    TCP 83 47078 → 8081 [PSH, ACK] Seq=1276 Ack=1276 Win=64256 Len=17 TSval=1682289738 TSecr=3806549437
1712184016.403017282   520 1.309360712    10.10.1.1 → 10.10.1.2    TCP 83 8081 → 47078 [PSH, ACK] Seq=1276 Ack=1293 Win=65152 Len=17 TSval=3806549447 TSecr=1682289738
1712184021.403017282   525 1.319570445    10.10.1.2 → 10.10.1.1    TCP 83 47078 → 8081 [PSH, ACK] Seq=1293 Ack=1293 Win=64256 Len=17 TSval=1682289748 TSecr=3806549447
1712184023.403017282   527 1.319654945    10.10.1.1 → 10.10.1.2    TCP 83 8081 → 47078 [PSH, ACK] Seq=1293 Ack=1310 Win=65152 Len=17 TSval=3806549457 TSecr=1682289748
1712184027.403017282   531 1.329863037    10.10.1.2 → 10.10.1.1    TCP 83 47078 → 8081 [PSH, ACK] Seq=1310 Ack=1310 Win=64256 Len=17 TSval=1682289758 TSecr=3806549457
1712184029.403017282   533 1.329948498    10.10.1.1 → 10.10.1.2    TCP 83 8081 → 47078 [PSH, ACK] Seq=1310 Ack=1327 Win=65152 Len=17 TSval=3806549468 TSecr=1682289758
1712184034.403017282   538 1.340158351    10.10.1.2 → 10.10.1.1    TCP 83 47078 → 8081 [PSH, ACK] Seq=1327 Ack=1327 Win=64256 Len=17 TSval=1682289769 TSecr=3806549468
1712184036.403017282   540 1.340243118    10.10.1.1 → 10.10.1.2    TCP 83 8081 → 47078 [PSH, ACK] Seq=1327 Ack=1344 Win=65152 Len=17 TSval=3806549478 TSecr=1682289769
1712184040.403017282   544 1.350455838    10.10.1.2 → 10.10.1.1    TCP 83 47078 → 8081 [PSH, ACK] Seq=1344 Ack=1344 Win=64256 Len=17 TSval=1682289779 TSecr=3806549478
1712184042.403017282   546 1.350541072    10.10.1.1 → 10.10.1.2    TCP 83 8081 → 47078 [PSH, ACK] Seq=1344 Ack=1361 Win=65152 Len=17 TSval=3806549488 TSecr=1682289779
1712184047.403017282   551 1.360750941    10.10.1.2 → 10.10.1.1    TCP 83 47078 → 8081 [PSH, ACK] Seq=1361 Ack=1361 Win=64256 Len=17 TSval=1682289789 TSecr=3806549488
1712184049.403017282   553 1.360837504    10.10.1.1 → 10.10.1.2    TCP 83 8081 → 47078 [PSH, ACK] Seq=1361 Ack=1378 Win=65152 Len=17 TSval=3806549499 TSecr=1682289789
1712184053.403017282   557 1.371045173    10.10.1.2 → 10.10.1.1    TCP 83 47078 → 8081 [PSH, ACK] Seq=1378 Ack=1378 Win=64256 Len=17 TSval=1682289800 TSecr=3806549499
1712184055.403017282   559 1.371130040    10.10.1.1 → 10.10.1.2    TCP 83 8081 → 47078 [PSH, ACK] Seq=1378 Ack=1395 Win=65152 Len=17 TSval=3806549509 TSecr=1682289800
1712184060.403017282   564 1.381341573    10.10.1.2 → 10.10.1.1    TCP 83 47078 → 8081 [PSH, ACK] Seq=1395 Ack=1395 Win=64256 Len=17 TSval=1682289810 TSecr=3806549509
1712184062.403017282   566 1.381427193    10.10.1.1 → 10.10.1.2    TCP 83 8081 → 47078 [PSH, ACK] Seq=1395 Ack=1412 Win=65152 Len=17 TSval=3806549519 TSecr=1682289810
1712184066.403017282   570 1.391639000    10.10.1.2 → 10.10.1.1    TCP 83 47078 → 8081 [PSH, ACK] Seq=1412 Ack=1412 Win=64256 Len=17 TSval=1682289820 TSecr=3806549519
1712184068.403017282   572 1.391724037    10.10.1.1 → 10.10.1.2    TCP 83 8081 → 47078 [PSH, ACK] Seq=1412 Ack=1429 Win=65152 Len=17 TSval=3806549529 TSecr=1682289820
1712184073.403017282   577 1.401932512    10.10.1.2 → 10.10.1.1    TCP 83 47078 → 8081 [PSH, ACK] Seq=1429 Ack=1429 Win=64256 Len=17 TSval=1682289831 TSecr=3806549529
1712184075.403017282   579 1.402017624    10.10.1.1 → 10.10.1.2    TCP 83 8081 → 47078 [PSH, ACK] Seq=1429 Ack=1446 Win=65152 Len=17 TSval=3806549540 TSecr=1682289831
1712184079.403017282   583 1.412226978    10.10.1.2 → 10.10.1.1    TCP 83 47078 → 8081 [PSH, ACK] Seq=1446 Ack=1446 Win=64256 Len=17 TSval=1682289841 TSecr=3806549540
1712184081.403017282   585 1.412312252    10.10.1.1 → 10.10.1.2    TCP 83 8081 → 47078 [PSH, ACK] Seq=1446 Ack=1463 Win=65152 Len=17 TSval=3806549550 TSecr=1682289841
1712184086.403017282   590 1.422524438    10.10.1.2 → 10.10.1.1    TCP 83 47078 → 8081 [PSH, ACK] Seq=1463 Ack=1463 Win=64256 Len=17 TSval=1682289851 TSecr=3806549550
1712184088.403017282   592 1.422609500    10.10.1.1 → 10.10.1.2    TCP 83 8081 → 47078 [PSH, ACK] Seq=1463 Ack=1480 Win=65152 Len=17 TSval=3806549560 TSecr=1682289851
1712184092.403017282   596 1.432819678    10.10.1.2 → 10.10.1.1    TCP 83 47078 → 8081 [PSH, ACK] Seq=1480 Ack=1480 Win=64256 Len=17 TSval=1682289861 TSecr=3806549560
1712184094.403017282   598 1.432904456    10.10.1.1 → 10.10.1.2    TCP 83 8081 → 47078 [PSH, ACK] Seq=1480 Ack=1497 Win=65152 Len=17 TSval=3806549571 TSecr=1682289861
1712184099.403017282   603 1.443114361    10.10.1.2 → 10.10.1.1    TCP 83 47078 → 8081 [PSH, ACK] Seq=1497 Ack=1497 Win=64256 Len=17 TSval=1682289872 TSecr=3806549571
1712184101.403017282   605 1.443199586    10.10.1.1 → 10.10.1.2    TCP 83 8081 → 47078 [PSH, ACK] Seq=1497 Ack=1514 Win=65152 Len=17 TSval=3806549581 TSecr=1682289872
1712184105.403017282   609 1.453419731    10.10.1.2 → 10.10.1.1    TCP 83 47078 → 8081 [PSH, ACK] Seq=1514 Ack=1514 Win=64256 Len=17 TSval=1682289882 TSecr=3806549581
1712184107.403017282   611 1.453504446    10.10.1.1 → 10.10.1.2    TCP 83 8081 → 47078 [PSH, ACK] Seq=1514 Ack=1531 Win=65152 Len=17 TSval=3806549591 TSecr=1682289882
1712184112.403017282   616 1.463718657    10.10.1.2 → 10.10.1.1    TCP 83 47078 → 8081 [PSH, ACK] Seq=1531 Ack=1531 Win=64256 Len=17 TSval=1682289892 TSecr=3806549591
1712184114.403017282   618 1.463804129    10.10.1.1 → 10.10.1.2    TCP 83 8081 → 47078 [PSH, ACK] Seq=1531 Ack=1548 Win=65152 Len=17 TSval=3806549602 TSecr=1682289892
1712184118.403017282   622 1.474016321    10.10.1.2 → 10.10.1.1    TCP 83 47078 → 8081 [PSH, ACK] Seq=1548 Ack=1548 Win=64256 Len=17 TSval=1682289903 TSecr=3806549602
1712184120.403017282   624 1.474101185    10.10.1.1 → 10.10.1.2    TCP 83 8081 → 47078 [PSH, ACK] Seq=1548 Ack=1565 Win=65152 Len=17 TSval=3806549612 TSecr=1682289903
1712184125.403017282   629 1.484312283    10.10.1.2 → 10.10.1.1    TCP 83 47078 → 8081 [PSH, ACK] Seq=1565 Ack=1565 Win=64256 Len=17 TSval=1682289913 TSecr=3806549612
1712184127.403017282   631 1.484397075    10.10.1.1 → 10.10.1.2    TCP 83 8081 → 47078 [PSH, ACK] Seq=1565 Ack=1582 Win=65152 Len=17 TSval=3806549622 TSecr=1682289913
1712184131.403017282   635 1.494606414    10.10.1.2 → 10.10.1.1    TCP 83 47078 → 8081 [PSH, ACK] Seq=1582 Ack=1582 Win=64256 Len=17 TSval=1682289923 TSecr=3806549622
1712184133.403017282   637 1.494690699    10.10.1.1 → 10.10.1.2    TCP 83 8081 → 47078 [PSH, ACK] Seq=1582 Ack=1599 Win=65152 Len=17 TSval=3806549632 TSecr=1682289923
1712184138.403017282   642 1.504853094    10.10.1.2 → 10.10.1.1    TCP 83 47078 → 8081 [PSH, ACK] Seq=1599 Ack=1599 Win=64256 Len=17 TSval=1682289934 TSecr=3806549632
1712184139.403017282   643 1.504919430    10.10.1.1 → 10.10.1.2    TCP 83 8081 → 47078 [PSH, ACK] Seq=1599 Ack=1616 Win=65152 Len=17 TSval=3806549643 TSecr=1682289934
1712184144.403017282   648 1.515075889    10.10.1.2 → 10.10.1.1    TCP 83 47078 → 8081 [PSH, ACK] Seq=1616 Ack=1616 Win=64256 Len=17 TSval=1682289944 TSecr=3806549643
1712184145.403017282   649 1.515107858    10.10.1.1 → 10.10.1.2    TCP 83 8081 → 47078 [PSH, ACK] Seq=1616 Ack=1633 Win=65152 Len=17 TSval=3806549653 TSecr=1682289944
1712184150.403017282   654 1.525314087    10.10.1.2 → 10.10.1.1    TCP 83 47078 → 8081 [PSH, ACK] Seq=1633 Ack=1633 Win=64256 Len=17 TSval=1682289954 TSecr=3806549653
1712184152.403017282   656 1.525399368    10.10.1.1 → 10.10.1.2    TCP 83 8081 → 47078 [PSH, ACK] Seq=1633 Ack=1650 Win=65152 Len=17 TSval=3806549663 TSecr=1682289954
1712184157.403017282   661 1.535611917    10.10.1.2 → 10.10.1.1    TCP 83 47078 → 8081 [PSH, ACK] Seq=1650 Ack=1650 Win=64256 Len=17 TSval=1682289964 TSecr=3806549663
1712184159.403017282   663 1.535696803    10.10.1.1 → 10.10.1.2    TCP 83 8081 → 47078 [PSH, ACK] Seq=1650 Ack=1667 Win=65152 Len=17 TSval=3806549673 TSecr=1682289964
1712184163.403017282   667 1.545905735    10.10.1.2 → 10.10.1.1    TCP 83 47078 → 8081 [PSH, ACK] Seq=1667 Ack=1667 Win=64256 Len=17 TSval=1682289975 TSecr=3806549673
1712184165.403017282   669 1.545990714    10.10.1.1 → 10.10.1.2    TCP 83 8081 → 47078 [PSH, ACK] Seq=1667 Ack=1684 Win=65152 Len=17 TSval=3806549684 TSecr=1682289975
1712184170.403017282   674 1.556199686    10.10.1.2 → 10.10.1.1    TCP 83 47078 → 8081 [PSH, ACK] Seq=1684 Ack=1684 Win=64256 Len=17 TSval=1682289985 TSecr=3806549684
1712184172.403017282   676 1.556284513    10.10.1.1 → 10.10.1.2    TCP 83 8081 → 47078 [PSH, ACK] Seq=1684 Ack=1701 Win=65152 Len=17 TSval=3806549694 TSecr=1682289985
1712184176.403017282   680 1.566493965    10.10.1.2 → 10.10.1.1    TCP 83 47078 → 8081 [PSH, ACK] Seq=1701 Ack=1701 Win=64256 Len=17 TSval=1682289995 TSecr=3806549694
1712184178.403017282   682 1.566578636    10.10.1.1 → 10.10.1.2    TCP 83 8081 → 47078 [PSH, ACK] Seq=1701 Ack=1718 Win=65152 Len=17 TSval=3806549704 TSecr=1682289995
1712184183.403017282   687 1.576790318    10.10.1.2 → 10.10.1.1    TCP 83 47078 → 8081 [PSH, ACK] Seq=1718 Ack=1718 Win=64256 Len=17 TSval=1682290005 TSecr=3806549704
1712184185.403017282   689 1.576875673    10.10.1.1 → 10.10.1.2    TCP 83 8081 → 47078 [PSH, ACK] Seq=1718 Ack=1735 Win=65152 Len=17 TSval=3806549715 TSecr=1682290005
1712184189.403017282   693 1.587086387    10.10.1.2 → 10.10.1.1    TCP 83 47078 → 8081 [PSH, ACK] Seq=1735 Ack=1735 Win=64256 Len=17 TSval=1682290016 TSecr=3806549715
1712184191.403017282   695 1.587171567    10.10.1.1 → 10.10.1.2    TCP 83 8081 → 47078 [PSH, ACK] Seq=1735 Ack=1752 Win=65152 Len=17 TSval=3806549725 TSecr=1682290016
1712184196.403017282   700 1.597383842    10.10.1.2 → 10.10.1.1    TCP 83 47078 → 8081 [PSH, ACK] Seq=1752 Ack=1752 Win=64256 Len=17 TSval=1682290026 TSecr=3806549725
1712184198.403017282   702 1.597469107    10.10.1.1 → 10.10.1.2    TCP 83 8081 → 47078 [PSH, ACK] Seq=1752 Ack=1769 Win=65152 Len=17 TSval=3806549735 TSecr=1682290026
1712184202.403017282   706 1.607678478    10.10.1.2 → 10.10.1.1    TCP 83 47078 → 8081 [PSH, ACK] Seq=1769 Ack=1769 Win=64256 Len=17 TSval=1682290036 TSecr=3806549735
1712184204.403017282   708 1.607781856    10.10.1.1 → 10.10.1.2    TCP 83 8081 → 47078 [PSH, ACK] Seq=1769 Ack=1786 Win=65152 Len=17 TSval=3806549746 TSecr=1682290036
1712184209.403017282   713 1.617990432    10.10.1.2 → 10.10.1.1    TCP 83 47078 → 8081 [PSH, ACK] Seq=1786 Ack=1786 Win=64256 Len=17 TSval=1682290047 TSecr=3806549746
1712184211.403017282   715 1.618075283    10.10.1.1 → 10.10.1.2    TCP 83 8081 → 47078 [PSH, ACK] Seq=1786 Ack=1803 Win=65152 Len=17 TSval=3806549756 TSecr=1682290047
1712184215.403017282   719 1.628284544    10.10.1.2 → 10.10.1.1    TCP 83 47078 → 8081 [PSH, ACK] Seq=1803 Ack=1803 Win=64256 Len=17 TSval=1682290057 TSecr=3806549756
1712184217.403017282   721 1.628369096    10.10.1.1 → 10.10.1.2    TCP 83 8081 → 47078 [PSH, ACK] Seq=1803 Ack=1820 Win=65152 Len=17 TSval=3806549766 TSecr=1682290057
1712184222.403017282   726 1.638578757    10.10.1.2 → 10.10.1.1    TCP 83 47078 → 8081 [PSH, ACK] Seq=1820 Ack=1820 Win=64256 Len=17 TSval=1682290067 TSecr=3806549766
1712184224.403017282   728 1.638663660    10.10.1.1 → 10.10.1.2    TCP 83 8081 → 47078 [PSH, ACK] Seq=1820 Ack=1837 Win=65152 Len=17 TSval=3806549776 TSecr=1682290067
1712184228.403017282   732 1.648874021    10.10.1.2 → 10.10.1.1    TCP 83 47078 → 8081 [PSH, ACK] Seq=1837 Ack=1837 Win=64256 Len=17 TSval=1682290077 TSecr=3806549776
1712184230.403017282   734 1.648958765    10.10.1.1 → 10.10.1.2    TCP 83 8081 → 47078 [PSH, ACK] Seq=1837 Ack=1854 Win=65152 Len=17 TSval=3806549787 TSecr=1682290077
1712184235.403017282   739 1.659170918    10.10.1.2 → 10.10.1.1    TCP 83 47078 → 8081 [PSH, ACK] Seq=1854 Ack=1854 Win=64256 Len=17 TSval=1682290088 TSecr=3806549787
1712184237.403017282   741 1.659255145    10.10.1.1 → 10.10.1.2    TCP 83 8081 → 47078 [PSH, ACK] Seq=1854 Ack=1871 Win=65152 Len=17 TSval=3806549797 TSecr=1682290088
1712184241.403017282   745 1.669473398    10.10.1.2 → 10.10.1.1    TCP 83 47078 → 8081 [PSH, ACK] Seq=1871 Ack=1871 Win=64256 Len=17 TSval=1682290098 TSecr=3806549797
1712184243.403017282   747 1.669558162    10.10.1.1 → 10.10.1.2    TCP 83 8081 → 47078 [PSH, ACK] Seq=1871 Ack=1888 Win=65152 Len=17 TSval=3806549807 TSecr=1682290098
1712184248.403017282   752 1.679773261    10.10.1.2 → 10.10.1.1    TCP 83 47078 → 8081 [PSH, ACK] Seq=1888 Ack=1888 Win=64256 Len=17 TSval=1682290108 TSecr=3806549807
1712184250.403017282   754 1.679857772    10.10.1.1 → 10.10.1.2    TCP 83 8081 → 47078 [PSH, ACK] Seq=1888 Ack=1905 Win=65152 Len=17 TSval=3806549818 TSecr=1682290108
1712184254.403017282   758 1.690067089    10.10.1.2 → 10.10.1.1    TCP 83 47078 → 8081 [PSH, ACK] Seq=1905 Ack=1905 Win=64256 Len=17 TSval=1682290119 TSecr=3806549818
1712184256.403017282   760 1.690152265    10.10.1.1 → 10.10.1.2    TCP 83 8081 → 47078 [PSH, ACK] Seq=1905 Ack=1922 Win=65152 Len=17 TSval=3806549828 TSecr=1682290119
1712184261.403017282   765 1.700362550    10.10.1.2 → 10.10.1.1    TCP 83 47078 → 8081 [PSH, ACK] Seq=1922 Ack=1922 Win=64256 Len=17 TSval=1682290129 TSecr=3806549828
1712184263.403017282   767 1.700505249    10.10.1.1 → 10.10.1.2    TCP 83 8081 → 47078 [PSH, ACK] Seq=1922 Ack=1939 Win=65152 Len=17 TSval=3806549838 TSecr=1682290129
1712184267.403017282   771 1.710717776    10.10.1.2 → 10.10.1.1    TCP 83 47078 → 8081 [PSH, ACK] Seq=1939 Ack=1939 Win=64256 Len=17 TSval=1682290139 TSecr=3806549838
1712184269.403017282   773 1.710802307    10.10.1.1 → 10.10.1.2    TCP 83 8081 → 47078 [PSH, ACK] Seq=1939 Ack=1956 Win=65152 Len=17 TSval=3806549849 TSecr=1682290139
1712184274.403017282   778 1.721010016    10.10.1.2 → 10.10.1.1    TCP 83 47078 → 8081 [PSH, ACK] Seq=1956 Ack=1956 Win=64256 Len=17 TSval=1682290150 TSecr=3806549849
1712184276.403017282   780 1.721094774    10.10.1.1 → 10.10.1.2    TCP 83 8081 → 47078 [PSH, ACK] Seq=1956 Ack=1973 Win=65152 Len=17 TSval=3806549859 TSecr=1682290150
1712184280.403017282   784 1.731303686    10.10.1.2 → 10.10.1.1    TCP 83 47078 → 8081 [PSH, ACK] Seq=1973 Ack=1973 Win=64256 Len=17 TSval=1682290160 TSecr=3806549859
1712184282.403017282   786 1.731388990    10.10.1.1 → 10.10.1.2    TCP 83 8081 → 47078 [PSH, ACK] Seq=1973 Ack=1990 Win=65152 Len=17 TSval=3806549869 TSecr=1682290160
1712184287.403017282   791 1.741600665    10.10.1.2 → 10.10.1.1    TCP 83 47078 → 8081 [PSH, ACK] Seq=1990 Ack=1990 Win=64256 Len=17 TSval=1682290170 TSecr=3806549869
1712184289.403017282   793 1.741685710    10.10.1.1 → 10.10.1.2    TCP 83 8081 → 47078 [PSH, ACK] Seq=1990 Ack=2007 Win=65152 Len=17 TSval=3806549879 TSecr=1682290170
