1711548703.104295492    22 0.279331887    10.10.1.2 → 10.10.1.1    TCP 74 53120 → 8081 [SYN] Seq=0 Win=64240 Len=0 MSS=1460 SACK_PERM=1 TSval=1047473407 TSecr=0 WS=128
1711548704.104295492    23 0.279367108    10.10.1.1 → 10.10.1.2    TCP 74 8081 → 53120 [SYN, ACK] Seq=0 Ack=1 Win=65160 Len=0 MSS=1460 SACK_PERM=1 TSval=3171733118 TSecr=1047473407 WS=128
1711548705.104295492    24 0.279468676    10.10.1.2 → 10.10.1.1    TCP 66 53120 → 8081 [ACK] Seq=1 Ack=1 Win=64256 Len=0 TSval=1047473407 TSecr=3171733118
1711548719.104295492    38 0.528868096    10.10.1.2 → 10.10.1.1    TCP 83 53120 → 8081 [PSH, ACK] Seq=1 Ack=1 Win=64256 Len=17 TSval=1047473657 TSecr=3171733118
1711548721.104295492    40 0.528895632    10.10.1.1 → 10.10.1.2    TCP 66 8081 → 53120 [ACK] Seq=1 Ack=18 Win=65152 Len=0 TSval=3171733368 TSecr=1047473657
1711548723.104295492    42 0.529166100    10.10.1.1 → 10.10.1.2    TCP 83 8081 → 53120 [PSH, ACK] Seq=1 Ack=18 Win=65152 Len=17 TSval=3171733368 TSecr=1047473657
1711548724.104295492    43 0.529194561    10.10.1.2 → 10.10.1.1    TCP 66 53120 → 8081 [ACK] Seq=18 Ack=18 Win=64256 Len=0 TSval=1047473657 TSecr=3171733368
1711548731.104295492    50 0.530383977    10.10.1.2 → 10.10.1.1    TCP 83 53120 → 8081 [PSH, ACK] Seq=18 Ack=18 Win=64256 Len=17 TSval=1047473658 TSecr=3171733368
1711548734.104295492    53 0.530504703    10.10.1.1 → 10.10.1.2    TCP 83 8081 → 53120 [PSH, ACK] Seq=18 Ack=35 Win=65152 Len=17 TSval=3171733369 TSecr=1047473658
1711548741.104295492    60 0.531719423    10.10.1.2 → 10.10.1.1    TCP 83 53120 → 8081 [PSH, ACK] Seq=35 Ack=35 Win=64256 Len=17 TSval=1047473660 TSecr=3171733369
1711548744.104295492    63 0.531850218    10.10.1.1 → 10.10.1.2    TCP 83 8081 → 53120 [PSH, ACK] Seq=35 Ack=52 Win=65152 Len=17 TSval=3171733371 TSecr=1047473660
1711548751.104295492    70 0.533065804    10.10.1.2 → 10.10.1.1    TCP 83 53120 → 8081 [PSH, ACK] Seq=52 Ack=52 Win=64256 Len=17 TSval=1047473661 TSecr=3171733371
1711548754.104295492    73 0.533191164    10.10.1.1 → 10.10.1.2    TCP 83 8081 → 53120 [PSH, ACK] Seq=52 Ack=69 Win=65152 Len=17 TSval=3171733372 TSecr=1047473661
1711548761.104295492    80 0.534414648    10.10.1.2 → 10.10.1.1    TCP 83 53120 → 8081 [PSH, ACK] Seq=69 Ack=69 Win=64256 Len=17 TSval=1047473662 TSecr=3171733372
1711548764.104295492    83 0.534539425    10.10.1.1 → 10.10.1.2    TCP 83 8081 → 53120 [PSH, ACK] Seq=69 Ack=86 Win=65152 Len=17 TSval=3171733373 TSecr=1047473662
1711548771.104295492    90 0.535753493    10.10.1.2 → 10.10.1.1    TCP 83 53120 → 8081 [PSH, ACK] Seq=86 Ack=86 Win=64256 Len=17 TSval=1047473664 TSecr=3171733373
1711548773.104295492    92 0.535882715    10.10.1.1 → 10.10.1.2    TCP 83 8081 → 53120 [PSH, ACK] Seq=86 Ack=103 Win=65152 Len=17 TSval=3171733375 TSecr=1047473664
1711548781.104295492   100 0.537099279    10.10.1.2 → 10.10.1.1    TCP 83 53120 → 8081 [PSH, ACK] Seq=103 Ack=103 Win=64256 Len=17 TSval=1047473665 TSecr=3171733375
1711548783.104295492   102 0.537225109    10.10.1.1 → 10.10.1.2    TCP 83 8081 → 53120 [PSH, ACK] Seq=103 Ack=120 Win=65152 Len=17 TSval=3171733376 TSecr=1047473665
1711548791.104295492   110 0.538437440    10.10.1.2 → 10.10.1.1    TCP 83 53120 → 8081 [PSH, ACK] Seq=120 Ack=120 Win=64256 Len=17 TSval=1047473666 TSecr=3171733376
1711548793.104295492   112 0.538562322    10.10.1.1 → 10.10.1.2    TCP 83 8081 → 53120 [PSH, ACK] Seq=120 Ack=137 Win=65152 Len=17 TSval=3171733377 TSecr=1047473666
1711548801.104295492   120 0.539776320    10.10.1.2 → 10.10.1.1    TCP 83 53120 → 8081 [PSH, ACK] Seq=137 Ack=137 Win=64256 Len=17 TSval=1047473668 TSecr=3171733377
1711548803.104295492   122 0.539905943    10.10.1.1 → 10.10.1.2    TCP 83 8081 → 53120 [PSH, ACK] Seq=137 Ack=154 Win=65152 Len=17 TSval=3171733379 TSecr=1047473668
1711548811.104295492   130 0.541121993    10.10.1.2 → 10.10.1.1    TCP 83 53120 → 8081 [PSH, ACK] Seq=154 Ack=154 Win=64256 Len=17 TSval=1047473669 TSecr=3171733379
1711548813.104295492   132 0.541246741    10.10.1.1 → 10.10.1.2    TCP 83 8081 → 53120 [PSH, ACK] Seq=154 Ack=171 Win=65152 Len=17 TSval=3171733380 TSecr=1047473669
1711548821.104295492   140 0.542459377    10.10.1.2 → 10.10.1.1    TCP 83 53120 → 8081 [PSH, ACK] Seq=171 Ack=171 Win=64256 Len=17 TSval=1047473670 TSecr=3171733380
1711548823.104295492   142 0.542585699    10.10.1.1 → 10.10.1.2    TCP 83 8081 → 53120 [PSH, ACK] Seq=171 Ack=188 Win=65152 Len=17 TSval=3171733381 TSecr=1047473670
1711548831.104295492   150 0.543798334    10.10.1.2 → 10.10.1.1    TCP 83 53120 → 8081 [PSH, ACK] Seq=188 Ack=188 Win=64256 Len=17 TSval=1047473672 TSecr=3171733381
1711548833.104295492   152 0.543928553    10.10.1.1 → 10.10.1.2    TCP 83 8081 → 53120 [PSH, ACK] Seq=188 Ack=205 Win=65152 Len=17 TSval=3171733383 TSecr=1047473672
1711548841.104295492   160 0.545143741    10.10.1.2 → 10.10.1.1    TCP 83 53120 → 8081 [PSH, ACK] Seq=205 Ack=205 Win=64256 Len=17 TSval=1047473673 TSecr=3171733383
1711548843.104295492   162 0.545268668    10.10.1.1 → 10.10.1.2    TCP 83 8081 → 53120 [PSH, ACK] Seq=205 Ack=222 Win=65152 Len=17 TSval=3171733384 TSecr=1047473673
1711548851.104295492   170 0.546481400    10.10.1.2 → 10.10.1.1    TCP 83 53120 → 8081 [PSH, ACK] Seq=222 Ack=222 Win=64256 Len=17 TSval=1047473674 TSecr=3171733384
1711548853.104295492   172 0.546613424    10.10.1.1 → 10.10.1.2    TCP 83 8081 → 53120 [PSH, ACK] Seq=222 Ack=239 Win=65152 Len=17 TSval=3171733385 TSecr=1047473674
1711548861.104295492   180 0.547783484    10.10.1.2 → 10.10.1.1    TCP 83 53120 → 8081 [PSH, ACK] Seq=239 Ack=239 Win=64256 Len=17 TSval=1047473676 TSecr=3171733385
1711548863.104295492   182 0.547913440    10.10.1.1 → 10.10.1.2    TCP 83 8081 → 53120 [PSH, ACK] Seq=239 Ack=256 Win=65152 Len=17 TSval=3171733387 TSecr=1047473676
1711548871.104295492   190 0.549129247    10.10.1.2 → 10.10.1.1    TCP 83 53120 → 8081 [PSH, ACK] Seq=256 Ack=256 Win=64256 Len=17 TSval=1047473677 TSecr=3171733387
1711548873.104295492   192 0.549253369    10.10.1.1 → 10.10.1.2    TCP 83 8081 → 53120 [PSH, ACK] Seq=256 Ack=273 Win=65152 Len=17 TSval=3171733388 TSecr=1047473677
1711548881.104295492   200 0.550466373    10.10.1.2 → 10.10.1.1    TCP 83 53120 → 8081 [PSH, ACK] Seq=273 Ack=273 Win=64256 Len=17 TSval=1047473678 TSecr=3171733388
1711548883.104295492   202 0.550586948    10.10.1.1 → 10.10.1.2    TCP 83 8081 → 53120 [PSH, ACK] Seq=273 Ack=290 Win=65152 Len=17 TSval=3171733389 TSecr=1047473678
1711548891.104295492   210 0.551799255    10.10.1.2 → 10.10.1.1    TCP 83 53120 → 8081 [PSH, ACK] Seq=290 Ack=290 Win=64256 Len=17 TSval=1047473680 TSecr=3171733389
1711548893.104295492   212 0.551928927    10.10.1.1 → 10.10.1.2    TCP 83 8081 → 53120 [PSH, ACK] Seq=290 Ack=307 Win=65152 Len=17 TSval=3171733391 TSecr=1047473680
1711548901.104295492   220 0.553144260    10.10.1.2 → 10.10.1.1    TCP 83 53120 → 8081 [PSH, ACK] Seq=307 Ack=307 Win=64256 Len=17 TSval=1047473681 TSecr=3171733391
1711548903.104295492   222 0.553269531    10.10.1.1 → 10.10.1.2    TCP 83 8081 → 53120 [PSH, ACK] Seq=307 Ack=324 Win=65152 Len=17 TSval=3171733392 TSecr=1047473681
1711548911.104295492   230 0.554481240    10.10.1.2 → 10.10.1.1    TCP 83 53120 → 8081 [PSH, ACK] Seq=324 Ack=324 Win=64256 Len=17 TSval=1047473682 TSecr=3171733392
1711548913.104295492   232 0.554606395    10.10.1.1 → 10.10.1.2    TCP 83 8081 → 53120 [PSH, ACK] Seq=324 Ack=341 Win=65152 Len=17 TSval=3171733393 TSecr=1047473682
1711548921.104295492   240 0.555818322    10.10.1.2 → 10.10.1.1    TCP 83 53120 → 8081 [PSH, ACK] Seq=341 Ack=341 Win=64256 Len=17 TSval=1047473684 TSecr=3171733393
1711548923.104295492   242 0.555947744    10.10.1.1 → 10.10.1.2    TCP 83 8081 → 53120 [PSH, ACK] Seq=341 Ack=358 Win=65152 Len=17 TSval=3171733395 TSecr=1047473684
1711548931.104295492   250 0.557162621    10.10.1.2 → 10.10.1.1    TCP 83 53120 → 8081 [PSH, ACK] Seq=358 Ack=358 Win=64256 Len=17 TSval=1047473685 TSecr=3171733395
1711548933.104295492   252 0.557287243    10.10.1.1 → 10.10.1.2    TCP 83 8081 → 53120 [PSH, ACK] Seq=358 Ack=375 Win=65152 Len=17 TSval=3171733396 TSecr=1047473685
1711548941.104295492   260 0.558498946    10.10.1.2 → 10.10.1.1    TCP 83 53120 → 8081 [PSH, ACK] Seq=375 Ack=375 Win=64256 Len=17 TSval=1047473686 TSecr=3171733396
1711548943.104295492   262 0.558623588    10.10.1.1 → 10.10.1.2    TCP 83 8081 → 53120 [PSH, ACK] Seq=375 Ack=392 Win=65152 Len=17 TSval=3171733397 TSecr=1047473686
1711548951.104295492   270 0.559836401    10.10.1.2 → 10.10.1.1    TCP 83 53120 → 8081 [PSH, ACK] Seq=392 Ack=392 Win=64256 Len=17 TSval=1047473688 TSecr=3171733397
1711548953.104295492   272 0.559962606    10.10.1.1 → 10.10.1.2    TCP 83 8081 → 53120 [PSH, ACK] Seq=392 Ack=409 Win=65152 Len=17 TSval=3171733399 TSecr=1047473688
1711548961.104295492   280 0.561177368    10.10.1.2 → 10.10.1.1    TCP 83 53120 → 8081 [PSH, ACK] Seq=409 Ack=409 Win=64256 Len=17 TSval=1047473689 TSecr=3171733399
1711548963.104295492   282 0.561297935    10.10.1.1 → 10.10.1.2    TCP 83 8081 → 53120 [PSH, ACK] Seq=409 Ack=426 Win=65152 Len=17 TSval=3171733400 TSecr=1047473689
1711548971.104295492   290 0.562509442    10.10.1.2 → 10.10.1.1    TCP 83 53120 → 8081 [PSH, ACK] Seq=426 Ack=426 Win=64256 Len=17 TSval=1047473690 TSecr=3171733400
1711548973.104295492   292 0.562629479    10.10.1.1 → 10.10.1.2    TCP 83 8081 → 53120 [PSH, ACK] Seq=426 Ack=443 Win=65152 Len=17 TSval=3171733401 TSecr=1047473690
1711548981.104295492   300 0.563841755    10.10.1.2 → 10.10.1.1    TCP 83 53120 → 8081 [PSH, ACK] Seq=443 Ack=443 Win=64256 Len=17 TSval=1047473692 TSecr=3171733401
1711548983.104295492   302 0.563966437    10.10.1.1 → 10.10.1.2    TCP 83 8081 → 53120 [PSH, ACK] Seq=443 Ack=460 Win=65152 Len=17 TSval=3171733403 TSecr=1047473692
1711548991.104295492   310 0.565182214    10.10.1.2 → 10.10.1.1    TCP 83 53120 → 8081 [PSH, ACK] Seq=460 Ack=460 Win=64256 Len=17 TSval=1047473693 TSecr=3171733403
1711548993.104295492   312 0.565303536    10.10.1.1 → 10.10.1.2    TCP 83 8081 → 53120 [PSH, ACK] Seq=460 Ack=477 Win=65152 Len=17 TSval=3171733404 TSecr=1047473693
1711549001.104295492   320 0.566514664    10.10.1.2 → 10.10.1.1    TCP 83 53120 → 8081 [PSH, ACK] Seq=477 Ack=477 Win=64256 Len=17 TSval=1047473694 TSecr=3171733404
1711549003.104295492   322 0.566639168    10.10.1.1 → 10.10.1.2    TCP 83 8081 → 53120 [PSH, ACK] Seq=477 Ack=494 Win=65152 Len=17 TSval=3171733405 TSecr=1047473694
1711549011.104295492   330 0.567850683    10.10.1.2 → 10.10.1.1    TCP 83 53120 → 8081 [PSH, ACK] Seq=494 Ack=494 Win=64256 Len=17 TSval=1047473696 TSecr=3171733405
1711549013.104295492   332 0.567975787    10.10.1.1 → 10.10.1.2    TCP 83 8081 → 53120 [PSH, ACK] Seq=494 Ack=511 Win=65152 Len=17 TSval=3171733407 TSecr=1047473696
1711549021.104295492   340 0.569191067    10.10.1.2 → 10.10.1.1    TCP 83 53120 → 8081 [PSH, ACK] Seq=511 Ack=511 Win=64256 Len=17 TSval=1047473697 TSecr=3171733407
1711549023.104295492   342 0.569311694    10.10.1.1 → 10.10.1.2    TCP 83 8081 → 53120 [PSH, ACK] Seq=511 Ack=528 Win=65152 Len=17 TSval=3171733408 TSecr=1047473697
1711549031.104295492   350 0.570523330    10.10.1.2 → 10.10.1.1    TCP 83 53120 → 8081 [PSH, ACK] Seq=528 Ack=528 Win=64256 Len=17 TSval=1047473698 TSecr=3171733408
1711549033.104295492   352 0.570643794    10.10.1.1 → 10.10.1.2    TCP 83 8081 → 53120 [PSH, ACK] Seq=528 Ack=545 Win=65152 Len=17 TSval=3171733409 TSecr=1047473698
1711549041.104295492   360 0.571870770    10.10.1.2 → 10.10.1.1    TCP 83 53120 → 8081 [PSH, ACK] Seq=545 Ack=545 Win=64256 Len=17 TSval=1047473700 TSecr=3171733409
1711549043.104295492   362 0.571995542    10.10.1.1 → 10.10.1.2    TCP 83 8081 → 53120 [PSH, ACK] Seq=545 Ack=562 Win=65152 Len=17 TSval=3171733411 TSecr=1047473700
1711549051.104295492   370 0.573210579    10.10.1.2 → 10.10.1.1    TCP 83 53120 → 8081 [PSH, ACK] Seq=562 Ack=562 Win=64256 Len=17 TSval=1047473701 TSecr=3171733411
1711549053.104295492   372 0.573332137    10.10.1.1 → 10.10.1.2    TCP 83 8081 → 53120 [PSH, ACK] Seq=562 Ack=579 Win=65152 Len=17 TSval=3171733412 TSecr=1047473701
1711549061.104295492   380 0.574543520    10.10.1.2 → 10.10.1.1    TCP 83 53120 → 8081 [PSH, ACK] Seq=579 Ack=579 Win=64256 Len=17 TSval=1047473702 TSecr=3171733412
1711549063.104295492   382 0.574684316    10.10.1.1 → 10.10.1.2    TCP 83 8081 → 53120 [PSH, ACK] Seq=579 Ack=596 Win=65152 Len=17 TSval=3171733414 TSecr=1047473702
1711549071.104295492   390 0.575896057    10.10.1.2 → 10.10.1.1    TCP 83 53120 → 8081 [PSH, ACK] Seq=596 Ack=596 Win=64256 Len=17 TSval=1047473704 TSecr=3171733414
1711549073.104295492   392 0.576021455    10.10.1.1 → 10.10.1.2    TCP 83 8081 → 53120 [PSH, ACK] Seq=596 Ack=613 Win=65152 Len=17 TSval=3171733415 TSecr=1047473704
1711549081.104295492   400 0.577236731    10.10.1.2 → 10.10.1.1    TCP 83 53120 → 8081 [PSH, ACK] Seq=613 Ack=613 Win=64256 Len=17 TSval=1047473705 TSecr=3171733415
1711549083.104295492   402 0.577357392    10.10.1.1 → 10.10.1.2    TCP 83 8081 → 53120 [PSH, ACK] Seq=613 Ack=630 Win=65152 Len=17 TSval=3171733416 TSecr=1047473705
1711549091.104295492   410 0.578569529    10.10.1.2 → 10.10.1.1    TCP 83 53120 → 8081 [PSH, ACK] Seq=630 Ack=630 Win=64256 Len=17 TSval=1047473707 TSecr=3171733416
1711549093.104295492   412 0.578711897    10.10.1.1 → 10.10.1.2    TCP 83 8081 → 53120 [PSH, ACK] Seq=630 Ack=647 Win=65152 Len=17 TSval=3171733418 TSecr=1047473707
1711549101.104295492   420 0.579924556    10.10.1.2 → 10.10.1.1    TCP 83 53120 → 8081 [PSH, ACK] Seq=647 Ack=647 Win=64256 Len=17 TSval=1047473708 TSecr=3171733418
1711549103.104295492   422 0.580049752    10.10.1.1 → 10.10.1.2    TCP 83 8081 → 53120 [PSH, ACK] Seq=647 Ack=664 Win=65152 Len=17 TSval=3171733419 TSecr=1047473708
1711549111.104295492   430 0.581263255    10.10.1.2 → 10.10.1.1    TCP 83 53120 → 8081 [PSH, ACK] Seq=664 Ack=664 Win=64256 Len=17 TSval=1047473709 TSecr=3171733419
1711549113.104295492   432 0.581384360    10.10.1.1 → 10.10.1.2    TCP 83 8081 → 53120 [PSH, ACK] Seq=664 Ack=681 Win=65152 Len=17 TSval=3171733420 TSecr=1047473709
1711549121.104295492   440 0.582595061    10.10.1.2 → 10.10.1.1    TCP 83 53120 → 8081 [PSH, ACK] Seq=681 Ack=681 Win=64256 Len=17 TSval=1047473711 TSecr=3171733420
1711549123.104295492   442 0.582735270    10.10.1.1 → 10.10.1.2    TCP 83 8081 → 53120 [PSH, ACK] Seq=681 Ack=698 Win=65152 Len=17 TSval=3171733422 TSecr=1047473711
1711549131.104295492   450 0.583947133    10.10.1.2 → 10.10.1.1    TCP 83 53120 → 8081 [PSH, ACK] Seq=698 Ack=698 Win=64256 Len=17 TSval=1047473712 TSecr=3171733422
1711549133.104295492   452 0.584077555    10.10.1.1 → 10.10.1.2    TCP 83 8081 → 53120 [PSH, ACK] Seq=698 Ack=715 Win=65152 Len=17 TSval=3171733423 TSecr=1047473712
1711549141.104295492   460 0.585292642    10.10.1.2 → 10.10.1.1    TCP 83 53120 → 8081 [PSH, ACK] Seq=715 Ack=715 Win=64256 Len=17 TSval=1047473713 TSecr=3171733423
1711549143.104295492   462 0.585412981    10.10.1.1 → 10.10.1.2    TCP 83 8081 → 53120 [PSH, ACK] Seq=715 Ack=732 Win=65152 Len=17 TSval=3171733424 TSecr=1047473713
1711549151.104295492   470 0.586624635    10.10.1.2 → 10.10.1.1    TCP 83 53120 → 8081 [PSH, ACK] Seq=732 Ack=732 Win=64256 Len=17 TSval=1047473715 TSecr=3171733424
1711549153.104295492   472 0.586764160    10.10.1.1 → 10.10.1.2    TCP 83 8081 → 53120 [PSH, ACK] Seq=732 Ack=749 Win=65152 Len=17 TSval=3171733426 TSecr=1047473715
1711549161.104295492   480 0.587976543    10.10.1.2 → 10.10.1.1    TCP 83 53120 → 8081 [PSH, ACK] Seq=749 Ack=749 Win=64256 Len=17 TSval=1047473716 TSecr=3171733426
1711549163.104295492   482 0.588106086    10.10.1.1 → 10.10.1.2    TCP 83 8081 → 53120 [PSH, ACK] Seq=749 Ack=766 Win=65152 Len=17 TSval=3171733427 TSecr=1047473716
1711549171.104295492   490 0.589320183    10.10.1.2 → 10.10.1.1    TCP 83 53120 → 8081 [PSH, ACK] Seq=766 Ack=766 Win=64256 Len=17 TSval=1047473717 TSecr=3171733427
1711549173.104295492   492 0.589446501    10.10.1.1 → 10.10.1.2    TCP 83 8081 → 53120 [PSH, ACK] Seq=766 Ack=783 Win=65152 Len=17 TSval=3171733428 TSecr=1047473717
1711549181.104295492   500 0.590660563    10.10.1.2 → 10.10.1.1    TCP 83 53120 → 8081 [PSH, ACK] Seq=783 Ack=783 Win=64256 Len=17 TSval=1047473719 TSecr=3171733428
1711549184.104295492   503 0.590790808    10.10.1.1 → 10.10.1.2    TCP 83 8081 → 53120 [PSH, ACK] Seq=783 Ack=800 Win=65152 Len=17 TSval=3171733430 TSecr=1047473719
1711549191.104295492   510 0.592002525    10.10.1.2 → 10.10.1.1    TCP 83 53120 → 8081 [PSH, ACK] Seq=800 Ack=800 Win=64256 Len=17 TSval=1047473720 TSecr=3171733430
1711549193.104295492   512 0.592124329    10.10.1.1 → 10.10.1.2    TCP 83 8081 → 53120 [PSH, ACK] Seq=800 Ack=817 Win=65152 Len=17 TSval=3171733431 TSecr=1047473720
1711549201.104295492   520 0.593340231    10.10.1.2 → 10.10.1.1    TCP 83 53120 → 8081 [PSH, ACK] Seq=817 Ack=817 Win=64256 Len=17 TSval=1047473721 TSecr=3171733431
1711549203.104295492   522 0.593462095    10.10.1.1 → 10.10.1.2    TCP 83 8081 → 53120 [PSH, ACK] Seq=817 Ack=834 Win=65152 Len=17 TSval=3171733432 TSecr=1047473721
1711549211.104295492   530 0.594676318    10.10.1.2 → 10.10.1.1    TCP 83 53120 → 8081 [PSH, ACK] Seq=834 Ack=834 Win=64256 Len=17 TSval=1047473723 TSecr=3171733432
1711549213.104295492   532 0.594777371    10.10.1.1 → 10.10.1.2    TCP 83 8081 → 53120 [PSH, ACK] Seq=834 Ack=851 Win=65152 Len=17 TSval=3171733434 TSecr=1047473723
1711549221.104295492   540 0.595988291    10.10.1.2 → 10.10.1.1    TCP 83 53120 → 8081 [PSH, ACK] Seq=851 Ack=851 Win=64256 Len=17 TSval=1047473724 TSecr=3171733434
1711549223.104295492   542 0.596114018    10.10.1.1 → 10.10.1.2    TCP 83 8081 → 53120 [PSH, ACK] Seq=851 Ack=868 Win=65152 Len=17 TSval=3171733435 TSecr=1047473724
1711549231.104295492   550 0.597328777    10.10.1.2 → 10.10.1.1    TCP 83 53120 → 8081 [PSH, ACK] Seq=868 Ack=868 Win=64256 Len=17 TSval=1047473725 TSecr=3171733435
1711549233.104295492   552 0.597453888    10.10.1.1 → 10.10.1.2    TCP 83 8081 → 53120 [PSH, ACK] Seq=868 Ack=885 Win=65152 Len=17 TSval=3171733436 TSecr=1047473725
1711549241.104295492   560 0.598667076    10.10.1.2 → 10.10.1.1    TCP 83 53120 → 8081 [PSH, ACK] Seq=885 Ack=885 Win=64256 Len=17 TSval=1047473727 TSecr=3171733436
1711549243.104295492   562 0.598768683    10.10.1.1 → 10.10.1.2    TCP 83 8081 → 53120 [PSH, ACK] Seq=885 Ack=902 Win=65152 Len=17 TSval=3171733438 TSecr=1047473727
1711549251.104295492   570 0.599980507    10.10.1.2 → 10.10.1.1    TCP 83 53120 → 8081 [PSH, ACK] Seq=902 Ack=902 Win=64256 Len=17 TSval=1047473728 TSecr=3171733438
1711549253.104295492   572 0.600105092    10.10.1.1 → 10.10.1.2    TCP 83 8081 → 53120 [PSH, ACK] Seq=902 Ack=919 Win=65152 Len=17 TSval=3171733439 TSecr=1047473728
1711549261.104295492   580 0.601318859    10.10.1.2 → 10.10.1.1    TCP 83 53120 → 8081 [PSH, ACK] Seq=919 Ack=919 Win=64256 Len=17 TSval=1047473729 TSecr=3171733439
1711549263.104295492   582 0.601444812    10.10.1.1 → 10.10.1.2    TCP 83 8081 → 53120 [PSH, ACK] Seq=919 Ack=936 Win=65152 Len=17 TSval=3171733440 TSecr=1047473729
1711549271.104295492   590 0.602655768    10.10.1.2 → 10.10.1.1    TCP 83 53120 → 8081 [PSH, ACK] Seq=936 Ack=936 Win=64256 Len=17 TSval=1047473731 TSecr=3171733440
1711549274.104295492   593 0.602785848    10.10.1.1 → 10.10.1.2    TCP 83 8081 → 53120 [PSH, ACK] Seq=936 Ack=953 Win=65152 Len=17 TSval=3171733442 TSecr=1047473731
1711549281.104295492   600 0.603955291    10.10.1.2 → 10.10.1.1    TCP 83 53120 → 8081 [PSH, ACK] Seq=953 Ack=953 Win=64256 Len=17 TSval=1047473732 TSecr=3171733442
1711549283.104295492   602 0.604134803    10.10.1.1 → 10.10.1.2    TCP 83 8081 → 53120 [PSH, ACK] Seq=953 Ack=970 Win=65152 Len=17 TSval=3171733443 TSecr=1047473732
1711549291.104295492   610 0.605350675    10.10.1.2 → 10.10.1.1    TCP 83 53120 → 8081 [PSH, ACK] Seq=970 Ack=970 Win=64256 Len=17 TSval=1047473733 TSecr=3171733443
1711549293.104295492   612 0.605473882    10.10.1.1 → 10.10.1.2    TCP 83 8081 → 53120 [PSH, ACK] Seq=970 Ack=987 Win=65152 Len=17 TSval=3171733444 TSecr=1047473733
1711549301.104295492   620 0.606686704    10.10.1.2 → 10.10.1.1    TCP 83 53120 → 8081 [PSH, ACK] Seq=987 Ack=987 Win=64256 Len=17 TSval=1047473735 TSecr=3171733444
1711549303.104295492   622 0.606780929    10.10.1.1 → 10.10.1.2    TCP 83 8081 → 53120 [PSH, ACK] Seq=987 Ack=1004 Win=65152 Len=17 TSval=3171733446 TSecr=1047473735
1711549311.104295492   630 0.607994225    10.10.1.2 → 10.10.1.1    TCP 83 53120 → 8081 [PSH, ACK] Seq=1004 Ack=1004 Win=64256 Len=17 TSval=1047473736 TSecr=3171733446
1711549313.104295492   632 0.608119409    10.10.1.1 → 10.10.1.2    TCP 83 8081 → 53120 [PSH, ACK] Seq=1004 Ack=1021 Win=65152 Len=17 TSval=3171733447 TSecr=1047473736
1711549321.104295492   640 0.609333976    10.10.1.2 → 10.10.1.1    TCP 83 53120 → 8081 [PSH, ACK] Seq=1021 Ack=1021 Win=64256 Len=17 TSval=1047473737 TSecr=3171733447
1711549323.104295492   642 0.609454207    10.10.1.1 → 10.10.1.2    TCP 83 8081 → 53120 [PSH, ACK] Seq=1021 Ack=1038 Win=65152 Len=17 TSval=3171733448 TSecr=1047473737
1711549331.104295492   650 0.610666992    10.10.1.2 → 10.10.1.1    TCP 83 53120 → 8081 [PSH, ACK] Seq=1038 Ack=1038 Win=64256 Len=17 TSval=1047473739 TSecr=3171733448
1711549333.104295492   652 0.610769173    10.10.1.1 → 10.10.1.2    TCP 83 8081 → 53120 [PSH, ACK] Seq=1038 Ack=1055 Win=65152 Len=17 TSval=3171733450 TSecr=1047473739
1711549341.104295492   660 0.611980890    10.10.1.2 → 10.10.1.1    TCP 83 53120 → 8081 [PSH, ACK] Seq=1055 Ack=1055 Win=64256 Len=17 TSval=1047473740 TSecr=3171733450
1711549343.104295492   662 0.612105776    10.10.1.1 → 10.10.1.2    TCP 83 8081 → 53120 [PSH, ACK] Seq=1055 Ack=1072 Win=65152 Len=17 TSval=3171733451 TSecr=1047473740
1711549351.104295492   670 0.613319982    10.10.1.2 → 10.10.1.1    TCP 83 53120 → 8081 [PSH, ACK] Seq=1072 Ack=1072 Win=64256 Len=17 TSval=1047473741 TSecr=3171733451
1711549353.104295492   672 0.613441405    10.10.1.1 → 10.10.1.2    TCP 83 8081 → 53120 [PSH, ACK] Seq=1072 Ack=1089 Win=65152 Len=17 TSval=3171733452 TSecr=1047473741
1711549361.104295492   680 0.614652879    10.10.1.2 → 10.10.1.1    TCP 83 53120 → 8081 [PSH, ACK] Seq=1089 Ack=1089 Win=64256 Len=17 TSval=1047473743 TSecr=3171733452
1711549363.104295492   682 0.614764704    10.10.1.1 → 10.10.1.2    TCP 83 8081 → 53120 [PSH, ACK] Seq=1089 Ack=1106 Win=65152 Len=17 TSval=3171733454 TSecr=1047473743
1711549371.104295492   690 0.615977887    10.10.1.2 → 10.10.1.1    TCP 83 53120 → 8081 [PSH, ACK] Seq=1106 Ack=1106 Win=64256 Len=17 TSval=1047473744 TSecr=3171733454
1711549373.104295492   692 0.616103313    10.10.1.1 → 10.10.1.2    TCP 83 8081 → 53120 [PSH, ACK] Seq=1106 Ack=1123 Win=65152 Len=17 TSval=3171733455 TSecr=1047473744
1711549382.104295492   701 0.617317776    10.10.1.2 → 10.10.1.1    TCP 83 53120 → 8081 [PSH, ACK] Seq=1123 Ack=1123 Win=64256 Len=17 TSval=1047473745 TSecr=3171733455
1711549384.104295492   703 0.617439982    10.10.1.1 → 10.10.1.2    TCP 83 8081 → 53120 [PSH, ACK] Seq=1123 Ack=1140 Win=65152 Len=17 TSval=3171733456 TSecr=1047473745
1711549391.104295492   710 0.618651389    10.10.1.2 → 10.10.1.1    TCP 83 53120 → 8081 [PSH, ACK] Seq=1140 Ack=1140 Win=64256 Len=17 TSval=1047473747 TSecr=3171733456
1711549393.104295492   712 0.618769105    10.10.1.1 → 10.10.1.2    TCP 83 8081 → 53120 [PSH, ACK] Seq=1140 Ack=1157 Win=65152 Len=17 TSval=3171733458 TSecr=1047473747
1711549402.104295492   721 0.619980324    10.10.1.2 → 10.10.1.1    TCP 83 53120 → 8081 [PSH, ACK] Seq=1157 Ack=1157 Win=64256 Len=17 TSval=1047473748 TSecr=3171733458
1711549404.104295492   723 0.620105246    10.10.1.1 → 10.10.1.2    TCP 83 8081 → 53120 [PSH, ACK] Seq=1157 Ack=1174 Win=65152 Len=17 TSval=3171733459 TSecr=1047473748
1711549411.104295492   730 0.621319650    10.10.1.2 → 10.10.1.1    TCP 83 53120 → 8081 [PSH, ACK] Seq=1174 Ack=1174 Win=64256 Len=17 TSval=1047473749 TSecr=3171733459
1711549413.104295492   732 0.621440519    10.10.1.1 → 10.10.1.2    TCP 83 8081 → 53120 [PSH, ACK] Seq=1174 Ack=1191 Win=65152 Len=17 TSval=3171733460 TSecr=1047473749
1711549421.104295492   740 0.622651269    10.10.1.2 → 10.10.1.1    TCP 83 53120 → 8081 [PSH, ACK] Seq=1191 Ack=1191 Win=64256 Len=17 TSval=1047473751 TSecr=3171733460
1711549424.104295492   743 0.622770150    10.10.1.1 → 10.10.1.2    TCP 83 8081 → 53120 [PSH, ACK] Seq=1191 Ack=1208 Win=65152 Len=17 TSval=3171733462 TSecr=1047473751
1711549431.104295492   750 0.623983390    10.10.1.2 → 10.10.1.1    TCP 83 53120 → 8081 [PSH, ACK] Seq=1208 Ack=1208 Win=64256 Len=17 TSval=1047473752 TSecr=3171733462
1711549433.104295492   752 0.624104289    10.10.1.1 → 10.10.1.2    TCP 83 8081 → 53120 [PSH, ACK] Seq=1208 Ack=1225 Win=65152 Len=17 TSval=3171733463 TSecr=1047473752
1711549441.104295492   760 0.625318920    10.10.1.2 → 10.10.1.1    TCP 83 53120 → 8081 [PSH, ACK] Seq=1225 Ack=1225 Win=64256 Len=17 TSval=1047473753 TSecr=3171733463
1711549443.104295492   762 0.625440989    10.10.1.1 → 10.10.1.2    TCP 83 8081 → 53120 [PSH, ACK] Seq=1225 Ack=1242 Win=65152 Len=17 TSval=3171733464 TSecr=1047473753
1711549451.104295492   770 0.626651989    10.10.1.2 → 10.10.1.1    TCP 83 53120 → 8081 [PSH, ACK] Seq=1242 Ack=1242 Win=64256 Len=17 TSval=1047473755 TSecr=3171733464
1711549453.104295492   772 0.626765807    10.10.1.1 → 10.10.1.2    TCP 83 8081 → 53120 [PSH, ACK] Seq=1242 Ack=1259 Win=65152 Len=17 TSval=3171733466 TSecr=1047473755
1711549461.104295492   780 0.627977225    10.10.1.2 → 10.10.1.1    TCP 83 53120 → 8081 [PSH, ACK] Seq=1259 Ack=1259 Win=64256 Len=17 TSval=1047473756 TSecr=3171733466
1711549463.104295492   782 0.628097997    10.10.1.1 → 10.10.1.2    TCP 83 8081 → 53120 [PSH, ACK] Seq=1259 Ack=1276 Win=65152 Len=17 TSval=3171733467 TSecr=1047473756
1711549471.104295492   790 0.629312866    10.10.1.2 → 10.10.1.1    TCP 83 53120 → 8081 [PSH, ACK] Seq=1276 Ack=1276 Win=64256 Len=17 TSval=1047473757 TSecr=3171733467
1711549473.104295492   792 0.629433531    10.10.1.1 → 10.10.1.2    TCP 83 8081 → 53120 [PSH, ACK] Seq=1276 Ack=1293 Win=65152 Len=17 TSval=3171733468 TSecr=1047473757
1711549481.104295492   800 0.630645005    10.10.1.2 → 10.10.1.1    TCP 83 53120 → 8081 [PSH, ACK] Seq=1293 Ack=1293 Win=64256 Len=17 TSval=1047473759 TSecr=3171733468
1711549483.104295492   802 0.630778695    10.10.1.1 → 10.10.1.2    TCP 83 8081 → 53120 [PSH, ACK] Seq=1293 Ack=1310 Win=65152 Len=17 TSval=3171733470 TSecr=1047473759
1711549491.104295492   810 0.631990332    10.10.1.2 → 10.10.1.1    TCP 83 53120 → 8081 [PSH, ACK] Seq=1310 Ack=1310 Win=64256 Len=17 TSval=1047473760 TSecr=3171733470
1711549493.104295492   812 0.632116150    10.10.1.1 → 10.10.1.2    TCP 83 8081 → 53120 [PSH, ACK] Seq=1310 Ack=1327 Win=65152 Len=17 TSval=3171733471 TSecr=1047473760
1711549501.104295492   820 0.633331097    10.10.1.2 → 10.10.1.1    TCP 83 53120 → 8081 [PSH, ACK] Seq=1327 Ack=1327 Win=64256 Len=17 TSval=1047473761 TSecr=3171733471
1711549503.104295492   822 0.633452133    10.10.1.1 → 10.10.1.2    TCP 83 8081 → 53120 [PSH, ACK] Seq=1327 Ack=1344 Win=65152 Len=17 TSval=3171733472 TSecr=1047473761
1711549511.104295492   830 0.634665986    10.10.1.2 → 10.10.1.1    TCP 83 53120 → 8081 [PSH, ACK] Seq=1344 Ack=1344 Win=64256 Len=17 TSval=1047473763 TSecr=3171733472
1711549513.104295492   832 0.634769672    10.10.1.1 → 10.10.1.2    TCP 83 8081 → 53120 [PSH, ACK] Seq=1344 Ack=1361 Win=65152 Len=17 TSval=3171733474 TSecr=1047473763
1711549521.104295492   840 0.635984145    10.10.1.2 → 10.10.1.1    TCP 83 53120 → 8081 [PSH, ACK] Seq=1361 Ack=1361 Win=64256 Len=17 TSval=1047473764 TSecr=3171733474
1711549523.104295492   842 0.636104707    10.10.1.1 → 10.10.1.2    TCP 83 8081 → 53120 [PSH, ACK] Seq=1361 Ack=1378 Win=65152 Len=17 TSval=3171733475 TSecr=1047473764
1711549531.104295492   850 0.637319370    10.10.1.2 → 10.10.1.1    TCP 83 53120 → 8081 [PSH, ACK] Seq=1378 Ack=1378 Win=64256 Len=17 TSval=1047473765 TSecr=3171733475
1711549533.104295492   852 0.637440671    10.10.1.1 → 10.10.1.2    TCP 83 8081 → 53120 [PSH, ACK] Seq=1378 Ack=1395 Win=65152 Len=17 TSval=3171733476 TSecr=1047473765
1711549541.104295492   860 0.638651821    10.10.1.2 → 10.10.1.1    TCP 83 53120 → 8081 [PSH, ACK] Seq=1395 Ack=1395 Win=64256 Len=17 TSval=1047473767 TSecr=3171733476
1711549544.104295492   863 0.638798778    10.10.1.1 → 10.10.1.2    TCP 83 8081 → 53120 [PSH, ACK] Seq=1395 Ack=1412 Win=65152 Len=17 TSval=3171733478 TSecr=1047473767
1711549551.104295492   870 0.640010532    10.10.1.2 → 10.10.1.1    TCP 83 53120 → 8081 [PSH, ACK] Seq=1412 Ack=1412 Win=64256 Len=17 TSval=1047473768 TSecr=3171733478
1711549553.104295492   872 0.640132268    10.10.1.1 → 10.10.1.2    TCP 83 8081 → 53120 [PSH, ACK] Seq=1412 Ack=1429 Win=65152 Len=17 TSval=3171733479 TSecr=1047473768
1711549561.104295492   880 0.641346477    10.10.1.2 → 10.10.1.1    TCP 83 53120 → 8081 [PSH, ACK] Seq=1429 Ack=1429 Win=64256 Len=17 TSval=1047473769 TSecr=3171733479
1711549563.104295492   882 0.641466792    10.10.1.1 → 10.10.1.2    TCP 83 8081 → 53120 [PSH, ACK] Seq=1429 Ack=1446 Win=65152 Len=17 TSval=3171733480 TSecr=1047473769
1711549571.104295492   890 0.642680541    10.10.1.2 → 10.10.1.1    TCP 83 53120 → 8081 [PSH, ACK] Seq=1446 Ack=1446 Win=64256 Len=17 TSval=1047473771 TSecr=3171733480
1711549573.104295492   892 0.642771505    10.10.1.1 → 10.10.1.2    TCP 83 8081 → 53120 [PSH, ACK] Seq=1446 Ack=1463 Win=65152 Len=17 TSval=3171733482 TSecr=1047473771
1711549582.104295492   901 0.643984644    10.10.1.2 → 10.10.1.1    TCP 83 53120 → 8081 [PSH, ACK] Seq=1463 Ack=1463 Win=64256 Len=17 TSval=1047473772 TSecr=3171733482
1711549584.104295492   903 0.644567900    10.10.1.1 → 10.10.1.2    TCP 83 8081 → 53120 [PSH, ACK] Seq=1463 Ack=1480 Win=65152 Len=17 TSval=3171733483 TSecr=1047473772
1711549591.104295492   910 0.645782763    10.10.1.2 → 10.10.1.1    TCP 83 53120 → 8081 [PSH, ACK] Seq=1480 Ack=1480 Win=64256 Len=17 TSval=1047473774 TSecr=3171733483
1711549593.104295492   912 0.645902959    10.10.1.1 → 10.10.1.2    TCP 83 8081 → 53120 [PSH, ACK] Seq=1480 Ack=1497 Win=65152 Len=17 TSval=3171733485 TSecr=1047473774
1711549601.104295492   920 0.647097637    10.10.1.2 → 10.10.1.1    TCP 83 53120 → 8081 [PSH, ACK] Seq=1497 Ack=1497 Win=64256 Len=17 TSval=1047473775 TSecr=3171733485
1711549603.104295492   922 0.647149679    10.10.1.1 → 10.10.1.2    TCP 83 8081 → 53120 [PSH, ACK] Seq=1497 Ack=1514 Win=65152 Len=17 TSval=3171733486 TSecr=1047473775
1711549611.104295492   930 0.648358646    10.10.1.2 → 10.10.1.1    TCP 83 53120 → 8081 [PSH, ACK] Seq=1514 Ack=1514 Win=64256 Len=17 TSval=1047473776 TSecr=3171733486
1711549613.104295492   932 0.648479875    10.10.1.1 → 10.10.1.2    TCP 83 8081 → 53120 [PSH, ACK] Seq=1514 Ack=1531 Win=65152 Len=17 TSval=3171733487 TSecr=1047473776
1711549621.104295492   940 0.649694138    10.10.1.2 → 10.10.1.1    TCP 83 53120 → 8081 [PSH, ACK] Seq=1531 Ack=1531 Win=64256 Len=17 TSval=1047473778 TSecr=3171733487
1711549623.104295492   942 0.649814527    10.10.1.1 → 10.10.1.2    TCP 83 8081 → 53120 [PSH, ACK] Seq=1531 Ack=1548 Win=65152 Len=17 TSval=3171733489 TSecr=1047473778
1711549631.104295492   950 0.650985158    10.10.1.2 → 10.10.1.1    TCP 83 53120 → 8081 [PSH, ACK] Seq=1548 Ack=1548 Win=64256 Len=17 TSval=1047473779 TSecr=3171733489
1711549633.104295492   952 0.651130179    10.10.1.1 → 10.10.1.2    TCP 83 8081 → 53120 [PSH, ACK] Seq=1548 Ack=1565 Win=65152 Len=17 TSval=3171733490 TSecr=1047473779
1711549641.104295492   960 0.652341916    10.10.1.2 → 10.10.1.1    TCP 83 53120 → 8081 [PSH, ACK] Seq=1565 Ack=1565 Win=64256 Len=17 TSval=1047473780 TSecr=3171733490
1711549643.104295492   962 0.652462159    10.10.1.1 → 10.10.1.2    TCP 83 8081 → 53120 [PSH, ACK] Seq=1565 Ack=1582 Win=65152 Len=17 TSval=3171733491 TSecr=1047473780
1711549651.104295492   970 0.653676815    10.10.1.2 → 10.10.1.1    TCP 83 53120 → 8081 [PSH, ACK] Seq=1582 Ack=1582 Win=64256 Len=17 TSval=1047473782 TSecr=3171733491
1711549653.104295492   972 0.653797356    10.10.1.1 → 10.10.1.2    TCP 83 8081 → 53120 [PSH, ACK] Seq=1582 Ack=1599 Win=65152 Len=17 TSval=3171733493 TSecr=1047473782
1711549661.104295492   980 0.654967158    10.10.1.2 → 10.10.1.1    TCP 83 53120 → 8081 [PSH, ACK] Seq=1599 Ack=1599 Win=64256 Len=17 TSval=1047473783 TSecr=3171733493
1711549663.104295492   982 0.655061296    10.10.1.1 → 10.10.1.2    TCP 83 8081 → 53120 [PSH, ACK] Seq=1599 Ack=1616 Win=65152 Len=17 TSval=3171733494 TSecr=1047473783
1711549671.104295492   990 0.656273677    10.10.1.2 → 10.10.1.1    TCP 83 53120 → 8081 [PSH, ACK] Seq=1616 Ack=1616 Win=64256 Len=17 TSval=1047473784 TSecr=3171733494
1711549673.104295492   992 0.656394338    10.10.1.1 → 10.10.1.2    TCP 83 8081 → 53120 [PSH, ACK] Seq=1616 Ack=1633 Win=65152 Len=17 TSval=3171733495 TSecr=1047473784
1711549681.104295492  1000 0.657608436    10.10.1.2 → 10.10.1.1    TCP 83 53120 → 8081 [PSH, ACK] Seq=1633 Ack=1633 Win=64256 Len=17 TSval=1047473786 TSecr=3171733495
1711549683.104295492  1002 0.657728092    10.10.1.1 → 10.10.1.2    TCP 83 8081 → 53120 [PSH, ACK] Seq=1633 Ack=1650 Win=65152 Len=17 TSval=3171733497 TSecr=1047473786
1711549691.104295492  1010 0.658897956    10.10.1.2 → 10.10.1.1    TCP 83 53120 → 8081 [PSH, ACK] Seq=1650 Ack=1650 Win=64256 Len=17 TSval=1047473787 TSecr=3171733497
1711549693.104295492  1012 0.658981877    10.10.1.1 → 10.10.1.2    TCP 83 8081 → 53120 [PSH, ACK] Seq=1650 Ack=1667 Win=65152 Len=17 TSval=3171733498 TSecr=1047473787
1711549700.104295492  1019 0.660193182    10.10.1.2 → 10.10.1.1    TCP 83 53120 → 8081 [PSH, ACK] Seq=1667 Ack=1667 Win=64256 Len=17 TSval=1047473788 TSecr=3171733498
1711549702.104295492  1021 0.660317280    10.10.1.1 → 10.10.1.2    TCP 83 8081 → 53120 [PSH, ACK] Seq=1667 Ack=1684 Win=65152 Len=17 TSval=3171733499 TSecr=1047473788
1711549710.104295492  1029 0.661531897    10.10.1.2 → 10.10.1.1    TCP 83 53120 → 8081 [PSH, ACK] Seq=1684 Ack=1684 Win=64256 Len=17 TSval=1047473789 TSecr=3171733499
1711549712.104295492  1031 0.661658970    10.10.1.1 → 10.10.1.2    TCP 83 8081 → 53120 [PSH, ACK] Seq=1684 Ack=1701 Win=65152 Len=17 TSval=3171733501 TSecr=1047473789
1711549720.104295492  1039 0.662829305    10.10.1.2 → 10.10.1.1    TCP 83 53120 → 8081 [PSH, ACK] Seq=1701 Ack=1701 Win=64256 Len=17 TSval=1047473791 TSecr=3171733501
1711549722.104295492  1041 0.662914213    10.10.1.1 → 10.10.1.2    TCP 83 8081 → 53120 [PSH, ACK] Seq=1701 Ack=1718 Win=65152 Len=17 TSval=3171733502 TSecr=1047473791
1711549730.104295492  1049 0.664126294    10.10.1.2 → 10.10.1.1    TCP 83 53120 → 8081 [PSH, ACK] Seq=1718 Ack=1718 Win=64256 Len=17 TSval=1047473792 TSecr=3171733502
1711549732.104295492  1051 0.664251030    10.10.1.1 → 10.10.1.2    TCP 83 8081 → 53120 [PSH, ACK] Seq=1718 Ack=1735 Win=65152 Len=17 TSval=3171733503 TSecr=1047473792
1711549740.104295492  1059 0.665464947    10.10.1.2 → 10.10.1.1    TCP 83 53120 → 8081 [PSH, ACK] Seq=1735 Ack=1735 Win=64256 Len=17 TSval=1047473793 TSecr=3171733503
1711549742.104295492  1061 0.665589351    10.10.1.1 → 10.10.1.2    TCP 83 8081 → 53120 [PSH, ACK] Seq=1735 Ack=1752 Win=65152 Len=17 TSval=3171733504 TSecr=1047473793
1711549750.104295492  1069 0.666759842    10.10.1.2 → 10.10.1.1    TCP 83 53120 → 8081 [PSH, ACK] Seq=1752 Ack=1752 Win=64256 Len=17 TSval=1047473795 TSecr=3171733504
1711549752.104295492  1071 0.666845661    10.10.1.1 → 10.10.1.2    TCP 83 8081 → 53120 [PSH, ACK] Seq=1752 Ack=1769 Win=65152 Len=17 TSval=3171733506 TSecr=1047473795
1711549760.104295492  1079 0.668057884    10.10.1.2 → 10.10.1.1    TCP 83 53120 → 8081 [PSH, ACK] Seq=1769 Ack=1769 Win=64256 Len=17 TSval=1047473796 TSecr=3171733506
1711549762.104295492  1081 0.668182375    10.10.1.1 → 10.10.1.2    TCP 83 8081 → 53120 [PSH, ACK] Seq=1769 Ack=1786 Win=65152 Len=17 TSval=3171733507 TSecr=1047473796
1711549770.104295492  1089 0.669398172    10.10.1.2 → 10.10.1.1    TCP 83 53120 → 8081 [PSH, ACK] Seq=1786 Ack=1786 Win=64256 Len=17 TSval=1047473797 TSecr=3171733507
1711549772.104295492  1091 0.669522453    10.10.1.1 → 10.10.1.2    TCP 83 8081 → 53120 [PSH, ACK] Seq=1786 Ack=1803 Win=65152 Len=17 TSval=3171733508 TSecr=1047473797
1711549780.104295492  1099 0.670709097    10.10.1.2 → 10.10.1.1    TCP 83 53120 → 8081 [PSH, ACK] Seq=1803 Ack=1803 Win=64256 Len=17 TSval=1047473799 TSecr=3171733508
1711549782.104295492  1101 0.670799422    10.10.1.1 → 10.10.1.2    TCP 83 8081 → 53120 [PSH, ACK] Seq=1803 Ack=1820 Win=65152 Len=17 TSval=3171733510 TSecr=1047473799
1711549789.104295492  1108 0.672010985    10.10.1.2 → 10.10.1.1    TCP 83 53120 → 8081 [PSH, ACK] Seq=1820 Ack=1820 Win=64256 Len=17 TSval=1047473800 TSecr=3171733510
1711549791.104295492  1110 0.672135627    10.10.1.1 → 10.10.1.2    TCP 83 8081 → 53120 [PSH, ACK] Seq=1820 Ack=1837 Win=65152 Len=17 TSval=3171733511 TSecr=1047473800
1711549799.104295492  1118 0.673349628    10.10.1.2 → 10.10.1.1    TCP 83 53120 → 8081 [PSH, ACK] Seq=1837 Ack=1837 Win=64256 Len=17 TSval=1047473801 TSecr=3171733511
1711549801.104295492  1120 0.673473927    10.10.1.1 → 10.10.1.2    TCP 83 8081 → 53120 [PSH, ACK] Seq=1837 Ack=1854 Win=65152 Len=17 TSval=3171733512 TSecr=1047473801
1711549809.104295492  1128 0.674690567    10.10.1.2 → 10.10.1.1    TCP 83 53120 → 8081 [PSH, ACK] Seq=1854 Ack=1854 Win=64256 Len=17 TSval=1047473803 TSecr=3171733512
1711549812.104295492  1131 0.674826026    10.10.1.1 → 10.10.1.2    TCP 83 8081 → 53120 [PSH, ACK] Seq=1854 Ack=1871 Win=65152 Len=17 TSval=3171733514 TSecr=1047473803
1711549819.104295492  1138 0.676037717    10.10.1.2 → 10.10.1.1    TCP 83 53120 → 8081 [PSH, ACK] Seq=1871 Ack=1871 Win=64256 Len=17 TSval=1047473804 TSecr=3171733514
1711549821.104295492  1140 0.676157913    10.10.1.1 → 10.10.1.2    TCP 83 8081 → 53120 [PSH, ACK] Seq=1871 Ack=1888 Win=65152 Len=17 TSval=3171733515 TSecr=1047473804
1711549829.104295492  1148 0.677371706    10.10.1.2 → 10.10.1.1    TCP 83 53120 → 8081 [PSH, ACK] Seq=1888 Ack=1888 Win=64256 Len=17 TSval=1047473805 TSecr=3171733515
1711549831.104295492  1150 0.677493447    10.10.1.1 → 10.10.1.2    TCP 83 8081 → 53120 [PSH, ACK] Seq=1888 Ack=1905 Win=65152 Len=17 TSval=3171733516 TSecr=1047473805
1711549840.104295492  1159 0.678732207    10.10.1.2 → 10.10.1.1    TCP 83 53120 → 8081 [PSH, ACK] Seq=1905 Ack=1905 Win=64256 Len=17 TSval=1047473807 TSecr=3171733516
1711549842.104295492  1161 0.678814942    10.10.1.1 → 10.10.1.2    TCP 83 8081 → 53120 [PSH, ACK] Seq=1905 Ack=1922 Win=65152 Len=17 TSval=3171733518 TSecr=1047473807
1711549849.104295492  1168 0.680026763    10.10.1.2 → 10.10.1.1    TCP 83 53120 → 8081 [PSH, ACK] Seq=1922 Ack=1922 Win=64256 Len=17 TSval=1047473808 TSecr=3171733518
1711549852.104295492  1171 0.680205041    10.10.1.1 → 10.10.1.2    TCP 83 8081 → 53120 [PSH, ACK] Seq=1922 Ack=1939 Win=65152 Len=17 TSval=3171733519 TSecr=1047473808
1711549859.104295492  1178 0.681420182    10.10.1.2 → 10.10.1.1    TCP 83 53120 → 8081 [PSH, ACK] Seq=1939 Ack=1939 Win=64256 Len=17 TSval=1047473809 TSecr=3171733519
1711549861.104295492  1180 0.681544868    10.10.1.1 → 10.10.1.2    TCP 83 8081 → 53120 [PSH, ACK] Seq=1939 Ack=1956 Win=65152 Len=17 TSval=3171733520 TSecr=1047473809
1711549869.104295492  1188 0.682758478    10.10.1.2 → 10.10.1.1    TCP 83 53120 → 8081 [PSH, ACK] Seq=1956 Ack=1956 Win=64256 Len=17 TSval=1047473811 TSecr=3171733520
1711549872.104295492  1191 0.682889426    10.10.1.1 → 10.10.1.2    TCP 83 8081 → 53120 [PSH, ACK] Seq=1956 Ack=1973 Win=65152 Len=17 TSval=3171733522 TSecr=1047473811
1711549879.104295492  1198 0.684101641    10.10.1.2 → 10.10.1.1    TCP 83 53120 → 8081 [PSH, ACK] Seq=1973 Ack=1973 Win=64256 Len=17 TSval=1047473812 TSecr=3171733522
1711549881.104295492  1200 0.684222609    10.10.1.1 → 10.10.1.2    TCP 83 8081 → 53120 [PSH, ACK] Seq=1973 Ack=1990 Win=65152 Len=17 TSval=3171733523 TSecr=1047473812
1711549889.104295492  1208 0.685437607    10.10.1.2 → 10.10.1.1    TCP 83 53120 → 8081 [PSH, ACK] Seq=1990 Ack=1990 Win=64256 Len=17 TSval=1047473813 TSecr=3171733523
1711549891.104295492  1210 0.685558561    10.10.1.1 → 10.10.1.2    TCP 83 8081 → 53120 [PSH, ACK] Seq=1990 Ack=2007 Win=65152 Len=17 TSval=3171733524 TSecr=1047473813
