1711546159.955795288    34 0.535842649    10.10.1.2 → 10.10.1.1    TCP 83 42594 → 8081 [PSH, ACK] Seq=1 Ack=1 Win=64256 Len=17 TSval=1044918575 TSecr=3169178030
1711546163.955795288    38 0.536153043    10.10.1.1 → 10.10.1.2    TCP 83 8081 → 42594 [PSH, ACK] Seq=1 Ack=18 Win=65152 Len=17 TSval=3169178284 TSecr=1044918575
1711546171.955795288    46 0.543041911    10.10.1.2 → 10.10.1.1    TCP 83 42594 → 8081 [PSH, ACK] Seq=18 Ack=18 Win=64256 Len=17 TSval=1044918582 TSecr=3169178284
1711546174.955795288    49 0.543167553    10.10.1.1 → 10.10.1.2    TCP 83 8081 → 42594 [PSH, ACK] Seq=18 Ack=35 Win=65152 Len=17 TSval=3169178291 TSecr=1044918582
1711546181.955795288    56 0.544280893    10.10.1.2 → 10.10.1.1    TCP 83 42594 → 8081 [PSH, ACK] Seq=35 Ack=35 Win=64256 Len=17 TSval=1044918583 TSecr=3169178291
1711546184.955795288    59 0.544406335    10.10.1.1 → 10.10.1.2    TCP 83 8081 → 42594 [PSH, ACK] Seq=35 Ack=52 Win=65152 Len=17 TSval=3169178292 TSecr=1044918583
1711546191.955795288    66 0.554464410    10.10.1.2 → 10.10.1.1    TCP 83 42594 → 8081 [PSH, ACK] Seq=52 Ack=52 Win=64256 Len=17 TSval=1044918594 TSecr=3169178292
1711546194.955795288    69 0.554595293    10.10.1.1 → 10.10.1.2    TCP 83 8081 → 42594 [PSH, ACK] Seq=52 Ack=69 Win=65152 Len=17 TSval=3169178302 TSecr=1044918594
1711546201.955795288    76 0.570736405    10.10.1.2 → 10.10.1.1    TCP 83 42594 → 8081 [PSH, ACK] Seq=69 Ack=69 Win=64256 Len=17 TSval=1044918610 TSecr=3169178302
1711546204.955795288    79 0.570869116    10.10.1.1 → 10.10.1.2    TCP 83 8081 → 42594 [PSH, ACK] Seq=69 Ack=86 Win=65152 Len=17 TSval=3169178318 TSecr=1044918610
1711546211.955795288    86 0.590607365    10.10.1.2 → 10.10.1.1    TCP 83 42594 → 8081 [PSH, ACK] Seq=86 Ack=86 Win=64256 Len=17 TSval=1044918630 TSecr=3169178318
1711546214.955795288    89 0.590739327    10.10.1.1 → 10.10.1.2    TCP 83 8081 → 42594 [PSH, ACK] Seq=86 Ack=103 Win=65152 Len=17 TSval=3169178338 TSecr=1044918630
1711546221.955795288    96 0.594395745    10.10.1.2 → 10.10.1.1    TCP 83 42594 → 8081 [PSH, ACK] Seq=103 Ack=103 Win=64256 Len=17 TSval=1044918634 TSecr=3169178338
1711546224.955795288    99 0.594527438    10.10.1.1 → 10.10.1.2    TCP 83 8081 → 42594 [PSH, ACK] Seq=103 Ack=120 Win=65152 Len=17 TSval=3169178342 TSecr=1044918634
1711546231.955795288   106 0.601737585    10.10.1.2 → 10.10.1.1    TCP 83 42594 → 8081 [PSH, ACK] Seq=120 Ack=120 Win=64256 Len=17 TSval=1044918641 TSecr=3169178342
1711546234.955795288   109 0.601868662    10.10.1.1 → 10.10.1.2    TCP 83 8081 → 42594 [PSH, ACK] Seq=120 Ack=137 Win=65152 Len=17 TSval=3169178349 TSecr=1044918641
1711546241.955795288   116 0.605822760    10.10.1.2 → 10.10.1.1    TCP 83 42594 → 8081 [PSH, ACK] Seq=137 Ack=137 Win=64256 Len=17 TSval=1044918645 TSecr=3169178349
1711546244.955795288   119 0.605953131    10.10.1.1 → 10.10.1.2    TCP 83 8081 → 42594 [PSH, ACK] Seq=137 Ack=154 Win=65152 Len=17 TSval=3169178353 TSecr=1044918645
1711546251.955795288   126 0.640217746    10.10.1.2 → 10.10.1.1    TCP 83 42594 → 8081 [PSH, ACK] Seq=154 Ack=154 Win=64256 Len=17 TSval=1044918679 TSecr=3169178353
1711546254.955795288   129 0.640348687    10.10.1.1 → 10.10.1.2    TCP 83 8081 → 42594 [PSH, ACK] Seq=154 Ack=171 Win=65152 Len=17 TSval=3169178388 TSecr=1044918679
1711546261.955795288   136 0.668988036    10.10.1.2 → 10.10.1.1    TCP 83 42594 → 8081 [PSH, ACK] Seq=171 Ack=171 Win=64256 Len=17 TSval=1044918708 TSecr=3169178388
1711546264.955795288   139 0.669119122    10.10.1.1 → 10.10.1.2    TCP 83 8081 → 42594 [PSH, ACK] Seq=171 Ack=188 Win=65152 Len=17 TSval=3169178417 TSecr=1044918708
1711546271.955795288   146 0.683800149    10.10.1.2 → 10.10.1.1    TCP 83 42594 → 8081 [PSH, ACK] Seq=188 Ack=188 Win=64256 Len=17 TSval=1044918723 TSecr=3169178417
1711546273.955795288   148 0.683935008    10.10.1.1 → 10.10.1.2    TCP 83 8081 → 42594 [PSH, ACK] Seq=188 Ack=205 Win=65152 Len=17 TSval=3169178431 TSecr=1044918723
1711546281.955795288   156 0.701810035    10.10.1.2 → 10.10.1.1    TCP 83 42594 → 8081 [PSH, ACK] Seq=205 Ack=205 Win=64256 Len=17 TSval=1044918741 TSecr=3169178431
1711546283.955795288   158 0.701945961    10.10.1.1 → 10.10.1.2    TCP 83 8081 → 42594 [PSH, ACK] Seq=205 Ack=222 Win=65152 Len=17 TSval=3169178449 TSecr=1044918741
1711546291.955795288   166 0.706340822    10.10.1.2 → 10.10.1.1    TCP 83 42594 → 8081 [PSH, ACK] Seq=222 Ack=222 Win=64256 Len=17 TSval=1044918746 TSecr=3169178449
1711546293.955795288   168 0.706475191    10.10.1.1 → 10.10.1.2    TCP 83 8081 → 42594 [PSH, ACK] Seq=222 Ack=239 Win=65152 Len=17 TSval=3169178454 TSecr=1044918746
1711546301.955795288   176 0.712515706    10.10.1.2 → 10.10.1.1    TCP 83 42594 → 8081 [PSH, ACK] Seq=239 Ack=239 Win=64256 Len=17 TSval=1044918752 TSecr=3169178454
1711546303.955795288   178 0.712658967    10.10.1.1 → 10.10.1.2    TCP 83 8081 → 42594 [PSH, ACK] Seq=239 Ack=256 Win=65152 Len=17 TSval=3169178460 TSecr=1044918752
1711546311.955795288   186 0.739468777    10.10.1.2 → 10.10.1.1    TCP 83 42594 → 8081 [PSH, ACK] Seq=256 Ack=256 Win=64256 Len=17 TSval=1044918779 TSecr=3169178460
1711546313.955795288   188 0.739607833    10.10.1.1 → 10.10.1.2    TCP 83 8081 → 42594 [PSH, ACK] Seq=256 Ack=273 Win=65152 Len=17 TSval=3169178487 TSecr=1044918779
1711546321.955795288   196 0.741506704    10.10.1.2 → 10.10.1.1    TCP 83 42594 → 8081 [PSH, ACK] Seq=273 Ack=273 Win=64256 Len=17 TSval=1044918781 TSecr=3169178487
1711546323.955795288   198 0.741638270    10.10.1.1 → 10.10.1.2    TCP 83 8081 → 42594 [PSH, ACK] Seq=273 Ack=290 Win=65152 Len=17 TSval=3169178489 TSecr=1044918781
1711546331.955795288   206 0.755349633    10.10.1.2 → 10.10.1.1    TCP 83 42594 → 8081 [PSH, ACK] Seq=290 Ack=290 Win=64256 Len=17 TSval=1044918795 TSecr=3169178489
1711546333.955795288   208 0.755485491    10.10.1.1 → 10.10.1.2    TCP 83 8081 → 42594 [PSH, ACK] Seq=290 Ack=307 Win=65152 Len=17 TSval=3169178503 TSecr=1044918795
1711546341.955795288   216 0.766742216    10.10.1.2 → 10.10.1.1    TCP 83 42594 → 8081 [PSH, ACK] Seq=307 Ack=307 Win=64256 Len=17 TSval=1044918806 TSecr=3169178503
1711546343.955795288   218 0.766877921    10.10.1.1 → 10.10.1.2    TCP 83 8081 → 42594 [PSH, ACK] Seq=307 Ack=324 Win=65152 Len=17 TSval=3169178514 TSecr=1044918806
1711546351.955795288   226 0.769192524    10.10.1.2 → 10.10.1.1    TCP 83 42594 → 8081 [PSH, ACK] Seq=324 Ack=324 Win=64256 Len=17 TSval=1044918808 TSecr=3169178514
1711546353.955795288   228 0.769326259    10.10.1.1 → 10.10.1.2    TCP 83 8081 → 42594 [PSH, ACK] Seq=324 Ack=341 Win=65152 Len=17 TSval=3169178517 TSecr=1044918808
1711546363.955795288   238 0.770093871    10.10.1.2 → 10.10.1.1    TCP 83 42594 → 8081 [PSH, ACK] Seq=341 Ack=341 Win=64256 Len=17 TSval=1044918809 TSecr=3169178517
1711546365.955795288   240 0.770228553    10.10.1.1 → 10.10.1.2    TCP 83 8081 → 42594 [PSH, ACK] Seq=341 Ack=358 Win=65152 Len=17 TSval=3169178518 TSecr=1044918809
1711546373.955795288   248 0.779738878    10.10.1.2 → 10.10.1.1    TCP 83 42594 → 8081 [PSH, ACK] Seq=358 Ack=358 Win=64256 Len=17 TSval=1044918819 TSecr=3169178518
1711546375.955795288   250 0.779873664    10.10.1.1 → 10.10.1.2    TCP 83 8081 → 42594 [PSH, ACK] Seq=358 Ack=375 Win=65152 Len=17 TSval=3169178527 TSecr=1044918819
1711546383.955795288   258 0.790677293    10.10.1.2 → 10.10.1.1    TCP 83 42594 → 8081 [PSH, ACK] Seq=375 Ack=375 Win=64256 Len=17 TSval=1044918830 TSecr=3169178527
1711546385.955795288   260 0.790814599    10.10.1.1 → 10.10.1.2    TCP 83 8081 → 42594 [PSH, ACK] Seq=375 Ack=392 Win=65152 Len=17 TSval=3169178538 TSecr=1044918830
1711546393.955795288   268 0.791869661    10.10.1.2 → 10.10.1.1    TCP 83 42594 → 8081 [PSH, ACK] Seq=392 Ack=392 Win=64256 Len=17 TSval=1044918831 TSecr=3169178538
1711546395.955795288   270 0.791999242    10.10.1.1 → 10.10.1.2    TCP 83 8081 → 42594 [PSH, ACK] Seq=392 Ack=409 Win=65152 Len=17 TSval=3169178540 TSecr=1044918831
1711546403.955795288   278 0.793299865    10.10.1.2 → 10.10.1.1    TCP 83 42594 → 8081 [PSH, ACK] Seq=409 Ack=409 Win=64256 Len=17 TSval=1044918833 TSecr=3169178540
1711546405.955795288   280 0.793426850    10.10.1.1 → 10.10.1.2    TCP 83 8081 → 42594 [PSH, ACK] Seq=409 Ack=426 Win=65152 Len=17 TSval=3169178541 TSecr=1044918833
1711546413.955795288   288 0.801839550    10.10.1.2 → 10.10.1.1    TCP 83 42594 → 8081 [PSH, ACK] Seq=426 Ack=426 Win=64256 Len=17 TSval=1044918841 TSecr=3169178541
1711546415.955795288   290 0.801991232    10.10.1.1 → 10.10.1.2    TCP 83 8081 → 42594 [PSH, ACK] Seq=426 Ack=443 Win=65152 Len=17 TSval=3169178549 TSecr=1044918841
1711546423.955795288   298 0.807850775    10.10.1.2 → 10.10.1.1    TCP 83 42594 → 8081 [PSH, ACK] Seq=443 Ack=443 Win=64256 Len=17 TSval=1044918847 TSecr=3169178549
1711546425.955795288   300 0.807987131    10.10.1.1 → 10.10.1.2    TCP 83 8081 → 42594 [PSH, ACK] Seq=443 Ack=460 Win=65152 Len=17 TSval=3169178556 TSecr=1044918847
1711546433.955795288   308 0.830884847    10.10.1.2 → 10.10.1.1    TCP 83 42594 → 8081 [PSH, ACK] Seq=460 Ack=460 Win=64256 Len=17 TSval=1044918870 TSecr=3169178556
1711546435.955795288   310 0.831019989    10.10.1.1 → 10.10.1.2    TCP 83 8081 → 42594 [PSH, ACK] Seq=460 Ack=477 Win=65152 Len=17 TSval=3169178579 TSecr=1044918870
1711546443.955795288   318 0.845337274    10.10.1.2 → 10.10.1.1    TCP 83 42594 → 8081 [PSH, ACK] Seq=477 Ack=477 Win=64256 Len=17 TSval=1044918885 TSecr=3169178579
1711546445.955795288   320 0.845472231    10.10.1.1 → 10.10.1.2    TCP 83 8081 → 42594 [PSH, ACK] Seq=477 Ack=494 Win=65152 Len=17 TSval=3169178593 TSecr=1044918885
1711546453.955795288   328 0.846854184    10.10.1.2 → 10.10.1.1    TCP 83 42594 → 8081 [PSH, ACK] Seq=494 Ack=494 Win=64256 Len=17 TSval=1044918886 TSecr=3169178593
1711546455.955795288   330 0.846992609    10.10.1.1 → 10.10.1.2    TCP 83 8081 → 42594 [PSH, ACK] Seq=494 Ack=511 Win=65152 Len=17 TSval=3169178595 TSecr=1044918886
1711546463.955795288   338 0.853656951    10.10.1.2 → 10.10.1.1    TCP 83 42594 → 8081 [PSH, ACK] Seq=511 Ack=511 Win=64256 Len=17 TSval=1044918893 TSecr=3169178595
1711546465.955795288   340 0.853792073    10.10.1.1 → 10.10.1.2    TCP 83 8081 → 42594 [PSH, ACK] Seq=511 Ack=528 Win=65152 Len=17 TSval=3169178601 TSecr=1044918893
1711546473.955795288   348 0.855168610    10.10.1.2 → 10.10.1.1    TCP 83 42594 → 8081 [PSH, ACK] Seq=528 Ack=528 Win=64256 Len=17 TSval=1044918894 TSecr=3169178601
1711546475.955795288   350 0.855302812    10.10.1.1 → 10.10.1.2    TCP 83 8081 → 42594 [PSH, ACK] Seq=528 Ack=545 Win=65152 Len=17 TSval=3169178603 TSecr=1044918894
1711546483.955795288   358 0.864596437    10.10.1.2 → 10.10.1.1    TCP 83 42594 → 8081 [PSH, ACK] Seq=545 Ack=545 Win=64256 Len=17 TSval=1044918904 TSecr=3169178603
1711546485.955795288   360 0.864727034    10.10.1.1 → 10.10.1.2    TCP 83 8081 → 42594 [PSH, ACK] Seq=545 Ack=562 Win=65152 Len=17 TSval=3169178612 TSecr=1044918904
1711546493.955795288   368 0.873174460    10.10.1.2 → 10.10.1.1    TCP 83 42594 → 8081 [PSH, ACK] Seq=562 Ack=562 Win=64256 Len=17 TSval=1044918912 TSecr=3169178612
1711546495.955795288   370 0.873309685    10.10.1.1 → 10.10.1.2    TCP 83 8081 → 42594 [PSH, ACK] Seq=562 Ack=579 Win=65152 Len=17 TSval=3169178621 TSecr=1044918912
1711546503.955795288   378 0.886830314    10.10.1.2 → 10.10.1.1    TCP 83 42594 → 8081 [PSH, ACK] Seq=579 Ack=579 Win=64256 Len=17 TSval=1044918926 TSecr=3169178621
1711546505.955795288   380 0.886966886    10.10.1.1 → 10.10.1.2    TCP 83 8081 → 42594 [PSH, ACK] Seq=579 Ack=596 Win=65152 Len=17 TSval=3169178634 TSecr=1044918926
1711546513.955795288   388 0.892179527    10.10.1.2 → 10.10.1.1    TCP 83 42594 → 8081 [PSH, ACK] Seq=596 Ack=596 Win=64256 Len=17 TSval=1044918931 TSecr=3169178634
1711546515.955795288   390 0.892315486    10.10.1.1 → 10.10.1.2    TCP 83 8081 → 42594 [PSH, ACK] Seq=596 Ack=613 Win=65152 Len=17 TSval=3169178640 TSecr=1044918931
1711546523.955795288   398 0.897964641    10.10.1.2 → 10.10.1.1    TCP 83 42594 → 8081 [PSH, ACK] Seq=613 Ack=613 Win=64256 Len=17 TSval=1044918937 TSecr=3169178640
1711546525.955795288   400 0.898101040    10.10.1.1 → 10.10.1.2    TCP 83 8081 → 42594 [PSH, ACK] Seq=613 Ack=630 Win=65152 Len=17 TSval=3169178646 TSecr=1044918937
1711546533.955795288   408 0.898532170    10.10.1.2 → 10.10.1.1    TCP 83 42594 → 8081 [PSH, ACK] Seq=630 Ack=630 Win=64256 Len=17 TSval=1044918938 TSecr=3169178646
1711546535.955795288   410 0.898567903    10.10.1.1 → 10.10.1.2    TCP 83 8081 → 42594 [PSH, ACK] Seq=630 Ack=647 Win=65152 Len=17 TSval=3169178646 TSecr=1044918938
1711546543.955795288   418 0.921425572    10.10.1.2 → 10.10.1.1    TCP 83 42594 → 8081 [PSH, ACK] Seq=647 Ack=647 Win=64256 Len=17 TSval=1044918961 TSecr=3169178646
1711546545.955795288   420 0.921562344    10.10.1.1 → 10.10.1.2    TCP 83 8081 → 42594 [PSH, ACK] Seq=647 Ack=664 Win=65152 Len=17 TSval=3169178669 TSecr=1044918961
1711546553.955795288   428 0.934904397    10.10.1.2 → 10.10.1.1    TCP 83 42594 → 8081 [PSH, ACK] Seq=664 Ack=664 Win=64256 Len=17 TSval=1044918974 TSecr=3169178669
1711546555.955795288   430 0.935039844    10.10.1.1 → 10.10.1.2    TCP 83 8081 → 42594 [PSH, ACK] Seq=664 Ack=681 Win=65152 Len=17 TSval=3169178683 TSecr=1044918974
1711546565.955795288   440 0.985211989    10.10.1.2 → 10.10.1.1    TCP 83 42594 → 8081 [PSH, ACK] Seq=681 Ack=681 Win=64256 Len=17 TSval=1044919024 TSecr=3169178683
1711546567.955795288   442 0.985342117    10.10.1.1 → 10.10.1.2    TCP 83 8081 → 42594 [PSH, ACK] Seq=681 Ack=698 Win=65152 Len=17 TSval=3169178733 TSecr=1044919024
1711546576.955795288   451 1.003751985    10.10.1.2 → 10.10.1.1    TCP 83 42594 → 8081 [PSH, ACK] Seq=698 Ack=698 Win=64256 Len=17 TSval=1044919043 TSecr=3169178733
1711546578.955795288   453 1.003881922    10.10.1.1 → 10.10.1.2    TCP 83 8081 → 42594 [PSH, ACK] Seq=698 Ack=715 Win=65152 Len=17 TSval=3169178751 TSecr=1044919043
1711546586.955795288   461 1.010939227    10.10.1.2 → 10.10.1.1    TCP 83 42594 → 8081 [PSH, ACK] Seq=715 Ack=715 Win=64256 Len=17 TSval=1044919050 TSecr=3169178751
1711546588.955795288   463 1.011072542    10.10.1.1 → 10.10.1.2    TCP 83 8081 → 42594 [PSH, ACK] Seq=715 Ack=732 Win=65152 Len=17 TSval=3169178759 TSecr=1044919050
1711546596.955795288   471 1.028557225    10.10.1.2 → 10.10.1.1    TCP 83 42594 → 8081 [PSH, ACK] Seq=732 Ack=732 Win=64256 Len=17 TSval=1044919068 TSecr=3169178759
1711546598.955795288   473 1.028695302    10.10.1.1 → 10.10.1.2    TCP 83 8081 → 42594 [PSH, ACK] Seq=732 Ack=749 Win=65152 Len=17 TSval=3169178776 TSecr=1044919068
1711546606.955795288   481 1.030888706    10.10.1.2 → 10.10.1.1    TCP 83 42594 → 8081 [PSH, ACK] Seq=749 Ack=749 Win=64256 Len=17 TSval=1044919070 TSecr=3169178776
1711546608.955795288   483 1.031024148    10.10.1.1 → 10.10.1.2    TCP 83 8081 → 42594 [PSH, ACK] Seq=749 Ack=766 Win=65152 Len=17 TSval=3169178779 TSecr=1044919070
1711546617.955795288   492 1.058827017    10.10.1.2 → 10.10.1.1    TCP 83 42594 → 8081 [PSH, ACK] Seq=766 Ack=766 Win=64256 Len=17 TSval=1044919098 TSecr=3169178779
1711546619.955795288   494 1.058962198    10.10.1.1 → 10.10.1.2    TCP 83 8081 → 42594 [PSH, ACK] Seq=766 Ack=783 Win=65152 Len=17 TSval=3169178806 TSecr=1044919098
1711546627.955795288   502 1.073129650    10.10.1.2 → 10.10.1.1    TCP 83 42594 → 8081 [PSH, ACK] Seq=783 Ack=783 Win=64256 Len=17 TSval=1044919112 TSecr=3169178806
1711546629.955795288   504 1.073268072    10.10.1.1 → 10.10.1.2    TCP 83 8081 → 42594 [PSH, ACK] Seq=783 Ack=800 Win=65152 Len=17 TSval=3169178821 TSecr=1044919112
1711546637.955795288   512 1.077550935    10.10.1.2 → 10.10.1.1    TCP 83 42594 → 8081 [PSH, ACK] Seq=800 Ack=800 Win=64256 Len=17 TSval=1044919117 TSecr=3169178821
1711546639.955795288   514 1.077687947    10.10.1.1 → 10.10.1.2    TCP 83 8081 → 42594 [PSH, ACK] Seq=800 Ack=817 Win=65152 Len=17 TSval=3169178825 TSecr=1044919117
1711546647.955795288   522 1.089211146    10.10.1.2 → 10.10.1.1    TCP 83 42594 → 8081 [PSH, ACK] Seq=817 Ack=817 Win=64256 Len=17 TSval=1044919128 TSecr=3169178825
1711546649.955795288   524 1.089345947    10.10.1.1 → 10.10.1.2    TCP 83 8081 → 42594 [PSH, ACK] Seq=817 Ack=834 Win=65152 Len=17 TSval=3169178837 TSecr=1044919128
1711546657.955795288   532 1.095021725    10.10.1.2 → 10.10.1.1    TCP 83 42594 → 8081 [PSH, ACK] Seq=834 Ack=834 Win=64256 Len=17 TSval=1044919134 TSecr=3169178837
1711546659.955795288   534 1.095157620    10.10.1.1 → 10.10.1.2    TCP 83 8081 → 42594 [PSH, ACK] Seq=834 Ack=851 Win=65152 Len=17 TSval=3169178843 TSecr=1044919134
1711546667.955795288   542 1.102784002    10.10.1.2 → 10.10.1.1    TCP 83 42594 → 8081 [PSH, ACK] Seq=851 Ack=851 Win=64256 Len=17 TSval=1044919142 TSecr=3169178843
1711546669.955795288   544 1.102920607    10.10.1.1 → 10.10.1.2    TCP 83 8081 → 42594 [PSH, ACK] Seq=851 Ack=868 Win=65152 Len=17 TSval=3169178850 TSecr=1044919142
1711546677.955795288   552 1.116241766    10.10.1.2 → 10.10.1.1    TCP 83 42594 → 8081 [PSH, ACK] Seq=868 Ack=868 Win=64256 Len=17 TSval=1044919155 TSecr=3169178850
1711546679.955795288   554 1.116378539    10.10.1.1 → 10.10.1.2    TCP 83 8081 → 42594 [PSH, ACK] Seq=868 Ack=885 Win=65152 Len=17 TSval=3169178864 TSecr=1044919155
1711546687.955795288   562 1.116802661    10.10.1.2 → 10.10.1.1    TCP 83 42594 → 8081 [PSH, ACK] Seq=885 Ack=885 Win=64256 Len=17 TSval=1044919156 TSecr=3169178864
1711546689.955795288   564 1.116835298    10.10.1.1 → 10.10.1.2    TCP 83 8081 → 42594 [PSH, ACK] Seq=885 Ack=902 Win=65152 Len=17 TSval=3169178864 TSecr=1044919156
1711546697.955795288   572 1.118981813    10.10.1.2 → 10.10.1.1    TCP 83 42594 → 8081 [PSH, ACK] Seq=902 Ack=902 Win=64256 Len=17 TSval=1044919158 TSecr=3169178864
1711546699.955795288   574 1.119117351    10.10.1.1 → 10.10.1.2    TCP 83 8081 → 42594 [PSH, ACK] Seq=902 Ack=919 Win=65152 Len=17 TSval=3169178867 TSecr=1044919158
1711546707.955795288   582 1.135969328    10.10.1.2 → 10.10.1.1    TCP 83 42594 → 8081 [PSH, ACK] Seq=919 Ack=919 Win=64256 Len=17 TSval=1044919175 TSecr=3169178867
1711546709.955795288   584 1.136106120    10.10.1.1 → 10.10.1.2    TCP 83 8081 → 42594 [PSH, ACK] Seq=919 Ack=936 Win=65152 Len=17 TSval=3169178884 TSecr=1044919175
1711546717.955795288   592 1.137681526    10.10.1.2 → 10.10.1.1    TCP 83 42594 → 8081 [PSH, ACK] Seq=936 Ack=936 Win=64256 Len=17 TSval=1044919177 TSecr=3169178884
1711546719.955795288   594 1.137812625    10.10.1.1 → 10.10.1.2    TCP 83 8081 → 42594 [PSH, ACK] Seq=936 Ack=953 Win=65152 Len=17 TSval=3169178885 TSecr=1044919177
1711546727.955795288   602 1.151320631    10.10.1.2 → 10.10.1.1    TCP 83 42594 → 8081 [PSH, ACK] Seq=953 Ack=953 Win=64256 Len=17 TSval=1044919191 TSecr=3169178885
1711546730.955795288   605 1.151530054    10.10.1.1 → 10.10.1.2    TCP 83 8081 → 42594 [PSH, ACK] Seq=953 Ack=970 Win=65152 Len=17 TSval=3169178899 TSecr=1044919191
1711546737.955795288   612 1.154514804    10.10.1.2 → 10.10.1.1    TCP 83 42594 → 8081 [PSH, ACK] Seq=970 Ack=970 Win=64256 Len=17 TSval=1044919194 TSecr=3169178899
1711546739.955795288   614 1.154649853    10.10.1.1 → 10.10.1.2    TCP 83 8081 → 42594 [PSH, ACK] Seq=970 Ack=987 Win=65152 Len=17 TSval=3169178902 TSecr=1044919194
1711546747.955795288   622 1.155065723    10.10.1.2 → 10.10.1.1    TCP 83 42594 → 8081 [PSH, ACK] Seq=987 Ack=987 Win=64256 Len=17 TSval=1044919194 TSecr=3169178902
1711546749.955795288   624 1.155098856    10.10.1.1 → 10.10.1.2    TCP 83 8081 → 42594 [PSH, ACK] Seq=987 Ack=1004 Win=65152 Len=17 TSval=3169178903 TSecr=1044919194
1711546757.955795288   632 1.162065118    10.10.1.2 → 10.10.1.1    TCP 83 42594 → 8081 [PSH, ACK] Seq=1004 Ack=1004 Win=64256 Len=17 TSval=1044919201 TSecr=3169178903
1711546759.955795288   634 1.162199903    10.10.1.1 → 10.10.1.2    TCP 83 8081 → 42594 [PSH, ACK] Seq=1004 Ack=1021 Win=65152 Len=17 TSval=3169178910 TSecr=1044919201
1711546767.955795288   642 1.166749288    10.10.1.2 → 10.10.1.1    TCP 83 42594 → 8081 [PSH, ACK] Seq=1021 Ack=1021 Win=64256 Len=17 TSval=1044919206 TSecr=3169178910
1711546769.955795288   644 1.166888105    10.10.1.1 → 10.10.1.2    TCP 83 8081 → 42594 [PSH, ACK] Seq=1021 Ack=1038 Win=65152 Len=17 TSval=3169178914 TSecr=1044919206
1711546777.955795288   652 1.174047525    10.10.1.2 → 10.10.1.1    TCP 83 42594 → 8081 [PSH, ACK] Seq=1038 Ack=1038 Win=64256 Len=17 TSval=1044919213 TSecr=3169178914
1711546779.955795288   654 1.174182549    10.10.1.1 → 10.10.1.2    TCP 83 8081 → 42594 [PSH, ACK] Seq=1038 Ack=1055 Win=65152 Len=17 TSval=3169178922 TSecr=1044919213
1711546787.955795288   662 1.183572359    10.10.1.2 → 10.10.1.1    TCP 83 42594 → 8081 [PSH, ACK] Seq=1055 Ack=1055 Win=64256 Len=17 TSval=1044919223 TSecr=3169178922
1711546789.955795288   664 1.183709066    10.10.1.1 → 10.10.1.2    TCP 83 8081 → 42594 [PSH, ACK] Seq=1055 Ack=1072 Win=65152 Len=17 TSval=3169178931 TSecr=1044919223
1711546797.955795288   672 1.213476353    10.10.1.2 → 10.10.1.1    TCP 83 42594 → 8081 [PSH, ACK] Seq=1072 Ack=1072 Win=64256 Len=17 TSval=1044919253 TSecr=3169178931
1711546799.955795288   674 1.213613892    10.10.1.1 → 10.10.1.2    TCP 83 8081 → 42594 [PSH, ACK] Seq=1072 Ack=1089 Win=65152 Len=17 TSval=3169178961 TSecr=1044919253
1711546807.955795288   682 1.214463070    10.10.1.2 → 10.10.1.1    TCP 83 42594 → 8081 [PSH, ACK] Seq=1089 Ack=1089 Win=64256 Len=17 TSval=1044919254 TSecr=3169178961
1711546809.955795288   684 1.214599670    10.10.1.1 → 10.10.1.2    TCP 83 8081 → 42594 [PSH, ACK] Seq=1089 Ack=1106 Win=65152 Len=17 TSval=3169178962 TSecr=1044919254
1711546817.955795288   692 1.218910169    10.10.1.2 → 10.10.1.1    TCP 83 42594 → 8081 [PSH, ACK] Seq=1106 Ack=1106 Win=64256 Len=17 TSval=1044919258 TSecr=3169178962
1711546819.955795288   694 1.219046605    10.10.1.1 → 10.10.1.2    TCP 83 8081 → 42594 [PSH, ACK] Seq=1106 Ack=1123 Win=65152 Len=17 TSval=3169178967 TSecr=1044919258
1711546827.955795288   702 1.223437350    10.10.1.2 → 10.10.1.1    TCP 83 42594 → 8081 [PSH, ACK] Seq=1123 Ack=1123 Win=64256 Len=17 TSval=1044919263 TSecr=3169178967
1711546829.955795288   704 1.223573377    10.10.1.1 → 10.10.1.2    TCP 83 8081 → 42594 [PSH, ACK] Seq=1123 Ack=1140 Win=65152 Len=17 TSval=3169178971 TSecr=1044919263
1711546837.955795288   712 1.230333541    10.10.1.2 → 10.10.1.1    TCP 83 42594 → 8081 [PSH, ACK] Seq=1140 Ack=1140 Win=64256 Len=17 TSval=1044919270 TSecr=3169178971
1711546839.955795288   714 1.230469638    10.10.1.1 → 10.10.1.2    TCP 83 8081 → 42594 [PSH, ACK] Seq=1140 Ack=1157 Win=65152 Len=17 TSval=3169178978 TSecr=1044919270
1711546847.955795288   722 1.235187871    10.10.1.2 → 10.10.1.1    TCP 83 42594 → 8081 [PSH, ACK] Seq=1157 Ack=1157 Win=64256 Len=17 TSval=1044919274 TSecr=3169178978
1711546849.955795288   724 1.235328016    10.10.1.1 → 10.10.1.2    TCP 83 8081 → 42594 [PSH, ACK] Seq=1157 Ack=1174 Win=65152 Len=17 TSval=3169178983 TSecr=1044919274
1711546857.955795288   732 1.238254863    10.10.1.2 → 10.10.1.1    TCP 83 42594 → 8081 [PSH, ACK] Seq=1174 Ack=1174 Win=64256 Len=17 TSval=1044919277 TSecr=3169178983
1711546859.955795288   734 1.238389405    10.10.1.1 → 10.10.1.2    TCP 83 8081 → 42594 [PSH, ACK] Seq=1174 Ack=1191 Win=65152 Len=17 TSval=3169178986 TSecr=1044919277
1711546867.955795288   742 1.240974737    10.10.1.2 → 10.10.1.1    TCP 83 42594 → 8081 [PSH, ACK] Seq=1191 Ack=1191 Win=64256 Len=17 TSval=1044919280 TSecr=3169178986
1711546869.955795288   744 1.241103606    10.10.1.1 → 10.10.1.2    TCP 83 8081 → 42594 [PSH, ACK] Seq=1191 Ack=1208 Win=65152 Len=17 TSval=3169178989 TSecr=1044919280
1711546877.955795288   752 1.245715510    10.10.1.2 → 10.10.1.1    TCP 83 42594 → 8081 [PSH, ACK] Seq=1208 Ack=1208 Win=64256 Len=17 TSval=1044919285 TSecr=3169178989
1711546879.955795288   754 1.245850739    10.10.1.1 → 10.10.1.2    TCP 83 8081 → 42594 [PSH, ACK] Seq=1208 Ack=1225 Win=65152 Len=17 TSval=3169178993 TSecr=1044919285
1711546887.955795288   762 1.246844403    10.10.1.2 → 10.10.1.1    TCP 83 42594 → 8081 [PSH, ACK] Seq=1225 Ack=1225 Win=64256 Len=17 TSval=1044919286 TSecr=3169178993
1711546889.955795288   764 1.246978902    10.10.1.1 → 10.10.1.2    TCP 83 8081 → 42594 [PSH, ACK] Seq=1225 Ack=1242 Win=65152 Len=17 TSval=3169178994 TSecr=1044919286
1711546897.955795288   772 1.259440845    10.10.1.2 → 10.10.1.1    TCP 83 42594 → 8081 [PSH, ACK] Seq=1242 Ack=1242 Win=64256 Len=17 TSval=1044919299 TSecr=3169178994
1711546899.955795288   774 1.259575136    10.10.1.1 → 10.10.1.2    TCP 83 8081 → 42594 [PSH, ACK] Seq=1242 Ack=1259 Win=65152 Len=17 TSval=3169179007 TSecr=1044919299
1711546907.955795288   782 1.261750274    10.10.1.2 → 10.10.1.1    TCP 83 42594 → 8081 [PSH, ACK] Seq=1259 Ack=1259 Win=64256 Len=17 TSval=1044919301 TSecr=3169179007
1711546909.955795288   784 1.261881916    10.10.1.1 → 10.10.1.2    TCP 83 8081 → 42594 [PSH, ACK] Seq=1259 Ack=1276 Win=65152 Len=17 TSval=3169179009 TSecr=1044919301
1711546917.955795288   792 1.265030847    10.10.1.2 → 10.10.1.1    TCP 83 42594 → 8081 [PSH, ACK] Seq=1276 Ack=1276 Win=64256 Len=17 TSval=1044919304 TSecr=3169179009
1711546919.955795288   794 1.265166922    10.10.1.1 → 10.10.1.2    TCP 83 8081 → 42594 [PSH, ACK] Seq=1276 Ack=1293 Win=65152 Len=17 TSval=3169179013 TSecr=1044919304
1711546927.955795288   802 1.275680857    10.10.1.2 → 10.10.1.1    TCP 83 42594 → 8081 [PSH, ACK] Seq=1293 Ack=1293 Win=64256 Len=17 TSval=1044919315 TSecr=3169179013
1711546929.955795288   804 1.275814948    10.10.1.1 → 10.10.1.2    TCP 83 8081 → 42594 [PSH, ACK] Seq=1293 Ack=1310 Win=65152 Len=17 TSval=3169179023 TSecr=1044919315
1711546937.955795288   812 1.302606852    10.10.1.2 → 10.10.1.1    TCP 83 42594 → 8081 [PSH, ACK] Seq=1310 Ack=1310 Win=64256 Len=17 TSval=1044919342 TSecr=3169179023
1711546939.955795288   814 1.302741369    10.10.1.1 → 10.10.1.2    TCP 83 8081 → 42594 [PSH, ACK] Seq=1310 Ack=1327 Win=65152 Len=17 TSval=3169179050 TSecr=1044919342
1711546947.955795288   822 1.311825173    10.10.1.2 → 10.10.1.1    TCP 83 42594 → 8081 [PSH, ACK] Seq=1327 Ack=1327 Win=64256 Len=17 TSval=1044919351 TSecr=3169179050
1711546949.955795288   824 1.311960815    10.10.1.1 → 10.10.1.2    TCP 83 8081 → 42594 [PSH, ACK] Seq=1327 Ack=1344 Win=65152 Len=17 TSval=3169179059 TSecr=1044919351
1711546957.955795288   832 1.316036829    10.10.1.2 → 10.10.1.1    TCP 83 42594 → 8081 [PSH, ACK] Seq=1344 Ack=1344 Win=64256 Len=17 TSval=1044919355 TSecr=3169179059
1711546959.955795288   834 1.316172380    10.10.1.1 → 10.10.1.2    TCP 83 8081 → 42594 [PSH, ACK] Seq=1344 Ack=1361 Win=65152 Len=17 TSval=3169179064 TSecr=1044919355
1711546967.955795288   842 1.320705154    10.10.1.2 → 10.10.1.1    TCP 83 42594 → 8081 [PSH, ACK] Seq=1361 Ack=1361 Win=64256 Len=17 TSval=1044919360 TSecr=3169179064
1711546969.955795288   844 1.320840040    10.10.1.1 → 10.10.1.2    TCP 83 8081 → 42594 [PSH, ACK] Seq=1361 Ack=1378 Win=65152 Len=17 TSval=3169179068 TSecr=1044919360
1711546977.955795288   852 1.322234446    10.10.1.2 → 10.10.1.1    TCP 83 42594 → 8081 [PSH, ACK] Seq=1378 Ack=1378 Win=64256 Len=17 TSval=1044919361 TSecr=3169179068
1711546979.955795288   854 1.322369859    10.10.1.1 → 10.10.1.2    TCP 83 8081 → 42594 [PSH, ACK] Seq=1378 Ack=1395 Win=65152 Len=17 TSval=3169179070 TSecr=1044919361
1711546987.955795288   862 1.323043578    10.10.1.2 → 10.10.1.1    TCP 83 42594 → 8081 [PSH, ACK] Seq=1395 Ack=1395 Win=64256 Len=17 TSval=1044919362 TSecr=3169179070
1711546990.955795288   865 1.323155239    10.10.1.1 → 10.10.1.2    TCP 83 8081 → 42594 [PSH, ACK] Seq=1395 Ack=1412 Win=65152 Len=17 TSval=3169179071 TSecr=1044919362
1711546997.955795288   872 1.328085926    10.10.1.2 → 10.10.1.1    TCP 83 42594 → 8081 [PSH, ACK] Seq=1412 Ack=1412 Win=64256 Len=17 TSval=1044919367 TSecr=3169179071
1711546999.955795288   874 1.328221393    10.10.1.1 → 10.10.1.2    TCP 83 8081 → 42594 [PSH, ACK] Seq=1412 Ack=1429 Win=65152 Len=17 TSval=3169179076 TSecr=1044919367
1711547007.955795288   882 1.331818066    10.10.1.2 → 10.10.1.1    TCP 83 42594 → 8081 [PSH, ACK] Seq=1429 Ack=1429 Win=64256 Len=17 TSval=1044919371 TSecr=3169179076
1711547009.955795288   884 1.331952816    10.10.1.1 → 10.10.1.2    TCP 83 8081 → 42594 [PSH, ACK] Seq=1429 Ack=1446 Win=65152 Len=17 TSval=3169179079 TSecr=1044919371
1711547017.955795288   892 1.351881872    10.10.1.2 → 10.10.1.1    TCP 83 42594 → 8081 [PSH, ACK] Seq=1446 Ack=1446 Win=64256 Len=17 TSval=1044919391 TSecr=3169179079
1711547019.955795288   894 1.352019848    10.10.1.1 → 10.10.1.2    TCP 83 8081 → 42594 [PSH, ACK] Seq=1446 Ack=1463 Win=65152 Len=17 TSval=3169179100 TSecr=1044919391
1711547027.955795288   902 1.359263484    10.10.1.2 → 10.10.1.1    TCP 83 42594 → 8081 [PSH, ACK] Seq=1463 Ack=1463 Win=64256 Len=17 TSval=1044919398 TSecr=3169179100
1711547029.955795288   904 1.359399631    10.10.1.1 → 10.10.1.2    TCP 83 8081 → 42594 [PSH, ACK] Seq=1463 Ack=1480 Win=65152 Len=17 TSval=3169179107 TSecr=1044919398
1711547037.955795288   912 1.359785838    10.10.1.2 → 10.10.1.1    TCP 83 42594 → 8081 [PSH, ACK] Seq=1480 Ack=1480 Win=64256 Len=17 TSval=1044919399 TSecr=3169179107
1711547039.955795288   914 1.359818938    10.10.1.1 → 10.10.1.2    TCP 83 8081 → 42594 [PSH, ACK] Seq=1480 Ack=1497 Win=65152 Len=17 TSval=3169179107 TSecr=1044919399
1711547047.955795288   922 1.361109693    10.10.1.2 → 10.10.1.1    TCP 83 42594 → 8081 [PSH, ACK] Seq=1497 Ack=1497 Win=64256 Len=17 TSval=1044919400 TSecr=3169179107
1711547049.955795288   924 1.361240913    10.10.1.1 → 10.10.1.2    TCP 83 8081 → 42594 [PSH, ACK] Seq=1497 Ack=1514 Win=65152 Len=17 TSval=3169179109 TSecr=1044919400
1711547057.955795288   932 1.369003473    10.10.1.2 → 10.10.1.1    TCP 83 42594 → 8081 [PSH, ACK] Seq=1514 Ack=1514 Win=64256 Len=17 TSval=1044919408 TSecr=3169179109
1711547059.955795288   934 1.369139039    10.10.1.1 → 10.10.1.2    TCP 83 8081 → 42594 [PSH, ACK] Seq=1514 Ack=1531 Win=65152 Len=17 TSval=3169179117 TSecr=1044919408
1711547067.955795288   942 1.376553405    10.10.1.2 → 10.10.1.1    TCP 83 42594 → 8081 [PSH, ACK] Seq=1531 Ack=1531 Win=64256 Len=17 TSval=1044919416 TSecr=3169179117
1711547069.955795288   944 1.376688229    10.10.1.1 → 10.10.1.2    TCP 83 8081 → 42594 [PSH, ACK] Seq=1531 Ack=1548 Win=65152 Len=17 TSval=3169179124 TSecr=1044919416
1711547077.955795288   952 1.382951468    10.10.1.2 → 10.10.1.1    TCP 83 42594 → 8081 [PSH, ACK] Seq=1548 Ack=1548 Win=64256 Len=17 TSval=1044919422 TSecr=3169179124
1711547079.955795288   954 1.383088127    10.10.1.1 → 10.10.1.2    TCP 83 8081 → 42594 [PSH, ACK] Seq=1548 Ack=1565 Win=65152 Len=17 TSval=3169179131 TSecr=1044919422
1711547087.955795288   962 1.383552153    10.10.1.2 → 10.10.1.1    TCP 83 42594 → 8081 [PSH, ACK] Seq=1565 Ack=1565 Win=64256 Len=17 TSval=1044919423 TSecr=3169179131
1711547090.955795288   965 1.383665232    10.10.1.1 → 10.10.1.2    TCP 83 8081 → 42594 [PSH, ACK] Seq=1565 Ack=1582 Win=65152 Len=17 TSval=3169179131 TSecr=1044919423
1711547097.955795288   972 1.385083320    10.10.1.2 → 10.10.1.1    TCP 83 42594 → 8081 [PSH, ACK] Seq=1582 Ack=1582 Win=64256 Len=17 TSval=1044919424 TSecr=3169179131
1711547099.955795288   974 1.385213365    10.10.1.1 → 10.10.1.2    TCP 83 8081 → 42594 [PSH, ACK] Seq=1582 Ack=1599 Win=65152 Len=17 TSval=3169179133 TSecr=1044919424
1711547107.955795288   982 1.390565046    10.10.1.2 → 10.10.1.1    TCP 83 42594 → 8081 [PSH, ACK] Seq=1599 Ack=1599 Win=64256 Len=17 TSval=1044919430 TSecr=3169179133
1711547109.955795288   984 1.390701021    10.10.1.1 → 10.10.1.2    TCP 83 8081 → 42594 [PSH, ACK] Seq=1599 Ack=1616 Win=65152 Len=17 TSval=3169179138 TSecr=1044919430
1711547117.955795288   992 1.391869217    10.10.1.2 → 10.10.1.1    TCP 83 42594 → 8081 [PSH, ACK] Seq=1616 Ack=1616 Win=64256 Len=17 TSval=1044919431 TSecr=3169179138
1711547119.955795288   994 1.392001045    10.10.1.1 → 10.10.1.2    TCP 83 8081 → 42594 [PSH, ACK] Seq=1616 Ack=1633 Win=65152 Len=17 TSval=3169179140 TSecr=1044919431
1711547127.955795288  1002 1.398180628    10.10.1.2 → 10.10.1.1    TCP 83 42594 → 8081 [PSH, ACK] Seq=1633 Ack=1633 Win=64256 Len=17 TSval=1044919437 TSecr=3169179140
1711547129.955795288  1004 1.398316592    10.10.1.1 → 10.10.1.2    TCP 83 8081 → 42594 [PSH, ACK] Seq=1633 Ack=1650 Win=65152 Len=17 TSval=3169179146 TSecr=1044919437
1711547137.955795288  1012 1.412100549    10.10.1.2 → 10.10.1.1    TCP 83 42594 → 8081 [PSH, ACK] Seq=1650 Ack=1650 Win=64256 Len=17 TSval=1044919451 TSecr=3169179146
1711547140.955795288  1015 1.412246987    10.10.1.1 → 10.10.1.2    TCP 83 8081 → 42594 [PSH, ACK] Seq=1650 Ack=1667 Win=65152 Len=17 TSval=3169179160 TSecr=1044919451
1711547147.955795288  1022 1.420927349    10.10.1.2 → 10.10.1.1    TCP 83 42594 → 8081 [PSH, ACK] Seq=1667 Ack=1667 Win=64256 Len=17 TSval=1044919460 TSecr=3169179160
1711547149.955795288  1024 1.421063966    10.10.1.1 → 10.10.1.2    TCP 83 8081 → 42594 [PSH, ACK] Seq=1667 Ack=1684 Win=65152 Len=17 TSval=3169179169 TSecr=1044919460
1711547157.955795288  1032 1.437972321    10.10.1.2 → 10.10.1.1    TCP 83 42594 → 8081 [PSH, ACK] Seq=1684 Ack=1684 Win=64256 Len=17 TSval=1044919477 TSecr=3169179169
1711547159.955795288  1034 1.438109600    10.10.1.1 → 10.10.1.2    TCP 83 8081 → 42594 [PSH, ACK] Seq=1684 Ack=1701 Win=65152 Len=17 TSval=3169179186 TSecr=1044919477
1711547167.955795288  1042 1.477191446    10.10.1.2 → 10.10.1.1    TCP 83 42594 → 8081 [PSH, ACK] Seq=1701 Ack=1701 Win=64256 Len=17 TSval=1044919516 TSecr=3169179186
1711547169.955795288  1044 1.477331743    10.10.1.1 → 10.10.1.2    TCP 83 8081 → 42594 [PSH, ACK] Seq=1701 Ack=1718 Win=65152 Len=17 TSval=3169179225 TSecr=1044919516
1711547177.955795288  1052 1.492769213    10.10.1.2 → 10.10.1.1    TCP 83 42594 → 8081 [PSH, ACK] Seq=1718 Ack=1718 Win=64256 Len=17 TSval=1044919532 TSecr=3169179225
1711547179.955795288  1054 1.492905312    10.10.1.1 → 10.10.1.2    TCP 83 8081 → 42594 [PSH, ACK] Seq=1718 Ack=1735 Win=65152 Len=17 TSval=3169179240 TSecr=1044919532
1711547187.955795288  1062 1.494951736    10.10.1.2 → 10.10.1.1    TCP 83 42594 → 8081 [PSH, ACK] Seq=1735 Ack=1735 Win=64256 Len=17 TSval=1044919534 TSecr=3169179240
1711547189.955795288  1064 1.495086710    10.10.1.1 → 10.10.1.2    TCP 83 8081 → 42594 [PSH, ACK] Seq=1735 Ack=1752 Win=65152 Len=17 TSval=3169179243 TSecr=1044919534
1711547197.955795288  1072 1.495858921    10.10.1.2 → 10.10.1.1    TCP 83 42594 → 8081 [PSH, ACK] Seq=1752 Ack=1752 Win=64256 Len=17 TSval=1044919535 TSecr=3169179243
1711547199.955795288  1074 1.495988117    10.10.1.1 → 10.10.1.2    TCP 83 8081 → 42594 [PSH, ACK] Seq=1752 Ack=1769 Win=65152 Len=17 TSval=3169179244 TSecr=1044919535
1711547207.955795288  1082 1.502895492    10.10.1.2 → 10.10.1.1    TCP 83 42594 → 8081 [PSH, ACK] Seq=1769 Ack=1769 Win=64256 Len=17 TSval=1044919542 TSecr=3169179244
1711547209.955795288  1084 1.503031400    10.10.1.1 → 10.10.1.2    TCP 83 8081 → 42594 [PSH, ACK] Seq=1769 Ack=1786 Win=65152 Len=17 TSval=3169179251 TSecr=1044919542
1711547217.955795288  1092 1.507477086    10.10.1.2 → 10.10.1.1    TCP 83 42594 → 8081 [PSH, ACK] Seq=1786 Ack=1786 Win=64256 Len=17 TSval=1044919547 TSecr=3169179251
1711547219.955795288  1094 1.507618094    10.10.1.1 → 10.10.1.2    TCP 83 8081 → 42594 [PSH, ACK] Seq=1786 Ack=1803 Win=65152 Len=17 TSval=3169179255 TSecr=1044919547
1711547227.955795288  1102 1.511522168    10.10.1.2 → 10.10.1.1    TCP 83 42594 → 8081 [PSH, ACK] Seq=1803 Ack=1803 Win=64256 Len=17 TSval=1044919551 TSecr=3169179255
1711547229.955795288  1104 1.511659917    10.10.1.1 → 10.10.1.2    TCP 83 8081 → 42594 [PSH, ACK] Seq=1803 Ack=1820 Win=65152 Len=17 TSval=3169179259 TSecr=1044919551
1711547237.955795288  1112 1.513278034    10.10.1.2 → 10.10.1.1    TCP 83 42594 → 8081 [PSH, ACK] Seq=1820 Ack=1820 Win=64256 Len=17 TSval=1044919552 TSecr=3169179259
1711547239.955795288  1114 1.513408887    10.10.1.1 → 10.10.1.2    TCP 83 8081 → 42594 [PSH, ACK] Seq=1820 Ack=1837 Win=65152 Len=17 TSval=3169179261 TSecr=1044919552
1711547247.955795288  1122 1.516835166    10.10.1.2 → 10.10.1.1    TCP 83 42594 → 8081 [PSH, ACK] Seq=1837 Ack=1837 Win=64256 Len=17 TSval=1044919556 TSecr=3169179261
1711547249.955795288  1124 1.516969004    10.10.1.1 → 10.10.1.2    TCP 83 8081 → 42594 [PSH, ACK] Seq=1837 Ack=1854 Win=65152 Len=17 TSval=3169179264 TSecr=1044919556
1711547257.955795288  1132 1.539833056    10.10.1.2 → 10.10.1.1    TCP 83 42594 → 8081 [PSH, ACK] Seq=1854 Ack=1854 Win=64256 Len=17 TSval=1044919579 TSecr=3169179264
1711547259.955795288  1134 1.539966416    10.10.1.1 → 10.10.1.2    TCP 83 8081 → 42594 [PSH, ACK] Seq=1854 Ack=1871 Win=65152 Len=17 TSval=3169179287 TSecr=1044919579
1711547267.955795288  1142 1.546175641    10.10.1.2 → 10.10.1.1    TCP 83 42594 → 8081 [PSH, ACK] Seq=1871 Ack=1871 Win=64256 Len=17 TSval=1044919585 TSecr=3169179287
1711547269.955795288  1144 1.546310745    10.10.1.1 → 10.10.1.2    TCP 83 8081 → 42594 [PSH, ACK] Seq=1871 Ack=1888 Win=65152 Len=17 TSval=3169179294 TSecr=1044919585
1711547277.955795288  1152 1.556299953    10.10.1.2 → 10.10.1.1    TCP 83 42594 → 8081 [PSH, ACK] Seq=1888 Ack=1888 Win=64256 Len=17 TSval=1044919596 TSecr=3169179294
1711547279.955795288  1154 1.556429755    10.10.1.1 → 10.10.1.2    TCP 83 8081 → 42594 [PSH, ACK] Seq=1888 Ack=1905 Win=65152 Len=17 TSval=3169179304 TSecr=1044919596
1711547287.955795288  1162 1.556662363    10.10.1.2 → 10.10.1.1    TCP 83 42594 → 8081 [PSH, ACK] Seq=1905 Ack=1905 Win=64256 Len=17 TSval=1044919596 TSecr=3169179304
1711547289.955795288  1164 1.556694942    10.10.1.1 → 10.10.1.2    TCP 83 8081 → 42594 [PSH, ACK] Seq=1905 Ack=1922 Win=65152 Len=17 TSval=3169179304 TSecr=1044919596
1711547297.955795288  1172 1.563856563    10.10.1.2 → 10.10.1.1    TCP 83 42594 → 8081 [PSH, ACK] Seq=1922 Ack=1922 Win=64256 Len=17 TSval=1044919603 TSecr=3169179304
1711547300.955795288  1175 1.564043950    10.10.1.1 → 10.10.1.2    TCP 83 8081 → 42594 [PSH, ACK] Seq=1922 Ack=1939 Win=65152 Len=17 TSval=3169179312 TSecr=1044919603
1711547303.955795288  1178 1.564154688    10.10.1.2 → 10.10.1.1    TCP 83 42594 → 8081 [PSH, ACK] Seq=1939 Ack=1939 Win=64256 Len=17 TSval=1044919603 TSecr=3169179312
1711547305.955795288  1180 1.564190642    10.10.1.1 → 10.10.1.2    TCP 83 8081 → 42594 [PSH, ACK] Seq=1939 Ack=1956 Win=65152 Len=17 TSval=3169179312 TSecr=1044919603
1711547313.955795288  1188 1.567882097    10.10.1.2 → 10.10.1.1    TCP 83 42594 → 8081 [PSH, ACK] Seq=1956 Ack=1956 Win=64256 Len=17 TSval=1044919607 TSecr=3169179312
1711547315.955795288  1190 1.568016178    10.10.1.1 → 10.10.1.2    TCP 83 8081 → 42594 [PSH, ACK] Seq=1956 Ack=1973 Win=65152 Len=17 TSval=3169179316 TSecr=1044919607
1711547323.955795288  1198 1.572720303    10.10.1.2 → 10.10.1.1    TCP 83 42594 → 8081 [PSH, ACK] Seq=1973 Ack=1973 Win=64256 Len=17 TSval=1044919612 TSecr=3169179316
1711547325.955795288  1200 1.572856686    10.10.1.1 → 10.10.1.2    TCP 83 8081 → 42594 [PSH, ACK] Seq=1973 Ack=1990 Win=65152 Len=17 TSval=3169179320 TSecr=1044919612
1711547333.955795288  1208 1.580112518    10.10.1.2 → 10.10.1.1    TCP 83 42594 → 8081 [PSH, ACK] Seq=1990 Ack=1990 Win=64256 Len=17 TSval=1044919619 TSecr=3169179320
1711547335.955795288  1210 1.580248104    10.10.1.1 → 10.10.1.2    TCP 83 8081 → 42594 [PSH, ACK] Seq=1990 Ack=2007 Win=65152 Len=17 TSval=3169179328 TSecr=1044919619
1711547343.955795288  1218 1.584257469    10.10.1.2 → 10.10.1.1    TCP 83 42594 → 8081 [PSH, ACK] Seq=2007 Ack=2007 Win=64256 Len=17 TSval=1044919623 TSecr=3169179328
1711547345.955795288  1220 1.584393111    10.10.1.1 → 10.10.1.2    TCP 83 8081 → 42594 [PSH, ACK] Seq=2007 Ack=2024 Win=65152 Len=17 TSval=3169179332 TSecr=1044919623
1711547353.955795288  1228 1.590844143    10.10.1.2 → 10.10.1.1    TCP 83 42594 → 8081 [PSH, ACK] Seq=2024 Ack=2024 Win=64256 Len=17 TSval=1044919630 TSecr=3169179332
1711547355.955795288  1230 1.590980712    10.10.1.1 → 10.10.1.2    TCP 83 8081 → 42594 [PSH, ACK] Seq=2024 Ack=2041 Win=65152 Len=17 TSval=3169179338 TSecr=1044919630
1711547363.955795288  1238 1.591497035    10.10.1.2 → 10.10.1.1    TCP 83 42594 → 8081 [PSH, ACK] Seq=2041 Ack=2041 Win=64256 Len=17 TSval=1044919631 TSecr=3169179338
