1712183492.766741276    22 0.283227164    10.10.1.2 → 10.10.1.1    TCP 74 33898 → 8081 [SYN] Seq=0 Win=64240 Len=0 MSS=1460 SACK_PERM=1 TSval=1682263085 TSecr=0 WS=128
1712183493.766741276    23 0.283269376    10.10.1.1 → 10.10.1.2    TCP 74 8081 → 33898 [SYN, ACK] Seq=0 Ack=1 Win=65160 Len=0 MSS=1460 SACK_PERM=1 TSval=3806522794 TSecr=1682263085 WS=128
1712183495.766741276    25 0.283341497    10.10.1.2 → 10.10.1.1    TCP 66 33898 → 8081 [ACK] Seq=1 Ack=1 Win=64256 Len=0 TSval=1682263085 TSecr=3806522794
1712183504.766741276    34 0.542824845    10.10.1.2 → 10.10.1.1    TCP 83 33898 → 8081 [PSH, ACK] Seq=1 Ack=1 Win=64256 Len=17 TSval=1682263345 TSecr=3806522794
1712183506.766741276    36 0.542857514    10.10.1.1 → 10.10.1.2    TCP 66 8081 → 33898 [ACK] Seq=1 Ack=18 Win=65152 Len=0 TSval=3806523054 TSecr=1682263345
1712183507.766741276    37 0.543125716    10.10.1.1 → 10.10.1.2    TCP 83 8081 → 33898 [PSH, ACK] Seq=1 Ack=18 Win=65152 Len=17 TSval=3806523054 TSecr=1682263345
1712183509.766741276    39 0.543229890    10.10.1.2 → 10.10.1.1    TCP 66 33898 → 8081 [ACK] Seq=18 Ack=18 Win=64256 Len=0 TSval=1682263345 TSecr=3806523054
1712183514.766741276    44 0.553357191    10.10.1.2 → 10.10.1.1    TCP 83 33898 → 8081 [PSH, ACK] Seq=18 Ack=18 Win=64256 Len=17 TSval=1682263355 TSecr=3806523054
1712183517.766741276    47 0.553484982    10.10.1.1 → 10.10.1.2    TCP 83 8081 → 33898 [PSH, ACK] Seq=18 Ack=35 Win=65152 Len=17 TSval=3806523064 TSecr=1682263355
1712183523.766741276    53 0.563710104    10.10.1.2 → 10.10.1.1    TCP 83 33898 → 8081 [PSH, ACK] Seq=35 Ack=35 Win=64256 Len=17 TSval=1682263366 TSecr=3806523064
1712183525.766741276    55 0.563846346    10.10.1.1 → 10.10.1.2    TCP 83 8081 → 33898 [PSH, ACK] Seq=35 Ack=52 Win=65152 Len=17 TSval=3806523075 TSecr=1682263366
1712183531.766741276    61 0.574066539    10.10.1.2 → 10.10.1.1    TCP 83 33898 → 8081 [PSH, ACK] Seq=52 Ack=52 Win=64256 Len=17 TSval=1682263376 TSecr=3806523075
1712183534.766741276    64 0.574201994    10.10.1.1 → 10.10.1.2    TCP 83 8081 → 33898 [PSH, ACK] Seq=52 Ack=69 Win=65152 Len=17 TSval=3806523085 TSecr=1682263376
1712183540.766741276    70 0.584423410    10.10.1.2 → 10.10.1.1    TCP 83 33898 → 8081 [PSH, ACK] Seq=69 Ack=69 Win=64256 Len=17 TSval=1682263386 TSecr=3806523085
1712183542.766741276    72 0.584558248    10.10.1.1 → 10.10.1.2    TCP 83 8081 → 33898 [PSH, ACK] Seq=69 Ack=86 Win=65152 Len=17 TSval=3806523096 TSecr=1682263386
1712183548.766741276    78 0.594782607    10.10.1.2 → 10.10.1.1    TCP 83 33898 → 8081 [PSH, ACK] Seq=86 Ack=86 Win=64256 Len=17 TSval=1682263397 TSecr=3806523096
1712183551.766741276    81 0.594918443    10.10.1.1 → 10.10.1.2    TCP 83 8081 → 33898 [PSH, ACK] Seq=86 Ack=103 Win=65152 Len=17 TSval=3806523106 TSecr=1682263397
1712183557.766741276    87 0.605142891    10.10.1.2 → 10.10.1.1    TCP 83 33898 → 8081 [PSH, ACK] Seq=103 Ack=103 Win=64256 Len=17 TSval=1682263407 TSecr=3806523106
1712183559.766741276    89 0.605279041    10.10.1.1 → 10.10.1.2    TCP 83 8081 → 33898 [PSH, ACK] Seq=103 Ack=120 Win=65152 Len=17 TSval=3806523116 TSecr=1682263407
1712183565.766741276    95 0.615497985    10.10.1.2 → 10.10.1.1    TCP 83 33898 → 8081 [PSH, ACK] Seq=120 Ack=120 Win=64256 Len=17 TSval=1682263417 TSecr=3806523116
1712183568.766741276    98 0.615627530    10.10.1.1 → 10.10.1.2    TCP 83 8081 → 33898 [PSH, ACK] Seq=120 Ack=137 Win=65152 Len=17 TSval=3806523127 TSecr=1682263417
1712183574.766741276   104 0.625845629    10.10.1.2 → 10.10.1.1    TCP 83 33898 → 8081 [PSH, ACK] Seq=137 Ack=137 Win=64256 Len=17 TSval=1682263428 TSecr=3806523127
1712183576.766741276   106 0.625979486    10.10.1.1 → 10.10.1.2    TCP 83 8081 → 33898 [PSH, ACK] Seq=137 Ack=154 Win=65152 Len=17 TSval=3806523137 TSecr=1682263428
1712183582.766741276   112 0.636196999    10.10.1.2 → 10.10.1.1    TCP 83 33898 → 8081 [PSH, ACK] Seq=154 Ack=154 Win=64256 Len=17 TSval=1682263438 TSecr=3806523137
1712183585.766741276   115 0.636331788    10.10.1.1 → 10.10.1.2    TCP 83 8081 → 33898 [PSH, ACK] Seq=154 Ack=171 Win=65152 Len=17 TSval=3806523147 TSecr=1682263438
1712183591.766741276   121 0.646553322    10.10.1.2 → 10.10.1.1    TCP 83 33898 → 8081 [PSH, ACK] Seq=171 Ack=171 Win=64256 Len=17 TSval=1682263448 TSecr=3806523147
1712183593.766741276   123 0.646688577    10.10.1.1 → 10.10.1.2    TCP 83 8081 → 33898 [PSH, ACK] Seq=171 Ack=188 Win=65152 Len=17 TSval=3806523158 TSecr=1682263448
1712183599.766741276   129 0.656905406    10.10.1.2 → 10.10.1.1    TCP 83 33898 → 8081 [PSH, ACK] Seq=188 Ack=188 Win=64256 Len=17 TSval=1682263459 TSecr=3806523158
1712183602.766741276   132 0.657041126    10.10.1.1 → 10.10.1.2    TCP 83 8081 → 33898 [PSH, ACK] Seq=188 Ack=205 Win=65152 Len=17 TSval=3806523168 TSecr=1682263459
1712183608.766741276   138 0.667263363    10.10.1.2 → 10.10.1.1    TCP 83 33898 → 8081 [PSH, ACK] Seq=205 Ack=205 Win=64256 Len=17 TSval=1682263469 TSecr=3806523168
1712183610.766741276   140 0.667398439    10.10.1.1 → 10.10.1.2    TCP 83 8081 → 33898 [PSH, ACK] Seq=205 Ack=222 Win=65152 Len=17 TSval=3806523178 TSecr=1682263469
1712183616.766741276   146 0.677617437    10.10.1.2 → 10.10.1.1    TCP 83 33898 → 8081 [PSH, ACK] Seq=222 Ack=222 Win=64256 Len=17 TSval=1682263479 TSecr=3806523178
1712183619.766741276   149 0.677752034    10.10.1.1 → 10.10.1.2    TCP 83 8081 → 33898 [PSH, ACK] Seq=222 Ack=239 Win=65152 Len=17 TSval=3806523189 TSecr=1682263479
1712183625.766741276   155 0.687972321    10.10.1.2 → 10.10.1.1    TCP 83 33898 → 8081 [PSH, ACK] Seq=239 Ack=239 Win=64256 Len=17 TSval=1682263490 TSecr=3806523189
1712183627.766741276   157 0.688107248    10.10.1.1 → 10.10.1.2    TCP 83 8081 → 33898 [PSH, ACK] Seq=239 Ack=256 Win=65152 Len=17 TSval=3806523199 TSecr=1682263490
1712183633.766741276   163 0.698325011    10.10.1.2 → 10.10.1.1    TCP 83 33898 → 8081 [PSH, ACK] Seq=256 Ack=256 Win=64256 Len=17 TSval=1682263500 TSecr=3806523199
1712183636.766741276   166 0.698459960    10.10.1.1 → 10.10.1.2    TCP 83 8081 → 33898 [PSH, ACK] Seq=256 Ack=273 Win=65152 Len=17 TSval=3806523209 TSecr=1682263500
1712183642.766741276   172 0.708677092    10.10.1.2 → 10.10.1.1    TCP 83 33898 → 8081 [PSH, ACK] Seq=273 Ack=273 Win=64256 Len=17 TSval=1682263511 TSecr=3806523209
1712183644.766741276   174 0.708810470    10.10.1.1 → 10.10.1.2    TCP 83 8081 → 33898 [PSH, ACK] Seq=273 Ack=290 Win=65152 Len=17 TSval=3806523220 TSecr=1682263511
1712183650.766741276   180 0.719031586    10.10.1.2 → 10.10.1.1    TCP 83 33898 → 8081 [PSH, ACK] Seq=290 Ack=290 Win=64256 Len=17 TSval=1682263521 TSecr=3806523220
1712183653.766741276   183 0.719166394    10.10.1.1 → 10.10.1.2    TCP 83 8081 → 33898 [PSH, ACK] Seq=290 Ack=307 Win=65152 Len=17 TSval=3806523230 TSecr=1682263521
1712183659.766741276   189 0.729384062    10.10.1.2 → 10.10.1.1    TCP 83 33898 → 8081 [PSH, ACK] Seq=307 Ack=307 Win=64256 Len=17 TSval=1682263531 TSecr=3806523230
1712183661.766741276   191 0.729519892    10.10.1.1 → 10.10.1.2    TCP 83 8081 → 33898 [PSH, ACK] Seq=307 Ack=324 Win=65152 Len=17 TSval=3806523240 TSecr=1682263531
1712183667.766741276   197 0.739740259    10.10.1.2 → 10.10.1.1    TCP 83 33898 → 8081 [PSH, ACK] Seq=324 Ack=324 Win=64256 Len=17 TSval=1682263542 TSecr=3806523240
1712183670.766741276   200 0.739875722    10.10.1.1 → 10.10.1.2    TCP 83 8081 → 33898 [PSH, ACK] Seq=324 Ack=341 Win=65152 Len=17 TSval=3806523251 TSecr=1682263542
1712183676.766741276   206 0.750092010    10.10.1.2 → 10.10.1.1    TCP 83 33898 → 8081 [PSH, ACK] Seq=341 Ack=341 Win=64256 Len=17 TSval=1682263552 TSecr=3806523251
1712183678.766741276   208 0.750226376    10.10.1.1 → 10.10.1.2    TCP 83 8081 → 33898 [PSH, ACK] Seq=341 Ack=358 Win=65152 Len=17 TSval=3806523261 TSecr=1682263552
1712183684.766741276   214 0.760447158    10.10.1.2 → 10.10.1.1    TCP 83 33898 → 8081 [PSH, ACK] Seq=358 Ack=358 Win=64256 Len=17 TSval=1682263562 TSecr=3806523261
1712183687.766741276   217 0.760582584    10.10.1.1 → 10.10.1.2    TCP 83 8081 → 33898 [PSH, ACK] Seq=358 Ack=375 Win=65152 Len=17 TSval=3806523272 TSecr=1682263562
1712183693.766741276   223 0.770803166    10.10.1.2 → 10.10.1.1    TCP 83 33898 → 8081 [PSH, ACK] Seq=375 Ack=375 Win=64256 Len=17 TSval=1682263573 TSecr=3806523272
1712183695.766741276   225 0.770937744    10.10.1.1 → 10.10.1.2    TCP 83 8081 → 33898 [PSH, ACK] Seq=375 Ack=392 Win=65152 Len=17 TSval=3806523282 TSecr=1682263573
1712183701.766741276   231 0.781153956    10.10.1.2 → 10.10.1.1    TCP 83 33898 → 8081 [PSH, ACK] Seq=392 Ack=392 Win=64256 Len=17 TSval=1682263583 TSecr=3806523282
1712183704.766741276   234 0.781288471    10.10.1.1 → 10.10.1.2    TCP 83 8081 → 33898 [PSH, ACK] Seq=392 Ack=409 Win=65152 Len=17 TSval=3806523292 TSecr=1682263583
1712183710.766741276   240 0.791508034    10.10.1.2 → 10.10.1.1    TCP 83 33898 → 8081 [PSH, ACK] Seq=409 Ack=409 Win=64256 Len=17 TSval=1682263593 TSecr=3806523292
1712183712.766741276   242 0.791643511    10.10.1.1 → 10.10.1.2    TCP 83 8081 → 33898 [PSH, ACK] Seq=409 Ack=426 Win=65152 Len=17 TSval=3806523303 TSecr=1682263593
1712183718.766741276   248 0.801864182    10.10.1.2 → 10.10.1.1    TCP 83 33898 → 8081 [PSH, ACK] Seq=426 Ack=426 Win=64256 Len=17 TSval=1682263604 TSecr=3806523303
1712183721.766741276   251 0.801998544    10.10.1.1 → 10.10.1.2    TCP 83 8081 → 33898 [PSH, ACK] Seq=426 Ack=443 Win=65152 Len=17 TSval=3806523313 TSecr=1682263604
1712183727.766741276   257 0.812218271    10.10.1.2 → 10.10.1.1    TCP 83 33898 → 8081 [PSH, ACK] Seq=443 Ack=443 Win=64256 Len=17 TSval=1682263614 TSecr=3806523313
1712183729.766741276   259 0.812353712    10.10.1.1 → 10.10.1.2    TCP 83 8081 → 33898 [PSH, ACK] Seq=443 Ack=460 Win=65152 Len=17 TSval=3806523323 TSecr=1682263614
1712183735.766741276   265 0.822573760    10.10.1.2 → 10.10.1.1    TCP 83 33898 → 8081 [PSH, ACK] Seq=460 Ack=460 Win=64256 Len=17 TSval=1682263624 TSecr=3806523323
1712183738.766741276   268 0.822709452    10.10.1.1 → 10.10.1.2    TCP 83 8081 → 33898 [PSH, ACK] Seq=460 Ack=477 Win=65152 Len=17 TSval=3806523334 TSecr=1682263624
1712183744.766741276   274 0.832928530    10.10.1.2 → 10.10.1.1    TCP 83 33898 → 8081 [PSH, ACK] Seq=477 Ack=477 Win=64256 Len=17 TSval=1682263635 TSecr=3806523334
1712183746.766741276   276 0.833061170    10.10.1.1 → 10.10.1.2    TCP 83 8081 → 33898 [PSH, ACK] Seq=477 Ack=494 Win=65152 Len=17 TSval=3806523344 TSecr=1682263635
1712183752.766741276   282 0.843281942    10.10.1.2 → 10.10.1.1    TCP 83 33898 → 8081 [PSH, ACK] Seq=494 Ack=494 Win=64256 Len=17 TSval=1682263645 TSecr=3806523344
1712183755.766741276   285 0.843416584    10.10.1.1 → 10.10.1.2    TCP 83 8081 → 33898 [PSH, ACK] Seq=494 Ack=511 Win=65152 Len=17 TSval=3806523354 TSecr=1682263645
1712183761.766741276   291 0.853633792    10.10.1.2 → 10.10.1.1    TCP 83 33898 → 8081 [PSH, ACK] Seq=511 Ack=511 Win=64256 Len=17 TSval=1682263655 TSecr=3806523354
1712183763.766741276   293 0.853771887    10.10.1.1 → 10.10.1.2    TCP 83 8081 → 33898 [PSH, ACK] Seq=511 Ack=528 Win=65152 Len=17 TSval=3806523365 TSecr=1682263655
1712183769.766741276   299 0.863995665    10.10.1.2 → 10.10.1.1    TCP 83 33898 → 8081 [PSH, ACK] Seq=528 Ack=528 Win=64256 Len=17 TSval=1682263666 TSecr=3806523365
1712183772.766741276   302 0.864131387    10.10.1.1 → 10.10.1.2    TCP 83 8081 → 33898 [PSH, ACK] Seq=528 Ack=545 Win=65152 Len=17 TSval=3806523375 TSecr=1682263666
1712183778.766741276   308 0.874348193    10.10.1.2 → 10.10.1.1    TCP 83 33898 → 8081 [PSH, ACK] Seq=545 Ack=545 Win=64256 Len=17 TSval=1682263676 TSecr=3806523375
1712183780.766741276   310 0.874483371    10.10.1.1 → 10.10.1.2    TCP 83 8081 → 33898 [PSH, ACK] Seq=545 Ack=562 Win=65152 Len=17 TSval=3806523385 TSecr=1682263676
1712183786.766741276   316 0.884704464    10.10.1.2 → 10.10.1.1    TCP 83 33898 → 8081 [PSH, ACK] Seq=562 Ack=562 Win=64256 Len=17 TSval=1682263687 TSecr=3806523385
1712183789.766741276   319 0.884839875    10.10.1.1 → 10.10.1.2    TCP 83 8081 → 33898 [PSH, ACK] Seq=562 Ack=579 Win=65152 Len=17 TSval=3806523396 TSecr=1682263687
1712183795.766741276   325 0.895058341    10.10.1.2 → 10.10.1.1    TCP 83 33898 → 8081 [PSH, ACK] Seq=579 Ack=579 Win=64256 Len=17 TSval=1682263697 TSecr=3806523396
1712183797.766741276   327 0.895191979    10.10.1.1 → 10.10.1.2    TCP 83 8081 → 33898 [PSH, ACK] Seq=579 Ack=596 Win=65152 Len=17 TSval=3806523406 TSecr=1682263697
1712183803.766741276   333 0.905408787    10.10.1.2 → 10.10.1.1    TCP 83 33898 → 8081 [PSH, ACK] Seq=596 Ack=596 Win=64256 Len=17 TSval=1682263707 TSecr=3806523406
1712183806.766741276   336 0.905543796    10.10.1.1 → 10.10.1.2    TCP 83 8081 → 33898 [PSH, ACK] Seq=596 Ack=613 Win=65152 Len=17 TSval=3806523417 TSecr=1682263707
1712183812.766741276   342 0.915764576    10.10.1.2 → 10.10.1.1    TCP 83 33898 → 8081 [PSH, ACK] Seq=613 Ack=613 Win=64256 Len=17 TSval=1682263718 TSecr=3806523417
1712183814.766741276   344 0.915900398    10.10.1.1 → 10.10.1.2    TCP 83 8081 → 33898 [PSH, ACK] Seq=613 Ack=630 Win=65152 Len=17 TSval=3806523427 TSecr=1682263718
1712183820.766741276   350 0.926117510    10.10.1.2 → 10.10.1.1    TCP 83 33898 → 8081 [PSH, ACK] Seq=630 Ack=630 Win=64256 Len=17 TSval=1682263728 TSecr=3806523427
1712183823.766741276   353 0.926251864    10.10.1.1 → 10.10.1.2    TCP 83 8081 → 33898 [PSH, ACK] Seq=630 Ack=647 Win=65152 Len=17 TSval=3806523437 TSecr=1682263728
1712183829.766741276   359 0.936473244    10.10.1.2 → 10.10.1.1    TCP 83 33898 → 8081 [PSH, ACK] Seq=647 Ack=647 Win=64256 Len=17 TSval=1682263738 TSecr=3806523437
1712183831.766741276   361 0.936607769    10.10.1.1 → 10.10.1.2    TCP 83 8081 → 33898 [PSH, ACK] Seq=647 Ack=664 Win=65152 Len=17 TSval=3806523448 TSecr=1682263738
1712183837.766741276   367 0.946827826    10.10.1.2 → 10.10.1.1    TCP 83 33898 → 8081 [PSH, ACK] Seq=664 Ack=664 Win=64256 Len=17 TSval=1682263749 TSecr=3806523448
1712183840.766741276   370 0.946962597    10.10.1.1 → 10.10.1.2    TCP 83 8081 → 33898 [PSH, ACK] Seq=664 Ack=681 Win=65152 Len=17 TSval=3806523458 TSecr=1682263749
1712183846.766741276   376 0.957182254    10.10.1.2 → 10.10.1.1    TCP 83 33898 → 8081 [PSH, ACK] Seq=681 Ack=681 Win=64256 Len=17 TSval=1682263759 TSecr=3806523458
1712183848.766741276   378 0.957317736    10.10.1.1 → 10.10.1.2    TCP 83 8081 → 33898 [PSH, ACK] Seq=681 Ack=698 Win=65152 Len=17 TSval=3806523468 TSecr=1682263759
1712183854.766741276   384 0.967536028    10.10.1.2 → 10.10.1.1    TCP 83 33898 → 8081 [PSH, ACK] Seq=698 Ack=698 Win=64256 Len=17 TSval=1682263769 TSecr=3806523468
1712183857.766741276   387 0.967669670    10.10.1.1 → 10.10.1.2    TCP 83 8081 → 33898 [PSH, ACK] Seq=698 Ack=715 Win=65152 Len=17 TSval=3806523479 TSecr=1682263769
1712183863.766741276   393 0.977889428    10.10.1.2 → 10.10.1.1    TCP 83 33898 → 8081 [PSH, ACK] Seq=715 Ack=715 Win=64256 Len=17 TSval=1682263780 TSecr=3806523479
1712183865.766741276   395 0.978023596    10.10.1.1 → 10.10.1.2    TCP 83 8081 → 33898 [PSH, ACK] Seq=715 Ack=732 Win=65152 Len=17 TSval=3806523489 TSecr=1682263780
1712183871.766741276   401 0.988239985    10.10.1.2 → 10.10.1.1    TCP 83 33898 → 8081 [PSH, ACK] Seq=732 Ack=732 Win=64256 Len=17 TSval=1682263790 TSecr=3806523489
1712183874.766741276   404 0.988382512    10.10.1.1 → 10.10.1.2    TCP 83 8081 → 33898 [PSH, ACK] Seq=732 Ack=749 Win=65152 Len=17 TSval=3806523499 TSecr=1682263790
1712183880.766741276   410 0.998599975    10.10.1.2 → 10.10.1.1    TCP 83 33898 → 8081 [PSH, ACK] Seq=749 Ack=749 Win=64256 Len=17 TSval=1682263800 TSecr=3806523499
1712183882.766741276   412 0.998734566    10.10.1.1 → 10.10.1.2    TCP 83 8081 → 33898 [PSH, ACK] Seq=749 Ack=766 Win=65152 Len=17 TSval=3806523510 TSecr=1682263800
1712183888.766741276   418 1.008952166    10.10.1.2 → 10.10.1.1    TCP 83 33898 → 8081 [PSH, ACK] Seq=766 Ack=766 Win=64256 Len=17 TSval=1682263811 TSecr=3806523510
1712183891.766741276   421 1.009085831    10.10.1.1 → 10.10.1.2    TCP 83 8081 → 33898 [PSH, ACK] Seq=766 Ack=783 Win=65152 Len=17 TSval=3806523520 TSecr=1682263811
1712183897.766741276   427 1.019305284    10.10.1.2 → 10.10.1.1    TCP 83 33898 → 8081 [PSH, ACK] Seq=783 Ack=783 Win=64256 Len=17 TSval=1682263821 TSecr=3806523520
1712183899.766741276   429 1.019439114    10.10.1.1 → 10.10.1.2    TCP 83 8081 → 33898 [PSH, ACK] Seq=783 Ack=800 Win=65152 Len=17 TSval=3806523530 TSecr=1682263821
1712183905.766741276   435 1.029657246    10.10.1.2 → 10.10.1.1    TCP 83 33898 → 8081 [PSH, ACK] Seq=800 Ack=800 Win=64256 Len=17 TSval=1682263831 TSecr=3806523530
1712183908.766741276   438 1.029792279    10.10.1.1 → 10.10.1.2    TCP 83 8081 → 33898 [PSH, ACK] Seq=800 Ack=817 Win=65152 Len=17 TSval=3806523541 TSecr=1682263831
1712183914.766741276   444 1.040011667    10.10.1.2 → 10.10.1.1    TCP 83 33898 → 8081 [PSH, ACK] Seq=817 Ack=817 Win=64256 Len=17 TSval=1682263842 TSecr=3806523541
1712183916.766741276   446 1.040144976    10.10.1.1 → 10.10.1.2    TCP 83 8081 → 33898 [PSH, ACK] Seq=817 Ack=834 Win=65152 Len=17 TSval=3806523551 TSecr=1682263842
1712183922.766741276   452 1.050364754    10.10.1.2 → 10.10.1.1    TCP 83 33898 → 8081 [PSH, ACK] Seq=834 Ack=834 Win=64256 Len=17 TSval=1682263852 TSecr=3806523551
1712183925.766741276   455 1.050500455    10.10.1.1 → 10.10.1.2    TCP 83 8081 → 33898 [PSH, ACK] Seq=834 Ack=851 Win=65152 Len=17 TSval=3806523561 TSecr=1682263852
1712183931.766741276   461 1.060717258    10.10.1.2 → 10.10.1.1    TCP 83 33898 → 8081 [PSH, ACK] Seq=851 Ack=851 Win=64256 Len=17 TSval=1682263863 TSecr=3806523561
1712183933.766741276   463 1.060852603    10.10.1.1 → 10.10.1.2    TCP 83 8081 → 33898 [PSH, ACK] Seq=851 Ack=868 Win=65152 Len=17 TSval=3806523572 TSecr=1682263863
1712183939.766741276   469 1.071071466    10.10.1.2 → 10.10.1.1    TCP 83 33898 → 8081 [PSH, ACK] Seq=868 Ack=868 Win=64256 Len=17 TSval=1682263873 TSecr=3806523572
1712183942.766741276   472 1.071207142    10.10.1.1 → 10.10.1.2    TCP 83 8081 → 33898 [PSH, ACK] Seq=868 Ack=885 Win=65152 Len=17 TSval=3806523582 TSecr=1682263873
1712183948.766741276   478 1.081423292    10.10.1.2 → 10.10.1.1    TCP 83 33898 → 8081 [PSH, ACK] Seq=885 Ack=885 Win=64256 Len=17 TSval=1682263883 TSecr=3806523582
1712183950.766741276   480 1.081558236    10.10.1.1 → 10.10.1.2    TCP 83 8081 → 33898 [PSH, ACK] Seq=885 Ack=902 Win=65152 Len=17 TSval=3806523593 TSecr=1682263883
1712183956.766741276   486 1.091778261    10.10.1.2 → 10.10.1.1    TCP 83 33898 → 8081 [PSH, ACK] Seq=902 Ack=902 Win=64256 Len=17 TSval=1682263894 TSecr=3806523593
1712183959.766741276   489 1.091913410    10.10.1.1 → 10.10.1.2    TCP 83 8081 → 33898 [PSH, ACK] Seq=902 Ack=919 Win=65152 Len=17 TSval=3806523603 TSecr=1682263894
1712183965.766741276   495 1.102129838    10.10.1.2 → 10.10.1.1    TCP 83 33898 → 8081 [PSH, ACK] Seq=919 Ack=919 Win=64256 Len=17 TSval=1682263904 TSecr=3806523603
1712183967.766741276   497 1.102264939    10.10.1.1 → 10.10.1.2    TCP 83 8081 → 33898 [PSH, ACK] Seq=919 Ack=936 Win=65152 Len=17 TSval=3806523613 TSecr=1682263904
1712183973.766741276   503 1.112482871    10.10.1.2 → 10.10.1.1    TCP 83 33898 → 8081 [PSH, ACK] Seq=936 Ack=936 Win=64256 Len=17 TSval=1682263914 TSecr=3806523613
1712183976.766741276   506 1.112617253    10.10.1.1 → 10.10.1.2    TCP 83 8081 → 33898 [PSH, ACK] Seq=936 Ack=953 Win=65152 Len=17 TSval=3806523624 TSecr=1682263914
1712183982.766741276   512 1.122835985    10.10.1.2 → 10.10.1.1    TCP 83 33898 → 8081 [PSH, ACK] Seq=953 Ack=953 Win=64256 Len=17 TSval=1682263925 TSecr=3806523624
1712183984.766741276   514 1.123025018    10.10.1.1 → 10.10.1.2    TCP 83 8081 → 33898 [PSH, ACK] Seq=953 Ack=970 Win=65152 Len=17 TSval=3806523634 TSecr=1682263925
1712183990.766741276   520 1.133241336    10.10.1.2 → 10.10.1.1    TCP 83 33898 → 8081 [PSH, ACK] Seq=970 Ack=970 Win=64256 Len=17 TSval=1682263935 TSecr=3806523634
1712183993.766741276   523 1.133372381    10.10.1.1 → 10.10.1.2    TCP 83 8081 → 33898 [PSH, ACK] Seq=970 Ack=987 Win=65152 Len=17 TSval=3806523644 TSecr=1682263935
1712183999.766741276   529 1.143593788    10.10.1.2 → 10.10.1.1    TCP 83 33898 → 8081 [PSH, ACK] Seq=987 Ack=987 Win=64256 Len=17 TSval=1682263945 TSecr=3806523644
1712184001.766741276   531 1.143727401    10.10.1.1 → 10.10.1.2    TCP 83 8081 → 33898 [PSH, ACK] Seq=987 Ack=1004 Win=65152 Len=17 TSval=3806523655 TSecr=1682263945
1712184007.766741276   537 1.153944253    10.10.1.2 → 10.10.1.1    TCP 83 33898 → 8081 [PSH, ACK] Seq=1004 Ack=1004 Win=64256 Len=17 TSval=1682263956 TSecr=3806523655
1712184010.766741276   540 1.154079699    10.10.1.1 → 10.10.1.2    TCP 83 8081 → 33898 [PSH, ACK] Seq=1004 Ack=1021 Win=65152 Len=17 TSval=3806523665 TSecr=1682263956
1712184016.766741276   546 1.164297500    10.10.1.2 → 10.10.1.1    TCP 83 33898 → 8081 [PSH, ACK] Seq=1021 Ack=1021 Win=64256 Len=17 TSval=1682263966 TSecr=3806523665
1712184018.766741276   548 1.164432079    10.10.1.1 → 10.10.1.2    TCP 83 8081 → 33898 [PSH, ACK] Seq=1021 Ack=1038 Win=65152 Len=17 TSval=3806523675 TSecr=1682263966
1712184024.766741276   554 1.174652020    10.10.1.2 → 10.10.1.1    TCP 83 33898 → 8081 [PSH, ACK] Seq=1038 Ack=1038 Win=64256 Len=17 TSval=1682263976 TSecr=3806523675
1712184027.766741276   557 1.174786212    10.10.1.1 → 10.10.1.2    TCP 83 8081 → 33898 [PSH, ACK] Seq=1038 Ack=1055 Win=65152 Len=17 TSval=3806523686 TSecr=1682263976
1712184033.766741276   563 1.185003624    10.10.1.2 → 10.10.1.1    TCP 83 33898 → 8081 [PSH, ACK] Seq=1055 Ack=1055 Win=64256 Len=17 TSval=1682263987 TSecr=3806523686
1712184035.766741276   565 1.185138226    10.10.1.1 → 10.10.1.2    TCP 83 8081 → 33898 [PSH, ACK] Seq=1055 Ack=1072 Win=65152 Len=17 TSval=3806523696 TSecr=1682263987
1712184041.766741276   571 1.195357145    10.10.1.2 → 10.10.1.1    TCP 83 33898 → 8081 [PSH, ACK] Seq=1072 Ack=1072 Win=64256 Len=17 TSval=1682263997 TSecr=3806523696
1712184044.766741276   574 1.195489534    10.10.1.1 → 10.10.1.2    TCP 83 8081 → 33898 [PSH, ACK] Seq=1072 Ack=1089 Win=65152 Len=17 TSval=3806523706 TSecr=1682263997
1712184050.766741276   580 1.205690668    10.10.1.2 → 10.10.1.1    TCP 83 33898 → 8081 [PSH, ACK] Seq=1089 Ack=1089 Win=64256 Len=17 TSval=1682264008 TSecr=3806523706
1712184052.766741276   582 1.205820450    10.10.1.1 → 10.10.1.2    TCP 83 8081 → 33898 [PSH, ACK] Seq=1089 Ack=1106 Win=65152 Len=17 TSval=3806523717 TSecr=1682264008
1712184058.766741276   588 1.216040289    10.10.1.2 → 10.10.1.1    TCP 83 33898 → 8081 [PSH, ACK] Seq=1106 Ack=1106 Win=64256 Len=17 TSval=1682264018 TSecr=3806523717
1712184061.766741276   591 1.216173618    10.10.1.1 → 10.10.1.2    TCP 83 8081 → 33898 [PSH, ACK] Seq=1106 Ack=1123 Win=65152 Len=17 TSval=3806523727 TSecr=1682264018
1712184067.766741276   597 1.226355765    10.10.1.2 → 10.10.1.1    TCP 83 33898 → 8081 [PSH, ACK] Seq=1123 Ack=1123 Win=64256 Len=17 TSval=1682264028 TSecr=3806523727
1712184069.766741276   599 1.226436276    10.10.1.1 → 10.10.1.2    TCP 83 8081 → 33898 [PSH, ACK] Seq=1123 Ack=1140 Win=65152 Len=17 TSval=3806523737 TSecr=1682264028
1712184075.766741276   605 1.236652787    10.10.1.2 → 10.10.1.1    TCP 83 33898 → 8081 [PSH, ACK] Seq=1140 Ack=1140 Win=64256 Len=17 TSval=1682264038 TSecr=3806523737
1712184077.766741276   607 1.236709257    10.10.1.1 → 10.10.1.2    TCP 83 8081 → 33898 [PSH, ACK] Seq=1140 Ack=1157 Win=65152 Len=17 TSval=3806523748 TSecr=1682264038
1712184084.766741276   614 1.246925550    10.10.1.2 → 10.10.1.1    TCP 83 33898 → 8081 [PSH, ACK] Seq=1157 Ack=1157 Win=64256 Len=17 TSval=1682264049 TSecr=3806523748
1712184086.766741276   616 1.247059367    10.10.1.1 → 10.10.1.2    TCP 83 8081 → 33898 [PSH, ACK] Seq=1157 Ack=1174 Win=65152 Len=17 TSval=3806523758 TSecr=1682264049
1712184092.766741276   622 1.257277840    10.10.1.2 → 10.10.1.1    TCP 83 33898 → 8081 [PSH, ACK] Seq=1174 Ack=1174 Win=64256 Len=17 TSval=1682264059 TSecr=3806523758
1712184095.766741276   625 1.257414121    10.10.1.1 → 10.10.1.2    TCP 83 8081 → 33898 [PSH, ACK] Seq=1174 Ack=1191 Win=65152 Len=17 TSval=3806523768 TSecr=1682264059
1712184101.766741276   631 1.267635236    10.10.1.2 → 10.10.1.1    TCP 83 33898 → 8081 [PSH, ACK] Seq=1191 Ack=1191 Win=64256 Len=17 TSval=1682264069 TSecr=3806523768
1712184103.766741276   633 1.267770489    10.10.1.1 → 10.10.1.2    TCP 83 8081 → 33898 [PSH, ACK] Seq=1191 Ack=1208 Win=65152 Len=17 TSval=3806523779 TSecr=1682264069
1712184109.766741276   639 1.277990026    10.10.1.2 → 10.10.1.1    TCP 83 33898 → 8081 [PSH, ACK] Seq=1208 Ack=1208 Win=64256 Len=17 TSval=1682264080 TSecr=3806523779
1712184112.766741276   642 1.278124503    10.10.1.1 → 10.10.1.2    TCP 83 8081 → 33898 [PSH, ACK] Seq=1208 Ack=1225 Win=65152 Len=17 TSval=3806523789 TSecr=1682264080
1712184118.766741276   648 1.288344060    10.10.1.2 → 10.10.1.1    TCP 83 33898 → 8081 [PSH, ACK] Seq=1225 Ack=1225 Win=64256 Len=17 TSval=1682264090 TSecr=3806523789
1712184120.766741276   650 1.288479013    10.10.1.1 → 10.10.1.2    TCP 83 8081 → 33898 [PSH, ACK] Seq=1225 Ack=1242 Win=65152 Len=17 TSval=3806523799 TSecr=1682264090
1712184126.766741276   656 1.298697085    10.10.1.2 → 10.10.1.1    TCP 83 33898 → 8081 [PSH, ACK] Seq=1242 Ack=1242 Win=64256 Len=17 TSval=1682264101 TSecr=3806523799
1712184129.766741276   659 1.298831860    10.10.1.1 → 10.10.1.2    TCP 83 8081 → 33898 [PSH, ACK] Seq=1242 Ack=1259 Win=65152 Len=17 TSval=3806523810 TSecr=1682264101
1712184135.766741276   665 1.309047954    10.10.1.2 → 10.10.1.1    TCP 83 33898 → 8081 [PSH, ACK] Seq=1259 Ack=1259 Win=64256 Len=17 TSval=1682264111 TSecr=3806523810
1712184137.766741276   667 1.309182978    10.10.1.1 → 10.10.1.2    TCP 83 8081 → 33898 [PSH, ACK] Seq=1259 Ack=1276 Win=65152 Len=17 TSval=3806523820 TSecr=1682264111
1712184143.766741276   673 1.319401736    10.10.1.2 → 10.10.1.1    TCP 83 33898 → 8081 [PSH, ACK] Seq=1276 Ack=1276 Win=64256 Len=17 TSval=1682264121 TSecr=3806523820
1712184146.766741276   676 1.319536992    10.10.1.1 → 10.10.1.2    TCP 83 8081 → 33898 [PSH, ACK] Seq=1276 Ack=1293 Win=65152 Len=17 TSval=3806523831 TSecr=1682264121
1712184152.766741276   682 1.329753726    10.10.1.2 → 10.10.1.1    TCP 83 33898 → 8081 [PSH, ACK] Seq=1293 Ack=1293 Win=64256 Len=17 TSval=1682264132 TSecr=3806523831
1712184154.766741276   684 1.329889303    10.10.1.1 → 10.10.1.2    TCP 83 8081 → 33898 [PSH, ACK] Seq=1293 Ack=1310 Win=65152 Len=17 TSval=3806523841 TSecr=1682264132
1712184160.766741276   690 1.340108983    10.10.1.2 → 10.10.1.1    TCP 83 33898 → 8081 [PSH, ACK] Seq=1310 Ack=1310 Win=64256 Len=17 TSval=1682264142 TSecr=3806523841
1712184163.766741276   693 1.340245235    10.10.1.1 → 10.10.1.2    TCP 83 8081 → 33898 [PSH, ACK] Seq=1310 Ack=1327 Win=65152 Len=17 TSval=3806523851 TSecr=1682264142
1712184169.766741276   699 1.350463254    10.10.1.2 → 10.10.1.1    TCP 83 33898 → 8081 [PSH, ACK] Seq=1327 Ack=1327 Win=64256 Len=17 TSval=1682264152 TSecr=3806523851
1712184171.766741276   701 1.350597775    10.10.1.1 → 10.10.1.2    TCP 83 8081 → 33898 [PSH, ACK] Seq=1327 Ack=1344 Win=65152 Len=17 TSval=3806523862 TSecr=1682264152
1712184177.766741276   707 1.360817277    10.10.1.2 → 10.10.1.1    TCP 83 33898 → 8081 [PSH, ACK] Seq=1344 Ack=1344 Win=64256 Len=17 TSval=1682264163 TSecr=3806523862
1712184180.766741276   710 1.360954909    10.10.1.1 → 10.10.1.2    TCP 83 8081 → 33898 [PSH, ACK] Seq=1344 Ack=1361 Win=65152 Len=17 TSval=3806523872 TSecr=1682264163
1712184186.766741276   716 1.371175094    10.10.1.2 → 10.10.1.1    TCP 83 33898 → 8081 [PSH, ACK] Seq=1361 Ack=1361 Win=64256 Len=17 TSval=1682264173 TSecr=3806523872
1712184188.766741276   718 1.371310582    10.10.1.1 → 10.10.1.2    TCP 83 8081 → 33898 [PSH, ACK] Seq=1361 Ack=1378 Win=65152 Len=17 TSval=3806523882 TSecr=1682264173
1712184194.766741276   724 1.381527216    10.10.1.2 → 10.10.1.1    TCP 83 33898 → 8081 [PSH, ACK] Seq=1378 Ack=1378 Win=64256 Len=17 TSval=1682264183 TSecr=3806523882
1712184197.766741276   727 1.381662177    10.10.1.1 → 10.10.1.2    TCP 83 8081 → 33898 [PSH, ACK] Seq=1378 Ack=1395 Win=65152 Len=17 TSval=3806523893 TSecr=1682264183
1712184203.766741276   733 1.391881859    10.10.1.2 → 10.10.1.1    TCP 83 33898 → 8081 [PSH, ACK] Seq=1395 Ack=1395 Win=64256 Len=17 TSval=1682264194 TSecr=3806523893
1712184205.766741276   735 1.392016284    10.10.1.1 → 10.10.1.2    TCP 83 8081 → 33898 [PSH, ACK] Seq=1395 Ack=1412 Win=65152 Len=17 TSval=3806523903 TSecr=1682264194
1712184211.766741276   741 1.402233266    10.10.1.2 → 10.10.1.1    TCP 83 33898 → 8081 [PSH, ACK] Seq=1412 Ack=1412 Win=64256 Len=17 TSval=1682264204 TSecr=3806523903
1712184214.766741276   744 1.402368508    10.10.1.1 → 10.10.1.2    TCP 83 8081 → 33898 [PSH, ACK] Seq=1412 Ack=1429 Win=65152 Len=17 TSval=3806523913 TSecr=1682264204
1712184220.766741276   750 1.412584580    10.10.1.2 → 10.10.1.1    TCP 83 33898 → 8081 [PSH, ACK] Seq=1429 Ack=1429 Win=64256 Len=17 TSval=1682264214 TSecr=3806523913
1712184222.766741276   752 1.412723631    10.10.1.1 → 10.10.1.2    TCP 83 8081 → 33898 [PSH, ACK] Seq=1429 Ack=1446 Win=65152 Len=17 TSval=3806523924 TSecr=1682264214
1712184228.766741276   758 1.422942511    10.10.1.2 → 10.10.1.1    TCP 83 33898 → 8081 [PSH, ACK] Seq=1446 Ack=1446 Win=64256 Len=17 TSval=1682264225 TSecr=3806523924
1712184231.766741276   761 1.423076753    10.10.1.1 → 10.10.1.2    TCP 83 8081 → 33898 [PSH, ACK] Seq=1446 Ack=1463 Win=65152 Len=17 TSval=3806523934 TSecr=1682264225
1712184237.766741276   767 1.433292054    10.10.1.2 → 10.10.1.1    TCP 83 33898 → 8081 [PSH, ACK] Seq=1463 Ack=1463 Win=64256 Len=17 TSval=1682264235 TSecr=3806523934
1712184239.766741276   769 1.433432339    10.10.1.1 → 10.10.1.2    TCP 83 8081 → 33898 [PSH, ACK] Seq=1463 Ack=1480 Win=65152 Len=17 TSval=3806523944 TSecr=1682264235
1712184245.766741276   775 1.443649924    10.10.1.2 → 10.10.1.1    TCP 83 33898 → 8081 [PSH, ACK] Seq=1480 Ack=1480 Win=64256 Len=17 TSval=1682264245 TSecr=3806523944
1712184248.766741276   778 1.443786080    10.10.1.1 → 10.10.1.2    TCP 83 8081 → 33898 [PSH, ACK] Seq=1480 Ack=1497 Win=65152 Len=17 TSval=3806523955 TSecr=1682264245
1712184254.766741276   784 1.454004932    10.10.1.2 → 10.10.1.1    TCP 83 33898 → 8081 [PSH, ACK] Seq=1497 Ack=1497 Win=64256 Len=17 TSval=1682264256 TSecr=3806523955
1712184256.766741276   786 1.454139727    10.10.1.1 → 10.10.1.2    TCP 83 8081 → 33898 [PSH, ACK] Seq=1497 Ack=1514 Win=65152 Len=17 TSval=3806523965 TSecr=1682264256
1712184262.766741276   792 1.464356219    10.10.1.2 → 10.10.1.1    TCP 83 33898 → 8081 [PSH, ACK] Seq=1514 Ack=1514 Win=64256 Len=17 TSval=1682264266 TSecr=3806523965
1712184265.766741276   795 1.464493643    10.10.1.1 → 10.10.1.2    TCP 83 8081 → 33898 [PSH, ACK] Seq=1514 Ack=1531 Win=65152 Len=17 TSval=3806523975 TSecr=1682264266
1712184271.766741276   801 1.474712960    10.10.1.2 → 10.10.1.1    TCP 83 33898 → 8081 [PSH, ACK] Seq=1531 Ack=1531 Win=64256 Len=17 TSval=1682264277 TSecr=3806523975
1712184273.766741276   803 1.474848022    10.10.1.1 → 10.10.1.2    TCP 83 8081 → 33898 [PSH, ACK] Seq=1531 Ack=1548 Win=65152 Len=17 TSval=3806523986 TSecr=1682264277
1712184279.766741276   809 1.485066678    10.10.1.2 → 10.10.1.1    TCP 83 33898 → 8081 [PSH, ACK] Seq=1548 Ack=1548 Win=64256 Len=17 TSval=1682264287 TSecr=3806523986
1712184282.766741276   812 1.485202085    10.10.1.1 → 10.10.1.2    TCP 83 8081 → 33898 [PSH, ACK] Seq=1548 Ack=1565 Win=65152 Len=17 TSval=3806523996 TSecr=1682264287
1712184288.766741276   818 1.495418796    10.10.1.2 → 10.10.1.1    TCP 83 33898 → 8081 [PSH, ACK] Seq=1565 Ack=1565 Win=64256 Len=17 TSval=1682264297 TSecr=3806523996
1712184290.766741276   820 1.495552478    10.10.1.1 → 10.10.1.2    TCP 83 8081 → 33898 [PSH, ACK] Seq=1565 Ack=1582 Win=65152 Len=17 TSval=3806524007 TSecr=1682264297
1712184296.766741276   826 1.505768261    10.10.1.2 → 10.10.1.1    TCP 83 33898 → 8081 [PSH, ACK] Seq=1582 Ack=1582 Win=64256 Len=17 TSval=1682264308 TSecr=3806524007
1712184299.766741276   829 1.505903302    10.10.1.1 → 10.10.1.2    TCP 83 8081 → 33898 [PSH, ACK] Seq=1582 Ack=1599 Win=65152 Len=17 TSval=3806524017 TSecr=1682264308
1712184305.766741276   835 1.516118535    10.10.1.2 → 10.10.1.1    TCP 83 33898 → 8081 [PSH, ACK] Seq=1599 Ack=1599 Win=64256 Len=17 TSval=1682264318 TSecr=3806524017
1712184307.766741276   837 1.516251520    10.10.1.1 → 10.10.1.2    TCP 83 8081 → 33898 [PSH, ACK] Seq=1599 Ack=1616 Win=65152 Len=17 TSval=3806524027 TSecr=1682264318
1712184313.766741276   843 1.526468849    10.10.1.2 → 10.10.1.1    TCP 83 33898 → 8081 [PSH, ACK] Seq=1616 Ack=1616 Win=64256 Len=17 TSval=1682264328 TSecr=3806524027
1712184316.766741276   846 1.526603374    10.10.1.1 → 10.10.1.2    TCP 83 8081 → 33898 [PSH, ACK] Seq=1616 Ack=1633 Win=65152 Len=17 TSval=3806524038 TSecr=1682264328
1712184322.766741276   852 1.536824058    10.10.1.2 → 10.10.1.1    TCP 83 33898 → 8081 [PSH, ACK] Seq=1633 Ack=1633 Win=64256 Len=17 TSval=1682264339 TSecr=3806524038
1712184324.766741276   854 1.536958894    10.10.1.1 → 10.10.1.2    TCP 83 8081 → 33898 [PSH, ACK] Seq=1633 Ack=1650 Win=65152 Len=17 TSval=3806524048 TSecr=1682264339
1712184330.766741276   860 1.547176216    10.10.1.2 → 10.10.1.1    TCP 83 33898 → 8081 [PSH, ACK] Seq=1650 Ack=1650 Win=64256 Len=17 TSval=1682264349 TSecr=3806524048
1712184333.766741276   863 1.547310802    10.10.1.1 → 10.10.1.2    TCP 83 8081 → 33898 [PSH, ACK] Seq=1650 Ack=1667 Win=65152 Len=17 TSval=3806524058 TSecr=1682264349
1712184339.766741276   869 1.557531783    10.10.1.2 → 10.10.1.1    TCP 83 33898 → 8081 [PSH, ACK] Seq=1667 Ack=1667 Win=64256 Len=17 TSval=1682264359 TSecr=3806524058
1712184341.766741276   871 1.557665721    10.10.1.1 → 10.10.1.2    TCP 83 8081 → 33898 [PSH, ACK] Seq=1667 Ack=1684 Win=65152 Len=17 TSval=3806524069 TSecr=1682264359
1712184347.766741276   877 1.567883133    10.10.1.2 → 10.10.1.1    TCP 83 33898 → 8081 [PSH, ACK] Seq=1684 Ack=1684 Win=64256 Len=17 TSval=1682264370 TSecr=3806524069
1712184350.766741276   880 1.568017650    10.10.1.1 → 10.10.1.2    TCP 83 8081 → 33898 [PSH, ACK] Seq=1684 Ack=1701 Win=65152 Len=17 TSval=3806524079 TSecr=1682264370
1712184356.766741276   886 1.578236437    10.10.1.2 → 10.10.1.1    TCP 83 33898 → 8081 [PSH, ACK] Seq=1701 Ack=1701 Win=64256 Len=17 TSval=1682264380 TSecr=3806524079
1712184358.766741276   888 1.578371434    10.10.1.1 → 10.10.1.2    TCP 83 8081 → 33898 [PSH, ACK] Seq=1701 Ack=1718 Win=65152 Len=17 TSval=3806524089 TSecr=1682264380
1712184364.766741276   894 1.588591405    10.10.1.2 → 10.10.1.1    TCP 83 33898 → 8081 [PSH, ACK] Seq=1718 Ack=1718 Win=64256 Len=17 TSval=1682264390 TSecr=3806524089
1712184367.766741276   897 1.588726272    10.10.1.1 → 10.10.1.2    TCP 83 8081 → 33898 [PSH, ACK] Seq=1718 Ack=1735 Win=65152 Len=17 TSval=3806524100 TSecr=1682264390
1712184373.766741276   903 1.598946686    10.10.1.2 → 10.10.1.1    TCP 83 33898 → 8081 [PSH, ACK] Seq=1735 Ack=1735 Win=64256 Len=17 TSval=1682264401 TSecr=3806524100
1712184375.766741276   905 1.599080631    10.10.1.1 → 10.10.1.2    TCP 83 8081 → 33898 [PSH, ACK] Seq=1735 Ack=1752 Win=65152 Len=17 TSval=3806524110 TSecr=1682264401
1712184381.766741276   911 1.609302043    10.10.1.2 → 10.10.1.1    TCP 83 33898 → 8081 [PSH, ACK] Seq=1752 Ack=1752 Win=64256 Len=17 TSval=1682264411 TSecr=3806524110
1712184384.766741276   914 1.609438034    10.10.1.1 → 10.10.1.2    TCP 83 8081 → 33898 [PSH, ACK] Seq=1752 Ack=1769 Win=65152 Len=17 TSval=3806524120 TSecr=1682264411
1712184390.766741276   920 1.619647137    10.10.1.2 → 10.10.1.1    TCP 83 33898 → 8081 [PSH, ACK] Seq=1769 Ack=1769 Win=64256 Len=17 TSval=1682264421 TSecr=3806524120
1712184392.766741276   922 1.619786575    10.10.1.1 → 10.10.1.2    TCP 83 8081 → 33898 [PSH, ACK] Seq=1769 Ack=1786 Win=65152 Len=17 TSval=3806524131 TSecr=1682264421
1712184398.766741276   928 1.630003800    10.10.1.2 → 10.10.1.1    TCP 83 33898 → 8081 [PSH, ACK] Seq=1786 Ack=1786 Win=64256 Len=17 TSval=1682264432 TSecr=3806524131
1712184401.766741276   931 1.630140332    10.10.1.1 → 10.10.1.2    TCP 83 8081 → 33898 [PSH, ACK] Seq=1786 Ack=1803 Win=65152 Len=17 TSval=3806524141 TSecr=1682264432
1712184407.766741276   937 1.640358680    10.10.1.2 → 10.10.1.1    TCP 83 33898 → 8081 [PSH, ACK] Seq=1803 Ack=1803 Win=64256 Len=17 TSval=1682264442 TSecr=3806524141
1712184409.766741276   939 1.640494192    10.10.1.1 → 10.10.1.2    TCP 83 8081 → 33898 [PSH, ACK] Seq=1803 Ack=1820 Win=65152 Len=17 TSval=3806524151 TSecr=1682264442
1712184415.766741276   945 1.650709433    10.10.1.2 → 10.10.1.1    TCP 83 33898 → 8081 [PSH, ACK] Seq=1820 Ack=1820 Win=64256 Len=17 TSval=1682264453 TSecr=3806524151
1712184418.766741276   948 1.650844840    10.10.1.1 → 10.10.1.2    TCP 83 8081 → 33898 [PSH, ACK] Seq=1820 Ack=1837 Win=65152 Len=17 TSval=3806524162 TSecr=1682264453
1712184424.766741276   954 1.661061361    10.10.1.2 → 10.10.1.1    TCP 83 33898 → 8081 [PSH, ACK] Seq=1837 Ack=1837 Win=64256 Len=17 TSval=1682264463 TSecr=3806524162
1712184426.766741276   956 1.661196539    10.10.1.1 → 10.10.1.2    TCP 83 8081 → 33898 [PSH, ACK] Seq=1837 Ack=1854 Win=65152 Len=17 TSval=3806524172 TSecr=1682264463
1712184432.766741276   962 1.671413282    10.10.1.2 → 10.10.1.1    TCP 83 33898 → 8081 [PSH, ACK] Seq=1854 Ack=1854 Win=64256 Len=17 TSval=1682264473 TSecr=3806524172
1712184435.766741276   965 1.671548582    10.10.1.1 → 10.10.1.2    TCP 83 8081 → 33898 [PSH, ACK] Seq=1854 Ack=1871 Win=65152 Len=17 TSval=3806524183 TSecr=1682264473
1712184441.766741276   971 1.681766737    10.10.1.2 → 10.10.1.1    TCP 83 33898 → 8081 [PSH, ACK] Seq=1871 Ack=1871 Win=64256 Len=17 TSval=1682264484 TSecr=3806524183
1712184443.766741276   973 1.681900902    10.10.1.1 → 10.10.1.2    TCP 83 8081 → 33898 [PSH, ACK] Seq=1871 Ack=1888 Win=65152 Len=17 TSval=3806524193 TSecr=1682264484
1712184449.766741276   979 1.692119665    10.10.1.2 → 10.10.1.1    TCP 83 33898 → 8081 [PSH, ACK] Seq=1888 Ack=1888 Win=64256 Len=17 TSval=1682264494 TSecr=3806524193
1712184452.766741276   982 1.692257591    10.10.1.1 → 10.10.1.2    TCP 83 8081 → 33898 [PSH, ACK] Seq=1888 Ack=1905 Win=65152 Len=17 TSval=3806524203 TSecr=1682264494
1712184458.766741276   988 1.702473803    10.10.1.2 → 10.10.1.1    TCP 83 33898 → 8081 [PSH, ACK] Seq=1905 Ack=1905 Win=64256 Len=17 TSval=1682264504 TSecr=3806524203
1712184460.766741276   990 1.702609045    10.10.1.1 → 10.10.1.2    TCP 83 8081 → 33898 [PSH, ACK] Seq=1905 Ack=1922 Win=65152 Len=17 TSval=3806524214 TSecr=1682264504
1712184466.766741276   996 1.712826267    10.10.1.2 → 10.10.1.1    TCP 83 33898 → 8081 [PSH, ACK] Seq=1922 Ack=1922 Win=64256 Len=17 TSval=1682264515 TSecr=3806524214
1712184469.766741276   999 1.713014579    10.10.1.1 → 10.10.1.2    TCP 83 8081 → 33898 [PSH, ACK] Seq=1922 Ack=1939 Win=65152 Len=17 TSval=3806524224 TSecr=1682264515
1712184475.766741276  1005 1.723233096    10.10.1.2 → 10.10.1.1    TCP 83 33898 → 8081 [PSH, ACK] Seq=1939 Ack=1939 Win=64256 Len=17 TSval=1682264525 TSecr=3806524224
1712184477.766741276  1007 1.723367913    10.10.1.1 → 10.10.1.2    TCP 83 8081 → 33898 [PSH, ACK] Seq=1939 Ack=1956 Win=65152 Len=17 TSval=3806524234 TSecr=1682264525
1712184483.766741276  1013 1.733587069    10.10.1.2 → 10.10.1.1    TCP 83 33898 → 8081 [PSH, ACK] Seq=1956 Ack=1956 Win=64256 Len=17 TSval=1682264535 TSecr=3806524234
1712184486.766741276  1016 1.733721156    10.10.1.1 → 10.10.1.2    TCP 83 8081 → 33898 [PSH, ACK] Seq=1956 Ack=1973 Win=65152 Len=17 TSval=3806524245 TSecr=1682264535
1712184492.766741276  1022 1.743942813    10.10.1.2 → 10.10.1.1    TCP 83 33898 → 8081 [PSH, ACK] Seq=1973 Ack=1973 Win=64256 Len=17 TSval=1682264546 TSecr=3806524245
1712184494.766741276  1024 1.744078474    10.10.1.1 → 10.10.1.2    TCP 83 8081 → 33898 [PSH, ACK] Seq=1973 Ack=1990 Win=65152 Len=17 TSval=3806524255 TSecr=1682264546
1712184500.766741276  1030 1.754294317    10.10.1.2 → 10.10.1.1    TCP 83 33898 → 8081 [PSH, ACK] Seq=1990 Ack=1990 Win=64256 Len=17 TSval=1682264556 TSecr=3806524255
1712184503.766741276  1033 1.754429253    10.10.1.1 → 10.10.1.2    TCP 83 8081 → 33898 [PSH, ACK] Seq=1990 Ack=2007 Win=65152 Len=17 TSval=3806524265 TSecr=1682264556
